      -----------------------------------------------------------      
     |                   =====================                   |     
     |                           x T B                           |     
     |                   =====================                   |     
     |                         S. Grimme                         |     
     |          Mulliken Center for Theoretical Chemistry        |     
     |                    University of Bonn                     |     
     |                Version 6.2 RC2 (SAW190805)                |     
      -----------------------------------------------------------      

   This program is distributed in the hope that it will be useful,
   but WITHOUT ANY WARRANTY; without even the implied warranty of
   MERCHANTABILITY or FITNESS FOR A PARTICULAR PURPOSE.
   
   FOR NON-COMMERCIAL, ACADEMIA USE ONLY.
   
   Cite this work as:
   * S. Grimme, C. Bannwarth, P. Shushkov, J. Chem. Theory Comput., 2017,
     13, 1989-2009. DOI: 10.1021/acs.jctc.7b00118
   * C. Bannwarth, S. Ehlert and S. Grimme., J. Chem. Theory Comput., 2019,
     15, 1652-1671. DOI: 10.1021/acs.jctc.8b01176
   * P. Pracht, E. Caldeweyher, S. Ehlert, S. Grimme, ChemRxiv, 2019, preprint.
     DOI: 10.26434/chemrxiv.8326202.v1
   
   for DFT-D4:
   * E. Caldeweyher, C. Bannwarth and S. Grimme, J. Chem. Phys., 2017,
     147, 034112. DOI: 10.1063/1.4993215
   * E. Caldeweyher, S. Ehlert, A. Hansen, H. Neugebauer, S. Spicher,
     C. Bannwarth and S. Grimme, J. Chem. Phys., 2019, 150, 154122.
     DOI: 10.1063/1.5090222
   
   for sTDA-xTB:
   * S. Grimme and C. Bannwarth, J. Chem. Phys., 2016, 145, 054103.
     DOI: 10.1063/1.4959605
   
   in the mass-spec context:
   * V. Asgeirsson, C. Bauer and S. Grimme, Chem. Sci., 2017, 8, 4879.
     DOI: 10.1039/c7sc00601b
   
   for metadynamics refer to:
   * S. Grimme, J. Chem. Theory Comput., 2019, 155, 2847-2862
     DOI: 10.1021/acs.jctc.9b00143
   
   with help from (in alphabetical order)
   C. Bannwarth, F. Bohle, G. Brandenburg, E. Caldeweyher, M. Checinski,
   S. Dohm, S. Ehlert, S. Ehrlich, F. März, H. Neugebauer, J. Pisarek,
   P. Pracht, P. Shushkov, and S. Spicher.
   
 * started run on 2021/05/19 at 10:58:49.293     

           -------------------------------------------------
          |                Calculation Setup                |
           -------------------------------------------------

          program call               : /ihome/ghutchison/geoffh/xtb/xtb 79.xyz -opt
          hostname                   : smp-n58
          coordinate file            : 79.xyz
          omp threads                :                     1
          number of atoms            :                    17
          number of electrons        :                    68
          charge                     :                     0
          spin                       :                   0.0
          first test random number   :      0.97628058771782


########################################################################
# WARNING! Please study the warnings concerning your input carefully
#  - the use of '-opt' is discouraged, please use '--opt' next time
########################################################################

           ------------------------------------------------- 
          |                 G F N 2 - x T B                 |
          | Geometry, Frequencies, Noncovalent interactions |
          |            JCTC 2019 parametrisation            |
           ------------------------------------------------- 
             KAB for C  - Si     :                1.0500
             KAB for H  - Pd     :                0.9500
             k(s)              :                1.8500
             k(p)              :                2.2300
             k(d)              :                2.2300
             k(f)              :                2.0000
             kEN (H0ij)        :               -2.0000
             D4 a1             :                0.5200
             D4 a2             :                5.0000
             D4 s6             :                1.0000
             D4 s8             :                2.7000
             D4 s9             :                5.0000
             alphaj            :                2.0000

  Z AO/shell   Hii/eV     exponent
  1     Wed Apr 25 08:07:45 CEST 2018   EN: 2.200 GM2: 0.406  GM3: 0.0800  RAES: 1.40
     1s    -10.707211    1.230000
  6     Wed Apr 25 08:07:45 CEST 2018   EN: 2.550 GM2: 0.538  GM3: 0.1500  RAES: 3.00
     2s    -13.970922    2.096432
     2p    -10.063292    1.800000
  7     Wed Apr 25 08:07:45 CEST 2018   EN: 3.040 GM2: 0.461  GM3:-0.0640  RAES: 1.90
     2s    -16.686243    2.339881
     2p    -12.523956    2.014332
  8     Wed Apr 25 08:07:45 CEST 2018   EN: 3.440 GM2: 0.452  GM3:-0.0517  RAES: 1.80
     2s    -20.229985    2.439742
     2p    -15.503117    2.137023
 16     Tue Apr 24 11:44:34 CEST 2018   EN: 2.580 GM2: 0.340  GM3:-0.0502  RAES: 3.10
     3s    -20.029654    1.981333
     3p    -11.377694    2.025643
     3d     -0.420282    1.702555

           ------------------------------------------------- 
          |        Self-Consistent Charge Iterations        |
           ------------------------------------------------- 

          ...................................................
          :                      SETUP                      :
          :.................................................:
          :  # basis functions                  62          :
          :  # atomic orbitals                  61          :
          :  # shells                           31          :
          :  # electrons                        68          :
          :  max. iterations                   250          :
          :  Hamiltonian                  GFN2-xTB          :
          :  restarted?                      false          :
          :  GBSA solvation                  false          :
          :  PC potential                    false          :
          :  electronic temp.          300.0000000     K    :
          :  accuracy                    1.0000000          :
          :  -> integral cutoff          0.2500000E+02      :
          :  -> integral neglect         0.1000000E-07      :
          :  -> SCF convergence          0.1000000E-05 Eh   :
          :  -> wf. convergence          0.1000000E-03 e    :
          :  Broyden damping             0.4000000          :
          ...................................................

 iter      E             dE          RMSdq      gap      omega  full diag
   1    -40.0750909 -0.400751E+02  0.693E+00    3.13       0.0  T
   2    -40.3354493 -0.260358E+00  0.290E+00    2.69       1.0  T
   3    -40.3366318 -0.118243E-02  0.166E+00    2.62       1.0  T
   4    -40.3294447  0.718704E-02  0.846E-01    2.39       1.0  T
   5    -40.3381946 -0.874985E-02  0.134E-01    2.46       1.0  T
   6    -40.3382193 -0.247366E-04  0.621E-02    2.46       1.0  T
   7    -40.3382323 -0.129524E-04  0.227E-02    2.46       1.1  T
   8    -40.3382353 -0.301834E-05  0.122E-02    2.46       2.0  T
   9    -40.3382356 -0.325405E-06  0.679E-03    2.46       3.6  T
  10    -40.3382359 -0.306859E-06  0.241E-03    2.46      10.1  T
  11    -40.3382359 -0.221569E-07  0.144E-03    2.46      16.8  T
  12    -40.3382360 -0.224029E-08  0.687E-04    2.46      35.3  T
  13    -40.3382360 -0.406405E-08  0.171E-04    2.46     142.1  T

   *** convergence criteria satisfied after 13 iterations ***

         #    Occupation            Energy/Eh            Energy/eV
      -------------------------------------------------------------
         1        2.0000           -0.7986944             -21.7336
       ...           ...                  ...                  ...
        28        2.0000           -0.4854290             -13.2092
        29        2.0000           -0.4825515             -13.1309
        30        2.0000           -0.4719818             -12.8433
        31        2.0000           -0.4645223             -12.6403
        32        2.0000           -0.4629019             -12.5962
        33        2.0000           -0.4616520             -12.5622
        34        2.0000           -0.4408803             -11.9970 (HOMO)
        35                         -0.3503666              -9.5340 (LUMO)
        36                         -0.3419304              -9.3044
        37                         -0.3196324              -8.6976
        38                         -0.2647903              -7.2053
        39                         -0.2495279              -6.7900
       ...                                ...                  ...
        61                          0.5928424              16.1321
      -------------------------------------------------------------
                  HL-Gap            0.0905137 Eh            2.4630 eV
             Fermi-level           -0.3956235 Eh          -10.7655 eV

 SCC (total)                   0 d,  0 h,  0 min,  0.031 sec
 SCC setup                      ...        0 min,  0.000 sec (  0.746%)
 Dispersion                     ...        0 min,  0.000 sec (  0.611%)
 integral evaluation            ...        0 min,  0.007 sec ( 23.109%)
 zeroth order Hamiltonian       ...        0 min,  0.000 sec (  0.464%)
 iterations                     ...        0 min,  0.012 sec ( 39.765%)
 molecular gradient             ...        0 min,  0.011 sec ( 34.130%)
 printout                       ...        0 min,  0.000 sec (  1.002%)

         :::::::::::::::::::::::::::::::::::::::::::::::::::::
         ::                     SUMMARY                     ::
         :::::::::::::::::::::::::::::::::::::::::::::::::::::
         :: total energy             -39.990171817866 Eh    ::
         :: gradient norm              0.094818142641 Eh/a0 ::
         :: HOMO-LUMO gap              2.463004366069 eV    ::
         ::.................................................::
         :: SCC energy               -40.338235955602 Eh    ::
         :: -> isotropic ES            0.097365520750 Eh    ::
         :: -> anisotropic ES          0.015033411829 Eh    ::
         :: -> anisotropic XC          0.001905425349 Eh    ::
         :: -> dispersion             -0.018837407602 Eh    ::
         :: repulsion energy           0.347993127878 Eh    ::
         :: add. restraining           0.000000000000 Eh    ::
         :::::::::::::::::::::::::::::::::::::::::::::::::::::

      ----------------------------------------------------------- 
     |                   =====================                   |
     |                        A N C O P T                        |
     |                   =====================                   |
     |               Approximate Normal Coordinate               |
     |                Rational Function Optimizer                |
      ----------------------------------------------------------- 

          ...................................................
          :                      SETUP                      :
          :.................................................:
          :   optimization level            normal          :
          :   max. optcycles                   200          :
          :   ANC micro-cycles                  20          :
          :   degrees of freedom                45          :
          :.................................................:
          :   RF solver                   davidson          :
          :   input Hessian                  false          :
          :   write xtbopt.log                true          :
          :   linear?                        false          :
          :   energy convergence         0.5000000E-05 Eh   :
          :   grad. convergence          0.1000000E-02 Eh/α :
          :   maximium RF displ.         2.0000000          :
          :   Hlow (freq-cutoff)         0.5000000E-02      :
          :   Hmax (freq-cutoff)         5.0000000          :
          :   S6 in model hess.         20.0000000          :
          ...................................................

generating ANC from model Hessian ...
Using Lindh-Hessian (1995)
 Shifting diagonal of input Hessian by   3.041056262048942E-003
 Lowest  eigenvalues of input Hessian
   -0.000000   -0.000000   -0.000000    0.000000    0.000000    0.000000
    0.005000    0.007480    0.009705    0.010993    0.016124    0.016463
    0.019604    0.022179    0.028423    0.033454    0.041988    0.051026
 Highest eigenvalues
    1.791737    1.975953    2.075926    2.098394    2.468816    2.499761
 

........................................................................
.............................. CYCLE    1 ..............................
........................................................................
   1    -40.3382360 -0.403382E+02  0.661E-05    2.46       0.0  T
   2    -40.3382360 -0.550671E-11  0.372E-05    2.46     651.5  T
   3    -40.3382360 -0.710543E-12  0.247E-05    2.46     980.1  T
     SCC iter.                  ...        0 min,  0.003 sec
     gradient                   ...        0 min,  0.011 sec
 * total energy  :   -39.9901718 Eh     change        0.2707896E-07 Eh
   gradient norm :     0.0948204 Eh/α   predicted     0.0000000E+00 (-100.00%)
   displ. norm   :     0.2097110 α      lambda       -0.9573600E-02
   maximum displ.:     0.1060478 α      in ANC's #14, #2, #3, ...

........................................................................
.............................. CYCLE    2 ..............................
........................................................................
   1    -40.3663794 -0.403664E+02  0.296E-01    2.67       0.0  T
   2    -40.3667582 -0.378815E-03  0.139E-01    2.62       1.0  T
   3    -40.3667490  0.918415E-05  0.859E-02    2.63       1.0  T
   4    -40.3667836 -0.345917E-04  0.513E-02    2.62       1.0  T
   5    -40.3668023 -0.186463E-04  0.102E-02    2.62       2.4  T
   6    -40.3668027 -0.428204E-06  0.637E-03    2.62       3.8  T
   7    -40.3668029 -0.257107E-06  0.211E-03    2.62      11.5  T
   8    -40.3668030 -0.108856E-07  0.113E-03    2.62      21.4  T
     SCC iter.                  ...        0 min,  0.007 sec
     gradient                   ...        0 min,  0.009 sec
 * total energy  :   -39.9965441 Eh     change       -0.6372270E-02 Eh
   gradient norm :     0.0340684 Eh/α   predicted    -0.4997320E-02 ( -21.58%)
   displ. norm   :     0.2067716 α      lambda       -0.2150328E-02
   maximum displ.:     0.1091822 α      in ANC's #3, #5, #2, ...

........................................................................
.............................. CYCLE    3 ..............................
........................................................................
   1    -40.3780350 -0.403780E+02  0.235E-01    2.73       0.0  T
   2    -40.3781249 -0.899221E-04  0.127E-01    2.69       1.0  T
   3    -40.3780921  0.327898E-04  0.702E-02    2.70       1.0  T
   4    -40.3781351 -0.429608E-04  0.310E-02    2.69       1.0  T
   5    -40.3781430 -0.790887E-05  0.743E-03    2.69       3.3  T
   6    -40.3781431 -0.125211E-06  0.388E-03    2.69       6.3  T
   7    -40.3781432 -0.802111E-07  0.149E-03    2.69      16.3  T
     SCC iter.                  ...        0 min,  0.006 sec
     gradient                   ...        0 min,  0.009 sec
 * total energy  :   -39.9974517 Eh     change       -0.9076466E-03 Eh
   gradient norm :     0.0116214 Eh/α   predicted    -0.1121135E-02 (  23.52%)
   displ. norm   :     0.1544043 α      lambda       -0.8087967E-03
   maximum displ.:     0.0808720 α      in ANC's #2, #3, #4, ...

........................................................................
.............................. CYCLE    4 ..............................
........................................................................
   1    -40.3788445 -0.403788E+02  0.226E-01    2.67       0.0  T
   2    -40.3788562 -0.117592E-04  0.133E-01    2.68       1.0  T
   3    -40.3788273  0.289257E-04  0.542E-02    2.67       1.0  T
   4    -40.3788636 -0.363158E-04  0.101E-02    2.68       2.4  T
   5    -40.3788641 -0.512481E-06  0.501E-03    2.68       4.8  T
   6    -40.3788642 -0.634042E-07  0.225E-03    2.68      10.8  T
   7    -40.3788642 -0.190230E-07  0.122E-03    2.68      19.9  T
     SCC iter.                  ...        0 min,  0.006 sec
     gradient                   ...        0 min,  0.009 sec
 * total energy  :   -39.9975872 Eh     change       -0.1354529E-03 Eh
   gradient norm :     0.0129034 Eh/α   predicted    -0.4140416E-03 ( 205.67%)
   displ. norm   :     0.0684016 α      lambda       -0.4580553E-03
   maximum displ.:     0.0273323 α      in ANC's #15, #7, #2, ...

........................................................................
.............................. CYCLE    5 ..............................
........................................................................
   1    -40.3761179 -0.403761E+02  0.127E-01    2.66       0.0  T
   2    -40.3761284 -0.104374E-04  0.751E-02    2.66       1.0  T
   3    -40.3761229  0.548922E-05  0.281E-02    2.66       1.0  T
   4    -40.3761308 -0.791602E-05  0.815E-03    2.66       3.0  T
   5    -40.3761314 -0.601559E-06  0.371E-03    2.66       6.5  T
   6    -40.3761315 -0.104397E-06  0.176E-03    2.66      13.7  T
   7    -40.3761315 -0.267555E-08  0.877E-04    2.66      27.6  T
     SCC iter.                  ...        0 min,  0.006 sec
     gradient                   ...        0 min,  0.009 sec
 * total energy  :   -39.9978185 Eh     change       -0.2313488E-03 Eh
   gradient norm :     0.0034012 Eh/α   predicted    -0.2300996E-03 (  -0.54%)
   displ. norm   :     0.0887025 α      lambda       -0.1514890E-03
   maximum displ.:     0.0504298 α      in ANC's #2, #5, #1, ...

........................................................................
.............................. CYCLE    6 ..............................
........................................................................
   1    -40.3750930 -0.403751E+02  0.998E-02    2.66       0.0  T
   2    -40.3750961 -0.312586E-05  0.563E-02    2.66       1.0  T
   3    -40.3750932  0.293455E-05  0.196E-02    2.66       1.2  T
   4    -40.3750970 -0.377885E-05  0.682E-03    2.66       3.6  T
   5    -40.3750972 -0.275096E-06  0.290E-03    2.66       8.4  T
   6    -40.3750973 -0.401470E-07  0.104E-03    2.66      23.3  T
   7    -40.3750973 -0.320956E-08  0.433E-04    2.66      56.0  T
   8    -40.3750973 -0.769020E-10  0.171E-04    2.66     141.9  T
     SCC iter.                  ...        0 min,  0.007 sec
     gradient                   ...        0 min,  0.009 sec
 * total energy  :   -39.9978578 Eh     change       -0.3925398E-04 Eh
   gradient norm :     0.0050843 Eh/α   predicted    -0.7633896E-04 (  94.47%)
   displ. norm   :     0.0524014 α      lambda       -0.8115628E-04
   maximum displ.:     0.0339853 α      in ANC's #2, #7, #1, ...

........................................................................
.............................. CYCLE    7 ..............................
........................................................................
   1    -40.3757805 -0.403758E+02  0.657E-02    2.66       0.0  T
   2    -40.3757828 -0.231635E-05  0.380E-02    2.66       1.0  T
   3    -40.3757813  0.158076E-05  0.160E-02    2.65       1.5  T
   4    -40.3757836 -0.229290E-05  0.420E-03    2.66       5.8  T
   5    -40.3757837 -0.128594E-06  0.197E-03    2.66      12.3  T
   6    -40.3757837 -0.199226E-07  0.674E-04    2.66      36.0  T
     SCC iter.                  ...        0 min,  0.005 sec
     gradient                   ...        0 min,  0.009 sec
 * total energy  :   -39.9979107 Eh     change       -0.5291213E-04 Eh
   gradient norm :     0.0019813 Eh/α   predicted    -0.4069119E-04 ( -23.10%)
   displ. norm   :     0.1410839 α      lambda       -0.6760337E-04
   maximum displ.:     0.0879252 α      in ANC's #2, #7, #1, ...

........................................................................
.............................. CYCLE    8 ..............................
........................................................................
   1    -40.3767416 -0.403767E+02  0.154E-01    2.66       0.0  T
   2    -40.3767482 -0.653992E-05  0.886E-02    2.65       1.0  T
   3    -40.3767447  0.348882E-05  0.230E-02    2.65       1.1  T
   4    -40.3767499 -0.518214E-05  0.800E-03    2.65       3.0  T
   5    -40.3767502 -0.308871E-06  0.435E-03    2.65       5.6  T
   6    -40.3767503 -0.152527E-06  0.107E-03    2.65      22.6  T
   7    -40.3767503 -0.243325E-08  0.466E-04    2.65      52.0  T
   8    -40.3767503 -0.404924E-09  0.242E-04    2.65     100.2  T
     SCC iter.                  ...        0 min,  0.006 sec
     gradient                   ...        0 min,  0.009 sec
 * total energy  :   -39.9979341 Eh     change       -0.2337896E-04 Eh
   gradient norm :     0.0039054 Eh/α   predicted    -0.3409989E-04 (  45.86%)
   displ. norm   :     0.0689488 α      lambda       -0.6072606E-04
   maximum displ.:     0.0447253 α      in ANC's #2, #1, #7, ...

........................................................................
.............................. CYCLE    9 ..............................
........................................................................
   1    -40.3767014 -0.403767E+02  0.703E-02    2.65       0.0  T
   2    -40.3767029 -0.146086E-05  0.396E-02    2.65       1.0  T
   3    -40.3767024  0.515840E-06  0.105E-02    2.65       2.3  T
   4    -40.3767034 -0.102236E-05  0.312E-03    2.65       7.8  T
   5    -40.3767034  0.193667E-07  0.177E-03    2.65      13.7  T
   6    -40.3767034 -0.454387E-07  0.396E-04    2.65      61.3  T
   7    -40.3767034 -0.351861E-10  0.244E-04    2.65      99.5  T
     SCC iter.                  ...        0 min,  0.006 sec
     gradient                   ...        0 min,  0.010 sec
 * total energy  :   -39.9979778 Eh     change       -0.4372039E-04 Eh
   gradient norm :     0.0027962 Eh/α   predicted    -0.3050714E-04 ( -30.22%)
   displ. norm   :     0.0852752 α      lambda       -0.4925926E-04
   maximum displ.:     0.0478388 α      in ANC's #2, #3, #1, ...

........................................................................
.............................. CYCLE   10 ..............................
........................................................................
   1    -40.3766508 -0.403767E+02  0.803E-02    2.64       0.0  T
   2    -40.3766518 -0.100913E-05  0.453E-02    2.64       1.0  T
   3    -40.3766515  0.357430E-06  0.852E-03    2.64       2.8  T
   4    -40.3766522 -0.727588E-06  0.401E-03    2.64       6.1  T
   5    -40.3766523 -0.760800E-07  0.142E-03    2.64      17.1  T
   6    -40.3766523 -0.185584E-07  0.493E-04    2.64      49.2  T
   7    -40.3766523 -0.810310E-09  0.316E-04    2.64      76.7  T
     SCC iter.                  ...        0 min,  0.006 sec
     gradient                   ...        0 min,  0.009 sec
 * total energy  :   -39.9980112 Eh     change       -0.3342872E-04 Eh
   gradient norm :     0.0017678 Eh/α   predicted    -0.2480987E-04 ( -25.78%)
   displ. norm   :     0.1485215 α      lambda       -0.2964455E-04
   maximum displ.:     0.0861774 α      in ANC's #2, #3, #1, ...

........................................................................
.............................. CYCLE   11 ..............................
........................................................................
   1    -40.3759769 -0.403760E+02  0.144E-01    2.63       0.0  T
   2    -40.3759799 -0.307213E-05  0.821E-02    2.63       1.0  T
   3    -40.3759781  0.187422E-05  0.162E-02    2.63       1.5  T
   4    -40.3759813 -0.325693E-05  0.626E-03    2.63       3.9  T
   5    -40.3759815 -0.170543E-06  0.256E-03    2.63       9.5  T
   6    -40.3759816 -0.562568E-07  0.905E-04    2.63      26.8  T
   7    -40.3759816 -0.217680E-08  0.544E-04    2.63      44.6  T
     SCC iter.                  ...        0 min,  0.006 sec
     gradient                   ...        0 min,  0.011 sec
 * total energy  :   -39.9980412 Eh     change       -0.3001157E-04 Eh
   gradient norm :     0.0026886 Eh/α   predicted    -0.1496609E-04 ( -50.13%)
   displ. norm   :     0.1151233 α      lambda       -0.3439526E-04
   maximum displ.:     0.0676886 α      in ANC's #2, #3, #1, ...

........................................................................
.............................. CYCLE   12 ..............................
........................................................................
   1    -40.3759446 -0.403759E+02  0.120E-01    2.62       0.0  T
   2    -40.3759466 -0.204363E-05  0.689E-02    2.62       1.0  T
   3    -40.3759442  0.242986E-05  0.159E-02    2.63       1.5  T
   4    -40.3759478 -0.361402E-05  0.458E-03    2.63       5.3  T
   5    -40.3759479 -0.563958E-07  0.175E-03    2.63      13.9  T
   6    -40.3759479 -0.227354E-07  0.772E-04    2.63      31.4  T
   7    -40.3759479 -0.213510E-08  0.407E-04    2.63      59.7  T
     SCC iter.                  ...        0 min,  0.006 sec
     gradient                   ...        0 min,  0.011 sec
 * total energy  :   -39.9980700 Eh     change       -0.2882030E-04 Eh
   gradient norm :     0.0025694 Eh/α   predicted    -0.1742582E-04 ( -39.54%)
   displ. norm   :     0.2705682 α      lambda       -0.6874671E-04
   maximum displ.:     0.1623203 α      in ANC's #2, #1, #6, ...

........................................................................
.............................. CYCLE   13 ..............................
........................................................................
   1    -40.3747155 -0.403747E+02  0.290E-01    2.60       0.0  T
   2    -40.3747278 -0.123037E-04  0.167E-01    2.60       1.0  T
   3    -40.3747200  0.787451E-05  0.329E-02    2.61       1.0  T
   4    -40.3747345 -0.145858E-04  0.104E-02    2.60       2.3  T
   5    -40.3747349 -0.377532E-06  0.364E-03    2.60       6.7  T
   6    -40.3747350 -0.594360E-07  0.174E-03    2.60      13.9  T
   7    -40.3747350 -0.118587E-07  0.769E-04    2.60      31.5  T
   8    -40.3747350 -0.903718E-09  0.377E-04    2.60      64.4  T
     SCC iter.                  ...        0 min,  0.007 sec
     gradient                   ...        0 min,  0.010 sec
 * total energy  :   -39.9981080 Eh     change       -0.3794679E-04 Eh
   gradient norm :     0.0050386 Eh/α   predicted    -0.3689279E-04 (  -2.78%)
   displ. norm   :     0.0624651 α      lambda       -0.4377604E-04
   maximum displ.:     0.0348250 α      in ANC's #6, #1, #2, ...

........................................................................
.............................. CYCLE   14 ..............................
........................................................................
   1    -40.3763693 -0.403764E+02  0.872E-02    2.60       0.0  T
   2    -40.3763718 -0.245540E-05  0.502E-02    2.60       1.0  T
   3    -40.3763706  0.123308E-05  0.137E-02    2.61       1.8  T
   4    -40.3763726 -0.206536E-05  0.366E-03    2.60       6.6  T
   5    -40.3763727 -0.100758E-06  0.199E-03    2.60      12.2  T
   6    -40.3763728 -0.243671E-07  0.895E-04    2.60      27.1  T
     SCC iter.                  ...        0 min,  0.005 sec
     gradient                   ...        0 min,  0.009 sec
 * total energy  :   -39.9981325 Eh     change       -0.2450739E-04 Eh
   gradient norm :     0.0033950 Eh/α   predicted    -0.2197481E-04 ( -10.33%)
   displ. norm   :     0.1464800 α      lambda       -0.3677617E-04
   maximum displ.:     0.0899676 α      in ANC's #2, #6, #1, ...

........................................................................
.............................. CYCLE   15 ..............................
........................................................................
   1    -40.3761980 -0.403762E+02  0.159E-01    2.60       0.0  T
   2    -40.3762019 -0.392892E-05  0.916E-02    2.60       1.0  T
   3    -40.3762015  0.436205E-06  0.142E-02    2.60       1.7  T
   4    -40.3762038 -0.231227E-05  0.570E-03    2.60       4.3  T
   5    -40.3762040 -0.150661E-06  0.259E-03    2.60       9.4  T
   6    -40.3762040 -0.356951E-07  0.933E-04    2.60      26.0  T
   7    -40.3762040 -0.209027E-08  0.417E-04    2.60      58.2  T
     SCC iter.                  ...        0 min,  0.006 sec
     gradient                   ...        0 min,  0.011 sec
 * total energy  :   -39.9981587 Eh     change       -0.2623716E-04 Eh
   gradient norm :     0.0019543 Eh/α   predicted    -0.1878157E-04 ( -28.42%)
   displ. norm   :     0.2799548 α      lambda       -0.3184535E-04
   maximum displ.:     0.1657141 α      in ANC's #2, #6, #1, ...

........................................................................
.............................. CYCLE   16 ..............................
........................................................................
   1    -40.3751101 -0.403751E+02  0.312E-01    2.58       0.0  T
   2    -40.3751251 -0.149597E-04  0.179E-01    2.58       1.0  T
   3    -40.3751292 -0.416821E-05  0.200E-02    2.58       1.2  T
   4    -40.3751321 -0.286802E-05  0.112E-02    2.58       2.2  T
   5    -40.3751328 -0.698733E-06  0.419E-03    2.58       5.8  T
   6    -40.3751329 -0.117394E-06  0.185E-03    2.58      13.1  T
   7    -40.3751329 -0.978088E-08  0.987E-04    2.58      24.6  T
   8    -40.3751329 -0.631852E-08  0.297E-04    2.58      81.7  T
     SCC iter.                  ...        0 min,  0.006 sec
     gradient                   ...        0 min,  0.009 sec
 * total energy  :   -39.9981689 Eh     change       -0.1020194E-04 Eh
   gradient norm :     0.0044616 Eh/α   predicted    -0.1647580E-04 (  61.50%)
   displ. norm   :     0.0537128 α      lambda       -0.4318237E-04
   maximum displ.:     0.0313248 α      in ANC's #2, #3, #1, ...

........................................................................
.............................. CYCLE   17 ..............................
........................................................................
   1    -40.3776504 -0.403777E+02  0.532E-02    2.61       0.0  T
   2    -40.3776539 -0.352025E-05  0.291E-02    2.60       1.0  T
   3    -40.3776533  0.674647E-06  0.122E-02    2.60       2.0  T
   4    -40.3776539 -0.658575E-06  0.599E-03    2.60       4.1  T
   5    -40.3776543 -0.417370E-06  0.115E-03    2.60      21.1  T
   6    -40.3776543 -0.209192E-08  0.648E-04    2.60      37.4  T
     SCC iter.                  ...        0 min,  0.006 sec
     gradient                   ...        0 min,  0.010 sec
 * total energy  :   -39.9981731 Eh     change       -0.4200119E-05 Eh
   gradient norm :     0.0043266 Eh/α   predicted    -0.2165468E-04 ( 415.57%)
   displ. norm   :     0.0653720 α      lambda       -0.4280986E-04
   maximum displ.:     0.0328384 α      in ANC's #3, #6, #2, ...

........................................................................
.............................. CYCLE   18 ..............................
........................................................................
   1    -40.3764637 -0.403765E+02  0.835E-02    2.58       0.0  T
   2    -40.3764673 -0.359132E-05  0.470E-02    2.58       1.0  T
   3    -40.3764656  0.168756E-05  0.160E-02    2.59       1.5  T
   4    -40.3764679 -0.228209E-05  0.547E-03    2.59       4.4  T
   5    -40.3764682 -0.305224E-06  0.208E-03    2.59      11.7  T
   6    -40.3764682 -0.263840E-07  0.960E-04    2.59      25.3  T
     SCC iter.                  ...        0 min,  0.006 sec
     gradient                   ...        0 min,  0.010 sec
 * total energy  :   -39.9981873 Eh     change       -0.1422056E-04 Eh
   gradient norm :     0.0029159 Eh/α   predicted    -0.2149619E-04 (  51.16%)
   displ. norm   :     0.0258348 α      lambda       -0.1432107E-04
   maximum displ.:     0.0130300 α      in ANC's #8, #7, #3, ...

........................................................................
.............................. CYCLE   19 ..............................
........................................................................
   1    -40.3763122 -0.403763E+02  0.286E-02    2.59       0.0  T
   2    -40.3763127 -0.504751E-06  0.163E-02    2.59       1.5  T
   3    -40.3763127  0.899265E-07  0.493E-03    2.59       4.9  T
   4    -40.3763128 -0.181835E-06  0.159E-03    2.59      15.2  T
   5    -40.3763129 -0.187847E-07  0.776E-04    2.59      31.2  T
   6    -40.3763129 -0.484225E-08  0.346E-04    2.59      70.0  T
     SCC iter.                  ...        0 min,  0.005 sec
     gradient                   ...        0 min,  0.010 sec
 * total energy  :   -39.9981947 Eh     change       -0.7368935E-05 Eh
   gradient norm :     0.0013824 Eh/α   predicted    -0.7164895E-05 (  -2.77%)
   displ. norm   :     0.0690201 α      lambda       -0.4467198E-05
   maximum displ.:     0.0374367 α      in ANC's #2, #1, #6, ...

........................................................................
.............................. CYCLE   20 ..............................
........................................................................
   1    -40.3763971 -0.403764E+02  0.756E-02    2.59       0.0  T
   2    -40.3763982 -0.105663E-05  0.433E-02    2.59       1.0  T
   3    -40.3763984 -0.179331E-06  0.583E-03    2.59       4.2  T
   4    -40.3763986 -0.232618E-06  0.309E-03    2.59       7.9  T
   5    -40.3763986 -0.505206E-07  0.145E-03    2.59      16.7  T
   6    -40.3763987 -0.164437E-07  0.514E-04    2.59      47.2  T
   7    -40.3763987 -0.826169E-09  0.215E-04    2.59     113.1  T
     SCC iter.                  ...        0 min,  0.006 sec
     gradient                   ...        0 min,  0.010 sec
 * total energy  :   -39.9981992 Eh     change       -0.4507205E-05 Eh
   gradient norm :     0.0009389 Eh/α   predicted    -0.2236428E-05 ( -50.38%)
   displ. norm   :     0.1933850 α      lambda       -0.8867572E-05
   maximum displ.:     0.1067181 α      in ANC's #6, #1, #2, ...

   *** GEOMETRY OPTIMIZATION CONVERGED AFTER 20 ITERATIONS ***

------------------------------------------------------------------------
 total energy gain   :        -0.0080274 Eh       -5.0373 kcal/mol
 total RMSD          :         0.4050565 a0        0.2143 Å
 total power (kW/mol):        -1.0537977 (step)  -45.1599 (real)
------------------------------------------------------------------------

 ANCopt (total)                0 d,  0 h,  0 min,  0.467 sec
 optimizer setup                ...        0 min,  0.000 sec (  0.031%)
 model hessian                  ...        0 min,  0.002 sec (  0.444%)
 ANC generation                 ...        0 min,  0.000 sec (  0.094%)
 coordinate transformation      ...        0 min,  0.000 sec (  0.054%)
 single point calculation       ...        0 min,  0.458 sec ( 98.085%)
 optimization log               ...        0 min,  0.001 sec (  0.296%)
 hessian update                 ...        0 min,  0.000 sec (  0.044%)
 rational function              ...        0 min,  0.003 sec (  0.701%)

================
 final structure:
================
$coord
    0.45246261248046    2.21297614617417   -0.24045549407628      C 
   -1.59795888124504   -0.25119632549901   -0.35368488345816      S 
    0.82271576196997   -2.46569139402293    0.01299843287159      C 
    3.10845285460455   -1.26059699091337    0.22284726615722      C 
    2.89355887302150    1.40966234959333    0.07644485603875      C 
    4.99308857284276    3.09740362908426    0.29886671274015      N 
    4.57891247970529    5.32257026370100   -0.02228209105062      O 
    7.01867157458396    2.16467631483223    0.80865214939346      O 
    5.51869967860768   -2.55236041642123    0.58015826580605      N 
    6.01197867071903   -3.19499455733599    2.70338744980446      O 
    6.74289058050850   -2.93665752728528   -1.29800232316434      O 
    0.17099962301101   -5.11390027027513    0.03989914116910      C 
    1.76643483022675   -7.04626247178025   -0.15322014033792      C 
   -0.16595497826067    4.13714501314110   -0.38932528229693      H 
   -1.83783816558617   -5.46748305213670    0.20054437212177      H 
    3.77572413278745   -6.83936003860283   -0.38059223163194      H 
    1.07547010529013   -8.95718319697443   -0.10987301547012      H 
$end
           -------------------------------------------------
          |                Final Singlepoint                |
           -------------------------------------------------

          ...................................................
          :                      SETUP                      :
          :.................................................:
          :  # basis functions                  62          :
          :  # atomic orbitals                  61          :
          :  # shells                           31          :
          :  # electrons                        68          :
          :  max. iterations                   250          :
          :  Hamiltonian                  GFN2-xTB          :
          :  restarted?                      false          :
          :  GBSA solvation                  false          :
          :  PC potential                    false          :
          :  electronic temp.          300.0000000     K    :
          :  accuracy                    1.0000000          :
          :  -> integral cutoff          0.2500000E+02      :
          :  -> integral neglect         0.1000000E-07      :
          :  -> SCF convergence          0.1000000E-05 Eh   :
          :  -> wf. convergence          0.1000000E-03 e    :
          :  Broyden damping             0.4000000          :
          ...................................................

 iter      E             dE          RMSdq      gap      omega  full diag
   1    -40.3763987 -0.403764E+02  0.659E-05    2.59       0.0  T
   2    -40.3763987 -0.105658E-10  0.422E-05    2.59     574.5  T
   3    -40.3763987 -0.163496E-10  0.230E-05    2.59    1053.2  T

   *** convergence criteria satisfied after 3 iterations ***

         #    Occupation            Energy/Eh            Energy/eV
      -------------------------------------------------------------
         1        2.0000           -0.7986005             -21.7310
       ...           ...                  ...                  ...
        28        2.0000           -0.4835915             -13.1592
        29        2.0000           -0.4824244             -13.1274
        30        2.0000           -0.4735070             -12.8848
        31        2.0000           -0.4625008             -12.5853
        32        2.0000           -0.4611294             -12.5480
        33        2.0000           -0.4590316             -12.4909
        34        2.0000           -0.4384321             -11.9303 (HOMO)
        35                         -0.3433319              -9.3425 (LUMO)
        36                         -0.3258284              -8.8662
        37                         -0.3180852              -8.6555
        38                         -0.2621343              -7.1330
        39                         -0.2406623              -6.5488
       ...                                ...                  ...
        61                          0.6119339              16.6516
      -------------------------------------------------------------
                  HL-Gap            0.0951003 Eh            2.5878 eV
             Fermi-level           -0.3908820 Eh          -10.6364 eV

 SCC (total)                   0 d,  0 h,  0 min,  0.021 sec
 SCC setup                      ...        0 min,  0.000 sec (  0.739%)
 Dispersion                     ...        0 min,  0.000 sec (  0.592%)
 integral evaluation            ...        0 min,  0.007 sec ( 33.284%)
 zeroth order Hamiltonian       ...        0 min,  0.000 sec (  0.521%)
 iterations                     ...        0 min,  0.003 sec ( 14.867%)
 molecular gradient             ...        0 min,  0.010 sec ( 48.435%)
 printout                       ...        0 min,  0.000 sec (  1.346%)

         :::::::::::::::::::::::::::::::::::::::::::::::::::::
         ::                     SUMMARY                     ::
         :::::::::::::::::::::::::::::::::::::::::::::::::::::
         :: total energy             -39.998199227140 Eh    ::
         :: gradient norm              0.000940289798 Eh/a0 ::
         :: HOMO-LUMO gap              2.587809795540 eV    ::
         ::.................................................::
         :: SCC energy               -40.376398651484 Eh    ::
         :: -> isotropic ES            0.096081828253 Eh    ::
         :: -> anisotropic ES          0.018050211607 Eh    ::
         :: -> anisotropic XC         -0.001249561005 Eh    ::
         :: -> dispersion             -0.019024903467 Eh    ::
         :: repulsion energy           0.378130424859 Eh    ::
         :: add. restraining           0.000000000000 Eh    ::
         :::::::::::::::::::::::::::::::::::::::::::::::::::::

           -------------------------------------------------
          |                Property Printout                |
           -------------------------------------------------

    * Orbital Energies and Occupations

         #    Occupation            Energy/Eh            Energy/eV
      -------------------------------------------------------------
         1        2.0000           -0.7986005             -21.7310
       ...           ...                  ...                  ...
        22        2.0000           -0.5451875             -14.8353
        23        2.0000           -0.5354765             -14.5711
        24        2.0000           -0.5109853             -13.9046
        25        2.0000           -0.4958284             -13.4922
        26        2.0000           -0.4944101             -13.4536
        27        2.0000           -0.4901803             -13.3385
        28        2.0000           -0.4835915             -13.1592
        29        2.0000           -0.4824244             -13.1274
        30        2.0000           -0.4735070             -12.8848
        31        2.0000           -0.4625008             -12.5853
        32        2.0000           -0.4611294             -12.5480
        33        2.0000           -0.4590316             -12.4909
        34        2.0000           -0.4384321             -11.9303 (HOMO)
        35                         -0.3433319              -9.3425 (LUMO)
        36                         -0.3258284              -8.8662
        37                         -0.3180852              -8.6555
        38                         -0.2621343              -7.1330
        39                         -0.2406623              -6.5488
        40                         -0.2036267              -5.5410
        41                         -0.1780398              -4.8447
        42                         -0.0702886              -1.9127
        43                         -0.0333166              -0.9066
        44                         -0.0252921              -0.6882
        45                         -0.0189251              -0.5150
       ...                                ...                  ...
        61                          0.6119339              16.6516
      -------------------------------------------------------------
                  HL-Gap            0.0951003 Eh            2.5878 eV
             Fermi-level           -0.3908820 Eh          -10.6364 eV

     #   Z        covCN         q      C6AA      α(0)
     1   6 C      2.929    -0.023    28.569     8.766
     2  16 S      2.362     0.116   136.414    19.658
     3   6 C      2.986     0.024    27.453     8.595
     4   6 C      3.096    -0.012    28.199     8.703
     5   6 C      3.124    -0.006    27.981     8.662
     6   7 N      2.757     0.556    13.417     5.440
     7   8 O      0.931    -0.376    21.171     6.171
     8   8 O      0.932    -0.369    21.042     6.152
     9   7 N      2.755     0.586    13.104     5.376
    10   8 O      0.930    -0.351    20.699     6.101
    11   8 O      0.930    -0.354    20.743     6.108
    12   6 C      2.927    -0.031    28.761     8.795
    13   6 C      2.838    -0.071    29.757     8.940
    14   1 H      0.926     0.105     1.740     2.063
    15   1 H      0.925     0.065     2.140     2.288
    16   1 H      0.926     0.069     2.096     2.264
    17   1 H      0.926     0.071     2.071     2.250

 Mol. C6AA /au·bohr⁶  :       5572.137341
 Mol. C8AA /au·bohr⁸  :     150961.236647
 Mol. α(0) /au        :        116.330885


Wiberg/Mayer (AO) data.
largest (>0.10) Wiberg bond orders for each atom
          total WBO             WBO to atom ...
     1  C   3.960        C    5 1.504    S    2 1.278    H   14 0.959
     2  S   2.711        C    1 1.278    C    3 1.140
     3  C   3.956        C    4 1.507    S    2 1.140    C   12 1.124
     4  C   3.961        C    3 1.507    C    5 1.224    N    9 0.907
     5  C   3.959        C    1 1.504    C    4 1.224    N    6 0.977
     6  N   3.918        O    8 1.449    O    7 1.449    C    5 0.977
     7  O   1.940        N    6 1.449    O    8 0.366
     8  O   1.956        N    6 1.449    O    7 0.366
     9  N   3.925        O   10 1.488    O   11 1.483    C    4 0.907
    10  O   1.984        N    9 1.488    O   11 0.389
    11  O   1.982        N    9 1.483    O   10 0.389
    12  C   3.987        C   13 1.870    C    3 1.124    H   15 0.958
    13  C   3.981        C   12 1.870    H   17 0.973    H   16 0.971
    14  H   0.988        C    1 0.959
    15  H   0.995        C   12 0.958
    16  H   0.995        C   13 0.971
    17  H   0.994        C   13 0.973

molecular dipole:
                 x           y           z       tot (Debye)
 q only:       -2.962      -0.922      -0.366
   full:       -2.851      -0.805      -0.360       7.585
molecular quadrupole (traceless):
                xx          xy          yy          xz          yz          zz
 q only:      -19.650      -2.484      11.059      -3.022       1.043       8.590
  q+dip:      -20.074      -1.631      12.622      -3.570       1.634       7.452
   full:      -21.629      -1.388      11.922      -3.686       1.724       9.706

           -------------------------------------------------
          |                Geometry Summary                 |
           -------------------------------------------------

      molecular mass/u    :      200.1686000
   center of mass at/Å    :        1.5840170      -0.3788183       0.0921499
  moments of inertia/u·Å² :        0.5054207E+03   0.6955168E+03   0.1124956E+04
rotational constants/cm⁻¹ :        0.3335366E-01   0.2423756E-01   0.1498514E-01

 * 15 selected distances

     #   Z        #   Z                                     value/Å
     1   6 C      2  16 S                                 1.6974300
     2  16 S      3   6 C                                 1.7469351 (max)
     3   6 C      4   6 C                                 1.3718744
     1   6 C      5   6 C                                 1.3702207
     4   6 C      5   6 C                                 1.4197243
     5   6 C      6   7 N                                 1.4303425
     6   7 N      7   8 O                                 1.2097280
     6   7 N      8   8 O                                 1.2105152
     9   7 N     10   8 O                                 1.2025726
     9   7 N     11   8 O                                 1.2036677
    12   6 C     13   6 C                                 1.3299870
     1   6 C     14   1 H                                 1.0724203 (min)
    12   6 C     15   1 H                                 1.0827149
    13   6 C     16   1 H                                 1.0756431
    13   6 C     17   1 H                                 1.0755362

 * 5 distinct bonds (by element types)

   Z      Z             #   av. dist./Å        max./Å        min./Å
   1 H    6 C           4     1.0765786     1.0827149     1.0724203
   6 C    6 C           4     1.3729516     1.4197243     1.3299870
   6 C    7 N           1     1.4303425     1.4303425     1.4303425
   7 N    8 O           4     1.2066209     1.2105152     1.2025726
   6 C   16 S           2     1.7221826     1.7469351     1.6974300


optimized geometry written to: xtbopt.xyz


           -------------------------------------------------
          | TOTAL ENERGY              -39.998199227140 Eh   |
          | GRADIENT NORM               0.000940289798 Eh/α |
          | HOMO-LUMO GAP               2.587809795540 eV   |
           -------------------------------------------------

------------------------------------------------------------------------
 * finished run on 2021/05/19 at 10:58:49.831     
------------------------------------------------------------------------
 total:
 * wall-time:     0 d,  0 h,  0 min,  0.538 sec
 *  cpu-time:     0 d,  0 h,  0 min,  0.538 sec
 * ratio c/w:     1.000 speedup
 SCF:
 * wall-time:     0 d,  0 h,  0 min,  0.031 sec
 *  cpu-time:     0 d,  0 h,  0 min,  0.031 sec
 * ratio c/w:     1.000 speedup
 ANC optimizer:
 * wall-time:     0 d,  0 h,  0 min,  0.488 sec
 *  cpu-time:     0 d,  0 h,  0 min,  0.488 sec
 * ratio c/w:     1.000 speedup

