      -----------------------------------------------------------      
     |                   =====================                   |     
     |                           x T B                           |     
     |                   =====================                   |     
     |                         S. Grimme                         |     
     |          Mulliken Center for Theoretical Chemistry        |     
     |                    University of Bonn                     |     
     |                Version 6.2 RC2 (SAW190805)                |     
      -----------------------------------------------------------      

   This program is distributed in the hope that it will be useful,
   but WITHOUT ANY WARRANTY; without even the implied warranty of
   MERCHANTABILITY or FITNESS FOR A PARTICULAR PURPOSE.
   
   FOR NON-COMMERCIAL, ACADEMIA USE ONLY.
   
   Cite this work as:
   * S. Grimme, C. Bannwarth, P. Shushkov, J. Chem. Theory Comput., 2017,
     13, 1989-2009. DOI: 10.1021/acs.jctc.7b00118
   * C. Bannwarth, S. Ehlert and S. Grimme., J. Chem. Theory Comput., 2019,
     15, 1652-1671. DOI: 10.1021/acs.jctc.8b01176
   * P. Pracht, E. Caldeweyher, S. Ehlert, S. Grimme, ChemRxiv, 2019, preprint.
     DOI: 10.26434/chemrxiv.8326202.v1
   
   for DFT-D4:
   * E. Caldeweyher, C. Bannwarth and S. Grimme, J. Chem. Phys., 2017,
     147, 034112. DOI: 10.1063/1.4993215
   * E. Caldeweyher, S. Ehlert, A. Hansen, H. Neugebauer, S. Spicher,
     C. Bannwarth and S. Grimme, J. Chem. Phys., 2019, 150, 154122.
     DOI: 10.1063/1.5090222
   
   for sTDA-xTB:
   * S. Grimme and C. Bannwarth, J. Chem. Phys., 2016, 145, 054103.
     DOI: 10.1063/1.4959605
   
   in the mass-spec context:
   * V. Asgeirsson, C. Bauer and S. Grimme, Chem. Sci., 2017, 8, 4879.
     DOI: 10.1039/c7sc00601b
   
   for metadynamics refer to:
   * S. Grimme, J. Chem. Theory Comput., 2019, 155, 2847-2862
     DOI: 10.1021/acs.jctc.9b00143
   
   with help from (in alphabetical order)
   C. Bannwarth, F. Bohle, G. Brandenburg, E. Caldeweyher, M. Checinski,
   S. Dohm, S. Ehlert, S. Ehrlich, F. März, H. Neugebauer, J. Pisarek,
   P. Pracht, P. Shushkov, and S. Spicher.
   
 * started run on 2021/05/19 at 11:01:01.585     

           -------------------------------------------------
          |                Calculation Setup                |
           -------------------------------------------------

          program call               : /ihome/ghutchison/geoffh/xtb/xtb 791.xyz -opt
          hostname                   : smp-n83
          coordinate file            : 791.xyz
          omp threads                :                     1
          number of atoms            :                    24
          number of electrons        :                    60
          charge                     :                     0
          spin                       :                   0.0
          first test random number   :      0.16145050140251


########################################################################
# WARNING! Please study the warnings concerning your input carefully
#  - the use of '-opt' is discouraged, please use '--opt' next time
########################################################################

           ------------------------------------------------- 
          |                 G F N 2 - x T B                 |
          | Geometry, Frequencies, Noncovalent interactions |
          |            JCTC 2019 parametrisation            |
           ------------------------------------------------- 
             KAB for C  - Si     :                1.0500
             KAB for H  - Pd     :                0.9500
             k(s)              :                1.8500
             k(p)              :                2.2300
             k(d)              :                2.2300
             k(f)              :                2.0000
             kEN (H0ij)        :               -2.0000
             D4 a1             :                0.5200
             D4 a2             :                5.0000
             D4 s6             :                1.0000
             D4 s8             :                2.7000
             D4 s9             :                5.0000
             alphaj            :                2.0000

  Z AO/shell   Hii/eV     exponent
  1     Wed Apr 25 08:07:45 CEST 2018   EN: 2.200 GM2: 0.406  GM3: 0.0800  RAES: 1.40
     1s    -10.707211    1.230000
  6     Wed Apr 25 08:07:45 CEST 2018   EN: 2.550 GM2: 0.538  GM3: 0.1500  RAES: 3.00
     2s    -13.970922    2.096432
     2p    -10.063292    1.800000

           ------------------------------------------------- 
          |        Self-Consistent Charge Iterations        |
           ------------------------------------------------- 

          ...................................................
          :                      SETUP                      :
          :.................................................:
          :  # basis functions                  60          :
          :  # atomic orbitals                  60          :
          :  # shells                           36          :
          :  # electrons                        60          :
          :  max. iterations                   250          :
          :  Hamiltonian                  GFN2-xTB          :
          :  restarted?                      false          :
          :  GBSA solvation                  false          :
          :  PC potential                    false          :
          :  electronic temp.          300.0000000     K    :
          :  accuracy                    1.0000000          :
          :  -> integral cutoff          0.2500000E+02      :
          :  -> integral neglect         0.1000000E-07      :
          :  -> SCF convergence          0.1000000E-05 Eh   :
          :  -> wf. convergence          0.1000000E-03 e    :
          :  Broyden damping             0.4000000          :
          ...................................................

 iter      E             dE          RMSdq      gap      omega  full diag
   1    -32.1429207 -0.321429E+02  0.456E+00    1.21       0.0  T
   2    -32.0078657  0.135055E+00  0.412E+00    1.03       1.0  T
   3    -32.1250649 -0.117199E+00  0.300E+00    1.41       1.0  T
   4    -32.2107495 -0.856846E-01  0.696E-01    0.92       1.0  T
   5    -32.2128589 -0.210940E-02  0.434E-01    0.90       1.0  T
   6    -32.2150917 -0.223280E-02  0.170E-01    0.88       1.0  T
   7    -32.2152917 -0.199960E-03  0.746E-02    0.87       1.0  T
   8    -32.2153234 -0.317426E-04  0.403E-02    0.87       1.0  T
   9    -32.2153392 -0.157644E-04  0.123E-02    0.87       1.7  T
  10    -32.2153403 -0.112023E-05  0.473E-03    0.86       4.3  T
  11    -32.2153405 -0.190328E-06  0.212E-03    0.86       9.6  T
  12    -32.2153405 -0.435981E-07  0.502E-04    0.86      40.7  T
  13    -32.2153405 -0.206702E-08  0.958E-05    0.86     213.1  T

   *** convergence criteria satisfied after 13 iterations ***

         #    Occupation            Energy/Eh            Energy/eV
      -------------------------------------------------------------
         1        2.0000           -0.6493503             -17.6697
       ...           ...                  ...                  ...
        24        2.0000           -0.4330941             -11.7851
        25        2.0000           -0.4294566             -11.6861
        26        2.0000           -0.4240107             -11.5379
        27        2.0000           -0.4165336             -11.3345
        28        2.0000           -0.3891080             -10.5882
        29        2.0000           -0.3544532              -9.6452
        30        2.0000           -0.3115956              -8.4789 (HOMO)
        31        0.0000           -0.2798330              -7.6146 (LUMO)
        32                         -0.2438323              -6.6350
        33                         -0.1980753              -5.3899
        34                         -0.1288452              -3.5061
        35                         -0.1154868              -3.1426
       ...                                ...                  ...
        60                          1.0801739              29.3930
      -------------------------------------------------------------
                  HL-Gap            0.0317626 Eh            0.8643 eV
             Fermi-level           -0.2957143 Eh           -8.0468 eV

 SCC (total)                   0 d,  0 h,  0 min,  0.033 sec
 SCC setup                      ...        0 min,  0.000 sec (  0.876%)
 Dispersion                     ...        0 min,  0.000 sec (  1.095%)
 integral evaluation            ...        0 min,  0.007 sec ( 21.150%)
 zeroth order Hamiltonian       ...        0 min,  0.000 sec (  0.460%)
 iterations                     ...        0 min,  0.013 sec ( 39.963%)
 molecular gradient             ...        0 min,  0.012 sec ( 35.112%)
 printout                       ...        0 min,  0.000 sec (  1.167%)

         :::::::::::::::::::::::::::::::::::::::::::::::::::::
         ::                     SUMMARY                     ::
         :::::::::::::::::::::::::::::::::::::::::::::::::::::
         :: total energy             -31.610192412810 Eh    ::
         :: gradient norm              0.073895275872 Eh/a0 ::
         :: HOMO-LUMO gap              0.864304211030 eV    ::
         ::.................................................::
         :: SCC energy               -32.215340544893 Eh    ::
         :: -> isotropic ES            0.005010044010 Eh    ::
         :: -> anisotropic ES          0.005097537635 Eh    ::
         :: -> anisotropic XC          0.023082097123 Eh    ::
         :: -> dispersion             -0.021128293190 Eh    ::
         :: repulsion energy           0.605052124457 Eh    ::
         :: add. restraining           0.000000000000 Eh    ::
         :::::::::::::::::::::::::::::::::::::::::::::::::::::

      ----------------------------------------------------------- 
     |                   =====================                   |
     |                        A N C O P T                        |
     |                   =====================                   |
     |               Approximate Normal Coordinate               |
     |                Rational Function Optimizer                |
      ----------------------------------------------------------- 

          ...................................................
          :                      SETUP                      :
          :.................................................:
          :   optimization level            normal          :
          :   max. optcycles                   200          :
          :   ANC micro-cycles                  20          :
          :   degrees of freedom                66          :
          :.................................................:
          :   RF solver                   davidson          :
          :   input Hessian                  false          :
          :   write xtbopt.log                true          :
          :   linear?                        false          :
          :   energy convergence         0.5000000E-05 Eh   :
          :   grad. convergence          0.1000000E-02 Eh/α :
          :   maximium RF displ.         2.0000000          :
          :   Hlow (freq-cutoff)         0.5000000E-02      :
          :   Hmax (freq-cutoff)         5.0000000          :
          :   S6 in model hess.         20.0000000          :
          ...................................................

generating ANC from model Hessian ...
Using Lindh-Hessian (1995)
 Shifting diagonal of input Hessian by   4.427829156242422E-003
 Lowest  eigenvalues of input Hessian
   -0.000000   -0.000000    0.000000    0.000000    0.000000    0.000000
    0.005000    0.005279    0.005606    0.007085    0.008306    0.009512
    0.010745    0.012985    0.018584    0.020843    0.027440    0.032908
 Highest eigenvalues
    1.605200    1.707265    1.783747    1.863193    2.036734    2.414263
 

........................................................................
.............................. CYCLE    1 ..............................
........................................................................
   1    -32.2153405 -0.322153E+02  0.510E-05    0.86       0.0  T
   2    -32.2153405  0.269011E-10  0.526E-05    0.86     388.0  T
   3    -32.2153405 -0.269864E-10  0.410E-05    0.86     497.3  T
     SCC iter.                  ...        0 min,  0.004 sec
     gradient                   ...        0 min,  0.011 sec
 * total energy  :   -31.6101924 Eh     change       -0.4437002E-08 Eh
   gradient norm :     0.0738949 Eh/α   predicted     0.0000000E+00 (-100.00%)
   displ. norm   :     0.8665299 α      lambda       -0.4392737E-01
   maximum displ.:     0.7930493 α      in ANC's #1, #2, #6, ...

........................................................................
.............................. CYCLE    2 ..............................
........................................................................
   1    -32.2265419 -0.322265E+02  0.874E-01    2.04       0.0  T
   2    -32.2207998  0.574208E-02  0.824E-01    2.15       1.0  T
   3    -32.2312302 -0.104303E-01  0.370E-01    2.06       1.0  T
   4    -32.2320216 -0.791400E-03  0.460E-02    2.07       1.0  T
   5    -32.2320569 -0.353114E-04  0.191E-02    2.07       1.1  T
   6    -32.2320631 -0.619890E-05  0.499E-03    2.07       4.1  T
   7    -32.2320632 -0.899843E-07  0.288E-03    2.07       7.1  T
   8    -32.2320632 -0.720224E-07  0.135E-03    2.07      15.1  T
     SCC iter.                  ...        0 min,  0.008 sec
     gradient                   ...        0 min,  0.011 sec
 * total energy  :   -31.6432509 Eh     change       -0.3305847E-01 Eh
   gradient norm :     0.0521157 Eh/α   predicted    -0.3845681E-01 (  16.33%)
   displ. norm   :     0.6321992 α      lambda       -0.1965564E-01
   maximum displ.:     0.4906984 α      in ANC's #1, #5, #9, ...

........................................................................
.............................. CYCLE    3 ..............................
........................................................................
   1    -32.2390033 -0.322390E+02  0.495E-01    2.69       0.0  T
   2    -32.2389092  0.941566E-04  0.333E-01    2.71       1.0  T
   3    -32.2386984  0.210841E-03  0.259E-01    2.71       1.0  T
   4    -32.2395238 -0.825425E-03  0.286E-02    2.70       1.0  T
   5    -32.2395279 -0.410983E-05  0.162E-02    2.70       1.3  T
   6    -32.2395309 -0.300279E-05  0.652E-03    2.70       3.1  T
   7    -32.2395314 -0.521388E-06  0.196E-03    2.70      10.4  T
   8    -32.2395314 -0.211399E-07  0.112E-03    2.70      18.3  T
     SCC iter.                  ...        0 min,  0.008 sec
     gradient                   ...        0 min,  0.011 sec
 * total energy  :   -31.6541506 Eh     change       -0.1089970E-01 Eh
   gradient norm :     0.0684453 Eh/α   predicted    -0.1375576E-01 (  26.20%)
   displ. norm   :     0.7260735 α      lambda       -0.2632584E-01
   maximum displ.:     0.3358351 α      in ANC's #1, #6, #2, ...

........................................................................
.............................. CYCLE    4 ..............................
........................................................................
   1    -32.2533459 -0.322533E+02  0.568E-01    3.03       0.0  T
   2    -32.2536776 -0.331672E-03  0.336E-01    3.04       1.0  T
   3    -32.2531237  0.553855E-03  0.226E-01    3.04       1.0  T
   4    -32.2538540 -0.730245E-03  0.530E-02    3.03       1.0  T
   5    -32.2538661 -0.121102E-04  0.165E-02    3.03       1.2  T
   6    -32.2538678 -0.166149E-05  0.742E-03    3.03       2.8  T
   7    -32.2538686 -0.881103E-06  0.250E-03    3.03       8.2  T
   8    -32.2538687 -0.730505E-07  0.117E-03    3.03      17.4  T
     SCC iter.                  ...        0 min,  0.008 sec
     gradient                   ...        0 min,  0.011 sec
 * total energy  :   -31.6561021 Eh     change       -0.1951551E-02 Eh
   gradient norm :     0.1023197 Eh/α   predicted    -0.2010219E-01 ( 930.06%)
   displ. norm   :     0.3561433 α      lambda       -0.2426465E-01
   maximum displ.:     0.1904310 α      in ANC's #5, #2, #6, ...

........................................................................
.............................. CYCLE    5 ..............................
........................................................................
   1    -32.2750241 -0.322750E+02  0.323E-01    2.99       0.0  T
   2    -32.2751409 -0.116840E-03  0.181E-01    2.98       1.0  T
   3    -32.2749834  0.157488E-03  0.135E-01    2.97       1.0  T
   4    -32.2752046 -0.221171E-03  0.290E-02    2.98       1.0  T
   5    -32.2752061 -0.151395E-05  0.970E-03    2.98       2.1  T
   6    -32.2752067 -0.579984E-06  0.454E-03    2.98       4.5  T
   7    -32.2752070 -0.312086E-06  0.156E-03    2.98      13.0  T
     SCC iter.                  ...        0 min,  0.007 sec
     gradient                   ...        0 min,  0.010 sec
 * total energy  :   -31.6715728 Eh     change       -0.1547063E-01 Eh
   gradient norm :     0.0324767 Eh/α   predicted    -0.1367118E-01 ( -11.63%)
   displ. norm   :     0.5658959 α      lambda       -0.1116465E-01
   maximum displ.:     0.4233348 α      in ANC's #1, #5, #25, ...

........................................................................
.............................. CYCLE    6 ..............................
........................................................................
   1    -32.2701083 -0.322701E+02  0.364E-01    2.98       0.0  T
   2    -32.2702084 -0.100130E-03  0.213E-01    2.99       1.0  T
   3    -32.2699843  0.224177E-03  0.152E-01    3.00       1.0  T
   4    -32.2702947 -0.310490E-03  0.231E-02    3.00       1.0  T
   5    -32.2702966 -0.188368E-05  0.137E-02    2.99       1.5  T
   6    -32.2703002 -0.357030E-05  0.459E-03    2.99       4.5  T
   7    -32.2703003 -0.145150E-06  0.193E-03    2.99      10.6  T
     SCC iter.                  ...        0 min,  0.007 sec
     gradient                   ...        0 min,  0.011 sec
 * total energy  :   -31.6739596 Eh     change       -0.2386834E-02 Eh
   gradient norm :     0.0670215 Eh/α   predicted    -0.7369999E-02 ( 208.78%)
   displ. norm   :     0.3436666 α      lambda       -0.1141611E-01
   maximum displ.:     0.1337269 α      in ANC's #5, #9, #33, ...

........................................................................
.............................. CYCLE    7 ..............................
........................................................................
   1    -32.2863286 -0.322863E+02  0.225E-01    3.04       0.0  T
   2    -32.2863791 -0.505297E-04  0.126E-01    3.04       1.0  T
   3    -32.2863162  0.629613E-04  0.856E-02    3.03       1.0  T
   4    -32.2864051 -0.889344E-04  0.117E-02    3.03       1.8  T
   5    -32.2864054 -0.274154E-06  0.750E-03    3.03       2.7  T
   6    -32.2864062 -0.821341E-06  0.309E-03    3.03       6.6  T
   7    -32.2864063 -0.836050E-07  0.961E-04    3.03      21.3  T
     SCC iter.                  ...        0 min,  0.007 sec
     gradient                   ...        0 min,  0.011 sec
 * total energy  :   -31.6807256 Eh     change       -0.6765969E-02 Eh
   gradient norm :     0.0443479 Eh/α   predicted    -0.6382227E-02 (  -5.67%)
   displ. norm   :     0.3441655 α      lambda       -0.7715937E-02
   maximum displ.:     0.1509440 α      in ANC's #2, #3, #1, ...

........................................................................
.............................. CYCLE    8 ..............................
........................................................................
   1    -32.2953117 -0.322953E+02  0.219E-01    3.05       0.0  T
   2    -32.2953525 -0.408147E-04  0.130E-01    3.05       1.0  T
   3    -32.2953447  0.786276E-05  0.405E-02    3.05       1.0  T
   4    -32.2953629 -0.182263E-04  0.195E-02    3.05       1.0  T
   5    -32.2953660 -0.310205E-05  0.364E-03    3.05       5.6  T
   6    -32.2953661 -0.147448E-06  0.157E-03    3.05      13.0  T
     SCC iter.                  ...        0 min,  0.006 sec
     gradient                   ...        0 min,  0.011 sec
 * total energy  :   -31.6832592 Eh     change       -0.2533646E-02 Eh
   gradient norm :     0.0473766 Eh/α   predicted    -0.4314954E-02 (  70.31%)
   displ. norm   :     0.3602238 α      lambda       -0.5133290E-02
   maximum displ.:     0.2014941 α      in ANC's #1, #5, #3, ...

........................................................................
.............................. CYCLE    9 ..............................
........................................................................
   1    -32.2866437 -0.322866E+02  0.227E-01    3.06       0.0  T
   2    -32.2866638 -0.200923E-04  0.133E-01    3.06       1.0  T
   3    -32.2865741  0.897080E-04  0.838E-02    3.06       1.0  T
   4    -32.2866846 -0.110502E-03  0.103E-02    3.06       2.0  T
   5    -32.2866846 -0.803084E-07  0.516E-03    3.06       4.0  T
   6    -32.2866850 -0.349473E-06  0.229E-03    3.06       8.9  T
     SCC iter.                  ...        0 min,  0.006 sec
     gradient                   ...        0 min,  0.011 sec
 * total energy  :   -31.6857155 Eh     change       -0.2456299E-02 Eh
   gradient norm :     0.0269245 Eh/α   predicted    -0.2899705E-02 (  18.05%)
   displ. norm   :     0.1966049 α      lambda       -0.2036273E-02
   maximum displ.:     0.0899146 α      in ANC's #5, #3, #4, ...

........................................................................
.............................. CYCLE   10 ..............................
........................................................................
   1    -32.2969530 -0.322970E+02  0.128E-01    3.05       0.0  T
   2    -32.2969592 -0.620447E-05  0.744E-02    3.05       1.0  T
   3    -32.2969301  0.290666E-04  0.465E-02    3.05       1.0  T
   4    -32.2969649 -0.347755E-04  0.579E-03    3.05       3.5  T
   5    -32.2969649 -0.589576E-07  0.360E-03    3.05       5.7  T
   6    -32.2969651 -0.194311E-06  0.133E-03    3.05      15.4  T
     SCC iter.                  ...        0 min,  0.006 sec
     gradient                   ...        0 min,  0.011 sec
 * total energy  :   -31.6868885 Eh     change       -0.1172936E-02 Eh
   gradient norm :     0.0166112 Eh/α   predicted    -0.1057497E-02 (  -9.84%)
   displ. norm   :     0.2978792 α      lambda       -0.1295523E-02
   maximum displ.:     0.1590604 α      in ANC's #3, #5, #2, ...

........................................................................
.............................. CYCLE   11 ..............................
........................................................................
   1    -32.2967341 -0.322967E+02  0.177E-01    3.04       0.0  T
   2    -32.2967361 -0.204154E-05  0.105E-01    3.04       1.0  T
   3    -32.2967310  0.509429E-05  0.165E-02    3.04       1.2  T
   4    -32.2967369 -0.586489E-05  0.337E-03    3.04       6.1  T
   5    -32.2967370 -0.952552E-07  0.154E-03    3.04      13.3  T
   6    -32.2967370 -0.103668E-07  0.886E-04    3.04      23.0  T
     SCC iter.                  ...        0 min,  0.006 sec
     gradient                   ...        0 min,  0.010 sec
 * total energy  :   -31.6877876 Eh     change       -0.8991377E-03 Eh
   gradient norm :     0.0076869 Eh/α   predicted    -0.7052458E-03 ( -21.56%)
   displ. norm   :     0.3307533 α      lambda       -0.8780172E-03
   maximum displ.:     0.2207182 α      in ANC's #3, #6, #4, ...

........................................................................
.............................. CYCLE   12 ..............................
........................................................................
   1    -32.2991877 -0.322992E+02  0.180E-01    3.03       0.0  T
   2    -32.2991898 -0.216458E-05  0.106E-01    3.03       1.0  T
   3    -32.2991804  0.939010E-05  0.223E-02    3.03       1.0  T
   4    -32.2991910 -0.105526E-04  0.338E-03    3.03       6.0  T
   5    -32.2991911 -0.112937E-06  0.183E-03    3.03      11.2  T
   6    -32.2991911 -0.289275E-07  0.857E-04    3.03      23.8  T
     SCC iter.                  ...        0 min,  0.006 sec
     gradient                   ...        0 min,  0.010 sec
 * total energy  :   -31.6883452 Eh     change       -0.5576508E-03 Eh
   gradient norm :     0.0109564 Eh/α   predicted    -0.4870390E-03 ( -12.66%)
   displ. norm   :     0.3957064 α      lambda       -0.7588348E-03
   maximum displ.:     0.2231677 α      in ANC's #3, #4, #6, ...

........................................................................
.............................. CYCLE   13 ..............................
........................................................................
   1    -32.2967503 -0.322968E+02  0.227E-01    3.01       0.0  T
   2    -32.2967525 -0.216791E-05  0.134E-01    3.01       1.0  T
   3    -32.2967424  0.100996E-04  0.231E-02    3.01       1.0  T
   4    -32.2967539 -0.115833E-04  0.264E-03    3.01       7.7  T
   5    -32.2967540 -0.398149E-07  0.141E-03    3.01      14.4  T
   6    -32.2967540 -0.286963E-08  0.907E-04    3.01      22.5  T
     SCC iter.                  ...        0 min,  0.006 sec
     gradient                   ...        0 min,  0.010 sec
 * total energy  :   -31.6888641 Eh     change       -0.5188820E-03 Eh
   gradient norm :     0.0152288 Eh/α   predicted    -0.4388357E-03 ( -15.43%)
   displ. norm   :     0.4283003 α      lambda       -0.8311881E-03
   maximum displ.:     0.2501988 α      in ANC's #3, #4, #6, ...

........................................................................
.............................. CYCLE   14 ..............................
........................................................................
   1    -32.2966966 -0.322967E+02  0.227E-01    2.97       0.0  T
   2    -32.2966990 -0.241673E-05  0.134E-01    2.98       1.0  T
   3    -32.2966893  0.971464E-05  0.237E-02    2.98       1.0  T
   4    -32.2967004 -0.110817E-04  0.391E-03    2.98       5.2  T
   5    -32.2967005 -0.791320E-07  0.238E-03    2.98       8.6  T
   6    -32.2967005 -0.533393E-07  0.951E-04    2.98      21.5  T
     SCC iter.                  ...        0 min,  0.006 sec
     gradient                   ...        0 min,  0.010 sec
 * total energy  :   -31.6894613 Eh     change       -0.5971985E-03 Eh
   gradient norm :     0.0126024 Eh/α   predicted    -0.4918380E-03 ( -17.64%)
   displ. norm   :     0.5185066 α      lambda       -0.1101431E-02
   maximum displ.:     0.2938098 α      in ANC's #3, #4, #6, ...

........................................................................
.............................. CYCLE   15 ..............................
........................................................................
   1    -32.2963712 -0.322964E+02  0.247E-01    2.97       0.0  T
   2    -32.2963760 -0.481643E-05  0.145E-01    2.97       1.0  T
   3    -32.2963631  0.128878E-04  0.277E-02    2.97       1.0  T
   4    -32.2963781 -0.150246E-04  0.531E-03    2.97       3.8  T
   5    -32.2963782 -0.103727E-06  0.277E-03    2.97       7.4  T
   6    -32.2963783 -0.871345E-07  0.145E-03    2.97      14.1  T
     SCC iter.                  ...        0 min,  0.006 sec
     gradient                   ...        0 min,  0.010 sec
 * total energy  :   -31.6898940 Eh     change       -0.4326452E-03 Eh
   gradient norm :     0.0161402 Eh/α   predicted    -0.6987821E-03 (  61.51%)
   displ. norm   :     0.2292083 α      lambda       -0.8164242E-03
   maximum displ.:     0.1089244 α      in ANC's #6, #4, #3, ...

........................................................................
.............................. CYCLE   16 ..............................
........................................................................
   1    -32.3000765 -0.323001E+02  0.117E-01    2.96       0.0  T
   2    -32.3000789 -0.239994E-05  0.693E-02    2.96       1.0  T
   3    -32.3000681  0.107682E-04  0.233E-02    2.96       1.0  T
   4    -32.3000805 -0.123982E-04  0.372E-03    2.96       5.5  T
   5    -32.3000806 -0.202286E-07  0.194E-03    2.96      10.5  T
   6    -32.3000806 -0.391992E-07  0.773E-04    2.96      26.4  T
     SCC iter.                  ...        0 min,  0.006 sec
     gradient                   ...        0 min,  0.010 sec
 * total energy  :   -31.6902788 Eh     change       -0.3848626E-03 Eh
   gradient norm :     0.0099108 Eh/α   predicted    -0.4296647E-03 (  11.64%)
   displ. norm   :     0.3250851 α      lambda       -0.5693252E-03
   maximum displ.:     0.2105765 α      in ANC's #3, #5, #4, ...

........................................................................
.............................. CYCLE   17 ..............................
........................................................................
   1    -32.2902056 -0.322902E+02  0.180E-01    2.93       0.0  T
   2    -32.2902081 -0.247783E-05  0.106E-01    2.94       1.0  T
   3    -32.2901806  0.275000E-04  0.394E-02    2.94       1.0  T
   4    -32.2902113 -0.307036E-04  0.340E-03    2.94       6.0  T
   5    -32.2902113 -0.180280E-07  0.178E-03    2.94      11.5  T
   6    -32.2902113 -0.104599E-07  0.119E-03    2.94      17.2  T
     SCC iter.                  ...        0 min,  0.006 sec
     gradient                   ...        0 min,  0.010 sec
 * total energy  :   -31.6902330 Eh     change        0.4587118E-04 Eh
   gradient norm :     0.0195101 Eh/α   predicted    -0.3147522E-03 (-786.17%)
   displ. norm   :     0.1058673 α      lambda       -0.7351199E-03
   maximum displ.:     0.0523709 α      in ANC's #7, #10, #3, ...

........................................................................
.............................. CYCLE   18 ..............................
........................................................................
   1    -32.2986750 -0.322987E+02  0.595E-02    2.96       0.0  T
   2    -32.2986767 -0.167178E-05  0.355E-02    2.96       1.0  T
   3    -32.2986693  0.736217E-05  0.206E-02    2.96       1.0  T
   4    -32.2986779 -0.859571E-05  0.367E-03    2.96       5.6  T
   5    -32.2986780 -0.203257E-07  0.235E-03    2.96       8.7  T
   6    -32.2986780 -0.758576E-07  0.691E-04    2.96      29.5  T
     SCC iter.                  ...        0 min,  0.006 sec
     gradient                   ...        0 min,  0.010 sec
 * total energy  :   -31.6906115 Eh     change       -0.3785888E-03 Eh
   gradient norm :     0.0097813 Eh/α   predicted    -0.3716801E-03 (  -1.82%)
   displ. norm   :     0.1847173 α      lambda       -0.4409156E-03
   maximum displ.:     0.1078155 α      in ANC's #3, #6, #9, ...

........................................................................
.............................. CYCLE   19 ..............................
........................................................................
   1    -32.3014851 -0.323015E+02  0.920E-02    2.98       0.0  T
   2    -32.3014893 -0.411862E-05  0.542E-02    2.97       1.0  T
   3    -32.3014717  0.175914E-04  0.338E-02    2.97       1.0  T
   4    -32.3014924 -0.207098E-04  0.441E-03    2.97       4.6  T
   5    -32.3014925 -0.142996E-06  0.256E-03    2.97       8.0  T
   6    -32.3014926 -0.893163E-07  0.103E-03    2.97      19.9  T
     SCC iter.                  ...        0 min,  0.006 sec
     gradient                   ...        0 min,  0.011 sec
 * total energy  :   -31.6906862 Eh     change       -0.7461566E-04 Eh
   gradient norm :     0.0153755 Eh/α   predicted    -0.2279830E-03 ( 205.54%)
   displ. norm   :     0.2014726 α      lambda       -0.3843064E-03
   maximum displ.:     0.1471483 α      in ANC's #3, #4, #5, ...

........................................................................
.............................. CYCLE   20 ..............................
........................................................................
   1    -32.2993302 -0.322993E+02  0.116E-01    2.96       0.0  T
   2    -32.2993316 -0.136319E-05  0.686E-02    2.96       1.0  T
   3    -32.2993167  0.149062E-04  0.281E-02    2.96       1.0  T
   4    -32.2993329 -0.162902E-04  0.269E-03    2.96       7.6  T
   5    -32.2993330 -0.571691E-07  0.161E-03    2.96      12.7  T
   6    -32.2993330 -0.375811E-07  0.655E-04    2.96      31.2  T
     SCC iter.                  ...        0 min,  0.006 sec
     gradient                   ...        0 min,  0.010 sec
 * total energy  :   -31.6909633 Eh     change       -0.2770935E-03 Eh
   gradient norm :     0.0071360 Eh/α   predicted    -0.1999592E-03 ( -27.84%)
   displ. norm   :     0.3340610 α      lambda       -0.5149604E-03
   maximum displ.:     0.2199768 α      in ANC's #3, #5, #2, ...
 * RMSD in coord.:     0.9607292 α      energy gain  -0.8077084E-01 Eh

generating ANC from model Hessian ...
Using Lindh-Hessian (1995)
 Shifting diagonal of input Hessian by   4.481376161154652E-003
 Lowest  eigenvalues of input Hessian
   -0.000000   -0.000000   -0.000000   -0.000000    0.000000    0.000000
    0.005000    0.005212    0.005438    0.006695    0.008596    0.009498
    0.012223    0.012696    0.018044    0.020496    0.025205    0.032614
 Highest eigenvalues
    1.591565    1.709492    1.771962    1.823735    2.053015    2.444365
 

........................................................................
.............................. CYCLE   21 ..............................
........................................................................
   1    -32.2997645 -0.322998E+02  0.183E-01    2.95       0.0  T
   2    -32.2997668 -0.229095E-05  0.108E-01    2.96       1.0  T
   3    -32.2997455  0.213478E-04  0.336E-02    2.96       1.0  T
   4    -32.2997694 -0.238931E-04  0.299E-03    2.96       6.8  T
   5    -32.2997694 -0.442692E-07  0.171E-03    2.96      12.0  T
   6    -32.2997694 -0.309256E-07  0.831E-04    2.96      24.6  T
   7    -32.2997694 -0.582568E-08  0.308E-04    2.96      66.4  T
     SCC iter.                  ...        0 min,  0.007 sec
     gradient                   ...        0 min,  0.011 sec
 * total energy  :   -31.6912027 Eh     change       -0.2394074E-03 Eh
   gradient norm :     0.0094790 Eh/α   predicted     0.0000000E+00 (-100.00%)
   displ. norm   :     0.3272633 α      lambda       -0.9203445E-03
   maximum displ.:     0.2101699 α      in ANC's #1, #3, #2, ...

........................................................................
.............................. CYCLE   22 ..............................
........................................................................
   1    -32.2964621 -0.322965E+02  0.255E-01    2.96       0.0  T
   2    -32.2964662 -0.416416E-05  0.155E-01    2.96       1.0  T
   3    -32.2964453  0.209092E-04  0.340E-02    2.96       1.0  T
   4    -32.2964691 -0.237344E-04  0.492E-03    2.96       4.1  T
   5    -32.2964691 -0.563863E-07  0.272E-03    2.96       7.5  T
   6    -32.2964692 -0.449919E-07  0.123E-03    2.96      16.6  T
     SCC iter.                  ...        0 min,  0.006 sec
     gradient                   ...        0 min,  0.010 sec
 * total energy  :   -31.6897135 Eh     change        0.1489146E-02 Eh
   gradient norm :     0.0233965 Eh/α   predicted    -0.5094609E-03 (-134.21%)
   displ. norm   :     0.2252382 α      lambda       -0.3840069E-02
   maximum displ.:     0.1564773 α      in ANC's #1, #5, #6, ...

........................................................................
.............................. CYCLE   23 ..............................
........................................................................
   1    -32.3022086 -0.323022E+02  0.236E-01    2.96       0.0  T
   2    -32.3022125 -0.391939E-05  0.144E-01    2.96       1.0  T
   3    -32.3022052  0.732527E-05  0.216E-02    2.96       1.0  T
   4    -32.3022140 -0.882736E-05  0.458E-03    2.96       4.5  T
   5    -32.3022141 -0.103149E-06  0.224E-03    2.96       9.1  T
   6    -32.3022142 -0.140027E-07  0.152E-03    2.96      13.5  T
     SCC iter.                  ...        0 min,  0.006 sec
     gradient                   ...        0 min,  0.010 sec
 * total energy  :   -31.6915348 Eh     change       -0.1821238E-02 Eh
   gradient norm :     0.0036526 Eh/α   predicted    -0.2017444E-02 (  10.77%)
   displ. norm   :     0.1847893 α      lambda       -0.3347447E-03
   maximum displ.:     0.1070125 α      in ANC's #3, #2, #5, ...

........................................................................
.............................. CYCLE   24 ..............................
........................................................................
   1    -32.3019824 -0.323020E+02  0.966E-02    2.95       0.0  T
   2    -32.3019827 -0.304098E-06  0.571E-02    2.95       1.0  T
   3    -32.3019819  0.722344E-06  0.612E-03    2.95       3.3  T
   4    -32.3019828 -0.901168E-06  0.132E-03    2.95      15.4  T
   5    -32.3019828 -0.636978E-08  0.770E-04    2.95      26.5  T
   6    -32.3019828 -0.161040E-08  0.379E-04    2.95      53.8  T
     SCC iter.                  ...        0 min,  0.006 sec
     gradient                   ...        0 min,  0.011 sec
 * total energy  :   -31.6916950 Eh     change       -0.1602104E-03 Eh
   gradient norm :     0.0036598 Eh/α   predicted    -0.1730882E-03 (   8.04%)
   displ. norm   :     0.2021095 α      lambda       -0.1957850E-03
   maximum displ.:     0.1475787 α      in ANC's #3, #5, #9, ...

........................................................................
.............................. CYCLE   25 ..............................
........................................................................
   1    -32.3007659 -0.323008E+02  0.105E-01    2.95       0.0  T
   2    -32.3007663 -0.391280E-06  0.619E-02    2.95       1.0  T
   3    -32.3007649  0.137081E-05  0.839E-03    2.95       2.4  T
   4    -32.3007666 -0.163888E-05  0.101E-03    2.95      20.1  T
   5    -32.3007666 -0.278306E-08  0.573E-04    2.95      35.6  T
   6    -32.3007666 -0.208162E-08  0.293E-04    2.95      69.8  T
     SCC iter.                  ...        0 min,  0.006 sec
     gradient                   ...        0 min,  0.011 sec
 * total energy  :   -31.6918603 Eh     change       -0.1653469E-03 Eh
   gradient norm :     0.0039642 Eh/α   predicted    -0.1018927E-03 ( -38.38%)
   displ. norm   :     0.4375475 α      lambda       -0.3659932E-03
   maximum displ.:     0.3156484 α      in ANC's #3, #5, #7, ...

........................................................................
.............................. CYCLE   26 ..............................
........................................................................
   1    -32.2979088 -0.322979E+02  0.237E-01    2.94       0.0  T
   2    -32.2979106 -0.177529E-05  0.139E-01    2.94       1.0  T
   3    -32.2979059  0.468834E-05  0.162E-02    2.94       1.3  T
   4    -32.2979117 -0.580393E-05  0.210E-03    2.94       9.7  T
   5    -32.2979117 -0.172858E-07  0.103E-03    2.94      19.9  T
   6    -32.2979117 -0.821167E-09  0.482E-04    2.94      42.4  T
   7    -32.2979117 -0.216112E-08  0.215E-04    2.94      94.9  T
     SCC iter.                  ...        0 min,  0.007 sec
     gradient                   ...        0 min,  0.011 sec
 * total energy  :   -31.6920836 Eh     change       -0.2233068E-03 Eh
   gradient norm :     0.0073402 Eh/α   predicted    -0.2180323E-03 (  -2.36%)
   displ. norm   :     0.2257126 α      lambda       -0.1996574E-03
   maximum displ.:     0.1800537 α      in ANC's #3, #5, #7, ...

........................................................................
.............................. CYCLE   27 ..............................
........................................................................
   1    -32.2993063 -0.322993E+02  0.121E-01    2.94       0.0  T
   2    -32.2993067 -0.409452E-06  0.713E-02    2.94       1.0  T
   3    -32.2993022  0.444712E-05  0.150E-02    2.94       1.4  T
   4    -32.2993071 -0.490877E-05  0.128E-03    2.94      15.9  T
   5    -32.2993071 -0.658557E-08  0.883E-04    2.94      23.1  T
   6    -32.2993071 -0.926515E-08  0.357E-04    2.94      57.2  T
     SCC iter.                  ...        0 min,  0.006 sec
     gradient                   ...        0 min,  0.010 sec
 * total energy  :   -31.6922278 Eh     change       -0.1441688E-03 Eh
   gradient norm :     0.0058060 Eh/α   predicted    -0.1049150E-03 ( -27.23%)
   displ. norm   :     0.3519331 α      lambda       -0.2481237E-03
   maximum displ.:     0.2786365 α      in ANC's #3, #5, #7, ...

........................................................................
.............................. CYCLE   28 ..............................
........................................................................
   1    -32.3008747 -0.323009E+02  0.187E-01    2.93       0.0  T
   2    -32.3008756 -0.903940E-06  0.110E-01    2.93       1.0  T
   3    -32.3008751  0.459778E-06  0.671E-03    2.93       3.0  T
   4    -32.3008760 -0.918488E-06  0.153E-03    2.93      13.4  T
   5    -32.3008761 -0.991605E-08  0.981E-04    2.93      20.8  T
     SCC iter.                  ...        0 min,  0.005 sec
     gradient                   ...        0 min,  0.011 sec
 * total energy  :   -31.6924193 Eh     change       -0.1914604E-03 Eh
   gradient norm :     0.0033611 Eh/α   predicted    -0.1394317E-03 ( -27.17%)
   displ. norm   :     0.4960650 α      lambda       -0.2397248E-03
   maximum displ.:     0.3842924 α      in ANC's #3, #5, #7, ...

........................................................................
.............................. CYCLE   29 ..............................
........................................................................
   1    -32.2991326 -0.322991E+02  0.268E-01    2.93       0.0  T
   2    -32.2991343 -0.177248E-05  0.157E-01    2.93       1.0  T
   3    -32.2991335  0.883288E-06  0.927E-03    2.93       2.2  T
   4    -32.2991353 -0.182104E-05  0.170E-03    2.93      12.0  T
   5    -32.2991353 -0.115788E-07  0.951E-04    2.93      21.5  T
   6    -32.2991353 -0.224240E-09  0.502E-04    2.93      40.7  T
     SCC iter.                  ...        0 min,  0.006 sec
     gradient                   ...        0 min,  0.012 sec
 * total energy  :   -31.6925708 Eh     change       -0.1515873E-03 Eh
   gradient norm :     0.0061020 Eh/α   predicted    -0.1493610E-03 (  -1.47%)
   displ. norm   :     0.4060395 α      lambda       -0.3446338E-03
   maximum displ.:     0.3023567 α      in ANC's #3, #7, #4, ...

........................................................................
.............................. CYCLE   30 ..............................
........................................................................
   1    -32.3048921 -0.323049E+02  0.210E-01    2.93       0.0  T
   2    -32.3048939 -0.184434E-05  0.123E-01    2.93       1.0  T
   3    -32.3048748  0.191456E-04  0.316E-02    2.93       1.0  T
   4    -32.3048957 -0.209124E-04  0.290E-03    2.93       7.0  T
   5    -32.3048958 -0.513558E-07  0.169E-03    2.93      12.1  T
   6    -32.3048958 -0.190437E-07  0.798E-04    2.93      25.6  T
     SCC iter.                  ...        0 min,  0.006 sec
     gradient                   ...        0 min,  0.010 sec
 * total energy  :   -31.6926651 Eh     change       -0.9423872E-04 Eh
   gradient norm :     0.0093546 Eh/α   predicted    -0.2007318E-03 ( 113.00%)
   displ. norm   :     0.3514836 α      lambda       -0.2235558E-03
   maximum displ.:     0.2884545 α      in ANC's #3, #5, #7, ...

........................................................................
.............................. CYCLE   31 ..............................
........................................................................
   1    -32.2987007 -0.322987E+02  0.189E-01    2.92       0.0  T
   2    -32.2987021 -0.139104E-05  0.111E-01    2.92       1.0  T
   3    -32.2986888  0.132544E-04  0.258E-02    2.92       1.0  T
   4    -32.2987035 -0.146842E-04  0.255E-03    2.92       8.0  T
   5    -32.2987035 -0.424638E-07  0.165E-03    2.92      12.4  T
   6    -32.2987036 -0.321786E-07  0.668E-04    2.92      30.5  T
     SCC iter.                  ...        0 min,  0.006 sec
     gradient                   ...        0 min,  0.010 sec
 * total energy  :   -31.6927585 Eh     change       -0.9345187E-04 Eh
   gradient norm :     0.0074406 Eh/α   predicted    -0.1255881E-03 (  34.39%)
   displ. norm   :     0.0662223 α      lambda       -0.1229964E-03
   maximum displ.:     0.0534834 α      in ANC's #3, #8, #6, ...

........................................................................
.............................. CYCLE   32 ..............................
........................................................................
   1    -32.3030161 -0.323030E+02  0.410E-02    2.93       0.0  T
   2    -32.3030169 -0.823426E-06  0.244E-02    2.93       1.0  T
   3    -32.3030137  0.323509E-05  0.180E-02    2.93       1.1  T
   4    -32.3030183 -0.461670E-05  0.245E-03    2.93       8.3  T
   5    -32.3030184 -0.808169E-07  0.134E-03    2.93      15.3  T
   6    -32.3030184 -0.216762E-07  0.486E-04    2.93      42.0  T
     SCC iter.                  ...        0 min,  0.006 sec
     gradient                   ...        0 min,  0.010 sec
 * total energy  :   -31.6927855 Eh     change       -0.2697137E-04 Eh
   gradient norm :     0.0056333 Eh/α   predicted    -0.6177021E-04 ( 129.02%)
   displ. norm   :     0.1297869 α      lambda       -0.8406815E-04
   maximum displ.:     0.1078541 α      in ANC's #3, #4, #7, ...

........................................................................
.............................. CYCLE   33 ..............................
........................................................................
   1    -32.3026186 -0.323026E+02  0.752E-02    2.92       0.0  T
   2    -32.3026191 -0.493325E-06  0.443E-02    2.93       1.0  T
   3    -32.3026147  0.441202E-05  0.149E-02    2.92       1.4  T
   4    -32.3026196 -0.483452E-05  0.189E-03    2.93      10.8  T
   5    -32.3026196 -0.416454E-07  0.110E-03    2.93      18.6  T
   6    -32.3026196 -0.158475E-07  0.404E-04    2.93      50.5  T
     SCC iter.                  ...        0 min,  0.006 sec
     gradient                   ...        0 min,  0.010 sec
 * total energy  :   -31.6928306 Eh     change       -0.4505521E-04 Eh
   gradient norm :     0.0032251 Eh/α   predicted    -0.4274408E-04 (  -5.13%)
   displ. norm   :     0.2572783 α      lambda       -0.5019326E-04
   maximum displ.:     0.2008380 α      in ANC's #3, #7, #4, ...

........................................................................
.............................. CYCLE   34 ..............................
........................................................................
   1    -32.3013764 -0.323014E+02  0.138E-01    2.92       0.0  T
   2    -32.3013769 -0.528419E-06  0.810E-02    2.92       1.0  T
   3    -32.3013757  0.125646E-05  0.840E-03    2.92       2.4  T
   4    -32.3013772 -0.158351E-05  0.114E-03    2.92      18.0  T
   5    -32.3013772 -0.116566E-08  0.743E-04    2.92      27.5  T
   6    -32.3013773 -0.546788E-08  0.361E-04    2.92      56.5  T
     SCC iter.                  ...        0 min,  0.006 sec
     gradient                   ...        0 min,  0.011 sec
 * total energy  :   -31.6928539 Eh     change       -0.2336279E-04 Eh
   gradient norm :     0.0035273 Eh/α   predicted    -0.2675863E-04 (  14.54%)
   displ. norm   :     0.0802797 α      lambda       -0.2365260E-04
   maximum displ.:     0.0650477 α      in ANC's #3, #4, #7, ...

........................................................................
.............................. CYCLE   35 ..............................
........................................................................
   1    -32.3023711 -0.323024E+02  0.433E-02    2.93       0.0  T
   2    -32.3023712 -0.744322E-07  0.254E-02    2.93       1.0  T
   3    -32.3023701  0.102140E-05  0.713E-03    2.93       2.9  T
   4    -32.3023713 -0.111200E-05  0.851E-04    2.93      24.0  T
   5    -32.3023713 -0.980995E-08  0.429E-04    2.93      47.6  T
   6    -32.3023713 -0.159919E-08  0.159E-04    2.93     128.1  T
     SCC iter.                  ...        0 min,  0.006 sec
     gradient                   ...        0 min,  0.011 sec
 * total energy  :   -31.6928683 Eh     change       -0.1442800E-04 Eh
   gradient norm :     0.0024780 Eh/α   predicted    -0.1190293E-04 ( -17.50%)
   displ. norm   :     0.1604632 α      lambda       -0.2805709E-04
   maximum displ.:     0.1167126 α      in ANC's #3, #7, #4, ...

........................................................................
.............................. CYCLE   36 ..............................
........................................................................
   1    -32.3030142 -0.323030E+02  0.956E-02    2.92       0.0  T
   2    -32.3030146 -0.388379E-06  0.564E-02    2.92       1.0  T
   3    -32.3030106  0.393894E-05  0.133E-02    2.92       1.5  T
   4    -32.3030150 -0.442285E-05  0.998E-04    2.92      20.5  T
   5    -32.3030151 -0.716562E-08  0.615E-04    2.92      33.2  T
   6    -32.3030151 -0.398153E-08  0.162E-04    2.92     125.8  T
     SCC iter.                  ...        0 min,  0.006 sec
     gradient                   ...        0 min,  0.011 sec
 * total energy  :   -31.6928734 Eh     change       -0.5093865E-05 Eh
   gradient norm :     0.0030514 Eh/α   predicted    -0.1439233E-04 ( 182.54%)
   displ. norm   :     0.0156147 α      lambda       -0.1276952E-04
   maximum displ.:     0.0093809 α      in ANC's #3, #5, #1, ...

........................................................................
.............................. CYCLE   37 ..............................
........................................................................
   1    -32.3033905 -0.323034E+02  0.123E-02    2.93       0.0  T
   2    -32.3033906 -0.551675E-07  0.746E-03    2.93       2.7  T
   3    -32.3033903  0.281279E-06  0.448E-03    2.93       4.6  T
   4    -32.3033907 -0.367609E-06  0.391E-04    2.93      52.2  T
   5    -32.3033907 -0.596131E-09  0.278E-04    2.93      73.5  T
     SCC iter.                  ...        0 min,  0.005 sec
     gradient                   ...        0 min,  0.011 sec
 * total energy  :   -31.6928800 Eh     change       -0.6528363E-05 Eh
   gradient norm :     0.0006200 Eh/α   predicted    -0.6388802E-05 (  -2.14%)
   displ. norm   :     0.0940104 α      lambda       -0.3285457E-05
   maximum displ.:     0.0770163 α      in ANC's #3, #5, #7, ...

........................................................................
.............................. CYCLE   38 ..............................
........................................................................
   1    -32.3017064 -0.323017E+02  0.513E-02    2.93       0.0  T
   2    -32.3017065 -0.100793E-06  0.301E-02    2.93       1.0  T
   3    -32.3017054  0.111336E-05  0.752E-03    2.93       2.7  T
   4    -32.3017066 -0.124310E-05  0.606E-04    2.93      33.7  T
   5    -32.3017066 -0.229966E-08  0.432E-04    2.93      47.3  T
   6    -32.3017066 -0.175768E-08  0.164E-04    2.93     124.7  T
     SCC iter.                  ...        0 min,  0.006 sec
     gradient                   ...        0 min,  0.011 sec
 * total energy  :   -31.6928760 Eh     change        0.3974962E-05 Eh
   gradient norm :     0.0022738 Eh/α   predicted    -0.1651905E-05 (-141.56%)
   displ. norm   :     0.0626958 α      lambda        0.3000500E-04
   maximum displ.:     0.0513355 α      in ANC's #3, #5, #7, ...

........................................................................
.............................. CYCLE   39 ..............................
........................................................................
   1    -32.3004878 -0.323005E+02  0.342E-02    2.93       0.0  T
   2    -32.3004878 -0.473134E-07  0.201E-02    2.93       1.0  T
   3    -32.3004873  0.546485E-06  0.526E-03    2.92       3.9  T
   4    -32.3004879 -0.608895E-06  0.428E-04    2.92      47.7  T
   5    -32.3004879 -0.134739E-08  0.301E-04    2.93      67.8  T
     SCC iter.                  ...        0 min,  0.005 sec
     gradient                   ...        0 min,  0.011 sec
 * total energy  :   -31.6928625 Eh     change        0.1350437E-04 Eh
   gradient norm :     0.0040878 Eh/α   predicted     0.1505972E-04 (  11.52%)
   displ. norm   :     0.0627277 α      lambda        0.4570937E-04
   maximum displ.:     0.0513201 α      in ANC's #3, #5, #7, ...

........................................................................
.............................. CYCLE   40 ..............................
........................................................................
   1    -32.2991927 -0.322992E+02  0.342E-02    2.92       0.0  T
   2    -32.2991928 -0.482866E-07  0.201E-02    2.92       1.0  T
   3    -32.2991922  0.576963E-06  0.545E-03    2.92       3.7  T
   4    -32.2991928 -0.643338E-06  0.401E-04    2.92      51.0  T
   5    -32.2991928 -0.902986E-09  0.285E-04    2.92      71.6  T
     SCC iter.                  ...        0 min,  0.005 sec
     gradient                   ...        0 min,  0.010 sec
 * total energy  :   -31.6928391 Eh     change        0.2334993E-04 Eh
   gradient norm :     0.0059809 Eh/α   predicted     0.2294094E-04 (  -1.75%)
   displ. norm   :     0.1008622 α      lambda       -0.8163395E-04
   maximum displ.:     0.0837437 α      in ANC's #3, #5, #6, ...

........................................................................
.............................. CYCLE   41 ..............................
........................................................................
   1    -32.3028085 -0.323028E+02  0.542E-02    2.93       0.0  T
   2    -32.3028088 -0.301965E-06  0.319E-02    2.93       1.0  T
   3    -32.3028049  0.388215E-05  0.146E-02    2.93       1.4  T
   4    -32.3028093 -0.439649E-05  0.114E-03    2.93      17.8  T
   5    -32.3028093 -0.118320E-07  0.776E-04    2.93      26.3  T
   6    -32.3028093 -0.618463E-08  0.286E-04    2.93      71.4  T
     SCC iter.                  ...        0 min,  0.006 sec
     gradient                   ...        0 min,  0.010 sec
 * total energy  :   -31.6928809 Eh     change       -0.4174860E-04 Eh
   gradient norm :     0.0007033 Eh/α   predicted    -0.4123598E-04 (  -1.23%)
   displ. norm   :     0.0860882 α      lambda       -0.3100031E-05
   maximum displ.:     0.0687664 α      in ANC's #3, #7, #4, ...

........................................................................
.............................. CYCLE   42 ..............................
........................................................................
   1    -32.3035182 -0.323035E+02  0.469E-02    2.93       0.0  T
   2    -32.3035182 -0.580211E-07  0.275E-02    2.93       1.0  T
   3    -32.3035181  0.951065E-07  0.245E-03    2.93       8.3  T
   4    -32.3035182 -0.127536E-06  0.433E-04    2.93      47.1  T
   5    -32.3035183 -0.304723E-09  0.269E-04    2.93      75.9  T
     SCC iter.                  ...        0 min,  0.005 sec
     gradient                   ...        0 min,  0.011 sec
 * total energy  :   -31.6928817 Eh     change       -0.7847457E-06 Eh
   gradient norm :     0.0008019 Eh/α   predicted    -0.1558947E-05 (  98.66%)
   displ. norm   :     0.0115328 α      lambda       -0.1580125E-05
   maximum displ.:     0.0071254 α      in ANC's #5, #3, #11, ...

   *** GEOMETRY OPTIMIZATION CONVERGED AFTER 42 ITERATIONS ***

------------------------------------------------------------------------
 total energy gain   :        -0.0826893 Eh      -51.8883 kcal/mol
 total RMSD          :         1.4705876 a0        0.7782 Å
 total power (kW/mol):        -5.1690624 (step) -205.4797 (real)
------------------------------------------------------------------------

 ANCopt (total)                0 d,  0 h,  0 min,  1.057 sec
 optimizer setup                ...        0 min,  0.000 sec (  0.015%)
 model hessian                  ...        0 min,  0.012 sec (  1.158%)
 ANC generation                 ...        0 min,  0.001 sec (  0.133%)
 coordinate transformation      ...        0 min,  0.001 sec (  0.078%)
 single point calculation       ...        0 min,  1.016 sec ( 96.188%)
 optimization log               ...        0 min,  0.004 sec (  0.391%)
 hessian update                 ...        0 min,  0.001 sec (  0.054%)
 rational function              ...        0 min,  0.018 sec (  1.739%)

================
 final structure:
================
$coord
    3.39071263955445   -2.75249846910176    3.81339468197000      C 
    4.51485261919119   -1.47189985530626    2.05470337022618      C 
    5.63965496927804   -0.18704765339421    0.29810759735127      C 
    6.42928605411233   -1.24868130233580   -2.25960935233172      C 
    7.60368878716820    1.00614042735799   -3.46203700859376      C 
    7.57090311871516    3.07334145491226   -1.99114835100696      C 
    6.35680677124853    2.59592551573381    0.50949252419829      C 
    8.74370754799349    5.17764973442999   -3.32179802541197      C 
    9.47312516435429    4.30487071048274   -5.61767683331958      C 
    8.82305735539284    1.56659021382715   -5.93312564435226      C 
    9.09622905237783    7.73835562384998   -2.43540076279805      C 
    8.43289060940365    8.62184920004085   -0.18169276853374      C 
    1.35802903487069   -2.87127832584554    3.92763549865797      H 
    4.43407849686726   -3.76112045954811    5.24646455627494      H 
    4.79699048960256   -1.95402234195820   -3.31680712365875      H 
    7.75506245066320   -2.82212610900342   -2.04633851019643      H 
    4.68321217096807    3.77040846294214    0.81275407586958      H 
    7.64990769249552    2.90684864664110    2.09127337984397      H 
   10.40311250513075    5.38118529672110   -7.06899283310296      H 
   10.50576517609261    0.41770214601069   -6.26593431109473      H 
    7.55314152580803    1.26364389841177   -7.53230754006441      H 
    9.98896904368969    8.98745989441032   -3.78890635233055      H 
    7.54199795764523    7.45349768201883    1.22339827663073      H 
    8.76449399416212   10.56180997503573    0.33691011079208      H 
$end
           -------------------------------------------------
          |                Final Singlepoint                |
           -------------------------------------------------

          ...................................................
          :                      SETUP                      :
          :.................................................:
          :  # basis functions                  60          :
          :  # atomic orbitals                  60          :
          :  # shells                           36          :
          :  # electrons                        60          :
          :  max. iterations                   250          :
          :  Hamiltonian                  GFN2-xTB          :
          :  restarted?                      false          :
          :  GBSA solvation                  false          :
          :  PC potential                    false          :
          :  electronic temp.          300.0000000     K    :
          :  accuracy                    1.0000000          :
          :  -> integral cutoff          0.2500000E+02      :
          :  -> integral neglect         0.1000000E-07      :
          :  -> SCF convergence          0.1000000E-05 Eh   :
          :  -> wf. convergence          0.1000000E-03 e    :
          :  Broyden damping             0.4000000          :
          ...................................................

 iter      E             dE          RMSdq      gap      omega  full diag
   1    -32.3035183 -0.323035E+02  0.154E-04    2.93       0.0  T
   2    -32.3035183  0.443947E-10  0.921E-05    2.93     221.5  T
   3    -32.3035183 -0.202753E-09  0.696E-05    2.93     293.1  T

   *** convergence criteria satisfied after 3 iterations ***

         #    Occupation            Energy/Eh            Energy/eV
      -------------------------------------------------------------
         1        2.0000           -0.6474642             -17.6184
       ...           ...                  ...                  ...
        24        2.0000           -0.4350022             -11.8370
        25        2.0000           -0.4335015             -11.7962
        26        2.0000           -0.4164170             -11.3313
        27        2.0000           -0.3936200             -10.7109
        28        2.0000           -0.3907886             -10.6339
        29        2.0000           -0.3735736             -10.1655
        30        2.0000           -0.3530050              -9.6058 (HOMO)
        31                         -0.2454612              -6.6793 (LUMO)
        32                         -0.1954673              -5.3189
        33                         -0.1914817              -5.2105
        34                         -0.1788260              -4.8661
        35                         -0.1019387              -2.7739
       ...                                ...                  ...
        60                          1.1077763              30.1441
      -------------------------------------------------------------
                  HL-Gap            0.1075437 Eh            2.9264 eV
             Fermi-level           -0.2992331 Eh           -8.1425 eV

 SCC (total)                   0 d,  0 h,  0 min,  0.023 sec
 SCC setup                      ...        0 min,  0.000 sec (  0.851%)
 Dispersion                     ...        0 min,  0.000 sec (  0.897%)
 integral evaluation            ...        0 min,  0.007 sec ( 31.158%)
 zeroth order Hamiltonian       ...        0 min,  0.000 sec (  0.587%)
 iterations                     ...        0 min,  0.004 sec ( 15.625%)
 molecular gradient             ...        0 min,  0.011 sec ( 49.020%)
 printout                       ...        0 min,  0.000 sec (  1.581%)

         :::::::::::::::::::::::::::::::::::::::::::::::::::::
         ::                     SUMMARY                     ::
         :::::::::::::::::::::::::::::::::::::::::::::::::::::
         :: total energy             -31.692881666696 Eh    ::
         :: gradient norm              0.000801143315 Eh/a0 ::
         :: HOMO-LUMO gap              2.926413481803 eV    ::
         ::.................................................::
         :: SCC energy               -32.303518251082 Eh    ::
         :: -> isotropic ES            0.004238966275 Eh    ::
         :: -> anisotropic ES          0.004834476547 Eh    ::
         :: -> anisotropic XC          0.022526407258 Eh    ::
         :: -> dispersion             -0.021022760337 Eh    ::
         :: repulsion energy           0.610613106427 Eh    ::
         :: add. restraining           0.000000000000 Eh    ::
         :::::::::::::::::::::::::::::::::::::::::::::::::::::

           -------------------------------------------------
          |                Property Printout                |
           -------------------------------------------------

    * Orbital Energies and Occupations

         #    Occupation            Energy/Eh            Energy/eV
      -------------------------------------------------------------
         1        2.0000           -0.6474642             -17.6184
       ...           ...                  ...                  ...
        18        2.0000           -0.4764884             -12.9659
        19        2.0000           -0.4705958             -12.8056
        20        2.0000           -0.4678510             -12.7309
        21        2.0000           -0.4516888             -12.2911
        22        2.0000           -0.4423860             -12.0379
        23        2.0000           -0.4409813             -11.9997
        24        2.0000           -0.4350022             -11.8370
        25        2.0000           -0.4335015             -11.7962
        26        2.0000           -0.4164170             -11.3313
        27        2.0000           -0.3936200             -10.7109
        28        2.0000           -0.3907886             -10.6339
        29        2.0000           -0.3735736             -10.1655
        30        2.0000           -0.3530050              -9.6058 (HOMO)
        31                         -0.2454612              -6.6793 (LUMO)
        32                         -0.1954673              -5.3189
        33                         -0.1914817              -5.2105
        34                         -0.1788260              -4.8661
        35                         -0.1019387              -2.7739
        36                          0.0629682               1.7135
        37                          0.0698302               1.9002
        38                          0.0893793               2.4321
        39                          0.1124721               3.0605
        40                          0.1461831               3.9778
        41                          0.1481000               4.0300
       ...                                ...                  ...
        60                          1.1077763              30.1441
      -------------------------------------------------------------
                  HL-Gap            0.1075437 Eh            2.9264 eV
             Fermi-level           -0.2992331 Eh           -8.1425 eV

     #   Z        covCN         q      C6AA      α(0)
     1   6 C      2.833    -0.097    30.423     9.039
     2   6 C      1.969    -0.035    32.013     9.137
     3   6 C      3.004    -0.003    28.087     8.693
     4   6 C      3.833    -0.054    21.515     6.599
     5   6 C      3.114    -0.017    28.268     8.710
     6   6 C      3.115    -0.015    28.226     8.703
     7   6 C      3.836    -0.051    21.455     6.590
     8   6 C      3.034    -0.000    28.005     8.680
     9   6 C      3.019    -0.056    29.361     8.888
    10   6 C      3.871    -0.062    21.652     6.617
    11   6 C      2.891    -0.028    28.694     8.782
    12   6 C      2.839    -0.089    30.216     9.008
    13   1 H      0.926     0.046     2.370     2.407
    14   1 H      0.926     0.046     2.370     2.407
    15   1 H      0.924     0.042     2.422     2.434
    16   1 H      0.924     0.042     2.423     2.434
    17   1 H      0.924     0.043     2.413     2.429
    18   1 H      0.924     0.043     2.416     2.431
    19   1 H      0.926     0.025     2.654     2.547
    20   1 H      0.924     0.060     2.202     2.321
    21   1 H      0.924     0.060     2.203     2.321
    22   1 H      0.925     0.029     2.606     2.525
    23   1 H      0.926     0.042     2.422     2.434
    24   1 H      0.926     0.030     2.581     2.512

 Mol. C6AA /au·bohr⁶  :       6590.876292
 Mol. C8AA /au·bohr⁸  :     160907.365447
 Mol. α(0) /au        :        128.648869


Wiberg/Mayer (AO) data.
largest (>0.10) Wiberg bond orders for each atom
          total WBO             WBO to atom ...
     1  C   3.984        C    2 1.976    H   13 0.949    H   14 0.949
     2  C   3.978        C    1 1.976    C    3 1.911
     3  C   3.979        C    2 1.911    C    4 0.969    C    7 0.969
     4  C   3.998        C    5 1.023    C    3 0.969    H   16 0.954    H   15 0.953
     5  C   3.981        C    6 1.729    C   10 1.028    C    4 1.023    C    9 0.104
     6  C   3.982        C    5 1.729    C    8 1.093    C    7 1.017
     7  C   3.999        C    6 1.017    C    3 0.969    H   17 0.955    H   18 0.955
     8  C   3.985        C    9 1.687    C   11 1.107    C    6 1.093
     9  C   3.985        C    8 1.687    C   10 1.038    H   19 0.972    C   12 0.125    C    5 0.104
    10  C   3.997        C    9 1.038    C    5 1.028    H   21 0.935    H   20 0.935
    11  C   3.992        C   12 1.889    C    8 1.107    H   22 0.964
    12  C   3.983        C   11 1.889    H   24 0.979    H   23 0.974    C    9 0.125
    13  H   0.998        C    1 0.949
    14  H   0.998        C    1 0.949
    15  H   0.998        C    4 0.953
    16  H   0.998        C    4 0.954
    17  H   0.998        C    7 0.955
    18  H   0.998        C    7 0.955
    19  H   0.999        C    9 0.972
    20  H   0.992        C   10 0.935
    21  H   0.992        C   10 0.935
    22  H   0.998        C   11 0.964
    23  H   0.998        C   12 0.974
    24  H   0.998        C   12 0.979

molecular dipole:
                 x           y           z       tot (Debye)
 q only:        0.029      -0.223      -0.218
   full:        0.037      -0.265      -0.266       0.960
molecular quadrupole (traceless):
                xx          xy          yy          xz          yz          zz
 q only:       -0.624      -2.819      -2.354      -3.394       1.443       2.978
  q+dip:       -2.642      -1.837      -2.551      -6.539       0.595       5.193
   full:       -1.111      -2.864      -2.821      -4.787       1.112       3.932

           -------------------------------------------------
          |                Geometry Summary                 |
           -------------------------------------------------

      molecular mass/u    :      156.2268000
   center of mass at/Å    :        3.7935551       1.2565755      -0.8096701
  moments of inertia/u·Å² :        0.2932579E+03   0.8095864E+03   0.1090040E+04
rotational constants/cm⁻¹ :        0.5748398E-01   0.2082252E-01   0.1546516E-01

 * 20 selected distances

     #   Z        #   Z                                     value/Å
     1   6 C      2   6 C                                 1.2958490
     2   6 C      3   6 C                                 1.2963929
     4   6 C      5   6 C                                 1.4882281
     5   6 C      6   6 C                                 1.3426832
     6   6 C      7   6 C                                 1.4925389 (max)
     8   6 C      9   6 C                                 1.3558563
     5   6 C     10   6 C                                 1.4880369
    11   6 C     12   6 C                                 1.3282010
     1   6 C     13   1 H                                 1.0791794
     1   6 C     14   1 H                                 1.0792648
     4   6 C     15   1 H                                 1.0947144
     4   6 C     16   1 H                                 1.0946292
     7   6 C     17   1 H                                 1.0937848
     7   6 C     18   1 H                                 1.0935949
     9   6 C     19   1 H                                 1.0753694 (min)
    10   6 C     20   1 H                                 1.0924930
    10   6 C     21   1 H                                 1.0924461
    11   6 C     22   1 H                                 1.0830985
    12   6 C     23   1 H                                 1.0758078
    12   6 C     24   1 H                                 1.0770230

 * 2 distinct bonds (by element types)

   Z      Z             #   av. dist./Å        max./Å        min./Å
   1 H    6 C          12     1.0859504     1.0947144     1.0753694
   6 C    6 C           8     1.3859733     1.4925389     1.2958490


optimized geometry written to: xtbopt.xyz


           -------------------------------------------------
          | TOTAL ENERGY              -31.692881666696 Eh   |
          | GRADIENT NORM               0.000801143315 Eh/α |
          | HOMO-LUMO GAP               2.926413481803 eV   |
           -------------------------------------------------

------------------------------------------------------------------------
 * finished run on 2021/05/19 at 11:01:02.718     
------------------------------------------------------------------------
 total:
 * wall-time:     0 d,  0 h,  0 min,  1.133 sec
 *  cpu-time:     0 d,  0 h,  0 min,  1.132 sec
 * ratio c/w:     0.999 speedup
 SCF:
 * wall-time:     0 d,  0 h,  0 min,  0.033 sec
 *  cpu-time:     0 d,  0 h,  0 min,  0.033 sec
 * ratio c/w:     1.000 speedup
 ANC optimizer:
 * wall-time:     0 d,  0 h,  0 min,  1.080 sec
 *  cpu-time:     0 d,  0 h,  0 min,  1.080 sec
 * ratio c/w:     1.000 speedup

