      -----------------------------------------------------------      
     |                   =====================                   |     
     |                           x T B                           |     
     |                   =====================                   |     
     |                         S. Grimme                         |     
     |          Mulliken Center for Theoretical Chemistry        |     
     |                    University of Bonn                     |     
     |                Version 6.2 RC2 (SAW190805)                |     
      -----------------------------------------------------------      

   This program is distributed in the hope that it will be useful,
   but WITHOUT ANY WARRANTY; without even the implied warranty of
   MERCHANTABILITY or FITNESS FOR A PARTICULAR PURPOSE.
   
   FOR NON-COMMERCIAL, ACADEMIA USE ONLY.
   
   Cite this work as:
   * S. Grimme, C. Bannwarth, P. Shushkov, J. Chem. Theory Comput., 2017,
     13, 1989-2009. DOI: 10.1021/acs.jctc.7b00118
   * C. Bannwarth, S. Ehlert and S. Grimme., J. Chem. Theory Comput., 2019,
     15, 1652-1671. DOI: 10.1021/acs.jctc.8b01176
   * P. Pracht, E. Caldeweyher, S. Ehlert, S. Grimme, ChemRxiv, 2019, preprint.
     DOI: 10.26434/chemrxiv.8326202.v1
   
   for DFT-D4:
   * E. Caldeweyher, C. Bannwarth and S. Grimme, J. Chem. Phys., 2017,
     147, 034112. DOI: 10.1063/1.4993215
   * E. Caldeweyher, S. Ehlert, A. Hansen, H. Neugebauer, S. Spicher,
     C. Bannwarth and S. Grimme, J. Chem. Phys., 2019, 150, 154122.
     DOI: 10.1063/1.5090222
   
   for sTDA-xTB:
   * S. Grimme and C. Bannwarth, J. Chem. Phys., 2016, 145, 054103.
     DOI: 10.1063/1.4959605
   
   in the mass-spec context:
   * V. Asgeirsson, C. Bauer and S. Grimme, Chem. Sci., 2017, 8, 4879.
     DOI: 10.1039/c7sc00601b
   
   for metadynamics refer to:
   * S. Grimme, J. Chem. Theory Comput., 2019, 155, 2847-2862
     DOI: 10.1021/acs.jctc.9b00143
   
   with help from (in alphabetical order)
   C. Bannwarth, F. Bohle, G. Brandenburg, E. Caldeweyher, M. Checinski,
   S. Dohm, S. Ehlert, S. Ehrlich, F. März, H. Neugebauer, J. Pisarek,
   P. Pracht, P. Shushkov, and S. Spicher.
   
 * started run on 2021/05/19 at 11:01:04.018     

           -------------------------------------------------
          |                Calculation Setup                |
           -------------------------------------------------

          program call               : /ihome/ghutchison/geoffh/xtb/xtb 795.xyz -opt
          hostname                   : smp-n83
          coordinate file            : 795.xyz
          omp threads                :                     1
          number of atoms            :                    31
          number of electrons        :                    82
          charge                     :                     0
          spin                       :                   0.0
          first test random number   :      0.95644671809765


########################################################################
# WARNING! Please study the warnings concerning your input carefully
#  - the use of '-opt' is discouraged, please use '--opt' next time
########################################################################

           ------------------------------------------------- 
          |                 G F N 2 - x T B                 |
          | Geometry, Frequencies, Noncovalent interactions |
          |            JCTC 2019 parametrisation            |
           ------------------------------------------------- 
             KAB for C  - Si     :                1.0500
             KAB for H  - Pd     :                0.9500
             k(s)              :                1.8500
             k(p)              :                2.2300
             k(d)              :                2.2300
             k(f)              :                2.0000
             kEN (H0ij)        :               -2.0000
             D4 a1             :                0.5200
             D4 a2             :                5.0000
             D4 s6             :                1.0000
             D4 s8             :                2.7000
             D4 s9             :                5.0000
             alphaj            :                2.0000

  Z AO/shell   Hii/eV     exponent
  1     Wed Apr 25 08:07:45 CEST 2018   EN: 2.200 GM2: 0.406  GM3: 0.0800  RAES: 1.40
     1s    -10.707211    1.230000
  6     Wed Apr 25 08:07:45 CEST 2018   EN: 2.550 GM2: 0.538  GM3: 0.1500  RAES: 3.00
     2s    -13.970922    2.096432
     2p    -10.063292    1.800000
  8     Wed Apr 25 08:07:45 CEST 2018   EN: 3.440 GM2: 0.452  GM3:-0.0517  RAES: 1.80
     2s    -20.229985    2.439742
     2p    -15.503117    2.137023
 16     Tue Apr 24 11:44:34 CEST 2018   EN: 2.580 GM2: 0.340  GM3:-0.0502  RAES: 3.10
     3s    -20.029654    1.981333
     3p    -11.377694    2.025643
     3d     -0.420282    1.702555

           ------------------------------------------------- 
          |        Self-Consistent Charge Iterations        |
           ------------------------------------------------- 

          ...................................................
          :                      SETUP                      :
          :.................................................:
          :  # basis functions                  82          :
          :  # atomic orbitals                  81          :
          :  # shells                           47          :
          :  # electrons                        82          :
          :  max. iterations                   250          :
          :  Hamiltonian                  GFN2-xTB          :
          :  restarted?                      false          :
          :  GBSA solvation                  false          :
          :  PC potential                    false          :
          :  electronic temp.          300.0000000     K    :
          :  accuracy                    1.0000000          :
          :  -> integral cutoff          0.2500000E+02      :
          :  -> integral neglect         0.1000000E-07      :
          :  -> SCF convergence          0.1000000E-05 Eh   :
          :  -> wf. convergence          0.1000000E-03 e    :
          :  Broyden damping             0.4000000          :
          ...................................................

 iter      E             dE          RMSdq      gap      omega  full diag
   1    -45.7037403 -0.457037E+02  0.426E+00    2.49       0.0  T
   2    -45.7583584 -0.546181E-01  0.232E+00    2.49       1.0  T
   3    -45.7565869  0.177144E-02  0.857E-01    2.49       1.0  T
   4    -45.7575467 -0.959766E-03  0.454E-01    2.49       1.0  T
   5    -45.7616494 -0.410266E-02  0.129E-01    2.49       1.0  T
   6    -45.7616918 -0.424629E-04  0.720E-02    2.49       1.0  T
   7    -45.7617622 -0.703436E-04  0.302E-02    2.49       1.0  T
   8    -45.7617759 -0.137725E-04  0.146E-02    2.49       1.2  T
   9    -45.7617772 -0.123115E-05  0.680E-03    2.49       2.6  T
  10    -45.7617776 -0.446002E-06  0.246E-03    2.49       7.3  T
  11    -45.7617777 -0.114370E-06  0.115E-03    2.49      15.7  T
  12    -45.7617777 -0.121321E-07  0.547E-04    2.49      32.8  T
  13    -45.7617777 -0.467850E-09  0.208E-04    2.49      86.2  T

   *** convergence criteria satisfied after 13 iterations ***

         #    Occupation            Energy/Eh            Energy/eV
      -------------------------------------------------------------
         1        2.0000           -0.7287639             -19.8307
       ...           ...                  ...                  ...
        35        2.0000           -0.4391837             -11.9508
        36        2.0000           -0.4364397             -11.8761
        37        2.0000           -0.4248159             -11.5598
        38        2.0000           -0.4191617             -11.4060
        39        2.0000           -0.3994645             -10.8700
        40        2.0000           -0.3687329             -10.0337
        41        2.0000           -0.3561184              -9.6905 (HOMO)
        42                         -0.2646592              -7.2017 (LUMO)
        43                         -0.2157244              -5.8702
        44                         -0.2010506              -5.4709
        45                         -0.1652615              -4.4970
        46                         -0.1288159              -3.5053
       ...                                ...                  ...
        81                          0.6847081              18.6319
      -------------------------------------------------------------
                  HL-Gap            0.0914592 Eh            2.4887 eV
             Fermi-level           -0.3103888 Eh           -8.4461 eV

 SCC (total)                   0 d,  0 h,  0 min,  0.053 sec
 SCC setup                      ...        0 min,  0.000 sec (  0.680%)
 Dispersion                     ...        0 min,  0.000 sec (  0.889%)
 integral evaluation            ...        0 min,  0.013 sec ( 23.865%)
 zeroth order Hamiltonian       ...        0 min,  0.000 sec (  0.445%)
 iterations                     ...        0 min,  0.021 sec ( 39.266%)
 molecular gradient             ...        0 min,  0.018 sec ( 33.972%)
 printout                       ...        0 min,  0.000 sec (  0.788%)

         :::::::::::::::::::::::::::::::::::::::::::::::::::::
         ::                     SUMMARY                     ::
         :::::::::::::::::::::::::::::::::::::::::::::::::::::
         :: total energy             -45.165331897065 Eh    ::
         :: gradient norm              0.045074196949 Eh/a0 ::
         :: HOMO-LUMO gap              2.488732435473 eV    ::
         ::.................................................::
         :: SCC energy               -45.761777740362 Eh    ::
         :: -> isotropic ES            0.032405543102 Eh    ::
         :: -> anisotropic ES          0.003704143614 Eh    ::
         :: -> anisotropic XC          0.018255043986 Eh    ::
         :: -> dispersion             -0.027515726825 Eh    ::
         :: repulsion energy           0.596339345824 Eh    ::
         :: add. restraining           0.000000000000 Eh    ::
         :::::::::::::::::::::::::::::::::::::::::::::::::::::

      ----------------------------------------------------------- 
     |                   =====================                   |
     |                        A N C O P T                        |
     |                   =====================                   |
     |               Approximate Normal Coordinate               |
     |                Rational Function Optimizer                |
      ----------------------------------------------------------- 

          ...................................................
          :                      SETUP                      :
          :.................................................:
          :   optimization level            normal          :
          :   max. optcycles                   200          :
          :   ANC micro-cycles                  20          :
          :   degrees of freedom                87          :
          :.................................................:
          :   RF solver                   davidson          :
          :   input Hessian                  false          :
          :   write xtbopt.log                true          :
          :   linear?                        false          :
          :   energy convergence         0.5000000E-05 Eh   :
          :   grad. convergence          0.1000000E-02 Eh/α :
          :   maximium RF displ.         2.0000000          :
          :   Hlow (freq-cutoff)         0.5000000E-02      :
          :   Hmax (freq-cutoff)         5.0000000          :
          :   S6 in model hess.         20.0000000          :
          ...................................................

generating ANC from model Hessian ...
Using Lindh-Hessian (1995)
 Shifting diagonal of input Hessian by   4.636953734274255E-003
 Lowest  eigenvalues of input Hessian
   -0.000000   -0.000000   -0.000000    0.000000    0.000000    0.000000
    0.005000    0.005539    0.005945    0.006354    0.006735    0.006902
    0.008074    0.009372    0.009714    0.012711    0.014099    0.015863
 Highest eigenvalues
    1.642013    1.778027    1.864953    1.953030    2.041533    2.067358
 

........................................................................
.............................. CYCLE    1 ..............................
........................................................................
   1    -45.7617777 -0.457618E+02  0.945E-05    2.49       0.0  T
   2    -45.7617777 -0.339497E-10  0.719E-05    2.49     250.0  T
   3    -45.7617777 -0.708269E-10  0.409E-05    2.49     439.5  T
     SCC iter.                  ...        0 min,  0.005 sec
     gradient                   ...        0 min,  0.018 sec
 * total energy  :   -45.1653319 Eh     change       -0.1473995E-07 Eh
   gradient norm :     0.0450739 Eh/α   predicted     0.0000000E+00 (-100.00%)
   displ. norm   :     0.2465140 α      lambda       -0.5844921E-02
   maximum displ.:     0.0756955 α      in ANC's #10, #9, #4, ...

........................................................................
.............................. CYCLE    2 ..............................
........................................................................
   1    -45.7781047 -0.457781E+02  0.207E-01    2.49       0.0  T
   2    -45.7781240 -0.193050E-04  0.118E-01    2.49       1.0  T
   3    -45.7780930  0.309246E-04  0.418E-02    2.49       1.0  T
   4    -45.7781281 -0.350943E-04  0.188E-02    2.49       1.0  T
   5    -45.7781315 -0.333383E-05  0.686E-03    2.49       2.6  T
   6    -45.7781323 -0.785938E-06  0.257E-03    2.49       7.0  T
   7    -45.7781324 -0.107528E-06  0.123E-03    2.49      14.6  T
     SCC iter.                  ...        0 min,  0.010 sec
     gradient                   ...        0 min,  0.017 sec
 * total energy  :   -45.1692396 Eh     change       -0.3907735E-02 Eh
   gradient norm :     0.0169120 Eh/α   predicted    -0.3100066E-02 ( -20.67%)
   displ. norm   :     0.2623140 α      lambda       -0.1711199E-02
   maximum displ.:     0.1283975 α      in ANC's #9, #10, #11, ...

........................................................................
.............................. CYCLE    3 ..............................
........................................................................
   1    -45.7843860 -0.457844E+02  0.171E-01    2.48       0.0  T
   2    -45.7843951 -0.904101E-05  0.101E-01    2.48       1.0  T
   3    -45.7843673  0.277482E-04  0.361E-02    2.48       1.0  T
   4    -45.7844001 -0.327764E-04  0.114E-02    2.48       1.6  T
   5    -45.7844008 -0.740227E-06  0.550E-03    2.48       3.3  T
   6    -45.7844014 -0.601956E-06  0.193E-03    2.48       9.3  T
   7    -45.7844015 -0.509387E-07  0.958E-04    2.48      18.8  T
     SCC iter.                  ...        0 min,  0.010 sec
     gradient                   ...        0 min,  0.017 sec
 * total energy  :   -45.1703978 Eh     change       -0.1158121E-02 Eh
   gradient norm :     0.0078975 Eh/α   predicted    -0.9144808E-03 ( -21.04%)
   displ. norm   :     0.3100602 α      lambda       -0.8542456E-03
   maximum displ.:     0.1556085 α      in ANC's #9, #11, #5, ...

........................................................................
.............................. CYCLE    4 ..............................
........................................................................
   1    -45.7846458 -0.457846E+02  0.179E-01    2.47       0.0  T
   2    -45.7846543 -0.851157E-05  0.104E-01    2.47       1.0  T
   3    -45.7846339  0.203951E-04  0.312E-02    2.47       1.0  T
   4    -45.7846586 -0.247293E-04  0.960E-03    2.47       1.9  T
   5    -45.7846592 -0.542373E-06  0.401E-03    2.47       4.5  T
   6    -45.7846594 -0.235363E-06  0.201E-03    2.47       8.9  T
   7    -45.7846595 -0.650528E-07  0.750E-04    2.47      24.0  T
     SCC iter.                  ...        0 min,  0.010 sec
     gradient                   ...        0 min,  0.017 sec
 * total energy  :   -45.1710517 Eh     change       -0.6539562E-03 Eh
   gradient norm :     0.0090215 Eh/α   predicted    -0.4681857E-03 ( -28.41%)
   displ. norm   :     0.4058341 α      lambda       -0.8273483E-03
   maximum displ.:     0.1947783 α      in ANC's #9, #11, #1, ...

........................................................................
.............................. CYCLE    5 ..............................
........................................................................
   1    -45.7824332 -0.457824E+02  0.222E-01    2.45       0.0  T
   2    -45.7824484 -0.152805E-04  0.129E-01    2.45       1.0  T
   3    -45.7824141  0.343258E-04  0.420E-02    2.45       1.0  T
   4    -45.7824558 -0.416533E-04  0.124E-02    2.45       1.5  T
   5    -45.7824566 -0.823233E-06  0.447E-03    2.45       4.0  T
   6    -45.7824568 -0.163881E-06  0.262E-03    2.45       6.9  T
   7    -45.7824569 -0.117608E-06  0.837E-04    2.45      21.5  T
     SCC iter.                  ...        0 min,  0.010 sec
     gradient                   ...        0 min,  0.017 sec
 * total energy  :   -45.1716568 Eh     change       -0.6050783E-03 Eh
   gradient norm :     0.0106497 Eh/α   predicted    -0.4818075E-03 ( -20.37%)
   displ. norm   :     0.3674268 α      lambda       -0.6491342E-03
   maximum displ.:     0.1656816 α      in ANC's #9, #1, #11, ...

........................................................................
.............................. CYCLE    6 ..............................
........................................................................
   1    -45.7818913 -0.457819E+02  0.188E-01    2.43       0.0  T
   2    -45.7819049 -0.135869E-04  0.109E-01    2.44       1.0  T
   3    -45.7818676  0.373283E-04  0.446E-02    2.44       1.0  T
   4    -45.7819123 -0.447181E-04  0.110E-02    2.44       1.6  T
   5    -45.7819128 -0.478208E-06  0.471E-03    2.44       3.8  T
   6    -45.7819131 -0.292997E-06  0.223E-03    2.44       8.0  T
   7    -45.7819132 -0.715722E-07  0.861E-04    2.44      20.9  T
     SCC iter.                  ...        0 min,  0.010 sec
     gradient                   ...        0 min,  0.017 sec
 * total energy  :   -45.1721487 Eh     change       -0.4919435E-03 Eh
   gradient norm :     0.0097755 Eh/α   predicted    -0.3683888E-03 ( -25.12%)
   displ. norm   :     0.3762576 α      lambda       -0.6255582E-03
   maximum displ.:     0.1937015 α      in ANC's #1, #9, #3, ...

........................................................................
.............................. CYCLE    7 ..............................
........................................................................
   1    -45.7836010 -0.457836E+02  0.170E-01    2.43       0.0  T
   2    -45.7836132 -0.121509E-04  0.987E-02    2.44       1.0  T
   3    -45.7835732  0.399848E-04  0.475E-02    2.43       1.0  T
   4    -45.7836211 -0.478966E-04  0.104E-02    2.44       1.7  T
   5    -45.7836215 -0.408166E-06  0.517E-03    2.43       3.5  T
   6    -45.7836219 -0.383257E-06  0.206E-03    2.43       8.7  T
   7    -45.7836219 -0.507697E-07  0.102E-03    2.43      17.6  T
     SCC iter.                  ...        0 min,  0.010 sec
     gradient                   ...        0 min,  0.017 sec
 * total energy  :   -45.1726284 Eh     change       -0.4796990E-03 Eh
   gradient norm :     0.0082604 Eh/α   predicted    -0.3570594E-03 ( -25.57%)
   displ. norm   :     0.4449566 α      lambda       -0.5632394E-03
   maximum displ.:     0.2513932 α      in ANC's #1, #3, #7, ...

........................................................................
.............................. CYCLE    8 ..............................
........................................................................
   1    -45.7842605 -0.457843E+02  0.181E-01    2.43       0.0  T
   2    -45.7842692 -0.868521E-05  0.106E-01    2.43       1.0  T
   3    -45.7842348  0.344258E-04  0.429E-02    2.43       1.0  T
   4    -45.7842751 -0.403899E-04  0.941E-03    2.43       1.9  T
   5    -45.7842754 -0.275378E-06  0.459E-03    2.43       3.9  T
   6    -45.7842757 -0.307191E-06  0.183E-03    2.43       9.8  T
   7    -45.7842758 -0.261491E-07  0.109E-03    2.43      16.4  T
     SCC iter.                  ...        0 min,  0.010 sec
     gradient                   ...        0 min,  0.017 sec
 * total energy  :   -45.1730587 Eh     change       -0.4302088E-03 Eh
   gradient norm :     0.0085967 Eh/α   predicted    -0.3373785E-03 ( -21.58%)
   displ. norm   :     0.4394886 α      lambda       -0.6042125E-03
   maximum displ.:     0.2828960 α      in ANC's #1, #3, #7, ...

........................................................................
.............................. CYCLE    9 ..............................
........................................................................
   1    -45.7891735 -0.457892E+02  0.167E-01    2.44       0.0  T
   2    -45.7891815 -0.806570E-05  0.977E-02    2.43       1.0  T
   3    -45.7891616  0.199574E-04  0.337E-02    2.43       1.0  T
   4    -45.7891847 -0.231259E-04  0.906E-03    2.43       2.0  T
   5    -45.7891854 -0.675845E-06  0.419E-03    2.43       4.3  T
   6    -45.7891855 -0.114239E-06  0.217E-03    2.43       8.3  T
   7    -45.7891856 -0.642925E-07  0.102E-03    2.43      17.5  T
     SCC iter.                  ...        0 min,  0.010 sec
     gradient                   ...        0 min,  0.017 sec
 * total energy  :   -45.1733994 Eh     change       -0.3407013E-03 Eh
   gradient norm :     0.0093787 Eh/α   predicted    -0.3604590E-03 (   5.80%)
   displ. norm   :     0.5402997 α      lambda       -0.5872480E-03
   maximum displ.:     0.3360544 α      in ANC's #1, #3, #5, ...

........................................................................
.............................. CYCLE   10 ..............................
........................................................................
   1    -45.7842344 -0.457842E+02  0.207E-01    2.43       0.0  T
   2    -45.7842445 -0.100968E-04  0.120E-01    2.43       1.0  T
   3    -45.7842383  0.620996E-05  0.243E-02    2.43       1.0  T
   4    -45.7842459 -0.766393E-05  0.127E-02    2.43       1.4  T
   5    -45.7842480 -0.207754E-05  0.377E-03    2.43       4.8  T
   6    -45.7842481 -0.785926E-07  0.190E-03    2.43       9.5  T
   7    -45.7842481 -0.583630E-07  0.892E-04    2.43      20.1  T
     SCC iter.                  ...        0 min,  0.010 sec
     gradient                   ...        0 min,  0.017 sec
 * total energy  :   -45.1736021 Eh     change       -0.2027143E-03 Eh
   gradient norm :     0.0133318 Eh/α   predicted    -0.3793454E-03 (  87.13%)
   displ. norm   :     0.1286289 α      lambda       -0.4969876E-03
   maximum displ.:     0.0783378 α      in ANC's #1, #9, #10, ...

........................................................................
.............................. CYCLE   11 ..............................
........................................................................
   1    -45.7887878 -0.457888E+02  0.795E-02    2.43       0.0  T
   2    -45.7887903 -0.250951E-05  0.440E-02    2.43       1.0  T
   3    -45.7887846  0.570226E-05  0.194E-02    2.43       1.0  T
   4    -45.7887913 -0.672787E-05  0.596E-03    2.43       3.0  T
   5    -45.7887915 -0.162326E-06  0.252E-03    2.43       7.1  T
   6    -45.7887915 -0.692177E-07  0.102E-03    2.43      17.5  T
     SCC iter.                  ...        0 min,  0.009 sec
     gradient                   ...        0 min,  0.017 sec
 * total energy  :   -45.1738782 Eh     change       -0.2761395E-03 Eh
   gradient norm :     0.0077496 Eh/α   predicted    -0.2526105E-03 (  -8.52%)
   displ. norm   :     0.2479639 α      lambda       -0.3779886E-03
   maximum displ.:     0.2004674 α      in ANC's #1, #3, #2, ...

........................................................................
.............................. CYCLE   12 ..............................
........................................................................
   1    -45.7895016 -0.457895E+02  0.106E-01    2.43       0.0  T
   2    -45.7895048 -0.314012E-05  0.601E-02    2.43       1.0  T
   3    -45.7894963  0.844237E-05  0.226E-02    2.43       1.0  T
   4    -45.7895060 -0.968243E-05  0.679E-03    2.43       2.6  T
   5    -45.7895062 -0.238225E-06  0.323E-03    2.43       5.6  T
   6    -45.7895064 -0.165774E-06  0.925E-04    2.43      19.4  T
   7    -45.7895064 -0.188872E-07  0.389E-04    2.43      46.2  T
     SCC iter.                  ...        0 min,  0.010 sec
     gradient                   ...        0 min,  0.017 sec
 * total energy  :   -45.1741345 Eh     change       -0.2563318E-03 Eh
   gradient norm :     0.0054765 Eh/α   predicted    -0.2006167E-03 ( -21.74%)
   displ. norm   :     0.4688334 α      lambda       -0.4160047E-03
   maximum displ.:     0.3696639 α      in ANC's #1, #3, #2, ...

........................................................................
.............................. CYCLE   13 ..............................
........................................................................
   1    -45.7888042 -0.457888E+02  0.174E-01    2.43       0.0  T
   2    -45.7888085 -0.426103E-05  0.101E-01    2.43       1.0  T
   3    -45.7887910  0.175492E-04  0.311E-02    2.43       1.0  T
   4    -45.7888110 -0.200175E-04  0.858E-03    2.43       2.1  T
   5    -45.7888112 -0.248927E-06  0.380E-03    2.43       4.7  T
   6    -45.7888115 -0.279932E-06  0.115E-03    2.43      15.7  T
   7    -45.7888115 -0.224987E-07  0.583E-04    2.43      30.8  T
     SCC iter.                  ...        0 min,  0.011 sec
     gradient                   ...        0 min,  0.017 sec
 * total energy  :   -45.1744661 Eh     change       -0.3316070E-03 Eh
   gradient norm :     0.0056521 Eh/α   predicted    -0.2537256E-03 ( -23.49%)
   displ. norm   :     0.4104748 α      lambda       -0.3204760E-03
   maximum displ.:     0.3264768 α      in ANC's #1, #2, #3, ...

........................................................................
.............................. CYCLE   14 ..............................
........................................................................
   1    -45.7873896 -0.457874E+02  0.151E-01    2.43       0.0  T
   2    -45.7873932 -0.359364E-05  0.868E-02    2.43       1.0  T
   3    -45.7873778  0.153870E-04  0.288E-02    2.43       1.0  T
   4    -45.7873951 -0.173218E-04  0.801E-03    2.43       2.2  T
   5    -45.7873954 -0.221813E-06  0.374E-03    2.43       4.8  T
   6    -45.7873957 -0.286897E-06  0.973E-04    2.43      18.5  T
   7    -45.7873957 -0.158354E-07  0.474E-04    2.43      37.9  T
     SCC iter.                  ...        0 min,  0.010 sec
     gradient                   ...        0 min,  0.017 sec
 * total energy  :   -45.1747221 Eh     change       -0.2559179E-03 Eh
   gradient norm :     0.0057301 Eh/α   predicted    -0.1872420E-03 ( -26.84%)
   displ. norm   :     0.4184417 α      lambda       -0.3207285E-03
   maximum displ.:     0.3378675 α      in ANC's #1, #2, #3, ...

........................................................................
.............................. CYCLE   15 ..............................
........................................................................
   1    -45.7868732 -0.457869E+02  0.161E-01    2.43       0.0  T
   2    -45.7868772 -0.394388E-05  0.913E-02    2.43       1.0  T
   3    -45.7868635  0.136980E-04  0.274E-02    2.43       1.0  T
   4    -45.7868790 -0.154874E-04  0.898E-03    2.43       2.0  T
   5    -45.7868793 -0.292663E-06  0.405E-03    2.43       4.4  T
   6    -45.7868797 -0.384376E-06  0.863E-04    2.43      20.8  T
   7    -45.7868797 -0.849727E-08  0.462E-04    2.43      38.9  T
     SCC iter.                  ...        0 min,  0.010 sec
     gradient                   ...        0 min,  0.017 sec
 * total energy  :   -45.1749817 Eh     change       -0.2595857E-03 Eh
   gradient norm :     0.0048525 Eh/α   predicted    -0.1884437E-03 ( -27.41%)
   displ. norm   :     0.4971669 α      lambda       -0.3309350E-03
   maximum displ.:     0.4024394 α      in ANC's #1, #2, #3, ...

........................................................................
.............................. CYCLE   16 ..............................
........................................................................
   1    -45.7876213 -0.457876E+02  0.205E-01    2.43       0.0  T
   2    -45.7876291 -0.779089E-05  0.115E-01    2.43       1.0  T
   3    -45.7876148  0.143449E-04  0.300E-02    2.43       1.0  T
   4    -45.7876313 -0.164956E-04  0.128E-02    2.43       1.4  T
   5    -45.7876322 -0.931538E-06  0.514E-03    2.43       3.5  T
   6    -45.7876328 -0.651400E-06  0.956E-04    2.43      18.8  T
   7    -45.7876328 -0.802694E-08  0.486E-04    2.43      36.9  T
     SCC iter.                  ...        0 min,  0.010 sec
     gradient                   ...        0 min,  0.017 sec
 * total energy  :   -45.1752311 Eh     change       -0.2494736E-03 Eh
   gradient norm :     0.0043991 Eh/α   predicted    -0.2063673E-03 ( -17.28%)
   displ. norm   :     0.5315755 α      lambda       -0.2852969E-03
   maximum displ.:     0.4395110 α      in ANC's #1, #2, #3, ...

........................................................................
.............................. CYCLE   17 ..............................
........................................................................
   1    -45.7849144 -0.457849E+02  0.193E-01    2.42       0.0  T
   2    -45.7849211 -0.674931E-05  0.109E-01    2.43       1.0  T
   3    -45.7849117  0.945676E-05  0.249E-02    2.42       1.0  T
   4    -45.7849231 -0.114458E-04  0.110E-02    2.43       1.6  T
   5    -45.7849241 -0.970499E-06  0.282E-03    2.42       6.4  T
   6    -45.7849243 -0.148853E-06  0.134E-03    2.42      13.4  T
     SCC iter.                  ...        0 min,  0.009 sec
     gradient                   ...        0 min,  0.017 sec
 * total energy  :   -45.1753963 Eh     change       -0.1651734E-03 Eh
   gradient norm :     0.0073514 Eh/α   predicted    -0.1829633E-03 (  10.77%)
   displ. norm   :     0.3951802 α      lambda       -0.2913685E-03
   maximum displ.:     0.3236839 α      in ANC's #1, #9, #2, ...

........................................................................
.............................. CYCLE   18 ..............................
........................................................................
   1    -45.7882334 -0.457882E+02  0.180E-01    2.43       0.0  T
   2    -45.7882403 -0.688240E-05  0.993E-02    2.43       1.0  T
   3    -45.7882375  0.275515E-05  0.197E-02    2.42       1.0  T
   4    -45.7882409 -0.339913E-05  0.117E-02    2.43       1.5  T
   5    -45.7882426 -0.168632E-05  0.179E-03    2.42      10.0  T
   6    -45.7882427 -0.654773E-07  0.850E-04    2.43      21.1  T
     SCC iter.                  ...        0 min,  0.009 sec
     gradient                   ...        0 min,  0.017 sec
 * total energy  :   -45.1755337 Eh     change       -0.1374041E-03 Eh
   gradient norm :     0.0072554 Eh/α   predicted    -0.1684427E-03 (  22.59%)
   displ. norm   :     0.3629619 α      lambda       -0.2118111E-03
   maximum displ.:     0.2992437 α      in ANC's #1, #2, #3, ...

........................................................................
.............................. CYCLE   19 ..............................
........................................................................
   1    -45.7885761 -0.457886E+02  0.135E-01    2.43       0.0  T
   2    -45.7885790 -0.295252E-05  0.771E-02    2.43       1.0  T
   3    -45.7885769  0.211642E-05  0.145E-02    2.43       1.2  T
   4    -45.7885795 -0.255244E-05  0.771E-03    2.43       2.3  T
   5    -45.7885801 -0.652552E-06  0.189E-03    2.43       9.5  T
   6    -45.7885802 -0.602983E-07  0.844E-04    2.43      21.3  T
     SCC iter.                  ...        0 min,  0.009 sec
     gradient                   ...        0 min,  0.017 sec
 * total energy  :   -45.1756705 Eh     change       -0.1367954E-03 Eh
   gradient norm :     0.0046137 Eh/α   predicted    -0.1198608E-03 ( -12.38%)
   displ. norm   :     0.3299034 α      lambda       -0.1605508E-03
   maximum displ.:     0.2675598 α      in ANC's #1, #7, #8, ...

........................................................................
.............................. CYCLE   20 ..............................
........................................................................
   1    -45.7885028 -0.457885E+02  0.121E-01    2.42       0.0  T
   2    -45.7885052 -0.246082E-05  0.696E-02    2.42       1.0  T
   3    -45.7885029  0.233717E-05  0.136E-02    2.42       1.3  T
   4    -45.7885060 -0.308385E-05  0.634E-03    2.42       2.8  T
   5    -45.7885063 -0.378112E-06  0.153E-03    2.42      11.8  T
   6    -45.7885064 -0.334845E-07  0.778E-04    2.42      23.1  T
     SCC iter.                  ...        0 min,  0.009 sec
     gradient                   ...        0 min,  0.017 sec
 * total energy  :   -45.1757816 Eh     change       -0.1110700E-03 Eh
   gradient norm :     0.0059952 Eh/α   predicted    -0.8901468E-04 ( -19.86%)
   displ. norm   :     0.3452308 α      lambda       -0.1796621E-03
   maximum displ.:     0.2670579 α      in ANC's #1, #7, #4, ...
 * RMSD in coord.:     1.1206647 α      energy gain  -0.1044967E-01 Eh

generating ANC from model Hessian ...
Using Lindh-Hessian (1995)
 Shifting diagonal of input Hessian by   4.650089322191892E-003
 Lowest  eigenvalues of input Hessian
   -0.000000   -0.000000   -0.000000    0.000000    0.000000    0.000000
    0.005000    0.005620    0.005807    0.006502    0.006767    0.007398
    0.007687    0.009462    0.010337    0.012765    0.013631    0.016086
 Highest eigenvalues
    1.681066    1.812640    1.903824    1.974692    2.097386    2.101393
 

........................................................................
.............................. CYCLE   21 ..............................
........................................................................
   1    -45.7898473 -0.457898E+02  0.136E-01    2.42       0.0  T
   2    -45.7898512 -0.394368E-05  0.773E-02    2.42       1.0  T
   3    -45.7898432  0.802602E-05  0.222E-02    2.42       1.0  T
   4    -45.7898529 -0.969875E-05  0.765E-03    2.42       2.3  T
   5    -45.7898532 -0.306103E-06  0.238E-03    2.42       7.6  T
   6    -45.7898533 -0.976334E-07  0.913E-04    2.42      19.7  T
   7    -45.7898533 -0.108619E-07  0.473E-04    2.42      38.0  T
     SCC iter.                  ...        0 min,  0.011 sec
     gradient                   ...        0 min,  0.018 sec
 * total energy  :   -45.1758974 Eh     change       -0.1158301E-03 Eh
   gradient norm :     0.0056804 Eh/α   predicted     0.0000000E+00 (-100.00%)
   displ. norm   :     0.0832764 α      lambda       -0.1132345E-03
   maximum displ.:     0.0521990 α      in ANC's #4, #7, #1, ...

........................................................................
.............................. CYCLE   22 ..............................
........................................................................
   1    -45.7899759 -0.457900E+02  0.396E-02    2.42       0.0  T
   2    -45.7899762 -0.347449E-06  0.234E-02    2.42       1.0  T
   3    -45.7899742  0.201988E-05  0.949E-03    2.42       1.9  T
   4    -45.7899765 -0.233290E-05  0.130E-03    2.42      13.8  T
   5    -45.7899765 -0.342857E-08  0.799E-04    2.42      22.5  T
     SCC iter.                  ...        0 min,  0.008 sec
     gradient                   ...        0 min,  0.017 sec
 * total energy  :   -45.1759803 Eh     change       -0.8293072E-04 Eh
   gradient norm :     0.0018614 Eh/α   predicted    -0.5701021E-04 ( -31.26%)
   displ. norm   :     0.1071999 α      lambda       -0.4413788E-04
   maximum displ.:     0.0647721 α      in ANC's #7, #4, #1, ...

........................................................................
.............................. CYCLE   23 ..............................
........................................................................
   1    -45.7899384 -0.457899E+02  0.496E-02    2.42       0.0  T
   2    -45.7899388 -0.419866E-06  0.295E-02    2.42       1.0  T
   3    -45.7899358  0.300058E-05  0.114E-02    2.42       1.6  T
   4    -45.7899393 -0.342989E-05  0.165E-03    2.42      10.9  T
   5    -45.7899393  0.493763E-09  0.114E-03    2.42      15.8  T
   6    -45.7899393 -0.219230E-07  0.357E-04    2.42      50.3  T
   7    -45.7899393 -0.751392E-09  0.143E-04    2.42     125.7  T
     SCC iter.                  ...        0 min,  0.011 sec
     gradient                   ...        0 min,  0.018 sec
 * total energy  :   -45.1760247 Eh     change       -0.4436041E-04 Eh
   gradient norm :     0.0017882 Eh/α   predicted    -0.2220951E-04 ( -49.93%)
   displ. norm   :     0.1132046 α      lambda       -0.2892348E-04
   maximum displ.:     0.0669251 α      in ANC's #4, #7, #1, ...

........................................................................
.............................. CYCLE   24 ..............................
........................................................................
   1    -45.7898671 -0.457899E+02  0.515E-02    2.42       0.0  T
   2    -45.7898675 -0.363929E-06  0.299E-02    2.42       1.0  T
   3    -45.7898668  0.654666E-06  0.637E-03    2.42       2.8  T
   4    -45.7898677 -0.804758E-06  0.241E-03    2.42       7.5  T
   5    -45.7898677 -0.296731E-07  0.974E-04    2.42      18.4  T
   6    -45.7898677 -0.210336E-07  0.287E-04    2.42      62.5  T
     SCC iter.                  ...        0 min,  0.009 sec
     gradient                   ...        0 min,  0.018 sec
 * total energy  :   -45.1760614 Eh     change       -0.3669293E-04 Eh
   gradient norm :     0.0019921 Eh/α   predicted    -0.1454510E-04 ( -60.36%)
   displ. norm   :     0.2025344 α      lambda       -0.4480392E-04
   maximum displ.:     0.1165625 α      in ANC's #1, #4, #7, ...

........................................................................
.............................. CYCLE   25 ..............................
........................................................................
   1    -45.7896466 -0.457896E+02  0.920E-02    2.41       0.0  T
   2    -45.7896479 -0.129301E-05  0.528E-02    2.41       1.0  T
   3    -45.7896481 -0.232529E-06  0.676E-03    2.41       2.7  T
   4    -45.7896479  0.270295E-06  0.480E-03    2.41       3.7  T
   5    -45.7896484 -0.501750E-06  0.918E-04    2.41      19.6  T
   6    -45.7896484 -0.129210E-07  0.446E-04    2.41      40.2  T
     SCC iter.                  ...        0 min,  0.009 sec
     gradient                   ...        0 min,  0.018 sec
 * total energy  :   -45.1761105 Eh     change       -0.4915069E-04 Eh
   gradient norm :     0.0014140 Eh/α   predicted    -0.2281918E-04 ( -53.57%)
   displ. norm   :     0.1708893 α      lambda       -0.2697419E-04
   maximum displ.:     0.1114277 α      in ANC's #1, #4, #7, ...

........................................................................
.............................. CYCLE   26 ..............................
........................................................................
   1    -45.7898454 -0.457898E+02  0.731E-02    2.41       0.0  T
   2    -45.7898461 -0.677339E-06  0.423E-02    2.41       1.0  T
   3    -45.7898460  0.781387E-07  0.550E-03    2.41       3.3  T
   4    -45.7898462 -0.197078E-06  0.322E-03    2.41       5.6  T
   5    -45.7898464 -0.147805E-06  0.735E-04    2.41      24.5  T
   6    -45.7898464 -0.937435E-08  0.360E-04    2.41      49.9  T
     SCC iter.                  ...        0 min,  0.009 sec
     gradient                   ...        0 min,  0.018 sec
 * total energy  :   -45.1761394 Eh     change       -0.2885745E-04 Eh
   gradient norm :     0.0011743 Eh/α   predicted    -0.1366272E-04 ( -52.65%)
   displ. norm   :     0.1192421 α      lambda       -0.1779996E-04
   maximum displ.:     0.0851788 α      in ANC's #1, #4, #7, ...

........................................................................
.............................. CYCLE   27 ..............................
........................................................................
   1    -45.7902316 -0.457902E+02  0.464E-02    2.41       0.0  T
   2    -45.7902318 -0.196500E-06  0.271E-02    2.41       1.0  T
   3    -45.7902317  0.116359E-06  0.332E-03    2.41       5.4  T
   4    -45.7902319 -0.162602E-06  0.176E-03    2.41      10.2  T
   5    -45.7902319 -0.327152E-07  0.618E-04    2.41      29.1  T
   6    -45.7902319 -0.783138E-08  0.204E-04    2.41      87.9  T
     SCC iter.                  ...        0 min,  0.009 sec
     gradient                   ...        0 min,  0.018 sec
 * total energy  :   -45.1761608 Eh     change       -0.2143666E-04 Eh
   gradient norm :     0.0010906 Eh/α   predicted    -0.8958034E-05 ( -58.21%)
   displ. norm   :     0.1215352 α      lambda       -0.1995998E-04
   maximum displ.:     0.0892147 α      in ANC's #1, #4, #6, ...

........................................................................
.............................. CYCLE   28 ..............................
........................................................................
   1    -45.7905557 -0.457906E+02  0.499E-02    2.41       0.0  T
   2    -45.7905560 -0.275118E-06  0.287E-02    2.41       1.0  T
   3    -45.7905558  0.164495E-06  0.405E-03    2.41       4.4  T
   4    -45.7905560 -0.190927E-06  0.226E-03    2.41       7.9  T
   5    -45.7905561 -0.684037E-07  0.637E-04    2.41      28.2  T
   6    -45.7905561 -0.901195E-08  0.204E-04    2.41      87.9  T
     SCC iter.                  ...        0 min,  0.009 sec
     gradient                   ...        0 min,  0.018 sec
 * total energy  :   -45.1761832 Eh     change       -0.2232902E-04 Eh
   gradient norm :     0.0013540 Eh/α   predicted    -0.1004600E-04 ( -55.01%)
   displ. norm   :     0.1429610 α      lambda       -0.2257395E-04
   maximum displ.:     0.1045160 α      in ANC's #1, #4, #3, ...

........................................................................
.............................. CYCLE   29 ..............................
........................................................................
   1    -45.7903602 -0.457904E+02  0.608E-02    2.41       0.0  T
   2    -45.7903608 -0.585966E-06  0.342E-02    2.41       1.0  T
   3    -45.7903607  0.101614E-06  0.522E-03    2.41       3.4  T
   4    -45.7903608 -0.118242E-06  0.316E-03    2.41       5.7  T
   5    -45.7903610 -0.166532E-06  0.469E-04    2.41      38.3  T
   6    -45.7903610 -0.419876E-08  0.218E-04    2.41      82.2  T
     SCC iter.                  ...        0 min,  0.009 sec
     gradient                   ...        0 min,  0.018 sec
 * total energy  :   -45.1762065 Eh     change       -0.2338843E-04 Eh
   gradient norm :     0.0011938 Eh/α   predicted    -0.1139130E-04 ( -51.30%)
   displ. norm   :     0.1054363 α      lambda       -0.1380881E-04
   maximum displ.:     0.0804608 α      in ANC's #1, #4, #3, ...

........................................................................
.............................. CYCLE   30 ..............................
........................................................................
   1    -45.7900188 -0.457900E+02  0.494E-02    2.41       0.0  T
   2    -45.7900192 -0.435937E-06  0.275E-02    2.41       1.0  T
   3    -45.7900190  0.230210E-06  0.537E-03    2.41       3.3  T
   4    -45.7900193 -0.260503E-06  0.307E-03    2.41       5.9  T
   5    -45.7900194 -0.108533E-06  0.670E-04    2.41      26.8  T
   6    -45.7900194 -0.101884E-07  0.189E-04    2.41      95.2  T
     SCC iter.                  ...        0 min,  0.009 sec
     gradient                   ...        0 min,  0.018 sec
 * total energy  :   -45.1762225 Eh     change       -0.1591266E-04 Eh
   gradient norm :     0.0009331 Eh/α   predicted    -0.6938741E-05 ( -56.39%)
   displ. norm   :     0.0879081 α      lambda       -0.1167105E-04
   maximum displ.:     0.0678954 α      in ANC's #1, #3, #4, ...

........................................................................
.............................. CYCLE   31 ..............................
........................................................................
   1    -45.7902238 -0.457902E+02  0.428E-02    2.41       0.0  T
   2    -45.7902242 -0.451444E-06  0.235E-02    2.41       1.0  T
   3    -45.7902232  0.107039E-05  0.819E-03    2.41       2.2  T
   4    -45.7902244 -0.126754E-05  0.281E-03    2.41       6.4  T
   5    -45.7902244 -0.170792E-07  0.118E-03    2.41      15.2  T
   6    -45.7902245 -0.331195E-07  0.232E-04    2.41      77.5  T
   7    -45.7902245 -0.768004E-09  0.116E-04    2.41     154.4  T
     SCC iter.                  ...        0 min,  0.010 sec
     gradient                   ...        0 min,  0.018 sec
 * total energy  :   -45.1762367 Eh     change       -0.1426506E-04 Eh
   gradient norm :     0.0005626 Eh/α   predicted    -0.5858935E-05 ( -58.93%)
   displ. norm   :     0.0923787 α      lambda       -0.1091835E-04
   maximum displ.:     0.0706390 α      in ANC's #1, #3, #4, ...

........................................................................
.............................. CYCLE   32 ..............................
........................................................................
   1    -45.7902777 -0.457903E+02  0.421E-02    2.41       0.0  T
   2    -45.7902780 -0.330697E-06  0.239E-02    2.41       1.0  T
   3    -45.7902763  0.169754E-05  0.960E-03    2.41       1.9  T
   4    -45.7902783 -0.194028E-05  0.245E-03    2.41       7.3  T
   5    -45.7902783 -0.192619E-08  0.120E-03    2.41      15.0  T
   6    -45.7902783 -0.342343E-07  0.244E-04    2.41      73.5  T
   7    -45.7902783 -0.658773E-09  0.132E-04    2.41     135.8  T
     SCC iter.                  ...        0 min,  0.010 sec
     gradient                   ...        0 min,  0.018 sec
 * total energy  :   -45.1762503 Eh     change       -0.1356855E-04 Eh
   gradient norm :     0.0005476 Eh/α   predicted    -0.5484268E-05 ( -59.58%)
   displ. norm   :     0.0918401 α      lambda       -0.9752042E-05
   maximum displ.:     0.0687033 α      in ANC's #1, #3, #8, ...

........................................................................
.............................. CYCLE   33 ..............................
........................................................................
   1    -45.7901703 -0.457902E+02  0.411E-02    2.41       0.0  T
   2    -45.7901707 -0.402853E-06  0.229E-02    2.41       1.0  T
   3    -45.7901698  0.949552E-06  0.766E-03    2.41       2.3  T
   4    -45.7901709 -0.112818E-05  0.270E-03    2.41       6.7  T
   5    -45.7901709 -0.146550E-07  0.120E-03    2.41      15.0  T
   6    -45.7901710 -0.348631E-07  0.238E-04    2.41      75.6  T
   7    -45.7901710 -0.484498E-09  0.136E-04    2.41     132.3  T
     SCC iter.                  ...        0 min,  0.010 sec
     gradient                   ...        0 min,  0.018 sec
 * total energy  :   -45.1762629 Eh     change       -0.1261723E-04 Eh
   gradient norm :     0.0006824 Eh/α   predicted    -0.4896195E-05 ( -61.19%)
   displ. norm   :     0.0995910 α      lambda       -0.9868086E-05
   maximum displ.:     0.0738134 α      in ANC's #1, #3, #5, ...

........................................................................
.............................. CYCLE   34 ..............................
........................................................................
   1    -45.7901866 -0.457902E+02  0.415E-02    2.40       0.0  T
   2    -45.7901869 -0.324609E-06  0.234E-02    2.40       1.0  T
   3    -45.7901858  0.114603E-05  0.821E-03    2.40       2.2  T
   4    -45.7901871 -0.132814E-05  0.250E-03    2.40       7.2  T
   5    -45.7901871 -0.113394E-07  0.103E-03    2.40      17.5  T
   6    -45.7901872 -0.262835E-07  0.240E-04    2.40      74.9  T
   7    -45.7901872 -0.373582E-09  0.142E-04    2.40     126.5  T
     SCC iter.                  ...        0 min,  0.010 sec
     gradient                   ...        0 min,  0.018 sec
 * total energy  :   -45.1762758 Eh     change       -0.1289837E-04 Eh
   gradient norm :     0.0005352 Eh/α   predicted    -0.4957651E-05 ( -61.56%)
   displ. norm   :     0.1266234 α      lambda       -0.1161813E-04
   maximum displ.:     0.0926404 α      in ANC's #1, #3, #5, ...

........................................................................
.............................. CYCLE   35 ..............................
........................................................................
   1    -45.7900457 -0.457900E+02  0.489E-02    2.40       0.0  T
   2    -45.7900461 -0.360900E-06  0.280E-02    2.40       1.0  T
   3    -45.7900455  0.607370E-06  0.654E-03    2.40       2.7  T
   4    -45.7900462 -0.733982E-06  0.266E-03    2.40       6.8  T
   5    -45.7900462 -0.432113E-07  0.828E-04    2.40      21.7  T
   6    -45.7900463 -0.154076E-07  0.284E-04    2.40      63.2  T
     SCC iter.                  ...        0 min,  0.009 sec
     gradient                   ...        0 min,  0.018 sec
 * total energy  :   -45.1762906 Eh     change       -0.1477551E-04 Eh
   gradient norm :     0.0007583 Eh/α   predicted    -0.5851323E-05 ( -60.40%)
   displ. norm   :     0.1609264 α      lambda       -0.1321049E-04
   maximum displ.:     0.1180772 α      in ANC's #1, #3, #5, ...

........................................................................
.............................. CYCLE   36 ..............................
........................................................................
   1    -45.7900566 -0.457901E+02  0.642E-02    2.40       0.0  T
   2    -45.7900572 -0.662521E-06  0.365E-02    2.40       1.0  T
   3    -45.7900558  0.144644E-05  0.991E-03    2.40       1.8  T
   4    -45.7900575 -0.169715E-05  0.374E-03    2.40       4.8  T
   5    -45.7900576 -0.750772E-07  0.115E-03    2.40      15.6  T
   6    -45.7900576 -0.299876E-07  0.369E-04    2.40      48.7  T
   7    -45.7900576 -0.876867E-09  0.216E-04    2.40      83.2  T
     SCC iter.                  ...        0 min,  0.011 sec
     gradient                   ...        0 min,  0.018 sec
 * total energy  :   -45.1763066 Eh     change       -0.1601670E-04 Eh
   gradient norm :     0.0006267 Eh/α   predicted    -0.6682961E-05 ( -58.28%)
   displ. norm   :     0.1629689 α      lambda       -0.1121255E-04
   maximum displ.:     0.1216183 α      in ANC's #1, #3, #5, ...

........................................................................
.............................. CYCLE   37 ..............................
........................................................................
   1    -45.7900531 -0.457901E+02  0.634E-02    2.40       0.0  T
   2    -45.7900537 -0.581571E-06  0.364E-02    2.40       1.0  T
   3    -45.7900528  0.899716E-06  0.808E-03    2.40       2.2  T
   4    -45.7900539 -0.109818E-05  0.334E-03    2.40       5.4  T
   5    -45.7900540 -0.755685E-07  0.941E-04    2.40      19.1  T
   6    -45.7900540 -0.179793E-07  0.380E-04    2.40      47.2  T
     SCC iter.                  ...        0 min,  0.009 sec
     gradient                   ...        0 min,  0.018 sec
 * total energy  :   -45.1763199 Eh     change       -0.1332848E-04 Eh
   gradient norm :     0.0006076 Eh/α   predicted    -0.5676415E-05 ( -57.41%)
   displ. norm   :     0.1569187 α      lambda       -0.8772726E-05
   maximum displ.:     0.1186970 α      in ANC's #1, #3, #5, ...

........................................................................
.............................. CYCLE   38 ..............................
........................................................................
   1    -45.7898961 -0.457899E+02  0.639E-02    2.40       0.0  T
   2    -45.7898968 -0.621612E-06  0.367E-02    2.40       1.0  T
   3    -45.7898960  0.725826E-06  0.782E-03    2.40       2.3  T
   4    -45.7898969 -0.889718E-06  0.364E-03    2.40       4.9  T
   5    -45.7898970 -0.105486E-06  0.105E-03    2.40      17.2  T
   6    -45.7898971 -0.233709E-07  0.384E-04    2.40      46.8  T
   7    -45.7898971 -0.812065E-09  0.208E-04    2.40      86.2  T
     SCC iter.                  ...        0 min,  0.010 sec
     gradient                   ...        0 min,  0.018 sec
 * total energy  :   -45.1763309 Eh     change       -0.1095202E-04 Eh
   gradient norm :     0.0007780 Eh/α   predicted    -0.4436212E-05 ( -59.49%)
   displ. norm   :     0.1521820 α      lambda       -0.8549156E-05
   maximum displ.:     0.1182551 α      in ANC's #1, #3, #5, ...

........................................................................
.............................. CYCLE   39 ..............................
........................................................................
   1    -45.7902757 -0.457903E+02  0.646E-02    2.40       0.0  T
   2    -45.7902764 -0.707736E-06  0.370E-02    2.40       1.0  T
   3    -45.7902755  0.851553E-06  0.837E-03    2.40       2.1  T
   4    -45.7902766 -0.107130E-05  0.377E-03    2.40       4.8  T
   5    -45.7902767 -0.103885E-06  0.107E-03    2.40      16.9  T
   6    -45.7902767 -0.233548E-07  0.415E-04    2.40      43.3  T
   7    -45.7902767 -0.942812E-09  0.225E-04    2.40      79.9  T
     SCC iter.                  ...        0 min,  0.010 sec
     gradient                   ...        0 min,  0.018 sec
 * total energy  :   -45.1763410 Eh     change       -0.1015268E-04 Eh
   gradient norm :     0.0004456 Eh/α   predicted    -0.4319918E-05 ( -57.45%)
   displ. norm   :     0.1552323 α      lambda       -0.7835699E-05
   maximum displ.:     0.1212809 α      in ANC's #1, #3, #5, ...

........................................................................
.............................. CYCLE   40 ..............................
........................................................................
   1    -45.7900266 -0.457900E+02  0.686E-02    2.40       0.0  T
   2    -45.7900274 -0.845406E-06  0.394E-02    2.40       1.0  T
   3    -45.7900266  0.881509E-06  0.878E-03    2.40       2.0  T
   4    -45.7900277 -0.112793E-05  0.415E-03    2.40       4.3  T
   5    -45.7900278 -0.128632E-06  0.129E-03    2.40      14.0  T
   6    -45.7900278 -0.350969E-07  0.448E-04    2.40      40.1  T
   7    -45.7900278 -0.110582E-08  0.237E-04    2.40      75.7  T
     SCC iter.                  ...        0 min,  0.010 sec
     gradient                   ...        0 min,  0.018 sec
 * total energy  :   -45.1763505 Eh     change       -0.9453454E-05 Eh
   gradient norm :     0.0006131 Eh/α   predicted    -0.3963871E-05 ( -58.07%)
   displ. norm   :     0.1425160 α      lambda       -0.6777031E-05
   maximum displ.:     0.1130584 α      in ANC's #1, #2, #5, ...

........................................................................
.............................. CYCLE   41 ..............................
........................................................................
   1    -45.7902067 -0.457902E+02  0.655E-02    2.40       0.0  T
   2    -45.7902075 -0.837895E-06  0.377E-02    2.40       1.0  T
   3    -45.7902067  0.813133E-06  0.873E-03    2.40       2.1  T
   4    -45.7902078 -0.106815E-05  0.416E-03    2.40       4.3  T
   5    -45.7902079 -0.132014E-06  0.118E-03    2.40      15.3  T
   6    -45.7902079 -0.286190E-07  0.443E-04    2.40      40.6  T
   7    -45.7902079 -0.114915E-08  0.226E-04    2.40      79.5  T
     SCC iter.                  ...        0 min,  0.010 sec
     gradient                   ...        0 min,  0.018 sec
 * total energy  :   -45.1763592 Eh     change       -0.8665149E-05 Eh
   gradient norm :     0.0004962 Eh/α   predicted    -0.3423266E-05 ( -60.49%)
   displ. norm   :     0.1471794 α      lambda       -0.6654388E-05
   maximum displ.:     0.1178352 α      in ANC's #1, #2, #5, ...

........................................................................
.............................. CYCLE   42 ..............................
........................................................................
   1    -45.7901867 -0.457902E+02  0.689E-02    2.39       0.0  T
   2    -45.7901876 -0.950336E-06  0.397E-02    2.39       1.0  T
   3    -45.7901862  0.139891E-05  0.104E-02    2.39       1.7  T
   4    -45.7901880 -0.176317E-05  0.436E-03    2.39       4.1  T
   5    -45.7901881 -0.104658E-06  0.144E-03    2.39      12.5  T
   6    -45.7901881 -0.444010E-07  0.471E-04    2.39      38.1  T
   7    -45.7901881 -0.131275E-08  0.264E-04    2.39      68.0  T
     SCC iter.                  ...        0 min,  0.010 sec
     gradient                   ...        0 min,  0.018 sec
 * total energy  :   -45.1763666 Eh     change       -0.7421682E-05 Eh
   gradient norm :     0.0004871 Eh/α   predicted    -0.3363333E-05 ( -54.68%)
   displ. norm   :     0.1460231 α      lambda       -0.1784156E-05
   maximum displ.:     0.1163885 α      in ANC's #1, #2, #5, ...
 * RMSD in coord.:     0.4495169 α      energy gain  -0.5850039E-03 Eh

generating ANC from model Hessian ...
Using Lindh-Hessian (1995)
 Shifting diagonal of input Hessian by   4.652757352424897E-003
 Lowest  eigenvalues of input Hessian
   -0.000000   -0.000000    0.000000    0.000000    0.000000    0.000000
    0.005000    0.005686    0.005782    0.006434    0.006715    0.007365
    0.007718    0.009294    0.010833    0.012610    0.013570    0.016119
 Highest eigenvalues
    1.677352    1.811553    1.900572    1.977666    2.091695    2.100680
 

........................................................................
.............................. CYCLE   43 ..............................
........................................................................
   1    -45.7899103 -0.457899E+02  0.685E-02    2.39       0.0  T
   2    -45.7899113 -0.930252E-06  0.394E-02    2.39       1.0  T
   3    -45.7899102  0.105675E-05  0.962E-03    2.39       1.9  T
   4    -45.7899116 -0.136679E-05  0.438E-03    2.39       4.1  T
   5    -45.7899117 -0.132535E-06  0.129E-03    2.39      13.9  T
   6    -45.7899117 -0.340721E-07  0.464E-04    2.39      38.7  T
   7    -45.7899117 -0.123522E-08  0.257E-04    2.39      70.0  T
     SCC iter.                  ...        0 min,  0.010 sec
     gradient                   ...        0 min,  0.018 sec
 * total energy  :   -45.1763696 Eh     change       -0.3075789E-05 Eh
   gradient norm :     0.0010280 Eh/α   predicted     0.0000000E+00 (-100.00%)
   displ. norm   :     0.0228214 α      lambda       -0.4069161E-05
   maximum displ.:     0.0131624 α      in ANC's #6, #1, #7, ...

........................................................................
.............................. CYCLE   44 ..............................
........................................................................
   1    -45.7904513 -0.457905E+02  0.872E-03    2.39       0.0  T
   2    -45.7904514 -0.183081E-07  0.515E-03    2.39       3.5  T
   3    -45.7904513  0.500866E-07  0.158E-03    2.39      11.4  T
   4    -45.7904514 -0.575750E-07  0.366E-04    2.39      49.1  T
   5    -45.7904514 -0.961357E-09  0.209E-04    2.39      85.8  T
     SCC iter.                  ...        0 min,  0.008 sec
     gradient                   ...        0 min,  0.018 sec
 * total energy  :   -45.1763727 Eh     change       -0.3036727E-05 Eh
   gradient norm :     0.0003944 Eh/α   predicted    -0.2037189E-05 ( -32.91%)
   displ. norm   :     0.0133107 α      lambda       -0.1090624E-05
   maximum displ.:     0.0069750 α      in ANC's #6, #1, #11, ...

   *** GEOMETRY OPTIMIZATION CONVERGED AFTER 44 ITERATIONS ***

------------------------------------------------------------------------
 total energy gain   :        -0.0110408 Eh       -6.9282 kcal/mol
 total RMSD          :         1.5172930 a0        0.8029 Å
 total power (kW/mol):        -0.6588087 (step)  -15.8354 (real)
------------------------------------------------------------------------

 ANCopt (total)                0 d,  0 h,  0 min,  1.831 sec
 optimizer setup                ...        0 min,  0.000 sec (  0.009%)
 model hessian                  ...        0 min,  0.017 sec (  0.953%)
 ANC generation                 ...        0 min,  0.003 sec (  0.159%)
 coordinate transformation      ...        0 min,  0.001 sec (  0.056%)
 single point calculation       ...        0 min,  1.792 sec ( 97.879%)
 optimization log               ...        0 min,  0.005 sec (  0.290%)
 hessian update                 ...        0 min,  0.001 sec (  0.039%)
 rational function              ...        0 min,  0.009 sec (  0.467%)

================
 final structure:
================
$coord
   -0.04123992871853    2.22424376767736   -0.90309486341015      C 
   -1.84113019950747   -0.47250974050076   -0.98230233526639      S 
    0.83285425815122   -2.38634658427602   -1.00162870608452      C 
    3.00779425717617   -0.93701618162673   -0.95131385917312      C 
    2.48650374966853    1.72002458720456   -0.90790394434919      C 
    4.41024922651446    3.43832362114845   -0.93698285858880      O 
    3.79335352727967    6.02854445090001   -0.72065320117170      C 
    3.08820188481129    6.79090904253175    1.96798310884860      C 
    5.30126414622270   -2.07821872829902   -0.98342345607706      O 
    7.48133332572219   -0.70508960197585   -0.24237961349394      C 
    9.63269169673560   -2.59721090355357   -0.01407795657727      C 
    0.50838029569130   -5.06636284772383   -1.06649620189693      C 
    2.36250408798899   -6.79860972885470   -1.24316262363645      C 
    1.88207239404246   -9.46985663978940   -1.28304927309241      C 
    3.69180141199654  -11.21168006539323   -1.45859432691658      C 
   -0.98234215221036    4.01474849170658   -0.88918697006077      H 
    2.27800462981123    6.51908285554020   -2.04726827483150      H 
    5.51744664568339    7.00920848844614   -1.30082373001261      H 
    1.42170469119138    5.77181826413671    2.60375260381850      H 
    2.70332517775326    8.80626248755219    2.03404094644420      H 
    4.63951054929868    6.36525498696886    3.24608665786128      H 
    7.14581908724055    0.23357931239636    1.57431589504400      H 
    7.93199800515528    0.73899532976922   -1.65603146870149      H 
    9.17569605640854   -4.02187620074477    1.39340609671655      H 
   11.35483237383247   -1.62852907095155    0.54128691766033      H 
    9.93799843919341   -3.53160276594721   -1.81710389587964      H 
   -1.43972195728806   -5.68966653326752   -0.96846858773475      H 
    4.30612797084720   -6.19710158091460   -1.36488415290518      H 
   -0.07881162682220  -10.04432991456836   -1.16292751465911      H 
    5.65635113911921  -10.69012211556462   -1.57999984934815      H 
    3.27701055132126  -13.20257797060452   -1.48521698649965      H 
$end
           -------------------------------------------------
          |                Final Singlepoint                |
           -------------------------------------------------

          ...................................................
          :                      SETUP                      :
          :.................................................:
          :  # basis functions                  82          :
          :  # atomic orbitals                  81          :
          :  # shells                           47          :
          :  # electrons                        82          :
          :  max. iterations                   250          :
          :  Hamiltonian                  GFN2-xTB          :
          :  restarted?                      false          :
          :  GBSA solvation                  false          :
          :  PC potential                    false          :
          :  electronic temp.          300.0000000     K    :
          :  accuracy                    1.0000000          :
          :  -> integral cutoff          0.2500000E+02      :
          :  -> integral neglect         0.1000000E-07      :
          :  -> SCF convergence          0.1000000E-05 Eh   :
          :  -> wf. convergence          0.1000000E-03 e    :
          :  Broyden damping             0.4000000          :
          ...................................................

 iter      E             dE          RMSdq      gap      omega  full diag
   1    -45.7904514 -0.457905E+02  0.122E-04    2.39       0.0  T
   2    -45.7904514 -0.802203E-11  0.568E-05    2.39     316.1  T
   3    -45.7904514 -0.602114E-10  0.598E-05    2.39     300.6  T

   *** convergence criteria satisfied after 3 iterations ***

         #    Occupation            Energy/Eh            Energy/eV
      -------------------------------------------------------------
         1        2.0000           -0.7259111             -19.7530
       ...           ...                  ...                  ...
        35        2.0000           -0.4397562             -11.9664
        36        2.0000           -0.4331201             -11.7858
        37        2.0000           -0.4290820             -11.6759
        38        2.0000           -0.4156300             -11.3099
        39        2.0000           -0.4022116             -10.9447
        40        2.0000           -0.3675712             -10.0021
        41        2.0000           -0.3518741              -9.5750 (HOMO)
        42                         -0.2639173              -7.1816 (LUMO)
        43                         -0.2076729              -5.6511
        44                         -0.2043312              -5.5601
        45                         -0.1573649              -4.2821
        46                         -0.1163545              -3.1662
       ...                                ...                  ...
        81                          0.6952369              18.9184
      -------------------------------------------------------------
                  HL-Gap            0.0879568 Eh            2.3934 eV
             Fermi-level           -0.3078957 Eh           -8.3783 eV

 SCC (total)                   0 d,  0 h,  0 min,  0.037 sec
 SCC setup                      ...        0 min,  0.000 sec (  0.719%)
 Dispersion                     ...        0 min,  0.000 sec (  0.726%)
 integral evaluation            ...        0 min,  0.012 sec ( 33.518%)
 zeroth order Hamiltonian       ...        0 min,  0.000 sec (  0.562%)
 iterations                     ...        0 min,  0.005 sec ( 14.040%)
 molecular gradient             ...        0 min,  0.018 sec ( 49.193%)
 printout                       ...        0 min,  0.000 sec (  1.100%)

         :::::::::::::::::::::::::::::::::::::::::::::::::::::
         ::                     SUMMARY                     ::
         :::::::::::::::::::::::::::::::::::::::::::::::::::::
         :: total energy             -45.176372654240 Eh    ::
         :: gradient norm              0.000393426811 Eh/a0 ::
         :: HOMO-LUMO gap              2.393426649556 eV    ::
         ::.................................................::
         :: SCC energy               -45.790451363280 Eh    ::
         :: -> isotropic ES            0.031744043453 Eh    ::
         :: -> anisotropic ES          0.002721041313 Eh    ::
         :: -> anisotropic XC          0.017236087949 Eh    ::
         :: -> dispersion             -0.028005807598 Eh    ::
         :: repulsion energy           0.613986627224 Eh    ::
         :: add. restraining           0.000000000000 Eh    ::
         :::::::::::::::::::::::::::::::::::::::::::::::::::::

           -------------------------------------------------
          |                Property Printout                |
           -------------------------------------------------

    * Orbital Energies and Occupations

         #    Occupation            Energy/Eh            Energy/eV
      -------------------------------------------------------------
         1        2.0000           -0.7259111             -19.7530
       ...           ...                  ...                  ...
        29        2.0000           -0.4700939             -12.7919
        30        2.0000           -0.4610950             -12.5470
        31        2.0000           -0.4592949             -12.4981
        32        2.0000           -0.4553827             -12.3916
        33        2.0000           -0.4470226             -12.1641
        34        2.0000           -0.4441472             -12.0859
        35        2.0000           -0.4397562             -11.9664
        36        2.0000           -0.4331201             -11.7858
        37        2.0000           -0.4290820             -11.6759
        38        2.0000           -0.4156300             -11.3099
        39        2.0000           -0.4022116             -10.9447
        40        2.0000           -0.3675712             -10.0021
        41        2.0000           -0.3518741              -9.5750 (HOMO)
        42                         -0.2639173              -7.1816 (LUMO)
        43                         -0.2076729              -5.6511
        44                         -0.2043312              -5.5601
        45                         -0.1573649              -4.2821
        46                         -0.1163545              -3.1662
        47                         -0.1140950              -3.1047
        48                         -0.0077483              -0.2108
        49                          0.0134318               0.3655
        50                          0.0337091               0.9173
        51                          0.0370078               1.0070
        52                          0.0415765               1.1314
       ...                                ...                  ...
        81                          0.6952369              18.9184
      -------------------------------------------------------------
                  HL-Gap            0.0879568 Eh            2.3934 eV
             Fermi-level           -0.3078957 Eh           -8.3783 eV

     #   Z        covCN         q      C6AA      α(0)
     1   6 C      2.929    -0.066    29.654     8.930
     2  16 S      2.327    -0.060   143.544    20.165
     3   6 C      2.979    -0.003    28.096     8.695
     4   6 C      3.034     0.108    25.584     8.297
     5   6 C      3.039     0.108    25.581     8.296
     6   8 O      1.703    -0.285    18.741     5.845
     7   6 C      3.693     0.082    19.389     6.300
     8   6 C      3.750    -0.116    22.783     6.807
     9   8 O      1.705    -0.265    18.398     5.791
    10   6 C      3.689     0.087    19.321     6.291
    11   6 C      3.751    -0.112    22.711     6.796
    12   6 C      2.943    -0.035    28.876     8.813
    13   6 C      2.901    -0.041    29.023     8.833
    14   6 C      2.895    -0.025    28.615     8.771
    15   6 C      2.842    -0.090    30.259     9.015
    16   1 H      0.927     0.049     2.332     2.388
    17   1 H      0.924     0.030     2.584     2.514
    18   1 H      0.924     0.051     2.302     2.373
    19   1 H      0.925     0.049     2.330     2.387
    20   1 H      0.925     0.046     2.376     2.410
    21   1 H      0.925     0.051     2.307     2.375
    22   1 H      0.924     0.034     2.528     2.486
    23   1 H      0.924     0.045     2.389     2.417
    24   1 H      0.925     0.054     2.267     2.355
    25   1 H      0.925     0.046     2.374     2.409
    26   1 H      0.925     0.055     2.257     2.350
    27   1 H      0.925     0.043     2.406     2.425
    28   1 H      0.926     0.058     2.218     2.329
    29   1 H      0.925     0.032     2.553     2.499
    30   1 H      0.926     0.038     2.482     2.464
    31   1 H      0.926     0.033     2.538     2.491

 Mol. C6AA /au·bohr⁶  :      11215.541938
 Mol. C8AA /au·bohr⁸  :     285572.971203
 Mol. α(0) /au        :        166.316821


Wiberg/Mayer (AO) data.
largest (>0.10) Wiberg bond orders for each atom
          total WBO             WBO to atom ...
     1  C   3.912        C    5 1.534    S    2 1.166    H   16 0.967
     2  S   2.562        C    1 1.166    C    3 1.111
     3  C   3.938        C    4 1.431    C   12 1.176    S    2 1.111
     4  C   3.909        C    3 1.431    C    5 1.184    O    9 1.068
     5  C   3.932        C    1 1.534    C    4 1.184    O    6 1.043
     6  O   2.213        C    5 1.043    C    7 0.966
     7  C   3.945        C    8 1.010    H   18 0.971    H   17 0.968    O    6 0.966
     8  C   3.994        C    7 1.010    H   21 0.987    H   20 0.985    H   19 0.984
     9  O   2.240        C    4 1.068    C   10 0.955
    10  C   3.941        C   11 1.015    H   22 0.971    H   23 0.968    O    9 0.955
    11  C   3.992        C   10 1.015    H   24 0.986    H   26 0.986    H   25 0.985
    12  C   3.989        C   13 1.693    C    3 1.176    H   27 0.962    C   15 0.121
    13  C   3.989        C   12 1.693    C   14 1.154    H   28 0.958
    14  C   3.991        C   15 1.847    C   13 1.154    H   29 0.964
    15  C   3.939        C   14 1.847    H   31 0.980    H   30 0.977    C   12 0.121
    16  H   0.997        C    1 0.967
    17  H   0.999        C    7 0.968
    18  H   0.997        C    7 0.971
    19  H   0.998        C    8 0.984
    20  H   0.997        C    8 0.985
    21  H   0.997        C    8 0.987
    22  H   0.998        C   10 0.971
    23  H   0.998        C   10 0.968
    24  H   0.997        C   11 0.986
    25  H   0.997        C   11 0.985
    26  H   0.997        C   11 0.986
    27  H   0.997        C   12 0.962
    28  H   0.997        C   13 0.958
    29  H   0.999        C   14 0.964
    30  H   0.999        C   15 0.977
    31  H   0.998        C   15 0.980

molecular dipole:
                 x           y           z       tot (Debye)
 q only:        0.468       0.726       0.321
   full:        0.697       1.095       0.324       3.399
molecular quadrupole (traceless):
                xx          xy          yy          xz          yz          zz
 q only:        4.035       1.980       2.218       1.880       0.187      -6.253
  q+dip:        3.572       3.194       3.654       1.245      -1.042      -7.226
   full:        2.335       3.347       3.277       1.560      -0.841      -5.612

           -------------------------------------------------
          |                Geometry Summary                 |
           -------------------------------------------------

      molecular mass/u    :      224.3172000
   center of mass at/Å    :        1.4977969      -0.6563026      -0.3753220
  moments of inertia/u·Å² :        0.6429781E+03   0.1550291E+04   0.2132580E+04
rotational constants/cm⁻¹ :        0.2621805E-01   0.1087385E-01   0.7904807E-02

 * 30 selected distances

     #   Z        #   Z                                     value/Å
     1   6 C      2  16 S                                 1.7162287
     2  16 S      3   6 C                                 1.7401275 (max)
     3   6 C      4   6 C                                 1.3833157
     1   6 C      5   6 C                                 1.3639792
     4   6 C      5   6 C                                 1.4330345
     5   6 C      6   8 O                                 1.3650511
     6   8 O      7   6 C                                 1.4136664
     7   6 C      8   6 C                                 1.5252064
     4   6 C      9   8 O                                 1.3557041
     9   8 O     10   6 C                                 1.4186818
    10   6 C     11   6 C                                 1.5209209
     3   6 C     12   6 C                                 1.4289725
    12   6 C     13   6 C                                 1.3459908
    14   6 C     15   6 C                                 1.3324221
     1   6 C     16   1 H                                 1.0704268 (min)
     7   6 C     17   1 H                                 1.0969192
     7   6 C     18   1 H                                 1.0935928
     8   6 C     19   1 H                                 1.0870648
     8   6 C     20   1 H                                 1.0863151
     8   6 C     21   1 H                                 1.0872357
    10   6 C     22   1 H                                 1.0965661
    10   6 C     23   1 H                                 1.0956515
    11   6 C     24   1 H                                 1.0870089
    11   6 C     25   1 H                                 1.0861089
    11   6 C     26   1 H                                 1.0867094
    12   6 C     27   1 H                                 1.0836149
    13   6 C     28   1 H                                 1.0785746
    14   6 C     29   1 H                                 1.0831361
    15   6 C     30   1 H                                 1.0775247
    15   6 C     31   1 H                                 1.0762527

 * 4 distinct bonds (by element types)

   Z      Z             #   av. dist./Å        max./Å        min./Å
   1 H    6 C          16     1.0857939     1.0969192     1.0704268
   6 C    6 C           8     1.4167303     1.5252064     1.3324221
   6 C    8 O           4     1.3882758     1.4186818     1.3557041
   6 C   16 S           2     1.7281781     1.7401275     1.7162287


optimized geometry written to: xtbopt.xyz


           -------------------------------------------------
          | TOTAL ENERGY              -45.176372654240 Eh   |
          | GRADIENT NORM               0.000393426811 Eh/α |
          | HOMO-LUMO GAP               2.393426649556 eV   |
           -------------------------------------------------

------------------------------------------------------------------------
 * finished run on 2021/05/19 at 11:01:05.998     
------------------------------------------------------------------------
 total:
 * wall-time:     0 d,  0 h,  0 min,  1.980 sec
 *  cpu-time:     0 d,  0 h,  0 min,  1.947 sec
 * ratio c/w:     0.983 speedup
 SCF:
 * wall-time:     0 d,  0 h,  0 min,  0.054 sec
 *  cpu-time:     0 d,  0 h,  0 min,  0.054 sec
 * ratio c/w:     1.000 speedup
 ANC optimizer:
 * wall-time:     0 d,  0 h,  0 min,  1.868 sec
 *  cpu-time:     0 d,  0 h,  0 min,  1.868 sec
 * ratio c/w:     1.000 speedup

