      -----------------------------------------------------------      
     |                   =====================                   |     
     |                           x T B                           |     
     |                   =====================                   |     
     |                         S. Grimme                         |     
     |          Mulliken Center for Theoretical Chemistry        |     
     |                    University of Bonn                     |     
     |                Version 6.2 RC2 (SAW190805)                |     
      -----------------------------------------------------------      

   This program is distributed in the hope that it will be useful,
   but WITHOUT ANY WARRANTY; without even the implied warranty of
   MERCHANTABILITY or FITNESS FOR A PARTICULAR PURPOSE.
   
   FOR NON-COMMERCIAL, ACADEMIA USE ONLY.
   
   Cite this work as:
   * S. Grimme, C. Bannwarth, P. Shushkov, J. Chem. Theory Comput., 2017,
     13, 1989-2009. DOI: 10.1021/acs.jctc.7b00118
   * C. Bannwarth, S. Ehlert and S. Grimme., J. Chem. Theory Comput., 2019,
     15, 1652-1671. DOI: 10.1021/acs.jctc.8b01176
   * P. Pracht, E. Caldeweyher, S. Ehlert, S. Grimme, ChemRxiv, 2019, preprint.
     DOI: 10.26434/chemrxiv.8326202.v1
   
   for DFT-D4:
   * E. Caldeweyher, C. Bannwarth and S. Grimme, J. Chem. Phys., 2017,
     147, 034112. DOI: 10.1063/1.4993215
   * E. Caldeweyher, S. Ehlert, A. Hansen, H. Neugebauer, S. Spicher,
     C. Bannwarth and S. Grimme, J. Chem. Phys., 2019, 150, 154122.
     DOI: 10.1063/1.5090222
   
   for sTDA-xTB:
   * S. Grimme and C. Bannwarth, J. Chem. Phys., 2016, 145, 054103.
     DOI: 10.1063/1.4959605
   
   in the mass-spec context:
   * V. Asgeirsson, C. Bauer and S. Grimme, Chem. Sci., 2017, 8, 4879.
     DOI: 10.1039/c7sc00601b
   
   for metadynamics refer to:
   * S. Grimme, J. Chem. Theory Comput., 2019, 155, 2847-2862
     DOI: 10.1021/acs.jctc.9b00143
   
   with help from (in alphabetical order)
   C. Bannwarth, F. Bohle, G. Brandenburg, E. Caldeweyher, M. Checinski,
   S. Dohm, S. Ehlert, S. Ehrlich, F. März, H. Neugebauer, J. Pisarek,
   P. Pracht, P. Shushkov, and S. Spicher.
   
 * started run on 2021/05/19 at 11:01:06.017     

           -------------------------------------------------
          |                Calculation Setup                |
           -------------------------------------------------

          program call               : /ihome/ghutchison/geoffh/xtb/xtb 796.xyz -opt
          hostname                   : smp-n83
          coordinate file            : 796.xyz
          omp threads                :                     1
          number of atoms            :                    23
          number of electrons        :                    62
          charge                     :                     0
          spin                       :                   0.0
          first test random number   :      0.09816349593173


########################################################################
# WARNING! Please study the warnings concerning your input carefully
#  - the use of '-opt' is discouraged, please use '--opt' next time
########################################################################

           ------------------------------------------------- 
          |                 G F N 2 - x T B                 |
          | Geometry, Frequencies, Noncovalent interactions |
          |            JCTC 2019 parametrisation            |
           ------------------------------------------------- 
             KAB for C  - Si     :                1.0500
             KAB for H  - Pd     :                0.9500
             k(s)              :                1.8500
             k(p)              :                2.2300
             k(d)              :                2.2300
             k(f)              :                2.0000
             kEN (H0ij)        :               -2.0000
             D4 a1             :                0.5200
             D4 a2             :                5.0000
             D4 s6             :                1.0000
             D4 s8             :                2.7000
             D4 s9             :                5.0000
             alphaj            :                2.0000

  Z AO/shell   Hii/eV     exponent
  1     Wed Apr 25 08:07:45 CEST 2018   EN: 2.200 GM2: 0.406  GM3: 0.0800  RAES: 1.40
     1s    -10.707211    1.230000
  6     Wed Apr 25 08:07:45 CEST 2018   EN: 2.550 GM2: 0.538  GM3: 0.1500  RAES: 3.00
     2s    -13.970922    2.096432
     2p    -10.063292    1.800000
  7     Wed Apr 25 08:07:45 CEST 2018   EN: 3.040 GM2: 0.461  GM3:-0.0640  RAES: 1.90
     2s    -16.686243    2.339881
     2p    -12.523956    2.014332
  8     Wed Apr 25 08:07:45 CEST 2018   EN: 3.440 GM2: 0.452  GM3:-0.0517  RAES: 1.80
     2s    -20.229985    2.439742
     2p    -15.503117    2.137023
 16     Tue Apr 24 11:44:34 CEST 2018   EN: 2.580 GM2: 0.340  GM3:-0.0502  RAES: 3.10
     3s    -20.029654    1.981333
     3p    -11.377694    2.025643
     3d     -0.420282    1.702555

           ------------------------------------------------- 
          |        Self-Consistent Charge Iterations        |
           ------------------------------------------------- 

          ...................................................
          :                      SETUP                      :
          :.................................................:
          :  # basis functions                  62          :
          :  # atomic orbitals                  61          :
          :  # shells                           35          :
          :  # electrons                        62          :
          :  max. iterations                   250          :
          :  Hamiltonian                  GFN2-xTB          :
          :  restarted?                      false          :
          :  GBSA solvation                  false          :
          :  PC potential                    false          :
          :  electronic temp.          300.0000000     K    :
          :  accuracy                    1.0000000          :
          :  -> integral cutoff          0.2500000E+02      :
          :  -> integral neglect         0.1000000E-07      :
          :  -> SCF convergence          0.1000000E-05 Eh   :
          :  -> wf. convergence          0.1000000E-03 e    :
          :  Broyden damping             0.4000000          :
          ...................................................

 iter      E             dE          RMSdq      gap      omega  full diag
   1    -34.5346780 -0.345347E+02  0.460E+00    3.77       0.0  T
   2    -34.6213111 -0.866331E-01  0.279E+00    3.55       1.0  T
   3    -34.6274869 -0.617573E-02  0.152E+00    3.44       1.0  T
   4    -34.6361301 -0.864323E-02  0.705E-01    3.02       1.0  T
   5    -34.6418533 -0.572322E-02  0.191E-01    3.03       1.0  T
   6    -34.6418669 -0.136132E-04  0.738E-02    3.08       1.0  T
   7    -34.6419028 -0.358612E-04  0.248E-02    3.07       1.0  T
   8    -34.6419050 -0.220315E-05  0.100E-02    3.07       2.1  T
   9    -34.6419051 -0.109128E-06  0.346E-03    3.07       6.0  T
  10    -34.6419051 -0.466233E-07  0.121E-03    3.07      17.2  T
  11    -34.6419051 -0.106089E-07  0.494E-04    3.07      42.2  T
  12    -34.6419051 -0.157292E-08  0.190E-04    3.07     109.8  T

   *** convergence criteria satisfied after 12 iterations ***

         #    Occupation            Energy/Eh            Energy/eV
      -------------------------------------------------------------
         1        2.0000           -0.7154261             -19.4677
       ...           ...                  ...                  ...
        25        2.0000           -0.4592121             -12.4958
        26        2.0000           -0.4512985             -12.2805
        27        2.0000           -0.4434378             -12.0666
        28        2.0000           -0.4385634             -11.9339
        29        2.0000           -0.4148397             -11.2884
        30        2.0000           -0.3634188              -9.8891
        31        2.0000           -0.3570522              -9.7159 (HOMO)
        32                         -0.2441534              -6.6438 (LUMO)
        33                         -0.2117678              -5.7625
        34                         -0.1888124              -5.1378
        35                         -0.1403818              -3.8200
        36                         -0.0399923              -1.0882
       ...                                ...                  ...
        61                          0.5881036              16.0031
      -------------------------------------------------------------
                  HL-Gap            0.1128989 Eh            3.0721 eV
             Fermi-level           -0.3006028 Eh           -8.1798 eV

 SCC (total)                   0 d,  0 h,  0 min,  0.033 sec
 SCC setup                      ...        0 min,  0.000 sec (  0.870%)
 Dispersion                     ...        0 min,  0.000 sec (  0.828%)
 integral evaluation            ...        0 min,  0.008 sec ( 22.660%)
 zeroth order Hamiltonian       ...        0 min,  0.000 sec (  0.482%)
 iterations                     ...        0 min,  0.013 sec ( 38.920%)
 molecular gradient             ...        0 min,  0.012 sec ( 35.018%)
 printout                       ...        0 min,  0.000 sec (  1.064%)

         :::::::::::::::::::::::::::::::::::::::::::::::::::::
         ::                     SUMMARY                     ::
         :::::::::::::::::::::::::::::::::::::::::::::::::::::
         :: total energy             -34.244862563995 Eh    ::
         :: gradient norm              0.059906032437 Eh/a0 ::
         :: HOMO-LUMO gap              3.072134839016 eV    ::
         ::.................................................::
         :: SCC energy               -34.641905148415 Eh    ::
         :: -> isotropic ES            0.049972435592 Eh    ::
         :: -> anisotropic ES          0.004643210884 Eh    ::
         :: -> anisotropic XC          0.019457499435 Eh    ::
         :: -> dispersion             -0.021280752402 Eh    ::
         :: repulsion energy           0.396835707717 Eh    ::
         :: add. restraining           0.000000000000 Eh    ::
         :::::::::::::::::::::::::::::::::::::::::::::::::::::

      ----------------------------------------------------------- 
     |                   =====================                   |
     |                        A N C O P T                        |
     |                   =====================                   |
     |               Approximate Normal Coordinate               |
     |                Rational Function Optimizer                |
      ----------------------------------------------------------- 

          ...................................................
          :                      SETUP                      :
          :.................................................:
          :   optimization level            normal          :
          :   max. optcycles                   200          :
          :   ANC micro-cycles                  20          :
          :   degrees of freedom                63          :
          :.................................................:
          :   RF solver                   davidson          :
          :   input Hessian                  false          :
          :   write xtbopt.log                true          :
          :   linear?                        false          :
          :   energy convergence         0.5000000E-05 Eh   :
          :   grad. convergence          0.1000000E-02 Eh/α :
          :   maximium RF displ.         2.0000000          :
          :   Hlow (freq-cutoff)         0.5000000E-02      :
          :   Hmax (freq-cutoff)         5.0000000          :
          :   S6 in model hess.         20.0000000          :
          ...................................................

generating ANC from model Hessian ...
Using Lindh-Hessian (1995)
 Shifting diagonal of input Hessian by   3.067708030222225E-003
 Lowest  eigenvalues of input Hessian
   -0.000000   -0.000000   -0.000000   -0.000000    0.000000    0.000000
    0.005000    0.006001    0.006371    0.007133    0.008259    0.010379
    0.013164    0.017299    0.019023    0.020494    0.024161    0.025541
 Highest eigenvalues
    1.424598    1.473575    1.701563    1.767866    2.063185    2.204183
 

........................................................................
.............................. CYCLE    1 ..............................
........................................................................
   1    -34.6419051 -0.346419E+02  0.607E-05    3.07       0.0  T
   2    -34.6419051 -0.602540E-11  0.379E-05    3.07     550.9  T
   3    -34.6419051  0.241585E-12  0.194E-05    3.07    1076.5  T
     SCC iter.                  ...        0 min,  0.004 sec
     gradient                   ...        0 min,  0.012 sec
 * total energy  :   -34.2448626 Eh     change       -0.1630045E-07 Eh
   gradient norm :     0.0599070 Eh/α   predicted     0.0000000E+00 (-100.00%)
   displ. norm   :     0.3223297 α      lambda       -0.8049431E-02
   maximum displ.:     0.1728532 α      in ANC's #15, #2, #11, ...

........................................................................
.............................. CYCLE    2 ..............................
........................................................................
   1    -34.6632893 -0.346633E+02  0.282E-01    3.29       0.0  T
   2    -34.6633505 -0.611657E-04  0.158E-01    3.25       1.0  T
   3    -34.6633341  0.163644E-04  0.579E-02    3.27       1.0  T
   4    -34.6633658 -0.316731E-04  0.211E-02    3.25       1.0  T
   5    -34.6633672 -0.138157E-05  0.117E-02    3.25       1.8  T
   6    -34.6633685 -0.130135E-05  0.321E-03    3.25       6.5  T
   7    -34.6633685 -0.353227E-07  0.155E-03    3.25      13.5  T
     SCC iter.                  ...        0 min,  0.007 sec
     gradient                   ...        0 min,  0.012 sec
 * total energy  :   -34.2498529 Eh     change       -0.4990350E-02 Eh
   gradient norm :     0.0269340 Eh/α   predicted    -0.4442875E-02 ( -10.97%)
   displ. norm   :     0.2832679 α      lambda       -0.2411373E-02
   maximum displ.:     0.1691548 α      in ANC's #4, #15, #2, ...

........................................................................
.............................. CYCLE    3 ..............................
........................................................................
   1    -34.6742639 -0.346743E+02  0.238E-01    3.42       0.0  T
   2    -34.6743002 -0.362220E-04  0.130E-01    3.39       1.0  T
   3    -34.6742615  0.386968E-04  0.615E-02    3.39       1.0  T
   4    -34.6743162 -0.547760E-04  0.139E-02    3.39       1.5  T
   5    -34.6743176 -0.136134E-05  0.600E-03    3.39       3.5  T
   6    -34.6743177 -0.145697E-06  0.179E-03    3.39      11.6  T
     SCC iter.                  ...        0 min,  0.006 sec
     gradient                   ...        0 min,  0.011 sec
 * total energy  :   -34.2511947 Eh     change       -0.1341731E-02 Eh
   gradient norm :     0.0115231 Eh/α   predicted    -0.1302433E-02 (  -2.93%)
   displ. norm   :     0.2044144 α      lambda       -0.7226020E-03
   maximum displ.:     0.1291710 α      in ANC's #4, #2, #6, ...

........................................................................
.............................. CYCLE    4 ..............................
........................................................................
   1    -34.6740159 -0.346740E+02  0.200E-01    3.40       0.0  T
   2    -34.6740389 -0.229796E-04  0.107E-01    3.41       1.0  T
   3    -34.6740196  0.193110E-04  0.463E-02    3.40       1.0  T
   4    -34.6740466 -0.270158E-04  0.156E-02    3.40       1.3  T
   5    -34.6740479 -0.134847E-05  0.556E-03    3.40       3.7  T
   6    -34.6740480 -0.100987E-06  0.160E-03    3.40      13.0  T
   7    -34.6740480 -0.464367E-08  0.801E-04    3.40      26.0  T
     SCC iter.                  ...        0 min,  0.007 sec
     gradient                   ...        0 min,  0.011 sec
 * total energy  :   -34.2517181 Eh     change       -0.5234284E-03 Eh
   gradient norm :     0.0067684 Eh/α   predicted    -0.3764104E-03 ( -28.09%)
   displ. norm   :     0.2812448 α      lambda       -0.5768970E-03
   maximum displ.:     0.1868775 α      in ANC's #4, #2, #6, ...

........................................................................
.............................. CYCLE    5 ..............................
........................................................................
   1    -34.6713423 -0.346713E+02  0.261E-01    3.42       0.0  T
   2    -34.6713718 -0.295061E-04  0.138E-01    3.43       1.0  T
   3    -34.6713316  0.402243E-04  0.619E-02    3.43       1.0  T
   4    -34.6713866 -0.549662E-04  0.181E-02    3.43       1.2  T
   5    -34.6713877 -0.116017E-05  0.524E-03    3.43       4.0  T
   6    -34.6713878 -0.993268E-07  0.178E-03    3.43      11.7  T
   7    -34.6713879 -0.366011E-08  0.814E-04    3.43      25.6  T
     SCC iter.                  ...        0 min,  0.007 sec
     gradient                   ...        0 min,  0.011 sec
 * total energy  :   -34.2520990 Eh     change       -0.3809297E-03 Eh
   gradient norm :     0.0083072 Eh/α   predicted    -0.3112647E-03 ( -18.29%)
   displ. norm   :     0.1931661 α      lambda       -0.2436341E-03
   maximum displ.:     0.1257897 α      in ANC's #4, #2, #1, ...

........................................................................
.............................. CYCLE    6 ..............................
........................................................................
   1    -34.6712039 -0.346712E+02  0.175E-01    3.46       0.0  T
   2    -34.6712155 -0.116114E-04  0.913E-02    3.46       1.0  T
   3    -34.6712009  0.145839E-04  0.378E-02    3.46       1.0  T
   4    -34.6712212 -0.202697E-04  0.117E-02    3.46       1.8  T
   5    -34.6712217 -0.455490E-06  0.311E-03    3.46       6.7  T
   6    -34.6712217 -0.642848E-07  0.116E-03    3.46      18.0  T
   7    -34.6712217 -0.253854E-08  0.536E-04    3.46      38.9  T
     SCC iter.                  ...        0 min,  0.007 sec
     gradient                   ...        0 min,  0.011 sec
 * total energy  :   -34.2522688 Eh     change       -0.1698017E-03 Eh
   gradient norm :     0.0064450 Eh/α   predicted    -0.1263649E-03 ( -25.58%)
   displ. norm   :     0.1775263 α      lambda       -0.1731959E-03
   maximum displ.:     0.1103247 α      in ANC's #4, #1, #2, ...

........................................................................
.............................. CYCLE    7 ..............................
........................................................................
   1    -34.6722567 -0.346723E+02  0.153E-01    3.48       0.0  T
   2    -34.6722647 -0.799700E-05  0.812E-02    3.48       1.0  T
   3    -34.6722619  0.280336E-05  0.224E-02    3.49       1.0  T
   4    -34.6722669 -0.500731E-05  0.105E-02    3.49       2.0  T
   5    -34.6722676 -0.680563E-06  0.300E-03    3.49       7.0  T
   6    -34.6722677 -0.646221E-07  0.115E-03    3.49      18.2  T
     SCC iter.                  ...        0 min,  0.006 sec
     gradient                   ...        0 min,  0.011 sec
 * total energy  :   -34.2523869 Eh     change       -0.1180361E-03 Eh
   gradient norm :     0.0040112 Eh/α   predicted    -0.8933223E-04 ( -24.32%)
   displ. norm   :     0.1419764 α      lambda       -0.1037307E-03
   maximum displ.:     0.0861393 α      in ANC's #1, #4, #5, ...

........................................................................
.............................. CYCLE    8 ..............................
........................................................................
   1    -34.6736269 -0.346736E+02  0.124E-01    3.49       0.0  T
   2    -34.6736311 -0.424047E-05  0.672E-02    3.50       1.0  T
   3    -34.6736317 -0.538095E-06  0.121E-02    3.50       1.7  T
   4    -34.6736321 -0.447937E-06  0.767E-03    3.50       2.7  T
   5    -34.6736326 -0.502263E-06  0.210E-03    3.50       9.9  T
   6    -34.6736326 -0.350727E-07  0.958E-04    3.50      21.8  T
     SCC iter.                  ...        0 min,  0.006 sec
     gradient                   ...        0 min,  0.011 sec
 * total energy  :   -34.2524537 Eh     change       -0.6683188E-04 Eh
   gradient norm :     0.0022863 Eh/α   predicted    -0.5291230E-04 ( -20.83%)
   displ. norm   :     0.1091077 α      lambda       -0.5182109E-04
   maximum displ.:     0.0736655 α      in ANC's #1, #4, #5, ...

........................................................................
.............................. CYCLE    9 ..............................
........................................................................
   1    -34.6740332 -0.346740E+02  0.906E-02    3.50       0.0  T
   2    -34.6740354 -0.221132E-05  0.498E-02    3.50       1.0  T
   3    -34.6740356 -0.262528E-06  0.893E-03    3.51       2.3  T
   4    -34.6740359 -0.234167E-06  0.536E-03    3.50       3.9  T
   5    -34.6740361 -0.208084E-06  0.204E-03    3.50      10.2  T
   6    -34.6740361 -0.360893E-07  0.674E-04    3.50      30.9  T
   7    -34.6740361 -0.599620E-09  0.315E-04    3.50      66.2  T
     SCC iter.                  ...        0 min,  0.007 sec
     gradient                   ...        0 min,  0.012 sec
 * total energy  :   -34.2524897 Eh     change       -0.3605437E-04 Eh
   gradient norm :     0.0025066 Eh/α   predicted    -0.2622415E-04 ( -27.26%)
   displ. norm   :     0.0937138 α      lambda       -0.3463681E-04
   maximum displ.:     0.0611484 α      in ANC's #1, #2, #4, ...

........................................................................
.............................. CYCLE   10 ..............................
........................................................................
   1    -34.6741139 -0.346741E+02  0.781E-02    3.51       0.0  T
   2    -34.6741152 -0.137819E-05  0.415E-02    3.51       1.0  T
   3    -34.6741157 -0.428023E-06  0.631E-03    3.51       3.3  T
   4    -34.6741157 -0.123570E-09  0.215E-03    3.51       9.7  T
   5    -34.6741157 -0.324044E-07  0.679E-04    3.51      30.7  T
   6    -34.6741157 -0.634444E-10  0.370E-04    3.51      56.4  T
     SCC iter.                  ...        0 min,  0.006 sec
     gradient                   ...        0 min,  0.012 sec
 * total energy  :   -34.2525165 Eh     change       -0.2673209E-04 Eh
   gradient norm :     0.0020223 Eh/α   predicted    -0.1747100E-04 ( -34.64%)
   displ. norm   :     0.1100269 α      lambda       -0.3292285E-04
   maximum displ.:     0.0674346 α      in ANC's #1, #2, #4, ...

........................................................................
.............................. CYCLE   11 ..............................
........................................................................
   1    -34.6735529 -0.346736E+02  0.100E-01    3.50       0.0  T
   2    -34.6735553 -0.242471E-05  0.525E-02    3.50       1.0  T
   3    -34.6735557 -0.397139E-06  0.937E-03    3.50       2.2  T
   4    -34.6735557 -0.605826E-07  0.609E-03    3.51       3.4  T
   5    -34.6735561 -0.318057E-06  0.153E-03    3.50      13.6  T
   6    -34.6735561 -0.249493E-07  0.620E-04    3.50      33.6  T
   7    -34.6735561 -0.531095E-09  0.249E-04    3.50      83.8  T
     SCC iter.                  ...        0 min,  0.007 sec
     gradient                   ...        0 min,  0.012 sec
 * total energy  :   -34.2525407 Eh     change       -0.2424837E-04 Eh
   gradient norm :     0.0020772 Eh/α   predicted    -0.1666126E-04 ( -31.29%)
   displ. norm   :     0.1017142 α      lambda       -0.2516702E-04
   maximum displ.:     0.0611129 α      in ANC's #1, #2, #4, ...

........................................................................
.............................. CYCLE   12 ..............................
........................................................................
   1    -34.6735383 -0.346735E+02  0.943E-02    3.51       0.0  T
   2    -34.6735406 -0.237947E-05  0.473E-02    3.51       1.0  T
   3    -34.6735403  0.322135E-06  0.104E-02    3.51       2.0  T
   4    -34.6735413 -0.931300E-06  0.570E-03    3.51       3.7  T
   5    -34.6735414 -0.153374E-06  0.120E-03    3.51      17.3  T
   6    -34.6735414 -0.108330E-07  0.507E-04    3.51      41.2  T
   7    -34.6735414 -0.314529E-09  0.214E-04    3.51      97.3  T
     SCC iter.                  ...        0 min,  0.007 sec
     gradient                   ...        0 min,  0.012 sec
 * total energy  :   -34.2525569 Eh     change       -0.1616004E-04 Eh
   gradient norm :     0.0019646 Eh/α   predicted    -0.1271582E-04 ( -21.31%)
   displ. norm   :     0.1125517 α      lambda       -0.1321608E-04
   maximum displ.:     0.0607294 α      in ANC's #2, #1, #4, ...

........................................................................
.............................. CYCLE   13 ..............................
........................................................................
   1    -34.6730267 -0.346730E+02  0.116E-01    3.50       0.0  T
   2    -34.6730306 -0.388939E-05  0.594E-02    3.50       1.0  T
   3    -34.6730290  0.163958E-05  0.161E-02    3.50       1.3  T
   4    -34.6730319 -0.287823E-05  0.754E-03    3.50       2.8  T
   5    -34.6730321 -0.203845E-06  0.205E-03    3.50      10.2  T
   6    -34.6730321 -0.329644E-07  0.687E-04    3.50      30.3  T
   7    -34.6730321 -0.881649E-09  0.334E-04    3.50      62.4  T
     SCC iter.                  ...        0 min,  0.007 sec
     gradient                   ...        0 min,  0.012 sec
 * total energy  :   -34.2525650 Eh     change       -0.8106511E-05 Eh
   gradient norm :     0.0018957 Eh/α   predicted    -0.6651055E-05 ( -17.95%)
   displ. norm   :     0.0271820 α      lambda       -0.6577506E-05
   maximum displ.:     0.0160767 α      in ANC's #5, #2, #6, ...

........................................................................
.............................. CYCLE   14 ..............................
........................................................................
   1    -34.6739126 -0.346739E+02  0.275E-02    3.51       0.0  T
   2    -34.6739131 -0.507263E-06  0.142E-02    3.51       1.5  T
   3    -34.6739131 -0.343004E-08  0.375E-03    3.51       5.6  T
   4    -34.6739132 -0.892855E-07  0.181E-03    3.51      11.6  T
   5    -34.6739132 -0.180355E-08  0.883E-04    3.51      23.6  T
   6    -34.6739132 -0.973927E-08  0.238E-04    3.51      87.5  T
     SCC iter.                  ...        0 min,  0.006 sec
     gradient                   ...        0 min,  0.012 sec
 * total energy  :   -34.2525696 Eh     change       -0.4586344E-05 Eh
   gradient norm :     0.0010897 Eh/α   predicted    -0.3293264E-05 ( -28.19%)
   displ. norm   :     0.0177751 α      lambda       -0.2234343E-05
   maximum displ.:     0.0135452 α      in ANC's #4, #5, #1, ...

........................................................................
.............................. CYCLE   15 ..............................
........................................................................
   1    -34.6736962 -0.346737E+02  0.158E-02    3.51       0.0  T
   2    -34.6736963 -0.718641E-07  0.822E-03    3.51       2.5  T
   3    -34.6736963 -0.146262E-07  0.130E-03    3.51      16.1  T
   4    -34.6736963 -0.265614E-08  0.780E-04    3.51      26.7  T
   5    -34.6736963 -0.447847E-08  0.269E-04    3.51      77.5  T
     SCC iter.                  ...        0 min,  0.005 sec
     gradient                   ...        0 min,  0.012 sec
 * total energy  :   -34.2525717 Eh     change       -0.2093935E-05 Eh
   gradient norm :     0.0005019 Eh/α   predicted    -0.1118788E-05 ( -46.57%)
   displ. norm   :     0.0201548 α      lambda       -0.1414613E-05
   maximum displ.:     0.0112080 α      in ANC's #4, #5, #1, ...

   *** GEOMETRY OPTIMIZATION CONVERGED AFTER 15 ITERATIONS ***

------------------------------------------------------------------------
 total energy gain   :        -0.0077091 Eh       -4.8375 kcal/mol
 total RMSD          :         0.3284955 a0        0.1738 Å
 total power (kW/mol):        -1.3493505 (step)  -50.4332 (real)
------------------------------------------------------------------------

 ANCopt (total)                0 d,  0 h,  0 min,  0.401 sec
 optimizer setup                ...        0 min,  0.000 sec (  0.039%)
 model hessian                  ...        0 min,  0.011 sec (  2.660%)
 ANC generation                 ...        0 min,  0.001 sec (  0.173%)
 coordinate transformation      ...        0 min,  0.000 sec (  0.071%)
 single point calculation       ...        0 min,  0.384 sec ( 95.788%)
 optimization log               ...        0 min,  0.002 sec (  0.374%)
 hessian update                 ...        0 min,  0.000 sec (  0.053%)
 rational function              ...        0 min,  0.002 sec (  0.603%)

================
 final structure:
================
$coord
    0.33465374271066    2.76400846060396   -0.09500229141986      C 
   -1.94867373290505    0.42884429741101    1.06424997470834      S 
    0.09841222364444   -2.25901253026398    0.38489694037070      C 
    2.77388806531409   -1.22451859313126    0.01094485520449      C 
    2.42969787512371    1.29312440546062   -1.40105632600198      C 
    4.32145589925600   -2.99210860264939   -1.71696927795885      C 
    3.36333438005216   -4.44131248521199   -3.19912136784727      O 
    6.83321307148979   -2.63208325057704   -1.51804344713569      N 
    4.12353281343386   -0.80591096598141    2.35770354091586      N 
    4.59146700085496   -2.85093207959952    3.93447387128926      C 
    4.87224742090255   -2.69102622507315    6.41842477876352      C 
    1.02268323982127    3.83877066043824    1.52379056258803      H 
   -0.63938676214319    4.04439771081395   -1.37456041788444      H 
   -0.55331690858241   -3.19250796379450   -1.33202886874385      H 
   -0.00724801908652   -3.57127138851473    1.96618923903683      H 
    1.88207076726992    0.86977036252879   -3.34395881580574      H 
    4.18845339998463    2.36760286950177   -1.42747524114834      H 
    7.53379656371984   -1.54098614796372   -0.12809767255598      H 
    8.00663947346211   -3.72145907463296   -2.54379218142898      H 
    3.50394152128809    0.72663847022349    3.32187716628543      H 
    4.83101686862918   -4.62557046292993    2.94649898344505      H 
    4.62360553825334   -0.93349965347495    7.41353684408625      H 
    5.38061044223393   -4.31121663080500    7.52665888108870      H 
$end
           -------------------------------------------------
          |                Final Singlepoint                |
           -------------------------------------------------

          ...................................................
          :                      SETUP                      :
          :.................................................:
          :  # basis functions                  62          :
          :  # atomic orbitals                  61          :
          :  # shells                           35          :
          :  # electrons                        62          :
          :  max. iterations                   250          :
          :  Hamiltonian                  GFN2-xTB          :
          :  restarted?                      false          :
          :  GBSA solvation                  false          :
          :  PC potential                    false          :
          :  electronic temp.          300.0000000     K    :
          :  accuracy                    1.0000000          :
          :  -> integral cutoff          0.2500000E+02      :
          :  -> integral neglect         0.1000000E-07      :
          :  -> SCF convergence          0.1000000E-05 Eh   :
          :  -> wf. convergence          0.1000000E-03 e    :
          :  Broyden damping             0.4000000          :
          ...................................................

 iter      E             dE          RMSdq      gap      omega  full diag
   1    -34.6736963 -0.346737E+02  0.112E-04    3.51       0.0  T
   2    -34.6736963 -0.103313E-10  0.497E-05    3.51     419.4  T
   3    -34.6736963  0.787992E-11  0.472E-05    3.51     441.7  T

   *** convergence criteria satisfied after 3 iterations ***

         #    Occupation            Energy/Eh            Energy/eV
      -------------------------------------------------------------
         1        2.0000           -0.7153975             -19.4670
       ...           ...                  ...                  ...
        25        2.0000           -0.4554621             -12.3938
        26        2.0000           -0.4498777             -12.2418
        27        2.0000           -0.4451108             -12.1121
        28        2.0000           -0.4351513             -11.8411
        29        2.0000           -0.4100380             -11.1577
        30        2.0000           -0.3686740             -10.0321
        31        2.0000           -0.3553625              -9.6699 (HOMO)
        32                         -0.2264499              -6.1620 (LUMO)
        33                         -0.2115862              -5.7576
        34                         -0.1931750              -5.2566
        35                         -0.1372382              -3.7344
        36                         -0.0225354              -0.6132
       ...                                ...                  ...
        61                          0.6430330              17.4978
      -------------------------------------------------------------
                  HL-Gap            0.1289126 Eh            3.5079 eV
             Fermi-level           -0.2909062 Eh           -7.9160 eV

 SCC (total)                   0 d,  0 h,  0 min,  0.024 sec
 SCC setup                      ...        0 min,  0.000 sec (  0.790%)
 Dispersion                     ...        0 min,  0.000 sec (  0.790%)
 integral evaluation            ...        0 min,  0.007 sec ( 31.363%)
 zeroth order Hamiltonian       ...        0 min,  0.000 sec (  0.611%)
 iterations                     ...        0 min,  0.004 sec ( 15.463%)
 molecular gradient             ...        0 min,  0.012 sec ( 49.280%)
 printout                       ...        0 min,  0.000 sec (  1.490%)

         :::::::::::::::::::::::::::::::::::::::::::::::::::::
         ::                     SUMMARY                     ::
         :::::::::::::::::::::::::::::::::::::::::::::::::::::
         :: total energy             -34.252571689691 Eh    ::
         :: gradient norm              0.000504817134 Eh/a0 ::
         :: HOMO-LUMO gap              3.507889981108 eV    ::
         ::.................................................::
         :: SCC energy               -34.673696287946 Eh    ::
         :: -> isotropic ES            0.050398914501 Eh    ::
         :: -> anisotropic ES          0.003745136270 Eh    ::
         :: -> anisotropic XC          0.019169291216 Eh    ::
         :: -> dispersion             -0.021768965582 Eh    ::
         :: repulsion energy           0.420923467836 Eh    ::
         :: add. restraining           0.000000000000 Eh    ::
         :::::::::::::::::::::::::::::::::::::::::::::::::::::

           -------------------------------------------------
          |                Property Printout                |
           -------------------------------------------------

    * Orbital Energies and Occupations

         #    Occupation            Energy/Eh            Energy/eV
      -------------------------------------------------------------
         1        2.0000           -0.7153975             -19.4670
       ...           ...                  ...                  ...
        19        2.0000           -0.5062603             -13.7760
        20        2.0000           -0.4863587             -13.2345
        21        2.0000           -0.4827410             -13.1361
        22        2.0000           -0.4805045             -13.0752
        23        2.0000           -0.4699174             -12.7871
        24        2.0000           -0.4646848             -12.6447
        25        2.0000           -0.4554621             -12.3938
        26        2.0000           -0.4498777             -12.2418
        27        2.0000           -0.4451108             -12.1121
        28        2.0000           -0.4351513             -11.8411
        29        2.0000           -0.4100380             -11.1577
        30        2.0000           -0.3686740             -10.0321
        31        2.0000           -0.3553625              -9.6699 (HOMO)
        32                         -0.2264499              -6.1620 (LUMO)
        33                         -0.2115862              -5.7576
        34                         -0.1931750              -5.2566
        35                         -0.1372382              -3.7344
        36                         -0.0225354              -0.6132
        37                         -0.0061900              -0.1684
        38                          0.0074453               0.2026
        39                          0.0177433               0.4828
        40                          0.0185315               0.5043
        41                          0.0543809               1.4798
        42                          0.0617640               1.6807
       ...                                ...                  ...
        61                          0.6430330              17.4978
      -------------------------------------------------------------
                  HL-Gap            0.1289126 Eh            3.5079 eV
             Fermi-level           -0.2909062 Eh           -7.9160 eV

     #   Z        covCN         q      C6AA      α(0)
     1   6 C      3.798    -0.007    20.704     6.479
     2  16 S      2.058    -0.211   150.067    20.618
     3   6 C      3.806    -0.011    20.774     6.488
     4   6 C      3.908     0.057    19.566     6.287
     5   6 C      3.879    -0.058    21.562     6.602
     6   6 C      2.749     0.278    22.297     7.732
     7   8 O      0.858    -0.422    22.133     6.308
     8   7 N      2.638    -0.265    26.866     7.698
     9   7 N      2.690    -0.217    25.738     7.535
    10   6 C      2.825     0.025    27.438     8.583
    11   6 C      2.839    -0.132    31.360     9.177
    12   1 H      0.925     0.041     2.437     2.441
    13   1 H      0.925     0.053     2.287     2.365
    14   1 H      0.925     0.068     2.106     2.270
    15   1 H      0.925     0.050     2.317     2.381
    16   1 H      0.924     0.055     2.254     2.348
    17   1 H      0.924     0.046     2.372     2.409
    18   1 H      0.860     0.199     1.109     1.649
    19   1 H      0.860     0.199     1.113     1.653
    20   1 H      0.860     0.164     1.311     1.794
    21   1 H      0.925     0.026     2.650     2.546
    22   1 H      0.926     0.030     2.593     2.518
    23   1 H      0.926     0.034     2.531     2.488

 Mol. C6AA /au·bohr⁶  :       6070.550541
 Mol. C8AA /au·bohr⁸  :     156102.662439
 Mol. α(0) /au        :        120.367581


Wiberg/Mayer (AO) data.
largest (>0.10) Wiberg bond orders for each atom
          total WBO             WBO to atom ...
     1  C   3.985        C    5 1.012    S    2 0.984    H   12 0.977    H   13 0.977
     2  S   2.061        C    3 0.988    C    1 0.984
     3  C   3.977        S    2 0.988    C    4 0.978    H   15 0.974    H   14 0.970
     4  C   3.979        N    9 0.992    C    3 0.978    C    5 0.965    C    6 0.913
     5  C   3.994        C    1 1.012    H   16 0.975    H   17 0.970    C    4 0.965
     6  C   3.950        O    7 1.709    N    8 1.270    C    4 0.913
     7  O   2.024        C    6 1.709    N    8 0.204
     8  N   3.385        C    6 1.270    H   19 0.939    H   18 0.935    O    7 0.204
     9  N   3.281        C   10 1.123    C    4 0.992    H   20 0.938    C   11 0.130
    10  C   3.972        C   11 1.862    N    9 1.123    H   21 0.961
    11  C   3.978        C   10 1.862    H   23 0.978    H   22 0.975    N    9 0.130
    12  H   0.998        C    1 0.977
    13  H   0.997        C    1 0.977
    14  H   0.995        C    3 0.970
    15  H   0.997        C    3 0.974
    16  H   0.996        C    5 0.975
    17  H   0.998        C    5 0.970
    18  H   0.960        N    8 0.935
    19  H   0.959        N    8 0.939
    20  H   0.973        N    9 0.938
    21  H   0.999        C   10 0.961
    22  H   0.999        C   11 0.975
    23  H   0.998        C   11 0.978

molecular dipole:
                 x           y           z       tot (Debye)
 q only:        1.349       0.882       0.179
   full:        1.678       0.924       0.243       4.908
molecular quadrupole (traceless):
                xx          xy          yy          xz          yz          zz
 q only:       12.279       1.187      -5.000       0.054      -4.461      -7.279
  q+dip:       10.371       0.873      -4.509       1.948      -4.925      -5.862
   full:       11.056       0.872      -3.791       1.280      -5.809      -7.265

           -------------------------------------------------
          |                Geometry Summary                 |
           -------------------------------------------------

      molecular mass/u    :      172.2446000
   center of mass at/Å    :        1.2847115      -0.6488774       0.3068302
  moments of inertia/u·Å² :        0.4353030E+03   0.5901541E+03   0.8034170E+03
rotational constants/cm⁻¹ :        0.3872620E-01   0.2856480E-01   0.2098242E-01

 * 20 selected distances

     #   Z        #   Z                                     value/Å
     3   6 C      4   6 C                                 1.5307946
     1   6 C      5   6 C                                 1.5207276
     4   6 C      5   6 C                                 1.5383266 (max)
     6   6 C      7   8 O                                 1.2084448
     6   6 C      8   7 N                                 1.3468693
     4   6 C      9   7 N                                 1.4496028
     9   7 N     10   6 C                                 1.3887529
    10   6 C     11   6 C                                 1.3255251
     1   6 C     12   1 H                                 1.0907971
     1   6 C     13   1 H                                 1.0877677
     3   6 C     14   1 H                                 1.0901564
     3   6 C     15   1 H                                 1.0888293
     5   6 C     16   1 H                                 1.0914394
     5   6 C     17   1 H                                 1.0907244
     8   7 N     18   1 H                                 1.0058906 (min)
     8   7 N     19   1 H                                 1.0062483
     9   7 N     20   1 H                                 1.0126843
    10   6 C     21   1 H                                 1.0822703
    11   6 C     22   1 H                                 1.0768426
    11   6 C     23   1 H                                 1.0730213

 * 5 distinct bonds (by element types)

   Z      Z             #   av. dist./Å        max./Å        min./Å
   1 H    6 C           9     1.0857609     1.0914394     1.0730213
   6 C    6 C           4     1.4788435     1.5383266     1.3255251
   1 H    7 N           3     1.0082744     1.0126843     1.0058906
   6 C    7 N           3     1.3950750     1.4496028     1.3468693
   6 C    8 O           1     1.2084448     1.2084448     1.2084448


optimized geometry written to: xtbopt.xyz


           -------------------------------------------------
          | TOTAL ENERGY              -34.252571689691 Eh   |
          | GRADIENT NORM               0.000504817134 Eh/α |
          | HOMO-LUMO GAP               3.507889981108 eV   |
           -------------------------------------------------

------------------------------------------------------------------------
 * finished run on 2021/05/19 at 11:01:06.502     
------------------------------------------------------------------------
 total:
 * wall-time:     0 d,  0 h,  0 min,  0.484 sec
 *  cpu-time:     0 d,  0 h,  0 min,  0.478 sec
 * ratio c/w:     0.987 speedup
 SCF:
 * wall-time:     0 d,  0 h,  0 min,  0.034 sec
 *  cpu-time:     0 d,  0 h,  0 min,  0.034 sec
 * ratio c/w:     0.999 speedup
 ANC optimizer:
 * wall-time:     0 d,  0 h,  0 min,  0.425 sec
 *  cpu-time:     0 d,  0 h,  0 min,  0.425 sec
 * ratio c/w:     0.999 speedup

