      -----------------------------------------------------------      
     |                   =====================                   |     
     |                           x T B                           |     
     |                   =====================                   |     
     |                         S. Grimme                         |     
     |          Mulliken Center for Theoretical Chemistry        |     
     |                    University of Bonn                     |     
     |                Version 6.2 RC2 (SAW190805)                |     
      -----------------------------------------------------------      

   This program is distributed in the hope that it will be useful,
   but WITHOUT ANY WARRANTY; without even the implied warranty of
   MERCHANTABILITY or FITNESS FOR A PARTICULAR PURPOSE.
   
   FOR NON-COMMERCIAL, ACADEMIA USE ONLY.
   
   Cite this work as:
   * S. Grimme, C. Bannwarth, P. Shushkov, J. Chem. Theory Comput., 2017,
     13, 1989-2009. DOI: 10.1021/acs.jctc.7b00118
   * C. Bannwarth, S. Ehlert and S. Grimme., J. Chem. Theory Comput., 2019,
     15, 1652-1671. DOI: 10.1021/acs.jctc.8b01176
   * P. Pracht, E. Caldeweyher, S. Ehlert, S. Grimme, ChemRxiv, 2019, preprint.
     DOI: 10.26434/chemrxiv.8326202.v1
   
   for DFT-D4:
   * E. Caldeweyher, C. Bannwarth and S. Grimme, J. Chem. Phys., 2017,
     147, 034112. DOI: 10.1063/1.4993215
   * E. Caldeweyher, S. Ehlert, A. Hansen, H. Neugebauer, S. Spicher,
     C. Bannwarth and S. Grimme, J. Chem. Phys., 2019, 150, 154122.
     DOI: 10.1063/1.5090222
   
   for sTDA-xTB:
   * S. Grimme and C. Bannwarth, J. Chem. Phys., 2016, 145, 054103.
     DOI: 10.1063/1.4959605
   
   in the mass-spec context:
   * V. Asgeirsson, C. Bauer and S. Grimme, Chem. Sci., 2017, 8, 4879.
     DOI: 10.1039/c7sc00601b
   
   for metadynamics refer to:
   * S. Grimme, J. Chem. Theory Comput., 2019, 155, 2847-2862
     DOI: 10.1021/acs.jctc.9b00143
   
   with help from (in alphabetical order)
   C. Bannwarth, F. Bohle, G. Brandenburg, E. Caldeweyher, M. Checinski,
   S. Dohm, S. Ehlert, S. Ehrlich, F. März, H. Neugebauer, J. Pisarek,
   P. Pracht, P. Shushkov, and S. Spicher.
   
 * started run on 2021/05/19 at 11:01:06.564     

           -------------------------------------------------
          |                Calculation Setup                |
           -------------------------------------------------

          program call               : /ihome/ghutchison/geoffh/xtb/xtb 797.xyz -opt
          hostname                   : smp-n83
          coordinate file            : 797.xyz
          omp threads                :                     1
          number of atoms            :                    29
          number of electrons        :                    84
          charge                     :                     0
          spin                       :                   0.0
          first test random number   :      0.63268742979431


########################################################################
# WARNING! Please study the warnings concerning your input carefully
#  - the use of '-opt' is discouraged, please use '--opt' next time
########################################################################

           ------------------------------------------------- 
          |                 G F N 2 - x T B                 |
          | Geometry, Frequencies, Noncovalent interactions |
          |            JCTC 2019 parametrisation            |
           ------------------------------------------------- 
             KAB for C  - Si     :                1.0500
             KAB for H  - Pd     :                0.9500
             k(s)              :                1.8500
             k(p)              :                2.2300
             k(d)              :                2.2300
             k(f)              :                2.0000
             kEN (H0ij)        :               -2.0000
             D4 a1             :                0.5200
             D4 a2             :                5.0000
             D4 s6             :                1.0000
             D4 s8             :                2.7000
             D4 s9             :                5.0000
             alphaj            :                2.0000

  Z AO/shell   Hii/eV     exponent
  1     Wed Apr 25 08:07:45 CEST 2018   EN: 2.200 GM2: 0.406  GM3: 0.0800  RAES: 1.40
     1s    -10.707211    1.230000
  6     Wed Apr 25 08:07:45 CEST 2018   EN: 2.550 GM2: 0.538  GM3: 0.1500  RAES: 3.00
     2s    -13.970922    2.096432
     2p    -10.063292    1.800000
  7     Wed Apr 25 08:07:45 CEST 2018   EN: 3.040 GM2: 0.461  GM3:-0.0640  RAES: 1.90
     2s    -16.686243    2.339881
     2p    -12.523956    2.014332
  8     Wed Apr 25 08:07:45 CEST 2018   EN: 3.440 GM2: 0.452  GM3:-0.0517  RAES: 1.80
     2s    -20.229985    2.439742
     2p    -15.503117    2.137023
 16     Tue Apr 24 11:44:34 CEST 2018   EN: 2.580 GM2: 0.340  GM3:-0.0502  RAES: 3.10
     3s    -20.029654    1.981333
     3p    -11.377694    2.025643
     3d     -0.420282    1.702555

           ------------------------------------------------- 
          |        Self-Consistent Charge Iterations        |
           ------------------------------------------------- 

          ...................................................
          :                      SETUP                      :
          :.................................................:
          :  # basis functions                  83          :
          :  # atomic orbitals                  82          :
          :  # shells                           46          :
          :  # electrons                        84          :
          :  max. iterations                   250          :
          :  Hamiltonian                  GFN2-xTB          :
          :  restarted?                      false          :
          :  GBSA solvation                  false          :
          :  PC potential                    false          :
          :  electronic temp.          300.0000000     K    :
          :  accuracy                    1.0000000          :
          :  -> integral cutoff          0.2500000E+02      :
          :  -> integral neglect         0.1000000E-07      :
          :  -> SCF convergence          0.1000000E-05 Eh   :
          :  -> wf. convergence          0.1000000E-03 e    :
          :  Broyden damping             0.4000000          :
          ...................................................

 iter      E             dE          RMSdq      gap      omega  full diag
   1    -46.7353908 -0.467354E+02  0.425E+00    1.77       0.0  T
   2    -46.7829450 -0.475542E-01  0.251E+00    1.79       1.0  T
   3    -46.7651977  0.177473E-01  0.138E+00    1.54       1.0  T
   4    -46.7881704 -0.229727E-01  0.640E-01    1.57       1.0  T
   5    -46.7964344 -0.826404E-02  0.268E-01    1.55       1.0  T
   6    -46.7979241 -0.148962E-02  0.998E-02    1.55       1.0  T
   7    -46.7980666 -0.142485E-03  0.425E-02    1.55       1.0  T
   8    -46.7980931 -0.265057E-04  0.167E-02    1.56       1.1  T
   9    -46.7980969 -0.384111E-05  0.831E-03    1.56       2.2  T
  10    -46.7980970 -0.682045E-07  0.430E-03    1.56       4.3  T
  11    -46.7980972 -0.265939E-06  0.169E-03    1.56      11.0  T
  12    -46.7980973 -0.354427E-07  0.708E-04    1.56      26.2  T
  13    -46.7980973 -0.340252E-08  0.318E-04    1.56      58.4  T

   *** convergence criteria satisfied after 13 iterations ***

         #    Occupation            Energy/Eh            Energy/eV
      -------------------------------------------------------------
         1        2.0000           -0.7437763             -20.2392
       ...           ...                  ...                  ...
        36        2.0000           -0.4428403             -12.0503
        37        2.0000           -0.4284525             -11.6588
        38        2.0000           -0.4275488             -11.6342
        39        2.0000           -0.3987904             -10.8516
        40        2.0000           -0.3821904             -10.3999
        41        2.0000           -0.3735049             -10.1636
        42        2.0000           -0.3697162             -10.0605 (HOMO)
        43                         -0.3124628              -8.5025 (LUMO)
        44                         -0.2519904              -6.8570
        45                         -0.2212107              -6.0194
        46                         -0.2102449              -5.7211
        47                         -0.1817744              -4.9463
       ...                                ...                  ...
        82                          0.6910467              18.8043
      -------------------------------------------------------------
                  HL-Gap            0.0572533 Eh            1.5579 eV
             Fermi-level           -0.3410895 Eh           -9.2815 eV

 SCC (total)                   0 d,  0 h,  0 min,  0.053 sec
 SCC setup                      ...        0 min,  0.000 sec (  0.669%)
 Dispersion                     ...        0 min,  0.000 sec (  0.911%)
 integral evaluation            ...        0 min,  0.013 sec ( 24.986%)
 zeroth order Hamiltonian       ...        0 min,  0.000 sec (  0.441%)
 iterations                     ...        0 min,  0.020 sec ( 37.968%)
 molecular gradient             ...        0 min,  0.018 sec ( 34.112%)
 printout                       ...        0 min,  0.000 sec (  0.811%)

         :::::::::::::::::::::::::::::::::::::::::::::::::::::
         ::                     SUMMARY                     ::
         :::::::::::::::::::::::::::::::::::::::::::::::::::::
         :: total energy             -46.215882147628 Eh    ::
         :: gradient norm              0.127788623680 Eh/a0 ::
         :: HOMO-LUMO gap              1.557942680357 eV    ::
         ::.................................................::
         :: SCC energy               -46.798097275610 Eh    ::
         :: -> isotropic ES            0.044105249202 Eh    ::
         :: -> anisotropic ES          0.002046394708 Eh    ::
         :: -> anisotropic XC          0.030910275723 Eh    ::
         :: -> dispersion             -0.028834971794 Eh    ::
         :: repulsion energy           0.582187354882 Eh    ::
         :: add. restraining           0.000000000000 Eh    ::
         :::::::::::::::::::::::::::::::::::::::::::::::::::::

      ----------------------------------------------------------- 
     |                   =====================                   |
     |                        A N C O P T                        |
     |                   =====================                   |
     |               Approximate Normal Coordinate               |
     |                Rational Function Optimizer                |
      ----------------------------------------------------------- 

          ...................................................
          :                      SETUP                      :
          :.................................................:
          :   optimization level            normal          :
          :   max. optcycles                   200          :
          :   ANC micro-cycles                  20          :
          :   degrees of freedom                81          :
          :.................................................:
          :   RF solver                   davidson          :
          :   input Hessian                  false          :
          :   write xtbopt.log                true          :
          :   linear?                        false          :
          :   energy convergence         0.5000000E-05 Eh   :
          :   grad. convergence          0.1000000E-02 Eh/α :
          :   maximium RF displ.         2.0000000          :
          :   Hlow (freq-cutoff)         0.5000000E-02      :
          :   Hmax (freq-cutoff)         5.0000000          :
          :   S6 in model hess.         20.0000000          :
          ...................................................

generating ANC from model Hessian ...
Using Lindh-Hessian (1995)
 Shifting diagonal of input Hessian by   4.367898232906003E-003
 Lowest  eigenvalues of input Hessian
   -0.000000   -0.000000   -0.000000    0.000000    0.000000    0.000000
    0.005000    0.006000    0.006367    0.006730    0.007047    0.007504
    0.009413    0.010997    0.012983    0.014538    0.017257    0.020713
 Highest eigenvalues
    1.729222    1.804976    1.896930    1.960926    2.000362    2.108391
 

........................................................................
.............................. CYCLE    1 ..............................
........................................................................
   1    -46.7980973 -0.467981E+02  0.114E-04    1.56       0.0  T
   2    -46.7980973 -0.765965E-11  0.750E-05    1.56     247.6  T
   3    -46.7980973 -0.785292E-10  0.597E-05    1.56     310.8  T
     SCC iter.                  ...        0 min,  0.005 sec
     gradient                   ...        0 min,  0.018 sec
 * total energy  :   -46.2158822 Eh     change       -0.3284498E-08 Eh
   gradient norm :     0.1277889 Eh/α   predicted     0.0000000E+00 (-100.00%)
   displ. norm   :     0.2248070 α      lambda       -0.1690254E-01
   maximum displ.:     0.0776970 α      in ANC's #53, #15, #55, ...

........................................................................
.............................. CYCLE    2 ..............................
........................................................................
   1    -46.8356467 -0.468356E+02  0.347E-01    1.60       0.0  T
   2    -46.8358426 -0.195851E-03  0.215E-01    1.61       1.0  T
   3    -46.8360676 -0.225015E-03  0.142E-01    1.60       1.0  T
   4    -46.8363743 -0.306695E-03  0.258E-02    1.59       1.0  T
   5    -46.8363822 -0.789530E-05  0.138E-02    1.59       1.3  T
   6    -46.8363838 -0.158211E-05  0.789E-03    1.59       2.4  T
   7    -46.8363848 -0.105423E-05  0.265E-03    1.59       7.0  T
   8    -46.8363849 -0.104172E-06  0.120E-03    1.59      15.5  T
     SCC iter.                  ...        0 min,  0.012 sec
     gradient                   ...        0 min,  0.017 sec
 * total energy  :   -46.2279572 Eh     change       -0.1207506E-01 Eh
   gradient norm :     0.0646525 Eh/α   predicted    -0.8878383E-02 ( -26.47%)
   displ. norm   :     0.2119169 α      lambda       -0.6272939E-02
   maximum displ.:     0.0765317 α      in ANC's #7, #8, #9, ...

........................................................................
.............................. CYCLE    3 ..............................
........................................................................
   1    -46.8587845 -0.468588E+02  0.287E-01    1.59       0.0  T
   2    -46.8589769 -0.192346E-03  0.168E-01    1.59       1.0  T
   3    -46.8590851 -0.108235E-03  0.114E-01    1.59       1.0  T
   4    -46.8592562 -0.171037E-03  0.249E-02    1.58       1.0  T
   5    -46.8592669 -0.107191E-04  0.115E-02    1.58       1.6  T
   6    -46.8592690 -0.210515E-05  0.525E-03    1.58       3.5  T
   7    -46.8592692 -0.253352E-06  0.245E-03    1.58       7.6  T
     SCC iter.                  ...        0 min,  0.010 sec
     gradient                   ...        0 min,  0.017 sec
 * total energy  :   -46.2311170 Eh     change       -0.3159751E-02 Eh
   gradient norm :     0.0159709 Eh/α   predicted    -0.3277330E-02 (   3.72%)
   displ. norm   :     0.1778949 α      lambda       -0.6795007E-03
   maximum displ.:     0.0795190 α      in ANC's #5, #7, #4, ...

........................................................................
.............................. CYCLE    4 ..............................
........................................................................
   1    -46.8565675 -0.468566E+02  0.950E-02    1.58       0.0  T
   2    -46.8565735 -0.601517E-05  0.554E-02    1.57       1.0  T
   3    -46.8565697  0.384393E-05  0.151E-02    1.58       1.2  T
   4    -46.8565742 -0.455894E-05  0.506E-03    1.58       3.7  T
   5    -46.8565747 -0.479899E-06  0.178E-03    1.58      10.4  T
   6    -46.8565747 -0.161041E-07  0.920E-04    1.58      20.2  T
     SCC iter.                  ...        0 min,  0.009 sec
     gradient                   ...        0 min,  0.017 sec
 * total energy  :   -46.2316125 Eh     change       -0.4955075E-03 Eh
   gradient norm :     0.0074419 Eh/α   predicted    -0.3505037E-03 ( -29.26%)
   displ. norm   :     0.3066225 α      lambda       -0.6785278E-03
   maximum displ.:     0.1435008 α      in ANC's #5, #7, #4, ...

........................................................................
.............................. CYCLE    5 ..............................
........................................................................
   1    -46.8526226 -0.468526E+02  0.169E-01    1.57       0.0  T
   2    -46.8526309 -0.826023E-05  0.985E-02    1.57       1.0  T
   3    -46.8526246  0.631194E-05  0.190E-02    1.58       1.0  T
   4    -46.8526322 -0.766259E-05  0.637E-03    1.57       2.9  T
   5    -46.8526329 -0.684759E-06  0.264E-03    1.58       7.0  T
   6    -46.8526330 -0.439725E-07  0.132E-03    1.58      14.1  T
     SCC iter.                  ...        0 min,  0.009 sec
     gradient                   ...        0 min,  0.017 sec
 * total energy  :   -46.2320061 Eh     change       -0.3935876E-03 Eh
   gradient norm :     0.0096387 Eh/α   predicted    -0.3711765E-03 (  -5.69%)
   displ. norm   :     0.2341772 α      lambda       -0.3592291E-03
   maximum displ.:     0.1125102 α      in ANC's #5, #6, #4, ...

........................................................................
.............................. CYCLE    6 ..............................
........................................................................
   1    -46.8528281 -0.468528E+02  0.122E-01    1.58       0.0  T
   2    -46.8528312 -0.309015E-05  0.708E-02    1.58       1.0  T
   3    -46.8528212  0.999378E-05  0.197E-02    1.58       1.0  T
   4    -46.8528321 -0.108543E-04  0.585E-03    1.58       3.2  T
   5    -46.8528327 -0.583325E-06  0.279E-03    1.58       6.7  T
   6    -46.8528328 -0.138858E-06  0.116E-03    1.58      16.0  T
     SCC iter.                  ...        0 min,  0.009 sec
     gradient                   ...        0 min,  0.017 sec
 * total energy  :   -46.2322705 Eh     change       -0.2644771E-03 Eh
   gradient norm :     0.0109661 Eh/α   predicted    -0.1894655E-03 ( -28.36%)
   displ. norm   :     0.3359084 α      lambda       -0.4981207E-03
   maximum displ.:     0.1627627 α      in ANC's #5, #1, #4, ...

........................................................................
.............................. CYCLE    7 ..............................
........................................................................
   1    -46.8546591 -0.468547E+02  0.168E-01    1.59       0.0  T
   2    -46.8546637 -0.461872E-05  0.972E-02    1.59       1.0  T
   3    -46.8546361  0.276528E-04  0.336E-02    1.59       1.0  T
   4    -46.8546666 -0.305742E-04  0.622E-03    1.59       3.0  T
   5    -46.8546669 -0.266287E-06  0.373E-03    1.59       5.0  T
   6    -46.8546671 -0.226322E-06  0.142E-03    1.59      13.1  T
   7    -46.8546671 -0.190448E-07  0.412E-04    1.59      45.0  T
     SCC iter.                  ...        0 min,  0.010 sec
     gradient                   ...        0 min,  0.017 sec
 * total energy  :   -46.2326517 Eh     change       -0.3811277E-03 Eh
   gradient norm :     0.0088770 Eh/α   predicted    -0.2771825E-03 ( -27.27%)
   displ. norm   :     0.4641639 α      lambda       -0.5002597E-03
   maximum displ.:     0.2333716 α      in ANC's #5, #1, #4, ...

........................................................................
.............................. CYCLE    8 ..............................
........................................................................
   1    -46.8535195 -0.468535E+02  0.216E-01    1.60       0.0  T
   2    -46.8535256 -0.611125E-05  0.126E-01    1.60       1.0  T
   3    -46.8535173  0.828118E-05  0.195E-02    1.60       1.0  T
   4    -46.8535280 -0.106867E-04  0.600E-03    1.60       3.1  T
   5    -46.8535283 -0.336881E-06  0.358E-03    1.60       5.2  T
   6    -46.8535285 -0.159588E-06  0.165E-03    1.60      11.3  T
   7    -46.8535285 -0.335944E-07  0.528E-04    1.60      35.2  T
     SCC iter.                  ...        0 min,  0.011 sec
     gradient                   ...        0 min,  0.017 sec
 * total energy  :   -46.2329856 Eh     change       -0.3339458E-03 Eh
   gradient norm :     0.0094131 Eh/α   predicted    -0.3040250E-03 (  -8.96%)
   displ. norm   :     0.3268453 α      lambda       -0.4628075E-03
   maximum displ.:     0.1721720 α      in ANC's #1, #5, #3, ...

........................................................................
.............................. CYCLE    9 ..............................
........................................................................
   1    -46.8586064 -0.468586E+02  0.150E-01    1.60       0.0  T
   2    -46.8586106 -0.427489E-05  0.866E-02    1.60       1.0  T
   3    -46.8585666  0.440482E-04  0.438E-02    1.60       1.0  T
   4    -46.8586142 -0.475953E-04  0.779E-03    1.60       2.4  T
   5    -46.8586152 -0.103615E-05  0.298E-03    1.60       6.2  T
   6    -46.8586153 -0.879455E-07  0.163E-03    1.60      11.4  T
     SCC iter.                  ...        0 min,  0.009 sec
     gradient                   ...        0 min,  0.017 sec
 * total energy  :   -46.2332187 Eh     change       -0.2330850E-03 Eh
   gradient norm :     0.0089451 Eh/α   predicted    -0.2561300E-03 (   9.89%)
   displ. norm   :     0.3680230 α      lambda       -0.2658575E-03
   maximum displ.:     0.1802016 α      in ANC's #1, #5, #4, ...

........................................................................
.............................. CYCLE   10 ..............................
........................................................................
   1    -46.8549691 -0.468550E+02  0.164E-01    1.60       0.0  T
   2    -46.8549722 -0.310868E-05  0.957E-02    1.60       1.0  T
   3    -46.8549707  0.147440E-05  0.103E-02    1.60       1.8  T
   4    -46.8549733 -0.260526E-05  0.432E-03    1.60       4.3  T
   5    -46.8549735 -0.144999E-06  0.225E-03    1.60       8.2  T
   6    -46.8549735 -0.581674E-07  0.130E-03    1.60      14.3  T
     SCC iter.                  ...        0 min,  0.009 sec
     gradient                   ...        0 min,  0.017 sec
 * total energy  :   -46.2333622 Eh     change       -0.1434823E-03 Eh
   gradient norm :     0.0092372 Eh/α   predicted    -0.1509500E-03 (   5.20%)
   displ. norm   :     0.1337758 α      lambda       -0.2147442E-03
   maximum displ.:     0.0870725 α      in ANC's #1, #4, #8, ...

........................................................................
.............................. CYCLE   11 ..............................
........................................................................
   1    -46.8580706 -0.468581E+02  0.595E-02    1.60       0.0  T
   2    -46.8580727 -0.207141E-05  0.343E-02    1.59       1.0  T
   3    -46.8580668  0.587704E-05  0.165E-02    1.60       1.1  T
   4    -46.8580734 -0.653296E-05  0.449E-03    1.59       4.1  T
   5    -46.8580736 -0.220225E-06  0.265E-03    1.59       7.0  T
   6    -46.8580737 -0.118878E-06  0.814E-04    1.59      22.8  T
     SCC iter.                  ...        0 min,  0.009 sec
     gradient                   ...        0 min,  0.017 sec
 * total energy  :   -46.2334685 Eh     change       -0.1063255E-03 Eh
   gradient norm :     0.0060432 Eh/α   predicted    -0.1092948E-03 (   2.79%)
   displ. norm   :     0.2468354 α      lambda       -0.1911311E-03
   maximum displ.:     0.1551502 α      in ANC's #1, #4, #3, ...

........................................................................
.............................. CYCLE   12 ..............................
........................................................................
   1    -46.8576056 -0.468576E+02  0.114E-01    1.59       0.0  T
   2    -46.8576089 -0.333021E-05  0.661E-02    1.59       1.0  T
   3    -46.8575959  0.130456E-04  0.244E-02    1.59       1.0  T
   4    -46.8576100 -0.141401E-04  0.593E-03    1.59       3.1  T
   5    -46.8576105 -0.499996E-06  0.247E-03    1.59       7.5  T
   6    -46.8576106 -0.541205E-07  0.122E-03    1.59      15.3  T
     SCC iter.                  ...        0 min,  0.009 sec
     gradient                   ...        0 min,  0.017 sec
 * total energy  :   -46.2335740 Eh     change       -0.1054763E-03 Eh
   gradient norm :     0.0060905 Eh/α   predicted    -0.1013891E-03 (  -3.87%)
   displ. norm   :     0.2144480 α      lambda       -0.1071578E-03
   maximum displ.:     0.1375994 α      in ANC's #1, #4, #3, ...

........................................................................
.............................. CYCLE   13 ..............................
........................................................................
   1    -46.8577771 -0.468578E+02  0.919E-02    1.59       0.0  T
   2    -46.8577787 -0.160469E-05  0.523E-02    1.59       1.0  T
   3    -46.8577786  0.622380E-07  0.734E-03    1.59       2.5  T
   4    -46.8577791 -0.484313E-06  0.388E-03    1.59       4.8  T
   5    -46.8577792 -0.116591E-06  0.157E-03    1.59      11.8  T
   6    -46.8577793 -0.516040E-07  0.566E-04    1.59      32.8  T
     SCC iter.                  ...        0 min,  0.009 sec
     gradient                   ...        0 min,  0.017 sec
 * total energy  :   -46.2336369 Eh     change       -0.6294807E-04 Eh
   gradient norm :     0.0058014 Eh/α   predicted    -0.5604469E-04 ( -10.97%)
   displ. norm   :     0.2622046 α      lambda       -0.1173897E-03
   maximum displ.:     0.1825377 α      in ANC's #1, #4, #3, ...

........................................................................
.............................. CYCLE   14 ..............................
........................................................................
   1    -46.8575562 -0.468576E+02  0.109E-01    1.60       0.0  T
   2    -46.8575582 -0.191250E-05  0.627E-02    1.60       1.0  T
   3    -46.8575574  0.798160E-06  0.833E-03    1.60       2.2  T
   4    -46.8575586 -0.128528E-05  0.397E-03    1.60       4.7  T
   5    -46.8575589 -0.212544E-06  0.144E-03    1.60      12.9  T
   6    -46.8575589 -0.171809E-07  0.779E-04    1.60      23.8  T
     SCC iter.                  ...        0 min,  0.009 sec
     gradient                   ...        0 min,  0.017 sec
 * total energy  :   -46.2337222 Eh     change       -0.8524505E-04 Eh
   gradient norm :     0.0046110 Eh/α   predicted    -0.6273219E-04 ( -26.41%)
   displ. norm   :     0.3047963 α      lambda       -0.1575557E-03
   maximum displ.:     0.2168824 α      in ANC's #1, #4, #3, ...

........................................................................
.............................. CYCLE   15 ..............................
........................................................................
   1    -46.8600420 -0.468600E+02  0.124E-01    1.61       0.0  T
   2    -46.8600459 -0.387695E-05  0.699E-02    1.61       1.0  T
   3    -46.8600425  0.344237E-05  0.149E-02    1.61       1.2  T
   4    -46.8600471 -0.463452E-05  0.632E-03    1.61       2.9  T
   5    -46.8600475 -0.361498E-06  0.214E-03    1.61       8.7  T
   6    -46.8600475 -0.542042E-07  0.106E-03    1.61      17.5  T
     SCC iter.                  ...        0 min,  0.009 sec
     gradient                   ...        0 min,  0.017 sec
 * total energy  :   -46.2338082 Eh     change       -0.8598506E-04 Eh
   gradient norm :     0.0050702 Eh/α   predicted    -0.8609679E-04 (   0.13%)
   displ. norm   :     0.4298082 α      lambda       -0.1188945E-03
   maximum displ.:     0.2896141 α      in ANC's #1, #4, #3, ...

........................................................................
.............................. CYCLE   16 ..............................
........................................................................
   1    -46.8547889 -0.468548E+02  0.180E-01    1.61       0.0  T
   2    -46.8547950 -0.613109E-05  0.103E-01    1.61       1.0  T
   3    -46.8547960 -0.961507E-06  0.110E-02    1.61       1.7  T
   4    -46.8547962 -0.157026E-06  0.692E-03    1.61       2.7  T
   5    -46.8547970 -0.822033E-06  0.236E-03    1.61       7.9  T
   6    -46.8547971 -0.964971E-07  0.108E-03    1.61      17.2  T
     SCC iter.                  ...        0 min,  0.009 sec
     gradient                   ...        0 min,  0.017 sec
 * total energy  :   -46.2338182 Eh     change       -0.1002091E-04 Eh
   gradient norm :     0.0074559 Eh/α   predicted    -0.7043355E-04 ( 602.87%)
   displ. norm   :     0.0931698 α      lambda       -0.1902278E-03
   maximum displ.:     0.0710313 α      in ANC's #5, #1, #3, ...

........................................................................
.............................. CYCLE   17 ..............................
........................................................................
   1    -46.8584774 -0.468585E+02  0.463E-02    1.61       0.0  T
   2    -46.8584794 -0.197601E-05  0.252E-02    1.60       1.0  T
   3    -46.8584775  0.189117E-05  0.107E-02    1.60       1.7  T
   4    -46.8584799 -0.232302E-05  0.334E-03    1.60       5.6  T
   5    -46.8584799 -0.881955E-07  0.173E-03    1.60      10.7  T
   6    -46.8584800 -0.358835E-07  0.807E-04    1.60      23.0  T
     SCC iter.                  ...        0 min,  0.009 sec
     gradient                   ...        0 min,  0.017 sec
 * total energy  :   -46.2338851 Eh     change       -0.6695996E-04 Eh
   gradient norm :     0.0060087 Eh/α   predicted    -0.9593754E-04 (  43.28%)
   displ. norm   :     0.0557479 α      lambda       -0.7852429E-04
   maximum displ.:     0.0313134 α      in ANC's #7, #5, #4, ...

........................................................................
.............................. CYCLE   18 ..............................
........................................................................
   1    -46.8603240 -0.468603E+02  0.340E-02    1.60       0.0  T
   2    -46.8603246 -0.538710E-06  0.193E-02    1.60       1.0  T
   3    -46.8603243  0.267806E-06  0.439E-03    1.60       4.2  T
   4    -46.8603245 -0.225044E-06  0.264E-03    1.60       7.0  T
   5    -46.8603247 -0.142990E-06  0.737E-04    1.60      25.2  T
     SCC iter.                  ...        0 min,  0.008 sec
     gradient                   ...        0 min,  0.017 sec
 * total energy  :   -46.2339250 Eh     change       -0.3982266E-04 Eh
   gradient norm :     0.0031767 Eh/α   predicted    -0.3938617E-04 (  -1.10%)
   displ. norm   :     0.2032039 α      lambda       -0.4646570E-04
   maximum displ.:     0.1472669 α      in ANC's #1, #4, #3, ...

........................................................................
.............................. CYCLE   19 ..............................
........................................................................
   1    -46.8590913 -0.468591E+02  0.838E-02    1.60       0.0  T
   2    -46.8590928 -0.148841E-05  0.471E-02    1.60       1.0  T
   3    -46.8590930 -0.259248E-06  0.595E-03    1.60       3.1  T
   4    -46.8590928  0.261369E-06  0.448E-03    1.60       4.1  T
   5    -46.8590932 -0.460414E-06  0.135E-03    1.60      13.8  T
   6    -46.8590933 -0.400015E-07  0.421E-04    1.60      44.1  T
   7    -46.8590933 -0.192416E-08  0.207E-04    1.60      89.9  T
     SCC iter.                  ...        0 min,  0.010 sec
     gradient                   ...        0 min,  0.018 sec
 * total energy  :   -46.2339584 Eh     change       -0.3345002E-04 Eh
   gradient norm :     0.0036731 Eh/α   predicted    -0.2420310E-04 ( -27.64%)
   displ. norm   :     0.2571304 α      lambda       -0.6410127E-04
   maximum displ.:     0.1896870 α      in ANC's #1, #4, #3, ...

........................................................................
.............................. CYCLE   20 ..............................
........................................................................
   1    -46.8581051 -0.468581E+02  0.109E-01    1.60       0.0  T
   2    -46.8581079 -0.281201E-05  0.605E-02    1.60       1.0  T
   3    -46.8581080 -0.606517E-07  0.948E-03    1.60       2.0  T
   4    -46.8581081 -0.111466E-06  0.666E-03    1.60       2.8  T
   5    -46.8581088 -0.663357E-06  0.222E-03    1.60       8.4  T
   6    -46.8581089 -0.127842E-06  0.571E-04    1.60      32.5  T
   7    -46.8581089 -0.429984E-08  0.280E-04    1.60      66.4  T
     SCC iter.                  ...        0 min,  0.010 sec
     gradient                   ...        0 min,  0.018 sec
 * total energy  :   -46.2340037 Eh     change       -0.4526048E-04 Eh
   gradient norm :     0.0036523 Eh/α   predicted    -0.3417267E-04 ( -24.50%)
   displ. norm   :     0.2053432 α      lambda       -0.7671781E-04
   maximum displ.:     0.1407509 α      in ANC's #1, #5, #7, ...
 * RMSD in coord.:     0.7562801 α      energy gain  -0.1812152E-01 Eh

generating ANC from model Hessian ...
Using Lindh-Hessian (1995)
 Shifting diagonal of input Hessian by   4.316733818280186E-003
 Lowest  eigenvalues of input Hessian
   -0.000000   -0.000000   -0.000000   -0.000000    0.000000    0.000000
    0.005000    0.006322    0.006578    0.006910    0.007354    0.007878
    0.009636    0.011649    0.013736    0.015975    0.018436    0.022265
 Highest eigenvalues
    1.783251    1.933841    2.012234    2.024817    2.110348    2.266744
 

........................................................................
.............................. CYCLE   21 ..............................
........................................................................
   1    -46.8585924 -0.468586E+02  0.916E-02    1.60       0.0  T
   2    -46.8585945 -0.210601E-05  0.499E-02    1.60       1.0  T
   3    -46.8585935  0.100908E-05  0.104E-02    1.60       1.8  T
   4    -46.8585946 -0.113163E-05  0.646E-03    1.60       2.9  T
   5    -46.8585951 -0.469523E-06  0.271E-03    1.60       6.9  T
   6    -46.8585953 -0.194459E-06  0.544E-04    1.60      34.1  T
   7    -46.8585953 -0.425167E-08  0.253E-04    1.60      73.3  T
     SCC iter.                  ...        0 min,  0.010 sec
     gradient                   ...        0 min,  0.018 sec
 * total energy  :   -46.2340589 Eh     change       -0.5524293E-04 Eh
   gradient norm :     0.0033948 Eh/α   predicted     0.0000000E+00 (-100.00%)
   displ. norm   :     0.0635862 α      lambda       -0.5171361E-04
   maximum displ.:     0.0397459 α      in ANC's #2, #5, #7, ...

........................................................................
.............................. CYCLE   22 ..............................
........................................................................
   1    -46.8590381 -0.468590E+02  0.295E-02    1.60       0.0  T
   2    -46.8590382 -0.180207E-06  0.168E-02    1.60       1.1  T
   3    -46.8590379  0.376665E-06  0.471E-03    1.60       3.9  T
   4    -46.8590383 -0.434945E-06  0.169E-03    1.60      11.0  T
   5    -46.8590383 -0.495883E-08  0.104E-03    1.60      17.9  T
   6    -46.8590383 -0.254302E-07  0.260E-04    1.60      71.5  T
   7    -46.8590383 -0.110318E-08  0.123E-04    1.60     151.4  T
     SCC iter.                  ...        0 min,  0.010 sec
     gradient                   ...        0 min,  0.018 sec
 * total energy  :   -46.2341002 Eh     change       -0.4128358E-04 Eh
   gradient norm :     0.0014037 Eh/α   predicted    -0.2596211E-04 ( -37.11%)
   displ. norm   :     0.1205038 α      lambda       -0.4105475E-04
   maximum displ.:     0.0637808 α      in ANC's #2, #5, #7, ...

........................................................................
.............................. CYCLE   23 ..............................
........................................................................
   1    -46.8593986 -0.468594E+02  0.613E-02    1.60       0.0  T
   2    -46.8593995 -0.809915E-06  0.343E-02    1.60       1.0  T
   3    -46.8593986  0.867509E-06  0.783E-03    1.60       2.4  T
   4    -46.8593996 -0.106087E-05  0.364E-03    1.60       5.1  T
   5    -46.8593997 -0.244482E-07  0.209E-03    1.60       8.9  T
   6    -46.8593998 -0.116137E-06  0.413E-04    1.60      44.9  T
   7    -46.8593998 -0.263357E-08  0.202E-04    1.60      92.0  T
     SCC iter.                  ...        0 min,  0.010 sec
     gradient                   ...        0 min,  0.018 sec
 * total energy  :   -46.2341415 Eh     change       -0.4127803E-04 Eh
   gradient norm :     0.0020691 Eh/α   predicted    -0.2066105E-04 ( -49.95%)
   displ. norm   :     0.0928544 α      lambda       -0.3306495E-04
   maximum displ.:     0.0522358 α      in ANC's #2, #5, #7, ...

........................................................................
.............................. CYCLE   24 ..............................
........................................................................
   1    -46.8592627 -0.468593E+02  0.454E-02    1.60       0.0  T
   2    -46.8592630 -0.303132E-06  0.259E-02    1.60       1.0  T
   3    -46.8592629  0.141684E-06  0.394E-03    1.60       4.7  T
   4    -46.8592630 -0.121716E-06  0.266E-03    1.60       7.0  T
   5    -46.8592631 -0.101729E-06  0.104E-03    1.60      17.9  T
   6    -46.8592632 -0.303793E-07  0.235E-04    1.60      79.1  T
   7    -46.8592632 -0.476959E-09  0.134E-04    1.60     138.2  T
     SCC iter.                  ...        0 min,  0.010 sec
     gradient                   ...        0 min,  0.018 sec
 * total energy  :   -46.2341657 Eh     change       -0.2426952E-04 Eh
   gradient norm :     0.0022269 Eh/α   predicted    -0.1667645E-04 ( -31.29%)
   displ. norm   :     0.1175536 α      lambda       -0.3239644E-04
   maximum displ.:     0.0669805 α      in ANC's #2, #5, #7, ...

........................................................................
.............................. CYCLE   25 ..............................
........................................................................
   1    -46.8590252 -0.468590E+02  0.555E-02    1.60       0.0  T
   2    -46.8590257 -0.475274E-06  0.314E-02    1.60       1.0  T
   3    -46.8590255  0.188027E-06  0.491E-03    1.60       3.8  T
   4    -46.8590256 -0.881134E-07  0.360E-03    1.60       5.2  T
   5    -46.8590258 -0.256437E-06  0.836E-04    1.60      22.2  T
   6    -46.8590258 -0.161050E-07  0.261E-04    1.60      71.1  T
     SCC iter.                  ...        0 min,  0.009 sec
     gradient                   ...        0 min,  0.018 sec
 * total energy  :   -46.2341905 Eh     change       -0.2476298E-04 Eh
   gradient norm :     0.0016811 Eh/α   predicted    -0.1642402E-04 ( -33.68%)
   displ. norm   :     0.1743629 α      lambda       -0.2290407E-04
   maximum displ.:     0.1031887 α      in ANC's #2, #5, #7, ...

........................................................................
.............................. CYCLE   26 ..............................
........................................................................
   1    -46.8588248 -0.468588E+02  0.855E-02    1.60       0.0  T
   2    -46.8588261 -0.127590E-05  0.479E-02    1.60       1.0  T
   3    -46.8588259  0.221333E-06  0.729E-03    1.60       2.5  T
   4    -46.8588259 -0.304283E-07  0.545E-03    1.60       3.4  T
   5    -46.8588265 -0.568554E-06  0.165E-03    1.60      11.2  T
   6    -46.8588265 -0.728341E-07  0.307E-04    1.60      60.4  T
   7    -46.8588265 -0.580485E-09  0.175E-04    1.60     106.3  T
     SCC iter.                  ...        0 min,  0.010 sec
     gradient                   ...        0 min,  0.018 sec
 * total energy  :   -46.2342101 Eh     change       -0.1960893E-04 Eh
   gradient norm :     0.0012997 Eh/α   predicted    -0.1160860E-04 ( -40.80%)
   displ. norm   :     0.0423694 α      lambda       -0.6266466E-05
   maximum displ.:     0.0262020 α      in ANC's #2, #4, #1, ...

........................................................................
.............................. CYCLE   27 ..............................
........................................................................
   1    -46.8594063 -0.468594E+02  0.209E-02    1.60       0.0  T
   2    -46.8594064 -0.110340E-06  0.116E-02    1.60       1.6  T
   3    -46.8594064  0.701847E-07  0.234E-03    1.60       7.9  T
   4    -46.8594064 -0.854393E-07  0.130E-03    1.60      14.2  T
   5    -46.8594065 -0.156999E-07  0.643E-04    1.60      28.9  T
   6    -46.8594065 -0.109650E-07  0.153E-04    1.60     121.3  T
     SCC iter.                  ...        0 min,  0.009 sec
     gradient                   ...        0 min,  0.018 sec
 * total energy  :   -46.2342168 Eh     change       -0.6707127E-05 Eh
   gradient norm :     0.0008265 Eh/α   predicted    -0.3140336E-05 ( -53.18%)
   displ. norm   :     0.0664741 α      lambda       -0.5971176E-05
   maximum displ.:     0.0401645 α      in ANC's #2, #4, #1, ...

........................................................................
.............................. CYCLE   28 ..............................
........................................................................
   1    -46.8594754 -0.468595E+02  0.310E-02    1.60       0.0  T
   2    -46.8594756 -0.198153E-06  0.173E-02    1.60       1.1  T
   3    -46.8594752  0.368803E-06  0.452E-03    1.60       4.1  T
   4    -46.8594756 -0.395474E-06  0.215E-03    1.60       8.6  T
   5    -46.8594756 -0.519442E-07  0.714E-04    1.60      26.0  T
   6    -46.8594756 -0.137000E-07  0.171E-04    1.60     108.8  T
     SCC iter.                  ...        0 min,  0.009 sec
     gradient                   ...        0 min,  0.018 sec
 * total energy  :   -46.2342236 Eh     change       -0.6758829E-05 Eh
   gradient norm :     0.0006304 Eh/α   predicted    -0.2991670E-05 ( -55.74%)
   displ. norm   :     0.0737981 α      lambda       -0.5633929E-05
   maximum displ.:     0.0429883 α      in ANC's #2, #4, #1, ...

........................................................................
.............................. CYCLE   29 ..............................
........................................................................
   1    -46.8595255 -0.468595E+02  0.292E-02    1.60       0.0  T
   2    -46.8595256 -0.100796E-06  0.169E-02    1.60       1.1  T
   3    -46.8595251  0.443640E-06  0.434E-03    1.60       4.3  T
   4    -46.8595256 -0.482781E-06  0.145E-03    1.60      12.8  T
   5    -46.8595256 -0.200277E-07  0.498E-04    1.60      37.3  T
   6    -46.8595256 -0.490990E-08  0.162E-04    1.60     114.8  T
     SCC iter.                  ...        0 min,  0.009 sec
     gradient                   ...        0 min,  0.018 sec
 * total energy  :   -46.2342309 Eh     change       -0.7318799E-05 Eh
   gradient norm :     0.0009650 Eh/α   predicted    -0.2828601E-05 ( -61.35%)
   displ. norm   :     0.0959747 α      lambda       -0.7942352E-05
   maximum displ.:     0.0559146 α      in ANC's #4, #2, #1, ...

........................................................................
.............................. CYCLE   30 ..............................
........................................................................
   1    -46.8594503 -0.468595E+02  0.362E-02    1.60       0.0  T
   2    -46.8594504 -0.102353E-06  0.212E-02    1.60       1.0  T
   3    -46.8594503  0.513439E-07  0.207E-03    1.60       9.0  T
   4    -46.8594504 -0.623859E-07  0.131E-03    1.60      14.1  T
   5    -46.8594504 -0.300670E-07  0.321E-04    1.60      57.8  T
   6    -46.8594504 -0.131726E-08  0.135E-04    1.60     137.4  T
     SCC iter.                  ...        0 min,  0.009 sec
     gradient                   ...        0 min,  0.018 sec
 * total energy  :   -46.2342407 Eh     change       -0.9824699E-05 Eh
   gradient norm :     0.0009457 Eh/α   predicted    -0.3991636E-05 ( -59.37%)
   displ. norm   :     0.1547509 α      lambda       -0.1068609E-04
   maximum displ.:     0.0869695 α      in ANC's #4, #2, #1, ...

........................................................................
.............................. CYCLE   31 ..............................
........................................................................
   1    -46.8589931 -0.468590E+02  0.604E-02    1.60       0.0  T
   2    -46.8589934 -0.350600E-06  0.352E-02    1.60       1.0  T
   3    -46.8589935 -0.483998E-07  0.324E-03    1.60       5.7  T
   4    -46.8589934  0.114630E-06  0.278E-03    1.60       6.7  T
   5    -46.8589936 -0.184261E-06  0.517E-04    1.60      35.9  T
   6    -46.8589936 -0.533439E-08  0.217E-04    1.60      85.7  T
     SCC iter.                  ...        0 min,  0.009 sec
     gradient                   ...        0 min,  0.018 sec
 * total energy  :   -46.2342517 Eh     change       -0.1096356E-04 Eh
   gradient norm :     0.0008604 Eh/α   predicted    -0.5403357E-05 ( -50.72%)
   displ. norm   :     0.0948701 α      lambda       -0.5220997E-05
   maximum displ.:     0.0557835 α      in ANC's #1, #2, #4, ...

........................................................................
.............................. CYCLE   32 ..............................
........................................................................
   1    -46.8590657 -0.468591E+02  0.372E-02    1.60       0.0  T
   2    -46.8590658 -0.122921E-06  0.217E-02    1.60       1.0  T
   3    -46.8590653  0.534734E-06  0.492E-03    1.60       3.8  T
   4    -46.8590659 -0.598675E-06  0.143E-03    1.60      13.0  T
   5    -46.8590659 -0.134485E-07  0.450E-04    1.60      41.3  T
   6    -46.8590659 -0.445289E-08  0.151E-04    1.60     122.8  T
     SCC iter.                  ...        0 min,  0.009 sec
     gradient                   ...        0 min,  0.018 sec
 * total energy  :   -46.2342572 Eh     change       -0.5545155E-05 Eh
   gradient norm :     0.0006145 Eh/α   predicted    -0.2624878E-05 ( -52.66%)
   displ. norm   :     0.0718704 α      lambda       -0.3726228E-05
   maximum displ.:     0.0461082 α      in ANC's #1, #2, #4, ...

........................................................................
.............................. CYCLE   33 ..............................
........................................................................
   1    -46.8592582 -0.468593E+02  0.297E-02    1.60       0.0  T
   2    -46.8592584 -0.128706E-06  0.170E-02    1.60       1.1  T
   3    -46.8592580  0.328842E-06  0.418E-03    1.60       4.4  T
   4    -46.8592584 -0.356091E-06  0.174E-03    1.60      10.7  T
   5    -46.8592584 -0.371103E-07  0.354E-04    1.60      52.5  T
   6    -46.8592584 -0.225217E-08  0.157E-04    1.60     118.1  T
     SCC iter.                  ...        0 min,  0.009 sec
     gradient                   ...        0 min,  0.018 sec
 * total energy  :   -46.2342616 Eh     change       -0.4339961E-05 Eh
   gradient norm :     0.0004622 Eh/α   predicted    -0.1870991E-05 ( -56.89%)
   displ. norm   :     0.0752929 α      lambda       -0.3410419E-05
   maximum displ.:     0.0499728 α      in ANC's #2, #1, #6, ...

   *** GEOMETRY OPTIMIZATION CONVERGED AFTER 33 ITERATIONS ***

------------------------------------------------------------------------
 total energy gain   :        -0.0183794 Eh      -11.5333 kcal/mol
 total RMSD          :         0.8472767 a0        0.4484 Å
 total power (kW/mol):        -1.4622780 (step)  -35.2881 (real)
------------------------------------------------------------------------

 ANCopt (total)                0 d,  0 h,  0 min,  1.367 sec
 optimizer setup                ...        0 min,  0.000 sec (  0.012%)
 model hessian                  ...        0 min,  0.008 sec (  0.611%)
 ANC generation                 ...        0 min,  0.002 sec (  0.131%)
 coordinate transformation      ...        0 min,  0.001 sec (  0.054%)
 single point calculation       ...        0 min,  1.342 sec ( 98.148%)
 optimization log               ...        0 min,  0.004 sec (  0.273%)
 hessian update                 ...        0 min,  0.001 sec (  0.039%)
 rational function              ...        0 min,  0.008 sec (  0.578%)

================
 final structure:
================
$coord
   -1.00610420175641    2.30973471361083   -0.85697900566689      C 
   -3.66398635602835    0.47086994270140   -0.72865524747513      S 
   -1.97679813592535   -2.26006256436872   -0.08601712600210      C 
    0.58321458133441   -1.70838197264919    0.01908848497040      C 
    1.13244802777646    0.91288826592217   -0.42780766427710      C 
    3.55221672889786    1.78681104674646   -0.40826696317666      N 
    5.29475948451465    0.11119212360388    0.03966116809453      C 
    7.72500307923733    0.78024684315598    0.08226238052165      O 
    8.24633423374034    3.37834698351151   -0.39564786241580      C 
   11.09131029122734    3.73963864908789   -0.38194433869981      C 
    4.75313388714670   -2.53409142196082    0.50763134975956      C 
    6.88904737296088   -4.33983706196124    1.02650333260376      C 
    6.13639930119461   -6.93388522057262    1.44873291594134      N 
    2.45690391514942   -3.39512154351450    0.48934213603455      N 
   -3.12398997360268   -4.68541955360069    0.26428727440093      C 
   -5.59253979597853   -5.15027331515550    0.12628869516839      C 
   -1.15072487060740    4.29145421714166   -1.23766187027339      H 
    7.32853746560748    4.52619573388977    1.06417572230648      H 
    7.42399627850084    3.90260541423045   -2.22314449808516      H 
   11.86550402171758    3.19868227376747    1.44156968243567      H 
   11.53796738826462    5.70928626697289   -0.74545469783416      H 
   11.95919971608352    2.57426357964674   -1.83306884169426      H 
    7.92847557515143   -3.66699027730715    2.68607384286102      H 
    8.20412369219541   -4.27663987962300   -0.57144528546299      H 
    4.92539790059752   -7.01079270512726    2.93510031526431      H 
    5.16264894128610   -7.56894181530742   -0.07794988922550      H 
   -1.78492914143641   -6.17827204110881    0.66287528514612      H 
   -6.93013797755463   -3.66626802965381   -0.27233699880718      H 
   -6.34476660931669   -7.01694309516079    0.40601362263347      H 
$end
           -------------------------------------------------
          |                Final Singlepoint                |
           -------------------------------------------------

          ...................................................
          :                      SETUP                      :
          :.................................................:
          :  # basis functions                  83          :
          :  # atomic orbitals                  82          :
          :  # shells                           46          :
          :  # electrons                        84          :
          :  max. iterations                   250          :
          :  Hamiltonian                  GFN2-xTB          :
          :  restarted?                      false          :
          :  GBSA solvation                  false          :
          :  PC potential                    false          :
          :  electronic temp.          300.0000000     K    :
          :  accuracy                    1.0000000          :
          :  -> integral cutoff          0.2500000E+02      :
          :  -> integral neglect         0.1000000E-07      :
          :  -> SCF convergence          0.1000000E-05 Eh   :
          :  -> wf. convergence          0.1000000E-03 e    :
          :  Broyden damping             0.4000000          :
          ...................................................

 iter      E             dE          RMSdq      gap      omega  full diag
   1    -46.8592584 -0.468593E+02  0.737E-05    1.60       0.0  T
   2    -46.8592584 -0.177636E-12  0.381E-05    1.60     488.0  T
   3    -46.8592584 -0.267519E-10  0.353E-05    1.60     526.4  T

   *** convergence criteria satisfied after 3 iterations ***

         #    Occupation            Energy/Eh            Energy/eV
      -------------------------------------------------------------
         1        2.0000           -0.7386925             -20.1008
       ...           ...                  ...                  ...
        36        2.0000           -0.4395996             -11.9621
        37        2.0000           -0.4271510             -11.6234
        38        2.0000           -0.4231701             -11.5150
        39        2.0000           -0.3944973             -10.7348
        40        2.0000           -0.3762136             -10.2373
        41        2.0000           -0.3710698             -10.0973
        42        2.0000           -0.3570528              -9.7159 (HOMO)
        43                         -0.2981992              -8.1144 (LUMO)
        44                         -0.2407820              -6.5520
        45                         -0.2146160              -5.8400
        46                         -0.2054083              -5.5894
        47                         -0.1700578              -4.6275
       ...                                ...                  ...
        82                          0.7061902              19.2164
      -------------------------------------------------------------
                  HL-Gap            0.0588536 Eh            1.6015 eV
             Fermi-level           -0.3276260 Eh           -8.9152 eV

 SCC (total)                   0 d,  0 h,  0 min,  0.037 sec
 SCC setup                      ...        0 min,  0.000 sec (  0.649%)
 Dispersion                     ...        0 min,  0.000 sec (  0.700%)
 integral evaluation            ...        0 min,  0.013 sec ( 34.470%)
 zeroth order Hamiltonian       ...        0 min,  0.000 sec (  0.552%)
 iterations                     ...        0 min,  0.005 sec ( 13.543%)
 molecular gradient             ...        0 min,  0.018 sec ( 48.817%)
 printout                       ...        0 min,  0.000 sec (  1.104%)

         :::::::::::::::::::::::::::::::::::::::::::::::::::::
         ::                     SUMMARY                     ::
         :::::::::::::::::::::::::::::::::::::::::::::::::::::
         :: total energy             -46.234261590172 Eh    ::
         :: gradient norm              0.000462481190 Eh/a0 ::
         :: HOMO-LUMO gap              1.601487819469 eV    ::
         ::.................................................::
         :: SCC energy               -46.859258427343 Eh    ::
         :: -> isotropic ES            0.044083898906 Eh    ::
         :: -> anisotropic ES          0.001249403559 Eh    ::
         :: -> anisotropic XC          0.029904994737 Eh    ::
         :: -> dispersion             -0.028977800939 Eh    ::
         :: repulsion energy           0.624995757576 Eh    ::
         :: add. restraining           0.000000000000 Eh    ::
         :::::::::::::::::::::::::::::::::::::::::::::::::::::

           -------------------------------------------------
          |                Property Printout                |
           -------------------------------------------------

    * Orbital Energies and Occupations

         #    Occupation            Energy/Eh            Energy/eV
      -------------------------------------------------------------
         1        2.0000           -0.7386925             -20.1008
       ...           ...                  ...                  ...
        30        2.0000           -0.4764361             -12.9645
        31        2.0000           -0.4686118             -12.7516
        32        2.0000           -0.4647046             -12.6453
        33        2.0000           -0.4574626             -12.4482
        34        2.0000           -0.4496548             -12.2357
        35        2.0000           -0.4461095             -12.1393
        36        2.0000           -0.4395996             -11.9621
        37        2.0000           -0.4271510             -11.6234
        38        2.0000           -0.4231701             -11.5150
        39        2.0000           -0.3944973             -10.7348
        40        2.0000           -0.3762136             -10.2373
        41        2.0000           -0.3710698             -10.0973
        42        2.0000           -0.3570528              -9.7159 (HOMO)
        43                         -0.2981992              -8.1144 (LUMO)
        44                         -0.2407820              -6.5520
        45                         -0.2146160              -5.8400
        46                         -0.2054083              -5.5894
        47                         -0.1700578              -4.6275
        48                         -0.1283870              -3.4936
        49                         -0.1060970              -2.8870
        50                         -0.0098453              -0.2679
        51                          0.0120767               0.3286
        52                          0.0236816               0.6444
        53                          0.0344561               0.9376
       ...                                ...                  ...
        82                          0.7061902              19.2164
      -------------------------------------------------------------
                  HL-Gap            0.0588536 Eh            1.6015 eV
             Fermi-level           -0.3276260 Eh           -8.9152 eV

     #   Z        covCN         q      C6AA      α(0)
     1   6 C      2.926    -0.046    29.154     8.855
     2  16 S      2.345     0.009   140.674    19.962
     3   6 C      2.977     0.007    27.849     8.656
     4   6 C      3.177     0.051    26.461     8.400
     5   6 C      3.174     0.065    26.162     8.354
     6   7 N      1.833    -0.295    28.497     7.911
     7   6 C      2.871     0.221    23.363     7.923
     8   8 O      1.706    -0.261    18.323     5.779
     9   6 C      3.706     0.082    19.354     6.289
    10   6 C      3.751    -0.115    22.766     6.804
    11   6 C      2.952     0.065    26.535     8.449
    12   6 C      3.738     0.014    20.422     6.448
    13   7 N      2.629    -0.332    28.552     7.936
    14   7 N      1.838    -0.239    27.092     7.714
    15   6 C      2.914    -0.027    28.680     8.782
    16   6 C      2.841    -0.088    30.192     9.005
    17   1 H      0.927     0.057     2.237     2.339
    18   1 H      0.924     0.049     2.332     2.388
    19   1 H      0.924     0.050     2.317     2.380
    20   1 H      0.925     0.058     2.222     2.331
    21   1 H      0.925     0.052     2.291     2.367
    22   1 H      0.925     0.058     2.225     2.333
    23   1 H      0.924     0.058     2.228     2.334
    24   1 H      0.924     0.058     2.225     2.333
    25   1 H      0.860     0.149     1.410     1.860
    26   1 H      0.860     0.149     1.410     1.860
    27   1 H      0.925     0.058     2.220     2.330
    28   1 H      0.926     0.048     2.341     2.392
    29   1 H      0.926     0.045     2.377     2.411

 Mol. C6AA /au·bohr⁶  :      11288.199046
 Mol. C8AA /au·bohr⁸  :     291593.626203
 Mol. α(0) /au        :        166.926470


Wiberg/Mayer (AO) data.
largest (>0.10) Wiberg bond orders for each atom
          total WBO             WBO to atom ...
     1  C   3.940        C    5 1.470    S    2 1.221    H   17 0.968    C    3 0.120
     2  S   2.684        C    1 1.221    C    3 1.169
     3  C   3.942        C    4 1.377    S    2 1.169    C   15 1.155    C    1 0.120
     4  C   3.980        C    3 1.377    N   14 1.224    C    5 1.144
     5  C   3.979        C    1 1.470    N    6 1.199    C    4 1.144
     6  N   3.039        C    7 1.524    C    5 1.199    O    8 0.112
     7  C   3.935        N    6 1.524    O    8 1.121    C   11 1.103
     8  O   2.277        C    7 1.121    C    9 0.943    N    6 0.112
     9  C   3.931        C   10 1.019    H   18 0.967    H   19 0.967    O    8 0.943
    10  C   3.991        C    9 1.019    H   22 0.985    H   20 0.985    H   21 0.984
    11  C   3.956        N   14 1.604    C    7 1.103    C   12 0.998
    12  C   3.987        N   13 1.039    C   11 0.998    H   24 0.950    H   23 0.950
    13  N   3.011        C   12 1.039    H   25 0.963    H   26 0.963
    14  N   3.066        C   11 1.604    C    4 1.224
    15  C   3.990        C   16 1.845    C    3 1.155    H   27 0.955
    16  C   3.965        C   15 1.845    H   29 0.978    H   28 0.972
    17  H   0.996        C    1 0.968
    18  H   0.997        C    9 0.967
    19  H   0.997        C    9 0.967
    20  H   0.997        C   10 0.985
    21  H   0.997        C   10 0.984
    22  H   0.997        C   10 0.985
    23  H   0.991        C   12 0.950
    24  H   0.991        C   12 0.950
    25  H   0.978        N   13 0.963
    26  H   0.978        N   13 0.963
    27  H   0.996        C   15 0.955
    28  H   0.998        C   16 0.972
    29  H   0.997        C   16 0.978

molecular dipole:
                 x           y           z       tot (Debye)
 q only:        0.314       0.274      -0.045
   full:        0.247       0.581      -0.103       1.626
molecular quadrupole (traceless):
                xx          xy          yy          xz          yz          zz
 q only:        8.365       8.719      -1.313      -0.836      -0.674      -7.052
  q+dip:        4.272      12.579      -2.930      -2.165       0.973      -1.342
   full:        2.985      13.158      -3.872      -2.614       1.636       0.888

           -------------------------------------------------
          |                Geometry Summary                 |
           -------------------------------------------------

      molecular mass/u    :      235.3032000
   center of mass at/Å    :        1.2428096      -0.5176969      -0.0007773
  moments of inertia/u·Å² :        0.6229480E+03   0.1684550E+04   0.2295159E+04
rotational constants/cm⁻¹ :        0.2706106E-01   0.1000720E-01   0.7344866E-02

 * 28 selected distances

     #   Z        #   Z                                     value/Å
     1   6 C      2  16 S                                 1.7116433
     2  16 S      3   6 C                                 1.7324055 (max)
     3   6 C      4   6 C                                 1.3869153
     1   6 C      5   6 C                                 1.3706379
     4   6 C      5   6 C                                 1.4368338
     5   6 C      6   7 N                                 1.3614779
     6   7 N      7   6 C                                 1.3010438
     7   6 C      8   8 O                                 1.3340655
     8   8 O      9   6 C                                 1.4248837
     9   6 C     10   6 C                                 1.5176051
    12   6 C     13   7 N                                 1.4466822
     4   6 C     14   7 N                                 1.3571040
    11   6 C     14   7 N                                 1.2977666
     3   6 C     15   6 C                                 1.4318249
    15   6 C     16   6 C                                 1.3312643
     1   6 C     17   1 H                                 1.0705933
     9   6 C     18   1 H                                 1.0961754
     9   6 C     19   1 H                                 1.0961547
    10   6 C     20   1 H                                 1.0867107
    10   6 C     21   1 H                                 1.0859298
    10   6 C     22   1 H                                 1.0866953
    12   6 C     23   1 H                                 1.0957047
    12   6 C     24   1 H                                 1.0956474
    13   7 N     25   1 H                                 1.0153762 (min)
    13   7 N     26   1 H                                 1.0154479
    15   6 C     27   1 H                                 1.0819786
    16   6 C     28   1 H                                 1.0780606
    16   6 C     29   1 H                                 1.0752261

 * 6 distinct bonds (by element types)

   Z      Z             #   av. dist./Å        max./Å        min./Å
   1 H    6 C          11     1.0862615     1.0961754     1.0705933
   6 C    6 C           6     1.4125136     1.5176051     1.3312643
   1 H    7 N           2     1.0154120     1.0154479     1.0153762
   6 C    7 N           5     1.3528149     1.4466822     1.2977666
   6 C    8 O           2     1.3794746     1.4248837     1.3340655
   6 C   16 S           2     1.7220244     1.7324055     1.7116433


optimized geometry written to: xtbopt.xyz


           -------------------------------------------------
          | TOTAL ENERGY              -46.234261590172 Eh   |
          | GRADIENT NORM               0.000462481190 Eh/α |
          | HOMO-LUMO GAP               1.601487819469 eV   |
           -------------------------------------------------

------------------------------------------------------------------------
 * finished run on 2021/05/19 at 11:01:08.049     
------------------------------------------------------------------------
 total:
 * wall-time:     0 d,  0 h,  0 min,  1.485 sec
 *  cpu-time:     0 d,  0 h,  0 min,  1.485 sec
 * ratio c/w:     1.000 speedup
 SCF:
 * wall-time:     0 d,  0 h,  0 min,  0.054 sec
 *  cpu-time:     0 d,  0 h,  0 min,  0.054 sec
 * ratio c/w:     1.000 speedup
 ANC optimizer:
 * wall-time:     0 d,  0 h,  0 min,  1.405 sec
 *  cpu-time:     0 d,  0 h,  0 min,  1.405 sec
 * ratio c/w:     1.000 speedup

