      -----------------------------------------------------------      
     |                   =====================                   |     
     |                           x T B                           |     
     |                   =====================                   |     
     |                         S. Grimme                         |     
     |          Mulliken Center for Theoretical Chemistry        |     
     |                    University of Bonn                     |     
     |                Version 6.2 RC2 (SAW190805)                |     
      -----------------------------------------------------------      

   This program is distributed in the hope that it will be useful,
   but WITHOUT ANY WARRANTY; without even the implied warranty of
   MERCHANTABILITY or FITNESS FOR A PARTICULAR PURPOSE.
   
   FOR NON-COMMERCIAL, ACADEMIA USE ONLY.
   
   Cite this work as:
   * S. Grimme, C. Bannwarth, P. Shushkov, J. Chem. Theory Comput., 2017,
     13, 1989-2009. DOI: 10.1021/acs.jctc.7b00118
   * C. Bannwarth, S. Ehlert and S. Grimme., J. Chem. Theory Comput., 2019,
     15, 1652-1671. DOI: 10.1021/acs.jctc.8b01176
   * P. Pracht, E. Caldeweyher, S. Ehlert, S. Grimme, ChemRxiv, 2019, preprint.
     DOI: 10.26434/chemrxiv.8326202.v1
   
   for DFT-D4:
   * E. Caldeweyher, C. Bannwarth and S. Grimme, J. Chem. Phys., 2017,
     147, 034112. DOI: 10.1063/1.4993215
   * E. Caldeweyher, S. Ehlert, A. Hansen, H. Neugebauer, S. Spicher,
     C. Bannwarth and S. Grimme, J. Chem. Phys., 2019, 150, 154122.
     DOI: 10.1063/1.5090222
   
   for sTDA-xTB:
   * S. Grimme and C. Bannwarth, J. Chem. Phys., 2016, 145, 054103.
     DOI: 10.1063/1.4959605
   
   in the mass-spec context:
   * V. Asgeirsson, C. Bauer and S. Grimme, Chem. Sci., 2017, 8, 4879.
     DOI: 10.1039/c7sc00601b
   
   for metadynamics refer to:
   * S. Grimme, J. Chem. Theory Comput., 2019, 155, 2847-2862
     DOI: 10.1021/acs.jctc.9b00143
   
   with help from (in alphabetical order)
   C. Bannwarth, F. Bohle, G. Brandenburg, E. Caldeweyher, M. Checinski,
   S. Dohm, S. Ehlert, S. Ehrlich, F. März, H. Neugebauer, J. Pisarek,
   P. Pracht, P. Shushkov, and S. Spicher.
   
 * started run on 2021/05/19 at 11:01:08.107     

           -------------------------------------------------
          |                Calculation Setup                |
           -------------------------------------------------

          program call               : /ihome/ghutchison/geoffh/xtb/xtb 798.xyz -opt
          hostname                   : smp-n83
          coordinate file            : 798.xyz
          omp threads                :                     1
          number of atoms            :                    27
          number of electrons        :                    70
          charge                     :                     0
          spin                       :                   0.0
          first test random number   :      0.23782270551423


########################################################################
# WARNING! Please study the warnings concerning your input carefully
#  - the use of '-opt' is discouraged, please use '--opt' next time
########################################################################

           ------------------------------------------------- 
          |                 G F N 2 - x T B                 |
          | Geometry, Frequencies, Noncovalent interactions |
          |            JCTC 2019 parametrisation            |
           ------------------------------------------------- 
             KAB for C  - Si     :                1.0500
             KAB for H  - Pd     :                0.9500
             k(s)              :                1.8500
             k(p)              :                2.2300
             k(d)              :                2.2300
             k(f)              :                2.0000
             kEN (H0ij)        :               -2.0000
             D4 a1             :                0.5200
             D4 a2             :                5.0000
             D4 s6             :                1.0000
             D4 s8             :                2.7000
             D4 s9             :                5.0000
             alphaj            :                2.0000

  Z AO/shell   Hii/eV     exponent
  1     Wed Apr 25 08:07:45 CEST 2018   EN: 2.200 GM2: 0.406  GM3: 0.0800  RAES: 1.40
     1s    -10.707211    1.230000
  6     Wed Apr 25 08:07:45 CEST 2018   EN: 2.550 GM2: 0.538  GM3: 0.1500  RAES: 3.00
     2s    -13.970922    2.096432
     2p    -10.063292    1.800000
  8     Wed Apr 25 08:07:45 CEST 2018   EN: 3.440 GM2: 0.452  GM3:-0.0517  RAES: 1.80
     2s    -20.229985    2.439742
     2p    -15.503117    2.137023

           ------------------------------------------------- 
          |        Self-Consistent Charge Iterations        |
           ------------------------------------------------- 

          ...................................................
          :                      SETUP                      :
          :.................................................:
          :  # basis functions                  66          :
          :  # atomic orbitals                  66          :
          :  # shells                           40          :
          :  # electrons                        70          :
          :  max. iterations                   250          :
          :  Hamiltonian                  GFN2-xTB          :
          :  restarted?                      false          :
          :  GBSA solvation                  false          :
          :  PC potential                    false          :
          :  electronic temp.          300.0000000     K    :
          :  accuracy                    1.0000000          :
          :  -> integral cutoff          0.2500000E+02      :
          :  -> integral neglect         0.1000000E-07      :
          :  -> SCF convergence          0.1000000E-05 Eh   :
          :  -> wf. convergence          0.1000000E-03 e    :
          :  Broyden damping             0.4000000          :
          ...................................................

 iter      E             dE          RMSdq      gap      omega  full diag
   1    -39.2625975 -0.392626E+02  0.440E+00    3.08       0.0  T
   2    -39.3155532 -0.529556E-01  0.247E+00    3.15       1.0  T
   3    -39.3142230  0.133014E-02  0.869E-01    2.98       1.0  T
   4    -39.3173075 -0.308442E-02  0.290E-01    3.19       1.0  T
   5    -39.3187376 -0.143018E-02  0.982E-02    3.14       1.0  T
   6    -39.3188094 -0.717247E-04  0.567E-02    3.14       1.0  T
   7    -39.3188385 -0.290933E-04  0.253E-02    3.14       1.0  T
   8    -39.3188426 -0.417017E-05  0.929E-03    3.14       2.1  T
   9    -39.3188441 -0.149094E-05  0.282E-03    3.14       6.8  T
  10    -39.3188442 -0.902450E-07  0.994E-04    3.14      19.4  T
  11    -39.3188442 -0.246713E-08  0.509E-04    3.14      37.8  T

   *** convergence criteria satisfied after 11 iterations ***

         #    Occupation            Energy/Eh            Energy/eV
      -------------------------------------------------------------
         1        2.0000           -0.7070070             -19.2386
       ...           ...                  ...                  ...
        29        2.0000           -0.4463062             -12.1446
        30        2.0000           -0.4323163             -11.7639
        31        2.0000           -0.4215747             -11.4716
        32        2.0000           -0.4155456             -11.3076
        33        2.0000           -0.4130253             -11.2390
        34        2.0000           -0.3855251             -10.4907
        35        2.0000           -0.3599800              -9.7956 (HOMO)
        36                         -0.2445537              -6.6546 (LUMO)
        37                         -0.2092767              -5.6947
        38                         -0.1754092              -4.7731
        39                         -0.0835195              -2.2727
        40                          0.0132938               0.3617
       ...                                ...                  ...
        66                          0.6418536              17.4657
      -------------------------------------------------------------
                  HL-Gap            0.1154263 Eh            3.1409 eV
             Fermi-level           -0.3022668 Eh           -8.2251 eV

 SCC (total)                   0 d,  0 h,  0 min,  0.036 sec
 SCC setup                      ...        0 min,  0.000 sec (  0.867%)
 Dispersion                     ...        0 min,  0.000 sec (  1.083%)
 integral evaluation            ...        0 min,  0.008 sec ( 23.362%)
 zeroth order Hamiltonian       ...        0 min,  0.000 sec (  0.453%)
 iterations                     ...        0 min,  0.013 sec ( 36.884%)
 molecular gradient             ...        0 min,  0.013 sec ( 36.042%)
 printout                       ...        0 min,  0.000 sec (  1.158%)

         :::::::::::::::::::::::::::::::::::::::::::::::::::::
         ::                     SUMMARY                     ::
         :::::::::::::::::::::::::::::::::::::::::::::::::::::
         :: total energy             -38.783783958069 Eh    ::
         :: gradient norm              0.040518001921 Eh/a0 ::
         :: HOMO-LUMO gap              3.140909453004 eV    ::
         ::.................................................::
         :: SCC energy               -39.318844210973 Eh    ::
         :: -> isotropic ES            0.032417414172 Eh    ::
         :: -> anisotropic ES          0.006881373522 Eh    ::
         :: -> anisotropic XC          0.015494907160 Eh    ::
         :: -> dispersion             -0.022251751799 Eh    ::
         :: repulsion energy           0.535022059522 Eh    ::
         :: add. restraining           0.000000000000 Eh    ::
         :::::::::::::::::::::::::::::::::::::::::::::::::::::

      ----------------------------------------------------------- 
     |                   =====================                   |
     |                        A N C O P T                        |
     |                   =====================                   |
     |               Approximate Normal Coordinate               |
     |                Rational Function Optimizer                |
      ----------------------------------------------------------- 

          ...................................................
          :                      SETUP                      :
          :.................................................:
          :   optimization level            normal          :
          :   max. optcycles                   200          :
          :   ANC micro-cycles                  20          :
          :   degrees of freedom                75          :
          :.................................................:
          :   RF solver                   davidson          :
          :   input Hessian                  false          :
          :   write xtbopt.log                true          :
          :   linear?                        false          :
          :   energy convergence         0.5000000E-05 Eh   :
          :   grad. convergence          0.1000000E-02 Eh/α :
          :   maximium RF displ.         2.0000000          :
          :   Hlow (freq-cutoff)         0.5000000E-02      :
          :   Hmax (freq-cutoff)         5.0000000          :
          :   S6 in model hess.         20.0000000          :
          ...................................................

generating ANC from model Hessian ...
Using Lindh-Hessian (1995)
 Shifting diagonal of input Hessian by   4.255770956814566E-003
 Lowest  eigenvalues of input Hessian
   -0.000000   -0.000000   -0.000000   -0.000000    0.000000    0.000000
    0.005000    0.006011    0.006726    0.007017    0.007307    0.008515
    0.009470    0.010543    0.014106    0.015579    0.018206    0.019799
 Highest eigenvalues
    1.617541    1.780246    1.865556    1.884051    1.993798    2.079302
 

........................................................................
.............................. CYCLE    1 ..............................
........................................................................
   1    -39.3188442 -0.393188E+02  0.242E-04    3.14       0.0  T
   2    -39.3188442 -0.348464E-09  0.170E-04    3.14     113.3  T
   3    -39.3188442 -0.337522E-09  0.962E-05    3.14     200.0  T
     SCC iter.                  ...        0 min,  0.004 sec
     gradient                   ...        0 min,  0.013 sec
 * total energy  :   -38.7837839 Eh     change        0.7167863E-07 Eh
   gradient norm :     0.0405224 Eh/α   predicted     0.0000000E+00 (-100.00%)
   displ. norm   :     0.2590685 α      lambda       -0.4742366E-02
   maximum displ.:     0.1147311 α      in ANC's #15, #7, #6, ...

........................................................................
.............................. CYCLE    2 ..............................
........................................................................
   1    -39.3452112 -0.393452E+02  0.167E-01    3.18       0.0  T
   2    -39.3452166 -0.542473E-05  0.101E-01    3.18       1.0  T
   3    -39.3451862  0.303955E-04  0.374E-02    3.18       1.0  T
   4    -39.3452210 -0.347240E-04  0.545E-03    3.18       3.5  T
   5    -39.3452212 -0.209698E-06  0.315E-03    3.18       6.1  T
   6    -39.3452212 -0.640496E-07  0.134E-03    3.18      14.4  T
     SCC iter.                  ...        0 min,  0.007 sec
     gradient                   ...        0 min,  0.012 sec
 * total energy  :   -38.7868615 Eh     change       -0.3077663E-02 Eh
   gradient norm :     0.0139840 Eh/α   predicted    -0.2530338E-02 ( -17.78%)
   displ. norm   :     0.2577081 α      lambda       -0.1156860E-02
   maximum displ.:     0.1640349 α      in ANC's #7, #8, #6, ...

........................................................................
.............................. CYCLE    3 ..............................
........................................................................
   1    -39.3538283 -0.393538E+02  0.169E-01    3.17       0.0  T
   2    -39.3538351 -0.682020E-05  0.102E-01    3.17       1.0  T
   3    -39.3538231  0.120040E-04  0.259E-02    3.17       1.0  T
   4    -39.3538380 -0.149203E-04  0.600E-03    3.17       3.2  T
   5    -39.3538383 -0.290984E-06  0.317E-03    3.17       6.1  T
   6    -39.3538383 -0.543699E-07  0.160E-03    3.17      12.0  T
   7    -39.3538384 -0.209375E-07  0.301E-04    3.17      63.9  T
     SCC iter.                  ...        0 min,  0.008 sec
     gradient                   ...        0 min,  0.012 sec
 * total energy  :   -38.7876512 Eh     change       -0.7896501E-03 Eh
   gradient norm :     0.0060670 Eh/α   predicted    -0.6168578E-03 ( -21.88%)
   displ. norm   :     0.3159191 α      lambda       -0.7051656E-03
   maximum displ.:     0.1906369 α      in ANC's #7, #8, #6, ...

........................................................................
.............................. CYCLE    4 ..............................
........................................................................
   1    -39.3543465 -0.393543E+02  0.205E-01    3.14       0.0  T
   2    -39.3543571 -0.106332E-04  0.124E-01    3.15       1.0  T
   3    -39.3543468  0.102513E-04  0.249E-02    3.14       1.0  T
   4    -39.3543615 -0.146972E-04  0.665E-03    3.15       2.9  T
   5    -39.3543618 -0.254064E-06  0.360E-03    3.15       5.4  T
   6    -39.3543618 -0.364976E-07  0.193E-03    3.15      10.0  T
   7    -39.3543619 -0.413620E-07  0.462E-04    3.15      41.7  T
     SCC iter.                  ...        0 min,  0.008 sec
     gradient                   ...        0 min,  0.012 sec
 * total energy  :   -38.7881668 Eh     change       -0.5155741E-03 Eh
   gradient norm :     0.0073622 Eh/α   predicted    -0.3877824E-03 ( -24.79%)
   displ. norm   :     0.3754746 α      lambda       -0.6636222E-03
   maximum displ.:     0.2152514 α      in ANC's #7, #8, #6, ...

........................................................................
.............................. CYCLE    5 ..............................
........................................................................
   1    -39.3508755 -0.393509E+02  0.247E-01    3.10       0.0  T
   2    -39.3508881 -0.125697E-04  0.151E-01    3.11       1.0  T
   3    -39.3508834  0.470827E-05  0.211E-02    3.11       1.0  T
   4    -39.3508940 -0.105615E-04  0.737E-03    3.11       2.6  T
   5    -39.3508943 -0.313993E-06  0.359E-03    3.11       5.4  T
   6    -39.3508943 -0.219513E-07  0.122E-03    3.11      15.8  T
   7    -39.3508943 -0.234317E-07  0.274E-04    3.11      70.2  T
     SCC iter.                  ...        0 min,  0.008 sec
     gradient                   ...        0 min,  0.012 sec
 * total energy  :   -38.7886171 Eh     change       -0.4503380E-03 Eh
   gradient norm :     0.0095260 Eh/α   predicted    -0.3785894E-03 ( -15.93%)
   displ. norm   :     0.3216011 α      lambda       -0.5011089E-03
   maximum displ.:     0.1823096 α      in ANC's #8, #7, #6, ...

........................................................................
.............................. CYCLE    6 ..............................
........................................................................
   1    -39.3487615 -0.393488E+02  0.206E-01    3.08       0.0  T
   2    -39.3487683 -0.671146E-05  0.125E-01    3.08       1.0  T
   3    -39.3487685 -0.278056E-06  0.134E-02    3.08       1.4  T
   4    -39.3487720 -0.344833E-05  0.591E-03    3.08       3.3  T
   5    -39.3487721 -0.904454E-07  0.278E-03    3.08       6.9  T
   6    -39.3487721 -0.461800E-07  0.112E-03    3.08      17.3  T
     SCC iter.                  ...        0 min,  0.007 sec
     gradient                   ...        0 min,  0.012 sec
 * total energy  :   -38.7889539 Eh     change       -0.3368257E-03 Eh
   gradient norm :     0.0082565 Eh/α   predicted    -0.2764866E-03 ( -17.91%)
   displ. norm   :     0.2319963 α      lambda       -0.3134843E-03
   maximum displ.:     0.1191732 α      in ANC's #8, #7, #6, ...

........................................................................
.............................. CYCLE    7 ..............................
........................................................................
   1    -39.3504091 -0.393504E+02  0.147E-01    3.07       0.0  T
   2    -39.3504123 -0.326977E-05  0.893E-02    3.07       1.0  T
   3    -39.3504131 -0.828952E-06  0.842E-03    3.07       2.3  T
   4    -39.3504143 -0.113395E-05  0.406E-03    3.07       4.7  T
   5    -39.3504143 -0.429007E-08  0.146E-03    3.07      13.1  T
   6    -39.3504143 -0.394480E-07  0.452E-04    3.07      42.6  T
     SCC iter.                  ...        0 min,  0.007 sec
     gradient                   ...        0 min,  0.012 sec
 * total energy  :   -38.7891657 Eh     change       -0.2117413E-03 Eh
   gradient norm :     0.0039497 Eh/α   predicted    -0.1651808E-03 ( -21.99%)
   displ. norm   :     0.2404125 α      lambda       -0.1626989E-03
   maximum displ.:     0.1271189 α      in ANC's #7, #8, #6, ...

........................................................................
.............................. CYCLE    8 ..............................
........................................................................
   1    -39.3511221 -0.393511E+02  0.150E-01    3.07       0.0  T
   2    -39.3511252 -0.308542E-05  0.916E-02    3.07       1.0  T
   3    -39.3511237  0.145194E-05  0.122E-02    3.07       1.6  T
   4    -39.3511272 -0.349185E-05  0.450E-03    3.07       4.3  T
   5    -39.3511272  0.206253E-07  0.268E-03    3.07       7.2  T
   6    -39.3511273 -0.981865E-07  0.336E-04    3.07      57.2  T
   7    -39.3511273 -0.166692E-08  0.145E-04    3.07     132.9  T
     SCC iter.                  ...        0 min,  0.008 sec
     gradient                   ...        0 min,  0.013 sec
 * total energy  :   -38.7892659 Eh     change       -0.1002008E-03 Eh
   gradient norm :     0.0037829 Eh/α   predicted    -0.8605305E-04 ( -14.12%)
   displ. norm   :     0.1444365 α      lambda       -0.1021166E-03
   maximum displ.:     0.0703071 α      in ANC's #1, #3, #8, ...

........................................................................
.............................. CYCLE    9 ..............................
........................................................................
   1    -39.3546731 -0.393547E+02  0.731E-02    3.07       0.0  T
   2    -39.3546739 -0.833857E-06  0.440E-02    3.07       1.0  T
   3    -39.3546724  0.148233E-05  0.862E-03    3.07       2.2  T
   4    -39.3546744 -0.199524E-05  0.242E-03    3.07       8.0  T
   5    -39.3546744 -0.203581E-07  0.149E-03    3.07      12.9  T
   6    -39.3546744 -0.181553E-07  0.398E-04    3.07      48.3  T
   7    -39.3546744 -0.173281E-08  0.193E-04    3.07     100.0  T
     SCC iter.                  ...        0 min,  0.008 sec
     gradient                   ...        0 min,  0.013 sec
 * total energy  :   -38.7893082 Eh     change       -0.4235559E-04 Eh
   gradient norm :     0.0038237 Eh/α   predicted    -0.5212683E-04 (  23.07%)
   displ. norm   :     0.1199204 α      lambda       -0.4780469E-04
   maximum displ.:     0.0606784 α      in ANC's #7, #8, #3, ...

........................................................................
.............................. CYCLE   10 ..............................
........................................................................
   1    -39.3536006 -0.393536E+02  0.716E-02    3.07       0.0  T
   2    -39.3536012 -0.662582E-06  0.435E-02    3.07       1.0  T
   3    -39.3536011  0.164164E-06  0.592E-03    3.07       3.3  T
   4    -39.3536016 -0.580320E-06  0.216E-03    3.07       8.9  T
   5    -39.3536016 -0.511550E-08  0.111E-03    3.07      17.4  T
   6    -39.3536017 -0.129687E-07  0.261E-04    3.07      73.8  T
   7    -39.3536017 -0.757055E-09  0.747E-05    3.07     257.7  T
     SCC iter.                  ...        0 min,  0.008 sec
     gradient                   ...        0 min,  0.013 sec
 * total energy  :   -38.7893360 Eh     change       -0.2772410E-04 Eh
   gradient norm :     0.0021342 Eh/α   predicted    -0.2425129E-04 ( -12.53%)
   displ. norm   :     0.0433913 α      lambda       -0.2098202E-04
   maximum displ.:     0.0281426 α      in ANC's #3, #1, #5, ...

........................................................................
.............................. CYCLE   11 ..............................
........................................................................
   1    -39.3539673 -0.393540E+02  0.184E-02    3.07       0.0  T
   2    -39.3539674 -0.934943E-07  0.109E-02    3.07       1.8  T
   3    -39.3539672  0.228805E-06  0.303E-03    3.07       6.4  T
   4    -39.3539675 -0.264959E-06  0.657E-04    3.07      29.3  T
   5    -39.3539675 -0.560387E-08  0.340E-04    3.07      56.7  T
     SCC iter.                  ...        0 min,  0.006 sec
     gradient                   ...        0 min,  0.013 sec
 * total energy  :   -38.7893504 Eh     change       -0.1444711E-04 Eh
   gradient norm :     0.0011215 Eh/α   predicted    -0.1051535E-04 ( -27.21%)
   displ. norm   :     0.1342852 α      lambda       -0.2363022E-04
   maximum displ.:     0.0854131 α      in ANC's #1, #3, #5, ...

........................................................................
.............................. CYCLE   12 ..............................
........................................................................
   1    -39.3534416 -0.393534E+02  0.510E-02    3.07       0.0  T
   2    -39.3534419 -0.357899E-06  0.303E-02    3.07       1.0  T
   3    -39.3534403  0.162839E-05  0.783E-03    3.07       2.5  T
   4    -39.3534422 -0.185828E-05  0.132E-03    3.07      14.6  T
   5    -39.3534422 -0.176749E-07  0.738E-04    3.07      26.1  T
   6    -39.3534422 -0.435239E-08  0.284E-04    3.07      67.9  T
     SCC iter.                  ...        0 min,  0.007 sec
     gradient                   ...        0 min,  0.013 sec
 * total energy  :   -38.7893657 Eh     change       -0.1532757E-04 Eh
   gradient norm :     0.0024958 Eh/α   predicted    -0.1191250E-04 ( -22.28%)
   displ. norm   :     0.0889949 α      lambda        0.3755186E-04
   maximum displ.:     0.0560942 α      in ANC's #1, #3, #5, ...

........................................................................
.............................. CYCLE   13 ..............................
........................................................................
   1    -39.3529314 -0.393529E+02  0.338E-02    3.07       0.0  T
   2    -39.3529316 -0.162935E-06  0.200E-02    3.07       1.0  T
   3    -39.3529309  0.712084E-06  0.524E-03    3.07       3.7  T
   4    -39.3529317 -0.811580E-06  0.893E-04    3.07      21.6  T
   5    -39.3529317 -0.834473E-08  0.492E-04    3.07      39.1  T
     SCC iter.                  ...        0 min,  0.006 sec
     gradient                   ...        0 min,  0.013 sec
 * total energy  :   -38.7893521 Eh     change        0.1359083E-04 Eh
   gradient norm :     0.0044272 Eh/α   predicted     0.1892109E-04 (  39.22%)
   displ. norm   :     0.0698577 α      lambda       -0.3918292E-04
   maximum displ.:     0.0327160 α      in ANC's #1, #8, #3, ...

........................................................................
.............................. CYCLE   14 ..............................
........................................................................
   1    -39.3538752 -0.393539E+02  0.323E-02    3.07       0.0  T
   2    -39.3538755 -0.264881E-06  0.192E-02    3.07       1.0  T
   3    -39.3538748  0.662884E-06  0.506E-03    3.07       3.8  T
   4    -39.3538756 -0.764039E-06  0.109E-03    3.07      17.7  T
   5    -39.3538756 -0.144485E-07  0.566E-04    3.07      34.0  T
     SCC iter.                  ...        0 min,  0.006 sec
     gradient                   ...        0 min,  0.013 sec
 * total energy  :   -38.7893752 Eh     change       -0.2306643E-04 Eh
   gradient norm :     0.0017773 Eh/α   predicted    -0.1968741E-04 ( -14.65%)
   displ. norm   :     0.0262310 α      lambda       -0.8527885E-05
   maximum displ.:     0.0161139 α      in ANC's #1, #7, #8, ...

........................................................................
.............................. CYCLE   15 ..............................
........................................................................
   1    -39.3538180 -0.393538E+02  0.144E-02    3.07       0.0  T
   2    -39.3538180 -0.801305E-07  0.867E-03    3.07       2.2  T
   3    -39.3538178  0.253010E-06  0.312E-03    3.07       6.2  T
   4    -39.3538181 -0.298459E-06  0.463E-04    3.07      41.6  T
   5    -39.3538181 -0.205827E-08  0.278E-04    3.07      69.3  T
     SCC iter.                  ...        0 min,  0.006 sec
     gradient                   ...        0 min,  0.013 sec
 * total energy  :   -38.7893837 Eh     change       -0.8488688E-05 Eh
   gradient norm :     0.0007192 Eh/α   predicted    -0.4267196E-05 ( -49.73%)
   displ. norm   :     0.0760442 α      lambda       -0.8620667E-05
   maximum displ.:     0.0567267 α      in ANC's #1, #7, #3, ...

........................................................................
.............................. CYCLE   16 ..............................
........................................................................
   1    -39.3537216 -0.393537E+02  0.353E-02    3.07       0.0  T
   2    -39.3537217 -0.135610E-06  0.213E-02    3.07       1.0  T
   3    -39.3537217  0.298691E-07  0.253E-03    3.07       7.6  T
   4    -39.3537218 -0.108250E-06  0.897E-04    3.07      21.4  T
   5    -39.3537218 -0.506397E-09  0.394E-04    3.07      48.9  T
     SCC iter.                  ...        0 min,  0.006 sec
     gradient                   ...        0 min,  0.013 sec
 * total energy  :   -38.7893934 Eh     change       -0.9699562E-05 Eh
   gradient norm :     0.0009698 Eh/α   predicted    -0.4322532E-05 ( -55.44%)
   displ. norm   :     0.0699851 α      lambda       -0.7138138E-05
   maximum displ.:     0.0586375 α      in ANC's #1, #4, #10, ...

........................................................................
.............................. CYCLE   17 ..............................
........................................................................
   1    -39.3533733 -0.393534E+02  0.279E-02    3.07       0.0  T
   2    -39.3533733 -0.684258E-07  0.167E-02    3.07       1.2  T
   3    -39.3533733  0.487238E-07  0.194E-03    3.07       9.9  T
   4    -39.3533734 -0.855585E-07  0.712E-04    3.07      27.0  T
   5    -39.3533734 -0.266947E-08  0.361E-04    3.07      53.3  T
     SCC iter.                  ...        0 min,  0.006 sec
     gradient                   ...        0 min,  0.013 sec
 * total energy  :   -38.7894016 Eh     change       -0.8238576E-05 Eh
   gradient norm :     0.0009831 Eh/α   predicted    -0.3578671E-05 ( -56.56%)
   displ. norm   :     0.0692402 α      lambda       -0.2970223E-06
   maximum displ.:     0.0577468 α      in ANC's #1, #4, #10, ...

........................................................................
.............................. CYCLE   18 ..............................
........................................................................
   1    -39.3529593 -0.393530E+02  0.276E-02    3.07       0.0  T
   2    -39.3529594 -0.704148E-07  0.166E-02    3.07       1.2  T
   3    -39.3529593  0.215247E-07  0.159E-03    3.07      12.1  T
   4    -39.3529594 -0.565181E-07  0.690E-04    3.07      27.9  T
   5    -39.3529594 -0.276177E-08  0.365E-04    3.07      52.7  T
     SCC iter.                  ...        0 min,  0.006 sec
     gradient                   ...        0 min,  0.013 sec
 * total energy  :   -38.7894044 Eh     change       -0.2777950E-05 Eh
   gradient norm :     0.0016425 Eh/α   predicted    -0.1505894E-06 ( -94.58%)
   displ. norm   :     0.0287732 α      lambda       -0.5408017E-05
   maximum displ.:     0.0253215 α      in ANC's #1, #4, #3, ...

........................................................................
.............................. CYCLE   19 ..............................
........................................................................
   1    -39.3532306 -0.393532E+02  0.120E-02    3.07       0.0  T
   2    -39.3532306 -0.234968E-07  0.723E-03    3.07       2.7  T
   3    -39.3532306  0.183840E-07  0.113E-03    3.07      17.0  T
   4    -39.3532306 -0.259733E-07  0.371E-04    3.07      51.8  T
   5    -39.3532306 -0.122401E-08  0.194E-04    3.07      99.3  T
     SCC iter.                  ...        0 min,  0.006 sec
     gradient                   ...        0 min,  0.013 sec
 * total energy  :   -38.7894109 Eh     change       -0.6490847E-05 Eh
   gradient norm :     0.0010361 Eh/α   predicted    -0.2707678E-05 ( -58.28%)
   displ. norm   :     0.0635905 α      lambda       -0.8875142E-05
   maximum displ.:     0.0553726 α      in ANC's #1, #4, #3, ...

........................................................................
.............................. CYCLE   20 ..............................
........................................................................
   1    -39.3539569 -0.393540E+02  0.278E-02    3.07       0.0  T
   2    -39.3539570 -0.987805E-07  0.167E-02    3.07       1.2  T
   3    -39.3539570  0.631330E-07  0.223E-03    3.07       8.6  T
   4    -39.3539571 -0.105515E-06  0.691E-04    3.07      27.9  T
   5    -39.3539571 -0.226588E-08  0.355E-04    3.07      54.2  T
     SCC iter.                  ...        0 min,  0.006 sec
     gradient                   ...        0 min,  0.013 sec
 * total energy  :   -38.7894199 Eh     change       -0.9009986E-05 Eh
   gradient norm :     0.0009779 Eh/α   predicted    -0.4449565E-05 ( -50.62%)
   displ. norm   :     0.0749022 α      lambda       -0.6796491E-05
   maximum displ.:     0.0643149 α      in ANC's #1, #4, #3, ...
 * RMSD in coord.:     0.4269751 α      energy gain  -0.5635957E-02 Eh

generating ANC from model Hessian ...
Using Lindh-Hessian (1995)
 Shifting diagonal of input Hessian by   4.238482379357883E-003
 Lowest  eigenvalues of input Hessian
   -0.000000   -0.000000    0.000000    0.000000    0.000000    0.000000
    0.005000    0.006290    0.006798    0.007180    0.008225    0.008632
    0.009192    0.011220    0.014707    0.016622    0.019220    0.020338
 Highest eigenvalues
    1.689547    1.844831    1.933204    1.946898    2.072601    2.155931
 

........................................................................
.............................. CYCLE   21 ..............................
........................................................................
   1    -39.3540159 -0.393540E+02  0.326E-02    3.07       0.0  T
   2    -39.3540160 -0.117980E-06  0.197E-02    3.07       1.0  T
   3    -39.3540160  0.356197E-07  0.246E-03    3.07       7.8  T
   4    -39.3540161 -0.104859E-06  0.898E-04    3.07      21.4  T
   5    -39.3540161 -0.155509E-09  0.535E-04    3.07      36.0  T
     SCC iter.                  ...        0 min,  0.006 sec
     gradient                   ...        0 min,  0.013 sec
 * total energy  :   -38.7894273 Eh     change       -0.7410765E-05 Eh
   gradient norm :     0.0012027 Eh/α   predicted     0.0000000E+00 (-100.00%)
   displ. norm   :     0.0344235 α      lambda       -0.5628234E-05
   maximum displ.:     0.0293538 α      in ANC's #1, #2, #7, ...

........................................................................
.............................. CYCLE   22 ..............................
........................................................................
   1    -39.3536792 -0.393537E+02  0.149E-02    3.07       0.0  T
   2    -39.3536792 -0.309378E-07  0.888E-03    3.07       2.2  T
   3    -39.3536792  0.749328E-07  0.197E-03    3.07       9.8  T
   4    -39.3536792 -0.864637E-07  0.399E-04    3.07      48.2  T
   5    -39.3536792 -0.184527E-08  0.203E-04    3.07      94.6  T
     SCC iter.                  ...        0 min,  0.006 sec
     gradient                   ...        0 min,  0.013 sec
 * total energy  :   -38.7894324 Eh     change       -0.5096286E-05 Eh
   gradient norm :     0.0003680 Eh/α   predicted    -0.2824034E-05 ( -44.59%)
   displ. norm   :     0.0166787 α      lambda       -0.1580514E-05
   maximum displ.:     0.0136633 α      in ANC's #1, #2, #6, ...

........................................................................
.............................. CYCLE   23 ..............................
........................................................................
   1    -39.3536581 -0.393537E+02  0.782E-03    3.07       0.0  T
   2    -39.3536581 -0.913602E-08  0.476E-03    3.07       4.0  T
   3    -39.3536581  0.804248E-08  0.853E-04    3.07      22.6  T
   4    -39.3536581 -0.137188E-07  0.208E-04    3.07      92.7  T
     SCC iter.                  ...        0 min,  0.005 sec
     gradient                   ...        0 min,  0.013 sec
 * total energy  :   -38.7894343 Eh     change       -0.1853479E-05 Eh
   gradient norm :     0.0003289 Eh/α   predicted    -0.7912542E-06 ( -57.31%)
   displ. norm   :     0.0262036 α      lambda       -0.1836920E-05
   maximum displ.:     0.0208735 α      in ANC's #1, #2, #6, ...

   *** GEOMETRY OPTIMIZATION CONVERGED AFTER 23 ITERATIONS ***

------------------------------------------------------------------------
 total energy gain   :        -0.0056503 Eh       -3.5456 kcal/mol
 total RMSD          :         0.4285448 a0        0.2268 Å
 total power (kW/mol):        -0.6449960 (step)  -22.1701 (real)
------------------------------------------------------------------------

 ANCopt (total)                0 d,  0 h,  0 min,  0.669 sec
 optimizer setup                ...        0 min,  0.000 sec (  0.024%)
 model hessian                  ...        0 min,  0.009 sec (  1.313%)
 ANC generation                 ...        0 min,  0.002 sec (  0.228%)
 coordinate transformation      ...        0 min,  0.000 sec (  0.074%)
 single point calculation       ...        0 min,  0.649 sec ( 97.023%)
 optimization log               ...        0 min,  0.003 sec (  0.375%)
 hessian update                 ...        0 min,  0.000 sec (  0.050%)
 rational function              ...        0 min,  0.005 sec (  0.693%)

================
 final structure:
================
$coord
    2.67690628321112    1.07510593714274   -1.28557683147606      C 
    1.31977959753364    3.32181162013365   -1.10258664009201      C 
    2.62999296554587    5.48356687439600   -1.64169119178956      O 
    1.36230826278723    7.80835142219426   -1.44048185081255      C 
   -1.20155799352518    3.22662405574219   -0.39904322142145      C 
   -2.39047613947313    0.93767542430176    0.13030103307890      C 
   -0.98738624324953   -1.31757974248700   -0.03561822577435      C 
    1.53648661929642   -1.21154605884623   -0.75661016640331      C 
   -2.24380165002593   -3.50022354899817    0.51783818149350      O 
   -0.91082240951249   -5.81076296321349    0.49420861975641      C 
   -2.73995070935936   -7.87290944376888    1.31071531515527      C 
   -5.03680143292347    0.80992609499236    0.88425809561820      C 
   -6.75375013652888    2.62128082961548    0.62634830510408      C 
    4.63614915274121    1.15557402053204   -1.83852780237753      H 
    2.75354359090104    9.24555239421593   -1.92488151610926      H 
    0.68142544871531    8.14098300962069    0.48573342296174      H 
   -0.22747663235151    7.92769243489479   -2.76056385146101      H 
   -2.29047745947030    4.93664244121256   -0.21751632395438      H 
    2.64716816360143   -2.91264205039922   -0.91443650497728      H 
    0.69944206552461   -5.72383147673249    1.80357295851677      H 
   -0.19444540249341   -6.20684620654428   -1.41512029271452      H 
   -3.44352073459778   -7.47794857575697    3.19923238931018      H 
   -1.78908454984049   -9.69227513405509    1.31184560687304      H 
   -4.33524549049927   -7.94440404637487    0.01969163401810      H 
   -5.58837117128981   -0.98443364990751    1.69034499608930      H 
   -6.34304793398807    4.42648329301779   -0.21904733718092      H 
   -8.67282098266072    2.35025312747931    1.24448424976502      H 
$end
           -------------------------------------------------
          |                Final Singlepoint                |
           -------------------------------------------------

          ...................................................
          :                      SETUP                      :
          :.................................................:
          :  # basis functions                  66          :
          :  # atomic orbitals                  66          :
          :  # shells                           40          :
          :  # electrons                        70          :
          :  max. iterations                   250          :
          :  Hamiltonian                  GFN2-xTB          :
          :  restarted?                      false          :
          :  GBSA solvation                  false          :
          :  PC potential                    false          :
          :  electronic temp.          300.0000000     K    :
          :  accuracy                    1.0000000          :
          :  -> integral cutoff          0.2500000E+02      :
          :  -> integral neglect         0.1000000E-07      :
          :  -> SCF convergence          0.1000000E-05 Eh   :
          :  -> wf. convergence          0.1000000E-03 e    :
          :  Broyden damping             0.4000000          :
          ...................................................

 iter      E             dE          RMSdq      gap      omega  full diag
   1    -39.3536581 -0.393537E+02  0.572E-05    3.07       0.0  T
   2    -39.3536581 -0.333458E-10  0.326E-05    3.07     590.1  T
   3    -39.3536581 -0.271143E-10  0.153E-05    3.07    1257.2  T

   *** convergence criteria satisfied after 3 iterations ***

         #    Occupation            Energy/Eh            Energy/eV
      -------------------------------------------------------------
         1        2.0000           -0.7089309             -19.2910
       ...           ...                  ...                  ...
        29        2.0000           -0.4505684             -12.2606
        30        2.0000           -0.4311213             -11.7314
        31        2.0000           -0.4234219             -11.5219
        32        2.0000           -0.4165434             -11.3347
        33        2.0000           -0.4123049             -11.2194
        34        2.0000           -0.3851872             -10.4815
        35        2.0000           -0.3568417              -9.7102 (HOMO)
        36                         -0.2439674              -6.6387 (LUMO)
        37                         -0.2028476              -5.5198
        38                         -0.1649845              -4.4895
        39                         -0.0698106              -1.8996
        40                          0.0195989               0.5333
       ...                                ...                  ...
        66                          0.6872345              18.7006
      -------------------------------------------------------------
                  HL-Gap            0.1128743 Eh            3.0715 eV
             Fermi-level           -0.3004045 Eh           -8.1744 eV

 SCC (total)                   0 d,  0 h,  0 min,  0.026 sec
 SCC setup                      ...        0 min,  0.000 sec (  0.812%)
 Dispersion                     ...        0 min,  0.000 sec (  0.861%)
 integral evaluation            ...        0 min,  0.008 sec ( 31.193%)
 zeroth order Hamiltonian       ...        0 min,  0.000 sec (  0.600%)
 iterations                     ...        0 min,  0.004 sec ( 15.549%)
 molecular gradient             ...        0 min,  0.013 sec ( 49.372%)
 printout                       ...        0 min,  0.000 sec (  1.408%)

         :::::::::::::::::::::::::::::::::::::::::::::::::::::
         ::                     SUMMARY                     ::
         :::::::::::::::::::::::::::::::::::::::::::::::::::::
         :: total energy             -38.789434280445 Eh    ::
         :: gradient norm              0.000329389472 Eh/a0 ::
         :: HOMO-LUMO gap              3.071466381548 eV    ::
         ::.................................................::
         :: SCC energy               -39.353658111948 Eh    ::
         :: -> isotropic ES            0.031402283002 Eh    ::
         :: -> anisotropic ES          0.006034013878 Eh    ::
         :: -> anisotropic XC          0.013998550755 Eh    ::
         :: -> dispersion             -0.022327297681 Eh    ::
         :: repulsion energy           0.564202847284 Eh    ::
         :: add. restraining           0.000000000000 Eh    ::
         :::::::::::::::::::::::::::::::::::::::::::::::::::::

           -------------------------------------------------
          |                Property Printout                |
           -------------------------------------------------

    * Orbital Energies and Occupations

         #    Occupation            Energy/Eh            Energy/eV
      -------------------------------------------------------------
         1        2.0000           -0.7089309             -19.2910
       ...           ...                  ...                  ...
        23        2.0000           -0.4741185             -12.9014
        24        2.0000           -0.4725297             -12.8582
        25        2.0000           -0.4701377             -12.7931
        26        2.0000           -0.4628942             -12.5960
        27        2.0000           -0.4534885             -12.3401
        28        2.0000           -0.4527489             -12.3199
        29        2.0000           -0.4505684             -12.2606
        30        2.0000           -0.4311213             -11.7314
        31        2.0000           -0.4234219             -11.5219
        32        2.0000           -0.4165434             -11.3347
        33        2.0000           -0.4123049             -11.2194
        34        2.0000           -0.3851872             -10.4815
        35        2.0000           -0.3568417              -9.7102 (HOMO)
        36                         -0.2439674              -6.6387 (LUMO)
        37                         -0.2028476              -5.5198
        38                         -0.1649845              -4.4895
        39                         -0.0698106              -1.8996
        40                          0.0195989               0.5333
        41                          0.0395336               1.0758
        42                          0.1000615               2.7228
        43                          0.1099266               2.9913
        44                          0.1181709               3.2156
        45                          0.1248565               3.3975
        46                          0.1392528               3.7893
       ...                                ...                  ...
        66                          0.6872345              18.7006
      -------------------------------------------------------------
                  HL-Gap            0.1128743 Eh            3.0715 eV
             Fermi-level           -0.3004045 Eh           -8.1744 eV

     #   Z        covCN         q      C6AA      α(0)
     1   6 C      2.921    -0.058    29.436     8.897
     2   6 C      2.862     0.132    25.118     8.215
     3   8 O      1.705    -0.275    18.567     5.818
     4   6 C      3.644     0.039    20.248     6.468
     5   6 C      2.923    -0.073    29.816     8.955
     6   6 C      2.971    -0.008    28.214     8.713
     7   6 C      2.866     0.128    25.198     8.228
     8   6 C      2.915    -0.069    29.706     8.938
     9   8 O      1.705    -0.275    18.554     5.816
    10   6 C      3.690     0.088    19.290     6.286
    11   6 C      3.751    -0.112    22.710     6.796
    12   6 C      2.896    -0.026    28.649     8.776
    13   6 C      2.837    -0.090    30.253     9.014
    14   1 H      0.926     0.049     2.329     2.387
    15   1 H      0.925     0.059     2.205     2.322
    16   1 H      0.924     0.038     2.475     2.460
    17   1 H      0.924     0.038     2.479     2.462
    18   1 H      0.926     0.045     2.381     2.413
    19   1 H      0.926     0.036     2.499     2.472
    20   1 H      0.923     0.027     2.623     2.533
    21   1 H      0.923     0.027     2.624     2.533
    22   1 H      0.925     0.055     2.255     2.348
    23   1 H      0.925     0.045     2.379     2.412
    24   1 H      0.925     0.056     2.244     2.343
    25   1 H      0.926     0.051     2.302     2.373
    26   1 H      0.926     0.034     2.526     2.485
    27   1 H      0.926     0.035     2.516     2.481

 Mol. C6AA /au·bohr⁶  :       7463.391815
 Mol. C8AA /au·bohr⁸  :     172843.827719
 Mol. α(0) /au        :        134.942758


Wiberg/Mayer (AO) data.
largest (>0.10) Wiberg bond orders for each atom
          total WBO             WBO to atom ...
     1  C   3.988        C    8 1.451    C    2 1.350    H   14 0.969
     2  C   3.935        C    5 1.387    C    1 1.350    O    3 1.047
     3  O   2.211        C    2 1.047    C    4 0.989
     4  C   3.949        O    3 0.989    H   15 0.980    H   16 0.977    H   17 0.977
     5  C   3.987        C    2 1.387    C    6 1.386    H   18 0.960
     6  C   3.987        C    5 1.386    C    7 1.300    C   12 1.095
     7  C   3.935        C    8 1.375    C    6 1.300    O    9 1.058
     8  C   3.988        C    1 1.451    C    7 1.375    H   19 0.965
     9  O   2.224        C    7 1.058    C   10 0.969
    10  C   3.950        C   11 1.015    O    9 0.969    H   20 0.968    H   21 0.968
    11  C   3.992        C   10 1.015    H   22 0.986    H   24 0.986    H   23 0.985
    12  C   3.990        C   13 1.898    C    6 1.095    H   25 0.961
    13  C   3.991        C   12 1.898    H   27 0.978    H   26 0.973
    14  H   0.997        C    1 0.969
    15  H   0.996        C    4 0.980
    16  H   0.998        C    4 0.977
    17  H   0.998        C    4 0.977
    18  H   0.997        C    5 0.960
    19  H   0.998        C    8 0.965
    20  H   0.999        C   10 0.968
    21  H   0.999        C   10 0.968
    22  H   0.997        C   11 0.986
    23  H   0.997        C   11 0.985
    24  H   0.997        C   11 0.986
    25  H   0.997        C   12 0.961
    26  H   0.999        C   13 0.973
    27  H   0.998        C   13 0.978

molecular dipole:
                 x           y           z       tot (Debye)
 q only:       -0.101      -0.191       0.112
   full:       -0.039      -0.173       0.093       0.509
molecular quadrupole (traceless):
                xx          xy          yy          xz          yz          zz
 q only:       -6.049      -1.725      11.534       0.138      -1.279      -5.484
  q+dip:       -5.380      -4.476      12.148      -0.103      -1.288      -6.768
   full:       -6.981      -4.065      12.146       0.769      -0.853      -5.164

           -------------------------------------------------
          |                Geometry Summary                 |
           -------------------------------------------------

      molecular mass/u    :      178.2304000
   center of mass at/Å    :       -0.5139598       0.2139106      -0.1081298
  moments of inertia/u·Å² :        0.3698675E+03   0.1076543E+04   0.1434747E+04
rotational constants/cm⁻¹ :        0.4557749E-01   0.1565904E-01   0.1174955E-01

 * 26 selected distances

     #   Z        #   Z                                     value/Å
     1   6 C      2   6 C                                 1.3923462
     2   6 C      3   8 O                                 1.3677444
     3   8 O      4   6 C                                 1.4052753
     2   6 C      5   6 C                                 1.3861189
     5   6 C      6   6 C                                 1.3933567
     6   6 C      7   6 C                                 1.4082844
     1   6 C      8   6 C                                 1.3808526
     7   6 C      8   6 C                                 1.3901363
     7   6 C      9   8 O                                 1.3645005
     9   8 O     10   6 C                                 1.4116228
    10   6 C     11   6 C                                 1.5213125 (max)
    12   6 C     13   6 C                                 1.3277432
     1   6 C     14   1 H                                 1.0781281
     4   6 C     15   1 H                                 1.0890933
     4   6 C     16   1 H                                 1.0953522
     4   6 C     17   1 H                                 1.0953170
     5   6 C     18   1 H                                 1.0770883
     8   6 C     19   1 H                                 1.0783083
    10   6 C     20   1 H                                 1.0992304
    10   6 C     21   1 H                                 1.0993159
    11   6 C     22   1 H                                 1.0867479
    11   6 C     23   1 H                                 1.0863275
    11   6 C     24   1 H                                 1.0866599
    12   6 C     25   1 H                                 1.0810940
    13   6 C     26   1 H                                 1.0769929
    13   6 C     27   1 H                                 1.0765059 (min)

 * 3 distinct bonds (by element types)

   Z      Z             #   av. dist./Å        max./Å        min./Å
   1 H    6 C          14     1.0861544     1.0993159     1.0765059
   6 C    6 C           8     1.4000189     1.5213125     1.3277432
   6 C    8 O           4     1.3872858     1.4116228     1.3645005


optimized geometry written to: xtbopt.xyz


           -------------------------------------------------
          | TOTAL ENERGY              -38.789434280445 Eh   |
          | GRADIENT NORM               0.000329389472 Eh/α |
          | HOMO-LUMO GAP               3.071466381548 eV   |
           -------------------------------------------------

------------------------------------------------------------------------
 * finished run on 2021/05/19 at 11:01:08.873     
------------------------------------------------------------------------
 total:
 * wall-time:     0 d,  0 h,  0 min,  0.766 sec
 *  cpu-time:     0 d,  0 h,  0 min,  0.753 sec
 * ratio c/w:     0.984 speedup
 SCF:
 * wall-time:     0 d,  0 h,  0 min,  0.036 sec
 *  cpu-time:     0 d,  0 h,  0 min,  0.036 sec
 * ratio c/w:     1.000 speedup
 ANC optimizer:
 * wall-time:     0 d,  0 h,  0 min,  0.696 sec
 *  cpu-time:     0 d,  0 h,  0 min,  0.696 sec
 * ratio c/w:     1.000 speedup

