      -----------------------------------------------------------      
     |                   =====================                   |     
     |                           x T B                           |     
     |                   =====================                   |     
     |                         S. Grimme                         |     
     |          Mulliken Center for Theoretical Chemistry        |     
     |                    University of Bonn                     |     
     |                Version 6.2 RC2 (SAW190805)                |     
      -----------------------------------------------------------      

   This program is distributed in the hope that it will be useful,
   but WITHOUT ANY WARRANTY; without even the implied warranty of
   MERCHANTABILITY or FITNESS FOR A PARTICULAR PURPOSE.
   
   FOR NON-COMMERCIAL, ACADEMIA USE ONLY.
   
   Cite this work as:
   * S. Grimme, C. Bannwarth, P. Shushkov, J. Chem. Theory Comput., 2017,
     13, 1989-2009. DOI: 10.1021/acs.jctc.7b00118
   * C. Bannwarth, S. Ehlert and S. Grimme., J. Chem. Theory Comput., 2019,
     15, 1652-1671. DOI: 10.1021/acs.jctc.8b01176
   * P. Pracht, E. Caldeweyher, S. Ehlert, S. Grimme, ChemRxiv, 2019, preprint.
     DOI: 10.26434/chemrxiv.8326202.v1
   
   for DFT-D4:
   * E. Caldeweyher, C. Bannwarth and S. Grimme, J. Chem. Phys., 2017,
     147, 034112. DOI: 10.1063/1.4993215
   * E. Caldeweyher, S. Ehlert, A. Hansen, H. Neugebauer, S. Spicher,
     C. Bannwarth and S. Grimme, J. Chem. Phys., 2019, 150, 154122.
     DOI: 10.1063/1.5090222
   
   for sTDA-xTB:
   * S. Grimme and C. Bannwarth, J. Chem. Phys., 2016, 145, 054103.
     DOI: 10.1063/1.4959605
   
   in the mass-spec context:
   * V. Asgeirsson, C. Bauer and S. Grimme, Chem. Sci., 2017, 8, 4879.
     DOI: 10.1039/c7sc00601b
   
   for metadynamics refer to:
   * S. Grimme, J. Chem. Theory Comput., 2019, 155, 2847-2862
     DOI: 10.1021/acs.jctc.9b00143
   
   with help from (in alphabetical order)
   C. Bannwarth, F. Bohle, G. Brandenburg, E. Caldeweyher, M. Checinski,
   S. Dohm, S. Ehlert, S. Ehrlich, F. März, H. Neugebauer, J. Pisarek,
   P. Pracht, P. Shushkov, and S. Spicher.
   
 * started run on 2021/05/19 at 11:00:12.002     

           -------------------------------------------------
          |                Calculation Setup                |
           -------------------------------------------------

          program call               : /ihome/ghutchison/geoffh/xtb/xtb 801.xyz -opt
          hostname                   : smp-n83
          coordinate file            : 801.xyz
          omp threads                :                     1
          number of atoms            :                    25
          number of electrons        :                    64
          charge                     :                     0
          spin                       :                   0.0
          first test random number   :      0.55894860975008


########################################################################
# WARNING! Please study the warnings concerning your input carefully
#  - the use of '-opt' is discouraged, please use '--opt' next time
########################################################################

           ------------------------------------------------- 
          |                 G F N 2 - x T B                 |
          | Geometry, Frequencies, Noncovalent interactions |
          |            JCTC 2019 parametrisation            |
           ------------------------------------------------- 
             KAB for C  - Si     :                1.0500
             KAB for H  - Pd     :                0.9500
             k(s)              :                1.8500
             k(p)              :                2.2300
             k(d)              :                2.2300
             k(f)              :                2.0000
             kEN (H0ij)        :               -2.0000
             D4 a1             :                0.5200
             D4 a2             :                5.0000
             D4 s6             :                1.0000
             D4 s8             :                2.7000
             D4 s9             :                5.0000
             alphaj            :                2.0000

  Z AO/shell   Hii/eV     exponent
  1     Wed Apr 25 08:07:45 CEST 2018   EN: 2.200 GM2: 0.406  GM3: 0.0800  RAES: 1.40
     1s    -10.707211    1.230000
  6     Wed Apr 25 08:07:45 CEST 2018   EN: 2.550 GM2: 0.538  GM3: 0.1500  RAES: 3.00
     2s    -13.970922    2.096432
     2p    -10.063292    1.800000
  7     Wed Apr 25 08:07:45 CEST 2018   EN: 3.040 GM2: 0.461  GM3:-0.0640  RAES: 1.90
     2s    -16.686243    2.339881
     2p    -12.523956    2.014332
 16     Tue Apr 24 11:44:34 CEST 2018   EN: 2.580 GM2: 0.340  GM3:-0.0502  RAES: 3.10
     3s    -20.029654    1.981333
     3p    -11.377694    2.025643
     3d     -0.420282    1.702555

           ------------------------------------------------- 
          |        Self-Consistent Charge Iterations        |
           ------------------------------------------------- 

          ...................................................
          :                      SETUP                      :
          :.................................................:
          :  # basis functions                  67          :
          :  # atomic orbitals                  66          :
          :  # shells                           38          :
          :  # electrons                        64          :
          :  max. iterations                   250          :
          :  Hamiltonian                  GFN2-xTB          :
          :  restarted?                      false          :
          :  GBSA solvation                  false          :
          :  PC potential                    false          :
          :  electronic temp.          300.0000000     K    :
          :  accuracy                    1.0000000          :
          :  -> integral cutoff          0.2500000E+02      :
          :  -> integral neglect         0.1000000E-07      :
          :  -> SCF convergence          0.1000000E-05 Eh   :
          :  -> wf. convergence          0.1000000E-03 e    :
          :  Broyden damping             0.4000000          :
          ...................................................

 iter      E             dE          RMSdq      gap      omega  full diag
   1    -34.6182187 -0.346182E+02  0.350E+00    2.70       0.0  T
   2    -34.6581582 -0.399396E-01  0.233E+00    2.56       1.0  T
   3    -34.6618974 -0.373917E-02  0.132E+00    2.71       1.0  T
   4    -34.6744182 -0.125208E-01  0.424E-01    2.44       1.0  T
   5    -34.6760489 -0.163070E-02  0.117E-01    2.39       1.0  T
   6    -34.6760553 -0.644271E-05  0.676E-02    2.41       1.0  T
   7    -34.6761207 -0.653836E-04  0.264E-02    2.41       1.0  T
   8    -34.6761254 -0.467871E-05  0.997E-03    2.42       2.0  T
   9    -34.6761258 -0.468049E-06  0.507E-03    2.42       3.9  T
  10    -34.6761260 -0.187848E-06  0.198E-03    2.42      10.1  T
  11    -34.6761261 -0.475943E-07  0.773E-04    2.42      25.9  T
  12    -34.6761261 -0.273578E-08  0.319E-04    2.42      62.7  T

   *** convergence criteria satisfied after 12 iterations ***

         #    Occupation            Energy/Eh            Energy/eV
      -------------------------------------------------------------
         1        2.0000           -0.7311801             -19.8964
       ...           ...                  ...                  ...
        26        2.0000           -0.4391297             -11.9493
        27        2.0000           -0.4330887             -11.7849
        28        2.0000           -0.4256423             -11.5823
        29        2.0000           -0.4239281             -11.5357
        30        2.0000           -0.3918314             -10.6623
        31        2.0000           -0.3858753             -10.5002
        32        2.0000           -0.3341696              -9.0932 (HOMO)
        33                         -0.2454096              -6.6779 (LUMO)
        34                         -0.1989829              -5.4146
        35                         -0.1796773              -4.8893
        36                         -0.1621505              -4.4123
        37                         -0.1137867              -3.0963
       ...                                ...                  ...
        66                          0.6642649              18.0756
      -------------------------------------------------------------
                  HL-Gap            0.0887601 Eh            2.4153 eV
             Fermi-level           -0.2897896 Eh           -7.8856 eV

 SCC (total)                   0 d,  0 h,  0 min,  0.037 sec
 SCC setup                      ...        0 min,  0.000 sec (  0.812%)
 Dispersion                     ...        0 min,  0.000 sec (  0.945%)
 integral evaluation            ...        0 min,  0.009 sec ( 23.355%)
 zeroth order Hamiltonian       ...        0 min,  0.000 sec (  0.444%)
 iterations                     ...        0 min,  0.014 sec ( 37.282%)
 molecular gradient             ...        0 min,  0.013 sec ( 35.945%)
 printout                       ...        0 min,  0.000 sec (  1.069%)

         :::::::::::::::::::::::::::::::::::::::::::::::::::::
         ::                     SUMMARY                     ::
         :::::::::::::::::::::::::::::::::::::::::::::::::::::
         :: total energy             -34.182548916242 Eh    ::
         :: gradient norm              0.044544343704 Eh/a0 ::
         :: HOMO-LUMO gap              2.415284998429 eV    ::
         ::.................................................::
         :: SCC energy               -34.676126076826 Eh    ::
         :: -> isotropic ES            0.009427416659 Eh    ::
         :: -> anisotropic ES          0.006898073558 Eh    ::
         :: -> anisotropic XC          0.018782537366 Eh    ::
         :: -> dispersion             -0.023777915279 Eh    ::
         :: repulsion energy           0.493392350265 Eh    ::
         :: add. restraining           0.000000000000 Eh    ::
         :::::::::::::::::::::::::::::::::::::::::::::::::::::

      ----------------------------------------------------------- 
     |                   =====================                   |
     |                        A N C O P T                        |
     |                   =====================                   |
     |               Approximate Normal Coordinate               |
     |                Rational Function Optimizer                |
      ----------------------------------------------------------- 

          ...................................................
          :                      SETUP                      :
          :.................................................:
          :   optimization level            normal          :
          :   max. optcycles                   200          :
          :   ANC micro-cycles                  20          :
          :   degrees of freedom                69          :
          :.................................................:
          :   RF solver                   davidson          :
          :   input Hessian                  false          :
          :   write xtbopt.log                true          :
          :   linear?                        false          :
          :   energy convergence         0.5000000E-05 Eh   :
          :   grad. convergence          0.1000000E-02 Eh/α :
          :   maximium RF displ.         2.0000000          :
          :   Hlow (freq-cutoff)         0.5000000E-02      :
          :   Hmax (freq-cutoff)         5.0000000          :
          :   S6 in model hess.         20.0000000          :
          ...................................................

generating ANC from model Hessian ...
Using Lindh-Hessian (1995)
 Shifting diagonal of input Hessian by   3.460324538675340E-003
 Lowest  eigenvalues of input Hessian
   -0.000000   -0.000000   -0.000000    0.000000    0.000000    0.000000
    0.005000    0.005425    0.006807    0.009206    0.009571    0.015500
    0.017976    0.020654    0.022360    0.023462    0.024442    0.030006
 Highest eigenvalues
    1.504639    1.638018    1.744181    1.764028    1.812262    2.119219
 

........................................................................
.............................. CYCLE    1 ..............................
........................................................................
   1    -34.6761261 -0.346761E+02  0.145E-04    2.42       0.0  T
   2    -34.6761261 -0.540794E-10  0.906E-05    2.42     220.7  T
   3    -34.6761261  0.591882E-11  0.637E-05    2.42     314.0  T
     SCC iter.                  ...        0 min,  0.004 sec
     gradient                   ...        0 min,  0.013 sec
 * total energy  :   -34.1825489 Eh     change       -0.2308953E-07 Eh
   gradient norm :     0.0445437 Eh/α   predicted     0.0000000E+00 (-100.00%)
   displ. norm   :     0.2780275 α      lambda       -0.5320970E-02
   maximum displ.:     0.1420371 α      in ANC's #14, #10, #5, ...

........................................................................
.............................. CYCLE    2 ..............................
........................................................................
   1    -34.7011125 -0.347011E+02  0.197E-01    2.48       0.0  T
   2    -34.7011376 -0.251159E-04  0.103E-01    2.48       1.0  T
   3    -34.7011155  0.220304E-04  0.419E-02    2.48       1.0  T
   4    -34.7011455 -0.299794E-04  0.174E-02    2.49       1.1  T
   5    -34.7011485 -0.300604E-05  0.516E-03    2.49       3.9  T
   6    -34.7011486 -0.569067E-07  0.201E-03    2.49       9.9  T
     SCC iter.                  ...        0 min,  0.007 sec
     gradient                   ...        0 min,  0.013 sec
 * total energy  :   -34.1858392 Eh     change       -0.3290287E-02 Eh
   gradient norm :     0.0160675 Eh/α   predicted    -0.2866139E-02 ( -12.89%)
   displ. norm   :     0.1890670 α      lambda       -0.9571704E-03
   maximum displ.:     0.0991190 α      in ANC's #5, #10, #6, ...

........................................................................
.............................. CYCLE    3 ..............................
........................................................................
   1    -34.7103578 -0.347104E+02  0.143E-01    2.51       0.0  T
   2    -34.7103720 -0.141792E-04  0.730E-02    2.51       1.0  T
   3    -34.7103649  0.705520E-05  0.261E-02    2.51       1.0  T
   4    -34.7103755 -0.105498E-04  0.115E-02    2.51       1.7  T
   5    -34.7103766 -0.117207E-05  0.364E-03    2.51       5.5  T
   6    -34.7103767 -0.246821E-07  0.899E-04    2.51      22.2  T
   7    -34.7103767 -0.480465E-08  0.545E-04    2.51      36.7  T
     SCC iter.                  ...        0 min,  0.008 sec
     gradient                   ...        0 min,  0.012 sec
 * total energy  :   -34.1864016 Eh     change       -0.5623806E-03 Eh
   gradient norm :     0.0054036 Eh/α   predicted    -0.4956933E-03 ( -11.86%)
   displ. norm   :     0.1402049 α      lambda       -0.2783167E-03
   maximum displ.:     0.0802219 α      in ANC's #5, #6, #10, ...

........................................................................
.............................. CYCLE    4 ..............................
........................................................................
   1    -34.7105457 -0.347105E+02  0.103E-01    2.51       0.0  T
   2    -34.7105498 -0.417080E-05  0.561E-02    2.52       1.0  T
   3    -34.7105463  0.353482E-05  0.175E-02    2.52       1.1  T
   4    -34.7105514 -0.508266E-05  0.559E-03    2.52       3.6  T
   5    -34.7105516 -0.207296E-06  0.177E-03    2.52      11.3  T
   6    -34.7105516 -0.106270E-07  0.733E-04    2.52      27.3  T
     SCC iter.                  ...        0 min,  0.007 sec
     gradient                   ...        0 min,  0.012 sec
 * total energy  :   -34.1866006 Eh     change       -0.1989660E-03 Eh
   gradient norm :     0.0037938 Eh/α   predicted    -0.1418943E-03 ( -28.68%)
   displ. norm   :     0.1971746 α      lambda       -0.2578869E-03
   maximum displ.:     0.1094544 α      in ANC's #6, #5, #4, ...

........................................................................
.............................. CYCLE    5 ..............................
........................................................................
   1    -34.7080209 -0.347080E+02  0.160E-01    2.52       0.0  T
   2    -34.7080301 -0.919607E-05  0.872E-02    2.53       1.0  T
   3    -34.7080238  0.622954E-05  0.244E-02    2.53       1.0  T
   4    -34.7080337 -0.988704E-05  0.798E-03    2.53       2.5  T
   5    -34.7080340 -0.306460E-06  0.202E-03    2.53       9.9  T
   6    -34.7080340 -0.205817E-07  0.755E-04    2.53      26.5  T
   7    -34.7080341 -0.400208E-08  0.416E-04    2.53      48.0  T
     SCC iter.                  ...        0 min,  0.008 sec
     gradient                   ...        0 min,  0.013 sec
 * total energy  :   -34.1867722 Eh     change       -0.1716023E-03 Eh
   gradient norm :     0.0042625 Eh/α   predicted    -0.1339594E-03 ( -21.94%)
   displ. norm   :     0.1702298 α      lambda       -0.1571021E-03
   maximum displ.:     0.0859026 α      in ANC's #5, #4, #3, ...

........................................................................
.............................. CYCLE    6 ..............................
........................................................................
   1    -34.7063323 -0.347063E+02  0.152E-01    2.54       0.0  T
   2    -34.7063406 -0.835377E-05  0.831E-02    2.54       1.0  T
   3    -34.7063341  0.653516E-05  0.234E-02    2.55       1.0  T
   4    -34.7063445 -0.104004E-04  0.647E-03    2.55       3.1  T
   5    -34.7063446 -0.140336E-06  0.141E-03    2.55      14.2  T
   6    -34.7063446 -0.836553E-08  0.540E-04    2.55      37.0  T
     SCC iter.                  ...        0 min,  0.007 sec
     gradient                   ...        0 min,  0.013 sec
 * total energy  :   -34.1868920 Eh     change       -0.1198049E-03 Eh
   gradient norm :     0.0057840 Eh/α   predicted    -0.8082812E-04 ( -32.53%)
   displ. norm   :     0.2375503 α      lambda       -0.2247024E-03
   maximum displ.:     0.1210633 α      in ANC's #4, #5, #3, ...

........................................................................
.............................. CYCLE    7 ..............................
........................................................................
   1    -34.7048176 -0.347048E+02  0.221E-01    2.57       0.0  T
   2    -34.7048358 -0.182457E-04  0.122E-01    2.58       1.0  T
   3    -34.7048090  0.267764E-04  0.424E-02    2.58       1.0  T
   4    -34.7048462 -0.371859E-04  0.828E-03    2.58       2.4  T
   5    -34.7048463 -0.135667E-06  0.232E-03    2.58       8.6  T
   6    -34.7048464 -0.213513E-07  0.866E-04    2.58      23.1  T
     SCC iter.                  ...        0 min,  0.007 sec
     gradient                   ...        0 min,  0.012 sec
 * total energy  :   -34.1870494 Eh     change       -0.1574474E-03 Eh
   gradient norm :     0.0082970 Eh/α   predicted    -0.1186985E-03 ( -24.61%)
   displ. norm   :     0.1957429 α      lambda       -0.2256502E-03
   maximum displ.:     0.1092355 α      in ANC's #4, #5, #1, ...

........................................................................
.............................. CYCLE    8 ..............................
........................................................................
   1    -34.7055820 -0.347056E+02  0.172E-01    2.62       0.0  T
   2    -34.7055926 -0.106628E-04  0.965E-02    2.62       1.0  T
   3    -34.7055615  0.311302E-04  0.437E-02    2.62       1.0  T
   4    -34.7056013 -0.398034E-04  0.594E-03    2.62       3.4  T
   5    -34.7056014 -0.468151E-07  0.222E-03    2.62       9.0  T
   6    -34.7056014 -0.144926E-07  0.695E-04    2.62      28.8  T
     SCC iter.                  ...        0 min,  0.007 sec
     gradient                   ...        0 min,  0.013 sec
 * total energy  :   -34.1872147 Eh     change       -0.1653067E-03 Eh
   gradient norm :     0.0067622 Eh/α   predicted    -0.1171487E-03 ( -29.13%)
   displ. norm   :     0.2068738 α      lambda       -0.2431330E-03
   maximum displ.:     0.0986619 α      in ANC's #4, #1, #2, ...

........................................................................
.............................. CYCLE    9 ..............................
........................................................................
   1    -34.7078630 -0.347079E+02  0.161E-01    2.66       0.0  T
   2    -34.7078711 -0.806462E-05  0.912E-02    2.67       1.0  T
   3    -34.7078379  0.332376E-04  0.453E-02    2.66       1.0  T
   4    -34.7078793 -0.414921E-04  0.484E-03    2.66       4.1  T
   5    -34.7078794 -0.288341E-07  0.237E-03    2.66       8.5  T
   6    -34.7078794 -0.947383E-08  0.588E-04    2.66      34.0  T
     SCC iter.                  ...        0 min,  0.007 sec
     gradient                   ...        0 min,  0.013 sec
 * total energy  :   -34.1873855 Eh     change       -0.1707989E-03 Eh
   gradient norm :     0.0043248 Eh/α   predicted    -0.1267704E-03 ( -25.78%)
   displ. norm   :     0.2288079 α      lambda       -0.1709229E-03
   maximum displ.:     0.1140722 α      in ANC's #2, #1, #4, ...

........................................................................
.............................. CYCLE   10 ..............................
........................................................................
   1    -34.7075008 -0.347075E+02  0.177E-01    2.70       0.0  T
   2    -34.7075109 -0.100448E-04  0.101E-01    2.71       1.0  T
   3    -34.7074687  0.421898E-04  0.520E-02    2.71       1.0  T
   4    -34.7075214 -0.527096E-04  0.520E-03    2.71       3.8  T
   5    -34.7075214 -0.324733E-07  0.270E-03    2.71       7.4  T
   6    -34.7075214 -0.167183E-07  0.864E-04    2.71      23.2  T
     SCC iter.                  ...        0 min,  0.007 sec
     gradient                   ...        0 min,  0.013 sec
 * total energy  :   -34.1874984 Eh     change       -0.1128766E-03 Eh
   gradient norm :     0.0055352 Eh/α   predicted    -0.8993782E-04 ( -20.32%)
   displ. norm   :     0.2015425 α      lambda       -0.2010745E-03
   maximum displ.:     0.1355363 α      in ANC's #2, #6, #1, ...

........................................................................
.............................. CYCLE   11 ..............................
........................................................................
   1    -34.7106209 -0.347106E+02  0.125E-01    2.72       0.0  T
   2    -34.7106261 -0.514646E-05  0.679E-02    2.72       1.0  T
   3    -34.7106173  0.876554E-05  0.257E-02    2.72       1.0  T
   4    -34.7106287 -0.113899E-04  0.647E-03    2.72       3.1  T
   5    -34.7106288 -0.834049E-07  0.191E-03    2.72      10.5  T
   6    -34.7106288 -0.166108E-07  0.798E-04    2.72      25.1  T
     SCC iter.                  ...        0 min,  0.007 sec
     gradient                   ...        0 min,  0.013 sec
 * total energy  :   -34.1875654 Eh     change       -0.6694450E-04 Eh
   gradient norm :     0.0079400 Eh/α   predicted    -0.1046226E-03 (  56.28%)
   displ. norm   :     0.1085970 α      lambda       -0.1179894E-03
   maximum displ.:     0.0622200 α      in ANC's #2, #1, #3, ...

........................................................................
.............................. CYCLE   12 ..............................
........................................................................
   1    -34.7081922 -0.347082E+02  0.870E-02    2.73       0.0  T
   2    -34.7081950 -0.280181E-05  0.486E-02    2.74       1.0  T
   3    -34.7081869  0.801830E-05  0.233E-02    2.74       1.0  T
   4    -34.7081970 -0.100994E-04  0.377E-03    2.74       5.3  T
   5    -34.7081971 -0.341299E-07  0.140E-03    2.74      14.3  T
   6    -34.7081971 -0.618075E-08  0.562E-04    2.74      35.6  T
     SCC iter.                  ...        0 min,  0.007 sec
     gradient                   ...        0 min,  0.026 sec
 * total energy  :   -34.1876461 Eh     change       -0.8077339E-04 Eh
   gradient norm :     0.0032515 Eh/α   predicted    -0.5969286E-04 ( -26.10%)
   displ. norm   :     0.0915905 α      lambda       -0.6534045E-04
   maximum displ.:     0.0639068 α      in ANC's #2, #1, #3, ...

........................................................................
.............................. CYCLE   13 ..............................
........................................................................
   1    -34.7069084 -0.347069E+02  0.574E-02    2.74       0.0  T
   2    -34.7069093 -0.901453E-06  0.313E-02    2.74       1.0  T
   3    -34.7069080  0.126866E-05  0.101E-02    2.74       2.0  T
   4    -34.7069096 -0.158870E-05  0.338E-03    2.74       5.9  T
   5    -34.7069097 -0.577160E-07  0.963E-04    2.74      20.8  T
   6    -34.7069097 -0.616210E-08  0.365E-04    2.74      54.8  T
     SCC iter.                  ...        0 min,  0.007 sec
     gradient                   ...        0 min,  0.013 sec
 * total energy  :   -34.1876956 Eh     change       -0.4949941E-04 Eh
   gradient norm :     0.0025939 Eh/α   predicted    -0.3294489E-04 ( -33.44%)
   displ. norm   :     0.1196504 α      lambda       -0.6108269E-04
   maximum displ.:     0.0817525 α      in ANC's #2, #1, #4, ...

........................................................................
.............................. CYCLE   14 ..............................
........................................................................
   1    -34.7062509 -0.347063E+02  0.863E-02    2.74       0.0  T
   2    -34.7062530 -0.203342E-05  0.449E-02    2.74       1.0  T
   3    -34.7062529  0.359204E-07  0.905E-03    2.74       2.2  T
   4    -34.7062532 -0.234281E-06  0.551E-03    2.74       3.6  T
   5    -34.7062535 -0.335506E-06  0.103E-03    2.74      19.4  T
   6    -34.7062535 -0.940915E-08  0.425E-04    2.74      47.1  T
   7    -34.7062535 -0.118034E-08  0.280E-04    2.74      71.4  T
     SCC iter.                  ...        0 min,  0.008 sec
     gradient                   ...        0 min,  0.013 sec
 * total energy  :   -34.1877408 Eh     change       -0.4516581E-04 Eh
   gradient norm :     0.0025310 Eh/α   predicted    -0.3097912E-04 ( -31.41%)
   displ. norm   :     0.1308435 α      lambda       -0.4399349E-04
   maximum displ.:     0.0903551 α      in ANC's #2, #1, #3, ...

........................................................................
.............................. CYCLE   15 ..............................
........................................................................
   1    -34.7062151 -0.347062E+02  0.827E-02    2.75       0.0  T
   2    -34.7062165 -0.138985E-05  0.450E-02    2.75       1.0  T
   3    -34.7062150  0.146356E-05  0.118E-02    2.75       1.7  T
   4    -34.7062169 -0.193503E-05  0.464E-03    2.75       4.3  T
   5    -34.7062170 -0.106251E-06  0.894E-04    2.75      22.4  T
   6    -34.7062170 -0.633847E-08  0.446E-04    2.75      44.8  T
     SCC iter.                  ...        0 min,  0.007 sec
     gradient                   ...        0 min,  0.013 sec
 * total energy  :   -34.1877729 Eh     change       -0.3207875E-04 Eh
   gradient norm :     0.0020511 Eh/α   predicted    -0.2237707E-04 ( -30.24%)
   displ. norm   :     0.1423027 α      lambda       -0.3244832E-04
   maximum displ.:     0.0969391 α      in ANC's #2, #1, #3, ...

........................................................................
.............................. CYCLE   16 ..............................
........................................................................
   1    -34.7066788 -0.347067E+02  0.975E-02    2.76       0.0  T
   2    -34.7066809 -0.208002E-05  0.529E-02    2.76       1.0  T
   3    -34.7066777  0.321125E-05  0.159E-02    2.76       1.3  T
   4    -34.7066819 -0.418266E-05  0.532E-03    2.76       3.8  T
   5    -34.7066819 -0.889278E-07  0.931E-04    2.76      21.5  T
   6    -34.7066820 -0.679819E-08  0.507E-04    2.76      39.5  T
     SCC iter.                  ...        0 min,  0.007 sec
     gradient                   ...        0 min,  0.013 sec
 * total energy  :   -34.1877945 Eh     change       -0.2165830E-04 Eh
   gradient norm :     0.0014722 Eh/α   predicted    -0.1655343E-04 ( -23.57%)
   displ. norm   :     0.1332646 α      lambda       -0.1323223E-04
   maximum displ.:     0.0931964 α      in ANC's #1, #2, #3, ...

........................................................................
.............................. CYCLE   17 ..............................
........................................................................
   1    -34.7071182 -0.347071E+02  0.841E-02    2.78       0.0  T
   2    -34.7071195 -0.139426E-05  0.472E-02    2.78       1.0  T
   3    -34.7071143  0.529183E-05  0.180E-02    2.78       1.1  T
   4    -34.7071206 -0.639011E-05  0.336E-03    2.78       6.0  T
   5    -34.7071207 -0.167586E-07  0.103E-03    2.78      19.3  T
   6    -34.7071207 -0.416996E-08  0.440E-04    2.78      45.4  T
   7    -34.7071207 -0.746994E-10  0.235E-04    2.78      85.1  T
     SCC iter.                  ...        0 min,  0.008 sec
     gradient                   ...        0 min,  0.013 sec
 * total energy  :   -34.1878030 Eh     change       -0.8502107E-05 Eh
   gradient norm :     0.0011900 Eh/α   predicted    -0.6669913E-05 ( -21.55%)
   displ. norm   :     0.0184914 α      lambda       -0.4200836E-05
   maximum displ.:     0.0095041 α      in ANC's #3, #5, #2, ...

........................................................................
.............................. CYCLE   18 ..............................
........................................................................
   1    -34.7077368 -0.347077E+02  0.122E-02    2.78       0.0  T
   2    -34.7077368 -0.618893E-07  0.671E-03    2.78       3.0  T
   3    -34.7077367  0.990841E-07  0.262E-03    2.78       7.6  T
   4    -34.7077369 -0.122204E-06  0.823E-04    2.78      24.3  T
   5    -34.7077369 -0.465201E-08  0.288E-04    2.78      69.5  T
     SCC iter.                  ...        0 min,  0.006 sec
     gradient                   ...        0 min,  0.013 sec
 * total energy  :   -34.1878050 Eh     change       -0.1933687E-05 Eh
   gradient norm :     0.0009177 Eh/α   predicted    -0.2104358E-05 (   8.83%)
   displ. norm   :     0.0177757 α      lambda       -0.2323940E-05
   maximum displ.:     0.0094863 α      in ANC's #2, #4, #5, ...

   *** GEOMETRY OPTIMIZATION CONVERGED AFTER 18 ITERATIONS ***

------------------------------------------------------------------------
 total energy gain   :        -0.0052560 Eh       -3.2982 kcal/mol
 total RMSD          :         0.3551986 a0        0.1880 Å
 total power (kW/mol):        -0.7666531 (step)  -25.3594 (real)
------------------------------------------------------------------------

 ANCopt (total)                0 d,  0 h,  0 min,  0.544 sec
 optimizer setup                ...        0 min,  0.000 sec (  0.027%)
 model hessian                  ...        0 min,  0.010 sec (  1.826%)
 ANC generation                 ...        0 min,  0.001 sec (  0.136%)
 coordinate transformation      ...        0 min,  0.000 sec (  0.061%)
 single point calculation       ...        0 min,  0.527 sec ( 96.756%)
 optimization log               ...        0 min,  0.002 sec (  0.335%)
 hessian update                 ...        0 min,  0.000 sec (  0.043%)
 rational function              ...        0 min,  0.003 sec (  0.610%)

================
 final structure:
================
$coord
    2.89372010308022    2.29311087796595   -0.11382377388976      C 
    5.16493722868752   -0.01409859098772    0.10444193798359      S 
    2.88200167621372   -2.32934990499885    0.10186795893442      C 
    0.50787474842593   -1.36579728307940   -0.05758181902065      C 
    0.51703391053323    1.32130566578488   -0.18824941982979      C 
   -1.85292916032578    2.88231169332165   -0.28409141231259      C 
   -4.14386939344859    1.20399408033155   -0.92536928606877      C 
   -4.12816038255158   -1.23077622079911    0.61845547882967      C 
   -1.88222953057780   -2.87363914253054   -0.14590963031490      C 
   -2.13074488711134    4.20080679391125    2.10020500076902      N 
   -3.70703618540700    6.25623834034829    2.29722338114221      C 
   -4.78410588743473    7.05840713397768    4.41728191816994      C 
    3.44338424244891    4.24127511166350   -0.16186862626443      H 
    3.43697700489666   -4.27383174448064    0.21799811280195      H 
   -1.65887993439794    4.34444245265205   -1.74347839466821      H 
   -4.09791443289680    0.73683992851729   -2.93512298246527      H 
   -5.86727200373795    2.27737760277666   -0.55249931110808      H 
   -5.88422346321167   -2.26889295933658    0.31231831726949      H 
   -4.00905074515488   -0.78007437265563    2.62983770586594      H 
   -2.16910135539148   -3.56317563415369   -2.07595910222931      H 
   -1.72826593698503   -4.52388767034092    1.08355084150239      H 
   -2.11108117403818    3.06856272023192    3.63767772030388      H 
   -3.92873624700785    7.29527541858848    0.54946832824719      H 
   -4.57517311752413    6.05265641789339    6.17158746521549      H 
   -5.86623433305914    8.77300905244550    4.46476057880712      H 
$end
           -------------------------------------------------
          |                Final Singlepoint                |
           -------------------------------------------------

          ...................................................
          :                      SETUP                      :
          :.................................................:
          :  # basis functions                  67          :
          :  # atomic orbitals                  66          :
          :  # shells                           38          :
          :  # electrons                        64          :
          :  max. iterations                   250          :
          :  Hamiltonian                  GFN2-xTB          :
          :  restarted?                      false          :
          :  GBSA solvation                  false          :
          :  PC potential                    false          :
          :  electronic temp.          300.0000000     K    :
          :  accuracy                    1.0000000          :
          :  -> integral cutoff          0.2500000E+02      :
          :  -> integral neglect         0.1000000E-07      :
          :  -> SCF convergence          0.1000000E-05 Eh   :
          :  -> wf. convergence          0.1000000E-03 e    :
          :  Broyden damping             0.4000000          :
          ...................................................

 iter      E             dE          RMSdq      gap      omega  full diag
   1    -34.7077369 -0.347077E+02  0.207E-04    2.78       0.0  T
   2    -34.7077369 -0.630322E-10  0.114E-04    2.78     176.0  T
   3    -34.7077369 -0.324832E-09  0.656E-05    2.78     304.8  T

   *** convergence criteria satisfied after 3 iterations ***

         #    Occupation            Energy/Eh            Energy/eV
      -------------------------------------------------------------
         1        2.0000           -0.7278833             -19.8067
       ...           ...                  ...                  ...
        26        2.0000           -0.4421336             -12.0311
        27        2.0000           -0.4334834             -11.7957
        28        2.0000           -0.4287332             -11.6664
        29        2.0000           -0.4250758             -11.5669
        30        2.0000           -0.3896267             -10.6023
        31        2.0000           -0.3864682             -10.5163
        32        2.0000           -0.3438125              -9.3556 (HOMO)
        33                         -0.2415627              -6.5733 (LUMO)
        34                         -0.1988885              -5.4120
        35                         -0.1730189              -4.7081
        36                         -0.1684509              -4.5838
        37                         -0.1114859              -3.0337
       ...                                ...                  ...
        66                          0.6868432              18.6900
      -------------------------------------------------------------
                  HL-Gap            0.1022498 Eh            2.7824 eV
             Fermi-level           -0.2926876 Eh           -7.9644 eV

 SCC (total)                   0 d,  0 h,  0 min,  0.027 sec
 SCC setup                      ...        0 min,  0.000 sec (  0.727%)
 Dispersion                     ...        0 min,  0.000 sec (  0.758%)
 integral evaluation            ...        0 min,  0.008 sec ( 31.271%)
 zeroth order Hamiltonian       ...        0 min,  0.000 sec (  0.574%)
 iterations                     ...        0 min,  0.004 sec ( 14.747%)
 molecular gradient             ...        0 min,  0.013 sec ( 50.408%)
 printout                       ...        0 min,  0.000 sec (  1.282%)

         :::::::::::::::::::::::::::::::::::::::::::::::::::::
         ::                     SUMMARY                     ::
         :::::::::::::::::::::::::::::::::::::::::::::::::::::
         :: total energy             -34.187804951782 Eh    ::
         :: gradient norm              0.000918465360 Eh/a0 ::
         :: HOMO-LUMO gap              2.782359569009 eV    ::
         ::.................................................::
         :: SCC energy               -34.707736876051 Eh    ::
         :: -> isotropic ES            0.009336631114 Eh    ::
         :: -> anisotropic ES          0.006223724880 Eh    ::
         :: -> anisotropic XC          0.019116293815 Eh    ::
         :: -> dispersion             -0.024234662322 Eh    ::
         :: repulsion energy           0.519750481588 Eh    ::
         :: add. restraining           0.000000000000 Eh    ::
         :::::::::::::::::::::::::::::::::::::::::::::::::::::

           -------------------------------------------------
          |                Property Printout                |
           -------------------------------------------------

    * Orbital Energies and Occupations

         #    Occupation            Energy/Eh            Energy/eV
      -------------------------------------------------------------
         1        2.0000           -0.7278833             -19.8067
       ...           ...                  ...                  ...
        20        2.0000           -0.4765663             -12.9680
        21        2.0000           -0.4704367             -12.8012
        22        2.0000           -0.4651235             -12.6567
        23        2.0000           -0.4587727             -12.4838
        24        2.0000           -0.4551667             -12.3857
        25        2.0000           -0.4437594             -12.0753
        26        2.0000           -0.4421336             -12.0311
        27        2.0000           -0.4334834             -11.7957
        28        2.0000           -0.4287332             -11.6664
        29        2.0000           -0.4250758             -11.5669
        30        2.0000           -0.3896267             -10.6023
        31        2.0000           -0.3864682             -10.5163
        32        2.0000           -0.3438125              -9.3556 (HOMO)
        33                         -0.2415627              -6.5733 (LUMO)
        34                         -0.1988885              -5.4120
        35                         -0.1730189              -4.7081
        36                         -0.1684509              -4.5838
        37                         -0.1114859              -3.0337
        38                          0.0013744               0.0374
        39                          0.0317617               0.8643
        40                          0.0337650               0.9188
        41                          0.0465326               1.2662
        42                          0.0807532               2.1974
        43                          0.0900110               2.4493
       ...                                ...                  ...
        66                          0.6868432              18.6900
      -------------------------------------------------------------
                  HL-Gap            0.1022498 Eh            2.7824 eV
             Fermi-level           -0.2926876 Eh           -7.9644 eV

     #   Z        covCN         q      C6AA      α(0)
     1   6 C      2.941    -0.028    28.710     8.788
     2  16 S      2.296    -0.034   142.461    20.089
     3   6 C      2.943    -0.036    28.893     8.816
     4   6 C      3.163    -0.007    27.847     8.625
     5   6 C      3.175    -0.018    28.056     8.650
     6   6 C      3.795     0.047    19.794     6.335
     7   6 C      3.806    -0.064    21.726     6.635
     8   6 C      3.806    -0.051    21.479     6.598
     9   6 C      3.808    -0.056    21.576     6.612
    10   7 N      2.691    -0.193    25.178     7.452
    11   6 C      2.824     0.026    27.416     8.580
    12   6 C      2.839    -0.143    31.653     9.220
    13   1 H      0.926     0.046     2.374     2.409
    14   1 H      0.926     0.040     2.448     2.447
    15   1 H      0.923     0.039     2.460     2.453
    16   1 H      0.924     0.036     2.508     2.476
    17   1 H      0.924     0.035     2.515     2.480
    18   1 H      0.924     0.031     2.565     2.505
    19   1 H      0.924     0.033     2.544     2.494
    20   1 H      0.924     0.042     2.418     2.432
    21   1 H      0.924     0.037     2.486     2.466
    22   1 H      0.860     0.150     1.401     1.854
    23   1 H      0.925     0.024     2.670     2.555
    24   1 H      0.926     0.019     2.755     2.596
    25   1 H      0.926     0.025     2.665     2.553

 Mol. C6AA /au·bohr⁶  :       7682.615787
 Mol. C8AA /au·bohr⁸  :     201366.436665
 Mol. α(0) /au        :        138.120895


Wiberg/Mayer (AO) data.
largest (>0.10) Wiberg bond orders for each atom
          total WBO             WBO to atom ...
     1  C   3.947        C    5 1.605    S    2 1.195    H   13 0.970    C    3 0.119
     2  S   2.630        C    1 1.195    C    3 1.183
     3  C   3.943        C    4 1.607    S    2 1.183    H   14 0.971    C    1 0.119
     4  C   3.985        C    3 1.607    C    5 1.224    C    9 1.009
     5  C   3.983        C    1 1.605    C    4 1.224    C    6 0.988
     6  C   3.981        C    5 0.988    N   10 0.988    C    7 0.978    H   15 0.956
     7  C   3.997        C    8 1.011    C    6 0.978    H   16 0.976    H   17 0.975
     8  C   3.998        C    7 1.011    C    9 1.005    H   18 0.977    H   19 0.976
     9  C   3.998        C    4 1.009    C    8 1.005    H   21 0.971    H   20 0.960
    10  N   3.318        C   11 1.154    C    6 0.988    H   22 0.944    C   12 0.150
    11  C   3.971        C   12 1.832    N   10 1.154    H   23 0.961
    12  C   3.968        C   11 1.832    H   25 0.979    H   24 0.977    N   10 0.150
    13  H   0.998        C    1 0.970
    14  H   0.998        C    3 0.971
    15  H   0.998        C    6 0.956
    16  H   0.999        C    7 0.976
    17  H   0.998        C    7 0.975
    18  H   0.998        C    8 0.977
    19  H   0.999        C    8 0.976
    20  H   0.998        C    9 0.960
    21  H   0.998        C    9 0.971
    22  H   0.978        N   10 0.944
    23  H   0.999        C   11 0.961
    24  H   1.000        C   12 0.977
    25  H   0.999        C   12 0.979

molecular dipole:
                 x           y           z       tot (Debye)
 q only:       -0.120      -0.522      -0.312
   full:       -0.503      -0.618      -0.305       2.168
molecular quadrupole (traceless):
                xx          xy          yy          xz          yz          zz
 q only:        0.081       3.629      -1.089       2.305      -4.093       1.009
  q+dip:       -2.990       2.860       0.265       1.794      -5.386       2.725
   full:       -3.036       3.094       0.218       1.905      -5.113       2.818

           -------------------------------------------------
          |                Geometry Summary                 |
           -------------------------------------------------

      molecular mass/u    :      179.2794000
   center of mass at/Å    :       -0.1891210       0.7044827       0.3340009
  moments of inertia/u·Å² :        0.3712522E+03   0.8945749E+03   0.1161908E+04
rotational constants/cm⁻¹ :        0.4540750E-01   0.1884429E-01   0.1450858E-01

 * 25 selected distances

     #   Z        #   Z                                     value/Å
     1   6 C      2  16 S                                 1.7171197
     2  16 S      3   6 C                                 1.7206148 (max)
     3   6 C      4   6 C                                 1.3584854
     1   6 C      5   6 C                                 1.3593349
     4   6 C      5   6 C                                 1.4236422
     6   6 C      7   6 C                                 1.5406598
     7   6 C      8   6 C                                 1.5256235
     4   6 C      9   6 C                                 1.4961767
     8   6 C      9   6 C                                 1.5270646
     6   6 C     10   7 N                                 1.4492580
    10   7 N     11   6 C                                 1.3746707
    11   6 C     12   6 C                                 1.3280348
     1   6 C     13   1 H                                 1.0714739
     3   6 C     14   1 H                                 1.0718281
     6   6 C     15   1 H                                 1.0980003
     7   6 C     16   1 H                                 1.0921397
     7   6 C     17   1 H                                 1.0923763
     8   6 C     18   1 H                                 1.0915894
     8   6 C     19   1 H                                 1.0925912
     9   6 C     20   1 H                                 1.0951345
     9   6 C     21   1 H                                 1.0920298
    10   7 N     22   1 H                                 1.0104633 (min)
    11   6 C     23   1 H                                 1.0823450
    12   6 C     24   1 H                                 1.0757765
    12   6 C     25   1 H                                 1.0732148

 * 5 distinct bonds (by element types)

   Z      Z             #   av. dist./Å        max./Å        min./Å
   1 H    6 C          12     1.0857083     1.0980003     1.0714739
   6 C    6 C           8     1.4448777     1.5406598     1.3280348
   1 H    7 N           1     1.0104633     1.0104633     1.0104633
   6 C    7 N           2     1.4119643     1.4492580     1.3746707
   6 C   16 S           2     1.7188672     1.7206148     1.7171197


optimized geometry written to: xtbopt.xyz


           -------------------------------------------------
          | TOTAL ENERGY              -34.187804951782 Eh   |
          | GRADIENT NORM               0.000918465360 Eh/α |
          | HOMO-LUMO GAP               2.782359569009 eV   |
           -------------------------------------------------

------------------------------------------------------------------------
 * finished run on 2021/05/19 at 11:00:12.632     
------------------------------------------------------------------------
 total:
 * wall-time:     0 d,  0 h,  0 min,  0.630 sec
 *  cpu-time:     0 d,  0 h,  0 min,  0.616 sec
 * ratio c/w:     0.979 speedup
 SCF:
 * wall-time:     0 d,  0 h,  0 min,  0.037 sec
 *  cpu-time:     0 d,  0 h,  0 min,  0.037 sec
 * ratio c/w:     1.000 speedup
 ANC optimizer:
 * wall-time:     0 d,  0 h,  0 min,  0.571 sec
 *  cpu-time:     0 d,  0 h,  0 min,  0.558 sec
 * ratio c/w:     0.977 speedup

