      -----------------------------------------------------------      
     |                   =====================                   |     
     |                           x T B                           |     
     |                   =====================                   |     
     |                         S. Grimme                         |     
     |          Mulliken Center for Theoretical Chemistry        |     
     |                    University of Bonn                     |     
     |                Version 6.2 RC2 (SAW190805)                |     
      -----------------------------------------------------------      

   This program is distributed in the hope that it will be useful,
   but WITHOUT ANY WARRANTY; without even the implied warranty of
   MERCHANTABILITY or FITNESS FOR A PARTICULAR PURPOSE.
   
   FOR NON-COMMERCIAL, ACADEMIA USE ONLY.
   
   Cite this work as:
   * S. Grimme, C. Bannwarth, P. Shushkov, J. Chem. Theory Comput., 2017,
     13, 1989-2009. DOI: 10.1021/acs.jctc.7b00118
   * C. Bannwarth, S. Ehlert and S. Grimme., J. Chem. Theory Comput., 2019,
     15, 1652-1671. DOI: 10.1021/acs.jctc.8b01176
   * P. Pracht, E. Caldeweyher, S. Ehlert, S. Grimme, ChemRxiv, 2019, preprint.
     DOI: 10.26434/chemrxiv.8326202.v1
   
   for DFT-D4:
   * E. Caldeweyher, C. Bannwarth and S. Grimme, J. Chem. Phys., 2017,
     147, 034112. DOI: 10.1063/1.4993215
   * E. Caldeweyher, S. Ehlert, A. Hansen, H. Neugebauer, S. Spicher,
     C. Bannwarth and S. Grimme, J. Chem. Phys., 2019, 150, 154122.
     DOI: 10.1063/1.5090222
   
   for sTDA-xTB:
   * S. Grimme and C. Bannwarth, J. Chem. Phys., 2016, 145, 054103.
     DOI: 10.1063/1.4959605
   
   in the mass-spec context:
   * V. Asgeirsson, C. Bauer and S. Grimme, Chem. Sci., 2017, 8, 4879.
     DOI: 10.1039/c7sc00601b
   
   for metadynamics refer to:
   * S. Grimme, J. Chem. Theory Comput., 2019, 155, 2847-2862
     DOI: 10.1021/acs.jctc.9b00143
   
   with help from (in alphabetical order)
   C. Bannwarth, F. Bohle, G. Brandenburg, E. Caldeweyher, M. Checinski,
   S. Dohm, S. Ehlert, S. Ehrlich, F. März, H. Neugebauer, J. Pisarek,
   P. Pracht, P. Shushkov, and S. Spicher.
   
 * started run on 2021/05/19 at 11:00:12.738     

           -------------------------------------------------
          |                Calculation Setup                |
           -------------------------------------------------

          program call               : /ihome/ghutchison/geoffh/xtb/xtb 802.xyz -opt
          hostname                   : smp-n83
          coordinate file            : 802.xyz
          omp threads                :                     1
          number of atoms            :                    25
          number of electrons        :                    76
          charge                     :                     0
          spin                       :                   0.0
          first test random number   :      0.67243719480799


########################################################################
# WARNING! Please study the warnings concerning your input carefully
#  - the use of '-opt' is discouraged, please use '--opt' next time
########################################################################

           ------------------------------------------------- 
          |                 G F N 2 - x T B                 |
          | Geometry, Frequencies, Noncovalent interactions |
          |            JCTC 2019 parametrisation            |
           ------------------------------------------------- 
             KAB for C  - Si     :                1.0500
             KAB for H  - Pd     :                0.9500
             k(s)              :                1.8500
             k(p)              :                2.2300
             k(d)              :                2.2300
             k(f)              :                2.0000
             kEN (H0ij)        :               -2.0000
             D4 a1             :                0.5200
             D4 a2             :                5.0000
             D4 s6             :                1.0000
             D4 s8             :                2.7000
             D4 s9             :                5.0000
             alphaj            :                2.0000

  Z AO/shell   Hii/eV     exponent
  1     Wed Apr 25 08:07:45 CEST 2018   EN: 2.200 GM2: 0.406  GM3: 0.0800  RAES: 1.40
     1s    -10.707211    1.230000
  6     Wed Apr 25 08:07:45 CEST 2018   EN: 2.550 GM2: 0.538  GM3: 0.1500  RAES: 3.00
     2s    -13.970922    2.096432
     2p    -10.063292    1.800000
  8     Wed Apr 25 08:07:45 CEST 2018   EN: 3.440 GM2: 0.452  GM3:-0.0517  RAES: 1.80
     2s    -20.229985    2.439742
     2p    -15.503117    2.137023
 16     Tue Apr 24 11:44:34 CEST 2018   EN: 2.580 GM2: 0.340  GM3:-0.0502  RAES: 3.10
     3s    -20.029654    1.981333
     3p    -11.377694    2.025643
     3d     -0.420282    1.702555

           ------------------------------------------------- 
          |        Self-Consistent Charge Iterations        |
           ------------------------------------------------- 

          ...................................................
          :                      SETUP                      :
          :.................................................:
          :  # basis functions                  76          :
          :  # atomic orbitals                  75          :
          :  # shells                           41          :
          :  # electrons                        76          :
          :  max. iterations                   250          :
          :  Hamiltonian                  GFN2-xTB          :
          :  restarted?                      false          :
          :  GBSA solvation                  false          :
          :  PC potential                    false          :
          :  electronic temp.          300.0000000     K    :
          :  accuracy                    1.0000000          :
          :  -> integral cutoff          0.2500000E+02      :
          :  -> integral neglect         0.1000000E-07      :
          :  -> SCF convergence          0.1000000E-05 Eh   :
          :  -> wf. convergence          0.1000000E-03 e    :
          :  Broyden damping             0.4000000          :
          ...................................................

 iter      E             dE          RMSdq      gap      omega  full diag
   1    -42.6527892 -0.426528E+02  0.496E+00    1.85       0.0  T
   2    -42.6955782 -0.427890E-01  0.283E+00    1.86       1.0  T
   3    -42.6729477  0.226305E-01  0.156E+00    1.95       1.0  T
   4    -42.6890524 -0.161047E-01  0.830E-01    1.82       1.0  T
   5    -42.7044022 -0.153497E-01  0.226E-01    1.86       1.0  T
   6    -42.7051818 -0.779610E-03  0.106E-01    1.84       1.0  T
   7    -42.7053327 -0.150910E-03  0.412E-02    1.85       1.0  T
   8    -42.7053473 -0.146135E-04  0.150E-02    1.85       1.3  T
   9    -42.7053487 -0.144770E-05  0.914E-03    1.85       2.2  T
  10    -42.7053492 -0.495638E-06  0.395E-03    1.85       5.1  T
  11    -42.7053494 -0.150859E-06  0.173E-03    1.85      11.5  T
  12    -42.7053494 -0.417904E-07  0.643E-04    1.85      31.1  T
  13    -42.7053494 -0.130922E-08  0.271E-04    1.85      73.7  T

   *** convergence criteria satisfied after 13 iterations ***

         #    Occupation            Energy/Eh            Energy/eV
      -------------------------------------------------------------
         1        2.0000           -0.7414590             -20.1761
       ...           ...                  ...                  ...
        32        2.0000           -0.4451429             -12.1130
        33        2.0000           -0.4432393             -12.0612
        34        2.0000           -0.4355162             -11.8510
        35        2.0000           -0.4199267             -11.4268
        36        2.0000           -0.4086426             -11.1197
        37        2.0000           -0.4054612             -11.0332
        38        2.0000           -0.3657645              -9.9530 (HOMO)
        39                         -0.2979313              -8.1071 (LUMO)
        40                         -0.2630150              -7.1570
        41                         -0.2241927              -6.1006
        42                         -0.2056884              -5.5971
        43                         -0.1933358              -5.2609
       ...                                ...                  ...
        75                          0.7326249              19.9357
      -------------------------------------------------------------
                  HL-Gap            0.0678332 Eh            1.8458 eV
             Fermi-level           -0.3318479 Eh           -9.0300 eV

 SCC (total)                   0 d,  0 h,  0 min,  0.045 sec
 SCC setup                      ...        0 min,  0.000 sec (  0.728%)
 Dispersion                     ...        0 min,  0.000 sec (  0.892%)
 integral evaluation            ...        0 min,  0.011 sec ( 25.021%)
 zeroth order Hamiltonian       ...        0 min,  0.000 sec (  0.417%)
 iterations                     ...        0 min,  0.018 sec ( 38.677%)
 molecular gradient             ...        0 min,  0.015 sec ( 33.339%)
 printout                       ...        0 min,  0.000 sec (  0.815%)

         :::::::::::::::::::::::::::::::::::::::::::::::::::::
         ::                     SUMMARY                     ::
         :::::::::::::::::::::::::::::::::::::::::::::::::::::
         :: total energy             -42.125840870368 Eh    ::
         :: gradient norm              0.104518782300 Eh/a0 ::
         :: HOMO-LUMO gap              1.845834649975 eV    ::
         ::.................................................::
         :: SCC energy               -42.705349428652 Eh    ::
         :: -> isotropic ES            0.045704036754 Eh    ::
         :: -> anisotropic ES          0.001782536611 Eh    ::
         :: -> anisotropic XC          0.016808073747 Eh    ::
         :: -> dispersion             -0.026020925491 Eh    ::
         :: repulsion energy           0.579614831325 Eh    ::
         :: add. restraining           0.000000000000 Eh    ::
         :::::::::::::::::::::::::::::::::::::::::::::::::::::

      ----------------------------------------------------------- 
     |                   =====================                   |
     |                        A N C O P T                        |
     |                   =====================                   |
     |               Approximate Normal Coordinate               |
     |                Rational Function Optimizer                |
      ----------------------------------------------------------- 

          ...................................................
          :                      SETUP                      :
          :.................................................:
          :   optimization level            normal          :
          :   max. optcycles                   200          :
          :   ANC micro-cycles                  20          :
          :   degrees of freedom                69          :
          :.................................................:
          :   RF solver                   davidson          :
          :   input Hessian                  false          :
          :   write xtbopt.log                true          :
          :   linear?                        false          :
          :   energy convergence         0.5000000E-05 Eh   :
          :   grad. convergence          0.1000000E-02 Eh/α :
          :   maximium RF displ.         2.0000000          :
          :   Hlow (freq-cutoff)         0.5000000E-02      :
          :   Hmax (freq-cutoff)         5.0000000          :
          :   S6 in model hess.         20.0000000          :
          ...................................................

generating ANC from model Hessian ...
Using Lindh-Hessian (1995)
 Shifting diagonal of input Hessian by   4.507237878166323E-003
 Lowest  eigenvalues of input Hessian
   -0.000000   -0.000000   -0.000000   -0.000000    0.000000    0.000000
    0.005000    0.006885    0.007429    0.008014    0.008600    0.011608
    0.012431    0.013442    0.018591    0.021437    0.023219    0.023738
 Highest eigenvalues
    1.749677    1.795495    1.935884    1.974762    2.052691    2.297577
 

........................................................................
.............................. CYCLE    1 ..............................
........................................................................
   1    -42.7053494 -0.427053E+02  0.113E-04    1.85       0.0  T
   2    -42.7053494 -0.521396E-10  0.793E-05    1.85     252.2  T
   3    -42.7053494 -0.105125E-09  0.387E-05    1.85     517.4  T
     SCC iter.                  ...        0 min,  0.005 sec
     gradient                   ...        0 min,  0.015 sec
 * total energy  :   -42.1258409 Eh     change        0.1233122E-07 Eh
   gradient norm :     0.1045205 Eh/α   predicted     0.0000000E+00 (-100.00%)
   displ. norm   :     0.3077743 α      lambda       -0.1848935E-01
   maximum displ.:     0.1556814 α      in ANC's #32, #18, #24, ...

........................................................................
.............................. CYCLE    2 ..............................
........................................................................
   1    -42.7446949 -0.427447E+02  0.283E-01    1.92       0.0  T
   2    -42.7448084 -0.113464E-03  0.170E-01    1.91       1.0  T
   3    -42.7446704  0.137975E-03  0.111E-01    1.91       1.0  T
   4    -42.7448794 -0.208972E-03  0.476E-02    1.91       1.0  T
   5    -42.7449168 -0.373935E-04  0.200E-02    1.91       1.0  T
   6    -42.7449219 -0.515093E-05  0.725E-03    1.91       2.8  T
   7    -42.7449227 -0.755875E-06  0.227E-03    1.91       8.8  T
   8    -42.7449228 -0.657663E-07  0.978E-04    1.91      20.4  T
     SCC iter.                  ...        0 min,  0.010 sec
     gradient                   ...        0 min,  0.014 sec
 * total energy  :   -42.1384528 Eh     change       -0.1261193E-01 Eh
   gradient norm :     0.0466774 Eh/α   predicted    -0.1012037E-01 ( -19.76%)
   displ. norm   :     0.2355031 α      lambda       -0.4635086E-02
   maximum displ.:     0.1137146 α      in ANC's #5, #32, #7, ...

........................................................................
.............................. CYCLE    3 ..............................
........................................................................
   1    -42.7596151 -0.427596E+02  0.192E-01    1.98       0.0  T
   2    -42.7596542 -0.390512E-04  0.117E-01    1.97       1.0  T
   3    -42.7596027  0.514837E-04  0.631E-02    1.97       1.0  T
   4    -42.7596792 -0.764830E-04  0.155E-02    1.97       1.3  T
   5    -42.7596825 -0.327850E-05  0.594E-03    1.97       3.4  T
   6    -42.7596827 -0.214839E-06  0.303E-03    1.97       6.6  T
     SCC iter.                  ...        0 min,  0.008 sec
     gradient                   ...        0 min,  0.014 sec
 * total energy  :   -42.1410152 Eh     change       -0.2562377E-02 Eh
   gradient norm :     0.0121904 Eh/α   predicted    -0.2446087E-02 (  -4.54%)
   displ. norm   :     0.1831275 α      lambda       -0.5440035E-03
   maximum displ.:     0.1293585 α      in ANC's #5, #3, #7, ...

........................................................................
.............................. CYCLE    4 ..............................
........................................................................
   1    -42.7576096 -0.427576E+02  0.119E-01    1.97       0.0  T
   2    -42.7576126 -0.303065E-05  0.675E-02    1.97       1.0  T
   3    -42.7575909  0.217353E-04  0.326E-02    1.98       1.0  T
   4    -42.7576137 -0.228263E-04  0.103E-02    1.97       1.9  T
   5    -42.7576151 -0.135029E-05  0.514E-03    1.97       3.9  T
   6    -42.7576155 -0.391761E-06  0.123E-03    1.97      16.3  T
   7    -42.7576155 -0.177170E-07  0.563E-04    1.97      35.5  T
     SCC iter.                  ...        0 min,  0.009 sec
     gradient                   ...        0 min,  0.014 sec
 * total energy  :   -42.1414247 Eh     change       -0.4095041E-03 Eh
   gradient norm :     0.0059916 Eh/α   predicted    -0.2811243E-03 ( -31.35%)
   displ. norm   :     0.2611296 α      lambda       -0.4926084E-03
   maximum displ.:     0.1763444 α      in ANC's #5, #3, #7, ...

........................................................................
.............................. CYCLE    5 ..............................
........................................................................
   1    -42.7548261 -0.427548E+02  0.169E-01    1.97       0.0  T
   2    -42.7548282 -0.205420E-05  0.974E-02    1.97       1.0  T
   3    -42.7547650  0.632062E-04  0.529E-02    1.97       1.0  T
   4    -42.7548321 -0.671427E-04  0.107E-02    1.97       1.9  T
   5    -42.7548332 -0.112349E-05  0.550E-03    1.97       3.6  T
   6    -42.7548337 -0.434500E-06  0.117E-03    1.97      17.1  T
   7    -42.7548337 -0.155014E-07  0.561E-04    1.97      35.7  T
     SCC iter.                  ...        0 min,  0.009 sec
     gradient                   ...        0 min,  0.014 sec
 * total energy  :   -42.1417504 Eh     change       -0.3256967E-03 Eh
   gradient norm :     0.0080155 Eh/α   predicted    -0.2631014E-03 ( -19.22%)
   displ. norm   :     0.2277248 α      lambda       -0.3117408E-03
   maximum displ.:     0.1499330 α      in ANC's #5, #3, #7, ...

........................................................................
.............................. CYCLE    6 ..............................
........................................................................
   1    -42.7544224 -0.427544E+02  0.146E-01    1.96       0.0  T
   2    -42.7544241 -0.165443E-05  0.832E-02    1.96       1.0  T
   3    -42.7543869  0.371668E-04  0.412E-02    1.97       1.0  T
   4    -42.7544268 -0.398447E-04  0.845E-03    1.96       2.4  T
   5    -42.7544270 -0.242159E-06  0.340E-03    1.96       5.9  T
   6    -42.7544272 -0.199243E-06  0.978E-04    1.96      20.4  T
   7    -42.7544272 -0.183663E-07  0.412E-04    1.96      48.5  T
     SCC iter.                  ...        0 min,  0.009 sec
     gradient                   ...        0 min,  0.014 sec
 * total energy  :   -42.1419682 Eh     change       -0.2178328E-03 Eh
   gradient norm :     0.0101718 Eh/α   predicted    -0.1639811E-03 ( -24.72%)
   displ. norm   :     0.2807439 α      lambda       -0.3727113E-03
   maximum displ.:     0.1844182 α      in ANC's #5, #3, #7, ...

........................................................................
.............................. CYCLE    7 ..............................
........................................................................
   1    -42.7553953 -0.427554E+02  0.177E-01    1.95       0.0  T
   2    -42.7553977 -0.243128E-05  0.101E-01    1.95       1.0  T
   3    -42.7553583  0.393841E-04  0.442E-02    1.95       1.0  T
   4    -42.7554006 -0.422254E-04  0.973E-03    1.95       2.1  T
   5    -42.7554006 -0.461549E-07  0.536E-03    1.95       3.7  T
   6    -42.7554012 -0.598198E-06  0.123E-03    1.95      16.2  T
   7    -42.7554012 -0.262657E-07  0.558E-04    1.95      35.8  T
     SCC iter.                  ...        0 min,  0.009 sec
     gradient                   ...        0 min,  0.014 sec
 * total energy  :   -42.1422284 Eh     change       -0.2602243E-03 Eh
   gradient norm :     0.0087735 Eh/α   predicted    -0.2010552E-03 ( -22.74%)
   displ. norm   :     0.2792294 α      lambda       -0.3403201E-03
   maximum displ.:     0.1892807 α      in ANC's #5, #3, #7, ...

........................................................................
.............................. CYCLE    8 ..............................
........................................................................
   1    -42.7573890 -0.427574E+02  0.159E-01    1.94       0.0  T
   2    -42.7573913 -0.238234E-05  0.919E-02    1.94       1.0  T
   3    -42.7573834  0.789791E-05  0.215E-02    1.94       1.0  T
   4    -42.7573924 -0.892975E-05  0.679E-03    1.94       2.9  T
   5    -42.7573923  0.253024E-07  0.464E-03    1.94       4.3  T
   6    -42.7573928 -0.431993E-06  0.119E-03    1.94      16.8  T
   7    -42.7573928 -0.265630E-07  0.531E-04    1.94      37.6  T
     SCC iter.                  ...        0 min,  0.009 sec
     gradient                   ...        0 min,  0.014 sec
 * total energy  :   -42.1424295 Eh     change       -0.2010525E-03 Eh
   gradient norm :     0.0060244 Eh/α   predicted    -0.1834292E-03 (  -8.77%)
   displ. norm   :     0.1868439 α      lambda       -0.1852354E-03
   maximum displ.:     0.1113161 α      in ANC's #5, #3, #2, ...

........................................................................
.............................. CYCLE    9 ..............................
........................................................................
   1    -42.7591768 -0.427592E+02  0.109E-01    1.93       0.0  T
   2    -42.7591779 -0.104518E-05  0.635E-02    1.93       1.0  T
   3    -42.7591643  0.135940E-04  0.276E-02    1.93       1.0  T
   4    -42.7591789 -0.146486E-04  0.487E-03    1.93       4.1  T
   5    -42.7591791 -0.154967E-06  0.329E-03    1.93       6.1  T
   6    -42.7591793 -0.208749E-06  0.928E-04    1.93      21.6  T
   7    -42.7591793 -0.130812E-07  0.304E-04    1.93      65.8  T
     SCC iter.                  ...        0 min,  0.009 sec
     gradient                   ...        0 min,  0.014 sec
 * total energy  :   -42.1425368 Eh     change       -0.1073344E-03 Eh
   gradient norm :     0.0036150 Eh/α   predicted    -0.9585199E-04 ( -10.70%)
   displ. norm   :     0.2057161 α      lambda       -0.8632307E-04
   maximum displ.:     0.1276860 α      in ANC's #5, #3, #2, ...

........................................................................
.............................. CYCLE   10 ..............................
........................................................................
   1    -42.7571307 -0.427571E+02  0.111E-01    1.93       0.0  T
   2    -42.7571313 -0.660653E-06  0.649E-02    1.93       1.0  T
   3    -42.7571281  0.325301E-05  0.127E-02    1.93       1.6  T
   4    -42.7571316 -0.355691E-05  0.365E-03    1.93       5.5  T
   5    -42.7571318 -0.124353E-06  0.147E-03    1.93      13.6  T
   6    -42.7571318 -0.234131E-07  0.511E-04    1.93      39.2  T
   7    -42.7571318 -0.273214E-08  0.257E-04    1.93      77.9  T
     SCC iter.                  ...        0 min,  0.009 sec
     gradient                   ...        0 min,  0.015 sec
 * total energy  :   -42.1425610 Eh     change       -0.2416872E-04 Eh
   gradient norm :     0.0064488 Eh/α   predicted    -0.4499273E-04 (  86.16%)
   displ. norm   :     0.1033646 α      lambda       -0.1499252E-03
   maximum displ.:     0.0663095 α      in ANC's #2, #1, #6, ...

........................................................................
.............................. CYCLE   11 ..............................
........................................................................
   1    -42.7593546 -0.427594E+02  0.657E-02    1.93       0.0  T
   2    -42.7593555 -0.876254E-06  0.390E-02    1.93       1.0  T
   3    -42.7593550  0.521995E-06  0.737E-03    1.93       2.7  T
   4    -42.7593558 -0.851825E-06  0.327E-03    1.93       6.1  T
   5    -42.7593559 -0.744585E-07  0.151E-03    1.93      13.3  T
   6    -42.7593559 -0.183313E-07  0.680E-04    1.93      29.4  T
     SCC iter.                  ...        0 min,  0.008 sec
     gradient                   ...        0 min,  0.014 sec
 * total energy  :   -42.1426261 Eh     change       -0.6515092E-04 Eh
   gradient norm :     0.0041540 Eh/α   predicted    -0.7577486E-04 (  16.31%)
   displ. norm   :     0.0771066 α      lambda       -0.5116744E-04
   maximum displ.:     0.0456155 α      in ANC's #2, #1, #3, ...

........................................................................
.............................. CYCLE   12 ..............................
........................................................................
   1    -42.7587904 -0.427588E+02  0.533E-02    1.93       0.0  T
   2    -42.7587908 -0.380396E-06  0.306E-02    1.93       1.0  T
   3    -42.7587848  0.595794E-05  0.177E-02    1.93       1.1  T
   4    -42.7587913 -0.646669E-05  0.391E-03    1.93       5.1  T
   5    -42.7587913 -0.301296E-07  0.213E-03    1.93       9.4  T
   6    -42.7587914 -0.834734E-07  0.514E-04    1.93      38.9  T
     SCC iter.                  ...        0 min,  0.008 sec
     gradient                   ...        0 min,  0.014 sec
 * total energy  :   -42.1426570 Eh     change       -0.3091060E-04 Eh
   gradient norm :     0.0029233 Eh/α   predicted    -0.2573692E-04 ( -16.74%)
   displ. norm   :     0.1065532 α      lambda       -0.4648133E-04
   maximum displ.:     0.0652095 α      in ANC's #2, #1, #4, ...

........................................................................
.............................. CYCLE   13 ..............................
........................................................................
   1    -42.7582522 -0.427583E+02  0.682E-02    1.93       0.0  T
   2    -42.7582531 -0.976480E-06  0.403E-02    1.93       1.0  T
   3    -42.7582515  0.165160E-05  0.108E-02    1.93       1.9  T
   4    -42.7582536 -0.208778E-05  0.415E-03    1.93       4.8  T
   5    -42.7582536 -0.526164E-07  0.225E-03    1.93       8.9  T
   6    -42.7582537 -0.878119E-07  0.987E-04    1.93      20.3  T
   7    -42.7582537 -0.147407E-07  0.418E-04    1.93      47.9  T
     SCC iter.                  ...        0 min,  0.009 sec
     gradient                   ...        0 min,  0.015 sec
 * total energy  :   -42.1426843 Eh     change       -0.2723862E-04 Eh
   gradient norm :     0.0028543 Eh/α   predicted    -0.2350641E-04 ( -13.70%)
   displ. norm   :     0.0930795 α      lambda       -0.3130420E-04
   maximum displ.:     0.0550146 α      in ANC's #2, #1, #4, ...

........................................................................
.............................. CYCLE   14 ..............................
........................................................................
   1    -42.7579812 -0.427580E+02  0.610E-02    1.93       0.0  T
   2    -42.7579819 -0.667213E-06  0.372E-02    1.93       1.0  T
   3    -42.7579786  0.328622E-05  0.122E-02    1.93       1.6  T
   4    -42.7579823 -0.371018E-05  0.291E-03    1.93       6.9  T
   5    -42.7579824 -0.895138E-07  0.155E-03    1.93      12.9  T
   6    -42.7579824 -0.121544E-07  0.824E-04    1.93      24.3  T
   7    -42.7579824 -0.616259E-08  0.270E-04    1.93      74.2  T
     SCC iter.                  ...        0 min,  0.009 sec
     gradient                   ...        0 min,  0.015 sec
 * total energy  :   -42.1427005 Eh     change       -0.1620531E-04 Eh
   gradient norm :     0.0032364 Eh/α   predicted    -0.1578869E-04 (  -2.57%)
   displ. norm   :     0.0740706 α      lambda       -0.2776270E-04
   maximum displ.:     0.0492283 α      in ANC's #1, #2, #4, ...

........................................................................
.............................. CYCLE   15 ..............................
........................................................................
   1    -42.7588906 -0.427589E+02  0.511E-02    1.93       0.0  T
   2    -42.7588913 -0.622109E-06  0.312E-02    1.93       1.0  T
   3    -42.7588914 -0.147577E-06  0.408E-03    1.93       4.9  T
   4    -42.7588915 -0.935621E-07  0.255E-03    1.93       7.9  T
   5    -42.7588916 -0.576702E-07  0.141E-03    1.93      14.2  T
   6    -42.7588916 -0.296030E-07  0.662E-04    1.93      30.2  T
   7    -42.7588916 -0.641584E-08  0.252E-04    1.93      79.3  T
     SCC iter.                  ...        0 min,  0.009 sec
     gradient                   ...        0 min,  0.016 sec
 * total energy  :   -42.1427135 Eh     change       -0.1298284E-04 Eh
   gradient norm :     0.0021995 Eh/α   predicted    -0.1396247E-04 (   7.55%)
   displ. norm   :     0.0666179 α      lambda       -0.1338990E-04
   maximum displ.:     0.0335195 α      in ANC's #1, #3, #2, ...

........................................................................
.............................. CYCLE   16 ..............................
........................................................................
   1    -42.7586690 -0.427587E+02  0.381E-02    1.93       0.0  T
   2    -42.7586692 -0.156577E-06  0.229E-02    1.93       1.0  T
   3    -42.7586682  0.981588E-06  0.663E-03    1.93       3.0  T
   4    -42.7586693 -0.109522E-05  0.173E-03    1.93      11.5  T
   5    -42.7586693 -0.310649E-07  0.100E-03    1.93      19.9  T
   6    -42.7586693 -0.814027E-08  0.398E-04    1.93      50.2  T
   7    -42.7586693 -0.166679E-08  0.150E-04    1.93     133.4  T
     SCC iter.                  ...        0 min,  0.009 sec
     gradient                   ...        0 min,  0.015 sec
 * total energy  :   -42.1427215 Eh     change       -0.8023956E-05 Eh
   gradient norm :     0.0010005 Eh/α   predicted    -0.6725312E-05 ( -16.18%)
   displ. norm   :     0.0418034 α      lambda       -0.7905596E-05
   maximum displ.:     0.0317522 α      in ANC's #1, #5, #3, ...

........................................................................
.............................. CYCLE   17 ..............................
........................................................................
   1    -42.7594387 -0.427594E+02  0.225E-02    1.93       0.0  T
   2    -42.7594389 -0.225907E-06  0.129E-02    1.93       1.6  T
   3    -42.7594387  0.248206E-06  0.441E-03    1.93       4.5  T
   4    -42.7594390 -0.292008E-06  0.171E-03    1.93      11.7  T
   5    -42.7594390 -0.239710E-07  0.813E-04    1.93      24.6  T
   6    -42.7594390 -0.563828E-08  0.457E-04    1.93      43.8  T
     SCC iter.                  ...        0 min,  0.008 sec
     gradient                   ...        0 min,  0.015 sec
 * total energy  :   -42.1427247 Eh     change       -0.3162111E-05 Eh
   gradient norm :     0.0023634 Eh/α   predicted    -0.3957735E-05 (  25.16%)
   displ. norm   :     0.0276077 α      lambda       -0.5770537E-05
   maximum displ.:     0.0173561 α      in ANC's #1, #3, #4, ...

........................................................................
.............................. CYCLE   18 ..............................
........................................................................
   1    -42.7591450 -0.427591E+02  0.155E-02    1.93       0.0  T
   2    -42.7591451 -0.545209E-07  0.935E-03    1.93       2.1  T
   3    -42.7591449  0.117492E-06  0.252E-03    1.93       7.9  T
   4    -42.7591451 -0.132744E-06  0.902E-04    1.93      22.2  T
   5    -42.7591451 -0.110693E-07  0.479E-04    1.93      41.8  T
     SCC iter.                  ...        0 min,  0.009 sec
     gradient                   ...        0 min,  0.015 sec
 * total energy  :   -42.1427293 Eh     change       -0.4610354E-05 Eh
   gradient norm :     0.0015751 Eh/α   predicted    -0.2888089E-05 ( -37.36%)
   displ. norm   :     0.0626793 α      lambda       -0.7033163E-05
   maximum displ.:     0.0437021 α      in ANC's #1, #3, #4, ...

........................................................................
.............................. CYCLE   19 ..............................
........................................................................
   1    -42.7585836 -0.427586E+02  0.320E-02    1.93       0.0  T
   2    -42.7585839 -0.298924E-06  0.194E-02    1.93       1.0  T
   3    -42.7585834  0.582522E-06  0.587E-03    1.93       3.4  T
   4    -42.7585840 -0.677928E-06  0.171E-03    1.93      11.7  T
   5    -42.7585841 -0.312266E-07  0.104E-03    1.93      19.2  T
   6    -42.7585841 -0.141715E-07  0.504E-04    1.93      39.7  T
   7    -42.7585841 -0.145902E-08  0.184E-04    1.93     108.7  T
     SCC iter.                  ...        0 min,  0.009 sec
     gradient                   ...        0 min,  0.015 sec
 * total energy  :   -42.1427348 Eh     change       -0.5585830E-05 Eh
   gradient norm :     0.0011419 Eh/α   predicted    -0.3526319E-05 ( -36.87%)
   displ. norm   :     0.0303895 α      lambda       -0.2516866E-05
   maximum displ.:     0.0216021 α      in ANC's #1, #5, #3, ...

........................................................................
.............................. CYCLE   20 ..............................
........................................................................
   1    -42.7587465 -0.427587E+02  0.128E-02    1.93       0.0  T
   2    -42.7587465 -0.190945E-07  0.746E-03    1.93       2.7  T
   3    -42.7587465  0.283025E-07  0.137E-03    1.93      14.6  T
   4    -42.7587465 -0.265526E-07  0.767E-04    1.93      26.1  T
   5    -42.7587465 -0.824885E-08  0.338E-04    1.93      59.2  T
     SCC iter.                  ...        0 min,  0.007 sec
     gradient                   ...        0 min,  0.015 sec
 * total energy  :   -42.1427379 Eh     change       -0.3064359E-05 Eh
   gradient norm :     0.0006997 Eh/α   predicted    -0.1262823E-05 ( -58.79%)
   displ. norm   :     0.0527284 α      lambda       -0.3445833E-05
   maximum displ.:     0.0402597 α      in ANC's #1, #5, #3, ...

   *** GEOMETRY OPTIMIZATION CONVERGED AFTER 20 ITERATIONS ***

------------------------------------------------------------------------
 total energy gain   :        -0.0168970 Eh      -10.6031 kcal/mol
 total RMSD          :         0.4330112 a0        0.2291 Å
 total power (kW/mol):        -2.2181588 (step)  -62.6927 (real)
------------------------------------------------------------------------

 ANCopt (total)                0 d,  0 h,  0 min,  0.708 sec
 optimizer setup                ...        0 min,  0.000 sec (  0.022%)
 model hessian                  ...        0 min,  0.003 sec (  0.419%)
 ANC generation                 ...        0 min,  0.001 sec (  0.096%)
 coordinate transformation      ...        0 min,  0.000 sec (  0.054%)
 single point calculation       ...        0 min,  0.695 sec ( 98.185%)
 optimization log               ...        0 min,  0.002 sec (  0.291%)
 hessian update                 ...        0 min,  0.000 sec (  0.039%)
 rational function              ...        0 min,  0.005 sec (  0.715%)

================
 final structure:
================
$coord
   -3.08119410511202    2.26813920921534   -0.04661335801271      C 
   -5.22481628399469   -0.12010948513467    0.15584982917347      S 
   -2.89783259964167   -2.42190864859772    0.27782573929838      C 
   -0.51224467041748   -1.31929898079907    0.15993692190784      C 
   -0.62638010226119    1.39082488550482   -0.02349268912165      C 
    1.62146803106261    2.82169901966850   -0.14640123152701      C 
    3.89983248256162    1.59527756249989   -0.09194548595007      C 
    6.32816403315321    2.97721058825220   -0.19889479378929      C 
    8.38237227760700    1.98279752968800   -0.19735339548850      O 
    6.01876261278386    5.49754409966862   -0.29609753198742      O 
    8.27593544268271    6.94081819718709   -0.38963787516863      C 
    4.01319137169164   -1.08610842532737    0.07749259597276      C 
    1.88108553620177   -2.51235925790543    0.20166945996399      C 
   -3.50387853200383   -5.05282779455630    0.48393584006237      C 
   -5.83390070366670   -5.99770463060554    0.61010386653687      C 
   -3.71365649728507    4.18814047064122   -0.16909393842721      H 
    1.52369063900368    4.85308151633125   -0.27885005826538      H 
    7.69789636978471    8.90327191490059   -0.57724693563351      H 
    9.43139357646215    6.36513543524026   -2.00005516007962      H 
    9.37173150983508    6.67119571677831    1.33906328211225      H 
    5.86333076620325   -1.94314992519270    0.10408810547313      H 
    1.99706005595541   -4.54427465264685    0.33028420631976      H 
   -1.89161764770090   -6.30837462058424    0.54363734108811      H 
   -7.47666135836759   -4.79470533414920    0.55754664252422      H 
   -6.16673962552912   -7.99548778441377    0.76555075871439      H 
$end
           -------------------------------------------------
          |                Final Singlepoint                |
           -------------------------------------------------

          ...................................................
          :                      SETUP                      :
          :.................................................:
          :  # basis functions                  76          :
          :  # atomic orbitals                  75          :
          :  # shells                           41          :
          :  # electrons                        76          :
          :  max. iterations                   250          :
          :  Hamiltonian                  GFN2-xTB          :
          :  restarted?                      false          :
          :  GBSA solvation                  false          :
          :  PC potential                    false          :
          :  electronic temp.          300.0000000     K    :
          :  accuracy                    1.0000000          :
          :  -> integral cutoff          0.2500000E+02      :
          :  -> integral neglect         0.1000000E-07      :
          :  -> SCF convergence          0.1000000E-05 Eh   :
          :  -> wf. convergence          0.1000000E-03 e    :
          :  Broyden damping             0.4000000          :
          ...................................................

 iter      E             dE          RMSdq      gap      omega  full diag
   1    -42.7587465 -0.427587E+02  0.210E-04    1.93       0.0  T
   2    -42.7587465  0.602540E-11  0.101E-04    1.93     198.4  T
   3    -42.7587465 -0.932019E-10  0.117E-04    1.93     171.6  T

   *** convergence criteria satisfied after 3 iterations ***

         #    Occupation            Energy/Eh            Energy/eV
      -------------------------------------------------------------
         1        2.0000           -0.7430520             -20.2195
       ...           ...                  ...                  ...
        32        2.0000           -0.4462919             -12.1442
        33        2.0000           -0.4450945             -12.1116
        34        2.0000           -0.4320785             -11.7575
        35        2.0000           -0.4218094             -11.4780
        36        2.0000           -0.4099531             -11.1554
        37        2.0000           -0.4083629             -11.1121
        38        2.0000           -0.3681966             -10.0191 (HOMO)
        39                         -0.2971745              -8.0865 (LUMO)
        40                         -0.2610165              -7.1026
        41                         -0.2145030              -5.8369
        42                         -0.2069876              -5.6324
        43                         -0.1925861              -5.2405
       ...                                ...                  ...
        75                          0.7264433              19.7675
      -------------------------------------------------------------
                  HL-Gap            0.0710221 Eh            1.9326 eV
             Fermi-level           -0.3326855 Eh           -9.0528 eV

 SCC (total)                   0 d,  0 h,  0 min,  0.032 sec
 SCC setup                      ...        0 min,  0.000 sec (  0.694%)
 Dispersion                     ...        0 min,  0.000 sec (  0.738%)
 integral evaluation            ...        0 min,  0.011 sec ( 34.292%)
 zeroth order Hamiltonian       ...        0 min,  0.000 sec (  0.538%)
 iterations                     ...        0 min,  0.004 sec ( 14.118%)
 molecular gradient             ...        0 min,  0.015 sec ( 48.312%)
 printout                       ...        0 min,  0.000 sec (  1.146%)

         :::::::::::::::::::::::::::::::::::::::::::::::::::::
         ::                     SUMMARY                     ::
         :::::::::::::::::::::::::::::::::::::::::::::::::::::
         :: total energy             -42.142737895983 Eh    ::
         :: gradient norm              0.000698744971 Eh/a0 ::
         :: HOMO-LUMO gap              1.932609491242 eV    ::
         ::.................................................::
         :: SCC energy               -42.758746544547 Eh    ::
         :: -> isotropic ES            0.045963467054 Eh    ::
         :: -> anisotropic ES          0.001533339573 Eh    ::
         :: -> anisotropic XC          0.014721376253 Eh    ::
         :: -> dispersion             -0.026069158056 Eh    ::
         :: repulsion energy           0.616135189991 Eh    ::
         :: add. restraining           0.000000000000 Eh    ::
         :::::::::::::::::::::::::::::::::::::::::::::::::::::

           -------------------------------------------------
          |                Property Printout                |
           -------------------------------------------------

    * Orbital Energies and Occupations

         #    Occupation            Energy/Eh            Energy/eV
      -------------------------------------------------------------
         1        2.0000           -0.7430520             -20.2195
       ...           ...                  ...                  ...
        26        2.0000           -0.4795420             -13.0490
        27        2.0000           -0.4766221             -12.9695
        28        2.0000           -0.4662779             -12.6881
        29        2.0000           -0.4661503             -12.6846
        30        2.0000           -0.4502372             -12.2516
        31        2.0000           -0.4483068             -12.1990
        32        2.0000           -0.4462919             -12.1442
        33        2.0000           -0.4450945             -12.1116
        34        2.0000           -0.4320785             -11.7575
        35        2.0000           -0.4218094             -11.4780
        36        2.0000           -0.4099531             -11.1554
        37        2.0000           -0.4083629             -11.1121
        38        2.0000           -0.3681966             -10.0191 (HOMO)
        39                         -0.2971745              -8.0865 (LUMO)
        40                         -0.2610165              -7.1026
        41                         -0.2145030              -5.8369
        42                         -0.2069876              -5.6324
        43                         -0.1925861              -5.2405
        44                         -0.1572573              -4.2792
        45                         -0.1291075              -3.5132
        46                         -0.0859437              -2.3386
        47                         -0.0119261              -0.3245
        48                          0.0191030               0.5198
        49                          0.0211061               0.5743
       ...                                ...                  ...
        75                          0.7264433              19.7675
      -------------------------------------------------------------
                  HL-Gap            0.0710221 Eh            1.9326 eV
             Fermi-level           -0.3326855 Eh           -9.0528 eV

     #   Z        covCN         q      C6AA      α(0)
     1   6 C      2.926    -0.035    28.863     8.810
     2  16 S      2.323     0.022   140.145    19.925
     3   6 C      2.978     0.011    27.768     8.644
     4   6 C      3.166    -0.003    27.756     8.609
     5   6 C      3.170     0.003    27.578     8.579
     6   6 C      2.912    -0.025    28.629     8.774
     7   6 C      2.969    -0.021    28.535     8.762
     8   6 C      2.733     0.350    21.063     7.514
     9   8 O      0.856    -0.416    22.012     6.290
    10   8 O      1.704    -0.268    18.450     5.799
    11   6 C      3.658     0.037    20.239     6.457
    12   6 C      2.920    -0.027    28.681     8.782
    13   6 C      2.908    -0.030    28.748     8.792
    14   6 C      2.920    -0.030    28.758     8.794
    15   6 C      2.841    -0.089    30.223     9.010
    16   1 H      0.926     0.050     2.324     2.384
    17   1 H      0.926     0.052     2.296     2.369
    18   1 H      0.925     0.065     2.144     2.290
    19   1 H      0.924     0.062     2.170     2.304
    20   1 H      0.924     0.060     2.194     2.316
    21   1 H      0.926     0.060     2.199     2.319
    22   1 H      0.926     0.039     2.467     2.456
    23   1 H      0.925     0.045     2.386     2.415
    24   1 H      0.926     0.046     2.366     2.405
    25   1 H      0.926     0.044     2.397     2.421

 Mol. C6AA /au·bohr⁶  :       9662.703366
 Mol. C8AA /au·bohr⁸  :     261301.484190
 Mol. α(0) /au        :        157.220613


Wiberg/Mayer (AO) data.
largest (>0.10) Wiberg bond orders for each atom
          total WBO             WBO to atom ...
     1  C   3.939        C    5 1.435    S    2 1.258    H   16 0.969    C    3 0.125
     2  S   2.720        C    1 1.258    C    3 1.166
     3  C   3.943        C    4 1.378    S    2 1.166    C   14 1.157    C    1 0.125
     4  C   3.988        C    3 1.378    C   13 1.235    C    5 1.162
     5  C   3.988        C    1 1.435    C    6 1.242    C    4 1.162
     6  C   3.985        C    7 1.533    C    5 1.242    H   17 0.964    C   13 0.108
     7  C   3.987        C    6 1.533    C   12 1.229    C    8 1.009
     8  C   3.914        O    9 1.723    O   10 1.109    C    7 1.009
     9  O   2.018        C    8 1.723    O   10 0.166
    10  O   2.291        C    8 1.109    C   11 0.962    O    9 0.166
    11  C   3.928        H   18 0.982    H   20 0.977    H   19 0.977    O   10 0.962
    12  C   3.970        C   13 1.612    C    7 1.229    H   21 0.965
    13  C   3.991        C   12 1.612    C    4 1.235    H   22 0.965    C    6 0.108
    14  C   3.992        C   15 1.842    C    3 1.157    H   23 0.955
    15  C   3.965        C   14 1.842    H   25 0.978    H   24 0.972
    16  H   0.997        C    1 0.969
    17  H   0.997        C    6 0.964
    18  H   0.995        C   11 0.982
    19  H   0.996        C   11 0.977
    20  H   0.996        C   11 0.977
    21  H   0.995        C   12 0.965
    22  H   0.998        C   13 0.965
    23  H   0.998        C   14 0.955
    24  H   0.998        C   15 0.972
    25  H   0.997        C   15 0.978

molecular dipole:
                 x           y           z       tot (Debye)
 q only:       -1.020       0.272       0.012
   full:       -0.799       0.421       0.003       2.294
molecular quadrupole (traceless):
                xx          xy          yy          xz          yz          zz
 q only:       -9.318       6.732      11.635      -0.217      -0.884      -2.317
  q+dip:      -11.137       6.355      15.771      -0.138      -1.341      -4.634
   full:      -13.480       6.850      14.260      -0.054      -0.991      -0.779

           -------------------------------------------------
          |                Geometry Summary                 |
           -------------------------------------------------

      molecular mass/u    :      218.2698000
   center of mass at/Å    :        0.4716607       0.2824653       0.0210905
  moments of inertia/u·Å² :        0.3173611E+03   0.1927829E+04   0.2241851E+04
rotational constants/cm⁻¹ :        0.5311815E-01   0.8744359E-02   0.7519514E-02

 * 25 selected distances

     #   Z        #   Z                                     value/Å
     1   6 C      2  16 S                                 1.7016023
     2  16 S      3   6 C                                 1.7332482 (max)
     3   6 C      4   6 C                                 1.3921160
     1   6 C      5   6 C                                 1.3795527
     4   6 C      5   6 C                                 1.4386854
     5   6 C      6   6 C                                 1.4115578
     6   6 C      7   6 C                                 1.3695389
     8   6 C      9   8 O                                 1.2077109
     8   6 C     10   8 O                                 1.3446996
    10   8 O     11   6 C                                 1.4186115
     7   6 C     12   6 C                                 1.4230235
     4   6 C     13   6 C                                 1.4153057
    12   6 C     13   6 C                                 1.3590161
     3   6 C     14   6 C                                 1.4328405
    14   6 C     15   6 C                                 1.3321940
     1   6 C     16   1 H                                 1.0716872 (min)
     6   6 C     17   1 H                                 1.0784858
    11   6 C     18   1 H                                 1.0871407
    11   6 C     19   1 H                                 1.0922016
    11   6 C     20   1 H                                 1.0924496
    12   6 C     21   1 H                                 1.0790861
    13   6 C     22   1 H                                 1.0791418
    14   6 C     23   1 H                                 1.0818210
    15   6 C     24   1 H                                 1.0778384
    15   6 C     25   1 H                                 1.0749052

 * 4 distinct bonds (by element types)

   Z      Z             #   av. dist./Å        max./Å        min./Å
   1 H    6 C          10     1.0814757     1.0924496     1.0716872
   6 C    6 C          10     1.3953831     1.4386854     1.3321940
   6 C    8 O           3     1.3236740     1.4186115     1.2077109
   6 C   16 S           2     1.7174253     1.7332482     1.7016023


optimized geometry written to: xtbopt.xyz


           -------------------------------------------------
          | TOTAL ENERGY              -42.142737895983 Eh   |
          | GRADIENT NORM               0.000698744971 Eh/α |
          | HOMO-LUMO GAP               1.932609491242 eV   |
           -------------------------------------------------

------------------------------------------------------------------------
 * finished run on 2021/05/19 at 11:00:13.548     
------------------------------------------------------------------------
 total:
 * wall-time:     0 d,  0 h,  0 min,  0.809 sec
 *  cpu-time:     0 d,  0 h,  0 min,  0.807 sec
 * ratio c/w:     0.997 speedup
 SCF:
 * wall-time:     0 d,  0 h,  0 min,  0.046 sec
 *  cpu-time:     0 d,  0 h,  0 min,  0.045 sec
 * ratio c/w:     0.999 speedup
 ANC optimizer:
 * wall-time:     0 d,  0 h,  0 min,  0.740 sec
 *  cpu-time:     0 d,  0 h,  0 min,  0.738 sec
 * ratio c/w:     0.998 speedup

