      -----------------------------------------------------------      
     |                   =====================                   |     
     |                           x T B                           |     
     |                   =====================                   |     
     |                         S. Grimme                         |     
     |          Mulliken Center for Theoretical Chemistry        |     
     |                    University of Bonn                     |     
     |                Version 6.2 RC2 (SAW190805)                |     
      -----------------------------------------------------------      

   This program is distributed in the hope that it will be useful,
   but WITHOUT ANY WARRANTY; without even the implied warranty of
   MERCHANTABILITY or FITNESS FOR A PARTICULAR PURPOSE.
   
   FOR NON-COMMERCIAL, ACADEMIA USE ONLY.
   
   Cite this work as:
   * S. Grimme, C. Bannwarth, P. Shushkov, J. Chem. Theory Comput., 2017,
     13, 1989-2009. DOI: 10.1021/acs.jctc.7b00118
   * C. Bannwarth, S. Ehlert and S. Grimme., J. Chem. Theory Comput., 2019,
     15, 1652-1671. DOI: 10.1021/acs.jctc.8b01176
   * P. Pracht, E. Caldeweyher, S. Ehlert, S. Grimme, ChemRxiv, 2019, preprint.
     DOI: 10.26434/chemrxiv.8326202.v1
   
   for DFT-D4:
   * E. Caldeweyher, C. Bannwarth and S. Grimme, J. Chem. Phys., 2017,
     147, 034112. DOI: 10.1063/1.4993215
   * E. Caldeweyher, S. Ehlert, A. Hansen, H. Neugebauer, S. Spicher,
     C. Bannwarth and S. Grimme, J. Chem. Phys., 2019, 150, 154122.
     DOI: 10.1063/1.5090222
   
   for sTDA-xTB:
   * S. Grimme and C. Bannwarth, J. Chem. Phys., 2016, 145, 054103.
     DOI: 10.1063/1.4959605
   
   in the mass-spec context:
   * V. Asgeirsson, C. Bauer and S. Grimme, Chem. Sci., 2017, 8, 4879.
     DOI: 10.1039/c7sc00601b
   
   for metadynamics refer to:
   * S. Grimme, J. Chem. Theory Comput., 2019, 155, 2847-2862
     DOI: 10.1021/acs.jctc.9b00143
   
   with help from (in alphabetical order)
   C. Bannwarth, F. Bohle, G. Brandenburg, E. Caldeweyher, M. Checinski,
   S. Dohm, S. Ehlert, S. Ehrlich, F. März, H. Neugebauer, J. Pisarek,
   P. Pracht, P. Shushkov, and S. Spicher.
   
 * started run on 2021/05/19 at 11:00:13.959     

           -------------------------------------------------
          |                Calculation Setup                |
           -------------------------------------------------

          program call               : /ihome/ghutchison/geoffh/xtb/xtb 804.xyz -opt
          hostname                   : smp-n83
          coordinate file            : 804.xyz
          omp threads                :                     1
          number of atoms            :                    28
          number of electrons        :                    78
          charge                     :                     0
          spin                       :                   0.0
          first test random number   :      0.57096412523275


########################################################################
# WARNING! Please study the warnings concerning your input carefully
#  - the use of '-opt' is discouraged, please use '--opt' next time
########################################################################

           ------------------------------------------------- 
          |                 G F N 2 - x T B                 |
          | Geometry, Frequencies, Noncovalent interactions |
          |            JCTC 2019 parametrisation            |
           ------------------------------------------------- 
             KAB for C  - Si     :                1.0500
             KAB for H  - Pd     :                0.9500
             k(s)              :                1.8500
             k(p)              :                2.2300
             k(d)              :                2.2300
             k(f)              :                2.0000
             kEN (H0ij)        :               -2.0000
             D4 a1             :                0.5200
             D4 a2             :                5.0000
             D4 s6             :                1.0000
             D4 s8             :                2.7000
             D4 s9             :                5.0000
             alphaj            :                2.0000

  Z AO/shell   Hii/eV     exponent
  1     Wed Apr 25 08:07:45 CEST 2018   EN: 2.200 GM2: 0.406  GM3: 0.0800  RAES: 1.40
     1s    -10.707211    1.230000
  6     Wed Apr 25 08:07:45 CEST 2018   EN: 2.550 GM2: 0.538  GM3: 0.1500  RAES: 3.00
     2s    -13.970922    2.096432
     2p    -10.063292    1.800000
  7     Wed Apr 25 08:07:45 CEST 2018   EN: 3.040 GM2: 0.461  GM3:-0.0640  RAES: 1.90
     2s    -16.686243    2.339881
     2p    -12.523956    2.014332
 16     Tue Apr 24 11:44:34 CEST 2018   EN: 2.580 GM2: 0.340  GM3:-0.0502  RAES: 3.10
     3s    -20.029654    1.981333
     3p    -11.377694    2.025643
     3d     -0.420282    1.702555

           ------------------------------------------------- 
          |        Self-Consistent Charge Iterations        |
           ------------------------------------------------- 

          ...................................................
          :                      SETUP                      :
          :.................................................:
          :  # basis functions                  82          :
          :  # atomic orbitals                  80          :
          :  # shells                           44          :
          :  # electrons                        78          :
          :  max. iterations                   250          :
          :  Hamiltonian                  GFN2-xTB          :
          :  restarted?                      false          :
          :  GBSA solvation                  false          :
          :  PC potential                    false          :
          :  electronic temp.          300.0000000     K    :
          :  accuracy                    1.0000000          :
          :  -> integral cutoff          0.2500000E+02      :
          :  -> integral neglect         0.1000000E-07      :
          :  -> SCF convergence          0.1000000E-05 Eh   :
          :  -> wf. convergence          0.1000000E-03 e    :
          :  Broyden damping             0.4000000          :
          ...................................................

 iter      E             dE          RMSdq      gap      omega  full diag
   1    -42.7452851 -0.427453E+02  0.454E+00    2.95       0.0  T
   2    -42.8060959 -0.608108E-01  0.298E+00    2.58       1.0  T
   3    -42.7939231  0.121728E-01  0.148E+00    2.39       1.0  T
   4    -42.8230517 -0.291286E-01  0.588E-01    2.20       1.0  T
   5    -42.8267926 -0.374084E-02  0.217E-01    2.21       1.0  T
   6    -42.8268112 -0.185932E-04  0.515E-02    2.20       1.0  T
   7    -42.8268307 -0.194950E-04  0.163E-02    2.20       1.2  T
   8    -42.8268310 -0.365122E-06  0.786E-03    2.20       2.4  T
   9    -42.8268312 -0.181530E-06  0.285E-03    2.21       6.6  T
  10    -42.8268312 -0.153055E-07  0.119E-03    2.20      15.9  T
  11    -42.8268312 -0.300744E-08  0.409E-04    2.20      46.2  T
  12    -42.8268312 -0.688765E-09  0.187E-04    2.20     100.8  T

   *** convergence criteria satisfied after 12 iterations ***

         #    Occupation            Energy/Eh            Energy/eV
      -------------------------------------------------------------
         1        2.0000           -0.7333227             -19.9547
       ...           ...                  ...                  ...
        33        2.0000           -0.4449238             -12.1070
        34        2.0000           -0.4309854             -11.7277
        35        2.0000           -0.4216091             -11.4726
        36        2.0000           -0.3998872             -10.8815
        37        2.0000           -0.3731973             -10.1552
        38        2.0000           -0.3231294              -8.7928
        39        2.0000           -0.3152755              -8.5791 (HOMO)
        40                         -0.2342491              -6.3742 (LUMO)
        41                         -0.2249917              -6.1223
        42                         -0.1797323              -4.8908
        43                         -0.1481131              -4.0304
        44                         -0.1409264              -3.8348
       ...                                ...                  ...
        80                          0.6127195              16.6729
      -------------------------------------------------------------
                  HL-Gap            0.0810264 Eh            2.2048 eV
             Fermi-level           -0.2747623 Eh           -7.4767 eV

 SCC (total)                   0 d,  0 h,  0 min,  0.076 sec
 SCC setup                      ...        0 min,  0.000 sec (  0.472%)
 Dispersion                     ...        0 min,  0.000 sec (  0.525%)
 integral evaluation            ...        0 min,  0.025 sec ( 33.153%)
 zeroth order Hamiltonian       ...        0 min,  0.000 sec (  0.329%)
 iterations                     ...        0 min,  0.031 sec ( 40.710%)
 molecular gradient             ...        0 min,  0.018 sec ( 24.164%)
 printout                       ...        0 min,  0.000 sec (  0.572%)

         :::::::::::::::::::::::::::::::::::::::::::::::::::::
         ::                     SUMMARY                     ::
         :::::::::::::::::::::::::::::::::::::::::::::::::::::
         :: total energy             -42.380376114247 Eh    ::
         :: gradient norm              0.114614910817 Eh/a0 ::
         :: HOMO-LUMO gap              2.204840184648 eV    ::
         ::.................................................::
         :: SCC energy               -42.826831226171 Eh    ::
         :: -> isotropic ES            0.027682154933 Eh    ::
         :: -> anisotropic ES          0.005518715219 Eh    ::
         :: -> anisotropic XC          0.040825256607 Eh    ::
         :: -> dispersion             -0.031012006346 Eh    ::
         :: repulsion energy           0.446255240656 Eh    ::
         :: add. restraining           0.000000000000 Eh    ::
         :::::::::::::::::::::::::::::::::::::::::::::::::::::

      ----------------------------------------------------------- 
     |                   =====================                   |
     |                        A N C O P T                        |
     |                   =====================                   |
     |               Approximate Normal Coordinate               |
     |                Rational Function Optimizer                |
      ----------------------------------------------------------- 

          ...................................................
          :                      SETUP                      :
          :.................................................:
          :   optimization level            normal          :
          :   max. optcycles                   200          :
          :   ANC micro-cycles                  20          :
          :   degrees of freedom                78          :
          :.................................................:
          :   RF solver                   davidson          :
          :   input Hessian                  false          :
          :   write xtbopt.log                true          :
          :   linear?                        false          :
          :   energy convergence         0.5000000E-05 Eh   :
          :   grad. convergence          0.1000000E-02 Eh/α :
          :   maximium RF displ.         2.0000000          :
          :   Hlow (freq-cutoff)         0.5000000E-02      :
          :   Hmax (freq-cutoff)         5.0000000          :
          :   S6 in model hess.         20.0000000          :
          ...................................................

generating ANC from model Hessian ...
Using Lindh-Hessian (1995)
 Shifting diagonal of input Hessian by   3.322806345331054E-003
 Lowest  eigenvalues of input Hessian
   -0.000000   -0.000000    0.000000    0.000000    0.000000    0.000000
    0.005000    0.006655    0.007355    0.009854    0.011616    0.015120
    0.017365    0.020042    0.021858    0.024430    0.026162    0.030118
 Highest eigenvalues
    1.487877    1.606393    1.627525    1.686762    1.821561    2.093013
 

........................................................................
.............................. CYCLE    1 ..............................
........................................................................
   1    -42.8268312 -0.428268E+02  0.572E-05    2.20       0.0  T
   2    -42.8268312 -0.459011E-11  0.383E-05    2.20     493.5  T
   3    -42.8268312  0.388667E-11  0.249E-05    2.20     758.5  T
     SCC iter.                  ...        0 min,  0.005 sec
     gradient                   ...        0 min,  0.018 sec
 * total energy  :   -42.3803761 Eh     change       -0.8482090E-08 Eh
   gradient norm :     0.1146145 Eh/α   predicted     0.0000000E+00 (-100.00%)
   displ. norm   :     0.3279395 α      lambda       -0.1538681E-01
   maximum displ.:     0.1462293 α      in ANC's #9, #16, #5, ...

........................................................................
.............................. CYCLE    2 ..............................
........................................................................
   1    -42.8437054 -0.428437E+02  0.739E-01    2.15       0.0  T
   2    -42.8440060 -0.300532E-03  0.321E-01    2.15       1.0  T
   3    -42.8440520 -0.460567E-04  0.547E-02    2.16       1.0  T
   4    -42.8440527 -0.689096E-06  0.232E-02    2.16       1.0  T
   5    -42.8440527  0.107358E-07  0.879E-03    2.16       2.2  T
   6    -42.8440536 -0.862960E-06  0.364E-03    2.16       5.2  T
   7    -42.8440537 -0.146826E-06  0.161E-03    2.16      11.7  T
     SCC iter.                  ...        0 min,  0.010 sec
     gradient                   ...        0 min,  0.017 sec
 * total energy  :   -42.3922263 Eh     change       -0.1185020E-01 Eh
   gradient norm :     0.0635831 Eh/α   predicted    -0.8520793E-02 ( -28.10%)
   displ. norm   :     0.4408557 α      lambda       -0.1134927E-01
   maximum displ.:     0.2413677 α      in ANC's #13, #9, #5, ...

........................................................................
.............................. CYCLE    3 ..............................
........................................................................
   1    -42.8509250 -0.428509E+02  0.145E+00    2.04       0.0  T
   2    -42.8520471 -0.112209E-02  0.610E-01    2.05       1.0  T
   3    -42.8521951 -0.147956E-03  0.976E-02    2.05       1.0  T
   4    -42.8521973 -0.218867E-05  0.688E-02    2.06       1.0  T
   5    -42.8522461 -0.488638E-04  0.250E-02    2.06       1.0  T
   6    -42.8522489 -0.272559E-05  0.539E-03    2.06       3.5  T
   7    -42.8522489 -0.581139E-07  0.252E-03    2.06       7.5  T
     SCC iter.                  ...        0 min,  0.009 sec
     gradient                   ...        0 min,  0.017 sec
 * total energy  :   -42.3991553 Eh     change       -0.6928942E-02 Eh
   gradient norm :     0.0154666 Eh/α   predicted    -0.6777526E-02 (  -2.19%)
   displ. norm   :     0.3212674 α      lambda       -0.2328620E-02
   maximum displ.:     0.1777494 α      in ANC's #13, #5, #9, ...

........................................................................
.............................. CYCLE    4 ..............................
........................................................................
   1    -42.8506252 -0.428506E+02  0.828E-01    2.04       0.0  T
   2    -42.8509618 -0.336652E-03  0.353E-01    2.04       1.0  T
   3    -42.8509890 -0.271328E-04  0.649E-02    2.04       1.0  T
   4    -42.8510263 -0.373506E-04  0.404E-02    2.05       1.0  T
   5    -42.8510387 -0.123802E-04  0.109E-02    2.05       1.7  T
   6    -42.8510391 -0.426244E-06  0.392E-03    2.05       4.8  T
   7    -42.8510391 -0.339090E-07  0.179E-03    2.05      10.6  T
   8    -42.8510392 -0.652543E-08  0.554E-04    2.05      34.1  T
     SCC iter.                  ...        0 min,  0.011 sec
     gradient                   ...        0 min,  0.017 sec
 * total energy  :   -42.4009495 Eh     change       -0.1794215E-02 Eh
   gradient norm :     0.0267209 Eh/α   predicted    -0.1284491E-02 ( -28.41%)
   displ. norm   :     0.4574204 α      lambda       -0.3002976E-02
   maximum displ.:     0.2547831 α      in ANC's #13, #5, #1, ...

........................................................................
.............................. CYCLE    5 ..............................
........................................................................
   1    -42.8471704 -0.428472E+02  0.105E+00    2.08       0.0  T
   2    -42.8477191 -0.548628E-03  0.452E-01    2.08       1.0  T
   3    -42.8477273 -0.824738E-05  0.949E-02    2.08       1.0  T
   4    -42.8478453 -0.117946E-03  0.512E-02    2.08       1.0  T
   5    -42.8478598 -0.145848E-04  0.135E-02    2.08       1.4  T
   6    -42.8478611 -0.125575E-05  0.544E-03    2.08       3.5  T
   7    -42.8478611 -0.314718E-07  0.205E-03    2.08       9.2  T
     SCC iter.                  ...        0 min,  0.010 sec
     gradient                   ...        0 min,  0.018 sec
 * total energy  :   -42.4031578 Eh     change       -0.2208311E-02 Eh
   gradient norm :     0.0390299 Eh/α   predicted    -0.1815668E-02 ( -17.78%)
   displ. norm   :     0.3769806 α      lambda       -0.3054511E-02
   maximum displ.:     0.2023555 α      in ANC's #13, #1, #5, ...

........................................................................
.............................. CYCLE    6 ..............................
........................................................................
   1    -42.8482314 -0.428482E+02  0.781E-01    2.18       0.0  T
   2    -42.8485598 -0.328322E-03  0.344E-01    2.18       1.0  T
   3    -42.8485201  0.396088E-04  0.863E-02    2.17       1.0  T
   4    -42.8486485 -0.128347E-03  0.380E-02    2.17       1.0  T
   5    -42.8486550 -0.645799E-05  0.112E-02    2.17       1.7  T
   6    -42.8486559 -0.938520E-06  0.386E-03    2.17       4.9  T
   7    -42.8486559 -0.108155E-07  0.148E-03    2.17      12.8  T
     SCC iter.                  ...        0 min,  0.010 sec
     gradient                   ...        0 min,  0.017 sec
 * total energy  :   -42.4055882 Eh     change       -0.2430437E-02 Eh
   gradient norm :     0.0370833 Eh/α   predicted    -0.1744301E-02 ( -28.23%)
   displ. norm   :     0.4008692 α      lambda       -0.4384709E-02
   maximum displ.:     0.2172130 α      in ANC's #13, #1, #10, ...

........................................................................
.............................. CYCLE    7 ..............................
........................................................................
   1    -42.8572970 -0.428573E+02  0.896E-01    2.33       0.0  T
   2    -42.8577444 -0.447325E-03  0.392E-01    2.33       1.0  T
   3    -42.8576869  0.574160E-04  0.101E-01    2.32       1.0  T
   4    -42.8578675 -0.180556E-03  0.422E-02    2.33       1.0  T
   5    -42.8578740 -0.648469E-05  0.107E-02    2.32       1.8  T
   6    -42.8578749 -0.880127E-06  0.361E-03    2.32       5.2  T
   7    -42.8578749 -0.177917E-07  0.158E-03    2.32      12.0  T
     SCC iter.                  ...        0 min,  0.010 sec
     gradient                   ...        0 min,  0.017 sec
 * total energy  :   -42.4087436 Eh     change       -0.3155334E-02 Eh
   gradient norm :     0.0199672 Eh/α   predicted    -0.2544658E-02 ( -19.35%)
   displ. norm   :     0.5426559 α      lambda       -0.3138627E-02
   maximum displ.:     0.3497651 α      in ANC's #13, #1, #10, ...

........................................................................
.............................. CYCLE    8 ..............................
........................................................................
   1    -42.8554632 -0.428555E+02  0.139E+00    2.36       0.0  T
   2    -42.8565839 -0.112066E-02  0.576E-01    2.37       1.0  T
   3    -42.8566141 -0.302950E-04  0.121E-01    2.37       1.0  T
   4    -42.8568259 -0.211711E-03  0.594E-02    2.38       1.0  T
   5    -42.8568455 -0.196464E-04  0.169E-02    2.38       1.1  T
   6    -42.8568463 -0.745602E-06  0.533E-03    2.38       3.5  T
   7    -42.8568463 -0.770315E-07  0.281E-03    2.38       6.7  T
   8    -42.8568463 -0.131390E-07  0.663E-04    2.38      28.5  T
     SCC iter.                  ...        0 min,  0.011 sec
     gradient                   ...        0 min,  0.018 sec
 * total energy  :   -42.4105221 Eh     change       -0.1778566E-02 Eh
   gradient norm :     0.0244197 Eh/α   predicted    -0.2031439E-02 (  14.22%)
   displ. norm   :     0.2269590 α      lambda       -0.2170885E-02
   maximum displ.:     0.1042392 α      in ANC's #1, #5, #4, ...

........................................................................
.............................. CYCLE    9 ..............................
........................................................................
   1    -42.8675043 -0.428675E+02  0.343E-01    2.46       0.0  T
   2    -42.8675702 -0.659823E-04  0.159E-01    2.46       1.0  T
   3    -42.8675626  0.765544E-05  0.460E-02    2.46       1.0  T
   4    -42.8675801 -0.175058E-04  0.286E-02    2.45       1.0  T
   5    -42.8675866 -0.653217E-05  0.588E-03    2.45       3.2  T
   6    -42.8675867 -0.967489E-07  0.195E-03    2.45       9.7  T
   7    -42.8675867 -0.422542E-08  0.948E-04    2.45      19.9  T
     SCC iter.                  ...        0 min,  0.009 sec
     gradient                   ...        0 min,  0.017 sec
 * total energy  :   -42.4113019 Eh     change       -0.7797919E-03 Eh
   gradient norm :     0.0175957 Eh/α   predicted    -0.1141366E-02 (  46.37%)
   displ. norm   :     0.1279915 α      lambda       -0.6142153E-03
   maximum displ.:     0.0619966 α      in ANC's #13, #1, #10, ...

........................................................................
.............................. CYCLE   10 ..............................
........................................................................
   1    -42.8632844 -0.428633E+02  0.222E-01    2.44       0.0  T
   2    -42.8633145 -0.300280E-04  0.983E-02    2.44       1.0  T
   3    -42.8633195 -0.505424E-05  0.192E-02    2.44       1.0  T
   4    -42.8633193  0.248794E-06  0.103E-02    2.45       1.8  T
   5    -42.8633198 -0.544076E-06  0.478E-03    2.45       4.0  T
   6    -42.8633202 -0.333923E-06  0.148E-03    2.45      12.8  T
   7    -42.8633202 -0.437207E-08  0.677E-04    2.45      27.9  T
     SCC iter.                  ...        0 min,  0.009 sec
     gradient                   ...        0 min,  0.018 sec
 * total energy  :   -42.4116352 Eh     change       -0.3333164E-03 Eh
   gradient norm :     0.0086573 Eh/α   predicted    -0.3121470E-03 (  -6.35%)
   displ. norm   :     0.0851319 α      lambda       -0.2173101E-03
   maximum displ.:     0.0469989 α      in ANC's #4, #1, #5, ...

........................................................................
.............................. CYCLE   11 ..............................
........................................................................
   1    -42.8621564 -0.428622E+02  0.117E-01    2.43       0.0  T
   2    -42.8621653 -0.897076E-05  0.533E-02    2.43       1.0  T
   3    -42.8621626  0.277525E-05  0.186E-02    2.43       1.0  T
   4    -42.8621675 -0.496752E-05  0.881E-03    2.43       2.1  T
   5    -42.8621681 -0.560622E-06  0.260E-03    2.43       7.3  T
   6    -42.8621681 -0.215596E-07  0.647E-04    2.43      29.2  T
     SCC iter.                  ...        0 min,  0.008 sec
     gradient                   ...        0 min,  0.017 sec
 * total energy  :   -42.4117624 Eh     change       -0.1271385E-03 Eh
   gradient norm :     0.0079425 Eh/α   predicted    -0.1094393E-03 ( -13.92%)
   displ. norm   :     0.1447978 α      lambda       -0.2514416E-03
   maximum displ.:     0.0629412 α      in ANC's #1, #5, #6, ...

........................................................................
.............................. CYCLE   12 ..............................
........................................................................
   1    -42.8624904 -0.428625E+02  0.154E-01    2.43       0.0  T
   2    -42.8625059 -0.154327E-04  0.736E-02    2.43       1.0  T
   3    -42.8624994  0.643159E-05  0.281E-02    2.43       1.0  T
   4    -42.8625093 -0.985681E-05  0.138E-02    2.43       1.4  T
   5    -42.8625107 -0.144821E-05  0.341E-03    2.43       5.5  T
   6    -42.8625108 -0.575441E-07  0.114E-03    2.43      16.6  T
   7    -42.8625108 -0.248164E-08  0.548E-04    2.43      34.5  T
     SCC iter.                  ...        0 min,  0.010 sec
     gradient                   ...        0 min,  0.017 sec
 * total energy  :   -42.4118927 Eh     change       -0.1303487E-03 Eh
   gradient norm :     0.0077807 Eh/α   predicted    -0.1283662E-03 (  -1.52%)
   displ. norm   :     0.1681422 α      lambda       -0.2263383E-03
   maximum displ.:     0.1030402 α      in ANC's #5, #1, #2, ...

........................................................................
.............................. CYCLE   13 ..............................
........................................................................
   1    -42.8635977 -0.428636E+02  0.205E-01    2.44       0.0  T
   2    -42.8636243 -0.266307E-04  0.917E-02    2.43       1.0  T
   3    -42.8636244 -0.740877E-07  0.247E-02    2.43       1.0  T
   4    -42.8636284 -0.401408E-05  0.149E-02    2.43       1.3  T
   5    -42.8636305 -0.207345E-05  0.267E-03    2.43       7.1  T
   6    -42.8636305 -0.406592E-07  0.108E-03    2.43      17.4  T
     SCC iter.                  ...        0 min,  0.008 sec
     gradient                   ...        0 min,  0.018 sec
 * total energy  :   -42.4120308 Eh     change       -0.1381170E-03 Eh
   gradient norm :     0.0094810 Eh/α   predicted    -0.1163726E-03 ( -15.74%)
   displ. norm   :     0.2119963 α      lambda       -0.2470042E-03
   maximum displ.:     0.1165482 α      in ANC's #1, #5, #6, ...

........................................................................
.............................. CYCLE   14 ..............................
........................................................................
   1    -42.8644401 -0.428644E+02  0.186E-01    2.45       0.0  T
   2    -42.8644580 -0.179370E-04  0.881E-02    2.45       1.0  T
   3    -42.8644615 -0.342790E-05  0.189E-02    2.45       1.0  T
   4    -42.8644613  0.216234E-06  0.595E-03    2.45       3.2  T
   5    -42.8644616 -0.375467E-06  0.239E-03    2.45       7.9  T
   6    -42.8644617 -0.745877E-07  0.110E-03    2.45      17.2  T
     SCC iter.                  ...        0 min,  0.009 sec
     gradient                   ...        0 min,  0.017 sec
 * total energy  :   -42.4122170 Eh     change       -0.1861466E-03 Eh
   gradient norm :     0.0070890 Eh/α   predicted    -0.1290541E-03 ( -30.67%)
   displ. norm   :     0.3198045 α      lambda       -0.3315780E-03
   maximum displ.:     0.1838493 α      in ANC's #5, #1, #2, ...

........................................................................
.............................. CYCLE   15 ..............................
........................................................................
   1    -42.8651331 -0.428651E+02  0.295E-01    2.46       0.0  T
   2    -42.8651868 -0.536835E-04  0.136E-01    2.46       1.0  T
   3    -42.8651917 -0.497732E-05  0.340E-02    2.46       1.0  T
   4    -42.8651902  0.152830E-05  0.236E-02    2.46       1.0  T
   5    -42.8651978 -0.758279E-05  0.405E-03    2.46       4.7  T
   6    -42.8651979 -0.117852E-06  0.193E-03    2.46       9.8  T
   7    -42.8651979 -0.477444E-08  0.795E-04    2.46      23.8  T
     SCC iter.                  ...        0 min,  0.009 sec
     gradient                   ...        0 min,  0.018 sec
 * total energy  :   -42.4124277 Eh     change       -0.2107487E-03 Eh
   gradient norm :     0.0063995 Eh/α   predicted    -0.1827478E-03 ( -13.29%)
   displ. norm   :     0.1966711 α      lambda       -0.1895062E-03
   maximum displ.:     0.1091336 α      in ANC's #5, #1, #6, ...

........................................................................
.............................. CYCLE   16 ..............................
........................................................................
   1    -42.8660129 -0.428660E+02  0.188E-01    2.46       0.0  T
   2    -42.8660362 -0.232499E-04  0.872E-02    2.46       1.0  T
   3    -42.8660399 -0.372964E-05  0.191E-02    2.46       1.0  T
   4    -42.8660394  0.488614E-06  0.114E-02    2.46       1.7  T
   5    -42.8660407 -0.131875E-05  0.363E-03    2.46       5.2  T
   6    -42.8660409 -0.187194E-06  0.142E-03    2.46      13.3  T
   7    -42.8660409 -0.488478E-08  0.636E-04    2.46      29.7  T
     SCC iter.                  ...        0 min,  0.010 sec
     gradient                   ...        0 min,  0.017 sec
 * total energy  :   -42.4125170 Eh     change       -0.8924460E-04 Eh
   gradient norm :     0.0063415 Eh/α   predicted    -0.9842060E-04 (  10.28%)
   displ. norm   :     0.1783530 α      lambda       -0.1310269E-03
   maximum displ.:     0.0996267 α      in ANC's #2, #1, #5, ...

........................................................................
.............................. CYCLE   17 ..............................
........................................................................
   1    -42.8640033 -0.428640E+02  0.164E-01    2.46       0.0  T
   2    -42.8640187 -0.154348E-04  0.770E-02    2.46       1.0  T
   3    -42.8640208 -0.206231E-05  0.182E-02    2.46       1.0  T
   4    -42.8640199  0.847148E-06  0.116E-02    2.46       1.6  T
   5    -42.8640219 -0.198122E-05  0.260E-03    2.46       7.3  T
   6    -42.8640220 -0.710084E-07  0.120E-03    2.46      15.8  T
     SCC iter.                  ...        0 min,  0.008 sec
     gradient                   ...        0 min,  0.017 sec
 * total energy  :   -42.4125845 Eh     change       -0.6755142E-04 Eh
   gradient norm :     0.0066091 Eh/α   predicted    -0.6760512E-04 (   0.08%)
   displ. norm   :     0.0829441 α      lambda       -0.1037625E-03
   maximum displ.:     0.0522413 α      in ANC's #3, #4, #2, ...

........................................................................
.............................. CYCLE   18 ..............................
........................................................................
   1    -42.8663405 -0.428663E+02  0.740E-02    2.46       0.0  T
   2    -42.8663441 -0.358143E-05  0.338E-02    2.46       1.0  T
   3    -42.8663440  0.926430E-07  0.104E-02    2.46       1.8  T
   4    -42.8663444 -0.403593E-06  0.652E-03    2.46       2.9  T
   5    -42.8663449 -0.494641E-06  0.120E-03    2.46      15.8  T
   6    -42.8663449 -0.931099E-08  0.548E-04    2.46      34.5  T
     SCC iter.                  ...        0 min,  0.008 sec
     gradient                   ...        0 min,  0.018 sec
 * total energy  :   -42.4126329 Eh     change       -0.4836842E-04 Eh
   gradient norm :     0.0061351 Eh/α   predicted    -0.5224453E-04 (   8.01%)
   displ. norm   :     0.0764778 α      lambda       -0.7216966E-04
   maximum displ.:     0.0430867 α      in ANC's #2, #1, #5, ...

........................................................................
.............................. CYCLE   19 ..............................
........................................................................
   1    -42.8656150 -0.428656E+02  0.766E-02    2.47       0.0  T
   2    -42.8656183 -0.334835E-05  0.356E-02    2.47       1.0  T
   3    -42.8656178  0.526392E-06  0.111E-02    2.47       1.7  T
   4    -42.8656188 -0.100728E-05  0.637E-03    2.47       3.0  T
   5    -42.8656192 -0.389324E-06  0.903E-04    2.47      20.9  T
   6    -42.8656192 -0.332279E-08  0.446E-04    2.47      42.3  T
     SCC iter.                  ...        0 min,  0.009 sec
     gradient                   ...        0 min,  0.017 sec
 * total energy  :   -42.4126780 Eh     change       -0.4507704E-04 Eh
   gradient norm :     0.0047434 Eh/α   predicted    -0.3630056E-04 ( -19.47%)
   displ. norm   :     0.0765309 α      lambda       -0.5452702E-04
   maximum displ.:     0.0412370 α      in ANC's #2, #5, #1, ...

........................................................................
.............................. CYCLE   20 ..............................
........................................................................
   1    -42.8652754 -0.428653E+02  0.898E-02    2.47       0.0  T
   2    -42.8652811 -0.566672E-05  0.406E-02    2.48       1.0  T
   3    -42.8652793  0.180029E-05  0.150E-02    2.48       1.3  T
   4    -42.8652826 -0.335153E-05  0.656E-03    2.48       2.9  T
   5    -42.8652829 -0.259931E-06  0.131E-03    2.48      14.5  T
   6    -42.8652829 -0.764842E-08  0.626E-04    2.48      30.2  T
     SCC iter.                  ...        0 min,  0.008 sec
     gradient                   ...        0 min,  0.018 sec
 * total energy  :   -42.4127104 Eh     change       -0.3238199E-04 Eh
   gradient norm :     0.0026172 Eh/α   predicted    -0.2742718E-04 ( -15.30%)
   displ. norm   :     0.1014643 α      lambda       -0.3981357E-04
   maximum displ.:     0.0620520 α      in ANC's #5, #2, #1, ...
 * RMSD in coord.:     0.6251843 α      energy gain  -0.3233425E-01 Eh

generating ANC from model Hessian ...
Using Lindh-Hessian (1995)
 Shifting diagonal of input Hessian by   3.177736780823798E-003
 Lowest  eigenvalues of input Hessian
   -0.000000   -0.000000   -0.000000   -0.000000    0.000000    0.000000
    0.005000    0.006698    0.006952    0.009860    0.011341    0.015086
    0.017598    0.020341    0.021575    0.022991    0.024426    0.027100
 Highest eigenvalues
    1.400108    1.423025    1.453880    1.487934    1.746656    2.080269
 

........................................................................
.............................. CYCLE   21 ..............................
........................................................................
   1    -42.8647194 -0.428647E+02  0.114E-01    2.48       0.0  T
   2    -42.8647277 -0.831374E-05  0.512E-02    2.48       1.0  T
   3    -42.8647252  0.255425E-05  0.190E-02    2.48       1.0  T
   4    -42.8647298 -0.463624E-05  0.909E-03    2.48       2.1  T
   5    -42.8647304 -0.553682E-06  0.135E-03    2.48      14.0  T
   6    -42.8647304 -0.695478E-08  0.758E-04    2.48      24.9  T
   7    -42.8647304 -0.842704E-09  0.247E-04    2.48      76.4  T
     SCC iter.                  ...        0 min,  0.010 sec
     gradient                   ...        0 min,  0.019 sec
 * total energy  :   -42.4127353 Eh     change       -0.2493679E-04 Eh
   gradient norm :     0.0030104 Eh/α   predicted     0.0000000E+00 (-100.00%)
   displ. norm   :     0.0447385 α      lambda       -0.3353845E-04
   maximum displ.:     0.0251169 α      in ANC's #2, #1, #4, ...

........................................................................
.............................. CYCLE   22 ..............................
........................................................................
   1    -42.8651109 -0.428651E+02  0.529E-02    2.48       0.0  T
   2    -42.8651130 -0.217385E-05  0.225E-02    2.48       1.0  T
   3    -42.8651134 -0.382859E-06  0.514E-03    2.48       3.7  T
   4    -42.8651134 -0.112436E-07  0.149E-03    2.48      12.6  T
   5    -42.8651134 -0.404868E-08  0.561E-04    2.48      33.7  T
   6    -42.8651134 -0.301583E-09  0.306E-04    2.48      61.8  T
     SCC iter.                  ...        0 min,  0.008 sec
     gradient                   ...        0 min,  0.019 sec
 * total energy  :   -42.4127615 Eh     change       -0.2618894E-04 Eh
   gradient norm :     0.0012552 Eh/α   predicted    -0.1680363E-04 ( -35.84%)
   displ. norm   :     0.1008905 α      lambda       -0.3066538E-04
   maximum displ.:     0.0492282 α      in ANC's #2, #4, #5, ...

........................................................................
.............................. CYCLE   23 ..............................
........................................................................
   1    -42.8653878 -0.428654E+02  0.120E-01    2.48       0.0  T
   2    -42.8653984 -0.105221E-04  0.509E-02    2.49       1.0  T
   3    -42.8654002 -0.186525E-05  0.118E-02    2.49       1.6  T
   4    -42.8654002  0.509132E-07  0.370E-03    2.49       5.1  T
   5    -42.8654003 -0.114583E-06  0.196E-03    2.49       9.6  T
   6    -42.8654003 -0.419622E-07  0.938E-04    2.49      20.1  T
   7    -42.8654003 -0.170380E-08  0.320E-04    2.49      59.0  T
     SCC iter.                  ...        0 min,  0.009 sec
     gradient                   ...        0 min,  0.018 sec
 * total energy  :   -42.4127876 Eh     change       -0.2611880E-04 Eh
   gradient norm :     0.0020911 Eh/α   predicted    -0.1540262E-04 ( -41.03%)
   displ. norm   :     0.0502462 α      lambda       -0.1452147E-04
   maximum displ.:     0.0282183 α      in ANC's #2, #1, #5, ...

........................................................................
.............................. CYCLE   24 ..............................
........................................................................
   1    -42.8652448 -0.428652E+02  0.550E-02    2.49       0.0  T
   2    -42.8652470 -0.222333E-05  0.230E-02    2.49       1.0  T
   3    -42.8652473 -0.260478E-06  0.641E-03    2.49       3.0  T
   4    -42.8652472  0.654080E-07  0.435E-03    2.49       4.3  T
   5    -42.8652475 -0.262163E-06  0.901E-04    2.49      21.0  T
   6    -42.8652475 -0.145272E-08  0.523E-04    2.49      36.1  T
     SCC iter.                  ...        0 min,  0.009 sec
     gradient                   ...        0 min,  0.019 sec
 * total energy  :   -42.4127998 Eh     change       -0.1217940E-04 Eh
   gradient norm :     0.0016726 Eh/α   predicted    -0.7279300E-05 ( -40.23%)
   displ. norm   :     0.1512729 α      lambda       -0.2550522E-04
   maximum displ.:     0.0879919 α      in ANC's #1, #2, #5, ...

........................................................................
.............................. CYCLE   25 ..............................
........................................................................
   1    -42.8647580 -0.428648E+02  0.162E-01    2.49       0.0  T
   2    -42.8647776 -0.195767E-04  0.674E-02    2.49       1.0  T
   3    -42.8647794 -0.184824E-05  0.196E-02    2.49       1.0  T
   4    -42.8647797 -0.233239E-06  0.130E-02    2.49       1.4  T
   5    -42.8647817 -0.207117E-05  0.283E-03    2.49       6.7  T
   6    -42.8647817 -0.136134E-07  0.165E-03    2.49      11.5  T
   7    -42.8647817 -0.291131E-08  0.398E-04    2.49      47.5  T
   8    -42.8647817 -0.688424E-09  0.171E-04    2.49     110.5  T
     SCC iter.                  ...        0 min,  0.011 sec
     gradient                   ...        0 min,  0.019 sec
 * total energy  :   -42.4128253 Eh     change       -0.2555097E-04 Eh
   gradient norm :     0.0012996 Eh/α   predicted    -0.1288321E-04 ( -49.58%)
   displ. norm   :     0.1030001 α      lambda       -0.1222166E-04
   maximum displ.:     0.0660509 α      in ANC's #1, #2, #3, ...

........................................................................
.............................. CYCLE   26 ..............................
........................................................................
   1    -42.8647832 -0.428648E+02  0.107E-01    2.49       0.0  T
   2    -42.8647921 -0.887747E-05  0.451E-02    2.49       1.0  T
   3    -42.8647931 -0.961996E-06  0.130E-02    2.49       1.5  T
   4    -42.8647931 -0.184478E-09  0.870E-03    2.49       2.2  T
   5    -42.8647940 -0.938561E-06  0.208E-03    2.49       9.1  T
   6    -42.8647940 -0.853752E-08  0.118E-03    2.49      16.0  T
   7    -42.8647940 -0.810950E-09  0.311E-04    2.49      60.8  T
   8    -42.8647940 -0.694776E-09  0.128E-04    2.49     147.7  T
     SCC iter.                  ...        0 min,  0.011 sec
     gradient                   ...        0 min,  0.018 sec
 * total energy  :   -42.4128409 Eh     change       -0.1552406E-04 Eh
   gradient norm :     0.0011829 Eh/α   predicted    -0.6147637E-05 ( -60.40%)
   displ. norm   :     0.1134312 α      lambda       -0.1480092E-04
   maximum displ.:     0.0754903 α      in ANC's #1, #2, #3, ...

........................................................................
.............................. CYCLE   27 ..............................
........................................................................
   1    -42.8649508 -0.428650E+02  0.110E-01    2.49       0.0  T
   2    -42.8649599 -0.901734E-05  0.480E-02    2.50       1.0  T
   3    -42.8649613 -0.142914E-05  0.128E-02    2.50       1.5  T
   4    -42.8649608  0.521883E-06  0.839E-03    2.50       2.3  T
   5    -42.8649618 -0.104442E-05  0.228E-03    2.50       8.3  T
   6    -42.8649618 -0.150522E-07  0.125E-03    2.50      15.1  T
   7    -42.8649618 -0.895355E-09  0.342E-04    2.50      55.3  T
   8    -42.8649618 -0.800796E-09  0.144E-04    2.50     131.3  T
     SCC iter.                  ...        0 min,  0.011 sec
     gradient                   ...        0 min,  0.018 sec
 * total energy  :   -42.4128596 Eh     change       -0.1878489E-04 Eh
   gradient norm :     0.0010304 Eh/α   predicted    -0.7443181E-05 ( -60.38%)
   displ. norm   :     0.1394407 α      lambda       -0.1588800E-04
   maximum displ.:     0.0934158 α      in ANC's #1, #3, #2, ...

........................................................................
.............................. CYCLE   28 ..............................
........................................................................
   1    -42.8649463 -0.428649E+02  0.130E-01    2.50       0.0  T
   2    -42.8649582 -0.118649E-04  0.585E-02    2.50       1.0  T
   3    -42.8649605 -0.236488E-05  0.145E-02    2.50       1.3  T
   4    -42.8649599  0.618585E-06  0.764E-03    2.50       2.5  T
   5    -42.8649608 -0.909070E-06  0.268E-03    2.50       7.1  T
   6    -42.8649608 -0.272988E-07  0.143E-03    2.50      13.2  T
   7    -42.8649608 -0.185244E-08  0.394E-04    2.50      47.9  T
   8    -42.8649608 -0.938044E-09  0.170E-04    2.50     111.3  T
     SCC iter.                  ...        0 min,  0.011 sec
     gradient                   ...        0 min,  0.018 sec
 * total energy  :   -42.4128792 Eh     change       -0.1957628E-04 Eh
   gradient norm :     0.0012791 Eh/α   predicted    -0.8013185E-05 ( -59.07%)
   displ. norm   :     0.1595339 α      lambda       -0.1537809E-04
   maximum displ.:     0.1091610 α      in ANC's #1, #3, #2, ...

........................................................................
.............................. CYCLE   29 ..............................
........................................................................
   1    -42.8648501 -0.428649E+02  0.144E-01    2.50       0.0  T
   2    -42.8648643 -0.141966E-04  0.661E-02    2.50       1.0  T
   3    -42.8648674 -0.311253E-05  0.157E-02    2.50       1.2  T
   4    -42.8648675 -0.971637E-07  0.402E-03    2.50       4.7  T
   5    -42.8648675 -0.333485E-07  0.237E-03    2.50       8.0  T
   6    -42.8648675 -0.194760E-10  0.146E-03    2.50      13.0  T
   7    -42.8648675 -0.183727E-07  0.442E-04    2.50      42.8  T
   8    -42.8648675 -0.156311E-08  0.181E-04    2.50     104.3  T
     SCC iter.                  ...        0 min,  0.011 sec
     gradient                   ...        0 min,  0.019 sec
 * total energy  :   -42.4128973 Eh     change       -0.1806223E-04 Eh
   gradient norm :     0.0012923 Eh/α   predicted    -0.7779838E-05 ( -56.93%)
   displ. norm   :     0.1478171 α      lambda       -0.1145402E-04
   maximum displ.:     0.1047327 α      in ANC's #1, #3, #2, ...

........................................................................
.............................. CYCLE   30 ..............................
........................................................................
   1    -42.8649269 -0.428649E+02  0.128E-01    2.51       0.0  T
   2    -42.8649378 -0.109459E-04  0.598E-02    2.51       1.0  T
   3    -42.8649402 -0.239031E-05  0.141E-02    2.51       1.3  T
   4    -42.8649399  0.295608E-06  0.614E-03    2.51       3.1  T
   5    -42.8649404 -0.461425E-06  0.275E-03    2.51       6.9  T
   6    -42.8649404 -0.455274E-07  0.146E-03    2.51      12.9  T
   7    -42.8649404 -0.296949E-08  0.368E-04    2.51      51.4  T
   8    -42.8649404 -0.512500E-09  0.153E-04    2.51     123.9  T
     SCC iter.                  ...        0 min,  0.011 sec
     gradient                   ...        0 min,  0.018 sec
 * total energy  :   -42.4129104 Eh     change       -0.1307383E-04 Eh
   gradient norm :     0.0008500 Eh/α   predicted    -0.5785988E-05 ( -55.74%)
   displ. norm   :     0.1065660 α      lambda       -0.6482206E-05
   maximum displ.:     0.0798387 α      in ANC's #1, #3, #2, ...

........................................................................
.............................. CYCLE   31 ..............................
........................................................................
   1    -42.8650376 -0.428650E+02  0.923E-02    2.51       0.0  T
   2    -42.8650435 -0.587411E-05  0.425E-02    2.51       1.0  T
   3    -42.8650446 -0.115492E-05  0.102E-02    2.51       1.8  T
   4    -42.8650443  0.356872E-06  0.602E-03    2.51       3.1  T
   5    -42.8650448 -0.558131E-06  0.185E-03    2.51      10.2  T
   6    -42.8650448 -0.123090E-07  0.103E-03    2.51      18.4  T
   7    -42.8650448 -0.112618E-08  0.262E-04    2.51      72.1  T
   8    -42.8650448 -0.231609E-09  0.108E-04    2.51     174.5  T
     SCC iter.                  ...        0 min,  0.011 sec
     gradient                   ...        0 min,  0.018 sec
 * total energy  :   -42.4129176 Eh     change       -0.7281202E-05 Eh
   gradient norm :     0.0004479 Eh/α   predicted    -0.3258120E-05 ( -55.25%)
   displ. norm   :     0.0651524 α      lambda       -0.3409527E-05
   maximum displ.:     0.0523829 α      in ANC's #1, #2, #3, ...

........................................................................
.............................. CYCLE   32 ..............................
........................................................................
   1    -42.8651494 -0.428651E+02  0.526E-02    2.51       0.0  T
   2    -42.8651513 -0.194005E-05  0.243E-02    2.51       1.0  T
   3    -42.8651516 -0.351814E-06  0.602E-03    2.51       3.1  T
   4    -42.8651515  0.109223E-06  0.382E-03    2.51       4.9  T
   5    -42.8651517 -0.205247E-06  0.115E-03    2.51      16.5  T
   6    -42.8651517 -0.579348E-08  0.624E-04    2.51      30.3  T
   7    -42.8651517 -0.312006E-09  0.179E-04    2.51     105.8  T
     SCC iter.                  ...        0 min,  0.010 sec
     gradient                   ...        0 min,  0.019 sec
 * total energy  :   -42.4129217 Eh     change       -0.4088140E-05 Eh
   gradient norm :     0.0003494 Eh/α   predicted    -0.1708389E-05 ( -58.21%)
   displ. norm   :     0.0643904 α      lambda        0.4121623E-06
   maximum displ.:     0.0514320 α      in ANC's #1, #2, #3, ...

   *** GEOMETRY OPTIMIZATION CONVERGED AFTER 32 ITERATIONS ***

------------------------------------------------------------------------
 total energy gain   :        -0.0325456 Eh      -20.4227 kcal/mol
 total RMSD          :         0.6082608 a0        0.3219 Å
 total power (kW/mol):        -2.6702653 (step)  -63.5515 (real)
------------------------------------------------------------------------

 ANCopt (total)                0 d,  0 h,  0 min,  1.345 sec
 optimizer setup                ...        0 min,  0.000 sec (  0.012%)
 model hessian                  ...        0 min,  0.035 sec (  2.604%)
 ANC generation                 ...        0 min,  0.002 sec (  0.126%)
 coordinate transformation      ...        0 min,  0.001 sec (  0.046%)
 single point calculation       ...        0 min,  1.294 sec ( 96.223%)
 optimization log               ...        0 min,  0.004 sec (  0.266%)
 hessian update                 ...        0 min,  0.000 sec (  0.034%)
 rational function              ...        0 min,  0.007 sec (  0.545%)

================
 final structure:
================
$coord
    4.17794174557490    2.07137664294957    1.26477220296179      N 
    2.29256490187368    1.35869150226662   -0.60015783728847      C 
   -0.25451432916266    2.54868722667851    0.00898477565284      C 
   -2.40855635833229    1.32430002839619   -1.47500717022143      C 
   -4.75572819875549    2.48479195204357   -0.65374281789362      N 
   -5.78130855506831    0.69670668166116    1.85189553778214      S 
   -4.84160716243739   -2.11262489684216    0.50973707084116      N 
   -2.56293888228007   -1.60160207378012   -0.94386627041745      C 
   -0.26228638911525   -2.53392700174976    0.53546446042969      C 
    2.15742306568412   -1.58148551129394   -0.71778729247769      C 
    4.37605543556558   -2.51082487268303    0.60172113774839      N 
    6.55417697551315   -0.04773070798428    0.97842667157465      S 
    5.21677785969774   -4.94412794869988    0.26190919093322      C 
    7.57077404238121   -5.71694264133076    0.65125101715135      C 
    3.44913736798153    2.04785154035512    3.04397544599592      H 
    2.98887689635475    2.05512523166088   -2.42378514816722      H 
   -0.20547862149294    4.56233600384898   -0.42117353011584      H 
   -0.67358526840300    2.35858434022392    2.01992065804920      H 
   -2.14280735520370    1.67302541156013   -3.49568169274234      H 
   -6.07971428873283    2.55155865012480   -2.04200504475704      H 
   -6.24915157809793   -2.85334336855708   -0.56179912854371      H 
   -2.66101322435909   -2.62609279209389   -2.74109211067947      H 
   -0.28938003589505   -4.59403537837390    0.57985074877114      H 
   -0.37498727769265   -1.87689981297309    2.48436462947446      H 
    2.16493354072989   -2.19110619496216   -2.70876672156929      H 
    3.73910956972656   -6.25219049361672   -0.27673031394709      H 
    9.03973855408326   -4.40368949725691    1.15455387339554      H 
    8.07067999940108   -7.67709977512672    0.50566083438415      H 
$end
           -------------------------------------------------
          |                Final Singlepoint                |
           -------------------------------------------------

          ...................................................
          :                      SETUP                      :
          :.................................................:
          :  # basis functions                  82          :
          :  # atomic orbitals                  80          :
          :  # shells                           44          :
          :  # electrons                        78          :
          :  max. iterations                   250          :
          :  Hamiltonian                  GFN2-xTB          :
          :  restarted?                      false          :
          :  GBSA solvation                  false          :
          :  PC potential                    false          :
          :  electronic temp.          300.0000000     K    :
          :  accuracy                    1.0000000          :
          :  -> integral cutoff          0.2500000E+02      :
          :  -> integral neglect         0.1000000E-07      :
          :  -> SCF convergence          0.1000000E-05 Eh   :
          :  -> wf. convergence          0.1000000E-03 e    :
          :  Broyden damping             0.4000000          :
          ...................................................

 iter      E             dE          RMSdq      gap      omega  full diag
   1    -42.8651517 -0.428652E+02  0.580E-05    2.51       0.0  T
   2    -42.8651517 -0.130811E-10  0.298E-05    2.51     635.2  T
   3    -42.8651517 -0.137135E-11  0.183E-05    2.51    1033.8  T

   *** convergence criteria satisfied after 3 iterations ***

         #    Occupation            Energy/Eh            Energy/eV
      -------------------------------------------------------------
         1        2.0000           -0.7314928             -19.9049
       ...           ...                  ...                  ...
        33        2.0000           -0.4354455             -11.8491
        34        2.0000           -0.4227809             -11.5045
        35        2.0000           -0.4069332             -11.0732
        36        2.0000           -0.3999807             -10.8840
        37        2.0000           -0.3776973             -10.2777
        38        2.0000           -0.3579911              -9.7414
        39        2.0000           -0.3350393              -9.1169 (HOMO)
        40                         -0.2427259              -6.6049 (LUMO)
        41                         -0.2383510              -6.4859
        42                         -0.1815203              -4.9394
        43                         -0.1599268              -4.3518
        44                         -0.1540089              -4.1908
       ...                                ...                  ...
        80                          0.6128480              16.6764
      -------------------------------------------------------------
                  HL-Gap            0.0923134 Eh            2.5120 eV
             Fermi-level           -0.2888826 Eh           -7.8609 eV

 SCC (total)                   0 d,  0 h,  0 min,  0.037 sec
 SCC setup                      ...        0 min,  0.000 sec (  0.673%)
 Dispersion                     ...        0 min,  0.000 sec (  0.616%)
 integral evaluation            ...        0 min,  0.012 sec ( 33.593%)
 zeroth order Hamiltonian       ...        0 min,  0.000 sec (  0.578%)
 iterations                     ...        0 min,  0.005 sec ( 13.270%)
 molecular gradient             ...        0 min,  0.018 sec ( 50.047%)
 printout                       ...        0 min,  0.000 sec (  1.079%)

         :::::::::::::::::::::::::::::::::::::::::::::::::::::
         ::                     SUMMARY                     ::
         :::::::::::::::::::::::::::::::::::::::::::::::::::::
         :: total energy             -42.412921715237 Eh    ::
         :: gradient norm              0.000348942815 Eh/a0 ::
         :: HOMO-LUMO gap              2.511974256841 eV    ::
         ::.................................................::
         :: SCC energy               -42.865151748406 Eh    ::
         :: -> isotropic ES            0.026696244383 Eh    ::
         :: -> anisotropic ES          0.004131196571 Eh    ::
         :: -> anisotropic XC          0.037129008072 Eh    ::
         :: -> dispersion             -0.031671258158 Eh    ::
         :: repulsion energy           0.452030959044 Eh    ::
         :: add. restraining           0.000000000000 Eh    ::
         :::::::::::::::::::::::::::::::::::::::::::::::::::::

           -------------------------------------------------
          |                Property Printout                |
           -------------------------------------------------

    * Orbital Energies and Occupations

         #    Occupation            Energy/Eh            Energy/eV
      -------------------------------------------------------------
         1        2.0000           -0.7314928             -19.9049
       ...           ...                  ...                  ...
        27        2.0000           -0.4719818             -12.8433
        28        2.0000           -0.4680954             -12.7375
        29        2.0000           -0.4649058             -12.6507
        30        2.0000           -0.4546323             -12.3712
        31        2.0000           -0.4532021             -12.3323
        32        2.0000           -0.4401773             -11.9778
        33        2.0000           -0.4354455             -11.8491
        34        2.0000           -0.4227809             -11.5045
        35        2.0000           -0.4069332             -11.0732
        36        2.0000           -0.3999807             -10.8840
        37        2.0000           -0.3776973             -10.2777
        38        2.0000           -0.3579911              -9.7414
        39        2.0000           -0.3350393              -9.1169 (HOMO)
        40                         -0.2427259              -6.6049 (LUMO)
        41                         -0.2383510              -6.4859
        42                         -0.1815203              -4.9394
        43                         -0.1599268              -4.3518
        44                         -0.1540089              -4.1908
        45                         -0.0320750              -0.8728
        46                         -0.0238182              -0.6481
        47                         -0.0030644              -0.0834
        48                          0.0022353               0.0608
        49                          0.0055823               0.1519
        50                          0.0201599               0.5486
       ...                                ...                  ...
        80                          0.6128480              16.6764
      -------------------------------------------------------------
                  HL-Gap            0.0923134 Eh            2.5120 eV
             Fermi-level           -0.2888826 Eh           -7.8609 eV

     #   Z        covCN         q      C6AA      α(0)
     1   7 N      2.686    -0.220    25.800     7.544
     2   6 C      4.021     0.050    19.666     6.300
     3   6 C      3.810    -0.076    21.952     6.669
     4   6 C      4.000     0.052    19.630     6.294
     5   7 N      2.687    -0.234    26.136     7.593
     6  16 S      2.221    -0.007   141.364    20.011
     7   7 N      2.685    -0.238    26.219     7.605
     8   6 C      3.959     0.052    19.645     6.298
     9   6 C      3.808    -0.071    21.860     6.655
    10   6 C      3.908     0.046    19.746     6.316
    11   7 N      2.742    -0.128    23.768     7.241
    12  16 S      2.231    -0.004   141.241    20.002
    13   6 C      2.878     0.025    27.441     8.588
    14   6 C      2.840    -0.130    31.308     9.170
    15   1 H      0.862     0.162     1.323     1.802
    16   1 H      0.924     0.041     2.440     2.443
    17   1 H      0.925     0.059     2.212     2.326
    18   1 H      0.924     0.063     2.159     2.298
    19   1 H      0.924     0.023     2.692     2.566
    20   1 H      0.861     0.149     1.410     1.860
    21   1 H      0.861     0.148     1.413     1.862
    22   1 H      0.924     0.016     2.794     2.614
    23   1 H      0.924     0.048     2.343     2.394
    24   1 H      0.925     0.063     2.165     2.301
    25   1 H      0.923     0.013     2.837     2.634
    26   1 H      0.925     0.027     2.628     2.535
    27   1 H      0.926     0.040     2.454     2.450
    28   1 H      0.926     0.034     2.536     2.490

 Mol. C6AA /au·bohr⁶  :      10500.446198
 Mol. C8AA /au·bohr⁸  :     287539.862812
 Mol. α(0) /au        :        158.859089


Wiberg/Mayer (AO) data.
largest (>0.10) Wiberg bond orders for each atom
          total WBO             WBO to atom ...
     1  N   3.171        S   12 1.134    C    2 1.001    H   15 0.944
     2  C   3.979        N    1 1.001    C    3 0.994    H   16 0.966    C   10 0.958
     3  C   3.992        C    2 0.994    C    4 0.992    H   17 0.973    H   18 0.966
     4  C   3.979        N    5 1.010    C    3 0.992    H   19 0.966    C    8 0.944
     5  N   3.158        S    6 1.095    C    4 1.010    H   20 0.953
     6  S   2.288        N    5 1.095    N    7 1.092
     7  N   3.152        S    6 1.092    C    8 1.007    H   21 0.955
     8  C   3.979        N    7 1.007    C    9 0.989    H   22 0.968    C    4 0.944
     9  C   3.993        C    8 0.989    C   10 0.987    H   23 0.971    H   24 0.971
    10  C   3.980        N   11 0.988    C    9 0.987    H   25 0.962    C    2 0.958
    11  N   3.363        C   13 1.136    S   12 1.014    C   10 0.988    C   14 0.129
    12  S   2.321        N    1 1.134    N   11 1.014
    13  C   3.967        C   14 1.837    N   11 1.136    H   26 0.952
    14  C   3.976        C   13 1.837    H   28 0.977    H   27 0.966    N   11 0.129
    15  H   0.974        N    1 0.944
    16  H   0.998        C    2 0.966
    17  H   0.996        C    3 0.973
    18  H   0.996        C    3 0.966
    19  H   0.999        C    4 0.966
    20  H   0.977        N    5 0.953
    21  H   0.978        N    7 0.955
    22  H   1.000        C    8 0.968
    23  H   0.998        C    9 0.971
    24  H   0.996        C    9 0.971
    25  H   1.000        C   10 0.962
    26  H   0.999        C   13 0.952
    27  H   0.998        C   14 0.966
    28  H   0.998        C   14 0.977

molecular dipole:
                 x           y           z       tot (Debye)
 q only:       -0.630       0.182      -0.456
   full:       -1.183      -0.273      -1.216       4.368
molecular quadrupole (traceless):
                xx          xy          yy          xz          yz          zz
 q only:       -5.890       3.374       1.662       3.507       0.889       4.228
  q+dip:      -10.122       3.782       1.666       8.760       1.842       8.456
   full:       -9.598       3.337       2.131       8.161       1.960       7.468

           -------------------------------------------------
          |                Geometry Summary                 |
           -------------------------------------------------

      molecular mass/u    :      230.3454000
   center of mass at/Å    :        0.3725016      -0.3018169       0.1896889
  moments of inertia/u·Å² :        0.3869104E+03   0.1565661E+04   0.1805116E+04
rotational constants/cm⁻¹ :        0.4356986E-01   0.1076710E-01   0.9338809E-02

 * 28 selected distances

     #   Z        #   Z                                     value/Å
     1   7 N      2   6 C                                 1.4531221
     2   6 C      3   6 C                                 1.5222248
     3   6 C      4   6 C                                 1.5283289
     4   6 C      5   7 N                                 1.4521488
     5   7 N      6  16 S                                 1.7169570
     6  16 S      7   7 N                                 1.7209876 (max)
     7   7 N      8   6 C                                 1.4556161
     8   6 C      9   6 C                                 1.5291896
     2   6 C     10   6 C                                 1.5587608
     9   6 C     10   6 C                                 1.5275523
    10   6 C     11   7 N                                 1.4518279
     1   7 N     12  16 S                                 1.6916386
    11   7 N     13   6 C                                 1.3741553
    13   6 C     14   6 C                                 1.3271833
     1   7 N     15   1 H                                 1.0175177
     2   6 C     16   1 H                                 1.0967493
     3   6 C     17   1 H                                 1.0899282
     3   6 C     18   1 H                                 1.0916483
     4   6 C     19   1 H                                 1.0941765
     5   7 N     20   1 H                                 1.0157818
     7   7 N     21   1 H                                 1.0148669 (min)
     8   6 C     22   1 H                                 1.0959490
     9   6 C     23   1 H                                 1.0905098
     9   6 C     24   1 H                                 1.0899765
    10   6 C     25   1 H                                 1.1018702
    13   6 C     26   1 H                                 1.0825088
    14   6 C     27   1 H                                 1.0761707
    14   6 C     28   1 H                                 1.0732412

 * 5 distinct bonds (by element types)

   Z      Z             #   av. dist./Å        max./Å        min./Å
   1 H    6 C          11     1.0893390     1.1018702     1.0732412
   6 C    6 C           6     1.4988733     1.5587608     1.3271833
   1 H    7 N           3     1.0160555     1.0175177     1.0148669
   6 C    7 N           5     1.4373740     1.4556161     1.3741553
   7 N   16 S           3     1.7098611     1.7209876     1.6916386


optimized geometry written to: xtbopt.xyz


           -------------------------------------------------
          | TOTAL ENERGY              -42.412921715237 Eh   |
          | GRADIENT NORM               0.000348942815 Eh/α |
          | HOMO-LUMO GAP               2.511974256841 eV   |
           -------------------------------------------------

------------------------------------------------------------------------
 * finished run on 2021/05/19 at 11:00:15.456     
------------------------------------------------------------------------
 total:
 * wall-time:     0 d,  0 h,  0 min,  1.497 sec
 *  cpu-time:     0 d,  0 h,  0 min,  1.457 sec
 * ratio c/w:     0.973 speedup
 SCF:
 * wall-time:     0 d,  0 h,  0 min,  0.076 sec
 *  cpu-time:     0 d,  0 h,  0 min,  0.050 sec
 * ratio c/w:     0.659 speedup
 ANC optimizer:
 * wall-time:     0 d,  0 h,  0 min,  1.382 sec
 *  cpu-time:     0 d,  0 h,  0 min,  1.382 sec
 * ratio c/w:     1.000 speedup

