      -----------------------------------------------------------      
     |                   =====================                   |     
     |                           x T B                           |     
     |                   =====================                   |     
     |                         S. Grimme                         |     
     |          Mulliken Center for Theoretical Chemistry        |     
     |                    University of Bonn                     |     
     |                Version 6.2 RC2 (SAW190805)                |     
      -----------------------------------------------------------      

   This program is distributed in the hope that it will be useful,
   but WITHOUT ANY WARRANTY; without even the implied warranty of
   MERCHANTABILITY or FITNESS FOR A PARTICULAR PURPOSE.
   
   FOR NON-COMMERCIAL, ACADEMIA USE ONLY.
   
   Cite this work as:
   * S. Grimme, C. Bannwarth, P. Shushkov, J. Chem. Theory Comput., 2017,
     13, 1989-2009. DOI: 10.1021/acs.jctc.7b00118
   * C. Bannwarth, S. Ehlert and S. Grimme., J. Chem. Theory Comput., 2019,
     15, 1652-1671. DOI: 10.1021/acs.jctc.8b01176
   * P. Pracht, E. Caldeweyher, S. Ehlert, S. Grimme, ChemRxiv, 2019, preprint.
     DOI: 10.26434/chemrxiv.8326202.v1
   
   for DFT-D4:
   * E. Caldeweyher, C. Bannwarth and S. Grimme, J. Chem. Phys., 2017,
     147, 034112. DOI: 10.1063/1.4993215
   * E. Caldeweyher, S. Ehlert, A. Hansen, H. Neugebauer, S. Spicher,
     C. Bannwarth and S. Grimme, J. Chem. Phys., 2019, 150, 154122.
     DOI: 10.1063/1.5090222
   
   for sTDA-xTB:
   * S. Grimme and C. Bannwarth, J. Chem. Phys., 2016, 145, 054103.
     DOI: 10.1063/1.4959605
   
   in the mass-spec context:
   * V. Asgeirsson, C. Bauer and S. Grimme, Chem. Sci., 2017, 8, 4879.
     DOI: 10.1039/c7sc00601b
   
   for metadynamics refer to:
   * S. Grimme, J. Chem. Theory Comput., 2019, 155, 2847-2862
     DOI: 10.1021/acs.jctc.9b00143
   
   with help from (in alphabetical order)
   C. Bannwarth, F. Bohle, G. Brandenburg, E. Caldeweyher, M. Checinski,
   S. Dohm, S. Ehlert, S. Ehrlich, F. März, H. Neugebauer, J. Pisarek,
   P. Pracht, P. Shushkov, and S. Spicher.
   
 * started run on 2021/05/19 at 11:00:16.455     

           -------------------------------------------------
          |                Calculation Setup                |
           -------------------------------------------------

          program call               : /ihome/ghutchison/geoffh/xtb/xtb 808.xyz -opt
          hostname                   : smp-n83
          coordinate file            : 808.xyz
          omp threads                :                     1
          number of atoms            :                    20
          number of electrons        :                    72
          charge                     :                     0
          spin                       :                   0.0
          first test random number   :      0.01710018816102


########################################################################
# WARNING! Please study the warnings concerning your input carefully
#  - the use of '-opt' is discouraged, please use '--opt' next time
########################################################################

           ------------------------------------------------- 
          |                 G F N 2 - x T B                 |
          | Geometry, Frequencies, Noncovalent interactions |
          |            JCTC 2019 parametrisation            |
           ------------------------------------------------- 
             KAB for C  - Si     :                1.0500
             KAB for H  - Pd     :                0.9500
             k(s)              :                1.8500
             k(p)              :                2.2300
             k(d)              :                2.2300
             k(f)              :                2.0000
             kEN (H0ij)        :               -2.0000
             D4 a1             :                0.5200
             D4 a2             :                5.0000
             D4 s6             :                1.0000
             D4 s8             :                2.7000
             D4 s9             :                5.0000
             alphaj            :                2.0000

  Z AO/shell   Hii/eV     exponent
  1     Wed Apr 25 08:07:45 CEST 2018   EN: 2.200 GM2: 0.406  GM3: 0.0800  RAES: 1.40
     1s    -10.707211    1.230000
  6     Wed Apr 25 08:07:45 CEST 2018   EN: 2.550 GM2: 0.538  GM3: 0.1500  RAES: 3.00
     2s    -13.970922    2.096432
     2p    -10.063292    1.800000
  8     Wed Apr 25 08:07:45 CEST 2018   EN: 3.440 GM2: 0.452  GM3:-0.0517  RAES: 1.80
     2s    -20.229985    2.439742
     2p    -15.503117    2.137023
 16     Tue Apr 24 11:44:34 CEST 2018   EN: 2.580 GM2: 0.340  GM3:-0.0502  RAES: 3.10
     3s    -20.029654    1.981333
     3p    -11.377694    2.025643
     3d     -0.420282    1.702555

           ------------------------------------------------- 
          |        Self-Consistent Charge Iterations        |
           ------------------------------------------------- 

          ...................................................
          :                      SETUP                      :
          :.................................................:
          :  # basis functions                  74          :
          :  # atomic orbitals                  72          :
          :  # shells                           36          :
          :  # electrons                        72          :
          :  max. iterations                   250          :
          :  Hamiltonian                  GFN2-xTB          :
          :  restarted?                      false          :
          :  GBSA solvation                  false          :
          :  PC potential                    false          :
          :  electronic temp.          300.0000000     K    :
          :  accuracy                    1.0000000          :
          :  -> integral cutoff          0.2500000E+02      :
          :  -> integral neglect         0.1000000E-07      :
          :  -> SCF convergence          0.1000000E-05 Eh   :
          :  -> wf. convergence          0.1000000E-03 e    :
          :  Broyden damping             0.4000000          :
          ...................................................

 iter      E             dE          RMSdq      gap      omega  full diag
   1    -41.3224671 -0.413225E+02  0.532E+00    2.89       0.0  T
   2    -41.3908453 -0.683781E-01  0.283E+00    2.69       1.0  T
   3    -41.3952159 -0.437063E-02  0.178E+00    2.79       1.0  T
   4    -41.4136698 -0.184539E-01  0.546E-01    2.74       1.0  T
   5    -41.4162096 -0.253975E-02  0.233E-01    2.74       1.0  T
   6    -41.4164120 -0.202468E-03  0.985E-02    2.75       1.0  T
   7    -41.4165229 -0.110885E-03  0.366E-02    2.75       1.0  T
   8    -41.4165317 -0.879522E-05  0.192E-02    2.75       1.2  T
   9    -41.4165327 -0.101160E-05  0.843E-03    2.75       2.7  T
  10    -41.4165332 -0.520515E-06  0.253E-03    2.75       8.8  T
  11    -41.4165333 -0.299690E-07  0.128E-03    2.75      17.5  T
  12    -41.4165333 -0.308696E-08  0.871E-04    2.75      25.7  T
  13    -41.4165333 -0.596706E-08  0.246E-04    2.75      91.0  T

   *** convergence criteria satisfied after 13 iterations ***

         #    Occupation            Energy/Eh            Energy/eV
      -------------------------------------------------------------
         1        2.0000           -0.7819856             -21.2789
       ...           ...                  ...                  ...
        30        2.0000           -0.4711650             -12.8211
        31        2.0000           -0.4639306             -12.6242
        32        2.0000           -0.4512525             -12.2792
        33        2.0000           -0.4403574             -11.9827
        34        2.0000           -0.4335068             -11.7963
        35        2.0000           -0.4149762             -11.2921
        36        2.0000           -0.4066714             -11.0661 (HOMO)
        37                         -0.3056739              -8.3178 (LUMO)
        38                         -0.2934943              -7.9864
        39                         -0.2737641              -7.4495
        40                         -0.2548492              -6.9348
        41                         -0.2434481              -6.6246
       ...                                ...                  ...
        72                          0.6425492              17.4847
      -------------------------------------------------------------
                  HL-Gap            0.1009975 Eh            2.7483 eV
             Fermi-level           -0.3561727 Eh           -9.6920 eV

 SCC (total)                   0 d,  0 h,  0 min,  0.043 sec
 SCC setup                      ...        0 min,  0.000 sec (  0.715%)
 Dispersion                     ...        0 min,  0.000 sec (  0.695%)
 integral evaluation            ...        0 min,  0.011 sec ( 25.377%)
 zeroth order Hamiltonian       ...        0 min,  0.000 sec (  0.482%)
 iterations                     ...        0 min,  0.016 sec ( 36.645%)
 molecular gradient             ...        0 min,  0.015 sec ( 35.110%)
 printout                       ...        0 min,  0.000 sec (  0.848%)

         :::::::::::::::::::::::::::::::::::::::::::::::::::::
         ::                     SUMMARY                     ::
         :::::::::::::::::::::::::::::::::::::::::::::::::::::
         :: total energy             -40.973274220758 Eh    ::
         :: gradient norm              0.106998035660 Eh/a0 ::
         :: HOMO-LUMO gap              2.748281082670 eV    ::
         ::.................................................::
         :: SCC energy               -41.416533288809 Eh    ::
         :: -> isotropic ES            0.065397669362 Eh    ::
         :: -> anisotropic ES          0.002602085579 Eh    ::
         :: -> anisotropic XC          0.009699207918 Eh    ::
         :: -> dispersion             -0.024467757220 Eh    ::
         :: repulsion energy           0.443101124286 Eh    ::
         :: add. restraining           0.000000000000 Eh    ::
         :::::::::::::::::::::::::::::::::::::::::::::::::::::

      ----------------------------------------------------------- 
     |                   =====================                   |
     |                        A N C O P T                        |
     |                   =====================                   |
     |               Approximate Normal Coordinate               |
     |                Rational Function Optimizer                |
      ----------------------------------------------------------- 

          ...................................................
          :                      SETUP                      :
          :.................................................:
          :   optimization level            normal          :
          :   max. optcycles                   200          :
          :   ANC micro-cycles                  20          :
          :   degrees of freedom                54          :
          :.................................................:
          :   RF solver                   davidson          :
          :   input Hessian                  false          :
          :   write xtbopt.log                true          :
          :   linear?                        false          :
          :   energy convergence         0.5000000E-05 Eh   :
          :   grad. convergence          0.1000000E-02 Eh/α :
          :   maximium RF displ.         2.0000000          :
          :   Hlow (freq-cutoff)         0.5000000E-02      :
          :   Hmax (freq-cutoff)         5.0000000          :
          :   S6 in model hess.         20.0000000          :
          ...................................................

generating ANC from model Hessian ...
Using Lindh-Hessian (1995)
 Shifting diagonal of input Hessian by   3.314036716643983E-003
 Lowest  eigenvalues of input Hessian
   -0.000000   -0.000000    0.000000    0.000000    0.000000    0.000000
    0.005000    0.006816    0.008364    0.009609    0.013220    0.018408
    0.023464    0.025689    0.031920    0.040241    0.046392    0.048772
 Highest eigenvalues
    1.751458    1.820169    1.974306    1.997103    2.060354    2.241146
 

........................................................................
.............................. CYCLE    1 ..............................
........................................................................
   1    -41.4165333 -0.414165E+02  0.805E-05    2.75       0.0  T
   2    -41.4165333 -0.800782E-11  0.507E-05    2.75     441.4  T
   3    -41.4165333  0.198952E-11  0.305E-05    2.75     733.0  T
     SCC iter.                  ...        0 min,  0.004 sec
     gradient                   ...        0 min,  0.015 sec
 * total energy  :   -40.9732742 Eh     change        0.3955805E-08 Eh
   gradient norm :     0.1070000 Eh/α   predicted     0.0000000E+00 (-100.00%)
   displ. norm   :     0.2368794 α      lambda       -0.1054445E-01
   maximum displ.:     0.0894392 α      in ANC's #19, #13, #2, ...

........................................................................
.............................. CYCLE    2 ..............................
........................................................................
   1    -41.4396560 -0.414397E+02  0.467E-01    2.84       0.0  T
   2    -41.4399586 -0.302574E-03  0.251E-01    2.82       1.0  T
   3    -41.4398945  0.641431E-04  0.108E-01    2.82       1.0  T
   4    -41.4399856 -0.911465E-04  0.548E-02    2.82       1.0  T
   5    -41.4400119 -0.263363E-04  0.220E-02    2.82       1.0  T
   6    -41.4400133 -0.139441E-05  0.771E-03    2.82       2.9  T
   7    -41.4400139 -0.526207E-06  0.334E-03    2.82       6.7  T
   8    -41.4400140 -0.112377E-06  0.164E-03    2.82      13.6  T
     SCC iter.                  ...        0 min,  0.009 sec
     gradient                   ...        0 min,  0.014 sec
 * total energy  :   -40.9799333 Eh     change       -0.6659095E-02 Eh
   gradient norm :     0.0403280 Eh/α   predicted    -0.5568076E-02 ( -16.38%)
   displ. norm   :     0.2746722 α      lambda       -0.3367909E-02
   maximum displ.:     0.1682662 α      in ANC's #3, #6, #4, ...

........................................................................
.............................. CYCLE    3 ..............................
........................................................................
   1    -41.4518700 -0.414519E+02  0.479E-01    2.87       0.0  T
   2    -41.4521749 -0.304950E-03  0.223E-01    2.85       1.0  T
   3    -41.4521397  0.352330E-04  0.899E-02    2.86       1.0  T
   4    -41.4521972 -0.575579E-04  0.440E-02    2.85       1.0  T
   5    -41.4522175 -0.202905E-04  0.171E-02    2.85       1.3  T
   6    -41.4522178 -0.255393E-06  0.742E-03    2.85       3.0  T
   7    -41.4522183 -0.473773E-06  0.228E-03    2.85       9.8  T
   8    -41.4522183 -0.512204E-07  0.114E-03    2.85      19.7  T
     SCC iter.                  ...        0 min,  0.009 sec
     gradient                   ...        0 min,  0.014 sec
 * total energy  :   -40.9816029 Eh     change       -0.1669562E-02 Eh
   gradient norm :     0.0207383 Eh/α   predicted    -0.1811001E-02 (   8.47%)
   displ. norm   :     0.2710286 α      lambda       -0.1394048E-02
   maximum displ.:     0.1662173 α      in ANC's #3, #2, #6, ...

........................................................................
.............................. CYCLE    4 ..............................
........................................................................
   1    -41.4480825 -0.414481E+02  0.311E-01    2.84       0.0  T
   2    -41.4481294 -0.468888E-04  0.180E-01    2.84       1.0  T
   3    -41.4480931  0.362760E-04  0.703E-02    2.84       1.0  T
   4    -41.4481497 -0.565684E-04  0.242E-02    2.84       1.0  T
   5    -41.4481495  0.148822E-06  0.120E-02    2.84       1.9  T
   6    -41.4481511 -0.154575E-05  0.462E-03    2.84       4.8  T
   7    -41.4481513 -0.222928E-06  0.181E-03    2.84      12.4  T
     SCC iter.                  ...        0 min,  0.008 sec
     gradient                   ...        0 min,  0.014 sec
 * total energy  :   -40.9825743 Eh     change       -0.9714279E-03 Eh
   gradient norm :     0.0152824 Eh/α   predicted    -0.7482592E-03 ( -22.97%)
   displ. norm   :     0.3320085 α      lambda       -0.9715328E-03
   maximum displ.:     0.2110139 α      in ANC's #3, #2, #6, ...

........................................................................
.............................. CYCLE    5 ..............................
........................................................................
   1    -41.4433770 -0.414434E+02  0.379E-01    2.81       0.0  T
   2    -41.4434116 -0.345847E-04  0.201E-01    2.81       1.0  T
   3    -41.4434036  0.800481E-05  0.532E-02    2.81       1.0  T
   4    -41.4434224 -0.188240E-04  0.292E-02    2.81       1.0  T
   5    -41.4434239 -0.148121E-05  0.115E-02    2.81       1.9  T
   6    -41.4434258 -0.192151E-05  0.313E-03    2.81       7.1  T
   7    -41.4434259 -0.553833E-07  0.176E-03    2.81      12.7  T
   8    -41.4434259 -0.189080E-08  0.785E-04    2.81      28.5  T
     SCC iter.                  ...        0 min,  0.009 sec
     gradient                   ...        0 min,  0.014 sec
 * total energy  :   -40.9832579 Eh     change       -0.6836100E-03 Eh
   gradient norm :     0.0202012 Eh/α   predicted    -0.5393125E-03 ( -21.11%)
   displ. norm   :     0.3038069 α      lambda       -0.8155559E-03
   maximum displ.:     0.1909774 α      in ANC's #3, #2, #1, ...

........................................................................
.............................. CYCLE    6 ..............................
........................................................................
   1    -41.4434210 -0.414434E+02  0.317E-01    2.79       0.0  T
   2    -41.4434492 -0.282297E-04  0.164E-01    2.78       1.0  T
   3    -41.4434427  0.643652E-05  0.425E-02    2.79       1.0  T
   4    -41.4434522 -0.948407E-05  0.258E-02    2.78       1.0  T
   5    -41.4434569 -0.469368E-05  0.100E-02    2.79       2.2  T
   6    -41.4434578 -0.875156E-06  0.299E-03    2.79       7.5  T
   7    -41.4434579 -0.743967E-07  0.144E-03    2.79      15.5  T
     SCC iter.                  ...        0 min,  0.008 sec
     gradient                   ...        0 min,  0.014 sec
 * total energy  :   -40.9838357 Eh     change       -0.5778356E-03 Eh
   gradient norm :     0.0147636 Eh/α   predicted    -0.4454262E-03 ( -22.91%)
   displ. norm   :     0.2876027 α      lambda       -0.5823348E-03
   maximum displ.:     0.1740702 α      in ANC's #3, #2, #6, ...

........................................................................
.............................. CYCLE    7 ..............................
........................................................................
   1    -41.4465281 -0.414465E+02  0.299E-01    2.77       0.0  T
   2    -41.4465465 -0.183731E-04  0.159E-01    2.77       1.0  T
   3    -41.4465478 -0.132801E-05  0.359E-02    2.77       1.0  T
   4    -41.4465477  0.118831E-06  0.242E-02    2.77       1.0  T
   5    -41.4465534 -0.567170E-05  0.431E-03    2.77       5.2  T
   6    -41.4465535 -0.139257E-06  0.230E-03    2.77       9.7  T
   7    -41.4465535 -0.154060E-07  0.123E-03    2.77      18.2  T
     SCC iter.                  ...        0 min,  0.008 sec
     gradient                   ...        0 min,  0.014 sec
 * total energy  :   -40.9842427 Eh     change       -0.4069967E-03 Eh
   gradient norm :     0.0118792 Eh/α   predicted    -0.3152524E-03 ( -22.54%)
   displ. norm   :     0.2151515 α      lambda       -0.3728176E-03
   maximum displ.:     0.1224520 α      in ANC's #3, #2, #1, ...

........................................................................
.............................. CYCLE    8 ..............................
........................................................................
   1    -41.4512173 -0.414512E+02  0.209E-01    2.77       0.0  T
   2    -41.4512285 -0.111627E-04  0.111E-01    2.76       1.0  T
   3    -41.4512275  0.976261E-06  0.280E-02    2.76       1.0  T
   4    -41.4512311 -0.360398E-05  0.159E-02    2.76       1.4  T
   5    -41.4512320 -0.945636E-06  0.599E-03    2.76       3.7  T
   6    -41.4512325 -0.441652E-06  0.193E-03    2.76      11.6  T
   7    -41.4512325 -0.185783E-07  0.106E-03    2.76      21.1  T
     SCC iter.                  ...        0 min,  0.008 sec
     gradient                   ...        0 min,  0.014 sec
 * total energy  :   -40.9844581 Eh     change       -0.2153304E-03 Eh
   gradient norm :     0.0062713 Eh/α   predicted    -0.1950395E-03 (  -9.42%)
   displ. norm   :     0.2261690 α      lambda       -0.2300866E-03
   maximum displ.:     0.1392879 α      in ANC's #2, #3, #6, ...

........................................................................
.............................. CYCLE    9 ..............................
........................................................................
   1    -41.4509572 -0.414510E+02  0.265E-01    2.75       0.0  T
   2    -41.4509765 -0.193560E-04  0.140E-01    2.76       1.0  T
   3    -41.4509725  0.400517E-05  0.368E-02    2.75       1.0  T
   4    -41.4509805 -0.801855E-05  0.215E-02    2.76       1.0  T
   5    -41.4509825 -0.195424E-05  0.923E-03    2.76       2.4  T
   6    -41.4509834 -0.956556E-06  0.274E-03    2.76       8.2  T
   7    -41.4509835 -0.575288E-07  0.131E-03    2.76      17.1  T
     SCC iter.                  ...        0 min,  0.008 sec
     gradient                   ...        0 min,  0.014 sec
 * total energy  :   -40.9845842 Eh     change       -0.1261111E-03 Eh
   gradient norm :     0.0085397 Eh/α   predicted    -0.1209328E-03 (  -4.11%)
   displ. norm   :     0.0961357 α      lambda       -0.1455855E-03
   maximum displ.:     0.0781302 α      in ANC's #2, #7, #9, ...

........................................................................
.............................. CYCLE   10 ..............................
........................................................................
   1    -41.4527799 -0.414528E+02  0.108E-01    2.76       0.0  T
   2    -41.4527838 -0.389208E-05  0.571E-02    2.76       1.0  T
   3    -41.4527822  0.166519E-05  0.173E-02    2.76       1.3  T
   4    -41.4527852 -0.298320E-05  0.771E-03    2.76       2.9  T
   5    -41.4527852 -0.519028E-07  0.251E-03    2.76       8.9  T
   6    -41.4527853 -0.790352E-07  0.944E-04    2.76      23.7  T
     SCC iter.                  ...        0 min,  0.007 sec
     gradient                   ...        0 min,  0.014 sec
 * total energy  :   -40.9846815 Eh     change       -0.9729813E-04 Eh
   gradient norm :     0.0067997 Eh/α   predicted    -0.7347694E-04 ( -24.48%)
   displ. norm   :     0.3395906 α      lambda       -0.5642720E-03
   maximum displ.:     0.2610160 α      in ANC's #2, #3, #4, ...

........................................................................
.............................. CYCLE   11 ..............................
........................................................................
   1    -41.4568178 -0.414568E+02  0.321E-01    2.78       0.0  T
   2    -41.4568587 -0.409074E-04  0.176E-01    2.79       1.0  T
   3    -41.4568374  0.213856E-04  0.549E-02    2.79       1.0  T
   4    -41.4568697 -0.323425E-04  0.223E-02    2.79       1.0  T
   5    -41.4568706 -0.921040E-06  0.912E-03    2.79       2.5  T
   6    -41.4568715 -0.889372E-06  0.283E-03    2.79       7.9  T
   7    -41.4568716 -0.753953E-07  0.130E-03    2.79      17.2  T
     SCC iter.                  ...        0 min,  0.008 sec
     gradient                   ...        0 min,  0.014 sec
 * total energy  :   -40.9844049 Eh     change        0.2766284E-03 Eh
   gradient norm :     0.0271229 Eh/α   predicted    -0.3146746E-03 (-213.75%)
   displ. norm   :     0.1620072 α      lambda       -0.8515291E-03
   maximum displ.:     0.0848197 α      in ANC's #2, #3, #6, ...

........................................................................
.............................. CYCLE   12 ..............................
........................................................................
   1    -41.4490166 -0.414490E+02  0.214E-01    2.76       0.0  T
   2    -41.4490749 -0.582862E-04  0.115E-01    2.77       1.0  T
   3    -41.4490656  0.929980E-05  0.523E-02    2.76       1.0  T
   4    -41.4490906 -0.249635E-04  0.174E-02    2.76       1.3  T
   5    -41.4490911 -0.542590E-06  0.858E-03    2.76       2.6  T
   6    -41.4490912 -0.591089E-07  0.477E-03    2.76       4.7  T
   7    -41.4490915 -0.308411E-06  0.131E-03    2.76      17.1  T
     SCC iter.                  ...        0 min,  0.008 sec
     gradient                   ...        0 min,  0.014 sec
 * total energy  :   -40.9847054 Eh     change       -0.3005866E-03 Eh
   gradient norm :     0.0129793 Eh/α   predicted    -0.4369466E-03 (  45.36%)
   displ. norm   :     0.2364557 α      lambda       -0.4764320E-03
   maximum displ.:     0.2066153 α      in ANC's #2, #9, #4, ...

........................................................................
.............................. CYCLE   13 ..............................
........................................................................
   1    -41.4510380 -0.414510E+02  0.225E-01    2.76       0.0  T
   2    -41.4510839 -0.458653E-04  0.124E-01    2.75       1.0  T
   3    -41.4510775  0.635156E-05  0.432E-02    2.75       1.0  T
   4    -41.4510872 -0.969562E-05  0.196E-02    2.75       1.1  T
   5    -41.4510906 -0.335438E-05  0.972E-03    2.75       2.3  T
   6    -41.4510911 -0.533671E-06  0.387E-03    2.75       5.8  T
   7    -41.4510913 -0.165986E-06  0.134E-03    2.75      16.7  T
   8    -41.4510913 -0.692828E-08  0.835E-04    2.75      26.8  T
     SCC iter.                  ...        0 min,  0.009 sec
     gradient                   ...        0 min,  0.014 sec
 * total energy  :   -40.9847777 Eh     change       -0.7225355E-04 Eh
   gradient norm :     0.0073825 Eh/α   predicted    -0.2515421E-03 ( 248.14%)
   displ. norm   :     0.1258048 α      lambda       -0.1708378E-03
   maximum displ.:     0.1160056 α      in ANC's #2, #9, #7, ...

........................................................................
.............................. CYCLE   14 ..............................
........................................................................
   1    -41.4508884 -0.414509E+02  0.108E-01    2.75       0.0  T
   2    -41.4508945 -0.611267E-05  0.600E-02    2.76       1.0  T
   3    -41.4508930  0.152925E-05  0.177E-02    2.76       1.3  T
   4    -41.4508952 -0.218804E-05  0.867E-03    2.76       2.6  T
   5    -41.4508957 -0.492721E-06  0.421E-03    2.76       5.3  T
   6    -41.4508958 -0.987793E-07  0.148E-03    2.76      15.1  T
   7    -41.4508958 -0.262331E-07  0.622E-04    2.76      35.9  T
     SCC iter.                  ...        0 min,  0.008 sec
     gradient                   ...        0 min,  0.014 sec
 * total energy  :   -40.9848705 Eh     change       -0.9276128E-04 Eh
   gradient norm :     0.0027121 Eh/α   predicted    -0.8677189E-04 (  -6.46%)
   displ. norm   :     0.0821977 α      lambda       -0.3753826E-04
   maximum displ.:     0.0681799 α      in ANC's #2, #5, #1, ...

........................................................................
.............................. CYCLE   15 ..............................
........................................................................
   1    -41.4510092 -0.414510E+02  0.932E-02    2.76       0.0  T
   2    -41.4510121 -0.290160E-05  0.489E-02    2.76       1.0  T
   3    -41.4510118  0.235112E-06  0.120E-02    2.76       1.9  T
   4    -41.4510123 -0.510517E-06  0.747E-03    2.76       3.0  T
   5    -41.4510127 -0.356855E-06  0.328E-03    2.76       6.8  T
   6    -41.4510128 -0.703570E-07  0.106E-03    2.76      21.1  T
   7    -41.4510128 -0.112731E-07  0.484E-04    2.76      46.2  T
   8    -41.4510128 -0.423825E-09  0.273E-04    2.76      81.9  T
     SCC iter.                  ...        0 min,  0.009 sec
     gradient                   ...        0 min,  0.015 sec
 * total energy  :   -40.9848919 Eh     change       -0.2142658E-04 Eh
   gradient norm :     0.0024969 Eh/α   predicted    -0.1890045E-04 ( -11.79%)
   displ. norm   :     0.0907015 α      lambda       -0.2807771E-04
   maximum displ.:     0.0784475 α      in ANC's #2, #1, #4, ...

........................................................................
.............................. CYCLE   16 ..............................
........................................................................
   1    -41.4505852 -0.414506E+02  0.105E-01    2.75       0.0  T
   2    -41.4505875 -0.223154E-05  0.531E-02    2.75       1.0  T
   3    -41.4505878 -0.284308E-06  0.109E-02    2.75       2.0  T
   4    -41.4505874  0.356732E-06  0.794E-03    2.75       2.8  T
   5    -41.4505882 -0.791892E-06  0.114E-03    2.75      19.5  T
   6    -41.4505882 -0.494099E-08  0.670E-04    2.75      33.4  T
   7    -41.4505882 -0.477726E-09  0.427E-04    2.75      52.4  T
     SCC iter.                  ...        0 min,  0.008 sec
     gradient                   ...        0 min,  0.015 sec
 * total energy  :   -40.9849132 Eh     change       -0.2130982E-04 Eh
   gradient norm :     0.0025729 Eh/α   predicted    -0.1415575E-04 ( -33.57%)
   displ. norm   :     0.1041278 α      lambda       -0.3746371E-04
   maximum displ.:     0.0744182 α      in ANC's #2, #1, #4, ...

........................................................................
.............................. CYCLE   17 ..............................
........................................................................
   1    -41.4511877 -0.414512E+02  0.109E-01    2.75       0.0  T
   2    -41.4511903 -0.261021E-05  0.554E-02    2.75       1.0  T
   3    -41.4511903  0.377008E-07  0.124E-02    2.75       1.8  T
   4    -41.4511906 -0.349703E-06  0.805E-03    2.75       2.8  T
   5    -41.4511911 -0.481615E-06  0.279E-03    2.75       8.0  T
   6    -41.4511912 -0.957318E-07  0.858E-04    2.75      26.1  T
   7    -41.4511912 -0.283156E-08  0.510E-04    2.75      43.9  T
     SCC iter.                  ...        0 min,  0.008 sec
     gradient                   ...        0 min,  0.015 sec
 * total energy  :   -40.9849332 Eh     change       -0.2001212E-04 Eh
   gradient norm :     0.0018419 Eh/α   predicted    -0.1893706E-04 (  -5.37%)
   displ. norm   :     0.0558938 α      lambda       -0.6881621E-05
   maximum displ.:     0.0456963 α      in ANC's #2, #4, #1, ...

........................................................................
.............................. CYCLE   18 ..............................
........................................................................
   1    -41.4511636 -0.414512E+02  0.492E-02    2.75       0.0  T
   2    -41.4511644 -0.788997E-06  0.264E-02    2.75       1.0  T
   3    -41.4511641  0.254802E-06  0.707E-03    2.75       3.2  T
   4    -41.4511645 -0.362270E-06  0.366E-03    2.75       6.1  T
   5    -41.4511646 -0.774090E-07  0.167E-03    2.75      13.4  T
   6    -41.4511646 -0.243777E-07  0.547E-04    2.75      40.9  T
   7    -41.4511646 -0.314057E-08  0.229E-04    2.75      97.5  T
     SCC iter.                  ...        0 min,  0.008 sec
     gradient                   ...        0 min,  0.015 sec
 * total energy  :   -40.9849352 Eh     change       -0.2023265E-05 Eh
   gradient norm :     0.0021084 Eh/α   predicted    -0.3450617E-05 (  70.55%)
   displ. norm   :     0.0100689 α      lambda       -0.5706008E-05
   maximum displ.:     0.0071054 α      in ANC's #1, #3, #17, ...

........................................................................
.............................. CYCLE   19 ..............................
........................................................................
   1    -41.4515183 -0.414515E+02  0.127E-02    2.75       0.0  T
   2    -41.4515183 -0.468207E-07  0.671E-03    2.75       3.3  T
   3    -41.4515183  0.460621E-07  0.225E-03    2.75       9.9  T
   4    -41.4515183 -0.559017E-07  0.102E-03    2.75      22.0  T
   5    -41.4515183 -0.523566E-08  0.458E-04    2.75      48.8  T
   6    -41.4515183 -0.188591E-08  0.111E-04    2.75     200.9  T
     SCC iter.                  ...        0 min,  0.007 sec
     gradient                   ...        0 min,  0.015 sec
 * total energy  :   -40.9849391 Eh     change       -0.3899596E-05 Eh
   gradient norm :     0.0010545 Eh/α   predicted    -0.2854361E-05 ( -26.80%)
   displ. norm   :     0.0224117 α      lambda       -0.4327776E-05
   maximum displ.:     0.0118563 α      in ANC's #1, #5, #3, ...

........................................................................
.............................. CYCLE   20 ..............................
........................................................................
   1    -41.4515049 -0.414515E+02  0.304E-02    2.75       0.0  T
   2    -41.4515053 -0.367423E-06  0.154E-02    2.75       1.4  T
   3    -41.4515052  0.963392E-07  0.448E-03    2.75       5.0  T
   4    -41.4515054 -0.156044E-06  0.224E-03    2.75      10.0  T
   5    -41.4515054 -0.190037E-07  0.109E-03    2.75      20.4  T
   6    -41.4515054 -0.120195E-07  0.330E-04    2.75      67.8  T
   7    -41.4515054 -0.119232E-08  0.119E-04    2.75     188.6  T
     SCC iter.                  ...        0 min,  0.008 sec
     gradient                   ...        0 min,  0.015 sec
 * total energy  :   -40.9849408 Eh     change       -0.1632507E-05 Eh
   gradient norm :     0.0013046 Eh/α   predicted    -0.2167943E-05 (  32.80%)
   displ. norm   :     0.0095092 α      lambda       -0.2052617E-05
   maximum displ.:     0.0043622 α      in ANC's #6, #2, #4, ...
 * RMSD in coord.:     0.5158991 α      energy gain  -0.1166654E-01 Eh

generating ANC from model Hessian ...
Using Lindh-Hessian (1995)
 Shifting diagonal of input Hessian by   3.350944921927187E-003
 Lowest  eigenvalues of input Hessian
   -0.000000   -0.000000    0.000000    0.000000    0.000000    0.000000
    0.005000    0.006751    0.008076    0.009623    0.012810    0.020643
    0.023501    0.025394    0.030812    0.040731    0.043848    0.045681
 Highest eigenvalues
    1.759183    1.839048    1.996470    2.025331    2.188957    2.362797
 

........................................................................
.............................. CYCLE   21 ..............................
........................................................................
   1    -41.4515054 -0.414515E+02  0.124E-02    2.75       0.0  T
   2    -41.4515055 -0.553586E-07  0.618E-03    2.75       3.6  T
   3    -41.4515055  0.176101E-07  0.172E-03    2.75      13.0  T
   4    -41.4515055 -0.254643E-07  0.906E-04    2.75      24.7  T
   5    -41.4515055 -0.501986E-08  0.336E-04    2.75      66.6  T
     SCC iter.                  ...        0 min,  0.006 sec
     gradient                   ...        0 min,  0.015 sec
 * total energy  :   -40.9849425 Eh     change       -0.1714641E-05 Eh
   gradient norm :     0.0006273 Eh/α   predicted     0.0000000E+00 (-100.00%)
   displ. norm   :     0.0016333 α      lambda       -0.2134187E-06
   maximum displ.:     0.0013350 α      in ANC's #1, #53, #47, ...

   *** GEOMETRY OPTIMIZATION CONVERGED AFTER 21 ITERATIONS ***

------------------------------------------------------------------------
 total energy gain   :        -0.0116683 Eh       -7.3219 kcal/mol
 total RMSD          :         0.5158991 a0        0.2730 Å
 total power (kW/mol):        -1.4588094 (step)  -42.8714 (real)
------------------------------------------------------------------------

 ANCopt (total)                0 d,  0 h,  0 min,  0.715 sec
 optimizer setup                ...        0 min,  0.000 sec (  0.022%)
 model hessian                  ...        0 min,  0.007 sec (  0.918%)
 ANC generation                 ...        0 min,  0.001 sec (  0.156%)
 coordinate transformation      ...        0 min,  0.000 sec (  0.044%)
 single point calculation       ...        0 min,  0.698 sec ( 97.735%)
 optimization log               ...        0 min,  0.002 sec (  0.251%)
 hessian update                 ...        0 min,  0.000 sec (  0.032%)
 rational function              ...        0 min,  0.005 sec (  0.660%)

================
 final structure:
================
$coord
   -3.31308621399023   -2.56267768091380    0.41623518704854      C 
   -5.48605760675342   -0.25689829305935    1.03473904731896      S 
   -3.37375789564333    2.12417170077898    0.25053215121089      C 
   -1.08630148031390    1.09970890906729   -0.47340553688807      C 
   -1.05692749691202   -1.58762848144638   -0.36762585449601      C 
    1.45066699108347   -3.57843980194552   -1.33515870346514      S 
    4.18923525357109   -2.18016836805457    0.05553033458710      C 
    6.19381428067215   -3.16643973952166   -0.24941809061214      O 
    3.73990485138889    0.24988559693471    1.47815927884928      C 
    3.26193741921624    2.31765072846386   -0.46808758438469      C 
    4.87424700697622    3.66965083082569   -1.28168691106638      O 
    0.87002808664248    2.58535906855218   -1.28622036636349      O 
   -4.17329506013500    4.72314255924886    0.42062828098192      C 
   -2.83609876202017    6.72328123031087   -0.30623702576780      C 
   -3.79002402079024   -4.51832013992258    0.62153871382251      H 
    5.46417834169559    0.71697566879879    2.50757333590339      H 
    2.13856218982515    0.07550692965279    2.76625653581300      H 
   -6.04463963819840    4.96553111030925    1.20962236502596      H 
   -0.98592700987542    6.55858450690355   -1.12844179824162      H 
   -3.58566692537106    8.60201556728809   -0.10299606268119      H 
$end
           -------------------------------------------------
          |                Final Singlepoint                |
           -------------------------------------------------

          ...................................................
          :                      SETUP                      :
          :.................................................:
          :  # basis functions                  74          :
          :  # atomic orbitals                  72          :
          :  # shells                           36          :
          :  # electrons                        72          :
          :  max. iterations                   250          :
          :  Hamiltonian                  GFN2-xTB          :
          :  restarted?                      false          :
          :  GBSA solvation                  false          :
          :  PC potential                    false          :
          :  electronic temp.          300.0000000     K    :
          :  accuracy                    1.0000000          :
          :  -> integral cutoff          0.2500000E+02      :
          :  -> integral neglect         0.1000000E-07      :
          :  -> SCF convergence          0.1000000E-05 Eh   :
          :  -> wf. convergence          0.1000000E-03 e    :
          :  Broyden damping             0.4000000          :
          ...................................................

 iter      E             dE          RMSdq      gap      omega  full diag
   1    -41.4515055 -0.414515E+02  0.165E-04    2.75       0.0  T
   2    -41.4515055 -0.600338E-10  0.706E-05    2.75     316.5  T
   3    -41.4515055 -0.809735E-10  0.633E-05    2.75     353.5  T

   *** convergence criteria satisfied after 3 iterations ***

         #    Occupation            Energy/Eh            Energy/eV
      -------------------------------------------------------------
         1        2.0000           -0.7822848             -21.2871
       ...           ...                  ...                  ...
        30        2.0000           -0.4768141             -12.9748
        31        2.0000           -0.4620862             -12.5740
        32        2.0000           -0.4511076             -12.2753
        33        2.0000           -0.4411811             -12.0051
        34        2.0000           -0.4318318             -11.7507
        35        2.0000           -0.4160895             -11.3224
        36        2.0000           -0.4063078             -11.0562 (HOMO)
        37                         -0.3052368              -8.3059 (LUMO)
        38                         -0.2819636              -7.6726
        39                         -0.2599678              -7.0741
        40                         -0.2504894              -6.8162
        41                         -0.2453833              -6.6772
       ...                                ...                  ...
        72                          0.6563707              17.8608
      -------------------------------------------------------------
                  HL-Gap            0.1010710 Eh            2.7503 eV
             Fermi-level           -0.3557723 Eh           -9.6811 eV

 SCC (total)                   0 d,  0 h,  0 min,  0.030 sec
 SCC setup                      ...        0 min,  0.000 sec (  0.546%)
 Dispersion                     ...        0 min,  0.000 sec (  0.447%)
 integral evaluation            ...        0 min,  0.011 sec ( 34.744%)
 zeroth order Hamiltonian       ...        0 min,  0.000 sec (  0.599%)
 iterations                     ...        0 min,  0.004 sec ( 13.166%)
 molecular gradient             ...        0 min,  0.015 sec ( 49.206%)
 printout                       ...        0 min,  0.000 sec (  1.136%)

         :::::::::::::::::::::::::::::::::::::::::::::::::::::
         ::                     SUMMARY                     ::
         :::::::::::::::::::::::::::::::::::::::::::::::::::::
         :: total energy             -40.984942459390 Eh    ::
         :: gradient norm              0.000628740253 Eh/a0 ::
         :: HOMO-LUMO gap              2.750280735429 eV    ::
         ::.................................................::
         :: SCC energy               -41.451505489828 Eh    ::
         :: -> isotropic ES            0.062715467884 Eh    ::
         :: -> anisotropic ES          0.001688128653 Eh    ::
         :: -> anisotropic XC          0.009274110946 Eh    ::
         :: -> dispersion             -0.024683839679 Eh    ::
         :: repulsion energy           0.466411914190 Eh    ::
         :: add. restraining           0.000000000000 Eh    ::
         :::::::::::::::::::::::::::::::::::::::::::::::::::::

           -------------------------------------------------
          |                Property Printout                |
           -------------------------------------------------

    * Orbital Energies and Occupations

         #    Occupation            Energy/Eh            Energy/eV
      -------------------------------------------------------------
         1        2.0000           -0.7822848             -21.2871
       ...           ...                  ...                  ...
        24        2.0000           -0.5199655             -14.1490
        25        2.0000           -0.5165046             -14.0548
        26        2.0000           -0.5073651             -13.8061
        27        2.0000           -0.5004435             -13.6178
        28        2.0000           -0.4891607             -13.3107
        29        2.0000           -0.4863926             -13.2354
        30        2.0000           -0.4768141             -12.9748
        31        2.0000           -0.4620862             -12.5740
        32        2.0000           -0.4511076             -12.2753
        33        2.0000           -0.4411811             -12.0051
        34        2.0000           -0.4318318             -11.7507
        35        2.0000           -0.4160895             -11.3224
        36        2.0000           -0.4063078             -11.0562 (HOMO)
        37                         -0.3052368              -8.3059 (LUMO)
        38                         -0.2819636              -7.6726
        39                         -0.2599678              -7.0741
        40                         -0.2504894              -6.8162
        41                         -0.2453833              -6.6772
        42                         -0.2130125              -5.7964
        43                         -0.1852011              -5.0396
        44                         -0.1685361              -4.5861
        45                         -0.1475514              -4.0151
        46                         -0.0456302              -1.2417
        47                         -0.0301804              -0.8213
       ...                                ...                  ...
        72                          0.6563707              17.8608
      -------------------------------------------------------------
                  HL-Gap            0.1010710 Eh            2.7503 eV
             Fermi-level           -0.3557723 Eh           -9.6811 eV

     #   Z        covCN         q      C6AA      α(0)
     1   6 C      2.976    -0.037    28.925     8.822
     2  16 S      2.349     0.041   139.403    19.872
     3   6 C      2.982     0.004    27.933     8.670
     4   6 C      3.068     0.111    25.495     8.279
     5   6 C      3.152     0.007    27.586     8.590
     6  16 S      2.054    -0.085   144.612    20.240
     7   6 C      2.812     0.263    22.572     7.784
     8   8 O      0.884    -0.318    20.094     6.011
     9   6 C      3.827    -0.108    22.544     6.756
    10   6 C      2.712     0.363    20.841     7.473
    11   8 O      0.857    -0.346    20.639     6.091
    12   8 O      1.708    -0.221    17.665     5.675
    13   6 C      2.928    -0.028    28.693     8.785
    14   6 C      2.839    -0.080    29.990     8.975
    15   1 H      0.927     0.077     2.008     2.216
    16   1 H      0.924     0.100     1.786     2.090
    17   1 H      0.924     0.074     2.044     2.236
    18   1 H      0.925     0.055     2.256     2.349
    19   1 H      0.926     0.071     2.072     2.251
    20   1 H      0.926     0.059     2.214     2.327

 Mol. C6AA /au·bohr⁶  :       8328.941428
 Mol. C8AA /au·bohr⁸  :     251435.312114
 Mol. α(0) /au        :        145.489917


Wiberg/Mayer (AO) data.
largest (>0.10) Wiberg bond orders for each atom
          total WBO             WBO to atom ...
     1  C   3.950        C    5 1.542    S    2 1.217    H   15 0.966
     2  S   2.653        C    1 1.217    C    3 1.153
     3  C   3.948        C    4 1.451    S    2 1.153    C   13 1.130
     4  C   3.912        C    3 1.451    C    5 1.218    O   12 0.999
     5  C   3.956        C    1 1.542    C    4 1.218    S    6 1.023
     6  S   2.431        C    7 1.035    C    5 1.023    O    8 0.199
     7  C   3.940        O    8 1.844    S    6 1.035    C    9 0.969
     8  O   2.171        C    7 1.844    S    6 0.199
     9  C   3.991        C    7 0.969    H   16 0.959    H   17 0.951    C   10 0.939
    10  C   3.924        O   11 1.791    O   12 1.090    C    9 0.939
    11  O   2.101        C   10 1.791    O   12 0.154
    12  O   2.389        C   10 1.090    C    4 0.999    O   11 0.154
    13  C   3.985        C   14 1.863    C    3 1.130    H   18 0.961
    14  C   3.986        C   13 1.863    H   20 0.975    H   19 0.970
    15  H   0.994        C    1 0.966
    16  H   0.990        C    9 0.959
    17  H   0.995        C    9 0.951
    18  H   0.996        C   13 0.961
    19  H   0.995        C   14 0.970
    20  H   0.996        C   14 0.975

molecular dipole:
                 x           y           z       tot (Debye)
 q only:       -2.192       0.221       1.074
   full:       -2.014       0.150       1.142       5.897
molecular quadrupole (traceless):
                xx          xy          yy          xz          yz          zz
 q only:       -6.185      -0.471       2.098       4.729       1.585       4.088
  q+dip:      -10.064      -0.788       3.717       5.785       1.642       6.347
   full:      -10.691      -0.871       2.937       6.614       2.080       7.754

           -------------------------------------------------
          |                Geometry Summary                 |
           -------------------------------------------------

      molecular mass/u    :      226.2646000
   center of mass at/Å    :       -0.0024824       0.1730504      -0.0858491
  moments of inertia/u·Å² :        0.5706576E+03   0.1037719E+04   0.1521728E+04
rotational constants/cm⁻¹ :        0.2954071E-01   0.1624490E-01   0.1107795E-01

 * 16 selected distances

     #   Z        #   Z                                     value/Å
     1   6 C      2  16 S                                 1.7082650
     2  16 S      3   6 C                                 1.7347238 (max)
     3   6 C      4   6 C                                 1.3805409
     1   6 C      5   6 C                                 1.3651759
     4   6 C      5   6 C                                 1.4232640
     7   6 C      8   8 O                                 1.1931817
    10   6 C     11   8 O                                 1.1938068
     4   6 C     12   8 O                                 1.3692353
    10   6 C     12   8 O                                 1.3452181
    13   6 C     14   6 C                                 1.3300133
     1   6 C     15   1 H                                 1.0707385 (min)
     9   6 C     16   1 H                                 1.0910533
     9   6 C     17   1 H                                 1.0914274
    13   6 C     18   1 H                                 1.0823188
    14   6 C     19   1 H                                 1.0749310
    14   6 C     20   1 H                                 1.0757800

 * 4 distinct bonds (by element types)

   Z      Z             #   av. dist./Å        max./Å        min./Å
   1 H    6 C           6     1.0810415     1.0914274     1.0707385
   6 C    6 C           4     1.3747485     1.4232640     1.3300133
   6 C    8 O           4     1.2753605     1.3692353     1.1931817
   6 C   16 S           2     1.7214944     1.7347238     1.7082650


optimized geometry written to: xtbopt.xyz


           -------------------------------------------------
          | TOTAL ENERGY              -40.984942459390 Eh   |
          | GRADIENT NORM               0.000628740253 Eh/α |
          | HOMO-LUMO GAP               2.750280735429 eV   |
           -------------------------------------------------

------------------------------------------------------------------------
 * finished run on 2021/05/19 at 11:00:17.267     
------------------------------------------------------------------------
 total:
 * wall-time:     0 d,  0 h,  0 min,  0.812 sec
 *  cpu-time:     0 d,  0 h,  0 min,  0.811 sec
 * ratio c/w:     0.999 speedup
 SCF:
 * wall-time:     0 d,  0 h,  0 min,  0.043 sec
 *  cpu-time:     0 d,  0 h,  0 min,  0.043 sec
 * ratio c/w:     1.000 speedup
 ANC optimizer:
 * wall-time:     0 d,  0 h,  0 min,  0.745 sec
 *  cpu-time:     0 d,  0 h,  0 min,  0.745 sec
 * ratio c/w:     1.000 speedup

