      -----------------------------------------------------------      
     |                   =====================                   |     
     |                           x T B                           |     
     |                   =====================                   |     
     |                         S. Grimme                         |     
     |          Mulliken Center for Theoretical Chemistry        |     
     |                    University of Bonn                     |     
     |                Version 6.2 RC2 (SAW190805)                |     
      -----------------------------------------------------------      

   This program is distributed in the hope that it will be useful,
   but WITHOUT ANY WARRANTY; without even the implied warranty of
   MERCHANTABILITY or FITNESS FOR A PARTICULAR PURPOSE.
   
   FOR NON-COMMERCIAL, ACADEMIA USE ONLY.
   
   Cite this work as:
   * S. Grimme, C. Bannwarth, P. Shushkov, J. Chem. Theory Comput., 2017,
     13, 1989-2009. DOI: 10.1021/acs.jctc.7b00118
   * C. Bannwarth, S. Ehlert and S. Grimme., J. Chem. Theory Comput., 2019,
     15, 1652-1671. DOI: 10.1021/acs.jctc.8b01176
   * P. Pracht, E. Caldeweyher, S. Ehlert, S. Grimme, ChemRxiv, 2019, preprint.
     DOI: 10.26434/chemrxiv.8326202.v1
   
   for DFT-D4:
   * E. Caldeweyher, C. Bannwarth and S. Grimme, J. Chem. Phys., 2017,
     147, 034112. DOI: 10.1063/1.4993215
   * E. Caldeweyher, S. Ehlert, A. Hansen, H. Neugebauer, S. Spicher,
     C. Bannwarth and S. Grimme, J. Chem. Phys., 2019, 150, 154122.
     DOI: 10.1063/1.5090222
   
   for sTDA-xTB:
   * S. Grimme and C. Bannwarth, J. Chem. Phys., 2016, 145, 054103.
     DOI: 10.1063/1.4959605
   
   in the mass-spec context:
   * V. Asgeirsson, C. Bauer and S. Grimme, Chem. Sci., 2017, 8, 4879.
     DOI: 10.1039/c7sc00601b
   
   for metadynamics refer to:
   * S. Grimme, J. Chem. Theory Comput., 2019, 155, 2847-2862
     DOI: 10.1021/acs.jctc.9b00143
   
   with help from (in alphabetical order)
   C. Bannwarth, F. Bohle, G. Brandenburg, E. Caldeweyher, M. Checinski,
   S. Dohm, S. Ehlert, S. Ehrlich, F. März, H. Neugebauer, J. Pisarek,
   P. Pracht, P. Shushkov, and S. Spicher.
   
 * started run on 2021/05/19 at 11:00:19.977     

           -------------------------------------------------
          |                Calculation Setup                |
           -------------------------------------------------

          program call               : /ihome/ghutchison/geoffh/xtb/xtb 817.xyz -opt
          hostname                   : smp-n83
          coordinate file            : 817.xyz
          omp threads                :                     1
          number of atoms            :                    25
          number of electrons        :                    76
          charge                     :                     0
          spin                       :                   0.0
          first test random number   :      0.27493908692609


########################################################################
# WARNING! Please study the warnings concerning your input carefully
#  - the use of '-opt' is discouraged, please use '--opt' next time
########################################################################

           ------------------------------------------------- 
          |                 G F N 2 - x T B                 |
          | Geometry, Frequencies, Noncovalent interactions |
          |            JCTC 2019 parametrisation            |
           ------------------------------------------------- 
             KAB for C  - Si     :                1.0500
             KAB for H  - Pd     :                0.9500
             k(s)              :                1.8500
             k(p)              :                2.2300
             k(d)              :                2.2300
             k(f)              :                2.0000
             kEN (H0ij)        :               -2.0000
             D4 a1             :                0.5200
             D4 a2             :                5.0000
             D4 s6             :                1.0000
             D4 s8             :                2.7000
             D4 s9             :                5.0000
             alphaj            :                2.0000

  Z AO/shell   Hii/eV     exponent
  1     Wed Apr 25 08:07:45 CEST 2018   EN: 2.200 GM2: 0.406  GM3: 0.0800  RAES: 1.40
     1s    -10.707211    1.230000
  6     Wed Apr 25 08:07:45 CEST 2018   EN: 2.550 GM2: 0.538  GM3: 0.1500  RAES: 3.00
     2s    -13.970922    2.096432
     2p    -10.063292    1.800000
 16     Tue Apr 24 11:44:34 CEST 2018   EN: 2.580 GM2: 0.340  GM3:-0.0502  RAES: 3.10
     3s    -20.029654    1.981333
     3p    -11.377694    2.025643
     3d     -0.420282    1.702555

           ------------------------------------------------- 
          |        Self-Consistent Charge Iterations        |
           ------------------------------------------------- 

          ...................................................
          :                      SETUP                      :
          :.................................................:
          :  # basis functions                  88          :
          :  # atomic orbitals                  85          :
          :  # shells                           43          :
          :  # electrons                        76          :
          :  max. iterations                   250          :
          :  Hamiltonian                  GFN2-xTB          :
          :  restarted?                      false          :
          :  GBSA solvation                  false          :
          :  PC potential                    false          :
          :  electronic temp.          300.0000000     K    :
          :  accuracy                    1.0000000          :
          :  -> integral cutoff          0.2500000E+02      :
          :  -> integral neglect         0.1000000E-07      :
          :  -> SCF convergence          0.1000000E-05 Eh   :
          :  -> wf. convergence          0.1000000E-03 e    :
          :  Broyden damping             0.4000000          :
          ...................................................

 iter      E             dE          RMSdq      gap      omega  full diag
   1    -40.9601776 -0.409602E+02  0.443E+00    0.63       0.0  T
   2    -40.9783708 -0.181933E-01  0.248E+00    0.56       1.0  T
   3    -40.7726473  0.205724E+00  0.250E+00    1.11       1.0  T
   4    -40.8529278 -0.802805E-01  0.187E+00    0.85       1.0  T
   5    -40.9611106 -0.108183E+00  0.102E+00    0.61       1.0  T
   6    -40.9971617 -0.360511E-01  0.265E-01    0.57       1.0  T
   7    -40.9980017 -0.839968E-03  0.111E-01    0.55       1.0  T
   8    -40.9979604  0.413193E-04  0.707E-02    0.55       1.0  T
   9    -40.9980654 -0.105026E-03  0.388E-02    0.55       1.0  T
  10    -40.9981146 -0.491914E-04  0.167E-02    0.55       1.2  T
  11    -40.9981230 -0.839110E-05  0.578E-03    0.55       3.5  T
  12    -40.9981230 -0.269643E-07  0.306E-03    0.55       6.5  T
  13    -40.9981232 -0.175744E-06  0.139E-03    0.55      14.4  T
  14    -40.9981232 -0.419065E-07  0.535E-04    0.55      37.4  T
  15    -40.9981232  0.544882E-08  0.463E-04    0.55      43.2  T

   *** convergence criteria satisfied after 15 iterations ***

         #    Occupation            Energy/Eh            Energy/eV
      -------------------------------------------------------------
         1        2.0000           -0.7259863             -19.7551
       ...           ...                  ...                  ...
        32        2.0000           -0.4369413             -11.8898
        33        2.0000           -0.4343151             -11.8183
        34        2.0000           -0.3978239             -10.8253
        35        2.0000           -0.3934015             -10.7050
        36        2.0000           -0.3877010             -10.5499
        37        2.0000           -0.3798528             -10.3363
        38        2.0000           -0.3159371              -8.5971 (HOMO)
        39        0.0000           -0.2955891              -8.0434 (LUMO)
        40                         -0.2403137              -6.5393
        41                         -0.2112492              -5.7484
        42                         -0.2085414              -5.6747
        43                         -0.2015663              -5.4849
       ...                                ...                  ...
        85                          0.7038098              19.1516
      -------------------------------------------------------------
                  HL-Gap            0.0203481 Eh            0.5537 eV
             Fermi-level           -0.3057631 Eh           -8.3202 eV

 SCC (total)                   0 d,  0 h,  0 min,  0.085 sec
 SCC setup                      ...        0 min,  0.000 sec (  0.431%)
 Dispersion                     ...        0 min,  0.000 sec (  0.463%)
 integral evaluation            ...        0 min,  0.028 sec ( 33.099%)
 zeroth order Hamiltonian       ...        0 min,  0.000 sec (  0.275%)
 iterations                     ...        0 min,  0.037 sec ( 43.415%)
 molecular gradient             ...        0 min,  0.018 sec ( 21.758%)
 printout                       ...        0 min,  0.000 sec (  0.489%)

         :::::::::::::::::::::::::::::::::::::::::::::::::::::
         ::                     SUMMARY                     ::
         :::::::::::::::::::::::::::::::::::::::::::::::::::::
         :: total energy             -40.425670844653 Eh    ::
         :: gradient norm              0.224615095252 Eh/a0 ::
         :: HOMO-LUMO gap              0.553698828690 eV    ::
         ::.................................................::
         :: SCC energy               -40.998123233693 Eh    ::
         :: -> isotropic ES            0.004406729779 Eh    ::
         :: -> anisotropic ES          0.002564186457 Eh    ::
         :: -> anisotropic XC          0.022717418199 Eh    ::
         :: -> dispersion             -0.029717595420 Eh    ::
         :: repulsion energy           0.572724315397 Eh    ::
         :: add. restraining           0.000000000000 Eh    ::
         :::::::::::::::::::::::::::::::::::::::::::::::::::::

      ----------------------------------------------------------- 
     |                   =====================                   |
     |                        A N C O P T                        |
     |                   =====================                   |
     |               Approximate Normal Coordinate               |
     |                Rational Function Optimizer                |
      ----------------------------------------------------------- 

          ...................................................
          :                      SETUP                      :
          :.................................................:
          :   optimization level            normal          :
          :   max. optcycles                   200          :
          :   ANC micro-cycles                  20          :
          :   degrees of freedom                69          :
          :.................................................:
          :   RF solver                   davidson          :
          :   input Hessian                  false          :
          :   write xtbopt.log                true          :
          :   linear?                        false          :
          :   energy convergence         0.5000000E-05 Eh   :
          :   grad. convergence          0.1000000E-02 Eh/α :
          :   maximium RF displ.         2.0000000          :
          :   Hlow (freq-cutoff)         0.5000000E-02      :
          :   Hmax (freq-cutoff)         5.0000000          :
          :   S6 in model hess.         20.0000000          :
          ...................................................

generating ANC from model Hessian ...
Using Lindh-Hessian (1995)
 Shifting diagonal of input Hessian by   4.260484558458886E-003
 Lowest  eigenvalues of input Hessian
   -0.000000   -0.000000   -0.000000   -0.000000    0.000000    0.000000
    0.005000    0.005817    0.006079    0.008023    0.009436    0.012162
    0.016223    0.017813    0.019922    0.020395    0.021161    0.036847
 Highest eigenvalues
    1.713398    1.720663    1.774237    1.795752    1.895717    1.924206
 

........................................................................
.............................. CYCLE    1 ..............................
........................................................................
   1    -40.9981232 -0.409981E+02  0.940E-05    0.55       0.0  T
   2    -40.9981232  0.250183E-08  0.249E-04    0.55      80.3  T
   3    -40.9981232 -0.236559E-08  0.900E-05    0.55     222.3  T
     SCC iter.                  ...        0 min,  0.005 sec
     gradient                   ...        0 min,  0.018 sec
 * total energy  :   -40.4256709 Eh     change       -0.5935291E-08 Eh
   gradient norm :     0.2246160 Eh/α   predicted     0.0000000E+00 (-100.00%)
   displ. norm   :     0.3919541 α      lambda       -0.4786524E-01
   maximum displ.:     0.2518522 α      in ANC's #28, #33, #11, ...

........................................................................
.............................. CYCLE    2 ..............................
........................................................................
   1    -41.0277910 -0.410278E+02  0.440E-01    0.77       0.0  T
   2    -41.0281018 -0.310799E-03  0.253E-01    0.74       1.0  T
   3    -41.0235920  0.450984E-02  0.348E-01    0.75       1.0  T
   4    -41.0264595 -0.286755E-02  0.224E-01    0.75       1.0  T
   5    -41.0282762 -0.181663E-02  0.374E-02    0.74       1.0  T
   6    -41.0282977 -0.215934E-04  0.161E-02    0.74       1.2  T
   7    -41.0282997 -0.194935E-05  0.773E-03    0.74       2.6  T
   8    -41.0283010 -0.127387E-05  0.287E-03    0.74       7.0  T
   9    -41.0283011 -0.168835E-06  0.105E-03    0.74      19.0  T
     SCC iter.                  ...        0 min,  0.013 sec
     gradient                   ...        0 min,  0.017 sec
 * total energy  :   -40.4610117 Eh     change       -0.3534087E-01 Eh
   gradient norm :     0.1287690 Eh/α   predicted    -0.2760934E-01 ( -21.88%)
   displ. norm   :     0.3573362 α      lambda       -0.2428732E-01
   maximum displ.:     0.1635288 α      in ANC's #28, #11, #9, ...

........................................................................
.............................. CYCLE    3 ..............................
........................................................................
   1    -41.0618203 -0.410618E+02  0.502E-01    1.07       0.0  T
   2    -41.0623236 -0.503210E-03  0.261E-01    1.03       1.0  T
   3    -41.0618013  0.522278E-03  0.156E-01    1.03       1.0  T
   4    -41.0617214  0.798798E-04  0.148E-01    1.03       1.0  T
   5    -41.0624090 -0.687586E-03  0.382E-02    1.02       1.0  T
   6    -41.0624362 -0.272333E-04  0.162E-02    1.02       1.2  T
   7    -41.0624387 -0.245918E-05  0.476E-03    1.02       4.2  T
   8    -41.0624389 -0.203883E-06  0.260E-03    1.03       7.7  T
     SCC iter.                  ...        0 min,  0.012 sec
     gradient                   ...        0 min,  0.017 sec
 * total energy  :   -40.4749034 Eh     change       -0.1389163E-01 Eh
   gradient norm :     0.0332155 Eh/α   predicted    -0.1369428E-01 (  -1.42%)
   displ. norm   :     0.3767744 α      lambda       -0.3570128E-02
   maximum displ.:     0.2427123 α      in ANC's #5, #3, #2, ...

........................................................................
.............................. CYCLE    4 ..............................
........................................................................
   1    -41.0658620 -0.410659E+02  0.512E-01    1.12       0.0  T
   2    -41.0659443 -0.822809E-04  0.250E-01    1.11       1.0  T
   3    -41.0658363  0.107983E-03  0.732E-02    1.11       1.0  T
   4    -41.0659002 -0.638519E-04  0.535E-02    1.11       1.0  T
   5    -41.0659585 -0.582987E-04  0.230E-02    1.11       1.0  T
   6    -41.0659688 -0.103530E-04  0.673E-03    1.11       3.0  T
   7    -41.0659698 -0.983387E-06  0.162E-03    1.11      12.4  T
   8    -41.0659698 -0.168064E-07  0.963E-04    1.11      20.8  T
     SCC iter.                  ...        0 min,  0.012 sec
     gradient                   ...        0 min,  0.018 sec
 * total energy  :   -40.4774840 Eh     change       -0.2580613E-02 Eh
   gradient norm :     0.0126979 Eh/α   predicted    -0.2038474E-02 ( -21.01%)
   displ. norm   :     0.4276939 α      lambda       -0.1938230E-02
   maximum displ.:     0.2768967 α      in ANC's #5, #3, #2, ...

........................................................................
.............................. CYCLE    5 ..............................
........................................................................
   1    -41.0663197 -0.410663E+02  0.539E-01    1.16       0.0  T
   2    -41.0663838 -0.640874E-04  0.265E-01    1.16       1.0  T
   3    -41.0662793  0.104574E-03  0.751E-02    1.16       1.0  T
   4    -41.0663632 -0.839283E-04  0.471E-02    1.16       1.0  T
   5    -41.0663860 -0.227918E-04  0.274E-02    1.16       1.0  T
   6    -41.0664070 -0.210666E-04  0.538E-03    1.16       3.7  T
   7    -41.0664077 -0.704666E-06  0.146E-03    1.16      13.7  T
   8    -41.0664078 -0.188980E-07  0.863E-04    1.16      23.2  T
     SCC iter.                  ...        0 min,  0.012 sec
     gradient                   ...        0 min,  0.018 sec
 * total energy  :   -40.4788687 Eh     change       -0.1384774E-02 Eh
   gradient norm :     0.0128636 Eh/α   predicted    -0.1146388E-02 ( -17.21%)
   displ. norm   :     0.3824778 α      lambda       -0.1116193E-02
   maximum displ.:     0.2370167 α      in ANC's #3, #5, #2, ...

........................................................................
.............................. CYCLE    6 ..............................
........................................................................
   1    -41.0673911 -0.410674E+02  0.396E-01    1.17       0.0  T
   2    -41.0674192 -0.281474E-04  0.198E-01    1.17       1.0  T
   3    -41.0673825  0.366930E-04  0.491E-02    1.17       1.0  T
   4    -41.0673972 -0.146309E-04  0.379E-02    1.17       1.0  T
   5    -41.0674204 -0.232623E-04  0.164E-02    1.17       1.2  T
   6    -41.0674288 -0.842348E-05  0.247E-03    1.17       8.1  T
   7    -41.0674290 -0.128926E-06  0.875E-04    1.17      22.9  T
   8    -41.0674290 -0.362594E-08  0.490E-04    1.17      40.8  T
     SCC iter.                  ...        0 min,  0.012 sec
     gradient                   ...        0 min,  0.017 sec
 * total energy  :   -40.4797660 Eh     change       -0.8972896E-03 Eh
   gradient norm :     0.0134654 Eh/α   predicted    -0.6397468E-03 ( -28.70%)
   displ. norm   :     0.4419440 α      lambda       -0.1207709E-02
   maximum displ.:     0.2917390 α      in ANC's #3, #2, #5, ...

........................................................................
.............................. CYCLE    7 ..............................
........................................................................
   1    -41.0702792 -0.410703E+02  0.402E-01    1.16       0.0  T
   2    -41.0703075 -0.283261E-04  0.204E-01    1.17       1.0  T
   3    -41.0703048  0.270788E-05  0.365E-02    1.17       1.0  T
   4    -41.0702382  0.665344E-04  0.476E-02    1.17       1.0  T
   5    -41.0703138 -0.755449E-04  0.706E-03    1.17       2.8  T
   6    -41.0703147 -0.963751E-06  0.203E-03    1.17       9.8  T
   7    -41.0703148 -0.745797E-07  0.888E-04    1.17      22.5  T
     SCC iter.                  ...        0 min,  0.011 sec
     gradient                   ...        0 min,  0.018 sec
 * total energy  :   -40.4807088 Eh     change       -0.9428035E-03 Eh
   gradient norm :     0.0091486 Eh/α   predicted    -0.7218117E-03 ( -23.44%)
   displ. norm   :     0.4501960 α      lambda       -0.8937137E-03
   maximum displ.:     0.3123381 α      in ANC's #3, #2, #5, ...

........................................................................
.............................. CYCLE    8 ..............................
........................................................................
   1    -41.0723622 -0.410724E+02  0.403E-01    1.16       0.0  T
   2    -41.0723892 -0.269950E-04  0.205E-01    1.16       1.0  T
   3    -41.0723333  0.559610E-04  0.545E-02    1.16       1.0  T
   4    -41.0723528 -0.195655E-04  0.435E-02    1.16       1.0  T
   5    -41.0723965 -0.436399E-04  0.102E-02    1.16       2.0  T
   6    -41.0723992 -0.269497E-05  0.203E-03    1.16       9.9  T
   7    -41.0723993 -0.762713E-07  0.818E-04    1.16      24.4  T
     SCC iter.                  ...        0 min,  0.010 sec
     gradient                   ...        0 min,  0.017 sec
 * total energy  :   -40.4813630 Eh     change       -0.6541444E-03 Eh
   gradient norm :     0.0081290 Eh/α   predicted    -0.5374355E-03 ( -17.84%)
   displ. norm   :     0.3733863 α      lambda       -0.5162702E-03
   maximum displ.:     0.2692541 α      in ANC's #3, #2, #5, ...

........................................................................
.............................. CYCLE    9 ..............................
........................................................................
   1    -41.0739177 -0.410739E+02  0.332E-01    1.16       0.0  T
   2    -41.0739328 -0.151207E-04  0.169E-01    1.16       1.0  T
   3    -41.0737916  0.141200E-03  0.721E-02    1.16       1.0  T
   4    -41.0739306 -0.139009E-03  0.294E-02    1.16       1.0  T
   5    -41.0739419 -0.112909E-04  0.979E-03    1.16       2.0  T
   6    -41.0739445 -0.266428E-05  0.182E-03    1.16      11.0  T
   7    -41.0739446 -0.649291E-07  0.710E-04    1.16      28.2  T
     SCC iter.                  ...        0 min,  0.011 sec
     gradient                   ...        0 min,  0.018 sec
 * total energy  :   -40.4817460 Eh     change       -0.3829938E-03 Eh
   gradient norm :     0.0086549 Eh/α   predicted    -0.2941273E-03 ( -23.20%)
   displ. norm   :     0.3415265 α      lambda       -0.3886186E-03
   maximum displ.:     0.2503051 α      in ANC's #3, #2, #22, ...

........................................................................
.............................. CYCLE   10 ..............................
........................................................................
   1    -41.0748194 -0.410748E+02  0.315E-01    1.17       0.0  T
   2    -41.0748359 -0.165237E-04  0.160E-01    1.17       1.0  T
   3    -41.0747798  0.560893E-04  0.501E-02    1.17       1.0  T
   4    -41.0748249 -0.450689E-04  0.301E-02    1.17       1.0  T
   5    -41.0748398 -0.149389E-04  0.109E-02    1.17       1.8  T
   6    -41.0748434 -0.357612E-05  0.170E-03    1.17      11.8  T
   7    -41.0748435 -0.544029E-07  0.618E-04    1.17      32.4  T
   8    -41.0748435 -0.109357E-08  0.293E-04    1.17      68.2  T
     SCC iter.                  ...        0 min,  0.012 sec
     gradient                   ...        0 min,  0.018 sec
 * total energy  :   -40.4820389 Eh     change       -0.2929727E-03 Eh
   gradient norm :     0.0078659 Eh/α   predicted    -0.2169798E-03 ( -25.94%)
   displ. norm   :     0.3346778 α      lambda       -0.3360810E-03
   maximum displ.:     0.2457660 α      in ANC's #3, #2, #22, ...

........................................................................
.............................. CYCLE   11 ..............................
........................................................................
   1    -41.0755034 -0.410755E+02  0.308E-01    1.17       0.0  T
   2    -41.0755134 -0.100375E-04  0.157E-01    1.17       1.0  T
   3    -41.0752989  0.214467E-03  0.852E-02    1.17       1.0  T
   4    -41.0755215 -0.222524E-03  0.247E-02    1.17       1.0  T
   5    -41.0755270 -0.550623E-05  0.793E-03    1.17       2.5  T
   6    -41.0755285 -0.154554E-05  0.131E-03    1.17      15.3  T
   7    -41.0755285 -0.291326E-07  0.733E-04    1.17      27.3  T
     SCC iter.                  ...        0 min,  0.011 sec
     gradient                   ...        0 min,  0.018 sec
 * total energy  :   -40.4822620 Eh     change       -0.2230571E-03 Eh
   gradient norm :     0.0069512 Eh/α   predicted    -0.1868664E-03 ( -16.22%)
   displ. norm   :     0.3480849 α      lambda       -0.2807492E-03
   maximum displ.:     0.2457004 α      in ANC's #3, #2, #1, ...

........................................................................
.............................. CYCLE   12 ..............................
........................................................................
   1    -41.0746792 -0.410747E+02  0.331E-01    1.17       0.0  T
   2    -41.0746937 -0.144377E-04  0.168E-01    1.17       1.0  T
   3    -41.0745172  0.176480E-03  0.790E-02    1.17       1.0  T
   4    -41.0746992 -0.181970E-03  0.268E-02    1.17       1.0  T
   5    -41.0747056 -0.639212E-05  0.821E-03    1.17       2.4  T
   6    -41.0747076 -0.200332E-05  0.171E-03    1.17      11.7  T
   7    -41.0747076 -0.476331E-07  0.793E-04    1.17      25.2  T
     SCC iter.                  ...        0 min,  0.011 sec
     gradient                   ...        0 min,  0.018 sec
 * total energy  :   -40.4823711 Eh     change       -0.1090576E-03 Eh
   gradient norm :     0.0087643 Eh/α   predicted    -0.1573868E-03 (  44.32%)
   displ. norm   :     0.0885540 α      lambda       -0.1718781E-03
   maximum displ.:     0.0604764 α      in ANC's #5, #3, #1, ...

........................................................................
.............................. CYCLE   13 ..............................
........................................................................
   1    -41.0768797 -0.410769E+02  0.115E-01    1.17       0.0  T
   2    -41.0768808 -0.114142E-05  0.580E-02    1.17       1.0  T
   3    -41.0768330  0.478680E-04  0.405E-02    1.17       1.0  T
   4    -41.0768828 -0.498735E-04  0.111E-02    1.17       1.8  T
   5    -41.0768839 -0.100491E-05  0.772E-03    1.17       2.6  T
   6    -41.0768851 -0.127675E-05  0.117E-03    1.17      17.1  T
   7    -41.0768852 -0.251843E-07  0.445E-04    1.17      45.0  T
     SCC iter.                  ...        0 min,  0.011 sec
     gradient                   ...        0 min,  0.018 sec
 * total energy  :   -40.4824660 Eh     change       -0.9495620E-04 Eh
   gradient norm :     0.0048919 Eh/α   predicted    -0.8661522E-04 (  -8.78%)
   displ. norm   :     0.1776409 α      lambda       -0.1123159E-03
   maximum displ.:     0.1214822 α      in ANC's #3, #2, #1, ...

........................................................................
.............................. CYCLE   14 ..............................
........................................................................
   1    -41.0736707 -0.410737E+02  0.158E-01    1.18       0.0  T
   2    -41.0736745 -0.388927E-05  0.809E-02    1.17       1.0  T
   3    -41.0736395  0.350494E-04  0.368E-02    1.17       1.0  T
   4    -41.0736732 -0.336718E-04  0.158E-02    1.17       1.3  T
   5    -41.0736750 -0.183465E-05  0.932E-03    1.17       2.1  T
   6    -41.0736777 -0.268800E-05  0.143E-03    1.17      14.0  T
   7    -41.0736777 -0.327602E-07  0.558E-04    1.17      35.8  T
     SCC iter.                  ...        0 min,  0.010 sec
     gradient                   ...        0 min,  0.017 sec
 * total energy  :   -40.4824697 Eh     change       -0.3684997E-05 Eh
   gradient norm :     0.0058250 Eh/α   predicted    -0.5793462E-04 (1472.18%)
   displ. norm   :     0.0778274 α      lambda       -0.1037602E-03
   maximum displ.:     0.0482999 α      in ANC's #3, #5, #2, ...

........................................................................
.............................. CYCLE   15 ..............................
........................................................................
   1    -41.0767546 -0.410768E+02  0.827E-02    1.17       0.0  T
   2    -41.0767557 -0.110462E-05  0.414E-02    1.17       1.0  T
   3    -41.0767434  0.122551E-04  0.209E-02    1.17       1.0  T
   4    -41.0767561 -0.126630E-04  0.706E-03    1.17       2.8  T
   5    -41.0767563 -0.198922E-06  0.469E-03    1.17       4.3  T
   6    -41.0767568 -0.481373E-06  0.824E-04    1.17      24.3  T
   7    -41.0767568 -0.159647E-07  0.347E-04    1.17      57.6  T
     SCC iter.                  ...        0 min,  0.010 sec
     gradient                   ...        0 min,  0.018 sec
 * total energy  :   -40.4825186 Eh     change       -0.4889623E-04 Eh
   gradient norm :     0.0027434 Eh/α   predicted    -0.5219566E-04 (   6.75%)
   displ. norm   :     0.0345238 α      lambda       -0.2913996E-04
   maximum displ.:     0.0142489 α      in ANC's #10, #5, #2, ...

........................................................................
.............................. CYCLE   16 ..............................
........................................................................
   1    -41.0762222 -0.410762E+02  0.339E-02    1.17       0.0  T
   2    -41.0762225 -0.349622E-06  0.174E-02    1.17       1.2  T
   3    -41.0762217  0.847886E-06  0.668E-03    1.17       3.0  T
   4    -41.0762226 -0.969459E-06  0.285E-03    1.17       7.0  T
   5    -41.0762226  0.986315E-08  0.187E-03    1.17      10.7  T
   6    -41.0762227 -0.666948E-07  0.871E-04    1.17      23.0  T
   7    -41.0762227 -0.238295E-07  0.261E-04    1.17      76.8  T
     SCC iter.                  ...        0 min,  0.010 sec
     gradient                   ...        0 min,  0.018 sec
 * total energy  :   -40.4825251 Eh     change       -0.6497088E-05 Eh
   gradient norm :     0.0022672 Eh/α   predicted    -0.1459742E-04 ( 124.68%)
   displ. norm   :     0.0222148 α      lambda       -0.1357407E-04
   maximum displ.:     0.0183044 α      in ANC's #1, #5, #4, ...

........................................................................
.............................. CYCLE   17 ..............................
........................................................................
   1    -41.0761690 -0.410762E+02  0.243E-02    1.17       0.0  T
   2    -41.0761691 -0.833053E-07  0.116E-02    1.17       1.7  T
   3    -41.0761674  0.175649E-05  0.787E-03    1.17       2.5  T
   4    -41.0761692 -0.184357E-05  0.222E-03    1.17       9.0  T
   5    -41.0761692 -0.129535E-07  0.146E-03    1.17      13.7  T
   6    -41.0761693 -0.588423E-07  0.191E-04    1.17     104.8  T
   7    -41.0761693 -0.570630E-09  0.795E-05    1.17     251.5  T
     SCC iter.                  ...        0 min,  0.010 sec
     gradient                   ...        0 min,  0.019 sec
 * total energy  :   -40.4825343 Eh     change       -0.9241998E-05 Eh
   gradient norm :     0.0011894 Eh/α   predicted    -0.6791297E-05 ( -26.52%)
   displ. norm   :     0.0470861 α      lambda       -0.8009565E-05
   maximum displ.:     0.0400479 α      in ANC's #1, #5, #6, ...

........................................................................
.............................. CYCLE   18 ..............................
........................................................................
   1    -41.0758379 -0.410758E+02  0.546E-02    1.17       0.0  T
   2    -41.0758386 -0.773828E-06  0.256E-02    1.17       1.0  T
   3    -41.0758387 -0.435401E-07  0.488E-03    1.17       4.1  T
   4    -41.0758386  0.134529E-06  0.367E-03    1.17       5.5  T
   5    -41.0758388 -0.230610E-06  0.114E-03    1.17      17.5  T
   6    -41.0758388 -0.382451E-07  0.380E-04    1.17      52.7  T
   7    -41.0758388 -0.400851E-08  0.140E-04    1.17     143.2  T
     SCC iter.                  ...        0 min,  0.011 sec
     gradient                   ...        0 min,  0.019 sec
 * total energy  :   -40.4825416 Eh     change       -0.7258196E-05 Eh
   gradient norm :     0.0014653 Eh/α   predicted    -0.4010682E-05 ( -44.74%)
   displ. norm   :     0.0526285 α      lambda       -0.6887425E-05
   maximum displ.:     0.0422811 α      in ANC's #1, #3, #5, ...

........................................................................
.............................. CYCLE   19 ..............................
........................................................................
   1    -41.0758368 -0.410758E+02  0.545E-02    1.18       0.0  T
   2    -41.0758375 -0.718232E-06  0.259E-02    1.18       1.0  T
   3    -41.0758366  0.863326E-06  0.721E-03    1.18       2.8  T
   4    -41.0758372 -0.514997E-06  0.521E-03    1.18       3.8  T
   5    -41.0758375 -0.335752E-06  0.295E-03    1.18       6.8  T
   6    -41.0758377 -0.255097E-06  0.285E-04    1.18      70.1  T
   7    -41.0758378 -0.130034E-08  0.132E-04    1.18     151.3  T
     SCC iter.                  ...        0 min,  0.011 sec
     gradient                   ...        0 min,  0.019 sec
 * total energy  :   -40.4825485 Eh     change       -0.6937379E-05 Eh
   gradient norm :     0.0018321 Eh/α   predicted    -0.3449325E-05 ( -50.28%)
   displ. norm   :     0.1214131 α      lambda       -0.1486956E-04
   maximum displ.:     0.1074891 α      in ANC's #1, #3, #5, ...

........................................................................
.............................. CYCLE   20 ..............................
........................................................................
   1    -41.0755654 -0.410756E+02  0.137E-01    1.18       0.0  T
   2    -41.0755703 -0.497785E-05  0.636E-02    1.18       1.0  T
   3    -41.0755689  0.144579E-05  0.139E-02    1.18       1.4  T
   4    -41.0755686  0.330328E-06  0.119E-02    1.18       1.7  T
   5    -41.0755703 -0.168987E-05  0.635E-03    1.18       3.1  T
   6    -41.0755717 -0.140286E-05  0.505E-04    1.18      39.6  T
   7    -41.0755717 -0.210908E-08  0.273E-04    1.18      73.2  T
   8    -41.0755717 -0.866670E-09  0.114E-04    1.18     175.0  T
     SCC iter.                  ...        0 min,  0.012 sec
     gradient                   ...        0 min,  0.018 sec
 * total energy  :   -40.4825602 Eh     change       -0.1164322E-04 Eh
   gradient norm :     0.0019838 Eh/α   predicted    -0.7489603E-05 ( -35.67%)
   displ. norm   :     0.0903877 α      lambda       -0.1003954E-04
   maximum displ.:     0.0833916 α      in ANC's #1, #4, #2, ...
 * RMSD in coord.:     0.7059603 α      energy gain  -0.5688933E-01 Eh

generating ANC from model Hessian ...
Using Lindh-Hessian (1995)
 Shifting diagonal of input Hessian by   4.206782617120143E-003
 Lowest  eigenvalues of input Hessian
   -0.000000   -0.000000   -0.000000   -0.000000   -0.000000    0.000000
    0.005000    0.005870    0.006181    0.008243    0.009231    0.014168
    0.014217    0.017954    0.019149    0.019933    0.020353    0.034578
 Highest eigenvalues
    1.733080    1.754345    1.842806    1.905190    2.011954    2.067998
 

........................................................................
.............................. CYCLE   21 ..............................
........................................................................
   1    -41.0754327 -0.410754E+02  0.938E-02    1.17       0.0  T
   2    -41.0754346 -0.186911E-05  0.441E-02    1.17       1.0  T
   3    -41.0754232  0.113942E-04  0.202E-02    1.17       1.0  T
   4    -41.0754350 -0.118476E-04  0.758E-03    1.17       2.6  T
   5    -41.0754356 -0.597752E-06  0.241E-03    1.17       8.3  T
   6    -41.0754358 -0.158985E-06  0.359E-04    1.17      55.8  T
   7    -41.0754358 -0.114533E-08  0.228E-04    1.17      87.8  T
     SCC iter.                  ...        0 min,  0.010 sec
     gradient                   ...        0 min,  0.019 sec
 * total energy  :   -40.4825694 Eh     change       -0.9195032E-05 Eh
   gradient norm :     0.0017199 Eh/α   predicted     0.0000000E+00 (-100.00%)
   displ. norm   :     0.0481356 α      lambda       -0.1393491E-04
   maximum displ.:     0.0327290 α      in ANC's #1, #5, #11, ...

........................................................................
.............................. CYCLE   22 ..............................
........................................................................
   1    -41.0760663 -0.410761E+02  0.424E-02    1.17       0.0  T
   2    -41.0760666 -0.301123E-06  0.209E-02    1.17       1.0  T
   3    -41.0760642  0.239537E-05  0.963E-03    1.17       2.1  T
   4    -41.0760666 -0.239746E-05  0.384E-03    1.17       5.2  T
   5    -41.0760666 -0.354183E-07  0.289E-03    1.17       6.9  T
   6    -41.0760668 -0.224920E-06  0.348E-04    1.17      57.5  T
   7    -41.0760668 -0.165929E-08  0.139E-04    1.17     144.3  T
     SCC iter.                  ...        0 min,  0.024 sec
     gradient                   ...        0 min,  0.019 sec
 * total energy  :   -40.4825816 Eh     change       -0.1218240E-04 Eh
   gradient norm :     0.0006553 Eh/α   predicted    -0.6975372E-05 ( -42.74%)
   displ. norm   :     0.0267308 α      lambda       -0.4081034E-05
   maximum displ.:     0.0178055 α      in ANC's #1, #5, #7, ...

........................................................................
.............................. CYCLE   23 ..............................
........................................................................
   1    -41.0760717 -0.410761E+02  0.231E-02    1.17       0.0  T
   2    -41.0760717 -0.468351E-07  0.121E-02    1.17       1.7  T
   3    -41.0760700  0.170708E-05  0.776E-03    1.17       2.6  T
   4    -41.0760718 -0.175420E-05  0.214E-03    1.17       9.4  T
   5    -41.0760718 -0.237886E-07  0.133E-03    1.17      15.1  T
   6    -41.0760719 -0.456774E-07  0.209E-04    1.17      95.7  T
   7    -41.0760719 -0.714103E-09  0.966E-05    1.17     207.1  T
     SCC iter.                  ...        0 min,  0.011 sec
     gradient                   ...        0 min,  0.018 sec
 * total energy  :   -40.4825855 Eh     change       -0.3939668E-05 Eh
   gradient norm :     0.0003606 Eh/α   predicted    -0.2041566E-05 ( -48.18%)
   displ. norm   :     0.0263884 α      lambda       -0.2009126E-05
   maximum displ.:     0.0203593 α      in ANC's #1, #5, #4, ...

   *** GEOMETRY OPTIMIZATION CONVERGED AFTER 23 ITERATIONS ***

------------------------------------------------------------------------
 total energy gain   :        -0.0569147 Eh      -35.7145 kcal/mol
 total RMSD          :         0.7112603 a0        0.3764 Å
 total power (kW/mol):        -6.4969301 (step) -143.7707 (real)
------------------------------------------------------------------------

 ANCopt (total)                0 d,  0 h,  0 min,  1.039 sec
 optimizer setup                ...        0 min,  0.000 sec (  0.015%)
 model hessian                  ...        0 min,  0.005 sec (  0.456%)
 ANC generation                 ...        0 min,  0.001 sec (  0.142%)
 coordinate transformation      ...        0 min,  0.000 sec (  0.040%)
 single point calculation       ...        0 min,  1.024 sec ( 98.482%)
 optimization log               ...        0 min,  0.002 sec (  0.227%)
 hessian update                 ...        0 min,  0.000 sec (  0.027%)
 rational function              ...        0 min,  0.005 sec (  0.476%)

================
 final structure:
================
$coord
    0.22378796559051    1.86040075443759   -2.06404674291953      C 
   -1.49345522674908    0.03200649523517   -2.34853683019556      C 
   -1.42407370993094   -1.93403047051672   -0.49251092322221      C 
    0.99473507208783   -1.34251743946778    1.71953491068098      S 
    1.95062001246479    1.57312647549983    0.13510032937016      C 
   -2.94508524629953   -4.00681523545913   -0.36143234509740      C 
   -2.89321407451002   -5.97452647949821    1.46367248358297      C 
   -4.63546812068231   -7.81113110782748    1.08891490251327      C 
   -6.19640976444526   -7.43707173937497   -1.06276771145282      C 
   -5.34745402437588   -4.59990338248384   -2.59816660037198      S 
   -8.08223357875528   -8.95982507193195   -1.92988740871814      C 
   -8.92386940020524  -11.80695458745991   -0.42050845584955      S 
  -11.37690336959900  -12.50311828351617   -2.74920669314865      C 
  -11.34725132368185  -10.36003692933886   -4.56818520276508      C 
   -9.63529736144141   -8.56244642476063   -4.10822405143978      C 
    0.43299504693332    3.47203453099555   -3.28573542115515      H 
   -2.87746598646864   -0.04476325961811   -3.83899111292274      H 
    3.92781502734617    1.39638853212993   -0.43178137445275      H 
    1.79395393459076    3.13448021910536    1.47620779023614      H 
   -1.54380240634649   -5.92722973633610    2.98441793701352      H 
   -4.88696733254188   -9.45053155244714    2.26594498074752      H 
  -13.18459459380357  -12.68757045764120   -1.77008855406140      H 
  -10.93558193774194  -14.30851323521208   -3.64918355658870      H 
  -12.66009779800856  -10.35802412529581   -6.12097279757307      H 
   -9.36570712753036   -6.89290930746639   -5.24096841066924      H 
$end
           -------------------------------------------------
          |                Final Singlepoint                |
           -------------------------------------------------

          ...................................................
          :                      SETUP                      :
          :.................................................:
          :  # basis functions                  88          :
          :  # atomic orbitals                  85          :
          :  # shells                           43          :
          :  # electrons                        76          :
          :  max. iterations                   250          :
          :  Hamiltonian                  GFN2-xTB          :
          :  restarted?                      false          :
          :  GBSA solvation                  false          :
          :  PC potential                    false          :
          :  electronic temp.          300.0000000     K    :
          :  accuracy                    1.0000000          :
          :  -> integral cutoff          0.2500000E+02      :
          :  -> integral neglect         0.1000000E-07      :
          :  -> SCF convergence          0.1000000E-05 Eh   :
          :  -> wf. convergence          0.1000000E-03 e    :
          :  Broyden damping             0.4000000          :
          ...................................................

 iter      E             dE          RMSdq      gap      omega  full diag
   1    -41.0760719 -0.410761E+02  0.499E-05    1.17       0.0  T
   2    -41.0760719 -0.117240E-11  0.238E-05    1.17     838.9  T
   3    -41.0760719 -0.412825E-11  0.240E-05    1.17     833.4  T

   *** convergence criteria satisfied after 3 iterations ***

         #    Occupation            Energy/Eh            Energy/eV
      -------------------------------------------------------------
         1        2.0000           -0.7208414             -19.6151
       ...           ...                  ...                  ...
        32        2.0000           -0.4410638             -12.0020
        33        2.0000           -0.4368188             -11.8864
        34        2.0000           -0.4125333             -11.2256
        35        2.0000           -0.4000545             -10.8860
        36        2.0000           -0.3911899             -10.6448
        37        2.0000           -0.3764732             -10.2444
        38        2.0000           -0.3310848              -9.0093 (HOMO)
        39                         -0.2879467              -7.8354 (LUMO)
        40                         -0.2370831              -6.4514
        41                         -0.2180545              -5.9336
        42                         -0.2145938              -5.8394
        43                         -0.2009965              -5.4694
       ...                                ...                  ...
        85                          0.7238949              19.6982
      -------------------------------------------------------------
                  HL-Gap            0.0431381 Eh            1.1738 eV
             Fermi-level           -0.3095157 Eh           -8.4224 eV

 SCC (total)                   0 d,  0 h,  0 min,  0.039 sec
 SCC setup                      ...        0 min,  0.000 sec (  0.608%)
 Dispersion                     ...        0 min,  0.000 sec (  0.578%)
 integral evaluation            ...        0 min,  0.015 sec ( 36.937%)
 zeroth order Hamiltonian       ...        0 min,  0.000 sec (  0.527%)
 iterations                     ...        0 min,  0.005 sec ( 13.709%)
 molecular gradient             ...        0 min,  0.018 sec ( 46.537%)
 printout                       ...        0 min,  0.000 sec (  0.954%)

         :::::::::::::::::::::::::::::::::::::::::::::::::::::
         ::                     SUMMARY                     ::
         :::::::::::::::::::::::::::::::::::::::::::::::::::::
         :: total energy             -40.482585486003 Eh    ::
         :: gradient norm              0.000360680499 Eh/a0 ::
         :: HOMO-LUMO gap              1.173848190422 eV    ::
         ::.................................................::
         :: SCC energy               -41.076071859218 Eh    ::
         :: -> isotropic ES            0.004550304424 Eh    ::
         :: -> anisotropic ES          0.000459637842 Eh    ::
         :: -> anisotropic XC          0.024105751025 Eh    ::
         :: -> dispersion             -0.029889479517 Eh    ::
         :: repulsion energy           0.593755584230 Eh    ::
         :: add. restraining           0.000000000000 Eh    ::
         :::::::::::::::::::::::::::::::::::::::::::::::::::::

           -------------------------------------------------
          |                Property Printout                |
           -------------------------------------------------

    * Orbital Energies and Occupations

         #    Occupation            Energy/Eh            Energy/eV
      -------------------------------------------------------------
         1        2.0000           -0.7208414             -19.6151
       ...           ...                  ...                  ...
        26        2.0000           -0.4667942             -12.7021
        27        2.0000           -0.4626593             -12.5896
        28        2.0000           -0.4606038             -12.5337
        29        2.0000           -0.4567254             -12.4281
        30        2.0000           -0.4540702             -12.3559
        31        2.0000           -0.4421922             -12.0327
        32        2.0000           -0.4410638             -12.0020
        33        2.0000           -0.4368188             -11.8864
        34        2.0000           -0.4125333             -11.2256
        35        2.0000           -0.4000545             -10.8860
        36        2.0000           -0.3911899             -10.6448
        37        2.0000           -0.3764732             -10.2444
        38        2.0000           -0.3310848              -9.0093 (HOMO)
        39                         -0.2879467              -7.8354 (LUMO)
        40                         -0.2370831              -6.4514
        41                         -0.2180545              -5.9336
        42                         -0.2145938              -5.8394
        43                         -0.2009965              -5.4694
        44                         -0.1960293              -5.3342
        45                         -0.1598654              -4.3502
        46                         -0.1545102              -4.2044
        47                         -0.1392243              -3.7885
        48                         -0.1246883              -3.3929
        49                         -0.0967110              -2.6316
       ...                                ...                  ...
        85                          0.7238949              19.6982
      -------------------------------------------------------------
                  HL-Gap            0.0431381 Eh            1.1738 eV
             Fermi-level           -0.3095157 Eh           -8.4224 eV

     #   Z        covCN         q      C6AA      α(0)
     1   6 C      3.009    -0.040    28.985     8.831
     2   6 C      3.022    -0.033    28.786     8.801
     3   6 C      3.012     0.027    27.373     8.582
     4  16 S      2.185    -0.133   146.655    20.382
     5   6 C      3.814    -0.005    20.649     6.468
     6   6 C      3.017     0.027    27.382     8.584
     7   6 C      3.052    -0.037    28.874     8.813
     8   6 C      3.052    -0.037    28.875     8.813
     9   6 C      3.017     0.027    27.382     8.584
    10  16 S      2.273    -0.124   146.257    20.355
    11   6 C      3.012     0.027    27.373     8.582
    12  16 S      2.185    -0.133   146.653    20.382
    13   6 C      3.814    -0.005    20.649     6.468
    14   6 C      3.009    -0.040    28.984     8.831
    15   6 C      3.022    -0.033    28.786     8.801
    16   1 H      0.926     0.041     2.437     2.441
    17   1 H      0.926     0.050     2.317     2.380
    18   1 H      0.924     0.060     2.199     2.319
    19   1 H      0.924     0.060     2.200     2.320
    20   1 H      0.926     0.045     2.387     2.416
    21   1 H      0.926     0.045     2.387     2.416
    22   1 H      0.924     0.060     2.200     2.320
    23   1 H      0.924     0.060     2.199     2.319
    24   1 H      0.926     0.041     2.437     2.441
    25   1 H      0.926     0.050     2.317     2.380

 Mol. C6AA /au·bohr⁶  :      12914.394840
 Mol. C8AA /au·bohr⁸  :     411023.587098
 Mol. α(0) /au        :        185.027605


Wiberg/Mayer (AO) data.
largest (>0.10) Wiberg bond orders for each atom
          total WBO             WBO to atom ...
     1  C   3.905        C    2 1.774    C    5 1.038    H   16 0.963
     2  C   3.989        C    1 1.774    C    3 1.166    H   17 0.957
     3  C   3.903        C    6 1.484    C    2 1.166    S    4 1.055
     4  S   2.267        C    3 1.055    C    5 0.986
     5  C   3.978        C    1 1.038    S    4 0.986    H   19 0.955    H   18 0.955
     6  C   3.955        C    3 1.484    C    7 1.214    S   10 1.046
     7  C   3.959        C    8 1.621    C    6 1.214    H   20 0.959
     8  C   3.959        C    7 1.621    C    9 1.214    H   21 0.959
     9  C   3.955        C   11 1.484    C    8 1.214    S   10 1.046
    10  S   2.414        C    6 1.046    C    9 1.046
    11  C   3.903        C    9 1.484    C   15 1.166    S   12 1.055
    12  S   2.267        C   11 1.055    C   13 0.986
    13  C   3.978        C   14 1.038    S   12 0.986    H   22 0.955    H   23 0.955
    14  C   3.905        C   15 1.774    C   13 1.038    H   24 0.963
    15  C   3.989        C   14 1.774    C   11 1.166    H   25 0.957
    16  H   0.998        C    1 0.963
    17  H   0.997        C    2 0.957
    18  H   0.988        C    5 0.955
    19  H   0.988        C    5 0.955
    20  H   0.997        C    7 0.959
    21  H   0.997        C    8 0.959
    22  H   0.988        C   13 0.955
    23  H   0.988        C   13 0.955
    24  H   0.998        C   14 0.963
    25  H   0.997        C   15 0.957

molecular dipole:
                 x           y           z       tot (Debye)
 q only:       -0.157       0.236      -0.429
   full:       -0.265       0.397      -0.711       2.177
molecular quadrupole (traceless):
                xx          xy          yy          xz          yz          zz
 q only:        5.123      11.738       0.610       6.305       5.131      -5.733
  q+dip:        8.371      16.751       0.031       9.062       8.907      -8.402
   full:        8.405      15.843      -0.247       8.403       9.265      -8.158

           -------------------------------------------------
          |                Geometry Summary                 |
           -------------------------------------------------

      molecular mass/u    :      250.3910000
   center of mass at/Å    :       -2.4731738      -2.9393774      -0.5569939
  moments of inertia/u·Å² :        0.3052475E+03   0.2745593E+04   0.3044283E+04
rotational constants/cm⁻¹ :        0.5522611E-01   0.6139888E-02   0.5537472E-02

 * 21 selected distances

     #   Z        #   Z                                     value/Å
     1   6 C      2   6 C                                 1.3358854
     2   6 C      3   6 C                                 1.4312212
     1   6 C      5   6 C                                 1.4874234
     3   6 C      6   6 C                                 1.3622686
     6   6 C      7   6 C                                 1.4204823
     7   6 C      8   6 C                                 1.3542192
     8   6 C      9   6 C                                 1.4205426
     9   6 C     11   6 C                                 1.3622595
    13   6 C     14   6 C                                 1.4875774 (max)
    11   6 C     15   6 C                                 1.4312330
    14   6 C     15   6 C                                 1.3359690
     1   6 C     16   1 H                                 1.0758909 (min)
     2   6 C     17   1 H                                 1.0770848
     5   6 C     18   1 H                                 1.0924520
     5   6 C     19   1 H                                 1.0923299
     7   6 C     20   1 H                                 1.0761722
     8   6 C     21   1 H                                 1.0762333
    13   6 C     22   1 H                                 1.0922663
    13   6 C     23   1 H                                 1.0927445
    14   6 C     24   1 H                                 1.0760295
    15   6 C     25   1 H                                 1.0771251

 * 2 distinct bonds (by element types)

   Z      Z             #   av. dist./Å        max./Å        min./Å
   1 H    6 C          10     1.0828328     1.0927445     1.0758909
   6 C    6 C          11     1.4026438     1.4875774     1.3358854


optimized geometry written to: xtbopt.xyz


           -------------------------------------------------
          | TOTAL ENERGY              -40.482585486003 Eh   |
          | GRADIENT NORM               0.000360680499 Eh/α |
          | HOMO-LUMO GAP               1.173848190422 eV   |
           -------------------------------------------------

------------------------------------------------------------------------
 * finished run on 2021/05/19 at 11:00:21.192     
------------------------------------------------------------------------
 total:
 * wall-time:     0 d,  0 h,  0 min,  1.215 sec
 *  cpu-time:     0 d,  0 h,  0 min,  1.152 sec
 * ratio c/w:     0.948 speedup
 SCF:
 * wall-time:     0 d,  0 h,  0 min,  0.085 sec
 *  cpu-time:     0 d,  0 h,  0 min,  0.059 sec
 * ratio c/w:     0.694 speedup
 ANC optimizer:
 * wall-time:     0 d,  0 h,  0 min,  1.079 sec
 *  cpu-time:     0 d,  0 h,  0 min,  1.066 sec
 * ratio c/w:     0.988 speedup

