      -----------------------------------------------------------      
     |                   =====================                   |     
     |                           x T B                           |     
     |                   =====================                   |     
     |                         S. Grimme                         |     
     |          Mulliken Center for Theoretical Chemistry        |     
     |                    University of Bonn                     |     
     |                Version 6.2 RC2 (SAW190805)                |     
      -----------------------------------------------------------      

   This program is distributed in the hope that it will be useful,
   but WITHOUT ANY WARRANTY; without even the implied warranty of
   MERCHANTABILITY or FITNESS FOR A PARTICULAR PURPOSE.
   
   FOR NON-COMMERCIAL, ACADEMIA USE ONLY.
   
   Cite this work as:
   * S. Grimme, C. Bannwarth, P. Shushkov, J. Chem. Theory Comput., 2017,
     13, 1989-2009. DOI: 10.1021/acs.jctc.7b00118
   * C. Bannwarth, S. Ehlert and S. Grimme., J. Chem. Theory Comput., 2019,
     15, 1652-1671. DOI: 10.1021/acs.jctc.8b01176
   * P. Pracht, E. Caldeweyher, S. Ehlert, S. Grimme, ChemRxiv, 2019, preprint.
     DOI: 10.26434/chemrxiv.8326202.v1
   
   for DFT-D4:
   * E. Caldeweyher, C. Bannwarth and S. Grimme, J. Chem. Phys., 2017,
     147, 034112. DOI: 10.1063/1.4993215
   * E. Caldeweyher, S. Ehlert, A. Hansen, H. Neugebauer, S. Spicher,
     C. Bannwarth and S. Grimme, J. Chem. Phys., 2019, 150, 154122.
     DOI: 10.1063/1.5090222
   
   for sTDA-xTB:
   * S. Grimme and C. Bannwarth, J. Chem. Phys., 2016, 145, 054103.
     DOI: 10.1063/1.4959605
   
   in the mass-spec context:
   * V. Asgeirsson, C. Bauer and S. Grimme, Chem. Sci., 2017, 8, 4879.
     DOI: 10.1039/c7sc00601b
   
   for metadynamics refer to:
   * S. Grimme, J. Chem. Theory Comput., 2019, 155, 2847-2862
     DOI: 10.1021/acs.jctc.9b00143
   
   with help from (in alphabetical order)
   C. Bannwarth, F. Bohle, G. Brandenburg, E. Caldeweyher, M. Checinski,
   S. Dohm, S. Ehlert, S. Ehrlich, F. März, H. Neugebauer, J. Pisarek,
   P. Pracht, P. Shushkov, and S. Spicher.
   
 * started run on 2021/05/19 at 11:00:21.636     

           -------------------------------------------------
          |                Calculation Setup                |
           -------------------------------------------------

          program call               : /ihome/ghutchison/geoffh/xtb/xtb 819.xyz -opt
          hostname                   : smp-n83
          coordinate file            : 819.xyz
          omp threads                :                     1
          number of atoms            :                    15
          number of electrons        :                    44
          charge                     :                     0
          spin                       :                   0.0
          first test random number   :      0.86386176125530


########################################################################
# WARNING! Please study the warnings concerning your input carefully
#  - the use of '-opt' is discouraged, please use '--opt' next time
########################################################################

           ------------------------------------------------- 
          |                 G F N 2 - x T B                 |
          | Geometry, Frequencies, Noncovalent interactions |
          |            JCTC 2019 parametrisation            |
           ------------------------------------------------- 
             KAB for C  - Si     :                1.0500
             KAB for H  - Pd     :                0.9500
             k(s)              :                1.8500
             k(p)              :                2.2300
             k(d)              :                2.2300
             k(f)              :                2.0000
             kEN (H0ij)        :               -2.0000
             D4 a1             :                0.5200
             D4 a2             :                5.0000
             D4 s6             :                1.0000
             D4 s8             :                2.7000
             D4 s9             :                5.0000
             alphaj            :                2.0000

  Z AO/shell   Hii/eV     exponent
  1     Wed Apr 25 08:07:45 CEST 2018   EN: 2.200 GM2: 0.406  GM3: 0.0800  RAES: 1.40
     1s    -10.707211    1.230000
  6     Wed Apr 25 08:07:45 CEST 2018   EN: 2.550 GM2: 0.538  GM3: 0.1500  RAES: 3.00
     2s    -13.970922    2.096432
     2p    -10.063292    1.800000
 16     Tue Apr 24 11:44:34 CEST 2018   EN: 2.580 GM2: 0.340  GM3:-0.0502  RAES: 3.10
     3s    -20.029654    1.981333
     3p    -11.377694    2.025643
     3d     -0.420282    1.702555

           ------------------------------------------------- 
          |        Self-Consistent Charge Iterations        |
           ------------------------------------------------- 

          ...................................................
          :                      SETUP                      :
          :.................................................:
          :  # basis functions                  48          :
          :  # atomic orbitals                  47          :
          :  # shells                           25          :
          :  # electrons                        44          :
          :  max. iterations                   250          :
          :  Hamiltonian                  GFN2-xTB          :
          :  restarted?                      false          :
          :  GBSA solvation                  false          :
          :  PC potential                    false          :
          :  electronic temp.          300.0000000     K    :
          :  accuracy                    1.0000000          :
          :  -> integral cutoff          0.2500000E+02      :
          :  -> integral neglect         0.1000000E-07      :
          :  -> SCF convergence          0.1000000E-05 Eh   :
          :  -> wf. convergence          0.1000000E-03 e    :
          :  Broyden damping             0.4000000          :
          ...................................................

 iter      E             dE          RMSdq      gap      omega  full diag
   1    -23.7500214 -0.237500E+02  0.567E+00    3.07       0.0  T
   2    -23.7601639 -0.101425E-01  0.334E+00    3.07       1.0  T
   3    -23.7372086  0.229554E-01  0.140E+00    3.10       1.0  T
   4    -23.7612810 -0.240724E-01  0.478E-01    3.09       1.0  T
   5    -23.7632318 -0.195084E-02  0.231E-01    3.09       1.0  T
   6    -23.7637985 -0.566738E-03  0.828E-02    3.09       1.0  T
   7    -23.7638615 -0.629421E-04  0.309E-02    3.09       1.0  T
   8    -23.7638637 -0.219500E-05  0.180E-02    3.09       1.4  T
   9    -23.7638653 -0.158015E-05  0.718E-03    3.09       3.6  T
  10    -23.7638654 -0.116921E-06  0.277E-03    3.09       9.3  T
  11    -23.7638654 -0.379825E-07  0.148E-03    3.09      17.4  T
  12    -23.7638654 -0.292994E-08  0.816E-04    3.09      31.6  T
  13    -23.7638654 -0.469834E-08  0.345E-04    3.09      74.9  T

   *** convergence criteria satisfied after 13 iterations ***

         #    Occupation            Energy/Eh            Energy/eV
      -------------------------------------------------------------
         1        2.0000           -0.7305157             -19.8783
       ...           ...                  ...                  ...
        16        2.0000           -0.4541928             -12.3592
        17        2.0000           -0.4512227             -12.2784
        18        2.0000           -0.4443209             -12.0906
        19        2.0000           -0.4265387             -11.6067
        20        2.0000           -0.3975911             -10.8190
        21        2.0000           -0.3959615             -10.7747
        22        2.0000           -0.3744800             -10.1901 (HOMO)
        23                         -0.2610624              -7.1039 (LUMO)
        24                         -0.2316349              -6.3031
        25                         -0.1965800              -5.3492
        26                         -0.1829337              -4.9779
        27                         -0.1458240              -3.9681
       ...                                ...                  ...
        47                          1.4422175              39.2447
      -------------------------------------------------------------
                  HL-Gap            0.1134176 Eh            3.0862 eV
             Fermi-level           -0.3177712 Eh           -8.6470 eV

 SCC (total)                   0 d,  0 h,  0 min,  0.034 sec
 SCC setup                      ...        0 min,  0.000 sec (  0.674%)
 Dispersion                     ...        0 min,  0.000 sec (  0.554%)
 integral evaluation            ...        0 min,  0.005 sec ( 13.741%)
 zeroth order Hamiltonian       ...        0 min,  0.000 sec (  0.304%)
 iterations                     ...        0 min,  0.022 sec ( 64.873%)
 molecular gradient             ...        0 min,  0.006 sec ( 18.898%)
 printout                       ...        0 min,  0.000 sec (  0.800%)

         :::::::::::::::::::::::::::::::::::::::::::::::::::::
         ::                     SUMMARY                     ::
         :::::::::::::::::::::::::::::::::::::::::::::::::::::
         :: total energy             -23.318264243966 Eh    ::
         :: gradient norm              0.063805389754 Eh/a0 ::
         :: HOMO-LUMO gap              3.086249620089 eV    ::
         ::.................................................::
         :: SCC energy               -23.763865425202 Eh    ::
         :: -> isotropic ES            0.001712478150 Eh    ::
         :: -> anisotropic ES          0.002253187048 Eh    ::
         :: -> anisotropic XC          0.018808783590 Eh    ::
         :: -> dispersion             -0.012178566006 Eh    ::
         :: repulsion energy           0.445664138247 Eh    ::
         :: add. restraining           0.000000000000 Eh    ::
         :::::::::::::::::::::::::::::::::::::::::::::::::::::

      ----------------------------------------------------------- 
     |                   =====================                   |
     |                        A N C O P T                        |
     |                   =====================                   |
     |               Approximate Normal Coordinate               |
     |                Rational Function Optimizer                |
      ----------------------------------------------------------- 

          ...................................................
          :                      SETUP                      :
          :.................................................:
          :   optimization level            normal          :
          :   max. optcycles                   200          :
          :   ANC micro-cycles                  20          :
          :   degrees of freedom                39          :
          :.................................................:
          :   RF solver                   davidson          :
          :   input Hessian                  false          :
          :   write xtbopt.log                true          :
          :   linear?                        false          :
          :   energy convergence         0.5000000E-05 Eh   :
          :   grad. convergence          0.1000000E-02 Eh/α :
          :   maximium RF displ.         2.0000000          :
          :   Hlow (freq-cutoff)         0.5000000E-02      :
          :   Hmax (freq-cutoff)         5.0000000          :
          :   S6 in model hess.         20.0000000          :
          ...................................................

generating ANC from model Hessian ...
Using Lindh-Hessian (1995)
 Shifting diagonal of input Hessian by   4.556932258698666E-003
 Lowest  eigenvalues of input Hessian
   -0.000000   -0.000000   -0.000000    0.000000    0.000000    0.000000
    0.005000    0.005089    0.006447    0.011421    0.019360    0.020328
    0.021642    0.030641    0.041409    0.043871    0.064815    0.070216
 Highest eigenvalues
    1.554930    1.644073    1.774100    1.817916    1.866791    2.641324
 

........................................................................
.............................. CYCLE    1 ..............................
........................................................................
   1    -23.7638654 -0.237639E+02  0.143E-04    3.09       0.0  T
   2    -23.7638654 -0.446576E-11  0.926E-05    3.09     278.8  T
   3    -23.7638654 -0.368665E-10  0.767E-05    3.09     336.5  T
     SCC iter.                  ...        0 min,  0.002 sec
     gradient                   ...        0 min,  0.006 sec
 * total energy  :   -23.3182643 Eh     change       -0.2163600E-07 Eh
   gradient norm :     0.0638064 Eh/α   predicted     0.0000000E+00 (-100.00%)
   displ. norm   :     0.1592526 α      lambda       -0.3819989E-02
   maximum displ.:     0.0995741 α      in ANC's #10, #3, #15, ...

........................................................................
.............................. CYCLE    2 ..............................
........................................................................
   1    -23.7801025 -0.237801E+02  0.217E-01    3.02       0.0  T
   2    -23.7801341 -0.315768E-04  0.108E-01    3.02       1.0  T
   3    -23.7801099  0.241366E-04  0.607E-02    3.02       1.0  T
   4    -23.7801424 -0.324458E-04  0.283E-02    3.02       1.0  T
   5    -23.7801483 -0.598439E-05  0.148E-02    3.02       1.7  T
   6    -23.7801500 -0.162377E-05  0.509E-03    3.02       5.1  T
   7    -23.7801502 -0.241196E-06  0.999E-04    3.02      25.8  T
     SCC iter.                  ...        0 min,  0.004 sec
     gradient                   ...        0 min,  0.006 sec
 * total energy  :   -23.3207159 Eh     change       -0.2451648E-02 Eh
   gradient norm :     0.0230795 Eh/α   predicted    -0.1958435E-02 ( -20.12%)
   displ. norm   :     0.1212398 α      lambda       -0.9028999E-03
   maximum displ.:     0.0579180 α      in ANC's #6, #10, #1, ...

........................................................................
.............................. CYCLE    3 ..............................
........................................................................
   1    -23.7889083 -0.237889E+02  0.169E-01    2.97       0.0  T
   2    -23.7889223 -0.140164E-04  0.931E-02    2.97       1.0  T
   3    -23.7889022  0.200900E-04  0.547E-02    2.97       1.0  T
   4    -23.7889250 -0.227974E-04  0.227E-02    2.97       1.1  T
   5    -23.7889289 -0.391647E-05  0.108E-02    2.97       2.4  T
   6    -23.7889303 -0.131440E-05  0.314E-03    2.97       8.2  T
   7    -23.7889304 -0.907897E-07  0.889E-04    2.97      29.1  T
     SCC iter.                  ...        0 min,  0.004 sec
     gradient                   ...        0 min,  0.006 sec
 * total energy  :   -23.3211264 Eh     change       -0.4104913E-03 Eh
   gradient norm :     0.0082479 Eh/α   predicted    -0.4580855E-03 (  11.59%)
   displ. norm   :     0.1163423 α      lambda       -0.3693516E-03
   maximum displ.:     0.0636377 α      in ANC's #3, #2, #6, ...

........................................................................
.............................. CYCLE    4 ..............................
........................................................................
   1    -23.7889634 -0.237890E+02  0.169E-01    2.95       0.0  T
   2    -23.7889684 -0.497126E-05  0.997E-02    2.95       1.0  T
   3    -23.7889541  0.142247E-04  0.372E-02    2.95       1.0  T
   4    -23.7889695 -0.153447E-04  0.110E-02    2.95       2.4  T
   5    -23.7889705 -0.102430E-05  0.491E-03    2.95       5.3  T
   6    -23.7889707 -0.238695E-06  0.204E-03    2.95      12.7  T
   7    -23.7889708 -0.324982E-07  0.875E-04    2.95      29.5  T
     SCC iter.                  ...        0 min,  0.004 sec
     gradient                   ...        0 min,  0.006 sec
 * total energy  :   -23.3212396 Eh     change       -0.1132331E-03 Eh
   gradient norm :     0.0062315 Eh/α   predicted    -0.1871731E-03 (  65.30%)
   displ. norm   :     0.0772982 α      lambda       -0.1831337E-03
   maximum displ.:     0.0350776 α      in ANC's #2, #1, #8, ...

........................................................................
.............................. CYCLE    5 ..............................
........................................................................
   1    -23.7859404 -0.237859E+02  0.788E-02    2.94       0.0  T
   2    -23.7859410 -0.612070E-06  0.439E-02    2.94       1.0  T
   3    -23.7859365  0.452479E-05  0.189E-02    2.94       1.4  T
   4    -23.7859414 -0.489541E-05  0.593E-03    2.94       4.4  T
   5    -23.7859414 -0.229669E-07  0.373E-03    2.94       6.9  T
   6    -23.7859416 -0.174770E-06  0.463E-04    2.94      55.8  T
   7    -23.7859416 -0.869477E-09  0.237E-04    2.94     108.8  T
     SCC iter.                  ...        0 min,  0.004 sec
     gradient                   ...        0 min,  0.006 sec
 * total energy  :   -23.3213447 Eh     change       -0.1050289E-03 Eh
   gradient norm :     0.0033616 Eh/α   predicted    -0.9211346E-04 ( -12.30%)
   displ. norm   :     0.0916839 α      lambda       -0.1007335E-03
   maximum displ.:     0.0546255 α      in ANC's #2, #1, #3, ...

........................................................................
.............................. CYCLE    6 ..............................
........................................................................
   1    -23.7838854 -0.237839E+02  0.967E-02    2.94       0.0  T
   2    -23.7838862 -0.749497E-06  0.549E-02    2.94       1.0  T
   3    -23.7838824  0.377295E-05  0.196E-02    2.94       1.3  T
   4    -23.7838867 -0.426394E-05  0.551E-03    2.94       4.7  T
   5    -23.7838866  0.659741E-07  0.327E-03    2.94       7.9  T
   6    -23.7838868 -0.161683E-06  0.682E-04    2.94      37.8  T
   7    -23.7838868 -0.362252E-08  0.331E-04    2.94      78.1  T
     SCC iter.                  ...        0 min,  0.004 sec
     gradient                   ...        0 min,  0.006 sec
 * total energy  :   -23.3213931 Eh     change       -0.4839822E-04 Eh
   gradient norm :     0.0024250 Eh/α   predicted    -0.5079190E-04 (   4.95%)
   displ. norm   :     0.0829942 α      lambda       -0.4956059E-04
   maximum displ.:     0.0570250 α      in ANC's #2, #1, #3, ...

........................................................................
.............................. CYCLE    7 ..............................
........................................................................
   1    -23.7840776 -0.237841E+02  0.766E-02    2.93       0.0  T
   2    -23.7840780 -0.433112E-06  0.437E-02    2.93       1.0  T
   3    -23.7840768  0.116832E-05  0.116E-02    2.93       2.2  T
   4    -23.7840781 -0.127884E-05  0.397E-03    2.93       6.5  T
   5    -23.7840782 -0.477495E-07  0.196E-03    2.93      13.1  T
   6    -23.7840782 -0.401038E-07  0.827E-04    2.93      31.2  T
   7    -23.7840782 -0.973815E-08  0.244E-04    2.93     105.6  T
     SCC iter.                  ...        0 min,  0.004 sec
     gradient                   ...        0 min,  0.006 sec
 * total energy  :   -23.3214353 Eh     change       -0.4227921E-04 Eh
   gradient norm :     0.0029281 Eh/α   predicted    -0.2495143E-04 ( -40.98%)
   displ. norm   :     0.1638192 α      lambda       -0.9100848E-04
   maximum displ.:     0.1077090 α      in ANC's #2, #1, #3, ...

........................................................................
.............................. CYCLE    8 ..............................
........................................................................
   1    -23.7851852 -0.237852E+02  0.167E-01    2.92       0.0  T
   2    -23.7851879 -0.266084E-05  0.916E-02    2.92       1.0  T
   3    -23.7851857  0.219062E-05  0.199E-02    2.92       1.3  T
   4    -23.7851872 -0.152751E-05  0.127E-02    2.92       2.0  T
   5    -23.7851886 -0.139784E-05  0.326E-03    2.92       7.9  T
   6    -23.7851888 -0.143731E-06  0.106E-03    2.92      24.4  T
   7    -23.7851888 -0.967330E-08  0.506E-04    2.92      51.0  T
   8    -23.7851888  0.678178E-10  0.191E-04    2.92     135.1  T
     SCC iter.                  ...        0 min,  0.005 sec
     gradient                   ...        0 min,  0.006 sec
 * total energy  :   -23.3215101 Eh     change       -0.7480513E-04 Eh
   gradient norm :     0.0037687 Eh/α   predicted    -0.4672556E-04 ( -37.54%)
   displ. norm   :     0.2670162 α      lambda       -0.1159863E-03
   maximum displ.:     0.1753991 α      in ANC's #2, #1, #3, ...

........................................................................
.............................. CYCLE    9 ..............................
........................................................................
   1    -23.7848638 -0.237849E+02  0.263E-01    2.89       0.0  T
   2    -23.7848695 -0.570473E-05  0.146E-01    2.89       1.0  T
   3    -23.7848686  0.963942E-06  0.236E-02    2.89       1.1  T
   4    -23.7848656  0.298258E-05  0.204E-02    2.89       1.3  T
   5    -23.7848710 -0.544850E-05  0.323E-03    2.89       8.0  T
   6    -23.7848712 -0.132571E-06  0.126E-03    2.89      20.5  T
   7    -23.7848712 -0.378833E-08  0.672E-04    2.89      38.4  T
   8    -23.7848712 -0.681414E-09  0.361E-04    2.89      71.5  T
     SCC iter.                  ...        0 min,  0.005 sec
     gradient                   ...        0 min,  0.006 sec
 * total energy  :   -23.3216009 Eh     change       -0.9076030E-04 Eh
   gradient norm :     0.0044937 Eh/α   predicted    -0.6212776E-04 ( -31.55%)
   displ. norm   :     0.3132096 α      lambda       -0.1259159E-03
   maximum displ.:     0.2151317 α      in ANC's #2, #1, #3, ...

........................................................................
.............................. CYCLE   10 ..............................
........................................................................
   1    -23.7843211 -0.237843E+02  0.328E-01    2.86       0.0  T
   2    -23.7843319 -0.107539E-04  0.179E-01    2.86       1.0  T
   3    -23.7843321 -0.220264E-06  0.292E-02    2.86       1.0  T
   4    -23.7843269  0.513913E-05  0.242E-02    2.86       1.1  T
   5    -23.7843344 -0.745418E-05  0.429E-03    2.86       6.0  T
   6    -23.7843346 -0.251787E-06  0.165E-03    2.86      15.7  T
   7    -23.7843347 -0.188367E-07  0.842E-04    2.86      30.7  T
     SCC iter.                  ...        0 min,  0.004 sec
     gradient                   ...        0 min,  0.006 sec
 * total energy  :   -23.3216879 Eh     change       -0.8698385E-04 Eh
   gradient norm :     0.0053068 Eh/α   predicted    -0.6913598E-04 ( -20.52%)
   displ. norm   :     0.2163066 α      lambda       -0.1339971E-03
   maximum displ.:     0.1565161 α      in ANC's #2, #1, #3, ...

........................................................................
.............................. CYCLE   11 ..............................
........................................................................
   1    -23.7861274 -0.237861E+02  0.233E-01    2.84       0.0  T
   2    -23.7861335 -0.603626E-05  0.127E-01    2.84       1.0  T
   3    -23.7861323  0.120955E-05  0.233E-02    2.84       1.1  T
   4    -23.7861328 -0.562673E-06  0.156E-02    2.84       1.7  T
   5    -23.7861349 -0.202413E-05  0.402E-03    2.84       6.4  T
   6    -23.7861350 -0.184120E-06  0.174E-03    2.84      14.8  T
   7    -23.7861351 -0.397542E-07  0.595E-04    2.84      43.4  T
     SCC iter.                  ...        0 min,  0.004 sec
     gradient                   ...        0 min,  0.006 sec
 * total energy  :   -23.3217825 Eh     change       -0.9462624E-04 Eh
   gradient norm :     0.0038619 Eh/α   predicted    -0.7013326E-04 ( -25.88%)
   displ. norm   :     0.3713044 α      lambda       -0.1321178E-03
   maximum displ.:     0.2748989 α      in ANC's #2, #1, #3, ...

........................................................................
.............................. CYCLE   12 ..............................
........................................................................
   1    -23.7831511 -0.237832E+02  0.404E-01    2.81       0.0  T
   2    -23.7831698 -0.187782E-04  0.216E-01    2.81       1.0  T
   3    -23.7831694  0.402109E-06  0.379E-02    2.81       1.0  T
   4    -23.7831579  0.115300E-04  0.340E-02    2.81       1.0  T
   5    -23.7831744 -0.165195E-04  0.515E-03    2.81       5.0  T
   6    -23.7831748 -0.370001E-06  0.128E-03    2.81      20.1  T
   7    -23.7831748 -0.280893E-08  0.722E-04    2.81      35.8  T
   8    -23.7831748 -0.104428E-09  0.365E-04    2.81      70.8  T
     SCC iter.                  ...        0 min,  0.005 sec
     gradient                   ...        0 min,  0.006 sec
 * total energy  :   -23.3218369 Eh     change       -0.5442581E-04 Eh
   gradient norm :     0.0073100 Eh/α   predicted    -0.7516194E-04 (  38.10%)
   displ. norm   :     0.1021651 α      lambda       -0.1824316E-03
   maximum displ.:     0.0712378 α      in ANC's #2, #4, #1, ...

........................................................................
.............................. CYCLE   13 ..............................
........................................................................
   1    -23.7863095 -0.237863E+02  0.116E-01    2.82       0.0  T
   2    -23.7863114 -0.186156E-05  0.616E-02    2.82       1.0  T
   3    -23.7863101  0.126588E-05  0.158E-02    2.82       1.6  T
   4    -23.7863116 -0.145159E-05  0.912E-03    2.82       2.8  T
   5    -23.7863119 -0.346249E-06  0.290E-03    2.82       8.9  T
   6    -23.7863120 -0.768330E-07  0.140E-03    2.82      18.4  T
     SCC iter.                  ...        0 min,  0.004 sec
     gradient                   ...        0 min,  0.006 sec
 * total energy  :   -23.3219209 Eh     change       -0.8399515E-04 Eh
   gradient norm :     0.0039481 Eh/α   predicted    -0.9216874E-04 (   9.73%)
   displ. norm   :     0.2834207 α      lambda       -0.1094739E-03
   maximum displ.:     0.2268662 α      in ANC's #2, #1, #23, ...

........................................................................
.............................. CYCLE   14 ..............................
........................................................................
   1    -23.7837015 -0.237837E+02  0.282E-01    2.79       0.0  T
   2    -23.7837065 -0.499032E-05  0.158E-01    2.79       1.0  T
   3    -23.7836989  0.768365E-05  0.313E-02    2.79       1.0  T
   4    -23.7837037 -0.484866E-05  0.203E-02    2.79       1.3  T
   5    -23.7837082 -0.450148E-05  0.347E-03    2.79       7.4  T
   6    -23.7837083 -0.137756E-06  0.137E-03    2.79      18.9  T
   7    -23.7837084 -0.227523E-07  0.454E-04    2.79      56.8  T
   8    -23.7837084 -0.500684E-09  0.237E-04    2.79     108.9  T
     SCC iter.                  ...        0 min,  0.005 sec
     gradient                   ...        0 min,  0.006 sec
 * total energy  :   -23.3219792 Eh     change       -0.5820909E-04 Eh
   gradient norm :     0.0079903 Eh/α   predicted    -0.5913353E-04 (   1.59%)
   displ. norm   :     0.2142064 α      lambda       -0.1206840E-03
   maximum displ.:     0.1868640 α      in ANC's #2, #1, #23, ...

........................................................................
.............................. CYCLE   15 ..............................
........................................................................
   1    -23.7836336 -0.237836E+02  0.182E-01    2.79       0.0  T
   2    -23.7836357 -0.218555E-05  0.103E-01    2.79       1.0  T
   3    -23.7836353  0.404349E-06  0.139E-02    2.79       1.9  T
   4    -23.7836349  0.429782E-06  0.113E-02    2.79       2.3  T
   5    -23.7836363 -0.136322E-05  0.244E-03    2.79      10.6  T
   6    -23.7836363 -0.526754E-07  0.121E-03    2.79      21.4  T
     SCC iter.                  ...        0 min,  0.004 sec
     gradient                   ...        0 min,  0.006 sec
 * total energy  :   -23.3220161 Eh     change       -0.3693685E-04 Eh
   gradient norm :     0.0082535 Eh/α   predicted    -0.6311217E-04 (  70.87%)
   displ. norm   :     0.0640653 α      lambda       -0.1235266E-03
   maximum displ.:     0.0411792 α      in ANC's #3, #1, #2, ...

........................................................................
.............................. CYCLE   16 ..............................
........................................................................
   1    -23.7862792 -0.237863E+02  0.553E-02    2.80       0.0  T
   2    -23.7862804 -0.123957E-05  0.298E-02    2.80       1.0  T
   3    -23.7862782  0.219348E-05  0.155E-02    2.80       1.7  T
   4    -23.7862804 -0.219823E-05  0.752E-03    2.80       3.4  T
   5    -23.7862809 -0.488456E-06  0.307E-03    2.80       8.4  T
   6    -23.7862809 -0.338427E-07  0.143E-03    2.80      18.1  T
   7    -23.7862810 -0.233891E-07  0.562E-04    2.80      45.9  T
     SCC iter.                  ...        0 min,  0.004 sec
     gradient                   ...        0 min,  0.006 sec
 * total energy  :   -23.3220938 Eh     change       -0.7770346E-04 Eh
   gradient norm :     0.0032654 Eh/α   predicted    -0.6201584E-04 ( -20.19%)
   displ. norm   :     0.3514375 α      lambda       -0.1117648E-03
   maximum displ.:     0.3052978 α      in ANC's #2, #1, #23, ...

........................................................................
.............................. CYCLE   17 ..............................
........................................................................
   1    -23.7829476 -0.237829E+02  0.389E-01    2.76       0.0  T
   2    -23.7829661 -0.185236E-04  0.209E-01    2.77       1.0  T
   3    -23.7829617  0.443479E-05  0.422E-02    2.77       1.0  T
   4    -23.7829672 -0.550028E-05  0.260E-02    2.77       1.0  T
   5    -23.7829710 -0.383554E-05  0.658E-03    2.77       3.9  T
   6    -23.7829714 -0.403226E-06  0.273E-03    2.77       9.5  T
   7    -23.7829715 -0.746640E-07  0.135E-03    2.77      19.1  T
   8    -23.7829715 -0.137526E-08  0.875E-04    2.77      29.5  T
   9    -23.7829715 -0.668907E-08  0.194E-04    2.77     133.2  T
     SCC iter.                  ...        0 min,  0.005 sec
     gradient                   ...        0 min,  0.006 sec
 * total energy  :   -23.3220925 Eh     change        0.1326034E-05 Eh
   gradient norm :     0.0087750 Eh/α   predicted    -0.6278232E-04 (*******%)
   displ. norm   :     0.0946115 α      lambda       -0.1529876E-03
   maximum displ.:     0.0558460 α      in ANC's #1, #2, #3, ...

........................................................................
.............................. CYCLE   18 ..............................
........................................................................
   1    -23.7866905 -0.237867E+02  0.130E-01    2.79       0.0  T
   2    -23.7866935 -0.304424E-05  0.667E-02    2.79       1.0  T
   3    -23.7866918  0.168312E-05  0.177E-02    2.79       1.5  T
   4    -23.7866944 -0.253011E-05  0.888E-03    2.79       2.9  T
   5    -23.7866944 -0.764484E-07  0.330E-03    2.79       7.8  T
   6    -23.7866946 -0.177556E-06  0.819E-04    2.79      31.5  T
   7    -23.7866946 -0.332218E-08  0.534E-04    2.79      48.3  T
     SCC iter.                  ...        0 min,  0.004 sec
     gradient                   ...        0 min,  0.006 sec
 * total energy  :   -23.3221617 Eh     change       -0.6923700E-04 Eh
   gradient norm :     0.0021661 Eh/α   predicted    -0.7717825E-04 (  11.47%)
   displ. norm   :     0.1151526 α      lambda       -0.2749478E-04
   maximum displ.:     0.0971332 α      in ANC's #2, #1, #3, ...

........................................................................
.............................. CYCLE   19 ..............................
........................................................................
   1    -23.7861282 -0.237861E+02  0.109E-01    2.79       0.0  T
   2    -23.7861292 -0.103250E-05  0.599E-02    2.79       1.0  T
   3    -23.7861289  0.337292E-06  0.114E-02    2.79       2.3  T
   4    -23.7861289 -0.346123E-07  0.804E-03    2.79       3.2  T
   5    -23.7861295 -0.565263E-06  0.185E-03    2.79      13.9  T
   6    -23.7861295 -0.453847E-07  0.765E-04    2.79      33.8  T
   7    -23.7861295 -0.597800E-08  0.349E-04    2.79      74.0  T
     SCC iter.                  ...        0 min,  0.004 sec
     gradient                   ...        0 min,  0.006 sec
 * total energy  :   -23.3221797 Eh     change       -0.1799316E-04 Eh
   gradient norm :     0.0016906 Eh/α   predicted    -0.1392853E-04 ( -22.59%)
   displ. norm   :     0.2641522 α      lambda       -0.2142814E-04
   maximum displ.:     0.2236551 α      in ANC's #2, #1, #3, ...

........................................................................
.............................. CYCLE   20 ..............................
........................................................................
   1    -23.7843467 -0.237843E+02  0.259E-01    2.78       0.0  T
   2    -23.7843532 -0.656789E-05  0.140E-01    2.78       1.0  T
   3    -23.7843540 -0.714864E-06  0.233E-02    2.78       1.1  T
   4    -23.7843513  0.267305E-05  0.167E-02    2.78       1.5  T
   5    -23.7843549 -0.363876E-05  0.273E-03    2.78       9.4  T
   6    -23.7843550 -0.757686E-07  0.153E-03    2.78      16.9  T
   7    -23.7843550 -0.105198E-07  0.760E-04    2.78      34.0  T
   8    -23.7843550 -0.738368E-09  0.179E-04    2.78     144.6  T
     SCC iter.                  ...        0 min,  0.005 sec
     gradient                   ...        0 min,  0.006 sec
 * total energy  :   -23.3221798 Eh     change       -0.1409093E-06 Eh
   gradient norm :     0.0037861 Eh/α   predicted    -0.1104877E-04 (7741.05%)
   displ. norm   :     0.0596632 α      lambda       -0.2482603E-04
   maximum displ.:     0.0518293 α      in ANC's #2, #1, #3, ...
 * RMSD in coord.:     0.7115744 α      energy gain  -0.3915592E-02 Eh

generating ANC from model Hessian ...
Using Lindh-Hessian (1995)
 Shifting diagonal of input Hessian by   4.551313411070149E-003
 Lowest  eigenvalues of input Hessian
   -0.000000   -0.000000    0.000000    0.000000    0.000000    0.000000
    0.005000    0.005102    0.005414    0.010164    0.020228    0.023386
    0.025575    0.027228    0.037016    0.041066    0.051315    0.070860
 Highest eigenvalues
    1.582994    1.679288    1.859624    1.899627    1.954495    2.677752
 

........................................................................
.............................. CYCLE   21 ..............................
........................................................................
   1    -23.7856821 -0.237857E+02  0.536E-02    2.78       0.0  T
   2    -23.7856823 -0.218385E-06  0.299E-02    2.78       1.0  T
   3    -23.7856821  0.139736E-06  0.531E-03    2.78       4.9  T
   4    -23.7856822 -0.683398E-07  0.361E-03    2.78       7.2  T
   5    -23.7856823 -0.124327E-06  0.125E-03    2.78      20.6  T
   6    -23.7856824 -0.220169E-07  0.301E-04    2.78      85.8  T
   7    -23.7856824 -0.279346E-09  0.201E-04    2.78     128.6  T
     SCC iter.                  ...        0 min,  0.004 sec
     gradient                   ...        0 min,  0.006 sec
 * total energy  :   -23.3221947 Eh     change       -0.1483020E-04 Eh
   gradient norm :     0.0015736 Eh/α   predicted     0.0000000E+00 (-100.00%)
   displ. norm   :     0.0508647 α      lambda       -0.1204627E-04
   maximum displ.:     0.0480342 α      in ANC's #3, #1, #9, ...

........................................................................
.............................. CYCLE   22 ..............................
........................................................................
   1    -23.7866555 -0.237867E+02  0.687E-02    2.78       0.0  T
   2    -23.7866557 -0.165776E-06  0.406E-02    2.78       1.0  T
   3    -23.7866552  0.488593E-06  0.715E-03    2.78       3.6  T
   4    -23.7866556 -0.426948E-06  0.393E-03    2.78       6.6  T
   5    -23.7866558 -0.129733E-06  0.139E-03    2.78      18.6  T
   6    -23.7866558 -0.257469E-07  0.304E-04    2.78      85.1  T
   7    -23.7866558 -0.798082E-10  0.149E-04    2.78     173.4  T
     SCC iter.                  ...        0 min,  0.004 sec
     gradient                   ...        0 min,  0.006 sec
 * total energy  :   -23.3221843 Eh     change        0.1037392E-04 Eh
   gradient norm :     0.0018223 Eh/α   predicted    -0.6029895E-05 (-158.13%)
   displ. norm   :     0.0445451 α      lambda       -0.2779048E-04
   maximum displ.:     0.0363199 α      in ANC's #2, #4, #5, ...

........................................................................
.............................. CYCLE   23 ..............................
........................................................................
   1    -23.7876363 -0.237876E+02  0.767E-02    2.79       0.0  T
   2    -23.7876365 -0.264551E-06  0.450E-02    2.79       1.0  T
   3    -23.7876361  0.398461E-06  0.730E-03    2.79       3.5  T
   4    -23.7876364 -0.245412E-06  0.489E-03    2.79       5.3  T
   5    -23.7876366 -0.240976E-06  0.139E-03    2.79      18.6  T
   6    -23.7876366 -0.271498E-07  0.379E-04    2.79      68.1  T
   7    -23.7876366 -0.708987E-09  0.196E-04    2.79     132.0  T
     SCC iter.                  ...        0 min,  0.004 sec
     gradient                   ...        0 min,  0.006 sec
 * total energy  :   -23.3221974 Eh     change       -0.1313938E-04 Eh
   gradient norm :     0.0018819 Eh/α   predicted    -0.1390637E-04 (   5.84%)
   displ. norm   :     0.0318232 α      lambda       -0.1728060E-04
   maximum displ.:     0.0198776 α      in ANC's #5, #1, #9, ...

........................................................................
.............................. CYCLE   24 ..............................
........................................................................
   1    -23.7863619 -0.237864E+02  0.417E-02    2.78       0.0  T
   2    -23.7863619 -0.312322E-07  0.248E-02    2.78       1.0  T
   3    -23.7863617  0.229799E-06  0.414E-03    2.78       6.2  T
   4    -23.7863620 -0.239351E-06  0.138E-03    2.78      18.7  T
   5    -23.7863620 -0.118335E-07  0.643E-04    2.78      40.1  T
   6    -23.7863620 -0.399832E-08  0.169E-04    2.78     153.0  T
     SCC iter.                  ...        0 min,  0.004 sec
     gradient                   ...        0 min,  0.006 sec
 * total energy  :   -23.3221908 Eh     change        0.6602498E-05 Eh
   gradient norm :     0.0017953 Eh/α   predicted    -0.8642585E-05 (-230.90%)
   displ. norm   :     0.0266455 α      lambda       -0.2175450E-04
   maximum displ.:     0.0150788 α      in ANC's #9, #2, #3, ...

........................................................................
.............................. CYCLE   25 ..............................
........................................................................
   1    -23.7860078 -0.237860E+02  0.330E-02    2.78       0.0  T
   2    -23.7860078 -0.179608E-07  0.196E-02    2.78       1.3  T
   3    -23.7860078  0.662772E-08  0.150E-03    2.78      17.2  T
   4    -23.7860078  0.787700E-08  0.126E-03    2.78      20.6  T
   5    -23.7860078 -0.207659E-07  0.298E-04    2.78      86.7  T
   6    -23.7860078 -0.989193E-09  0.112E-04    2.78     229.5  T
     SCC iter.                  ...        0 min,  0.004 sec
     gradient                   ...        0 min,  0.006 sec
 * total energy  :   -23.3222046 Eh     change       -0.1381290E-04 Eh
   gradient norm :     0.0010066 Eh/α   predicted    -0.1088202E-04 ( -21.22%)
   displ. norm   :     0.0320195 α      lambda       -0.5840100E-05
   maximum displ.:     0.0250192 α      in ANC's #3, #2, #1, ...

........................................................................
.............................. CYCLE   26 ..............................
........................................................................
   1    -23.7869769 -0.237870E+02  0.352E-02    2.78       0.0  T
   2    -23.7869771 -0.142237E-06  0.188E-02    2.78       1.4  T
   3    -23.7869771  0.151445E-07  0.372E-03    2.78       6.9  T
   4    -23.7869770  0.585515E-07  0.295E-03    2.78       8.7  T
   5    -23.7869771 -0.105290E-06  0.792E-04    2.78      32.6  T
   6    -23.7869771 -0.921468E-08  0.187E-04    2.78     137.9  T
     SCC iter.                  ...        0 min,  0.004 sec
     gradient                   ...        0 min,  0.006 sec
 * total energy  :   -23.3222061 Eh     change       -0.1418324E-05 Eh
   gradient norm :     0.0008784 Eh/α   predicted    -0.2921945E-05 ( 106.01%)
   displ. norm   :     0.0185534 α      lambda       -0.3366438E-05
   maximum displ.:     0.0121767 α      in ANC's #1, #4, #2, ...

   *** GEOMETRY OPTIMIZATION CONVERGED AFTER 26 ITERATIONS ***

------------------------------------------------------------------------
 total energy gain   :        -0.0039418 Eh       -2.4735 kcal/mol
 total RMSD          :         0.7339862 a0        0.3884 Å
 total power (kW/mol):        -0.3980476 (step)  -25.1583 (real)
------------------------------------------------------------------------

 ANCopt (total)                0 d,  0 h,  0 min,  0.411 sec
 optimizer setup                ...        0 min,  0.000 sec (  0.028%)
 model hessian                  ...        0 min,  0.001 sec (  0.347%)
 ANC generation                 ...        0 min,  0.001 sec (  0.183%)
 coordinate transformation      ...        0 min,  0.000 sec (  0.081%)
 single point calculation       ...        0 min,  0.401 sec ( 97.478%)
 optimization log               ...        0 min,  0.002 sec (  0.434%)
 hessian update                 ...        0 min,  0.000 sec (  0.065%)
 rational function              ...        0 min,  0.004 sec (  1.006%)

================
 final structure:
================
$coord
   -2.30125089828247   -0.15190400276378   -0.32082542820635      C 
   -0.84213981549393    2.70241357755901   -0.82691275903334      S 
    2.10431162958629    1.36502979936266   -0.18166655453776      C 
    1.87732318059407   -1.15436521871860    0.38078341820670      C 
   -0.63850290848006   -2.00939147416896    0.29926155681080      C 
    4.29492751794509    2.81604741068895   -0.27481044341692      C 
    6.16802953616932    4.12604704143823   -0.37691250873257      C 
    8.38006554082188    5.58386349717926   -0.48632400603799      C 
    8.41380743579162    7.99518246220580   -1.19945397897996      C 
   -4.31376613294569   -0.27995505630697   -0.51391865672596      H 
    3.47233895253180   -2.32902566434967    0.83373771279827      H 
   -1.18970843349699   -3.92693504505784    0.68567700058511      H 
   10.10133981856881    4.61632823721659    0.05535214835031      H 
    6.71125203240902    8.96445149575553   -1.74878736053609      H 
   10.14532703687641    9.05987727874921   -1.26500046378463      H 
$end
           -------------------------------------------------
          |                Final Singlepoint                |
           -------------------------------------------------

          ...................................................
          :                      SETUP                      :
          :.................................................:
          :  # basis functions                  48          :
          :  # atomic orbitals                  47          :
          :  # shells                           25          :
          :  # electrons                        44          :
          :  max. iterations                   250          :
          :  Hamiltonian                  GFN2-xTB          :
          :  restarted?                      false          :
          :  GBSA solvation                  false          :
          :  PC potential                    false          :
          :  electronic temp.          300.0000000     K    :
          :  accuracy                    1.0000000          :
          :  -> integral cutoff          0.2500000E+02      :
          :  -> integral neglect         0.1000000E-07      :
          :  -> SCF convergence          0.1000000E-05 Eh   :
          :  -> wf. convergence          0.1000000E-03 e    :
          :  Broyden damping             0.4000000          :
          ...................................................

 iter      E             dE          RMSdq      gap      omega  full diag
   1    -23.7869771 -0.237870E+02  0.760E-05    2.78       0.0  T
   2    -23.7869771 -0.131806E-10  0.611E-05    2.78     422.4  T
   3    -23.7869771 -0.382485E-10  0.242E-05    2.78    1065.7  T

   *** convergence criteria satisfied after 3 iterations ***

         #    Occupation            Energy/Eh            Energy/eV
      -------------------------------------------------------------
         1        2.0000           -0.7289311             -19.8352
       ...           ...                  ...                  ...
        16        2.0000           -0.4588308             -12.4854
        17        2.0000           -0.4520013             -12.2996
        18        2.0000           -0.4432765             -12.0622
        19        2.0000           -0.4183479             -11.3838
        20        2.0000           -0.4048176             -11.0156
        21        2.0000           -0.3972176             -10.8088
        22        2.0000           -0.3709064             -10.0929 (HOMO)
        23                         -0.2685784              -7.3084 (LUMO)
        24                         -0.2159725              -5.8769
        25                         -0.2060429              -5.6067
        26                         -0.1693500              -4.6082
        27                         -0.1661387              -4.5209
       ...                                ...                  ...
        47                          1.4354992              39.0619
      -------------------------------------------------------------
                  HL-Gap            0.1023280 Eh            2.7845 eV
             Fermi-level           -0.3197424 Eh           -8.7006 eV

 SCC (total)                   0 d,  0 h,  0 min,  0.014 sec
 SCC setup                      ...        0 min,  0.000 sec (  1.014%)
 Dispersion                     ...        0 min,  0.000 sec (  0.711%)
 integral evaluation            ...        0 min,  0.004 sec ( 31.899%)
 zeroth order Hamiltonian       ...        0 min,  0.000 sec (  0.566%)
 iterations                     ...        0 min,  0.002 sec ( 17.531%)
 molecular gradient             ...        0 min,  0.006 sec ( 46.040%)
 printout                       ...        0 min,  0.000 sec (  1.901%)

         :::::::::::::::::::::::::::::::::::::::::::::::::::::
         ::                     SUMMARY                     ::
         :::::::::::::::::::::::::::::::::::::::::::::::::::::
         :: total energy             -23.322206061811 Eh    ::
         :: gradient norm              0.000878428220 Eh/a0 ::
         :: HOMO-LUMO gap              2.784486854183 eV    ::
         ::.................................................::
         :: SCC energy               -23.786977110491 Eh    ::
         :: -> isotropic ES            0.001730548000 Eh    ::
         :: -> anisotropic ES          0.002045582414 Eh    ::
         :: -> anisotropic XC          0.018249494647 Eh    ::
         :: -> dispersion             -0.012226265844 Eh    ::
         :: repulsion energy           0.464838630704 Eh    ::
         :: add. restraining           0.000000000000 Eh    ::
         :::::::::::::::::::::::::::::::::::::::::::::::::::::

           -------------------------------------------------
          |                Property Printout                |
           -------------------------------------------------

    * Orbital Energies and Occupations

         #    Occupation            Energy/Eh            Energy/eV
      -------------------------------------------------------------
         1        2.0000           -0.7289311             -19.8352
       ...           ...                  ...                  ...
        10        2.0000           -0.5193024             -14.1309
        11        2.0000           -0.4915083             -13.3746
        12        2.0000           -0.4896859             -13.3250
        13        2.0000           -0.4794319             -13.0460
        14        2.0000           -0.4730206             -12.8715
        15        2.0000           -0.4666045             -12.6970
        16        2.0000           -0.4588308             -12.4854
        17        2.0000           -0.4520013             -12.2996
        18        2.0000           -0.4432765             -12.0622
        19        2.0000           -0.4183479             -11.3838
        20        2.0000           -0.4048176             -11.0156
        21        2.0000           -0.3972176             -10.8088
        22        2.0000           -0.3709064             -10.0929 (HOMO)
        23                         -0.2685784              -7.3084 (LUMO)
        24                         -0.2159725              -5.8769
        25                         -0.2060429              -5.6067
        26                         -0.1693500              -4.6082
        27                         -0.1661387              -4.5209
        28                         -0.0999324              -2.7193
        29                         -0.0760411              -2.0692
        30                          0.0006219               0.0169
        31                          0.0357282               0.9722
        32                          0.0412533               1.1226
        33                          0.0847153               2.3052
       ...                                ...                  ...
        47                          1.4354992              39.0619
      -------------------------------------------------------------
                  HL-Gap            0.1023280 Eh            2.7845 eV
             Fermi-level           -0.3197424 Eh           -8.7006 eV

     #   Z        covCN         q      C6AA      α(0)
     1   6 C      2.940    -0.020    28.503     8.756
     2  16 S      2.327    -0.024   142.061    20.060
     3   6 C      2.988     0.048    26.915     8.510
     4   6 C      3.104    -0.046    29.005     8.825
     5   6 C      3.106    -0.043    28.910     8.810
     6   6 C      2.012    -0.044    32.195     9.164
     7   6 C      1.977    -0.030    31.854     9.114
     8   6 C      2.887    -0.003    28.104     8.691
     9   6 C      2.848    -0.080    29.994     8.976
    10   1 H      0.926     0.041     2.438     2.442
    11   1 H      0.926     0.038     2.481     2.463
    12   1 H      0.926     0.035     2.516     2.481
    13   1 H      0.925     0.046     2.366     2.405
    14   1 H      0.926     0.043     2.403     2.424
    15   1 H      0.926     0.038     2.469     2.457

 Mol. C6AA /au·bohr⁶  :       4180.832477
 Mol. C8AA /au·bohr⁸  :     121948.295550
 Mol. α(0) /au        :        105.578653


Wiberg/Mayer (AO) data.
largest (>0.10) Wiberg bond orders for each atom
          total WBO             WBO to atom ...
     1  C   3.935        C    5 1.602    S    2 1.203    H   10 0.971    C    3 0.101
     2  S   2.607        C    1 1.203    C    3 1.114
     3  C   3.953        C    4 1.502    C    6 1.183    S    2 1.114    C    1 0.101
     4  C   3.961        C    3 1.502    C    5 1.301    H   11 0.965
     5  C   3.987        C    1 1.602    C    4 1.301    H   12 0.965
     6  C   3.980        C    7 2.606    C    3 1.183    C    9 0.122
     7  C   3.978        C    6 2.606    C    8 1.160
     8  C   3.992        C    9 1.854    C    7 1.160    H   13 0.947
     9  C   3.937        C    8 1.854    H   15 0.978    H   14 0.978    C    6 0.122
    10  H   0.997        C    1 0.971
    11  H   0.999        C    4 0.965
    12  H   0.998        C    5 0.965
    13  H   0.996        C    8 0.947
    14  H   0.998        C    9 0.978
    15  H   0.998        C    9 0.978

molecular dipole:
                 x           y           z       tot (Debye)
 q only:        0.099      -0.046       0.021
   full:        0.112      -0.286       0.077       0.804
molecular quadrupole (traceless):
                xx          xy          yy          xz          yz          zz
 q only:        2.942       2.450      -0.049       0.089      -0.492      -2.894
  q+dip:        7.002       4.853       0.190       0.570      -1.488      -7.192
   full:        5.242       3.582      -0.799       0.288      -0.591      -4.443

           -------------------------------------------------
          |                Geometry Summary                 |
           -------------------------------------------------

      molecular mass/u    :      134.1954000
   center of mass at/Å    :        1.3329278       1.2852182      -0.2146054
  moments of inertia/u·Å² :        0.1085927E+03   0.7884351E+03   0.8969007E+03
rotational constants/cm⁻¹ :        0.1552373E+00   0.2138113E-01   0.1879543E-01

 * 13 selected distances

     #   Z        #   Z                                     value/Å
     1   6 C      2  16 S                                 1.7173623
     2  16 S      3   6 C                                 1.7460054 (max)
     3   6 C      4   6 C                                 1.3712968
     1   6 C      5   6 C                                 1.3594293
     4   6 C      5   6 C                                 1.4067654
     6   6 C      7   6 C                                 1.2107681
     8   6 C      9   6 C                                 1.3307679
     1   6 C     10   1 H                                 1.0720117 (min)
     4   6 C     11   1 H                                 1.0752942
     5   6 C     12   1 H                                 1.0754306
     8   6 C     13   1 H                                 1.0834990
     9   6 C     14   1 H                                 1.0767092
     9   6 C     15   1 H                                 1.0762003

 * 3 distinct bonds (by element types)

   Z      Z             #   av. dist./Å        max./Å        min./Å
   1 H    6 C           6     1.0765242     1.0834990     1.0720117
   6 C    6 C           5     1.3358055     1.4067654     1.2107681
   6 C   16 S           2     1.7316839     1.7460054     1.7173623


optimized geometry written to: xtbopt.xyz


           -------------------------------------------------
          | TOTAL ENERGY              -23.322206061811 Eh   |
          | GRADIENT NORM               0.000878428220 Eh/α |
          | HOMO-LUMO GAP               2.784486854183 eV   |
           -------------------------------------------------

------------------------------------------------------------------------
 * finished run on 2021/05/19 at 11:00:22.126     
------------------------------------------------------------------------
 total:
 * wall-time:     0 d,  0 h,  0 min,  0.489 sec
 *  cpu-time:     0 d,  0 h,  0 min,  0.463 sec
 * ratio c/w:     0.947 speedup
 SCF:
 * wall-time:     0 d,  0 h,  0 min,  0.034 sec
 *  cpu-time:     0 d,  0 h,  0 min,  0.021 sec
 * ratio c/w:     0.622 speedup
 ANC optimizer:
 * wall-time:     0 d,  0 h,  0 min,  0.426 sec
 *  cpu-time:     0 d,  0 h,  0 min,  0.426 sec
 * ratio c/w:     1.000 speedup

