      -----------------------------------------------------------      
     |                   =====================                   |     
     |                           x T B                           |     
     |                   =====================                   |     
     |                         S. Grimme                         |     
     |          Mulliken Center for Theoretical Chemistry        |     
     |                    University of Bonn                     |     
     |                Version 6.2 RC2 (SAW190805)                |     
      -----------------------------------------------------------      

   This program is distributed in the hope that it will be useful,
   but WITHOUT ANY WARRANTY; without even the implied warranty of
   MERCHANTABILITY or FITNESS FOR A PARTICULAR PURPOSE.
   
   FOR NON-COMMERCIAL, ACADEMIA USE ONLY.
   
   Cite this work as:
   * S. Grimme, C. Bannwarth, P. Shushkov, J. Chem. Theory Comput., 2017,
     13, 1989-2009. DOI: 10.1021/acs.jctc.7b00118
   * C. Bannwarth, S. Ehlert and S. Grimme., J. Chem. Theory Comput., 2019,
     15, 1652-1671. DOI: 10.1021/acs.jctc.8b01176
   * P. Pracht, E. Caldeweyher, S. Ehlert, S. Grimme, ChemRxiv, 2019, preprint.
     DOI: 10.26434/chemrxiv.8326202.v1
   
   for DFT-D4:
   * E. Caldeweyher, C. Bannwarth and S. Grimme, J. Chem. Phys., 2017,
     147, 034112. DOI: 10.1063/1.4993215
   * E. Caldeweyher, S. Ehlert, A. Hansen, H. Neugebauer, S. Spicher,
     C. Bannwarth and S. Grimme, J. Chem. Phys., 2019, 150, 154122.
     DOI: 10.1063/1.5090222
   
   for sTDA-xTB:
   * S. Grimme and C. Bannwarth, J. Chem. Phys., 2016, 145, 054103.
     DOI: 10.1063/1.4959605
   
   in the mass-spec context:
   * V. Asgeirsson, C. Bauer and S. Grimme, Chem. Sci., 2017, 8, 4879.
     DOI: 10.1039/c7sc00601b
   
   for metadynamics refer to:
   * S. Grimme, J. Chem. Theory Comput., 2019, 155, 2847-2862
     DOI: 10.1021/acs.jctc.9b00143
   
   with help from (in alphabetical order)
   C. Bannwarth, F. Bohle, G. Brandenburg, E. Caldeweyher, M. Checinski,
   S. Dohm, S. Ehlert, S. Ehrlich, F. März, H. Neugebauer, J. Pisarek,
   P. Pracht, P. Shushkov, and S. Spicher.
   
 * started run on 2021/05/19 at 11:00:22.196     

           -------------------------------------------------
          |                Calculation Setup                |
           -------------------------------------------------

          program call               : /ihome/ghutchison/geoffh/xtb/xtb 820.xyz -opt
          hostname                   : smp-n83
          coordinate file            : 820.xyz
          omp threads                :                     1
          number of atoms            :                    25
          number of electrons        :                    80
          charge                     :                     0
          spin                       :                   0.0
          first test random number   :      0.24983822099690


########################################################################
# WARNING! Please study the warnings concerning your input carefully
#  - the use of '-opt' is discouraged, please use '--opt' next time
########################################################################

           ------------------------------------------------- 
          |                 G F N 2 - x T B                 |
          | Geometry, Frequencies, Noncovalent interactions |
          |            JCTC 2019 parametrisation            |
           ------------------------------------------------- 
             KAB for C  - Si     :                1.0500
             KAB for H  - Pd     :                0.9500
             k(s)              :                1.8500
             k(p)              :                2.2300
             k(d)              :                2.2300
             k(f)              :                2.0000
             kEN (H0ij)        :               -2.0000
             D4 a1             :                0.5200
             D4 a2             :                5.0000
             D4 s6             :                1.0000
             D4 s8             :                2.7000
             D4 s9             :                5.0000
             alphaj            :                2.0000

  Z AO/shell   Hii/eV     exponent
  1     Wed Apr 25 08:07:45 CEST 2018   EN: 2.200 GM2: 0.406  GM3: 0.0800  RAES: 1.40
     1s    -10.707211    1.230000
  6     Wed Apr 25 08:07:45 CEST 2018   EN: 2.550 GM2: 0.538  GM3: 0.1500  RAES: 3.00
     2s    -13.970922    2.096432
     2p    -10.063292    1.800000
  7     Wed Apr 25 08:07:45 CEST 2018   EN: 3.040 GM2: 0.461  GM3:-0.0640  RAES: 1.90
     2s    -16.686243    2.339881
     2p    -12.523956    2.014332
  8     Wed Apr 25 08:07:45 CEST 2018   EN: 3.440 GM2: 0.452  GM3:-0.0517  RAES: 1.80
     2s    -20.229985    2.439742
     2p    -15.503117    2.137023
 16     Tue Apr 24 11:44:34 CEST 2018   EN: 2.580 GM2: 0.340  GM3:-0.0502  RAES: 3.10
     3s    -20.029654    1.981333
     3p    -11.377694    2.025643
     3d     -0.420282    1.702555

           ------------------------------------------------- 
          |        Self-Consistent Charge Iterations        |
           ------------------------------------------------- 

          ...................................................
          :                      SETUP                      :
          :.................................................:
          :  # basis functions                  79          :
          :  # atomic orbitals                  78          :
          :  # shells                           42          :
          :  # electrons                        80          :
          :  max. iterations                   250          :
          :  Hamiltonian                  GFN2-xTB          :
          :  restarted?                      false          :
          :  GBSA solvation                  false          :
          :  PC potential                    false          :
          :  electronic temp.          300.0000000     K    :
          :  accuracy                    1.0000000          :
          :  -> integral cutoff          0.2500000E+02      :
          :  -> integral neglect         0.1000000E-07      :
          :  -> SCF convergence          0.1000000E-05 Eh   :
          :  -> wf. convergence          0.1000000E-03 e    :
          :  Broyden damping             0.4000000          :
          ...................................................

 iter      E             dE          RMSdq      gap      omega  full diag
   1    -45.1351364 -0.451351E+02  0.475E+00    2.27       0.0  T
   2    -45.2026819 -0.675456E-01  0.267E+00    2.23       1.0  T
   3    -45.2012087  0.147328E-02  0.145E+00    2.21       1.0  T
   4    -45.2077101 -0.650144E-02  0.448E-01    2.23       1.0  T
   5    -45.2127119 -0.500182E-02  0.144E-01    2.21       1.0  T
   6    -45.2129923 -0.280421E-03  0.596E-02    2.21       1.0  T
   7    -45.2130146 -0.222850E-04  0.213E-02    2.21       1.0  T
   8    -45.2130176 -0.297335E-05  0.106E-02    2.21       1.9  T
   9    -45.2130184 -0.810958E-06  0.375E-03    2.21       5.3  T
  10    -45.2130184  0.250683E-07  0.206E-03    2.21       9.7  T
  11    -45.2130185 -0.695405E-07  0.100E-03    2.21      19.9  T
  12    -45.2130185 -0.173511E-07  0.358E-04    2.21      55.9  T
  13    -45.2130185 -0.471978E-09  0.111E-04    2.21     180.2  T

   *** convergence criteria satisfied after 13 iterations ***

         #    Occupation            Energy/Eh            Energy/eV
      -------------------------------------------------------------
         1        2.0000           -0.7561626             -20.5762
       ...           ...                  ...                  ...
        34        2.0000           -0.4558227             -12.4036
        35        2.0000           -0.4518707             -12.2960
        36        2.0000           -0.4299160             -11.6986
        37        2.0000           -0.4183104             -11.3828
        38        2.0000           -0.4132109             -11.2440
        39        2.0000           -0.4067612             -11.0685
        40        2.0000           -0.3905283             -10.6268 (HOMO)
        41                         -0.3091840              -8.4133 (LUMO)
        42                         -0.2993564              -8.1459
        43                         -0.2333145              -6.3488
        44                         -0.2182062              -5.9377
        45                         -0.1859003              -5.0586
       ...                                ...                  ...
        78                          0.7398078              20.1312
      -------------------------------------------------------------
                  HL-Gap            0.0813443 Eh            2.2135 eV
             Fermi-level           -0.3498562 Eh           -9.5201 eV

 SCC (total)                   0 d,  0 h,  0 min,  0.049 sec
 SCC setup                      ...        0 min,  0.000 sec (  0.670%)
 Dispersion                     ...        0 min,  0.000 sec (  0.847%)
 integral evaluation            ...        0 min,  0.012 sec ( 25.339%)
 zeroth order Hamiltonian       ...        0 min,  0.000 sec (  0.414%)
 iterations                     ...        0 min,  0.019 sec ( 38.038%)
 molecular gradient             ...        0 min,  0.017 sec ( 33.771%)
 printout                       ...        0 min,  0.000 sec (  0.811%)

         :::::::::::::::::::::::::::::::::::::::::::::::::::::
         ::                     SUMMARY                     ::
         :::::::::::::::::::::::::::::::::::::::::::::::::::::
         :: total energy             -44.601058708027 Eh    ::
         :: gradient norm              0.108980075717 Eh/a0 ::
         :: HOMO-LUMO gap              2.213490783286 eV    ::
         ::.................................................::
         :: SCC energy               -45.213018475291 Eh    ::
         :: -> isotropic ES            0.062532778100 Eh    ::
         :: -> anisotropic ES          0.000972844448 Eh    ::
         :: -> anisotropic XC          0.013457509391 Eh    ::
         :: -> dispersion             -0.028222498663 Eh    ::
         :: repulsion energy           0.612009989707 Eh    ::
         :: add. restraining           0.000000000000 Eh    ::
         :::::::::::::::::::::::::::::::::::::::::::::::::::::

      ----------------------------------------------------------- 
     |                   =====================                   |
     |                        A N C O P T                        |
     |                   =====================                   |
     |               Approximate Normal Coordinate               |
     |                Rational Function Optimizer                |
      ----------------------------------------------------------- 

          ...................................................
          :                      SETUP                      :
          :.................................................:
          :   optimization level            normal          :
          :   max. optcycles                   200          :
          :   ANC micro-cycles                  20          :
          :   degrees of freedom                69          :
          :.................................................:
          :   RF solver                   davidson          :
          :   input Hessian                  false          :
          :   write xtbopt.log                true          :
          :   linear?                        false          :
          :   energy convergence         0.5000000E-05 Eh   :
          :   grad. convergence          0.1000000E-02 Eh/α :
          :   maximium RF displ.         2.0000000          :
          :   Hlow (freq-cutoff)         0.5000000E-02      :
          :   Hmax (freq-cutoff)         5.0000000          :
          :   S6 in model hess.         20.0000000          :
          ...................................................

generating ANC from model Hessian ...
Using Lindh-Hessian (1995)
 Shifting diagonal of input Hessian by   3.827437312968621E-003
 Lowest  eigenvalues of input Hessian
   -0.000000   -0.000000   -0.000000   -0.000000   -0.000000    0.000000
    0.005000    0.006141    0.009480    0.009836    0.010908    0.015865
    0.018102    0.019406    0.022450    0.026356    0.037846    0.039112
 Highest eigenvalues
    1.866717    1.979571    2.062925    2.068556    2.353478    2.480471
 

........................................................................
.............................. CYCLE    1 ..............................
........................................................................
   1    -45.2130185 -0.452130E+02  0.368E-05    2.21       0.0  T
   2    -45.2130185 -0.417089E-11  0.224E-05    2.21     891.1  T
   3    -45.2130185  0.547118E-12  0.151E-05    2.21    1326.2  T
     SCC iter.                  ...        0 min,  0.005 sec
     gradient                   ...        0 min,  0.017 sec
 * total energy  :   -44.6010587 Eh     change        0.4005031E-08 Eh
   gradient norm :     0.1089802 Eh/α   predicted     0.0000000E+00 (-100.00%)
   displ. norm   :     0.3200163 α      lambda       -0.1765263E-01
   maximum displ.:     0.1446956 α      in ANC's #17, #30, #26, ...

........................................................................
.............................. CYCLE    2 ..............................
........................................................................
   1    -45.2364527 -0.452365E+02  0.280E-01    2.31       0.0  T
   2    -45.2366779 -0.225154E-03  0.166E-01    2.31       1.0  T
   3    -45.2366626  0.153200E-04  0.979E-02    2.31       1.0  T
   4    -45.2367302 -0.676222E-04  0.348E-02    2.31       1.0  T
   5    -45.2367582 -0.280109E-04  0.836E-03    2.31       2.4  T
   6    -45.2367590 -0.839694E-06  0.379E-03    2.31       5.3  T
   7    -45.2367591 -0.930393E-07  0.119E-03    2.31      16.8  T
     SCC iter.                  ...        0 min,  0.009 sec
     gradient                   ...        0 min,  0.015 sec
 * total energy  :   -44.6137784 Eh     change       -0.1271968E-01 Eh
   gradient norm :     0.0554803 Eh/α   predicted    -0.9730386E-02 ( -23.50%)
   displ. norm   :     0.2529170 α      lambda       -0.6923341E-02
   maximum displ.:     0.0934541 α      in ANC's #26, #24, #12, ...

........................................................................
.............................. CYCLE    3 ..............................
........................................................................
   1    -45.2476718 -0.452477E+02  0.265E-01    2.42       0.0  T
   2    -45.2478553 -0.183565E-03  0.158E-01    2.42       1.0  T
   3    -45.2478395  0.158464E-04  0.855E-02    2.42       1.0  T
   4    -45.2478899 -0.503959E-04  0.260E-02    2.42       1.0  T
   5    -45.2479043 -0.144440E-04  0.790E-03    2.42       2.5  T
   6    -45.2479048 -0.462973E-06  0.410E-03    2.42       4.9  T
   7    -45.2479050 -0.193193E-06  0.108E-03    2.42      18.5  T
     SCC iter.                  ...        0 min,  0.009 sec
     gradient                   ...        0 min,  0.015 sec
 * total energy  :   -44.6176716 Eh     change       -0.3893215E-02 Eh
   gradient norm :     0.0137842 Eh/α   predicted    -0.3683103E-02 (  -5.40%)
   displ. norm   :     0.0790183 α      lambda       -0.4527627E-03
   maximum displ.:     0.0427243 α      in ANC's #21, #24, #12, ...

........................................................................
.............................. CYCLE    4 ..............................
........................................................................
   1    -45.2454144 -0.452454E+02  0.726E-02    2.42       0.0  T
   2    -45.2454225 -0.809236E-05  0.434E-02    2.43       1.0  T
   3    -45.2454211  0.140403E-05  0.177E-02    2.42       1.1  T
   4    -45.2454234 -0.228755E-05  0.532E-03    2.43       3.8  T
   5    -45.2454239 -0.504277E-06  0.191E-03    2.43      10.4  T
   6    -45.2454239 -0.943906E-09  0.791E-04    2.43      25.3  T
     SCC iter.                  ...        0 min,  0.008 sec
     gradient                   ...        0 min,  0.015 sec
 * total energy  :   -44.6179609 Eh     change       -0.2893074E-03 Eh
   gradient norm :     0.0059696 Eh/α   predicted    -0.2278289E-03 ( -21.25%)
   displ. norm   :     0.0367899 α      lambda       -0.8951746E-04
   maximum displ.:     0.0185983 α      in ANC's #21, #7, #24, ...

........................................................................
.............................. CYCLE    5 ..............................
........................................................................
   1    -45.2447154 -0.452447E+02  0.380E-02    2.42       0.0  T
   2    -45.2447170 -0.162293E-05  0.227E-02    2.42       1.0  T
   3    -45.2447170  0.651868E-07  0.618E-03    2.42       3.2  T
   4    -45.2447171 -0.141738E-06  0.261E-03    2.42       7.7  T
   5    -45.2447172 -0.115633E-06  0.118E-03    2.42      17.0  T
     SCC iter.                  ...        0 min,  0.007 sec
     gradient                   ...        0 min,  0.015 sec
 * total energy  :   -44.6180135 Eh     change       -0.5263208E-04 Eh
   gradient norm :     0.0019201 Eh/α   predicted    -0.4482342E-04 ( -14.84%)
   displ. norm   :     0.0214259 α      lambda       -0.1085916E-04
   maximum displ.:     0.0101872 α      in ANC's #12, #7, #3, ...

........................................................................
.............................. CYCLE    6 ..............................
........................................................................
   1    -45.2450609 -0.452451E+02  0.211E-02    2.42       0.0  T
   2    -45.2450614 -0.496368E-06  0.125E-02    2.42       1.6  T
   3    -45.2450613  0.172934E-06  0.433E-03    2.42       4.6  T
   4    -45.2450615 -0.254594E-06  0.164E-03    2.42      12.2  T
   5    -45.2450616 -0.393243E-07  0.744E-04    2.42      26.9  T
   6    -45.2450616 -0.952944E-09  0.523E-04    2.42      38.2  T
     SCC iter.                  ...        0 min,  0.008 sec
     gradient                   ...        0 min,  0.016 sec
 * total energy  :   -44.6180213 Eh     change       -0.7719665E-05 Eh
   gradient norm :     0.0010638 Eh/α   predicted    -0.5434738E-05 ( -29.60%)
   displ. norm   :     0.0111115 α      lambda       -0.2562274E-05
   maximum displ.:     0.0059937 α      in ANC's #7, #1, #12, ...

........................................................................
.............................. CYCLE    7 ..............................
........................................................................
   1    -45.2452174 -0.452452E+02  0.157E-02    2.42       0.0  T
   2    -45.2452175 -0.114799E-06  0.786E-03    2.42       2.5  T
   3    -45.2452175  0.746999E-08  0.187E-03    2.42      10.7  T
   4    -45.2452175 -0.335415E-07  0.104E-03    2.42      19.2  T
   5    -45.2452175 -0.764533E-08  0.336E-04    2.42      59.5  T
   6    -45.2452175 -0.125402E-08  0.137E-04    2.42     145.8  T
     SCC iter.                  ...        0 min,  0.008 sec
     gradient                   ...        0 min,  0.016 sec
 * total energy  :   -44.6180233 Eh     change       -0.2069192E-05 Eh
   gradient norm :     0.0004409 Eh/α   predicted    -0.1284547E-05 ( -37.92%)
   displ. norm   :     0.0115892 α      lambda        0.1940413E-05
   maximum displ.:     0.0059941 α      in ANC's #7, #1, #12, ...

   *** GEOMETRY OPTIMIZATION CONVERGED AFTER 7 ITERATIONS ***

------------------------------------------------------------------------
 total energy gain   :        -0.0169646 Eh      -10.6455 kcal/mol
 total RMSD          :         0.1278591 a0        0.0677 Å
 total power (kW/mol):        -6.3629423 (step) -171.7413 (real)
------------------------------------------------------------------------

 ANCopt (total)                0 d,  0 h,  0 min,  0.259 sec
 optimizer setup                ...        0 min,  0.000 sec (  0.062%)
 model hessian                  ...        0 min,  0.005 sec (  1.881%)
 ANC generation                 ...        0 min,  0.001 sec (  0.283%)
 coordinate transformation      ...        0 min,  0.000 sec (  0.051%)
 single point calculation       ...        0 min,  0.251 sec ( 96.850%)
 optimization log               ...        0 min,  0.001 sec (  0.297%)
 hessian update                 ...        0 min,  0.000 sec (  0.036%)
 rational function              ...        0 min,  0.001 sec (  0.345%)

================
 final structure:
================
$coord
    4.80257529045020    2.25590152818416   -0.00232499072771      C 
    6.97954746242171   -0.12266895160796   -0.01241485231561      S 
    4.69483561604308   -2.39794795806687   -0.01152617403403      C 
    2.30278237178323   -1.38213558856970   -0.00647937401269      C 
    2.36607966151478    1.35184011619312   -0.00102440647757      C 
    0.08353240549860    2.76305062581256    0.00747207429527      C 
   -2.11501715486383    1.43836485469502    0.00984518200960      C 
   -4.75655936082399    2.34396118010761    0.02665680162204      C 
   -5.55992039693895    4.47703745636843    0.04159391930013      O 
   -6.24303704138983    0.18333529181503    0.04258916254360      N 
   -8.97574189558741    0.24714402660435    0.00569071539243      C 
   -9.98258950484950    0.30206031420896   -2.69328036186364      C 
   -4.85818473578304   -2.04369493561000    0.01705988989039      C 
   -5.75944988379623   -4.13733846895736    0.02255946168279      O 
   -2.17754290540395   -1.26127992990710    0.00415958067926      C 
   -0.04263517781800   -2.68625399647986   -0.00368690472329      C 
    5.41152916304221    4.18705978904897    0.00093008731622      H 
    5.21381485234568   -4.35520443090379   -0.01592391919144      H 
    0.11635083864052    4.80098265972714    0.01431091422270      H 
   -9.56778853701615    1.94119783045595    1.02755571742007      H 
   -9.64466678222059   -1.44129145351305    0.98853714410580      H 
   -9.29117653822169    1.97120864766008   -3.67324511863683      H 
  -12.03476040476496    0.35124302772882   -2.66906791535149      H 
   -9.37172196264380   -1.37530162325356   -3.71202445503828      H 
   -0.10410270555951   -4.72353169131498   -0.00520515109565      H 
$end
           -------------------------------------------------
          |                Final Singlepoint                |
           -------------------------------------------------

          ...................................................
          :                      SETUP                      :
          :.................................................:
          :  # basis functions                  79          :
          :  # atomic orbitals                  78          :
          :  # shells                           42          :
          :  # electrons                        80          :
          :  max. iterations                   250          :
          :  Hamiltonian                  GFN2-xTB          :
          :  restarted?                      false          :
          :  GBSA solvation                  false          :
          :  PC potential                    false          :
          :  electronic temp.          300.0000000     K    :
          :  accuracy                    1.0000000          :
          :  -> integral cutoff          0.2500000E+02      :
          :  -> integral neglect         0.1000000E-07      :
          :  -> SCF convergence          0.1000000E-05 Eh   :
          :  -> wf. convergence          0.1000000E-03 e    :
          :  Broyden damping             0.4000000          :
          ...................................................

 iter      E             dE          RMSdq      gap      omega  full diag
   1    -45.2452175 -0.452452E+02  0.599E-05    2.42       0.0  T
   2    -45.2452175 -0.250822E-11  0.262E-05    2.42     762.6  T
   3    -45.2452175  0.586198E-11  0.306E-05    2.42     653.4  T

   *** convergence criteria satisfied after 3 iterations ***

         #    Occupation            Energy/Eh            Energy/eV
      -------------------------------------------------------------
         1        2.0000           -0.7588801             -20.6502
       ...           ...                  ...                  ...
        34        2.0000           -0.4536712             -12.3450
        35        2.0000           -0.4501450             -12.2491
        36        2.0000           -0.4289407             -11.6721
        37        2.0000           -0.4188982             -11.3988
        38        2.0000           -0.4160361             -11.3209
        39        2.0000           -0.4095227             -11.1437
        40        2.0000           -0.3951576             -10.7528 (HOMO)
        41                         -0.3061034              -8.3295 (LUMO)
        42                         -0.2969046              -8.0792
        43                         -0.2326638              -6.3311
        44                         -0.2203791              -5.9968
        45                         -0.1899488              -5.1688
       ...                                ...                  ...
        78                          0.7586231              20.6432
      -------------------------------------------------------------
                  HL-Gap            0.0890542 Eh            2.4233 eV
             Fermi-level           -0.3506305 Eh           -9.5411 eV

 SCC (total)                   0 d,  0 h,  0 min,  0.034 sec
 SCC setup                      ...        0 min,  0.000 sec (  0.654%)
 Dispersion                     ...        0 min,  0.000 sec (  0.660%)
 integral evaluation            ...        0 min,  0.012 sec ( 35.036%)
 zeroth order Hamiltonian       ...        0 min,  0.000 sec (  0.563%)
 iterations                     ...        0 min,  0.005 sec ( 13.613%)
 molecular gradient             ...        0 min,  0.016 sec ( 48.251%)
 printout                       ...        0 min,  0.000 sec (  1.070%)

         :::::::::::::::::::::::::::::::::::::::::::::::::::::
         ::                     SUMMARY                     ::
         :::::::::::::::::::::::::::::::::::::::::::::::::::::
         :: total energy             -44.618023331147 Eh    ::
         :: gradient norm              0.000441801743 Eh/a0 ::
         :: HOMO-LUMO gap              2.423288502632 eV    ::
         ::.................................................::
         :: SCC energy               -45.245217546691 Eh    ::
         :: -> isotropic ES            0.060127788985 Eh    ::
         :: -> anisotropic ES          0.001702186259 Eh    ::
         :: -> anisotropic XC          0.012643148488 Eh    ::
         :: -> dispersion             -0.028123462644 Eh    ::
         :: repulsion energy           0.627262075665 Eh    ::
         :: add. restraining           0.000000000000 Eh    ::
         :::::::::::::::::::::::::::::::::::::::::::::::::::::

           -------------------------------------------------
          |                Property Printout                |
           -------------------------------------------------

    * Orbital Energies and Occupations

         #    Occupation            Energy/Eh            Energy/eV
      -------------------------------------------------------------
         1        2.0000           -0.7588801             -20.6502
       ...           ...                  ...                  ...
        28        2.0000           -0.4964506             -13.5091
        29        2.0000           -0.4868049             -13.2466
        30        2.0000           -0.4788307             -13.0296
        31        2.0000           -0.4750495             -12.9268
        32        2.0000           -0.4706319             -12.8065
        33        2.0000           -0.4557903             -12.4027
        34        2.0000           -0.4536712             -12.3450
        35        2.0000           -0.4501450             -12.2491
        36        2.0000           -0.4289407             -11.6721
        37        2.0000           -0.4188982             -11.3988
        38        2.0000           -0.4160361             -11.3209
        39        2.0000           -0.4095227             -11.1437
        40        2.0000           -0.3951576             -10.7528 (HOMO)
        41                         -0.3061034              -8.3295 (LUMO)
        42                         -0.2969046              -8.0792
        43                         -0.2326638              -6.3311
        44                         -0.2203791              -5.9968
        45                         -0.1899488              -5.1688
        46                         -0.1673050              -4.5526
        47                         -0.1383671              -3.7652
        48                         -0.0959899              -2.6120
        49                         -0.0234286              -0.6375
        50                         -0.0027292              -0.0743
        51                          0.0061473               0.1673
       ...                                ...                  ...
        78                          0.7586231              20.6432
      -------------------------------------------------------------
                  HL-Gap            0.0890542 Eh            2.4233 eV
             Fermi-level           -0.3506305 Eh           -9.5411 eV

     #   Z        covCN         q      C6AA      α(0)
     1   6 C      2.929    -0.034    28.858     8.810
     2  16 S      2.303     0.057   138.744    19.825
     3   6 C      2.929    -0.034    28.858     8.810
     4   6 C      3.181     0.004    27.490     8.559
     5   6 C      3.181     0.004    27.490     8.558
     6   6 C      2.905    -0.015    28.391     8.737
     7   6 C      3.035    -0.029    28.684     8.785
     8   6 C      2.824     0.274    22.371     7.750
     9   8 O      0.857    -0.385    21.392     6.201
    10   7 N      2.792    -0.107    23.333     7.174
    11   6 C      3.740     0.012    20.453     6.453
    12   6 C      3.752    -0.109    22.639     6.785
    13   6 C      2.824     0.274    22.371     7.750
    14   8 O      0.857    -0.385    21.393     6.201
    15   6 C      3.035    -0.029    28.684     8.785
    16   6 C      2.905    -0.015    28.391     8.737
    17   1 H      0.926     0.058     2.228     2.334
    18   1 H      0.926     0.058     2.228     2.334
    19   1 H      0.926     0.060     2.195     2.317
    20   1 H      0.924     0.065     2.145     2.290
    21   1 H      0.924     0.065     2.141     2.288
    22   1 H      0.925     0.051     2.311     2.377
    23   1 H      0.925     0.051     2.311     2.377
    24   1 H      0.925     0.050     2.316     2.380
    25   1 H      0.926     0.060     2.195     2.317

 Mol. C6AA /au·bohr⁶  :      10082.450067
 Mol. C8AA /au·bohr⁸  :     272639.851464
 Mol. α(0) /au        :        158.933957


Wiberg/Mayer (AO) data.
largest (>0.10) Wiberg bond orders for each atom
          total WBO             WBO to atom ...
     1  C   3.929        C    5 1.475    S    2 1.249    H   17 0.969    C    3 0.134
     2  S   2.746        C    3 1.249    C    1 1.249
     3  C   3.929        C    4 1.475    S    2 1.249    H   18 0.969    C    1 0.134
     4  C   3.988        C    3 1.475    C   16 1.214    C    5 1.146
     5  C   3.988        C    1 1.475    C    6 1.214    C    4 1.146
     6  C   3.988        C    7 1.580    C    5 1.214    H   19 0.964
     7  C   3.988        C    6 1.580    C   15 1.174    C    8 1.003
     8  C   3.942        O    9 1.731    N   10 1.113    C    7 1.003
     9  O   2.048        C    8 1.731    N   10 0.136
    10  N   3.558        C   13 1.113    C    8 1.113    C   11 0.974    O   14 0.136    O    9 0.136
    11  C   3.959        C   12 1.007    N   10 0.974    H   21 0.969    H   20 0.969
    12  C   3.990        C   11 1.007    H   24 0.987    H   22 0.987    H   23 0.984
    13  C   3.942        O   14 1.731    N   10 1.113    C   15 1.003
    14  O   2.048        C   13 1.731    N   10 0.136
    15  C   3.988        C   16 1.580    C    7 1.174    C   13 1.003
    16  C   3.988        C   15 1.580    C    4 1.214    H   25 0.964
    17  H   0.996        C    1 0.969
    18  H   0.996        C    3 0.969
    19  H   0.995        C    6 0.964
    20  H   0.995        C   11 0.969
    21  H   0.995        C   11 0.969
    22  H   0.997        C   12 0.987
    23  H   0.997        C   12 0.984
    24  H   0.997        C   12 0.987
    25  H   0.995        C   16 0.964

molecular dipole:
                 x           y           z       tot (Debye)
 q only:        1.399      -0.031      -0.103
   full:        1.295      -0.029      -0.080       3.298
molecular quadrupole (traceless):
                xx          xy          yy          xz          yz          zz
 q only:        9.195      -0.398     -10.553       1.551      -0.080       1.358
  q+dip:        6.547      -0.271      -7.797       0.820      -0.044       1.250
   full:        4.564      -0.278      -9.987       1.020      -0.067       5.423

           -------------------------------------------------
          |                Geometry Summary                 |
           -------------------------------------------------

      molecular mass/u    :      231.2686000
   center of mass at/Å    :       -0.7058320       0.0380281      -0.0885082
  moments of inertia/u·Å² :        0.3644194E+03   0.1934986E+04   0.2243123E+04
rotational constants/cm⁻¹ :        0.4625888E-01   0.8712017E-02   0.7515252E-02

 * 25 selected distances

     #   Z        #   Z                                     value/Å
     1   6 C      2  16 S                                 1.7062916 (max)
     2  16 S      3   6 C                                 1.7062831
     3   6 C      4   6 C                                 1.3752317
     1   6 C      5   6 C                                 1.3752338
     4   6 C      5   6 C                                 1.4471483
     5   6 C      6   6 C                                 1.4200903
     6   6 C      7   6 C                                 1.3582877
     8   6 C      9   8 O                                 1.2062022
     8   6 C     10   7 N                                 1.3878347
    10   7 N     11   6 C                                 1.4466112
    11   6 C     12   6 C                                 1.5246554
    10   7 N     13   6 C                                 1.3878304
    13   6 C     14   8 O                                 1.2062053
     7   6 C     15   6 C                                 1.4289769
     4   6 C     16   6 C                                 1.4201008
    15   6 C     16   6 C                                 1.3582903
     1   6 C     17   1 H                                 1.0715294 (min)
     3   6 C     18   1 H                                 1.0715299
     6   6 C     19   1 H                                 1.0785732
    11   6 C     20   1 H                                 1.0927921
    11   6 C     21   1 H                                 1.0927558
    12   6 C     22   1 H                                 1.0876413
    12   6 C     23   1 H                                 1.0863496
    12   6 C     24   1 H                                 1.0876545
    16   6 C     25   1 H                                 1.0785719

 * 5 distinct bonds (by element types)

   Z      Z             #   av. dist./Å        max./Å        min./Å
   1 H    6 C           9     1.0830442     1.0927921     1.0715294
   6 C    6 C           9     1.4120017     1.5246554     1.3582877
   6 C    7 N           3     1.4074255     1.4466112     1.3878304
   6 C    8 O           2     1.2062038     1.2062053     1.2062022
   6 C   16 S           2     1.7062874     1.7062916     1.7062831


optimized geometry written to: xtbopt.xyz


           -------------------------------------------------
          | TOTAL ENERGY              -44.618023331147 Eh   |
          | GRADIENT NORM               0.000441801743 Eh/α |
          | HOMO-LUMO GAP               2.423288502632 eV   |
           -------------------------------------------------

------------------------------------------------------------------------
 * finished run on 2021/05/19 at 11:00:22.566     
------------------------------------------------------------------------
 total:
 * wall-time:     0 d,  0 h,  0 min,  0.369 sec
 *  cpu-time:     0 d,  0 h,  0 min,  0.368 sec
 * ratio c/w:     0.997 speedup
 SCF:
 * wall-time:     0 d,  0 h,  0 min,  0.049 sec
 *  cpu-time:     0 d,  0 h,  0 min,  0.049 sec
 * ratio c/w:     1.000 speedup
 ANC optimizer:
 * wall-time:     0 d,  0 h,  0 min,  0.294 sec
 *  cpu-time:     0 d,  0 h,  0 min,  0.294 sec
 * ratio c/w:     1.000 speedup

