      -----------------------------------------------------------      
     |                   =====================                   |     
     |                           x T B                           |     
     |                   =====================                   |     
     |                         S. Grimme                         |     
     |          Mulliken Center for Theoretical Chemistry        |     
     |                    University of Bonn                     |     
     |                Version 6.2 RC2 (SAW190805)                |     
      -----------------------------------------------------------      

   This program is distributed in the hope that it will be useful,
   but WITHOUT ANY WARRANTY; without even the implied warranty of
   MERCHANTABILITY or FITNESS FOR A PARTICULAR PURPOSE.
   
   FOR NON-COMMERCIAL, ACADEMIA USE ONLY.
   
   Cite this work as:
   * S. Grimme, C. Bannwarth, P. Shushkov, J. Chem. Theory Comput., 2017,
     13, 1989-2009. DOI: 10.1021/acs.jctc.7b00118
   * C. Bannwarth, S. Ehlert and S. Grimme., J. Chem. Theory Comput., 2019,
     15, 1652-1671. DOI: 10.1021/acs.jctc.8b01176
   * P. Pracht, E. Caldeweyher, S. Ehlert, S. Grimme, ChemRxiv, 2019, preprint.
     DOI: 10.26434/chemrxiv.8326202.v1
   
   for DFT-D4:
   * E. Caldeweyher, C. Bannwarth and S. Grimme, J. Chem. Phys., 2017,
     147, 034112. DOI: 10.1063/1.4993215
   * E. Caldeweyher, S. Ehlert, A. Hansen, H. Neugebauer, S. Spicher,
     C. Bannwarth and S. Grimme, J. Chem. Phys., 2019, 150, 154122.
     DOI: 10.1063/1.5090222
   
   for sTDA-xTB:
   * S. Grimme and C. Bannwarth, J. Chem. Phys., 2016, 145, 054103.
     DOI: 10.1063/1.4959605
   
   in the mass-spec context:
   * V. Asgeirsson, C. Bauer and S. Grimme, Chem. Sci., 2017, 8, 4879.
     DOI: 10.1039/c7sc00601b
   
   for metadynamics refer to:
   * S. Grimme, J. Chem. Theory Comput., 2019, 155, 2847-2862
     DOI: 10.1021/acs.jctc.9b00143
   
   with help from (in alphabetical order)
   C. Bannwarth, F. Bohle, G. Brandenburg, E. Caldeweyher, M. Checinski,
   S. Dohm, S. Ehlert, S. Ehrlich, F. März, H. Neugebauer, J. Pisarek,
   P. Pracht, P. Shushkov, and S. Spicher.
   
 * started run on 2021/05/19 at 11:00:23.838     

           -------------------------------------------------
          |                Calculation Setup                |
           -------------------------------------------------

          program call               : /ihome/ghutchison/geoffh/xtb/xtb 824.xyz -opt
          hostname                   : smp-n83
          coordinate file            : 824.xyz
          omp threads                :                     1
          number of atoms            :                    26
          number of electrons        :                    84
          charge                     :                     0
          spin                       :                   0.0
          first test random number   :      0.39418853423839


########################################################################
# WARNING! Please study the warnings concerning your input carefully
#  - the use of '-opt' is discouraged, please use '--opt' next time
########################################################################

           ------------------------------------------------- 
          |                 G F N 2 - x T B                 |
          | Geometry, Frequencies, Noncovalent interactions |
          |            JCTC 2019 parametrisation            |
           ------------------------------------------------- 
             KAB for C  - Si     :                1.0500
             KAB for H  - Pd     :                0.9500
             k(s)              :                1.8500
             k(p)              :                2.2300
             k(d)              :                2.2300
             k(f)              :                2.0000
             kEN (H0ij)        :               -2.0000
             D4 a1             :                0.5200
             D4 a2             :                5.0000
             D4 s6             :                1.0000
             D4 s8             :                2.7000
             D4 s9             :                5.0000
             alphaj            :                2.0000

  Z AO/shell   Hii/eV     exponent
  1     Wed Apr 25 08:07:45 CEST 2018   EN: 2.200 GM2: 0.406  GM3: 0.0800  RAES: 1.40
     1s    -10.707211    1.230000
  6     Wed Apr 25 08:07:45 CEST 2018   EN: 2.550 GM2: 0.538  GM3: 0.1500  RAES: 3.00
     2s    -13.970922    2.096432
     2p    -10.063292    1.800000
  8     Wed Apr 25 08:07:45 CEST 2018   EN: 3.440 GM2: 0.452  GM3:-0.0517  RAES: 1.80
     2s    -20.229985    2.439742
     2p    -15.503117    2.137023
  9     Mon Apr 23 13:58:50 CEST 2018   EN: 3.980 GM2: 0.532  GM3: 0.1426  RAES: 2.40
     2s    -23.458179    2.416361
     2p    -15.746583    2.308399
 16     Tue Apr 24 11:44:34 CEST 2018   EN: 2.580 GM2: 0.340  GM3:-0.0502  RAES: 3.10
     3s    -20.029654    1.981333
     3p    -11.377694    2.025643
     3d     -0.420282    1.702555

           ------------------------------------------------- 
          |        Self-Consistent Charge Iterations        |
           ------------------------------------------------- 

          ...................................................
          :                      SETUP                      :
          :.................................................:
          :  # basis functions                  77          :
          :  # atomic orbitals                  76          :
          :  # shells                           42          :
          :  # electrons                        84          :
          :  max. iterations                   250          :
          :  Hamiltonian                  GFN2-xTB          :
          :  restarted?                      false          :
          :  GBSA solvation                  false          :
          :  PC potential                    false          :
          :  electronic temp.          300.0000000     K    :
          :  accuracy                    1.0000000          :
          :  -> integral cutoff          0.2500000E+02      :
          :  -> integral neglect         0.1000000E-07      :
          :  -> SCF convergence          0.1000000E-05 Eh   :
          :  -> wf. convergence          0.1000000E-03 e    :
          :  Broyden damping             0.4000000          :
          ...................................................

 iter      E             dE          RMSdq      gap      omega  full diag
   1    -48.8738271 -0.488738E+02  0.416E+00    3.85       0.0  T
   2    -48.9685132 -0.946862E-01  0.230E+00    3.90       1.0  T
   3    -48.9700796 -0.156642E-02  0.110E+00    3.91       1.0  T
   4    -48.9715211 -0.144151E-02  0.454E-01    3.84       1.0  T
   5    -48.9754335 -0.391239E-02  0.136E-01    3.88       1.0  T
   6    -48.9755551 -0.121561E-03  0.516E-02    3.89       1.0  T
   7    -48.9755655 -0.103683E-04  0.274E-02    3.89       1.0  T
   8    -48.9755778 -0.123452E-04  0.997E-03    3.89       2.0  T
   9    -48.9755781 -0.319619E-06  0.342E-03    3.89       5.7  T
  10    -48.9755782 -0.298567E-07  0.107E-03    3.89      18.2  T
  11    -48.9755782 -0.530435E-08  0.375E-04    3.89      52.3  T
  12    -48.9755782 -0.202917E-09  0.147E-04    3.89     133.3  T

   *** convergence criteria satisfied after 12 iterations ***

         #    Occupation            Energy/Eh            Energy/eV
      -------------------------------------------------------------
         1        2.0000           -0.8757029             -23.8291
       ...           ...                  ...                  ...
        36        2.0000           -0.4658243             -12.6757
        37        2.0000           -0.4581194             -12.4661
        38        2.0000           -0.4485876             -12.2067
        39        2.0000           -0.4451460             -12.1130
        40        2.0000           -0.4105056             -11.1704
        41        2.0000           -0.4062903             -11.0557
        42        2.0000           -0.4027438             -10.9592 (HOMO)
        43                         -0.2599098              -7.0725 (LUMO)
        44                         -0.2117329              -5.7615
        45                         -0.1999633              -5.4413
        46                         -0.1252207              -3.4074
        47                         -0.0169297              -0.4607
       ...                                ...                  ...
        76                          0.6475152              17.6198
      -------------------------------------------------------------
                  HL-Gap            0.1428341 Eh            3.8867 eV
             Fermi-level           -0.3313268 Eh           -9.0159 eV

 SCC (total)                   0 d,  0 h,  0 min,  0.046 sec
 SCC setup                      ...        0 min,  0.000 sec (  0.755%)
 Dispersion                     ...        0 min,  0.000 sec (  0.786%)
 integral evaluation            ...        0 min,  0.011 sec ( 24.372%)
 zeroth order Hamiltonian       ...        0 min,  0.000 sec (  0.477%)
 iterations                     ...        0 min,  0.017 sec ( 36.379%)
 molecular gradient             ...        0 min,  0.017 sec ( 36.276%)
 printout                       ...        0 min,  0.000 sec (  0.844%)

         :::::::::::::::::::::::::::::::::::::::::::::::::::::
         ::                     SUMMARY                     ::
         :::::::::::::::::::::::::::::::::::::::::::::::::::::
         :: total energy             -48.547473192608 Eh    ::
         :: gradient norm              0.047719736997 Eh/a0 ::
         :: HOMO-LUMO gap              3.886712428716 eV    ::
         ::.................................................::
         :: SCC energy               -48.975578161792 Eh    ::
         :: -> isotropic ES            0.061025203398 Eh    ::
         :: -> anisotropic ES          0.001428176724 Eh    ::
         :: -> anisotropic XC         -0.007522323735 Eh    ::
         :: -> dispersion             -0.026844254120 Eh    ::
         :: repulsion energy           0.427791094872 Eh    ::
         :: add. restraining           0.000000000000 Eh    ::
         :::::::::::::::::::::::::::::::::::::::::::::::::::::

      ----------------------------------------------------------- 
     |                   =====================                   |
     |                        A N C O P T                        |
     |                   =====================                   |
     |               Approximate Normal Coordinate               |
     |                Rational Function Optimizer                |
      ----------------------------------------------------------- 

          ...................................................
          :                      SETUP                      :
          :.................................................:
          :   optimization level            normal          :
          :   max. optcycles                   200          :
          :   ANC micro-cycles                  20          :
          :   degrees of freedom                72          :
          :.................................................:
          :   RF solver                   davidson          :
          :   input Hessian                  false          :
          :   write xtbopt.log                true          :
          :   linear?                        false          :
          :   energy convergence         0.5000000E-05 Eh   :
          :   grad. convergence          0.1000000E-02 Eh/α :
          :   maximium RF displ.         2.0000000          :
          :   Hlow (freq-cutoff)         0.5000000E-02      :
          :   Hmax (freq-cutoff)         5.0000000          :
          :   S6 in model hess.         20.0000000          :
          ...................................................

generating ANC from model Hessian ...
Using Lindh-Hessian (1995)
 Shifting diagonal of input Hessian by   3.664647899282308E-003
 Lowest  eigenvalues of input Hessian
   -0.000000   -0.000000   -0.000000   -0.000000    0.000000    0.000000
    0.005000    0.006004    0.007811    0.008559    0.009097    0.011618
    0.012900    0.014498    0.019853    0.022845    0.023809    0.029213
 Highest eigenvalues
    1.494733    1.622514    1.648608    1.680379    1.740680    1.799670
 

........................................................................
.............................. CYCLE    1 ..............................
........................................................................
   1    -48.9755782 -0.489756E+02  0.544E-05    3.89       0.0  T
   2    -48.9755782 -0.798650E-11  0.342E-05    3.89     573.0  T
   3    -48.9755782 -0.667910E-12  0.209E-05    3.89     940.2  T
     SCC iter.                  ...        0 min,  0.005 sec
     gradient                   ...        0 min,  0.017 sec
 * total energy  :   -48.5474732 Eh     change        0.7254656E-08 Eh
   gradient norm :     0.0477203 Eh/α   predicted     0.0000000E+00 (-100.00%)
   displ. norm   :     0.2974899 α      lambda       -0.6958094E-02
   maximum displ.:     0.1305177 α      in ANC's #6, #7, #15, ...

........................................................................
.............................. CYCLE    2 ..............................
........................................................................
   1    -49.0000712 -0.490001E+02  0.248E-01    3.95       0.0  T
   2    -49.0001073 -0.361180E-04  0.133E-01    3.96       1.0  T
   3    -49.0000794  0.279003E-04  0.449E-02    3.96       1.0  T
   4    -49.0001149 -0.355357E-04  0.215E-02    3.96       1.0  T
   5    -49.0001193 -0.435249E-05  0.589E-03    3.96       3.3  T
   6    -49.0001194 -0.863761E-07  0.109E-03    3.96      18.0  T
     SCC iter.                  ...        0 min,  0.008 sec
     gradient                   ...        0 min,  0.016 sec
 * total energy  :   -48.5519209 Eh     change       -0.4447725E-02 Eh
   gradient norm :     0.0171861 Eh/α   predicted    -0.3786952E-02 ( -14.86%)
   displ. norm   :     0.1747748 α      lambda       -0.1023532E-02
   maximum displ.:     0.1175241 α      in ANC's #6, #7, #21, ...

........................................................................
.............................. CYCLE    3 ..............................
........................................................................
   1    -49.0088228 -0.490088E+02  0.111E-01    3.97       0.0  T
   2    -49.0088361 -0.132377E-04  0.598E-02    3.98       1.0  T
   3    -49.0088286  0.752879E-05  0.251E-02    3.98       1.0  T
   4    -49.0088391 -0.105765E-04  0.108E-02    3.98       1.8  T
   5    -49.0088403 -0.115283E-05  0.314E-03    3.98       6.3  T
   6    -49.0088403 -0.251018E-07  0.697E-04    3.98      28.1  T
   7    -49.0088403 -0.553712E-09  0.328E-04    3.98      59.8  T
     SCC iter.                  ...        0 min,  0.009 sec
     gradient                   ...        0 min,  0.016 sec
 * total energy  :   -48.5524986 Eh     change       -0.5776516E-03 Eh
   gradient norm :     0.0047031 Eh/α   predicted    -0.5274088E-03 (  -8.70%)
   displ. norm   :     0.1003981 α      lambda       -0.1260360E-03
   maximum displ.:     0.0772239 α      in ANC's #6, #1, #5, ...

........................................................................
.............................. CYCLE    4 ..............................
........................................................................
   1    -49.0089681 -0.490090E+02  0.507E-02    3.97       0.0  T
   2    -49.0089696 -0.149191E-05  0.297E-02    3.97       1.0  T
   3    -49.0089694  0.125975E-06  0.660E-03    3.98       3.0  T
   4    -49.0089698 -0.363960E-06  0.352E-03    3.98       5.6  T
   5    -49.0089700 -0.206318E-06  0.939E-04    3.98      20.9  T
   6    -49.0089700 -0.583452E-08  0.309E-04    3.98      63.5  T
     SCC iter.                  ...        0 min,  0.008 sec
     gradient                   ...        0 min,  0.016 sec
 * total energy  :   -48.5525962 Eh     change       -0.9764919E-04 Eh
   gradient norm :     0.0022921 Eh/α   predicted    -0.6367022E-04 ( -34.80%)
   displ. norm   :     0.1566919 α      lambda       -0.1324779E-03
   maximum displ.:     0.1046335 α      in ANC's #6, #1, #4, ...

........................................................................
.............................. CYCLE    5 ..............................
........................................................................
   1    -49.0081552 -0.490082E+02  0.785E-02    3.97       0.0  T
   2    -49.0081578 -0.257557E-05  0.473E-02    3.97       1.0  T
   3    -49.0081584 -0.662221E-06  0.626E-03    3.97       3.1  T
   4    -49.0081587 -0.241615E-06  0.361E-03    3.97       5.4  T
   5    -49.0081589 -0.211832E-06  0.115E-03    3.97      17.1  T
   6    -49.0081589 -0.108180E-07  0.404E-04    3.97      48.5  T
   7    -49.0081589 -0.183313E-09  0.181E-04    3.97     108.5  T
     SCC iter.                  ...        0 min,  0.009 sec
     gradient                   ...        0 min,  0.017 sec
 * total energy  :   -48.5526915 Eh     change       -0.9530828E-04 Eh
   gradient norm :     0.0025212 Eh/α   predicted    -0.6786539E-04 ( -28.79%)
   displ. norm   :     0.1483581 α      lambda       -0.7498926E-04
   maximum displ.:     0.0935322 α      in ANC's #6, #1, #7, ...

........................................................................
.............................. CYCLE    6 ..............................
........................................................................
   1    -49.0074559 -0.490075E+02  0.814E-02    3.97       0.0  T
   2    -49.0074582 -0.230745E-05  0.488E-02    3.97       1.0  T
   3    -49.0074591 -0.898911E-06  0.698E-03    3.97       2.8  T
   4    -49.0074592 -0.108503E-06  0.432E-03    3.97       4.5  T
   5    -49.0074594 -0.263478E-06  0.121E-03    3.97      16.3  T
   6    -49.0074595 -0.189415E-07  0.326E-04    3.97      60.1  T
   7    -49.0074595 -0.165834E-09  0.158E-04    3.97     123.9  T
     SCC iter.                  ...        0 min,  0.009 sec
     gradient                   ...        0 min,  0.017 sec
 * total energy  :   -48.5527457 Eh     change       -0.5421131E-04 Eh
   gradient norm :     0.0033414 Eh/α   predicted    -0.3832208E-04 ( -29.31%)
   displ. norm   :     0.1352816 α      lambda       -0.5362718E-04
   maximum displ.:     0.0816300 α      in ANC's #6, #1, #7, ...

........................................................................
.............................. CYCLE    7 ..............................
........................................................................
   1    -49.0073228 -0.490073E+02  0.747E-02    3.97       0.0  T
   2    -49.0073248 -0.200189E-05  0.458E-02    3.97       1.0  T
   3    -49.0073257 -0.887595E-06  0.475E-03    3.97       4.1  T
   4    -49.0073260 -0.219745E-06  0.271E-03    3.97       7.2  T
   5    -49.0073260 -0.807264E-07  0.995E-04    3.97      19.7  T
   6    -49.0073260 -0.115229E-07  0.285E-04    3.97      68.7  T
     SCC iter.                  ...        0 min,  0.008 sec
     gradient                   ...        0 min,  0.017 sec
 * total energy  :   -48.5527858 Eh     change       -0.4007101E-04 Eh
   gradient norm :     0.0033729 Eh/α   predicted    -0.2730936E-04 ( -31.85%)
   displ. norm   :     0.1326913 α      lambda       -0.5147139E-04
   maximum displ.:     0.0821053 α      in ANC's #1, #6, #7, ...

........................................................................
.............................. CYCLE    8 ..............................
........................................................................
   1    -49.0077505 -0.490078E+02  0.749E-02    3.98       0.0  T
   2    -49.0077526 -0.211303E-05  0.457E-02    3.97       1.0  T
   3    -49.0077530 -0.383245E-06  0.711E-03    3.97       2.8  T
   4    -49.0077537 -0.666562E-06  0.344E-03    3.97       5.7  T
   5    -49.0077538 -0.140922E-06  0.980E-04    3.97      20.0  T
   6    -49.0077538 -0.797686E-08  0.386E-04    3.97      50.8  T
     SCC iter.                  ...        0 min,  0.008 sec
     gradient                   ...        0 min,  0.017 sec
 * total energy  :   -48.5528241 Eh     change       -0.3832027E-04 Eh
   gradient norm :     0.0028890 Eh/α   predicted    -0.2619043E-04 ( -31.65%)
   displ. norm   :     0.1145041 α      lambda       -0.4369249E-04
   maximum displ.:     0.0811425 α      in ANC's #1, #6, #7, ...

........................................................................
.............................. CYCLE    9 ..............................
........................................................................
   1    -49.0084178 -0.490084E+02  0.609E-02    3.98       0.0  T
   2    -49.0084192 -0.142126E-05  0.374E-02    3.98       1.0  T
   3    -49.0084195 -0.266805E-06  0.487E-03    3.98       4.0  T
   4    -49.0084198 -0.351715E-06  0.249E-03    3.98       7.9  T
   5    -49.0084199 -0.964138E-07  0.873E-04    3.98      22.5  T
   6    -49.0084199 -0.451513E-08  0.368E-04    3.98      53.3  T
     SCC iter.                  ...        0 min,  0.008 sec
     gradient                   ...        0 min,  0.017 sec
 * total energy  :   -48.5528558 Eh     change       -0.3163885E-04 Eh
   gradient norm :     0.0021477 Eh/α   predicted    -0.2213430E-04 ( -30.04%)
   displ. norm   :     0.0999942 α      lambda       -0.2516760E-04
   maximum displ.:     0.0738414 α      in ANC's #1, #6, #2, ...

........................................................................
.............................. CYCLE   10 ..............................
........................................................................
   1    -49.0086598 -0.490087E+02  0.536E-02    3.98       0.0  T
   2    -49.0086607 -0.861012E-06  0.327E-02    3.98       1.0  T
   3    -49.0086609 -0.230974E-06  0.452E-03    3.98       4.3  T
   4    -49.0086611 -0.204071E-06  0.237E-03    3.98       8.3  T
   5    -49.0086612 -0.599302E-07  0.799E-04    3.98      24.5  T
   6    -49.0086612 -0.712298E-08  0.259E-04    3.98      75.8  T
     SCC iter.                  ...        0 min,  0.008 sec
     gradient                   ...        0 min,  0.017 sec
 * total energy  :   -48.5528744 Eh     change       -0.1865804E-04 Eh
   gradient norm :     0.0018499 Eh/α   predicted    -0.1271115E-04 ( -31.87%)
   displ. norm   :     0.1098479 α      lambda       -0.1383923E-04
   maximum displ.:     0.0852002 α      in ANC's #1, #6, #2, ...

........................................................................
.............................. CYCLE   11 ..............................
........................................................................
   1    -49.0086570 -0.490087E+02  0.562E-02    3.98       0.0  T
   2    -49.0086579 -0.855689E-06  0.347E-02    3.98       1.0  T
   3    -49.0086580 -0.116276E-06  0.437E-03    3.98       4.5  T
   4    -49.0086584 -0.389603E-06  0.154E-03    3.98      12.7  T
   5    -49.0086584 -0.132097E-07  0.728E-04    3.98      26.9  T
   6    -49.0086584 -0.324236E-08  0.295E-04    3.98      66.4  T
     SCC iter.                  ...        0 min,  0.008 sec
     gradient                   ...        0 min,  0.017 sec
 * total energy  :   -48.5528871 Eh     change       -0.1270151E-04 Eh
   gradient norm :     0.0011210 Eh/α   predicted    -0.6959531E-05 ( -45.21%)
   displ. norm   :     0.0372597 α      lambda       -0.3414316E-05
   maximum displ.:     0.0316479 α      in ANC's #1, #6, #2, ...

........................................................................
.............................. CYCLE   12 ..............................
........................................................................
   1    -49.0085158 -0.490085E+02  0.204E-02    3.98       0.0  T
   2    -49.0085160 -0.177324E-06  0.118E-02    3.98       1.7  T
   3    -49.0085159  0.182823E-07  0.269E-03    3.98       7.3  T
   4    -49.0085160 -0.458972E-07  0.153E-03    3.98      12.8  T
   5    -49.0085160 -0.335382E-07  0.399E-04    3.98      49.1  T
   6    -49.0085160 -0.100088E-08  0.153E-04    3.98     128.0  T
     SCC iter.                  ...        0 min,  0.008 sec
     gradient                   ...        0 min,  0.017 sec
 * total energy  :   -48.5528906 Eh     change       -0.3447959E-05 Eh
   gradient norm :     0.0004889 Eh/α   predicted    -0.1709336E-05 ( -50.42%)
   displ. norm   :     0.0380100 α      lambda        0.1180615E-05
   maximum displ.:     0.0325272 α      in ANC's #1, #6, #2, ...

   *** GEOMETRY OPTIMIZATION CONVERGED AFTER 12 ITERATIONS ***

------------------------------------------------------------------------
 total energy gain   :        -0.0054174 Eh       -3.3995 kcal/mol
 total RMSD          :         0.2272139 a0        0.1202 Å
 total power (kW/mol):        -1.1852764 (step)  -31.1596 (real)
------------------------------------------------------------------------

 ANCopt (total)                0 d,  0 h,  0 min,  0.456 sec
 optimizer setup                ...        0 min,  0.000 sec (  0.032%)
 model hessian                  ...        0 min,  0.011 sec (  2.469%)
 ANC generation                 ...        0 min,  0.001 sec (  0.168%)
 coordinate transformation      ...        0 min,  0.000 sec (  0.053%)
 single point calculation       ...        0 min,  0.440 sec ( 96.416%)
 optimization log               ...        0 min,  0.001 sec (  0.292%)
 hessian update                 ...        0 min,  0.000 sec (  0.039%)
 rational function              ...        0 min,  0.002 sec (  0.355%)

================
 final structure:
================
$coord
    3.44283949137529    2.13881898549897    1.35090893517748      C 
    5.15682189473167   -0.60975425582017    1.25127195027988      S 
    2.50594693148293   -2.30235212555049    0.44421140934007      C 
    0.41360077573167   -0.82102230485401    0.26596018537329      C 
    0.96120068844762    1.75895480814841    0.79406721850569      C 
   -1.04309513391496    3.77101868335462    0.84107563255837      C 
   -1.39084871162074    4.66318526506304    3.56727446099240      C 
    0.66389810089145    5.88605775140956    4.42513416880604      F 
   -3.32096071307350    6.29318234332825    3.81434672962589      F 
   -1.82895383876536    2.78645606494826    5.20964503006905      F 
   -3.53698671860909    2.82075116850176   -0.29051113936514      C 
   -4.15788987458174    0.12495556384639    0.52952562514725      C 
   -2.17291502645576   -1.69084508106586   -0.52563885690158      C 
   -2.44804110228273   -1.67299357347119   -3.19883038016594      O 
   -1.05892906897434   -3.53195096143395   -4.47736930359880      C 
    4.36434623008337    3.87681476754465    1.83240658158871      H 
    2.64757508124534   -4.30576395110090    0.17940183972523      H 
   -0.40004535341095    5.44851947926576   -0.19195332209607      H 
   -3.36274733626427    2.82831152621439   -2.34390580690023      H 
   -5.06605617768089    4.09855276123475    0.23814081148143      H 
   -5.99799280691510   -0.40325934916118   -0.22957365198764      H 
   -4.21405824582825   -0.04233558276560    2.58100545320857      H 
   -2.50435424147686   -3.62509841301912    0.17756431056522      H 
   -1.58300026875054   -3.37462845167287   -6.45964676854944      H 
   -1.53176927803217   -5.42917243544792   -3.78666088774684      H 
    0.98239452944556   -3.23842217075672   -4.28454909046197      H 
$end
           -------------------------------------------------
          |                Final Singlepoint                |
           -------------------------------------------------

          ...................................................
          :                      SETUP                      :
          :.................................................:
          :  # basis functions                  77          :
          :  # atomic orbitals                  76          :
          :  # shells                           42          :
          :  # electrons                        84          :
          :  max. iterations                   250          :
          :  Hamiltonian                  GFN2-xTB          :
          :  restarted?                      false          :
          :  GBSA solvation                  false          :
          :  PC potential                    false          :
          :  electronic temp.          300.0000000     K    :
          :  accuracy                    1.0000000          :
          :  -> integral cutoff          0.2500000E+02      :
          :  -> integral neglect         0.1000000E-07      :
          :  -> SCF convergence          0.1000000E-05 Eh   :
          :  -> wf. convergence          0.1000000E-03 e    :
          :  Broyden damping             0.4000000          :
          ...................................................

 iter      E             dE          RMSdq      gap      omega  full diag
   1    -49.0085160 -0.490085E+02  0.950E-05    3.98       0.0  T
   2    -49.0085160 -0.166338E-10  0.459E-05    3.98     427.1  T
   3    -49.0085160 -0.556213E-10  0.351E-05    3.98     559.3  T

   *** convergence criteria satisfied after 3 iterations ***

         #    Occupation            Energy/Eh            Energy/eV
      -------------------------------------------------------------
         1        2.0000           -0.8786793             -23.9101
       ...           ...                  ...                  ...
        36        2.0000           -0.4657057             -12.6725
        37        2.0000           -0.4600069             -12.5174
        38        2.0000           -0.4494407             -12.2299
        39        2.0000           -0.4460095             -12.1365
        40        2.0000           -0.4109335             -11.1821
        41        2.0000           -0.4069035             -11.0724
        42        2.0000           -0.4044664             -11.0061 (HOMO)
        43                         -0.2583271              -7.0294 (LUMO)
        44                         -0.2130577              -5.7976
        45                         -0.1922922              -5.2325
        46                         -0.1253274              -3.4103
        47                         -0.0127748              -0.3476
       ...                                ...                  ...
        76                          0.6696655              18.2225
      -------------------------------------------------------------
                  HL-Gap            0.1461393 Eh            3.9767 eV
             Fermi-level           -0.3313967 Eh           -9.0178 eV

 SCC (total)                   0 d,  0 h,  0 min,  0.034 sec
 SCC setup                      ...        0 min,  0.000 sec (  0.678%)
 Dispersion                     ...        0 min,  0.000 sec (  0.643%)
 integral evaluation            ...        0 min,  0.011 sec ( 33.491%)
 zeroth order Hamiltonian       ...        0 min,  0.000 sec (  0.578%)
 iterations                     ...        0 min,  0.005 sec ( 13.409%)
 molecular gradient             ...        0 min,  0.017 sec ( 50.057%)
 printout                       ...        0 min,  0.000 sec (  0.987%)

         :::::::::::::::::::::::::::::::::::::::::::::::::::::
         ::                     SUMMARY                     ::
         :::::::::::::::::::::::::::::::::::::::::::::::::::::
         :: total energy             -48.552890567244 Eh    ::
         :: gradient norm              0.000488139292 Eh/a0 ::
         :: HOMO-LUMO gap              3.976653331687 eV    ::
         ::.................................................::
         :: SCC energy               -49.008516015556 Eh    ::
         :: -> isotropic ES            0.060625465790 Eh    ::
         :: -> anisotropic ES          0.000338602730 Eh    ::
         :: -> anisotropic XC         -0.009245429809 Eh    ::
         :: -> dispersion             -0.027311387076 Eh    ::
         :: repulsion energy           0.455316967887 Eh    ::
         :: add. restraining           0.000000000000 Eh    ::
         :::::::::::::::::::::::::::::::::::::::::::::::::::::

           -------------------------------------------------
          |                Property Printout                |
           -------------------------------------------------

    * Orbital Energies and Occupations

         #    Occupation            Energy/Eh            Energy/eV
      -------------------------------------------------------------
         1        2.0000           -0.8786793             -23.9101
       ...           ...                  ...                  ...
        30        2.0000           -0.5024520             -13.6724
        31        2.0000           -0.4979301             -13.5494
        32        2.0000           -0.4914385             -13.3727
        33        2.0000           -0.4857528             -13.2180
        34        2.0000           -0.4846492             -13.1880
        35        2.0000           -0.4726020             -12.8602
        36        2.0000           -0.4657057             -12.6725
        37        2.0000           -0.4600069             -12.5174
        38        2.0000           -0.4494407             -12.2299
        39        2.0000           -0.4460095             -12.1365
        40        2.0000           -0.4109335             -11.1821
        41        2.0000           -0.4069035             -11.0724
        42        2.0000           -0.4044664             -11.0061 (HOMO)
        43                         -0.2583271              -7.0294 (LUMO)
        44                         -0.2130577              -5.7976
        45                         -0.1922922              -5.2325
        46                         -0.1253274              -3.4103
        47                         -0.0127748              -0.3476
        48                          0.0065670               0.1787
        49                          0.0187119               0.5092
        50                          0.0203020               0.5524
        51                          0.0290193               0.7897
        52                          0.0362704               0.9870
        53                          0.0422626               1.1500
       ...                                ...                  ...
        76                          0.6696655              18.2225
      -------------------------------------------------------------
                  HL-Gap            0.1461393 Eh            3.9767 eV
             Fermi-level           -0.3313967 Eh           -9.0178 eV

     #   Z        covCN         q      C6AA      α(0)
     1   6 C      2.939    -0.033    28.819     8.804
     2  16 S      2.301     0.005   140.849    19.975
     3   6 C      2.942    -0.032    28.799     8.801
     4   6 C      3.165    -0.018    28.109     8.665
     5   6 C      3.178    -0.010    27.840     8.615
     6   6 C      3.857    -0.035    21.152     6.541
     7   6 C      3.336     0.483    17.329     6.594
     8   9 F      0.791    -0.211    11.354     3.980
     9   9 F      0.791    -0.209    11.329     3.976
    10   9 F      0.791    -0.206    11.292     3.969
    11   6 C      3.808    -0.062    21.676     6.628
    12   6 C      3.808    -0.065    21.742     6.638
    13   6 C      3.751     0.118    18.716     6.170
    14   8 O      1.701    -0.314    19.238     5.922
    15   6 C      3.644     0.041    20.222     6.464
    16   1 H      0.926     0.057     2.238     2.339
    17   1 H      0.926     0.049     2.328     2.386
    18   1 H      0.924     0.066     2.127     2.281
    19   1 H      0.924     0.073     2.057     2.243
    20   1 H      0.924     0.054     2.276     2.359
    21   1 H      0.925     0.059     2.209     2.324
    22   1 H      0.925     0.053     2.283     2.363
    23   1 H      0.923     0.020     2.736     2.587
    24   1 H      0.925     0.060     2.197     2.318
    25   1 H      0.924     0.027     2.631     2.536
    26   1 H      0.924     0.030     2.590     2.517

 Mol. C6AA /au·bohr⁶  :       8260.380021
 Mol. C8AA /au·bohr⁸  :     211602.029252
 Mol. α(0) /au        :        137.993826


Wiberg/Mayer (AO) data.
largest (>0.10) Wiberg bond orders for each atom
          total WBO             WBO to atom ...
     1  C   3.951        C    5 1.603    S    2 1.203    H   16 0.969    C    3 0.113
     2  S   2.650        C    1 1.203    C    3 1.196
     3  C   3.949        C    4 1.603    S    2 1.196    H   17 0.970    C    1 0.113
     4  C   3.984        C    3 1.603    C    5 1.227    C   13 0.982
     5  C   3.981        C    1 1.603    C    4 1.227    C    6 0.989
     6  C   3.980        C   11 0.990    C    5 0.989    H   18 0.953    C    7 0.933
     7  C   3.819        F   10 0.951    F    9 0.946    F    8 0.944    C    6 0.933
     8  F   1.067        C    7 0.944
     9  F   1.070        C    7 0.946
    10  F   1.076        C    7 0.951
    11  C   3.990        C   12 1.010    C    6 0.990    H   20 0.974    H   19 0.972
    12  C   3.995        C   11 1.010    C   13 0.989    H   22 0.974    H   21 0.973
    13  C   3.957        C   12 0.989    C    4 0.982    O   14 0.961    H   23 0.955
    14  O   2.081        C   15 0.999    C   13 0.961
    15  C   3.954        O   14 0.999    H   24 0.978    H   25 0.976    H   26 0.975
    16  H   0.996        C    1 0.969
    17  H   0.997        C    3 0.970
    18  H   0.995        C    6 0.953
    19  H   0.995        C   11 0.972
    20  H   0.996        C   11 0.974
    21  H   0.995        C   12 0.973
    22  H   0.997        C   12 0.974
    23  H   0.999        C   13 0.955
    24  H   0.996        C   15 0.978
    25  H   0.999        C   15 0.976
    26  H   0.999        C   15 0.975

molecular dipole:
                 x           y           z       tot (Debye)
 q only:        0.168      -0.763      -0.981
   full:        0.048      -0.770      -0.960       3.130
molecular quadrupole (traceless):
                xx          xy          yy          xz          yz          zz
 q only:        3.977       1.033       0.931       0.804      -6.611      -4.907
  q+dip:        0.631       2.955       4.769       0.051      -6.464      -5.400
   full:        0.170       2.666       4.562      -0.289      -6.305      -4.732

           -------------------------------------------------
          |                Geometry Summary                 |
           -------------------------------------------------

      molecular mass/u    :      236.2515000
   center of mass at/Å    :       -0.1083553       0.7101876       0.5870414
  moments of inertia/u·Å² :        0.6705031E+03   0.1070296E+04   0.1555141E+04
rotational constants/cm⁻¹ :        0.2514177E-01   0.1575043E-01   0.1083994E-01

 * 25 selected distances

     #   Z        #   Z                                     value/Å
     1   6 C      2  16 S                                 1.7149196
     2  16 S      3   6 C                                 1.7182682 (max)
     3   6 C      4   6 C                                 1.3598954
     1   6 C      5   6 C                                 1.3608090
     4   6 C      5   6 C                                 1.4233830
     6   6 C      7   6 C                                 1.5290434
     7   6 C      8   9 F                                 1.3442899
     7   6 C      9   9 F                                 1.3432420
     7   6 C     10   9 F                                 1.3399192
     6   6 C     11   6 C                                 1.5339745
    11   6 C     12   6 C                                 1.5268662
    12   6 C     13   6 C                                 1.5291876
    13   6 C     14   8 O                                 1.4220959
    14   8 O     15   6 C                                 1.4020718
     1   6 C     16   1 H                                 1.0717171 (min)
     3   6 C     17   1 H                                 1.0720042
     6   6 C     18   1 H                                 1.0966451
    11   6 C     19   1 H                                 1.0905220
    11   6 C     20   1 H                                 1.0909658
    12   6 C     21   1 H                                 1.0897996
    12   6 C     22   1 H                                 1.0896055
    13   6 C     23   1 H                                 1.1031388
    15   6 C     24   1 H                                 1.0882058
    15   6 C     25   1 H                                 1.0973388
    15   6 C     26   1 H                                 1.0960922

 * 5 distinct bonds (by element types)

   Z      Z             #   av. dist./Å        max./Å        min./Å
   1 H    6 C          11     1.0896395     1.1031388     1.0717171
   6 C    6 C           7     1.4661656     1.5339745     1.3598954
   6 C    8 O           2     1.4120838     1.4220959     1.4020718
   6 C    9 F           3     1.3424837     1.3442899     1.3399192
   6 C   16 S           2     1.7165939     1.7182682     1.7149196


optimized geometry written to: xtbopt.xyz


           -------------------------------------------------
          | TOTAL ENERGY              -48.552890567244 Eh   |
          | GRADIENT NORM               0.000488139292 Eh/α |
          | HOMO-LUMO GAP               3.976653331687 eV   |
           -------------------------------------------------

------------------------------------------------------------------------
 * finished run on 2021/05/19 at 11:00:24.413     
------------------------------------------------------------------------
 total:
 * wall-time:     0 d,  0 h,  0 min,  0.574 sec
 *  cpu-time:     0 d,  0 h,  0 min,  0.561 sec
 * ratio c/w:     0.976 speedup
 SCF:
 * wall-time:     0 d,  0 h,  0 min,  0.046 sec
 *  cpu-time:     0 d,  0 h,  0 min,  0.046 sec
 * ratio c/w:     1.000 speedup
 ANC optimizer:
 * wall-time:     0 d,  0 h,  0 min,  0.491 sec
 *  cpu-time:     0 d,  0 h,  0 min,  0.491 sec
 * ratio c/w:     1.000 speedup

