      -----------------------------------------------------------      
     |                   =====================                   |     
     |                           x T B                           |     
     |                   =====================                   |     
     |                         S. Grimme                         |     
     |          Mulliken Center for Theoretical Chemistry        |     
     |                    University of Bonn                     |     
     |                Version 6.2 RC2 (SAW190805)                |     
      -----------------------------------------------------------      

   This program is distributed in the hope that it will be useful,
   but WITHOUT ANY WARRANTY; without even the implied warranty of
   MERCHANTABILITY or FITNESS FOR A PARTICULAR PURPOSE.
   
   FOR NON-COMMERCIAL, ACADEMIA USE ONLY.
   
   Cite this work as:
   * S. Grimme, C. Bannwarth, P. Shushkov, J. Chem. Theory Comput., 2017,
     13, 1989-2009. DOI: 10.1021/acs.jctc.7b00118
   * C. Bannwarth, S. Ehlert and S. Grimme., J. Chem. Theory Comput., 2019,
     15, 1652-1671. DOI: 10.1021/acs.jctc.8b01176
   * P. Pracht, E. Caldeweyher, S. Ehlert, S. Grimme, ChemRxiv, 2019, preprint.
     DOI: 10.26434/chemrxiv.8326202.v1
   
   for DFT-D4:
   * E. Caldeweyher, C. Bannwarth and S. Grimme, J. Chem. Phys., 2017,
     147, 034112. DOI: 10.1063/1.4993215
   * E. Caldeweyher, S. Ehlert, A. Hansen, H. Neugebauer, S. Spicher,
     C. Bannwarth and S. Grimme, J. Chem. Phys., 2019, 150, 154122.
     DOI: 10.1063/1.5090222
   
   for sTDA-xTB:
   * S. Grimme and C. Bannwarth, J. Chem. Phys., 2016, 145, 054103.
     DOI: 10.1063/1.4959605
   
   in the mass-spec context:
   * V. Asgeirsson, C. Bauer and S. Grimme, Chem. Sci., 2017, 8, 4879.
     DOI: 10.1039/c7sc00601b
   
   for metadynamics refer to:
   * S. Grimme, J. Chem. Theory Comput., 2019, 155, 2847-2862
     DOI: 10.1021/acs.jctc.9b00143
   
   with help from (in alphabetical order)
   C. Bannwarth, F. Bohle, G. Brandenburg, E. Caldeweyher, M. Checinski,
   S. Dohm, S. Ehlert, S. Ehrlich, F. März, H. Neugebauer, J. Pisarek,
   P. Pracht, P. Shushkov, and S. Spicher.
   
 * started run on 2021/05/19 at 11:00:25.489     

           -------------------------------------------------
          |                Calculation Setup                |
           -------------------------------------------------

          program call               : /ihome/ghutchison/geoffh/xtb/xtb 827.xyz -opt
          hostname                   : smp-n83
          coordinate file            : 827.xyz
          omp threads                :                     1
          number of atoms            :                    28
          number of electrons        :                    80
          charge                     :                     0
          spin                       :                   0.0
          first test random number   :      0.24251373327042


########################################################################
# WARNING! Please study the warnings concerning your input carefully
#  - the use of '-opt' is discouraged, please use '--opt' next time
########################################################################

           ------------------------------------------------- 
          |                 G F N 2 - x T B                 |
          | Geometry, Frequencies, Noncovalent interactions |
          |            JCTC 2019 parametrisation            |
           ------------------------------------------------- 
             KAB for C  - Si     :                1.0500
             KAB for H  - Pd     :                0.9500
             k(s)              :                1.8500
             k(p)              :                2.2300
             k(d)              :                2.2300
             k(f)              :                2.0000
             kEN (H0ij)        :               -2.0000
             D4 a1             :                0.5200
             D4 a2             :                5.0000
             D4 s6             :                1.0000
             D4 s8             :                2.7000
             D4 s9             :                5.0000
             alphaj            :                2.0000

  Z AO/shell   Hii/eV     exponent
  1     Wed Apr 25 08:07:45 CEST 2018   EN: 2.200 GM2: 0.406  GM3: 0.0800  RAES: 1.40
     1s    -10.707211    1.230000
  6     Wed Apr 25 08:07:45 CEST 2018   EN: 2.550 GM2: 0.538  GM3: 0.1500  RAES: 3.00
     2s    -13.970922    2.096432
     2p    -10.063292    1.800000
 16     Tue Apr 24 11:44:34 CEST 2018   EN: 2.580 GM2: 0.340  GM3:-0.0502  RAES: 3.10
     3s    -20.029654    1.981333
     3p    -11.377694    2.025643
     3d     -0.420282    1.702555

           ------------------------------------------------- 
          |        Self-Consistent Charge Iterations        |
           ------------------------------------------------- 

          ...................................................
          :                      SETUP                      :
          :.................................................:
          :  # basis functions                  88          :
          :  # atomic orbitals                  86          :
          :  # shells                           46          :
          :  # electrons                        80          :
          :  max. iterations                   250          :
          :  Hamiltonian                  GFN2-xTB          :
          :  restarted?                      false          :
          :  GBSA solvation                  false          :
          :  PC potential                    false          :
          :  electronic temp.          300.0000000     K    :
          :  accuracy                    1.0000000          :
          :  -> integral cutoff          0.2500000E+02      :
          :  -> integral neglect         0.1000000E-07      :
          :  -> SCF convergence          0.1000000E-05 Eh   :
          :  -> wf. convergence          0.1000000E-03 e    :
          :  Broyden damping             0.4000000          :
          ...................................................

 iter      E             dE          RMSdq      gap      omega  full diag
   1    -43.1878896 -0.431879E+02  0.435E+00    3.01       0.0  T
   2    -43.2130796 -0.251900E-01  0.249E+00    2.82       1.0  T
   3    -43.1895497  0.235300E-01  0.122E+00    3.00       1.0  T
   4    -43.2189573 -0.294076E-01  0.445E-01    2.79       1.0  T
   5    -43.2207597 -0.180238E-02  0.134E-01    2.86       1.0  T
   6    -43.2208622 -0.102499E-03  0.515E-02    2.84       1.0  T
   7    -43.2209081 -0.458621E-04  0.195E-02    2.85       1.0  T
   8    -43.2209112 -0.313193E-05  0.100E-02    2.85       1.9  T
   9    -43.2209121 -0.848296E-06  0.360E-03    2.85       5.3  T
  10    -43.2209121 -0.707577E-07  0.169E-03    2.85      11.2  T
  11    -43.2209122 -0.382460E-07  0.655E-04    2.85      28.8  T
  12    -43.2209122 -0.341837E-08  0.334E-04    2.85      56.6  T

   *** convergence criteria satisfied after 12 iterations ***

         #    Occupation            Energy/Eh            Energy/eV
      -------------------------------------------------------------
         1        2.0000           -0.7293484             -19.8466
       ...           ...                  ...                  ...
        34        2.0000           -0.4273304             -11.6283
        35        2.0000           -0.4234254             -11.5220
        36        2.0000           -0.4134985             -11.2519
        37        2.0000           -0.4051120             -11.0237
        38        2.0000           -0.3983261             -10.8390
        39        2.0000           -0.3704064             -10.0793
        40        2.0000           -0.3603585              -9.8059 (HOMO)
        41                         -0.2557503              -6.9593 (LUMO)
        42                         -0.2405683              -6.5462
        43                         -0.2251667              -6.1271
        44                         -0.2106639              -5.7325
        45                         -0.1990652              -5.4168
       ...                                ...                  ...
        86                          0.7121781              19.3794
      -------------------------------------------------------------
                  HL-Gap            0.1046082 Eh            2.8465 eV
             Fermi-level           -0.3080544 Eh           -8.3826 eV

 SCC (total)                   0 d,  0 h,  0 min,  0.057 sec
 SCC setup                      ...        0 min,  0.000 sec (  0.637%)
 Dispersion                     ...        0 min,  0.000 sec (  0.830%)
 integral evaluation            ...        0 min,  0.015 sec ( 25.857%)
 zeroth order Hamiltonian       ...        0 min,  0.000 sec (  0.470%)
 iterations                     ...        0 min,  0.020 sec ( 34.426%)
 molecular gradient             ...        0 min,  0.021 sec ( 36.902%)
 printout                       ...        0 min,  0.000 sec (  0.781%)

         :::::::::::::::::::::::::::::::::::::::::::::::::::::
         ::                     SUMMARY                     ::
         :::::::::::::::::::::::::::::::::::::::::::::::::::::
         :: total energy             -42.557656080431 Eh    ::
         :: gradient norm              0.097050108796 Eh/a0 ::
         :: HOMO-LUMO gap              2.846533601519 eV    ::
         ::.................................................::
         :: SCC energy               -43.220912167503 Eh    ::
         :: -> isotropic ES            0.003274270080 Eh    ::
         :: -> anisotropic ES          0.005681349606 Eh    ::
         :: -> anisotropic XC          0.022776494044 Eh    ::
         :: -> dispersion             -0.035116918823 Eh    ::
         :: repulsion energy           0.663043370689 Eh    ::
         :: add. restraining           0.000000000000 Eh    ::
         :::::::::::::::::::::::::::::::::::::::::::::::::::::

      ----------------------------------------------------------- 
     |                   =====================                   |
     |                        A N C O P T                        |
     |                   =====================                   |
     |               Approximate Normal Coordinate               |
     |                Rational Function Optimizer                |
      ----------------------------------------------------------- 

          ...................................................
          :                      SETUP                      :
          :.................................................:
          :   optimization level            normal          :
          :   max. optcycles                   200          :
          :   ANC micro-cycles                  20          :
          :   degrees of freedom                78          :
          :.................................................:
          :   RF solver                   davidson          :
          :   input Hessian                  false          :
          :   write xtbopt.log                true          :
          :   linear?                        false          :
          :   energy convergence         0.5000000E-05 Eh   :
          :   grad. convergence          0.1000000E-02 Eh/α :
          :   maximium RF displ.         2.0000000          :
          :   Hlow (freq-cutoff)         0.5000000E-02      :
          :   Hmax (freq-cutoff)         5.0000000          :
          :   S6 in model hess.         20.0000000          :
          ...................................................

generating ANC from model Hessian ...
Using Lindh-Hessian (1995)
 Shifting diagonal of input Hessian by   4.096925481652828E-003
 Lowest  eigenvalues of input Hessian
   -0.000000   -0.000000   -0.000000    0.000000    0.000000    0.000000
    0.005000    0.005400    0.006774    0.008756    0.009898    0.010778
    0.011533    0.011750    0.013071    0.015596    0.016391    0.020098
 Highest eigenvalues
    1.723962    1.776780    1.820721    1.948759    1.972575    2.002669
 

........................................................................
.............................. CYCLE    1 ..............................
........................................................................
   1    -43.2209122 -0.432209E+02  0.176E-04    2.85       0.0  T
   2    -43.2209122 -0.354206E-10  0.125E-04    2.85     151.2  T
   3    -43.2209122  0.167049E-10  0.938E-05    2.85     201.4  T
     SCC iter.                  ...        0 min,  0.006 sec
     gradient                   ...        0 min,  0.021 sec
 * total energy  :   -42.5576561 Eh     change       -0.1188859E-07 Eh
   gradient norm :     0.0970498 Eh/α   predicted     0.0000000E+00 (-100.00%)
   displ. norm   :     0.3546777 α      lambda       -0.1452145E-01
   maximum displ.:     0.1930307 α      in ANC's #12, #20, #26, ...

........................................................................
.............................. CYCLE    2 ..............................
........................................................................
   1    -43.2538955 -0.432539E+02  0.325E-01    2.88       0.0  T
   2    -43.2539790 -0.834393E-04  0.170E-01    2.90       1.0  T
   3    -43.2538462  0.132739E-03  0.875E-02    2.87       1.0  T
   4    -43.2540401 -0.193847E-03  0.341E-02    2.89       1.0  T
   5    -43.2540486 -0.852497E-05  0.133E-02    2.89       1.4  T
   6    -43.2540503 -0.175730E-05  0.382E-03    2.89       4.9  T
   7    -43.2540506 -0.260104E-06  0.151E-03    2.89      12.5  T
     SCC iter.                  ...        0 min,  0.011 sec
     gradient                   ...        0 min,  0.019 sec
 * total energy  :   -42.5675902 Eh     change       -0.9934131E-02 Eh
   gradient norm :     0.0372046 Eh/α   predicted    -0.8174093E-02 ( -17.72%)
   displ. norm   :     0.3398987 α      lambda       -0.4018660E-02
   maximum displ.:     0.2208591 α      in ANC's #12, #4, #9, ...

........................................................................
.............................. CYCLE    3 ..............................
........................................................................
   1    -43.2682221 -0.432682E+02  0.210E-01    2.91       0.0  T
   2    -43.2682675 -0.453543E-04  0.115E-01    2.91       1.0  T
   3    -43.2682150  0.525021E-04  0.594E-02    2.90       1.0  T
   4    -43.2682920 -0.770009E-04  0.242E-02    2.91       1.0  T
   5    -43.2682982 -0.617612E-05  0.860E-03    2.91       2.2  T
   6    -43.2682985 -0.287012E-06  0.343E-03    2.91       5.5  T
   7    -43.2682987 -0.199038E-06  0.142E-03    2.91      13.3  T
     SCC iter.                  ...        0 min,  0.011 sec
     gradient                   ...        0 min,  0.020 sec
 * total energy  :   -42.5698439 Eh     change       -0.2253664E-02 Eh
   gradient norm :     0.0103628 Eh/α   predicted    -0.2241477E-02 (  -0.54%)
   displ. norm   :     0.1838514 α      lambda       -0.5620209E-03
   maximum displ.:     0.1064627 α      in ANC's #4, #12, #9, ...

........................................................................
.............................. CYCLE    4 ..............................
........................................................................
   1    -43.2673608 -0.432674E+02  0.828E-02    2.91       0.0  T
   2    -43.2673644 -0.359557E-05  0.476E-02    2.90       1.0  T
   3    -43.2673573  0.711403E-05  0.201E-02    2.90       1.0  T
   4    -43.2673655 -0.827829E-05  0.786E-03    2.90       2.4  T
   5    -43.2673662 -0.673736E-06  0.288E-03    2.90       6.6  T
   6    -43.2673662 -0.364669E-07  0.122E-03    2.90      15.5  T
     SCC iter.                  ...        0 min,  0.010 sec
     gradient                   ...        0 min,  0.020 sec
 * total energy  :   -42.5701702 Eh     change       -0.3263492E-03 Eh
   gradient norm :     0.0064701 Eh/α   predicted    -0.2905317E-03 ( -10.98%)
   displ. norm   :     0.1463534 α      lambda       -0.2406319E-03
   maximum displ.:     0.0983458 α      in ANC's #4, #3, #1, ...

........................................................................
.............................. CYCLE    5 ..............................
........................................................................
   1    -43.2658837 -0.432659E+02  0.693E-02    2.90       0.0  T
   2    -43.2658855 -0.180140E-05  0.387E-02    2.90       1.0  T
   3    -43.2658837  0.178176E-05  0.112E-02    2.90       1.7  T
   4    -43.2658859 -0.213052E-05  0.547E-03    2.90       3.5  T
   5    -43.2658861 -0.248238E-06  0.224E-03    2.90       8.5  T
   6    -43.2658862 -0.721261E-07  0.761E-04    2.90      24.8  T
     SCC iter.                  ...        0 min,  0.010 sec
     gradient                   ...        0 min,  0.020 sec
 * total energy  :   -42.5702906 Eh     change       -0.1203661E-03 Eh
   gradient norm :     0.0026239 Eh/α   predicted    -0.1228937E-03 (   2.10%)
   displ. norm   :     0.0680111 α      lambda       -0.5451043E-04
   maximum displ.:     0.0443991 α      in ANC's #1, #4, #8, ...

........................................................................
.............................. CYCLE    6 ..............................
........................................................................
   1    -43.2662907 -0.432663E+02  0.295E-02    2.90       0.0  T
   2    -43.2662909 -0.139408E-06  0.169E-02    2.90       1.1  T
   3    -43.2662903  0.603441E-06  0.514E-03    2.90       3.7  T
   4    -43.2662909 -0.690349E-06  0.164E-03    2.90      11.5  T
   5    -43.2662910 -0.143279E-07  0.552E-04    2.90      34.2  T
   6    -43.2662910 -0.599141E-08  0.188E-04    2.90     100.4  T
     SCC iter.                  ...        0 min,  0.010 sec
     gradient                   ...        0 min,  0.021 sec
 * total energy  :   -42.5703325 Eh     change       -0.4192321E-04 Eh
   gradient norm :     0.0020770 Eh/α   predicted    -0.2738136E-04 ( -34.69%)
   displ. norm   :     0.1082163 α      lambda       -0.5718325E-04
   maximum displ.:     0.0756798 α      in ANC's #1, #8, #4, ...

........................................................................
.............................. CYCLE    7 ..............................
........................................................................
   1    -43.2669503 -0.432670E+02  0.442E-02    2.90       0.0  T
   2    -43.2669506 -0.281641E-06  0.254E-02    2.90       1.0  T
   3    -43.2669493  0.124768E-05  0.768E-03    2.90       2.5  T
   4    -43.2669508 -0.142722E-05  0.224E-03    2.90       8.4  T
   5    -43.2669508 -0.235527E-07  0.756E-04    2.90      25.0  T
   6    -43.2669508 -0.966789E-08  0.238E-04    2.90      79.5  T
     SCC iter.                  ...        0 min,  0.010 sec
     gradient                   ...        0 min,  0.021 sec
 * total energy  :   -42.5703765 Eh     change       -0.4402065E-04 Eh
   gradient norm :     0.0019266 Eh/α   predicted    -0.2893249E-04 ( -34.28%)
   displ. norm   :     0.1675989 α      lambda       -0.4296420E-04
   maximum displ.:     0.1238049 α      in ANC's #1, #8, #4, ...

........................................................................
.............................. CYCLE    8 ..............................
........................................................................
   1    -43.2673141 -0.432673E+02  0.681E-02    2.90       0.0  T
   2    -43.2673147 -0.611508E-06  0.390E-02    2.90       1.0  T
   3    -43.2673129  0.182846E-05  0.994E-03    2.90       1.9  T
   4    -43.2673150 -0.210626E-05  0.341E-03    2.90       5.5  T
   5    -43.2673151 -0.671817E-07  0.928E-04    2.90      20.4  T
   6    -43.2673151 -0.147179E-07  0.268E-04    2.90      70.6  T
     SCC iter.                  ...        0 min,  0.010 sec
     gradient                   ...        0 min,  0.021 sec
 * total energy  :   -42.5704248 Eh     change       -0.4821159E-04 Eh
   gradient norm :     0.0020454 Eh/α   predicted    -0.2175296E-04 ( -54.88%)
   displ. norm   :     0.0761086 α      lambda       -0.2909297E-04
   maximum displ.:     0.0605013 α      in ANC's #1, #8, #2, ...

........................................................................
.............................. CYCLE    9 ..............................
........................................................................
   1    -43.2673823 -0.432674E+02  0.321E-02    2.90       0.0  T
   2    -43.2673825 -0.148773E-06  0.182E-02    2.90       1.0  T
   3    -43.2673824  0.713407E-07  0.303E-03    2.90       6.2  T
   4    -43.2673825 -0.813716E-07  0.169E-03    2.90      11.2  T
   5    -43.2673825 -0.379221E-07  0.307E-04    2.90      61.6  T
   6    -43.2673825 -0.165164E-08  0.998E-05    2.90     189.4  T
     SCC iter.                  ...        0 min,  0.010 sec
     gradient                   ...        0 min,  0.021 sec
 * total energy  :   -42.5704512 Eh     change       -0.2639612E-04 Eh
   gradient norm :     0.0016549 Eh/α   predicted    -0.1463122E-04 ( -44.57%)
   displ. norm   :     0.1566778 α      lambda       -0.3933890E-04
   maximum displ.:     0.1196121 α      in ANC's #1, #8, #6, ...

........................................................................
.............................. CYCLE   10 ..............................
........................................................................
   1    -43.2671185 -0.432671E+02  0.719E-02    2.90       0.0  T
   2    -43.2671193 -0.855861E-06  0.401E-02    2.90       1.0  T
   3    -43.2671192  0.143889E-06  0.653E-03    2.90       2.9  T
   4    -43.2671193 -0.155799E-06  0.389E-03    2.90       4.9  T
   5    -43.2671196 -0.237658E-06  0.525E-04    2.90      36.0  T
   6    -43.2671196 -0.662437E-08  0.217E-04    2.90      87.3  T
     SCC iter.                  ...        0 min,  0.010 sec
     gradient                   ...        0 min,  0.021 sec
 * total energy  :   -42.5704988 Eh     change       -0.4764174E-04 Eh
   gradient norm :     0.0015044 Eh/α   predicted    -0.1988858E-04 ( -58.25%)
   displ. norm   :     0.1748302 α      lambda       -0.3224403E-04
   maximum displ.:     0.1299543 α      in ANC's #1, #8, #6, ...

........................................................................
.............................. CYCLE   11 ..............................
........................................................................
   1    -43.2666302 -0.432666E+02  0.827E-02    2.90       0.0  T
   2    -43.2666314 -0.114179E-05  0.460E-02    2.90       1.0  T
   3    -43.2666311  0.242564E-06  0.776E-03    2.90       2.4  T
   4    -43.2666314 -0.222872E-06  0.489E-03    2.90       3.9  T
   5    -43.2666317 -0.359680E-06  0.551E-04    2.90      34.3  T
   6    -43.2666317 -0.656151E-08  0.212E-04    2.90      89.1  T
     SCC iter.                  ...        0 min,  0.009 sec
     gradient                   ...        0 min,  0.021 sec
 * total energy  :   -42.5705384 Eh     change       -0.3962271E-04 Eh
   gradient norm :     0.0014885 Eh/α   predicted    -0.1634167E-04 ( -58.76%)
   displ. norm   :     0.2322790 α      lambda       -0.3481403E-04
   maximum displ.:     0.1684363 α      in ANC's #1, #8, #6, ...

........................................................................
.............................. CYCLE   12 ..............................
........................................................................
   1    -43.2663611 -0.432664E+02  0.119E-01    2.89       0.0  T
   2    -43.2663637 -0.260626E-05  0.654E-02    2.89       1.0  T
   3    -43.2663639 -0.117888E-06  0.103E-02    2.89       1.8  T
   4    -43.2663634  0.412892E-06  0.707E-03    2.89       2.7  T
   5    -43.2663644 -0.999142E-06  0.648E-04    2.89      29.2  T
   6    -43.2663645 -0.865990E-08  0.307E-04    2.89      61.6  T
     SCC iter.                  ...        0 min,  0.009 sec
     gradient                   ...        0 min,  0.021 sec
 * total energy  :   -42.5705767 Eh     change       -0.3826439E-04 Eh
   gradient norm :     0.0015586 Eh/α   predicted    -0.1782504E-04 ( -53.42%)
   displ. norm   :     0.3028763 α      lambda       -0.3401807E-04
   maximum displ.:     0.2168161 α      in ANC's #1, #8, #3, ...

........................................................................
.............................. CYCLE   13 ..............................
........................................................................
   1    -43.2658096 -0.432658E+02  0.157E-01    2.89       0.0  T
   2    -43.2658141 -0.451393E-05  0.862E-02    2.89       1.0  T
   3    -43.2658139  0.200251E-06  0.140E-02    2.89       1.3  T
   4    -43.2658136  0.342600E-06  0.973E-03    2.89       1.9  T
   5    -43.2658154 -0.180085E-05  0.929E-04    2.89      20.3  T
   6    -43.2658154 -0.203207E-07  0.412E-04    2.89      45.9  T
   7    -43.2658154 -0.280988E-08  0.194E-04    2.89      97.5  T
     SCC iter.                  ...        0 min,  0.011 sec
     gradient                   ...        0 min,  0.021 sec
 * total energy  :   -42.5706038 Eh     change       -0.2715419E-04 Eh
   gradient norm :     0.0024875 Eh/α   predicted    -0.1770424E-04 ( -34.80%)
   displ. norm   :     0.0708120 α      lambda       -0.2296303E-04
   maximum displ.:     0.0437710 α      in ANC's #1, #3, #6, ...

........................................................................
.............................. CYCLE   14 ..............................
........................................................................
   1    -43.2669516 -0.432670E+02  0.436E-02    2.89       0.0  T
   2    -43.2669521 -0.454604E-06  0.236E-02    2.89       1.0  T
   3    -43.2669517  0.310933E-06  0.534E-03    2.89       3.5  T
   4    -43.2669521 -0.361219E-06  0.288E-03    2.89       6.6  T
   5    -43.2669522 -0.969741E-07  0.330E-04    2.89      57.2  T
   6    -43.2669522 -0.823178E-09  0.162E-04    2.89     116.7  T
     SCC iter.                  ...        0 min,  0.009 sec
     gradient                   ...        0 min,  0.021 sec
 * total energy  :   -42.5706205 Eh     change       -0.1667861E-04 Eh
   gradient norm :     0.0017979 Eh/α   predicted    -0.1154106E-04 ( -30.80%)
   displ. norm   :     0.1993455 α      lambda       -0.2824314E-04
   maximum displ.:     0.1114670 α      in ANC's #1, #3, #6, ...

........................................................................
.............................. CYCLE   15 ..............................
........................................................................
   1    -43.2674806 -0.432675E+02  0.120E-01    2.88       0.0  T
   2    -43.2674834 -0.283373E-05  0.655E-02    2.88       1.0  T
   3    -43.2674802  0.316675E-05  0.156E-02    2.89       1.2  T
   4    -43.2674840 -0.373088E-05  0.758E-03    2.88       2.5  T
   5    -43.2674845 -0.556602E-06  0.738E-04    2.88      25.6  T
   6    -43.2674845 -0.959893E-08  0.341E-04    2.88      55.4  T
     SCC iter.                  ...        0 min,  0.010 sec
     gradient                   ...        0 min,  0.021 sec
 * total energy  :   -42.5706477 Eh     change       -0.2721299E-04 Eh
   gradient norm :     0.0013556 Eh/α   predicted    -0.1437154E-04 ( -47.19%)
   displ. norm   :     0.1996335 α      lambda        0.7160720E-05
   maximum displ.:     0.1119802 α      in ANC's #1, #3, #6, ...

........................................................................
.............................. CYCLE   16 ..............................
........................................................................
   1    -43.2671330 -0.432671E+02  0.120E-01    2.88       0.0  T
   2    -43.2671358 -0.283232E-05  0.658E-02    2.88       1.0  T
   3    -43.2671326  0.323211E-05  0.157E-02    2.88       1.2  T
   4    -43.2671364 -0.379474E-05  0.764E-03    2.88       2.5  T
   5    -43.2671369 -0.568393E-06  0.734E-04    2.88      25.7  T
   6    -43.2671370 -0.957720E-08  0.342E-04    2.88      55.2  T
     SCC iter.                  ...        0 min,  0.010 sec
     gradient                   ...        0 min,  0.021 sec
 * total energy  :   -42.5706464 Eh     change        0.1309956E-05 Eh
   gradient norm :     0.0028540 Eh/α   predicted     0.3643183E-05 ( 178.12%)
   displ. norm   :     0.1334255 α      lambda        0.4237182E-04
   maximum displ.:     0.0752609 α      in ANC's #1, #3, #6, ...

........................................................................
.............................. CYCLE   17 ..............................
........................................................................
   1    -43.2664077 -0.432664E+02  0.805E-02    2.87       0.0  T
   2    -43.2664089 -0.126471E-05  0.440E-02    2.87       1.0  T
   3    -43.2664075  0.145373E-05  0.105E-02    2.88       1.8  T
   4    -43.2664092 -0.170454E-05  0.513E-03    2.87       3.7  T
   5    -43.2664094 -0.256217E-06  0.499E-04    2.87      37.9  T
   6    -43.2664094 -0.450008E-08  0.234E-04    2.87      80.9  T
     SCC iter.                  ...        0 min,  0.010 sec
     gradient                   ...        0 min,  0.021 sec
 * total energy  :   -42.5706262 Eh     change        0.2023218E-04 Eh
   gradient norm :     0.0043173 Eh/α   predicted     0.2156120E-04 (   6.57%)
   displ. norm   :     0.1268220 α      lambda       -0.7340462E-04
   maximum displ.:     0.0765708 α      in ANC's #1, #8, #3, ...

........................................................................
.............................. CYCLE   18 ..............................
........................................................................
   1    -43.2675239 -0.432675E+02  0.767E-02    2.88       0.0  T
   2    -43.2675253 -0.134374E-05  0.415E-02    2.88       1.0  T
   3    -43.2675237  0.160778E-05  0.109E-02    2.88       1.7  T
   4    -43.2675256 -0.193088E-05  0.506E-03    2.88       3.7  T
   5    -43.2675258 -0.216408E-06  0.652E-04    2.88      29.0  T
   6    -43.2675258 -0.751129E-08  0.255E-04    2.88      74.2  T
     SCC iter.                  ...        0 min,  0.010 sec
     gradient                   ...        0 min,  0.020 sec
 * total energy  :   -42.5706682 Eh     change       -0.4204479E-04 Eh
   gradient norm :     0.0019970 Eh/α   predicted    -0.3729742E-04 ( -11.29%)
   displ. norm   :     0.0527880 α      lambda       -0.1510430E-04
   maximum displ.:     0.0318206 α      in ANC's #1, #8, #3, ...

........................................................................
.............................. CYCLE   19 ..............................
........................................................................
   1    -43.2683992 -0.432684E+02  0.279E-02    2.88       0.0  T
   2    -43.2683993 -0.135527E-06  0.158E-02    2.88       1.2  T
   3    -43.2683991  0.167781E-06  0.345E-03    2.88       5.5  T
   4    -43.2683993 -0.194226E-06  0.143E-03    2.88      13.2  T
   5    -43.2683993 -0.171754E-07  0.427E-04    2.88      44.3  T
   6    -43.2683994 -0.290413E-08  0.104E-04    2.88     182.0  T
     SCC iter.                  ...        0 min,  0.010 sec
     gradient                   ...        0 min,  0.021 sec
 * total energy  :   -42.5706802 Eh     change       -0.1199274E-04 Eh
   gradient norm :     0.0016793 Eh/α   predicted    -0.7563806E-05 ( -36.93%)
   displ. norm   :     0.0917261 α      lambda       -0.1418450E-04
   maximum displ.:     0.0557022 α      in ANC's #6, #3, #5, ...

........................................................................
.............................. CYCLE   20 ..............................
........................................................................
   1    -43.2675105 -0.432675E+02  0.526E-02    2.87       0.0  T
   2    -43.2675108 -0.213540E-06  0.306E-02    2.87       1.0  T
   3    -43.2675101  0.609235E-06  0.565E-03    2.87       3.3  T
   4    -43.2675109 -0.715197E-06  0.149E-03    2.87      12.6  T
   5    -43.2675109 -0.806172E-08  0.575E-04    2.87      32.9  T
   6    -43.2675109 -0.739280E-08  0.185E-04    2.87     102.0  T
     SCC iter.                  ...        0 min,  0.010 sec
     gradient                   ...        0 min,  0.021 sec
 * total energy  :   -42.5706922 Eh     change       -0.1193445E-04 Eh
   gradient norm :     0.0017947 Eh/α   predicted    -0.7123768E-05 ( -40.31%)
   displ. norm   :     0.0804652 α      lambda       -0.9733943E-05
   maximum displ.:     0.0522723 α      in ANC's #3, #6, #5, ...
 * RMSD in coord.:     0.3911849 α      energy gain  -0.1303608E-01 Eh

generating ANC from model Hessian ...
Using Lindh-Hessian (1995)
 Shifting diagonal of input Hessian by   4.040504981398543E-003
 Lowest  eigenvalues of input Hessian
   -0.000000   -0.000000   -0.000000   -0.000000    0.000000    0.000000
    0.005000    0.005548    0.007146    0.008829    0.010098    0.010728
    0.012167    0.012930    0.014025    0.016014    0.016725    0.020761
 Highest eigenvalues
    1.786120    1.818641    1.869476    1.974780    2.012461    2.038638
 

........................................................................
.............................. CYCLE   21 ..............................
........................................................................
   1    -43.2670131 -0.432670E+02  0.510E-02    2.87       0.0  T
   2    -43.2670133 -0.257848E-06  0.296E-02    2.87       1.0  T
   3    -43.2670127  0.593854E-06  0.557E-03    2.87       3.4  T
   4    -43.2670134 -0.671943E-06  0.188E-03    2.87      10.1  T
   5    -43.2670134 -0.342203E-07  0.399E-04    2.87      47.4  T
   6    -43.2670134 -0.122086E-08  0.196E-04    2.87      96.4  T
     SCC iter.                  ...        0 min,  0.009 sec
     gradient                   ...        0 min,  0.021 sec
 * total energy  :   -42.5707000 Eh     change       -0.7803712E-05 Eh
   gradient norm :     0.0009810 Eh/α   predicted     0.0000000E+00 (-100.00%)
   displ. norm   :     0.0019346 α      lambda       -0.8822443E-06
   maximum displ.:     0.0012545 α      in ANC's #1, #73, #70, ...

........................................................................
.............................. CYCLE   22 ..............................
........................................................................
   1    -43.2671104 -0.432671E+02  0.253E-03    2.87       0.0  T
   2    -43.2671104 -0.171142E-07  0.139E-03    2.87      13.5  T
   3    -43.2671104  0.170972E-08  0.855E-04    2.87      22.1  T
   4    -43.2671105 -0.103500E-07  0.316E-04    2.87      59.8  T
     SCC iter.                  ...        0 min,  0.007 sec
     gradient                   ...        0 min,  0.021 sec
 * total energy  :   -42.5707007 Eh     change       -0.7049102E-06 Eh
   gradient norm :     0.0005440 Eh/α   predicted    -0.4428585E-06 ( -37.18%)
   displ. norm   :     0.0018752 α      lambda        0.1010187E-05
   maximum displ.:     0.0011608 α      in ANC's #1, #73, #70, ...

   *** GEOMETRY OPTIMIZATION CONVERGED AFTER 22 ITERATIONS ***

------------------------------------------------------------------------
 total energy gain   :        -0.0130446 Eh       -8.1856 kcal/mol
 total RMSD          :         0.3913173 a0        0.2071 Å
 total power (kW/mol):        -1.5567526 (step)  -33.4171 (real)
------------------------------------------------------------------------

 ANCopt (total)                0 d,  0 h,  0 min,  1.025 sec
 optimizer setup                ...        0 min,  0.000 sec (  0.015%)
 model hessian                  ...        0 min,  0.014 sec (  1.346%)
 ANC generation                 ...        0 min,  0.002 sec (  0.161%)
 coordinate transformation      ...        0 min,  0.000 sec (  0.042%)
 single point calculation       ...        0 min,  1.001 sec ( 97.666%)
 optimization log               ...        0 min,  0.002 sec (  0.241%)
 hessian update                 ...        0 min,  0.000 sec (  0.030%)
 rational function              ...        0 min,  0.004 sec (  0.356%)

================
 final structure:
================
$coord
   -5.42195139632194    0.52328682218125    0.31711857607115      C 
   -5.81706831119105   -1.99467340703433    0.25617535029703      C 
   -3.07112116176879   -3.74242937814892   -0.03951208672615      S 
   -1.30131535732816   -0.97819604346452   -0.07719499752146      C 
   -2.81424509232019    1.19103042396384    0.12439106683549      C 
   -1.68732076703671    3.60628187551035    0.02041599256244      C 
   -3.33635688679493    5.91160826499301    0.14726193954104      C 
    0.90473784210393    3.83730622822791   -0.25538969196160      C 
    2.03525984628249    6.40375553607141   -0.67746481677872      C 
    2.44734403403204    1.65113257290721   -0.25378403822879      C 
    1.30022909927022   -0.74700611712824   -0.26249657885182      C 
    3.46154631246527   -3.19656779228098   -0.56367612724978      S 
    5.89820944405879   -1.03671007635454   -0.60118540959951      C 
    5.15721189208179    1.41044024401672   -0.36512821595936      C 
    7.07302677584666    3.38381675725306   -0.02947566094700      C 
    7.16315754306024    4.90270941055305    1.95671973702583      C 
   -6.93968767436064    1.86351967774334    0.47790597371841      H 
   -7.58510988617044   -2.97975263618615    0.36248641756953      H 
   -5.13961834311375    5.47282157584362    1.02002597506639      H 
   -3.70268437413988    6.64236822237974   -1.74522310123726      H 
   -2.43588559113685    7.39626657107309    1.24568489235317      H 
    0.79513424965523    7.53418895142253   -1.86432763227473      H 
    3.85627493826815    6.24982621347673   -1.60667721998460      H 
    2.30634855006934    7.40569431168991    1.10195374440713      H 
    7.80379272604307   -1.72168684171480   -0.70866716402155      H 
    8.56194741757082    3.42318811218261   -1.43489570482951      H 
    5.73951089298459    4.83744829523939    3.41081606788139      H 
    8.65202247492447    6.26858960497304    2.19644608279504      H 
$end
           -------------------------------------------------
          |                Final Singlepoint                |
           -------------------------------------------------

          ...................................................
          :                      SETUP                      :
          :.................................................:
          :  # basis functions                  88          :
          :  # atomic orbitals                  86          :
          :  # shells                           46          :
          :  # electrons                        80          :
          :  max. iterations                   250          :
          :  Hamiltonian                  GFN2-xTB          :
          :  restarted?                      false          :
          :  GBSA solvation                  false          :
          :  PC potential                    false          :
          :  electronic temp.          300.0000000     K    :
          :  accuracy                    1.0000000          :
          :  -> integral cutoff          0.2500000E+02      :
          :  -> integral neglect         0.1000000E-07      :
          :  -> SCF convergence          0.1000000E-05 Eh   :
          :  -> wf. convergence          0.1000000E-03 e    :
          :  Broyden damping             0.4000000          :
          ...................................................

 iter      E             dE          RMSdq      gap      omega  full diag
   1    -43.2671105 -0.432671E+02  0.140E-04    2.87       0.0  T
   2    -43.2671105 -0.680771E-10  0.666E-05    2.87     283.6  T
   3    -43.2671105 -0.293383E-10  0.541E-05    2.87     349.1  T

   *** convergence criteria satisfied after 3 iterations ***

         #    Occupation            Energy/Eh            Energy/eV
      -------------------------------------------------------------
         1        2.0000           -0.7263883             -19.7660
       ...           ...                  ...                  ...
        34        2.0000           -0.4278066             -11.6412
        35        2.0000           -0.4232100             -11.5161
        36        2.0000           -0.4192762             -11.4091
        37        2.0000           -0.4069904             -11.0748
        38        2.0000           -0.3970569             -10.8045
        39        2.0000           -0.3703748             -10.0784
        40        2.0000           -0.3638664              -9.9013 (HOMO)
        41                         -0.2583679              -7.0305 (LUMO)
        42                         -0.2355602              -6.4099
        43                         -0.2226793              -6.0594
        44                         -0.2125999              -5.7851
        45                         -0.1990909              -5.4175
       ...                                ...                  ...
        86                          0.7154925              19.4695
      -------------------------------------------------------------
                  HL-Gap            0.1054985 Eh            2.8708 eV
             Fermi-level           -0.3111172 Eh           -8.4659 eV

 SCC (total)                   0 d,  0 h,  0 min,  0.042 sec
 SCC setup                      ...        0 min,  0.000 sec (  0.573%)
 Dispersion                     ...        0 min,  0.000 sec (  0.673%)
 integral evaluation            ...        0 min,  0.014 sec ( 34.270%)
 zeroth order Hamiltonian       ...        0 min,  0.000 sec (  0.575%)
 iterations                     ...        0 min,  0.005 sec ( 12.521%)
 molecular gradient             ...        0 min,  0.021 sec ( 50.301%)
 printout                       ...        0 min,  0.000 sec (  0.970%)

         :::::::::::::::::::::::::::::::::::::::::::::::::::::
         ::                     SUMMARY                     ::
         :::::::::::::::::::::::::::::::::::::::::::::::::::::
         :: total energy             -42.570700663928 Eh    ::
         :: gradient norm              0.000544085250 Eh/a0 ::
         :: HOMO-LUMO gap              2.870760873199 eV    ::
         ::.................................................::
         :: SCC energy               -43.267110453531 Eh    ::
         :: -> isotropic ES            0.003533321824 Eh    ::
         :: -> anisotropic ES          0.004967817420 Eh    ::
         :: -> anisotropic XC          0.021767098143 Eh    ::
         :: -> dispersion             -0.035517707254 Eh    ::
         :: repulsion energy           0.696173513782 Eh    ::
         :: add. restraining           0.000000000000 Eh    ::
         :::::::::::::::::::::::::::::::::::::::::::::::::::::

           -------------------------------------------------
          |                Property Printout                |
           -------------------------------------------------

    * Orbital Energies and Occupations

         #    Occupation            Energy/Eh            Energy/eV
      -------------------------------------------------------------
         1        2.0000           -0.7263883             -19.7660
       ...           ...                  ...                  ...
        28        2.0000           -0.4629494             -12.5975
        29        2.0000           -0.4607668             -12.5381
        30        2.0000           -0.4576589             -12.4535
        31        2.0000           -0.4563154             -12.4170
        32        2.0000           -0.4405355             -11.9876
        33        2.0000           -0.4343857             -11.8202
        34        2.0000           -0.4278066             -11.6412
        35        2.0000           -0.4232100             -11.5161
        36        2.0000           -0.4192762             -11.4091
        37        2.0000           -0.4069904             -11.0748
        38        2.0000           -0.3970569             -10.8045
        39        2.0000           -0.3703748             -10.0784
        40        2.0000           -0.3638664              -9.9013 (HOMO)
        41                         -0.2583679              -7.0305 (LUMO)
        42                         -0.2355602              -6.4099
        43                         -0.2226793              -6.0594
        44                         -0.2125999              -5.7851
        45                         -0.1990909              -5.4175
        46                         -0.1870770              -5.0906
        47                         -0.1562425              -4.2516
        48                         -0.1153044              -3.1376
        49                         -0.1121861              -3.0527
        50                         -0.0973703              -2.6496
        51                         -0.0055086              -0.1499
       ...                                ...                  ...
        86                          0.7154925              19.4695
      -------------------------------------------------------------
                  HL-Gap            0.1054985 Eh            2.8708 eV
             Fermi-level           -0.3111172 Eh           -8.4659 eV

     #   Z        covCN         q      C6AA      α(0)
     1   6 C      3.080    -0.048    29.103     8.844
     2   6 C      2.934    -0.014    28.360     8.734
     3  16 S      2.247    -0.052   143.205    20.141
     4   6 C      3.029     0.017    27.599     8.617
     5   6 C      3.136    -0.012    28.076     8.673
     6   6 C      2.965    -0.004    28.109     8.696
     7   6 C      3.758    -0.106    22.586     6.776
     8   6 C      2.964    -0.001    28.046     8.687
     9   6 C      3.758    -0.108    22.621     6.781
    10   6 C      3.122    -0.015    28.195     8.696
    11   6 C      3.024     0.017    27.612     8.619
    12  16 S      2.226    -0.055   143.319    20.149
    13   6 C      2.943    -0.021    28.528     8.760
    14   6 C      3.119    -0.002    27.914     8.653
    15   6 C      2.895    -0.024    28.604     8.769
    16   6 C      2.840    -0.086    30.135     8.996
    17   1 H      0.926     0.038     2.475     2.460
    18   1 H      0.926     0.043     2.406     2.425
    19   1 H      0.925     0.045     2.378     2.411
    20   1 H      0.924     0.045     2.388     2.417
    21   1 H      0.925     0.047     2.363     2.404
    22   1 H      0.925     0.047     2.363     2.404
    23   1 H      0.925     0.047     2.353     2.399
    24   1 H      0.925     0.045     2.387     2.416
    25   1 H      0.926     0.041     2.432     2.438
    26   1 H      0.925     0.034     2.525     2.485
    27   1 H      0.926     0.043     2.406     2.426
    28   1 H      0.926     0.038     2.480     2.462

 Mol. C6AA /au·bohr⁶  :      13426.065799
 Mol. C8AA /au·bohr⁸  :     392486.467881
 Mol. α(0) /au        :        187.738518


Wiberg/Mayer (AO) data.
largest (>0.10) Wiberg bond orders for each atom
          total WBO             WBO to atom ...
     1  C   3.985        C    2 1.678    C    5 1.195    H   17 0.959    S    3 0.101
     2  C   3.943        C    1 1.678    S    3 1.153    H   18 0.970
     3  S   2.556        C    2 1.153    C    4 1.111    C    1 0.101
     4  C   3.955        C   11 1.328    C    5 1.305    S    3 1.111
     5  C   3.984        C    4 1.305    C    6 1.268    C    1 1.195
     6  C   3.987        C    8 1.480    C    5 1.268    C    7 1.024
     7  C   3.995        C    6 1.024    H   19 0.979    H   21 0.977    H   20 0.966
     8  C   3.987        C    6 1.480    C   10 1.269    C    9 1.025
     9  C   3.995        C    8 1.025    H   23 0.977    H   22 0.976    H   24 0.965
    10  C   3.982        C   11 1.308    C    8 1.269    C   14 1.160
    11  C   3.955        C    4 1.328    C   10 1.308    S   12 1.108
    12  S   2.569        C   13 1.157    C   11 1.108
    13  C   3.938        C   14 1.612    S   12 1.157    H   25 0.970
    14  C   3.982        C   13 1.612    C   10 1.160    C   15 1.044
    15  C   3.991        C   16 1.936    C   14 1.044    H   26 0.959
    16  C   3.990        C   15 1.936    H   28 0.977    H   27 0.976
    17  H   0.998        C    1 0.959
    18  H   0.997        C    2 0.970
    19  H   0.997        C    7 0.979
    20  H   0.996        C    7 0.966
    21  H   0.996        C    7 0.977
    22  H   0.996        C    9 0.976
    23  H   0.997        C    9 0.977
    24  H   0.996        C    9 0.965
    25  H   0.998        C   13 0.970
    26  H   0.998        C   15 0.959
    27  H   0.998        C   16 0.976
    28  H   0.997        C   16 0.977

molecular dipole:
                 x           y           z       tot (Debye)
 q only:       -0.062       0.784       0.013
   full:       -0.084       1.160       0.033       2.958
molecular quadrupole (traceless):
                xx          xy          yy          xz          yz          zz
 q only:        2.789       0.535       1.173      -0.562      -0.074      -3.962
  q+dip:        8.176       1.293      -1.757      -1.601       0.531      -6.418
   full:        7.216       0.933      -2.718      -1.023      -0.131      -4.498

           -------------------------------------------------
          |                Geometry Summary                 |
           -------------------------------------------------

      molecular mass/u    :      244.3688000
   center of mass at/Å    :        0.3548405       0.3625635      -0.0287153
  moments of inertia/u·Å² :        0.7410828E+03   0.1276703E+04   0.1963984E+04
rotational constants/cm⁻¹ :        0.2274730E-01   0.1320403E-01   0.8583387E-02

 * 27 selected distances

     #   Z        #   Z                                     value/Å
     1   6 C      2   6 C                                 1.3491379
     2   6 C      3  16 S                                 1.7295524
     3  16 S      4   6 C                                 1.7370092 (max)
     1   6 C      5   6 C                                 1.4281079
     4   6 C      5   6 C                                 1.4035809
     5   6 C      6   6 C                                 1.4114467
     6   6 C      8   6 C                                 1.3848083
     8   6 C     10   6 C                                 1.4158821
     4   6 C     11   6 C                                 1.3855776
    10   6 C     11   6 C                                 1.4067576
    11   6 C     12  16 S                                 1.7360203
    12  16 S     13   6 C                                 1.7231786
    10   6 C     14   6 C                                 1.4408511
    13   6 C     14   6 C                                 1.3587954
    15   6 C     16   6 C                                 1.3240149
     1   6 C     17   1 H                                 1.0748423
     2   6 C     18   1 H                                 1.0725020 (min)
     7   6 C     19   1 H                                 1.0852654
     7   6 C     20   1 H                                 1.0908891
     7   6 C     21   1 H                                 1.0872747
     9   6 C     22   1 H                                 1.0876407
     9   6 C     23   1 H                                 1.0849071
     9   6 C     24   1 H                                 1.0901181
    13   6 C     25   1 H                                 1.0730683
    15   6 C     26   1 H                                 1.0836693
    16   6 C     27   1 H                                 1.0774217
    16   6 C     28   1 H                                 1.0766925

 * 3 distinct bonds (by element types)

   Z      Z             #   av. dist./Å        max./Å        min./Å
   1 H    6 C          12     1.0820243     1.0908891     1.0725020
   6 C    6 C          11     1.3917237     1.4408511     1.3240149
   6 C   16 S           4     1.7314401     1.7370092     1.7231786


optimized geometry written to: xtbopt.xyz


           -------------------------------------------------
          | TOTAL ENERGY              -42.570700663928 Eh   |
          | GRADIENT NORM               0.000544085250 Eh/α |
          | HOMO-LUMO GAP               2.870760873199 eV   |
           -------------------------------------------------

------------------------------------------------------------------------
 * finished run on 2021/05/19 at 11:00:26.641     
------------------------------------------------------------------------
 total:
 * wall-time:     0 d,  0 h,  0 min,  1.152 sec
 *  cpu-time:     0 d,  0 h,  0 min,  1.151 sec
 * ratio c/w:     0.999 speedup
 SCF:
 * wall-time:     0 d,  0 h,  0 min,  0.057 sec
 *  cpu-time:     0 d,  0 h,  0 min,  0.057 sec
 * ratio c/w:     1.000 speedup
 ANC optimizer:
 * wall-time:     0 d,  0 h,  0 min,  1.068 sec
 *  cpu-time:     0 d,  0 h,  0 min,  1.068 sec
 * ratio c/w:     1.000 speedup

