      -----------------------------------------------------------      
     |                   =====================                   |     
     |                           x T B                           |     
     |                   =====================                   |     
     |                         S. Grimme                         |     
     |          Mulliken Center for Theoretical Chemistry        |     
     |                    University of Bonn                     |     
     |                Version 6.2 RC2 (SAW190805)                |     
      -----------------------------------------------------------      

   This program is distributed in the hope that it will be useful,
   but WITHOUT ANY WARRANTY; without even the implied warranty of
   MERCHANTABILITY or FITNESS FOR A PARTICULAR PURPOSE.
   
   FOR NON-COMMERCIAL, ACADEMIA USE ONLY.
   
   Cite this work as:
   * S. Grimme, C. Bannwarth, P. Shushkov, J. Chem. Theory Comput., 2017,
     13, 1989-2009. DOI: 10.1021/acs.jctc.7b00118
   * C. Bannwarth, S. Ehlert and S. Grimme., J. Chem. Theory Comput., 2019,
     15, 1652-1671. DOI: 10.1021/acs.jctc.8b01176
   * P. Pracht, E. Caldeweyher, S. Ehlert, S. Grimme, ChemRxiv, 2019, preprint.
     DOI: 10.26434/chemrxiv.8326202.v1
   
   for DFT-D4:
   * E. Caldeweyher, C. Bannwarth and S. Grimme, J. Chem. Phys., 2017,
     147, 034112. DOI: 10.1063/1.4993215
   * E. Caldeweyher, S. Ehlert, A. Hansen, H. Neugebauer, S. Spicher,
     C. Bannwarth and S. Grimme, J. Chem. Phys., 2019, 150, 154122.
     DOI: 10.1063/1.5090222
   
   for sTDA-xTB:
   * S. Grimme and C. Bannwarth, J. Chem. Phys., 2016, 145, 054103.
     DOI: 10.1063/1.4959605
   
   in the mass-spec context:
   * V. Asgeirsson, C. Bauer and S. Grimme, Chem. Sci., 2017, 8, 4879.
     DOI: 10.1039/c7sc00601b
   
   for metadynamics refer to:
   * S. Grimme, J. Chem. Theory Comput., 2019, 155, 2847-2862
     DOI: 10.1021/acs.jctc.9b00143
   
   with help from (in alphabetical order)
   C. Bannwarth, F. Bohle, G. Brandenburg, E. Caldeweyher, M. Checinski,
   S. Dohm, S. Ehlert, S. Ehrlich, F. März, H. Neugebauer, J. Pisarek,
   P. Pracht, P. Shushkov, and S. Spicher.
   
 * started run on 2021/05/19 at 11:00:27.122     

           -------------------------------------------------
          |                Calculation Setup                |
           -------------------------------------------------

          program call               : /ihome/ghutchison/geoffh/xtb/xtb 829.xyz -opt
          hostname                   : smp-n83
          coordinate file            : 829.xyz
          omp threads                :                     1
          number of atoms            :                    17
          number of electrons        :                    46
          charge                     :                     0
          spin                       :                   0.0
          first test random number   :      0.82567562124805


########################################################################
# WARNING! Please study the warnings concerning your input carefully
#  - the use of '-opt' is discouraged, please use '--opt' next time
########################################################################

           ------------------------------------------------- 
          |                 G F N 2 - x T B                 |
          | Geometry, Frequencies, Noncovalent interactions |
          |            JCTC 2019 parametrisation            |
           ------------------------------------------------- 
             KAB for C  - Si     :                1.0500
             KAB for H  - Pd     :                0.9500
             k(s)              :                1.8500
             k(p)              :                2.2300
             k(d)              :                2.2300
             k(f)              :                2.0000
             kEN (H0ij)        :               -2.0000
             D4 a1             :                0.5200
             D4 a2             :                5.0000
             D4 s6             :                1.0000
             D4 s8             :                2.7000
             D4 s9             :                5.0000
             alphaj            :                2.0000

  Z AO/shell   Hii/eV     exponent
  1     Wed Apr 25 08:07:45 CEST 2018   EN: 2.200 GM2: 0.406  GM3: 0.0800  RAES: 1.40
     1s    -10.707211    1.230000
  6     Wed Apr 25 08:07:45 CEST 2018   EN: 2.550 GM2: 0.538  GM3: 0.1500  RAES: 3.00
     2s    -13.970922    2.096432
     2p    -10.063292    1.800000
 16     Tue Apr 24 11:44:34 CEST 2018   EN: 2.580 GM2: 0.340  GM3:-0.0502  RAES: 3.10
     3s    -20.029654    1.981333
     3p    -11.377694    2.025643
     3d     -0.420282    1.702555

           ------------------------------------------------- 
          |        Self-Consistent Charge Iterations        |
           ------------------------------------------------- 

          ...................................................
          :                      SETUP                      :
          :.................................................:
          :  # basis functions                  50          :
          :  # atomic orbitals                  49          :
          :  # shells                           27          :
          :  # electrons                        46          :
          :  max. iterations                   250          :
          :  Hamiltonian                  GFN2-xTB          :
          :  restarted?                      false          :
          :  GBSA solvation                  false          :
          :  PC potential                    false          :
          :  electronic temp.          300.0000000     K    :
          :  accuracy                    1.0000000          :
          :  -> integral cutoff          0.2500000E+02      :
          :  -> integral neglect         0.1000000E-07      :
          :  -> SCF convergence          0.1000000E-05 Eh   :
          :  -> wf. convergence          0.1000000E-03 e    :
          :  Broyden damping             0.4000000          :
          ...................................................

 iter      E             dE          RMSdq      gap      omega  full diag
   1    -24.7751846 -0.247752E+02  0.409E+00    3.84       0.0  T
   2    -24.7900689 -0.148842E-01  0.234E+00    3.77       1.0  T
   3    -24.7876293  0.243954E-02  0.733E-01    3.86       1.0  T
   4    -24.7900059 -0.237660E-02  0.366E-01    3.68       1.0  T
   5    -24.7914686 -0.146270E-02  0.105E-01    3.74       1.0  T
   6    -24.7915215 -0.529074E-04  0.278E-02    3.75       1.0  T
   7    -24.7915222 -0.673694E-06  0.123E-02    3.75       2.0  T
   8    -24.7915221  0.416887E-07  0.450E-03    3.74       5.4  T
   9    -24.7915222 -0.910987E-07  0.258E-03    3.75       9.4  T
  10    -24.7915223 -0.555309E-07  0.580E-04    3.75      41.8  T
  11    -24.7915223 -0.646939E-09  0.278E-04    3.75      87.1  T

   *** convergence criteria satisfied after 11 iterations ***

         #    Occupation            Energy/Eh            Energy/eV
      -------------------------------------------------------------
         1        2.0000           -0.7237134             -19.6932
       ...           ...                  ...                  ...
        17        2.0000           -0.4618605             -12.5679
        18        2.0000           -0.4471103             -12.1665
        19        2.0000           -0.4285511             -11.6615
        20        2.0000           -0.4269996             -11.6193
        21        2.0000           -0.3975589             -10.8181
        22        2.0000           -0.3791363             -10.3168
        23        2.0000           -0.3745578             -10.1922 (HOMO)
        24                         -0.2369271              -6.4471 (LUMO)
        25                         -0.2047575              -5.5717
        26                         -0.1920134              -5.2249
        27                         -0.1665943              -4.5333
        28                         -0.1070132              -2.9120
       ...                                ...                  ...
        49                          0.6752087              18.3734
      -------------------------------------------------------------
                  HL-Gap            0.1376307 Eh            3.7451 eV
             Fermi-level           -0.3057424 Eh           -8.3197 eV

 SCC (total)                   0 d,  0 h,  0 min,  0.022 sec
 SCC setup                      ...        0 min,  0.000 sec (  1.077%)
 Dispersion                     ...        0 min,  0.000 sec (  0.938%)
 integral evaluation            ...        0 min,  0.005 sec ( 23.013%)
 zeroth order Hamiltonian       ...        0 min,  0.000 sec (  0.478%)
 iterations                     ...        0 min,  0.008 sec ( 38.166%)
 molecular gradient             ...        0 min,  0.008 sec ( 34.852%)
 printout                       ...        0 min,  0.000 sec (  1.252%)

         :::::::::::::::::::::::::::::::::::::::::::::::::::::
         ::                     SUMMARY                     ::
         :::::::::::::::::::::::::::::::::::::::::::::::::::::
         :: total energy             -24.422716378973 Eh    ::
         :: gradient norm              0.053503062963 Eh/a0 ::
         :: HOMO-LUMO gap              3.745122995318 eV    ::
         ::.................................................::
         :: SCC energy               -24.791522294258 Eh    ::
         :: -> isotropic ES            0.001820512308 Eh    ::
         :: -> anisotropic ES          0.002462200297 Eh    ::
         :: -> anisotropic XC          0.013411801306 Eh    ::
         :: -> dispersion             -0.015671524450 Eh    ::
         :: repulsion energy           0.368749540565 Eh    ::
         :: add. restraining           0.000000000000 Eh    ::
         :::::::::::::::::::::::::::::::::::::::::::::::::::::

      ----------------------------------------------------------- 
     |                   =====================                   |
     |                        A N C O P T                        |
     |                   =====================                   |
     |               Approximate Normal Coordinate               |
     |                Rational Function Optimizer                |
      ----------------------------------------------------------- 

          ...................................................
          :                      SETUP                      :
          :.................................................:
          :   optimization level            normal          :
          :   max. optcycles                   200          :
          :   ANC micro-cycles                  20          :
          :   degrees of freedom                45          :
          :.................................................:
          :   RF solver                   davidson          :
          :   input Hessian                  false          :
          :   write xtbopt.log                true          :
          :   linear?                        false          :
          :   energy convergence         0.5000000E-05 Eh   :
          :   grad. convergence          0.1000000E-02 Eh/α :
          :   maximium RF displ.         2.0000000          :
          :   Hlow (freq-cutoff)         0.5000000E-02      :
          :   Hmax (freq-cutoff)         5.0000000          :
          :   S6 in model hess.         20.0000000          :
          ...................................................

generating ANC from model Hessian ...
Using Lindh-Hessian (1995)
 Shifting diagonal of input Hessian by   0.000000000000000E+000
 Lowest  eigenvalues of input Hessian
   -0.000000   -0.000000   -0.000000    0.000000    0.000000    0.000000
    0.005563    0.006981    0.014794    0.017323    0.020103    0.028591
    0.031149    0.043405    0.044615    0.053864    0.056266    0.060480
 Highest eigenvalues
    1.431820    1.497522    1.631454    1.732020    1.814885    1.823581
 

........................................................................
.............................. CYCLE    1 ..............................
........................................................................
   1    -24.7915223 -0.247915E+02  0.537E-05    3.75       0.0  T
   2    -24.7915223 -0.541434E-11  0.424E-05    3.75     571.7  T
   3    -24.7915223 -0.193623E-10  0.159E-05    3.75    1520.7  T
     SCC iter.                  ...        0 min,  0.003 sec
     gradient                   ...        0 min,  0.008 sec
 * total energy  :   -24.4227164 Eh     change       -0.2218047E-07 Eh
   gradient norm :     0.0535035 Eh/α   predicted     0.0000000E+00 (-100.00%)
   displ. norm   :     0.1501289 α      lambda       -0.4120893E-02
   maximum displ.:     0.0806244 α      in ANC's #8, #15, #26, ...

........................................................................
.............................. CYCLE    2 ..............................
........................................................................
   1    -24.8177059 -0.248177E+02  0.188E-01    3.82       0.0  T
   2    -24.8177461 -0.401656E-04  0.920E-02    3.82       1.0  T
   3    -24.8177369  0.918937E-05  0.479E-02    3.81       1.0  T
   4    -24.8177607 -0.238175E-04  0.196E-02    3.82       1.2  T
   5    -24.8177633 -0.261278E-05  0.699E-03    3.82       3.5  T
   6    -24.8177634 -0.603981E-07  0.833E-04    3.82      29.1  T
   7    -24.8177634 -0.198830E-08  0.420E-04    3.82      57.8  T
     SCC iter.                  ...        0 min,  0.005 sec
     gradient                   ...        0 min,  0.007 sec
 * total energy  :   -24.4251537 Eh     change       -0.2437268E-02 Eh
   gradient norm :     0.0136952 Eh/α   predicted    -0.2106883E-02 ( -13.56%)
   displ. norm   :     0.0330977 α      lambda       -0.2337159E-03
   maximum displ.:     0.0152768 α      in ANC's #8, #15, #26, ...

........................................................................
.............................. CYCLE    3 ..............................
........................................................................
   1    -24.8222826 -0.248223E+02  0.701E-02    3.83       0.0  T
   2    -24.8222893 -0.664720E-05  0.327E-02    3.83       1.0  T
   3    -24.8222887  0.612391E-06  0.178E-02    3.83       1.4  T
   4    -24.8222921 -0.347027E-05  0.700E-03    3.83       3.5  T
   5    -24.8222924 -0.287950E-06  0.262E-03    3.83       9.2  T
   6    -24.8222924 -0.104864E-07  0.273E-04    3.83      88.7  T
     SCC iter.                  ...        0 min,  0.004 sec
     gradient                   ...        0 min,  0.007 sec
 * total energy  :   -24.4252817 Eh     change       -0.1280017E-03 Eh
   gradient norm :     0.0045438 Eh/α   predicted    -0.1169846E-03 (  -8.61%)
   displ. norm   :     0.0168992 α      lambda       -0.2964177E-04
   maximum displ.:     0.0109072 α      in ANC's #3, #5, #17, ...

........................................................................
.............................. CYCLE    4 ..............................
........................................................................
   1    -24.8219007 -0.248219E+02  0.328E-02    3.82       0.0  T
   2    -24.8219018 -0.110376E-05  0.156E-02    3.82       1.6  T
   3    -24.8219015  0.336606E-06  0.870E-03    3.82       2.8  T
   4    -24.8219023 -0.820170E-06  0.309E-03    3.82       7.9  T
   5    -24.8219024 -0.488631E-07  0.109E-03    3.82      22.2  T
   6    -24.8219024 -0.129321E-08  0.138E-04    3.82     176.0  T
     SCC iter.                  ...        0 min,  0.004 sec
     gradient                   ...        0 min,  0.007 sec
 * total energy  :   -24.4252999 Eh     change       -0.1818185E-04 Eh
   gradient norm :     0.0021265 Eh/α   predicted    -0.1482458E-04 ( -18.46%)
   displ. norm   :     0.0113937 α      lambda       -0.1224061E-04
   maximum displ.:     0.0060356 α      in ANC's #2, #8, #17, ...

........................................................................
.............................. CYCLE    5 ..............................
........................................................................
   1    -24.8211361 -0.248211E+02  0.202E-02    3.82       0.0  T
   2    -24.8211366 -0.503920E-06  0.950E-03    3.82       2.6  T
   3    -24.8211365  0.941656E-07  0.548E-03    3.82       4.4  T
   4    -24.8211368 -0.304471E-06  0.200E-03    3.82      12.1  T
   5    -24.8211368 -0.215184E-07  0.673E-04    3.82      36.1  T
   6    -24.8211368 -0.529521E-09  0.135E-04    3.82     179.4  T
     SCC iter.                  ...        0 min,  0.004 sec
     gradient                   ...        0 min,  0.008 sec
 * total energy  :   -24.4253060 Eh     change       -0.6176426E-05 Eh
   gradient norm :     0.0005430 Eh/α   predicted    -0.6122289E-05 (  -0.88%)
   displ. norm   :     0.0073496 α      lambda       -0.1016043E-05
   maximum displ.:     0.0056847 α      in ANC's #2, #8, #3, ...

........................................................................
.............................. CYCLE    6 ..............................
........................................................................
   1    -24.8210041 -0.248210E+02  0.577E-03    3.82       0.0  T
   2    -24.8210041 -0.102399E-07  0.326E-03    3.82       7.4  T
   3    -24.8210041  0.637373E-08  0.925E-04    3.82      26.2  T
   4    -24.8210041 -0.646561E-08  0.411E-04    3.82      59.0  T
     SCC iter.                  ...        0 min,  0.003 sec
     gradient                   ...        0 min,  0.008 sec
 * total energy  :   -24.4253068 Eh     change       -0.7211792E-06 Eh
   gradient norm :     0.0002228 Eh/α   predicted    -0.5077839E-06 ( -29.59%)
   displ. norm   :     0.0065148 α      lambda       -0.2767394E-06
   maximum displ.:     0.0061953 α      in ANC's #2, #3, #20, ...

   *** GEOMETRY OPTIMIZATION CONVERGED AFTER 6 ITERATIONS ***

------------------------------------------------------------------------
 total energy gain   :        -0.0025904 Eh       -1.6255 kcal/mol
 total RMSD          :         0.0417200 a0        0.0221 Å
 total power (kW/mol):        -1.1335032 (step)  -64.5919 (real)
------------------------------------------------------------------------

 ANCopt (total)                0 d,  0 h,  0 min,  0.105 sec
 optimizer setup                ...        0 min,  0.000 sec (  0.112%)
 model hessian                  ...        0 min,  0.003 sec (  3.300%)
 ANC generation                 ...        0 min,  0.000 sec (  0.440%)
 coordinate transformation      ...        0 min,  0.000 sec (  0.075%)
 single point calculation       ...        0 min,  0.099 sec ( 93.992%)
 optimization log               ...        0 min,  0.000 sec (  0.468%)
 hessian update                 ...        0 min,  0.000 sec (  0.067%)
 rational function              ...        0 min,  0.001 sec (  1.109%)

================
 final structure:
================
$coord
    4.09657307360242    1.24630306217035   -0.16108040076569      C 
    4.08295326276772   -1.25107398277452   -0.16074935135651      C 
    1.77094247531141   -2.85264408889435    0.15149501831722      C 
   -0.60284535426428   -1.32067673408091    0.08601369553115      C 
   -2.98418215242929   -2.27777233722182    0.01172083267841      C 
   -5.25412042098620    0.04859932557830   -0.05589110703602      S 
   -2.95892671057852    2.35007908073336    0.01092242173618      C 
   -0.58818193254215    1.36706164278778    0.08562735079788      C 
    1.80218721327618    2.87304676905034    0.15100508483688      C 
    5.85640918599731    2.26295041237168   -0.37803759322976      H 
    5.83160186868408   -2.28690110848843   -0.37740558824646      H 
    1.89629415563929   -3.87207956504201    1.95315731645621      H 
    1.72073455866776   -4.29365213855823   -1.33380735625275      H 
   -3.55426111353311   -4.22169378271047   -0.00986807566450      H 
   -3.50770950559307    4.30010218295872   -0.01135493598966      H 
    1.93863728461169    3.89101690227944    1.95269919746904      H 
    1.76770226707069    4.31451936208368   -1.33426284832839      H 
$end
           -------------------------------------------------
          |                Final Singlepoint                |
           -------------------------------------------------

          ...................................................
          :                      SETUP                      :
          :.................................................:
          :  # basis functions                  50          :
          :  # atomic orbitals                  49          :
          :  # shells                           27          :
          :  # electrons                        46          :
          :  max. iterations                   250          :
          :  Hamiltonian                  GFN2-xTB          :
          :  restarted?                      false          :
          :  GBSA solvation                  false          :
          :  PC potential                    false          :
          :  electronic temp.          300.0000000     K    :
          :  accuracy                    1.0000000          :
          :  -> integral cutoff          0.2500000E+02      :
          :  -> integral neglect         0.1000000E-07      :
          :  -> SCF convergence          0.1000000E-05 Eh   :
          :  -> wf. convergence          0.1000000E-03 e    :
          :  Broyden damping             0.4000000          :
          ...................................................

 iter      E             dE          RMSdq      gap      omega  full diag
   1    -24.8210041 -0.248210E+02  0.216E-04    3.82       0.0  T
   2    -24.8210041 -0.178844E-10  0.969E-05    3.82     250.2  T
   3    -24.8210041  0.348344E-10  0.917E-05    3.82     264.4  T

   *** convergence criteria satisfied after 3 iterations ***

         #    Occupation            Energy/Eh            Energy/eV
      -------------------------------------------------------------
         1        2.0000           -0.7227974             -19.6683
       ...           ...                  ...                  ...
        17        2.0000           -0.4634397             -12.6108
        18        2.0000           -0.4479029             -12.1881
        19        2.0000           -0.4287072             -11.6657
        20        2.0000           -0.4268284             -11.6146
        21        2.0000           -0.3996787             -10.8758
        22        2.0000           -0.3816562             -10.3854
        23        2.0000           -0.3761804             -10.2364 (HOMO)
        24                         -0.2358126              -6.4168 (LUMO)
        25                         -0.1993085              -5.4235
        26                         -0.1938959              -5.2762
        27                         -0.1599242              -4.3518
        28                         -0.1071427              -2.9155
       ...                                ...                  ...
        49                          0.7002579              19.0550
      -------------------------------------------------------------
                  HL-Gap            0.1403678 Eh            3.8196 eV
             Fermi-level           -0.3059965 Eh           -8.3266 eV

 SCC (total)                   0 d,  0 h,  0 min,  0.016 sec
 SCC setup                      ...        0 min,  0.000 sec (  0.975%)
 Dispersion                     ...        0 min,  0.000 sec (  0.765%)
 integral evaluation            ...        0 min,  0.005 sec ( 29.993%)
 zeroth order Hamiltonian       ...        0 min,  0.000 sec (  0.639%)
 iterations                     ...        0 min,  0.003 sec ( 16.238%)
 molecular gradient             ...        0 min,  0.008 sec ( 49.391%)
 printout                       ...        0 min,  0.000 sec (  1.692%)

         :::::::::::::::::::::::::::::::::::::::::::::::::::::
         ::                     SUMMARY                     ::
         :::::::::::::::::::::::::::::::::::::::::::::::::::::
         :: total energy             -24.425306794709 Eh    ::
         :: gradient norm              0.000222056738 Eh/a0 ::
         :: HOMO-LUMO gap              3.819601813533 eV    ::
         ::.................................................::
         :: SCC energy               -24.821004084906 Eh    ::
         :: -> isotropic ES            0.001838748816 Eh    ::
         :: -> anisotropic ES          0.002279854691 Eh    ::
         :: -> anisotropic XC          0.012983128049 Eh    ::
         :: -> dispersion             -0.015759120068 Eh    ::
         :: repulsion energy           0.395641815537 Eh    ::
         :: add. restraining           0.000000000000 Eh    ::
         :::::::::::::::::::::::::::::::::::::::::::::::::::::

           -------------------------------------------------
          |                Property Printout                |
           -------------------------------------------------

    * Orbital Energies and Occupations

         #    Occupation            Energy/Eh            Energy/eV
      -------------------------------------------------------------
         1        2.0000           -0.7227974             -19.6683
       ...           ...                  ...                  ...
        11        2.0000           -0.5141267             -13.9901
        12        2.0000           -0.5058548             -13.7650
        13        2.0000           -0.4908739             -13.3574
        14        2.0000           -0.4756509             -12.9431
        15        2.0000           -0.4748752             -12.9220
        16        2.0000           -0.4659963             -12.6804
        17        2.0000           -0.4634397             -12.6108
        18        2.0000           -0.4479029             -12.1881
        19        2.0000           -0.4287072             -11.6657
        20        2.0000           -0.4268284             -11.6146
        21        2.0000           -0.3996787             -10.8758
        22        2.0000           -0.3816562             -10.3854
        23        2.0000           -0.3761804             -10.2364 (HOMO)
        24                         -0.2358126              -6.4168 (LUMO)
        25                         -0.1993085              -5.4235
        26                         -0.1938959              -5.2762
        27                         -0.1599242              -4.3518
        28                         -0.1071427              -2.9155
        29                          0.0056450               0.1536
        30                          0.0374705               1.0196
        31                          0.0419845               1.1425
        32                          0.1025004               2.7892
        33                          0.1040409               2.8311
        34                          0.1140384               3.1031
       ...                                ...                  ...
        49                          0.7002579              19.0550
      -------------------------------------------------------------
                  HL-Gap            0.1403678 Eh            3.8196 eV
             Fermi-level           -0.3059965 Eh           -8.3266 eV

     #   Z        covCN         q      C6AA      α(0)
     1   6 C      2.892    -0.038    28.947     8.821
     2   6 C      2.892    -0.038    28.947     8.821
     3   6 C      3.809    -0.052    21.504     6.601
     4   6 C      3.166    -0.005    27.795     8.615
     5   6 C      2.942    -0.035    28.865     8.812
     6  16 S      2.293    -0.049   143.086    20.133
     7   6 C      2.942    -0.035    28.865     8.812
     8   6 C      3.166    -0.005    27.795     8.615
     9   6 C      3.809    -0.052    21.504     6.601
    10   1 H      0.925     0.026     2.649     2.545
    11   1 H      0.925     0.026     2.649     2.545
    12   1 H      0.924     0.048     2.347     2.396
    13   1 H      0.924     0.044     2.394     2.420
    14   1 H      0.926     0.037     2.488     2.466
    15   1 H      0.926     0.037     2.488     2.466
    16   1 H      0.924     0.048     2.347     2.396
    17   1 H      0.924     0.044     2.394     2.420

 Mol. C6AA /au·bohr⁶  :       4325.947016
 Mol. C8AA /au·bohr⁸  :     121937.077981
 Mol. α(0) /au        :        105.484328


Wiberg/Mayer (AO) data.
largest (>0.10) Wiberg bond orders for each atom
          total WBO             WBO to atom ...
     1  C   3.991        C    2 1.929    C    9 1.022    H   10 0.967
     2  C   3.991        C    1 1.929    C    3 1.022    H   11 0.967
     3  C   3.999        C    2 1.022    C    4 1.007    H   13 0.955    H   12 0.945
     4  C   3.986        C    5 1.607    C    8 1.223    C    3 1.007
     5  C   3.943        C    4 1.607    S    6 1.182    H   14 0.971    C    7 0.120
     6  S   2.620        C    5 1.182    C    7 1.182
     7  C   3.943        C    8 1.607    S    6 1.182    H   15 0.971    C    5 0.120
     8  C   3.986        C    7 1.607    C    4 1.223    C    9 1.007
     9  C   3.999        C    1 1.022    C    8 1.007    H   17 0.955    H   16 0.945
    10  H   0.998        C    1 0.967
    11  H   0.998        C    2 0.967
    12  H   0.998        C    3 0.945
    13  H   0.998        C    3 0.955
    14  H   0.998        C    5 0.971
    15  H   0.998        C    7 0.971
    16  H   0.998        C    9 0.945
    17  H   0.998        C    9 0.955

molecular dipole:
                 x           y           z       tot (Debye)
 q only:        0.348      -0.002       0.046
   full:        0.610      -0.003       0.062       1.559
molecular quadrupole (traceless):
                xx          xy          yy          xz          yz          zz
 q only:       -2.207       0.040       3.204       0.078       0.001      -0.997
  q+dip:       -5.091       0.086       7.309      -0.040       0.001      -2.218
   full:       -5.502       0.083       6.349       0.016       0.001      -0.847

           -------------------------------------------------
          |                Geometry Summary                 |
           -------------------------------------------------

      molecular mass/u    :      136.2112000
   center of mass at/Å    :       -0.3921116       0.0126901       0.0030080
  moments of inertia/u·Å² :        0.1495647E+03   0.4564298E+03   0.5987106E+03
rotational constants/cm⁻¹ :        0.1127113E+00   0.3693368E-01   0.2815656E-01

 * 16 selected distances

     #   Z        #   Z                                     value/Å
     1   6 C      2   6 C                                 1.3215748
     3   6 C      4   6 C                                 1.4954366
     4   6 C      5   6 C                                 1.3586894
     5   6 C      6  16 S                                 1.7203712 (max)
     6  16 S      7   6 C                                 1.7203704
     4   6 C      8   6 C                                 1.4223112
     7   6 C      8   6 C                                 1.3586913
     8   6 C      9   6 C                                 1.4954413
     1   6 C     10   1 H                                 1.0816033
     2   6 C     11   1 H                                 1.0816013
     3   6 C     12   1 H                                 1.0974464
     3   6 C     13   1 H                                 1.0954286
     5   6 C     14   1 H                                 1.0720623
     7   6 C     15   1 H                                 1.0720574 (min)
     9   6 C     16   1 H                                 1.0974508
     9   6 C     17   1 H                                 1.0954165

 * 3 distinct bonds (by element types)

   Z      Z             #   av. dist./Å        max./Å        min./Å
   1 H    6 C           8     1.0866333     1.0974508     1.0720574
   6 C    6 C           6     1.4086908     1.4954413     1.3215748
   6 C   16 S           2     1.7203708     1.7203712     1.7203704


optimized geometry written to: xtbopt.xyz


           -------------------------------------------------
          | TOTAL ENERGY              -24.425306794709 Eh   |
          | GRADIENT NORM               0.000222056738 Eh/α |
          | HOMO-LUMO GAP               3.819601813533 eV   |
           -------------------------------------------------

------------------------------------------------------------------------
 * finished run on 2021/05/19 at 11:00:27.282     
------------------------------------------------------------------------
 total:
 * wall-time:     0 d,  0 h,  0 min,  0.160 sec
 *  cpu-time:     0 d,  0 h,  0 min,  0.160 sec
 * ratio c/w:     0.997 speedup
 SCF:
 * wall-time:     0 d,  0 h,  0 min,  0.022 sec
 *  cpu-time:     0 d,  0 h,  0 min,  0.022 sec
 * ratio c/w:     0.999 speedup
 ANC optimizer:
 * wall-time:     0 d,  0 h,  0 min,  0.121 sec
 *  cpu-time:     0 d,  0 h,  0 min,  0.121 sec
 * ratio c/w:     0.999 speedup

