      -----------------------------------------------------------      
     |                   =====================                   |     
     |                           x T B                           |     
     |                   =====================                   |     
     |                         S. Grimme                         |     
     |          Mulliken Center for Theoretical Chemistry        |     
     |                    University of Bonn                     |     
     |                Version 6.2 RC2 (SAW190805)                |     
      -----------------------------------------------------------      

   This program is distributed in the hope that it will be useful,
   but WITHOUT ANY WARRANTY; without even the implied warranty of
   MERCHANTABILITY or FITNESS FOR A PARTICULAR PURPOSE.
   
   FOR NON-COMMERCIAL, ACADEMIA USE ONLY.
   
   Cite this work as:
   * S. Grimme, C. Bannwarth, P. Shushkov, J. Chem. Theory Comput., 2017,
     13, 1989-2009. DOI: 10.1021/acs.jctc.7b00118
   * C. Bannwarth, S. Ehlert and S. Grimme., J. Chem. Theory Comput., 2019,
     15, 1652-1671. DOI: 10.1021/acs.jctc.8b01176
   * P. Pracht, E. Caldeweyher, S. Ehlert, S. Grimme, ChemRxiv, 2019, preprint.
     DOI: 10.26434/chemrxiv.8326202.v1
   
   for DFT-D4:
   * E. Caldeweyher, C. Bannwarth and S. Grimme, J. Chem. Phys., 2017,
     147, 034112. DOI: 10.1063/1.4993215
   * E. Caldeweyher, S. Ehlert, A. Hansen, H. Neugebauer, S. Spicher,
     C. Bannwarth and S. Grimme, J. Chem. Phys., 2019, 150, 154122.
     DOI: 10.1063/1.5090222
   
   for sTDA-xTB:
   * S. Grimme and C. Bannwarth, J. Chem. Phys., 2016, 145, 054103.
     DOI: 10.1063/1.4959605
   
   in the mass-spec context:
   * V. Asgeirsson, C. Bauer and S. Grimme, Chem. Sci., 2017, 8, 4879.
     DOI: 10.1039/c7sc00601b
   
   for metadynamics refer to:
   * S. Grimme, J. Chem. Theory Comput., 2019, 155, 2847-2862
     DOI: 10.1021/acs.jctc.9b00143
   
   with help from (in alphabetical order)
   C. Bannwarth, F. Bohle, G. Brandenburg, E. Caldeweyher, M. Checinski,
   S. Dohm, S. Ehlert, S. Ehrlich, F. März, H. Neugebauer, J. Pisarek,
   P. Pracht, P. Shushkov, and S. Spicher.
   
 * started run on 2021/05/19 at 11:00:29.571     

           -------------------------------------------------
          |                Calculation Setup                |
           -------------------------------------------------

          program call               : /ihome/ghutchison/geoffh/xtb/xtb 837.xyz -opt
          hostname                   : smp-n83
          coordinate file            : 837.xyz
          omp threads                :                     1
          number of atoms            :                    22
          number of electrons        :                    88
          charge                     :                     0
          spin                       :                   0.0
          first test random number   :      0.45015097654556


########################################################################
# WARNING! Please study the warnings concerning your input carefully
#  - the use of '-opt' is discouraged, please use '--opt' next time
########################################################################

           ------------------------------------------------- 
          |                 G F N 2 - x T B                 |
          | Geometry, Frequencies, Noncovalent interactions |
          |            JCTC 2019 parametrisation            |
           ------------------------------------------------- 
             KAB for C  - Si     :                1.0500
             KAB for H  - Pd     :                0.9500
             k(s)              :                1.8500
             k(p)              :                2.2300
             k(d)              :                2.2300
             k(f)              :                2.0000
             kEN (H0ij)        :               -2.0000
             D4 a1             :                0.5200
             D4 a2             :                5.0000
             D4 s6             :                1.0000
             D4 s8             :                2.7000
             D4 s9             :                5.0000
             alphaj            :                2.0000

  Z AO/shell   Hii/eV     exponent
  1     Wed Apr 25 08:07:45 CEST 2018   EN: 2.200 GM2: 0.406  GM3: 0.0800  RAES: 1.40
     1s    -10.707211    1.230000
  6     Wed Apr 25 08:07:45 CEST 2018   EN: 2.550 GM2: 0.538  GM3: 0.1500  RAES: 3.00
     2s    -13.970922    2.096432
     2p    -10.063292    1.800000
  8     Wed Apr 25 08:07:45 CEST 2018   EN: 3.440 GM2: 0.452  GM3:-0.0517  RAES: 1.80
     2s    -20.229985    2.439742
     2p    -15.503117    2.137023
 16     Tue Apr 24 11:44:34 CEST 2018   EN: 2.580 GM2: 0.340  GM3:-0.0502  RAES: 3.10
     3s    -20.029654    1.981333
     3p    -11.377694    2.025643
     3d     -0.420282    1.702555

           ------------------------------------------------- 
          |        Self-Consistent Charge Iterations        |
           ------------------------------------------------- 

          ...................................................
          :                      SETUP                      :
          :.................................................:
          :  # basis functions                  82          :
          :  # atomic orbitals                  81          :
          :  # shells                           41          :
          :  # electrons                        88          :
          :  max. iterations                   250          :
          :  Hamiltonian                  GFN2-xTB          :
          :  restarted?                      false          :
          :  GBSA solvation                  false          :
          :  PC potential                    false          :
          :  electronic temp.          300.0000000     K    :
          :  accuracy                    1.0000000          :
          :  -> integral cutoff          0.2500000E+02      :
          :  -> integral neglect         0.1000000E-07      :
          :  -> SCF convergence          0.1000000E-05 Eh   :
          :  -> wf. convergence          0.1000000E-03 e    :
          :  Broyden damping             0.4000000          :
          ...................................................

 iter      E             dE          RMSdq      gap      omega  full diag
   1    -51.7901209 -0.517901E+02  0.628E+00    2.18       0.0  T
   2    -51.8688853 -0.787643E-01  0.332E+00    1.69       1.0  T
   3    -51.8666574  0.222783E-02  0.195E+00    1.90       1.0  T
   4    -51.8882641 -0.216067E-01  0.447E-01    1.62       1.0  T
   5    -51.8896390 -0.137489E-02  0.233E-01    1.67       1.0  T
   6    -51.8900692 -0.430237E-03  0.930E-02    1.68       1.0  T
   7    -51.8902157 -0.146524E-03  0.284E-02    1.67       1.0  T
   8    -51.8902178 -0.203075E-05  0.152E-02    1.67       1.4  T
   9    -51.8902191 -0.133203E-05  0.714E-03    1.67       3.0  T
  10    -51.8902198 -0.720602E-06  0.239E-03    1.67       8.9  T
  11    -51.8902199 -0.476190E-07  0.109E-03    1.67      19.5  T
  12    -51.8902199 -0.281646E-08  0.443E-04    1.67      48.1  T
  13    -51.8902199 -0.190569E-08  0.158E-04    1.67     135.2  T

   *** convergence criteria satisfied after 13 iterations ***

         #    Occupation            Energy/Eh            Energy/eV
      -------------------------------------------------------------
         1        2.0000           -0.8134378             -22.1348
       ...           ...                  ...                  ...
        38        2.0000           -0.4792012             -13.0397
        39        2.0000           -0.4740511             -12.8996
        40        2.0000           -0.4663249             -12.6893
        41        2.0000           -0.4569314             -12.4337
        42        2.0000           -0.4561280             -12.4119
        43        2.0000           -0.4526536             -12.3173
        44        2.0000           -0.4432021             -12.0601 (HOMO)
        45                         -0.3817597             -10.3882 (LUMO)
        46                         -0.3401596              -9.2562
        47                         -0.3376644              -9.1883
        48                         -0.2687387              -7.3128
        49                         -0.2560444              -6.9673
       ...                                ...                  ...
        81                          0.6966010              18.9555
      -------------------------------------------------------------
                  HL-Gap            0.0614424 Eh            1.6719 eV
             Fermi-level           -0.4124809 Eh          -11.2242 eV

 SCC (total)                   0 d,  0 h,  0 min,  0.052 sec
 SCC setup                      ...        0 min,  0.000 sec (  0.650%)
 Dispersion                     ...        0 min,  0.000 sec (  0.754%)
 integral evaluation            ...        0 min,  0.014 sec ( 26.246%)
 zeroth order Hamiltonian       ...        0 min,  0.000 sec (  0.463%)
 iterations                     ...        0 min,  0.019 sec ( 36.460%)
 molecular gradient             ...        0 min,  0.018 sec ( 34.515%)
 printout                       ...        0 min,  0.000 sec (  0.810%)

         :::::::::::::::::::::::::::::::::::::::::::::::::::::
         ::                     SUMMARY                     ::
         :::::::::::::::::::::::::::::::::::::::::::::::::::::
         :: total energy             -51.283013491667 Eh    ::
         :: gradient norm              0.122232359049 Eh/a0 ::
         :: HOMO-LUMO gap              1.671933196245 eV    ::
         ::.................................................::
         :: SCC energy               -51.890219871525 Eh    ::
         :: -> isotropic ES            0.106308849078 Eh    ::
         :: -> anisotropic ES          0.003721694715 Eh    ::
         :: -> anisotropic XC          0.005783541659 Eh    ::
         :: -> dispersion             -0.028559622040 Eh    ::
         :: repulsion energy           0.607063746936 Eh    ::
         :: add. restraining           0.000000000000 Eh    ::
         :::::::::::::::::::::::::::::::::::::::::::::::::::::

      ----------------------------------------------------------- 
     |                   =====================                   |
     |                        A N C O P T                        |
     |                   =====================                   |
     |               Approximate Normal Coordinate               |
     |                Rational Function Optimizer                |
      ----------------------------------------------------------- 

          ...................................................
          :                      SETUP                      :
          :.................................................:
          :   optimization level            normal          :
          :   max. optcycles                   200          :
          :   ANC micro-cycles                  20          :
          :   degrees of freedom                60          :
          :.................................................:
          :   RF solver                   davidson          :
          :   input Hessian                  false          :
          :   write xtbopt.log                true          :
          :   linear?                        false          :
          :   energy convergence         0.5000000E-05 Eh   :
          :   grad. convergence          0.1000000E-02 Eh/α :
          :   maximium RF displ.         2.0000000          :
          :   Hlow (freq-cutoff)         0.5000000E-02      :
          :   Hmax (freq-cutoff)         5.0000000          :
          :   S6 in model hess.         20.0000000          :
          ...................................................

generating ANC from model Hessian ...
Using Lindh-Hessian (1995)
 Shifting diagonal of input Hessian by   2.905633181158567E-003
 Lowest  eigenvalues of input Hessian
   -0.000000   -0.000000   -0.000000   -0.000000    0.000000    0.000000
    0.005000    0.006306    0.007539    0.008362    0.009352    0.015754
    0.020903    0.022171    0.023411    0.031187    0.039732    0.049412
 Highest eigenvalues
    2.040787    2.109962    2.184525    2.225768    2.398537    2.458938
 

........................................................................
.............................. CYCLE    1 ..............................
........................................................................
   1    -51.8902199 -0.518902E+02  0.864E-05    1.67       0.0  T
   2    -51.8902199 -0.454108E-10  0.519E-05    1.67     411.1  T
   3    -51.8902199 -0.313065E-10  0.277E-05    1.67     769.6  T
     SCC iter.                  ...        0 min,  0.005 sec
     gradient                   ...        0 min,  0.018 sec
 * total energy  :   -51.2830135 Eh     change        0.2305772E-07 Eh
   gradient norm :     0.1222338 Eh/α   predicted     0.0000000E+00 (-100.00%)
   displ. norm   :     0.2144334 α      lambda       -0.1205962E-01
   maximum displ.:     0.0856899 α      in ANC's #8, #9, #23, ...

........................................................................
.............................. CYCLE    2 ..............................
........................................................................
   1    -51.9107231 -0.519107E+02  0.317E-01    1.80       0.0  T
   2    -51.9111557 -0.432580E-03  0.161E-01    1.80       1.0  T
   3    -51.9111653 -0.966225E-05  0.810E-02    1.79       1.0  T
   4    -51.9111578  0.749831E-05  0.407E-02    1.79       1.0  T
   5    -51.9111800 -0.221974E-04  0.112E-02    1.79       1.9  T
   6    -51.9111811 -0.111349E-05  0.546E-03    1.79       3.9  T
   7    -51.9111814 -0.285425E-06  0.190E-03    1.79      11.2  T
     SCC iter.                  ...        0 min,  0.010 sec
     gradient                   ...        0 min,  0.016 sec
 * total energy  :   -51.2913313 Eh     change       -0.8317856E-02 Eh
   gradient norm :     0.0514001 Eh/α   predicted    -0.6307073E-02 ( -24.17%)
   displ. norm   :     0.2246551 α      lambda       -0.4269723E-02
   maximum displ.:     0.1010093 α      in ANC's #9, #2, #8, ...

........................................................................
.............................. CYCLE    3 ..............................
........................................................................
   1    -51.9181721 -0.519182E+02  0.277E-01    1.85       0.0  T
   2    -51.9185219 -0.349786E-03  0.142E-01    1.84       1.0  T
   3    -51.9185302 -0.830737E-05  0.763E-02    1.83       1.0  T
   4    -51.9185232  0.700657E-05  0.344E-02    1.83       1.0  T
   5    -51.9185413 -0.181147E-04  0.701E-03    1.83       3.0  T
   6    -51.9185419 -0.612043E-06  0.333E-03    1.83       6.4  T
   7    -51.9185420 -0.707387E-07  0.145E-03    1.83      14.7  T
     SCC iter.                  ...        0 min,  0.010 sec
     gradient                   ...        0 min,  0.016 sec
 * total energy  :   -51.2935698 Eh     change       -0.2238490E-02 Eh
   gradient norm :     0.0161744 Eh/α   predicted    -0.2242618E-02 (   0.18%)
   displ. norm   :     0.1497315 α      lambda       -0.9181376E-03
   maximum displ.:     0.0793551 α      in ANC's #12, #5, #9, ...

........................................................................
.............................. CYCLE    4 ..............................
........................................................................
   1    -51.9154443 -0.519154E+02  0.160E-01    1.83       0.0  T
   2    -51.9154834 -0.391558E-04  0.968E-02    1.83       1.0  T
   3    -51.9154607  0.227497E-04  0.622E-02    1.83       1.0  T
   4    -51.9154985 -0.378377E-04  0.206E-02    1.83       1.0  T
   5    -51.9155043 -0.582354E-05  0.399E-03    1.83       5.3  T
   6    -51.9155045 -0.218918E-06  0.158E-03    1.83      13.5  T
   7    -51.9155045 -0.544433E-08  0.701E-04    1.83      30.4  T
     SCC iter.                  ...        0 min,  0.009 sec
     gradient                   ...        0 min,  0.016 sec
 * total energy  :   -51.2939007 Eh     change       -0.3309174E-03 Eh
   gradient norm :     0.0115568 Eh/α   predicted    -0.4693612E-03 (  41.84%)
   displ. norm   :     0.0920296 α      lambda       -0.3029100E-03
   maximum displ.:     0.0726912 α      in ANC's #2, #3, #1, ...

........................................................................
.............................. CYCLE    5 ..............................
........................................................................
   1    -51.9145741 -0.519146E+02  0.589E-02    1.82       0.0  T
   2    -51.9145760 -0.197282E-05  0.337E-02    1.81       1.0  T
   3    -51.9145741  0.188901E-05  0.119E-02    1.82       1.8  T
   4    -51.9145762 -0.207545E-05  0.476E-03    1.82       4.5  T
   5    -51.9145765 -0.291471E-06  0.210E-03    1.82      10.2  T
   6    -51.9145765 -0.423193E-07  0.547E-04    1.82      39.0  T
     SCC iter.                  ...        0 min,  0.008 sec
     gradient                   ...        0 min,  0.016 sec
 * total energy  :   -51.2941043 Eh     change       -0.2035395E-03 Eh
   gradient norm :     0.0052753 Eh/α   predicted    -0.1527388E-03 ( -24.96%)
   displ. norm   :     0.1041729 α      lambda       -0.1215095E-03
   maximum displ.:     0.0854083 α      in ANC's #2, #3, #1, ...

........................................................................
.............................. CYCLE    6 ..............................
........................................................................
   1    -51.9146930 -0.519147E+02  0.842E-02    1.81       0.0  T
   2    -51.9146954 -0.247752E-05  0.459E-02    1.80       1.0  T
   3    -51.9146883  0.714344E-05  0.231E-02    1.80       1.0  T
   4    -51.9146968 -0.850561E-05  0.601E-03    1.80       3.5  T
   5    -51.9146970 -0.200004E-06  0.227E-03    1.80       9.4  T
   6    -51.9146970 -0.422087E-07  0.815E-04    1.80      26.2  T
     SCC iter.                  ...        0 min,  0.008 sec
     gradient                   ...        0 min,  0.016 sec
 * total energy  :   -51.2941880 Eh     change       -0.8370659E-04 Eh
   gradient norm :     0.0026059 Eh/α   predicted    -0.6141726E-04 ( -26.63%)
   displ. norm   :     0.1004314 α      lambda       -0.6800803E-04
   maximum displ.:     0.0782931 α      in ANC's #2, #3, #1, ...

........................................................................
.............................. CYCLE    7 ..............................
........................................................................
   1    -51.9149290 -0.519149E+02  0.719E-02    1.79       0.0  T
   2    -51.9149300 -0.977098E-06  0.424E-02    1.79       1.0  T
   3    -51.9149206  0.944003E-05  0.255E-02    1.79       1.0  T
   4    -51.9149317 -0.110783E-04  0.288E-03    1.79       7.4  T
   5    -51.9149317 -0.730529E-07  0.141E-03    1.79      15.1  T
   6    -51.9149318 -0.243849E-07  0.714E-04    1.79      29.9  T
   7    -51.9149318 -0.409698E-08  0.278E-04    1.79      76.8  T
     SCC iter.                  ...        0 min,  0.010 sec
     gradient                   ...        0 min,  0.017 sec
 * total energy  :   -51.2942375 Eh     change       -0.4951232E-04 Eh
   gradient norm :     0.0033915 Eh/α   predicted    -0.3434921E-04 ( -30.62%)
   displ. norm   :     0.1260251 α      lambda       -0.6763812E-04
   maximum displ.:     0.0950628 α      in ANC's #2, #5, #1, ...

........................................................................
.............................. CYCLE    8 ..............................
........................................................................
   1    -51.9151090 -0.519151E+02  0.105E-01    1.79       0.0  T
   2    -51.9151112 -0.216927E-05  0.587E-02    1.78       1.0  T
   3    -51.9150977  0.134941E-04  0.308E-02    1.78       1.0  T
   4    -51.9151137 -0.159518E-04  0.626E-03    1.78       3.4  T
   5    -51.9151137 -0.329587E-07  0.261E-03    1.78       8.2  T
   6    -51.9151138 -0.120226E-06  0.892E-04    1.78      23.9  T
   7    -51.9151138 -0.165312E-07  0.305E-04    1.78      69.9  T
     SCC iter.                  ...        0 min,  0.010 sec
     gradient                   ...        0 min,  0.017 sec
 * total energy  :   -51.2942862 Eh     change       -0.4871618E-04 Eh
   gradient norm :     0.0041565 Eh/α   predicted    -0.3435819E-04 ( -29.47%)
   displ. norm   :     0.1302503 α      lambda       -0.5820223E-04
   maximum displ.:     0.0970591 α      in ANC's #2, #5, #1, ...

........................................................................
.............................. CYCLE    9 ..............................
........................................................................
   1    -51.9148581 -0.519149E+02  0.940E-02    1.78       0.0  T
   2    -51.9148590 -0.878887E-06  0.551E-02    1.79       1.0  T
   3    -51.9148438  0.152063E-04  0.315E-02    1.78       1.0  T
   4    -51.9148613 -0.175217E-04  0.326E-03    1.78       6.5  T
   5    -51.9148613 -0.158253E-07  0.195E-03    1.79      11.0  T
   6    -51.9148614 -0.709610E-07  0.555E-04    1.79      38.4  T
     SCC iter.                  ...        0 min,  0.008 sec
     gradient                   ...        0 min,  0.016 sec
 * total energy  :   -51.2943277 Eh     change       -0.4147064E-04 Eh
   gradient norm :     0.0037057 Eh/α   predicted    -0.2959708E-04 ( -28.63%)
   displ. norm   :     0.1101623 α      lambda       -0.3892366E-04
   maximum displ.:     0.0826078 α      in ANC's #2, #4, #5, ...

........................................................................
.............................. CYCLE   10 ..............................
........................................................................
   1    -51.9146533 -0.519147E+02  0.845E-02    1.79       0.0  T
   2    -51.9146547 -0.140442E-05  0.482E-02    1.79       1.0  T
   3    -51.9146466  0.813858E-05  0.234E-02    1.79       1.0  T
   4    -51.9146560 -0.942180E-05  0.454E-03    1.79       4.7  T
   5    -51.9146560 -0.476375E-07  0.199E-03    1.79      10.7  T
   6    -51.9146561 -0.544518E-07  0.796E-04    1.79      26.8  T
   7    -51.9146561 -0.125979E-07  0.278E-04    1.79      76.8  T
     SCC iter.                  ...        0 min,  0.009 sec
     gradient                   ...        0 min,  0.018 sec
 * total energy  :   -51.2943534 Eh     change       -0.2574203E-04 Eh
   gradient norm :     0.0023345 Eh/α   predicted    -0.1969892E-04 ( -23.48%)
   displ. norm   :     0.0597981 α      lambda       -0.1480437E-04
   maximum displ.:     0.0454795 α      in ANC's #2, #5, #4, ...

........................................................................
.............................. CYCLE   11 ..............................
........................................................................
   1    -51.9145814 -0.519146E+02  0.453E-02    1.80       0.0  T
   2    -51.9145820 -0.645902E-06  0.258E-02    1.80       1.0  T
   3    -51.9145801  0.194066E-05  0.119E-02    1.80       1.8  T
   4    -51.9145823 -0.222964E-05  0.297E-03    1.80       7.2  T
   5    -51.9145824 -0.767874E-07  0.111E-03    1.80      19.3  T
   6    -51.9145824 -0.365985E-08  0.578E-04    1.80      36.9  T
   7    -51.9145824 -0.672853E-08  0.193E-04    1.80     110.2  T
     SCC iter.                  ...        0 min,  0.009 sec
     gradient                   ...        0 min,  0.017 sec
 * total energy  :   -51.2943624 Eh     change       -0.8986034E-05 Eh
   gradient norm :     0.0012029 Eh/α   predicted    -0.7433617E-05 ( -17.28%)
   displ. norm   :     0.0896435 α      lambda        0.5969055E-05
   maximum displ.:     0.0682193 α      in ANC's #2, #5, #4, ...

........................................................................
.............................. CYCLE   12 ..............................
........................................................................
   1    -51.9142811 -0.519143E+02  0.677E-02    1.81       0.0  T
   2    -51.9142825 -0.146414E-05  0.386E-02    1.81       1.0  T
   3    -51.9142780  0.449564E-05  0.181E-02    1.81       1.2  T
   4    -51.9142832 -0.518309E-05  0.443E-03    1.81       4.8  T
   5    -51.9142834 -0.166751E-06  0.167E-03    1.81      12.8  T
   6    -51.9142834 -0.898670E-08  0.873E-04    1.81      24.4  T
   7    -51.9142834 -0.153952E-07  0.289E-04    1.81      73.7  T
     SCC iter.                  ...        0 min,  0.010 sec
     gradient                   ...        0 min,  0.017 sec
 * total energy  :   -51.2943543 Eh     change        0.8134873E-05 Eh
   gradient norm :     0.0028437 Eh/α   predicted     0.2995113E-05 ( -63.18%)
   displ. norm   :     0.0361528 α      lambda       -0.1587233E-04
   maximum displ.:     0.0250070 α      in ANC's #2, #5, #4, ...

........................................................................
.............................. CYCLE   13 ..............................
........................................................................
   1    -51.9145152 -0.519145E+02  0.269E-02    1.81       0.0  T
   2    -51.9145154 -0.228446E-06  0.154E-02    1.81       1.4  T
   3    -51.9145146  0.765729E-06  0.761E-03    1.81       2.8  T
   4    -51.9145155 -0.885535E-06  0.145E-03    1.81      14.7  T
   5    -51.9145156 -0.171872E-07  0.628E-04    1.81      34.0  T
   6    -51.9145156 -0.418623E-08  0.294E-04    1.81      72.5  T
     SCC iter.                  ...        0 min,  0.008 sec
     gradient                   ...        0 min,  0.017 sec
 * total energy  :   -51.2943643 Eh     change       -0.1004604E-04 Eh
   gradient norm :     0.0013936 Eh/α   predicted    -0.7947878E-05 ( -20.89%)
   displ. norm   :     0.0515690 α      lambda       -0.4939382E-05
   maximum displ.:     0.0329798 α      in ANC's #2, #4, #5, ...

........................................................................
.............................. CYCLE   14 ..............................
........................................................................
   1    -51.9147782 -0.519148E+02  0.383E-02    1.80       0.0  T
   2    -51.9147788 -0.559672E-06  0.220E-02    1.80       1.0  T
   3    -51.9147772  0.160881E-05  0.108E-02    1.80       2.0  T
   4    -51.9147790 -0.183393E-05  0.242E-03    1.80       8.8  T
   5    -51.9147791 -0.644783E-07  0.828E-04    1.80      25.8  T
   6    -51.9147791 -0.435112E-08  0.414E-04    1.80      51.5  T
     SCC iter.                  ...        0 min,  0.008 sec
     gradient                   ...        0 min,  0.017 sec
 * total energy  :   -51.2943660 Eh     change       -0.1719475E-05 Eh
   gradient norm :     0.0008156 Eh/α   predicted    -0.2476551E-05 (  44.03%)
   displ. norm   :     0.0519321 α      lambda        0.1244031E-04
   maximum displ.:     0.0329832 α      in ANC's #2, #4, #5, ...

   *** GEOMETRY OPTIMIZATION CONVERGED AFTER 14 ITERATIONS ***

------------------------------------------------------------------------
 total energy gain   :        -0.0113525 Eh       -7.1238 kcal/mol
 total RMSD          :         0.2117958 a0        0.1121 Å
 total power (kW/mol):        -2.1290070 (step)  -52.8122 (real)
------------------------------------------------------------------------

 ANCopt (total)                0 d,  0 h,  0 min,  0.564 sec
 optimizer setup                ...        0 min,  0.000 sec (  0.027%)
 model hessian                  ...        0 min,  0.003 sec (  0.546%)
 ANC generation                 ...        0 min,  0.001 sec (  0.117%)
 coordinate transformation      ...        0 min,  0.000 sec (  0.043%)
 single point calculation       ...        0 min,  0.556 sec ( 98.457%)
 optimization log               ...        0 min,  0.001 sec (  0.233%)
 hessian update                 ...        0 min,  0.000 sec (  0.032%)
 rational function              ...        0 min,  0.002 sec (  0.387%)

================
 final structure:
================
$coord
    0.04713589174500    2.74584358651948   -0.11428805380061      C 
    2.23217673280009    1.29594538177188   -0.06587277243354      C 
    4.79138196809582    2.42849358534082   -0.09672199749917      C 
    5.31400013231012    4.61762110691116   -0.17974741701943      O 
    7.08027419842919   -0.06330866101109    0.00977514934693      S 
    4.71600810735411   -2.51175136402006    0.05661455002249      C 
    5.24735179915627   -4.70239467256266    0.10002744662801      O 
    2.17977994517141   -1.33910299253819    0.02683088104686      C 
   -0.09544114641779   -2.72108435307509    0.04975555068463      C 
   -2.28612053700455   -1.22918356467729    0.03350077757218      C 
   -2.19530781401816    1.40435200843801   -0.04046659274073      C 
   -4.83600180682564    2.35676472183914    0.04188446316349      C 
   -5.60677334614428    4.46512879542916   -0.01608558103741      O 
   -6.37259239192031    0.27674465532455    0.22350309972770      O 
   -5.00135217891740   -1.93605399926641    0.24635421086473      C 
   -5.98817837657201   -3.94457489649699    0.44784292791738      O 
   -0.11502081992429   -5.46891535805434    0.12334041088966      C 
   -1.65110962554458   -6.91281120011955   -1.23572673969929      C 
    0.10926827955720    4.78094402949778   -0.18108290380038      H 
    1.32219602176033   -6.31910179337897    1.30031621958791      H 
   -3.01915065210438   -6.14482520195554   -2.52906097692421      H 
   -1.54893987926372   -8.93960199122739   -1.12109403180057      H 
$end
           -------------------------------------------------
          |                Final Singlepoint                |
           -------------------------------------------------

          ...................................................
          :                      SETUP                      :
          :.................................................:
          :  # basis functions                  82          :
          :  # atomic orbitals                  81          :
          :  # shells                           41          :
          :  # electrons                        88          :
          :  max. iterations                   250          :
          :  Hamiltonian                  GFN2-xTB          :
          :  restarted?                      false          :
          :  GBSA solvation                  false          :
          :  PC potential                    false          :
          :  electronic temp.          300.0000000     K    :
          :  accuracy                    1.0000000          :
          :  -> integral cutoff          0.2500000E+02      :
          :  -> integral neglect         0.1000000E-07      :
          :  -> SCF convergence          0.1000000E-05 Eh   :
          :  -> wf. convergence          0.1000000E-03 e    :
          :  Broyden damping             0.4000000          :
          ...................................................

 iter      E             dE          RMSdq      gap      omega  full diag
   1    -51.9147791 -0.519148E+02  0.209E-04    1.80       0.0  T
   2    -51.9147791 -0.529425E-10  0.921E-05    1.80     231.4  T
   3    -51.9147791  0.378932E-10  0.842E-05    1.80     253.1  T

   *** convergence criteria satisfied after 3 iterations ***

         #    Occupation            Energy/Eh            Energy/eV
      -------------------------------------------------------------
         1        2.0000           -0.8058877             -21.9293
       ...           ...                  ...                  ...
        38        2.0000           -0.4838444             -13.1661
        39        2.0000           -0.4735292             -12.8854
        40        2.0000           -0.4678889             -12.7319
        41        2.0000           -0.4543942             -12.3647
        42        2.0000           -0.4533811             -12.3371
        43        2.0000           -0.4454950             -12.1225
        44        2.0000           -0.4427935             -12.0490 (HOMO)
        45                         -0.3765943             -10.2477 (LUMO)
        46                         -0.3380053              -9.1976
        47                         -0.3319522              -9.0329
        48                         -0.2669352              -7.2637
        49                         -0.2532811              -6.8921
       ...                                ...                  ...
        81                          0.7222529              19.6535
      -------------------------------------------------------------
                  HL-Gap            0.0661992 Eh            1.8014 eV
             Fermi-level           -0.4096939 Eh          -11.1483 eV

 SCC (total)                   0 d,  0 h,  0 min,  0.036 sec
 SCC setup                      ...        0 min,  0.000 sec (  0.612%)
 Dispersion                     ...        0 min,  0.000 sec (  0.624%)
 integral evaluation            ...        0 min,  0.013 sec ( 36.433%)
 zeroth order Hamiltonian       ...        0 min,  0.000 sec (  0.577%)
 iterations                     ...        0 min,  0.005 sec ( 13.211%)
 molecular gradient             ...        0 min,  0.017 sec ( 47.415%)
 printout                       ...        0 min,  0.000 sec (  0.976%)

         :::::::::::::::::::::::::::::::::::::::::::::::::::::
         ::                     SUMMARY                     ::
         :::::::::::::::::::::::::::::::::::::::::::::::::::::
         :: total energy             -51.294366070298 Eh    ::
         :: gradient norm              0.000817344781 Eh/a0 ::
         :: HOMO-LUMO gap              1.801372365700 eV    ::
         ::.................................................::
         :: SCC energy               -51.914779080643 Eh    ::
         :: -> isotropic ES            0.100917870571 Eh    ::
         :: -> anisotropic ES          0.002031987474 Eh    ::
         :: -> anisotropic XC          0.006849956411 Eh    ::
         :: -> dispersion             -0.028445856147 Eh    ::
         :: repulsion energy           0.620287008484 Eh    ::
         :: add. restraining           0.000000000000 Eh    ::
         :::::::::::::::::::::::::::::::::::::::::::::::::::::

           -------------------------------------------------
          |                Property Printout                |
           -------------------------------------------------

    * Orbital Energies and Occupations

         #    Occupation            Energy/Eh            Energy/eV
      -------------------------------------------------------------
         1        2.0000           -0.8058877             -21.9293
       ...           ...                  ...                  ...
        32        2.0000           -0.5447459             -14.8233
        33        2.0000           -0.5268858             -14.3373
        34        2.0000           -0.5236918             -14.2504
        35        2.0000           -0.5124060             -13.9433
        36        2.0000           -0.4952145             -13.4755
        37        2.0000           -0.4931429             -13.4191
        38        2.0000           -0.4838444             -13.1661
        39        2.0000           -0.4735292             -12.8854
        40        2.0000           -0.4678889             -12.7319
        41        2.0000           -0.4543942             -12.3647
        42        2.0000           -0.4533811             -12.3371
        43        2.0000           -0.4454950             -12.1225
        44        2.0000           -0.4427935             -12.0490 (HOMO)
        45                         -0.3765943             -10.2477 (LUMO)
        46                         -0.3380053              -9.1976
        47                         -0.3319522              -9.0329
        48                         -0.2669352              -7.2637
        49                         -0.2532811              -6.8921
        50                         -0.2465638              -6.7093
        51                         -0.2324163              -6.3244
        52                         -0.2202574              -5.9935
        53                         -0.1694603              -4.6112
        54                         -0.1408571              -3.8329
        55                         -0.0527324              -1.4349
       ...                                ...                  ...
        81                          0.7222529              19.6535
      -------------------------------------------------------------
                  HL-Gap            0.0661992 Eh            1.8014 eV
             Fermi-level           -0.4096939 Eh          -11.1483 eV

     #   Z        covCN         q      C6AA      α(0)
     1   6 C      2.910    -0.003    28.099     8.692
     2   6 C      3.079     0.003    27.878     8.656
     3   6 C      2.820     0.256    22.695     7.806
     4   8 O      0.869    -0.290    19.593     5.935
     5  16 S      2.126    -0.064   143.729    20.178
     6   6 C      2.822     0.256    22.691     7.805
     7   8 O      0.871    -0.296    19.708     5.952
     8   6 C      3.064    -0.009    28.189     8.706
     9   6 C      2.964     0.056    26.749     8.483
    10   6 C      3.020    -0.024    28.572     8.768
    11   6 C      3.032    -0.014    28.326     8.730
    12   6 C      2.797     0.359    20.918     7.492
    13   8 O      0.856    -0.296    19.712     5.953
    14   8 O      1.712    -0.237    17.926     5.716
    15   6 C      2.803     0.359    20.913     7.492
    16   8 O      0.856    -0.302    19.811     5.968
    17   6 C      2.892    -0.029    28.716     8.786
    18   6 C      2.840    -0.059    29.451     8.894
    19   1 H      0.926     0.101     1.780     2.086
    20   1 H      0.926     0.088     1.900     2.155
    21   1 H      0.926     0.069     2.095     2.264
    22   1 H      0.926     0.076     2.021     2.223

 Mol. C6AA /au·bohr⁶  :      10086.525720
 Mol. C8AA /au·bohr⁸  :     280493.728291
 Mol. α(0) /au        :        158.740708


Wiberg/Mayer (AO) data.
largest (>0.10) Wiberg bond orders for each atom
          total WBO             WBO to atom ...
     1  C   3.981        C   11 1.395    C    2 1.393    H   19 0.958
     2  C   3.988        C    1 1.393    C    8 1.356    C    3 1.001
     3  C   3.939        O    4 1.860    S    5 1.016    C    2 1.001
     4  O   2.186        C    3 1.860    S    5 0.177
     5  S   2.483        C    3 1.016    C    6 1.001    O    4 0.177    O    7 0.170
     6  C   3.939        O    7 1.850    C    8 1.018    S    5 1.001
     7  O   2.185        C    6 1.850    S    5 0.170
     8  C   3.988        C    2 1.356    C    9 1.322    C    6 1.018
     9  C   3.979        C   10 1.329    C    8 1.322    C   17 1.093
    10  C   3.987        C   11 1.359    C    9 1.329    C   15 0.994
    11  C   3.988        C    1 1.395    C   10 1.359    C   12 0.986
    12  C   3.917        O   13 1.836    O   14 1.029    C   11 0.986
    13  O   2.138        C   12 1.836    O   14 0.124
    14  O   2.378        C   12 1.029    C   15 1.019    O   13 0.124    O   16 0.121
    15  C   3.915        O   16 1.830    O   14 1.019    C   10 0.994
    16  O   2.137        C   15 1.830    O   14 0.121
    17  C   3.984        C   18 1.898    C    9 1.093    H   20 0.942
    18  C   3.975        C   17 1.898    H   22 0.973    H   21 0.972
    19  H   0.988        C    1 0.958
    20  H   0.992        C   17 0.942
    21  H   0.995        C   18 0.972
    22  H   0.993        C   18 0.973

molecular dipole:
                 x           y           z       tot (Debye)
 q only:        0.299      -0.759      -0.161
   full:        0.241      -0.674      -0.171       1.870
molecular quadrupole (traceless):
                xx          xy          yy          xz          yz          zz
 q only:      -17.169       1.884       3.873       2.039       1.838      13.296
  q+dip:      -18.443       1.735       1.058       3.359       2.138      17.385
   full:      -20.849       1.729      -1.576       2.657       2.335      22.425

           -------------------------------------------------
          |                Geometry Summary                 |
           -------------------------------------------------

      molecular mass/u    :      260.2206000
   center of mass at/Å    :        0.1601372      -0.3053701      -0.0096340
  moments of inertia/u·Å² :        0.7957659E+03   0.1581870E+04   0.2359382E+04
rotational constants/cm⁻¹ :        0.2118416E-01   0.1065677E-01   0.7144936E-02

 * 17 selected distances

     #   Z        #   Z                                     value/Å
     1   6 C      2   6 C                                 1.3879133
     3   6 C      4   8 O                                 1.1918010
     6   6 C      7   8 O                                 1.1930722
     2   6 C      8   6 C                                 1.3955458
     8   6 C      9   6 C                                 1.4087479 (max)
     9   6 C     10   6 C                                 1.4025801
     1   6 C     11   6 C                                 1.3833308
    10   6 C     11   6 C                                 1.3949847
    12   6 C     13   8 O                                 1.1883121
    12   6 C     14   8 O                                 1.3718434
    14   8 O     15   6 C                                 1.3776203
    15   6 C     16   8 O                                 1.1890108
    17   6 C     18   6 C                                 1.3273246
     1   6 C     19   1 H                                 1.0780103
    17   6 C     20   1 H                                 1.0810874
    18   6 C     21   1 H                                 1.0759427
    18   6 C     22   1 H                                 1.0756054 (min)

 * 3 distinct bonds (by element types)

   Z      Z             #   av. dist./Å        max./Å        min./Å
   1 H    6 C           4     1.0776615     1.0810874     1.0756054
   6 C    6 C           7     1.3857753     1.4087479     1.3273246
   6 C    8 O           6     1.2519433     1.3776203     1.1883121


optimized geometry written to: xtbopt.xyz


           -------------------------------------------------
          | TOTAL ENERGY              -51.294366070298 Eh   |
          | GRADIENT NORM               0.000817344781 Eh/α |
          | HOMO-LUMO GAP               1.801372365700 eV   |
           -------------------------------------------------

------------------------------------------------------------------------
 * finished run on 2021/05/19 at 11:00:30.263     
------------------------------------------------------------------------
 total:
 * wall-time:     0 d,  0 h,  0 min,  0.691 sec
 *  cpu-time:     0 d,  0 h,  0 min,  0.679 sec
 * ratio c/w:     0.982 speedup
 SCF:
 * wall-time:     0 d,  0 h,  0 min,  0.052 sec
 *  cpu-time:     0 d,  0 h,  0 min,  0.052 sec
 * ratio c/w:     1.000 speedup
 ANC optimizer:
 * wall-time:     0 d,  0 h,  0 min,  0.601 sec
 *  cpu-time:     0 d,  0 h,  0 min,  0.601 sec
 * ratio c/w:     1.000 speedup

