      -----------------------------------------------------------      
     |                   =====================                   |     
     |                           x T B                           |     
     |                   =====================                   |     
     |                         S. Grimme                         |     
     |          Mulliken Center for Theoretical Chemistry        |     
     |                    University of Bonn                     |     
     |                Version 6.2 RC2 (SAW190805)                |     
      -----------------------------------------------------------      

   This program is distributed in the hope that it will be useful,
   but WITHOUT ANY WARRANTY; without even the implied warranty of
   MERCHANTABILITY or FITNESS FOR A PARTICULAR PURPOSE.
   
   FOR NON-COMMERCIAL, ACADEMIA USE ONLY.
   
   Cite this work as:
   * S. Grimme, C. Bannwarth, P. Shushkov, J. Chem. Theory Comput., 2017,
     13, 1989-2009. DOI: 10.1021/acs.jctc.7b00118
   * C. Bannwarth, S. Ehlert and S. Grimme., J. Chem. Theory Comput., 2019,
     15, 1652-1671. DOI: 10.1021/acs.jctc.8b01176
   * P. Pracht, E. Caldeweyher, S. Ehlert, S. Grimme, ChemRxiv, 2019, preprint.
     DOI: 10.26434/chemrxiv.8326202.v1
   
   for DFT-D4:
   * E. Caldeweyher, C. Bannwarth and S. Grimme, J. Chem. Phys., 2017,
     147, 034112. DOI: 10.1063/1.4993215
   * E. Caldeweyher, S. Ehlert, A. Hansen, H. Neugebauer, S. Spicher,
     C. Bannwarth and S. Grimme, J. Chem. Phys., 2019, 150, 154122.
     DOI: 10.1063/1.5090222
   
   for sTDA-xTB:
   * S. Grimme and C. Bannwarth, J. Chem. Phys., 2016, 145, 054103.
     DOI: 10.1063/1.4959605
   
   in the mass-spec context:
   * V. Asgeirsson, C. Bauer and S. Grimme, Chem. Sci., 2017, 8, 4879.
     DOI: 10.1039/c7sc00601b
   
   for metadynamics refer to:
   * S. Grimme, J. Chem. Theory Comput., 2019, 155, 2847-2862
     DOI: 10.1021/acs.jctc.9b00143
   
   with help from (in alphabetical order)
   C. Bannwarth, F. Bohle, G. Brandenburg, E. Caldeweyher, M. Checinski,
   S. Dohm, S. Ehlert, S. Ehrlich, F. März, H. Neugebauer, J. Pisarek,
   P. Pracht, P. Shushkov, and S. Spicher.
   
 * started run on 2021/05/19 at 11:00:31.360     

           -------------------------------------------------
          |                Calculation Setup                |
           -------------------------------------------------

          program call               : /ihome/ghutchison/geoffh/xtb/xtb 840.xyz -opt
          hostname                   : smp-n83
          coordinate file            : 840.xyz
          omp threads                :                     1
          number of atoms            :                    29
          number of electrons        :                    80
          charge                     :                     0
          spin                       :                   0.0
          first test random number   :      0.27493908692609


########################################################################
# WARNING! Please study the warnings concerning your input carefully
#  - the use of '-opt' is discouraged, please use '--opt' next time
########################################################################

           ------------------------------------------------- 
          |                 G F N 2 - x T B                 |
          | Geometry, Frequencies, Noncovalent interactions |
          |            JCTC 2019 parametrisation            |
           ------------------------------------------------- 
             KAB for C  - Si     :                1.0500
             KAB for H  - Pd     :                0.9500
             k(s)              :                1.8500
             k(p)              :                2.2300
             k(d)              :                2.2300
             k(f)              :                2.0000
             kEN (H0ij)        :               -2.0000
             D4 a1             :                0.5200
             D4 a2             :                5.0000
             D4 s6             :                1.0000
             D4 s8             :                2.7000
             D4 s9             :                5.0000
             alphaj            :                2.0000

  Z AO/shell   Hii/eV     exponent
  1     Wed Apr 25 08:07:45 CEST 2018   EN: 2.200 GM2: 0.406  GM3: 0.0800  RAES: 1.40
     1s    -10.707211    1.230000
  6     Wed Apr 25 08:07:45 CEST 2018   EN: 2.550 GM2: 0.538  GM3: 0.1500  RAES: 3.00
     2s    -13.970922    2.096432
     2p    -10.063292    1.800000
  8     Wed Apr 25 08:07:45 CEST 2018   EN: 3.440 GM2: 0.452  GM3:-0.0517  RAES: 1.80
     2s    -20.229985    2.439742
     2p    -15.503117    2.137023
 16     Tue Apr 24 11:44:34 CEST 2018   EN: 2.580 GM2: 0.340  GM3:-0.0502  RAES: 3.10
     3s    -20.029654    1.981333
     3p    -11.377694    2.025643
     3d     -0.420282    1.702555

           ------------------------------------------------- 
          |        Self-Consistent Charge Iterations        |
           ------------------------------------------------- 

          ...................................................
          :                      SETUP                      :
          :.................................................:
          :  # basis functions                  80          :
          :  # atomic orbitals                  79          :
          :  # shells                           45          :
          :  # electrons                        80          :
          :  max. iterations                   250          :
          :  Hamiltonian                  GFN2-xTB          :
          :  restarted?                      false          :
          :  GBSA solvation                  false          :
          :  PC potential                    false          :
          :  electronic temp.          300.0000000     K    :
          :  accuracy                    1.0000000          :
          :  -> integral cutoff          0.2500000E+02      :
          :  -> integral neglect         0.1000000E-07      :
          :  -> SCF convergence          0.1000000E-05 Eh   :
          :  -> wf. convergence          0.1000000E-03 e    :
          :  Broyden damping             0.4000000          :
          ...................................................

 iter      E             dE          RMSdq      gap      omega  full diag
   1    -44.6918426 -0.446918E+02  0.426E+00    3.06       0.0  T
   2    -44.7551176 -0.632750E-01  0.231E+00    3.09       1.0  T
   3    -44.7550893  0.283150E-04  0.115E+00    3.08       1.0  T
   4    -44.7623801 -0.729079E-02  0.255E-01    3.08       1.0  T
   5    -44.7628412 -0.461115E-03  0.136E-01    3.08       1.0  T
   6    -44.7631097 -0.268496E-03  0.618E-02    3.08       1.0  T
   7    -44.7631547 -0.450106E-04  0.203E-02    3.08       1.0  T
   8    -44.7631554 -0.625458E-06  0.135E-02    3.08       1.4  T
   9    -44.7631576 -0.228143E-05  0.381E-03    3.08       4.9  T
  10    -44.7631577 -0.100903E-06  0.158E-03    3.08      11.7  T
  11    -44.7631577 -0.111967E-09  0.908E-04    3.08      20.5  T
  12    -44.7631578 -0.103449E-07  0.415E-04    3.08      44.7  T

   *** convergence criteria satisfied after 12 iterations ***

         #    Occupation            Energy/Eh            Energy/eV
      -------------------------------------------------------------
         1        2.0000           -0.7434198             -20.2295
       ...           ...                  ...                  ...
        34        2.0000           -0.4421632             -12.0319
        35        2.0000           -0.4369263             -11.8894
        36        2.0000           -0.4257511             -11.5853
        37        2.0000           -0.4216626             -11.4740
        38        2.0000           -0.4144227             -11.2770
        39        2.0000           -0.3811575             -10.3718
        40        2.0000           -0.3683506             -10.0233 (HOMO)
        41                         -0.2552964              -6.9470 (LUMO)
        42                         -0.2416956              -6.5769
        43                         -0.1998237              -5.4375
        44                         -0.1913346              -5.2065
        45                         -0.1536540              -4.1811
       ...                                ...                  ...
        79                          0.6694629              18.2170
      -------------------------------------------------------------
                  HL-Gap            0.1130542 Eh            3.0764 eV
             Fermi-level           -0.3118235 Eh           -8.4851 eV

 SCC (total)                   0 d,  0 h,  0 min,  0.050 sec
 SCC setup                      ...        0 min,  0.000 sec (  0.703%)
 Dispersion                     ...        0 min,  0.000 sec (  0.870%)
 integral evaluation            ...        0 min,  0.012 sec ( 24.190%)
 zeroth order Hamiltonian       ...        0 min,  0.000 sec (  0.460%)
 iterations                     ...        0 min,  0.018 sec ( 36.702%)
 molecular gradient             ...        0 min,  0.018 sec ( 36.116%)
 printout                       ...        0 min,  0.000 sec (  0.858%)

         :::::::::::::::::::::::::::::::::::::::::::::::::::::
         ::                     SUMMARY                     ::
         :::::::::::::::::::::::::::::::::::::::::::::::::::::
         :: total energy             -44.200937525670 Eh    ::
         :: gradient norm              0.067767368191 Eh/a0 ::
         :: HOMO-LUMO gap              3.076362011933 eV    ::
         ::.................................................::
         :: SCC energy               -44.763157752631 Eh    ::
         :: -> isotropic ES            0.046026186941 Eh    ::
         :: -> anisotropic ES          0.003582944886 Eh    ::
         :: -> anisotropic XC          0.016532045612 Eh    ::
         :: -> dispersion             -0.029446259380 Eh    ::
         :: repulsion energy           0.561800863080 Eh    ::
         :: add. restraining           0.000000000000 Eh    ::
         :::::::::::::::::::::::::::::::::::::::::::::::::::::

      ----------------------------------------------------------- 
     |                   =====================                   |
     |                        A N C O P T                        |
     |                   =====================                   |
     |               Approximate Normal Coordinate               |
     |                Rational Function Optimizer                |
      ----------------------------------------------------------- 

          ...................................................
          :                      SETUP                      :
          :.................................................:
          :   optimization level            normal          :
          :   max. optcycles                   200          :
          :   ANC micro-cycles                  20          :
          :   degrees of freedom                81          :
          :.................................................:
          :   RF solver                   davidson          :
          :   input Hessian                  false          :
          :   write xtbopt.log                true          :
          :   linear?                        false          :
          :   energy convergence         0.5000000E-05 Eh   :
          :   grad. convergence          0.1000000E-02 Eh/α :
          :   maximium RF displ.         2.0000000          :
          :   Hlow (freq-cutoff)         0.5000000E-02      :
          :   Hmax (freq-cutoff)         5.0000000          :
          :   S6 in model hess.         20.0000000          :
          ...................................................

generating ANC from model Hessian ...
Using Lindh-Hessian (1995)
 Shifting diagonal of input Hessian by   4.549645347935430E-003
 Lowest  eigenvalues of input Hessian
   -0.000000   -0.000000   -0.000000   -0.000000   -0.000000    0.000000
    0.005000    0.005765    0.007408    0.008201    0.008480    0.010246
    0.011693    0.012671    0.015062    0.018044    0.022422    0.023213
 Highest eigenvalues
    1.627525    1.671085    1.781440    1.830052    1.974907    2.218073
 

........................................................................
.............................. CYCLE    1 ..............................
........................................................................
   1    -44.7631578 -0.447632E+02  0.144E-04    3.08       0.0  T
   2    -44.7631578 -0.116209E-09  0.932E-05    3.08     199.2  T
   3    -44.7631578 -0.650147E-10  0.625E-05    3.08     297.0  T
     SCC iter.                  ...        0 min,  0.005 sec
     gradient                   ...        0 min,  0.018 sec
 * total energy  :   -44.2009375 Eh     change       -0.2375269E-07 Eh
   gradient norm :     0.0677688 Eh/α   predicted     0.0000000E+00 (-100.00%)
   displ. norm   :     0.2539303 α      lambda       -0.7405003E-02
   maximum displ.:     0.1222406 α      in ANC's #9, #4, #33, ...

........................................................................
.............................. CYCLE    2 ..............................
........................................................................
   1    -44.7916059 -0.447916E+02  0.208E-01    3.12       0.0  T
   2    -44.7916811 -0.752458E-04  0.114E-01    3.12       1.0  T
   3    -44.7916416  0.395157E-04  0.670E-02    3.12       1.0  T
   4    -44.7917238 -0.821774E-04  0.233E-02    3.12       1.0  T
   5    -44.7917294 -0.563351E-05  0.997E-03    3.12       1.9  T
   6    -44.7917298 -0.435296E-06  0.378E-03    3.12       4.9  T
   7    -44.7917302 -0.335790E-06  0.116E-03    3.12      15.9  T
     SCC iter.                  ...        0 min,  0.010 sec
     gradient                   ...        0 min,  0.017 sec
 * total energy  :   -44.2056473 Eh     change       -0.4709795E-02 Eh
   gradient norm :     0.0190392 Eh/α   predicted    -0.3941244E-02 ( -16.32%)
   displ. norm   :     0.2594964 α      lambda       -0.1581116E-02
   maximum displ.:     0.1665423 α      in ANC's #9, #4, #3, ...

........................................................................
.............................. CYCLE    3 ..............................
........................................................................
   1    -44.8011026 -0.448011E+02  0.151E-01    3.14       0.0  T
   2    -44.8011197 -0.171252E-04  0.837E-02    3.14       1.0  T
   3    -44.8010873  0.324323E-04  0.442E-02    3.14       1.0  T
   4    -44.8011305 -0.432350E-04  0.136E-02    3.14       1.4  T
   5    -44.8011321 -0.157720E-05  0.567E-03    3.14       3.3  T
   6    -44.8011324 -0.312793E-06  0.184E-03    3.14      10.1  T
   7    -44.8011325 -0.794377E-07  0.588E-04    3.14      31.6  T
     SCC iter.                  ...        0 min,  0.010 sec
     gradient                   ...        0 min,  0.017 sec
 * total energy  :   -44.2066121 Eh     change       -0.9647247E-03 Eh
   gradient norm :     0.0084772 Eh/α   predicted    -0.8437996E-03 ( -12.53%)
   displ. norm   :     0.2485741 α      lambda       -0.6149538E-03
   maximum displ.:     0.1420276 α      in ANC's #9, #4, #3, ...

........................................................................
.............................. CYCLE    4 ..............................
........................................................................
   1    -44.8009391 -0.448009E+02  0.152E-01    3.13       0.0  T
   2    -44.8009494 -0.103046E-04  0.882E-02    3.13       1.0  T
   3    -44.8009390  0.104325E-04  0.256E-02    3.13       1.0  T
   4    -44.8009511 -0.121772E-04  0.111E-02    3.13       1.7  T
   5    -44.8009528 -0.170594E-05  0.385E-03    3.13       4.8  T
   6    -44.8009529 -0.650367E-07  0.182E-03    3.13      10.2  T
   7    -44.8009530 -0.570355E-07  0.762E-04    3.13      24.4  T
     SCC iter.                  ...        0 min,  0.010 sec
     gradient                   ...        0 min,  0.017 sec
 * total energy  :   -44.2070227 Eh     change       -0.4106219E-03 Eh
   gradient norm :     0.0072076 Eh/α   predicted    -0.3264764E-03 ( -20.49%)
   displ. norm   :     0.2631771 α      lambda       -0.4073589E-03
   maximum displ.:     0.1576283 α      in ANC's #4, #9, #3, ...

........................................................................
.............................. CYCLE    5 ..............................
........................................................................
   1    -44.7983913 -0.447984E+02  0.161E-01    3.12       0.0  T
   2    -44.7983965 -0.515099E-05  0.923E-02    3.12       1.0  T
   3    -44.7983967 -0.201762E-06  0.153E-02    3.12       1.2  T
   4    -44.7983968 -0.133556E-06  0.103E-02    3.12       1.8  T
   5    -44.7983984 -0.162014E-05  0.235E-03    3.12       7.9  T
   6    -44.7983985 -0.655052E-07  0.931E-04    3.12      19.9  T
     SCC iter.                  ...        0 min,  0.009 sec
     gradient                   ...        0 min,  0.017 sec
 * total energy  :   -44.2073049 Eh     change       -0.2821800E-03 Eh
   gradient norm :     0.0081183 Eh/α   predicted    -0.2177929E-03 ( -22.82%)
   displ. norm   :     0.2032905 α      lambda       -0.2470986E-03
   maximum displ.:     0.1261372 α      in ANC's #4, #3, #9, ...

........................................................................
.............................. CYCLE    6 ..............................
........................................................................
   1    -44.7975770 -0.447976E+02  0.141E-01    3.10       0.0  T
   2    -44.7975820 -0.495141E-05  0.816E-02    3.10       1.0  T
   3    -44.7975746  0.736917E-05  0.227E-02    3.10       1.0  T
   4    -44.7975837 -0.912472E-05  0.942E-03    3.10       2.0  T
   5    -44.7975844 -0.690052E-06  0.259E-03    3.10       7.2  T
   6    -44.7975845 -0.644217E-07  0.103E-03    3.10      18.1  T
     SCC iter.                  ...        0 min,  0.009 sec
     gradient                   ...        0 min,  0.017 sec
 * total energy  :   -44.2074711 Eh     change       -0.1662091E-03 Eh
   gradient norm :     0.0063094 Eh/α   predicted    -0.1286555E-03 ( -22.59%)
   displ. norm   :     0.1498165 α      lambda       -0.1402704E-03
   maximum displ.:     0.0974214 α      in ANC's #4, #3, #7, ...

........................................................................
.............................. CYCLE    7 ..............................
........................................................................
   1    -44.7984645 -0.447985E+02  0.112E-01    3.09       0.0  T
   2    -44.7984689 -0.440200E-05  0.651E-02    3.09       1.0  T
   3    -44.7984615  0.739944E-05  0.222E-02    3.09       1.0  T
   4    -44.7984704 -0.891833E-05  0.818E-03    3.09       2.3  T
   5    -44.7984710 -0.555139E-06  0.259E-03    3.09       7.2  T
   6    -44.7984710 -0.408252E-07  0.101E-03    3.09      18.4  T
     SCC iter.                  ...        0 min,  0.009 sec
     gradient                   ...        0 min,  0.017 sec
 * total energy  :   -44.2075561 Eh     change       -0.8503670E-04 Eh
   gradient norm :     0.0048851 Eh/α   predicted    -0.7171053E-04 ( -15.67%)
   displ. norm   :     0.1008515 α      lambda       -0.7983626E-04
   maximum displ.:     0.0692371 α      in ANC's #4, #6, #12, ...

........................................................................
.............................. CYCLE    8 ..............................
........................................................................
   1    -44.7999898 -0.448000E+02  0.769E-02    3.09       0.0  T
   2    -44.7999927 -0.289793E-05  0.457E-02    3.09       1.0  T
   3    -44.7999882  0.445530E-05  0.169E-02    3.09       1.1  T
   4    -44.7999935 -0.521644E-05  0.545E-03    3.09       3.4  T
   5    -44.7999938 -0.336875E-06  0.184E-03    3.09      10.1  T
   6    -44.7999938 -0.712330E-08  0.769E-04    3.09      24.2  T
     SCC iter.                  ...        0 min,  0.009 sec
     gradient                   ...        0 min,  0.017 sec
 * total energy  :   -44.2076070 Eh     change       -0.5085936E-04 Eh
   gradient norm :     0.0029013 Eh/α   predicted    -0.4033438E-04 ( -20.69%)
   displ. norm   :     0.1098921 α      lambda       -0.6104320E-04
   maximum displ.:     0.0782842 α      in ANC's #4, #6, #12, ...

........................................................................
.............................. CYCLE    9 ..............................
........................................................................
   1    -44.8005335 -0.448005E+02  0.884E-02    3.08       0.0  T
   2    -44.8005353 -0.179144E-05  0.532E-02    3.08       1.0  T
   3    -44.8005327  0.261098E-05  0.138E-02    3.08       1.3  T
   4    -44.8005362 -0.345892E-05  0.500E-03    3.08       3.7  T
   5    -44.8005364 -0.203948E-06  0.172E-03    3.08      10.8  T
   6    -44.8005364 -0.233493E-07  0.649E-04    3.08      28.6  T
   7    -44.8005364 -0.129683E-08  0.363E-04    3.08      51.2  T
     SCC iter.                  ...        0 min,  0.010 sec
     gradient                   ...        0 min,  0.018 sec
 * total energy  :   -44.2076539 Eh     change       -0.4689489E-04 Eh
   gradient norm :     0.0027125 Eh/α   predicted    -0.3089375E-04 ( -34.12%)
   displ. norm   :     0.1500338 α      lambda       -0.7651900E-04
   maximum displ.:     0.0994459 α      in ANC's #4, #6, #12, ...

........................................................................
.............................. CYCLE   10 ..............................
........................................................................
   1    -44.8010296 -0.448010E+02  0.114E-01    3.08       0.0  T
   2    -44.8010321 -0.242705E-05  0.689E-02    3.08       1.0  T
   3    -44.8010296  0.248471E-05  0.143E-02    3.08       1.3  T
   4    -44.8010333 -0.372772E-05  0.541E-03    3.08       3.4  T
   5    -44.8010335 -0.238157E-06  0.181E-03    3.08      10.3  T
   6    -44.8010336 -0.193863E-07  0.793E-04    3.08      23.4  T
   7    -44.8010336 -0.322880E-08  0.421E-04    3.08      44.1  T
     SCC iter.                  ...        0 min,  0.010 sec
     gradient                   ...        0 min,  0.018 sec
 * total energy  :   -44.2077097 Eh     change       -0.5579532E-04 Eh
   gradient norm :     0.0028656 Eh/α   predicted    -0.3912170E-04 ( -29.88%)
   displ. norm   :     0.1714622 α      lambda       -0.6074021E-04
   maximum displ.:     0.1187746 α      in ANC's #4, #6, #12, ...

........................................................................
.............................. CYCLE   11 ..............................
........................................................................
   1    -44.7998513 -0.447999E+02  0.137E-01    3.07       0.0  T
   2    -44.7998545 -0.321531E-05  0.832E-02    3.07       1.0  T
   3    -44.7998517  0.280671E-05  0.157E-02    3.07       1.2  T
   4    -44.7998564 -0.466814E-05  0.605E-03    3.07       3.1  T
   5    -44.7998566 -0.210770E-06  0.256E-03    3.07       7.2  T
   6    -44.7998567 -0.787905E-07  0.875E-04    3.07      21.2  T
   7    -44.7998567 -0.730196E-09  0.526E-04    3.07      35.3  T
     SCC iter.                  ...        0 min,  0.010 sec
     gradient                   ...        0 min,  0.018 sec
 * total energy  :   -44.2077512 Eh     change       -0.4149634E-04 Eh
   gradient norm :     0.0049162 Eh/α   predicted    -0.3126652E-04 ( -24.65%)
   displ. norm   :     0.1402829 α      lambda       -0.5888356E-04
   maximum displ.:     0.0870487 α      in ANC's #4, #3, #6, ...

........................................................................
.............................. CYCLE   12 ..............................
........................................................................
   1    -44.8002158 -0.448002E+02  0.988E-02    3.06       0.0  T
   2    -44.8002177 -0.188809E-05  0.598E-02    3.06       1.0  T
   3    -44.8002152  0.251320E-05  0.123E-02    3.06       1.5  T
   4    -44.8002186 -0.341831E-05  0.424E-03    3.06       4.4  T
   5    -44.8002188 -0.122678E-06  0.192E-03    3.06       9.7  T
   6    -44.8002188 -0.267755E-07  0.857E-04    3.06      21.7  T
     SCC iter.                  ...        0 min,  0.009 sec
     gradient                   ...        0 min,  0.017 sec
 * total energy  :   -44.2077872 Eh     change       -0.3602205E-04 Eh
   gradient norm :     0.0027894 Eh/α   predicted    -0.3002251E-04 ( -16.66%)
   displ. norm   :     0.1455190 α      lambda       -0.3927033E-04
   maximum displ.:     0.1007782 α      in ANC's #4, #3, #12, ...

........................................................................
.............................. CYCLE   13 ..............................
........................................................................
   1    -44.7993428 -0.447993E+02  0.119E-01    3.06       0.0  T
   2    -44.7993454 -0.255308E-05  0.726E-02    3.06       1.0  T
   3    -44.7993430  0.235255E-05  0.136E-02    3.06       1.4  T
   4    -44.7993468 -0.379648E-05  0.477E-03    3.06       3.9  T
   5    -44.7993470 -0.162502E-06  0.233E-03    3.06       8.0  T
   6    -44.7993470 -0.414277E-07  0.770E-04    3.06      24.1  T
   7    -44.7993470 -0.345950E-08  0.428E-04    3.06      43.4  T
     SCC iter.                  ...        0 min,  0.010 sec
     gradient                   ...        0 min,  0.018 sec
 * total energy  :   -44.2078115 Eh     change       -0.2430627E-04 Eh
   gradient norm :     0.0046514 Eh/α   predicted    -0.2005598E-04 ( -17.49%)
   displ. norm   :     0.0778257 α      lambda       -0.4125946E-04
   maximum displ.:     0.0546256 α      in ANC's #3, #4, #8, ...

........................................................................
.............................. CYCLE   14 ..............................
........................................................................
   1    -44.8002027 -0.448002E+02  0.510E-02    3.06       0.0  T
   2    -44.8002035 -0.797830E-06  0.301E-02    3.06       1.0  T
   3    -44.8002027  0.733410E-06  0.761E-03    3.06       2.4  T
   4    -44.8002037 -0.960138E-06  0.313E-03    3.06       5.9  T
   5    -44.8002038 -0.971665E-07  0.140E-03    3.06      13.3  T
   6    -44.8002038 -0.176509E-07  0.470E-04    3.06      39.5  T
     SCC iter.                  ...        0 min,  0.009 sec
     gradient                   ...        0 min,  0.017 sec
 * total energy  :   -44.2078410 Eh     change       -0.2953380E-04 Eh
   gradient norm :     0.0025208 Eh/α   predicted    -0.2075633E-04 ( -29.72%)
   displ. norm   :     0.1300568 α      lambda       -0.3562340E-04
   maximum displ.:     0.0823567 α      in ANC's #3, #4, #12, ...

........................................................................
.............................. CYCLE   15 ..............................
........................................................................
   1    -44.8001109 -0.448001E+02  0.980E-02    3.06       0.0  T
   2    -44.8001128 -0.184234E-05  0.589E-02    3.06       1.0  T
   3    -44.8001119  0.856502E-06  0.104E-02    3.06       1.8  T
   4    -44.8001135 -0.153638E-05  0.517E-03    3.06       3.6  T
   5    -44.8001137 -0.255071E-06  0.204E-03    3.06       9.1  T
   6    -44.8001138 -0.431186E-07  0.661E-04    3.06      28.1  T
   7    -44.8001138 -0.139936E-08  0.389E-04    3.06      47.7  T
     SCC iter.                  ...        0 min,  0.010 sec
     gradient                   ...        0 min,  0.018 sec
 * total energy  :   -44.2078660 Eh     change       -0.2496643E-04 Eh
   gradient norm :     0.0026771 Eh/α   predicted    -0.1811611E-04 ( -27.44%)
   displ. norm   :     0.1435030 α      lambda       -0.3796649E-04
   maximum displ.:     0.0994317 α      in ANC's #3, #7, #4, ...

........................................................................
.............................. CYCLE   16 ..............................
........................................................................
   1    -44.8008952 -0.448009E+02  0.105E-01    3.06       0.0  T
   2    -44.8008975 -0.223032E-05  0.620E-02    3.06       1.0  T
   3    -44.8008951  0.240377E-05  0.149E-02    3.06       1.2  T
   4    -44.8008984 -0.331598E-05  0.667E-03    3.06       2.8  T
   5    -44.8008987 -0.310595E-06  0.193E-03    3.06       9.6  T
   6    -44.8008987 -0.508862E-07  0.717E-04    3.06      25.9  T
   7    -44.8008987 -0.231282E-09  0.456E-04    3.06      40.7  T
     SCC iter.                  ...        0 min,  0.010 sec
     gradient                   ...        0 min,  0.018 sec
 * total energy  :   -44.2078853 Eh     change       -0.1928304E-04 Eh
   gradient norm :     0.0035153 Eh/α   predicted    -0.1937713E-04 (   0.49%)
   displ. norm   :     0.1163820 α      lambda       -0.3172571E-04
   maximum displ.:     0.0690332 α      in ANC's #3, #4, #2, ...

........................................................................
.............................. CYCLE   17 ..............................
........................................................................
   1    -44.8002971 -0.448003E+02  0.878E-02    3.06       0.0  T
   2    -44.8002988 -0.171126E-05  0.517E-02    3.06       1.0  T
   3    -44.8002987  0.119356E-06  0.904E-03    3.06       2.1  T
   4    -44.8002990 -0.381331E-06  0.574E-03    3.06       3.2  T
   5    -44.8002995 -0.449262E-06  0.153E-03    3.06      12.2  T
   6    -44.8002995 -0.278178E-07  0.557E-04    3.06      33.3  T
   7    -44.8002995 -0.771216E-09  0.289E-04    3.06      64.2  T
     SCC iter.                  ...        0 min,  0.010 sec
     gradient                   ...        0 min,  0.018 sec
 * total energy  :   -44.2079050 Eh     change       -0.1968772E-04 Eh
   gradient norm :     0.0022795 Eh/α   predicted    -0.1607921E-04 ( -18.33%)
   displ. norm   :     0.1164113 α      lambda        0.1106614E-04
   maximum displ.:     0.0690301 α      in ANC's #3, #4, #2, ...

........................................................................
.............................. CYCLE   18 ..............................
........................................................................
   1    -44.7993644 -0.447994E+02  0.878E-02    3.06       0.0  T
   2    -44.7993661 -0.169441E-05  0.517E-02    3.06       1.0  T
   3    -44.7993659  0.184053E-06  0.919E-03    3.06       2.0  T
   4    -44.7993664 -0.494622E-06  0.565E-03    3.06       3.3  T
   5    -44.7993668 -0.399343E-06  0.169E-03    3.06      11.0  T
   6    -44.7993668 -0.402854E-07  0.564E-04    3.06      32.9  T
   7    -44.7993668 -0.618087E-09  0.287E-04    3.06      64.6  T
     SCC iter.                  ...        0 min,  0.010 sec
     gradient                   ...        0 min,  0.018 sec
 * total energy  :   -44.2078998 Eh     change        0.5156091E-05 Eh
   gradient norm :     0.0036981 Eh/α   predicted     0.5607358E-05 (   8.75%)
   displ. norm   :     0.0403000 α      lambda       -0.3319188E-04
   maximum displ.:     0.0265831 α      in ANC's #3, #4, #5, ...

........................................................................
.............................. CYCLE   19 ..............................
........................................................................
   1    -44.8002042 -0.448002E+02  0.205E-02    3.06       0.0  T
   2    -44.8002043 -0.143685E-06  0.119E-02    3.06       1.6  T
   3    -44.8002043  0.596331E-07  0.236E-03    3.06       7.9  T
   4    -44.8002043 -0.756165E-07  0.120E-03    3.06      15.4  T
   5    -44.8002044 -0.202185E-07  0.469E-04    3.06      39.6  T
   6    -44.8002044 -0.120851E-08  0.192E-04    3.06      96.5  T
     SCC iter.                  ...        0 min,  0.009 sec
     gradient                   ...        0 min,  0.018 sec
 * total energy  :   -44.2079222 Eh     change       -0.2240792E-04 Eh
   gradient norm :     0.0021238 Eh/α   predicted    -0.1662506E-04 ( -25.81%)
   displ. norm   :     0.0475515 α      lambda       -0.2196250E-04
   maximum displ.:     0.0306798 α      in ANC's #5, #2, #7, ...

........................................................................
.............................. CYCLE   20 ..............................
........................................................................
   1    -44.8010483 -0.448010E+02  0.295E-02    3.06       0.0  T
   2    -44.8010485 -0.205957E-06  0.173E-02    3.06       1.1  T
   3    -44.8010484  0.111379E-06  0.375E-03    3.06       5.0  T
   4    -44.8010485 -0.159528E-06  0.192E-03    3.06       9.7  T
   5    -44.8010486 -0.361045E-07  0.699E-04    3.06      26.6  T
   6    -44.8010486 -0.670684E-08  0.197E-04    3.06      94.1  T
     SCC iter.                  ...        0 min,  0.009 sec
     gradient                   ...        0 min,  0.018 sec
 * total energy  :   -44.2079357 Eh     change       -0.1351040E-04 Eh
   gradient norm :     0.0012267 Eh/α   predicted    -0.1100805E-04 ( -18.52%)
   displ. norm   :     0.1834641 α      lambda       -0.2081814E-04
   maximum displ.:     0.1131681 α      in ANC's #4, #5, #2, ...
 * RMSD in coord.:     0.3891004 α      energy gain  -0.6998198E-02 Eh

generating ANC from model Hessian ...
Using Lindh-Hessian (1995)
 Shifting diagonal of input Hessian by   4.508150471325130E-003
 Lowest  eigenvalues of input Hessian
   -0.000000   -0.000000    0.000000    0.000000    0.000000    0.000000
    0.005000    0.005969    0.007158    0.008450    0.008934    0.010178
    0.013012    0.013606    0.015256    0.018979    0.024158    0.025723
 Highest eigenvalues
    1.683011    1.765849    1.833031    1.889187    2.024852    2.330570
 

........................................................................
.............................. CYCLE   21 ..............................
........................................................................
   1    -44.7992081 -0.447992E+02  0.163E-01    3.06       0.0  T
   2    -44.7992142 -0.608105E-05  0.990E-02    3.06       1.0  T
   3    -44.7992090  0.522908E-05  0.209E-02    3.06       1.0  T
   4    -44.7992170 -0.797759E-05  0.805E-03    3.06       2.3  T
   5    -44.7992174 -0.477579E-06  0.397E-03    3.06       4.7  T
   6    -44.7992176 -0.190634E-06  0.956E-04    3.06      19.4  T
   7    -44.7992176 -0.274916E-09  0.449E-04    3.06      41.3  T
     SCC iter.                  ...        0 min,  0.010 sec
     gradient                   ...        0 min,  0.018 sec
 * total energy  :   -44.2079201 Eh     change        0.1561195E-04 Eh
   gradient norm :     0.0083207 Eh/α   predicted     0.0000000E+00 (-100.00%)
   displ. norm   :     0.0204499 α      lambda       -0.6419064E-04
   maximum displ.:     0.0103771 α      in ANC's #4, #6, #10, ...

........................................................................
.............................. CYCLE   22 ..............................
........................................................................
   1    -44.8007043 -0.448007E+02  0.158E-02    3.06       0.0  T
   2    -44.8007056 -0.133000E-05  0.939E-03    3.06       2.0  T
   3    -44.8007057 -0.858779E-07  0.521E-03    3.06       3.6  T
   4    -44.8007058 -0.918519E-07  0.152E-03    3.06      12.2  T
   5    -44.8007059 -0.454934E-07  0.534E-04    3.06      34.8  T
     SCC iter.                  ...        0 min,  0.008 sec
     gradient                   ...        0 min,  0.017 sec
 * total energy  :   -44.2079573 Eh     change       -0.3720382E-04 Eh
   gradient norm :     0.0014874 Eh/α   predicted    -0.3214811E-04 ( -13.59%)
   displ. norm   :     0.0205428 α      lambda       -0.4747661E-05
   maximum displ.:     0.0115475 α      in ANC's #4, #6, #5, ...

........................................................................
.............................. CYCLE   23 ..............................
........................................................................
   1    -44.8010636 -0.448011E+02  0.151E-02    3.06       0.0  T
   2    -44.8010638 -0.170639E-06  0.884E-03    3.06       2.1  T
   3    -44.8010637  0.857839E-07  0.293E-03    3.06       6.3  T
   4    -44.8010638 -0.121827E-06  0.105E-03    3.06      17.7  T
   5    -44.8010638 -0.990927E-08  0.498E-04    3.06      37.3  T
   6    -44.8010638 -0.300706E-08  0.139E-04    3.06     133.9  T
     SCC iter.                  ...        0 min,  0.009 sec
     gradient                   ...        0 min,  0.018 sec
 * total energy  :   -44.2079608 Eh     change       -0.3521207E-05 Eh
   gradient norm :     0.0010256 Eh/α   predicted    -0.2381156E-05 ( -32.38%)
   displ. norm   :     0.0207494 α      lambda        0.4828905E-05
   maximum displ.:     0.0115449 α      in ANC's #4, #6, #5, ...

........................................................................
.............................. CYCLE   24 ..............................
........................................................................
   1    -44.8014046 -0.448014E+02  0.151E-02    3.06       0.0  T
   2    -44.8014047 -0.168426E-06  0.884E-03    3.06       2.1  T
   3    -44.8014046  0.891836E-07  0.296E-03    3.06       6.3  T
   4    -44.8014048 -0.122364E-06  0.110E-03    3.06      16.8  T
   5    -44.8014048 -0.120983E-07  0.516E-04    3.06      36.0  T
   6    -44.8014048 -0.314327E-08  0.155E-04    3.06     120.1  T
     SCC iter.                  ...        0 min,  0.009 sec
     gradient                   ...        0 min,  0.019 sec
 * total energy  :   -44.2079573 Eh     change        0.3503063E-05 Eh
   gradient norm :     0.0028875 Eh/α   predicted     0.2410624E-05 ( -31.19%)
   displ. norm   :     0.0071107 α      lambda       -0.6971814E-05
   maximum displ.:     0.0037313 α      in ANC's #18, #8, #5, ...

........................................................................
.............................. CYCLE   25 ..............................
........................................................................
   1    -44.8011348 -0.448011E+02  0.695E-03    3.06       0.0  T
   2    -44.8011349 -0.575663E-07  0.369E-03    3.06       5.0  T
   3    -44.8011348  0.735303E-08  0.122E-03    3.06      15.2  T
   4    -44.8011349 -0.171238E-07  0.479E-04    3.06      38.8  T
   5    -44.8011349 -0.135074E-10  0.254E-04    3.06      73.2  T
     SCC iter.                  ...        0 min,  0.007 sec
     gradient                   ...        0 min,  0.018 sec
 * total energy  :   -44.2079622 Eh     change       -0.4906009E-05 Eh
   gradient norm :     0.0014341 Eh/α   predicted    -0.3486328E-05 ( -28.94%)
   displ. norm   :     0.0210520 α      lambda       -0.4539269E-05
   maximum displ.:     0.0114767 α      in ANC's #4, #5, #2, ...

........................................................................
.............................. CYCLE   26 ..............................
........................................................................
   1    -44.8006370 -0.448006E+02  0.149E-02    3.06       0.0  T
   2    -44.8006372 -0.164418E-06  0.904E-03    3.06       2.1  T
   3    -44.8006372  0.611393E-07  0.254E-03    3.06       7.3  T
   4    -44.8006373 -0.100772E-06  0.516E-04    3.06      36.0  T
   5    -44.8006373 -0.308070E-09  0.354E-04    3.06      52.5  T
     SCC iter.                  ...        0 min,  0.007 sec
     gradient                   ...        0 min,  0.018 sec
 * total energy  :   -44.2079645 Eh     change       -0.2306434E-05 Eh
   gradient norm :     0.0012790 Eh/α   predicted    -0.2272573E-05 (  -1.47%)
   displ. norm   :     0.0211858 α      lambda        0.9272693E-05
   maximum displ.:     0.0114747 α      in ANC's #4, #5, #2, ...

........................................................................
.............................. CYCLE   27 ..............................
........................................................................
   1    -44.8001210 -0.448001E+02  0.149E-02    3.06       0.0  T
   2    -44.8001212 -0.166522E-06  0.905E-03    3.06       2.1  T
   3    -44.8001211  0.608708E-07  0.255E-03    3.06       7.3  T
   4    -44.8001212 -0.101613E-06  0.481E-04    3.06      38.6  T
   5    -44.8001212  0.401457E-10  0.311E-04    3.06      59.7  T
     SCC iter.                  ...        0 min,  0.007 sec
     gradient                   ...        0 min,  0.031 sec
 * total energy  :   -44.2079576 Eh     change        0.6931623E-05 Eh
   gradient norm :     0.0039407 Eh/α   predicted     0.4634562E-05 ( -33.14%)
   displ. norm   :     0.0086487 α      lambda       -0.1163793E-04
   maximum displ.:     0.0042832 α      in ANC's #8, #17, #10, ...

........................................................................
.............................. CYCLE   28 ..............................
........................................................................
   1    -44.8005389 -0.448005E+02  0.634E-03    3.06       0.0  T
   2    -44.8005390 -0.108151E-06  0.370E-03    3.06       5.0  T
   3    -44.8005390  0.102191E-07  0.182E-03    3.06      10.2  T
   4    -44.8005390 -0.256203E-07  0.592E-04    3.06      31.4  T
   5    -44.8005390 -0.622921E-08  0.219E-04    3.06      85.0  T
     SCC iter.                  ...        0 min,  0.008 sec
     gradient                   ...        0 min,  0.018 sec
 * total energy  :   -44.2079658 Eh     change       -0.8141726E-05 Eh
   gradient norm :     0.0017796 Eh/α   predicted    -0.5821957E-05 ( -28.49%)
   displ. norm   :     0.0251844 α      lambda       -0.4998525E-05
   maximum displ.:     0.0146483 α      in ANC's #4, #5, #2, ...

........................................................................
.............................. CYCLE   29 ..............................
........................................................................
   1    -44.8010277 -0.448010E+02  0.178E-02    3.06       0.0  T
   2    -44.8010279 -0.202688E-06  0.107E-02    3.06       1.7  T
   3    -44.8010278  0.102308E-06  0.294E-03    3.06       6.3  T
   4    -44.8010279 -0.139350E-06  0.983E-04    3.06      18.9  T
   5    -44.8010280 -0.110588E-07  0.481E-04    3.06      38.6  T
     SCC iter.                  ...        0 min,  0.008 sec
     gradient                   ...        0 min,  0.018 sec
 * total energy  :   -44.2079692 Eh     change       -0.3477311E-05 Eh
   gradient norm :     0.0008673 Eh/α   predicted    -0.2502871E-05 ( -28.02%)
   displ. norm   :     0.0328618 α      lambda       -0.2114341E-05
   maximum displ.:     0.0195312 α      in ANC's #4, #5, #2, ...

   *** GEOMETRY OPTIMIZATION CONVERGED AFTER 29 ITERATIONS ***

------------------------------------------------------------------------
 total energy gain   :        -0.0070317 Eh       -4.4125 kcal/mol
 total RMSD          :         0.3966110 a0        0.2099 Å
 total power (kW/mol):        -0.6366120 (step)  -15.3230 (real)
------------------------------------------------------------------------

 ANCopt (total)                0 d,  0 h,  0 min,  1.205 sec
 optimizer setup                ...        0 min,  0.000 sec (  0.013%)
 model hessian                  ...        0 min,  0.024 sec (  2.019%)
 ANC generation                 ...        0 min,  0.002 sec (  0.150%)
 coordinate transformation      ...        0 min,  0.001 sec (  0.049%)
 single point calculation       ...        0 min,  1.167 sec ( 96.857%)
 optimization log               ...        0 min,  0.003 sec (  0.275%)
 hessian update                 ...        0 min,  0.000 sec (  0.036%)
 rational function              ...        0 min,  0.005 sec (  0.451%)

================
 final structure:
================
$coord
    2.75675724518290   -2.51636469527241    0.73806306492727      C 
    5.09603644496682   -0.31827860499716    0.32559416285872      S 
    2.87779036659678    2.08817601849194   -0.07935895312932      C 
    0.46085495773031    1.15787923616115    0.14408247006529      C 
    0.40552165369657   -1.48390164382141    0.60654346561520      C 
   -1.99082465018237   -2.95171089323751    0.94305441385720      C 
   -4.24460903036343   -1.46566651428756   -0.08010252018501      C 
   -4.23164240424050   -1.49528006498993   -2.95248612518871      C 
   -2.92305441955322   -2.82326410078606   -4.24714749403185      O 
   -5.93295804170532    0.12513989475431   -3.89771209990819      O 
   -6.11459844473473    0.22227108606888   -6.57433417814075      C 
   -4.19547890310342    1.23385425980229    0.95959992828973      C 
   -1.91373587119832    2.68219860339327   -0.05613541888273      C 
    3.84554551261694    4.58878667000047   -0.54762651782191      C 
    2.59202643347864    6.59098238894694   -1.40973647417925      C 
    3.24970354878386   -4.45657884032288    1.04702298503725      H 
   -2.28475376248436   -3.33726112537729    2.95328885841492      H 
   -1.83443100814070   -4.76065681681612   -0.03607516994286      H 
   -6.00673396102788   -2.38811654093370    0.50003245378748      H 
   -7.28078801398420    1.85466821614888   -7.01682795056241      H 
   -6.98897779626591   -1.50254100532625   -7.29333503267576      H 
   -4.23909187603303    0.41358471282922   -7.41257640462640      H 
   -4.09581479915277    1.13492302338373    3.01855785134416      H 
   -5.92604713908525    2.22434890980106    0.44056113712798      H 
   -1.69424578954619    4.45362081730150    0.98314690365848      H 
   -2.24180366826478    3.15905580406913   -2.04250865241938      H 
    5.84990117470483    4.77442700715628   -0.17048257064936      H 
    0.62412069383297    6.54794817305883   -1.90427725991462      H 
    3.54649771504680    8.36656362435610   -1.68376081347176      H 
$end
           -------------------------------------------------
          |                Final Singlepoint                |
           -------------------------------------------------

          ...................................................
          :                      SETUP                      :
          :.................................................:
          :  # basis functions                  80          :
          :  # atomic orbitals                  79          :
          :  # shells                           45          :
          :  # electrons                        80          :
          :  max. iterations                   250          :
          :  Hamiltonian                  GFN2-xTB          :
          :  restarted?                      false          :
          :  GBSA solvation                  false          :
          :  PC potential                    false          :
          :  electronic temp.          300.0000000     K    :
          :  accuracy                    1.0000000          :
          :  -> integral cutoff          0.2500000E+02      :
          :  -> integral neglect         0.1000000E-07      :
          :  -> SCF convergence          0.1000000E-05 Eh   :
          :  -> wf. convergence          0.1000000E-03 e    :
          :  Broyden damping             0.4000000          :
          ...................................................

 iter      E             dE          RMSdq      gap      omega  full diag
   1    -44.8010280 -0.448010E+02  0.253E-04    3.06       0.0  T
   2    -44.8010280 -0.497806E-10  0.121E-04    3.06     153.1  T
   3    -44.8010280 -0.193914E-09  0.111E-04    3.06     166.6  T

   *** convergence criteria satisfied after 3 iterations ***

         #    Occupation            Energy/Eh            Energy/eV
      -------------------------------------------------------------
         1        2.0000           -0.7478913             -20.3512
       ...           ...                  ...                  ...
        34        2.0000           -0.4410740             -12.0022
        35        2.0000           -0.4334200             -11.7940
        36        2.0000           -0.4257460             -11.5851
        37        2.0000           -0.4221084             -11.4862
        38        2.0000           -0.4137676             -11.2592
        39        2.0000           -0.3813124             -10.3760
        40        2.0000           -0.3678386             -10.0094 (HOMO)
        41                         -0.2552938              -6.9469 (LUMO)
        42                         -0.2313679              -6.2958
        43                         -0.1972135              -5.3665
        44                         -0.1893341              -5.1520
        45                         -0.1409780              -3.8362
       ...                                ...                  ...
        79                          0.6880943              18.7240
      -------------------------------------------------------------
                  HL-Gap            0.1125448 Eh            3.0625 eV
             Fermi-level           -0.3115662 Eh           -8.4781 eV

 SCC (total)                   0 d,  0 h,  0 min,  0.036 sec
 SCC setup                      ...        0 min,  0.000 sec (  0.671%)
 Dispersion                     ...        0 min,  0.000 sec (  0.703%)
 integral evaluation            ...        0 min,  0.012 sec ( 33.201%)
 zeroth order Hamiltonian       ...        0 min,  0.000 sec (  0.582%)
 iterations                     ...        0 min,  0.005 sec ( 13.848%)
 molecular gradient             ...        0 min,  0.018 sec ( 49.774%)
 printout                       ...        0 min,  0.000 sec (  1.078%)

         :::::::::::::::::::::::::::::::::::::::::::::::::::::
         ::                     SUMMARY                     ::
         :::::::::::::::::::::::::::::::::::::::::::::::::::::
         :: total energy             -44.207969217620 Eh    ::
         :: gradient norm              0.000865591884 Eh/a0 ::
         :: HOMO-LUMO gap              3.062500418100 eV    ::
         ::.................................................::
         :: SCC energy               -44.801027957342 Eh    ::
         :: -> isotropic ES            0.045924865206 Eh    ::
         :: -> anisotropic ES          0.002837426929 Eh    ::
         :: -> anisotropic XC          0.015519654929 Eh    ::
         :: -> dispersion             -0.030146647231 Eh    ::
         :: repulsion energy           0.592639197134 Eh    ::
         :: add. restraining           0.000000000000 Eh    ::
         :::::::::::::::::::::::::::::::::::::::::::::::::::::

           -------------------------------------------------
          |                Property Printout                |
           -------------------------------------------------

    * Orbital Energies and Occupations

         #    Occupation            Energy/Eh            Energy/eV
      -------------------------------------------------------------
         1        2.0000           -0.7478913             -20.3512
       ...           ...                  ...                  ...
        28        2.0000           -0.4757357             -12.9454
        29        2.0000           -0.4669919             -12.7075
        30        2.0000           -0.4631097             -12.6019
        31        2.0000           -0.4540357             -12.3549
        32        2.0000           -0.4511984             -12.2777
        33        2.0000           -0.4473008             -12.1717
        34        2.0000           -0.4410740             -12.0022
        35        2.0000           -0.4334200             -11.7940
        36        2.0000           -0.4257460             -11.5851
        37        2.0000           -0.4221084             -11.4862
        38        2.0000           -0.4137676             -11.2592
        39        2.0000           -0.3813124             -10.3760
        40        2.0000           -0.3678386             -10.0094 (HOMO)
        41                         -0.2552938              -6.9469 (LUMO)
        42                         -0.2313679              -6.2958
        43                         -0.1972135              -5.3665
        44                         -0.1893341              -5.1520
        45                         -0.1409780              -3.8362
        46                         -0.1071991              -2.9170
        47                          0.0027466               0.0747
        48                          0.0067251               0.1830
        49                          0.0396968               1.0802
        50                          0.0421431               1.1468
        51                          0.0808683               2.2005
       ...                                ...                  ...
        79                          0.6880943              18.7240
      -------------------------------------------------------------
                  HL-Gap            0.1125448 Eh            3.0625 eV
             Fermi-level           -0.3115662 Eh           -8.4781 eV

     #   Z        covCN         q      C6AA      α(0)
     1   6 C      2.937    -0.030    28.737     8.792
     2  16 S      2.340    -0.049   143.102    20.134
     3   6 C      2.986     0.012    27.743     8.640
     4   6 C      3.152    -0.012    28.029     8.659
     5   6 C      3.162    -0.003    27.759     8.612
     6   6 C      3.812    -0.057    21.591     6.614
     7   6 C      3.858    -0.039    21.231     6.553
     8   6 C      2.725     0.359    20.912     7.486
     9   8 O      0.856    -0.404    21.771     6.256
    10   8 O      1.704    -0.264    18.379     5.788
    11   6 C      3.656     0.034    20.295     6.467
    12   6 C      3.808    -0.056    21.577     6.612
    13   6 C      3.806    -0.051    21.492     6.600
    14   6 C      2.938    -0.030    28.741     8.792
    15   6 C      2.837    -0.096    30.395     9.035
    16   1 H      0.926     0.042     2.426     2.435
    17   1 H      0.924     0.045     2.384     2.414
    18   1 H      0.924     0.059     2.216     2.328
    19   1 H      0.924     0.054     2.265     2.354
    20   1 H      0.925     0.067     2.119     2.277
    21   1 H      0.924     0.060     2.205     2.322
    22   1 H      0.924     0.065     2.140     2.288
    23   1 H      0.924     0.045     2.389     2.417
    24   1 H      0.924     0.045     2.380     2.413
    25   1 H      0.924     0.046     2.372     2.409
    26   1 H      0.924     0.041     2.435     2.440
    27   1 H      0.925     0.042     2.423     2.434
    28   1 H      0.926     0.039     2.457     2.451
    29   1 H      0.926     0.038     2.475     2.460

 Mol. C6AA /au·bohr⁶  :      10348.754031
 Mol. C8AA /au·bohr⁸  :     268283.563042
 Mol. α(0) /au        :        158.481224


Wiberg/Mayer (AO) data.
largest (>0.10) Wiberg bond orders for each atom
          total WBO             WBO to atom ...
     1  C   3.947        C    5 1.581    S    2 1.195    H   16 0.970    C    3 0.103
     2  S   2.607        C    1 1.195    C    3 1.125
     3  C   3.945        C    4 1.500    C   14 1.135    S    2 1.125    C    1 0.103
     4  C   3.985        C    3 1.500    C    5 1.248    C   13 1.012
     5  C   3.986        C    1 1.581    C    4 1.248    C    6 1.007
     6  C   3.996        C    5 1.007    C    7 0.995    H   18 0.966    H   17 0.961
     7  C   3.995        C    6 0.995    C   12 0.986    C    8 0.954    H   19 0.944
     8  C   3.912        O    9 1.766    O   10 1.124    C    7 0.954
     9  O   2.047        C    8 1.766    O   10 0.171
    10  O   2.299        C    8 1.124    C   11 0.958    O    9 0.171
    11  C   3.927        H   20 0.982    H   21 0.977    H   22 0.977    O   10 0.958
    12  C   3.995        C   13 1.005    C    7 0.986    H   23 0.976    H   24 0.976
    13  C   3.998        C    4 1.012    C   12 1.005    H   25 0.963    H   26 0.957
    14  C   3.991        C   15 1.861    C    3 1.135    H   27 0.963
    15  C   3.991        C   14 1.861    H   29 0.978    H   28 0.973
    16  H   0.998        C    1 0.970
    17  H   0.997        C    6 0.961
    18  H   0.996        C    6 0.966
    19  H   0.996        C    7 0.944
    20  H   0.995        C   11 0.982
    21  H   0.996        C   11 0.977
    22  H   0.996        C   11 0.977
    23  H   0.998        C   12 0.976
    24  H   0.997        C   12 0.976
    25  H   0.998        C   13 0.963
    26  H   0.998        C   13 0.957
    27  H   0.998        C   14 0.963
    28  H   0.998        C   15 0.973
    29  H   0.998        C   15 0.978

molecular dipole:
                 x           y           z       tot (Debye)
 q only:       -0.827       0.514       0.258
   full:       -1.226       0.472       0.240       3.394
molecular quadrupole (traceless):
                xx          xy          yy          xz          yz          zz
 q only:        2.312      -1.635      -3.019       3.895      -6.163       0.707
  q+dip:        1.785      -0.710      -0.652       4.336      -7.473      -1.134
   full:        0.930      -0.241      -1.160       4.236      -7.187       0.229

           -------------------------------------------------
          |                Geometry Summary                 |
           -------------------------------------------------

      molecular mass/u    :      222.3014000
   center of mass at/Å    :       -0.2975611       0.1598512      -0.5675736
  moments of inertia/u·Å² :        0.5871831E+03   0.1298740E+04   0.1527666E+04
rotational constants/cm⁻¹ :        0.2870933E-01   0.1297999E-01   0.1103490E-01

 * 28 selected distances

     #   Z        #   Z                                     value/Å
     1   6 C      2  16 S                                 1.7126011
     2  16 S      3   6 C                                 1.7451321 (max)
     3   6 C      4   6 C                                 1.3755510
     1   6 C      5   6 C                                 1.3606737
     4   6 C      5   6 C                                 1.4195310
     5   6 C      6   6 C                                 1.4976912
     6   6 C      7   6 C                                 1.5277304
     8   6 C      9   8 O                                 1.2011382
     8   6 C     10   8 O                                 1.3401552
    10   8 O     11   6 C                                 1.4205954
     7   6 C     12   6 C                                 1.5310340
     4   6 C     13   6 C                                 1.4969562
    12   6 C     13   6 C                                 1.5278266
    14   6 C     15   6 C                                 1.3306816
     1   6 C     16   1 H                                 1.0718790 (min)
     6   6 C     17   1 H                                 1.0942697
     6   6 C     18   1 H                                 1.0916247
     7   6 C     19   1 H                                 1.0963749
    11   6 C     20   1 H                                 1.0871366
    11   6 C     21   1 H                                 1.0917580
    11   6 C     22   1 H                                 1.0917962
    12   6 C     23   1 H                                 1.0920850
    12   6 C     24   1 H                                 1.0903296
    13   6 C     25   1 H                                 1.0930067
    13   6 C     26   1 H                                 1.0948599
    14   6 C     27   1 H                                 1.0837340
    15   6 C     28   1 H                                 1.0739920
    15   6 C     29   1 H                                 1.0765595

 * 4 distinct bonds (by element types)

   Z      Z             #   av. dist./Å        max./Å        min./Å
   1 H    6 C          14     1.0878147     1.0963749     1.0718790
   6 C    6 C           9     1.4519640     1.5310340     1.3306816
   6 C    8 O           3     1.3206296     1.4205954     1.2011382
   6 C   16 S           2     1.7288666     1.7451321     1.7126011


optimized geometry written to: xtbopt.xyz


           -------------------------------------------------
          | TOTAL ENERGY              -44.207969217620 Eh   |
          | GRADIENT NORM               0.000865591884 Eh/α |
          | HOMO-LUMO GAP               3.062500418100 eV   |
           -------------------------------------------------

------------------------------------------------------------------------
 * finished run on 2021/05/19 at 11:00:32.690     
------------------------------------------------------------------------
 total:
 * wall-time:     0 d,  0 h,  0 min,  1.330 sec
 *  cpu-time:     0 d,  0 h,  0 min,  1.290 sec
 * ratio c/w:     0.970 speedup
 SCF:
 * wall-time:     0 d,  0 h,  0 min,  0.050 sec
 *  cpu-time:     0 d,  0 h,  0 min,  0.050 sec
 * ratio c/w:     1.000 speedup
 ANC optimizer:
 * wall-time:     0 d,  0 h,  0 min,  1.242 sec
 *  cpu-time:     0 d,  0 h,  0 min,  1.216 sec
 * ratio c/w:     0.979 speedup

