      -----------------------------------------------------------      
     |                   =====================                   |     
     |                           x T B                           |     
     |                   =====================                   |     
     |                         S. Grimme                         |     
     |          Mulliken Center for Theoretical Chemistry        |     
     |                    University of Bonn                     |     
     |                Version 6.2 RC2 (SAW190805)                |     
      -----------------------------------------------------------      

   This program is distributed in the hope that it will be useful,
   but WITHOUT ANY WARRANTY; without even the implied warranty of
   MERCHANTABILITY or FITNESS FOR A PARTICULAR PURPOSE.
   
   FOR NON-COMMERCIAL, ACADEMIA USE ONLY.
   
   Cite this work as:
   * S. Grimme, C. Bannwarth, P. Shushkov, J. Chem. Theory Comput., 2017,
     13, 1989-2009. DOI: 10.1021/acs.jctc.7b00118
   * C. Bannwarth, S. Ehlert and S. Grimme., J. Chem. Theory Comput., 2019,
     15, 1652-1671. DOI: 10.1021/acs.jctc.8b01176
   * P. Pracht, E. Caldeweyher, S. Ehlert, S. Grimme, ChemRxiv, 2019, preprint.
     DOI: 10.26434/chemrxiv.8326202.v1
   
   for DFT-D4:
   * E. Caldeweyher, C. Bannwarth and S. Grimme, J. Chem. Phys., 2017,
     147, 034112. DOI: 10.1063/1.4993215
   * E. Caldeweyher, S. Ehlert, A. Hansen, H. Neugebauer, S. Spicher,
     C. Bannwarth and S. Grimme, J. Chem. Phys., 2019, 150, 154122.
     DOI: 10.1063/1.5090222
   
   for sTDA-xTB:
   * S. Grimme and C. Bannwarth, J. Chem. Phys., 2016, 145, 054103.
     DOI: 10.1063/1.4959605
   
   in the mass-spec context:
   * V. Asgeirsson, C. Bauer and S. Grimme, Chem. Sci., 2017, 8, 4879.
     DOI: 10.1039/c7sc00601b
   
   for metadynamics refer to:
   * S. Grimme, J. Chem. Theory Comput., 2019, 155, 2847-2862
     DOI: 10.1021/acs.jctc.9b00143
   
   with help from (in alphabetical order)
   C. Bannwarth, F. Bohle, G. Brandenburg, E. Caldeweyher, M. Checinski,
   S. Dohm, S. Ehlert, S. Ehrlich, F. März, H. Neugebauer, J. Pisarek,
   P. Pracht, P. Shushkov, and S. Spicher.
   
 * started run on 2021/05/19 at 11:00:33.518     

           -------------------------------------------------
          |                Calculation Setup                |
           -------------------------------------------------

          program call               : /ihome/ghutchison/geoffh/xtb/xtb 843.xyz -opt
          hostname                   : smp-n83
          coordinate file            : 843.xyz
          omp threads                :                     1
          number of atoms            :                    26
          number of electrons        :                    66
          charge                     :                     0
          spin                       :                   0.0
          first test random number   :      0.79481396896727


########################################################################
# WARNING! Please study the warnings concerning your input carefully
#  - the use of '-opt' is discouraged, please use '--opt' next time
########################################################################

           ------------------------------------------------- 
          |                 G F N 2 - x T B                 |
          | Geometry, Frequencies, Noncovalent interactions |
          |            JCTC 2019 parametrisation            |
           ------------------------------------------------- 
             KAB for C  - Si     :                1.0500
             KAB for H  - Pd     :                0.9500
             k(s)              :                1.8500
             k(p)              :                2.2300
             k(d)              :                2.2300
             k(f)              :                2.0000
             kEN (H0ij)        :               -2.0000
             D4 a1             :                0.5200
             D4 a2             :                5.0000
             D4 s6             :                1.0000
             D4 s8             :                2.7000
             D4 s9             :                5.0000
             alphaj            :                2.0000

  Z AO/shell   Hii/eV     exponent
  1     Wed Apr 25 08:07:45 CEST 2018   EN: 2.200 GM2: 0.406  GM3: 0.0800  RAES: 1.40
     1s    -10.707211    1.230000
  6     Wed Apr 25 08:07:45 CEST 2018   EN: 2.550 GM2: 0.538  GM3: 0.1500  RAES: 3.00
     2s    -13.970922    2.096432
     2p    -10.063292    1.800000
  8     Wed Apr 25 08:07:45 CEST 2018   EN: 3.440 GM2: 0.452  GM3:-0.0517  RAES: 1.80
     2s    -20.229985    2.439742
     2p    -15.503117    2.137023

           ------------------------------------------------- 
          |        Self-Consistent Charge Iterations        |
           ------------------------------------------------- 

          ...................................................
          :                      SETUP                      :
          :.................................................:
          :  # basis functions                  62          :
          :  # atomic orbitals                  62          :
          :  # shells                           38          :
          :  # electrons                        66          :
          :  max. iterations                   250          :
          :  Hamiltonian                  GFN2-xTB          :
          :  restarted?                      false          :
          :  GBSA solvation                  false          :
          :  PC potential                    false          :
          :  electronic temp.          300.0000000     K    :
          :  accuracy                    1.0000000          :
          :  -> integral cutoff          0.2500000E+02      :
          :  -> integral neglect         0.1000000E-07      :
          :  -> SCF convergence          0.1000000E-05 Eh   :
          :  -> wf. convergence          0.1000000E-03 e    :
          :  Broyden damping             0.4000000          :
          ...................................................

 iter      E             dE          RMSdq      gap      omega  full diag
   1    -37.0962208 -0.370962E+02  0.423E+00    3.63       0.0  T
   2    -37.1544864 -0.582657E-01  0.236E+00    3.75       1.0  T
   3    -37.1543157  0.170724E-03  0.874E-01    3.54       1.0  T
   4    -37.1564578 -0.214207E-02  0.247E-01    3.76       1.0  T
   5    -37.1572647 -0.806962E-03  0.740E-02    3.70       1.0  T
   6    -37.1572728 -0.807963E-05  0.347E-02    3.70       1.0  T
   7    -37.1572752 -0.242728E-05  0.926E-03    3.70       2.1  T
   8    -37.1572758 -0.532186E-06  0.395E-03    3.70       5.0  T
   9    -37.1572760 -0.234662E-06  0.126E-03    3.70      15.6  T
  10    -37.1572760 -0.434513E-08  0.655E-04    3.70      29.9  T
  11    -37.1572760 -0.355670E-08  0.281E-04    3.70      69.8  T

   *** convergence criteria satisfied after 11 iterations ***

         #    Occupation            Energy/Eh            Energy/eV
      -------------------------------------------------------------
         1        2.0000           -0.7042938             -19.1648
       ...           ...                  ...                  ...
        27        2.0000           -0.4518250             -12.2948
        28        2.0000           -0.4465157             -12.1503
        29        2.0000           -0.4406466             -11.9906
        30        2.0000           -0.4210140             -11.4564
        31        2.0000           -0.4090178             -11.1299
        32        2.0000           -0.3985274             -10.8445
        33        2.0000           -0.3613521              -9.8329 (HOMO)
        34                         -0.2254133              -6.1338 (LUMO)
        35                         -0.2025102              -5.5106
        36                         -0.0891719              -2.4265
        37                          0.0092282               0.2511
        38                          0.0271286               0.7382
       ...                                ...                  ...
        62                          0.6425295              17.4841
      -------------------------------------------------------------
                  HL-Gap            0.1359389 Eh            3.6991 eV
             Fermi-level           -0.2933827 Eh           -7.9834 eV

 SCC (total)                   0 d,  0 h,  0 min,  0.032 sec
 SCC setup                      ...        0 min,  0.000 sec (  0.951%)
 Dispersion                     ...        0 min,  0.000 sec (  1.114%)
 integral evaluation            ...        0 min,  0.007 sec ( 23.369%)
 zeroth order Hamiltonian       ...        0 min,  0.000 sec (  0.462%)
 iterations                     ...        0 min,  0.012 sec ( 37.741%)
 molecular gradient             ...        0 min,  0.011 sec ( 35.023%)
 printout                       ...        0 min,  0.000 sec (  1.167%)

         :::::::::::::::::::::::::::::::::::::::::::::::::::::
         ::                     SUMMARY                     ::
         :::::::::::::::::::::::::::::::::::::::::::::::::::::
         :: total energy             -36.672097041798 Eh    ::
         :: gradient norm              0.046837215536 Eh/a0 ::
         :: HOMO-LUMO gap              3.699084711744 eV    ::
         ::.................................................::
         :: SCC energy               -37.157276016082 Eh    ::
         :: -> isotropic ES            0.033310923156 Eh    ::
         :: -> anisotropic ES          0.006697396294 Eh    ::
         :: -> anisotropic XC          0.012799872773 Eh    ::
         :: -> dispersion             -0.019334426011 Eh    ::
         :: repulsion energy           0.485295617712 Eh    ::
         :: add. restraining           0.000000000000 Eh    ::
         :::::::::::::::::::::::::::::::::::::::::::::::::::::

      ----------------------------------------------------------- 
     |                   =====================                   |
     |                        A N C O P T                        |
     |                   =====================                   |
     |               Approximate Normal Coordinate               |
     |                Rational Function Optimizer                |
      ----------------------------------------------------------- 

          ...................................................
          :                      SETUP                      :
          :.................................................:
          :   optimization level            normal          :
          :   max. optcycles                   200          :
          :   ANC micro-cycles                  20          :
          :   degrees of freedom                72          :
          :.................................................:
          :   RF solver                   davidson          :
          :   input Hessian                  false          :
          :   write xtbopt.log                true          :
          :   linear?                        false          :
          :   energy convergence         0.5000000E-05 Eh   :
          :   grad. convergence          0.1000000E-02 Eh/α :
          :   maximium RF displ.         2.0000000          :
          :   Hlow (freq-cutoff)         0.5000000E-02      :
          :   Hmax (freq-cutoff)         5.0000000          :
          :   S6 in model hess.         20.0000000          :
          ...................................................

generating ANC from model Hessian ...
Using Lindh-Hessian (1995)
 Shifting diagonal of input Hessian by   4.396264710754766E-003
 Lowest  eigenvalues of input Hessian
   -0.000000   -0.000000   -0.000000   -0.000000    0.000000    0.000000
    0.005000    0.006353    0.006375    0.006781    0.008565    0.009972
    0.013780    0.015072    0.017491    0.019075    0.022843    0.024015
 Highest eigenvalues
    1.529339    1.577870    1.823890    1.899219    1.979401    2.094756
 

........................................................................
.............................. CYCLE    1 ..............................
........................................................................
   1    -37.1572760 -0.371573E+02  0.647E-05    3.70       0.0  T
   2    -37.1572760 -0.100613E-10  0.403E-05    3.70     487.1  T
   3    -37.1572760 -0.288480E-11  0.266E-05    3.70     737.8  T
     SCC iter.                  ...        0 min,  0.004 sec
     gradient                   ...        0 min,  0.011 sec
 * total energy  :   -36.6720970 Eh     change        0.2527381E-07 Eh
   gradient norm :     0.0468392 Eh/α   predicted     0.0000000E+00 (-100.00%)
   displ. norm   :     0.2235497 α      lambda       -0.3939589E-02
   maximum displ.:     0.1090964 α      in ANC's #3, #8, #4, ...

........................................................................
.............................. CYCLE    2 ..............................
........................................................................
   1    -37.1772931 -0.371773E+02  0.143E-01    3.79       0.0  T
   2    -37.1773032 -0.100952E-04  0.857E-02    3.78       1.0  T
   3    -37.1772928  0.104758E-04  0.273E-02    3.79       1.0  T
   4    -37.1773066 -0.138934E-04  0.418E-03    3.78       4.7  T
   5    -37.1773068 -0.109240E-06  0.223E-03    3.78       8.8  T
   6    -37.1773068 -0.318548E-07  0.907E-04    3.78      21.6  T
     SCC iter.                  ...        0 min,  0.006 sec
     gradient                   ...        0 min,  0.010 sec
 * total energy  :   -36.6746556 Eh     change       -0.2558626E-02 Eh
   gradient norm :     0.0164412 Eh/α   predicted    -0.2068245E-02 ( -19.17%)
   displ. norm   :     0.2192313 α      lambda       -0.8827607E-03
   maximum displ.:     0.1193415 α      in ANC's #3, #4, #8, ...

........................................................................
.............................. CYCLE    3 ..............................
........................................................................
   1    -37.1839905 -0.371840E+02  0.116E-01    3.81       0.0  T
   2    -37.1839941 -0.356121E-05  0.700E-02    3.81       1.0  T
   3    -37.1839921  0.202742E-05  0.123E-02    3.81       1.6  T
   4    -37.1839950 -0.294081E-05  0.339E-03    3.81       5.8  T
   5    -37.1839951 -0.905220E-07  0.171E-03    3.81      11.4  T
   6    -37.1839951 -0.545749E-08  0.612E-04    3.81      32.0  T
     SCC iter.                  ...        0 min,  0.006 sec
     gradient                   ...        0 min,  0.010 sec
 * total energy  :   -36.6752707 Eh     change       -0.6150316E-03 Eh
   gradient norm :     0.0053647 Eh/α   predicted    -0.4626009E-03 ( -24.78%)
   displ. norm   :     0.2834357 α      lambda       -0.5313382E-03
   maximum displ.:     0.1670129 α      in ANC's #3, #4, #5, ...

........................................................................
.............................. CYCLE    4 ..............................
........................................................................
   1    -37.1847160 -0.371847E+02  0.149E-01    3.80       0.0  T
   2    -37.1847214 -0.538410E-05  0.905E-02    3.81       1.0  T
   3    -37.1847207  0.698454E-06  0.105E-02    3.81       1.9  T
   4    -37.1847226 -0.190327E-05  0.448E-03    3.81       4.4  T
   5    -37.1847229 -0.238693E-06  0.215E-03    3.81       9.1  T
   6    -37.1847229 -0.104336E-07  0.653E-04    3.81      30.0  T
     SCC iter.                  ...        0 min,  0.006 sec
     gradient                   ...        0 min,  0.010 sec
 * total energy  :   -36.6756879 Eh     change       -0.4171843E-03 Eh
   gradient norm :     0.0081663 Eh/α   predicted    -0.2870168E-03 ( -31.20%)
   displ. norm   :     0.3532169 α      lambda       -0.5189872E-03
   maximum displ.:     0.2103400 α      in ANC's #3, #4, #5, ...

........................................................................
.............................. CYCLE    5 ..............................
........................................................................
   1    -37.1825631 -0.371826E+02  0.191E-01    3.78       0.0  T
   2    -37.1825720 -0.888256E-05  0.116E-01    3.79       1.0  T
   3    -37.1825648  0.722063E-05  0.218E-02    3.79       1.0  T
   4    -37.1825752 -0.104030E-04  0.550E-03    3.79       3.6  T
   5    -37.1825754 -0.180227E-06  0.273E-03    3.79       7.2  T
   6    -37.1825754 -0.611013E-08  0.939E-04    3.79      20.9  T
     SCC iter.                  ...        0 min,  0.006 sec
     gradient                   ...        0 min,  0.010 sec
 * total energy  :   -36.6760916 Eh     change       -0.4037165E-03 Eh
   gradient norm :     0.0107857 Eh/α   predicted    -0.2918689E-03 ( -27.70%)
   displ. norm   :     0.3592256 α      lambda       -0.4841684E-03
   maximum displ.:     0.2195421 α      in ANC's #3, #4, #5, ...

........................................................................
.............................. CYCLE    6 ..............................
........................................................................
   1    -37.1801942 -0.371802E+02  0.197E-01    3.76       0.0  T
   2    -37.1802032 -0.899946E-05  0.120E-01    3.77       1.0  T
   3    -37.1801903  0.129400E-04  0.279E-02    3.77       1.0  T
   4    -37.1802075 -0.172883E-04  0.536E-03    3.77       3.7  T
   5    -37.1802076 -0.773035E-07  0.271E-03    3.77       7.2  T
   6    -37.1802076 -0.655903E-08  0.955E-04    3.77      20.5  T
     SCC iter.                  ...        0 min,  0.006 sec
     gradient                   ...        0 min,  0.011 sec
 * total energy  :   -36.6764580 Eh     change       -0.3664726E-03 Eh
   gradient norm :     0.0107171 Eh/α   predicted    -0.2733259E-03 ( -25.42%)
   displ. norm   :     0.3385017 α      lambda       -0.4990263E-03
   maximum displ.:     0.2105553 α      in ANC's #3, #4, #5, ...

........................................................................
.............................. CYCLE    7 ..............................
........................................................................
   1    -37.1798036 -0.371798E+02  0.182E-01    3.75       0.0  T
   2    -37.1798113 -0.769260E-05  0.110E-01    3.76       1.0  T
   3    -37.1797980  0.132491E-04  0.285E-02    3.75       1.0  T
   4    -37.1798154 -0.173695E-04  0.489E-03    3.75       4.0  T
   5    -37.1798154 -0.406638E-07  0.238E-03    3.76       8.2  T
   6    -37.1798154 -0.617553E-08  0.865E-04    3.75      22.7  T
     SCC iter.                  ...        0 min,  0.006 sec
     gradient                   ...        0 min,  0.011 sec
 * total energy  :   -36.6768222 Eh     change       -0.3641466E-03 Eh
   gradient norm :     0.0079410 Eh/α   predicted    -0.2781314E-03 ( -23.62%)
   displ. norm   :     0.2773172 α      lambda       -0.3638522E-03
   maximum displ.:     0.1672813 α      in ANC's #3, #4, #5, ...

........................................................................
.............................. CYCLE    8 ..............................
........................................................................
   1    -37.1816953 -0.371817E+02  0.145E-01    3.75       0.0  T
   2    -37.1816992 -0.381001E-05  0.881E-02    3.75       1.0  T
   3    -37.1816953  0.380980E-05  0.165E-02    3.75       1.2  T
   4    -37.1817010 -0.567711E-05  0.394E-03    3.75       5.0  T
   5    -37.1817011 -0.350216E-07  0.171E-03    3.75      11.4  T
   6    -37.1817011 -0.873072E-09  0.503E-04    3.75      39.0  T
     SCC iter.                  ...        0 min,  0.006 sec
     gradient                   ...        0 min,  0.011 sec
 * total energy  :   -36.6770854 Eh     change       -0.2631800E-03 Eh
   gradient norm :     0.0059311 Eh/α   predicted    -0.1959202E-03 ( -25.56%)
   displ. norm   :     0.2548014 α      lambda       -0.2130147E-03
   maximum displ.:     0.1512911 α      in ANC's #3, #5, #4, ...

........................................................................
.............................. CYCLE    9 ..............................
........................................................................
   1    -37.1828151 -0.371828E+02  0.135E-01    3.76       0.0  T
   2    -37.1828170 -0.183760E-05  0.814E-02    3.76       1.0  T
   3    -37.1828175 -0.538297E-06  0.625E-03    3.76       3.1  T
   4    -37.1828180 -0.455598E-06  0.337E-03    3.76       5.8  T
   5    -37.1828180 -0.450894E-07  0.105E-03    3.76      18.8  T
   6    -37.1828180 -0.444204E-08  0.269E-04    3.76      72.8  T
     SCC iter.                  ...        0 min,  0.006 sec
     gradient                   ...        0 min,  0.010 sec
 * total energy  :   -36.6772343 Eh     change       -0.1489204E-03 Eh
   gradient norm :     0.0053127 Eh/α   predicted    -0.1134240E-03 ( -23.84%)
   displ. norm   :     0.1494765 α      lambda       -0.1567044E-03
   maximum displ.:     0.0768925 α      in ANC's #6, #3, #5, ...

........................................................................
.............................. CYCLE   10 ..............................
........................................................................
   1    -37.1870776 -0.371871E+02  0.730E-02    3.77       0.0  T
   2    -37.1870786 -0.999243E-06  0.436E-02    3.77       1.0  T
   3    -37.1870784  0.251639E-06  0.558E-03    3.77       3.5  T
   4    -37.1870789 -0.571758E-06  0.212E-03    3.77       9.2  T
   5    -37.1870790 -0.328762E-07  0.104E-03    3.77      18.8  T
     SCC iter.                  ...        0 min,  0.005 sec
     gradient                   ...        0 min,  0.011 sec
 * total energy  :   -36.6772828 Eh     change       -0.4855217E-04 Eh
   gradient norm :     0.0058217 Eh/α   predicted    -0.8010372E-04 (  64.98%)
   displ. norm   :     0.2943136 α      lambda       -0.1831919E-03
   maximum displ.:     0.1777759 α      in ANC's #3, #2, #5, ...

........................................................................
.............................. CYCLE   11 ..............................
........................................................................
   1    -37.1840207 -0.371840E+02  0.161E-01    3.78       0.0  T
   2    -37.1840235 -0.283252E-05  0.975E-02    3.78       1.0  T
   3    -37.1840240 -0.460535E-06  0.859E-03    3.78       2.3  T
   4    -37.1840251 -0.107454E-05  0.410E-03    3.78       4.8  T
   5    -37.1840251 -0.532409E-07  0.162E-03    3.78      12.1  T
   6    -37.1840251 -0.632561E-08  0.314E-04    3.78      62.4  T
     SCC iter.                  ...        0 min,  0.006 sec
     gradient                   ...        0 min,  0.011 sec
 * total energy  :   -36.6773394 Eh     change       -0.5656282E-04 Eh
   gradient norm :     0.0051048 Eh/α   predicted    -0.9953047E-04 (  75.96%)
   displ. norm   :     0.1156349 α      lambda       -0.8679459E-04
   maximum displ.:     0.0659783 α      in ANC's #3, #4, #5, ...

........................................................................
.............................. CYCLE   12 ..............................
........................................................................
   1    -37.1853825 -0.371854E+02  0.605E-02    3.77       0.0  T
   2    -37.1853831 -0.635824E-06  0.365E-02    3.77       1.0  T
   3    -37.1853831 -0.269975E-07  0.344E-03    3.77       5.7  T
   4    -37.1853833 -0.185647E-06  0.167E-03    3.77      11.8  T
   5    -37.1853834 -0.223825E-07  0.865E-04    3.77      22.7  T
     SCC iter.                  ...        0 min,  0.005 sec
     gradient                   ...        0 min,  0.010 sec
 * total energy  :   -36.6773902 Eh     change       -0.5075159E-04 Eh
   gradient norm :     0.0018028 Eh/α   predicted    -0.4397697E-04 ( -13.35%)
   displ. norm   :     0.1255181 α      lambda       -0.5756598E-04
   maximum displ.:     0.0788315 α      in ANC's #2, #7, #4, ...

........................................................................
.............................. CYCLE   13 ..............................
........................................................................
   1    -37.1850499 -0.371850E+02  0.547E-02    3.77       0.0  T
   2    -37.1850503 -0.419035E-06  0.326E-02    3.77       1.0  T
   3    -37.1850502  0.142677E-06  0.326E-03    3.77       6.0  T
   4    -37.1850504 -0.252791E-06  0.126E-03    3.77      15.5  T
   5    -37.1850504 -0.164832E-07  0.596E-04    3.77      32.9  T
   6    -37.1850504 -0.802096E-09  0.237E-04    3.77      82.9  T
     SCC iter.                  ...        0 min,  0.006 sec
     gradient                   ...        0 min,  0.011 sec
 * total energy  :   -36.6774444 Eh     change       -0.5421129E-04 Eh
   gradient norm :     0.0038266 Eh/α   predicted    -0.2899560E-04 ( -46.51%)
   displ. norm   :     0.1783351 α      lambda       -0.8933278E-04
   maximum displ.:     0.1229199 α      in ANC's #2, #3, #7, ...

........................................................................
.............................. CYCLE   14 ..............................
........................................................................
   1    -37.1848003 -0.371848E+02  0.837E-02    3.76       0.0  T
   2    -37.1848008 -0.567916E-06  0.501E-02    3.77       1.0  T
   3    -37.1848009 -0.850340E-07  0.319E-03    3.77       6.2  T
   4    -37.1848011 -0.152266E-06  0.166E-03    3.77      11.8  T
   5    -37.1848011 -0.166165E-07  0.760E-04    3.77      25.8  T
   6    -37.1848011 -0.228278E-08  0.206E-04    3.77      95.2  T
     SCC iter.                  ...        0 min,  0.006 sec
     gradient                   ...        0 min,  0.011 sec
 * total energy  :   -36.6775055 Eh     change       -0.6117137E-04 Eh
   gradient norm :     0.0034872 Eh/α   predicted    -0.4609686E-04 ( -24.64%)
   displ. norm   :     0.2115951 α      lambda       -0.6358563E-04
   maximum displ.:     0.1383047 α      in ANC's #2, #3, #7, ...

........................................................................
.............................. CYCLE   15 ..............................
........................................................................
   1    -37.1836892 -0.371837E+02  0.104E-01    3.77       0.0  T
   2    -37.1836901 -0.833093E-06  0.623E-02    3.77       1.0  T
   3    -37.1836904 -0.284967E-06  0.348E-03    3.77       5.6  T
   4    -37.1836905 -0.102290E-06  0.209E-03    3.77       9.4  T
   5    -37.1836905 -0.242399E-07  0.889E-04    3.77      22.0  T
   6    -37.1836905 -0.396614E-08  0.196E-04    3.77      99.9  T
     SCC iter.                  ...        0 min,  0.006 sec
     gradient                   ...        0 min,  0.011 sec
 * total energy  :   -36.6775409 Eh     change       -0.3534659E-04 Eh
   gradient norm :     0.0037438 Eh/α   predicted    -0.3322308E-04 (  -6.01%)
   displ. norm   :     0.0614616 α      lambda       -0.3634188E-04
   maximum displ.:     0.0287902 α      in ANC's #2, #4, #3, ...

........................................................................
.............................. CYCLE   16 ..............................
........................................................................
   1    -37.1847334 -0.371847E+02  0.296E-02    3.77       0.0  T
   2    -37.1847337 -0.244504E-06  0.176E-02    3.77       1.1  T
   3    -37.1847336  0.734726E-07  0.267E-03    3.77       7.3  T
   4    -37.1847337 -0.109074E-06  0.812E-04    3.77      24.1  T
   5    -37.1847337 -0.695194E-08  0.328E-04    3.77      59.7  T
     SCC iter.                  ...        0 min,  0.005 sec
     gradient                   ...        0 min,  0.011 sec
 * total energy  :   -36.6775646 Eh     change       -0.2372626E-04 Eh
   gradient norm :     0.0012806 Eh/α   predicted    -0.1824021E-04 ( -23.12%)
   displ. norm   :     0.1278500 α      lambda       -0.1811849E-04
   maximum displ.:     0.0809648 α      in ANC's #3, #2, #7, ...

........................................................................
.............................. CYCLE   17 ..............................
........................................................................
   1    -37.1849807 -0.371850E+02  0.617E-02    3.77       0.0  T
   2    -37.1849811 -0.406837E-06  0.369E-02    3.77       1.0  T
   3    -37.1849809  0.180324E-06  0.405E-03    3.77       4.8  T
   4    -37.1849812 -0.312626E-06  0.119E-03    3.77      16.4  T
   5    -37.1849813 -0.792365E-08  0.557E-04    3.77      35.2  T
   6    -37.1849813 -0.352699E-09  0.197E-04    3.77      99.5  T
     SCC iter.                  ...        0 min,  0.007 sec
     gradient                   ...        0 min,  0.011 sec
 * total energy  :   -36.6775772 Eh     change       -0.1254021E-04 Eh
   gradient norm :     0.0018390 Eh/α   predicted    -0.9132660E-05 ( -27.17%)
   displ. norm   :     0.0395464 α      lambda       -0.8776874E-05
   maximum displ.:     0.0265586 α      in ANC's #3, #2, #5, ...

........................................................................
.............................. CYCLE   18 ..............................
........................................................................
   1    -37.1856088 -0.371856E+02  0.141E-02    3.77       0.0  T
   2    -37.1856089 -0.576325E-07  0.835E-03    3.77       2.3  T
   3    -37.1856089  0.248820E-07  0.130E-03    3.77      15.1  T
   4    -37.1856089 -0.358141E-07  0.421E-04    3.77      46.5  T
   5    -37.1856089 -0.219151E-08  0.198E-04    3.77      99.2  T
     SCC iter.                  ...        0 min,  0.006 sec
     gradient                   ...        0 min,  0.011 sec
 * total energy  :   -36.6775849 Eh     change       -0.7774221E-05 Eh
   gradient norm :     0.0014090 Eh/α   predicted    -0.4396216E-05 ( -43.45%)
   displ. norm   :     0.0775901 α      lambda       -0.8903719E-05
   maximum displ.:     0.0646537 α      in ANC's #3, #7, #1, ...

........................................................................
.............................. CYCLE   19 ..............................
........................................................................
   1    -37.1851412 -0.371851E+02  0.340E-02    3.77       0.0  T
   2    -37.1851413 -0.123163E-06  0.202E-02    3.77       1.0  T
   3    -37.1851412  0.529407E-07  0.209E-03    3.77       9.4  T
   4    -37.1851413 -0.858222E-07  0.646E-04    3.77      30.4  T
   5    -37.1851413 -0.291840E-08  0.300E-04    3.77      65.3  T
     SCC iter.                  ...        0 min,  0.005 sec
     gradient                   ...        0 min,  0.011 sec
 * total energy  :   -36.6775928 Eh     change       -0.7908290E-05 Eh
   gradient norm :     0.0010404 Eh/α   predicted    -0.4467795E-05 ( -43.50%)
   displ. norm   :     0.0779418 α      lambda        0.4345839E-05
   maximum displ.:     0.0646574 α      in ANC's #3, #7, #1, ...

........................................................................
.............................. CYCLE   20 ..............................
........................................................................
   1    -37.1845148 -0.371845E+02  0.342E-02    3.77       0.0  T
   2    -37.1845149 -0.132748E-06  0.203E-02    3.77       1.0  T
   3    -37.1845149  0.493553E-07  0.208E-03    3.77       9.4  T
   4    -37.1845150 -0.823414E-07  0.665E-04    3.77      29.5  T
   5    -37.1845150 -0.334376E-08  0.311E-04    3.77      63.1  T
     SCC iter.                  ...        0 min,  0.005 sec
     gradient                   ...        0 min,  0.011 sec
 * total energy  :   -36.6775887 Eh     change        0.4097888E-05 Eh
   gradient norm :     0.0022064 Eh/α   predicted     0.2174846E-05 ( -46.93%)
   displ. norm   :     0.0424200 α      lambda       -0.1075711E-04
   maximum displ.:     0.0266635 α      in ANC's #3, #2, #7, ...
 * RMSD in coord.:     0.5422737 α      energy gain  -0.5491700E-02 Eh

generating ANC from model Hessian ...
Using Lindh-Hessian (1995)
 Shifting diagonal of input Hessian by   4.363710953472933E-003
 Lowest  eigenvalues of input Hessian
   -0.000000   -0.000000   -0.000000   -0.000000    0.000000    0.000000
    0.005000    0.006419    0.006658    0.006725    0.008807    0.010548
    0.013944    0.015498    0.018196    0.020394    0.024911    0.025122
 Highest eigenvalues
    1.600817    1.648794    1.881586    1.937027    2.032838    2.162958
 

........................................................................
.............................. CYCLE   21 ..............................
........................................................................
   1    -37.1852088 -0.371852E+02  0.212E-02    3.77       0.0  T
   2    -37.1852089 -0.737777E-07  0.127E-02    3.77       1.5  T
   3    -37.1852089 -0.157895E-08  0.110E-03    3.77      17.8  T
   4    -37.1852089 -0.168295E-07  0.507E-04    3.77      38.7  T
   5    -37.1852089 -0.179370E-08  0.252E-04    3.77      77.7  T
     SCC iter.                  ...        0 min,  0.006 sec
     gradient                   ...        0 min,  0.011 sec
 * total energy  :   -36.6775949 Eh     change       -0.6146045E-05 Eh
   gradient norm :     0.0011149 Eh/α   predicted     0.0000000E+00 (-100.00%)
   displ. norm   :     0.0129885 α      lambda       -0.2536812E-05
   maximum displ.:     0.0061308 α      in ANC's #6, #1, #8, ...

........................................................................
.............................. CYCLE   22 ..............................
........................................................................
   1    -37.1852711 -0.371853E+02  0.662E-03    3.77       0.0  T
   2    -37.1852711 -0.440874E-07  0.396E-03    3.77       4.9  T
   3    -37.1852711  0.125681E-07  0.119E-03    3.77      16.5  T
   4    -37.1852711 -0.198229E-07  0.235E-04    3.77      83.4  T
   5    -37.1852711 -0.443713E-09  0.108E-04    3.77     182.2  T
     SCC iter.                  ...        0 min,  0.006 sec
     gradient                   ...        0 min,  0.011 sec
 * total energy  :   -36.6775970 Eh     change       -0.2134629E-05 Eh
   gradient norm :     0.0003358 Eh/α   predicted    -0.1274680E-05 ( -40.29%)
   displ. norm   :     0.0130549 α      lambda        0.1729737E-05
   maximum displ.:     0.0061308 α      in ANC's #6, #1, #8, ...

   *** GEOMETRY OPTIMIZATION CONVERGED AFTER 22 ITERATIONS ***

------------------------------------------------------------------------
 total energy gain   :        -0.0055000 Eh       -3.4513 kcal/mol
 total RMSD          :         0.5413233 a0        0.2865 Å
 total power (kW/mol):        -0.6563726 (step)  -25.7852 (real)
------------------------------------------------------------------------

 ANCopt (total)                0 d,  0 h,  0 min,  0.560 sec
 optimizer setup                ...        0 min,  0.000 sec (  0.028%)
 model hessian                  ...        0 min,  0.008 sec (  1.387%)
 ANC generation                 ...        0 min,  0.002 sec (  0.272%)
 coordinate transformation      ...        0 min,  0.000 sec (  0.074%)
 single point calculation       ...        0 min,  0.542 sec ( 96.725%)
 optimization log               ...        0 min,  0.002 sec (  0.415%)
 hessian update                 ...        0 min,  0.000 sec (  0.053%)
 rational function              ...        0 min,  0.004 sec (  0.796%)

================
 final structure:
================
$coord
    2.07711490423589   -1.21741261858194    0.55998575300511      C 
    2.11682432737108    1.30846752849573    1.28932055137996      C 
    4.24170328266557    2.73287208916442    1.61109488366690      O 
    6.62205563333249    1.60867786922275    1.17251738218327      C 
    8.63088111775535    3.60993042471793    1.64321241591026      C 
   -0.16961532123970    2.52993815692387    1.73966860675679      C 
   -2.44622332051155    1.28174250501795    1.47178464027735      C 
   -2.48614539369780   -1.24304381521975    0.73826152855449      C 
   -0.19964560451087   -2.46534423917944    0.29110771946877      C 
   -4.61155082265439   -2.66520465386140    0.41012792624214      O 
   -6.99334365061655   -1.52840817208935    0.80549148975997      C 
   -9.00514509244667   -3.50951598199502    0.26735224368104      C 
    3.80347510504258   -2.23729288739424    0.19445872564559      H 
    6.74042810475252    0.92278908164001   -0.78515119153374      H 
    6.90107496843985   -0.00131481112489    2.45601117277939      H 
    8.34063510109674    5.20166456873100    0.37930318867953      H 
   10.49710132900777    2.81957463618116    1.31774855371810      H 
    8.50891984085565    4.28284700757294    3.57920969253452      H 
   -0.12626923816562    4.48732986272981    2.30625161834604      H 
   -4.17254305974728    2.30021255226026    1.84116778028954      H 
   -0.24282843513707   -4.42301762877911   -0.27450728401199      H 
   -7.23126324310394    0.09653919248791   -0.46700311679270      H 
   -7.15194982999994   -0.86173625484615    2.76699481947703      H 
   -8.84317923587024   -4.16170628232691   -1.67284043902267      H 
  -10.87275612467823   -2.70894794175340    0.55881888392930      H 
   -8.75511697143415   -5.11728625162143    1.51940623457465      H 
$end
           -------------------------------------------------
          |                Final Singlepoint                |
           -------------------------------------------------

          ...................................................
          :                      SETUP                      :
          :.................................................:
          :  # basis functions                  62          :
          :  # atomic orbitals                  62          :
          :  # shells                           38          :
          :  # electrons                        66          :
          :  max. iterations                   250          :
          :  Hamiltonian                  GFN2-xTB          :
          :  restarted?                      false          :
          :  GBSA solvation                  false          :
          :  PC potential                    false          :
          :  electronic temp.          300.0000000     K    :
          :  accuracy                    1.0000000          :
          :  -> integral cutoff          0.2500000E+02      :
          :  -> integral neglect         0.1000000E-07      :
          :  -> SCF convergence          0.1000000E-05 Eh   :
          :  -> wf. convergence          0.1000000E-03 e    :
          :  Broyden damping             0.4000000          :
          ...................................................

 iter      E             dE          RMSdq      gap      omega  full diag
   1    -37.1852711 -0.371853E+02  0.485E-05    3.77       0.0  T
   2    -37.1852711 -0.240448E-10  0.255E-05    3.77     770.4  T
   3    -37.1852711 -0.208047E-10  0.127E-05    3.77    1543.6  T

   *** convergence criteria satisfied after 3 iterations ***

         #    Occupation            Energy/Eh            Energy/eV
      -------------------------------------------------------------
         1        2.0000           -0.7058701             -19.2077
       ...           ...                  ...                  ...
        27        2.0000           -0.4482292             -12.1969
        28        2.0000           -0.4469365             -12.1618
        29        2.0000           -0.4432404             -12.0612
        30        2.0000           -0.4164129             -11.3312
        31        2.0000           -0.4131161             -11.2415
        32        2.0000           -0.4007374             -10.9046
        33        2.0000           -0.3573646              -9.7244 (HOMO)
        34                         -0.2189440              -5.9578 (LUMO)
        35                         -0.1986818              -5.4064
        36                         -0.0801159              -2.1801
        37                          0.0210841               0.5737
        38                          0.0343590               0.9350
       ...                                ...                  ...
        62                          0.6708236              18.2540
      -------------------------------------------------------------
                  HL-Gap            0.1384207 Eh            3.7666 eV
             Fermi-level           -0.2881543 Eh           -7.8411 eV

 SCC (total)                   0 d,  0 h,  0 min,  0.023 sec
 SCC setup                      ...        0 min,  0.000 sec (  0.841%)
 Dispersion                     ...        0 min,  0.000 sec (  0.916%)
 integral evaluation            ...        0 min,  0.007 sec ( 31.548%)
 zeroth order Hamiltonian       ...        0 min,  0.000 sec (  0.534%)
 iterations                     ...        0 min,  0.004 sec ( 16.362%)
 molecular gradient             ...        0 min,  0.011 sec ( 48.146%)
 printout                       ...        0 min,  0.000 sec (  1.393%)

         :::::::::::::::::::::::::::::::::::::::::::::::::::::
         ::                     SUMMARY                     ::
         :::::::::::::::::::::::::::::::::::::::::::::::::::::
         :: total energy             -36.677597026960 Eh    ::
         :: gradient norm              0.000336286986 Eh/a0 ::
         :: HOMO-LUMO gap              3.766617794689 eV    ::
         ::.................................................::
         :: SCC energy               -37.185271149384 Eh    ::
         :: -> isotropic ES            0.032360206884 Eh    ::
         :: -> anisotropic ES          0.005815219661 Eh    ::
         :: -> anisotropic XC          0.011659898291 Eh    ::
         :: -> dispersion             -0.019429023825 Eh    ::
         :: repulsion energy           0.507793817370 Eh    ::
         :: add. restraining           0.000000000000 Eh    ::
         :::::::::::::::::::::::::::::::::::::::::::::::::::::

           -------------------------------------------------
          |                Property Printout                |
           -------------------------------------------------

    * Orbital Energies and Occupations

         #    Occupation            Energy/Eh            Energy/eV
      -------------------------------------------------------------
         1        2.0000           -0.7058701             -19.2077
       ...           ...                  ...                  ...
        21        2.0000           -0.4815300             -13.1031
        22        2.0000           -0.4777132             -12.9992
        23        2.0000           -0.4717453             -12.8368
        24        2.0000           -0.4660052             -12.6806
        25        2.0000           -0.4640274             -12.6268
        26        2.0000           -0.4570321             -12.4365
        27        2.0000           -0.4482292             -12.1969
        28        2.0000           -0.4469365             -12.1618
        29        2.0000           -0.4432404             -12.0612
        30        2.0000           -0.4164129             -11.3312
        31        2.0000           -0.4131161             -11.2415
        32        2.0000           -0.4007374             -10.9046
        33        2.0000           -0.3573646              -9.7244 (HOMO)
        34                         -0.2189440              -5.9578 (LUMO)
        35                         -0.1986818              -5.4064
        36                         -0.0801159              -2.1801
        37                          0.0210841               0.5737
        38                          0.0343590               0.9350
        39                          0.1017014               2.7674
        40                          0.1075393               2.9263
        41                          0.1203588               3.2751
        42                          0.1254349               3.4133
        43                          0.1496301               4.0716
        44                          0.1496797               4.0730
       ...                                ...                  ...
        62                          0.6708236              18.2540
      -------------------------------------------------------------
                  HL-Gap            0.1384207 Eh            3.7666 eV
             Fermi-level           -0.2881543 Eh           -7.8411 eV

     #   Z        covCN         q      C6AA      α(0)
     1   6 C      2.918    -0.067    29.663     8.931
     2   6 C      2.862     0.132    25.103     8.213
     3   8 O      1.706    -0.280    18.640     5.829
     4   6 C      3.691     0.089    19.284     6.284
     5   6 C      3.751    -0.113    22.717     6.797
     6   6 C      2.922    -0.057    29.409     8.893
     7   6 C      2.918    -0.067    29.663     8.931
     8   6 C      2.862     0.132    25.103     8.213
     9   6 C      2.922    -0.057    29.409     8.893
    10   8 O      1.706    -0.280    18.640     5.829
    11   6 C      3.691     0.089    19.284     6.284
    12   6 C      3.751    -0.113    22.718     6.797
    13   1 H      0.926     0.036     2.507     2.476
    14   1 H      0.923     0.027     2.634     2.538
    15   1 H      0.923     0.027     2.635     2.538
    16   1 H      0.925     0.056     2.247     2.344
    17   1 H      0.925     0.045     2.383     2.414
    18   1 H      0.925     0.056     2.248     2.344
    19   1 H      0.926     0.049     2.334     2.389
    20   1 H      0.926     0.036     2.507     2.476
    21   1 H      0.926     0.049     2.334     2.389
    22   1 H      0.923     0.027     2.634     2.538
    23   1 H      0.923     0.027     2.635     2.539
    24   1 H      0.925     0.056     2.248     2.345
    25   1 H      0.925     0.045     2.383     2.414
    26   1 H      0.925     0.056     2.246     2.344

 Mol. C6AA /au·bohr⁶  :       6453.075785
 Mol. C8AA /au·bohr⁸  :     146739.567537
 Mol. α(0) /au        :        123.982880


Wiberg/Mayer (AO) data.
largest (>0.10) Wiberg bond orders for each atom
          total WBO             WBO to atom ...
     1  C   3.988        C    9 1.456    C    2 1.364    H   13 0.966
     2  C   3.936        C    1 1.364    C    6 1.360    O    3 1.053
     3  O   2.214        C    2 1.053    C    4 0.970
     4  C   3.950        C    5 1.015    O    3 0.970    H   15 0.969    H   14 0.969
     5  C   3.993        C    4 1.015    H   18 0.986    H   16 0.986    H   17 0.985
     6  C   3.988        C    7 1.457    C    2 1.360    H   19 0.969    C    9 0.111
     7  C   3.988        C    6 1.457    C    8 1.364    H   20 0.966
     8  C   3.936        C    7 1.364    C    9 1.361    O   10 1.053
     9  C   3.988        C    1 1.456    C    8 1.361    H   21 0.969    C    6 0.111
    10  O   2.214        C    8 1.053    C   11 0.970
    11  C   3.950        C   12 1.015    O   10 0.970    H   22 0.969    H   23 0.969
    12  C   3.993        C   11 1.015    H   24 0.986    H   26 0.986    H   25 0.985
    13  H   0.998        C    1 0.966
    14  H   0.999        C    4 0.969
    15  H   0.999        C    4 0.969
    16  H   0.997        C    5 0.986
    17  H   0.997        C    5 0.985
    18  H   0.997        C    5 0.986
    19  H   0.998        C    6 0.969
    20  H   0.998        C    7 0.966
    21  H   0.998        C    9 0.969
    22  H   0.999        C   11 0.969
    23  H   0.999        C   11 0.969
    24  H   0.997        C   12 0.986
    25  H   0.997        C   12 0.985
    26  H   0.997        C   12 0.986

molecular dipole:
                 x           y           z       tot (Debye)
 q only:       -0.000       0.004      -0.012
   full:       -0.000       0.004      -0.013       0.033
molecular quadrupole (traceless):
                xx          xy          yy          xz          yz          zz
 q only:       12.725       1.006      -6.278      -0.442       0.027      -6.447
  q+dip:       12.046      -2.795      -6.099      -1.515       0.111      -5.946
   full:       12.536      -2.307      -7.329      -1.346      -0.538      -5.206

           -------------------------------------------------
          |                Geometry Summary                 |
           -------------------------------------------------

      molecular mass/u    :      166.2194000
   center of mass at/Å    :       -0.0980598       0.0197114       0.5285450
  moments of inertia/u·Å² :        0.1172695E+03   0.1477147E+04   0.1581664E+04
rotational constants/cm⁻¹ :        0.1437512E+00   0.1141229E-01   0.1065816E-01

 * 26 selected distances

     #   Z        #   Z                                     value/Å
     1   6 C      2   6 C                                 1.3914018
     2   6 C      3   8 O                                 1.3643723
     3   8 O      4   6 C                                 1.4122432
     4   6 C      5   6 C                                 1.5210460 (max)
     2   6 C      6   6 C                                 1.3923105
     6   6 C      7   6 C                                 1.3812133
     7   6 C      8   6 C                                 1.3914641
     1   6 C      9   6 C                                 1.3812710
     8   6 C      9   6 C                                 1.3922538
     8   6 C     10   8 O                                 1.3643706
    10   8 O     11   6 C                                 1.4121753
    11   6 C     12   6 C                                 1.5210258
     1   6 C     13   1 H                                 1.0785465
     4   6 C     14   1 H                                 1.0994823
     4   6 C     15   1 H                                 1.0995285
     5   6 C     16   1 H                                 1.0864677
     5   6 C     17   1 H                                 1.0862150
     5   6 C     18   1 H                                 1.0865256
     6   6 C     19   1 H                                 1.0785715
     7   6 C     20   1 H                                 1.0785231 (min)
     9   6 C     21   1 H                                 1.0785705
    11   6 C     22   1 H                                 1.0994034
    11   6 C     23   1 H                                 1.0995054
    12   6 C     24   1 H                                 1.0865457
    12   6 C     25   1 H                                 1.0862751
    12   6 C     26   1 H                                 1.0864356

 * 3 distinct bonds (by element types)

   Z      Z             #   av. dist./Å        max./Å        min./Å
   1 H    6 C          14     1.0878997     1.0995285     1.0785231
   6 C    6 C           8     1.4214983     1.5210460     1.3812133
   6 C    8 O           4     1.3882903     1.4122432     1.3643706


optimized geometry written to: xtbopt.xyz


           -------------------------------------------------
          | TOTAL ENERGY              -36.677597026960 Eh   |
          | GRADIENT NORM               0.000336286986 Eh/α |
          | HOMO-LUMO GAP               3.766617794689 eV   |
           -------------------------------------------------

------------------------------------------------------------------------
 * finished run on 2021/05/19 at 11:00:34.154     
------------------------------------------------------------------------
 total:
 * wall-time:     0 d,  0 h,  0 min,  0.636 sec
 *  cpu-time:     0 d,  0 h,  0 min,  0.634 sec
 * ratio c/w:     0.998 speedup
 SCF:
 * wall-time:     0 d,  0 h,  0 min,  0.032 sec
 *  cpu-time:     0 d,  0 h,  0 min,  0.032 sec
 * ratio c/w:     0.999 speedup
 ANC optimizer:
 * wall-time:     0 d,  0 h,  0 min,  0.583 sec
 *  cpu-time:     0 d,  0 h,  0 min,  0.583 sec
 * ratio c/w:     1.000 speedup

