      -----------------------------------------------------------      
     |                   =====================                   |     
     |                           x T B                           |     
     |                   =====================                   |     
     |                         S. Grimme                         |     
     |          Mulliken Center for Theoretical Chemistry        |     
     |                    University of Bonn                     |     
     |                Version 6.2 RC2 (SAW190805)                |     
      -----------------------------------------------------------      

   This program is distributed in the hope that it will be useful,
   but WITHOUT ANY WARRANTY; without even the implied warranty of
   MERCHANTABILITY or FITNESS FOR A PARTICULAR PURPOSE.
   
   FOR NON-COMMERCIAL, ACADEMIA USE ONLY.
   
   Cite this work as:
   * S. Grimme, C. Bannwarth, P. Shushkov, J. Chem. Theory Comput., 2017,
     13, 1989-2009. DOI: 10.1021/acs.jctc.7b00118
   * C. Bannwarth, S. Ehlert and S. Grimme., J. Chem. Theory Comput., 2019,
     15, 1652-1671. DOI: 10.1021/acs.jctc.8b01176
   * P. Pracht, E. Caldeweyher, S. Ehlert, S. Grimme, ChemRxiv, 2019, preprint.
     DOI: 10.26434/chemrxiv.8326202.v1
   
   for DFT-D4:
   * E. Caldeweyher, C. Bannwarth and S. Grimme, J. Chem. Phys., 2017,
     147, 034112. DOI: 10.1063/1.4993215
   * E. Caldeweyher, S. Ehlert, A. Hansen, H. Neugebauer, S. Spicher,
     C. Bannwarth and S. Grimme, J. Chem. Phys., 2019, 150, 154122.
     DOI: 10.1063/1.5090222
   
   for sTDA-xTB:
   * S. Grimme and C. Bannwarth, J. Chem. Phys., 2016, 145, 054103.
     DOI: 10.1063/1.4959605
   
   in the mass-spec context:
   * V. Asgeirsson, C. Bauer and S. Grimme, Chem. Sci., 2017, 8, 4879.
     DOI: 10.1039/c7sc00601b
   
   for metadynamics refer to:
   * S. Grimme, J. Chem. Theory Comput., 2019, 155, 2847-2862
     DOI: 10.1021/acs.jctc.9b00143
   
   with help from (in alphabetical order)
   C. Bannwarth, F. Bohle, G. Brandenburg, E. Caldeweyher, M. Checinski,
   S. Dohm, S. Ehlert, S. Ehrlich, F. März, H. Neugebauer, J. Pisarek,
   P. Pracht, P. Shushkov, and S. Spicher.
   
 * started run on 2021/05/19 at 11:00:34.910     

           -------------------------------------------------
          |                Calculation Setup                |
           -------------------------------------------------

          program call               : /ihome/ghutchison/geoffh/xtb/xtb 847.xyz -opt
          hostname                   : smp-n83
          coordinate file            : 847.xyz
          omp threads                :                     1
          number of atoms            :                    23
          number of electrons        :                    66
          charge                     :                     0
          spin                       :                   0.0
          first test random number   :      0.73885152712575


########################################################################
# WARNING! Please study the warnings concerning your input carefully
#  - the use of '-opt' is discouraged, please use '--opt' next time
########################################################################

           ------------------------------------------------- 
          |                 G F N 2 - x T B                 |
          | Geometry, Frequencies, Noncovalent interactions |
          |            JCTC 2019 parametrisation            |
           ------------------------------------------------- 
             KAB for C  - Si     :                1.0500
             KAB for H  - Pd     :                0.9500
             k(s)              :                1.8500
             k(p)              :                2.2300
             k(d)              :                2.2300
             k(f)              :                2.0000
             kEN (H0ij)        :               -2.0000
             D4 a1             :                0.5200
             D4 a2             :                5.0000
             D4 s6             :                1.0000
             D4 s8             :                2.7000
             D4 s9             :                5.0000
             alphaj            :                2.0000

  Z AO/shell   Hii/eV     exponent
  1     Wed Apr 25 08:07:45 CEST 2018   EN: 2.200 GM2: 0.406  GM3: 0.0800  RAES: 1.40
     1s    -10.707211    1.230000
  6     Wed Apr 25 08:07:45 CEST 2018   EN: 2.550 GM2: 0.538  GM3: 0.1500  RAES: 3.00
     2s    -13.970922    2.096432
     2p    -10.063292    1.800000
  7     Wed Apr 25 08:07:45 CEST 2018   EN: 3.040 GM2: 0.461  GM3:-0.0640  RAES: 1.90
     2s    -16.686243    2.339881
     2p    -12.523956    2.014332
  8     Wed Apr 25 08:07:45 CEST 2018   EN: 3.440 GM2: 0.452  GM3:-0.0517  RAES: 1.80
     2s    -20.229985    2.439742
     2p    -15.503117    2.137023
 16     Tue Apr 24 11:44:34 CEST 2018   EN: 2.580 GM2: 0.340  GM3:-0.0502  RAES: 3.10
     3s    -20.029654    1.981333
     3p    -11.377694    2.025643
     3d     -0.420282    1.702555

           ------------------------------------------------- 
          |        Self-Consistent Charge Iterations        |
           ------------------------------------------------- 

          ...................................................
          :                      SETUP                      :
          :.................................................:
          :  # basis functions                  65          :
          :  # atomic orbitals                  64          :
          :  # shells                           36          :
          :  # electrons                        66          :
          :  max. iterations                   250          :
          :  Hamiltonian                  GFN2-xTB          :
          :  restarted?                      false          :
          :  GBSA solvation                  false          :
          :  PC potential                    false          :
          :  electronic temp.          300.0000000     K    :
          :  accuracy                    1.0000000          :
          :  -> integral cutoff          0.2500000E+02      :
          :  -> integral neglect         0.1000000E-07      :
          :  -> SCF convergence          0.1000000E-05 Eh   :
          :  -> wf. convergence          0.1000000E-03 e    :
          :  Broyden damping             0.4000000          :
          ...................................................

 iter      E             dE          RMSdq      gap      omega  full diag
   1    -37.3810001 -0.373810E+02  0.409E+00    3.30       0.0  T
   2    -37.4179513 -0.369512E-01  0.221E+00    3.25       1.0  T
   3    -37.4152766  0.267473E-02  0.936E-01    3.19       1.0  T
   4    -37.4197914 -0.451477E-02  0.370E-01    2.88       1.0  T
   5    -37.4215684 -0.177706E-02  0.124E-01    2.91       1.0  T
   6    -37.4216957 -0.127285E-03  0.387E-02    2.90       1.0  T
   7    -37.4216982 -0.253922E-05  0.153E-02    2.91       1.4  T
   8    -37.4216989 -0.659284E-06  0.981E-03    2.91       2.1  T
   9    -37.4216998 -0.924350E-06  0.368E-03    2.91       5.7  T
  10    -37.4216999 -0.745586E-07  0.967E-04    2.91      21.6  T
  11    -37.4216999 -0.250737E-08  0.432E-04    2.91      48.2  T

   *** convergence criteria satisfied after 11 iterations ***

         #    Occupation            Energy/Eh            Energy/eV
      -------------------------------------------------------------
         1        2.0000           -0.7462097             -20.3054
       ...           ...                  ...                  ...
        27        2.0000           -0.4538088             -12.3488
        28        2.0000           -0.4452166             -12.1150
        29        2.0000           -0.4365004             -11.8778
        30        2.0000           -0.4231725             -11.5151
        31        2.0000           -0.4085950             -11.1184
        32        2.0000           -0.4068074             -11.0698
        33        2.0000           -0.3712968             -10.1035 (HOMO)
        34                         -0.2644482              -7.1960 (LUMO)
        35                         -0.2200908              -5.9890
        36                         -0.1911762              -5.2022
        37                         -0.1344315              -3.6581
        38                         -0.0196340              -0.5343
       ...                                ...                  ...
        64                          0.6866138              18.6837
      -------------------------------------------------------------
                  HL-Gap            0.1068486 Eh            2.9075 eV
             Fermi-level           -0.3178725 Eh           -8.6498 eV

 SCC (total)                   0 d,  0 h,  0 min,  0.034 sec
 SCC setup                      ...        0 min,  0.000 sec (  0.887%)
 Dispersion                     ...        0 min,  0.000 sec (  0.896%)
 integral evaluation            ...        0 min,  0.008 sec ( 24.624%)
 zeroth order Hamiltonian       ...        0 min,  0.000 sec (  0.495%)
 iterations                     ...        0 min,  0.012 sec ( 35.581%)
 molecular gradient             ...        0 min,  0.012 sec ( 36.218%)
 printout                       ...        0 min,  0.000 sec (  1.128%)

         :::::::::::::::::::::::::::::::::::::::::::::::::::::
         ::                     SUMMARY                     ::
         :::::::::::::::::::::::::::::::::::::::::::::::::::::
         :: total energy             -37.013863599222 Eh    ::
         :: gradient norm              0.063941840720 Eh/a0 ::
         :: HOMO-LUMO gap              2.907497366446 eV    ::
         ::.................................................::
         :: SCC energy               -37.421699895421 Eh    ::
         :: -> isotropic ES            0.056419542743 Eh    ::
         :: -> anisotropic ES          0.003043228328 Eh    ::
         :: -> anisotropic XC          0.011689996965 Eh    ::
         :: -> dispersion             -0.020683268643 Eh    ::
         :: repulsion energy           0.407754947774 Eh    ::
         :: add. restraining           0.000000000000 Eh    ::
         :::::::::::::::::::::::::::::::::::::::::::::::::::::

      ----------------------------------------------------------- 
     |                   =====================                   |
     |                        A N C O P T                        |
     |                   =====================                   |
     |               Approximate Normal Coordinate               |
     |                Rational Function Optimizer                |
      ----------------------------------------------------------- 

          ...................................................
          :                      SETUP                      :
          :.................................................:
          :   optimization level            normal          :
          :   max. optcycles                   200          :
          :   ANC micro-cycles                  20          :
          :   degrees of freedom                63          :
          :.................................................:
          :   RF solver                   davidson          :
          :   input Hessian                  false          :
          :   write xtbopt.log                true          :
          :   linear?                        false          :
          :   energy convergence         0.5000000E-05 Eh   :
          :   grad. convergence          0.1000000E-02 Eh/α :
          :   maximium RF displ.         2.0000000          :
          :   Hlow (freq-cutoff)         0.5000000E-02      :
          :   Hmax (freq-cutoff)         5.0000000          :
          :   S6 in model hess.         20.0000000          :
          ...................................................

generating ANC from model Hessian ...
Using Lindh-Hessian (1995)
 Shifting diagonal of input Hessian by   3.213960544391287E-003
 Lowest  eigenvalues of input Hessian
   -0.000000   -0.000000   -0.000000   -0.000000    0.000000    0.000000
    0.005000    0.005693    0.006178    0.009082    0.012655    0.013934
    0.015867    0.019022    0.021972    0.022524    0.036169    0.038478
 Highest eigenvalues
    1.448265    1.470983    1.544240    1.695182    1.881463    1.966013
 

........................................................................
.............................. CYCLE    1 ..............................
........................................................................
   1    -37.4216999 -0.374217E+02  0.157E-04    2.91       0.0  T
   2    -37.4216999 -0.743228E-10  0.968E-05    2.91     215.4  T
   3    -37.4216999 -0.104237E-10  0.647E-05    2.91     322.1  T
     SCC iter.                  ...        0 min,  0.004 sec
     gradient                   ...        0 min,  0.012 sec
 * total energy  :   -37.0138636 Eh     change       -0.1308045E-07 Eh
   gradient norm :     0.0639434 Eh/α   predicted     0.0000000E+00 (-100.00%)
   displ. norm   :     0.2337839 α      lambda       -0.7899647E-02
   maximum displ.:     0.1064315 α      in ANC's #17, #9, #36, ...

........................................................................
.............................. CYCLE    2 ..............................
........................................................................
   1    -37.4349555 -0.374350E+02  0.230E-01    2.97       0.0  T
   2    -37.4349920 -0.365246E-04  0.128E-01    2.96       1.0  T
   3    -37.4349895  0.250785E-05  0.332E-02    2.95       1.0  T
   4    -37.4349935 -0.392789E-05  0.149E-02    2.95       1.4  T
   5    -37.4349961 -0.266818E-05  0.591E-03    2.95       3.5  T
   6    -37.4349963 -0.216800E-06  0.168E-03    2.95      12.4  T
     SCC iter.                  ...        0 min,  0.006 sec
     gradient                   ...        0 min,  0.011 sec
 * total energy  :   -37.0189866 Eh     change       -0.5122945E-02 Eh
   gradient norm :     0.0262297 Eh/α   predicted    -0.4165707E-02 ( -18.69%)
   displ. norm   :     0.2028414 α      lambda       -0.1901015E-02
   maximum displ.:     0.1308040 α      in ANC's #6, #17, #9, ...

........................................................................
.............................. CYCLE    3 ..............................
........................................................................
   1    -37.4387767 -0.374388E+02  0.178E-01    2.98       0.0  T
   2    -37.4387993 -0.225953E-04  0.102E-01    2.98       1.0  T
   3    -37.4387988  0.515954E-06  0.254E-02    2.98       1.0  T
   4    -37.4388017 -0.292223E-05  0.889E-03    2.98       2.3  T
   5    -37.4388021 -0.390518E-06  0.528E-03    2.98       3.9  T
   6    -37.4388025 -0.354721E-06  0.144E-03    2.98      14.5  T
     SCC iter.                  ...        0 min,  0.006 sec
     gradient                   ...        0 min,  0.012 sec
 * total energy  :   -37.0201507 Eh     change       -0.1164141E-02 Eh
   gradient norm :     0.0108680 Eh/α   predicted    -0.9896170E-03 ( -14.99%)
   displ. norm   :     0.1355972 α      lambda       -0.4050216E-03
   maximum displ.:     0.0950069 α      in ANC's #6, #9, #7, ...

........................................................................
.............................. CYCLE    4 ..............................
........................................................................
   1    -37.4383659 -0.374384E+02  0.127E-01    2.98       0.0  T
   2    -37.4383736 -0.775242E-05  0.728E-02    2.98       1.0  T
   3    -37.4383718  0.176828E-05  0.189E-02    2.98       1.1  T
   4    -37.4383744 -0.257687E-05  0.996E-03    2.98       2.1  T
   5    -37.4383754 -0.956967E-06  0.399E-03    2.98       5.2  T
   6    -37.4383755 -0.132144E-06  0.947E-04    2.98      22.0  T
   7    -37.4383755 -0.306898E-08  0.451E-04    2.98      46.2  T
     SCC iter.                  ...        0 min,  0.007 sec
     gradient                   ...        0 min,  0.011 sec
 * total energy  :   -37.0204373 Eh     change       -0.2865925E-03 Eh
   gradient norm :     0.0109637 Eh/α   predicted    -0.2062368E-03 ( -28.04%)
   displ. norm   :     0.1448599 α      lambda       -0.3184811E-03
   maximum displ.:     0.0849289 α      in ANC's #6, #1, #7, ...

........................................................................
.............................. CYCLE    5 ..............................
........................................................................
   1    -37.4379347 -0.374379E+02  0.134E-01    2.98       0.0  T
   2    -37.4379415 -0.686572E-05  0.771E-02    2.98       1.0  T
   3    -37.4379402  0.131404E-05  0.179E-02    2.98       1.2  T
   4    -37.4379427 -0.245606E-05  0.101E-02    2.98       2.1  T
   5    -37.4379437 -0.999535E-06  0.359E-03    2.98       5.8  T
   6    -37.4379438 -0.896429E-07  0.100E-03    2.98      20.8  T
   7    -37.4379438 -0.356490E-08  0.491E-04    2.98      42.5  T
     SCC iter.                  ...        0 min,  0.007 sec
     gradient                   ...        0 min,  0.011 sec
 * total energy  :   -37.0206612 Eh     change       -0.2239181E-03 Eh
   gradient norm :     0.0090615 Eh/α   predicted    -0.1625868E-03 ( -27.39%)
   displ. norm   :     0.1482156 α      lambda       -0.2272618E-03
   maximum displ.:     0.0751365 α      in ANC's #6, #1, #7, ...

........................................................................
.............................. CYCLE    6 ..............................
........................................................................
   1    -37.4379533 -0.374380E+02  0.149E-01    2.99       0.0  T
   2    -37.4379595 -0.617765E-05  0.845E-02    2.99       1.0  T
   3    -37.4379584  0.104594E-05  0.194E-02    2.99       1.1  T
   4    -37.4379608 -0.236487E-05  0.117E-02    2.99       1.8  T
   5    -37.4379620 -0.125818E-05  0.278E-03    2.99       7.5  T
   6    -37.4379621 -0.633135E-07  0.110E-03    2.99      18.9  T
     SCC iter.                  ...        0 min,  0.006 sec
     gradient                   ...        0 min,  0.011 sec
 * total energy  :   -37.0208280 Eh     change       -0.1667752E-03 Eh
   gradient norm :     0.0069225 Eh/α   predicted    -0.1161294E-03 ( -30.37%)
   displ. norm   :     0.1809906 α      lambda       -0.2060603E-03
   maximum displ.:     0.0964346 α      in ANC's #1, #6, #7, ...

........................................................................
.............................. CYCLE    7 ..............................
........................................................................
   1    -37.4384007 -0.374384E+02  0.159E-01    3.01       0.0  T
   2    -37.4384073 -0.655648E-05  0.947E-02    3.00       1.0  T
   3    -37.4384083 -0.970027E-06  0.147E-02    3.01       1.4  T
   4    -37.4384097 -0.139376E-05  0.864E-03    3.01       2.4  T
   5    -37.4384102 -0.533045E-06  0.367E-03    3.01       5.7  T
   6    -37.4384103 -0.139818E-06  0.116E-03    3.01      17.9  T
   7    -37.4384103 -0.223940E-08  0.531E-04    3.01      39.3  T
     SCC iter.                  ...        0 min,  0.007 sec
     gradient                   ...        0 min,  0.011 sec
 * total energy  :   -37.0209672 Eh     change       -0.1392392E-03 Eh
   gradient norm :     0.0045752 Eh/α   predicted    -0.1064085E-03 ( -23.58%)
   displ. norm   :     0.1442774 α      lambda       -0.1128189E-03
   maximum displ.:     0.0816888 α      in ANC's #1, #6, #7, ...

........................................................................
.............................. CYCLE    8 ..............................
........................................................................
   1    -37.4394201 -0.374394E+02  0.127E-01    3.02       0.0  T
   2    -37.4394253 -0.523563E-05  0.730E-02    3.02       1.0  T
   3    -37.4394265 -0.115928E-05  0.136E-02    3.02       1.5  T
   4    -37.4394264  0.310210E-07  0.845E-03    3.02       2.5  T
   5    -37.4394273 -0.834345E-06  0.273E-03    3.02       7.6  T
   6    -37.4394274 -0.815588E-07  0.107E-03    3.02      19.5  T
     SCC iter.                  ...        0 min,  0.006 sec
     gradient                   ...        0 min,  0.012 sec
 * total energy  :   -37.0210360 Eh     change       -0.6881649E-04 Eh
   gradient norm :     0.0033921 Eh/α   predicted    -0.5759011E-04 ( -16.31%)
   displ. norm   :     0.1404438 α      lambda       -0.5968071E-04
   maximum displ.:     0.0689313 α      in ANC's #1, #6, #2, ...

........................................................................
.............................. CYCLE    9 ..............................
........................................................................
   1    -37.4389869 -0.374390E+02  0.109E-01    3.04       0.0  T
   2    -37.4389894 -0.252495E-05  0.657E-02    3.04       1.0  T
   3    -37.4389896 -0.148433E-06  0.763E-03    3.04       2.7  T
   4    -37.4389902 -0.658274E-06  0.390E-03    3.04       5.3  T
   5    -37.4389903 -0.942757E-07  0.204E-03    3.04      10.2  T
   6    -37.4389904 -0.370383E-07  0.846E-04    3.04      24.6  T
   7    -37.4389904 -0.281867E-08  0.254E-04    3.04      82.1  T
     SCC iter.                  ...        0 min,  0.007 sec
     gradient                   ...        0 min,  0.012 sec
 * total energy  :   -37.0210437 Eh     change       -0.7706979E-05 Eh
   gradient norm :     0.0067839 Eh/α   predicted    -0.3042934E-04 ( 294.83%)
   displ. norm   :     0.0483302 α      lambda       -0.7941792E-04
   maximum displ.:     0.0274962 α      in ANC's #2, #4, #1, ...

........................................................................
.............................. CYCLE   10 ..............................
........................................................................
   1    -37.4403415 -0.374403E+02  0.525E-02    3.04       0.0  T
   2    -37.4403432 -0.167643E-05  0.274E-02    3.04       1.0  T
   3    -37.4403427  0.506960E-06  0.982E-03    3.04       2.1  T
   4    -37.4403437 -0.102172E-05  0.507E-03    3.04       4.1  T
   5    -37.4403438 -0.141653E-06  0.184E-03    3.04      11.4  T
   6    -37.4403439 -0.192442E-07  0.727E-04    3.04      28.7  T
     SCC iter.                  ...        0 min,  0.006 sec
     gradient                   ...        0 min,  0.011 sec
 * total energy  :   -37.0210813 Eh     change       -0.3751081E-04 Eh
   gradient norm :     0.0026966 Eh/α   predicted    -0.3980218E-04 (   6.11%)
   displ. norm   :     0.0329602 α      lambda       -0.1824335E-04
   maximum displ.:     0.0245330 α      in ANC's #2, #1, #4, ...

........................................................................
.............................. CYCLE   11 ..............................
........................................................................
   1    -37.4400918 -0.374401E+02  0.261E-02    3.04       0.0  T
   2    -37.4400920 -0.284747E-06  0.135E-02    3.05       1.5  T
   3    -37.4400920 -0.712514E-08  0.298E-03    3.05       7.0  T
   4    -37.4400921 -0.328126E-07  0.173E-03    3.05      12.1  T
   5    -37.4400921 -0.159350E-07  0.673E-04    3.05      31.0  T
   6    -37.4400921 -0.624642E-08  0.167E-04    3.05     124.8  T
     SCC iter.                  ...        0 min,  0.006 sec
     gradient                   ...        0 min,  0.012 sec
 * total energy  :   -37.0210957 Eh     change       -0.1442213E-04 Eh
   gradient norm :     0.0017050 Eh/α   predicted    -0.9138380E-05 ( -36.64%)
   displ. norm   :     0.1150447 α      lambda       -0.2327283E-04
   maximum displ.:     0.0825342 α      in ANC's #2, #1, #4, ...

........................................................................
.............................. CYCLE   12 ..............................
........................................................................
   1    -37.4392568 -0.374393E+02  0.587E-02    3.05       0.0  T
   2    -37.4392577 -0.953760E-06  0.347E-02    3.05       1.0  T
   3    -37.4392575  0.239355E-06  0.599E-03    3.05       3.5  T
   4    -37.4392580 -0.455082E-06  0.263E-03    3.05       7.9  T
   5    -37.4392580 -0.545418E-07  0.114E-03    3.05      18.3  T
   6    -37.4392580 -0.966233E-08  0.449E-04    3.05      46.4  T
   7    -37.4392580  0.102041E-09  0.259E-04    3.05      80.4  T
     SCC iter.                  ...        0 min,  0.007 sec
     gradient                   ...        0 min,  0.012 sec
 * total energy  :   -37.0211160 Eh     change       -0.2034688E-04 Eh
   gradient norm :     0.0016295 Eh/α   predicted    -0.1170987E-04 ( -42.45%)
   displ. norm   :     0.0578807 α      lambda       -0.7411929E-05
   maximum displ.:     0.0425622 α      in ANC's #2, #1, #4, ...

........................................................................
.............................. CYCLE   13 ..............................
........................................................................
   1    -37.4394279 -0.374394E+02  0.322E-02    3.05       0.0  T
   2    -37.4394281 -0.217425E-06  0.180E-02    3.05       1.2  T
   3    -37.4394281 -0.754653E-08  0.349E-03    3.05       6.0  T
   4    -37.4394281 -0.200370E-07  0.225E-03    3.05       9.3  T
   5    -37.4394282 -0.558001E-07  0.506E-04    3.05      41.2  T
   6    -37.4394282 -0.206289E-08  0.265E-04    3.05      78.5  T
     SCC iter.                  ...        0 min,  0.006 sec
     gradient                   ...        0 min,  0.012 sec
 * total energy  :   -37.0211253 Eh     change       -0.9305602E-05 Eh
   gradient norm :     0.0012497 Eh/α   predicted    -0.3712972E-05 ( -60.10%)
   displ. norm   :     0.0600747 α      lambda       -0.8282753E-05
   maximum displ.:     0.0458745 α      in ANC's #2, #1, #7, ...

........................................................................
.............................. CYCLE   14 ..............................
........................................................................
   1    -37.4396379 -0.374396E+02  0.343E-02    3.05       0.0  T
   2    -37.4396383 -0.377104E-06  0.187E-02    3.05       1.1  T
   3    -37.4396381  0.218281E-06  0.505E-03    3.05       4.1  T
   4    -37.4396384 -0.300582E-06  0.244E-03    3.05       8.6  T
   5    -37.4396384 -0.395590E-07  0.772E-04    3.05      27.0  T
   6    -37.4396384 -0.344042E-08  0.300E-04    3.05      69.6  T
     SCC iter.                  ...        0 min,  0.006 sec
     gradient                   ...        0 min,  0.012 sec
 * total energy  :   -37.0211349 Eh     change       -0.9612788E-05 Eh
   gradient norm :     0.0006311 Eh/α   predicted    -0.4151625E-05 ( -56.81%)
   displ. norm   :     0.0637100 α      lambda       -0.5386290E-05
   maximum displ.:     0.0470874 α      in ANC's #2, #1, #7, ...

........................................................................
.............................. CYCLE   15 ..............................
........................................................................
   1    -37.4396372 -0.374396E+02  0.324E-02    3.05       0.0  T
   2    -37.4396374 -0.224356E-06  0.181E-02    3.05       1.2  T
   3    -37.4396373  0.908960E-07  0.384E-03    3.05       5.4  T
   4    -37.4396374 -0.126419E-06  0.209E-03    3.05      10.0  T
   5    -37.4396375 -0.351419E-07  0.589E-04    3.05      35.4  T
   6    -37.4396375 -0.323756E-08  0.255E-04    3.05      81.9  T
     SCC iter.                  ...        0 min,  0.006 sec
     gradient                   ...        0 min,  0.012 sec
 * total energy  :   -37.0211414 Eh     change       -0.6415471E-05 Eh
   gradient norm :     0.0006857 Eh/α   predicted    -0.2701478E-05 ( -57.89%)
   displ. norm   :     0.0632269 α      lambda       -0.3935152E-05
   maximum displ.:     0.0455058 α      in ANC's #2, #1, #3, ...

........................................................................
.............................. CYCLE   16 ..............................
........................................................................
   1    -37.4396569 -0.374397E+02  0.327E-02    3.05       0.0  T
   2    -37.4396571 -0.183431E-06  0.181E-02    3.05       1.2  T
   3    -37.4396571 -0.941377E-08  0.310E-03    3.05       6.7  T
   4    -37.4396571  0.187425E-07  0.223E-03    3.05       9.4  T
   5    -37.4396572 -0.684851E-07  0.275E-04    3.05      75.8  T
   6    -37.4396572 -0.308027E-09  0.169E-04    3.05     123.3  T
     SCC iter.                  ...        0 min,  0.006 sec
     gradient                   ...        0 min,  0.012 sec
 * total energy  :   -37.0211463 Eh     change       -0.4895488E-05 Eh
   gradient norm :     0.0006588 Eh/α   predicted    -0.1973166E-05 ( -59.69%)
   displ. norm   :     0.0801813 α      lambda       -0.4011134E-05
   maximum displ.:     0.0553345 α      in ANC's #2, #1, #3, ...

   *** GEOMETRY OPTIMIZATION CONVERGED AFTER 16 ITERATIONS ***

------------------------------------------------------------------------
 total energy gain   :        -0.0072827 Eh       -4.5699 kcal/mol
 total RMSD          :         0.2712437 a0        0.1435 Å
 total power (kW/mol):        -1.1950382 (step)  -43.6890 (real)
------------------------------------------------------------------------

 ANCopt (total)                0 d,  0 h,  0 min,  0.438 sec
 optimizer setup                ...        0 min,  0.000 sec (  0.033%)
 model hessian                  ...        0 min,  0.005 sec (  1.215%)
 ANC generation                 ...        0 min,  0.001 sec (  0.167%)
 coordinate transformation      ...        0 min,  0.000 sec (  0.065%)
 single point calculation       ...        0 min,  0.426 sec ( 97.270%)
 optimization log               ...        0 min,  0.002 sec (  0.353%)
 hessian update                 ...        0 min,  0.000 sec (  0.047%)
 rational function              ...        0 min,  0.003 sec (  0.620%)

================
 final structure:
================
$coord
   -3.18082687351217   -1.55639105047254   -1.28667095948975      C 
   -5.03470674042030    1.08424170540414   -1.80278845504169      S 
   -0.74209620342573   -0.87896878527922   -0.93970329406879      C 
    1.73824452519351   -2.11089899124904   -0.36459351903970      C 
    1.78985792115991   -2.94633309829096    2.23743413166802      N 
    4.10200498621551   -4.26454857570278    2.91510954807966      C 
    4.01624584559707   -5.06601498097483    5.67253615154746      C 
    3.54834784714350   -0.16665673148733   -0.74244738773839      O 
    2.42771239361381    2.27895635479661   -0.68136113139335      C 
    3.55315359921866    3.81454356897965   -2.47888594223766      O 
   -0.34451388112647    1.76694971555596   -1.06795971011743      C 
   -2.47511577647455    3.09563940089694   -1.53190167100419      C 
   -4.03471354046365   -3.39153897452103   -1.29170159267503      H 
    2.24222854428489   -3.64521603117183   -1.70437249707382      H 
    0.25981801151913   -4.05001299751467    2.58924741815988      H 
    5.65330109649565   -2.93984854440437    2.59922411994789      H 
    4.42238522161100   -5.92998738539891    1.69631564213293      H 
    3.68822356683274   -3.42919311165029    6.86723365883897      H 
    5.79481983053611   -5.94097830216775    6.20903031106771      H 
    2.49805918577809   -6.41816390810044    5.98490340719420      H 
    2.78202204623080    3.20174829153178    1.14944121413162      H 
    3.67893984213769    2.88018027269524   -4.04097724483387      H 
   -2.73409971554127    5.09136345394014   -1.73816098650793      H 
$end
           -------------------------------------------------
          |                Final Singlepoint                |
           -------------------------------------------------

          ...................................................
          :                      SETUP                      :
          :.................................................:
          :  # basis functions                  65          :
          :  # atomic orbitals                  64          :
          :  # shells                           36          :
          :  # electrons                        66          :
          :  max. iterations                   250          :
          :  Hamiltonian                  GFN2-xTB          :
          :  restarted?                      false          :
          :  GBSA solvation                  false          :
          :  PC potential                    false          :
          :  electronic temp.          300.0000000     K    :
          :  accuracy                    1.0000000          :
          :  -> integral cutoff          0.2500000E+02      :
          :  -> integral neglect         0.1000000E-07      :
          :  -> SCF convergence          0.1000000E-05 Eh   :
          :  -> wf. convergence          0.1000000E-03 e    :
          :  Broyden damping             0.4000000          :
          ...................................................

 iter      E             dE          RMSdq      gap      omega  full diag
   1    -37.4396572 -0.374397E+02  0.536E-05    3.05       0.0  T
   2    -37.4396572 -0.125979E-10  0.330E-05    3.05     631.6  T
   3    -37.4396572 -0.113332E-10  0.222E-05    3.05     939.1  T

   *** convergence criteria satisfied after 3 iterations ***

         #    Occupation            Energy/Eh            Energy/eV
      -------------------------------------------------------------
         1        2.0000           -0.7418225             -20.1860
       ...           ...                  ...                  ...
        27        2.0000           -0.4531808             -12.3317
        28        2.0000           -0.4447469             -12.1022
        29        2.0000           -0.4367467             -11.8845
        30        2.0000           -0.4134265             -11.2499
        31        2.0000           -0.4079683             -11.1014
        32        2.0000           -0.4032414             -10.9728
        33        2.0000           -0.3698728             -10.0648 (HOMO)
        34                         -0.2577675              -7.0142 (LUMO)
        35                         -0.2174453              -5.9170
        36                         -0.1861379              -5.0651
        37                         -0.1294567              -3.5227
        38                         -0.0111934              -0.3046
       ...                                ...                  ...
        64                          0.7090502              19.2942
      -------------------------------------------------------------
                  HL-Gap            0.1121053 Eh            3.0505 eV
             Fermi-level           -0.3138202 Eh           -8.5395 eV

 SCC (total)                   0 d,  0 h,  0 min,  0.024 sec
 SCC setup                      ...        0 min,  0.000 sec (  0.777%)
 Dispersion                     ...        0 min,  0.000 sec (  0.731%)
 integral evaluation            ...        0 min,  0.008 sec ( 32.153%)
 zeroth order Hamiltonian       ...        0 min,  0.000 sec (  0.568%)
 iterations                     ...        0 min,  0.004 sec ( 14.871%)
 molecular gradient             ...        0 min,  0.012 sec ( 49.321%)
 printout                       ...        0 min,  0.000 sec (  1.386%)

         :::::::::::::::::::::::::::::::::::::::::::::::::::::
         ::                     SUMMARY                     ::
         :::::::::::::::::::::::::::::::::::::::::::::::::::::
         :: total energy             -37.021146248028 Eh    ::
         :: gradient norm              0.000657998824 Eh/a0 ::
         :: HOMO-LUMO gap              3.050540886351 eV    ::
         ::.................................................::
         :: SCC energy               -37.439657160128 Eh    ::
         :: -> isotropic ES            0.054851353672 Eh    ::
         :: -> anisotropic ES          0.001340703190 Eh    ::
         :: -> anisotropic XC          0.010402581508 Eh    ::
         :: -> dispersion             -0.020680634757 Eh    ::
         :: repulsion energy           0.418418914960 Eh    ::
         :: add. restraining           0.000000000000 Eh    ::
         :::::::::::::::::::::::::::::::::::::::::::::::::::::

           -------------------------------------------------
          |                Property Printout                |
           -------------------------------------------------

    * Orbital Energies and Occupations

         #    Occupation            Energy/Eh            Energy/eV
      -------------------------------------------------------------
         1        2.0000           -0.7418225             -20.1860
       ...           ...                  ...                  ...
        21        2.0000           -0.4922753             -13.3955
        22        2.0000           -0.4875768             -13.2676
        23        2.0000           -0.4845613             -13.1856
        24        2.0000           -0.4745125             -12.9121
        25        2.0000           -0.4682691             -12.7423
        26        2.0000           -0.4575126             -12.4496
        27        2.0000           -0.4531808             -12.3317
        28        2.0000           -0.4447469             -12.1022
        29        2.0000           -0.4367467             -11.8845
        30        2.0000           -0.4134265             -11.2499
        31        2.0000           -0.4079683             -11.1014
        32        2.0000           -0.4032414             -10.9728
        33        2.0000           -0.3698728             -10.0648 (HOMO)
        34                         -0.2577675              -7.0142 (LUMO)
        35                         -0.2174453              -5.9170
        36                         -0.1861379              -5.0651
        37                         -0.1294567              -3.5227
        38                         -0.0111934              -0.3046
        39                          0.0068094               0.1853
        40                          0.0180144               0.4902
        41                          0.0231632               0.6303
        42                          0.0461451               1.2557
        43                          0.0543692               1.4795
        44                          0.0895140               2.4358
       ...                                ...                  ...
        64                          0.7090502              19.2942
      -------------------------------------------------------------
                  HL-Gap            0.1121053 Eh            3.0505 eV
             Fermi-level           -0.3138202 Eh           -8.5395 eV

     #   Z        covCN         q      C6AA      α(0)
     1   6 C      2.932    -0.032    28.802     8.801
     2  16 S      2.361     0.004   140.903    19.978
     3   6 C      3.221    -0.028    27.947     8.594
     4   6 C      3.724     0.193    17.640     5.998
     5   7 N      2.684    -0.275    27.104     7.732
     6   6 C      3.741     0.023    20.267     6.423
     7   6 C      3.753    -0.110    22.665     6.789
     8   8 O      1.704    -0.342    19.750     6.000
     9   6 C      3.653     0.252    16.983     5.918
    10   8 O      1.657    -0.427    21.382     6.242
    11   6 C      3.222    -0.035    28.117     8.620
    12   6 C      2.932    -0.026    28.643     8.777
    13   1 H      0.926     0.049     2.327     2.385
    14   1 H      0.922     0.008     2.917     2.671
    15   1 H      0.860     0.142     1.455     1.890
    16   1 H      0.924     0.052     2.293     2.368
    17   1 H      0.922     0.004     2.988     2.703
    18   1 H      0.925     0.052     2.300     2.372
    19   1 H      0.925     0.044     2.400     2.423
    20   1 H      0.925     0.037     2.489     2.467
    21   1 H      0.923     0.048     2.348     2.396
    22   1 H      0.805     0.310     0.693     1.307
    23   1 H      0.927     0.059     2.215     2.327

 Mol. C6AA /au·bohr⁶  :       6559.264544
 Mol. C8AA /au·bohr⁸  :     170163.840097
 Mol. α(0) /au        :        125.182783


Wiberg/Mayer (AO) data.
largest (>0.10) Wiberg bond orders for each atom
          total WBO             WBO to atom ...
     1  C   3.950        C    3 1.618    S    2 1.186    H   13 0.970    C   12 0.117
     2  S   2.624        C   12 1.187    C    1 1.186
     3  C   3.983        C    1 1.618    C   11 1.216    C    4 0.984
     4  C   3.953        N    5 0.995    C    3 0.984    O    8 0.965    H   14 0.939
     5  N   3.069        C    6 1.003    C    4 0.995    H   15 0.951
     6  C   3.980        C    7 1.018    N    5 1.003    H   16 0.973    H   17 0.967
     7  C   3.995        C    6 1.018    H   20 0.987    H   18 0.987    H   19 0.985
     8  O   2.073        C    4 0.965    C    9 0.954
     9  C   3.931        O   10 1.011    C   11 0.969    O    8 0.954    H   21 0.941
    10  O   1.994        C    9 1.011    H   22 0.885
    11  C   3.982        C   12 1.622    C    3 1.216    C    9 0.969
    12  C   3.951        C   11 1.622    S    2 1.187    H   23 0.969    C    1 0.117
    13  H   0.997        C    1 0.970
    14  H   1.000        C    4 0.939
    15  H   0.980        N    5 0.951
    16  H   0.997        C    6 0.973
    17  H   1.000        C    6 0.967
    18  H   0.997        C    7 0.987
    19  H   0.997        C    7 0.985
    20  H   0.999        C    7 0.987
    21  H   0.998        C    9 0.941
    22  H   0.904        O   10 0.885
    23  H   0.996        C   12 0.969

molecular dipole:
                 x           y           z       tot (Debye)
 q only:       -0.630      -0.478       0.016
   full:       -0.505      -0.964      -0.152       2.792
molecular quadrupole (traceless):
                xx          xy          yy          xz          yz          zz
 q only:       -3.890      -2.939       0.409       1.403      -1.969       3.481
  q+dip:       -7.391      -3.569       4.150      -0.226       0.210       3.240
   full:       -8.061      -3.469       4.045      -0.645      -0.565       4.017

           -------------------------------------------------
          |                Geometry Summary                 |
           -------------------------------------------------

      molecular mass/u    :      185.2404000
   center of mass at/Å    :        0.1950571      -0.1537101      -0.0768953
  moments of inertia/u·Å² :        0.3989271E+03   0.9188566E+03   0.1223816E+04
rotational constants/cm⁻¹ :        0.4225743E-01   0.1834631E-01   0.1377465E-01

 * 23 selected distances

     #   Z        #   Z                                     value/Å
     1   6 C      2  16 S                                 1.7290570 (max)
     1   6 C      3   6 C                                 1.3519101
     3   6 C      4   6 C                                 1.4967855
     4   6 C      5   7 N                                 1.4464228
     5   7 N      6   6 C                                 1.4533562
     6   6 C      7   6 C                                 1.5202319
     4   6 C      8   8 O                                 1.4198651
     8   8 O      9   6 C                                 1.4239273
     9   6 C     10   8 O                                 1.3855697
     3   6 C     11   6 C                                 1.4175044
     2  16 S     12   6 C                                 1.7286048
    11   6 C     12   6 C                                 1.3512293
     1   6 C     13   1 H                                 1.0710992
     4   6 C     14   1 H                                 1.1104071
     5   7 N     15   1 H                                 1.0155385
     6   6 C     16   1 H                                 1.0923548
     6   6 C     17   1 H                                 1.1051812
     7   6 C     18   1 H                                 1.0863078
     7   6 C     19   1 H                                 1.0866462
     7   6 C     20   1 H                                 1.0884561
     9   6 C     21   1 H                                 1.1010089
    10   8 O     22   1 H                                 0.9655109 (min)
    12   6 C     23   1 H                                 1.0705257

 * 7 distinct bonds (by element types)

   Z      Z             #   av. dist./Å        max./Å        min./Å
   1 H    6 C           9     1.0902208     1.1104071     1.0705257
   6 C    6 C           5     1.4275323     1.5202319     1.3512293
   1 H    7 N           1     1.0155385     1.0155385     1.0155385
   6 C    7 N           2     1.4498895     1.4533562     1.4464228
   1 H    8 O           1     0.9655109     0.9655109     0.9655109
   6 C    8 O           3     1.4097874     1.4239273     1.3855697
   6 C   16 S           2     1.7288309     1.7290570     1.7286048


optimized geometry written to: xtbopt.xyz


           -------------------------------------------------
          | TOTAL ENERGY              -37.021146248028 Eh   |
          | GRADIENT NORM               0.000657998824 Eh/α |
          | HOMO-LUMO GAP               3.050540886351 eV   |
           -------------------------------------------------

------------------------------------------------------------------------
 * finished run on 2021/05/19 at 11:00:35.428     
------------------------------------------------------------------------
 total:
 * wall-time:     0 d,  0 h,  0 min,  0.518 sec
 *  cpu-time:     0 d,  0 h,  0 min,  0.516 sec
 * ratio c/w:     0.998 speedup
 SCF:
 * wall-time:     0 d,  0 h,  0 min,  0.034 sec
 *  cpu-time:     0 d,  0 h,  0 min,  0.034 sec
 * ratio c/w:     0.998 speedup
 ANC optimizer:
 * wall-time:     0 d,  0 h,  0 min,  0.463 sec
 *  cpu-time:     0 d,  0 h,  0 min,  0.463 sec
 * ratio c/w:     1.000 speedup

