      -----------------------------------------------------------      
     |                   =====================                   |     
     |                           x T B                           |     
     |                   =====================                   |     
     |                         S. Grimme                         |     
     |          Mulliken Center for Theoretical Chemistry        |     
     |                    University of Bonn                     |     
     |                Version 6.2 RC2 (SAW190805)                |     
      -----------------------------------------------------------      

   This program is distributed in the hope that it will be useful,
   but WITHOUT ANY WARRANTY; without even the implied warranty of
   MERCHANTABILITY or FITNESS FOR A PARTICULAR PURPOSE.
   
   FOR NON-COMMERCIAL, ACADEMIA USE ONLY.
   
   Cite this work as:
   * S. Grimme, C. Bannwarth, P. Shushkov, J. Chem. Theory Comput., 2017,
     13, 1989-2009. DOI: 10.1021/acs.jctc.7b00118
   * C. Bannwarth, S. Ehlert and S. Grimme., J. Chem. Theory Comput., 2019,
     15, 1652-1671. DOI: 10.1021/acs.jctc.8b01176
   * P. Pracht, E. Caldeweyher, S. Ehlert, S. Grimme, ChemRxiv, 2019, preprint.
     DOI: 10.26434/chemrxiv.8326202.v1
   
   for DFT-D4:
   * E. Caldeweyher, C. Bannwarth and S. Grimme, J. Chem. Phys., 2017,
     147, 034112. DOI: 10.1063/1.4993215
   * E. Caldeweyher, S. Ehlert, A. Hansen, H. Neugebauer, S. Spicher,
     C. Bannwarth and S. Grimme, J. Chem. Phys., 2019, 150, 154122.
     DOI: 10.1063/1.5090222
   
   for sTDA-xTB:
   * S. Grimme and C. Bannwarth, J. Chem. Phys., 2016, 145, 054103.
     DOI: 10.1063/1.4959605
   
   in the mass-spec context:
   * V. Asgeirsson, C. Bauer and S. Grimme, Chem. Sci., 2017, 8, 4879.
     DOI: 10.1039/c7sc00601b
   
   for metadynamics refer to:
   * S. Grimme, J. Chem. Theory Comput., 2019, 155, 2847-2862
     DOI: 10.1021/acs.jctc.9b00143
   
   with help from (in alphabetical order)
   C. Bannwarth, F. Bohle, G. Brandenburg, E. Caldeweyher, M. Checinski,
   S. Dohm, S. Ehlert, S. Ehrlich, F. März, H. Neugebauer, J. Pisarek,
   P. Pracht, P. Shushkov, and S. Spicher.
   
 * started run on 2021/05/19 at 11:00:35.517     

           -------------------------------------------------
          |                Calculation Setup                |
           -------------------------------------------------

          program call               : /ihome/ghutchison/geoffh/xtb/xtb 848.xyz -opt
          hostname                   : smp-n83
          coordinate file            : 848.xyz
          omp threads                :                     1
          number of atoms            :                    27
          number of electrons        :                    62
          charge                     :                     0
          spin                       :                   0.0
          first test random number   :      0.79168664258596


########################################################################
# WARNING! Please study the warnings concerning your input carefully
#  - the use of '-opt' is discouraged, please use '--opt' next time
########################################################################

           ------------------------------------------------- 
          |                 G F N 2 - x T B                 |
          | Geometry, Frequencies, Noncovalent interactions |
          |            JCTC 2019 parametrisation            |
           ------------------------------------------------- 
             KAB for C  - Si     :                1.0500
             KAB for H  - Pd     :                0.9500
             k(s)              :                1.8500
             k(p)              :                2.2300
             k(d)              :                2.2300
             k(f)              :                2.0000
             kEN (H0ij)        :               -2.0000
             D4 a1             :                0.5200
             D4 a2             :                5.0000
             D4 s6             :                1.0000
             D4 s8             :                2.7000
             D4 s9             :                5.0000
             alphaj            :                2.0000

  Z AO/shell   Hii/eV     exponent
  1     Wed Apr 25 08:07:45 CEST 2018   EN: 2.200 GM2: 0.406  GM3: 0.0800  RAES: 1.40
     1s    -10.707211    1.230000
  6     Wed Apr 25 08:07:45 CEST 2018   EN: 2.550 GM2: 0.538  GM3: 0.1500  RAES: 3.00
     2s    -13.970922    2.096432
     2p    -10.063292    1.800000
  7     Wed Apr 25 08:07:45 CEST 2018   EN: 3.040 GM2: 0.461  GM3:-0.0640  RAES: 1.90
     2s    -16.686243    2.339881
     2p    -12.523956    2.014332

           ------------------------------------------------- 
          |        Self-Consistent Charge Iterations        |
           ------------------------------------------------- 

          ...................................................
          :                      SETUP                      :
          :.................................................:
          :  # basis functions                  60          :
          :  # atomic orbitals                  60          :
          :  # shells                           38          :
          :  # electrons                        62          :
          :  max. iterations                   250          :
          :  Hamiltonian                  GFN2-xTB          :
          :  restarted?                      false          :
          :  GBSA solvation                  false          :
          :  PC potential                    false          :
          :  electronic temp.          300.0000000     K    :
          :  accuracy                    1.0000000          :
          :  -> integral cutoff          0.2500000E+02      :
          :  -> integral neglect         0.1000000E-07      :
          :  -> SCF convergence          0.1000000E-05 Eh   :
          :  -> wf. convergence          0.1000000E-03 e    :
          :  Broyden damping             0.4000000          :
          ...................................................

 iter      E             dE          RMSdq      gap      omega  full diag
   1    -33.6773507 -0.336774E+02  0.289E+00    4.89       0.0  T
   2    -33.7458270 -0.684762E-01  0.200E+00    4.52       1.0  T
   3    -33.7555325 -0.970556E-02  0.104E+00    4.76       1.0  T
   4    -33.7567536 -0.122113E-02  0.414E-01    4.49       1.0  T
   5    -33.7587962 -0.204253E-02  0.913E-02    4.60       1.0  T
   6    -33.7588221 -0.258926E-04  0.404E-02    4.61       1.0  T
   7    -33.7588366 -0.145320E-04  0.210E-02    4.62       1.0  T
   8    -33.7588385 -0.188692E-05  0.460E-03    4.61       4.2  T
   9    -33.7588387 -0.231250E-06  0.170E-03    4.62      11.3  T
  10    -33.7588388 -0.255249E-07  0.694E-04    4.61      27.7  T
  11    -33.7588388 -0.134924E-08  0.232E-04    4.61      82.8  T

   *** convergence criteria satisfied after 11 iterations ***

         #    Occupation            Energy/Eh            Energy/eV
      -------------------------------------------------------------
         1        2.0000           -0.6719594             -18.2849
       ...           ...                  ...                  ...
        25        2.0000           -0.4351029             -11.8398
        26        2.0000           -0.4320012             -11.7554
        27        2.0000           -0.4220939             -11.4858
        28        2.0000           -0.4197781             -11.4227
        29        2.0000           -0.3824181             -10.4061
        30        2.0000           -0.3787756             -10.3070
        31        2.0000           -0.3711806             -10.1003 (HOMO)
        32                         -0.2015855              -5.4854 (LUMO)
        33                         -0.1496949              -4.0734
        34                          0.0011413               0.0311
        35                          0.0927481               2.5238
        36                          0.0957675               2.6060
       ...                                ...                  ...
        60                          0.6430695              17.4988
      -------------------------------------------------------------
                  HL-Gap            0.1695951 Eh            4.6149 eV
             Fermi-level           -0.2863831 Eh           -7.7929 eV

 SCC (total)                   0 d,  0 h,  0 min,  0.031 sec
 SCC setup                      ...        0 min,  0.000 sec (  0.939%)
 Dispersion                     ...        0 min,  0.000 sec (  1.146%)
 integral evaluation            ...        0 min,  0.007 sec ( 21.303%)
 zeroth order Hamiltonian       ...        0 min,  0.000 sec (  0.471%)
 iterations                     ...        0 min,  0.012 sec ( 37.352%)
 molecular gradient             ...        0 min,  0.012 sec ( 37.352%)
 printout                       ...        0 min,  0.000 sec (  1.271%)

         :::::::::::::::::::::::::::::::::::::::::::::::::::::
         ::                     SUMMARY                     ::
         :::::::::::::::::::::::::::::::::::::::::::::::::::::
         :: total energy             -33.286099570539 Eh    ::
         :: gradient norm              0.049557661101 Eh/a0 ::
         :: HOMO-LUMO gap              4.614917098159 eV    ::
         ::.................................................::
         :: SCC energy               -33.758838753915 Eh    ::
         :: -> isotropic ES            0.012706583189 Eh    ::
         :: -> anisotropic ES          0.007119416206 Eh    ::
         :: -> anisotropic XC          0.023497309256 Eh    ::
         :: -> dispersion             -0.020895878541 Eh    ::
         :: repulsion energy           0.472551587919 Eh    ::
         :: add. restraining           0.000000000000 Eh    ::
         :::::::::::::::::::::::::::::::::::::::::::::::::::::

      ----------------------------------------------------------- 
     |                   =====================                   |
     |                        A N C O P T                        |
     |                   =====================                   |
     |               Approximate Normal Coordinate               |
     |                Rational Function Optimizer                |
      ----------------------------------------------------------- 

          ...................................................
          :                      SETUP                      :
          :.................................................:
          :   optimization level            normal          :
          :   max. optcycles                   200          :
          :   ANC micro-cycles                  20          :
          :   degrees of freedom                75          :
          :.................................................:
          :   RF solver                   davidson          :
          :   input Hessian                  false          :
          :   write xtbopt.log                true          :
          :   linear?                        false          :
          :   energy convergence         0.5000000E-05 Eh   :
          :   grad. convergence          0.1000000E-02 Eh/α :
          :   maximium RF displ.         2.0000000          :
          :   Hlow (freq-cutoff)         0.5000000E-02      :
          :   Hmax (freq-cutoff)         5.0000000          :
          :   S6 in model hess.         20.0000000          :
          ...................................................

generating ANC from model Hessian ...
Using Lindh-Hessian (1995)
 Shifting diagonal of input Hessian by   3.693054820848226E-003
 Lowest  eigenvalues of input Hessian
   -0.000000   -0.000000   -0.000000    0.000000    0.000000    0.000000
    0.005000    0.005222    0.005932    0.006592    0.009336    0.009887
    0.010947    0.011887    0.013020    0.014990    0.018504    0.022220
 Highest eigenvalues
    1.256156    1.580258    1.739181    1.830922    1.985350    2.010714
 

........................................................................
.............................. CYCLE    1 ..............................
........................................................................
   1    -33.7588388 -0.337588E+02  0.746E-05    4.61       0.0  T
   2    -33.7588388 -0.557066E-11  0.446E-05    4.61     431.5  T
   3    -33.7588388 -0.146372E-11  0.105E-05    4.61    1826.1  T
     SCC iter.                  ...        0 min,  0.004 sec
     gradient                   ...        0 min,  0.011 sec
 * total energy  :   -33.2860995 Eh     change        0.2497310E-07 Eh
   gradient norm :     0.0495578 Eh/α   predicted     0.0000000E+00 (-100.00%)
   displ. norm   :     0.1408133 α      lambda       -0.3809092E-02
   maximum displ.:     0.0502558 α      in ANC's #11, #27, #51, ...

........................................................................
.............................. CYCLE    2 ..............................
........................................................................
   1    -33.7753884 -0.337754E+02  0.142E-01    4.75       0.0  T
   2    -33.7754619 -0.734847E-04  0.734E-02    4.74       1.0  T
   3    -33.7754637 -0.183601E-05  0.341E-02    4.75       1.0  T
   4    -33.7754720 -0.827747E-05  0.104E-02    4.74       1.8  T
   5    -33.7754735 -0.149430E-05  0.325E-03    4.75       5.9  T
   6    -33.7754735 -0.219902E-07  0.158E-03    4.75      12.2  T
     SCC iter.                  ...        0 min,  0.006 sec
     gradient                   ...        0 min,  0.011 sec
 * total energy  :   -33.2884772 Eh     change       -0.2377657E-02 Eh
   gradient norm :     0.0156147 Eh/α   predicted    -0.1942312E-02 ( -18.31%)
   displ. norm   :     0.0811891 α      lambda       -0.4335403E-03
   maximum displ.:     0.0392915 α      in ANC's #2, #6, #7, ...

........................................................................
.............................. CYCLE    3 ..............................
........................................................................
   1    -33.7814931 -0.337815E+02  0.542E-02    4.79       0.0  T
   2    -33.7815056 -0.125501E-04  0.297E-02    4.79       1.0  T
   3    -33.7815063 -0.688377E-06  0.145E-02    4.79       1.3  T
   4    -33.7815078 -0.147276E-05  0.399E-03    4.79       4.8  T
   5    -33.7815080 -0.214268E-06  0.121E-03    4.79      15.9  T
   6    -33.7815080 -0.726212E-08  0.584E-04    4.79      33.0  T
     SCC iter.                  ...        0 min,  0.006 sec
     gradient                   ...        0 min,  0.011 sec
 * total energy  :   -33.2887218 Eh     change       -0.2446220E-03 Eh
   gradient norm :     0.0032678 Eh/α   predicted    -0.2182044E-03 ( -10.80%)
   displ. norm   :     0.0594298 α      lambda       -0.4883969E-04
   maximum displ.:     0.0400922 α      in ANC's #2, #7, #6, ...

........................................................................
.............................. CYCLE    4 ..............................
........................................................................
   1    -33.7819968 -0.337820E+02  0.239E-02    4.79       0.0  T
   2    -33.7819975 -0.679063E-06  0.138E-02    4.79       1.4  T
   3    -33.7819973  0.221961E-06  0.464E-03    4.79       4.2  T
   4    -33.7819977 -0.380186E-06  0.985E-04    4.79      19.5  T
   5    -33.7819977 -0.105615E-07  0.439E-04    4.79      43.8  T
     SCC iter.                  ...        0 min,  0.005 sec
     gradient                   ...        0 min,  0.012 sec
 * total energy  :   -33.2887601 Eh     change       -0.3828018E-04 Eh
   gradient norm :     0.0016137 Eh/α   predicted    -0.2451189E-04 ( -35.97%)
   displ. norm   :     0.1511125 α      lambda       -0.5109305E-04
   maximum displ.:     0.0987243 α      in ANC's #2, #7, #6, ...

........................................................................
.............................. CYCLE    5 ..............................
........................................................................
   1    -33.7815669 -0.337816E+02  0.621E-02    4.78       0.0  T
   2    -33.7815685 -0.161055E-05  0.357E-02    4.78       1.0  T
   3    -33.7815685  0.790666E-07  0.540E-03    4.78       3.6  T
   4    -33.7815690 -0.553620E-06  0.208E-03    4.78       9.3  T
   5    -33.7815690 -0.275702E-07  0.787E-04    4.78      24.5  T
   6    -33.7815690 -0.321122E-08  0.174E-04    4.78     110.8  T
     SCC iter.                  ...        0 min,  0.006 sec
     gradient                   ...        0 min,  0.012 sec
 * total energy  :   -33.2888053 Eh     change       -0.4521975E-04 Eh
   gradient norm :     0.0031999 Eh/α   predicted    -0.2580976E-04 ( -42.92%)
   displ. norm   :     0.0561671 α      lambda       -0.1989755E-04
   maximum displ.:     0.0370811 α      in ANC's #2, #1, #7, ...

........................................................................
.............................. CYCLE    6 ..............................
........................................................................
   1    -33.7815210 -0.337815E+02  0.219E-02    4.78       0.0  T
   2    -33.7815212 -0.192195E-06  0.127E-02    4.78       1.5  T
   3    -33.7815211  0.663115E-07  0.266E-03    4.78       7.2  T
   4    -33.7815212 -0.132002E-06  0.643E-04    4.78      29.9  T
   5    -33.7815212 -0.678341E-09  0.246E-04    4.78      78.2  T
     SCC iter.                  ...        0 min,  0.005 sec
     gradient                   ...        0 min,  0.011 sec
 * total energy  :   -33.2888234 Eh     change       -0.1805874E-04 Eh
   gradient norm :     0.0024959 Eh/α   predicted    -0.9980520E-05 ( -44.73%)
   displ. norm   :     0.1205489 α      lambda       -0.4144877E-04
   maximum displ.:     0.0758647 α      in ANC's #2, #1, #6, ...

........................................................................
.............................. CYCLE    7 ..............................
........................................................................
   1    -33.7814593 -0.337815E+02  0.454E-02    4.78       0.0  T
   2    -33.7814601 -0.796457E-06  0.265E-02    4.78       1.0  T
   3    -33.7814597  0.363113E-06  0.551E-03    4.78       3.5  T
   4    -33.7814603 -0.613091E-06  0.120E-03    4.78      16.0  T
   5    -33.7814603 -0.436535E-08  0.505E-04    4.78      38.1  T
   6    -33.7814603 -0.160602E-08  0.120E-04    4.78     160.6  T
     SCC iter.                  ...        0 min,  0.006 sec
     gradient                   ...        0 min,  0.012 sec
 * total energy  :   -33.2888560 Eh     change       -0.3257508E-04 Eh
   gradient norm :     0.0008778 Eh/α   predicted    -0.2102609E-04 ( -35.45%)
   displ. norm   :     0.2044810 α      lambda       -0.2985709E-04
   maximum displ.:     0.1265342 α      in ANC's #2, #1, #6, ...

........................................................................
.............................. CYCLE    8 ..............................
........................................................................
   1    -33.7813202 -0.337813E+02  0.728E-02    4.78       0.0  T
   2    -33.7813214 -0.128788E-05  0.425E-02    4.78       1.0  T
   3    -33.7813213  0.164500E-06  0.551E-03    4.78       3.5  T
   4    -33.7813219 -0.594447E-06  0.178E-03    4.78      10.8  T
   5    -33.7813219 -0.692681E-08  0.546E-04    4.78      35.3  T
   6    -33.7813219 -0.279458E-08  0.138E-04    4.78     139.6  T
     SCC iter.                  ...        0 min,  0.006 sec
     gradient                   ...        0 min,  0.012 sec
 * total energy  :   -33.2888849 Eh     change       -0.2892414E-04 Eh
   gradient norm :     0.0023108 Eh/α   predicted    -0.1521152E-04 ( -47.41%)
   displ. norm   :     0.0644038 α      lambda       -0.1225036E-04
   maximum displ.:     0.0451985 α      in ANC's #1, #2, #3, ...

........................................................................
.............................. CYCLE    9 ..............................
........................................................................
   1    -33.7816017 -0.337816E+02  0.204E-02    4.78       0.0  T
   2    -33.7816018 -0.730557E-07  0.119E-02    4.78       1.6  T
   3    -33.7816018  0.229152E-07  0.160E-03    4.78      12.0  T
   4    -33.7816018 -0.451078E-07  0.435E-04    4.78      44.3  T
   5    -33.7816018 -0.859700E-09  0.176E-04    4.78     109.4  T
     SCC iter.                  ...        0 min,  0.005 sec
     gradient                   ...        0 min,  0.011 sec
 * total energy  :   -33.2888959 Eh     change       -0.1096763E-04 Eh
   gradient norm :     0.0018031 Eh/α   predicted    -0.6156364E-05 ( -43.87%)
   displ. norm   :     0.1075319 α      lambda       -0.1610813E-04
   maximum displ.:     0.0787378 α      in ANC's #1, #2, #3, ...

........................................................................
.............................. CYCLE   10 ..............................
........................................................................
   1    -33.7820464 -0.337820E+02  0.326E-02    4.78       0.0  T
   2    -33.7820468 -0.432225E-06  0.191E-02    4.78       1.0  T
   3    -33.7820465  0.336958E-06  0.524E-03    4.78       3.7  T
   4    -33.7820469 -0.454972E-06  0.766E-04    4.78      25.1  T
   5    -33.7820469 -0.449538E-08  0.337E-04    4.78      57.1  T
     SCC iter.                  ...        0 min,  0.005 sec
     gradient                   ...        0 min,  0.012 sec
 * total energy  :   -33.2889142 Eh     change       -0.1834945E-04 Eh
   gradient norm :     0.0005472 Eh/α   predicted    -0.8097411E-05 ( -55.87%)
   displ. norm   :     0.0867525 α      lambda       -0.8509694E-05
   maximum displ.:     0.0648773 α      in ANC's #1, #2, #3, ...

........................................................................
.............................. CYCLE   11 ..............................
........................................................................
   1    -33.7818737 -0.337819E+02  0.276E-02    4.78       0.0  T
   2    -33.7818738 -0.119364E-06  0.162E-02    4.78       1.2  T
   3    -33.7818737  0.728272E-07  0.247E-03    4.78       7.8  T
   4    -33.7818738 -0.114488E-06  0.562E-04    4.78      34.2  T
   5    -33.7818738 -0.826233E-09  0.221E-04    4.78      87.1  T
     SCC iter.                  ...        0 min,  0.005 sec
     gradient                   ...        0 min,  0.012 sec
 * total energy  :   -33.2889246 Eh     change       -0.1043870E-04 Eh
   gradient norm :     0.0008348 Eh/α   predicted    -0.4272794E-05 ( -59.07%)
   displ. norm   :     0.0725814 α      lambda       -0.6061954E-05
   maximum displ.:     0.0529985 α      in ANC's #1, #3, #5, ...

........................................................................
.............................. CYCLE   12 ..............................
........................................................................
   1    -33.7818888 -0.337819E+02  0.239E-02    4.78       0.0  T
   2    -33.7818888 -0.379415E-07  0.141E-02    4.78       1.4  T
   3    -33.7818888 -0.950417E-08  0.695E-04    4.78      27.7  T
   4    -33.7818888 -0.456082E-08  0.358E-04    4.78      53.7  T
     SCC iter.                  ...        0 min,  0.004 sec
     gradient                   ...        0 min,  0.012 sec
 * total energy  :   -33.2889323 Eh     change       -0.7690364E-05 Eh
   gradient norm :     0.0006908 Eh/α   predicted    -0.3042789E-05 ( -60.43%)
   displ. norm   :     0.0735286 α      lambda       -0.3415956E-05
   maximum displ.:     0.0542897 α      in ANC's #1, #3, #5, ...

........................................................................
.............................. CYCLE   13 ..............................
........................................................................
   1    -33.7818278 -0.337818E+02  0.242E-02    4.78       0.0  T
   2    -33.7818278 -0.390089E-07  0.143E-02    4.78       1.3  T
   3    -33.7818278 -0.808593E-08  0.788E-04    4.78      24.4  T
   4    -33.7818278 -0.676178E-08  0.381E-04    4.78      50.5  T
     SCC iter.                  ...        0 min,  0.004 sec
     gradient                   ...        0 min,  0.011 sec
 * total energy  :   -33.2889370 Eh     change       -0.4644189E-05 Eh
   gradient norm :     0.0006654 Eh/α   predicted    -0.1715794E-05 ( -63.06%)
   displ. norm   :     0.0505504 α      lambda       -0.3485282E-05
   maximum displ.:     0.0366162 α      in ANC's #1, #3, #5, ...

   *** GEOMETRY OPTIMIZATION CONVERGED AFTER 13 ITERATIONS ***

------------------------------------------------------------------------
 total energy gain   :        -0.0028374 Eh       -1.7805 kcal/mol
 total RMSD          :         0.1907289 a0        0.1009 Å
 total power (kW/mol):        -0.5730460 (step)  -22.7077 (real)
------------------------------------------------------------------------

 ANCopt (total)                0 d,  0 h,  0 min,  0.328 sec
 optimizer setup                ...        0 min,  0.000 sec (  0.047%)
 model hessian                  ...        0 min,  0.009 sec (  2.662%)
 ANC generation                 ...        0 min,  0.001 sec (  0.263%)
 coordinate transformation      ...        0 min,  0.000 sec (  0.075%)
 single point calculation       ...        0 min,  0.314 sec ( 95.714%)
 optimization log               ...        0 min,  0.001 sec (  0.439%)
 hessian update                 ...        0 min,  0.000 sec (  0.055%)
 rational function              ...        0 min,  0.002 sec (  0.493%)

================
 final structure:
================
$coord
   -2.22443682680080   -0.13477648497128   -0.04306967277620      C 
   -0.64071558456486    1.85962089034955   -0.11155295441321      N 
   -1.28028014539045    4.49662250318010   -0.03361215785496      C 
   -1.52174603134618    5.43781875292528    2.68528071826252      C 
    1.76124090211620    1.12494687708641   -0.12133066388905      N 
    1.74708404007699   -1.37668546679543   -0.06906733145964      C 
   -0.76012286640952   -2.29062826023015   -0.02464385362537      C 
   -1.66707189989467   -4.96009031490109    0.06428483116714      C 
   -2.21079206613568   -5.80775448085304    2.77411835997312      C 
    4.15799889861639   -2.83572876625880   -0.03640039145874      C 
    5.12495946700639   -3.20477431465250    2.66262901484807      C 
   -4.23687729018882    0.10059777279405   -0.04153463594643      H 
   -3.05665595011754    4.77868191251805   -1.05154786726318      H 
    0.22799810726386    5.52328612251442   -0.99903021292292      H 
   -3.01700869660485    4.42508045658929    3.66655395296110      H 
   -1.95671455970505    7.44409526613952    2.70418609442157      H 
    0.24576053039873    5.12917581437767    3.68431214733424      H 
   -0.24437634317092   -6.20261808419604   -0.76691738837185      H 
   -3.39540440125600   -5.12819603458091   -1.05447610051934      H 
   -0.51191026383558   -5.67627834185606    3.92323339162599      H 
   -2.86963172748727   -7.75502004621727    2.80112825930924      H 
   -3.65494122752631   -4.61397362016657    3.62042558043214      H 
    5.56795339453285   -1.79257932736947   -1.12053722762698      H 
    3.86737974440388   -4.67451704353988   -0.92678635012176      H 
    5.42405248992301   -1.37784589450622    3.55364610709403      H 
    6.90322879550724   -4.23629319278637    2.65379135858536      H 
    3.76229180897265   -4.26035155121455    3.78269491587447      H 
$end
           -------------------------------------------------
          |                Final Singlepoint                |
           -------------------------------------------------

          ...................................................
          :                      SETUP                      :
          :.................................................:
          :  # basis functions                  60          :
          :  # atomic orbitals                  60          :
          :  # shells                           38          :
          :  # electrons                        62          :
          :  max. iterations                   250          :
          :  Hamiltonian                  GFN2-xTB          :
          :  restarted?                      false          :
          :  GBSA solvation                  false          :
          :  PC potential                    false          :
          :  electronic temp.          300.0000000     K    :
          :  accuracy                    1.0000000          :
          :  -> integral cutoff          0.2500000E+02      :
          :  -> integral neglect         0.1000000E-07      :
          :  -> SCF convergence          0.1000000E-05 Eh   :
          :  -> wf. convergence          0.1000000E-03 e    :
          :  Broyden damping             0.4000000          :
          ...................................................

 iter      E             dE          RMSdq      gap      omega  full diag
   1    -33.7818278 -0.337818E+02  0.112E-04    4.78       0.0  T
   2    -33.7818278 -0.547189E-10  0.504E-05    4.78     381.5  T
   3    -33.7818278 -0.277893E-10  0.369E-05    4.78     521.9  T

   *** convergence criteria satisfied after 3 iterations ***

         #    Occupation            Energy/Eh            Energy/eV
      -------------------------------------------------------------
         1        2.0000           -0.6756750             -18.3861
       ...           ...                  ...                  ...
        25        2.0000           -0.4350943             -11.8395
        26        2.0000           -0.4331500             -11.7866
        27        2.0000           -0.4233525             -11.5200
        28        2.0000           -0.4200605             -11.4304
        29        2.0000           -0.3811425             -10.3714
        30        2.0000           -0.3736653             -10.1679
        31        2.0000           -0.3715959             -10.1116 (HOMO)
        32                         -0.1959571              -5.3323 (LUMO)
        33                         -0.1443628              -3.9283
        34                          0.0144992               0.3945
        35                          0.1008597               2.7445
        36                          0.1082440               2.9455
       ...                                ...                  ...
        60                          0.6610618              17.9884
      -------------------------------------------------------------
                  HL-Gap            0.1756388 Eh            4.7794 eV
             Fermi-level           -0.2837765 Eh           -7.7220 eV

 SCC (total)                   0 d,  0 h,  0 min,  0.023 sec
 SCC setup                      ...        0 min,  0.000 sec (  0.855%)
 Dispersion                     ...        0 min,  0.000 sec (  0.919%)
 integral evaluation            ...        0 min,  0.007 sec ( 29.008%)
 zeroth order Hamiltonian       ...        0 min,  0.000 sec (  0.603%)
 iterations                     ...        0 min,  0.004 sec ( 15.799%)
 molecular gradient             ...        0 min,  0.012 sec ( 51.116%)
 printout                       ...        0 min,  0.000 sec (  1.488%)

         :::::::::::::::::::::::::::::::::::::::::::::::::::::
         ::                     SUMMARY                     ::
         :::::::::::::::::::::::::::::::::::::::::::::::::::::
         :: total energy             -33.288936970462 Eh    ::
         :: gradient norm              0.000662932572 Eh/a0 ::
         :: HOMO-LUMO gap              4.779373931082 eV    ::
         ::.................................................::
         :: SCC energy               -33.781827806368 Eh    ::
         :: -> isotropic ES            0.013198324191 Eh    ::
         :: -> anisotropic ES          0.006461466582 Eh    ::
         :: -> anisotropic XC          0.023503666148 Eh    ::
         :: -> dispersion             -0.021040761977 Eh    ::
         :: repulsion energy           0.492689073845 Eh    ::
         :: add. restraining           0.000000000000 Eh    ::
         :::::::::::::::::::::::::::::::::::::::::::::::::::::

           -------------------------------------------------
          |                Property Printout                |
           -------------------------------------------------

    * Orbital Energies and Occupations

         #    Occupation            Energy/Eh            Energy/eV
      -------------------------------------------------------------
         1        2.0000           -0.6756750             -18.3861
       ...           ...                  ...                  ...
        19        2.0000           -0.4759788             -12.9520
        20        2.0000           -0.4718795             -12.8405
        21        2.0000           -0.4636220             -12.6158
        22        2.0000           -0.4606021             -12.5336
        23        2.0000           -0.4547770             -12.3751
        24        2.0000           -0.4515283             -12.2867
        25        2.0000           -0.4350943             -11.8395
        26        2.0000           -0.4331500             -11.7866
        27        2.0000           -0.4233525             -11.5200
        28        2.0000           -0.4200605             -11.4304
        29        2.0000           -0.3811425             -10.3714
        30        2.0000           -0.3736653             -10.1679
        31        2.0000           -0.3715959             -10.1116 (HOMO)
        32                         -0.1959571              -5.3323 (LUMO)
        33                         -0.1443628              -3.9283
        34                          0.0144992               0.3945
        35                          0.1008597               2.7445
        36                          0.1082440               2.9455
        37                          0.1151729               3.1340
        38                          0.1327108               3.6112
        39                          0.1352458               3.6802
        40                          0.1460701               3.9748
        41                          0.1497651               4.0753
        42                          0.1565461               4.2598
       ...                                ...                  ...
        60                          0.6610618              17.9884
      -------------------------------------------------------------
                  HL-Gap            0.1756388 Eh            4.7794 eV
             Fermi-level           -0.2837765 Eh           -7.7220 eV

     #   Z        covCN         q      C6AA      α(0)
     1   6 C      3.028    -0.030    28.728     8.792
     2   7 N      3.026     0.073    19.965     6.636
     3   6 C      3.741    -0.007    20.775     6.503
     4   6 C      3.752    -0.111    22.685     6.792
     5   7 N      2.012    -0.257    27.464     7.773
     6   6 C      3.158     0.055    26.457     8.409
     7   6 C      3.067    -0.042    28.975     8.827
     8   6 C      3.802    -0.049    21.459     6.595
     9   6 C      3.753    -0.095    22.379     6.746
    10   6 C      3.804    -0.055    21.556     6.610
    11   6 C      3.753    -0.096    22.383     6.746
    12   1 H      0.926     0.023     2.687     2.563
    13   1 H      0.924     0.047     2.363     2.404
    14   1 H      0.924     0.068     2.113     2.273
    15   1 H      0.925     0.045     2.384     2.415
    16   1 H      0.925     0.047     2.363     2.404
    17   1 H      0.925     0.056     2.248     2.345
    18   1 H      0.924     0.031     2.568     2.506
    19   1 H      0.924     0.027     2.631     2.536
    20   1 H      0.925     0.033     2.541     2.493
    21   1 H      0.925     0.030     2.587     2.515
    22   1 H      0.925     0.031     2.568     2.506
    23   1 H      0.924     0.044     2.401     2.423
    24   1 H      0.924     0.030     2.584     2.514
    25   1 H      0.925     0.040     2.451     2.448
    26   1 H      0.925     0.031     2.568     2.506
    27   1 H      0.925     0.032     2.564     2.504

 Mol. C6AA /au·bohr⁶  :       6193.277690
 Mol. C8AA /au·bohr⁸  :     136067.794672
 Mol. α(0) /au        :        119.784573


Wiberg/Mayer (AO) data.
largest (>0.10) Wiberg bond orders for each atom
          total WBO             WBO to atom ...
     1  C   3.954        C    7 1.483    N    2 1.269    H   12 0.969    N    5 0.157
     2  N   3.665        C    1 1.269    N    5 1.200    C    3 0.991
     3  C   3.974        C    4 1.005    N    2 0.991    H   13 0.971    H   14 0.970
     4  C   3.993        C    3 1.005    H   15 0.987    H   17 0.986    H   16 0.985
     5  N   2.956        C    6 1.479    N    2 1.200    C    1 0.157
     6  C   3.975        N    5 1.479    C    7 1.317    C   10 1.015
     7  C   3.976        C    1 1.483    C    6 1.317    C    8 1.016
     8  C   3.998        C    7 1.016    C    9 1.003    H   19 0.974    H   18 0.973
     9  C   3.997        C    8 1.003    H   22 0.989    H   21 0.987    H   20 0.986
    10  C   3.998        C    6 1.015    C   11 1.001    H   23 0.973    H   24 0.972
    11  C   3.997        C   10 1.001    H   25 0.989    H   26 0.987    H   27 0.986
    12  H   0.999        C    1 0.969
    13  H   0.997        C    3 0.971
    14  H   0.995        C    3 0.970
    15  H   0.998        C    4 0.987
    16  H   0.997        C    4 0.985
    17  H   0.997        C    4 0.986
    18  H   0.999        C    8 0.973
    19  H   0.999        C    8 0.974
    20  H   0.999        C    9 0.986
    21  H   0.998        C    9 0.987
    22  H   0.999        C    9 0.989
    23  H   0.998        C   10 0.973
    24  H   0.999        C   10 0.972
    25  H   0.998        C   11 0.989
    26  H   0.998        C   11 0.987
    27  H   0.999        C   11 0.986

molecular dipole:
                 x           y           z       tot (Debye)
 q only:       -0.393       0.489       0.125
   full:       -0.749       0.264       0.126       2.043
molecular quadrupole (traceless):
                xx          xy          yy          xz          yz          zz
 q only:       -1.818      -2.964       3.896       0.050       0.635      -2.078
  q+dip:       -0.167      -3.792       4.311       0.074       0.480      -4.144
   full:       -1.303      -4.038       3.812       0.124       0.478      -2.509

           -------------------------------------------------
          |                Geometry Summary                 |
           -------------------------------------------------

      molecular mass/u    :      152.2388000
   center of mass at/Å    :        0.1222716      -0.3645836       0.4073912
  moments of inertia/u·Å² :        0.3431382E+03   0.6608839E+03   0.8459504E+03
rotational constants/cm⁻¹ :        0.4912782E-01   0.2550770E-01   0.1992745E-01

 * 27 selected distances

     #   Z        #   Z                                     value/Å
     1   6 C      2   7 N                                 1.3481546
     2   7 N      3   6 C                                 1.4364892
     3   6 C      4   6 C                                 1.5278966
     2   7 N      5   7 N                                 1.3291977
     5   7 N      6   6 C                                 1.3241170
     1   6 C      7   6 C                                 1.3791391
     6   6 C      7   6 C                                 1.4123533
     7   6 C      8   6 C                                 1.4926638
     8   6 C      9   6 C                                 1.5298041 (max)
     6   6 C     10   6 C                                 1.4913399
    10   6 C     11   6 C                                 1.5296763
     1   6 C     12   1 H                                 1.0721972 (min)
     3   6 C     13   1 H                                 1.0936523
     3   6 C     14   1 H                                 1.0923343
     4   6 C     15   1 H                                 1.0876294
     4   6 C     16   1 H                                 1.0863869
     4   6 C     17   1 H                                 1.0867353
     8   6 C     18   1 H                                 1.0920602
     8   6 C     19   1 H                                 1.0931090
     9   6 C     20   1 H                                 1.0875785
     9   6 C     21   1 H                                 1.0879249
     9   6 C     22   1 H                                 1.0879601
    10   6 C     23   1 H                                 1.0911175
    10   6 C     24   1 H                                 1.0920030
    11   6 C     25   1 H                                 1.0872031
    11   6 C     26   1 H                                 1.0878874
    11   6 C     27   1 H                                 1.0877977

 * 4 distinct bonds (by element types)

   Z      Z             #   av. dist./Å        max./Å        min./Å
   1 H    6 C          16     1.0883485     1.0936523     1.0721972
   6 C    6 C           7     1.4804104     1.5298041     1.3791391
   6 C    7 N           3     1.3695869     1.4364892     1.3241170
   7 N    7 N           1     1.3291977     1.3291977     1.3291977


optimized geometry written to: xtbopt.xyz


           -------------------------------------------------
          | TOTAL ENERGY              -33.288936970462 Eh   |
          | GRADIENT NORM               0.000662932572 Eh/α |
          | HOMO-LUMO GAP               4.779373931082 eV   |
           -------------------------------------------------

------------------------------------------------------------------------
 * finished run on 2021/05/19 at 11:00:35.932     
------------------------------------------------------------------------
 total:
 * wall-time:     0 d,  0 h,  0 min,  0.415 sec
 *  cpu-time:     0 d,  0 h,  0 min,  0.402 sec
 * ratio c/w:     0.969 speedup
 SCF:
 * wall-time:     0 d,  0 h,  0 min,  0.032 sec
 *  cpu-time:     0 d,  0 h,  0 min,  0.032 sec
 * ratio c/w:     1.000 speedup
 ANC optimizer:
 * wall-time:     0 d,  0 h,  0 min,  0.352 sec
 *  cpu-time:     0 d,  0 h,  0 min,  0.352 sec
 * ratio c/w:     1.000 speedup

