      -----------------------------------------------------------      
     |                   =====================                   |     
     |                           x T B                           |     
     |                   =====================                   |     
     |                         S. Grimme                         |     
     |          Mulliken Center for Theoretical Chemistry        |     
     |                    University of Bonn                     |     
     |                Version 6.2 RC2 (SAW190805)                |     
      -----------------------------------------------------------      

   This program is distributed in the hope that it will be useful,
   but WITHOUT ANY WARRANTY; without even the implied warranty of
   MERCHANTABILITY or FITNESS FOR A PARTICULAR PURPOSE.
   
   FOR NON-COMMERCIAL, ACADEMIA USE ONLY.
   
   Cite this work as:
   * S. Grimme, C. Bannwarth, P. Shushkov, J. Chem. Theory Comput., 2017,
     13, 1989-2009. DOI: 10.1021/acs.jctc.7b00118
   * C. Bannwarth, S. Ehlert and S. Grimme., J. Chem. Theory Comput., 2019,
     15, 1652-1671. DOI: 10.1021/acs.jctc.8b01176
   * P. Pracht, E. Caldeweyher, S. Ehlert, S. Grimme, ChemRxiv, 2019, preprint.
     DOI: 10.26434/chemrxiv.8326202.v1
   
   for DFT-D4:
   * E. Caldeweyher, C. Bannwarth and S. Grimme, J. Chem. Phys., 2017,
     147, 034112. DOI: 10.1063/1.4993215
   * E. Caldeweyher, S. Ehlert, A. Hansen, H. Neugebauer, S. Spicher,
     C. Bannwarth and S. Grimme, J. Chem. Phys., 2019, 150, 154122.
     DOI: 10.1063/1.5090222
   
   for sTDA-xTB:
   * S. Grimme and C. Bannwarth, J. Chem. Phys., 2016, 145, 054103.
     DOI: 10.1063/1.4959605
   
   in the mass-spec context:
   * V. Asgeirsson, C. Bauer and S. Grimme, Chem. Sci., 2017, 8, 4879.
     DOI: 10.1039/c7sc00601b
   
   for metadynamics refer to:
   * S. Grimme, J. Chem. Theory Comput., 2019, 155, 2847-2862
     DOI: 10.1021/acs.jctc.9b00143
   
   with help from (in alphabetical order)
   C. Bannwarth, F. Bohle, G. Brandenburg, E. Caldeweyher, M. Checinski,
   S. Dohm, S. Ehlert, S. Ehrlich, F. März, H. Neugebauer, J. Pisarek,
   P. Pracht, P. Shushkov, and S. Spicher.
   
 * started run on 2021/05/19 at 11:00:35.950     

           -------------------------------------------------
          |                Calculation Setup                |
           -------------------------------------------------

          program call               : /ihome/ghutchison/geoffh/xtb/xtb 849.xyz -opt
          hostname                   : smp-n83
          coordinate file            : 849.xyz
          omp threads                :                     1
          number of atoms            :                    27
          number of electrons        :                    84
          charge                     :                     0
          spin                       :                   0.0
          first test random number   :      0.35443869332191


########################################################################
# WARNING! Please study the warnings concerning your input carefully
#  - the use of '-opt' is discouraged, please use '--opt' next time
########################################################################

           ------------------------------------------------- 
          |                 G F N 2 - x T B                 |
          | Geometry, Frequencies, Noncovalent interactions |
          |            JCTC 2019 parametrisation            |
           ------------------------------------------------- 
             KAB for C  - Si     :                1.0500
             KAB for H  - Pd     :                0.9500
             k(s)              :                1.8500
             k(p)              :                2.2300
             k(d)              :                2.2300
             k(f)              :                2.0000
             kEN (H0ij)        :               -2.0000
             D4 a1             :                0.5200
             D4 a2             :                5.0000
             D4 s6             :                1.0000
             D4 s8             :                2.7000
             D4 s9             :                5.0000
             alphaj            :                2.0000

  Z AO/shell   Hii/eV     exponent
  1     Wed Apr 25 08:07:45 CEST 2018   EN: 2.200 GM2: 0.406  GM3: 0.0800  RAES: 1.40
     1s    -10.707211    1.230000
  6     Wed Apr 25 08:07:45 CEST 2018   EN: 2.550 GM2: 0.538  GM3: 0.1500  RAES: 3.00
     2s    -13.970922    2.096432
     2p    -10.063292    1.800000
  8     Wed Apr 25 08:07:45 CEST 2018   EN: 3.440 GM2: 0.452  GM3:-0.0517  RAES: 1.80
     2s    -20.229985    2.439742
     2p    -15.503117    2.137023
 16     Tue Apr 24 11:44:34 CEST 2018   EN: 2.580 GM2: 0.340  GM3:-0.0502  RAES: 3.10
     3s    -20.029654    1.981333
     3p    -11.377694    2.025643
     3d     -0.420282    1.702555

           ------------------------------------------------- 
          |        Self-Consistent Charge Iterations        |
           ------------------------------------------------- 

          ...................................................
          :                      SETUP                      :
          :.................................................:
          :  # basis functions                  84          :
          :  # atomic orbitals                  83          :
          :  # shells                           45          :
          :  # electrons                        84          :
          :  max. iterations                   250          :
          :  Hamiltonian                  GFN2-xTB          :
          :  restarted?                      false          :
          :  GBSA solvation                  false          :
          :  PC potential                    false          :
          :  electronic temp.          300.0000000     K    :
          :  accuracy                    1.0000000          :
          :  -> integral cutoff          0.2500000E+02      :
          :  -> integral neglect         0.1000000E-07      :
          :  -> SCF convergence          0.1000000E-05 Eh   :
          :  -> wf. convergence          0.1000000E-03 e    :
          :  Broyden damping             0.4000000          :
          ...................................................

 iter      E             dE          RMSdq      gap      omega  full diag
   1    -47.0299535 -0.470300E+02  0.509E+00    2.45       0.0  T
   2    -47.0827130 -0.527595E-01  0.279E+00    1.99       1.0  T
   3    -47.0724297  0.102833E-01  0.163E+00    2.26       1.0  T
   4    -47.0931479 -0.207182E-01  0.431E-01    2.12       1.0  T
   5    -47.0971292 -0.398135E-02  0.153E-01    2.11       1.0  T
   6    -47.0974930 -0.363751E-03  0.532E-02    2.12       1.0  T
   7    -47.0975171 -0.240957E-04  0.212E-02    2.12       1.0  T
   8    -47.0975224 -0.538686E-05  0.963E-03    2.12       2.0  T
   9    -47.0975226 -0.139761E-06  0.290E-03    2.12       6.6  T
  10    -47.0975227 -0.127345E-06  0.130E-03    2.12      14.8  T
  11    -47.0975227 -0.491579E-08  0.661E-04    2.12      29.1  T
  12    -47.0975227 -0.964590E-09  0.343E-04    2.12      56.0  T

   *** convergence criteria satisfied after 12 iterations ***

         #    Occupation            Energy/Eh            Energy/eV
      -------------------------------------------------------------
         1        2.0000           -0.7593943             -20.6642
       ...           ...                  ...                  ...
        36        2.0000           -0.4372328             -11.8977
        37        2.0000           -0.4279266             -11.6445
        38        2.0000           -0.4230716             -11.5124
        39        2.0000           -0.4215974             -11.4722
        40        2.0000           -0.4165866             -11.3359
        41        2.0000           -0.4069153             -11.0727
        42        2.0000           -0.3972122             -10.8087 (HOMO)
        43                         -0.3194400              -8.6924 (LUMO)
        44                         -0.2954573              -8.0398
        45                         -0.2538189              -6.9068
        46                         -0.2325034              -6.3267
        47                         -0.2234059              -6.0792
       ...                                ...                  ...
        83                          0.7222350              19.6530
      -------------------------------------------------------------
                  HL-Gap            0.0777722 Eh            2.1163 eV
             Fermi-level           -0.3583261 Eh           -9.7506 eV

 SCC (total)                   0 d,  0 h,  0 min,  0.053 sec
 SCC setup                      ...        0 min,  0.000 sec (  0.696%)
 Dispersion                     ...        0 min,  0.000 sec (  0.901%)
 integral evaluation            ...        0 min,  0.014 sec ( 26.409%)
 zeroth order Hamiltonian       ...        0 min,  0.000 sec (  0.427%)
 iterations                     ...        0 min,  0.019 sec ( 35.261%)
 molecular gradient             ...        0 min,  0.019 sec ( 35.310%)
 printout                       ...        0 min,  0.000 sec (  0.892%)

         :::::::::::::::::::::::::::::::::::::::::::::::::::::
         ::                     SUMMARY                     ::
         :::::::::::::::::::::::::::::::::::::::::::::::::::::
         :: total energy             -46.440729544616 Eh    ::
         :: gradient norm              0.048033900633 Eh/a0 ::
         :: HOMO-LUMO gap              2.116289753321 eV    ::
         ::.................................................::
         :: SCC energy               -47.097522713445 Eh    ::
         :: -> isotropic ES            0.055051954459 Eh    ::
         :: -> anisotropic ES          0.001153087544 Eh    ::
         :: -> anisotropic XC          0.016913637054 Eh    ::
         :: -> dispersion             -0.030678682813 Eh    ::
         :: repulsion energy           0.656841184556 Eh    ::
         :: add. restraining           0.000000000000 Eh    ::
         :::::::::::::::::::::::::::::::::::::::::::::::::::::

      ----------------------------------------------------------- 
     |                   =====================                   |
     |                        A N C O P T                        |
     |                   =====================                   |
     |               Approximate Normal Coordinate               |
     |                Rational Function Optimizer                |
      ----------------------------------------------------------- 

          ...................................................
          :                      SETUP                      :
          :.................................................:
          :   optimization level            normal          :
          :   max. optcycles                   200          :
          :   ANC micro-cycles                  20          :
          :   degrees of freedom                75          :
          :.................................................:
          :   RF solver                   davidson          :
          :   input Hessian                  false          :
          :   write xtbopt.log                true          :
          :   linear?                        false          :
          :   energy convergence         0.5000000E-05 Eh   :
          :   grad. convergence          0.1000000E-02 Eh/α :
          :   maximium RF displ.         2.0000000          :
          :   Hlow (freq-cutoff)         0.5000000E-02      :
          :   Hmax (freq-cutoff)         5.0000000          :
          :   S6 in model hess.         20.0000000          :
          ...................................................

generating ANC from model Hessian ...
Using Lindh-Hessian (1995)
 Shifting diagonal of input Hessian by   4.089111806866568E-003
 Lowest  eigenvalues of input Hessian
   -0.000000   -0.000000   -0.000000   -0.000000    0.000000    0.000000
    0.005000    0.005884    0.007633    0.008584    0.009763    0.013757
    0.015196    0.016541    0.019829    0.022582    0.025096    0.027849
 Highest eigenvalues
    1.823012    1.860487    1.879954    1.989348    2.162109    2.248003
 

........................................................................
.............................. CYCLE    1 ..............................
........................................................................
   1    -47.0975227 -0.470975E+02  0.113E-04    2.12       0.0  T
   2    -47.0975227 -0.230003E-10  0.810E-05    2.12     237.5  T
   3    -47.0975227 -0.817977E-10  0.452E-05    2.12     425.4  T
     SCC iter.                  ...        0 min,  0.005 sec
     gradient                   ...        0 min,  0.018 sec
 * total energy  :   -46.4407296 Eh     change       -0.1220670E-07 Eh
   gradient norm :     0.0480356 Eh/α   predicted     0.0000000E+00 (-100.00%)
   displ. norm   :     0.1821147 α      lambda       -0.3713619E-02
   maximum displ.:     0.0756835 α      in ANC's #14, #34, #38, ...

........................................................................
.............................. CYCLE    2 ..............................
........................................................................
   1    -47.1256457 -0.471256E+02  0.946E-02    2.13       0.0  T
   2    -47.1256834 -0.376540E-04  0.484E-02    2.13       1.0  T
   3    -47.1256827  0.697439E-06  0.234E-02    2.13       1.0  T
   4    -47.1256854 -0.272872E-05  0.103E-02    2.13       1.9  T
   5    -47.1256868 -0.133034E-05  0.389E-03    2.13       5.0  T
   6    -47.1256871 -0.388585E-06  0.136E-03    2.13      14.1  T
     SCC iter.                  ...        0 min,  0.009 sec
     gradient                   ...        0 min,  0.017 sec
 * total energy  :   -46.4431427 Eh     change       -0.2413171E-02 Eh
   gradient norm :     0.0192107 Eh/α   predicted    -0.1918406E-02 ( -20.50%)
   displ. norm   :     0.1090185 α      lambda       -0.6387320E-03
   maximum displ.:     0.0475292 α      in ANC's #4, #3, #14, ...

........................................................................
.............................. CYCLE    3 ..............................
........................................................................
   1    -47.1348546 -0.471349E+02  0.620E-02    2.14       0.0  T
   2    -47.1348699 -0.152663E-04  0.323E-02    2.14       1.0  T
   3    -47.1348692  0.751478E-06  0.158E-02    2.14       1.2  T
   4    -47.1348710 -0.186648E-05  0.726E-03    2.14       2.7  T
   5    -47.1348718 -0.799823E-06  0.275E-03    2.14       7.0  T
   6    -47.1348720 -0.156224E-06  0.879E-04    2.14      21.9  T
     SCC iter.                  ...        0 min,  0.009 sec
     gradient                   ...        0 min,  0.017 sec
 * total energy  :   -46.4435043 Eh     change       -0.3615539E-03 Eh
   gradient norm :     0.0050016 Eh/α   predicted    -0.3231640E-03 ( -10.62%)
   displ. norm   :     0.0547874 α      lambda       -0.6077457E-04
   maximum displ.:     0.0309250 α      in ANC's #4, #3, #1, ...

........................................................................
.............................. CYCLE    4 ..............................
........................................................................
   1    -47.1342307 -0.471342E+02  0.271E-02    2.14       0.0  T
   2    -47.1342316 -0.887850E-06  0.152E-02    2.14       1.3  T
   3    -47.1342311  0.511831E-06  0.612E-03    2.14       3.1  T
   4    -47.1342317 -0.645093E-06  0.210E-03    2.14       9.1  T
   5    -47.1342318 -0.606796E-07  0.909E-04    2.14      21.2  T
     SCC iter.                  ...        0 min,  0.008 sec
     gradient                   ...        0 min,  0.017 sec
 * total energy  :   -46.4435460 Eh     change       -0.4175128E-04 Eh
   gradient norm :     0.0019098 Eh/α   predicted    -0.3047999E-04 ( -27.00%)
   displ. norm   :     0.0844387 α      lambda       -0.2585823E-04
   maximum displ.:     0.0498415 α      in ANC's #1, #3, #4, ...

........................................................................
.............................. CYCLE    5 ..............................
........................................................................
   1    -47.1323991 -0.471324E+02  0.347E-02    2.14       0.0  T
   2    -47.1323995 -0.416605E-06  0.204E-02    2.14       1.0  T
   3    -47.1323986  0.886491E-06  0.642E-03    2.14       3.0  T
   4    -47.1323997 -0.106428E-05  0.128E-03    2.14      15.1  T
   5    -47.1323997 -0.910199E-08  0.612E-04    2.14      31.5  T
   6    -47.1323997 -0.622578E-08  0.253E-04    2.14      76.0  T
     SCC iter.                  ...        0 min,  0.009 sec
     gradient                   ...        0 min,  0.018 sec
 * total energy  :   -46.4435643 Eh     change       -0.1829239E-04 Eh
   gradient norm :     0.0020105 Eh/α   predicted    -0.1297209E-04 ( -29.08%)
   displ. norm   :     0.0216414 α      lambda       -0.7915569E-05
   maximum displ.:     0.0165139 α      in ANC's #1, #3, #4, ...

........................................................................
.............................. CYCLE    6 ..............................
........................................................................
   1    -47.1325557 -0.471326E+02  0.123E-02    2.14       0.0  T
   2    -47.1325558 -0.725838E-07  0.688E-03    2.14       2.8  T
   3    -47.1325558  0.693306E-08  0.164E-03    2.14      11.7  T
   4    -47.1325558 -0.208299E-07  0.889E-04    2.14      21.6  T
   5    -47.1325558 -0.702526E-08  0.365E-04    2.14      52.7  T
     SCC iter.                  ...        0 min,  0.008 sec
     gradient                   ...        0 min,  0.018 sec
 * total energy  :   -46.4435706 Eh     change       -0.6313527E-05 Eh
   gradient norm :     0.0014067 Eh/α   predicted    -0.3960455E-05 ( -37.27%)
   displ. norm   :     0.0635798 α      lambda       -0.1188097E-04
   maximum displ.:     0.0461916 α      in ANC's #1, #3, #4, ...

........................................................................
.............................. CYCLE    7 ..............................
........................................................................
   1    -47.1335138 -0.471335E+02  0.300E-02    2.14       0.0  T
   2    -47.1335142 -0.468020E-06  0.174E-02    2.14       1.1  T
   3    -47.1335140  0.236833E-06  0.458E-03    2.14       4.2  T
   4    -47.1335143 -0.349890E-06  0.193E-03    2.14      10.0  T
   5    -47.1335144 -0.352255E-07  0.866E-04    2.14      22.2  T
   6    -47.1335144 -0.111503E-07  0.380E-04    2.14      50.7  T
     SCC iter.                  ...        0 min,  0.009 sec
     gradient                   ...        0 min,  0.018 sec
 * total energy  :   -46.4435792 Eh     change       -0.8594633E-05 Eh
   gradient norm :     0.0012357 Eh/α   predicted    -0.5952989E-05 ( -30.74%)
   displ. norm   :     0.0271595 α      lambda       -0.2915412E-05
   maximum displ.:     0.0205480 α      in ANC's #1, #3, #2, ...

........................................................................
.............................. CYCLE    8 ..............................
........................................................................
   1    -47.1334546 -0.471335E+02  0.133E-02    2.14       0.0  T
   2    -47.1334547 -0.712676E-07  0.742E-03    2.14       2.6  T
   3    -47.1334547  0.152114E-07  0.168E-03    2.14      11.5  T
   4    -47.1334547 -0.274839E-07  0.868E-04    2.14      22.2  T
   5    -47.1334547 -0.734779E-08  0.335E-04    2.14      57.5  T
     SCC iter.                  ...        0 min,  0.008 sec
     gradient                   ...        0 min,  0.018 sec
 * total energy  :   -46.4435824 Eh     change       -0.3178206E-05 Eh
   gradient norm :     0.0006093 Eh/α   predicted    -0.1460118E-05 ( -54.06%)
   displ. norm   :     0.0301219 α      lambda       -0.2557704E-05
   maximum displ.:     0.0227905 α      in ANC's #1, #3, #2, ...

   *** GEOMETRY OPTIMIZATION CONVERGED AFTER 8 ITERATIONS ***

------------------------------------------------------------------------
 total energy gain   :        -0.0028529 Eh       -1.7902 kcal/mol
 total RMSD          :         0.0850820 a0        0.0450 Å
 total power (kW/mol):        -0.9362752 (step)  -22.6861 (real)
------------------------------------------------------------------------

 ANCopt (total)                0 d,  0 h,  0 min,  0.330 sec
 optimizer setup                ...        0 min,  0.000 sec (  0.044%)
 model hessian                  ...        0 min,  0.005 sec (  1.575%)
 ANC generation                 ...        0 min,  0.001 sec (  0.250%)
 coordinate transformation      ...        0 min,  0.000 sec (  0.047%)
 single point calculation       ...        0 min,  0.321 sec ( 97.275%)
 optimization log               ...        0 min,  0.001 sec (  0.277%)
 hessian update                 ...        0 min,  0.000 sec (  0.034%)
 rational function              ...        0 min,  0.001 sec (  0.314%)

================
 final structure:
================
$coord
   -5.30933814287723   -2.26738755029661   -0.00793895273506      C 
   -7.54089446888835    0.07993320549387    0.02075749568116      S 
   -5.25110999794002    2.36903068395022    0.01161898313056      C 
   -2.87140419814401    1.36904587163199   -0.00765995358565      C 
   -2.90580968066768   -1.32843892413104   -0.02005847240544      C 
   -0.59240326055450   -2.85646196524170   -0.04434385090603      C 
   -0.61310862927840   -5.15498050841302   -0.07869522593142      O 
    1.77557916636567   -1.36662006338431   -0.01779305958602      C 
    4.06267862394055   -2.66979881479509   -0.00869589577194      C 
    6.33662168259074   -1.39165098813965    0.04131329594479      C 
    6.39603774577857    1.23764449972291    0.08677386159852      C 
    8.85976452720342    2.63718640541217    0.07004868433017      C 
    9.70319794598949    3.14518093477505   -2.64933907331903      C 
    4.12060286353755    2.54084790967010    0.05881016932974      C 
    1.81252807661706    1.28520403649886    0.00990896309202      C 
   -0.52163472054572    2.83696126700655   -0.00863432755616      C 
   -0.48042286116552    5.13481956742295   -0.02349120234636      O 
   -5.86141819020474   -4.21655851336834   -0.01127013356071      H 
   -5.75276644489774    4.33179660233434    0.02401001180185      H 
    4.00346532448821   -4.70970154688454   -0.03599084463063      H 
    8.08902135568043   -2.43927854108081    0.05443414885648      H 
   10.30408828897743    1.52439019648712    1.03537245664744      H 
    8.64831456302619    4.43298947166013    1.06180527099121      H 
    9.94486527142241    1.37659154137062   -3.66849380909015      H 
   11.48891294544185    4.16094279984835   -2.66426377165742      H 
    8.29690946601223    4.27398338195885   -3.63484827512316      H 
    4.09448991378631    4.58275346409534    0.08443235121444      H 
$end
           -------------------------------------------------
          |                Final Singlepoint                |
           -------------------------------------------------

          ...................................................
          :                      SETUP                      :
          :.................................................:
          :  # basis functions                  84          :
          :  # atomic orbitals                  83          :
          :  # shells                           45          :
          :  # electrons                        84          :
          :  max. iterations                   250          :
          :  Hamiltonian                  GFN2-xTB          :
          :  restarted?                      false          :
          :  GBSA solvation                  false          :
          :  PC potential                    false          :
          :  electronic temp.          300.0000000     K    :
          :  accuracy                    1.0000000          :
          :  -> integral cutoff          0.2500000E+02      :
          :  -> integral neglect         0.1000000E-07      :
          :  -> SCF convergence          0.1000000E-05 Eh   :
          :  -> wf. convergence          0.1000000E-03 e    :
          :  Broyden damping             0.4000000          :
          ...................................................

 iter      E             dE          RMSdq      gap      omega  full diag
   1    -47.1334547 -0.471335E+02  0.166E-04    2.14       0.0  T
   2    -47.1334547 -0.403659E-10  0.825E-05    2.14     233.2  T
   3    -47.1334547 -0.986660E-10  0.751E-05    2.14     256.4  T

   *** convergence criteria satisfied after 3 iterations ***

         #    Occupation            Energy/Eh            Energy/eV
      -------------------------------------------------------------
         1        2.0000           -0.7572836             -20.6067
       ...           ...                  ...                  ...
        36        2.0000           -0.4378257             -11.9138
        37        2.0000           -0.4283627             -11.6563
        38        2.0000           -0.4243399             -11.5469
        39        2.0000           -0.4218354             -11.4787
        40        2.0000           -0.4178536             -11.3704
        41        2.0000           -0.4078058             -11.0970
        42        2.0000           -0.3971666             -10.8075 (HOMO)
        43                         -0.3185839              -8.6691 (LUMO)
        44                         -0.2927395              -7.9658
        45                         -0.2511933              -6.8353
        46                         -0.2297354              -6.2514
        47                         -0.2224793              -6.0540
       ...                                ...                  ...
        83                          0.7399658              20.1355
      -------------------------------------------------------------
                  HL-Gap            0.0785828 Eh            2.1383 eV
             Fermi-level           -0.3578753 Eh           -9.7383 eV

 SCC (total)                   0 d,  0 h,  0 min,  0.038 sec
 SCC setup                      ...        0 min,  0.000 sec (  0.667%)
 Dispersion                     ...        0 min,  0.000 sec (  0.703%)
 integral evaluation            ...        0 min,  0.013 sec ( 35.101%)
 zeroth order Hamiltonian       ...        0 min,  0.000 sec (  0.591%)
 iterations                     ...        0 min,  0.005 sec ( 13.702%)
 molecular gradient             ...        0 min,  0.018 sec ( 48.094%)
 printout                       ...        0 min,  0.000 sec (  1.002%)

         :::::::::::::::::::::::::::::::::::::::::::::::::::::
         ::                     SUMMARY                     ::
         :::::::::::::::::::::::::::::::::::::::::::::::::::::
         :: total energy             -46.443582460398 Eh    ::
         :: gradient norm              0.000609917040 Eh/a0 ::
         :: HOMO-LUMO gap              2.138346463586 eV    ::
         ::.................................................::
         :: SCC energy               -47.133454712953 Eh    ::
         :: -> isotropic ES            0.053764013218 Eh    ::
         :: -> anisotropic ES          0.000989184408 Eh    ::
         :: -> anisotropic XC          0.016043563031 Eh    ::
         :: -> dispersion             -0.030870390225 Eh    ::
         :: repulsion energy           0.689912817514 Eh    ::
         :: add. restraining           0.000000000000 Eh    ::
         :::::::::::::::::::::::::::::::::::::::::::::::::::::

           -------------------------------------------------
          |                Property Printout                |
           -------------------------------------------------

    * Orbital Energies and Occupations

         #    Occupation            Energy/Eh            Energy/eV
      -------------------------------------------------------------
         1        2.0000           -0.7572836             -20.6067
       ...           ...                  ...                  ...
        30        2.0000           -0.4846438             -13.1878
        31        2.0000           -0.4836000             -13.1594
        32        2.0000           -0.4770537             -12.9813
        33        2.0000           -0.4718278             -12.8391
        34        2.0000           -0.4537715             -12.3478
        35        2.0000           -0.4483918             -12.2014
        36        2.0000           -0.4378257             -11.9138
        37        2.0000           -0.4283627             -11.6563
        38        2.0000           -0.4243399             -11.5469
        39        2.0000           -0.4218354             -11.4787
        40        2.0000           -0.4178536             -11.3704
        41        2.0000           -0.4078058             -11.0970
        42        2.0000           -0.3971666             -10.8075 (HOMO)
        43                         -0.3185839              -8.6691 (LUMO)
        44                         -0.2927395              -7.9658
        45                         -0.2511933              -6.8353
        46                         -0.2297354              -6.2514
        47                         -0.2224793              -6.0540
        48                         -0.1895222              -5.1572
        49                         -0.1506012              -4.0981
        50                         -0.1379151              -3.7529
        51                         -0.0794527              -2.1620
        52                         -0.0218742              -0.5952
        53                          0.0083519               0.2273
       ...                                ...                  ...
        83                          0.7399658              20.1355
      -------------------------------------------------------------
                  HL-Gap            0.0785828 Eh            2.1383 eV
             Fermi-level           -0.3578753 Eh           -9.7383 eV

     #   Z        covCN         q      C6AA      α(0)
     1   6 C      2.938    -0.010    28.263     8.719
     2  16 S      2.301     0.053   138.889    19.835
     3   6 C      2.938    -0.010    28.260     8.719
     4   6 C      3.169    -0.028    28.334     8.697
     5   6 C      3.169    -0.028    28.329     8.696
     6   6 C      2.826     0.228    23.224     7.897
     7   8 O      0.858    -0.372    21.135     6.164
     8   6 C      2.975    -0.016    28.415     8.744
     9   6 C      2.923    -0.018    28.451     8.747
    10   6 C      2.922    -0.030    28.738     8.791
    11   6 C      2.969     0.026    27.412     8.588
    12   6 C      3.807    -0.060    21.654     6.624
    13   6 C      3.754    -0.100    22.459     6.758
    14   6 C      2.930    -0.025    28.635     8.776
    15   6 C      2.974    -0.013    28.344     8.733
    16   6 C      2.826     0.228    23.215     7.895
    17   8 O      0.858    -0.371    21.109     6.160
    18   1 H      0.926     0.076     2.023     2.224
    19   1 H      0.926     0.076     2.024     2.225
    20   1 H      0.926     0.067     2.118     2.276
    21   1 H      0.926     0.047     2.360     2.402
    22   1 H      0.924     0.044     2.402     2.423
    23   1 H      0.924     0.047     2.363     2.404
    24   1 H      0.925     0.039     2.464     2.455
    25   1 H      0.925     0.043     2.408     2.427
    26   1 H      0.925     0.041     2.429     2.437
    27   1 H      0.926     0.067     2.116     2.275

 Mol. C6AA /au·bohr⁶  :      11677.602949
 Mol. C8AA /au·bohr⁸  :     317616.701993
 Mol. α(0) /au        :        172.089701


Wiberg/Mayer (AO) data.
largest (>0.10) Wiberg bond orders for each atom
          total WBO             WBO to atom ...
     1  C   3.952        C    5 1.559    S    2 1.222    H   18 0.966
     2  S   2.707        C    3 1.225    C    1 1.222
     3  C   3.953        C    4 1.557    S    2 1.225    H   19 0.966
     4  C   3.985        C    3 1.557    C    5 1.189    C   16 1.040
     5  C   3.985        C    1 1.559    C    4 1.189    C    6 1.038
     6  C   3.939        O    7 1.764    C    5 1.038    C    8 1.029
     7  O   2.044        C    6 1.764
     8  C   3.988        C    9 1.389    C   15 1.326    C    6 1.029
     9  C   3.984        C   10 1.451    C    8 1.389    H   20 0.964
    10  C   3.987        C    9 1.451    C   11 1.394    H   21 0.967
    11  C   3.982        C   14 1.407    C   10 1.394    C   12 1.016
    12  C   3.995        C   11 1.016    C   13 0.997    H   22 0.973    H   23 0.972
    13  C   3.993        C   12 0.997    H   24 0.988    H   26 0.988    H   25 0.985
    14  C   3.984        C   11 1.407    C   15 1.404    H   27 0.962
    15  C   3.988        C   14 1.404    C    8 1.326    C   16 1.023
    16  C   3.940        O   17 1.767    C    4 1.040    C   15 1.023
    17  O   2.047        C   16 1.767
    18  H   0.994        C    1 0.966
    19  H   0.994        C    3 0.966
    20  H   0.995        C    9 0.964
    21  H   0.997        C   10 0.967
    22  H   0.997        C   12 0.973
    23  H   0.997        C   12 0.972
    24  H   0.998        C   13 0.988
    25  H   0.997        C   13 0.985
    26  H   0.998        C   13 0.988
    27  H   0.995        C   14 0.962

molecular dipole:
                 x           y           z       tot (Debye)
 q only:        0.388       0.172      -0.019
   full:        0.566       0.154      -0.016       1.493
molecular quadrupole (traceless):
                xx          xy          yy          xz          yz          zz
 q only:       22.093       1.962     -18.688      -0.851      -0.379      -3.405
  q+dip:       22.021       1.224     -16.804      -0.428      -0.118      -5.217
   full:       19.304       1.455     -19.597      -0.630      -0.280       0.293

           -------------------------------------------------
          |                Geometry Summary                 |
           -------------------------------------------------

      molecular mass/u    :      242.2918000
   center of mass at/Å    :        0.2229591       0.1795574      -0.0844020
  moments of inertia/u·Å² :        0.4980428E+03   0.1976570E+04   0.2422043E+04
rotational constants/cm⁻¹ :        0.3384776E-01   0.8528731E-02   0.6960087E-02

 * 24 selected distances

     #   Z        #   Z                                     value/Å
     1   6 C      2  16 S                                 1.7139611 (max)
     2  16 S      3   6 C                                 1.7133550
     3   6 C      4   6 C                                 1.3659890
     1   6 C      5   6 C                                 1.3655153
     4   6 C      5   6 C                                 1.4275788
     6   6 C      7   8 O                                 1.2165089
     8   6 C      9   6 C                                 1.3929712
     9   6 C     10   6 C                                 1.3806335
    10   6 C     11   6 C                                 1.3919265
    12   6 C     13   6 C                                 1.5304579
    11   6 C     14   6 C                                 1.3876885
     8   6 C     15   6 C                                 1.4034978
    14   6 C     15   6 C                                 1.3906636
    16   6 C     17   8 O                                 1.2161953
     1   6 C     18   1 H                                 1.0720341 (min)
     3   6 C     19   1 H                                 1.0720592
     9   6 C     20   1 H                                 1.0800214
    10   6 C     21   1 H                                 1.0804292
    12   6 C     22   1 H                                 1.0917270
    12   6 C     23   1 H                                 1.0913376
    13   6 C     24   1 H                                 1.0877120
    13   6 C     25   1 H                                 1.0871693
    13   6 C     26   1 H                                 1.0874651
    14   6 C     27   1 H                                 1.0807034

 * 4 distinct bonds (by element types)

   Z      Z             #   av. dist./Å        max./Å        min./Å
   1 H    6 C          10     1.0830658     1.0917270     1.0720341
   6 C    6 C          10     1.4036922     1.5304579     1.3655153
   6 C    8 O           2     1.2163521     1.2165089     1.2161953
   6 C   16 S           2     1.7136581     1.7139611     1.7133550


optimized geometry written to: xtbopt.xyz


           -------------------------------------------------
          | TOTAL ENERGY              -46.443582460398 Eh   |
          | GRADIENT NORM               0.000609917040 Eh/α |
          | HOMO-LUMO GAP               2.138346463586 eV   |
           -------------------------------------------------

------------------------------------------------------------------------
 * finished run on 2021/05/19 at 11:00:36.405     
------------------------------------------------------------------------
 total:
 * wall-time:     0 d,  0 h,  0 min,  0.455 sec
 *  cpu-time:     0 d,  0 h,  0 min,  0.448 sec
 * ratio c/w:     0.986 speedup
 SCF:
 * wall-time:     0 d,  0 h,  0 min,  0.053 sec
 *  cpu-time:     0 d,  0 h,  0 min,  0.053 sec
 * ratio c/w:     1.000 speedup
 ANC optimizer:
 * wall-time:     0 d,  0 h,  0 min,  0.369 sec
 *  cpu-time:     0 d,  0 h,  0 min,  0.369 sec
 * ratio c/w:     1.000 speedup

