      -----------------------------------------------------------      
     |                   =====================                   |     
     |                           x T B                           |     
     |                   =====================                   |     
     |                         S. Grimme                         |     
     |          Mulliken Center for Theoretical Chemistry        |     
     |                    University of Bonn                     |     
     |                Version 6.2 RC2 (SAW190805)                |     
      -----------------------------------------------------------      

   This program is distributed in the hope that it will be useful,
   but WITHOUT ANY WARRANTY; without even the implied warranty of
   MERCHANTABILITY or FITNESS FOR A PARTICULAR PURPOSE.
   
   FOR NON-COMMERCIAL, ACADEMIA USE ONLY.
   
   Cite this work as:
   * S. Grimme, C. Bannwarth, P. Shushkov, J. Chem. Theory Comput., 2017,
     13, 1989-2009. DOI: 10.1021/acs.jctc.7b00118
   * C. Bannwarth, S. Ehlert and S. Grimme., J. Chem. Theory Comput., 2019,
     15, 1652-1671. DOI: 10.1021/acs.jctc.8b01176
   * P. Pracht, E. Caldeweyher, S. Ehlert, S. Grimme, ChemRxiv, 2019, preprint.
     DOI: 10.26434/chemrxiv.8326202.v1
   
   for DFT-D4:
   * E. Caldeweyher, C. Bannwarth and S. Grimme, J. Chem. Phys., 2017,
     147, 034112. DOI: 10.1063/1.4993215
   * E. Caldeweyher, S. Ehlert, A. Hansen, H. Neugebauer, S. Spicher,
     C. Bannwarth and S. Grimme, J. Chem. Phys., 2019, 150, 154122.
     DOI: 10.1063/1.5090222
   
   for sTDA-xTB:
   * S. Grimme and C. Bannwarth, J. Chem. Phys., 2016, 145, 054103.
     DOI: 10.1063/1.4959605
   
   in the mass-spec context:
   * V. Asgeirsson, C. Bauer and S. Grimme, Chem. Sci., 2017, 8, 4879.
     DOI: 10.1039/c7sc00601b
   
   for metadynamics refer to:
   * S. Grimme, J. Chem. Theory Comput., 2019, 155, 2847-2862
     DOI: 10.1021/acs.jctc.9b00143
   
   with help from (in alphabetical order)
   C. Bannwarth, F. Bohle, G. Brandenburg, E. Caldeweyher, M. Checinski,
   S. Dohm, S. Ehlert, S. Ehrlich, F. März, H. Neugebauer, J. Pisarek,
   P. Pracht, P. Shushkov, and S. Spicher.
   
 * started run on 2021/05/19 at 10:58:52.170     

           -------------------------------------------------
          |                Calculation Setup                |
           -------------------------------------------------

          program call               : /ihome/ghutchison/geoffh/xtb/xtb 85.xyz -opt
          hostname                   : smp-n58
          coordinate file            : 85.xyz
          omp threads                :                     1
          number of atoms            :                    23
          number of electrons        :                    70
          charge                     :                     0
          spin                       :                   0.0
          first test random number   :      0.55944247616111


########################################################################
# WARNING! Please study the warnings concerning your input carefully
#  - the use of '-opt' is discouraged, please use '--opt' next time
########################################################################

           ------------------------------------------------- 
          |                 G F N 2 - x T B                 |
          | Geometry, Frequencies, Noncovalent interactions |
          |            JCTC 2019 parametrisation            |
           ------------------------------------------------- 
             KAB for C  - Si     :                1.0500
             KAB for H  - Pd     :                0.9500
             k(s)              :                1.8500
             k(p)              :                2.2300
             k(d)              :                2.2300
             k(f)              :                2.0000
             kEN (H0ij)        :               -2.0000
             D4 a1             :                0.5200
             D4 a2             :                5.0000
             D4 s6             :                1.0000
             D4 s8             :                2.7000
             D4 s9             :                5.0000
             alphaj            :                2.0000

  Z AO/shell   Hii/eV     exponent
  1     Wed Apr 25 08:07:45 CEST 2018   EN: 2.200 GM2: 0.406  GM3: 0.0800  RAES: 1.40
     1s    -10.707211    1.230000
  6     Wed Apr 25 08:07:45 CEST 2018   EN: 2.550 GM2: 0.538  GM3: 0.1500  RAES: 3.00
     2s    -13.970922    2.096432
     2p    -10.063292    1.800000
  7     Wed Apr 25 08:07:45 CEST 2018   EN: 3.040 GM2: 0.461  GM3:-0.0640  RAES: 1.90
     2s    -16.686243    2.339881
     2p    -12.523956    2.014332
 16     Tue Apr 24 11:44:34 CEST 2018   EN: 2.580 GM2: 0.340  GM3:-0.0502  RAES: 3.10
     3s    -20.029654    1.981333
     3p    -11.377694    2.025643
     3d     -0.420282    1.702555

           ------------------------------------------------- 
          |        Self-Consistent Charge Iterations        |
           ------------------------------------------------- 

          ...................................................
          :                      SETUP                      :
          :.................................................:
          :  # basis functions                  77          :
          :  # atomic orbitals                  75          :
          :  # shells                           39          :
          :  # electrons                        70          :
          :  max. iterations                   250          :
          :  Hamiltonian                  GFN2-xTB          :
          :  restarted?                      false          :
          :  GBSA solvation                  false          :
          :  PC potential                    false          :
          :  electronic temp.          300.0000000     K    :
          :  accuracy                    1.0000000          :
          :  -> integral cutoff          0.2500000E+02      :
          :  -> integral neglect         0.1000000E-07      :
          :  -> SCF convergence          0.1000000E-05 Eh   :
          :  -> wf. convergence          0.1000000E-03 e    :
          :  Broyden damping             0.4000000          :
          ...................................................

 iter      E             dE          RMSdq      gap      omega  full diag
   1    -38.0433005 -0.380433E+02  0.462E+00    2.45       0.0  T
   2    -38.0915337 -0.482332E-01  0.251E+00    2.43       1.0  T
   3    -38.0835048  0.802889E-02  0.147E+00    2.54       1.0  T
   4    -38.0983173 -0.148125E-01  0.564E-01    2.47       1.0  T
   5    -38.1028025 -0.448519E-02  0.200E-01    2.48       1.0  T
   6    -38.1029406 -0.138119E-03  0.955E-02    2.48       1.0  T
   7    -38.1030758 -0.135250E-03  0.210E-02    2.48       1.0  T
   8    -38.1030781 -0.225488E-05  0.109E-02    2.48       1.9  T
   9    -38.1030783 -0.164766E-06  0.654E-03    2.48       3.2  T
  10    -38.1030787 -0.479604E-06  0.207E-03    2.48      10.1  T
  11    -38.1030788 -0.260227E-07  0.913E-04    2.48      22.8  T
  12    -38.1030788 -0.307305E-08  0.459E-04    2.48      45.4  T

   *** convergence criteria satisfied after 12 iterations ***

         #    Occupation            Energy/Eh            Energy/eV
      -------------------------------------------------------------
         1        2.0000           -0.7270303             -19.7835
       ...           ...                  ...                  ...
        29        2.0000           -0.4411808             -12.0051
        30        2.0000           -0.4366895             -11.8829
        31        2.0000           -0.4318988             -11.7526
        32        2.0000           -0.4023124             -10.9475
        33        2.0000           -0.3954967             -10.7620
        34        2.0000           -0.3618291              -9.8459
        35        2.0000           -0.3562009              -9.6927 (HOMO)
        36                         -0.2649913              -7.2108 (LUMO)
        37                         -0.2279191              -6.2020
        38                         -0.2080191              -5.6605
        39                         -0.1948853              -5.3031
        40                         -0.1740863              -4.7371
       ...                                ...                  ...
        75                          0.7997310              21.7618
      -------------------------------------------------------------
                  HL-Gap            0.0912097 Eh            2.4819 eV
             Fermi-level           -0.3105961 Eh           -8.4518 eV

 SCC (total)                   0 d,  0 h,  0 min,  0.040 sec
 SCC setup                      ...        0 min,  0.000 sec (  0.700%)
 Dispersion                     ...        0 min,  0.000 sec (  0.776%)
 integral evaluation            ...        0 min,  0.010 sec ( 25.766%)
 zeroth order Hamiltonian       ...        0 min,  0.000 sec (  0.524%)
 iterations                     ...        0 min,  0.015 sec ( 36.506%)
 molecular gradient             ...        0 min,  0.014 sec ( 34.774%)
 printout                       ...        0 min,  0.000 sec (  0.837%)

         :::::::::::::::::::::::::::::::::::::::::::::::::::::
         ::                     SUMMARY                     ::
         :::::::::::::::::::::::::::::::::::::::::::::::::::::
         :: total energy             -37.505532134782 Eh    ::
         :: gradient norm              0.107339891724 Eh/a0 ::
         :: HOMO-LUMO gap              2.481941506716 eV    ::
         ::.................................................::
         :: SCC energy               -38.103078759835 Eh    ::
         :: -> isotropic ES            0.003969331865 Eh    ::
         :: -> anisotropic ES          0.003700010432 Eh    ::
         :: -> anisotropic XC          0.019759241501 Eh    ::
         :: -> dispersion             -0.027287288995 Eh    ::
         :: repulsion energy           0.597585803269 Eh    ::
         :: add. restraining           0.000000000000 Eh    ::
         :::::::::::::::::::::::::::::::::::::::::::::::::::::

      ----------------------------------------------------------- 
     |                   =====================                   |
     |                        A N C O P T                        |
     |                   =====================                   |
     |               Approximate Normal Coordinate               |
     |                Rational Function Optimizer                |
      ----------------------------------------------------------- 

          ...................................................
          :                      SETUP                      :
          :.................................................:
          :   optimization level            normal          :
          :   max. optcycles                   200          :
          :   ANC micro-cycles                  20          :
          :   degrees of freedom                63          :
          :.................................................:
          :   RF solver                   davidson          :
          :   input Hessian                  false          :
          :   write xtbopt.log                true          :
          :   linear?                        false          :
          :   energy convergence         0.5000000E-05 Eh   :
          :   grad. convergence          0.1000000E-02 Eh/α :
          :   maximium RF displ.         2.0000000          :
          :   Hlow (freq-cutoff)         0.5000000E-02      :
          :   Hmax (freq-cutoff)         5.0000000          :
          :   S6 in model hess.         20.0000000          :
          ...................................................

generating ANC from model Hessian ...
Using Lindh-Hessian (1995)
 Shifting diagonal of input Hessian by   3.583400697273985E-003
 Lowest  eigenvalues of input Hessian
   -0.000000    0.000000    0.000000    0.000000    0.000000    0.000000
    0.005000    0.007116    0.008964    0.010013    0.011855    0.013971
    0.015137    0.018095    0.023018    0.025424    0.028486    0.040188
 Highest eigenvalues
    1.898811    1.962789    2.116835    2.145583    2.304393    2.317441
 

........................................................................
.............................. CYCLE    1 ..............................
........................................................................
   1    -38.1030788 -0.381031E+02  0.271E-04    2.48       0.0  T
   2    -38.1030788 -0.676934E-10  0.195E-04    2.48     106.8  T
   3    -38.1030788 -0.400291E-09  0.130E-04    2.48     160.1  T
     SCC iter.                  ...        0 min,  0.004 sec
     gradient                   ...        0 min,  0.016 sec
 * total energy  :   -37.5055321 Eh     change        0.6308845E-08 Eh
   gradient norm :     0.1073412 Eh/α   predicted     0.0000000E+00 (-100.00%)
   displ. norm   :     0.4097458 α      lambda       -0.2508437E-01
   maximum displ.:     0.1667231 α      in ANC's #20, #10, #9, ...

........................................................................
.............................. CYCLE    2 ..............................
........................................................................
   1    -38.1023161 -0.381023E+02  0.319E-01    2.49       0.0  T
   2    -38.1024544 -0.138238E-03  0.216E-01    2.47       1.0  T
   3    -38.1024412  0.132014E-04  0.127E-01    2.49       1.0  T
   4    -38.1026518 -0.210642E-03  0.298E-02    2.48       1.0  T
   5    -38.1026562 -0.440638E-05  0.181E-02    2.48       1.1  T
   6    -38.1026587 -0.247995E-05  0.606E-03    2.48       3.4  T
   7    -38.1026590 -0.274046E-06  0.287E-03    2.48       7.3  T
   8    -38.1026590 -0.144515E-07  0.134E-03    2.48      15.5  T
     SCC iter.                  ...        0 min,  0.010 sec
     gradient                   ...        0 min,  0.014 sec
 * total energy  :   -37.5231531 Eh     change       -0.1762100E-01 Eh
   gradient norm :     0.0385701 Eh/α   predicted    -0.1464792E-01 ( -16.87%)
   displ. norm   :     0.4802230 α      lambda       -0.9982143E-02
   maximum displ.:     0.2473624 α      in ANC's #9, #10, #3, ...

........................................................................
.............................. CYCLE    3 ..............................
........................................................................
   1    -38.1009895 -0.381010E+02  0.293E-01    2.49       0.0  T
   2    -38.1010373 -0.478290E-04  0.175E-01    2.48       1.0  T
   3    -38.1008869  0.150448E-03  0.114E-01    2.49       1.0  T
   4    -38.1011084 -0.221547E-03  0.230E-02    2.49       1.0  T
   5    -38.1011074  0.105745E-05  0.144E-02    2.49       1.4  T
   6    -38.1011097 -0.229887E-05  0.548E-03    2.49       3.8  T
   7    -38.1011098 -0.151041E-06  0.260E-03    2.49       8.0  T
     SCC iter.                  ...        0 min,  0.008 sec
     gradient                   ...        0 min,  0.013 sec
 * total energy  :   -37.5300092 Eh     change       -0.6856103E-02 Eh
   gradient norm :     0.0162605 Eh/α   predicted    -0.6142087E-02 ( -10.41%)
   displ. norm   :     0.4393300 α      lambda       -0.3497820E-02
   maximum displ.:     0.2246466 α      in ANC's #3, #9, #10, ...

........................................................................
.............................. CYCLE    4 ..............................
........................................................................
   1    -38.0989279 -0.380989E+02  0.202E-01    2.48       0.0  T
   2    -38.0989510 -0.231380E-04  0.115E-01    2.48       1.0  T
   3    -38.0989077  0.433900E-04  0.600E-02    2.48       1.0  T
   4    -38.0989648 -0.571036E-04  0.168E-02    2.48       1.2  T
   5    -38.0989653 -0.539166E-06  0.985E-03    2.48       2.1  T
   6    -38.0989659 -0.643378E-06  0.429E-03    2.48       4.9  T
   7    -38.0989661 -0.119460E-06  0.225E-03    2.48       9.3  T
   8    -38.0989661 -0.134393E-07  0.982E-04    2.48      21.2  T
     SCC iter.                  ...        0 min,  0.009 sec
     gradient                   ...        0 min,  0.015 sec
 * total energy  :   -37.5324087 Eh     change       -0.2399463E-02 Eh
   gradient norm :     0.0134303 Eh/α   predicted    -0.2086468E-02 ( -13.04%)
   displ. norm   :     0.3380317 α      lambda       -0.1322374E-02
   maximum displ.:     0.2155904 α      in ANC's #3, #10, #9, ...

........................................................................
.............................. CYCLE    5 ..............................
........................................................................
   1    -38.1008489 -0.381008E+02  0.143E-01    2.48       0.0  T
   2    -38.1008561 -0.719159E-05  0.801E-02    2.49       1.0  T
   3    -38.1008525  0.362142E-05  0.242E-02    2.48       1.0  T
   4    -38.1008581 -0.567222E-05  0.984E-03    2.49       2.1  T
   5    -38.1008582 -0.655549E-07  0.565E-03    2.49       3.7  T
   6    -38.1008586 -0.336384E-06  0.218E-03    2.49       9.6  T
   7    -38.1008586 -0.142146E-07  0.111E-03    2.49      18.8  T
     SCC iter.                  ...        0 min,  0.009 sec
     gradient                   ...        0 min,  0.015 sec
 * total energy  :   -37.5333043 Eh     change       -0.8956579E-03 Eh
   gradient norm :     0.0098538 Eh/α   predicted    -0.7367380E-03 ( -17.74%)
   displ. norm   :     0.2449735 α      lambda       -0.5813991E-03
   maximum displ.:     0.1682155 α      in ANC's #3, #2, #1, ...

........................................................................
.............................. CYCLE    6 ..............................
........................................................................
   1    -38.1045416 -0.381045E+02  0.118E-01    2.48       0.0  T
   2    -38.1045444 -0.280024E-05  0.677E-02    2.49       1.0  T
   3    -38.1045345  0.990293E-05  0.258E-02    2.48       1.0  T
   4    -38.1045462 -0.117220E-04  0.713E-03    2.49       2.9  T
   5    -38.1045464 -0.202722E-06  0.364E-03    2.49       5.7  T
   6    -38.1045465 -0.132501E-06  0.135E-03    2.49      15.4  T
   7    -38.1045465 -0.409638E-08  0.874E-04    2.49      23.9  T
     SCC iter.                  ...        0 min,  0.008 sec
     gradient                   ...        0 min,  0.013 sec
 * total energy  :   -37.5336671 Eh     change       -0.3627908E-03 Eh
   gradient norm :     0.0058413 Eh/α   predicted    -0.3081554E-03 ( -15.06%)
   displ. norm   :     0.1952441 α      lambda       -0.2805778E-03
   maximum displ.:     0.1265660 α      in ANC's #3, #2, #1, ...

........................................................................
.............................. CYCLE    7 ..............................
........................................................................
   1    -38.1070100 -0.381070E+02  0.101E-01    2.48       0.0  T
   2    -38.1070129 -0.288829E-05  0.575E-02    2.48       1.0  T
   3    -38.1070023  0.106293E-04  0.260E-02    2.48       1.0  T
   4    -38.1070151 -0.127585E-04  0.601E-03    2.48       3.5  T
   5    -38.1070153 -0.209509E-06  0.263E-03    2.48       7.9  T
   6    -38.1070153 -0.485798E-07  0.121E-03    2.48      17.3  T
     SCC iter.                  ...        0 min,  0.007 sec
     gradient                   ...        0 min,  0.013 sec
 * total energy  :   -37.5338274 Eh     change       -0.1602514E-03 Eh
   gradient norm :     0.0049987 Eh/α   predicted    -0.1456376E-03 (  -9.12%)
   displ. norm   :     0.1229338 α      lambda       -0.1248086E-03
   maximum displ.:     0.0712730 α      in ANC's #2, #3, #1, ...

........................................................................
.............................. CYCLE    8 ..............................
........................................................................
   1    -38.1075734 -0.381076E+02  0.714E-02    2.48       0.0  T
   2    -38.1075747 -0.124768E-05  0.406E-02    2.48       1.0  T
   3    -38.1075716  0.302780E-05  0.139E-02    2.48       1.5  T
   4    -38.1075751 -0.346662E-05  0.419E-03    2.48       5.0  T
   5    -38.1075753 -0.160802E-06  0.151E-03    2.48      13.8  T
   6    -38.1075753 -0.101310E-07  0.697E-04    2.48      29.9  T
     SCC iter.                  ...        0 min,  0.007 sec
     gradient                   ...        0 min,  0.013 sec
 * total energy  :   -37.5339207 Eh     change       -0.9331687E-04 Eh
   gradient norm :     0.0038740 Eh/α   predicted    -0.6334910E-04 ( -32.11%)
   displ. norm   :     0.1464528 α      lambda       -0.1052261E-03
   maximum displ.:     0.0873497 α      in ANC's #2, #1, #3, ...

........................................................................
.............................. CYCLE    9 ..............................
........................................................................
   1    -38.1069432 -0.381069E+02  0.838E-02    2.47       0.0  T
   2    -38.1069443 -0.113229E-05  0.476E-02    2.47       1.0  T
   3    -38.1069438  0.575931E-06  0.827E-03    2.47       2.5  T
   4    -38.1069444 -0.664734E-06  0.445E-03    2.47       4.7  T
   5    -38.1069446 -0.213712E-06  0.140E-03    2.47      14.8  T
   6    -38.1069447 -0.192962E-07  0.414E-04    2.47      50.4  T
   7    -38.1069447 -0.945811E-09  0.262E-04    2.47      79.6  T
     SCC iter.                  ...        0 min,  0.008 sec
     gradient                   ...        0 min,  0.014 sec
 * total energy  :   -37.5339937 Eh     change       -0.7297000E-04 Eh
   gradient norm :     0.0028979 Eh/α   predicted    -0.5374389E-04 ( -26.35%)
   displ. norm   :     0.1062245 α      lambda       -0.4784608E-04
   maximum displ.:     0.0741748 α      in ANC's #1, #2, #4, ...

........................................................................
.............................. CYCLE   10 ..............................
........................................................................
   1    -38.1064733 -0.381065E+02  0.638E-02    2.47       0.0  T
   2    -38.1064739 -0.609752E-06  0.361E-02    2.47       1.0  T
   3    -38.1064733  0.621105E-06  0.707E-03    2.47       2.9  T
   4    -38.1064741 -0.777261E-06  0.298E-03    2.47       7.0  T
   5    -38.1064741 -0.687275E-07  0.773E-04    2.47      27.0  T
   6    -38.1064741 -0.548362E-08  0.266E-04    2.47      78.3  T
     SCC iter.                  ...        0 min,  0.007 sec
     gradient                   ...        0 min,  0.014 sec
 * total energy  :   -37.5340313 Eh     change       -0.3766000E-04 Eh
   gradient norm :     0.0026806 Eh/α   predicted    -0.2419520E-04 ( -35.75%)
   displ. norm   :     0.1111107 α      lambda       -0.4650212E-04
   maximum displ.:     0.0820655 α      in ANC's #1, #2, #4, ...

........................................................................
.............................. CYCLE   11 ..............................
........................................................................
   1    -38.1063643 -0.381064E+02  0.672E-02    2.46       0.0  T
   2    -38.1063651 -0.840371E-06  0.379E-02    2.46       1.0  T
   3    -38.1063633  0.182183E-05  0.104E-02    2.46       2.0  T
   4    -38.1063655 -0.215356E-05  0.339E-03    2.46       6.1  T
   5    -38.1063656 -0.759202E-07  0.106E-03    2.46      19.7  T
   6    -38.1063656 -0.845612E-08  0.422E-04    2.46      49.4  T
   7    -38.1063656 -0.378400E-08  0.103E-04    2.46     202.5  T
     SCC iter.                  ...        0 min,  0.008 sec
     gradient                   ...        0 min,  0.014 sec
 * total energy  :   -37.5340702 Eh     change       -0.3883813E-04 Eh
   gradient norm :     0.0022578 Eh/α   predicted    -0.2353859E-04 ( -39.39%)
   displ. norm   :     0.1543761 α      lambda       -0.5590640E-04
   maximum displ.:     0.1131466 α      in ANC's #1, #2, #4, ...

........................................................................
.............................. CYCLE   12 ..............................
........................................................................
   1    -38.1061962 -0.381062E+02  0.929E-02    2.46       0.0  T
   2    -38.1061974 -0.120704E-05  0.526E-02    2.46       1.0  T
   3    -38.1061950  0.241659E-05  0.124E-02    2.46       1.7  T
   4    -38.1061979 -0.283066E-05  0.454E-03    2.46       4.6  T
   5    -38.1061980 -0.146843E-06  0.135E-03    2.46      15.4  T
   6    -38.1061980 -0.187435E-07  0.498E-04    2.46      41.9  T
   7    -38.1061980 -0.485896E-08  0.140E-04    2.46     148.7  T
     SCC iter.                  ...        0 min,  0.008 sec
     gradient                   ...        0 min,  0.016 sec
 * total energy  :   -37.5341153 Eh     change       -0.4507833E-04 Eh
   gradient norm :     0.0024441 Eh/α   predicted    -0.2862382E-04 ( -36.50%)
   displ. norm   :     0.1774625 α      lambda       -0.5389354E-04
   maximum displ.:     0.1326721 α      in ANC's #1, #2, #3, ...

........................................................................
.............................. CYCLE   13 ..............................
........................................................................
   1    -38.1064064 -0.381064E+02  0.104E-01    2.46       0.0  T
   2    -38.1064077 -0.129627E-05  0.585E-02    2.46       1.0  T
   3    -38.1064067  0.969433E-06  0.101E-02    2.46       2.1  T
   4    -38.1064078 -0.114758E-05  0.533E-03    2.46       3.9  T
   5    -38.1064081 -0.297692E-06  0.104E-03    2.46      20.1  T
   6    -38.1064081 -0.131802E-07  0.375E-04    2.46      55.6  T
   7    -38.1064081 -0.223987E-08  0.158E-04    2.46     131.6  T
     SCC iter.                  ...        0 min,  0.009 sec
     gradient                   ...        0 min,  0.016 sec
 * total energy  :   -37.5341559 Eh     change       -0.4063716E-04 Eh
   gradient norm :     0.0028157 Eh/α   predicted    -0.2780869E-04 ( -31.57%)
   displ. norm   :     0.1605032 α      lambda       -0.4027365E-04
   maximum displ.:     0.1249159 α      in ANC's #1, #2, #3, ...

........................................................................
.............................. CYCLE   14 ..............................
........................................................................
   1    -38.1067404 -0.381067E+02  0.968E-02    2.46       0.0  T
   2    -38.1067416 -0.114886E-05  0.544E-02    2.46       1.0  T
   3    -38.1067412  0.389202E-06  0.872E-03    2.46       2.4  T
   4    -38.1067416 -0.452833E-06  0.528E-03    2.46       4.0  T
   5    -38.1067420 -0.321084E-06  0.800E-04    2.46      26.1  T
   6    -38.1067420 -0.874570E-08  0.300E-04    2.46      69.4  T
     SCC iter.                  ...        0 min,  0.008 sec
     gradient                   ...        0 min,  0.014 sec
 * total energy  :   -37.5341846 Eh     change       -0.2866738E-04 Eh
   gradient norm :     0.0027098 Eh/α   predicted    -0.2065656E-04 ( -27.94%)
   displ. norm   :     0.1364893 α      lambda       -0.2757503E-04
   maximum displ.:     0.1067112 α      in ANC's #1, #2, #3, ...

........................................................................
.............................. CYCLE   15 ..............................
........................................................................
   1    -38.1071142 -0.381071E+02  0.792E-02    2.46       0.0  T
   2    -38.1071153 -0.107829E-05  0.439E-02    2.46       1.0  T
   3    -38.1071147  0.611538E-06  0.823E-03    2.46       2.5  T
   4    -38.1071155 -0.786463E-06  0.430E-03    2.46       4.9  T
   5    -38.1071157 -0.187291E-06  0.820E-04    2.46      25.4  T
   6    -38.1071157 -0.751116E-08  0.308E-04    2.46      67.7  T
     SCC iter.                  ...        0 min,  0.007 sec
     gradient                   ...        0 min,  0.014 sec
 * total energy  :   -37.5342013 Eh     change       -0.1678442E-04 Eh
   gradient norm :     0.0020154 Eh/α   predicted    -0.1404744E-04 ( -16.31%)
   displ. norm   :     0.0803763 α      lambda       -0.1153741E-04
   maximum displ.:     0.0656264 α      in ANC's #1, #2, #3, ...

........................................................................
.............................. CYCLE   16 ..............................
........................................................................
   1    -38.1070791 -0.381071E+02  0.523E-02    2.46       0.0  T
   2    -38.1070797 -0.575382E-06  0.291E-02    2.46       1.0  T
   3    -38.1070789  0.768446E-06  0.768E-03    2.46       2.7  T
   4    -38.1070798 -0.916559E-06  0.310E-03    2.46       6.7  T
   5    -38.1070799 -0.658730E-07  0.915E-04    2.46      22.8  T
   6    -38.1070799 -0.674473E-08  0.383E-04    2.46      54.4  T
     SCC iter.                  ...        0 min,  0.008 sec
     gradient                   ...        0 min,  0.016 sec
 * total energy  :   -37.5342068 Eh     change       -0.5485115E-05 Eh
   gradient norm :     0.0014841 Eh/α   predicted    -0.5806640E-05 (   5.86%)
   displ. norm   :     0.0251897 α      lambda       -0.3137512E-05
   maximum displ.:     0.0179483 α      in ANC's #1, #2, #8, ...

........................................................................
.............................. CYCLE   17 ..............................
........................................................................
   1    -38.1071313 -0.381071E+02  0.155E-02    2.46       0.0  T
   2    -38.1071315 -0.114104E-06  0.832E-03    2.46       2.5  T
   3    -38.1071312  0.222251E-06  0.400E-03    2.46       5.2  T
   4    -38.1071315 -0.282602E-06  0.118E-03    2.46      17.7  T
   5    -38.1071315 -0.726034E-08  0.488E-04    2.46      42.7  T
   6    -38.1071315 -0.107503E-08  0.164E-04    2.46     127.4  T
     SCC iter.                  ...        0 min,  0.008 sec
     gradient                   ...        0 min,  0.015 sec
 * total energy  :   -37.5342086 Eh     change       -0.1735047E-05 Eh
   gradient norm :     0.0008025 Eh/α   predicted    -0.1569811E-05 (  -9.52%)
   displ. norm   :     0.0134390 α      lambda       -0.1460663E-05
   maximum displ.:     0.0072681 α      in ANC's #3, #1, #7, ...

   *** GEOMETRY OPTIMIZATION CONVERGED AFTER 17 ITERATIONS ***

------------------------------------------------------------------------
 total energy gain   :        -0.0286764 Eh      -17.9947 kcal/mol
 total RMSD          :         0.4942246 a0        0.2615 Å
 total power (kW/mol):        -4.4288205 (step) -132.3398 (real)
------------------------------------------------------------------------

 ANCopt (total)                0 d,  0 h,  0 min,  0.569 sec
 optimizer setup                ...        0 min,  0.000 sec (  0.023%)
 model hessian                  ...        0 min,  0.003 sec (  0.593%)
 ANC generation                 ...        0 min,  0.001 sec (  0.106%)
 coordinate transformation      ...        0 min,  0.000 sec (  0.049%)
 single point calculation       ...        0 min,  0.560 sec ( 98.346%)
 optimization log               ...        0 min,  0.001 sec (  0.260%)
 hessian update                 ...        0 min,  0.000 sec (  0.036%)
 rational function              ...        0 min,  0.002 sec (  0.416%)

================
 final structure:
================
$coord
    5.84720001624341   -0.48337441089184    0.26025640544523      C 
    3.83091000711028   -3.06846173591792    0.27404741906925      S 
    1.25978837986748   -1.06790676039128    0.10520976496282      C 
    2.01295776822365    1.47859268485028    0.04383145500300      C 
    4.65735593194322    1.78977304522323    0.13460591432134      C 
   -0.07242381467677    3.00667753948900   -0.09469359154990      N 
   -0.11663796651911    5.71712311531855   -0.18509497768841      C 
   -2.15138435213052    1.45937696637506   -0.11856213853109      C 
   -1.38234348561004   -1.08351463083626    0.00182796651981      C 
   -3.93891788917507   -3.09516762332023   -0.03064840023775      S 
   -6.02151112088599   -0.50660695795924   -0.20630749352172      C 
   -4.77952563718961    1.77254759818001   -0.23576558980212      C 
   -8.68423389768661   -1.02649335091299   -0.29944318633649      C 
  -10.51315478264804    0.69537864115070   -0.43831929631351      C 
    7.84155669874400   -0.82536676496498    0.34914577296016      H 
    5.63485619203285    3.57028923126130    0.11035731700284      H 
    1.81311346880161    6.42356347825324   -0.22878982552677      H 
   -1.07515742457458    6.48662691680633    1.47597464433227      H 
   -1.10713495194102    6.36617968475039   -1.87722834910826      H 
   -5.72663700277262    3.56506811678064   -0.33634964259660      H 
   -9.16879821981949   -3.01280339084252   -0.25207943321151      H 
  -10.12608761340395    2.69203164572392   -0.48775374870633      H 
  -12.46988341949890    0.14991559834822   -0.50461737464547      H 
$end
           -------------------------------------------------
          |                Final Singlepoint                |
           -------------------------------------------------

          ...................................................
          :                      SETUP                      :
          :.................................................:
          :  # basis functions                  77          :
          :  # atomic orbitals                  75          :
          :  # shells                           39          :
          :  # electrons                        70          :
          :  max. iterations                   250          :
          :  Hamiltonian                  GFN2-xTB          :
          :  restarted?                      false          :
          :  GBSA solvation                  false          :
          :  PC potential                    false          :
          :  electronic temp.          300.0000000     K    :
          :  accuracy                    1.0000000          :
          :  -> integral cutoff          0.2500000E+02      :
          :  -> integral neglect         0.1000000E-07      :
          :  -> SCF convergence          0.1000000E-05 Eh   :
          :  -> wf. convergence          0.1000000E-03 e    :
          :  Broyden damping             0.4000000          :
          ...................................................

 iter      E             dE          RMSdq      gap      omega  full diag
   1    -38.1071315 -0.381071E+02  0.825E-05    2.46       0.0  T
   2    -38.1071315 -0.312639E-11  0.406E-05    2.46     513.0  T
   3    -38.1071315  0.846967E-11  0.346E-05    2.46     603.4  T

   *** convergence criteria satisfied after 3 iterations ***

         #    Occupation            Energy/Eh            Energy/eV
      -------------------------------------------------------------
         1        2.0000           -0.7233882             -19.6844
       ...           ...                  ...                  ...
        29        2.0000           -0.4428360             -12.0502
        30        2.0000           -0.4348495             -11.8329
        31        2.0000           -0.4305846             -11.7168
        32        2.0000           -0.4038987             -10.9906
        33        2.0000           -0.3943576             -10.7310
        34        2.0000           -0.3628178              -9.8728
        35        2.0000           -0.3552880              -9.6679 (HOMO)
        36                         -0.2648186              -7.2061 (LUMO)
        37                         -0.2250783              -6.1247
        38                         -0.2023859              -5.5072
        39                         -0.1972715              -5.3680
        40                         -0.1754425              -4.7740
       ...                                ...                  ...
        75                          0.7038718              19.1533
      -------------------------------------------------------------
                  HL-Gap            0.0904694 Eh            2.4618 eV
             Fermi-level           -0.3100533 Eh           -8.4370 eV

 SCC (total)                   0 d,  0 h,  0 min,  0.029 sec
 SCC setup                      ...        0 min,  0.000 sec (  0.597%)
 Dispersion                     ...        0 min,  0.000 sec (  0.600%)
 integral evaluation            ...        0 min,  0.010 sec ( 34.777%)
 zeroth order Hamiltonian       ...        0 min,  0.000 sec (  0.611%)
 iterations                     ...        0 min,  0.004 sec ( 14.019%)
 molecular gradient             ...        0 min,  0.014 sec ( 48.171%)
 printout                       ...        0 min,  0.000 sec (  1.032%)

         :::::::::::::::::::::::::::::::::::::::::::::::::::::
         ::                     SUMMARY                     ::
         :::::::::::::::::::::::::::::::::::::::::::::::::::::
         :: total energy             -37.534208556626 Eh    ::
         :: gradient norm              0.000802908550 Eh/a0 ::
         :: HOMO-LUMO gap              2.461797807087 eV    ::
         ::.................................................::
         :: SCC energy               -38.107131521428 Eh    ::
         :: -> isotropic ES            0.004117477692 Eh    ::
         :: -> anisotropic ES          0.003708566563 Eh    ::
         :: -> anisotropic XC          0.017496885454 Eh    ::
         :: -> dispersion             -0.027071261640 Eh    ::
         :: repulsion energy           0.572967565932 Eh    ::
         :: add. restraining           0.000000000000 Eh    ::
         :::::::::::::::::::::::::::::::::::::::::::::::::::::

           -------------------------------------------------
          |                Property Printout                |
           -------------------------------------------------

    * Orbital Energies and Occupations

         #    Occupation            Energy/Eh            Energy/eV
      -------------------------------------------------------------
         1        2.0000           -0.7233882             -19.6844
       ...           ...                  ...                  ...
        23        2.0000           -0.4769261             -12.9778
        24        2.0000           -0.4721184             -12.8470
        25        2.0000           -0.4591864             -12.4951
        26        2.0000           -0.4553297             -12.3902
        27        2.0000           -0.4497245             -12.2376
        28        2.0000           -0.4445854             -12.0978
        29        2.0000           -0.4428360             -12.0502
        30        2.0000           -0.4348495             -11.8329
        31        2.0000           -0.4305846             -11.7168
        32        2.0000           -0.4038987             -10.9906
        33        2.0000           -0.3943576             -10.7310
        34        2.0000           -0.3628178              -9.8728
        35        2.0000           -0.3552880              -9.6679 (HOMO)
        36                         -0.2648186              -7.2061 (LUMO)
        37                         -0.2250783              -6.1247
        38                         -0.2023859              -5.5072
        39                         -0.1972715              -5.3680
        40                         -0.1754425              -4.7740
        41                         -0.1503515              -4.0913
        42                         -0.1333953              -3.6299
        43                         -0.1277238              -3.4755
        44                         -0.1134669              -3.0876
        45                         -0.0110499              -0.3007
        46                         -0.0080375              -0.2187
       ...                                ...                  ...
        75                          0.7038718              19.1533
      -------------------------------------------------------------
                  HL-Gap            0.0904694 Eh            2.4618 eV
             Fermi-level           -0.3100533 Eh           -8.4370 eV

     #   Z        covCN         q      C6AA      α(0)
     1   6 C      2.956    -0.021    28.540     8.762
     2  16 S      2.223    -0.052   143.207    20.141
     3   6 C      3.104    -0.008    28.080     8.683
     4   6 C      3.307     0.022    25.629     8.090
     5   6 C      3.047    -0.059    29.418     8.896
     6   7 N      2.797    -0.038    21.971     6.962
     7   6 C      3.688    -0.042    21.530     6.641
     8   6 C      3.304     0.022    25.695     8.107
     9   6 C      3.098    -0.006    28.036     8.677
    10  16 S      2.262    -0.066   143.781    20.181
    11   6 C      3.002     0.025    27.441     8.593
    12   6 C      3.041    -0.065    29.584     8.921
    13   6 C      2.929    -0.030    28.741     8.792
    14   6 C      2.840    -0.092    30.300     9.021
    15   1 H      0.926     0.044     2.401     2.423
    16   1 H      0.926     0.033     2.548     2.496
    17   1 H      0.925     0.063     2.159     2.298
    18   1 H      0.924     0.055     2.255     2.348
    19   1 H      0.924     0.056     2.243     2.342
    20   1 H      0.926     0.037     2.485     2.465
    21   1 H      0.925     0.044     2.402     2.424
    22   1 H      0.926     0.037     2.490     2.468
    23   1 H      0.926     0.040     2.442     2.444

 Mol. C6AA /au·bohr⁶  :      10019.064886
 Mol. C8AA /au·bohr⁸  :     299803.075597
 Mol. α(0) /au        :        162.175167


Wiberg/Mayer (AO) data.
largest (>0.10) Wiberg bond orders for each atom
          total WBO             WBO to atom ...
     1  C   3.913        C    5 1.626    S    2 1.164    H   15 0.972
     2  S   2.549        C    1 1.164    C    3 1.113    C    5 0.103
     3  C   3.936        C    4 1.314    C    9 1.284    S    2 1.113
     4  C   3.938        C    3 1.314    C    5 1.236    N    6 1.160
     5  C   3.983        C    1 1.626    C    4 1.236    H   16 0.963    S    2 0.103
     6  N   3.568        C    4 1.160    C    8 1.153    C    7 1.005
     7  C   3.972        N    6 1.005    H   17 0.981    H   19 0.976    H   18 0.975
     8  C   3.953        C    9 1.298    C   12 1.269    N    6 1.153
     9  C   3.940        C    8 1.298    C    3 1.284    S   10 1.123
    10  S   2.528        C    9 1.123    C   11 1.103
    11  C   3.924        C   12 1.517    C   13 1.143    S   10 1.103
    12  C   3.983        C   11 1.517    C    8 1.269    H   20 0.961
    13  C   3.990        C   14 1.851    C   11 1.143    H   21 0.964
    14  C   3.961        C   13 1.851    H   23 0.978    H   22 0.976
    15  H   0.997        C    1 0.972
    16  H   0.998        C    5 0.963
    17  H   0.995        C    7 0.981
    18  H   0.995        C    7 0.975
    19  H   0.995        C    7 0.976
    20  H   0.998        C   12 0.961
    21  H   0.998        C   13 0.964
    22  H   0.999        C   14 0.976
    23  H   0.998        C   14 0.978

molecular dipole:
                 x           y           z       tot (Debye)
 q only:        0.080       1.142      -0.039
   full:        0.144       1.722      -0.055       4.394
molecular quadrupole (traceless):
                xx          xy          yy          xz          yz          zz
 q only:       -0.547       0.216       4.213       0.122      -0.256      -3.666
  q+dip:        2.476       0.014       3.465       0.346      -0.290      -5.941
   full:        1.432       0.165       2.571       0.218      -0.187      -4.003

           -------------------------------------------------
          |                Geometry Summary                 |
           -------------------------------------------------

      molecular mass/u    :      219.3188000
   center of mass at/Å    :       -0.6459859      -0.0599371      -0.0158078
  moments of inertia/u·Å² :        0.4146126E+03   0.1370238E+04   0.1781671E+04
rotational constants/cm⁻¹ :        0.4065876E-01   0.1230270E-01   0.9461696E-02

 * 24 selected distances

     #   Z        #   Z                                     value/Å
     1   6 C      2  16 S                                 1.7348858 (max)
     2  16 S      3   6 C                                 1.7262370
     3   6 C      4   6 C                                 1.4056298
     1   6 C      5   6 C                                 1.3593488
     4   6 C      5   6 C                                 1.4098294
     4   6 C      6   7 N                                 1.3700530
     6   7 N      7   6 C                                 1.4352944
     6   7 N      8   6 C                                 1.3714561
     3   6 C      9   6 C                                 1.3992504
     8   6 C      9   6 C                                 1.4072748
     9   6 C     10  16 S                                 1.7215654
     8   6 C     12   6 C                                 1.4019642
    11   6 C     12   6 C                                 1.3736142
    11   6 C     13   6 C                                 1.4365042
    13   6 C     14   6 C                                 1.3312864
     1   6 C     15   1 H                                 1.0718052 (min)
     5   6 C     16   1 H                                 1.0749377
     7   6 C     17   1 H                                 1.0877017
     7   6 C     18   1 H                                 1.0934969
     7   6 C     19   1 H                                 1.0929367
    12   6 C     20   1 H                                 1.0741473
    13   6 C     21   1 H                                 1.0822255
    14   6 C     22   1 H                                 1.0765718
    14   6 C     23   1 H                                 1.0755080

 * 4 distinct bonds (by element types)

   Z      Z             #   av. dist./Å        max./Å        min./Å
   1 H    6 C           9     1.0810368     1.0934969     1.0718052
   6 C    6 C           9     1.3916336     1.4365042     1.3312864
   6 C    7 N           3     1.3922679     1.4352944     1.3700530
   6 C   16 S           3     1.7275627     1.7348858     1.7215654


optimized geometry written to: xtbopt.xyz


           -------------------------------------------------
          | TOTAL ENERGY              -37.534208556626 Eh   |
          | GRADIENT NORM               0.000802908550 Eh/α |
          | HOMO-LUMO GAP               2.461797807087 eV   |
           -------------------------------------------------

------------------------------------------------------------------------
 * finished run on 2021/05/19 at 10:58:52.830     
------------------------------------------------------------------------
 total:
 * wall-time:     0 d,  0 h,  0 min,  0.660 sec
 *  cpu-time:     0 d,  0 h,  0 min,  0.660 sec
 * ratio c/w:     1.000 speedup
 SCF:
 * wall-time:     0 d,  0 h,  0 min,  0.040 sec
 *  cpu-time:     0 d,  0 h,  0 min,  0.040 sec
 * ratio c/w:     1.000 speedup
 ANC optimizer:
 * wall-time:     0 d,  0 h,  0 min,  0.598 sec
 *  cpu-time:     0 d,  0 h,  0 min,  0.598 sec
 * ratio c/w:     1.000 speedup

