      -----------------------------------------------------------      
     |                   =====================                   |     
     |                           x T B                           |     
     |                   =====================                   |     
     |                         S. Grimme                         |     
     |          Mulliken Center for Theoretical Chemistry        |     
     |                    University of Bonn                     |     
     |                Version 6.2 RC2 (SAW190805)                |     
      -----------------------------------------------------------      

   This program is distributed in the hope that it will be useful,
   but WITHOUT ANY WARRANTY; without even the implied warranty of
   MERCHANTABILITY or FITNESS FOR A PARTICULAR PURPOSE.
   
   FOR NON-COMMERCIAL, ACADEMIA USE ONLY.
   
   Cite this work as:
   * S. Grimme, C. Bannwarth, P. Shushkov, J. Chem. Theory Comput., 2017,
     13, 1989-2009. DOI: 10.1021/acs.jctc.7b00118
   * C. Bannwarth, S. Ehlert and S. Grimme., J. Chem. Theory Comput., 2019,
     15, 1652-1671. DOI: 10.1021/acs.jctc.8b01176
   * P. Pracht, E. Caldeweyher, S. Ehlert, S. Grimme, ChemRxiv, 2019, preprint.
     DOI: 10.26434/chemrxiv.8326202.v1
   
   for DFT-D4:
   * E. Caldeweyher, C. Bannwarth and S. Grimme, J. Chem. Phys., 2017,
     147, 034112. DOI: 10.1063/1.4993215
   * E. Caldeweyher, S. Ehlert, A. Hansen, H. Neugebauer, S. Spicher,
     C. Bannwarth and S. Grimme, J. Chem. Phys., 2019, 150, 154122.
     DOI: 10.1063/1.5090222
   
   for sTDA-xTB:
   * S. Grimme and C. Bannwarth, J. Chem. Phys., 2016, 145, 054103.
     DOI: 10.1063/1.4959605
   
   in the mass-spec context:
   * V. Asgeirsson, C. Bauer and S. Grimme, Chem. Sci., 2017, 8, 4879.
     DOI: 10.1039/c7sc00601b
   
   for metadynamics refer to:
   * S. Grimme, J. Chem. Theory Comput., 2019, 155, 2847-2862
     DOI: 10.1021/acs.jctc.9b00143
   
   with help from (in alphabetical order)
   C. Bannwarth, F. Bohle, G. Brandenburg, E. Caldeweyher, M. Checinski,
   S. Dohm, S. Ehlert, S. Ehrlich, F. März, H. Neugebauer, J. Pisarek,
   P. Pracht, P. Shushkov, and S. Spicher.
   
 * started run on 2021/05/19 at 11:00:40.116     

           -------------------------------------------------
          |                Calculation Setup                |
           -------------------------------------------------

          program call               : /ihome/ghutchison/geoffh/xtb/xtb 857.xyz -opt
          hostname                   : smp-n83
          coordinate file            : 857.xyz
          omp threads                :                     1
          number of atoms            :                    26
          number of electrons        :                    70
          charge                     :                     0
          spin                       :                   0.0
          first test random number   :      0.15099861139193


########################################################################
# WARNING! Please study the warnings concerning your input carefully
#  - the use of '-opt' is discouraged, please use '--opt' next time
########################################################################

           ------------------------------------------------- 
          |                 G F N 2 - x T B                 |
          | Geometry, Frequencies, Noncovalent interactions |
          |            JCTC 2019 parametrisation            |
           ------------------------------------------------- 
             KAB for C  - Si     :                1.0500
             KAB for H  - Pd     :                0.9500
             k(s)              :                1.8500
             k(p)              :                2.2300
             k(d)              :                2.2300
             k(f)              :                2.0000
             kEN (H0ij)        :               -2.0000
             D4 a1             :                0.5200
             D4 a2             :                5.0000
             D4 s6             :                1.0000
             D4 s8             :                2.7000
             D4 s9             :                5.0000
             alphaj            :                2.0000

  Z AO/shell   Hii/eV     exponent
  1     Wed Apr 25 08:07:45 CEST 2018   EN: 2.200 GM2: 0.406  GM3: 0.0800  RAES: 1.40
     1s    -10.707211    1.230000
  6     Wed Apr 25 08:07:45 CEST 2018   EN: 2.550 GM2: 0.538  GM3: 0.1500  RAES: 3.00
     2s    -13.970922    2.096432
     2p    -10.063292    1.800000
  7     Wed Apr 25 08:07:45 CEST 2018   EN: 3.040 GM2: 0.461  GM3:-0.0640  RAES: 1.90
     2s    -16.686243    2.339881
     2p    -12.523956    2.014332

           ------------------------------------------------- 
          |        Self-Consistent Charge Iterations        |
           ------------------------------------------------- 

          ...................................................
          :                      SETUP                      :
          :.................................................:
          :  # basis functions                  68          :
          :  # atomic orbitals                  68          :
          :  # shells                           40          :
          :  # electrons                        70          :
          :  max. iterations                   250          :
          :  Hamiltonian                  GFN2-xTB          :
          :  restarted?                      false          :
          :  GBSA solvation                  false          :
          :  PC potential                    false          :
          :  electronic temp.          300.0000000     K    :
          :  accuracy                    1.0000000          :
          :  -> integral cutoff          0.2500000E+02      :
          :  -> integral neglect         0.1000000E-07      :
          :  -> SCF convergence          0.1000000E-05 Eh   :
          :  -> wf. convergence          0.1000000E-03 e    :
          :  Broyden damping             0.4000000          :
          ...................................................

 iter      E             dE          RMSdq      gap      omega  full diag
   1    -38.1070864 -0.381071E+02  0.422E+00    0.96       0.0  T
   2    -38.1881720 -0.810856E-01  0.317E+00    1.38       1.0  T
   3    -38.2260529 -0.378809E-01  0.182E+00    1.25       1.0  T
   4    -38.2310702 -0.501735E-02  0.709E-01    1.22       1.0  T
   5    -38.2398073 -0.873707E-02  0.256E-01    1.20       1.0  T
   6    -38.2408430 -0.103574E-02  0.135E-01    1.23       1.0  T
   7    -38.2411661 -0.323037E-03  0.699E-02    1.23       1.0  T
   8    -38.2412747 -0.108624E-03  0.227E-02    1.23       1.0  T
   9    -38.2412765 -0.182502E-05  0.878E-03    1.22       2.2  T
  10    -38.2412770 -0.420558E-06  0.288E-03    1.23       6.8  T
  11    -38.2412771 -0.120041E-06  0.135E-03    1.23      14.6  T
  12    -38.2412771 -0.238446E-07  0.571E-04    1.23      34.3  T
  13    -38.2412771 -0.124982E-08  0.198E-04    1.23      99.2  T

   *** convergence criteria satisfied after 13 iterations ***

         #    Occupation            Energy/Eh            Energy/eV
      -------------------------------------------------------------
         1        2.0000           -0.6532903             -17.7769
       ...           ...                  ...                  ...
        29        2.0000           -0.4278703             -11.6429
        30        2.0000           -0.4232268             -11.5166
        31        2.0000           -0.4135065             -11.2521
        32        2.0000           -0.3921504             -10.6710
        33        2.0000           -0.3732873             -10.1577
        34        2.0000           -0.3479896              -9.4693
        35        2.0000           -0.3357914              -9.1373 (HOMO)
        36                         -0.2907486              -7.9117 (LUMO)
        37                         -0.1919591              -5.2235
        38                         -0.1784180              -4.8550
        39                         -0.1257278              -3.4212
        40                         -0.1160766              -3.1586
       ...                                ...                  ...
        68                          0.8097828              22.0353
      -------------------------------------------------------------
                  HL-Gap            0.0450428 Eh            1.2257 eV
             Fermi-level           -0.3132700 Eh           -8.5245 eV

 SCC (total)                   0 d,  0 h,  0 min,  0.038 sec
 SCC setup                      ...        0 min,  0.000 sec (  0.828%)
 Dispersion                     ...        0 min,  0.000 sec (  1.084%)
 integral evaluation            ...        0 min,  0.009 sec ( 23.356%)
 zeroth order Hamiltonian       ...        0 min,  0.000 sec (  0.417%)
 iterations                     ...        0 min,  0.015 sec ( 39.885%)
 molecular gradient             ...        0 min,  0.013 sec ( 33.285%)
 printout                       ...        0 min,  0.000 sec (  1.008%)

         :::::::::::::::::::::::::::::::::::::::::::::::::::::
         ::                     SUMMARY                     ::
         :::::::::::::::::::::::::::::::::::::::::::::::::::::
         :: total energy             -37.557083449397 Eh    ::
         :: gradient norm              0.058349808153 Eh/a0 ::
         :: HOMO-LUMO gap              1.225676581804 eV    ::
         ::.................................................::
         :: SCC energy               -38.241277099341 Eh    ::
         :: -> isotropic ES            0.016183274308 Eh    ::
         :: -> anisotropic ES          0.009174323348 Eh    ::
         :: -> anisotropic XC          0.023375074281 Eh    ::
         :: -> dispersion             -0.023656488892 Eh    ::
         :: repulsion energy           0.684391811817 Eh    ::
         :: add. restraining           0.000000000000 Eh    ::
         :::::::::::::::::::::::::::::::::::::::::::::::::::::

      ----------------------------------------------------------- 
     |                   =====================                   |
     |                        A N C O P T                        |
     |                   =====================                   |
     |               Approximate Normal Coordinate               |
     |                Rational Function Optimizer                |
      ----------------------------------------------------------- 

          ...................................................
          :                      SETUP                      :
          :.................................................:
          :   optimization level            normal          :
          :   max. optcycles                   200          :
          :   ANC micro-cycles                  20          :
          :   degrees of freedom                72          :
          :.................................................:
          :   RF solver                   davidson          :
          :   input Hessian                  false          :
          :   write xtbopt.log                true          :
          :   linear?                        false          :
          :   energy convergence         0.5000000E-05 Eh   :
          :   grad. convergence          0.1000000E-02 Eh/α :
          :   maximium RF displ.         2.0000000          :
          :   Hlow (freq-cutoff)         0.5000000E-02      :
          :   Hmax (freq-cutoff)         5.0000000          :
          :   S6 in model hess.         20.0000000          :
          ...................................................

generating ANC from model Hessian ...
Using Lindh-Hessian (1995)
 Shifting diagonal of input Hessian by   4.357736231341675E-003
 Lowest  eigenvalues of input Hessian
   -0.000000   -0.000000   -0.000000   -0.000000    0.000000    0.000000
    0.005000    0.006319    0.006516    0.008352    0.008684    0.012605
    0.013186    0.016753    0.018712    0.021930    0.022259    0.026059
 Highest eigenvalues
    1.891151    1.911814    2.035373    2.112286    2.162452    2.288171
 

........................................................................
.............................. CYCLE    1 ..............................
........................................................................
   1    -38.2412771 -0.382413E+02  0.850E-05    1.23       0.0  T
   2    -38.2412771 -0.859046E-11  0.614E-05    1.23     319.6  T
   3    -38.2412771 -0.422702E-10  0.360E-05    1.23     545.2  T
     SCC iter.                  ...        0 min,  0.004 sec
     gradient                   ...        0 min,  0.013 sec
 * total energy  :   -37.5570834 Eh     change        0.1634419E-07 Eh
   gradient norm :     0.0583512 Eh/α   predicted     0.0000000E+00 (-100.00%)
   displ. norm   :     0.2231402 α      lambda       -0.5483458E-02
   maximum displ.:     0.1308157 α      in ANC's #16, #19, #23, ...

........................................................................
.............................. CYCLE    2 ..............................
........................................................................
   1    -38.2416205 -0.382416E+02  0.153E-01    1.13       0.0  T
   2    -38.2416149  0.558484E-05  0.101E-01    1.15       1.0  T
   3    -38.2415071  0.107818E-03  0.930E-02    1.14       1.0  T
   4    -38.2416649 -0.157833E-03  0.378E-02    1.14       1.0  T
   5    -38.2417036 -0.386282E-04  0.743E-03    1.14       2.6  T
   6    -38.2417043 -0.759690E-06  0.391E-03    1.14       5.0  T
   7    -38.2417045 -0.156344E-06  0.167E-03    1.14      11.7  T
     SCC iter.                  ...        0 min,  0.008 sec
     gradient                   ...        0 min,  0.012 sec
 * total energy  :   -37.5607678 Eh     change       -0.3684348E-02 Eh
   gradient norm :     0.0259136 Eh/α   predicted    -0.2878250E-02 ( -21.88%)
   displ. norm   :     0.1637721 α      lambda       -0.1514879E-02
   maximum displ.:     0.0719174 α      in ANC's #8, #7, #16, ...

........................................................................
.............................. CYCLE    3 ..............................
........................................................................
   1    -38.2416825 -0.382417E+02  0.137E-01    1.08       0.0  T
   2    -38.2416931 -0.106418E-04  0.815E-02    1.09       1.0  T
   3    -38.2415981  0.950411E-04  0.743E-02    1.09       1.0  T
   4    -38.2416980 -0.999010E-04  0.334E-02    1.09       1.0  T
   5    -38.2417305 -0.325550E-04  0.767E-03    1.09       2.6  T
   6    -38.2417317 -0.116284E-05  0.286E-03    1.09       6.9  T
   7    -38.2417317 -0.393544E-07  0.154E-03    1.09      12.8  T
     SCC iter.                  ...        0 min,  0.008 sec
     gradient                   ...        0 min,  0.012 sec
 * total energy  :   -37.5616657 Eh     change       -0.8978731E-03 Eh
   gradient norm :     0.0087099 Eh/α   predicted    -0.7777594E-03 ( -13.38%)
   displ. norm   :     0.0833214 α      lambda       -0.2540186E-03
   maximum displ.:     0.0402262 α      in ANC's #7, #12, #19, ...

........................................................................
.............................. CYCLE    4 ..............................
........................................................................
   1    -38.2420862 -0.382421E+02  0.780E-02    1.08       0.0  T
   2    -38.2420389  0.473208E-04  0.644E-02    1.08       1.0  T
   3    -38.2420609 -0.220078E-04  0.509E-02    1.08       1.0  T
   4    -38.2421078 -0.468896E-04  0.196E-02    1.08       1.0  T
   5    -38.2421179 -0.101583E-04  0.263E-03    1.08       7.4  T
   6    -38.2421180 -0.667802E-07  0.145E-03    1.08      13.6  T
   7    -38.2421180 -0.108997E-07  0.807E-04    1.08      24.3  T
     SCC iter.                  ...        0 min,  0.008 sec
     gradient                   ...        0 min,  0.012 sec
 * total energy  :   -37.5618356 Eh     change       -0.1699136E-03 Eh
   gradient norm :     0.0058539 Eh/α   predicted    -0.1278917E-03 ( -24.73%)
   displ. norm   :     0.0795685 α      lambda       -0.1465511E-03
   maximum displ.:     0.0380466 α      in ANC's #7, #2, #12, ...

........................................................................
.............................. CYCLE    5 ..............................
........................................................................
   1    -38.2429705 -0.382430E+02  0.784E-02    1.07       0.0  T
   2    -38.2428805  0.900817E-04  0.762E-02    1.08       1.0  T
   3    -38.2429788 -0.983084E-04  0.451E-02    1.08       1.0  T
   4    -38.2430067 -0.279219E-04  0.190E-02    1.08       1.0  T
   5    -38.2430160 -0.929402E-05  0.250E-03    1.08       7.8  T
   6    -38.2430160 -0.607034E-07  0.145E-03    1.08      13.6  T
   7    -38.2430161 -0.163915E-07  0.756E-04    1.08      25.9  T
     SCC iter.                  ...        0 min,  0.008 sec
     gradient                   ...        0 min,  0.012 sec
 * total energy  :   -37.5619260 Eh     change       -0.9041783E-04 Eh
   gradient norm :     0.0048152 Eh/α   predicted    -0.7373986E-04 ( -18.45%)
   displ. norm   :     0.0439923 α      lambda       -0.4974753E-04
   maximum displ.:     0.0266644 α      in ANC's #2, #4, #7, ...

........................................................................
.............................. CYCLE    6 ..............................
........................................................................
   1    -38.2438976 -0.382439E+02  0.455E-02    1.08       0.0  T
   2    -38.2438689  0.287730E-04  0.434E-02    1.08       1.0  T
   3    -38.2438979 -0.290331E-04  0.267E-02    1.08       1.0  T
   4    -38.2439091 -0.111415E-04  0.924E-03    1.08       2.1  T
   5    -38.2439113 -0.222727E-05  0.143E-03    1.08      13.7  T
   6    -38.2439113 -0.209278E-07  0.845E-04    1.08      23.2  T
     SCC iter.                  ...        0 min,  0.007 sec
     gradient                   ...        0 min,  0.012 sec
 * total energy  :   -37.5619601 Eh     change       -0.3413846E-04 Eh
   gradient norm :     0.0031475 Eh/α   predicted    -0.2493134E-04 ( -26.97%)
   displ. norm   :     0.0446884 α      lambda       -0.3092306E-04
   maximum displ.:     0.0291117 α      in ANC's #2, #4, #10, ...

........................................................................
.............................. CYCLE    7 ..............................
........................................................................
   1    -38.2444993 -0.382445E+02  0.434E-02    1.08       0.0  T
   2    -38.2444839  0.153410E-04  0.353E-02    1.08       1.0  T
   3    -38.2444868 -0.284551E-05  0.297E-02    1.08       1.0  T
   4    -38.2445058 -0.190721E-04  0.656E-03    1.08       3.0  T
   5    -38.2445069 -0.110897E-05  0.117E-03    1.08      16.7  T
   6    -38.2445069 -0.737246E-08  0.723E-04    1.08      27.1  T
   7    -38.2445070 -0.700815E-08  0.258E-04    1.08      75.9  T
     SCC iter.                  ...        0 min,  0.008 sec
     gradient                   ...        0 min,  0.013 sec
 * total energy  :   -37.5619818 Eh     change       -0.2170549E-04 Eh
   gradient norm :     0.0021312 Eh/α   predicted    -0.1549263E-04 ( -28.62%)
   displ. norm   :     0.0422122 α      lambda       -0.1763363E-04
   maximum displ.:     0.0280664 α      in ANC's #2, #4, #10, ...

........................................................................
.............................. CYCLE    8 ..............................
........................................................................
   1    -38.2446909 -0.382447E+02  0.358E-02    1.08       0.0  T
   2    -38.2446849  0.599111E-05  0.258E-02    1.08       1.0  T
   3    -38.2446744  0.104817E-04  0.276E-02    1.08       1.0  T
   4    -38.2446938 -0.194141E-04  0.421E-03    1.08       4.7  T
   5    -38.2446943 -0.438762E-06  0.922E-04    1.08      21.3  T
   6    -38.2446943 -0.328674E-08  0.548E-04    1.08      35.8  T
     SCC iter.                  ...        0 min,  0.007 sec
     gradient                   ...        0 min,  0.013 sec
 * total energy  :   -37.5619936 Eh     change       -0.1177664E-04 Eh
   gradient norm :     0.0015471 Eh/α   predicted    -0.8833360E-05 ( -24.99%)
   displ. norm   :     0.0631374 α      lambda       -0.4975745E-06
   maximum displ.:     0.0420998 α      in ANC's #2, #4, #10, ...

........................................................................
.............................. CYCLE    9 ..............................
........................................................................
   1    -38.2448370 -0.382448E+02  0.533E-02    1.08       0.0  T
   2    -38.2448239  0.131559E-04  0.383E-02    1.08       1.0  T
   3    -38.2448002  0.236524E-04  0.412E-02    1.08       1.0  T
   4    -38.2448435 -0.432696E-04  0.620E-03    1.08       3.2  T
   5    -38.2448445 -0.953500E-06  0.133E-03    1.08      14.8  T
   6    -38.2448445 -0.548878E-08  0.795E-04    1.08      24.7  T
   7    -38.2448445 -0.916586E-08  0.299E-04    1.08      65.6  T
     SCC iter.                  ...        0 min,  0.008 sec
     gradient                   ...        0 min,  0.013 sec
 * total energy  :   -37.5619908 Eh     change        0.2767023E-05 Eh
   gradient norm :     0.0025207 Eh/α   predicted    -0.2532811E-06 (-109.15%)
   displ. norm   :     0.0204917 α      lambda       -0.9246662E-05
   maximum displ.:     0.0117445 α      in ANC's #2, #4, #10, ...

........................................................................
.............................. CYCLE   10 ..............................
........................................................................
   1    -38.2447243 -0.382447E+02  0.203E-02    1.08       0.0  T
   2    -38.2447217  0.260511E-05  0.155E-02    1.08       1.3  T
   3    -38.2447202  0.143433E-05  0.148E-02    1.08       1.3  T
   4    -38.2447255 -0.523381E-05  0.256E-03    1.08       7.7  T
   5    -38.2447256 -0.163564E-06  0.526E-04    1.08      37.3  T
   6    -38.2447256 -0.182270E-08  0.312E-04    1.08      62.8  T
     SCC iter.                  ...        0 min,  0.007 sec
     gradient                   ...        0 min,  0.013 sec
 * total energy  :   -37.5619973 Eh     change       -0.6426199E-05 Eh
   gradient norm :     0.0011321 Eh/α   predicted    -0.4626961E-05 ( -28.00%)
   displ. norm   :     0.0308167 α      lambda       -0.1753968E-05
   maximum displ.:     0.0176147 α      in ANC's #2, #4, #10, ...

........................................................................
.............................. CYCLE   11 ..............................
........................................................................
   1    -38.2445037 -0.382445E+02  0.307E-02    1.07       0.0  T
   2    -38.2444974  0.622727E-05  0.236E-02    1.08       1.0  T
   3    -38.2444946  0.278556E-05  0.224E-02    1.07       1.0  T
   4    -38.2445065 -0.118118E-04  0.391E-03    1.08       5.0  T
   5    -38.2445068 -0.381299E-06  0.809E-04    1.08      24.2  T
   6    -38.2445068 -0.430711E-08  0.481E-04    1.08      40.8  T
     SCC iter.                  ...        0 min,  0.007 sec
     gradient                   ...        0 min,  0.013 sec
 * total energy  :   -37.5619965 Eh     change        0.7487539E-06 Eh
   gradient norm :     0.0012108 Eh/α   predicted    -0.8779030E-06 (-217.25%)
   displ. norm   :     0.0264331 α      lambda       -0.3465108E-05
   maximum displ.:     0.0171441 α      in ANC's #2, #4, #10, ...

........................................................................
.............................. CYCLE   12 ..............................
........................................................................
   1    -38.2445577 -0.382446E+02  0.216E-02    1.08       0.0  T
   2    -38.2445547  0.293193E-05  0.165E-02    1.08       1.2  T
   3    -38.2445529  0.184843E-05  0.159E-02    1.08       1.2  T
   4    -38.2445590 -0.609593E-05  0.263E-03    1.08       7.4  T
   5    -38.2445592 -0.171920E-06  0.516E-04    1.08      38.0  T
   6    -38.2445592 -0.171932E-08  0.316E-04    1.08      62.1  T
     SCC iter.                  ...        0 min,  0.007 sec
     gradient                   ...        0 min,  0.013 sec
 * total energy  :   -37.5619992 Eh     change       -0.2634411E-05 Eh
   gradient norm :     0.0004284 Eh/α   predicted    -0.1743358E-05 ( -33.82%)
   displ. norm   :     0.0265108 α      lambda        0.3531602E-05
   maximum displ.:     0.0171442 α      in ANC's #2, #4, #10, ...

   *** GEOMETRY OPTIMIZATION CONVERGED AFTER 12 ITERATIONS ***

------------------------------------------------------------------------
 total energy gain   :        -0.0049157 Eh       -3.0846 kcal/mol
 total RMSD          :         0.1093558 a0        0.0579 Å
 total power (kW/mol):        -1.0755145 (step)  -36.0380 (real)
------------------------------------------------------------------------

 ANCopt (total)                0 d,  0 h,  0 min,  0.358 sec
 optimizer setup                ...        0 min,  0.000 sec (  0.044%)
 model hessian                  ...        0 min,  0.004 sec (  1.044%)
 ANC generation                 ...        0 min,  0.001 sec (  0.209%)
 coordinate transformation      ...        0 min,  0.000 sec (  0.061%)
 single point calculation       ...        0 min,  0.349 sec ( 97.581%)
 optimization log               ...        0 min,  0.001 sec (  0.361%)
 hessian update                 ...        0 min,  0.000 sec (  0.045%)
 rational function              ...        0 min,  0.002 sec (  0.432%)

================
 final structure:
================
$coord
    2.26733901117632    0.69727071976234   -0.11372487809259      C 
    1.51393338159318   -1.77195916285691   -0.01885656387488      C 
   -1.23954000606088   -1.84147962755812    0.10240420284083      C 
   -2.10448852959828    0.54734033300053    0.07873335254876      C 
    0.05933035073143    2.25232349915055   -0.05757738536795      C 
   -0.06546350566439    4.84374128684654   -0.11137973257392      C 
    2.10252416195359    6.55376643435418   -0.24190244715836      C 
    1.24061670824248    8.94293885381181   -0.23586178396128      C 
   -1.51429938132255    8.86941666551375   -0.09473562123304      C 
   -2.26720171526641    6.40295868218608   -0.02754227329262      C 
   -2.97999262394490   10.99606480989719   -0.16271307901281      N 
    2.90910269713105   -3.94313925479218   -0.02418610930054      N 
    5.48728078322800   -4.11927625963342   -0.14321458224916      C 
    6.74159130340555   -6.29931464044622   -0.14579714275998      C 
    4.16605934887742    1.39561889024721   -0.21430025809304      H 
   -2.32598003874040   -3.55759556775721    0.19277344324865      H 
   -4.03802378699992    1.15309472196285    0.14501061495947      H 
    4.03565888659192    5.94811930817002   -0.32711848869449      H 
    2.32482351391662   10.65984469534599   -0.31811434740802      H 
   -4.17864725661712    5.73574147184447    0.07449142008458      H 
   -2.15521045464729   12.64013070794070    0.32372428070538      H 
   -4.80506509334721   10.80742064625745    0.33913009193649      H 
    1.94115850174969   -5.58801464289012    0.06147728208613      H 
    6.45689628904431   -2.32771675737865   -0.23622203702245      H 
    5.77917277908531   -8.09013539504412   -0.05170453108492      H 
    8.76595943122763   -6.34752193309130   -0.24068255232228      H 
$end
           -------------------------------------------------
          |                Final Singlepoint                |
           -------------------------------------------------

          ...................................................
          :                      SETUP                      :
          :.................................................:
          :  # basis functions                  68          :
          :  # atomic orbitals                  68          :
          :  # shells                           40          :
          :  # electrons                        70          :
          :  max. iterations                   250          :
          :  Hamiltonian                  GFN2-xTB          :
          :  restarted?                      false          :
          :  GBSA solvation                  false          :
          :  PC potential                    false          :
          :  electronic temp.          300.0000000     K    :
          :  accuracy                    1.0000000          :
          :  -> integral cutoff          0.2500000E+02      :
          :  -> integral neglect         0.1000000E-07      :
          :  -> SCF convergence          0.1000000E-05 Eh   :
          :  -> wf. convergence          0.1000000E-03 e    :
          :  Broyden damping             0.4000000          :
          ...................................................

 iter      E             dE          RMSdq      gap      omega  full diag
   1    -38.2445592 -0.382446E+02  0.160E-04    1.08       0.0  T
   2    -38.2445592 -0.498304E-10  0.871E-05    1.08     225.3  T
   3    -38.2445592 -0.123585E-09  0.692E-05    1.08     283.6  T

   *** convergence criteria satisfied after 3 iterations ***

         #    Occupation            Energy/Eh            Energy/eV
      -------------------------------------------------------------
         1        2.0000           -0.6529790             -17.7685
       ...           ...                  ...                  ...
        29        2.0000           -0.4259014             -11.5894
        30        2.0000           -0.4228612             -11.5066
        31        2.0000           -0.4099763             -11.1560
        32        2.0000           -0.3901032             -10.6152
        33        2.0000           -0.3703305             -10.0772
        34        2.0000           -0.3450443              -9.3891
        35        2.0000           -0.3298110              -8.9746 (HOMO)
        36                         -0.2902738              -7.8988 (LUMO)
        37                         -0.1901085              -5.1731
        38                         -0.1732813              -4.7152
        39                         -0.1256520              -3.4192
        40                         -0.1157700              -3.1503
       ...                                ...                  ...
        68                          0.7763795              21.1264
      -------------------------------------------------------------
                  HL-Gap            0.0395372 Eh            1.0759 eV
             Fermi-level           -0.3100424 Eh           -8.4367 eV

 SCC (total)                   0 d,  0 h,  0 min,  0.027 sec
 SCC setup                      ...        0 min,  0.000 sec (  0.807%)
 Dispersion                     ...        0 min,  0.000 sec (  0.836%)
 integral evaluation            ...        0 min,  0.009 sec ( 32.976%)
 zeroth order Hamiltonian       ...        0 min,  0.000 sec (  0.500%)
 iterations                     ...        0 min,  0.004 sec ( 14.587%)
 molecular gradient             ...        0 min,  0.013 sec ( 48.775%)
 printout                       ...        0 min,  0.000 sec (  1.329%)

         :::::::::::::::::::::::::::::::::::::::::::::::::::::
         ::                     SUMMARY                     ::
         :::::::::::::::::::::::::::::::::::::::::::::::::::::
         :: total energy             -37.561999164313 Eh    ::
         :: gradient norm              0.000429098958 Eh/a0 ::
         :: HOMO-LUMO gap              1.075863083235 eV    ::
         ::.................................................::
         :: SCC energy               -38.244559153986 Eh    ::
         :: -> isotropic ES            0.016452745315 Eh    ::
         :: -> anisotropic ES          0.009247785814 Eh    ::
         :: -> anisotropic XC          0.022936366393 Eh    ::
         :: -> dispersion             -0.023666645735 Eh    ::
         :: repulsion energy           0.682760707032 Eh    ::
         :: add. restraining           0.000000000000 Eh    ::
         :::::::::::::::::::::::::::::::::::::::::::::::::::::

           -------------------------------------------------
          |                Property Printout                |
           -------------------------------------------------

    * Orbital Energies and Occupations

         #    Occupation            Energy/Eh            Energy/eV
      -------------------------------------------------------------
         1        2.0000           -0.6529790             -17.7685
       ...           ...                  ...                  ...
        23        2.0000           -0.4548456             -12.3770
        24        2.0000           -0.4509168             -12.2701
        25        2.0000           -0.4501842             -12.2501
        26        2.0000           -0.4458156             -12.1313
        27        2.0000           -0.4333528             -11.7921
        28        2.0000           -0.4272360             -11.6257
        29        2.0000           -0.4259014             -11.5894
        30        2.0000           -0.4228612             -11.5066
        31        2.0000           -0.4099763             -11.1560
        32        2.0000           -0.3901032             -10.6152
        33        2.0000           -0.3703305             -10.0772
        34        2.0000           -0.3450443              -9.3891
        35        2.0000           -0.3298110              -8.9746 (HOMO)
        36                         -0.2902738              -7.8988 (LUMO)
        37                         -0.1901085              -5.1731
        38                         -0.1732813              -4.7152
        39                         -0.1256520              -3.4192
        40                         -0.1157700              -3.1503
        41                         -0.0707143              -1.9242
        42                          0.0279111               0.7595
        43                          0.0361723               0.9843
        44                          0.0991281               2.6974
        45                          0.1132317               3.0812
        46                          0.1233142               3.3555
       ...                                ...                  ...
        68                          0.7763795              21.1264
      -------------------------------------------------------------
                  HL-Gap            0.0395372 Eh            1.0759 eV
             Fermi-level           -0.3100424 Eh           -8.4367 eV

     #   Z        covCN         q      C6AA      α(0)
     1   6 C      2.995    -0.096    30.415     9.047
     2   6 C      3.028     0.056    26.727     8.480
     3   6 C      3.018    -0.061    29.491     8.908
     4   6 C      3.005    -0.048    29.177     8.861
     5   6 C      3.095     0.013    27.618     8.613
     6   6 C      3.093     0.016    27.548     8.603
     7   6 C      3.006    -0.048    29.182     8.861
     8   6 C      3.014    -0.059    29.437     8.900
     9   6 C      3.020     0.073    26.347     8.420
    10   6 C      2.996    -0.107    30.682     9.086
    11   7 N      2.634    -0.256    26.642     7.666
    12   7 N      2.692    -0.111    23.429     7.189
    13   6 C      2.825     0.023    27.491     8.591
    14   6 C      2.841    -0.132    31.364     9.178
    15   1 H      0.926     0.019     2.756     2.596
    16   1 H      0.926     0.017     2.785     2.609
    17   1 H      0.926     0.029     2.602     2.522
    18   1 H      0.926     0.029     2.602     2.522
    19   1 H      0.926     0.020     2.727     2.582
    20   1 H      0.926     0.015     2.807     2.620
    21   1 H      0.860     0.165     1.301     1.787
    22   1 H      0.860     0.163     1.315     1.796
    23   1 H      0.860     0.166     1.295     1.783
    24   1 H      0.926     0.049     2.331     2.387
    25   1 H      0.926     0.028     2.609     2.526
    26   1 H      0.926     0.037     2.488     2.466

 Mol. C6AA /au·bohr⁶  :       8524.944423
 Mol. C8AA /au·bohr⁸  :     207505.027925
 Mol. α(0) /au        :        148.599914


Wiberg/Mayer (AO) data.
largest (>0.10) Wiberg bond orders for each atom
          total WBO             WBO to atom ...
     1  C   3.961        C    2 1.526    C    5 1.202    H   15 0.970
     2  C   3.903        C    1 1.526    N   12 1.156    C    3 1.084
     3  C   3.935        C    4 1.753    C    2 1.084    H   16 0.972
     4  C   3.977        C    3 1.753    C    5 1.092    H   17 0.972
     5  C   3.983        C    6 1.453    C    1 1.202    C    4 1.092
     6  C   3.965        C    5 1.453    C   10 1.205    C    7 1.082
     7  C   3.974        C    8 1.761    C    6 1.082    H   18 0.972
     8  C   3.931        C    7 1.761    C    9 1.077    H   19 0.972
     9  C   3.897        C   10 1.531    N   11 1.183    C    8 1.077
    10  C   3.957        C    9 1.531    C    6 1.205    H   20 0.971
    11  N   3.258        C    9 1.183    H   22 0.954    H   21 0.953
    12  N   3.487        C    2 1.156    C   13 1.155    H   23 0.938
    13  C   3.966        C   14 1.811    N   12 1.155    H   24 0.958
    14  C   3.920        C   13 1.811    H   26 0.979    H   25 0.976
    15  H   1.000        C    1 0.970
    16  H   0.999        C    3 0.972
    17  H   0.999        C    4 0.972
    18  H   0.999        C    7 0.972
    19  H   0.999        C    8 0.972
    20  H   1.000        C   10 0.971
    21  H   0.971        N   11 0.953
    22  H   0.972        N   11 0.954
    23  H   0.972        N   12 0.938
    24  H   0.998        C   13 0.958
    25  H   0.999        C   14 0.976
    26  H   0.998        C   14 0.979

molecular dipole:
                 x           y           z       tot (Debye)
 q only:       -0.318       0.337       0.165
   full:       -0.426       0.330       0.346       1.627
molecular quadrupole (traceless):
                xx          xy          yy          xz          yz          zz
 q only:       -5.110      -6.537      14.444      -0.812       2.531      -9.334
  q+dip:       -3.883      -6.002      22.093      -2.187       5.303     -18.210
   full:       -5.256      -6.158      19.172      -1.934       5.489     -13.916

           -------------------------------------------------
          |                Geometry Summary                 |
           -------------------------------------------------

      molecular mass/u    :      184.2402000
   center of mass at/Å    :        0.4649939       1.2138061      -0.0430715
  moments of inertia/u·Å² :        0.2175446E+03   0.1794500E+04   0.2011793E+04
rotational constants/cm⁻¹ :        0.7749045E-01   0.9394056E-02   0.8379408E-02

 * 23 selected distances

     #   Z        #   Z                                     value/Å
     1   6 C      2   6 C                                 1.3670520
     3   6 C      4   6 C                                 1.3444807
     1   6 C      5   6 C                                 1.4294295 (max)
     5   6 C      6   6 C                                 1.3732037
     7   6 C      8   6 C                                 1.3440546
     6   6 C     10   6 C                                 1.4283708
     9   6 C     10   6 C                                 1.3651124
     9   6 C     11   7 N                                 1.3672357
     2   6 C     12   7 N                                 1.3657027
    12   7 N     13   6 C                                 1.3689432
    13   6 C     14   6 C                                 1.3309485
     1   6 C     15   1 H                                 1.0718870
     3   6 C     16   1 H                                 1.0758803
     4   6 C     17   1 H                                 1.0727938
     7   6 C     18   1 H                                 1.0729492
     8   6 C     19   1 H                                 1.0754199
    10   6 C     20   1 H                                 1.0727056
    11   7 N     21   1 H                                 1.0068061
    11   7 N     22   1 H                                 1.0065951 (min)
    12   7 N     23   1 H                                 1.0109736
    13   6 C     24   1 H                                 1.0791182
    14   6 C     25   1 H                                 1.0769949
    14   6 C     26   1 H                                 1.0727290

 * 4 distinct bonds (by element types)

   Z      Z             #   av. dist./Å        max./Å        min./Å
   1 H    6 C           9     1.0744975     1.0791182     1.0718870
   6 C    6 C           8     1.3728315     1.4294295     1.3309485
   1 H    7 N           3     1.0081249     1.0109736     1.0065951
   6 C    7 N           3     1.3672939     1.3689432     1.3657027


optimized geometry written to: xtbopt.xyz


           -------------------------------------------------
          | TOTAL ENERGY              -37.561999164313 Eh   |
          | GRADIENT NORM               0.000429098958 Eh/α |
          | HOMO-LUMO GAP               1.075863083235 eV   |
           -------------------------------------------------

------------------------------------------------------------------------
 * finished run on 2021/05/19 at 11:00:40.594     
------------------------------------------------------------------------
 total:
 * wall-time:     0 d,  0 h,  0 min,  0.478 sec
 *  cpu-time:     0 d,  0 h,  0 min,  0.446 sec
 * ratio c/w:     0.933 speedup
 SCF:
 * wall-time:     0 d,  0 h,  0 min,  0.039 sec
 *  cpu-time:     0 d,  0 h,  0 min,  0.039 sec
 * ratio c/w:     1.000 speedup
 ANC optimizer:
 * wall-time:     0 d,  0 h,  0 min,  0.386 sec
 *  cpu-time:     0 d,  0 h,  0 min,  0.386 sec
 * ratio c/w:     1.000 speedup

