      -----------------------------------------------------------      
     |                   =====================                   |     
     |                           x T B                           |     
     |                   =====================                   |     
     |                         S. Grimme                         |     
     |          Mulliken Center for Theoretical Chemistry        |     
     |                    University of Bonn                     |     
     |                Version 6.2 RC2 (SAW190805)                |     
      -----------------------------------------------------------      

   This program is distributed in the hope that it will be useful,
   but WITHOUT ANY WARRANTY; without even the implied warranty of
   MERCHANTABILITY or FITNESS FOR A PARTICULAR PURPOSE.
   
   FOR NON-COMMERCIAL, ACADEMIA USE ONLY.
   
   Cite this work as:
   * S. Grimme, C. Bannwarth, P. Shushkov, J. Chem. Theory Comput., 2017,
     13, 1989-2009. DOI: 10.1021/acs.jctc.7b00118
   * C. Bannwarth, S. Ehlert and S. Grimme., J. Chem. Theory Comput., 2019,
     15, 1652-1671. DOI: 10.1021/acs.jctc.8b01176
   * P. Pracht, E. Caldeweyher, S. Ehlert, S. Grimme, ChemRxiv, 2019, preprint.
     DOI: 10.26434/chemrxiv.8326202.v1
   
   for DFT-D4:
   * E. Caldeweyher, C. Bannwarth and S. Grimme, J. Chem. Phys., 2017,
     147, 034112. DOI: 10.1063/1.4993215
   * E. Caldeweyher, S. Ehlert, A. Hansen, H. Neugebauer, S. Spicher,
     C. Bannwarth and S. Grimme, J. Chem. Phys., 2019, 150, 154122.
     DOI: 10.1063/1.5090222
   
   for sTDA-xTB:
   * S. Grimme and C. Bannwarth, J. Chem. Phys., 2016, 145, 054103.
     DOI: 10.1063/1.4959605
   
   in the mass-spec context:
   * V. Asgeirsson, C. Bauer and S. Grimme, Chem. Sci., 2017, 8, 4879.
     DOI: 10.1039/c7sc00601b
   
   for metadynamics refer to:
   * S. Grimme, J. Chem. Theory Comput., 2019, 155, 2847-2862
     DOI: 10.1021/acs.jctc.9b00143
   
   with help from (in alphabetical order)
   C. Bannwarth, F. Bohle, G. Brandenburg, E. Caldeweyher, M. Checinski,
   S. Dohm, S. Ehlert, S. Ehrlich, F. März, H. Neugebauer, J. Pisarek,
   P. Pracht, P. Shushkov, and S. Spicher.
   
 * started run on 2021/05/19 at 11:00:49.698     

           -------------------------------------------------
          |                Calculation Setup                |
           -------------------------------------------------

          program call               : /ihome/ghutchison/geoffh/xtb/xtb 867.xyz -opt
          hostname                   : smp-n83
          coordinate file            : 867.xyz
          omp threads                :                     1
          number of atoms            :                    22
          number of electrons        :                    60
          charge                     :                     0
          spin                       :                   0.0
          first test random number   :      0.30580073920687


########################################################################
# WARNING! Please study the warnings concerning your input carefully
#  - the use of '-opt' is discouraged, please use '--opt' next time
########################################################################

           ------------------------------------------------- 
          |                 G F N 2 - x T B                 |
          | Geometry, Frequencies, Noncovalent interactions |
          |            JCTC 2019 parametrisation            |
           ------------------------------------------------- 
             KAB for C  - Si     :                1.0500
             KAB for H  - Pd     :                0.9500
             k(s)              :                1.8500
             k(p)              :                2.2300
             k(d)              :                2.2300
             k(f)              :                2.0000
             kEN (H0ij)        :               -2.0000
             D4 a1             :                0.5200
             D4 a2             :                5.0000
             D4 s6             :                1.0000
             D4 s8             :                2.7000
             D4 s9             :                5.0000
             alphaj            :                2.0000

  Z AO/shell   Hii/eV     exponent
  1     Wed Apr 25 08:07:45 CEST 2018   EN: 2.200 GM2: 0.406  GM3: 0.0800  RAES: 1.40
     1s    -10.707211    1.230000
  6     Wed Apr 25 08:07:45 CEST 2018   EN: 2.550 GM2: 0.538  GM3: 0.1500  RAES: 3.00
     2s    -13.970922    2.096432
     2p    -10.063292    1.800000
 16     Tue Apr 24 11:44:34 CEST 2018   EN: 2.580 GM2: 0.340  GM3:-0.0502  RAES: 3.10
     3s    -20.029654    1.981333
     3p    -11.377694    2.025643
     3d     -0.420282    1.702555

           ------------------------------------------------- 
          |        Self-Consistent Charge Iterations        |
           ------------------------------------------------- 

          ...................................................
          :                      SETUP                      :
          :.................................................:
          :  # basis functions                  64          :
          :  # atomic orbitals                  63          :
          :  # shells                           35          :
          :  # electrons                        60          :
          :  max. iterations                   250          :
          :  Hamiltonian                  GFN2-xTB          :
          :  restarted?                      false          :
          :  GBSA solvation                  false          :
          :  PC potential                    false          :
          :  electronic temp.          300.0000000     K    :
          :  accuracy                    1.0000000          :
          :  -> integral cutoff          0.2500000E+02      :
          :  -> integral neglect         0.1000000E-07      :
          :  -> SCF convergence          0.1000000E-05 Eh   :
          :  -> wf. convergence          0.1000000E-03 e    :
          :  Broyden damping             0.4000000          :
          ...................................................

 iter      E             dE          RMSdq      gap      omega  full diag
   1    -32.3480125 -0.323480E+02  0.426E+00    1.94       0.0  T
   2    -32.3665597 -0.185473E-01  0.248E+00    2.00       1.0  T
   3    -32.3515890  0.149707E-01  0.112E+00    2.00       1.0  T
   4    -32.3634406 -0.118516E-01  0.593E-01    1.98       1.0  T
   5    -32.3691733 -0.573279E-02  0.229E-01    1.98       1.0  T
   6    -32.3700851 -0.911714E-03  0.728E-02    1.98       1.0  T
   7    -32.3701233 -0.381937E-04  0.319E-02    1.98       1.0  T
   8    -32.3701333 -0.100797E-04  0.134E-02    1.98       1.6  T
   9    -32.3701340 -0.695953E-06  0.557E-03    1.98       3.8  T
  10    -32.3701341 -0.602310E-07  0.338E-03    1.98       6.3  T
  11    -32.3701342 -0.131404E-06  0.102E-03    1.98      20.8  T
  12    -32.3701342 -0.877799E-08  0.471E-04    1.98      45.2  T
  13    -32.3701342 -0.811454E-09  0.226E-04    1.98      94.3  T

   *** convergence criteria satisfied after 13 iterations ***

         #    Occupation            Energy/Eh            Energy/eV
      -------------------------------------------------------------
         1        2.0000           -0.7285071             -19.8237
       ...           ...                  ...                  ...
        24        2.0000           -0.4337512             -11.8030
        25        2.0000           -0.4288476             -11.6695
        26        2.0000           -0.4266325             -11.6093
        27        2.0000           -0.4231502             -11.5145
        28        2.0000           -0.4061902             -11.0530
        29        2.0000           -0.3873267             -10.5397
        30        2.0000           -0.3509661              -9.5503 (HOMO)
        31                         -0.2782051              -7.5703 (LUMO)
        32                         -0.2241669              -6.0999
        33                         -0.1989531              -5.4138
        34                         -0.1936057              -5.2683
        35                         -0.1770243              -4.8171
       ...                                ...                  ...
        63                          0.7457862              20.2939
      -------------------------------------------------------------
                  HL-Gap            0.0727610 Eh            1.9799 eV
             Fermi-level           -0.3145856 Eh           -8.5603 eV

 SCC (total)                   0 d,  0 h,  0 min,  0.035 sec
 SCC setup                      ...        0 min,  0.000 sec (  0.744%)
 Dispersion                     ...        0 min,  0.000 sec (  0.746%)
 integral evaluation            ...        0 min,  0.008 sec ( 23.065%)
 zeroth order Hamiltonian       ...        0 min,  0.000 sec (  0.460%)
 iterations                     ...        0 min,  0.014 sec ( 40.169%)
 molecular gradient             ...        0 min,  0.012 sec ( 33.661%)
 printout                       ...        0 min,  0.000 sec (  1.007%)

         :::::::::::::::::::::::::::::::::::::::::::::::::::::
         ::                     SUMMARY                     ::
         :::::::::::::::::::::::::::::::::::::::::::::::::::::
         :: total energy             -31.840493320986 Eh    ::
         :: gradient norm              0.105196241251 Eh/a0 ::
         :: HOMO-LUMO gap              1.979927897068 eV    ::
         ::.................................................::
         :: SCC energy               -32.370134232282 Eh    ::
         :: -> isotropic ES            0.002595981781 Eh    ::
         :: -> anisotropic ES          0.003806816084 Eh    ::
         :: -> anisotropic XC          0.020041970665 Eh    ::
         :: -> dispersion             -0.022699556972 Eh    ::
         :: repulsion energy           0.529599299489 Eh    ::
         :: add. restraining           0.000000000000 Eh    ::
         :::::::::::::::::::::::::::::::::::::::::::::::::::::

      ----------------------------------------------------------- 
     |                   =====================                   |
     |                        A N C O P T                        |
     |                   =====================                   |
     |               Approximate Normal Coordinate               |
     |                Rational Function Optimizer                |
      ----------------------------------------------------------- 

          ...................................................
          :                      SETUP                      :
          :.................................................:
          :   optimization level            normal          :
          :   max. optcycles                   200          :
          :   ANC micro-cycles                  20          :
          :   degrees of freedom                60          :
          :.................................................:
          :   RF solver                   davidson          :
          :   input Hessian                  false          :
          :   write xtbopt.log                true          :
          :   linear?                        false          :
          :   energy convergence         0.5000000E-05 Eh   :
          :   grad. convergence          0.1000000E-02 Eh/α :
          :   maximium RF displ.         2.0000000          :
          :   Hlow (freq-cutoff)         0.5000000E-02      :
          :   Hmax (freq-cutoff)         5.0000000          :
          :   S6 in model hess.         20.0000000          :
          ...................................................

generating ANC from model Hessian ...
Using Lindh-Hessian (1995)
 Shifting diagonal of input Hessian by   3.535452966871880E-003
 Lowest  eigenvalues of input Hessian
   -0.000000   -0.000000   -0.000000    0.000000    0.000000    0.000000
    0.005000    0.006465    0.008545    0.010005    0.010774    0.013208
    0.016566    0.017104    0.022174    0.026053    0.030905    0.038685
 Highest eigenvalues
    1.625332    1.712410    1.847432    1.903916    1.991644    2.044307
 

........................................................................
.............................. CYCLE    1 ..............................
........................................................................
   1    -32.3701342 -0.323701E+02  0.872E-05    1.98       0.0  T
   2    -32.3701342 -0.573408E-11  0.639E-05    1.98     333.8  T
   3    -32.3701342 -0.626699E-10  0.333E-05    1.98     639.8  T
     SCC iter.                  ...        0 min,  0.004 sec
     gradient                   ...        0 min,  0.012 sec
 * total energy  :   -31.8404933 Eh     change       -0.1166168E-08 Eh
   gradient norm :     0.1051965 Eh/α   predicted     0.0000000E+00 (-100.00%)
   displ. norm   :     0.2962664 α      lambda       -0.1738688E-01
   maximum displ.:     0.1746118 α      in ANC's #28, #17, #22, ...

........................................................................
.............................. CYCLE    2 ..............................
........................................................................
   1    -32.4036640 -0.324037E+02  0.259E-01    2.06       0.0  T
   2    -32.4037401 -0.760644E-04  0.162E-01    2.06       1.0  T
   3    -32.4036533  0.867678E-04  0.103E-01    2.06       1.0  T
   4    -32.4037976 -0.144248E-03  0.405E-02    2.06       1.0  T
   5    -32.4038257 -0.280949E-04  0.163E-02    2.06       1.3  T
   6    -32.4038297 -0.400119E-05  0.531E-03    2.06       4.0  T
   7    -32.4038299 -0.255978E-06  0.204E-03    2.06      10.4  T
     SCC iter.                  ...        0 min,  0.007 sec
     gradient                   ...        0 min,  0.011 sec
 * total energy  :   -31.8524450 Eh     change       -0.1195164E-01 Eh
   gradient norm :     0.0488013 Eh/α   predicted    -0.9456498E-02 ( -20.88%)
   displ. norm   :     0.2190327 α      lambda       -0.4502860E-02
   maximum displ.:     0.1082041 α      in ANC's #2, #28, #4, ...

........................................................................
.............................. CYCLE    3 ..............................
........................................................................
   1    -32.4163888 -0.324164E+02  0.198E-01    2.14       0.0  T
   2    -32.4164247 -0.358772E-04  0.121E-01    2.13       1.0  T
   3    -32.4163609  0.637482E-04  0.775E-02    2.13       1.0  T
   4    -32.4164445 -0.835874E-04  0.287E-02    2.13       1.0  T
   5    -32.4164611 -0.166121E-04  0.787E-03    2.13       2.7  T
   6    -32.4164619 -0.711045E-06  0.294E-03    2.13       7.2  T
   7    -32.4164619 -0.863242E-07  0.114E-03    2.13      18.6  T
     SCC iter.                  ...        0 min,  0.007 sec
     gradient                   ...        0 min,  0.011 sec
 * total energy  :   -31.8548990 Eh     change       -0.2454021E-02 Eh
   gradient norm :     0.0108371 Eh/α   predicted    -0.2359449E-02 (  -3.85%)
   displ. norm   :     0.1624394 α      lambda       -0.4417517E-03
   maximum displ.:     0.1294380 α      in ANC's #2, #4, #3, ...

........................................................................
.............................. CYCLE    4 ..............................
........................................................................
   1    -32.4143376 -0.324143E+02  0.120E-01    2.13       0.0  T
   2    -32.4143398 -0.220369E-05  0.687E-02    2.13       1.0  T
   3    -32.4143256  0.141993E-04  0.283E-02    2.13       1.0  T
   4    -32.4143406 -0.150308E-04  0.842E-03    2.13       2.5  T
   5    -32.4143415 -0.831408E-06  0.412E-03    2.13       5.2  T
   6    -32.4143417 -0.215280E-06  0.873E-04    2.13      24.4  T
   7    -32.4143417 -0.106138E-07  0.423E-04    2.13      50.4  T
     SCC iter.                  ...        0 min,  0.007 sec
     gradient                   ...        0 min,  0.012 sec
 * total energy  :   -31.8552382 Eh     change       -0.3392496E-03 Eh
   gradient norm :     0.0044581 Eh/α   predicted    -0.2267467E-03 ( -33.16%)
   displ. norm   :     0.2086661 α      lambda       -0.3267264E-03
   maximum displ.:     0.1632348 α      in ANC's #2, #4, #3, ...

........................................................................
.............................. CYCLE    5 ..............................
........................................................................
   1    -32.4126478 -0.324126E+02  0.158E-01    2.13       0.0  T
   2    -32.4126505 -0.278391E-05  0.890E-02    2.13       1.0  T
   3    -32.4126293  0.212562E-04  0.351E-02    2.13       1.0  T
   4    -32.4126520 -0.227285E-04  0.101E-02    2.13       2.1  T
   5    -32.4126525 -0.439582E-06  0.582E-03    2.13       3.7  T
   6    -32.4126530 -0.545604E-06  0.133E-03    2.13      16.0  T
   7    -32.4126530 -0.350489E-07  0.448E-04    2.13      47.6  T
     SCC iter.                  ...        0 min,  0.007 sec
     gradient                   ...        0 min,  0.011 sec
 * total energy  :   -31.8554730 Eh     change       -0.2347732E-03 Eh
   gradient norm :     0.0051317 Eh/α   predicted    -0.1704769E-03 ( -27.39%)
   displ. norm   :     0.1590853 α      lambda       -0.1628753E-03
   maximum displ.:     0.1252159 α      in ANC's #2, #4, #10, ...

........................................................................
.............................. CYCLE    6 ..............................
........................................................................
   1    -32.4127621 -0.324128E+02  0.122E-01    2.12       0.0  T
   2    -32.4127633 -0.123132E-05  0.696E-02    2.12       1.0  T
   3    -32.4127497  0.136436E-04  0.278E-02    2.12       1.0  T
   4    -32.4127643 -0.145866E-04  0.667E-03    2.12       3.2  T
   5    -32.4127644 -0.112978E-06  0.405E-03    2.12       5.3  T
   6    -32.4127646 -0.263917E-06  0.858E-04    2.12      24.8  T
   7    -32.4127647 -0.150748E-07  0.257E-04    2.12      83.1  T
     SCC iter.                  ...        0 min,  0.007 sec
     gradient                   ...        0 min,  0.011 sec
 * total energy  :   -31.8555994 Eh     change       -0.1264446E-03 Eh
   gradient norm :     0.0060542 Eh/α   predicted    -0.8350427E-04 ( -33.96%)
   displ. norm   :     0.1794423 α      lambda       -0.1672948E-03
   maximum displ.:     0.1406750 α      in ANC's #2, #4, #10, ...

........................................................................
.............................. CYCLE    7 ..............................
........................................................................
   1    -32.4135540 -0.324136E+02  0.133E-01    2.10       0.0  T
   2    -32.4135553 -0.134738E-05  0.760E-02    2.10       1.0  T
   3    -32.4135306  0.246810E-04  0.372E-02    2.10       1.0  T
   4    -32.4135571 -0.264557E-04  0.751E-03    2.10       2.8  T
   5    -32.4135572 -0.165331E-06  0.468E-03    2.10       4.6  T
   6    -32.4135576 -0.331737E-06  0.931E-04    2.10      22.9  T
   7    -32.4135576 -0.177323E-07  0.295E-04    2.10      72.3  T
     SCC iter.                  ...        0 min,  0.007 sec
     gradient                   ...        0 min,  0.011 sec
 * total energy  :   -31.8557220 Eh     change       -0.1225139E-03 Eh
   gradient norm :     0.0048131 Eh/α   predicted    -0.8635477E-04 ( -29.51%)
   displ. norm   :     0.2413698 α      lambda       -0.1784864E-03
   maximum displ.:     0.1815399 α      in ANC's #2, #4, #3, ...

........................................................................
.............................. CYCLE    8 ..............................
........................................................................
   1    -32.4142272 -0.324142E+02  0.181E-01    2.08       0.0  T
   2    -32.4142299 -0.269059E-05  0.104E-01    2.08       1.0  T
   3    -32.4141840  0.459428E-04  0.512E-02    2.08       1.0  T
   4    -32.4142330 -0.490306E-04  0.104E-02    2.08       2.0  T
   5    -32.4142336 -0.569507E-06  0.630E-03    2.08       3.4  T
   6    -32.4142341 -0.575553E-06  0.134E-03    2.08      15.9  T
   7    -32.4142342 -0.347342E-07  0.412E-04    2.08      51.7  T
     SCC iter.                  ...        0 min,  0.007 sec
     gradient                   ...        0 min,  0.011 sec
 * total energy  :   -31.8558210 Eh     change       -0.9903006E-04 Eh
   gradient norm :     0.0043540 Eh/α   predicted    -0.9444925E-04 (  -4.63%)
   displ. norm   :     0.1253297 α      lambda       -0.1000124E-03
   maximum displ.:     0.0789683 α      in ANC's #2, #3, #4, ...

........................................................................
.............................. CYCLE    9 ..............................
........................................................................
   1    -32.4151333 -0.324151E+02  0.866E-02    2.08       0.0  T
   2    -32.4151339 -0.531561E-06  0.492E-02    2.08       1.0  T
   3    -32.4151229  0.109952E-04  0.247E-02    2.08       1.0  T
   4    -32.4151346 -0.117505E-04  0.500E-03    2.08       4.3  T
   5    -32.4151347 -0.946174E-07  0.274E-03    2.08       7.8  T
   6    -32.4151349 -0.123127E-06  0.436E-04    2.08      48.9  T
     SCC iter.                  ...        0 min,  0.006 sec
     gradient                   ...        0 min,  0.011 sec
 * total energy  :   -31.8558863 Eh     change       -0.6533669E-04 Eh
   gradient norm :     0.0031680 Eh/α   predicted    -0.5079349E-04 ( -22.26%)
   displ. norm   :     0.1135521 α      lambda       -0.5603064E-04
   maximum displ.:     0.0759505 α      in ANC's #3, #2, #4, ...

........................................................................
.............................. CYCLE   10 ..............................
........................................................................
   1    -32.4154450 -0.324154E+02  0.730E-02    2.07       0.0  T
   2    -32.4154453 -0.299011E-06  0.418E-02    2.07       1.0  T
   3    -32.4154350  0.102728E-04  0.242E-02    2.07       1.0  T
   4    -32.4154460 -0.109923E-04  0.433E-03    2.07       4.9  T
   5    -32.4154461 -0.868401E-07  0.260E-03    2.07       8.2  T
   6    -32.4154462 -0.109741E-06  0.459E-04    2.07      46.4  T
   7    -32.4154462 -0.263660E-08  0.192E-04    2.07     111.0  T
     SCC iter.                  ...        0 min,  0.007 sec
     gradient                   ...        0 min,  0.012 sec
 * total energy  :   -31.8559270 Eh     change       -0.4071191E-04 Eh
   gradient norm :     0.0026583 Eh/α   predicted    -0.2838187E-04 ( -30.29%)
   displ. norm   :     0.1361002 α      lambda       -0.3992487E-04
   maximum displ.:     0.0770563 α      in ANC's #3, #4, #2, ...

........................................................................
.............................. CYCLE   11 ..............................
........................................................................
   1    -32.4142437 -0.324142E+02  0.883E-02    2.07       0.0  T
   2    -32.4142440 -0.302791E-06  0.510E-02    2.07       1.0  T
   3    -32.4142306  0.134234E-04  0.269E-02    2.07       1.0  T
   4    -32.4142449 -0.142932E-04  0.422E-03    2.07       5.0  T
   5    -32.4142449 -0.583044E-07  0.239E-03    2.07       8.9  T
   6    -32.4142450 -0.980893E-07  0.456E-04    2.07      46.7  T
   7    -32.4142450 -0.224433E-08  0.190E-04    2.07     112.1  T
     SCC iter.                  ...        0 min,  0.007 sec
     gradient                   ...        0 min,  0.012 sec
 * total energy  :   -31.8559493 Eh     change       -0.2222297E-04 Eh
   gradient norm :     0.0025448 Eh/α   predicted    -0.2033478E-04 (  -8.50%)
   displ. norm   :     0.0611237 α      lambda       -0.2927158E-04
   maximum displ.:     0.0533410 α      in ANC's #3, #1, #4, ...

........................................................................
.............................. CYCLE   12 ..............................
........................................................................
   1    -32.4150264 -0.324150E+02  0.314E-02    2.07       0.0  T
   2    -32.4150265 -0.764961E-07  0.179E-02    2.07       1.2  T
   3    -32.4150236  0.295937E-05  0.132E-02    2.07       1.6  T
   4    -32.4150268 -0.322671E-05  0.225E-03    2.07       9.5  T
   5    -32.4150268 -0.253380E-07  0.125E-03    2.07      17.0  T
   6    -32.4150268 -0.220642E-07  0.329E-04    2.07      64.8  T
   7    -32.4150268 -0.108464E-08  0.141E-04    2.07     151.7  T
     SCC iter.                  ...        0 min,  0.007 sec
     gradient                   ...        0 min,  0.012 sec
 * total energy  :   -31.8559608 Eh     change       -0.1148836E-04 Eh
   gradient norm :     0.0015263 Eh/α   predicted    -0.1469653E-04 (  27.93%)
   displ. norm   :     0.0745009 α      lambda       -0.1121746E-04
   maximum displ.:     0.0438692 α      in ANC's #4, #2, #3, ...

........................................................................
.............................. CYCLE   13 ..............................
........................................................................
   1    -32.4147485 -0.324147E+02  0.423E-02    2.07       0.0  T
   2    -32.4147486 -0.169255E-06  0.243E-02    2.07       1.0  T
   3    -32.4147474  0.118586E-05  0.853E-03    2.07       2.5  T
   4    -32.4147487 -0.125180E-05  0.216E-03    2.07       9.9  T
   5    -32.4147487 -0.324233E-07  0.121E-03    2.07      17.6  T
   6    -32.4147487 -0.229181E-07  0.355E-04    2.07      60.1  T
   7    -32.4147488 -0.158001E-08  0.106E-04    2.07     201.9  T
     SCC iter.                  ...        0 min,  0.007 sec
     gradient                   ...        0 min,  0.012 sec
 * total energy  :   -31.8559643 Eh     change       -0.3517464E-05 Eh
   gradient norm :     0.0024249 Eh/α   predicted    -0.5624635E-05 (  59.91%)
   displ. norm   :     0.0137632 α      lambda       -0.7698295E-05
   maximum displ.:     0.0069727 α      in ANC's #1, #2, #4, ...

........................................................................
.............................. CYCLE   14 ..............................
........................................................................
   1    -32.4147408 -0.324147E+02  0.148E-02    2.07       0.0  T
   2    -32.4147408 -0.418451E-07  0.842E-03    2.07       2.5  T
   3    -32.4147400  0.829539E-06  0.679E-03    2.07       3.1  T
   4    -32.4147409 -0.918789E-06  0.117E-03    2.07      18.2  T
   5    -32.4147409 -0.522744E-08  0.592E-04    2.07      36.0  T
   6    -32.4147409 -0.283339E-08  0.208E-04    2.07     102.3  T
     SCC iter.                  ...        0 min,  0.006 sec
     gradient                   ...        0 min,  0.012 sec
 * total energy  :   -31.8559690 Eh     change       -0.4769983E-05 Eh
   gradient norm :     0.0009356 Eh/α   predicted    -0.3851479E-05 ( -19.26%)
   displ. norm   :     0.0206568 α      lambda        0.2241724E-05
   maximum displ.:     0.0104827 α      in ANC's #1, #2, #4, ...

   *** GEOMETRY OPTIMIZATION CONVERGED AFTER 14 ITERATIONS ***

------------------------------------------------------------------------
 total energy gain   :        -0.0154757 Eh       -9.7112 kcal/mol
 total RMSD          :         0.3309894 a0        0.1752 Å
 total power (kW/mol):        -2.9022494 (step) -106.5029 (real)
------------------------------------------------------------------------

 ANCopt (total)                0 d,  0 h,  0 min,  0.382 sec
 optimizer setup                ...        0 min,  0.000 sec (  0.041%)
 model hessian                  ...        0 min,  0.003 sec (  0.864%)
 ANC generation                 ...        0 min,  0.001 sec (  0.171%)
 coordinate transformation      ...        0 min,  0.000 sec (  0.063%)
 single point calculation       ...        0 min,  0.372 sec ( 97.607%)
 optimization log               ...        0 min,  0.001 sec (  0.344%)
 hessian update                 ...        0 min,  0.000 sec (  0.046%)
 rational function              ...        0 min,  0.002 sec (  0.625%)

================
 final structure:
================
$coord
   -2.89628819767260    2.38301490796962   -0.10891795065336      C 
   -5.10694728245327    0.04290224909620   -0.15363980023934      S 
   -2.84790073350377   -2.32647078702559   -0.00755183415039      C 
   -0.43227294520890   -1.28435562313301    0.00669904726176      C 
   -0.47569212849368    1.43244910718527   -0.03070478079210      C 
    1.81464160687456    2.81566613832403    0.00390082054172      C 
    4.07037657494186    1.57462783529309    0.02416026437109      C 
    6.53881941755087    2.95838256070106    0.06848599428711      C 
    4.10172043381146   -1.11071603507309   -0.04084591322656      C 
    1.94456293047410   -2.50838000246888   -0.05512964240807      C 
   -3.72520835858226   -4.89514079681863    0.10460401886777      C 
   -2.48746116056299   -6.87199893647702    1.05109170608749      C 
   -3.47505884922475    4.32362864306282   -0.13316339896910      H 
    1.72881585334551    4.85580947753259    0.00108168082602      H 
    6.24428890653898    4.98861640933084    0.17181971714474      H 
    7.62555304170634    2.53577610425282   -1.62910870713727      H 
    7.65859270335032    2.36899284476343    1.69257581654806      H 
    5.91606668768230   -2.04684536468509   -0.09426649390468      H 
    2.03280351128755   -4.54065122180053   -0.16329991500591      H 
   -5.63268968745724   -5.16189671173493   -0.59623963124839      H 
   -0.64184339955653   -6.71457850136614    1.88832561628563      H 
   -3.32416527702413   -8.72507135187246    1.04997099234416      H 
$end
           -------------------------------------------------
          |                Final Singlepoint                |
           -------------------------------------------------

          ...................................................
          :                      SETUP                      :
          :.................................................:
          :  # basis functions                  64          :
          :  # atomic orbitals                  63          :
          :  # shells                           35          :
          :  # electrons                        60          :
          :  max. iterations                   250          :
          :  Hamiltonian                  GFN2-xTB          :
          :  restarted?                      false          :
          :  GBSA solvation                  false          :
          :  PC potential                    false          :
          :  electronic temp.          300.0000000     K    :
          :  accuracy                    1.0000000          :
          :  -> integral cutoff          0.2500000E+02      :
          :  -> integral neglect         0.1000000E-07      :
          :  -> SCF convergence          0.1000000E-05 Eh   :
          :  -> wf. convergence          0.1000000E-03 e    :
          :  Broyden damping             0.4000000          :
          ...................................................

 iter      E             dE          RMSdq      gap      omega  full diag
   1    -32.4147409 -0.324147E+02  0.109E-04    2.07       0.0  T
   2    -32.4147409 -0.114824E-10  0.470E-05    2.07     453.4  T
   3    -32.4147409 -0.536460E-11  0.519E-05    2.07     410.6  T

   *** convergence criteria satisfied after 3 iterations ***

         #    Occupation            Energy/Eh            Energy/eV
      -------------------------------------------------------------
         1        2.0000           -0.7306458             -19.8819
       ...           ...                  ...                  ...
        24        2.0000           -0.4401129             -11.9761
        25        2.0000           -0.4337895             -11.8040
        26        2.0000           -0.4294906             -11.6870
        27        2.0000           -0.4147898             -11.2870
        28        2.0000           -0.4059058             -11.0453
        29        2.0000           -0.3907613             -10.6332
        30        2.0000           -0.3542284              -9.6390 (HOMO)
        31                         -0.2782311              -7.5711 (LUMO)
        32                         -0.2186431              -5.9496
        33                         -0.1971322              -5.3642
        34                         -0.1949012              -5.3035
        35                         -0.1637988              -4.4572
       ...                                ...                  ...
        63                          0.7383792              20.0923
      -------------------------------------------------------------
                  HL-Gap            0.0759973 Eh            2.0680 eV
             Fermi-level           -0.3162297 Eh           -8.6050 eV

 SCC (total)                   0 d,  0 h,  0 min,  0.024 sec
 SCC setup                      ...        0 min,  0.000 sec (  0.747%)
 Dispersion                     ...        0 min,  0.000 sec (  0.775%)
 integral evaluation            ...        0 min,  0.008 sec ( 31.962%)
 zeroth order Hamiltonian       ...        0 min,  0.000 sec (  0.590%)
 iterations                     ...        0 min,  0.004 sec ( 15.201%)
 molecular gradient             ...        0 min,  0.012 sec ( 49.037%)
 printout                       ...        0 min,  0.000 sec (  1.416%)

         :::::::::::::::::::::::::::::::::::::::::::::::::::::
         ::                     SUMMARY                     ::
         :::::::::::::::::::::::::::::::::::::::::::::::::::::
         :: total energy             -31.855969036278 Eh    ::
         :: gradient norm              0.000936975380 Eh/a0 ::
         :: HOMO-LUMO gap              2.067991899371 eV    ::
         ::.................................................::
         :: SCC energy               -32.414740896078 Eh    ::
         :: -> isotropic ES            0.002697349652 Eh    ::
         :: -> anisotropic ES          0.004119214036 Eh    ::
         :: -> anisotropic XC          0.018356223054 Eh    ::
         :: -> dispersion             -0.022668820194 Eh    ::
         :: repulsion energy           0.558744093540 Eh    ::
         :: add. restraining           0.000000000000 Eh    ::
         :::::::::::::::::::::::::::::::::::::::::::::::::::::

           -------------------------------------------------
          |                Property Printout                |
           -------------------------------------------------

    * Orbital Energies and Occupations

         #    Occupation            Energy/Eh            Energy/eV
      -------------------------------------------------------------
         1        2.0000           -0.7306458             -19.8819
       ...           ...                  ...                  ...
        18        2.0000           -0.4794020             -13.0452
        19        2.0000           -0.4756640             -12.9435
        20        2.0000           -0.4673999             -12.7186
        21        2.0000           -0.4602984             -12.5254
        22        2.0000           -0.4482688             -12.1980
        23        2.0000           -0.4451392             -12.1129
        24        2.0000           -0.4401129             -11.9761
        25        2.0000           -0.4337895             -11.8040
        26        2.0000           -0.4294906             -11.6870
        27        2.0000           -0.4147898             -11.2870
        28        2.0000           -0.4059058             -11.0453
        29        2.0000           -0.3907613             -10.6332
        30        2.0000           -0.3542284              -9.6390 (HOMO)
        31                         -0.2782311              -7.5711 (LUMO)
        32                         -0.2186431              -5.9496
        33                         -0.1971322              -5.3642
        34                         -0.1949012              -5.3035
        35                         -0.1637988              -4.4572
        36                         -0.1132171              -3.0808
        37                         -0.0821102              -2.2343
        38                          0.0006433               0.0175
        39                          0.0313711               0.8537
        40                          0.0391521               1.0654
        41                          0.0961171               2.6155
       ...                                ...                  ...
        63                          0.7383792              20.0923
      -------------------------------------------------------------
                  HL-Gap            0.0759973 Eh            2.0680 eV
             Fermi-level           -0.3162297 Eh           -8.6050 eV

     #   Z        covCN         q      C6AA      α(0)
     1   6 C      2.925    -0.036    28.894     8.815
     2  16 S      2.348    -0.014   141.653    20.032
     3   6 C      2.976     0.012    27.747     8.641
     4   6 C      3.164    -0.007    27.842     8.624
     5   6 C      3.174    -0.000    27.632     8.585
     6   6 C      2.915    -0.048    29.186     8.859
     7   6 C      2.963     0.017    27.639     8.623
     8   6 C      3.758    -0.108    22.617     6.780
     9   6 C      2.921    -0.040    28.995     8.830
    10   6 C      2.907    -0.035    28.868     8.810
    11   6 C      2.939    -0.029    28.729     8.791
    12   6 C      2.838    -0.092    30.305     9.022
    13   1 H      0.926     0.040     2.443     2.444
    14   1 H      0.926     0.026     2.638     2.540
    15   1 H      0.925     0.040     2.453     2.449
    16   1 H      0.925     0.046     2.373     2.409
    17   1 H      0.925     0.046     2.376     2.410
    18   1 H      0.926     0.030     2.587     2.515
    19   1 H      0.926     0.033     2.540     2.492
    20   1 H      0.925     0.039     2.457     2.451
    21   1 H      0.926     0.042     2.426     2.436
    22   1 H      0.926     0.039     2.468     2.457

 Mol. C6AA /au·bohr⁶  :       7359.258875
 Mol. C8AA /au·bohr⁸  :     203154.674575
 Mol. α(0) /au        :        139.014357


Wiberg/Mayer (AO) data.
largest (>0.10) Wiberg bond orders for each atom
          total WBO             WBO to atom ...
     1  C   3.936        C    5 1.450    S    2 1.238    H   13 0.970    C    3 0.133
     2  S   2.702        C    1 1.238    C    3 1.169
     3  C   3.942        C    4 1.379    S    2 1.169    C   11 1.144    C    1 0.133
     4  C   3.987        C    3 1.379    C   10 1.233    C    5 1.167
     5  C   3.988        C    1 1.450    C    6 1.219    C    4 1.167
     6  C   3.984        C    7 1.581    C    5 1.219    H   14 0.967    C   10 0.112
     7  C   3.987        C    6 1.581    C    9 1.238    C    8 1.026
     8  C   3.995        C    7 1.026    H   15 0.986    H   17 0.973    H   16 0.972
     9  C   3.991        C   10 1.611    C    7 1.238    H   18 0.970
    10  C   3.992        C    9 1.611    C    4 1.233    H   19 0.963    C    6 0.112
    11  C   3.990        C   12 1.850    C    3 1.144    H   20 0.961
    12  C   3.984        C   11 1.850    H   22 0.978    H   21 0.972
    13  H   0.998        C    1 0.970
    14  H   0.999        C    6 0.967
    15  H   0.998        C    8 0.986
    16  H   0.995        C    8 0.972
    17  H   0.995        C    8 0.973
    18  H   0.998        C    9 0.970
    19  H   0.998        C   10 0.963
    20  H   0.997        C   11 0.961
    21  H   0.998        C   12 0.972
    22  H   0.998        C   12 0.978

molecular dipole:
                 x           y           z       tot (Debye)
 q only:        0.247       0.068      -0.006
   full:        0.472       0.128      -0.004       1.243
molecular quadrupole (traceless):
                xx          xy          yy          xz          yz          zz
 q only:        1.863       1.015       0.929       0.295      -0.095      -2.792
  q+dip:        1.925       0.293       4.705       0.989      -0.408      -6.630
   full:        0.229       0.535       3.294       0.470      -0.171      -3.524

           -------------------------------------------------
          |                Geometry Summary                 |
           -------------------------------------------------

      molecular mass/u    :      174.2600000
   center of mass at/Å    :       -0.2372518      -0.3063620       0.0287879
  moments of inertia/u·Å² :        0.3299113E+03   0.8153499E+03   0.1136058E+04
rotational constants/cm⁻¹ :        0.5109747E-01   0.2067534E-01   0.1483870E-01

 * 21 selected distances

     #   Z        #   Z                                     value/Å
     1   6 C      2  16 S                                 1.7036830
     2  16 S      3   6 C                                 1.7341004 (max)
     3   6 C      4   6 C                                 1.3921953
     1   6 C      5   6 C                                 1.3767742
     4   6 C      5   6 C                                 1.4379911
     5   6 C      6   6 C                                 1.4159933
     6   6 C      7   6 C                                 1.3624569
     7   6 C      9   6 C                                 1.4215360
     4   6 C     10   6 C                                 1.4151319
     9   6 C     10   6 C                                 1.3602014
    11   6 C     12   6 C                                 1.3319955
     1   6 C     13   1 H                                 1.0717042 (min)
     6   6 C     14   1 H                                 1.0805534
     8   6 C     15   1 H                                 1.0869764
     8   6 C     16   1 H                                 1.0898243
     8   6 C     17   1 H                                 1.0895065
     9   6 C     18   1 H                                 1.0807458
    10   6 C     19   1 H                                 1.0779658
    11   6 C     20   1 H                                 1.0845972
    12   6 C     21   1 H                                 1.0756817
    12   6 C     22   1 H                                 1.0759297

 * 3 distinct bonds (by element types)

   Z      Z             #   av. dist./Å        max./Å        min./Å
   1 H    6 C          10     1.0813485     1.0898243     1.0717042
   6 C    6 C           9     1.3904751     1.4379911     1.3319955
   6 C   16 S           2     1.7188917     1.7341004     1.7036830


optimized geometry written to: xtbopt.xyz


           -------------------------------------------------
          | TOTAL ENERGY              -31.855969036278 Eh   |
          | GRADIENT NORM               0.000936975380 Eh/α |
          | HOMO-LUMO GAP               2.067991899371 eV   |
           -------------------------------------------------

------------------------------------------------------------------------
 * finished run on 2021/05/19 at 11:00:50.161     
------------------------------------------------------------------------
 total:
 * wall-time:     0 d,  0 h,  0 min,  0.462 sec
 *  cpu-time:     0 d,  0 h,  0 min,  0.462 sec
 * ratio c/w:     0.998 speedup
 SCF:
 * wall-time:     0 d,  0 h,  0 min,  0.035 sec
 *  cpu-time:     0 d,  0 h,  0 min,  0.035 sec
 * ratio c/w:     1.000 speedup
 ANC optimizer:
 * wall-time:     0 d,  0 h,  0 min,  0.406 sec
 *  cpu-time:     0 d,  0 h,  0 min,  0.406 sec
 * ratio c/w:     1.000 speedup

