      -----------------------------------------------------------      
     |                   =====================                   |     
     |                           x T B                           |     
     |                   =====================                   |     
     |                         S. Grimme                         |     
     |          Mulliken Center for Theoretical Chemistry        |     
     |                    University of Bonn                     |     
     |                Version 6.2 RC2 (SAW190805)                |     
      -----------------------------------------------------------      

   This program is distributed in the hope that it will be useful,
   but WITHOUT ANY WARRANTY; without even the implied warranty of
   MERCHANTABILITY or FITNESS FOR A PARTICULAR PURPOSE.
   
   FOR NON-COMMERCIAL, ACADEMIA USE ONLY.
   
   Cite this work as:
   * S. Grimme, C. Bannwarth, P. Shushkov, J. Chem. Theory Comput., 2017,
     13, 1989-2009. DOI: 10.1021/acs.jctc.7b00118
   * C. Bannwarth, S. Ehlert and S. Grimme., J. Chem. Theory Comput., 2019,
     15, 1652-1671. DOI: 10.1021/acs.jctc.8b01176
   * P. Pracht, E. Caldeweyher, S. Ehlert, S. Grimme, ChemRxiv, 2019, preprint.
     DOI: 10.26434/chemrxiv.8326202.v1
   
   for DFT-D4:
   * E. Caldeweyher, C. Bannwarth and S. Grimme, J. Chem. Phys., 2017,
     147, 034112. DOI: 10.1063/1.4993215
   * E. Caldeweyher, S. Ehlert, A. Hansen, H. Neugebauer, S. Spicher,
     C. Bannwarth and S. Grimme, J. Chem. Phys., 2019, 150, 154122.
     DOI: 10.1063/1.5090222
   
   for sTDA-xTB:
   * S. Grimme and C. Bannwarth, J. Chem. Phys., 2016, 145, 054103.
     DOI: 10.1063/1.4959605
   
   in the mass-spec context:
   * V. Asgeirsson, C. Bauer and S. Grimme, Chem. Sci., 2017, 8, 4879.
     DOI: 10.1039/c7sc00601b
   
   for metadynamics refer to:
   * S. Grimme, J. Chem. Theory Comput., 2019, 155, 2847-2862
     DOI: 10.1021/acs.jctc.9b00143
   
   with help from (in alphabetical order)
   C. Bannwarth, F. Bohle, G. Brandenburg, E. Caldeweyher, M. Checinski,
   S. Dohm, S. Ehlert, S. Ehrlich, F. März, H. Neugebauer, J. Pisarek,
   P. Pracht, P. Shushkov, and S. Spicher.
   
 * started run on 2021/05/19 at 11:00:50.212     

           -------------------------------------------------
          |                Calculation Setup                |
           -------------------------------------------------

          program call               : /ihome/ghutchison/geoffh/xtb/xtb 868.xyz -opt
          hostname                   : smp-n83
          coordinate file            : 868.xyz
          omp threads                :                     1
          number of atoms            :                    26
          number of electrons        :                    76
          charge                     :                     0
          spin                       :                   0.0
          first test random number   :      0.79325034396084


########################################################################
# WARNING! Please study the warnings concerning your input carefully
#  - the use of '-opt' is discouraged, please use '--opt' next time
########################################################################

           ------------------------------------------------- 
          |                 G F N 2 - x T B                 |
          | Geometry, Frequencies, Noncovalent interactions |
          |            JCTC 2019 parametrisation            |
           ------------------------------------------------- 
             KAB for C  - Si     :                1.0500
             KAB for H  - Pd     :                0.9500
             k(s)              :                1.8500
             k(p)              :                2.2300
             k(d)              :                2.2300
             k(f)              :                2.0000
             kEN (H0ij)        :               -2.0000
             D4 a1             :                0.5200
             D4 a2             :                5.0000
             D4 s6             :                1.0000
             D4 s8             :                2.7000
             D4 s9             :                5.0000
             alphaj            :                2.0000

  Z AO/shell   Hii/eV     exponent
  1     Wed Apr 25 08:07:45 CEST 2018   EN: 2.200 GM2: 0.406  GM3: 0.0800  RAES: 1.40
     1s    -10.707211    1.230000
  6     Wed Apr 25 08:07:45 CEST 2018   EN: 2.550 GM2: 0.538  GM3: 0.1500  RAES: 3.00
     2s    -13.970922    2.096432
     2p    -10.063292    1.800000
  8     Wed Apr 25 08:07:45 CEST 2018   EN: 3.440 GM2: 0.452  GM3:-0.0517  RAES: 1.80
     2s    -20.229985    2.439742
     2p    -15.503117    2.137023

           ------------------------------------------------- 
          |        Self-Consistent Charge Iterations        |
           ------------------------------------------------- 

          ...................................................
          :                      SETUP                      :
          :.................................................:
          :  # basis functions                  74          :
          :  # atomic orbitals                  74          :
          :  # shells                           42          :
          :  # electrons                        76          :
          :  max. iterations                   250          :
          :  Hamiltonian                  GFN2-xTB          :
          :  restarted?                      false          :
          :  GBSA solvation                  false          :
          :  PC potential                    false          :
          :  electronic temp.          300.0000000     K    :
          :  accuracy                    1.0000000          :
          :  -> integral cutoff          0.2500000E+02      :
          :  -> integral neglect         0.1000000E-07      :
          :  -> SCF convergence          0.1000000E-05 Eh   :
          :  -> wf. convergence          0.1000000E-03 e    :
          :  Broyden damping             0.4000000          :
          ...................................................

 iter      E             dE          RMSdq      gap      omega  full diag
   1    -41.9220666 -0.419221E+02  0.527E+00    2.23       0.0  T
   2    -41.9533703 -0.313037E-01  0.300E+00    2.05       1.0  T
   3    -41.9409729  0.123975E-01  0.127E+00    2.15       1.0  T
   4    -41.9570655 -0.160926E-01  0.317E-01    2.16       1.0  T
   5    -41.9591694 -0.210392E-02  0.129E-01    2.14       1.0  T
   6    -41.9595352 -0.365722E-03  0.461E-02    2.16       1.0  T
   7    -41.9595541 -0.189438E-04  0.234E-02    2.16       1.0  T
   8    -41.9595584 -0.430915E-05  0.100E-02    2.16       2.0  T
   9    -41.9595590 -0.579506E-06  0.292E-03    2.16       6.7  T
  10    -41.9595592 -0.182305E-06  0.114E-03    2.16      17.2  T
  11    -41.9595592 -0.352766E-08  0.611E-04    2.16      32.1  T
  12    -41.9595592 -0.309406E-08  0.202E-04    2.16      97.1  T

   *** convergence criteria satisfied after 12 iterations ***

         #    Occupation            Energy/Eh            Energy/eV
      -------------------------------------------------------------
         1        2.0000           -0.7038099             -19.1516
       ...           ...                  ...                  ...
        32        2.0000           -0.4350452             -11.8382
        33        2.0000           -0.4313628             -11.7380
        34        2.0000           -0.4206441             -11.4463
        35        2.0000           -0.4187743             -11.3954
        36        2.0000           -0.4154501             -11.3050
        37        2.0000           -0.3874315             -10.5425
        38        2.0000           -0.3855248             -10.4907 (HOMO)
        39                         -0.3060672              -8.3285 (LUMO)
        40                         -0.2644788              -7.1968
        41                         -0.2374604              -6.4616
        42                         -0.2303793              -6.2689
        43                         -0.1928506              -5.2477
       ...                                ...                  ...
        74                          0.7394458              20.1213
      -------------------------------------------------------------
                  HL-Gap            0.0794576 Eh            2.1622 eV
             Fermi-level           -0.3457960 Eh           -9.4096 eV

 SCC (total)                   0 d,  0 h,  0 min,  0.044 sec
 SCC setup                      ...        0 min,  0.000 sec (  0.793%)
 Dispersion                     ...        0 min,  0.000 sec (  1.092%)
 integral evaluation            ...        0 min,  0.011 sec ( 24.499%)
 zeroth order Hamiltonian       ...        0 min,  0.000 sec (  0.431%)
 iterations                     ...        0 min,  0.016 sec ( 37.021%)
 molecular gradient             ...        0 min,  0.016 sec ( 35.136%)
 printout                       ...        0 min,  0.000 sec (  0.904%)

         :::::::::::::::::::::::::::::::::::::::::::::::::::::
         ::                     SUMMARY                     ::
         :::::::::::::::::::::::::::::::::::::::::::::::::::::
         :: total energy             -41.237880641962 Eh    ::
         :: gradient norm              0.047486744399 Eh/a0 ::
         :: HOMO-LUMO gap              2.162152059417 eV    ::
         ::.................................................::
         :: SCC energy               -41.959559178882 Eh    ::
         :: -> isotropic ES            0.026099227020 Eh    ::
         :: -> anisotropic ES          0.001848461005 Eh    ::
         :: -> anisotropic XC          0.023883909090 Eh    ::
         :: -> dispersion             -0.028123748543 Eh    ::
         :: repulsion energy           0.721780115100 Eh    ::
         :: add. restraining           0.000000000000 Eh    ::
         :::::::::::::::::::::::::::::::::::::::::::::::::::::

      ----------------------------------------------------------- 
     |                   =====================                   |
     |                        A N C O P T                        |
     |                   =====================                   |
     |               Approximate Normal Coordinate               |
     |                Rational Function Optimizer                |
      ----------------------------------------------------------- 

          ...................................................
          :                      SETUP                      :
          :.................................................:
          :   optimization level            normal          :
          :   max. optcycles                   200          :
          :   ANC micro-cycles                  20          :
          :   degrees of freedom                72          :
          :.................................................:
          :   RF solver                   davidson          :
          :   input Hessian                  false          :
          :   write xtbopt.log                true          :
          :   linear?                        false          :
          :   energy convergence         0.5000000E-05 Eh   :
          :   grad. convergence          0.1000000E-02 Eh/α :
          :   maximium RF displ.         2.0000000          :
          :   Hlow (freq-cutoff)         0.5000000E-02      :
          :   Hmax (freq-cutoff)         5.0000000          :
          :   S6 in model hess.         20.0000000          :
          ...................................................

generating ANC from model Hessian ...
Using Lindh-Hessian (1995)
 Shifting diagonal of input Hessian by   4.060376309785123E-003
 Lowest  eigenvalues of input Hessian
   -0.000000   -0.000000   -0.000000    0.000000    0.000000    0.000000
    0.005000    0.006621    0.008240    0.009214    0.009727    0.014583
    0.015769    0.017253    0.020139    0.022706    0.024116    0.030340
 Highest eigenvalues
    1.893394    1.938944    2.002805    2.027494    2.083532    2.280101
 

........................................................................
.............................. CYCLE    1 ..............................
........................................................................
   1    -41.9595592 -0.419596E+02  0.713E-05    2.16       0.0  T
   2    -41.9595592 -0.110632E-10  0.421E-05    2.16     465.8  T
   3    -41.9595592  0.135003E-11  0.273E-05    2.16     718.1  T
     SCC iter.                  ...        0 min,  0.005 sec
     gradient                   ...        0 min,  0.015 sec
 * total energy  :   -41.2378807 Eh     change       -0.1548593E-07 Eh
   gradient norm :     0.0474863 Eh/α   predicted     0.0000000E+00 (-100.00%)
   displ. norm   :     0.1793500 α      lambda       -0.4622347E-02
   maximum displ.:     0.0765679 α      in ANC's #35, #13, #8, ...

........................................................................
.............................. CYCLE    2 ..............................
........................................................................
   1    -41.9855956 -0.419856E+02  0.108E-01    2.20       0.0  T
   2    -41.9856189 -0.232933E-04  0.686E-02    2.19       1.0  T
   3    -41.9856089  0.100452E-04  0.359E-02    2.18       1.0  T
   4    -41.9856290 -0.201809E-04  0.101E-02    2.19       1.9  T
   5    -41.9856317 -0.263174E-05  0.283E-03    2.19       6.9  T
   6    -41.9856318 -0.116477E-06  0.112E-03    2.19      17.5  T
     SCC iter.                  ...        0 min,  0.008 sec
     gradient                   ...        0 min,  0.014 sec
 * total energy  :   -41.2407886 Eh     change       -0.2907962E-02 Eh
   gradient norm :     0.0160976 Eh/α   predicted    -0.2385520E-02 ( -17.97%)
   displ. norm   :     0.1237643 α      lambda       -0.6011951E-03
   maximum displ.:     0.0645100 α      in ANC's #3, #8, #4, ...

........................................................................
.............................. CYCLE    3 ..............................
........................................................................
   1    -41.9926867 -0.419927E+02  0.727E-02    2.21       0.0  T
   2    -41.9926954 -0.863707E-05  0.439E-02    2.20       1.0  T
   3    -41.9926906  0.478705E-05  0.196E-02    2.20       1.0  T
   4    -41.9926972 -0.662408E-05  0.451E-03    2.20       4.3  T
   5    -41.9926977 -0.522922E-06  0.132E-03    2.20      14.9  T
   6    -41.9926977 -0.381541E-07  0.586E-04    2.20      33.4  T
     SCC iter.                  ...        0 min,  0.008 sec
     gradient                   ...        0 min,  0.015 sec
 * total energy  :   -41.2411352 Eh     change       -0.3465371E-03 Eh
   gradient norm :     0.0040808 Eh/α   predicted    -0.3052105E-03 ( -11.93%)
   displ. norm   :     0.0926208 α      lambda       -0.1075333E-03
   maximum displ.:     0.0515360 α      in ANC's #3, #4, #2, ...

........................................................................
.............................. CYCLE    4 ..............................
........................................................................
   1    -41.9924331 -0.419924E+02  0.553E-02    2.21       0.0  T
   2    -41.9924341 -0.979645E-06  0.328E-02    2.20       1.0  T
   3    -41.9924321  0.202371E-05  0.993E-03    2.20       2.0  T
   4    -41.9924344 -0.226680E-05  0.189E-03    2.20      10.4  T
   5    -41.9924344 -0.662381E-07  0.577E-04    2.20      34.0  T
     SCC iter.                  ...        0 min,  0.007 sec
     gradient                   ...        0 min,  0.014 sec
 * total energy  :   -41.2412116 Eh     change       -0.7644341E-04 Eh
   gradient norm :     0.0026969 Eh/α   predicted    -0.5423810E-04 ( -29.05%)
   displ. norm   :     0.1414315 α      lambda       -0.1008157E-03
   maximum displ.:     0.0810794 α      in ANC's #3, #4, #2, ...

........................................................................
.............................. CYCLE    5 ..............................
........................................................................
   1    -41.9909576 -0.419910E+02  0.799E-02    2.20       0.0  T
   2    -41.9909582 -0.633311E-06  0.472E-02    2.20       1.0  T
   3    -41.9909552  0.299533E-05  0.110E-02    2.20       1.8  T
   4    -41.9909586 -0.335850E-05  0.149E-03    2.20      13.2  T
   5    -41.9909586 -0.397325E-07  0.549E-04    2.20      35.7  T
   6    -41.9909586 -0.263261E-08  0.270E-04    2.20      72.7  T
     SCC iter.                  ...        0 min,  0.008 sec
     gradient                   ...        0 min,  0.015 sec
 * total energy  :   -41.2412735 Eh     change       -0.6189451E-04 Eh
   gradient norm :     0.0040099 Eh/α   predicted    -0.5141676E-04 ( -16.93%)
   displ. norm   :     0.1056245 α      lambda       -0.5986094E-04
   maximum displ.:     0.0635291 α      in ANC's #4, #2, #3, ...

........................................................................
.............................. CYCLE    6 ..............................
........................................................................
   1    -41.9902283 -0.419902E+02  0.660E-02    2.20       0.0  T
   2    -41.9902285 -0.213425E-06  0.390E-02    2.20       1.0  T
   3    -41.9902268  0.169076E-05  0.815E-03    2.20       2.4  T
   4    -41.9902287 -0.189078E-05  0.100E-03    2.20      19.6  T
   5    -41.9902287 -0.123031E-07  0.471E-04    2.20      41.7  T
     SCC iter.                  ...        0 min,  0.007 sec
     gradient                   ...        0 min,  0.014 sec
 * total energy  :   -41.2413164 Eh     change       -0.4294729E-04 Eh
   gradient norm :     0.0036499 Eh/α   predicted    -0.3026474E-04 ( -29.53%)
   displ. norm   :     0.1312118 α      lambda       -0.6620586E-04
   maximum displ.:     0.0804155 α      in ANC's #4, #2, #3, ...

........................................................................
.............................. CYCLE    7 ..............................
........................................................................
   1    -41.9903768 -0.419904E+02  0.760E-02    2.19       0.0  T
   2    -41.9903773 -0.488123E-06  0.447E-02    2.19       1.0  T
   3    -41.9903765  0.854148E-06  0.618E-03    2.19       3.2  T
   4    -41.9903775 -0.101396E-05  0.123E-03    2.19      16.0  T
   5    -41.9903775 -0.288974E-07  0.552E-04    2.19      35.5  T
   6    -41.9903775 -0.263084E-08  0.310E-04    2.19      63.3  T
     SCC iter.                  ...        0 min,  0.008 sec
     gradient                   ...        0 min,  0.015 sec
 * total energy  :   -41.2413690 Eh     change       -0.5254349E-04 Eh
   gradient norm :     0.0027504 Eh/α   predicted    -0.3367335E-04 ( -35.91%)
   displ. norm   :     0.1845760 α      lambda       -0.7770982E-04
   maximum displ.:     0.1159717 α      in ANC's #4, #2, #3, ...

........................................................................
.............................. CYCLE    8 ..............................
........................................................................
   1    -41.9907789 -0.419908E+02  0.104E-01    2.18       0.0  T
   2    -41.9907796 -0.699805E-06  0.612E-02    2.18       1.0  T
   3    -41.9907785  0.110329E-05  0.791E-03    2.18       2.5  T
   4    -41.9907798 -0.139325E-05  0.128E-03    2.18      15.3  T
   5    -41.9907799 -0.175798E-07  0.739E-04    2.18      26.5  T
   6    -41.9907799 -0.428644E-08  0.408E-04    2.18      48.1  T
     SCC iter.                  ...        0 min,  0.008 sec
     gradient                   ...        0 min,  0.015 sec
 * total energy  :   -41.2414257 Eh     change       -0.5674851E-04 Eh
   gradient norm :     0.0027820 Eh/α   predicted    -0.4017931E-04 ( -29.20%)
   displ. norm   :     0.1838457 α      lambda       -0.5676864E-04
   maximum displ.:     0.1138127 α      in ANC's #4, #2, #3, ...

........................................................................
.............................. CYCLE    9 ..............................
........................................................................
   1    -41.9911670 -0.419912E+02  0.101E-01    2.18       0.0  T
   2    -41.9911674 -0.438878E-06  0.593E-02    2.18       1.0  T
   3    -41.9911668  0.649750E-06  0.594E-03    2.18       3.3  T
   4    -41.9911677 -0.900721E-06  0.939E-04    2.18      20.9  T
   5    -41.9911677 -0.258960E-08  0.587E-04    2.18      33.4  T
     SCC iter.                  ...        0 min,  0.007 sec
     gradient                   ...        0 min,  0.015 sec
 * total energy  :   -41.2414645 Eh     change       -0.3880186E-04 Eh
   gradient norm :     0.0027697 Eh/α   predicted    -0.2934543E-04 ( -24.37%)
   displ. norm   :     0.1352390 α      lambda       -0.3577903E-04
   maximum displ.:     0.0858627 α      in ANC's #2, #4, #1, ...

........................................................................
.............................. CYCLE   10 ..............................
........................................................................
   1    -41.9916574 -0.419917E+02  0.721E-02    2.18       0.0  T
   2    -41.9916576 -0.205854E-06  0.425E-02    2.18       1.0  T
   3    -41.9916572  0.452845E-06  0.475E-03    2.18       4.1  T
   4    -41.9916578 -0.577955E-06  0.684E-04    2.18      28.7  T
   5    -41.9916578 -0.368522E-08  0.408E-04    2.18      48.0  T
     SCC iter.                  ...        0 min,  0.007 sec
     gradient                   ...        0 min,  0.015 sec
 * total energy  :   -41.2414897 Eh     change       -0.2518796E-04 Eh
   gradient norm :     0.0017666 Eh/α   predicted    -0.1821733E-04 ( -27.67%)
   displ. norm   :     0.2664649 α      lambda       -0.3054758E-04
   maximum displ.:     0.1758782 α      in ANC's #2, #4, #1, ...

........................................................................
.............................. CYCLE   11 ..............................
........................................................................
   1    -41.9902381 -0.419902E+02  0.137E-01    2.18       0.0  T
   2    -41.9902389 -0.868683E-06  0.807E-02    2.18       1.0  T
   3    -41.9902374  0.155441E-05  0.935E-03    2.18       2.1  T
   4    -41.9902393 -0.197473E-05  0.154E-03    2.18      12.7  T
   5    -41.9902394 -0.265991E-07  0.665E-04    2.18      29.5  T
   6    -41.9902394 -0.674973E-09  0.354E-04    2.18      55.4  T
     SCC iter.                  ...        0 min,  0.008 sec
     gradient                   ...        0 min,  0.015 sec
 * total energy  :   -41.2415018 Eh     change       -0.1204121E-04 Eh
   gradient norm :     0.0039341 Eh/α   predicted    -0.1575664E-04 (  30.86%)
   displ. norm   :     0.0687485 α      lambda       -0.5530004E-04
   maximum displ.:     0.0489563 α      in ANC's #1, #3, #2, ...

........................................................................
.............................. CYCLE   12 ..............................
........................................................................
   1    -41.9920528 -0.419921E+02  0.310E-02    2.19       0.0  T
   2    -41.9920532 -0.350730E-06  0.182E-02    2.18       1.1  T
   3    -41.9920527  0.487724E-06  0.541E-03    2.18       3.6  T
   4    -41.9920532 -0.563935E-06  0.937E-04    2.18      20.9  T
   5    -41.9920532 -0.136998E-07  0.494E-04    2.18      39.7  T
     SCC iter.                  ...        0 min,  0.007 sec
     gradient                   ...        0 min,  0.015 sec
 * total energy  :   -41.2415209 Eh     change       -0.1914476E-04 Eh
   gradient norm :     0.0035172 Eh/α   predicted    -0.2778148E-04 (  45.11%)
   displ. norm   :     0.0486498 α      lambda       -0.2747979E-04
   maximum displ.:     0.0287886 α      in ANC's #2, #1, #4, ...

........................................................................
.............................. CYCLE   13 ..............................
........................................................................
   1    -41.9915866 -0.419916E+02  0.255E-02    2.18       0.0  T
   2    -41.9915867 -0.115978E-06  0.150E-02    2.18       1.3  T
   3    -41.9915859  0.746070E-06  0.633E-03    2.18       3.1  T
   4    -41.9915868 -0.842698E-06  0.679E-04    2.18      28.9  T
   5    -41.9915868 -0.354134E-08  0.400E-04    2.18      49.1  T
     SCC iter.                  ...        0 min,  0.007 sec
     gradient                   ...        0 min,  0.015 sec
 * total energy  :   -41.2415353 Eh     change       -0.1441743E-04 Eh
   gradient norm :     0.0018745 Eh/α   predicted    -0.1377708E-04 (  -4.44%)
   displ. norm   :     0.0884372 α      lambda       -0.1205021E-04
   maximum displ.:     0.0542688 α      in ANC's #2, #1, #4, ...

........................................................................
.............................. CYCLE   14 ..............................
........................................................................
   1    -41.9911886 -0.419912E+02  0.439E-02    2.18       0.0  T
   2    -41.9911888 -0.227392E-06  0.259E-02    2.18       1.0  T
   3    -41.9911883  0.490730E-06  0.427E-03    2.18       4.6  T
   4    -41.9911889 -0.568431E-06  0.911E-04    2.18      21.5  T
   5    -41.9911889 -0.165691E-07  0.388E-04    2.18      50.6  T
     SCC iter.                  ...        0 min,  0.007 sec
     gradient                   ...        0 min,  0.015 sec
 * total energy  :   -41.2415461 Eh     change       -0.1072950E-04 Eh
   gradient norm :     0.0011191 Eh/α   predicted    -0.6046432E-05 ( -43.65%)
   displ. norm   :     0.0831656 α      lambda       -0.7084925E-05
   maximum displ.:     0.0583433 α      in ANC's #1, #2, #4, ...

........................................................................
.............................. CYCLE   15 ..............................
........................................................................
   1    -41.9914165 -0.419914E+02  0.418E-02    2.18       0.0  T
   2    -41.9914166 -0.949374E-07  0.246E-02    2.18       1.0  T
   3    -41.9914164  0.151145E-06  0.290E-03    2.18       6.8  T
   4    -41.9914166 -0.200467E-06  0.555E-04    2.18      35.3  T
   5    -41.9914166 -0.262857E-08  0.345E-04    2.18      56.8  T
     SCC iter.                  ...        0 min,  0.007 sec
     gradient                   ...        0 min,  0.015 sec
 * total energy  :   -41.2415535 Eh     change       -0.7435418E-05 Eh
   gradient norm :     0.0014457 Eh/α   predicted    -0.3557799E-05 ( -52.15%)
   displ. norm   :     0.0824841 α      lambda        0.1676063E-05
   maximum displ.:     0.0573674 α      in ANC's #1, #2, #4, ...

........................................................................
.............................. CYCLE   16 ..............................
........................................................................
   1    -41.9915100 -0.419915E+02  0.414E-02    2.17       0.0  T
   2    -41.9915101 -0.938725E-07  0.244E-02    2.17       1.0  T
   3    -41.9915100  0.129277E-06  0.262E-03    2.18       7.5  T
   4    -41.9915102 -0.176774E-06  0.542E-04    2.17      36.2  T
   5    -41.9915102 -0.248116E-08  0.337E-04    2.17      58.2  T
     SCC iter.                  ...        0 min,  0.007 sec
     gradient                   ...        0 min,  0.016 sec
 * total energy  :   -41.2415538 Eh     change       -0.3232520E-06 Eh
   gradient norm :     0.0028173 Eh/α   predicted     0.8384457E-06 (-359.38%)
   displ. norm   :     0.0304696 α      lambda       -0.8815956E-05
   maximum displ.:     0.0242347 α      in ANC's #1, #2, #5, ...

........................................................................
.............................. CYCLE   17 ..............................
........................................................................
   1    -41.9919439 -0.419919E+02  0.128E-02    2.18       0.0  T
   2    -41.9919440 -0.311181E-07  0.755E-03    2.18       2.6  T
   3    -41.9919439  0.589588E-07  0.187E-03    2.18      10.5  T
   4    -41.9919440 -0.682330E-07  0.362E-04    2.18      54.1  T
   5    -41.9919440 -0.180798E-08  0.157E-04    2.18     125.0  T
     SCC iter.                  ...        0 min,  0.007 sec
     gradient                   ...        0 min,  0.015 sec
 * total energy  :   -41.2415588 Eh     change       -0.5000260E-05 Eh
   gradient norm :     0.0013209 Eh/α   predicted    -0.4413985E-05 ( -11.72%)
   displ. norm   :     0.1137097 α      lambda       -0.1000266E-04
   maximum displ.:     0.0690087 α      in ANC's #1, #2, #4, ...

........................................................................
.............................. CYCLE   18 ..............................
........................................................................
   1    -41.9912926 -0.419913E+02  0.545E-02    2.18       0.0  T
   2    -41.9912928 -0.216760E-06  0.321E-02    2.18       1.0  T
   3    -41.9912919  0.899553E-06  0.690E-03    2.18       2.8  T
   4    -41.9912929 -0.105021E-05  0.899E-04    2.18      21.8  T
   5    -41.9912929 -0.777671E-08  0.550E-04    2.18      35.7  T
   6    -41.9912929 -0.131374E-08  0.259E-04    2.18      75.7  T
     SCC iter.                  ...        0 min,  0.008 sec
     gradient                   ...        0 min,  0.016 sec
 * total energy  :   -41.2415656 Eh     change       -0.6829865E-05 Eh
   gradient norm :     0.0012424 Eh/α   predicted    -0.5036449E-05 ( -26.26%)
   displ. norm   :     0.0406137 α      lambda       -0.4872163E-05
   maximum displ.:     0.0349039 α      in ANC's #1, #3, #4, ...

........................................................................
.............................. CYCLE   19 ..............................
........................................................................
   1    -41.9915934 -0.419916E+02  0.184E-02    2.18       0.0  T
   2    -41.9915934 -0.326029E-07  0.109E-02    2.18       1.8  T
   3    -41.9915933  0.114469E-06  0.244E-03    2.18       8.0  T
   4    -41.9915935 -0.136566E-06  0.432E-04    2.18      45.4  T
   5    -41.9915935 -0.137619E-08  0.272E-04    2.18      72.1  T
     SCC iter.                  ...        0 min,  0.007 sec
     gradient                   ...        0 min,  0.015 sec
 * total energy  :   -41.2415712 Eh     change       -0.5523284E-05 Eh
   gradient norm :     0.0005680 Eh/α   predicted    -0.2438517E-05 ( -55.85%)
   displ. norm   :     0.0759583 α      lambda       -0.4986543E-05
   maximum displ.:     0.0584837 α      in ANC's #1, #3, #4, ...

........................................................................
.............................. CYCLE   20 ..............................
........................................................................
   1    -41.9916080 -0.419916E+02  0.359E-02    2.18       0.0  T
   2    -41.9916081 -0.567464E-07  0.211E-02    2.18       1.0  T
   3    -41.9916081  0.313520E-07  0.194E-03    2.18      10.1  T
   4    -41.9916081 -0.671566E-07  0.536E-04    2.18      36.6  T
   5    -41.9916081 -0.498346E-09  0.316E-04    2.18      62.0  T
     SCC iter.                  ...        0 min,  0.007 sec
     gradient                   ...        0 min,  0.015 sec
 * total energy  :   -41.2415762 Eh     change       -0.5067075E-05 Eh
   gradient norm :     0.0006404 Eh/α   predicted    -0.2501686E-05 ( -50.63%)
   displ. norm   :     0.0802823 α      lambda       -0.3944653E-05
   maximum displ.:     0.0656103 α      in ANC's #1, #3, #4, ...
 * RMSD in coord.:     0.3675469 α      energy gain  -0.3695594E-02 Eh

generating ANC from model Hessian ...
Using Lindh-Hessian (1995)
 Shifting diagonal of input Hessian by   4.057077118958587E-003
 Lowest  eigenvalues of input Hessian
   -0.000000   -0.000000   -0.000000   -0.000000    0.000000    0.000000
    0.005000    0.006757    0.008774    0.009024    0.010140    0.014724
    0.016543    0.017880    0.021064    0.023790    0.025997    0.032235
 Highest eigenvalues
    1.933003    1.988600    2.030466    2.052633    2.106727    2.287292
 

........................................................................
.............................. CYCLE   21 ..............................
........................................................................
   1    -41.9917540 -0.419918E+02  0.373E-02    2.18       0.0  T
   2    -41.9917541 -0.552747E-07  0.219E-02    2.18       1.0  T
   3    -41.9917541  0.376492E-07  0.174E-03    2.18      11.3  T
   4    -41.9917541 -0.716390E-07  0.503E-04    2.18      39.0  T
   5    -41.9917541 -0.600686E-09  0.310E-04    2.18      63.3  T
     SCC iter.                  ...        0 min,  0.006 sec
     gradient                   ...        0 min,  0.016 sec
 * total energy  :   -41.2415800 Eh     change       -0.3740632E-05 Eh
   gradient norm :     0.0007854 Eh/α   predicted     0.0000000E+00 (-100.00%)
   displ. norm   :     0.0133748 α      lambda       -0.1184154E-05
   maximum displ.:     0.0099222 α      in ANC's #1, #4, #5, ...

   *** GEOMETRY OPTIMIZATION CONVERGED AFTER 21 ITERATIONS ***

------------------------------------------------------------------------
 total energy gain   :        -0.0036993 Eh       -2.3214 kcal/mol
 total RMSD          :         0.3675469 a0        0.1945 Å
 total power (kW/mol):        -0.4625048 (step)  -13.4288 (real)
------------------------------------------------------------------------

 ANCopt (total)                0 d,  0 h,  0 min,  0.723 sec
 optimizer setup                ...        0 min,  0.000 sec (  0.021%)
 model hessian                  ...        0 min,  0.007 sec (  0.989%)
 ANC generation                 ...        0 min,  0.002 sec (  0.213%)
 coordinate transformation      ...        0 min,  0.000 sec (  0.053%)
 single point calculation       ...        0 min,  0.706 sec ( 97.613%)
 optimization log               ...        0 min,  0.002 sec (  0.307%)
 hessian update                 ...        0 min,  0.000 sec (  0.036%)
 rational function              ...        0 min,  0.004 sec (  0.588%)

================
 final structure:
================
$coord
    6.54363239805037    0.30458608567891   -0.07612343192381      C 
    5.70647072230656    2.78331745183452   -0.12294876882569      C 
    3.13957159223709    3.35721997043950   -0.11065353801878      C 
    1.42766133657051    1.39087486181518   -0.04977279689634      C 
    2.28391985851172   -1.12719750259618   -0.00239412640140      C 
    4.82924792399406   -1.68753382760223   -0.01532200615686      C 
    0.07622245847131   -2.86373408740275    0.06090340826865      C 
    0.09047932020643   -5.14784775114037    0.11169561067115      O 
   -2.15771636982708   -1.15640020843380    0.04999783275011      C 
   -1.33361105153761    1.37262215203829   -0.01826785485063      C 
   -3.08697977433714    3.30256806091088   -0.04623455770798      C 
   -5.63600839012673    2.68099626746953    0.00025246878397      C 
   -6.47967215934881    0.18147993848394    0.07943063447448      C 
   -4.68222379603488   -1.76760639070668    0.09772513291790      C 
   -9.18921008160803   -0.30231957335870    0.13927733011415      C 
  -10.30126825403364   -2.54000423694552    0.38034360545122      C 
    8.54672900842393   -0.08472616424830   -0.08653336624548      H 
    7.06925404939745    4.30286136337810   -0.16956134404252      H 
    2.51483287763776    5.29929816273312   -0.14729379403461      H 
    5.45755790811708   -3.62797877867473    0.02189881738649      H 
   -2.50608862678040    5.25803497020597   -0.10328396762739      H 
   -7.02012820225262    4.18382350266632   -0.01997048874524      H 
   -5.24315408915904   -3.72637171344556    0.14104610348932      H 
  -10.35688105547302    1.37129114806328   -0.01871791476562      H 
   -9.26020267674075   -4.27603054320825    0.56456450727420      H 
  -12.32777260614050   -2.71189501259960    0.41073681657009      H 
$end
           -------------------------------------------------
          |                Final Singlepoint                |
           -------------------------------------------------

          ...................................................
          :                      SETUP                      :
          :.................................................:
          :  # basis functions                  74          :
          :  # atomic orbitals                  74          :
          :  # shells                           42          :
          :  # electrons                        76          :
          :  max. iterations                   250          :
          :  Hamiltonian                  GFN2-xTB          :
          :  restarted?                      false          :
          :  GBSA solvation                  false          :
          :  PC potential                    false          :
          :  electronic temp.          300.0000000     K    :
          :  accuracy                    1.0000000          :
          :  -> integral cutoff          0.2500000E+02      :
          :  -> integral neglect         0.1000000E-07      :
          :  -> SCF convergence          0.1000000E-05 Eh   :
          :  -> wf. convergence          0.1000000E-03 e    :
          :  Broyden damping             0.4000000          :
          ...................................................

 iter      E             dE          RMSdq      gap      omega  full diag
   1    -41.9917541 -0.419918E+02  0.112E-04    2.18       0.0  T
   2    -41.9917541 -0.281588E-10  0.526E-05    2.18     373.1  T
   3    -41.9917541 -0.252811E-10  0.501E-05    2.18     391.1  T

   *** convergence criteria satisfied after 3 iterations ***

         #    Occupation            Energy/Eh            Energy/eV
      -------------------------------------------------------------
         1        2.0000           -0.7058981             -19.2085
       ...           ...                  ...                  ...
        32        2.0000           -0.4344324             -11.8215
        33        2.0000           -0.4304802             -11.7140
        34        2.0000           -0.4221843             -11.4882
        35        2.0000           -0.4203659             -11.4387
        36        2.0000           -0.4169624             -11.3461
        37        2.0000           -0.3884182             -10.5694
        38        2.0000           -0.3854065             -10.4874 (HOMO)
        39                         -0.3054159              -8.3108 (LUMO)
        40                         -0.2663073              -7.2466
        41                         -0.2343038              -6.3757
        42                         -0.2298959              -6.2558
        43                         -0.1893949              -5.1537
       ...                                ...                  ...
        74                          0.7460404              20.3008
      -------------------------------------------------------------
                  HL-Gap            0.0799906 Eh            2.1767 eV
             Fermi-level           -0.3454112 Eh           -9.3991 eV

 SCC (total)                   0 d,  0 h,  0 min,  0.031 sec
 SCC setup                      ...        0 min,  0.000 sec (  0.750%)
 Dispersion                     ...        0 min,  0.000 sec (  0.848%)
 integral evaluation            ...        0 min,  0.011 sec ( 33.847%)
 zeroth order Hamiltonian       ...        0 min,  0.000 sec (  0.538%)
 iterations                     ...        0 min,  0.004 sec ( 13.990%)
 molecular gradient             ...        0 min,  0.015 sec ( 48.737%)
 printout                       ...        0 min,  0.000 sec (  1.137%)

         :::::::::::::::::::::::::::::::::::::::::::::::::::::
         ::                     SUMMARY                     ::
         :::::::::::::::::::::::::::::::::::::::::::::::::::::
         :: total energy             -41.241579974002 Eh    ::
         :: gradient norm              0.000784547038 Eh/a0 ::
         :: HOMO-LUMO gap              2.176655686820 eV    ::
         ::.................................................::
         :: SCC energy               -41.991754131489 Eh    ::
         :: -> isotropic ES            0.025449205998 Eh    ::
         :: -> anisotropic ES          0.002171493025 Eh    ::
         :: -> anisotropic XC          0.022647295636 Eh    ::
         :: -> dispersion             -0.028182030547 Eh    ::
         :: repulsion energy           0.750282947801 Eh    ::
         :: add. restraining           0.000000000000 Eh    ::
         :::::::::::::::::::::::::::::::::::::::::::::::::::::

           -------------------------------------------------
          |                Property Printout                |
           -------------------------------------------------

    * Orbital Energies and Occupations

         #    Occupation            Energy/Eh            Energy/eV
      -------------------------------------------------------------
         1        2.0000           -0.7058981             -19.2085
       ...           ...                  ...                  ...
        26        2.0000           -0.4869320             -13.2501
        27        2.0000           -0.4745572             -12.9134
        28        2.0000           -0.4645776             -12.6418
        29        2.0000           -0.4527815             -12.3208
        30        2.0000           -0.4490375             -12.2189
        31        2.0000           -0.4383170             -11.9272
        32        2.0000           -0.4344324             -11.8215
        33        2.0000           -0.4304802             -11.7140
        34        2.0000           -0.4221843             -11.4882
        35        2.0000           -0.4203659             -11.4387
        36        2.0000           -0.4169624             -11.3461
        37        2.0000           -0.3884182             -10.5694
        38        2.0000           -0.3854065             -10.4874 (HOMO)
        39                         -0.3054159              -8.3108 (LUMO)
        40                         -0.2663073              -7.2466
        41                         -0.2343038              -6.3757
        42                         -0.2298959              -6.2558
        43                         -0.1893949              -5.1537
        44                         -0.1579295              -4.2975
        45                         -0.0881560              -2.3988
        46                         -0.0700345              -1.9057
        47                          0.0687960               1.8720
        48                          0.0857999               2.3347
        49                          0.1068377               2.9072
       ...                                ...                  ...
        74                          0.7460404              20.3008
      -------------------------------------------------------------
                  HL-Gap            0.0799906 Eh            2.1767 eV
             Fermi-level           -0.3454112 Eh           -9.3991 eV

     #   Z        covCN         q      C6AA      α(0)
     1   6 C      2.921    -0.029    28.723     8.789
     2   6 C      2.922    -0.023    28.573     8.766
     3   6 C      2.913    -0.030    28.738     8.791
     4   6 C      3.039     0.008    27.811     8.650
     5   6 C      3.045    -0.025    28.574     8.767
     6   6 C      2.913    -0.015    28.375     8.735
     7   6 C      2.866     0.230    23.177     7.891
     8   8 O      0.856    -0.352    20.752     6.108
     9   6 C      3.042    -0.026    28.611     8.773
    10   6 C      3.040     0.004    27.889     8.662
    11   6 C      2.911    -0.030    28.757     8.793
    12   6 C      2.930    -0.030    28.743     8.792
    13   6 C      2.971     0.017    27.635     8.623
    14   6 C      2.917    -0.019    28.476     8.751
    15   6 C      2.896    -0.030    28.748     8.791
    16   6 C      2.837    -0.083    30.058     8.985
    17   1 H      0.926     0.040     2.444     2.445
    18   1 H      0.926     0.040     2.455     2.450
    19   1 H      0.926     0.038     2.474     2.460
    20   1 H      0.926     0.053     2.281     2.362
    21   1 H      0.926     0.038     2.481     2.463
    22   1 H      0.925     0.039     2.457     2.451
    23   1 H      0.926     0.057     2.230     2.335
    24   1 H      0.925     0.037     2.491     2.468
    25   1 H      0.926     0.047     2.361     2.403
    26   1 H      0.926     0.042     2.420     2.433

 Mol. C6AA /au·bohr⁶  :       9921.573625
 Mol. C8AA /au·bohr⁸  :     252232.815116
 Mol. α(0) /au        :        160.935450


Wiberg/Mayer (AO) data.
largest (>0.10) Wiberg bond orders for each atom
          total WBO             WBO to atom ...
     1  C   3.968        C    2 1.457    C    6 1.406    H   17 0.971
     2  C   3.988        C    1 1.457    C    3 1.408    H   18 0.971    C    5 0.100
     3  C   3.976        C    4 1.430    C    2 1.408    H   19 0.968
     4  C   3.987        C    3 1.430    C    5 1.300    C   10 1.060
     5  C   3.984        C    6 1.438    C    4 1.300    C    7 1.008    C    2 0.100
     6  C   3.987        C    5 1.438    C    1 1.406    H   20 0.967
     7  C   3.927        O    8 1.811    C    5 1.008    C    9 1.005
     8  O   2.082        C    7 1.811
     9  C   3.987        C   14 1.462    C   10 1.290    C    7 1.005
    10  C   3.988        C   11 1.424    C    9 1.290    C    4 1.060
    11  C   3.980        C   10 1.424    C   12 1.424    H   21 0.968
    12  C   3.988        C   11 1.424    C   13 1.391    H   22 0.968
    13  C   3.970        C   12 1.391    C   14 1.337    C   15 1.097
    14  C   3.986        C    9 1.462    C   13 1.337    H   23 0.962
    15  C   3.990        C   16 1.894    C   13 1.097    H   24 0.964
    16  C   3.979        C   15 1.894    H   26 0.978    H   25 0.972
    17  H   0.998        C    1 0.971
    18  H   0.998        C    2 0.971
    19  H   0.998        C    3 0.968
    20  H   0.997        C    6 0.967
    21  H   0.998        C   11 0.968
    22  H   0.998        C   12 0.968
    23  H   0.996        C   14 0.962
    24  H   0.998        C   15 0.964
    25  H   0.998        C   16 0.972
    26  H   0.998        C   16 0.978

molecular dipole:
                 x           y           z       tot (Debye)
 q only:       -0.119       1.218      -0.021
   full:       -0.103       1.406      -0.024       3.584
molecular quadrupole (traceless):
                xx          xy          yy          xz          yz          zz
 q only:       11.238       1.022      -7.818      -0.245      -0.008      -3.420
  q+dip:       15.620       0.813      -4.702      -0.381      -0.455     -10.918
   full:       12.409       0.798      -8.437      -0.265      -0.077      -3.971

           -------------------------------------------------
          |                Geometry Summary                 |
           -------------------------------------------------

      molecular mass/u    :      206.2434000
   center of mass at/Å    :       -0.6373113      -0.0747600       0.0174043
  moments of inertia/u·Å² :        0.3652904E+03   0.1499128E+04   0.1864155E+04
rotational constants/cm⁻¹ :        0.4614857E-01   0.1124496E-01   0.9043042E-02

 * 24 selected distances

     #   Z        #   Z                                     value/Å
     1   6 C      2   6 C                                 1.3847004
     2   6 C      3   6 C                                 1.3918958
     3   6 C      4   6 C                                 1.3800123
     4   6 C      5   6 C                                 1.4076624
     1   6 C      6   6 C                                 1.3911780
     5   6 C      6   6 C                                 1.3791987
     7   6 C      8   8 O                                 1.2090234
     9   6 C     10   6 C                                 1.4080256 (max)
    10   6 C     11   6 C                                 1.3799027
    11   6 C     12   6 C                                 1.3886300
    12   6 C     13   6 C                                 1.3966290
     9   6 C     14   6 C                                 1.3747398
    13   6 C     14   6 C                                 1.4030776
    15   6 C     16   6 C                                 1.3284372
     1   6 C     17   1 H                                 1.0798417
     2   6 C     18   1 H                                 1.0803987
     3   6 C     19   1 H                                 1.0797432
     6   6 C     20   1 H                                 1.0795068
    11   6 C     21   1 H                                 1.0799029
    12   6 C     22   1 H                                 1.0812176
    14   6 C     23   1 H                                 1.0784421
    15   6 C     24   1 H                                 1.0831201
    16   6 C     25   1 H                                 1.0756160 (min)
    16   6 C     26   1 H                                 1.0763510

 * 3 distinct bonds (by element types)

   Z      Z             #   av. dist./Å        max./Å        min./Å
   1 H    6 C          10     1.0794140     1.0831201     1.0756160
   6 C    6 C          13     1.3856992     1.4080256     1.3284372
   6 C    8 O           1     1.2090234     1.2090234     1.2090234


optimized geometry written to: xtbopt.xyz


           -------------------------------------------------
          | TOTAL ENERGY              -41.241579974002 Eh   |
          | GRADIENT NORM               0.000784547038 Eh/α |
          | HOMO-LUMO GAP               2.176655686820 eV   |
           -------------------------------------------------

------------------------------------------------------------------------
 * finished run on 2021/05/19 at 11:00:51.036     
------------------------------------------------------------------------
 total:
 * wall-time:     0 d,  0 h,  0 min,  0.824 sec
 *  cpu-time:     0 d,  0 h,  0 min,  0.823 sec
 * ratio c/w:     0.999 speedup
 SCF:
 * wall-time:     0 d,  0 h,  0 min,  0.044 sec
 *  cpu-time:     0 d,  0 h,  0 min,  0.044 sec
 * ratio c/w:     1.000 speedup
 ANC optimizer:
 * wall-time:     0 d,  0 h,  0 min,  0.755 sec
 *  cpu-time:     0 d,  0 h,  0 min,  0.755 sec
 * ratio c/w:     1.000 speedup

