      -----------------------------------------------------------      
     |                   =====================                   |     
     |                           x T B                           |     
     |                   =====================                   |     
     |                         S. Grimme                         |     
     |          Mulliken Center for Theoretical Chemistry        |     
     |                    University of Bonn                     |     
     |                Version 6.2 RC2 (SAW190805)                |     
      -----------------------------------------------------------      

   This program is distributed in the hope that it will be useful,
   but WITHOUT ANY WARRANTY; without even the implied warranty of
   MERCHANTABILITY or FITNESS FOR A PARTICULAR PURPOSE.
   
   FOR NON-COMMERCIAL, ACADEMIA USE ONLY.
   
   Cite this work as:
   * S. Grimme, C. Bannwarth, P. Shushkov, J. Chem. Theory Comput., 2017,
     13, 1989-2009. DOI: 10.1021/acs.jctc.7b00118
   * C. Bannwarth, S. Ehlert and S. Grimme., J. Chem. Theory Comput., 2019,
     15, 1652-1671. DOI: 10.1021/acs.jctc.8b01176
   * P. Pracht, E. Caldeweyher, S. Ehlert, S. Grimme, ChemRxiv, 2019, preprint.
     DOI: 10.26434/chemrxiv.8326202.v1
   
   for DFT-D4:
   * E. Caldeweyher, C. Bannwarth and S. Grimme, J. Chem. Phys., 2017,
     147, 034112. DOI: 10.1063/1.4993215
   * E. Caldeweyher, S. Ehlert, A. Hansen, H. Neugebauer, S. Spicher,
     C. Bannwarth and S. Grimme, J. Chem. Phys., 2019, 150, 154122.
     DOI: 10.1063/1.5090222
   
   for sTDA-xTB:
   * S. Grimme and C. Bannwarth, J. Chem. Phys., 2016, 145, 054103.
     DOI: 10.1063/1.4959605
   
   in the mass-spec context:
   * V. Asgeirsson, C. Bauer and S. Grimme, Chem. Sci., 2017, 8, 4879.
     DOI: 10.1039/c7sc00601b
   
   for metadynamics refer to:
   * S. Grimme, J. Chem. Theory Comput., 2019, 155, 2847-2862
     DOI: 10.1021/acs.jctc.9b00143
   
   with help from (in alphabetical order)
   C. Bannwarth, F. Bohle, G. Brandenburg, E. Caldeweyher, M. Checinski,
   S. Dohm, S. Ehlert, S. Ehrlich, F. März, H. Neugebauer, J. Pisarek,
   P. Pracht, P. Shushkov, and S. Spicher.
   
 * started run on 2021/05/19 at 10:58:53.040     

           -------------------------------------------------
          |                Calculation Setup                |
           -------------------------------------------------

          program call               : /ihome/ghutchison/geoffh/xtb/xtb 87.xyz -opt
          hostname                   : smp-n58
          coordinate file            : 87.xyz
          omp threads                :                     1
          number of atoms            :                    21
          number of electrons        :                    68
          charge                     :                     0
          spin                       :                   0.0
          first test random number   :      0.23099216010158


########################################################################
# WARNING! Please study the warnings concerning your input carefully
#  - the use of '-opt' is discouraged, please use '--opt' next time
########################################################################

           ------------------------------------------------- 
          |                 G F N 2 - x T B                 |
          | Geometry, Frequencies, Noncovalent interactions |
          |            JCTC 2019 parametrisation            |
           ------------------------------------------------- 
             KAB for C  - Si     :                1.0500
             KAB for H  - Pd     :                0.9500
             k(s)              :                1.8500
             k(p)              :                2.2300
             k(d)              :                2.2300
             k(f)              :                2.0000
             kEN (H0ij)        :               -2.0000
             D4 a1             :                0.5200
             D4 a2             :                5.0000
             D4 s6             :                1.0000
             D4 s8             :                2.7000
             D4 s9             :                5.0000
             alphaj            :                2.0000

  Z AO/shell   Hii/eV     exponent
  1     Wed Apr 25 08:07:45 CEST 2018   EN: 2.200 GM2: 0.406  GM3: 0.0800  RAES: 1.40
     1s    -10.707211    1.230000
  6     Wed Apr 25 08:07:45 CEST 2018   EN: 2.550 GM2: 0.538  GM3: 0.1500  RAES: 3.00
     2s    -13.970922    2.096432
     2p    -10.063292    1.800000
  8     Wed Apr 25 08:07:45 CEST 2018   EN: 3.440 GM2: 0.452  GM3:-0.0517  RAES: 1.80
     2s    -20.229985    2.439742
     2p    -15.503117    2.137023
 16     Tue Apr 24 11:44:34 CEST 2018   EN: 2.580 GM2: 0.340  GM3:-0.0502  RAES: 3.10
     3s    -20.029654    1.981333
     3p    -11.377694    2.025643
     3d     -0.420282    1.702555

           ------------------------------------------------- 
          |        Self-Consistent Charge Iterations        |
           ------------------------------------------------- 

          ...................................................
          :                      SETUP                      :
          :.................................................:
          :  # basis functions                  72          :
          :  # atomic orbitals                  70          :
          :  # shells                           36          :
          :  # electrons                        68          :
          :  max. iterations                   250          :
          :  Hamiltonian                  GFN2-xTB          :
          :  restarted?                      false          :
          :  GBSA solvation                  false          :
          :  PC potential                    false          :
          :  electronic temp.          300.0000000     K    :
          :  accuracy                    1.0000000          :
          :  -> integral cutoff          0.2500000E+02      :
          :  -> integral neglect         0.1000000E-07      :
          :  -> SCF convergence          0.1000000E-05 Eh   :
          :  -> wf. convergence          0.1000000E-03 e    :
          :  Broyden damping             0.4000000          :
          ...................................................

 iter      E             dE          RMSdq      gap      omega  full diag
   1    -38.2763754 -0.382764E+02  0.522E+00    2.97       0.0  T
   2    -38.3197957 -0.434203E-01  0.280E+00    2.14       1.0  T
   3    -38.3114269  0.836875E-02  0.166E+00    2.33       1.0  T
   4    -38.3332675 -0.218405E-01  0.463E-01    1.94       1.0  T
   5    -38.3344976 -0.123018E-02  0.237E-01    1.93       1.0  T
   6    -38.3348998 -0.402194E-03  0.795E-02    2.00       1.0  T
   7    -38.3349296 -0.297345E-04  0.318E-02    1.98       1.0  T
   8    -38.3349377 -0.817308E-05  0.184E-02    1.98       1.2  T
   9    -38.3349396 -0.185065E-05  0.845E-03    1.98       2.6  T
  10    -38.3349398 -0.171767E-06  0.269E-03    1.98       8.1  T
  11    -38.3349398 -0.159078E-07  0.170E-03    1.98      12.9  T
  12    -38.3349398 -0.119624E-07  0.100E-03    1.98      21.8  T
  13    -38.3349398 -0.772739E-08  0.253E-04    1.98      86.4  T

   *** convergence criteria satisfied after 13 iterations ***

         #    Occupation            Energy/Eh            Energy/eV
      -------------------------------------------------------------
         1        2.0000           -0.7480739             -20.3561
       ...           ...                  ...                  ...
        28        2.0000           -0.4570861             -12.4379
        29        2.0000           -0.4482525             -12.1976
        30        2.0000           -0.4363837             -11.8746
        31        2.0000           -0.4261376             -11.5958
        32        2.0000           -0.4151744             -11.2975
        33        2.0000           -0.3907181             -10.6320
        34        2.0000           -0.3746535             -10.1948 (HOMO)
        35                         -0.3018438              -8.2136 (LUMO)
        36                         -0.2787073              -7.5840
        37                         -0.2370280              -6.4499
        38                         -0.2234751              -6.0811
        39                         -0.1948958              -5.3034
       ...                                ...                  ...
        70                          0.6662775              18.1303
      -------------------------------------------------------------
                  HL-Gap            0.0728097 Eh            1.9813 eV
             Fermi-level           -0.3382487 Eh           -9.2042 eV

 SCC (total)                   0 d,  0 h,  0 min,  0.038 sec
 SCC setup                      ...        0 min,  0.000 sec (  0.715%)
 Dispersion                     ...        0 min,  0.000 sec (  0.841%)
 integral evaluation            ...        0 min,  0.009 sec ( 24.624%)
 zeroth order Hamiltonian       ...        0 min,  0.000 sec (  0.446%)
 iterations                     ...        0 min,  0.015 sec ( 38.478%)
 molecular gradient             ...        0 min,  0.013 sec ( 33.975%)
 printout                       ...        0 min,  0.000 sec (  0.802%)

         :::::::::::::::::::::::::::::::::::::::::::::::::::::
         ::                     SUMMARY                     ::
         :::::::::::::::::::::::::::::::::::::::::::::::::::::
         :: total energy             -37.903583917168 Eh    ::
         :: gradient norm              0.080466278991 Eh/a0 ::
         :: HOMO-LUMO gap              1.981252467622 eV    ::
         ::.................................................::
         :: SCC energy               -38.334939788119 Eh    ::
         :: -> isotropic ES            0.040237443406 Eh    ::
         :: -> anisotropic ES          0.002411623763 Eh    ::
         :: -> anisotropic XC          0.013452812339 Eh    ::
         :: -> dispersion             -0.024555392988 Eh    ::
         :: repulsion energy           0.431160914504 Eh    ::
         :: add. restraining           0.000000000000 Eh    ::
         :::::::::::::::::::::::::::::::::::::::::::::::::::::

      ----------------------------------------------------------- 
     |                   =====================                   |
     |                        A N C O P T                        |
     |                   =====================                   |
     |               Approximate Normal Coordinate               |
     |                Rational Function Optimizer                |
      ----------------------------------------------------------- 

          ...................................................
          :                      SETUP                      :
          :.................................................:
          :   optimization level            normal          :
          :   max. optcycles                   200          :
          :   ANC micro-cycles                  20          :
          :   degrees of freedom                57          :
          :.................................................:
          :   RF solver                   davidson          :
          :   input Hessian                  false          :
          :   write xtbopt.log                true          :
          :   linear?                        false          :
          :   energy convergence         0.5000000E-05 Eh   :
          :   grad. convergence          0.1000000E-02 Eh/α :
          :   maximium RF displ.         2.0000000          :
          :   Hlow (freq-cutoff)         0.5000000E-02      :
          :   Hmax (freq-cutoff)         5.0000000          :
          :   S6 in model hess.         20.0000000          :
          ...................................................

generating ANC from model Hessian ...
Using Lindh-Hessian (1995)
 Shifting diagonal of input Hessian by   3.468447851703280E-003
 Lowest  eigenvalues of input Hessian
   -0.000000    0.000000    0.000000    0.000000    0.000000    0.000000
    0.005000    0.006699    0.007940    0.009618    0.012379    0.016517
    0.018003    0.025495    0.029992    0.033273    0.041495    0.044018
 Highest eigenvalues
    1.570161    1.755519    1.812240    1.990291    1.996477    2.011894
 

........................................................................
.............................. CYCLE    1 ..............................
........................................................................
   1    -38.3349398 -0.383349E+02  0.117E-04    1.98       0.0  T
   2    -38.3349398 -0.538094E-10  0.776E-05    1.98     281.3  T
   3    -38.3349398 -0.231424E-10  0.530E-05    1.98     412.1  T
     SCC iter.                  ...        0 min,  0.004 sec
     gradient                   ...        0 min,  0.014 sec
 * total energy  :   -37.9035839 Eh     change       -0.1859195E-07 Eh
   gradient norm :     0.0804652 Eh/α   predicted     0.0000000E+00 (-100.00%)
   displ. norm   :     0.2367464 α      lambda       -0.7928872E-02
   maximum displ.:     0.1050300 α      in ANC's #10, #2, #28, ...

........................................................................
.............................. CYCLE    2 ..............................
........................................................................
   1    -38.3526225 -0.383526E+02  0.506E-01    2.28       0.0  T
   2    -38.3527748 -0.152327E-03  0.247E-01    2.21       1.0  T
   3    -38.3527086  0.662130E-04  0.847E-02    2.20       1.0  T
   4    -38.3528077 -0.990871E-04  0.378E-02    2.20       1.0  T
   5    -38.3528126 -0.490804E-05  0.176E-02    2.20       1.2  T
   6    -38.3528151 -0.250092E-05  0.531E-03    2.20       4.1  T
   7    -38.3528152 -0.157648E-06  0.231E-03    2.20       9.4  T
     SCC iter.                  ...        0 min,  0.008 sec
     gradient                   ...        0 min,  0.014 sec
 * total energy  :   -37.9085887 Eh     change       -0.5004796E-02 Eh
   gradient norm :     0.0250603 Eh/α   predicted    -0.4186654E-02 ( -16.35%)
   displ. norm   :     0.1783989 α      lambda       -0.1489927E-02
   maximum displ.:     0.1018321 α      in ANC's #2, #3, #5, ...

........................................................................
.............................. CYCLE    3 ..............................
........................................................................
   1    -38.3582156 -0.383582E+02  0.190E-01    2.26       0.0  T
   2    -38.3582503 -0.346776E-04  0.107E-01    2.24       1.0  T
   3    -38.3582197  0.306011E-04  0.558E-02    2.23       1.0  T
   4    -38.3582646 -0.448705E-04  0.192E-02    2.23       1.1  T
   5    -38.3582663 -0.172370E-05  0.890E-03    2.23       2.5  T
   6    -38.3582667 -0.428991E-06  0.313E-03    2.23       7.0  T
   7    -38.3582668 -0.761130E-07  0.149E-03    2.23      14.6  T
     SCC iter.                  ...        0 min,  0.008 sec
     gradient                   ...        0 min,  0.013 sec
 * total energy  :   -37.9095411 Eh     change       -0.9524156E-03 Eh
   gradient norm :     0.0097044 Eh/α   predicted    -0.7686734E-03 ( -19.29%)
   displ. norm   :     0.2046621 α      lambda       -0.5302798E-03
   maximum displ.:     0.1277500 α      in ANC's #2, #3, #1, ...

........................................................................
.............................. CYCLE    4 ..............................
........................................................................
   1    -38.3578202 -0.383578E+02  0.168E-01    2.21       0.0  T
   2    -38.3578311 -0.108641E-04  0.949E-02    2.21       1.0  T
   3    -38.3578128  0.182450E-04  0.410E-02    2.21       1.0  T
   4    -38.3578369 -0.240912E-04  0.151E-02    2.21       1.4  T
   5    -38.3578376 -0.714071E-06  0.606E-03    2.21       3.6  T
   6    -38.3578380 -0.380034E-06  0.195E-03    2.21      11.2  T
   7    -38.3578380 -0.123138E-07  0.119E-03    2.21      18.4  T
     SCC iter.                  ...        0 min,  0.007 sec
     gradient                   ...        0 min,  0.013 sec
 * total energy  :   -37.9099385 Eh     change       -0.3973257E-03 Eh
   gradient norm :     0.0058278 Eh/α   predicted    -0.2762465E-03 ( -30.47%)
   displ. norm   :     0.2903794 α      lambda       -0.4656396E-03
   maximum displ.:     0.1751574 α      in ANC's #2, #3, #1, ...

........................................................................
.............................. CYCLE    5 ..............................
........................................................................
   1    -38.3561984 -0.383562E+02  0.257E-01    2.17       0.0  T
   2    -38.3562158 -0.173945E-04  0.137E-01    2.18       1.0  T
   3    -38.3562089  0.690928E-05  0.385E-02    2.18       1.0  T
   4    -38.3562195 -0.106459E-04  0.215E-02    2.18       1.0  T
   5    -38.3562224 -0.291739E-05  0.606E-03    2.18       3.6  T
   6    -38.3562229 -0.455276E-06  0.236E-03    2.18       9.2  T
   7    -38.3562229 -0.874515E-08  0.115E-03    2.18      18.9  T
     SCC iter.                  ...        0 min,  0.007 sec
     gradient                   ...        0 min,  0.012 sec
 * total energy  :   -37.9102946 Eh     change       -0.3561382E-03 Eh
   gradient norm :     0.0077039 Eh/α   predicted    -0.2524523E-03 ( -29.11%)
   displ. norm   :     0.3369849 α      lambda       -0.4291255E-03
   maximum displ.:     0.1993963 α      in ANC's #2, #3, #6, ...

........................................................................
.............................. CYCLE    6 ..............................
........................................................................
   1    -38.3546312 -0.383546E+02  0.353E-01    2.14       0.0  T
   2    -38.3546602 -0.289609E-04  0.177E-01    2.15       1.0  T
   3    -38.3546620 -0.181855E-05  0.405E-02    2.15       1.0  T
   4    -38.3546632 -0.118243E-05  0.254E-02    2.16       1.0  T
   5    -38.3546682 -0.499007E-05  0.752E-03    2.15       2.9  T
   6    -38.3546689 -0.746528E-06  0.274E-03    2.15       8.0  T
   7    -38.3546690 -0.249512E-07  0.121E-03    2.15      18.0  T
     SCC iter.                  ...        0 min,  0.007 sec
     gradient                   ...        0 min,  0.013 sec
 * total energy  :   -37.9106278 Eh     change       -0.3331859E-03 Eh
   gradient norm :     0.0108479 Eh/α   predicted    -0.2389453E-03 ( -28.28%)
   displ. norm   :     0.3916131 α      lambda       -0.4890255E-03
   maximum displ.:     0.2352370 α      in ANC's #2, #3, #6, ...

........................................................................
.............................. CYCLE    7 ..............................
........................................................................
   1    -38.3539859 -0.383540E+02  0.487E-01    2.14       0.0  T
   2    -38.3540391 -0.531514E-04  0.232E-01    2.15       1.0  T
   3    -38.3540382  0.928492E-06  0.503E-02    2.15       1.0  T
   4    -38.3540468 -0.865433E-05  0.324E-02    2.15       1.0  T
   5    -38.3540537 -0.692442E-05  0.771E-03    2.14       2.8  T
   6    -38.3540543 -0.597897E-06  0.307E-03    2.14       7.1  T
   7    -38.3540544 -0.265967E-07  0.159E-03    2.14      13.8  T
   8    -38.3540544 -0.102789E-07  0.768E-04    2.14      28.4  T
     SCC iter.                  ...        0 min,  0.008 sec
     gradient                   ...        0 min,  0.013 sec
 * total energy  :   -37.9109859 Eh     change       -0.3581111E-03 Eh
   gradient norm :     0.0113831 Eh/α   predicted    -0.2820124E-03 ( -21.25%)
   displ. norm   :     0.3676858 α      lambda       -0.5152054E-03
   maximum displ.:     0.2173174 α      in ANC's #2, #3, #6, ...

........................................................................
.............................. CYCLE    8 ..............................
........................................................................
   1    -38.3557285 -0.383557E+02  0.562E-01    2.15       0.0  T
   2    -38.3558008 -0.722201E-04  0.261E-01    2.16       1.0  T
   3    -38.3557889  0.118459E-04  0.575E-02    2.15       1.0  T
   4    -38.3558179 -0.289466E-04  0.320E-02    2.15       1.0  T
   5    -38.3558219 -0.400495E-05  0.766E-03    2.15       2.8  T
   6    -38.3558223 -0.468298E-06  0.350E-03    2.15       6.2  T
   7    -38.3558224 -0.877218E-07  0.178E-03    2.15      12.3  T
   8    -38.3558224 -0.161638E-07  0.773E-04    2.15      28.2  T
     SCC iter.                  ...        0 min,  0.008 sec
     gradient                   ...        0 min,  0.012 sec
 * total energy  :   -37.9113331 Eh     change       -0.3472091E-03 Eh
   gradient norm :     0.0113567 Eh/α   predicted    -0.2924332E-03 ( -15.78%)
   displ. norm   :     0.2690801 α      lambda       -0.4890246E-03
   maximum displ.:     0.1724202 α      in ANC's #2, #3, #6, ...

........................................................................
.............................. CYCLE    9 ..............................
........................................................................
   1    -38.3595690 -0.383596E+02  0.465E-01    2.16       0.0  T
   2    -38.3596193 -0.503488E-04  0.212E-01    2.16       1.0  T
   3    -38.3596197 -0.301022E-06  0.378E-02    2.17       1.0  T
   4    -38.3596301 -0.104329E-04  0.227E-02    2.16       1.0  T
   5    -38.3596326 -0.253573E-05  0.435E-03    2.16       5.0  T
   6    -38.3596327 -0.106836E-06  0.229E-03    2.16       9.5  T
   7    -38.3596328 -0.405827E-07  0.115E-03    2.16      18.9  T
     SCC iter.                  ...        0 min,  0.007 sec
     gradient                   ...        0 min,  0.013 sec
 * total energy  :   -37.9116709 Eh     change       -0.3378015E-03 Eh
   gradient norm :     0.0102896 Eh/α   predicted    -0.2622241E-03 ( -22.37%)
   displ. norm   :     0.4021020 α      lambda       -0.5511874E-03
   maximum displ.:     0.2709492 α      in ANC's #2, #6, #3, ...

........................................................................
.............................. CYCLE   10 ..............................
........................................................................
   1    -38.3590389 -0.383590E+02  0.634E-01    2.18       0.0  T
   2    -38.3591361 -0.971895E-04  0.291E-01    2.18       1.0  T
   3    -38.3591549 -0.187690E-04  0.443E-02    2.18       1.0  T
   4    -38.3591478  0.705253E-05  0.290E-02    2.18       1.0  T
   5    -38.3591583 -0.104572E-04  0.542E-03    2.18       4.0  T
   6    -38.3591585 -0.173704E-06  0.293E-03    2.18       7.4  T
   7    -38.3591585 -0.390829E-07  0.136E-03    2.18      16.1  T
     SCC iter.                  ...        0 min,  0.007 sec
     gradient                   ...        0 min,  0.013 sec
 * total energy  :   -37.9120774 Eh     change       -0.4064944E-03 Eh
   gradient norm :     0.0131508 Eh/α   predicted    -0.3201546E-03 ( -21.24%)
   displ. norm   :     0.3838581 α      lambda       -0.9188872E-03
   maximum displ.:     0.2124013 α      in ANC's #2, #1, #5, ...

........................................................................
.............................. CYCLE   11 ..............................
........................................................................
   1    -38.3645253 -0.383645E+02  0.604E-01    2.21       0.0  T
   2    -38.3646214 -0.960849E-04  0.281E-01    2.20       1.0  T
   3    -38.3646357 -0.143453E-04  0.483E-02    2.20       1.0  T
   4    -38.3646335  0.225361E-05  0.332E-02    2.20       1.0  T
   5    -38.3646433 -0.984227E-05  0.812E-03    2.20       2.7  T
   6    -38.3646440 -0.673326E-06  0.273E-03    2.20       8.0  T
   7    -38.3646440  0.144434E-08  0.162E-03    2.20      13.5  T
     SCC iter.                  ...        0 min,  0.008 sec
     gradient                   ...        0 min,  0.014 sec
 * total energy  :   -37.9125263 Eh     change       -0.4489299E-03 Eh
   gradient norm :     0.0144660 Eh/α   predicted    -0.5271420E-03 (  17.42%)
   displ. norm   :     0.5552228 α      lambda       -0.8312775E-03
   maximum displ.:     0.4020387 α      in ANC's #2, #6, #5, ...

........................................................................
.............................. CYCLE   12 ..............................
........................................................................
   1    -38.3530605 -0.383531E+02  0.823E-01    2.16       0.0  T
   2    -38.3532602 -0.199678E-03  0.377E-01    2.19       1.0  T
   3    -38.3532854 -0.251718E-04  0.666E-02    2.20       1.0  T
   4    -38.3532875 -0.215167E-05  0.453E-02    2.20       1.0  T
   5    -38.3533053 -0.177971E-04  0.965E-03    2.20       2.3  T
   6    -38.3533062 -0.915815E-06  0.446E-03    2.20       4.9  T
   7    -38.3533063 -0.128765E-06  0.226E-03    2.20       9.7  T
   8    -38.3533064 -0.386844E-07  0.102E-03    2.20      21.5  T
     SCC iter.                  ...        0 min,  0.009 sec
     gradient                   ...        0 min,  0.013 sec
 * total energy  :   -37.9127110 Eh     change       -0.1846682E-03 Eh
   gradient norm :     0.0192328 Eh/α   predicted    -0.5437779E-03 ( 194.46%)
   displ. norm   :     0.2135889 α      lambda       -0.8688040E-03
   maximum displ.:     0.1078788 α      in ANC's #3, #6, #2, ...

........................................................................
.............................. CYCLE   13 ..............................
........................................................................
   1    -38.3594792 -0.383595E+02  0.284E-01    2.25       0.0  T
   2    -38.3595036 -0.243752E-04  0.137E-01    2.22       1.0  T
   3    -38.3594942  0.940638E-05  0.400E-02    2.22       1.0  T
   4    -38.3595095 -0.153295E-04  0.218E-02    2.22       1.0  T
   5    -38.3595114 -0.189973E-05  0.735E-03    2.22       3.0  T
   6    -38.3595120 -0.542289E-06  0.234E-03    2.22       9.3  T
   7    -38.3595120 -0.148859E-07  0.122E-03    2.22      17.9  T
     SCC iter.                  ...        0 min,  0.007 sec
     gradient                   ...        0 min,  0.012 sec
 * total energy  :   -37.9131847 Eh     change       -0.4736595E-03 Eh
   gradient norm :     0.0125147 Eh/α   predicted    -0.4542241E-03 (  -4.10%)
   displ. norm   :     0.2578467 α      lambda       -0.5479368E-03
   maximum displ.:     0.1701487 α      in ANC's #1, #4, #2, ...

........................................................................
.............................. CYCLE   14 ..............................
........................................................................
   1    -38.3627560 -0.383628E+02  0.301E-01    2.23       0.0  T
   2    -38.3627842 -0.281807E-04  0.146E-01    2.22       1.0  T
   3    -38.3627677  0.165648E-04  0.441E-02    2.23       1.0  T
   4    -38.3627931 -0.254522E-04  0.203E-02    2.22       1.1  T
   5    -38.3627941 -0.996051E-06  0.770E-03    2.22       2.8  T
   6    -38.3627948 -0.691917E-06  0.226E-03    2.22       9.7  T
   7    -38.3627948 -0.228487E-07  0.129E-03    2.22      17.0  T
     SCC iter.                  ...        0 min,  0.008 sec
     gradient                   ...        0 min,  0.014 sec
 * total energy  :   -37.9135974 Eh     change       -0.4127479E-03 Eh
   gradient norm :     0.0110662 Eh/α   predicted    -0.2921848E-03 ( -29.21%)
   displ. norm   :     0.5979259 α      lambda       -0.9128267E-03
   maximum displ.:     0.3603568 α      in ANC's #1, #2, #4, ...

........................................................................
.............................. CYCLE   15 ..............................
........................................................................
   1    -38.3588616 -0.383589E+02  0.709E-01    2.20       0.0  T
   2    -38.3590213 -0.159693E-03  0.339E-01    2.20       1.0  T
   3    -38.3589659  0.553732E-04  0.934E-02    2.22       1.0  T
   4    -38.3590620 -0.960577E-04  0.471E-02    2.21       1.0  T
   5    -38.3590699 -0.791038E-05  0.143E-02    2.21       1.5  T
   6    -38.3590722 -0.231402E-05  0.459E-03    2.21       4.8  T
   7    -38.3590723 -0.112049E-06  0.245E-03    2.21       8.9  T
   8    -38.3590724 -0.374919E-07  0.118E-03    2.21      18.5  T
     SCC iter.                  ...        0 min,  0.009 sec
     gradient                   ...        0 min,  0.014 sec
 * total energy  :   -37.9142666 Eh     change       -0.6691535E-03 Eh
   gradient norm :     0.0098284 Eh/α   predicted    -0.6195927E-03 (  -7.41%)
   displ. norm   :     0.4804068 α      lambda       -0.5400836E-03
   maximum displ.:     0.2929474 α      in ANC's #1, #2, #4, ...

........................................................................
.............................. CYCLE   16 ..............................
........................................................................
   1    -38.3553015 -0.383553E+02  0.542E-01    2.18       0.0  T
   2    -38.3553987 -0.972527E-04  0.263E-01    2.19       1.0  T
   3    -38.3553909  0.782477E-05  0.638E-02    2.20       1.0  T
   4    -38.3554171 -0.262047E-04  0.382E-02    2.20       1.0  T
   5    -38.3554255 -0.835491E-05  0.114E-02    2.20       1.9  T
   6    -38.3554268 -0.135862E-05  0.382E-03    2.20       5.7  T
   7    -38.3554269 -0.652113E-07  0.217E-03    2.20      10.1  T
   8    -38.3554269 -0.283590E-07  0.950E-04    2.20      23.0  T
     SCC iter.                  ...        0 min,  0.008 sec
     gradient                   ...        0 min,  0.012 sec
 * total energy  :   -37.9145769 Eh     change       -0.3103470E-03 Eh
   gradient norm :     0.0165273 Eh/α   predicted    -0.3323675E-03 (   7.10%)
   displ. norm   :     0.2593602 α      lambda       -0.7413559E-03
   maximum displ.:     0.1379366 α      in ANC's #1, #2, #4, ...

........................................................................
.............................. CYCLE   17 ..............................
........................................................................
   1    -38.3582122 -0.383582E+02  0.218E-01    2.16       0.0  T
   2    -38.3582361 -0.238841E-04  0.120E-01    2.17       1.0  T
   3    -38.3582246  0.114381E-04  0.394E-02    2.18       1.0  T
   4    -38.3582410 -0.163231E-04  0.201E-02    2.18       1.1  T
   5    -38.3582438 -0.283269E-05  0.715E-03    2.18       3.1  T
   6    -38.3582441 -0.290398E-06  0.305E-03    2.18       7.2  T
   7    -38.3582442 -0.691315E-07  0.164E-03    2.18      13.3  T
   8    -38.3582442 -0.127000E-07  0.772E-04    2.18      28.3  T
     SCC iter.                  ...        0 min,  0.008 sec
     gradient                   ...        0 min,  0.012 sec
 * total energy  :   -37.9148731 Eh     change       -0.2961845E-03 Eh
   gradient norm :     0.0214294 Eh/α   predicted    -0.3956127E-03 (  33.57%)
   displ. norm   :     0.2001591 α      lambda       -0.6525925E-03
   maximum displ.:     0.1151591 α      in ANC's #2, #5, #9, ...

........................................................................
.............................. CYCLE   18 ..............................
........................................................................
   1    -38.3607953 -0.383608E+02  0.246E-01    2.26       0.0  T
   2    -38.3608166 -0.213572E-04  0.121E-01    2.24       1.0  T
   3    -38.3608177 -0.111875E-05  0.287E-02    2.25       1.0  T
   4    -38.3608220 -0.421304E-05  0.157E-02    2.24       1.4  T
   5    -38.3608224 -0.418859E-06  0.517E-03    2.25       4.2  T
   6    -38.3608228 -0.397341E-06  0.175E-03    2.25      12.5  T
     SCC iter.                  ...        0 min,  0.006 sec
     gradient                   ...        0 min,  0.012 sec
 * total energy  :   -37.9152544 Eh     change       -0.3813043E-03 Eh
   gradient norm :     0.0105616 Eh/α   predicted    -0.3393709E-03 ( -11.00%)
   displ. norm   :     0.3597173 α      lambda       -0.3989713E-03
   maximum displ.:     0.1929023 α      in ANC's #2, #1, #5, ...

........................................................................
.............................. CYCLE   19 ..............................
........................................................................
   1    -38.3576119 -0.383576E+02  0.398E-01    2.24       0.0  T
   2    -38.3576626 -0.506545E-04  0.195E-01    2.25       1.0  T
   3    -38.3576673 -0.470752E-05  0.437E-02    2.25       1.0  T
   4    -38.3576672  0.234963E-07  0.301E-02    2.25       1.0  T
   5    -38.3576761 -0.890328E-05  0.582E-03    2.25       3.7  T
   6    -38.3576764 -0.309588E-06  0.269E-03    2.25       8.1  T
   7    -38.3576765 -0.207997E-07  0.146E-03    2.25      15.0  T
     SCC iter.                  ...        0 min,  0.007 sec
     gradient                   ...        0 min,  0.012 sec
 * total energy  :   -37.9154912 Eh     change       -0.2368018E-03 Eh
   gradient norm :     0.0140649 Eh/α   predicted    -0.2252991E-03 (  -4.86%)
   displ. norm   :     0.1996503 α      lambda       -0.5061237E-03
   maximum displ.:     0.0839280 α      in ANC's #7, #2, #1, ...

........................................................................
.............................. CYCLE   20 ..............................
........................................................................
   1    -38.3627874 -0.383628E+02  0.162E-01    2.30       0.0  T
   2    -38.3627954 -0.803553E-05  0.888E-02    2.29       1.0  T
   3    -38.3627920  0.343257E-05  0.278E-02    2.29       1.0  T
   4    -38.3627967 -0.472187E-05  0.147E-02    2.28       1.5  T
   5    -38.3627980 -0.132688E-05  0.502E-03    2.29       4.3  T
   6    -38.3627983 -0.314052E-06  0.168E-03    2.29      13.0  T
   7    -38.3627984 -0.636529E-08  0.967E-04    2.29      22.6  T
     SCC iter.                  ...        0 min,  0.007 sec
     gradient                   ...        0 min,  0.013 sec
 * total energy  :   -37.9157653 Eh     change       -0.2740852E-03 Eh
   gradient norm :     0.0099585 Eh/α   predicted    -0.2631555E-03 (  -3.99%)
   displ. norm   :     0.4151509 α      lambda       -0.4636693E-03
   maximum displ.:     0.2677680 α      in ANC's #2, #1, #9, ...
 * RMSD in coord.:     1.0245622 α      energy gain  -0.1218138E-01 Eh

generating ANC from model Hessian ...
Using Lindh-Hessian (1995)
 Shifting diagonal of input Hessian by   3.346009622692719E-003
 Lowest  eigenvalues of input Hessian
   -0.000000   -0.000000    0.000000    0.000000    0.000000    0.000000
    0.005000    0.006530    0.007730    0.009719    0.011734    0.016248
    0.018866    0.025187    0.029662    0.031665    0.038700    0.042998
 Highest eigenvalues
    1.570753    1.746553    1.827521    1.965892    2.019028    2.156253
 

........................................................................
.............................. CYCLE   21 ..............................
........................................................................
   1    -38.3580486 -0.383580E+02  0.393E-01    2.25       0.0  T
   2    -38.3581040 -0.554408E-04  0.203E-01    2.27       1.0  T
   3    -38.3581015  0.251576E-05  0.517E-02    2.27       1.0  T
   4    -38.3581096 -0.812198E-05  0.338E-02    2.27       1.0  T
   5    -38.3581191 -0.950291E-05  0.948E-03    2.27       2.3  T
   6    -38.3581199 -0.780370E-06  0.317E-03    2.27       6.9  T
   7    -38.3581199 -0.398077E-07  0.174E-03    2.27      12.5  T
   8    -38.3581200 -0.774352E-08  0.808E-04    2.27      27.0  T
   9    -38.3581200 -0.469490E-08  0.323E-04    2.27      67.6  T
     SCC iter.                  ...        0 min,  0.009 sec
     gradient                   ...        0 min,  0.013 sec
 * total energy  :   -37.9159267 Eh     change       -0.1613777E-03 Eh
   gradient norm :     0.0157130 Eh/α   predicted     0.0000000E+00 (-100.00%)
   displ. norm   :     0.1039641 α      lambda       -0.4861147E-03
   maximum displ.:     0.0478183 α      in ANC's #2, #1, #6, ...

........................................................................
.............................. CYCLE   22 ..............................
........................................................................
   1    -38.3631806 -0.383632E+02  0.120E-01    2.32       0.0  T
   2    -38.3631879 -0.730992E-05  0.605E-02    2.31       1.0  T
   3    -38.3631849  0.305373E-05  0.214E-02    2.32       1.0  T
   4    -38.3631902 -0.529140E-05  0.851E-03    2.31       2.6  T
   5    -38.3631901  0.357033E-07  0.480E-03    2.31       4.5  T
   6    -38.3631904 -0.305101E-06  0.100E-03    2.31      21.8  T
   7    -38.3631904 -0.607694E-08  0.564E-04    2.31      38.7  T
     SCC iter.                  ...        0 min,  0.007 sec
     gradient                   ...        0 min,  0.012 sec
 * total energy  :   -37.9162157 Eh     change       -0.2890699E-03 Eh
   gradient norm :     0.0052317 Eh/α   predicted    -0.2456943E-03 ( -15.01%)
   displ. norm   :     0.0794826 α      lambda       -0.1097687E-03
   maximum displ.:     0.0436589 α      in ANC's #5, #2, #1, ...

........................................................................
.............................. CYCLE   23 ..............................
........................................................................
   1    -38.3648085 -0.383648E+02  0.948E-02    2.33       0.0  T
   2    -38.3648121 -0.358078E-05  0.487E-02    2.32       1.0  T
   3    -38.3648108  0.130670E-05  0.153E-02    2.33       1.4  T
   4    -38.3648132 -0.244559E-05  0.722E-03    2.32       3.0  T
   5    -38.3648133 -0.524161E-07  0.317E-03    2.32       6.9  T
   6    -38.3648135 -0.166467E-06  0.742E-04    2.32      29.4  T
   7    -38.3648135 -0.389903E-09  0.449E-04    2.32      48.6  T
     SCC iter.                  ...        0 min,  0.008 sec
     gradient                   ...        0 min,  0.013 sec
 * total energy  :   -37.9162950 Eh     change       -0.7922306E-04 Eh
   gradient norm :     0.0029500 Eh/α   predicted    -0.5523539E-04 ( -30.28%)
   displ. norm   :     0.1614988 α      lambda       -0.1173997E-03
   maximum displ.:     0.0830588 α      in ANC's #5, #2, #1, ...

........................................................................
.............................. CYCLE   24 ..............................
........................................................................
   1    -38.3650612 -0.383651E+02  0.175E-01    2.32       0.0  T
   2    -38.3650718 -0.106108E-04  0.903E-02    2.32       1.0  T
   3    -38.3650698  0.199473E-05  0.243E-02    2.33       1.0  T
   4    -38.3650744 -0.459357E-05  0.133E-02    2.32       1.6  T
   5    -38.3650751 -0.724526E-06  0.460E-03    2.32       4.7  T
   6    -38.3650754 -0.298631E-06  0.140E-03    2.33      15.5  T
   7    -38.3650754 -0.434238E-08  0.833E-04    2.33      26.2  T
   8    -38.3650754 -0.263854E-08  0.405E-04    2.33      53.9  T
     SCC iter.                  ...        0 min,  0.009 sec
     gradient                   ...        0 min,  0.014 sec
 * total energy  :   -37.9163862 Eh     change       -0.9127169E-04 Eh
   gradient norm :     0.0035487 Eh/α   predicted    -0.6026546E-04 ( -33.97%)
   displ. norm   :     0.2481238 α      lambda       -0.1360689E-03
   maximum displ.:     0.1252442 α      in ANC's #2, #1, #5, ...

........................................................................
.............................. CYCLE   25 ..............................
........................................................................
   1    -38.3636520 -0.383637E+02  0.269E-01    2.31       0.0  T
   2    -38.3636758 -0.237573E-04  0.139E-01    2.32       1.0  T
   3    -38.3636749  0.849415E-06  0.341E-02    2.33       1.0  T
   4    -38.3636800 -0.509167E-05  0.205E-02    2.32       1.1  T
   5    -38.3636828 -0.277807E-05  0.648E-03    2.32       3.4  T
   6    -38.3636833 -0.481721E-06  0.226E-03    2.32       9.7  T
   7    -38.3636833 -0.175996E-07  0.135E-03    2.32      16.2  T
   8    -38.3636833 -0.737458E-08  0.621E-04    2.32      35.2  T
   9    -38.3636833 -0.306165E-08  0.220E-04    2.32      99.1  T
     SCC iter.                  ...        0 min,  0.009 sec
     gradient                   ...        0 min,  0.013 sec
 * total energy  :   -37.9164891 Eh     change       -0.1028198E-03 Eh
   gradient norm :     0.0075045 Eh/α   predicted    -0.7222884E-04 ( -29.75%)
   displ. norm   :     0.2481862 α      lambda       -0.1226347E-03
   maximum displ.:     0.1289534 α      in ANC's #1, #2, #5, ...

........................................................................
.............................. CYCLE   26 ..............................
........................................................................
   1    -38.3619966 -0.383620E+02  0.265E-01    2.32       0.0  T
   2    -38.3620178 -0.211608E-04  0.136E-01    2.32       1.0  T
   3    -38.3620195 -0.172672E-05  0.305E-02    2.33       1.0  T
   4    -38.3620201 -0.620020E-06  0.198E-02    2.32       1.1  T
   5    -38.3620239 -0.377202E-05  0.505E-03    2.33       4.3  T
   6    -38.3620242 -0.250355E-06  0.209E-03    2.33      10.4  T
   7    -38.3620242 -0.153742E-07  0.123E-03    2.33      17.8  T
     SCC iter.                  ...        0 min,  0.007 sec
     gradient                   ...        0 min,  0.012 sec
 * total energy  :   -37.9165793 Eh     change       -0.9028445E-04 Eh
   gradient norm :     0.0103595 Eh/α   predicted    -0.6510121E-04 ( -27.89%)
   displ. norm   :     0.2381382 α      lambda       -0.1509901E-03
   maximum displ.:     0.1379151 α      in ANC's #1, #2, #5, ...

........................................................................
.............................. CYCLE   27 ..............................
........................................................................
   1    -38.3612954 -0.383613E+02  0.253E-01    2.34       0.0  T
   2    -38.3613132 -0.178451E-04  0.128E-01    2.34       1.0  T
   3    -38.3613159 -0.266262E-05  0.273E-02    2.35       1.0  T
   4    -38.3613140  0.186753E-05  0.188E-02    2.34       1.2  T
   5    -38.3613183 -0.432426E-05  0.338E-03    2.34       6.5  T
   6    -38.3613184 -0.937995E-07  0.179E-03    2.34      12.2  T
   7    -38.3613184 -0.127727E-07  0.940E-04    2.34      23.2  T
     SCC iter.                  ...        0 min,  0.008 sec
     gradient                   ...        0 min,  0.013 sec
 * total energy  :   -37.9166942 Eh     change       -0.1148717E-03 Eh
   gradient norm :     0.0088419 Eh/α   predicted    -0.7977986E-04 ( -30.55%)
   displ. norm   :     0.2431605 α      lambda       -0.1857140E-03
   maximum displ.:     0.1585158 α      in ANC's #1, #2, #5, ...

........................................................................
.............................. CYCLE   28 ..............................
........................................................................
   1    -38.3623925 -0.383624E+02  0.243E-01    2.37       0.0  T
   2    -38.3624081 -0.156696E-04  0.124E-01    2.37       1.0  T
   3    -38.3624098 -0.162510E-05  0.278E-02    2.38       1.0  T
   4    -38.3624092  0.568685E-06  0.189E-02    2.37       1.2  T
   5    -38.3624127 -0.352573E-05  0.404E-03    2.38       5.4  T
   6    -38.3624129 -0.215952E-06  0.165E-03    2.38      13.3  T
   7    -38.3624129 -0.311196E-08  0.803E-04    2.38      27.2  T
     SCC iter.                  ...        0 min,  0.008 sec
     gradient                   ...        0 min,  0.013 sec
 * total energy  :   -37.9168202 Eh     change       -0.1260038E-03 Eh
   gradient norm :     0.0051246 Eh/α   predicted    -0.9834789E-04 ( -21.95%)
   displ. norm   :     0.3359529 α      lambda       -0.1399031E-03
   maximum displ.:     0.2112862 α      in ANC's #1, #2, #5, ...

........................................................................
.............................. CYCLE   29 ..............................
........................................................................
   1    -38.3611672 -0.383612E+02  0.347E-01    2.37       0.0  T
   2    -38.3612001 -0.328751E-04  0.179E-01    2.38       1.0  T
   3    -38.3612063 -0.622281E-05  0.374E-02    2.38       1.0  T
   4    -38.3612012  0.508781E-05  0.245E-02    2.38       1.0  T
   5    -38.3612095 -0.830734E-05  0.487E-03    2.38       4.5  T
   6    -38.3612097 -0.179865E-06  0.245E-03    2.38       8.9  T
   7    -38.3612097 -0.220495E-07  0.141E-03    2.38      15.5  T
     SCC iter.                  ...        0 min,  0.007 sec
     gradient                   ...        0 min,  0.012 sec
 * total energy  :   -37.9169042 Eh     change       -0.8397356E-04 Eh
   gradient norm :     0.0093298 Eh/α   predicted    -0.7784997E-04 (  -7.29%)
   displ. norm   :     0.2020617 α      lambda       -0.1800111E-03
   maximum displ.:     0.1498269 α      in ANC's #1, #2, #5, ...

........................................................................
.............................. CYCLE   30 ..............................
........................................................................
   1    -38.3650118 -0.383650E+02  0.174E-01    2.43       0.0  T
   2    -38.3650210 -0.923860E-05  0.906E-02    2.42       1.0  T
   3    -38.3650211 -0.697864E-07  0.226E-02    2.43       1.0  T
   4    -38.3650226 -0.148515E-05  0.128E-02    2.42       1.7  T
   5    -38.3650233 -0.736548E-06  0.501E-03    2.42       4.4  T
   6    -38.3650237 -0.389858E-06  0.127E-03    2.42      17.2  T
   7    -38.3650237 -0.394169E-08  0.718E-04    2.42      30.4  T
     SCC iter.                  ...        0 min,  0.007 sec
     gradient                   ...        0 min,  0.012 sec
 * total energy  :   -37.9169902 Eh     change       -0.8598676E-04 Eh
   gradient norm :     0.0066873 Eh/α   predicted    -0.9368105E-04 (   8.95%)
   displ. norm   :     0.3514845 α      lambda       -0.1478213E-03
   maximum displ.:     0.2236255 α      in ANC's #1, #2, #5, ...

........................................................................
.............................. CYCLE   31 ..............................
........................................................................
   1    -38.3626552 -0.383627E+02  0.357E-01    2.41       0.0  T
   2    -38.3626900 -0.348352E-04  0.185E-01    2.42       1.0  T
   3    -38.3626955 -0.546657E-05  0.398E-02    2.43       1.0  T
   4    -38.3626932  0.230867E-05  0.242E-02    2.42       1.0  T
   5    -38.3626997 -0.654381E-05  0.556E-03    2.42       3.9  T
   6    -38.3627001 -0.381169E-06  0.240E-03    2.42       9.1  T
   7    -38.3627001 -0.192969E-07  0.140E-03    2.42      15.5  T
     SCC iter.                  ...        0 min,  0.007 sec
     gradient                   ...        0 min,  0.012 sec
 * total energy  :   -37.9170791 Eh     change       -0.8889988E-04 Eh
   gradient norm :     0.0077281 Eh/α   predicted    -0.8304254E-04 (  -6.59%)
   displ. norm   :     0.1146951 α      lambda       -0.8798212E-04
   maximum displ.:     0.0753884 α      in ANC's #2, #1, #5, ...

........................................................................
.............................. CYCLE   32 ..............................
........................................................................
   1    -38.3635185 -0.383635E+02  0.123E-01    2.44       0.0  T
   2    -38.3635238 -0.532058E-05  0.631E-02    2.43       1.0  T
   3    -38.3635210  0.277256E-05  0.207E-02    2.44       1.1  T
   4    -38.3635253 -0.430485E-05  0.989E-03    2.44       2.2  T
   5    -38.3635255 -0.155264E-06  0.460E-03    2.43       4.7  T
   6    -38.3635258 -0.332353E-06  0.969E-04    2.44      22.5  T
   7    -38.3635258 -0.417086E-08  0.593E-04    2.44      36.8  T
     SCC iter.                  ...        0 min,  0.008 sec
     gradient                   ...        0 min,  0.012 sec
 * total energy  :   -37.9171426 Eh     change       -0.6351316E-04 Eh
   gradient norm :     0.0050295 Eh/α   predicted    -0.4457216E-04 ( -29.82%)
   displ. norm   :     0.3660176 α      lambda       -0.1269398E-03
   maximum displ.:     0.2229478 α      in ANC's #1, #2, #5, ...

........................................................................
.............................. CYCLE   33 ..............................
........................................................................
   1    -38.3615907 -0.383616E+02  0.394E-01    2.45       0.0  T
   2    -38.3616340 -0.432949E-04  0.198E-01    2.45       1.0  T
   3    -38.3616277  0.633450E-05  0.510E-02    2.46       1.0  T
   4    -38.3616413 -0.135763E-04  0.304E-02    2.45       1.0  T
   5    -38.3616463 -0.505646E-05  0.888E-03    2.45       2.5  T
   6    -38.3616476 -0.129440E-05  0.263E-03    2.45       8.3  T
   7    -38.3616476 -0.227492E-07  0.157E-03    2.45      13.9  T
     SCC iter.                  ...        0 min,  0.008 sec
     gradient                   ...        0 min,  0.012 sec
 * total energy  :   -37.9172059 Eh     change       -0.6333744E-04 Eh
   gradient norm :     0.0065204 Eh/α   predicted    -0.7197362E-04 (  13.64%)
   displ. norm   :     0.0444193 α      lambda       -0.9795915E-04
   maximum displ.:     0.0218305 α      in ANC's #2, #17, #7, ...

........................................................................
.............................. CYCLE   34 ..............................
........................................................................
   1    -38.3656408 -0.383656E+02  0.495E-02    2.49       0.0  T
   2    -38.3656429 -0.208200E-05  0.261E-02    2.48       1.0  T
   3    -38.3656413  0.154793E-05  0.147E-02    2.48       1.5  T
   4    -38.3656440 -0.261196E-05  0.468E-03    2.48       4.7  T
   5    -38.3656441 -0.107256E-06  0.250E-03    2.48       8.7  T
   6    -38.3656441 -0.509779E-07  0.655E-04    2.48      33.3  T
     SCC iter.                  ...        0 min,  0.006 sec
     gradient                   ...        0 min,  0.012 sec
 * total energy  :   -37.9172321 Eh     change       -0.2619033E-04 Eh
   gradient norm :     0.0051346 Eh/α   predicted    -0.4908388E-04 (  87.41%)
   displ. norm   :     0.2246849 α      lambda       -0.8185981E-04
   maximum displ.:     0.1362320 α      in ANC's #1, #2, #5, ...

........................................................................
.............................. CYCLE   35 ..............................
........................................................................
   1    -38.3642373 -0.383642E+02  0.242E-01    2.46       0.0  T
   2    -38.3642538 -0.164925E-04  0.124E-01    2.47       1.0  T
   3    -38.3642562 -0.241623E-05  0.266E-02    2.48       1.0  T
   4    -38.3642548  0.149089E-05  0.168E-02    2.48       1.3  T
   5    -38.3642580 -0.328852E-05  0.418E-03    2.48       5.2  T
   6    -38.3642582 -0.186319E-06  0.166E-03    2.48      13.2  T
   7    -38.3642582 -0.115893E-07  0.101E-03    2.48      21.6  T
     SCC iter.                  ...        0 min,  0.007 sec
     gradient                   ...        0 min,  0.012 sec
 * total energy  :   -37.9172825 Eh     change       -0.5034338E-04 Eh
   gradient norm :     0.0065867 Eh/α   predicted    -0.4300363E-04 ( -14.58%)
   displ. norm   :     0.2380443 α      lambda       -0.7544259E-04
   maximum displ.:     0.1367650 α      in ANC's #2, #1, #5, ...

........................................................................
.............................. CYCLE   36 ..............................
........................................................................
   1    -38.3625519 -0.383626E+02  0.278E-01    2.49       0.0  T
   2    -38.3625712 -0.192915E-04  0.137E-01    2.49       1.0  T
   3    -38.3625753 -0.410147E-05  0.267E-02    2.50       1.0  T
   4    -38.3625721  0.321188E-05  0.165E-02    2.50       1.3  T
   5    -38.3625762 -0.414865E-05  0.297E-03    2.50       7.3  T
   6    -38.3625763 -0.703785E-07  0.137E-03    2.50      16.0  T
   7    -38.3625763 -0.178610E-08  0.588E-04    2.50      37.1  T
     SCC iter.                  ...        0 min,  0.008 sec
     gradient                   ...        0 min,  0.013 sec
 * total energy  :   -37.9173135 Eh     change       -0.3104425E-04 Eh
   gradient norm :     0.0068707 Eh/α   predicted    -0.3986278E-04 (  28.41%)
   displ. norm   :     0.0275500 α      lambda       -0.5433149E-04
   maximum displ.:     0.0228175 α      in ANC's #1, #7, #36, ...

........................................................................
.............................. CYCLE   37 ..............................
........................................................................
   1    -38.3644639 -0.383645E+02  0.242E-02    2.51       0.0  T
   2    -38.3644643 -0.368391E-06  0.131E-02    2.51       1.7  T
   3    -38.3644640  0.285183E-06  0.586E-03    2.51       3.7  T
   4    -38.3644644 -0.410258E-06  0.216E-03    2.51      10.1  T
   5    -38.3644644 -0.103353E-07  0.123E-03    2.51      17.8  T
     SCC iter.                  ...        0 min,  0.006 sec
     gradient                   ...        0 min,  0.013 sec
 * total energy  :   -37.9173504 Eh     change       -0.3688860E-04 Eh
   gradient norm :     0.0032123 Eh/α   predicted    -0.2719428E-04 ( -26.28%)
   displ. norm   :     0.2392932 α      lambda       -0.8116039E-04
   maximum displ.:     0.1534599 α      in ANC's #2, #1, #5, ...

........................................................................
.............................. CYCLE   38 ..............................
........................................................................
   1    -38.3649164 -0.383649E+02  0.292E-01    2.52       0.0  T
   2    -38.3649379 -0.215018E-04  0.148E-01    2.52       1.0  T
   3    -38.3649404 -0.250892E-05  0.321E-02    2.52       1.0  T
   4    -38.3649392  0.119979E-05  0.216E-02    2.52       1.0  T
   5    -38.3649438 -0.465235E-05  0.476E-03    2.52       4.6  T
   6    -38.3649441 -0.285462E-06  0.193E-03    2.52      11.3  T
   7    -38.3649441 -0.152586E-07  0.107E-03    2.52      20.5  T
   8    -38.3649441 -0.571686E-08  0.460E-04    2.52      47.4  T
   9    -38.3649441 -0.165515E-08  0.173E-04    2.52     126.1  T
     SCC iter.                  ...        0 min,  0.009 sec
     gradient                   ...        0 min,  0.013 sec
 * total energy  :   -37.9174059 Eh     change       -0.5552506E-04 Eh
   gradient norm :     0.0051438 Eh/α   predicted    -0.4290583E-04 ( -22.73%)
   displ. norm   :     0.3072888 α      lambda       -0.7775705E-04
   maximum displ.:     0.1926524 α      in ANC's #2, #5, #1, ...

........................................................................
.............................. CYCLE   39 ..............................
........................................................................
   1    -38.3638289 -0.383638E+02  0.394E-01    2.54       0.0  T
   2    -38.3638666 -0.377038E-04  0.196E-01    2.54       1.0  T
   3    -38.3638711 -0.452166E-05  0.416E-02    2.54       1.0  T
   4    -38.3638687  0.245580E-05  0.287E-02    2.54       1.0  T
   5    -38.3638772 -0.851852E-05  0.536E-03    2.54       4.1  T
   6    -38.3638775 -0.348378E-06  0.230E-03    2.54       9.5  T
   7    -38.3638776 -0.121303E-07  0.116E-03    2.54      18.9  T
     SCC iter.                  ...        0 min,  0.007 sec
     gradient                   ...        0 min,  0.012 sec
 * total energy  :   -37.9174616 Eh     change       -0.5565412E-04 Eh
   gradient norm :     0.0064151 Eh/α   predicted    -0.4255374E-04 ( -23.54%)
   displ. norm   :     0.2164864 α      lambda       -0.7507424E-04
   maximum displ.:     0.1332753 α      in ANC's #2, #5, #6, ...

........................................................................
.............................. CYCLE   40 ..............................
........................................................................
   1    -38.3643919 -0.383644E+02  0.281E-01    2.56       0.0  T
   2    -38.3644109 -0.190158E-04  0.140E-01    2.56       1.0  T
   3    -38.3644113 -0.386968E-06  0.318E-02    2.56       1.0  T
   4    -38.3644131 -0.181302E-05  0.206E-02    2.56       1.1  T
   5    -38.3644165 -0.332246E-05  0.501E-03    2.56       4.4  T
   6    -38.3644168 -0.369075E-06  0.176E-03    2.56      12.4  T
   7    -38.3644168 -0.307669E-08  0.970E-04    2.56      22.5  T
     SCC iter.                  ...        0 min,  0.008 sec
     gradient                   ...        0 min,  0.013 sec
 * total energy  :   -37.9175112 Eh     change       -0.4960708E-04 Eh
   gradient norm :     0.0036633 Eh/α   predicted    -0.3929791E-04 ( -20.78%)
   displ. norm   :     0.1632559 α      lambda       -0.4765870E-04
   maximum displ.:     0.1018151 α      in ANC's #2, #5, #4, ...

........................................................................
.............................. CYCLE   41 ..............................
........................................................................
   1    -38.3649381 -0.383649E+02  0.222E-01    2.56       0.0  T
   2    -38.3649496 -0.115318E-04  0.111E-01    2.56       1.0  T
   3    -38.3649500 -0.431010E-06  0.251E-02    2.56       1.0  T
   4    -38.3649509 -0.934013E-06  0.164E-02    2.56       1.3  T
   5    -38.3649531 -0.215843E-05  0.377E-03    2.56       5.8  T
   6    -38.3649533 -0.209974E-06  0.143E-03    2.56      15.3  T
   7    -38.3649533 -0.245907E-08  0.814E-04    2.56      26.8  T
   8    -38.3649533 -0.580228E-08  0.300E-04    2.56      72.8  T
     SCC iter.                  ...        0 min,  0.009 sec
     gradient                   ...        0 min,  0.013 sec
 * total energy  :   -37.9175423 Eh     change       -0.3113796E-04 Eh
   gradient norm :     0.0035896 Eh/α   predicted    -0.2446656E-04 ( -21.43%)
   displ. norm   :     0.1544537 α      lambda       -0.4556695E-04
   maximum displ.:     0.0903690 α      in ANC's #2, #5, #6, ...

........................................................................
.............................. CYCLE   42 ..............................
........................................................................
   1    -38.3659759 -0.383660E+02  0.182E-01    2.57       0.0  T
   2    -38.3659834 -0.750007E-05  0.938E-02    2.57       1.0  T
   3    -38.3659834  0.399092E-07  0.220E-02    2.57       1.0  T
   4    -38.3659841 -0.742015E-06  0.142E-02    2.57       1.5  T
   5    -38.3659859 -0.180896E-05  0.323E-03    2.57       6.7  T
   6    -38.3659860 -0.139492E-06  0.136E-03    2.57      16.0  T
   7    -38.3659861 -0.499062E-08  0.759E-04    2.57      28.7  T
   8    -38.3659861 -0.446823E-08  0.334E-04    2.57      65.4  T
     SCC iter.                  ...        0 min,  0.008 sec
     gradient                   ...        0 min,  0.013 sec
 * total energy  :   -37.9175683 Eh     change       -0.2596959E-04 Eh
   gradient norm :     0.0037553 Eh/α   predicted    -0.2332955E-04 ( -10.17%)
   displ. norm   :     0.2131736 α      lambda       -0.3032496E-04
   maximum displ.:     0.1338438 α      in ANC's #2, #5, #6, ...
 * RMSD in coord.:     0.9301474 α      energy gain  -0.1802993E-02 Eh

generating ANC from model Hessian ...
Using Lindh-Hessian (1995)
 Shifting diagonal of input Hessian by   3.207133590736036E-003
 Lowest  eigenvalues of input Hessian
   -0.000000   -0.000000   -0.000000   -0.000000    0.000000    0.000000
    0.005000    0.006390    0.007533    0.009632    0.011513    0.013812
    0.020173    0.025519    0.027382    0.037608    0.038701    0.043563
 Highest eigenvalues
    1.577467    1.751219    1.836034    1.982037    2.023430    2.164447
 

........................................................................
.............................. CYCLE   43 ..............................
........................................................................
   1    -38.3641544 -0.383642E+02  0.273E-01    2.56       0.0  T
   2    -38.3641715 -0.171226E-04  0.137E-01    2.56       1.0  T
   3    -38.3641733 -0.178343E-05  0.300E-02    2.56       1.0  T
   4    -38.3641724  0.915450E-06  0.205E-02    2.56       1.1  T
   5    -38.3641766 -0.420100E-05  0.410E-03    2.56       5.3  T
   6    -38.3641768 -0.207180E-06  0.172E-03    2.56      12.7  T
   7    -38.3641768 -0.732577E-08  0.831E-04    2.56      26.3  T
   8    -38.3641768 -0.361661E-08  0.409E-04    2.56      53.3  T
     SCC iter.                  ...        0 min,  0.008 sec
     gradient                   ...        0 min,  0.013 sec
 * total energy  :   -37.9175748 Eh     change       -0.6467360E-05 Eh
   gradient norm :     0.0056476 Eh/α   predicted     0.0000000E+00 (-100.00%)
   displ. norm   :     0.0364045 α      lambda       -0.5812061E-04
   maximum displ.:     0.0210941 α      in ANC's #5, #1, #9, ...

........................................................................
.............................. CYCLE   44 ..............................
........................................................................
   1    -38.3654480 -0.383654E+02  0.686E-02    2.58       0.0  T
   2    -38.3654497 -0.168854E-05  0.335E-02    2.57       1.0  T
   3    -38.3654498 -0.726033E-07  0.696E-03    2.57       3.1  T
   4    -38.3654501 -0.297885E-06  0.392E-03    2.57       5.6  T
   5    -38.3654501 -0.198288E-07  0.161E-03    2.57      13.5  T
   6    -38.3654501 -0.303576E-07  0.530E-04    2.57      41.2  T
     SCC iter.                  ...        0 min,  0.006 sec
     gradient                   ...        0 min,  0.013 sec
 * total energy  :   -37.9176126 Eh     change       -0.3783501E-04 Eh
   gradient norm :     0.0015229 Eh/α   predicted    -0.2910054E-04 ( -23.09%)
   displ. norm   :     0.0489453 α      lambda       -0.2005817E-04
   maximum displ.:     0.0235309 α      in ANC's #6, #5, #9, ...

........................................................................
.............................. CYCLE   45 ..............................
........................................................................
   1    -38.3661246 -0.383661E+02  0.898E-02    2.57       0.0  T
   2    -38.3661270 -0.238601E-05  0.438E-02    2.56       1.0  T
   3    -38.3661273 -0.347799E-06  0.789E-03    2.56       2.8  T
   4    -38.3661272  0.822797E-07  0.515E-03    2.56       4.2  T
   5    -38.3661275 -0.277188E-06  0.144E-03    2.56      15.2  T
   6    -38.3661275 -0.142571E-07  0.609E-04    2.56      35.8  T
   7    -38.3661275 -0.334738E-08  0.283E-04    2.56      77.2  T
     SCC iter.                  ...        0 min,  0.007 sec
     gradient                   ...        0 min,  0.013 sec
 * total energy  :   -37.9176254 Eh     change       -0.1280211E-04 Eh
   gradient norm :     0.0018854 Eh/α   predicted    -0.1004016E-04 ( -21.57%)
   displ. norm   :     0.0134709 α      lambda       -0.4944918E-05
   maximum displ.:     0.0064730 α      in ANC's #6, #9, #15, ...

........................................................................
.............................. CYCLE   46 ..............................
........................................................................
   1    -38.3656442 -0.383656E+02  0.177E-02    2.55       0.0  T
   2    -38.3656443 -0.108781E-06  0.101E-02    2.55       2.2  T
   3    -38.3656443  0.392096E-07  0.296E-03    2.55       7.4  T
   4    -38.3656444 -0.738904E-07  0.137E-03    2.55      15.9  T
   5    -38.3656444 -0.555247E-08  0.713E-04    2.55      30.6  T
   6    -38.3656444 -0.547612E-08  0.208E-04    2.55     105.0  T
     SCC iter.                  ...        0 min,  0.007 sec
     gradient                   ...        0 min,  0.013 sec
 * total energy  :   -37.9176287 Eh     change       -0.3331274E-05 Eh
   gradient norm :     0.0005299 Eh/α   predicted    -0.2473966E-05 ( -25.74%)
   displ. norm   :     0.0170217 α      lambda       -0.2482025E-05
   maximum displ.:     0.0107087 α      in ANC's #5, #6, #12, ...

   *** GEOMETRY OPTIMIZATION CONVERGED AFTER 46 ITERATIONS ***

------------------------------------------------------------------------
 total energy gain   :        -0.0140448 Eh       -8.8132 kcal/mol
 total RMSD          :         1.7723512 a0        0.9379 Å
 total power (kW/mol):        -0.8016225 (step)  -26.3163 (real)
------------------------------------------------------------------------

 ANCopt (total)                0 d,  0 h,  0 min,  1.401 sec
 optimizer setup                ...        0 min,  0.000 sec (  0.009%)
 model hessian                  ...        0 min,  0.012 sec (  0.889%)
 ANC generation                 ...        0 min,  0.002 sec (  0.118%)
 coordinate transformation      ...        0 min,  0.001 sec (  0.048%)
 single point calculation       ...        0 min,  1.370 sec ( 97.767%)
 optimization log               ...        0 min,  0.004 sec (  0.256%)
 hessian update                 ...        0 min,  0.000 sec (  0.035%)
 rational function              ...        0 min,  0.010 sec (  0.702%)

================
 final structure:
================
$coord
   -3.62310796357803   -2.41875784308307    0.88996971147060      C 
   -5.82630079141056   -0.08354443897562    0.50798718611387      S 
   -3.50077184286000    2.15856109829934   -0.06702872715409      C 
   -1.12685897169883    1.08834797938270    0.06224003917453      C 
   -1.21468115653027   -1.55042966665069    0.59631497908900      C 
    1.37157512662081   -3.64543165740911    0.86982683181435      S 
    3.80509073893332   -1.91053630231622   -0.88153269303073      C 
    4.76340473108554    0.02769354905726    0.95977872664818      C 
    6.70687661273605   -0.19125532408150    2.11698613363013      O 
    2.98811090614136    2.25120535357589    1.40397460568708      C 
    1.00391803377357    2.49774217975652   -0.35706622909964      O 
   -4.24580943453400    4.72851799051878   -0.57355543421658      C 
   -2.73397850898750    6.56181698537479   -1.39090115015866      C 
   -4.19415705723800   -4.31662645579765    1.29602537935551      H 
    2.96156161880734   -1.09514173379093   -2.57012654293517      H 
    5.26477836166382   -3.27988449556544   -1.35371244119752      H 
    4.09896362420050    3.99053678274975    1.25746581867245      H 
    2.26733321510306    2.12761268719412    3.34800346660962      H 
   -6.23027045794897    5.10004968607259   -0.24496582467850      H 
   -0.76464798632940    6.23958636389847   -1.76871538334471      H 
   -3.44371972197029    8.44190940397909   -1.69971258593694      H 
$end
           -------------------------------------------------
          |                Final Singlepoint                |
           -------------------------------------------------

          ...................................................
          :                      SETUP                      :
          :.................................................:
          :  # basis functions                  72          :
          :  # atomic orbitals                  70          :
          :  # shells                           36          :
          :  # electrons                        68          :
          :  max. iterations                   250          :
          :  Hamiltonian                  GFN2-xTB          :
          :  restarted?                      false          :
          :  GBSA solvation                  false          :
          :  PC potential                    false          :
          :  electronic temp.          300.0000000     K    :
          :  accuracy                    1.0000000          :
          :  -> integral cutoff          0.2500000E+02      :
          :  -> integral neglect         0.1000000E-07      :
          :  -> SCF convergence          0.1000000E-05 Eh   :
          :  -> wf. convergence          0.1000000E-03 e    :
          :  Broyden damping             0.4000000          :
          ...................................................

 iter      E             dE          RMSdq      gap      omega  full diag
   1    -38.3656444 -0.383656E+02  0.963E-05    2.55       0.0  T
   2    -38.3656444 -0.100400E-10  0.457E-05    2.55     477.7  T
   3    -38.3656444 -0.255369E-10  0.438E-05    2.55     498.7  T

   *** convergence criteria satisfied after 3 iterations ***

         #    Occupation            Energy/Eh            Energy/eV
      -------------------------------------------------------------
         1        2.0000           -0.7476183             -20.3437
       ...           ...                  ...                  ...
        28        2.0000           -0.4658630             -12.6768
        29        2.0000           -0.4553351             -12.3903
        30        2.0000           -0.4407958             -11.9947
        31        2.0000           -0.4217232             -11.4757
        32        2.0000           -0.4200440             -11.4300
        33        2.0000           -0.3879934             -10.5578
        34        2.0000           -0.3757985             -10.2260 (HOMO)
        35                         -0.2820999              -7.6763 (LUMO)
        36                         -0.2773788              -7.5479
        37                         -0.2263081              -6.1582
        38                         -0.2220618              -6.0426
        39                         -0.2092757              -5.6947
       ...                                ...                  ...
        70                          0.6538175              17.7913
      -------------------------------------------------------------
                  HL-Gap            0.0936986 Eh            2.5497 eV
             Fermi-level           -0.3289492 Eh           -8.9512 eV

 SCC (total)                   0 d,  0 h,  0 min,  0.026 sec
 SCC setup                      ...        0 min,  0.000 sec (  0.612%)
 Dispersion                     ...        0 min,  0.000 sec (  0.555%)
 integral evaluation            ...        0 min,  0.009 sec ( 33.116%)
 zeroth order Hamiltonian       ...        0 min,  0.000 sec (  0.544%)
 iterations                     ...        0 min,  0.004 sec ( 14.002%)
 molecular gradient             ...        0 min,  0.013 sec ( 49.767%)
 printout                       ...        0 min,  0.000 sec (  1.213%)

         :::::::::::::::::::::::::::::::::::::::::::::::::::::
         ::                     SUMMARY                     ::
         :::::::::::::::::::::::::::::::::::::::::::::::::::::
         :: total energy             -37.917628711629 Eh    ::
         :: gradient norm              0.000529628819 Eh/a0 ::
         :: HOMO-LUMO gap              2.549669859445 eV    ::
         ::.................................................::
         :: SCC energy               -38.365644388923 Eh    ::
         :: -> isotropic ES            0.039626446597 Eh    ::
         :: -> anisotropic ES          0.002349239239 Eh    ::
         :: -> anisotropic XC          0.013015393290 Eh    ::
         :: -> dispersion             -0.024158264939 Eh    ::
         :: repulsion energy           0.447863351913 Eh    ::
         :: add. restraining           0.000000000000 Eh    ::
         :::::::::::::::::::::::::::::::::::::::::::::::::::::

           -------------------------------------------------
          |                Property Printout                |
           -------------------------------------------------

    * Orbital Energies and Occupations

         #    Occupation            Energy/Eh            Energy/eV
      -------------------------------------------------------------
         1        2.0000           -0.7476183             -20.3437
       ...           ...                  ...                  ...
        22        2.0000           -0.5080082             -13.8236
        23        2.0000           -0.5001656             -13.6102
        24        2.0000           -0.4915140             -13.3748
        25        2.0000           -0.4827008             -13.1350
        26        2.0000           -0.4738180             -12.8932
        27        2.0000           -0.4667167             -12.7000
        28        2.0000           -0.4658630             -12.6768
        29        2.0000           -0.4553351             -12.3903
        30        2.0000           -0.4407958             -11.9947
        31        2.0000           -0.4217232             -11.4757
        32        2.0000           -0.4200440             -11.4300
        33        2.0000           -0.3879934             -10.5578
        34        2.0000           -0.3757985             -10.2260 (HOMO)
        35                         -0.2820999              -7.6763 (LUMO)
        36                         -0.2773788              -7.5479
        37                         -0.2263081              -6.1582
        38                         -0.2220618              -6.0426
        39                         -0.2092757              -5.6947
        40                         -0.1663357              -4.5262
        41                         -0.1576175              -4.2890
        42                         -0.1260536              -3.4301
        43                         -0.0307946              -0.8380
        44                         -0.0153420              -0.4175
        45                         -0.0129388              -0.3521
       ...                                ...                  ...
        70                          0.6538175              17.7913
      -------------------------------------------------------------
                  HL-Gap            0.0936986 Eh            2.5497 eV
             Fermi-level           -0.3289492 Eh           -8.9512 eV

     #   Z        covCN         q      C6AA      α(0)
     1   6 C      2.982    -0.038    28.945     8.825
     2  16 S      2.334    -0.008   141.380    20.012
     3   6 C      2.985     0.000    28.014     8.682
     4   6 C      3.058     0.113    25.459     8.275
     5   6 C      3.150     0.006    27.620     8.596
     6  16 S      2.100    -0.118   146.006    20.337
     7   6 C      3.796    -0.029    21.103     6.541
     8   6 C      2.904     0.228    23.217     7.901
     9   8 O      0.857    -0.341    20.535     6.076
    10   6 C      3.699     0.060    19.727     6.352
    11   8 O      1.703    -0.282    18.680     5.835
    12   6 C      2.929    -0.026    28.664     8.780
    13   6 C      2.839    -0.087    30.181     9.003
    14   1 H      0.927     0.063     2.164     2.300
    15   1 H      0.925     0.078     1.998     2.210
    16   1 H      0.925     0.080     1.980     2.201
    17   1 H      0.924     0.082     1.961     2.190
    18   1 H      0.923     0.064     2.154     2.295
    19   1 H      0.925     0.048     2.343     2.394
    20   1 H      0.926     0.061     2.188     2.313
    21   1 H      0.926     0.047     2.352     2.398

 Mol. C6AA /au·bohr⁶  :       8095.272528
 Mol. C8AA /au·bohr⁸  :     242743.844381
 Mol. α(0) /au        :        143.518072


Wiberg/Mayer (AO) data.
largest (>0.10) Wiberg bond orders for each atom
          total WBO             WBO to atom ...
     1  C   3.945        C    5 1.548    S    2 1.196    H   14 0.968
     2  S   2.630        C    1 1.196    C    3 1.138
     3  C   3.944        C    4 1.462    S    2 1.138    C   12 1.130
     4  C   3.929        C    3 1.462    C    5 1.215    O   11 1.023
     5  C   3.955        C    1 1.548    C    4 1.215    S    6 1.029
     6  S   2.269        C    5 1.029    C    7 0.955
     7  C   3.977        C    8 0.995    H   16 0.966    H   15 0.962    S    6 0.955
     8  C   3.926        O    9 1.862    C    7 0.995    C   10 0.966
     9  O   2.092        C    8 1.862
    10  C   3.949        O   11 0.974    C    8 0.966    H   17 0.947    H   18 0.944
    11  O   2.183        C    4 1.023    C   10 0.974
    12  C   3.986        C   13 1.864    C    3 1.130    H   19 0.962
    13  C   3.989        C   12 1.864    H   21 0.977    H   20 0.972
    14  H   0.996        C    1 0.968
    15  H   0.994        C    7 0.962
    16  H   0.993        C    7 0.966
    17  H   0.992        C   10 0.947
    18  H   0.996        C   10 0.944
    19  H   0.997        C   12 0.962
    20  H   0.996        C   13 0.972
    21  H   0.997        C   13 0.977

molecular dipole:
                 x           y           z       tot (Debye)
 q only:       -0.817       0.368      -0.396
   full:       -0.569       0.468      -0.496       2.257
molecular quadrupole (traceless):
                xx          xy          yy          xz          yz          zz
 q only:       -5.884       0.829       5.009      -5.870       2.310       0.876
  q+dip:       -9.612       1.123       7.257      -7.879       3.333       2.355
   full:       -9.745       1.614       6.393      -7.963       3.021       3.352

           -------------------------------------------------
          |                Geometry Summary                 |
           -------------------------------------------------

      molecular mass/u    :      212.2810000
   center of mass at/Å    :       -0.1949578       0.1646573       0.2058642
  moments of inertia/u·Å² :        0.4733313E+03   0.9971871E+03   0.1399689E+04
rotational constants/cm⁻¹ :        0.3561487E-01   0.1690518E-01   0.1204385E-01

 * 17 selected distances

     #   Z        #   Z                                     value/Å
     1   6 C      2  16 S                                 1.7109039
     2  16 S      3   6 C                                 1.7362955 (max)
     3   6 C      4   6 C                                 1.3796747
     1   6 C      5   6 C                                 1.3636711
     4   6 C      5   6 C                                 1.4254523
     8   6 C      9   8 O                                 1.2025430
     4   6 C     11   8 O                                 1.3699888
    10   6 C     11   8 O                                 1.4099438
    12   6 C     13   6 C                                 1.3297701
     1   6 C     14   1 H                                 1.0705720 (min)
     7   6 C     15   1 H                                 1.0880686
     7   6 C     16   1 H                                 1.0881969
    10   6 C     17   1 H                                 1.0948641
    10   6 C     18   1 H                                 1.0991158
    12   6 C     19   1 H                                 1.0824350
    13   6 C     20   1 H                                 1.0747431
    13   6 C     21   1 H                                 1.0759157

 * 4 distinct bonds (by element types)

   Z      Z             #   av. dist./Å        max./Å        min./Å
   1 H    6 C           8     1.0842389     1.0991158     1.0705720
   6 C    6 C           4     1.3746421     1.4254523     1.3297701
   6 C    8 O           3     1.3274919     1.4099438     1.2025430
   6 C   16 S           2     1.7235997     1.7362955     1.7109039


optimized geometry written to: xtbopt.xyz


           -------------------------------------------------
          | TOTAL ENERGY              -37.917628711629 Eh   |
          | GRADIENT NORM               0.000529628819 Eh/α |
          | HOMO-LUMO GAP               2.549669859445 eV   |
           -------------------------------------------------

------------------------------------------------------------------------
 * finished run on 2021/05/19 at 10:58:54.527     
------------------------------------------------------------------------
 total:
 * wall-time:     0 d,  0 h,  0 min,  1.487 sec
 *  cpu-time:     0 d,  0 h,  0 min,  1.486 sec
 * ratio c/w:     1.000 speedup
 SCF:
 * wall-time:     0 d,  0 h,  0 min,  0.038 sec
 *  cpu-time:     0 d,  0 h,  0 min,  0.038 sec
 * ratio c/w:     1.000 speedup
 ANC optimizer:
 * wall-time:     0 d,  0 h,  0 min,  1.428 sec
 *  cpu-time:     0 d,  0 h,  0 min,  1.428 sec
 * ratio c/w:     1.000 speedup

