      -----------------------------------------------------------      
     |                   =====================                   |     
     |                           x T B                           |     
     |                   =====================                   |     
     |                         S. Grimme                         |     
     |          Mulliken Center for Theoretical Chemistry        |     
     |                    University of Bonn                     |     
     |                Version 6.2 RC2 (SAW190805)                |     
      -----------------------------------------------------------      

   This program is distributed in the hope that it will be useful,
   but WITHOUT ANY WARRANTY; without even the implied warranty of
   MERCHANTABILITY or FITNESS FOR A PARTICULAR PURPOSE.
   
   FOR NON-COMMERCIAL, ACADEMIA USE ONLY.
   
   Cite this work as:
   * S. Grimme, C. Bannwarth, P. Shushkov, J. Chem. Theory Comput., 2017,
     13, 1989-2009. DOI: 10.1021/acs.jctc.7b00118
   * C. Bannwarth, S. Ehlert and S. Grimme., J. Chem. Theory Comput., 2019,
     15, 1652-1671. DOI: 10.1021/acs.jctc.8b01176
   * P. Pracht, E. Caldeweyher, S. Ehlert, S. Grimme, ChemRxiv, 2019, preprint.
     DOI: 10.26434/chemrxiv.8326202.v1
   
   for DFT-D4:
   * E. Caldeweyher, C. Bannwarth and S. Grimme, J. Chem. Phys., 2017,
     147, 034112. DOI: 10.1063/1.4993215
   * E. Caldeweyher, S. Ehlert, A. Hansen, H. Neugebauer, S. Spicher,
     C. Bannwarth and S. Grimme, J. Chem. Phys., 2019, 150, 154122.
     DOI: 10.1063/1.5090222
   
   for sTDA-xTB:
   * S. Grimme and C. Bannwarth, J. Chem. Phys., 2016, 145, 054103.
     DOI: 10.1063/1.4959605
   
   in the mass-spec context:
   * V. Asgeirsson, C. Bauer and S. Grimme, Chem. Sci., 2017, 8, 4879.
     DOI: 10.1039/c7sc00601b
   
   for metadynamics refer to:
   * S. Grimme, J. Chem. Theory Comput., 2019, 155, 2847-2862
     DOI: 10.1021/acs.jctc.9b00143
   
   with help from (in alphabetical order)
   C. Bannwarth, F. Bohle, G. Brandenburg, E. Caldeweyher, M. Checinski,
   S. Dohm, S. Ehlert, S. Ehrlich, F. März, H. Neugebauer, J. Pisarek,
   P. Pracht, P. Shushkov, and S. Spicher.
   
 * started run on 2021/05/19 at 11:01:00.103     

           -------------------------------------------------
          |                Calculation Setup                |
           -------------------------------------------------

          program call               : /ihome/ghutchison/geoffh/xtb/xtb 877.xyz -opt
          hostname                   : smp-n83
          coordinate file            : 877.xyz
          omp threads                :                     1
          number of atoms            :                    29
          number of electrons        :                   106
          charge                     :                     0
          spin                       :                   0.0
          first test random number   :      0.64001191752078


########################################################################
# WARNING! Please study the warnings concerning your input carefully
#  - the use of '-opt' is discouraged, please use '--opt' next time
########################################################################

           ------------------------------------------------- 
          |                 G F N 2 - x T B                 |
          | Geometry, Frequencies, Noncovalent interactions |
          |            JCTC 2019 parametrisation            |
           ------------------------------------------------- 
             KAB for C  - Si     :                1.0500
             KAB for H  - Pd     :                0.9500
             k(s)              :                1.8500
             k(p)              :                2.2300
             k(d)              :                2.2300
             k(f)              :                2.0000
             kEN (H0ij)        :               -2.0000
             D4 a1             :                0.5200
             D4 a2             :                5.0000
             D4 s6             :                1.0000
             D4 s8             :                2.7000
             D4 s9             :                5.0000
             alphaj            :                2.0000

  Z AO/shell   Hii/eV     exponent
  1     Wed Apr 25 08:07:45 CEST 2018   EN: 2.200 GM2: 0.406  GM3: 0.0800  RAES: 1.40
     1s    -10.707211    1.230000
  6     Wed Apr 25 08:07:45 CEST 2018   EN: 2.550 GM2: 0.538  GM3: 0.1500  RAES: 3.00
     2s    -13.970922    2.096432
     2p    -10.063292    1.800000
  9     Mon Apr 23 13:58:50 CEST 2018   EN: 3.980 GM2: 0.532  GM3: 0.1426  RAES: 2.40
     2s    -23.458179    2.416361
     2p    -15.746583    2.308399
 16     Tue Apr 24 11:44:34 CEST 2018   EN: 2.580 GM2: 0.340  GM3:-0.0502  RAES: 3.10
     3s    -20.029654    1.981333
     3p    -11.377694    2.025643
     3d     -0.420282    1.702555

           ------------------------------------------------- 
          |        Self-Consistent Charge Iterations        |
           ------------------------------------------------- 

          ...................................................
          :                      SETUP                      :
          :.................................................:
          :  # basis functions                  92          :
          :  # atomic orbitals                  91          :
          :  # shells                           49          :
          :  # electrons                       106          :
          :  max. iterations                   250          :
          :  Hamiltonian                  GFN2-xTB          :
          :  restarted?                      false          :
          :  GBSA solvation                  false          :
          :  PC potential                    false          :
          :  electronic temp.          300.0000000     K    :
          :  accuracy                    1.0000000          :
          :  -> integral cutoff          0.2500000E+02      :
          :  -> integral neglect         0.1000000E-07      :
          :  -> SCF convergence          0.1000000E-05 Eh   :
          :  -> wf. convergence          0.1000000E-03 e    :
          :  Broyden damping             0.4000000          :
          ...................................................

 iter      E             dE          RMSdq      gap      omega  full diag
   1    -62.8238458 -0.628238E+02  0.433E+00    3.08       0.0  T
   2    -62.9632676 -0.139422E+00  0.243E+00    3.10       1.0  T
   3    -62.9678140 -0.454640E-02  0.118E+00    3.10       1.0  T
   4    -62.9687855 -0.971509E-03  0.323E-01    3.09       1.0  T
   5    -62.9709589 -0.217338E-02  0.142E-01    3.09       1.0  T
   6    -62.9711736 -0.214737E-03  0.438E-02    3.09       1.0  T
   7    -62.9711860 -0.123692E-04  0.198E-02    3.09       1.0  T
   8    -62.9711885 -0.250477E-05  0.125E-02    3.09       1.5  T
   9    -62.9711897 -0.125483E-05  0.405E-03    3.09       4.6  T
  10    -62.9711899 -0.164329E-06  0.171E-03    3.09      10.9  T
  11    -62.9711899 -0.145089E-07  0.724E-04    3.09      25.6  T
  12    -62.9711899 -0.198943E-08  0.301E-04    3.09      61.7  T

   *** convergence criteria satisfied after 12 iterations ***

         #    Occupation            Energy/Eh            Energy/eV
      -------------------------------------------------------------
         1        2.0000           -0.8930913             -24.3023
       ...           ...                  ...                  ...
        47        2.0000           -0.4720609             -12.8454
        48        2.0000           -0.4675212             -12.7219
        49        2.0000           -0.4598655             -12.5136
        50        2.0000           -0.4454988             -12.1226
        51        2.0000           -0.4378111             -11.9134
        52        2.0000           -0.4001230             -10.8879
        53        2.0000           -0.3850997             -10.4791 (HOMO)
        54                         -0.2714871              -7.3875 (LUMO)
        55                         -0.2154887              -5.8637
        56                         -0.2080248              -5.6606
        57                         -0.1699008              -4.6232
        58                         -0.1198373              -3.2609
       ...                                ...                  ...
        91                          0.6546368              17.8136
      -------------------------------------------------------------
                  HL-Gap            0.1136126 Eh            3.0916 eV
             Fermi-level           -0.3282934 Eh           -8.9333 eV

 SCC (total)                   0 d,  0 h,  0 min,  0.062 sec
 SCC setup                      ...        0 min,  0.000 sec (  0.611%)
 Dispersion                     ...        0 min,  0.000 sec (  0.724%)
 integral evaluation            ...        0 min,  0.017 sec ( 26.686%)
 zeroth order Hamiltonian       ...        0 min,  0.000 sec (  0.481%)
 iterations                     ...        0 min,  0.021 sec ( 34.250%)
 molecular gradient             ...        0 min,  0.023 sec ( 36.444%)
 printout                       ...        0 min,  0.000 sec (  0.721%)

         :::::::::::::::::::::::::::::::::::::::::::::::::::::
         ::                     SUMMARY                     ::
         :::::::::::::::::::::::::::::::::::::::::::::::::::::
         :: total energy             -62.451130608866 Eh    ::
         :: gradient norm              0.056261674356 Eh/a0 ::
         :: HOMO-LUMO gap              3.091557141900 eV    ::
         ::.................................................::
         :: SCC energy               -62.971189908924 Eh    ::
         :: -> isotropic ES            0.085020355768 Eh    ::
         :: -> anisotropic ES          0.001394246550 Eh    ::
         :: -> anisotropic XC         -0.021122957344 Eh    ::
         :: -> dispersion             -0.032740698517 Eh    ::
         :: repulsion energy           0.519539376920 Eh    ::
         :: add. restraining           0.000000000000 Eh    ::
         :::::::::::::::::::::::::::::::::::::::::::::::::::::

      ----------------------------------------------------------- 
     |                   =====================                   |
     |                        A N C O P T                        |
     |                   =====================                   |
     |               Approximate Normal Coordinate               |
     |                Rational Function Optimizer                |
      ----------------------------------------------------------- 

          ...................................................
          :                      SETUP                      :
          :.................................................:
          :   optimization level            normal          :
          :   max. optcycles                   200          :
          :   ANC micro-cycles                  20          :
          :   degrees of freedom                81          :
          :.................................................:
          :   RF solver                   davidson          :
          :   input Hessian                  false          :
          :   write xtbopt.log                true          :
          :   linear?                        false          :
          :   energy convergence         0.5000000E-05 Eh   :
          :   grad. convergence          0.1000000E-02 Eh/α :
          :   maximium RF displ.         2.0000000          :
          :   Hlow (freq-cutoff)         0.5000000E-02      :
          :   Hmax (freq-cutoff)         5.0000000          :
          :   S6 in model hess.         20.0000000          :
          ...................................................

generating ANC from model Hessian ...
Using Lindh-Hessian (1995)
 Shifting diagonal of input Hessian by   4.146294042130237E-003
 Lowest  eigenvalues of input Hessian
   -0.000000    0.000000    0.000000    0.000000    0.000000    0.000000
    0.005000    0.006441    0.007540    0.008858    0.009336    0.011374
    0.012781    0.013028    0.013860    0.015999    0.019925    0.023337
 Highest eigenvalues
    1.674286    1.703019    1.705328    1.783747    1.829862    1.984208
 

........................................................................
.............................. CYCLE    1 ..............................
........................................................................
   1    -62.9711899 -0.629712E+02  0.171E-04    3.09       0.0  T
   2    -62.9711899 -0.850520E-11  0.141E-04    3.09     132.0  T
   3    -62.9711899 -0.285787E-09  0.729E-05    3.09     254.6  T
     SCC iter.                  ...        0 min,  0.006 sec
     gradient                   ...        0 min,  0.023 sec
 * total energy  :   -62.4511306 Eh     change       -0.4707168E-08 Eh
   gradient norm :     0.0562616 Eh/α   predicted     0.0000000E+00 (-100.00%)
   displ. norm   :     0.2174400 α      lambda       -0.6212464E-02
   maximum displ.:     0.1025216 α      in ANC's #3, #52, #1, ...

........................................................................
.............................. CYCLE    2 ..............................
........................................................................
   1    -62.9915545 -0.629916E+02  0.208E-01    3.13       0.0  T
   2    -62.9915899 -0.353948E-04  0.118E-01    3.14       1.0  T
   3    -62.9915183  0.715751E-04  0.707E-02    3.14       1.0  T
   4    -62.9916265 -0.108155E-03  0.216E-02    3.14       1.0  T
   5    -62.9916290 -0.252865E-05  0.959E-03    3.14       1.9  T
   6    -62.9916301 -0.113232E-05  0.317E-03    3.14       5.9  T
   7    -62.9916304 -0.227629E-06  0.789E-04    3.14      23.5  T
     SCC iter.                  ...        0 min,  0.012 sec
     gradient                   ...        0 min,  0.021 sec
 * total energy  :   -62.4551418 Eh     change       -0.4011141E-02 Eh
   gradient norm :     0.0196050 Eh/α   predicted    -0.3253099E-02 ( -18.90%)
   displ. norm   :     0.1958277 α      lambda       -0.1193049E-02
   maximum displ.:     0.1492224 α      in ANC's #3, #1, #15, ...

........................................................................
.............................. CYCLE    3 ..............................
........................................................................
   1    -62.9993664 -0.629994E+02  0.118E-01    3.15       0.0  T
   2    -62.9993767 -0.102878E-04  0.677E-02    3.15       1.0  T
   3    -62.9993521  0.246146E-04  0.394E-02    3.15       1.0  T
   4    -62.9993874 -0.353323E-04  0.114E-02    3.15       1.6  T
   5    -62.9993880 -0.656394E-06  0.497E-03    3.15       3.7  T
   6    -62.9993884 -0.366479E-06  0.153E-03    3.15      12.1  T
   7    -62.9993885 -0.494931E-07  0.472E-04    3.15      39.3  T
     SCC iter.                  ...        0 min,  0.012 sec
     gradient                   ...        0 min,  0.021 sec
 * total energy  :   -62.4558627 Eh     change       -0.7209745E-03 Eh
   gradient norm :     0.0051978 Eh/α   predicted    -0.6194100E-03 ( -14.09%)
   displ. norm   :     0.1800951 α      lambda       -0.3129822E-03
   maximum displ.:     0.1387109 α      in ANC's #3, #1, #8, ...

........................................................................
.............................. CYCLE    4 ..............................
........................................................................
   1    -62.9998391 -0.629998E+02  0.913E-02    3.14       0.0  T
   2    -62.9998417 -0.257273E-05  0.539E-02    3.14       1.0  T
   3    -62.9998371  0.459441E-05  0.159E-02    3.14       1.2  T
   4    -62.9998433 -0.614058E-05  0.505E-03    3.14       3.7  T
   5    -62.9998434 -0.177502E-06  0.174E-03    3.14      10.7  T
   6    -62.9998435 -0.430283E-07  0.669E-04    3.14      27.7  T
     SCC iter.                  ...        0 min,  0.011 sec
     gradient                   ...        0 min,  0.021 sec
 * total energy  :   -62.4561155 Eh     change       -0.2527421E-03 Eh
   gradient norm :     0.0045961 Eh/α   predicted    -0.1615826E-03 ( -36.07%)
   displ. norm   :     0.2797544 α      lambda       -0.3772606E-03
   maximum displ.:     0.1932432 α      in ANC's #3, #1, #8, ...

........................................................................
.............................. CYCLE    5 ..............................
........................................................................
   1    -62.9981983 -0.629982E+02  0.148E-01    3.13       0.0  T
   2    -62.9982048 -0.655546E-05  0.873E-02    3.13       1.0  T
   3    -62.9982077 -0.283080E-05  0.115E-02    3.13       1.6  T
   4    -62.9982076  0.111247E-06  0.643E-03    3.13       2.9  T
   5    -62.9982083 -0.780945E-06  0.196E-03    3.13       9.5  T
   6    -62.9982084 -0.737900E-07  0.740E-04    3.13      25.1  T
     SCC iter.                  ...        0 min,  0.011 sec
     gradient                   ...        0 min,  0.021 sec
 * total energy  :   -62.4564204 Eh     change       -0.3049456E-03 Eh
   gradient norm :     0.0056017 Eh/α   predicted    -0.2033930E-03 ( -33.30%)
   displ. norm   :     0.3610686 α      lambda       -0.3815654E-03
   maximum displ.:     0.2350047 α      in ANC's #3, #1, #8, ...

........................................................................
.............................. CYCLE    6 ..............................
........................................................................
   1    -62.9959391 -0.629959E+02  0.192E-01    3.11       0.0  T
   2    -62.9959499 -0.107817E-04  0.114E-01    3.11       1.0  T
   3    -62.9959486  0.129520E-05  0.207E-02    3.11       1.0  T
   4    -62.9959552 -0.663950E-05  0.988E-03    3.11       1.9  T
   5    -62.9959562 -0.948977E-06  0.262E-03    3.11       7.1  T
   6    -62.9959563 -0.859279E-07  0.909E-04    3.11      20.4  T
     SCC iter.                  ...        0 min,  0.010 sec
     gradient                   ...        0 min,  0.021 sec
 * total energy  :   -62.4566877 Eh     change       -0.2673077E-03 Eh
   gradient norm :     0.0076086 Eh/α   predicted    -0.2156673E-03 ( -19.32%)
   displ. norm   :     0.2718134 α      lambda       -0.2338537E-03
   maximum displ.:     0.1813300 α      in ANC's #3, #1, #8, ...

........................................................................
.............................. CYCLE    7 ..............................
........................................................................
   1    -62.9961154 -0.629961E+02  0.138E-01    3.10       0.0  T
   2    -62.9961208 -0.537009E-05  0.802E-02    3.10       1.0  T
   3    -62.9961146  0.619519E-05  0.219E-02    3.10       1.0  T
   4    -62.9961237 -0.907409E-05  0.808E-03    3.10       2.3  T
   5    -62.9961241 -0.436272E-06  0.186E-03    3.10      10.0  T
   6    -62.9961241 -0.400646E-07  0.737E-04    3.10      25.2  T
     SCC iter.                  ...        0 min,  0.010 sec
     gradient                   ...        0 min,  0.021 sec
 * total energy  :   -62.4568491 Eh     change       -0.1614196E-03 Eh
   gradient norm :     0.0064883 Eh/α   predicted    -0.1255864E-03 ( -22.20%)
   displ. norm   :     0.1620870 α      lambda       -0.1340145E-03
   maximum displ.:     0.0977645 α      in ANC's #3, #1, #8, ...

........................................................................
.............................. CYCLE    8 ..............................
........................................................................
   1    -62.9985166 -0.629985E+02  0.838E-02    3.10       0.0  T
   2    -62.9985194 -0.284682E-05  0.482E-02    3.10       1.0  T
   3    -62.9985128  0.658328E-05  0.205E-02    3.10       1.0  T
   4    -62.9985210 -0.820854E-05  0.539E-03    3.10       3.4  T
   5    -62.9985212 -0.170178E-06  0.181E-03    3.10      10.2  T
   6    -62.9985212 -0.228531E-07  0.622E-04    3.10      29.9  T
     SCC iter.                  ...        0 min,  0.011 sec
     gradient                   ...        0 min,  0.021 sec
 * total energy  :   -62.4569323 Eh     change       -0.8310658E-04 Eh
   gradient norm :     0.0028529 Eh/α   predicted    -0.6876979E-04 ( -17.25%)
   displ. norm   :     0.1034526 α      lambda       -0.3722657E-04
   maximum displ.:     0.0518412 α      in ANC's #1, #8, #3, ...

........................................................................
.............................. CYCLE    9 ..............................
........................................................................
   1    -62.9992649 -0.629993E+02  0.563E-02    3.10       0.0  T
   2    -62.9992662 -0.130203E-05  0.334E-02    3.10       1.0  T
   3    -62.9992646  0.163235E-05  0.111E-02    3.10       1.7  T
   4    -62.9992670 -0.238405E-05  0.329E-03    3.10       5.6  T
   5    -62.9992670 -0.765719E-07  0.899E-04    3.10      20.7  T
   6    -62.9992670 -0.619341E-08  0.378E-04    3.10      49.1  T
     SCC iter.                  ...        0 min,  0.010 sec
     gradient                   ...        0 min,  0.023 sec
 * total energy  :   -62.4569544 Eh     change       -0.2214917E-04 Eh
   gradient norm :     0.0023633 Eh/α   predicted    -0.1882141E-04 ( -15.02%)
   displ. norm   :     0.0299371 α      lambda       -0.1540928E-04
   maximum displ.:     0.0154268 α      in ANC's #8, #1, #5, ...

........................................................................
.............................. CYCLE   10 ..............................
........................................................................
   1    -62.9999552 -0.630000E+02  0.153E-02    3.10       0.0  T
   2    -62.9999555 -0.294169E-06  0.899E-03    3.10       2.1  T
   3    -62.9999553  0.194365E-06  0.428E-03    3.10       4.3  T
   4    -62.9999556 -0.262507E-06  0.147E-03    3.10      12.6  T
   5    -62.9999556 -0.350135E-07  0.437E-04    3.10      42.5  T
   6    -62.9999556 -0.108364E-08  0.146E-04    3.10     127.1  T
     SCC iter.                  ...        0 min,  0.010 sec
     gradient                   ...        0 min,  0.023 sec
 * total energy  :   -62.4569646 Eh     change       -0.1021950E-04 Eh
   gradient norm :     0.0012003 Eh/α   predicted    -0.7725278E-05 ( -24.41%)
   displ. norm   :     0.0740277 α      lambda       -0.1221001E-04
   maximum displ.:     0.0491669 α      in ANC's #8, #1, #7, ...

........................................................................
.............................. CYCLE   11 ..............................
........................................................................
   1    -62.9996386 -0.629996E+02  0.408E-02    3.09       0.0  T
   2    -62.9996395 -0.838258E-06  0.249E-02    3.09       1.0  T
   3    -62.9996391  0.390357E-06  0.637E-03    3.09       2.9  T
   4    -62.9996400 -0.873437E-06  0.196E-03    3.09       9.5  T
   5    -62.9996400 -0.458790E-07  0.559E-04    3.09      33.2  T
   6    -62.9996400 -0.126009E-08  0.242E-04    3.09      76.8  T
     SCC iter.                  ...        0 min,  0.010 sec
     gradient                   ...        0 min,  0.023 sec
 * total energy  :   -62.4569742 Eh     change       -0.9555400E-05 Eh
   gradient norm :     0.0017614 Eh/α   predicted    -0.6122435E-05 ( -35.93%)
   displ. norm   :     0.0254196 α      lambda       -0.5380035E-05
   maximum displ.:     0.0186101 α      in ANC's #3, #8, #1, ...

........................................................................
.............................. CYCLE   12 ..............................
........................................................................
   1    -62.9995395 -0.629995E+02  0.150E-02    3.09       0.0  T
   2    -62.9995396 -0.114480E-06  0.841E-03    3.09       2.2  T
   3    -62.9995393  0.241954E-06  0.403E-03    3.09       4.6  T
   4    -62.9995396 -0.299476E-06  0.111E-03    3.09      16.7  T
   5    -62.9995396 -0.681368E-08  0.401E-04    3.09      46.3  T
   6    -62.9995396 -0.112674E-08  0.135E-04    3.09     137.9  T
     SCC iter.                  ...        0 min,  0.010 sec
     gradient                   ...        0 min,  0.023 sec
 * total energy  :   -62.4569788 Eh     change       -0.4654749E-05 Eh
   gradient norm :     0.0010154 Eh/α   predicted    -0.2693880E-05 ( -42.13%)
   displ. norm   :     0.0266904 α      lambda       -0.3193118E-05
   maximum displ.:     0.0125006 α      in ANC's #8, #5, #3, ...

........................................................................
.............................. CYCLE   13 ..............................
........................................................................
   1    -62.9993718 -0.629994E+02  0.153E-02    3.09       0.0  T
   2    -62.9993719 -0.149332E-06  0.887E-03    3.09       2.1  T
   3    -62.9993717  0.169964E-06  0.356E-03    3.09       5.2  T
   4    -62.9993720 -0.230073E-06  0.120E-03    3.09      15.4  T
   5    -62.9993720 -0.159341E-07  0.443E-04    3.09      41.9  T
   6    -62.9993720 -0.168293E-08  0.198E-04    3.09      93.6  T
     SCC iter.                  ...        0 min,  0.010 sec
     gradient                   ...        0 min,  0.023 sec
 * total energy  :   -62.4569816 Eh     change       -0.2809676E-05 Eh
   gradient norm :     0.0007739 Eh/α   predicted    -0.1600974E-05 ( -43.02%)
   displ. norm   :     0.0270684 α      lambda        0.2115242E-05
   maximum displ.:     0.0125024 α      in ANC's #8, #5, #3, ...

   *** GEOMETRY OPTIMIZATION CONVERGED AFTER 13 ITERATIONS ***

------------------------------------------------------------------------
 total energy gain   :        -0.0058510 Eh       -3.6716 kcal/mol
 total RMSD          :         0.3097235 a0        0.1639 Å
 total power (kW/mol):        -1.1816830 (step)  -23.1951 (real)
------------------------------------------------------------------------

 ANCopt (total)                0 d,  0 h,  0 min,  0.662 sec
 optimizer setup                ...        0 min,  0.000 sec (  0.024%)
 model hessian                  ...        0 min,  0.016 sec (  2.449%)
 ANC generation                 ...        0 min,  0.001 sec (  0.139%)
 coordinate transformation      ...        0 min,  0.000 sec (  0.040%)
 single point calculation       ...        0 min,  0.640 sec ( 96.691%)
 optimization log               ...        0 min,  0.002 sec (  0.231%)
 hessian update                 ...        0 min,  0.000 sec (  0.028%)
 rational function              ...        0 min,  0.002 sec (  0.269%)

================
 final structure:
================
$coord
    2.87672404129519   -1.44775982837731    0.47116320563227      C 
    4.58796960122480    1.22759972378041   -0.11967573828578      S 
    1.85720509674135    2.95586860831519   -0.72753801877201      C 
   -0.25410032778007    1.46571215261018   -0.43835133690744      C 
    0.34319421502393   -1.05349998065177    0.24839426043801      C 
   -1.60430218039393   -3.04284703497999    0.77412233633106      C 
   -4.22613944786030   -2.28260456488480   -0.19047829564349      C 
   -4.43977060167262   -2.83224853409009   -3.01576934327446      C 
   -4.40957712702591   -5.32958779190076   -3.44651759462832      F 
   -6.61783326237587   -1.96261480126418   -3.99350286297005      F 
   -2.58657715778184   -1.84729777602051   -4.42121279788841      F 
   -4.84598550051418    0.50034003019100    0.36278221884598      C 
   -5.05210700658488    0.95195159410090    3.20690728743522      C 
   -6.50038068307760   -0.79335245033539    4.34951240240253      F 
   -2.84403048211356    0.95609975607847    4.43210824212340      F 
   -6.13202720606389    3.19627856426827    3.67870237283464      F 
   -2.92353973359463    2.33777356481490   -0.79236291617753      C 
    2.16896603212532    5.57947537517913   -1.38905161312936      C 
    0.49358407036997    7.10448378905797   -2.47735283726832      C 
    3.82411469166175   -3.16913231575915    0.96125799326696      H 
   -1.70737739746452   -3.36259074718591    2.81306093168012      H 
   -1.04138599214572   -4.83075847412317   -0.09251204451330      H 
   -5.66419045989888   -3.48478161039062    0.69436036987096      H 
   -6.73265514740636    0.93024091791365   -0.38037596510195      H 
   -3.16940732236442    4.20186325814639    0.06460231133624      H 
   -3.32081642476323    2.52399189815182   -2.81202046649906      H 
    4.03008076221796    6.31180655048644   -0.95393782328300      H 
   -1.35762852556017    6.50709189990887   -3.05370107531617      H 
    0.97096350665606    9.04145141319502   -2.87275188725874      H 
$end
           -------------------------------------------------
          |                Final Singlepoint                |
           -------------------------------------------------

          ...................................................
          :                      SETUP                      :
          :.................................................:
          :  # basis functions                  92          :
          :  # atomic orbitals                  91          :
          :  # shells                           49          :
          :  # electrons                       106          :
          :  max. iterations                   250          :
          :  Hamiltonian                  GFN2-xTB          :
          :  restarted?                      false          :
          :  GBSA solvation                  false          :
          :  PC potential                    false          :
          :  electronic temp.          300.0000000     K    :
          :  accuracy                    1.0000000          :
          :  -> integral cutoff          0.2500000E+02      :
          :  -> integral neglect         0.1000000E-07      :
          :  -> SCF convergence          0.1000000E-05 Eh   :
          :  -> wf. convergence          0.1000000E-03 e    :
          :  Broyden damping             0.4000000          :
          ...................................................

 iter      E             dE          RMSdq      gap      omega  full diag
   1    -62.9993720 -0.629994E+02  0.983E-05    3.09       0.0  T
   2    -62.9993720 -0.114042E-10  0.448E-05    3.09     414.2  T
   3    -62.9993720  0.768807E-11  0.368E-05    3.09     505.2  T

   *** convergence criteria satisfied after 3 iterations ***

         #    Occupation            Energy/Eh            Energy/eV
      -------------------------------------------------------------
         1        2.0000           -0.8954048             -24.3652
       ...           ...                  ...                  ...
        47        2.0000           -0.4735277             -12.8853
        48        2.0000           -0.4697165             -12.7816
        49        2.0000           -0.4600345             -12.5182
        50        2.0000           -0.4430156             -12.0551
        51        2.0000           -0.4419380             -12.0257
        52        2.0000           -0.4022245             -10.9451
        53        2.0000           -0.3868011             -10.5254 (HOMO)
        54                         -0.2730802              -7.4309 (LUMO)
        55                         -0.2146904              -5.8420
        56                         -0.2079730              -5.6592
        57                         -0.1613846              -4.3915
        58                         -0.1237910              -3.3685
       ...                                ...                  ...
        91                          0.6670081              18.1502
      -------------------------------------------------------------
                  HL-Gap            0.1137209 Eh            3.0945 eV
             Fermi-level           -0.3299406 Eh           -8.9781 eV

 SCC (total)                   0 d,  0 h,  0 min,  0.046 sec
 SCC setup                      ...        0 min,  0.000 sec (  0.566%)
 Dispersion                     ...        0 min,  0.000 sec (  0.553%)
 integral evaluation            ...        0 min,  0.016 sec ( 35.110%)
 zeroth order Hamiltonian       ...        0 min,  0.000 sec (  0.594%)
 iterations                     ...        0 min,  0.006 sec ( 12.840%)
 molecular gradient             ...        0 min,  0.023 sec ( 49.292%)
 printout                       ...        0 min,  0.000 sec (  0.933%)

         :::::::::::::::::::::::::::::::::::::::::::::::::::::
         ::                     SUMMARY                     ::
         :::::::::::::::::::::::::::::::::::::::::::::::::::::
         :: total energy             -62.456981610907 Eh    ::
         :: gradient norm              0.000773725886 Eh/a0 ::
         :: HOMO-LUMO gap              3.094503098140 eV    ::
         ::.................................................::
         :: SCC energy               -62.999371978018 Eh    ::
         :: -> isotropic ES            0.085225317614 Eh    ::
         :: -> anisotropic ES          0.001418298733 Eh    ::
         :: -> anisotropic XC         -0.023537878392 Eh    ::
         :: -> dispersion             -0.033111543929 Eh    ::
         :: repulsion energy           0.541864313341 Eh    ::
         :: add. restraining           0.000000000000 Eh    ::
         :::::::::::::::::::::::::::::::::::::::::::::::::::::

           -------------------------------------------------
          |                Property Printout                |
           -------------------------------------------------

    * Orbital Energies and Occupations

         #    Occupation            Energy/Eh            Energy/eV
      -------------------------------------------------------------
         1        2.0000           -0.8954048             -24.3652
       ...           ...                  ...                  ...
        41        2.0000           -0.5197310             -14.1426
        42        2.0000           -0.5120631             -13.9339
        43        2.0000           -0.5080530             -13.8248
        44        2.0000           -0.4889064             -13.3038
        45        2.0000           -0.4875718             -13.2675
        46        2.0000           -0.4809630             -13.0877
        47        2.0000           -0.4735277             -12.8853
        48        2.0000           -0.4697165             -12.7816
        49        2.0000           -0.4600345             -12.5182
        50        2.0000           -0.4430156             -12.0551
        51        2.0000           -0.4419380             -12.0257
        52        2.0000           -0.4022245             -10.9451
        53        2.0000           -0.3868011             -10.5254 (HOMO)
        54                         -0.2730802              -7.4309 (LUMO)
        55                         -0.2146904              -5.8420
        56                         -0.2079730              -5.6592
        57                         -0.1613846              -4.3915
        58                         -0.1237910              -3.3685
        59                         -0.0387506              -1.0545
        60                         -0.0172109              -0.4683
        61                         -0.0108229              -0.2945
        62                         -0.0060183              -0.1638
        63                          0.0070617               0.1922
        64                          0.0215372               0.5861
       ...                                ...                  ...
        91                          0.6670081              18.1502
      -------------------------------------------------------------
                  HL-Gap            0.1137209 Eh            3.0945 eV
             Fermi-level           -0.3299406 Eh           -8.9781 eV

     #   Z        covCN         q      C6AA      α(0)
     1   6 C      2.937    -0.033    28.823     8.805
     2  16 S      2.351    -0.007   141.346    20.010
     3   6 C      2.987     0.015    27.671     8.629
     4   6 C      3.157    -0.014    28.048     8.659
     5   6 C      3.166    -0.009    27.880     8.628
     6   6 C      3.809    -0.061    21.674     6.627
     7   6 C      3.857    -0.034    21.146     6.540
     8   6 C      3.333     0.485    17.347     6.603
     9   9 F      0.791    -0.204    11.271     3.966
    10   9 F      0.791    -0.210    11.336     3.977
    11   9 F      0.791    -0.195    11.188     3.951
    12   6 C      3.857    -0.035    21.163     6.543
    13   6 C      3.333     0.485    17.348     6.603
    14   9 F      0.791    -0.209    11.333     3.977
    15   9 F      0.791    -0.196    11.190     3.952
    16   9 F      0.791    -0.204    11.275     3.966
    17   6 C      3.808    -0.059    21.625     6.620
    18   6 C      2.938    -0.030    28.751     8.794
    19   6 C      2.838    -0.092    30.301     9.021
    20   1 H      0.926     0.050     2.319     2.381
    21   1 H      0.924     0.068     2.106     2.270
    22   1 H      0.924     0.063     2.167     2.302
    23   1 H      0.924     0.076     2.021     2.223
    24   1 H      0.924     0.076     2.024     2.225
    25   1 H      0.924     0.067     2.118     2.276
    26   1 H      0.924     0.068     2.107     2.270
    27   1 H      0.925     0.049     2.327     2.385
    28   1 H      0.926     0.044     2.401     2.423
    29   1 H      0.926     0.047     2.351     2.398

 Mol. C6AA /au·bohr⁶  :      11034.615038
 Mol. C8AA /au·bohr⁸  :     282607.418328
 Mol. α(0) /au        :        159.023908


Wiberg/Mayer (AO) data.
largest (>0.10) Wiberg bond orders for each atom
          total WBO             WBO to atom ...
     1  C   3.949        C    5 1.572    S    2 1.208    H   20 0.970    C    3 0.103
     2  S   2.630        C    1 1.208    C    3 1.140
     3  C   3.949        C    4 1.495    S    2 1.140    C   18 1.131    C    1 0.103
     4  C   3.982        C    3 1.495    C    5 1.255    C   17 1.011
     5  C   3.983        C    1 1.572    C    4 1.255    C    6 1.006
     6  C   3.988        C    5 1.006    C    7 0.989    H   22 0.965    H   21 0.959
     7  C   3.982        C    6 0.989    C   12 0.982    H   23 0.958    C    8 0.944
     8  C   3.830        F   11 0.958    F    9 0.950    C    7 0.944    F   10 0.944
     9  F   1.074        C    8 0.950
    10  F   1.068        C    8 0.944
    11  F   1.085        C    8 0.958
    12  C   3.981        C   17 0.987    C    7 0.982    H   24 0.958    C   13 0.944
    13  C   3.830        F   15 0.958    F   16 0.950    F   14 0.944    C   12 0.944
    14  F   1.069        C   13 0.944
    15  F   1.085        C   13 0.958
    16  F   1.073        C   13 0.950
    17  C   3.988        C    4 1.011    C   12 0.987    H   25 0.960    H   26 0.956
    18  C   3.990        C   19 1.866    C    3 1.131    H   27 0.961
    19  C   3.991        C   18 1.866    H   29 0.977    H   28 0.973
    20  H   0.997        C    1 0.970
    21  H   0.995        C    6 0.959
    22  H   0.996        C    6 0.965
    23  H   0.993        C    7 0.958
    24  H   0.994        C   12 0.958
    25  H   0.995        C   17 0.960
    26  H   0.995        C   17 0.956
    27  H   0.997        C   18 0.961
    28  H   0.998        C   19 0.973
    29  H   0.997        C   19 0.977

molecular dipole:
                 x           y           z       tot (Debye)
 q only:        0.553       0.227      -0.037
   full:        0.114       0.045      -0.012       0.313
molecular quadrupole (traceless):
                xx          xy          yy          xz          yz          zz
 q only:        0.144      -1.382       7.814       1.659      -8.424      -7.958
  q+dip:       -0.517      -2.248       8.760       2.677      -9.370      -8.243
   full:       -0.961      -2.306       8.650       2.142      -8.994      -7.689

           -------------------------------------------------
          |                Geometry Summary                 |
           -------------------------------------------------

      molecular mass/u    :      300.2614000
   center of mass at/Å    :       -1.0703134       0.1185638      -0.0806921
  moments of inertia/u·Å² :        0.1200946E+04   0.1701296E+04   0.2092263E+04
rotational constants/cm⁻¹ :        0.1403697E-01   0.9908702E-02   0.8057128E-02

 * 28 selected distances

     #   Z        #   Z                                     value/Å
     1   6 C      2  16 S                                 1.7094146
     2  16 S      3   6 C                                 1.7401393 (max)
     3   6 C      4   6 C                                 1.3760446
     1   6 C      5   6 C                                 1.3619341
     4   6 C      5   6 C                                 1.4174455
     6   6 C      7   6 C                                 1.5320987
     7   6 C      8   6 C                                 1.5272991
     8   6 C      9   9 F                                 1.3411443
     8   6 C     10   9 F                                 1.3445875
     8   6 C     11   9 F                                 1.3366022
     7   6 C     12   6 C                                 1.5369012
    12   6 C     13   6 C                                 1.5278005
    13   6 C     14   9 F                                 1.3438528
    13   6 C     15   9 F                                 1.3362891
    13   6 C     16   9 F                                 1.3414223
     4   6 C     17   6 C                                 1.4978355
    12   6 C     17   6 C                                 1.5342783
    18   6 C     19   6 C                                 1.3300105
     1   6 C     20   1 H                                 1.0716153 (min)
     6   6 C     21   1 H                                 1.0935075
     6   6 C     22   1 H                                 1.0927936
     7   6 C     23   1 H                                 1.0968352
    12   6 C     24   1 H                                 1.0968941
    17   6 C     25   1 H                                 1.0934486
    17   6 C     26   1 H                                 1.0936857
    18   6 C     27   1 H                                 1.0831188
    19   6 C     28   1 H                                 1.0735965
    19   6 C     29   1 H                                 1.0762059

 * 4 distinct bonds (by element types)

   Z      Z             #   av. dist./Å        max./Å        min./Å
   1 H    6 C          10     1.0871701     1.0968941     1.0716153
   6 C    6 C          10     1.4641648     1.5369012     1.3300105
   6 C    9 F           6     1.3406497     1.3445875     1.3362891
   6 C   16 S           2     1.7247769     1.7401393     1.7094146


optimized geometry written to: xtbopt.xyz


           -------------------------------------------------
          | TOTAL ENERGY              -62.456981610907 Eh   |
          | GRADIENT NORM               0.000773725886 Eh/α |
          | HOMO-LUMO GAP               3.094503098140 eV   |
           -------------------------------------------------

------------------------------------------------------------------------
 * finished run on 2021/05/19 at 11:01:00.904     
------------------------------------------------------------------------
 total:
 * wall-time:     0 d,  0 h,  0 min,  0.801 sec
 *  cpu-time:     0 d,  0 h,  0 min,  0.800 sec
 * ratio c/w:     0.999 speedup
 SCF:
 * wall-time:     0 d,  0 h,  0 min,  0.062 sec
 *  cpu-time:     0 d,  0 h,  0 min,  0.062 sec
 * ratio c/w:     1.000 speedup
 ANC optimizer:
 * wall-time:     0 d,  0 h,  0 min,  0.709 sec
 *  cpu-time:     0 d,  0 h,  0 min,  0.709 sec
 * ratio c/w:     1.000 speedup

