      -----------------------------------------------------------      
     |                   =====================                   |     
     |                           x T B                           |     
     |                   =====================                   |     
     |                         S. Grimme                         |     
     |          Mulliken Center for Theoretical Chemistry        |     
     |                    University of Bonn                     |     
     |                Version 6.2 RC2 (SAW190805)                |     
      -----------------------------------------------------------      

   This program is distributed in the hope that it will be useful,
   but WITHOUT ANY WARRANTY; without even the implied warranty of
   MERCHANTABILITY or FITNESS FOR A PARTICULAR PURPOSE.
   
   FOR NON-COMMERCIAL, ACADEMIA USE ONLY.
   
   Cite this work as:
   * S. Grimme, C. Bannwarth, P. Shushkov, J. Chem. Theory Comput., 2017,
     13, 1989-2009. DOI: 10.1021/acs.jctc.7b00118
   * C. Bannwarth, S. Ehlert and S. Grimme., J. Chem. Theory Comput., 2019,
     15, 1652-1671. DOI: 10.1021/acs.jctc.8b01176
   * P. Pracht, E. Caldeweyher, S. Ehlert, S. Grimme, ChemRxiv, 2019, preprint.
     DOI: 10.26434/chemrxiv.8326202.v1
   
   for DFT-D4:
   * E. Caldeweyher, C. Bannwarth and S. Grimme, J. Chem. Phys., 2017,
     147, 034112. DOI: 10.1063/1.4993215
   * E. Caldeweyher, S. Ehlert, A. Hansen, H. Neugebauer, S. Spicher,
     C. Bannwarth and S. Grimme, J. Chem. Phys., 2019, 150, 154122.
     DOI: 10.1063/1.5090222
   
   for sTDA-xTB:
   * S. Grimme and C. Bannwarth, J. Chem. Phys., 2016, 145, 054103.
     DOI: 10.1063/1.4959605
   
   in the mass-spec context:
   * V. Asgeirsson, C. Bauer and S. Grimme, Chem. Sci., 2017, 8, 4879.
     DOI: 10.1039/c7sc00601b
   
   for metadynamics refer to:
   * S. Grimme, J. Chem. Theory Comput., 2019, 155, 2847-2862
     DOI: 10.1021/acs.jctc.9b00143
   
   with help from (in alphabetical order)
   C. Bannwarth, F. Bohle, G. Brandenburg, E. Caldeweyher, M. Checinski,
   S. Dohm, S. Ehlert, S. Ehrlich, F. März, H. Neugebauer, J. Pisarek,
   P. Pracht, P. Shushkov, and S. Spicher.
   
 * started run on 2021/05/19 at 11:01:02.449     

           -------------------------------------------------
          |                Calculation Setup                |
           -------------------------------------------------

          program call               : /ihome/ghutchison/geoffh/xtb/xtb 881.xyz -opt
          hostname                   : smp-n83
          coordinate file            : 881.xyz
          omp threads                :                     1
          number of atoms            :                    19
          number of electrons        :                    76
          charge                     :                     0
          spin                       :                   0.0
          first test random number   :      0.52808695746930


########################################################################
# WARNING! Please study the warnings concerning your input carefully
#  - the use of '-opt' is discouraged, please use '--opt' next time
########################################################################

           ------------------------------------------------- 
          |                 G F N 2 - x T B                 |
          | Geometry, Frequencies, Noncovalent interactions |
          |            JCTC 2019 parametrisation            |
           ------------------------------------------------- 
             KAB for C  - Si     :                1.0500
             KAB for H  - Pd     :                0.9500
             k(s)              :                1.8500
             k(p)              :                2.2300
             k(d)              :                2.2300
             k(f)              :                2.0000
             kEN (H0ij)        :               -2.0000
             D4 a1             :                0.5200
             D4 a2             :                5.0000
             D4 s6             :                1.0000
             D4 s8             :                2.7000
             D4 s9             :                5.0000
             alphaj            :                2.0000

  Z AO/shell   Hii/eV     exponent
  1     Wed Apr 25 08:07:45 CEST 2018   EN: 2.200 GM2: 0.406  GM3: 0.0800  RAES: 1.40
     1s    -10.707211    1.230000
  6     Wed Apr 25 08:07:45 CEST 2018   EN: 2.550 GM2: 0.538  GM3: 0.1500  RAES: 3.00
     2s    -13.970922    2.096432
     2p    -10.063292    1.800000
  7     Wed Apr 25 08:07:45 CEST 2018   EN: 3.040 GM2: 0.461  GM3:-0.0640  RAES: 1.90
     2s    -16.686243    2.339881
     2p    -12.523956    2.014332
  9     Mon Apr 23 13:58:50 CEST 2018   EN: 3.980 GM2: 0.532  GM3: 0.1426  RAES: 2.40
     2s    -23.458179    2.416361
     2p    -15.746583    2.308399
 16     Tue Apr 24 11:44:34 CEST 2018   EN: 2.580 GM2: 0.340  GM3:-0.0502  RAES: 3.10
     3s    -20.029654    1.981333
     3p    -11.377694    2.025643
     3d     -0.420282    1.702555

           ------------------------------------------------- 
          |        Self-Consistent Charge Iterations        |
           ------------------------------------------------- 

          ...................................................
          :                      SETUP                      :
          :.................................................:
          :  # basis functions                  70          :
          :  # atomic orbitals                  69          :
          :  # shells                           35          :
          :  # electrons                        76          :
          :  max. iterations                   250          :
          :  Hamiltonian                  GFN2-xTB          :
          :  restarted?                      false          :
          :  GBSA solvation                  false          :
          :  PC potential                    false          :
          :  electronic temp.          300.0000000     K    :
          :  accuracy                    1.0000000          :
          :  -> integral cutoff          0.2500000E+02      :
          :  -> integral neglect         0.1000000E-07      :
          :  -> SCF convergence          0.1000000E-05 Eh   :
          :  -> wf. convergence          0.1000000E-03 e    :
          :  Broyden damping             0.4000000          :
          ...................................................

 iter      E             dE          RMSdq      gap      omega  full diag
   1    -44.1680798 -0.441681E+02  0.564E+00    2.16       0.0  T
   2    -44.2161627 -0.480829E-01  0.363E+00    2.14       1.0  T
   3    -44.1893639  0.267988E-01  0.244E+00    2.12       1.0  T
   4    -44.2478490 -0.584852E-01  0.769E-01    2.14       1.0  T
   5    -44.2561018 -0.825271E-02  0.232E-01    2.13       1.0  T
   6    -44.2565395 -0.437734E-03  0.134E-01    2.13       1.0  T
   7    -44.2567025 -0.163014E-03  0.503E-02    2.13       1.0  T
   8    -44.2567391 -0.365766E-04  0.208E-02    2.13       1.1  T
   9    -44.2567411 -0.197998E-05  0.722E-03    2.13       3.2  T
  10    -44.2567415 -0.442185E-06  0.312E-03    2.13       7.4  T
  11    -44.2567416 -0.675143E-07  0.121E-03    2.13      19.0  T
  12    -44.2567416 -0.118096E-08  0.581E-04    2.13      39.5  T
  13    -44.2567416 -0.193945E-08  0.300E-04    2.13      76.4  T

   *** convergence criteria satisfied after 13 iterations ***

         #    Occupation            Energy/Eh            Energy/eV
      -------------------------------------------------------------
         1        2.0000           -0.8742236             -23.7888
       ...           ...                  ...                  ...
        32        2.0000           -0.4818987             -13.1131
        33        2.0000           -0.4811875             -13.0938
        34        2.0000           -0.4728929             -12.8681
        35        2.0000           -0.4686476             -12.7526
        36        2.0000           -0.4375639             -11.9067
        37        2.0000           -0.4345908             -11.8258
        38        2.0000           -0.4048959             -11.0178 (HOMO)
        39                         -0.3267025              -8.8900 (LUMO)
        40                         -0.2846711              -7.7463
        41                         -0.2472114              -6.7270
        42                         -0.2327447              -6.3333
        43                         -0.2235533              -6.0832
       ...                                ...                  ...
        69                          1.0660209              29.0079
      -------------------------------------------------------------
                  HL-Gap            0.0781934 Eh            2.1277 eV
             Fermi-level           -0.3657992 Eh           -9.9539 eV

 SCC (total)                   0 d,  0 h,  0 min,  0.039 sec
 SCC setup                      ...        0 min,  0.000 sec (  0.758%)
 Dispersion                     ...        0 min,  0.000 sec (  0.711%)
 integral evaluation            ...        0 min,  0.010 sec ( 25.532%)
 zeroth order Hamiltonian       ...        0 min,  0.000 sec (  0.459%)
 iterations                     ...        0 min,  0.015 sec ( 38.251%)
 molecular gradient             ...        0 min,  0.013 sec ( 33.250%)
 printout                       ...        0 min,  0.000 sec (  0.898%)

         :::::::::::::::::::::::::::::::::::::::::::::::::::::
         ::                     SUMMARY                     ::
         :::::::::::::::::::::::::::::::::::::::::::::::::::::
         :: total energy             -43.757142617689 Eh    ::
         :: gradient norm              0.113499544691 Eh/a0 ::
         :: HOMO-LUMO gap              2.127749469750 eV    ::
         ::.................................................::
         :: SCC energy               -44.256741572356 Eh    ::
         :: -> isotropic ES            0.052572198468 Eh    ::
         :: -> anisotropic ES         -0.000350984564 Eh    ::
         :: -> anisotropic XC          0.010267769533 Eh    ::
         :: -> dispersion             -0.021731190815 Eh    ::
         :: repulsion energy           0.499551350045 Eh    ::
         :: add. restraining           0.000000000000 Eh    ::
         :::::::::::::::::::::::::::::::::::::::::::::::::::::

      ----------------------------------------------------------- 
     |                   =====================                   |
     |                        A N C O P T                        |
     |                   =====================                   |
     |               Approximate Normal Coordinate               |
     |                Rational Function Optimizer                |
      ----------------------------------------------------------- 

          ...................................................
          :                      SETUP                      :
          :.................................................:
          :   optimization level            normal          :
          :   max. optcycles                   200          :
          :   ANC micro-cycles                  20          :
          :   degrees of freedom                51          :
          :.................................................:
          :   RF solver                   davidson          :
          :   input Hessian                  false          :
          :   write xtbopt.log                true          :
          :   linear?                        false          :
          :   energy convergence         0.5000000E-05 Eh   :
          :   grad. convergence          0.1000000E-02 Eh/α :
          :   maximium RF displ.         2.0000000          :
          :   Hlow (freq-cutoff)         0.5000000E-02      :
          :   Hmax (freq-cutoff)         5.0000000          :
          :   S6 in model hess.         20.0000000          :
          ...................................................

generating ANC from model Hessian ...
Using Lindh-Hessian (1995)
 Shifting diagonal of input Hessian by   4.744390764127086E-003
 Lowest  eigenvalues of input Hessian
   -0.000000   -0.000000   -0.000000   -0.000000    0.000000    0.000000
    0.005000    0.007450    0.010393    0.014163    0.015437    0.016289
    0.021982    0.023858    0.025405    0.036596    0.046488    0.053269
 Highest eigenvalues
    1.650155    1.705640    1.847574    1.967784    2.051574    2.504321
 

........................................................................
.............................. CYCLE    1 ..............................
........................................................................
   1    -44.2567416 -0.442567E+02  0.123E-04    2.13       0.0  T
   2    -44.2567416 -0.251603E-10  0.817E-05    2.13     280.7  T
   3    -44.2567416 -0.203997E-10  0.593E-05    2.13     386.7  T
     SCC iter.                  ...        0 min,  0.004 sec
     gradient                   ...        0 min,  0.013 sec
 * total energy  :   -43.7571426 Eh     change        0.1812192E-07 Eh
   gradient norm :     0.1134994 Eh/α   predicted     0.0000000E+00 (-100.00%)
   displ. norm   :     0.2951560 α      lambda       -0.1921566E-01
   maximum displ.:     0.1380243 α      in ANC's #14, #22, #21, ...

........................................................................
.............................. CYCLE    2 ..............................
........................................................................
   1    -44.3032459 -0.443032E+02  0.286E-01    2.25       0.0  T
   2    -44.3033816 -0.135681E-03  0.189E-01    2.24       1.0  T
   3    -44.3034073 -0.257022E-04  0.115E-01    2.24       1.0  T
   4    -44.3035247 -0.117352E-03  0.397E-02    2.24       1.0  T
   5    -44.3035490 -0.243215E-04  0.105E-02    2.24       2.2  T
   6    -44.3035500 -0.101636E-05  0.515E-03    2.24       4.5  T
   7    -44.3035501 -0.103739E-06  0.310E-03    2.24       7.4  T
     SCC iter.                  ...        0 min,  0.008 sec
     gradient                   ...        0 min,  0.012 sec
 * total energy  :   -43.7702145 Eh     change       -0.1307193E-01 Eh
   gradient norm :     0.0527126 Eh/α   predicted    -0.1044484E-01 ( -20.10%)
   displ. norm   :     0.1791140 α      lambda       -0.4950906E-02
   maximum displ.:     0.0893360 α      in ANC's #14, #21, #22, ...

........................................................................
.............................. CYCLE    3 ..............................
........................................................................
   1    -44.3175907 -0.443176E+02  0.204E-01    2.34       0.0  T
   2    -44.3176569 -0.662051E-04  0.127E-01    2.34       1.0  T
   3    -44.3176482  0.867530E-05  0.741E-02    2.34       1.0  T
   4    -44.3177005 -0.523365E-04  0.266E-02    2.34       1.0  T
   5    -44.3177101 -0.952310E-05  0.938E-03    2.34       2.4  T
   6    -44.3177107 -0.677152E-06  0.424E-03    2.34       5.4  T
   7    -44.3177109 -0.160933E-06  0.198E-03    2.34      11.6  T
     SCC iter.                  ...        0 min,  0.008 sec
     gradient                   ...        0 min,  0.012 sec
 * total energy  :   -43.7726945 Eh     change       -0.2480006E-02 Eh
   gradient norm :     0.0131520 Eh/α   predicted    -0.2554887E-02 (   3.02%)
   displ. norm   :     0.0568895 α      lambda       -0.2194983E-03
   maximum displ.:     0.0288502 α      in ANC's #1, #4, #17, ...

........................................................................
.............................. CYCLE    4 ..............................
........................................................................
   1    -44.3165374 -0.443165E+02  0.923E-02    2.35       0.0  T
   2    -44.3165409 -0.354737E-05  0.521E-02    2.35       1.0  T
   3    -44.3165335  0.738409E-05  0.223E-02    2.34       1.0  T
   4    -44.3165432 -0.966299E-05  0.358E-03    2.35       6.4  T
   5    -44.3165433 -0.102055E-06  0.204E-03    2.35      11.2  T
   6    -44.3165433 -0.309808E-07  0.104E-03    2.35      22.0  T
     SCC iter.                  ...        0 min,  0.007 sec
     gradient                   ...        0 min,  0.012 sec
 * total energy  :   -43.7727618 Eh     change       -0.6728443E-04 Eh
   gradient norm :     0.0060306 Eh/α   predicted    -0.1101052E-03 (  63.64%)
   displ. norm   :     0.1104347 α      lambda       -0.3708693E-03
   maximum displ.:     0.0610755 α      in ANC's #1, #3, #4, ...

........................................................................
.............................. CYCLE    5 ..............................
........................................................................
   1    -44.3142066 -0.443142E+02  0.189E-01    2.35       0.0  T
   2    -44.3142193 -0.126847E-04  0.106E-01    2.35       1.0  T
   3    -44.3141884  0.309259E-04  0.445E-02    2.35       1.0  T
   4    -44.3142280 -0.396701E-04  0.667E-03    2.35       3.4  T
   5    -44.3142284 -0.368156E-06  0.378E-03    2.35       6.1  T
   6    -44.3142285 -0.951684E-07  0.180E-03    2.35      12.8  T
   7    -44.3142285 -0.169459E-07  0.723E-04    2.35      31.7  T
     SCC iter.                  ...        0 min,  0.008 sec
     gradient                   ...        0 min,  0.012 sec
 * total energy  :   -43.7725813 Eh     change        0.1805170E-03 Eh
   gradient norm :     0.0149526 Eh/α   predicted    -0.1876978E-03 (-203.98%)
   displ. norm   :     0.0700158 α      lambda       -0.4870866E-03
   maximum displ.:     0.0308683 α      in ANC's #1, #17, #3, ...

........................................................................
.............................. CYCLE    6 ..............................
........................................................................
   1    -44.3162427 -0.443162E+02  0.107E-01    2.35       0.0  T
   2    -44.3162480 -0.536731E-05  0.611E-02    2.35       1.0  T
   3    -44.3162360  0.120457E-04  0.285E-02    2.35       1.0  T
   4    -44.3162514 -0.154416E-04  0.521E-03    2.35       4.4  T
   5    -44.3162517 -0.263061E-06  0.287E-03    2.35       8.0  T
   6    -44.3162518 -0.685991E-07  0.146E-03    2.35      15.7  T
     SCC iter.                  ...        0 min,  0.007 sec
     gradient                   ...        0 min,  0.012 sec
 * total energy  :   -43.7728345 Eh     change       -0.2532166E-03 Eh
   gradient norm :     0.0012633 Eh/α   predicted    -0.2447438E-03 (  -3.35%)
   displ. norm   :     0.0077425 α      lambda       -0.1605525E-05
   maximum displ.:     0.0047541 α      in ANC's #2, #4, #1, ...

........................................................................
.............................. CYCLE    7 ..............................
........................................................................
   1    -44.3160588 -0.443161E+02  0.115E-02    2.35       0.0  T
   2    -44.3160589 -0.414956E-07  0.640E-03    2.35       3.6  T
   3    -44.3160587  0.194590E-06  0.360E-03    2.35       6.4  T
   4    -44.3160589 -0.225558E-06  0.613E-04    2.35      37.4  T
   5    -44.3160589 -0.352418E-08  0.334E-04    2.35      68.6  T
     SCC iter.                  ...        0 min,  0.006 sec
     gradient                   ...        0 min,  0.013 sec
 * total energy  :   -43.7728356 Eh     change       -0.1047986E-05 Eh
   gradient norm :     0.0005960 Eh/α   predicted    -0.8202620E-06 ( -21.73%)
   displ. norm   :     0.0045179 α      lambda       -0.3172621E-06
   maximum displ.:     0.0027305 α      in ANC's #3, #2, #4, ...

   *** GEOMETRY OPTIMIZATION CONVERGED AFTER 7 ITERATIONS ***

------------------------------------------------------------------------
 total energy gain   :        -0.0156930 Eh       -9.8475 kcal/mol
 total RMSD          :         0.1073148 a0        0.0568 Å
 total power (kW/mol):        -5.8859781 (step) -197.8129 (real)
------------------------------------------------------------------------

 ANCopt (total)                0 d,  0 h,  0 min,  0.208 sec
 optimizer setup                ...        0 min,  0.000 sec (  0.069%)
 model hessian                  ...        0 min,  0.002 sec (  1.092%)
 ANC generation                 ...        0 min,  0.001 sec (  0.250%)
 coordinate transformation      ...        0 min,  0.000 sec (  0.047%)
 single point calculation       ...        0 min,  0.203 sec ( 97.555%)
 optimization log               ...        0 min,  0.001 sec (  0.291%)
 hessian update                 ...        0 min,  0.000 sec (  0.037%)
 rational function              ...        0 min,  0.001 sec (  0.424%)

================
 final structure:
================
$coord
   -2.79845903509411   -2.24973737916634    0.29657311882930      C 
   -5.00781277204825    0.08657696289826    0.47722822402020      S 
   -2.78719076154430    2.41080482626189    0.31108699094366      C 
   -0.37964800901712    1.43694198226304    0.11879146073109      C 
   -0.38926268548708   -1.28852953343243    0.11052663333142      C 
    1.92213906853184   -2.62008574803028   -0.07674342207350      C 
    4.12426259691757   -1.29948301086440   -0.24636172663137      C 
    6.61498338431140   -2.64900665005536   -0.45124578853752      C 
    6.35655016301173   -5.17247926224291   -0.42442764032067      F 
    7.84557819703019   -2.08723447614882   -2.60001331892950      F 
    8.18679299689042   -2.07904117011911    1.45899696780471      F 
    4.14690672129638    1.40838468156449   -0.23971289517736      C 
    6.46320312331808    2.73398622628305   -0.42082764267870      C 
    8.30467278842469    3.86315237784969   -0.56245098762916      N 
    1.93564215301612    2.74747768024205   -0.05956090388255      C 
   -3.36292373300199   -4.19351924686025    0.33432960240183      H 
   -3.34094532611043    4.35746238229797    0.36053024111511      H 
    1.91459817120492   -4.65884518081895   -0.08322454655571      H 
    1.96020711811786    4.78686394869292   -0.05436325330415      H 
$end
           -------------------------------------------------
          |                Final Singlepoint                |
           -------------------------------------------------

          ...................................................
          :                      SETUP                      :
          :.................................................:
          :  # basis functions                  70          :
          :  # atomic orbitals                  69          :
          :  # shells                           35          :
          :  # electrons                        76          :
          :  max. iterations                   250          :
          :  Hamiltonian                  GFN2-xTB          :
          :  restarted?                      false          :
          :  GBSA solvation                  false          :
          :  PC potential                    false          :
          :  electronic temp.          300.0000000     K    :
          :  accuracy                    1.0000000          :
          :  -> integral cutoff          0.2500000E+02      :
          :  -> integral neglect         0.1000000E-07      :
          :  -> SCF convergence          0.1000000E-05 Eh   :
          :  -> wf. convergence          0.1000000E-03 e    :
          :  Broyden damping             0.4000000          :
          ...................................................

 iter      E             dE          RMSdq      gap      omega  full diag
   1    -44.3160589 -0.443161E+02  0.190E-04    2.35       0.0  T
   2    -44.3160589  0.393925E-10  0.116E-04    2.35     197.0  T
   3    -44.3160589 -0.234394E-09  0.854E-05    2.35     268.5  T

   *** convergence criteria satisfied after 3 iterations ***

         #    Occupation            Energy/Eh            Energy/eV
      -------------------------------------------------------------
         1        2.0000           -0.8799283             -23.9441
       ...           ...                  ...                  ...
        32        2.0000           -0.4853706             -13.2076
        33        2.0000           -0.4820696             -13.1178
        34        2.0000           -0.4668723             -12.7042
        35        2.0000           -0.4666538             -12.6983
        36        2.0000           -0.4381278             -11.9221
        37        2.0000           -0.4340760             -11.8118
        38        2.0000           -0.4080378             -11.1033 (HOMO)
        39                         -0.3216195              -8.7517 (LUMO)
        40                         -0.2779961              -7.5647
        41                         -0.2417785              -6.5791
        42                         -0.2317647              -6.3066
        43                         -0.2179498              -5.9307
       ...                                ...                  ...
        69                          1.1595155              31.5520
      -------------------------------------------------------------
                  HL-Gap            0.0864183 Eh            2.3516 eV
             Fermi-level           -0.3648286 Eh           -9.9275 eV

 SCC (total)                   0 d,  0 h,  0 min,  0.027 sec
 SCC setup                      ...        0 min,  0.000 sec (  0.653%)
 Dispersion                     ...        0 min,  0.000 sec (  0.593%)
 integral evaluation            ...        0 min,  0.010 sec ( 35.438%)
 zeroth order Hamiltonian       ...        0 min,  0.000 sec (  0.564%)
 iterations                     ...        0 min,  0.004 sec ( 14.430%)
 molecular gradient             ...        0 min,  0.013 sec ( 46.986%)
 printout                       ...        0 min,  0.000 sec (  1.131%)

         :::::::::::::::::::::::::::::::::::::::::::::::::::::
         ::                     SUMMARY                     ::
         :::::::::::::::::::::::::::::::::::::::::::::::::::::
         :: total energy             -43.772835563657 Eh    ::
         :: gradient norm              0.000598390137 Eh/a0 ::
         :: HOMO-LUMO gap              2.351560361007 eV    ::
         ::.................................................::
         :: SCC energy               -44.316058895726 Eh    ::
         :: -> isotropic ES            0.052441546678 Eh    ::
         :: -> anisotropic ES          0.000795620785 Eh    ::
         :: -> anisotropic XC          0.007046762352 Eh    ::
         :: -> dispersion             -0.021858733259 Eh    ::
         :: repulsion energy           0.543184107186 Eh    ::
         :: add. restraining           0.000000000000 Eh    ::
         :::::::::::::::::::::::::::::::::::::::::::::::::::::

           -------------------------------------------------
          |                Property Printout                |
           -------------------------------------------------

    * Orbital Energies and Occupations

         #    Occupation            Energy/Eh            Energy/eV
      -------------------------------------------------------------
         1        2.0000           -0.8799283             -23.9441
       ...           ...                  ...                  ...
        26        2.0000           -0.5293487             -14.4043
        27        2.0000           -0.5157487             -14.0342
        28        2.0000           -0.5147889             -14.0081
        29        2.0000           -0.5089155             -13.8483
        30        2.0000           -0.4999501             -13.6043
        31        2.0000           -0.4890419             -13.3075
        32        2.0000           -0.4853706             -13.2076
        33        2.0000           -0.4820696             -13.1178
        34        2.0000           -0.4668723             -12.7042
        35        2.0000           -0.4666538             -12.6983
        36        2.0000           -0.4381278             -11.9221
        37        2.0000           -0.4340760             -11.8118
        38        2.0000           -0.4080378             -11.1033 (HOMO)
        39                         -0.3216195              -8.7517 (LUMO)
        40                         -0.2779961              -7.5647
        41                         -0.2417785              -6.5791
        42                         -0.2317647              -6.3066
        43                         -0.2179498              -5.9307
        44                         -0.1786132              -4.8603
        45                         -0.1502157              -4.0876
        46                         -0.1150187              -3.1298
        47                         -0.0331056              -0.9008
        48                         -0.0056860              -0.1547
        49                          0.0056848               0.1547
       ...                                ...                  ...
        69                          1.1595155              31.5520
      -------------------------------------------------------------
                  HL-Gap            0.0864183 Eh            2.3516 eV
             Fermi-level           -0.3648286 Eh           -9.9275 eV

     #   Z        covCN         q      C6AA      α(0)
     1   6 C      2.928    -0.037    28.932     8.821
     2  16 S      2.315     0.083   137.694    19.750
     3   6 C      2.928    -0.038    28.939     8.822
     4   6 C      3.181     0.005    27.468     8.555
     5   6 C      3.184     0.006    27.431     8.548
     6   6 C      2.910    -0.024    28.593     8.768
     7   6 C      2.975    -0.025    28.628     8.777
     8   6 C      3.336     0.490    17.240     6.576
     9   9 F      0.791    -0.208    11.321     3.975
    10   9 F      0.791    -0.204    11.281     3.968
    11   9 F      0.791    -0.204    11.278     3.967
    12   6 C      2.969     0.022    27.515     8.604
    13   6 C      1.913     0.113    28.318     8.594
    14   7 N      0.911    -0.205    25.454     7.297
    15   6 C      2.922    -0.019    28.471     8.750
    16   1 H      0.926     0.062     2.176     2.307
    17   1 H      0.926     0.061     2.185     2.312
    18   1 H      0.926     0.065     2.145     2.290
    19   1 H      0.926     0.057     2.232     2.336

 Mol. C6AA /au·bohr⁶  :       7116.544902
 Mol. C8AA /au·bohr⁸  :     198792.175614
 Mol. α(0) /au        :        133.015708


Wiberg/Mayer (AO) data.
largest (>0.10) Wiberg bond orders for each atom
          total WBO             WBO to atom ...
     1  C   3.941        C    5 1.466    S    2 1.262    H   16 0.969    C    3 0.142
     2  S   2.773        C    3 1.267    C    1 1.262
     3  C   3.931        C    4 1.452    S    2 1.267    H   17 0.969    C    1 0.142
     4  C   3.989        C    3 1.452    C   15 1.241    C    5 1.146
     5  C   3.982        C    1 1.466    C    6 1.223    C    4 1.146
     6  C   3.989        C    7 1.594    C    5 1.223    H   18 0.963    C   15 0.101
     7  C   3.973        C    6 1.594    C   12 1.182    C    8 0.951
     8  C   3.825        C    7 0.951    F    9 0.947    F   11 0.946    F   10 0.946
     9  F   1.070        C    8 0.947
    10  F   1.073        C    8 0.946
    11  F   1.074        C    8 0.946
    12  C   3.989        C   15 1.516    C    7 1.182    C   13 1.092
    13  C   3.949        N   14 2.812    C   12 1.092
    14  N   2.984        C   13 2.812
    15  C   3.990        C   12 1.516    C    4 1.241    H   19 0.966    C    6 0.101
    16  H   0.996        C    1 0.969
    17  H   0.996        C    3 0.969
    18  H   0.994        C    6 0.963
    19  H   0.996        C   15 0.966

molecular dipole:
                 x           y           z       tot (Debye)
 q only:       -2.815       0.203       0.225
   full:       -3.017      -0.047       0.240       7.693
molecular quadrupole (traceless):
                xx          xy          yy          xz          yz          zz
 q only:      -17.726       1.088       8.807       1.793      -0.067       8.919
  q+dip:      -23.078      -2.912      13.871       2.202       0.236       9.207
   full:      -25.693      -3.890      12.806       2.701       0.297      12.888

           -------------------------------------------------
          |                Geometry Summary                 |
           -------------------------------------------------

      molecular mass/u    :      227.2035000
   center of mass at/Å    :        1.4084263      -0.2624080      -0.0690676
  moments of inertia/u·Å² :        0.4369591E+03   0.1506815E+04   0.1855502E+04
rotational constants/cm⁻¹ :        0.3857943E-01   0.1118759E-01   0.9085212E-02

 * 18 selected distances

     #   Z        #   Z                                     value/Å
     1   6 C      2  16 S                                 1.7042667 (max)
     2  16 S      3   6 C                                 1.7033262
     3   6 C      4   6 C                                 1.3780622
     1   6 C      5   6 C                                 1.3761418
     4   6 C      5   6 C                                 1.4422732
     5   6 C      6   6 C                                 1.4150610
     6   6 C      7   6 C                                 1.3617562
     8   6 C      9   9 F                                 1.3424238
     8   6 C     10   9 F                                 1.3436470
     8   6 C     11   9 F                                 1.3433677
     7   6 C     12   6 C                                 1.4329964
    13   6 C     14   7 N                                 1.1455293
     4   6 C     15   6 C                                 1.4110174
    12   6 C     15   6 C                                 1.3713061
     1   6 C     16   1 H                                 1.0712846 (min)
     3   6 C     17   1 H                                 1.0713147
     6   6 C     18   1 H                                 1.0788780
    15   6 C     19   1 H                                 1.0792786

 * 5 distinct bonds (by element types)

   Z      Z             #   av. dist./Å        max./Å        min./Å
   1 H    6 C           4     1.0751890     1.0792786     1.0712846
   6 C    6 C           8     1.3985768     1.4422732     1.3617562
   6 C    7 N           1     1.1455293     1.1455293     1.1455293
   6 C    9 F           3     1.3431462     1.3436470     1.3424238
   6 C   16 S           2     1.7037964     1.7042667     1.7033262


optimized geometry written to: xtbopt.xyz


           -------------------------------------------------
          | TOTAL ENERGY              -43.772835563657 Eh   |
          | GRADIENT NORM               0.000598390137 Eh/α |
          | HOMO-LUMO GAP               2.351560361007 eV   |
           -------------------------------------------------

------------------------------------------------------------------------
 * finished run on 2021/05/19 at 11:01:02.772     
------------------------------------------------------------------------
 total:
 * wall-time:     0 d,  0 h,  0 min,  0.323 sec
 *  cpu-time:     0 d,  0 h,  0 min,  0.297 sec
 * ratio c/w:     0.919 speedup
 SCF:
 * wall-time:     0 d,  0 h,  0 min,  0.039 sec
 *  cpu-time:     0 d,  0 h,  0 min,  0.039 sec
 * ratio c/w:     1.000 speedup
 ANC optimizer:
 * wall-time:     0 d,  0 h,  0 min,  0.236 sec
 *  cpu-time:     0 d,  0 h,  0 min,  0.236 sec
 * ratio c/w:     1.000 speedup

