      -----------------------------------------------------------      
     |                   =====================                   |     
     |                           x T B                           |     
     |                   =====================                   |     
     |                         S. Grimme                         |     
     |          Mulliken Center for Theoretical Chemistry        |     
     |                    University of Bonn                     |     
     |                Version 6.2 RC2 (SAW190805)                |     
      -----------------------------------------------------------      

   This program is distributed in the hope that it will be useful,
   but WITHOUT ANY WARRANTY; without even the implied warranty of
   MERCHANTABILITY or FITNESS FOR A PARTICULAR PURPOSE.
   
   FOR NON-COMMERCIAL, ACADEMIA USE ONLY.
   
   Cite this work as:
   * S. Grimme, C. Bannwarth, P. Shushkov, J. Chem. Theory Comput., 2017,
     13, 1989-2009. DOI: 10.1021/acs.jctc.7b00118
   * C. Bannwarth, S. Ehlert and S. Grimme., J. Chem. Theory Comput., 2019,
     15, 1652-1671. DOI: 10.1021/acs.jctc.8b01176
   * P. Pracht, E. Caldeweyher, S. Ehlert, S. Grimme, ChemRxiv, 2019, preprint.
     DOI: 10.26434/chemrxiv.8326202.v1
   
   for DFT-D4:
   * E. Caldeweyher, C. Bannwarth and S. Grimme, J. Chem. Phys., 2017,
     147, 034112. DOI: 10.1063/1.4993215
   * E. Caldeweyher, S. Ehlert, A. Hansen, H. Neugebauer, S. Spicher,
     C. Bannwarth and S. Grimme, J. Chem. Phys., 2019, 150, 154122.
     DOI: 10.1063/1.5090222
   
   for sTDA-xTB:
   * S. Grimme and C. Bannwarth, J. Chem. Phys., 2016, 145, 054103.
     DOI: 10.1063/1.4959605
   
   in the mass-spec context:
   * V. Asgeirsson, C. Bauer and S. Grimme, Chem. Sci., 2017, 8, 4879.
     DOI: 10.1039/c7sc00601b
   
   for metadynamics refer to:
   * S. Grimme, J. Chem. Theory Comput., 2019, 155, 2847-2862
     DOI: 10.1021/acs.jctc.9b00143
   
   with help from (in alphabetical order)
   C. Bannwarth, F. Bohle, G. Brandenburg, E. Caldeweyher, M. Checinski,
   S. Dohm, S. Ehlert, S. Ehrlich, F. März, H. Neugebauer, J. Pisarek,
   P. Pracht, P. Shushkov, and S. Spicher.
   
 * started run on 2021/05/19 at 11:01:02.829     

           -------------------------------------------------
          |                Calculation Setup                |
           -------------------------------------------------

          program call               : /ihome/ghutchison/geoffh/xtb/xtb 882.xyz -opt
          hostname                   : smp-n83
          coordinate file            : 882.xyz
          omp threads                :                     1
          number of atoms            :                    30
          number of electrons        :                    82
          charge                     :                     0
          spin                       :                   0.0
          first test random number   :      0.07462633137742


########################################################################
# WARNING! Please study the warnings concerning your input carefully
#  - the use of '-opt' is discouraged, please use '--opt' next time
########################################################################

           ------------------------------------------------- 
          |                 G F N 2 - x T B                 |
          | Geometry, Frequencies, Noncovalent interactions |
          |            JCTC 2019 parametrisation            |
           ------------------------------------------------- 
             KAB for C  - Si     :                1.0500
             KAB for H  - Pd     :                0.9500
             k(s)              :                1.8500
             k(p)              :                2.2300
             k(d)              :                2.2300
             k(f)              :                2.0000
             kEN (H0ij)        :               -2.0000
             D4 a1             :                0.5200
             D4 a2             :                5.0000
             D4 s6             :                1.0000
             D4 s8             :                2.7000
             D4 s9             :                5.0000
             alphaj            :                2.0000

  Z AO/shell   Hii/eV     exponent
  1     Wed Apr 25 08:07:45 CEST 2018   EN: 2.200 GM2: 0.406  GM3: 0.0800  RAES: 1.40
     1s    -10.707211    1.230000
  6     Wed Apr 25 08:07:45 CEST 2018   EN: 2.550 GM2: 0.538  GM3: 0.1500  RAES: 3.00
     2s    -13.970922    2.096432
     2p    -10.063292    1.800000
 16     Tue Apr 24 11:44:34 CEST 2018   EN: 2.580 GM2: 0.340  GM3:-0.0502  RAES: 3.10
     3s    -20.029654    1.981333
     3p    -11.377694    2.025643
     3d     -0.420282    1.702555

           ------------------------------------------------- 
          |        Self-Consistent Charge Iterations        |
           ------------------------------------------------- 

          ...................................................
          :                      SETUP                      :
          :.................................................:
          :  # basis functions                  90          :
          :  # atomic orbitals                  88          :
          :  # shells                           48          :
          :  # electrons                        82          :
          :  max. iterations                   250          :
          :  Hamiltonian                  GFN2-xTB          :
          :  restarted?                      false          :
          :  GBSA solvation                  false          :
          :  PC potential                    false          :
          :  electronic temp.          300.0000000     K    :
          :  accuracy                    1.0000000          :
          :  -> integral cutoff          0.2500000E+02      :
          :  -> integral neglect         0.1000000E-07      :
          :  -> SCF convergence          0.1000000E-05 Eh   :
          :  -> wf. convergence          0.1000000E-03 e    :
          :  Broyden damping             0.4000000          :
          ...................................................

 iter      E             dE          RMSdq      gap      omega  full diag
   1    -44.2267431 -0.442267E+02  0.418E+00    2.67       0.0  T
   2    -44.2617536 -0.350104E-01  0.239E+00    2.45       1.0  T
   3    -44.2384114  0.233422E-01  0.126E+00    2.55       1.0  T
   4    -44.2692016 -0.307902E-01  0.479E-01    2.45       1.0  T
   5    -44.2715481 -0.234651E-02  0.129E-01    2.48       1.0  T
   6    -44.2715664 -0.183370E-04  0.456E-02    2.47       1.0  T
   7    -44.2715998 -0.333694E-04  0.161E-02    2.47       1.1  T
   8    -44.2715996  0.207973E-06  0.676E-03    2.47       2.7  T
   9    -44.2716002 -0.573076E-06  0.302E-03    2.47       6.0  T
  10    -44.2716002 -0.261318E-07  0.200E-03    2.47       9.1  T
  11    -44.2716003 -0.604778E-07  0.803E-04    2.47      22.7  T
  12    -44.2716003 -0.533898E-08  0.257E-04    2.47      71.0  T

   *** convergence criteria satisfied after 12 iterations ***

         #    Occupation            Energy/Eh            Energy/eV
      -------------------------------------------------------------
         1        2.0000           -0.7263265             -19.7643
       ...           ...                  ...                  ...
        35        2.0000           -0.4278594             -11.6426
        36        2.0000           -0.4261499             -11.5961
        37        2.0000           -0.4177921             -11.3687
        38        2.0000           -0.4150612             -11.2944
        39        2.0000           -0.3909536             -10.6384
        40        2.0000           -0.3908937             -10.6368
        41        2.0000           -0.3548172              -9.6551 (HOMO)
        42                         -0.2639477              -7.1824 (LUMO)
        43                         -0.2286536              -6.2220
        44                         -0.2189821              -5.9588
        45                         -0.1946796              -5.2975
        46                         -0.1938096              -5.2738
       ...                                ...                  ...
        88                          0.7112741              19.3548
      -------------------------------------------------------------
                  HL-Gap            0.0908695 Eh            2.4727 eV
             Fermi-level           -0.3093825 Eh           -8.4187 eV

 SCC (total)                   0 d,  0 h,  0 min,  0.060 sec
 SCC setup                      ...        0 min,  0.000 sec (  0.644%)
 Dispersion                     ...        0 min,  0.001 sec (  0.854%)
 integral evaluation            ...        0 min,  0.016 sec ( 25.977%)
 zeroth order Hamiltonian       ...        0 min,  0.000 sec (  0.487%)
 iterations                     ...        0 min,  0.021 sec ( 34.254%)
 molecular gradient             ...        0 min,  0.022 sec ( 36.927%)
 printout                       ...        0 min,  0.000 sec (  0.761%)

         :::::::::::::::::::::::::::::::::::::::::::::::::::::
         ::                     SUMMARY                     ::
         :::::::::::::::::::::::::::::::::::::::::::::::::::::
         :: total energy             -43.621180388476 Eh    ::
         :: gradient norm              0.088794357386 Eh/a0 ::
         :: HOMO-LUMO gap              2.472685053056 eV    ::
         ::.................................................::
         :: SCC energy               -44.271600256383 Eh    ::
         :: -> isotropic ES            0.003244855824 Eh    ::
         :: -> anisotropic ES          0.005480962961 Eh    ::
         :: -> anisotropic XC          0.021557789708 Eh    ::
         :: -> dispersion             -0.036060271864 Eh    ::
         :: repulsion energy           0.650040908050 Eh    ::
         :: add. restraining           0.000000000000 Eh    ::
         :::::::::::::::::::::::::::::::::::::::::::::::::::::

      ----------------------------------------------------------- 
     |                   =====================                   |
     |                        A N C O P T                        |
     |                   =====================                   |
     |               Approximate Normal Coordinate               |
     |                Rational Function Optimizer                |
      ----------------------------------------------------------- 

          ...................................................
          :                      SETUP                      :
          :.................................................:
          :   optimization level            normal          :
          :   max. optcycles                   200          :
          :   ANC micro-cycles                  20          :
          :   degrees of freedom                84          :
          :.................................................:
          :   RF solver                   davidson          :
          :   input Hessian                  false          :
          :   write xtbopt.log                true          :
          :   linear?                        false          :
          :   energy convergence         0.5000000E-05 Eh   :
          :   grad. convergence          0.1000000E-02 Eh/α :
          :   maximium RF displ.         2.0000000          :
          :   Hlow (freq-cutoff)         0.5000000E-02      :
          :   Hmax (freq-cutoff)         5.0000000          :
          :   S6 in model hess.         20.0000000          :
          ...................................................

generating ANC from model Hessian ...
Using Lindh-Hessian (1995)
 Shifting diagonal of input Hessian by   4.350883549414661E-003
 Lowest  eigenvalues of input Hessian
   -0.000000   -0.000000    0.000000    0.000000    0.000000    0.000000
    0.005000    0.006327    0.006350    0.006967    0.007919    0.009839
    0.010276    0.011155    0.013548    0.016269    0.017648    0.018256
 Highest eigenvalues
    1.716430    1.735323    1.753173    1.860117    1.888661    1.975199
 

........................................................................
.............................. CYCLE    1 ..............................
........................................................................
   1    -44.2716003 -0.442716E+02  0.117E-04    2.47       0.0  T
   2    -44.2716003 -0.629257E-10  0.864E-05    2.47     211.2  T
   3    -44.2716003 -0.151893E-09  0.409E-05    2.47     446.5  T
     SCC iter.                  ...        0 min,  0.006 sec
     gradient                   ...        0 min,  0.022 sec
 * total energy  :   -43.6211804 Eh     change       -0.8633947E-08 Eh
   gradient norm :     0.0887944 Eh/α   predicted     0.0000000E+00 (-100.00%)
   displ. norm   :     0.3339078 α      lambda       -0.1445952E-01
   maximum displ.:     0.2339372 α      in ANC's #22, #35, #31, ...

........................................................................
.............................. CYCLE    2 ..............................
........................................................................
   1    -44.3073633 -0.443074E+02  0.258E-01    2.59       0.0  T
   2    -44.3074480 -0.846725E-04  0.138E-01    2.59       1.0  T
   3    -44.3074097  0.383102E-04  0.880E-02    2.58       1.0  T
   4    -44.3075478 -0.138129E-03  0.268E-02    2.59       1.0  T
   5    -44.3075524 -0.460072E-05  0.119E-02    2.59       1.5  T
   6    -44.3075536 -0.122032E-05  0.286E-03    2.59       6.4  T
   7    -44.3075537 -0.972639E-07  0.788E-04    2.59      23.2  T
     SCC iter.                  ...        0 min,  0.011 sec
     gradient                   ...        0 min,  0.021 sec
 * total energy  :   -43.6306302 Eh     change       -0.9449763E-02 Eh
   gradient norm :     0.0328605 Eh/α   predicted    -0.8035841E-02 ( -14.96%)
   displ. norm   :     0.1624363 α      lambda       -0.2147193E-02
   maximum displ.:     0.1024362 α      in ANC's #22, #7, #10, ...

........................................................................
.............................. CYCLE    3 ..............................
........................................................................
   1    -44.3213912 -0.443214E+02  0.131E-01    2.63       0.0  T
   2    -44.3214236 -0.324404E-04  0.698E-02    2.63       1.0  T
   3    -44.3214218  0.178628E-05  0.438E-02    2.63       1.0  T
   4    -44.3214531 -0.312850E-04  0.141E-02    2.63       1.3  T
   5    -44.3214546 -0.153362E-05  0.587E-03    2.63       3.1  T
   6    -44.3214548 -0.201101E-06  0.192E-03    2.63       9.5  T
     SCC iter.                  ...        0 min,  0.010 sec
     gradient                   ...        0 min,  0.021 sec
 * total energy  :   -43.6317760 Eh     change       -0.1145837E-02 Eh
   gradient norm :     0.0083589 Eh/α   predicted    -0.1101933E-02 (  -3.83%)
   displ. norm   :     0.0631121 α      lambda       -0.1214380E-03
   maximum displ.:     0.0374026 α      in ANC's #7, #4, #11, ...

........................................................................
.............................. CYCLE    4 ..............................
........................................................................
   1    -44.3208632 -0.443209E+02  0.381E-02    2.63       0.0  T
   2    -44.3208651 -0.190190E-05  0.204E-02    2.63       1.0  T
   3    -44.3208636  0.153859E-05  0.129E-02    2.63       1.4  T
   4    -44.3208664 -0.278815E-05  0.366E-03    2.63       5.0  T
   5    -44.3208665 -0.119679E-06  0.141E-03    2.63      13.0  T
   6    -44.3208665 -0.103961E-07  0.459E-04    2.63      39.8  T
     SCC iter.                  ...        0 min,  0.010 sec
     gradient                   ...        0 min,  0.021 sec
 * total energy  :   -43.6318689 Eh     change       -0.9290282E-04 Eh
   gradient norm :     0.0045873 Eh/α   predicted    -0.6096293E-04 ( -34.38%)
   displ. norm   :     0.0893446 α      lambda       -0.9344565E-04
   maximum displ.:     0.0577212 α      in ANC's #4, #7, #3, ...

........................................................................
.............................. CYCLE    5 ..............................
........................................................................
   1    -44.3196712 -0.443197E+02  0.529E-02    2.63       0.0  T
   2    -44.3196742 -0.304781E-05  0.279E-02    2.62       1.0  T
   3    -44.3196711  0.310691E-05  0.158E-02    2.62       1.2  T
   4    -44.3196757 -0.452405E-05  0.480E-03    2.62       3.8  T
   5    -44.3196759 -0.217277E-06  0.182E-03    2.62      10.0  T
   6    -44.3196759 -0.132190E-07  0.546E-04    2.62      33.5  T
     SCC iter.                  ...        0 min,  0.010 sec
     gradient                   ...        0 min,  0.021 sec
 * total energy  :   -43.6319232 Eh     change       -0.5426441E-04 Eh
   gradient norm :     0.0011164 Eh/α   predicted    -0.4709588E-04 ( -13.21%)
   displ. norm   :     0.0615254 α      lambda       -0.1233840E-04
   maximum displ.:     0.0386805 α      in ANC's #4, #3, #1, ...

........................................................................
.............................. CYCLE    6 ..............................
........................................................................
   1    -44.3195955 -0.443196E+02  0.319E-02    2.63       0.0  T
   2    -44.3195961 -0.538122E-06  0.167E-02    2.62       1.1  T
   3    -44.3195955  0.526649E-06  0.613E-03    2.62       3.0  T
   4    -44.3195962 -0.660153E-06  0.256E-03    2.62       7.1  T
   5    -44.3195963 -0.557172E-07  0.810E-04    2.62      22.6  T
   6    -44.3195963 -0.405288E-08  0.207E-04    2.62      88.0  T
     SCC iter.                  ...        0 min,  0.010 sec
     gradient                   ...        0 min,  0.022 sec
 * total energy  :   -43.6319363 Eh     change       -0.1316852E-04 Eh
   gradient norm :     0.0014236 Eh/α   predicted    -0.6186516E-05 ( -53.02%)
   displ. norm   :     0.0710644 α      lambda       -0.1165357E-04
   maximum displ.:     0.0420968 α      in ANC's #3, #4, #1, ...

........................................................................
.............................. CYCLE    7 ..............................
........................................................................
   1    -44.3198874 -0.443199E+02  0.305E-02    2.63       0.0  T
   2    -44.3198876 -0.232383E-06  0.165E-02    2.63       1.1  T
   3    -44.3198876 -0.275918E-07  0.292E-03    2.63       6.3  T
   4    -44.3198876  0.368530E-09  0.165E-03    2.63      11.0  T
   5    -44.3198877 -0.364961E-07  0.305E-04    2.63      59.8  T
   6    -44.3198877 -0.356735E-09  0.210E-04    2.63      86.8  T
     SCC iter.                  ...        0 min,  0.010 sec
     gradient                   ...        0 min,  0.022 sec
 * total energy  :   -43.6319502 Eh     change       -0.1390491E-04 Eh
   gradient norm :     0.0013075 Eh/α   predicted    -0.5841482E-05 ( -57.99%)
   displ. norm   :     0.1066417 α      lambda       -0.1322584E-04
   maximum displ.:     0.0646925 α      in ANC's #3, #4, #1, ...

........................................................................
.............................. CYCLE    8 ..............................
........................................................................
   1    -44.3199875 -0.443200E+02  0.405E-02    2.62       0.0  T
   2    -44.3199878 -0.327370E-06  0.226E-02    2.63       1.0  T
   3    -44.3199879 -0.828167E-08  0.369E-03    2.63       4.9  T
   4    -44.3199878  0.880075E-08  0.225E-03    2.63       8.1  T
   5    -44.3199879 -0.842823E-07  0.664E-04    2.63      27.5  T
   6    -44.3199879 -0.601552E-08  0.275E-04    2.63      66.4  T
     SCC iter.                  ...        0 min,  0.010 sec
     gradient                   ...        0 min,  0.022 sec
 * total energy  :   -43.6319655 Eh     change       -0.1527983E-04 Eh
   gradient norm :     0.0010836 Eh/α   predicted    -0.6649343E-05 ( -56.48%)
   displ. norm   :     0.1086617 α      lambda       -0.1074083E-04
   maximum displ.:     0.0689867 α      in ANC's #3, #1, #2, ...

........................................................................
.............................. CYCLE    9 ..............................
........................................................................
   1    -44.3201135 -0.443201E+02  0.377E-02    2.62       0.0  T
   2    -44.3201137 -0.191860E-06  0.217E-02    2.63       1.0  T
   3    -44.3201137  0.185132E-07  0.304E-03    2.63       6.0  T
   4    -44.3201138 -0.338731E-07  0.169E-03    2.63      10.8  T
   5    -44.3201138 -0.389627E-07  0.576E-04    2.63      31.7  T
   6    -44.3201138 -0.455590E-08  0.234E-04    2.63      78.1  T
     SCC iter.                  ...        0 min,  0.010 sec
     gradient                   ...        0 min,  0.022 sec
 * total energy  :   -43.6319776 Eh     change       -0.1206938E-04 Eh
   gradient norm :     0.0008041 Eh/α   predicted    -0.5399520E-05 ( -55.26%)
   displ. norm   :     0.0919103 α      lambda       -0.8168152E-05
   maximum displ.:     0.0624025 α      in ANC's #3, #1, #2, ...

........................................................................
.............................. CYCLE   10 ..............................
........................................................................
   1    -44.3202925 -0.443203E+02  0.289E-02    2.62       0.0  T
   2    -44.3202926 -0.801829E-07  0.170E-02    2.62       1.1  T
   3    -44.3202925  0.859688E-07  0.245E-03    2.62       7.5  T
   4    -44.3202926 -0.105931E-06  0.901E-04    2.62      20.3  T
   5    -44.3202926 -0.875395E-08  0.482E-04    2.62      37.9  T
     SCC iter.                  ...        0 min,  0.008 sec
     gradient                   ...        0 min,  0.022 sec
 * total energy  :   -43.6319872 Eh     change       -0.9633130E-05 Eh
   gradient norm :     0.0006740 Eh/α   predicted    -0.4101291E-05 ( -57.43%)
   displ. norm   :     0.0925811 α      lambda       -0.3083588E-05
   maximum displ.:     0.0624057 α      in ANC's #3, #1, #2, ...

........................................................................
.............................. CYCLE   11 ..............................
........................................................................
   1    -44.3203569 -0.443204E+02  0.290E-02    2.62       0.0  T
   2    -44.3203570 -0.831562E-07  0.171E-02    2.62       1.1  T
   3    -44.3203569  0.711510E-07  0.233E-03    2.62       7.8  T
   4    -44.3203570 -0.911704E-07  0.914E-04    2.62      20.0  T
   5    -44.3203570 -0.836415E-08  0.504E-04    2.62      36.2  T
     SCC iter.                  ...        0 min,  0.008 sec
     gradient                   ...        0 min,  0.023 sec
 * total energy  :   -43.6319919 Eh     change       -0.4655443E-05 Eh
   gradient norm :     0.0012304 Eh/α   predicted    -0.1551603E-05 ( -66.67%)
   displ. norm   :     0.0670035 α      lambda       -0.5813834E-05
   maximum displ.:     0.0464211 α      in ANC's #3, #2, #1, ...

........................................................................
.............................. CYCLE   12 ..............................
........................................................................
   1    -44.3202689 -0.443203E+02  0.268E-02    2.62       0.0  T
   2    -44.3202691 -0.191498E-06  0.145E-02    2.62       1.3  T
   3    -44.3202690  0.277480E-07  0.287E-03    2.62       6.4  T
   4    -44.3202691 -0.230520E-07  0.195E-03    2.62       9.4  T
   5    -44.3202691 -0.573678E-07  0.308E-04    2.62      59.4  T
   6    -44.3202691 -0.136659E-08  0.157E-04    2.62     116.0  T
     SCC iter.                  ...        0 min,  0.010 sec
     gradient                   ...        0 min,  0.022 sec
 * total energy  :   -43.6319991 Eh     change       -0.7240456E-05 Eh
   gradient norm :     0.0009908 Eh/α   predicted    -0.2917076E-05 ( -59.71%)
   displ. norm   :     0.0779531 α      lambda       -0.6848772E-05
   maximum displ.:     0.0538725 α      in ANC's #3, #2, #1, ...

........................................................................
.............................. CYCLE   13 ..............................
........................................................................
   1    -44.3202017 -0.443202E+02  0.349E-02    2.62       0.0  T
   2    -44.3202021 -0.456850E-06  0.183E-02    2.62       1.0  T
   3    -44.3202020  0.123850E-06  0.436E-03    2.62       4.2  T
   4    -44.3202022 -0.167113E-06  0.270E-03    2.62       6.8  T
   5    -44.3202022 -0.804356E-07  0.528E-04    2.62      34.6  T
   6    -44.3202022 -0.240757E-08  0.215E-04    2.62      84.8  T
     SCC iter.                  ...        0 min,  0.010 sec
     gradient                   ...        0 min,  0.023 sec
 * total energy  :   -43.6320068 Eh     change       -0.7668235E-05 Eh
   gradient norm :     0.0004896 Eh/α   predicted    -0.3435252E-05 ( -55.20%)
   displ. norm   :     0.0681149 α      lambda       -0.4030350E-05
   maximum displ.:     0.0480732 α      in ANC's #3, #2, #1, ...

........................................................................
.............................. CYCLE   14 ..............................
........................................................................
   1    -44.3200842 -0.443201E+02  0.307E-02    2.62       0.0  T
   2    -44.3200845 -0.322885E-06  0.161E-02    2.62       1.1  T
   3    -44.3200845  0.243487E-07  0.342E-03    2.62       5.3  T
   4    -44.3200845 -0.360627E-07  0.235E-03    2.62       7.8  T
   5    -44.3200846 -0.746298E-07  0.369E-04    2.62      49.4  T
   6    -44.3200846 -0.980037E-09  0.210E-04    2.62      87.0  T
     SCC iter.                  ...        0 min,  0.010 sec
     gradient                   ...        0 min,  0.022 sec
 * total energy  :   -43.6320107 Eh     change       -0.3898990E-05 Eh
   gradient norm :     0.0003622 Eh/α   predicted    -0.2020598E-05 ( -48.18%)
   displ. norm   :     0.0361951 α      lambda       -0.1566686E-05
   maximum displ.:     0.0267565 α      in ANC's #3, #2, #4, ...

   *** GEOMETRY OPTIMIZATION CONVERGED AFTER 14 ITERATIONS ***

------------------------------------------------------------------------
 total energy gain   :        -0.0108303 Eh       -6.7961 kcal/mol
 total RMSD          :         0.1761624 a0        0.0932 Å
 total power (kW/mol):        -2.0310669 (step)  -42.2035 (real)
------------------------------------------------------------------------

 ANCopt (total)                0 d,  0 h,  0 min,  0.674 sec
 optimizer setup                ...        0 min,  0.000 sec (  0.021%)
 model hessian                  ...        0 min,  0.007 sec (  1.039%)
 ANC generation                 ...        0 min,  0.001 sec (  0.142%)
 coordinate transformation      ...        0 min,  0.000 sec (  0.043%)
 single point calculation       ...        0 min,  0.661 sec ( 98.040%)
 optimization log               ...        0 min,  0.002 sec (  0.253%)
 hessian update                 ...        0 min,  0.000 sec (  0.031%)
 rational function              ...        0 min,  0.002 sec (  0.292%)

================
 final structure:
================
$coord
   -6.51226644809743   -1.48018200206649   -0.22396744683223      C 
   -4.48298400697939   -3.01653025068106   -0.21812131330002      C 
   -2.13900256479891   -1.67513229455803   -0.18428701350855      C 
   -2.52739159045266    0.97181240681488   -0.16465124249295      C 
   -5.74922059923245    1.69972234138735   -0.18762908033618      S 
   -0.58643851423982    2.72454000427855   -0.12962355875587      C 
   -1.11051310006834    5.50750212909298   -0.03228349829341      C 
   -1.12661605640340    6.44366105659313    2.70299022097315      C 
    1.86805031977574    1.74923745981012   -0.08966264191320      C 
    2.25643398801008   -0.89744985320740   -0.10948174121221      C 
    0.31582270229478   -2.65011260238687   -0.16812101798555      C 
    0.84034096051107   -5.43408377300002   -0.10726457944225      C 
    0.81143556173193   -6.41714121787199    2.61148822049858      C 
    5.47747039313363   -1.62577051676756   -0.04280138473350      S 
    6.24040352235294    1.55416105296234    0.00102407198324      C 
    4.21141794229961    3.09061244464399   -0.02717092251608      C 
   -8.47185701017600   -1.99957134980823   -0.24439917881645      H 
   -4.62113244827964   -5.04328456137345   -0.23364728969904      H 
   -2.95307321437448    5.87768932669717   -0.88616292049851      H 
    0.31730195742659    6.53407211785367   -1.10936160080705      H 
   -2.58219168364472    5.46759041258224    3.77653822937380      H 
   -1.50858640307048    8.46153327003287    2.76625461421837      H 
    0.68970127194603    6.08628360199613    3.59699657357034      H 
    2.69747966362625   -5.78873711577169   -0.93571844270464      H 
   -0.56767822043706   -6.44343813773886   -1.22541136325084      H 
    2.24834083675273   -5.45902614620867    3.72552954533697      H 
    1.19379753223578   -8.43571996484964    2.64688905517741      H 
   -1.01981098310226   -6.07568213863113    3.48095666341318      H 
    8.19948942188657    2.07339570488555    0.05291227037076      H 
    4.34903098579591    5.11728377656002   -0.00053772024939      H 
$end
           -------------------------------------------------
          |                Final Singlepoint                |
           -------------------------------------------------

          ...................................................
          :                      SETUP                      :
          :.................................................:
          :  # basis functions                  90          :
          :  # atomic orbitals                  88          :
          :  # shells                           48          :
          :  # electrons                        82          :
          :  max. iterations                   250          :
          :  Hamiltonian                  GFN2-xTB          :
          :  restarted?                      false          :
          :  GBSA solvation                  false          :
          :  PC potential                    false          :
          :  electronic temp.          300.0000000     K    :
          :  accuracy                    1.0000000          :
          :  -> integral cutoff          0.2500000E+02      :
          :  -> integral neglect         0.1000000E-07      :
          :  -> SCF convergence          0.1000000E-05 Eh   :
          :  -> wf. convergence          0.1000000E-03 e    :
          :  Broyden damping             0.4000000          :
          ...................................................

 iter      E             dE          RMSdq      gap      omega  full diag
   1    -44.3200846 -0.443201E+02  0.106E-04    2.62       0.0  T
   2    -44.3200846 -0.126761E-10  0.675E-05    2.62     270.7  T
   3    -44.3200846 -0.105565E-09  0.431E-05    2.62     423.9  T

   *** convergence criteria satisfied after 3 iterations ***

         #    Occupation            Energy/Eh            Energy/eV
      -------------------------------------------------------------
         1        2.0000           -0.7236995             -19.6929
       ...           ...                  ...                  ...
        35        2.0000           -0.4276487             -11.6369
        36        2.0000           -0.4272800             -11.6269
        37        2.0000           -0.4202678             -11.4361
        38        2.0000           -0.4198417             -11.4245
        39        2.0000           -0.3932472             -10.7008
        40        2.0000           -0.3868422             -10.5265
        41        2.0000           -0.3578642              -9.7380 (HOMO)
        42                         -0.2614597              -7.1147 (LUMO)
        43                         -0.2268534              -6.1730
        44                         -0.2153684              -5.8605
        45                         -0.2010839              -5.4718
        46                         -0.2009304              -5.4676
       ...                                ...                  ...
        88                          0.7217997              19.6412
      -------------------------------------------------------------
                  HL-Gap            0.0964045 Eh            2.6233 eV
             Fermi-level           -0.3096619 Eh           -8.4263 eV

 SCC (total)                   0 d,  0 h,  0 min,  0.045 sec
 SCC setup                      ...        0 min,  0.000 sec (  0.590%)
 Dispersion                     ...        0 min,  0.000 sec (  0.705%)
 integral evaluation            ...        0 min,  0.015 sec ( 33.504%)
 zeroth order Hamiltonian       ...        0 min,  0.000 sec (  0.572%)
 iterations                     ...        0 min,  0.006 sec ( 12.635%)
 molecular gradient             ...        0 min,  0.023 sec ( 50.946%)
 printout                       ...        0 min,  0.000 sec (  0.940%)

         :::::::::::::::::::::::::::::::::::::::::::::::::::::
         ::                     SUMMARY                     ::
         :::::::::::::::::::::::::::::::::::::::::::::::::::::
         :: total energy             -43.632010681399 Eh    ::
         :: gradient norm              0.000362306155 Eh/a0 ::
         :: HOMO-LUMO gap              2.623299819424 eV    ::
         ::.................................................::
         :: SCC energy               -44.320084592937 Eh    ::
         :: -> isotropic ES            0.003514141393 Eh    ::
         :: -> anisotropic ES          0.004504686713 Eh    ::
         :: -> anisotropic XC          0.021236168322 Eh    ::
         :: -> dispersion             -0.036536813690 Eh    ::
         :: repulsion energy           0.687672825613 Eh    ::
         :: add. restraining           0.000000000000 Eh    ::
         :::::::::::::::::::::::::::::::::::::::::::::::::::::

           -------------------------------------------------
          |                Property Printout                |
           -------------------------------------------------

    * Orbital Energies and Occupations

         #    Occupation            Energy/Eh            Energy/eV
      -------------------------------------------------------------
         1        2.0000           -0.7236995             -19.6929
       ...           ...                  ...                  ...
        29        2.0000           -0.4613357             -12.5536
        30        2.0000           -0.4562932             -12.4164
        31        2.0000           -0.4510768             -12.2744
        32        2.0000           -0.4505602             -12.2604
        33        2.0000           -0.4482497             -12.1975
        34        2.0000           -0.4357243             -11.8567
        35        2.0000           -0.4276487             -11.6369
        36        2.0000           -0.4272800             -11.6269
        37        2.0000           -0.4202678             -11.4361
        38        2.0000           -0.4198417             -11.4245
        39        2.0000           -0.3932472             -10.7008
        40        2.0000           -0.3868422             -10.5265
        41        2.0000           -0.3578642              -9.7380 (HOMO)
        42                         -0.2614597              -7.1147 (LUMO)
        43                         -0.2268534              -6.1730
        44                         -0.2153684              -5.8605
        45                         -0.2010839              -5.4718
        46                         -0.2009304              -5.4676
        47                         -0.1616521              -4.3988
        48                         -0.1172613              -3.1908
        49                         -0.1130906              -3.0774
        50                         -0.0999081              -2.7186
        51                         -0.0027970              -0.0761
        52                         -0.0018253              -0.0497
       ...                                ...                  ...
        88                          0.7217997              19.6412
      -------------------------------------------------------------
                  HL-Gap            0.0964045 Eh            2.6233 eV
             Fermi-level           -0.3096619 Eh           -8.4263 eV

     #   Z        covCN         q      C6AA      α(0)
     1   6 C      2.932    -0.011    28.280     8.721
     2   6 C      3.072    -0.048    29.116     8.847
     3   6 C      3.143    -0.009    27.994     8.657
     4   6 C      3.010     0.019    27.562     8.612
     5  16 S      2.251    -0.074   144.114    20.205
     6   6 C      2.988    -0.005    28.140     8.702
     7   6 C      3.806    -0.053    21.528     6.605
     8   6 C      3.754    -0.097    22.410     6.750
     9   6 C      3.144    -0.009    27.993     8.657
    10   6 C      3.010     0.019    27.562     8.612
    11   6 C      2.987    -0.005    28.141     8.702
    12   6 C      3.806    -0.053    21.529     6.605
    13   6 C      3.754    -0.097    22.411     6.750
    14  16 S      2.251    -0.073   144.108    20.204
    15   6 C      2.932    -0.011    28.281     8.721
    16   6 C      3.072    -0.048    29.117     8.847
    17   1 H      0.926     0.041     2.440     2.443
    18   1 H      0.926     0.038     2.478     2.462
    19   1 H      0.924     0.045     2.387     2.416
    20   1 H      0.924     0.040     2.443     2.444
    21   1 H      0.925     0.039     2.463     2.454
    22   1 H      0.925     0.038     2.478     2.462
    23   1 H      0.925     0.037     2.484     2.464
    24   1 H      0.924     0.045     2.388     2.416
    25   1 H      0.924     0.040     2.444     2.445
    26   1 H      0.925     0.039     2.461     2.453
    27   1 H      0.925     0.038     2.478     2.462
    28   1 H      0.925     0.037     2.485     2.465
    29   1 H      0.926     0.041     2.440     2.443
    30   1 H      0.926     0.038     2.477     2.461

 Mol. C6AA /au·bohr⁶  :      13839.720800
 Mol. C8AA /au·bohr⁸  :     396726.825184
 Mol. α(0) /au        :        188.489821


Wiberg/Mayer (AO) data.
largest (>0.10) Wiberg bond orders for each atom
          total WBO             WBO to atom ...
     1  C   3.942        C    2 1.691    S    5 1.143    H   17 0.970
     2  C   3.983        C    1 1.691    C    3 1.184    H   18 0.961    S    5 0.102
     3  C   3.986        C   11 1.327    C    4 1.260    C    2 1.184
     4  C   3.953        C    6 1.401    C    3 1.260    S    5 1.089
     5  S   2.518        C    1 1.143    C    4 1.089    C    2 0.102
     6  C   3.987        C    4 1.401    C    9 1.326    C    7 1.012    C   11 0.102
     7  C   3.996        C    6 1.012    C    8 0.999    H   20 0.970    H   19 0.968
     8  C   3.995        C    7 0.999    H   21 0.988    H   23 0.988    H   22 0.986
     9  C   3.986        C    6 1.326    C   10 1.260    C   16 1.185
    10  C   3.953        C   11 1.400    C    9 1.260    S   14 1.089
    11  C   3.987        C   10 1.400    C    3 1.327    C   12 1.012    C    6 0.102
    12  C   3.996        C   11 1.012    C   13 0.999    H   25 0.970    H   24 0.968
    13  C   3.995        C   12 0.999    H   26 0.988    H   28 0.988    H   27 0.986
    14  S   2.518        C   15 1.143    C   10 1.089    C   16 0.102
    15  C   3.943        C   16 1.691    S   14 1.143    H   29 0.970
    16  C   3.983        C   15 1.691    C    9 1.185    H   30 0.961    S   14 0.102
    17  H   0.997        C    1 0.970
    18  H   0.998        C    2 0.961
    19  H   0.997        C    7 0.968
    20  H   0.998        C    7 0.970
    21  H   0.998        C    8 0.988
    22  H   0.997        C    8 0.986
    23  H   0.999        C    8 0.988
    24  H   0.997        C   12 0.968
    25  H   0.998        C   12 0.970
    26  H   0.998        C   13 0.988
    27  H   0.997        C   13 0.986
    28  H   0.999        C   13 0.988
    29  H   0.997        C   15 0.970
    30  H   0.998        C   16 0.961

molecular dipole:
                 x           y           z       tot (Debye)
 q only:        0.000      -0.000       0.091
   full:        0.000      -0.000       0.086       0.218
molecular quadrupole (traceless):
                xx          xy          yy          xz          yz          zz
 q only:       -2.885       2.834       5.310       0.007       0.123      -2.424
  q+dip:       -0.510       8.615       6.305       0.135       0.252      -5.795
   full:       -2.382       8.813       5.289       0.071       0.219      -2.907

           -------------------------------------------------
          |                Geometry Summary                 |
           -------------------------------------------------

      molecular mass/u    :      246.3846000
   center of mass at/Å    :       -0.0731843       0.0180459       0.1170918
  moments of inertia/u·Å² :        0.8604019E+03   0.1195982E+04   0.1925623E+04
rotational constants/cm⁻¹ :        0.1959274E-01   0.1409522E-01   0.8754377E-02

 * 30 selected distances

     #   Z        #   Z                                     value/Å
     1   6 C      2   6 C                                 1.3468978
     2   6 C      3   6 C                                 1.4292432
     3   6 C      4   6 C                                 1.4157394
     1   6 C      5  16 S                                 1.7306080
     4   6 C      5  16 S                                 1.7479329 (max)
     4   6 C      6   6 C                                 1.3840368
     7   6 C      8   6 C                                 1.5298967
     6   6 C      9   6 C                                 1.3978022
     9   6 C     10   6 C                                 1.4156049
     3   6 C     11   6 C                                 1.3977709
    10   6 C     11   6 C                                 1.3841033
    12   6 C     13   6 C                                 1.5299405
    10   6 C     14  16 S                                 1.7478856
    14  16 S     15   6 C                                 1.7306566
     9   6 C     16   6 C                                 1.4292258
    15   6 C     16   6 C                                 1.3468845
     1   6 C     17   1 H                                 1.0728314 (min)
     2   6 C     18   1 H                                 1.0750323
     7   6 C     19   1 H                                 1.0923604
     7   6 C     20   1 H                                 1.0912604
     8   6 C     21   1 H                                 1.0875745
     8   6 C     22   1 H                                 1.0872902
     8   6 C     23   1 H                                 1.0878390
    12   6 C     24   1 H                                 1.0923479
    12   6 C     25   1 H                                 1.0911279
    13   6 C     26   1 H                                 1.0875551
    13   6 C     27   1 H                                 1.0873420
    13   6 C     28   1 H                                 1.0878466
    15   6 C     29   1 H                                 1.0728493
    16   6 C     30   1 H                                 1.0750303

 * 3 distinct bonds (by element types)

   Z      Z             #   av. dist./Å        max./Å        min./Å
   1 H    6 C          14     1.0848776     1.0923604     1.0728314
   6 C    6 C          12     1.4172622     1.5299405     1.3468845
   6 C   16 S           4     1.7392708     1.7479329     1.7306080


optimized geometry written to: xtbopt.xyz


           -------------------------------------------------
          | TOTAL ENERGY              -43.632010681399 Eh   |
          | GRADIENT NORM               0.000362306155 Eh/α |
          | HOMO-LUMO GAP               2.623299819424 eV   |
           -------------------------------------------------

------------------------------------------------------------------------
 * finished run on 2021/05/19 at 11:01:03.636     
------------------------------------------------------------------------
 total:
 * wall-time:     0 d,  0 h,  0 min,  0.807 sec
 *  cpu-time:     0 d,  0 h,  0 min,  0.806 sec
 * ratio c/w:     0.999 speedup
 SCF:
 * wall-time:     0 d,  0 h,  0 min,  0.060 sec
 *  cpu-time:     0 d,  0 h,  0 min,  0.060 sec
 * ratio c/w:     1.000 speedup
 ANC optimizer:
 * wall-time:     0 d,  0 h,  0 min,  0.719 sec
 *  cpu-time:     0 d,  0 h,  0 min,  0.719 sec
 * ratio c/w:     1.000 speedup

