      -----------------------------------------------------------      
     |                   =====================                   |     
     |                           x T B                           |     
     |                   =====================                   |     
     |                         S. Grimme                         |     
     |          Mulliken Center for Theoretical Chemistry        |     
     |                    University of Bonn                     |     
     |                Version 6.2 RC2 (SAW190805)                |     
      -----------------------------------------------------------      

   This program is distributed in the hope that it will be useful,
   but WITHOUT ANY WARRANTY; without even the implied warranty of
   MERCHANTABILITY or FITNESS FOR A PARTICULAR PURPOSE.
   
   FOR NON-COMMERCIAL, ACADEMIA USE ONLY.
   
   Cite this work as:
   * S. Grimme, C. Bannwarth, P. Shushkov, J. Chem. Theory Comput., 2017,
     13, 1989-2009. DOI: 10.1021/acs.jctc.7b00118
   * C. Bannwarth, S. Ehlert and S. Grimme., J. Chem. Theory Comput., 2019,
     15, 1652-1671. DOI: 10.1021/acs.jctc.8b01176
   * P. Pracht, E. Caldeweyher, S. Ehlert, S. Grimme, ChemRxiv, 2019, preprint.
     DOI: 10.26434/chemrxiv.8326202.v1
   
   for DFT-D4:
   * E. Caldeweyher, C. Bannwarth and S. Grimme, J. Chem. Phys., 2017,
     147, 034112. DOI: 10.1063/1.4993215
   * E. Caldeweyher, S. Ehlert, A. Hansen, H. Neugebauer, S. Spicher,
     C. Bannwarth and S. Grimme, J. Chem. Phys., 2019, 150, 154122.
     DOI: 10.1063/1.5090222
   
   for sTDA-xTB:
   * S. Grimme and C. Bannwarth, J. Chem. Phys., 2016, 145, 054103.
     DOI: 10.1063/1.4959605
   
   in the mass-spec context:
   * V. Asgeirsson, C. Bauer and S. Grimme, Chem. Sci., 2017, 8, 4879.
     DOI: 10.1039/c7sc00601b
   
   for metadynamics refer to:
   * S. Grimme, J. Chem. Theory Comput., 2019, 155, 2847-2862
     DOI: 10.1021/acs.jctc.9b00143
   
   with help from (in alphabetical order)
   C. Bannwarth, F. Bohle, G. Brandenburg, E. Caldeweyher, M. Checinski,
   S. Dohm, S. Ehlert, S. Ehrlich, F. März, H. Neugebauer, J. Pisarek,
   P. Pracht, P. Shushkov, and S. Spicher.
   
 * started run on 2021/05/19 at 11:01:03.656     

           -------------------------------------------------
          |                Calculation Setup                |
           -------------------------------------------------

          program call               : /ihome/ghutchison/geoffh/xtb/xtb 883.xyz -opt
          hostname                   : smp-n83
          coordinate file            : 883.xyz
          omp threads                :                     1
          number of atoms            :                    25
          number of electrons        :                    68
          charge                     :                     0
          spin                       :                   0.0
          first test random number   :      0.10705168503308


########################################################################
# WARNING! Please study the warnings concerning your input carefully
#  - the use of '-opt' is discouraged, please use '--opt' next time
########################################################################

           ------------------------------------------------- 
          |                 G F N 2 - x T B                 |
          | Geometry, Frequencies, Noncovalent interactions |
          |            JCTC 2019 parametrisation            |
           ------------------------------------------------- 
             KAB for C  - Si     :                1.0500
             KAB for H  - Pd     :                0.9500
             k(s)              :                1.8500
             k(p)              :                2.2300
             k(d)              :                2.2300
             k(f)              :                2.0000
             kEN (H0ij)        :               -2.0000
             D4 a1             :                0.5200
             D4 a2             :                5.0000
             D4 s6             :                1.0000
             D4 s8             :                2.7000
             D4 s9             :                5.0000
             alphaj            :                2.0000

  Z AO/shell   Hii/eV     exponent
  1     Wed Apr 25 08:07:45 CEST 2018   EN: 2.200 GM2: 0.406  GM3: 0.0800  RAES: 1.40
     1s    -10.707211    1.230000
  6     Wed Apr 25 08:07:45 CEST 2018   EN: 2.550 GM2: 0.538  GM3: 0.1500  RAES: 3.00
     2s    -13.970922    2.096432
     2p    -10.063292    1.800000
  8     Wed Apr 25 08:07:45 CEST 2018   EN: 3.440 GM2: 0.452  GM3:-0.0517  RAES: 1.80
     2s    -20.229985    2.439742
     2p    -15.503117    2.137023
 16     Tue Apr 24 11:44:34 CEST 2018   EN: 2.580 GM2: 0.340  GM3:-0.0502  RAES: 3.10
     3s    -20.029654    1.981333
     3p    -11.377694    2.025643
     3d     -0.420282    1.702555

           ------------------------------------------------- 
          |        Self-Consistent Charge Iterations        |
           ------------------------------------------------- 

          ...................................................
          :                      SETUP                      :
          :.................................................:
          :  # basis functions                  70          :
          :  # atomic orbitals                  69          :
          :  # shells                           39          :
          :  # electrons                        68          :
          :  max. iterations                   250          :
          :  Hamiltonian                  GFN2-xTB          :
          :  restarted?                      false          :
          :  GBSA solvation                  false          :
          :  PC potential                    false          :
          :  electronic temp.          300.0000000     K    :
          :  accuracy                    1.0000000          :
          :  -> integral cutoff          0.2500000E+02      :
          :  -> integral neglect         0.1000000E-07      :
          :  -> SCF convergence          0.1000000E-05 Eh   :
          :  -> wf. convergence          0.1000000E-03 e    :
          :  Broyden damping             0.4000000          :
          ...................................................

 iter      E             dE          RMSdq      gap      omega  full diag
   1    -37.3876672 -0.373877E+02  0.429E+00    3.05       0.0  T
   2    -37.4374344 -0.497672E-01  0.228E+00    2.78       1.0  T
   3    -37.4375632 -0.128747E-03  0.139E+00    3.01       1.0  T
   4    -37.4487736 -0.112104E-01  0.252E-01    2.64       1.0  T
   5    -37.4488573 -0.837168E-04  0.122E-01    2.70       1.0  T
   6    -37.4489717 -0.114368E-03  0.708E-02    2.71       1.0  T
   7    -37.4490456 -0.739190E-04  0.208E-02    2.71       1.0  T
   8    -37.4490460 -0.429801E-06  0.779E-03    2.71       2.6  T
   9    -37.4490461 -0.906176E-07  0.335E-03    2.71       6.0  T
  10    -37.4490462 -0.756092E-07  0.183E-03    2.71      11.0  T
  11    -37.4490462 -0.304256E-07  0.603E-04    2.71      33.2  T
  12    -37.4490462 -0.169445E-08  0.377E-04    2.71      53.1  T

   *** convergence criteria satisfied after 12 iterations ***

         #    Occupation            Energy/Eh            Energy/eV
      -------------------------------------------------------------
         1        2.0000           -0.7331456             -19.9499
       ...           ...                  ...                  ...
        28        2.0000           -0.4491935             -12.2232
        29        2.0000           -0.4430950             -12.0572
        30        2.0000           -0.4334067             -11.7936
        31        2.0000           -0.4291348             -11.6774
        32        2.0000           -0.4051573             -11.0249
        33        2.0000           -0.3899182             -10.6102
        34        2.0000           -0.3763827             -10.2419 (HOMO)
        35                         -0.2769197              -7.5354 (LUMO)
        36                         -0.2632704              -7.1640
        37                         -0.2080062              -5.6601
        38                         -0.1990651              -5.4168
        39                         -0.1623145              -4.4168
       ...                                ...                  ...
        69                          0.6614494              17.9990
      -------------------------------------------------------------
                  HL-Gap            0.0994630 Eh            2.7065 eV
             Fermi-level           -0.3266512 Eh           -8.8886 eV

 SCC (total)                   0 d,  0 h,  0 min,  0.040 sec
 SCC setup                      ...        0 min,  0.000 sec (  0.795%)
 Dispersion                     ...        0 min,  0.000 sec (  0.913%)
 integral evaluation            ...        0 min,  0.010 sec ( 23.897%)
 zeroth order Hamiltonian       ...        0 min,  0.000 sec (  0.464%)
 iterations                     ...        0 min,  0.015 sec ( 36.826%)
 molecular gradient             ...        0 min,  0.014 sec ( 36.048%)
 printout                       ...        0 min,  0.000 sec (  0.931%)

         :::::::::::::::::::::::::::::::::::::::::::::::::::::
         ::                     SUMMARY                     ::
         :::::::::::::::::::::::::::::::::::::::::::::::::::::
         :: total energy             -36.937556387144 Eh    ::
         :: gradient norm              0.075292455836 Eh/a0 ::
         :: HOMO-LUMO gap              2.706525720874 eV    ::
         ::.................................................::
         :: SCC energy               -37.449046197565 Eh    ::
         :: -> isotropic ES            0.024596323400 Eh    ::
         :: -> anisotropic ES          0.003141660620 Eh    ::
         :: -> anisotropic XC          0.018245155364 Eh    ::
         :: -> dispersion             -0.025578788400 Eh    ::
         :: repulsion energy           0.511242416810 Eh    ::
         :: add. restraining           0.000000000000 Eh    ::
         :::::::::::::::::::::::::::::::::::::::::::::::::::::

      ----------------------------------------------------------- 
     |                   =====================                   |
     |                        A N C O P T                        |
     |                   =====================                   |
     |               Approximate Normal Coordinate               |
     |                Rational Function Optimizer                |
      ----------------------------------------------------------- 

          ...................................................
          :                      SETUP                      :
          :.................................................:
          :   optimization level            normal          :
          :   max. optcycles                   200          :
          :   ANC micro-cycles                  20          :
          :   degrees of freedom                69          :
          :.................................................:
          :   RF solver                   davidson          :
          :   input Hessian                  false          :
          :   write xtbopt.log                true          :
          :   linear?                        false          :
          :   energy convergence         0.5000000E-05 Eh   :
          :   grad. convergence          0.1000000E-02 Eh/α :
          :   maximium RF displ.         2.0000000          :
          :   Hlow (freq-cutoff)         0.5000000E-02      :
          :   Hmax (freq-cutoff)         5.0000000          :
          :   S6 in model hess.         20.0000000          :
          ...................................................

generating ANC from model Hessian ...
Using Lindh-Hessian (1995)
 Shifting diagonal of input Hessian by   3.710259561612019E-003
 Lowest  eigenvalues of input Hessian
   -0.000000   -0.000000   -0.000000   -0.000000    0.000000    0.000000
    0.005000    0.006417    0.007900    0.008622    0.010833    0.012886
    0.013756    0.017129    0.017964    0.022344    0.028322    0.029157
 Highest eigenvalues
    1.524789    1.626054    1.777274    1.824992    1.974067    2.061093
 

........................................................................
.............................. CYCLE    1 ..............................
........................................................................
   1    -37.4490462 -0.374490E+02  0.156E-04    2.71       0.0  T
   2    -37.4490462 -0.110141E-09  0.129E-04    2.71     154.8  T
   3    -37.4490462 -0.275215E-09  0.571E-05    2.71     350.0  T
     SCC iter.                  ...        0 min,  0.004 sec
     gradient                   ...        0 min,  0.014 sec
 * total energy  :   -36.9375564 Eh     change       -0.2192386E-07 Eh
   gradient norm :     0.0752911 Eh/α   predicted     0.0000000E+00 (-100.00%)
   displ. norm   :     0.2455299 α      lambda       -0.6250039E-02
   maximum displ.:     0.1288591 α      in ANC's #3, #6, #2, ...

........................................................................
.............................. CYCLE    2 ..............................
........................................................................
   1    -37.4746034 -0.374746E+02  0.220E-01    2.98       0.0  T
   2    -37.4746793 -0.759014E-04  0.118E-01    2.92       1.0  T
   3    -37.4746326  0.467149E-04  0.681E-02    2.91       1.0  T
   4    -37.4747128 -0.802317E-04  0.250E-02    2.90       1.0  T
   5    -37.4747174 -0.458426E-05  0.101E-02    2.90       2.0  T
   6    -37.4747180 -0.583838E-06  0.403E-03    2.91       5.0  T
   7    -37.4747183 -0.326581E-06  0.113E-03    2.90      17.7  T
     SCC iter.                  ...        0 min,  0.008 sec
     gradient                   ...        0 min,  0.013 sec
 * total energy  :   -36.9414754 Eh     change       -0.3918982E-02 Eh
   gradient norm :     0.0223358 Eh/α   predicted    -0.3313416E-02 ( -15.45%)
   displ. norm   :     0.2787265 α      lambda       -0.2115274E-02
   maximum displ.:     0.1669070 α      in ANC's #3, #5, #4, ...

........................................................................
.............................. CYCLE    3 ..............................
........................................................................
   1    -37.4857526 -0.374858E+02  0.211E-01    3.03       0.0  T
   2    -37.4857874 -0.347670E-04  0.121E-01    3.00       1.0  T
   3    -37.4857319  0.554873E-04  0.637E-02    2.99       1.0  T
   4    -37.4858048 -0.729189E-04  0.214E-02    2.98       1.0  T
   5    -37.4858079 -0.305093E-05  0.869E-03    2.99       2.3  T
   6    -37.4858085 -0.630154E-06  0.351E-03    2.99       5.7  T
   7    -37.4858087 -0.196281E-06  0.155E-03    2.99      12.9  T
     SCC iter.                  ...        0 min,  0.008 sec
     gradient                   ...        0 min,  0.013 sec
 * total energy  :   -36.9419827 Eh     change       -0.5073382E-03 Eh
   gradient norm :     0.0178281 Eh/α   predicted    -0.1139803E-02 ( 124.66%)
   displ. norm   :     0.2116119 α      lambda       -0.1295381E-02
   maximum displ.:     0.1245538 α      in ANC's #3, #6, #2, ...

........................................................................
.............................. CYCLE    4 ..............................
........................................................................
   1    -37.4837565 -0.374838E+02  0.122E-01    2.99       0.0  T
   2    -37.4837591 -0.258525E-05  0.719E-02    2.99       1.0  T
   3    -37.4837534  0.571512E-05  0.196E-02    2.98       1.0  T
   4    -37.4837601 -0.670724E-05  0.655E-03    2.99       3.1  T
   5    -37.4837603 -0.254726E-06  0.204E-03    2.99       9.8  T
   6    -37.4837604 -0.475836E-07  0.756E-04    2.99      26.5  T
     SCC iter.                  ...        0 min,  0.007 sec
     gradient                   ...        0 min,  0.014 sec
 * total energy  :   -36.9427579 Eh     change       -0.7751712E-03 Eh
   gradient norm :     0.0086841 Eh/α   predicted    -0.6766951E-03 ( -12.70%)
   displ. norm   :     0.2131507 α      lambda       -0.4185547E-03
   maximum displ.:     0.1310746 α      in ANC's #3, #2, #4, ...

........................................................................
.............................. CYCLE    5 ..............................
........................................................................
   1    -37.4797569 -0.374798E+02  0.123E-01    2.96       0.0  T
   2    -37.4797596 -0.270788E-05  0.717E-02    2.96       1.0  T
   3    -37.4797559  0.365951E-05  0.164E-02    2.96       1.2  T
   4    -37.4797606 -0.471674E-05  0.692E-03    2.96       2.9  T
   5    -37.4797609 -0.310285E-06  0.196E-03    2.96      10.2  T
   6    -37.4797610 -0.498752E-07  0.912E-04    2.96      21.9  T
     SCC iter.                  ...        0 min,  0.007 sec
     gradient                   ...        0 min,  0.014 sec
 * total energy  :   -36.9430737 Eh     change       -0.3158382E-03 Eh
   gradient norm :     0.0066422 Eh/α   predicted    -0.2187914E-03 ( -30.73%)
   displ. norm   :     0.2947537 α      lambda       -0.4151095E-03
   maximum displ.:     0.1824623 α      in ANC's #3, #2, #1, ...

........................................................................
.............................. CYCLE    6 ..............................
........................................................................
   1    -37.4771687 -0.374772E+02  0.173E-01    2.95       0.0  T
   2    -37.4771742 -0.554750E-05  0.986E-02    2.95       1.0  T
   3    -37.4771689  0.535335E-05  0.231E-02    2.95       1.0  T
   4    -37.4771761 -0.721494E-05  0.115E-02    2.95       1.7  T
   5    -37.4771771 -0.101647E-05  0.278E-03    2.95       7.2  T
   6    -37.4771772 -0.944325E-07  0.139E-03    2.95      14.4  T
     SCC iter.                  ...        0 min,  0.007 sec
     gradient                   ...        0 min,  0.014 sec
 * total energy  :   -36.9433717 Eh     change       -0.2979845E-03 Eh
   gradient norm :     0.0084755 Eh/α   predicted    -0.2255904E-03 ( -24.29%)
   displ. norm   :     0.2886742 α      lambda       -0.3115213E-03
   maximum displ.:     0.1759996 α      in ANC's #3, #2, #1, ...

........................................................................
.............................. CYCLE    7 ..............................
........................................................................
   1    -37.4778449 -0.374778E+02  0.167E-01    2.95       0.0  T
   2    -37.4778496 -0.464807E-05  0.961E-02    2.95       1.0  T
   3    -37.4778443  0.523595E-05  0.226E-02    2.95       1.0  T
   4    -37.4778514 -0.709871E-05  0.103E-02    2.95       1.9  T
   5    -37.4778521 -0.699551E-06  0.272E-03    2.95       7.3  T
   6    -37.4778522 -0.698513E-07  0.135E-03    2.95      14.8  T
     SCC iter.                  ...        0 min,  0.007 sec
     gradient                   ...        0 min,  0.014 sec
 * total energy  :   -36.9435656 Eh     change       -0.1938456E-03 Eh
   gradient norm :     0.0071951 Eh/α   predicted    -0.1687470E-03 ( -12.95%)
   displ. norm   :     0.1725384 α      lambda       -0.1657918E-03
   maximum displ.:     0.1015352 α      in ANC's #3, #2, #1, ...

........................................................................
.............................. CYCLE    8 ..............................
........................................................................
   1    -37.4805326 -0.374805E+02  0.108E-01    2.96       0.0  T
   2    -37.4805353 -0.268509E-05  0.606E-02    2.96       1.0  T
   3    -37.4805333  0.204342E-05  0.162E-02    2.96       1.2  T
   4    -37.4805361 -0.282568E-05  0.802E-03    2.96       2.5  T
   5    -37.4805366 -0.472696E-06  0.181E-03    2.96      11.0  T
   6    -37.4805366 -0.211591E-07  0.879E-04    2.96      22.8  T
     SCC iter.                  ...        0 min,  0.007 sec
     gradient                   ...        0 min,  0.013 sec
 * total energy  :   -36.9436684 Eh     change       -0.1028167E-03 Eh
   gradient norm :     0.0044180 Eh/α   predicted    -0.8536450E-04 ( -16.97%)
   displ. norm   :     0.1114482 α      lambda       -0.8654806E-04
   maximum displ.:     0.0461483 α      in ANC's #2, #8, #5, ...

........................................................................
.............................. CYCLE    9 ..............................
........................................................................
   1    -37.4827966 -0.374828E+02  0.743E-02    2.97       0.0  T
   2    -37.4827982 -0.158995E-05  0.429E-02    2.96       1.0  T
   3    -37.4827964  0.187152E-05  0.137E-02    2.96       1.5  T
   4    -37.4827989 -0.258009E-05  0.555E-03    2.96       3.6  T
   5    -37.4827991 -0.199380E-06  0.163E-03    2.96      12.3  T
   6    -37.4827991 -0.114546E-07  0.673E-04    2.96      29.7  T
     SCC iter.                  ...        0 min,  0.007 sec
     gradient                   ...        0 min,  0.014 sec
 * total energy  :   -36.9437308 Eh     change       -0.6238911E-04 Eh
   gradient norm :     0.0024470 Eh/α   predicted    -0.4381185E-04 ( -29.78%)
   displ. norm   :     0.1507991 α      lambda       -0.7680614E-04
   maximum displ.:     0.0740776 α      in ANC's #8, #5, #4, ...

........................................................................
.............................. CYCLE   10 ..............................
........................................................................
   1    -37.4828029 -0.374828E+02  0.101E-01    2.96       0.0  T
   2    -37.4828059 -0.295145E-05  0.593E-02    2.96       1.0  T
   3    -37.4828050  0.862745E-06  0.147E-02    2.96       1.4  T
   4    -37.4828071 -0.209851E-05  0.783E-03    2.96       2.6  T
   5    -37.4828076 -0.545381E-06  0.233E-03    2.96       8.6  T
   6    -37.4828077 -0.297236E-07  0.105E-03    2.96      19.0  T
   7    -37.4828077 -0.270494E-08  0.580E-04    2.96      34.5  T
   8    -37.4828077 -0.330400E-08  0.145E-04    2.96     137.6  T
     SCC iter.                  ...        0 min,  0.009 sec
     gradient                   ...        0 min,  0.014 sec
 * total energy  :   -36.9437831 Eh     change       -0.5231224E-04 Eh
   gradient norm :     0.0036496 Eh/α   predicted    -0.3928114E-04 ( -24.91%)
   displ. norm   :     0.1113150 α      lambda       -0.5919468E-04
   maximum displ.:     0.0585980 α      in ANC's #8, #9, #5, ...

........................................................................
.............................. CYCLE   11 ..............................
........................................................................
   1    -37.4833073 -0.374833E+02  0.676E-02    2.97       0.0  T
   2    -37.4833088 -0.149106E-05  0.401E-02    2.97       1.0  T
   3    -37.4833087  0.126933E-06  0.934E-03    2.97       2.1  T
   4    -37.4833095 -0.749134E-06  0.511E-03    2.97       3.9  T
   5    -37.4833097 -0.236726E-06  0.199E-03    2.97      10.1  T
   6    -37.4833097 -0.299542E-07  0.767E-04    2.97      26.1  T
   7    -37.4833097 -0.223447E-08  0.384E-04    2.97      52.1  T
     SCC iter.                  ...        0 min,  0.008 sec
     gradient                   ...        0 min,  0.014 sec
 * total energy  :   -36.9438116 Eh     change       -0.2851137E-04 Eh
   gradient norm :     0.0026740 Eh/α   predicted    -0.2997055E-04 (   5.12%)
   displ. norm   :     0.1113188 α      lambda        0.6008981E-04
   maximum displ.:     0.0585997 α      in ANC's #8, #9, #5, ...

........................................................................
.............................. CYCLE   12 ..............................
........................................................................
   1    -37.4834061 -0.374834E+02  0.675E-02    2.98       0.0  T
   2    -37.4834076 -0.143448E-05  0.401E-02    2.98       1.0  T
   3    -37.4834075  0.101386E-06  0.925E-03    2.98       2.2  T
   4    -37.4834082 -0.718776E-06  0.513E-03    2.98       3.9  T
   5    -37.4834084 -0.243197E-06  0.190E-03    2.98      10.5  T
   6    -37.4834085 -0.262375E-07  0.750E-04    2.98      26.7  T
   7    -37.4834085 -0.188634E-08  0.376E-04    2.98      53.2  T
     SCC iter.                  ...        0 min,  0.008 sec
     gradient                   ...        0 min,  0.014 sec
 * total energy  :   -36.9437856 Eh     change        0.2597022E-04 Eh
   gradient norm :     0.0057353 Eh/α   predicted     0.3041718E-04 (  17.12%)
   displ. norm   :     0.0588165 α      lambda       -0.8756074E-04
   maximum displ.:     0.0395747 α      in ANC's #6, #3, #2, ...

........................................................................
.............................. CYCLE   13 ..............................
........................................................................
   1    -37.4814531 -0.374815E+02  0.321E-02    2.94       0.0  T
   2    -37.4814540 -0.949927E-06  0.194E-02    2.95       1.0  T
   3    -37.4814538  0.261292E-06  0.683E-03    2.95       2.9  T
   4    -37.4814543 -0.505305E-06  0.223E-03    2.95       9.0  T
   5    -37.4814543 -0.374666E-07  0.120E-03    2.95      16.6  T
     SCC iter.                  ...        0 min,  0.006 sec
     gradient                   ...        0 min,  0.014 sec
 * total energy  :   -36.9438237 Eh     change       -0.3810228E-04 Eh
   gradient norm :     0.0052123 Eh/α   predicted    -0.4393639E-04 (  15.31%)
   displ. norm   :     0.1353209 α      lambda       -0.4572588E-04
   maximum displ.:     0.0669615 α      in ANC's #8, #5, #4, ...

........................................................................
.............................. CYCLE   14 ..............................
........................................................................
   1    -37.4822451 -0.374822E+02  0.901E-02    2.97       0.0  T
   2    -37.4822477 -0.264086E-05  0.517E-02    2.97       1.0  T
   3    -37.4822466  0.114456E-05  0.146E-02    2.96       1.4  T
   4    -37.4822486 -0.198983E-05  0.766E-03    2.96       2.6  T
   5    -37.4822491 -0.523284E-06  0.225E-03    2.96       8.9  T
   6    -37.4822491 -0.303663E-07  0.928E-04    2.96      21.6  T
     SCC iter.                  ...        0 min,  0.007 sec
     gradient                   ...        0 min,  0.014 sec
 * total energy  :   -36.9438330 Eh     change       -0.9257940E-05 Eh
   gradient norm :     0.0012956 Eh/α   predicted    -0.2328405E-04 ( 151.50%)
   displ. norm   :     0.1002223 α      lambda       -0.2427703E-04
   maximum displ.:     0.0652085 α      in ANC's #8, #9, #5, ...

........................................................................
.............................. CYCLE   15 ..............................
........................................................................
   1    -37.4821389 -0.374821E+02  0.707E-02    2.96       0.0  T
   2    -37.4821406 -0.173576E-05  0.435E-02    2.96       1.0  T
   3    -37.4821409 -0.257985E-06  0.877E-03    2.96       2.3  T
   4    -37.4821418 -0.878635E-06  0.445E-03    2.96       4.5  T
   5    -37.4821419 -0.152307E-06  0.171E-03    2.96      11.7  T
   6    -37.4821419 -0.154162E-07  0.625E-04    2.96      32.0  T
   7    -37.4821419  0.520217E-09  0.327E-04    2.96      61.1  T
     SCC iter.                  ...        0 min,  0.008 sec
     gradient                   ...        0 min,  0.014 sec
 * total energy  :   -36.9438570 Eh     change       -0.2405018E-04 Eh
   gradient norm :     0.0017103 Eh/α   predicted    -0.1219435E-04 ( -49.30%)
   displ. norm   :     0.1149276 α      lambda       -0.2560194E-04
   maximum displ.:     0.0752630 α      in ANC's #8, #6, #4, ...

........................................................................
.............................. CYCLE   16 ..............................
........................................................................
   1    -37.4812316 -0.374812E+02  0.879E-02    2.95       0.0  T
   2    -37.4812346 -0.296113E-05  0.552E-02    2.95       1.0  T
   3    -37.4812358 -0.119443E-05  0.827E-03    2.95       2.4  T
   4    -37.4812367 -0.956182E-06  0.428E-03    2.95       4.7  T
   5    -37.4812368 -0.113060E-06  0.229E-03    2.95       8.7  T
   6    -37.4812369 -0.255677E-07  0.656E-04    2.95      30.5  T
   7    -37.4812369 -0.600541E-08  0.228E-04    2.95      87.8  T
     SCC iter.                  ...        0 min,  0.008 sec
     gradient                   ...        0 min,  0.014 sec
 * total energy  :   -36.9438848 Eh     change       -0.2776301E-04 Eh
   gradient norm :     0.0043234 Eh/α   predicted    -0.1288294E-04 ( -53.60%)
   displ. norm   :     0.0765332 α      lambda        0.1525710E-05
   maximum displ.:     0.0501777 α      in ANC's #8, #6, #4, ...

........................................................................
.............................. CYCLE   17 ..............................
........................................................................
   1    -37.4802592 -0.374803E+02  0.586E-02    2.94       0.0  T
   2    -37.4802606 -0.144417E-05  0.367E-02    2.94       1.0  T
   3    -37.4802611 -0.465074E-06  0.587E-03    2.94       3.4  T
   4    -37.4802616 -0.486848E-06  0.295E-03    2.94       6.8  T
   5    -37.4802617 -0.610398E-07  0.165E-03    2.94      12.1  T
     SCC iter.                  ...        0 min,  0.006 sec
     gradient                   ...        0 min,  0.014 sec
 * total energy  :   -36.9438810 Eh     change        0.3820364E-05 Eh
   gradient norm :     0.0080985 Eh/α   predicted     0.7661620E-06 ( -79.95%)
   displ. norm   :     0.0580775 α      lambda       -0.5128724E-04
   maximum displ.:     0.0291838 α      in ANC's #5, #1, #4, ...

........................................................................
.............................. CYCLE   18 ..............................
........................................................................
   1    -37.4814279 -0.374814E+02  0.343E-02    2.96       0.0  T
   2    -37.4814283 -0.426447E-06  0.188E-02    2.96       1.1  T
   3    -37.4814283  0.429842E-07  0.404E-03    2.95       4.9  T
   4    -37.4814284 -0.103301E-06  0.200E-03    2.95      10.0  T
   5    -37.4814284 -0.135983E-07  0.986E-04    2.95      20.3  T
     SCC iter.                  ...        0 min,  0.006 sec
     gradient                   ...        0 min,  0.014 sec
 * total energy  :   -36.9439170 Eh     change       -0.3598695E-04 Eh
   gradient norm :     0.0035354 Eh/α   predicted    -0.2573352E-04 ( -28.49%)
   displ. norm   :     0.1008893 α      lambda       -0.4651207E-04
   maximum displ.:     0.0745222 α      in ANC's #6, #1, #8, ...

........................................................................
.............................. CYCLE   19 ..............................
........................................................................
   1    -37.4819511 -0.374820E+02  0.667E-02    2.97       0.0  T
   2    -37.4819525 -0.143990E-05  0.402E-02    2.97       1.0  T
   3    -37.4819528 -0.275986E-06  0.790E-03    2.96       2.5  T
   4    -37.4819533 -0.516197E-06  0.430E-03    2.96       4.7  T
   5    -37.4819535 -0.121808E-06  0.195E-03    2.96      10.3  T
   6    -37.4819535 -0.446174E-07  0.751E-04    2.96      26.6  T
   7    -37.4819535 -0.145998E-08  0.363E-04    2.96      55.2  T
     SCC iter.                  ...        0 min,  0.008 sec
     gradient                   ...        0 min,  0.014 sec
 * total energy  :   -36.9439515 Eh     change       -0.3452302E-04 Eh
   gradient norm :     0.0013438 Eh/α   predicted    -0.2349454E-04 ( -31.95%)
   displ. norm   :     0.2779342 α      lambda       -0.5250816E-04
   maximum displ.:     0.2095674 α      in ANC's #6, #8, #1, ...

........................................................................
.............................. CYCLE   20 ..............................
........................................................................
   1    -37.4803313 -0.374803E+02  0.197E-01    2.92       0.0  T
   2    -37.4803459 -0.145243E-04  0.122E-01    2.93       1.0  T
   3    -37.4803486 -0.268342E-05  0.234E-02    2.93       1.0  T
   4    -37.4803561 -0.755631E-05  0.107E-02    2.94       1.9  T
   5    -37.4803567 -0.581552E-06  0.514E-03    2.93       3.9  T
   6    -37.4803569 -0.168405E-06  0.192E-03    2.93      10.4  T
   7    -37.4803569 -0.129533E-07  0.105E-03    2.93      19.1  T
   8    -37.4803569 -0.153767E-07  0.176E-04    2.93     113.7  T
   9    -37.4803569 -0.362057E-09  0.726E-05    2.93     275.3  T
     SCC iter.                  ...        0 min,  0.010 sec
     gradient                   ...        0 min,  0.014 sec
 * total energy  :   -36.9439650 Eh     change       -0.1346524E-04 Eh
   gradient norm :     0.0096635 Eh/α   predicted    -0.2715765E-04 ( 101.69%)
   displ. norm   :     0.0774955 α      lambda       -0.6673477E-04
   maximum displ.:     0.0439621 α      in ANC's #6, #8, #1, ...
 * RMSD in coord.:     0.3805601 α      energy gain  -0.6408569E-02 Eh

generating ANC from model Hessian ...
Using Lindh-Hessian (1995)
 Shifting diagonal of input Hessian by   3.640981765072201E-003
 Lowest  eigenvalues of input Hessian
   -0.000000    0.000000    0.000000    0.000000    0.000000    0.000000
    0.005000    0.006524    0.008098    0.008728    0.010694    0.013201
    0.014256    0.018478    0.018594    0.023448    0.028008    0.030700
 Highest eigenvalues
    1.524998    1.677821    1.831849    1.887745    2.018740    2.199073
 

........................................................................
.............................. CYCLE   21 ..............................
........................................................................
   1    -37.4819959 -0.374820E+02  0.591E-02    2.97       0.0  T
   2    -37.4819980 -0.209874E-05  0.355E-02    2.96       1.0  T
   3    -37.4819981 -0.422999E-07  0.818E-03    2.96       2.4  T
   4    -37.4819987 -0.609814E-06  0.406E-03    2.96       4.9  T
   5    -37.4819988 -0.157370E-06  0.180E-03    2.96      11.1  T
   6    -37.4819989 -0.286017E-07  0.718E-04    2.96      27.8  T
   7    -37.4819989 -0.117506E-08  0.419E-04    2.96      47.7  T
     SCC iter.                  ...        0 min,  0.008 sec
     gradient                   ...        0 min,  0.014 sec
 * total energy  :   -36.9439974 Eh     change       -0.3245447E-04 Eh
   gradient norm :     0.0018442 Eh/α   predicted     0.0000000E+00 (-100.00%)
   displ. norm   :     0.0235506 α      lambda       -0.8644690E-05
   maximum displ.:     0.0104921 α      in ANC's #8, #6, #4, ...

........................................................................
.............................. CYCLE   22 ..............................
........................................................................
   1    -37.4824745 -0.374825E+02  0.206E-02    2.97       0.0  T
   2    -37.4824747 -0.183170E-06  0.124E-02    2.97       1.6  T
   3    -37.4824747  0.287938E-07  0.292E-03    2.97       6.8  T
   4    -37.4824748 -0.112471E-06  0.143E-03    2.97      14.0  T
   5    -37.4824748 -0.183615E-07  0.580E-04    2.97      34.5  T
   6    -37.4824748 -0.242885E-08  0.223E-04    2.97      89.5  T
     SCC iter.                  ...        0 min,  0.007 sec
     gradient                   ...        0 min,  0.014 sec
 * total energy  :   -36.9440040 Eh     change       -0.6549264E-05 Eh
   gradient norm :     0.0008537 Eh/α   predicted    -0.4347301E-05 ( -33.62%)
   displ. norm   :     0.0483545 α      lambda       -0.9222509E-05
   maximum displ.:     0.0297086 α      in ANC's #6, #8, #5, ...

........................................................................
.............................. CYCLE   23 ..............................
........................................................................
   1    -37.4827488 -0.374827E+02  0.291E-02    2.97       0.0  T
   2    -37.4827491 -0.284940E-06  0.174E-02    2.97       1.1  T
   3    -37.4827491 -0.234585E-07  0.342E-03    2.97       5.8  T
   4    -37.4827492 -0.110765E-06  0.190E-03    2.97      10.5  T
   5    -37.4827493 -0.334324E-07  0.740E-04    2.97      27.0  T
   6    -37.4827493 -0.440710E-08  0.311E-04    2.97      64.3  T
     SCC iter.                  ...        0 min,  0.007 sec
     gradient                   ...        0 min,  0.014 sec
 * total energy  :   -36.9440062 Eh     change       -0.2276259E-05 Eh
   gradient norm :     0.0022314 Eh/α   predicted    -0.4616659E-05 ( 102.82%)
   displ. norm   :     0.0203654 α      lambda       -0.9368642E-05
   maximum displ.:     0.0144954 α      in ANC's #8, #6, #5, ...

........................................................................
.............................. CYCLE   24 ..............................
........................................................................
   1    -37.4825023 -0.374825E+02  0.179E-02    2.96       0.0  T
   2    -37.4825025 -0.139016E-06  0.111E-02    2.97       1.8  T
   3    -37.4825025 -0.597695E-07  0.189E-03    2.97      10.6  T
   4    -37.4825025 -0.247448E-07  0.105E-03    2.97      19.1  T
   5    -37.4825025 -0.561292E-08  0.559E-04    2.97      35.8  T
   6    -37.4825025 -0.363893E-08  0.188E-04    2.97     106.6  T
     SCC iter.                  ...        0 min,  0.007 sec
     gradient                   ...        0 min,  0.015 sec
 * total energy  :   -36.9440136 Eh     change       -0.7351421E-05 Eh
   gradient norm :     0.0010783 Eh/α   predicted    -0.4688436E-05 ( -36.22%)
   displ. norm   :     0.0791078 α      lambda       -0.1218668E-04
   maximum displ.:     0.0573304 α      in ANC's #8, #6, #5, ...

........................................................................
.............................. CYCLE   25 ..............................
........................................................................
   1    -37.4817823 -0.374818E+02  0.648E-02    2.95       0.0  T
   2    -37.4817840 -0.175692E-05  0.405E-02    2.95       1.0  T
   3    -37.4817842 -0.238087E-06  0.832E-03    2.95       2.4  T
   4    -37.4817852 -0.948675E-06  0.378E-03    2.95       5.3  T
   5    -37.4817853 -0.955206E-07  0.178E-03    2.95      11.2  T
   6    -37.4817853 -0.194480E-07  0.564E-04    2.95      35.5  T
   7    -37.4817853 -0.275058E-09  0.267E-04    2.95      75.0  T
     SCC iter.                  ...        0 min,  0.008 sec
     gradient                   ...        0 min,  0.015 sec
 * total energy  :   -36.9440195 Eh     change       -0.5881667E-05 Eh
   gradient norm :     0.0031443 Eh/α   predicted    -0.6111831E-05 (   3.91%)
   displ. norm   :     0.0055449 α      lambda       -0.5390742E-05
   maximum displ.:     0.0026143 α      in ANC's #9, #13, #5, ...

........................................................................
.............................. CYCLE   26 ..............................
........................................................................
   1    -37.4820644 -0.374821E+02  0.465E-03    2.96       0.0  T
   2    -37.4820644 -0.339424E-07  0.268E-03    2.96       7.5  T
   3    -37.4820644  0.343939E-08  0.105E-03    2.96      19.0  T
   4    -37.4820645 -0.870454E-08  0.388E-04    2.96      51.5  T
   5    -37.4820645 -0.645372E-09  0.234E-04    2.96      85.6  T
     SCC iter.                  ...        0 min,  0.006 sec
     gradient                   ...        0 min,  0.014 sec
 * total energy  :   -36.9440236 Eh     change       -0.4148774E-05 Eh
   gradient norm :     0.0016427 Eh/α   predicted    -0.2696366E-05 ( -35.01%)
   displ. norm   :     0.0480113 α      lambda       -0.7454976E-05
   maximum displ.:     0.0305590 α      in ANC's #6, #8, #9, ...

........................................................................
.............................. CYCLE   27 ..............................
........................................................................
   1    -37.4824989 -0.374825E+02  0.326E-02    2.97       0.0  T
   2    -37.4824994 -0.441231E-06  0.203E-02    2.97       1.0  T
   3    -37.4824993  0.726673E-07  0.487E-03    2.96       4.1  T
   4    -37.4824996 -0.366924E-06  0.179E-03    2.96      11.2  T
   5    -37.4824997 -0.148064E-07  0.102E-03    2.96      19.6  T
   6    -37.4824997 -0.719530E-08  0.358E-04    2.96      55.9  T
   7    -37.4824997 -0.455714E-09  0.134E-04    2.96     148.9  T
     SCC iter.                  ...        0 min,  0.008 sec
     gradient                   ...        0 min,  0.014 sec
 * total energy  :   -36.9440296 Eh     change       -0.5987077E-05 Eh
   gradient norm :     0.0009144 Eh/α   predicted    -0.3733687E-05 ( -37.64%)
   displ. norm   :     0.0603765 α      lambda       -0.3599147E-05
   maximum displ.:     0.0394117 α      in ANC's #6, #8, #5, ...

........................................................................
.............................. CYCLE   28 ..............................
........................................................................
   1    -37.4822521 -0.374823E+02  0.458E-02    2.96       0.0  T
   2    -37.4822529 -0.785310E-06  0.286E-02    2.96       1.0  T
   3    -37.4822532 -0.295549E-06  0.478E-03    2.96       4.2  T
   4    -37.4822535 -0.296295E-06  0.235E-03    2.96       8.5  T
   5    -37.4822535 -0.287594E-07  0.106E-03    2.96      18.9  T
   6    -37.4822535 -0.702060E-08  0.329E-04    2.96      60.8  T
   7    -37.4822535 -0.200501E-09  0.172E-04    2.96     116.6  T
     SCC iter.                  ...        0 min,  0.008 sec
     gradient                   ...        0 min,  0.014 sec
 * total energy  :   -36.9440332 Eh     change       -0.3563861E-05 Eh
   gradient norm :     0.0007463 Eh/α   predicted    -0.1804975E-05 ( -49.35%)
   displ. norm   :     0.0569657 α      lambda       -0.3013492E-05
   maximum displ.:     0.0392689 α      in ANC's #6, #8, #5, ...

   *** GEOMETRY OPTIMIZATION CONVERGED AFTER 28 ITERATIONS ***

------------------------------------------------------------------------
 total energy gain   :        -0.0064768 Eh       -4.0642 kcal/mol
 total RMSD          :         0.4181558 a0        0.2213 Å
 total power (kW/mol):        -0.6073139 (step)  -18.6180 (real)
------------------------------------------------------------------------

 ANCopt (total)                0 d,  0 h,  0 min,  0.913 sec
 optimizer setup                ...        0 min,  0.000 sec (  0.016%)
 model hessian                  ...        0 min,  0.023 sec (  2.566%)
 ANC generation                 ...        0 min,  0.001 sec (  0.156%)
 coordinate transformation      ...        0 min,  0.001 sec (  0.057%)
 single point calculation       ...        0 min,  0.877 sec ( 96.030%)
 optimization log               ...        0 min,  0.003 sec (  0.315%)
 hessian update                 ...        0 min,  0.000 sec (  0.040%)
 rational function              ...        0 min,  0.006 sec (  0.634%)

================
 final structure:
================
$coord
    2.50201330144522   -2.51283649058703    0.72849447745215      C 
    4.89684245953215   -0.33457479485495    0.65785708097322      S 
    2.77752882361679    2.09135027342146   -0.04208780839677      C 
    0.34494479465005    1.18408412088990   -0.16466700457375      C 
    0.19978854647293   -1.45989634319578    0.27409386744433      C 
   -2.23958076903994   -2.89677273646290    0.30013526367163      C 
   -4.38463983129938   -1.34193667156740   -0.84157011264339      C 
   -4.36218984947261    1.36924200467926    0.20417688611701      C 
   -4.53908841404961    1.26444828718586    3.04512233034612      C 
   -6.47059974584919    1.07605776006717    4.21384348729302      O 
   -1.96717340804066    2.73699830065468   -0.66050734738422      C 
    3.81002131446384    4.59148585177120   -0.35790104997255      C 
    2.73180358721371    6.55899226866752   -1.49191084609122      C 
    2.92813507080180   -4.45681920832114    1.10737737803555      H 
   -2.70847728388278   -3.38928738888619    2.25445555706738      H 
   -2.01842250112193   -4.66773900663319   -0.73818235213460      H 
   -6.19395420937078   -2.23474289198563   -0.41862055136143      H 
   -4.17047788261977   -1.25027441791269   -2.89247746479768      H 
   -6.03864412025719    2.35497503556042   -0.50324094269970      H 
   -2.68779801857512    1.36060782597226    4.02124624789826      H 
   -1.80629768524580    4.55792842807104    0.30148974020396      H 
   -2.11704895622078    3.11069859171128   -2.68990091664677      H 
    5.69972573050082    4.80410774639434    0.40022911667095      H 
    0.90319109528891    6.47536461151731   -2.36874118842062      H 
    3.70058632763473    8.34367036480105   -1.60626461166469      H 
$end
           -------------------------------------------------
          |                Final Singlepoint                |
           -------------------------------------------------

          ...................................................
          :                      SETUP                      :
          :.................................................:
          :  # basis functions                  70          :
          :  # atomic orbitals                  69          :
          :  # shells                           39          :
          :  # electrons                        68          :
          :  max. iterations                   250          :
          :  Hamiltonian                  GFN2-xTB          :
          :  restarted?                      false          :
          :  GBSA solvation                  false          :
          :  PC potential                    false          :
          :  electronic temp.          300.0000000     K    :
          :  accuracy                    1.0000000          :
          :  -> integral cutoff          0.2500000E+02      :
          :  -> integral neglect         0.1000000E-07      :
          :  -> SCF convergence          0.1000000E-05 Eh   :
          :  -> wf. convergence          0.1000000E-03 e    :
          :  Broyden damping             0.4000000          :
          ...................................................

 iter      E             dE          RMSdq      gap      omega  full diag
   1    -37.4822535 -0.374823E+02  0.803E-05    2.96       0.0  T
   2    -37.4822535 -0.857625E-11  0.348E-05    2.96     574.5  T
   3    -37.4822535  0.336087E-11  0.350E-05    2.96     571.5  T

   *** convergence criteria satisfied after 3 iterations ***

         #    Occupation            Energy/Eh            Energy/eV
      -------------------------------------------------------------
         1        2.0000           -0.7313752             -19.9017
       ...           ...                  ...                  ...
        28        2.0000           -0.4486616             -12.2087
        29        2.0000           -0.4431337             -12.0583
        30        2.0000           -0.4322280             -11.7615
        31        2.0000           -0.4296579             -11.6916
        32        2.0000           -0.4049328             -11.0188
        33        2.0000           -0.3905282             -10.6268
        34        2.0000           -0.3773670             -10.2687 (HOMO)
        35                         -0.2685983              -7.3089 (LUMO)
        36                         -0.2636622              -7.1746
        37                         -0.2067731              -5.6266
        38                         -0.1985076              -5.4017
        39                         -0.1520402              -4.1372
       ...                                ...                  ...
        69                          0.6765006              18.4085
      -------------------------------------------------------------
                  HL-Gap            0.1087687 Eh            2.9597 eV
             Fermi-level           -0.3229827 Eh           -8.7888 eV

 SCC (total)                   0 d,  0 h,  0 min,  0.029 sec
 SCC setup                      ...        0 min,  0.000 sec (  0.683%)
 Dispersion                     ...        0 min,  0.000 sec (  0.753%)
 integral evaluation            ...        0 min,  0.009 sec ( 31.750%)
 zeroth order Hamiltonian       ...        0 min,  0.000 sec (  0.571%)
 iterations                     ...        0 min,  0.004 sec ( 14.598%)
 molecular gradient             ...        0 min,  0.014 sec ( 50.212%)
 printout                       ...        0 min,  0.000 sec (  1.216%)

         :::::::::::::::::::::::::::::::::::::::::::::::::::::
         ::                     SUMMARY                     ::
         :::::::::::::::::::::::::::::::::::::::::::::::::::::
         :: total energy             -36.944033157655 Eh    ::
         :: gradient norm              0.000747464056 Eh/a0 ::
         :: HOMO-LUMO gap              2.959748001239 eV    ::
         ::.................................................::
         :: SCC energy               -37.482253507890 Eh    ::
         :: -> isotropic ES            0.023618436271 Eh    ::
         :: -> anisotropic ES          0.002844974714 Eh    ::
         :: -> anisotropic XC          0.017463119510 Eh    ::
         :: -> dispersion             -0.026108628552 Eh    ::
         :: repulsion energy           0.537971484440 Eh    ::
         :: add. restraining           0.000000000000 Eh    ::
         :::::::::::::::::::::::::::::::::::::::::::::::::::::

           -------------------------------------------------
          |                Property Printout                |
           -------------------------------------------------

    * Orbital Energies and Occupations

         #    Occupation            Energy/Eh            Energy/eV
      -------------------------------------------------------------
         1        2.0000           -0.7313752             -19.9017
       ...           ...                  ...                  ...
        22        2.0000           -0.4859386             -13.2231
        23        2.0000           -0.4842326             -13.1766
        24        2.0000           -0.4757707             -12.9464
        25        2.0000           -0.4710350             -12.8175
        26        2.0000           -0.4629380             -12.5972
        27        2.0000           -0.4554042             -12.3922
        28        2.0000           -0.4486616             -12.2087
        29        2.0000           -0.4431337             -12.0583
        30        2.0000           -0.4322280             -11.7615
        31        2.0000           -0.4296579             -11.6916
        32        2.0000           -0.4049328             -11.0188
        33        2.0000           -0.3905282             -10.6268
        34        2.0000           -0.3773670             -10.2687 (HOMO)
        35                         -0.2685983              -7.3089 (LUMO)
        36                         -0.2636622              -7.1746
        37                         -0.2067731              -5.6266
        38                         -0.1985076              -5.4017
        39                         -0.1520402              -4.1372
        40                         -0.1162438              -3.1632
        41                         -0.0051722              -0.1407
        42                          0.0298375               0.8119
        43                          0.0324117               0.8820
        44                          0.0706223               1.9217
        45                          0.0743843               2.0241
       ...                                ...                  ...
        69                          0.6765006              18.4085
      -------------------------------------------------------------
                  HL-Gap            0.1087687 Eh            2.9597 eV
             Fermi-level           -0.3229827 Eh           -8.7888 eV

     #   Z        covCN         q      C6AA      α(0)
     1   6 C      2.937    -0.033    28.818     8.804
     2  16 S      2.336    -0.046   142.960    20.124
     3   6 C      2.986     0.012    27.735     8.639
     4   6 C      3.152    -0.014    28.077     8.666
     5   6 C      3.159    -0.009    27.922     8.639
     6   6 C      3.807    -0.057    21.591     6.615
     7   6 C      3.810    -0.050    21.460     6.594
     8   6 C      3.856    -0.037    21.203     6.549
     9   6 C      2.763     0.218    23.393     7.921
    10   8 O      0.856    -0.324    20.213     6.028
    11   6 C      3.810    -0.058    21.607     6.617
    12   6 C      2.937    -0.030    28.752     8.794
    13   6 C      2.838    -0.094    30.345     9.027
    14   1 H      0.926     0.041     2.435     2.440
    15   1 H      0.924     0.042     2.424     2.435
    16   1 H      0.924     0.044     2.395     2.420
    17   1 H      0.924     0.045     2.382     2.413
    18   1 H      0.924     0.046     2.365     2.405
    19   1 H      0.924     0.058     2.223     2.332
    20   1 H      0.922     0.022     2.703     2.571
    21   1 H      0.924     0.046     2.367     2.406
    22   1 H      0.924     0.050     2.316     2.380
    23   1 H      0.925     0.044     2.402     2.423
    24   1 H      0.926     0.041     2.432     2.439
    25   1 H      0.926     0.041     2.432     2.439

 Mol. C6AA /au·bohr⁶  :       8160.109571
 Mol. C8AA /au·bohr⁸  :     217016.453625
 Mol. α(0) /au        :        142.119272


Wiberg/Mayer (AO) data.
largest (>0.10) Wiberg bond orders for each atom
          total WBO             WBO to atom ...
     1  C   3.946        C    5 1.581    S    2 1.195    H   14 0.970    C    3 0.103
     2  S   2.610        C    1 1.195    C    3 1.128
     3  C   3.945        C    4 1.501    C   12 1.131    S    2 1.128    C    1 0.103
     4  C   3.984        C    3 1.501    C    5 1.245    C   11 1.012
     5  C   3.985        C    1 1.581    C    4 1.245    C    6 1.007
     6  C   3.998        C    5 1.007    C    7 1.007    H   16 0.968    H   15 0.960
     7  C   3.994        C    6 1.007    H   17 0.977    H   18 0.974    C    8 0.963
     8  C   3.995        C    9 0.992    C   11 0.990    C    7 0.963    H   19 0.955
     9  C   3.908        O   10 1.932    C    8 0.992    H   20 0.930
    10  O   2.094        C    9 1.932
    11  C   3.997        C    4 1.012    C    8 0.990    H   21 0.963    H   22 0.956
    12  C   3.991        C   13 1.865    C    3 1.131    H   23 0.962
    13  C   3.990        C   12 1.865    H   25 0.978    H   24 0.973
    14  H   0.998        C    1 0.970
    15  H   0.998        C    6 0.960
    16  H   0.998        C    6 0.968
    17  H   0.997        C    7 0.977
    18  H   0.998        C    7 0.974
    19  H   0.996        C    8 0.955
    20  H   1.000        C    9 0.930
    21  H   0.998        C   11 0.963
    22  H   0.997        C   11 0.956
    23  H   0.998        C   12 0.962
    24  H   0.998        C   13 0.973
    25  H   0.998        C   13 0.978

molecular dipole:
                 x           y           z       tot (Debye)
 q only:        0.359      -0.018      -0.802
   full:        0.256      -0.046      -0.883       2.340
molecular quadrupole (traceless):
                xx          xy          yy          xz          yz          zz
 q only:       -6.413       1.859       7.919       9.627      -1.598      -1.506
  q+dip:       -9.592       1.951      11.246      12.276      -2.598      -1.654
   full:      -10.692       1.831      11.800      11.508      -2.028      -1.107

           -------------------------------------------------
          |                Geometry Summary                 |
           -------------------------------------------------

      molecular mass/u    :      192.2752000
   center of mass at/Å    :       -0.0625636       0.4424586       0.2677436
  moments of inertia/u·Å² :        0.4551326E+03   0.9396588E+03   0.1200898E+04
rotational constants/cm⁻¹ :        0.3703895E-01   0.1794016E-01   0.1403753E-01

 * 22 selected distances

     #   Z        #   Z                                     value/Å
     1   6 C      2  16 S                                 1.7135067
     2  16 S      3   6 C                                 1.7444018 (max)
     3   6 C      4   6 C                                 1.3754153
     1   6 C      5   6 C                                 1.3610663
     4   6 C      5   6 C                                 1.4203471
     6   6 C      7   6 C                                 1.5265902
     7   6 C      8   6 C                                 1.5377659
     9   6 C     10   8 O                                 1.1988097
     4   6 C     11   6 C                                 1.4970471
     8   6 C     11   6 C                                 1.5295456
    12   6 C     13   6 C                                 1.3302903
     1   6 C     14   1 H                                 1.0720511 (min)
     6   6 C     15   1 H                                 1.0950009
     6   6 C     16   1 H                                 1.0926371
     7   6 C     17   1 H                                 1.0908765
     7   6 C     18   1 H                                 1.0922722
     8   6 C     19   1 H                                 1.0951040
    11   6 C     21   1 H                                 1.0931201
    11   6 C     22   1 H                                 1.0948411
    12   6 C     23   1 H                                 1.0833219
    13   6 C     24   1 H                                 1.0740667
    13   6 C     25   1 H                                 1.0762863

 * 4 distinct bonds (by element types)

   Z      Z             #   av. dist./Å        max./Å        min./Å
   1 H    6 C          11     1.0872344     1.0951040     1.0720511
   6 C    6 C           8     1.4472585     1.5377659     1.3302903
   6 C    8 O           1     1.1988097     1.1988097     1.1988097
   6 C   16 S           2     1.7289543     1.7444018     1.7135067


optimized geometry written to: xtbopt.xyz


           -------------------------------------------------
          | TOTAL ENERGY              -36.944033157655 Eh   |
          | GRADIENT NORM               0.000747464056 Eh/α |
          | HOMO-LUMO GAP               2.959748001239 eV   |
           -------------------------------------------------

------------------------------------------------------------------------
 * finished run on 2021/05/19 at 11:01:04.661     
------------------------------------------------------------------------
 total:
 * wall-time:     0 d,  0 h,  0 min,  1.005 sec
 *  cpu-time:     0 d,  0 h,  0 min,  1.004 sec
 * ratio c/w:     0.999 speedup
 SCF:
 * wall-time:     0 d,  0 h,  0 min,  0.040 sec
 *  cpu-time:     0 d,  0 h,  0 min,  0.040 sec
 * ratio c/w:     1.000 speedup
 ANC optimizer:
 * wall-time:     0 d,  0 h,  0 min,  0.943 sec
 *  cpu-time:     0 d,  0 h,  0 min,  0.942 sec
 * ratio c/w:     1.000 speedup

