      -----------------------------------------------------------      
     |                   =====================                   |     
     |                           x T B                           |     
     |                   =====================                   |     
     |                         S. Grimme                         |     
     |          Mulliken Center for Theoretical Chemistry        |     
     |                    University of Bonn                     |     
     |                Version 6.2 RC2 (SAW190805)                |     
      -----------------------------------------------------------      

   This program is distributed in the hope that it will be useful,
   but WITHOUT ANY WARRANTY; without even the implied warranty of
   MERCHANTABILITY or FITNESS FOR A PARTICULAR PURPOSE.
   
   FOR NON-COMMERCIAL, ACADEMIA USE ONLY.
   
   Cite this work as:
   * S. Grimme, C. Bannwarth, P. Shushkov, J. Chem. Theory Comput., 2017,
     13, 1989-2009. DOI: 10.1021/acs.jctc.7b00118
   * C. Bannwarth, S. Ehlert and S. Grimme., J. Chem. Theory Comput., 2019,
     15, 1652-1671. DOI: 10.1021/acs.jctc.8b01176
   * P. Pracht, E. Caldeweyher, S. Ehlert, S. Grimme, ChemRxiv, 2019, preprint.
     DOI: 10.26434/chemrxiv.8326202.v1
   
   for DFT-D4:
   * E. Caldeweyher, C. Bannwarth and S. Grimme, J. Chem. Phys., 2017,
     147, 034112. DOI: 10.1063/1.4993215
   * E. Caldeweyher, S. Ehlert, A. Hansen, H. Neugebauer, S. Spicher,
     C. Bannwarth and S. Grimme, J. Chem. Phys., 2019, 150, 154122.
     DOI: 10.1063/1.5090222
   
   for sTDA-xTB:
   * S. Grimme and C. Bannwarth, J. Chem. Phys., 2016, 145, 054103.
     DOI: 10.1063/1.4959605
   
   in the mass-spec context:
   * V. Asgeirsson, C. Bauer and S. Grimme, Chem. Sci., 2017, 8, 4879.
     DOI: 10.1039/c7sc00601b
   
   for metadynamics refer to:
   * S. Grimme, J. Chem. Theory Comput., 2019, 155, 2847-2862
     DOI: 10.1021/acs.jctc.9b00143
   
   with help from (in alphabetical order)
   C. Bannwarth, F. Bohle, G. Brandenburg, E. Caldeweyher, M. Checinski,
   S. Dohm, S. Ehlert, S. Ehrlich, F. März, H. Neugebauer, J. Pisarek,
   P. Pracht, P. Shushkov, and S. Spicher.
   
 * started run on 2021/05/19 at 11:01:04.694     

           -------------------------------------------------
          |                Calculation Setup                |
           -------------------------------------------------

          program call               : /ihome/ghutchison/geoffh/xtb/xtb 884.xyz -opt
          hostname                   : smp-n83
          coordinate file            : 884.xyz
          omp threads                :                     1
          number of atoms            :                    27
          number of electrons        :                    72
          charge                     :                     0
          spin                       :                   0.0
          first test random number   :      0.18655129142891


########################################################################
# WARNING! Please study the warnings concerning your input carefully
#  - the use of '-opt' is discouraged, please use '--opt' next time
########################################################################

           ------------------------------------------------- 
          |                 G F N 2 - x T B                 |
          | Geometry, Frequencies, Noncovalent interactions |
          |            JCTC 2019 parametrisation            |
           ------------------------------------------------- 
             KAB for C  - Si     :                1.0500
             KAB for H  - Pd     :                0.9500
             k(s)              :                1.8500
             k(p)              :                2.2300
             k(d)              :                2.2300
             k(f)              :                2.0000
             kEN (H0ij)        :               -2.0000
             D4 a1             :                0.5200
             D4 a2             :                5.0000
             D4 s6             :                1.0000
             D4 s8             :                2.7000
             D4 s9             :                5.0000
             alphaj            :                2.0000

  Z AO/shell   Hii/eV     exponent
  1     Wed Apr 25 08:07:45 CEST 2018   EN: 2.200 GM2: 0.406  GM3: 0.0800  RAES: 1.40
     1s    -10.707211    1.230000
  6     Wed Apr 25 08:07:45 CEST 2018   EN: 2.550 GM2: 0.538  GM3: 0.1500  RAES: 3.00
     2s    -13.970922    2.096432
     2p    -10.063292    1.800000
  8     Wed Apr 25 08:07:45 CEST 2018   EN: 3.440 GM2: 0.452  GM3:-0.0517  RAES: 1.80
     2s    -20.229985    2.439742
     2p    -15.503117    2.137023
 16     Tue Apr 24 11:44:34 CEST 2018   EN: 2.580 GM2: 0.340  GM3:-0.0502  RAES: 3.10
     3s    -20.029654    1.981333
     3p    -11.377694    2.025643
     3d     -0.420282    1.702555

           ------------------------------------------------- 
          |        Self-Consistent Charge Iterations        |
           ------------------------------------------------- 

          ...................................................
          :                      SETUP                      :
          :.................................................:
          :  # basis functions                  72          :
          :  # atomic orbitals                  71          :
          :  # shells                           41          :
          :  # electrons                        72          :
          :  max. iterations                   250          :
          :  Hamiltonian                  GFN2-xTB          :
          :  restarted?                      false          :
          :  GBSA solvation                  false          :
          :  PC potential                    false          :
          :  electronic temp.          300.0000000     K    :
          :  accuracy                    1.0000000          :
          :  -> integral cutoff          0.2500000E+02      :
          :  -> integral neglect         0.1000000E-07      :
          :  -> SCF convergence          0.1000000E-05 Eh   :
          :  -> wf. convergence          0.1000000E-03 e    :
          :  Broyden damping             0.4000000          :
          ...................................................

 iter      E             dE          RMSdq      gap      omega  full diag
   1    -40.3003071 -0.403003E+02  0.401E+00    3.86       0.0  T
   2    -40.3607232 -0.604161E-01  0.209E+00    3.90       1.0  T
   3    -40.3600493  0.673878E-03  0.876E-01    3.87       1.0  T
   4    -40.3602358 -0.186478E-03  0.387E-01    3.82       1.0  T
   5    -40.3635477 -0.331188E-02  0.113E-01    3.85       1.0  T
   6    -40.3636265 -0.788763E-04  0.422E-02    3.86       1.0  T
   7    -40.3636385 -0.119600E-04  0.165E-02    3.86       1.2  T
   8    -40.3636388 -0.302033E-06  0.460E-03    3.86       4.2  T
   9    -40.3636388  0.271564E-07  0.280E-03    3.86       6.9  T
  10    -40.3636389 -0.118843E-06  0.104E-03    3.86      18.5  T
  11    -40.3636389 -0.125130E-07  0.439E-04    3.86      43.9  T
  12    -40.3636389 -0.811724E-10  0.134E-04    3.86     143.1  T

   *** convergence criteria satisfied after 12 iterations ***

         #    Occupation            Energy/Eh            Energy/eV
      -------------------------------------------------------------
         1        2.0000           -0.7267282             -19.7753
       ...           ...                  ...                  ...
        30        2.0000           -0.4487950             -12.2123
        31        2.0000           -0.4351394             -11.8407
        32        2.0000           -0.4347093             -11.8290
        33        2.0000           -0.4046539             -11.0112
        34        2.0000           -0.4009703             -10.9110
        35        2.0000           -0.3850795             -10.4785
        36        2.0000           -0.3828283             -10.4173 (HOMO)
        37                         -0.2410812              -6.5602 (LUMO)
        38                         -0.1959800              -5.3329
        39                         -0.1788325              -4.8663
        40                         -0.1087315              -2.9587
        41                         -0.0070786              -0.1926
       ...                                ...                  ...
        71                          0.6655549              18.1107
      -------------------------------------------------------------
                  HL-Gap            0.1417471 Eh            3.8571 eV
             Fermi-level           -0.3119548 Eh           -8.4887 eV

 SCC (total)                   0 d,  0 h,  0 min,  0.041 sec
 SCC setup                      ...        0 min,  0.000 sec (  0.752%)
 Dispersion                     ...        0 min,  0.000 sec (  0.922%)
 integral evaluation            ...        0 min,  0.010 sec ( 23.836%)
 zeroth order Hamiltonian       ...        0 min,  0.000 sec (  0.462%)
 iterations                     ...        0 min,  0.015 sec ( 36.695%)
 molecular gradient             ...        0 min,  0.015 sec ( 36.182%)
 printout                       ...        0 min,  0.000 sec (  1.019%)

         :::::::::::::::::::::::::::::::::::::::::::::::::::::
         ::                     SUMMARY                     ::
         :::::::::::::::::::::::::::::::::::::::::::::::::::::
         :: total energy             -39.913666742868 Eh    ::
         :: gradient norm              0.045355625643 Eh/a0 ::
         :: HOMO-LUMO gap              3.857135014002 eV    ::
         ::.................................................::
         :: SCC energy               -40.363638912512 Eh    ::
         :: -> isotropic ES            0.039004686827 Eh    ::
         :: -> anisotropic ES          0.004646861496 Eh    ::
         :: -> anisotropic XC          0.009425828916 Eh    ::
         :: -> dispersion             -0.025198551174 Eh    ::
         :: repulsion energy           0.449821452602 Eh    ::
         :: add. restraining           0.000000000000 Eh    ::
         :::::::::::::::::::::::::::::::::::::::::::::::::::::

      ----------------------------------------------------------- 
     |                   =====================                   |
     |                        A N C O P T                        |
     |                   =====================                   |
     |               Approximate Normal Coordinate               |
     |                Rational Function Optimizer                |
      ----------------------------------------------------------- 

          ...................................................
          :                      SETUP                      :
          :.................................................:
          :   optimization level            normal          :
          :   max. optcycles                   200          :
          :   ANC micro-cycles                  20          :
          :   degrees of freedom                75          :
          :.................................................:
          :   RF solver                   davidson          :
          :   input Hessian                  false          :
          :   write xtbopt.log                true          :
          :   linear?                        false          :
          :   energy convergence         0.5000000E-05 Eh   :
          :   grad. convergence          0.1000000E-02 Eh/α :
          :   maximium RF displ.         2.0000000          :
          :   Hlow (freq-cutoff)         0.5000000E-02      :
          :   Hmax (freq-cutoff)         5.0000000          :
          :   S6 in model hess.         20.0000000          :
          ...................................................

generating ANC from model Hessian ...
Using Lindh-Hessian (1995)
 Shifting diagonal of input Hessian by   3.815428031202337E-003
 Lowest  eigenvalues of input Hessian
    0.000000    0.000000    0.000000    0.000000    0.000000    0.000000
    0.005000    0.005897    0.006974    0.007391    0.008927    0.009631
    0.011490    0.012034    0.018769    0.022133    0.022389    0.023239
 Highest eigenvalues
    1.482900    1.485886    1.512890    1.643006    1.738540    1.799494
 

........................................................................
.............................. CYCLE    1 ..............................
........................................................................
   1    -40.3636389 -0.403636E+02  0.502E-05    3.86       0.0  T
   2    -40.3636389 -0.569855E-11  0.315E-05    3.86     611.6  T
   3    -40.3636389  0.170530E-11  0.179E-05    3.86    1072.7  T
     SCC iter.                  ...        0 min,  0.005 sec
     gradient                   ...        0 min,  0.015 sec
 * total energy  :   -39.9136668 Eh     change       -0.9395194E-08 Eh
   gradient norm :     0.0453558 Eh/α   predicted     0.0000000E+00 (-100.00%)
   displ. norm   :     0.3339042 α      lambda       -0.6020874E-02
   maximum displ.:     0.1805225 α      in ANC's #10, #15, #2, ...

........................................................................
.............................. CYCLE    2 ..............................
........................................................................
   1    -40.3848140 -0.403848E+02  0.198E-01    3.94       0.0  T
   2    -40.3848485 -0.345141E-04  0.105E-01    3.95       1.0  T
   3    -40.3848437  0.477354E-05  0.318E-02    3.95       1.0  T
   4    -40.3848484 -0.471687E-05  0.185E-02    3.95       1.0  T
   5    -40.3848539 -0.546639E-05  0.603E-03    3.95       3.2  T
   6    -40.3848541 -0.195421E-06  0.131E-03    3.95      14.7  T
   7    -40.3848541 -0.228523E-08  0.584E-04    3.95      32.9  T
     SCC iter.                  ...        0 min,  0.009 sec
     gradient                   ...        0 min,  0.014 sec
 * total energy  :   -39.9176944 Eh     change       -0.4027665E-02 Eh
   gradient norm :     0.0180301 Eh/α   predicted    -0.3346078E-02 ( -16.92%)
   displ. norm   :     0.2537854 α      lambda       -0.1417111E-02
   maximum displ.:     0.1416458 α      in ANC's #10, #2, #5, ...

........................................................................
.............................. CYCLE    3 ..............................
........................................................................
   1    -40.3926127 -0.403926E+02  0.144E-01    3.97       0.0  T
   2    -40.3926298 -0.170860E-04  0.801E-02    3.98       1.0  T
   3    -40.3926218  0.796112E-05  0.273E-02    3.98       1.0  T
   4    -40.3926307 -0.883512E-05  0.137E-02    3.98       1.4  T
   5    -40.3926338 -0.312849E-05  0.406E-03    3.98       4.7  T
   6    -40.3926338 -0.404728E-07  0.115E-03    3.98      16.7  T
   7    -40.3926338  0.188268E-08  0.770E-04    3.98      25.0  T
     SCC iter.                  ...        0 min,  0.009 sec
     gradient                   ...        0 min,  0.014 sec
 * total energy  :   -39.9185792 Eh     change       -0.8848265E-03 Eh
   gradient norm :     0.0065508 Eh/α   predicted    -0.7541925E-03 ( -14.76%)
   displ. norm   :     0.1901928 α      lambda       -0.3557368E-03
   maximum displ.:     0.1023549 α      in ANC's #2, #5, #9, ...

........................................................................
.............................. CYCLE    4 ..............................
........................................................................
   1    -40.3927795 -0.403928E+02  0.883E-02    3.97       0.0  T
   2    -40.3927829 -0.343561E-05  0.518E-02    3.97       1.0  T
   3    -40.3927811  0.180798E-05  0.115E-02    3.97       1.7  T
   4    -40.3927832 -0.207095E-05  0.555E-03    3.97       3.5  T
   5    -40.3927837 -0.566329E-06  0.189E-03    3.97      10.2  T
   6    -40.3927837 -0.134666E-07  0.857E-04    3.97      22.5  T
     SCC iter.                  ...        0 min,  0.008 sec
     gradient                   ...        0 min,  0.014 sec
 * total energy  :   -39.9188360 Eh     change       -0.2567759E-03 Eh
   gradient norm :     0.0036769 Eh/α   predicted    -0.1843034E-03 ( -28.22%)
   displ. norm   :     0.1906474 α      lambda       -0.2056843E-03
   maximum displ.:     0.1034490 α      in ANC's #2, #8, #4, ...

........................................................................
.............................. CYCLE    5 ..............................
........................................................................
   1    -40.3915256 -0.403915E+02  0.847E-02    3.96       0.0  T
   2    -40.3915269 -0.136056E-05  0.506E-02    3.96       1.0  T
   3    -40.3915263  0.689324E-06  0.698E-03    3.96       2.8  T
   4    -40.3915271 -0.859009E-06  0.336E-03    3.96       5.7  T
   5    -40.3915273 -0.177506E-06  0.140E-03    3.96      13.8  T
   6    -40.3915273 -0.101024E-07  0.554E-04    3.96      34.8  T
   7    -40.3915273 -0.247582E-09  0.259E-04    3.96      74.4  T
     SCC iter.                  ...        0 min,  0.009 sec
     gradient                   ...        0 min,  0.015 sec
 * total energy  :   -39.9189720 Eh     change       -0.1359833E-03 Eh
   gradient norm :     0.0028944 Eh/α   predicted    -0.1065814E-03 ( -21.62%)
   displ. norm   :     0.1145307 α      lambda       -0.6457559E-04
   maximum displ.:     0.0640447 α      in ANC's #2, #8, #4, ...

........................................................................
.............................. CYCLE    6 ..............................
........................................................................
   1    -40.3911918 -0.403912E+02  0.594E-02    3.96       0.0  T
   2    -40.3911923 -0.503878E-06  0.354E-02    3.96       1.0  T
   3    -40.3911918  0.434076E-06  0.574E-03    3.96       3.4  T
   4    -40.3911924 -0.548769E-06  0.285E-03    3.96       6.8  T
   5    -40.3911925 -0.945974E-07  0.980E-04    3.96      19.6  T
   6    -40.3911925 -0.771735E-08  0.394E-04    3.96      48.9  T
     SCC iter.                  ...        0 min,  0.008 sec
     gradient                   ...        0 min,  0.015 sec
 * total energy  :   -39.9190178 Eh     change       -0.4583493E-04 Eh
   gradient norm :     0.0024020 Eh/α   predicted    -0.3271561E-04 ( -28.62%)
   displ. norm   :     0.0956125 α      lambda       -0.4047188E-04
   maximum displ.:     0.0535685 α      in ANC's #2, #8, #4, ...

........................................................................
.............................. CYCLE    7 ..............................
........................................................................
   1    -40.3914056 -0.403914E+02  0.562E-02    3.97       0.0  T
   2    -40.3914061 -0.514577E-06  0.344E-02    3.96       1.0  T
   3    -40.3914053  0.815809E-06  0.623E-03    3.97       3.1  T
   4    -40.3914064 -0.104628E-05  0.209E-03    3.96       9.2  T
   5    -40.3914064 -0.500779E-07  0.874E-04    3.96      22.0  T
   6    -40.3914064  0.813429E-10  0.425E-04    3.96      45.3  T
     SCC iter.                  ...        0 min,  0.008 sec
     gradient                   ...        0 min,  0.015 sec
 * total energy  :   -39.9190475 Eh     change       -0.2962503E-04 Eh
   gradient norm :     0.0015770 Eh/α   predicted    -0.2042150E-04 ( -31.07%)
   displ. norm   :     0.1388846 α      lambda       -0.2958601E-04
   maximum displ.:     0.0756636 α      in ANC's #2, #4, #8, ...

........................................................................
.............................. CYCLE    8 ..............................
........................................................................
   1    -40.3919649 -0.403920E+02  0.943E-02    3.97       0.0  T
   2    -40.3919665 -0.167105E-05  0.558E-02    3.97       1.0  T
   3    -40.3919659  0.654126E-06  0.100E-02    3.97       1.9  T
   4    -40.3919667 -0.825312E-06  0.612E-03    3.97       3.1  T
   5    -40.3919673 -0.555489E-06  0.141E-03    3.97      13.7  T
   6    -40.3919673 -0.150808E-07  0.648E-04    3.97      29.7  T
   7    -40.3919673 -0.413558E-08  0.344E-04    3.97      55.9  T
     SCC iter.                  ...        0 min,  0.009 sec
     gradient                   ...        0 min,  0.015 sec
 * total energy  :   -39.9190722 Eh     change       -0.2475619E-04 Eh
   gradient norm :     0.0018746 Eh/α   predicted    -0.1492148E-04 ( -39.73%)
   displ. norm   :     0.1386771 α      lambda        0.2274514E-04
   maximum displ.:     0.0756637 α      in ANC's #2, #4, #8, ...

........................................................................
.............................. CYCLE    9 ..............................
........................................................................
   1    -40.3921073 -0.403921E+02  0.944E-02    3.97       0.0  T
   2    -40.3921090 -0.165110E-05  0.559E-02    3.97       1.0  T
   3    -40.3921084  0.635464E-06  0.996E-03    3.97       1.9  T
   4    -40.3921092 -0.816636E-06  0.604E-03    3.97       3.2  T
   5    -40.3921097 -0.544641E-06  0.138E-03    3.97      13.9  T
   6    -40.3921097 -0.143870E-07  0.636E-04    3.97      30.2  T
   7    -40.3921097 -0.353454E-08  0.349E-04    3.97      55.2  T
     SCC iter.                  ...        0 min,  0.009 sec
     gradient                   ...        0 min,  0.015 sec
 * total energy  :   -39.9190549 Eh     change        0.1731215E-04 Eh
   gradient norm :     0.0041202 Eh/α   predicted     0.1146897E-04 ( -33.75%)
   displ. norm   :     0.0599083 α      lambda       -0.3671307E-04
   maximum displ.:     0.0353872 α      in ANC's #8, #2, #4, ...

........................................................................
.............................. CYCLE   10 ..............................
........................................................................
   1    -40.3923137 -0.403923E+02  0.475E-02    3.97       0.0  T
   2    -40.3923143 -0.649034E-06  0.268E-02    3.97       1.0  T
   3    -40.3923140  0.341263E-06  0.647E-03    3.97       3.0  T
   4    -40.3923144 -0.412130E-06  0.374E-03    3.97       5.2  T
   5    -40.3923146 -0.178663E-06  0.682E-04    3.97      28.2  T
   6    -40.3923146 -0.272775E-08  0.319E-04    3.97      60.4  T
     SCC iter.                  ...        0 min,  0.008 sec
     gradient                   ...        0 min,  0.014 sec
 * total energy  :   -39.9190809 Eh     change       -0.2597230E-04 Eh
   gradient norm :     0.0021986 Eh/α   predicted    -0.1842258E-04 ( -29.07%)
   displ. norm   :     0.0414722 α      lambda       -0.1989710E-04
   maximum displ.:     0.0325154 α      in ANC's #8, #5, #3, ...

........................................................................
.............................. CYCLE   11 ..............................
........................................................................
   1    -40.3922239 -0.403922E+02  0.274E-02    3.97       0.0  T
   2    -40.3922242 -0.286439E-06  0.159E-02    3.97       1.2  T
   3    -40.3922236  0.574783E-06  0.550E-03    3.97       3.5  T
   4    -40.3922243 -0.690955E-06  0.199E-03    3.97       9.7  T
   5    -40.3922243 -0.324948E-07  0.538E-04    3.97      35.7  T
   6    -40.3922243 -0.535699E-09  0.164E-04    3.97     117.0  T
     SCC iter.                  ...        0 min,  0.008 sec
     gradient                   ...        0 min,  0.015 sec
 * total energy  :   -39.9190940 Eh     change       -0.1312511E-04 Eh
   gradient norm :     0.0005492 Eh/α   predicted    -0.9968049E-05 ( -24.05%)
   displ. norm   :     0.0679087 α      lambda       -0.9417912E-05
   maximum displ.:     0.0339856 α      in ANC's #4, #3, #2, ...

........................................................................
.............................. CYCLE   12 ..............................
........................................................................
   1    -40.3920805 -0.403921E+02  0.427E-02    3.96       0.0  T
   2    -40.3920808 -0.336480E-06  0.231E-02    3.97       1.0  T
   3    -40.3920805  0.300636E-06  0.535E-03    3.96       3.6  T
   4    -40.3920808 -0.339469E-06  0.297E-03    3.97       6.5  T
   5    -40.3920809 -0.919944E-07  0.469E-04    3.97      41.1  T
   6    -40.3920809 -0.226694E-08  0.265E-04    3.97      72.6  T
     SCC iter.                  ...        0 min,  0.008 sec
     gradient                   ...        0 min,  0.015 sec
 * total energy  :   -39.9191037 Eh     change       -0.9659623E-05 Eh
   gradient norm :     0.0009112 Eh/α   predicted    -0.4719583E-05 ( -51.14%)
   displ. norm   :     0.0929453 α      lambda       -0.8273866E-05
   maximum displ.:     0.0523656 α      in ANC's #4, #2, #1, ...

........................................................................
.............................. CYCLE   13 ..............................
........................................................................
   1    -40.3919169 -0.403919E+02  0.607E-02    3.96       0.0  T
   2    -40.3919175 -0.590372E-06  0.339E-02    3.97       1.0  T
   3    -40.3919174  0.611083E-07  0.648E-03    3.96       3.0  T
   4    -40.3919174  0.771755E-07  0.455E-03    3.97       4.2  T
   5    -40.3919177 -0.355746E-06  0.653E-04    3.97      29.5  T
   6    -40.3919177 -0.586083E-08  0.319E-04    3.96      60.4  T
     SCC iter.                  ...        0 min,  0.008 sec
     gradient                   ...        0 min,  0.015 sec
 * total energy  :   -39.9191125 Eh     change       -0.8857523E-05 Eh
   gradient norm :     0.0009022 Eh/α   predicted    -0.4155329E-05 ( -53.09%)
   displ. norm   :     0.0951062 α      lambda       -0.5882408E-05
   maximum displ.:     0.0544049 α      in ANC's #4, #2, #1, ...

........................................................................
.............................. CYCLE   14 ..............................
........................................................................
   1    -40.3918520 -0.403919E+02  0.562E-02    3.97       0.0  T
   2    -40.3918523 -0.368413E-06  0.332E-02    3.97       1.0  T
   3    -40.3918523  0.795591E-07  0.496E-03    3.97       3.9  T
   4    -40.3918523 -0.902348E-07  0.335E-03    3.97       5.7  T
   5    -40.3918525 -0.168467E-06  0.778E-04    3.97      24.7  T
   6    -40.3918525 -0.753995E-08  0.335E-04    3.97      57.4  T
     SCC iter.                  ...        0 min,  0.008 sec
     gradient                   ...        0 min,  0.015 sec
 * total energy  :   -39.9191174 Eh     change       -0.4912916E-05 Eh
   gradient norm :     0.0008604 Eh/α   predicted    -0.2956779E-05 ( -39.82%)
   displ. norm   :     0.0447156 α      lambda       -0.2985715E-05
   maximum displ.:     0.0237084 α      in ANC's #1, #4, #2, ...

   *** GEOMETRY OPTIMIZATION CONVERGED AFTER 14 ITERATIONS ***

------------------------------------------------------------------------
 total energy gain   :        -0.0054507 Eh       -3.4204 kcal/mol
 total RMSD          :         0.2417338 a0        0.1279 Å
 total power (kW/mol):        -1.0221991 (step)  -29.9901 (real)
------------------------------------------------------------------------

 ANCopt (total)                0 d,  0 h,  0 min,  0.477 sec
 optimizer setup                ...        0 min,  0.000 sec (  0.035%)
 model hessian                  ...        0 min,  0.009 sec (  1.978%)
 ANC generation                 ...        0 min,  0.001 sec (  0.162%)
 coordinate transformation      ...        0 min,  0.000 sec (  0.058%)
 single point calculation       ...        0 min,  0.462 sec ( 96.778%)
 optimization log               ...        0 min,  0.002 sec (  0.329%)
 hessian update                 ...        0 min,  0.000 sec (  0.043%)
 rational function              ...        0 min,  0.002 sec (  0.427%)

================
 final structure:
================
$coord
    2.19830934239405    2.08940513801876    1.29465519646222      C 
    4.40839135701983    0.53486692612002   -0.50119336437344      S 
    2.12045706098600   -1.37928198749232   -1.77736655090962      C 
   -0.21495655818751   -0.84370889740854   -0.85585947656117      C 
   -0.17113704017430    1.17460909351303    0.92102065176260      C 
   -2.50635968975545    2.17491738046735    2.18774286442159      C 
   -1.88807696916863    2.71163652448597    4.73464378423612      O 
   -3.67255552905694    4.18963176443774    6.02762280871471      C 
   -4.66377035756104    0.25264354792727    1.91791946375187      C 
   -4.89866148813926   -0.63583489194417   -0.81217967998370      C 
   -2.59059659159161   -2.22216635316921   -1.57165099425645      C 
   -2.48271360252885   -2.73677442583513   -4.19436538529100      O 
   -4.23725622314194   -4.53268510573760   -5.05147541712947      C 
    2.76818589011243    3.57687728072005    2.54219991922428      H 
    2.61792180747570   -2.78098898213646   -3.14895598449165      H 
   -3.07384729303994    3.95327985834898    1.24124067775543      H 
   -2.80814192173276    4.68678993202552    7.82720761611673      H 
   -5.43184315936389    3.15540324594431    6.38717564085100      H 
   -4.11747691574557    5.92283682441370    4.97618280699940      H 
   -6.44074862199984    1.10875247486621    2.52233092241541      H 
   -4.26368865089654   -1.35397179652914    3.15199017516257      H 
   -5.01815761717243    0.99076468585498   -2.07848275308206      H 
   -6.61748820558925   -1.75546492055021   -1.03019737475453      H 
   -2.65438440971648   -4.03569843372809   -0.52904827686599      H 
   -3.72990784484942   -4.94359000208651   -7.00211480389777      H 
   -6.17937173866934   -3.81700139501666   -4.99626903203799      H 
   -4.13394491763243   -6.27611669255029   -3.93326928887956      H 
$end
           -------------------------------------------------
          |                Final Singlepoint                |
           -------------------------------------------------

          ...................................................
          :                      SETUP                      :
          :.................................................:
          :  # basis functions                  72          :
          :  # atomic orbitals                  71          :
          :  # shells                           41          :
          :  # electrons                        72          :
          :  max. iterations                   250          :
          :  Hamiltonian                  GFN2-xTB          :
          :  restarted?                      false          :
          :  GBSA solvation                  false          :
          :  PC potential                    false          :
          :  electronic temp.          300.0000000     K    :
          :  accuracy                    1.0000000          :
          :  -> integral cutoff          0.2500000E+02      :
          :  -> integral neglect         0.1000000E-07      :
          :  -> SCF convergence          0.1000000E-05 Eh   :
          :  -> wf. convergence          0.1000000E-03 e    :
          :  Broyden damping             0.4000000          :
          ...................................................

 iter      E             dE          RMSdq      gap      omega  full diag
   1    -40.3918525 -0.403919E+02  0.133E-04    3.97       0.0  T
   2    -40.3918525 -0.100620E-09  0.797E-05    3.97     241.4  T
   3    -40.3918525 -0.178865E-09  0.415E-05    3.97     463.6  T

   *** convergence criteria satisfied after 3 iterations ***

         #    Occupation            Energy/Eh            Energy/eV
      -------------------------------------------------------------
         1        2.0000           -0.7251665             -19.7328
       ...           ...                  ...                  ...
        30        2.0000           -0.4493502             -12.2274
        31        2.0000           -0.4349055             -11.8344
        32        2.0000           -0.4346599             -11.8277
        33        2.0000           -0.4055691             -11.0361
        34        2.0000           -0.4017135             -10.9312
        35        2.0000           -0.3847104             -10.4685
        36        2.0000           -0.3846469             -10.4668 (HOMO)
        37                         -0.2388805              -6.5003 (LUMO)
        38                         -0.1965910              -5.3495
        39                         -0.1706135              -4.6426
        40                         -0.1086246              -2.9558
        41                          0.0047355               0.1289
       ...                                ...                  ...
        71                          0.6915986              18.8194
      -------------------------------------------------------------
                  HL-Gap            0.1457664 Eh            3.9665 eV
             Fermi-level           -0.3117637 Eh           -8.4835 eV

 SCC (total)                   0 d,  0 h,  0 min,  0.030 sec
 SCC setup                      ...        0 min,  0.000 sec (  0.692%)
 Dispersion                     ...        0 min,  0.000 sec (  0.732%)
 integral evaluation            ...        0 min,  0.010 sec ( 31.939%)
 zeroth order Hamiltonian       ...        0 min,  0.000 sec (  0.578%)
 iterations                     ...        0 min,  0.004 sec ( 14.745%)
 molecular gradient             ...        0 min,  0.015 sec ( 49.888%)
 printout                       ...        0 min,  0.000 sec (  1.212%)

         :::::::::::::::::::::::::::::::::::::::::::::::::::::
         ::                     SUMMARY                     ::
         :::::::::::::::::::::::::::::::::::::::::::::::::::::
         :: total energy             -39.919117442654 Eh    ::
         :: gradient norm              0.000860727625 Eh/a0 ::
         :: HOMO-LUMO gap              3.966506299459 eV    ::
         ::.................................................::
         :: SCC energy               -40.391852518672 Eh    ::
         :: -> isotropic ES            0.037441855854 Eh    ::
         :: -> anisotropic ES          0.003927101478 Eh    ::
         :: -> anisotropic XC          0.008999010596 Eh    ::
         :: -> dispersion             -0.025492246935 Eh    ::
         :: repulsion energy           0.472584075464 Eh    ::
         :: add. restraining           0.000000000000 Eh    ::
         :::::::::::::::::::::::::::::::::::::::::::::::::::::

           -------------------------------------------------
          |                Property Printout                |
           -------------------------------------------------

    * Orbital Energies and Occupations

         #    Occupation            Energy/Eh            Energy/eV
      -------------------------------------------------------------
         1        2.0000           -0.7251665             -19.7328
       ...           ...                  ...                  ...
        24        2.0000           -0.4797333             -13.0542
        25        2.0000           -0.4680816             -12.7371
        26        2.0000           -0.4664584             -12.6930
        27        2.0000           -0.4654675             -12.6660
        28        2.0000           -0.4611032             -12.5473
        29        2.0000           -0.4511399             -12.2761
        30        2.0000           -0.4493502             -12.2274
        31        2.0000           -0.4349055             -11.8344
        32        2.0000           -0.4346599             -11.8277
        33        2.0000           -0.4055691             -11.0361
        34        2.0000           -0.4017135             -10.9312
        35        2.0000           -0.3847104             -10.4685
        36        2.0000           -0.3846469             -10.4668 (HOMO)
        37                         -0.2388805              -6.5003 (LUMO)
        38                         -0.1965910              -5.3495
        39                         -0.1706135              -4.6426
        40                         -0.1086246              -2.9558
        41                          0.0047355               0.1289
        42                          0.0111713               0.3040
        43                          0.0337320               0.9179
        44                          0.0376006               1.0232
        45                          0.0491595               1.3377
        46                          0.0727299               1.9791
        47                          0.0774272               2.1069
       ...                                ...                  ...
        71                          0.6915986              18.8194
      -------------------------------------------------------------
                  HL-Gap            0.1457664 Eh            3.9665 eV
             Fermi-level           -0.3117637 Eh           -8.4835 eV

     #   Z        covCN         q      C6AA      α(0)
     1   6 C      2.941    -0.024    28.600     8.771
     2  16 S      2.309    -0.015   141.662    20.032
     3   6 C      2.941    -0.024    28.601     8.771
     4   6 C      3.174    -0.016    28.001     8.642
     5   6 C      3.174    -0.016    28.003     8.643
     6   6 C      3.751     0.120    18.685     6.164
     7   8 O      1.701    -0.317    19.297     5.931
     8   6 C      3.645     0.043    20.184     6.457
     9   6 C      3.806    -0.067    21.773     6.643
    10   6 C      3.806    -0.067    21.772     6.642
    11   6 C      3.752     0.120    18.684     6.164
    12   8 O      1.701    -0.317    19.297     5.931
    13   6 C      3.645     0.043    20.183     6.457
    14   1 H      0.927     0.056     2.241     2.341
    15   1 H      0.927     0.057     2.240     2.340
    16   1 H      0.922     0.018     2.769     2.603
    17   1 H      0.925     0.059     2.216     2.328
    18   1 H      0.924     0.028     2.608     2.526
    19   1 H      0.923     0.027     2.631     2.537
    20   1 H      0.924     0.035     2.511     2.478
    21   1 H      0.924     0.044     2.390     2.418
    22   1 H      0.924     0.045     2.389     2.417
    23   1 H      0.924     0.035     2.510     2.478
    24   1 H      0.922     0.018     2.767     2.601
    25   1 H      0.925     0.059     2.217     2.328
    26   1 H      0.924     0.029     2.607     2.525
    27   1 H      0.924     0.027     2.629     2.536

 Mol. C6AA /au·bohr⁶  :       8230.280596
 Mol. C8AA /au·bohr⁸  :     209367.595113
 Mol. α(0) /au        :        139.703688


Wiberg/Mayer (AO) data.
largest (>0.10) Wiberg bond orders for each atom
          total WBO             WBO to atom ...
     1  C   3.949        C    5 1.609    S    2 1.194    H   14 0.969    C    3 0.116
     2  S   2.636        C    1 1.194    C    3 1.194
     3  C   3.948        C    4 1.609    S    2 1.194    H   15 0.969    C    1 0.116
     4  C   3.983        C    3 1.609    C    5 1.224    C   11 0.986
     5  C   3.983        C    1 1.609    C    4 1.224    C    6 0.986
     6  C   3.955        C    5 0.986    C    9 0.981    O    7 0.971    H   16 0.945
     7  O   2.076        C    8 0.998    C    6 0.971
     8  C   3.954        O    7 0.998    H   17 0.979    H   18 0.977    H   19 0.976
     9  C   3.997        C   10 1.008    C    6 0.981    H   21 0.976    H   20 0.975
    10  C   3.997        C    9 1.008    C   11 0.981    H   22 0.976    H   23 0.975
    11  C   3.955        C    4 0.986    C   10 0.981    O   12 0.971    H   24 0.945
    12  O   2.076        C   13 0.998    C   11 0.971
    13  C   3.954        O   12 0.998    H   25 0.979    H   26 0.977    H   27 0.976
    14  H   0.996        C    1 0.969
    15  H   0.996        C    3 0.969
    16  H   1.000        C    6 0.945
    17  H   0.996        C    8 0.979
    18  H   0.999        C    8 0.977
    19  H   0.999        C    8 0.976
    20  H   0.998        C    9 0.975
    21  H   0.998        C    9 0.976
    22  H   0.998        C   10 0.976
    23  H   0.998        C   10 0.975
    24  H   1.000        C   11 0.945
    25  H   0.996        C   13 0.979
    26  H   0.999        C   13 0.977
    27  H   0.999        C   13 0.976

molecular dipole:
                 x           y           z       tot (Debye)
 q only:       -0.697      -0.058       0.082
   full:       -1.368      -0.112       0.161       3.513
molecular quadrupole (traceless):
                xx          xy          yy          xz          yz          zz
 q only:        2.968       0.485       1.237      -1.256       4.339      -4.205
  q+dip:        2.193      -0.091       4.768      -1.458       3.934      -6.961
   full:        1.570      -0.042       4.363      -1.319       4.515      -5.933

           -------------------------------------------------
          |                Geometry Summary                 |
           -------------------------------------------------

      molecular mass/u    :      198.2794000
   center of mass at/Å    :       -0.5388694       0.0490492       0.0692377
  moments of inertia/u·Å² :        0.6050463E+03   0.8284212E+03   0.1393763E+04
rotational constants/cm⁻¹ :        0.2786172E-01   0.2034911E-01   0.1209505E-01

 * 26 selected distances

     #   Z        #   Z                                     value/Å
     1   6 C      2  16 S                                 1.7168621
     2  16 S      3   6 C                                 1.7169521 (max)
     3   6 C      4   6 C                                 1.3584683
     1   6 C      5   6 C                                 1.3585260
     4   6 C      5   6 C                                 1.4231652
     6   6 C      7   8 O                                 1.4156896
     7   8 O      8   6 C                                 1.4041286
     6   6 C      9   6 C                                 1.5357415
     9   6 C     10   6 C                                 1.5243620
    10   6 C     11   6 C                                 1.5355633
    11   6 C     12   8 O                                 1.4154963
    12   8 O     13   6 C                                 1.4039016
     1   6 C     14   1 H                                 1.0706788
     3   6 C     15   1 H                                 1.0706541 (min)
     6   6 C     16   1 H                                 1.1075469
     8   6 C     17   1 H                                 1.0887277
     8   6 C     18   1 H                                 1.0965595
     8   6 C     19   1 H                                 1.0982794
     9   6 C     20   1 H                                 1.0916822
     9   6 C     21   1 H                                 1.0927490
    10   6 C     22   1 H                                 1.0926747
    10   6 C     23   1 H                                 1.0916285
    11   6 C     24   1 H                                 1.1074844
    13   6 C     25   1 H                                 1.0885164
    13   6 C     26   1 H                                 1.0956734
    13   6 C     27   1 H                                 1.0974034

 * 4 distinct bonds (by element types)

   Z      Z             #   av. dist./Å        max./Å        min./Å
   1 H    6 C          14     1.0921613     1.1075469     1.0706541
   6 C    6 C           6     1.4559711     1.5357415     1.3584683
   6 C    8 O           4     1.4098041     1.4156896     1.4039016
   6 C   16 S           2     1.7169071     1.7169521     1.7168621


optimized geometry written to: xtbopt.xyz


           -------------------------------------------------
          | TOTAL ENERGY              -39.919117442654 Eh   |
          | GRADIENT NORM               0.000860727625 Eh/α |
          | HOMO-LUMO GAP               3.966506299459 eV   |
           -------------------------------------------------

------------------------------------------------------------------------
 * finished run on 2021/05/19 at 11:01:05.266     
------------------------------------------------------------------------
 total:
 * wall-time:     0 d,  0 h,  0 min,  0.572 sec
 *  cpu-time:     0 d,  0 h,  0 min,  0.570 sec
 * ratio c/w:     0.998 speedup
 SCF:
 * wall-time:     0 d,  0 h,  0 min,  0.042 sec
 *  cpu-time:     0 d,  0 h,  0 min,  0.041 sec
 * ratio c/w:     0.999 speedup
 ANC optimizer:
 * wall-time:     0 d,  0 h,  0 min,  0.508 sec
 *  cpu-time:     0 d,  0 h,  0 min,  0.508 sec
 * ratio c/w:     1.000 speedup

