      -----------------------------------------------------------      
     |                   =====================                   |     
     |                           x T B                           |     
     |                   =====================                   |     
     |                         S. Grimme                         |     
     |          Mulliken Center for Theoretical Chemistry        |     
     |                    University of Bonn                     |     
     |                Version 6.2 RC2 (SAW190805)                |     
      -----------------------------------------------------------      

   This program is distributed in the hope that it will be useful,
   but WITHOUT ANY WARRANTY; without even the implied warranty of
   MERCHANTABILITY or FITNESS FOR A PARTICULAR PURPOSE.
   
   FOR NON-COMMERCIAL, ACADEMIA USE ONLY.
   
   Cite this work as:
   * S. Grimme, C. Bannwarth, P. Shushkov, J. Chem. Theory Comput., 2017,
     13, 1989-2009. DOI: 10.1021/acs.jctc.7b00118
   * C. Bannwarth, S. Ehlert and S. Grimme., J. Chem. Theory Comput., 2019,
     15, 1652-1671. DOI: 10.1021/acs.jctc.8b01176
   * P. Pracht, E. Caldeweyher, S. Ehlert, S. Grimme, ChemRxiv, 2019, preprint.
     DOI: 10.26434/chemrxiv.8326202.v1
   
   for DFT-D4:
   * E. Caldeweyher, C. Bannwarth and S. Grimme, J. Chem. Phys., 2017,
     147, 034112. DOI: 10.1063/1.4993215
   * E. Caldeweyher, S. Ehlert, A. Hansen, H. Neugebauer, S. Spicher,
     C. Bannwarth and S. Grimme, J. Chem. Phys., 2019, 150, 154122.
     DOI: 10.1063/1.5090222
   
   for sTDA-xTB:
   * S. Grimme and C. Bannwarth, J. Chem. Phys., 2016, 145, 054103.
     DOI: 10.1063/1.4959605
   
   in the mass-spec context:
   * V. Asgeirsson, C. Bauer and S. Grimme, Chem. Sci., 2017, 8, 4879.
     DOI: 10.1039/c7sc00601b
   
   for metadynamics refer to:
   * S. Grimme, J. Chem. Theory Comput., 2019, 155, 2847-2862
     DOI: 10.1021/acs.jctc.9b00143
   
   with help from (in alphabetical order)
   C. Bannwarth, F. Bohle, G. Brandenburg, E. Caldeweyher, M. Checinski,
   S. Dohm, S. Ehlert, S. Ehrlich, F. März, H. Neugebauer, J. Pisarek,
   P. Pracht, P. Shushkov, and S. Spicher.
   
 * started run on 2021/05/19 at 11:01:07.558     

           -------------------------------------------------
          |                Calculation Setup                |
           -------------------------------------------------

          program call               : /ihome/ghutchison/geoffh/xtb/xtb 888.xyz -opt
          hostname                   : smp-n83
          coordinate file            : 888.xyz
          omp threads                :                     1
          number of atoms            :                    25
          number of electrons        :                    82
          charge                     :                     0
          spin                       :                   0.0
          first test random number   :      0.70486254846366


########################################################################
# WARNING! Please study the warnings concerning your input carefully
#  - the use of '-opt' is discouraged, please use '--opt' next time
########################################################################

           ------------------------------------------------- 
          |                 G F N 2 - x T B                 |
          | Geometry, Frequencies, Noncovalent interactions |
          |            JCTC 2019 parametrisation            |
           ------------------------------------------------- 
             KAB for C  - Si     :                1.0500
             KAB for H  - Pd     :                0.9500
             k(s)              :                1.8500
             k(p)              :                2.2300
             k(d)              :                2.2300
             k(f)              :                2.0000
             kEN (H0ij)        :               -2.0000
             D4 a1             :                0.5200
             D4 a2             :                5.0000
             D4 s6             :                1.0000
             D4 s8             :                2.7000
             D4 s9             :                5.0000
             alphaj            :                2.0000

  Z AO/shell   Hii/eV     exponent
  1     Wed Apr 25 08:07:45 CEST 2018   EN: 2.200 GM2: 0.406  GM3: 0.0800  RAES: 1.40
     1s    -10.707211    1.230000
  6     Wed Apr 25 08:07:45 CEST 2018   EN: 2.550 GM2: 0.538  GM3: 0.1500  RAES: 3.00
     2s    -13.970922    2.096432
     2p    -10.063292    1.800000
  8     Wed Apr 25 08:07:45 CEST 2018   EN: 3.440 GM2: 0.452  GM3:-0.0517  RAES: 1.80
     2s    -20.229985    2.439742
     2p    -15.503117    2.137023
 16     Tue Apr 24 11:44:34 CEST 2018   EN: 2.580 GM2: 0.340  GM3:-0.0502  RAES: 3.10
     3s    -20.029654    1.981333
     3p    -11.377694    2.025643
     3d     -0.420282    1.702555

           ------------------------------------------------- 
          |        Self-Consistent Charge Iterations        |
           ------------------------------------------------- 

          ...................................................
          :                      SETUP                      :
          :.................................................:
          :  # basis functions                  82          :
          :  # atomic orbitals                  81          :
          :  # shells                           43          :
          :  # electrons                        82          :
          :  max. iterations                   250          :
          :  Hamiltonian                  GFN2-xTB          :
          :  restarted?                      false          :
          :  GBSA solvation                  false          :
          :  PC potential                    false          :
          :  electronic temp.          300.0000000     K    :
          :  accuracy                    1.0000000          :
          :  -> integral cutoff          0.2500000E+02      :
          :  -> integral neglect         0.1000000E-07      :
          :  -> SCF convergence          0.1000000E-05 Eh   :
          :  -> wf. convergence          0.1000000E-03 e    :
          :  Broyden damping             0.4000000          :
          ...................................................

 iter      E             dE          RMSdq      gap      omega  full diag
   1    -45.9830177 -0.459830E+02  0.556E+00    2.21       0.0  T
   2    -46.0333392 -0.503215E-01  0.308E+00    1.93       1.0  T
   3    -46.0159760  0.173632E-01  0.179E+00    2.13       1.0  T
   4    -46.0440208 -0.280448E-01  0.513E-01    2.06       1.0  T
   5    -46.0494879 -0.546717E-02  0.163E-01    2.04       1.0  T
   6    -46.0498002 -0.312314E-03  0.577E-02    2.05       1.0  T
   7    -46.0498301 -0.298186E-04  0.246E-02    2.04       1.0  T
   8    -46.0498376 -0.756367E-05  0.119E-02    2.04       1.7  T
   9    -46.0498378 -0.209824E-06  0.609E-03    2.04       3.3  T
  10    -46.0498385 -0.632411E-06  0.146E-03    2.04      13.7  T
  11    -46.0498385 -0.100449E-07  0.892E-04    2.04      22.4  T
  12    -46.0498385 -0.439751E-08  0.369E-04    2.04      54.1  T

   *** convergence criteria satisfied after 12 iterations ***

         #    Occupation            Energy/Eh            Energy/eV
      -------------------------------------------------------------
         1        2.0000           -0.7581106             -20.6292
       ...           ...                  ...                  ...
        35        2.0000           -0.4413529             -12.0098
        36        2.0000           -0.4291470             -11.6777
        37        2.0000           -0.4239380             -11.5359
        38        2.0000           -0.4226439             -11.5007
        39        2.0000           -0.4072083             -11.0807
        40        2.0000           -0.4027200             -10.9586
        41        2.0000           -0.3952783             -10.7561 (HOMO)
        42                         -0.3201786              -8.7125 (LUMO)
        43                         -0.2983519              -8.1186
        44                         -0.2590908              -7.0502
        45                         -0.2383673              -6.4863
        46                         -0.2243297              -6.1043
       ...                                ...                  ...
        81                          0.7220481              19.6479
      -------------------------------------------------------------
                  HL-Gap            0.0750996 Eh            2.0436 eV
             Fermi-level           -0.3577285 Eh           -9.7343 eV

 SCC (total)                   0 d,  0 h,  0 min,  0.051 sec
 SCC setup                      ...        0 min,  0.000 sec (  0.672%)
 Dispersion                     ...        0 min,  0.000 sec (  0.886%)
 integral evaluation            ...        0 min,  0.013 sec ( 26.145%)
 zeroth order Hamiltonian       ...        0 min,  0.000 sec (  0.456%)
 iterations                     ...        0 min,  0.018 sec ( 35.207%)
 molecular gradient             ...        0 min,  0.018 sec ( 35.700%)
 printout                       ...        0 min,  0.000 sec (  0.825%)

         :::::::::::::::::::::::::::::::::::::::::::::::::::::
         ::                     SUMMARY                     ::
         :::::::::::::::::::::::::::::::::::::::::::::::::::::
         :: total energy             -45.381255929485 Eh    ::
         :: gradient norm              0.053044885221 Eh/a0 ::
         :: HOMO-LUMO gap              2.043564829875 eV    ::
         ::.................................................::
         :: SCC energy               -46.049838472144 Eh    ::
         :: -> isotropic ES            0.054641080704 Eh    ::
         :: -> anisotropic ES         -0.000046456092 Eh    ::
         :: -> anisotropic XC          0.018872040092 Eh    ::
         :: -> dispersion             -0.030674157148 Eh    ::
         :: repulsion energy           0.668555664369 Eh    ::
         :: add. restraining           0.000000000000 Eh    ::
         :::::::::::::::::::::::::::::::::::::::::::::::::::::

      ----------------------------------------------------------- 
     |                   =====================                   |
     |                        A N C O P T                        |
     |                   =====================                   |
     |               Approximate Normal Coordinate               |
     |                Rational Function Optimizer                |
      ----------------------------------------------------------- 

          ...................................................
          :                      SETUP                      :
          :.................................................:
          :   optimization level            normal          :
          :   max. optcycles                   200          :
          :   ANC micro-cycles                  20          :
          :   degrees of freedom                69          :
          :.................................................:
          :   RF solver                   davidson          :
          :   input Hessian                  false          :
          :   write xtbopt.log                true          :
          :   linear?                        false          :
          :   energy convergence         0.5000000E-05 Eh   :
          :   grad. convergence          0.1000000E-02 Eh/α :
          :   maximium RF displ.         2.0000000          :
          :   Hlow (freq-cutoff)         0.5000000E-02      :
          :   Hmax (freq-cutoff)         5.0000000          :
          :   S6 in model hess.         20.0000000          :
          ...................................................

generating ANC from model Hessian ...
Using Lindh-Hessian (1995)
 Shifting diagonal of input Hessian by   3.699652153218562E-003
 Lowest  eigenvalues of input Hessian
   -0.000000   -0.000000   -0.000000   -0.000000    0.000000    0.000000
    0.005000    0.005713    0.007773    0.008668    0.010574    0.015011
    0.015639    0.019392    0.023182    0.024081    0.025335    0.030413
 Highest eigenvalues
    1.864746    1.903825    1.967226    1.996629    2.153861    2.240034
 

........................................................................
.............................. CYCLE    1 ..............................
........................................................................
   1    -46.0498385 -0.460498E+02  0.161E-04    2.04       0.0  T
   2    -46.0498385 -0.570708E-10  0.128E-04    2.04     156.3  T
   3    -46.0498385 -0.251504E-09  0.630E-05    2.04     317.7  T
     SCC iter.                  ...        0 min,  0.005 sec
     gradient                   ...        0 min,  0.018 sec
 * total energy  :   -45.3812559 Eh     change       -0.1593499E-07 Eh
   gradient norm :     0.0530463 Eh/α   predicted     0.0000000E+00 (-100.00%)
   displ. norm   :     0.2094725 α      lambda       -0.4528581E-02
   maximum displ.:     0.0985282 α      in ANC's #3, #15, #14, ...

........................................................................
.............................. CYCLE    2 ..............................
........................................................................
   1    -46.0764483 -0.460764E+02  0.146E-01    2.05       0.0  T
   2    -46.0764871 -0.387721E-04  0.829E-02    2.06       1.0  T
   3    -46.0764621  0.249642E-04  0.521E-02    2.05       1.0  T
   4    -46.0765119 -0.497825E-04  0.183E-02    2.05       1.1  T
   5    -46.0765145 -0.256339E-05  0.694E-03    2.05       2.9  T
   6    -46.0765149 -0.432314E-06  0.234E-03    2.05       8.5  T
   7    -46.0765150 -0.623467E-07  0.855E-04    2.05      23.4  T
     SCC iter.                  ...        0 min,  0.010 sec
     gradient                   ...        0 min,  0.017 sec
 * total energy  :   -45.3842670 Eh     change       -0.3011039E-02 Eh
   gradient norm :     0.0210524 Eh/α   predicted    -0.2363648E-02 ( -21.50%)
   displ. norm   :     0.1717176 α      lambda       -0.1115089E-02
   maximum displ.:     0.1135524 α      in ANC's #3, #12, #4, ...

........................................................................
.............................. CYCLE    3 ..............................
........................................................................
   1    -46.0856249 -0.460856E+02  0.132E-01    2.06       0.0  T
   2    -46.0856482 -0.232572E-04  0.724E-02    2.06       1.0  T
   3    -46.0856228  0.254343E-04  0.435E-02    2.06       1.0  T
   4    -46.0856610 -0.382262E-04  0.142E-02    2.06       1.4  T
   5    -46.0856624 -0.145582E-05  0.599E-03    2.06       3.3  T
   6    -46.0856628 -0.334848E-06  0.204E-03    2.06       9.8  T
     SCC iter.                  ...        0 min,  0.008 sec
     gradient                   ...        0 min,  0.017 sec
 * total energy  :   -45.3848695 Eh     change       -0.6025147E-03 Eh
   gradient norm :     0.0054352 Eh/α   predicted    -0.5739995E-03 (  -4.73%)
   displ. norm   :     0.1015712 α      lambda       -0.2182424E-03
   maximum displ.:     0.0579701 α      in ANC's #4, #3, #15, ...

........................................................................
.............................. CYCLE    4 ..............................
........................................................................
   1    -46.0847163 -0.460847E+02  0.829E-02    2.05       0.0  T
   2    -46.0847197 -0.340704E-05  0.487E-02    2.05       1.0  T
   3    -46.0847057  0.140451E-04  0.348E-02    2.05       1.0  T
   4    -46.0847265 -0.208143E-04  0.513E-03    2.05       3.9  T
   5    -46.0847266 -0.712467E-07  0.234E-03    2.05       8.5  T
   6    -46.0847266 -0.595752E-07  0.954E-04    2.05      21.0  T
     SCC iter.                  ...        0 min,  0.009 sec
     gradient                   ...        0 min,  0.017 sec
 * total energy  :   -45.3849700 Eh     change       -0.1004899E-03 Eh
   gradient norm :     0.0042733 Eh/α   predicted    -0.1102551E-03 (   9.72%)
   displ. norm   :     0.0833251 α      lambda       -0.9270790E-04
   maximum displ.:     0.0573124 α      in ANC's #4, #3, #5, ...

........................................................................
.............................. CYCLE    5 ..............................
........................................................................
   1    -46.0827320 -0.460827E+02  0.607E-02    2.05       0.0  T
   2    -46.0827328 -0.885000E-06  0.328E-02    2.05       1.0  T
   3    -46.0827313  0.153110E-05  0.107E-02    2.05       1.9  T
   4    -46.0827332 -0.188229E-05  0.395E-03    2.05       5.1  T
   5    -46.0827333 -0.602421E-07  0.103E-03    2.05      19.5  T
   6    -46.0827333 -0.194052E-07  0.299E-04    2.05      66.8  T
     SCC iter.                  ...        0 min,  0.009 sec
     gradient                   ...        0 min,  0.017 sec
 * total energy  :   -45.3850402 Eh     change       -0.7018288E-04 Eh
   gradient norm :     0.0030417 Eh/α   predicted    -0.4667823E-04 ( -33.49%)
   displ. norm   :     0.1197868 α      lambda       -0.8377723E-04
   maximum displ.:     0.0843284 α      in ANC's #4, #3, #5, ...

........................................................................
.............................. CYCLE    6 ..............................
........................................................................
   1    -46.0812324 -0.460812E+02  0.929E-02    2.05       0.0  T
   2    -46.0812346 -0.219038E-05  0.503E-02    2.05       1.0  T
   3    -46.0812324  0.212898E-05  0.146E-02    2.05       1.4  T
   4    -46.0812352 -0.273301E-05  0.615E-03    2.05       3.3  T
   5    -46.0812354 -0.190866E-06  0.169E-03    2.05      11.9  T
   6    -46.0812354 -0.463120E-07  0.476E-04    2.05      42.0  T
   7    -46.0812354 -0.183232E-08  0.281E-04    2.05      71.2  T
     SCC iter.                  ...        0 min,  0.010 sec
     gradient                   ...        0 min,  0.018 sec
 * total energy  :   -45.3851022 Eh     change       -0.6201051E-04 Eh
   gradient norm :     0.0025517 Eh/α   predicted    -0.4249022E-04 ( -31.48%)
   displ. norm   :     0.1270842 α      lambda       -0.6280724E-04
   maximum displ.:     0.0923717 α      in ANC's #4, #5, #3, ...

........................................................................
.............................. CYCLE    7 ..............................
........................................................................
   1    -46.0809650 -0.460810E+02  0.904E-02    2.04       0.0  T
   2    -46.0809666 -0.161495E-05  0.501E-02    2.04       1.0  T
   3    -46.0809650  0.161485E-05  0.127E-02    2.04       1.6  T
   4    -46.0809670 -0.201839E-05  0.549E-03    2.04       3.6  T
   5    -46.0809672 -0.184877E-06  0.154E-03    2.04      13.0  T
   6    -46.0809672 -0.411187E-07  0.437E-04    2.04      45.8  T
   7    -46.0809672 -0.129558E-08  0.263E-04    2.04      76.1  T
     SCC iter.                  ...        0 min,  0.010 sec
     gradient                   ...        0 min,  0.018 sec
 * total energy  :   -45.3851510 Eh     change       -0.4876820E-04 Eh
   gradient norm :     0.0029378 Eh/α   predicted    -0.3191531E-04 ( -34.56%)
   displ. norm   :     0.1303050 α      lambda       -0.6058927E-04
   maximum displ.:     0.0982667 α      in ANC's #4, #5, #3, ...

........................................................................
.............................. CYCLE    8 ..............................
........................................................................
   1    -46.0816328 -0.460816E+02  0.896E-02    2.04       0.0  T
   2    -46.0816343 -0.152678E-05  0.501E-02    2.04       1.0  T
   3    -46.0816338  0.537953E-06  0.975E-03    2.04       2.1  T
   4    -46.0816345 -0.739274E-06  0.533E-03    2.04       3.8  T
   5    -46.0816348 -0.270333E-06  0.164E-03    2.04      12.2  T
   6    -46.0816348 -0.516782E-07  0.480E-04    2.04      41.6  T
   7    -46.0816348 -0.854605E-09  0.291E-04    2.04      68.8  T
     SCC iter.                  ...        0 min,  0.010 sec
     gradient                   ...        0 min,  0.018 sec
 * total energy  :   -45.3851994 Eh     change       -0.4840527E-04 Eh
   gradient norm :     0.0026996 Eh/α   predicted    -0.3081153E-04 ( -36.35%)
   displ. norm   :     0.1572355 α      lambda       -0.6458564E-04
   maximum displ.:     0.1210320 α      in ANC's #4, #5, #1, ...

........................................................................
.............................. CYCLE    9 ..............................
........................................................................
   1    -46.0824758 -0.460825E+02  0.963E-02    2.05       0.0  T
   2    -46.0824772 -0.141477E-05  0.548E-02    2.05       1.0  T
   3    -46.0824762  0.989210E-06  0.981E-03    2.05       2.0  T
   4    -46.0824774 -0.114137E-05  0.523E-03    2.05       3.8  T
   5    -46.0824777 -0.345645E-06  0.153E-03    2.05      13.1  T
   6    -46.0824777 -0.423515E-07  0.465E-04    2.05      43.0  T
   7    -46.0824777 -0.560114E-09  0.277E-04    2.05      72.3  T
     SCC iter.                  ...        0 min,  0.010 sec
     gradient                   ...        0 min,  0.018 sec
 * total energy  :   -45.3852498 Eh     change       -0.5042300E-04 Eh
   gradient norm :     0.0021348 Eh/α   predicted    -0.3309224E-04 ( -34.37%)
   displ. norm   :     0.1775767 α      lambda       -0.5787831E-04
   maximum displ.:     0.1377126 α      in ANC's #4, #5, #1, ...

........................................................................
.............................. CYCLE   10 ..............................
........................................................................
   1    -46.0826353 -0.460826E+02  0.104E-01    2.05       0.0  T
   2    -46.0826370 -0.165486E-05  0.599E-02    2.05       1.0  T
   3    -46.0826347  0.229414E-05  0.126E-02    2.05       1.6  T
   4    -46.0826375 -0.277374E-05  0.550E-03    2.05       3.6  T
   5    -46.0826377 -0.272619E-06  0.170E-03    2.05      11.7  T
   6    -46.0826378 -0.484476E-07  0.599E-04    2.05      33.4  T
   7    -46.0826378 -0.679549E-09  0.360E-04    2.05      55.5  T
     SCC iter.                  ...        0 min,  0.010 sec
     gradient                   ...        0 min,  0.018 sec
 * total energy  :   -45.3852947 Eh     change       -0.4490129E-04 Eh
   gradient norm :     0.0020579 Eh/α   predicted    -0.2985355E-04 ( -33.51%)
   displ. norm   :     0.2076483 α      lambda       -0.5490117E-04
   maximum displ.:     0.1596630 α      in ANC's #4, #1, #5, ...

........................................................................
.............................. CYCLE   11 ..............................
........................................................................
   1    -46.0822968 -0.460823E+02  0.115E-01    2.06       0.0  T
   2    -46.0822987 -0.186249E-05  0.666E-02    2.06       1.0  T
   3    -46.0822945  0.417292E-05  0.156E-02    2.06       1.3  T
   4    -46.0822995 -0.499210E-05  0.532E-03    2.06       3.8  T
   5    -46.0822997 -0.182233E-06  0.188E-03    2.06      10.7  T
   6    -46.0822997 -0.520675E-07  0.705E-04    2.06      28.4  T
   7    -46.0822997 -0.218837E-08  0.425E-04    2.06      47.1  T
     SCC iter.                  ...        0 min,  0.010 sec
     gradient                   ...        0 min,  0.018 sec
 * total energy  :   -45.3853358 Eh     change       -0.4109941E-04 Eh
   gradient norm :     0.0022479 Eh/α   predicted    -0.2863459E-04 ( -30.33%)
   displ. norm   :     0.2006694 α      lambda       -0.4468310E-04
   maximum displ.:     0.1499008 α      in ANC's #4, #1, #5, ...

........................................................................
.............................. CYCLE   12 ..............................
........................................................................
   1    -46.0817735 -0.460818E+02  0.110E-01    2.06       0.0  T
   2    -46.0817752 -0.172106E-05  0.644E-02    2.06       1.0  T
   3    -46.0817711  0.415490E-05  0.154E-02    2.06       1.3  T
   4    -46.0817762 -0.509838E-05  0.482E-03    2.06       4.1  T
   5    -46.0817763 -0.116820E-06  0.193E-03    2.06      10.4  T
   6    -46.0817763 -0.479852E-07  0.776E-04    2.06      25.8  T
   7    -46.0817764 -0.233200E-08  0.450E-04    2.06      44.4  T
     SCC iter.                  ...        0 min,  0.010 sec
     gradient                   ...        0 min,  0.018 sec
 * total energy  :   -45.3853693 Eh     change       -0.3349159E-04 Eh
   gradient norm :     0.0023445 Eh/α   predicted    -0.2324319E-04 ( -30.60%)
   displ. norm   :     0.1650272 α      lambda       -0.3873398E-04
   maximum displ.:     0.1114568 α      in ANC's #4, #1, #2, ...

........................................................................
.............................. CYCLE   13 ..............................
........................................................................
   1    -46.0815199 -0.460815E+02  0.910E-02    2.06       0.0  T
   2    -46.0815211 -0.120119E-05  0.538E-02    2.06       1.0  T
   3    -46.0815185  0.265917E-05  0.122E-02    2.06       1.6  T
   4    -46.0815218 -0.338900E-05  0.361E-03    2.06       5.5  T
   5    -46.0815219 -0.603375E-07  0.168E-03    2.06      11.9  T
   6    -46.0815219 -0.253246E-07  0.701E-04    2.06      28.5  T
   7    -46.0815219 -0.273857E-08  0.370E-04    2.06      54.1  T
     SCC iter.                  ...        0 min,  0.010 sec
     gradient                   ...        0 min,  0.018 sec
 * total energy  :   -45.3854005 Eh     change       -0.3118972E-04 Eh
   gradient norm :     0.0020622 Eh/α   predicted    -0.1989481E-04 ( -36.21%)
   displ. norm   :     0.2200027 α      lambda       -0.5499282E-04
   maximum displ.:     0.1306134 α      in ANC's #4, #1, #2, ...

........................................................................
.............................. CYCLE   14 ..............................
........................................................................
   1    -46.0808279 -0.460808E+02  0.123E-01    2.06       0.0  T
   2    -46.0808300 -0.214455E-05  0.730E-02    2.06       1.0  T
   3    -46.0808261  0.391509E-05  0.153E-02    2.06       1.3  T
   4    -46.0808314 -0.527853E-05  0.468E-03    2.06       4.3  T
   5    -46.0808315 -0.897732E-07  0.228E-03    2.06       8.8  T
   6    -46.0808315 -0.435068E-07  0.913E-04    2.06      21.9  T
   7    -46.0808315 -0.398869E-08  0.470E-04    2.06      42.6  T
     SCC iter.                  ...        0 min,  0.010 sec
     gradient                   ...        0 min,  0.018 sec
 * total energy  :   -45.3854429 Eh     change       -0.4241240E-04 Eh
   gradient norm :     0.0024699 Eh/α   predicted    -0.2883159E-04 ( -32.02%)
   displ. norm   :     0.2247844 α      lambda       -0.7141218E-04
   maximum displ.:     0.1517072 α      in ANC's #1, #2, #4, ...

........................................................................
.............................. CYCLE   15 ..............................
........................................................................
   1    -46.0815738 -0.460816E+02  0.129E-01    2.06       0.0  T
   2    -46.0815767 -0.296956E-05  0.763E-02    2.06       1.0  T
   3    -46.0815705  0.623535E-05  0.197E-02    2.06       1.0  T
   4    -46.0815785 -0.804644E-05  0.566E-03    2.06       3.5  T
   5    -46.0815787 -0.143217E-06  0.263E-03    2.06       7.6  T
   6    -46.0815787 -0.396723E-07  0.110E-03    2.06      18.2  T
   7    -46.0815787 -0.666594E-08  0.551E-04    2.06      36.3  T
   8    -46.0815787 -0.536879E-09  0.254E-04    2.06      78.8  T
     SCC iter.                  ...        0 min,  0.011 sec
     gradient                   ...        0 min,  0.018 sec
 * total energy  :   -45.3854854 Eh     change       -0.4249558E-04 Eh
   gradient norm :     0.0038915 Eh/α   predicted    -0.3751430E-04 ( -11.72%)
   displ. norm   :     0.5482923 α      lambda       -0.1350797E-03
   maximum displ.:     0.3210058 α      in ANC's #1, #4, #2, ...

........................................................................
.............................. CYCLE   16 ..............................
........................................................................
   1    -46.0735267 -0.460735E+02  0.294E-01    2.07       0.0  T
   2    -46.0735380 -0.112815E-04  0.174E-01    2.06       1.0  T
   3    -46.0735325  0.548505E-05  0.256E-02    2.06       1.0  T
   4    -46.0735436 -0.111375E-04  0.107E-02    2.07       1.9  T
   5    -46.0735443 -0.715220E-06  0.559E-03    2.06       3.6  T
   6    -46.0735446 -0.301964E-06  0.198E-03    2.07      10.1  T
   7    -46.0735446 -0.168555E-07  0.891E-04    2.07      22.4  T
   8    -46.0735446 -0.266215E-08  0.357E-04    2.07      56.1  T
     SCC iter.                  ...        0 min,  0.011 sec
     gradient                   ...        0 min,  0.018 sec
 * total energy  :   -45.3853116 Eh     change        0.1738109E-03 Eh
   gradient norm :     0.0143174 Eh/α   predicted    -0.8784521E-04 (-150.54%)
   displ. norm   :     0.2625515 α      lambda       -0.5787061E-03
   maximum displ.:     0.1802030 α      in ANC's #4, #1, #2, ...

........................................................................
.............................. CYCLE   17 ..............................
........................................................................
   1    -46.0812497 -0.460812E+02  0.146E-01    2.07       0.0  T
   2    -46.0812549 -0.520721E-05  0.858E-02    2.07       1.0  T
   3    -46.0812443  0.105596E-04  0.275E-02    2.07       1.0  T
   4    -46.0812570 -0.127023E-04  0.658E-03    2.07       3.0  T
   5    -46.0812574 -0.393786E-06  0.318E-03    2.07       6.3  T
   6    -46.0812575 -0.532108E-07  0.135E-03    2.07      14.8  T
   7    -46.0812575 -0.119738E-07  0.617E-04    2.07      32.4  T
     SCC iter.                  ...        0 min,  0.010 sec
     gradient                   ...        0 min,  0.017 sec
 * total energy  :   -45.3855457 Eh     change       -0.2341832E-03 Eh
   gradient norm :     0.0035909 Eh/α   predicted    -0.3093038E-03 (  32.08%)
   displ. norm   :     0.0558772 α      lambda       -0.3678102E-04
   maximum displ.:     0.0359438 α      in ANC's #1, #2, #4, ...

........................................................................
.............................. CYCLE   18 ..............................
........................................................................
   1    -46.0810027 -0.460810E+02  0.399E-02    2.07       0.0  T
   2    -46.0810032 -0.490624E-06  0.233E-02    2.07       1.0  T
   3    -46.0810020  0.112286E-05  0.810E-03    2.07       2.5  T
   4    -46.0810033 -0.127600E-05  0.193E-03    2.07      10.4  T
   5    -46.0810033 -0.343161E-07  0.817E-04    2.07      24.5  T
   6    -46.0810033 -0.420560E-08  0.335E-04    2.07      59.7  T
     SCC iter.                  ...        0 min,  0.009 sec
     gradient                   ...        0 min,  0.018 sec
 * total energy  :   -45.3855632 Eh     change       -0.1742832E-04 Eh
   gradient norm :     0.0045281 Eh/α   predicted    -0.1845339E-04 (   5.88%)
   displ. norm   :     0.1284322 α      lambda       -0.3961389E-04
   maximum displ.:     0.0859651 α      in ANC's #1, #2, #4, ...

........................................................................
.............................. CYCLE   19 ..............................
........................................................................
   1    -46.0809813 -0.460810E+02  0.683E-02    2.07       0.0  T
   2    -46.0809817 -0.440249E-06  0.399E-02    2.07       1.0  T
   3    -46.0809815  0.215448E-06  0.502E-03    2.07       4.0  T
   4    -46.0809818 -0.357934E-06  0.247E-03    2.07       8.1  T
   5    -46.0809819 -0.555601E-07  0.101E-03    2.07      19.9  T
     SCC iter.                  ...        0 min,  0.007 sec
     gradient                   ...        0 min,  0.017 sec
 * total energy  :   -45.3855919 Eh     change       -0.2875928E-04 Eh
   gradient norm :     0.0027353 Eh/α   predicted    -0.2013656E-04 ( -29.98%)
   displ. norm   :     0.3449350 α      lambda       -0.6193812E-04
   maximum displ.:     0.2414584 α      in ANC's #1, #2, #4, ...

........................................................................
.............................. CYCLE   20 ..............................
........................................................................
   1    -46.0788641 -0.460789E+02  0.182E-01    2.07       0.0  T
   2    -46.0788669 -0.279444E-05  0.107E-01    2.07       1.0  T
   3    -46.0788654  0.145675E-05  0.139E-02    2.07       1.4  T
   4    -46.0788680 -0.261771E-05  0.665E-03    2.07       3.0  T
   5    -46.0788684 -0.357121E-06  0.233E-03    2.07       8.6  T
   6    -46.0788685 -0.600709E-07  0.102E-03    2.07      19.5  T
   7    -46.0788685 -0.146422E-08  0.404E-04    2.07      49.5  T
   8    -46.0788685 -0.849390E-09  0.156E-04    2.07     127.9  T
     SCC iter.                  ...        0 min,  0.011 sec
     gradient                   ...        0 min,  0.018 sec
 * total energy  :   -45.3856175 Eh     change       -0.2555254E-04 Eh
   gradient norm :     0.0054772 Eh/α   predicted    -0.3465492E-04 (  35.62%)
   displ. norm   :     0.0299390 α      lambda       -0.4274643E-04
   maximum displ.:     0.0223029 α      in ANC's #4, #1, #9, ...
 * RMSD in coord.:     0.5022897 α      energy gain  -0.4361552E-02 Eh

generating ANC from model Hessian ...
Using Lindh-Hessian (1995)
 Shifting diagonal of input Hessian by   3.551931121902189E-003
 Lowest  eigenvalues of input Hessian
   -0.000000   -0.000000   -0.000000   -0.000000   -0.000000    0.000000
    0.005000    0.005787    0.008510    0.009279    0.011038    0.015567
    0.016404    0.022442    0.023647    0.025598    0.025991    0.031525
 Highest eigenvalues
    1.902668    1.968243    2.011808    2.045551    2.188088    2.276907
 

........................................................................
.............................. CYCLE   21 ..............................
........................................................................
   1    -46.0805921 -0.460806E+02  0.169E-02    2.08       0.0  T
   2    -46.0805924 -0.210945E-06  0.101E-02    2.08       2.0  T
   3    -46.0805921  0.247662E-06  0.440E-03    2.08       4.5  T
   4    -46.0805924 -0.302151E-06  0.118E-03    2.08      17.0  T
   5    -46.0805924 -0.192320E-07  0.495E-04    2.08      40.4  T
   6    -46.0805924 -0.146772E-08  0.246E-04    2.08      81.5  T
     SCC iter.                  ...        0 min,  0.009 sec
     gradient                   ...        0 min,  0.018 sec
 * total energy  :   -45.3856443 Eh     change       -0.2680021E-04 Eh
   gradient norm :     0.0021525 Eh/α   predicted     0.0000000E+00 (-100.00%)
   displ. norm   :     0.0228623 α      lambda       -0.1365897E-04
   maximum displ.:     0.0126003 α      in ANC's #3, #2, #5, ...

........................................................................
.............................. CYCLE   22 ..............................
........................................................................
   1    -46.0812360 -0.460812E+02  0.173E-02    2.07       0.0  T
   2    -46.0812361 -0.590565E-07  0.990E-03    2.07       2.0  T
   3    -46.0812360  0.429737E-07  0.213E-03    2.07       9.4  T
   4    -46.0812361 -0.544691E-07  0.965E-04    2.07      20.7  T
   5    -46.0812361 -0.635561E-08  0.376E-04    2.07      53.2  T
     SCC iter.                  ...        0 min,  0.007 sec
     gradient                   ...        0 min,  0.018 sec
 * total energy  :   -45.3856543 Eh     change       -0.9970264E-05 Eh
   gradient norm :     0.0008427 Eh/α   predicted    -0.6833812E-05 ( -31.46%)
   displ. norm   :     0.0505806 α      lambda       -0.9516434E-05
   maximum displ.:     0.0296338 α      in ANC's #3, #5, #2, ...

........................................................................
.............................. CYCLE   23 ..............................
........................................................................
   1    -46.0817999 -0.460818E+02  0.311E-02    2.07       0.0  T
   2    -46.0818001 -0.183659E-06  0.180E-02    2.07       1.1  T
   3    -46.0818000  0.504544E-07  0.307E-03    2.07       6.5  T
   4    -46.0818001 -0.966747E-07  0.156E-03    2.07      12.8  T
   5    -46.0818001 -0.166374E-07  0.678E-04    2.07      29.5  T
   6    -46.0818001 -0.610525E-08  0.240E-04    2.07      83.2  T
     SCC iter.                  ...        0 min,  0.008 sec
     gradient                   ...        0 min,  0.018 sec
 * total energy  :   -45.3856627 Eh     change       -0.8474968E-05 Eh
   gradient norm :     0.0011453 Eh/α   predicted    -0.4764586E-05 ( -43.78%)
   displ. norm   :     0.0559768 α      lambda       -0.6706108E-05
   maximum displ.:     0.0314715 α      in ANC's #3, #2, #5, ...

........................................................................
.............................. CYCLE   24 ..............................
........................................................................
   1    -46.0815365 -0.460815E+02  0.328E-02    2.07       0.0  T
   2    -46.0815366 -0.976322E-07  0.191E-02    2.07       1.0  T
   3    -46.0815366  0.180423E-07  0.229E-03    2.07       8.7  T
   4    -46.0815366 -0.381646E-07  0.138E-03    2.07      14.5  T
   5    -46.0815367 -0.252055E-07  0.337E-04    2.07      59.3  T
   6    -46.0815367 -0.132356E-08  0.168E-04    2.07     118.8  T
     SCC iter.                  ...        0 min,  0.009 sec
     gradient                   ...        0 min,  0.018 sec
 * total energy  :   -45.3856700 Eh     change       -0.7307364E-05 Eh
   gradient norm :     0.0012620 Eh/α   predicted    -0.3360911E-05 ( -54.01%)
   displ. norm   :     0.0838644 α      lambda       -0.9299374E-05
   maximum displ.:     0.0495488 α      in ANC's #2, #3, #5, ...

........................................................................
.............................. CYCLE   25 ..............................
........................................................................
   1    -46.0808923 -0.460809E+02  0.439E-02    2.07       0.0  T
   2    -46.0808924 -0.152687E-06  0.256E-02    2.07       1.0  T
   3    -46.0808924  0.478456E-07  0.301E-03    2.07       6.7  T
   4    -46.0808925 -0.887757E-07  0.168E-03    2.07      11.9  T
   5    -46.0808925 -0.308745E-07  0.459E-04    2.07      43.6  T
   6    -46.0808925 -0.301257E-08  0.198E-04    2.07     101.1  T
     SCC iter.                  ...        0 min,  0.009 sec
     gradient                   ...        0 min,  0.018 sec
 * total energy  :   -45.3856784 Eh     change       -0.8406009E-05 Eh
   gradient norm :     0.0011740 Eh/α   predicted    -0.4664769E-05 ( -44.51%)
   displ. norm   :     0.0574707 α      lambda       -0.5875260E-05
   maximum displ.:     0.0388052 α      in ANC's #2, #3, #5, ...

........................................................................
.............................. CYCLE   26 ..............................
........................................................................
   1    -46.0808266 -0.460808E+02  0.319E-02    2.08       0.0  T
   2    -46.0808267 -0.968763E-07  0.184E-02    2.08       1.1  T
   3    -46.0808266  0.651415E-07  0.266E-03    2.08       7.5  T
   4    -46.0808267 -0.814374E-07  0.130E-03    2.08      15.3  T
   5    -46.0808267 -0.155400E-07  0.420E-04    2.08      47.6  T
   6    -46.0808267 -0.275755E-08  0.975E-05    2.08     205.1  T
     SCC iter.                  ...        0 min,  0.009 sec
     gradient                   ...        0 min,  0.018 sec
 * total energy  :   -45.3856844 Eh     change       -0.5987535E-05 Eh
   gradient norm :     0.0009969 Eh/α   predicted    -0.2943473E-05 ( -50.84%)
   displ. norm   :     0.0595100 α      lambda       -0.6288166E-05
   maximum displ.:     0.0446603 α      in ANC's #2, #3, #1, ...

........................................................................
.............................. CYCLE   27 ..............................
........................................................................
   1    -46.0810115 -0.460810E+02  0.345E-02    2.08       0.0  T
   2    -46.0810116 -0.115270E-06  0.202E-02    2.08       1.0  T
   3    -46.0810114  0.207086E-06  0.380E-03    2.08       5.3  T
   4    -46.0810116 -0.252002E-06  0.124E-03    2.08      16.2  T
   5    -46.0810116 -0.949218E-08  0.482E-04    2.08      41.5  T
   6    -46.0810116 -0.215650E-08  0.174E-04    2.08     115.1  T
     SCC iter.                  ...        0 min,  0.008 sec
     gradient                   ...        0 min,  0.018 sec
 * total energy  :   -45.3856915 Eh     change       -0.7110952E-05 Eh
   gradient norm :     0.0009269 Eh/α   predicted    -0.3149672E-05 ( -55.71%)
   displ. norm   :     0.0699462 α      lambda       -0.6638250E-05
   maximum displ.:     0.0522844 α      in ANC's #2, #3, #1, ...

........................................................................
.............................. CYCLE   28 ..............................
........................................................................
   1    -46.0811980 -0.460812E+02  0.449E-02    2.08       0.0  T
   2    -46.0811983 -0.341204E-06  0.253E-02    2.08       1.0  T
   3    -46.0811983  0.206673E-07  0.434E-03    2.08       4.6  T
   4    -46.0811983 -0.237251E-07  0.297E-03    2.08       6.7  T
   5    -46.0811984 -0.125245E-06  0.486E-04    2.08      41.1  T
   6    -46.0811984 -0.210627E-08  0.266E-04    2.08      75.1  T
     SCC iter.                  ...        0 min,  0.008 sec
     gradient                   ...        0 min,  0.018 sec
 * total energy  :   -45.3856992 Eh     change       -0.7646830E-05 Eh
   gradient norm :     0.0010276 Eh/α   predicted    -0.3330158E-05 ( -56.45%)
   displ. norm   :     0.1045044 α      lambda       -0.8233606E-05
   maximum displ.:     0.0782172 α      in ANC's #2, #3, #1, ...

........................................................................
.............................. CYCLE   29 ..............................
........................................................................
   1    -46.0811868 -0.460812E+02  0.617E-02    2.08       0.0  T
   2    -46.0811872 -0.474195E-06  0.356E-02    2.08       1.0  T
   3    -46.0811873 -0.731834E-07  0.463E-03    2.08       4.3  T
   4    -46.0811873  0.150772E-07  0.328E-03    2.08       6.1  T
   5    -46.0811875 -0.163895E-06  0.680E-04    2.08      29.4  T
   6    -46.0811875 -0.273741E-08  0.386E-04    2.08      51.9  T
     SCC iter.                  ...        0 min,  0.008 sec
     gradient                   ...        0 min,  0.018 sec
 * total energy  :   -45.3857092 Eh     change       -0.1002129E-04 Eh
   gradient norm :     0.0010619 Eh/α   predicted    -0.4138769E-05 ( -58.70%)
   displ. norm   :     0.1045955 α      lambda       -0.6607027E-05
   maximum displ.:     0.0782866 α      in ANC's #2, #3, #1, ...

........................................................................
.............................. CYCLE   30 ..............................
........................................................................
   1    -46.0809283 -0.460809E+02  0.643E-02    2.08       0.0  T
   2    -46.0809288 -0.569347E-06  0.367E-02    2.08       1.0  T
   3    -46.0809290 -0.120000E-06  0.496E-03    2.08       4.0  T
   4    -46.0809288  0.120082E-06  0.339E-03    2.08       5.9  T
   5    -46.0809291 -0.238252E-06  0.660E-04    2.08      30.3  T
   6    -46.0809291 -0.337074E-08  0.397E-04    2.08      50.4  T
     SCC iter.                  ...        0 min,  0.009 sec
     gradient                   ...        0 min,  0.018 sec
 * total energy  :   -45.3857171 Eh     change       -0.7865290E-05 Eh
   gradient norm :     0.0008184 Eh/α   predicted    -0.3321901E-05 ( -57.77%)
   displ. norm   :     0.0840179 α      lambda       -0.4535362E-05
   maximum displ.:     0.0659481 α      in ANC's #2, #1, #3, ...

........................................................................
.............................. CYCLE   31 ..............................
........................................................................
   1    -46.0810180 -0.460810E+02  0.520E-02    2.08       0.0  T
   2    -46.0810184 -0.412840E-06  0.294E-02    2.08       1.0  T
   3    -46.0810184  0.170792E-08  0.478E-03    2.08       4.2  T
   4    -46.0810184 -0.112401E-07  0.330E-03    2.08       6.1  T
   5    -46.0810186 -0.159134E-06  0.531E-04    2.08      37.7  T
   6    -46.0810186 -0.249015E-08  0.322E-04    2.08      62.1  T
     SCC iter.                  ...        0 min,  0.009 sec
     gradient                   ...        0 min,  0.018 sec
 * total energy  :   -45.3857222 Eh     change       -0.5174921E-05 Eh
   gradient norm :     0.0004068 Eh/α   predicted    -0.2278265E-05 ( -55.97%)
   displ. norm   :     0.0766349 α      lambda       -0.2997464E-05
   maximum displ.:     0.0601646 α      in ANC's #2, #1, #3, ...

........................................................................
.............................. CYCLE   32 ..............................
........................................................................
   1    -46.0809000 -0.460809E+02  0.448E-02    2.08       0.0  T
   2    -46.0809002 -0.202853E-06  0.257E-02    2.08       1.0  T
   3    -46.0809002 -0.571024E-08  0.321E-03    2.08       6.2  T
   4    -46.0809002  0.112223E-07  0.227E-03    2.08       8.8  T
   5    -46.0809003 -0.903908E-07  0.329E-04    2.08      60.9  T
   6    -46.0809003 -0.509871E-09  0.209E-04    2.08      95.7  T
     SCC iter.                  ...        0 min,  0.009 sec
     gradient                   ...        0 min,  0.018 sec
 * total energy  :   -45.3857259 Eh     change       -0.3670809E-05 Eh
   gradient norm :     0.0006383 Eh/α   predicted    -0.1506964E-05 ( -58.95%)
   displ. norm   :     0.0770764 α      lambda       -0.6230489E-06
   maximum displ.:     0.0601627 α      in ANC's #2, #1, #3, ...

   *** GEOMETRY OPTIMIZATION CONVERGED AFTER 32 ITERATIONS ***

------------------------------------------------------------------------
 total energy gain   :        -0.0044700 Eh       -2.8050 kcal/mol
 total RMSD          :         0.6287413 a0        0.3327 Å
 total power (kW/mol):        -0.3667486 (step)   -8.9049 (real)
------------------------------------------------------------------------

 ANCopt (total)                0 d,  0 h,  0 min,  1.318 sec
 optimizer setup                ...        0 min,  0.000 sec (  0.012%)
 model hessian                  ...        0 min,  0.007 sec (  0.513%)
 ANC generation                 ...        0 min,  0.001 sec (  0.113%)
 coordinate transformation      ...        0 min,  0.001 sec (  0.044%)
 single point calculation       ...        0 min,  1.297 sec ( 98.419%)
 optimization log               ...        0 min,  0.003 sec (  0.246%)
 hessian update                 ...        0 min,  0.000 sec (  0.031%)
 rational function              ...        0 min,  0.006 sec (  0.472%)

================
 final structure:
================
$coord
   -5.08790042682043   -2.29259829195897    0.13581247470412      C 
   -7.35181889709076   -0.01141450921877    0.06463189052297      S 
   -5.10767231873107    2.39993080293785   -0.17080828267242      C 
   -2.67990633935863    1.39959655912986   -0.17723389293999      C 
   -2.70923038296086   -1.30083794299085    0.00212253993646      C 
   -0.45095786582174   -2.90659574167096    0.05010525357364      C 
   -0.56420120877068   -5.20170347578061    0.14850390851675      O 
    1.96456390520228   -1.51258477434344   -0.00592194397320      C 
    4.21322342105486   -2.87525241489189    0.11263246139805      C 
    6.51709845934837   -1.64672546464744    0.08836759714880      C 
    6.59466121654630    0.96997330906636   -0.05786013258189      C 
    4.37355732509058    2.33784127113594   -0.18861351845911      C 
    2.03498702902901    1.12667195015504   -0.16487925196884      C 
   -0.26039091060443    2.73948258890124   -0.33245448435200      C 
   -0.03761738675925    5.01702572049522   -0.58757088982383      O 
   -6.21369094935546    4.88731087601521   -0.28954173995216      C 
   -5.07222231958019    7.11268416619999   -0.56797747834180      C 
   -5.57147853001323   -4.25529794021652    0.27814078620217      H 
    4.09505150775991   -4.90967582934702    0.22575894052840      H 
    8.24910671882918   -2.72107657073523    0.18362928322825      H 
    8.38885269713906    1.94187162617899   -0.07277387186044      H 
    4.39972894024339    4.37499149021833   -0.31135144685113      H 
   -8.25805906163345    4.83399760577054   -0.13579755188542      H 
   -3.05697675721493    7.28893845038924   -0.74134701261805      H 
   -6.17289259258951    8.82361396665892   -0.62542889127460      H 
$end
           -------------------------------------------------
          |                Final Singlepoint                |
           -------------------------------------------------

          ...................................................
          :                      SETUP                      :
          :.................................................:
          :  # basis functions                  82          :
          :  # atomic orbitals                  81          :
          :  # shells                           43          :
          :  # electrons                        82          :
          :  max. iterations                   250          :
          :  Hamiltonian                  GFN2-xTB          :
          :  restarted?                      false          :
          :  GBSA solvation                  false          :
          :  PC potential                    false          :
          :  electronic temp.          300.0000000     K    :
          :  accuracy                    1.0000000          :
          :  -> integral cutoff          0.2500000E+02      :
          :  -> integral neglect         0.1000000E-07      :
          :  -> SCF convergence          0.1000000E-05 Eh   :
          :  -> wf. convergence          0.1000000E-03 e    :
          :  Broyden damping             0.4000000          :
          ...................................................

 iter      E             dE          RMSdq      gap      omega  full diag
   1    -46.0809003 -0.460809E+02  0.832E-05    2.08       0.0  T
   2    -46.0809003 -0.109281E-10  0.554E-05    2.08     360.8  T
   3    -46.0809003 -0.646594E-10  0.291E-05    2.08     687.1  T

   *** convergence criteria satisfied after 3 iterations ***

         #    Occupation            Energy/Eh            Energy/eV
      -------------------------------------------------------------
         1        2.0000           -0.7554732             -20.5575
       ...           ...                  ...                  ...
        35        2.0000           -0.4417031             -12.0194
        36        2.0000           -0.4313151             -11.7367
        37        2.0000           -0.4275184             -11.6334
        38        2.0000           -0.4219202             -11.4810
        39        2.0000           -0.4050027             -11.0207
        40        2.0000           -0.4005722             -10.9001
        41        2.0000           -0.3970699             -10.8048 (HOMO)
        42                         -0.3207523              -8.7281 (LUMO)
        43                         -0.2986571              -8.1269
        44                         -0.2588431              -7.0435
        45                         -0.2356293              -6.4118
        46                         -0.2248624              -6.1188
       ...                                ...                  ...
        81                          0.7381340              20.0856
      -------------------------------------------------------------
                  HL-Gap            0.0763177 Eh            2.0767 eV
             Fermi-level           -0.3589111 Eh           -9.7665 eV

 SCC (total)                   0 d,  0 h,  0 min,  0.037 sec
 SCC setup                      ...        0 min,  0.000 sec (  0.652%)
 Dispersion                     ...        0 min,  0.000 sec (  0.663%)
 integral evaluation            ...        0 min,  0.013 sec ( 34.996%)
 zeroth order Hamiltonian       ...        0 min,  0.000 sec (  0.543%)
 iterations                     ...        0 min,  0.005 sec ( 13.275%)
 molecular gradient             ...        0 min,  0.018 sec ( 48.762%)
 printout                       ...        0 min,  0.000 sec (  0.959%)

         :::::::::::::::::::::::::::::::::::::::::::::::::::::
         ::                     SUMMARY                     ::
         :::::::::::::::::::::::::::::::::::::::::::::::::::::
         :: total energy             -45.385725928441 Eh    ::
         :: gradient norm              0.000638207743 Eh/a0 ::
         :: HOMO-LUMO gap              2.076709182975 eV    ::
         ::.................................................::
         :: SCC energy               -46.080900278154 Eh    ::
         :: -> isotropic ES            0.052821585716 Eh    ::
         :: -> anisotropic ES         -0.001915885038 Eh    ::
         :: -> anisotropic XC          0.017743949182 Eh    ::
         :: -> dispersion             -0.030676906295 Eh    ::
         :: repulsion energy           0.695175749398 Eh    ::
         :: add. restraining           0.000000000000 Eh    ::
         :::::::::::::::::::::::::::::::::::::::::::::::::::::

           -------------------------------------------------
          |                Property Printout                |
           -------------------------------------------------

    * Orbital Energies and Occupations

         #    Occupation            Energy/Eh            Energy/eV
      -------------------------------------------------------------
         1        2.0000           -0.7554732             -20.5575
       ...           ...                  ...                  ...
        29        2.0000           -0.4871980             -13.2573
        30        2.0000           -0.4789406             -13.0326
        31        2.0000           -0.4706462             -12.8069
        32        2.0000           -0.4630849             -12.6012
        33        2.0000           -0.4550338             -12.3821
        34        2.0000           -0.4462203             -12.1423
        35        2.0000           -0.4417031             -12.0194
        36        2.0000           -0.4313151             -11.7367
        37        2.0000           -0.4275184             -11.6334
        38        2.0000           -0.4219202             -11.4810
        39        2.0000           -0.4050027             -11.0207
        40        2.0000           -0.4005722             -10.9001
        41        2.0000           -0.3970699             -10.8048 (HOMO)
        42                         -0.3207523              -8.7281 (LUMO)
        43                         -0.2986571              -8.1269
        44                         -0.2588431              -7.0435
        45                         -0.2356293              -6.4118
        46                         -0.2248624              -6.1188
        47                         -0.2045100              -5.5650
        48                         -0.1803876              -4.9086
        49                         -0.1445128              -3.9324
        50                         -0.1372698              -3.7353
        51                         -0.0789565              -2.1485
        52                         -0.0213492              -0.5809
       ...                                ...                  ...
        81                          0.7381340              20.0856
      -------------------------------------------------------------
                  HL-Gap            0.0763177 Eh            2.0767 eV
             Fermi-level           -0.3589111 Eh           -9.7665 eV

     #   Z        covCN         q      C6AA      α(0)
     1   6 C      2.928    -0.007    28.190     8.707
     2  16 S      2.373     0.029   139.885    19.906
     3   6 C      2.980     0.040    27.090     8.538
     4   6 C      3.132    -0.037    28.693     8.769
     5   6 C      3.178    -0.030    28.326     8.690
     6   6 C      2.829     0.226    23.256     7.902
     7   8 O      0.858    -0.374    21.176     6.170
     8   6 C      2.977    -0.012    28.302     8.726
     9   6 C      2.924    -0.016    28.408     8.741
    10   6 C      2.918    -0.020    28.515     8.757
    11   6 C      2.918    -0.020    28.514     8.756
    12   6 C      2.926    -0.016    28.419     8.742
    13   6 C      2.974    -0.011    28.282     8.723
    14   6 C      2.825     0.228    23.216     7.895
    15   8 O      0.858    -0.380    21.288     6.186
    16   6 C      2.967    -0.028    28.696     8.787
    17   6 C      2.836    -0.079    29.973     8.972
    18   1 H      0.926     0.077     2.013     2.218
    19   1 H      0.926     0.067     2.113     2.273
    20   1 H      0.926     0.048     2.351     2.398
    21   1 H      0.926     0.047     2.352     2.398
    22   1 H      0.926     0.068     2.103     2.268
    23   1 H      0.925     0.047     2.355     2.400
    24   1 H      0.926     0.100     1.787     2.091
    25   1 H      0.926     0.053     2.279     2.361

 Mol. C6AA /au·bohr⁶  :      11295.763268
 Mol. C8AA /au·bohr⁸  :     313942.781264
 Mol. α(0) /au        :        171.373899


Wiberg/Mayer (AO) data.
largest (>0.10) Wiberg bond orders for each atom
          total WBO             WBO to atom ...
     1  C   3.955        C    5 1.542    S    2 1.232    H   18 0.965
     2  S   2.685        C    1 1.232    C    3 1.150
     3  C   3.950        C    4 1.449    S    2 1.150    C   16 1.146
     4  C   3.982        C    3 1.449    C    5 1.196    C   14 1.064
     5  C   3.984        C    1 1.542    C    4 1.196    C    6 1.040
     6  C   3.939        O    7 1.760    C    5 1.040    C    8 1.028
     7  O   2.040        C    6 1.760
     8  C   3.987        C    9 1.390    C   13 1.337    C    6 1.028
     9  C   3.984        C   10 1.446    C    8 1.390    H   19 0.964
    10  C   3.986        C    9 1.446    C   11 1.424    H   20 0.969
    11  C   3.987        C   12 1.446    C   10 1.424    H   21 0.969
    12  C   3.983        C   11 1.446    C   13 1.394    H   22 0.963
    13  C   3.988        C   12 1.394    C    8 1.337    C   14 1.019
    14  C   3.941        O   15 1.738    C    4 1.064    C   13 1.019
    15  O   2.055        C   14 1.738
    16  C   3.988        C   17 1.843    C    3 1.146    H   23 0.960
    17  C   3.967        C   16 1.843    H   25 0.976    H   24 0.953
    18  H   0.993        C    1 0.965
    19  H   0.995        C    9 0.964
    20  H   0.997        C   10 0.969
    21  H   0.997        C   11 0.969
    22  H   0.995        C   12 0.963
    23  H   0.997        C   16 0.960
    24  H   0.990        C   17 0.953
    25  H   0.997        C   17 0.976

molecular dipole:
                 x           y           z       tot (Debye)
 q only:       -0.096       0.464       0.066
   full:        0.089       0.347       0.080       0.933
molecular quadrupole (traceless):
                xx          xy          yy          xz          yz          zz
 q only:       16.762      -4.686     -12.555       0.227       0.584      -4.207
  q+dip:       18.823      -4.183     -11.760       0.155       0.415      -7.063
   full:       15.439      -4.308     -14.619       0.268       1.048      -0.820

           -------------------------------------------------
          |                Geometry Summary                 |
           -------------------------------------------------

      molecular mass/u    :      240.2760000
   center of mass at/Å    :       -0.5855351       0.3029578      -0.0550011
  moments of inertia/u·Å² :        0.6379830E+03   0.1442023E+04   0.2079003E+04
rotational constants/cm⁻¹ :        0.2642332E-01   0.1169026E-01   0.8108518E-02

 * 22 selected distances

     #   Z        #   Z                                     value/Å
     1   6 C      2  16 S                                 1.7011377
     2  16 S      3   6 C                                 1.7475843 (max)
     3   6 C      4   6 C                                 1.3895068
     1   6 C      5   6 C                                 1.3655986
     4   6 C      5   6 C                                 1.4322410
     6   6 C      7   8 O                                 1.2171107
     8   6 C      9   6 C                                 1.3927909
     9   6 C     10   6 C                                 1.3817210
    10   6 C     11   6 C                                 1.3874651
    11   6 C     12   6 C                                 1.3821014
     8   6 C     13   6 C                                 1.3996616
    12   6 C     13   6 C                                 1.3936971
    14   6 C     15   8 O                                 1.2184776
    16   6 C     17   6 C                                 1.3316736
     1   6 C     18   1 H                                 1.0723245 (min)
     9   6 C     19   1 H                                 1.0800456
    10   6 C     20   1 H                                 1.0797236
    11   6 C     21   1 H                                 1.0798240
    12   6 C     22   1 H                                 1.0800572
    16   6 C     23   1 H                                 1.0852548
    17   6 C     24   1 H                                 1.0744172
    17   6 C     25   1 H                                 1.0769838

 * 4 distinct bonds (by element types)

   Z      Z             #   av. dist./Å        max./Å        min./Å
   1 H    6 C           8     1.0785788     1.0852548     1.0723245
   6 C    6 C          10     1.3856457     1.4322410     1.3316736
   6 C    8 O           2     1.2177942     1.2184776     1.2171107
   6 C   16 S           2     1.7243610     1.7475843     1.7011377


optimized geometry written to: xtbopt.xyz


           -------------------------------------------------
          | TOTAL ENERGY              -45.385725928441 Eh   |
          | GRADIENT NORM               0.000638207743 Eh/α |
          | HOMO-LUMO GAP               2.076709182975 eV   |
           -------------------------------------------------

------------------------------------------------------------------------
 * finished run on 2021/05/19 at 11:01:08.990     
------------------------------------------------------------------------
 total:
 * wall-time:     0 d,  0 h,  0 min,  1.432 sec
 *  cpu-time:     0 d,  0 h,  0 min,  1.432 sec
 * ratio c/w:     1.000 speedup
 SCF:
 * wall-time:     0 d,  0 h,  0 min,  0.051 sec
 *  cpu-time:     0 d,  0 h,  0 min,  0.051 sec
 * ratio c/w:     1.000 speedup
 ANC optimizer:
 * wall-time:     0 d,  0 h,  0 min,  1.355 sec
 *  cpu-time:     0 d,  0 h,  0 min,  1.355 sec
 * ratio c/w:     1.000 speedup

