      -----------------------------------------------------------      
     |                   =====================                   |     
     |                           x T B                           |     
     |                   =====================                   |     
     |                         S. Grimme                         |     
     |          Mulliken Center for Theoretical Chemistry        |     
     |                    University of Bonn                     |     
     |                Version 6.2 RC2 (SAW190805)                |     
      -----------------------------------------------------------      

   This program is distributed in the hope that it will be useful,
   but WITHOUT ANY WARRANTY; without even the implied warranty of
   MERCHANTABILITY or FITNESS FOR A PARTICULAR PURPOSE.
   
   FOR NON-COMMERCIAL, ACADEMIA USE ONLY.
   
   Cite this work as:
   * S. Grimme, C. Bannwarth, P. Shushkov, J. Chem. Theory Comput., 2017,
     13, 1989-2009. DOI: 10.1021/acs.jctc.7b00118
   * C. Bannwarth, S. Ehlert and S. Grimme., J. Chem. Theory Comput., 2019,
     15, 1652-1671. DOI: 10.1021/acs.jctc.8b01176
   * P. Pracht, E. Caldeweyher, S. Ehlert, S. Grimme, ChemRxiv, 2019, preprint.
     DOI: 10.26434/chemrxiv.8326202.v1
   
   for DFT-D4:
   * E. Caldeweyher, C. Bannwarth and S. Grimme, J. Chem. Phys., 2017,
     147, 034112. DOI: 10.1063/1.4993215
   * E. Caldeweyher, S. Ehlert, A. Hansen, H. Neugebauer, S. Spicher,
     C. Bannwarth and S. Grimme, J. Chem. Phys., 2019, 150, 154122.
     DOI: 10.1063/1.5090222
   
   for sTDA-xTB:
   * S. Grimme and C. Bannwarth, J. Chem. Phys., 2016, 145, 054103.
     DOI: 10.1063/1.4959605
   
   in the mass-spec context:
   * V. Asgeirsson, C. Bauer and S. Grimme, Chem. Sci., 2017, 8, 4879.
     DOI: 10.1039/c7sc00601b
   
   for metadynamics refer to:
   * S. Grimme, J. Chem. Theory Comput., 2019, 155, 2847-2862
     DOI: 10.1021/acs.jctc.9b00143
   
   with help from (in alphabetical order)
   C. Bannwarth, F. Bohle, G. Brandenburg, E. Caldeweyher, M. Checinski,
   S. Dohm, S. Ehlert, S. Ehrlich, F. März, H. Neugebauer, J. Pisarek,
   P. Pracht, P. Shushkov, and S. Spicher.
   
 * started run on 2021/05/19 at 11:01:09.006     

           -------------------------------------------------
          |                Calculation Setup                |
           -------------------------------------------------

          program call               : /ihome/ghutchison/geoffh/xtb/xtb 889.xyz -opt
          hostname                   : smp-n83
          coordinate file            : 889.xyz
          omp threads                :                     1
          number of atoms            :                    31
          number of electrons        :                    80
          charge                     :                     0
          spin                       :                   0.0
          first test random number   :      0.07462633137742


########################################################################
# WARNING! Please study the warnings concerning your input carefully
#  - the use of '-opt' is discouraged, please use '--opt' next time
########################################################################

           ------------------------------------------------- 
          |                 G F N 2 - x T B                 |
          | Geometry, Frequencies, Noncovalent interactions |
          |            JCTC 2019 parametrisation            |
           ------------------------------------------------- 
             KAB for C  - Si     :                1.0500
             KAB for H  - Pd     :                0.9500
             k(s)              :                1.8500
             k(p)              :                2.2300
             k(d)              :                2.2300
             k(f)              :                2.0000
             kEN (H0ij)        :               -2.0000
             D4 a1             :                0.5200
             D4 a2             :                5.0000
             D4 s6             :                1.0000
             D4 s8             :                2.7000
             D4 s9             :                5.0000
             alphaj            :                2.0000

  Z AO/shell   Hii/eV     exponent
  1     Wed Apr 25 08:07:45 CEST 2018   EN: 2.200 GM2: 0.406  GM3: 0.0800  RAES: 1.40
     1s    -10.707211    1.230000
  6     Wed Apr 25 08:07:45 CEST 2018   EN: 2.550 GM2: 0.538  GM3: 0.1500  RAES: 3.00
     2s    -13.970922    2.096432
     2p    -10.063292    1.800000
  8     Wed Apr 25 08:07:45 CEST 2018   EN: 3.440 GM2: 0.452  GM3:-0.0517  RAES: 1.80
     2s    -20.229985    2.439742
     2p    -15.503117    2.137023

           ------------------------------------------------- 
          |        Self-Consistent Charge Iterations        |
           ------------------------------------------------- 

          ...................................................
          :                      SETUP                      :
          :.................................................:
          :  # basis functions                  76          :
          :  # atomic orbitals                  76          :
          :  # shells                           46          :
          :  # electrons                        80          :
          :  max. iterations                   250          :
          :  Hamiltonian                  GFN2-xTB          :
          :  restarted?                      false          :
          :  GBSA solvation                  false          :
          :  PC potential                    false          :
          :  electronic temp.          300.0000000     K    :
          :  accuracy                    1.0000000          :
          :  -> integral cutoff          0.2500000E+02      :
          :  -> integral neglect         0.1000000E-07      :
          :  -> SCF convergence          0.1000000E-05 Eh   :
          :  -> wf. convergence          0.1000000E-03 e    :
          :  Broyden damping             0.4000000          :
          ...................................................

 iter      E             dE          RMSdq      gap      omega  full diag
   1    -44.6413357 -0.446413E+02  0.444E+00    2.65       0.0  T
   2    -44.6984296 -0.570939E-01  0.252E+00    2.66       1.0  T
   3    -44.6935642  0.486542E-02  0.936E-01    2.56       1.0  T
   4    -44.6984199 -0.485577E-02  0.422E-01    2.68       1.0  T
   5    -44.7025198 -0.409982E-02  0.152E-01    2.68       1.0  T
   6    -44.7029254 -0.405643E-03  0.619E-02    2.67       1.0  T
   7    -44.7029501 -0.247117E-04  0.348E-02    2.67       1.0  T
   8    -44.7029631 -0.129835E-04  0.133E-02    2.67       1.3  T
   9    -44.7029649 -0.178911E-05  0.358E-03    2.67       5.0  T
  10    -44.7029650 -0.134173E-06  0.153E-03    2.67      11.7  T
  11    -44.7029651 -0.400437E-07  0.689E-04    2.67      26.1  T
  12    -44.7029651 -0.381080E-08  0.297E-04    2.67      60.4  T

   *** convergence criteria satisfied after 12 iterations ***

         #    Occupation            Energy/Eh            Energy/eV
      -------------------------------------------------------------
         1        2.0000           -0.7088386             -19.2885
       ...           ...                  ...                  ...
        34        2.0000           -0.4381878             -11.9237
        35        2.0000           -0.4265232             -11.6063
        36        2.0000           -0.4221772             -11.4880
        37        2.0000           -0.4119579             -11.2099
        38        2.0000           -0.4056712             -11.0389
        39        2.0000           -0.3762992             -10.2396
        40        2.0000           -0.3575062              -9.7282 (HOMO)
        41                         -0.2593775              -7.0580 (LUMO)
        42                         -0.2139516              -5.8219
        43                         -0.1995758              -5.4307
        44                         -0.1386519              -3.7729
        45                         -0.0821818              -2.2363
       ...                                ...                  ...
        76                          0.6648429              18.0913
      -------------------------------------------------------------
                  HL-Gap            0.0981287 Eh            2.6702 eV
             Fermi-level           -0.3084418 Eh           -8.3931 eV

 SCC (total)                   0 d,  0 h,  0 min,  0.046 sec
 SCC setup                      ...        0 min,  0.000 sec (  0.760%)
 Dispersion                     ...        0 min,  0.000 sec (  1.076%)
 integral evaluation            ...        0 min,  0.011 sec ( 24.142%)
 zeroth order Hamiltonian       ...        0 min,  0.000 sec (  0.422%)
 iterations                     ...        0 min,  0.017 sec ( 37.089%)
 molecular gradient             ...        0 min,  0.016 sec ( 35.468%)
 printout                       ...        0 min,  0.000 sec (  0.928%)

         :::::::::::::::::::::::::::::::::::::::::::::::::::::
         ::                     SUMMARY                     ::
         :::::::::::::::::::::::::::::::::::::::::::::::::::::
         :: total energy             -44.067656891387 Eh    ::
         :: gradient norm              0.044258908719 Eh/a0 ::
         :: HOMO-LUMO gap              2.670218250321 eV    ::
         ::.................................................::
         :: SCC energy               -44.702965059028 Eh    ::
         :: -> isotropic ES            0.032564820979 Eh    ::
         :: -> anisotropic ES          0.007383231101 Eh    ::
         :: -> anisotropic XC          0.019891749821 Eh    ::
         :: -> dispersion             -0.025831757798 Eh    ::
         :: repulsion energy           0.635318494350 Eh    ::
         :: add. restraining           0.000000000000 Eh    ::
         :::::::::::::::::::::::::::::::::::::::::::::::::::::

      ----------------------------------------------------------- 
     |                   =====================                   |
     |                        A N C O P T                        |
     |                   =====================                   |
     |               Approximate Normal Coordinate               |
     |                Rational Function Optimizer                |
      ----------------------------------------------------------- 

          ...................................................
          :                      SETUP                      :
          :.................................................:
          :   optimization level            normal          :
          :   max. optcycles                   200          :
          :   ANC micro-cycles                  20          :
          :   degrees of freedom                87          :
          :.................................................:
          :   RF solver                   davidson          :
          :   input Hessian                  false          :
          :   write xtbopt.log                true          :
          :   linear?                        false          :
          :   energy convergence         0.5000000E-05 Eh   :
          :   grad. convergence          0.1000000E-02 Eh/α :
          :   maximium RF displ.         2.0000000          :
          :   Hlow (freq-cutoff)         0.5000000E-02      :
          :   Hmax (freq-cutoff)         5.0000000          :
          :   S6 in model hess.         20.0000000          :
          ...................................................

generating ANC from model Hessian ...
Using Lindh-Hessian (1995)
 Shifting diagonal of input Hessian by   4.337508069307167E-003
 Lowest  eigenvalues of input Hessian
   -0.000000    0.000000    0.000000    0.000000    0.000000    0.000000
    0.005000    0.005059    0.005864    0.006125    0.006481    0.006931
    0.008586    0.010149    0.010796    0.012358    0.012985    0.016132
 Highest eigenvalues
    1.740823    1.814652    1.867179    1.954670    2.034963    2.073894
 

........................................................................
.............................. CYCLE    1 ..............................
........................................................................
   1    -44.7029651 -0.447030E+02  0.791E-05    2.67       0.0  T
   2    -44.7029651 -0.325429E-10  0.556E-05    2.67     323.1  T
   3    -44.7029651 -0.400178E-10  0.347E-05    2.67     518.3  T
     SCC iter.                  ...        0 min,  0.005 sec
     gradient                   ...        0 min,  0.016 sec
 * total energy  :   -44.0676568 Eh     change        0.4675192E-07 Eh
   gradient norm :     0.0442625 Eh/α   predicted     0.0000000E+00 (-100.00%)
   displ. norm   :     0.2438905 α      lambda       -0.5022707E-02
   maximum displ.:     0.1070831 α      in ANC's #18, #15, #27, ...

........................................................................
.............................. CYCLE    2 ..............................
........................................................................
   1    -44.7321759 -0.447322E+02  0.134E-01    2.66       0.0  T
   2    -44.7321809 -0.497444E-05  0.826E-02    2.67       1.0  T
   3    -44.7321108  0.700754E-04  0.543E-02    2.66       1.0  T
   4    -44.7321902 -0.794135E-04  0.643E-03    2.67       2.8  T
   5    -44.7321909 -0.664836E-06  0.335E-03    2.67       5.4  T
   6    -44.7321910 -0.119811E-06  0.157E-03    2.67      11.4  T
     SCC iter.                  ...        0 min,  0.008 sec
     gradient                   ...        0 min,  0.015 sec
 * total energy  :   -44.0709316 Eh     change       -0.3274801E-02 Eh
   gradient norm :     0.0170185 Eh/α   predicted    -0.2660740E-02 ( -18.75%)
   displ. norm   :     0.1941555 α      lambda       -0.1015615E-02
   maximum displ.:     0.0779478 α      in ANC's #8, #18, #4, ...

........................................................................
.............................. CYCLE    3 ..............................
........................................................................
   1    -44.7424419 -0.447424E+02  0.115E-01    2.65       0.0  T
   2    -44.7424469 -0.498313E-05  0.700E-02    2.65       1.0  T
   3    -44.7424085  0.383729E-04  0.410E-02    2.65       1.0  T
   4    -44.7424518 -0.433178E-04  0.568E-03    2.65       3.2  T
   5    -44.7424522 -0.398475E-06  0.305E-03    2.65       5.9  T
   6    -44.7424523 -0.131879E-06  0.138E-03    2.65      13.0  T
   7    -44.7424523 -0.389922E-08  0.570E-04    2.65      31.5  T
     SCC iter.                  ...        0 min,  0.009 sec
     gradient                   ...        0 min,  0.015 sec
 * total energy  :   -44.0715681 Eh     change       -0.6364778E-03 Eh
   gradient norm :     0.0058605 Eh/α   predicted    -0.5269520E-03 ( -17.21%)
   displ. norm   :     0.1905802 α      lambda       -0.3211336E-03
   maximum displ.:     0.0899898 α      in ANC's #4, #8, #3, ...

........................................................................
.............................. CYCLE    4 ..............................
........................................................................
   1    -44.7430714 -0.447431E+02  0.107E-01    2.63       0.0  T
   2    -44.7430756 -0.412550E-05  0.647E-02    2.63       1.0  T
   3    -44.7430668  0.877174E-05  0.206E-02    2.63       1.0  T
   4    -44.7430770 -0.102023E-04  0.503E-03    2.63       3.6  T
   5    -44.7430773 -0.356206E-06  0.269E-03    2.63       6.7  T
   6    -44.7430774 -0.959487E-07  0.120E-03    2.63      15.0  T
     SCC iter.                  ...        0 min,  0.008 sec
     gradient                   ...        0 min,  0.015 sec
 * total energy  :   -44.0718240 Eh     change       -0.2558731E-03 Eh
   gradient norm :     0.0044297 Eh/α   predicted    -0.1664053E-03 ( -34.97%)
   displ. norm   :     0.3206354 α      lambda       -0.3966210E-03
   maximum displ.:     0.1619846 α      in ANC's #4, #3, #8, ...

........................................................................
.............................. CYCLE    5 ..............................
........................................................................
   1    -44.7404758 -0.447405E+02  0.174E-01    2.60       0.0  T
   2    -44.7404842 -0.843693E-05  0.105E-01    2.61       1.0  T
   3    -44.7404723  0.119538E-04  0.252E-02    2.61       1.0  T
   4    -44.7404875 -0.151982E-04  0.653E-03    2.61       2.7  T
   5    -44.7404879 -0.372976E-06  0.411E-03    2.61       4.4  T
   6    -44.7404881 -0.222519E-06  0.176E-03    2.61      10.2  T
   7    -44.7404881 -0.131077E-07  0.552E-04    2.61      32.5  T
     SCC iter.                  ...        0 min,  0.009 sec
     gradient                   ...        0 min,  0.015 sec
 * total energy  :   -44.0721267 Eh     change       -0.3026638E-03 Eh
   gradient norm :     0.0069052 Eh/α   predicted    -0.2187110E-03 ( -27.74%)
   displ. norm   :     0.3338834 α      lambda       -0.3101754E-03
   maximum displ.:     0.1749032 α      in ANC's #4, #3, #2, ...

........................................................................
.............................. CYCLE    6 ..............................
........................................................................
   1    -44.7376696 -0.447377E+02  0.174E-01    2.59       0.0  T
   2    -44.7376753 -0.568345E-05  0.105E-01    2.59       1.0  T
   3    -44.7376689  0.636672E-05  0.196E-02    2.59       1.0  T
   4    -44.7376781 -0.923177E-05  0.507E-03    2.59       3.5  T
   5    -44.7376782 -0.237433E-07  0.358E-03    2.59       5.0  T
   6    -44.7376783 -0.163843E-06  0.140E-03    2.59      12.8  T
   7    -44.7376784 -0.152502E-07  0.397E-04    2.59      45.2  T
     SCC iter.                  ...        0 min,  0.009 sec
     gradient                   ...        0 min,  0.015 sec
 * total energy  :   -44.0723593 Eh     change       -0.2326108E-03 Eh
   gradient norm :     0.0084266 Eh/α   predicted    -0.1723774E-03 ( -25.89%)
   displ. norm   :     0.3077100 α      lambda       -0.2755062E-03
   maximum displ.:     0.1691365 α      in ANC's #4, #3, #2, ...

........................................................................
.............................. CYCLE    7 ..............................
........................................................................
   1    -44.7373314 -0.447373E+02  0.152E-01    2.59       0.0  T
   2    -44.7373348 -0.345265E-05  0.916E-02    2.59       1.0  T
   3    -44.7373308  0.396091E-05  0.158E-02    2.59       1.1  T
   4    -44.7373369 -0.606042E-05  0.395E-03    2.59       4.6  T
   5    -44.7373368  0.805141E-07  0.282E-03    2.59       6.4  T
   6    -44.7373370 -0.131574E-06  0.790E-04    2.59      22.7  T
     SCC iter.                  ...        0 min,  0.008 sec
     gradient                   ...        0 min,  0.015 sec
 * total energy  :   -44.0725699 Eh     change       -0.2106703E-03 Eh
   gradient norm :     0.0067506 Eh/α   predicted    -0.1508028E-03 ( -28.42%)
   displ. norm   :     0.3330365 α      lambda       -0.2624782E-03
   maximum displ.:     0.1810306 α      in ANC's #4, #3, #2, ...

........................................................................
.............................. CYCLE    8 ..............................
........................................................................
   1    -44.7387625 -0.447388E+02  0.155E-01    2.59       0.0  T
   2    -44.7387656 -0.304159E-05  0.934E-02    2.59       1.0  T
   3    -44.7387608  0.474082E-05  0.154E-02    2.59       1.2  T
   4    -44.7387674 -0.658181E-05  0.432E-03    2.59       4.2  T
   5    -44.7387674 -0.386108E-07  0.312E-03    2.59       5.8  T
   6    -44.7387676 -0.118514E-06  0.720E-04    2.59      24.9  T
   7    -44.7387676 -0.432845E-08  0.228E-04    2.59      78.7  T
     SCC iter.                  ...        0 min,  0.009 sec
     gradient                   ...        0 min,  0.015 sec
 * total energy  :   -44.0727625 Eh     change       -0.1926059E-03 Eh
   gradient norm :     0.0041820 Eh/α   predicted    -0.1457956E-03 ( -24.30%)
   displ. norm   :     0.3454484 α      lambda       -0.2020673E-03
   maximum displ.:     0.1828621 α      in ANC's #4, #3, #2, ...

........................................................................
.............................. CYCLE    9 ..............................
........................................................................
   1    -44.7402308 -0.447402E+02  0.157E-01    2.59       0.0  T
   2    -44.7402332 -0.239907E-05  0.944E-02    2.59       1.0  T
   3    -44.7402311  0.206287E-05  0.113E-02    2.59       1.6  T
   4    -44.7402347 -0.353366E-05  0.398E-03    2.59       4.5  T
   5    -44.7402347  0.172469E-08  0.276E-03    2.59       6.5  T
   6    -44.7402348 -0.993041E-07  0.623E-04    2.59      28.8  T
     SCC iter.                  ...        0 min,  0.008 sec
     gradient                   ...        0 min,  0.015 sec
 * total energy  :   -44.0728991 Eh     change       -0.1365472E-03 Eh
   gradient norm :     0.0045010 Eh/α   predicted    -0.1130928E-03 ( -17.18%)
   displ. norm   :     0.3089450 α      lambda       -0.1626109E-03
   maximum displ.:     0.1622714 α      in ANC's #2, #4, #3, ...

........................................................................
.............................. CYCLE   10 ..............................
........................................................................
   1    -44.7423348 -0.447423E+02  0.131E-01    2.59       0.0  T
   2    -44.7423361 -0.133563E-05  0.781E-02    2.59       1.0  T
   3    -44.7423348  0.132183E-05  0.844E-03    2.59       2.1  T
   4    -44.7423369 -0.213924E-05  0.296E-03    2.59       6.1  T
   5    -44.7423369 -0.709775E-09  0.201E-03    2.59       8.9  T
     SCC iter.                  ...        0 min,  0.007 sec
     gradient                   ...        0 min,  0.015 sec
 * total energy  :   -44.0730046 Eh     change       -0.1054942E-03 Eh
   gradient norm :     0.0044704 Eh/α   predicted    -0.8906684E-04 ( -15.57%)
   displ. norm   :     0.3261345 α      lambda       -0.1244996E-03
   maximum displ.:     0.1678687 α      in ANC's #2, #4, #3, ...

........................................................................
.............................. CYCLE   11 ..............................
........................................................................
   1    -44.7409852 -0.447410E+02  0.142E-01    2.58       0.0  T
   2    -44.7409868 -0.163946E-05  0.848E-02    2.58       1.0  T
   3    -44.7409867  0.105630E-06  0.656E-03    2.58       2.7  T
   4    -44.7409877 -0.975619E-06  0.307E-03    2.58       5.8  T
   5    -44.7409877 -0.255163E-07  0.163E-03    2.58      11.0  T
   6    -44.7409877 -0.253773E-07  0.623E-04    2.58      28.8  T
     SCC iter.                  ...        0 min,  0.008 sec
     gradient                   ...        0 min,  0.015 sec
 * total energy  :   -44.0730821 Eh     change       -0.7752241E-04 Eh
   gradient norm :     0.0046627 Eh/α   predicted    -0.6887356E-04 ( -11.16%)
   displ. norm   :     0.2497546 α      lambda       -0.1709701E-03
   maximum displ.:     0.1486413 α      in ANC's #1, #2, #4, ...

........................................................................
.............................. CYCLE   12 ..............................
........................................................................
   1    -44.7457403 -0.447457E+02  0.103E-01    2.57       0.0  T
   2    -44.7457427 -0.244839E-05  0.612E-02    2.57       1.0  T
   3    -44.7457376  0.513807E-05  0.132E-02    2.57       1.4  T
   4    -44.7457437 -0.608773E-05  0.281E-03    2.57       6.4  T
   5    -44.7457438 -0.958686E-07  0.176E-03    2.57      10.2  T
   6    -44.7457438 -0.328529E-07  0.893E-04    2.57      20.1  T
     SCC iter.                  ...        0 min,  0.008 sec
     gradient                   ...        0 min,  0.015 sec
 * total energy  :   -44.0731460 Eh     change       -0.6385852E-04 Eh
   gradient norm :     0.0064306 Eh/α   predicted    -0.9082235E-04 (  42.22%)
   displ. norm   :     0.3906361 α      lambda       -0.2020377E-03
   maximum displ.:     0.2050740 α      in ANC's #4, #2, #1, ...

........................................................................
.............................. CYCLE   13 ..............................
........................................................................
   1    -44.7399905 -0.447400E+02  0.166E-01    2.56       0.0  T
   2    -44.7399936 -0.304094E-05  0.988E-02    2.56       1.0  T
   3    -44.7399913  0.231277E-05  0.120E-02    2.56       1.5  T
   4    -44.7399949 -0.360374E-05  0.449E-03    2.56       4.0  T
   5    -44.7399950 -0.158098E-06  0.259E-03    2.56       6.9  T
   6    -44.7399951 -0.586843E-07  0.102E-03    2.56      17.6  T
     SCC iter.                  ...        0 min,  0.008 sec
     gradient                   ...        0 min,  0.015 sec
 * total energy  :   -44.0731863 Eh     change       -0.4028837E-04 Eh
   gradient norm :     0.0081415 Eh/α   predicted    -0.1164432E-03 ( 189.02%)
   displ. norm   :     0.0896708 α      lambda       -0.1811568E-03
   maximum displ.:     0.0493393 α      in ANC's #3, #4, #11, ...

........................................................................
.............................. CYCLE   14 ..............................
........................................................................
   1    -44.7416661 -0.447417E+02  0.389E-02    2.56       0.0  T
   2    -44.7416667 -0.611488E-06  0.231E-02    2.56       1.0  T
   3    -44.7416657  0.102194E-05  0.764E-03    2.56       2.4  T
   4    -44.7416670 -0.123108E-05  0.204E-03    2.56       8.8  T
   5    -44.7416670 -0.413072E-07  0.118E-03    2.56      15.3  T
     SCC iter.                  ...        0 min,  0.007 sec
     gradient                   ...        0 min,  0.015 sec
 * total energy  :   -44.0732780 Eh     change       -0.9177064E-04 Eh
   gradient norm :     0.0038923 Eh/α   predicted    -0.9131330E-04 (  -0.50%)
   displ. norm   :     0.1257175 α      lambda       -0.7401777E-04
   maximum displ.:     0.0912740 α      in ANC's #1, #2, #4, ...

........................................................................
.............................. CYCLE   15 ..............................
........................................................................
   1    -44.7422159 -0.447422E+02  0.521E-02    2.56       0.0  T
   2    -44.7422163 -0.431968E-06  0.311E-02    2.56       1.0  T
   3    -44.7422154  0.889819E-06  0.633E-03    2.56       2.8  T
   4    -44.7422165 -0.109404E-05  0.134E-03    2.56      13.4  T
   5    -44.7422165 -0.914709E-08  0.853E-04    2.56      21.1  T
   6    -44.7422165 -0.595126E-08  0.385E-04    2.56      46.7  T
     SCC iter.                  ...        0 min,  0.008 sec
     gradient                   ...        0 min,  0.016 sec
 * total energy  :   -44.0733210 Eh     change       -0.4292402E-04 Eh
   gradient norm :     0.0036250 Eh/α   predicted    -0.3759921E-04 ( -12.41%)
   displ. norm   :     0.1893961 α      lambda       -0.7963616E-04
   maximum displ.:     0.1428961 α      in ANC's #1, #4, #2, ...

........................................................................
.............................. CYCLE   16 ..............................
........................................................................
   1    -44.7421995 -0.447422E+02  0.780E-02    2.55       0.0  T
   2    -44.7422002 -0.637996E-06  0.465E-02    2.55       1.0  T
   3    -44.7421989  0.124288E-05  0.743E-03    2.55       2.4  T
   4    -44.7422005 -0.160204E-05  0.203E-03    2.55       8.9  T
   5    -44.7422005 -0.220325E-07  0.129E-03    2.55      14.0  T
   6    -44.7422006 -0.166936E-07  0.329E-04    2.55      54.6  T
   7    -44.7422006 -0.971639E-09  0.106E-04    2.55     168.8  T
     SCC iter.                  ...        0 min,  0.009 sec
     gradient                   ...        0 min,  0.016 sec
 * total energy  :   -44.0733767 Eh     change       -0.5573139E-04 Eh
   gradient norm :     0.0030577 Eh/α   predicted    -0.4125053E-04 ( -25.98%)
   displ. norm   :     0.1785789 α      lambda       -0.6585976E-04
   maximum displ.:     0.1400612 α      in ANC's #1, #6, #2, ...

........................................................................
.............................. CYCLE   17 ..............................
........................................................................
   1    -44.7420577 -0.447421E+02  0.674E-02    2.55       0.0  T
   2    -44.7420583 -0.593528E-06  0.403E-02    2.55       1.0  T
   3    -44.7420563  0.197678E-05  0.974E-03    2.55       1.8  T
   4    -44.7420587 -0.237633E-05  0.193E-03    2.55       9.3  T
   5    -44.7420587 -0.150179E-07  0.132E-03    2.55      13.6  T
   6    -44.7420587 -0.144868E-07  0.520E-04    2.55      34.5  T
   7    -44.7420587 -0.398784E-08  0.167E-04    2.55     107.3  T
     SCC iter.                  ...        0 min,  0.010 sec
     gradient                   ...        0 min,  0.016 sec
 * total energy  :   -44.0734130 Eh     change       -0.3626708E-04 Eh
   gradient norm :     0.0028557 Eh/α   predicted    -0.3398220E-04 (  -6.30%)
   displ. norm   :     0.1464070 α      lambda       -0.3568766E-04
   maximum displ.:     0.0988344 α      in ANC's #1, #4, #2, ...

........................................................................
.............................. CYCLE   18 ..............................
........................................................................
   1    -44.7406318 -0.447406E+02  0.597E-02    2.55       0.0  T
   2    -44.7406320 -0.208156E-06  0.354E-02    2.55       1.0  T
   3    -44.7406318  0.180648E-06  0.353E-03    2.55       5.1  T
   4    -44.7406321 -0.303029E-06  0.110E-03    2.55      16.3  T
   5    -44.7406321 -0.940098E-09  0.672E-04    2.55      26.7  T
   6    -44.7406321 -0.500237E-08  0.222E-04    2.55      80.8  T
     SCC iter.                  ...        0 min,  0.008 sec
     gradient                   ...        0 min,  0.016 sec
 * total energy  :   -44.0734324 Eh     change       -0.1940062E-04 Eh
   gradient norm :     0.0028561 Eh/α   predicted    -0.1823029E-04 (  -6.03%)
   displ. norm   :     0.1344806 α      lambda       -0.3466230E-04
   maximum displ.:     0.1119446 α      in ANC's #1, #6, #2, ...

........................................................................
.............................. CYCLE   19 ..............................
........................................................................
   1    -44.7417082 -0.447417E+02  0.505E-02    2.55       0.0  T
   2    -44.7417084 -0.192466E-06  0.300E-02    2.55       1.0  T
   3    -44.7417063  0.211496E-05  0.950E-03    2.55       1.9  T
   4    -44.7417086 -0.233330E-05  0.106E-03    2.55      17.0  T
   5    -44.7417086 -0.645655E-08  0.615E-04    2.55      29.2  T
   6    -44.7417086 -0.467189E-09  0.286E-04    2.55      62.7  T
     SCC iter.                  ...        0 min,  0.008 sec
     gradient                   ...        0 min,  0.016 sec
 * total energy  :   -44.0734476 Eh     change       -0.1527428E-04 Eh
   gradient norm :     0.0030673 Eh/α   predicted    -0.1764517E-04 (  15.52%)
   displ. norm   :     0.0945539 α      lambda       -0.2507917E-04
   maximum displ.:     0.0766050 α      in ANC's #1, #4, #2, ...

........................................................................
.............................. CYCLE   20 ..............................
........................................................................
   1    -44.7426329 -0.447426E+02  0.335E-02    2.55       0.0  T
   2    -44.7426331 -0.158405E-06  0.199E-02    2.55       1.0  T
   3    -44.7426314  0.170092E-05  0.870E-03    2.55       2.1  T
   4    -44.7426332 -0.185311E-05  0.735E-04    2.55      24.4  T
   5    -44.7426333 -0.729207E-08  0.369E-04    2.55      48.6  T
   6    -44.7426333 -0.504492E-09  0.217E-04    2.55      82.9  T
     SCC iter.                  ...        0 min,  0.008 sec
     gradient                   ...        0 min,  0.016 sec
 * total energy  :   -44.0734578 Eh     change       -0.1015785E-04 Eh
   gradient norm :     0.0019993 Eh/α   predicted    -0.1265500E-04 (  24.58%)
   displ. norm   :     0.1067840 α      lambda       -0.1431417E-04
   maximum displ.:     0.0582356 α      in ANC's #1, #4, #2, ...
 * RMSD in coord.:     0.6630744 α      energy gain  -0.5800893E-02 Eh

generating ANC from model Hessian ...
Using Lindh-Hessian (1995)
 Shifting diagonal of input Hessian by   4.235583366441921E-003
 Lowest  eigenvalues of input Hessian
   -0.000000    0.000000    0.000000    0.000000    0.000000    0.000000
    0.005000    0.005235    0.005674    0.006147    0.006497    0.007132
    0.008657    0.010222    0.011292    0.012585    0.013692    0.017258
 Highest eigenvalues
    1.812400    1.871916    1.936501    2.008835    2.104411    2.157874
 

........................................................................
.............................. CYCLE   21 ..............................
........................................................................
   1    -44.7415093 -0.447415E+02  0.473E-02    2.54       0.0  T
   2    -44.7415096 -0.301686E-06  0.283E-02    2.54       1.0  T
   3    -44.7415092  0.445600E-06  0.451E-03    2.54       4.0  T
   4    -44.7415098 -0.570540E-06  0.153E-03    2.54      11.8  T
   5    -44.7415098 -0.273444E-07  0.783E-04    2.54      22.9  T
   6    -44.7415098 -0.257521E-08  0.361E-04    2.54      49.8  T
     SCC iter.                  ...        0 min,  0.008 sec
     gradient                   ...        0 min,  0.016 sec
 * total energy  :   -44.0734675 Eh     change       -0.9701841E-05 Eh
   gradient norm :     0.0022168 Eh/α   predicted     0.0000000E+00 (-100.00%)
   displ. norm   :     0.0274271 α      lambda       -0.1521998E-04
   maximum displ.:     0.0192572 α      in ANC's #4, #2, #8, ...

........................................................................
.............................. CYCLE   22 ..............................
........................................................................
   1    -44.7422759 -0.447423E+02  0.139E-02    2.54       0.0  T
   2    -44.7422759 -0.458012E-07  0.833E-03    2.54       2.2  T
   3    -44.7422758  0.116654E-06  0.243E-03    2.54       7.4  T
   4    -44.7422759 -0.133132E-06  0.540E-04    2.54      33.3  T
   5    -44.7422759 -0.431420E-08  0.241E-04    2.54      74.4  T
     SCC iter.                  ...        0 min,  0.007 sec
     gradient                   ...        0 min,  0.016 sec
 * total energy  :   -44.0734781 Eh     change       -0.1065220E-04 Eh
   gradient norm :     0.0006851 Eh/α   predicted    -0.7629996E-05 ( -28.37%)
   displ. norm   :     0.0407431 α      lambda       -0.7213062E-05
   maximum displ.:     0.0249581 α      in ANC's #4, #8, #11, ...

........................................................................
.............................. CYCLE   23 ..............................
........................................................................
   1    -44.7429214 -0.447429E+02  0.228E-02    2.54       0.0  T
   2    -44.7429215 -0.100837E-06  0.139E-02    2.54       1.3  T
   3    -44.7429215  0.414872E-07  0.205E-03    2.54       8.8  T
   4    -44.7429216 -0.889092E-07  0.777E-04    2.54      23.1  T
   5    -44.7429216 -0.414087E-08  0.436E-04    2.54      41.2  T
     SCC iter.                  ...        0 min,  0.007 sec
     gradient                   ...        0 min,  0.016 sec
 * total energy  :   -44.0734845 Eh     change       -0.6373746E-05 Eh
   gradient norm :     0.0011523 Eh/α   predicted    -0.3609655E-05 ( -43.37%)
   displ. norm   :     0.0410104 α      lambda        0.4058691E-05
   maximum displ.:     0.0249552 α      in ANC's #4, #8, #11, ...

........................................................................
.............................. CYCLE   24 ..............................
........................................................................
   1    -44.7435183 -0.447435E+02  0.229E-02    2.54       0.0  T
   2    -44.7435184 -0.101004E-06  0.139E-02    2.55       1.3  T
   3    -44.7435184  0.306683E-07  0.187E-03    2.55       9.6  T
   4    -44.7435185 -0.796913E-07  0.732E-04    2.55      24.5  T
   5    -44.7435185 -0.286786E-08  0.426E-04    2.55      42.2  T
     SCC iter.                  ...        0 min,  0.007 sec
     gradient                   ...        0 min,  0.016 sec
 * total energy  :   -44.0734820 Eh     change        0.2543030E-05 Eh
   gradient norm :     0.0026261 Eh/α   predicted     0.2027080E-05 ( -20.29%)
   displ. norm   :     0.0154876 α      lambda       -0.1076163E-04
   maximum displ.:     0.0091544 α      in ANC's #4, #2, #8, ...

........................................................................
.............................. CYCLE   25 ..............................
........................................................................
   1    -44.7431834 -0.447432E+02  0.992E-03    2.54       0.0  T
   2    -44.7431834 -0.140832E-07  0.605E-03    2.54       3.0  T
   3    -44.7431833  0.104080E-06  0.214E-03    2.54       8.4  T
   4    -44.7431834 -0.117052E-06  0.286E-04    2.54      62.8  T
   5    -44.7431834 -0.478458E-09  0.162E-04    2.54     110.7  T
     SCC iter.                  ...        0 min,  0.007 sec
     gradient                   ...        0 min,  0.016 sec
 * total energy  :   -44.0734897 Eh     change       -0.7683590E-05 Eh
   gradient norm :     0.0017855 Eh/α   predicted    -0.5384119E-05 ( -29.93%)
   displ. norm   :     0.0396068 α      lambda       -0.1006103E-04
   maximum displ.:     0.0263586 α      in ANC's #4, #2, #3, ...

........................................................................
.............................. CYCLE   26 ..............................
........................................................................
   1    -44.7420088 -0.447420E+02  0.235E-02    2.54       0.0  T
   2    -44.7420089 -0.124355E-06  0.142E-02    2.54       1.3  T
   3    -44.7420086  0.330270E-06  0.411E-03    2.54       4.4  T
   4    -44.7420090 -0.386694E-06  0.901E-04    2.54      19.9  T
   5    -44.7420090 -0.100275E-07  0.437E-04    2.54      41.1  T
     SCC iter.                  ...        0 min,  0.007 sec
     gradient                   ...        0 min,  0.016 sec
 * total energy  :   -44.0734961 Eh     change       -0.6401170E-05 Eh
   gradient norm :     0.0010290 Eh/α   predicted    -0.5034513E-05 ( -21.35%)
   displ. norm   :     0.0394366 α      lambda        0.1512745E-04
   maximum displ.:     0.0263618 α      in ANC's #4, #2, #3, ...

........................................................................
.............................. CYCLE   27 ..............................
........................................................................
   1    -44.7407876 -0.447408E+02  0.235E-02    2.54       0.0  T
   2    -44.7407877 -0.127773E-06  0.142E-02    2.54       1.3  T
   3    -44.7407874  0.314966E-06  0.405E-03    2.54       4.4  T
   4    -44.7407877 -0.370007E-06  0.921E-04    2.54      19.5  T
   5    -44.7407877 -0.108470E-07  0.448E-04    2.54      40.1  T
     SCC iter.                  ...        0 min,  0.007 sec
     gradient                   ...        0 min,  0.016 sec
 * total energy  :   -44.0734848 Eh     change        0.1122943E-04 Eh
   gradient norm :     0.0036186 Eh/α   predicted     0.7565822E-05 ( -32.63%)
   displ. norm   :     0.0110351 α      lambda       -0.1802503E-04
   maximum displ.:     0.0038269 α      in ANC's #10, #15, #4, ...

........................................................................
.............................. CYCLE   28 ..............................
........................................................................
   1    -44.7417456 -0.447417E+02  0.736E-03    2.54       0.0  T
   2    -44.7417456 -0.448168E-07  0.442E-03    2.54       4.1  T
   3    -44.7417455  0.132544E-06  0.271E-03    2.54       6.6  T
   4    -44.7417457 -0.149675E-06  0.492E-04    2.54      36.5  T
   5    -44.7417457 -0.446121E-08  0.145E-04    2.54     124.0  T
     SCC iter.                  ...        0 min,  0.007 sec
     gradient                   ...        0 min,  0.016 sec
 * total energy  :   -44.0734974 Eh     change       -0.1262358E-04 Eh
   gradient norm :     0.0015072 Eh/α   predicted    -0.9015840E-05 ( -28.58%)
   displ. norm   :     0.0267297 α      lambda       -0.6507809E-05
   maximum displ.:     0.0177752 α      in ANC's #4, #2, #3, ...

........................................................................
.............................. CYCLE   29 ..............................
........................................................................
   1    -44.7427234 -0.447427E+02  0.136E-02    2.54       0.0  T
   2    -44.7427235 -0.602241E-07  0.813E-03    2.54       2.2  T
   3    -44.7427232  0.221321E-06  0.332E-03    2.54       5.4  T
   4    -44.7427235 -0.246410E-06  0.592E-04    2.54      30.3  T
   5    -44.7427235 -0.549524E-08  0.249E-04    2.54      72.1  T
     SCC iter.                  ...        0 min,  0.007 sec
     gradient                   ...        0 min,  0.016 sec
 * total energy  :   -44.0735015 Eh     change       -0.4078564E-05 Eh
   gradient norm :     0.0007414 Eh/α   predicted    -0.3257915E-05 ( -20.12%)
   displ. norm   :     0.0242457 α      lambda       -0.1741803E-05
   maximum displ.:     0.0179388 α      in ANC's #4, #3, #2, ...

   *** GEOMETRY OPTIMIZATION CONVERGED AFTER 29 ITERATIONS ***

------------------------------------------------------------------------
 total energy gain   :        -0.0058446 Eh       -3.6676 kcal/mol
 total RMSD          :         0.6789984 a0        0.3593 Å
 total power (kW/mol):        -0.5291409 (step)  -14.6519 (real)
------------------------------------------------------------------------

 ANCopt (total)                0 d,  0 h,  0 min,  1.047 sec
 optimizer setup                ...        0 min,  0.000 sec (  0.014%)
 model hessian                  ...        0 min,  0.009 sec (  0.899%)
 ANC generation                 ...        0 min,  0.002 sec (  0.186%)
 coordinate transformation      ...        0 min,  0.001 sec (  0.060%)
 single point calculation       ...        0 min,  1.024 sec ( 97.726%)
 optimization log               ...        0 min,  0.004 sec (  0.339%)
 hessian update                 ...        0 min,  0.000 sec (  0.042%)
 rational function              ...        0 min,  0.006 sec (  0.561%)

================
 final structure:
================
$coord
    3.13578689092188    1.07481374328455   -0.02138167965030      C 
    1.86430284196141    3.37444605022206   -0.17665248656393      C 
    3.30608481028149    5.42079969579774   -0.81746422425571      O 
    2.11816071251615    7.78839058792839   -1.01121019208971      C 
   -0.70745375470051    3.43842978430295    0.30677953864604      C 
   -2.04065085302105    1.25351997328175    0.94427906981717      C 
   -0.72800718491030   -1.06311530120275    1.07934764213501      C 
    1.85281459385453   -1.11172485760716    0.59641654089702      C 
   -2.11981285465239   -3.13800017077845    1.71164734422965      O 
   -0.91845481014081   -5.51430137979059    1.87017200316545      C 
   -2.91929689550592   -7.44961204778796    2.58565055048307      C 
   -4.73155937162186    1.27911346104712    1.44693686993321      C 
   -6.19341110607184    3.31454043495964    1.84113175309337      C 
   -8.86314367746223    3.14532182491655    2.33061102317980      C 
  -10.33697871030749    5.13657890996778    2.77418979130947      C 
    5.13727409778189    1.03440542422252   -0.39974700721627      H 
    3.60277934243135    9.11603905455547   -1.52958595959158      H 
    1.28222511296748    8.37135119149744    0.79001290101917      H 
    0.65897902211699    7.79157133132892   -2.47896988167120      H 
   -1.74000530130956    5.18716804793407    0.17076133957216      H 
    2.89823158219879   -2.85827131922722    0.69437766230926      H 
    0.57565822120336   -5.46727997915507    3.31211632096278      H 
   -0.06364662778020   -6.01033222815736    0.04340452896670      H 
   -3.77563165092271   -6.93888031664524    4.38004321919933      H 
   -2.06655035736554   -9.30896333698317    2.74931417953416      H 
   -4.38787849602836   -7.50511917452492    1.15189167823470      H 
   -5.59131516078688   -0.57262357850187    1.54262810261830      H 
   -5.40726642667635    5.20104195741958    1.83108109271313      H 
   -9.66376239248455    1.26287336010858    2.32731234538934      H 
   -9.59060609680864    7.03141777240107    2.79326526024919      H 
  -12.32908102874367    4.94790521293131    3.13605121399974      H 
$end
           -------------------------------------------------
          |                Final Singlepoint                |
           -------------------------------------------------

          ...................................................
          :                      SETUP                      :
          :.................................................:
          :  # basis functions                  76          :
          :  # atomic orbitals                  76          :
          :  # shells                           46          :
          :  # electrons                        80          :
          :  max. iterations                   250          :
          :  Hamiltonian                  GFN2-xTB          :
          :  restarted?                      false          :
          :  GBSA solvation                  false          :
          :  PC potential                    false          :
          :  electronic temp.          300.0000000     K    :
          :  accuracy                    1.0000000          :
          :  -> integral cutoff          0.2500000E+02      :
          :  -> integral neglect         0.1000000E-07      :
          :  -> SCF convergence          0.1000000E-05 Eh   :
          :  -> wf. convergence          0.1000000E-03 e    :
          :  Broyden damping             0.4000000          :
          ...................................................

 iter      E             dE          RMSdq      gap      omega  full diag
   1    -44.7427235 -0.447427E+02  0.108E-04    2.54       0.0  T
   2    -44.7427235 -0.932658E-10  0.575E-05    2.54     312.5  T
   3    -44.7427235 -0.142002E-09  0.366E-05    2.54     491.2  T

   *** convergence criteria satisfied after 3 iterations ***

         #    Occupation            Energy/Eh            Energy/eV
      -------------------------------------------------------------
         1        2.0000           -0.7102975             -19.3282
       ...           ...                  ...                  ...
        34        2.0000           -0.4348759             -11.8336
        35        2.0000           -0.4219948             -11.4831
        36        2.0000           -0.4211811             -11.4609
        37        2.0000           -0.4138229             -11.2607
        38        2.0000           -0.4108746             -11.1805
        39        2.0000           -0.3756456             -10.2218
        40        2.0000           -0.3540167              -9.6333 (HOMO)
        41                         -0.2606155              -7.0917 (LUMO)
        42                         -0.2062956              -5.6136
        43                         -0.1936896              -5.2706
        44                         -0.1322351              -3.5983
        45                         -0.0683162              -1.8590
       ...                                ...                  ...
        76                          0.7078472              19.2615
      -------------------------------------------------------------
                  HL-Gap            0.0934012 Eh            2.5416 eV
             Fermi-level           -0.3073161 Eh           -8.3625 eV

 SCC (total)                   0 d,  0 h,  0 min,  0.033 sec
 SCC setup                      ...        0 min,  0.000 sec (  0.754%)
 Dispersion                     ...        0 min,  0.000 sec (  0.845%)
 integral evaluation            ...        0 min,  0.011 sec ( 33.333%)
 zeroth order Hamiltonian       ...        0 min,  0.000 sec (  0.516%)
 iterations                     ...        0 min,  0.005 sec ( 14.898%)
 molecular gradient             ...        0 min,  0.016 sec ( 48.344%)
 printout                       ...        0 min,  0.000 sec (  1.156%)

         :::::::::::::::::::::::::::::::::::::::::::::::::::::
         ::                     SUMMARY                     ::
         :::::::::::::::::::::::::::::::::::::::::::::::::::::
         :: total energy             -44.073501512967 Eh    ::
         :: gradient norm              0.000740284846 Eh/a0 ::
         :: HOMO-LUMO gap              2.541577223611 eV    ::
         ::.................................................::
         :: SCC energy               -44.742723482036 Eh    ::
         :: -> isotropic ES            0.031584735058 Eh    ::
         :: -> anisotropic ES          0.006721380688 Eh    ::
         :: -> anisotropic XC          0.018147125236 Eh    ::
         :: -> dispersion             -0.026004763956 Eh    ::
         :: repulsion energy           0.669292888458 Eh    ::
         :: add. restraining           0.000000000000 Eh    ::
         :::::::::::::::::::::::::::::::::::::::::::::::::::::

           -------------------------------------------------
          |                Property Printout                |
           -------------------------------------------------

    * Orbital Energies and Occupations

         #    Occupation            Energy/Eh            Energy/eV
      -------------------------------------------------------------
         1        2.0000           -0.7102975             -19.3282
       ...           ...                  ...                  ...
        28        2.0000           -0.4709254             -12.8145
        29        2.0000           -0.4575839             -12.4515
        30        2.0000           -0.4561749             -12.4131
        31        2.0000           -0.4526356             -12.3168
        32        2.0000           -0.4519384             -12.2979
        33        2.0000           -0.4445632             -12.0972
        34        2.0000           -0.4348759             -11.8336
        35        2.0000           -0.4219948             -11.4831
        36        2.0000           -0.4211811             -11.4609
        37        2.0000           -0.4138229             -11.2607
        38        2.0000           -0.4108746             -11.1805
        39        2.0000           -0.3756456             -10.2218
        40        2.0000           -0.3540167              -9.6333 (HOMO)
        41                         -0.2606155              -7.0917 (LUMO)
        42                         -0.2062956              -5.6136
        43                         -0.1936896              -5.2706
        44                         -0.1322351              -3.5983
        45                         -0.0683162              -1.8590
        46                          0.0183864               0.5003
        47                          0.0386449               1.0516
        48                          0.0988079               2.6887
        49                          0.1068065               2.9064
        50                          0.1101337               2.9969
        51                          0.1237568               3.3676
       ...                                ...                  ...
        76                          0.7078472              19.2615
      -------------------------------------------------------------
                  HL-Gap            0.0934012 Eh            2.5416 eV
             Fermi-level           -0.3073161 Eh           -8.3625 eV

     #   Z        covCN         q      C6AA      α(0)
     1   6 C      2.921    -0.057    29.427     8.896
     2   6 C      2.861     0.132    25.105     8.213
     3   8 O      1.705    -0.275    18.562     5.817
     4   6 C      3.644     0.039    20.250     6.468
     5   6 C      2.922    -0.074    29.849     8.959
     6   6 C      2.969    -0.008    28.209     8.712
     7   6 C      2.866     0.128    25.190     8.227
     8   6 C      2.915    -0.068    29.704     8.937
     9   8 O      1.705    -0.273    18.527     5.811
    10   6 C      3.690     0.088    19.293     6.286
    11   6 C      3.751    -0.112    22.712     6.796
    12   6 C      2.906    -0.035    28.862     8.809
    13   6 C      2.898    -0.037    28.928     8.819
    14   6 C      2.895    -0.026    28.643     8.775
    15   6 C      2.841    -0.090    30.246     9.013
    16   1 H      0.926     0.050     2.324     2.384
    17   1 H      0.925     0.060     2.202     2.321
    18   1 H      0.924     0.038     2.476     2.461
    19   1 H      0.924     0.038     2.472     2.459
    20   1 H      0.926     0.044     2.399     2.422
    21   1 H      0.926     0.037     2.495     2.470
    22   1 H      0.923     0.028     2.616     2.530
    23   1 H      0.923     0.028     2.618     2.531
    24   1 H      0.925     0.056     2.242     2.341
    25   1 H      0.925     0.046     2.375     2.410
    26   1 H      0.925     0.055     2.253     2.347
    27   1 H      0.925     0.053     2.279     2.361
    28   1 H      0.925     0.034     2.536     2.490
    29   1 H      0.925     0.033     2.538     2.491
    30   1 H      0.926     0.035     2.513     2.479
    31   1 H      0.926     0.033     2.542     2.493

 Mol. C6AA /au·bohr⁶  :      10060.632211
 Mol. C8AA /au·bohr⁸  :     234773.393795
 Mol. α(0) /au        :        157.528800


Wiberg/Mayer (AO) data.
largest (>0.10) Wiberg bond orders for each atom
          total WBO             WBO to atom ...
     1  C   3.975        C    8 1.450    C    2 1.345    H   16 0.969
     2  C   3.935        C    5 1.392    C    1 1.345    O    3 1.048
     3  O   2.211        C    2 1.048    C    4 0.989
     4  C   3.949        O    3 0.989    H   17 0.980    H   18 0.977    H   19 0.977
     5  C   3.972        C    2 1.392    C    6 1.371    H   20 0.960
     6  C   3.986        C    5 1.371    C    7 1.288    C   12 1.124
     7  C   3.921        C    8 1.377    C    6 1.288    O    9 1.060
     8  C   3.987        C    1 1.450    C    7 1.377    H   21 0.965
     9  O   2.224        C    7 1.060    C   10 0.969
    10  C   3.950        C   11 1.015    O    9 0.969    H   23 0.968    H   22 0.968
    11  C   3.992        C   10 1.015    H   26 0.986    H   24 0.986    H   25 0.985
    12  C   3.990        C   13 1.736    C    6 1.124    H   27 0.959    C   15 0.127
    13  C   3.991        C   12 1.736    C   14 1.146    H   28 0.959
    14  C   3.991        C   15 1.856    C   13 1.146    H   29 0.964
    15  C   3.944        C   14 1.856    H   31 0.980    H   30 0.977    C   12 0.127
    16  H   0.997        C    1 0.969
    17  H   0.996        C    4 0.980
    18  H   0.998        C    4 0.977
    19  H   0.998        C    4 0.977
    20  H   0.997        C    5 0.960
    21  H   0.998        C    8 0.965
    22  H   0.998        C   10 0.968
    23  H   0.999        C   10 0.968
    24  H   0.997        C   11 0.986
    25  H   0.997        C   11 0.985
    26  H   0.997        C   11 0.986
    27  H   0.997        C   12 0.959
    28  H   0.999        C   13 0.959
    29  H   0.999        C   14 0.964
    30  H   0.999        C   15 0.977
    31  H   0.998        C   15 0.980

molecular dipole:
                 x           y           z       tot (Debye)
 q only:       -0.045      -0.247       0.020
   full:        0.022      -0.234       0.009       0.597
molecular quadrupole (traceless):
                xx          xy          yy          xz          yz          zz
 q only:       -6.970       0.157      11.933       0.527      -3.101      -4.963
  q+dip:       -6.223      -2.295      14.121       0.292      -2.304      -7.898
   full:       -8.151      -1.862      13.332       1.175      -2.485      -5.181

           -------------------------------------------------
          |                Geometry Summary                 |
           -------------------------------------------------

      molecular mass/u    :      204.2682000
   center of mass at/Å    :       -0.9422750       0.5804318       0.5438651
  moments of inertia/u·Å² :        0.1008954E+04   0.1089273E+04   0.2086169E+04
rotational constants/cm⁻¹ :        0.1670803E-01   0.1547603E-01   0.8080664E-02

 * 29 selected distances

     #   Z        #   Z                                     value/Å
     1   6 C      2   6 C                                 1.3929620
     2   6 C      3   8 O                                 1.3673820
     3   8 O      4   6 C                                 1.4054800
     2   6 C      5   6 C                                 1.3851646
     5   6 C      6   6 C                                 1.3958299
     6   6 C      7   6 C                                 1.4108382
     1   6 C      8   6 C                                 1.3808022
     7   6 C      8   6 C                                 1.3896548
     7   6 C      9   8 O                                 1.3638073
     9   8 O     10   6 C                                 1.4115449
    10   6 C     11   6 C                                 1.5209319 (max)
    12   6 C     13   6 C                                 1.3424178
    14   6 C     15   6 C                                 1.3318096
     1   6 C     16   1 H                                 1.0781127
     4   6 C     17   1 H                                 1.0890587
     4   6 C     18   1 H                                 1.0951586
     4   6 C     19   1 H                                 1.0952231
     5   6 C     20   1 H                                 1.0770739
     8   6 C     21   1 H                                 1.0783949
    10   6 C     22   1 H                                 1.0990832
    10   6 C     23   1 H                                 1.0990877
    11   6 C     24   1 H                                 1.0862968
    11   6 C     25   1 H                                 1.0859292
    11   6 C     26   1 H                                 1.0864871
    12   6 C     27   1 H                                 1.0815517
    13   6 C     28   1 H                                 1.0815188
    14   6 C     29   1 H                                 1.0825023
    15   6 C     30   1 H                                 1.0777368
    15   6 C     31   1 H                                 1.0760678 (min)

 * 3 distinct bonds (by element types)

   Z      Z             #   av. dist./Å        max./Å        min./Å
   1 H    6 C          16     1.0855802     1.0990877     1.0760678
   6 C    6 C           9     1.3944901     1.5209319     1.3318096
   6 C    8 O           4     1.3870535     1.4115449     1.3638073


optimized geometry written to: xtbopt.xyz


           -------------------------------------------------
          | TOTAL ENERGY              -44.073501512967 Eh   |
          | GRADIENT NORM               0.000740284846 Eh/α |
          | HOMO-LUMO GAP               2.541577223611 eV   |
           -------------------------------------------------

------------------------------------------------------------------------
 * finished run on 2021/05/19 at 11:01:10.157     
------------------------------------------------------------------------
 total:
 * wall-time:     0 d,  0 h,  0 min,  1.151 sec
 *  cpu-time:     0 d,  0 h,  0 min,  1.150 sec
 * ratio c/w:     0.999 speedup
 SCF:
 * wall-time:     0 d,  0 h,  0 min,  0.046 sec
 *  cpu-time:     0 d,  0 h,  0 min,  0.046 sec
 * ratio c/w:     1.000 speedup
 ANC optimizer:
 * wall-time:     0 d,  0 h,  0 min,  1.081 sec
 *  cpu-time:     0 d,  0 h,  0 min,  1.081 sec
 * ratio c/w:     1.000 speedup

