      -----------------------------------------------------------      
     |                   =====================                   |     
     |                           x T B                           |     
     |                   =====================                   |     
     |                         S. Grimme                         |     
     |          Mulliken Center for Theoretical Chemistry        |     
     |                    University of Bonn                     |     
     |                Version 6.2 RC2 (SAW190805)                |     
      -----------------------------------------------------------      

   This program is distributed in the hope that it will be useful,
   but WITHOUT ANY WARRANTY; without even the implied warranty of
   MERCHANTABILITY or FITNESS FOR A PARTICULAR PURPOSE.
   
   FOR NON-COMMERCIAL, ACADEMIA USE ONLY.
   
   Cite this work as:
   * S. Grimme, C. Bannwarth, P. Shushkov, J. Chem. Theory Comput., 2017,
     13, 1989-2009. DOI: 10.1021/acs.jctc.7b00118
   * C. Bannwarth, S. Ehlert and S. Grimme., J. Chem. Theory Comput., 2019,
     15, 1652-1671. DOI: 10.1021/acs.jctc.8b01176
   * P. Pracht, E. Caldeweyher, S. Ehlert, S. Grimme, ChemRxiv, 2019, preprint.
     DOI: 10.26434/chemrxiv.8326202.v1
   
   for DFT-D4:
   * E. Caldeweyher, C. Bannwarth and S. Grimme, J. Chem. Phys., 2017,
     147, 034112. DOI: 10.1063/1.4993215
   * E. Caldeweyher, S. Ehlert, A. Hansen, H. Neugebauer, S. Spicher,
     C. Bannwarth and S. Grimme, J. Chem. Phys., 2019, 150, 154122.
     DOI: 10.1063/1.5090222
   
   for sTDA-xTB:
   * S. Grimme and C. Bannwarth, J. Chem. Phys., 2016, 145, 054103.
     DOI: 10.1063/1.4959605
   
   in the mass-spec context:
   * V. Asgeirsson, C. Bauer and S. Grimme, Chem. Sci., 2017, 8, 4879.
     DOI: 10.1039/c7sc00601b
   
   for metadynamics refer to:
   * S. Grimme, J. Chem. Theory Comput., 2019, 155, 2847-2862
     DOI: 10.1021/acs.jctc.9b00143
   
   with help from (in alphabetical order)
   C. Bannwarth, F. Bohle, G. Brandenburg, E. Caldeweyher, M. Checinski,
   S. Dohm, S. Ehlert, S. Ehrlich, F. März, H. Neugebauer, J. Pisarek,
   P. Pracht, P. Shushkov, and S. Spicher.
   
 * started run on 2021/05/19 at 11:01:10.175     

           -------------------------------------------------
          |                Calculation Setup                |
           -------------------------------------------------

          program call               : /ihome/ghutchison/geoffh/xtb/xtb 890.xyz -opt
          hostname                   : smp-n83
          coordinate file            : 890.xyz
          omp threads                :                     1
          number of atoms            :                    22
          number of electrons        :                    66
          charge                     :                     0
          spin                       :                   0.0
          first test random number   :      0.89628711491097


########################################################################
# WARNING! Please study the warnings concerning your input carefully
#  - the use of '-opt' is discouraged, please use '--opt' next time
########################################################################

           ------------------------------------------------- 
          |                 G F N 2 - x T B                 |
          | Geometry, Frequencies, Noncovalent interactions |
          |            JCTC 2019 parametrisation            |
           ------------------------------------------------- 
             KAB for C  - Si     :                1.0500
             KAB for H  - Pd     :                0.9500
             k(s)              :                1.8500
             k(p)              :                2.2300
             k(d)              :                2.2300
             k(f)              :                2.0000
             kEN (H0ij)        :               -2.0000
             D4 a1             :                0.5200
             D4 a2             :                5.0000
             D4 s6             :                1.0000
             D4 s8             :                2.7000
             D4 s9             :                5.0000
             alphaj            :                2.0000

  Z AO/shell   Hii/eV     exponent
  1     Wed Apr 25 08:07:45 CEST 2018   EN: 2.200 GM2: 0.406  GM3: 0.0800  RAES: 1.40
     1s    -10.707211    1.230000
  6     Wed Apr 25 08:07:45 CEST 2018   EN: 2.550 GM2: 0.538  GM3: 0.1500  RAES: 3.00
     2s    -13.970922    2.096432
     2p    -10.063292    1.800000
  7     Wed Apr 25 08:07:45 CEST 2018   EN: 3.040 GM2: 0.461  GM3:-0.0640  RAES: 1.90
     2s    -16.686243    2.339881
     2p    -12.523956    2.014332
  8     Wed Apr 25 08:07:45 CEST 2018   EN: 3.440 GM2: 0.452  GM3:-0.0517  RAES: 1.80
     2s    -20.229985    2.439742
     2p    -15.503117    2.137023

           ------------------------------------------------- 
          |        Self-Consistent Charge Iterations        |
           ------------------------------------------------- 

          ...................................................
          :                      SETUP                      :
          :.................................................:
          :  # basis functions                  61          :
          :  # atomic orbitals                  61          :
          :  # shells                           35          :
          :  # electrons                        66          :
          :  max. iterations                   250          :
          :  Hamiltonian                  GFN2-xTB          :
          :  restarted?                      false          :
          :  GBSA solvation                  false          :
          :  PC potential                    false          :
          :  electronic temp.          300.0000000     K    :
          :  accuracy                    1.0000000          :
          :  -> integral cutoff          0.2500000E+02      :
          :  -> integral neglect         0.1000000E-07      :
          :  -> SCF convergence          0.1000000E-05 Eh   :
          :  -> wf. convergence          0.1000000E-03 e    :
          :  Broyden damping             0.4000000          :
          ...................................................

 iter      E             dE          RMSdq      gap      omega  full diag
   1    -37.5340440 -0.375340E+02  0.496E+00    2.75       0.0  T
   2    -37.6025419 -0.684979E-01  0.277E+00    2.58       1.0  T
   3    -37.6038932 -0.135136E-02  0.141E+00    2.81       1.0  T
   4    -37.6096613 -0.576802E-02  0.200E-01    2.68       1.0  T
   5    -37.6102151 -0.553795E-03  0.825E-02    2.72       1.0  T
   6    -37.6102454 -0.303075E-04  0.417E-02    2.71       1.0  T
   7    -37.6102604 -0.149899E-04  0.166E-02    2.71       1.3  T
   8    -37.6102611 -0.691038E-06  0.694E-03    2.71       3.1  T
   9    -37.6102617 -0.627367E-06  0.247E-03    2.71       8.6  T
  10    -37.6102617 -0.445980E-07  0.816E-04    2.71      26.1  T
  11    -37.6102617 -0.145315E-08  0.388E-04    2.71      55.0  T

   *** convergence criteria satisfied after 11 iterations ***

         #    Occupation            Energy/Eh            Energy/eV
      -------------------------------------------------------------
         1        2.0000           -0.7264125             -19.7667
       ...           ...                  ...                  ...
        27        2.0000           -0.4576444             -12.4531
        28        2.0000           -0.4561623             -12.4128
        29        2.0000           -0.4400593             -11.9746
        30        2.0000           -0.4363858             -11.8747
        31        2.0000           -0.4273840             -11.6297
        32        2.0000           -0.4194086             -11.4127
        33        2.0000           -0.4139844             -11.2651 (HOMO)
        34                         -0.3142862              -8.5522 (LUMO)
        35                         -0.2669416              -7.2638
        36                         -0.2176309              -5.9220
        37                         -0.1737631              -4.7283
        38                         -0.1002187              -2.7271
       ...                                ...                  ...
        61                          0.7326058              19.9352
      -------------------------------------------------------------
                  HL-Gap            0.0996982 Eh            2.7129 eV
             Fermi-level           -0.3641353 Eh           -9.9086 eV

 SCC (total)                   0 d,  0 h,  0 min,  0.032 sec
 SCC setup                      ...        0 min,  0.000 sec (  0.833%)
 Dispersion                     ...        0 min,  0.000 sec (  0.875%)
 integral evaluation            ...        0 min,  0.008 sec ( 23.899%)
 zeroth order Hamiltonian       ...        0 min,  0.000 sec (  0.466%)
 iterations                     ...        0 min,  0.012 sec ( 36.786%)
 molecular gradient             ...        0 min,  0.011 sec ( 35.860%)
 printout                       ...        0 min,  0.000 sec (  1.129%)

         :::::::::::::::::::::::::::::::::::::::::::::::::::::
         ::                     SUMMARY                     ::
         :::::::::::::::::::::::::::::::::::::::::::::::::::::
         :: total energy             -37.082210113461 Eh    ::
         :: gradient norm              0.066685972447 Eh/a0 ::
         :: HOMO-LUMO gap              2.712925230222 eV    ::
         ::.................................................::
         :: SCC energy               -37.610261726987 Eh    ::
         :: -> isotropic ES            0.059294735529 Eh    ::
         :: -> anisotropic ES          0.001563129192 Eh    ::
         :: -> anisotropic XC          0.012627258017 Eh    ::
         :: -> dispersion             -0.020910086859 Eh    ::
         :: repulsion energy           0.528021334625 Eh    ::
         :: add. restraining           0.000000000000 Eh    ::
         :::::::::::::::::::::::::::::::::::::::::::::::::::::

      ----------------------------------------------------------- 
     |                   =====================                   |
     |                        A N C O P T                        |
     |                   =====================                   |
     |               Approximate Normal Coordinate               |
     |                Rational Function Optimizer                |
      ----------------------------------------------------------- 

          ...................................................
          :                      SETUP                      :
          :.................................................:
          :   optimization level            normal          :
          :   max. optcycles                   200          :
          :   ANC micro-cycles                  20          :
          :   degrees of freedom                60          :
          :.................................................:
          :   RF solver                   davidson          :
          :   input Hessian                  false          :
          :   write xtbopt.log                true          :
          :   linear?                        false          :
          :   energy convergence         0.5000000E-05 Eh   :
          :   grad. convergence          0.1000000E-02 Eh/α :
          :   maximium RF displ.         2.0000000          :
          :   Hlow (freq-cutoff)         0.5000000E-02      :
          :   Hmax (freq-cutoff)         5.0000000          :
          :   S6 in model hess.         20.0000000          :
          ...................................................

generating ANC from model Hessian ...
Using Lindh-Hessian (1995)
 Shifting diagonal of input Hessian by   3.134426591281636E-003
 Lowest  eigenvalues of input Hessian
   -0.000000   -0.000000    0.000000    0.000000    0.000000    0.000000
    0.005000    0.005955    0.010534    0.011826    0.012147    0.018591
    0.022017    0.023435    0.027030    0.044176    0.044790    0.052686
 Highest eigenvalues
    1.847828    1.984233    2.089611    2.090303    2.375454    2.488409
 

........................................................................
.............................. CYCLE    1 ..............................
........................................................................
   1    -37.6102617 -0.376103E+02  0.632E-05    2.71       0.0  T
   2    -37.6102617 -0.522249E-11  0.376E-05    2.71     566.5  T
   3    -37.6102617 -0.149214E-12  0.152E-05    2.71    1402.9  T
     SCC iter.                  ...        0 min,  0.004 sec
     gradient                   ...        0 min,  0.011 sec
 * total energy  :   -37.0822101 Eh     change        0.3117828E-07 Eh
   gradient norm :     0.0666905 Eh/α   predicted     0.0000000E+00 (-100.00%)
   displ. norm   :     0.1631186 α      lambda       -0.6013860E-02
   maximum displ.:     0.1261836 α      in ANC's #18, #39, #37, ...

........................................................................
.............................. CYCLE    2 ..............................
........................................................................
   1    -37.6215057 -0.376215E+02  0.213E-01    2.76       0.0  T
   2    -37.6216555 -0.149791E-03  0.134E-01    2.76       1.0  T
   3    -37.6216558 -0.332466E-06  0.652E-02    2.76       1.0  T
   4    -37.6216656 -0.981484E-05  0.225E-02    2.76       1.0  T
   5    -37.6216764 -0.107199E-04  0.467E-03    2.76       4.6  T
   6    -37.6216765 -0.130587E-06  0.224E-03    2.76       9.5  T
   7    -37.6216765 -0.151438E-07  0.326E-04    2.76      65.4  T
     SCC iter.                  ...        0 min,  0.007 sec
     gradient                   ...        0 min,  0.011 sec
 * total energy  :   -37.0864565 Eh     change       -0.4246426E-02 Eh
   gradient norm :     0.0317172 Eh/α   predicted    -0.3086946E-02 ( -27.30%)
   displ. norm   :     0.1372736 α      lambda       -0.2204579E-02
   maximum displ.:     0.0953735 α      in ANC's #18, #23, #37, ...

........................................................................
.............................. CYCLE    3 ..............................
........................................................................
   1    -37.6252800 -0.376253E+02  0.207E-01    2.78       0.0  T
   2    -37.6253982 -0.118186E-03  0.128E-01    2.79       1.0  T
   3    -37.6253979  0.279039E-06  0.582E-02    2.78       1.0  T
   4    -37.6254042 -0.628930E-05  0.161E-02    2.79       1.3  T
   5    -37.6254099 -0.568319E-05  0.454E-03    2.78       4.7  T
   6    -37.6254100 -0.114797E-06  0.208E-03    2.78      10.3  T
     SCC iter.                  ...        0 min,  0.006 sec
     gradient                   ...        0 min,  0.010 sec
 * total energy  :   -37.0877088 Eh     change       -0.1252318E-02 Eh
   gradient norm :     0.0094958 Eh/α   predicted    -0.1123075E-02 ( -10.32%)
   displ. norm   :     0.0356462 α      lambda       -0.1552413E-03
   maximum displ.:     0.0157496 α      in ANC's #18, #23, #28, ...

........................................................................
.............................. CYCLE    4 ..............................
........................................................................
   1    -37.6246773 -0.376247E+02  0.565E-02    2.78       0.0  T
   2    -37.6246840 -0.675847E-05  0.345E-02    2.78       1.0  T
   3    -37.6246841 -0.113498E-06  0.135E-02    2.78       1.6  T
   4    -37.6246845 -0.344019E-06  0.251E-03    2.78       8.5  T
   5    -37.6246846 -0.721800E-07  0.115E-03    2.78      18.5  T
     SCC iter.                  ...        0 min,  0.005 sec
     gradient                   ...        0 min,  0.011 sec
 * total energy  :   -37.0878097 Eh     change       -0.1008950E-03 Eh
   gradient norm :     0.0040725 Eh/α   predicted    -0.7772039E-04 ( -22.97%)
   displ. norm   :     0.0204792 α      lambda       -0.3549406E-04
   maximum displ.:     0.0087995 α      in ANC's #1, #6, #10, ...

........................................................................
.............................. CYCLE    5 ..............................
........................................................................
   1    -37.6244443 -0.376244E+02  0.258E-02    2.78       0.0  T
   2    -37.6244453 -0.991694E-06  0.158E-02    2.78       1.4  T
   3    -37.6244451  0.169626E-06  0.549E-03    2.78       3.9  T
   4    -37.6244453 -0.236737E-06  0.202E-03    2.78      10.6  T
   5    -37.6244454 -0.875843E-07  0.664E-04    2.78      32.1  T
     SCC iter.                  ...        0 min,  0.005 sec
     gradient                   ...        0 min,  0.010 sec
 * total energy  :   -37.0878304 Eh     change       -0.2071064E-04 Eh
   gradient norm :     0.0012646 Eh/α   predicted    -0.1776408E-04 ( -14.23%)
   displ. norm   :     0.0307301 α      lambda        0.1801067E-04
   maximum displ.:     0.0132254 α      in ANC's #1, #6, #10, ...

........................................................................
.............................. CYCLE    6 ..............................
........................................................................
   1    -37.6240071 -0.376240E+02  0.386E-02    2.77       0.0  T
   2    -37.6240094 -0.224167E-05  0.237E-02    2.77       1.0  T
   3    -37.6240088  0.553347E-06  0.881E-03    2.77       2.4  T
   4    -37.6240096 -0.742083E-06  0.316E-03    2.77       6.7  T
   5    -37.6240098 -0.217675E-06  0.991E-04    2.77      21.5  T
   6    -37.6240098 -0.121772E-08  0.310E-04    2.77      68.9  T
     SCC iter.                  ...        0 min,  0.006 sec
     gradient                   ...        0 min,  0.011 sec
 * total energy  :   -37.0878060 Eh     change        0.2440511E-04 Eh
   gradient norm :     0.0047603 Eh/α   predicted     0.9009114E-05 ( -63.09%)
   displ. norm   :     0.0151629 α      lambda       -0.3611414E-04
   maximum displ.:     0.0061903 α      in ANC's #23, #10, #28, ...

........................................................................
.............................. CYCLE    7 ..............................
........................................................................
   1    -37.6243899 -0.376244E+02  0.223E-02    2.77       0.0  T
   2    -37.6243908 -0.950255E-06  0.137E-02    2.77       1.6  T
   3    -37.6243907  0.882433E-07  0.539E-03    2.77       4.0  T
   4    -37.6243908 -0.126382E-06  0.182E-03    2.77      11.7  T
   5    -37.6243909 -0.773461E-07  0.520E-04    2.77      41.0  T
     SCC iter.                  ...        0 min,  0.005 sec
     gradient                   ...        0 min,  0.011 sec
 * total energy  :   -37.0878303 Eh     change       -0.2430734E-04 Eh
   gradient norm :     0.0017592 Eh/α   predicted    -0.1806214E-04 ( -25.69%)
   displ. norm   :     0.0113565 α      lambda       -0.7419859E-05
   maximum displ.:     0.0049843 α      in ANC's #23, #5, #39, ...

........................................................................
.............................. CYCLE    8 ..............................
........................................................................
   1    -37.6246673 -0.376247E+02  0.170E-02    2.78       0.0  T
   2    -37.6246679 -0.581853E-06  0.105E-02    2.78       2.0  T
   3    -37.6246678  0.629401E-07  0.431E-03    2.78       4.9  T
   4    -37.6246679 -0.844734E-07  0.149E-03    2.78      14.3  T
   5    -37.6246679 -0.526839E-07  0.385E-04    2.78      55.4  T
   6    -37.6246679 -0.196493E-09  0.135E-04    2.78     158.3  T
     SCC iter.                  ...        0 min,  0.006 sec
     gradient                   ...        0 min,  0.011 sec
 * total energy  :   -37.0878337 Eh     change       -0.3367287E-05 Eh
   gradient norm :     0.0007910 Eh/α   predicted    -0.3711484E-05 (  10.22%)
   displ. norm   :     0.0064065 α      lambda       -0.1284155E-05
   maximum displ.:     0.0037948 α      in ANC's #1, #6, #10, ...

   *** GEOMETRY OPTIMIZATION CONVERGED AFTER 8 ITERATIONS ***

------------------------------------------------------------------------
 total energy gain   :        -0.0056236 Eh       -3.5289 kcal/mol
 total RMSD          :         0.0710064 a0        0.0376 Å
 total power (kW/mol):        -1.8455913 (step)  -73.9290 (real)
------------------------------------------------------------------------

 ANCopt (total)                0 d,  0 h,  0 min,  0.200 sec
 optimizer setup                ...        0 min,  0.000 sec (  0.078%)
 model hessian                  ...        0 min,  0.004 sec (  2.210%)
 ANC generation                 ...        0 min,  0.001 sec (  0.331%)
 coordinate transformation      ...        0 min,  0.000 sec (  0.064%)
 single point calculation       ...        0 min,  0.192 sec ( 96.073%)
 optimization log               ...        0 min,  0.001 sec (  0.398%)
 hessian update                 ...        0 min,  0.000 sec (  0.049%)
 rational function              ...        0 min,  0.001 sec (  0.502%)

================
 final structure:
================
$coord
   -5.03126476734153   -1.31496400624754    0.08200461059643      C 
   -2.78208384113572   -2.67659351542930    0.03270783426649      C 
   -0.55383565082646   -1.32743922037548   -0.03716147261845      C 
   -0.55367190768770    1.31373515065372   -0.05961226757522      C 
    2.11287871075540    2.18065924378369   -0.14558904911589      C 
    2.94730034621724    4.29833512013466   -0.19296603184306      O 
    3.55531000592792   -0.00823901324587   -0.18437562758112      N 
    2.11264410925851   -2.19600505896692   -0.10850655508904      C 
    2.94679598215870   -4.31428269071307   -0.12005587282924      O 
    6.29063231595324   -0.00853385393593   -0.21133179107326      C 
    7.36254403135006    0.00304764887615    2.46265001460076      C 
   -2.78172466781710    2.66419952331092   -0.01278379094171      C 
   -5.03109350959449    1.30391583057911    0.05966674217577      C 
   -6.80777487902390   -2.31664055027602    0.13794852104454      H 
   -2.76761562424980   -4.71493557361655    0.04756605525769      H 
    6.89655644165054    1.67802392005539   -1.23712334972156      H 
    6.89718392642188   -1.70379205597645   -1.22234932879422      H 
    6.73423583119328    1.67968703496951    3.47142894872628      H 
    9.41378419292668    0.00552969712971    2.38867851749182      H 
    6.73866145742079   -1.66754463040687    3.48407164898397      H 
   -2.76695520819881    4.70249592114460   -0.03266214551876      H 
   -6.80747032759486    2.30663782293646    0.09848950257151      H 
$end
           -------------------------------------------------
          |                Final Singlepoint                |
           -------------------------------------------------

          ...................................................
          :                      SETUP                      :
          :.................................................:
          :  # basis functions                  61          :
          :  # atomic orbitals                  61          :
          :  # shells                           35          :
          :  # electrons                        66          :
          :  max. iterations                   250          :
          :  Hamiltonian                  GFN2-xTB          :
          :  restarted?                      false          :
          :  GBSA solvation                  false          :
          :  PC potential                    false          :
          :  electronic temp.          300.0000000     K    :
          :  accuracy                    1.0000000          :
          :  -> integral cutoff          0.2500000E+02      :
          :  -> integral neglect         0.1000000E-07      :
          :  -> SCF convergence          0.1000000E-05 Eh   :
          :  -> wf. convergence          0.1000000E-03 e    :
          :  Broyden damping             0.4000000          :
          ...................................................

 iter      E             dE          RMSdq      gap      omega  full diag
   1    -37.6246679 -0.376247E+02  0.339E-05    2.78       0.0  T
   2    -37.6246679 -0.328271E-11  0.176E-05    2.78    1212.5  T
   3    -37.6246679 -0.177636E-12  0.102E-05    2.78    2092.7  T

   *** convergence criteria satisfied after 3 iterations ***

         #    Occupation            Energy/Eh            Energy/eV
      -------------------------------------------------------------
         1        2.0000           -0.7280042             -19.8100
       ...           ...                  ...                  ...
        27        2.0000           -0.4581345             -12.4665
        28        2.0000           -0.4537452             -12.3470
        29        2.0000           -0.4407776             -11.9942
        30        2.0000           -0.4383487             -11.9281
        31        2.0000           -0.4253927             -11.5755
        32        2.0000           -0.4221313             -11.4868
        33        2.0000           -0.4141983             -11.2709 (HOMO)
        34                         -0.3121878              -8.4951 (LUMO)
        35                         -0.2665322              -7.2527
        36                         -0.2153908              -5.8611
        37                         -0.1760583              -4.7908
        38                         -0.1017540              -2.7689
       ...                                ...                  ...
        61                          0.7397618              20.1299
      -------------------------------------------------------------
                  HL-Gap            0.1020105 Eh            2.7758 eV
             Fermi-level           -0.3631930 Eh           -9.8830 eV

 SCC (total)                   0 d,  0 h,  0 min,  0.023 sec
 SCC setup                      ...        0 min,  0.000 sec (  0.772%)
 Dispersion                     ...        0 min,  0.000 sec (  0.844%)
 integral evaluation            ...        0 min,  0.007 sec ( 31.438%)
 zeroth order Hamiltonian       ...        0 min,  0.000 sec (  0.581%)
 iterations                     ...        0 min,  0.004 sec ( 15.690%)
 molecular gradient             ...        0 min,  0.011 sec ( 48.931%)
 printout                       ...        0 min,  0.000 sec (  1.481%)

         :::::::::::::::::::::::::::::::::::::::::::::::::::::
         ::                     SUMMARY                     ::
         :::::::::::::::::::::::::::::::::::::::::::::::::::::
         :: total energy             -37.087833697352 Eh    ::
         :: gradient norm              0.000791236751 Eh/a0 ::
         :: HOMO-LUMO gap              2.775847910765 eV    ::
         ::.................................................::
         :: SCC energy               -37.624667949817 Eh    ::
         :: -> isotropic ES            0.057084737785 Eh    ::
         :: -> anisotropic ES          0.001277496583 Eh    ::
         :: -> anisotropic XC          0.012493547302 Eh    ::
         :: -> dispersion             -0.020872310714 Eh    ::
         :: repulsion energy           0.536803626171 Eh    ::
         :: add. restraining           0.000000000000 Eh    ::
         :::::::::::::::::::::::::::::::::::::::::::::::::::::

           -------------------------------------------------
          |                Property Printout                |
           -------------------------------------------------

    * Orbital Energies and Occupations

         #    Occupation            Energy/Eh            Energy/eV
      -------------------------------------------------------------
         1        2.0000           -0.7280042             -19.8100
       ...           ...                  ...                  ...
        21        2.0000           -0.5115569             -13.9202
        22        2.0000           -0.5088534             -13.8466
        23        2.0000           -0.5085689             -13.8389
        24        2.0000           -0.4973519             -13.5336
        25        2.0000           -0.4742689             -12.9055
        26        2.0000           -0.4716818             -12.8351
        27        2.0000           -0.4581345             -12.4665
        28        2.0000           -0.4537452             -12.3470
        29        2.0000           -0.4407776             -11.9942
        30        2.0000           -0.4383487             -11.9281
        31        2.0000           -0.4253927             -11.5755
        32        2.0000           -0.4221313             -11.4868
        33        2.0000           -0.4141983             -11.2709 (HOMO)
        34                         -0.3121878              -8.4951 (LUMO)
        35                         -0.2665322              -7.2527
        36                         -0.2153908              -5.8611
        37                         -0.1760583              -4.7908
        38                         -0.1017540              -2.7689
        39                         -0.0128239              -0.3490
        40                          0.0675994               1.8395
        41                          0.0995356               2.7085
        42                          0.1122256               3.0538
        43                          0.1210364               3.2936
        44                          0.1356097               3.6901
       ...                                ...                  ...
        61                          0.7397618              20.1299
      -------------------------------------------------------------
                  HL-Gap            0.1020105 Eh            2.7758 eV
             Fermi-level           -0.3631930 Eh           -9.8830 eV

     #   Z        covCN         q      C6AA      α(0)
     1   6 C      2.923    -0.021    28.522     8.758
     2   6 C      2.913    -0.013    28.333     8.728
     3   6 C      3.044    -0.024    28.551     8.764
     4   6 C      3.044    -0.024    28.551     8.764
     5   6 C      2.832     0.276    22.335     7.744
     6   8 O      0.857    -0.373    21.144     6.165
     7   7 N      2.790    -0.109    23.380     7.181
     8   6 C      2.832     0.276    22.335     7.744
     9   8 O      0.857    -0.373    21.143     6.165
    10   6 C      3.739     0.011    20.463     6.454
    11   6 C      3.752    -0.110    22.657     6.788
    12   6 C      2.913    -0.013    28.333     8.728
    13   6 C      2.923    -0.021    28.522     8.758
    14   1 H      0.926     0.052     2.294     2.368
    15   1 H      0.926     0.062     2.170     2.304
    16   1 H      0.924     0.066     2.134     2.284
    17   1 H      0.924     0.066     2.136     2.285
    18   1 H      0.925     0.051     2.309     2.376
    19   1 H      0.925     0.052     2.296     2.370
    20   1 H      0.925     0.051     2.307     2.375
    21   1 H      0.926     0.062     2.170     2.304
    22   1 H      0.926     0.052     2.294     2.368

 Mol. C6AA /au·bohr⁶  :       6093.272090
 Mol. C8AA /au·bohr⁸  :     146628.392907
 Mol. α(0) /au        :        121.777587


Wiberg/Mayer (AO) data.
largest (>0.10) Wiberg bond orders for each atom
          total WBO             WBO to atom ...
     1  C   3.990        C   13 1.458    C    2 1.411    H   14 0.970    C    4 0.103
     2  C   3.988        C    3 1.436    C    1 1.411    H   15 0.966
     3  C   3.988        C    2 1.436    C    4 1.328    C    8 0.990    C   13 0.103
     4  C   3.988        C   12 1.436    C    3 1.328    C    5 0.990    C    1 0.103
     5  C   3.946        O    6 1.746    N    7 1.115    C    4 0.990
     6  O   2.074        C    5 1.746    N    7 0.133
     7  N   3.560        C    5 1.115    C    8 1.115    C   10 0.972    O    6 0.133    O    9 0.133
     8  C   3.946        O    9 1.747    N    7 1.115    C    3 0.990
     9  O   2.074        C    8 1.747    N    7 0.133
    10  C   3.958        C   11 1.008    N    7 0.972    H   16 0.969    H   17 0.969
    11  C   3.991        C   10 1.008    H   18 0.987    H   20 0.987    H   19 0.983
    12  C   3.988        C    4 1.436    C   13 1.411    H   21 0.966
    13  C   3.990        C    1 1.458    C   12 1.411    H   22 0.970    C    3 0.103
    14  H   0.997        C    1 0.970
    15  H   0.996        C    2 0.966
    16  H   0.995        C   10 0.969
    17  H   0.995        C   10 0.969
    18  H   0.997        C   11 0.987
    19  H   0.997        C   11 0.983
    20  H   0.997        C   11 0.987
    21  H   0.996        C   12 0.966
    22  H   0.997        C   13 0.970

molecular dipole:
                 x           y           z       tot (Debye)
 q only:       -0.823       0.001       0.123
   full:       -0.937       0.001       0.103       2.396
molecular quadrupole (traceless):
                xx          xy          yy          xz          yz          zz
 q only:       12.349       0.009     -12.605       0.949       0.103       0.256
  q+dip:       13.733       0.007     -12.546       0.219       0.096      -1.187
   full:       11.998       0.009     -14.938       0.564       0.149       2.940

           -------------------------------------------------
          |                Geometry Summary                 |
           -------------------------------------------------

      molecular mass/u    :      175.1866000
   center of mass at/Å    :        0.5301909      -0.0033158       0.0736101
  moments of inertia/u·Å² :        0.3139163E+03   0.7853707E+03   0.1048182E+04
rotational constants/cm⁻¹ :        0.5370104E-01   0.2146455E-01   0.1608273E-01

 * 21 selected distances

     #   Z        #   Z                                     value/Å
     1   6 C      2   6 C                                 1.3915732
     2   6 C      3   6 C                                 1.3789296
     3   6 C      4   6 C                                 1.3976999
     5   6 C      6   8 O                                 1.2047421
     5   6 C      7   7 N                                 1.3873518
     7   7 N      8   6 C                                 1.3873491
     8   6 C      9   8 O                                 1.2047407
     7   7 N     10   6 C                                 1.4475407
    10   6 C     11   6 C                                 1.5244813 (max)
     4   6 C     12   6 C                                 1.3789273
     1   6 C     13   6 C                                 1.3859021
    12   6 C     13   6 C                                 1.3915733
     1   6 C     14   1 H                                 1.0796349
     2   6 C     15   1 H                                 1.0787001
    10   6 C     16   1 H                                 1.0927055
    10   6 C     17   1 H                                 1.0927173
    11   6 C     18   1 H                                 1.0875237
    11   6 C     19   1 H                                 1.0861760
    11   6 C     20   1 H                                 1.0875089
    12   6 C     21   1 H                                 1.0786997 (min)
    13   6 C     22   1 H                                 1.0796349

 * 4 distinct bonds (by element types)

   Z      Z             #   av. dist./Å        max./Å        min./Å
   1 H    6 C           9     1.0848112     1.0927173     1.0786997
   6 C    6 C           7     1.4070124     1.5244813     1.3789273
   6 C    7 N           3     1.4074139     1.4475407     1.3873491
   6 C    8 O           2     1.2047414     1.2047421     1.2047407


optimized geometry written to: xtbopt.xyz


           -------------------------------------------------
          | TOTAL ENERGY              -37.087833697352 Eh   |
          | GRADIENT NORM               0.000791236751 Eh/α |
          | HOMO-LUMO GAP               2.775847910765 eV   |
           -------------------------------------------------

------------------------------------------------------------------------
 * finished run on 2021/05/19 at 11:01:10.450     
------------------------------------------------------------------------
 total:
 * wall-time:     0 d,  0 h,  0 min,  0.275 sec
 *  cpu-time:     0 d,  0 h,  0 min,  0.274 sec
 * ratio c/w:     0.997 speedup
 SCF:
 * wall-time:     0 d,  0 h,  0 min,  0.032 sec
 *  cpu-time:     0 d,  0 h,  0 min,  0.032 sec
 * ratio c/w:     1.000 speedup
 ANC optimizer:
 * wall-time:     0 d,  0 h,  0 min,  0.223 sec
 *  cpu-time:     0 d,  0 h,  0 min,  0.223 sec
 * ratio c/w:     1.000 speedup

