      -----------------------------------------------------------      
     |                   =====================                   |     
     |                           x T B                           |     
     |                   =====================                   |     
     |                         S. Grimme                         |     
     |          Mulliken Center for Theoretical Chemistry        |     
     |                    University of Bonn                     |     
     |                Version 6.2 RC2 (SAW190805)                |     
      -----------------------------------------------------------      

   This program is distributed in the hope that it will be useful,
   but WITHOUT ANY WARRANTY; without even the implied warranty of
   MERCHANTABILITY or FITNESS FOR A PARTICULAR PURPOSE.
   
   FOR NON-COMMERCIAL, ACADEMIA USE ONLY.
   
   Cite this work as:
   * S. Grimme, C. Bannwarth, P. Shushkov, J. Chem. Theory Comput., 2017,
     13, 1989-2009. DOI: 10.1021/acs.jctc.7b00118
   * C. Bannwarth, S. Ehlert and S. Grimme., J. Chem. Theory Comput., 2019,
     15, 1652-1671. DOI: 10.1021/acs.jctc.8b01176
   * P. Pracht, E. Caldeweyher, S. Ehlert, S. Grimme, ChemRxiv, 2019, preprint.
     DOI: 10.26434/chemrxiv.8326202.v1
   
   for DFT-D4:
   * E. Caldeweyher, C. Bannwarth and S. Grimme, J. Chem. Phys., 2017,
     147, 034112. DOI: 10.1063/1.4993215
   * E. Caldeweyher, S. Ehlert, A. Hansen, H. Neugebauer, S. Spicher,
     C. Bannwarth and S. Grimme, J. Chem. Phys., 2019, 150, 154122.
     DOI: 10.1063/1.5090222
   
   for sTDA-xTB:
   * S. Grimme and C. Bannwarth, J. Chem. Phys., 2016, 145, 054103.
     DOI: 10.1063/1.4959605
   
   in the mass-spec context:
   * V. Asgeirsson, C. Bauer and S. Grimme, Chem. Sci., 2017, 8, 4879.
     DOI: 10.1039/c7sc00601b
   
   for metadynamics refer to:
   * S. Grimme, J. Chem. Theory Comput., 2019, 155, 2847-2862
     DOI: 10.1021/acs.jctc.9b00143
   
   with help from (in alphabetical order)
   C. Bannwarth, F. Bohle, G. Brandenburg, E. Caldeweyher, M. Checinski,
   S. Dohm, S. Ehlert, S. Ehrlich, F. März, H. Neugebauer, J. Pisarek,
   P. Pracht, P. Shushkov, and S. Spicher.
   
 * started run on 2021/05/19 at 11:01:11.648     

           -------------------------------------------------
          |                Calculation Setup                |
           -------------------------------------------------

          program call               : /ihome/ghutchison/geoffh/xtb/xtb 894.xyz -opt
          hostname                   : smp-n83
          coordinate file            : 894.xyz
          omp threads                :                     1
          number of atoms            :                    16
          number of electrons        :                    56
          charge                     :                     0
          spin                       :                   0.0
          first test random number   :      0.02442467588750


########################################################################
# WARNING! Please study the warnings concerning your input carefully
#  - the use of '-opt' is discouraged, please use '--opt' next time
########################################################################

           ------------------------------------------------- 
          |                 G F N 2 - x T B                 |
          | Geometry, Frequencies, Noncovalent interactions |
          |            JCTC 2019 parametrisation            |
           ------------------------------------------------- 
             KAB for C  - Si     :                1.0500
             KAB for H  - Pd     :                0.9500
             k(s)              :                1.8500
             k(p)              :                2.2300
             k(d)              :                2.2300
             k(f)              :                2.0000
             kEN (H0ij)        :               -2.0000
             D4 a1             :                0.5200
             D4 a2             :                5.0000
             D4 s6             :                1.0000
             D4 s8             :                2.7000
             D4 s9             :                5.0000
             alphaj            :                2.0000

  Z AO/shell   Hii/eV     exponent
  1     Wed Apr 25 08:07:45 CEST 2018   EN: 2.200 GM2: 0.406  GM3: 0.0800  RAES: 1.40
     1s    -10.707211    1.230000
  6     Wed Apr 25 08:07:45 CEST 2018   EN: 2.550 GM2: 0.538  GM3: 0.1500  RAES: 3.00
     2s    -13.970922    2.096432
     2p    -10.063292    1.800000
  7     Wed Apr 25 08:07:45 CEST 2018   EN: 3.040 GM2: 0.461  GM3:-0.0640  RAES: 1.90
     2s    -16.686243    2.339881
     2p    -12.523956    2.014332
  8     Wed Apr 25 08:07:45 CEST 2018   EN: 3.440 GM2: 0.452  GM3:-0.0517  RAES: 1.80
     2s    -20.229985    2.439742
     2p    -15.503117    2.137023

           ------------------------------------------------- 
          |        Self-Consistent Charge Iterations        |
           ------------------------------------------------- 

          ...................................................
          :                      SETUP                      :
          :.................................................:
          :  # basis functions                  52          :
          :  # atomic orbitals                  52          :
          :  # shells                           28          :
          :  # electrons                        56          :
          :  max. iterations                   250          :
          :  Hamiltonian                  GFN2-xTB          :
          :  restarted?                      false          :
          :  GBSA solvation                  false          :
          :  PC potential                    false          :
          :  electronic temp.          300.0000000     K    :
          :  accuracy                    1.0000000          :
          :  -> integral cutoff          0.2500000E+02      :
          :  -> integral neglect         0.1000000E-07      :
          :  -> SCF convergence          0.1000000E-05 Eh   :
          :  -> wf. convergence          0.1000000E-03 e    :
          :  Broyden damping             0.4000000          :
          ...................................................

 iter      E             dE          RMSdq      gap      omega  full diag
   1    -31.5522856 -0.315523E+02  0.570E+00    1.22       0.0  T
   2    -31.5813439 -0.290583E-01  0.339E+00    1.13       1.0  T
   3    -31.5686387  0.127052E-01  0.192E+00    1.08       1.0  T
   4    -31.5867377 -0.180990E-01  0.562E-01    1.10       1.0  T
   5    -31.5911020 -0.436432E-02  0.147E-01    1.13       1.0  T
   6    -31.5912456 -0.143556E-03  0.594E-02    1.11       1.0  T
   7    -31.5912920 -0.464067E-04  0.263E-02    1.12       1.0  T
   8    -31.5912961 -0.415039E-05  0.970E-03    1.12       2.6  T
   9    -31.5912965 -0.405693E-06  0.418E-03    1.12       6.0  T
  10    -31.5912965 -0.124422E-07  0.154E-03    1.12      16.2  T
  11    -31.5912966 -0.843418E-08  0.116E-03    1.12      21.6  T
  12    -31.5912966 -0.134115E-07  0.186E-04    1.12     134.2  T
  13    -31.5912966 -0.291774E-09  0.891E-05    1.12     280.5  T

   *** convergence criteria satisfied after 13 iterations ***

         #    Occupation            Energy/Eh            Energy/eV
      -------------------------------------------------------------
         1        2.0000           -0.7285277             -19.8242
       ...           ...                  ...                  ...
        22        2.0000           -0.4743890             -12.9088
        23        2.0000           -0.4518998             -12.2968
        24        2.0000           -0.4502817             -12.2528
        25        2.0000           -0.4457570             -12.1297
        26        2.0000           -0.4196534             -11.4194
        27        2.0000           -0.4172154             -11.3530
        28        2.0000           -0.4104077             -11.1678 (HOMO)
        29                         -0.3692929             -10.0490 (LUMO)
        30                         -0.3156317              -8.5888
        31                         -0.2390228              -6.5041
        32                         -0.2099415              -5.7128
        33                         -0.1444054              -3.9295
       ...                                ...                  ...
        52                          0.7855297              21.3754
      -------------------------------------------------------------
                  HL-Gap            0.0411148 Eh            1.1188 eV
             Fermi-level           -0.3898499 Eh          -10.6084 eV

 SCC (total)                   0 d,  0 h,  0 min,  0.025 sec
 SCC setup                      ...        0 min,  0.000 sec (  1.021%)
 Dispersion                     ...        0 min,  0.000 sec (  0.989%)
 integral evaluation            ...        0 min,  0.006 sec ( 22.006%)
 zeroth order Hamiltonian       ...        0 min,  0.000 sec (  0.464%)
 iterations                     ...        0 min,  0.010 sec ( 40.325%)
 molecular gradient             ...        0 min,  0.008 sec ( 33.667%)
 printout                       ...        0 min,  0.000 sec (  1.308%)

         :::::::::::::::::::::::::::::::::::::::::::::::::::::
         ::                     SUMMARY                     ::
         :::::::::::::::::::::::::::::::::::::::::::::::::::::
         :: total energy             -31.100883184487 Eh    ::
         :: gradient norm              0.116844397888 Eh/a0 ::
         :: HOMO-LUMO gap              1.118789486764 eV    ::
         ::.................................................::
         :: SCC energy               -31.591296567495 Eh    ::
         :: -> isotropic ES            0.039231071282 Eh    ::
         :: -> anisotropic ES          0.003560911117 Eh    ::
         :: -> anisotropic XC          0.022593474248 Eh    ::
         :: -> dispersion             -0.015828881217 Eh    ::
         :: repulsion energy           0.490405594346 Eh    ::
         :: add. restraining           0.000000000000 Eh    ::
         :::::::::::::::::::::::::::::::::::::::::::::::::::::

      ----------------------------------------------------------- 
     |                   =====================                   |
     |                        A N C O P T                        |
     |                   =====================                   |
     |               Approximate Normal Coordinate               |
     |                Rational Function Optimizer                |
      ----------------------------------------------------------- 

          ...................................................
          :                      SETUP                      :
          :.................................................:
          :   optimization level            normal          :
          :   max. optcycles                   200          :
          :   ANC micro-cycles                  20          :
          :   degrees of freedom                42          :
          :.................................................:
          :   RF solver                   davidson          :
          :   input Hessian                  false          :
          :   write xtbopt.log                true          :
          :   linear?                        false          :
          :   energy convergence         0.5000000E-05 Eh   :
          :   grad. convergence          0.1000000E-02 Eh/α :
          :   maximium RF displ.         2.0000000          :
          :   Hlow (freq-cutoff)         0.5000000E-02      :
          :   Hmax (freq-cutoff)         5.0000000          :
          :   S6 in model hess.         20.0000000          :
          ...................................................

generating ANC from model Hessian ...
Using Lindh-Hessian (1995)
 Shifting diagonal of input Hessian by   0.000000000000000E+000
 Lowest  eigenvalues of input Hessian
   -0.000000   -0.000000   -0.000000    0.000000    0.000000    0.000000
    0.006425    0.008516    0.012912    0.026744    0.033416    0.047111
    0.072162    0.073185    0.073269    0.074685    0.092786    0.110964
 Highest eigenvalues
    1.920602    2.019772    2.028349    2.103383    2.314848    2.385472
 

........................................................................
.............................. CYCLE    1 ..............................
........................................................................
   1    -31.5912966 -0.315913E+02  0.326E-05    1.12       0.0  T
   2    -31.5912966 -0.293099E-11  0.244E-05    1.12    1025.6  T
   3    -31.5912966 -0.457234E-11  0.111E-05    1.12    2261.8  T
     SCC iter.                  ...        0 min,  0.003 sec
     gradient                   ...        0 min,  0.008 sec
 * total energy  :   -31.1008832 Eh     change       -0.7718022E-09 Eh
   gradient norm :     0.1168443 Eh/α   predicted     0.0000000E+00 (-100.00%)
   displ. norm   :     0.2688848 α      lambda       -0.1848172E-01
   maximum displ.:     0.1427461 α      in ANC's #17, #5, #9, ...

........................................................................
.............................. CYCLE    2 ..............................
........................................................................
   1    -31.5830840 -0.315831E+02  0.252E-01    1.06       0.0  T
   2    -31.5831848 -0.100824E-03  0.162E-01    1.07       1.0  T
   3    -31.5831196  0.652453E-04  0.104E-01    1.07       1.0  T
   4    -31.5832407 -0.121128E-03  0.353E-02    1.07       1.0  T
   5    -31.5832559 -0.152306E-04  0.119E-02    1.07       2.1  T
   6    -31.5832566 -0.687645E-06  0.549E-03    1.07       4.6  T
   7    -31.5832566  0.100661E-07  0.351E-03    1.07       7.1  T
     SCC iter.                  ...        0 min,  0.005 sec
     gradient                   ...        0 min,  0.008 sec
 * total energy  :   -31.1129217 Eh     change       -0.1203854E-01 Eh
   gradient norm :     0.0460124 Eh/α   predicted    -0.9908966E-02 ( -17.69%)
   displ. norm   :     0.1482805 α      lambda       -0.3353415E-02
   maximum displ.:     0.1185556 α      in ANC's #5, #17, #22, ...

........................................................................
.............................. CYCLE    3 ..............................
........................................................................
   1    -31.5812804 -0.315813E+02  0.130E-01    1.05       0.0  T
   2    -31.5813005 -0.200924E-04  0.823E-02    1.05       1.0  T
   3    -31.5812855  0.150239E-04  0.512E-02    1.05       1.0  T
   4    -31.5813133 -0.278282E-04  0.197E-02    1.05       1.3  T
   5    -31.5813187 -0.536822E-05  0.642E-03    1.05       3.9  T
   6    -31.5813187 -0.171786E-07  0.458E-03    1.05       5.5  T
   7    -31.5813189 -0.221993E-06  0.229E-03    1.05      10.9  T
     SCC iter.                  ...        0 min,  0.005 sec
     gradient                   ...        0 min,  0.008 sec
 * total energy  :   -31.1148704 Eh     change       -0.1948663E-02 Eh
   gradient norm :     0.0176862 Eh/α   predicted    -0.1713572E-02 ( -12.06%)
   displ. norm   :     0.0543589 α      lambda       -0.3287247E-03
   maximum displ.:     0.0505098 α      in ANC's #5, #22, #33, ...

........................................................................
.............................. CYCLE    4 ..............................
........................................................................
   1    -31.5810286 -0.315810E+02  0.420E-02    1.05       0.0  T
   2    -31.5810315 -0.285851E-05  0.249E-02    1.04       1.0  T
   3    -31.5810311  0.337947E-06  0.139E-02    1.04       1.8  T
   4    -31.5810321 -0.959924E-06  0.615E-03    1.04       4.1  T
   5    -31.5810327 -0.623656E-06  0.123E-03    1.04      20.3  T
   6    -31.5810327 -0.129533E-07  0.643E-04    1.04      38.9  T
     SCC iter.                  ...        0 min,  0.004 sec
     gradient                   ...        0 min,  0.008 sec
 * total energy  :   -31.1150911 Eh     change       -0.2206947E-03 Eh
   gradient norm :     0.0084918 Eh/α   predicted    -0.1648497E-03 ( -25.30%)
   displ. norm   :     0.0267921 α      lambda       -0.1000596E-03
   maximum displ.:     0.0213930 α      in ANC's #5, #9, #17, ...

........................................................................
.............................. CYCLE    5 ..............................
........................................................................
   1    -31.5816031 -0.315816E+02  0.274E-02    1.04       0.0  T
   2    -31.5816049 -0.183322E-05  0.155E-02    1.04       1.6  T
   3    -31.5816050 -0.213231E-07  0.817E-03    1.04       3.1  T
   4    -31.5816050 -0.374806E-07  0.370E-03    1.04       6.8  T
   5    -31.5816052 -0.204060E-06  0.144E-03    1.04      17.4  T
   6    -31.5816052 -0.319944E-07  0.549E-04    1.04      45.6  T
     SCC iter.                  ...        0 min,  0.004 sec
     gradient                   ...        0 min,  0.008 sec
 * total energy  :   -31.1151472 Eh     change       -0.5608510E-04 Eh
   gradient norm :     0.0018220 Eh/α   predicted    -0.5006665E-04 ( -10.73%)
   displ. norm   :     0.0073054 α      lambda       -0.4888314E-05
   maximum displ.:     0.0045138 α      in ANC's #5, #17, #9, ...

........................................................................
.............................. CYCLE    6 ..............................
........................................................................
   1    -31.5819840 -0.315820E+02  0.939E-03    1.04       0.0  T
   2    -31.5819842 -0.243115E-06  0.516E-03    1.03       4.8  T
   3    -31.5819842  0.681421E-07  0.380E-03    1.03       6.6  T
   4    -31.5819843 -0.116000E-06  0.137E-03    1.03      18.3  T
   5    -31.5819843 -0.262201E-07  0.506E-04    1.03      49.4  T
   6    -31.5819843 -0.208069E-08  0.315E-04    1.03      79.3  T
     SCC iter.                  ...        0 min,  0.004 sec
     gradient                   ...        0 min,  0.008 sec
 * total energy  :   -31.1151502 Eh     change       -0.3059713E-05 Eh
   gradient norm :     0.0008335 Eh/α   predicted    -0.2442209E-05 ( -20.18%)
   displ. norm   :     0.0034643 α      lambda       -0.5802747E-06
   maximum displ.:     0.0027553 α      in ANC's #5, #1, #17, ...

   *** GEOMETRY OPTIMIZATION CONVERGED AFTER 6 ITERATIONS ***

------------------------------------------------------------------------
 total energy gain   :        -0.0142670 Eh       -8.9527 kcal/mol
 total RMSD          :         0.1127636 a0        0.0597 Å
 total power (kW/mol):        -6.2430194 (step) -330.2394 (real)
------------------------------------------------------------------------

 ANCopt (total)                0 d,  0 h,  0 min,  0.113 sec
 optimizer setup                ...        0 min,  0.000 sec (  0.131%)
 model hessian                  ...        0 min,  0.002 sec (  1.418%)
 ANC generation                 ...        0 min,  0.000 sec (  0.370%)
 coordinate transformation      ...        0 min,  0.000 sec (  0.065%)
 single point calculation       ...        0 min,  0.109 sec ( 96.148%)
 optimization log               ...        0 min,  0.000 sec (  0.417%)
 hessian update                 ...        0 min,  0.000 sec (  0.059%)
 rational function              ...        0 min,  0.001 sec (  0.994%)

================
 final structure:
================
$coord
    5.28969203246752   -0.99971791443796    0.01098215083210      C 
    3.29246377270822   -2.44073157944861    0.01152154422629      N 
    1.29158567361377   -0.82378959693941    0.01475160922475      C 
    2.19235936261736    1.84343948931217    0.01699572680353      C 
    0.02054918202314    3.60239437008616    0.01928697718387      C 
    0.02774225983930    5.88170170444882    0.02257336117163      O 
   -2.16232437157464    1.85719660420217    0.01607546397578      C 
   -1.27842697008749   -0.81570248417642    0.01424431847987      C 
   -3.28948689895320   -2.41993975744830    0.01014990027132      N 
   -5.27756512147717   -0.96632156511871    0.00890554654080      C 
   -4.71363276317125    1.73034331894244    0.01144406188359      C 
    4.74281870952054    1.70045202379406    0.01353611161257      C 
    7.15071719590959   -1.82180483429042    0.00847292347214      H 
   -7.14374654025689   -1.77663726496331    0.00530129617233      H 
   -6.09022733043146    3.21638422410564    0.01030821439965      H 
    6.12880101208772    3.17774250136877    0.01309388105857      H 
$end
           -------------------------------------------------
          |                Final Singlepoint                |
           -------------------------------------------------

          ...................................................
          :                      SETUP                      :
          :.................................................:
          :  # basis functions                  52          :
          :  # atomic orbitals                  52          :
          :  # shells                           28          :
          :  # electrons                        56          :
          :  max. iterations                   250          :
          :  Hamiltonian                  GFN2-xTB          :
          :  restarted?                      false          :
          :  GBSA solvation                  false          :
          :  PC potential                    false          :
          :  electronic temp.          300.0000000     K    :
          :  accuracy                    1.0000000          :
          :  -> integral cutoff          0.2500000E+02      :
          :  -> integral neglect         0.1000000E-07      :
          :  -> SCF convergence          0.1000000E-05 Eh   :
          :  -> wf. convergence          0.1000000E-03 e    :
          :  Broyden damping             0.4000000          :
          ...................................................

 iter      E             dE          RMSdq      gap      omega  full diag
   1    -31.5819843 -0.315820E+02  0.207E-04    1.03       0.0  T
   2    -31.5819843  0.254378E-09  0.131E-04    1.03     190.9  T
   3    -31.5819843 -0.191786E-09  0.160E-04    1.03     156.3  T

   *** convergence criteria satisfied after 3 iterations ***

         #    Occupation            Energy/Eh            Energy/eV
      -------------------------------------------------------------
         1        2.0000           -0.7283734             -19.8201
       ...           ...                  ...                  ...
        22        2.0000           -0.4764729             -12.9655
        23        2.0000           -0.4501413             -12.2490
        24        2.0000           -0.4474448             -12.1756
        25        2.0000           -0.4417668             -12.0211
        26        2.0000           -0.4199466             -11.4273
        27        2.0000           -0.4161545             -11.3241
        28        2.0000           -0.4084945             -11.1157 (HOMO)
        29                         -0.3704886             -10.0815 (LUMO)
        30                         -0.3176014              -8.6424
        31                         -0.2349708              -6.3939
        32                         -0.2061292              -5.6091
        33                         -0.1533553              -4.1730
       ...                                ...                  ...
        52                          0.7606269              20.6977
      -------------------------------------------------------------
                  HL-Gap            0.0380058 Eh            1.0342 eV
             Fermi-level           -0.3894914 Eh          -10.5986 eV

 SCC (total)                   0 d,  0 h,  0 min,  0.017 sec
 SCC setup                      ...        0 min,  0.000 sec (  0.853%)
 Dispersion                     ...        0 min,  0.000 sec (  0.745%)
 integral evaluation            ...        0 min,  0.005 sec ( 31.739%)
 zeroth order Hamiltonian       ...        0 min,  0.000 sec (  0.559%)
 iterations                     ...        0 min,  0.003 sec ( 15.626%)
 molecular gradient             ...        0 min,  0.008 sec ( 48.751%)
 printout                       ...        0 min,  0.000 sec (  1.475%)

         :::::::::::::::::::::::::::::::::::::::::::::::::::::
         ::                     SUMMARY                     ::
         :::::::::::::::::::::::::::::::::::::::::::::::::::::
         :: total energy             -31.115150220856 Eh    ::
         :: gradient norm              0.000833144128 Eh/a0 ::
         :: HOMO-LUMO gap              1.034191710223 eV    ::
         ::.................................................::
         :: SCC energy               -31.581984307333 Eh    ::
         :: -> isotropic ES            0.039416848873 Eh    ::
         :: -> anisotropic ES          0.002632613379 Eh    ::
         :: -> anisotropic XC          0.022721083217 Eh    ::
         :: -> dispersion             -0.016200803660 Eh    ::
         :: repulsion energy           0.466826852993 Eh    ::
         :: add. restraining           0.000000000000 Eh    ::
         :::::::::::::::::::::::::::::::::::::::::::::::::::::

           -------------------------------------------------
          |                Property Printout                |
           -------------------------------------------------

    * Orbital Energies and Occupations

         #    Occupation            Energy/Eh            Energy/eV
      -------------------------------------------------------------
         1        2.0000           -0.7283734             -19.8201
       ...           ...                  ...                  ...
        16        2.0000           -0.5398683             -14.6906
        17        2.0000           -0.5303477             -14.4315
        18        2.0000           -0.5275975             -14.3567
        19        2.0000           -0.5147896             -14.0081
        20        2.0000           -0.5100186             -13.8783
        21        2.0000           -0.4828281             -13.1384
        22        2.0000           -0.4764729             -12.9655
        23        2.0000           -0.4501413             -12.2490
        24        2.0000           -0.4474448             -12.1756
        25        2.0000           -0.4417668             -12.0211
        26        2.0000           -0.4199466             -11.4273
        27        2.0000           -0.4161545             -11.3241
        28        2.0000           -0.4084945             -11.1157 (HOMO)
        29                         -0.3704886             -10.0815 (LUMO)
        30                         -0.3176014              -8.6424
        31                         -0.2349708              -6.3939
        32                         -0.2061292              -5.6091
        33                         -0.1533553              -4.1730
        34                         -0.1471006              -4.0028
        35                         -0.0028627              -0.0779
        36                          0.0512915               1.3957
        37                          0.0575033               1.5647
        38                          0.0837297               2.2784
        39                          0.1444342               3.9303
       ...                                ...                  ...
        52                          0.7606269              20.6977
      -------------------------------------------------------------
                  HL-Gap            0.0380058 Eh            1.0342 eV
             Fermi-level           -0.3894914 Eh          -10.5986 eV

     #   Z        covCN         q      C6AA      α(0)
     1   6 C      3.190     0.086    25.621     8.256
     2   7 N      1.854    -0.212    26.455     7.623
     3   6 C      3.267     0.102    24.592     8.002
     4   6 C      3.165    -0.028    28.335     8.699
     5   6 C      2.832     0.237    23.042     7.866
     6   8 O      0.856    -0.340    20.510     6.072
     7   6 C      3.165    -0.028    28.334     8.699
     8   6 C      3.267     0.102    24.592     8.002
     9   7 N      1.854    -0.212    26.455     7.623
    10   6 C      3.190     0.086    25.621     8.256
    11   6 C      2.985    -0.028    28.681     8.785
    12   6 C      2.985    -0.028    28.681     8.785
    13   1 H      0.926     0.067     2.121     2.278
    14   1 H      0.926     0.067     2.121     2.278
    15   1 H      0.926     0.064     2.155     2.295
    16   1 H      0.926     0.064     2.155     2.295

 Mol. C6AA /au·bohr⁶  :       4458.529111
 Mol. C8AA /au·bohr⁸  :     113592.882578
 Mol. α(0) /au        :        105.816117


Wiberg/Mayer (AO) data.
largest (>0.10) Wiberg bond orders for each atom
          total WBO             WBO to atom ...
     1  C   3.881        N    2 1.615    C   12 1.133    H   13 0.965    C    8 0.109
     2  N   3.053        C    1 1.615    C    3 1.214    C    4 0.104
     3  C   3.973        C    8 1.478    N    2 1.214    C    4 1.007    C   10 0.109
     4  C   3.979        C   12 1.670    C    5 1.025    C    3 1.007    N    2 0.104
     5  C   3.945        O    6 1.800    C    7 1.025    C    4 1.025
     6  O   2.095        C    5 1.800
     7  C   3.979        C   11 1.670    C    5 1.025    C    8 1.007    N    9 0.104
     8  C   3.973        C    3 1.478    N    9 1.214    C    7 1.007    C    1 0.109
     9  N   3.053        C   10 1.615    C    8 1.214    C    7 0.104
    10  C   3.881        N    9 1.615    C   11 1.133    H   14 0.965    C    3 0.109
    11  C   3.960        C    7 1.670    C   10 1.133    H   15 0.970
    12  C   3.960        C    4 1.670    C    1 1.133    H   16 0.970
    13  H   0.994        C    1 0.965
    14  H   0.994        C   10 0.965
    15  H   0.995        C   11 0.970
    16  H   0.995        C   12 0.970

molecular dipole:
                 x           y           z       tot (Debye)
 q only:       -0.002      -0.475      -0.002
   full:        0.000       0.044      -0.002       0.112
molecular quadrupole (traceless):
                xx          xy          yy          xz          yz          zz
 q only:       15.379      -0.102     -14.800       0.003      -0.032      -0.579
  q+dip:       22.843      -0.137     -20.657       0.005      -0.028      -2.186
   full:       19.572      -0.132     -22.498       0.004      -0.035       2.926

           -------------------------------------------------
          |                Geometry Summary                 |
           -------------------------------------------------

      molecular mass/u    :      156.1434000
   center of mass at/Å    :        0.0060775       0.3879016       0.0075177
  moments of inertia/u·Å² :        0.2829266E+03   0.5160474E+03   0.7989736E+03
rotational constants/cm⁻¹ :        0.5958305E-01   0.3266683E-01   0.2109911E-01

 * 12 selected distances

     #   Z        #   Z                                     value/Å
     1   6 C      2   7 N                                 1.3032639
     2   7 N      3   6 C                                 1.3613361 (max)
     5   6 C      6   8 O                                 1.2061649
     3   6 C      8   6 C                                 1.3599990
     8   6 C      9   7 N                                 1.3613290
     9   7 N     10   6 C                                 1.3032662
     7   6 C     11   6 C                                 1.3517644
     4   6 C     12   6 C                                 1.3517657
     1   6 C     13   1 H                                 1.0766186
    10   6 C     14   1 H                                 1.0766199
    11   6 C     15   1 H                                 1.0719375 (min)
    12   6 C     16   1 H                                 1.0719379

 * 4 distinct bonds (by element types)

   Z      Z             #   av. dist./Å        max./Å        min./Å
   1 H    6 C           4     1.0742785     1.0766199     1.0719375
   6 C    6 C           3     1.3545097     1.3599990     1.3517644
   6 C    7 N           4     1.3322988     1.3613361     1.3032639
   6 C    8 O           1     1.2061649     1.2061649     1.2061649


optimized geometry written to: xtbopt.xyz


           -------------------------------------------------
          | TOTAL ENERGY              -31.115150220856 Eh   |
          | GRADIENT NORM               0.000833144128 Eh/α |
          | HOMO-LUMO GAP               1.034191710223 eV   |
           -------------------------------------------------

------------------------------------------------------------------------
 * finished run on 2021/05/19 at 11:01:11.838     
------------------------------------------------------------------------
 total:
 * wall-time:     0 d,  0 h,  0 min,  0.190 sec
 *  cpu-time:     0 d,  0 h,  0 min,  0.174 sec
 * ratio c/w:     0.917 speedup
 SCF:
 * wall-time:     0 d,  0 h,  0 min,  0.025 sec
 *  cpu-time:     0 d,  0 h,  0 min,  0.025 sec
 * ratio c/w:     1.000 speedup
 ANC optimizer:
 * wall-time:     0 d,  0 h,  0 min,  0.131 sec
 *  cpu-time:     0 d,  0 h,  0 min,  0.131 sec
 * ratio c/w:     1.000 speedup

