      -----------------------------------------------------------      
     |                   =====================                   |     
     |                           x T B                           |     
     |                   =====================                   |     
     |                         S. Grimme                         |     
     |          Mulliken Center for Theoretical Chemistry        |     
     |                    University of Bonn                     |     
     |                Version 6.2 RC2 (SAW190805)                |     
      -----------------------------------------------------------      

   This program is distributed in the hope that it will be useful,
   but WITHOUT ANY WARRANTY; without even the implied warranty of
   MERCHANTABILITY or FITNESS FOR A PARTICULAR PURPOSE.
   
   FOR NON-COMMERCIAL, ACADEMIA USE ONLY.
   
   Cite this work as:
   * S. Grimme, C. Bannwarth, P. Shushkov, J. Chem. Theory Comput., 2017,
     13, 1989-2009. DOI: 10.1021/acs.jctc.7b00118
   * C. Bannwarth, S. Ehlert and S. Grimme., J. Chem. Theory Comput., 2019,
     15, 1652-1671. DOI: 10.1021/acs.jctc.8b01176
   * P. Pracht, E. Caldeweyher, S. Ehlert, S. Grimme, ChemRxiv, 2019, preprint.
     DOI: 10.26434/chemrxiv.8326202.v1
   
   for DFT-D4:
   * E. Caldeweyher, C. Bannwarth and S. Grimme, J. Chem. Phys., 2017,
     147, 034112. DOI: 10.1063/1.4993215
   * E. Caldeweyher, S. Ehlert, A. Hansen, H. Neugebauer, S. Spicher,
     C. Bannwarth and S. Grimme, J. Chem. Phys., 2019, 150, 154122.
     DOI: 10.1063/1.5090222
   
   for sTDA-xTB:
   * S. Grimme and C. Bannwarth, J. Chem. Phys., 2016, 145, 054103.
     DOI: 10.1063/1.4959605
   
   in the mass-spec context:
   * V. Asgeirsson, C. Bauer and S. Grimme, Chem. Sci., 2017, 8, 4879.
     DOI: 10.1039/c7sc00601b
   
   for metadynamics refer to:
   * S. Grimme, J. Chem. Theory Comput., 2019, 155, 2847-2862
     DOI: 10.1021/acs.jctc.9b00143
   
   with help from (in alphabetical order)
   C. Bannwarth, F. Bohle, G. Brandenburg, E. Caldeweyher, M. Checinski,
   S. Dohm, S. Ehlert, S. Ehrlich, F. März, H. Neugebauer, J. Pisarek,
   P. Pracht, P. Shushkov, and S. Spicher.
   
 * started run on 2021/05/19 at 11:01:12.700     

           -------------------------------------------------
          |                Calculation Setup                |
           -------------------------------------------------

          program call               : /ihome/ghutchison/geoffh/xtb/xtb 897.xyz -opt
          hostname                   : smp-n83
          coordinate file            : 897.xyz
          omp threads                :                     1
          number of atoms            :                    30
          number of electrons        :                    84
          charge                     :                     0
          spin                       :                   0.0
          first test random number   :      0.49722530518852


########################################################################
# WARNING! Please study the warnings concerning your input carefully
#  - the use of '-opt' is discouraged, please use '--opt' next time
########################################################################

           ------------------------------------------------- 
          |                 G F N 2 - x T B                 |
          | Geometry, Frequencies, Noncovalent interactions |
          |            JCTC 2019 parametrisation            |
           ------------------------------------------------- 
             KAB for C  - Si     :                1.0500
             KAB for H  - Pd     :                0.9500
             k(s)              :                1.8500
             k(p)              :                2.2300
             k(d)              :                2.2300
             k(f)              :                2.0000
             kEN (H0ij)        :               -2.0000
             D4 a1             :                0.5200
             D4 a2             :                5.0000
             D4 s6             :                1.0000
             D4 s8             :                2.7000
             D4 s9             :                5.0000
             alphaj            :                2.0000

  Z AO/shell   Hii/eV     exponent
  1     Wed Apr 25 08:07:45 CEST 2018   EN: 2.200 GM2: 0.406  GM3: 0.0800  RAES: 1.40
     1s    -10.707211    1.230000
  6     Wed Apr 25 08:07:45 CEST 2018   EN: 2.550 GM2: 0.538  GM3: 0.1500  RAES: 3.00
     2s    -13.970922    2.096432
     2p    -10.063292    1.800000
  7     Wed Apr 25 08:07:45 CEST 2018   EN: 3.040 GM2: 0.461  GM3:-0.0640  RAES: 1.90
     2s    -16.686243    2.339881
     2p    -12.523956    2.014332
  8     Wed Apr 25 08:07:45 CEST 2018   EN: 3.440 GM2: 0.452  GM3:-0.0517  RAES: 1.80
     2s    -20.229985    2.439742
     2p    -15.503117    2.137023

           ------------------------------------------------- 
          |        Self-Consistent Charge Iterations        |
           ------------------------------------------------- 

          ...................................................
          :                      SETUP                      :
          :.................................................:
          :  # basis functions                  78          :
          :  # atomic orbitals                  78          :
          :  # shells                           46          :
          :  # electrons                        84          :
          :  max. iterations                   250          :
          :  Hamiltonian                  GFN2-xTB          :
          :  restarted?                      false          :
          :  GBSA solvation                  false          :
          :  PC potential                    false          :
          :  electronic temp.          300.0000000     K    :
          :  accuracy                    1.0000000          :
          :  -> integral cutoff          0.2500000E+02      :
          :  -> integral neglect         0.1000000E-07      :
          :  -> SCF convergence          0.1000000E-05 Eh   :
          :  -> wf. convergence          0.1000000E-03 e    :
          :  Broyden damping             0.4000000          :
          ...................................................

 iter      E             dE          RMSdq      gap      omega  full diag
   1    -47.3300522 -0.473301E+02  0.430E+00    2.13       0.0  T
   2    -47.4410495 -0.110997E+00  0.256E+00    1.88       1.0  T
   3    -47.4564277 -0.153783E-01  0.149E+00    2.03       1.0  T
   4    -47.4651142 -0.868648E-02  0.406E-01    1.88       1.0  T
   5    -47.4684488 -0.333456E-02  0.998E-02    1.93       1.0  T
   6    -47.4684940 -0.452057E-04  0.620E-02    1.93       1.0  T
   7    -47.4685370 -0.430317E-04  0.313E-02    1.93       1.0  T
   8    -47.4685493 -0.122627E-04  0.129E-02    1.93       1.4  T
   9    -47.4685512 -0.197136E-05  0.510E-03    1.93       3.6  T
  10    -47.4685514 -0.133288E-06  0.306E-03    1.93       6.0  T
  11    -47.4685516 -0.206322E-06  0.821E-04    1.93      22.2  T
  12    -47.4685516 -0.235516E-08  0.347E-04    1.93      52.7  T

   *** convergence criteria satisfied after 12 iterations ***

         #    Occupation            Energy/Eh            Energy/eV
      -------------------------------------------------------------
         1        2.0000           -0.7034798             -19.1427
       ...           ...                  ...                  ...
        36        2.0000           -0.4532098             -12.3325
        37        2.0000           -0.4453314             -12.1181
        38        2.0000           -0.4269756             -11.6186
        39        2.0000           -0.4105637             -11.1720
        40        2.0000           -0.4012318             -10.9181
        41        2.0000           -0.3934605             -10.7066
        42        2.0000           -0.3748129             -10.1992 (HOMO)
        43                         -0.3039506              -8.2709 (LUMO)
        44                         -0.2418731              -6.5817
        45                         -0.2041417              -5.5550
        46                         -0.1472733              -4.0075
        47                         -0.1089965              -2.9659
       ...                                ...                  ...
        78                          0.7851385              21.3647
      -------------------------------------------------------------
                  HL-Gap            0.0708624 Eh            1.9283 eV
             Fermi-level           -0.3393818 Eh           -9.2350 eV

 SCC (total)                   0 d,  0 h,  0 min,  0.049 sec
 SCC setup                      ...        0 min,  0.000 sec (  0.736%)
 Dispersion                     ...        0 min,  0.001 sec (  1.043%)
 integral evaluation            ...        0 min,  0.012 sec ( 24.150%)
 zeroth order Hamiltonian       ...        0 min,  0.000 sec (  0.461%)
 iterations                     ...        0 min,  0.018 sec ( 36.759%)
 molecular gradient             ...        0 min,  0.017 sec ( 35.859%)
 printout                       ...        0 min,  0.000 sec (  0.888%)

         :::::::::::::::::::::::::::::::::::::::::::::::::::::
         ::                     SUMMARY                     ::
         :::::::::::::::::::::::::::::::::::::::::::::::::::::
         :: total energy             -46.818860843465 Eh    ::
         :: gradient norm              0.081279778809 Eh/a0 ::
         :: HOMO-LUMO gap              1.928263227832 eV    ::
         ::.................................................::
         :: SCC energy               -47.468551582299 Eh    ::
         :: -> isotropic ES            0.067141793183 Eh    ::
         :: -> anisotropic ES          0.004329624382 Eh    ::
         :: -> anisotropic XC          0.018064740428 Eh    ::
         :: -> dispersion             -0.029106583182 Eh    ::
         :: repulsion energy           0.649600974119 Eh    ::
         :: add. restraining           0.000000000000 Eh    ::
         :::::::::::::::::::::::::::::::::::::::::::::::::::::

      ----------------------------------------------------------- 
     |                   =====================                   |
     |                        A N C O P T                        |
     |                   =====================                   |
     |               Approximate Normal Coordinate               |
     |                Rational Function Optimizer                |
      ----------------------------------------------------------- 

          ...................................................
          :                      SETUP                      :
          :.................................................:
          :   optimization level            normal          :
          :   max. optcycles                   200          :
          :   ANC micro-cycles                  20          :
          :   degrees of freedom                84          :
          :.................................................:
          :   RF solver                   davidson          :
          :   input Hessian                  false          :
          :   write xtbopt.log                true          :
          :   linear?                        false          :
          :   energy convergence         0.5000000E-05 Eh   :
          :   grad. convergence          0.1000000E-02 Eh/α :
          :   maximium RF displ.         2.0000000          :
          :   Hlow (freq-cutoff)         0.5000000E-02      :
          :   Hmax (freq-cutoff)         5.0000000          :
          :   S6 in model hess.         20.0000000          :
          ...................................................

generating ANC from model Hessian ...
Using Lindh-Hessian (1995)
 Shifting diagonal of input Hessian by   4.105818664714132E-003
 Lowest  eigenvalues of input Hessian
   -0.000000   -0.000000   -0.000000   -0.000000   -0.000000    0.000000
    0.005000    0.005761    0.006486    0.007584    0.008228    0.008424
    0.010721    0.010815    0.012856    0.014004    0.016258    0.019540
 Highest eigenvalues
    1.837787    2.009411    2.118325    2.169914    2.365601    2.396407
 

........................................................................
.............................. CYCLE    1 ..............................
........................................................................
   1    -47.4685516 -0.474686E+02  0.717E-05    1.93       0.0  T
   2    -47.4685516 -0.104947E-10  0.427E-05    1.93     428.0  T
   3    -47.4685516  0.772360E-11  0.361E-05    1.93     505.9  T
     SCC iter.                  ...        0 min,  0.005 sec
     gradient                   ...        0 min,  0.017 sec
 * total energy  :   -46.8188608 Eh     change        0.4456569E-07 Eh
   gradient norm :     0.0812806 Eh/α   predicted     0.0000000E+00 (-100.00%)
   displ. norm   :     0.2581706 α      lambda       -0.8861420E-02
   maximum displ.:     0.0936625 α      in ANC's #30, #29, #32, ...

........................................................................
.............................. CYCLE    2 ..............................
........................................................................
   1    -47.4801497 -0.474801E+02  0.224E-01    1.83       0.0  T
   2    -47.4802566 -0.106847E-03  0.130E-01    1.83       1.0  T
   3    -47.4802413  0.152790E-04  0.619E-02    1.83       1.0  T
   4    -47.4802732 -0.318629E-04  0.148E-02    1.83       1.2  T
   5    -47.4802780 -0.482245E-05  0.480E-03    1.83       3.8  T
   6    -47.4802781 -0.789554E-07  0.268E-03    1.83       6.8  T
     SCC iter.                  ...        0 min,  0.009 sec
     gradient                   ...        0 min,  0.016 sec
 * total energy  :   -46.8252040 Eh     change       -0.6343203E-02 Eh
   gradient norm :     0.0396498 Eh/α   predicted    -0.4726040E-02 ( -25.49%)
   displ. norm   :     0.2845718 α      lambda       -0.4176354E-02
   maximum displ.:     0.1256808 α      in ANC's #6, #30, #32, ...

........................................................................
.............................. CYCLE    3 ..............................
........................................................................
   1    -47.4853220 -0.474853E+02  0.267E-01    1.75       0.0  T
   2    -47.4854229 -0.100943E-03  0.154E-01    1.74       1.0  T
   3    -47.4853333  0.896338E-04  0.863E-02    1.75       1.0  T
   4    -47.4854224 -0.891362E-04  0.343E-02    1.74       1.0  T
   5    -47.4854542 -0.317250E-04  0.102E-02    1.75       1.8  T
   6    -47.4854567 -0.248262E-05  0.391E-03    1.75       4.7  T
   7    -47.4854567 -0.720631E-07  0.153E-03    1.75      12.0  T
     SCC iter.                  ...        0 min,  0.010 sec
     gradient                   ...        0 min,  0.016 sec
 * total energy  :   -46.8277882 Eh     change       -0.2584212E-02 Eh
   gradient norm :     0.0170205 Eh/α   predicted    -0.2257285E-02 ( -12.65%)
   displ. norm   :     0.2639948 α      lambda       -0.9953011E-03
   maximum displ.:     0.1931939 α      in ANC's #6, #2, #4, ...

........................................................................
.............................. CYCLE    4 ..............................
........................................................................
   1    -47.4851334 -0.474851E+02  0.153E-01    1.72       0.0  T
   2    -47.4851396 -0.618478E-05  0.912E-02    1.72       1.0  T
   3    -47.4850306  0.109015E-03  0.680E-02    1.73       1.0  T
   4    -47.4851509 -0.120304E-03  0.144E-02    1.72       1.3  T
   5    -47.4851564 -0.550988E-05  0.395E-03    1.72       4.6  T
   6    -47.4851565 -0.113384E-06  0.219E-03    1.72       8.3  T
   7    -47.4851566 -0.292309E-07  0.958E-04    1.72      19.1  T
     SCC iter.                  ...        0 min,  0.010 sec
     gradient                   ...        0 min,  0.016 sec
 * total energy  :   -46.8285066 Eh     change       -0.7184195E-03 Eh
   gradient norm :     0.0132960 Eh/α   predicted    -0.5323353E-03 ( -25.90%)
   displ. norm   :     0.3389201 α      lambda       -0.8895411E-03
   maximum displ.:     0.2361721 α      in ANC's #6, #2, #3, ...

........................................................................
.............................. CYCLE    5 ..............................
........................................................................
   1    -47.4840197 -0.474840E+02  0.193E-01    1.70       0.0  T
   2    -47.4840250 -0.533947E-05  0.116E-01    1.70       1.0  T
   3    -47.4838628  0.162226E-03  0.842E-02    1.71       1.0  T
   4    -47.4840418 -0.179036E-03  0.137E-02    1.70       1.3  T
   5    -47.4840467 -0.488258E-05  0.501E-03    1.70       3.6  T
   6    -47.4840471 -0.384425E-06  0.255E-03    1.70       7.2  T
   7    -47.4840471 -0.414710E-07  0.984E-04    1.70      18.6  T
     SCC iter.                  ...        0 min,  0.010 sec
     gradient                   ...        0 min,  0.016 sec
 * total energy  :   -46.8290976 Eh     change       -0.5909257E-03 Eh
   gradient norm :     0.0115813 Eh/α   predicted    -0.4958626E-03 ( -16.09%)
   displ. norm   :     0.3238490 α      lambda       -0.6674553E-03
   maximum displ.:     0.2319140 α      in ANC's #6, #2, #3, ...

........................................................................
.............................. CYCLE    6 ..............................
........................................................................
   1    -47.4842920 -0.474843E+02  0.154E-01    1.70       0.0  T
   2    -47.4843071 -0.150814E-04  0.906E-02    1.70       1.0  T
   3    -47.4842709  0.362191E-04  0.403E-02    1.70       1.0  T
   4    -47.4843055 -0.345981E-04  0.151E-02    1.70       1.2  T
   5    -47.4843120 -0.653386E-05  0.343E-03    1.70       5.3  T
   6    -47.4843121 -0.141243E-06  0.214E-03    1.70       8.5  T
   7    -47.4843122 -0.554524E-07  0.440E-04    1.70      41.5  T
     SCC iter.                  ...        0 min,  0.010 sec
     gradient                   ...        0 min,  0.016 sec
 * total energy  :   -46.8295650 Eh     change       -0.4674871E-03 Eh
   gradient norm :     0.0117616 Eh/α   predicted    -0.3687303E-03 ( -21.13%)
   displ. norm   :     0.3076379 α      lambda       -0.5361177E-03
   maximum displ.:     0.2127478 α      in ANC's #6, #3, #2, ...

........................................................................
.............................. CYCLE    7 ..............................
........................................................................
   1    -47.4858550 -0.474859E+02  0.156E-01    1.70       0.0  T
   2    -47.4858660 -0.110279E-04  0.913E-02    1.70       1.0  T
   3    -47.4858434  0.226051E-04  0.281E-02    1.70       1.0  T
   4    -47.4858637 -0.203088E-04  0.131E-02    1.70       1.4  T
   5    -47.4858694 -0.572223E-05  0.328E-03    1.70       5.6  T
   6    -47.4858695 -0.735282E-07  0.200E-03    1.70       9.2  T
   7    -47.4858695 -0.373602E-07  0.616E-04    1.70      29.6  T
     SCC iter.                  ...        0 min,  0.010 sec
     gradient                   ...        0 min,  0.016 sec
 * total energy  :   -46.8299589 Eh     change       -0.3938526E-03 Eh
   gradient norm :     0.0132202 Eh/α   predicted    -0.2934447E-03 ( -25.49%)
   displ. norm   :     0.3582171 α      lambda       -0.4998772E-03
   maximum displ.:     0.2396928 α      in ANC's #6, #3, #2, ...

........................................................................
.............................. CYCLE    8 ..............................
........................................................................
   1    -47.4854755 -0.474855E+02  0.178E-01    1.69       0.0  T
   2    -47.4854799 -0.437594E-05  0.105E-01    1.69       1.0  T
   3    -47.4854647  0.151895E-04  0.225E-02    1.69       1.0  T
   4    -47.4854819 -0.172027E-04  0.644E-03    1.69       2.8  T
   5    -47.4854826 -0.698599E-06  0.350E-03    1.69       5.2  T
   6    -47.4854826 -0.708044E-07  0.194E-03    1.69       9.4  T
   7    -47.4854827 -0.655753E-07  0.437E-04    1.69      41.8  T
     SCC iter.                  ...        0 min,  0.010 sec
     gradient                   ...        0 min,  0.016 sec
 * total energy  :   -46.8303273 Eh     change       -0.3684086E-03 Eh
   gradient norm :     0.0142098 Eh/α   predicted    -0.2820159E-03 ( -23.45%)
   displ. norm   :     0.3384044 α      lambda       -0.5481480E-03
   maximum displ.:     0.2037747 α      in ANC's #6, #3, #2, ...

........................................................................
.............................. CYCLE    9 ..............................
........................................................................
   1    -47.4879110 -0.474879E+02  0.169E-01    1.68       0.0  T
   2    -47.4879204 -0.934421E-05  0.100E-01    1.68       1.0  T
   3    -47.4878734  0.469063E-04  0.410E-02    1.68       1.0  T
   4    -47.4879212 -0.477083E-04  0.120E-02    1.68       1.5  T
   5    -47.4879251 -0.396552E-05  0.317E-03    1.68       5.8  T
   6    -47.4879251  0.129533E-07  0.220E-03    1.68       8.3  T
   7    -47.4879252 -0.846206E-07  0.427E-04    1.68      42.8  T
     SCC iter.                  ...        0 min,  0.010 sec
     gradient                   ...        0 min,  0.016 sec
 * total energy  :   -46.8306789 Eh     change       -0.3515744E-03 Eh
   gradient norm :     0.0088548 Eh/α   predicted    -0.3054624E-03 ( -13.12%)
   displ. norm   :     0.4004421 α      lambda       -0.3858571E-03
   maximum displ.:     0.2282264 α      in ANC's #6, #3, #4, ...

........................................................................
.............................. CYCLE   10 ..............................
........................................................................
   1    -47.4832758 -0.474833E+02  0.183E-01    1.67       0.0  T
   2    -47.4832861 -0.103227E-04  0.108E-01    1.67       1.0  T
   3    -47.4832219  0.642660E-04  0.500E-02    1.67       1.0  T
   4    -47.4832867 -0.648812E-04  0.134E-02    1.67       1.4  T
   5    -47.4832922 -0.545648E-05  0.309E-03    1.67       5.9  T
   6    -47.4832923 -0.954125E-07  0.177E-03    1.67      10.3  T
   7    -47.4832923 -0.254520E-07  0.565E-04    1.67      32.3  T
     SCC iter.                  ...        0 min,  0.010 sec
     gradient                   ...        0 min,  0.016 sec
 * total energy  :   -46.8308189 Eh     change       -0.1400506E-03 Eh
   gradient norm :     0.0108586 Eh/α   predicted    -0.2238681E-03 (  59.85%)
   displ. norm   :     0.0942152 α      lambda       -0.3430587E-03
   maximum displ.:     0.0514383 α      in ANC's #3, #6, #2, ...

........................................................................
.............................. CYCLE   11 ..............................
........................................................................
   1    -47.4893158 -0.474893E+02  0.435E-02    1.67       0.0  T
   2    -47.4893207 -0.497860E-05  0.256E-02    1.68       1.0  T
   3    -47.4893195  0.127057E-05  0.125E-02    1.68       1.5  T
   4    -47.4893201 -0.656007E-06  0.706E-03    1.68       2.6  T
   5    -47.4893217 -0.158204E-05  0.184E-03    1.68       9.9  T
   6    -47.4893218 -0.471530E-07  0.986E-04    1.68      18.5  T
     SCC iter.                  ...        0 min,  0.009 sec
     gradient                   ...        0 min,  0.016 sec
 * total energy  :   -46.8309853 Eh     change       -0.1663559E-03 Eh
   gradient norm :     0.0074117 Eh/α   predicted    -0.1730536E-03 (   4.03%)
   displ. norm   :     0.1405347 α      lambda       -0.1651736E-03
   maximum displ.:     0.1043806 α      in ANC's #3, #4, #6, ...

........................................................................
.............................. CYCLE   12 ..............................
........................................................................
   1    -47.4885476 -0.474885E+02  0.662E-02    1.67       0.0  T
   2    -47.4885485 -0.907321E-06  0.391E-02    1.67       1.0  T
   3    -47.4885479  0.598810E-06  0.523E-03    1.67       3.5  T
   4    -47.4885486 -0.732669E-06  0.234E-03    1.67       7.8  T
   5    -47.4885488 -0.106400E-06  0.110E-03    1.67      16.6  T
     SCC iter.                  ...        0 min,  0.007 sec
     gradient                   ...        0 min,  0.016 sec
 * total energy  :   -46.8310584 Eh     change       -0.7309556E-04 Eh
   gradient norm :     0.0077041 Eh/α   predicted    -0.8422879E-04 (  15.23%)
   displ. norm   :     0.1677256 α      lambda       -0.1538976E-03
   maximum displ.:     0.1177221 α      in ANC's #3, #4, #5, ...

........................................................................
.............................. CYCLE   13 ..............................
........................................................................
   1    -47.4880411 -0.474880E+02  0.644E-02    1.68       0.0  T
   2    -47.4880419 -0.896296E-06  0.380E-02    1.68       1.0  T
   3    -47.4880326  0.939009E-05  0.173E-02    1.68       1.1  T
   4    -47.4880424 -0.987310E-05  0.336E-03    1.68       5.4  T
   5    -47.4880427 -0.279051E-06  0.110E-03    1.68      16.6  T
   6    -47.4880427 -0.802842E-08  0.627E-04    1.68      29.1  T
     SCC iter.                  ...        0 min,  0.009 sec
     gradient                   ...        0 min,  0.016 sec
 * total energy  :   -46.8311607 Eh     change       -0.1023171E-03 Eh
   gradient norm :     0.0060158 Eh/α   predicted    -0.7911462E-04 ( -22.68%)
   displ. norm   :     0.2777069 α      lambda       -0.2013185E-03
   maximum displ.:     0.1910440 α      in ANC's #3, #4, #5, ...

........................................................................
.............................. CYCLE   14 ..............................
........................................................................
   1    -47.4866036 -0.474866E+02  0.113E-01    1.68       0.0  T
   2    -47.4866065 -0.287336E-05  0.664E-02    1.68       1.0  T
   3    -47.4865795  0.269903E-04  0.332E-02    1.68       1.0  T
   4    -47.4866080 -0.285000E-04  0.634E-03    1.68       2.9  T
   5    -47.4866091 -0.104627E-05  0.227E-03    1.68       8.0  T
   6    -47.4866092 -0.854430E-07  0.123E-03    1.68      14.8  T
     SCC iter.                  ...        0 min,  0.009 sec
     gradient                   ...        0 min,  0.016 sec
 * total energy  :   -46.8312683 Eh     change       -0.1076405E-03 Eh
   gradient norm :     0.0069389 Eh/α   predicted    -0.1084271E-03 (   0.73%)
   displ. norm   :     0.1691840 α      lambda       -0.1560978E-03
   maximum displ.:     0.0871597 α      in ANC's #3, #4, #6, ...

........................................................................
.............................. CYCLE   15 ..............................
........................................................................
   1    -47.4887085 -0.474887E+02  0.801E-02    1.69       0.0  T
   2    -47.4887131 -0.458903E-05  0.465E-02    1.69       1.0  T
   3    -47.4887113  0.170696E-05  0.126E-02    1.68       1.5  T
   4    -47.4887138 -0.240466E-05  0.465E-03    1.69       3.9  T
   5    -47.4887141 -0.389513E-06  0.215E-03    1.69       8.5  T
   6    -47.4887142 -0.251042E-07  0.136E-03    1.69      13.4  T
     SCC iter.                  ...        0 min,  0.009 sec
     gradient                   ...        0 min,  0.016 sec
 * total energy  :   -46.8313715 Eh     change       -0.1031762E-03 Eh
   gradient norm :     0.0062569 Eh/α   predicted    -0.8028456E-04 ( -22.19%)
   displ. norm   :     0.2869746 α      lambda       -0.1424725E-03
   maximum displ.:     0.2064067 α      in ANC's #3, #4, #5, ...

........................................................................
.............................. CYCLE   16 ..............................
........................................................................
   1    -47.4872686 -0.474873E+02  0.121E-01    1.68       0.0  T
   2    -47.4872708 -0.218014E-05  0.708E-02    1.68       1.0  T
   3    -47.4872713 -0.532107E-06  0.566E-03    1.68       3.2  T
   4    -47.4872716 -0.281631E-06  0.351E-03    1.68       5.2  T
   5    -47.4872717 -0.108465E-06  0.158E-03    1.68      11.6  T
   6    -47.4872717 -0.488325E-08  0.785E-04    1.68      23.3  T
     SCC iter.                  ...        0 min,  0.009 sec
     gradient                   ...        0 min,  0.016 sec
 * total energy  :   -46.8314634 Eh     change       -0.9190169E-04 Eh
   gradient norm :     0.0055867 Eh/α   predicted    -0.7710399E-04 ( -16.10%)
   displ. norm   :     0.2029188 α      lambda       -0.1355255E-03
   maximum displ.:     0.1211098 α      in ANC's #4, #3, #6, ...

........................................................................
.............................. CYCLE   17 ..............................
........................................................................
   1    -47.4887602 -0.474888E+02  0.933E-02    1.67       0.0  T
   2    -47.4887634 -0.326437E-05  0.546E-02    1.67       1.0  T
   3    -47.4887486  0.148146E-04  0.240E-02    1.67       1.0  T
   4    -47.4887643 -0.156543E-04  0.626E-03    1.68       2.9  T
   5    -47.4887652 -0.954759E-06  0.230E-03    1.67       8.0  T
   6    -47.4887653 -0.559894E-07  0.124E-03    1.67      14.8  T
     SCC iter.                  ...        0 min,  0.009 sec
     gradient                   ...        0 min,  0.016 sec
 * total energy  :   -46.8315163 Eh     change       -0.5283629E-04 Eh
   gradient norm :     0.0045527 Eh/α   predicted    -0.7055403E-04 (  33.53%)
   displ. norm   :     0.1326398 α      lambda       -0.7534619E-04
   maximum displ.:     0.0940951 α      in ANC's #3, #4, #7, ...

........................................................................
.............................. CYCLE   18 ..............................
........................................................................
   1    -47.4878930 -0.474879E+02  0.527E-02    1.67       0.0  T
   2    -47.4878945 -0.148545E-05  0.311E-02    1.67       1.0  T
   3    -47.4878921  0.237453E-05  0.108E-02    1.68       1.7  T
   4    -47.4878949 -0.273657E-05  0.292E-03    1.67       6.3  T
   5    -47.4878951 -0.166141E-06  0.144E-03    1.67      12.7  T
     SCC iter.                  ...        0 min,  0.007 sec
     gradient                   ...        0 min,  0.016 sec
 * total energy  :   -46.8315497 Eh     change       -0.3348234E-04 Eh
   gradient norm :     0.0037664 Eh/α   predicted    -0.3834076E-04 (  14.51%)
   displ. norm   :     0.0303972 α      lambda       -0.2381914E-04
   maximum displ.:     0.0192899 α      in ANC's #6, #2, #5, ...

........................................................................
.............................. CYCLE   19 ..............................
........................................................................
   1    -47.4884791 -0.474885E+02  0.157E-02    1.67       0.0  T
   2    -47.4884793 -0.216376E-06  0.913E-03    1.67       2.0  T
   3    -47.4884785  0.816646E-06  0.581E-03    1.67       3.1  T
   4    -47.4884794 -0.861201E-06  0.173E-03    1.67      10.6  T
   5    -47.4884795 -0.880671E-07  0.483E-04    1.67      37.8  T
   6    -47.4884795 -0.243856E-08  0.235E-04    1.67      77.6  T
     SCC iter.                  ...        0 min,  0.008 sec
     gradient                   ...        0 min,  0.017 sec
 * total energy  :   -46.8315658 Eh     change       -0.1611100E-04 Eh
   gradient norm :     0.0024060 Eh/α   predicted    -0.1192257E-04 ( -26.00%)
   displ. norm   :     0.0439920 α      lambda       -0.2043455E-04
   maximum displ.:     0.0226378 α      in ANC's #3, #1, #6, ...

........................................................................
.............................. CYCLE   20 ..............................
........................................................................
   1    -47.4894663 -0.474895E+02  0.199E-02    1.68       0.0  T
   2    -47.4894664 -0.141502E-06  0.116E-02    1.68       1.6  T
   3    -47.4894645  0.189544E-05  0.859E-03    1.68       2.1  T
   4    -47.4894666 -0.208385E-05  0.138E-03    1.68      13.3  T
   5    -47.4894667 -0.491206E-07  0.514E-04    1.68      35.5  T
   6    -47.4894667 -0.264941E-08  0.252E-04    1.68      72.5  T
     SCC iter.                  ...        0 min,  0.009 sec
     gradient                   ...        0 min,  0.017 sec
 * total energy  :   -46.8315787 Eh     change       -0.1282859E-04 Eh
   gradient norm :     0.0013123 Eh/α   predicted    -0.1024000E-04 ( -20.18%)
   displ. norm   :     0.2047085 α      lambda       -0.1801393E-04
   maximum displ.:     0.1563928 α      in ANC's #3, #4, #8, ...
 * RMSD in coord.:     0.6617937 α      energy gain  -0.1271783E-01 Eh

generating ANC from model Hessian ...
Using Lindh-Hessian (1995)
 Shifting diagonal of input Hessian by   4.100164982021426E-003
 Lowest  eigenvalues of input Hessian
   -0.000000   -0.000000    0.000000    0.000000    0.000000    0.000000
    0.005000    0.005655    0.006567    0.007595    0.008296    0.008987
    0.010500    0.010783    0.012900    0.014630    0.016825    0.019471
 Highest eigenvalues
    1.899231    2.038496    2.093684    2.113664    2.392628    2.427621
 

........................................................................
.............................. CYCLE   21 ..............................
........................................................................
   1    -47.4881131 -0.474881E+02  0.777E-02    1.68       0.0  T
   2    -47.4881136 -0.462030E-06  0.459E-02    1.68       1.0  T
   3    -47.4881123  0.125552E-05  0.674E-03    1.68       2.7  T
   4    -47.4881138 -0.142691E-05  0.197E-03    1.68       9.3  T
   5    -47.4881138 -0.756697E-07  0.963E-04    1.68      19.0  T
   6    -47.4881138 -0.523014E-08  0.506E-04    1.68      36.1  T
     SCC iter.                  ...        0 min,  0.009 sec
     gradient                   ...        0 min,  0.017 sec
 * total energy  :   -46.8315808 Eh     change       -0.2112690E-05 Eh
   gradient norm :     0.0028018 Eh/α   predicted     0.0000000E+00 (-100.00%)
   displ. norm   :     0.0322223 α      lambda       -0.2307959E-04
   maximum displ.:     0.0217546 α      in ANC's #1, #2, #5, ...

........................................................................
.............................. CYCLE   22 ..............................
........................................................................
   1    -47.4889767 -0.474890E+02  0.125E-02    1.68       0.0  T
   2    -47.4889767 -0.737389E-07  0.732E-03    1.68       2.5  T
   3    -47.4889765  0.252208E-06  0.361E-03    1.68       5.1  T
   4    -47.4889768 -0.275666E-06  0.909E-04    1.68      20.1  T
   5    -47.4889768 -0.170688E-07  0.345E-04    1.68      52.9  T
     SCC iter.                  ...        0 min,  0.008 sec
     gradient                   ...        0 min,  0.017 sec
 * total energy  :   -46.8315956 Eh     change       -0.1485837E-04 Eh
   gradient norm :     0.0008775 Eh/α   predicted    -0.1155197E-04 ( -22.25%)
   displ. norm   :     0.0340490 α      lambda       -0.6140251E-05
   maximum displ.:     0.0186810 α      in ANC's #1, #2, #4, ...

........................................................................
.............................. CYCLE   23 ..............................
........................................................................
   1    -47.4894387 -0.474894E+02  0.129E-02    1.68       0.0  T
   2    -47.4894388 -0.101050E-06  0.754E-03    1.68       2.4  T
   3    -47.4894386  0.260146E-06  0.346E-03    1.68       5.3  T
   4    -47.4894388 -0.274196E-06  0.102E-03    1.68      17.9  T
   5    -47.4894389 -0.311663E-07  0.455E-04    1.68      40.1  T
   6    -47.4894389 -0.382188E-08  0.189E-04    1.68      96.8  T
     SCC iter.                  ...        0 min,  0.009 sec
     gradient                   ...        0 min,  0.017 sec
 * total energy  :   -46.8315995 Eh     change       -0.3887104E-05 Eh
   gradient norm :     0.0009789 Eh/α   predicted    -0.3077818E-05 ( -20.82%)
   displ. norm   :     0.0321334 α      lambda       -0.4627770E-05
   maximum displ.:     0.0193547 α      in ANC's #1, #2, #4, ...

   *** GEOMETRY OPTIMIZATION CONVERGED AFTER 23 ITERATIONS ***

------------------------------------------------------------------------
 total energy gain   :        -0.0127387 Eh       -7.9937 kcal/mol
 total RMSD          :         0.6581988 a0        0.3483 Å
 total power (kW/mol):        -1.4541492 (step)  -37.3856 (real)
------------------------------------------------------------------------

 ANCopt (total)                0 d,  0 h,  0 min,  0.895 sec
 optimizer setup                ...        0 min,  0.000 sec (  0.017%)
 model hessian                  ...        0 min,  0.018 sec (  2.028%)
 ANC generation                 ...        0 min,  0.002 sec (  0.207%)
 coordinate transformation      ...        0 min,  0.000 sec (  0.054%)
 single point calculation       ...        0 min,  0.863 sec ( 96.426%)
 optimization log               ...        0 min,  0.003 sec (  0.311%)
 hessian update                 ...        0 min,  0.000 sec (  0.039%)
 rational function              ...        0 min,  0.006 sec (  0.723%)

================
 final structure:
================
$coord
   -0.86013650161103   -2.79596773832715    0.12354747939066      C 
   -3.15734003959704   -1.67002718192703    0.38072023560538      N 
   -5.56312530040690   -2.94514718295034    0.41221580051518      C 
   -6.40311839265494   -3.68455860452795   -2.24719434486496      C 
   -2.93960681571159    0.99019946101100    0.45137485944183      C 
   -4.74956443809810    2.39103164610730    0.66266264435982      O 
   -0.26034056726316    1.43849486484557    0.23491982168054      C 
    0.96410079307700   -0.97725424268233    0.03609583428171      C 
    3.65385233959683   -0.53891753643963   -0.17637454572860      C 
    5.44493865954117   -1.94932302722947   -0.37905865724873      O 
    3.88164170262185    2.11776362305881   -0.08195999368213      N 
    6.30875759762166    3.31896209083423   -0.38271963567350      C 
    6.69365913625332    4.29231958270241   -3.07165761492668      C 
    1.57364738145331    3.29418500124839    0.15153900730674      C 
    1.28828863080096    5.99165769846109    0.30816533396206      C 
   -0.95760078301149    7.11955156442269    0.48236895434295      C 
   -0.69249557265375   -4.81780331605362    0.03813560868251      H 
   -6.92012428149766   -1.62153068300419    1.23439784558440      H 
   -5.42646449804479   -4.61840868461324    1.61840125847822      H 
   -6.57068292094754   -2.00727896190792   -3.42197499922654      H 
   -8.22868663492624   -4.62032206758640   -2.17033930863725      H 
   -5.04026997392499   -4.95929886764643   -3.10989542884075      H 
    7.71682613409282    1.86487453717542    0.03506518322477      H 
    6.50819811276122    4.84928724535081    0.99128637971990      H 
    6.59145261862535    2.72869246384664   -4.40055184131210      H 
    8.53887580153357    5.17754558323466   -3.23705309989818      H 
    5.24887412193592    5.66763355909881   -3.56997395371414      H 
    3.00099498030743    7.10369394536484    0.28807573931558      H 
   -2.68750397190934    6.04860666142125    0.51489272495177      H 
   -1.11291864168573    9.14364430486840    0.61081103239845      H 
$end
           -------------------------------------------------
          |                Final Singlepoint                |
           -------------------------------------------------

          ...................................................
          :                      SETUP                      :
          :.................................................:
          :  # basis functions                  78          :
          :  # atomic orbitals                  78          :
          :  # shells                           46          :
          :  # electrons                        84          :
          :  max. iterations                   250          :
          :  Hamiltonian                  GFN2-xTB          :
          :  restarted?                      false          :
          :  GBSA solvation                  false          :
          :  PC potential                    false          :
          :  electronic temp.          300.0000000     K    :
          :  accuracy                    1.0000000          :
          :  -> integral cutoff          0.2500000E+02      :
          :  -> integral neglect         0.1000000E-07      :
          :  -> SCF convergence          0.1000000E-05 Eh   :
          :  -> wf. convergence          0.1000000E-03 e    :
          :  Broyden damping             0.4000000          :
          ...................................................

 iter      E             dE          RMSdq      gap      omega  full diag
   1    -47.4894389 -0.474894E+02  0.918E-05    1.68       0.0  T
   2    -47.4894389 -0.244285E-10  0.663E-05    1.68     275.4  T
   3    -47.4894389 -0.122839E-09  0.254E-05    1.68     717.9  T

   *** convergence criteria satisfied after 3 iterations ***

         #    Occupation            Energy/Eh            Energy/eV
      -------------------------------------------------------------
         1        2.0000           -0.7041044             -19.1597
       ...           ...                  ...                  ...
        36        2.0000           -0.4535149             -12.3408
        37        2.0000           -0.4470988             -12.1662
        38        2.0000           -0.4282443             -11.6531
        39        2.0000           -0.4108095             -11.1787
        40        2.0000           -0.4020967             -10.9416
        41        2.0000           -0.3977531             -10.8234
        42        2.0000           -0.3704556             -10.0806 (HOMO)
        43                         -0.3088478              -8.4042 (LUMO)
        44                         -0.2439488              -6.6382
        45                         -0.1966960              -5.3524
        46                         -0.1419989              -3.8640
        47                         -0.1057236              -2.8769
       ...                                ...                  ...
        78                          0.7693154              20.9341
      -------------------------------------------------------------
                  HL-Gap            0.0616077 Eh            1.6764 eV
             Fermi-level           -0.3396517 Eh           -9.2424 eV

 SCC (total)                   0 d,  0 h,  0 min,  0.035 sec
 SCC setup                      ...        0 min,  0.000 sec (  0.701%)
 Dispersion                     ...        0 min,  0.000 sec (  0.778%)
 integral evaluation            ...        0 min,  0.011 sec ( 32.901%)
 zeroth order Hamiltonian       ...        0 min,  0.000 sec (  0.553%)
 iterations                     ...        0 min,  0.005 sec ( 14.157%)
 molecular gradient             ...        0 min,  0.017 sec ( 49.619%)
 printout                       ...        0 min,  0.000 sec (  1.142%)

         :::::::::::::::::::::::::::::::::::::::::::::::::::::
         ::                     SUMMARY                     ::
         :::::::::::::::::::::::::::::::::::::::::::::::::::::
         :: total energy             -46.831599525662 Eh    ::
         :: gradient norm              0.000978587632 Eh/a0 ::
         :: HOMO-LUMO gap              1.676432005945 eV    ::
         ::.................................................::
         :: SCC energy               -47.489438867367 Eh    ::
         :: -> isotropic ES            0.068717010860 Eh    ::
         :: -> anisotropic ES          0.001960104126 Eh    ::
         :: -> anisotropic XC          0.017116896014 Eh    ::
         :: -> dispersion             -0.029359956997 Eh    ::
         :: repulsion energy           0.657730133492 Eh    ::
         :: add. restraining           0.000000000000 Eh    ::
         :::::::::::::::::::::::::::::::::::::::::::::::::::::

           -------------------------------------------------
          |                Property Printout                |
           -------------------------------------------------

    * Orbital Energies and Occupations

         #    Occupation            Energy/Eh            Energy/eV
      -------------------------------------------------------------
         1        2.0000           -0.7041044             -19.1597
       ...           ...                  ...                  ...
        30        2.0000           -0.4818998             -13.1132
        31        2.0000           -0.4754883             -12.9387
        32        2.0000           -0.4731311             -12.8746
        33        2.0000           -0.4671866             -12.7128
        34        2.0000           -0.4668314             -12.7031
        35        2.0000           -0.4561518             -12.4125
        36        2.0000           -0.4535149             -12.3408
        37        2.0000           -0.4470988             -12.1662
        38        2.0000           -0.4282443             -11.6531
        39        2.0000           -0.4108095             -11.1787
        40        2.0000           -0.4020967             -10.9416
        41        2.0000           -0.3977531             -10.8234
        42        2.0000           -0.3704556             -10.0806 (HOMO)
        43                         -0.3088478              -8.4042 (LUMO)
        44                         -0.2439488              -6.6382
        45                         -0.1966960              -5.3524
        46                         -0.1419989              -3.8640
        47                         -0.1057236              -2.8769
        48                         -0.0222720              -0.6061
        49                          0.0149603               0.4071
        50                          0.0481055               1.3090
        51                          0.0970074               2.6397
        52                          0.1053837               2.8676
        53                          0.1072471               2.9183
       ...                                ...                  ...
        78                          0.7693154              20.9341
      -------------------------------------------------------------
                  HL-Gap            0.0616077 Eh            1.6764 eV
             Fermi-level           -0.3396517 Eh           -9.2424 eV

     #   Z        covCN         q      C6AA      α(0)
     1   6 C      2.960     0.034    27.230     8.559
     2   7 N      2.838    -0.061    22.418     7.032
     3   6 C      3.739     0.003    20.611     6.478
     4   6 C      3.752    -0.111    22.678     6.791
     5   6 C      2.849     0.265    22.548     7.783
     6   8 O      0.857    -0.424    22.165     6.312
     7   6 C      3.162    -0.080    29.648     8.900
     8   6 C      3.153    -0.072    29.487     8.881
     9   6 C      2.835     0.268    22.483     7.770
    10   8 O      0.857    -0.411    21.894     6.273
    11   7 N      2.833    -0.077    22.739     7.082
    12   6 C      3.739     0.005    20.576     6.472
    13   6 C      3.752    -0.110    22.661     6.789
    14   6 C      2.994     0.083    26.144     8.387
    15   6 C      2.889    -0.034    28.849     8.806
    16   6 C      2.843    -0.075    29.866     8.956
    17   1 H      0.926     0.060     2.196     2.317
    18   1 H      0.924     0.077     2.011     2.218
    19   1 H      0.924     0.048     2.351     2.398
    20   1 H      0.925     0.053     2.284     2.363
    21   1 H      0.925     0.050     2.315     2.379
    22   1 H      0.925     0.045     2.390     2.417
    23   1 H      0.924     0.077     2.007     2.216
    24   1 H      0.924     0.045     2.381     2.413
    25   1 H      0.925     0.051     2.302     2.372
    26   1 H      0.925     0.048     2.339     2.392
    27   1 H      0.925     0.044     2.398     2.422
    28   1 H      0.926     0.049     2.328     2.386
    29   1 H      0.926     0.094     1.845     2.124
    30   1 H      0.926     0.056     2.248     2.344

 Mol. C6AA /au·bohr⁶  :       9951.818030
 Mol. C8AA /au·bohr⁸  :     232369.466481
 Mol. α(0) /au        :        154.034111


Wiberg/Mayer (AO) data.
largest (>0.10) Wiberg bond orders for each atom
          total WBO             WBO to atom ...
     1  C   3.967        C    8 1.508    N    2 1.239    H   17 0.964
     2  N   3.589        C    1 1.239    C    5 1.058    C    3 0.987    O    6 0.110
     3  C   3.965        C    4 1.006    N    2 0.987    H   19 0.970    H   18 0.966
     4  C   3.990        C    3 1.006    H   20 0.987    H   22 0.987    H   21 0.984
     5  C   3.951        O    6 1.651    C    7 1.101    N    2 1.058
     6  O   2.012        C    5 1.651    N    2 0.110
     7  C   3.967        C   14 1.409    C    8 1.147    C    5 1.101
     8  C   3.971        C    1 1.508    C    7 1.147    C    9 1.075
     9  C   3.950        O   10 1.685    C    8 1.075    N   11 1.067
    10  O   2.020        C    9 1.685    N   11 0.121
    11  N   3.570        C   14 1.184    C    9 1.067    C   12 0.988    O   10 0.121
    12  C   3.965        C   13 1.006    N   11 0.988    H   24 0.967    H   23 0.964
    13  C   3.991        C   12 1.006    H   25 0.987    H   27 0.985    H   26 0.984
    14  C   3.965        C    7 1.409    N   11 1.184    C   15 1.133
    15  C   3.990        C   16 1.846    C   14 1.133    H   28 0.959
    16  C   3.977        C   15 1.846    H   30 0.978    H   29 0.962
    17  H   0.996        C    1 0.964
    18  H   0.993        C    3 0.966
    19  H   0.996        C    3 0.970
    20  H   0.997        C    4 0.987
    21  H   0.997        C    4 0.984
    22  H   0.998        C    4 0.987
    23  H   0.993        C   12 0.964
    24  H   0.997        C   12 0.967
    25  H   0.997        C   13 0.987
    26  H   0.997        C   13 0.984
    27  H   0.998        C   13 0.985
    28  H   0.997        C   15 0.959
    29  H   0.991        C   16 0.962
    30  H   0.996        C   16 0.978

molecular dipole:
                 x           y           z       tot (Debye)
 q only:       -0.170       0.415      -0.186
   full:       -0.131       0.346      -0.157       1.022
molecular quadrupole (traceless):
                xx          xy          yy          xz          yz          zz
 q only:       -5.254      21.016       7.438       1.030      -1.394      -2.183
  q+dip:       -7.151      24.634      10.751       1.313      -1.443      -3.601
   full:       -8.926      24.440       8.822       1.705      -1.671       0.104

           -------------------------------------------------
          |                Geometry Summary                 |
           -------------------------------------------------

      molecular mass/u    :      218.2548000
   center of mass at/Å    :        0.1557142       0.5325554      -0.1215804
  moments of inertia/u·Å² :        0.5566115E+03   0.1319011E+04   0.1747257E+04
rotational constants/cm⁻¹ :        0.3028618E-01   0.1278051E-01   0.9648055E-02

 * 31 selected distances

     #   Z        #   Z                                     value/Å
     1   6 C      2   7 N                                 1.3606159
     2   7 N      3   6 C                                 1.4409494
     3   6 C      4   6 C                                 1.5268190
     2   7 N      5   6 C                                 1.4129336
     5   6 C      6   8 O                                 1.2162929
     5   6 C      7   6 C                                 1.4420725
     1   6 C      8   6 C                                 1.3639238
     7   6 C      8   6 C                                 1.4370482
     8   6 C      9   6 C                                 1.4465083
     9   6 C     10   8 O                                 1.2111473
     9   6 C     11   7 N                                 1.4118978
    11   7 N     12   6 C                                 1.4418722
    12   6 C     13   6 C                                 1.5269273 (max)
     7   6 C     14   6 C                                 1.3813503
    11   7 N     14   6 C                                 1.3764029
    14   6 C     15   6 C                                 1.4377971
    15   6 C     16   6 C                                 1.3331183
     1   6 C     17   1 H                                 1.0745319 (min)
     3   6 C     18   1 H                                 1.0934127
     3   6 C     19   1 H                                 1.0939213
     4   6 C     20   1 H                                 1.0872570
     4   6 C     21   1 H                                 1.0863301
     4   6 C     22   1 H                                 1.0879158
    12   6 C     23   1 H                                 1.0936920
    12   6 C     24   1 H                                 1.0934349
    13   6 C     25   1 H                                 1.0872418
    13   6 C     26   1 H                                 1.0865293
    13   6 C     27   1 H                                 1.0879982
    15   6 C     28   1 H                                 1.0806612
    16   6 C     29   1 H                                 1.0767874
    16   6 C     30   1 H                                 1.0764007

 * 4 distinct bonds (by element types)

   Z      Z             #   av. dist./Å        max./Å        min./Å
   1 H    6 C          14     1.0861510     1.0939213     1.0745319
   6 C    6 C           9     1.4328405     1.5269273     1.3331183
   6 C    7 N           6     1.4074453     1.4418722     1.3606159
   6 C    8 O           2     1.2137201     1.2162929     1.2111473


optimized geometry written to: xtbopt.xyz


           -------------------------------------------------
          | TOTAL ENERGY              -46.831599525662 Eh   |
          | GRADIENT NORM               0.000978587632 Eh/α |
          | HOMO-LUMO GAP               1.676432005945 eV   |
           -------------------------------------------------

------------------------------------------------------------------------
 * finished run on 2021/05/19 at 11:01:13.704     
------------------------------------------------------------------------
 total:
 * wall-time:     0 d,  0 h,  0 min,  1.003 sec
 *  cpu-time:     0 d,  0 h,  0 min,  1.003 sec
 * ratio c/w:     0.999 speedup
 SCF:
 * wall-time:     0 d,  0 h,  0 min,  0.049 sec
 *  cpu-time:     0 d,  0 h,  0 min,  0.049 sec
 * ratio c/w:     1.000 speedup
 ANC optimizer:
 * wall-time:     0 d,  0 h,  0 min,  0.930 sec
 *  cpu-time:     0 d,  0 h,  0 min,  0.930 sec
 * ratio c/w:     1.000 speedup

