      -----------------------------------------------------------      
     |                   =====================                   |     
     |                           x T B                           |     
     |                   =====================                   |     
     |                         S. Grimme                         |     
     |          Mulliken Center for Theoretical Chemistry        |     
     |                    University of Bonn                     |     
     |                Version 6.2 RC2 (SAW190805)                |     
      -----------------------------------------------------------      

   This program is distributed in the hope that it will be useful,
   but WITHOUT ANY WARRANTY; without even the implied warranty of
   MERCHANTABILITY or FITNESS FOR A PARTICULAR PURPOSE.
   
   FOR NON-COMMERCIAL, ACADEMIA USE ONLY.
   
   Cite this work as:
   * S. Grimme, C. Bannwarth, P. Shushkov, J. Chem. Theory Comput., 2017,
     13, 1989-2009. DOI: 10.1021/acs.jctc.7b00118
   * C. Bannwarth, S. Ehlert and S. Grimme., J. Chem. Theory Comput., 2019,
     15, 1652-1671. DOI: 10.1021/acs.jctc.8b01176
   * P. Pracht, E. Caldeweyher, S. Ehlert, S. Grimme, ChemRxiv, 2019, preprint.
     DOI: 10.26434/chemrxiv.8326202.v1
   
   for DFT-D4:
   * E. Caldeweyher, C. Bannwarth and S. Grimme, J. Chem. Phys., 2017,
     147, 034112. DOI: 10.1063/1.4993215
   * E. Caldeweyher, S. Ehlert, A. Hansen, H. Neugebauer, S. Spicher,
     C. Bannwarth and S. Grimme, J. Chem. Phys., 2019, 150, 154122.
     DOI: 10.1063/1.5090222
   
   for sTDA-xTB:
   * S. Grimme and C. Bannwarth, J. Chem. Phys., 2016, 145, 054103.
     DOI: 10.1063/1.4959605
   
   in the mass-spec context:
   * V. Asgeirsson, C. Bauer and S. Grimme, Chem. Sci., 2017, 8, 4879.
     DOI: 10.1039/c7sc00601b
   
   for metadynamics refer to:
   * S. Grimme, J. Chem. Theory Comput., 2019, 155, 2847-2862
     DOI: 10.1021/acs.jctc.9b00143
   
   with help from (in alphabetical order)
   C. Bannwarth, F. Bohle, G. Brandenburg, E. Caldeweyher, M. Checinski,
   S. Dohm, S. Ehlert, S. Ehrlich, F. März, H. Neugebauer, J. Pisarek,
   P. Pracht, P. Shushkov, and S. Spicher.
   
 * started run on 2021/05/19 at 10:58:55.142     

           -------------------------------------------------
          |                Calculation Setup                |
           -------------------------------------------------

          program call               : /ihome/ghutchison/geoffh/xtb/xtb 90.xyz -opt
          hostname                   : smp-n58
          coordinate file            : 90.xyz
          omp threads                :                     1
          number of atoms            :                    27
          number of electrons        :                    78
          charge                     :                     0
          spin                       :                   0.0
          first test random number   :      0.43130483974745


########################################################################
# WARNING! Please study the warnings concerning your input carefully
#  - the use of '-opt' is discouraged, please use '--opt' next time
########################################################################

           ------------------------------------------------- 
          |                 G F N 2 - x T B                 |
          | Geometry, Frequencies, Noncovalent interactions |
          |            JCTC 2019 parametrisation            |
           ------------------------------------------------- 
             KAB for C  - Si     :                1.0500
             KAB for H  - Pd     :                0.9500
             k(s)              :                1.8500
             k(p)              :                2.2300
             k(d)              :                2.2300
             k(f)              :                2.0000
             kEN (H0ij)        :               -2.0000
             D4 a1             :                0.5200
             D4 a2             :                5.0000
             D4 s6             :                1.0000
             D4 s8             :                2.7000
             D4 s9             :                5.0000
             alphaj            :                2.0000

  Z AO/shell   Hii/eV     exponent
  1     Wed Apr 25 08:07:45 CEST 2018   EN: 2.200 GM2: 0.406  GM3: 0.0800  RAES: 1.40
     1s    -10.707211    1.230000
  6     Wed Apr 25 08:07:45 CEST 2018   EN: 2.550 GM2: 0.538  GM3: 0.1500  RAES: 3.00
     2s    -13.970922    2.096432
     2p    -10.063292    1.800000
  8     Wed Apr 25 08:07:45 CEST 2018   EN: 3.440 GM2: 0.452  GM3:-0.0517  RAES: 1.80
     2s    -20.229985    2.439742
     2p    -15.503117    2.137023
 16     Tue Apr 24 11:44:34 CEST 2018   EN: 2.580 GM2: 0.340  GM3:-0.0502  RAES: 3.10
     3s    -20.029654    1.981333
     3p    -11.377694    2.025643
     3d     -0.420282    1.702555

           ------------------------------------------------- 
          |        Self-Consistent Charge Iterations        |
           ------------------------------------------------- 

          ...................................................
          :                      SETUP                      :
          :.................................................:
          :  # basis functions                  78          :
          :  # atomic orbitals                  77          :
          :  # shells                           43          :
          :  # electrons                        78          :
          :  max. iterations                   250          :
          :  Hamiltonian                  GFN2-xTB          :
          :  restarted?                      false          :
          :  GBSA solvation                  false          :
          :  PC potential                    false          :
          :  electronic temp.          300.0000000     K    :
          :  accuracy                    1.0000000          :
          :  -> integral cutoff          0.2500000E+02      :
          :  -> integral neglect         0.1000000E-07      :
          :  -> SCF convergence          0.1000000E-05 Eh   :
          :  -> wf. convergence          0.1000000E-03 e    :
          :  Broyden damping             0.4000000          :
          ...................................................

 iter      E             dE          RMSdq      gap      omega  full diag
   1    -43.6629576 -0.436630E+02  0.471E+00    1.84       0.0  T
   2    -43.6994535 -0.364959E-01  0.268E+00    1.84       1.0  T
   3    -43.6778579  0.215955E-01  0.120E+00    1.91       1.0  T
   4    -43.6998322 -0.219743E-01  0.573E-01    1.82       1.0  T
   5    -43.7050881 -0.525587E-02  0.208E-01    1.84       1.0  T
   6    -43.7058036 -0.715515E-03  0.109E-01    1.84       1.0  T
   7    -43.7059497 -0.146106E-03  0.423E-02    1.84       1.0  T
   8    -43.7059723 -0.226070E-04  0.165E-02    1.84       1.2  T
   9    -43.7059736 -0.123224E-05  0.695E-03    1.84       2.8  T
  10    -43.7059736 -0.154039E-07  0.310E-03    1.84       6.2  T
  11    -43.7059737 -0.152179E-06  0.149E-03    1.84      12.9  T
  12    -43.7059737 -0.145686E-07  0.819E-04    1.84      23.5  T
  13    -43.7059737 -0.473815E-08  0.224E-04    1.84      86.0  T

   *** convergence criteria satisfied after 13 iterations ***

         #    Occupation            Energy/Eh            Energy/eV
      -------------------------------------------------------------
         1        2.0000           -0.7273684             -19.7927
       ...           ...                  ...                  ...
        33        2.0000           -0.4374538             -11.9037
        34        2.0000           -0.4333318             -11.7916
        35        2.0000           -0.4300302             -11.7017
        36        2.0000           -0.4157822             -11.3140
        37        2.0000           -0.4025073             -10.9528
        38        2.0000           -0.3708516             -10.0914
        39        2.0000           -0.3492119              -9.5025 (HOMO)
        40                         -0.2816247              -7.6634 (LUMO)
        41                         -0.2246466              -6.1129
        42                         -0.1987605              -5.4085
        43                         -0.1916020              -5.2138
        44                         -0.1617269              -4.4008
       ...                                ...                  ...
        77                          0.7448379              20.2681
      -------------------------------------------------------------
                  HL-Gap            0.0675872 Eh            1.8391 eV
             Fermi-level           -0.3154183 Eh           -8.5830 eV

 SCC (total)                   0 d,  0 h,  0 min,  0.043 sec
 SCC setup                      ...        0 min,  0.000 sec (  0.671%)
 Dispersion                     ...        0 min,  0.000 sec (  0.947%)
 integral evaluation            ...        0 min,  0.011 sec ( 24.580%)
 zeroth order Hamiltonian       ...        0 min,  0.000 sec (  0.443%)
 iterations                     ...        0 min,  0.016 sec ( 37.681%)
 molecular gradient             ...        0 min,  0.015 sec ( 34.619%)
 printout                       ...        0 min,  0.000 sec (  0.945%)

         :::::::::::::::::::::::::::::::::::::::::::::::::::::
         ::                     SUMMARY                     ::
         :::::::::::::::::::::::::::::::::::::::::::::::::::::
         :: total energy             -43.130851883788 Eh    ::
         :: gradient norm              0.099915455733 Eh/a0 ::
         :: HOMO-LUMO gap              1.839141115390 eV    ::
         ::.................................................::
         :: SCC energy               -43.705973741127 Eh    ::
         :: -> isotropic ES            0.031139665529 Eh    ::
         :: -> anisotropic ES          0.004368706872 Eh    ::
         :: -> anisotropic XC          0.015004352074 Eh    ::
         :: -> dispersion             -0.027918376868 Eh    ::
         :: repulsion energy           0.575096651119 Eh    ::
         :: add. restraining           0.000000000000 Eh    ::
         :::::::::::::::::::::::::::::::::::::::::::::::::::::

      ----------------------------------------------------------- 
     |                   =====================                   |
     |                        A N C O P T                        |
     |                   =====================                   |
     |               Approximate Normal Coordinate               |
     |                Rational Function Optimizer                |
      ----------------------------------------------------------- 

          ...................................................
          :                      SETUP                      :
          :.................................................:
          :   optimization level            normal          :
          :   max. optcycles                   200          :
          :   ANC micro-cycles                  20          :
          :   degrees of freedom                75          :
          :.................................................:
          :   RF solver                   davidson          :
          :   input Hessian                  false          :
          :   write xtbopt.log                true          :
          :   linear?                        false          :
          :   energy convergence         0.5000000E-05 Eh   :
          :   grad. convergence          0.1000000E-02 Eh/α :
          :   maximium RF displ.         2.0000000          :
          :   Hlow (freq-cutoff)         0.5000000E-02      :
          :   Hmax (freq-cutoff)         5.0000000          :
          :   S6 in model hess.         20.0000000          :
          ...................................................

generating ANC from model Hessian ...
Using Lindh-Hessian (1995)
 Shifting diagonal of input Hessian by   4.318470362608488E-003
 Lowest  eigenvalues of input Hessian
   -0.000000   -0.000000   -0.000000   -0.000000    0.000000    0.000000
    0.005000    0.006271    0.006864    0.007392    0.008500    0.008665
    0.009321    0.010056    0.015031    0.015300    0.016747    0.021553
 Highest eigenvalues
    1.747075    1.775857    1.835961    1.960519    1.994141    2.073931
 

........................................................................
.............................. CYCLE    1 ..............................
........................................................................
   1    -43.7059737 -0.437060E+02  0.111E-04    1.84       0.0  T
   2    -43.7059737 -0.537952E-10  0.817E-05    1.84     235.5  T
   3    -43.7059737 -0.101501E-09  0.454E-05    1.84     423.8  T
     SCC iter.                  ...        0 min,  0.004 sec
     gradient                   ...        0 min,  0.014 sec
 * total energy  :   -43.1308519 Eh     change       -0.2862611E-07 Eh
   gradient norm :     0.0999153 Eh/α   predicted     0.0000000E+00 (-100.00%)
   displ. norm   :     0.3267779 α      lambda       -0.1806059E-01
   maximum displ.:     0.1494268 α      in ANC's #33, #32, #24, ...

........................................................................
.............................. CYCLE    2 ..............................
........................................................................
   1    -43.7385194 -0.437385E+02  0.255E-01    1.90       0.0  T
   2    -43.7385698 -0.504812E-04  0.160E-01    1.89       1.0  T
   3    -43.7384760  0.938377E-04  0.117E-01    1.90       1.0  T
   4    -43.7386737 -0.197660E-03  0.433E-02    1.89       1.0  T
   5    -43.7387140 -0.403605E-04  0.129E-02    1.89       1.5  T
   6    -43.7387163 -0.232560E-05  0.434E-03    1.89       4.4  T
   7    -43.7387165 -0.186102E-06  0.209E-03    1.89       9.2  T
     SCC iter.                  ...        0 min,  0.009 sec
     gradient                   ...        0 min,  0.013 sec
 * total energy  :   -43.1433916 Eh     change       -0.1253972E-01 Eh
   gradient norm :     0.0490619 Eh/α   predicted    -0.9994585E-02 ( -20.30%)
   displ. norm   :     0.2461451 α      lambda       -0.5227201E-02
   maximum displ.:     0.0928445 α      in ANC's #5, #33, #16, ...

........................................................................
.............................. CYCLE    3 ..............................
........................................................................
   1    -43.7528900 -0.437529E+02  0.204E-01    1.97       0.0  T
   2    -43.7529333 -0.432844E-04  0.129E-01    1.96       1.0  T
   3    -43.7528960  0.373003E-04  0.875E-02    1.97       1.0  T
   4    -43.7530018 -0.105822E-03  0.244E-02    1.96       1.0  T
   5    -43.7530144 -0.125670E-04  0.775E-03    1.96       2.5  T
   6    -43.7530149 -0.535543E-06  0.359E-03    1.96       5.4  T
   7    -43.7530151 -0.218068E-06  0.141E-03    1.96      13.6  T
     SCC iter.                  ...        0 min,  0.008 sec
     gradient                   ...        0 min,  0.014 sec
 * total energy  :   -43.1462939 Eh     change       -0.2902267E-02 Eh
   gradient norm :     0.0131707 Eh/α   predicted    -0.2771958E-02 (  -4.49%)
   displ. norm   :     0.1780407 α      lambda       -0.5299227E-03
   maximum displ.:     0.1156268 α      in ANC's #5, #2, #4, ...

........................................................................
.............................. CYCLE    4 ..............................
........................................................................
   1    -43.7514427 -0.437514E+02  0.118E-01    1.98       0.0  T
   2    -43.7514511 -0.832172E-05  0.725E-02    1.98       1.0  T
   3    -43.7514195  0.315298E-04  0.423E-02    1.98       1.0  T
   4    -43.7514582 -0.386902E-04  0.785E-03    1.98       2.5  T
   5    -43.7514589 -0.633651E-06  0.504E-03    1.98       3.8  T
   6    -43.7514594 -0.513784E-06  0.209E-03    1.98       9.2  T
   7    -43.7514594 -0.428127E-07  0.101E-03    1.98      19.1  T
     SCC iter.                  ...        0 min,  0.009 sec
     gradient                   ...        0 min,  0.015 sec
 * total energy  :   -43.1467078 Eh     change       -0.4138691E-03 Eh
   gradient norm :     0.0067241 Eh/α   predicted    -0.2733626E-03 ( -33.95%)
   displ. norm   :     0.2827696 α      lambda       -0.5303352E-03
   maximum displ.:     0.1664054 α      in ANC's #5, #2, #4, ...

........................................................................
.............................. CYCLE    5 ..............................
........................................................................
   1    -43.7492225 -0.437492E+02  0.196E-01    1.99       0.0  T
   2    -43.7492391 -0.166257E-04  0.120E-01    1.99       1.0  T
   3    -43.7491477  0.914360E-04  0.679E-02    2.00       1.0  T
   4    -43.7492532 -0.105481E-03  0.142E-02    1.99       1.4  T
   5    -43.7492555 -0.234654E-05  0.900E-03    1.99       2.1  T
   6    -43.7492572 -0.165635E-05  0.290E-03    1.99       6.6  T
   7    -43.7492572 -0.352374E-07  0.156E-03    1.99      12.3  T
     SCC iter.                  ...        0 min,  0.009 sec
     gradient                   ...        0 min,  0.015 sec
 * total energy  :   -43.1470689 Eh     change       -0.3610963E-03 Eh
   gradient norm :     0.0083470 Eh/α   predicted    -0.2863747E-03 ( -20.69%)
   displ. norm   :     0.2052918 α      lambda       -0.2586193E-03
   maximum displ.:     0.1146965 α      in ANC's #5, #2, #4, ...

........................................................................
.............................. CYCLE    6 ..............................
........................................................................
   1    -43.7492595 -0.437493E+02  0.143E-01    2.00       0.0  T
   2    -43.7492658 -0.625690E-05  0.869E-02    2.00       1.0  T
   3    -43.7492212  0.445775E-04  0.464E-02    2.00       1.0  T
   4    -43.7492712 -0.499918E-04  0.105E-02    2.00       1.8  T
   5    -43.7492724 -0.116562E-05  0.669E-03    2.00       2.9  T
   6    -43.7492732 -0.858098E-06  0.180E-03    2.00      10.7  T
   7    -43.7492732 -0.894659E-08  0.102E-03    2.00      18.8  T
     SCC iter.                  ...        0 min,  0.009 sec
     gradient                   ...        0 min,  0.014 sec
 * total energy  :   -43.1472638 Eh     change       -0.1949053E-03 Eh
   gradient norm :     0.0100310 Eh/α   predicted    -0.1347601E-03 ( -30.86%)
   displ. norm   :     0.2326548 α      lambda       -0.2996860E-03
   maximum displ.:     0.1412152 α      in ANC's #2, #5, #4, ...

........................................................................
.............................. CYCLE    7 ..............................
........................................................................
   1    -43.7507872 -0.437508E+02  0.161E-01    2.00       0.0  T
   2    -43.7507936 -0.641588E-05  0.967E-02    2.00       1.0  T
   3    -43.7507561  0.375099E-04  0.434E-02    2.00       1.0  T
   4    -43.7507977 -0.416202E-04  0.121E-02    2.00       1.6  T
   5    -43.7507985 -0.848779E-06  0.814E-03    2.00       2.4  T
   6    -43.7507999 -0.132129E-05  0.158E-03    2.00      12.2  T
   7    -43.7507999 -0.961150E-08  0.926E-04    2.00      20.8  T
     SCC iter.                  ...        0 min,  0.009 sec
     gradient                   ...        0 min,  0.015 sec
 * total energy  :   -43.1474816 Eh     change       -0.2178104E-03 Eh
   gradient norm :     0.0079516 Eh/α   predicted    -0.1579540E-03 ( -27.48%)
   displ. norm   :     0.2342873 α      lambda       -0.2328050E-03
   maximum displ.:     0.1474535 α      in ANC's #2, #4, #5, ...

........................................................................
.............................. CYCLE    8 ..............................
........................................................................
   1    -43.7521525 -0.437522E+02  0.155E-01    1.99       0.0  T
   2    -43.7521572 -0.464305E-05  0.929E-02    1.99       1.0  T
   3    -43.7521409  0.162974E-04  0.307E-02    1.99       1.0  T
   4    -43.7521593 -0.183867E-04  0.107E-02    1.99       1.8  T
   5    -43.7521598 -0.562532E-06  0.656E-03    1.99       2.9  T
   6    -43.7521607 -0.899206E-06  0.111E-03    1.99      17.3  T
   7    -43.7521607 -0.243209E-08  0.613E-04    1.99      31.4  T
     SCC iter.                  ...        0 min,  0.009 sec
     gradient                   ...        0 min,  0.015 sec
 * total energy  :   -43.1476354 Eh     change       -0.1537853E-03 Eh
   gradient norm :     0.0048529 Eh/α   predicted    -0.1227963E-03 ( -20.15%)
   displ. norm   :     0.1831884 α      lambda       -0.1394075E-03
   maximum displ.:     0.1238635 α      in ANC's #2, #1, #4, ...

........................................................................
.............................. CYCLE    9 ..............................
........................................................................
   1    -43.7532257 -0.437532E+02  0.112E-01    1.98       0.0  T
   2    -43.7532281 -0.242393E-05  0.659E-02    1.98       1.0  T
   3    -43.7532259  0.226946E-05  0.153E-02    1.98       1.3  T
   4    -43.7532288 -0.288243E-05  0.804E-03    1.98       2.4  T
   5    -43.7532291 -0.343657E-06  0.397E-03    1.98       4.8  T
   6    -43.7532295 -0.386348E-06  0.970E-04    1.98      19.8  T
   7    -43.7532295 -0.800327E-08  0.542E-04    1.98      35.5  T
     SCC iter.                  ...        0 min,  0.009 sec
     gradient                   ...        0 min,  0.015 sec
 * total energy  :   -43.1477191 Eh     change       -0.8372629E-04 Eh
   gradient norm :     0.0032265 Eh/α   predicted    -0.7204564E-04 ( -13.95%)
   displ. norm   :     0.1688336 α      lambda       -0.6445032E-04
   maximum displ.:     0.1142546 α      in ANC's #2, #1, #4, ...

........................................................................
.............................. CYCLE   10 ..............................
........................................................................
   1    -43.7524438 -0.437524E+02  0.101E-01    1.98       0.0  T
   2    -43.7524456 -0.179090E-05  0.596E-02    1.98       1.0  T
   3    -43.7524456  0.235800E-07  0.956E-03    1.98       2.0  T
   4    -43.7524457 -0.105723E-06  0.710E-03    1.98       2.7  T
   5    -43.7524464 -0.728577E-06  0.230E-03    1.98       8.4  T
   6    -43.7524466 -0.116789E-06  0.796E-04    1.98      24.2  T
   7    -43.7524466 -0.548744E-08  0.388E-04    1.98      49.6  T
     SCC iter.                  ...        0 min,  0.008 sec
     gradient                   ...        0 min,  0.015 sec
 * total energy  :   -43.1477617 Eh     change       -0.4264779E-04 Eh
   gradient norm :     0.0034666 Eh/α   predicted    -0.3314402E-04 ( -22.28%)
   displ. norm   :     0.1450099 α      lambda       -0.7532614E-04
   maximum displ.:     0.0934212 α      in ANC's #1, #2, #8, ...

........................................................................
.............................. CYCLE   11 ..............................
........................................................................
   1    -43.7533095 -0.437533E+02  0.722E-02    1.98       0.0  T
   2    -43.7533106 -0.108148E-05  0.409E-02    1.98       1.0  T
   3    -43.7533091  0.150602E-05  0.102E-02    1.98       1.9  T
   4    -43.7533107 -0.161617E-05  0.517E-03    1.98       3.7  T
   5    -43.7533109 -0.192306E-06  0.296E-03    1.98       6.5  T
   6    -43.7533111 -0.186248E-06  0.783E-04    1.98      24.6  T
   7    -43.7533111 -0.755459E-08  0.389E-04    1.98      49.4  T
     SCC iter.                  ...        0 min,  0.008 sec
     gradient                   ...        0 min,  0.014 sec
 * total energy  :   -43.1477918 Eh     change       -0.3005515E-04 Eh
   gradient norm :     0.0039705 Eh/α   predicted    -0.3845632E-04 (  27.95%)
   displ. norm   :     0.1163173 α      lambda       -0.5088352E-04
   maximum displ.:     0.0800353 α      in ANC's #2, #1, #15, ...

........................................................................
.............................. CYCLE   12 ..............................
........................................................................
   1    -43.7525493 -0.437525E+02  0.636E-02    1.98       0.0  T
   2    -43.7525502 -0.866964E-06  0.362E-02    1.98       1.0  T
   3    -43.7525500  0.175108E-06  0.724E-03    1.98       2.7  T
   4    -43.7525502 -0.253465E-06  0.465E-03    1.98       4.1  T
   5    -43.7525504 -0.162300E-06  0.222E-03    1.98       8.7  T
   6    -43.7525505 -0.113490E-06  0.486E-04    1.98      39.6  T
   7    -43.7525505 -0.194784E-08  0.280E-04    1.98      68.8  T
     SCC iter.                  ...        0 min,  0.009 sec
     gradient                   ...        0 min,  0.015 sec
 * total energy  :   -43.1478277 Eh     change       -0.3587367E-04 Eh
   gradient norm :     0.0018885 Eh/α   predicted    -0.2578635E-04 ( -28.12%)
   displ. norm   :     0.1745503 α      lambda        0.2323301E-05
   maximum displ.:     0.1200527 α      in ANC's #2, #1, #15, ...

........................................................................
.............................. CYCLE   13 ..............................
........................................................................
   1    -43.7509963 -0.437510E+02  0.952E-02    1.99       0.0  T
   2    -43.7509983 -0.195531E-05  0.542E-02    1.99       1.0  T
   3    -43.7509975  0.742471E-06  0.117E-02    1.99       1.6  T
   4    -43.7509985 -0.978879E-06  0.712E-03    1.99       2.7  T
   5    -43.7509988 -0.316158E-06  0.348E-03    1.99       5.5  T
   6    -43.7509991 -0.278685E-06  0.771E-04    1.99      25.0  T
   7    -43.7509991 -0.552610E-08  0.443E-04    1.99      43.4  T
     SCC iter.                  ...        0 min,  0.009 sec
     gradient                   ...        0 min,  0.016 sec
 * total energy  :   -43.1478168 Eh     change        0.1084553E-04 Eh
   gradient norm :     0.0045098 Eh/α   predicted     0.1177346E-05 ( -89.14%)
   displ. norm   :     0.0613059 α      lambda       -0.4704570E-04
   maximum displ.:     0.0365408 α      in ANC's #2, #4, #5, ...

........................................................................
.............................. CYCLE   14 ..............................
........................................................................
   1    -43.7522782 -0.437523E+02  0.408E-02    1.99       0.0  T
   2    -43.7522785 -0.327644E-06  0.249E-02    1.99       1.0  T
   3    -43.7522781  0.397182E-06  0.526E-03    1.99       3.7  T
   4    -43.7522787 -0.560441E-06  0.196E-03    1.99       9.8  T
   5    -43.7522787 -0.914475E-08  0.143E-03    1.99      13.5  T
     SCC iter.                  ...        0 min,  0.007 sec
     gradient                   ...        0 min,  0.013 sec
 * total energy  :   -43.1478508 Eh     change       -0.3400771E-04 Eh
   gradient norm :     0.0025891 Eh/α   predicted    -0.2361227E-04 ( -30.57%)
   displ. norm   :     0.0563555 α      lambda       -0.3173313E-04
   maximum displ.:     0.0316004 α      in ANC's #4, #1, #5, ...

........................................................................
.............................. CYCLE   15 ..............................
........................................................................
   1    -43.7530472 -0.437530E+02  0.360E-02    1.99       0.0  T
   2    -43.7530476 -0.361300E-06  0.214E-02    1.99       1.0  T
   3    -43.7530468  0.818813E-06  0.725E-03    1.99       2.7  T
   4    -43.7530477 -0.938799E-06  0.273E-03    1.99       7.1  T
   5    -43.7530477 -0.312323E-07  0.193E-03    1.99      10.0  T
   6    -43.7530478 -0.745924E-07  0.360E-04    1.99      53.5  T
   7    -43.7530478 -0.939806E-09  0.189E-04    1.99     102.0  T
     SCC iter.                  ...        0 min,  0.008 sec
     gradient                   ...        0 min,  0.016 sec
 * total energy  :   -43.1478717 Eh     change       -0.2085101E-04 Eh
   gradient norm :     0.0013467 Eh/α   predicted    -0.1592286E-04 ( -23.64%)
   displ. norm   :     0.0973381 α      lambda       -0.1390239E-04
   maximum displ.:     0.0689841 α      in ANC's #1, #4, #5, ...

........................................................................
.............................. CYCLE   16 ..............................
........................................................................
   1    -43.7535194 -0.437535E+02  0.502E-02    1.99       0.0  T
   2    -43.7535199 -0.589866E-06  0.285E-02    1.99       1.0  T
   3    -43.7535198  0.124760E-06  0.573E-03    1.99       3.4  T
   4    -43.7535201 -0.228368E-06  0.330E-03    1.99       5.8  T
   5    -43.7535201 -0.696438E-07  0.160E-03    1.99      12.0  T
   6    -43.7535202 -0.585182E-07  0.466E-04    1.99      41.3  T
   7    -43.7535202 -0.234940E-08  0.234E-04    1.99      82.3  T
     SCC iter.                  ...        0 min,  0.009 sec
     gradient                   ...        0 min,  0.016 sec
 * total energy  :   -43.1478851 Eh     change       -0.1340158E-04 Eh
   gradient norm :     0.0015377 Eh/α   predicted    -0.6981123E-05 ( -47.91%)
   displ. norm   :     0.0547308 α      lambda       -0.7924636E-05
   maximum displ.:     0.0443470 α      in ANC's #1, #2, #6, ...

........................................................................
.............................. CYCLE   17 ..............................
........................................................................
   1    -43.7530761 -0.437531E+02  0.248E-02    1.99       0.0  T
   2    -43.7530762 -0.136534E-06  0.137E-02    1.99       1.4  T
   3    -43.7530762  0.903375E-08  0.258E-03    1.99       7.4  T
   4    -43.7530762 -0.257120E-07  0.151E-03    1.99      12.7  T
   5    -43.7530762 -0.172185E-07  0.635E-04    1.99      30.3  T
   6    -43.7530763 -0.893115E-08  0.220E-04    1.99      87.5  T
     SCC iter.                  ...        0 min,  0.007 sec
     gradient                   ...        0 min,  0.014 sec
 * total energy  :   -43.1478945 Eh     change       -0.9386019E-05 Eh
   gradient norm :     0.0009248 Eh/α   predicted    -0.3967990E-05 ( -57.72%)
   displ. norm   :     0.0550789 α      lambda       -0.7422767E-05
   maximum displ.:     0.0428426 α      in ANC's #1, #8, #2, ...

........................................................................
.............................. CYCLE   18 ..............................
........................................................................
   1    -43.7527727 -0.437528E+02  0.255E-02    1.99       0.0  T
   2    -43.7527728 -0.127308E-06  0.145E-02    1.99       1.3  T
   3    -43.7527724  0.392244E-06  0.481E-03    1.99       4.0  T
   4    -43.7527728 -0.421800E-06  0.196E-03    1.99       9.8  T
   5    -43.7527729 -0.145924E-07  0.126E-03    1.99      15.3  T
   6    -43.7527729 -0.348415E-07  0.226E-04    1.99      85.0  T
   7    -43.7527729 -0.359293E-09  0.136E-04    1.99     141.6  T
     SCC iter.                  ...        0 min,  0.009 sec
     gradient                   ...        0 min,  0.014 sec
 * total energy  :   -43.1479022 Eh     change       -0.7721738E-05 Eh
   gradient norm :     0.0009991 Eh/α   predicted    -0.3719492E-05 ( -51.83%)
   displ. norm   :     0.0539611 α      lambda        0.5027464E-06
   maximum displ.:     0.0413952 α      in ANC's #1, #8, #2, ...

........................................................................
.............................. CYCLE   19 ..............................
........................................................................
   1    -43.7524308 -0.437524E+02  0.251E-02    1.99       0.0  T
   2    -43.7524309 -0.122803E-06  0.143E-02    1.99       1.3  T
   3    -43.7524305  0.402412E-06  0.483E-03    1.99       4.0  T
   4    -43.7524310 -0.432715E-06  0.193E-03    1.99      10.0  T
   5    -43.7524310 -0.141457E-07  0.124E-03    1.99      15.6  T
   6    -43.7524310 -0.336676E-07  0.225E-04    1.99      85.6  T
   7    -43.7524310 -0.386649E-09  0.133E-04    1.99     144.6  T
     SCC iter.                  ...        0 min,  0.009 sec
     gradient                   ...        0 min,  0.016 sec
 * total energy  :   -43.1479031 Eh     change       -0.8578139E-06 Eh
   gradient norm :     0.0021030 Eh/α   predicted     0.2470479E-06 (-128.80%)
   displ. norm   :     0.0364208 α      lambda        0.8523412E-05
   maximum displ.:     0.0281795 α      in ANC's #1, #8, #2, ...

........................................................................
.............................. CYCLE   20 ..............................
........................................................................
   1    -43.7521743 -0.437522E+02  0.169E-02    1.99       0.0  T
   2    -43.7521744 -0.554105E-07  0.959E-03    1.99       2.0  T
   3    -43.7521742  0.177912E-06  0.322E-03    1.99       6.0  T
   4    -43.7521744 -0.191041E-06  0.130E-03    1.99      14.8  T
   5    -43.7521744 -0.669989E-08  0.826E-04    1.99      23.3  T
   6    -43.7521744 -0.149997E-07  0.151E-04    1.99     127.7  T
     SCC iter.                  ...        0 min,  0.008 sec
     gradient                   ...        0 min,  0.015 sec
 * total energy  :   -43.1479000 Eh     change        0.3086594E-05 Eh
   gradient norm :     0.0029206 Eh/α   predicted     0.4265658E-05 (  38.20%)
   displ. norm   :     0.0365506 α      lambda        0.1280555E-04
   maximum displ.:     0.0283481 α      in ANC's #1, #8, #2, ...
 * RMSD in coord.:     0.3842709 α      energy gain  -0.1704808E-01 Eh

generating ANC from model Hessian ...
Using Lindh-Hessian (1995)
 Shifting diagonal of input Hessian by   4.271604851370554E-003
 Lowest  eigenvalues of input Hessian
   -0.000000   -0.000000    0.000000    0.000000    0.000000    0.000000
    0.005000    0.006437    0.007424    0.007686    0.008455    0.009059
    0.009343    0.010544    0.015497    0.015778    0.019085    0.022322
 Highest eigenvalues
    1.797543    1.846070    1.942042    2.000018    2.036257    2.177406
 

........................................................................
.............................. CYCLE   21 ..............................
........................................................................
   1    -43.7518961 -0.437519E+02  0.169E-02    1.98       0.0  T
   2    -43.7518961 -0.562359E-07  0.961E-03    1.98       2.0  T
   3    -43.7518960  0.171761E-06  0.321E-03    1.98       6.0  T
   4    -43.7518962 -0.184075E-06  0.131E-03    1.98      14.7  T
   5    -43.7518962 -0.719081E-08  0.826E-04    1.98      23.3  T
   6    -43.7518962 -0.150372E-07  0.145E-04    1.98     132.6  T
     SCC iter.                  ...        0 min,  0.007 sec
     gradient                   ...        0 min,  0.015 sec
 * total energy  :   -43.1478939 Eh     change        0.6081335E-05 Eh
   gradient norm :     0.0037588 Eh/α   predicted     0.0000000E+00 (-100.00%)
   displ. norm   :     0.0310515 α      lambda       -0.4166087E-04
   maximum displ.:     0.0203720 α      in ANC's #1, #8, #18, ...

........................................................................
.............................. CYCLE   22 ..............................
........................................................................
   1    -43.7526923 -0.437527E+02  0.186E-02    1.99       0.0  T
   2    -43.7526924 -0.848961E-07  0.109E-02    1.99       1.8  T
   3    -43.7526920  0.450793E-06  0.479E-03    1.99       4.0  T
   4    -43.7526925 -0.499324E-06  0.138E-03    1.99      14.0  T
   5    -43.7526925 -0.312919E-08  0.104E-03    1.99      18.5  T
   6    -43.7526925 -0.234312E-07  0.222E-04    1.99      86.6  T
   7    -43.7526925 -0.349367E-09  0.118E-04    1.99     162.7  T
     SCC iter.                  ...        0 min,  0.008 sec
     gradient                   ...        0 min,  0.014 sec
 * total energy  :   -43.1479154 Eh     change       -0.2150309E-04 Eh
   gradient norm :     0.0012739 Eh/α   predicted    -0.2085142E-04 (  -3.03%)
   displ. norm   :     0.0258504 α      lambda       -0.9805292E-05
   maximum displ.:     0.0162255 α      in ANC's #1, #17, #3, ...

........................................................................
.............................. CYCLE   23 ..............................
........................................................................
   1    -43.7532124 -0.437532E+02  0.181E-02    1.99       0.0  T
   2    -43.7532125 -0.109865E-06  0.108E-02    1.99       1.8  T
   3    -43.7532120  0.484096E-06  0.479E-03    1.99       4.0  T
   4    -43.7532125 -0.563832E-06  0.987E-04    1.99      19.5  T
   5    -43.7532125  0.321846E-08  0.741E-04    1.99      26.0  T
     SCC iter.                  ...        0 min,  0.006 sec
     gradient                   ...        0 min,  0.014 sec
 * total energy  :   -43.1479175 Eh     change       -0.2076412E-05 Eh
   gradient norm :     0.0012354 Eh/α   predicted    -0.4905001E-05 ( 136.22%)
   displ. norm   :     0.0148274 α      lambda       -0.5282891E-05
   maximum displ.:     0.0099439 α      in ANC's #1, #3, #2, ...

........................................................................
.............................. CYCLE   24 ..............................
........................................................................
   1    -43.7529871 -0.437530E+02  0.841E-03    1.99       0.0  T
   2    -43.7529872 -0.120580E-07  0.504E-03    1.99       3.8  T
   3    -43.7529870  0.196272E-06  0.306E-03    1.99       6.3  T
   4    -43.7529872 -0.210128E-06  0.585E-04    1.99      32.9  T
   5    -43.7529872 -0.432426E-08  0.314E-04    1.99      61.2  T
     SCC iter.                  ...        0 min,  0.007 sec
     gradient                   ...        0 min,  0.016 sec
 * total energy  :   -43.1479226 Eh     change       -0.5149067E-05 Eh
   gradient norm :     0.0004114 Eh/α   predicted    -0.2642302E-05 ( -48.68%)
   displ. norm   :     0.0255663 α      lambda       -0.2392512E-05
   maximum displ.:     0.0191995 α      in ANC's #1, #3, #2, ...

........................................................................
.............................. CYCLE   25 ..............................
........................................................................
   1    -43.7528358 -0.437528E+02  0.146E-02    1.98       0.0  T
   2    -43.7528358 -0.329496E-07  0.874E-03    1.98       2.2  T
   3    -43.7528355  0.308254E-06  0.391E-03    1.98       4.9  T
   4    -43.7528359 -0.332973E-06  0.987E-04    1.98      19.5  T
   5    -43.7528359 -0.779090E-08  0.578E-04    1.98      33.3  T
     SCC iter.                  ...        0 min,  0.006 sec
     gradient                   ...        0 min,  0.016 sec
 * total energy  :   -43.1479256 Eh     change       -0.2998056E-05 Eh
   gradient norm :     0.0003148 Eh/α   predicted    -0.1205439E-05 ( -59.79%)
   displ. norm   :     0.0449172 α      lambda       -0.3289408E-05
   maximum displ.:     0.0324245 α      in ANC's #1, #3, #2, ...

   *** GEOMETRY OPTIMIZATION CONVERGED AFTER 25 ITERATIONS ***

------------------------------------------------------------------------
 total energy gain   :        -0.0170737 Eh      -10.7139 kcal/mol
 total RMSD          :         0.3893902 a0        0.2061 Å
 total power (kW/mol):        -1.7930824 (step)  -51.5843 (real)
------------------------------------------------------------------------

 ANCopt (total)                0 d,  0 h,  0 min,  0.869 sec
 optimizer setup                ...        0 min,  0.000 sec (  0.018%)
 model hessian                  ...        0 min,  0.008 sec (  0.890%)
 ANC generation                 ...        0 min,  0.001 sec (  0.156%)
 coordinate transformation      ...        0 min,  0.000 sec (  0.051%)
 single point calculation       ...        0 min,  0.852 sec ( 97.992%)
 optimization log               ...        0 min,  0.002 sec (  0.283%)
 hessian update                 ...        0 min,  0.000 sec (  0.037%)
 rational function              ...        0 min,  0.004 sec (  0.409%)

================
 final structure:
================
$coord
   -3.36298496627307    2.40238304791283    0.38963842114031      C 
   -5.91208396612977    0.42933855463437    0.46373225753323      S 
   -1.11977727580892    1.09574339909167    0.23282046158867      C 
    1.36459420954238    2.06516414796680    0.18046423058631      C 
    3.40541866009331    0.48740757330549    0.03096447736148      C 
    5.70019801350736    1.65776078905781   -0.06713702529485      O 
    7.90791744471051    0.42804237231923    0.78390639685261      C 
    3.01876428984891   -2.20566192751533   -0.11522321307264      C 
    5.14362800571317   -3.65552619205069   -0.38257873324656      O 
    4.87282329675031   -6.28697419300545   -0.60371908780585      C 
    0.62840275643951   -3.18365387156882   -0.02436624964620      C 
   -1.49986658704742   -1.58466075210575    0.16416626391421      C 
   -4.04070668407751   -2.25625733940923    0.27987082639389      C 
   -5.11506523829963   -4.73907341151268    0.26966178057739      C 
   -7.57365756303058   -5.26169141167434    0.42489449140900      C 
   -3.63798518427739    4.40639168325397    0.47217590724362      H 
    1.68056102023889    4.07625426396592    0.25543544689276      H 
    9.28491932928420    1.93302747213977    1.07593903319458      H 
    8.63408954887534   -0.90371671011620   -0.61522347679916      H 
    7.59041476016576   -0.56186845739382    2.56745682384192      H 
    6.78303707107563   -7.02052886338441   -0.82699404139211      H 
    3.74544924811130   -6.79900288013895   -2.26140509603223      H 
    4.01982379414667   -7.11139960896501    1.09190728919923      H 
    0.32629775657126   -5.19457364950363   -0.12381093524969      H 
   -3.76330701321063   -6.26715224848379    0.12516367291368      H 
   -8.96536454117297   -3.78316537760526    0.57150764001570      H 
   -8.26156395857461   -7.17363751255411    0.40790739839485      H 
$end
           -------------------------------------------------
          |                Final Singlepoint                |
           -------------------------------------------------

          ...................................................
          :                      SETUP                      :
          :.................................................:
          :  # basis functions                  78          :
          :  # atomic orbitals                  77          :
          :  # shells                           43          :
          :  # electrons                        78          :
          :  max. iterations                   250          :
          :  Hamiltonian                  GFN2-xTB          :
          :  restarted?                      false          :
          :  GBSA solvation                  false          :
          :  PC potential                    false          :
          :  electronic temp.          300.0000000     K    :
          :  accuracy                    1.0000000          :
          :  -> integral cutoff          0.2500000E+02      :
          :  -> integral neglect         0.1000000E-07      :
          :  -> SCF convergence          0.1000000E-05 Eh   :
          :  -> wf. convergence          0.1000000E-03 e    :
          :  Broyden damping             0.4000000          :
          ...................................................

 iter      E             dE          RMSdq      gap      omega  full diag
   1    -43.7528359 -0.437528E+02  0.293E-04    1.98       0.0  T
   2    -43.7528359 -0.799005E-10  0.134E-04    1.98     144.0  T
   3    -43.7528359  0.760920E-10  0.958E-05    1.98     200.8  T

   *** convergence criteria satisfied after 3 iterations ***

         #    Occupation            Energy/Eh            Energy/eV
      -------------------------------------------------------------
         1        2.0000           -0.7269436             -19.7811
       ...           ...                  ...                  ...
        33        2.0000           -0.4375384             -11.9060
        34        2.0000           -0.4313182             -11.7368
        35        2.0000           -0.4220279             -11.4840
        36        2.0000           -0.4196433             -11.4191
        37        2.0000           -0.4000589             -10.8862
        38        2.0000           -0.3724346             -10.1345
        39        2.0000           -0.3498596              -9.5202 (HOMO)
        40                         -0.2769230              -7.5355 (LUMO)
        41                         -0.2172634              -5.9120
        42                         -0.1940885              -5.2814
        43                         -0.1914489              -5.2096
        44                         -0.1569089              -4.2697
       ...                                ...                  ...
        77                          0.7398809              20.1332
      -------------------------------------------------------------
                  HL-Gap            0.0729366 Eh            1.9847 eV
             Fermi-level           -0.3133913 Eh           -8.5278 eV

 SCC (total)                   0 d,  0 h,  0 min,  0.031 sec
 SCC setup                      ...        0 min,  0.000 sec (  0.689%)
 Dispersion                     ...        0 min,  0.000 sec (  0.774%)
 integral evaluation            ...        0 min,  0.011 sec ( 34.372%)
 zeroth order Hamiltonian       ...        0 min,  0.000 sec (  0.526%)
 iterations                     ...        0 min,  0.004 sec ( 14.004%)
 molecular gradient             ...        0 min,  0.015 sec ( 48.412%)
 printout                       ...        0 min,  0.000 sec (  1.070%)

         :::::::::::::::::::::::::::::::::::::::::::::::::::::
         ::                     SUMMARY                     ::
         :::::::::::::::::::::::::::::::::::::::::::::::::::::
         :: total energy             -43.147925602362 Eh    ::
         :: gradient norm              0.000316340283 Eh/a0 ::
         :: HOMO-LUMO gap              1.984705016935 eV    ::
         ::.................................................::
         :: SCC energy               -43.752835878610 Eh    ::
         :: -> isotropic ES            0.030069524240 Eh    ::
         :: -> anisotropic ES          0.004401204315 Eh    ::
         :: -> anisotropic XC          0.012904021999 Eh    ::
         :: -> dispersion             -0.027949445660 Eh    ::
         :: repulsion energy           0.604902484103 Eh    ::
         :: add. restraining           0.000000000000 Eh    ::
         :::::::::::::::::::::::::::::::::::::::::::::::::::::

           -------------------------------------------------
          |                Property Printout                |
           -------------------------------------------------

    * Orbital Energies and Occupations

         #    Occupation            Energy/Eh            Energy/eV
      -------------------------------------------------------------
         1        2.0000           -0.7269436             -19.7811
       ...           ...                  ...                  ...
        27        2.0000           -0.4752149             -12.9313
        28        2.0000           -0.4704787             -12.8024
        29        2.0000           -0.4638160             -12.6211
        30        2.0000           -0.4525166             -12.3136
        31        2.0000           -0.4496822             -12.2365
        32        2.0000           -0.4463612             -12.1461
        33        2.0000           -0.4375384             -11.9060
        34        2.0000           -0.4313182             -11.7368
        35        2.0000           -0.4220279             -11.4840
        36        2.0000           -0.4196433             -11.4191
        37        2.0000           -0.4000589             -10.8862
        38        2.0000           -0.3724346             -10.1345
        39        2.0000           -0.3498596              -9.5202 (HOMO)
        40                         -0.2769230              -7.5355 (LUMO)
        41                         -0.2172634              -5.9120
        42                         -0.1940885              -5.2814
        43                         -0.1914489              -5.2096
        44                         -0.1569089              -4.2697
        45                         -0.1148253              -3.1246
        46                         -0.0813916              -2.2148
        47                         -0.0004586              -0.0125
        48                          0.0149764               0.4075
        49                          0.0354204               0.9638
        50                          0.0358084               0.9744
       ...                                ...                  ...
        77                          0.7398809              20.1332
      -------------------------------------------------------------
                  HL-Gap            0.0729366 Eh            1.9847 eV
             Fermi-level           -0.3133913 Eh           -8.5278 eV

     #   Z        covCN         q      C6AA      α(0)
     1   6 C      2.928    -0.035    28.882     8.813
     2  16 S      2.324    -0.009   141.427    20.016
     3   6 C      3.168    -0.004    27.772     8.611
     4   6 C      2.912    -0.070    29.737     8.942
     5   6 C      2.850     0.127    25.206     8.229
     6   8 O      1.706    -0.269    18.456     5.800
     7   6 C      3.636     0.038    20.302     6.483
     8   6 C      2.857     0.118    25.399     8.260
     9   8 O      1.704    -0.270    18.479     5.804
    10   6 C      3.643     0.039    20.258     6.471
    11   6 C      2.908    -0.079    29.982     8.978
    12   6 C      3.168    -0.013    27.970     8.641
    13   6 C      2.979     0.009    27.817     8.651
    14   6 C      2.920    -0.031    28.765     8.795
    15   6 C      2.841    -0.093    30.338     9.027
    16   1 H      0.926     0.044     2.392     2.419
    17   1 H      0.926     0.052     2.295     2.369
    18   1 H      0.924     0.056     2.242     2.342
    19   1 H      0.924     0.053     2.284     2.363
    20   1 H      0.924     0.041     2.430     2.438
    21   1 H      0.925     0.060     2.194     2.316
    22   1 H      0.924     0.041     2.432     2.439
    23   1 H      0.924     0.040     2.453     2.449
    24   1 H      0.926     0.037     2.487     2.466
    25   1 H      0.925     0.036     2.504     2.475
    26   1 H      0.926     0.044     2.400     2.423
    27   1 H      0.926     0.037     2.484     2.465

 Mol. C6AA /au·bohr⁶  :      10177.636648
 Mol. C8AA /au·bohr⁸  :     269447.670072
 Mol. α(0) /au        :        160.483855


Wiberg/Mayer (AO) data.
largest (>0.10) Wiberg bond orders for each atom
          total WBO             WBO to atom ...
     1  C   3.940        C    3 1.451    S    2 1.234    H   16 0.970    C   13 0.125
     2  S   2.679        C    1 1.234    C   13 1.156
     3  C   3.988        C    1 1.451    C    4 1.223    C   12 1.165
     4  C   3.977        C    5 1.534    C    3 1.223    H   17 0.965
     5  C   3.938        C    4 1.534    C    8 1.156    O    6 1.061
     6  O   2.214        C    5 1.061    C    7 0.976
     7  C   3.942        H   20 0.981    H   18 0.979    O    6 0.976    H   19 0.975
     8  C   3.916        C   11 1.525    C    5 1.156    O    9 1.050
     9  O   2.216        C    8 1.050    C   10 0.986
    10  C   3.947        O    9 0.986    H   21 0.979    H   23 0.975    H   22 0.975
    11  C   3.982        C    8 1.525    C   12 1.236    H   24 0.959
    12  C   3.987        C   13 1.375    C   11 1.236    C    3 1.165
    13  C   3.942        C   12 1.375    C   14 1.161    S    2 1.156    C    1 0.125
    14  C   3.992        C   15 1.837    C   13 1.161    H   25 0.956
    15  C   3.963        C   14 1.837    H   27 0.979    H   26 0.973
    16  H   0.997        C    1 0.970
    17  H   0.996        C    4 0.965
    18  H   0.996        C    7 0.979
    19  H   0.996        C    7 0.975
    20  H   0.997        C    7 0.981
    21  H   0.996        C   10 0.979
    22  H   0.998        C   10 0.975
    23  H   0.998        C   10 0.975
    24  H   0.998        C   11 0.959
    25  H   0.998        C   14 0.956
    26  H   0.998        C   15 0.973
    27  H   0.998        C   15 0.979

molecular dipole:
                 x           y           z       tot (Debye)
 q only:        0.363      -0.627       0.149
   full:        0.655      -0.909       0.159       2.876
molecular quadrupole (traceless):
                xx          xy          yy          xz          yz          zz
 q only:        1.689      -5.641       3.970       1.910       1.088      -5.659
  q+dip:       -1.584      -6.428       8.552       1.950       1.579      -6.969
   full:       -2.960      -6.702       7.596       2.437       1.348      -4.636

           -------------------------------------------------
          |                Geometry Summary                 |
           -------------------------------------------------

      molecular mass/u    :      220.2856000
   center of mass at/Å    :       -0.0400185      -0.6763481       0.0831482
  moments of inertia/u·Å² :        0.4869328E+03   0.1475628E+04   0.1947797E+04
rotational constants/cm⁻¹ :        0.3462004E-01   0.1142404E-01   0.8654716E-02

 * 27 selected distances

     #   Z        #   Z                                     value/Å
     1   6 C      2  16 S                                 1.7062418
     1   6 C      3   6 C                                 1.3762556
     3   6 C      4   6 C                                 1.4114874
     4   6 C      5   6 C                                 1.3673505
     5   6 C      6   8 O                                 1.3641450
     6   8 O      7   6 C                                 1.4110795
     8   6 C      9   8 O                                 1.3685788
     9   8 O     10   6 C                                 1.4047396
     8   6 C     11   6 C                                 1.3675472
     3   6 C     12   6 C                                 1.4330593
    11   6 C     12   6 C                                 1.4122049
     2  16 S     13   6 C                                 1.7348851 (max)
    12   6 C     13   6 C                                 1.3920780
    13   6 C     14   6 C                                 1.4315909
    14   6 C     15   6 C                                 1.3326342
     1   6 C     16   1 H                                 1.0713047 (min)
     4   6 C     17   1 H                                 1.0780081
     7   6 C     18   1 H                                 1.0904644
     7   6 C     19   1 H                                 1.0920137
     7   6 C     20   1 H                                 1.0924382
    10   6 C     21   1 H                                 1.0892405
    10   6 C     22   1 H                                 1.0949071
    10   6 C     23   1 H                                 1.0950817
    11   6 C     24   1 H                                 1.0773606
    14   6 C     25   1 H                                 1.0823137
    15   6 C     26   1 H                                 1.0772862
    15   6 C     27   1 H                                 1.0752905

 * 4 distinct bonds (by element types)

   Z      Z             #   av. dist./Å        max./Å        min./Å
   1 H    6 C          12     1.0846425     1.0950817     1.0713047
   6 C    6 C           9     1.3915787     1.4330593     1.3326342
   6 C    8 O           4     1.3871357     1.4110795     1.3641450
   6 C   16 S           2     1.7205635     1.7348851     1.7062418


optimized geometry written to: xtbopt.xyz


           -------------------------------------------------
          | TOTAL ENERGY              -43.147925602362 Eh   |
          | GRADIENT NORM               0.000316340283 Eh/α |
          | HOMO-LUMO GAP               1.984705016935 eV   |
           -------------------------------------------------

------------------------------------------------------------------------
 * finished run on 2021/05/19 at 10:58:56.107     
------------------------------------------------------------------------
 total:
 * wall-time:     0 d,  0 h,  0 min,  0.966 sec
 *  cpu-time:     0 d,  0 h,  0 min,  0.965 sec
 * ratio c/w:     1.000 speedup
 SCF:
 * wall-time:     0 d,  0 h,  0 min,  0.043 sec
 *  cpu-time:     0 d,  0 h,  0 min,  0.043 sec
 * ratio c/w:     1.000 speedup
 ANC optimizer:
 * wall-time:     0 d,  0 h,  0 min,  0.900 sec
 *  cpu-time:     0 d,  0 h,  0 min,  0.900 sec
 * ratio c/w:     1.000 speedup

