      -----------------------------------------------------------      
     |                   =====================                   |     
     |                           x T B                           |     
     |                   =====================                   |     
     |                         S. Grimme                         |     
     |          Mulliken Center for Theoretical Chemistry        |     
     |                    University of Bonn                     |     
     |                Version 6.2 RC2 (SAW190805)                |     
      -----------------------------------------------------------      

   This program is distributed in the hope that it will be useful,
   but WITHOUT ANY WARRANTY; without even the implied warranty of
   MERCHANTABILITY or FITNESS FOR A PARTICULAR PURPOSE.
   
   FOR NON-COMMERCIAL, ACADEMIA USE ONLY.
   
   Cite this work as:
   * S. Grimme, C. Bannwarth, P. Shushkov, J. Chem. Theory Comput., 2017,
     13, 1989-2009. DOI: 10.1021/acs.jctc.7b00118
   * C. Bannwarth, S. Ehlert and S. Grimme., J. Chem. Theory Comput., 2019,
     15, 1652-1671. DOI: 10.1021/acs.jctc.8b01176
   * P. Pracht, E. Caldeweyher, S. Ehlert, S. Grimme, ChemRxiv, 2019, preprint.
     DOI: 10.26434/chemrxiv.8326202.v1
   
   for DFT-D4:
   * E. Caldeweyher, C. Bannwarth and S. Grimme, J. Chem. Phys., 2017,
     147, 034112. DOI: 10.1063/1.4993215
   * E. Caldeweyher, S. Ehlert, A. Hansen, H. Neugebauer, S. Spicher,
     C. Bannwarth and S. Grimme, J. Chem. Phys., 2019, 150, 154122.
     DOI: 10.1063/1.5090222
   
   for sTDA-xTB:
   * S. Grimme and C. Bannwarth, J. Chem. Phys., 2016, 145, 054103.
     DOI: 10.1063/1.4959605
   
   in the mass-spec context:
   * V. Asgeirsson, C. Bauer and S. Grimme, Chem. Sci., 2017, 8, 4879.
     DOI: 10.1039/c7sc00601b
   
   for metadynamics refer to:
   * S. Grimme, J. Chem. Theory Comput., 2019, 155, 2847-2862
     DOI: 10.1021/acs.jctc.9b00143
   
   with help from (in alphabetical order)
   C. Bannwarth, F. Bohle, G. Brandenburg, E. Caldeweyher, M. Checinski,
   S. Dohm, S. Ehlert, S. Ehrlich, F. März, H. Neugebauer, J. Pisarek,
   P. Pracht, P. Shushkov, and S. Spicher.
   
 * started run on 2021/05/19 at 11:00:27.809     

           -------------------------------------------------
          |                Calculation Setup                |
           -------------------------------------------------

          program call               : /ihome/ghutchison/geoffh/xtb/xtb 915.xyz -opt
          hostname                   : smp-n122
          coordinate file            : 915.xyz
          omp threads                :                     1
          number of atoms            :                    16
          number of electrons        :                    52
          charge                     :                     0
          spin                       :                   0.0
          first test random number   :      0.85077648717724


########################################################################
# WARNING! Please study the warnings concerning your input carefully
#  - the use of '-opt' is discouraged, please use '--opt' next time
########################################################################

           ------------------------------------------------- 
          |                 G F N 2 - x T B                 |
          | Geometry, Frequencies, Noncovalent interactions |
          |            JCTC 2019 parametrisation            |
           ------------------------------------------------- 
             KAB for C  - Si     :                1.0500
             KAB for H  - Pd     :                0.9500
             k(s)              :                1.8500
             k(p)              :                2.2300
             k(d)              :                2.2300
             k(f)              :                2.0000
             kEN (H0ij)        :               -2.0000
             D4 a1             :                0.5200
             D4 a2             :                5.0000
             D4 s6             :                1.0000
             D4 s8             :                2.7000
             D4 s9             :                5.0000
             alphaj            :                2.0000

  Z AO/shell   Hii/eV     exponent
  1     Wed Apr 25 08:07:45 CEST 2018   EN: 2.200 GM2: 0.406  GM3: 0.0800  RAES: 1.40
     1s    -10.707211    1.230000
  6     Wed Apr 25 08:07:45 CEST 2018   EN: 2.550 GM2: 0.538  GM3: 0.1500  RAES: 3.00
     2s    -13.970922    2.096432
     2p    -10.063292    1.800000
  7     Wed Apr 25 08:07:45 CEST 2018   EN: 3.040 GM2: 0.461  GM3:-0.0640  RAES: 1.90
     2s    -16.686243    2.339881
     2p    -12.523956    2.014332
 16     Tue Apr 24 11:44:34 CEST 2018   EN: 2.580 GM2: 0.340  GM3:-0.0502  RAES: 3.10
     3s    -20.029654    1.981333
     3p    -11.377694    2.025643
     3d     -0.420282    1.702555

           ------------------------------------------------- 
          |        Self-Consistent Charge Iterations        |
           ------------------------------------------------- 

          ...................................................
          :                      SETUP                      :
          :.................................................:
          :  # basis functions                  55          :
          :  # atomic orbitals                  54          :
          :  # shells                           28          :
          :  # electrons                        52          :
          :  max. iterations                   250          :
          :  Hamiltonian                  GFN2-xTB          :
          :  restarted?                      false          :
          :  GBSA solvation                  false          :
          :  PC potential                    false          :
          :  electronic temp.          300.0000000     K    :
          :  accuracy                    1.0000000          :
          :  -> integral cutoff          0.2500000E+02      :
          :  -> integral neglect         0.1000000E-07      :
          :  -> SCF convergence          0.1000000E-05 Eh   :
          :  -> wf. convergence          0.1000000E-03 e    :
          :  Broyden damping             0.4000000          :
          ...................................................

 iter      E             dE          RMSdq      gap      omega  full diag
   1    -28.3552296 -0.283552E+02  0.554E+00    2.14       0.0  T
   2    -28.3545766  0.653021E-03  0.366E+00    2.15       1.0  T
   3    -28.3032692  0.513073E-01  0.263E+00    2.09       1.0  T
   4    -28.3858609 -0.825917E-01  0.418E-01    2.11       1.0  T
   5    -28.3863789 -0.517970E-03  0.278E-01    2.10       1.0  T
   6    -28.3872347 -0.855823E-03  0.923E-02    2.11       1.0  T
   7    -28.3873368 -0.102081E-03  0.347E-02    2.11       1.0  T
   8    -28.3873404 -0.364256E-05  0.194E-02    2.11       1.3  T
   9    -28.3873430 -0.256225E-05  0.769E-03    2.11       3.3  T
  10    -28.3873434 -0.440428E-06  0.224E-03    2.11      11.1  T
  11    -28.3873435 -0.307769E-07  0.840E-04    2.11      29.8  T
  12    -28.3873435 -0.170403E-08  0.449E-04    2.11      55.7  T

   *** convergence criteria satisfied after 12 iterations ***

         #    Occupation            Energy/Eh            Energy/eV
      -------------------------------------------------------------
         1        2.0000           -0.7500934             -20.4111
       ...           ...                  ...                  ...
        20        2.0000           -0.4584661             -12.4755
        21        2.0000           -0.4565556             -12.4235
        22        2.0000           -0.4499164             -12.2428
        23        2.0000           -0.4462011             -12.1417
        24        2.0000           -0.4201603             -11.4331
        25        2.0000           -0.4134000             -11.2492
        26        2.0000           -0.3808187             -10.3626 (HOMO)
        27                         -0.3033612              -8.2549 (LUMO)
        28                         -0.2547215              -6.9313
        29                         -0.2214661              -6.0264
        30                         -0.2147590              -5.8439
        31                         -0.2090405              -5.6883
       ...                                ...                  ...
        54                          1.0728056              29.1925
      -------------------------------------------------------------
                  HL-Gap            0.0774575 Eh            2.1077 eV
             Fermi-level           -0.3420899 Eh           -9.3087 eV

 SCC (total)                   0 d,  0 h,  0 min,  0.025 sec
 SCC setup                      ...        0 min,  0.000 sec (  0.918%)
 Dispersion                     ...        0 min,  0.000 sec (  0.863%)
 integral evaluation            ...        0 min,  0.006 sec ( 23.579%)
 zeroth order Hamiltonian       ...        0 min,  0.000 sec (  0.447%)
 iterations                     ...        0 min,  0.010 sec ( 39.069%)
 molecular gradient             ...        0 min,  0.009 sec ( 33.769%)
 printout                       ...        0 min,  0.000 sec (  1.168%)

         :::::::::::::::::::::::::::::::::::::::::::::::::::::
         ::                     SUMMARY                     ::
         :::::::::::::::::::::::::::::::::::::::::::::::::::::
         :: total energy             -27.910738329861 Eh    ::
         :: gradient norm              0.109644502042 Eh/a0 ::
         :: HOMO-LUMO gap              2.107727010836 eV    ::
         ::.................................................::
         :: SCC energy               -28.387343459800 Eh    ::
         :: -> isotropic ES            0.008995425213 Eh    ::
         :: -> anisotropic ES          0.002027121255 Eh    ::
         :: -> anisotropic XC          0.028916950191 Eh    ::
         :: -> dispersion             -0.017120758422 Eh    ::
         :: repulsion energy           0.476591745981 Eh    ::
         :: add. restraining           0.000000000000 Eh    ::
         :::::::::::::::::::::::::::::::::::::::::::::::::::::

      ----------------------------------------------------------- 
     |                   =====================                   |
     |                        A N C O P T                        |
     |                   =====================                   |
     |               Approximate Normal Coordinate               |
     |                Rational Function Optimizer                |
      ----------------------------------------------------------- 

          ...................................................
          :                      SETUP                      :
          :.................................................:
          :   optimization level            normal          :
          :   max. optcycles                   200          :
          :   ANC micro-cycles                  20          :
          :   degrees of freedom                42          :
          :.................................................:
          :   RF solver                   davidson          :
          :   input Hessian                  false          :
          :   write xtbopt.log                true          :
          :   linear?                        false          :
          :   energy convergence         0.5000000E-05 Eh   :
          :   grad. convergence          0.1000000E-02 Eh/α :
          :   maximium RF displ.         2.0000000          :
          :   Hlow (freq-cutoff)         0.5000000E-02      :
          :   Hmax (freq-cutoff)         5.0000000          :
          :   S6 in model hess.         20.0000000          :
          ...................................................

generating ANC from model Hessian ...
Using Lindh-Hessian (1995)
 Shifting diagonal of input Hessian by   1.484476478807684E-003
 Lowest  eigenvalues of input Hessian
   -0.000000   -0.000000    0.000000    0.000000    0.000000    0.000000
    0.005000    0.005965    0.008934    0.014365    0.019353    0.022519
    0.037512    0.039715    0.062893    0.064300    0.075989    0.077463
 Highest eigenvalues
    1.615951    1.687834    1.842297    1.959325    2.041858    2.497158
 

........................................................................
.............................. CYCLE    1 ..............................
........................................................................
   1    -28.3873435 -0.283873E+02  0.180E-04    2.11       0.0  T
   2    -28.3873435 -0.531593E-10  0.135E-04    2.11     184.7  T
   3    -28.3873435 -0.185366E-09  0.731E-05    2.11     341.9  T
     SCC iter.                  ...        0 min,  0.003 sec
     gradient                   ...        0 min,  0.008 sec
 * total energy  :   -27.9107383 Eh     change        0.3407196E-07 Eh
   gradient norm :     0.1096460 Eh/α   predicted     0.0000000E+00 (-100.00%)
   displ. norm   :     0.3068296 α      lambda       -0.1853924E-01
   maximum displ.:     0.1555923 α      in ANC's #10, #17, #19, ...

........................................................................
.............................. CYCLE    2 ..............................
........................................................................
   1    -28.4304369 -0.284304E+02  0.424E-01    2.22       0.0  T
   2    -28.4305581 -0.121164E-03  0.242E-01    2.21       1.0  T
   3    -28.4303628  0.195261E-03  0.153E-01    2.21       1.0  T
   4    -28.4306765 -0.313642E-03  0.446E-02    2.21       1.0  T
   5    -28.4306926 -0.161239E-04  0.199E-02    2.21       1.3  T
   6    -28.4306944 -0.175490E-05  0.621E-03    2.21       4.0  T
   7    -28.4306947 -0.317155E-06  0.186E-03    2.21      13.4  T
   8    -28.4306947 -0.173377E-07  0.111E-03    2.21      22.6  T
     SCC iter.                  ...        0 min,  0.006 sec
     gradient                   ...        0 min,  0.008 sec
 * total energy  :   -27.9230184 Eh     change       -0.1228010E-01 Eh
   gradient norm :     0.0508959 Eh/α   predicted    -0.1014230E-01 ( -17.41%)
   displ. norm   :     0.1887492 α      lambda       -0.4533480E-02
   maximum displ.:     0.1009323 α      in ANC's #17, #2, #10, ...

........................................................................
.............................. CYCLE    3 ..............................
........................................................................
   1    -28.4423436 -0.284423E+02  0.304E-01    2.31       0.0  T
   2    -28.4424044 -0.607771E-04  0.176E-01    2.31       1.0  T
   3    -28.4423360  0.683505E-04  0.902E-02    2.31       1.0  T
   4    -28.4424376 -0.101551E-03  0.235E-02    2.31       1.1  T
   5    -28.4424429 -0.534514E-05  0.102E-02    2.31       2.4  T
   6    -28.4424437 -0.734580E-06  0.345E-03    2.31       7.2  T
   7    -28.4424437 -0.726036E-07  0.122E-03    2.31      20.5  T
     SCC iter.                  ...        0 min,  0.005 sec
     gradient                   ...        0 min,  0.008 sec
 * total energy  :   -27.9251967 Eh     change       -0.2178280E-02 Eh
   gradient norm :     0.0136952 Eh/α   predicted    -0.2347493E-02 (   7.77%)
   displ. norm   :     0.1414295 α      lambda       -0.5531532E-03
   maximum displ.:     0.1258676 α      in ANC's #2, #13, #6, ...

........................................................................
.............................. CYCLE    4 ..............................
........................................................................
   1    -28.4396198 -0.284396E+02  0.335E-01    2.31       0.0  T
   2    -28.4396398 -0.200274E-04  0.181E-01    2.32       1.0  T
   3    -28.4396324  0.748543E-05  0.339E-02    2.31       1.0  T
   4    -28.4396474 -0.149931E-04  0.131E-02    2.31       1.9  T
   5    -28.4396480 -0.663167E-06  0.817E-03    2.32       3.1  T
   6    -28.4396488 -0.796433E-06  0.183E-03    2.32      13.7  T
   7    -28.4396488 -0.169386E-07  0.113E-03    2.32      22.2  T
     SCC iter.                  ...        0 min,  0.005 sec
     gradient                   ...        0 min,  0.008 sec
 * total energy  :   -27.9252851 Eh     change       -0.8839247E-04 Eh
   gradient norm :     0.0087913 Eh/α   predicted    -0.2821066E-03 ( 219.15%)
   displ. norm   :     0.0775971 α      lambda       -0.3016501E-03
   maximum displ.:     0.0704491 α      in ANC's #2, #11, #10, ...

........................................................................
.............................. CYCLE    5 ..............................
........................................................................
   1    -28.4402657 -0.284403E+02  0.182E-01    2.32       0.0  T
   2    -28.4402713 -0.561868E-05  0.100E-01    2.32       1.0  T
   3    -28.4402652  0.612901E-05  0.230E-02    2.31       1.1  T
   4    -28.4402743 -0.907927E-05  0.459E-03    2.32       5.4  T
   5    -28.4402744 -0.999938E-07  0.280E-03    2.32       8.9  T
   6    -28.4402745 -0.616180E-07  0.922E-04    2.32      27.1  T
     SCC iter.                  ...        0 min,  0.005 sec
     gradient                   ...        0 min,  0.008 sec
 * total energy  :   -27.9254160 Eh     change       -0.1309500E-03 Eh
   gradient norm :     0.0051500 Eh/α   predicted    -0.1517351E-03 (  15.87%)
   displ. norm   :     0.0230580 α      lambda       -0.2595170E-04
   maximum displ.:     0.0142662 α      in ANC's #6, #5, #1, ...

........................................................................
.............................. CYCLE    6 ..............................
........................................................................
   1    -28.4401131 -0.284401E+02  0.528E-02    2.32       0.0  T
   2    -28.4401139 -0.787902E-06  0.253E-02    2.32       1.0  T
   3    -28.4401140 -0.497035E-07  0.510E-03    2.32       4.9  T
   4    -28.4401139  0.468963E-07  0.423E-03    2.32       5.9  T
   5    -28.4401141 -0.157436E-06  0.123E-03    2.32      20.3  T
   6    -28.4401141 -0.161179E-07  0.383E-04    2.32      65.3  T
     SCC iter.                  ...        0 min,  0.004 sec
     gradient                   ...        0 min,  0.008 sec
 * total energy  :   -27.9254268 Eh     change       -0.1077142E-04 Eh
   gradient norm :     0.0009893 Eh/α   predicted    -0.1298377E-04 (  20.54%)
   displ. norm   :     0.0155500 α      lambda       -0.4080197E-05
   maximum displ.:     0.0097245 α      in ANC's #1, #6, #5, ...

........................................................................
.............................. CYCLE    7 ..............................
........................................................................
   1    -28.4399382 -0.284399E+02  0.397E-02    2.32       0.0  T
   2    -28.4399386 -0.425830E-06  0.188E-02    2.32       1.3  T
   3    -28.4399386  0.354943E-07  0.440E-03    2.32       5.7  T
   4    -28.4399387 -0.727259E-07  0.303E-03    2.32       8.2  T
   5    -28.4399387 -0.619085E-07  0.919E-04    2.32      27.2  T
   6    -28.4399388 -0.774020E-08  0.270E-04    2.32      92.7  T
     SCC iter.                  ...        0 min,  0.004 sec
     gradient                   ...        0 min,  0.008 sec
 * total energy  :   -27.9254287 Eh     change       -0.1911349E-05 Eh
   gradient norm :     0.0010395 Eh/α   predicted    -0.2040008E-05 (   6.73%)
   displ. norm   :     0.0069119 α      lambda       -0.1026693E-05
   maximum displ.:     0.0057589 α      in ANC's #1, #6, #7, ...

........................................................................
.............................. CYCLE    8 ..............................
........................................................................
   1    -28.4401119 -0.284401E+02  0.965E-03    2.32       0.0  T
   2    -28.4401119 -0.237439E-07  0.499E-03    2.32       5.0  T
   3    -28.4401119 -0.195192E-08  0.923E-04    2.32      27.1  T
   4    -28.4401119 -0.194295E-08  0.550E-04    2.32      45.4  T
     SCC iter.                  ...        0 min,  0.003 sec
     gradient                   ...        0 min,  0.008 sec
 * total energy  :   -27.9254295 Eh     change       -0.8173838E-06 Eh
   gradient norm :     0.0003227 Eh/α   predicted    -0.5141826E-06 ( -37.09%)
   displ. norm   :     0.0058711 α      lambda       -0.2533118E-06
   maximum displ.:     0.0051745 α      in ANC's #1, #2, #6, ...

   *** GEOMETRY OPTIMIZATION CONVERGED AFTER 8 ITERATIONS ***

------------------------------------------------------------------------
 total energy gain   :        -0.0146912 Eh       -9.2189 kcal/mol
 total RMSD          :         0.1162914 a0        0.0615 Å
 total power (kW/mol):        -4.8214625 (step) -249.1970 (real)
------------------------------------------------------------------------

 ANCopt (total)                0 d,  0 h,  0 min,  0.155 sec
 optimizer setup                ...        0 min,  0.000 sec (  0.085%)
 model hessian                  ...        0 min,  0.002 sec (  0.992%)
 ANC generation                 ...        0 min,  0.000 sec (  0.238%)
 coordinate transformation      ...        0 min,  0.000 sec (  0.061%)
 single point calculation       ...        0 min,  0.150 sec ( 96.944%)
 optimization log               ...        0 min,  0.001 sec (  0.386%)
 hessian update                 ...        0 min,  0.000 sec (  0.097%)
 rational function              ...        0 min,  0.001 sec (  0.860%)

================
 final structure:
================
$coord
   -2.79740203703459   -2.37326805693982    0.29441220269699      C 
   -5.00391489688917   -0.03289319627764    0.45830777056615      S 
   -2.76549480531426    2.28592477948143    0.29460902252923      C 
   -0.36549229213950    1.30766960718661    0.11756667027164      C 
   -0.38175937977790   -1.41730632067520    0.11686979119139      C 
    1.92202754542945   -2.75081736040804   -0.05622734321154      C 
    4.13515064320591   -1.41188237978991   -0.22046111153644      C 
    6.46603492287932   -2.70136013209749   -0.40050837893137      C 
    8.36305452210379   -3.73816553162538   -0.55152366177552      N 
    4.15435518367565    1.28654604834280   -0.21737359351580      C 
    1.96782926528700    2.61605236163509   -0.05316769757978      C 
   -3.36997799019555   -4.31499103508476    0.33534541455740      H 
   -3.32125253400956    4.23246414541700    0.33602911314394      H 
    1.92322066739208   -4.79157372567838   -0.05876790667306      H 
    5.95494686398960    2.23746484862071   -0.34924885315438      H 
    1.96687652872615    4.65589093849860   -0.04986765759137      H 
$end
           -------------------------------------------------
          |                Final Singlepoint                |
           -------------------------------------------------

          ...................................................
          :                      SETUP                      :
          :.................................................:
          :  # basis functions                  55          :
          :  # atomic orbitals                  54          :
          :  # shells                           28          :
          :  # electrons                        52          :
          :  max. iterations                   250          :
          :  Hamiltonian                  GFN2-xTB          :
          :  restarted?                      false          :
          :  GBSA solvation                  false          :
          :  PC potential                    false          :
          :  electronic temp.          300.0000000     K    :
          :  accuracy                    1.0000000          :
          :  -> integral cutoff          0.2500000E+02      :
          :  -> integral neglect         0.1000000E-07      :
          :  -> SCF convergence          0.1000000E-05 Eh   :
          :  -> wf. convergence          0.1000000E-03 e    :
          :  Broyden damping             0.4000000          :
          ...................................................

 iter      E             dE          RMSdq      gap      omega  full diag
   1    -28.4401119 -0.284401E+02  0.244E-04    2.32       0.0  T
   2    -28.4401119  0.739959E-10  0.168E-04    2.32     149.1  T
   3    -28.4401119 -0.300741E-09  0.110E-04    2.32     227.2  T

   *** convergence criteria satisfied after 3 iterations ***

         #    Occupation            Energy/Eh            Energy/eV
      -------------------------------------------------------------
         1        2.0000           -0.7522511             -20.4698
       ...           ...                  ...                  ...
        20        2.0000           -0.4648902             -12.6503
        21        2.0000           -0.4613351             -12.5536
        22        2.0000           -0.4438311             -12.0773
        23        2.0000           -0.4424791             -12.0405
        24        2.0000           -0.4196453             -11.4191
        25        2.0000           -0.4152393             -11.2992
        26        2.0000           -0.3847025             -10.4683 (HOMO)
        27                         -0.2994926              -8.1496 (LUMO)
        28                         -0.2501481              -6.8069
        29                         -0.2154215              -5.8619
        30                         -0.2142407              -5.8298
        31                         -0.2036991              -5.5429
       ...                                ...                  ...
        54                          1.1714187              31.8759
      -------------------------------------------------------------
                  HL-Gap            0.0852099 Eh            2.3187 eV
             Fermi-level           -0.3420976 Eh           -9.3089 eV

 SCC (total)                   0 d,  0 h,  0 min,  0.018 sec
 SCC setup                      ...        0 min,  0.000 sec (  0.776%)
 Dispersion                     ...        0 min,  0.000 sec (  0.731%)
 integral evaluation            ...        0 min,  0.006 sec ( 31.983%)
 zeroth order Hamiltonian       ...        0 min,  0.000 sec (  0.554%)
 iterations                     ...        0 min,  0.003 sec ( 15.561%)
 molecular gradient             ...        0 min,  0.009 sec ( 48.600%)
 printout                       ...        0 min,  0.000 sec (  1.541%)

         :::::::::::::::::::::::::::::::::::::::::::::::::::::
         ::                     SUMMARY                     ::
         :::::::::::::::::::::::::::::::::::::::::::::::::::::
         :: total energy             -27.925429515058 Eh    ::
         :: gradient norm              0.000323034343 Eh/a0 ::
         :: HOMO-LUMO gap              2.318680644209 eV    ::
         ::.................................................::
         :: SCC energy               -28.440111892574 Eh    ::
         :: -> isotropic ES            0.009055632750 Eh    ::
         :: -> anisotropic ES          0.002499183504 Eh    ::
         :: -> anisotropic XC          0.027301233201 Eh    ::
         :: -> dispersion             -0.017161531554 Eh    ::
         :: repulsion energy           0.514672368651 Eh    ::
         :: add. restraining           0.000000000000 Eh    ::
         :::::::::::::::::::::::::::::::::::::::::::::::::::::

           -------------------------------------------------
          |                Property Printout                |
           -------------------------------------------------

    * Orbital Energies and Occupations

         #    Occupation            Energy/Eh            Energy/eV
      -------------------------------------------------------------
         1        2.0000           -0.7522511             -20.4698
       ...           ...                  ...                  ...
        14        2.0000           -0.5060388             -13.7700
        15        2.0000           -0.5002118             -13.6115
        16        2.0000           -0.4963802             -13.5072
        17        2.0000           -0.4902180             -13.3395
        18        2.0000           -0.4810842             -13.0910
        19        2.0000           -0.4681471             -12.7389
        20        2.0000           -0.4648902             -12.6503
        21        2.0000           -0.4613351             -12.5536
        22        2.0000           -0.4438311             -12.0773
        23        2.0000           -0.4424791             -12.0405
        24        2.0000           -0.4196453             -11.4191
        25        2.0000           -0.4152393             -11.2992
        26        2.0000           -0.3847025             -10.4683 (HOMO)
        27                         -0.2994926              -8.1496 (LUMO)
        28                         -0.2501481              -6.8069
        29                         -0.2154215              -5.8619
        30                         -0.2142407              -5.8298
        31                         -0.2036991              -5.5429
        32                         -0.1591248              -4.3300
        33                         -0.1324041              -3.6029
        34                         -0.0863328              -2.3492
        35                         -0.0157519              -0.4286
        36                          0.0112498               0.3061
        37                          0.0228334               0.6213
       ...                                ...                  ...
        54                          1.1714187              31.8759
      -------------------------------------------------------------
                  HL-Gap            0.0852099 Eh            2.3187 eV
             Fermi-level           -0.3420976 Eh           -9.3089 eV

     #   Z        covCN         q      C6AA      α(0)
     1   6 C      2.928    -0.037    28.911     8.818
     2  16 S      2.309     0.039   139.479    19.877
     3   6 C      2.929    -0.038    28.947     8.823
     4   6 C      3.178     0.004    27.526     8.566
     5   6 C      3.182     0.003    27.528     8.564
     6   6 C      2.919    -0.023    28.579     8.767
     7   6 C      2.970     0.018    27.610     8.619
     8   6 C      1.914     0.111    28.359     8.600
     9   7 N      0.911    -0.237    26.198     7.403
    10   6 C      2.922    -0.025    28.635     8.775
    11   6 C      2.907    -0.031    28.766     8.795
    12   1 H      0.926     0.050     2.321     2.382
    13   1 H      0.926     0.049     2.332     2.388
    14   1 H      0.926     0.040     2.443     2.444
    15   1 H      0.926     0.041     2.441     2.443
    16   1 H      0.926     0.037     2.488     2.467

 Mol. C6AA /au·bohr⁶  :       5258.261755
 Mol. C8AA /au·bohr⁸  :     152800.042893
 Mol. α(0) /au        :        117.731885


Wiberg/Mayer (AO) data.
largest (>0.10) Wiberg bond orders for each atom
          total WBO             WBO to atom ...
     1  C   3.929        C    5 1.451    S    2 1.258    H   12 0.970    C    3 0.150
     2  S   2.749        C    1 1.258    C    3 1.243
     3  C   3.940        C    4 1.474    S    2 1.243    H   13 0.970    C    1 0.150
     4  C   3.981        C    3 1.474    C   11 1.212    C    5 1.149
     5  C   3.989        C    1 1.451    C    6 1.239    C    4 1.149
     6  C   3.992        C    7 1.513    C    5 1.239    H   14 0.968    C   11 0.108
     7  C   3.990        C    6 1.513    C   10 1.198    C    8 1.097
     8  C   3.944        N    9 2.799    C    7 1.097
     9  N   2.974        C    8 2.799
    10  C   3.992        C   11 1.632    C    7 1.198    H   15 0.970
    11  C   3.992        C   10 1.632    C    4 1.212    H   16 0.967    C    6 0.108
    12  H   0.997        C    1 0.970
    13  H   0.997        C    3 0.970
    14  H   0.998        C    6 0.968
    15  H   0.997        C   10 0.970
    16  H   0.997        C   11 0.967

molecular dipole:
                 x           y           z       tot (Debye)
 q only:       -1.329       0.573       0.102
   full:       -1.543       0.785       0.120       4.411
molecular quadrupole (traceless):
                xx          xy          yy          xz          yz          zz
 q only:       -9.251       8.617       4.994       0.880      -0.581       4.257
  q+dip:      -14.450      12.518      10.340       1.252      -0.845       4.109
   full:      -17.051      13.529       9.414       1.718      -0.930       7.636

           -------------------------------------------------
          |                Geometry Summary                 |
           -------------------------------------------------

      molecular mass/u    :      159.2052000
   center of mass at/Å    :        0.3591464      -0.2968706       0.0189154
  moments of inertia/u·Å² :        0.1613294E+03   0.8744396E+03   0.1035768E+04
rotational constants/cm⁻¹ :        0.1044920E+00   0.1927821E-01   0.1627549E-01

 * 16 selected distances

     #   Z        #   Z                                     value/Å
     1   6 C      2  16 S                                 1.7043218
     2  16 S      3   6 C                                 1.7077132 (max)
     3   6 C      4   6 C                                 1.3746737
     1   6 C      5   6 C                                 1.3779672
     4   6 C      5   6 C                                 1.4420210
     5   6 C      6   6 C                                 1.4115895
     6   6 C      7   6 C                                 1.3715427
     8   6 C      9   7 N                                 1.1467962
     7   6 C     10   6 C                                 1.4279841
     4   6 C     11   6 C                                 1.4184917
    10   6 C     11   6 C                                 1.3569498
     1   6 C     12   1 H                                 1.0714770
     3   6 C     13   1 H                                 1.0714497 (min)
     6   6 C     14   1 H                                 1.0799229
    10   6 C     15   1 H                                 1.0798028
    11   6 C     16   1 H                                 1.0794377

 * 4 distinct bonds (by element types)

   Z      Z             #   av. dist./Å        max./Å        min./Å
   1 H    6 C           5     1.0764180     1.0799229     1.0714497
   6 C    6 C           8     1.3976525     1.4420210     1.3569498
   6 C    7 N           1     1.1467962     1.1467962     1.1467962
   6 C   16 S           2     1.7060175     1.7077132     1.7043218


optimized geometry written to: xtbopt.xyz


           -------------------------------------------------
          | TOTAL ENERGY              -27.925429515058 Eh   |
          | GRADIENT NORM               0.000323034343 Eh/α |
          | HOMO-LUMO GAP               2.318680644209 eV   |
           -------------------------------------------------

------------------------------------------------------------------------
 * finished run on 2021/05/19 at 11:00:28.025     
------------------------------------------------------------------------
 total:
 * wall-time:     0 d,  0 h,  0 min,  0.215 sec
 *  cpu-time:     0 d,  0 h,  0 min,  0.215 sec
 * ratio c/w:     0.997 speedup
 SCF:
 * wall-time:     0 d,  0 h,  0 min,  0.025 sec
 *  cpu-time:     0 d,  0 h,  0 min,  0.025 sec
 * ratio c/w:     1.000 speedup
 ANC optimizer:
 * wall-time:     0 d,  0 h,  0 min,  0.173 sec
 *  cpu-time:     0 d,  0 h,  0 min,  0.173 sec
 * ratio c/w:     1.000 speedup

