      -----------------------------------------------------------      
     |                   =====================                   |     
     |                           x T B                           |     
     |                   =====================                   |     
     |                         S. Grimme                         |     
     |          Mulliken Center for Theoretical Chemistry        |     
     |                    University of Bonn                     |     
     |                Version 6.2 RC2 (SAW190805)                |     
      -----------------------------------------------------------      

   This program is distributed in the hope that it will be useful,
   but WITHOUT ANY WARRANTY; without even the implied warranty of
   MERCHANTABILITY or FITNESS FOR A PARTICULAR PURPOSE.
   
   FOR NON-COMMERCIAL, ACADEMIA USE ONLY.
   
   Cite this work as:
   * S. Grimme, C. Bannwarth, P. Shushkov, J. Chem. Theory Comput., 2017,
     13, 1989-2009. DOI: 10.1021/acs.jctc.7b00118
   * C. Bannwarth, S. Ehlert and S. Grimme., J. Chem. Theory Comput., 2019,
     15, 1652-1671. DOI: 10.1021/acs.jctc.8b01176
   * P. Pracht, E. Caldeweyher, S. Ehlert, S. Grimme, ChemRxiv, 2019, preprint.
     DOI: 10.26434/chemrxiv.8326202.v1
   
   for DFT-D4:
   * E. Caldeweyher, C. Bannwarth and S. Grimme, J. Chem. Phys., 2017,
     147, 034112. DOI: 10.1063/1.4993215
   * E. Caldeweyher, S. Ehlert, A. Hansen, H. Neugebauer, S. Spicher,
     C. Bannwarth and S. Grimme, J. Chem. Phys., 2019, 150, 154122.
     DOI: 10.1063/1.5090222
   
   for sTDA-xTB:
   * S. Grimme and C. Bannwarth, J. Chem. Phys., 2016, 145, 054103.
     DOI: 10.1063/1.4959605
   
   in the mass-spec context:
   * V. Asgeirsson, C. Bauer and S. Grimme, Chem. Sci., 2017, 8, 4879.
     DOI: 10.1039/c7sc00601b
   
   for metadynamics refer to:
   * S. Grimme, J. Chem. Theory Comput., 2019, 155, 2847-2862
     DOI: 10.1021/acs.jctc.9b00143
   
   with help from (in alphabetical order)
   C. Bannwarth, F. Bohle, G. Brandenburg, E. Caldeweyher, M. Checinski,
   S. Dohm, S. Ehlert, S. Ehrlich, F. März, H. Neugebauer, J. Pisarek,
   P. Pracht, P. Shushkov, and S. Spicher.
   
 * started run on 2021/05/19 at 11:00:33.590     

           -------------------------------------------------
          |                Calculation Setup                |
           -------------------------------------------------

          program call               : /ihome/ghutchison/geoffh/xtb/xtb 924.xyz -opt
          hostname                   : smp-n122
          coordinate file            : 924.xyz
          omp threads                :                     1
          number of atoms            :                    28
          number of electrons        :                    72
          charge                     :                     0
          spin                       :                   0.0
          first test random number   :      0.85810097490371


########################################################################
# WARNING! Please study the warnings concerning your input carefully
#  - the use of '-opt' is discouraged, please use '--opt' next time
########################################################################

           ------------------------------------------------- 
          |                 G F N 2 - x T B                 |
          | Geometry, Frequencies, Noncovalent interactions |
          |            JCTC 2019 parametrisation            |
           ------------------------------------------------- 
             KAB for C  - Si     :                1.0500
             KAB for H  - Pd     :                0.9500
             k(s)              :                1.8500
             k(p)              :                2.2300
             k(d)              :                2.2300
             k(f)              :                2.0000
             kEN (H0ij)        :               -2.0000
             D4 a1             :                0.5200
             D4 a2             :                5.0000
             D4 s6             :                1.0000
             D4 s8             :                2.7000
             D4 s9             :                5.0000
             alphaj            :                2.0000

  Z AO/shell   Hii/eV     exponent
  1     Wed Apr 25 08:07:45 CEST 2018   EN: 2.200 GM2: 0.406  GM3: 0.0800  RAES: 1.40
     1s    -10.707211    1.230000
  6     Wed Apr 25 08:07:45 CEST 2018   EN: 2.550 GM2: 0.538  GM3: 0.1500  RAES: 3.00
     2s    -13.970922    2.096432
     2p    -10.063292    1.800000
  7     Wed Apr 25 08:07:45 CEST 2018   EN: 3.040 GM2: 0.461  GM3:-0.0640  RAES: 1.90
     2s    -16.686243    2.339881
     2p    -12.523956    2.014332

           ------------------------------------------------- 
          |        Self-Consistent Charge Iterations        |
           ------------------------------------------------- 

          ...................................................
          :                      SETUP                      :
          :.................................................:
          :  # basis functions                  70          :
          :  # atomic orbitals                  70          :
          :  # shells                           42          :
          :  # electrons                        72          :
          :  max. iterations                   250          :
          :  Hamiltonian                  GFN2-xTB          :
          :  restarted?                      false          :
          :  GBSA solvation                  false          :
          :  PC potential                    false          :
          :  electronic temp.          300.0000000     K    :
          :  accuracy                    1.0000000          :
          :  -> integral cutoff          0.2500000E+02      :
          :  -> integral neglect         0.1000000E-07      :
          :  -> SCF convergence          0.1000000E-05 Eh   :
          :  -> wf. convergence          0.1000000E-03 e    :
          :  Broyden damping             0.4000000          :
          ...................................................

 iter      E             dE          RMSdq      gap      omega  full diag
   1    -39.2439592 -0.392440E+02  0.407E+00    1.97       0.0  T
   2    -39.2818503 -0.378911E-01  0.241E+00    1.74       1.0  T
   3    -39.2723740  0.947628E-02  0.108E+00    1.65       1.0  T
   4    -39.2867526 -0.143785E-01  0.353E-01    1.48       1.0  T
   5    -39.2895583 -0.280578E-02  0.996E-02    1.49       1.0  T
   6    -39.2897282 -0.169870E-03  0.417E-02    1.50       1.0  T
   7    -39.2897456 -0.173586E-04  0.191E-02    1.49       1.0  T
   8    -39.2897473 -0.176275E-05  0.942E-03    1.50       2.0  T
   9    -39.2897488 -0.143872E-05  0.162E-03    1.50      11.7  T
  10    -39.2897488 -0.513927E-07  0.534E-04    1.50      35.4  T
  11    -39.2897488  0.484150E-09  0.225E-04    1.50      84.0  T

   *** convergence criteria satisfied after 11 iterations ***

         #    Occupation            Energy/Eh            Energy/eV
      -------------------------------------------------------------
         1        2.0000           -0.6664455             -18.1349
       ...           ...                  ...                  ...
        30        2.0000           -0.4402504             -11.9798
        31        2.0000           -0.4351281             -11.8404
        32        2.0000           -0.4250788             -11.5670
        33        2.0000           -0.4059356             -11.0461
        34        2.0000           -0.4037369             -10.9862
        35        2.0000           -0.3926372             -10.6842
        36        2.0000           -0.3500300              -9.5248 (HOMO)
        37                         -0.2950360              -8.0283 (LUMO)
        38                         -0.2351997              -6.4001
        39                         -0.2097938              -5.7088
        40                         -0.1691872              -4.6038
        41                         -0.0716368              -1.9493
       ...                                ...                  ...
        70                          0.6746173              18.3573
      -------------------------------------------------------------
                  HL-Gap            0.0549939 Eh            1.4965 eV
             Fermi-level           -0.3225330 Eh           -8.7766 eV

 SCC (total)                   0 d,  0 h,  0 min,  0.052 sec
 SCC setup                      ...        0 min,  0.000 sec (  0.627%)
 Dispersion                     ...        0 min,  0.000 sec (  0.824%)
 integral evaluation            ...        0 min,  0.009 sec ( 17.459%)
 zeroth order Hamiltonian       ...        0 min,  0.000 sec (  0.339%)
 iterations                     ...        0 min,  0.027 sec ( 51.822%)
 molecular gradient             ...        0 min,  0.015 sec ( 28.090%)
 printout                       ...        0 min,  0.000 sec (  0.746%)

         :::::::::::::::::::::::::::::::::::::::::::::::::::::
         ::                     SUMMARY                     ::
         :::::::::::::::::::::::::::::::::::::::::::::::::::::
         :: total energy             -38.678556644901 Eh    ::
         :: gradient norm              0.105191693472 Eh/a0 ::
         :: HOMO-LUMO gap              1.496460963651 eV    ::
         ::.................................................::
         :: SCC energy               -39.289748808676 Eh    ::
         :: -> isotropic ES            0.019193366605 Eh    ::
         :: -> anisotropic ES          0.006215855427 Eh    ::
         :: -> anisotropic XC          0.032435054819 Eh    ::
         :: -> dispersion             -0.026225162803 Eh    ::
         :: repulsion energy           0.611102957017 Eh    ::
         :: add. restraining           0.000000000000 Eh    ::
         :::::::::::::::::::::::::::::::::::::::::::::::::::::

      ----------------------------------------------------------- 
     |                   =====================                   |
     |                        A N C O P T                        |
     |                   =====================                   |
     |               Approximate Normal Coordinate               |
     |                Rational Function Optimizer                |
      ----------------------------------------------------------- 

          ...................................................
          :                      SETUP                      :
          :.................................................:
          :   optimization level            normal          :
          :   max. optcycles                   200          :
          :   ANC micro-cycles                  20          :
          :   degrees of freedom                78          :
          :.................................................:
          :   RF solver                   davidson          :
          :   input Hessian                  false          :
          :   write xtbopt.log                true          :
          :   linear?                        false          :
          :   energy convergence         0.5000000E-05 Eh   :
          :   grad. convergence          0.1000000E-02 Eh/α :
          :   maximium RF displ.         2.0000000          :
          :   Hlow (freq-cutoff)         0.5000000E-02      :
          :   Hmax (freq-cutoff)         5.0000000          :
          :   S6 in model hess.         20.0000000          :
          ...................................................

generating ANC from model Hessian ...
Using Lindh-Hessian (1995)
 Shifting diagonal of input Hessian by   3.607723035281221E-003
 Lowest  eigenvalues of input Hessian
   -0.000000   -0.000000   -0.000000   -0.000000    0.000000    0.000000
    0.005000    0.005299    0.005948    0.006315    0.009208    0.010317
    0.011835    0.011926    0.018799    0.019586    0.022687    0.022893
 Highest eigenvalues
    1.776625    1.818634    1.855343    1.965787    2.080012    2.182681
 

........................................................................
.............................. CYCLE    1 ..............................
........................................................................
   1    -39.2897488 -0.392897E+02  0.676E-05    1.50       0.0  T
   2    -39.2897488 -0.738964E-11  0.409E-05    1.50     461.8  T
   3    -39.2897488  0.731859E-12  0.300E-05    1.50     630.8  T
     SCC iter.                  ...        0 min,  0.004 sec
     gradient                   ...        0 min,  0.014 sec
 * total energy  :   -38.6785566 Eh     change       -0.4028117E-08 Eh
   gradient norm :     0.1051918 Eh/α   predicted     0.0000000E+00 (-100.00%)
   displ. norm   :     0.2001314 α      lambda       -0.9069708E-02
   maximum displ.:     0.0830667 α      in ANC's #14, #16, #7, ...

........................................................................
.............................. CYCLE    2 ..............................
........................................................................
   1    -39.3121489 -0.393121E+02  0.169E-01    1.61       0.0  T
   2    -39.3122167 -0.677191E-04  0.106E-01    1.61       1.0  T
   3    -39.3121832  0.335042E-04  0.601E-02    1.61       1.0  T
   4    -39.3122551 -0.718952E-04  0.119E-02    1.60       1.6  T
   5    -39.3122586 -0.355337E-05  0.303E-03    1.60       6.2  T
   6    -39.3122587 -0.549717E-07  0.147E-03    1.60      12.8  T
     SCC iter.                  ...        0 min,  0.007 sec
     gradient                   ...        0 min,  0.014 sec
 * total energy  :   -38.6848716 Eh     change       -0.6314999E-02 Eh
   gradient norm :     0.0471575 Eh/α   predicted    -0.4716497E-02 ( -25.31%)
   displ. norm   :     0.1379762 α      lambda       -0.2653588E-02
   maximum displ.:     0.0983173 α      in ANC's #7, #9, #14, ...

........................................................................
.............................. CYCLE    3 ..............................
........................................................................
   1    -39.3248125 -0.393248E+02  0.135E-01    1.68       0.0  T
   2    -39.3248458 -0.333248E-04  0.799E-02    1.67       1.0  T
   3    -39.3248214  0.244282E-04  0.485E-02    1.68       1.0  T
   4    -39.3248706 -0.492406E-04  0.645E-03    1.67       2.9  T
   5    -39.3248715 -0.922928E-06  0.241E-03    1.67       7.8  T
   6    -39.3248716 -0.276273E-07  0.980E-04    1.67      19.3  T
     SCC iter.                  ...        0 min,  0.007 sec
     gradient                   ...        0 min,  0.014 sec
 * total energy  :   -38.6862270 Eh     change       -0.1355331E-02 Eh
   gradient norm :     0.0086989 Eh/α   predicted    -0.1352056E-02 (  -0.24%)
   displ. norm   :     0.0643064 α      lambda       -0.1413079E-03
   maximum displ.:     0.0465304 α      in ANC's #7, #1, #3, ...

........................................................................
.............................. CYCLE    4 ..............................
........................................................................
   1    -39.3234395 -0.393234E+02  0.370E-02    1.67       0.0  T
   2    -39.3234403 -0.833789E-06  0.210E-02    1.67       1.0  T
   3    -39.3234398  0.527378E-06  0.564E-03    1.67       3.3  T
   4    -39.3234405 -0.725883E-06  0.161E-03    1.67      11.7  T
   5    -39.3234405 -0.492129E-07  0.645E-04    1.67      29.3  T
     SCC iter.                  ...        0 min,  0.006 sec
     gradient                   ...        0 min,  0.014 sec
 * total energy  :   -38.6863327 Eh     change       -0.1057687E-03 Eh
   gradient norm :     0.0044988 Eh/α   predicted    -0.7103299E-04 ( -32.84%)
   displ. norm   :     0.0856323 α      lambda       -0.8338880E-04
   maximum displ.:     0.0524301 α      in ANC's #7, #1, #3, ...

........................................................................
.............................. CYCLE    5 ..............................
........................................................................
   1    -39.3226261 -0.393226E+02  0.467E-02    1.68       0.0  T
   2    -39.3226271 -0.101071E-05  0.264E-02    1.68       1.0  T
   3    -39.3226251  0.201490E-05  0.939E-03    1.68       2.0  T
   4    -39.3226277 -0.256609E-05  0.163E-03    1.68      11.6  T
   5    -39.3226277 -0.261092E-07  0.662E-04    1.68      28.6  T
     SCC iter.                  ...        0 min,  0.006 sec
     gradient                   ...        0 min,  0.014 sec
 * total energy  :   -38.6863802 Eh     change       -0.4743520E-04 Eh
   gradient norm :     0.0011513 Eh/α   predicted    -0.4200235E-04 ( -11.45%)
   displ. norm   :     0.0570964 α      lambda       -0.1096580E-04
   maximum displ.:     0.0402998 α      in ANC's #1, #3, #7, ...

........................................................................
.............................. CYCLE    6 ..............................
........................................................................
   1    -39.3228167 -0.393228E+02  0.271E-02    1.68       0.0  T
   2    -39.3228169 -0.207223E-06  0.155E-02    1.68       1.2  T
   3    -39.3228162  0.754744E-06  0.519E-03    1.68       3.6  T
   4    -39.3228171 -0.920168E-06  0.682E-04    1.68      27.7  T
   5    -39.3228171 -0.619401E-09  0.142E-04    1.68     133.5  T
     SCC iter.                  ...        0 min,  0.006 sec
     gradient                   ...        0 min,  0.015 sec
 * total energy  :   -38.6863936 Eh     change       -0.1340727E-04 Eh
   gradient norm :     0.0011824 Eh/α   predicted    -0.5491028E-05 ( -59.04%)
   displ. norm   :     0.0715970 α      lambda       -0.1374654E-04
   maximum displ.:     0.0500547 α      in ANC's #1, #3, #4, ...

........................................................................
.............................. CYCLE    7 ..............................
........................................................................
   1    -39.3232182 -0.393232E+02  0.321E-02    1.68       0.0  T
   2    -39.3232184 -0.176585E-06  0.185E-02    1.68       1.0  T
   3    -39.3232181  0.285601E-06  0.324E-03    1.68       5.8  T
   4    -39.3232185 -0.374151E-06  0.670E-04    1.68      28.2  T
   5    -39.3232185 -0.103338E-08  0.235E-04    1.68      80.4  T
     SCC iter.                  ...        0 min,  0.006 sec
     gradient                   ...        0 min,  0.015 sec
 * total energy  :   -38.6864113 Eh     change       -0.1774481E-04 Eh
   gradient norm :     0.0011786 Eh/α   predicted    -0.6889843E-05 ( -61.17%)
   displ. norm   :     0.1063885 α      lambda       -0.1656260E-04
   maximum displ.:     0.0738732 α      in ANC's #1, #3, #4, ...

........................................................................
.............................. CYCLE    8 ..............................
........................................................................
   1    -39.3231629 -0.393232E+02  0.464E-02    1.68       0.0  T
   2    -39.3231631 -0.254093E-06  0.269E-02    1.68       1.0  T
   3    -39.3231632 -0.556700E-07  0.160E-03    1.68      11.8  T
   4    -39.3231632 -0.342745E-07  0.892E-04    1.68      21.2  T
   5    -39.3231632 -0.108966E-07  0.143E-04    1.68     132.0  T
     SCC iter.                  ...        0 min,  0.006 sec
     gradient                   ...        0 min,  0.015 sec
 * total energy  :   -38.6864335 Eh     change       -0.2211602E-04 Eh
   gradient norm :     0.0012708 Eh/α   predicted    -0.8323525E-05 ( -62.36%)
   displ. norm   :     0.1454885 α      lambda       -0.1903941E-04
   maximum displ.:     0.1010961 α      in ANC's #3, #1, #5, ...

........................................................................
.............................. CYCLE    9 ..............................
........................................................................
   1    -39.3230111 -0.393230E+02  0.641E-02    1.68       0.0  T
   2    -39.3230116 -0.470317E-06  0.371E-02    1.68       1.0  T
   3    -39.3230118 -0.160688E-06  0.179E-03    1.68      10.6  T
   4    -39.3230118 -0.195492E-09  0.107E-03    1.68      17.7  T
   5    -39.3230118 -0.217565E-07  0.210E-04    1.68      90.0  T
   6    -39.3230118 -0.678561E-09  0.648E-05    1.68     291.7  T
     SCC iter.                  ...        0 min,  0.007 sec
     gradient                   ...        0 min,  0.015 sec
 * total energy  :   -38.6864574 Eh     change       -0.2396539E-04 Eh
   gradient norm :     0.0007915 Eh/α   predicted    -0.9612328E-05 ( -59.89%)
   displ. norm   :     0.1465144 α      lambda       -0.1335265E-04
   maximum displ.:     0.1022173 α      in ANC's #1, #3, #5, ...

........................................................................
.............................. CYCLE   10 ..............................
........................................................................
   1    -39.3225470 -0.393225E+02  0.645E-02    1.68       0.0  T
   2    -39.3225475 -0.475633E-06  0.374E-02    1.68       1.0  T
   3    -39.3225476 -0.142311E-06  0.194E-03    1.68       9.8  T
   4    -39.3225476 -0.165700E-07  0.120E-03    1.68      15.7  T
   5    -39.3225477 -0.284813E-07  0.170E-04    1.68     111.0  T
   6    -39.3225477 -0.201084E-09  0.586E-05    1.68     322.6  T
     SCC iter.                  ...        0 min,  0.007 sec
     gradient                   ...        0 min,  0.015 sec
 * total energy  :   -38.6864714 Eh     change       -0.1394944E-04 Eh
   gradient norm :     0.0009089 Eh/α   predicted    -0.6744828E-05 ( -51.65%)
   displ. norm   :     0.1215716 α      lambda       -0.8037429E-05
   maximum displ.:     0.0850938 α      in ANC's #3, #1, #5, ...

........................................................................
.............................. CYCLE   11 ..............................
........................................................................
   1    -39.3229264 -0.393229E+02  0.528E-02    1.68       0.0  T
   2    -39.3229268 -0.355249E-06  0.305E-02    1.68       1.0  T
   3    -39.3229269 -0.929651E-07  0.183E-03    1.68      10.3  T
   4    -39.3229269 -0.338832E-07  0.102E-03    1.68      18.6  T
   5    -39.3229269 -0.111878E-07  0.208E-04    1.68      91.1  T
   6    -39.3229269 -0.109491E-08  0.617E-05    1.68     306.1  T
     SCC iter.                  ...        0 min,  0.007 sec
     gradient                   ...        0 min,  0.015 sec
 * total energy  :   -38.6864791 Eh     change       -0.7686217E-05 Eh
   gradient norm :     0.0006872 Eh/α   predicted    -0.4048448E-05 ( -47.33%)
   displ. norm   :     0.0718856 α      lambda       -0.2725696E-05
   maximum displ.:     0.0509332 α      in ANC's #3, #1, #5, ...

........................................................................
.............................. CYCLE   12 ..............................
........................................................................
   1    -39.3230936 -0.393231E+02  0.337E-02    1.68       0.0  T
   2    -39.3230938 -0.163654E-06  0.194E-02    1.68       1.0  T
   3    -39.3230936  0.161284E-06  0.269E-03    1.68       7.0  T
   4    -39.3230939 -0.239277E-06  0.710E-04    1.68      26.6  T
   5    -39.3230939 -0.207715E-08  0.109E-04    1.68     173.9  T
     SCC iter.                  ...        0 min,  0.006 sec
     gradient                   ...        0 min,  0.015 sec
 * total energy  :   -38.6864811 Eh     change       -0.2022246E-05 Eh
   gradient norm :     0.0005469 Eh/α   predicted    -0.1368067E-05 ( -32.35%)
   displ. norm   :     0.0192696 α      lambda       -0.7618963E-06
   maximum displ.:     0.0140290 α      in ANC's #3, #1, #6, ...

   *** GEOMETRY OPTIMIZATION CONVERGED AFTER 12 ITERATIONS ***

------------------------------------------------------------------------
 total energy gain   :        -0.0079244 Eh       -4.9727 kcal/mol
 total RMSD          :         0.1774278 a0        0.0939 Å
 total power (kW/mol):        -1.7337988 (step)  -55.8646 (real)
------------------------------------------------------------------------

 ANCopt (total)                0 d,  0 h,  0 min,  0.372 sec
 optimizer setup                ...        0 min,  0.000 sec (  0.037%)
 model hessian                  ...        0 min,  0.007 sec (  1.912%)
 ANC generation                 ...        0 min,  0.001 sec (  0.216%)
 coordinate transformation      ...        0 min,  0.000 sec (  0.058%)
 single point calculation       ...        0 min,  0.360 sec ( 96.771%)
 optimization log               ...        0 min,  0.001 sec (  0.349%)
 hessian update                 ...        0 min,  0.000 sec (  0.045%)
 rational function              ...        0 min,  0.001 sec (  0.380%)

================
 final structure:
================
$coord
   -2.13542610849015    2.62299127449150    0.23419156454257      C 
   -4.34920031475504    1.29182183206142    0.16156963976129      C 
   -4.33984813554799   -1.35714160468117   -0.03158112651904      C 
   -2.11667151127345   -2.66982901918044   -0.14475215663839      C 
    0.19369346503400   -1.35208346518777   -0.06764337010803      C 
    0.18409369632913    1.32458146691900    0.11425866964948      C 
    2.38258931141939    2.61406140981164    0.15724631792088      N 
    4.50591609689677    1.35156746631540    0.05050930281037      C 
    6.87399170745313    2.91105003575324   -0.02169480261415      C 
    7.63524808116009    3.43759020349487   -2.76232289547527      C 
    4.51603652199555   -1.34254374151679   -0.08514202764578      C 
    6.89850126007942   -2.88142486564807   -0.05893093659305      C 
    7.71017134099734   -3.41130165940764    2.66656825758499      C 
    2.40180753906487   -2.62298511102387   -0.15178715848808      N 
   -2.10123780379488    4.65669936233013    0.37541016262460      H 
   -6.13674255708839    2.27404678065589    0.24797772580391      H 
   -6.12043345870247   -2.35428848407105   -0.08739607823841      H 
   -2.06805577210042   -4.70320890572946   -0.28682130231989      H 
    8.41109225502746    1.96095951900920    0.96636296780456      H 
    6.48194469155434    4.70267034042782    0.91911855908808      H 
    7.99707438526539    1.68656458159115   -3.77834224222842      H 
    9.33508068119085    4.59108397538083   -2.81776783404283      H 
    6.12486470801401    4.44318085200320   -3.72604967739738      H 
    8.41048698817064   -1.91385954999609   -1.06837928305696      H 
    6.50696525690438   -4.67289192150431   -1.00027666607606      H 
    8.05845711410180   -1.66020120543246    3.68710725898758      H 
    9.42951551577095   -4.53665763154375    2.68907258810198      H 
    6.23154678765137   -4.44725709735832    3.64728381700201      H 
$end
           -------------------------------------------------
          |                Final Singlepoint                |
           -------------------------------------------------

          ...................................................
          :                      SETUP                      :
          :.................................................:
          :  # basis functions                  70          :
          :  # atomic orbitals                  70          :
          :  # shells                           42          :
          :  # electrons                        72          :
          :  max. iterations                   250          :
          :  Hamiltonian                  GFN2-xTB          :
          :  restarted?                      false          :
          :  GBSA solvation                  false          :
          :  PC potential                    false          :
          :  electronic temp.          300.0000000     K    :
          :  accuracy                    1.0000000          :
          :  -> integral cutoff          0.2500000E+02      :
          :  -> integral neglect         0.1000000E-07      :
          :  -> SCF convergence          0.1000000E-05 Eh   :
          :  -> wf. convergence          0.1000000E-03 e    :
          :  Broyden damping             0.4000000          :
          ...................................................

 iter      E             dE          RMSdq      gap      omega  full diag
   1    -39.3230939 -0.393231E+02  0.300E-05    1.68       0.0  T
   2    -39.3230939 -0.453326E-11  0.134E-05    1.68    1409.7  T
   3    -39.3230939 -0.112266E-11  0.111E-05    1.68    1708.2  T

   *** convergence criteria satisfied after 3 iterations ***

         #    Occupation            Energy/Eh            Energy/eV
      -------------------------------------------------------------
         1        2.0000           -0.6685342             -18.1917
       ...           ...                  ...                  ...
        30        2.0000           -0.4405304             -11.9874
        31        2.0000           -0.4352297             -11.8432
        32        2.0000           -0.4248705             -11.5613
        33        2.0000           -0.4047587             -11.0140
        34        2.0000           -0.4015126             -10.9257
        35        2.0000           -0.3970221             -10.8035
        36        2.0000           -0.3446286              -9.3778 (HOMO)
        37                         -0.2827924              -7.6952 (LUMO)
        38                         -0.2377645              -6.4699
        39                         -0.2061879              -5.6107
        40                         -0.1621185              -4.4115
        41                         -0.0704772              -1.9178
       ...                                ...                  ...
        70                          0.6968841              18.9632
      -------------------------------------------------------------
                  HL-Gap            0.0618363 Eh            1.6827 eV
             Fermi-level           -0.3137105 Eh           -8.5365 eV

 SCC (total)                   0 d,  0 h,  0 min,  0.028 sec
 SCC setup                      ...        0 min,  0.000 sec (  0.698%)
 Dispersion                     ...        0 min,  0.000 sec (  0.880%)
 integral evaluation            ...        0 min,  0.009 sec ( 30.700%)
 zeroth order Hamiltonian       ...        0 min,  0.000 sec (  0.556%)
 iterations                     ...        0 min,  0.004 sec ( 14.639%)
 molecular gradient             ...        0 min,  0.015 sec ( 51.128%)
 printout                       ...        0 min,  0.000 sec (  1.210%)

         :::::::::::::::::::::::::::::::::::::::::::::::::::::
         ::                     SUMMARY                     ::
         :::::::::::::::::::::::::::::::::::::::::::::::::::::
         :: total energy             -38.686481062352 Eh    ::
         :: gradient norm              0.000546937547 Eh/a0 ::
         :: HOMO-LUMO gap              1.682650786131 eV    ::
         ::.................................................::
         :: SCC energy               -39.323093886467 Eh    ::
         :: -> isotropic ES            0.018939757971 Eh    ::
         :: -> anisotropic ES          0.005508976480 Eh    ::
         :: -> anisotropic XC          0.031862739523 Eh    ::
         :: -> dispersion             -0.026458703128 Eh    ::
         :: repulsion energy           0.636505486258 Eh    ::
         :: add. restraining           0.000000000000 Eh    ::
         :::::::::::::::::::::::::::::::::::::::::::::::::::::

           -------------------------------------------------
          |                Property Printout                |
           -------------------------------------------------

    * Orbital Energies and Occupations

         #    Occupation            Energy/Eh            Energy/eV
      -------------------------------------------------------------
         1        2.0000           -0.6685342             -18.1917
       ...           ...                  ...                  ...
        24        2.0000           -0.4784090             -13.0182
        25        2.0000           -0.4579272             -12.4608
        26        2.0000           -0.4558370             -12.4040
        27        2.0000           -0.4549739             -12.3805
        28        2.0000           -0.4517282             -12.2922
        29        2.0000           -0.4465725             -12.1519
        30        2.0000           -0.4405304             -11.9874
        31        2.0000           -0.4352297             -11.8432
        32        2.0000           -0.4248705             -11.5613
        33        2.0000           -0.4047587             -11.0140
        34        2.0000           -0.4015126             -10.9257
        35        2.0000           -0.3970221             -10.8035
        36        2.0000           -0.3446286              -9.3778 (HOMO)
        37                         -0.2827924              -7.6952 (LUMO)
        38                         -0.2377645              -6.4699
        39                         -0.2061879              -5.6107
        40                         -0.1621185              -4.4115
        41                         -0.0704772              -1.9178
        42                          0.0862241               2.3463
        43                          0.0954999               2.5987
        44                          0.1201416               3.2692
        45                          0.1215046               3.3063
        46                          0.1254584               3.4139
        47                          0.1336479               3.6367
       ...                                ...                  ...
        70                          0.6968841              18.9632
      -------------------------------------------------------------
                  HL-Gap            0.0618363 Eh            1.6827 eV
             Fermi-level           -0.3137105 Eh           -8.5365 eV

     #   Z        covCN         q      C6AA      α(0)
     1   6 C      2.917    -0.040    28.988     8.829
     2   6 C      2.917    -0.029    28.716     8.788
     3   6 C      2.917    -0.029    28.716     8.788
     4   6 C      2.917    -0.040    28.988     8.829
     5   6 C      2.965     0.077    26.272     8.407
     6   6 C      2.965     0.077    26.272     8.407
     7   7 N      1.849    -0.240    27.111     7.717
     8   6 C      2.944     0.088    26.049     8.371
     9   6 C      3.809    -0.064    21.714     6.633
    10   6 C      3.754    -0.096    22.396     6.748
    11   6 C      2.944     0.088    26.048     8.371
    12   6 C      3.809    -0.064    21.713     6.633
    13   6 C      3.754    -0.096    22.396     6.748
    14   7 N      1.849    -0.240    27.110     7.717
    15   1 H      0.926     0.051     2.313     2.378
    16   1 H      0.926     0.038     2.482     2.464
    17   1 H      0.926     0.038     2.482     2.464
    18   1 H      0.926     0.051     2.313     2.378
    19   1 H      0.925     0.041     2.433     2.439
    20   1 H      0.924     0.056     2.244     2.343
    21   1 H      0.925     0.033     2.541     2.493
    22   1 H      0.925     0.040     2.445     2.445
    23   1 H      0.925     0.044     2.397     2.421
    24   1 H      0.925     0.041     2.433     2.439
    25   1 H      0.924     0.056     2.244     2.343
    26   1 H      0.925     0.033     2.541     2.493
    27   1 H      0.925     0.040     2.445     2.445
    28   1 H      0.925     0.044     2.396     2.420

 Mol. C6AA /au·bohr⁶  :       8601.232802
 Mol. C8AA /au·bohr⁸  :     202903.155276
 Mol. α(0) /au        :        144.950789


Wiberg/Mayer (AO) data.
largest (>0.10) Wiberg bond orders for each atom
          total WBO             WBO to atom ...
     1  C   3.987        C    2 1.556    C    6 1.271    H   15 0.967    C    4 0.118
     2  C   3.989        C    1 1.556    C    3 1.321    H   16 0.971
     3  C   3.989        C    4 1.556    C    2 1.321    H   17 0.971
     4  C   3.987        C    3 1.556    C    5 1.271    H   18 0.967    C    1 0.118
     5  C   3.981        N   14 1.282    C    4 1.271    C    6 1.227
     6  C   3.981        N    7 1.282    C    1 1.271    C    5 1.227
     7  N   3.063        C    8 1.539    C    6 1.282
     8  C   3.974        N    7 1.539    C   11 1.215    C    9 1.009
     9  C   3.995        C    8 1.009    C   10 0.996    H   20 0.972    H   19 0.969
    10  C   3.992        C    9 0.996    H   23 0.988    H   21 0.987    H   22 0.985
    11  C   3.974        N   14 1.539    C    8 1.215    C   12 1.009
    12  C   3.995        C   11 1.009    C   13 0.996    H   25 0.972    H   24 0.969
    13  C   3.992        C   12 0.996    H   28 0.988    H   26 0.987    H   27 0.985
    14  N   3.063        C   11 1.539    C    5 1.282
    15  H   0.997        C    1 0.967
    16  H   0.998        C    2 0.971
    17  H   0.998        C    3 0.971
    18  H   0.997        C    4 0.967
    19  H   0.997        C    9 0.969
    20  H   0.997        C    9 0.972
    21  H   0.999        C   10 0.987
    22  H   0.997        C   10 0.985
    23  H   0.998        C   10 0.988
    24  H   0.997        C   12 0.969
    25  H   0.997        C   12 0.972
    26  H   0.999        C   13 0.987
    27  H   0.997        C   13 0.985
    28  H   0.998        C   13 0.988

molecular dipole:
                 x           y           z       tot (Debye)
 q only:        0.323       0.001      -0.003
   full:        0.334       0.001      -0.004       0.848
molecular quadrupole (traceless):
                xx          xy          yy          xz          yz          zz
 q only:        8.660       0.037      -3.714      -0.114      -0.658      -4.946
  q+dip:       12.467       0.061      -4.183      -0.179      -0.124      -8.284
   full:       10.816       0.060      -7.059      -0.120      -0.734      -3.758

           -------------------------------------------------
          |                Geometry Summary                 |
           -------------------------------------------------

      molecular mass/u    :      186.2560000
   center of mass at/Å    :        1.2366070      -0.0028281       0.0014288
  moments of inertia/u·Å² :        0.3978271E+03   0.1018646E+04   0.1308542E+04
rotational constants/cm⁻¹ :        0.4237427E-01   0.1654906E-01   0.1288276E-01

 * 27 selected distances

     #   Z        #   Z                                     value/Å
     1   6 C      2   6 C                                 1.3674991
     2   6 C      3   6 C                                 1.4055014
     3   6 C      4   6 C                                 1.3675388
     4   6 C      5   6 C                                 1.4080675
     1   6 C      6   6 C                                 1.4080913
     5   6 C      6   6 C                                 1.4197063
     6   6 C      7   7 N                                 1.3489339
     7   7 N      8   6 C                                 1.3084490
     9   6 C     10   6 C                                 1.5307588
     8   6 C     11   6 C                                 1.4274785
    12   6 C     13   6 C                                 1.5307703 (max)
     5   6 C     14   7 N                                 1.3489391
    11   6 C     14   7 N                                 1.3084635
     1   6 C     15   1 H                                 1.0789352 (min)
     2   6 C     16   1 H                                 1.0802917
     3   6 C     17   1 H                                 1.0803386
     4   6 C     18   1 H                                 1.0789483
     9   6 C     19   1 H                                 1.0898493
     9   6 C     20   1 H                                 1.0907644
    10   6 C     21   1 H                                 1.0882675
    10   6 C     22   1 H                                 1.0874629
    10   6 C     23   1 H                                 1.0872294
    12   6 C     24   1 H                                 1.0898058
    12   6 C     25   1 H                                 1.0907711
    13   6 C     26   1 H                                 1.0882483
    13   6 C     27   1 H                                 1.0874660
    13   6 C     28   1 H                                 1.0872419

 * 3 distinct bonds (by element types)

   Z      Z             #   av. dist./Å        max./Å        min./Å
   1 H    6 C          14     1.0861157     1.0907711     1.0789352
   6 C    6 C           9     1.4294902     1.5307703     1.3674991
   6 C    7 N           4     1.3286964     1.3489391     1.3084490


optimized geometry written to: xtbopt.xyz


           -------------------------------------------------
          | TOTAL ENERGY              -38.686481062352 Eh   |
          | GRADIENT NORM               0.000546937547 Eh/α |
          | HOMO-LUMO GAP               1.682650786131 eV   |
           -------------------------------------------------

------------------------------------------------------------------------
 * finished run on 2021/05/19 at 11:00:34.076     
------------------------------------------------------------------------
 total:
 * wall-time:     0 d,  0 h,  0 min,  0.486 sec
 *  cpu-time:     0 d,  0 h,  0 min,  0.461 sec
 * ratio c/w:     0.948 speedup
 SCF:
 * wall-time:     0 d,  0 h,  0 min,  0.052 sec
 *  cpu-time:     0 d,  0 h,  0 min,  0.039 sec
 * ratio c/w:     0.750 speedup
 ANC optimizer:
 * wall-time:     0 d,  0 h,  0 min,  0.401 sec
 *  cpu-time:     0 d,  0 h,  0 min,  0.401 sec
 * ratio c/w:     1.000 speedup

