      -----------------------------------------------------------      
     |                   =====================                   |     
     |                           x T B                           |     
     |                   =====================                   |     
     |                         S. Grimme                         |     
     |          Mulliken Center for Theoretical Chemistry        |     
     |                    University of Bonn                     |     
     |                Version 6.2 RC2 (SAW190805)                |     
      -----------------------------------------------------------      

   This program is distributed in the hope that it will be useful,
   but WITHOUT ANY WARRANTY; without even the implied warranty of
   MERCHANTABILITY or FITNESS FOR A PARTICULAR PURPOSE.
   
   FOR NON-COMMERCIAL, ACADEMIA USE ONLY.
   
   Cite this work as:
   * S. Grimme, C. Bannwarth, P. Shushkov, J. Chem. Theory Comput., 2017,
     13, 1989-2009. DOI: 10.1021/acs.jctc.7b00118
   * C. Bannwarth, S. Ehlert and S. Grimme., J. Chem. Theory Comput., 2019,
     15, 1652-1671. DOI: 10.1021/acs.jctc.8b01176
   * P. Pracht, E. Caldeweyher, S. Ehlert, S. Grimme, ChemRxiv, 2019, preprint.
     DOI: 10.26434/chemrxiv.8326202.v1
   
   for DFT-D4:
   * E. Caldeweyher, C. Bannwarth and S. Grimme, J. Chem. Phys., 2017,
     147, 034112. DOI: 10.1063/1.4993215
   * E. Caldeweyher, S. Ehlert, A. Hansen, H. Neugebauer, S. Spicher,
     C. Bannwarth and S. Grimme, J. Chem. Phys., 2019, 150, 154122.
     DOI: 10.1063/1.5090222
   
   for sTDA-xTB:
   * S. Grimme and C. Bannwarth, J. Chem. Phys., 2016, 145, 054103.
     DOI: 10.1063/1.4959605
   
   in the mass-spec context:
   * V. Asgeirsson, C. Bauer and S. Grimme, Chem. Sci., 2017, 8, 4879.
     DOI: 10.1039/c7sc00601b
   
   for metadynamics refer to:
   * S. Grimme, J. Chem. Theory Comput., 2019, 155, 2847-2862
     DOI: 10.1021/acs.jctc.9b00143
   
   with help from (in alphabetical order)
   C. Bannwarth, F. Bohle, G. Brandenburg, E. Caldeweyher, M. Checinski,
   S. Dohm, S. Ehlert, S. Ehrlich, F. März, H. Neugebauer, J. Pisarek,
   P. Pracht, P. Shushkov, and S. Spicher.
   
 * started run on 2021/05/19 at 11:00:36.196     

           -------------------------------------------------
          |                Calculation Setup                |
           -------------------------------------------------

          program call               : /ihome/ghutchison/geoffh/xtb/xtb 930.xyz -opt
          hostname                   : smp-n122
          coordinate file            : 930.xyz
          omp threads                :                     1
          number of atoms            :                    27
          number of electrons        :                    76
          charge                     :                     0
          spin                       :                   0.0
          first test random number   :      0.12170066048603


########################################################################
# WARNING! Please study the warnings concerning your input carefully
#  - the use of '-opt' is discouraged, please use '--opt' next time
########################################################################

           ------------------------------------------------- 
          |                 G F N 2 - x T B                 |
          | Geometry, Frequencies, Noncovalent interactions |
          |            JCTC 2019 parametrisation            |
           ------------------------------------------------- 
             KAB for C  - Si     :                1.0500
             KAB for H  - Pd     :                0.9500
             k(s)              :                1.8500
             k(p)              :                2.2300
             k(d)              :                2.2300
             k(f)              :                2.0000
             kEN (H0ij)        :               -2.0000
             D4 a1             :                0.5200
             D4 a2             :                5.0000
             D4 s6             :                1.0000
             D4 s8             :                2.7000
             D4 s9             :                5.0000
             alphaj            :                2.0000

  Z AO/shell   Hii/eV     exponent
  1     Wed Apr 25 08:07:45 CEST 2018   EN: 2.200 GM2: 0.406  GM3: 0.0800  RAES: 1.40
     1s    -10.707211    1.230000
  6     Wed Apr 25 08:07:45 CEST 2018   EN: 2.550 GM2: 0.538  GM3: 0.1500  RAES: 3.00
     2s    -13.970922    2.096432
     2p    -10.063292    1.800000
 16     Tue Apr 24 11:44:34 CEST 2018   EN: 2.580 GM2: 0.340  GM3:-0.0502  RAES: 3.10
     3s    -20.029654    1.981333
     3p    -11.377694    2.025643
     3d     -0.420282    1.702555

           ------------------------------------------------- 
          |        Self-Consistent Charge Iterations        |
           ------------------------------------------------- 

          ...................................................
          :                      SETUP                      :
          :.................................................:
          :  # basis functions                  84          :
          :  # atomic orbitals                  82          :
          :  # shells                           44          :
          :  # electrons                        76          :
          :  max. iterations                   250          :
          :  Hamiltonian                  GFN2-xTB          :
          :  restarted?                      false          :
          :  GBSA solvation                  false          :
          :  PC potential                    false          :
          :  electronic temp.          300.0000000     K    :
          :  accuracy                    1.0000000          :
          :  -> integral cutoff          0.2500000E+02      :
          :  -> integral neglect         0.1000000E-07      :
          :  -> SCF convergence          0.1000000E-05 Eh   :
          :  -> wf. convergence          0.1000000E-03 e    :
          :  Broyden damping             0.4000000          :
          ...................................................

 iter      E             dE          RMSdq      gap      omega  full diag
   1    -40.9928403 -0.409928E+02  0.395E+00    2.21       0.0  T
   2    -41.0195669 -0.267266E-01  0.230E+00    2.21       1.0  T
   3    -41.0056598  0.139070E-01  0.101E+00    2.26       1.0  T
   4    -41.0226084 -0.169486E-01  0.448E-01    2.21       1.0  T
   5    -41.0253372 -0.272877E-02  0.146E-01    2.22       1.0  T
   6    -41.0255088 -0.171568E-03  0.769E-02    2.23       1.0  T
   7    -41.0256224 -0.113672E-03  0.218E-02    2.22       1.0  T
   8    -41.0256269 -0.448552E-05  0.102E-02    2.22       1.9  T
   9    -41.0256272 -0.315554E-06  0.515E-03    2.22       3.7  T
  10    -41.0256275 -0.313992E-06  0.202E-03    2.22       9.5  T
  11    -41.0256276 -0.239310E-07  0.762E-04    2.22      25.2  T
  12    -41.0256276 -0.471626E-08  0.419E-04    2.22      45.9  T

   *** convergence criteria satisfied after 12 iterations ***

         #    Occupation            Energy/Eh            Energy/eV
      -------------------------------------------------------------
         1        2.0000           -0.7326657             -19.9368
       ...           ...                  ...                  ...
        32        2.0000           -0.4360792             -11.8663
        33        2.0000           -0.4335843             -11.7984
        34        2.0000           -0.4276072             -11.6358
        35        2.0000           -0.4020204             -10.9395
        36        2.0000           -0.3968562             -10.7990
        37        2.0000           -0.3912192             -10.6456
        38        2.0000           -0.3552219              -9.6661 (HOMO)
        39                         -0.2735236              -7.4430 (LUMO)
        40                         -0.2332280              -6.3465
        41                         -0.2023787              -5.5070
        42                         -0.1963732              -5.3436
        43                         -0.1939279              -5.2770
       ...                                ...                  ...
        82                          0.7383815              20.0924
      -------------------------------------------------------------
                  HL-Gap            0.0816983 Eh            2.2231 eV
             Fermi-level           -0.3143727 Eh           -8.5545 eV

 SCC (total)                   0 d,  0 h,  0 min,  0.055 sec
 SCC setup                      ...        0 min,  0.000 sec (  0.638%)
 Dispersion                     ...        0 min,  0.000 sec (  0.795%)
 integral evaluation            ...        0 min,  0.016 sec ( 29.306%)
 zeroth order Hamiltonian       ...        0 min,  0.000 sec (  0.447%)
 iterations                     ...        0 min,  0.018 sec ( 32.976%)
 molecular gradient             ...        0 min,  0.019 sec ( 35.002%)
 printout                       ...        0 min,  0.000 sec (  0.737%)

         :::::::::::::::::::::::::::::::::::::::::::::::::::::
         ::                     SUMMARY                     ::
         :::::::::::::::::::::::::::::::::::::::::::::::::::::
         :: total energy             -40.405603477276 Eh    ::
         :: gradient norm              0.075778857936 Eh/a0 ::
         :: HOMO-LUMO gap              2.223123217737 eV    ::
         ::.................................................::
         :: SCC energy               -41.025627567779 Eh    ::
         :: -> isotropic ES            0.003425587193 Eh    ::
         :: -> anisotropic ES          0.005719214832 Eh    ::
         :: -> anisotropic XC          0.020412932757 Eh    ::
         :: -> dispersion             -0.032309160989 Eh    ::
         :: repulsion energy           0.619868063826 Eh    ::
         :: add. restraining           0.000000000000 Eh    ::
         :::::::::::::::::::::::::::::::::::::::::::::::::::::

      ----------------------------------------------------------- 
     |                   =====================                   |
     |                        A N C O P T                        |
     |                   =====================                   |
     |               Approximate Normal Coordinate               |
     |                Rational Function Optimizer                |
      ----------------------------------------------------------- 

          ...................................................
          :                      SETUP                      :
          :.................................................:
          :   optimization level            normal          :
          :   max. optcycles                   200          :
          :   ANC micro-cycles                  20          :
          :   degrees of freedom                75          :
          :.................................................:
          :   RF solver                   davidson          :
          :   input Hessian                  false          :
          :   write xtbopt.log                true          :
          :   linear?                        false          :
          :   energy convergence         0.5000000E-05 Eh   :
          :   grad. convergence          0.1000000E-02 Eh/α :
          :   maximium RF displ.         2.0000000          :
          :   Hlow (freq-cutoff)         0.5000000E-02      :
          :   Hmax (freq-cutoff)         5.0000000          :
          :   S6 in model hess.         20.0000000          :
          ...................................................

generating ANC from model Hessian ...
Using Lindh-Hessian (1995)
 Shifting diagonal of input Hessian by   3.898494350255457E-003
 Lowest  eigenvalues of input Hessian
   -0.000000   -0.000000    0.000000    0.000000    0.000000    0.000000
    0.005000    0.006472    0.007700    0.008088    0.009006    0.011146
    0.011921    0.012447    0.012744    0.013646    0.014359    0.020086
 Highest eigenvalues
    1.756646    1.787279    1.821957    1.970974    1.975337    2.064785
 

........................................................................
.............................. CYCLE    1 ..............................
........................................................................
   1    -41.0256276 -0.410256E+02  0.254E-04    2.22       0.0  T
   2    -41.0256276 -0.112834E-09  0.187E-04    2.22     102.7  T
   3    -41.0256276 -0.544574E-09  0.111E-04    2.22     173.2  T
     SCC iter.                  ...        0 min,  0.005 sec
     gradient                   ...        0 min,  0.019 sec
 * total energy  :   -40.4056035 Eh     change       -0.3267456E-07 Eh
   gradient norm :     0.0757782 Eh/α   predicted     0.0000000E+00 (-100.00%)
   displ. norm   :     0.2519272 α      lambda       -0.7747261E-02
   maximum displ.:     0.1564051 α      in ANC's #14, #4, #18, ...

........................................................................
.............................. CYCLE    2 ..............................
........................................................................
   1    -41.0453606 -0.410454E+02  0.214E-01    2.22       0.0  T
   2    -41.0454247 -0.641384E-04  0.134E-01    2.23       1.0  T
   3    -41.0454979 -0.731745E-04  0.750E-02    2.22       1.0  T
   4    -41.0455898 -0.918867E-04  0.229E-02    2.22       1.0  T
   5    -41.0455930 -0.319791E-05  0.139E-02    2.23       1.4  T
   6    -41.0455954 -0.240106E-05  0.352E-03    2.22       5.5  T
   7    -41.0455955 -0.115685E-06  0.123E-03    2.22      15.7  T
     SCC iter.                  ...        0 min,  0.010 sec
     gradient                   ...        0 min,  0.018 sec
 * total energy  :   -40.4109845 Eh     change       -0.5381038E-02 Eh
   gradient norm :     0.0357667 Eh/α   predicted    -0.4119501E-02 ( -23.44%)
   displ. norm   :     0.2431066 α      lambda       -0.2589588E-02
   maximum displ.:     0.1448378 α      in ANC's #14, #4, #7, ...

........................................................................
.............................. CYCLE    3 ..............................
........................................................................
   1    -41.0525322 -0.410525E+02  0.167E-01    2.21       0.0  T
   2    -41.0525686 -0.363908E-04  0.995E-02    2.21       1.0  T
   3    -41.0525729 -0.431436E-05  0.615E-02    2.21       1.0  T
   4    -41.0526369 -0.639740E-04  0.179E-02    2.21       1.1  T
   5    -41.0526387 -0.185160E-05  0.105E-02    2.21       1.8  T
   6    -41.0526401 -0.138182E-05  0.332E-03    2.21       5.8  T
   7    -41.0526402 -0.121742E-06  0.134E-03    2.21      14.3  T
     SCC iter.                  ...        0 min,  0.010 sec
     gradient                   ...        0 min,  0.018 sec
 * total energy  :   -40.4125386 Eh     change       -0.1554003E-02 Eh
   gradient norm :     0.0114942 Eh/α   predicted    -0.1371318E-02 ( -11.76%)
   displ. norm   :     0.1581839 α      lambda       -0.3873943E-03
   maximum displ.:     0.0838042 α      in ANC's #4, #14, #7, ...

........................................................................
.............................. CYCLE    4 ..............................
........................................................................
   1    -41.0507218 -0.410507E+02  0.736E-02    2.20       0.0  T
   2    -41.0507257 -0.390156E-05  0.418E-02    2.20       1.0  T
   3    -41.0507174  0.831505E-05  0.255E-02    2.20       1.0  T
   4    -41.0507285 -0.110532E-04  0.642E-03    2.20       3.0  T
   5    -41.0507289 -0.447422E-06  0.340E-03    2.20       5.7  T
   6    -41.0507290 -0.944662E-07  0.147E-03    2.20      13.1  T
   7    -41.0507290 -0.347911E-07  0.693E-04    2.20      27.8  T
     SCC iter.                  ...        0 min,  0.010 sec
     gradient                   ...        0 min,  0.018 sec
 * total energy  :   -40.4128035 Eh     change       -0.2649039E-03 Eh
   gradient norm :     0.0052841 Eh/α   predicted    -0.1985445E-03 ( -25.05%)
   displ. norm   :     0.1494861 α      lambda       -0.1651350E-03
   maximum displ.:     0.0786865 α      in ANC's #4, #2, #1, ...

........................................................................
.............................. CYCLE    5 ..............................
........................................................................
   1    -41.0488053 -0.410488E+02  0.760E-02    2.20       0.0  T
   2    -41.0488067 -0.146029E-05  0.431E-02    2.20       1.0  T
   3    -41.0488049  0.182575E-05  0.123E-02    2.20       1.6  T
   4    -41.0488070 -0.210791E-05  0.441E-03    2.20       4.4  T
   5    -41.0488072 -0.136295E-06  0.254E-03    2.20       7.6  T
   6    -41.0488073 -0.106489E-06  0.787E-04    2.20      24.4  T
     SCC iter.                  ...        0 min,  0.009 sec
     gradient                   ...        0 min,  0.018 sec
 * total energy  :   -40.4129164 Eh     change       -0.1129733E-03 Eh
   gradient norm :     0.0033485 Eh/α   predicted    -0.8441458E-04 ( -25.28%)
   displ. norm   :     0.1246645 α      lambda       -0.8033851E-04
   maximum displ.:     0.0635632 α      in ANC's #2, #1, #4, ...

........................................................................
.............................. CYCLE    6 ..............................
........................................................................
   1    -41.0483340 -0.410483E+02  0.647E-02    2.19       0.0  T
   2    -41.0483345 -0.510545E-06  0.371E-02    2.19       1.0  T
   3    -41.0483321  0.243207E-05  0.109E-02    2.19       1.8  T
   4    -41.0483349 -0.278992E-05  0.290E-03    2.19       6.6  T
   5    -41.0483349 -0.271642E-07  0.120E-03    2.19      16.0  T
   6    -41.0483349 -0.255842E-07  0.430E-04    2.19      44.7  T
   7    -41.0483349 -0.118507E-08  0.281E-04    2.19      68.5  T
     SCC iter.                  ...        0 min,  0.010 sec
     gradient                   ...        0 min,  0.019 sec
 * total energy  :   -40.4129776 Eh     change       -0.6113752E-04 Eh
   gradient norm :     0.0035857 Eh/α   predicted    -0.4080520E-04 ( -33.26%)
   displ. norm   :     0.1402140 α      lambda       -0.7395534E-04
   maximum displ.:     0.0793617 α      in ANC's #1, #2, #4, ...

........................................................................
.............................. CYCLE    7 ..............................
........................................................................
   1    -41.0487456 -0.410487E+02  0.748E-02    2.19       0.0  T
   2    -41.0487463 -0.663331E-06  0.430E-02    2.19       1.0  T
   3    -41.0487430  0.330518E-05  0.128E-02    2.19       1.5  T
   4    -41.0487467 -0.375002E-05  0.324E-03    2.19       5.9  T
   5    -41.0487468 -0.567347E-07  0.107E-03    2.19      17.9  T
   6    -41.0487468 -0.139538E-07  0.475E-04    2.19      40.5  T
   7    -41.0487468 -0.374015E-08  0.210E-04    2.19      91.4  T
     SCC iter.                  ...        0 min,  0.010 sec
     gradient                   ...        0 min,  0.019 sec
 * total energy  :   -40.4130335 Eh     change       -0.5594064E-04 Eh
   gradient norm :     0.0036281 Eh/α   predicted    -0.3770568E-04 ( -32.60%)
   displ. norm   :     0.1410213 α      lambda       -0.6141923E-04
   maximum displ.:     0.0881184 α      in ANC's #1, #2, #5, ...

........................................................................
.............................. CYCLE    8 ..............................
........................................................................
   1    -41.0495679 -0.410496E+02  0.749E-02    2.19       0.0  T
   2    -41.0495686 -0.676945E-06  0.430E-02    2.19       1.0  T
   3    -41.0495672  0.142408E-05  0.942E-03    2.19       2.0  T
   4    -41.0495688 -0.160113E-05  0.335E-03    2.19       5.7  T
   5    -41.0495689 -0.110532E-06  0.964E-04    2.19      20.0  T
   6    -41.0495689 -0.543172E-08  0.438E-04    2.19      43.9  T
     SCC iter.                  ...        0 min,  0.009 sec
     gradient                   ...        0 min,  0.019 sec
 * total energy  :   -40.4130797 Eh     change       -0.4619532E-04 Eh
   gradient norm :     0.0031506 Eh/α   predicted    -0.3132101E-04 ( -32.20%)
   displ. norm   :     0.1432578 α      lambda       -0.5422004E-04
   maximum displ.:     0.0970357 α      in ANC's #1, #2, #5, ...

........................................................................
.............................. CYCLE    9 ..............................
........................................................................
   1    -41.0502414 -0.410502E+02  0.756E-02    2.18       0.0  T
   2    -41.0502421 -0.668486E-06  0.431E-02    2.18       1.0  T
   3    -41.0502418  0.279289E-06  0.633E-03    2.18       3.0  T
   4    -41.0502421 -0.289928E-06  0.364E-03    2.18       5.3  T
   5    -41.0502422 -0.170662E-06  0.106E-03    2.18      18.1  T
   6    -41.0502423 -0.173457E-07  0.255E-04    2.18      75.6  T
   7    -41.0502423 -0.127929E-08  0.118E-04    2.18     163.5  T
     SCC iter.                  ...        0 min,  0.010 sec
     gradient                   ...        0 min,  0.019 sec
 * total energy  :   -40.4131198 Eh     change       -0.4013932E-04 Eh
   gradient norm :     0.0026070 Eh/α   predicted    -0.2767334E-04 ( -31.06%)
   displ. norm   :     0.1621304 α      lambda       -0.5834749E-04
   maximum displ.:     0.1159065 α      in ANC's #1, #2, #5, ...

........................................................................
.............................. CYCLE   10 ..............................
........................................................................
   1    -41.0506850 -0.410507E+02  0.914E-02    2.18       0.0  T
   2    -41.0506861 -0.108221E-05  0.515E-02    2.18       1.0  T
   3    -41.0506848  0.125407E-05  0.987E-03    2.18       2.0  T
   4    -41.0506862 -0.136875E-05  0.490E-03    2.18       3.9  T
   5    -41.0506865 -0.276378E-06  0.129E-03    2.18      14.9  T
   6    -41.0506865 -0.392090E-07  0.314E-04    2.18      61.3  T
   7    -41.0506865 -0.198349E-08  0.132E-04    2.18     145.3  T
     SCC iter.                  ...        0 min,  0.010 sec
     gradient                   ...        0 min,  0.019 sec
 * total energy  :   -40.4131596 Eh     change       -0.3972820E-04 Eh
   gradient norm :     0.0028433 Eh/α   predicted    -0.2994167E-04 ( -24.63%)
   displ. norm   :     0.1619064 α      lambda       -0.4818738E-04
   maximum displ.:     0.1184155 α      in ANC's #1, #2, #5, ...

........................................................................
.............................. CYCLE   11 ..............................
........................................................................
   1    -41.0504508 -0.410505E+02  0.880E-02    2.18       0.0  T
   2    -41.0504519 -0.112986E-05  0.490E-02    2.18       1.0  T
   3    -41.0504510  0.972040E-06  0.918E-03    2.18       2.1  T
   4    -41.0504521 -0.108247E-05  0.489E-03    2.18       3.9  T
   5    -41.0504524 -0.307571E-06  0.897E-04    2.18      21.4  T
   6    -41.0504524 -0.220999E-07  0.217E-04    2.18      88.6  T
     SCC iter.                  ...        0 min,  0.009 sec
     gradient                   ...        0 min,  0.019 sec
 * total energy  :   -40.4131951 Eh     change       -0.3549544E-04 Eh
   gradient norm :     0.0028071 Eh/α   predicted    -0.2472860E-04 ( -30.33%)
   displ. norm   :     0.1346944 α      lambda       -0.3633063E-04
   maximum displ.:     0.1031700 α      in ANC's #1, #2, #4, ...

........................................................................
.............................. CYCLE   12 ..............................
........................................................................
   1    -41.0503620 -0.410504E+02  0.801E-02    2.18       0.0  T
   2    -41.0503632 -0.119144E-05  0.438E-02    2.18       1.0  T
   3    -41.0503623  0.851090E-06  0.887E-03    2.18       2.2  T
   4    -41.0503631 -0.825736E-06  0.528E-03    2.18       3.6  T
   5    -41.0503636 -0.418276E-06  0.115E-03    2.18      16.7  T
   6    -41.0503636 -0.257308E-07  0.358E-04    2.18      53.7  T
   7    -41.0503636 -0.254616E-08  0.134E-04    2.18     144.0  T
     SCC iter.                  ...        0 min,  0.010 sec
     gradient                   ...        0 min,  0.019 sec
 * total energy  :   -40.4132214 Eh     change       -0.2632379E-04 Eh
   gradient norm :     0.0021372 Eh/α   predicted    -0.1850030E-04 ( -29.72%)
   displ. norm   :     0.1468112 α      lambda       -0.2493276E-04
   maximum displ.:     0.1089535 α      in ANC's #1, #2, #4, ...

........................................................................
.............................. CYCLE   13 ..............................
........................................................................
   1    -41.0494510 -0.410495E+02  0.837E-02    2.18       0.0  T
   2    -41.0494523 -0.133547E-05  0.459E-02    2.18       1.0  T
   3    -41.0494525 -0.160669E-06  0.691E-03    2.18       2.8  T
   4    -41.0494524  0.127275E-06  0.446E-03    2.18       4.3  T
   5    -41.0494526 -0.289314E-06  0.944E-04    2.18      20.4  T
   6    -41.0494527 -0.146235E-07  0.217E-04    2.18      88.8  T
     SCC iter.                  ...        0 min,  0.009 sec
     gradient                   ...        0 min,  0.019 sec
 * total energy  :   -40.4132347 Eh     change       -0.1331379E-04 Eh
   gradient norm :     0.0018593 Eh/α   predicted    -0.1273630E-04 (  -4.34%)
   displ. norm   :     0.1016550 α      lambda       -0.1790616E-04
   maximum displ.:     0.0753115 α      in ANC's #1, #4, #2, ...

........................................................................
.............................. CYCLE   14 ..............................
........................................................................
   1    -41.0506510 -0.410507E+02  0.731E-02    2.19       0.0  T
   2    -41.0506526 -0.155746E-05  0.378E-02    2.19       1.0  T
   3    -41.0506528 -0.158552E-06  0.699E-03    2.19       2.8  T
   4    -41.0506526  0.126261E-06  0.492E-03    2.19       3.9  T
   5    -41.0506530 -0.347502E-06  0.775E-04    2.19      24.8  T
   6    -41.0506530 -0.113971E-07  0.235E-04    2.19      81.8  T
     SCC iter.                  ...        0 min,  0.009 sec
     gradient                   ...        0 min,  0.019 sec
 * total energy  :   -40.4132388 Eh     change       -0.4059542E-05 Eh
   gradient norm :     0.0027190 Eh/α   predicted    -0.8994602E-05 ( 121.57%)
   displ. norm   :     0.0445204 α      lambda       -0.1178864E-04
   maximum displ.:     0.0327983 α      in ANC's #1, #2, #5, ...

........................................................................
.............................. CYCLE   15 ..............................
........................................................................
   1    -41.0501269 -0.410501E+02  0.265E-02    2.18       0.0  T
   2    -41.0501270 -0.109378E-06  0.153E-02    2.18       1.3  T
   3    -41.0501267  0.245476E-06  0.400E-03    2.18       4.8  T
   4    -41.0501270 -0.276333E-06  0.126E-03    2.18      15.3  T
   5    -41.0501270 -0.115099E-07  0.372E-04    2.18      51.8  T
   6    -41.0501270 -0.849901E-09  0.187E-04    2.18     102.8  T
     SCC iter.                  ...        0 min,  0.009 sec
     gradient                   ...        0 min,  0.019 sec
 * total energy  :   -40.4132447 Eh     change       -0.5953630E-05 Eh
   gradient norm :     0.0015938 Eh/α   predicted    -0.5906581E-05 (  -0.79%)
   displ. norm   :     0.0308682 α      lambda       -0.5707049E-05
   maximum displ.:     0.0174436 α      in ANC's #4, #1, #9, ...

........................................................................
.............................. CYCLE   16 ..............................
........................................................................
   1    -41.0501971 -0.410502E+02  0.196E-02    2.18       0.0  T
   2    -41.0501972 -0.139330E-06  0.108E-02    2.18       1.8  T
   3    -41.0501967  0.477991E-06  0.490E-03    2.18       3.9  T
   4    -41.0501973 -0.545358E-06  0.159E-03    2.18      12.1  T
   5    -41.0501973 -0.234388E-07  0.619E-04    2.18      31.1  T
   6    -41.0501973 -0.216230E-08  0.212E-04    2.18      90.8  T
     SCC iter.                  ...        0 min,  0.009 sec
     gradient                   ...        0 min,  0.019 sec
 * total energy  :   -40.4132468 Eh     change       -0.2106139E-05 Eh
   gradient norm :     0.0010159 Eh/α   predicted    -0.2857107E-05 (  35.66%)
   displ. norm   :     0.0316205 α      lambda        0.1443126E-04
   maximum displ.:     0.0175100 α      in ANC's #1, #4, #9, ...

........................................................................
.............................. CYCLE   17 ..............................
........................................................................
   1    -41.0502611 -0.410503E+02  0.202E-02    2.19       0.0  T
   2    -41.0502612 -0.146768E-06  0.111E-02    2.19       1.7  T
   3    -41.0502607  0.477682E-06  0.492E-03    2.19       3.9  T
   4    -41.0502613 -0.544829E-06  0.163E-03    2.19      11.8  T
   5    -41.0502613 -0.246984E-07  0.631E-04    2.19      30.5  T
   6    -41.0502613 -0.230950E-08  0.211E-04    2.19      91.2  T
     SCC iter.                  ...        0 min,  0.009 sec
     gradient                   ...        0 min,  0.019 sec
 * total energy  :   -40.4132360 Eh     change        0.1077436E-04 Eh
   gradient norm :     0.0034257 Eh/α   predicted     0.7214117E-05 ( -33.04%)
   displ. norm   :     0.0230375 α      lambda       -0.1655269E-04
   maximum displ.:     0.0144849 α      in ANC's #1, #4, #9, ...

........................................................................
.............................. CYCLE   18 ..............................
........................................................................
   1    -41.0502861 -0.410503E+02  0.177E-02    2.18       0.0  T
   2    -41.0502862 -0.119286E-06  0.946E-03    2.18       2.0  T
   3    -41.0502859  0.336674E-06  0.419E-03    2.18       4.6  T
   4    -41.0502863 -0.393364E-06  0.140E-03    2.18      13.7  T
   5    -41.0502863 -0.126225E-07  0.518E-04    2.18      37.1  T
   6    -41.0502863 -0.195454E-08  0.149E-04    2.18     128.9  T
     SCC iter.                  ...        0 min,  0.009 sec
     gradient                   ...        0 min,  0.019 sec
 * total energy  :   -40.4132472 Eh     change       -0.1118944E-04 Eh
   gradient norm :     0.0011283 Eh/α   predicted    -0.8287961E-05 ( -25.93%)
   displ. norm   :     0.0359512 α      lambda       -0.3750444E-05
   maximum displ.:     0.0289271 α      in ANC's #1, #4, #2, ...

........................................................................
.............................. CYCLE   19 ..............................
........................................................................
   1    -41.0502182 -0.410502E+02  0.262E-02    2.18       0.0  T
   2    -41.0502184 -0.202935E-06  0.138E-02    2.18       1.4  T
   3    -41.0502182  0.200997E-06  0.391E-03    2.18       4.9  T
   4    -41.0502184 -0.232088E-06  0.197E-03    2.18       9.8  T
   5    -41.0502184 -0.386950E-07  0.556E-04    2.18      34.6  T
   6    -41.0502184 -0.356459E-08  0.131E-04    2.18     146.8  T
     SCC iter.                  ...        0 min,  0.009 sec
     gradient                   ...        0 min,  0.019 sec
 * total energy  :   -40.4132489 Eh     change       -0.1649774E-05 Eh
   gradient norm :     0.0007529 Eh/α   predicted    -0.1878710E-05 (  13.88%)
   displ. norm   :     0.0078884 α      lambda       -0.7839627E-06
   maximum displ.:     0.0044510 α      in ANC's #9, #4, #7, ...

   *** GEOMETRY OPTIMIZATION CONVERGED AFTER 19 ITERATIONS ***

------------------------------------------------------------------------
 total energy gain   :        -0.0076454 Eh       -4.7976 kcal/mol
 total RMSD          :         0.3127659 a0        0.1655 Å
 total power (kW/mol):        -1.0564746 (step)  -25.4209 (real)
------------------------------------------------------------------------

 ANCopt (total)                0 d,  0 h,  0 min,  0.790 sec
 optimizer setup                ...        0 min,  0.000 sec (  0.018%)
 model hessian                  ...        0 min,  0.008 sec (  0.977%)
 ANC generation                 ...        0 min,  0.001 sec (  0.094%)
 coordinate transformation      ...        0 min,  0.000 sec (  0.042%)
 single point calculation       ...        0 min,  0.774 sec ( 98.032%)
 optimization log               ...        0 min,  0.002 sec (  0.251%)
 hessian update                 ...        0 min,  0.000 sec (  0.032%)
 rational function              ...        0 min,  0.003 sec (  0.383%)

================
 final structure:
================
$coord
   -5.94838015407115    0.63673488982482    0.28348601565261      C 
   -3.77448317233000    3.07610475731727    0.34810171725373      S 
   -1.35511390411454    0.91960864304469    0.15871024090827      C 
   -2.22227834955520   -1.54734918046154    0.05299426650100      C 
   -4.86777778067407   -1.69748624597926    0.12560351945116      C 
   -0.04215844806617   -3.38508310634753   -0.11149023136310      C 
    0.01741914485267   -5.15469909560355    2.17660264210517      C 
   -0.12553232148203   -4.90125326547051   -2.57414342518347      C 
    2.16724669090346   -1.57266772174689   -0.08307848792386      C 
    1.33060653200336    0.90875635600722    0.07489149256107      C 
    3.77121061375125    3.03572860585481    0.10688141327339      S 
    5.96578891792585    0.56204666013575   -0.09608464838514      C 
    4.79366423545814   -1.76386397517748   -0.17929124271936      C 
    8.60642401955243    1.18135747872472   -0.15486119103280      C 
   10.49659462412358   -0.47511608713449   -0.30003758455980      C 
   -7.91961486621143    1.09524422223424    0.36783003722666      H 
   -5.93994916246684   -3.42242216805801    0.06557204219955      H 
   -1.65774591284691   -6.34498210019635    2.19400933669120      H 
    0.06977734377703   -4.06464901434692    3.91860670636007      H 
    1.68399864954964   -6.35459630508263    2.10013118105789      H 
   -1.80502117014759   -6.08459300881815   -2.62039353609716      H 
    1.53637293628696   -6.10078265761644   -2.72288712606709      H 
   -0.16861162852646   -3.63194853358114   -4.19037089571870      H 
    5.81891959604057   -3.51225782141141   -0.30543126997825      H 
    9.02144397930494    3.18211489312925   -0.06975620369011      H 
   10.17752345538669   -2.48030002500089   -0.38856242243469      H 
   12.43452222870413    0.13623274538009   -0.33508048292648      H 
$end
           -------------------------------------------------
          |                Final Singlepoint                |
           -------------------------------------------------

          ...................................................
          :                      SETUP                      :
          :.................................................:
          :  # basis functions                  84          :
          :  # atomic orbitals                  82          :
          :  # shells                           44          :
          :  # electrons                        76          :
          :  max. iterations                   250          :
          :  Hamiltonian                  GFN2-xTB          :
          :  restarted?                      false          :
          :  GBSA solvation                  false          :
          :  PC potential                    false          :
          :  electronic temp.          300.0000000     K    :
          :  accuracy                    1.0000000          :
          :  -> integral cutoff          0.2500000E+02      :
          :  -> integral neglect         0.1000000E-07      :
          :  -> SCF convergence          0.1000000E-05 Eh   :
          :  -> wf. convergence          0.1000000E-03 e    :
          :  Broyden damping             0.4000000          :
          ...................................................

 iter      E             dE          RMSdq      gap      omega  full diag
   1    -41.0502184 -0.410502E+02  0.644E-05    2.18       0.0  T
   2    -41.0502184 -0.462563E-11  0.282E-05    2.18     682.8  T
   3    -41.0502184  0.232347E-11  0.290E-05    2.18     664.0  T

   *** convergence criteria satisfied after 3 iterations ***

         #    Occupation            Energy/Eh            Energy/eV
      -------------------------------------------------------------
         1        2.0000           -0.7294833             -19.8503
       ...           ...                  ...                  ...
        32        2.0000           -0.4388858             -11.9427
        33        2.0000           -0.4338675             -11.8061
        34        2.0000           -0.4283823             -11.6569
        35        2.0000           -0.4037025             -10.9853
        36        2.0000           -0.3966513             -10.7934
        37        2.0000           -0.3914939             -10.6531
        38        2.0000           -0.3560049              -9.6874 (HOMO)
        39                         -0.2757415              -7.5033 (LUMO)
        40                         -0.2324113              -6.3242
        41                         -0.2042799              -5.5587
        42                         -0.1990956              -5.4177
        43                         -0.1933077              -5.2602
       ...                                ...                  ...
        82                          0.6808849              18.5278
      -------------------------------------------------------------
                  HL-Gap            0.0802634 Eh            2.1841 eV
             Fermi-level           -0.3158732 Eh           -8.5953 eV

 SCC (total)                   0 d,  0 h,  0 min,  0.037 sec
 SCC setup                      ...        0 min,  0.000 sec (  0.590%)
 Dispersion                     ...        0 min,  0.000 sec (  0.623%)
 integral evaluation            ...        0 min,  0.012 sec ( 32.927%)
 zeroth order Hamiltonian       ...        0 min,  0.000 sec (  0.572%)
 iterations                     ...        0 min,  0.005 sec ( 12.917%)
 molecular gradient             ...        0 min,  0.019 sec ( 51.278%)
 printout                       ...        0 min,  0.000 sec (  0.964%)

         :::::::::::::::::::::::::::::::::::::::::::::::::::::
         ::                     SUMMARY                     ::
         :::::::::::::::::::::::::::::::::::::::::::::::::::::
         :: total energy             -40.413248861541 Eh    ::
         :: gradient norm              0.000753107871 Eh/a0 ::
         :: HOMO-LUMO gap              2.184078435000 eV    ::
         ::.................................................::
         :: SCC energy               -41.050218436781 Eh    ::
         :: -> isotropic ES            0.003513265881 Eh    ::
         :: -> anisotropic ES          0.005167803706 Eh    ::
         :: -> anisotropic XC          0.019728053222 Eh    ::
         :: -> dispersion             -0.032332295978 Eh    ::
         :: repulsion energy           0.636818769730 Eh    ::
         :: add. restraining           0.000000000000 Eh    ::
         :::::::::::::::::::::::::::::::::::::::::::::::::::::

           -------------------------------------------------
          |                Property Printout                |
           -------------------------------------------------

    * Orbital Energies and Occupations

         #    Occupation            Energy/Eh            Energy/eV
      -------------------------------------------------------------
         1        2.0000           -0.7294833             -19.8503
       ...           ...                  ...                  ...
        26        2.0000           -0.4638536             -12.6221
        27        2.0000           -0.4573737             -12.4458
        28        2.0000           -0.4533137             -12.3353
        29        2.0000           -0.4523047             -12.3078
        30        2.0000           -0.4454845             -12.1223
        31        2.0000           -0.4392407             -11.9523
        32        2.0000           -0.4388858             -11.9427
        33        2.0000           -0.4338675             -11.8061
        34        2.0000           -0.4283823             -11.6569
        35        2.0000           -0.4037025             -10.9853
        36        2.0000           -0.3966513             -10.7934
        37        2.0000           -0.3914939             -10.6531
        38        2.0000           -0.3560049              -9.6874 (HOMO)
        39                         -0.2757415              -7.5033 (LUMO)
        40                         -0.2324113              -6.3242
        41                         -0.2042799              -5.5587
        42                         -0.1990956              -5.4177
        43                         -0.1933077              -5.2602
        44                         -0.1603047              -4.3621
        45                         -0.1390649              -3.7841
        46                         -0.1296735              -3.5286
        47                         -0.1154719              -3.1421
        48                         -0.0169090              -0.4601
        49                          0.0013904               0.0378
       ...                                ...                  ...
        82                          0.6808849              18.5278
      -------------------------------------------------------------
                  HL-Gap            0.0802634 Eh            2.1841 eV
             Fermi-level           -0.3158732 Eh           -8.5953 eV

     #   Z        covCN         q      C6AA      α(0)
     1   6 C      2.953    -0.025    28.627     8.776
     2  16 S      2.248    -0.031   142.352    20.081
     3   6 C      3.077     0.011    27.683     8.626
     4   6 C      3.262    -0.025    27.409     8.456
     5   6 C      3.075    -0.045    29.038     8.835
     6   6 C      3.941     0.028    20.043     6.362
     7   6 C      3.758    -0.099    22.443     6.754
     8   6 C      3.758    -0.099    22.443     6.754
     9   6 C      3.253    -0.024    27.510     8.487
    10   6 C      3.074     0.012    27.663     8.623
    11  16 S      2.283    -0.043   142.837    20.115
    12   6 C      2.999     0.022    27.512     8.604
    13   6 C      3.069    -0.051    29.188     8.859
    14   6 C      2.929    -0.030    28.747     8.793
    15   6 C      2.840    -0.091    30.283     9.018
    16   1 H      0.926     0.042     2.421     2.433
    17   1 H      0.926     0.036     2.497     2.471
    18   1 H      0.925     0.043     2.404     2.424
    19   1 H      0.925     0.040     2.452     2.449
    20   1 H      0.925     0.044     2.401     2.423
    21   1 H      0.925     0.043     2.404     2.425
    22   1 H      0.925     0.044     2.401     2.423
    23   1 H      0.925     0.040     2.452     2.449
    24   1 H      0.926     0.039     2.465     2.455
    25   1 H      0.925     0.042     2.428     2.437
    26   1 H      0.926     0.039     2.466     2.456
    27   1 H      0.926     0.040     2.442     2.444

 Mol. C6AA /au·bohr⁶  :      12029.840016
 Mol. C8AA /au·bohr⁸  :     351558.871670
 Mol. α(0) /au        :        176.431446


Wiberg/Mayer (AO) data.
largest (>0.10) Wiberg bond orders for each atom
          total WBO             WBO to atom ...
     1  C   3.907        C    5 1.593    S    2 1.183    H   16 0.972
     2  S   2.602        C    1 1.183    C    3 1.152
     3  C   3.948        C    4 1.436    C   10 1.166    S    2 1.152
     4  C   3.965        C    3 1.436    C    5 1.298    C    6 0.984
     5  C   3.988        C    1 1.593    C    4 1.298    H   17 0.963
     6  C   3.991        C    4 0.984    C    9 0.983    C    7 0.974    C    8 0.974
     7  C   3.995        H   19 0.987    H   18 0.984    H   20 0.984    C    6 0.974
     8  C   3.995        H   23 0.987    H   21 0.984    H   22 0.984    C    6 0.974
     9  C   3.979        C   10 1.409    C   13 1.339    C    6 0.983
    10  C   3.950        C    9 1.409    C    3 1.166    S   11 1.162
    11  S   2.585        C   10 1.162    C   12 1.122
    12  C   3.919        C   13 1.481    C   14 1.147    S   11 1.122
    13  C   3.988        C   12 1.481    C    9 1.339    H   24 0.961
    14  C   3.991        C   15 1.846    C   12 1.147    H   25 0.964
    15  C   3.963        C   14 1.846    H   27 0.978    H   26 0.976
    16  H   0.998        C    1 0.972
    17  H   0.998        C    5 0.963
    18  H   0.997        C    7 0.984
    19  H   0.998        C    7 0.987
    20  H   0.997        C    7 0.984
    21  H   0.997        C    8 0.984
    22  H   0.997        C    8 0.984
    23  H   0.998        C    8 0.987
    24  H   0.998        C   13 0.961
    25  H   0.998        C   14 0.964
    26  H   0.998        C   15 0.976
    27  H   0.998        C   15 0.978

molecular dipole:
                 x           y           z       tot (Debye)
 q only:       -0.057      -0.617      -0.032
   full:       -0.121      -1.021      -0.051       2.615
molecular quadrupole (traceless):
                xx          xy          yy          xz          yz          zz
 q only:        1.040       0.198       1.342      -0.109       0.127      -2.382
  q+dip:        5.217      -0.012       0.766      -0.374       0.248      -5.984
   full:        3.935       0.132      -0.746      -0.235       0.020      -3.189

           -------------------------------------------------
          |                Geometry Summary                 |
           -------------------------------------------------

      molecular mass/u    :      232.3578000
   center of mass at/Å    :        0.5678425      -0.0855897       0.0115180
  moments of inertia/u·Å² :        0.5429772E+03   0.1432933E+04   0.1867929E+04
rotational constants/cm⁻¹ :        0.3104667E-01   0.1176442E-01   0.9024773E-02

 * 27 selected distances

     #   Z        #   Z                                     value/Å
     1   6 C      2  16 S                                 1.7294083
     2  16 S      3   6 C                                 1.7179683
     3   6 C      4   6 C                                 1.3848915
     1   6 C      5   6 C                                 1.3637193
     4   6 C      5   6 C                                 1.4027171
     6   6 C      7   6 C                                 1.5310022
     6   6 C      8   6 C                                 1.5309953
     3   6 C     10   6 C                                 1.4219257
     9   6 C     10   6 C                                 1.3882597
    10   6 C     11  16 S                                 1.7132258
    11  16 S     12   6 C                                 1.7532044 (max)
     9   6 C     13   6 C                                 1.3944481
    12   6 C     13   6 C                                 1.3789774
    12   6 C     14   6 C                                 1.4356175
    14   6 C     15   6 C                                 1.3321953
     1   6 C     16   1 H                                 1.0719087 (min)
     5   6 C     17   1 H                                 1.0752277
     7   6 C     18   1 H                                 1.0874888
     7   6 C     19   1 H                                 1.0877816
     7   6 C     20   1 H                                 1.0874674
     8   6 C     21   1 H                                 1.0874708
     8   6 C     22   1 H                                 1.0874463
     8   6 C     23   1 H                                 1.0877369
    13   6 C     24   1 H                                 1.0746261
    14   6 C     25   1 H                                 1.0822308
    15   6 C     26   1 H                                 1.0754681
    15   6 C     27   1 H                                 1.0754854

 * 3 distinct bonds (by element types)

   Z      Z             #   av. dist./Å        max./Å        min./Å
   1 H    6 C          12     1.0816949     1.0877816     1.0719087
   6 C    6 C          11     1.4149772     1.5310022     1.3321953
   6 C   16 S           4     1.7284517     1.7532044     1.7132258


optimized geometry written to: xtbopt.xyz


           -------------------------------------------------
          | TOTAL ENERGY              -40.413248861541 Eh   |
          | GRADIENT NORM               0.000753107871 Eh/α |
          | HOMO-LUMO GAP               2.184078435000 eV   |
           -------------------------------------------------

------------------------------------------------------------------------
 * finished run on 2021/05/19 at 11:00:37.126     
------------------------------------------------------------------------
 total:
 * wall-time:     0 d,  0 h,  0 min,  0.929 sec
 *  cpu-time:     0 d,  0 h,  0 min,  0.903 sec
 * ratio c/w:     0.972 speedup
 SCF:
 * wall-time:     0 d,  0 h,  0 min,  0.055 sec
 *  cpu-time:     0 d,  0 h,  0 min,  0.052 sec
 * ratio c/w:     0.945 speedup
 ANC optimizer:
 * wall-time:     0 d,  0 h,  0 min,  0.827 sec
 *  cpu-time:     0 d,  0 h,  0 min,  0.827 sec
 * ratio c/w:     1.000 speedup

