      -----------------------------------------------------------      
     |                   =====================                   |     
     |                           x T B                           |     
     |                   =====================                   |     
     |                         S. Grimme                         |     
     |          Mulliken Center for Theoretical Chemistry        |     
     |                    University of Bonn                     |     
     |                Version 6.2 RC2 (SAW190805)                |     
      -----------------------------------------------------------      

   This program is distributed in the hope that it will be useful,
   but WITHOUT ANY WARRANTY; without even the implied warranty of
   MERCHANTABILITY or FITNESS FOR A PARTICULAR PURPOSE.
   
   FOR NON-COMMERCIAL, ACADEMIA USE ONLY.
   
   Cite this work as:
   * S. Grimme, C. Bannwarth, P. Shushkov, J. Chem. Theory Comput., 2017,
     13, 1989-2009. DOI: 10.1021/acs.jctc.7b00118
   * C. Bannwarth, S. Ehlert and S. Grimme., J. Chem. Theory Comput., 2019,
     15, 1652-1671. DOI: 10.1021/acs.jctc.8b01176
   * P. Pracht, E. Caldeweyher, S. Ehlert, S. Grimme, ChemRxiv, 2019, preprint.
     DOI: 10.26434/chemrxiv.8326202.v1
   
   for DFT-D4:
   * E. Caldeweyher, C. Bannwarth and S. Grimme, J. Chem. Phys., 2017,
     147, 034112. DOI: 10.1063/1.4993215
   * E. Caldeweyher, S. Ehlert, A. Hansen, H. Neugebauer, S. Spicher,
     C. Bannwarth and S. Grimme, J. Chem. Phys., 2019, 150, 154122.
     DOI: 10.1063/1.5090222
   
   for sTDA-xTB:
   * S. Grimme and C. Bannwarth, J. Chem. Phys., 2016, 145, 054103.
     DOI: 10.1063/1.4959605
   
   in the mass-spec context:
   * V. Asgeirsson, C. Bauer and S. Grimme, Chem. Sci., 2017, 8, 4879.
     DOI: 10.1039/c7sc00601b
   
   for metadynamics refer to:
   * S. Grimme, J. Chem. Theory Comput., 2019, 155, 2847-2862
     DOI: 10.1021/acs.jctc.9b00143
   
   with help from (in alphabetical order)
   C. Bannwarth, F. Bohle, G. Brandenburg, E. Caldeweyher, M. Checinski,
   S. Dohm, S. Ehlert, S. Ehrlich, F. März, H. Neugebauer, J. Pisarek,
   P. Pracht, P. Shushkov, and S. Spicher.
   
 * started run on 2021/05/19 at 11:00:39.013     

           -------------------------------------------------
          |                Calculation Setup                |
           -------------------------------------------------

          program call               : /ihome/ghutchison/geoffh/xtb/xtb 934.xyz -opt
          hostname                   : smp-n122
          coordinate file            : 934.xyz
          omp threads                :                     1
          number of atoms            :                    31
          number of electrons        :                    82
          charge                     :                     0
          spin                       :                   0.0
          first test random number   :      0.43393829971773


########################################################################
# WARNING! Please study the warnings concerning your input carefully
#  - the use of '-opt' is discouraged, please use '--opt' next time
########################################################################

           ------------------------------------------------- 
          |                 G F N 2 - x T B                 |
          | Geometry, Frequencies, Noncovalent interactions |
          |            JCTC 2019 parametrisation            |
           ------------------------------------------------- 
             KAB for C  - Si     :                1.0500
             KAB for H  - Pd     :                0.9500
             k(s)              :                1.8500
             k(p)              :                2.2300
             k(d)              :                2.2300
             k(f)              :                2.0000
             kEN (H0ij)        :               -2.0000
             D4 a1             :                0.5200
             D4 a2             :                5.0000
             D4 s6             :                1.0000
             D4 s8             :                2.7000
             D4 s9             :                5.0000
             alphaj            :                2.0000

  Z AO/shell   Hii/eV     exponent
  1     Wed Apr 25 08:07:45 CEST 2018   EN: 2.200 GM2: 0.406  GM3: 0.0800  RAES: 1.40
     1s    -10.707211    1.230000
  6     Wed Apr 25 08:07:45 CEST 2018   EN: 2.550 GM2: 0.538  GM3: 0.1500  RAES: 3.00
     2s    -13.970922    2.096432
     2p    -10.063292    1.800000
  7     Wed Apr 25 08:07:45 CEST 2018   EN: 3.040 GM2: 0.461  GM3:-0.0640  RAES: 1.90
     2s    -16.686243    2.339881
     2p    -12.523956    2.014332
 16     Tue Apr 24 11:44:34 CEST 2018   EN: 2.580 GM2: 0.340  GM3:-0.0502  RAES: 3.10
     3s    -20.029654    1.981333
     3p    -11.377694    2.025643
     3d     -0.420282    1.702555

           ------------------------------------------------- 
          |        Self-Consistent Charge Iterations        |
           ------------------------------------------------- 

          ...................................................
          :                      SETUP                      :
          :.................................................:
          :  # basis functions                  88          :
          :  # atomic orbitals                  86          :
          :  # shells                           48          :
          :  # electrons                        82          :
          :  max. iterations                   250          :
          :  Hamiltonian                  GFN2-xTB          :
          :  restarted?                      false          :
          :  GBSA solvation                  false          :
          :  PC potential                    false          :
          :  electronic temp.          300.0000000     K    :
          :  accuracy                    1.0000000          :
          :  -> integral cutoff          0.2500000E+02      :
          :  -> integral neglect         0.1000000E-07      :
          :  -> SCF convergence          0.1000000E-05 Eh   :
          :  -> wf. convergence          0.1000000E-03 e    :
          :  Broyden damping             0.4000000          :
          ...................................................

 iter      E             dE          RMSdq      gap      omega  full diag
   1    -44.5028883 -0.445029E+02  0.349E+00    3.14       0.0  T
   2    -44.5510928 -0.482045E-01  0.196E+00    3.02       1.0  T
   3    -44.5488194  0.227345E-02  0.882E-01    2.59       1.0  T
   4    -44.5528329 -0.401350E-02  0.487E-01    2.55       1.0  T
   5    -44.5570639 -0.423104E-02  0.175E-01    2.49       1.0  T
   6    -44.5572638 -0.199879E-03  0.836E-02    2.54       1.0  T
   7    -44.5573464 -0.826248E-04  0.349E-02    2.54       1.0  T
   8    -44.5573687 -0.223375E-04  0.166E-02    2.55       1.1  T
   9    -44.5573697 -0.942005E-06  0.608E-03    2.55       3.0  T
  10    -44.5573698 -0.114592E-06  0.266E-03    2.55       6.8  T
  11    -44.5573698 -0.978989E-08  0.954E-04    2.55      18.8  T
  12    -44.5573698 -0.161889E-08  0.454E-04    2.55      39.5  T

   *** convergence criteria satisfied after 12 iterations ***

         #    Occupation            Energy/Eh            Energy/eV
      -------------------------------------------------------------
         1        2.0000           -0.7487777             -20.3753
       ...           ...                  ...                  ...
        35        2.0000           -0.4320081             -11.7555
        36        2.0000           -0.4299093             -11.6984
        37        2.0000           -0.4279759             -11.6458
        38        2.0000           -0.4064047             -11.0588
        39        2.0000           -0.3943439             -10.7306
        40        2.0000           -0.3846646             -10.4673
        41        2.0000           -0.3625805              -9.8663 (HOMO)
        42                         -0.2690075              -7.3201 (LUMO)
        43                         -0.2205048              -6.0002
        44                         -0.2104263              -5.7260
        45                         -0.2025413              -5.5114
        46                         -0.1483276              -4.0362
       ...                                ...                  ...
        86                          0.6584730              17.9180
      -------------------------------------------------------------
                  HL-Gap            0.0935730 Eh            2.5463 eV
             Fermi-level           -0.3157940 Eh           -8.5932 eV

 SCC (total)                   0 d,  0 h,  0 min,  0.096 sec
 SCC setup                      ...        0 min,  0.000 sec (  0.405%)
 Dispersion                     ...        0 min,  0.000 sec (  0.485%)
 integral evaluation            ...        0 min,  0.026 sec ( 27.137%)
 zeroth order Hamiltonian       ...        0 min,  0.000 sec (  0.299%)
 iterations                     ...        0 min,  0.033 sec ( 34.513%)
 molecular gradient             ...        0 min,  0.035 sec ( 36.653%)
 printout                       ...        0 min,  0.000 sec (  0.448%)

         :::::::::::::::::::::::::::::::::::::::::::::::::::::
         ::                     SUMMARY                     ::
         :::::::::::::::::::::::::::::::::::::::::::::::::::::
         :: total energy             -44.035072741292 Eh    ::
         :: gradient norm              0.085215923658 Eh/a0 ::
         :: HOMO-LUMO gap              2.546250166061 eV    ::
         ::.................................................::
         :: SCC energy               -44.557369815327 Eh    ::
         :: -> isotropic ES            0.020318475646 Eh    ::
         :: -> anisotropic ES          0.007640627773 Eh    ::
         :: -> anisotropic XC          0.028994214883 Eh    ::
         :: -> dispersion             -0.035673405276 Eh    ::
         :: repulsion energy           0.521721366322 Eh    ::
         :: add. restraining           0.000000000000 Eh    ::
         :::::::::::::::::::::::::::::::::::::::::::::::::::::

      ----------------------------------------------------------- 
     |                   =====================                   |
     |                        A N C O P T                        |
     |                   =====================                   |
     |               Approximate Normal Coordinate               |
     |                Rational Function Optimizer                |
      ----------------------------------------------------------- 

          ...................................................
          :                      SETUP                      :
          :.................................................:
          :   optimization level            normal          :
          :   max. optcycles                   200          :
          :   ANC micro-cycles                  20          :
          :   degrees of freedom                87          :
          :.................................................:
          :   RF solver                   davidson          :
          :   input Hessian                  false          :
          :   write xtbopt.log                true          :
          :   linear?                        false          :
          :   energy convergence         0.5000000E-05 Eh   :
          :   grad. convergence          0.1000000E-02 Eh/α :
          :   maximium RF displ.         2.0000000          :
          :   Hlow (freq-cutoff)         0.5000000E-02      :
          :   Hmax (freq-cutoff)         5.0000000          :
          :   S6 in model hess.         20.0000000          :
          ...................................................

generating ANC from model Hessian ...
Using Lindh-Hessian (1995)
 Shifting diagonal of input Hessian by   3.365949189314019E-003
 Lowest  eigenvalues of input Hessian
   -0.000000   -0.000000   -0.000000   -0.000000    0.000000    0.000000
    0.005000    0.005269    0.005601    0.006886    0.007011    0.007804
    0.008419    0.012613    0.013430    0.014487    0.015260    0.016741
 Highest eigenvalues
    1.389697    1.394504    1.530880    1.752627    1.847805    1.925105
 

........................................................................
.............................. CYCLE    1 ..............................
........................................................................
   1    -44.5573698 -0.445574E+02  0.150E-04    2.55       0.0  T
   2    -44.5573698 -0.312497E-10  0.996E-05    2.55     180.3  T
   3    -44.5573698  0.310507E-10  0.530E-05    2.55     338.9  T
     SCC iter.                  ...        0 min,  0.006 sec
     gradient                   ...        0 min,  0.022 sec
 * total energy  :   -44.0350728 Eh     change       -0.5246019E-07 Eh
   gradient norm :     0.0852183 Eh/α   predicted     0.0000000E+00 (-100.00%)
   displ. norm   :     0.3184169 α      lambda       -0.1337800E-01
   maximum displ.:     0.1548078 α      in ANC's #17, #9, #22, ...

........................................................................
.............................. CYCLE    2 ..............................
........................................................................
   1    -44.5807799 -0.445808E+02  0.320E-01    2.62       0.0  T
   2    -44.5808888 -0.108904E-03  0.193E-01    2.58       1.0  T
   3    -44.5808161  0.726751E-04  0.128E-01    2.62       1.0  T
   4    -44.5811869 -0.370760E-03  0.290E-02    2.60       1.0  T
   5    -44.5811915 -0.464406E-05  0.109E-02    2.60       1.6  T
   6    -44.5811918 -0.233457E-06  0.244E-03    2.60       7.3  T
   7    -44.5811918 -0.238731E-07  0.139E-03    2.60      12.9  T
     SCC iter.                  ...        0 min,  0.011 sec
     gradient                   ...        0 min,  0.021 sec
 * total energy  :   -44.0437165 Eh     change       -0.8643717E-02 Eh
   gradient norm :     0.0367495 Eh/α   predicted    -0.7367192E-02 ( -14.77%)
   displ. norm   :     0.2978474 α      lambda       -0.3353802E-02
   maximum displ.:     0.1963677 α      in ANC's #9, #5, #8, ...

........................................................................
.............................. CYCLE    3 ..............................
........................................................................
   1    -44.5922831 -0.445923E+02  0.201E-01    2.62       0.0  T
   2    -44.5923529 -0.697380E-04  0.121E-01    2.59       1.0  T
   3    -44.5923192  0.336826E-04  0.794E-02    2.60       1.0  T
   4    -44.5924505 -0.131272E-03  0.206E-02    2.60       1.0  T
   5    -44.5924548 -0.434282E-05  0.818E-03    2.59       2.2  T
   6    -44.5924550 -0.132752E-06  0.194E-03    2.59       9.3  T
   7    -44.5924550 -0.417509E-07  0.113E-03    2.59      16.0  T
     SCC iter.                  ...        0 min,  0.011 sec
     gradient                   ...        0 min,  0.021 sec
 * total energy  :   -44.0457644 Eh     change       -0.2047902E-02 Eh
   gradient norm :     0.0118480 Eh/α   predicted    -0.1825709E-02 ( -10.85%)
   displ. norm   :     0.2268288 α      lambda       -0.7195640E-03
   maximum displ.:     0.1316488 α      in ANC's #5, #9, #4, ...

........................................................................
.............................. CYCLE    4 ..............................
........................................................................
   1    -44.5926355 -0.445926E+02  0.146E-01    2.58       0.0  T
   2    -44.5926528 -0.173691E-04  0.767E-02    2.57       1.0  T
   3    -44.5926272  0.256413E-04  0.374E-02    2.58       1.0  T
   4    -44.5926595 -0.323120E-04  0.121E-02    2.57       1.5  T
   5    -44.5926611 -0.161907E-05  0.563E-03    2.57       3.2  T
   6    -44.5926613 -0.184607E-06  0.166E-03    2.57      10.8  T
   7    -44.5926614 -0.462987E-07  0.913E-04    2.57      19.7  T
     SCC iter.                  ...        0 min,  0.011 sec
     gradient                   ...        0 min,  0.021 sec
 * total energy  :   -44.0462681 Eh     change       -0.5036467E-03 Eh
   gradient norm :     0.0070214 Eh/α   predicted    -0.3782933E-03 ( -24.89%)
   displ. norm   :     0.2170186 α      lambda       -0.3623661E-03
   maximum displ.:     0.1328813 α      in ANC's #5, #4, #3, ...

........................................................................
.............................. CYCLE    5 ..............................
........................................................................
   1    -44.5913532 -0.445914E+02  0.160E-01    2.56       0.0  T
   2    -44.5913664 -0.131590E-04  0.789E-02    2.55       1.0  T
   3    -44.5913673 -0.850591E-06  0.160E-02    2.55       1.1  T
   4    -44.5913687 -0.145850E-05  0.931E-03    2.55       1.9  T
   5    -44.5913697 -0.100872E-05  0.375E-03    2.55       4.8  T
   6    -44.5913699 -0.207944E-06  0.122E-03    2.55      14.7  T
   7    -44.5913699 -0.151036E-07  0.864E-04    2.55      20.8  T
     SCC iter.                  ...        0 min,  0.011 sec
     gradient                   ...        0 min,  0.021 sec
 * total energy  :   -44.0465106 Eh     change       -0.2425310E-03 Eh
   gradient norm :     0.0045510 Eh/α   predicted    -0.1897160E-03 ( -21.78%)
   displ. norm   :     0.1524969 α      lambda       -0.1441010E-03
   maximum displ.:     0.0890402 α      in ANC's #5, #4, #3, ...

........................................................................
.............................. CYCLE    6 ..............................
........................................................................
   1    -44.5910559 -0.445911E+02  0.125E-01    2.55       0.0  T
   2    -44.5910627 -0.688461E-05  0.604E-02    2.55       1.0  T
   3    -44.5910636 -0.895961E-06  0.109E-02    2.55       1.7  T
   4    -44.5910634  0.273772E-06  0.808E-03    2.55       2.2  T
   5    -44.5910646 -0.119817E-05  0.184E-03    2.55       9.8  T
   6    -44.5910646 -0.539503E-07  0.711E-04    2.55      25.3  T
     SCC iter.                  ...        0 min,  0.010 sec
     gradient                   ...        0 min,  0.021 sec
 * total energy  :   -44.0466152 Eh     change       -0.1046111E-03 Eh
   gradient norm :     0.0043888 Eh/α   predicted    -0.7373060E-04 ( -29.52%)
   displ. norm   :     0.1475986 α      lambda       -0.1030007E-03
   maximum displ.:     0.0854301 α      in ANC's #4, #5, #3, ...

........................................................................
.............................. CYCLE    7 ..............................
........................................................................
   1    -44.5915012 -0.445915E+02  0.134E-01    2.55       0.0  T
   2    -44.5915084 -0.720264E-05  0.636E-02    2.55       1.0  T
   3    -44.5915084  0.482381E-07  0.122E-02    2.55       1.5  T
   4    -44.5915094 -0.102882E-05  0.837E-03    2.55       2.1  T
   5    -44.5915105 -0.112486E-05  0.135E-03    2.55      13.3  T
   6    -44.5915105 -0.161853E-07  0.542E-04    2.55      33.2  T
     SCC iter.                  ...        0 min,  0.010 sec
     gradient                   ...        0 min,  0.021 sec
 * total energy  :   -44.0466884 Eh     change       -0.7321522E-04 Eh
   gradient norm :     0.0038285 Eh/α   predicted    -0.5263390E-04 ( -28.11%)
   displ. norm   :     0.1208001 α      lambda       -0.5902329E-04
   maximum displ.:     0.0734585 α      in ANC's #4, #5, #1, ...

........................................................................
.............................. CYCLE    8 ..............................
........................................................................
   1    -44.5922119 -0.445922E+02  0.113E-01    2.55       0.0  T
   2    -44.5922169 -0.494932E-05  0.538E-02    2.55       1.0  T
   3    -44.5922178 -0.902005E-06  0.830E-03    2.55       2.2  T
   4    -44.5922174  0.379609E-06  0.593E-03    2.55       3.0  T
   5    -44.5922181 -0.720042E-06  0.142E-03    2.55      12.7  T
   6    -44.5922181 -0.307201E-07  0.528E-04    2.55      34.0  T
   7    -44.5922181 -0.224629E-08  0.279E-04    2.55      64.3  T
     SCC iter.                  ...        0 min,  0.011 sec
     gradient                   ...        0 min,  0.022 sec
 * total energy  :   -44.0467282 Eh     change       -0.3983150E-04 Eh
   gradient norm :     0.0024032 Eh/α   predicted    -0.2994257E-04 ( -24.83%)
   displ. norm   :     0.0758320 α      lambda       -0.2459377E-04
   maximum displ.:     0.0462515 α      in ANC's #4, #1, #5, ...

........................................................................
.............................. CYCLE    9 ..............................
........................................................................
   1    -44.5926974 -0.445927E+02  0.744E-02    2.55       0.0  T
   2    -44.5926995 -0.210416E-05  0.349E-02    2.55       1.0  T
   3    -44.5926999 -0.343540E-06  0.518E-03    2.55       3.5  T
   4    -44.5926998  0.414068E-07  0.360E-03    2.55       5.0  T
   5    -44.5927000 -0.181521E-06  0.129E-03    2.55      13.9  T
   6    -44.5927000 -0.282017E-07  0.289E-04    2.55      62.2  T
   7    -44.5927000 -0.267015E-09  0.172E-04    2.55     104.5  T
     SCC iter.                  ...        0 min,  0.011 sec
     gradient                   ...        0 min,  0.022 sec
 * total energy  :   -44.0467446 Eh     change       -0.1635913E-04 Eh
   gradient norm :     0.0012540 Eh/α   predicted    -0.1236857E-04 ( -24.39%)
   displ. norm   :     0.0723484 α      lambda       -0.1088062E-04
   maximum displ.:     0.0381774 α      in ANC's #4, #1, #8, ...

........................................................................
.............................. CYCLE   10 ..............................
........................................................................
   1    -44.5929962 -0.445930E+02  0.674E-02    2.56       0.0  T
   2    -44.5929978 -0.164625E-05  0.321E-02    2.56       1.0  T
   3    -44.5929980 -0.208175E-06  0.527E-03    2.55       3.4  T
   4    -44.5929981 -0.123038E-07  0.353E-03    2.55       5.1  T
   5    -44.5929982 -0.160488E-06  0.128E-03    2.55      14.1  T
   6    -44.5929983 -0.310476E-07  0.277E-04    2.55      64.9  T
   7    -44.5929983 -0.131976E-09  0.146E-04    2.55     123.2  T
     SCC iter.                  ...        0 min,  0.011 sec
     gradient                   ...        0 min,  0.022 sec
 * total energy  :   -44.0467531 Eh     change       -0.8515112E-05 Eh
   gradient norm :     0.0014738 Eh/α   predicted    -0.5454052E-05 ( -35.95%)
   displ. norm   :     0.0245261 α      lambda       -0.4139747E-05
   maximum displ.:     0.0178598 α      in ANC's #8, #1, #16, ...

........................................................................
.............................. CYCLE   11 ..............................
........................................................................
   1    -44.5927787 -0.445928E+02  0.212E-02    2.55       0.0  T
   2    -44.5927789 -0.182611E-06  0.106E-02    2.55       1.7  T
   3    -44.5927789  0.218585E-07  0.227E-03    2.55       7.9  T
   4    -44.5927789 -0.690907E-07  0.120E-03    2.55      15.0  T
   5    -44.5927790 -0.109005E-07  0.387E-04    2.55      46.4  T
   6    -44.5927790 -0.217013E-08  0.179E-04    2.55     100.5  T
     SCC iter.                  ...        0 min,  0.010 sec
     gradient                   ...        0 min,  0.022 sec
 * total energy  :   -44.0467573 Eh     change       -0.4128403E-05 Eh
   gradient norm :     0.0009646 Eh/α   predicted    -0.2072549E-05 ( -49.80%)
   displ. norm   :     0.0279205 α      lambda       -0.3346209E-05
   maximum displ.:     0.0196070 α      in ANC's #8, #12, #1, ...

   *** GEOMETRY OPTIMIZATION CONVERGED AFTER 11 ITERATIONS ***

------------------------------------------------------------------------
 total energy gain   :        -0.0116845 Eh       -7.3321 kcal/mol
 total RMSD          :         0.2331669 a0        0.1234 Å
 total power (kW/mol):        -2.7888796 (step)  -58.3326 (real)
------------------------------------------------------------------------

 ANCopt (total)                0 d,  0 h,  0 min,  0.526 sec
 optimizer setup                ...        0 min,  0.000 sec (  0.029%)
 model hessian                  ...        0 min,  0.021 sec (  3.909%)
 ANC generation                 ...        0 min,  0.001 sec (  0.185%)
 coordinate transformation      ...        0 min,  0.000 sec (  0.042%)
 single point calculation       ...        0 min,  0.500 sec ( 95.116%)
 optimization log               ...        0 min,  0.001 sec (  0.254%)
 hessian update                 ...        0 min,  0.000 sec (  0.030%)
 rational function              ...        0 min,  0.001 sec (  0.281%)

================
 final structure:
================
$coord
    5.47590558443049    1.39704458438702   -1.61810605614241      C 
    4.04359971612447   -0.34329187812822   -2.52144811151336      N 
    1.74159918414633   -0.26846371143916   -1.43280975142581      C 
    1.42347121717496    1.58144820231581    0.36276018919398      C 
    4.11838528619580    3.34451463773041    0.68239096665731      S 
   -1.23603983266261    1.61824918695892    1.19768910846892      C 
   -1.97862374717935   -1.13646099324043    0.65514725716369      C 
   -0.61274306736154   -1.84439375063423   -1.83607868719619      C 
   -2.07975877019340   -0.89118108240756   -4.15597938797468      C 
   -0.72034427147464   -1.38152231733558   -6.64745184252036      C 
    0.08435966320163   -4.65479864045127   -1.97988154703588      C 
   -2.16730889084670   -6.44148424680350   -2.13987498518994      C 
   -4.68975545278609   -1.08837984428246    0.94803844567911      N 
   -5.18038962586026   -0.03895701695300    3.44421696418138      C 
   -2.50963576258217    2.03373094798858    4.35892602864543      S 
    7.39566830886838    1.68460804827410   -2.19147627379894      H 
   -2.32571973373346    2.92520883553214    0.01449127938446      H 
   -1.07944481641067   -2.29839604782332    2.15078397941704      H 
   -2.36597950698332    1.14046893226285   -3.94018005148075      H 
   -3.94492858728411   -1.76717389712179   -4.16827456646087      H 
    1.23005123111261   -0.74518498122449   -6.53199399148785      H 
   -1.65489945986312   -0.36010066599782   -8.16627554365447      H 
   -0.72908381770204   -3.37877175702194   -7.12289183808283      H 
    1.19807169759240   -5.12458671554281   -0.30397540499604      H 
    1.31035051922153   -4.92426161155005   -3.61234690652068      H 
   -3.35340022360015   -6.28487368855344   -0.46802936022023      H 
   -1.50302587192588   -8.38273301908588   -2.26328903969522      H 
   -3.31575804604588   -6.05006358350406   -3.79584247595062      H 
   -5.49464773461832   -2.82051291723012    0.78783459631093      H 
   -5.32320443348040   -1.46328220059055    4.94405402476302      H 
   -6.90262913948750    1.09606474442198    3.40598824236823      H 
$end
           -------------------------------------------------
          |                Final Singlepoint                |
           -------------------------------------------------

          ...................................................
          :                      SETUP                      :
          :.................................................:
          :  # basis functions                  88          :
          :  # atomic orbitals                  86          :
          :  # shells                           48          :
          :  # electrons                        82          :
          :  max. iterations                   250          :
          :  Hamiltonian                  GFN2-xTB          :
          :  restarted?                      false          :
          :  GBSA solvation                  false          :
          :  PC potential                    false          :
          :  electronic temp.          300.0000000     K    :
          :  accuracy                    1.0000000          :
          :  -> integral cutoff          0.2500000E+02      :
          :  -> integral neglect         0.1000000E-07      :
          :  -> SCF convergence          0.1000000E-05 Eh   :
          :  -> wf. convergence          0.1000000E-03 e    :
          :  Broyden damping             0.4000000          :
          ...................................................

 iter      E             dE          RMSdq      gap      omega  full diag
   1    -44.5927790 -0.445928E+02  0.109E-04    2.55       0.0  T
   2    -44.5927790 -0.620304E-11  0.451E-05    2.55     398.0  T
   3    -44.5927790 -0.618527E-10  0.467E-05    2.55     384.3  T

   *** convergence criteria satisfied after 3 iterations ***

         #    Occupation            Energy/Eh            Energy/eV
      -------------------------------------------------------------
         1        2.0000           -0.7442343             -20.2516
       ...           ...                  ...                  ...
        35        2.0000           -0.4322831             -11.7630
        36        2.0000           -0.4294867             -11.6869
        37        2.0000           -0.4279501             -11.6451
        38        2.0000           -0.4032854             -10.9740
        39        2.0000           -0.3956079             -10.7650
        40        2.0000           -0.3846256             -10.4662
        41        2.0000           -0.3614177              -9.8347 (HOMO)
        42                         -0.2675820              -7.2813 (LUMO)
        43                         -0.2253831              -6.1330
        44                         -0.2128755              -5.7926
        45                         -0.1955116              -5.3201
        46                         -0.1525583              -4.1513
       ...                                ...                  ...
        86                          0.5962254              16.2241
      -------------------------------------------------------------
                  HL-Gap            0.0938356 Eh            2.5534 eV
             Fermi-level           -0.3144999 Eh           -8.5580 eV

 SCC (total)                   0 d,  0 h,  0 min,  0.042 sec
 SCC setup                      ...        0 min,  0.000 sec (  0.547%)
 Dispersion                     ...        0 min,  0.000 sec (  0.629%)
 integral evaluation            ...        0 min,  0.013 sec ( 31.858%)
 zeroth order Hamiltonian       ...        0 min,  0.000 sec (  0.586%)
 iterations                     ...        0 min,  0.005 sec ( 12.910%)
 molecular gradient             ...        0 min,  0.022 sec ( 52.446%)
 printout                       ...        0 min,  0.000 sec (  0.884%)

         :::::::::::::::::::::::::::::::::::::::::::::::::::::
         ::                     SUMMARY                     ::
         :::::::::::::::::::::::::::::::::::::::::::::::::::::
         :: total energy             -44.046757212444 Eh    ::
         :: gradient norm              0.000964940526 Eh/a0 ::
         :: HOMO-LUMO gap              2.553397849337 eV    ::
         ::.................................................::
         :: SCC energy               -44.592778954351 Eh    ::
         :: -> isotropic ES            0.020065551030 Eh    ::
         :: -> anisotropic ES          0.006133661723 Eh    ::
         :: -> anisotropic XC          0.028724926521 Eh    ::
         :: -> dispersion             -0.036001169793 Eh    ::
         :: repulsion energy           0.545459754145 Eh    ::
         :: add. restraining           0.000000000000 Eh    ::
         :::::::::::::::::::::::::::::::::::::::::::::::::::::

           -------------------------------------------------
          |                Property Printout                |
           -------------------------------------------------

    * Orbital Energies and Occupations

         #    Occupation            Energy/Eh            Energy/eV
      -------------------------------------------------------------
         1        2.0000           -0.7442343             -20.2516
       ...           ...                  ...                  ...
        29        2.0000           -0.4668842             -12.7046
        30        2.0000           -0.4632822             -12.6065
        31        2.0000           -0.4616700             -12.5627
        32        2.0000           -0.4547828             -12.3753
        33        2.0000           -0.4495341             -12.2324
        34        2.0000           -0.4366106             -11.8808
        35        2.0000           -0.4322831             -11.7630
        36        2.0000           -0.4294867             -11.6869
        37        2.0000           -0.4279501             -11.6451
        38        2.0000           -0.4032854             -10.9740
        39        2.0000           -0.3956079             -10.7650
        40        2.0000           -0.3846256             -10.4662
        41        2.0000           -0.3614177              -9.8347 (HOMO)
        42                         -0.2675820              -7.2813 (LUMO)
        43                         -0.2253831              -6.1330
        44                         -0.2128755              -5.7926
        45                         -0.1955116              -5.3201
        46                         -0.1525583              -4.1513
        47                         -0.1317477              -3.5850
        48                         -0.0480801              -1.3083
        49                         -0.0259286              -0.7056
        50                         -0.0014167              -0.0386
        51                          0.0010815               0.0294
        52                          0.0065744               0.1789
       ...                                ...                  ...
        86                          0.5962254              16.2241
      -------------------------------------------------------------
                  HL-Gap            0.0938356 Eh            2.5534 eV
             Fermi-level           -0.3144999 Eh           -8.5580 eV

     #   Z        covCN         q      C6AA      α(0)
     1   6 C      3.015     0.068    26.466     8.439
     2   7 N      1.937    -0.218    26.589     7.646
     3   6 C      3.348     0.055    24.163     7.753
     4   6 C      3.044    -0.008    28.178     8.706
     5  16 S      2.237    -0.021   141.907    20.050
     6   6 C      3.914     0.037    19.893     6.339
     7   6 C      4.066     0.062    19.464     6.267
     8   6 C      3.922     0.005    20.436     6.425
     9   6 C      3.804    -0.055    21.552     6.609
    10   6 C      3.751    -0.105    22.576     6.776
    11   6 C      3.805    -0.058    21.614     6.619
    12   6 C      3.751    -0.100    22.462     6.759
    13   7 N      2.723    -0.267    26.901     7.703
    14   6 C      3.765     0.066    19.513     6.296
    15  16 S      2.110    -0.205   149.767    20.597
    16   1 H      0.926     0.059     2.211     2.325
    17   1 H      0.924     0.051     2.303     2.373
    18   1 H      0.922     0.010     2.896     2.661
    19   1 H      0.924     0.033     2.548     2.496
    20   1 H      0.924     0.045     2.377     2.411
    21   1 H      0.925     0.049     2.332     2.388
    22   1 H      0.925     0.037     2.490     2.468
    23   1 H      0.925     0.040     2.445     2.445
    24   1 H      0.924     0.032     2.558     2.501
    25   1 H      0.925     0.057     2.235     2.338
    26   1 H      0.925     0.027     2.626     2.534
    27   1 H      0.925     0.039     2.461     2.453
    28   1 H      0.925     0.040     2.443     2.444
    29   1 H      0.860     0.148     1.411     1.861
    30   1 H      0.924     0.026     2.646     2.544
    31   1 H      0.924     0.049     2.335     2.389

 Mol. C6AA /au·bohr⁶  :      12300.112995
 Mol. C8AA /au·bohr⁸  :     338155.675024
 Mol. α(0) /au        :        171.615925


Wiberg/Mayer (AO) data.
largest (>0.10) Wiberg bond orders for each atom
          total WBO             WBO to atom ...
     1  C   3.953        N    2 1.645    S    5 1.166    H   16 0.964    C    4 0.109
     2  N   3.138        C    1 1.645    C    3 1.262    S    5 0.164
     3  C   3.971        C    4 1.521    N    2 1.262    C    8 0.973
     4  C   3.944        C    3 1.521    S    5 1.193    C    6 1.027    C    1 0.109
     5  S   2.672        C    4 1.193    C    1 1.166    N    2 0.164
     6  C   3.978        C    4 1.027    C    7 0.965    S   15 0.962    H   17 0.944
     7  C   3.978        N   13 1.006    C    6 0.965    C    8 0.955    H   18 0.954
     8  C   3.987        C   11 0.982    C    3 0.973    C    9 0.972    C    7 0.955
     9  C   3.995        C   10 1.019    H   19 0.975    C    8 0.972    H   20 0.971
    10  C   3.995        C    9 1.019    H   22 0.986    H   23 0.986    H   21 0.984
    11  C   3.995        C   12 1.019    C    8 0.982    H   24 0.976    H   25 0.971
    12  C   3.996        C   11 1.019    H   27 0.986    H   28 0.985    H   26 0.984
    13  N   3.055        C   14 1.017    C    7 1.006    H   29 0.942
    14  C   3.973        N   13 1.017    H   31 0.975    H   30 0.973    S   15 0.973
    15  S   2.059        C   14 0.973    C    6 0.962
    16  H   0.996        C    1 0.964
    17  H   0.997        C    6 0.944
    18  H   1.000        C    7 0.954
    19  H   0.999        C    9 0.975
    20  H   0.997        C    9 0.971
    21  H   0.998        C   10 0.984
    22  H   0.998        C   10 0.986
    23  H   0.998        C   10 0.986
    24  H   0.999        C   11 0.976
    25  H   0.996        C   11 0.971
    26  H   0.999        C   12 0.984
    27  H   0.998        C   12 0.986
    28  H   0.998        C   12 0.985
    29  H   0.977        N   13 0.942
    30  H   0.999        C   14 0.973
    31  H   0.997        C   14 0.975

molecular dipole:
                 x           y           z       tot (Debye)
 q only:       -0.304      -0.563      -0.635
   full:       -0.519      -0.852      -0.515       2.854
molecular quadrupole (traceless):
                xx          xy          yy          xz          yz          zz
 q only:        3.628       4.271       0.440       0.652      -1.849      -4.068
  q+dip:        5.668       5.715       2.080       0.913      -7.500      -7.747
   full:        5.701       6.569       1.492       0.433      -7.179      -7.194

           -------------------------------------------------
          |                Geometry Summary                 |
           -------------------------------------------------

      molecular mass/u    :      240.3808000
   center of mass at/Å    :       -0.1047894      -0.0650061      -0.1362281
  moments of inertia/u·Å² :        0.9138603E+03   0.9533672E+03   0.1601539E+04
rotational constants/cm⁻¹ :        0.1844662E-01   0.1768220E-01   0.1052590E-01

 * 30 selected distances

     #   Z        #   Z                                     value/Å
     1   6 C      2   7 N                                 1.2849638
     2   7 N      3   6 C                                 1.3480981
     3   6 C      4   6 C                                 1.3745832
     1   6 C      5  16 S                                 1.7493121 (max)
     4   6 C      5  16 S                                 1.7125348
     4   6 C      6   6 C                                 1.4752053
     6   6 C      7   6 C                                 1.5368214
     7   6 C      8   6 C                                 1.5494149
     8   6 C      9   6 C                                 1.5375936
     9   6 C     10   6 C                                 1.5241662
     8   6 C     11   6 C                                 1.5341584
    11   6 C     12   6 C                                 1.5234291
     7   6 C     13   7 N                                 1.4432413
    13   7 N     14   6 C                                 1.4562394
     1   6 C     16   1 H                                 1.0711017
     6   6 C     17   1 H                                 1.0967514
     7   6 C     18   1 H                                 1.1094495
     9   6 C     19   1 H                                 1.0917086
     9   6 C     20   1 H                                 1.0904613
    10   6 C     21   1 H                                 1.0873657
    10   6 C     22   1 H                                 1.0875231
    10   6 C     23   1 H                                 1.0864416
    11   6 C     24   1 H                                 1.0934545
    11   6 C     25   1 H                                 1.0897207
    12   6 C     26   1 H                                 1.0878947
    12   6 C     27   1 H                                 1.0877071
    12   6 C     28   1 H                                 1.0863448
    13   7 N     29   1 H                                 1.0142827 (min)
    14   6 C     30   1 H                                 1.0971479
    14   6 C     31   1 H                                 1.0916768

 * 5 distinct bonds (by element types)

   Z      Z             #   av. dist./Å        max./Å        min./Å
   1 H    6 C          15     1.0903166     1.1094495     1.0711017
   6 C    6 C           8     1.5069215     1.5494149     1.3745832
   1 H    7 N           1     1.0142827     1.0142827     1.0142827
   6 C    7 N           4     1.3831356     1.4562394     1.2849638
   6 C   16 S           2     1.7309234     1.7493121     1.7125348


optimized geometry written to: xtbopt.xyz


           -------------------------------------------------
          | TOTAL ENERGY              -44.046757212444 Eh   |
          | GRADIENT NORM               0.000964940526 Eh/α |
          | HOMO-LUMO GAP               2.553397849337 eV   |
           -------------------------------------------------

------------------------------------------------------------------------
 * finished run on 2021/05/19 at 11:00:39.712     
------------------------------------------------------------------------
 total:
 * wall-time:     0 d,  0 h,  0 min,  0.698 sec
 *  cpu-time:     0 d,  0 h,  0 min,  0.651 sec
 * ratio c/w:     0.932 speedup
 SCF:
 * wall-time:     0 d,  0 h,  0 min,  0.096 sec
 *  cpu-time:     0 d,  0 h,  0 min,  0.058 sec
 * ratio c/w:     0.603 speedup
 ANC optimizer:
 * wall-time:     0 d,  0 h,  0 min,  0.568 sec
 *  cpu-time:     0 d,  0 h,  0 min,  0.568 sec
 * ratio c/w:     1.000 speedup

