      -----------------------------------------------------------      
     |                   =====================                   |     
     |                           x T B                           |     
     |                   =====================                   |     
     |                         S. Grimme                         |     
     |          Mulliken Center for Theoretical Chemistry        |     
     |                    University of Bonn                     |     
     |                Version 6.2 RC2 (SAW190805)                |     
      -----------------------------------------------------------      

   This program is distributed in the hope that it will be useful,
   but WITHOUT ANY WARRANTY; without even the implied warranty of
   MERCHANTABILITY or FITNESS FOR A PARTICULAR PURPOSE.
   
   FOR NON-COMMERCIAL, ACADEMIA USE ONLY.
   
   Cite this work as:
   * S. Grimme, C. Bannwarth, P. Shushkov, J. Chem. Theory Comput., 2017,
     13, 1989-2009. DOI: 10.1021/acs.jctc.7b00118
   * C. Bannwarth, S. Ehlert and S. Grimme., J. Chem. Theory Comput., 2019,
     15, 1652-1671. DOI: 10.1021/acs.jctc.8b01176
   * P. Pracht, E. Caldeweyher, S. Ehlert, S. Grimme, ChemRxiv, 2019, preprint.
     DOI: 10.26434/chemrxiv.8326202.v1
   
   for DFT-D4:
   * E. Caldeweyher, C. Bannwarth and S. Grimme, J. Chem. Phys., 2017,
     147, 034112. DOI: 10.1063/1.4993215
   * E. Caldeweyher, S. Ehlert, A. Hansen, H. Neugebauer, S. Spicher,
     C. Bannwarth and S. Grimme, J. Chem. Phys., 2019, 150, 154122.
     DOI: 10.1063/1.5090222
   
   for sTDA-xTB:
   * S. Grimme and C. Bannwarth, J. Chem. Phys., 2016, 145, 054103.
     DOI: 10.1063/1.4959605
   
   in the mass-spec context:
   * V. Asgeirsson, C. Bauer and S. Grimme, Chem. Sci., 2017, 8, 4879.
     DOI: 10.1039/c7sc00601b
   
   for metadynamics refer to:
   * S. Grimme, J. Chem. Theory Comput., 2019, 155, 2847-2862
     DOI: 10.1021/acs.jctc.9b00143
   
   with help from (in alphabetical order)
   C. Bannwarth, F. Bohle, G. Brandenburg, E. Caldeweyher, M. Checinski,
   S. Dohm, S. Ehlert, S. Ehrlich, F. März, H. Neugebauer, J. Pisarek,
   P. Pracht, P. Shushkov, and S. Spicher.
   
 * started run on 2021/05/19 at 11:00:43.308     

           -------------------------------------------------
          |                Calculation Setup                |
           -------------------------------------------------

          program call               : /ihome/ghutchison/geoffh/xtb/xtb 939.xyz -opt
          hostname                   : smp-n122
          coordinate file            : 939.xyz
          omp threads                :                     1
          number of atoms            :                    33
          number of electrons        :                   102
          charge                     :                     0
          spin                       :                   0.0
          first test random number   :      0.02598837726238


########################################################################
# WARNING! Please study the warnings concerning your input carefully
#  - the use of '-opt' is discouraged, please use '--opt' next time
########################################################################

           ------------------------------------------------- 
          |                 G F N 2 - x T B                 |
          | Geometry, Frequencies, Noncovalent interactions |
          |            JCTC 2019 parametrisation            |
           ------------------------------------------------- 
             KAB for C  - Si     :                1.0500
             KAB for H  - Pd     :                0.9500
             k(s)              :                1.8500
             k(p)              :                2.2300
             k(d)              :                2.2300
             k(f)              :                2.0000
             kEN (H0ij)        :               -2.0000
             D4 a1             :                0.5200
             D4 a2             :                5.0000
             D4 s6             :                1.0000
             D4 s8             :                2.7000
             D4 s9             :                5.0000
             alphaj            :                2.0000

  Z AO/shell   Hii/eV     exponent
  1     Wed Apr 25 08:07:45 CEST 2018   EN: 2.200 GM2: 0.406  GM3: 0.0800  RAES: 1.40
     1s    -10.707211    1.230000
  6     Wed Apr 25 08:07:45 CEST 2018   EN: 2.550 GM2: 0.538  GM3: 0.1500  RAES: 3.00
     2s    -13.970922    2.096432
     2p    -10.063292    1.800000
  8     Wed Apr 25 08:07:45 CEST 2018   EN: 3.440 GM2: 0.452  GM3:-0.0517  RAES: 1.80
     2s    -20.229985    2.439742
     2p    -15.503117    2.137023
 16     Tue Apr 24 11:44:34 CEST 2018   EN: 2.580 GM2: 0.340  GM3:-0.0502  RAES: 3.10
     3s    -20.029654    1.981333
     3p    -11.377694    2.025643
     3d     -0.420282    1.702555

           ------------------------------------------------- 
          |        Self-Consistent Charge Iterations        |
           ------------------------------------------------- 

          ...................................................
          :                      SETUP                      :
          :.................................................:
          :  # basis functions                 102          :
          :  # atomic orbitals                 101          :
          :  # shells                           55          :
          :  # electrons                       102          :
          :  max. iterations                   250          :
          :  Hamiltonian                  GFN2-xTB          :
          :  restarted?                      false          :
          :  GBSA solvation                  false          :
          :  PC potential                    false          :
          :  electronic temp.          300.0000000     K    :
          :  accuracy                    1.0000000          :
          :  -> integral cutoff          0.2500000E+02      :
          :  -> integral neglect         0.1000000E-07      :
          :  -> SCF convergence          0.1000000E-05 Eh   :
          :  -> wf. convergence          0.1000000E-03 e    :
          :  Broyden damping             0.4000000          :
          ...................................................

 iter      E             dE          RMSdq      gap      omega  full diag
   1    -56.7414872 -0.567415E+02  0.480E+00    3.14       0.0  T
   2    -56.7951244 -0.536372E-01  0.272E+00    2.43       1.0  T
   3    -56.7730458  0.220786E-01  0.165E+00    2.97       1.0  T
   4    -56.8127181 -0.396723E-01  0.410E-01    2.68       1.0  T
   5    -56.8171346 -0.441643E-02  0.130E-01    2.72       1.0  T
   6    -56.8174821 -0.347585E-03  0.454E-02    2.74       1.0  T
   7    -56.8175020 -0.198926E-04  0.199E-02    2.73       1.0  T
   8    -56.8175075 -0.543521E-05  0.928E-03    2.73       1.9  T
   9    -56.8175082 -0.720781E-06  0.322E-03    2.73       5.4  T
  10    -56.8175083 -0.734878E-07  0.150E-03    2.73      11.6  T
  11    -56.8175083 -0.326114E-07  0.711E-04    2.73      24.5  T
  12    -56.8175083  0.227774E-08  0.450E-04    2.73      38.6  T

   *** convergence criteria satisfied after 12 iterations ***

         #    Occupation            Energy/Eh            Energy/eV
      -------------------------------------------------------------
         1        2.0000           -0.7581361             -20.6299
       ...           ...                  ...                  ...
        45        2.0000           -0.4176750             -11.3655
        46        2.0000           -0.4152117             -11.2985
        47        2.0000           -0.4149795             -11.2922
        48        2.0000           -0.4141566             -11.2698
        49        2.0000           -0.4137262             -11.2581
        50        2.0000           -0.3923667             -10.6768
        51        2.0000           -0.3921504             -10.6710 (HOMO)
        52                         -0.2917076              -7.9378 (LUMO)
        53                         -0.2911848              -7.9235
        54                         -0.2579255              -7.0185
        55                         -0.2379948              -6.4762
        56                         -0.2378804              -6.4731
       ...                                ...                  ...
       101                          0.6580151              17.9055
      -------------------------------------------------------------
                  HL-Gap            0.1004427 Eh            2.7332 eV
             Fermi-level           -0.3419290 Eh           -9.3044 eV

 SCC (total)                   0 d,  0 h,  0 min,  0.124 sec
 SCC setup                      ...        0 min,  0.000 sec (  0.361%)
 Dispersion                     ...        0 min,  0.001 sec (  0.531%)
 integral evaluation            ...        0 min,  0.032 sec ( 26.001%)
 zeroth order Hamiltonian       ...        0 min,  0.000 sec (  0.317%)
 iterations                     ...        0 min,  0.052 sec ( 41.907%)
 molecular gradient             ...        0 min,  0.038 sec ( 30.467%)
 printout                       ...        0 min,  0.000 sec (  0.366%)

         :::::::::::::::::::::::::::::::::::::::::::::::::::::
         ::                     SUMMARY                     ::
         :::::::::::::::::::::::::::::::::::::::::::::::::::::
         :: total energy             -55.969779377745 Eh    ::
         :: gradient norm              0.072873509798 Eh/a0 ::
         :: HOMO-LUMO gap              2.733186344764 eV    ::
         ::.................................................::
         :: SCC energy               -56.817508302170 Eh    ::
         :: -> isotropic ES            0.053986377230 Eh    ::
         :: -> anisotropic ES          0.001253427066 Eh    ::
         :: -> anisotropic XC          0.027852692205 Eh    ::
         :: -> dispersion             -0.039160888853 Eh    ::
         :: repulsion energy           0.847805062010 Eh    ::
         :: add. restraining           0.000000000000 Eh    ::
         :::::::::::::::::::::::::::::::::::::::::::::::::::::

      ----------------------------------------------------------- 
     |                   =====================                   |
     |                        A N C O P T                        |
     |                   =====================                   |
     |               Approximate Normal Coordinate               |
     |                Rational Function Optimizer                |
      ----------------------------------------------------------- 

          ...................................................
          :                      SETUP                      :
          :.................................................:
          :   optimization level            normal          :
          :   max. optcycles                   200          :
          :   ANC micro-cycles                  20          :
          :   degrees of freedom                93          :
          :.................................................:
          :   RF solver                   davidson          :
          :   input Hessian                  false          :
          :   write xtbopt.log                true          :
          :   linear?                        false          :
          :   energy convergence         0.5000000E-05 Eh   :
          :   grad. convergence          0.1000000E-02 Eh/α :
          :   maximium RF displ.         2.0000000          :
          :   Hlow (freq-cutoff)         0.5000000E-02      :
          :   Hmax (freq-cutoff)         5.0000000          :
          :   S6 in model hess.         20.0000000          :
          ...................................................

generating ANC from model Hessian ...
Using Lindh-Hessian (1995)
 Shifting diagonal of input Hessian by   4.618037928711956E-003
 Lowest  eigenvalues of input Hessian
   -0.000000   -0.000000   -0.000000    0.000000    0.000000    0.000000
    0.005000    0.005216    0.005500    0.006307    0.006635    0.007404
    0.009243    0.010827    0.013438    0.015843    0.018490    0.018625
 Highest eigenvalues
    1.911941    1.914716    1.940341    1.941607    2.120726    2.149305
 

........................................................................
.............................. CYCLE    1 ..............................
........................................................................
   1    -56.8175083 -0.568175E+02  0.122E-04    2.73       0.0  T
   2    -56.8175083 -0.556142E-10  0.680E-05    2.73     255.8  T
   3    -56.8175083 -0.272067E-10  0.481E-05    2.73     362.0  T
     SCC iter.                  ...        0 min,  0.007 sec
     gradient                   ...        0 min,  0.025 sec
 * total energy  :   -55.9697794 Eh     change       -0.2534887E-07 Eh
   gradient norm :     0.0728760 Eh/α   predicted     0.0000000E+00 (-100.00%)
   displ. norm   :     0.3463605 α      lambda       -0.8542677E-02
   maximum displ.:     0.1580038 α      in ANC's #10, #8, #7, ...

........................................................................
.............................. CYCLE    2 ..............................
........................................................................
   1    -56.8677494 -0.568677E+02  0.229E-01    2.78       0.0  T
   2    -56.8678362 -0.867671E-04  0.114E-01    2.80       1.0  T
   3    -56.8678225  0.137189E-04  0.371E-02    2.80       1.0  T
   4    -56.8678410 -0.184633E-04  0.168E-02    2.80       1.0  T
   5    -56.8678461 -0.515070E-05  0.644E-03    2.80       2.7  T
   6    -56.8678466 -0.473710E-06  0.261E-03    2.80       6.7  T
   7    -56.8678468 -0.176715E-06  0.736E-04    2.80      23.6  T
     SCC iter.                  ...        0 min,  0.014 sec
     gradient                   ...        0 min,  0.023 sec
 * total energy  :   -55.9755549 Eh     change       -0.5775524E-02 Eh
   gradient norm :     0.0284730 Eh/α   predicted    -0.4783754E-02 ( -17.17%)
   displ. norm   :     0.3390592 α      lambda       -0.2389441E-02
   maximum displ.:     0.1729275 α      in ANC's #7, #10, #8, ...

........................................................................
.............................. CYCLE    3 ..............................
........................................................................
   1    -56.8876101 -0.568876E+02  0.159E-01    2.81       0.0  T
   2    -56.8876488 -0.387743E-04  0.813E-02    2.82       1.0  T
   3    -56.8876439  0.496645E-05  0.262E-02    2.83       1.0  T
   4    -56.8876519 -0.800786E-05  0.118E-02    2.83       1.5  T
   5    -56.8876537 -0.177915E-05  0.499E-03    2.83       3.5  T
   6    -56.8876541 -0.401429E-06  0.182E-03    2.83       9.5  T
     SCC iter.                  ...        0 min,  0.012 sec
     gradient                   ...        0 min,  0.023 sec
 * total energy  :   -55.9770546 Eh     change       -0.1499705E-02 Eh
   gradient norm :     0.0064116 Eh/α   predicted    -0.1332069E-02 ( -11.18%)
   displ. norm   :     0.2635572 α      lambda       -0.6284851E-03
   maximum displ.:     0.1526826 α      in ANC's #7, #5, #2, ...

........................................................................
.............................. CYCLE    4 ..............................
........................................................................
   1    -56.8887322 -0.568887E+02  0.843E-02    2.83       0.0  T
   2    -56.8887354 -0.320895E-05  0.505E-02    2.83       1.0  T
   3    -56.8887318  0.356239E-05  0.129E-02    2.83       1.3  T
   4    -56.8887364 -0.454217E-05  0.410E-03    2.83       4.2  T
   5    -56.8887366 -0.177106E-06  0.208E-03    2.83       8.4  T
   6    -56.8887366 -0.787950E-07  0.821E-04    2.83      21.2  T
     SCC iter.                  ...        0 min,  0.012 sec
     gradient                   ...        0 min,  0.023 sec
 * total energy  :   -55.9775252 Eh     change       -0.4705601E-03 Eh
   gradient norm :     0.0054210 Eh/α   predicted    -0.3360818E-03 ( -28.58%)
   displ. norm   :     0.2866855 α      lambda       -0.4666790E-03
   maximum displ.:     0.1805835 α      in ANC's #5, #7, #2, ...

........................................................................
.............................. CYCLE    5 ..............................
........................................................................
   1    -56.8869987 -0.568870E+02  0.109E-01    2.83       0.0  T
   2    -56.8870049 -0.614232E-05  0.628E-02    2.83       1.0  T
   3    -56.8870041  0.833589E-06  0.140E-02    2.83       1.2  T
   4    -56.8870063 -0.228676E-05  0.620E-03    2.83       2.8  T
   5    -56.8870065 -0.199812E-06  0.246E-03    2.83       7.1  T
   6    -56.8870066 -0.762631E-07  0.105E-03    2.83      16.5  T
     SCC iter.                  ...        0 min,  0.012 sec
     gradient                   ...        0 min,  0.023 sec
 * total energy  :   -55.9778946 Eh     change       -0.3693595E-03 Eh
   gradient norm :     0.0047081 Eh/α   predicted    -0.2525176E-03 ( -31.63%)
   displ. norm   :     0.3247844 α      lambda       -0.3964479E-03
   maximum displ.:     0.2051953 α      in ANC's #5, #2, #7, ...

........................................................................
.............................. CYCLE    6 ..............................
........................................................................
   1    -56.8857787 -0.568858E+02  0.149E-01    2.83       0.0  T
   2    -56.8857883 -0.964738E-05  0.801E-02    2.83       1.0  T
   3    -56.8857869  0.138250E-05  0.180E-02    2.83       1.0  T
   4    -56.8857900 -0.305908E-05  0.930E-03    2.83       1.9  T
   5    -56.8857906 -0.602747E-06  0.316E-03    2.83       5.5  T
   6    -56.8857909 -0.290802E-06  0.114E-03    2.83      15.3  T
   7    -56.8857909 -0.247079E-07  0.558E-04    2.83      31.2  T
     SCC iter.                  ...        0 min,  0.014 sec
     gradient                   ...        0 min,  0.023 sec
 * total energy  :   -55.9782081 Eh     change       -0.3135054E-03 Eh
   gradient norm :     0.0046853 Eh/α   predicted    -0.2191365E-03 ( -30.10%)
   displ. norm   :     0.3001107 α      lambda       -0.2882923E-03
   maximum displ.:     0.1952375 α      in ANC's #2, #5, #7, ...

........................................................................
.............................. CYCLE    7 ..............................
........................................................................
   1    -56.8862788 -0.568863E+02  0.160E-01    2.83       0.0  T
   2    -56.8862876 -0.881772E-05  0.825E-02    2.83       1.0  T
   3    -56.8862861  0.154484E-05  0.176E-02    2.83       1.0  T
   4    -56.8862892 -0.315335E-05  0.954E-03    2.83       1.8  T
   5    -56.8862900 -0.735958E-06  0.319E-03    2.83       5.5  T
   6    -56.8862903 -0.345571E-06  0.847E-04    2.83      20.5  T
   7    -56.8862903 -0.861770E-08  0.471E-04    2.83      37.0  T
     SCC iter.                  ...        0 min,  0.014 sec
     gradient                   ...        0 min,  0.023 sec
 * total energy  :   -55.9784425 Eh     change       -0.2344014E-03 Eh
   gradient norm :     0.0040121 Eh/α   predicted    -0.1571368E-03 ( -32.96%)
   displ. norm   :     0.2737479 α      lambda       -0.2237310E-03
   maximum displ.:     0.1935347 α      in ANC's #2, #5, #8, ...

........................................................................
.............................. CYCLE    8 ..............................
........................................................................
   1    -56.8876108 -0.568876E+02  0.163E-01    2.83       0.0  T
   2    -56.8876181 -0.735383E-05  0.823E-02    2.83       1.0  T
   3    -56.8876181  0.412197E-07  0.148E-02    2.83       1.2  T
   4    -56.8876190 -0.888525E-06  0.854E-03    2.83       2.0  T
   5    -56.8876201 -0.112453E-05  0.207E-03    2.83       8.4  T
   6    -56.8876203 -0.156477E-06  0.443E-04    2.83      39.3  T
     SCC iter.                  ...        0 min,  0.012 sec
     gradient                   ...        0 min,  0.023 sec
 * total energy  :   -55.9786291 Eh     change       -0.1866082E-03 Eh
   gradient norm :     0.0027066 Eh/α   predicted    -0.1202494E-03 ( -35.56%)
   displ. norm   :     0.2641228 α      lambda       -0.1878642E-03
   maximum displ.:     0.1956071 α      in ANC's #2, #5, #8, ...

........................................................................
.............................. CYCLE    9 ..............................
........................................................................
   1    -56.8887478 -0.568887E+02  0.167E-01    2.84       0.0  T
   2    -56.8887548 -0.705843E-05  0.852E-02    2.84       1.0  T
   3    -56.8887561 -0.130297E-05  0.137E-02    2.84       1.3  T
   4    -56.8887557  0.387433E-06  0.639E-03    2.84       2.7  T
   5    -56.8887566 -0.881648E-06  0.970E-04    2.84      17.9  T
   6    -56.8887566 -0.306111E-07  0.334E-04    2.84      52.1  T
     SCC iter.                  ...        0 min,  0.012 sec
     gradient                   ...        0 min,  0.025 sec
 * total energy  :   -55.9787886 Eh     change       -0.1595657E-03 Eh
   gradient norm :     0.0026827 Eh/α   predicted    -0.1004872E-03 ( -37.02%)
   displ. norm   :     0.2572863 α      lambda       -0.1607714E-03
   maximum displ.:     0.1948119 α      in ANC's #2, #5, #7, ...

........................................................................
.............................. CYCLE   10 ..............................
........................................................................
   1    -56.8894896 -0.568895E+02  0.168E-01    2.84       0.0  T
   2    -56.8894965 -0.687990E-05  0.863E-02    2.84       1.0  T
   3    -56.8894980 -0.144902E-05  0.135E-02    2.84       1.3  T
   4    -56.8894975  0.501787E-06  0.505E-03    2.84       3.4  T
   5    -56.8894982 -0.715182E-06  0.106E-03    2.84      16.4  T
   6    -56.8894982 -0.382575E-07  0.278E-04    2.84      62.7  T
   7    -56.8894982 -0.110411E-08  0.147E-04    2.84     118.7  T
     SCC iter.                  ...        0 min,  0.014 sec
     gradient                   ...        0 min,  0.025 sec
 * total energy  :   -55.9789246 Eh     change       -0.1359391E-03 Eh
   gradient norm :     0.0030699 Eh/α   predicted    -0.8571236E-04 ( -36.95%)
   displ. norm   :     0.2255522 α      lambda       -0.1198043E-03
   maximum displ.:     0.1761009 α      in ANC's #2, #5, #7, ...

........................................................................
.............................. CYCLE   11 ..............................
........................................................................
   1    -56.8896942 -0.568897E+02  0.145E-01    2.85       0.0  T
   2    -56.8896986 -0.441575E-05  0.757E-02    2.84       1.0  T
   3    -56.8896990 -0.404174E-06  0.121E-02    2.85       1.4  T
   4    -56.8896981  0.950468E-06  0.692E-03    2.84       2.5  T
   5    -56.8896998 -0.173111E-05  0.766E-04    2.84      22.7  T
   6    -56.8896998 -0.175609E-07  0.228E-04    2.84      76.4  T
   7    -56.8896998 -0.129596E-08  0.965E-05    2.84     180.4  T
     SCC iter.                  ...        0 min,  0.014 sec
     gradient                   ...        0 min,  0.025 sec
 * total energy  :   -55.9790244 Eh     change       -0.9979660E-04 Eh
   gradient norm :     0.0021028 Eh/α   predicted    -0.6295330E-04 ( -36.92%)
   displ. norm   :     0.1683943 α      lambda       -0.7298558E-04
   maximum displ.:     0.1379032 α      in ANC's #2, #5, #7, ...

........................................................................
.............................. CYCLE   12 ..............................
........................................................................
   1    -56.8899646 -0.568900E+02  0.103E-01    2.85       0.0  T
   2    -56.8899667 -0.206802E-05  0.546E-02    2.85       1.0  T
   3    -56.8899666  0.974494E-07  0.892E-03    2.85       2.0  T
   4    -56.8899666  0.242356E-07  0.516E-03    2.85       3.4  T
   5    -56.8899673 -0.729419E-06  0.611E-04    2.85      28.5  T
   6    -56.8899673 -0.106950E-07  0.219E-04    2.85      79.5  T
     SCC iter.                  ...        0 min,  0.012 sec
     gradient                   ...        0 min,  0.025 sec
 * total energy  :   -55.9790855 Eh     change       -0.6115477E-04 Eh
   gradient norm :     0.0012533 Eh/α   predicted    -0.3753132E-04 ( -38.63%)
   displ. norm   :     0.1566077 α      lambda       -0.3939756E-04
   maximum displ.:     0.1381008 α      in ANC's #2, #5, #3, ...

........................................................................
.............................. CYCLE   13 ..............................
........................................................................
   1    -56.8902097 -0.568902E+02  0.864E-02    2.85       0.0  T
   2    -56.8902109 -0.123441E-05  0.478E-02    2.85       1.0  T
   3    -56.8902105  0.461114E-06  0.726E-03    2.85       2.4  T
   4    -56.8902108 -0.326908E-06  0.426E-03    2.85       4.1  T
   5    -56.8902113 -0.481187E-06  0.658E-04    2.85      26.5  T
   6    -56.8902113 -0.888093E-08  0.271E-04    2.85      64.3  T
     SCC iter.                  ...        0 min,  0.012 sec
     gradient                   ...        0 min,  0.025 sec
 * total energy  :   -55.9791350 Eh     change       -0.4951586E-04 Eh
   gradient norm :     0.0012131 Eh/α   predicted    -0.1991357E-04 ( -59.78%)
   displ. norm   :     0.0886923 α      lambda       -0.2356838E-04
   maximum displ.:     0.0825263 α      in ANC's #2, #3, #5, ...

........................................................................
.............................. CYCLE   14 ..............................
........................................................................
   1    -56.8904625 -0.568905E+02  0.383E-02    2.85       0.0  T
   2    -56.8904627 -0.156590E-06  0.222E-02    2.85       1.0  T
   3    -56.8904626  0.888380E-07  0.234E-03    2.85       7.5  T
   4    -56.8904627 -0.105736E-06  0.117E-03    2.85      14.9  T
   5    -56.8904627 -0.248118E-07  0.349E-04    2.85      49.8  T
   6    -56.8904627 -0.174593E-08  0.140E-04    2.85     123.9  T
     SCC iter.                  ...        0 min,  0.012 sec
     gradient                   ...        0 min,  0.025 sec
 * total energy  :   -55.9791682 Eh     change       -0.3317457E-04 Eh
   gradient norm :     0.0013642 Eh/α   predicted    -0.1182808E-04 ( -64.35%)
   displ. norm   :     0.0930214 α      lambda       -0.2801469E-04
   maximum displ.:     0.0776979 α      in ANC's #2, #3, #5, ...

........................................................................
.............................. CYCLE   15 ..............................
........................................................................
   1    -56.8906221 -0.568906E+02  0.390E-02    2.85       0.0  T
   2    -56.8906223 -0.249969E-06  0.225E-02    2.85       1.0  T
   3    -56.8906222  0.119036E-06  0.319E-03    2.85       5.5  T
   4    -56.8906224 -0.170412E-06  0.138E-03    2.85      12.6  T
   5    -56.8906224 -0.163913E-07  0.517E-04    2.85      33.7  T
   6    -56.8906224 -0.417800E-08  0.204E-04    2.85      85.3  T
     SCC iter.                  ...        0 min,  0.012 sec
     gradient                   ...        0 min,  0.025 sec
 * total energy  :   -55.9792088 Eh     change       -0.4058437E-04 Eh
   gradient norm :     0.0013298 Eh/α   predicted    -0.1406100E-04 ( -65.35%)
   displ. norm   :     0.1556601 α      lambda       -0.4572510E-04
   maximum displ.:     0.1170145 α      in ANC's #2, #3, #5, ...

........................................................................
.............................. CYCLE   16 ..............................
........................................................................
   1    -56.8902955 -0.568903E+02  0.669E-02    2.85       0.0  T
   2    -56.8902966 -0.102617E-05  0.378E-02    2.84       1.0  T
   3    -56.8902961  0.481161E-06  0.690E-03    2.85       2.5  T
   4    -56.8902968 -0.705040E-06  0.319E-03    2.84       5.5  T
   5    -56.8902969 -0.809502E-07  0.960E-04    2.84      18.1  T
   6    -56.8902969 -0.165959E-07  0.381E-04    2.84      45.7  T
     SCC iter.                  ...        0 min,  0.012 sec
     gradient                   ...        0 min,  0.025 sec
 * total energy  :   -55.9792725 Eh     change       -0.6371100E-04 Eh
   gradient norm :     0.0010836 Eh/α   predicted    -0.2310885E-04 ( -63.73%)
   displ. norm   :     0.2477200 α      lambda       -0.6408471E-04
   maximum displ.:     0.1780447 α      in ANC's #2, #3, #5, ...

........................................................................
.............................. CYCLE   17 ..............................
........................................................................
   1    -56.8899085 -0.568899E+02  0.104E-01    2.84       0.0  T
   2    -56.8899101 -0.159226E-05  0.591E-02    2.84       1.0  T
   3    -56.8899092  0.893952E-06  0.917E-03    2.84       1.9  T
   4    -56.8899105 -0.128618E-05  0.441E-03    2.84       3.9  T
   5    -56.8899107 -0.197404E-06  0.930E-04    2.84      18.7  T
   6    -56.8899107 -0.194817E-07  0.409E-04    2.84      42.6  T
     SCC iter.                  ...        0 min,  0.012 sec
     gradient                   ...        0 min,  0.025 sec
 * total energy  :   -55.9793554 Eh     change       -0.8291750E-04 Eh
   gradient norm :     0.0010597 Eh/α   predicted    -0.3291989E-04 ( -60.30%)
   displ. norm   :     0.2921953 α      lambda       -0.6075681E-04
   maximum displ.:     0.2098168 α      in ANC's #2, #3, #5, ...

........................................................................
.............................. CYCLE   18 ..............................
........................................................................
   1    -56.8895487 -0.568895E+02  0.123E-01    2.84       0.0  T
   2    -56.8895513 -0.266963E-05  0.698E-02    2.84       1.0  T
   3    -56.8895502  0.114855E-05  0.110E-02    2.84       1.6  T
   4    -56.8895519 -0.171069E-05  0.532E-03    2.84       3.3  T
   5    -56.8895522 -0.273449E-06  0.130E-03    2.84      13.4  T
   6    -56.8895522 -0.308923E-07  0.527E-04    2.84      33.1  T
   7    -56.8895522 -0.165747E-08  0.312E-04    2.84      55.7  T
     SCC iter.                  ...        0 min,  0.014 sec
     gradient                   ...        0 min,  0.025 sec
 * total energy  :   -55.9794291 Eh     change       -0.7368336E-04 Eh
   gradient norm :     0.0011845 Eh/α   predicted    -0.3153218E-04 ( -57.21%)
   displ. norm   :     0.2431899 α      lambda       -0.3996793E-04
   maximum displ.:     0.1796717 α      in ANC's #2, #3, #5, ...

........................................................................
.............................. CYCLE   19 ..............................
........................................................................
   1    -56.8892704 -0.568893E+02  0.100E-01    2.84       0.0  T
   2    -56.8892717 -0.136014E-05  0.576E-02    2.84       1.0  T
   3    -56.8892710  0.731932E-06  0.784E-03    2.84       2.2  T
   4    -56.8892720 -0.105276E-05  0.358E-03    2.84       4.9  T
   5    -56.8892721 -0.110033E-06  0.114E-03    2.84      15.3  T
   6    -56.8892722 -0.229442E-07  0.501E-04    2.84      34.7  T
   7    -56.8892722 -0.359026E-08  0.269E-04    2.84      64.7  T
     SCC iter.                  ...        0 min,  0.014 sec
     gradient                   ...        0 min,  0.025 sec
 * total energy  :   -55.9794753 Eh     change       -0.4621798E-04 Eh
   gradient norm :     0.0015546 Eh/α   predicted    -0.2051256E-04 ( -55.62%)
   displ. norm   :     0.1786951 α      lambda       -0.2821963E-04
   maximum displ.:     0.1371290 α      in ANC's #2, #3, #5, ...

........................................................................
.............................. CYCLE   20 ..............................
........................................................................
   1    -56.8896346 -0.568896E+02  0.740E-02    2.84       0.0  T
   2    -56.8896349 -0.286364E-06  0.433E-02    2.84       1.0  T
   3    -56.8896347  0.198727E-06  0.342E-03    2.84       5.1  T
   4    -56.8896350 -0.332194E-06  0.116E-03    2.84      15.1  T
   5    -56.8896350 -0.731798E-08  0.442E-04    2.84      39.4  T
   6    -56.8896350 -0.182670E-08  0.222E-04    2.84      78.4  T
     SCC iter.                  ...        0 min,  0.012 sec
     gradient                   ...        0 min,  0.025 sec
 * total energy  :   -55.9795099 Eh     change       -0.3459978E-04 Eh
   gradient norm :     0.0013049 Eh/α   predicted    -0.1431194E-04 ( -58.64%)
   displ. norm   :     0.1659098 α      lambda       -0.2493296E-04
   maximum displ.:     0.1326436 α      in ANC's #2, #3, #7, ...
 * RMSD in coord.:     0.6040037 α      energy gain  -0.9730549E-02 Eh

generating ANC from model Hessian ...
Using Lindh-Hessian (1995)
 Shifting diagonal of input Hessian by   4.543856744248590E-003
 Lowest  eigenvalues of input Hessian
   -0.000000   -0.000000   -0.000000    0.000000    0.000000    0.000000
    0.005000    0.005073    0.005454    0.006214    0.006744    0.007706
    0.009638    0.011359    0.013731    0.017811    0.019836    0.020060
 Highest eigenvalues
    1.983276    1.987045    2.021467    2.024455    2.212756    2.237583
 

........................................................................
.............................. CYCLE   21 ..............................
........................................................................
   1    -56.8901367 -0.568901E+02  0.707E-02    2.84       0.0  T
   2    -56.8901372 -0.417261E-06  0.413E-02    2.83       1.0  T
   3    -56.8901369  0.243324E-06  0.376E-03    2.84       4.6  T
   4    -56.8901373 -0.337866E-06  0.146E-03    2.83      12.0  T
   5    -56.8901373 -0.321718E-07  0.570E-04    2.83      30.6  T
   6    -56.8901373 -0.237798E-08  0.241E-04    2.83      72.2  T
     SCC iter.                  ...        0 min,  0.012 sec
     gradient                   ...        0 min,  0.025 sec
 * total energy  :   -55.9795440 Eh     change       -0.3408722E-04 Eh
   gradient norm :     0.0008367 Eh/α   predicted     0.0000000E+00 (-100.00%)
   displ. norm   :     0.0023511 α      lambda       -0.5441246E-06
   maximum displ.:     0.0019847 α      in ANC's #1, #92, #2, ...

........................................................................
.............................. CYCLE   22 ..............................
........................................................................
   1    -56.8900501 -0.568901E+02  0.260E-03    2.83       0.0  T
   2    -56.8900501 -0.545389E-07  0.124E-03    2.83      14.0  T
   3    -56.8900501  0.132687E-09  0.665E-04    2.83      26.2  T
   4    -56.8900502 -0.291994E-08  0.350E-04    2.83      49.7  T
     SCC iter.                  ...        0 min,  0.009 sec
     gradient                   ...        0 min,  0.025 sec
 * total energy  :   -55.9795445 Eh     change       -0.5133192E-06 Eh
   gradient norm :     0.0006365 Eh/α   predicted    -0.2764121E-06 ( -46.15%)
   displ. norm   :     0.0022587 α      lambda        0.8658651E-06
   maximum displ.:     0.0018744 α      in ANC's #1, #92, #2, ...

   *** GEOMETRY OPTIMIZATION CONVERGED AFTER 22 ITERATIONS ***

------------------------------------------------------------------------
 total energy gain   :        -0.0097651 Eh       -6.1277 kcal/mol
 total RMSD          :         0.6040769 a0        0.3197 Å
 total power (kW/mol):        -1.1653817 (step)  -20.2687 (real)
------------------------------------------------------------------------

 ANCopt (total)                0 d,  0 h,  0 min,  1.265 sec
 optimizer setup                ...        0 min,  0.000 sec (  0.011%)
 model hessian                  ...        0 min,  0.013 sec (  1.022%)
 ANC generation                 ...        0 min,  0.002 sec (  0.168%)
 coordinate transformation      ...        0 min,  0.000 sec (  0.036%)
 single point calculation       ...        0 min,  1.242 sec ( 98.160%)
 optimization log               ...        0 min,  0.003 sec (  0.218%)
 hessian update                 ...        0 min,  0.000 sec (  0.025%)
 rational function              ...        0 min,  0.003 sec (  0.234%)

================
 final structure:
================
$coord
    3.54321685509716    2.71617378349254   -6.74802127606345      C 
    4.52069701414993    2.36313172260896   -4.32702639945787      C 
    5.93708035608271    4.46832609664847   -3.14402769259612      C 
    5.68034314865238    6.65475893400288   -3.77478818891889      O 
    7.82789260611999    3.74481606781549   -1.20094686865209      C 
    9.54492369448553    1.84474119599703   -1.46746040497961      C 
   11.66970023300692    1.74155279156387    0.98457455146721      S 
   10.25201565323877    4.29454557353480    2.40067876942481      C 
    8.24901440158395    5.18333138390454    1.04729703486039      C 
    6.49095872148037    7.18487867327471    1.92524916903188      C 
    4.22303050293374    6.90361238807497    1.77193894590888      O 
    7.67092350581183    9.43560104409665    3.10034945221730      C 
    6.25784757409706   10.82621790388714    4.83540236358433      C 
    7.29623281758550   12.91118084630186    6.01289390387672      C 
    9.74350643899117   13.64973982671899    5.44145137226469      C 
   11.14019978744417   12.31002984684523    3.67686408177992      C 
   10.11824323594871   10.20709087459619    2.51025109854977      C 
    4.12262139206975    0.07199207062650   -3.09204450470021      C 
    2.80418820444120   -1.84185152452186   -4.28611268165618      C 
    1.88629904797377   -1.49607542627365   -6.71450719701080      C 
    2.24924252483564    0.78942495288922   -7.94170904820118      C 
    3.83913486865345    4.51525155884887   -7.66470470615288      H 
    9.71597700760899    0.53134371703499   -3.00112021844080      H 
   10.93807072490602    4.96164298433555    4.18691764761500      H 
    4.35211754602840   10.22255201762328    5.24545484156583      H 
    6.20129475231310   13.96579153985945    7.37439090140276      H 
   10.55942328876861   15.27853410964097    6.36217503806685      H 
   13.03412697693748   12.91022582424673    3.20908194830742      H 
   11.19940370760276    9.19130227913058    1.10942930649810      H 
    4.80307918852397   -0.19233001058099   -1.18662797596060      H 
    2.48993537763737   -3.61296063001296   -3.32129466275977      H 
    0.87800063732933   -3.00641435375430   -7.64667793491495      H 
    1.51840109773704    1.06490409595939   -9.82718283458437      H 
$end
           -------------------------------------------------
          |                Final Singlepoint                |
           -------------------------------------------------

          ...................................................
          :                      SETUP                      :
          :.................................................:
          :  # basis functions                 102          :
          :  # atomic orbitals                 101          :
          :  # shells                           55          :
          :  # electrons                       102          :
          :  max. iterations                   250          :
          :  Hamiltonian                  GFN2-xTB          :
          :  restarted?                      false          :
          :  GBSA solvation                  false          :
          :  PC potential                    false          :
          :  electronic temp.          300.0000000     K    :
          :  accuracy                    1.0000000          :
          :  -> integral cutoff          0.2500000E+02      :
          :  -> integral neglect         0.1000000E-07      :
          :  -> SCF convergence          0.1000000E-05 Eh   :
          :  -> wf. convergence          0.1000000E-03 e    :
          :  Broyden damping             0.4000000          :
          ...................................................

 iter      E             dE          RMSdq      gap      omega  full diag
   1    -56.8900502 -0.568901E+02  0.139E-04    2.83       0.0  T
   2    -56.8900502 -0.391793E-10  0.771E-05    2.83     225.8  T
   3    -56.8900502 -0.272280E-10  0.600E-05    2.83     290.0  T

   *** convergence criteria satisfied after 3 iterations ***

         #    Occupation            Energy/Eh            Energy/eV
      -------------------------------------------------------------
         1        2.0000           -0.7518240             -20.4582
       ...           ...                  ...                  ...
        45        2.0000           -0.4177783             -11.3683
        46        2.0000           -0.4171006             -11.3499
        47        2.0000           -0.4170056             -11.3473
        48        2.0000           -0.4154025             -11.3037
        49        2.0000           -0.4136748             -11.2567
        50        2.0000           -0.3940686             -10.7232
        51        2.0000           -0.3931680             -10.6986 (HOMO)
        52                         -0.2890050              -7.8642 (LUMO)
        53                         -0.2859789              -7.7819
        54                         -0.2581596              -7.0249
        55                         -0.2350367              -6.3957
        56                         -0.2349080              -6.3922
       ...                                ...                  ...
       101                          0.6870526              18.6957
      -------------------------------------------------------------
                  HL-Gap            0.1041630 Eh            2.8344 eV
             Fermi-level           -0.3410865 Eh           -9.2814 eV

 SCC (total)                   0 d,  0 h,  0 min,  0.052 sec
 SCC setup                      ...        0 min,  0.000 sec (  0.665%)
 Dispersion                     ...        0 min,  0.001 sec (  0.959%)
 integral evaluation            ...        0 min,  0.019 sec ( 35.728%)
 zeroth order Hamiltonian       ...        0 min,  0.000 sec (  0.531%)
 iterations                     ...        0 min,  0.007 sec ( 13.322%)
 molecular gradient             ...        0 min,  0.025 sec ( 47.903%)
 printout                       ...        0 min,  0.000 sec (  0.800%)

         :::::::::::::::::::::::::::::::::::::::::::::::::::::
         ::                     SUMMARY                     ::
         :::::::::::::::::::::::::::::::::::::::::::::::::::::
         :: total energy             -55.979544455762 Eh    ::
         :: gradient norm              0.000637388940 Eh/a0 ::
         :: HOMO-LUMO gap              2.834418927033 eV    ::
         ::.................................................::
         :: SCC energy               -56.890050153053 Eh    ::
         :: -> isotropic ES            0.052633518948 Eh    ::
         :: -> anisotropic ES          0.000067491585 Eh    ::
         :: -> anisotropic XC          0.026403269208 Eh    ::
         :: -> dispersion             -0.039965639122 Eh    ::
         :: repulsion energy           0.910514632130 Eh    ::
         :: add. restraining           0.000000000000 Eh    ::
         :::::::::::::::::::::::::::::::::::::::::::::::::::::

           -------------------------------------------------
          |                Property Printout                |
           -------------------------------------------------

    * Orbital Energies and Occupations

         #    Occupation            Energy/Eh            Energy/eV
      -------------------------------------------------------------
         1        2.0000           -0.7518240             -20.4582
       ...           ...                  ...                  ...
        39        2.0000           -0.4786813             -13.0256
        40        2.0000           -0.4471896             -12.1686
        41        2.0000           -0.4470681             -12.1653
        42        2.0000           -0.4331661             -11.7870
        43        2.0000           -0.4327148             -11.7748
        44        2.0000           -0.4185490             -11.3893
        45        2.0000           -0.4177783             -11.3683
        46        2.0000           -0.4171006             -11.3499
        47        2.0000           -0.4170056             -11.3473
        48        2.0000           -0.4154025             -11.3037
        49        2.0000           -0.4136748             -11.2567
        50        2.0000           -0.3940686             -10.7232
        51        2.0000           -0.3931680             -10.6986 (HOMO)
        52                         -0.2890050              -7.8642 (LUMO)
        53                         -0.2859789              -7.7819
        54                         -0.2581596              -7.0249
        55                         -0.2350367              -6.3957
        56                         -0.2349080              -6.3922
        57                         -0.2223813              -6.0513
        58                         -0.2216209              -6.0306
        59                         -0.1921666              -5.2291
        60                         -0.1570271              -4.2729
        61                         -0.1323588              -3.6017
        62                         -0.0953199              -2.5938
       ...                                ...                  ...
       101                          0.6870526              18.6957
      -------------------------------------------------------------
                  HL-Gap            0.1041630 Eh            2.8344 eV
             Fermi-level           -0.3410865 Eh           -9.2814 eV

     #   Z        covCN         q      C6AA      α(0)
     1   6 C      2.925    -0.016    28.412     8.741
     2   6 C      2.973    -0.011    28.292     8.725
     3   6 C      2.825     0.238    23.023     7.862
     4   8 O      0.858    -0.356    20.818     6.117
     5   6 C      3.161    -0.015    28.046     8.657
     6   6 C      2.938    -0.023    28.579     8.768
     7  16 S      2.291     0.021   140.188    19.928
     8   6 C      2.938    -0.023    28.576     8.767
     9   6 C      3.161    -0.015    28.053     8.658
    10   6 C      2.825     0.238    23.032     7.864
    11   8 O      0.858    -0.357    20.831     6.119
    12   6 C      2.973    -0.011    28.295     8.725
    13   6 C      2.925    -0.016    28.413     8.742
    14   6 C      2.918    -0.026    28.649     8.777
    15   6 C      2.920    -0.022    28.548     8.762
    16   6 C      2.918    -0.027    28.664     8.780
    17   6 C      2.921    -0.025    28.627     8.774
    18   6 C      2.921    -0.025    28.622     8.773
    19   6 C      2.918    -0.026    28.663     8.779
    20   6 C      2.920    -0.022    28.547     8.762
    21   6 C      2.918    -0.026    28.648     8.777
    22   1 H      0.926     0.058     2.219     2.330
    23   1 H      0.926     0.054     2.269     2.356
    24   1 H      0.926     0.054     2.267     2.355
    25   1 H      0.926     0.058     2.220     2.330
    26   1 H      0.926     0.041     2.434     2.440
    27   1 H      0.926     0.040     2.452     2.449
    28   1 H      0.926     0.039     2.464     2.455
    29   1 H      0.926     0.039     2.458     2.452
    30   1 H      0.926     0.039     2.460     2.453
    31   1 H      0.926     0.039     2.464     2.455
    32   1 H      0.926     0.040     2.452     2.449
    33   1 H      0.926     0.041     2.434     2.439

 Mol. C6AA /au·bohr⁶  :      18031.796224
 Mol. C8AA /au·bohr⁸  :     487451.017929
 Mol. α(0) /au        :        216.817494


Wiberg/Mayer (AO) data.
largest (>0.10) Wiberg bond orders for each atom
          total WBO             WBO to atom ...
     1  C   3.988        C   21 1.455    C    2 1.381    H   22 0.966    C   19 0.107
     2  C   3.988        C   18 1.383    C    1 1.381    C    3 1.020    C   20 0.102
     3  C   3.931        O    4 1.807    C    2 1.020    C    5 0.997
     4  O   2.077        C    3 1.807
     5  C   3.982        C    6 1.579    C    9 1.192    C    3 0.997
     6  C   3.952        C    5 1.579    S    7 1.204    H   23 0.969    C    8 0.102
     7  S   2.679        C    8 1.206    C    6 1.204
     8  C   3.952        C    9 1.576    S    7 1.206    H   24 0.969    C    6 0.102
     9  C   3.982        C    8 1.576    C    5 1.192    C   10 0.999
    10  C   3.931        O   11 1.805    C   12 1.020    C    9 0.999
    11  O   2.076        C   10 1.805
    12  C   3.988        C   17 1.383    C   13 1.381    C   10 1.020    C   15 0.102
    13  C   3.988        C   14 1.455    C   12 1.381    H   25 0.966    C   16 0.107
    14  C   3.992        C   13 1.455    C   15 1.432    H   26 0.970    C   17 0.107
    15  C   3.991        C   16 1.433    C   14 1.432    H   27 0.971    C   12 0.102
    16  C   3.992        C   17 1.454    C   15 1.433    H   28 0.970    C   13 0.107
    17  C   3.991        C   16 1.454    C   12 1.383    H   29 0.967    C   14 0.107
    18  C   3.991        C   19 1.454    C    2 1.383    H   30 0.967    C   21 0.107
    19  C   3.992        C   18 1.454    C   20 1.433    H   31 0.970    C    1 0.107
    20  C   3.991        C   19 1.433    C   21 1.432    H   32 0.971    C    2 0.102
    21  C   3.992        C    1 1.455    C   20 1.432    H   33 0.970    C   18 0.107
    22  H   0.997        C    1 0.966
    23  H   0.997        C    6 0.969
    24  H   0.997        C    8 0.969
    25  H   0.997        C   13 0.966
    26  H   0.998        C   14 0.970
    27  H   0.998        C   15 0.971
    28  H   0.998        C   16 0.970
    29  H   0.998        C   17 0.967
    30  H   0.998        C   18 0.967
    31  H   0.998        C   19 0.970
    32  H   0.998        C   20 0.971
    33  H   0.998        C   21 0.970

molecular dipole:
                 x           y           z       tot (Debye)
 q only:        1.070      -0.818       0.337
   full:        1.066      -0.815       0.339       3.518
molecular quadrupole (traceless):
                xx          xy          yy          xz          yz          zz
 q only:       12.994       7.349     -10.900       9.701      16.637      -2.094
  q+dip:       10.012      11.936      -9.732      10.052      20.248      -0.281
   full:       10.591      10.486     -10.946       8.831      18.390       0.355

           -------------------------------------------------
          |                Geometry Summary                 |
           -------------------------------------------------

      molecular mass/u    :      292.3516000
   center of mass at/Å    :        3.7104894       2.7588288      -0.1835857
  moments of inertia/u·Å² :        0.8304833E+03   0.3196515E+04   0.3666877E+04
rotational constants/cm⁻¹ :        0.2029858E-01   0.5273754E-02   0.4597273E-02

 * 31 selected distances

     #   Z        #   Z                                     value/Å
     1   6 C      2   6 C                                 1.3941910
     3   6 C      4   8 O                                 1.2118346
     5   6 C      6   6 C                                 1.3625168
     6   6 C      7  16 S                                 1.7178139 (max)
     7  16 S      8   6 C                                 1.7174189
     5   6 C      9   6 C                                 1.4298826
     8   6 C      9   6 C                                 1.3629367
    10   6 C     11   8 O                                 1.2120485
    12   6 C     13   6 C                                 1.3941594
    13   6 C     14   6 C                                 1.3811223
    14   6 C     15   6 C                                 1.3861176
    15   6 C     16   6 C                                 1.3859337
    12   6 C     17   6 C                                 1.3933335
    16   6 C     17   6 C                                 1.3827366
     2   6 C     18   6 C                                 1.3933515
    18   6 C     19   6 C                                 1.3826484
    19   6 C     20   6 C                                 1.3859173
     1   6 C     21   6 C                                 1.3811041
    20   6 C     21   6 C                                 1.3861277
     1   6 C     22   1 H                                 1.0799050
     6   6 C     23   1 H                                 1.0723362
     8   6 C     24   1 H                                 1.0723304 (min)
    13   6 C     25   1 H                                 1.0798798
    14   6 C     26   1 H                                 1.0799323
    15   6 C     27   1 H                                 1.0801470
    16   6 C     28   1 H                                 1.0800942
    17   6 C     29   1 H                                 1.0797079
    18   6 C     30   1 H                                 1.0797682
    19   6 C     31   1 H                                 1.0801513
    20   6 C     32   1 H                                 1.0801870
    21   6 C     33   1 H                                 1.0799663

 * 4 distinct bonds (by element types)

   Z      Z             #   av. dist./Å        max./Å        min./Å
   1 H    6 C          12     1.0787005     1.0801870     1.0723304
   6 C    6 C          15     1.3868053     1.4298826     1.3625168
   6 C    8 O           2     1.2119415     1.2120485     1.2118346
   6 C   16 S           2     1.7176164     1.7178139     1.7174189


optimized geometry written to: xtbopt.xyz


           -------------------------------------------------
          | TOTAL ENERGY              -55.979544455762 Eh   |
          | GRADIENT NORM               0.000637388940 Eh/α |
          | HOMO-LUMO GAP               2.834418927033 eV   |
           -------------------------------------------------

------------------------------------------------------------------------
 * finished run on 2021/05/19 at 11:00:44.819     
------------------------------------------------------------------------
 total:
 * wall-time:     0 d,  0 h,  0 min,  1.511 sec
 *  cpu-time:     0 d,  0 h,  0 min,  1.421 sec
 * ratio c/w:     0.940 speedup
 SCF:
 * wall-time:     0 d,  0 h,  0 min,  0.124 sec
 *  cpu-time:     0 d,  0 h,  0 min,  0.072 sec
 * ratio c/w:     0.581 speedup
 ANC optimizer:
 * wall-time:     0 d,  0 h,  0 min,  1.318 sec
 *  cpu-time:     0 d,  0 h,  0 min,  1.318 sec
 * ratio c/w:     1.000 speedup

