      -----------------------------------------------------------      
     |                   =====================                   |     
     |                           x T B                           |     
     |                   =====================                   |     
     |                         S. Grimme                         |     
     |          Mulliken Center for Theoretical Chemistry        |     
     |                    University of Bonn                     |     
     |                Version 6.2 RC2 (SAW190805)                |     
      -----------------------------------------------------------      

   This program is distributed in the hope that it will be useful,
   but WITHOUT ANY WARRANTY; without even the implied warranty of
   MERCHANTABILITY or FITNESS FOR A PARTICULAR PURPOSE.
   
   FOR NON-COMMERCIAL, ACADEMIA USE ONLY.
   
   Cite this work as:
   * S. Grimme, C. Bannwarth, P. Shushkov, J. Chem. Theory Comput., 2017,
     13, 1989-2009. DOI: 10.1021/acs.jctc.7b00118
   * C. Bannwarth, S. Ehlert and S. Grimme., J. Chem. Theory Comput., 2019,
     15, 1652-1671. DOI: 10.1021/acs.jctc.8b01176
   * P. Pracht, E. Caldeweyher, S. Ehlert, S. Grimme, ChemRxiv, 2019, preprint.
     DOI: 10.26434/chemrxiv.8326202.v1
   
   for DFT-D4:
   * E. Caldeweyher, C. Bannwarth and S. Grimme, J. Chem. Phys., 2017,
     147, 034112. DOI: 10.1063/1.4993215
   * E. Caldeweyher, S. Ehlert, A. Hansen, H. Neugebauer, S. Spicher,
     C. Bannwarth and S. Grimme, J. Chem. Phys., 2019, 150, 154122.
     DOI: 10.1063/1.5090222
   
   for sTDA-xTB:
   * S. Grimme and C. Bannwarth, J. Chem. Phys., 2016, 145, 054103.
     DOI: 10.1063/1.4959605
   
   in the mass-spec context:
   * V. Asgeirsson, C. Bauer and S. Grimme, Chem. Sci., 2017, 8, 4879.
     DOI: 10.1039/c7sc00601b
   
   for metadynamics refer to:
   * S. Grimme, J. Chem. Theory Comput., 2019, 155, 2847-2862
     DOI: 10.1021/acs.jctc.9b00143
   
   with help from (in alphabetical order)
   C. Bannwarth, F. Bohle, G. Brandenburg, E. Caldeweyher, M. Checinski,
   S. Dohm, S. Ehlert, S. Ehrlich, F. März, H. Neugebauer, J. Pisarek,
   P. Pracht, P. Shushkov, and S. Spicher.
   
 * started run on 2021/05/19 at 10:59:02.991     

           -------------------------------------------------
          |                Calculation Setup                |
           -------------------------------------------------

          program call               : /ihome/ghutchison/geoffh/xtb/xtb 94.xyz -opt
          hostname                   : smp-n58
          coordinate file            : 94.xyz
          omp threads                :                     1
          number of atoms            :                    15
          number of electrons        :                    38
          charge                     :                     0
          spin                       :                   0.0
          first test random number   :      0.23831664782805


########################################################################
# WARNING! Please study the warnings concerning your input carefully
#  - the use of '-opt' is discouraged, please use '--opt' next time
########################################################################

           ------------------------------------------------- 
          |                 G F N 2 - x T B                 |
          | Geometry, Frequencies, Noncovalent interactions |
          |            JCTC 2019 parametrisation            |
           ------------------------------------------------- 
             KAB for C  - Si     :                1.0500
             KAB for H  - Pd     :                0.9500
             k(s)              :                1.8500
             k(p)              :                2.2300
             k(d)              :                2.2300
             k(f)              :                2.0000
             kEN (H0ij)        :               -2.0000
             D4 a1             :                0.5200
             D4 a2             :                5.0000
             D4 s6             :                1.0000
             D4 s8             :                2.7000
             D4 s9             :                5.0000
             alphaj            :                2.0000

  Z AO/shell   Hii/eV     exponent
  1     Wed Apr 25 08:07:45 CEST 2018   EN: 2.200 GM2: 0.406  GM3: 0.0800  RAES: 1.40
     1s    -10.707211    1.230000
  6     Wed Apr 25 08:07:45 CEST 2018   EN: 2.550 GM2: 0.538  GM3: 0.1500  RAES: 3.00
     2s    -13.970922    2.096432
     2p    -10.063292    1.800000
 16     Tue Apr 24 11:44:34 CEST 2018   EN: 2.580 GM2: 0.340  GM3:-0.0502  RAES: 3.10
     3s    -20.029654    1.981333
     3p    -11.377694    2.025643
     3d     -0.420282    1.702555

           ------------------------------------------------- 
          |        Self-Consistent Charge Iterations        |
           ------------------------------------------------- 

          ...................................................
          :                      SETUP                      :
          :.................................................:
          :  # basis functions                  42          :
          :  # atomic orbitals                  41          :
          :  # shells                           23          :
          :  # electrons                        38          :
          :  max. iterations                   250          :
          :  Hamiltonian                  GFN2-xTB          :
          :  restarted?                      false          :
          :  GBSA solvation                  false          :
          :  PC potential                    false          :
          :  electronic temp.          300.0000000     K    :
          :  accuracy                    1.0000000          :
          :  -> integral cutoff          0.2500000E+02      :
          :  -> integral neglect         0.1000000E-07      :
          :  -> SCF convergence          0.1000000E-05 Eh   :
          :  -> wf. convergence          0.1000000E-03 e    :
          :  Broyden damping             0.4000000          :
          ...................................................

 iter      E             dE          RMSdq      gap      omega  full diag
   1    -20.4192682 -0.204193E+02  0.378E+00    3.80       0.0  T
   2    -20.4414914 -0.222232E-01  0.221E+00    3.87       1.0  T
   3    -20.4363825  0.510889E-02  0.106E+00    3.86       1.0  T
   4    -20.4439413 -0.755883E-02  0.497E-01    3.82       1.0  T
   5    -20.4454475 -0.150622E-02  0.148E-01    3.82       1.0  T
   6    -20.4454973 -0.497976E-04  0.901E-02    3.82       1.0  T
   7    -20.4455797 -0.823833E-04  0.206E-02    3.82       1.3  T
   8    -20.4455808 -0.103177E-05  0.869E-03    3.82       3.0  T
   9    -20.4455809 -0.107146E-06  0.290E-03    3.82       8.9  T
  10    -20.4455809 -0.210099E-07  0.118E-03    3.82      21.9  T
  11    -20.4455809 -0.464557E-08  0.410E-04    3.82      63.0  T
  12    -20.4455809 -0.636113E-10  0.130E-04    3.82     198.3  T

   *** convergence criteria satisfied after 12 iterations ***

         #    Occupation            Energy/Eh            Energy/eV
      -------------------------------------------------------------
         1        2.0000           -0.7245438             -19.7158
       ...           ...                  ...                  ...
        13        2.0000           -0.4614334             -12.5562
        14        2.0000           -0.4591839             -12.4950
        15        2.0000           -0.4493840             -12.2284
        16        2.0000           -0.4403353             -11.9821
        17        2.0000           -0.4337676             -11.8034
        18        2.0000           -0.3902586             -10.6195
        19        2.0000           -0.3780487             -10.2872 (HOMO)
        20                         -0.2375177              -6.4632 (LUMO)
        21                         -0.1927489              -5.2450
        22                         -0.1676126              -4.5610
        23                         -0.1090081              -2.9663
        24                         -0.0002672              -0.0073
       ...                                ...                  ...
        41                          0.6848512              18.6357
      -------------------------------------------------------------
                  HL-Gap            0.1405310 Eh            3.8240 eV
             Fermi-level           -0.3077832 Eh           -8.3752 eV

 SCC (total)                   0 d,  0 h,  0 min,  0.016 sec
 SCC setup                      ...        0 min,  0.000 sec (  1.235%)
 Dispersion                     ...        0 min,  0.000 sec (  0.986%)
 integral evaluation            ...        0 min,  0.003 sec ( 20.498%)
 zeroth order Hamiltonian       ...        0 min,  0.000 sec (  0.522%)
 iterations                     ...        0 min,  0.007 sec ( 43.125%)
 molecular gradient             ...        0 min,  0.005 sec ( 31.818%)
 printout                       ...        0 min,  0.000 sec (  1.464%)

         :::::::::::::::::::::::::::::::::::::::::::::::::::::
         ::                     SUMMARY                     ::
         :::::::::::::::::::::::::::::::::::::::::::::::::::::
         :: total energy             -20.151268510535 Eh    ::
         :: gradient norm              0.038881286442 Eh/a0 ::
         :: HOMO-LUMO gap              3.824043268334 eV    ::
         ::.................................................::
         :: SCC energy               -20.445580887533 Eh    ::
         :: -> isotropic ES            0.002229963056 Eh    ::
         :: -> anisotropic ES          0.002946843377 Eh    ::
         :: -> anisotropic XC          0.011738560028 Eh    ::
         :: -> dispersion             -0.011519634296 Eh    ::
         :: repulsion energy           0.294293194580 Eh    ::
         :: add. restraining           0.000000000000 Eh    ::
         :::::::::::::::::::::::::::::::::::::::::::::::::::::

      ----------------------------------------------------------- 
     |                   =====================                   |
     |                        A N C O P T                        |
     |                   =====================                   |
     |               Approximate Normal Coordinate               |
     |                Rational Function Optimizer                |
      ----------------------------------------------------------- 

          ...................................................
          :                      SETUP                      :
          :.................................................:
          :   optimization level            normal          :
          :   max. optcycles                   200          :
          :   ANC micro-cycles                  20          :
          :   degrees of freedom                39          :
          :.................................................:
          :   RF solver                   davidson          :
          :   input Hessian                  false          :
          :   write xtbopt.log                true          :
          :   linear?                        false          :
          :   energy convergence         0.5000000E-05 Eh   :
          :   grad. convergence          0.1000000E-02 Eh/α :
          :   maximium RF displ.         2.0000000          :
          :   Hlow (freq-cutoff)         0.5000000E-02      :
          :   Hmax (freq-cutoff)         5.0000000          :
          :   S6 in model hess.         20.0000000          :
          ...................................................

generating ANC from model Hessian ...
Using Lindh-Hessian (1995)
 Shifting diagonal of input Hessian by   1.829378475457086E-003
 Lowest  eigenvalues of input Hessian
   -0.000000   -0.000000   -0.000000   -0.000000    0.000000    0.000000
    0.005000    0.005856    0.009456    0.016331    0.020677    0.025079
    0.042722    0.046291    0.047971    0.053536    0.067135    0.067896
 Highest eigenvalues
    1.217482    1.360093    1.526428    1.614335    1.793971    1.807655
 

........................................................................
.............................. CYCLE    1 ..............................
........................................................................
   1    -20.4455809 -0.204456E+02  0.348E-05    3.82       0.0  T
   2    -20.4455809 -0.203926E-11  0.193E-05    3.82    1336.1  T
   3    -20.4455809 -0.817124E-12  0.148E-05    3.82    1748.0  T
     SCC iter.                  ...        0 min,  0.002 sec
     gradient                   ...        0 min,  0.005 sec
 * total energy  :   -20.1512685 Eh     change        0.9243308E-09 Eh
   gradient norm :     0.0388820 Eh/α   predicted     0.0000000E+00 (-100.00%)
   displ. norm   :     0.1377483 α      lambda       -0.2402744E-02
   maximum displ.:     0.0690003 α      in ANC's #1, #16, #6, ...

........................................................................
.............................. CYCLE    2 ..............................
........................................................................
   1    -20.4614414 -0.204614E+02  0.189E-01    3.90       0.0  T
   2    -20.4614693 -0.278113E-04  0.869E-02    3.91       1.0  T
   3    -20.4614635  0.574875E-05  0.362E-02    3.90       1.0  T
   4    -20.4614722 -0.874104E-05  0.197E-02    3.91       1.3  T
   5    -20.4614750 -0.273599E-05  0.719E-03    3.91       3.6  T
   6    -20.4614750  0.810964E-09  0.322E-03    3.91       8.0  T
   7    -20.4614751 -0.115453E-06  0.775E-04    3.91      33.3  T
     SCC iter.                  ...        0 min,  0.003 sec
     gradient                   ...        0 min,  0.005 sec
 * total energy  :   -20.1527570 Eh     change       -0.1488478E-02 Eh
   gradient norm :     0.0152891 Eh/α   predicted    -0.1224166E-02 ( -17.76%)
   displ. norm   :     0.0630846 α      lambda       -0.3008792E-03
   maximum displ.:     0.0479052 α      in ANC's #1, #6, #4, ...

........................................................................
.............................. CYCLE    3 ..............................
........................................................................
   1    -20.4655691 -0.204656E+02  0.992E-02    3.92       0.0  T
   2    -20.4655789 -0.986184E-05  0.437E-02    3.93       1.0  T
   3    -20.4655777  0.120771E-05  0.193E-02    3.93       1.3  T
   4    -20.4655803 -0.254036E-05  0.100E-02    3.93       2.6  T
   5    -20.4655810 -0.680506E-06  0.361E-03    3.93       7.2  T
   6    -20.4655810  0.774809E-08  0.177E-03    3.93      14.5  T
   7    -20.4655810 -0.367543E-07  0.263E-04    3.93      98.3  T
     SCC iter.                  ...        0 min,  0.003 sec
     gradient                   ...        0 min,  0.005 sec
 * total energy  :   -20.1529408 Eh     change       -0.1838527E-03 Eh
   gradient norm :     0.0056841 Eh/α   predicted    -0.1510386E-03 ( -17.85%)
   displ. norm   :     0.0554230 α      lambda       -0.7228898E-04
   maximum displ.:     0.0518695 α      in ANC's #1, #2, #14, ...

........................................................................
.............................. CYCLE    4 ..............................
........................................................................
   1    -20.4654152 -0.204654E+02  0.643E-02    3.93       0.0  T
   2    -20.4654181 -0.289322E-05  0.306E-02    3.93       1.0  T
   3    -20.4654175  0.648971E-06  0.124E-02    3.93       2.1  T
   4    -20.4654185 -0.992927E-06  0.615E-03    3.93       4.2  T
   5    -20.4654187 -0.257021E-06  0.218E-03    3.93      11.9  T
   6    -20.4654187  0.849877E-09  0.106E-03    3.93      24.4  T
     SCC iter.                  ...        0 min,  0.003 sec
     gradient                   ...        0 min,  0.005 sec
 * total energy  :   -20.1529888 Eh     change       -0.4795969E-04 Eh
   gradient norm :     0.0021049 Eh/α   predicted    -0.3625704E-04 ( -24.40%)
   displ. norm   :     0.0454955 α      lambda       -0.2546473E-04
   maximum displ.:     0.0431934 α      in ANC's #1, #4, #3, ...

........................................................................
.............................. CYCLE    5 ..............................
........................................................................
   1    -20.4644711 -0.204645E+02  0.432E-02    3.92       0.0  T
   2    -20.4644718 -0.755514E-06  0.217E-02    3.93       1.2  T
   3    -20.4644717  0.832257E-07  0.596E-03    3.93       4.3  T
   4    -20.4644719 -0.146955E-06  0.321E-03    3.93       8.0  T
   5    -20.4644719 -0.622948E-07  0.111E-03    3.93      23.2  T
   6    -20.4644720 -0.281370E-08  0.250E-04    3.93     103.4  T
   7    -20.4644720 -0.371237E-09  0.125E-04    3.93     207.2  T
     SCC iter.                  ...        0 min,  0.003 sec
     gradient                   ...        0 min,  0.005 sec
 * total energy  :   -20.1530046 Eh     change       -0.1583800E-04 Eh
   gradient norm :     0.0011605 Eh/α   predicted    -0.1275884E-04 ( -19.44%)
   displ. norm   :     0.0423319 α      lambda       -0.7322155E-05
   maximum displ.:     0.0369723 α      in ANC's #1, #2, #5, ...

........................................................................
.............................. CYCLE    6 ..............................
........................................................................
   1    -20.4639018 -0.204639E+02  0.409E-02    3.92       0.0  T
   2    -20.4639021 -0.318820E-06  0.210E-02    3.92       1.2  T
   3    -20.4639022 -0.441568E-07  0.386E-03    3.92       6.7  T
   4    -20.4639022  0.200371E-07  0.235E-03    3.92      11.0  T
   5    -20.4639022 -0.405339E-07  0.772E-04    3.92      33.4  T
   6    -20.4639022 -0.500113E-08  0.188E-04    3.92     137.5  T
     SCC iter.                  ...        0 min,  0.003 sec
     gradient                   ...        0 min,  0.005 sec
 * total energy  :   -20.1530122 Eh     change       -0.7533586E-05 Eh
   gradient norm :     0.0012112 Eh/α   predicted    -0.3664310E-05 ( -51.36%)
   displ. norm   :     0.0456745 α      lambda       -0.6698538E-05
   maximum displ.:     0.0324127 α      in ANC's #1, #2, #3, ...

........................................................................
.............................. CYCLE    7 ..............................
........................................................................
   1    -20.4639134 -0.204639E+02  0.431E-02    3.93       0.0  T
   2    -20.4639137 -0.277004E-06  0.228E-02    3.93       1.1  T
   3    -20.4639136  0.542219E-07  0.487E-03    3.93       5.3  T
   4    -20.4639137 -0.804726E-07  0.289E-03    3.93       8.9  T
   5    -20.4639137 -0.506897E-07  0.643E-04    3.93      40.2  T
   6    -20.4639137 -0.358004E-08  0.244E-04    3.93     105.9  T
     SCC iter.                  ...        0 min,  0.003 sec
     gradient                   ...        0 min,  0.005 sec
 * total energy  :   -20.1530210 Eh     change       -0.8794470E-05 Eh
   gradient norm :     0.0011030 Eh/α   predicted    -0.3352525E-05 ( -61.88%)
   displ. norm   :     0.0799599 α      lambda       -0.1098068E-04
   maximum displ.:     0.0553493 α      in ANC's #1, #2, #5, ...

........................................................................
.............................. CYCLE    8 ..............................
........................................................................
   1    -20.4642963 -0.204643E+02  0.806E-02    3.93       0.0  T
   2    -20.4642974 -0.102474E-05  0.420E-02    3.93       1.0  T
   3    -20.4642975 -0.976825E-07  0.772E-03    3.93       3.3  T
   4    -20.4642974  0.464241E-07  0.485E-03    3.93       5.3  T
   5    -20.4642976 -0.203509E-06  0.812E-04    3.93      31.8  T
   6    -20.4642976 -0.463418E-08  0.377E-04    3.93      68.5  T
     SCC iter.                  ...        0 min,  0.003 sec
     gradient                   ...        0 min,  0.005 sec
 * total energy  :   -20.1530356 Eh     change       -0.1461851E-04 Eh
   gradient norm :     0.0010427 Eh/α   predicted    -0.5507281E-05 ( -62.33%)
   displ. norm   :     0.1473377 α      lambda       -0.1746441E-04
   maximum displ.:     0.1032898 α      in ANC's #2, #1, #6, ...

........................................................................
.............................. CYCLE    9 ..............................
........................................................................
   1    -20.4643515 -0.204644E+02  0.145E-01    3.93       0.0  T
   2    -20.4643545 -0.300455E-05  0.760E-02    3.93       1.0  T
   3    -20.4643552 -0.660532E-06  0.125E-02    3.93       2.1  T
   4    -20.4643550  0.182452E-06  0.445E-03    3.93       5.8  T
   5    -20.4643553 -0.247782E-06  0.852E-04    3.93      30.3  T
   6    -20.4643553 -0.388634E-08  0.455E-04    3.93      56.8  T
     SCC iter.                  ...        0 min,  0.003 sec
     gradient                   ...        0 min,  0.005 sec
 * total energy  :   -20.1530590 Eh     change       -0.2341502E-04 Eh
   gradient norm :     0.0011047 Eh/α   predicted    -0.8816563E-05 ( -62.35%)
   displ. norm   :     0.2619735 α      lambda       -0.2647062E-04
   maximum displ.:     0.1841494 α      in ANC's #2, #1, #6, ...

........................................................................
.............................. CYCLE   10 ..............................
........................................................................
   1    -20.4637307 -0.204637E+02  0.259E-01    3.92       0.0  T
   2    -20.4637403 -0.954964E-05  0.136E-01    3.92       1.0  T
   3    -20.4637425 -0.224899E-05  0.221E-02    3.92       1.2  T
   4    -20.4637425 -0.812625E-08  0.249E-03    3.92      10.4  T
   5    -20.4637426 -0.591663E-07  0.115E-03    3.92      22.5  T
   6    -20.4637426 -0.303451E-08  0.612E-04    3.92      42.2  T
   7    -20.4637426 -0.377046E-09  0.167E-04    3.92     154.4  T
     SCC iter.                  ...        0 min,  0.003 sec
     gradient                   ...        0 min,  0.005 sec
 * total energy  :   -20.1530891 Eh     change       -0.3009566E-04 Eh
   gradient norm :     0.0015147 Eh/α   predicted    -0.1364107E-04 ( -54.67%)
   displ. norm   :     0.1671300 α      lambda       -0.1458526E-04
   maximum displ.:     0.1239903 α      in ANC's #2, #1, #6, ...

........................................................................
.............................. CYCLE   11 ..............................
........................................................................
   1    -20.4637692 -0.204638E+02  0.166E-01    3.92       0.0  T
   2    -20.4637730 -0.380372E-05  0.875E-02    3.92       1.0  T
   3    -20.4637738 -0.804225E-06  0.144E-02    3.92       1.8  T
   4    -20.4637733  0.549599E-06  0.736E-03    3.92       3.5  T
   5    -20.4637740 -0.673158E-06  0.847E-04    3.92      30.5  T
   6    -20.4637740 -0.248532E-08  0.508E-04    3.92      50.8  T
     SCC iter.                  ...        0 min,  0.003 sec
     gradient                   ...        0 min,  0.005 sec
 * total energy  :   -20.1531050 Eh     change       -0.1593996E-04 Eh
   gradient norm :     0.0012979 Eh/α   predicted    -0.7383669E-05 ( -53.68%)
   displ. norm   :     0.0986431 α      lambda       -0.9604295E-05
   maximum displ.:     0.0815493 α      in ANC's #2, #1, #3, ...

........................................................................
.............................. CYCLE   12 ..............................
........................................................................
   1    -20.4643521 -0.204644E+02  0.987E-02    3.92       0.0  T
   2    -20.4643534 -0.131525E-05  0.522E-02    3.92       1.0  T
   3    -20.4643537 -0.257189E-06  0.870E-03    3.92       3.0  T
   4    -20.4643535  0.159640E-06  0.435E-03    3.92       5.9  T
   5    -20.4643537 -0.222681E-06  0.589E-04    3.92      43.8  T
   6    -20.4643537 -0.242072E-08  0.307E-04    3.92      84.0  T
     SCC iter.                  ...        0 min,  0.003 sec
     gradient                   ...        0 min,  0.005 sec
 * total energy  :   -20.1531161 Eh     change       -0.1101994E-04 Eh
   gradient norm :     0.0007939 Eh/α   predicted    -0.4821866E-05 ( -56.24%)
   displ. norm   :     0.0713541 α      lambda       -0.6672366E-05
   maximum displ.:     0.0628815 α      in ANC's #2, #1, #3, ...

........................................................................
.............................. CYCLE   13 ..............................
........................................................................
   1    -20.4646732 -0.204647E+02  0.810E-02    3.93       0.0  T
   2    -20.4646741 -0.993153E-06  0.421E-02    3.93       1.0  T
   3    -20.4646744 -0.217389E-06  0.715E-03    3.93       3.6  T
   4    -20.4646743  0.749223E-07  0.268E-03    3.93       9.6  T
   5    -20.4646744 -0.934704E-07  0.399E-04    3.93      64.7  T
   6    -20.4646744 -0.655280E-09  0.239E-04    3.93     107.8  T
     SCC iter.                  ...        0 min,  0.003 sec
     gradient                   ...        0 min,  0.005 sec
 * total energy  :   -20.1531237 Eh     change       -0.7657427E-05 Eh
   gradient norm :     0.0005599 Eh/α   predicted    -0.3344200E-05 ( -56.33%)
   displ. norm   :     0.0543182 α      lambda       -0.4159969E-05
   maximum displ.:     0.0497303 α      in ANC's #2, #1, #3, ...

........................................................................
.............................. CYCLE   14 ..............................
........................................................................
   1    -20.4645584 -0.204646E+02  0.505E-02    3.93       0.0  T
   2    -20.4645587 -0.297685E-06  0.273E-02    3.93       1.0  T
   3    -20.4645587 -0.759803E-08  0.473E-03    3.93       5.5  T
   4    -20.4645587  0.539969E-08  0.291E-03    3.93       8.9  T
   5    -20.4645588 -0.725201E-07  0.370E-04    3.93      69.9  T
   6    -20.4645588 -0.908642E-09  0.142E-04    3.93     182.3  T
     SCC iter.                  ...        0 min,  0.003 sec
     gradient                   ...        0 min,  0.005 sec
 * total energy  :   -20.1531282 Eh     change       -0.4530547E-05 Eh
   gradient norm :     0.0003036 Eh/α   predicted    -0.2081622E-05 ( -54.05%)
   displ. norm   :     0.0305608 α      lambda       -0.1739839E-05
   maximum displ.:     0.0278245 α      in ANC's #2, #1, #3, ...

   *** GEOMETRY OPTIMIZATION CONVERGED AFTER 14 ITERATIONS ***

------------------------------------------------------------------------
 total energy gain   :        -0.0018597 Eh       -1.1670 kcal/mol
 total RMSD          :         0.2789467 a0        0.1476 Å
 total power (kW/mol):        -0.3487662 (step)  -28.5824 (real)
------------------------------------------------------------------------

 ANCopt (total)                0 d,  0 h,  0 min,  0.171 sec
 optimizer setup                ...        0 min,  0.000 sec (  0.056%)
 model hessian                  ...        0 min,  0.002 sec (  1.018%)
 ANC generation                 ...        0 min,  0.000 sec (  0.213%)
 coordinate transformation      ...        0 min,  0.000 sec (  0.094%)
 single point calculation       ...        0 min,  0.165 sec ( 96.389%)
 optimization log               ...        0 min,  0.001 sec (  0.517%)
 hessian update                 ...        0 min,  0.000 sec (  0.071%)
 rational function              ...        0 min,  0.002 sec (  1.165%)

================
 final structure:
================
$coord
    2.66192322530071    1.19887489227863    0.19470220800908      C 
    0.33823912776663    2.27401426987470   -0.00459399532875      C 
   -0.33395026604552    5.00851481516611   -0.05993649296224      C 
   -0.88441239006716    5.89272035691371   -2.75761672929002      C 
   -1.98337817680476   -0.01803416582543   -0.33592530161662      S 
    0.23290375962009   -2.39236377118522   -0.19317616400382      C 
    2.60484558798341   -1.47169421709990    0.09087220449413      C 
    4.37129628956988    2.27679319561134    0.41795901979898      H 
    1.23739407362130    6.09649107720467    0.71931481989722      H 
   -1.99916334585175    5.34084565345207    1.11463771873338      H 
    0.76112764875265    5.59830140442068   -3.95373916108891      H 
   -1.36095555086041    7.89131943416592   -2.77285453953492      H 
   -2.46051726546064    4.83328822811147   -3.54405192619605      H 
   -0.37136591974500   -4.32071318820228   -0.32762717797346      H 
    4.26139282076274   -2.64175030412560    0.22259022608334      H 
$end
           -------------------------------------------------
          |                Final Singlepoint                |
           -------------------------------------------------

          ...................................................
          :                      SETUP                      :
          :.................................................:
          :  # basis functions                  42          :
          :  # atomic orbitals                  41          :
          :  # shells                           23          :
          :  # electrons                        38          :
          :  max. iterations                   250          :
          :  Hamiltonian                  GFN2-xTB          :
          :  restarted?                      false          :
          :  GBSA solvation                  false          :
          :  PC potential                    false          :
          :  electronic temp.          300.0000000     K    :
          :  accuracy                    1.0000000          :
          :  -> integral cutoff          0.2500000E+02      :
          :  -> integral neglect         0.1000000E-07      :
          :  -> SCF convergence          0.1000000E-05 Eh   :
          :  -> wf. convergence          0.1000000E-03 e    :
          :  Broyden damping             0.4000000          :
          ...................................................

 iter      E             dE          RMSdq      gap      omega  full diag
   1    -20.4645588 -0.204646E+02  0.765E-05    3.93       0.0  T
   2    -20.4645588 -0.201084E-11  0.321E-05    3.93     804.8  T
   3    -20.4645588 -0.129923E-10  0.343E-05    3.93     752.1  T

   *** convergence criteria satisfied after 3 iterations ***

         #    Occupation            Energy/Eh            Energy/eV
      -------------------------------------------------------------
         1        2.0000           -0.7226257             -19.6636
       ...           ...                  ...                  ...
        13        2.0000           -0.4610129             -12.5448
        14        2.0000           -0.4588379             -12.4856
        15        2.0000           -0.4498723             -12.2416
        16        2.0000           -0.4397516             -11.9662
        17        2.0000           -0.4351351             -11.8406
        18        2.0000           -0.3896948             -10.6041
        19        2.0000           -0.3805739             -10.3559 (HOMO)
        20                         -0.2362470              -6.4286 (LUMO)
        21                         -0.1951076              -5.3091
        22                         -0.1609022              -4.3784
        23                         -0.1106709              -3.0115
        24                          0.0016950               0.0461
       ...                                ...                  ...
        41                          0.7060766              19.2133
      -------------------------------------------------------------
                  HL-Gap            0.1443269 Eh            3.9273 eV
             Fermi-level           -0.3084105 Eh           -8.3923 eV

 SCC (total)                   0 d,  0 h,  0 min,  0.010 sec
 SCC setup                      ...        0 min,  0.000 sec (  1.129%)
 Dispersion                     ...        0 min,  0.000 sec (  0.651%)
 integral evaluation            ...        0 min,  0.003 sec ( 30.193%)
 zeroth order Hamiltonian       ...        0 min,  0.000 sec (  0.537%)
 iterations                     ...        0 min,  0.002 sec ( 17.781%)
 molecular gradient             ...        0 min,  0.005 sec ( 47.321%)
 printout                       ...        0 min,  0.000 sec (  2.022%)

         :::::::::::::::::::::::::::::::::::::::::::::::::::::
         ::                     SUMMARY                     ::
         :::::::::::::::::::::::::::::::::::::::::::::::::::::
         :: total energy             -20.153128247083 Eh    ::
         :: gradient norm              0.000303963992 Eh/a0 ::
         :: HOMO-LUMO gap              3.927334400517 eV    ::
         ::.................................................::
         :: SCC energy               -20.464558798936 Eh    ::
         :: -> isotropic ES            0.002329138485 Eh    ::
         :: -> anisotropic ES          0.002601465995 Eh    ::
         :: -> anisotropic XC          0.011474159292 Eh    ::
         :: -> dispersion             -0.011566614874 Eh    ::
         :: repulsion energy           0.311411124921 Eh    ::
         :: add. restraining           0.000000000000 Eh    ::
         :::::::::::::::::::::::::::::::::::::::::::::::::::::

           -------------------------------------------------
          |                Property Printout                |
           -------------------------------------------------

    * Orbital Energies and Occupations

         #    Occupation            Energy/Eh            Energy/eV
      -------------------------------------------------------------
         1        2.0000           -0.7226257             -19.6636
       ...           ...                  ...                  ...
         7        2.0000           -0.5476425             -14.9021
         8        2.0000           -0.5258162             -14.3082
         9        2.0000           -0.5084328             -13.8352
        10        2.0000           -0.4965809             -13.5127
        11        2.0000           -0.4789107             -13.0318
        12        2.0000           -0.4664113             -12.6917
        13        2.0000           -0.4610129             -12.5448
        14        2.0000           -0.4588379             -12.4856
        15        2.0000           -0.4498723             -12.2416
        16        2.0000           -0.4397516             -11.9662
        17        2.0000           -0.4351351             -11.8406
        18        2.0000           -0.3896948             -10.6041
        19        2.0000           -0.3805739             -10.3559 (HOMO)
        20                         -0.2362470              -6.4286 (LUMO)
        21                         -0.1951076              -5.3091
        22                         -0.1609022              -4.3784
        23                         -0.1106709              -3.0115
        24                          0.0016950               0.0461
        25                          0.0304914               0.8297
        26                          0.0395732               1.0768
        27                          0.1092874               2.9739
        28                          0.1311552               3.5689
        29                          0.1448057               3.9404
        30                          0.1610737               4.3830
       ...                                ...                  ...
        41                          0.7060766              19.2133
      -------------------------------------------------------------
                  HL-Gap            0.1443269 Eh            3.9273 eV
             Fermi-level           -0.3084105 Eh           -8.3923 eV

     #   Z        covCN         q      C6AA      α(0)
     1   6 C      3.125    -0.058    29.231     8.853
     2   6 C      2.988     0.022    27.501     8.602
     3   6 C      3.824    -0.054    21.527     6.602
     4   6 C      3.754    -0.100    22.474     6.760
     5  16 S      2.339    -0.049   143.073    20.132
     6   6 C      2.940    -0.023    28.577     8.767
     7   6 C      3.115    -0.046    28.975     8.817
     8   1 H      0.926     0.031     2.571     2.508
     9   1 H      0.924     0.041     2.433     2.439
    10   1 H      0.924     0.044     2.391     2.418
    11   1 H      0.925     0.038     2.470     2.458
    12   1 H      0.925     0.039     2.463     2.454
    13   1 H      0.925     0.043     2.408     2.427
    14   1 H      0.926     0.038     2.472     2.459
    15   1 H      0.926     0.032     2.555     2.500

 Mol. C6AA /au·bohr⁶  :       3048.565437
 Mol. C8AA /au·bohr⁸  :      85498.914847
 Mol. α(0) /au        :         88.196354


Wiberg/Mayer (AO) data.
largest (>0.10) Wiberg bond orders for each atom
          total WBO             WBO to atom ...
     1  C   3.986        C    2 1.609    C    7 1.263    H    8 0.965
     2  C   3.950        C    1 1.609    S    5 1.158    C    3 1.026    C    6 0.115
     3  C   3.998        C    2 1.026    C    4 1.000    H    9 0.971    H   10 0.969
     4  C   3.995        C    3 1.000    H   11 0.989    H   13 0.987    H   12 0.986
     5  S   2.599        C    6 1.183    C    2 1.158
     6  C   3.947        C    7 1.638    S    5 1.183    H   14 0.971    C    2 0.115
     7  C   3.988        C    6 1.638    C    1 1.263    H   15 0.965
     8  H   0.999        C    1 0.965
     9  H   0.998        C    3 0.971
    10  H   0.998        C    3 0.969
    11  H   0.999        C    4 0.989
    12  H   0.998        C    4 0.986
    13  H   0.998        C    4 0.987
    14  H   0.998        C    6 0.971
    15  H   0.999        C    7 0.965

molecular dipole:
                 x           y           z       tot (Debye)
 q only:        0.024       0.282      -0.041
   full:        0.312       0.227      -0.004       0.980
molecular quadrupole (traceless):
                xx          xy          yy          xz          yz          zz
 q only:       -1.341      -0.432       2.723       0.179      -0.455      -1.381
  q+dip:       -0.681       0.007       4.100       0.061       0.099      -3.420
   full:       -1.699      -0.119       3.985      -0.021      -0.106      -2.286

           -------------------------------------------------
          |                Geometry Summary                 |
           -------------------------------------------------

      molecular mass/u    :      112.1892000
   center of mass at/Å    :       -0.0171099       0.7119152      -0.2440710
  moments of inertia/u·Å² :        0.1148361E+03   0.2881895E+03   0.3655095E+03
rotational constants/cm⁻¹ :        0.1467973E+00   0.5849496E-01   0.4612091E-01

 * 14 selected distances

     #   Z        #   Z                                     value/Å
     1   6 C      2   6 C                                 1.3589815
     3   6 C      4   6 C                                 1.5302564
     2   6 C      5  16 S                                 1.7352797 (max)
     5  16 S      6   6 C                                 1.7204141
     1   6 C      7   6 C                                 1.4145946
     6   6 C      7   6 C                                 1.3547789
     1   6 C      8   1 H                                 1.0758979
     3   6 C      9   1 H                                 1.0922157
     3   6 C     10   1 H                                 1.0925945
     4   6 C     11   1 H                                 1.0877384
     4   6 C     12   1 H                                 1.0872917
     4   6 C     13   1 H                                 1.0877114
     6   6 C     14   1 H                                 1.0717310 (min)
     7   6 C     15   1 H                                 1.0754842

 * 3 distinct bonds (by element types)

   Z      Z             #   av. dist./Å        max./Å        min./Å
   1 H    6 C           8     1.0838331     1.0925945     1.0717310
   6 C    6 C           4     1.4146529     1.5302564     1.3547789
   6 C   16 S           2     1.7278469     1.7352797     1.7204141


optimized geometry written to: xtbopt.xyz


           -------------------------------------------------
          | TOTAL ENERGY              -20.153128247083 Eh   |
          | GRADIENT NORM               0.000303963992 Eh/α |
          | HOMO-LUMO GAP               3.927334400517 eV   |
           -------------------------------------------------

------------------------------------------------------------------------
 * finished run on 2021/05/19 at 10:59:03.203     
------------------------------------------------------------------------
 total:
 * wall-time:     0 d,  0 h,  0 min,  0.212 sec
 *  cpu-time:     0 d,  0 h,  0 min,  0.212 sec
 * ratio c/w:     0.999 speedup
 SCF:
 * wall-time:     0 d,  0 h,  0 min,  0.016 sec
 *  cpu-time:     0 d,  0 h,  0 min,  0.016 sec
 * ratio c/w:     1.000 speedup
 ANC optimizer:
 * wall-time:     0 d,  0 h,  0 min,  0.182 sec
 *  cpu-time:     0 d,  0 h,  0 min,  0.182 sec
 * ratio c/w:     1.000 speedup

