      -----------------------------------------------------------      
     |                   =====================                   |     
     |                           x T B                           |     
     |                   =====================                   |     
     |                         S. Grimme                         |     
     |          Mulliken Center for Theoretical Chemistry        |     
     |                    University of Bonn                     |     
     |                Version 6.2 RC2 (SAW190805)                |     
      -----------------------------------------------------------      

   This program is distributed in the hope that it will be useful,
   but WITHOUT ANY WARRANTY; without even the implied warranty of
   MERCHANTABILITY or FITNESS FOR A PARTICULAR PURPOSE.
   
   FOR NON-COMMERCIAL, ACADEMIA USE ONLY.
   
   Cite this work as:
   * S. Grimme, C. Bannwarth, P. Shushkov, J. Chem. Theory Comput., 2017,
     13, 1989-2009. DOI: 10.1021/acs.jctc.7b00118
   * C. Bannwarth, S. Ehlert and S. Grimme., J. Chem. Theory Comput., 2019,
     15, 1652-1671. DOI: 10.1021/acs.jctc.8b01176
   * P. Pracht, E. Caldeweyher, S. Ehlert, S. Grimme, ChemRxiv, 2019, preprint.
     DOI: 10.26434/chemrxiv.8326202.v1
   
   for DFT-D4:
   * E. Caldeweyher, C. Bannwarth and S. Grimme, J. Chem. Phys., 2017,
     147, 034112. DOI: 10.1063/1.4993215
   * E. Caldeweyher, S. Ehlert, A. Hansen, H. Neugebauer, S. Spicher,
     C. Bannwarth and S. Grimme, J. Chem. Phys., 2019, 150, 154122.
     DOI: 10.1063/1.5090222
   
   for sTDA-xTB:
   * S. Grimme and C. Bannwarth, J. Chem. Phys., 2016, 145, 054103.
     DOI: 10.1063/1.4959605
   
   in the mass-spec context:
   * V. Asgeirsson, C. Bauer and S. Grimme, Chem. Sci., 2017, 8, 4879.
     DOI: 10.1039/c7sc00601b
   
   for metadynamics refer to:
   * S. Grimme, J. Chem. Theory Comput., 2019, 155, 2847-2862
     DOI: 10.1021/acs.jctc.9b00143
   
   with help from (in alphabetical order)
   C. Bannwarth, F. Bohle, G. Brandenburg, E. Caldeweyher, M. Checinski,
   S. Dohm, S. Ehlert, S. Ehrlich, F. März, H. Neugebauer, J. Pisarek,
   P. Pracht, P. Shushkov, and S. Spicher.
   
 * started run on 2021/05/19 at 11:00:46.389     

           -------------------------------------------------
          |                Calculation Setup                |
           -------------------------------------------------

          program call               : /ihome/ghutchison/geoffh/xtb/xtb 943.xyz -opt
          hostname                   : smp-n122
          coordinate file            : 943.xyz
          omp threads                :                     1
          number of atoms            :                    26
          number of electrons        :                    64
          charge                     :                     0
          spin                       :                   0.0
          first test random number   :      0.71531436257144


########################################################################
# WARNING! Please study the warnings concerning your input carefully
#  - the use of '-opt' is discouraged, please use '--opt' next time
########################################################################

           ------------------------------------------------- 
          |                 G F N 2 - x T B                 |
          | Geometry, Frequencies, Noncovalent interactions |
          |            JCTC 2019 parametrisation            |
           ------------------------------------------------- 
             KAB for C  - Si     :                1.0500
             KAB for H  - Pd     :                0.9500
             k(s)              :                1.8500
             k(p)              :                2.2300
             k(d)              :                2.2300
             k(f)              :                2.0000
             kEN (H0ij)        :               -2.0000
             D4 a1             :                0.5200
             D4 a2             :                5.0000
             D4 s6             :                1.0000
             D4 s8             :                2.7000
             D4 s9             :                5.0000
             alphaj            :                2.0000

  Z AO/shell   Hii/eV     exponent
  1     Wed Apr 25 08:07:45 CEST 2018   EN: 2.200 GM2: 0.406  GM3: 0.0800  RAES: 1.40
     1s    -10.707211    1.230000
  6     Wed Apr 25 08:07:45 CEST 2018   EN: 2.550 GM2: 0.538  GM3: 0.1500  RAES: 3.00
     2s    -13.970922    2.096432
     2p    -10.063292    1.800000
  7     Wed Apr 25 08:07:45 CEST 2018   EN: 3.040 GM2: 0.461  GM3:-0.0640  RAES: 1.90
     2s    -16.686243    2.339881
     2p    -12.523956    2.014332

           ------------------------------------------------- 
          |        Self-Consistent Charge Iterations        |
           ------------------------------------------------- 

          ...................................................
          :                      SETUP                      :
          :.................................................:
          :  # basis functions                  62          :
          :  # atomic orbitals                  62          :
          :  # shells                           38          :
          :  # electrons                        64          :
          :  max. iterations                   250          :
          :  Hamiltonian                  GFN2-xTB          :
          :  restarted?                      false          :
          :  GBSA solvation                  false          :
          :  PC potential                    false          :
          :  electronic temp.          300.0000000     K    :
          :  accuracy                    1.0000000          :
          :  -> integral cutoff          0.2500000E+02      :
          :  -> integral neglect         0.1000000E-07      :
          :  -> SCF convergence          0.1000000E-05 Eh   :
          :  -> wf. convergence          0.1000000E-03 e    :
          :  Broyden damping             0.4000000          :
          ...................................................

 iter      E             dE          RMSdq      gap      omega  full diag
   1    -34.8252786 -0.348253E+02  0.410E+00    3.01       0.0  T
   2    -34.8658854 -0.406068E-01  0.272E+00    2.83       1.0  T
   3    -34.8595810  0.630441E-02  0.153E+00    2.99       1.0  T
   4    -34.8814394 -0.218584E-01  0.382E-01    2.78       1.0  T
   5    -34.8829248 -0.148538E-02  0.821E-02    2.77       1.0  T
   6    -34.8829629 -0.381260E-04  0.384E-02    2.78       1.0  T
   7    -34.8829631 -0.223030E-06  0.219E-02    2.77       1.0  T
   8    -34.8829704 -0.732722E-05  0.321E-03    2.78       6.1  T
   9    -34.8829705 -0.983061E-07  0.148E-03    2.78      13.3  T
  10    -34.8829705 -0.944964E-08  0.696E-04    2.78      28.2  T
  11    -34.8829706 -0.393842E-08  0.227E-04    2.78      86.4  T

   *** convergence criteria satisfied after 11 iterations ***

         #    Occupation            Energy/Eh            Energy/eV
      -------------------------------------------------------------
         1        2.0000           -0.6478511             -17.6289
       ...           ...                  ...                  ...
        26        2.0000           -0.4263666             -11.6020
        27        2.0000           -0.4238207             -11.5327
        28        2.0000           -0.4205918             -11.4449
        29        2.0000           -0.4039207             -10.9912
        30        2.0000           -0.3967040             -10.7949
        31        2.0000           -0.3696422             -10.0585
        32        2.0000           -0.3325150              -9.0482 (HOMO)
        33                         -0.2304329              -6.2704 (LUMO)
        34                         -0.2279790              -6.2036
        35                         -0.1606948              -4.3727
        36                         -0.1092253              -2.9722
        37                          0.0268466               0.7305
       ...                                ...                  ...
        62                          0.6234685              16.9654
      -------------------------------------------------------------
                  HL-Gap            0.1020821 Eh            2.7778 eV
             Fermi-level           -0.2814739 Eh           -7.6593 eV

 SCC (total)                   0 d,  0 h,  0 min,  0.031 sec
 SCC setup                      ...        0 min,  0.000 sec (  0.925%)
 Dispersion                     ...        0 min,  0.000 sec (  1.167%)
 integral evaluation            ...        0 min,  0.007 sec ( 22.503%)
 zeroth order Hamiltonian       ...        0 min,  0.000 sec (  0.448%)
 iterations                     ...        0 min,  0.012 sec ( 37.862%)
 molecular gradient             ...        0 min,  0.011 sec ( 35.811%)
 printout                       ...        0 min,  0.000 sec (  1.121%)

         :::::::::::::::::::::::::::::::::::::::::::::::::::::
         ::                     SUMMARY                     ::
         :::::::::::::::::::::::::::::::::::::::::::::::::::::
         :: total energy             -34.334910156597 Eh    ::
         :: gradient norm              0.034743940986 Eh/a0 ::
         :: HOMO-LUMO gap              2.777795727157 eV    ::
         ::.................................................::
         :: SCC energy               -34.882970553075 Eh    ::
         :: -> isotropic ES            0.019143602552 Eh    ::
         :: -> anisotropic ES          0.009095759934 Eh    ::
         :: -> anisotropic XC          0.026152772394 Eh    ::
         :: -> dispersion             -0.020789263943 Eh    ::
         :: repulsion energy           0.548092007191 Eh    ::
         :: add. restraining           0.000000000000 Eh    ::
         :::::::::::::::::::::::::::::::::::::::::::::::::::::

      ----------------------------------------------------------- 
     |                   =====================                   |
     |                        A N C O P T                        |
     |                   =====================                   |
     |               Approximate Normal Coordinate               |
     |                Rational Function Optimizer                |
      ----------------------------------------------------------- 

          ...................................................
          :                      SETUP                      :
          :.................................................:
          :   optimization level            normal          :
          :   max. optcycles                   200          :
          :   ANC micro-cycles                  20          :
          :   degrees of freedom                72          :
          :.................................................:
          :   RF solver                   davidson          :
          :   input Hessian                  false          :
          :   write xtbopt.log                true          :
          :   linear?                        false          :
          :   energy convergence         0.5000000E-05 Eh   :
          :   grad. convergence          0.1000000E-02 Eh/α :
          :   maximium RF displ.         2.0000000          :
          :   Hlow (freq-cutoff)         0.5000000E-02      :
          :   Hmax (freq-cutoff)         5.0000000          :
          :   S6 in model hess.         20.0000000          :
          ...................................................

generating ANC from model Hessian ...
Using Lindh-Hessian (1995)
 Shifting diagonal of input Hessian by   4.447273826293063E-003
 Lowest  eigenvalues of input Hessian
   -0.000000    0.000000    0.000000    0.000000    0.000000    0.000000
    0.005000    0.005774    0.006951    0.007925    0.008415    0.012640
    0.013868    0.014474    0.018525    0.020186    0.020984    0.023865
 Highest eigenvalues
    1.577847    1.760757    1.814066    1.886384    1.931276    2.123124
 

........................................................................
.............................. CYCLE    1 ..............................
........................................................................
   1    -34.8829706 -0.348830E+02  0.101E-04    2.78       0.0  T
   2    -34.8829706 -0.356550E-10  0.634E-05    2.78     309.2  T
   3    -34.8829706 -0.179696E-10  0.417E-05    2.78     470.9  T
     SCC iter.                  ...        0 min,  0.004 sec
     gradient                   ...        0 min,  0.011 sec
 * total energy  :   -34.3349102 Eh     change        0.4353154E-08 Eh
   gradient norm :     0.0347437 Eh/α   predicted     0.0000000E+00 (-100.00%)
   displ. norm   :     0.2602893 α      lambda       -0.5102011E-02
   maximum displ.:     0.1007011 α      in ANC's #21, #7, #11, ...

........................................................................
.............................. CYCLE    2 ..............................
........................................................................
   1    -34.9077662 -0.349078E+02  0.173E-01    2.87       0.0  T
   2    -34.9077749 -0.868675E-05  0.985E-02    2.86       1.0  T
   3    -34.9077747  0.191187E-06  0.133E-02    2.86       1.5  T
   4    -34.9077781 -0.343867E-05  0.496E-03    2.86       4.0  T
   5    -34.9077782 -0.918034E-07  0.252E-03    2.87       7.8  T
     SCC iter.                  ...        0 min,  0.005 sec
     gradient                   ...        0 min,  0.010 sec
 * total energy  :   -34.3380681 Eh     change       -0.3157958E-02 Eh
   gradient norm :     0.0094914 Eh/α   predicted    -0.2723837E-02 ( -13.75%)
   displ. norm   :     0.1779008 α      lambda       -0.7471867E-03
   maximum displ.:     0.0801051 α      in ANC's #7, #4, #12, ...

........................................................................
.............................. CYCLE    3 ..............................
........................................................................
   1    -34.9155482 -0.349155E+02  0.131E-01    2.90       0.0  T
   2    -34.9155536 -0.536563E-05  0.737E-02    2.90       1.0  T
   3    -34.9155524  0.120592E-05  0.134E-02    2.90       1.5  T
   4    -34.9155557 -0.332193E-05  0.385E-03    2.90       5.1  T
   5    -34.9155558 -0.745690E-07  0.186E-03    2.90      10.5  T
   6    -34.9155558 -0.135878E-07  0.588E-04    2.90      33.4  T
     SCC iter.                  ...        0 min,  0.006 sec
     gradient                   ...        0 min,  0.011 sec
 * total energy  :   -34.3385579 Eh     change       -0.4897393E-03 Eh
   gradient norm :     0.0053120 Eh/α   predicted    -0.3854277E-03 ( -21.30%)
   displ. norm   :     0.2059403 α      lambda       -0.3765328E-03
   maximum displ.:     0.1101078 α      in ANC's #4, #7, #6, ...

........................................................................
.............................. CYCLE    4 ..............................
........................................................................
   1    -34.9172937 -0.349173E+02  0.161E-01    2.93       0.0  T
   2    -34.9173023 -0.863734E-05  0.905E-02    2.94       1.0  T
   3    -34.9172834  0.189259E-04  0.366E-02    2.93       1.0  T
   4    -34.9173081 -0.246893E-04  0.415E-03    2.94       4.7  T
   5    -34.9173081 -0.370822E-07  0.214E-03    2.94       9.2  T
   6    -34.9173081 -0.122947E-07  0.543E-04    2.94      36.1  T
     SCC iter.                  ...        0 min,  0.006 sec
     gradient                   ...        0 min,  0.011 sec
 * total energy  :   -34.3388392 Eh     change       -0.2813839E-03 Eh
   gradient norm :     0.0059928 Eh/α   predicted    -0.1962585E-03 ( -30.25%)
   displ. norm   :     0.2974107 α      lambda       -0.4303826E-03
   maximum displ.:     0.1670391 α      in ANC's #4, #6, #7, ...

........................................................................
.............................. CYCLE    5 ..............................
........................................................................
   1    -34.9161791 -0.349162E+02  0.252E-01    2.98       0.0  T
   2    -34.9162028 -0.236540E-04  0.142E-01    3.00       1.0  T
   3    -34.9161216  0.811843E-04  0.766E-02    2.99       1.0  T
   4    -34.9162263 -0.104684E-03  0.668E-03    3.00       2.9  T
   5    -34.9162263 -0.967451E-07  0.339E-03    3.00       5.8  T
   6    -34.9162264 -0.219674E-07  0.908E-04    3.00      21.6  T
   7    -34.9162264 -0.147196E-07  0.290E-04    3.00      67.6  T
     SCC iter.                  ...        0 min,  0.007 sec
     gradient                   ...        0 min,  0.011 sec
 * total energy  :   -34.3391528 Eh     change       -0.3135684E-03 Eh
   gradient norm :     0.0072287 Eh/α   predicted    -0.2342276E-03 ( -25.30%)
   displ. norm   :     0.2988757 α      lambda       -0.3593883E-03
   maximum displ.:     0.1702573 α      in ANC's #4, #6, #5, ...

........................................................................
.............................. CYCLE    6 ..............................
........................................................................
   1    -34.9136086 -0.349136E+02  0.257E-01    3.05       0.0  T
   2    -34.9136379 -0.293448E-04  0.144E-01    3.08       1.0  T
   3    -34.9135389  0.990076E-04  0.898E-02    3.07       1.0  T
   4    -34.9136732 -0.134298E-03  0.706E-03    3.08       2.8  T
   5    -34.9136733 -0.119524E-06  0.362E-03    3.08       5.4  T
   6    -34.9136734 -0.171311E-07  0.114E-03    3.08      17.2  T
   7    -34.9136734 -0.238821E-07  0.364E-04    3.08      53.9  T
     SCC iter.                  ...        0 min,  0.007 sec
     gradient                   ...        0 min,  0.011 sec
 * total energy  :   -34.3393839 Eh     change       -0.2310498E-03 Eh
   gradient norm :     0.0070675 Eh/α   predicted    -0.1957475E-03 ( -15.28%)
   displ. norm   :     0.1287923 α      lambda       -0.1838564E-03
   maximum displ.:     0.0646351 α      in ANC's #4, #5, #6, ...

........................................................................
.............................. CYCLE    7 ..............................
........................................................................
   1    -34.9140808 -0.349141E+02  0.983E-02    3.11       0.0  T
   2    -34.9140861 -0.522669E-05  0.559E-02    3.12       1.0  T
   3    -34.9140719  0.142128E-04  0.360E-02    3.11       1.0  T
   4    -34.9140926 -0.207436E-04  0.315E-03    3.12       6.2  T
   5    -34.9140926 -0.308928E-07  0.152E-03    3.12      12.9  T
   6    -34.9140926 -0.193054E-08  0.511E-04    3.12      38.4  T
     SCC iter.                  ...        0 min,  0.006 sec
     gradient                   ...        0 min,  0.011 sec
 * total energy  :   -34.3395009 Eh     change       -0.1169983E-03 Eh
   gradient norm :     0.0038867 Eh/α   predicted    -0.9345361E-04 ( -20.12%)
   displ. norm   :     0.0822792 α      lambda       -0.7572644E-04
   maximum displ.:     0.0413804 α      in ANC's #5, #6, #4, ...

........................................................................
.............................. CYCLE    8 ..............................
........................................................................
   1    -34.9145042 -0.349145E+02  0.528E-02    3.13       0.0  T
   2    -34.9145051 -0.947478E-06  0.298E-02    3.13       1.0  T
   3    -34.9145034  0.168884E-05  0.109E-02    3.13       1.8  T
   4    -34.9145056 -0.218086E-05  0.165E-03    3.13      11.9  T
   5    -34.9145056 -0.997885E-08  0.847E-04    3.13      23.2  T
   6    -34.9145056 -0.509673E-08  0.301E-04    3.13      65.2  T
     SCC iter.                  ...        0 min,  0.006 sec
     gradient                   ...        0 min,  0.011 sec
 * total energy  :   -34.3395511 Eh     change       -0.5023831E-04 Eh
   gradient norm :     0.0023142 Eh/α   predicted    -0.3812384E-04 ( -24.11%)
   displ. norm   :     0.0776517 α      lambda       -0.3893557E-04
   maximum displ.:     0.0435967 α      in ANC's #5, #6, #8, ...

........................................................................
.............................. CYCLE    9 ..............................
........................................................................
   1    -34.9147777 -0.349148E+02  0.516E-02    3.14       0.0  T
   2    -34.9147784 -0.705570E-06  0.295E-02    3.14       1.0  T
   3    -34.9147783  0.858985E-07  0.423E-03    3.14       4.6  T
   4    -34.9147786 -0.305523E-06  0.157E-03    3.14      12.5  T
   5    -34.9147786 -0.219416E-07  0.676E-04    3.14      29.0  T
   6    -34.9147786 -0.241671E-08  0.268E-04    3.14      73.1  T
     SCC iter.                  ...        0 min,  0.006 sec
     gradient                   ...        0 min,  0.011 sec
 * total energy  :   -34.3395788 Eh     change       -0.2774454E-04 Eh
   gradient norm :     0.0017379 Eh/α   predicted    -0.1959330E-04 ( -29.38%)
   displ. norm   :     0.1518859 α      lambda       -0.3620068E-04
   maximum displ.:     0.0862913 α      in ANC's #5, #8, #1, ...

........................................................................
.............................. CYCLE   10 ..............................
........................................................................
   1    -34.9150451 -0.349150E+02  0.970E-02    3.14       0.0  T
   2    -34.9150472 -0.212637E-05  0.555E-02    3.15       1.0  T
   3    -34.9150477 -0.488945E-06  0.413E-03    3.15       4.7  T
   4    -34.9150480 -0.241518E-06  0.225E-03    3.15       8.7  T
   5    -34.9150480 -0.521246E-07  0.948E-04    3.15      20.7  T
   6    -34.9150480 -0.186893E-08  0.451E-04    3.15      43.5  T
     SCC iter.                  ...        0 min,  0.006 sec
     gradient                   ...        0 min,  0.011 sec
 * total energy  :   -34.3396137 Eh     change       -0.3491488E-04 Eh
   gradient norm :     0.0024786 Eh/α   predicted    -0.1828888E-04 ( -47.62%)
   displ. norm   :     0.0936595 α      lambda       -0.3130756E-04
   maximum displ.:     0.0589264 α      in ANC's #5, #8, #1, ...

........................................................................
.............................. CYCLE   11 ..............................
........................................................................
   1    -34.9146984 -0.349147E+02  0.564E-02    3.15       0.0  T
   2    -34.9146991 -0.677744E-06  0.323E-02    3.15       1.0  T
   3    -34.9146985  0.521292E-06  0.653E-03    3.15       3.0  T
   4    -34.9146994 -0.858131E-06  0.133E-03    3.15      14.7  T
   5    -34.9146994 -0.346373E-08  0.635E-04    3.15      30.9  T
   6    -34.9146994 -0.327562E-08  0.200E-04    3.15      97.9  T
     SCC iter.                  ...        0 min,  0.006 sec
     gradient                   ...        0 min,  0.011 sec
 * total energy  :   -34.3396406 Eh     change       -0.2681636E-04 Eh
   gradient norm :     0.0021169 Eh/α   predicted    -0.1579141E-04 ( -41.11%)
   displ. norm   :     0.1622859 α      lambda       -0.5555444E-04
   maximum displ.:     0.0996033 α      in ANC's #5, #1, #8, ...

........................................................................
.............................. CYCLE   12 ..............................
........................................................................
   1    -34.9145737 -0.349146E+02  0.914E-02    3.15       0.0  T
   2    -34.9145754 -0.162470E-05  0.524E-02    3.15       1.0  T
   3    -34.9145755 -0.126470E-06  0.537E-03    3.15       3.7  T
   4    -34.9145760 -0.558833E-06  0.197E-03    3.15      10.0  T
   5    -34.9145761 -0.872053E-08  0.992E-04    3.15      19.8  T
   6    -34.9145761 -0.873317E-08  0.291E-04    3.15      67.3  T
     SCC iter.                  ...        0 min,  0.006 sec
     gradient                   ...        0 min,  0.011 sec
 * total energy  :   -34.3396830 Eh     change       -0.4238808E-04 Eh
   gradient norm :     0.0020080 Eh/α   predicted    -0.2850997E-04 ( -32.74%)
   displ. norm   :     0.1764872 α      lambda       -0.4458908E-04
   maximum displ.:     0.1163533 α      in ANC's #5, #1, #2, ...

........................................................................
.............................. CYCLE   13 ..............................
........................................................................
   1    -34.9137473 -0.349137E+02  0.941E-02    3.16       0.0  T
   2    -34.9137493 -0.199989E-05  0.538E-02    3.16       1.0  T
   3    -34.9137456  0.374435E-05  0.158E-02    3.16       1.2  T
   4    -34.9137505 -0.491547E-05  0.237E-03    3.16       8.3  T
   5    -34.9137505 -0.189695E-07  0.117E-03    3.16      16.7  T
   6    -34.9137505 -0.654277E-08  0.323E-04    3.16      60.7  T
   7    -34.9137505 -0.142069E-08  0.946E-05    3.16     207.4  T
     SCC iter.                  ...        0 min,  0.007 sec
     gradient                   ...        0 min,  0.011 sec
 * total energy  :   -34.3397184 Eh     change       -0.3542541E-04 Eh
   gradient norm :     0.0023611 Eh/α   predicted    -0.2299159E-04 ( -35.10%)
   displ. norm   :     0.1567604 α      lambda       -0.4075757E-04
   maximum displ.:     0.1038249 α      in ANC's #5, #1, #2, ...

........................................................................
.............................. CYCLE   14 ..............................
........................................................................
   1    -34.9140346 -0.349140E+02  0.774E-02    3.16       0.0  T
   2    -34.9140356 -0.103181E-05  0.445E-02    3.17       1.0  T
   3    -34.9140356  0.846239E-08  0.491E-03    3.17       4.0  T
   4    -34.9140360 -0.400581E-06  0.192E-03    3.17      10.2  T
   5    -34.9140360 -0.198957E-07  0.851E-04    3.17      23.0  T
   6    -34.9140360 -0.377553E-08  0.239E-04    3.17      82.2  T
     SCC iter.                  ...        0 min,  0.006 sec
     gradient                   ...        0 min,  0.011 sec
 * total energy  :   -34.3397537 Eh     change       -0.3535428E-04 Eh
   gradient norm :     0.0024738 Eh/α   predicted    -0.2088466E-04 ( -40.93%)
   displ. norm   :     0.2011004 α      lambda       -0.5537823E-04
   maximum displ.:     0.1347955 α      in ANC's #5, #1, #2, ...

........................................................................
.............................. CYCLE   15 ..............................
........................................................................
   1    -34.9141176 -0.349141E+02  0.971E-02    3.17       0.0  T
   2    -34.9141193 -0.172342E-05  0.557E-02    3.17       1.0  T
   3    -34.9141180  0.129696E-05  0.103E-02    3.17       1.9  T
   4    -34.9141201 -0.202857E-05  0.251E-03    3.18       7.8  T
   5    -34.9141201 -0.341138E-07  0.111E-03    3.18      17.7  T
   6    -34.9141201 -0.236246E-08  0.280E-04    3.17      70.0  T
   7    -34.9141201 -0.107390E-08  0.882E-05    3.17     222.5  T
     SCC iter.                  ...        0 min,  0.007 sec
     gradient                   ...        0 min,  0.011 sec
 * total energy  :   -34.3398017 Eh     change       -0.4800218E-04 Eh
   gradient norm :     0.0020347 Eh/α   predicted    -0.2881396E-04 ( -39.97%)
   displ. norm   :     0.2967580 α      lambda       -0.7376062E-04
   maximum displ.:     0.1971512 α      in ANC's #5, #1, #2, ...

........................................................................
.............................. CYCLE   16 ..............................
........................................................................
   1    -34.9140038 -0.349140E+02  0.143E-01    3.18       0.0  T
   2    -34.9140069 -0.310143E-05  0.821E-02    3.18       1.0  T
   3    -34.9140077 -0.779245E-06  0.579E-03    3.18       3.4  T
   4    -34.9140080 -0.302571E-06  0.290E-03    3.18       6.8  T
   5    -34.9140081 -0.297739E-07  0.127E-03    3.18      15.5  T
   6    -34.9140081 -0.916476E-08  0.201E-04    3.18      97.3  T
   7    -34.9140081 -0.161045E-09  0.793E-05    3.18     247.3  T
     SCC iter.                  ...        0 min,  0.007 sec
     gradient                   ...        0 min,  0.011 sec
 * total energy  :   -34.3398633 Eh     change       -0.6157163E-04 Eh
   gradient norm :     0.0022017 Eh/α   predicted    -0.4013442E-04 ( -34.82%)
   displ. norm   :     0.4589417 α      lambda       -0.9517309E-04
   maximum displ.:     0.3059737 α      in ANC's #5, #1, #2, ...

........................................................................
.............................. CYCLE   17 ..............................
........................................................................
   1    -34.9125072 -0.349125E+02  0.224E-01    3.18       0.0  T
   2    -34.9125147 -0.747299E-05  0.129E-01    3.19       1.0  T
   3    -34.9125153 -0.579095E-06  0.121E-02    3.19       1.6  T
   4    -34.9125173 -0.201848E-05  0.529E-03    3.19       3.7  T
   5    -34.9125175 -0.166413E-06  0.228E-03    3.19       8.6  T
   6    -34.9125175 -0.234352E-07  0.673E-04    3.19      29.1  T
   7    -34.9125175 -0.555784E-08  0.223E-04    3.19      88.1  T
     SCC iter.                  ...        0 min,  0.007 sec
     gradient                   ...        0 min,  0.011 sec
 * total energy  :   -34.3399276 Eh     change       -0.6429146E-04 Eh
   gradient norm :     0.0037760 Eh/α   predicted    -0.5761134E-04 ( -10.39%)
   displ. norm   :     0.2403147 α      lambda       -0.6046364E-04
   maximum displ.:     0.1545087 α      in ANC's #5, #2, #1, ...

........................................................................
.............................. CYCLE   18 ..............................
........................................................................
   1    -34.9135420 -0.349135E+02  0.119E-01    3.19       0.0  T
   2    -34.9135438 -0.185606E-05  0.684E-02    3.19       1.0  T
   3    -34.9135436  0.236797E-06  0.743E-03    3.20       2.6  T
   4    -34.9135445 -0.911842E-06  0.261E-03    3.20       7.5  T
   5    -34.9135445 -0.360063E-07  0.126E-03    3.20      15.6  T
   6    -34.9135445 -0.738258E-08  0.382E-04    3.20      51.3  T
   7    -34.9135445 -0.200478E-08  0.943E-05    3.20     208.0  T
     SCC iter.                  ...        0 min,  0.007 sec
     gradient                   ...        0 min,  0.011 sec
 * total energy  :   -34.3399721 Eh     change       -0.4450778E-04 Eh
   gradient norm :     0.0027814 Eh/α   predicted    -0.3197847E-04 ( -28.15%)
   displ. norm   :     0.3027128 α      lambda       -0.5851967E-04
   maximum displ.:     0.1961422 α      in ANC's #5, #2, #1, ...

........................................................................
.............................. CYCLE   19 ..............................
........................................................................
   1    -34.9133503 -0.349134E+02  0.151E-01    3.20       0.0  T
   2    -34.9133537 -0.341509E-05  0.870E-02    3.20       1.0  T
   3    -34.9133541 -0.389082E-06  0.703E-03    3.21       2.8  T
   4    -34.9133547 -0.621852E-06  0.336E-03    3.21       5.8  T
   5    -34.9133548 -0.901625E-07  0.153E-03    3.21      12.8  T
   6    -34.9133548 -0.985920E-08  0.541E-04    3.21      36.2  T
   7    -34.9133548 -0.321928E-08  0.160E-04    3.21     122.8  T
     SCC iter.                  ...        0 min,  0.007 sec
     gradient                   ...        0 min,  0.011 sec
 * total energy  :   -34.3400129 Eh     change       -0.4077650E-04 Eh
   gradient norm :     0.0025965 Eh/α   predicted    -0.3194185E-04 ( -21.67%)
   displ. norm   :     0.1667782 α      lambda       -0.5495543E-04
   maximum displ.:     0.0922210 α      in ANC's #2, #5, #6, ...

........................................................................
.............................. CYCLE   20 ..............................
........................................................................
   1    -34.9158913 -0.349159E+02  0.902E-02    3.22       0.0  T
   2    -34.9158930 -0.167561E-05  0.519E-02    3.22       1.0  T
   3    -34.9158927  0.236258E-06  0.663E-03    3.23       3.0  T
   4    -34.9158936 -0.825473E-06  0.235E-03    3.22       8.4  T
   5    -34.9158936 -0.402765E-07  0.112E-03    3.22      17.5  T
   6    -34.9158936 -0.484883E-08  0.382E-04    3.22      51.4  T
   7    -34.9158936 -0.188678E-08  0.873E-05    3.22     224.6  T
     SCC iter.                  ...        0 min,  0.007 sec
     gradient                   ...        0 min,  0.011 sec
 * total energy  :   -34.3400347 Eh     change       -0.2182946E-04 Eh
   gradient norm :     0.0026690 Eh/α   predicted    -0.2825184E-04 (  29.42%)
   displ. norm   :     0.2618529 α      lambda       -0.3663473E-04
   maximum displ.:     0.1682063 α      in ANC's #5, #2, #1, ...
 * RMSD in coord.:     0.6194805 α      energy gain  -0.5124555E-02 Eh

generating ANC from model Hessian ...
Using Lindh-Hessian (1995)
 Shifting diagonal of input Hessian by   4.326824546317620E-003
 Lowest  eigenvalues of input Hessian
   -0.000000   -0.000000   -0.000000   -0.000000    0.000000    0.000000
    0.005000    0.005677    0.006827    0.007949    0.008948    0.011858
    0.012878    0.015978    0.019774    0.020300    0.021384    0.024350
 Highest eigenvalues
    1.619011    1.754791    1.891603    1.972372    2.022557    2.106685
 

........................................................................
.............................. CYCLE   21 ..............................
........................................................................
   1    -34.9131877 -0.349132E+02  0.132E-01    3.22       0.0  T
   2    -34.9131902 -0.254283E-05  0.760E-02    3.22       1.0  T
   3    -34.9131907 -0.500094E-06  0.580E-03    3.22       3.4  T
   4    -34.9131911 -0.385482E-06  0.287E-03    3.22       6.8  T
   5    -34.9131911 -0.414820E-07  0.127E-03    3.22      15.4  T
   6    -34.9131911 -0.102187E-07  0.408E-04    3.22      48.1  T
   7    -34.9131911 -0.204001E-08  0.133E-04    3.22     147.6  T
     SCC iter.                  ...        0 min,  0.007 sec
     gradient                   ...        0 min,  0.011 sec
 * total energy  :   -34.3400510 Eh     change       -0.1630138E-04 Eh
   gradient norm :     0.0025638 Eh/α   predicted     0.0000000E+00 (-100.00%)
   displ. norm   :     0.0321870 α      lambda       -0.2349439E-04
   maximum displ.:     0.0209830 α      in ANC's #1, #2, #7, ...

........................................................................
.............................. CYCLE   22 ..............................
........................................................................
   1    -34.9144868 -0.349145E+02  0.159E-02    3.23       0.0  T
   2    -34.9144869 -0.148419E-06  0.910E-03    3.23       2.2  T
   3    -34.9144868  0.814896E-07  0.246E-03    3.23       8.0  T
   4    -34.9144869 -0.112819E-06  0.836E-04    3.23      23.4  T
   5    -34.9144870 -0.876130E-08  0.253E-04    3.23      77.4  T
     SCC iter.                  ...        0 min,  0.005 sec
     gradient                   ...        0 min,  0.011 sec
 * total energy  :   -34.3400684 Eh     change       -0.1739753E-04 Eh
   gradient norm :     0.0008880 Eh/α   predicted    -0.1177879E-04 ( -32.30%)
   displ. norm   :     0.0510416 α      lambda       -0.1172559E-04
   maximum displ.:     0.0264325 α      in ANC's #2, #1, #7, ...

........................................................................
.............................. CYCLE   23 ..............................
........................................................................
   1    -34.9154700 -0.349155E+02  0.262E-02    3.23       0.0  T
   2    -34.9154703 -0.304313E-06  0.150E-02    3.23       1.3  T
   3    -34.9154704 -0.164643E-07  0.184E-03    3.23      10.7  T
   4    -34.9154704 -0.579798E-07  0.972E-04    3.23      20.2  T
   5    -34.9154704 -0.136261E-07  0.364E-04    3.23      53.9  T
     SCC iter.                  ...        0 min,  0.005 sec
     gradient                   ...        0 min,  0.011 sec
 * total energy  :   -34.3400792 Eh     change       -0.1081903E-04 Eh
   gradient norm :     0.0009655 Eh/α   predicted    -0.5870251E-05 ( -45.74%)
   displ. norm   :     0.0499282 α      lambda       -0.6066103E-05
   maximum displ.:     0.0304861 α      in ANC's #2, #1, #7, ...

........................................................................
.............................. CYCLE   24 ..............................
........................................................................
   1    -34.9153236 -0.349153E+02  0.248E-02    3.23       0.0  T
   2    -34.9153237 -0.161067E-06  0.141E-02    3.23       1.4  T
   3    -34.9153237  0.715294E-07  0.289E-03    3.23       6.8  T
   4    -34.9153238 -0.149657E-06  0.601E-04    3.23      32.7  T
   5    -34.9153238  0.468319E-10  0.318E-04    3.23      61.7  T
     SCC iter.                  ...        0 min,  0.005 sec
     gradient                   ...        0 min,  0.011 sec
 * total energy  :   -34.3400870 Eh     change       -0.7739444E-05 Eh
   gradient norm :     0.0008392 Eh/α   predicted    -0.3037516E-05 ( -60.75%)
   displ. norm   :     0.0872288 α      lambda       -0.9419163E-05
   maximum displ.:     0.0535253 α      in ANC's #2, #1, #3, ...

........................................................................
.............................. CYCLE   25 ..............................
........................................................................
   1    -34.9148229 -0.349148E+02  0.443E-02    3.23       0.0  T
   2    -34.9148234 -0.472283E-06  0.253E-02    3.23       1.0  T
   3    -34.9148233  0.149520E-06  0.457E-03    3.23       4.3  T
   4    -34.9148236 -0.372262E-06  0.104E-03    3.23      18.9  T
   5    -34.9148236 -0.132142E-08  0.503E-04    3.23      39.0  T
   6    -34.9148236 -0.109932E-08  0.105E-04    3.23     187.5  T
     SCC iter.                  ...        0 min,  0.006 sec
     gradient                   ...        0 min,  0.011 sec
 * total energy  :   -34.3400983 Eh     change       -0.1137589E-04 Eh
   gradient norm :     0.0006167 Eh/α   predicted    -0.4730692E-05 ( -58.41%)
   displ. norm   :     0.1167553 α      lambda       -0.1065506E-04
   maximum displ.:     0.0742832 α      in ANC's #2, #1, #3, ...

........................................................................
.............................. CYCLE   26 ..............................
........................................................................
   1    -34.9143678 -0.349144E+02  0.599E-02    3.23       0.0  T
   2    -34.9143685 -0.716795E-06  0.344E-02    3.23       1.0  T
   3    -34.9143686 -0.134097E-07  0.427E-03    3.23       4.6  T
   4    -34.9143689 -0.296810E-06  0.131E-03    3.23      15.0  T
   5    -34.9143689 -0.528640E-08  0.639E-04    3.23      30.7  T
   6    -34.9143689 -0.175211E-08  0.120E-04    3.23     163.6  T
     SCC iter.                  ...        0 min,  0.006 sec
     gradient                   ...        0 min,  0.011 sec
 * total energy  :   -34.3401105 Eh     change       -0.1210779E-04 Eh
   gradient norm :     0.0010312 Eh/α   predicted    -0.5360184E-05 ( -55.73%)
   displ. norm   :     0.1178402 α      lambda       -0.9861255E-05
   maximum displ.:     0.0749602 α      in ANC's #2, #1, #3, ...

........................................................................
.............................. CYCLE   27 ..............................
........................................................................
   1    -34.9142038 -0.349142E+02  0.608E-02    3.23       0.0  T
   2    -34.9142045 -0.654742E-06  0.350E-02    3.23       1.0  T
   3    -34.9142047 -0.217511E-06  0.239E-03    3.23       8.2  T
   4    -34.9142047 -0.512066E-07  0.122E-03    3.23      16.1  T
   5    -34.9142048 -0.434034E-08  0.594E-04    3.23      33.0  T
   6    -34.9142048 -0.323662E-08  0.126E-04    3.23     155.6  T
     SCC iter.                  ...        0 min,  0.006 sec
     gradient                   ...        0 min,  0.011 sec
 * total energy  :   -34.3401224 Eh     change       -0.1199548E-04 Eh
   gradient norm :     0.0011100 Eh/α   predicted    -0.4965675E-05 ( -58.60%)
   displ. norm   :     0.1156131 α      lambda       -0.9817488E-05
   maximum displ.:     0.0775477 α      in ANC's #2, #3, #1, ...

........................................................................
.............................. CYCLE   28 ..............................
........................................................................
   1    -34.9144641 -0.349145E+02  0.614E-02    3.23       0.0  T
   2    -34.9144646 -0.488471E-06  0.356E-02    3.23       1.0  T
   3    -34.9144647 -0.141112E-06  0.228E-03    3.23       8.6  T
   4    -34.9144648 -0.543293E-07  0.111E-03    3.23      17.7  T
   5    -34.9144648 -0.551271E-08  0.545E-04    3.23      36.0  T
   6    -34.9144648 -0.225203E-08  0.123E-04    3.23     159.5  T
     SCC iter.                  ...        0 min,  0.006 sec
     gradient                   ...        0 min,  0.024 sec
 * total energy  :   -34.3401346 Eh     change       -0.1217852E-04 Eh
   gradient norm :     0.0007336 Eh/α   predicted    -0.4938754E-05 ( -59.45%)
   displ. norm   :     0.1098629 α      lambda       -0.8310529E-05
   maximum displ.:     0.0774277 α      in ANC's #2, #3, #1, ...

........................................................................
.............................. CYCLE   29 ..............................
........................................................................
   1    -34.9148242 -0.349148E+02  0.599E-02    3.23       0.0  T
   2    -34.9148247 -0.437520E-06  0.348E-02    3.23       1.0  T
   3    -34.9148246  0.881758E-07  0.403E-03    3.23       4.9  T
   4    -34.9148249 -0.277096E-06  0.109E-03    3.23      18.1  T
   5    -34.9148249 -0.409543E-08  0.511E-04    3.23      38.4  T
   6    -34.9148249 -0.102742E-08  0.130E-04    3.23     150.6  T
     SCC iter.                  ...        0 min,  0.006 sec
     gradient                   ...        0 min,  0.011 sec
 * total energy  :   -34.3401448 Eh     change       -0.1020275E-04 Eh
   gradient norm :     0.0004419 Eh/α   predicted    -0.4181249E-05 ( -59.02%)
   displ. norm   :     0.0864254 α      lambda       -0.6053444E-05
   maximum displ.:     0.0644772 α      in ANC's #2, #3, #1, ...

........................................................................
.............................. CYCLE   30 ..............................
........................................................................
   1    -34.9150703 -0.349151E+02  0.504E-02    3.23       0.0  T
   2    -34.9150706 -0.321539E-06  0.292E-02    3.23       1.0  T
   3    -34.9150702  0.383138E-06  0.544E-03    3.23       3.6  T
   4    -34.9150708 -0.551692E-06  0.931E-04    3.23      21.1  T
   5    -34.9150708 -0.130069E-08  0.427E-04    3.23      45.9  T
     SCC iter.                  ...        0 min,  0.005 sec
     gradient                   ...        0 min,  0.011 sec
 * total energy  :   -34.3401524 Eh     change       -0.7524596E-05 Eh
   gradient norm :     0.0004880 Eh/α   predicted    -0.3041486E-05 ( -59.58%)
   displ. norm   :     0.0734005 α      lambda       -0.5218062E-05
   maximum displ.:     0.0566090 α      in ANC's #2, #3, #4, ...

........................................................................
.............................. CYCLE   31 ..............................
........................................................................
   1    -34.9152195 -0.349152E+02  0.436E-02    3.23       0.0  T
   2    -34.9152198 -0.308692E-06  0.251E-02    3.23       1.0  T
   3    -34.9152192  0.617098E-06  0.654E-03    3.23       3.0  T
   4    -34.9152200 -0.807223E-06  0.911E-04    3.23      21.5  T
   5    -34.9152200 -0.603329E-09  0.429E-04    3.23      45.7  T
     SCC iter.                  ...        0 min,  0.005 sec
     gradient                   ...        0 min,  0.011 sec
 * total energy  :   -34.3401595 Eh     change       -0.7140790E-05 Eh
   gradient norm :     0.0004168 Eh/α   predicted    -0.2618819E-05 ( -63.33%)
   displ. norm   :     0.0825405 α      lambda       -0.6259418E-05
   maximum displ.:     0.0625613 α      in ANC's #2, #3, #5, ...

........................................................................
.............................. CYCLE   32 ..............................
........................................................................
   1    -34.9151958 -0.349152E+02  0.498E-02    3.22       0.0  T
   2    -34.9151963 -0.500358E-06  0.286E-02    3.22       1.0  T
   3    -34.9151955  0.859426E-06  0.786E-03    3.22       2.5  T
   4    -34.9151966 -0.116021E-05  0.115E-03    3.22      17.1  T
   5    -34.9151966 -0.929901E-09  0.537E-04    3.22      36.5  T
   6    -34.9151966 -0.941519E-09  0.130E-04    3.22     151.3  T
     SCC iter.                  ...        0 min,  0.006 sec
     gradient                   ...        0 min,  0.011 sec
 * total energy  :   -34.3401682 Eh     change       -0.8670075E-05 Eh
   gradient norm :     0.0003083 Eh/α   predicted    -0.3143981E-05 ( -63.74%)
   displ. norm   :     0.1188293 α      lambda       -0.8786024E-05
   maximum displ.:     0.0883137 α      in ANC's #2, #3, #1, ...

........................................................................
.............................. CYCLE   33 ..............................
........................................................................
   1    -34.9150012 -0.349150E+02  0.706E-02    3.22       0.0  T
   2    -34.9150023 -0.109834E-05  0.404E-02    3.22       1.0  T
   3    -34.9150013  0.101553E-05  0.928E-03    3.22       2.1  T
   4    -34.9150029 -0.159013E-05  0.170E-03    3.22      11.6  T
   5    -34.9150029 -0.301898E-08  0.788E-04    3.22      24.9  T
   6    -34.9150029 -0.207302E-08  0.179E-04    3.22     109.3  T
     SCC iter.                  ...        0 min,  0.006 sec
     gradient                   ...        0 min,  0.011 sec
 * total energy  :   -34.3401800 Eh     change       -0.1185481E-04 Eh
   gradient norm :     0.0004379 Eh/α   predicted    -0.4422125E-05 ( -62.70%)
   displ. norm   :     0.1626380 α      lambda       -0.1094255E-04
   maximum displ.:     0.1199516 α      in ANC's #2, #3, #1, ...

........................................................................
.............................. CYCLE   34 ..............................
........................................................................
   1    -34.9147252 -0.349147E+02  0.949E-02    3.22       0.0  T
   2    -34.9147272 -0.204921E-05  0.543E-02    3.22       1.0  T
   3    -34.9147266  0.599174E-06  0.942E-03    3.22       2.1  T
   4    -34.9147282 -0.155110E-05  0.233E-03    3.22       8.4  T
   5    -34.9147282 -0.880178E-08  0.106E-03    3.22      18.5  T
   6    -34.9147282 -0.443016E-08  0.234E-04    3.22      83.7  T
   7    -34.9147282 -0.931216E-09  0.828E-05    3.22     236.9  T
     SCC iter.                  ...        0 min,  0.007 sec
     gradient                   ...        0 min,  0.011 sec
 * total energy  :   -34.3401943 Eh     change       -0.1423424E-04 Eh
   gradient norm :     0.0009331 Eh/α   predicted    -0.5536916E-05 ( -61.10%)
   displ. norm   :     0.2136026 α      lambda       -0.1286896E-04
   maximum displ.:     0.1580059 α      in ANC's #2, #3, #1, ...

........................................................................
.............................. CYCLE   35 ..............................
........................................................................
   1    -34.9141983 -0.349142E+02  0.122E-01    3.21       0.0  T
   2    -34.9142017 -0.336531E-05  0.697E-02    3.21       1.0  T
   3    -34.9142021 -0.440234E-06  0.818E-03    3.21       2.4  T
   4    -34.9142031 -0.977107E-06  0.302E-03    3.21       6.5  T
   5    -34.9142031 -0.279645E-07  0.136E-03    3.21      14.5  T
   6    -34.9142031 -0.962307E-08  0.323E-04    3.21      60.7  T
   7    -34.9142031 -0.164619E-08  0.110E-04    3.21     177.9  T
     SCC iter.                  ...        0 min,  0.007 sec
     gradient                   ...        0 min,  0.011 sec
 * total energy  :   -34.3402099 Eh     change       -0.1565043E-04 Eh
   gradient norm :     0.0015757 Eh/α   predicted    -0.6567199E-05 ( -58.04%)
   displ. norm   :     0.3539113 α      lambda       -0.1915458E-04
   maximum displ.:     0.2661741 α      in ANC's #2, #3, #1, ...

........................................................................
.............................. CYCLE   36 ..............................
........................................................................
   1    -34.9130495 -0.349130E+02  0.198E-01    3.21       0.0  T
   2    -34.9130582 -0.863312E-05  0.113E-01    3.21       1.0  T
   3    -34.9130604 -0.219061E-05  0.107E-02    3.22       1.8  T
   4    -34.9130617 -0.133151E-05  0.483E-03    3.21       4.1  T
   5    -34.9130618 -0.848927E-07  0.219E-03    3.21       9.0  T
   6    -34.9130618 -0.313068E-07  0.531E-04    3.21      36.9  T
   7    -34.9130618 -0.440267E-08  0.178E-04    3.21     110.4  T
     SCC iter.                  ...        0 min,  0.007 sec
     gradient                   ...        0 min,  0.011 sec
 * total energy  :   -34.3402255 Eh     change       -0.1555221E-04 Eh
   gradient norm :     0.0030833 Eh/α   predicted    -0.1011176E-04 ( -34.98%)
   displ. norm   :     0.0673791 α      lambda       -0.1707844E-04
   maximum displ.:     0.0513114 α      in ANC's #2, #3, #1, ...

........................................................................
.............................. CYCLE   37 ..............................
........................................................................
   1    -34.9140329 -0.349140E+02  0.341E-02    3.22       0.0  T
   2    -34.9140331 -0.262349E-06  0.195E-02    3.22       1.0  T
   3    -34.9140331  0.429232E-07  0.289E-03    3.22       6.8  T
   4    -34.9140332 -0.144844E-06  0.936E-04    3.22      21.0  T
   5    -34.9140333 -0.422973E-08  0.362E-04    3.22      54.2  T
     SCC iter.                  ...        0 min,  0.005 sec
     gradient                   ...        0 min,  0.011 sec
 * total energy  :   -34.3402387 Eh     change       -0.1324816E-04 Eh
   gradient norm :     0.0021204 Eh/α   predicted    -0.8584048E-05 ( -35.21%)
   displ. norm   :     0.2398662 α      lambda       -0.2731605E-04
   maximum displ.:     0.1828042 α      in ANC's #2, #3, #1, ...

........................................................................
.............................. CYCLE   38 ..............................
........................................................................
   1    -34.9145583 -0.349146E+02  0.126E-01    3.22       0.0  T
   2    -34.9145614 -0.316363E-05  0.721E-02    3.23       1.0  T
   3    -34.9145622 -0.728951E-06  0.638E-03    3.23       3.1  T
   4    -34.9145627 -0.483515E-06  0.316E-03    3.23       6.2  T
   5    -34.9145627 -0.531817E-07  0.123E-03    3.23      15.9  T
   6    -34.9145627 -0.889437E-08  0.403E-04    3.23      48.6  T
   7    -34.9145627 -0.201567E-08  0.142E-04    3.23     137.9  T
     SCC iter.                  ...        0 min,  0.007 sec
     gradient                   ...        0 min,  0.011 sec
 * total energy  :   -34.3402599 Eh     change       -0.2120843E-04 Eh
   gradient norm :     0.0014757 Eh/α   predicted    -0.1444634E-04 ( -31.88%)
   displ. norm   :     0.5838185 α      lambda       -0.3129403E-04
   maximum displ.:     0.4431270 α      in ANC's #2, #3, #1, ...

........................................................................
.............................. CYCLE   39 ..............................
........................................................................
   1    -34.9124909 -0.349125E+02  0.308E-01    3.24       0.0  T
   2    -34.9125096 -0.186715E-04  0.176E-01    3.24       1.0  T
   3    -34.9125133 -0.366809E-05  0.169E-02    3.25       1.2  T
   4    -34.9125170 -0.378293E-05  0.780E-03    3.25       2.5  T
   5    -34.9125173 -0.284387E-06  0.314E-03    3.25       6.3  T
   6    -34.9125174 -0.615044E-07  0.887E-04    3.25      22.1  T
   7    -34.9125174 -0.105082E-07  0.313E-04    3.25      62.6  T
     SCC iter.                  ...        0 min,  0.007 sec
     gradient                   ...        0 min,  0.011 sec
 * total energy  :   -34.3402709 Eh     change       -0.1102344E-04 Eh
   gradient norm :     0.0036232 Eh/α   predicted    -0.1801873E-04 (  63.46%)
   displ. norm   :     0.0737271 α      lambda       -0.4992988E-04
   maximum displ.:     0.0487971 α      in ANC's #3, #2, #5, ...

........................................................................
.............................. CYCLE   40 ..............................
........................................................................
   1    -34.9162596 -0.349163E+02  0.455E-02    3.26       0.0  T
   2    -34.9162603 -0.652559E-06  0.260E-02    3.26       1.0  T
   3    -34.9162597  0.579029E-06  0.691E-03    3.26       2.8  T
   4    -34.9162605 -0.868126E-06  0.128E-03    3.26      15.3  T
   5    -34.9162606 -0.724814E-08  0.591E-04    3.26      33.2  T
   6    -34.9162606 -0.700531E-09  0.211E-04    3.26      93.0  T
     SCC iter.                  ...        0 min,  0.006 sec
     gradient                   ...        0 min,  0.011 sec
 * total energy  :   -34.3402890 Eh     change       -0.1804611E-04 Eh
   gradient norm :     0.0021061 Eh/α   predicted    -0.2510184E-04 (  39.10%)
   displ. norm   :     0.0677299 α      lambda       -0.1280054E-04
   maximum displ.:     0.0504630 α      in ANC's #2, #3, #1, ...

........................................................................
.............................. CYCLE   41 ..............................
........................................................................
   1    -34.9152533 -0.349153E+02  0.358E-02    3.25       0.0  T
   2    -34.9152535 -0.239464E-06  0.206E-02    3.26       1.0  T
   3    -34.9152536 -0.675595E-07  0.149E-03    3.26      13.2  T
   4    -34.9152536 -0.219969E-07  0.796E-04    3.26      24.6  T
   5    -34.9152536 -0.396188E-08  0.279E-04    3.26      70.2  T
     SCC iter.                  ...        0 min,  0.018 sec
     gradient                   ...        0 min,  0.011 sec
 * total energy  :   -34.3402953 Eh     change       -0.6352602E-05 Eh
   gradient norm :     0.0009778 Eh/α   predicted    -0.6429961E-05 (   1.22%)
   displ. norm   :     0.1453945 α      lambda       -0.4706475E-05
   maximum displ.:     0.1112930 α      in ANC's #2, #3, #1, ...

........................................................................
.............................. CYCLE   42 ..............................
........................................................................
   1    -34.9145643 -0.349146E+02  0.753E-02    3.26       0.0  T
   2    -34.9145654 -0.110403E-05  0.432E-02    3.26       1.0  T
   3    -34.9145658 -0.380142E-06  0.305E-03    3.26       6.4  T
   4    -34.9145658 -0.677385E-07  0.166E-03    3.26      11.8  T
   5    -34.9145658 -0.783401E-08  0.598E-04    3.26      32.8  T
   6    -34.9145658 -0.297540E-08  0.996E-05    3.26     196.9  T
     SCC iter.                  ...        0 min,  0.006 sec
     gradient                   ...        0 min,  0.024 sec
 * total energy  :   -34.3402993 Eh     change       -0.3964394E-05 Eh
   gradient norm :     0.0007980 Eh/α   predicted    -0.2376116E-05 ( -40.06%)
   displ. norm   :     0.1455015 α      lambda        0.4067310E-05
   maximum displ.:     0.1112906 α      in ANC's #2, #3, #1, ...

   *** GEOMETRY OPTIMIZATION CONVERGED AFTER 42 ITERATIONS ***

------------------------------------------------------------------------
 total energy gain   :        -0.0053891 Eh       -3.3817 kcal/mol
 total RMSD          :         0.9069634 a0        0.4799 Å
 total power (kW/mol):        -0.3368855 (step)  -12.4457 (real)
------------------------------------------------------------------------

 ANCopt (total)                0 d,  0 h,  0 min,  1.137 sec
 optimizer setup                ...        0 min,  0.000 sec (  0.012%)
 model hessian                  ...        0 min,  0.010 sec (  0.897%)
 ANC generation                 ...        0 min,  0.001 sec (  0.130%)
 coordinate transformation      ...        0 min,  0.001 sec (  0.065%)
 single point calculation       ...        0 min,  1.097 sec ( 96.465%)
 optimization log               ...        0 min,  0.017 sec (  1.461%)
 hessian update                 ...        0 min,  0.001 sec (  0.048%)
 rational function              ...        0 min,  0.008 sec (  0.680%)

================
 final structure:
================
$coord
    2.72613271687683   -0.14540148194250    0.83044655334525      C 
    1.55133558250471    2.16576350677136    1.17491789151313      C 
   -0.96885255259179    2.49051457827470    0.52949666836373      C 
   -2.27301604346380    4.99156733972478    0.90832113983138      C 
   -4.02935842270620    5.49283914479426   -1.15076344483841      N 
   -2.29217949210407    0.45471877328015   -0.47198633684433      C 
   -1.11964125416288   -1.85132926667960   -0.81558100792203      C 
    1.40448913115026   -2.17857598216967   -0.16566440053999      C 
    2.66023922933031   -4.70780719475642   -0.53356283858140      C 
    1.90346281285007   -5.83596580884366   -2.90177150222028      N 
    2.19238281188301   -8.38315505104388   -3.31912254582796      C 
    2.38314843226531   -9.46884319288337   -5.57499745923418      C 
    4.69263423858662   -0.36534269518126    1.34071079920314      H 
    2.61158046566064    3.73148242892549    1.94996525382417      H 
   -0.83502860584489    6.48354864650959    1.15509821122830      H 
   -3.38803011120881    4.90893476941965    2.65441490564867      H 
   -3.08253024013079    5.57871538418152   -2.81693469576980      H 
   -4.90995437719428    7.17302777409962   -0.88239176267274      H 
   -4.24877389110326    0.71458757076451   -0.98282030733819      H 
   -2.15340852985973   -3.42718054211953   -1.59899001708639      H 
    2.06996050271329   -5.98906806794754    0.98620966962224      H 
    4.72868056254486   -4.48206287963448   -0.39376742621896      H 
    2.22518923467090   -4.73788940622527   -4.43220608207477      H 
    2.13600316095759   -9.51127079026662   -1.61344509162744      H 
    2.43844848638098   -8.37523960259421   -7.29016696686242      H 
    2.44882036067951  -11.48651867494081   -5.76891947340438      H 
$end
           -------------------------------------------------
          |                Final Singlepoint                |
           -------------------------------------------------

          ...................................................
          :                      SETUP                      :
          :.................................................:
          :  # basis functions                  62          :
          :  # atomic orbitals                  62          :
          :  # shells                           38          :
          :  # electrons                        64          :
          :  max. iterations                   250          :
          :  Hamiltonian                  GFN2-xTB          :
          :  restarted?                      false          :
          :  GBSA solvation                  false          :
          :  PC potential                    false          :
          :  electronic temp.          300.0000000     K    :
          :  accuracy                    1.0000000          :
          :  -> integral cutoff          0.2500000E+02      :
          :  -> integral neglect         0.1000000E-07      :
          :  -> SCF convergence          0.1000000E-05 Eh   :
          :  -> wf. convergence          0.1000000E-03 e    :
          :  Broyden damping             0.4000000          :
          ...................................................

 iter      E             dE          RMSdq      gap      omega  full diag
   1    -34.9145658 -0.349146E+02  0.561E-05    3.26       0.0  T
   2    -34.9145658 -0.125269E-10  0.331E-05    3.26     591.7  T
   3    -34.9145658 -0.248832E-10  0.163E-05    3.26    1204.8  T

   *** convergence criteria satisfied after 3 iterations ***

         #    Occupation            Energy/Eh            Energy/eV
      -------------------------------------------------------------
         1        2.0000           -0.6474068             -17.6168
       ...           ...                  ...                  ...
        26        2.0000           -0.4288928             -11.6708
        27        2.0000           -0.4202722             -11.4362
        28        2.0000           -0.4174890             -11.3605
        29        2.0000           -0.4016134             -10.9285
        30        2.0000           -0.3915280             -10.6540
        31        2.0000           -0.3682658             -10.0210
        32        2.0000           -0.3406076              -9.2684 (HOMO)
        33                         -0.2208185              -6.0088 (LUMO)
        34                         -0.2195292              -5.9737
        35                         -0.1684626              -4.5841
        36                         -0.0942912              -2.5658
        37                          0.0392211               1.0673
       ...                                ...                  ...
        62                          0.6583246              17.9139
      -------------------------------------------------------------
                  HL-Gap            0.1197891 Eh            3.2596 eV
             Fermi-level           -0.2807131 Eh           -7.6386 eV

 SCC (total)                   0 d,  0 h,  0 min,  0.035 sec
 SCC setup                      ...        0 min,  0.000 sec (  0.504%)
 Dispersion                     ...        0 min,  0.000 sec (  0.611%)
 integral evaluation            ...        0 min,  0.007 sec ( 18.964%)
 zeroth order Hamiltonian       ...        0 min,  0.000 sec (  0.342%)
 iterations                     ...        0 min,  0.004 sec ( 10.259%)
 molecular gradient             ...        0 min,  0.024 sec ( 68.174%)
 printout                       ...        0 min,  0.000 sec (  1.010%)

         :::::::::::::::::::::::::::::::::::::::::::::::::::::
         ::                     SUMMARY                     ::
         :::::::::::::::::::::::::::::::::::::::::::::::::::::
         :: total energy             -34.340299303843 Eh    ::
         :: gradient norm              0.000797974753 Eh/a0 ::
         :: HOMO-LUMO gap              3.259627096211 eV    ::
         ::.................................................::
         :: SCC energy               -34.914565842652 Eh    ::
         :: -> isotropic ES            0.018798946192 Eh    ::
         :: -> anisotropic ES          0.008086279168 Eh    ::
         :: -> anisotropic XC          0.025752279152 Eh    ::
         :: -> dispersion             -0.021045188176 Eh    ::
         :: repulsion energy           0.574351985561 Eh    ::
         :: add. restraining           0.000000000000 Eh    ::
         :::::::::::::::::::::::::::::::::::::::::::::::::::::

           -------------------------------------------------
          |                Property Printout                |
           -------------------------------------------------

    * Orbital Energies and Occupations

         #    Occupation            Energy/Eh            Energy/eV
      -------------------------------------------------------------
         1        2.0000           -0.6474068             -17.6168
       ...           ...                  ...                  ...
        20        2.0000           -0.4772274             -12.9860
        21        2.0000           -0.4714968             -12.8301
        22        2.0000           -0.4602144             -12.5231
        23        2.0000           -0.4589871             -12.4897
        24        2.0000           -0.4536230             -12.3437
        25        2.0000           -0.4339527             -11.8085
        26        2.0000           -0.4288928             -11.6708
        27        2.0000           -0.4202722             -11.4362
        28        2.0000           -0.4174890             -11.3605
        29        2.0000           -0.4016134             -10.9285
        30        2.0000           -0.3915280             -10.6540
        31        2.0000           -0.3682658             -10.0210
        32        2.0000           -0.3406076              -9.2684 (HOMO)
        33                         -0.2208185              -6.0088 (LUMO)
        34                         -0.2195292              -5.9737
        35                         -0.1684626              -4.5841
        36                         -0.0942912              -2.5658
        37                          0.0392211               1.0673
        38                          0.0520634               1.4167
        39                          0.0920612               2.5051
        40                          0.1037037               2.8219
        41                          0.1180545               3.2124
        42                          0.1291338               3.5139
        43                          0.1421596               3.8684
       ...                                ...                  ...
        62                          0.6583246              17.9139
      -------------------------------------------------------------
                  HL-Gap            0.1197891 Eh            3.2596 eV
             Fermi-level           -0.2807131 Eh           -7.6386 eV

     #   Z        covCN         q      C6AA      α(0)
     1   6 C      2.923    -0.041    29.007     8.832
     2   6 C      2.923    -0.041    29.010     8.833
     3   6 C      2.971     0.005    27.918     8.667
     4   6 C      3.736     0.021    20.306     6.431
     5   7 N      2.630    -0.337    28.667     7.952
     6   6 C      2.924    -0.036    28.887     8.814
     7   6 C      2.924    -0.037    28.925     8.820
     8   6 C      2.971     0.000    28.015     8.682
     9   6 C      3.745     0.008    20.517     6.462
    10   7 N      2.687    -0.183    24.974     7.422
    11   6 C      2.824     0.024    27.459     8.586
    12   6 C      2.839    -0.144    31.681     9.224
    13   1 H      0.925     0.028     2.618     2.530
    14   1 H      0.925     0.028     2.622     2.532
    15   1 H      0.923     0.007     2.945     2.684
    16   1 H      0.924     0.041     2.431     2.438
    17   1 H      0.860     0.136     1.498     1.917
    18   1 H      0.860     0.136     1.504     1.921
    19   1 H      0.926     0.053     2.285     2.364
    20   1 H      0.926     0.044     2.395     2.420
    21   1 H      0.924     0.050     2.316     2.380
    22   1 H      0.923     0.022     2.702     2.570
    23   1 H      0.860     0.148     1.417     1.865
    24   1 H      0.925     0.025     2.653     2.547
    25   1 H      0.926     0.018     2.762     2.599
    26   1 H      0.926     0.025     2.666     2.553

 Mol. C6AA /au·bohr⁶  :       6982.802436
 Mol. C8AA /au·bohr⁸  :     161536.977734
 Mol. α(0) /au        :        132.044887


Wiberg/Mayer (AO) data.
largest (>0.10) Wiberg bond orders for each atom
          total WBO             WBO to atom ...
     1  C   3.991        C    2 1.441    C    8 1.419    H   13 0.969    C    6 0.109
     2  C   3.992        C    1 1.441    C    3 1.419    H   14 0.969    C    7 0.109
     3  C   3.988        C    2 1.419    C    6 1.404    C    4 1.006    C    8 0.106
     4  C   3.987        N    5 1.021    C    3 1.006    H   15 0.966    H   16 0.959
     5  N   3.003        C    4 1.021    H   17 0.969    H   18 0.968
     6  C   3.991        C    7 1.457    C    3 1.404    H   19 0.967    C    1 0.109
     7  C   3.991        C    6 1.457    C    8 1.405    H   20 0.968    C    2 0.109
     8  C   3.988        C    1 1.419    C    7 1.405    C    9 1.003    C    3 0.106
     9  C   3.982        N   10 1.003    C    8 1.003    H   22 0.962    H   21 0.956
    10  N   3.318        C   11 1.157    C    9 1.003    H   23 0.947    C   12 0.153
    11  C   3.971        C   12 1.830    N   10 1.157    H   24 0.961
    12  C   3.968        C   11 1.830    H   26 0.979    H   25 0.977    N   10 0.153
    13  H   0.999        C    1 0.969
    14  H   0.999        C    2 0.969
    15  H   1.000        C    4 0.966
    16  H   0.998        C    4 0.959
    17  H   0.981        N    5 0.969
    18  H   0.981        N    5 0.968
    19  H   0.997        C    6 0.967
    20  H   0.998        C    7 0.968
    21  H   0.997        C    9 0.956
    22  H   0.999        C    9 0.962
    23  H   0.978        N   10 0.947
    24  H   0.999        C   11 0.961
    25  H   1.000        C   12 0.977
    26  H   0.999        C   12 0.979

molecular dipole:
                 x           y           z       tot (Debye)
 q only:       -0.016       0.613       0.278
   full:        0.390       0.968       0.236       2.721
molecular quadrupole (traceless):
                xx          xy          yy          xz          yz          zz
 q only:        2.066       0.153      -2.331       1.232      -5.971       0.265
  q+dip:       -0.376      -0.934       2.327       0.681      -6.111      -1.951
   full:       -1.099      -1.145       1.369       0.103      -6.922      -0.270

           -------------------------------------------------
          |                Geometry Summary                 |
           -------------------------------------------------

      molecular mass/u    :      162.2340000
   center of mass at/Å    :        0.1638461      -0.7323432      -0.5347102
  moments of inertia/u·Å² :        0.1920766E+03   0.1359353E+04   0.1493616E+04
rotational constants/cm⁻¹ :        0.8776514E-01   0.1240122E-01   0.1128646E-01

 * 24 selected distances

     #   Z        #   Z                                     value/Å
     1   6 C      2   6 C                                 1.3840077
     2   6 C      3   6 C                                 1.3873510
     4   6 C      5   7 N                                 1.4565205 (max)
     3   6 C      6   6 C                                 1.3898966
     6   6 C      7   6 C                                 1.3810169
     1   6 C      8   6 C                                 1.3872902
     7   6 C      8   6 C                                 1.3901071
     9   6 C     10   7 N                                 1.4447474
    10   7 N     11   6 C                                 1.3744181
    11   6 C     12   6 C                                 1.3286546
     1   6 C     13   1 H                                 1.0813711
     2   6 C     14   1 H                                 1.0814257
     4   6 C     15   1 H                                 1.1042847
     4   6 C     16   1 H                                 1.0971885
     5   7 N     17   1 H                                 1.0151359
     5   7 N     18   1 H                                 1.0138277
     6   6 C     19   1 H                                 1.0788917
     7   6 C     20   1 H                                 1.0800548
     9   6 C     21   1 H                                 1.0972956
     9   6 C     22   1 H                                 1.1035538
    10   7 N     23   1 H                                 1.0112008 (min)
    11   6 C     24   1 H                                 1.0825730
    12   6 C     25   1 H                                 1.0768248
    12   6 C     26   1 H                                 1.0731909

 * 4 distinct bonds (by element types)

   Z      Z             #   av. dist./Å        max./Å        min./Å
   1 H    6 C          11     1.0869686     1.1042847     1.0731909
   6 C    6 C           7     1.3783320     1.3901071     1.3286546
   1 H    7 N           3     1.0133881     1.0151359     1.0112008
   6 C    7 N           3     1.4252287     1.4565205     1.3744181


optimized geometry written to: xtbopt.xyz


           -------------------------------------------------
          | TOTAL ENERGY              -34.340299303843 Eh   |
          | GRADIENT NORM               0.000797974753 Eh/α |
          | HOMO-LUMO GAP               3.259627096211 eV   |
           -------------------------------------------------

------------------------------------------------------------------------
 * finished run on 2021/05/19 at 11:00:47.637     
------------------------------------------------------------------------
 total:
 * wall-time:     0 d,  0 h,  0 min,  1.248 sec
 *  cpu-time:     0 d,  0 h,  0 min,  1.132 sec
 * ratio c/w:     0.907 speedup
 SCF:
 * wall-time:     0 d,  0 h,  0 min,  0.031 sec
 *  cpu-time:     0 d,  0 h,  0 min,  0.031 sec
 * ratio c/w:     1.000 speedup
 ANC optimizer:
 * wall-time:     0 d,  0 h,  0 min,  1.173 sec
 *  cpu-time:     0 d,  0 h,  0 min,  1.082 sec
 * ratio c/w:     0.923 speedup

