      -----------------------------------------------------------      
     |                   =====================                   |     
     |                           x T B                           |     
     |                   =====================                   |     
     |                         S. Grimme                         |     
     |          Mulliken Center for Theoretical Chemistry        |     
     |                    University of Bonn                     |     
     |                Version 6.2 RC2 (SAW190805)                |     
      -----------------------------------------------------------      

   This program is distributed in the hope that it will be useful,
   but WITHOUT ANY WARRANTY; without even the implied warranty of
   MERCHANTABILITY or FITNESS FOR A PARTICULAR PURPOSE.
   
   FOR NON-COMMERCIAL, ACADEMIA USE ONLY.
   
   Cite this work as:
   * S. Grimme, C. Bannwarth, P. Shushkov, J. Chem. Theory Comput., 2017,
     13, 1989-2009. DOI: 10.1021/acs.jctc.7b00118
   * C. Bannwarth, S. Ehlert and S. Grimme., J. Chem. Theory Comput., 2019,
     15, 1652-1671. DOI: 10.1021/acs.jctc.8b01176
   * P. Pracht, E. Caldeweyher, S. Ehlert, S. Grimme, ChemRxiv, 2019, preprint.
     DOI: 10.26434/chemrxiv.8326202.v1
   
   for DFT-D4:
   * E. Caldeweyher, C. Bannwarth and S. Grimme, J. Chem. Phys., 2017,
     147, 034112. DOI: 10.1063/1.4993215
   * E. Caldeweyher, S. Ehlert, A. Hansen, H. Neugebauer, S. Spicher,
     C. Bannwarth and S. Grimme, J. Chem. Phys., 2019, 150, 154122.
     DOI: 10.1063/1.5090222
   
   for sTDA-xTB:
   * S. Grimme and C. Bannwarth, J. Chem. Phys., 2016, 145, 054103.
     DOI: 10.1063/1.4959605
   
   in the mass-spec context:
   * V. Asgeirsson, C. Bauer and S. Grimme, Chem. Sci., 2017, 8, 4879.
     DOI: 10.1039/c7sc00601b
   
   for metadynamics refer to:
   * S. Grimme, J. Chem. Theory Comput., 2019, 155, 2847-2862
     DOI: 10.1021/acs.jctc.9b00143
   
   with help from (in alphabetical order)
   C. Bannwarth, F. Bohle, G. Brandenburg, E. Caldeweyher, M. Checinski,
   S. Dohm, S. Ehlert, S. Ehrlich, F. März, H. Neugebauer, J. Pisarek,
   P. Pracht, P. Shushkov, and S. Spicher.
   
 * started run on 2021/05/19 at 11:00:47.740     

           -------------------------------------------------
          |                Calculation Setup                |
           -------------------------------------------------

          program call               : /ihome/ghutchison/geoffh/xtb/xtb 944.xyz -opt
          hostname                   : smp-n122
          coordinate file            : 944.xyz
          omp threads                :                     1
          number of atoms            :                    30
          number of electrons        :                    72
          charge                     :                     0
          spin                       :                   0.0
          first test random number   :      0.58561310068570


########################################################################
# WARNING! Please study the warnings concerning your input carefully
#  - the use of '-opt' is discouraged, please use '--opt' next time
########################################################################

           ------------------------------------------------- 
          |                 G F N 2 - x T B                 |
          | Geometry, Frequencies, Noncovalent interactions |
          |            JCTC 2019 parametrisation            |
           ------------------------------------------------- 
             KAB for C  - Si     :                1.0500
             KAB for H  - Pd     :                0.9500
             k(s)              :                1.8500
             k(p)              :                2.2300
             k(d)              :                2.2300
             k(f)              :                2.0000
             kEN (H0ij)        :               -2.0000
             D4 a1             :                0.5200
             D4 a2             :                5.0000
             D4 s6             :                1.0000
             D4 s8             :                2.7000
             D4 s9             :                5.0000
             alphaj            :                2.0000

  Z AO/shell   Hii/eV     exponent
  1     Wed Apr 25 08:07:45 CEST 2018   EN: 2.200 GM2: 0.406  GM3: 0.0800  RAES: 1.40
     1s    -10.707211    1.230000
  6     Wed Apr 25 08:07:45 CEST 2018   EN: 2.550 GM2: 0.538  GM3: 0.1500  RAES: 3.00
     2s    -13.970922    2.096432
     2p    -10.063292    1.800000

           ------------------------------------------------- 
          |        Self-Consistent Charge Iterations        |
           ------------------------------------------------- 

          ...................................................
          :                      SETUP                      :
          :.................................................:
          :  # basis functions                  72          :
          :  # atomic orbitals                  72          :
          :  # shells                           44          :
          :  # electrons                        72          :
          :  max. iterations                   250          :
          :  Hamiltonian                  GFN2-xTB          :
          :  restarted?                      false          :
          :  GBSA solvation                  false          :
          :  PC potential                    false          :
          :  electronic temp.          300.0000000     K    :
          :  accuracy                    1.0000000          :
          :  -> integral cutoff          0.2500000E+02      :
          :  -> integral neglect         0.1000000E-07      :
          :  -> SCF convergence          0.1000000E-05 Eh   :
          :  -> wf. convergence          0.1000000E-03 e    :
          :  Broyden damping             0.4000000          :
          ...................................................

 iter      E             dE          RMSdq      gap      omega  full diag
   1    -38.6572652 -0.386573E+02  0.355E+00    3.54       0.0  T
   2    -38.6982714 -0.410062E-01  0.210E+00    3.50       1.0  T
   3    -38.6908511  0.742033E-02  0.846E-01    3.52       1.0  T
   4    -38.6952266 -0.437558E-02  0.525E-01    3.49       1.0  T
   5    -38.7012936 -0.606694E-02  0.815E-02    3.49       1.0  T
   6    -38.7013905 -0.969042E-04  0.562E-02    3.49       1.0  T
   7    -38.7014403 -0.498631E-04  0.232E-02    3.49       1.0  T
   8    -38.7014428 -0.245744E-05  0.366E-03    3.49       5.0  T
   9    -38.7014429 -0.105530E-06  0.166E-03    3.49      11.0  T
  10    -38.7014429 -0.390905E-07  0.885E-04    3.49      20.6  T
  11    -38.7014430 -0.113063E-07  0.260E-04    3.49      70.2  T

   *** convergence criteria satisfied after 11 iterations ***

         #    Occupation            Energy/Eh            Energy/eV
      -------------------------------------------------------------
         1        2.0000           -0.6496066             -17.6767
       ...           ...                  ...                  ...
        30        2.0000           -0.4282948             -11.6545
        31        2.0000           -0.4232146             -11.5163
        32        2.0000           -0.4202410             -11.4353
        33        2.0000           -0.4187988             -11.3961
        34        2.0000           -0.3851476             -10.4804
        35        2.0000           -0.3762399             -10.2380
        36        2.0000           -0.3663082              -9.9678 (HOMO)
        37                         -0.2380419              -6.4775 (LUMO)
        38                         -0.2042137              -5.5569
        39                         -0.1987494              -5.4082
        40                         -0.1378048              -3.7499
        41                          0.0302257               0.8225
       ...                                ...                  ...
        72                          0.6679403              18.1756
      -------------------------------------------------------------
                  HL-Gap            0.1282663 Eh            3.4903 eV
             Fermi-level           -0.3021750 Eh           -8.2226 eV

 SCC (total)                   0 d,  0 h,  0 min,  0.041 sec
 SCC setup                      ...        0 min,  0.000 sec (  0.780%)
 Dispersion                     ...        0 min,  0.000 sec (  1.171%)
 integral evaluation            ...        0 min,  0.010 sec ( 22.992%)
 zeroth order Hamiltonian       ...        0 min,  0.000 sec (  0.468%)
 iterations                     ...        0 min,  0.014 sec ( 34.299%)
 molecular gradient             ...        0 min,  0.016 sec ( 39.288%)
 printout                       ...        0 min,  0.000 sec (  0.888%)

         :::::::::::::::::::::::::::::::::::::::::::::::::::::
         ::                     SUMMARY                     ::
         :::::::::::::::::::::::::::::::::::::::::::::::::::::
         :: total energy             -38.061214298678 Eh    ::
         :: gradient norm              0.049342959392 Eh/a0 ::
         :: HOMO-LUMO gap              3.490302345046 eV    ::
         ::.................................................::
         :: SCC energy               -38.701442956435 Eh    ::
         :: -> isotropic ES            0.003603886107 Eh    ::
         :: -> anisotropic ES          0.007398712545 Eh    ::
         :: -> anisotropic XC          0.025843633087 Eh    ::
         :: -> dispersion             -0.030084674910 Eh    ::
         :: repulsion energy           0.639825802447 Eh    ::
         :: add. restraining           0.000000000000 Eh    ::
         :::::::::::::::::::::::::::::::::::::::::::::::::::::

      ----------------------------------------------------------- 
     |                   =====================                   |
     |                        A N C O P T                        |
     |                   =====================                   |
     |               Approximate Normal Coordinate               |
     |                Rational Function Optimizer                |
      ----------------------------------------------------------- 

          ...................................................
          :                      SETUP                      :
          :.................................................:
          :   optimization level            normal          :
          :   max. optcycles                   200          :
          :   ANC micro-cycles                  20          :
          :   degrees of freedom                84          :
          :.................................................:
          :   RF solver                   davidson          :
          :   input Hessian                  false          :
          :   write xtbopt.log                true          :
          :   linear?                        false          :
          :   energy convergence         0.5000000E-05 Eh   :
          :   grad. convergence          0.1000000E-02 Eh/α :
          :   maximium RF displ.         2.0000000          :
          :   Hlow (freq-cutoff)         0.5000000E-02      :
          :   Hmax (freq-cutoff)         5.0000000          :
          :   S6 in model hess.         20.0000000          :
          ...................................................

generating ANC from model Hessian ...
Using Lindh-Hessian (1995)
 Shifting diagonal of input Hessian by   3.928051961444190E-003
 Lowest  eigenvalues of input Hessian
   -0.000000   -0.000000   -0.000000   -0.000000    0.000000    0.000000
    0.005000    0.005810    0.006895    0.007381    0.008497    0.011477
    0.012647    0.016576    0.017888    0.019644    0.022782    0.025157
 Highest eigenvalues
    1.547449    1.631184    1.751446    1.826057    1.839804    2.027005
 

........................................................................
.............................. CYCLE    1 ..............................
........................................................................
   1    -38.7014430 -0.387014E+02  0.119E-04    3.49       0.0  T
   2    -38.7014430 -0.153833E-10  0.912E-05    3.49     200.2  T
   3    -38.7014430 -0.140560E-09  0.458E-05    3.49     399.0  T
     SCC iter.                  ...        0 min,  0.005 sec
     gradient                   ...        0 min,  0.016 sec
 * total energy  :   -38.0612143 Eh     change       -0.2264940E-07 Eh
   gradient norm :     0.0493433 Eh/α   predicted     0.0000000E+00 (-100.00%)
   displ. norm   :     0.2809238 α      lambda       -0.5014732E-02
   maximum displ.:     0.1345833 α      in ANC's #7, #3, #19, ...

........................................................................
.............................. CYCLE    2 ..............................
........................................................................
   1    -38.7211893 -0.387212E+02  0.147E-01    3.56       0.0  T
   2    -38.7212035 -0.141733E-04  0.880E-02    3.56       1.0  T
   3    -38.7211871  0.163937E-04  0.278E-02    3.56       1.0  T
   4    -38.7212037 -0.165928E-04  0.973E-03    3.56       1.9  T
   5    -38.7212063 -0.256967E-05  0.276E-03    3.56       6.6  T
   6    -38.7212063 -0.584257E-07  0.154E-03    3.56      11.8  T
     SCC iter.                  ...        0 min,  0.007 sec
     gradient                   ...        0 min,  0.015 sec
 * total energy  :   -38.0642834 Eh     change       -0.3069034E-02 Eh
   gradient norm :     0.0139456 Eh/α   predicted    -0.2705252E-02 ( -11.85%)
   displ. norm   :     0.2040747 α      lambda       -0.9033511E-03
   maximum displ.:     0.1274540 α      in ANC's #3, #1, #4, ...

........................................................................
.............................. CYCLE    3 ..............................
........................................................................
   1    -38.7271099 -0.387271E+02  0.860E-02    3.59       0.0  T
   2    -38.7271130 -0.301664E-05  0.515E-02    3.59       1.0  T
   3    -38.7271067  0.625825E-05  0.168E-02    3.59       1.1  T
   4    -38.7271137 -0.696086E-05  0.329E-03    3.59       5.6  T
   5    -38.7271139 -0.215645E-06  0.107E-03    3.59      17.0  T
   6    -38.7271139 -0.335224E-08  0.760E-04    3.59      24.0  T
     SCC iter.                  ...        0 min,  0.008 sec
     gradient                   ...        0 min,  0.015 sec
 * total energy  :   -38.0648755 Eh     change       -0.5921180E-03 Eh
   gradient norm :     0.0047301 Eh/α   predicted    -0.4704970E-03 ( -20.54%)
   displ. norm   :     0.2171306 α      lambda       -0.3967565E-03
   maximum displ.:     0.1496257 α      in ANC's #3, #1, #4, ...

........................................................................
.............................. CYCLE    4 ..............................
........................................................................
   1    -38.7279760 -0.387280E+02  0.829E-02    3.60       0.0  T
   2    -38.7279773 -0.126103E-05  0.493E-02    3.60       1.0  T
   3    -38.7279712  0.610634E-05  0.160E-02    3.60       1.1  T
   4    -38.7279778 -0.663134E-05  0.250E-03    3.60       7.3  T
   5    -38.7279779 -0.120431E-06  0.108E-03    3.60      17.0  T
   6    -38.7279779 -0.141251E-07  0.577E-04    3.60      31.7  T
     SCC iter.                  ...        0 min,  0.007 sec
     gradient                   ...        0 min,  0.015 sec
 * total energy  :   -38.0651720 Eh     change       -0.2965414E-03 Eh
   gradient norm :     0.0048155 Eh/α   predicted    -0.2077468E-03 ( -29.94%)
   displ. norm   :     0.2672675 α      lambda       -0.3477782E-03
   maximum displ.:     0.1765206 α      in ANC's #3, #1, #4, ...

........................................................................
.............................. CYCLE    5 ..............................
........................................................................
   1    -38.7273191 -0.387273E+02  0.100E-01    3.59       0.0  T
   2    -38.7273197 -0.623693E-06  0.594E-02    3.59       1.0  T
   3    -38.7273102  0.946335E-05  0.193E-02    3.59       1.0  T
   4    -38.7273205 -0.102516E-04  0.185E-03    3.59       9.9  T
   5    -38.7273205 -0.348819E-07  0.106E-03    3.59      17.2  T
   6    -38.7273205 -0.372651E-08  0.628E-04    3.59      29.1  T
     SCC iter.                  ...        0 min,  0.007 sec
     gradient                   ...        0 min,  0.015 sec
 * total energy  :   -38.0654489 Eh     change       -0.2768916E-03 Eh
   gradient norm :     0.0052828 Eh/α   predicted    -0.1863106E-03 ( -32.71%)
   displ. norm   :     0.3525768 α      lambda       -0.4078854E-03
   maximum displ.:     0.2239522 α      in ANC's #3, #1, #5, ...

........................................................................
.............................. CYCLE    6 ..............................
........................................................................
   1    -38.7257878 -0.387258E+02  0.127E-01    3.58       0.0  T
   2    -38.7257885 -0.615631E-06  0.748E-02    3.58       1.0  T
   3    -38.7257837  0.474885E-05  0.140E-02    3.58       1.3  T
   4    -38.7257890 -0.532174E-05  0.198E-03    3.58       9.2  T
   5    -38.7257890 -0.176090E-07  0.119E-03    3.58      15.4  T
   6    -38.7257890  0.156938E-09  0.597E-04    3.58      30.6  T
     SCC iter.                  ...        0 min,  0.007 sec
     gradient                   ...        0 min,  0.015 sec
 * total energy  :   -38.0658025 Eh     change       -0.3536290E-03 Eh
   gradient norm :     0.0062293 Eh/α   predicted    -0.2293053E-03 ( -35.16%)
   displ. norm   :     0.4819120 α      lambda       -0.5587516E-03
   maximum displ.:     0.2992329 α      in ANC's #3, #1, #5, ...

........................................................................
.............................. CYCLE    7 ..............................
........................................................................
   1    -38.7237337 -0.387237E+02  0.171E-01    3.56       0.0  T
   2    -38.7237352 -0.146656E-05  0.101E-01    3.56       1.0  T
   3    -38.7237338  0.145181E-05  0.912E-03    3.56       2.0  T
   4    -38.7237357 -0.194443E-05  0.318E-03    3.56       5.7  T
   5    -38.7237359 -0.142749E-06  0.155E-03    3.56      11.8  T
   6    -38.7237358  0.303895E-08  0.802E-04    3.56      22.8  T
     SCC iter.                  ...        0 min,  0.007 sec
     gradient                   ...        0 min,  0.015 sec
 * total energy  :   -38.0662912 Eh     change       -0.4886939E-03 Eh
   gradient norm :     0.0083570 Eh/α   predicted    -0.3442611E-03 ( -29.55%)
   displ. norm   :     0.5876929 α      lambda       -0.7159000E-03
   maximum displ.:     0.3767759 α      in ANC's #1, #3, #5, ...

........................................................................
.............................. CYCLE    8 ..............................
........................................................................
   1    -38.7219079 -0.387219E+02  0.205E-01    3.55       0.0  T
   2    -38.7219104 -0.251600E-05  0.121E-01    3.55       1.0  T
   3    -38.7219103  0.103896E-06  0.666E-03    3.55       2.7  T
   4    -38.7219110 -0.735675E-06  0.347E-03    3.55       5.3  T
   5    -38.7219112 -0.158713E-06  0.184E-03    3.55       9.9  T
   6    -38.7219112 -0.838675E-08  0.693E-04    3.55      26.3  T
     SCC iter.                  ...        0 min,  0.007 sec
     gradient                   ...        0 min,  0.015 sec
 * total energy  :   -38.0668679 Eh     change       -0.5767199E-03 Eh
   gradient norm :     0.0106916 Eh/α   predicted    -0.4815805E-03 ( -16.50%)
   displ. norm   :     0.4891310 α      lambda       -0.7170500E-03
   maximum displ.:     0.3440127 α      in ANC's #1, #3, #5, ...

........................................................................
.............................. CYCLE    9 ..............................
........................................................................
   1    -38.7242097 -0.387242E+02  0.169E-01    3.55       0.0  T
   2    -38.7242112 -0.148335E-05  0.996E-02    3.55       1.0  T
   3    -38.7242068  0.439114E-05  0.137E-02    3.55       1.3  T
   4    -38.7242119 -0.509224E-05  0.307E-03    3.55       6.0  T
   5    -38.7242120 -0.104047E-06  0.161E-03    3.55      11.4  T
   6    -38.7242120  0.891546E-08  0.876E-04    3.55      20.8  T
     SCC iter.                  ...        0 min,  0.007 sec
     gradient                   ...        0 min,  0.015 sec
 * total energy  :   -38.0674325 Eh     change       -0.5645821E-03 Eh
   gradient norm :     0.0091137 Eh/α   predicted    -0.4443056E-03 ( -21.30%)
   displ. norm   :     0.5011409 α      lambda       -0.6508809E-03
   maximum displ.:     0.3818995 α      in ANC's #1, #3, #6, ...

........................................................................
.............................. CYCLE   10 ..............................
........................................................................
   1    -38.7269854 -0.387270E+02  0.173E-01    3.55       0.0  T
   2    -38.7269865 -0.105385E-05  0.102E-01    3.55       1.0  T
   3    -38.7269752  0.113056E-04  0.206E-02    3.55       1.0  T
   4    -38.7269877 -0.125127E-04  0.261E-03    3.55       7.0  T
   5    -38.7269877 -0.256559E-07  0.162E-03    3.55      11.3  T
   6    -38.7269877 -0.629255E-08  0.837E-04    3.55      21.8  T
     SCC iter.                  ...        0 min,  0.007 sec
     gradient                   ...        0 min,  0.029 sec
 * total energy  :   -38.0679560 Eh     change       -0.5234624E-03 Eh
   gradient norm :     0.0065974 Eh/α   predicted    -0.4071771E-03 ( -22.21%)
   displ. norm   :     0.5010206 α      lambda       -0.5990344E-03
   maximum displ.:     0.4143398 α      in ANC's #1, #3, #6, ...

........................................................................
.............................. CYCLE   11 ..............................
........................................................................
   1    -38.7305457 -0.387305E+02  0.172E-01    3.55       0.0  T
   2    -38.7305470 -0.134207E-05  0.101E-01    3.55       1.0  T
   3    -38.7305426  0.444478E-05  0.139E-02    3.55       1.3  T
   4    -38.7305478 -0.525749E-05  0.292E-03    3.55       6.3  T
   5    -38.7305479 -0.682293E-07  0.174E-03    3.55      10.5  T
   6    -38.7305479 -0.135755E-07  0.859E-04    3.55      21.2  T
     SCC iter.                  ...        0 min,  0.021 sec
     gradient                   ...        0 min,  0.029 sec
 * total energy  :   -38.0684195 Eh     change       -0.4635009E-03 Eh
   gradient norm :     0.0057828 Eh/α   predicted    -0.3747084E-03 ( -19.16%)
   displ. norm   :     0.7225501 α      lambda       -0.6646524E-03
   maximum displ.:     0.5954707 α      in ANC's #1, #3, #4, ...

........................................................................
.............................. CYCLE   12 ..............................
........................................................................
   1    -38.7260490 -0.387260E+02  0.241E-01    3.55       0.0  T
   2    -38.7260538 -0.477671E-05  0.142E-01    3.55       1.0  T
   3    -38.7260417  0.121109E-04  0.232E-02    3.55       1.0  T
   4    -38.7260558 -0.140678E-04  0.489E-03    3.55       3.7  T
   5    -38.7260560 -0.274833E-06  0.250E-03    3.55       7.3  T
   6    -38.7260560  0.128718E-07  0.171E-03    3.55      10.7  T
     SCC iter.                  ...        0 min,  0.008 sec
     gradient                   ...        0 min,  0.016 sec
 * total energy  :   -38.0688122 Eh     change       -0.3927428E-03 Eh
   gradient norm :     0.0100083 Eh/α   predicted    -0.5058276E-03 (  28.79%)
   displ. norm   :     0.4172736 α      lambda       -0.6604958E-03
   maximum displ.:     0.3670980 α      in ANC's #1, #6, #5, ...

........................................................................
.............................. CYCLE   13 ..............................
........................................................................
   1    -38.7321472 -0.387321E+02  0.143E-01    3.55       0.0  T
   2    -38.7321493 -0.206788E-05  0.838E-02    3.55       1.0  T
   3    -38.7321451  0.410993E-05  0.132E-02    3.55       1.4  T
   4    -38.7321497 -0.454638E-05  0.382E-03    3.55       4.8  T
   5    -38.7321500 -0.287825E-06  0.142E-03    3.55      12.9  T
   6    -38.7321500  0.340816E-08  0.742E-04    3.55      24.6  T
     SCC iter.                  ...        0 min,  0.007 sec
     gradient                   ...        0 min,  0.015 sec
 * total energy  :   -38.0692540 Eh     change       -0.4417799E-03 Eh
   gradient norm :     0.0103934 Eh/α   predicted    -0.3877486E-03 ( -12.23%)
   displ. norm   :     0.6041695 α      lambda       -0.9155052E-03
   maximum displ.:     0.5297184 α      in ANC's #1, #6, #4, ...

........................................................................
.............................. CYCLE   14 ..............................
........................................................................
   1    -38.7284786 -0.387285E+02  0.203E-01    3.55       0.0  T
   2    -38.7284821 -0.349373E-05  0.120E-01    3.55       1.0  T
   3    -38.7284725  0.959154E-05  0.204E-02    3.55       1.0  T
   4    -38.7284838 -0.112830E-04  0.519E-03    3.55       3.5  T
   5    -38.7284840 -0.228829E-06  0.260E-03    3.55       7.0  T
   6    -38.7284840 -0.241921E-07  0.134E-03    3.55      13.6  T
     SCC iter.                  ...        0 min,  0.007 sec
     gradient                   ...        0 min,  0.015 sec
 * total energy  :   -38.0695713 Eh     change       -0.3173274E-03 Eh
   gradient norm :     0.0151949 Eh/α   predicted    -0.6248430E-03 (  96.91%)
   displ. norm   :     0.4492399 α      lambda       -0.7036838E-03
   maximum displ.:     0.3944631 α      in ANC's #1, #6, #4, ...

........................................................................
.............................. CYCLE   15 ..............................
........................................................................
   1    -38.7255436 -0.387255E+02  0.149E-01    3.54       0.0  T
   2    -38.7255458 -0.222352E-05  0.878E-02    3.54       1.0  T
   3    -38.7255457  0.150264E-06  0.705E-03    3.54       2.6  T
   4    -38.7255464 -0.756715E-06  0.399E-03    3.54       4.6  T
   5    -38.7255466 -0.181624E-06  0.149E-03    3.54      12.2  T
   6    -38.7255466 -0.136026E-07  0.404E-04    3.54      45.2  T
     SCC iter.                  ...        0 min,  0.007 sec
     gradient                   ...        0 min,  0.015 sec
 * total energy  :   -38.0700285 Eh     change       -0.4571068E-03 Eh
   gradient norm :     0.0067614 Eh/α   predicted    -0.4228549E-03 (  -7.49%)
   displ. norm   :     0.2997279 α      lambda       -0.4765882E-03
   maximum displ.:     0.2266013 α      in ANC's #1, #5, #2, ...

........................................................................
.............................. CYCLE   16 ..............................
........................................................................
   1    -38.7334141 -0.387334E+02  0.109E-01    3.55       0.0  T
   2    -38.7334153 -0.120587E-05  0.640E-02    3.55       1.0  T
   3    -38.7334133  0.200452E-05  0.973E-03    3.55       1.9  T
   4    -38.7334158 -0.244170E-05  0.225E-03    3.55       8.1  T
   5    -38.7334158 -0.464532E-07  0.101E-03    3.55      18.1  T
     SCC iter.                  ...        0 min,  0.006 sec
     gradient                   ...        0 min,  0.015 sec
 * total energy  :   -38.0702991 Eh     change       -0.2706618E-03 Eh
   gradient norm :     0.0085107 Eh/α   predicted    -0.2597061E-03 (  -4.05%)
   displ. norm   :     0.6685079 α      lambda       -0.4673151E-03
   maximum displ.:     0.5924753 α      in ANC's #1, #4, #6, ...

........................................................................
.............................. CYCLE   17 ..............................
........................................................................
   1    -38.7269527 -0.387270E+02  0.216E-01    3.53       0.0  T
   2    -38.7269549 -0.211808E-05  0.127E-01    3.53       1.0  T
   3    -38.7269402  0.147041E-04  0.240E-02    3.53       1.0  T
   4    -38.7269568 -0.165883E-04  0.355E-03    3.53       5.1  T
   5    -38.7269568 -0.416146E-07  0.234E-03    3.53       7.8  T
   6    -38.7269568 -0.301178E-07  0.110E-03    3.53      16.6  T
     SCC iter.                  ...        0 min,  0.008 sec
     gradient                   ...        0 min,  0.015 sec
 * total energy  :   -38.0706202 Eh     change       -0.3210706E-03 Eh
   gradient norm :     0.0093099 Eh/α   predicted    -0.3380816E-03 (   5.30%)
   displ. norm   :     0.3468336 α      lambda       -0.4172717E-03
   maximum displ.:     0.2852161 α      in ANC's #1, #5, #2, ...

........................................................................
.............................. CYCLE   18 ..............................
........................................................................
   1    -38.7295007 -0.387295E+02  0.118E-01    3.52       0.0  T
   2    -38.7295018 -0.111150E-05  0.701E-02    3.52       1.0  T
   3    -38.7294951  0.668994E-05  0.167E-02    3.52       1.1  T
   4    -38.7295026 -0.749503E-05  0.256E-03    3.52       7.1  T
   5    -38.7295026 -0.425517E-07  0.157E-03    3.52      11.6  T
   6    -38.7295027 -0.119320E-07  0.832E-04    3.52      21.9  T
     SCC iter.                  ...        0 min,  0.007 sec
     gradient                   ...        0 min,  0.015 sec
 * total energy  :   -38.0708632 Eh     change       -0.2430173E-03 Eh
   gradient norm :     0.0087524 Eh/α   predicted    -0.2337336E-03 (  -3.82%)
   displ. norm   :     0.4400089 α      lambda       -0.3379628E-03
   maximum displ.:     0.3574643 α      in ANC's #1, #5, #4, ...

........................................................................
.............................. CYCLE   19 ..............................
........................................................................
   1    -38.7297675 -0.387298E+02  0.150E-01    3.51       0.0  T
   2    -38.7297693 -0.180578E-05  0.889E-02    3.51       1.0  T
   3    -38.7297378  0.314655E-04  0.352E-02    3.51       1.0  T
   4    -38.7297721 -0.342772E-04  0.333E-03    3.51       5.5  T
   5    -38.7297722 -0.106791E-06  0.226E-03    3.51       8.1  T
   6    -38.7297723 -0.773987E-07  0.942E-04    3.51      19.4  T
     SCC iter.                  ...        0 min,  0.007 sec
     gradient                   ...        0 min,  0.015 sec
 * total energy  :   -38.0710432 Eh     change       -0.1799571E-03 Eh
   gradient norm :     0.0098049 Eh/α   predicted    -0.2016985E-03 (  12.08%)
   displ. norm   :     0.3030751 α      lambda       -0.2558238E-03
   maximum displ.:     0.2333201 α      in ANC's #1, #5, #2, ...

........................................................................
.............................. CYCLE   20 ..............................
........................................................................
   1    -38.7310924 -0.387311E+02  0.108E-01    3.50       0.0  T
   2    -38.7310932 -0.869757E-06  0.636E-02    3.50       1.0  T
   3    -38.7310910  0.227952E-05  0.998E-03    3.50       1.8  T
   4    -38.7310936 -0.264314E-05  0.224E-03    3.50       8.2  T
   5    -38.7310937 -0.520881E-07  0.113E-03    3.50      16.2  T
     SCC iter.                  ...        0 min,  0.006 sec
     gradient                   ...        0 min,  0.015 sec
 * total energy  :   -38.0712154 Eh     change       -0.1722893E-03 Eh
   gradient norm :     0.0063407 Eh/α   predicted    -0.1396624E-03 ( -18.94%)
   displ. norm   :     0.2624568 α      lambda       -0.1891623E-03
   maximum displ.:     0.1918358 α      in ANC's #1, #5, #2, ...
 * RMSD in coord.:     1.3304860 α      energy gain  -0.1000115E-01 Eh

generating ANC from model Hessian ...
Using Lindh-Hessian (1995)
 Shifting diagonal of input Hessian by   3.728629950144333E-003
 Lowest  eigenvalues of input Hessian
   -0.000000   -0.000000   -0.000000   -0.000000    0.000000    0.000000
    0.005000    0.006035    0.006678    0.007356    0.007717    0.010733
    0.013324    0.016736    0.018730    0.019606    0.022217    0.024219
 Highest eigenvalues
    1.560408    1.663870    1.801420    1.899299    1.911536    2.074095
 

........................................................................
.............................. CYCLE   21 ..............................
........................................................................
   1    -38.7341872 -0.387342E+02  0.971E-02    3.51       0.0  T
   2    -38.7341878 -0.611478E-06  0.572E-02    3.51       1.0  T
   3    -38.7341817  0.610475E-05  0.156E-02    3.51       1.2  T
   4    -38.7341884 -0.673103E-05  0.204E-03    3.51       8.9  T
   5    -38.7341884 -0.407723E-07  0.114E-03    3.51      16.0  T
   6    -38.7341884 -0.530103E-08  0.669E-04    3.51      27.3  T
   7    -38.7341884 -0.718487E-08  0.121E-04    3.51     151.5  T
     SCC iter.                  ...        0 min,  0.008 sec
     gradient                   ...        0 min,  0.016 sec
 * total energy  :   -38.0713246 Eh     change       -0.1091541E-03 Eh
   gradient norm :     0.0046519 Eh/α   predicted     0.0000000E+00 (-100.00%)
   displ. norm   :     0.0980271 α      lambda       -0.1340611E-03
   maximum displ.:     0.0597347 α      in ANC's #4, #3, #5, ...

........................................................................
.............................. CYCLE   22 ..............................
........................................................................
   1    -38.7333885 -0.387334E+02  0.566E-02    3.51       0.0  T
   2    -38.7333887 -0.148901E-06  0.335E-02    3.51       1.0  T
   3    -38.7333879  0.742776E-06  0.542E-03    3.51       3.4  T
   4    -38.7333888 -0.847857E-06  0.815E-04    3.51      22.4  T
   5    -38.7333888 -0.511240E-08  0.498E-04    3.51      36.7  T
     SCC iter.                  ...        0 min,  0.006 sec
     gradient                   ...        0 min,  0.015 sec
 * total energy  :   -38.0714147 Eh     change       -0.9006959E-04 Eh
   gradient norm :     0.0016083 Eh/α   predicted    -0.6767673E-04 ( -24.86%)
   displ. norm   :     0.1023000 α      lambda       -0.4379501E-04
   maximum displ.:     0.0535347 α      in ANC's #4, #5, #3, ...

........................................................................
.............................. CYCLE   23 ..............................
........................................................................
   1    -38.7329190 -0.387329E+02  0.518E-02    3.52       0.0  T
   2    -38.7329191 -0.138708E-06  0.307E-02    3.52       1.0  T
   3    -38.7329180  0.114454E-05  0.646E-03    3.52       2.8  T
   4    -38.7329193 -0.127730E-05  0.764E-04    3.52      23.9  T
   5    -38.7329193 -0.580820E-08  0.464E-04    3.52      39.3  T
   6    -38.7329193 -0.216514E-08  0.206E-04    3.52      88.6  T
     SCC iter.                  ...        0 min,  0.007 sec
     gradient                   ...        0 min,  0.016 sec
 * total energy  :   -38.0714530 Eh     change       -0.3837557E-04 Eh
   gradient norm :     0.0018130 Eh/α   predicted    -0.2200023E-04 ( -42.67%)
   displ. norm   :     0.0861585 α      lambda       -0.2015939E-04
   maximum displ.:     0.0490198 α      in ANC's #1, #5, #4, ...

........................................................................
.............................. CYCLE   24 ..............................
........................................................................
   1    -38.7332456 -0.387332E+02  0.408E-02    3.52       0.0  T
   2    -38.7332457 -0.643118E-07  0.241E-02    3.52       1.0  T
   3    -38.7332455  0.216607E-06  0.304E-03    3.52       6.0  T
   4    -38.7332457 -0.255703E-06  0.497E-04    3.52      36.7  T
   5    -38.7332457 -0.213791E-08  0.297E-04    3.52      61.4  T
     SCC iter.                  ...        0 min,  0.006 sec
     gradient                   ...        0 min,  0.016 sec
 * total energy  :   -38.0714744 Eh     change       -0.2131919E-04 Eh
   gradient norm :     0.0010870 Eh/α   predicted    -0.1011609E-04 ( -52.55%)
   displ. norm   :     0.1058075 α      lambda       -0.1986157E-04
   maximum displ.:     0.0717801 α      in ANC's #1, #5, #3, ...

........................................................................
.............................. CYCLE   25 ..............................
........................................................................
   1    -38.7336703 -0.387337E+02  0.480E-02    3.51       0.0  T
   2    -38.7336704 -0.903281E-07  0.283E-02    3.51       1.0  T
   3    -38.7336702  0.135677E-06  0.270E-03    3.51       6.8  T
   4    -38.7336704 -0.180675E-06  0.626E-04    3.51      29.1  T
   5    -38.7336704 -0.210697E-08  0.375E-04    3.51      48.7  T
     SCC iter.                  ...        0 min,  0.006 sec
     gradient                   ...        0 min,  0.016 sec
 * total energy  :   -38.0714930 Eh     change       -0.1863504E-04 Eh
   gradient norm :     0.0013069 Eh/α   predicted    -0.9980491E-05 ( -46.44%)
   displ. norm   :     0.0953801 α      lambda       -0.1789625E-04
   maximum displ.:     0.0739088 α      in ANC's #1, #5, #3, ...

........................................................................
.............................. CYCLE   26 ..............................
........................................................................
   1    -38.7338519 -0.387339E+02  0.386E-02    3.51       0.0  T
   2    -38.7338520 -0.467778E-07  0.228E-02    3.51       1.0  T
   3    -38.7338516  0.372527E-06  0.384E-03    3.51       4.8  T
   4    -38.7338520 -0.419792E-06  0.511E-04    3.51      35.7  T
   5    -38.7338520  0.109701E-09  0.299E-04    3.51      61.0  T
     SCC iter.                  ...        0 min,  0.006 sec
     gradient                   ...        0 min,  0.016 sec
 * total energy  :   -38.0715131 Eh     change       -0.2014538E-04 Eh
   gradient norm :     0.0014187 Eh/α   predicted    -0.8988971E-05 ( -55.38%)
   displ. norm   :     0.0745530 α      lambda       -0.1439170E-04
   maximum displ.:     0.0609738 α      in ANC's #1, #2, #6, ...

........................................................................
.............................. CYCLE   27 ..............................
........................................................................
   1    -38.7337825 -0.387338E+02  0.267E-02    3.51       0.0  T
   2    -38.7337825 -0.280484E-07  0.158E-02    3.51       1.2  T
   3    -38.7337820  0.480536E-06  0.427E-03    3.51       4.3  T
   4    -38.7337825 -0.525437E-06  0.428E-04    3.51      42.7  T
   5    -38.7337825 -0.637144E-09  0.292E-04    3.51      62.6  T
     SCC iter.                  ...        0 min,  0.006 sec
     gradient                   ...        0 min,  0.016 sec
 * total energy  :   -38.0715316 Eh     change       -0.1843519E-04 Eh
   gradient norm :     0.0008596 Eh/α   predicted    -0.7214297E-05 ( -60.87%)
   displ. norm   :     0.0822261 α      lambda       -0.1361707E-04
   maximum displ.:     0.0655176 α      in ANC's #1, #6, #2, ...

........................................................................
.............................. CYCLE   28 ..............................
........................................................................
   1    -38.7335900 -0.387336E+02  0.285E-02    3.51       0.0  T
   2    -38.7335900 -0.429608E-07  0.168E-02    3.51       1.1  T
   3    -38.7335898  0.265067E-06  0.341E-03    3.51       5.4  T
   4    -38.7335901 -0.301819E-06  0.405E-04    3.51      45.1  T
   5    -38.7335901 -0.648669E-09  0.212E-04    3.51      86.0  T
     SCC iter.                  ...        0 min,  0.006 sec
     gradient                   ...        0 min,  0.016 sec
 * total energy  :   -38.0715490 Eh     change       -0.1738701E-04 Eh
   gradient norm :     0.0007011 Eh/α   predicted    -0.6829352E-05 ( -60.72%)
   displ. norm   :     0.0821930 α      lambda       -0.1083786E-04
   maximum displ.:     0.0659990 α      in ANC's #1, #6, #3, ...

........................................................................
.............................. CYCLE   29 ..............................
........................................................................
   1    -38.7334822 -0.387335E+02  0.281E-02    3.51       0.0  T
   2    -38.7334823 -0.388082E-07  0.166E-02    3.51       1.1  T
   3    -38.7334822  0.808172E-07  0.201E-03    3.51       9.1  T
   4    -38.7334823 -0.101225E-06  0.433E-04    3.51      42.2  T
   5    -38.7334823 -0.121467E-08  0.235E-04    3.51      77.7  T
     SCC iter.                  ...        0 min,  0.006 sec
     gradient                   ...        0 min,  0.016 sec
 * total energy  :   -38.0715629 Eh     change       -0.1397233E-04 Eh
   gradient norm :     0.0007071 Eh/α   predicted    -0.5440203E-05 ( -61.06%)
   displ. norm   :     0.0722389 α      lambda       -0.8177770E-05
   maximum displ.:     0.0584052 α      in ANC's #1, #3, #6, ...

........................................................................
.............................. CYCLE   30 ..............................
........................................................................
   1    -38.7335200 -0.387335E+02  0.255E-02    3.51       0.0  T
   2    -38.7335201 -0.296752E-07  0.150E-02    3.51       1.2  T
   3    -38.7335201 -0.661004E-09  0.773E-04    3.51      23.6  T
   4    -38.7335201 -0.107656E-07  0.374E-04    3.51      48.9  T
     SCC iter.                  ...        0 min,  0.005 sec
     gradient                   ...        0 min,  0.016 sec
 * total energy  :   -38.0715738 Eh     change       -0.1090662E-04 Eh
   gradient norm :     0.0005197 Eh/α   predicted    -0.4103345E-05 ( -62.38%)
   displ. norm   :     0.0636933 α      lambda       -0.6715019E-05
   maximum displ.:     0.0521044 α      in ANC's #1, #3, #6, ...

........................................................................
.............................. CYCLE   31 ..............................
........................................................................
   1    -38.7335925 -0.387336E+02  0.226E-02    3.51       0.0  T
   2    -38.7335925 -0.236941E-07  0.134E-02    3.51       1.4  T
   3    -38.7335925  0.280901E-07  0.124E-03    3.51      14.8  T
   4    -38.7335925 -0.386474E-07  0.383E-04    3.51      47.6  T
   5    -38.7335925 -0.137305E-08  0.210E-04    3.51      87.1  T
     SCC iter.                  ...        0 min,  0.006 sec
     gradient                   ...        0 min,  0.016 sec
 * total energy  :   -38.0715831 Eh     change       -0.9248196E-05 Eh
   gradient norm :     0.0003934 Eh/α   predicted    -0.3364962E-05 ( -63.61%)
   displ. norm   :     0.0626916 α      lambda       -0.4360076E-05
   maximum displ.:     0.0508856 α      in ANC's #1, #3, #6, ...

........................................................................
.............................. CYCLE   32 ..............................
........................................................................
   1    -38.7336201 -0.387336E+02  0.223E-02    3.51       0.0  T
   2    -38.7336201 -0.238446E-07  0.132E-02    3.51       1.4  T
   3    -38.7336201  0.255602E-07  0.120E-03    3.51      15.2  T
   4    -38.7336202 -0.361350E-07  0.367E-04    3.51      49.8  T
   5    -38.7336202 -0.111310E-08  0.204E-04    3.51      89.4  T
     SCC iter.                  ...        0 min,  0.006 sec
     gradient                   ...        0 min,  0.016 sec
 * total energy  :   -38.0715904 Eh     change       -0.7353651E-05 Eh
   gradient norm :     0.0006606 Eh/α   predicted    -0.2187094E-05 ( -70.26%)
   displ. norm   :     0.0529321 α      lambda       -0.5242939E-05
   maximum displ.:     0.0441227 α      in ANC's #1, #3, #6, ...

........................................................................
.............................. CYCLE   33 ..............................
........................................................................
   1    -38.7337238 -0.387337E+02  0.193E-02    3.51       0.0  T
   2    -38.7337238 -0.133461E-07  0.114E-02    3.51       1.6  T
   3    -38.7337237  0.440488E-07  0.139E-03    3.51      13.1  T
   4    -38.7337238 -0.533872E-07  0.277E-04    3.51      66.0  T
   5    -38.7337238 -0.130157E-09  0.169E-04    3.51     107.8  T
     SCC iter.                  ...        0 min,  0.006 sec
     gradient                   ...        0 min,  0.016 sec
 * total energy  :   -38.0715977 Eh     change       -0.7293670E-05 Eh
   gradient norm :     0.0005635 Eh/α   predicted    -0.2628369E-05 ( -63.96%)
   displ. norm   :     0.0469497 α      lambda       -0.4878438E-05
   maximum displ.:     0.0402920 α      in ANC's #1, #3, #5, ...

........................................................................
.............................. CYCLE   34 ..............................
........................................................................
   1    -38.7338001 -0.387338E+02  0.166E-02    3.51       0.0  T
   2    -38.7338001 -0.100229E-07  0.977E-03    3.51       1.9  T
   3    -38.7338001  0.612736E-07  0.156E-03    3.51      11.7  T
   4    -38.7338001 -0.702695E-07  0.243E-04    3.51      75.0  T
   5    -38.7338001 -0.519478E-10  0.162E-04    3.51     112.4  T
     SCC iter.                  ...        0 min,  0.006 sec
     gradient                   ...        0 min,  0.016 sec
 * total energy  :   -38.0716044 Eh     change       -0.6697701E-05 Eh
   gradient norm :     0.0003780 Eh/α   predicted    -0.2442576E-05 ( -63.53%)
   displ. norm   :     0.0479937 α      lambda       -0.3438601E-05
   maximum displ.:     0.0415046 α      in ANC's #1, #3, #5, ...

........................................................................
.............................. CYCLE   35 ..............................
........................................................................
   1    -38.7338353 -0.387338E+02  0.169E-02    3.50       0.0  T
   2    -38.7338353 -0.104374E-07  0.996E-03    3.50       1.8  T
   3    -38.7338353  0.711466E-07  0.170E-03    3.50      10.8  T
   4    -38.7338354 -0.811412E-07  0.252E-04    3.50      72.5  T
   5    -38.7338354 -0.246132E-10  0.179E-04    3.50     102.2  T
     SCC iter.                  ...        0 min,  0.006 sec
     gradient                   ...        0 min,  0.016 sec
 * total energy  :   -38.0716101 Eh     change       -0.5614765E-05 Eh
   gradient norm :     0.0004430 Eh/α   predicted    -0.1724337E-05 ( -69.29%)
   displ. norm   :     0.0486526 α      lambda       -0.2067126E-05
   maximum displ.:     0.0422657 α      in ANC's #1, #3, #5, ...

........................................................................
.............................. CYCLE   36 ..............................
........................................................................
   1    -38.7338316 -0.387338E+02  0.171E-02    3.50       0.0  T
   2    -38.7338316 -0.106580E-07  0.101E-02    3.50       1.8  T
   3    -38.7338316  0.724129E-07  0.171E-03    3.50      10.7  T
   4    -38.7338317 -0.826156E-07  0.255E-04    3.50      71.7  T
   5    -38.7338317 -0.155893E-10  0.180E-04    3.50     101.2  T
     SCC iter.                  ...        0 min,  0.006 sec
     gradient                   ...        0 min,  0.016 sec
 * total energy  :   -38.0716145 Eh     change       -0.4452600E-05 Eh
   gradient norm :     0.0006926 Eh/α   predicted    -0.1035948E-05 ( -76.73%)
   displ. norm   :     0.0481177 α      lambda       -0.6556833E-06
   maximum displ.:     0.0416500 α      in ANC's #1, #3, #5, ...

   *** GEOMETRY OPTIMIZATION CONVERGED AFTER 36 ITERATIONS ***

------------------------------------------------------------------------
 total energy gain   :        -0.0104002 Eh       -6.5262 kcal/mol
 total RMSD          :         1.4849402 a0        0.7858 Å
 total power (kW/mol):        -0.7584929 (step)  -21.4826 (real)
------------------------------------------------------------------------

 ANCopt (total)                0 d,  0 h,  0 min,  1.271 sec
 optimizer setup                ...        0 min,  0.000 sec (  0.011%)
 model hessian                  ...        0 min,  0.046 sec (  3.639%)
 ANC generation                 ...        0 min,  0.002 sec (  0.142%)
 coordinate transformation      ...        0 min,  0.001 sec (  0.054%)
 single point calculation       ...        0 min,  1.209 sec ( 95.151%)
 optimization log               ...        0 min,  0.004 sec (  0.299%)
 hessian update                 ...        0 min,  0.001 sec (  0.040%)
 rational function              ...        0 min,  0.006 sec (  0.471%)

================
 final structure:
================
$coord
    1.64196804988994    1.18062806260966    0.80691869443625      C 
    3.54251384776185   -0.34204797057172    0.26601881846993      C 
    5.72749565552762    1.06287018109392   -0.88292501788073      C 
    4.66710997277849    3.74288322653657   -1.39468940882351      C 
    2.18940413165535    3.87281507388618    0.13882927418446      C 
    6.77375399887283    5.60400213325214   -0.64005375742167      C 
    8.34492308026776    4.18172661565996    1.35835555367861      C 
    7.36158325367311    5.24180934140353    3.81068005444040      C 
    6.02394074085317    7.32050983903255    3.44236010717484      C 
    5.87813765536018    8.01955763884729    0.69491083951894      C 
    7.89211668880597    1.41222482330747    0.94023613720372      C 
    9.26809653528121   -0.40129686453114    2.03014732394959      C 
    8.99987871579670   -3.08372580600175    1.61623647073896      C 
   10.25457006326018   -4.81957513495837    2.93075841321185      C 
   -0.11418669998631    0.64444348809590    1.68462708638115      H 
    3.61839354052650   -2.34032204259712    0.62864691513425      H 
    6.40462069478986    0.13594351822978   -2.60483905397080      H 
    4.21312164661796    3.97023804771193   -3.39616080587013      H 
    0.65424437481262    4.72378123681749   -0.94462713375062      H 
    2.41227075398465    4.95450731765361    1.88042325129940      H 
    7.90301670722048    6.04303312929482   -2.31074816859295      H 
   10.37214616691526    4.59280791630301    1.22439950897128      H 
    7.78306147767910    4.35680333966311    5.59160798024859      H 
    5.15384782099063    8.46365862769942    4.88469112046744      H 
    7.17154432217571    9.58564521147091    0.30675169691935      H 
    3.99569745066712    8.61186460042759    0.10460355134498      H 
   10.74519733866634    0.14519580452659    3.33938142690914      H 
    7.72509480553767   -3.66438885640903    0.12991268318768      H 
   11.53639697301950   -4.30290817417465    4.42662633319994      H 
   10.03995182237772   -6.81002065350834    2.57346990709515      H 
$end
           -------------------------------------------------
          |                Final Singlepoint                |
           -------------------------------------------------

          ...................................................
          :                      SETUP                      :
          :.................................................:
          :  # basis functions                  72          :
          :  # atomic orbitals                  72          :
          :  # shells                           44          :
          :  # electrons                        72          :
          :  max. iterations                   250          :
          :  Hamiltonian                  GFN2-xTB          :
          :  restarted?                      false          :
          :  GBSA solvation                  false          :
          :  PC potential                    false          :
          :  electronic temp.          300.0000000     K    :
          :  accuracy                    1.0000000          :
          :  -> integral cutoff          0.2500000E+02      :
          :  -> integral neglect         0.1000000E-07      :
          :  -> SCF convergence          0.1000000E-05 Eh   :
          :  -> wf. convergence          0.1000000E-03 e    :
          :  Broyden damping             0.4000000          :
          ...................................................

 iter      E             dE          RMSdq      gap      omega  full diag
   1    -38.7338317 -0.387338E+02  0.865E-05    3.50       0.0  T
   2    -38.7338317  0.335376E-11  0.516E-05    3.50     353.9  T
   3    -38.7338317 -0.819114E-10  0.357E-05    3.50     511.7  T

   *** convergence criteria satisfied after 3 iterations ***

         #    Occupation            Energy/Eh            Energy/eV
      -------------------------------------------------------------
         1        2.0000           -0.6498660             -17.6838
       ...           ...                  ...                  ...
        30        2.0000           -0.4280196             -11.6470
        31        2.0000           -0.4248526             -11.5608
        32        2.0000           -0.4238750             -11.5342
        33        2.0000           -0.4183217             -11.3831
        34        2.0000           -0.3848406             -10.4720
        35        2.0000           -0.3801468             -10.3443
        36        2.0000           -0.3663145              -9.9679 (HOMO)
        37                         -0.2375698              -6.4646 (LUMO)
        38                         -0.1991279              -5.4185
        39                         -0.1928624              -5.2481
        40                         -0.1340629              -3.6480
        41                          0.0326231               0.8877
       ...                                ...                  ...
        72                          0.6930898              18.8599
      -------------------------------------------------------------
                  HL-Gap            0.1287447 Eh            3.5033 eV
             Fermi-level           -0.3019422 Eh           -8.2163 eV

 SCC (total)                   0 d,  0 h,  0 min,  0.031 sec
 SCC setup                      ...        0 min,  0.000 sec (  0.733%)
 Dispersion                     ...        0 min,  0.000 sec (  0.892%)
 integral evaluation            ...        0 min,  0.009 sec ( 29.693%)
 zeroth order Hamiltonian       ...        0 min,  0.000 sec (  0.565%)
 iterations                     ...        0 min,  0.004 sec ( 14.148%)
 molecular gradient             ...        0 min,  0.016 sec ( 52.602%)
 printout                       ...        0 min,  0.000 sec (  1.219%)

         :::::::::::::::::::::::::::::::::::::::::::::::::::::
         ::                     SUMMARY                     ::
         :::::::::::::::::::::::::::::::::::::::::::::::::::::
         :: total energy             -38.071614497072 Eh    ::
         :: gradient norm              0.000692834879 Eh/a0 ::
         :: HOMO-LUMO gap              3.503321670359 eV    ::
         ::.................................................::
         :: SCC energy               -38.733831656270 Eh    ::
         :: -> isotropic ES            0.003720751028 Eh    ::
         :: -> anisotropic ES          0.006667822707 Eh    ::
         :: -> anisotropic XC          0.025196556773 Eh    ::
         :: -> dispersion             -0.030517135502 Eh    ::
         :: repulsion energy           0.661904784704 Eh    ::
         :: add. restraining           0.000000000000 Eh    ::
         :::::::::::::::::::::::::::::::::::::::::::::::::::::

           -------------------------------------------------
          |                Property Printout                |
           -------------------------------------------------

    * Orbital Energies and Occupations

         #    Occupation            Energy/Eh            Energy/eV
      -------------------------------------------------------------
         1        2.0000           -0.6498660             -17.6838
       ...           ...                  ...                  ...
        24        2.0000           -0.4560212             -12.4090
        25        2.0000           -0.4495745             -12.2335
        26        2.0000           -0.4435539             -12.0697
        27        2.0000           -0.4376701             -11.9096
        28        2.0000           -0.4368850             -11.8882
        29        2.0000           -0.4336549             -11.8003
        30        2.0000           -0.4280196             -11.6470
        31        2.0000           -0.4248526             -11.5608
        32        2.0000           -0.4238750             -11.5342
        33        2.0000           -0.4183217             -11.3831
        34        2.0000           -0.3848406             -10.4720
        35        2.0000           -0.3801468             -10.3443
        36        2.0000           -0.3663145              -9.9679 (HOMO)
        37                         -0.2375698              -6.4646 (LUMO)
        38                         -0.1991279              -5.4185
        39                         -0.1928624              -5.2481
        40                         -0.1340629              -3.6480
        41                          0.0326231               0.8877
        42                          0.0462643               1.2589
        43                          0.0583559               1.5879
        44                          0.0813711               2.2142
        45                          0.0940068               2.5581
        46                          0.1069278               2.9097
        47                          0.1125040               3.0614
       ...                                ...                  ...
        72                          0.6930898              18.8599
      -------------------------------------------------------------
                  HL-Gap            0.1287447 Eh            3.5033 eV
             Fermi-level           -0.3019422 Eh           -8.2163 eV

     #   Z        covCN         q      C6AA      α(0)
     1   6 C      2.935    -0.039    28.979     8.829
     2   6 C      2.936    -0.040    28.995     8.831
     3   6 C      3.908    -0.020    20.865     6.493
     4   6 C      3.895    -0.022    20.918     6.502
     5   6 C      3.841    -0.060    21.627     6.616
     6   6 C      3.904    -0.021    20.891     6.497
     7   6 C      3.915    -0.023    20.914     6.500
     8   6 C      2.939    -0.036    28.894     8.816
     9   6 C      2.940    -0.039    28.976     8.828
    10   6 C      3.843    -0.058    21.589     6.610
    11   6 C      2.963     0.007    27.851     8.656
    12   6 C      2.900    -0.053    29.319     8.878
    13   6 C      2.891    -0.025    28.633     8.773
    14   6 C      2.842    -0.092    30.306     9.022
    15   1 H      0.926     0.026     2.640     2.541
    16   1 H      0.926     0.030     2.589     2.516
    17   1 H      0.924     0.037     2.488     2.466
    18   1 H      0.924     0.024     2.679     2.560
    19   1 H      0.924     0.031     2.577     2.510
    20   1 H      0.924     0.053     2.289     2.366
    21   1 H      0.924     0.024     2.670     2.555
    22   1 H      0.924     0.039     2.457     2.451
    23   1 H      0.926     0.029     2.594     2.519
    24   1 H      0.926     0.026     2.643     2.542
    25   1 H      0.924     0.038     2.478     2.462
    26   1 H      0.925     0.040     2.452     2.449
    27   1 H      0.925     0.030     2.589     2.516
    28   1 H      0.926     0.032     2.552     2.498
    29   1 H      0.926     0.033     2.541     2.493
    30   1 H      0.926     0.030     2.592     2.517

 Mol. C6AA /au·bohr⁶  :       9231.570057
 Mol. C8AA /au·bohr⁸  :     219203.477663
 Mol. α(0) /au        :        149.811792


Wiberg/Mayer (AO) data.
largest (>0.10) Wiberg bond orders for each atom
          total WBO             WBO to atom ...
     1  C   3.989        C    2 1.924    C    5 1.024    H   15 0.969
     2  C   3.987        C    1 1.924    C    3 0.998    H   16 0.967
     3  C   3.996        C    2 0.998    C   11 0.984    C    4 0.977    H   17 0.947
     4  C   3.994        C    5 0.993    C    6 0.987    C    3 0.977    H   18 0.977
     5  C   3.997        C    1 1.024    C    4 0.993    H   19 0.970    H   20 0.950
     6  C   3.994        C   10 0.994    C    4 0.987    C    7 0.978    H   21 0.975
     7  C   3.995        C   11 0.996    C    8 0.991    C    6 0.978    H   22 0.943
     8  C   3.983        C    9 1.923    C    7 0.991    H   23 0.970
     9  C   3.988        C    8 1.923    C   10 1.021    H   24 0.969
    10  C   3.997        C    9 1.021    C    6 0.994    H   26 0.968    H   25 0.960
    11  C   3.984        C   12 1.786    C    7 0.996    C    3 0.984    C   14 0.132
    12  C   3.988        C   11 1.786    C   13 1.129    H   27 0.961
    13  C   3.992        C   14 1.874    C   12 1.129    H   28 0.962
    14  C   3.983        C   13 1.874    H   30 0.980    H   29 0.977    C   11 0.132
    15  H   0.999        C    1 0.969
    16  H   0.999        C    2 0.967
    17  H   0.999        C    3 0.947
    18  H   0.999        C    4 0.977
    19  H   0.999        C    5 0.970
    20  H   0.997        C    5 0.950
    21  H   0.999        C    6 0.975
    22  H   0.998        C    7 0.943
    23  H   0.999        C    8 0.970
    24  H   0.997        C    9 0.969
    25  H   0.998        C   10 0.960
    26  H   0.998        C   10 0.968
    27  H   0.999        C   12 0.961
    28  H   0.999        C   13 0.962
    29  H   0.999        C   14 0.977
    30  H   0.998        C   14 0.980

molecular dipole:
                 x           y           z       tot (Debye)
 q only:       -0.102       0.401      -0.161
   full:       -0.077       0.425      -0.159       1.171
molecular quadrupole (traceless):
                xx          xy          yy          xz          yz          zz
 q only:       -2.278       3.790       2.963      -1.783       0.212      -0.684
  q+dip:       -2.512       2.566       4.006      -0.372      -0.233      -1.494
   full:       -2.169       3.773       3.105      -1.257       0.107      -0.936

           -------------------------------------------------
          |                Geometry Summary                 |
           -------------------------------------------------

      molecular mass/u    :      184.2804000
   center of mass at/Å    :        3.3429914       1.2511240       0.5721260
  moments of inertia/u·Å² :        0.4204835E+03   0.8889025E+03   0.1115294E+04
rotational constants/cm⁻¹ :        0.4009106E-01   0.1896455E-01   0.1511497E-01

 * 24 selected distances

     #   Z        #   Z                                     value/Å
     1   6 C      2   6 C                                 1.3201026
     4   6 C      5   6 C                                 1.5434921 (max)
     4   6 C      6   6 C                                 1.5401865
     6   6 C      7   6 C                                 1.5414489
     8   6 C      9   6 C                                 1.3225137
     6   6 C     10   6 C                                 1.5354502
    11   6 C     12   6 C                                 1.3355922
    13   6 C     14   6 C                                 1.3298458
     1   6 C     15   1 H                                 1.0769694
     2   6 C     16   1 H                                 1.0754616 (min)
     3   6 C     17   1 H                                 1.0951130
     4   6 C     18   1 H                                 1.0926816
     5   6 C     19   1 H                                 1.0915346
     5   6 C     20   1 H                                 1.0912961
     6   6 C     21   1 H                                 1.0921073
     7   6 C     22   1 H                                 1.0968870
     8   6 C     23   1 H                                 1.0757516
     9   6 C     24   1 H                                 1.0772585
    10   6 C     25   1 H                                 1.0942841
    10   6 C     26   1 H                                 1.0900116
    12   6 C     27   1 H                                 1.0837900
    13   6 C     28   1 H                                 1.0807922
    14   6 C     29   1 H                                 1.0777102
    14   6 C     30   1 H                                 1.0761427

 * 2 distinct bonds (by element types)

   Z      Z             #   av. dist./Å        max./Å        min./Å
   1 H    6 C          16     1.0854870     1.0968870     1.0754616
   6 C    6 C           8     1.4335790     1.5434921     1.3201026


optimized geometry written to: xtbopt.xyz


           -------------------------------------------------
          | TOTAL ENERGY              -38.071614497072 Eh   |
          | GRADIENT NORM               0.000692834879 Eh/α |
          | HOMO-LUMO GAP               3.503321670359 eV   |
           -------------------------------------------------

------------------------------------------------------------------------
 * finished run on 2021/05/19 at 11:00:49.105     
------------------------------------------------------------------------
 total:
 * wall-time:     0 d,  0 h,  0 min,  1.365 sec
 *  cpu-time:     0 d,  0 h,  0 min,  1.317 sec
 * ratio c/w:     0.965 speedup
 SCF:
 * wall-time:     0 d,  0 h,  0 min,  0.042 sec
 *  cpu-time:     0 d,  0 h,  0 min,  0.042 sec
 * ratio c/w:     1.000 speedup
 ANC optimizer:
 * wall-time:     0 d,  0 h,  0 min,  1.302 sec
 *  cpu-time:     0 d,  0 h,  0 min,  1.254 sec
 * ratio c/w:     0.963 speedup

