      -----------------------------------------------------------      
     |                   =====================                   |     
     |                           x T B                           |     
     |                   =====================                   |     
     |                         S. Grimme                         |     
     |          Mulliken Center for Theoretical Chemistry        |     
     |                    University of Bonn                     |     
     |                Version 6.2 RC2 (SAW190805)                |     
      -----------------------------------------------------------      

   This program is distributed in the hope that it will be useful,
   but WITHOUT ANY WARRANTY; without even the implied warranty of
   MERCHANTABILITY or FITNESS FOR A PARTICULAR PURPOSE.
   
   FOR NON-COMMERCIAL, ACADEMIA USE ONLY.
   
   Cite this work as:
   * S. Grimme, C. Bannwarth, P. Shushkov, J. Chem. Theory Comput., 2017,
     13, 1989-2009. DOI: 10.1021/acs.jctc.7b00118
   * C. Bannwarth, S. Ehlert and S. Grimme., J. Chem. Theory Comput., 2019,
     15, 1652-1671. DOI: 10.1021/acs.jctc.8b01176
   * P. Pracht, E. Caldeweyher, S. Ehlert, S. Grimme, ChemRxiv, 2019, preprint.
     DOI: 10.26434/chemrxiv.8326202.v1
   
   for DFT-D4:
   * E. Caldeweyher, C. Bannwarth and S. Grimme, J. Chem. Phys., 2017,
     147, 034112. DOI: 10.1063/1.4993215
   * E. Caldeweyher, S. Ehlert, A. Hansen, H. Neugebauer, S. Spicher,
     C. Bannwarth and S. Grimme, J. Chem. Phys., 2019, 150, 154122.
     DOI: 10.1063/1.5090222
   
   for sTDA-xTB:
   * S. Grimme and C. Bannwarth, J. Chem. Phys., 2016, 145, 054103.
     DOI: 10.1063/1.4959605
   
   in the mass-spec context:
   * V. Asgeirsson, C. Bauer and S. Grimme, Chem. Sci., 2017, 8, 4879.
     DOI: 10.1039/c7sc00601b
   
   for metadynamics refer to:
   * S. Grimme, J. Chem. Theory Comput., 2019, 155, 2847-2862
     DOI: 10.1021/acs.jctc.9b00143
   
   with help from (in alphabetical order)
   C. Bannwarth, F. Bohle, G. Brandenburg, E. Caldeweyher, M. Checinski,
   S. Dohm, S. Ehlert, S. Ehrlich, F. März, H. Neugebauer, J. Pisarek,
   P. Pracht, P. Shushkov, and S. Spicher.
   
 * started run on 2021/05/19 at 11:00:51.703     

           -------------------------------------------------
          |                Calculation Setup                |
           -------------------------------------------------

          program call               : /ihome/ghutchison/geoffh/xtb/xtb 949.xyz -opt
          hostname                   : smp-n122
          coordinate file            : 949.xyz
          omp threads                :                     1
          number of atoms            :                    27
          number of electrons        :                    90
          charge                     :                     0
          spin                       :                   0.0
          first test random number   :      0.61803837843857


########################################################################
# WARNING! Please study the warnings concerning your input carefully
#  - the use of '-opt' is discouraged, please use '--opt' next time
########################################################################

           ------------------------------------------------- 
          |                 G F N 2 - x T B                 |
          | Geometry, Frequencies, Noncovalent interactions |
          |            JCTC 2019 parametrisation            |
           ------------------------------------------------- 
             KAB for C  - Si     :                1.0500
             KAB for H  - Pd     :                0.9500
             k(s)              :                1.8500
             k(p)              :                2.2300
             k(d)              :                2.2300
             k(f)              :                2.0000
             kEN (H0ij)        :               -2.0000
             D4 a1             :                0.5200
             D4 a2             :                5.0000
             D4 s6             :                1.0000
             D4 s8             :                2.7000
             D4 s9             :                5.0000
             alphaj            :                2.0000

  Z AO/shell   Hii/eV     exponent
  1     Wed Apr 25 08:07:45 CEST 2018   EN: 2.200 GM2: 0.406  GM3: 0.0800  RAES: 1.40
     1s    -10.707211    1.230000
  6     Wed Apr 25 08:07:45 CEST 2018   EN: 2.550 GM2: 0.538  GM3: 0.1500  RAES: 3.00
     2s    -13.970922    2.096432
     2p    -10.063292    1.800000
  7     Wed Apr 25 08:07:45 CEST 2018   EN: 3.040 GM2: 0.461  GM3:-0.0640  RAES: 1.90
     2s    -16.686243    2.339881
     2p    -12.523956    2.014332
  8     Wed Apr 25 08:07:45 CEST 2018   EN: 3.440 GM2: 0.452  GM3:-0.0517  RAES: 1.80
     2s    -20.229985    2.439742
     2p    -15.503117    2.137023
 16     Tue Apr 24 11:44:34 CEST 2018   EN: 2.580 GM2: 0.340  GM3:-0.0502  RAES: 3.10
     3s    -20.029654    1.981333
     3p    -11.377694    2.025643
     3d     -0.420282    1.702555

           ------------------------------------------------- 
          |        Self-Consistent Charge Iterations        |
           ------------------------------------------------- 

          ...................................................
          :                      SETUP                      :
          :.................................................:
          :  # basis functions                  84          :
          :  # atomic orbitals                  83          :
          :  # shells                           45          :
          :  # electrons                        90          :
          :  max. iterations                   250          :
          :  Hamiltonian                  GFN2-xTB          :
          :  restarted?                      false          :
          :  GBSA solvation                  false          :
          :  PC potential                    false          :
          :  electronic temp.          300.0000000     K    :
          :  accuracy                    1.0000000          :
          :  -> integral cutoff          0.2500000E+02      :
          :  -> integral neglect         0.1000000E-07      :
          :  -> SCF convergence          0.1000000E-05 Eh   :
          :  -> wf. convergence          0.1000000E-03 e    :
          :  Broyden damping             0.4000000          :
          ...................................................

 iter      E             dE          RMSdq      gap      omega  full diag
   1    -51.8765638 -0.518766E+02  0.559E+00    3.01       0.0  T
   2    -52.1472735 -0.270710E+00  0.249E+00    2.48       1.0  T
   3    -52.1493229 -0.204937E-02  0.142E+00    2.21       1.0  T
   4    -52.1432298  0.609306E-02  0.593E-01    1.98       1.0  T
   5    -52.1509677 -0.773789E-02  0.131E-01    1.92       1.0  T
   6    -52.1511036 -0.135873E-03  0.661E-02    1.94       1.0  T
   7    -52.1511354 -0.317943E-04  0.239E-02    1.95       1.0  T
   8    -52.1511426 -0.722576E-05  0.131E-02    1.95       1.5  T
   9    -52.1511435 -0.880132E-06  0.397E-03    1.95       4.8  T
  10    -52.1511437 -0.179498E-06  0.143E-03    1.95      13.4  T
  11    -52.1511437 -0.136680E-07  0.695E-04    1.95      27.7  T
  12    -52.1511437 -0.775074E-09  0.231E-04    1.95      83.2  T

   *** convergence criteria satisfied after 12 iterations ***

         #    Occupation            Energy/Eh            Energy/eV
      -------------------------------------------------------------
         1        2.0000           -0.7794644             -21.2103
       ...           ...                  ...                  ...
        39        2.0000           -0.4680433             -12.7361
        40        2.0000           -0.4615011             -12.5581
        41        2.0000           -0.4570733             -12.4376
        42        2.0000           -0.4523745             -12.3097
        43        2.0000           -0.4446144             -12.0986
        44        2.0000           -0.4227730             -11.5042
        45        2.0000           -0.4056711             -11.0389 (HOMO)
        46                         -0.3341676              -9.0932 (LUMO)
        47                         -0.3329563              -9.0602
        48                         -0.2923321              -7.9548
        49                         -0.2437710              -6.6333
        50                         -0.2276203              -6.1939
       ...                                ...                  ...
        83                          0.6297667              17.1368
      -------------------------------------------------------------
                  HL-Gap            0.0715035 Eh            1.9457 eV
             Fermi-level           -0.3699194 Eh          -10.0660 eV

 SCC (total)                   0 d,  0 h,  0 min,  0.105 sec
 SCC setup                      ...        0 min,  0.000 sec (  0.332%)
 Dispersion                     ...        0 min,  0.000 sec (  0.400%)
 integral evaluation            ...        0 min,  0.026 sec ( 25.018%)
 zeroth order Hamiltonian       ...        0 min,  0.000 sec (  0.240%)
 iterations                     ...        0 min,  0.032 sec ( 30.499%)
 molecular gradient             ...        0 min,  0.045 sec ( 43.050%)
 printout                       ...        0 min,  0.000 sec (  0.407%)

         :::::::::::::::::::::::::::::::::::::::::::::::::::::
         ::                     SUMMARY                     ::
         :::::::::::::::::::::::::::::::::::::::::::::::::::::
         :: total energy             -51.653530513243 Eh    ::
         :: gradient norm              0.108411873580 Eh/a0 ::
         :: HOMO-LUMO gap              1.945708270910 eV    ::
         ::.................................................::
         :: SCC energy               -52.151143702901 Eh    ::
         :: -> isotropic ES            0.091860014020 Eh    ::
         :: -> anisotropic ES          0.013179240423 Eh    ::
         :: -> anisotropic XC          0.009813274181 Eh    ::
         :: -> dispersion             -0.031325854383 Eh    ::
         :: repulsion energy           0.497178399974 Eh    ::
         :: add. restraining           0.000000000000 Eh    ::
         :::::::::::::::::::::::::::::::::::::::::::::::::::::

      ----------------------------------------------------------- 
     |                   =====================                   |
     |                        A N C O P T                        |
     |                   =====================                   |
     |               Approximate Normal Coordinate               |
     |                Rational Function Optimizer                |
      ----------------------------------------------------------- 

          ...................................................
          :                      SETUP                      :
          :.................................................:
          :   optimization level            normal          :
          :   max. optcycles                   200          :
          :   ANC micro-cycles                  20          :
          :   degrees of freedom                75          :
          :.................................................:
          :   RF solver                   davidson          :
          :   input Hessian                  false          :
          :   write xtbopt.log                true          :
          :   linear?                        false          :
          :   energy convergence         0.5000000E-05 Eh   :
          :   grad. convergence          0.1000000E-02 Eh/α :
          :   maximium RF displ.         2.0000000          :
          :   Hlow (freq-cutoff)         0.5000000E-02      :
          :   Hmax (freq-cutoff)         5.0000000          :
          :   S6 in model hess.         20.0000000          :
          ...................................................

generating ANC from model Hessian ...
Using Lindh-Hessian (1995)
 Shifting diagonal of input Hessian by   4.020267161716204E-003
 Lowest  eigenvalues of input Hessian
   -0.000000   -0.000000    0.000000    0.000000    0.000000    0.000000
    0.005000    0.006488    0.007328    0.008119    0.009332    0.010275
    0.013071    0.014873    0.015624    0.017011    0.017346    0.020999
 Highest eigenvalues
    1.790052    1.804305    1.820076    1.978686    2.376787    2.379418
 

........................................................................
.............................. CYCLE    1 ..............................
........................................................................
   1    -52.1511437 -0.521511E+02  0.137E-04    1.95       0.0  T
   2    -52.1511437 -0.207336E-10  0.123E-04    1.95     156.8  T
   3    -52.1511437 -0.276941E-09  0.514E-05    1.95     374.2  T
     SCC iter.                  ...        0 min,  0.005 sec
     gradient                   ...        0 min,  0.019 sec
 * total energy  :   -51.6535305 Eh     change        0.8589616E-08 Eh
   gradient norm :     0.1084137 Eh/α   predicted     0.0000000E+00 (-100.00%)
   displ. norm   :     0.3474128 α      lambda       -0.1703614E-01
   maximum displ.:     0.1329432 α      in ANC's #8, #7, #28, ...

........................................................................
.............................. CYCLE    2 ..............................
........................................................................
   1    -52.1945309 -0.521945E+02  0.323E-01    2.34       0.0  T
   2    -52.1952075 -0.676675E-03  0.150E-01    2.25       1.0  T
   3    -52.1952059  0.160507E-05  0.856E-02    2.24       1.0  T
   4    -52.1952225 -0.165555E-04  0.555E-02    2.22       1.0  T
   5    -52.1952687 -0.461795E-04  0.118E-02    2.22       1.6  T
   6    -52.1952692 -0.576993E-06  0.669E-03    2.22       2.9  T
   7    -52.1952698 -0.572262E-06  0.220E-03    2.22       8.7  T
   8    -52.1952699 -0.495146E-07  0.107E-03    2.22      17.9  T
     SCC iter.                  ...        0 min,  0.012 sec
     gradient                   ...        0 min,  0.018 sec
 * total energy  :   -51.6649548 Eh     change       -0.1142434E-01 Eh
   gradient norm :     0.0336659 Eh/α   predicted    -0.9546165E-02 ( -16.44%)
   displ. norm   :     0.3455563 α      lambda       -0.4015384E-02
   maximum displ.:     0.2154599 α      in ANC's #7, #8, #9, ...

........................................................................
.............................. CYCLE    3 ..............................
........................................................................
   1    -52.2132778 -0.522133E+02  0.236E-01    2.39       0.0  T
   2    -52.2134268 -0.148979E-03  0.131E-01    2.36       1.0  T
   3    -52.2133961  0.307197E-04  0.676E-02    2.36       1.0  T
   4    -52.2134300 -0.339402E-04  0.334E-02    2.35       1.0  T
   5    -52.2134504 -0.203980E-04  0.787E-03    2.35       2.4  T
   6    -52.2134510 -0.557822E-06  0.370E-03    2.35       5.2  T
   7    -52.2134510 -0.895930E-07  0.176E-03    2.35      10.9  T
     SCC iter.                  ...        0 min,  0.010 sec
     gradient                   ...        0 min,  0.018 sec
 * total energy  :   -51.6671041 Eh     change       -0.2149246E-02 Eh
   gradient norm :     0.0125122 Eh/α   predicted    -0.2247438E-02 (   4.57%)
   displ. norm   :     0.2969793 α      lambda       -0.1558357E-02
   maximum displ.:     0.1691014 α      in ANC's #6, #8, #7, ...

........................................................................
.............................. CYCLE    4 ..............................
........................................................................
   1    -52.2162274 -0.522162E+02  0.253E-01    2.37       0.0  T
   2    -52.2162583 -0.308708E-04  0.149E-01    2.35       1.0  T
   3    -52.2162116  0.467430E-04  0.585E-02    2.35       1.0  T
   4    -52.2162711 -0.594805E-04  0.156E-02    2.35       1.2  T
   5    -52.2162740 -0.294085E-05  0.670E-03    2.35       2.9  T
   6    -52.2162742 -0.241434E-06  0.194E-03    2.35       9.9  T
   7    -52.2162742 -0.569860E-08  0.107E-03    2.35      18.1  T
     SCC iter.                  ...        0 min,  0.010 sec
     gradient                   ...        0 min,  0.018 sec
 * total energy  :   -51.6673690 Eh     change       -0.2649085E-03 Eh
   gradient norm :     0.0182037 Eh/α   predicted    -0.8479006E-03 ( 220.07%)
   displ. norm   :     0.1433598 α      lambda       -0.1057098E-02
   maximum displ.:     0.0783807 α      in ANC's #7, #6, #12, ...

........................................................................
.............................. CYCLE    5 ..............................
........................................................................
   1    -52.2127795 -0.522128E+02  0.155E-01    2.30       0.0  T
   2    -52.2127997 -0.202195E-04  0.880E-02    2.31       1.0  T
   3    -52.2127913  0.833401E-05  0.296E-02    2.32       1.0  T
   4    -52.2128026 -0.112730E-04  0.122E-02    2.32       1.6  T
   5    -52.2128048 -0.222588E-05  0.443E-03    2.32       4.3  T
   6    -52.2128050 -0.116342E-06  0.200E-03    2.32       9.6  T
   7    -52.2128050 -0.236156E-07  0.916E-04    2.32      21.0  T
     SCC iter.                  ...        0 min,  0.010 sec
     gradient                   ...        0 min,  0.018 sec
 * total energy  :   -51.6679759 Eh     change       -0.6069549E-03 Eh
   gradient norm :     0.0046483 Eh/α   predicted    -0.5394143E-03 ( -11.13%)
   displ. norm   :     0.1372983 α      lambda       -0.2430626E-03
   maximum displ.:     0.0707997 α      in ANC's #6, #12, #11, ...

........................................................................
.............................. CYCLE    6 ..............................
........................................................................
   1    -52.2123521 -0.522124E+02  0.121E-01    2.31       0.0  T
   2    -52.2123575 -0.538547E-05  0.655E-02    2.31       1.0  T
   3    -52.2123557  0.179136E-05  0.162E-02    2.31       1.2  T
   4    -52.2123593 -0.357788E-05  0.744E-03    2.31       2.6  T
   5    -52.2123596 -0.374739E-06  0.260E-03    2.31       7.4  T
   6    -52.2123597 -0.785535E-07  0.758E-04    2.31      25.4  T
     SCC iter.                  ...        0 min,  0.009 sec
     gradient                   ...        0 min,  0.018 sec
 * total energy  :   -51.6681347 Eh     change       -0.1587663E-03 Eh
   gradient norm :     0.0045257 Eh/α   predicted    -0.1238237E-03 ( -22.01%)
   displ. norm   :     0.2069524 α      lambda       -0.2237646E-03
   maximum displ.:     0.1167786 α      in ANC's #6, #12, #2, ...

........................................................................
.............................. CYCLE    7 ..............................
........................................................................
   1    -52.2116100 -0.522116E+02  0.180E-01    2.29       0.0  T
   2    -52.2116213 -0.112927E-04  0.101E-01    2.30       1.0  T
   3    -52.2116225 -0.115525E-05  0.172E-02    2.30       1.1  T
   4    -52.2116251 -0.257819E-05  0.935E-03    2.30       2.1  T
   5    -52.2116258 -0.722554E-06  0.373E-03    2.30       5.2  T
   6    -52.2116260 -0.176205E-06  0.117E-03    2.30      16.4  T
   7    -52.2116260 -0.366216E-08  0.681E-04    2.30      28.3  T
     SCC iter.                  ...        0 min,  0.010 sec
     gradient                   ...        0 min,  0.018 sec
 * total energy  :   -51.6682829 Eh     change       -0.1481852E-03 Eh
   gradient norm :     0.0069188 Eh/α   predicted    -0.1166816E-03 ( -21.26%)
   displ. norm   :     0.2140152 α      lambda       -0.2004617E-03
   maximum displ.:     0.1181087 α      in ANC's #6, #10, #2, ...

........................................................................
.............................. CYCLE    8 ..............................
........................................................................
   1    -52.2116899 -0.522117E+02  0.185E-01    2.29       0.0  T
   2    -52.2117056 -0.157068E-04  0.106E-01    2.29       1.0  T
   3    -52.2116946  0.110165E-04  0.314E-02    2.29       1.0  T
   4    -52.2117119 -0.173266E-04  0.997E-03    2.29       1.9  T
   5    -52.2117129 -0.981930E-06  0.502E-03    2.29       3.8  T
   6    -52.2117130 -0.169953E-06  0.133E-03    2.29      14.5  T
   7    -52.2117130 -0.333535E-08  0.806E-04    2.29      23.9  T
     SCC iter.                  ...        0 min,  0.010 sec
     gradient                   ...        0 min,  0.018 sec
 * total energy  :   -51.6684161 Eh     change       -0.1331672E-03 Eh
   gradient norm :     0.0081887 Eh/α   predicted    -0.1048303E-03 ( -21.28%)
   displ. norm   :     0.3385905 α      lambda       -0.3339852E-03
   maximum displ.:     0.1699437 α      in ANC's #10, #6, #2, ...

........................................................................
.............................. CYCLE    9 ..............................
........................................................................
   1    -52.2110322 -0.522110E+02  0.301E-01    2.25       0.0  T
   2    -52.2110655 -0.333499E-04  0.173E-01    2.26       1.0  T
   3    -52.2110529  0.126588E-04  0.386E-02    2.26       1.0  T
   4    -52.2110791 -0.261810E-04  0.135E-02    2.26       1.4  T
   5    -52.2110806 -0.156869E-05  0.693E-03    2.26       2.8  T
   6    -52.2110810 -0.423570E-06  0.222E-03    2.26       8.7  T
   7    -52.2110811 -0.143225E-07  0.104E-03    2.26      18.6  T
     SCC iter.                  ...        0 min,  0.010 sec
     gradient                   ...        0 min,  0.018 sec
 * total energy  :   -51.6685600 Eh     change       -0.1439374E-03 Eh
   gradient norm :     0.0121202 Eh/α   predicted    -0.1861374E-03 (  29.32%)
   displ. norm   :     0.1328262 α      lambda       -0.2906649E-03
   maximum displ.:     0.0717435 α      in ANC's #10, #4, #2, ...

........................................................................
.............................. CYCLE   10 ..............................
........................................................................
   1    -52.2143779 -0.522144E+02  0.114E-01    2.29       0.0  T
   2    -52.2143978 -0.198903E-04  0.643E-02    2.28       1.0  T
   3    -52.2143943  0.352859E-05  0.249E-02    2.28       1.0  T
   4    -52.2143999 -0.561717E-05  0.953E-03    2.28       2.0  T
   5    -52.2144014 -0.145656E-05  0.352E-03    2.28       5.5  T
   6    -52.2144015 -0.122264E-06  0.154E-03    2.28      12.5  T
   7    -52.2144015 -0.107670E-08  0.716E-04    2.28      26.9  T
     SCC iter.                  ...        0 min,  0.010 sec
     gradient                   ...        0 min,  0.018 sec
 * total energy  :   -51.6687283 Eh     change       -0.1682565E-03 Eh
   gradient norm :     0.0081381 Eh/α   predicted    -0.1478973E-03 ( -12.10%)
   displ. norm   :     0.3241367 α      lambda       -0.3417426E-03
   maximum displ.:     0.1987929 α      in ANC's #10, #2, #6, ...

........................................................................
.............................. CYCLE   11 ..............................
........................................................................
   1    -52.2123533 -0.522124E+02  0.317E-01    2.24       0.0  T
   2    -52.2124096 -0.563113E-04  0.184E-01    2.25       1.0  T
   3    -52.2123697  0.399168E-04  0.554E-02    2.25       1.0  T
   4    -52.2124280 -0.583341E-04  0.164E-02    2.25       1.2  T
   5    -52.2124319 -0.388584E-05  0.747E-03    2.25       2.6  T
   6    -52.2124322 -0.317825E-06  0.352E-03    2.25       5.5  T
   7    -52.2124322 -0.154791E-07  0.147E-03    2.25      13.1  T
   8    -52.2124323 -0.410041E-07  0.494E-04    2.25      39.0  T
     SCC iter.                  ...        0 min,  0.011 sec
     gradient                   ...        0 min,  0.018 sec
 * total energy  :   -51.6688614 Eh     change       -0.1330919E-03 Eh
   gradient norm :     0.0162013 Eh/α   predicted    -0.1888244E-03 (  41.88%)
   displ. norm   :     0.0988230 α      lambda       -0.3008851E-03
   maximum displ.:     0.0657583 α      in ANC's #1, #5, #10, ...

........................................................................
.............................. CYCLE   12 ..............................
........................................................................
   1    -52.2141624 -0.522142E+02  0.729E-02    2.29       0.0  T
   2    -52.2141954 -0.330030E-04  0.415E-02    2.28       1.0  T
   3    -52.2142014 -0.598526E-05  0.225E-02    2.28       1.0  T
   4    -52.2142018 -0.416232E-06  0.790E-03    2.28       2.4  T
   5    -52.2142028 -0.934782E-06  0.307E-03    2.28       6.3  T
   6    -52.2142029 -0.115648E-06  0.125E-03    2.28      15.4  T
   7    -52.2142029  0.150871E-08  0.686E-04    2.28      28.1  T
     SCC iter.                  ...        0 min,  0.010 sec
     gradient                   ...        0 min,  0.018 sec
 * total energy  :   -51.6690300 Eh     change       -0.1686651E-03 Eh
   gradient norm :     0.0041945 Eh/α   predicted    -0.1519156E-03 (  -9.93%)
   displ. norm   :     0.2961638 α      lambda       -0.2144261E-03
   maximum displ.:     0.1657186 α      in ANC's #10, #2, #6, ...

........................................................................
.............................. CYCLE   13 ..............................
........................................................................
   1    -52.2114402 -0.522114E+02  0.256E-01    2.22       0.0  T
   2    -52.2114655 -0.253419E-04  0.148E-01    2.24       1.0  T
   3    -52.2114523  0.132364E-04  0.333E-02    2.24       1.0  T
   4    -52.2114748 -0.224905E-04  0.106E-02    2.24       1.8  T
   5    -52.2114760 -0.127813E-05  0.521E-03    2.24       3.7  T
   6    -52.2114762 -0.136682E-06  0.246E-03    2.24       7.8  T
   7    -52.2114762 -0.289579E-07  0.982E-04    2.24      19.6  T
     SCC iter.                  ...        0 min,  0.010 sec
     gradient                   ...        0 min,  0.018 sec
 * total energy  :   -51.6691353 Eh     change       -0.1052852E-03 Eh
   gradient norm :     0.0104980 Eh/α   predicted    -0.1166174E-03 (  10.76%)
   displ. norm   :     0.1795940 α      lambda       -0.2017306E-03
   maximum displ.:     0.1158957 α      in ANC's #1, #10, #4, ...

........................................................................
.............................. CYCLE   14 ..............................
........................................................................
   1    -52.2122604 -0.522123E+02  0.137E-01    2.29       0.0  T
   2    -52.2122763 -0.159724E-04  0.787E-02    2.28       1.0  T
   3    -52.2122711  0.522600E-05  0.225E-02    2.28       1.0  T
   4    -52.2122777 -0.662106E-05  0.968E-03    2.28       2.0  T
   5    -52.2122795 -0.178705E-05  0.292E-03    2.28       6.6  T
   6    -52.2122796 -0.555560E-07  0.155E-03    2.28      12.4  T
     SCC iter.                  ...        0 min,  0.009 sec
     gradient                   ...        0 min,  0.018 sec
 * total energy  :   -51.6692419 Eh     change       -0.1066302E-03 Eh
   gradient norm :     0.0075858 Eh/α   predicted    -0.1041193E-03 (  -2.35%)
   displ. norm   :     0.1729317 α      lambda       -0.1795663E-03
   maximum displ.:     0.1143680 α      in ANC's #1, #10, #3, ...

........................................................................
.............................. CYCLE   15 ..............................
........................................................................
   1    -52.2131284 -0.522131E+02  0.139E-01    2.27       0.0  T
   2    -52.2131386 -0.101889E-04  0.802E-02    2.27       1.0  T
   3    -52.2131339  0.475224E-05  0.227E-02    2.27       1.0  T
   4    -52.2131415 -0.765072E-05  0.667E-03    2.27       2.9  T
   5    -52.2131421 -0.564044E-06  0.330E-03    2.27       5.8  T
   6    -52.2131422 -0.922304E-07  0.115E-03    2.27      16.7  T
   7    -52.2131422 -0.319066E-08  0.361E-04    2.27      53.3  T
     SCC iter.                  ...        0 min,  0.010 sec
     gradient                   ...        0 min,  0.018 sec
 * total energy  :   -51.6693805 Eh     change       -0.1385928E-03 Eh
   gradient norm :     0.0039328 Eh/α   predicted    -0.9247442E-04 ( -33.28%)
   displ. norm   :     0.5073957 α      lambda       -0.3120764E-03
   maximum displ.:     0.3189422 α      in ANC's #1, #3, #10, ...

........................................................................
.............................. CYCLE   16 ..............................
........................................................................
   1    -52.2095223 -0.522095E+02  0.407E-01    2.20       0.0  T
   2    -52.2095714 -0.491549E-04  0.237E-01    2.21       1.0  T
   3    -52.2095547  0.167741E-04  0.432E-02    2.22       1.0  T
   4    -52.2095902 -0.355018E-04  0.154E-02    2.21       1.3  T
   5    -52.2095929 -0.271000E-05  0.770E-03    2.21       2.5  T
   6    -52.2095932 -0.288285E-06  0.318E-03    2.21       6.1  T
   7    -52.2095932 -0.316377E-07  0.111E-03    2.21      17.3  T
   8    -52.2095932 -0.195146E-07  0.521E-04    2.21      36.9  T
   9    -52.2095932 -0.177187E-08  0.146E-04    2.21     131.7  T
     SCC iter.                  ...        0 min,  0.013 sec
     gradient                   ...        0 min,  0.019 sec
 * total energy  :   -51.6695236 Eh     change       -0.1430917E-03 Eh
   gradient norm :     0.0130091 Eh/α   predicted    -0.1962120E-03 (  37.12%)
   displ. norm   :     0.2545476 α      lambda       -0.4703053E-03
   maximum displ.:     0.1966054 α      in ANC's #1, #3, #2, ...

........................................................................
.............................. CYCLE   17 ..............................
........................................................................
   1    -52.2159485 -0.522159E+02  0.161E-01    2.27       0.0  T
   2    -52.2159894 -0.408784E-04  0.887E-02    2.26       1.0  T
   3    -52.2159873  0.211135E-05  0.268E-02    2.25       1.0  T
   4    -52.2159883 -0.100437E-05  0.133E-02    2.25       1.4  T
   5    -52.2159921 -0.376144E-05  0.390E-03    2.25       4.9  T
   6    -52.2159922 -0.113677E-06  0.175E-03    2.25      11.0  T
   7    -52.2159922 -0.239183E-07  0.648E-04    2.25      29.7  T
     SCC iter.                  ...        0 min,  0.010 sec
     gradient                   ...        0 min,  0.018 sec
 * total energy  :   -51.6696951 Eh     change       -0.1714645E-03 Eh
   gradient norm :     0.0134035 Eh/α   predicted    -0.2503938E-03 (  46.03%)
   displ. norm   :     0.2780935 α      lambda       -0.3636091E-03
   maximum displ.:     0.2046948 α      in ANC's #1, #3, #10, ...

........................................................................
.............................. CYCLE   18 ..............................
........................................................................
   1    -52.2152264 -0.522152E+02  0.210E-01    2.26       0.0  T
   2    -52.2152561 -0.297528E-04  0.122E-01    2.25       1.0  T
   3    -52.2152195  0.365956E-04  0.531E-02    2.25       1.0  T
   4    -52.2152659 -0.463676E-04  0.134E-02    2.25       1.4  T
   5    -52.2152690 -0.304113E-05  0.475E-03    2.25       4.0  T
   6    -52.2152691 -0.116754E-06  0.215E-03    2.25       8.9  T
   7    -52.2152691  0.182786E-08  0.890E-04    2.25      21.6  T
     SCC iter.                  ...        0 min,  0.010 sec
     gradient                   ...        0 min,  0.018 sec
 * total energy  :   -51.6699387 Eh     change       -0.2436256E-03 Eh
   gradient norm :     0.0065277 Eh/α   predicted    -0.1958647E-03 ( -19.60%)
   displ. norm   :     0.4827626 α      lambda       -0.3285876E-03
   maximum displ.:     0.3475307 α      in ANC's #1, #3, #10, ...

........................................................................
.............................. CYCLE   19 ..............................
........................................................................
   1    -52.2084557 -0.522085E+02  0.334E-01    2.20       0.0  T
   2    -52.2085026 -0.469054E-04  0.196E-01    2.21       1.0  T
   3    -52.2084549  0.476925E-04  0.568E-02    2.21       1.0  T
   4    -52.2085180 -0.630782E-04  0.166E-02    2.21       1.2  T
   5    -52.2085222 -0.420316E-05  0.686E-03    2.22       2.8  T
   6    -52.2085224 -0.220927E-06  0.284E-03    2.21       6.8  T
   7    -52.2085224 -0.228707E-08  0.127E-03    2.22      15.2  T
     SCC iter.                  ...        0 min,  0.010 sec
     gradient                   ...        0 min,  0.018 sec
 * total energy  :   -51.6699514 Eh     change       -0.1269586E-04 Eh
   gradient norm :     0.0157298 Eh/α   predicted    -0.2025856E-03 (1495.68%)
   displ. norm   :     0.1497800 α      lambda       -0.4845027E-03
   maximum displ.:     0.0922056 α      in ANC's #3, #2, #10, ...

........................................................................
.............................. CYCLE   20 ..............................
........................................................................
   1    -52.2156755 -0.522157E+02  0.119E-01    2.29       0.0  T
   2    -52.2156920 -0.164874E-04  0.687E-02    2.28       1.0  T
   3    -52.2156895  0.251951E-05  0.228E-02    2.27       1.0  T
   4    -52.2156947 -0.515172E-05  0.676E-03    2.27       2.8  T
   5    -52.2156951 -0.403872E-06  0.366E-03    2.27       5.3  T
   6    -52.2156952 -0.164747E-06  0.148E-03    2.27      13.0  T
   7    -52.2156952 -0.742281E-08  0.452E-04    2.27      42.6  T
     SCC iter.                  ...        0 min,  0.010 sec
     gradient                   ...        0 min,  0.018 sec
 * total energy  :   -51.6701250 Eh     change       -0.1736007E-03 Eh
   gradient norm :     0.0076447 Eh/α   predicted    -0.2476891E-03 (  42.68%)
   displ. norm   :     0.1721851 α      lambda       -0.2723621E-03
   maximum displ.:     0.1195964 α      in ANC's #1, #3, #2, ...
 * RMSD in coord.:     0.6442238 α      energy gain  -0.1659449E-01 Eh

generating ANC from model Hessian ...
Using Lindh-Hessian (1995)
 Shifting diagonal of input Hessian by   3.840552741637117E-003
 Lowest  eigenvalues of input Hessian
   -0.000000   -0.000000   -0.000000    0.000000    0.000000    0.000000
    0.005000    0.006888    0.007648    0.008600    0.009851    0.010918
    0.014018    0.015708    0.017045    0.020600    0.021679    0.022709
 Highest eigenvalues
    1.890046    2.015672    2.029819    2.040887    2.613463    2.627157
 

........................................................................
.............................. CYCLE   21 ..............................
........................................................................
   1    -52.2150977 -0.522151E+02  0.122E-01    2.26       0.0  T
   2    -52.2151153 -0.175666E-04  0.692E-02    2.25       1.0  T
   3    -52.2151105  0.480309E-05  0.248E-02    2.25       1.0  T
   4    -52.2151171 -0.657606E-05  0.882E-03    2.25       2.2  T
   5    -52.2151183 -0.121025E-05  0.373E-03    2.25       5.2  T
   6    -52.2151185 -0.169983E-06  0.135E-03    2.25      14.2  T
   7    -52.2151185 -0.431625E-08  0.646E-04    2.25      29.8  T
   8    -52.2151185 -0.697722E-08  0.300E-04    2.25      64.0  T
     SCC iter.                  ...        0 min,  0.011 sec
     gradient                   ...        0 min,  0.019 sec
 * total energy  :   -51.6701627 Eh     change       -0.3766412E-04 Eh
   gradient norm :     0.0130803 Eh/α   predicted     0.0000000E+00 (-100.00%)
   displ. norm   :     0.1196807 α      lambda       -0.2631735E-03
   maximum displ.:     0.0792582 α      in ANC's #3, #2, #1, ...

........................................................................
.............................. CYCLE   22 ..............................
........................................................................
   1    -52.2153985 -0.522154E+02  0.682E-02    2.26       0.0  T
   2    -52.2154043 -0.579362E-05  0.392E-02    2.26       1.0  T
   3    -52.2154030  0.136345E-05  0.149E-02    2.26       1.3  T
   4    -52.2154053 -0.233133E-05  0.396E-03    2.26       4.9  T
   5    -52.2154055 -0.244330E-06  0.194E-03    2.26       9.9  T
   6    -52.2154056 -0.496649E-07  0.759E-04    2.26      25.4  T
     SCC iter.                  ...        0 min,  0.009 sec
     gradient                   ...        0 min,  0.018 sec
 * total energy  :   -51.6703392 Eh     change       -0.1765582E-03 Eh
   gradient norm :     0.0033712 Eh/α   predicted    -0.1334791E-03 ( -24.40%)
   displ. norm   :     0.1187431 α      lambda       -0.1387894E-03
   maximum displ.:     0.0775904 α      in ANC's #3, #2, #7, ...

........................................................................
.............................. CYCLE   23 ..............................
........................................................................
   1    -52.2151431 -0.522151E+02  0.712E-02    2.25       0.0  T
   2    -52.2151469 -0.383327E-05  0.408E-02    2.26       1.0  T
   3    -52.2151449  0.201470E-05  0.153E-02    2.26       1.3  T
   4    -52.2151476 -0.269463E-05  0.409E-03    2.26       4.7  T
   5    -52.2151479 -0.296774E-06  0.149E-03    2.26      12.9  T
   6    -52.2151479 -0.210554E-07  0.658E-04    2.26      29.3  T
   7    -52.2151479  0.931422E-09  0.352E-04    2.26      54.7  T
     SCC iter.                  ...        0 min,  0.010 sec
     gradient                   ...        0 min,  0.019 sec
 * total energy  :   -51.6704249 Eh     change       -0.8567553E-04 Eh
   gradient norm :     0.0055505 Eh/α   predicted    -0.7037638E-04 ( -17.86%)
   displ. norm   :     0.1189220 α      lambda        0.6158713E-04
   maximum displ.:     0.0775817 α      in ANC's #3, #2, #7, ...

........................................................................
.............................. CYCLE   24 ..............................
........................................................................
   1    -52.2143982 -0.522144E+02  0.714E-02    2.25       0.0  T
   2    -52.2144025 -0.425799E-05  0.408E-02    2.25       1.0  T
   3    -52.2144001  0.238537E-05  0.167E-02    2.25       1.2  T
   4    -52.2144033 -0.314425E-05  0.448E-03    2.26       4.3  T
   5    -52.2144036 -0.363765E-06  0.152E-03    2.26      12.6  T
   6    -52.2144036 -0.222590E-07  0.675E-04    2.26      28.5  T
     SCC iter.                  ...        0 min,  0.009 sec
     gradient                   ...        0 min,  0.018 sec
 * total energy  :   -51.6703964 Eh     change        0.2846225E-04 Eh
   gradient norm :     0.0136394 Eh/α   predicted     0.3122573E-04 (   9.71%)
   displ. norm   :     0.0567142 α      lambda       -0.1912095E-03
   maximum displ.:     0.0314305 α      in ANC's #2, #3, #1, ...

........................................................................
.............................. CYCLE   25 ..............................
........................................................................
   1    -52.2143358 -0.522143E+02  0.542E-02    2.26       0.0  T
   2    -52.2143372 -0.135721E-05  0.317E-02    2.26       1.0  T
   3    -52.2143346  0.256563E-05  0.127E-02    2.26       1.5  T
   4    -52.2143378 -0.315712E-05  0.278E-03    2.26       6.9  T
   5    -52.2143379 -0.111781E-06  0.122E-03    2.26      15.7  T
   6    -52.2143379 -0.745457E-08  0.536E-04    2.26      35.9  T
     SCC iter.                  ...        0 min,  0.009 sec
     gradient                   ...        0 min,  0.018 sec
 * total energy  :   -51.6705334 Eh     change       -0.1369095E-03 Eh
   gradient norm :     0.0085213 Eh/α   predicted    -0.9591269E-04 ( -29.94%)
   displ. norm   :     0.1631085 α      lambda       -0.1897144E-03
   maximum displ.:     0.0991972 α      in ANC's #2, #3, #1, ...

........................................................................
.............................. CYCLE   26 ..............................
........................................................................
   1    -52.2141886 -0.522142E+02  0.106E-01    2.26       0.0  T
   2    -52.2141915 -0.287968E-05  0.608E-02    2.26       1.0  T
   3    -52.2141901  0.141287E-05  0.114E-02    2.26       1.7  T
   4    -52.2141922 -0.212561E-05  0.482E-03    2.26       4.0  T
   5    -52.2141925 -0.264845E-06  0.214E-03    2.26       9.0  T
   6    -52.2141925 -0.496672E-07  0.601E-04    2.26      32.0  T
     SCC iter.                  ...        0 min,  0.009 sec
     gradient                   ...        0 min,  0.018 sec
 * total energy  :   -51.6706748 Eh     change       -0.1414243E-03 Eh
   gradient norm :     0.0043637 Eh/α   predicted    -0.9738895E-04 ( -31.14%)
   displ. norm   :     0.2836299 α      lambda       -0.2101089E-03
   maximum displ.:     0.1764273 α      in ANC's #2, #3, #1, ...

........................................................................
.............................. CYCLE   27 ..............................
........................................................................
   1    -52.2129856 -0.522130E+02  0.177E-01    2.25       0.0  T
   2    -52.2129915 -0.592309E-05  0.102E-01    2.25       1.0  T
   3    -52.2129901  0.144339E-05  0.150E-02    2.25       1.3  T
   4    -52.2129936 -0.348634E-05  0.695E-03    2.25       2.8  T
   5    -52.2129940 -0.443033E-06  0.303E-03    2.25       6.4  T
   6    -52.2129941 -0.118640E-06  0.826E-04    2.25      23.3  T
   7    -52.2129941 -0.148349E-08  0.401E-04    2.25      47.9  T
     SCC iter.                  ...        0 min,  0.010 sec
     gradient                   ...        0 min,  0.018 sec
 * total energy  :   -51.6708204 Eh     change       -0.1455993E-03 Eh
   gradient norm :     0.0073123 Eh/α   predicted    -0.1135096E-03 ( -22.04%)
   displ. norm   :     0.2824351 α      lambda       -0.2124776E-03
   maximum displ.:     0.1850877 α      in ANC's #2, #3, #1, ...

........................................................................
.............................. CYCLE   28 ..............................
........................................................................
   1    -52.2125901 -0.522126E+02  0.169E-01    2.25       0.0  T
   2    -52.2125953 -0.528140E-05  0.975E-02    2.25       1.0  T
   3    -52.2125950  0.340123E-06  0.135E-02    2.25       1.4  T
   4    -52.2125973 -0.226707E-05  0.635E-03    2.25       3.0  T
   5    -52.2125976 -0.292322E-06  0.285E-03    2.25       6.7  T
   6    -52.2125977 -0.102408E-06  0.779E-04    2.25      24.7  T
     SCC iter.                  ...        0 min,  0.009 sec
     gradient                   ...        0 min,  0.018 sec
 * total energy  :   -51.6709731 Eh     change       -0.1527002E-03 Eh
   gradient norm :     0.0083545 Eh/α   predicted    -0.1147169E-03 ( -24.87%)
   displ. norm   :     0.2947851 α      lambda       -0.3265673E-03
   maximum displ.:     0.2156761 α      in ANC's #2, #3, #11, ...

........................................................................
.............................. CYCLE   29 ..............................
........................................................................
   1    -52.2156064 -0.522156E+02  0.193E-01    2.26       0.0  T
   2    -52.2156153 -0.893565E-05  0.110E-01    2.25       1.0  T
   3    -52.2156173 -0.202962E-05  0.137E-02    2.25       1.4  T
   4    -52.2156185 -0.121393E-05  0.670E-03    2.25       2.9  T
   5    -52.2156187 -0.143588E-06  0.271E-03    2.25       7.1  T
   6    -52.2156188 -0.113129E-06  0.106E-03    2.25      18.1  T
     SCC iter.                  ...        0 min,  0.009 sec
     gradient                   ...        0 min,  0.018 sec
 * total energy  :   -51.6711564 Eh     change       -0.1833718E-03 Eh
   gradient norm :     0.0067802 Eh/α   predicted    -0.1774774E-03 (  -3.21%)
   displ. norm   :     0.4902864 α      lambda       -0.2744437E-03
   maximum displ.:     0.3408230 α      in ANC's #2, #3, #11, ...

........................................................................
.............................. CYCLE   30 ..............................
........................................................................
   1    -52.2090331 -0.522090E+02  0.306E-01    2.20       0.0  T
   2    -52.2090573 -0.242624E-04  0.175E-01    2.21       1.0  T
   3    -52.2090297  0.276555E-04  0.457E-02    2.21       1.0  T
   4    -52.2090667 -0.369968E-04  0.120E-02    2.21       1.6  T
   5    -52.2090679 -0.127087E-05  0.475E-03    2.21       4.1  T
   6    -52.2090680 -0.886604E-07  0.193E-03    2.21       9.9  T
   7    -52.2090681 -0.282197E-07  0.930E-04    2.21      20.7  T
     SCC iter.                  ...        0 min,  0.010 sec
     gradient                   ...        0 min,  0.018 sec
 * total energy  :   -51.6710688 Eh     change        0.8759872E-04 Eh
   gradient norm :     0.0139768 Eh/α   predicted    -0.1702335E-03 (-294.33%)
   displ. norm   :     0.2242672 α      lambda       -0.5164762E-03
   maximum displ.:     0.1419865 α      in ANC's #3, #2, #11, ...

........................................................................
.............................. CYCLE   31 ..............................
........................................................................
   1    -52.2157158 -0.522157E+02  0.144E-01    2.26       0.0  T
   2    -52.2157230 -0.720080E-05  0.822E-02    2.25       1.0  T
   3    -52.2157077  0.152537E-04  0.320E-02    2.25       1.0  T
   4    -52.2157261 -0.184336E-04  0.579E-03    2.25       3.3  T
   5    -52.2157264 -0.280008E-06  0.234E-03    2.25       8.2  T
   6    -52.2157264 -0.129286E-07  0.102E-03    2.25      18.8  T
     SCC iter.                  ...        0 min,  0.009 sec
     gradient                   ...        0 min,  0.018 sec
 * total energy  :   -51.6712766 Eh     change       -0.2077422E-03 Eh
   gradient norm :     0.0022242 Eh/α   predicted    -0.2712280E-03 (  30.56%)
   displ. norm   :     0.1136677 α      lambda       -0.4987009E-04
   maximum displ.:     0.0845562 α      in ANC's #2, #3, #4, ...

........................................................................
.............................. CYCLE   32 ..............................
........................................................................
   1    -52.2151766 -0.522152E+02  0.715E-02    2.25       0.0  T
   2    -52.2151778 -0.112940E-05  0.403E-02    2.25       1.0  T
   3    -52.2151779 -0.171188E-06  0.562E-03    2.25       3.4  T
   4    -52.2151780 -0.575837E-07  0.312E-03    2.25       6.2  T
   5    -52.2151781 -0.123612E-06  0.108E-03    2.25      17.8  T
   6    -52.2151781 -0.192086E-07  0.355E-04    2.25      54.2  T
   7    -52.2151781 -0.681396E-09  0.202E-04    2.25      95.2  T
     SCC iter.                  ...        0 min,  0.010 sec
     gradient                   ...        0 min,  0.019 sec
 * total energy  :   -51.6713066 Eh     change       -0.3000624E-04 Eh
   gradient norm :     0.0030840 Eh/α   predicted    -0.2525915E-04 ( -15.82%)
   displ. norm   :     0.2281266 α      lambda       -0.6547102E-04
   maximum displ.:     0.1766887 α      in ANC's #2, #3, #43, ...

........................................................................
.............................. CYCLE   33 ..............................
........................................................................
   1    -52.2144424 -0.522144E+02  0.134E-01    2.25       0.0  T
   2    -52.2144455 -0.319585E-05  0.767E-02    2.25       1.0  T
   3    -52.2144446  0.956283E-06  0.129E-02    2.25       1.5  T
   4    -52.2144466 -0.202075E-05  0.600E-03    2.25       3.2  T
   5    -52.2144469 -0.284518E-06  0.199E-03    2.25       9.7  T
   6    -52.2144470 -0.575159E-07  0.600E-04    2.25      32.1  T
   7    -52.2144470 -0.275058E-09  0.335E-04    2.25      57.4  T
     SCC iter.                  ...        0 min,  0.010 sec
     gradient                   ...        0 min,  0.019 sec
 * total energy  :   -51.6713454 Eh     change       -0.3882995E-04 Eh
   gradient norm :     0.0030661 Eh/α   predicted    -0.3443993E-04 ( -11.31%)
   displ. norm   :     0.1031298 α      lambda       -0.3005528E-04
   maximum displ.:     0.0841751 α      in ANC's #2, #3, #43, ...

........................................................................
.............................. CYCLE   34 ..............................
........................................................................
   1    -52.2151110 -0.522151E+02  0.569E-02    2.25       0.0  T
   2    -52.2151118 -0.859081E-06  0.331E-02    2.25       1.0  T
   3    -52.2151116  0.175208E-06  0.512E-03    2.25       3.8  T
   4    -52.2151121 -0.417023E-06  0.212E-03    2.25       9.1  T
   5    -52.2151121 -0.415744E-07  0.109E-03    2.25      17.7  T
   6    -52.2151121 -0.115238E-07  0.374E-04    2.25      51.4  T
   7    -52.2151121 -0.623139E-09  0.176E-04    2.25     109.0  T
     SCC iter.                  ...        0 min,  0.010 sec
     gradient                   ...        0 min,  0.019 sec
 * total energy  :   -51.6713632 Eh     change       -0.1774954E-04 Eh
   gradient norm :     0.0024667 Eh/α   predicted    -0.1518816E-04 ( -14.43%)
   displ. norm   :     0.0954182 α      lambda       -0.2415113E-04
   maximum displ.:     0.0798763 α      in ANC's #2, #3, #43, ...

........................................................................
.............................. CYCLE   35 ..............................
........................................................................
   1    -52.2160851 -0.522161E+02  0.539E-02    2.25       0.0  T
   2    -52.2160859 -0.827425E-06  0.314E-02    2.25       1.0  T
   3    -52.2160855  0.454615E-06  0.658E-03    2.25       2.9  T
   4    -52.2160861 -0.672141E-06  0.230E-03    2.25       8.4  T
   5    -52.2160862 -0.454609E-07  0.128E-03    2.25      15.0  T
   6    -52.2160862 -0.190733E-07  0.311E-04    2.25      61.9  T
   7    -52.2160862 -0.325464E-09  0.150E-04    2.25     128.4  T
     SCC iter.                  ...        0 min,  0.010 sec
     gradient                   ...        0 min,  0.019 sec
 * total energy  :   -51.6713729 Eh     change       -0.9708944E-05 Eh
   gradient norm :     0.0019124 Eh/α   predicted    -0.1218833E-04 (  25.54%)
   displ. norm   :     0.0975607 α      lambda       -0.9796267E-05
   maximum displ.:     0.0737169 α      in ANC's #2, #3, #4, ...

........................................................................
.............................. CYCLE   36 ..............................
........................................................................
   1    -52.2158222 -0.522158E+02  0.523E-02    2.26       0.0  T
   2    -52.2158229 -0.716252E-06  0.300E-02    2.26       1.0  T
   3    -52.2158224  0.522272E-06  0.654E-03    2.26       2.9  T
   4    -52.2158230 -0.633428E-06  0.282E-03    2.26       6.8  T
   5    -52.2158231 -0.890641E-07  0.113E-03    2.26      17.1  T
   6    -52.2158232 -0.153924E-07  0.302E-04    2.26      63.8  T
   7    -52.2158232 -0.605880E-09  0.148E-04    2.26     130.0  T
     SCC iter.                  ...        0 min,  0.010 sec
     gradient                   ...        0 min,  0.019 sec
 * total energy  :   -51.6713767 Eh     change       -0.3783814E-05 Eh
   gradient norm :     0.0020232 Eh/α   predicted    -0.4920892E-05 (  30.05%)
   displ. norm   :     0.0297393 α      lambda       -0.5320127E-05
   maximum displ.:     0.0232179 α      in ANC's #2, #3, #8, ...

........................................................................
.............................. CYCLE   37 ..............................
........................................................................
   1    -52.2162146 -0.522162E+02  0.185E-02    2.26       0.0  T
   2    -52.2162147 -0.155036E-06  0.106E-02    2.26       1.8  T
   3    -52.2162146  0.121315E-06  0.337E-03    2.26       5.7  T
   4    -52.2162148 -0.159082E-06  0.105E-03    2.26      18.3  T
   5    -52.2162148 -0.120149E-07  0.499E-04    2.26      38.6  T
   6    -52.2162148 -0.239007E-08  0.122E-04    2.26     157.6  T
     SCC iter.                  ...        0 min,  0.009 sec
     gradient                   ...        0 min,  0.019 sec
 * total energy  :   -51.6713801 Eh     change       -0.3398097E-05 Eh
   gradient norm :     0.0012882 Eh/α   predicted    -0.2663266E-05 ( -21.62%)
   displ. norm   :     0.0215472 α      lambda       -0.5466931E-05
   maximum displ.:     0.0102988 α      in ANC's #6, #2, #4, ...

........................................................................
.............................. CYCLE   38 ..............................
........................................................................
   1    -52.2159750 -0.522160E+02  0.188E-02    2.25       0.0  T
   2    -52.2159755 -0.527770E-06  0.102E-02    2.25       1.9  T
   3    -52.2159755  0.658849E-07  0.368E-03    2.25       5.2  T
   4    -52.2159756 -0.103564E-06  0.173E-03    2.25      11.1  T
   5    -52.2159756 -0.392083E-07  0.710E-04    2.25      27.1  T
   6    -52.2159756 -0.521165E-08  0.270E-04    2.25      71.2  T
     SCC iter.                  ...        0 min,  0.009 sec
     gradient                   ...        0 min,  0.019 sec
 * total energy  :   -51.6713828 Eh     change       -0.2739840E-05 Eh
   gradient norm :     0.0013522 Eh/α   predicted    -0.2736550E-05 (  -0.12%)
   displ. norm   :     0.0278451 α      lambda       -0.4563848E-05
   maximum displ.:     0.0196654 α      in ANC's #11, #2, #4, ...

........................................................................
.............................. CYCLE   39 ..............................
........................................................................
   1    -52.2164471 -0.522164E+02  0.314E-02    2.26       0.0  T
   2    -52.2164476 -0.457904E-06  0.179E-02    2.26       1.1  T
   3    -52.2164472  0.455789E-06  0.571E-03    2.25       3.4  T
   4    -52.2164478 -0.635447E-06  0.153E-03    2.25      12.6  T
   5    -52.2164478 -0.268125E-07  0.693E-04    2.25      27.8  T
   6    -52.2164478 -0.230082E-08  0.277E-04    2.25      69.6  T
     SCC iter.                  ...        0 min,  0.009 sec
     gradient                   ...        0 min,  0.019 sec
 * total energy  :   -51.6713864 Eh     change       -0.3613024E-05 Eh
   gradient norm :     0.0013399 Eh/α   predicted    -0.2283167E-05 ( -36.81%)
   displ. norm   :     0.0393023 α      lambda       -0.5605633E-05
   maximum displ.:     0.0212377 α      in ANC's #11, #3, #4, ...

........................................................................
.............................. CYCLE   40 ..............................
........................................................................
   1    -52.2163077 -0.522163E+02  0.368E-02    2.26       0.0  T
   2    -52.2163080 -0.337800E-06  0.212E-02    2.26       1.0  T
   3    -52.2163078  0.221210E-06  0.438E-03    2.26       4.4  T
   4    -52.2163082 -0.402425E-06  0.117E-03    2.26      16.4  T
   5    -52.2163082 -0.834785E-08  0.645E-04    2.26      29.8  T
   6    -52.2163082 -0.223588E-08  0.184E-04    2.26     104.7  T
     SCC iter.                  ...        0 min,  0.009 sec
     gradient                   ...        0 min,  0.019 sec
 * total energy  :   -51.6713915 Eh     change       -0.5087293E-05 Eh
   gradient norm :     0.0011927 Eh/α   predicted    -0.2805618E-05 ( -44.85%)
   displ. norm   :     0.0719984 α      lambda       -0.4737929E-05
   maximum displ.:     0.0460157 α      in ANC's #3, #2, #11, ...

........................................................................
.............................. CYCLE   41 ..............................
........................................................................
   1    -52.2155979 -0.522156E+02  0.489E-02    2.25       0.0  T
   2    -52.2155984 -0.539114E-06  0.283E-02    2.25       1.0  T
   3    -52.2155977  0.780962E-06  0.697E-03    2.26       2.8  T
   4    -52.2155987 -0.104217E-05  0.177E-03    2.26      10.8  T
   5    -52.2155987 -0.247553E-07  0.799E-04    2.26      24.1  T
   6    -52.2155987 -0.351432E-08  0.287E-04    2.26      67.0  T
     SCC iter.                  ...        0 min,  0.009 sec
     gradient                   ...        0 min,  0.019 sec
 * total energy  :   -51.6713924 Eh     change       -0.8743868E-06 Eh
   gradient norm :     0.0015218 Eh/α   predicted    -0.2376018E-05 ( 171.74%)
   displ. norm   :     0.0368512 α      lambda       -0.4769058E-05
   maximum displ.:     0.0291252 α      in ANC's #2, #11, #10, ...

........................................................................
.............................. CYCLE   42 ..............................
........................................................................
   1    -52.2159546 -0.522160E+02  0.318E-02    2.26       0.0  T
   2    -52.2159549 -0.290148E-06  0.183E-02    2.26       1.1  T
   3    -52.2159549 -0.332558E-07  0.260E-03    2.26       7.4  T
   4    -52.2159550 -0.891016E-07  0.115E-03    2.26      16.7  T
   5    -52.2159550 -0.503306E-08  0.665E-04    2.26      29.0  T
   6    -52.2159550 -0.519596E-08  0.196E-04    2.26      98.0  T
     SCC iter.                  ...        0 min,  0.009 sec
     gradient                   ...        0 min,  0.019 sec
 * total energy  :   -51.6713956 Eh     change       -0.3197144E-05 Eh
   gradient norm :     0.0005806 Eh/α   predicted    -0.2390260E-05 ( -25.24%)
   displ. norm   :     0.0122701 α      lambda       -0.6753776E-06
   maximum displ.:     0.0053145 α      in ANC's #2, #3, #4, ...

   *** GEOMETRY OPTIMIZATION CONVERGED AFTER 42 ITERATIONS ***

------------------------------------------------------------------------
 total energy gain   :        -0.0178651 Eh      -11.2105 kcal/mol
 total RMSD          :         0.8228121 a0        0.4354 Å
 total power (kW/mol):        -1.1167791 (step)  -25.5270 (real)
------------------------------------------------------------------------

 ANCopt (total)                0 d,  0 h,  0 min,  1.837 sec
 optimizer setup                ...        0 min,  0.000 sec (  0.008%)
 model hessian                  ...        0 min,  0.038 sec (  2.061%)
 ANC generation                 ...        0 min,  0.002 sec (  0.083%)
 coordinate transformation      ...        0 min,  0.001 sec (  0.041%)
 single point calculation       ...        0 min,  1.778 sec ( 96.743%)
 optimization log               ...        0 min,  0.004 sec (  0.237%)
 hessian update                 ...        0 min,  0.001 sec (  0.031%)
 rational function              ...        0 min,  0.012 sec (  0.643%)

================
 final structure:
================
$coord
    2.96118688361472   -2.56739280552403   -0.17577290126611      C 
    5.26118888045983   -0.31276242030199   -0.36922616964377      S 
    3.04658021592734    2.11381662053167   -0.28389640912462      C 
    0.63644378444725    1.14094301867038   -0.13693521144836      C 
    0.60181589041926   -1.53857648328589   -0.06555658173366      C 
   -1.77272276896625   -3.06574514210114   -0.00798360065977      C 
   -2.26723796383136   -4.12253844159261   -2.57773630338094      N 
   -3.04059219106957   -6.26191330828912   -2.67867161974195      O 
   -1.92467708405632   -2.74780686978347   -4.36567801896630      O 
   -4.06086070552075   -1.44795558272245    0.72499901758561      C 
   -4.05633737612743    1.04569742789350   -0.71793392283984      C 
   -1.74075798424355    2.65310154952796   -0.03588877101677      C 
   -2.15003209740989    3.62399178429551    2.58140692751332      N 
   -2.94206423348319    5.75337247286437    2.77646807499275      O 
   -1.73200860459218    2.20205971007872    4.31330629384600      O 
    4.00801078692783    4.66061987800406   -0.44988781193428      C 
    2.83508034540335    6.82674824522063    0.05584272349828      C 
    3.46207847646070   -4.53034225325172   -0.15463509497293      H 
   -1.60490120100225   -4.69436145901787    1.25395757240321      H 
   -3.95814623363718   -1.09901043517844    2.75698046758690      H 
   -5.80148283602236   -2.48833855029319    0.34484527081379      H 
   -5.77813185928325    2.10680456007098   -0.30997294347927      H 
   -3.99197971572366    0.68868784242276   -2.75041836485283      H 
   -1.64179253783289    4.30933543933600   -1.26887469443604      H 
    5.96627034224307    4.73326341409303   -1.04120976463797      H 
    0.93112324525184    6.98809961101389    0.74038203392695      H 
    3.82456352167343    8.58859782720008   -0.17619420365957      H 
$end
           -------------------------------------------------
          |                Final Singlepoint                |
           -------------------------------------------------

          ...................................................
          :                      SETUP                      :
          :.................................................:
          :  # basis functions                  84          :
          :  # atomic orbitals                  83          :
          :  # shells                           45          :
          :  # electrons                        90          :
          :  max. iterations                   250          :
          :  Hamiltonian                  GFN2-xTB          :
          :  restarted?                      false          :
          :  GBSA solvation                  false          :
          :  PC potential                    false          :
          :  electronic temp.          300.0000000     K    :
          :  accuracy                    1.0000000          :
          :  -> integral cutoff          0.2500000E+02      :
          :  -> integral neglect         0.1000000E-07      :
          :  -> SCF convergence          0.1000000E-05 Eh   :
          :  -> wf. convergence          0.1000000E-03 e    :
          :  Broyden damping             0.4000000          :
          ...................................................

 iter      E             dE          RMSdq      gap      omega  full diag
   1    -52.2159550 -0.522160E+02  0.807E-05    2.26       0.0  T
   2    -52.2159550 -0.221405E-10  0.376E-05    2.26     512.1  T
   3    -52.2159550 -0.193410E-10  0.324E-05    2.26     593.8  T

   *** convergence criteria satisfied after 3 iterations ***

         #    Occupation            Energy/Eh            Energy/eV
      -------------------------------------------------------------
         1        2.0000           -0.7916358             -21.5415
       ...           ...                  ...                  ...
        39        2.0000           -0.4662069             -12.6861
        40        2.0000           -0.4625640             -12.5870
        41        2.0000           -0.4552502             -12.3880
        42        2.0000           -0.4535755             -12.3424
        43        2.0000           -0.4428562             -12.0507
        44        2.0000           -0.4215819             -11.4718
        45        2.0000           -0.4044132             -11.0046 (HOMO)
        46                         -0.3214988              -8.7484 (LUMO)
        47                         -0.3192430              -8.6870
        48                         -0.2911285              -7.9220
        49                         -0.2340591              -6.3691
        50                         -0.2269946              -6.1768
       ...                                ...                  ...
        83                          0.6555835              17.8393
      -------------------------------------------------------------
                  HL-Gap            0.0829145 Eh            2.2562 eV
             Fermi-level           -0.3629560 Eh           -9.8765 eV

 SCC (total)                   0 d,  0 h,  0 min,  0.039 sec
 SCC setup                      ...        0 min,  0.000 sec (  0.596%)
 Dispersion                     ...        0 min,  0.000 sec (  0.673%)
 integral evaluation            ...        0 min,  0.013 sec ( 33.752%)
 zeroth order Hamiltonian       ...        0 min,  0.000 sec (  0.576%)
 iterations                     ...        0 min,  0.005 sec ( 12.981%)
 molecular gradient             ...        0 min,  0.020 sec ( 50.336%)
 printout                       ...        0 min,  0.000 sec (  0.933%)

         :::::::::::::::::::::::::::::::::::::::::::::::::::::
         ::                     SUMMARY                     ::
         :::::::::::::::::::::::::::::::::::::::::::::::::::::
         :: total energy             -51.671395589354 Eh    ::
         :: gradient norm              0.000581028488 Eh/a0 ::
         :: HOMO-LUMO gap              2.256217259647 eV    ::
         ::.................................................::
         :: SCC energy               -52.215955039032 Eh    ::
         :: -> isotropic ES            0.093531535349 Eh    ::
         :: -> anisotropic ES          0.015317642093 Eh    ::
         :: -> anisotropic XC          0.005388936050 Eh    ::
         :: -> dispersion             -0.032446442562 Eh    ::
         :: repulsion energy           0.544149770392 Eh    ::
         :: add. restraining           0.000000000000 Eh    ::
         :::::::::::::::::::::::::::::::::::::::::::::::::::::

           -------------------------------------------------
          |                Property Printout                |
           -------------------------------------------------

    * Orbital Energies and Occupations

         #    Occupation            Energy/Eh            Energy/eV
      -------------------------------------------------------------
         1        2.0000           -0.7916358             -21.5415
       ...           ...                  ...                  ...
        33        2.0000           -0.4900202             -13.3341
        34        2.0000           -0.4886732             -13.2975
        35        2.0000           -0.4851844             -13.2025
        36        2.0000           -0.4832763             -13.1506
        37        2.0000           -0.4769933             -12.9796
        38        2.0000           -0.4710373             -12.8176
        39        2.0000           -0.4662069             -12.6861
        40        2.0000           -0.4625640             -12.5870
        41        2.0000           -0.4552502             -12.3880
        42        2.0000           -0.4535755             -12.3424
        43        2.0000           -0.4428562             -12.0507
        44        2.0000           -0.4215819             -11.4718
        45        2.0000           -0.4044132             -11.0046 (HOMO)
        46                         -0.3214988              -8.7484 (LUMO)
        47                         -0.3192430              -8.6870
        48                         -0.2911285              -7.9220
        49                         -0.2340591              -6.3691
        50                         -0.2269946              -6.1768
        51                         -0.1838666              -5.0033
        52                         -0.1395128              -3.7963
        53                         -0.0432888              -1.1779
        54                         -0.0323548              -0.8804
        55                         -0.0260171              -0.7080
        56                          0.0090778               0.2470
       ...                                ...                  ...
        83                          0.6555835              17.8393
      -------------------------------------------------------------
                  HL-Gap            0.0829145 Eh            2.2562 eV
             Fermi-level           -0.3629560 Eh           -9.8765 eV

     #   Z        covCN         q      C6AA      α(0)
     1   6 C      2.936    -0.033    28.820     8.804
     2  16 S      2.360     0.030   139.819    19.901
     3   6 C      2.984     0.016    27.642     8.624
     4   6 C      3.163    -0.011    27.959     8.642
     5   6 C      3.173    -0.003    27.715     8.599
     6   6 C      3.793    -0.018    20.897     6.510
     7   7 N      2.757     0.546    13.525     5.462
     8   8 O      0.928    -0.370    21.063     6.155
     9   8 O      0.927    -0.375    21.158     6.169
    10   6 C      3.808    -0.062    21.690     6.630
    11   6 C      3.808    -0.063    21.704     6.632
    12   6 C      3.792    -0.016    20.871     6.506
    13   7 N      2.757     0.548    13.506     5.458
    14   8 O      0.928    -0.376    21.174     6.171
    15   8 O      0.927    -0.372    21.103     6.161
    16   6 C      2.941    -0.032    28.804     8.802
    17   6 C      2.837    -0.087    30.177     9.002
    18   1 H      0.926     0.057     2.231     2.336
    19   1 H      0.924     0.084     1.943     2.180
    20   1 H      0.924     0.085     1.923     2.169
    21   1 H      0.924     0.059     2.210     2.325
    22   1 H      0.924     0.059     2.212     2.326
    23   1 H      0.924     0.086     1.921     2.168
    24   1 H      0.924     0.087     1.912     2.163
    25   1 H      0.925     0.053     2.278     2.360
    26   1 H      0.926     0.055     2.255     2.348
    27   1 H      0.926     0.055     2.262     2.352

 Mol. C6AA /au·bohr⁶  :      10456.242795
 Mol. C8AA /au·bohr⁸  :     270689.402851
 Mol. α(0) /au        :        156.954260


Wiberg/Mayer (AO) data.
largest (>0.10) Wiberg bond orders for each atom
          total WBO             WBO to atom ...
     1  C   3.954        C    5 1.566    S    2 1.221    H   18 0.969
     2  S   2.653        C    1 1.221    C    3 1.154
     3  C   3.953        C    4 1.490    S    2 1.154    C   16 1.129
     4  C   3.979        C    3 1.490    C    5 1.249    C   12 1.000
     5  C   3.980        C    1 1.566    C    4 1.249    C    6 0.995
     6  C   3.967        C    5 0.995    C   10 0.970    H   19 0.956    N    7 0.884
     7  N   3.904        O    8 1.488    O    9 1.478    C    6 0.884
     8  O   1.959        N    7 1.488    O    9 0.373
     9  O   1.954        N    7 1.478    O    8 0.373
    10  C   3.988        C   11 1.015    H   21 0.971    C    6 0.970    H   20 0.957
    11  C   3.988        C   10 1.015    H   22 0.971    C   12 0.968    H   23 0.957
    12  C   3.966        C    4 1.000    C   11 0.968    H   24 0.951    N   13 0.883
    13  N   3.904        O   15 1.483    O   14 1.480    C   12 0.883
    14  O   1.954        N   13 1.480    O   15 0.370
    15  O   1.959        N   13 1.483    O   14 0.370
    16  C   3.989        C   17 1.868    C    3 1.129    H   25 0.960
    17  C   3.989        C   16 1.868    H   27 0.976    H   26 0.970
    18  H   0.996        C    1 0.969
    19  H   0.993        C    6 0.956
    20  H   0.993        C   10 0.957
    21  H   0.996        C   10 0.971
    22  H   0.996        C   11 0.971
    23  H   0.993        C   11 0.957
    24  H   0.992        C   12 0.951
    25  H   0.997        C   16 0.960
    26  H   0.997        C   17 0.970
    27  H   0.996        C   17 0.976

molecular dipole:
                 x           y           z       tot (Debye)
 q only:        0.616       0.265      -0.048
   full:        0.401       0.185      -0.026       1.125
molecular quadrupole (traceless):
                xx          xy          yy          xz          yz          zz
 q only:       12.991       0.790      -3.847      -0.795     -16.048      -9.144
  q+dip:       13.856       0.306      -2.694      -1.377     -16.326     -11.162
   full:       13.761       0.466      -3.382      -0.880     -16.452     -10.379

           -------------------------------------------------
          |                Geometry Summary                 |
           -------------------------------------------------

      molecular mass/u    :      254.2600000
   center of mass at/Å    :       -0.0552640       0.2056334      -0.0516093
  moments of inertia/u·Å² :        0.8355093E+03   0.1232558E+04   0.1757353E+04
rotational constants/cm⁻¹ :        0.2017648E-01   0.1367695E-01   0.9592628E-02

 * 25 selected distances

     #   Z        #   Z                                     value/Å
     1   6 C      2  16 S                                 1.7074306
     2  16 S      3   6 C                                 1.7390586 (max)
     3   6 C      4   6 C                                 1.3775734
     1   6 C      5   6 C                                 1.3633112
     4   6 C      5   6 C                                 1.4185622
     5   6 C      6   6 C                                 1.4943044
     7   7 N      8   8 O                                 1.2049901
     7   7 N      9   8 O                                 1.2071704
     6   6 C     10   6 C                                 1.5327957
    10   6 C     11   6 C                                 1.5245799
     4   6 C     12   6 C                                 1.4918597
    11   6 C     12   6 C                                 1.5346908
    13   7 N     14   8 O                                 1.2066664
    13   7 N     15   8 O                                 1.2062584
    16   6 C     17   6 C                                 1.3307142
     1   6 C     18   1 H                                 1.0720914 (min)
     6   6 C     19   1 H                                 1.0938813
    10   6 C     20   1 H                                 1.0923713
    10   6 C     21   1 H                                 1.0917837
    11   6 C     22   1 H                                 1.0918194
    11   6 C     23   1 H                                 1.0925416
    12   6 C     24   1 H                                 1.0938952
    16   6 C     25   1 H                                 1.0831625
    17   6 C     26   1 H                                 1.0740709
    17   6 C     27   1 H                                 1.0763304

 * 4 distinct bonds (by element types)

   Z      Z             #   av. dist./Å        max./Å        min./Å
   1 H    6 C          10     1.0861948     1.0938952     1.0720914
   6 C    6 C           9     1.4520435     1.5346908     1.3307142
   7 N    8 O           4     1.2062713     1.2071704     1.2049901
   6 C   16 S           2     1.7232446     1.7390586     1.7074306


optimized geometry written to: xtbopt.xyz


           -------------------------------------------------
          | TOTAL ENERGY              -51.671395589354 Eh   |
          | GRADIENT NORM               0.000581028488 Eh/α |
          | HOMO-LUMO GAP               2.256217259647 eV   |
           -------------------------------------------------

------------------------------------------------------------------------
 * finished run on 2021/05/19 at 11:00:53.723     
------------------------------------------------------------------------
 total:
 * wall-time:     0 d,  0 h,  0 min,  2.019 sec
 *  cpu-time:     0 d,  0 h,  0 min,  1.929 sec
 * ratio c/w:     0.955 speedup
 SCF:
 * wall-time:     0 d,  0 h,  0 min,  0.105 sec
 *  cpu-time:     0 d,  0 h,  0 min,  0.053 sec
 * ratio c/w:     0.507 speedup
 ANC optimizer:
 * wall-time:     0 d,  0 h,  0 min,  1.877 sec
 *  cpu-time:     0 d,  0 h,  0 min,  1.851 sec
 * ratio c/w:     0.986 speedup

