      -----------------------------------------------------------      
     |                   =====================                   |     
     |                           x T B                           |     
     |                   =====================                   |     
     |                         S. Grimme                         |     
     |          Mulliken Center for Theoretical Chemistry        |     
     |                    University of Bonn                     |     
     |                Version 6.2 RC2 (SAW190805)                |     
      -----------------------------------------------------------      

   This program is distributed in the hope that it will be useful,
   but WITHOUT ANY WARRANTY; without even the implied warranty of
   MERCHANTABILITY or FITNESS FOR A PARTICULAR PURPOSE.
   
   FOR NON-COMMERCIAL, ACADEMIA USE ONLY.
   
   Cite this work as:
   * S. Grimme, C. Bannwarth, P. Shushkov, J. Chem. Theory Comput., 2017,
     13, 1989-2009. DOI: 10.1021/acs.jctc.7b00118
   * C. Bannwarth, S. Ehlert and S. Grimme., J. Chem. Theory Comput., 2019,
     15, 1652-1671. DOI: 10.1021/acs.jctc.8b01176
   * P. Pracht, E. Caldeweyher, S. Ehlert, S. Grimme, ChemRxiv, 2019, preprint.
     DOI: 10.26434/chemrxiv.8326202.v1
   
   for DFT-D4:
   * E. Caldeweyher, C. Bannwarth and S. Grimme, J. Chem. Phys., 2017,
     147, 034112. DOI: 10.1063/1.4993215
   * E. Caldeweyher, S. Ehlert, A. Hansen, H. Neugebauer, S. Spicher,
     C. Bannwarth and S. Grimme, J. Chem. Phys., 2019, 150, 154122.
     DOI: 10.1063/1.5090222
   
   for sTDA-xTB:
   * S. Grimme and C. Bannwarth, J. Chem. Phys., 2016, 145, 054103.
     DOI: 10.1063/1.4959605
   
   in the mass-spec context:
   * V. Asgeirsson, C. Bauer and S. Grimme, Chem. Sci., 2017, 8, 4879.
     DOI: 10.1039/c7sc00601b
   
   for metadynamics refer to:
   * S. Grimme, J. Chem. Theory Comput., 2019, 155, 2847-2862
     DOI: 10.1021/acs.jctc.9b00143
   
   with help from (in alphabetical order)
   C. Bannwarth, F. Bohle, G. Brandenburg, E. Caldeweyher, M. Checinski,
   S. Dohm, S. Ehlert, S. Ehrlich, F. März, H. Neugebauer, J. Pisarek,
   P. Pracht, P. Shushkov, and S. Spicher.
   
 * started run on 2021/05/19 at 10:59:03.220     

           -------------------------------------------------
          |                Calculation Setup                |
           -------------------------------------------------

          program call               : /ihome/ghutchison/geoffh/xtb/xtb 95.xyz -opt
          hostname                   : smp-n58
          coordinate file            : 95.xyz
          omp threads                :                     1
          number of atoms            :                    16
          number of electrons        :                    40
          charge                     :                     0
          spin                       :                   0.0
          first test random number   :      0.96739239861646


########################################################################
# WARNING! Please study the warnings concerning your input carefully
#  - the use of '-opt' is discouraged, please use '--opt' next time
########################################################################

           ------------------------------------------------- 
          |                 G F N 2 - x T B                 |
          | Geometry, Frequencies, Noncovalent interactions |
          |            JCTC 2019 parametrisation            |
           ------------------------------------------------- 
             KAB for C  - Si     :                1.0500
             KAB for H  - Pd     :                0.9500
             k(s)              :                1.8500
             k(p)              :                2.2300
             k(d)              :                2.2300
             k(f)              :                2.0000
             kEN (H0ij)        :               -2.0000
             D4 a1             :                0.5200
             D4 a2             :                5.0000
             D4 s6             :                1.0000
             D4 s8             :                2.7000
             D4 s9             :                5.0000
             alphaj            :                2.0000

  Z AO/shell   Hii/eV     exponent
  1     Wed Apr 25 08:07:45 CEST 2018   EN: 2.200 GM2: 0.406  GM3: 0.0800  RAES: 1.40
     1s    -10.707211    1.230000
  6     Wed Apr 25 08:07:45 CEST 2018   EN: 2.550 GM2: 0.538  GM3: 0.1500  RAES: 3.00
     2s    -13.970922    2.096432
     2p    -10.063292    1.800000

           ------------------------------------------------- 
          |        Self-Consistent Charge Iterations        |
           ------------------------------------------------- 

          ...................................................
          :                      SETUP                      :
          :.................................................:
          :  # basis functions                  40          :
          :  # atomic orbitals                  40          :
          :  # shells                           24          :
          :  # electrons                        40          :
          :  max. iterations                   250          :
          :  Hamiltonian                  GFN2-xTB          :
          :  restarted?                      false          :
          :  GBSA solvation                  false          :
          :  PC potential                    false          :
          :  electronic temp.          300.0000000     K    :
          :  accuracy                    1.0000000          :
          :  -> integral cutoff          0.2500000E+02      :
          :  -> integral neglect         0.1000000E-07      :
          :  -> SCF convergence          0.1000000E-05 Eh   :
          :  -> wf. convergence          0.1000000E-03 e    :
          :  Broyden damping             0.4000000          :
          ...................................................

 iter      E             dE          RMSdq      gap      omega  full diag
   1    -21.5336565 -0.215337E+02  0.480E+00    3.78       0.0  T
   2    -21.5518059 -0.181494E-01  0.285E+00    3.76       1.0  T
   3    -21.5511969  0.608995E-03  0.589E-01    3.75       1.0  T
   4    -21.5518804 -0.683504E-03  0.299E-01    3.75       1.0  T
   5    -21.5531596 -0.127917E-02  0.442E-02    3.75       1.0  T
   6    -21.5531564  0.320744E-05  0.237E-02    3.75       1.1  T
   7    -21.5531605 -0.408117E-05  0.800E-03    3.75       3.1  T
   8    -21.5531611 -0.600304E-06  0.175E-03    3.75      14.3  T
   9    -21.5531611 -0.397171E-07  0.623E-04    3.75      40.1  T
  10    -21.5531611 -0.833769E-09  0.170E-04    3.75     146.6  T

   *** convergence criteria satisfied after 10 iterations ***

         #    Occupation            Energy/Eh            Energy/eV
      -------------------------------------------------------------
         1        2.0000           -0.6402921             -17.4232
       ...           ...                  ...                  ...
        14        2.0000           -0.4640774             -12.6282
        15        2.0000           -0.4433487             -12.0641
        16        2.0000           -0.4291541             -11.6779
        17        2.0000           -0.4195516             -11.4166
        18        2.0000           -0.4170091             -11.3474
        19        2.0000           -0.4000974             -10.8872
        20        2.0000           -0.3840526             -10.4506 (HOMO)
        21                         -0.2461272              -6.6975 (LUMO)
        22                         -0.2239337              -6.0935
        23                         -0.1805060              -4.9118
        24                         -0.0875196              -2.3815
        25                          0.0972980               2.6476
       ...                                ...                  ...
        40                          0.6472066              17.6114
      -------------------------------------------------------------
                  HL-Gap            0.1379253 Eh            3.7531 eV
             Fermi-level           -0.3150899 Eh           -8.5740 eV

 SCC (total)                   0 d,  0 h,  0 min,  0.015 sec
 SCC setup                      ...        0 min,  0.000 sec (  1.315%)
 Dispersion                     ...        0 min,  0.000 sec (  1.267%)
 integral evaluation            ...        0 min,  0.003 sec ( 20.033%)
 zeroth order Hamiltonian       ...        0 min,  0.000 sec (  0.489%)
 iterations                     ...        0 min,  0.006 sec ( 41.543%)
 molecular gradient             ...        0 min,  0.005 sec ( 33.183%)
 printout                       ...        0 min,  0.000 sec (  1.776%)

         :::::::::::::::::::::::::::::::::::::::::::::::::::::
         ::                     SUMMARY                     ::
         :::::::::::::::::::::::::::::::::::::::::::::::::::::
         :: total energy             -21.156623839466 Eh    ::
         :: gradient norm              0.030893851251 Eh/a0 ::
         :: HOMO-LUMO gap              3.753139313022 eV    ::
         ::.................................................::
         :: SCC energy               -21.553161103093 Eh    ::
         :: -> isotropic ES            0.001472668616 Eh    ::
         :: -> anisotropic ES          0.003648794265 Eh    ::
         :: -> anisotropic XC          0.017599812291 Eh    ::
         :: -> dispersion             -0.012202621931 Eh    ::
         :: repulsion energy           0.396522982246 Eh    ::
         :: add. restraining           0.000000000000 Eh    ::
         :::::::::::::::::::::::::::::::::::::::::::::::::::::

      ----------------------------------------------------------- 
     |                   =====================                   |
     |                        A N C O P T                        |
     |                   =====================                   |
     |               Approximate Normal Coordinate               |
     |                Rational Function Optimizer                |
      ----------------------------------------------------------- 

          ...................................................
          :                      SETUP                      :
          :.................................................:
          :   optimization level            normal          :
          :   max. optcycles                   200          :
          :   ANC micro-cycles                  20          :
          :   degrees of freedom                42          :
          :.................................................:
          :   RF solver                   davidson          :
          :   input Hessian                  false          :
          :   write xtbopt.log                true          :
          :   linear?                        false          :
          :   energy convergence         0.5000000E-05 Eh   :
          :   grad. convergence          0.1000000E-02 Eh/α :
          :   maximium RF displ.         2.0000000          :
          :   Hlow (freq-cutoff)         0.5000000E-02      :
          :   Hmax (freq-cutoff)         5.0000000          :
          :   S6 in model hess.         20.0000000          :
          ...................................................

generating ANC from model Hessian ...
Using Lindh-Hessian (1995)
 Shifting diagonal of input Hessian by   1.761016082887825E-003
 Lowest  eigenvalues of input Hessian
   -0.000000   -0.000000    0.000000    0.000000    0.000000    0.000000
    0.005000    0.006517    0.009525    0.015598    0.016097    0.022985
    0.026032    0.034160    0.045798    0.056675    0.067925    0.073413
 Highest eigenvalues
    1.512944    1.593920    1.818435    1.860355    1.937380    1.990209
 

........................................................................
.............................. CYCLE    1 ..............................
........................................................................
   1    -21.5531611 -0.215532E+02  0.599E-05    3.75       0.0  T
   2    -21.5531611 -0.301981E-11  0.335E-05    3.75     745.4  T
   3    -21.5531611  0.290257E-11  0.249E-05    3.75    1002.2  T
     SCC iter.                  ...        0 min,  0.002 sec
     gradient                   ...        0 min,  0.005 sec
 * total energy  :   -21.1566238 Eh     change       -0.2759847E-08 Eh
   gradient norm :     0.0308944 Eh/α   predicted     0.0000000E+00 (-100.00%)
   displ. norm   :     0.1661171 α      lambda       -0.2456455E-02
   maximum displ.:     0.1033841 α      in ANC's #2, #8, #24, ...

........................................................................
.............................. CYCLE    2 ..............................
........................................................................
   1    -21.5766927 -0.215767E+02  0.102E-01    3.80       0.0  T
   2    -21.5766944 -0.164702E-05  0.607E-02    3.80       1.0  T
   3    -21.5766895  0.487102E-05  0.197E-02    3.80       1.3  T
   4    -21.5766954 -0.587778E-05  0.236E-03    3.80      10.6  T
   5    -21.5766954 -0.237040E-07  0.153E-03    3.80      16.3  T
     SCC iter.                  ...        0 min,  0.003 sec
     gradient                   ...        0 min,  0.005 sec
 * total energy  :   -21.1580833 Eh     change       -0.1459470E-02 Eh
   gradient norm :     0.0073986 Eh/α   predicted    -0.1262119E-02 ( -13.52%)
   displ. norm   :     0.0952697 α      lambda       -0.2018404E-03
   maximum displ.:     0.0796386 α      in ANC's #2, #1, #10, ...

........................................................................
.............................. CYCLE    3 ..............................
........................................................................
   1    -21.5812245 -0.215812E+02  0.687E-02    3.80       0.0  T
   2    -21.5812250 -0.564560E-06  0.407E-02    3.80       1.0  T
   3    -21.5812226  0.245985E-05  0.122E-02    3.80       2.0  T
   4    -21.5812254 -0.283844E-05  0.176E-03    3.80      14.2  T
   5    -21.5812255 -0.341814E-07  0.623E-04    3.80      40.1  T
     SCC iter.                  ...        0 min,  0.003 sec
     gradient                   ...        0 min,  0.005 sec
 * total energy  :   -21.1582145 Eh     change       -0.1312191E-03 Eh
   gradient norm :     0.0024498 Eh/α   predicted    -0.1018365E-03 ( -22.39%)
   displ. norm   :     0.0980723 α      lambda       -0.8532715E-04
   maximum displ.:     0.0776815 α      in ANC's #2, #1, #5, ...

........................................................................
.............................. CYCLE    4 ..............................
........................................................................
   1    -21.5817781 -0.215818E+02  0.734E-02    3.78       0.0  T
   2    -21.5817785 -0.375819E-06  0.434E-02    3.78       1.0  T
   3    -21.5817765  0.203313E-05  0.109E-02    3.78       2.3  T
   4    -21.5817788 -0.230678E-05  0.147E-03    3.78      17.0  T
   5    -21.5817788 -0.252717E-07  0.438E-04    3.78      57.1  T
   6    -21.5817788 -0.287891E-09  0.212E-04    3.78     118.2  T
     SCC iter.                  ...        0 min,  0.003 sec
     gradient                   ...        0 min,  0.005 sec
 * total energy  :   -21.1582780 Eh     change       -0.6351553E-04 Eh
   gradient norm :     0.0021340 Eh/α   predicted    -0.4307283E-04 ( -32.19%)
   displ. norm   :     0.1102849 α      lambda       -0.6590248E-04
   maximum displ.:     0.0813027 α      in ANC's #2, #1, #5, ...

........................................................................
.............................. CYCLE    5 ..............................
........................................................................
   1    -21.5808017 -0.215808E+02  0.873E-02    3.75       0.0  T
   2    -21.5808019 -0.213220E-06  0.515E-02    3.75       1.0  T
   3    -21.5808004  0.150882E-05  0.982E-03    3.75       2.5  T
   4    -21.5808021 -0.170027E-05  0.109E-03    3.75      23.0  T
   5    -21.5808021 -0.126183E-07  0.409E-04    3.75      61.1  T
   6    -21.5808021 -0.188187E-09  0.170E-04    3.75     146.9  T
     SCC iter.                  ...        0 min,  0.003 sec
     gradient                   ...        0 min,  0.005 sec
 * total energy  :   -21.1583313 Eh     change       -0.5323257E-04 Eh
   gradient norm :     0.0026973 Eh/α   predicted    -0.3335077E-04 ( -37.35%)
   displ. norm   :     0.1410010 α      lambda       -0.6848515E-04
   maximum displ.:     0.0958985 α      in ANC's #2, #1, #5, ...

........................................................................
.............................. CYCLE    6 ..............................
........................................................................
   1    -21.5795518 -0.215796E+02  0.106E-01    3.73       0.0  T
   2    -21.5795520 -0.200814E-06  0.625E-02    3.73       1.0  T
   3    -21.5795513  0.690042E-06  0.729E-03    3.73       3.4  T
   4    -21.5795521 -0.838642E-06  0.815E-04    3.73      30.7  T
   5    -21.5795521 -0.539531E-08  0.364E-04    3.73      68.7  T
     SCC iter.                  ...        0 min,  0.002 sec
     gradient                   ...        0 min,  0.005 sec
 * total energy  :   -21.1583854 Eh     change       -0.5409178E-04 Eh
   gradient norm :     0.0033076 Eh/α   predicted    -0.3492409E-04 ( -35.44%)
   displ. norm   :     0.1944262 α      lambda       -0.8109053E-04
   maximum displ.:     0.1314724 α      in ANC's #1, #2, #3, ...

........................................................................
.............................. CYCLE    7 ..............................
........................................................................
   1    -21.5783000 -0.215783E+02  0.147E-01    3.69       0.0  T
   2    -21.5783005 -0.410622E-06  0.864E-02    3.69       1.0  T
   3    -21.5782995  0.971926E-06  0.930E-03    3.69       2.7  T
   4    -21.5783007 -0.123914E-05  0.131E-03    3.69      19.0  T
   5    -21.5783007 -0.792521E-08  0.777E-04    3.69      32.2  T
   6    -21.5783007 -0.273835E-08  0.158E-04    3.69     157.9  T
     SCC iter.                  ...        0 min,  0.003 sec
     gradient                   ...        0 min,  0.005 sec
 * total energy  :   -21.1584371 Eh     change       -0.5176684E-04 Eh
   gradient norm :     0.0037972 Eh/α   predicted    -0.4207800E-04 ( -18.72%)
   displ. norm   :     0.1431479 α      lambda       -0.6514320E-04
   maximum displ.:     0.1096759 α      in ANC's #1, #2, #3, ...

........................................................................
.............................. CYCLE    8 ..............................
........................................................................
   1    -21.5784661 -0.215785E+02  0.104E-01    3.68       0.0  T
   2    -21.5784663 -0.233100E-06  0.608E-02    3.68       1.0  T
   3    -21.5784661  0.253889E-06  0.546E-03    3.68       4.6  T
   4    -21.5784665 -0.375709E-06  0.545E-04    3.68      45.9  T
   5    -21.5784665 -0.738467E-09  0.357E-04    3.68      70.0  T
     SCC iter.                  ...        0 min,  0.003 sec
     gradient                   ...        0 min,  0.005 sec
 * total energy  :   -21.1584818 Eh     change       -0.4466983E-04 Eh
   gradient norm :     0.0035110 Eh/α   predicted    -0.3323922E-04 ( -25.59%)
   displ. norm   :     0.1365578 α      lambda       -0.6364790E-04
   maximum displ.:     0.1138654 α      in ANC's #1, #2, #3, ...

........................................................................
.............................. CYCLE    9 ..............................
........................................................................
   1    -21.5799521 -0.215800E+02  0.971E-02    3.68       0.0  T
   2    -21.5799524 -0.276239E-06  0.571E-02    3.68       1.0  T
   3    -21.5799518  0.548429E-06  0.715E-03    3.68       3.5  T
   4    -21.5799525 -0.688082E-06  0.105E-03    3.68      23.8  T
   5    -21.5799525 -0.693374E-08  0.611E-04    3.68      40.9  T
   6    -21.5799525 -0.172650E-08  0.206E-04    3.68     121.4  T
     SCC iter.                  ...        0 min,  0.003 sec
     gradient                   ...        0 min,  0.005 sec
 * total energy  :   -21.1585248 Eh     change       -0.4300392E-04 Eh
   gradient norm :     0.0016984 Eh/α   predicted    -0.3241866E-04 ( -24.61%)
   displ. norm   :     0.3589295 α      lambda       -0.4926272E-04
   maximum displ.:     0.2930337 α      in ANC's #1, #2, #3, ...

........................................................................
.............................. CYCLE   10 ..............................
........................................................................
   1    -21.5788571 -0.215789E+02  0.244E-01    3.64       0.0  T
   2    -21.5788583 -0.121885E-05  0.144E-01    3.64       1.0  T
   3    -21.5788557  0.257944E-05  0.158E-02    3.64       1.6  T
   4    -21.5788590 -0.333520E-05  0.194E-03    3.64      12.9  T
   5    -21.5788591 -0.215123E-07  0.111E-03    3.64      22.5  T
   6    -21.5788591 -0.659222E-08  0.352E-04    3.64      71.1  T
   7    -21.5788591 -0.899121E-10  0.116E-04    3.64     216.0  T
     SCC iter.                  ...        0 min,  0.003 sec
     gradient                   ...        0 min,  0.005 sec
 * total energy  :   -21.1585366 Eh     change       -0.1179321E-04 Eh
   gradient norm :     0.0051909 Eh/α   predicted    -0.2604238E-04 ( 120.83%)
   displ. norm   :     0.0456214 α      lambda       -0.6327274E-04
   maximum displ.:     0.0403002 α      in ANC's #2, #3, #5, ...

........................................................................
.............................. CYCLE   11 ..............................
........................................................................
   1    -21.5807843 -0.215808E+02  0.278E-02    3.65       0.0  T
   2    -21.5807844 -0.172192E-06  0.163E-02    3.65       1.5  T
   3    -21.5807841  0.315675E-06  0.472E-03    3.65       5.3  T
   4    -21.5807845 -0.382682E-06  0.642E-04    3.65      39.0  T
   5    -21.5807845 -0.226819E-08  0.285E-04    3.65      87.8  T
     SCC iter.                  ...        0 min,  0.003 sec
     gradient                   ...        0 min,  0.005 sec
 * total energy  :   -21.1585711 Eh     change       -0.3446441E-04 Eh
   gradient norm :     0.0020716 Eh/α   predicted    -0.3170126E-04 (  -8.02%)
   displ. norm   :     0.0645262 α      lambda       -0.1857001E-04
   maximum displ.:     0.0571844 α      in ANC's #1, #2, #6, ...

........................................................................
.............................. CYCLE   12 ..............................
........................................................................
   1    -21.5806886 -0.215807E+02  0.482E-02    3.65       0.0  T
   2    -21.5806887 -0.912325E-07  0.284E-02    3.65       1.0  T
   3    -21.5806885  0.249715E-06  0.407E-03    3.65       6.1  T
   4    -21.5806888 -0.304011E-06  0.442E-04    3.65      56.6  T
   5    -21.5806888 -0.409173E-09  0.248E-04    3.65     100.7  T
     SCC iter.                  ...        0 min,  0.003 sec
     gradient                   ...        0 min,  0.005 sec
 * total energy  :   -21.1585823 Eh     change       -0.1124159E-04 Eh
   gradient norm :     0.0016298 Eh/α   predicted    -0.9322974E-05 ( -17.07%)
   displ. norm   :     0.1658988 α      lambda       -0.1267000E-04
   maximum displ.:     0.1458580 α      in ANC's #1, #2, #3, ...

........................................................................
.............................. CYCLE   13 ..............................
........................................................................
   1    -21.5799530 -0.215800E+02  0.116E-01    3.64       0.0  T
   2    -21.5799533 -0.297079E-06  0.685E-02    3.64       1.0  T
   3    -21.5799519  0.135094E-05  0.974E-03    3.64       2.6  T
   4    -21.5799535 -0.158106E-05  0.107E-03    3.64      23.4  T
   5    -21.5799535 -0.970492E-08  0.476E-04    3.64      52.5  T
   6    -21.5799535 -0.504503E-09  0.195E-04    3.64     128.0  T
     SCC iter.                  ...        0 min,  0.003 sec
     gradient                   ...        0 min,  0.005 sec
 * total energy  :   -21.1585937 Eh     change       -0.1135743E-04 Eh
   gradient norm :     0.0008737 Eh/α   predicted    -0.6414031E-05 ( -43.53%)
   displ. norm   :     0.0908600 α      lambda       -0.3882989E-05
   maximum displ.:     0.0767168 α      in ANC's #1, #2, #3, ...

........................................................................
.............................. CYCLE   14 ..............................
........................................................................
   1    -21.5799527 -0.215800E+02  0.656E-02    3.63       0.0  T
   2    -21.5799528 -0.762297E-07  0.386E-02    3.63       1.0  T
   3    -21.5799527  0.103182E-06  0.336E-03    3.63       7.4  T
   4    -21.5799528 -0.149603E-06  0.534E-04    3.63      46.8  T
   5    -21.5799528 -0.705910E-09  0.335E-04    3.63      74.6  T
     SCC iter.                  ...        0 min,  0.003 sec
     gradient                   ...        0 min,  0.005 sec
 * total energy  :   -21.1585969 Eh     change       -0.3255489E-05 Eh
   gradient norm :     0.0011320 Eh/α   predicted    -0.1949552E-05 ( -40.11%)
   displ. norm   :     0.0616082 α      lambda       -0.4083543E-05
   maximum displ.:     0.0488946 α      in ANC's #1, #2, #26, ...

........................................................................
.............................. CYCLE   15 ..............................
........................................................................
   1    -21.5808359 -0.215808E+02  0.409E-02    3.64       0.0  T
   2    -21.5808359 -0.548065E-07  0.241E-02    3.64       1.0  T
   3    -21.5808359  0.707179E-07  0.250E-03    3.64      10.0  T
   4    -21.5808360 -0.951925E-07  0.389E-04    3.64      64.3  T
   5    -21.5808360 -0.660314E-09  0.217E-04    3.64     115.0  T
     SCC iter.                  ...        0 min,  0.003 sec
     gradient                   ...        0 min,  0.005 sec
 * total energy  :   -21.1585978 Eh     change       -0.8523924E-06 Eh
   gradient norm :     0.0021044 Eh/α   predicted    -0.2045673E-05 ( 139.99%)
   displ. norm   :     0.0477776 α      lambda       -0.4348631E-05
   maximum displ.:     0.0392232 α      in ANC's #1, #2, #26, ...

........................................................................
.............................. CYCLE   16 ..............................
........................................................................
   1    -21.5806190 -0.215806E+02  0.351E-02    3.63       0.0  T
   2    -21.5806190 -0.270528E-07  0.207E-02    3.63       1.2  T
   3    -21.5806190  0.225247E-07  0.163E-03    3.63      15.4  T
   4    -21.5806190 -0.345967E-07  0.342E-04    3.63      73.1  T
   5    -21.5806190 -0.688690E-09  0.170E-04    3.63     146.9  T
     SCC iter.                  ...        0 min,  0.003 sec
     gradient                   ...        0 min,  0.005 sec
 * total energy  :   -21.1586007 Eh     change       -0.2877847E-05 Eh
   gradient norm :     0.0010703 Eh/α   predicted    -0.2180590E-05 ( -24.23%)
   displ. norm   :     0.0558512 α      lambda       -0.2453709E-05
   maximum displ.:     0.0411154 α      in ANC's #1, #2, #26, ...

........................................................................
.............................. CYCLE   17 ..............................
........................................................................
   1    -21.5801985 -0.215802E+02  0.403E-02    3.63       0.0  T
   2    -21.5801985 -0.342485E-07  0.237E-02    3.63       1.1  T
   3    -21.5801985  0.929419E-08  0.155E-03    3.63      16.1  T
   4    -21.5801985 -0.250128E-07  0.343E-04    3.63      72.8  T
   5    -21.5801985 -0.246942E-09  0.205E-04    3.63     121.7  T
     SCC iter.                  ...        0 min,  0.003 sec
     gradient                   ...        0 min,  0.005 sec
 * total energy  :   -21.1586022 Eh     change       -0.1555718E-05 Eh
   gradient norm :     0.0008442 Eh/α   predicted    -0.1228449E-05 ( -21.04%)
   displ. norm   :     0.0187693 α      lambda       -0.1280609E-05
   maximum displ.:     0.0132136 α      in ANC's #2, #1, #3, ...

   *** GEOMETRY OPTIMIZATION CONVERGED AFTER 17 ITERATIONS ***

------------------------------------------------------------------------
 total energy gain   :        -0.0019784 Eh       -1.2414 kcal/mol
 total RMSD          :         0.4345751 a0        0.2300 Å
 total power (kW/mol):        -0.3055418 (step)  -26.2338 (real)
------------------------------------------------------------------------

 ANCopt (total)                0 d,  0 h,  0 min,  0.198 sec
 optimizer setup                ...        0 min,  0.000 sec (  0.066%)
 model hessian                  ...        0 min,  0.002 sec (  0.866%)
 ANC generation                 ...        0 min,  0.000 sec (  0.156%)
 coordinate transformation      ...        0 min,  0.000 sec (  0.100%)
 single point calculation       ...        0 min,  0.191 sec ( 96.330%)
 optimization log               ...        0 min,  0.001 sec (  0.575%)
 hessian update                 ...        0 min,  0.000 sec (  0.080%)
 rational function              ...        0 min,  0.003 sec (  1.331%)

================
 final structure:
================
$coord
    2.66296716192992   -0.34623190176799    0.14793973403428      C 
    1.64507243480935    2.06379304085395    0.21579652658760      C 
   -0.93476123669762    2.40106432739377   -0.00379364124466      C 
   -2.55627259258407    0.34193560012162   -0.30562524809106      C 
   -1.50077341601236   -2.07388842056353   -0.36604863289729      C 
    1.07806836371151   -2.41032821766292   -0.14154913078737      C 
   -5.26451580769262    0.80240391140151   -0.52925610731388      C 
   -7.03652333921900   -0.89138128584196   -1.06595627336029      C 
    4.67834923289174   -0.61626315698319    0.32419705294923      H 
    2.86733082936064    3.68348192396556    0.44394751207990      H 
   -1.71591837647286    4.28842407332790    0.05050437297799      H 
   -2.70565442179763   -3.70576224314407   -0.57495699561100      H 
    1.86120527721936   -4.29565929109886   -0.18762815292478      H 
   -5.81981333553738    2.75087230406766   -0.22572253055959      H 
   -6.61928474626115   -2.85146087776901   -1.41789427431173      H 
   -8.99791304740937   -0.36614691374891   -1.19048436136780      H 
$end
           -------------------------------------------------
          |                Final Singlepoint                |
           -------------------------------------------------

          ...................................................
          :                      SETUP                      :
          :.................................................:
          :  # basis functions                  40          :
          :  # atomic orbitals                  40          :
          :  # shells                           24          :
          :  # electrons                        40          :
          :  max. iterations                   250          :
          :  Hamiltonian                  GFN2-xTB          :
          :  restarted?                      false          :
          :  GBSA solvation                  false          :
          :  PC potential                    false          :
          :  electronic temp.          300.0000000     K    :
          :  accuracy                    1.0000000          :
          :  -> integral cutoff          0.2500000E+02      :
          :  -> integral neglect         0.1000000E-07      :
          :  -> SCF convergence          0.1000000E-05 Eh   :
          :  -> wf. convergence          0.1000000E-03 e    :
          :  Broyden damping             0.4000000          :
          ...................................................

 iter      E             dE          RMSdq      gap      omega  full diag
   1    -21.5801985 -0.215802E+02  0.945E-05    3.63       0.0  T
   2    -21.5801985 -0.102993E-10  0.381E-05    3.63     655.4  T
   3    -21.5801985 -0.141505E-10  0.441E-05    3.63     566.8  T

   *** convergence criteria satisfied after 3 iterations ***

         #    Occupation            Energy/Eh            Energy/eV
      -------------------------------------------------------------
         1        2.0000           -0.6431877             -17.5020
       ...           ...                  ...                  ...
        14        2.0000           -0.4665714             -12.6961
        15        2.0000           -0.4408862             -11.9971
        16        2.0000           -0.4337823             -11.8038
        17        2.0000           -0.4212728             -11.4634
        18        2.0000           -0.4170637             -11.3489
        19        2.0000           -0.4028408             -10.9619
        20        2.0000           -0.3832377             -10.4284 (HOMO)
        21                         -0.2499571              -6.8017 (LUMO)
        22                         -0.2203692              -5.9966
        23                         -0.1707524              -4.6464
        24                         -0.0758787              -2.0648
        25                          0.1076669               2.9298
       ...                                ...                  ...
        40                          0.6873415              18.7035
      -------------------------------------------------------------
                  HL-Gap            0.1332806 Eh            3.6267 eV
             Fermi-level           -0.3165974 Eh           -8.6151 eV

 SCC (total)                   0 d,  0 h,  0 min,  0.010 sec
 SCC setup                      ...        0 min,  0.000 sec (  1.137%)
 Dispersion                     ...        0 min,  0.000 sec (  0.841%)
 integral evaluation            ...        0 min,  0.003 sec ( 29.910%)
 zeroth order Hamiltonian       ...        0 min,  0.000 sec (  0.539%)
 iterations                     ...        0 min,  0.002 sec ( 17.010%)
 molecular gradient             ...        0 min,  0.005 sec ( 48.269%)
 printout                       ...        0 min,  0.000 sec (  1.887%)

         :::::::::::::::::::::::::::::::::::::::::::::::::::::
         ::                     SUMMARY                     ::
         :::::::::::::::::::::::::::::::::::::::::::::::::::::
         :: total energy             -21.158602201529 Eh    ::
         :: gradient norm              0.000845942062 Eh/a0 ::
         :: HOMO-LUMO gap              3.626749541880 eV    ::
         ::.................................................::
         :: SCC energy               -21.580198532301 Eh    ::
         :: -> isotropic ES            0.001508737447 Eh    ::
         :: -> anisotropic ES          0.003657857560 Eh    ::
         :: -> anisotropic XC          0.016551365198 Eh    ::
         :: -> dispersion             -0.012260036467 Eh    ::
         :: repulsion energy           0.421585381668 Eh    ::
         :: add. restraining           0.000000000000 Eh    ::
         :::::::::::::::::::::::::::::::::::::::::::::::::::::

           -------------------------------------------------
          |                Property Printout                |
           -------------------------------------------------

    * Orbital Energies and Occupations

         #    Occupation            Energy/Eh            Energy/eV
      -------------------------------------------------------------
         1        2.0000           -0.6431877             -17.5020
       ...           ...                  ...                  ...
         8        2.0000           -0.5258813             -14.3100
         9        2.0000           -0.5063842             -13.7794
        10        2.0000           -0.4922709             -13.3954
        11        2.0000           -0.4858576             -13.2209
        12        2.0000           -0.4801116             -13.0645
        13        2.0000           -0.4752658             -12.9326
        14        2.0000           -0.4665714             -12.6961
        15        2.0000           -0.4408862             -11.9971
        16        2.0000           -0.4337823             -11.8038
        17        2.0000           -0.4212728             -11.4634
        18        2.0000           -0.4170637             -11.3489
        19        2.0000           -0.4028408             -10.9619
        20        2.0000           -0.3832377             -10.4284 (HOMO)
        21                         -0.2499571              -6.8017 (LUMO)
        22                         -0.2203692              -5.9966
        23                         -0.1707524              -4.6464
        24                         -0.0758787              -2.0648
        25                          0.1076669               2.9298
        26                          0.1242782               3.3818
        27                          0.1268267               3.4511
        28                          0.1516607               4.1269
        29                          0.1855121               5.0480
        30                          0.1924008               5.2355
        31                          0.1949428               5.3047
       ...                                ...                  ...
        40                          0.6873415              18.7035
      -------------------------------------------------------------
                  HL-Gap            0.1332806 Eh            3.6267 eV
             Fermi-level           -0.3165974 Eh           -8.6151 eV

     #   Z        covCN         q      C6AA      α(0)
     1   6 C      2.920    -0.030    28.760     8.794
     2   6 C      2.917    -0.030    28.747     8.792
     3   6 C      2.929    -0.034    28.847     8.808
     4   6 C      2.970     0.015    27.681     8.630
     5   6 C      2.924    -0.032    28.810     8.802
     6   6 C      2.918    -0.030    28.748     8.792
     7   6 C      2.896    -0.030    28.753     8.792
     8   6 C      2.837    -0.086    30.142     8.997
     9   1 H      0.926     0.029     2.601     2.522
    10   1 H      0.926     0.029     2.604     2.524
    11   1 H      0.925     0.029     2.595     2.519
    12   1 H      0.926     0.034     2.530     2.487
    13   1 H      0.926     0.029     2.601     2.522
    14   1 H      0.925     0.033     2.543     2.494
    15   1 H      0.926     0.039     2.464     2.455
    16   1 H      0.926     0.036     2.500     2.473

 Mol. C6AA /au·bohr⁶  :       3103.739785
 Mol. C8AA /au·bohr⁸  :      75802.622142
 Mol. α(0) /au        :         90.402828


Wiberg/Mayer (AO) data.
largest (>0.10) Wiberg bond orders for each atom
          total WBO             WBO to atom ...
     1  C   3.993        C    2 1.433    C    6 1.429    H    9 0.972    C    4 0.102
     2  C   3.993        C    3 1.456    C    1 1.433    H   10 0.971    C    5 0.106
     3  C   3.992        C    2 1.456    C    4 1.377    H   11 0.969    C    6 0.105
     4  C   3.990        C    3 1.377    C    5 1.374    C    7 1.090    C    1 0.102
     5  C   3.992        C    6 1.461    C    4 1.374    H   12 0.966    C    2 0.106
     6  C   3.993        C    5 1.461    C    1 1.429    H   13 0.971    C    3 0.105
     7  C   3.991        C    8 1.902    C    4 1.090    H   14 0.964
     8  C   3.992        C    7 1.902    H   16 0.978    H   15 0.973
     9  H   0.999        C    1 0.972
    10  H   0.999        C    2 0.971
    11  H   0.999        C    3 0.969
    12  H   0.999        C    5 0.966
    13  H   0.999        C    6 0.971
    14  H   0.998        C    7 0.964
    15  H   0.998        C    8 0.973
    16  H   0.998        C    8 0.978

molecular dipole:
                 x           y           z       tot (Debye)
 q only:       -0.002      -0.005       0.001
   full:        0.005       0.001       0.001       0.013
molecular quadrupole (traceless):
                xx          xy          yy          xz          yz          zz
 q only:        0.716      -0.014       0.953       0.245       0.268      -1.669
  q+dip:        2.977       0.009       3.912       1.050       1.136      -6.889
   full:        1.391      -0.081       2.061       0.509       0.572      -3.452

           -------------------------------------------------
          |                Geometry Summary                 |
           -------------------------------------------------

      molecular mass/u    :      104.1512000
   center of mass at/Å    :       -0.8108716      -0.0125707      -0.1392380
  moments of inertia/u·Å² :        0.9646423E+02   0.3224739E+03   0.4186073E+03
rotational constants/cm⁻¹ :        0.1747553E+00   0.5227596E-01   0.4027075E-01

 * 15 selected distances

     #   Z        #   Z                                     value/Å
     1   6 C      2   6 C                                 1.3848817
     2   6 C      3   6 C                                 1.3817013
     3   6 C      4   6 C                                 1.3961069 (max)
     4   6 C      5   6 C                                 1.3954571
     1   6 C      6   6 C                                 1.3856162
     5   6 C      6   6 C                                 1.3813469
     7   6 C      8   6 C                                 1.3279045
     1   6 C      9   1 H                                 1.0800595
     2   6 C     10   1 H                                 1.0805277
     3   6 C     11   1 H                                 1.0812947
     5   6 C     12   1 H                                 1.0791056
     6   6 C     13   1 H                                 1.0805976
     7   6 C     14   1 H                                 1.0841055
     8   6 C     15   1 H                                 1.0766983
     8   6 C     16   1 H                                 1.0765120 (min)

 * 2 distinct bonds (by element types)

   Z      Z             #   av. dist./Å        max./Å        min./Å
   1 H    6 C           8     1.0798626     1.0841055     1.0765120
   6 C    6 C           7     1.3790021     1.3961069     1.3279045


optimized geometry written to: xtbopt.xyz


           -------------------------------------------------
          | TOTAL ENERGY              -21.158602201529 Eh   |
          | GRADIENT NORM               0.000845942062 Eh/α |
          | HOMO-LUMO GAP               3.626749541880 eV   |
           -------------------------------------------------

------------------------------------------------------------------------
 * finished run on 2021/05/19 at 10:59:03.457     
------------------------------------------------------------------------
 total:
 * wall-time:     0 d,  0 h,  0 min,  0.237 sec
 *  cpu-time:     0 d,  0 h,  0 min,  0.236 sec
 * ratio c/w:     0.999 speedup
 SCF:
 * wall-time:     0 d,  0 h,  0 min,  0.015 sec
 *  cpu-time:     0 d,  0 h,  0 min,  0.015 sec
 * ratio c/w:     1.000 speedup
 ANC optimizer:
 * wall-time:     0 d,  0 h,  0 min,  0.208 sec
 *  cpu-time:     0 d,  0 h,  0 min,  0.208 sec
 * ratio c/w:     1.000 speedup

