      -----------------------------------------------------------      
     |                   =====================                   |     
     |                           x T B                           |     
     |                   =====================                   |     
     |                         S. Grimme                         |     
     |          Mulliken Center for Theoretical Chemistry        |     
     |                    University of Bonn                     |     
     |                Version 6.2 RC2 (SAW190805)                |     
      -----------------------------------------------------------      

   This program is distributed in the hope that it will be useful,
   but WITHOUT ANY WARRANTY; without even the implied warranty of
   MERCHANTABILITY or FITNESS FOR A PARTICULAR PURPOSE.
   
   FOR NON-COMMERCIAL, ACADEMIA USE ONLY.
   
   Cite this work as:
   * S. Grimme, C. Bannwarth, P. Shushkov, J. Chem. Theory Comput., 2017,
     13, 1989-2009. DOI: 10.1021/acs.jctc.7b00118
   * C. Bannwarth, S. Ehlert and S. Grimme., J. Chem. Theory Comput., 2019,
     15, 1652-1671. DOI: 10.1021/acs.jctc.8b01176
   * P. Pracht, E. Caldeweyher, S. Ehlert, S. Grimme, ChemRxiv, 2019, preprint.
     DOI: 10.26434/chemrxiv.8326202.v1
   
   for DFT-D4:
   * E. Caldeweyher, C. Bannwarth and S. Grimme, J. Chem. Phys., 2017,
     147, 034112. DOI: 10.1063/1.4993215
   * E. Caldeweyher, S. Ehlert, A. Hansen, H. Neugebauer, S. Spicher,
     C. Bannwarth and S. Grimme, J. Chem. Phys., 2019, 150, 154122.
     DOI: 10.1063/1.5090222
   
   for sTDA-xTB:
   * S. Grimme and C. Bannwarth, J. Chem. Phys., 2016, 145, 054103.
     DOI: 10.1063/1.4959605
   
   in the mass-spec context:
   * V. Asgeirsson, C. Bauer and S. Grimme, Chem. Sci., 2017, 8, 4879.
     DOI: 10.1039/c7sc00601b
   
   for metadynamics refer to:
   * S. Grimme, J. Chem. Theory Comput., 2019, 155, 2847-2862
     DOI: 10.1021/acs.jctc.9b00143
   
   with help from (in alphabetical order)
   C. Bannwarth, F. Bohle, G. Brandenburg, E. Caldeweyher, M. Checinski,
   S. Dohm, S. Ehlert, S. Ehrlich, F. März, H. Neugebauer, J. Pisarek,
   P. Pracht, P. Shushkov, and S. Spicher.
   
 * started run on 2021/05/19 at 11:01:01.204     

           -------------------------------------------------
          |                Calculation Setup                |
           -------------------------------------------------

          program call               : /ihome/ghutchison/geoffh/xtb/xtb 967.xyz -opt
          hostname                   : smp-n122
          coordinate file            : 967.xyz
          omp threads                :                     1
          number of atoms            :                    28
          number of electrons        :                    64
          charge                     :                     0
          spin                       :                   0.0
          first test random number   :      0.91406341674523


########################################################################
# WARNING! Please study the warnings concerning your input carefully
#  - the use of '-opt' is discouraged, please use '--opt' next time
########################################################################

           ------------------------------------------------- 
          |                 G F N 2 - x T B                 |
          | Geometry, Frequencies, Noncovalent interactions |
          |            JCTC 2019 parametrisation            |
           ------------------------------------------------- 
             KAB for C  - Si     :                1.0500
             KAB for H  - Pd     :                0.9500
             k(s)              :                1.8500
             k(p)              :                2.2300
             k(d)              :                2.2300
             k(f)              :                2.0000
             kEN (H0ij)        :               -2.0000
             D4 a1             :                0.5200
             D4 a2             :                5.0000
             D4 s6             :                1.0000
             D4 s8             :                2.7000
             D4 s9             :                5.0000
             alphaj            :                2.0000

  Z AO/shell   Hii/eV     exponent
  1     Wed Apr 25 08:07:45 CEST 2018   EN: 2.200 GM2: 0.406  GM3: 0.0800  RAES: 1.40
     1s    -10.707211    1.230000
  6     Wed Apr 25 08:07:45 CEST 2018   EN: 2.550 GM2: 0.538  GM3: 0.1500  RAES: 3.00
     2s    -13.970922    2.096432
     2p    -10.063292    1.800000

           ------------------------------------------------- 
          |        Self-Consistent Charge Iterations        |
           ------------------------------------------------- 

          ...................................................
          :                      SETUP                      :
          :.................................................:
          :  # basis functions                  64          :
          :  # atomic orbitals                  64          :
          :  # shells                           40          :
          :  # electrons                        64          :
          :  max. iterations                   250          :
          :  Hamiltonian                  GFN2-xTB          :
          :  restarted?                      false          :
          :  GBSA solvation                  false          :
          :  PC potential                    false          :
          :  electronic temp.          300.0000000     K    :
          :  accuracy                    1.0000000          :
          :  -> integral cutoff          0.2500000E+02      :
          :  -> integral neglect         0.1000000E-07      :
          :  -> SCF convergence          0.1000000E-05 Eh   :
          :  -> wf. convergence          0.1000000E-03 e    :
          :  Broyden damping             0.4000000          :
          ...................................................

 iter      E             dE          RMSdq      gap      omega  full diag
   1    -34.3592630 -0.343593E+02  0.374E+00    3.69       0.0  T
   2    -34.3955135 -0.362505E-01  0.216E+00    3.68       1.0  T
   3    -34.3939661  0.154741E-02  0.753E-01    3.61       1.0  T
   4    -34.3969903 -0.302418E-02  0.310E-01    3.66       1.0  T
   5    -34.3984647 -0.147436E-02  0.771E-02    3.65       1.0  T
   6    -34.3985211 -0.563880E-04  0.410E-02    3.65       1.0  T
   7    -34.3985351 -0.140698E-04  0.229E-02    3.65       1.0  T
   8    -34.3985389 -0.374717E-05  0.691E-03    3.65       2.7  T
   9    -34.3985400 -0.109465E-05  0.121E-03    3.65      15.6  T
  10    -34.3985400 -0.156882E-07  0.533E-04    3.65      35.5  T
  11    -34.3985400 -0.112159E-09  0.164E-04    3.65     115.1  T

   *** convergence criteria satisfied after 11 iterations ***

         #    Occupation            Energy/Eh            Energy/eV
      -------------------------------------------------------------
         1        2.0000           -0.6334625             -17.2374
       ...           ...                  ...                  ...
        26        2.0000           -0.4379765             -11.9179
        27        2.0000           -0.4284623             -11.6591
        28        2.0000           -0.4148271             -11.2880
        29        2.0000           -0.4068130             -11.0699
        30        2.0000           -0.4036934             -10.9851
        31        2.0000           -0.3766017             -10.2479
        32        2.0000           -0.3701131             -10.0713 (HOMO)
        33                         -0.2359908              -6.4216 (LUMO)
        34                         -0.2105678              -5.7298
        35                         -0.1768871              -4.8133
        36                         -0.0865276              -2.3545
        37                          0.0746139               2.0303
       ...                                ...                  ...
        64                          0.6325725              17.2132
      -------------------------------------------------------------
                  HL-Gap            0.1341224 Eh            3.6497 eV
             Fermi-level           -0.3030520 Eh           -8.2465 eV

 SCC (total)                   0 d,  0 h,  0 min,  0.034 sec
 SCC setup                      ...        0 min,  0.000 sec (  0.862%)
 Dispersion                     ...        0 min,  0.000 sec (  1.201%)
 integral evaluation            ...        0 min,  0.007 sec ( 21.539%)
 zeroth order Hamiltonian       ...        0 min,  0.000 sec (  0.463%)
 iterations                     ...        0 min,  0.012 sec ( 36.588%)
 molecular gradient             ...        0 min,  0.013 sec ( 38.238%)
 printout                       ...        0 min,  0.000 sec (  0.963%)

         :::::::::::::::::::::::::::::::::::::::::::::::::::::
         ::                     SUMMARY                     ::
         :::::::::::::::::::::::::::::::::::::::::::::::::::::
         :: total energy             -33.826446097349 Eh    ::
         :: gradient norm              0.040870988182 Eh/a0 ::
         :: HOMO-LUMO gap              3.649654959432 eV    ::
         ::.................................................::
         :: SCC energy               -34.398539981875 Eh    ::
         :: -> isotropic ES            0.004674692072 Eh    ::
         :: -> anisotropic ES          0.008357143828 Eh    ::
         :: -> anisotropic XC          0.023099548732 Eh    ::
         :: -> dispersion             -0.024100768894 Eh    ::
         :: repulsion energy           0.571929574282 Eh    ::
         :: add. restraining           0.000000000000 Eh    ::
         :::::::::::::::::::::::::::::::::::::::::::::::::::::

      ----------------------------------------------------------- 
     |                   =====================                   |
     |                        A N C O P T                        |
     |                   =====================                   |
     |               Approximate Normal Coordinate               |
     |                Rational Function Optimizer                |
      ----------------------------------------------------------- 

          ...................................................
          :                      SETUP                      :
          :.................................................:
          :   optimization level            normal          :
          :   max. optcycles                   200          :
          :   ANC micro-cycles                  20          :
          :   degrees of freedom                78          :
          :.................................................:
          :   RF solver                   davidson          :
          :   input Hessian                  false          :
          :   write xtbopt.log                true          :
          :   linear?                        false          :
          :   energy convergence         0.5000000E-05 Eh   :
          :   grad. convergence          0.1000000E-02 Eh/α :
          :   maximium RF displ.         2.0000000          :
          :   Hlow (freq-cutoff)         0.5000000E-02      :
          :   Hmax (freq-cutoff)         5.0000000          :
          :   S6 in model hess.         20.0000000          :
          ...................................................

generating ANC from model Hessian ...
Using Lindh-Hessian (1995)
 Shifting diagonal of input Hessian by   4.195881874545376E-003
 Lowest  eigenvalues of input Hessian
   -0.000000   -0.000000   -0.000000   -0.000000    0.000000    0.000000
    0.005000    0.006108    0.006831    0.007308    0.008141    0.009444
    0.010085    0.011746    0.012807    0.014492    0.014957    0.017050
 Highest eigenvalues
    1.520406    1.553590    1.743707    1.838676    1.893113    1.937114
 

........................................................................
.............................. CYCLE    1 ..............................
........................................................................
   1    -34.3985400 -0.343985E+02  0.673E-05    3.65       0.0  T
   2    -34.3985400 -0.146940E-10  0.429E-05    3.65     440.3  T
   3    -34.3985400 -0.611067E-11  0.277E-05    3.65     681.4  T
     SCC iter.                  ...        0 min,  0.004 sec
     gradient                   ...        0 min,  0.013 sec
 * total energy  :   -33.8264461 Eh     change       -0.1418584E-08 Eh
   gradient norm :     0.0408707 Eh/α   predicted     0.0000000E+00 (-100.00%)
   displ. norm   :     0.2534677 α      lambda       -0.5252752E-02
   maximum displ.:     0.1009459 α      in ANC's #15, #18, #28, ...

........................................................................
.............................. CYCLE    2 ..............................
........................................................................
   1    -34.4327675 -0.344328E+02  0.113E-01    3.74       0.0  T
   2    -34.4327765 -0.903389E-05  0.678E-02    3.74       1.0  T
   3    -34.4327667  0.978256E-05  0.233E-02    3.74       1.0  T
   4    -34.4327771 -0.103676E-04  0.682E-03    3.74       2.8  T
   5    -34.4327782 -0.111792E-05  0.141E-03    3.74      13.4  T
   6    -34.4327783 -0.172371E-07  0.800E-04    3.74      23.6  T
     SCC iter.                  ...        0 min,  0.006 sec
     gradient                   ...        0 min,  0.012 sec
 * total energy  :   -33.8296375 Eh     change       -0.3191364E-02 Eh
   gradient norm :     0.0104141 Eh/α   predicted    -0.2795124E-02 ( -12.42%)
   displ. norm   :     0.1353970 α      lambda       -0.4978956E-03
   maximum displ.:     0.0710290 α      in ANC's #3, #11, #15, ...

........................................................................
.............................. CYCLE    3 ..............................
........................................................................
   1    -34.4423682 -0.344424E+02  0.526E-02    3.76       0.0  T
   2    -34.4423695 -0.136549E-05  0.309E-02    3.76       1.0  T
   3    -34.4423688  0.691251E-06  0.696E-03    3.76       2.7  T
   4    -34.4423696 -0.783444E-06  0.206E-03    3.76       9.2  T
   5    -34.4423697 -0.854607E-07  0.656E-04    3.76      28.8  T
     SCC iter.                  ...        0 min,  0.006 sec
     gradient                   ...        0 min,  0.012 sec
 * total energy  :   -33.8299055 Eh     change       -0.2680311E-03 Eh
   gradient norm :     0.0029606 Eh/α   predicted    -0.2535177E-03 (  -5.41%)
   displ. norm   :     0.0846631 α      lambda       -0.9344622E-04
   maximum displ.:     0.0569508 α      in ANC's #3, #9, #5, ...

........................................................................
.............................. CYCLE    4 ..............................
........................................................................
   1    -34.4430625 -0.344431E+02  0.369E-02    3.75       0.0  T
   2    -34.4430628 -0.219645E-06  0.220E-02    3.75       1.0  T
   3    -34.4430622  0.538993E-06  0.429E-03    3.75       4.4  T
   4    -34.4430628 -0.600440E-06  0.984E-04    3.75      19.2  T
   5    -34.4430628 -0.181676E-07  0.430E-04    3.75      43.9  T
     SCC iter.                  ...        0 min,  0.006 sec
     gradient                   ...        0 min,  0.013 sec
 * total energy  :   -33.8299550 Eh     change       -0.4954966E-04 Eh
   gradient norm :     0.0020977 Eh/α   predicted    -0.4706422E-04 (  -5.02%)
   displ. norm   :     0.0754332 α      lambda       -0.5493093E-04
   maximum displ.:     0.0545993 α      in ANC's #3, #9, #8, ...

........................................................................
.............................. CYCLE    5 ..............................
........................................................................
   1    -34.4420678 -0.344421E+02  0.301E-02    3.75       0.0  T
   2    -34.4420680 -0.112076E-06  0.179E-02    3.75       1.1  T
   3    -34.4420671  0.870765E-06  0.565E-03    3.75       3.3  T
   4    -34.4420680 -0.963755E-06  0.582E-04    3.75      32.5  T
   5    -34.4420680 -0.413688E-08  0.292E-04    3.75      64.7  T
     SCC iter.                  ...        0 min,  0.006 sec
     gradient                   ...        0 min,  0.013 sec
 * total energy  :   -33.8299935 Eh     change       -0.3844284E-04 Eh
   gradient norm :     0.0014106 Eh/α   predicted    -0.2762205E-04 ( -28.15%)
   displ. norm   :     0.1230389 α      lambda       -0.3354433E-04
   maximum displ.:     0.0776510 α      in ANC's #3, #9, #8, ...

........................................................................
.............................. CYCLE    6 ..............................
........................................................................
   1    -34.4408092 -0.344408E+02  0.493E-02    3.74       0.0  T
   2    -34.4408093 -0.102372E-06  0.292E-02    3.74       1.0  T
   3    -34.4408087  0.675422E-06  0.508E-03    3.74       3.7  T
   4    -34.4408094 -0.767473E-06  0.562E-04    3.74      33.7  T
   5    -34.4408094 -0.176259E-08  0.321E-04    3.74      58.8  T
     SCC iter.                  ...        0 min,  0.006 sec
     gradient                   ...        0 min,  0.013 sec
 * total energy  :   -33.8300199 Eh     change       -0.2637882E-04 Eh
   gradient norm :     0.0016804 Eh/α   predicted    -0.1688722E-04 ( -35.98%)
   displ. norm   :     0.1230493 α      lambda        0.2993826E-04
   maximum displ.:     0.0776520 α      in ANC's #3, #9, #8, ...

........................................................................
.............................. CYCLE    7 ..............................
........................................................................
   1    -34.4392143 -0.344392E+02  0.492E-02    3.74       0.0  T
   2    -34.4392144 -0.102887E-06  0.291E-02    3.74       1.0  T
   3    -34.4392138  0.637892E-06  0.498E-03    3.74       3.8  T
   4    -34.4392145 -0.726442E-06  0.561E-04    3.74      33.7  T
   5    -34.4392145 -0.189549E-08  0.314E-04    3.74      60.1  T
     SCC iter.                  ...        0 min,  0.006 sec
     gradient                   ...        0 min,  0.013 sec
 * total energy  :   -33.8299959 Eh     change        0.2396040E-04 Eh
   gradient norm :     0.0033409 Eh/α   predicted     0.1506984E-04 ( -37.11%)
   displ. norm   :     0.0520334 α      lambda       -0.4428151E-04
   maximum displ.:     0.0327422 α      in ANC's #3, #9, #5, ...

........................................................................
.............................. CYCLE    8 ..............................
........................................................................
   1    -34.4407801 -0.344408E+02  0.226E-02    3.74       0.0  T
   2    -34.4407801 -0.540123E-07  0.134E-02    3.74       1.4  T
   3    -34.4407796  0.483139E-06  0.422E-03    3.74       4.5  T
   4    -34.4407802 -0.534436E-06  0.413E-04    3.74      45.7  T
   5    -34.4407802 -0.240255E-08  0.196E-04    3.74      96.2  T
     SCC iter.                  ...        0 min,  0.006 sec
     gradient                   ...        0 min,  0.013 sec
 * total energy  :   -33.8300258 Eh     change       -0.2986473E-04 Eh
   gradient norm :     0.0015144 Eh/α   predicted    -0.2220187E-04 ( -25.66%)
   displ. norm   :     0.0489414 α      lambda       -0.1285832E-04
   maximum displ.:     0.0319067 α      in ANC's #3, #5, #4, ...

........................................................................
.............................. CYCLE    9 ..............................
........................................................................
   1    -34.4424009 -0.344424E+02  0.216E-02    3.75       0.0  T
   2    -34.4424010 -0.803031E-07  0.129E-02    3.75       1.5  T
   3    -34.4424002  0.811319E-06  0.538E-03    3.75       3.5  T
   4    -34.4424011 -0.907627E-06  0.555E-04    3.75      34.1  T
   5    -34.4424011 -0.502351E-08  0.232E-04    3.75      81.6  T
     SCC iter.                  ...        0 min,  0.005 sec
     gradient                   ...        0 min,  0.013 sec
 * total energy  :   -33.8300328 Eh     change       -0.7053968E-05 Eh
   gradient norm :     0.0006435 Eh/α   predicted    -0.6438289E-05 (  -8.73%)
   displ. norm   :     0.0259606 α      lambda       -0.2740006E-05
   maximum displ.:     0.0129374 α      in ANC's #9, #8, #2, ...

........................................................................
.............................. CYCLE   10 ..............................
........................................................................
   1    -34.4419804 -0.344420E+02  0.106E-02    3.75       0.0  T
   2    -34.4419804 -0.572875E-08  0.630E-03    3.75       3.0  T
   3    -34.4419804  0.278553E-07  0.103E-03    3.75      18.3  T
   4    -34.4419804 -0.316862E-07  0.124E-04    3.75     152.7  T
   5    -34.4419804 -0.210811E-09  0.607E-05    3.75     311.1  T
     SCC iter.                  ...        0 min,  0.005 sec
     gradient                   ...        0 min,  0.013 sec
 * total energy  :   -33.8300359 Eh     change       -0.3080066E-05 Eh
   gradient norm :     0.0003104 Eh/α   predicted    -0.1372185E-05 ( -55.45%)
   displ. norm   :     0.0466568 α      lambda       -0.3368161E-05
   maximum displ.:     0.0240971 α      in ANC's #2, #9, #8, ...

   *** GEOMETRY OPTIMIZATION CONVERGED AFTER 10 ITERATIONS ***

------------------------------------------------------------------------
 total energy gain   :        -0.0035898 Eh       -2.2526 kcal/mol
 total RMSD          :         0.1108463 a0        0.0587 Å
 total power (kW/mol):        -0.9425035 (step)  -34.8284 (real)
------------------------------------------------------------------------

 ANCopt (total)                0 d,  0 h,  0 min,  0.271 sec
 optimizer setup                ...        0 min,  0.000 sec (  0.043%)
 model hessian                  ...        0 min,  0.008 sec (  2.815%)
 ANC generation                 ...        0 min,  0.001 sec (  0.307%)
 coordinate transformation      ...        0 min,  0.000 sec (  0.067%)
 single point calculation       ...        0 min,  0.259 sec ( 95.571%)
 optimization log               ...        0 min,  0.001 sec (  0.404%)
 hessian update                 ...        0 min,  0.000 sec (  0.048%)
 rational function              ...        0 min,  0.001 sec (  0.472%)

================
 final structure:
================
$coord
    1.26371118287248    2.34841732226741   -0.06101846120761      C 
    2.38495241114561   -0.01281460135729   -0.09576547371313      C 
    5.20201541253245   -0.31313639868361   -0.14222272421424      C 
    0.82656159470382   -2.11974596343549   -0.11442246653785      C 
   -1.78936877796191   -1.91624718913195   -0.06994344424008      C 
   -3.30245299265821   -4.32842450599786   -0.04680570319447      C 
   -3.82636970181613   -5.19101444476010    2.66255610083865      C 
   -2.90562399625460    0.47089136601370    0.01378557880687      C 
   -5.72137445540131    0.82228293278928    0.16341337597651      C 
   -1.35189596861429    2.61698164704303   -0.01497073356175      C 
   -2.45210290623242    5.15785929732817   -0.03706643943165      C 
   -1.48760948359986    7.13619863703119    1.15810382764113      C 
    2.43009428789322    4.02324421636761   -0.10933933257085      H 
    6.13759386662074    1.51226860721290   -0.02982440661013      H 
    5.79537412175186   -1.24750091322711   -1.87852893295182      H 
    5.82666013020733   -1.47258542224143    1.43991806815358      H 
    1.67360237946159   -3.97899561504920   -0.17170232125442      H 
   -2.22523033851880   -5.79956486215146   -1.01437835825867      H 
   -5.07843194928048   -4.09566966938987   -1.06639062245013      H 
   -2.05560123849725   -5.50709491028850    3.65731804310096      H 
   -4.90301038803104   -6.94264388692925    2.66726257225296      H 
   -4.88856612437390   -3.76452213835731    3.69258468773399      H 
   -6.68544739791328   -0.90648179188580    0.69322346642835      H 
   -6.46404606740916    1.43869939080826   -1.65920209421480      H 
   -6.18199604833214    2.26311878585762    1.55806177676096      H 
   -4.16760176078412    5.38387104095032   -1.12812757058435      H 
    0.18237997276560    6.98976893528952    2.31337365480197      H 
   -2.35025815528856    8.97665174820559    1.05460434302224      H 
$end
           -------------------------------------------------
          |                Final Singlepoint                |
           -------------------------------------------------

          ...................................................
          :                      SETUP                      :
          :.................................................:
          :  # basis functions                  64          :
          :  # atomic orbitals                  64          :
          :  # shells                           40          :
          :  # electrons                        64          :
          :  max. iterations                   250          :
          :  Hamiltonian                  GFN2-xTB          :
          :  restarted?                      false          :
          :  GBSA solvation                  false          :
          :  PC potential                    false          :
          :  electronic temp.          300.0000000     K    :
          :  accuracy                    1.0000000          :
          :  -> integral cutoff          0.2500000E+02      :
          :  -> integral neglect         0.1000000E-07      :
          :  -> SCF convergence          0.1000000E-05 Eh   :
          :  -> wf. convergence          0.1000000E-03 e    :
          :  Broyden damping             0.4000000          :
          ...................................................

 iter      E             dE          RMSdq      gap      omega  full diag
   1    -34.4419804 -0.344420E+02  0.271E-05    3.75       0.0  T
   2    -34.4419804 -0.342482E-11  0.135E-05    3.75    1401.1  T
   3    -34.4419804 -0.456879E-11  0.975E-06    3.75    1938.7  T

   *** convergence criteria satisfied after 3 iterations ***

         #    Occupation            Energy/Eh            Energy/eV
      -------------------------------------------------------------
         1        2.0000           -0.6378826             -17.3577
       ...           ...                  ...                  ...
        26        2.0000           -0.4375231             -11.9056
        27        2.0000           -0.4295501             -11.6887
        28        2.0000           -0.4161226             -11.3233
        29        2.0000           -0.4059382             -11.0461
        30        2.0000           -0.4049198             -11.0184
        31        2.0000           -0.3786015             -10.3023
        32        2.0000           -0.3713850             -10.1059 (HOMO)
        33                         -0.2336731              -6.3586 (LUMO)
        34                         -0.2066299              -5.6227
        35                         -0.1708814              -4.6499
        36                         -0.0769450              -2.0938
        37                          0.0891092               2.4248
       ...                                ...                  ...
        64                          0.6793442              18.4859
      -------------------------------------------------------------
                  HL-Gap            0.1377119 Eh            3.7473 eV
             Fermi-level           -0.3025290 Eh           -8.2322 eV

 SCC (total)                   0 d,  0 h,  0 min,  0.025 sec
 SCC setup                      ...        0 min,  0.000 sec (  0.793%)
 Dispersion                     ...        0 min,  0.000 sec (  0.922%)
 integral evaluation            ...        0 min,  0.007 sec ( 29.231%)
 zeroth order Hamiltonian       ...        0 min,  0.000 sec (  0.562%)
 iterations                     ...        0 min,  0.004 sec ( 15.095%)
 molecular gradient             ...        0 min,  0.013 sec ( 51.879%)
 printout                       ...        0 min,  0.000 sec (  1.298%)

         :::::::::::::::::::::::::::::::::::::::::::::::::::::
         ::                     SUMMARY                     ::
         :::::::::::::::::::::::::::::::::::::::::::::::::::::
         :: total energy             -33.830035900980 Eh    ::
         :: gradient norm              0.000310378790 Eh/a0 ::
         :: HOMO-LUMO gap              3.747332654675 eV    ::
         ::.................................................::
         :: SCC energy               -34.441980409800 Eh    ::
         :: -> isotropic ES            0.004963032065 Eh    ::
         :: -> anisotropic ES          0.007720326059 Eh    ::
         :: -> anisotropic XC          0.022024640345 Eh    ::
         :: -> dispersion             -0.024408153266 Eh    ::
         :: repulsion energy           0.611774817054 Eh    ::
         :: add. restraining           0.000000000000 Eh    ::
         :::::::::::::::::::::::::::::::::::::::::::::::::::::

           -------------------------------------------------
          |                Property Printout                |
           -------------------------------------------------

    * Orbital Energies and Occupations

         #    Occupation            Energy/Eh            Energy/eV
      -------------------------------------------------------------
         1        2.0000           -0.6378826             -17.3577
       ...           ...                  ...                  ...
        20        2.0000           -0.4673199             -12.7164
        21        2.0000           -0.4639444             -12.6246
        22        2.0000           -0.4606441             -12.5348
        23        2.0000           -0.4484189             -12.2021
        24        2.0000           -0.4469161             -12.1612
        25        2.0000           -0.4420358             -12.0284
        26        2.0000           -0.4375231             -11.9056
        27        2.0000           -0.4295501             -11.6887
        28        2.0000           -0.4161226             -11.3233
        29        2.0000           -0.4059382             -11.0461
        30        2.0000           -0.4049198             -11.0184
        31        2.0000           -0.3786015             -10.3023
        32        2.0000           -0.3713850             -10.1059 (HOMO)
        33                         -0.2336731              -6.3586 (LUMO)
        34                         -0.2066299              -5.6227
        35                         -0.1708814              -4.6499
        36                         -0.0769450              -2.0938
        37                          0.0891092               2.4248
        38                          0.1053821               2.8676
        39                          0.1271438               3.4598
        40                          0.1292301               3.5165
        41                          0.1340592               3.6479
        42                          0.1442680               3.9257
        43                          0.1605525               4.3689
       ...                                ...                  ...
        64                          0.6793442              18.4859
      -------------------------------------------------------------
                  HL-Gap            0.1377119 Eh            3.7473 eV
             Fermi-level           -0.3025290 Eh           -8.2322 eV

     #   Z        covCN         q      C6AA      α(0)
     1   6 C      2.931    -0.050    29.237     8.868
     2   6 C      2.962     0.009    27.804     8.649
     3   6 C      3.758    -0.107    22.594     6.777
     4   6 C      2.933    -0.053    29.309     8.879
     5   6 C      2.969     0.001    28.010     8.681
     6   6 C      3.807    -0.057    21.587     6.614
     7   6 C      3.753    -0.096    22.400     6.749
     8   6 C      2.971    -0.001    28.039     8.686
     9   6 C      3.757    -0.106    22.573     6.774
    10   6 C      2.976     0.001    28.006     8.681
    11   6 C      2.896    -0.029    28.712     8.786
    12   6 C      2.839    -0.089    30.231     9.011
    13   1 H      0.926     0.030     2.589     2.516
    14   1 H      0.925     0.038     2.473     2.459
    15   1 H      0.925     0.043     2.416     2.430
    16   1 H      0.925     0.042     2.418     2.432
    17   1 H      0.925     0.027     2.632     2.537
    18   1 H      0.924     0.033     2.539     2.492
    19   1 H      0.924     0.035     2.521     2.483
    20   1 H      0.925     0.035     2.522     2.483
    21   1 H      0.925     0.032     2.562     2.503
    22   1 H      0.925     0.035     2.523     2.484
    23   1 H      0.925     0.044     2.398     2.421
    24   1 H      0.924     0.040     2.455     2.451
    25   1 H      0.925     0.041     2.440     2.443
    26   1 H      0.925     0.036     2.508     2.477
    27   1 H      0.926     0.036     2.497     2.471
    28   1 H      0.926     0.031     2.571     2.508

 Mol. C6AA /au·bohr⁶  :       7556.737098
 Mol. C8AA /au·bohr⁸  :     175909.862481
 Mol. α(0) /au        :        136.742445


Wiberg/Mayer (AO) data.
largest (>0.10) Wiberg bond orders for each atom
          total WBO             WBO to atom ...
     1  C   3.990        C    2 1.422    C   10 1.389    H   13 0.966
     2  C   3.989        C    1 1.422    C    4 1.406    C    3 1.022
     3  C   3.996        C    2 1.022    H   14 0.986    H   16 0.975    H   15 0.973
     4  C   3.991        C    5 1.416    C    2 1.406    H   17 0.968
     5  C   3.988        C    4 1.416    C    8 1.396    C    6 1.009
     6  C   3.996        C    5 1.009    C    7 1.003    H   18 0.974    H   19 0.971
     7  C   3.997        C    6 1.003    H   20 0.988    H   22 0.987    H   21 0.987
     8  C   3.988        C    5 1.396    C   10 1.359    C    9 1.023
     9  C   3.996        C    8 1.023    H   23 0.979    H   25 0.977    H   24 0.968
    10  C   3.989        C    1 1.389    C    8 1.359    C   11 1.068
    11  C   3.991        C   12 1.926    C   10 1.068    H   26 0.959
    12  C   3.991        C   11 1.926    H   28 0.978    H   27 0.975
    13  H   0.998        C    1 0.966
    14  H   0.998        C    3 0.986
    15  H   0.998        C    3 0.973
    16  H   0.998        C    3 0.975
    17  H   0.999        C    4 0.968
    18  H   0.999        C    6 0.974
    19  H   0.999        C    6 0.971
    20  H   0.999        C    7 0.988
    21  H   0.998        C    7 0.987
    22  H   0.999        C    7 0.987
    23  H   0.998        C    9 0.979
    24  H   0.998        C    9 0.968
    25  H   0.998        C    9 0.977
    26  H   0.998        C   11 0.959
    27  H   0.999        C   12 0.975
    28  H   0.998        C   12 0.978

molecular dipole:
                 x           y           z       tot (Debye)
 q only:       -0.093      -0.185      -0.006
   full:       -0.097      -0.181      -0.002       0.522
molecular quadrupole (traceless):
                xx          xy          yy          xz          yz          zz
 q only:        2.904       0.269      -0.819       0.118      -0.227      -2.084
  q+dip:        4.240      -0.298       1.986       1.352       0.542      -6.225
   full:        3.322      -0.132       0.180       0.645       0.015      -3.502

           -------------------------------------------------
          |                Geometry Summary                 |
           -------------------------------------------------

      molecular mass/u    :      160.2584000
   center of mass at/Å    :       -0.5983113       0.1748562       0.1688104
  moments of inertia/u·Å² :        0.4536302E+03   0.6273358E+03   0.1011749E+04
rotational constants/cm⁻¹ :        0.3716162E-01   0.2687178E-01   0.1666188E-01

 * 24 selected distances

     #   Z        #   Z                                     value/Å
     1   6 C      2   6 C                                 1.3833513
     2   6 C      4   6 C                                 1.3868170
     4   6 C      5   6 C                                 1.3886726
     6   6 C      7   6 C                                 1.5299714 (max)
     5   6 C      8   6 C                                 1.3952094
     1   6 C     10   6 C                                 1.3916102
     8   6 C     10   6 C                                 1.4021301
    11   6 C     12   6 C                                 1.3253229
     1   6 C     13   1 H                                 1.0803293
     3   6 C     14   1 H                                 1.0870754
     3   6 C     15   1 H                                 1.0896261
     3   6 C     16   1 H                                 1.0893436
     4   6 C     17   1 H                                 1.0815907
     6   6 C     18   1 H                                 1.0923197
     6   6 C     19   1 H                                 1.0906483
     7   6 C     20   1 H                                 1.0877237
     7   6 C     21   1 H                                 1.0880202
     7   6 C     22   1 H                                 1.0875977
     9   6 C     23   1 H                                 1.0843309
     9   6 C     24   1 H                                 1.0913705
     9   6 C     25   1 H                                 1.0887717
    11   6 C     26   1 H                                 1.0824789
    12   6 C     27   1 H                                 1.0773606
    12   6 C     28   1 H                                 1.0769950 (min)

 * 2 distinct bonds (by element types)

   Z      Z             #   av. dist./Å        max./Å        min./Å
   1 H    6 C          16     1.0859739     1.0923197     1.0769950
   6 C    6 C           8     1.4003856     1.5299714     1.3253229


optimized geometry written to: xtbopt.xyz


           -------------------------------------------------
          | TOTAL ENERGY              -33.830035900980 Eh   |
          | GRADIENT NORM               0.000310378790 Eh/α |
          | HOMO-LUMO GAP               3.747332654675 eV   |
           -------------------------------------------------

------------------------------------------------------------------------
 * finished run on 2021/05/19 at 11:01:01.553     
------------------------------------------------------------------------
 total:
 * wall-time:     0 d,  0 h,  0 min,  0.349 sec
 *  cpu-time:     0 d,  0 h,  0 min,  0.348 sec
 * ratio c/w:     0.998 speedup
 SCF:
 * wall-time:     0 d,  0 h,  0 min,  0.034 sec
 *  cpu-time:     0 d,  0 h,  0 min,  0.034 sec
 * ratio c/w:     0.999 speedup
 ANC optimizer:
 * wall-time:     0 d,  0 h,  0 min,  0.296 sec
 *  cpu-time:     0 d,  0 h,  0 min,  0.296 sec
 * ratio c/w:     1.000 speedup

