      -----------------------------------------------------------      
     |                   =====================                   |     
     |                           x T B                           |     
     |                   =====================                   |     
     |                         S. Grimme                         |     
     |          Mulliken Center for Theoretical Chemistry        |     
     |                    University of Bonn                     |     
     |                Version 6.2 RC2 (SAW190805)                |     
      -----------------------------------------------------------      

   This program is distributed in the hope that it will be useful,
   but WITHOUT ANY WARRANTY; without even the implied warranty of
   MERCHANTABILITY or FITNESS FOR A PARTICULAR PURPOSE.
   
   FOR NON-COMMERCIAL, ACADEMIA USE ONLY.
   
   Cite this work as:
   * S. Grimme, C. Bannwarth, P. Shushkov, J. Chem. Theory Comput., 2017,
     13, 1989-2009. DOI: 10.1021/acs.jctc.7b00118
   * C. Bannwarth, S. Ehlert and S. Grimme., J. Chem. Theory Comput., 2019,
     15, 1652-1671. DOI: 10.1021/acs.jctc.8b01176
   * P. Pracht, E. Caldeweyher, S. Ehlert, S. Grimme, ChemRxiv, 2019, preprint.
     DOI: 10.26434/chemrxiv.8326202.v1
   
   for DFT-D4:
   * E. Caldeweyher, C. Bannwarth and S. Grimme, J. Chem. Phys., 2017,
     147, 034112. DOI: 10.1063/1.4993215
   * E. Caldeweyher, S. Ehlert, A. Hansen, H. Neugebauer, S. Spicher,
     C. Bannwarth and S. Grimme, J. Chem. Phys., 2019, 150, 154122.
     DOI: 10.1063/1.5090222
   
   for sTDA-xTB:
   * S. Grimme and C. Bannwarth, J. Chem. Phys., 2016, 145, 054103.
     DOI: 10.1063/1.4959605
   
   in the mass-spec context:
   * V. Asgeirsson, C. Bauer and S. Grimme, Chem. Sci., 2017, 8, 4879.
     DOI: 10.1039/c7sc00601b
   
   for metadynamics refer to:
   * S. Grimme, J. Chem. Theory Comput., 2019, 155, 2847-2862
     DOI: 10.1021/acs.jctc.9b00143
   
   with help from (in alphabetical order)
   C. Bannwarth, F. Bohle, G. Brandenburg, E. Caldeweyher, M. Checinski,
   S. Dohm, S. Ehlert, S. Ehrlich, F. März, H. Neugebauer, J. Pisarek,
   P. Pracht, P. Shushkov, and S. Spicher.
   
 * started run on 2021/05/19 at 11:01:02.383     

           -------------------------------------------------
          |                Calculation Setup                |
           -------------------------------------------------

          program call               : /ihome/ghutchison/geoffh/xtb/xtb 969.xyz -opt
          hostname                   : smp-n122
          coordinate file            : 969.xyz
          omp threads                :                     1
          number of atoms            :                    26
          number of electrons        :                    76
          charge                     :                     0
          spin                       :                   0.0
          first test random number   :      0.71375066166222


########################################################################
# WARNING! Please study the warnings concerning your input carefully
#  - the use of '-opt' is discouraged, please use '--opt' next time
########################################################################

           ------------------------------------------------- 
          |                 G F N 2 - x T B                 |
          | Geometry, Frequencies, Noncovalent interactions |
          |            JCTC 2019 parametrisation            |
           ------------------------------------------------- 
             KAB for C  - Si     :                1.0500
             KAB for H  - Pd     :                0.9500
             k(s)              :                1.8500
             k(p)              :                2.2300
             k(d)              :                2.2300
             k(f)              :                2.0000
             kEN (H0ij)        :               -2.0000
             D4 a1             :                0.5200
             D4 a2             :                5.0000
             D4 s6             :                1.0000
             D4 s8             :                2.7000
             D4 s9             :                5.0000
             alphaj            :                2.0000

  Z AO/shell   Hii/eV     exponent
  1     Wed Apr 25 08:07:45 CEST 2018   EN: 2.200 GM2: 0.406  GM3: 0.0800  RAES: 1.40
     1s    -10.707211    1.230000
  6     Wed Apr 25 08:07:45 CEST 2018   EN: 2.550 GM2: 0.538  GM3: 0.1500  RAES: 3.00
     2s    -13.970922    2.096432
     2p    -10.063292    1.800000
  8     Wed Apr 25 08:07:45 CEST 2018   EN: 3.440 GM2: 0.452  GM3:-0.0517  RAES: 1.80
     2s    -20.229985    2.439742
     2p    -15.503117    2.137023

           ------------------------------------------------- 
          |        Self-Consistent Charge Iterations        |
           ------------------------------------------------- 

          ...................................................
          :                      SETUP                      :
          :.................................................:
          :  # basis functions                  68          :
          :  # atomic orbitals                  68          :
          :  # shells                           40          :
          :  # electrons                        76          :
          :  max. iterations                   250          :
          :  Hamiltonian                  GFN2-xTB          :
          :  restarted?                      false          :
          :  GBSA solvation                  false          :
          :  PC potential                    false          :
          :  electronic temp.          300.0000000     K    :
          :  accuracy                    1.0000000          :
          :  -> integral cutoff          0.2500000E+02      :
          :  -> integral neglect         0.1000000E-07      :
          :  -> SCF convergence          0.1000000E-05 Eh   :
          :  -> wf. convergence          0.1000000E-03 e    :
          :  Broyden damping             0.4000000          :
          ...................................................

 iter      E             dE          RMSdq      gap      omega  full diag
   1    -44.1842542 -0.441843E+02  0.432E+00    5.52       0.0  T
   2    -44.2803168 -0.960626E-01  0.221E+00    4.43       1.0  T
   3    -44.2871438 -0.682701E-02  0.131E+00    4.94       1.0  T
   4    -44.2932357 -0.609187E-02  0.152E-01    4.66       1.0  T
   5    -44.2935220 -0.286309E-03  0.720E-02    4.71       1.0  T
   6    -44.2935264 -0.440777E-05  0.209E-02    4.71       1.0  T
   7    -44.2935286 -0.220784E-05  0.751E-03    4.71       2.6  T
   8    -44.2935288 -0.229507E-06  0.235E-03    4.71       8.3  T
   9    -44.2935288 -0.146483E-07  0.103E-03    4.71      19.1  T
  10    -44.2935288 -0.712357E-08  0.274E-04    4.71      71.5  T
  11    -44.2935288 -0.682903E-09  0.116E-04    4.71     168.9  T

   *** convergence criteria satisfied after 11 iterations ***

         #    Occupation            Energy/Eh            Energy/eV
      -------------------------------------------------------------
         1        2.0000           -0.7586285             -20.6433
       ...           ...                  ...                  ...
        32        2.0000           -0.4813832             -13.0991
        33        2.0000           -0.4763742             -12.9628
        34        2.0000           -0.4724425             -12.8558
        35        2.0000           -0.4670930             -12.7102
        36        2.0000           -0.4468326             -12.1589
        37        2.0000           -0.4288189             -11.6688
        38        2.0000           -0.4287535             -11.6670 (HOMO)
        39                         -0.2556061              -6.9554 (LUMO)
        40                         -0.2528756              -6.8811
        41                         -0.0531036              -1.4450
        42                         -0.0371823              -1.0118
        43                          0.0158730               0.4319
       ...                                ...                  ...
        68                          0.5782253              15.7343
      -------------------------------------------------------------
                  HL-Gap            0.1731474 Eh            4.7116 eV
             Fermi-level           -0.3421798 Eh           -9.3112 eV

 SCC (total)                   0 d,  0 h,  0 min,  0.037 sec
 SCC setup                      ...        0 min,  0.000 sec (  0.828%)
 Dispersion                     ...        0 min,  0.000 sec (  0.992%)
 integral evaluation            ...        0 min,  0.009 sec ( 23.307%)
 zeroth order Hamiltonian       ...        0 min,  0.000 sec (  0.468%)
 iterations                     ...        0 min,  0.013 sec ( 35.285%)
 molecular gradient             ...        0 min,  0.014 sec ( 37.995%)
 printout                       ...        0 min,  0.000 sec (  0.978%)

         :::::::::::::::::::::::::::::::::::::::::::::::::::::
         ::                     SUMMARY                     ::
         :::::::::::::::::::::::::::::::::::::::::::::::::::::
         :: total energy             -43.854443695539 Eh    ::
         :: gradient norm              0.090073386735 Eh/a0 ::
         :: HOMO-LUMO gap              4.711579670071 eV    ::
         ::.................................................::
         :: SCC energy               -44.293528838567 Eh    ::
         :: -> isotropic ES            0.089152162430 Eh    ::
         :: -> anisotropic ES          0.003569542355 Eh    ::
         :: -> anisotropic XC          0.005796682007 Eh    ::
         :: -> dispersion             -0.024535973991 Eh    ::
         :: repulsion energy           0.438872059980 Eh    ::
         :: add. restraining           0.000000000000 Eh    ::
         :::::::::::::::::::::::::::::::::::::::::::::::::::::

      ----------------------------------------------------------- 
     |                   =====================                   |
     |                        A N C O P T                        |
     |                   =====================                   |
     |               Approximate Normal Coordinate               |
     |                Rational Function Optimizer                |
      ----------------------------------------------------------- 

          ...................................................
          :                      SETUP                      :
          :.................................................:
          :   optimization level            normal          :
          :   max. optcycles                   200          :
          :   ANC micro-cycles                  20          :
          :   degrees of freedom                72          :
          :.................................................:
          :   RF solver                   davidson          :
          :   input Hessian                  false          :
          :   write xtbopt.log                true          :
          :   linear?                        false          :
          :   energy convergence         0.5000000E-05 Eh   :
          :   grad. convergence          0.1000000E-02 Eh/α :
          :   maximium RF displ.         2.0000000          :
          :   Hlow (freq-cutoff)         0.5000000E-02      :
          :   Hmax (freq-cutoff)         5.0000000          :
          :   S6 in model hess.         20.0000000          :
          ...................................................

generating ANC from model Hessian ...
Using Lindh-Hessian (1995)
 Shifting diagonal of input Hessian by   1.085393110282044E-003
 Lowest  eigenvalues of input Hessian
   -0.000000   -0.000000    0.000000    0.000000    0.000000    0.000000
    0.005000    0.005605    0.009565    0.010300    0.011662    0.015635
    0.018160    0.027492    0.039124    0.041847    0.046551    0.048757
 Highest eigenvalues
    1.381421    1.387035    1.618862    1.622426    2.264660    2.266503
 

........................................................................
.............................. CYCLE    1 ..............................
........................................................................
   1    -44.2935288 -0.442935E+02  0.383E-05    4.71       0.0  T
   2    -44.2935288 -0.139053E-10  0.225E-05    4.71     870.3  T
   3    -44.2935288 -0.299849E-11  0.138E-05    4.71    1424.6  T
     SCC iter.                  ...        0 min,  0.004 sec
     gradient                   ...        0 min,  0.014 sec
 * total energy  :   -43.8544437 Eh     change       -0.2416719E-07 Eh
   gradient norm :     0.0900711 Eh/α   predicted     0.0000000E+00 (-100.00%)
   displ. norm   :     0.2583371 α      lambda       -0.9875624E-02
   maximum displ.:     0.1148032 α      in ANC's #18, #26, #5, ...

........................................................................
.............................. CYCLE    2 ..............................
........................................................................
   1    -44.3119864 -0.443120E+02  0.214E-01    4.95       0.0  T
   2    -44.3121408 -0.154395E-03  0.133E-01    4.93       1.0  T
   3    -44.3121427 -0.190673E-05  0.510E-02    4.95       1.0  T
   4    -44.3121518 -0.912138E-05  0.711E-03    4.94       2.8  T
   5    -44.3121523 -0.520915E-06  0.404E-03    4.94       4.8  T
   6    -44.3121524 -0.792816E-07  0.140E-03    4.94      14.0  T
     SCC iter.                  ...        0 min,  0.007 sec
     gradient                   ...        0 min,  0.013 sec
 * total energy  :   -43.8604275 Eh     change       -0.5983816E-02 Eh
   gradient norm :     0.0252183 Eh/α   predicted    -0.5267355E-02 ( -11.97%)
   displ. norm   :     0.1465413 α      lambda       -0.1578974E-02
   maximum displ.:     0.0718056 α      in ANC's #5, #26, #18, ...

........................................................................
.............................. CYCLE    3 ..............................
........................................................................
   1    -44.3171295 -0.443171E+02  0.147E-01    5.03       0.0  T
   2    -44.3171514 -0.218990E-04  0.900E-02    5.02       1.0  T
   3    -44.3171503  0.110463E-05  0.222E-02    5.03       1.0  T
   4    -44.3171550 -0.471304E-05  0.423E-03    5.02       4.6  T
   5    -44.3171551 -0.853340E-07  0.244E-03    5.02       8.0  T
     SCC iter.                  ...        0 min,  0.006 sec
     gradient                   ...        0 min,  0.013 sec
 * total energy  :   -43.8611639 Eh     change       -0.7363185E-03 Eh
   gradient norm :     0.0104792 Eh/α   predicted    -0.8064412E-03 (   9.52%)
   displ. norm   :     0.0781631 α      lambda       -0.2290286E-03
   maximum displ.:     0.0469399 α      in ANC's #2, #3, #5, ...

........................................................................
.............................. CYCLE    4 ..............................
........................................................................
   1    -44.3161020 -0.443161E+02  0.478E-02    5.01       0.0  T
   2    -44.3161043 -0.230605E-05  0.286E-02    5.01       1.0  T
   3    -44.3161044 -0.898562E-07  0.495E-03    5.01       4.0  T
   4    -44.3161045 -0.694232E-07  0.121E-03    5.01      16.3  T
   5    -44.3161045 -0.705734E-08  0.706E-04    5.01      27.8  T
     SCC iter.                  ...        0 min,  0.006 sec
     gradient                   ...        0 min,  0.013 sec
 * total energy  :   -43.8612842 Eh     change       -0.1203710E-03 Eh
   gradient norm :     0.0038197 Eh/α   predicted    -0.1152150E-03 (  -4.28%)
   displ. norm   :     0.0547008 α      lambda       -0.4766608E-04
   maximum displ.:     0.0475597 α      in ANC's #2, #3, #7, ...

........................................................................
.............................. CYCLE    5 ..............................
........................................................................
   1    -44.3157432 -0.443157E+02  0.259E-02    5.00       0.0  T
   2    -44.3157442 -0.992148E-06  0.158E-02    5.00       1.2  T
   3    -44.3157442 -0.387850E-07  0.381E-03    5.00       5.1  T
   4    -44.3157443 -0.614067E-07  0.987E-04    5.00      19.9  T
   5    -44.3157443 -0.604717E-08  0.530E-04    5.00      37.0  T
     SCC iter.                  ...        0 min,  0.006 sec
     gradient                   ...        0 min,  0.014 sec
 * total energy  :   -43.8613215 Eh     change       -0.3731265E-04 Eh
   gradient norm :     0.0015053 Eh/α   predicted    -0.2390543E-04 ( -35.93%)
   displ. norm   :     0.1158802 α      lambda       -0.4045805E-04
   maximum displ.:     0.0978487 α      in ANC's #2, #3, #7, ...

........................................................................
.............................. CYCLE    6 ..............................
........................................................................
   1    -44.3157020 -0.443157E+02  0.543E-02    5.00       0.0  T
   2    -44.3157039 -0.185217E-05  0.333E-02    5.00       1.0  T
   3    -44.3157040 -0.110101E-06  0.555E-03    5.00       3.5  T
   4    -44.3157043 -0.328018E-06  0.195E-03    5.00      10.0  T
   5    -44.3157043 -0.162786E-07  0.103E-03    5.00      19.0  T
   6    -44.3157043 -0.149765E-08  0.191E-04    5.00     102.7  T
   7    -44.3157043 -0.211273E-09  0.875E-05    5.00     224.2  T
     SCC iter.                  ...        0 min,  0.008 sec
     gradient                   ...        0 min,  0.014 sec
 * total energy  :   -43.8613621 Eh     change       -0.4057587E-04 Eh
   gradient norm :     0.0024136 Eh/α   predicted    -0.2035210E-04 ( -49.84%)
   displ. norm   :     0.0477159 α      lambda       -0.1702827E-04
   maximum displ.:     0.0415929 α      in ANC's #2, #3, #9, ...

........................................................................
.............................. CYCLE    7 ..............................
........................................................................
   1    -44.3157996 -0.443158E+02  0.213E-02    5.00       0.0  T
   2    -44.3157997 -0.855011E-07  0.129E-02    5.00       1.5  T
   3    -44.3157998 -0.294119E-07  0.122E-03    5.00      16.1  T
   4    -44.3157998 -0.173310E-07  0.634E-04    5.00      30.9  T
   5    -44.3157998 -0.714451E-09  0.163E-04    5.00     120.1  T
     SCC iter.                  ...        0 min,  0.006 sec
     gradient                   ...        0 min,  0.014 sec
 * total energy  :   -43.8613774 Eh     change       -0.1525959E-04 Eh
   gradient norm :     0.0018335 Eh/α   predicted    -0.8536772E-05 ( -44.06%)
   displ. norm   :     0.0737130 α      lambda       -0.1702028E-04
   maximum displ.:     0.0643226 α      in ANC's #2, #3, #5, ...

........................................................................
.............................. CYCLE    8 ..............................
........................................................................
   1    -44.3160117 -0.443160E+02  0.327E-02    5.01       0.0  T
   2    -44.3160120 -0.360145E-06  0.197E-02    5.01       1.0  T
   3    -44.3160121 -0.877862E-07  0.177E-03    5.01      11.1  T
   4    -44.3160121 -0.155032E-07  0.912E-04    5.01      21.5  T
   5    -44.3160121 -0.224676E-08  0.465E-04    5.01      42.2  T
     SCC iter.                  ...        0 min,  0.006 sec
     gradient                   ...        0 min,  0.014 sec
 * total energy  :   -43.8613971 Eh     change       -0.1975719E-04 Eh
   gradient norm :     0.0006240 Eh/α   predicted    -0.8531838E-05 ( -56.82%)
   displ. norm   :     0.0530841 α      lambda       -0.7685975E-05
   maximum displ.:     0.0485864 α      in ANC's #2, #3, #5, ...

........................................................................
.............................. CYCLE    9 ..............................
........................................................................
   1    -44.3159897 -0.443160E+02  0.239E-02    5.01       0.0  T
   2    -44.3159898 -0.120812E-06  0.144E-02    5.01       1.4  T
   3    -44.3159899 -0.533335E-07  0.117E-03    5.01      16.8  T
   4    -44.3159899 -0.627033E-08  0.694E-04    5.01      28.3  T
   5    -44.3159899 -0.116381E-08  0.256E-04    5.01      76.5  T
     SCC iter.                  ...        0 min,  0.006 sec
     gradient                   ...        0 min,  0.014 sec
 * total energy  :   -43.8614068 Eh     change       -0.9629843E-05 Eh
   gradient norm :     0.0004920 Eh/α   predicted    -0.3848557E-05 ( -60.04%)
   displ. norm   :     0.0530782 α      lambda       -0.2002588E-05
   maximum displ.:     0.0485834 α      in ANC's #2, #3, #5, ...

........................................................................
.............................. CYCLE   10 ..............................
........................................................................
   1    -44.3159200 -0.443159E+02  0.239E-02    5.01       0.0  T
   2    -44.3159201 -0.119395E-06  0.144E-02    5.01       1.4  T
   3    -44.3159202 -0.536122E-07  0.115E-03    5.01      17.0  T
   4    -44.3159202 -0.543604E-08  0.682E-04    5.01      28.8  T
   5    -44.3159202 -0.101927E-08  0.248E-04    5.01      79.1  T
     SCC iter.                  ...        0 min,  0.006 sec
     gradient                   ...        0 min,  0.014 sec
 * total energy  :   -43.8614124 Eh     change       -0.5620656E-05 Eh
   gradient norm :     0.0009035 Eh/α   predicted    -0.1003500E-05 ( -82.15%)
   displ. norm   :     0.0215326 α      lambda       -0.2324138E-05
   maximum displ.:     0.0201808 α      in ANC's #2, #3, #5, ...

........................................................................
.............................. CYCLE   11 ..............................
........................................................................
   1    -44.3160610 -0.443161E+02  0.935E-03    5.01       0.0  T
   2    -44.3160610 -0.315591E-07  0.570E-03    5.01       3.4  T
   3    -44.3160610 -0.446502E-08  0.801E-04    5.01      24.5  T
   4    -44.3160610 -0.830680E-08  0.352E-04    5.01      55.6  T
     SCC iter.                  ...        0 min,  0.005 sec
     gradient                   ...        0 min,  0.014 sec
 * total energy  :   -43.8614150 Eh     change       -0.2644877E-05 Eh
   gradient norm :     0.0005812 Eh/α   predicted    -0.1162696E-05 ( -56.04%)
   displ. norm   :     0.0215335 α      lambda       -0.6760819E-06
   maximum displ.:     0.0201810 α      in ANC's #2, #3, #5, ...

   *** GEOMETRY OPTIMIZATION CONVERGED AFTER 11 ITERATIONS ***

------------------------------------------------------------------------
 total energy gain   :        -0.0069713 Eh       -4.3746 kcal/mol
 total RMSD          :         0.1342391 a0        0.0710 Å
 total power (kW/mol):        -1.6639294 (step)  -53.3418 (real)
------------------------------------------------------------------------

 ANCopt (total)                0 d,  0 h,  0 min,  0.343 sec
 optimizer setup                ...        0 min,  0.000 sec (  0.040%)
 model hessian                  ...        0 min,  0.023 sec (  6.624%)
 ANC generation                 ...        0 min,  0.001 sec (  0.218%)
 coordinate transformation      ...        0 min,  0.000 sec (  0.054%)
 single point calculation       ...        0 min,  0.316 sec ( 92.048%)
 optimization log               ...        0 min,  0.001 sec (  0.375%)
 hessian update                 ...        0 min,  0.000 sec (  0.039%)
 rational function              ...        0 min,  0.001 sec (  0.367%)

================
 final structure:
================
$coord
   -4.54182190731408   -1.17898110703994   -0.59473982585126      C 
   -4.97043579945908    1.66140230742920   -0.76714160571808      C 
   -6.74434604089974    2.72774599620950   -1.66072328065875      O 
   -2.99889660258721    2.87831792839216    0.27875397301615      O 
   -1.06652031750240    1.15952980044365    1.01143756950436      C 
   -2.45038404410372   -1.37386087973019    1.38281401586537      C 
   -0.74986794330801   -3.69264325415064    1.24039916181634      C 
    0.91888715304085   -3.69535588883924   -1.10373269614173      C 
    2.51470069870913   -1.30941932183196   -1.32609991376232      C 
    1.01911802575003    1.17098773068033   -1.04032232289102      C 
    2.87249637692402    2.99803652047016   -0.36794933185761      O 
    4.89474004533250    1.90640778175866    0.71872277299129      C 
    6.61821431698635    3.08046757507303    1.57513311670473      O 
    4.59379120664524   -0.95449369371711    0.64225175023327      C 
   -3.94286171330755   -1.86091660549700   -2.44609969221650      H 
   -6.28082247977456   -2.14518037135657   -0.07858617692842      H 
   -0.24758419185292    1.88217872618352    2.76737515943007      H 
   -3.33548547026833   -1.32613518962758    3.25454298909565      H 
   -1.92823915028224   -5.38445374599019    1.24909568382257      H 
    0.42623362359396   -3.75422110150255    2.93359577056513      H 
   -0.25204082710237   -3.86665322033747   -2.79296493250444      H 
    2.17135171490066   -5.33239105340854   -1.05586211544979      H 
    3.39838132288697   -1.28612369656806   -3.19897383918918      H 
    0.17026925234791    1.79623617171839   -2.81926558223439      H 
    4.02479880893178   -1.59994602731142    2.51598402185498      H 
    6.37470471604919   -1.85864234167740    0.15745133141639      H 
$end
           -------------------------------------------------
          |                Final Singlepoint                |
           -------------------------------------------------

          ...................................................
          :                      SETUP                      :
          :.................................................:
          :  # basis functions                  68          :
          :  # atomic orbitals                  68          :
          :  # shells                           40          :
          :  # electrons                        76          :
          :  max. iterations                   250          :
          :  Hamiltonian                  GFN2-xTB          :
          :  restarted?                      false          :
          :  GBSA solvation                  false          :
          :  PC potential                    false          :
          :  electronic temp.          300.0000000     K    :
          :  accuracy                    1.0000000          :
          :  -> integral cutoff          0.2500000E+02      :
          :  -> integral neglect         0.1000000E-07      :
          :  -> SCF convergence          0.1000000E-05 Eh   :
          :  -> wf. convergence          0.1000000E-03 e    :
          :  Broyden damping             0.4000000          :
          ...................................................

 iter      E             dE          RMSdq      gap      omega  full diag
   1    -44.3160610 -0.443161E+02  0.696E-05    5.01       0.0  T
   2    -44.3160610 -0.335092E-10  0.372E-05    5.01     526.7  T
   3    -44.3160610 -0.412825E-11  0.247E-05    5.01     794.2  T

   *** convergence criteria satisfied after 3 iterations ***

         #    Occupation            Energy/Eh            Energy/eV
      -------------------------------------------------------------
         1        2.0000           -0.7617824             -20.7292
       ...           ...                  ...                  ...
        32        2.0000           -0.4807068             -13.0807
        33        2.0000           -0.4764179             -12.9640
        34        2.0000           -0.4688543             -12.7582
        35        2.0000           -0.4666178             -12.6973
        36        2.0000           -0.4430292             -12.0554
        37        2.0000           -0.4283639             -11.6564
        38        2.0000           -0.4283088             -11.6549 (HOMO)
        39                         -0.2443173              -6.6482 (LUMO)
        40                         -0.2411440              -6.5619
        41                         -0.0395593              -1.0765
        42                         -0.0251523              -0.6844
        43                          0.0126895               0.3453
       ...                                ...                  ...
        68                          0.6609052              17.9841
      -------------------------------------------------------------
                  HL-Gap            0.1839915 Eh            5.0067 eV
             Fermi-level           -0.3363130 Eh           -9.1515 eV

 SCC (total)                   0 d,  0 h,  0 min,  0.027 sec
 SCC setup                      ...        0 min,  0.000 sec (  0.675%)
 Dispersion                     ...        0 min,  0.000 sec (  0.791%)
 integral evaluation            ...        0 min,  0.008 sec ( 30.478%)
 zeroth order Hamiltonian       ...        0 min,  0.000 sec (  0.600%)
 iterations                     ...        0 min,  0.004 sec ( 14.248%)
 molecular gradient             ...        0 min,  0.014 sec ( 51.792%)
 printout                       ...        0 min,  0.000 sec (  1.242%)

         :::::::::::::::::::::::::::::::::::::::::::::::::::::
         ::                     SUMMARY                     ::
         :::::::::::::::::::::::::::::::::::::::::::::::::::::
         :: total energy             -43.861415061937 Eh    ::
         :: gradient norm              0.000583249029 Eh/a0 ::
         :: HOMO-LUMO gap              5.006663396856 eV    ::
         ::.................................................::
         :: SCC energy               -44.316061027271 Eh    ::
         :: -> isotropic ES            0.086203123807 Eh    ::
         :: -> anisotropic ES          0.003166485670 Eh    ::
         :: -> anisotropic XC          0.004944225003 Eh    ::
         :: -> dispersion             -0.024491714126 Eh    ::
         :: repulsion energy           0.454429070227 Eh    ::
         :: add. restraining           0.000000000000 Eh    ::
         :::::::::::::::::::::::::::::::::::::::::::::::::::::

           -------------------------------------------------
          |                Property Printout                |
           -------------------------------------------------

    * Orbital Energies and Occupations

         #    Occupation            Energy/Eh            Energy/eV
      -------------------------------------------------------------
         1        2.0000           -0.7617824             -20.7292
       ...           ...                  ...                  ...
        26        2.0000           -0.5199132             -14.1476
        27        2.0000           -0.5156036             -14.0303
        28        2.0000           -0.5074026             -13.8071
        29        2.0000           -0.4999701             -13.6049
        30        2.0000           -0.4953851             -13.4801
        31        2.0000           -0.4912627             -13.3679
        32        2.0000           -0.4807068             -13.0807
        33        2.0000           -0.4764179             -12.9640
        34        2.0000           -0.4688543             -12.7582
        35        2.0000           -0.4666178             -12.6973
        36        2.0000           -0.4430292             -12.0554
        37        2.0000           -0.4283639             -11.6564
        38        2.0000           -0.4283088             -11.6549 (HOMO)
        39                         -0.2443173              -6.6482 (LUMO)
        40                         -0.2411440              -6.5619
        41                         -0.0395593              -1.0765
        42                         -0.0251523              -0.6844
        43                          0.0126895               0.3453
        44                          0.0263832               0.7179
        45                          0.0312354               0.8500
        46                          0.0369248               1.0048
        47                          0.0517105               1.4071
        48                          0.0642183               1.7475
        49                          0.0707461               1.9251
       ...                                ...                  ...
        68                          0.6609052              17.9841
      -------------------------------------------------------------
                  HL-Gap            0.1839915 Eh            5.0067 eV
             Fermi-level           -0.3363130 Eh           -9.1515 eV

     #   Z        covCN         q      C6AA      α(0)
     1   6 C      3.825    -0.104    22.463     6.744
     2   6 C      2.770     0.358    20.935     7.494
     3   8 O      0.856    -0.362    20.945     6.136
     4   8 O      1.706    -0.255    18.229     5.765
     5   6 C      3.808     0.096    18.987     6.203
     6   6 C      3.874    -0.028    21.030     6.521
     7   6 C      3.803    -0.067    21.784     6.645
     8   6 C      3.803    -0.067    21.784     6.645
     9   6 C      3.874    -0.028    21.030     6.521
    10   6 C      3.808     0.096    18.987     6.203
    11   8 O      1.706    -0.255    18.230     5.765
    12   6 C      2.770     0.358    20.935     7.494
    13   8 O      0.856    -0.362    20.945     6.136
    14   6 C      3.825    -0.104    22.463     6.744
    15   1 H      0.924     0.071     2.075     2.253
    16   1 H      0.925     0.074     2.042     2.234
    17   1 H      0.924     0.066     2.132     2.283
    18   1 H      0.924     0.050     2.320     2.382
    19   1 H      0.924     0.056     2.251     2.346
    20   1 H      0.924     0.047     2.362     2.404
    21   1 H      0.924     0.047     2.362     2.404
    22   1 H      0.924     0.056     2.251     2.346
    23   1 H      0.924     0.050     2.320     2.382
    24   1 H      0.924     0.066     2.131     2.283
    25   1 H      0.924     0.071     2.075     2.253
    26   1 H      0.925     0.074     2.041     2.234

 Mol. C6AA /au·bohr⁶  :       6580.474164
 Mol. C8AA /au·bohr⁸  :     149782.412344
 Mol. α(0) /au        :        118.817060


Wiberg/Mayer (AO) data.
largest (>0.10) Wiberg bond orders for each atom
          total WBO             WBO to atom ...
     1  C   3.995        C    6 1.000    H   16 0.966    C    2 0.958    H   15 0.949
     2  C   3.917        O    3 1.798    O    4 1.110    C    1 0.958
     3  O   2.084        C    2 1.798    O    4 0.163
     4  O   2.311        C    2 1.110    C    5 0.952    O    3 0.163
     5  C   3.933        C    6 0.970    H   17 0.961    C   10 0.961    O    4 0.952
     6  C   3.991        C    7 1.000    C    1 1.000    C    5 0.970    H   18 0.967
     7  C   3.995        C    8 1.010    C    6 1.000    H   19 0.973    H   20 0.972
     8  C   3.995        C    7 1.010    C    9 1.000    H   22 0.973    H   21 0.972
     9  C   3.991        C    8 1.000    C   14 1.000    C   10 0.971    H   23 0.967
    10  C   3.933        C    9 0.971    H   24 0.961    C    5 0.961    O   11 0.952
    11  O   2.311        C   12 1.110    C   10 0.952    O   13 0.163
    12  C   3.917        O   13 1.798    O   11 1.110    C   14 0.958
    13  O   2.084        C   12 1.798    O   11 0.163
    14  C   3.995        C    9 1.000    H   26 0.966    C   12 0.958    H   25 0.949
    15  H   0.995        C    1 0.949
    16  H   0.994        C    1 0.966
    17  H   0.996        C    5 0.961
    18  H   0.997        C    6 0.967
    19  H   0.997        C    7 0.973
    20  H   0.997        C    7 0.972
    21  H   0.997        C    8 0.972
    22  H   0.997        C    8 0.973
    23  H   0.997        C    9 0.967
    24  H   0.996        C   10 0.961
    25  H   0.995        C   14 0.949
    26  H   0.994        C   14 0.966

molecular dipole:
                 x           y           z       tot (Debye)
 q only:        0.060      -2.693       0.045
   full:        0.066      -2.924       0.049       7.434
molecular quadrupole (traceless):
                xx          xy          yy          xz          yz          zz
 q only:      -13.210      -0.476       2.018      -7.540      -0.036      11.193
  q+dip:      -17.562      -0.616       1.198     -11.117      -0.016      16.364
   full:      -17.126      -0.601       0.791     -11.349      -0.015      16.336

           -------------------------------------------------
          |                Geometry Summary                 |
           -------------------------------------------------

      molecular mass/u    :      196.2024000
   center of mass at/Å    :       -0.0040694       0.2326731      -0.0009210
  moments of inertia/u·Å² :        0.3833476E+03   0.9541307E+03   0.1202540E+04
rotational constants/cm⁻¹ :        0.4397479E-01   0.1766805E-01   0.1401836E-01

 * 26 selected distances

     #   Z        #   Z                                     value/Å
     2   6 C      3   8 O                                 1.1929790
     2   6 C      4   8 O                                 1.3451669
     4   8 O      5   6 C                                 1.4224080
     1   6 C      6   6 C                                 1.5266383
     5   6 C      6   6 C                                 1.5401756
     6   6 C      7   6 C                                 1.5235149
     7   6 C      8   6 C                                 1.5226799
     8   6 C      9   6 C                                 1.5235124
     5   6 C     10   6 C                                 1.5482154 (max)
     9   6 C     10   6 C                                 1.5401563
    10   6 C     11   8 O                                 1.4224147
    11   8 O     12   6 C                                 1.3451910
    12   6 C     13   8 O                                 1.1929654
     9   6 C     14   6 C                                 1.5266556
     1   6 C     15   1 H                                 1.0910966
     1   6 C     16   1 H                                 1.0875949 (min)
     5   6 C     17   1 H                                 1.0942836
     6   6 C     18   1 H                                 1.0959275
     7   6 C     19   1 H                                 1.0910369
     7   6 C     20   1 H                                 1.0914301
     8   6 C     21   1 H                                 1.0914299
     8   6 C     22   1 H                                 1.0910351
     9   6 C     23   1 H                                 1.0959325
    10   6 C     24   1 H                                 1.0942740
    14   6 C     25   1 H                                 1.0910852
    14   6 C     26   1 H                                 1.0876066

 * 3 distinct bonds (by element types)

   Z      Z             #   av. dist./Å        max./Å        min./Å
   1 H    6 C          12     1.0918944     1.0959325     1.0875949
   6 C    6 C           8     1.5314436     1.5482154     1.5226799
   6 C    8 O           6     1.3201875     1.4224147     1.1929654


optimized geometry written to: xtbopt.xyz


           -------------------------------------------------
          | TOTAL ENERGY              -43.861415061937 Eh   |
          | GRADIENT NORM               0.000583249029 Eh/α |
          | HOMO-LUMO GAP               5.006663396856 eV   |
           -------------------------------------------------

------------------------------------------------------------------------
 * finished run on 2021/05/19 at 11:01:02.824     
------------------------------------------------------------------------
 total:
 * wall-time:     0 d,  0 h,  0 min,  0.440 sec
 *  cpu-time:     0 d,  0 h,  0 min,  0.428 sec
 * ratio c/w:     0.971 speedup
 SCF:
 * wall-time:     0 d,  0 h,  0 min,  0.037 sec
 *  cpu-time:     0 d,  0 h,  0 min,  0.037 sec
 * ratio c/w:     1.000 speedup
 ANC optimizer:
 * wall-time:     0 d,  0 h,  0 min,  0.371 sec
 *  cpu-time:     0 d,  0 h,  0 min,  0.371 sec
 * ratio c/w:     0.999 speedup

