      -----------------------------------------------------------      
     |                   =====================                   |     
     |                           x T B                           |     
     |                   =====================                   |     
     |                         S. Grimme                         |     
     |          Mulliken Center for Theoretical Chemistry        |     
     |                    University of Bonn                     |     
     |                Version 6.2 RC2 (SAW190805)                |     
      -----------------------------------------------------------      

   This program is distributed in the hope that it will be useful,
   but WITHOUT ANY WARRANTY; without even the implied warranty of
   MERCHANTABILITY or FITNESS FOR A PARTICULAR PURPOSE.
   
   FOR NON-COMMERCIAL, ACADEMIA USE ONLY.
   
   Cite this work as:
   * S. Grimme, C. Bannwarth, P. Shushkov, J. Chem. Theory Comput., 2017,
     13, 1989-2009. DOI: 10.1021/acs.jctc.7b00118
   * C. Bannwarth, S. Ehlert and S. Grimme., J. Chem. Theory Comput., 2019,
     15, 1652-1671. DOI: 10.1021/acs.jctc.8b01176
   * P. Pracht, E. Caldeweyher, S. Ehlert, S. Grimme, ChemRxiv, 2019, preprint.
     DOI: 10.26434/chemrxiv.8326202.v1
   
   for DFT-D4:
   * E. Caldeweyher, C. Bannwarth and S. Grimme, J. Chem. Phys., 2017,
     147, 034112. DOI: 10.1063/1.4993215
   * E. Caldeweyher, S. Ehlert, A. Hansen, H. Neugebauer, S. Spicher,
     C. Bannwarth and S. Grimme, J. Chem. Phys., 2019, 150, 154122.
     DOI: 10.1063/1.5090222
   
   for sTDA-xTB:
   * S. Grimme and C. Bannwarth, J. Chem. Phys., 2016, 145, 054103.
     DOI: 10.1063/1.4959605
   
   in the mass-spec context:
   * V. Asgeirsson, C. Bauer and S. Grimme, Chem. Sci., 2017, 8, 4879.
     DOI: 10.1039/c7sc00601b
   
   for metadynamics refer to:
   * S. Grimme, J. Chem. Theory Comput., 2019, 155, 2847-2862
     DOI: 10.1021/acs.jctc.9b00143
   
   with help from (in alphabetical order)
   C. Bannwarth, F. Bohle, G. Brandenburg, E. Caldeweyher, M. Checinski,
   S. Dohm, S. Ehlert, S. Ehrlich, F. März, H. Neugebauer, J. Pisarek,
   P. Pracht, P. Shushkov, and S. Spicher.
   
 * started run on 2021/05/19 at 11:01:03.068     

           -------------------------------------------------
          |                Calculation Setup                |
           -------------------------------------------------

          program call               : /ihome/ghutchison/geoffh/xtb/xtb 971.xyz -opt
          hostname                   : smp-n122
          coordinate file            : 971.xyz
          omp threads                :                     1
          number of atoms            :                    24
          number of electrons        :                    78
          charge                     :                     0
          spin                       :                   0.0
          first test random number   :      0.88476546583933


########################################################################
# WARNING! Please study the warnings concerning your input carefully
#  - the use of '-opt' is discouraged, please use '--opt' next time
########################################################################

           ------------------------------------------------- 
          |                 G F N 2 - x T B                 |
          | Geometry, Frequencies, Noncovalent interactions |
          |            JCTC 2019 parametrisation            |
           ------------------------------------------------- 
             KAB for C  - Si     :                1.0500
             KAB for H  - Pd     :                0.9500
             k(s)              :                1.8500
             k(p)              :                2.2300
             k(d)              :                2.2300
             k(f)              :                2.0000
             kEN (H0ij)        :               -2.0000
             D4 a1             :                0.5200
             D4 a2             :                5.0000
             D4 s6             :                1.0000
             D4 s8             :                2.7000
             D4 s9             :                5.0000
             alphaj            :                2.0000

  Z AO/shell   Hii/eV     exponent
  1     Wed Apr 25 08:07:45 CEST 2018   EN: 2.200 GM2: 0.406  GM3: 0.0800  RAES: 1.40
     1s    -10.707211    1.230000
  6     Wed Apr 25 08:07:45 CEST 2018   EN: 2.550 GM2: 0.538  GM3: 0.1500  RAES: 3.00
     2s    -13.970922    2.096432
     2p    -10.063292    1.800000
  8     Wed Apr 25 08:07:45 CEST 2018   EN: 3.440 GM2: 0.452  GM3:-0.0517  RAES: 1.80
     2s    -20.229985    2.439742
     2p    -15.503117    2.137023
  9     Mon Apr 23 13:58:50 CEST 2018   EN: 3.980 GM2: 0.532  GM3: 0.1426  RAES: 2.40
     2s    -23.458179    2.416361
     2p    -15.746583    2.308399
 16     Tue Apr 24 11:44:34 CEST 2018   EN: 2.580 GM2: 0.340  GM3:-0.0502  RAES: 3.10
     3s    -20.029654    1.981333
     3p    -11.377694    2.025643
     3d     -0.420282    1.702555

           ------------------------------------------------- 
          |        Self-Consistent Charge Iterations        |
           ------------------------------------------------- 

          ...................................................
          :                      SETUP                      :
          :.................................................:
          :  # basis functions                  81          :
          :  # atomic orbitals                  79          :
          :  # shells                           41          :
          :  # electrons                        78          :
          :  max. iterations                   250          :
          :  Hamiltonian                  GFN2-xTB          :
          :  restarted?                      false          :
          :  GBSA solvation                  false          :
          :  PC potential                    false          :
          :  electronic temp.          300.0000000     K    :
          :  accuracy                    1.0000000          :
          :  -> integral cutoff          0.2500000E+02      :
          :  -> integral neglect         0.1000000E-07      :
          :  -> SCF convergence          0.1000000E-05 Eh   :
          :  -> wf. convergence          0.1000000E-03 e    :
          :  Broyden damping             0.4000000          :
          ...................................................

 iter      E             dE          RMSdq      gap      omega  full diag
   1    -43.8315460 -0.438315E+02  0.504E+00    2.02       0.0  T
   2    -43.8713044 -0.397584E-01  0.276E+00    1.85       1.0  T
   3    -43.8579923  0.133121E-01  0.215E+00    2.01       1.0  T
   4    -43.9002973 -0.423050E-01  0.794E-01    1.86       1.0  T
   5    -43.9111166 -0.108193E-01  0.259E-01    1.86       1.0  T
   6    -43.9113068 -0.190202E-03  0.134E-01    1.84       1.0  T
   7    -43.9115567 -0.249875E-03  0.445E-02    1.85       1.0  T
   8    -43.9115823 -0.256371E-04  0.165E-02    1.85       1.2  T
   9    -43.9115822  0.182134E-06  0.976E-03    1.85       2.1  T
  10    -43.9115828 -0.694681E-06  0.393E-03    1.85       5.2  T
  11    -43.9115830 -0.181401E-06  0.176E-03    1.85      11.6  T
  12    -43.9115830 -0.112448E-07  0.812E-04    1.85      25.2  T
  13    -43.9115830 -0.206790E-08  0.295E-04    1.85      69.2  T

   *** convergence criteria satisfied after 13 iterations ***

         #    Occupation            Energy/Eh            Energy/eV
      -------------------------------------------------------------
         1        2.0000           -0.8531468             -23.2153
       ...           ...                  ...                  ...
        33        2.0000           -0.4543655             -12.3639
        34        2.0000           -0.4499374             -12.2434
        35        2.0000           -0.4427788             -12.0486
        36        2.0000           -0.4227185             -11.5028
        37        2.0000           -0.4160324             -11.3208
        38        2.0000           -0.3993208             -10.8661
        39        2.0000           -0.3798937             -10.3374 (HOMO)
        40                         -0.3118655              -8.4863 (LUMO)
        41                         -0.2689152              -7.3176
        42                         -0.2416222              -6.5749
        43                         -0.2282312              -6.2105
        44                         -0.2193159              -5.9679
       ...                                ...                  ...
        79                          0.7327236              19.9384
      -------------------------------------------------------------
                  HL-Gap            0.0680282 Eh            1.8511 eV
             Fermi-level           -0.3458796 Eh           -9.4119 eV

 SCC (total)                   0 d,  0 h,  0 min,  0.062 sec
 SCC setup                      ...        0 min,  0.000 sec (  0.535%)
 Dispersion                     ...        0 min,  0.000 sec (  0.587%)
 integral evaluation            ...        0 min,  0.025 sec ( 40.650%)
 zeroth order Hamiltonian       ...        0 min,  0.000 sec (  0.352%)
 iterations                     ...        0 min,  0.019 sec ( 30.029%)
 molecular gradient             ...        0 min,  0.017 sec ( 27.159%)
 printout                       ...        0 min,  0.000 sec (  0.600%)

         :::::::::::::::::::::::::::::::::::::::::::::::::::::
         ::                     SUMMARY                     ::
         :::::::::::::::::::::::::::::::::::::::::::::::::::::
         :: total energy             -43.374046140358 Eh    ::
         :: gradient norm              0.103930734519 Eh/a0 ::
         :: HOMO-LUMO gap              1.851141246291 eV    ::
         ::.................................................::
         :: SCC energy               -43.911583041852 Eh    ::
         :: -> isotropic ES            0.037259912085 Eh    ::
         :: -> anisotropic ES          0.002701020343 Eh    ::
         :: -> anisotropic XC          0.011429492230 Eh    ::
         :: -> dispersion             -0.026691099415 Eh    ::
         :: repulsion energy           0.537545251111 Eh    ::
         :: add. restraining           0.000000000000 Eh    ::
         :::::::::::::::::::::::::::::::::::::::::::::::::::::

      ----------------------------------------------------------- 
     |                   =====================                   |
     |                        A N C O P T                        |
     |                   =====================                   |
     |               Approximate Normal Coordinate               |
     |                Rational Function Optimizer                |
      ----------------------------------------------------------- 

          ...................................................
          :                      SETUP                      :
          :.................................................:
          :   optimization level            normal          :
          :   max. optcycles                   200          :
          :   ANC micro-cycles                  20          :
          :   degrees of freedom                66          :
          :.................................................:
          :   RF solver                   davidson          :
          :   input Hessian                  false          :
          :   write xtbopt.log                true          :
          :   linear?                        false          :
          :   energy convergence         0.5000000E-05 Eh   :
          :   grad. convergence          0.1000000E-02 Eh/α :
          :   maximium RF displ.         2.0000000          :
          :   Hlow (freq-cutoff)         0.5000000E-02      :
          :   Hmax (freq-cutoff)         5.0000000          :
          :   S6 in model hess.         20.0000000          :
          ...................................................

generating ANC from model Hessian ...
Using Lindh-Hessian (1995)
 Shifting diagonal of input Hessian by   4.013368820189058E-003
 Lowest  eigenvalues of input Hessian
   -0.000000   -0.000000   -0.000000    0.000000    0.000000    0.000000
    0.005000    0.005961    0.006025    0.007800    0.009137    0.011078
    0.013311    0.014665    0.016458    0.016923    0.023819    0.029348
 Highest eigenvalues
    1.689366    1.830958    1.939171    2.056260    2.102210    2.157663
 

........................................................................
.............................. CYCLE    1 ..............................
........................................................................
   1    -43.9115830 -0.439116E+02  0.112E-04    1.85       0.0  T
   2    -43.9115830 -0.245919E-10  0.650E-05    1.85     313.9  T
   3    -43.9115830 -0.192557E-11  0.404E-05    1.85     505.3  T
     SCC iter.                  ...        0 min,  0.005 sec
     gradient                   ...        0 min,  0.017 sec
 * total energy  :   -43.3740461 Eh     change        0.1164337E-07 Eh
   gradient norm :     0.1039287 Eh/α   predicted     0.0000000E+00 (-100.00%)
   displ. norm   :     0.2232647 α      lambda       -0.1379778E-01
   maximum displ.:     0.1027668 α      in ANC's #28, #31, #43, ...

........................................................................
.............................. CYCLE    2 ..............................
........................................................................
   1    -43.9267440 -0.439267E+02  0.357E-01    1.89       0.0  T
   2    -43.9266752  0.687153E-04  0.249E-01    1.89       1.0  T
   3    -43.9269359 -0.260611E-03  0.158E-01    1.88       1.0  T
   4    -43.9273005 -0.364656E-03  0.509E-02    1.89       1.0  T
   5    -43.9273208 -0.203360E-04  0.267E-02    1.88       1.0  T
   6    -43.9273263 -0.549193E-05  0.966E-03    1.88       2.1  T
   7    -43.9273275 -0.117811E-05  0.270E-03    1.88       7.5  T
   8    -43.9273276 -0.371219E-07  0.147E-03    1.88      13.9  T
     SCC iter.                  ...        0 min,  0.010 sec
     gradient                   ...        0 min,  0.016 sec
 * total energy  :   -43.3830920 Eh     change       -0.9045880E-02 Eh
   gradient norm :     0.0421827 Eh/α   predicted    -0.7242780E-02 ( -19.93%)
   displ. norm   :     0.1488648 α      lambda       -0.2682453E-02
   maximum displ.:     0.0663915 α      in ANC's #4, #20, #19, ...

........................................................................
.............................. CYCLE    3 ..............................
........................................................................
   1    -43.9330725 -0.439331E+02  0.207E-01    1.89       0.0  T
   2    -43.9330910 -0.185682E-04  0.131E-01    1.90       1.0  T
   3    -43.9330616  0.293868E-04  0.949E-02    1.89       1.0  T
   4    -43.9332069 -0.145286E-03  0.314E-02    1.90       1.0  T
   5    -43.9332164 -0.943450E-05  0.147E-02    1.90       1.4  T
   6    -43.9332181 -0.173396E-05  0.530E-03    1.90       3.9  T
   7    -43.9332184 -0.311274E-06  0.196E-03    1.90      10.4  T
     SCC iter.                  ...        0 min,  0.009 sec
     gradient                   ...        0 min,  0.016 sec
 * total energy  :   -43.3846231 Eh     change       -0.1531096E-02 Eh
   gradient norm :     0.0115331 Eh/α   predicted    -0.1370953E-02 ( -10.46%)
   displ. norm   :     0.1113657 α      lambda       -0.2930315E-03
   maximum displ.:     0.0711797 α      in ANC's #4, #3, #2, ...

........................................................................
.............................. CYCLE    4 ..............................
........................................................................
   1    -43.9330265 -0.439330E+02  0.778E-02    1.89       0.0  T
   2    -43.9330318 -0.537017E-05  0.435E-02    1.90       1.0  T
   3    -43.9330250  0.682010E-05  0.259E-02    1.89       1.0  T
   4    -43.9330334 -0.842177E-05  0.988E-03    1.90       2.1  T
   5    -43.9330349 -0.147606E-05  0.458E-03    1.90       4.5  T
   6    -43.9330351 -0.203292E-06  0.179E-03    1.90      11.4  T
   7    -43.9330351 -0.283054E-07  0.903E-04    1.90      22.6  T
     SCC iter.                  ...        0 min,  0.009 sec
     gradient                   ...        0 min,  0.016 sec
 * total energy  :   -43.3848332 Eh     change       -0.2100614E-03 Eh
   gradient norm :     0.0049376 Eh/α   predicted    -0.1483332E-03 ( -29.39%)
   displ. norm   :     0.1579194 α      lambda       -0.2035122E-03
   maximum displ.:     0.1009179 α      in ANC's #4, #3, #2, ...

........................................................................
.............................. CYCLE    5 ..............................
........................................................................
   1    -43.9324648 -0.439325E+02  0.973E-02    1.89       0.0  T
   2    -43.9324687 -0.389111E-05  0.542E-02    1.89       1.0  T
   3    -43.9324632  0.551167E-05  0.216E-02    1.89       1.0  T
   4    -43.9324693 -0.611159E-05  0.920E-03    1.89       2.2  T
   5    -43.9324701 -0.800856E-06  0.441E-03    1.89       4.6  T
   6    -43.9324703 -0.220000E-06  0.192E-03    1.89      10.6  T
   7    -43.9324704 -0.481222E-07  0.800E-04    1.89      25.5  T
     SCC iter.                  ...        0 min,  0.009 sec
     gradient                   ...        0 min,  0.016 sec
 * total energy  :   -43.3849664 Eh     change       -0.1332160E-03 Eh
   gradient norm :     0.0040107 Eh/α   predicted    -0.1042942E-03 ( -21.71%)
   displ. norm   :     0.1396044 α      lambda       -0.1036037E-03
   maximum displ.:     0.0900181 α      in ANC's #4, #3, #2, ...

........................................................................
.............................. CYCLE    6 ..............................
........................................................................
   1    -43.9322391 -0.439322E+02  0.760E-02    1.89       0.0  T
   2    -43.9322401 -0.103550E-05  0.427E-02    1.89       1.0  T
   3    -43.9322370  0.312175E-05  0.135E-02    1.89       1.5  T
   4    -43.9322402 -0.316592E-05  0.648E-03    1.89       3.2  T
   5    -43.9322406 -0.423227E-06  0.250E-03    1.89       8.2  T
   6    -43.9322407 -0.847441E-07  0.988E-04    1.89      20.7  T
     SCC iter.                  ...        0 min,  0.008 sec
     gradient                   ...        0 min,  0.016 sec
 * total energy  :   -43.3850434 Eh     change       -0.7703603E-04 Eh
   gradient norm :     0.0050581 Eh/α   predicted    -0.5281392E-04 ( -31.44%)
   displ. norm   :     0.1718399 α      lambda       -0.1102447E-03
   maximum displ.:     0.1085958 α      in ANC's #4, #3, #2, ...

........................................................................
.............................. CYCLE    7 ..............................
........................................................................
   1    -43.9322939 -0.439323E+02  0.917E-02    1.89       0.0  T
   2    -43.9322953 -0.140222E-05  0.518E-02    1.89       1.0  T
   3    -43.9322916  0.372938E-05  0.150E-02    1.89       1.4  T
   4    -43.9322955 -0.390621E-05  0.698E-03    1.89       2.9  T
   5    -43.9322959 -0.390128E-06  0.310E-03    1.89       6.6  T
   6    -43.9322961 -0.161470E-06  0.900E-04    1.89      22.7  T
   7    -43.9322961 -0.828848E-08  0.453E-04    1.89      45.1  T
     SCC iter.                  ...        0 min,  0.009 sec
     gradient                   ...        0 min,  0.016 sec
 * total energy  :   -43.3851310 Eh     change       -0.8753848E-04 Eh
   gradient norm :     0.0049287 Eh/α   predicted    -0.5675028E-04 ( -35.17%)
   displ. norm   :     0.2383281 α      lambda       -0.1322182E-03
   maximum displ.:     0.1583549 α      in ANC's #4, #3, #2, ...

........................................................................
.............................. CYCLE    8 ..............................
........................................................................
   1    -43.9321249 -0.439321E+02  0.131E-01    1.88       0.0  T
   2    -43.9321285 -0.356062E-05  0.727E-02    1.88       1.0  T
   3    -43.9321235  0.496053E-05  0.207E-02    1.88       1.0  T
   4    -43.9321293 -0.583260E-05  0.885E-03    1.88       2.3  T
   5    -43.9321295 -0.226542E-06  0.477E-03    1.88       4.3  T
   6    -43.9321300 -0.401738E-06  0.121E-03    1.88      16.8  T
   7    -43.9321300 -0.249918E-07  0.552E-04    1.88      37.0  T
     SCC iter.                  ...        0 min,  0.009 sec
     gradient                   ...        0 min,  0.029 sec
 * total energy  :   -43.3852238 Eh     change       -0.9280508E-04 Eh
   gradient norm :     0.0040224 Eh/α   predicted    -0.6987687E-04 ( -24.71%)
   displ. norm   :     0.1935350 α      lambda       -0.8605143E-04
   maximum displ.:     0.1330232 α      in ANC's #4, #2, #3, ...

........................................................................
.............................. CYCLE    9 ..............................
........................................................................
   1    -43.9321366 -0.439321E+02  0.111E-01    1.87       0.0  T
   2    -43.9321389 -0.229420E-05  0.621E-02    1.87       1.0  T
   3    -43.9321318  0.715637E-05  0.216E-02    1.87       1.0  T
   4    -43.9321397 -0.796586E-05  0.772E-03    1.87       2.6  T
   5    -43.9321399 -0.175346E-06  0.433E-03    1.87       4.7  T
   6    -43.9321403 -0.353132E-06  0.848E-04    1.87      24.1  T
   7    -43.9321403 -0.963097E-08  0.390E-04    1.87      52.3  T
     SCC iter.                  ...        0 min,  0.009 sec
     gradient                   ...        0 min,  0.028 sec
 * total energy  :   -43.3852794 Eh     change       -0.5565824E-04 Eh
   gradient norm :     0.0029638 Eh/α   predicted    -0.4465869E-04 ( -19.76%)
   displ. norm   :     0.1280123 α      lambda       -0.4973127E-04
   maximum displ.:     0.0977370 α      in ANC's #4, #2, #3, ...

........................................................................
.............................. CYCLE   10 ..............................
........................................................................
   1    -43.9325156 -0.439325E+02  0.858E-02    1.87       0.0  T
   2    -43.9325168 -0.122908E-05  0.469E-02    1.87       1.0  T
   3    -43.9325076  0.917303E-05  0.227E-02    1.86       1.0  T
   4    -43.9325179 -0.102817E-04  0.599E-03    1.87       3.4  T
   5    -43.9325179  0.114920E-07  0.268E-03    1.87       7.6  T
   6    -43.9325181 -0.157229E-06  0.416E-04    1.87      49.0  T
   7    -43.9325181 -0.105364E-08  0.242E-04    1.87      84.2  T
     SCC iter.                  ...        0 min,  0.009 sec
     gradient                   ...        0 min,  0.017 sec
 * total energy  :   -43.3853150 Eh     change       -0.3553118E-04 Eh
   gradient norm :     0.0021295 Eh/α   predicted    -0.2527684E-04 ( -28.86%)
   displ. norm   :     0.1089112 α      lambda       -0.3688543E-04
   maximum displ.:     0.0847372 α      in ANC's #4, #2, #6, ...

........................................................................
.............................. CYCLE   11 ..............................
........................................................................
   1    -43.9327363 -0.439327E+02  0.777E-02    1.86       0.0  T
   2    -43.9327373 -0.101075E-05  0.425E-02    1.86       1.0  T
   3    -43.9327317  0.559261E-05  0.177E-02    1.86       1.2  T
   4    -43.9327379 -0.620475E-05  0.548E-03    1.86       3.7  T
   5    -43.9327380 -0.108830E-06  0.192E-03    1.86      10.6  T
   6    -43.9327381 -0.687764E-07  0.427E-04    1.86      47.8  T
   7    -43.9327381 -0.180449E-08  0.205E-04    1.86      99.4  T
     SCC iter.                  ...        0 min,  0.009 sec
     gradient                   ...        0 min,  0.017 sec
 * total energy  :   -43.3853437 Eh     change       -0.2872522E-04 Eh
   gradient norm :     0.0019240 Eh/α   predicted    -0.1866260E-04 ( -35.03%)
   displ. norm   :     0.2322399 α      lambda       -0.4272791E-04
   maximum displ.:     0.1762276 α      in ANC's #4, #2, #6, ...

........................................................................
.............................. CYCLE   12 ..............................
........................................................................
   1    -43.9322825 -0.439323E+02  0.167E-01    1.86       0.0  T
   2    -43.9322872 -0.467300E-05  0.911E-02    1.86       1.0  T
   3    -43.9322719  0.152303E-04  0.307E-02    1.86       1.0  T
   4    -43.9322884 -0.165029E-04  0.122E-02    1.86       1.7  T
   5    -43.9322896 -0.119292E-05  0.269E-03    1.86       7.6  T
   6    -43.9322897 -0.110377E-06  0.867E-04    1.86      23.5  T
   7    -43.9322897 -0.930235E-08  0.405E-04    1.86      50.4  T
     SCC iter.                  ...        0 min,  0.009 sec
     gradient                   ...        0 min,  0.017 sec
 * total energy  :   -43.3853817 Eh     change       -0.3798573E-04 Eh
   gradient norm :     0.0031367 Eh/α   predicted    -0.2187961E-04 ( -42.40%)
   displ. norm   :     0.1547522 α      lambda        0.2399749E-04
   maximum displ.:     0.1175027 α      in ANC's #4, #2, #6, ...

........................................................................
.............................. CYCLE   13 ..............................
........................................................................
   1    -43.9312216 -0.439312E+02  0.110E-01    1.85       0.0  T
   2    -43.9312237 -0.212576E-05  0.602E-02    1.85       1.0  T
   3    -43.9312196  0.411307E-05  0.170E-02    1.85       1.2  T
   4    -43.9312238 -0.420106E-05  0.858E-03    1.85       2.4  T
   5    -43.9312246 -0.779561E-06  0.205E-03    1.85       9.9  T
   6    -43.9312247 -0.683168E-07  0.584E-04    1.85      35.0  T
   7    -43.9312247 -0.403221E-08  0.279E-04    1.85      73.3  T
     SCC iter.                  ...        0 min,  0.009 sec
     gradient                   ...        0 min,  0.017 sec
 * total energy  :   -43.3853702 Eh     change        0.1149460E-04 Eh
   gradient norm :     0.0053769 Eh/α   predicted     0.1228166E-04 (   6.85%)
   displ. norm   :     0.0635915 α      lambda       -0.5721152E-04
   maximum displ.:     0.0444652 α      in ANC's #4, #2, #3, ...

........................................................................
.............................. CYCLE   14 ..............................
........................................................................
   1    -43.9330862 -0.439331E+02  0.368E-02    1.86       0.0  T
   2    -43.9330866 -0.316615E-06  0.203E-02    1.86       1.0  T
   3    -43.9330860  0.527432E-06  0.651E-03    1.86       3.1  T
   4    -43.9330867 -0.635046E-06  0.242E-03    1.86       8.4  T
   5    -43.9330867 -0.259202E-07  0.808E-04    1.86      25.3  T
     SCC iter.                  ...        0 min,  0.007 sec
     gradient                   ...        0 min,  0.016 sec
 * total energy  :   -43.3854017 Eh     change       -0.3156686E-04 Eh
   gradient norm :     0.0028450 Eh/α   predicted    -0.2872461E-04 (  -9.00%)
   displ. norm   :     0.0324305 α      lambda       -0.2993770E-04
   maximum displ.:     0.0153496 α      in ANC's #7, #8, #3, ...

........................................................................
.............................. CYCLE   15 ..............................
........................................................................
   1    -43.9331397 -0.439331E+02  0.289E-02    1.86       0.0  T
   2    -43.9331400 -0.309267E-06  0.156E-02    1.86       1.3  T
   3    -43.9331384  0.163882E-05  0.970E-03    1.86       2.1  T
   4    -43.9331403 -0.188911E-05  0.277E-03    1.86       7.4  T
   5    -43.9331403 -0.340641E-07  0.154E-03    1.86      13.3  T
   6    -43.9331403 -0.246737E-07  0.483E-04    1.86      42.3  T
   7    -43.9331403 -0.277495E-08  0.174E-04    1.86     117.1  T
     SCC iter.                  ...        0 min,  0.009 sec
     gradient                   ...        0 min,  0.017 sec
 * total energy  :   -43.3854191 Eh     change       -0.1734148E-04 Eh
   gradient norm :     0.0021963 Eh/α   predicted    -0.1498716E-04 ( -13.58%)
   displ. norm   :     0.1061805 α      lambda       -0.2909835E-04
   maximum displ.:     0.0707162 α      in ANC's #4, #2, #3, ...

........................................................................
.............................. CYCLE   16 ..............................
........................................................................
   1    -43.9329659 -0.439330E+02  0.716E-02    1.86       0.0  T
   2    -43.9329666 -0.719517E-06  0.404E-02    1.86       1.0  T
   3    -43.9329650  0.167948E-05  0.111E-02    1.86       1.8  T
   4    -43.9329668 -0.184151E-05  0.442E-03    1.86       4.6  T
   5    -43.9329669 -0.915404E-07  0.206E-03    1.86       9.9  T
   6    -43.9329670 -0.808876E-07  0.535E-04    1.86      38.2  T
   7    -43.9329670 -0.516692E-08  0.198E-04    1.86     103.2  T
     SCC iter.                  ...        0 min,  0.009 sec
     gradient                   ...        0 min,  0.017 sec
 * total energy  :   -43.3854398 Eh     change       -0.2073924E-04 Eh
   gradient norm :     0.0011954 Eh/α   predicted    -0.1471650E-04 ( -29.04%)
   displ. norm   :     0.3092261 α      lambda       -0.2878819E-04
   maximum displ.:     0.2165359 α      in ANC's #4, #2, #3, ...

........................................................................
.............................. CYCLE   17 ..............................
........................................................................
   1    -43.9309590 -0.439310E+02  0.203E-01    1.86       0.0  T
   2    -43.9309650 -0.599743E-05  0.113E-01    1.86       1.0  T
   3    -43.9309642  0.863285E-06  0.188E-02    1.86       1.1  T
   4    -43.9309627  0.145709E-05  0.155E-02    1.86       1.3  T
   5    -43.9309667 -0.399244E-05  0.298E-03    1.86       6.9  T
   6    -43.9309669 -0.169579E-06  0.706E-04    1.86      28.9  T
   7    -43.9309669 -0.304698E-08  0.427E-04    1.86      47.8  T
     SCC iter.                  ...        0 min,  0.009 sec
     gradient                   ...        0 min,  0.017 sec
 * total energy  :   -43.3854437 Eh     change       -0.3897842E-05 Eh
   gradient norm :     0.0043910 Eh/α   predicted    -0.1500904E-04 ( 285.06%)
   displ. norm   :     0.0758153 α      lambda       -0.3441295E-04
   maximum displ.:     0.0572354 α      in ANC's #4, #2, #6, ...

........................................................................
.............................. CYCLE   18 ..............................
........................................................................
   1    -43.9323872 -0.439324E+02  0.494E-02    1.86       0.0  T
   2    -43.9323875 -0.364275E-06  0.275E-02    1.86       1.0  T
   3    -43.9323873  0.189197E-06  0.538E-03    1.86       3.8  T
   4    -43.9323875 -0.121977E-06  0.365E-03    1.86       5.6  T
   5    -43.9323876 -0.174114E-06  0.929E-04    1.86      22.0  T
   6    -43.9323877 -0.180497E-07  0.207E-04    1.86      98.4  T
     SCC iter.                  ...        0 min,  0.008 sec
     gradient                   ...        0 min,  0.016 sec
 * total energy  :   -43.3854633 Eh     change       -0.1957114E-04 Eh
   gradient norm :     0.0015185 Eh/α   predicted    -0.1730677E-04 ( -11.57%)
   displ. norm   :     0.0436633 α      lambda       -0.7085399E-05
   maximum displ.:     0.0205798 α      in ANC's #4, #1, #2, ...

........................................................................
.............................. CYCLE   19 ..............................
........................................................................
   1    -43.9329083 -0.439329E+02  0.274E-02    1.86       0.0  T
   2    -43.9329083 -0.764476E-07  0.160E-02    1.86       1.3  T
   3    -43.9329070  0.133907E-05  0.816E-03    1.86       2.5  T
   4    -43.9329085 -0.147155E-05  0.163E-03    1.86      12.6  T
   5    -43.9329085  0.112674E-08  0.949E-04    1.86      21.5  T
   6    -43.9329085 -0.162177E-07  0.247E-04    1.86      82.6  T
     SCC iter.                  ...        0 min,  0.008 sec
     gradient                   ...        0 min,  0.017 sec
 * total energy  :   -43.3854705 Eh     change       -0.7263900E-05 Eh
   gradient norm :     0.0006364 Eh/α   predicted    -0.3548837E-05 ( -51.14%)
   displ. norm   :     0.1203730 α      lambda       -0.8730988E-05
   maximum displ.:     0.0706621 α      in ANC's #4, #2, #1, ...

........................................................................
.............................. CYCLE   20 ..............................
........................................................................
   1    -43.9329010 -0.439329E+02  0.761E-02    1.85       0.0  T
   2    -43.9329017 -0.752017E-06  0.431E-02    1.85       1.0  T
   3    -43.9329008  0.901114E-06  0.921E-03    1.85       2.2  T
   4    -43.9329017 -0.933682E-06  0.520E-03    1.85       3.9  T
   5    -43.9329020 -0.278919E-06  0.159E-03    1.85      12.8  T
   6    -43.9329021 -0.533488E-07  0.503E-04    1.85      40.6  T
   7    -43.9329021 -0.831946E-09  0.301E-04    1.85      67.8  T
     SCC iter.                  ...        0 min,  0.009 sec
     gradient                   ...        0 min,  0.017 sec
 * total energy  :   -43.3854807 Eh     change       -0.1011323E-04 Eh
   gradient norm :     0.0008419 Eh/α   predicted    -0.4396217E-05 ( -56.53%)
   displ. norm   :     0.2731719 α      lambda       -0.1441619E-04
   maximum displ.:     0.1582926 α      in ANC's #4, #2, #1, ...
 * RMSD in coord.:     0.4484019 α      energy gain  -0.1143452E-01 Eh

generating ANC from model Hessian ...
Using Lindh-Hessian (1995)
 Shifting diagonal of input Hessian by   3.892440217688297E-003
 Lowest  eigenvalues of input Hessian
   -0.000000   -0.000000   -0.000000    0.000000    0.000000    0.000000
    0.005000    0.005717    0.005898    0.007535    0.009088    0.010146
    0.013673    0.014508    0.017214    0.017532    0.024054    0.030202
 Highest eigenvalues
    1.730021    1.864852    1.943691    2.019678    2.056696    2.200773
 

........................................................................
.............................. CYCLE   21 ..............................
........................................................................
   1    -43.9312102 -0.439312E+02  0.172E-01    1.85       0.0  T
   2    -43.9312141 -0.384088E-05  0.978E-02    1.85       1.0  T
   3    -43.9312145 -0.431647E-06  0.139E-02    1.85       1.5  T
   4    -43.9312129  0.155493E-05  0.116E-02    1.85       1.8  T
   5    -43.9312154 -0.250586E-05  0.233E-03    1.85       8.8  T
   6    -43.9312155 -0.901803E-07  0.105E-03    1.85      19.4  T
   7    -43.9312155 -0.393221E-08  0.596E-04    1.85      34.2  T
   8    -43.9312155 -0.201639E-08  0.161E-04    1.85     126.8  T
     SCC iter.                  ...        0 min,  0.010 sec
     gradient                   ...        0 min,  0.017 sec
 * total energy  :   -43.3854790 Eh     change        0.1667890E-05 Eh
   gradient norm :     0.0036960 Eh/α   predicted     0.0000000E+00 (-100.00%)
   displ. norm   :     0.0331852 α      lambda       -0.3212857E-04
   maximum displ.:     0.0236696 α      in ANC's #1, #3, #2, ...

........................................................................
.............................. CYCLE   22 ..............................
........................................................................
   1    -43.9326016 -0.439326E+02  0.204E-02    1.85       0.0  T
   2    -43.9326018 -0.131039E-06  0.110E-02    1.85       1.9  T
   3    -43.9326014  0.357334E-06  0.506E-03    1.85       4.0  T
   4    -43.9326018 -0.403947E-06  0.164E-03    1.85      12.4  T
   5    -43.9326018 -0.939834E-08  0.886E-04    1.85      23.0  T
   6    -43.9326018 -0.106901E-07  0.281E-04    1.85      72.6  T
     SCC iter.                  ...        0 min,  0.008 sec
     gradient                   ...        0 min,  0.017 sec
 * total energy  :   -43.3854990 Eh     change       -0.2001085E-04 Eh
   gradient norm :     0.0010079 Eh/α   predicted    -0.1608212E-04 ( -19.63%)
   displ. norm   :     0.0276865 α      lambda       -0.5401302E-05
   maximum displ.:     0.0191358 α      in ANC's #1, #3, #2, ...

........................................................................
.............................. CYCLE   23 ..............................
........................................................................
   1    -43.9331790 -0.439332E+02  0.208E-02    1.85       0.0  T
   2    -43.9331791 -0.142657E-06  0.109E-02    1.85       1.9  T
   3    -43.9331791  0.348076E-07  0.273E-03    1.85       7.5  T
   4    -43.9331791 -0.347882E-07  0.172E-03    1.85      11.9  T
   5    -43.9331792 -0.266018E-07  0.765E-04    1.85      26.7  T
   6    -43.9331792 -0.919717E-08  0.220E-04    1.85      92.8  T
     SCC iter.                  ...        0 min,  0.008 sec
     gradient                   ...        0 min,  0.017 sec
 * total energy  :   -43.3855021 Eh     change       -0.3144532E-05 Eh
   gradient norm :     0.0008924 Eh/α   predicted    -0.2711761E-05 ( -13.76%)
   displ. norm   :     0.0243667 α      lambda       -0.3511865E-05
   maximum displ.:     0.0178745 α      in ANC's #1, #3, #2, ...

   *** GEOMETRY OPTIMIZATION CONVERGED AFTER 23 ITERATIONS ***

------------------------------------------------------------------------
 total energy gain   :        -0.0114560 Eh       -7.1888 kcal/mol
 total RMSD          :         0.4511834 a0        0.2388 Å
 total power (kW/mol):        -1.3077281 (step)  -32.8924 (real)
------------------------------------------------------------------------

 ANCopt (total)                0 d,  0 h,  0 min,  0.914 sec
 optimizer setup                ...        0 min,  0.000 sec (  0.016%)
 model hessian                  ...        0 min,  0.006 sec (  0.645%)
 ANC generation                 ...        0 min,  0.001 sec (  0.136%)
 coordinate transformation      ...        0 min,  0.000 sec (  0.040%)
 single point calculation       ...        0 min,  0.899 sec ( 98.262%)
 optimization log               ...        0 min,  0.002 sec (  0.240%)
 hessian update                 ...        0 min,  0.000 sec (  0.034%)
 rational function              ...        0 min,  0.004 sec (  0.458%)

================
 final structure:
================
$coord
    1.75569174301774    2.92462425077096    0.34017639061945      C 
    4.52897445167768    1.25418068101270    0.18238818317473      S 
    3.01100003425490   -1.64866116755109   -0.10582652647648      C 
    0.40973121210835   -1.28377283611206   -0.06760473039646      C 
   -0.25569128447640    1.33292578789222    0.18471571400524      C 
   -3.49945920331601    1.84719432474532    0.24765367307645      S 
   -4.02719756116777   -1.41481104660871   -0.03270293150724      C 
   -6.68386826654073   -2.20305562970410   -0.06021980319242      C 
   -8.33770465050024   -0.62481995153438    0.05245361928628      O 
   -7.18701277928645   -5.00949170762675   -0.21642271314492      C 
  -10.00377385402028   -5.58542593755124   -0.15771559087938      C 
   -1.82766859620230   -2.76448058532076   -0.17608313984794      C 
   -1.81433370442678   -5.28854669401725   -0.39618522325397      F 
    4.61245310091245   -3.82795583511349   -0.33144699999404      C 
    3.92384563539478   -6.21680580050978   -0.72148379925382      C 
    1.77299994576051    4.93724481602254    0.53499564021798      H 
   -6.22394784369819   -5.93488159007025    1.35890067481086      H 
   -6.33566944095181   -5.72698212723823   -1.95617615587776      H 
  -10.83886887629821   -4.86497174825356    1.57526426355145      H 
  -10.32146846010643   -7.61198991388611   -0.26029100438406      H 
  -10.94751104858873   -4.67942007828447   -1.74116760295350      H 
    6.60255649335874   -3.37926499278769   -0.17562346241756      H 
    1.99415816758956   -6.80266901094199   -0.92027990854592      H 
    5.32807042959232   -7.67989700254350   -0.86579235855588      H 
$end
           -------------------------------------------------
          |                Final Singlepoint                |
           -------------------------------------------------

          ...................................................
          :                      SETUP                      :
          :.................................................:
          :  # basis functions                  81          :
          :  # atomic orbitals                  79          :
          :  # shells                           41          :
          :  # electrons                        78          :
          :  max. iterations                   250          :
          :  Hamiltonian                  GFN2-xTB          :
          :  restarted?                      false          :
          :  GBSA solvation                  false          :
          :  PC potential                    false          :
          :  electronic temp.          300.0000000     K    :
          :  accuracy                    1.0000000          :
          :  -> integral cutoff          0.2500000E+02      :
          :  -> integral neglect         0.1000000E-07      :
          :  -> SCF convergence          0.1000000E-05 Eh   :
          :  -> wf. convergence          0.1000000E-03 e    :
          :  Broyden damping             0.4000000          :
          ...................................................

 iter      E             dE          RMSdq      gap      omega  full diag
   1    -43.9331792 -0.439332E+02  0.139E-04    1.85       0.0  T
   2    -43.9331792 -0.400036E-11  0.503E-05    1.85     406.0  T
   3    -43.9331792  0.227942E-10  0.728E-05    1.85     280.2  T

   *** convergence criteria satisfied after 3 iterations ***

         #    Occupation            Energy/Eh            Energy/eV
      -------------------------------------------------------------
         1        2.0000           -0.8432803             -22.9468
       ...           ...                  ...                  ...
        33        2.0000           -0.4551341             -12.3848
        34        2.0000           -0.4495833             -12.2338
        35        2.0000           -0.4460524             -12.1377
        36        2.0000           -0.4223734             -11.4934
        37        2.0000           -0.4148132             -11.2876
        38        2.0000           -0.4028676             -10.9626
        39        2.0000           -0.3789504             -10.3118 (HOMO)
        40                         -0.3108149              -8.4577 (LUMO)
        41                         -0.2665424              -7.2530
        42                         -0.2330225              -6.3409
        43                         -0.2208670              -6.0101
        44                         -0.2193445              -5.9687
       ...                                ...                  ...
        79                          0.7164944              19.4968
      -------------------------------------------------------------
                  HL-Gap            0.0681354 Eh            1.8541 eV
             Fermi-level           -0.3448827 Eh           -9.3847 eV

 SCC (total)                   0 d,  0 h,  0 min,  0.034 sec
 SCC setup                      ...        0 min,  0.000 sec (  0.632%)
 Dispersion                     ...        0 min,  0.000 sec (  0.611%)
 integral evaluation            ...        0 min,  0.012 sec ( 34.187%)
 zeroth order Hamiltonian       ...        0 min,  0.000 sec (  0.564%)
 iterations                     ...        0 min,  0.005 sec ( 13.581%)
 molecular gradient             ...        0 min,  0.017 sec ( 49.276%)
 printout                       ...        0 min,  0.000 sec (  1.015%)

         :::::::::::::::::::::::::::::::::::::::::::::::::::::
         ::                     SUMMARY                     ::
         :::::::::::::::::::::::::::::::::::::::::::::::::::::
         :: total energy             -43.385502159501 Eh    ::
         :: gradient norm              0.000892301895 Eh/a0 ::
         :: HOMO-LUMO gap              1.854059899601 eV    ::
         ::.................................................::
         :: SCC energy               -43.933179178345 Eh    ::
         :: -> isotropic ES            0.036793377906 Eh    ::
         :: -> anisotropic ES          0.002108843240 Eh    ::
         :: -> anisotropic XC          0.011083347651 Eh    ::
         :: -> dispersion             -0.026685352071 Eh    ::
         :: repulsion energy           0.547709642603 Eh    ::
         :: add. restraining           0.000000000000 Eh    ::
         :::::::::::::::::::::::::::::::::::::::::::::::::::::

           -------------------------------------------------
          |                Property Printout                |
           -------------------------------------------------

    * Orbital Energies and Occupations

         #    Occupation            Energy/Eh            Energy/eV
      -------------------------------------------------------------
         1        2.0000           -0.8432803             -22.9468
       ...           ...                  ...                  ...
        27        2.0000           -0.4875254             -13.2662
        28        2.0000           -0.4774384             -12.9918
        29        2.0000           -0.4716178             -12.8334
        30        2.0000           -0.4708388             -12.8122
        31        2.0000           -0.4659273             -12.6785
        32        2.0000           -0.4573567             -12.4453
        33        2.0000           -0.4551341             -12.3848
        34        2.0000           -0.4495833             -12.2338
        35        2.0000           -0.4460524             -12.1377
        36        2.0000           -0.4223734             -11.4934
        37        2.0000           -0.4148132             -11.2876
        38        2.0000           -0.4028676             -10.9626
        39        2.0000           -0.3789504             -10.3118 (HOMO)
        40                         -0.3108149              -8.4577 (LUMO)
        41                         -0.2665424              -7.2530
        42                         -0.2330225              -6.3409
        43                         -0.2208670              -6.0101
        44                         -0.2193445              -5.9687
        45                         -0.1951290              -5.3097
        46                         -0.1500333              -4.0826
        47                         -0.1480441              -4.0285
        48                         -0.1265062              -3.4424
        49                         -0.0262545              -0.7144
        50                         -0.0170784              -0.4647
       ...                                ...                  ...
        79                          0.7164944              19.4968
      -------------------------------------------------------------
                  HL-Gap            0.0681354 Eh            1.8541 eV
             Fermi-level           -0.3448827 Eh           -9.3847 eV

     #   Z        covCN         q      C6AA      α(0)
     1   6 C      2.932    -0.038    28.955     8.825
     2  16 S      2.398     0.026   140.000    19.914
     3   6 C      2.975     0.025    27.451     8.594
     4   6 C      3.269    -0.029    27.397     8.442
     5   6 C      3.226     0.016    26.877     8.423
     6  16 S      2.231    -0.004   141.203    20.000
     7   6 C      2.976    -0.028    28.696     8.787
     8   6 C      2.861     0.233    23.122     7.882
     9   8 O      0.859    -0.356    20.825     6.118
    10   6 C      3.803    -0.076    21.952     6.670
    11   6 C      3.753    -0.101    22.483     6.761
    12   6 C      2.916     0.157    24.614     8.136
    13   9 F      0.786    -0.211    11.349     3.979
    14   6 C      2.946    -0.029    28.712     8.788
    15   6 C      2.838    -0.084    30.095     8.990
    16   1 H      0.927     0.063     2.158     2.297
    17   1 H      0.924     0.063     2.164     2.300
    18   1 H      0.924     0.064     2.152     2.294
    19   1 H      0.925     0.051     2.310     2.377
    20   1 H      0.925     0.039     2.464     2.455
    21   1 H      0.925     0.051     2.304     2.373
    22   1 H      0.925     0.049     2.335     2.390
    23   1 H      0.926     0.069     2.101     2.266
    24   1 H      0.926     0.050     2.314     2.379

 Mol. C6AA /au·bohr⁶  :      10260.899057
 Mol. C8AA /au·bohr⁸  :     301879.688653
 Mol. α(0) /au        :        161.441894


Wiberg/Mayer (AO) data.
largest (>0.10) Wiberg bond orders for each atom
          total WBO             WBO to atom ...
     1  C   3.946        C    5 1.542    S    2 1.199    H   16 0.967    C    3 0.108
     2  S   2.668        C    1 1.199    C    3 1.172
     3  C   3.939        C    4 1.381    S    2 1.172    C   14 1.152    C    1 0.108
     4  C   3.979        C    3 1.381    C   12 1.188    C    5 1.173
     5  C   3.960        C    1 1.542    C    4 1.173    S    6 1.095
     6  S   2.520        C    5 1.095    C    7 1.091
     7  C   3.951        C   12 1.516    S    6 1.091    C    8 1.065
     8  C   3.931        O    9 1.797    C    7 1.065    C   10 0.987
     9  O   2.060        C    8 1.797
    10  C   3.996        C   11 1.019    C    8 0.987    H   17 0.951    H   18 0.949
    11  C   3.993        C   10 1.019    H   20 0.987    H   19 0.986    H   21 0.986
    12  C   3.881        C    7 1.516    C    4 1.188    F   13 0.963
    13  F   1.116        C   12 0.963
    14  C   3.989        C   15 1.837    C    3 1.152    H   22 0.961
    15  C   3.969        C   14 1.837    H   24 0.977    H   23 0.971
    16  H   0.995        C    1 0.967
    17  H   0.995        C   10 0.951
    18  H   0.995        C   10 0.949
    19  H   0.997        C   11 0.986
    20  H   0.998        C   11 0.987
    21  H   0.997        C   11 0.986
    22  H   0.997        C   14 0.961
    23  H   0.995        C   15 0.971
    24  H   0.997        C   15 0.977

molecular dipole:
                 x           y           z       tot (Debye)
 q only:        1.363      -0.290      -0.021
   full:        1.307      -0.552      -0.045       3.608
molecular quadrupole (traceless):
                xx          xy          yy          xz          yz          zz
 q only:       -7.543       5.568       6.574       0.395       0.509       0.970
  q+dip:      -10.977       7.223       8.503       0.713       0.680       2.474
   full:      -12.470       7.246       7.881       0.636       0.348       4.589

           -------------------------------------------------
          |                Geometry Summary                 |
           -------------------------------------------------

      molecular mass/u    :      240.3099000
   center of mass at/Å    :       -0.7916608      -0.7966152      -0.0253682
  moments of inertia/u·Å² :        0.5556884E+03   0.1559329E+04   0.2108125E+04
rotational constants/cm⁻¹ :        0.3033648E-01   0.1081083E-01   0.7996504E-02

 * 23 selected distances

     #   Z        #   Z                                     value/Å
     1   6 C      2  16 S                                 1.7152508
     2  16 S      3   6 C                                 1.7401650
     3   6 C      4   6 C                                 1.3901562
     1   6 C      5   6 C                                 1.3598243
     4   6 C      5   6 C                                 1.4349941
     5   6 C      6  16 S                                 1.7382860
     6  16 S      7   6 C                                 1.7549058 (max)
     8   6 C      9   8 O                                 1.2111916
    10   6 C     11   6 C                                 1.5217219
     4   6 C     12   6 C                                 1.4209391
     7   6 C     12   6 C                                 1.3677050
    12   6 C     13   9 F                                 1.3407656
     3   6 C     14   6 C                                 1.4360980
    14   6 C     15   6 C                                 1.3316894
     1   6 C     16   1 H                                 1.0700503 (min)
    10   6 C     17   1 H                                 1.0929124
    10   6 C     18   1 H                                 1.0930194
    11   6 C     19   1 H                                 1.0870256
    11   6 C     20   1 H                                 1.0868653
    11   6 C     21   1 H                                 1.0869160
    14   6 C     22   1 H                                 1.0826967
    15   6 C     23   1 H                                 1.0723447
    15   6 C     24   1 H                                 1.0758459

 * 5 distinct bonds (by element types)

   Z      Z             #   av. dist./Å        max./Å        min./Å
   1 H    6 C           9     1.0830751     1.0930194     1.0700503
   6 C    6 C           8     1.4078910     1.5217219     1.3316894
   6 C    8 O           1     1.2111916     1.2111916     1.2111916
   6 C    9 F           1     1.3407656     1.3407656     1.3407656
   6 C   16 S           4     1.7371519     1.7549058     1.7152508


optimized geometry written to: xtbopt.xyz


           -------------------------------------------------
          | TOTAL ENERGY              -43.385502159501 Eh   |
          | GRADIENT NORM               0.000892301895 Eh/α |
          | HOMO-LUMO GAP               1.854059899601 eV   |
           -------------------------------------------------

------------------------------------------------------------------------
 * finished run on 2021/05/19 at 11:01:04.115     
------------------------------------------------------------------------
 total:
 * wall-time:     0 d,  0 h,  0 min,  1.047 sec
 *  cpu-time:     0 d,  0 h,  0 min,  0.983 sec
 * ratio c/w:     0.940 speedup
 SCF:
 * wall-time:     0 d,  0 h,  0 min,  0.062 sec
 *  cpu-time:     0 d,  0 h,  0 min,  0.049 sec
 * ratio c/w:     0.792 speedup
 ANC optimizer:
 * wall-time:     0 d,  0 h,  0 min,  0.949 sec
 *  cpu-time:     0 d,  0 h,  0 min,  0.911 sec
 * ratio c/w:     0.960 speedup

