      -----------------------------------------------------------      
     |                   =====================                   |     
     |                           x T B                           |     
     |                   =====================                   |     
     |                         S. Grimme                         |     
     |          Mulliken Center for Theoretical Chemistry        |     
     |                    University of Bonn                     |     
     |                Version 6.2 RC2 (SAW190805)                |     
      -----------------------------------------------------------      

   This program is distributed in the hope that it will be useful,
   but WITHOUT ANY WARRANTY; without even the implied warranty of
   MERCHANTABILITY or FITNESS FOR A PARTICULAR PURPOSE.
   
   FOR NON-COMMERCIAL, ACADEMIA USE ONLY.
   
   Cite this work as:
   * S. Grimme, C. Bannwarth, P. Shushkov, J. Chem. Theory Comput., 2017,
     13, 1989-2009. DOI: 10.1021/acs.jctc.7b00118
   * C. Bannwarth, S. Ehlert and S. Grimme., J. Chem. Theory Comput., 2019,
     15, 1652-1671. DOI: 10.1021/acs.jctc.8b01176
   * P. Pracht, E. Caldeweyher, S. Ehlert, S. Grimme, ChemRxiv, 2019, preprint.
     DOI: 10.26434/chemrxiv.8326202.v1
   
   for DFT-D4:
   * E. Caldeweyher, C. Bannwarth and S. Grimme, J. Chem. Phys., 2017,
     147, 034112. DOI: 10.1063/1.4993215
   * E. Caldeweyher, S. Ehlert, A. Hansen, H. Neugebauer, S. Spicher,
     C. Bannwarth and S. Grimme, J. Chem. Phys., 2019, 150, 154122.
     DOI: 10.1063/1.5090222
   
   for sTDA-xTB:
   * S. Grimme and C. Bannwarth, J. Chem. Phys., 2016, 145, 054103.
     DOI: 10.1063/1.4959605
   
   in the mass-spec context:
   * V. Asgeirsson, C. Bauer and S. Grimme, Chem. Sci., 2017, 8, 4879.
     DOI: 10.1039/c7sc00601b
   
   for metadynamics refer to:
   * S. Grimme, J. Chem. Theory Comput., 2019, 155, 2847-2862
     DOI: 10.1021/acs.jctc.9b00143
   
   with help from (in alphabetical order)
   C. Bannwarth, F. Bohle, G. Brandenburg, E. Caldeweyher, M. Checinski,
   S. Dohm, S. Ehlert, S. Ehrlich, F. März, H. Neugebauer, J. Pisarek,
   P. Pracht, P. Shushkov, and S. Spicher.
   
 * started run on 2021/05/19 at 11:01:04.522     

           -------------------------------------------------
          |                Calculation Setup                |
           -------------------------------------------------

          program call               : /ihome/ghutchison/geoffh/xtb/xtb 973.xyz -opt
          hostname                   : smp-n122
          coordinate file            : 973.xyz
          omp threads                :                     1
          number of atoms            :                    27
          number of electrons        :                    80
          charge                     :                     0
          spin                       :                   0.0
          first test random number   :      0.21008845598321


########################################################################
# WARNING! Please study the warnings concerning your input carefully
#  - the use of '-opt' is discouraged, please use '--opt' next time
########################################################################

           ------------------------------------------------- 
          |                 G F N 2 - x T B                 |
          | Geometry, Frequencies, Noncovalent interactions |
          |            JCTC 2019 parametrisation            |
           ------------------------------------------------- 
             KAB for C  - Si     :                1.0500
             KAB for H  - Pd     :                0.9500
             k(s)              :                1.8500
             k(p)              :                2.2300
             k(d)              :                2.2300
             k(f)              :                2.0000
             kEN (H0ij)        :               -2.0000
             D4 a1             :                0.5200
             D4 a2             :                5.0000
             D4 s6             :                1.0000
             D4 s8             :                2.7000
             D4 s9             :                5.0000
             alphaj            :                2.0000

  Z AO/shell   Hii/eV     exponent
  1     Wed Apr 25 08:07:45 CEST 2018   EN: 2.200 GM2: 0.406  GM3: 0.0800  RAES: 1.40
     1s    -10.707211    1.230000
  6     Wed Apr 25 08:07:45 CEST 2018   EN: 2.550 GM2: 0.538  GM3: 0.1500  RAES: 3.00
     2s    -13.970922    2.096432
     2p    -10.063292    1.800000
  7     Wed Apr 25 08:07:45 CEST 2018   EN: 3.040 GM2: 0.461  GM3:-0.0640  RAES: 1.90
     2s    -16.686243    2.339881
     2p    -12.523956    2.014332
  8     Wed Apr 25 08:07:45 CEST 2018   EN: 3.440 GM2: 0.452  GM3:-0.0517  RAES: 1.80
     2s    -20.229985    2.439742
     2p    -15.503117    2.137023
 16     Tue Apr 24 11:44:34 CEST 2018   EN: 2.580 GM2: 0.340  GM3:-0.0502  RAES: 3.10
     3s    -20.029654    1.981333
     3p    -11.377694    2.025643
     3d     -0.420282    1.702555

           ------------------------------------------------- 
          |        Self-Consistent Charge Iterations        |
           ------------------------------------------------- 

          ...................................................
          :                      SETUP                      :
          :.................................................:
          :  # basis functions                  78          :
          :  # atomic orbitals                  77          :
          :  # shells                           43          :
          :  # electrons                        80          :
          :  max. iterations                   250          :
          :  Hamiltonian                  GFN2-xTB          :
          :  restarted?                      false          :
          :  GBSA solvation                  false          :
          :  PC potential                    false          :
          :  electronic temp.          300.0000000     K    :
          :  accuracy                    1.0000000          :
          :  -> integral cutoff          0.2500000E+02      :
          :  -> integral neglect         0.1000000E-07      :
          :  -> SCF convergence          0.1000000E-05 Eh   :
          :  -> wf. convergence          0.1000000E-03 e    :
          :  Broyden damping             0.4000000          :
          ...................................................

 iter      E             dE          RMSdq      gap      omega  full diag
   1    -44.9864345 -0.449864E+02  0.473E+00    2.72       0.0  T
   2    -45.1340465 -0.147612E+00  0.228E+00    2.37       1.0  T
   3    -45.1357350 -0.168853E-02  0.119E+00    1.93       1.0  T
   4    -45.1326847  0.305029E-02  0.447E-01    1.64       1.0  T
   5    -45.1370774 -0.439273E-02  0.133E-01    1.56       1.0  T
   6    -45.1372292 -0.151795E-03  0.528E-02    1.61       1.0  T
   7    -45.1372504 -0.211333E-04  0.222E-02    1.61       1.0  T
   8    -45.1372522 -0.180234E-05  0.143E-02    1.61       1.3  T
   9    -45.1372542 -0.197550E-05  0.442E-03    1.61       4.4  T
  10    -45.1372543 -0.161666E-06  0.171E-03    1.61      11.3  T
  11    -45.1372543 -0.176214E-07  0.857E-04    1.61      22.4  T
  12    -45.1372543 -0.294503E-08  0.273E-04    1.61      70.4  T

   *** convergence criteria satisfied after 12 iterations ***

         #    Occupation            Energy/Eh            Energy/eV
      -------------------------------------------------------------
         1        2.0000           -0.7693226             -20.9343
       ...           ...                  ...                  ...
        34        2.0000           -0.4537037             -12.3459
        35        2.0000           -0.4473605             -12.1733
        36        2.0000           -0.4401967             -11.9784
        37        2.0000           -0.4327850             -11.7767
        38        2.0000           -0.4010333             -10.9127
        39        2.0000           -0.3939298             -10.7194
        40        2.0000           -0.3808360             -10.3631 (HOMO)
        41                         -0.3215390              -8.7495 (LUMO)
        42                         -0.2675344              -7.2800
        43                         -0.2116987              -5.7606
        44                         -0.2019273              -5.4947
        45                         -0.1673619              -4.5541
       ...                                ...                  ...
        77                          0.6575081              17.8917
      -------------------------------------------------------------
                  HL-Gap            0.0592970 Eh            1.6136 eV
             Fermi-level           -0.3511875 Eh           -9.5563 eV

 SCC (total)                   0 d,  0 h,  0 min,  0.069 sec
 SCC setup                      ...        0 min,  0.000 sec (  0.501%)
 Dispersion                     ...        0 min,  0.000 sec (  0.590%)
 integral evaluation            ...        0 min,  0.024 sec ( 35.195%)
 zeroth order Hamiltonian       ...        0 min,  0.000 sec (  0.340%)
 iterations                     ...        0 min,  0.026 sec ( 37.815%)
 molecular gradient             ...        0 min,  0.017 sec ( 24.907%)
 printout                       ...        0 min,  0.000 sec (  0.566%)

         :::::::::::::::::::::::::::::::::::::::::::::::::::::
         ::                     SUMMARY                     ::
         :::::::::::::::::::::::::::::::::::::::::::::::::::::
         :: total energy             -44.626565492822 Eh    ::
         :: gradient norm              0.084991777031 Eh/a0 ::
         :: HOMO-LUMO gap              1.613553985568 eV    ::
         ::.................................................::
         :: SCC energy               -45.137254335372 Eh    ::
         :: -> isotropic ES            0.058198893757 Eh    ::
         :: -> anisotropic ES          0.011138111263 Eh    ::
         :: -> anisotropic XC          0.017238626258 Eh    ::
         :: -> dispersion             -0.029439610058 Eh    ::
         :: repulsion energy           0.510291776105 Eh    ::
         :: add. restraining           0.000000000000 Eh    ::
         :::::::::::::::::::::::::::::::::::::::::::::::::::::

      ----------------------------------------------------------- 
     |                   =====================                   |
     |                        A N C O P T                        |
     |                   =====================                   |
     |               Approximate Normal Coordinate               |
     |                Rational Function Optimizer                |
      ----------------------------------------------------------- 

          ...................................................
          :                      SETUP                      :
          :.................................................:
          :   optimization level            normal          :
          :   max. optcycles                   200          :
          :   ANC micro-cycles                  20          :
          :   degrees of freedom                75          :
          :.................................................:
          :   RF solver                   davidson          :
          :   input Hessian                  false          :
          :   write xtbopt.log                true          :
          :   linear?                        false          :
          :   energy convergence         0.5000000E-05 Eh   :
          :   grad. convergence          0.1000000E-02 Eh/α :
          :   maximium RF displ.         2.0000000          :
          :   Hlow (freq-cutoff)         0.5000000E-02      :
          :   Hmax (freq-cutoff)         5.0000000          :
          :   S6 in model hess.         20.0000000          :
          ...................................................

generating ANC from model Hessian ...
Using Lindh-Hessian (1995)
 Shifting diagonal of input Hessian by   3.971550689243529E-003
 Lowest  eigenvalues of input Hessian
   -0.000000    0.000000    0.000000    0.000000    0.000000    0.000000
    0.005000    0.006468    0.007622    0.008808    0.009473    0.011918
    0.012934    0.015320    0.017054    0.017965    0.021046    0.024379
 Highest eigenvalues
    1.624054    1.774959    1.823336    1.835850    1.975340    2.394399
 

........................................................................
.............................. CYCLE    1 ..............................
........................................................................
   1    -45.1372543 -0.451373E+02  0.155E-04    1.61       0.0  T
   2    -45.1372543 -0.938627E-11  0.144E-04    1.61     134.0  T
   3    -45.1372543 -0.344770E-09  0.592E-05    1.61     325.2  T
     SCC iter.                  ...        0 min,  0.005 sec
     gradient                   ...        0 min,  0.017 sec
 * total energy  :   -44.6265655 Eh     change       -0.3555883E-07 Eh
   gradient norm :     0.0849911 Eh/α   predicted     0.0000000E+00 (-100.00%)
   displ. norm   :     0.2557391 α      lambda       -0.1012921E-01
   maximum displ.:     0.0969894 α      in ANC's #3, #29, #13, ...

........................................................................
.............................. CYCLE    2 ..............................
........................................................................
   1    -45.1690139 -0.451690E+02  0.260E-01    1.97       0.0  T
   2    -45.1693468 -0.332973E-03  0.129E-01    1.91       1.0  T
   3    -45.1693419  0.489839E-05  0.724E-02    1.91       1.0  T
   4    -45.1693819 -0.399796E-04  0.405E-02    1.90       1.0  T
   5    -45.1694038 -0.218574E-04  0.113E-02    1.90       1.7  T
   6    -45.1694045 -0.730900E-06  0.579E-03    1.89       3.3  T
   7    -45.1694049 -0.348922E-06  0.217E-03    1.89       8.8  T
     SCC iter.                  ...        0 min,  0.009 sec
     gradient                   ...        0 min,  0.016 sec
 * total energy  :   -44.6333218 Eh     change       -0.6756265E-02 Eh
   gradient norm :     0.0308185 Eh/α   predicted    -0.5395845E-02 ( -20.14%)
   displ. norm   :     0.2551382 α      lambda       -0.2809650E-02
   maximum displ.:     0.1601387 α      in ANC's #3, #4, #13, ...

........................................................................
.............................. CYCLE    3 ..............................
........................................................................
   1    -45.1827528 -0.451828E+02  0.218E-01    2.09       0.0  T
   2    -45.1828612 -0.108329E-03  0.118E-01    2.06       1.0  T
   3    -45.1828352  0.259147E-04  0.579E-02    2.06       1.0  T
   4    -45.1828703 -0.350705E-04  0.268E-02    2.05       1.0  T
   5    -45.1828820 -0.116983E-04  0.750E-03    2.05       2.6  T
   6    -45.1828824 -0.357963E-06  0.367E-03    2.05       5.2  T
   7    -45.1828825 -0.141296E-06  0.155E-03    2.05      12.4  T
     SCC iter.                  ...        0 min,  0.009 sec
     gradient                   ...        0 min,  0.016 sec
 * total energy  :   -44.6345977 Eh     change       -0.1275897E-02 Eh
   gradient norm :     0.0165852 Eh/α   predicted    -0.1496306E-02 (  17.27%)
   displ. norm   :     0.2896220 α      lambda       -0.1636781E-02
   maximum displ.:     0.1640960 α      in ANC's #3, #4, #8, ...

........................................................................
.............................. CYCLE    4 ..............................
........................................................................
   1    -45.1843938 -0.451844E+02  0.271E-01    2.03       0.0  T
   2    -45.1844455 -0.517090E-04  0.158E-01    2.06       1.0  T
   3    -45.1843978  0.477723E-04  0.541E-02    2.07       1.0  T
   4    -45.1844606 -0.628699E-04  0.160E-02    2.06       1.2  T
   5    -45.1844641 -0.348681E-05  0.744E-03    2.06       2.6  T
   6    -45.1844644 -0.326833E-06  0.344E-03    2.06       5.6  T
   7    -45.1844646 -0.107138E-06  0.160E-03    2.06      12.1  T
   8    -45.1844646 -0.283487E-07  0.632E-04    2.06      30.4  T
     SCC iter.                  ...        0 min,  0.010 sec
     gradient                   ...        0 min,  0.016 sec
 * total energy  :   -44.6351477 Eh     change       -0.5500292E-03 Eh
   gradient norm :     0.0177793 Eh/α   predicted    -0.8870498E-03 (  61.27%)
   displ. norm   :     0.1568424 α      lambda       -0.7452811E-03
   maximum displ.:     0.0998476 α      in ANC's #3, #4, #9, ...

........................................................................
.............................. CYCLE    5 ..............................
........................................................................
   1    -45.1806802 -0.451807E+02  0.134E-01    2.00       0.0  T
   2    -45.1806975 -0.173367E-04  0.769E-02    2.01       1.0  T
   3    -45.1806888  0.874088E-05  0.288E-02    2.02       1.0  T
   4    -45.1807009 -0.121168E-04  0.959E-03    2.02       2.0  T
   5    -45.1807023 -0.142364E-05  0.390E-03    2.02       4.9  T
   6    -45.1807024 -0.140369E-06  0.175E-03    2.02      11.0  T
   7    -45.1807025 -0.137458E-07  0.861E-04    2.02      22.4  T
     SCC iter.                  ...        0 min,  0.009 sec
     gradient                   ...        0 min,  0.016 sec
 * total energy  :   -44.6356709 Eh     change       -0.5231892E-03 Eh
   gradient norm :     0.0069961 Eh/α   predicted    -0.3818136E-03 ( -27.02%)
   displ. norm   :     0.2407671 α      lambda       -0.4646126E-03
   maximum displ.:     0.1623800 α      in ANC's #3, #4, #9, ...

........................................................................
.............................. CYCLE    6 ..............................
........................................................................
   1    -45.1781218 -0.451781E+02  0.184E-01    1.97       0.0  T
   2    -45.1781386 -0.167916E-04  0.105E-01    1.98       1.0  T
   3    -45.1781282  0.104065E-04  0.297E-02    1.99       1.0  T
   4    -45.1781439 -0.156977E-04  0.996E-03    1.99       1.9  T
   5    -45.1781449 -0.954764E-06  0.469E-03    1.99       4.1  T
   6    -45.1781451 -0.224358E-06  0.166E-03    1.99      11.6  T
   7    -45.1781451 -0.138148E-07  0.888E-04    1.99      21.7  T
     SCC iter.                  ...        0 min,  0.009 sec
     gradient                   ...        0 min,  0.016 sec
 * total energy  :   -44.6359657 Eh     change       -0.2947528E-03 Eh
   gradient norm :     0.0091830 Eh/α   predicted    -0.2457785E-03 ( -16.62%)
   displ. norm   :     0.2069834 α      lambda       -0.2683357E-03
   maximum displ.:     0.1347535 α      in ANC's #3, #4, #10, ...

........................................................................
.............................. CYCLE    7 ..............................
........................................................................
   1    -45.1781501 -0.451782E+02  0.153E-01    1.98       0.0  T
   2    -45.1781562 -0.617199E-05  0.874E-02    1.98       1.0  T
   3    -45.1781530  0.328072E-05  0.177E-02    1.99       1.1  T
   4    -45.1781590 -0.601970E-05  0.675E-03    1.99       2.9  T
   5    -45.1781592 -0.261611E-06  0.279E-03    1.99       6.9  T
   6    -45.1781593 -0.954478E-07  0.981E-04    1.99      19.6  T
     SCC iter.                  ...        0 min,  0.008 sec
     gradient                   ...        0 min,  0.016 sec
 * total energy  :   -44.6361490 Eh     change       -0.1833544E-03 Eh
   gradient norm :     0.0103364 Eh/α   predicted    -0.1399165E-03 ( -23.69%)
   displ. norm   :     0.2255105 α      lambda       -0.2819059E-03
   maximum displ.:     0.1492475 α      in ANC's #3, #4, #10, ...

........................................................................
.............................. CYCLE    8 ..............................
........................................................................
   1    -45.1798989 -0.451799E+02  0.167E-01    2.01       0.0  T
   2    -45.1799077 -0.883973E-05  0.952E-02    2.01       1.0  T
   3    -45.1799032  0.449552E-05  0.216E-02    2.01       1.0  T
   4    -45.1799108 -0.761612E-05  0.817E-03    2.01       2.4  T
   5    -45.1799114 -0.598664E-06  0.367E-03    2.01       5.2  T
   6    -45.1799115 -0.109273E-06  0.122E-03    2.01      15.8  T
   7    -45.1799116 -0.651853E-08  0.662E-04    2.01      29.1  T
     SCC iter.                  ...        0 min,  0.009 sec
     gradient                   ...        0 min,  0.016 sec
 * total energy  :   -44.6363495 Eh     change       -0.2004804E-03 Eh
   gradient norm :     0.0080948 Eh/α   predicted    -0.1481233E-03 ( -26.12%)
   displ. norm   :     0.2118832 α      lambda       -0.2273872E-03
   maximum displ.:     0.1178875 α      in ANC's #3, #10, #4, ...

........................................................................
.............................. CYCLE    9 ..............................
........................................................................
   1    -45.1819850 -0.451820E+02  0.185E-01    2.00       0.0  T
   2    -45.1819951 -0.100592E-04  0.106E-01    2.00       1.0  T
   3    -45.1819928  0.230689E-05  0.199E-02    2.00       1.0  T
   4    -45.1819996 -0.679450E-05  0.727E-03    2.00       2.6  T
   5    -45.1819999 -0.345972E-06  0.389E-03    2.00       5.0  T
   6    -45.1820001 -0.133822E-06  0.121E-03    2.00      15.9  T
   7    -45.1820001 -0.609263E-08  0.653E-04    2.00      29.5  T
     SCC iter.                  ...        0 min,  0.009 sec
     gradient                   ...        0 min,  0.016 sec
 * total energy  :   -44.6365166 Eh     change       -0.1671048E-03 Eh
   gradient norm :     0.0083510 Eh/α   predicted    -0.1187999E-03 ( -28.91%)
   displ. norm   :     0.2276031 α      lambda       -0.2697500E-03
   maximum displ.:     0.1213746 α      in ANC's #10, #4, #3, ...

........................................................................
.............................. CYCLE   10 ..............................
........................................................................
   1    -45.1845747 -0.451846E+02  0.204E-01    2.06       0.0  T
   2    -45.1845942 -0.195834E-04  0.116E-01    2.04       1.0  T
   3    -45.1845894  0.479981E-05  0.239E-02    2.03       1.0  T
   4    -45.1845995 -0.100683E-04  0.864E-03    2.04       2.2  T
   5    -45.1846005 -0.100187E-05  0.389E-03    2.04       4.9  T
   6    -45.1846006 -0.769172E-07  0.180E-03    2.04      10.7  T
   7    -45.1846006 -0.179510E-07  0.885E-04    2.04      21.7  T
     SCC iter.                  ...        0 min,  0.009 sec
     gradient                   ...        0 min,  0.016 sec
 * total energy  :   -44.6366805 Eh     change       -0.1638957E-03 Eh
   gradient norm :     0.0039246 Eh/α   predicted    -0.1418686E-03 ( -13.44%)
   displ. norm   :     0.4191957 α      lambda       -0.3292194E-03
   maximum displ.:     0.2611201 α      in ANC's #10, #4, #3, ...

........................................................................
.............................. CYCLE   11 ..............................
........................................................................
   1    -45.1783796 -0.451784E+02  0.422E-01    1.86       0.0  T
   2    -45.1784944 -0.114780E-03  0.242E-01    1.90       1.0  T
   3    -45.1784955 -0.106925E-05  0.407E-02    1.91       1.0  T
   4    -45.1785130 -0.175253E-04  0.201E-02    1.91       1.0  T
   5    -45.1785205 -0.746707E-05  0.804E-03    1.91       2.4  T
   6    -45.1785206 -0.155250E-06  0.431E-03    1.91       4.5  T
   7    -45.1785208 -0.164635E-06  0.148E-03    1.91      13.0  T
   8    -45.1785208 -0.152111E-07  0.824E-04    1.91      23.4  T
   9    -45.1785208 -0.677536E-08  0.202E-04    1.91      95.4  T
     SCC iter.                  ...        0 min,  0.011 sec
     gradient                   ...        0 min,  0.017 sec
 * total energy  :   -44.6365034 Eh     change        0.1771202E-03 Eh
   gradient norm :     0.0233454 Eh/α   predicted    -0.1935387E-03 (-209.27%)
   displ. norm   :     0.2424785 α      lambda       -0.8372260E-03
   maximum displ.:     0.1293061 α      in ANC's #3, #10, #4, ...

........................................................................
.............................. CYCLE   12 ..............................
........................................................................
   1    -45.1837350 -0.451837E+02  0.226E-01    2.08       0.0  T
   2    -45.1838033 -0.683426E-04  0.128E-01    2.04       1.0  T
   3    -45.1838030  0.316504E-06  0.308E-02    2.03       1.0  T
   4    -45.1838063 -0.334574E-05  0.148E-02    2.03       1.3  T
   5    -45.1838114 -0.506290E-05  0.454E-03    2.03       4.2  T
   6    -45.1838115 -0.573971E-07  0.270E-03    2.03       7.1  T
     SCC iter.                  ...        0 min,  0.008 sec
     gradient                   ...        0 min,  0.016 sec
 * total energy  :   -44.6368215 Eh     change       -0.3180746E-03 Eh
   gradient norm :     0.0051856 Eh/α   predicted    -0.4432265E-03 (  39.35%)
   displ. norm   :     0.0698569 α      lambda       -0.8528076E-04
   maximum displ.:     0.0362109 α      in ANC's #2, #5, #6, ...

........................................................................
.............................. CYCLE   13 ..............................
........................................................................
   1    -45.1823007 -0.451823E+02  0.554E-02    2.03       0.0  T
   2    -45.1823059 -0.523824E-05  0.327E-02    2.03       1.0  T
   3    -45.1823050  0.902534E-06  0.164E-02    2.03       1.2  T
   4    -45.1823075 -0.245779E-05  0.464E-03    2.03       4.1  T
   5    -45.1823079 -0.431363E-06  0.140E-03    2.02      13.8  T
   6    -45.1823079 -0.322088E-08  0.725E-04    2.03      26.5  T
     SCC iter.                  ...        0 min,  0.008 sec
     gradient                   ...        0 min,  0.016 sec
 * total energy  :   -44.6368606 Eh     change       -0.3913301E-04 Eh
   gradient norm :     0.0031852 Eh/α   predicted    -0.4284945E-04 (   9.50%)
   displ. norm   :     0.1051620 α      lambda       -0.7080944E-04
   maximum displ.:     0.0697058 α      in ANC's #10, #4, #2, ...

........................................................................
.............................. CYCLE   14 ..............................
........................................................................
   1    -45.1816905 -0.451817E+02  0.109E-01    2.00       0.0  T
   2    -45.1816950 -0.443622E-05  0.631E-02    2.01       1.0  T
   3    -45.1816945  0.478206E-06  0.108E-02    2.01       1.8  T
   4    -45.1816965 -0.205961E-05  0.429E-03    2.01       4.5  T
   5    -45.1816968 -0.223677E-06  0.202E-03    2.01       9.5  T
   6    -45.1816968 -0.142158E-07  0.103E-03    2.01      18.6  T
   7    -45.1816968 -0.663274E-08  0.330E-04    2.01      58.3  T
   8    -45.1816968 -0.187349E-08  0.119E-04    2.01     161.6  T
     SCC iter.                  ...        0 min,  0.010 sec
     gradient                   ...        0 min,  0.017 sec
 * total energy  :   -44.6369104 Eh     change       -0.4981440E-04 Eh
   gradient norm :     0.0036102 Eh/α   predicted    -0.3579662E-04 ( -28.14%)
   displ. norm   :     0.1226290 α      lambda       -0.5362926E-04
   maximum displ.:     0.0642448 α      in ANC's #10, #2, #4, ...

........................................................................
.............................. CYCLE   15 ..............................
........................................................................
   1    -45.1807032 -0.451807E+02  0.118E-01    2.00       0.0  T
   2    -45.1807097 -0.649304E-05  0.685E-02    2.01       1.0  T
   3    -45.1807077  0.195917E-05  0.164E-02    2.00       1.2  T
   4    -45.1807120 -0.435412E-05  0.418E-03    2.01       4.6  T
   5    -45.1807122 -0.138643E-06  0.251E-03    2.01       7.7  T
   6    -45.1807122 -0.436097E-07  0.664E-04    2.01      29.0  T
   7    -45.1807122 -0.220257E-08  0.304E-04    2.01      63.2  T
     SCC iter.                  ...        0 min,  0.009 sec
     gradient                   ...        0 min,  0.017 sec
 * total energy  :   -44.6369392 Eh     change       -0.2883214E-04 Eh
   gradient norm :     0.0047460 Eh/α   predicted    -0.2722477E-04 (  -5.57%)
   displ. norm   :     0.0615743 α      lambda       -0.4074672E-04
   maximum displ.:     0.0311697 α      in ANC's #9, #3, #2, ...

........................................................................
.............................. CYCLE   16 ..............................
........................................................................
   1    -45.1816264 -0.451816E+02  0.632E-02    2.02       0.0  T
   2    -45.1816279 -0.151994E-05  0.361E-02    2.01       1.0  T
   3    -45.1816274  0.450581E-06  0.769E-03    2.01       2.5  T
   4    -45.1816285 -0.103303E-05  0.245E-03    2.01       7.8  T
   5    -45.1816285 -0.428512E-07  0.142E-03    2.01      13.5  T
     SCC iter.                  ...        0 min,  0.007 sec
     gradient                   ...        0 min,  0.016 sec
 * total energy  :   -44.6369665 Eh     change       -0.2727509E-04 Eh
   gradient norm :     0.0032704 Eh/α   predicted    -0.2045392E-04 ( -25.01%)
   displ. norm   :     0.0752784 α      lambda       -0.3889563E-04
   maximum displ.:     0.0450775 α      in ANC's #2, #9, #3, ...

........................................................................
.............................. CYCLE   17 ..............................
........................................................................
   1    -45.1825068 -0.451825E+02  0.697E-02    2.04       0.0  T
   2    -45.1825095 -0.267131E-05  0.388E-02    2.03       1.0  T
   3    -45.1825095 -0.592440E-08  0.732E-03    2.03       2.6  T
   4    -45.1825098 -0.334562E-06  0.407E-03    2.03       4.7  T
   5    -45.1825101 -0.230327E-06  0.150E-03    2.03      12.8  T
   6    -45.1825101 -0.136172E-07  0.587E-04    2.03      32.8  T
   7    -45.1825101 -0.214662E-08  0.232E-04    2.03      83.0  T
     SCC iter.                  ...        0 min,  0.009 sec
     gradient                   ...        0 min,  0.017 sec
 * total energy  :   -44.6369893 Eh     change       -0.2282405E-04 Eh
   gradient norm :     0.0015285 Eh/α   predicted    -0.1955910E-04 ( -14.30%)
   displ. norm   :     0.1585865 α      lambda       -0.2045851E-04
   maximum displ.:     0.0989778 α      in ANC's #2, #9, #10, ...

........................................................................
.............................. CYCLE   18 ..............................
........................................................................
   1    -45.1815383 -0.451815E+02  0.162E-01    2.01       0.0  T
   2    -45.1815459 -0.761541E-05  0.928E-02    2.01       1.0  T
   3    -45.1815452  0.755030E-06  0.147E-02    2.01       1.3  T
   4    -45.1815491 -0.391000E-05  0.595E-03    2.01       3.2  T
   5    -45.1815494 -0.281695E-06  0.280E-03    2.01       6.9  T
   6    -45.1815494 -0.426872E-07  0.127E-03    2.01      15.1  T
   7    -45.1815494 -0.117861E-07  0.589E-04    2.01      32.7  T
   8    -45.1815494 -0.359876E-08  0.253E-04    2.01      76.0  T
     SCC iter.                  ...        0 min,  0.010 sec
     gradient                   ...        0 min,  0.017 sec
 * total energy  :   -44.6369899 Eh     change       -0.5528404E-06 Eh
   gradient norm :     0.0043094 Eh/α   predicted    -0.1034475E-04 (1771.20%)
   displ. norm   :     0.0457232 α      lambda       -0.2086002E-04
   maximum displ.:     0.0227094 α      in ANC's #10, #4, #2, ...

........................................................................
.............................. CYCLE   19 ..............................
........................................................................
   1    -45.1822444 -0.451822E+02  0.453E-02    2.03       0.0  T
   2    -45.1822456 -0.125138E-05  0.262E-02    2.03       1.0  T
   3    -45.1822451  0.519854E-06  0.681E-03    2.02       2.8  T
   4    -45.1822459 -0.770625E-06  0.248E-03    2.02       7.8  T
   5    -45.1822460 -0.101945E-06  0.931E-04    2.02      20.7  T
     SCC iter.                  ...        0 min,  0.007 sec
     gradient                   ...        0 min,  0.016 sec
 * total energy  :   -44.6370024 Eh     change       -0.1253837E-04 Eh
   gradient norm :     0.0017520 Eh/α   predicted    -0.1045562E-04 ( -16.61%)
   displ. norm   :     0.0261701 α      lambda       -0.5302210E-05
   maximum displ.:     0.0153730 α      in ANC's #5, #4, #3, ...

........................................................................
.............................. CYCLE   20 ..............................
........................................................................
   1    -45.1827425 -0.451827E+02  0.202E-02    2.03       0.0  T
   2    -45.1827428 -0.224267E-06  0.118E-02    2.03       1.6  T
   3    -45.1827427  0.486353E-07  0.237E-03    2.03       8.1  T
   4    -45.1827428 -0.941918E-07  0.848E-04    2.03      22.7  T
   5    -45.1827428 -0.706396E-08  0.428E-04    2.03      44.9  T
     SCC iter.                  ...        0 min,  0.007 sec
     gradient                   ...        0 min,  0.017 sec
 * total energy  :   -44.6370049 Eh     change       -0.2471571E-05 Eh
   gradient norm :     0.0012281 Eh/α   predicted    -0.2655712E-05 (   7.45%)
   displ. norm   :     0.0216935 α      lambda       -0.3449531E-05
   maximum displ.:     0.0125948 α      in ANC's #2, #5, #1, ...
 * RMSD in coord.:     0.4130575 α      energy gain  -0.1043940E-01 Eh

generating ANC from model Hessian ...
Using Lindh-Hessian (1995)
 Shifting diagonal of input Hessian by   3.895915450521776E-003
 Lowest  eigenvalues of input Hessian
   -0.000000   -0.000000   -0.000000   -0.000000    0.000000    0.000000
    0.005000    0.006612    0.008162    0.008799    0.010077    0.012412
    0.013693    0.017119    0.018823    0.020852    0.023049    0.026385
 Highest eigenvalues
    1.684696    1.833059    1.888578    2.025891    2.046140    2.599931
 

........................................................................
.............................. CYCLE   21 ..............................
........................................................................
   1    -45.1824596 -0.451825E+02  0.152E-02    2.03       0.0  T
   2    -45.1824597 -0.112029E-06  0.851E-03    2.03       2.3  T
   3    -45.1824596  0.767787E-07  0.243E-03    2.03       7.9  T
   4    -45.1824597 -0.860759E-07  0.107E-03    2.03      18.0  T
   5    -45.1824597 -0.149748E-07  0.365E-04    2.03      52.7  T
   6    -45.1824597 -0.884746E-09  0.122E-04    2.03     157.7  T
     SCC iter.                  ...        0 min,  0.008 sec
     gradient                   ...        0 min,  0.017 sec
 * total energy  :   -44.6370075 Eh     change       -0.2576007E-05 Eh
   gradient norm :     0.0010129 Eh/α   predicted     0.0000000E+00 (-100.00%)
   displ. norm   :     0.0148328 α      lambda       -0.2060685E-05
   maximum displ.:     0.0079052 α      in ANC's #4, #1, #10, ...

........................................................................
.............................. CYCLE   22 ..............................
........................................................................
   1    -45.1823638 -0.451824E+02  0.117E-02    2.03       0.0  T
   2    -45.1823639 -0.887026E-07  0.684E-03    2.03       2.8  T
   3    -45.1823637  0.201787E-06  0.350E-03    2.03       5.5  T
   4    -45.1823639 -0.245567E-06  0.592E-04    2.03      32.5  T
   5    -45.1823639 -0.320409E-08  0.257E-04    2.03      74.9  T
     SCC iter.                  ...        0 min,  0.007 sec
     gradient                   ...        0 min,  0.017 sec
 * total energy  :   -44.6370090 Eh     change       -0.1528811E-05 Eh
   gradient norm :     0.0004493 Eh/α   predicted    -0.1032792E-05 ( -32.44%)
   displ. norm   :     0.0151011 α      lambda       -0.1514205E-05
   maximum displ.:     0.0082893 α      in ANC's #10, #5, #4, ...

   *** GEOMETRY OPTIMIZATION CONVERGED AFTER 22 ITERATIONS ***

------------------------------------------------------------------------
 total energy gain   :        -0.0104435 Eh       -6.5534 kcal/mol
 total RMSD          :         0.4125444 a0        0.2183 Å
 total power (kW/mol):        -1.2463372 (step)  -32.2197 (real)
------------------------------------------------------------------------

 ANCopt (total)                0 d,  0 h,  0 min,  0.851 sec
 optimizer setup                ...        0 min,  0.000 sec (  0.016%)
 model hessian                  ...        0 min,  0.032 sec (  3.708%)
 ANC generation                 ...        0 min,  0.002 sec (  0.177%)
 coordinate transformation      ...        0 min,  0.000 sec (  0.047%)
 single point calculation       ...        0 min,  0.808 sec ( 94.925%)
 optimization log               ...        0 min,  0.002 sec (  0.272%)
 hessian update                 ...        0 min,  0.000 sec (  0.033%)
 rational function              ...        0 min,  0.005 sec (  0.642%)

================
 final structure:
================
$coord
    2.55086207773106   -2.40421783954181    0.42941038181686      C 
    4.87665868786986   -0.19633162243970    0.01779652244559      S 
    2.65541151825218    2.19528200035062   -0.41310745365312      C 
    0.24144271357619    1.25147662964014   -0.20181828546130      C 
    0.19281861334250   -1.38484557280852    0.27952106253311      C 
   -2.19663420285738   -2.85855155559131    0.63811308854914      C 
   -4.47185455324707   -1.46412600022582   -0.47182432715606      C 
   -4.44411171156733   -1.69402074692245   -3.17701083848154      N 
   -4.45259810276354    1.33275078089804    0.48218182203607      C 
   -4.59897041229604    1.25515943435324    3.26480960480385      N 
   -6.56251421977926    0.46829710081391    4.14124484001634      O 
   -2.78813011503200    1.91995139767766    4.48116795349200      O 
   -2.13273925337767    2.78195108693132   -0.41378079520698      C 
    3.61385935844991    4.69924367297653   -0.88164536221992      C 
    2.35764380011098    6.71456191441855   -1.70765899392018      C 
    3.04484886448597   -4.33802035444282    0.77284462780633      H 
   -2.49888811901763   -3.19299527524105    2.65556996381545      H 
   -2.03948000562900   -4.69850476694761   -0.27865970995499      H 
   -6.22162925404981   -2.33829433276594    0.21560344412768      H 
   -2.79293598360811   -1.07375869978641   -3.91950109200573      H 
   -5.90485700997561   -0.77729567631964   -4.00368789235957      H 
   -6.19427422904176    2.25078536454393   -0.15971731184024      H 
   -1.92832595249713    4.50539466061112    0.70774162910701      H 
   -2.43256687452203    3.34422292785559   -2.38247623435377      H 
    5.62182979121977    4.87882868195027   -0.52693832770078      H 
    0.38200145650440    6.69922532397384   -2.17119325192100      H 
    3.31998507617195    8.48637773267118   -1.97361115516330      H 
$end
           -------------------------------------------------
          |                Final Singlepoint                |
           -------------------------------------------------

          ...................................................
          :                      SETUP                      :
          :.................................................:
          :  # basis functions                  78          :
          :  # atomic orbitals                  77          :
          :  # shells                           43          :
          :  # electrons                        80          :
          :  max. iterations                   250          :
          :  Hamiltonian                  GFN2-xTB          :
          :  restarted?                      false          :
          :  GBSA solvation                  false          :
          :  PC potential                    false          :
          :  electronic temp.          300.0000000     K    :
          :  accuracy                    1.0000000          :
          :  -> integral cutoff          0.2500000E+02      :
          :  -> integral neglect         0.1000000E-07      :
          :  -> SCF convergence          0.1000000E-05 Eh   :
          :  -> wf. convergence          0.1000000E-03 e    :
          :  Broyden damping             0.4000000          :
          ...................................................

 iter      E             dE          RMSdq      gap      omega  full diag
   1    -45.1823639 -0.451824E+02  0.131E-04    2.03       0.0  T
   2    -45.1823639 -0.731788E-10  0.666E-05    2.03     288.9  T
   3    -45.1823639 -0.124302E-09  0.441E-05    2.03     436.2  T

   *** convergence criteria satisfied after 3 iterations ***

         #    Occupation            Energy/Eh            Energy/eV
      -------------------------------------------------------------
         1        2.0000           -0.7760622             -21.1177
       ...           ...                  ...                  ...
        34        2.0000           -0.4518640             -12.2958
        35        2.0000           -0.4439436             -12.0803
        36        2.0000           -0.4374283             -11.9030
        37        2.0000           -0.4352345             -11.8433
        38        2.0000           -0.3992846             -10.8651
        39        2.0000           -0.3940248             -10.7220
        40        2.0000           -0.3807873             -10.3617 (HOMO)
        41                         -0.3062999              -8.3348 (LUMO)
        42                         -0.2682526              -7.2995
        43                         -0.2085014              -5.6736
        44                         -0.2018516              -5.4927
        45                         -0.1542612              -4.1977
       ...                                ...                  ...
        77                          0.6743970              18.3513
      -------------------------------------------------------------
                  HL-Gap            0.0744873 Eh            2.0269 eV
             Fermi-level           -0.3435436 Eh           -9.3483 eV

 SCC (total)                   0 d,  0 h,  0 min,  0.034 sec
 SCC setup                      ...        0 min,  0.000 sec (  0.595%)
 Dispersion                     ...        0 min,  0.000 sec (  0.750%)
 integral evaluation            ...        0 min,  0.011 sec ( 31.999%)
 zeroth order Hamiltonian       ...        0 min,  0.000 sec (  0.604%)
 iterations                     ...        0 min,  0.005 sec ( 13.665%)
 molecular gradient             ...        0 min,  0.017 sec ( 51.183%)
 printout                       ...        0 min,  0.000 sec (  1.041%)

         :::::::::::::::::::::::::::::::::::::::::::::::::::::
         ::                     SUMMARY                     ::
         :::::::::::::::::::::::::::::::::::::::::::::::::::::
         :: total energy             -44.637008979777 Eh    ::
         :: gradient norm              0.000447930534 Eh/a0 ::
         :: HOMO-LUMO gap              2.026903648888 eV    ::
         ::.................................................::
         :: SCC energy               -45.182363930398 Eh    ::
         :: -> isotropic ES            0.059444544194 Eh    ::
         :: -> anisotropic ES          0.011995812024 Eh    ::
         :: -> anisotropic XC          0.014618224366 Eh    ::
         :: -> dispersion             -0.030114756766 Eh    ::
         :: repulsion energy           0.544958584917 Eh    ::
         :: add. restraining           0.000000000000 Eh    ::
         :::::::::::::::::::::::::::::::::::::::::::::::::::::

           -------------------------------------------------
          |                Property Printout                |
           -------------------------------------------------

    * Orbital Energies and Occupations

         #    Occupation            Energy/Eh            Energy/eV
      -------------------------------------------------------------
         1        2.0000           -0.7760622             -21.1177
       ...           ...                  ...                  ...
        28        2.0000           -0.4786468             -13.0246
        29        2.0000           -0.4750224             -12.9260
        30        2.0000           -0.4747225             -12.9179
        31        2.0000           -0.4632744             -12.6063
        32        2.0000           -0.4562942             -12.4164
        33        2.0000           -0.4549003             -12.3785
        34        2.0000           -0.4518640             -12.2958
        35        2.0000           -0.4439436             -12.0803
        36        2.0000           -0.4374283             -11.9030
        37        2.0000           -0.4352345             -11.8433
        38        2.0000           -0.3992846             -10.8651
        39        2.0000           -0.3940248             -10.7220
        40        2.0000           -0.3807873             -10.3617 (HOMO)
        41                         -0.3062999              -8.3348 (LUMO)
        42                         -0.2682526              -7.2995
        43                         -0.2085014              -5.6736
        44                         -0.2018516              -5.4927
        45                         -0.1542612              -4.1977
        46                         -0.1188865              -3.2351
        47                         -0.0403281              -1.0974
        48                         -0.0075906              -0.2066
        49                          0.0210046               0.5716
        50                          0.0285695               0.7774
        51                          0.0311393               0.8473
       ...                                ...                  ...
        77                          0.6743970              18.3513
      -------------------------------------------------------------
                  HL-Gap            0.0744873 Eh            2.0269 eV
             Fermi-level           -0.3435436 Eh           -9.3483 eV

     #   Z        covCN         q      C6AA      α(0)
     1   6 C      2.938    -0.033    28.811     8.803
     2  16 S      2.346    -0.027   142.186    20.069
     3   6 C      2.985     0.013    27.712     8.635
     4   6 C      3.157    -0.012    27.993     8.651
     5   6 C      3.162    -0.007    27.865     8.628
     6   6 C      3.811    -0.068    21.801     6.646
     7   6 C      3.785     0.059    19.604     6.307
     8   7 N      2.633    -0.326    28.384     7.913
     9   6 C      3.790    -0.029    21.097     6.541
    10   7 N      2.756     0.540    13.589     5.475
    11   8 O      0.929    -0.394    21.535     6.224
    12   8 O      0.927    -0.372    21.091     6.159
    13   6 C      3.807    -0.053    21.520     6.604
    14   6 C      2.939    -0.029    28.730     8.791
    15   6 C      2.837    -0.094    30.348     9.028
    16   1 H      0.926     0.045     2.378     2.411
    17   1 H      0.924     0.053     2.279     2.361
    18   1 H      0.924     0.064     2.153     2.295
    19   1 H      0.924     0.056     2.252     2.347
    20   1 H      0.860     0.156     1.360     1.827
    21   1 H      0.860     0.146     1.431     1.874
    22   1 H      0.924     0.066     2.134     2.284
    23   1 H      0.924     0.069     2.096     2.264
    24   1 H      0.924     0.050     2.325     2.385
    25   1 H      0.925     0.046     2.367     2.406
    26   1 H      0.926     0.038     2.471     2.458
    27   1 H      0.926     0.043     2.411     2.428

 Mol. C6AA /au·bohr⁶  :       9563.285202
 Mol. C8AA /au·bohr⁸  :     247773.351523
 Mol. α(0) /au        :        151.813722


Wiberg/Mayer (AO) data.
largest (>0.10) Wiberg bond orders for each atom
          total WBO             WBO to atom ...
     1  C   3.948        C    5 1.572    S    2 1.203    H   16 0.970    C    3 0.103
     2  S   2.623        C    1 1.203    C    3 1.135
     3  C   3.947        C    4 1.494    S    2 1.135    C   14 1.135    C    1 0.103
     4  C   3.983        C    3 1.494    C    5 1.253    C   13 1.009
     5  C   3.985        C    1 1.572    C    4 1.253    C    6 1.008
     6  C   3.995        C    5 1.008    C    7 0.992    H   18 0.965    H   17 0.958
     7  C   3.981        N    8 1.044    C    6 0.992    H   19 0.960    C    9 0.918
     8  N   3.066        C    7 1.044    H   21 0.963    H   20 0.958
     9  C   3.965        C   13 1.000    H   22 0.952    C    7 0.918    N   10 0.917
    10  N   3.906        O   12 1.477    O   11 1.458    C    9 0.917
    11  O   1.929        N   10 1.458    O   12 0.364
    12  O   1.956        N   10 1.477    O   11 0.364
    13  C   3.994        C    4 1.009    C    9 1.000    H   24 0.955    H   23 0.955
    14  C   3.991        C   15 1.862    C    3 1.135    H   25 0.962
    15  C   3.991        C   14 1.862    H   27 0.977    H   26 0.973
    16  H   0.997        C    1 0.970
    17  H   0.997        C    6 0.958
    18  H   0.996        C    6 0.965
    19  H   0.996        C    7 0.960
    20  H   0.976        N    8 0.958
    21  H   0.979        N    8 0.963
    22  H   0.995        C    9 0.952
    23  H   0.995        C   13 0.955
    24  H   0.998        C   13 0.955
    25  H   0.997        C   14 0.962
    26  H   0.999        C   15 0.973
    27  H   0.998        C   15 0.977

molecular dipole:
                 x           y           z       tot (Debye)
 q only:        0.193      -0.013      -1.695
   full:       -0.122       0.326      -1.698       4.406
molecular quadrupole (traceless):
                xx          xy          yy          xz          yz          zz
 q only:       -0.964      -0.849       8.267      11.982      -4.653      -7.303
  q+dip:       -1.684      -4.907      10.853      13.099      -7.601      -9.170
   full:       -2.509      -4.987      10.385      12.790      -7.135      -7.876

           -------------------------------------------------
          |                Geometry Summary                 |
           -------------------------------------------------

      molecular mass/u    :      224.2770000
   center of mass at/Å    :       -0.3714435       0.4013607       0.2393697
  moments of inertia/u·Å² :        0.5999632E+03   0.1191783E+04   0.1353652E+04
rotational constants/cm⁻¹ :        0.2809778E-01   0.1414488E-01   0.1245345E-01

 * 25 selected distances

     #   Z        #   Z                                     value/Å
     1   6 C      2  16 S                                 1.7109306
     2  16 S      3   6 C                                 1.7422259 (max)
     3   6 C      4   6 C                                 1.3761312
     1   6 C      5   6 C                                 1.3617403
     4   6 C      5   6 C                                 1.4183774
     5   6 C      6   6 C                                 1.4976635
     6   6 C      7   6 C                                 1.5294057
     7   6 C      8   7 N                                 1.4367582
     9   6 C     10   7 N                                 1.4751107
    10   7 N     11   8 O                                 1.2116652
    10   7 N     12   8 O                                 1.2067816
     9   6 C     13   6 C                                 1.5231369
    14   6 C     15   6 C                                 1.3305292
     1   6 C     16   1 H                                 1.0717064
     6   6 C     17   1 H                                 1.0939186
     6   6 C     18   1 H                                 1.0910036
     7   6 C     19   1 H                                 1.0971261
     8   7 N     20   1 H                                 1.0127073
     8   7 N     21   1 H                                 1.0120377 (min)
     9   6 C     22   1 H                                 1.0958260
    13   6 C     23   1 H                                 1.0934722
    13   6 C     24   1 H                                 1.0950016
    14   6 C     25   1 H                                 1.0832005
    15   6 C     26   1 H                                 1.0738859
    15   6 C     27   1 H                                 1.0762173

 * 6 distinct bonds (by element types)

   Z      Z             #   av. dist./Å        max./Å        min./Å
   1 H    6 C          10     1.0871358     1.0971261     1.0717064
   6 C    6 C           7     1.4338549     1.5294057     1.3305292
   1 H    7 N           2     1.0123725     1.0127073     1.0120377
   6 C    7 N           2     1.4559344     1.4751107     1.4367582
   7 N    8 O           2     1.2092234     1.2116652     1.2067816
   6 C   16 S           2     1.7265782     1.7422259     1.7109306


optimized geometry written to: xtbopt.xyz


           -------------------------------------------------
          | TOTAL ENERGY              -44.637008979777 Eh   |
          | GRADIENT NORM               0.000447930534 Eh/α |
          | HOMO-LUMO GAP               2.026903648888 eV   |
           -------------------------------------------------

------------------------------------------------------------------------
 * finished run on 2021/05/19 at 11:01:05.511     
------------------------------------------------------------------------
 total:
 * wall-time:     0 d,  0 h,  0 min,  0.989 sec
 *  cpu-time:     0 d,  0 h,  0 min,  0.954 sec
 * ratio c/w:     0.965 speedup
 SCF:
 * wall-time:     0 d,  0 h,  0 min,  0.069 sec
 *  cpu-time:     0 d,  0 h,  0 min,  0.047 sec
 * ratio c/w:     0.681 speedup
 ANC optimizer:
 * wall-time:     0 d,  0 h,  0 min,  0.885 sec
 *  cpu-time:     0 d,  0 h,  0 min,  0.885 sec
 * ratio c/w:     1.000 speedup

