      -----------------------------------------------------------      
     |                   =====================                   |     
     |                           x T B                           |     
     |                   =====================                   |     
     |                         S. Grimme                         |     
     |          Mulliken Center for Theoretical Chemistry        |     
     |                    University of Bonn                     |     
     |                Version 6.2 RC2 (SAW190805)                |     
      -----------------------------------------------------------      

   This program is distributed in the hope that it will be useful,
   but WITHOUT ANY WARRANTY; without even the implied warranty of
   MERCHANTABILITY or FITNESS FOR A PARTICULAR PURPOSE.
   
   FOR NON-COMMERCIAL, ACADEMIA USE ONLY.
   
   Cite this work as:
   * S. Grimme, C. Bannwarth, P. Shushkov, J. Chem. Theory Comput., 2017,
     13, 1989-2009. DOI: 10.1021/acs.jctc.7b00118
   * C. Bannwarth, S. Ehlert and S. Grimme., J. Chem. Theory Comput., 2019,
     15, 1652-1671. DOI: 10.1021/acs.jctc.8b01176
   * P. Pracht, E. Caldeweyher, S. Ehlert, S. Grimme, ChemRxiv, 2019, preprint.
     DOI: 10.26434/chemrxiv.8326202.v1
   
   for DFT-D4:
   * E. Caldeweyher, C. Bannwarth and S. Grimme, J. Chem. Phys., 2017,
     147, 034112. DOI: 10.1063/1.4993215
   * E. Caldeweyher, S. Ehlert, A. Hansen, H. Neugebauer, S. Spicher,
     C. Bannwarth and S. Grimme, J. Chem. Phys., 2019, 150, 154122.
     DOI: 10.1063/1.5090222
   
   for sTDA-xTB:
   * S. Grimme and C. Bannwarth, J. Chem. Phys., 2016, 145, 054103.
     DOI: 10.1063/1.4959605
   
   in the mass-spec context:
   * V. Asgeirsson, C. Bauer and S. Grimme, Chem. Sci., 2017, 8, 4879.
     DOI: 10.1039/c7sc00601b
   
   for metadynamics refer to:
   * S. Grimme, J. Chem. Theory Comput., 2019, 155, 2847-2862
     DOI: 10.1021/acs.jctc.9b00143
   
   with help from (in alphabetical order)
   C. Bannwarth, F. Bohle, G. Brandenburg, E. Caldeweyher, M. Checinski,
   S. Dohm, S. Ehlert, S. Ehrlich, F. März, H. Neugebauer, J. Pisarek,
   P. Pracht, P. Shushkov, and S. Spicher.
   
 * started run on 2021/05/19 at 10:59:09.377     

           -------------------------------------------------
          |                Calculation Setup                |
           -------------------------------------------------

          program call               : /ihome/ghutchison/geoffh/xtb/xtb 99.xyz -opt
          hostname                   : smp-n58
          coordinate file            : 99.xyz
          omp threads                :                     1
          number of atoms            :                    20
          number of electrons        :                    64
          charge                     :                     0
          spin                       :                   0.0
          first test random number   :      0.37377869653105


########################################################################
# WARNING! Please study the warnings concerning your input carefully
#  - the use of '-opt' is discouraged, please use '--opt' next time
########################################################################

           ------------------------------------------------- 
          |                 G F N 2 - x T B                 |
          | Geometry, Frequencies, Noncovalent interactions |
          |            JCTC 2019 parametrisation            |
           ------------------------------------------------- 
             KAB for C  - Si     :                1.0500
             KAB for H  - Pd     :                0.9500
             k(s)              :                1.8500
             k(p)              :                2.2300
             k(d)              :                2.2300
             k(f)              :                2.0000
             kEN (H0ij)        :               -2.0000
             D4 a1             :                0.5200
             D4 a2             :                5.0000
             D4 s6             :                1.0000
             D4 s8             :                2.7000
             D4 s9             :                5.0000
             alphaj            :                2.0000

  Z AO/shell   Hii/eV     exponent
  1     Wed Apr 25 08:07:45 CEST 2018   EN: 2.200 GM2: 0.406  GM3: 0.0800  RAES: 1.40
     1s    -10.707211    1.230000
  6     Wed Apr 25 08:07:45 CEST 2018   EN: 2.550 GM2: 0.538  GM3: 0.1500  RAES: 3.00
     2s    -13.970922    2.096432
     2p    -10.063292    1.800000
  7     Wed Apr 25 08:07:45 CEST 2018   EN: 3.040 GM2: 0.461  GM3:-0.0640  RAES: 1.90
     2s    -16.686243    2.339881
     2p    -12.523956    2.014332

           ------------------------------------------------- 
          |        Self-Consistent Charge Iterations        |
           ------------------------------------------------- 

          ...................................................
          :                      SETUP                      :
          :.................................................:
          :  # basis functions                  62          :
          :  # atomic orbitals                  62          :
          :  # shells                           34          :
          :  # electrons                        64          :
          :  max. iterations                   250          :
          :  Hamiltonian                  GFN2-xTB          :
          :  restarted?                      false          :
          :  GBSA solvation                  false          :
          :  PC potential                    false          :
          :  electronic temp.          300.0000000     K    :
          :  accuracy                    1.0000000          :
          :  -> integral cutoff          0.2500000E+02      :
          :  -> integral neglect         0.1000000E-07      :
          :  -> SCF convergence          0.1000000E-05 Eh   :
          :  -> wf. convergence          0.1000000E-03 e    :
          :  Broyden damping             0.4000000          :
          ...................................................

 iter      E             dE          RMSdq      gap      omega  full diag
   1    -34.9640519 -0.349641E+02  0.685E+00    1.43       0.0  T
   2    -34.9198819  0.441700E-01  0.479E+00    1.43       1.0  T
   3    -34.8117613  0.108121E+00  0.395E+00    1.38       1.0  T
   4    -35.0146015 -0.202840E+00  0.116E+00    1.45       1.0  T
   5    -35.0373749 -0.227734E-01  0.381E-01    1.42       1.0  T
   6    -35.0382729 -0.897985E-03  0.201E-01    1.42       1.0  T
   7    -35.0386880 -0.415135E-03  0.103E-01    1.41       1.0  T
   8    -35.0388332 -0.145240E-03  0.339E-02    1.43       1.0  T
   9    -35.0388382 -0.497276E-05  0.214E-02    1.42       1.0  T
  10    -35.0388424 -0.418208E-05  0.892E-03    1.42       2.5  T
  11    -35.0388431 -0.730221E-06  0.189E-03    1.42      11.8  T
  12    -35.0388431 -0.124077E-07  0.127E-03    1.42      17.5  T
  13    -35.0388431 -0.103387E-07  0.495E-04    1.42      45.2  T
  14    -35.0388431 -0.206962E-08  0.186E-04    1.42     120.0  T

   *** convergence criteria satisfied after 14 iterations ***

         #    Occupation            Energy/Eh            Energy/eV
      -------------------------------------------------------------
         1        2.0000           -0.6930796             -18.8597
       ...           ...                  ...                  ...
        26        2.0000           -0.4689661             -12.7612
        27        2.0000           -0.4508928             -12.2694
        28        2.0000           -0.4433400             -12.0639
        29        2.0000           -0.4406377             -11.9904
        30        2.0000           -0.4332282             -11.7887
        31        2.0000           -0.4140129             -11.2659
        32        2.0000           -0.4126485             -11.2287 (HOMO)
        33                         -0.3603584              -9.8058 (LUMO)
        34                         -0.2834310              -7.7125
        35                         -0.2620592              -7.1310
        36                         -0.2506965              -6.8218
        37                         -0.2237090              -6.0874
       ...                                ...                  ...
        62                          1.1081252              30.1536
      -------------------------------------------------------------
                  HL-Gap            0.0522902 Eh            1.4229 eV
             Fermi-level           -0.3864036 Eh          -10.5146 eV

 SCC (total)                   0 d,  0 h,  0 min,  0.031 sec
 SCC setup                      ...        0 min,  0.000 sec (  0.829%)
 Dispersion                     ...        0 min,  0.000 sec (  1.047%)
 integral evaluation            ...        0 min,  0.007 sec ( 22.891%)
 zeroth order Hamiltonian       ...        0 min,  0.000 sec (  0.470%)
 iterations                     ...        0 min,  0.013 sec ( 41.778%)
 molecular gradient             ...        0 min,  0.010 sec ( 31.886%)
 printout                       ...        0 min,  0.000 sec (  0.938%)

         :::::::::::::::::::::::::::::::::::::::::::::::::::::
         ::                     SUMMARY                     ::
         :::::::::::::::::::::::::::::::::::::::::::::::::::::
         :: total energy             -34.397753105564 Eh    ::
         :: gradient norm              0.251195791730 Eh/a0 ::
         :: HOMO-LUMO gap              1.422888389836 eV    ::
         ::.................................................::
         :: SCC energy               -35.038843146644 Eh    ::
         :: -> isotropic ES            0.017637161647 Eh    ::
         :: -> anisotropic ES          0.001961392737 Eh    ::
         :: -> anisotropic XC          0.049884859063 Eh    ::
         :: -> dispersion             -0.021195132708 Eh    ::
         :: repulsion energy           0.641015848902 Eh    ::
         :: add. restraining           0.000000000000 Eh    ::
         :::::::::::::::::::::::::::::::::::::::::::::::::::::

      ----------------------------------------------------------- 
     |                   =====================                   |
     |                        A N C O P T                        |
     |                   =====================                   |
     |               Approximate Normal Coordinate               |
     |                Rational Function Optimizer                |
      ----------------------------------------------------------- 

          ...................................................
          :                      SETUP                      :
          :.................................................:
          :   optimization level            normal          :
          :   max. optcycles                   200          :
          :   ANC micro-cycles                  20          :
          :   degrees of freedom                54          :
          :.................................................:
          :   RF solver                   davidson          :
          :   input Hessian                  false          :
          :   write xtbopt.log                true          :
          :   linear?                        false          :
          :   energy convergence         0.5000000E-05 Eh   :
          :   grad. convergence          0.1000000E-02 Eh/α :
          :   maximium RF displ.         2.0000000          :
          :   Hlow (freq-cutoff)         0.5000000E-02      :
          :   Hmax (freq-cutoff)         5.0000000          :
          :   S6 in model hess.         20.0000000          :
          ...................................................

generating ANC from model Hessian ...
Using Lindh-Hessian (1995)
 Shifting diagonal of input Hessian by   4.918163280009358E-003
 Lowest  eigenvalues of input Hessian
   -0.000000   -0.000000    0.000000    0.000000    0.000000    0.000000
    0.005000    0.005999    0.007243    0.008360    0.010002    0.010432
    0.016547    0.021747    0.023634    0.025960    0.030314    0.041656
 Highest eigenvalues
    1.822308    1.884470    1.923146    2.039263    2.081646    2.579913
 

........................................................................
.............................. CYCLE    1 ..............................
........................................................................
   1    -35.0388431 -0.350388E+02  0.109E-04    1.42       0.0  T
   2    -35.0388431  0.901608E-10  0.995E-05    1.42     224.8  T
   3    -35.0388431 -0.179007E-09  0.517E-05    1.42     432.5  T
     SCC iter.                  ...        0 min,  0.003 sec
     gradient                   ...        0 min,  0.010 sec
 * total energy  :   -34.3977531 Eh     change       -0.1180036E-07 Eh
   gradient norm :     0.2511959 Eh/α   predicted     0.0000000E+00 (-100.00%)
   displ. norm   :     0.3241988 α      lambda       -0.5581723E-01
   maximum displ.:     0.1650195 α      in ANC's #18, #24, #35, ...

........................................................................
.............................. CYCLE    2 ..............................
........................................................................
   1    -35.1393331 -0.351393E+02  0.487E-01    1.39       0.0  T
   2    -35.1395473 -0.214215E-03  0.308E-01    1.40       1.0  T
   3    -35.1392092  0.338026E-03  0.231E-01    1.39       1.0  T
   4    -35.1398572 -0.648005E-03  0.543E-02    1.40       1.0  T
   5    -35.1398919 -0.346777E-04  0.265E-02    1.39       1.0  T
   6    -35.1399026 -0.106507E-04  0.107E-02    1.40       2.1  T
   7    -35.1399037 -0.109959E-05  0.675E-03    1.40       3.3  T
   8    -35.1399041 -0.453788E-06  0.261E-03    1.40       8.6  T
   9    -35.1399042 -0.446945E-07  0.722E-04    1.40      31.0  T
     SCC iter.                  ...        0 min,  0.008 sec
     gradient                   ...        0 min,  0.010 sec
 * total energy  :   -34.4311992 Eh     change       -0.3344613E-01 Eh
   gradient norm :     0.0520440 Eh/α   predicted    -0.3084229E-01 (  -7.79%)
   displ. norm   :     0.1996560 α      lambda       -0.4248065E-02
   maximum displ.:     0.1073349 α      in ANC's #18, #3, #5, ...

........................................................................
.............................. CYCLE    3 ..............................
........................................................................
   1    -35.1500344 -0.351500E+02  0.183E-01    1.36       0.0  T
   2    -35.1500614 -0.269230E-04  0.131E-01    1.35       1.0  T
   3    -35.1501077 -0.463139E-04  0.770E-02    1.36       1.0  T
   4    -35.1501309 -0.231748E-04  0.384E-02    1.35       1.0  T
   5    -35.1501581 -0.272258E-04  0.127E-02    1.36       1.8  T
   6    -35.1501605 -0.240679E-05  0.330E-03    1.36       6.8  T
   7    -35.1501605 -0.133792E-07  0.242E-03    1.36       9.2  T
     SCC iter.                  ...        0 min,  0.007 sec
     gradient                   ...        0 min,  0.010 sec
 * total energy  :   -34.4337776 Eh     change       -0.2578385E-02 Eh
   gradient norm :     0.0174853 Eh/α   predicted    -0.2208706E-02 ( -14.34%)
   displ. norm   :     0.1637902 α      lambda       -0.7244305E-03
   maximum displ.:     0.0861420 α      in ANC's #5, #6, #3, ...

........................................................................
.............................. CYCLE    4 ..............................
........................................................................
   1    -35.1490446 -0.351490E+02  0.175E-01    1.34       0.0  T
   2    -35.1490574 -0.127073E-04  0.998E-02    1.34       1.0  T
   3    -35.1490105  0.468701E-04  0.584E-02    1.34       1.0  T
   4    -35.1490680 -0.575587E-04  0.711E-03    1.34       3.1  T
   5    -35.1490685 -0.449658E-06  0.423E-03    1.34       5.3  T
   6    -35.1490687 -0.170106E-06  0.227E-03    1.34       9.8  T
   7    -35.1490687 -0.399449E-07  0.113E-03    1.34      19.8  T
     SCC iter.                  ...        0 min,  0.007 sec
     gradient                   ...        0 min,  0.010 sec
 * total energy  :   -34.4339407 Eh     change       -0.1631150E-03 Eh
   gradient norm :     0.0103266 Eh/α   predicted    -0.3719350E-03 ( 128.02%)
   displ. norm   :     0.2150274 α      lambda       -0.9256381E-03
   maximum displ.:     0.1003364 α      in ANC's #1, #5, #3, ...

........................................................................
.............................. CYCLE    5 ..............................
........................................................................
   1    -35.1461905 -0.351462E+02  0.315E-01    1.33       0.0  T
   2    -35.1462201 -0.296216E-04  0.175E-01    1.33       1.0  T
   3    -35.1461288  0.912679E-04  0.726E-02    1.33       1.0  T
   4    -35.1462400 -0.111165E-03  0.848E-03    1.33       2.6  T
   5    -35.1462406 -0.569178E-06  0.537E-03    1.33       4.2  T
   6    -35.1462408 -0.264404E-06  0.334E-03    1.33       6.7  T
   7    -35.1462410 -0.129919E-06  0.127E-03    1.33      17.6  T
   8    -35.1462410 -0.213188E-07  0.449E-04    1.33      49.8  T
     SCC iter.                  ...        0 min,  0.007 sec
     gradient                   ...        0 min,  0.010 sec
 * total energy  :   -34.4338194 Eh     change        0.1213040E-03 Eh
   gradient norm :     0.0252326 Eh/α   predicted    -0.4842217E-03 (-499.18%)
   displ. norm   :     0.1188676 α      lambda       -0.8069971E-03
   maximum displ.:     0.0713151 α      in ANC's #5, #1, #2, ...

........................................................................
.............................. CYCLE    6 ..............................
........................................................................
   1    -35.1492618 -0.351493E+02  0.165E-01    1.34       0.0  T
   2    -35.1492723 -0.104889E-04  0.932E-02    1.35       1.0  T
   3    -35.1492393  0.329835E-04  0.502E-02    1.35       1.0  T
   4    -35.1492799 -0.405321E-04  0.644E-03    1.35       3.5  T
   5    -35.1492800 -0.187714E-06  0.476E-03    1.35       4.7  T
   6    -35.1492804 -0.365310E-06  0.158E-03    1.35      14.2  T
     SCC iter.                  ...        0 min,  0.006 sec
     gradient                   ...        0 min,  0.010 sec
 * total energy  :   -34.4341957 Eh     change       -0.3762547E-03 Eh
   gradient norm :     0.0071656 Eh/α   predicted    -0.4092034E-03 (   8.76%)
   displ. norm   :     0.0927090 α      lambda       -0.1641255E-03
   maximum displ.:     0.0777023 α      in ANC's #3, #5, #6, ...

........................................................................
.............................. CYCLE    7 ..............................
........................................................................
   1    -35.1523127 -0.351523E+02  0.192E-01    1.35       0.0  T
   2    -35.1523218 -0.908458E-05  0.106E-01    1.35       1.0  T
   3    -35.1522667  0.551010E-04  0.531E-02    1.35       1.0  T
   4    -35.1523280 -0.612820E-04  0.679E-03    1.35       3.3  T
   5    -35.1523285 -0.522076E-06  0.304E-03    1.35       7.3  T
   6    -35.1523286 -0.126491E-06  0.123E-03    1.35      18.1  T
   7    -35.1523286 -0.921604E-08  0.432E-04    1.35      51.8  T
     SCC iter.                  ...        0 min,  0.007 sec
     gradient                   ...        0 min,  0.010 sec
 * total energy  :   -34.4340708 Eh     change        0.1248772E-03 Eh
   gradient norm :     0.0178767 Eh/α   predicted    -0.8276978E-04 (-166.28%)
   displ. norm   :     0.0643223 α      lambda       -0.2649475E-03
   maximum displ.:     0.0567252 α      in ANC's #3, #10, #5, ...

........................................................................
.............................. CYCLE    8 ..............................
........................................................................
   1    -35.1497335 -0.351497E+02  0.127E-01    1.35       0.0  T
   2    -35.1497379 -0.437769E-05  0.698E-02    1.35       1.0  T
   3    -35.1497195  0.183888E-04  0.310E-02    1.35       1.0  T
   4    -35.1497403 -0.208183E-04  0.489E-03    1.35       4.6  T
   5    -35.1497406 -0.292441E-06  0.253E-03    1.35       8.8  T
   6    -35.1497407 -0.103303E-06  0.860E-04    1.35      26.0  T
     SCC iter.                  ...        0 min,  0.006 sec
     gradient                   ...        0 min,  0.010 sec
 * total energy  :   -34.4342215 Eh     change       -0.1506985E-03 Eh
   gradient norm :     0.0014917 Eh/α   predicted    -0.1330300E-03 ( -11.72%)
   displ. norm   :     0.0163012 α      lambda       -0.3591164E-05
   maximum displ.:     0.0151894 α      in ANC's #3, #1, #20, ...

........................................................................
.............................. CYCLE    9 ..............................
........................................................................
   1    -35.1495462 -0.351495E+02  0.246E-02    1.35       0.0  T
   2    -35.1495464 -0.156218E-06  0.136E-02    1.35       1.6  T
   3    -35.1495457  0.654450E-06  0.628E-03    1.35       3.6  T
   4    -35.1495465 -0.756939E-06  0.106E-03    1.35      21.1  T
   5    -35.1495465 -0.168478E-07  0.483E-04    1.35      46.3  T
   6    -35.1495465 -0.353003E-08  0.173E-04    1.35     129.6  T
     SCC iter.                  ...        0 min,  0.005 sec
     gradient                   ...        0 min,  0.011 sec
 * total energy  :   -34.4342231 Eh     change       -0.1583669E-05 Eh
   gradient norm :     0.0014550 Eh/α   predicted    -0.1796811E-05 (  13.46%)
   displ. norm   :     0.0051015 α      lambda       -0.1147962E-05
   maximum displ.:     0.0032890 α      in ANC's #3, #10, #2, ...

........................................................................
.............................. CYCLE   10 ..............................
........................................................................
   1    -35.1497066 -0.351497E+02  0.861E-03    1.35       0.0  T
   2    -35.1497066 -0.196379E-07  0.479E-03    1.35       4.7  T
   3    -35.1497064  0.180192E-06  0.300E-03    1.35       7.5  T
   4    -35.1497066 -0.196753E-06  0.422E-04    1.35      53.0  T
   5    -35.1497066 -0.231534E-08  0.175E-04    1.35     127.7  T
     SCC iter.                  ...        0 min,  0.005 sec
     gradient                   ...        0 min,  0.010 sec
 * total energy  :   -34.4342242 Eh     change       -0.1058998E-05 Eh
   gradient norm :     0.0002487 Eh/α   predicted    -0.5761865E-06 ( -45.59%)
   displ. norm   :     0.0046538 α      lambda       -0.2472681E-06
   maximum displ.:     0.0022397 α      in ANC's #1, #2, #10, ...

   *** GEOMETRY OPTIMIZATION CONVERGED AFTER 10 ITERATIONS ***

------------------------------------------------------------------------
 total energy gain   :        -0.0364711 Eh      -22.8859 kcal/mol
 total RMSD          :         0.1364809 a0        0.0722 Å
 total power (kW/mol):        -9.5754734 (step) -394.2651 (real)
------------------------------------------------------------------------

 ANCopt (total)                0 d,  0 h,  0 min,  0.243 sec
 optimizer setup                ...        0 min,  0.000 sec (  0.063%)
 model hessian                  ...        0 min,  0.002 sec (  0.788%)
 ANC generation                 ...        0 min,  0.000 sec (  0.196%)
 coordinate transformation      ...        0 min,  0.000 sec (  0.057%)
 single point calculation       ...        0 min,  0.237 sec ( 97.684%)
 optimization log               ...        0 min,  0.001 sec (  0.374%)
 hessian update                 ...        0 min,  0.000 sec (  0.044%)
 rational function              ...        0 min,  0.001 sec (  0.535%)

================
 final structure:
================
$coord
    1.32283186393414   -1.82785989276157    0.01036487609739      C 
    2.24269682842698    0.54901123690325    0.00202027188170      C 
    0.13243636568610    2.31129037785915   -0.00151934991455      C 
   -2.16133692438489    0.72434814784373    0.00799974571032      C 
   -1.41233930928142   -1.73407816896975    0.01481132145476      C 
   -4.67186640350923    1.54838805927029    0.01255170275818      C 
   -6.75813519723886    2.15008918176921    0.01775401196960      N 
    0.23872457650409    4.87450739706038   -0.01481210827279      C 
   -1.87226051962349    6.63596324176772   -0.02796161482479      C 
   -0.95340206981842    9.01318290046127   -0.04441565844070      C 
    1.78173105956414    8.92053317899808   -0.04079681555371      C 
    2.53179006517238    6.46244264664159   -0.02301219540962      C 
    5.04224005615367    5.63845417352851   -0.01151694843524      C 
    7.12651534927105    5.03017205113957   -0.00119374623540      N 
    2.39533075690730   -3.55109593379421    0.01346468978540      H 
    4.18851221082433    1.11169153941937   -0.00302510686784      H 
   -2.63111302818603   -3.35880859110293    0.02254603992400      H 
   -3.81791042119922    6.07252314948702   -0.02608117543795      H 
   -2.02691660960682   10.73574340790946   -0.05813944226622      H 
    2.99994693731816   10.54566349550179   -0.05040769507975      H 
$end
           -------------------------------------------------
          |                Final Singlepoint                |
           -------------------------------------------------

          ...................................................
          :                      SETUP                      :
          :.................................................:
          :  # basis functions                  62          :
          :  # atomic orbitals                  62          :
          :  # shells                           34          :
          :  # electrons                        64          :
          :  max. iterations                   250          :
          :  Hamiltonian                  GFN2-xTB          :
          :  restarted?                      false          :
          :  GBSA solvation                  false          :
          :  PC potential                    false          :
          :  electronic temp.          300.0000000     K    :
          :  accuracy                    1.0000000          :
          :  -> integral cutoff          0.2500000E+02      :
          :  -> integral neglect         0.1000000E-07      :
          :  -> SCF convergence          0.1000000E-05 Eh   :
          :  -> wf. convergence          0.1000000E-03 e    :
          :  Broyden damping             0.4000000          :
          ...................................................

 iter      E             dE          RMSdq      gap      omega  full diag
   1    -35.1497066 -0.351497E+02  0.102E-04    1.35       0.0  T
   2    -35.1497066  0.635580E-10  0.693E-05    1.35     322.7  T
   3    -35.1497066 -0.985523E-10  0.634E-05    1.35     352.5  T

   *** convergence criteria satisfied after 3 iterations ***

         #    Occupation            Energy/Eh            Energy/eV
      -------------------------------------------------------------
         1        2.0000           -0.6923774             -18.8405
       ...           ...                  ...                  ...
        26        2.0000           -0.4765841             -12.9685
        27        2.0000           -0.4525605             -12.3148
        28        2.0000           -0.4419270             -12.0254
        29        2.0000           -0.4329061             -11.7800
        30        2.0000           -0.4315753             -11.7438
        31        2.0000           -0.4121353             -11.2148
        32        2.0000           -0.4111403             -11.1877 (HOMO)
        33                         -0.3614596              -9.8358 (LUMO)
        34                         -0.2763575              -7.5201
        35                         -0.2378972              -6.4735
        36                         -0.2219831              -6.0405
        37                         -0.2164556              -5.8901
       ...                                ...                  ...
        62                          1.1741743              31.9509
      -------------------------------------------------------------
                  HL-Gap            0.0496807 Eh            1.3519 eV
             Fermi-level           -0.3861581 Eh          -10.5079 eV

 SCC (total)                   0 d,  0 h,  0 min,  0.021 sec
 SCC setup                      ...        0 min,  0.000 sec (  0.748%)
 Dispersion                     ...        0 min,  0.000 sec (  0.882%)
 integral evaluation            ...        0 min,  0.007 sec ( 33.770%)
 zeroth order Hamiltonian       ...        0 min,  0.000 sec (  0.535%)
 iterations                     ...        0 min,  0.003 sec ( 14.425%)
 molecular gradient             ...        0 min,  0.010 sec ( 48.167%)
 printout                       ...        0 min,  0.000 sec (  1.264%)

         :::::::::::::::::::::::::::::::::::::::::::::::::::::
         ::                     SUMMARY                     ::
         :::::::::::::::::::::::::::::::::::::::::::::::::::::
         :: total energy             -34.434224155475 Eh    ::
         :: gradient norm              0.000247753255 Eh/a0 ::
         :: HOMO-LUMO gap              1.351880990670 eV    ::
         ::.................................................::
         :: SCC energy               -35.149706598942 Eh    ::
         :: -> isotropic ES            0.018281412944 Eh    ::
         :: -> anisotropic ES          0.001393523203 Eh    ::
         :: -> anisotropic XC          0.047752021151 Eh    ::
         :: -> dispersion             -0.021462272635 Eh    ::
         :: repulsion energy           0.715406547531 Eh    ::
         :: add. restraining           0.000000000000 Eh    ::
         :::::::::::::::::::::::::::::::::::::::::::::::::::::

           -------------------------------------------------
          |                Property Printout                |
           -------------------------------------------------

    * Orbital Energies and Occupations

         #    Occupation            Energy/Eh            Energy/eV
      -------------------------------------------------------------
         1        2.0000           -0.6923774             -18.8405
       ...           ...                  ...                  ...
        20        2.0000           -0.5021679             -13.6647
        21        2.0000           -0.4929311             -13.4133
        22        2.0000           -0.4847632             -13.1911
        23        2.0000           -0.4818312             -13.1113
        24        2.0000           -0.4812522             -13.0955
        25        2.0000           -0.4769377             -12.9781
        26        2.0000           -0.4765841             -12.9685
        27        2.0000           -0.4525605             -12.3148
        28        2.0000           -0.4419270             -12.0254
        29        2.0000           -0.4329061             -11.7800
        30        2.0000           -0.4315753             -11.7438
        31        2.0000           -0.4121353             -11.2148
        32        2.0000           -0.4111403             -11.1877 (HOMO)
        33                         -0.3614596              -9.8358 (LUMO)
        34                         -0.2763575              -7.5201
        35                         -0.2378972              -6.4735
        36                         -0.2219831              -6.0405
        37                         -0.2164556              -5.8901
        38                         -0.2012672              -5.4768
        39                         -0.1672239              -4.5504
        40                         -0.1306636              -3.5555
        41                         -0.1012261              -2.7545
        42                          0.0404263               1.1001
        43                          0.0618510               1.6831
       ...                                ...                  ...
        62                          1.1741743              31.9509
      -------------------------------------------------------------
                  HL-Gap            0.0496807 Eh            1.3519 eV
             Fermi-level           -0.3861581 Eh          -10.5079 eV

     #   Z        covCN         q      C6AA      α(0)
     1   6 C      3.018    -0.021    28.508     8.758
     2   6 C      2.994    -0.042    29.026     8.838
     3   6 C      3.072     0.040    27.038     8.526
     4   6 C      3.044    -0.000    27.998     8.678
     5   6 C      3.021    -0.012    28.283     8.724
     6   6 C      1.900     0.115    28.263     8.586
     7   7 N      0.911    -0.241    26.291     7.416
     8   6 C      3.072     0.040    27.038     8.526
     9   6 C      2.994    -0.042    29.026     8.838
    10   6 C      3.018    -0.021    28.509     8.758
    11   6 C      3.021    -0.012    28.283     8.724
    12   6 C      3.044    -0.000    27.998     8.679
    13   6 C      1.900     0.115    28.262     8.586
    14   7 N      0.911    -0.241    26.291     7.416
    15   1 H      0.926     0.050     2.318     2.381
    16   1 H      0.926     0.060     2.203     2.321
    17   1 H      0.926     0.051     2.305     2.374
    18   1 H      0.926     0.060     2.204     2.321
    19   1 H      0.926     0.050     2.319     2.381
    20   1 H      0.926     0.051     2.305     2.374

 Mol. C6AA /au·bohr⁶  :       6880.839689
 Mol. C8AA /au·bohr⁸  :     178050.126228
 Mol. α(0) /au        :        133.204467


Wiberg/Mayer (AO) data.
largest (>0.10) Wiberg bond orders for each atom
          total WBO             WBO to atom ...
     1  C   3.946        C    2 1.724    C    5 1.128    H   15 0.971
     2  C   3.986        C    1 1.724    C    3 1.109    H   16 0.963
     3  C   3.981        C    8 1.581    C    2 1.109    C    4 1.034
     4  C   3.982        C    5 1.619    C    6 1.133    C    3 1.034
     5  C   3.945        C    4 1.619    C    1 1.128    H   17 0.972    N    7 0.113
     6  C   3.951        N    7 2.761    C    4 1.133
     7  N   2.999        C    6 2.761    C    5 0.113
     8  C   3.981        C    3 1.581    C    9 1.109    C   12 1.034
     9  C   3.986        C   10 1.724    C    8 1.109    H   18 0.963
    10  C   3.946        C    9 1.724    C   11 1.128    H   19 0.971
    11  C   3.945        C   12 1.619    C   10 1.128    H   20 0.972    N   14 0.113
    12  C   3.982        C   11 1.619    C   13 1.133    C    8 1.034
    13  C   3.951        N   14 2.761    C   12 1.133
    14  N   2.999        C   13 2.761    C   11 0.113
    15  H   0.996        C    1 0.971
    16  H   0.995        C    2 0.963
    17  H   0.997        C    5 0.972
    18  H   0.995        C    9 0.963
    19  H   0.996        C   10 0.971
    20  H   0.997        C   11 0.972

molecular dipole:
                 x           y           z       tot (Debye)
 q only:        0.001       0.001      -0.008
   full:        0.001       0.002      -0.011       0.029
molecular quadrupole (traceless):
                xx          xy          yy          xz          yz          zz
 q only:      -19.153      -4.055      15.737       0.025      -0.104       3.416
  q+dip:      -26.915      -4.301      25.766       0.027      -0.185       1.149
   full:      -31.282      -3.116      24.057       0.024      -0.146       7.225

           -------------------------------------------------
          |                Geometry Summary                 |
           -------------------------------------------------

      molecular mass/u    :      178.1928000
   center of mass at/Å    :        0.0978684       1.9010949      -0.0037632
  moments of inertia/u·Å² :        0.4713197E+03   0.7944075E+03   0.1265720E+04
rotational constants/cm⁻¹ :        0.3576687E-01   0.2122038E-01   0.1331861E-01

 * 13 selected distances

     #   Z        #   Z                                     value/Å
     1   6 C      2   6 C                                 1.3487002
     4   6 C      5   6 C                                 1.3599859
     6   6 C      7   7 N                                 1.1490081
     3   6 C      8   6 C                                 1.3575800
     9   6 C     10   6 C                                 1.3487009
    11   6 C     12   6 C                                 1.3600076 (max)
    13   6 C     14   7 N                                 1.1489750
     1   6 C     15   1 H                                 1.0740872
     2   6 C     16   1 H                                 1.0718723 (min)
     5   6 C     17   1 H                                 1.0747925
     9   6 C     18   1 H                                 1.0718971
    10   6 C     19   1 H                                 1.0740912
    11   6 C     20   1 H                                 1.0747890

 * 3 distinct bonds (by element types)

   Z      Z             #   av. dist./Å        max./Å        min./Å
   1 H    6 C           6     1.0735882     1.0747925     1.0718723
   6 C    6 C           5     1.3549949     1.3600076     1.3487002
   6 C    7 N           2     1.1489915     1.1490081     1.1489750


optimized geometry written to: xtbopt.xyz


           -------------------------------------------------
          | TOTAL ENERGY              -34.434224155475 Eh   |
          | GRADIENT NORM               0.000247753255 Eh/α |
          | HOMO-LUMO GAP               1.351880990670 eV   |
           -------------------------------------------------

------------------------------------------------------------------------
 * finished run on 2021/05/19 at 10:59:09.691     
------------------------------------------------------------------------
 total:
 * wall-time:     0 d,  0 h,  0 min,  0.314 sec
 *  cpu-time:     0 d,  0 h,  0 min,  0.314 sec
 * ratio c/w:     0.999 speedup
 SCF:
 * wall-time:     0 d,  0 h,  0 min,  0.031 sec
 *  cpu-time:     0 d,  0 h,  0 min,  0.031 sec
 * ratio c/w:     1.000 speedup
 ANC optimizer:
 * wall-time:     0 d,  0 h,  0 min,  0.264 sec
 *  cpu-time:     0 d,  0 h,  0 min,  0.264 sec
 * ratio c/w:     1.000 speedup

