      -----------------------------------------------------------      
     |                   =====================                   |     
     |                           x T B                           |     
     |                   =====================                   |     
     |                         S. Grimme                         |     
     |          Mulliken Center for Theoretical Chemistry        |     
     |                    University of Bonn                     |     
     |                Version 6.2 RC2 (SAW190805)                |     
      -----------------------------------------------------------      

   This program is distributed in the hope that it will be useful,
   but WITHOUT ANY WARRANTY; without even the implied warranty of
   MERCHANTABILITY or FITNESS FOR A PARTICULAR PURPOSE.
   
   FOR NON-COMMERCIAL, ACADEMIA USE ONLY.
   
   Cite this work as:
   * S. Grimme, C. Bannwarth, P. Shushkov, J. Chem. Theory Comput., 2017,
     13, 1989-2009. DOI: 10.1021/acs.jctc.7b00118
   * C. Bannwarth, S. Ehlert and S. Grimme., J. Chem. Theory Comput., 2019,
     15, 1652-1671. DOI: 10.1021/acs.jctc.8b01176
   * P. Pracht, E. Caldeweyher, S. Ehlert, S. Grimme, ChemRxiv, 2019, preprint.
     DOI: 10.26434/chemrxiv.8326202.v1
   
   for DFT-D4:
   * E. Caldeweyher, C. Bannwarth and S. Grimme, J. Chem. Phys., 2017,
     147, 034112. DOI: 10.1063/1.4993215
   * E. Caldeweyher, S. Ehlert, A. Hansen, H. Neugebauer, S. Spicher,
     C. Bannwarth and S. Grimme, J. Chem. Phys., 2019, 150, 154122.
     DOI: 10.1063/1.5090222
   
   for sTDA-xTB:
   * S. Grimme and C. Bannwarth, J. Chem. Phys., 2016, 145, 054103.
     DOI: 10.1063/1.4959605
   
   in the mass-spec context:
   * V. Asgeirsson, C. Bauer and S. Grimme, Chem. Sci., 2017, 8, 4879.
     DOI: 10.1039/c7sc00601b
   
   for metadynamics refer to:
   * S. Grimme, J. Chem. Theory Comput., 2019, 155, 2847-2862
     DOI: 10.1021/acs.jctc.9b00143
   
   with help from (in alphabetical order)
   C. Bannwarth, F. Bohle, G. Brandenburg, E. Caldeweyher, M. Checinski,
   S. Dohm, S. Ehlert, S. Ehrlich, F. März, H. Neugebauer, J. Pisarek,
   P. Pracht, P. Shushkov, and S. Spicher.
   
 * started run on 2021/05/19 at 11:01:21.613     

           -------------------------------------------------
          |                Calculation Setup                |
           -------------------------------------------------

          program call               : /ihome/ghutchison/geoffh/xtb/xtb 996.xyz -opt
          hostname                   : smp-n122
          coordinate file            : 996.xyz
          omp threads                :                     1
          number of atoms            :                    32
          number of electrons        :                    78
          charge                     :                     0
          spin                       :                   0.0
          first test random number   :      0.17766310232755


########################################################################
# WARNING! Please study the warnings concerning your input carefully
#  - the use of '-opt' is discouraged, please use '--opt' next time
########################################################################

           ------------------------------------------------- 
          |                 G F N 2 - x T B                 |
          | Geometry, Frequencies, Noncovalent interactions |
          |            JCTC 2019 parametrisation            |
           ------------------------------------------------- 
             KAB for C  - Si     :                1.0500
             KAB for H  - Pd     :                0.9500
             k(s)              :                1.8500
             k(p)              :                2.2300
             k(d)              :                2.2300
             k(f)              :                2.0000
             kEN (H0ij)        :               -2.0000
             D4 a1             :                0.5200
             D4 a2             :                5.0000
             D4 s6             :                1.0000
             D4 s8             :                2.7000
             D4 s9             :                5.0000
             alphaj            :                2.0000

  Z AO/shell   Hii/eV     exponent
  1     Wed Apr 25 08:07:45 CEST 2018   EN: 2.200 GM2: 0.406  GM3: 0.0800  RAES: 1.40
     1s    -10.707211    1.230000
  6     Wed Apr 25 08:07:45 CEST 2018   EN: 2.550 GM2: 0.538  GM3: 0.1500  RAES: 3.00
     2s    -13.970922    2.096432
     2p    -10.063292    1.800000
  8     Wed Apr 25 08:07:45 CEST 2018   EN: 3.440 GM2: 0.452  GM3:-0.0517  RAES: 1.80
     2s    -20.229985    2.439742
     2p    -15.503117    2.137023

           ------------------------------------------------- 
          |        Self-Consistent Charge Iterations        |
           ------------------------------------------------- 

          ...................................................
          :                      SETUP                      :
          :.................................................:
          :  # basis functions                  74          :
          :  # atomic orbitals                  74          :
          :  # shells                           46          :
          :  # electrons                        78          :
          :  max. iterations                   250          :
          :  Hamiltonian                  GFN2-xTB          :
          :  restarted?                      false          :
          :  GBSA solvation                  false          :
          :  PC potential                    false          :
          :  electronic temp.          300.0000000     K    :
          :  accuracy                    1.0000000          :
          :  -> integral cutoff          0.2500000E+02      :
          :  -> integral neglect         0.1000000E-07      :
          :  -> SCF convergence          0.1000000E-05 Eh   :
          :  -> wf. convergence          0.1000000E-03 e    :
          :  Broyden damping             0.4000000          :
          ...................................................

 iter      E             dE          RMSdq      gap      omega  full diag
   1    -43.5053734 -0.435054E+02  0.395E+00    3.64       0.0  T
   2    -43.5781190 -0.727457E-01  0.219E+00    3.75       1.0  T
   3    -43.5783159 -0.196894E-03  0.847E-01    3.56       1.0  T
   4    -43.5797628 -0.144683E-02  0.248E-01    3.79       1.0  T
   5    -43.5810263 -0.126348E-02  0.730E-02    3.71       1.0  T
   6    -43.5810343 -0.802173E-05  0.412E-02    3.71       1.0  T
   7    -43.5810548 -0.205216E-04  0.136E-02    3.71       1.3  T
   8    -43.5810566 -0.181686E-05  0.382E-03    3.71       4.6  T
   9    -43.5810567 -0.121055E-06  0.118E-03    3.71      15.0  T
  10    -43.5810567 -0.164605E-08  0.551E-04    3.71      32.1  T
  11    -43.5810567 -0.708482E-09  0.231E-04    3.71      76.6  T

   *** convergence criteria satisfied after 11 iterations ***

         #    Occupation            Energy/Eh            Energy/eV
      -------------------------------------------------------------
         1        2.0000           -0.7046252             -19.1738
       ...           ...                  ...                  ...
        33        2.0000           -0.4405055             -11.9868
        34        2.0000           -0.4370712             -11.8933
        35        2.0000           -0.4324956             -11.7688
        36        2.0000           -0.4202636             -11.4360
        37        2.0000           -0.4100504             -11.1580
        38        2.0000           -0.3979493             -10.8288
        39        2.0000           -0.3597906              -9.7904 (HOMO)
        40                         -0.2233111              -6.0766 (LUMO)
        41                         -0.2014818              -5.4826
        42                         -0.0875739              -2.3830
        43                          0.0079736               0.2170
        44                          0.0217044               0.5906
       ...                                ...                  ...
        74                          0.6530857              17.7714
      -------------------------------------------------------------
                  HL-Gap            0.1364795 Eh            3.7138 eV
             Fermi-level           -0.2915508 Eh           -7.9335 eV

 SCC (total)                   0 d,  0 h,  0 min,  0.081 sec
 SCC setup                      ...        0 min,  0.000 sec (  0.420%)
 Dispersion                     ...        0 min,  0.000 sec (  0.590%)
 integral evaluation            ...        0 min,  0.010 sec ( 12.043%)
 zeroth order Hamiltonian       ...        0 min,  0.000 sec (  0.212%)
 iterations                     ...        0 min,  0.042 sec ( 51.566%)
 molecular gradient             ...        0 min,  0.028 sec ( 34.604%)
 printout                       ...        0 min,  0.000 sec (  0.502%)

         :::::::::::::::::::::::::::::::::::::::::::::::::::::
         ::                     SUMMARY                     ::
         :::::::::::::::::::::::::::::::::::::::::::::::::::::
         :: total energy             -43.002784212553 Eh    ::
         :: gradient norm              0.043909916411 Eh/a0 ::
         :: HOMO-LUMO gap              3.713796015097 eV    ::
         ::.................................................::
         :: SCC energy               -43.581056733616 Eh    ::
         :: -> isotropic ES            0.034028544995 Eh    ::
         :: -> anisotropic ES          0.007737964941 Eh    ::
         :: -> anisotropic XC          0.016698319108 Eh    ::
         :: -> dispersion             -0.023851392024 Eh    ::
         :: repulsion energy           0.578468408346 Eh    ::
         :: add. restraining           0.000000000000 Eh    ::
         :::::::::::::::::::::::::::::::::::::::::::::::::::::

      ----------------------------------------------------------- 
     |                   =====================                   |
     |                        A N C O P T                        |
     |                   =====================                   |
     |               Approximate Normal Coordinate               |
     |                Rational Function Optimizer                |
      ----------------------------------------------------------- 

          ...................................................
          :                      SETUP                      :
          :.................................................:
          :   optimization level            normal          :
          :   max. optcycles                   200          :
          :   ANC micro-cycles                  20          :
          :   degrees of freedom                90          :
          :.................................................:
          :   RF solver                   davidson          :
          :   input Hessian                  false          :
          :   write xtbopt.log                true          :
          :   linear?                        false          :
          :   energy convergence         0.5000000E-05 Eh   :
          :   grad. convergence          0.1000000E-02 Eh/α :
          :   maximium RF displ.         2.0000000          :
          :   Hlow (freq-cutoff)         0.5000000E-02      :
          :   Hmax (freq-cutoff)         5.0000000          :
          :   S6 in model hess.         20.0000000          :
          ...................................................

generating ANC from model Hessian ...
Using Lindh-Hessian (1995)
 Shifting diagonal of input Hessian by   4.578947266970814E-003
 Lowest  eigenvalues of input Hessian
   -0.000000   -0.000000   -0.000000    0.000000    0.000000    0.000000
    0.005000    0.005567    0.006144    0.006483    0.006608    0.007468
    0.008865    0.012409    0.014071    0.014585    0.014998    0.015751
 Highest eigenvalues
    1.524675    1.594744    1.853427    1.866736    1.996119    2.096666
 

........................................................................
.............................. CYCLE    1 ..............................
........................................................................
   1    -43.5810567 -0.435811E+02  0.655E-05    3.71       0.0  T
   2    -43.5810567 -0.194191E-10  0.407E-05    3.71     434.5  T
   3    -43.5810567 -0.763833E-11  0.272E-05    3.71     649.8  T
     SCC iter.                  ...        0 min,  0.005 sec
     gradient                   ...        0 min,  0.015 sec
 * total energy  :   -43.0027842 Eh     change        0.1416288E-07 Eh
   gradient norm :     0.0439113 Eh/α   predicted     0.0000000E+00 (-100.00%)
   displ. norm   :     0.1599463 α      lambda       -0.3305905E-02
   maximum displ.:     0.0545718 α      in ANC's #9, #5, #1, ...

........................................................................
.............................. CYCLE    2 ..............................
........................................................................
   1    -43.6013577 -0.436014E+02  0.115E-01    3.79       0.0  T
   2    -43.6013647 -0.697266E-05  0.683E-02    3.78       1.0  T
   3    -43.6013547  0.998568E-05  0.203E-02    3.79       1.0  T
   4    -43.6013670 -0.123077E-04  0.323E-03    3.78       5.5  T
   5    -43.6013672 -0.185909E-06  0.158E-03    3.78      11.2  T
   6    -43.6013672 -0.915492E-08  0.675E-04    3.78      26.2  T
     SCC iter.                  ...        0 min,  0.008 sec
     gradient                   ...        0 min,  0.014 sec
 * total energy  :   -43.0049011 Eh     change       -0.2116934E-02 Eh
   gradient norm :     0.0166827 Eh/α   predicted    -0.1695247E-02 ( -19.92%)
   displ. norm   :     0.1391425 α      lambda       -0.6057104E-03
   maximum displ.:     0.0692807 α      in ANC's #9, #5, #7, ...

........................................................................
.............................. CYCLE    3 ..............................
........................................................................
   1    -43.6075249 -0.436075E+02  0.854E-02    3.80       0.0  T
   2    -43.6075299 -0.497530E-05  0.511E-02    3.80       1.0  T
   3    -43.6075239  0.598110E-05  0.162E-02    3.80       1.1  T
   4    -43.6075314 -0.745147E-05  0.285E-03    3.80       6.2  T
   5    -43.6075315 -0.150353E-06  0.132E-03    3.80      13.4  T
   6    -43.6075315 -0.342180E-08  0.505E-04    3.80      35.0  T
     SCC iter.                  ...        0 min,  0.008 sec
     gradient                   ...        0 min,  0.014 sec
 * total energy  :   -43.0052878 Eh     change       -0.3866335E-03 Eh
   gradient norm :     0.0049528 Eh/α   predicted    -0.3087200E-03 ( -20.15%)
   displ. norm   :     0.1488398 α      lambda       -0.2047218E-03
   maximum displ.:     0.0674739 α      in ANC's #5, #9, #1, ...

........................................................................
.............................. CYCLE    4 ..............................
........................................................................
   1    -43.6078678 -0.436079E+02  0.830E-02    3.80       0.0  T
   2    -43.6078712 -0.339835E-05  0.500E-02    3.80       1.0  T
   3    -43.6078676  0.361136E-05  0.127E-02    3.80       1.4  T
   4    -43.6078722 -0.460810E-05  0.266E-03    3.80       6.6  T
   5    -43.6078723 -0.948962E-07  0.128E-03    3.80      13.8  T
   6    -43.6078723 -0.284204E-08  0.458E-04    3.80      38.6  T
     SCC iter.                  ...        0 min,  0.008 sec
     gradient                   ...        0 min,  0.014 sec
 * total energy  :   -43.0054462 Eh     change       -0.1584347E-03 Eh
   gradient norm :     0.0036956 Eh/α   predicted    -0.1046324E-03 ( -33.96%)
   displ. norm   :     0.2541660 α      lambda       -0.2401508E-03
   maximum displ.:     0.1121396 α      in ANC's #5, #1, #4, ...

........................................................................
.............................. CYCLE    5 ..............................
........................................................................
   1    -43.6062571 -0.436063E+02  0.139E-01    3.79       0.0  T
   2    -43.6062632 -0.614130E-05  0.843E-02    3.79       1.0  T
   3    -43.6062567  0.656350E-05  0.178E-02    3.79       1.0  T
   4    -43.6062656 -0.895482E-05  0.407E-03    3.79       4.3  T
   5    -43.6062657 -0.112956E-06  0.205E-03    3.79       8.6  T
   6    -43.6062657 -0.380635E-08  0.592E-04    3.79      29.9  T
   7    -43.6062658 -0.381469E-08  0.184E-04    3.79      96.1  T
     SCC iter.                  ...        0 min,  0.009 sec
     gradient                   ...        0 min,  0.015 sec
 * total energy  :   -43.0056280 Eh     change       -0.1817749E-03 Eh
   gradient norm :     0.0063362 Eh/α   predicted    -0.1278448E-03 ( -29.67%)
   displ. norm   :     0.2992500 α      lambda       -0.2129589E-03
   maximum displ.:     0.1333822 α      in ANC's #1, #5, #4, ...

........................................................................
.............................. CYCLE    6 ..............................
........................................................................
   1    -43.6043358 -0.436043E+02  0.162E-01    3.78       0.0  T
   2    -43.6043410 -0.520765E-05  0.980E-02    3.78       1.0  T
   3    -43.6043363  0.471532E-05  0.169E-02    3.78       1.0  T
   4    -43.6043438 -0.746586E-05  0.446E-03    3.78       4.0  T
   5    -43.6043438 -0.518051E-07  0.194E-03    3.78       9.1  T
   6    -43.6043438 -0.284731E-08  0.416E-04    3.78      42.5  T
     SCC iter.                  ...        0 min,  0.008 sec
     gradient                   ...        0 min,  0.014 sec
 * total energy  :   -43.0057885 Eh     change       -0.1604821E-03 Eh
   gradient norm :     0.0070203 Eh/α   predicted    -0.1160151E-03 ( -27.71%)
   displ. norm   :     0.2848454 α      lambda       -0.1835693E-03
   maximum displ.:     0.1397326 α      in ANC's #1, #4, #5, ...

........................................................................
.............................. CYCLE    7 ..............................
........................................................................
   1    -43.6038870 -0.436039E+02  0.149E-01    3.78       0.0  T
   2    -43.6038905 -0.346649E-05  0.902E-02    3.78       1.0  T
   3    -43.6038892  0.128195E-05  0.120E-02    3.78       1.5  T
   4    -43.6038924 -0.324743E-05  0.408E-03    3.78       4.3  T
   5    -43.6038925 -0.376375E-07  0.144E-03    3.78      12.2  T
   6    -43.6038925 -0.519770E-08  0.302E-04    3.78      58.5  T
     SCC iter.                  ...        0 min,  0.008 sec
     gradient                   ...        0 min,  0.014 sec
 * total energy  :   -43.0059268 Eh     change       -0.1383580E-03 Eh
   gradient norm :     0.0049880 Eh/α   predicted    -0.9923457E-04 ( -28.28%)
   displ. norm   :     0.2407199 α      lambda       -0.1415887E-03
   maximum displ.:     0.1293629 α      in ANC's #1, #4, #3, ...

........................................................................
.............................. CYCLE    8 ..............................
........................................................................
   1    -43.6053741 -0.436054E+02  0.117E-01    3.78       0.0  T
   2    -43.6053762 -0.216904E-05  0.706E-02    3.78       1.0  T
   3    -43.6053762  0.320001E-07  0.726E-03    3.78       2.4  T
   4    -43.6053772 -0.997547E-06  0.319E-03    3.78       5.5  T
   5    -43.6053773 -0.503334E-07  0.138E-03    3.78      12.8  T
   6    -43.6053773 -0.637468E-08  0.375E-04    3.78      47.2  T
     SCC iter.                  ...        0 min,  0.008 sec
     gradient                   ...        0 min,  0.014 sec
 * total energy  :   -43.0060301 Eh     change       -0.1032361E-03 Eh
   gradient norm :     0.0026583 Eh/α   predicted    -0.7490846E-04 ( -27.44%)
   displ. norm   :     0.2180150 α      lambda       -0.8711252E-04
   maximum displ.:     0.1199224 α      in ANC's #1, #4, #3, ...

........................................................................
.............................. CYCLE    9 ..............................
........................................................................
   1    -43.6065641 -0.436066E+02  0.100E-01    3.78       0.0  T
   2    -43.6065653 -0.113802E-05  0.599E-02    3.78       1.0  T
   3    -43.6065655 -0.275881E-06  0.441E-03    3.78       4.0  T
   4    -43.6065658 -0.255859E-06  0.233E-03    3.78       7.6  T
   5    -43.6065658 -0.202340E-07  0.963E-04    3.78      18.4  T
   6    -43.6065658 -0.513278E-08  0.269E-04    3.78      65.7  T
     SCC iter.                  ...        0 min,  0.008 sec
     gradient                   ...        0 min,  0.015 sec
 * total energy  :   -43.0060995 Eh     change       -0.6949084E-04 Eh
   gradient norm :     0.0029817 Eh/α   predicted    -0.4562679E-04 ( -34.34%)
   displ. norm   :     0.2399009 α      lambda       -0.8962994E-04
   maximum displ.:     0.1339116 α      in ANC's #1, #4, #3, ...

........................................................................
.............................. CYCLE   10 ..............................
........................................................................
   1    -43.6077352 -0.436077E+02  0.100E-01    3.78       0.0  T
   2    -43.6077360 -0.783803E-06  0.597E-02    3.78       1.0  T
   3    -43.6077362 -0.234423E-06  0.363E-03    3.78       4.9  T
   4    -43.6077364 -0.168370E-06  0.192E-03    3.78       9.2  T
   5    -43.6077364 -0.660754E-08  0.617E-04    3.78      28.6  T
   6    -43.6077364 -0.272636E-08  0.202E-04    3.78      87.5  T
     SCC iter.                  ...        0 min,  0.008 sec
     gradient                   ...        0 min,  0.015 sec
 * total energy  :   -43.0061753 Eh     change       -0.7579123E-04 Eh
   gradient norm :     0.0036082 Eh/α   predicted    -0.4739801E-04 ( -37.46%)
   displ. norm   :     0.3243800 α      lambda       -0.1160021E-03
   maximum displ.:     0.1813777 α      in ANC's #1, #4, #3, ...

........................................................................
.............................. CYCLE   11 ..............................
........................................................................
   1    -43.6079499 -0.436079E+02  0.129E-01    3.78       0.0  T
   2    -43.6079510 -0.103798E-05  0.766E-02    3.78       1.0  T
   3    -43.6079513 -0.362857E-06  0.399E-03    3.78       4.4  T
   4    -43.6079515 -0.179379E-06  0.223E-03    3.78       7.9  T
   5    -43.6079515 -0.112781E-07  0.707E-04    3.78      25.0  T
   6    -43.6079515 -0.571603E-08  0.228E-04    3.78      77.5  T
     SCC iter.                  ...        0 min,  0.008 sec
     gradient                   ...        0 min,  0.015 sec
 * total energy  :   -43.0062728 Eh     change       -0.9743162E-04 Eh
   gradient norm :     0.0037576 Eh/α   predicted    -0.6411443E-04 ( -34.20%)
   displ. norm   :     0.4084667 α      lambda       -0.1371550E-03
   maximum displ.:     0.2293476 α      in ANC's #1, #4, #3, ...

........................................................................
.............................. CYCLE   12 ..............................
........................................................................
   1    -43.6075781 -0.436076E+02  0.152E-01    3.78       0.0  T
   2    -43.6075794 -0.131082E-05  0.901E-02    3.79       1.0  T
   3    -43.6075799 -0.468457E-06  0.400E-03    3.79       4.4  T
   4    -43.6075800 -0.135150E-06  0.235E-03    3.79       7.5  T
   5    -43.6075800 -0.250231E-07  0.896E-04    3.79      19.7  T
   6    -43.6075800 -0.756695E-08  0.252E-04    3.79      70.2  T
     SCC iter.                  ...        0 min,  0.008 sec
     gradient                   ...        0 min,  0.015 sec
 * total energy  :   -43.0063770 Eh     change       -0.1042033E-03 Eh
   gradient norm :     0.0038945 Eh/α   predicted    -0.8002222E-04 ( -23.21%)
   displ. norm   :     0.3107583 α      lambda       -0.9399839E-04
   maximum displ.:     0.1791091 α      in ANC's #1, #4, #2, ...

........................................................................
.............................. CYCLE   13 ..............................
........................................................................
   1    -43.6072642 -0.436073E+02  0.110E-01    3.78       0.0  T
   2    -43.6072649 -0.712573E-06  0.653E-02    3.79       1.0  T
   3    -43.6072652 -0.235792E-06  0.280E-03    3.79       6.3  T
   4    -43.6072652 -0.640407E-07  0.169E-03    3.79      10.5  T
   5    -43.6072652 -0.171400E-07  0.710E-04    3.79      24.9  T
   6    -43.6072653 -0.577460E-08  0.191E-04    3.79      92.4  T
     SCC iter.                  ...        0 min,  0.008 sec
     gradient                   ...        0 min,  0.015 sec
 * total energy  :   -43.0064452 Eh     change       -0.6822808E-04 Eh
   gradient norm :     0.0033855 Eh/α   predicted    -0.5153815E-04 ( -24.46%)
   displ. norm   :     0.1988685 α      lambda       -0.5739836E-04
   maximum displ.:     0.1219003 α      in ANC's #1, #2, #4, ...

........................................................................
.............................. CYCLE   14 ..............................
........................................................................
   1    -43.6072662 -0.436073E+02  0.685E-02    3.79       0.0  T
   2    -43.6072665 -0.340842E-06  0.407E-02    3.78       1.0  T
   3    -43.6072666 -0.616725E-07  0.234E-03    3.79       7.6  T
   4    -43.6072666 -0.865583E-07  0.117E-03    3.79      15.2  T
   5    -43.6072667 -0.324166E-08  0.385E-04    3.79      45.9  T
   6    -43.6072667 -0.651276E-09  0.129E-04    3.79     136.8  T
     SCC iter.                  ...        0 min,  0.008 sec
     gradient                   ...        0 min,  0.015 sec
 * total energy  :   -43.0064872 Eh     change       -0.4200001E-04 Eh
   gradient norm :     0.0024284 Eh/α   predicted    -0.2983431E-04 ( -28.97%)
   displ. norm   :     0.1591169 α      lambda       -0.3491090E-04
   maximum displ.:     0.1063981 α      in ANC's #1, #2, #3, ...

........................................................................
.............................. CYCLE   15 ..............................
........................................................................
   1    -43.6067895 -0.436068E+02  0.542E-02    3.78       0.0  T
   2    -43.6067897 -0.236866E-06  0.322E-02    3.78       1.0  T
   3    -43.6067897  0.513359E-07  0.243E-03    3.78       7.3  T
   4    -43.6067898 -0.142787E-06  0.876E-04    3.78      20.2  T
   5    -43.6067898 -0.156398E-08  0.408E-04    3.78      43.3  T
     SCC iter.                  ...        0 min,  0.007 sec
     gradient                   ...        0 min,  0.015 sec
 * total energy  :   -43.0065134 Eh     change       -0.2617308E-04 Eh
   gradient norm :     0.0017318 Eh/α   predicted    -0.1789810E-04 ( -31.62%)
   displ. norm   :     0.1513138 α      lambda       -0.2523121E-04
   maximum displ.:     0.1043622 α      in ANC's #1, #2, #8, ...

........................................................................
.............................. CYCLE   16 ..............................
........................................................................
   1    -43.6080656 -0.436081E+02  0.526E-02    3.79       0.0  T
   2    -43.6080660 -0.337663E-06  0.312E-02    3.78       1.0  T
   3    -43.6080657  0.209471E-06  0.330E-03    3.78       5.4  T
   4    -43.6080661 -0.314999E-06  0.970E-04    3.78      18.2  T
   5    -43.6080661 -0.733247E-08  0.466E-04    3.78      37.9  T
     SCC iter.                  ...        0 min,  0.007 sec
     gradient                   ...        0 min,  0.015 sec
 * total energy  :   -43.0065356 Eh     change       -0.2219818E-04 Eh
   gradient norm :     0.0024998 Eh/α   predicted    -0.1274651E-04 ( -42.58%)
   displ. norm   :     0.1174085 α      lambda       -0.2730492E-04
   maximum displ.:     0.0855262 α      in ANC's #1, #2, #3, ...

........................................................................
.............................. CYCLE   17 ..............................
........................................................................
   1    -43.6071406 -0.436071E+02  0.400E-02    3.78       0.0  T
   2    -43.6071408 -0.130017E-06  0.237E-02    3.78       1.0  T
   3    -43.6071407  0.266228E-07  0.160E-03    3.78      11.0  T
   4    -43.6071408 -0.663408E-07  0.584E-04    3.78      30.3  T
   5    -43.6071408 -0.251023E-08  0.292E-04    3.78      60.6  T
     SCC iter.                  ...        0 min,  0.007 sec
     gradient                   ...        0 min,  0.015 sec
 * total energy  :   -43.0065569 Eh     change       -0.2137390E-04 Eh
   gradient norm :     0.0026599 Eh/α   predicted    -0.1384396E-04 ( -35.23%)
   displ. norm   :     0.0998884 α      lambda       -0.2933428E-04
   maximum displ.:     0.0717432 α      in ANC's #1, #2, #3, ...

........................................................................
.............................. CYCLE   18 ..............................
........................................................................
   1    -43.6070448 -0.436070E+02  0.344E-02    3.78       0.0  T
   2    -43.6070449 -0.874071E-07  0.204E-02    3.78       1.0  T
   3    -43.6070449  0.600322E-07  0.179E-03    3.78       9.9  T
   4    -43.6070450 -0.971747E-07  0.551E-04    3.78      32.1  T
   5    -43.6070450 -0.131281E-08  0.244E-04    3.78      72.4  T
     SCC iter.                  ...        0 min,  0.007 sec
     gradient                   ...        0 min,  0.015 sec
 * total energy  :   -43.0065827 Eh     change       -0.2576337E-04 Eh
   gradient norm :     0.0023143 Eh/α   predicted    -0.1481765E-04 ( -42.49%)
   displ. norm   :     0.2201765 α      lambda       -0.5815210E-04
   maximum displ.:     0.1512256 α      in ANC's #1, #2, #4, ...

........................................................................
.............................. CYCLE   19 ..............................
........................................................................
   1    -43.6070062 -0.436070E+02  0.757E-02    3.78       0.0  T
   2    -43.6070066 -0.410094E-06  0.450E-02    3.78       1.0  T
   3    -43.6070065  0.106229E-06  0.324E-03    3.78       5.5  T
   4    -43.6070067 -0.270728E-06  0.122E-03    3.78      14.5  T
   5    -43.6070067 -0.654428E-08  0.525E-04    3.78      33.7  T
   6    -43.6070067 -0.244869E-08  0.174E-04    3.78     101.8  T
     SCC iter.                  ...        0 min,  0.008 sec
     gradient                   ...        0 min,  0.015 sec
 * total energy  :   -43.0066266 Eh     change       -0.4391991E-04 Eh
   gradient norm :     0.0019770 Eh/α   predicted    -0.3048774E-04 ( -30.58%)
   displ. norm   :     0.3148870 α      lambda       -0.3784894E-04
   maximum displ.:     0.2206168 α      in ANC's #1, #2, #4, ...

........................................................................
.............................. CYCLE   20 ..............................
........................................................................
   1    -43.6064371 -0.436064E+02  0.107E-01    3.78       0.0  T
   2    -43.6064379 -0.760334E-06  0.636E-02    3.78       1.0  T
   3    -43.6064378  0.100107E-06  0.392E-03    3.78       4.5  T
   4    -43.6064381 -0.359536E-06  0.157E-03    3.78      11.3  T
   5    -43.6064382 -0.176003E-07  0.683E-04    3.78      25.9  T
   6    -43.6064382 -0.223476E-08  0.198E-04    3.78      89.5  T
     SCC iter.                  ...        0 min,  0.008 sec
     gradient                   ...        0 min,  0.015 sec
 * total energy  :   -43.0066587 Eh     change       -0.3209971E-04 Eh
   gradient norm :     0.0029457 Eh/α   predicted    -0.1976428E-04 ( -38.43%)
   displ. norm   :     0.0842833 α      lambda       -0.2113669E-04
   maximum displ.:     0.0624561 α      in ANC's #1, #2, #4, ...
 * RMSD in coord.:     0.6300676 α      energy gain  -0.3874513E-02 Eh

generating ANC from model Hessian ...
Using Lindh-Hessian (1995)
 Shifting diagonal of input Hessian by   4.474820246070828E-003
 Lowest  eigenvalues of input Hessian
   -0.000000   -0.000000   -0.000000   -0.000000    0.000000    0.000000
    0.005000    0.005392    0.006063    0.006514    0.006546    0.007514
    0.008902    0.013402    0.013603    0.014693    0.015259    0.015409
 Highest eigenvalues
    1.576722    1.658116    1.898352    1.915354    2.041856    2.162077
 

........................................................................
.............................. CYCLE   21 ..............................
........................................................................
   1    -43.6070928 -0.436071E+02  0.273E-02    3.78       0.0  T
   2    -43.6070928 -0.767255E-07  0.161E-02    3.78       1.1  T
   3    -43.6070928  0.377371E-07  0.138E-03    3.78      12.8  T
   4    -43.6070929 -0.570458E-07  0.418E-04    3.78      42.3  T
   5    -43.6070929 -0.248989E-08  0.179E-04    3.78      98.7  T
     SCC iter.                  ...        0 min,  0.007 sec
     gradient                   ...        0 min,  0.015 sec
 * total energy  :   -43.0066751 Eh     change       -0.1633296E-04 Eh
   gradient norm :     0.0019134 Eh/α   predicted     0.0000000E+00 (-100.00%)
   displ. norm   :     0.0563822 α      lambda       -0.1680587E-04
   maximum displ.:     0.0403792 α      in ANC's #1, #6, #4, ...

........................................................................
.............................. CYCLE   22 ..............................
........................................................................
   1    -43.6077501 -0.436078E+02  0.197E-02    3.78       0.0  T
   2    -43.6077503 -0.112774E-06  0.118E-02    3.78       1.5  T
   3    -43.6077501  0.106900E-06  0.232E-03    3.78       7.6  T
   4    -43.6077503 -0.146205E-06  0.581E-04    3.78      30.4  T
   5    -43.6077503 -0.281200E-08  0.300E-04    3.78      58.8  T
     SCC iter.                  ...        0 min,  0.007 sec
     gradient                   ...        0 min,  0.015 sec
 * total energy  :   -43.0066935 Eh     change       -0.1846870E-04 Eh
   gradient norm :     0.0005806 Eh/α   predicted    -0.8415075E-05 ( -54.44%)
   displ. norm   :     0.0526939 α      lambda       -0.9437224E-05
   maximum displ.:     0.0303821 α      in ANC's #1, #10, #12, ...

........................................................................
.............................. CYCLE   23 ..............................
........................................................................
   1    -43.6078208 -0.436078E+02  0.189E-02    3.78       0.0  T
   2    -43.6078209 -0.737353E-07  0.113E-02    3.78       1.6  T
   3    -43.6078208  0.514916E-07  0.168E-03    3.78      10.5  T
   4    -43.6078209 -0.768249E-07  0.468E-04    3.78      37.8  T
   5    -43.6078209 -0.165682E-08  0.248E-04    3.78      71.2  T
     SCC iter.                  ...        0 min,  0.007 sec
     gradient                   ...        0 min,  0.015 sec
 * total energy  :   -43.0067046 Eh     change       -0.1108401E-04 Eh
   gradient norm :     0.0006327 Eh/α   predicted    -0.4726281E-05 ( -57.36%)
   displ. norm   :     0.0866104 α      lambda       -0.1019516E-04
   maximum displ.:     0.0532692 α      in ANC's #1, #10, #12, ...

........................................................................
.............................. CYCLE   24 ..............................
........................................................................
   1    -43.6076506 -0.436077E+02  0.296E-02    3.78       0.0  T
   2    -43.6076507 -0.906678E-07  0.177E-02    3.78       1.0  T
   3    -43.6076507 -0.787231E-08  0.133E-03    3.78      13.3  T
   4    -43.6076507 -0.339854E-07  0.630E-04    3.78      28.1  T
   5    -43.6076507 -0.766875E-09  0.245E-04    3.78      72.2  T
     SCC iter.                  ...        0 min,  0.007 sec
     gradient                   ...        0 min,  0.015 sec
 * total energy  :   -43.0067149 Eh     change       -0.1025945E-04 Eh
   gradient norm :     0.0008075 Eh/α   predicted    -0.5117114E-05 ( -50.12%)
   displ. norm   :     0.0496751 α      lambda       -0.3826387E-05
   maximum displ.:     0.0367177 α      in ANC's #1, #4, #3, ...

........................................................................
.............................. CYCLE   25 ..............................
........................................................................
   1    -43.6077081 -0.436077E+02  0.152E-02    3.78       0.0  T
   2    -43.6077081 -0.173216E-07  0.907E-03    3.78       1.9  T
   3    -43.6077081  0.813578E-08  0.803E-04    3.78      22.0  T
   4    -43.6077081 -0.158134E-07  0.271E-04    3.78      65.2  T
     SCC iter.                  ...        0 min,  0.006 sec
     gradient                   ...        0 min,  0.015 sec
 * total energy  :   -43.0067195 Eh     change       -0.4581080E-05 Eh
   gradient norm :     0.0005426 Eh/α   predicted    -0.1919210E-05 ( -58.11%)
   displ. norm   :     0.0354835 α      lambda       -0.3067511E-05
   maximum displ.:     0.0286028 α      in ANC's #1, #4, #3, ...

   *** GEOMETRY OPTIMIZATION CONVERGED AFTER 25 ITERATIONS ***

------------------------------------------------------------------------
 total energy gain   :        -0.0039352 Eh       -2.4694 kcal/mol
 total RMSD          :         0.6424165 a0        0.3400 Å
 total power (kW/mol):        -0.4132787 (step)  -12.3402 (real)
------------------------------------------------------------------------

 ANCopt (total)                0 d,  0 h,  0 min,  0.837 sec
 optimizer setup                ...        0 min,  0.000 sec (  0.018%)
 model hessian                  ...        0 min,  0.012 sec (  1.460%)
 ANC generation                 ...        0 min,  0.002 sec (  0.230%)
 coordinate transformation      ...        0 min,  0.001 sec (  0.060%)
 single point calculation       ...        0 min,  0.814 sec ( 97.185%)
 optimization log               ...        0 min,  0.003 sec (  0.358%)
 hessian update                 ...        0 min,  0.000 sec (  0.042%)
 rational function              ...        0 min,  0.004 sec (  0.442%)

================
 final structure:
================
$coord
    2.57881706985290    0.64625099984989   -0.28855938781426      C 
    1.00605221238681    2.46152839283953    0.75835808881994      C 
    1.67364179127811    4.90210866651124    1.25910863105444      O 
    4.09811669236978    5.73950025620138    0.53177884652949      C 
    4.27087596831184    8.55910074444882    1.10472039295399      C 
    6.81929909466783    9.63911292832142    0.31933596659482      C 
   -1.47424571551860    1.79356126689105    1.36955814913391      C 
   -2.34685185423694   -0.61076370588926    0.92060855244597      C 
   -0.77166920032575   -2.43605817076434   -0.15625585753031      C 
    1.69695373509582   -1.78341325036988   -0.74248607537146      C 
   -1.83475057391894   -4.75363221576398   -0.54439615337906      O 
   -0.37651972101838   -6.65125338426815   -1.72176421484601      C 
   -2.05416346884209   -8.97074938255554   -2.05794586279960      C 
   -0.63554036178747  -11.12384188052363   -3.33372439325348      C 
    4.51211503986827    1.07872377965196   -0.76892874795943      H 
    4.39221104924061    5.41254844444960   -1.49934785463627      H 
    5.56559186150483    4.70951922405543    1.58361149476130      H 
    3.96883159112352    8.84066821006659    3.12438987645059      H 
    2.75058505638732    9.52384813385199    0.10044220383758      H 
    8.34519425863709    8.70174966686581    1.32855877569989      H 
    6.90220496849832   11.64806615132190    0.73700727262916      H 
    7.12304258802775    9.38194600507187   -1.69755683113573      H 
   -2.68387639127857    3.21098475488661    2.19417957833677      H 
   -4.26121301118586   -1.13460138946982    1.38204283495688      H 
    2.97997934258012   -3.14121250835005   -1.55847724059834      H 
    1.27094517984387   -7.12856720173870   -0.54794522187727      H 
    0.30148179563544   -5.99365800114267   -3.57266610171703      H 
   -3.69407692597309   -8.43324584108597   -3.18616209093980      H 
   -2.73345630635626   -9.56425718702244   -0.20424035929384      H 
    0.04773679735379  -10.54459630009020   -5.18412409947129      H 
   -1.87144954944221  -12.74589476807763   -3.57727122303890      H 
    0.97852175538010  -11.70121249185599   -2.19911035051523      H 
$end
           -------------------------------------------------
          |                Final Singlepoint                |
           -------------------------------------------------

          ...................................................
          :                      SETUP                      :
          :.................................................:
          :  # basis functions                  74          :
          :  # atomic orbitals                  74          :
          :  # shells                           46          :
          :  # electrons                        78          :
          :  max. iterations                   250          :
          :  Hamiltonian                  GFN2-xTB          :
          :  restarted?                      false          :
          :  GBSA solvation                  false          :
          :  PC potential                    false          :
          :  electronic temp.          300.0000000     K    :
          :  accuracy                    1.0000000          :
          :  -> integral cutoff          0.2500000E+02      :
          :  -> integral neglect         0.1000000E-07      :
          :  -> SCF convergence          0.1000000E-05 Eh   :
          :  -> wf. convergence          0.1000000E-03 e    :
          :  Broyden damping             0.4000000          :
          ...................................................

 iter      E             dE          RMSdq      gap      omega  full diag
   1    -43.6077081 -0.436077E+02  0.571E-05    3.78       0.0  T
   2    -43.6077081 -0.120366E-10  0.279E-05    3.78     634.1  T
   3    -43.6077081  0.262901E-12  0.195E-05    3.78     908.7  T

   *** convergence criteria satisfied after 3 iterations ***

         #    Occupation            Energy/Eh            Energy/eV
      -------------------------------------------------------------
         1        2.0000           -0.7055457             -19.1989
       ...           ...                  ...                  ...
        33        2.0000           -0.4398080             -11.9678
        34        2.0000           -0.4387787             -11.9398
        35        2.0000           -0.4337766             -11.8037
        36        2.0000           -0.4159704             -11.3191
        37        2.0000           -0.4127900             -11.2326
        38        2.0000           -0.3996850             -10.8760
        39        2.0000           -0.3573781              -9.7248 (HOMO)
        40                         -0.2183434              -5.9414 (LUMO)
        41                         -0.1984074              -5.3989
        42                         -0.0798395              -2.1725
        43                          0.0144749               0.3939
        44                          0.0261084               0.7104
       ...                                ...                  ...
        74                          0.6862009              18.6725
      -------------------------------------------------------------
                  HL-Gap            0.1390346 Eh            3.7833 eV
             Fermi-level           -0.2878607 Eh           -7.8331 eV

 SCC (total)                   0 d,  0 h,  0 min,  0.030 sec
 SCC setup                      ...        0 min,  0.000 sec (  0.722%)
 Dispersion                     ...        0 min,  0.000 sec (  0.950%)
 integral evaluation            ...        0 min,  0.010 sec ( 32.000%)
 zeroth order Hamiltonian       ...        0 min,  0.000 sec (  0.483%)
 iterations                     ...        0 min,  0.004 sec ( 14.960%)
 molecular gradient             ...        0 min,  0.015 sec ( 49.551%)
 printout                       ...        0 min,  0.000 sec (  1.151%)

         :::::::::::::::::::::::::::::::::::::::::::::::::::::
         ::                     SUMMARY                     ::
         :::::::::::::::::::::::::::::::::::::::::::::::::::::
         :: total energy             -43.006719452084 Eh    ::
         :: gradient norm              0.000542943733 Eh/a0 ::
         :: HOMO-LUMO gap              3.783325354810 eV    ::
         ::.................................................::
         :: SCC energy               -43.607708089812 Eh    ::
         :: -> isotropic ES            0.033177650732 Eh    ::
         :: -> anisotropic ES          0.007108271910 Eh    ::
         :: -> anisotropic XC          0.015342402088 Eh    ::
         :: -> dispersion             -0.023876965954 Eh    ::
         :: repulsion energy           0.601218331031 Eh    ::
         :: add. restraining           0.000000000000 Eh    ::
         :::::::::::::::::::::::::::::::::::::::::::::::::::::

           -------------------------------------------------
          |                Property Printout                |
           -------------------------------------------------

    * Orbital Energies and Occupations

         #    Occupation            Energy/Eh            Energy/eV
      -------------------------------------------------------------
         1        2.0000           -0.7055457             -19.1989
       ...           ...                  ...                  ...
        27        2.0000           -0.4727092             -12.8631
        28        2.0000           -0.4654489             -12.6655
        29        2.0000           -0.4602677             -12.5245
        30        2.0000           -0.4576029             -12.4520
        31        2.0000           -0.4515354             -12.2869
        32        2.0000           -0.4428993             -12.0519
        33        2.0000           -0.4398080             -11.9678
        34        2.0000           -0.4387787             -11.9398
        35        2.0000           -0.4337766             -11.8037
        36        2.0000           -0.4159704             -11.3191
        37        2.0000           -0.4127900             -11.2326
        38        2.0000           -0.3996850             -10.8760
        39        2.0000           -0.3573781              -9.7248 (HOMO)
        40                         -0.2183434              -5.9414 (LUMO)
        41                         -0.1984074              -5.3989
        42                         -0.0798395              -2.1725
        43                          0.0144749               0.3939
        44                          0.0261084               0.7104
        45                          0.0943550               2.5675
        46                          0.1038689               2.8264
        47                          0.1113989               3.0313
        48                          0.1286040               3.4995
        49                          0.1287033               3.5022
        50                          0.1316155               3.5814
       ...                                ...                  ...
        74                          0.6862009              18.6725
      -------------------------------------------------------------
                  HL-Gap            0.1390346 Eh            3.7833 eV
             Fermi-level           -0.2878607 Eh           -7.8331 eV

     #   Z        covCN         q      C6AA      α(0)
     1   6 C      2.919    -0.069    29.723     8.940
     2   6 C      2.862     0.133    25.087     8.210
     3   8 O      1.706    -0.281    18.664     5.833
     4   6 C      3.694     0.085    19.328     6.290
     5   6 C      3.800    -0.061    21.670     6.628
     6   6 C      3.753    -0.108    22.617     6.782
     7   6 C      2.921    -0.054    29.342     8.883
     8   6 C      2.921    -0.054    29.343     8.883
     9   6 C      2.862     0.133    25.086     8.210
    10   6 C      2.919    -0.069    29.724     8.940
    11   8 O      1.706    -0.281    18.665     5.833
    12   6 C      3.694     0.085    19.331     6.290
    13   6 C      3.800    -0.061    21.669     6.628
    14   6 C      3.753    -0.108    22.617     6.782
    15   1 H      0.926     0.033     2.546     2.495
    16   1 H      0.923     0.026     2.650     2.546
    17   1 H      0.923     0.025     2.657     2.549
    18   1 H      0.924     0.049     2.333     2.388
    19   1 H      0.924     0.049     2.329     2.387
    20   1 H      0.925     0.038     2.477     2.461
    21   1 H      0.925     0.044     2.393     2.419
    22   1 H      0.925     0.038     2.477     2.461
    23   1 H      0.926     0.052     2.293     2.368
    24   1 H      0.926     0.052     2.293     2.368
    25   1 H      0.926     0.033     2.546     2.495
    26   1 H      0.923     0.025     2.654     2.547
    27   1 H      0.923     0.026     2.650     2.546
    28   1 H      0.924     0.049     2.332     2.388
    29   1 H      0.924     0.049     2.329     2.387
    30   1 H      0.925     0.038     2.478     2.462
    31   1 H      0.925     0.044     2.393     2.419
    32   1 H      0.925     0.038     2.476     2.461

 Mol. C6AA /au·bohr⁶  :       9222.793786
 Mol. C8AA /au·bohr⁸  :     207309.452058
 Mol. α(0) /au        :        147.278821


Wiberg/Mayer (AO) data.
largest (>0.10) Wiberg bond orders for each atom
          total WBO             WBO to atom ...
     1  C   3.988        C   10 1.419    C    2 1.391    H   15 0.967    C    8 0.105
     2  C   3.935        C    1 1.391    C    7 1.334    O    3 1.052
     3  O   2.213        C    2 1.052    C    4 0.971
     4  C   3.949        C    5 1.002    O    3 0.971    H   16 0.968    H   17 0.967
     5  C   3.994        C    6 1.019    C    4 1.002    H   18 0.977    H   19 0.977
     6  C   3.996        C    5 1.019    H   20 0.988    H   22 0.987    H   21 0.987
     7  C   3.988        C    8 1.495    C    2 1.334    H   23 0.968    C   10 0.105
     8  C   3.988        C    7 1.495    C    9 1.333    H   24 0.968    C    1 0.105
     9  C   3.935        C   10 1.391    C    8 1.333    O   11 1.052
    10  C   3.988        C    1 1.419    C    9 1.391    H   25 0.967    C    7 0.105
    11  O   2.213        C    9 1.052    C   12 0.971
    12  C   3.949        C   13 1.002    O   11 0.971    H   27 0.968    H   26 0.968
    13  C   3.994        C   14 1.020    C   12 1.002    H   28 0.977    H   29 0.977
    14  C   3.996        C   13 1.020    H   32 0.988    H   30 0.987    H   31 0.987
    15  H   0.999        C    1 0.967
    16  H   0.999        C    4 0.968
    17  H   0.999        C    4 0.967
    18  H   0.998        C    5 0.977
    19  H   0.998        C    5 0.977
    20  H   0.999        C    6 0.988
    21  H   0.998        C    6 0.987
    22  H   0.999        C    6 0.987
    23  H   0.997        C    7 0.968
    24  H   0.997        C    8 0.968
    25  H   0.999        C   10 0.967
    26  H   0.999        C   12 0.968
    27  H   0.999        C   12 0.968
    28  H   0.998        C   13 0.977
    29  H   0.998        C   13 0.977
    30  H   0.999        C   14 0.987
    31  H   0.998        C   14 0.987
    32  H   0.999        C   14 0.988

molecular dipole:
                 x           y           z       tot (Debye)
 q only:        0.542      -0.142      -0.314
   full:        0.842      -0.228      -0.436       2.478
molecular quadrupole (traceless):
                xx          xy          yy          xz          yz          zz
 q only:       -1.669       4.414       8.037      -0.617       3.018      -6.368
  q+dip:        0.506       2.232       4.645      -1.069       2.214      -5.151
   full:       -0.333       2.615       5.037      -0.629       2.027      -4.704

           -------------------------------------------------
          |                Geometry Summary                 |
           -------------------------------------------------

      molecular mass/u    :      194.2730000
   center of mass at/Å    :        0.5051687      -0.1047070      -0.1138867
  moments of inertia/u·Å² :        0.2072903E+03   0.2456162E+04   0.2641670E+04
rotational constants/cm⁻¹ :        0.8132378E-01   0.6863405E-02   0.6381430E-02

 * 32 selected distances

     #   Z        #   Z                                     value/Å
     1   6 C      2   6 C                                 1.3864906
     2   6 C      3   8 O                                 1.3649141
     3   8 O      4   6 C                                 1.4108616
     4   6 C      5   6 C                                 1.5253028 (max)
     5   6 C      6   6 C                                 1.5224969
     2   6 C      7   6 C                                 1.3972307
     7   6 C      8   6 C                                 1.3742088
     8   6 C      9   6 C                                 1.3973223
     1   6 C     10   6 C                                 1.3887250
     9   6 C     10   6 C                                 1.3863748
     9   6 C     11   8 O                                 1.3648203
    11   8 O     12   6 C                                 1.4113862
    12   6 C     13   6 C                                 1.5252398
    13   6 C     14   6 C                                 1.5223308
     1   6 C     15   1 H                                 1.0787209
     4   6 C     16   1 H                                 1.0997297
     4   6 C     17   1 H                                 1.0999629
     5   6 C     18   1 H                                 1.0908724
     5   6 C     19   1 H                                 1.0910034
     6   6 C     20   1 H                                 1.0877826
     6   6 C     21   1 H                                 1.0867111
     6   6 C     22   1 H                                 1.0878746
     7   6 C     23   1 H                                 1.0783142
     8   6 C     24   1 H                                 1.0782896 (min)
    10   6 C     25   1 H                                 1.0787451
    12   6 C     26   1 H                                 1.0998514
    12   6 C     27   1 H                                 1.0996140
    13   6 C     28   1 H                                 1.0910678
    13   6 C     29   1 H                                 1.0909159
    14   6 C     30   1 H                                 1.0878901
    14   6 C     31   1 H                                 1.0867918
    14   6 C     32   1 H                                 1.0878297

 * 3 distinct bonds (by element types)

   Z      Z             #   av. dist./Å        max./Å        min./Å
   1 H    6 C          18     1.0889982     1.0999629     1.0782896
   6 C    6 C          10     1.4425723     1.5253028     1.3742088
   6 C    8 O           4     1.3879956     1.4113862     1.3648203


optimized geometry written to: xtbopt.xyz


           -------------------------------------------------
          | TOTAL ENERGY              -43.006719452084 Eh   |
          | GRADIENT NORM               0.000542943733 Eh/α |
          | HOMO-LUMO GAP               3.783325354810 eV   |
           -------------------------------------------------

------------------------------------------------------------------------
 * finished run on 2021/05/19 at 11:01:22.595     
------------------------------------------------------------------------
 total:
 * wall-time:     0 d,  0 h,  0 min,  0.982 sec
 *  cpu-time:     0 d,  0 h,  0 min,  0.917 sec
 * ratio c/w:     0.934 speedup
 SCF:
 * wall-time:     0 d,  0 h,  0 min,  0.081 sec
 *  cpu-time:     0 d,  0 h,  0 min,  0.042 sec
 * ratio c/w:     0.517 speedup
 ANC optimizer:
 * wall-time:     0 d,  0 h,  0 min,  0.868 sec
 *  cpu-time:     0 d,  0 h,  0 min,  0.855 sec
 * ratio c/w:     0.985 speedup

