      -----------------------------------------------------------      
     |                   =====================                   |     
     |                           x T B                           |     
     |                   =====================                   |     
     |                         S. Grimme                         |     
     |          Mulliken Center for Theoretical Chemistry        |     
     |                    University of Bonn                     |     
     |                Version 6.2 RC2 (SAW190805)                |     
      -----------------------------------------------------------      

   This program is distributed in the hope that it will be useful,
   but WITHOUT ANY WARRANTY; without even the implied warranty of
   MERCHANTABILITY or FITNESS FOR A PARTICULAR PURPOSE.
   
   FOR NON-COMMERCIAL, ACADEMIA USE ONLY.
   
   Cite this work as:
   * S. Grimme, C. Bannwarth, P. Shushkov, J. Chem. Theory Comput., 2017,
     13, 1989-2009. DOI: 10.1021/acs.jctc.7b00118
   * C. Bannwarth, S. Ehlert and S. Grimme., J. Chem. Theory Comput., 2019,
     15, 1652-1671. DOI: 10.1021/acs.jctc.8b01176
   * P. Pracht, E. Caldeweyher, S. Ehlert, S. Grimme, ChemRxiv, 2019, preprint.
     DOI: 10.26434/chemrxiv.8326202.v1
   
   for DFT-D4:
   * E. Caldeweyher, C. Bannwarth and S. Grimme, J. Chem. Phys., 2017,
     147, 034112. DOI: 10.1063/1.4993215
   * E. Caldeweyher, S. Ehlert, A. Hansen, H. Neugebauer, S. Spicher,
     C. Bannwarth and S. Grimme, J. Chem. Phys., 2019, 150, 154122.
     DOI: 10.1063/1.5090222
   
   for sTDA-xTB:
   * S. Grimme and C. Bannwarth, J. Chem. Phys., 2016, 145, 054103.
     DOI: 10.1063/1.4959605
   
   in the mass-spec context:
   * V. Asgeirsson, C. Bauer and S. Grimme, Chem. Sci., 2017, 8, 4879.
     DOI: 10.1039/c7sc00601b
   
   for metadynamics refer to:
   * S. Grimme, J. Chem. Theory Comput., 2019, 155, 2847-2862
     DOI: 10.1021/acs.jctc.9b00143
   
   with help from (in alphabetical order)
   C. Bannwarth, F. Bohle, G. Brandenburg, E. Caldeweyher, M. Checinski,
   S. Dohm, S. Ehlert, S. Ehrlich, F. März, H. Neugebauer, J. Pisarek,
   P. Pracht, P. Shushkov, and S. Spicher.
   
 * started run on 2021/02/19 at 08:08:49.610     

           -------------------------------------------------
          |                Calculation Setup                |
           -------------------------------------------------

          program call               : /ihome/ghutchison/geoffh/xtb/xtb 10atl.xyz -opt
          hostname                   : smp-n167
          coordinate file            : 10atl.xyz
          omp threads                :                     1
          number of atoms            :                    24
          number of electrons        :                    90
          charge                     :                     0
          spin                       :                   0.0
          first test random number   :      0.89155814460592


########################################################################
# WARNING! Please study the warnings concerning your input carefully
#  - the use of '-opt' is discouraged, please use '--opt' next time
########################################################################

           ------------------------------------------------- 
          |                 G F N 2 - x T B                 |
          | Geometry, Frequencies, Noncovalent interactions |
          |            JCTC 2019 parametrisation            |
           ------------------------------------------------- 
             KAB for C  - Si     :                1.0500
             KAB for H  - Pd     :                0.9500
             k(s)              :                1.8500
             k(p)              :                2.2300
             k(d)              :                2.2300
             k(f)              :                2.0000
             kEN (H0ij)        :               -2.0000
             D4 a1             :                0.5200
             D4 a2             :                5.0000
             D4 s6             :                1.0000
             D4 s8             :                2.7000
             D4 s9             :                5.0000
             alphaj            :                2.0000

  Z AO/shell   Hii/eV     exponent
  1     Wed Apr 25 08:07:45 CEST 2018   EN: 2.200 GM2: 0.406  GM3: 0.0800  RAES: 1.40
     1s    -10.707211    1.230000
  6     Wed Apr 25 08:07:45 CEST 2018   EN: 2.550 GM2: 0.538  GM3: 0.1500  RAES: 3.00
     2s    -13.970922    2.096432
     2p    -10.063292    1.800000
  7     Wed Apr 25 08:07:45 CEST 2018   EN: 3.040 GM2: 0.461  GM3:-0.0640  RAES: 1.90
     2s    -16.686243    2.339881
     2p    -12.523956    2.014332
  8     Wed Apr 25 08:07:45 CEST 2018   EN: 3.440 GM2: 0.452  GM3:-0.0517  RAES: 1.80
     2s    -20.229985    2.439742
     2p    -15.503117    2.137023

           ------------------------------------------------- 
          |        Self-Consistent Charge Iterations        |
           ------------------------------------------------- 

          ...................................................
          :                      SETUP                      :
          :.................................................:
          :  # basis functions                  84          :
          :  # atomic orbitals                  84          :
          :  # shells                           44          :
          :  # electrons                        90          :
          :  max. iterations                   250          :
          :  Hamiltonian                  GFN2-xTB          :
          :  restarted?                      false          :
          :  GBSA solvation                  false          :
          :  PC potential                    false          :
          :  electronic temp.          300.0000000     K    :
          :  accuracy                    1.0000000          :
          :  -> integral cutoff          0.2500000E+02      :
          :  -> integral neglect         0.1000000E-07      :
          :  -> SCF convergence          0.1000000E-05 Eh   :
          :  -> wf. convergence          0.1000000E-03 e    :
          :  Broyden damping             0.4000000          :
          ...................................................

 iter      E             dE          RMSdq      gap      omega  full diag
   1    -50.5387821 -0.505388E+02  0.771E+00    2.34       0.0  T
   2    -50.5381364  0.645731E-03  0.523E+00    2.18       1.0  T
   3    -50.5308492  0.728716E-02  0.352E+00    1.81       1.0  T
   4    -50.6894181 -0.158569E+00  0.545E-01    1.92       1.0  T
   5    -50.6938083 -0.439015E-02  0.223E-01    1.89       1.0  T
   6    -50.6940269 -0.218565E-03  0.104E-01    1.93       1.0  T
   7    -50.6941501 -0.123192E-03  0.461E-02    1.93       1.0  T
   8    -50.6941736 -0.235064E-04  0.175E-02    1.92       1.2  T
   9    -50.6941790 -0.540609E-05  0.664E-03    1.92       3.1  T
  10    -50.6941792 -0.187633E-06  0.324E-03    1.92       6.3  T
  11    -50.6941793 -0.118559E-06  0.134E-03    1.92      15.3  T
  12    -50.6941793 -0.226717E-07  0.485E-04    1.92      42.1  T
  13    -50.6941793  0.221590E-09  0.272E-04    1.92      75.0  T

   *** convergence criteria satisfied after 13 iterations ***

         #    Occupation            Energy/Eh            Energy/eV
      -------------------------------------------------------------
         1        2.0000           -0.7547387             -20.5375
       ...           ...                  ...                  ...
        39        2.0000           -0.4719286             -12.8418
        40        2.0000           -0.4714990             -12.8301
        41        2.0000           -0.4617101             -12.5638
        42        2.0000           -0.4592182             -12.4960
        43        2.0000           -0.4574339             -12.4474
        44        2.0000           -0.4530419             -12.3279
        45        2.0000           -0.4388796             -11.9425 (HOMO)
        46                         -0.3682465             -10.0205 (LUMO)
        47                         -0.3529112              -9.6032
        48                         -0.3079485              -8.3797
        49                         -0.3007732              -8.1845
        50                         -0.2722539              -7.4084
       ...                                ...                  ...
        84                          1.1536432              31.3922
      -------------------------------------------------------------
                  HL-Gap            0.0706331 Eh            1.9220 eV
             Fermi-level           -0.4035631 Eh          -10.9815 eV

 SCC (total)                   0 d,  0 h,  0 min,  0.066 sec
 SCC setup                      ...        0 min,  0.000 sec (  0.324%)
 Dispersion                     ...        0 min,  0.000 sec (  0.451%)
 integral evaluation            ...        0 min,  0.028 sec ( 42.384%)
 zeroth order Hamiltonian       ...        0 min,  0.000 sec (  0.280%)
 iterations                     ...        0 min,  0.022 sec ( 33.280%)
 molecular gradient             ...        0 min,  0.015 sec ( 22.818%)
 printout                       ...        0 min,  0.000 sec (  0.437%)

         :::::::::::::::::::::::::::::::::::::::::::::::::::::
         ::                     SUMMARY                     ::
         :::::::::::::::::::::::::::::::::::::::::::::::::::::
         :: total energy             -49.702550231763 Eh    ::
         :: gradient norm              0.000296189023 Eh/a0 ::
         :: HOMO-LUMO gap              1.922023364112 eV    ::
         ::.................................................::
         :: SCC energy               -50.694179299054 Eh    ::
         :: -> isotropic ES            0.052175928228 Eh    ::
         :: -> anisotropic ES          0.003542407189 Eh    ::
         :: -> anisotropic XC          0.078326111797 Eh    ::
         :: -> dispersion             -0.030757025737 Eh    ::
         :: repulsion energy           0.991665295994 Eh    ::
         :: add. restraining           0.000000000000 Eh    ::
         :::::::::::::::::::::::::::::::::::::::::::::::::::::

      ----------------------------------------------------------- 
     |                   =====================                   |
     |                        A N C O P T                        |
     |                   =====================                   |
     |               Approximate Normal Coordinate               |
     |                Rational Function Optimizer                |
      ----------------------------------------------------------- 

          ...................................................
          :                      SETUP                      :
          :.................................................:
          :   optimization level            normal          :
          :   max. optcycles                   200          :
          :   ANC micro-cycles                  20          :
          :   degrees of freedom                66          :
          :.................................................:
          :   RF solver                   davidson          :
          :   input Hessian                  false          :
          :   write xtbopt.log                true          :
          :   linear?                        false          :
          :   energy convergence         0.5000000E-05 Eh   :
          :   grad. convergence          0.1000000E-02 Eh/α :
          :   maximium RF displ.         2.0000000          :
          :   Hlow (freq-cutoff)         0.5000000E-02      :
          :   Hmax (freq-cutoff)         5.0000000          :
          :   S6 in model hess.         20.0000000          :
          ...................................................

generating ANC from model Hessian ...
Using Lindh-Hessian (1995)
 Shifting diagonal of input Hessian by   4.983977629956606E-003
 Lowest  eigenvalues of input Hessian
   -0.000000   -0.000000   -0.000000    0.000000    0.000000    0.000000
    0.005000    0.005143    0.005232    0.006068    0.007104    0.008340
    0.009017    0.013037    0.016320    0.016950    0.020473    0.021770
 Highest eigenvalues
    2.032159    2.295443    2.608667    2.620012    2.631169    2.645722
 

........................................................................
.............................. CYCLE    1 ..............................
........................................................................
   1    -50.6941793 -0.506942E+02  0.936E-05    1.92       0.0  T
   2    -50.6941793  0.566303E-11  0.815E-05    1.92     250.5  T
   3    -50.6941793 -0.154607E-09  0.302E-05    1.92     675.6  T
     SCC iter.                  ...        0 min,  0.004 sec
     gradient                   ...        0 min,  0.015 sec
 * total energy  :   -49.7025502 Eh     change        0.4265091E-07 Eh
   gradient norm :     0.0002973 Eh/α   predicted     0.0000000E+00 (-100.00%)
   displ. norm   :     0.0057614 α      lambda       -0.1569997E-06
   maximum displ.:     0.0035587 α      in ANC's #1, #5, #2, ...

........................................................................
.............................. CYCLE    2 ..............................
........................................................................
   1    -50.6941642 -0.506942E+02  0.525E-03    1.92       0.0  T
   2    -50.6941642 -0.754438E-08  0.293E-03    1.92       7.0  T
   3    -50.6941642 -0.415639E-09  0.382E-04    1.92      53.5  T
   4    -50.6941642 -0.284033E-08  0.121E-04    1.92     168.1  T
     SCC iter.                  ...        0 min,  0.006 sec
     gradient                   ...        0 min,  0.015 sec
 * total energy  :   -49.7025502 Eh     change        0.3417760E-07 Eh
   gradient norm :     0.0003065 Eh/α   predicted    -0.7889192E-07 (-330.83%)
   displ. norm   :     0.0133265 α      lambda       -0.4895521E-06
   maximum displ.:     0.0116201 α      in ANC's #5, #1, #3, ...

........................................................................
.............................. CYCLE    3 ..............................
........................................................................
   1    -50.6941351 -0.506941E+02  0.102E-02    1.92       0.0  T
   2    -50.6941351 -0.245048E-07  0.572E-03    1.92       3.6  T
   3    -50.6941351  0.383915E-08  0.851E-04    1.92      24.0  T
   4    -50.6941351 -0.147542E-07  0.276E-04    1.92      74.0  T
     SCC iter.                  ...        0 min,  0.006 sec
     gradient                   ...        0 min,  0.015 sec
 * total energy  :   -49.7025498 Eh     change        0.3729791E-06 Eh
   gradient norm :     0.0013390 Eh/α   predicted    -0.2469954E-06 (-166.22%)
   displ. norm   :     0.0095772 α      lambda       -0.1235461E-05
   maximum displ.:     0.0063811 α      in ANC's #1, #13, #5, ...

........................................................................
.............................. CYCLE    4 ..............................
........................................................................
   1    -50.6941447 -0.506941E+02  0.134E-02    1.92       0.0  T
   2    -50.6941447 -0.560134E-07  0.736E-03    1.92       2.8  T
   3    -50.6941448 -0.209184E-07  0.435E-04    1.92      46.9  T
   4    -50.6941448 -0.302744E-08  0.199E-04    1.92     102.6  T
     SCC iter.                  ...        0 min,  0.006 sec
     gradient                   ...        0 min,  0.015 sec
 * total energy  :   -49.7025499 Eh     change       -0.1033431E-06 Eh
   gradient norm :     0.0008010 Eh/α   predicted    -0.6222632E-06 ( 502.13%)
   displ. norm   :     0.0127694 α      lambda       -0.2176796E-05
   maximum displ.:     0.0088799 α      in ANC's #2, #6, #1, ...

   *** GEOMETRY OPTIMIZATION CONVERGED AFTER 4 ITERATIONS ***

------------------------------------------------------------------------
 total energy gain   :         0.0000003 Eh        0.0002 kcal/mol
 total RMSD          :         0.0049990 a0        0.0026 Å
 total power (kW/mol):         0.0002274 (step)    0.0062 (real)
------------------------------------------------------------------------

 ANCopt (total)                0 d,  0 h,  0 min,  0.147 sec
 optimizer setup                ...        0 min,  0.000 sec (  0.046%)
 model hessian                  ...        0 min,  0.003 sec (  1.788%)
 ANC generation                 ...        0 min,  0.001 sec (  0.373%)
 coordinate transformation      ...        0 min,  0.000 sec (  0.015%)
 single point calculation       ...        0 min,  0.143 sec ( 97.345%)
 optimization log               ...        0 min,  0.000 sec (  0.154%)
 hessian update                 ...        0 min,  0.000 sec (  0.016%)
 rational function              ...        0 min,  0.000 sec (  0.180%)

================
 final structure:
================
$coord
   -2.25377062107923    0.12347553396596   -0.62544025643533      C 
   -0.75365952968813    2.25574496984777   -0.34704773963461      C 
    1.84339895410370    2.02746612510882   -0.73191874424997      C 
    3.40825877093806    4.18497308782798   -0.45467305167872      C 
    4.65844131030710    5.93461682506276   -0.22682224201503      N 
    2.94393327653085   -0.30668174085216   -1.39061540425961      C 
    5.58796215114557   -0.47385247341593   -1.77145435703710      C 
    7.72218130511210   -0.64507093514400   -2.08082358337019      N 
    1.43278691495602   -2.44810277244012   -1.66763338659217      C 
   -1.13493940277571   -2.20352134257259   -1.28180827464367      C 
   -3.10202604645979   -4.18062997326822   -1.45988681309520      C 
   -2.82767385807089   -6.37922530006238   -1.98125722018428      O 
   -5.53719927755215   -2.87428743650287   -0.85002113152045      C 
   -4.97954080863676   -0.21010068771235   -0.34965189557557      C 
   -6.68579605260188    1.62145827803009    0.25250334965393      C 
   -6.05797539050098    4.17823078961928    0.71541935150066      C 
   -5.65357349398360    6.27067705608431    1.10472092442618      N 
   -9.31748271462251    1.21486951960227    0.49072303009831      C 
  -11.46217067710450    1.00991649922151    0.71687215276465      N 
   -7.72902506184798   -4.12412877598512   -0.81792915076301      C 
   -1.52646461740591    4.07340921873584    0.15509111387864      H 
    2.24484998746358   -4.25074546606534   -2.17016026929898      H 
   -7.71547592811303   -6.11672377919585   -1.24977027239899      H 
   -9.52208931052048   -3.27051315352946   -0.38571601996795      H 
$end
           -------------------------------------------------
          |                Final Singlepoint                |
           -------------------------------------------------

          ...................................................
          :                      SETUP                      :
          :.................................................:
          :  # basis functions                  84          :
          :  # atomic orbitals                  84          :
          :  # shells                           44          :
          :  # electrons                        90          :
          :  max. iterations                   250          :
          :  Hamiltonian                  GFN2-xTB          :
          :  restarted?                      false          :
          :  GBSA solvation                  false          :
          :  PC potential                    false          :
          :  electronic temp.          300.0000000     K    :
          :  accuracy                    1.0000000          :
          :  -> integral cutoff          0.2500000E+02      :
          :  -> integral neglect         0.1000000E-07      :
          :  -> SCF convergence          0.1000000E-05 Eh   :
          :  -> wf. convergence          0.1000000E-03 e    :
          :  Broyden damping             0.4000000          :
          ...................................................

 iter      E             dE          RMSdq      gap      omega  full diag
   1    -50.6941448 -0.506941E+02  0.968E-05    1.92       0.0  T
   2    -50.6941448 -0.109992E-10  0.687E-05    1.92     297.1  T
   3    -50.6941448 -0.123720E-09  0.290E-05    1.92     703.4  T

   *** convergence criteria satisfied after 3 iterations ***

         #    Occupation            Energy/Eh            Energy/eV
      -------------------------------------------------------------
         1        2.0000           -0.7547401             -20.5375
       ...           ...                  ...                  ...
        39        2.0000           -0.4719296             -12.8419
        40        2.0000           -0.4715068             -12.8304
        41        2.0000           -0.4617139             -12.5639
        42        2.0000           -0.4592137             -12.4958
        43        2.0000           -0.4574301             -12.4473
        44        2.0000           -0.4530407             -12.3279
        45        2.0000           -0.4388810             -11.9426 (HOMO)
        46                         -0.3682516             -10.0206 (LUMO)
        47                         -0.3529086              -9.6031
        48                         -0.3079435              -8.3796
        49                         -0.3007624              -8.1842
        50                         -0.2723096              -7.4099
       ...                                ...                  ...
        84                          1.1542262              31.4081
      -------------------------------------------------------------
                  HL-Gap            0.0706294 Eh            1.9219 eV
             Fermi-level           -0.4035663 Eh          -10.9816 eV

 SCC (total)                   0 d,  0 h,  0 min,  0.048 sec
 SCC setup                      ...        0 min,  0.000 sec (  0.307%)
 Dispersion                     ...        0 min,  0.000 sec (  0.404%)
 integral evaluation            ...        0 min,  0.015 sec ( 31.073%)
 zeroth order Hamiltonian       ...        0 min,  0.000 sec (  0.356%)
 iterations                     ...        0 min,  0.004 sec (  8.973%)
 molecular gradient             ...        0 min,  0.028 sec ( 58.304%)
 printout                       ...        0 min,  0.000 sec (  0.557%)

         :::::::::::::::::::::::::::::::::::::::::::::::::::::
         ::                     SUMMARY                     ::
         :::::::::::::::::::::::::::::::::::::::::::::::::::::
         :: total energy             -49.702549868511 Eh    ::
         :: gradient norm              0.000800260601 Eh/a0 ::
         :: HOMO-LUMO gap              1.921922471279 eV    ::
         ::.................................................::
         :: SCC energy               -50.694144754364 Eh    ::
         :: -> isotropic ES            0.052170365809 Eh    ::
         :: -> anisotropic ES          0.003541377496 Eh    ::
         :: -> anisotropic XC          0.078327616781 Eh    ::
         :: -> dispersion             -0.030756929135 Eh    ::
         :: repulsion energy           0.991631084713 Eh    ::
         :: add. restraining           0.000000000000 Eh    ::
         :::::::::::::::::::::::::::::::::::::::::::::::::::::

           -------------------------------------------------
          |                Property Printout                |
           -------------------------------------------------

    * Orbital Energies and Occupations

         #    Occupation            Energy/Eh            Energy/eV
      -------------------------------------------------------------
         1        2.0000           -0.7547401             -20.5375
       ...           ...                  ...                  ...
        33        2.0000           -0.5111835             -13.9100
        34        2.0000           -0.5097611             -13.8713
        35        2.0000           -0.5078232             -13.8186
        36        2.0000           -0.5051387             -13.7455
        37        2.0000           -0.4947508             -13.4629
        38        2.0000           -0.4794630             -13.0469
        39        2.0000           -0.4719296             -12.8419
        40        2.0000           -0.4715068             -12.8304
        41        2.0000           -0.4617139             -12.5639
        42        2.0000           -0.4592137             -12.4958
        43        2.0000           -0.4574301             -12.4473
        44        2.0000           -0.4530407             -12.3279
        45        2.0000           -0.4388810             -11.9426 (HOMO)
        46                         -0.3682516             -10.0206 (LUMO)
        47                         -0.3529086              -9.6031
        48                         -0.3079435              -8.3796
        49                         -0.3007624              -8.1842
        50                         -0.2723096              -7.4099
        51                         -0.2484693              -6.7612
        52                         -0.2471386              -6.7250
        53                         -0.2403285              -6.5397
        54                         -0.2278870              -6.2011
        55                         -0.2144734              -5.8361
        56                         -0.2061129              -5.6086
       ...                                ...                  ...
        84                          1.1542262              31.4081
      -------------------------------------------------------------
                  HL-Gap            0.0706294 Eh            1.9219 eV
             Fermi-level           -0.4035663 Eh          -10.9816 eV

     #   Z        covCN         q      C6AA      α(0)
     1   6 C      3.026     0.017    27.603     8.618
     2   6 C      2.920    -0.018    28.461     8.749
     3   6 C      2.979     0.040    27.106     8.540
     4   6 C      1.911     0.116    28.243     8.583
     5   7 N      0.911    -0.182    24.954     7.225
     6   6 C      2.980     0.037    27.160     8.549
     7   6 C      1.910     0.116    28.241     8.582
     8   7 N      0.911    -0.186    25.026     7.235
     9   6 C      2.918    -0.005    28.140     8.699
    10   6 C      3.031    -0.009    28.201     8.711
    11   6 C      2.862     0.230    23.175     7.891
    12   8 O      0.856    -0.328    20.292     6.040
    13   6 C      2.994    -0.013    28.323     8.730
    14   6 C      3.006     0.033    27.245     8.562
    15   6 C      2.947     0.026    27.432     8.590
    16   6 C      1.935     0.124    28.034     8.550
    17   7 N      0.911    -0.202    25.394     7.288
    18   6 C      1.935     0.126    27.993     8.544
    19   7 N      0.911    -0.202    25.382     7.287
    20   6 C      2.840    -0.050    29.231     8.860
    21   1 H      0.926     0.071     2.071     2.251
    22   1 H      0.926     0.079     1.994     2.208
    23   1 H      0.926     0.095     1.827     2.114
    24   1 H      0.926     0.082     1.954     2.186

 Mol. C6AA /au·bohr⁶  :      11851.752267
 Mol. C8AA /au·bohr⁸  :     310544.293831
 Mol. α(0) /au        :        172.591130


Wiberg/Mayer (AO) data.
largest (>0.10) Wiberg bond orders for each atom
          total WBO             WBO to atom ...
     1  C   3.968        C    2 1.398    C   10 1.287    C   14 1.091
     2  C   3.978        C    1 1.398    C    3 1.380    H   21 0.958
     3  C   3.985        C    2 1.380    C    6 1.289    C    4 1.088
     4  C   3.951        N    5 2.822    C    3 1.088
     5  N   2.993        C    4 2.822
     6  C   3.975        C    9 1.366    C    3 1.289    C    7 1.091
     7  C   3.950        N    8 2.817    C    6 1.091
     8  N   2.987        C    7 2.817
     9  C   3.984        C   10 1.425    C    6 1.366    H   22 0.962
    10  C   3.959        C    9 1.425    C    1 1.287    C   11 1.015
    11  C   3.929        O   12 1.826    C   10 1.015    C   13 0.991
    12  O   2.094        C   11 1.826
    13  C   3.986        C   20 1.797    C   14 1.083    C   11 0.991
    14  C   3.982        C   15 1.546    C    1 1.091    C   13 1.083
    15  C   3.982        C   14 1.546    C   16 1.085    C   18 1.084
    16  C   3.949        N   17 2.785    C   15 1.085
    17  N   2.991        C   16 2.785
    18  C   3.949        N   19 2.787    C   15 1.084
    19  N   2.992        C   18 2.787
    20  C   3.938        C   13 1.797    H   23 0.966    H   24 0.965
    21  H   0.993        C    2 0.958
    22  H   0.992        C    9 0.962
    23  H   0.990        C   20 0.966
    24  H   0.992        C   20 0.965

molecular dipole:
                 x           y           z       tot (Debye)
 q only:       -0.676      -0.760      -0.065
   full:       -1.093      -1.298      -0.126       4.325
molecular quadrupole (traceless):
                xx          xy          yy          xz          yz          zz
 q only:       -7.909       4.796      -5.396       4.694      -3.930      13.305
  q+dip:      -14.645       4.309      -4.551       6.750      -4.252      19.197
   full:      -19.661       2.519      -7.546       8.129      -6.563      27.207

           -------------------------------------------------
          |                Geometry Summary                 |
           -------------------------------------------------

      molecular mass/u    :      256.2228000
   center of mass at/Å    :       -1.0669156       0.1027856      -0.3423706
  moments of inertia/u·Å² :        0.8751430E+03   0.1983108E+04   0.2858215E+04
rotational constants/cm⁻¹ :        0.1926272E-01   0.8500612E-02   0.5897959E-02

 * 17 selected distances

     #   Z        #   Z                                     value/Å
     1   6 C      2   6 C                                 1.3874548
     2   6 C      3   6 C                                 1.3945553
     4   6 C      5   7 N                                 1.1443115
     3   6 C      6   6 C                                 1.4093714
     7   6 C      8   7 N                                 1.1447752
     6   6 C      9   6 C                                 1.3946593
     1   6 C     10   6 C                                 1.4097899 (max)
     9   6 C     10   6 C                                 1.3801182
    11   6 C     12   8 O                                 1.2044937
    14   6 C     15   6 C                                 1.3624137
    16   6 C     17   7 N                                 1.1464266
    18   6 C     19   7 N                                 1.1463542
    13   6 C     20   6 C                                 1.3352930
     2   6 C     21   1 H                                 1.0784412
     9   6 C     22   1 H                                 1.0795087
    20   6 C     23   1 H                                 1.0789385
    20   6 C     24   1 H                                 1.0754865 (min)

 * 4 distinct bonds (by element types)

   Z      Z             #   av. dist./Å        max./Å        min./Å
   1 H    6 C           4     1.0780937     1.0795087     1.0754865
   6 C    6 C           8     1.3842069     1.4097899     1.3352930
   6 C    7 N           4     1.1454669     1.1464266     1.1443115
   6 C    8 O           1     1.2044937     1.2044937     1.2044937


optimized geometry written to: xtbopt.xyz


           -------------------------------------------------
          | TOTAL ENERGY              -49.702549868511 Eh   |
          | GRADIENT NORM               0.000800260601 Eh/α |
          | HOMO-LUMO GAP               1.921922471279 eV   |
           -------------------------------------------------

------------------------------------------------------------------------
 * finished run on 2021/02/19 at 08:08:49.940     
------------------------------------------------------------------------
 total:
 * wall-time:     0 d,  0 h,  0 min,  0.330 sec
 *  cpu-time:     0 d,  0 h,  0 min,  0.254 sec
 * ratio c/w:     0.772 speedup
 SCF:
 * wall-time:     0 d,  0 h,  0 min,  0.066 sec
 *  cpu-time:     0 d,  0 h,  0 min,  0.049 sec
 * ratio c/w:     0.743 speedup
 ANC optimizer:
 * wall-time:     0 d,  0 h,  0 min,  0.195 sec
 *  cpu-time:     0 d,  0 h,  0 min,  0.182 sec
 * ratio c/w:     0.933 speedup

