      -----------------------------------------------------------      
     |                   =====================                   |     
     |                           x T B                           |     
     |                   =====================                   |     
     |                         S. Grimme                         |     
     |          Mulliken Center for Theoretical Chemistry        |     
     |                    University of Bonn                     |     
     |                Version 6.2 RC2 (SAW190805)                |     
      -----------------------------------------------------------      

   This program is distributed in the hope that it will be useful,
   but WITHOUT ANY WARRANTY; without even the implied warranty of
   MERCHANTABILITY or FITNESS FOR A PARTICULAR PURPOSE.
   
   FOR NON-COMMERCIAL, ACADEMIA USE ONLY.
   
   Cite this work as:
   * S. Grimme, C. Bannwarth, P. Shushkov, J. Chem. Theory Comput., 2017,
     13, 1989-2009. DOI: 10.1021/acs.jctc.7b00118
   * C. Bannwarth, S. Ehlert and S. Grimme., J. Chem. Theory Comput., 2019,
     15, 1652-1671. DOI: 10.1021/acs.jctc.8b01176
   * P. Pracht, E. Caldeweyher, S. Ehlert, S. Grimme, ChemRxiv, 2019, preprint.
     DOI: 10.26434/chemrxiv.8326202.v1
   
   for DFT-D4:
   * E. Caldeweyher, C. Bannwarth and S. Grimme, J. Chem. Phys., 2017,
     147, 034112. DOI: 10.1063/1.4993215
   * E. Caldeweyher, S. Ehlert, A. Hansen, H. Neugebauer, S. Spicher,
     C. Bannwarth and S. Grimme, J. Chem. Phys., 2019, 150, 154122.
     DOI: 10.1063/1.5090222
   
   for sTDA-xTB:
   * S. Grimme and C. Bannwarth, J. Chem. Phys., 2016, 145, 054103.
     DOI: 10.1063/1.4959605
   
   in the mass-spec context:
   * V. Asgeirsson, C. Bauer and S. Grimme, Chem. Sci., 2017, 8, 4879.
     DOI: 10.1039/c7sc00601b
   
   for metadynamics refer to:
   * S. Grimme, J. Chem. Theory Comput., 2019, 155, 2847-2862
     DOI: 10.1021/acs.jctc.9b00143
   
   with help from (in alphabetical order)
   C. Bannwarth, F. Bohle, G. Brandenburg, E. Caldeweyher, M. Checinski,
   S. Dohm, S. Ehlert, S. Ehrlich, F. März, H. Neugebauer, J. Pisarek,
   P. Pracht, P. Shushkov, and S. Spicher.
   
 * started run on 2021/02/19 at 08:08:51.509     

           -------------------------------------------------
          |                Calculation Setup                |
           -------------------------------------------------

          program call               : /ihome/ghutchison/geoffh/xtb/xtb 11atl.xyz -opt
          hostname                   : smp-n167
          coordinate file            : 11atl.xyz
          omp threads                :                     1
          number of atoms            :                    26
          number of electrons        :                    98
          charge                     :                     0
          spin                       :                   0.0
          first test random number   :      0.71955885093776


########################################################################
# WARNING! Please study the warnings concerning your input carefully
#  - the use of '-opt' is discouraged, please use '--opt' next time
########################################################################

           ------------------------------------------------- 
          |                 G F N 2 - x T B                 |
          | Geometry, Frequencies, Noncovalent interactions |
          |            JCTC 2019 parametrisation            |
           ------------------------------------------------- 
             KAB for C  - Si     :                1.0500
             KAB for H  - Pd     :                0.9500
             k(s)              :                1.8500
             k(p)              :                2.2300
             k(d)              :                2.2300
             k(f)              :                2.0000
             kEN (H0ij)        :               -2.0000
             D4 a1             :                0.5200
             D4 a2             :                5.0000
             D4 s6             :                1.0000
             D4 s8             :                2.7000
             D4 s9             :                5.0000
             alphaj            :                2.0000

  Z AO/shell   Hii/eV     exponent
  1     Wed Apr 25 08:07:45 CEST 2018   EN: 2.200 GM2: 0.406  GM3: 0.0800  RAES: 1.40
     1s    -10.707211    1.230000
  6     Wed Apr 25 08:07:45 CEST 2018   EN: 2.550 GM2: 0.538  GM3: 0.1500  RAES: 3.00
     2s    -13.970922    2.096432
     2p    -10.063292    1.800000
  7     Wed Apr 25 08:07:45 CEST 2018   EN: 3.040 GM2: 0.461  GM3:-0.0640  RAES: 1.90
     2s    -16.686243    2.339881
     2p    -12.523956    2.014332
  8     Wed Apr 25 08:07:45 CEST 2018   EN: 3.440 GM2: 0.452  GM3:-0.0517  RAES: 1.80
     2s    -20.229985    2.439742
     2p    -15.503117    2.137023

           ------------------------------------------------- 
          |        Self-Consistent Charge Iterations        |
           ------------------------------------------------- 

          ...................................................
          :                      SETUP                      :
          :.................................................:
          :  # basis functions                  89          :
          :  # atomic orbitals                  89          :
          :  # shells                           47          :
          :  # electrons                        98          :
          :  max. iterations                   250          :
          :  Hamiltonian                  GFN2-xTB          :
          :  restarted?                      false          :
          :  GBSA solvation                  false          :
          :  PC potential                    false          :
          :  electronic temp.          300.0000000     K    :
          :  accuracy                    1.0000000          :
          :  -> integral cutoff          0.2500000E+02      :
          :  -> integral neglect         0.1000000E-07      :
          :  -> SCF convergence          0.1000000E-05 Eh   :
          :  -> wf. convergence          0.1000000E-03 e    :
          :  Broyden damping             0.4000000          :
          ...................................................

 iter      E             dE          RMSdq      gap      omega  full diag
   1    -56.2705136 -0.562705E+02  0.669E+00    2.31       0.0  T
   2    -56.3004526 -0.299390E-01  0.434E+00    2.13       1.0  T
   3    -56.2820967  0.183559E-01  0.297E+00    1.77       1.0  T
   4    -56.4030825 -0.120986E+00  0.670E-01    1.90       1.0  T
   5    -56.4109450 -0.786247E-02  0.223E-01    1.85       1.0  T
   6    -56.4113907 -0.445690E-03  0.114E-01    1.88       1.0  T
   7    -56.4115932 -0.202503E-03  0.416E-02    1.89       1.0  T
   8    -56.4116078 -0.146157E-04  0.180E-02    1.88       1.1  T
   9    -56.4116120 -0.420904E-05  0.678E-03    1.89       2.9  T
  10    -56.4116123 -0.256367E-06  0.332E-03    1.89       5.9  T
  11    -56.4116124 -0.139028E-06  0.152E-03    1.89      12.9  T
  12    -56.4116124 -0.118518E-07  0.743E-04    1.89      26.4  T
  13    -56.4116124 -0.700430E-08  0.250E-04    1.89      78.6  T

   *** convergence criteria satisfied after 13 iterations ***

         #    Occupation            Energy/Eh            Energy/eV
      -------------------------------------------------------------
         1        2.0000           -0.7751945             -21.0941
       ...           ...                  ...                  ...
        43        2.0000           -0.4768602             -12.9760
        44        2.0000           -0.4743008             -12.9064
        45        2.0000           -0.4645621             -12.6414
        46        2.0000           -0.4544170             -12.3653
        47        2.0000           -0.4508237             -12.2675
        48        2.0000           -0.4491690             -12.2225
        49        2.0000           -0.4386283             -11.9357 (HOMO)
        50                         -0.3693322             -10.0500 (LUMO)
        51                         -0.3524863              -9.5916
        52                         -0.3050819              -8.3017
        53                         -0.3015156              -8.2047
        54                         -0.2752388              -7.4896
       ...                                ...                  ...
        89                          1.1403339              31.0301
      -------------------------------------------------------------
                  HL-Gap            0.0692961 Eh            1.8856 eV
             Fermi-level           -0.4039803 Eh          -10.9929 eV

 SCC (total)                   0 d,  0 h,  0 min,  0.056 sec
 SCC setup                      ...        0 min,  0.000 sec (  0.397%)
 Dispersion                     ...        0 min,  0.000 sec (  0.569%)
 integral evaluation            ...        0 min,  0.017 sec ( 30.095%)
 zeroth order Hamiltonian       ...        0 min,  0.000 sec (  0.351%)
 iterations                     ...        0 min,  0.021 sec ( 38.081%)
 molecular gradient             ...        0 min,  0.017 sec ( 29.893%)
 printout                       ...        0 min,  0.000 sec (  0.583%)

         :::::::::::::::::::::::::::::::::::::::::::::::::::::
         ::                     SUMMARY                     ::
         :::::::::::::::::::::::::::::::::::::::::::::::::::::
         :: total energy             -55.464542030480 Eh    ::
         :: gradient norm              0.000989263104 Eh/a0 ::
         :: HOMO-LUMO gap              1.885643373848 eV    ::
         ::.................................................::
         :: SCC energy               -56.411612431370 Eh    ::
         :: -> isotropic ES            0.090474059203 Eh    ::
         :: -> anisotropic ES          0.004259124967 Eh    ::
         :: -> anisotropic XC          0.058488687923 Eh    ::
         :: -> dispersion             -0.032890111107 Eh    ::
         :: repulsion energy           0.947066915848 Eh    ::
         :: add. restraining           0.000000000000 Eh    ::
         :::::::::::::::::::::::::::::::::::::::::::::::::::::

      ----------------------------------------------------------- 
     |                   =====================                   |
     |                        A N C O P T                        |
     |                   =====================                   |
     |               Approximate Normal Coordinate               |
     |                Rational Function Optimizer                |
      ----------------------------------------------------------- 

          ...................................................
          :                      SETUP                      :
          :.................................................:
          :   optimization level            normal          :
          :   max. optcycles                   200          :
          :   ANC micro-cycles                  20          :
          :   degrees of freedom                72          :
          :.................................................:
          :   RF solver                   davidson          :
          :   input Hessian                  false          :
          :   write xtbopt.log                true          :
          :   linear?                        false          :
          :   energy convergence         0.5000000E-05 Eh   :
          :   grad. convergence          0.1000000E-02 Eh/α :
          :   maximium RF displ.         2.0000000          :
          :   Hlow (freq-cutoff)         0.5000000E-02      :
          :   Hmax (freq-cutoff)         5.0000000          :
          :   S6 in model hess.         20.0000000          :
          ...................................................

generating ANC from model Hessian ...
Using Lindh-Hessian (1995)
 Shifting diagonal of input Hessian by   4.473671618079891E-003
 Lowest  eigenvalues of input Hessian
   -0.000000   -0.000000   -0.000000   -0.000000    0.000000    0.000000
    0.005000    0.005374    0.005686    0.006819    0.007716    0.007916
    0.009352    0.010975    0.013466    0.015176    0.016279    0.016576
 Highest eigenvalues
    2.035125    2.296417    2.374663    2.602095    2.617932    2.647722
 

........................................................................
.............................. CYCLE    1 ..............................
........................................................................
   1    -56.4116124 -0.564116E+02  0.139E-04    1.89       0.0  T
   2    -56.4116124 -0.574687E-10  0.105E-04    1.89     187.0  T
   3    -56.4116124 -0.235339E-09  0.487E-05    1.89     402.4  T
     SCC iter.                  ...        0 min,  0.018 sec
     gradient                   ...        0 min,  0.030 sec
 * total energy  :   -55.4645420 Eh     change        0.2399327E-07 Eh
   gradient norm :     0.0009884 Eh/α   predicted     0.0000000E+00 (-100.00%)
   displ. norm   :     0.0017066 α      lambda       -0.5818868E-07
   maximum displ.:     0.0009269 α      in ANC's #71, #1, #70, ...

........................................................................
.............................. CYCLE    2 ..............................
........................................................................
   1    -56.4107405 -0.564107E+02  0.323E-03    1.88       0.0  T
   2    -56.4107406 -0.452646E-07  0.206E-03    1.88       9.5  T
   3    -56.4107406  0.756382E-08  0.973E-04    1.88      20.2  T
   4    -56.4107406 -0.778705E-08  0.563E-04    1.88      34.8  T
     SCC iter.                  ...        0 min,  0.020 sec
     gradient                   ...        0 min,  0.017 sec
 * total energy  :   -55.4645412 Eh     change        0.8377399E-06 Eh
   gradient norm :     0.0025563 Eh/α   predicted    -0.2988038E-07 (-103.57%)
   displ. norm   :     0.0016266 α      lambda        0.6928229E-05
   maximum displ.:     0.0012922 α      in ANC's #1, #71, #70, ...

........................................................................
.............................. CYCLE    3 ..............................
........................................................................
   1    -56.4101605 -0.564102E+02  0.240E-03    1.88       0.0  T
   2    -56.4101606 -0.191072E-07  0.150E-03    1.88      13.1  T
   3    -56.4101605  0.822585E-08  0.782E-04    1.88      25.1  T
   4    -56.4101606 -0.901579E-08  0.378E-04    1.88      51.9  T
     SCC iter.                  ...        0 min,  0.007 sec
     gradient                   ...        0 min,  0.017 sec
 * total energy  :   -55.4645382 Eh     change        0.2933962E-05 Eh
   gradient norm :     0.0047797 Eh/α   predicted     0.3461465E-05 (  17.98%)
   displ. norm   :     0.0021643 α      lambda        0.9848125E-05
   maximum displ.:     0.0019260 α      in ANC's #1, #71, #70, ...

........................................................................
.............................. CYCLE    4 ..............................
........................................................................
   1    -56.4095814 -0.564096E+02  0.271E-03    1.88       0.0  T
   2    -56.4095815 -0.201925E-07  0.165E-03    1.88      11.9  T
   3    -56.4095814  0.896397E-08  0.773E-04    1.88      25.4  T
     SCC iter.                  ...        0 min,  0.005 sec
     gradient                   ...        0 min,  0.028 sec
 * total energy  :   -55.4645335 Eh     change        0.4774675E-05 Eh
   gradient norm :     0.0069903 Eh/α   predicted     0.4922066E-05 (   3.09%)
   displ. norm   :     0.0023712 α      lambda        0.1371741E-04
   maximum displ.:     0.0021561 α      in ANC's #1, #71, #70, ...

........................................................................
.............................. CYCLE    5 ..............................
........................................................................
   1    -56.4090024 -0.564090E+02  0.288E-03    1.88       0.0  T
   2    -56.4090024 -0.212905E-07  0.167E-03    1.88      11.7  T
   3    -56.4090024  0.759066E-08  0.828E-04    1.88      23.7  T
     SCC iter.                  ...        0 min,  0.005 sec
     gradient                   ...        0 min,  0.028 sec
 * total energy  :   -55.4645264 Eh     change        0.7046703E-05 Eh
   gradient norm :     0.0092278 Eh/α   predicted     0.6858478E-05 (  -2.67%)
   displ. norm   :     0.0022415 α      lambda        0.1767876E-04
   maximum displ.:     0.0020124 α      in ANC's #1, #71, #70, ...

........................................................................
.............................. CYCLE    6 ..............................
........................................................................
   1    -56.4084228 -0.564084E+02  0.276E-03    1.88       0.0  T
   2    -56.4084228 -0.185924E-07  0.181E-03    1.88      10.9  T
   3    -56.4084228  0.178621E-07  0.123E-03    1.88      16.0  T
     SCC iter.                  ...        0 min,  0.005 sec
     gradient                   ...        0 min,  0.028 sec
 * total energy  :   -55.4645178 Eh     change        0.8615987E-05 Eh
   gradient norm :     0.0114295 Eh/α   predicted     0.8839318E-05 (   2.59%)
   displ. norm   :     0.0022920 α      lambda        0.2152906E-04
   maximum displ.:     0.0020686 α      in ANC's #1, #71, #70, ...

........................................................................
.............................. CYCLE    7 ..............................
........................................................................
   1    -56.4078429 -0.564078E+02  0.281E-03    1.88       0.0  T
   2    -56.4078429 -0.227765E-07  0.166E-03    1.88      11.8  T
   3    -56.4078429  0.664977E-08  0.819E-04    1.88      23.9  T
     SCC iter.                  ...        0 min,  0.005 sec
     gradient                   ...        0 min,  0.028 sec
 * total energy  :   -55.4645068 Eh     change        0.1097865E-04 Eh
   gradient norm :     0.0136625 Eh/α   predicted     0.1076457E-04 (  -1.95%)
   displ. norm   :     0.0022104 α      lambda        0.2548827E-04
   maximum displ.:     0.0019777 α      in ANC's #1, #71, #70, ...

........................................................................
.............................. CYCLE    8 ..............................
........................................................................
   1    -56.4072625 -0.564073E+02  0.274E-03    1.88       0.0  T
   2    -56.4072626 -0.190114E-07  0.174E-03    1.88      11.3  T
   3    -56.4072625  0.215414E-07  0.120E-03    1.88      16.3  T
     SCC iter.                  ...        0 min,  0.005 sec
     gradient                   ...        0 min,  0.028 sec
 * total energy  :   -55.4644942 Eh     change        0.1257695E-04 Eh
   gradient norm :     0.0158627 Eh/α   predicted     0.1274415E-04 (   1.33%)
   displ. norm   :     0.0025029 α      lambda        0.2934063E-04
   maximum displ.:     0.0023005 α      in ANC's #1, #71, #70, ...

........................................................................
.............................. CYCLE    9 ..............................
........................................................................
   1    -56.4066824 -0.564067E+02  0.296E-03    1.88       0.0  T
   2    -56.4066825 -0.228519E-07  0.174E-03    1.88      11.3  T
   3    -56.4066825  0.883499E-08  0.870E-04    1.88      22.5  T
     SCC iter.                  ...        0 min,  0.018 sec
     gradient                   ...        0 min,  0.028 sec
 * total energy  :   -55.4644794 Eh     change        0.1486039E-04 Eh
   gradient norm :     0.0180803 Eh/α   predicted     0.1466987E-04 (  -1.28%)
   displ. norm   :     0.0025188 α      lambda        0.3327057E-04
   maximum displ.:     0.0023177 α      in ANC's #1, #71, #70, ...

........................................................................
.............................. CYCLE   10 ..............................
........................................................................
   1    -56.4061020 -0.564061E+02  0.294E-03    1.88       0.0  T
   2    -56.4061020 -0.194170E-07  0.184E-03    1.88      10.7  T
   3    -56.4061020  0.265196E-07  0.128E-03    1.88      15.3  T
     SCC iter.                  ...        0 min,  0.018 sec
     gradient                   ...        0 min,  0.028 sec
 * total energy  :   -55.4644629 Eh     change        0.1647261E-04 Eh
   gradient norm :     0.0202691 Eh/α   predicted     0.1663538E-04 (   0.99%)
   displ. norm   :     0.0026665 α      lambda        0.3711986E-04
   maximum displ.:     0.0024778 α      in ANC's #1, #71, #70, ...

........................................................................
.............................. CYCLE   11 ..............................
........................................................................
   1    -56.4055214 -0.564055E+02  0.306E-03    1.88       0.0  T
   2    -56.4055214 -0.230481E-07  0.180E-03    1.88      10.9  T
   3    -56.4055214  0.900703E-08  0.869E-04    1.88      22.6  T
     SCC iter.                  ...        0 min,  0.005 sec
     gradient                   ...        0 min,  0.015 sec
 * total energy  :   -55.4644442 Eh     change        0.1867934E-04 Eh
   gradient norm :     0.0224746 Eh/α   predicted     0.1855992E-04 (  -0.64%)
   displ. norm   :     0.0024775 α      lambda        0.4104127E-04
   maximum displ.:     0.0022727 α      in ANC's #1, #71, #70, ...

........................................................................
.............................. CYCLE   12 ..............................
........................................................................
   1    -56.4049400 -0.564049E+02  0.292E-03    1.88       0.0  T
   2    -56.4049400 -0.193126E-07  0.182E-03    1.88      10.8  T
   3    -56.4049400  0.261591E-07  0.127E-03    1.88      15.4  T
     SCC iter.                  ...        0 min,  0.005 sec
     gradient                   ...        0 min,  0.015 sec
 * total energy  :   -55.4644239 Eh     change        0.2036475E-04 Eh
   gradient norm :     0.0246553 Eh/α   predicted     0.2052054E-04 (   0.77%)
   displ. norm   :     0.0027500 α      lambda        0.4488151E-04
   maximum displ.:     0.0025676 α      in ANC's #1, #71, #70, ...

........................................................................
.............................. CYCLE   13 ..............................
........................................................................
   1    -56.4043587 -0.564044E+02  0.312E-03    1.88       0.0  T
   2    -56.4043587 -0.230485E-07  0.183E-03    1.88      10.7  T
   3    -56.4043587  0.102752E-07  0.892E-04    1.88      22.0  T
     SCC iter.                  ...        0 min,  0.005 sec
     gradient                   ...        0 min,  0.015 sec
 * total energy  :   -55.4644012 Eh     change        0.2262116E-04 Eh
   gradient norm :     0.0268492 Eh/α   predicted     0.2244047E-04 (  -0.80%)
   displ. norm   :     0.0025700 α      lambda        0.4878723E-04
   maximum displ.:     0.0023734 α      in ANC's #1, #71, #70, ...

........................................................................
.............................. CYCLE   14 ..............................
........................................................................
   1    -56.4037766 -0.564038E+02  0.298E-03    1.88       0.0  T
   2    -56.4037766 -0.194689E-07  0.185E-03    1.88      10.6  T
   3    -56.4037765  0.276013E-07  0.130E-03    1.88      15.1  T
     SCC iter.                  ...        0 min,  0.005 sec
     gradient                   ...        0 min,  0.015 sec
 * total energy  :   -55.4643770 Eh     change        0.2424356E-04 Eh
   gradient norm :     0.0290198 Eh/α   predicted     0.2439357E-04 (   0.62%)
   displ. norm   :     0.0028275 α      lambda        0.5261977E-04
   maximum displ.:     0.0026506 α      in ANC's #1, #71, #70, ...

........................................................................
.............................. CYCLE   15 ..............................
........................................................................
   1    -56.4031945 -0.564032E+02  0.317E-03    1.88       0.0  T
   2    -56.4031945 -0.231390E-07  0.186E-03    1.88      10.6  T
   3    -56.4031945  0.109347E-07  0.903E-04    1.88      21.7  T
     SCC iter.                  ...        0 min,  0.005 sec
     gradient                   ...        0 min,  0.015 sec
 * total energy  :   -55.4643505 Eh     change        0.2648422E-04 Eh
   gradient norm :     0.0312028 Eh/α   predicted     0.2630969E-04 (  -0.66%)
   displ. norm   :     0.0025435 α      lambda        0.5651557E-04
   maximum displ.:     0.0023446 α      in ANC's #1, #71, #70, ...

........................................................................
.............................. CYCLE   16 ..............................
........................................................................
   1    -56.4026114 -0.564026E+02  0.297E-03    1.88       0.0  T
   2    -56.4026114 -0.194371E-07  0.184E-03    1.88      10.7  T
   3    -56.4026114  0.271151E-07  0.130E-03    1.88      15.1  T
     SCC iter.                  ...        0 min,  0.005 sec
     gradient                   ...        0 min,  0.015 sec
 * total energy  :   -55.4643224 Eh     change        0.2811338E-04 Eh
   gradient norm :     0.0333644 Eh/α   predicted     0.2825747E-04 (   0.51%)
   displ. norm   :     0.0028849 α      lambda        0.6033697E-04
   maximum displ.:     0.0027119 α      in ANC's #1, #71, #70, ...

........................................................................
.............................. CYCLE   17 ..............................
........................................................................
   1    -56.4020284 -0.564020E+02  0.320E-03    1.88       0.0  T
   2    -56.4020284 -0.231732E-07  0.188E-03    1.88      10.4  T
   3    -56.4020284  0.114015E-07  0.910E-04    1.88      21.6  T
     SCC iter.                  ...        0 min,  0.005 sec
     gradient                   ...        0 min,  0.015 sec
 * total energy  :   -55.4642921 Eh     change        0.3033681E-04 Eh
   gradient norm :     0.0355365 Eh/α   predicted     0.3016802E-04 (  -0.56%)
   displ. norm   :     0.0025262 α      lambda        0.6422083E-04
   maximum displ.:     0.0023257 α      in ANC's #1, #71, #70, ...

........................................................................
.............................. CYCLE   18 ..............................
........................................................................
   1    -56.4014444 -0.564014E+02  0.296E-03    1.88       0.0  T
   2    -56.4014444 -0.194103E-07  0.183E-03    1.88      10.7  T
   3    -56.4014444  0.268320E-07  0.129E-03    1.88      15.1  T
     SCC iter.                  ...        0 min,  0.005 sec
     gradient                   ...        0 min,  0.015 sec
 * total energy  :   -55.4642601 Eh     change        0.3196957E-04 Eh
   gradient norm :     0.0376890 Eh/α   predicted     0.3210983E-04 (   0.44%)
   displ. norm   :     0.0029319 α      lambda        0.6803106E-04
   maximum displ.:     0.0027620 α      in ANC's #1, #71, #70, ...

........................................................................
.............................. CYCLE   19 ..............................
........................................................................
   1    -56.4008606 -0.564009E+02  0.323E-03    1.88       0.0  T
   2    -56.4008606 -0.232185E-07  0.189E-03    1.88      10.4  T
   3    -56.4008606  0.117990E-07  0.916E-04    1.88      21.4  T
     SCC iter.                  ...        0 min,  0.005 sec
     gradient                   ...        0 min,  0.015 sec
 * total energy  :   -55.4642259 Eh     change        0.3417981E-04 Eh
   gradient norm :     0.0398506 Eh/α   predicted     0.3401481E-04 (  -0.48%)
   displ. norm   :     0.0024905 α      lambda        0.7190333E-04
   maximum displ.:     0.0022868 α      in ANC's #1, #71, #70, ...

........................................................................
.............................. CYCLE   20 ..............................
........................................................................
   1    -56.4002756 -0.564003E+02  0.294E-03    1.87       0.0  T
   2    -56.4002756 -0.193604E-07  0.182E-03    1.87      10.8  T
   3    -56.4002756  0.262683E-07  0.129E-03    1.87      15.2  T
     SCC iter.                  ...        0 min,  0.005 sec
     gradient                   ...        0 min,  0.015 sec
 * total energy  :   -55.4641901 Eh     change        0.3581362E-04 Eh
   gradient norm :     0.0419939 Eh/α   predicted     0.3595070E-04 (   0.38%)
   displ. norm   :     0.0029722 α      lambda        0.7570133E-04
   maximum displ.:     0.0028049 α      in ANC's #1, #71, #70, ...
 * RMSD in coord.:     0.0095809 α      energy gain   0.3519279E-03 Eh

generating ANC from model Hessian ...
Using Lindh-Hessian (1995)
 Shifting diagonal of input Hessian by   4.448369940858695E-003
 Lowest  eigenvalues of input Hessian
   -0.000000    0.000000    0.000000    0.000000    0.000000    0.000000
    0.005000    0.005347    0.005752    0.006904    0.007753    0.007903
    0.009360    0.010960    0.013372    0.015010    0.016215    0.016696
 Highest eigenvalues
    2.035117    2.301441    2.368656    2.585187    2.587783    2.634175
 

........................................................................
.............................. CYCLE   21 ..............................
........................................................................
   1    -56.3996909 -0.563997E+02  0.326E-03    1.87       0.0  T
   2    -56.3996909 -0.233655E-07  0.191E-03    1.87      10.3  T
   3    -56.3996909  0.135533E-07  0.948E-04    1.87      20.7  T
   4    -56.3996909 -0.139976E-07  0.390E-04    1.87      50.3  T
     SCC iter.                  ...        0 min,  0.020 sec
     gradient                   ...        0 min,  0.030 sec
 * total energy  :   -55.4641521 Eh     change        0.3801410E-04 Eh
   gradient norm :     0.0441521 Eh/α   predicted     0.0000000E+00 (-100.00%)
   displ. norm   :     0.0591607 α      lambda       -0.8786558E-03
   maximum displ.:     0.0265466 α      in ANC's #1, #6, #5, ...

........................................................................
.............................. CYCLE   22 ..............................
........................................................................
   1    -56.4136951 -0.564137E+02  0.104E-01    1.89       0.0  T
   2    -56.4137039 -0.877849E-05  0.590E-02    1.89       1.0  T
   3    -56.4136998  0.408418E-05  0.161E-02    1.88       1.2  T
   4    -56.4137053 -0.546964E-05  0.614E-03    1.88       3.2  T
   5    -56.4137060 -0.747639E-06  0.198E-03    1.89       9.9  T
   6    -56.4137061 -0.279917E-07  0.114E-03    1.89      17.2  T
     SCC iter.                  ...        0 min,  0.010 sec
     gradient                   ...        0 min,  0.015 sec
 * total energy  :   -55.4644675 Eh     change       -0.3154576E-03 Eh
   gradient norm :     0.0073542 Eh/α   predicted    -0.4408690E-03 (  39.76%)
   displ. norm   :     0.1339220 α      lambda       -0.3556710E-03
   maximum displ.:     0.0573114 α      in ANC's #8, #5, #7, ...

........................................................................
.............................. CYCLE   23 ..............................
........................................................................
   1    -56.4156520 -0.564157E+02  0.232E-01    1.88       0.0  T
   2    -56.4156697 -0.177228E-04  0.128E-01    1.89       1.0  T
   3    -56.4156727 -0.300389E-05  0.140E-02    1.88       1.4  T
   4    -56.4156771 -0.431267E-05  0.426E-03    1.88       4.6  T
   5    -56.4156773 -0.196937E-06  0.233E-03    1.88       8.4  T
   6    -56.4156773 -0.496278E-07  0.957E-04    1.88      20.5  T
     SCC iter.                  ...        0 min,  0.010 sec
     gradient                   ...        0 min,  0.015 sec
 * total energy  :   -55.4641525 Eh     change        0.3150064E-03 Eh
   gradient norm :     0.0190413 Eh/α   predicted    -0.1810358E-03 (-157.47%)
   displ. norm   :     0.0932003 α      lambda       -0.7675018E-03
   maximum displ.:     0.0454715 α      in ANC's #7, #8, #5, ...

........................................................................
.............................. CYCLE   24 ..............................
........................................................................
   1    -56.4116031 -0.564116E+02  0.157E-01    1.88       0.0  T
   2    -56.4116115 -0.842841E-05  0.867E-02    1.88       1.0  T
   3    -56.4115999  0.116304E-04  0.247E-02    1.88       1.0  T
   4    -56.4116162 -0.163259E-04  0.311E-03    1.89       6.3  T
   5    -56.4116163 -0.367925E-07  0.198E-03    1.88       9.9  T
   6    -56.4116163 -0.400762E-07  0.943E-04    1.88      20.8  T
     SCC iter.                  ...        0 min,  0.023 sec
     gradient                   ...        0 min,  0.028 sec
 * total energy  :   -55.4645305 Eh     change       -0.3779524E-03 Eh
   gradient norm :     0.0027208 Eh/α   predicted    -0.3870845E-03 (   2.42%)
   displ. norm   :     0.0735796 α      lambda       -0.9221562E-04
   maximum displ.:     0.0356683 α      in ANC's #3, #4, #8, ...

........................................................................
.............................. CYCLE   25 ..............................
........................................................................
   1    -56.4098758 -0.564099E+02  0.134E-01    1.89       0.0  T
   2    -56.4098810 -0.517004E-05  0.736E-02    1.89       1.0  T
   3    -56.4098799  0.110465E-05  0.116E-02    1.89       1.7  T
   4    -56.4098834 -0.355193E-05  0.220E-03    1.89       8.9  T
   5    -56.4098834 -0.749088E-08  0.131E-03    1.89      15.0  T
   6    -56.4098835 -0.196874E-07  0.464E-04    1.89      42.3  T
   7    -56.4098835 -0.245392E-08  0.245E-04    1.89      80.1  T
     SCC iter.                  ...        0 min,  0.011 sec
     gradient                   ...        0 min,  0.017 sec
 * total energy  :   -55.4644269 Eh     change        0.1035612E-03 Eh
   gradient norm :     0.0075563 Eh/α   predicted    -0.4635789E-04 (-144.76%)
   displ. norm   :     0.0576560 α      lambda       -0.2387519E-03
   maximum displ.:     0.0316469 α      in ANC's #3, #4, #8, ...

........................................................................
.............................. CYCLE   26 ..............................
........................................................................
   1    -56.4116209 -0.564116E+02  0.106E-01    1.89       0.0  T
   2    -56.4116242 -0.331319E-05  0.583E-02    1.89       1.0  T
   3    -56.4116238  0.398914E-06  0.898E-03    1.89       2.2  T
   4    -56.4116257 -0.189710E-05  0.161E-03    1.89      12.2  T
   5    -56.4116257 -0.200568E-07  0.965E-04    1.89      20.3  T
     SCC iter.                  ...        0 min,  0.008 sec
     gradient                   ...        0 min,  0.015 sec
 * total energy  :   -55.4645428 Eh     change       -0.1159024E-03 Eh
   gradient norm :     0.0009425 Eh/α   predicted    -0.1197771E-03 (   3.34%)
   displ. norm   :     0.0105214 α      lambda       -0.2221932E-05
   maximum displ.:     0.0045483 α      in ANC's #2, #8, #6, ...

........................................................................
.............................. CYCLE   27 ..............................
........................................................................
   1    -56.4114434 -0.564114E+02  0.104E-02    1.89       0.0  T
   2    -56.4114434 -0.297559E-07  0.642E-03    1.89       3.1  T
   3    -56.4114432  0.185251E-06  0.298E-03    1.89       6.6  T
   4    -56.4114435 -0.215296E-06  0.528E-04    1.89      37.1  T
   5    -56.4114435 -0.173103E-08  0.328E-04    1.89      59.7  T
     SCC iter.                  ...        0 min,  0.008 sec
     gradient                   ...        0 min,  0.017 sec
 * total energy  :   -55.4645425 Eh     change        0.3810083E-06 Eh
   gradient norm :     0.0009307 Eh/α   predicted    -0.1113358E-05 (-392.21%)
   displ. norm   :     0.0109570 α      lambda        0.1093964E-04
   maximum displ.:     0.0045479 α      in ANC's #2, #1, #8, ...

........................................................................
.............................. CYCLE   28 ..............................
........................................................................
   1    -56.4112454 -0.564112E+02  0.104E-02    1.89       0.0  T
   2    -56.4112454 -0.311456E-07  0.644E-03    1.89       3.0  T
   3    -56.4112453  0.129055E-06  0.261E-03    1.89       7.5  T
   4    -56.4112455 -0.156240E-06  0.479E-04    1.89      41.0  T
   5    -56.4112455 -0.553115E-09  0.305E-04    1.89      64.3  T
     SCC iter.                  ...        0 min,  0.008 sec
     gradient                   ...        0 min,  0.043 sec
 * total energy  :   -55.4645343 Eh     change        0.8184337E-05 Eh
   gradient norm :     0.0025752 Eh/α   predicted     0.5465453E-05 ( -33.22%)
   displ. norm   :     0.0085749 α      lambda       -0.1301628E-04
   maximum displ.:     0.0033163 α      in ANC's #29, #6, #28, ...

........................................................................
.............................. CYCLE   29 ..............................
........................................................................
   1    -56.4113330 -0.564113E+02  0.112E-02    1.89       0.0  T
   2    -56.4113330 -0.356668E-07  0.684E-03    1.89       2.9  T
   3    -56.4113329  0.150065E-06  0.279E-03    1.89       7.0  T
   4    -56.4113331 -0.181456E-06  0.620E-04    1.89      31.6  T
   5    -56.4113331 -0.924544E-09  0.403E-04    1.89      48.7  T
     SCC iter.                  ...        0 min,  0.021 sec
     gradient                   ...        0 min,  0.030 sec
 * total energy  :   -55.4645429 Eh     change       -0.8643982E-05 Eh
   gradient norm :     0.0010640 Eh/α   predicted    -0.6513607E-05 ( -24.65%)
   displ. norm   :     0.0074386 α      lambda       -0.2637262E-05
   maximum displ.:     0.0028251 α      in ANC's #3, #2, #29, ...

........................................................................
.............................. CYCLE   30 ..............................
........................................................................
   1    -56.4115727 -0.564116E+02  0.893E-03    1.89       0.0  T
   2    -56.4115728 -0.231374E-07  0.552E-03    1.89       3.6  T
   3    -56.4115727  0.803738E-07  0.205E-03    1.89       9.6  T
   4    -56.4115728 -0.101254E-06  0.444E-04    1.89      44.1  T
   5    -56.4115728 -0.435328E-09  0.291E-04    1.89      67.5  T
     SCC iter.                  ...        0 min,  0.021 sec
     gradient                   ...        0 min,  0.030 sec
 * total energy  :   -55.4645440 Eh     change       -0.1053944E-05 Eh
   gradient norm :     0.0006870 Eh/α   predicted    -0.1321023E-05 (  25.34%)
   displ. norm   :     0.0078061 α      lambda        0.6732701E-05
   maximum displ.:     0.0028244 α      in ANC's #3, #2, #29, ...

   *** GEOMETRY OPTIMIZATION CONVERGED AFTER 30 ITERATIONS ***

------------------------------------------------------------------------
 total energy gain   :        -0.0000019 Eh       -0.0012 kcal/mol
 total RMSD          :         0.0076659 a0        0.0041 Å
 total power (kW/mol):        -0.0001694 (step)   -0.0029 (real)
------------------------------------------------------------------------

 ANCopt (total)                0 d,  0 h,  0 min,  1.736 sec
 optimizer setup                ...        0 min,  0.000 sec (  0.004%)
 model hessian                  ...        0 min,  0.006 sec (  0.366%)
 ANC generation                 ...        0 min,  0.001 sec (  0.075%)
 coordinate transformation      ...        0 min,  0.000 sec (  0.010%)
 single point calculation       ...        0 min,  1.711 sec ( 98.584%)
 optimization log               ...        0 min,  0.002 sec (  0.106%)
 hessian update                 ...        0 min,  0.000 sec (  0.011%)
 rational function              ...        0 min,  0.001 sec (  0.054%)

================
 final structure:
================
$coord
   -1.55484274450415   -2.67361656810346    0.13799151384543      C 
    0.05190834264411   -0.59324494410822    0.14407096795318      C 
   -0.77797305392135    1.92223135868359    1.17872645610746      C 
    0.68021004663831    3.33796945014329    2.17085138366483      O 
   -3.22932911307576    2.48617599592493    0.95757522387644      O 
    2.56219074185507   -0.82446100232333   -0.69877128377540      C 
    4.22252453664802    1.28055275721117   -0.76354559068199      C 
    5.68510518730832    2.86156645794303   -0.96420481890607      N 
    3.48025983739611   -3.14943321242942   -1.54822731073051      C 
    1.86655449785254   -5.19639824520073   -1.53807138821700      C 
   -0.65782464850834   -4.98500893940248   -0.72421013437982      C 
   -1.90862704937582   -7.43253855624640   -0.94426916300004      C 
   -4.41636965515207   -7.89888123473949   -0.58088690068997      C 
   -6.19477704459447   -6.00504289494164    0.03710633437478      C 
   -7.67856599525668   -4.49223365982316    0.49195608833244      N 
   -5.56477207615615  -10.29719760433627   -0.84783290463798      C 
   -6.60435821463570  -12.18871574039165   -1.02925566766649      N 
    0.00160938248114   -9.25900315236697   -1.76074506391139      C 
    2.40444654316169   -7.84451520959411   -2.25946514725990      C 
    4.34948311367670   -8.70940515296594   -3.06132337852274      O 
   -0.14284409893686  -11.76314785987183   -2.03032899572028      C 
   -3.45165145314328   -2.51002901083511    0.87170535276847      H 
   -4.22946441798101    1.22714463307966    0.08910063017383      H 
    5.40808866725884   -3.34544695524646   -2.18562607032750      H 
   -1.81342373327862  -12.85395575271219   -1.64090894336207      H 
    1.51341780254096  -12.77077792858265   -2.66081346597018      H 
$end
           -------------------------------------------------
          |                Final Singlepoint                |
           -------------------------------------------------

          ...................................................
          :                      SETUP                      :
          :.................................................:
          :  # basis functions                  89          :
          :  # atomic orbitals                  89          :
          :  # shells                           47          :
          :  # electrons                        98          :
          :  max. iterations                   250          :
          :  Hamiltonian                  GFN2-xTB          :
          :  restarted?                      false          :
          :  GBSA solvation                  false          :
          :  PC potential                    false          :
          :  electronic temp.          300.0000000     K    :
          :  accuracy                    1.0000000          :
          :  -> integral cutoff          0.2500000E+02      :
          :  -> integral neglect         0.1000000E-07      :
          :  -> SCF convergence          0.1000000E-05 Eh   :
          :  -> wf. convergence          0.1000000E-03 e    :
          :  Broyden damping             0.4000000          :
          ...................................................

 iter      E             dE          RMSdq      gap      omega  full diag
   1    -56.4115728 -0.564116E+02  0.998E-05    1.89       0.0  T
   2    -56.4115728  0.125482E-10  0.716E-05    1.89     273.7  T
   3    -56.4115728 -0.990568E-10  0.437E-05    1.89     448.5  T

   *** convergence criteria satisfied after 3 iterations ***

         #    Occupation            Energy/Eh            Energy/eV
      -------------------------------------------------------------
         1        2.0000           -0.7752227             -21.0949
       ...           ...                  ...                  ...
        43        2.0000           -0.4768578             -12.9760
        44        2.0000           -0.4743020             -12.9064
        45        2.0000           -0.4645678             -12.6415
        46        2.0000           -0.4544245             -12.3655
        47        2.0000           -0.4508586             -12.2685
        48        2.0000           -0.4491785             -12.2228
        49        2.0000           -0.4386406             -11.9360 (HOMO)
        50                         -0.3693511             -10.0506 (LUMO)
        51                         -0.3524891              -9.5917
        52                         -0.3050986              -8.3022
        53                         -0.3015012              -8.2043
        54                         -0.2753229              -7.4919
       ...                                ...                  ...
        89                          1.1404401              31.0330
      -------------------------------------------------------------
                  HL-Gap            0.0692895 Eh            1.8855 eV
             Fermi-level           -0.4039959 Eh          -10.9933 eV

 SCC (total)                   0 d,  0 h,  0 min,  0.039 sec
 SCC setup                      ...        0 min,  0.000 sec (  0.411%)
 Dispersion                     ...        0 min,  0.000 sec (  0.544%)
 integral evaluation            ...        0 min,  0.017 sec ( 42.480%)
 zeroth order Hamiltonian       ...        0 min,  0.000 sec (  0.470%)
 iterations                     ...        0 min,  0.005 sec ( 13.039%)
 molecular gradient             ...        0 min,  0.017 sec ( 42.254%)
 printout                       ...        0 min,  0.000 sec (  0.768%)

         :::::::::::::::::::::::::::::::::::::::::::::::::::::
         ::                     SUMMARY                     ::
         :::::::::::::::::::::::::::::::::::::::::::::::::::::
         :: total energy             -55.464543956037 Eh    ::
         :: gradient norm              0.000685293459 Eh/a0 ::
         :: HOMO-LUMO gap              1.885462279913 eV    ::
         ::.................................................::
         :: SCC energy               -56.411572774867 Eh    ::
         :: -> isotropic ES            0.090483369561 Eh    ::
         :: -> anisotropic ES          0.004258299438 Eh    ::
         :: -> anisotropic XC          0.058488590352 Eh    ::
         :: -> dispersion             -0.032891052405 Eh    ::
         :: repulsion energy           0.947025203853 Eh    ::
         :: add. restraining           0.000000000000 Eh    ::
         :::::::::::::::::::::::::::::::::::::::::::::::::::::

           -------------------------------------------------
          |                Property Printout                |
           -------------------------------------------------

    * Orbital Energies and Occupations

         #    Occupation            Energy/Eh            Energy/eV
      -------------------------------------------------------------
         1        2.0000           -0.7752227             -21.0949
       ...           ...                  ...                  ...
        37        2.0000           -0.5089169             -13.8483
        38        2.0000           -0.5076573             -13.8141
        39        2.0000           -0.5073299             -13.8052
        40        2.0000           -0.4996495             -13.5962
        41        2.0000           -0.4975199             -13.5382
        42        2.0000           -0.4818980             -13.1131
        43        2.0000           -0.4768578             -12.9760
        44        2.0000           -0.4743020             -12.9064
        45        2.0000           -0.4645678             -12.6415
        46        2.0000           -0.4544245             -12.3655
        47        2.0000           -0.4508586             -12.2685
        48        2.0000           -0.4491785             -12.2228
        49        2.0000           -0.4386406             -11.9360 (HOMO)
        50                         -0.3693511             -10.0506 (LUMO)
        51                         -0.3524891              -9.5917
        52                         -0.3050986              -8.3022
        53                         -0.3015012              -8.2043
        54                         -0.2753229              -7.4919
        55                         -0.2525041              -6.8710
        56                         -0.2373270              -6.4580
        57                         -0.2334302              -6.3520
        58                         -0.2316467              -6.3034
        59                         -0.2099288              -5.7125
        60                         -0.1890493              -5.1443
       ...                                ...                  ...
        89                          1.1404401              31.0330
      -------------------------------------------------------------
                  HL-Gap            0.0692895 Eh            1.8855 eV
             Fermi-level           -0.4039959 Eh          -10.9933 eV

     #   Z        covCN         q      C6AA      α(0)
     1   6 C      2.914    -0.030    28.754     8.793
     2   6 C      2.972    -0.017    28.423     8.745
     3   6 C      2.693     0.360    20.887     7.480
     4   8 O      0.857    -0.344    20.585     6.083
     5   8 O      1.659    -0.354    19.984     6.035
     6   6 C      2.976     0.044    27.011     8.525
     7   6 C      1.911     0.123    28.081     8.558
     8   7 N      0.911    -0.175    24.788     7.201
     9   6 C      2.922    -0.004    28.134     8.698
    10   6 C      3.031    -0.008    28.184     8.708
    11   6 C      3.026     0.015    27.642     8.624
    12   6 C      3.008     0.034    27.221     8.558
    13   6 C      2.947     0.023    27.498     8.601
    14   6 C      1.933     0.126    28.003     8.546
    15   7 N      0.911    -0.215    25.698     7.332
    16   6 C      1.932     0.126    28.011     8.547
    17   7 N      0.911    -0.202    25.386     7.287
    18   6 C      2.994    -0.012    28.309     8.728
    19   6 C      2.862     0.231    23.159     7.888
    20   8 O      0.856    -0.323    20.211     6.027
    21   6 C      2.840    -0.050    29.224     8.859
    22   1 H      0.926     0.061     2.187     2.313
    23   1 H      0.805     0.329     0.639     1.255
    24   1 H      0.926     0.083     1.949     2.183
    25   1 H      0.926     0.083     1.950     2.184
    26   1 H      0.926     0.096     1.820     2.110

 Mol. C6AA /au·bohr⁶  :      12767.560957
 Mol. C8AA /au·bohr⁸  :     328789.547592
 Mol. α(0) /au        :        177.867504


Wiberg/Mayer (AO) data.
largest (>0.10) Wiberg bond orders for each atom
          total WBO             WBO to atom ...
     1  C   3.981        C    2 1.419    C   11 1.387    H   22 0.952
     2  C   3.980        C    1 1.419    C    6 1.321    C    3 0.969
     3  C   3.926        O    4 1.783    O    5 1.135    C    2 0.969
     4  O   2.097        C    3 1.783    O    5 0.171
     5  O   2.225        C    3 1.135    H   23 0.863    O    4 0.171
     6  C   3.974        C    9 1.362    C    2 1.321    C    7 1.086
     7  C   3.950        N    8 2.817    C    6 1.086
     8  N   2.987        C    7 2.817
     9  C   3.983        C   10 1.427    C    6 1.362    H   24 0.962
    10  C   3.979        C    9 1.427    C   11 1.290    C   19 1.013
    11  C   3.968        C    1 1.387    C   10 1.290    C   12 1.094
    12  C   3.982        C   13 1.539    C   11 1.094    C   18 1.083
    13  C   3.981        C   12 1.539    C   14 1.088    C   16 1.085
    14  C   3.948        N   15 2.780    C   13 1.088
    15  N   2.986        C   14 2.780
    16  C   3.949        N   17 2.788    C   13 1.085
    17  N   2.991        C   16 2.788
    18  C   3.986        C   21 1.799    C   12 1.083    C   19 0.988
    19  C   3.930        O   20 1.831    C   10 1.013    C   18 0.988
    20  O   2.100        C   19 1.831
    21  C   3.938        C   18 1.799    H   26 0.966    H   25 0.965
    22  H   0.995        C    1 0.952
    23  H   0.891        O    5 0.863
    24  H   0.992        C    9 0.962
    25  H   0.992        C   21 0.965
    26  H   0.990        C   21 0.966

molecular dipole:
                 x           y           z       tot (Debye)
 q only:       -0.387      -1.320      -0.562
   full:       -0.528      -1.837      -0.652       5.134
molecular quadrupole (traceless):
                xx          xy          yy          xz          yz          zz
 q only:      -10.115      -9.030       2.230       3.802      -4.759       7.886
  q+dip:      -13.509     -14.482       1.927       3.756      -5.857      11.581
   full:      -16.060     -16.003      -2.600       6.164      -8.021      18.661

           -------------------------------------------------
          |                Geometry Summary                 |
           -------------------------------------------------

      molecular mass/u    :      275.2228000
   center of mass at/Å    :       -0.3342290      -2.2451193      -0.3307918
  moments of inertia/u·Å² :        0.9838276E+03   0.2190425E+04   0.3147697E+04
rotational constants/cm⁻¹ :        0.1713474E-01   0.7696057E-02   0.5355545E-02

 * 19 selected distances

     #   Z        #   Z                                     value/Å
     1   6 C      2   6 C                                 1.3910048
     3   6 C      4   8 O                                 1.1967978
     3   6 C      5   8 O                                 1.3362211
     2   6 C      6   6 C                                 1.4065927
     7   6 C      8   7 N                                 1.1446644
     6   6 C      9   6 C                                 1.3970603
     9   6 C     10   6 C                                 1.3793383
     1   6 C     11   6 C                                 1.3890845
    10   6 C     11   6 C                                 1.4080039 (max)
    12   6 C     13   6 C                                 1.3634193
    14   6 C     15   7 N                                 1.1468762
    16   6 C     17   7 N                                 1.1461904
    19   6 C     20   8 O                                 1.2037100
    18   6 C     21   6 C                                 1.3349836
     1   6 C     22   1 H                                 1.0797006
     5   8 O     23   1 H                                 0.9670602 (min)
     9   6 C     24   1 H                                 1.0794727
    21   6 C     25   1 H                                 1.0757207
    21   6 C     26   1 H                                 1.0787993

 * 5 distinct bonds (by element types)

   Z      Z             #   av. dist./Å        max./Å        min./Å
   1 H    6 C           4     1.0784233     1.0797006     1.0757207
   6 C    6 C           8     1.3836859     1.4080039     1.3349836
   6 C    7 N           3     1.1459103     1.1468762     1.1446644
   1 H    8 O           1     0.9670602     0.9670602     0.9670602
   6 C    8 O           3     1.2455763     1.3362211     1.1967978


optimized geometry written to: xtbopt.xyz


           -------------------------------------------------
          | TOTAL ENERGY              -55.464543956037 Eh   |
          | GRADIENT NORM               0.000685293459 Eh/α |
          | HOMO-LUMO GAP               1.885462279913 eV   |
           -------------------------------------------------

------------------------------------------------------------------------
 * finished run on 2021/02/19 at 08:08:53.376     
------------------------------------------------------------------------
 total:
 * wall-time:     0 d,  0 h,  0 min,  1.867 sec
 *  cpu-time:     0 d,  0 h,  0 min,  1.311 sec
 * ratio c/w:     0.703 speedup
 SCF:
 * wall-time:     0 d,  0 h,  0 min,  0.056 sec
 *  cpu-time:     0 d,  0 h,  0 min,  0.056 sec
 * ratio c/w:     1.000 speedup
 ANC optimizer:
 * wall-time:     0 d,  0 h,  0 min,  1.775 sec
 *  cpu-time:     0 d,  0 h,  0 min,  1.230 sec
 * ratio c/w:     0.693 speedup

