      -----------------------------------------------------------      
     |                   =====================                   |     
     |                           x T B                           |     
     |                   =====================                   |     
     |                         S. Grimme                         |     
     |          Mulliken Center for Theoretical Chemistry        |     
     |                    University of Bonn                     |     
     |                Version 6.2 RC2 (SAW190805)                |     
      -----------------------------------------------------------      

   This program is distributed in the hope that it will be useful,
   but WITHOUT ANY WARRANTY; without even the implied warranty of
   MERCHANTABILITY or FITNESS FOR A PARTICULAR PURPOSE.
   
   FOR NON-COMMERCIAL, ACADEMIA USE ONLY.
   
   Cite this work as:
   * S. Grimme, C. Bannwarth, P. Shushkov, J. Chem. Theory Comput., 2017,
     13, 1989-2009. DOI: 10.1021/acs.jctc.7b00118
   * C. Bannwarth, S. Ehlert and S. Grimme., J. Chem. Theory Comput., 2019,
     15, 1652-1671. DOI: 10.1021/acs.jctc.8b01176
   * P. Pracht, E. Caldeweyher, S. Ehlert, S. Grimme, ChemRxiv, 2019, preprint.
     DOI: 10.26434/chemrxiv.8326202.v1
   
   for DFT-D4:
   * E. Caldeweyher, C. Bannwarth and S. Grimme, J. Chem. Phys., 2017,
     147, 034112. DOI: 10.1063/1.4993215
   * E. Caldeweyher, S. Ehlert, A. Hansen, H. Neugebauer, S. Spicher,
     C. Bannwarth and S. Grimme, J. Chem. Phys., 2019, 150, 154122.
     DOI: 10.1063/1.5090222
   
   for sTDA-xTB:
   * S. Grimme and C. Bannwarth, J. Chem. Phys., 2016, 145, 054103.
     DOI: 10.1063/1.4959605
   
   in the mass-spec context:
   * V. Asgeirsson, C. Bauer and S. Grimme, Chem. Sci., 2017, 8, 4879.
     DOI: 10.1039/c7sc00601b
   
   for metadynamics refer to:
   * S. Grimme, J. Chem. Theory Comput., 2019, 155, 2847-2862
     DOI: 10.1021/acs.jctc.9b00143
   
   with help from (in alphabetical order)
   C. Bannwarth, F. Bohle, G. Brandenburg, E. Caldeweyher, M. Checinski,
   S. Dohm, S. Ehlert, S. Ehrlich, F. März, H. Neugebauer, J. Pisarek,
   P. Pracht, P. Shushkov, and S. Spicher.
   
 * started run on 2021/02/19 at 08:08:55.416     

           -------------------------------------------------
          |                Calculation Setup                |
           -------------------------------------------------

          program call               : /ihome/ghutchison/geoffh/xtb/xtb 12atl.xyz -opt
          hostname                   : smp-n167
          coordinate file            : 12atl.xyz
          omp threads                :                     1
          number of atoms            :                    25
          number of electrons        :                    98
          charge                     :                     0
          spin                       :                   0.0
          first test random number   :      0.00208300080945


########################################################################
# WARNING! Please study the warnings concerning your input carefully
#  - the use of '-opt' is discouraged, please use '--opt' next time
########################################################################

           ------------------------------------------------- 
          |                 G F N 2 - x T B                 |
          | Geometry, Frequencies, Noncovalent interactions |
          |            JCTC 2019 parametrisation            |
           ------------------------------------------------- 
             KAB for C  - Si     :                1.0500
             KAB for H  - Pd     :                0.9500
             k(s)              :                1.8500
             k(p)              :                2.2300
             k(d)              :                2.2300
             k(f)              :                2.0000
             kEN (H0ij)        :               -2.0000
             D4 a1             :                0.5200
             D4 a2             :                5.0000
             D4 s6             :                1.0000
             D4 s8             :                2.7000
             D4 s9             :                5.0000
             alphaj            :                2.0000

  Z AO/shell   Hii/eV     exponent
  1     Wed Apr 25 08:07:45 CEST 2018   EN: 2.200 GM2: 0.406  GM3: 0.0800  RAES: 1.40
     1s    -10.707211    1.230000
  6     Wed Apr 25 08:07:45 CEST 2018   EN: 2.550 GM2: 0.538  GM3: 0.1500  RAES: 3.00
     2s    -13.970922    2.096432
     2p    -10.063292    1.800000
  7     Wed Apr 25 08:07:45 CEST 2018   EN: 3.040 GM2: 0.461  GM3:-0.0640  RAES: 1.90
     2s    -16.686243    2.339881
     2p    -12.523956    2.014332
  8     Wed Apr 25 08:07:45 CEST 2018   EN: 3.440 GM2: 0.452  GM3:-0.0517  RAES: 1.80
     2s    -20.229985    2.439742
     2p    -15.503117    2.137023
  9     Mon Apr 23 13:58:50 CEST 2018   EN: 3.980 GM2: 0.532  GM3: 0.1426  RAES: 2.40
     2s    -23.458179    2.416361
     2p    -15.746583    2.308399

           ------------------------------------------------- 
          |        Self-Consistent Charge Iterations        |
           ------------------------------------------------- 

          ...................................................
          :                      SETUP                      :
          :.................................................:
          :  # basis functions                  85          :
          :  # atomic orbitals                  85          :
          :  # shells                           45          :
          :  # electrons                        98          :
          :  max. iterations                   250          :
          :  Hamiltonian                  GFN2-xTB          :
          :  restarted?                      false          :
          :  GBSA solvation                  false          :
          :  PC potential                    false          :
          :  electronic temp.          300.0000000     K    :
          :  accuracy                    1.0000000          :
          :  -> integral cutoff          0.2500000E+02      :
          :  -> integral neglect         0.1000000E-07      :
          :  -> SCF convergence          0.1000000E-05 Eh   :
          :  -> wf. convergence          0.1000000E-03 e    :
          :  Broyden damping             0.4000000          :
          ...................................................

 iter      E             dE          RMSdq      gap      omega  full diag
   1    -57.1891370 -0.571891E+02  0.679E+00    2.45       0.0  T
   2    -57.2433076 -0.541705E-01  0.429E+00    2.19       1.0  T
   3    -57.1725723  0.707352E-01  0.305E+00    1.85       1.0  T
   4    -57.3126183 -0.140046E+00  0.770E-01    1.99       1.0  T
   5    -57.3230107 -0.103923E-01  0.189E-01    1.95       1.0  T
   6    -57.3231575 -0.146867E-03  0.944E-02    1.98       1.0  T
   7    -57.3232662 -0.108651E-03  0.400E-02    1.99       1.0  T
   8    -57.3232776 -0.114595E-04  0.149E-02    1.98       1.3  T
   9    -57.3232794 -0.179610E-05  0.618E-03    1.98       3.2  T
  10    -57.3232797 -0.226850E-06  0.339E-03    1.98       5.9  T
  11    -57.3232798 -0.150571E-06  0.117E-03    1.98      17.1  T
  12    -57.3232798 -0.167737E-07  0.616E-04    1.98      32.5  T
  13    -57.3232798 -0.364550E-08  0.209E-04    1.98      95.5  T

   *** convergence criteria satisfied after 13 iterations ***

         #    Occupation            Energy/Eh            Energy/eV
      -------------------------------------------------------------
         1        2.0000           -0.8948375             -24.3498
       ...           ...                  ...                  ...
        43        2.0000           -0.4842207             -13.1763
        44        2.0000           -0.4754976             -12.9389
        45        2.0000           -0.4719681             -12.8429
        46        2.0000           -0.4671345             -12.7114
        47        2.0000           -0.4567226             -12.4281
        48        2.0000           -0.4481406             -12.1945
        49        2.0000           -0.4325110             -11.7692 (HOMO)
        50                         -0.3597180              -9.7884 (LUMO)
        51                         -0.3406210              -9.2688
        52                         -0.2876309              -7.8268
        53                         -0.2673297              -7.2744
        54                         -0.2626215              -7.1463
       ...                                ...                  ...
        85                          1.1391788              30.9986
      -------------------------------------------------------------
                  HL-Gap            0.0727930 Eh            1.9808 eV
             Fermi-level           -0.3961145 Eh          -10.7788 eV

 SCC (total)                   0 d,  0 h,  0 min,  0.064 sec
 SCC setup                      ...        0 min,  0.000 sec (  0.296%)
 Dispersion                     ...        0 min,  0.000 sec (  0.366%)
 integral evaluation            ...        0 min,  0.015 sec ( 24.164%)
 zeroth order Hamiltonian       ...        0 min,  0.000 sec (  0.259%)
 iterations                     ...        0 min,  0.032 sec ( 50.625%)
 molecular gradient             ...        0 min,  0.015 sec ( 23.800%)
 printout                       ...        0 min,  0.000 sec (  0.471%)

         :::::::::::::::::::::::::::::::::::::::::::::::::::::
         ::                     SUMMARY                     ::
         :::::::::::::::::::::::::::::::::::::::::::::::::::::
         :: total energy             -56.520620558378 Eh    ::
         :: gradient norm              0.000946689390 Eh/a0 ::
         :: HOMO-LUMO gap              1.980799438741 eV    ::
         ::.................................................::
         :: SCC energy               -57.323279841125 Eh    ::
         :: -> isotropic ES            0.081008425847 Eh    ::
         :: -> anisotropic ES          0.000011157212 Eh    ::
         :: -> anisotropic XC          0.026772335094 Eh    ::
         :: -> dispersion             -0.029416205994 Eh    ::
         :: repulsion energy           0.802675702145 Eh    ::
         :: add. restraining           0.000000000000 Eh    ::
         :::::::::::::::::::::::::::::::::::::::::::::::::::::

      ----------------------------------------------------------- 
     |                   =====================                   |
     |                        A N C O P T                        |
     |                   =====================                   |
     |               Approximate Normal Coordinate               |
     |                Rational Function Optimizer                |
      ----------------------------------------------------------- 

          ...................................................
          :                      SETUP                      :
          :.................................................:
          :   optimization level            normal          :
          :   max. optcycles                   200          :
          :   ANC micro-cycles                  20          :
          :   degrees of freedom                69          :
          :.................................................:
          :   RF solver                   davidson          :
          :   input Hessian                  false          :
          :   write xtbopt.log                true          :
          :   linear?                        false          :
          :   energy convergence         0.5000000E-05 Eh   :
          :   grad. convergence          0.1000000E-02 Eh/α :
          :   maximium RF displ.         2.0000000          :
          :   Hlow (freq-cutoff)         0.5000000E-02      :
          :   Hmax (freq-cutoff)         5.0000000          :
          :   S6 in model hess.         20.0000000          :
          ...................................................

generating ANC from model Hessian ...
Using Lindh-Hessian (1995)
 Shifting diagonal of input Hessian by   4.960288768397174E-003
 Lowest  eigenvalues of input Hessian
   -0.000000   -0.000000   -0.000000   -0.000000   -0.000000    0.000000
    0.005000    0.006002    0.006602    0.006996    0.009004    0.011683
    0.014386    0.014798    0.015454    0.018355    0.022132    0.022591
 Highest eigenvalues
    1.985341    2.022030    2.058545    2.296583    2.608788    2.644971
 

........................................................................
.............................. CYCLE    1 ..............................
........................................................................
   1    -57.3232798 -0.573233E+02  0.686E-05    1.98       0.0  T
   2    -57.3232798 -0.173728E-10  0.451E-05    1.98     443.0  T
   3    -57.3232798 -0.221121E-10  0.271E-05    1.98     739.0  T
     SCC iter.                  ...        0 min,  0.005 sec
     gradient                   ...        0 min,  0.015 sec
 * total energy  :   -56.5206205 Eh     change        0.1505629E-07 Eh
   gradient norm :     0.0009465 Eh/α   predicted     0.0000000E+00 (-100.00%)
   displ. norm   :     0.0085290 α      lambda       -0.1231975E-05
   maximum displ.:     0.0044857 α      in ANC's #2, #17, #1, ...

........................................................................
.............................. CYCLE    2 ..............................
........................................................................
   1    -57.3229642 -0.573230E+02  0.957E-03    1.98       0.0  T
   2    -57.3229642 -0.301992E-07  0.542E-03    1.98       3.7  T
   3    -57.3229642  0.442999E-07  0.161E-03    1.98      12.4  T
   4    -57.3229642 -0.591576E-07  0.297E-04    1.98      67.2  T
   5    -57.3229642 -0.504137E-09  0.161E-04    1.98     123.9  T
     SCC iter.                  ...        0 min,  0.007 sec
     gradient                   ...        0 min,  0.015 sec
 * total energy  :   -56.5206200 Eh     change        0.5682447E-06 Eh
   gradient norm :     0.0008090 Eh/α   predicted    -0.6187928E-06 (-208.90%)
   displ. norm   :     0.0140221 α      lambda       -0.2063335E-05
   maximum displ.:     0.0119867 α      in ANC's #1, #4, #3, ...

........................................................................
.............................. CYCLE    3 ..............................
........................................................................
   1    -57.3228526 -0.573229E+02  0.236E-02    1.98       0.0  T
   2    -57.3228528 -0.187143E-06  0.130E-02    1.98       1.5  T
   3    -57.3228528 -0.584741E-07  0.110E-03    1.98      18.2  T
   4    -57.3228529 -0.244978E-07  0.296E-04    1.98      67.5  T
   5    -57.3228529 -0.132211E-09  0.114E-04    1.98     175.0  T
     SCC iter.                  ...        0 min,  0.008 sec
     gradient                   ...        0 min,  0.015 sec
 * total energy  :   -56.5206165 Eh     change        0.3475488E-05 Eh
   gradient norm :     0.0016482 Eh/α   predicted    -0.1032515E-05 (-129.71%)
   displ. norm   :     0.0145492 α      lambda       -0.7952188E-05
   maximum displ.:     0.0088024 α      in ANC's #1, #17, #14, ...

........................................................................
.............................. CYCLE    4 ..............................
........................................................................
   1    -57.3232526 -0.573233E+02  0.198E-02    1.98       0.0  T
   2    -57.3232527 -0.119323E-06  0.111E-02    1.98       1.8  T
   3    -57.3232528 -0.233281E-07  0.122E-03    1.98      16.4  T
   4    -57.3232528 -0.275115E-07  0.506E-04    1.98      39.5  T
   5    -57.3232528 -0.113548E-08  0.238E-04    1.98      84.0  T
     SCC iter.                  ...        0 min,  0.007 sec
     gradient                   ...        0 min,  0.015 sec
 * total energy  :   -56.5206185 Eh     change       -0.2033022E-05 Eh
   gradient norm :     0.0009370 Eh/α   predicted    -0.3977055E-05 (  95.62%)
   displ. norm   :     0.0099552 α      lambda       -0.4687773E-05
   maximum displ.:     0.0084283 α      in ANC's #17, #24, #14, ...

   *** GEOMETRY OPTIMIZATION CONVERGED AFTER 4 ITERATIONS ***

------------------------------------------------------------------------
 total energy gain   :         0.0000020 Eh        0.0013 kcal/mol
 total RMSD          :         0.0018617 a0        0.0010 Å
 total power (kW/mol):         0.0013297 (step)    0.0343 (real)
------------------------------------------------------------------------

 ANCopt (total)                0 d,  0 h,  0 min,  0.155 sec
 optimizer setup                ...        0 min,  0.000 sec (  0.038%)
 model hessian                  ...        0 min,  0.003 sec (  2.062%)
 ANC generation                 ...        0 min,  0.001 sec (  0.404%)
 coordinate transformation      ...        0 min,  0.000 sec (  0.049%)
 single point calculation       ...        0 min,  0.150 sec ( 97.046%)
 optimization log               ...        0 min,  0.000 sec (  0.153%)
 hessian update                 ...        0 min,  0.000 sec (  0.014%)
 rational function              ...        0 min,  0.000 sec (  0.147%)

================
 final structure:
================
$coord
    0.96820766191839    3.10901330505811   -0.00648125631369      C 
    3.43655397263540    2.22917666786442   -0.00675811920904      C 
    3.94821891883162   -0.34920076645350   -0.00550465938928      C 
    2.00669185015163   -2.12157552231630   -0.00352843992998      C 
   -0.44739657548456   -1.23503769633203   -0.00324077299267      C 
   -0.99559063275583    1.36804961126935   -0.00439109144474      C 
   -3.73253972725737    1.73158544210089   -0.00107569814831      C 
   -4.97133917451199    3.98839169208125    0.00101772509798      C 
   -3.76758408330950    6.37468142537924   -0.00268063298893      C 
   -2.90077874495385    8.36005532853931   -0.00603903168826      N 
   -7.63142802445195    4.25433398995653    0.00719119286439      C 
   -9.76981086006428    4.60056885028723    0.01426901519573      N 
   -4.89725848701625   -0.77876087549977    0.00299581566329      C 
   -7.32669289377695   -1.45910910769979    0.00655689237031      C 
   -2.82187964782440   -2.70585491429614   -0.00238847703220      C 
   -3.07128245022524   -4.96819601300420   -0.00075132093670      O 
    6.63074631876180   -1.30150701054404   -0.00450317873211      C 
    8.34972305882956    0.55168980028196   -0.01873860891913      F 
    7.11956828437093   -2.73225123617232    2.03536518979211      F 
    7.11288721604680   -2.75761380145914   -2.02767930301572      F 
    0.61855296420202    5.11487170024780   -0.00692598648169      H 
    4.98085170535339    3.56128737552303   -0.00790736680003      H 
    2.38990999965959   -4.12496998305775   -0.00336961842615      H 
   -8.87880881480799   -0.14699597552684   -0.00006271221931      H 
   -7.77617951042961   -3.44778120589336   -0.00094974621326      H 
$end
           -------------------------------------------------
          |                Final Singlepoint                |
           -------------------------------------------------

          ...................................................
          :                      SETUP                      :
          :.................................................:
          :  # basis functions                  85          :
          :  # atomic orbitals                  85          :
          :  # shells                           45          :
          :  # electrons                        98          :
          :  max. iterations                   250          :
          :  Hamiltonian                  GFN2-xTB          :
          :  restarted?                      false          :
          :  GBSA solvation                  false          :
          :  PC potential                    false          :
          :  electronic temp.          300.0000000     K    :
          :  accuracy                    1.0000000          :
          :  -> integral cutoff          0.2500000E+02      :
          :  -> integral neglect         0.1000000E-07      :
          :  -> SCF convergence          0.1000000E-05 Eh   :
          :  -> wf. convergence          0.1000000E-03 e    :
          :  Broyden damping             0.4000000          :
          ...................................................

 iter      E             dE          RMSdq      gap      omega  full diag
   1    -57.3232528 -0.573233E+02  0.107E-04    1.98       0.0  T
   2    -57.3232528  0.475708E-10  0.939E-05    1.98     213.0  T
   3    -57.3232528 -0.238501E-09  0.283E-05    1.98     707.3  T

   *** convergence criteria satisfied after 3 iterations ***

         #    Occupation            Energy/Eh            Energy/eV
      -------------------------------------------------------------
         1        2.0000           -0.8948478             -24.3500
       ...           ...                  ...                  ...
        43        2.0000           -0.4842261             -13.1765
        44        2.0000           -0.4755044             -12.9391
        45        2.0000           -0.4719830             -12.8433
        46        2.0000           -0.4671190             -12.7110
        47        2.0000           -0.4567138             -12.4278
        48        2.0000           -0.4481350             -12.1944
        49        2.0000           -0.4325255             -11.7696 (HOMO)
        50                         -0.3597372              -9.7889 (LUMO)
        51                         -0.3406373              -9.2692
        52                         -0.2876398              -7.8271
        53                         -0.2673877              -7.2760
        54                         -0.2626284              -7.1465
       ...                                ...                  ...
        85                          1.1390892              30.9962
      -------------------------------------------------------------
                  HL-Gap            0.0727883 Eh            1.9807 eV
             Fermi-level           -0.3961314 Eh          -10.7793 eV

 SCC (total)                   0 d,  0 h,  0 min,  0.036 sec
 SCC setup                      ...        0 min,  0.000 sec (  0.431%)
 Dispersion                     ...        0 min,  0.000 sec (  0.493%)
 integral evaluation            ...        0 min,  0.015 sec ( 42.787%)
 zeroth order Hamiltonian       ...        0 min,  0.000 sec (  0.442%)
 iterations                     ...        0 min,  0.005 sec ( 12.926%)
 molecular gradient             ...        0 min,  0.015 sec ( 42.122%)
 printout                       ...        0 min,  0.000 sec (  0.769%)

         :::::::::::::::::::::::::::::::::::::::::::::::::::::
         ::                     SUMMARY                     ::
         :::::::::::::::::::::::::::::::::::::::::::::::::::::
         :: total energy             -56.520618544387 Eh    ::
         :: gradient norm              0.000937172532 Eh/a0 ::
         :: HOMO-LUMO gap              1.980670037909 eV    ::
         ::.................................................::
         :: SCC energy               -57.323252793598 Eh    ::
         :: -> isotropic ES            0.081013469985 Eh    ::
         :: -> anisotropic ES          0.000010237898 Eh    ::
         :: -> anisotropic XC          0.026767722527 Eh    ::
         :: -> dispersion             -0.029416639327 Eh    ::
         :: repulsion energy           0.802650678170 Eh    ::
         :: add. restraining           0.000000000000 Eh    ::
         :::::::::::::::::::::::::::::::::::::::::::::::::::::

           -------------------------------------------------
          |                Property Printout                |
           -------------------------------------------------

    * Orbital Energies and Occupations

         #    Occupation            Energy/Eh            Energy/eV
      -------------------------------------------------------------
         1        2.0000           -0.8948478             -24.3500
       ...           ...                  ...                  ...
        37        2.0000           -0.5200744             -14.1519
        38        2.0000           -0.5185418             -14.1102
        39        2.0000           -0.5125764             -13.9479
        40        2.0000           -0.5119718             -13.9315
        41        2.0000           -0.5003844             -13.6162
        42        2.0000           -0.4980588             -13.5529
        43        2.0000           -0.4842261             -13.1765
        44        2.0000           -0.4755044             -12.9391
        45        2.0000           -0.4719830             -12.8433
        46        2.0000           -0.4671190             -12.7110
        47        2.0000           -0.4567138             -12.4278
        48        2.0000           -0.4481350             -12.1944
        49        2.0000           -0.4325255             -11.7696 (HOMO)
        50                         -0.3597372              -9.7889 (LUMO)
        51                         -0.3406373              -9.2692
        52                         -0.2876398              -7.8271
        53                         -0.2673877              -7.2760
        54                         -0.2626284              -7.1465
        55                         -0.2433781              -6.6227
        56                         -0.2226331              -6.0582
        57                         -0.1956644              -5.3243
        58                         -0.1480346              -4.0282
        59                         -0.1180183              -3.2114
        60                          0.0018922               0.0515
       ...                                ...                  ...
        85                          1.1390892              30.9962
      -------------------------------------------------------------
                  HL-Gap            0.0727883 Eh            1.9807 eV
             Fermi-level           -0.3961314 Eh          -10.7793 eV

     #   Z        covCN         q      C6AA      α(0)
     1   6 C      2.914    -0.021    28.532     8.759
     2   6 C      2.920    -0.014    28.354     8.732
     3   6 C      2.978    -0.014    28.347     8.733
     4   6 C      2.915    -0.007    28.191     8.707
     5   6 C      3.035    -0.008    28.193     8.709
     6   6 C      3.027     0.018    27.587     8.615
     7   6 C      3.007     0.035    27.196     8.554
     8   6 C      2.947     0.024    27.462     8.595
     9   6 C      1.936     0.125    28.018     8.548
    10   7 N      0.911    -0.206    25.493     7.302
    11   6 C      1.936     0.126    27.988     8.544
    12   7 N      0.911    -0.205    25.450     7.296
    13   6 C      2.993    -0.012    28.309     8.728
    14   6 C      2.840    -0.051    29.259     8.865
    15   6 C      2.862     0.232    23.156     7.888
    16   8 O      0.856    -0.326    20.267     6.036
    17   6 C      3.336     0.487    17.266     6.581
    18   9 F      0.791    -0.199    11.225     3.958
    19   9 F      0.791    -0.202    11.252     3.962
    20   9 F      0.791    -0.202    11.251     3.962
    21   1 H      0.926     0.075     2.029     2.228
    22   1 H      0.926     0.081     1.972     2.196
    23   1 H      0.926     0.086     1.919     2.166
    24   1 H      0.926     0.082     1.959     2.189
    25   1 H      0.926     0.095     1.829     2.115

 Mol. C6AA /au·bohr⁶  :      10774.999549
 Mol. C8AA /au·bohr⁸  :     272564.641724
 Mol. α(0) /au        :        161.968337


Wiberg/Mayer (AO) data.
largest (>0.10) Wiberg bond orders for each atom
          total WBO             WBO to atom ...
     1  C   3.978        C    2 1.437    C    6 1.394    H   21 0.959
     2  C   3.980        C    1 1.437    C    3 1.410    H   22 0.964
     3  C   3.963        C    2 1.410    C    4 1.404    C   17 0.948
     4  C   3.983        C    5 1.419    C    3 1.404    H   23 0.961
     5  C   3.979        C    4 1.419    C    6 1.297    C   15 1.018
     6  C   3.988        C    1 1.394    C    5 1.297    C    7 1.090
     7  C   3.984        C    8 1.547    C    6 1.090    C   13 1.083
     8  C   3.988        C    7 1.547    C    9 1.085    C   11 1.084
     9  C   3.949        N   10 2.784    C    8 1.085
    10  N   2.990        C    9 2.784
    11  C   3.949        N   12 2.786    C    8 1.084
    12  N   2.992        C   11 2.786
    13  C   3.987        C   14 1.800    C    7 1.083    C   15 0.989
    14  C   3.941        C   13 1.800    H   25 0.966    H   24 0.965
    15  C   3.932        O   16 1.827    C    5 1.018    C   13 0.989
    16  O   2.098        C   15 1.827
    17  C   3.832        F   18 0.956    C    3 0.948    F   20 0.947    F   19 0.947
    18  F   1.080        C   17 0.956
    19  F   1.075        C   17 0.947
    20  F   1.075        C   17 0.947
    21  H   0.994        C    1 0.959
    22  H   0.993        C    2 0.964
    23  H   0.992        C    4 0.961
    24  H   0.993        C   14 0.965
    25  H   0.990        C   14 0.966

molecular dipole:
                 x           y           z       tot (Debye)
 q only:       -0.569       0.204      -0.003
   full:       -0.282      -0.073      -0.005       0.740
molecular quadrupole (traceless):
                xx          xy          yy          xz          yz          zz
 q only:       -5.832      12.992      -6.595       0.033      -0.006      12.427
  q+dip:       -5.293      15.733      -8.227       0.054      -0.006      13.520
   full:       -9.318      15.321     -11.412       0.068      -0.002      20.730

           -------------------------------------------------
          |                Geometry Summary                 |
           -------------------------------------------------

      molecular mass/u    :      274.2015000
   center of mass at/Å    :       -0.0805761       0.3214963      -0.0007716
  moments of inertia/u·Å² :        0.7488099E+03   0.2584171E+04   0.3245150E+04
rotational constants/cm⁻¹ :        0.2251257E-01   0.6523419E-02   0.5194716E-02

 * 19 selected distances

     #   Z        #   Z                                     value/Å
     1   6 C      2   6 C                                 1.3866914
     2   6 C      3   6 C                                 1.3910250
     3   6 C      4   6 C                                 1.3911268
     4   6 C      5   6 C                                 1.3807876
     1   6 C      6   6 C                                 1.3887715
     5   6 C      6   6 C                                 1.4077091 (max)
     7   6 C      8   6 C                                 1.3623414
     9   6 C     10   7 N                                 1.1463832
    11   6 C     12   7 N                                 1.1463267
    13   6 C     14   6 C                                 1.3350627
    15   6 C     16   8 O                                 1.2044325
    17   6 C     18   9 F                                 1.3376176
    17   6 C     19   9 F                                 1.3436350
    17   6 C     20   9 F                                 1.3435214
     1   6 C     21   1 H                                 1.0774608
     2   6 C     22   1 H                                 1.0792331
     4   6 C     23   1 H                                 1.0793719
    14   6 C     24   1 H                                 1.0755127 (min)
    14   6 C     25   1 H                                 1.0789133

 * 5 distinct bonds (by element types)

   Z      Z             #   av. dist./Å        max./Å        min./Å
   1 H    6 C           5     1.0780984     1.0793719     1.0755127
   6 C    6 C           8     1.3804395     1.4077091     1.3350627
   6 C    7 N           2     1.1463549     1.1463832     1.1463267
   6 C    8 O           1     1.2044325     1.2044325     1.2044325
   6 C    9 F           3     1.3415913     1.3436350     1.3376176


optimized geometry written to: xtbopt.xyz


           -------------------------------------------------
          | TOTAL ENERGY              -56.520618544387 Eh   |
          | GRADIENT NORM               0.000937172532 Eh/α |
          | HOMO-LUMO GAP               1.980670037909 eV   |
           -------------------------------------------------

------------------------------------------------------------------------
 * finished run on 2021/02/19 at 08:08:55.724     
------------------------------------------------------------------------
 total:
 * wall-time:     0 d,  0 h,  0 min,  0.308 sec
 *  cpu-time:     0 d,  0 h,  0 min,  0.265 sec
 * ratio c/w:     0.861 speedup
 SCF:
 * wall-time:     0 d,  0 h,  0 min,  0.064 sec
 *  cpu-time:     0 d,  0 h,  0 min,  0.051 sec
 * ratio c/w:     0.795 speedup
 ANC optimizer:
 * wall-time:     0 d,  0 h,  0 min,  0.191 sec
 *  cpu-time:     0 d,  0 h,  0 min,  0.191 sec
 * ratio c/w:     0.999 speedup

