      -----------------------------------------------------------      
     |                   =====================                   |     
     |                           x T B                           |     
     |                   =====================                   |     
     |                         S. Grimme                         |     
     |          Mulliken Center for Theoretical Chemistry        |     
     |                    University of Bonn                     |     
     |                Version 6.2 RC2 (SAW190805)                |     
      -----------------------------------------------------------      

   This program is distributed in the hope that it will be useful,
   but WITHOUT ANY WARRANTY; without even the implied warranty of
   MERCHANTABILITY or FITNESS FOR A PARTICULAR PURPOSE.
   
   FOR NON-COMMERCIAL, ACADEMIA USE ONLY.
   
   Cite this work as:
   * S. Grimme, C. Bannwarth, P. Shushkov, J. Chem. Theory Comput., 2017,
     13, 1989-2009. DOI: 10.1021/acs.jctc.7b00118
   * C. Bannwarth, S. Ehlert and S. Grimme., J. Chem. Theory Comput., 2019,
     15, 1652-1671. DOI: 10.1021/acs.jctc.8b01176
   * P. Pracht, E. Caldeweyher, S. Ehlert, S. Grimme, ChemRxiv, 2019, preprint.
     DOI: 10.26434/chemrxiv.8326202.v1
   
   for DFT-D4:
   * E. Caldeweyher, C. Bannwarth and S. Grimme, J. Chem. Phys., 2017,
     147, 034112. DOI: 10.1063/1.4993215
   * E. Caldeweyher, S. Ehlert, A. Hansen, H. Neugebauer, S. Spicher,
     C. Bannwarth and S. Grimme, J. Chem. Phys., 2019, 150, 154122.
     DOI: 10.1063/1.5090222
   
   for sTDA-xTB:
   * S. Grimme and C. Bannwarth, J. Chem. Phys., 2016, 145, 054103.
     DOI: 10.1063/1.4959605
   
   in the mass-spec context:
   * V. Asgeirsson, C. Bauer and S. Grimme, Chem. Sci., 2017, 8, 4879.
     DOI: 10.1039/c7sc00601b
   
   for metadynamics refer to:
   * S. Grimme, J. Chem. Theory Comput., 2019, 155, 2847-2862
     DOI: 10.1021/acs.jctc.9b00143
   
   with help from (in alphabetical order)
   C. Bannwarth, F. Bohle, G. Brandenburg, E. Caldeweyher, M. Checinski,
   S. Dohm, S. Ehlert, S. Ehrlich, F. März, H. Neugebauer, J. Pisarek,
   P. Pracht, P. Shushkov, and S. Spicher.
   
 * started run on 2021/02/19 at 08:08:56.116     

           -------------------------------------------------
          |                Calculation Setup                |
           -------------------------------------------------

          program call               : /ihome/ghutchison/geoffh/xtb/xtb 12d.xyz -opt
          hostname                   : smp-n167
          coordinate file            : 12d.xyz
          omp threads                :                     1
          number of atoms            :                    25
          number of electrons        :                    68
          charge                     :                     0
          spin                       :                   0.0
          first test random number   :      0.87190569430216


########################################################################
# WARNING! Please study the warnings concerning your input carefully
#  - the use of '-opt' is discouraged, please use '--opt' next time
########################################################################

           ------------------------------------------------- 
          |                 G F N 2 - x T B                 |
          | Geometry, Frequencies, Noncovalent interactions |
          |            JCTC 2019 parametrisation            |
           ------------------------------------------------- 
             KAB for C  - Si     :                1.0500
             KAB for H  - Pd     :                0.9500
             k(s)              :                1.8500
             k(p)              :                2.2300
             k(d)              :                2.2300
             k(f)              :                2.0000
             kEN (H0ij)        :               -2.0000
             D4 a1             :                0.5200
             D4 a2             :                5.0000
             D4 s6             :                1.0000
             D4 s8             :                2.7000
             D4 s9             :                5.0000
             alphaj            :                2.0000

  Z AO/shell   Hii/eV     exponent
  1     Wed Apr 25 08:07:45 CEST 2018   EN: 2.200 GM2: 0.406  GM3: 0.0800  RAES: 1.40
     1s    -10.707211    1.230000
  6     Wed Apr 25 08:07:45 CEST 2018   EN: 2.550 GM2: 0.538  GM3: 0.1500  RAES: 3.00
     2s    -13.970922    2.096432
     2p    -10.063292    1.800000
  7     Wed Apr 25 08:07:45 CEST 2018   EN: 3.040 GM2: 0.461  GM3:-0.0640  RAES: 1.90
     2s    -16.686243    2.339881
     2p    -12.523956    2.014332

           ------------------------------------------------- 
          |        Self-Consistent Charge Iterations        |
           ------------------------------------------------- 

          ...................................................
          :                      SETUP                      :
          :.................................................:
          :  # basis functions                  67          :
          :  # atomic orbitals                  67          :
          :  # shells                           39          :
          :  # electrons                        68          :
          :  max. iterations                   250          :
          :  Hamiltonian                  GFN2-xTB          :
          :  restarted?                      false          :
          :  GBSA solvation                  false          :
          :  PC potential                    false          :
          :  electronic temp.          300.0000000     K    :
          :  accuracy                    1.0000000          :
          :  -> integral cutoff          0.2500000E+02      :
          :  -> integral neglect         0.1000000E-07      :
          :  -> SCF convergence          0.1000000E-05 Eh   :
          :  -> wf. convergence          0.1000000E-03 e    :
          :  Broyden damping             0.4000000          :
          ...................................................

 iter      E             dE          RMSdq      gap      omega  full diag
   1    -37.0133023 -0.370133E+02  0.420E+00    2.82       0.0  T
   2    -37.0576870 -0.443847E-01  0.269E+00    3.31       1.0  T
   3    -37.0507965  0.689057E-02  0.118E+00    3.15       1.0  T
   4    -37.0628947 -0.120983E-01  0.329E-01    3.22       1.0  T
   5    -37.0655921 -0.269732E-02  0.993E-02    3.23       1.0  T
   6    -37.0657364 -0.144370E-03  0.428E-02    3.23       1.0  T
   7    -37.0657578 -0.214088E-04  0.196E-02    3.23       1.0  T
   8    -37.0657582 -0.351647E-06  0.377E-03    3.23       5.3  T
   9    -37.0657585 -0.258797E-06  0.107E-03    3.23      18.8  T
  10    -37.0657585 -0.228297E-08  0.587E-04    3.23      34.1  T
  11    -37.0657585 -0.592453E-08  0.257E-04    3.23      77.9  T

   *** convergence criteria satisfied after 11 iterations ***

         #    Occupation            Energy/Eh            Energy/eV
      -------------------------------------------------------------
         1        2.0000           -0.6712240             -18.2649
       ...           ...                  ...                  ...
        28        2.0000           -0.4298634             -11.6972
        29        2.0000           -0.4160840             -11.3222
        30        2.0000           -0.4138120             -11.2604
        31        2.0000           -0.4126018             -11.2275
        32        2.0000           -0.3993961             -10.8681
        33        2.0000           -0.3723143             -10.1312
        34        2.0000           -0.3574456              -9.7266 (HOMO)
        35                         -0.2388596              -6.4997 (LUMO)
        36                         -0.2158482              -5.8735
        37                         -0.1877797              -5.1097
        38                         -0.1799341              -4.8963
        39                         -0.0864030              -2.3511
       ...                                ...                  ...
        67                          0.7532318              20.4965
      -------------------------------------------------------------
                  HL-Gap            0.1185861 Eh            3.2269 eV
             Fermi-level           -0.2981526 Eh           -8.1131 eV

 SCC (total)                   0 d,  0 h,  0 min,  0.032 sec
 SCC setup                      ...        0 min,  0.000 sec (  0.518%)
 Dispersion                     ...        0 min,  0.000 sec (  0.681%)
 integral evaluation            ...        0 min,  0.009 sec ( 28.627%)
 zeroth order Hamiltonian       ...        0 min,  0.000 sec (  0.383%)
 iterations                     ...        0 min,  0.011 sec ( 33.426%)
 molecular gradient             ...        0 min,  0.011 sec ( 35.616%)
 printout                       ...        0 min,  0.000 sec (  0.693%)

         :::::::::::::::::::::::::::::::::::::::::::::::::::::
         ::                     SUMMARY                     ::
         :::::::::::::::::::::::::::::::::::::::::::::::::::::
         :: total energy             -36.391789090131 Eh    ::
         :: gradient norm              0.000097478515 Eh/a0 ::
         :: HOMO-LUMO gap              3.226890806693 eV    ::
         ::.................................................::
         :: SCC energy               -37.065758463236 Eh    ::
         :: -> isotropic ES            0.004014397426 Eh    ::
         :: -> anisotropic ES          0.006385028873 Eh    ::
         :: -> anisotropic XC          0.020428425804 Eh    ::
         :: -> dispersion             -0.026462312353 Eh    ::
         :: repulsion energy           0.673908799642 Eh    ::
         :: add. restraining           0.000000000000 Eh    ::
         :::::::::::::::::::::::::::::::::::::::::::::::::::::

      ----------------------------------------------------------- 
     |                   =====================                   |
     |                        A N C O P T                        |
     |                   =====================                   |
     |               Approximate Normal Coordinate               |
     |                Rational Function Optimizer                |
      ----------------------------------------------------------- 

          ...................................................
          :                      SETUP                      :
          :.................................................:
          :   optimization level            normal          :
          :   max. optcycles                   200          :
          :   ANC micro-cycles                  20          :
          :   degrees of freedom                69          :
          :.................................................:
          :   RF solver                   davidson          :
          :   input Hessian                  false          :
          :   write xtbopt.log                true          :
          :   linear?                        false          :
          :   energy convergence         0.5000000E-05 Eh   :
          :   grad. convergence          0.1000000E-02 Eh/α :
          :   maximium RF displ.         2.0000000          :
          :   Hlow (freq-cutoff)         0.5000000E-02      :
          :   Hmax (freq-cutoff)         5.0000000          :
          :   S6 in model hess.         20.0000000          :
          ...................................................

generating ANC from model Hessian ...
Using Lindh-Hessian (1995)
 Shifting diagonal of input Hessian by   2.217167622721959E-003
 Lowest  eigenvalues of input Hessian
   -0.000000   -0.000000   -0.000000    0.000000    0.000000    0.000000
    0.005000    0.005788    0.007435    0.011679    0.014752    0.014893
    0.015350    0.019827    0.023343    0.024713    0.031711    0.042414
 Highest eigenvalues
    1.916699    1.938166    2.039068    2.082799    2.153402    2.179675
 

........................................................................
.............................. CYCLE    1 ..............................
........................................................................
   1    -37.0657585 -0.370658E+02  0.649E-05    3.23       0.0  T
   2    -37.0657585 -0.298215E-10  0.391E-05    3.23     511.1  T
   3    -37.0657585 -0.167049E-10  0.229E-05    3.23     873.0  T
     SCC iter.                  ...        0 min,  0.003 sec
     gradient                   ...        0 min,  0.011 sec
 * total energy  :   -36.3917891 Eh     change       -0.8559304E-08 Eh
   gradient norm :     0.0000978 Eh/α   predicted     0.0000000E+00 (-100.00%)
   displ. norm   :     0.0001467 α      lambda        0.0000000E+00
   maximum displ.:     0.0001237 α      in ANC's #65, #58, #67, ...

   *** GEOMETRY OPTIMIZATION CONVERGED AFTER 1 ITERATIONS ***

------------------------------------------------------------------------
 total energy gain   :        -0.0000000 Eh       -0.0000 kcal/mol
 total RMSD          :         0.0000000 a0        0.0000 Å
 total power (kW/mol):        -0.0000225 (step)   -0.0008 (real)
------------------------------------------------------------------------

 ANCopt (total)                0 d,  0 h,  0 min,  0.029 sec
 optimizer setup                ...        0 min,  0.000 sec (  0.203%)
 model hessian                  ...        0 min,  0.004 sec ( 15.134%)
 ANC generation                 ...        0 min,  0.001 sec (  2.157%)
 coordinate transformation      ...        0 min,  0.000 sec (  0.016%)
 single point calculation       ...        0 min,  0.024 sec ( 81.912%)
 optimization log               ...        0 min,  0.000 sec (  0.237%)
 hessian update                 ...        0 min,  0.000 sec (  0.003%)
 rational function              ...        0 min,  0.000 sec (  0.106%)

================
 final structure:
================
$coord
    6.39597357574936   -0.40869382160713   -0.00006864613937      C 
    4.62299587911058   -2.32518613304275   -0.00001348717607      C 
    2.08954638233463   -1.64648084234935   -0.00004819120493      C 
    1.34473255452277    0.92139185579021   -0.00013823925457      C 
    3.16394424801595    2.81259382465936   -0.00017836223892      C 
    5.68074121812343    2.12555125368928   -0.00014737942749      C 
   -1.36675295479917    0.92420244376829   -0.00021143473779      C 
   -2.12807399909042   -1.64323679447276   -0.00016897138995      C 
   -0.02006050545549   -3.16018097806897   -0.00004723629315      N 
    0.04632240897870   -5.87035717075798    0.00015374236234      C 
   -4.67186935097170   -2.28604935434516   -0.00029416106495      C 
   -6.42641361161797   -0.35325289290624   -0.00042966952202      C 
   -5.69085946366932    2.17437385369335   -0.00043517443081      C 
   -3.16721721194187    2.83284670241034   -0.00032889598429      C 
    8.38133788030612   -0.88398366361370   -0.00004881475801      H 
    5.19882666572093   -4.28256515146344    0.00004341988917      H 
    2.61349352373295    4.77730606404357   -0.00023664350860      H 
    7.12530312026671    3.56726523271408   -0.00017599416887      H 
   -1.87119383960853   -6.60762814661310    0.00037898557933      H 
    1.02698360628127   -6.57246528959634    1.67851726222363      H 
    1.02670552565766   -6.57274863778166   -1.67825407708610      H 
   -5.28743181015422   -4.23226426796745   -0.00030887897428      H 
   -8.41532877672295   -0.81329586922788   -0.00055482616483      H 
   -7.12163076217635    3.62948768077957   -0.00053971370865      H 
   -2.59378366380039    4.79096196023797   -0.00033855101689      H 
$end
           -------------------------------------------------
          |                Final Singlepoint                |
           -------------------------------------------------

          ...................................................
          :                      SETUP                      :
          :.................................................:
          :  # basis functions                  67          :
          :  # atomic orbitals                  67          :
          :  # shells                           39          :
          :  # electrons                        68          :
          :  max. iterations                   250          :
          :  Hamiltonian                  GFN2-xTB          :
          :  restarted?                      false          :
          :  GBSA solvation                  false          :
          :  PC potential                    false          :
          :  electronic temp.          300.0000000     K    :
          :  accuracy                    1.0000000          :
          :  -> integral cutoff          0.2500000E+02      :
          :  -> integral neglect         0.1000000E-07      :
          :  -> SCF convergence          0.1000000E-05 Eh   :
          :  -> wf. convergence          0.1000000E-03 e    :
          :  Broyden damping             0.4000000          :
          ...................................................

 iter      E             dE          RMSdq      gap      omega  full diag
   1    -37.0657585 -0.370658E+02  0.740E-06    3.23       0.0  T
   2    -37.0657585 -0.127898E-12  0.369E-06    3.23    5418.9  T
   3    -37.0657585 -0.639488E-13  0.292E-06    3.23    6849.8  T

   *** convergence criteria satisfied after 3 iterations ***

         #    Occupation            Energy/Eh            Energy/eV
      -------------------------------------------------------------
         1        2.0000           -0.6712229             -18.2649
       ...           ...                  ...                  ...
        28        2.0000           -0.4298640             -11.6972
        29        2.0000           -0.4160853             -11.3223
        30        2.0000           -0.4138129             -11.2604
        31        2.0000           -0.4126030             -11.2275
        32        2.0000           -0.3993970             -10.8681
        33        2.0000           -0.3723157             -10.1312
        34        2.0000           -0.3574442              -9.7266 (HOMO)
        35                         -0.2388607              -6.4997 (LUMO)
        36                         -0.2158490              -5.8736
        37                         -0.1877796              -5.1097
        38                         -0.1799353              -4.8963
        39                         -0.0864036              -2.3512
       ...                                ...                  ...
        67                          0.7532303              20.4964
      -------------------------------------------------------------
                  HL-Gap            0.1185835 Eh            3.2268 eV
             Fermi-level           -0.2981524 Eh           -8.1131 eV

 SCC (total)                   0 d,  0 h,  0 min,  0.024 sec
 SCC setup                      ...        0 min,  0.000 sec (  0.546%)
 Dispersion                     ...        0 min,  0.000 sec (  0.671%)
 integral evaluation            ...        0 min,  0.009 sec ( 37.652%)
 zeroth order Hamiltonian       ...        0 min,  0.000 sec (  0.475%)
 iterations                     ...        0 min,  0.003 sec ( 12.630%)
 molecular gradient             ...        0 min,  0.011 sec ( 47.152%)
 printout                       ...        0 min,  0.000 sec (  0.818%)

         :::::::::::::::::::::::::::::::::::::::::::::::::::::
         ::                     SUMMARY                     ::
         :::::::::::::::::::::::::::::::::::::::::::::::::::::
         :: total energy             -36.391789100676 Eh    ::
         :: gradient norm              0.000097765018 Eh/a0 ::
         :: HOMO-LUMO gap              3.226820597730 eV    ::
         ::.................................................::
         :: SCC energy               -37.065758464026 Eh    ::
         :: -> isotropic ES            0.004013486298 Eh    ::
         :: -> anisotropic ES          0.006384920657 Eh    ::
         :: -> anisotropic XC          0.020428342432 Eh    ::
         :: -> dispersion             -0.026462318025 Eh    ::
         :: repulsion energy           0.673908799642 Eh    ::
         :: add. restraining           0.000000000000 Eh    ::
         :::::::::::::::::::::::::::::::::::::::::::::::::::::

           -------------------------------------------------
          |                Property Printout                |
           -------------------------------------------------

    * Orbital Energies and Occupations

         #    Occupation            Energy/Eh            Energy/eV
      -------------------------------------------------------------
         1        2.0000           -0.6712229             -18.2649
       ...           ...                  ...                  ...
        22        2.0000           -0.4695775             -12.7779
        23        2.0000           -0.4687934             -12.7565
        24        2.0000           -0.4680184             -12.7354
        25        2.0000           -0.4629130             -12.5965
        26        2.0000           -0.4389476             -11.9444
        27        2.0000           -0.4328055             -11.7772
        28        2.0000           -0.4298640             -11.6972
        29        2.0000           -0.4160853             -11.3223
        30        2.0000           -0.4138129             -11.2604
        31        2.0000           -0.4126030             -11.2275
        32        2.0000           -0.3993970             -10.8681
        33        2.0000           -0.3723157             -10.1312
        34        2.0000           -0.3574442              -9.7266 (HOMO)
        35                         -0.2388607              -6.4997 (LUMO)
        36                         -0.2158490              -5.8736
        37                         -0.1877796              -5.1097
        38                         -0.1799353              -4.8963
        39                         -0.0864036              -2.3512
        40                         -0.0534839              -1.4554
        41                          0.0123689               0.3366
        42                          0.1059070               2.8819
        43                          0.1165810               3.1723
        44                          0.1214702               3.3054
        45                          0.1241095               3.3772
       ...                                ...                  ...
        67                          0.7532303              20.4964
      -------------------------------------------------------------
                  HL-Gap            0.1185835 Eh            3.2268 eV
             Fermi-level           -0.2981524 Eh           -8.1131 eV

     #   Z        covCN         q      C6AA      α(0)
     1   6 C      2.924    -0.034    28.853     8.809
     2   6 C      2.910    -0.054    29.334     8.881
     3   6 C      3.086     0.042    26.953     8.510
     4   6 C      3.068    -0.019    28.411     8.740
     5   6 C      2.912    -0.033    28.821     8.803
     6   6 C      2.920    -0.043    29.056     8.839
     7   6 C      3.072    -0.019    28.409     8.739
     8   6 C      3.078     0.044    26.932     8.508
     9   7 N      2.796    -0.045    22.110     6.984
    10   6 C      3.689    -0.043    21.530     6.641
    11   6 C      2.910    -0.053    29.315     8.878
    12   6 C      2.923    -0.034    28.849     8.808
    13   6 C      2.920    -0.043    29.063     8.841
    14   6 C      2.912    -0.033    28.817     8.803
    15   1 H      0.926     0.026     2.638     2.540
    16   1 H      0.926     0.023     2.681     2.561
    17   1 H      0.926     0.029     2.601     2.522
    18   1 H      0.926     0.026     2.650     2.546
    19   1 H      0.925     0.059     2.209     2.324
    20   1 H      0.924     0.050     2.318     2.381
    21   1 H      0.924     0.050     2.319     2.381
    22   1 H      0.926     0.020     2.732     2.585
    23   1 H      0.926     0.027     2.635     2.539
    24   1 H      0.926     0.026     2.648     2.545
    25   1 H      0.926     0.029     2.596     2.520

 Mol. C6AA /au·bohr⁶  :       8274.418853
 Mol. C8AA /au·bohr⁸  :     204916.199063
 Mol. α(0) /au        :        146.226480


Wiberg/Mayer (AO) data.
largest (>0.10) Wiberg bond orders for each atom
          total WBO             WBO to atom ...
     1  C   3.970        C    2 1.470    C    6 1.395    H   15 0.972
     2  C   3.985        C    1 1.470    C    3 1.354    H   16 0.968    C    5 0.107
     3  C   3.963        C    2 1.354    C    4 1.255    N    9 1.148
     4  C   3.985        C    5 1.367    C    3 1.255    C    7 1.151
     5  C   3.982        C    6 1.473    C    4 1.367    H   17 0.969    C    2 0.107
     6  C   3.982        C    5 1.473    C    1 1.395    H   18 0.972
     7  C   3.985        C   14 1.368    C    8 1.252    C    4 1.151
     8  C   3.963        C   11 1.353    C    7 1.252    N    9 1.149
     9  N   3.561        C    8 1.149    C    3 1.148    C   10 1.008
    10  C   3.976        N    9 1.008    H   19 0.978    H   20 0.976    H   21 0.976
    11  C   3.985        C   12 1.470    C    8 1.353    H   22 0.965    C   14 0.106
    12  C   3.970        C   11 1.470    C   13 1.395    H   23 0.972
    13  C   3.982        C   14 1.472    C   12 1.395    H   24 0.972
    14  C   3.982        C   13 1.472    C    7 1.368    H   25 0.969    C   11 0.106
    15  H   0.999        C    1 0.972
    16  H   0.999        C    2 0.968
    17  H   0.999        C    5 0.969
    18  H   0.999        C    6 0.972
    19  H   0.996        C   10 0.978
    20  H   0.996        C   10 0.976
    21  H   0.996        C   10 0.976
    22  H   0.999        C   11 0.965
    23  H   0.999        C   12 0.972
    24  H   0.999        C   13 0.972
    25  H   0.999        C   14 0.969

molecular dipole:
                 x           y           z       tot (Debye)
 q only:        0.000      -0.698       0.000
   full:        0.001      -0.834       0.000       2.120
molecular quadrupole (traceless):
                xx          xy          yy          xz          yz          zz
 q only:       -3.379       0.013       6.373      -0.000      -0.000      -2.995
  q+dip:       -0.254       0.032       9.833       0.000      -0.001      -9.579
   full:       -2.670       0.039       7.884       0.000      -0.000      -5.214

           -------------------------------------------------
          |                Geometry Summary                 |
           -------------------------------------------------

      molecular mass/u    :      181.2366000
   center of mass at/Å    :       -0.0043254      -0.2642597      -0.0000874
  moments of inertia/u·Å² :        0.3569236E+03   0.8399669E+03   0.1193710E+04
rotational constants/cm⁻¹ :        0.4723037E-01   0.2006940E-01   0.1412205E-01

 * 27 selected distances

     #   Z        #   Z                                     value/Å
     1   6 C      2   6 C                                 1.3815878
     2   6 C      3   6 C                                 1.3879188
     3   6 C      4   6 C                                 1.4148658
     4   6 C      5   6 C                                 1.3886418
     1   6 C      6   6 C                                 1.3934510
     5   6 C      6   6 C                                 1.3805640
     4   6 C      7   6 C                                 1.4348572 (max)
     7   6 C      8   6 C                                 1.4171041
     3   6 C      9   7 N                                 1.3740003
     8   6 C      9   7 N                                 1.3743173
     9   7 N     10   6 C                                 1.4345938
     8   6 C     11   6 C                                 1.3884327
    11   6 C     12   6 C                                 1.3813582
    12   6 C     13   6 C                                 1.3930471
     7   6 C     14   6 C                                 1.3884823
    13   6 C     14   6 C                                 1.3801646
     1   6 C     15   1 H                                 1.0802959
     2   6 C     16   1 H                                 1.0796920 (min)
     5   6 C     17   1 H                                 1.0797149
     6   6 C     18   1 H                                 1.0800012
    10   6 C     19   1 H                                 1.0871260
    10   6 C     20   1 H                                 1.0936900
    10   6 C     21   1 H                                 1.0936902
    11   6 C     22   1 H                                 1.0801789
    12   6 C     23   1 H                                 1.0802766
    13   6 C     24   1 H                                 1.0798928
    14   6 C     25   1 H                                 1.0797085

 * 3 distinct bonds (by element types)

   Z      Z             #   av. dist./Å        max./Å        min./Å
   1 H    6 C          11     1.0831152     1.0936902     1.0796920
   6 C    6 C          13     1.3946520     1.4348572     1.3801646
   6 C    7 N           3     1.3943038     1.4345938     1.3740003


optimized geometry written to: xtbopt.xyz


           -------------------------------------------------
          | TOTAL ENERGY              -36.391789100676 Eh   |
          | GRADIENT NORM               0.000097765018 Eh/α |
          | HOMO-LUMO GAP               3.226820597730 eV   |
           -------------------------------------------------

------------------------------------------------------------------------
 * finished run on 2021/02/19 at 08:08:56.221     
------------------------------------------------------------------------
 total:
 * wall-time:     0 d,  0 h,  0 min,  0.104 sec
 *  cpu-time:     0 d,  0 h,  0 min,  0.103 sec
 * ratio c/w:     0.987 speedup
 SCF:
 * wall-time:     0 d,  0 h,  0 min,  0.032 sec
 *  cpu-time:     0 d,  0 h,  0 min,  0.032 sec
 * ratio c/w:     1.000 speedup
 ANC optimizer:
 * wall-time:     0 d,  0 h,  0 min,  0.053 sec
 *  cpu-time:     0 d,  0 h,  0 min,  0.053 sec
 * ratio c/w:     1.000 speedup

