      -----------------------------------------------------------      
     |                   =====================                   |     
     |                           x T B                           |     
     |                   =====================                   |     
     |                         S. Grimme                         |     
     |          Mulliken Center for Theoretical Chemistry        |     
     |                    University of Bonn                     |     
     |                Version 6.2 RC2 (SAW190805)                |     
      -----------------------------------------------------------      

   This program is distributed in the hope that it will be useful,
   but WITHOUT ANY WARRANTY; without even the implied warranty of
   MERCHANTABILITY or FITNESS FOR A PARTICULAR PURPOSE.
   
   FOR NON-COMMERCIAL, ACADEMIA USE ONLY.
   
   Cite this work as:
   * S. Grimme, C. Bannwarth, P. Shushkov, J. Chem. Theory Comput., 2017,
     13, 1989-2009. DOI: 10.1021/acs.jctc.7b00118
   * C. Bannwarth, S. Ehlert and S. Grimme., J. Chem. Theory Comput., 2019,
     15, 1652-1671. DOI: 10.1021/acs.jctc.8b01176
   * P. Pracht, E. Caldeweyher, S. Ehlert, S. Grimme, ChemRxiv, 2019, preprint.
     DOI: 10.26434/chemrxiv.8326202.v1
   
   for DFT-D4:
   * E. Caldeweyher, C. Bannwarth and S. Grimme, J. Chem. Phys., 2017,
     147, 034112. DOI: 10.1063/1.4993215
   * E. Caldeweyher, S. Ehlert, A. Hansen, H. Neugebauer, S. Spicher,
     C. Bannwarth and S. Grimme, J. Chem. Phys., 2019, 150, 154122.
     DOI: 10.1063/1.5090222
   
   for sTDA-xTB:
   * S. Grimme and C. Bannwarth, J. Chem. Phys., 2016, 145, 054103.
     DOI: 10.1063/1.4959605
   
   in the mass-spec context:
   * V. Asgeirsson, C. Bauer and S. Grimme, Chem. Sci., 2017, 8, 4879.
     DOI: 10.1039/c7sc00601b
   
   for metadynamics refer to:
   * S. Grimme, J. Chem. Theory Comput., 2019, 155, 2847-2862
     DOI: 10.1021/acs.jctc.9b00143
   
   with help from (in alphabetical order)
   C. Bannwarth, F. Bohle, G. Brandenburg, E. Caldeweyher, M. Checinski,
   S. Dohm, S. Ehlert, S. Ehrlich, F. März, H. Neugebauer, J. Pisarek,
   P. Pracht, P. Shushkov, and S. Spicher.
   
 * started run on 2021/02/19 at 08:08:58.151     

           -------------------------------------------------
          |                Calculation Setup                |
           -------------------------------------------------

          program call               : /ihome/ghutchison/geoffh/xtb/xtb 13atl.xyz -opt
          hostname                   : smp-n167
          coordinate file            : 13atl.xyz
          omp threads                :                     1
          number of atoms            :                    22
          number of electrons        :                    80
          charge                     :                     0
          spin                       :                   0.0
          first test random number   :      0.22077704070418


########################################################################
# WARNING! Please study the warnings concerning your input carefully
#  - the use of '-opt' is discouraged, please use '--opt' next time
########################################################################

           ------------------------------------------------- 
          |                 G F N 2 - x T B                 |
          | Geometry, Frequencies, Noncovalent interactions |
          |            JCTC 2019 parametrisation            |
           ------------------------------------------------- 
             KAB for C  - Si     :                1.0500
             KAB for H  - Pd     :                0.9500
             k(s)              :                1.8500
             k(p)              :                2.2300
             k(d)              :                2.2300
             k(f)              :                2.0000
             kEN (H0ij)        :               -2.0000
             D4 a1             :                0.5200
             D4 a2             :                5.0000
             D4 s6             :                1.0000
             D4 s8             :                2.7000
             D4 s9             :                5.0000
             alphaj            :                2.0000

  Z AO/shell   Hii/eV     exponent
  1     Wed Apr 25 08:07:45 CEST 2018   EN: 2.200 GM2: 0.406  GM3: 0.0800  RAES: 1.40
     1s    -10.707211    1.230000
  6     Wed Apr 25 08:07:45 CEST 2018   EN: 2.550 GM2: 0.538  GM3: 0.1500  RAES: 3.00
     2s    -13.970922    2.096432
     2p    -10.063292    1.800000
  7     Wed Apr 25 08:07:45 CEST 2018   EN: 3.040 GM2: 0.461  GM3:-0.0640  RAES: 1.90
     2s    -16.686243    2.339881
     2p    -12.523956    2.014332
  8     Wed Apr 25 08:07:45 CEST 2018   EN: 3.440 GM2: 0.452  GM3:-0.0517  RAES: 1.80
     2s    -20.229985    2.439742
     2p    -15.503117    2.137023
  9     Mon Apr 23 13:58:50 CEST 2018   EN: 3.980 GM2: 0.532  GM3: 0.1426  RAES: 2.40
     2s    -23.458179    2.416361
     2p    -15.746583    2.308399

           ------------------------------------------------- 
          |        Self-Consistent Charge Iterations        |
           ------------------------------------------------- 

          ...................................................
          :                      SETUP                      :
          :.................................................:
          :  # basis functions                  73          :
          :  # atomic orbitals                  73          :
          :  # shells                           39          :
          :  # electrons                        80          :
          :  max. iterations                   250          :
          :  Hamiltonian                  GFN2-xTB          :
          :  restarted?                      false          :
          :  GBSA solvation                  false          :
          :  PC potential                    false          :
          :  electronic temp.          300.0000000     K    :
          :  accuracy                    1.0000000          :
          :  -> integral cutoff          0.2500000E+02      :
          :  -> integral neglect         0.1000000E-07      :
          :  -> SCF convergence          0.1000000E-05 Eh   :
          :  -> wf. convergence          0.1000000E-03 e    :
          :  Broyden damping             0.4000000          :
          ...................................................

 iter      E             dE          RMSdq      gap      omega  full diag
   1    -45.5740627 -0.455741E+02  0.687E+00    2.40       0.0  T
   2    -45.5875962 -0.135334E-01  0.444E+00    2.29       1.0  T
   3    -45.5145334  0.730628E-01  0.318E+00    1.92       1.0  T
   4    -45.6633332 -0.148800E+00  0.652E-01    2.09       1.0  T
   5    -45.6696558 -0.632260E-02  0.197E-01    2.05       1.0  T
   6    -45.6698359 -0.180107E-03  0.835E-02    2.07       1.0  T
   7    -45.6698932 -0.572910E-04  0.454E-02    2.08       1.0  T
   8    -45.6699092 -0.159392E-04  0.144E-02    2.07       1.5  T
   9    -45.6699119 -0.269993E-05  0.661E-03    2.07       3.2  T
  10    -45.6699121 -0.214609E-06  0.288E-03    2.07       7.4  T
  11    -45.6699122 -0.106411E-06  0.128E-03    2.07      16.7  T
  12    -45.6699122 -0.161696E-07  0.471E-04    2.07      45.3  T
  13    -45.6699122 -0.593339E-09  0.178E-04    2.07     120.0  T

   *** convergence criteria satisfied after 13 iterations ***

         #    Occupation            Energy/Eh            Energy/eV
      -------------------------------------------------------------
         1        2.0000           -0.8496570             -23.1203
       ...           ...                  ...                  ...
        34        2.0000           -0.4747487             -12.9186
        35        2.0000           -0.4630819             -12.6011
        36        2.0000           -0.4593400             -12.4993
        37        2.0000           -0.4574801             -12.4487
        38        2.0000           -0.4486988             -12.2097
        39        2.0000           -0.4350775             -11.8391
        40        2.0000           -0.4246775             -11.5561 (HOMO)
        41                         -0.3485245              -9.4838 (LUMO)
        42                         -0.3323688              -9.0442
        43                         -0.2738588              -7.4521
        44                         -0.2592808              -7.0554
        45                         -0.2441495              -6.6436
       ...                                ...                  ...
        73                          1.1462880              31.1921
      -------------------------------------------------------------
                  HL-Gap            0.0761530 Eh            2.0722 eV
             Fermi-level           -0.3866010 Eh          -10.5199 eV

 SCC (total)                   0 d,  0 h,  0 min,  0.065 sec
 SCC setup                      ...        0 min,  0.000 sec (  0.255%)
 Dispersion                     ...        0 min,  0.000 sec (  0.324%)
 integral evaluation            ...        0 min,  0.011 sec ( 17.551%)
 zeroth order Hamiltonian       ...        0 min,  0.000 sec (  0.218%)
 iterations                     ...        0 min,  0.027 sec ( 42.210%)
 molecular gradient             ...        0 min,  0.025 sec ( 39.023%)
 printout                       ...        0 min,  0.000 sec (  0.398%)

         :::::::::::::::::::::::::::::::::::::::::::::::::::::
         ::                     SUMMARY                     ::
         :::::::::::::::::::::::::::::::::::::::::::::::::::::
         :: total energy             -44.902528631270 Eh    ::
         :: gradient norm              0.000206407325 Eh/a0 ::
         :: HOMO-LUMO gap              2.072227699685 eV    ::
         ::.................................................::
         :: SCC energy               -45.669912216394 Eh    ::
         :: -> isotropic ES            0.049824143828 Eh    ::
         :: -> anisotropic ES          0.000182526707 Eh    ::
         :: -> anisotropic XC          0.041312848137 Eh    ::
         :: -> dispersion             -0.025661749619 Eh    ::
         :: repulsion energy           0.767327034750 Eh    ::
         :: add. restraining           0.000000000000 Eh    ::
         :::::::::::::::::::::::::::::::::::::::::::::::::::::

      ----------------------------------------------------------- 
     |                   =====================                   |
     |                        A N C O P T                        |
     |                   =====================                   |
     |               Approximate Normal Coordinate               |
     |                Rational Function Optimizer                |
      ----------------------------------------------------------- 

          ...................................................
          :                      SETUP                      :
          :.................................................:
          :   optimization level            normal          :
          :   max. optcycles                   200          :
          :   ANC micro-cycles                  20          :
          :   degrees of freedom                60          :
          :.................................................:
          :   RF solver                   davidson          :
          :   input Hessian                  false          :
          :   write xtbopt.log                true          :
          :   linear?                        false          :
          :   energy convergence         0.5000000E-05 Eh   :
          :   grad. convergence          0.1000000E-02 Eh/α :
          :   maximium RF displ.         2.0000000          :
          :   Hlow (freq-cutoff)         0.5000000E-02      :
          :   Hmax (freq-cutoff)         5.0000000          :
          :   S6 in model hess.         20.0000000          :
          ...................................................

generating ANC from model Hessian ...
Using Lindh-Hessian (1995)
 Shifting diagonal of input Hessian by   4.940721318998807E-003
 Lowest  eigenvalues of input Hessian
   -0.000000   -0.000000   -0.000000    0.000000    0.000000    0.000000
    0.005000    0.006036    0.007116    0.008445    0.009632    0.013599
    0.017325    0.018438    0.021420    0.022653    0.027252    0.032781
 Highest eigenvalues
    2.000014    2.028689    2.127109    2.294390    2.608443    2.644678
 

........................................................................
.............................. CYCLE    1 ..............................
........................................................................
   1    -45.6699122 -0.456699E+02  0.668E-05    2.07       0.0  T
   2    -45.6699122 -0.139480E-10  0.403E-05    2.07     529.2  T
   3    -45.6699122 -0.834177E-11  0.287E-05    2.07     742.6  T
     SCC iter.                  ...        0 min,  0.003 sec
     gradient                   ...        0 min,  0.012 sec
 * total energy  :   -44.9025286 Eh     change        0.1673067E-07 Eh
   gradient norm :     0.0002064 Eh/α   predicted     0.0000000E+00 (-100.00%)
   displ. norm   :     0.0061371 α      lambda       -0.1953809E-06
   maximum displ.:     0.0042547 α      in ANC's #2, #1, #4, ...

........................................................................
.............................. CYCLE    2 ..............................
........................................................................
   1    -45.6698522 -0.456699E+02  0.797E-03    2.07       0.0  T
   2    -45.6698522 -0.185183E-07  0.441E-03    2.07       4.8  T
   3    -45.6698522 -0.828152E-09  0.607E-04    2.07      35.1  T
   4    -45.6698522 -0.718521E-08  0.165E-04    2.07     128.9  T
     SCC iter.                  ...        0 min,  0.004 sec
     gradient                   ...        0 min,  0.012 sec
 * total energy  :   -44.9025286 Eh     change        0.6132517E-07 Eh
   gradient norm :     0.0002809 Eh/α   predicted    -0.9787277E-07 (-259.60%)
   displ. norm   :     0.0079115 α      lambda       -0.6574849E-06
   maximum displ.:     0.0044854 α      in ANC's #2, #8, #1, ...

........................................................................
.............................. CYCLE    3 ..............................
........................................................................
   1    -45.6697333 -0.456697E+02  0.789E-03    2.07       0.0  T
   2    -45.6697333 -0.185625E-07  0.447E-03    2.07       4.8  T
   3    -45.6697333  0.335142E-07  0.146E-03    2.07      14.6  T
   4    -45.6697333 -0.429061E-07  0.319E-04    2.07      66.9  T
   5    -45.6697333 -0.944617E-09  0.183E-04    2.07     116.3  T
     SCC iter.                  ...        0 min,  0.005 sec
     gradient                   ...        0 min,  0.012 sec
 * total energy  :   -44.9025286 Eh     change       -0.5169466E-07 Eh
   gradient norm :     0.0004925 Eh/α   predicted    -0.3323079E-06 ( 542.83%)
   displ. norm   :     0.0047992 α      lambda       -0.4183749E-06
   maximum displ.:     0.0023970 α      in ANC's #5, #8, #9, ...

   *** GEOMETRY OPTIMIZATION CONVERGED AFTER 3 ITERATIONS ***

------------------------------------------------------------------------
 total energy gain   :         0.0000000 Eh        0.0000 kcal/mol
 total RMSD          :         0.0025715 a0        0.0014 Å
 total power (kW/mol):         0.0000231 (step)    0.0008 (real)
------------------------------------------------------------------------

 ANCopt (total)                0 d,  0 h,  0 min,  0.088 sec
 optimizer setup                ...        0 min,  0.000 sec (  0.069%)
 model hessian                  ...        0 min,  0.002 sec (  2.790%)
 ANC generation                 ...        0 min,  0.000 sec (  0.542%)
 coordinate transformation      ...        0 min,  0.000 sec (  0.015%)
 single point calculation       ...        0 min,  0.085 sec ( 96.037%)
 optimization log               ...        0 min,  0.000 sec (  0.202%)
 hessian update                 ...        0 min,  0.000 sec (  0.017%)
 rational function              ...        0 min,  0.000 sec (  0.208%)

================
 final structure:
================
$coord
   -3.74239874674556    1.76014608280691   -0.00098172622990      C 
   -5.01611861987627    3.99997267932272   -0.00016419208089      C 
   -3.84569148382093    6.40123777260993   -0.00033095438183      C 
   -3.00590302381958    8.39932741907697   -0.00319701743322      N 
   -7.67799556630659    4.22955558301247    0.00539737030964      C 
   -9.82110539896301    4.54976837559688    0.01018085533926      N 
   -1.00751682894162    1.43116778293278   -0.00071113821959      C 
   -0.42339344353989   -1.16568810719049   -0.00112463412149      C 
    2.03973024763210   -2.03068528644109   -0.00066611786930      C 
    3.93158164691728   -0.21880545499958    0.00033764495484      C 
    3.41268576387415    2.35464725532678    0.00097922257888      C 
    0.93632531929048    3.19961808502531    0.00041553641430      C 
    6.35138178914099   -0.96644396789121    0.00060104040793      F 
   -2.77679296113075   -2.66437837921653   -0.00172328343738      C 
   -2.99878411107156   -4.93176015152662   -0.00224989270709      O 
   -4.87696636610714   -0.76525309762636   -0.00152835571818      C 
   -7.29711189711200   -1.47556208456018   -0.00195449175910      C 
    2.46809604987777   -4.02304694733240   -0.00096310715316      H 
    4.96371848337118    3.67734272557940    0.00202091489966      H 
    0.55676842035493    5.20036082811560    0.00101967449172      H 
   -7.72235600090526   -3.46967222709054   -0.00137298635671      H 
   -8.86525464189462   -0.18245724613978   -0.00111197848508      H 
$end
           -------------------------------------------------
          |                Final Singlepoint                |
           -------------------------------------------------

          ...................................................
          :                      SETUP                      :
          :.................................................:
          :  # basis functions                  73          :
          :  # atomic orbitals                  73          :
          :  # shells                           39          :
          :  # electrons                        80          :
          :  max. iterations                   250          :
          :  Hamiltonian                  GFN2-xTB          :
          :  restarted?                      false          :
          :  GBSA solvation                  false          :
          :  PC potential                    false          :
          :  electronic temp.          300.0000000     K    :
          :  accuracy                    1.0000000          :
          :  -> integral cutoff          0.2500000E+02      :
          :  -> integral neglect         0.1000000E-07      :
          :  -> SCF convergence          0.1000000E-05 Eh   :
          :  -> wf. convergence          0.1000000E-03 e    :
          :  Broyden damping             0.4000000          :
          ...................................................

 iter      E             dE          RMSdq      gap      omega  full diag
   1    -45.6697333 -0.456697E+02  0.761E-05    2.07       0.0  T
   2    -45.6697333 -0.812150E-11  0.573E-05    2.07     371.9  T
   3    -45.6697333 -0.564171E-10  0.230E-05    2.07     926.9  T

   *** convergence criteria satisfied after 3 iterations ***

         #    Occupation            Energy/Eh            Energy/eV
      -------------------------------------------------------------
         1        2.0000           -0.8496540             -23.1203
       ...           ...                  ...                  ...
        34        2.0000           -0.4747420             -12.9184
        35        2.0000           -0.4630603             -12.6005
        36        2.0000           -0.4593265             -12.4989
        37        2.0000           -0.4574791             -12.4486
        38        2.0000           -0.4487003             -12.2098
        39        2.0000           -0.4350669             -11.8388
        40        2.0000           -0.4246877             -11.5563 (HOMO)
        41                         -0.3485322              -9.4840 (LUMO)
        42                         -0.3323742              -9.0444
        43                         -0.2738720              -7.4524
        44                         -0.2592883              -7.0556
        45                         -0.2441381              -6.6433
       ...                                ...                  ...
        73                          1.1460882              31.1866
      -------------------------------------------------------------
                  HL-Gap            0.0761555 Eh            2.0723 eV
             Fermi-level           -0.3866100 Eh          -10.5202 eV

 SCC (total)                   0 d,  0 h,  0 min,  0.027 sec
 SCC setup                      ...        0 min,  0.000 sec (  0.451%)
 Dispersion                     ...        0 min,  0.000 sec (  0.538%)
 integral evaluation            ...        0 min,  0.011 sec ( 41.151%)
 zeroth order Hamiltonian       ...        0 min,  0.000 sec (  0.466%)
 iterations                     ...        0 min,  0.003 sec ( 12.371%)
 molecular gradient             ...        0 min,  0.012 sec ( 44.146%)
 printout                       ...        0 min,  0.000 sec (  0.834%)

         :::::::::::::::::::::::::::::::::::::::::::::::::::::
         ::                     SUMMARY                     ::
         :::::::::::::::::::::::::::::::::::::::::::::::::::::
         :: total energy             -44.902528617465 Eh    ::
         :: gradient norm              0.000491988597 Eh/a0 ::
         :: HOMO-LUMO gap              2.072297808910 eV    ::
         ::.................................................::
         :: SCC energy               -45.669733347210 Eh    ::
         :: -> isotropic ES            0.049823846770 Eh    ::
         :: -> anisotropic ES          0.000180600413 Eh    ::
         :: -> anisotropic XC          0.041319767278 Eh    ::
         :: -> dispersion             -0.025661233361 Eh    ::
         :: repulsion energy           0.767148173410 Eh    ::
         :: add. restraining           0.000000000000 Eh    ::
         :::::::::::::::::::::::::::::::::::::::::::::::::::::

           -------------------------------------------------
          |                Property Printout                |
           -------------------------------------------------

    * Orbital Energies and Occupations

         #    Occupation            Energy/Eh            Energy/eV
      -------------------------------------------------------------
         1        2.0000           -0.8496540             -23.1203
       ...           ...                  ...                  ...
        28        2.0000           -0.5116055             -13.9215
        29        2.0000           -0.5083928             -13.8341
        30        2.0000           -0.5023169             -13.6687
        31        2.0000           -0.4972421             -13.5306
        32        2.0000           -0.4968308             -13.5195
        33        2.0000           -0.4907614             -13.3543
        34        2.0000           -0.4747420             -12.9184
        35        2.0000           -0.4630603             -12.6005
        36        2.0000           -0.4593265             -12.4989
        37        2.0000           -0.4574791             -12.4486
        38        2.0000           -0.4487003             -12.2098
        39        2.0000           -0.4350669             -11.8388
        40        2.0000           -0.4246877             -11.5563 (HOMO)
        41                         -0.3485322              -9.4840 (LUMO)
        42                         -0.3323742              -9.0444
        43                         -0.2738720              -7.4524
        44                         -0.2592883              -7.0556
        45                         -0.2441381              -6.6433
        46                         -0.2351901              -6.3998
        47                         -0.2143921              -5.8339
        48                         -0.1865128              -5.0753
        49                         -0.1341821              -3.6513
        50                         -0.1075655              -2.9270
        51                          0.0156712               0.4264
       ...                                ...                  ...
        73                          1.1460882              31.1866
      -------------------------------------------------------------
                  HL-Gap            0.0761555 Eh            2.0723 eV
             Fermi-level           -0.3866100 Eh          -10.5202 eV

     #   Z        covCN         q      C6AA      α(0)
     1   6 C      3.008     0.035    27.199     8.555
     2   6 C      2.947     0.019    27.585     8.614
     3   6 C      1.937     0.125    28.029     8.550
     4   7 N      0.911    -0.215    25.684     7.330
     5   6 C      1.937     0.125    28.009     8.547
     6   7 N      0.911    -0.213    25.642     7.324
     7   6 C      3.027     0.006    27.856     8.657
     8   6 C      3.040    -0.013    28.298     8.725
     9   6 C      2.910    -0.032    28.805     8.801
    10   6 C      2.788     0.182    24.093     8.040
    11   6 C      2.918    -0.037    28.923     8.819
    12   6 C      2.916    -0.024    28.609     8.771
    13   9 F      0.788    -0.200    11.235     3.959
    14   6 C      2.863     0.231    23.165     7.889
    15   8 O      0.856    -0.334    20.402     6.056
    16   6 C      2.994    -0.013    28.329     8.731
    17   6 C      2.840    -0.053    29.301     8.871
    18   1 H      0.926     0.088     1.895     2.153
    19   1 H      0.926     0.079     1.986     2.204
    20   1 H      0.926     0.072     2.067     2.248
    21   1 H      0.926     0.092     1.862     2.134
    22   1 H      0.926     0.080     1.984     2.202

 Mol. C6AA /au·bohr⁶  :       8644.634291
 Mol. C8AA /au·bohr⁸  :     222664.454508
 Mol. α(0) /au        :        147.179808


Wiberg/Mayer (AO) data.
largest (>0.10) Wiberg bond orders for each atom
          total WBO             WBO to atom ...
     1  C   3.983        C    2 1.538    C    7 1.100    C   16 1.080
     2  C   3.983        C    1 1.538    C    3 1.087    C    5 1.086
     3  C   3.948        N    4 2.780    C    2 1.087
     4  N   2.987        C    3 2.780
     5  C   3.948        N    6 2.782    C    2 1.086
     6  N   2.987        C    5 2.782
     7  C   3.989        C   12 1.383    C    8 1.292    C    1 1.100
     8  C   3.979        C    9 1.419    C    7 1.292    C   14 1.022
     9  C   3.984        C    8 1.419    C   10 1.383    H   18 0.960
    10  C   3.877        C    9 1.383    C   11 1.376    F   13 0.981
    11  C   3.980        C   12 1.450    C   10 1.376    H   19 0.964
    12  C   3.978        C   11 1.450    C    7 1.383    H   20 0.959
    13  F   1.115        C   10 0.981
    14  C   3.932        O   15 1.820    C    8 1.022    C   16 0.989
    15  O   2.092        C   14 1.820
    16  C   3.987        C   17 1.803    C    1 1.080    C   14 0.989
    17  C   3.941        C   16 1.803    H   21 0.966    H   22 0.965
    18  H   0.992        C    9 0.960
    19  H   0.993        C   11 0.964
    20  H   0.994        C   12 0.959
    21  H   0.991        C   17 0.966
    22  H   0.993        C   17 0.965

molecular dipole:
                 x           y           z       tot (Debye)
 q only:        0.344      -0.136      -0.001
   full:        0.611      -0.409      -0.001       1.868
molecular quadrupole (traceless):
                xx          xy          yy          xz          yz          zz
 q only:       -1.403      11.293      -9.518       0.021      -0.004      10.921
  q+dip:       -2.403      14.911     -10.512       0.032      -0.004      12.914
   full:       -5.820      14.173     -13.904       0.038      -0.004      19.724

           -------------------------------------------------
          |                Geometry Summary                 |
           -------------------------------------------------

      molecular mass/u    :      224.1937000
   center of mass at/Å    :       -1.0198099       0.6282264       0.0001136
  moments of inertia/u·Å² :        0.6509894E+03   0.1385939E+04   0.2036927E+04
rotational constants/cm⁻¹ :        0.2589540E-01   0.1216333E-01   0.8276012E-02

 * 17 selected distances

     #   Z        #   Z                                     value/Å
     1   6 C      2   6 C                                 1.3635108
     3   6 C      4   7 N                                 1.1469379
     5   6 C      6   7 N                                 1.1466770
     7   6 C      8   6 C                                 1.4085324 (max)
     8   6 C      9   6 C                                 1.3814667
     9   6 C     10   6 C                                 1.3862032
    10   6 C     11   6 C                                 1.3892200
     7   6 C     12   6 C                                 1.3906331
    11   6 C     12   6 C                                 1.3846191
    10   6 C     13   9 F                                 1.3402292
    14   6 C     15   8 O                                 1.2055839
    16   6 C     17   6 C                                 1.3347067
     9   6 C     18   1 H                                 1.0784059
    11   6 C     19   1 H                                 1.0786947
    12   6 C     20   1 H                                 1.0776309
    17   6 C     21   1 H                                 1.0789648
    17   6 C     22   1 H                                 1.0755705 (min)

 * 5 distinct bonds (by element types)

   Z      Z             #   av. dist./Å        max./Å        min./Å
   1 H    6 C           5     1.0778534     1.0789648     1.0755705
   6 C    6 C           8     1.3798615     1.4085324     1.3347067
   6 C    7 N           2     1.1468075     1.1469379     1.1466770
   6 C    8 O           1     1.2055839     1.2055839     1.2055839
   6 C    9 F           1     1.3402292     1.3402292     1.3402292


optimized geometry written to: xtbopt.xyz


           -------------------------------------------------
          | TOTAL ENERGY              -44.902528617465 Eh   |
          | GRADIENT NORM               0.000491988597 Eh/α |
          | HOMO-LUMO GAP               2.072297808910 eV   |
           -------------------------------------------------

------------------------------------------------------------------------
 * finished run on 2021/02/19 at 08:08:58.382     
------------------------------------------------------------------------
 total:
 * wall-time:     0 d,  0 h,  0 min,  0.231 sec
 *  cpu-time:     0 d,  0 h,  0 min,  0.174 sec
 * ratio c/w:     0.755 speedup
 SCF:
 * wall-time:     0 d,  0 h,  0 min,  0.065 sec
 *  cpu-time:     0 d,  0 h,  0 min,  0.039 sec
 * ratio c/w:     0.598 speedup
 ANC optimizer:
 * wall-time:     0 d,  0 h,  0 min,  0.116 sec
 *  cpu-time:     0 d,  0 h,  0 min,  0.116 sec
 * ratio c/w:     1.000 speedup

