      -----------------------------------------------------------      
     |                   =====================                   |     
     |                           x T B                           |     
     |                   =====================                   |     
     |                         S. Grimme                         |     
     |          Mulliken Center for Theoretical Chemistry        |     
     |                    University of Bonn                     |     
     |                Version 6.2 RC2 (SAW190805)                |     
      -----------------------------------------------------------      

   This program is distributed in the hope that it will be useful,
   but WITHOUT ANY WARRANTY; without even the implied warranty of
   MERCHANTABILITY or FITNESS FOR A PARTICULAR PURPOSE.
   
   FOR NON-COMMERCIAL, ACADEMIA USE ONLY.
   
   Cite this work as:
   * S. Grimme, C. Bannwarth, P. Shushkov, J. Chem. Theory Comput., 2017,
     13, 1989-2009. DOI: 10.1021/acs.jctc.7b00118
   * C. Bannwarth, S. Ehlert and S. Grimme., J. Chem. Theory Comput., 2019,
     15, 1652-1671. DOI: 10.1021/acs.jctc.8b01176
   * P. Pracht, E. Caldeweyher, S. Ehlert, S. Grimme, ChemRxiv, 2019, preprint.
     DOI: 10.26434/chemrxiv.8326202.v1
   
   for DFT-D4:
   * E. Caldeweyher, C. Bannwarth and S. Grimme, J. Chem. Phys., 2017,
     147, 034112. DOI: 10.1063/1.4993215
   * E. Caldeweyher, S. Ehlert, A. Hansen, H. Neugebauer, S. Spicher,
     C. Bannwarth and S. Grimme, J. Chem. Phys., 2019, 150, 154122.
     DOI: 10.1063/1.5090222
   
   for sTDA-xTB:
   * S. Grimme and C. Bannwarth, J. Chem. Phys., 2016, 145, 054103.
     DOI: 10.1063/1.4959605
   
   in the mass-spec context:
   * V. Asgeirsson, C. Bauer and S. Grimme, Chem. Sci., 2017, 8, 4879.
     DOI: 10.1039/c7sc00601b
   
   for metadynamics refer to:
   * S. Grimme, J. Chem. Theory Comput., 2019, 155, 2847-2862
     DOI: 10.1021/acs.jctc.9b00143
   
   with help from (in alphabetical order)
   C. Bannwarth, F. Bohle, G. Brandenburg, E. Caldeweyher, M. Checinski,
   S. Dohm, S. Ehlert, S. Ehrlich, F. März, H. Neugebauer, J. Pisarek,
   P. Pracht, P. Shushkov, and S. Spicher.
   
 * started run on 2021/02/19 at 08:09:16.901     

           -------------------------------------------------
          |                Calculation Setup                |
           -------------------------------------------------

          program call               : /ihome/ghutchison/geoffh/xtb/xtb 15atl.xyz -opt
          hostname                   : smp-n61
          coordinate file            : 15atl.xyz
          omp threads                :                     1
          number of atoms            :                    19
          number of electrons        :                    70
          charge                     :                     0
          spin                       :                   0.0
          first test random number   :      0.98509010241025


########################################################################
# WARNING! Please study the warnings concerning your input carefully
#  - the use of '-opt' is discouraged, please use '--opt' next time
########################################################################

           ------------------------------------------------- 
          |                 G F N 2 - x T B                 |
          | Geometry, Frequencies, Noncovalent interactions |
          |            JCTC 2019 parametrisation            |
           ------------------------------------------------- 
             KAB for C  - Si     :                1.0500
             KAB for H  - Pd     :                0.9500
             k(s)              :                1.8500
             k(p)              :                2.2300
             k(d)              :                2.2300
             k(f)              :                2.0000
             kEN (H0ij)        :               -2.0000
             D4 a1             :                0.5200
             D4 a2             :                5.0000
             D4 s6             :                1.0000
             D4 s8             :                2.7000
             D4 s9             :                5.0000
             alphaj            :                2.0000

  Z AO/shell   Hii/eV     exponent
  1     Wed Apr 25 08:07:45 CEST 2018   EN: 2.200 GM2: 0.406  GM3: 0.0800  RAES: 1.40
     1s    -10.707211    1.230000
  6     Wed Apr 25 08:07:45 CEST 2018   EN: 2.550 GM2: 0.538  GM3: 0.1500  RAES: 3.00
     2s    -13.970922    2.096432
     2p    -10.063292    1.800000
  7     Wed Apr 25 08:07:45 CEST 2018   EN: 3.040 GM2: 0.461  GM3:-0.0640  RAES: 1.90
     2s    -16.686243    2.339881
     2p    -12.523956    2.014332
  8     Wed Apr 25 08:07:45 CEST 2018   EN: 3.440 GM2: 0.452  GM3:-0.0517  RAES: 1.80
     2s    -20.229985    2.439742
     2p    -15.503117    2.137023
 16     Tue Apr 24 11:44:34 CEST 2018   EN: 2.580 GM2: 0.340  GM3:-0.0502  RAES: 3.10
     3s    -20.029654    1.981333
     3p    -11.377694    2.025643
     3d     -0.420282    1.702555

           ------------------------------------------------- 
          |        Self-Consistent Charge Iterations        |
           ------------------------------------------------- 

          ...................................................
          :                      SETUP                      :
          :.................................................:
          :  # basis functions                  70          :
          :  # atomic orbitals                  69          :
          :  # shells                           35          :
          :  # electrons                        70          :
          :  max. iterations                   250          :
          :  Hamiltonian                  GFN2-xTB          :
          :  restarted?                      false          :
          :  GBSA solvation                  false          :
          :  PC potential                    false          :
          :  electronic temp.          300.0000000     K    :
          :  accuracy                    1.0000000          :
          :  -> integral cutoff          0.2500000E+02      :
          :  -> integral neglect         0.1000000E-07      :
          :  -> SCF convergence          0.1000000E-05 Eh   :
          :  -> wf. convergence          0.1000000E-03 e    :
          :  Broyden damping             0.4000000          :
          ...................................................

 iter      E             dE          RMSdq      gap      omega  full diag
   1    -38.9353056 -0.389353E+02  0.723E+00    2.31       0.0  T
   2    -38.7929186  0.142387E+00  0.553E+00    2.20       1.0  T
   3    -38.8187984 -0.258798E-01  0.419E+00    1.97       1.0  T
   4    -39.0507498 -0.231951E+00  0.105E+00    2.01       1.0  T
   5    -39.0629375 -0.121876E-01  0.320E-01    1.98       1.0  T
   6    -39.0636749 -0.737475E-03  0.170E-01    2.03       1.0  T
   7    -39.0639444 -0.269502E-03  0.593E-02    2.03       1.0  T
   8    -39.0639606 -0.161423E-04  0.364E-02    2.03       1.0  T
   9    -39.0639737 -0.131672E-04  0.154E-02    2.02       1.5  T
  10    -39.0639755 -0.180497E-05  0.783E-03    2.02       2.9  T
  11    -39.0639762 -0.636214E-06  0.373E-03    2.02       6.1  T
  12    -39.0639763 -0.145962E-06  0.128E-03    2.02      18.0  T
  13    -39.0639763 -0.616481E-08  0.612E-04    2.02      37.5  T
  14    -39.0639763 -0.757744E-09  0.322E-04    2.02      71.3  T

   *** convergence criteria satisfied after 14 iterations ***

         #    Occupation            Energy/Eh            Energy/eV
      -------------------------------------------------------------
         1        2.0000           -0.7749377             -21.0871
       ...           ...                  ...                  ...
        29        2.0000           -0.4797229             -13.0539
        30        2.0000           -0.4619991             -12.5716
        31        2.0000           -0.4525049             -12.3133
        32        2.0000           -0.4518550             -12.2956
        33        2.0000           -0.4414086             -12.0113
        34        2.0000           -0.4281419             -11.6503
        35        2.0000           -0.4181201             -11.3776 (HOMO)
        36                         -0.3437150              -9.3530 (LUMO)
        37                         -0.3224494              -8.7743
        38                         -0.2893499              -7.8736
        39                         -0.2794455              -7.6041
        40                         -0.2791618              -7.5964
       ...                                ...                  ...
        69                          0.7219243              19.6446
      -------------------------------------------------------------
                  HL-Gap            0.0744051 Eh            2.0247 eV
             Fermi-level           -0.3809175 Eh          -10.3653 eV

 SCC (total)                   0 d,  0 h,  0 min,  0.035 sec
 SCC setup                      ...        0 min,  0.000 sec (  0.751%)
 Dispersion                     ...        0 min,  0.000 sec (  0.769%)
 integral evaluation            ...        0 min,  0.009 sec ( 25.313%)
 zeroth order Hamiltonian       ...        0 min,  0.000 sec (  0.427%)
 iterations                     ...        0 min,  0.014 sec ( 39.073%)
 molecular gradient             ...        0 min,  0.011 sec ( 32.723%)
 printout                       ...        0 min,  0.000 sec (  0.820%)

         :::::::::::::::::::::::::::::::::::::::::::::::::::::
         ::                     SUMMARY                     ::
         :::::::::::::::::::::::::::::::::::::::::::::::::::::
         :: total energy             -38.539903455160 Eh    ::
         :: gradient norm              0.343149651063 Eh/a0 ::
         :: HOMO-LUMO gap              2.024667016120 eV    ::
         ::.................................................::
         :: SCC energy               -39.063976336915 Eh    ::
         :: -> isotropic ES            0.039885848838 Eh    ::
         :: -> anisotropic ES          0.003368156450 Eh    ::
         :: -> anisotropic XC          0.046643523982 Eh    ::
         :: -> dispersion             -0.023158420755 Eh    ::
         :: repulsion energy           0.523994852085 Eh    ::
         :: add. restraining           0.000000000000 Eh    ::
         :::::::::::::::::::::::::::::::::::::::::::::::::::::

      ----------------------------------------------------------- 
     |                   =====================                   |
     |                        A N C O P T                        |
     |                   =====================                   |
     |               Approximate Normal Coordinate               |
     |                Rational Function Optimizer                |
      ----------------------------------------------------------- 

          ...................................................
          :                      SETUP                      :
          :.................................................:
          :   optimization level            normal          :
          :   max. optcycles                   200          :
          :   ANC micro-cycles                  20          :
          :   degrees of freedom                51          :
          :.................................................:
          :   RF solver                   davidson          :
          :   input Hessian                  false          :
          :   write xtbopt.log                true          :
          :   linear?                        false          :
          :   energy convergence         0.5000000E-05 Eh   :
          :   grad. convergence          0.1000000E-02 Eh/α :
          :   maximium RF displ.         2.0000000          :
          :   Hlow (freq-cutoff)         0.5000000E-02      :
          :   Hmax (freq-cutoff)         5.0000000          :
          :   S6 in model hess.         20.0000000          :
          ...................................................

generating ANC from model Hessian ...
Using Lindh-Hessian (1995)
 Shifting diagonal of input Hessian by   5.316825987216447E-003
 Lowest  eigenvalues of input Hessian
    0.005000    0.000000    0.000000    0.000000    0.000000    0.000000
    0.000000    0.006564    0.007820    0.008268    0.010275    0.012263
    0.013798    0.017861    0.023280    0.024326    0.030085    0.033100
 Highest eigenvalues
    1.884962    1.939852    1.973290    2.017622    2.047325    2.292996
 

........................................................................
.............................. CYCLE    1 ..............................
........................................................................
   1    -39.0639763 -0.390640E+02  0.153E-04    2.02       0.0  T
   2    -39.0639763  0.367436E-09  0.169E-04    2.02     135.5  T
   3    -39.0639763 -0.560469E-09  0.710E-05    2.02     323.0  T
     SCC iter.                  ...        0 min,  0.004 sec
     gradient                   ...        0 min,  0.013 sec
 * total energy  :   -38.5399034 Eh     change        0.2603003E-07 Eh
   gradient norm :     0.3431500 Eh/α   predicted     0.0000000E+00 (-100.00%)
   displ. norm   :     0.4252669 α      lambda       -0.9875108E-01
   maximum displ.:     0.2404655 α      in ANC's #19, #26, #24, ...

........................................................................
.............................. CYCLE    2 ..............................
........................................................................
   1    -39.2429431 -0.392429E+02  0.656E-01    2.14       0.0  T
   2    -39.2432011 -0.257982E-03  0.406E-01    2.15       1.0  T
   3    -39.2425561  0.645008E-03  0.321E-01    2.16       1.0  T
   4    -39.2438172 -0.126114E-02  0.649E-02    2.12       1.0  T
   5    -39.2439002 -0.829925E-04  0.203E-02    2.14       1.1  T
   6    -39.2439037 -0.349701E-05  0.113E-02    2.14       2.0  T
   7    -39.2439046 -0.956455E-06  0.519E-03    2.14       4.4  T
   8    -39.2439048 -0.124864E-06  0.250E-03    2.14       9.2  T
     SCC iter.                  ...        0 min,  0.008 sec
     gradient                   ...        0 min,  0.012 sec
 * total energy  :   -38.6023227 Eh     change       -0.6241928E-01 Eh
   gradient norm :     0.0528864 Eh/α   predicted    -0.5830522E-01 (  -6.59%)
   displ. norm   :     0.3469490 α      lambda       -0.1281822E-01
   maximum displ.:     0.2248888 α      in ANC's #19, #9, #24, ...

........................................................................
.............................. CYCLE    3 ..............................
........................................................................
   1    -39.2896116 -0.392896E+02  0.315E-01    2.12       0.0  T
   2    -39.2895936  0.179401E-04  0.225E-01    2.12       1.0  T
   3    -39.2897204 -0.126734E-03  0.139E-01    2.14       1.0  T
   4    -39.2898839 -0.163484E-03  0.306E-02    2.14       1.0  T
   5    -39.2898967 -0.128040E-04  0.108E-02    2.13       2.1  T
   6    -39.2898973 -0.600795E-06  0.495E-03    2.13       4.6  T
   7    -39.2898974 -0.137570E-06  0.194E-03    2.13      11.8  T
     SCC iter.                  ...        0 min,  0.007 sec
     gradient                   ...        0 min,  0.012 sec
 * total energy  :   -38.6100077 Eh     change       -0.7685029E-02 Eh
   gradient norm :     0.0416282 Eh/α   predicted    -0.7180616E-02 (  -6.56%)
   displ. norm   :     0.2179904 α      lambda       -0.2427325E-02
   maximum displ.:     0.1600933 α      in ANC's #9, #19, #12, ...

........................................................................
.............................. CYCLE    4 ..............................
........................................................................
   1    -39.2836456 -0.392836E+02  0.232E-01    2.09       0.0  T
   2    -39.2836730 -0.274151E-04  0.146E-01    2.11       1.0  T
   3    -39.2835740  0.989974E-04  0.102E-01    2.12       1.0  T
   4    -39.2837199 -0.145872E-03  0.191E-02    2.12       1.2  T
   5    -39.2837241 -0.420167E-05  0.904E-03    2.12       2.5  T
   6    -39.2837250 -0.851139E-06  0.370E-03    2.12       6.2  T
   7    -39.2837250 -0.606556E-07  0.165E-03    2.12      13.9  T
     SCC iter.                  ...        0 min,  0.007 sec
     gradient                   ...        0 min,  0.012 sec
 * total energy  :   -38.6109106 Eh     change       -0.9028339E-03 Eh
   gradient norm :     0.0244431 Eh/α   predicted    -0.1271335E-02 (  40.82%)
   displ. norm   :     0.3371529 α      lambda       -0.1864157E-02
   maximum displ.:     0.1561405 α      in ANC's #3, #9, #1, ...

........................................................................
.............................. CYCLE    5 ..............................
........................................................................
   1    -39.2679359 -0.392679E+02  0.587E-01    2.07       0.0  T
   2    -39.2680146 -0.787481E-04  0.330E-01    2.10       1.0  T
   3    -39.2675924  0.422248E-03  0.152E-01    2.09       1.0  T
   4    -39.2680891 -0.496729E-03  0.175E-02    2.10       1.3  T
   5    -39.2680901 -0.970269E-06  0.126E-02    2.10       1.8  T
   6    -39.2680914 -0.132983E-05  0.449E-03    2.10       5.1  T
   7    -39.2680915 -0.939550E-07  0.210E-03    2.10      10.9  T
     SCC iter.                  ...        0 min,  0.007 sec
     gradient                   ...        0 min,  0.012 sec
 * total energy  :   -38.6082672 Eh     change        0.2643328E-02 Eh
   gradient norm :     0.0752545 Eh/α   predicted    -0.1038030E-02 (-139.27%)
   displ. norm   :     0.2213145 α      lambda       -0.6932259E-02
   maximum displ.:     0.1394456 α      in ANC's #1, #3, #5, ...

........................................................................
.............................. CYCLE    6 ..............................
........................................................................
   1    -39.2866485 -0.392866E+02  0.430E-01    2.14       0.0  T
   2    -39.2867114 -0.629753E-04  0.241E-01    2.14       1.0  T
   3    -39.2865874  0.124050E-03  0.873E-02    2.12       1.0  T
   4    -39.2867425 -0.155165E-03  0.151E-02    2.13       1.5  T
   5    -39.2867448 -0.224979E-05  0.658E-03    2.13       3.5  T
   6    -39.2867449 -0.102679E-06  0.379E-03    2.13       6.1  T
   7    -39.2867450 -0.131332E-06  0.116E-03    2.13      19.7  T
     SCC iter.                  ...        0 min,  0.007 sec
     gradient                   ...        0 min,  0.012 sec
 * total energy  :   -38.6113811 Eh     change       -0.3113866E-02 Eh
   gradient norm :     0.0136568 Eh/α   predicted    -0.3635902E-02 (  16.76%)
   displ. norm   :     0.1424859 α      lambda       -0.5634716E-03
   maximum displ.:     0.1043240 α      in ANC's #4, #12, #3, ...

........................................................................
.............................. CYCLE    7 ..............................
........................................................................
   1    -39.2874028 -0.392874E+02  0.328E-01    2.13       0.0  T
   2    -39.2874266 -0.238653E-04  0.181E-01    2.14       1.0  T
   3    -39.2873679  0.586936E-04  0.637E-02    2.14       1.0  T
   4    -39.2874400 -0.720925E-04  0.801E-03    2.13       2.9  T
   5    -39.2874406 -0.572537E-06  0.470E-03    2.14       4.9  T
   6    -39.2874409 -0.263601E-06  0.188E-03    2.14      12.2  T
   7    -39.2874409 -0.126487E-07  0.769E-04    2.14      29.8  T
     SCC iter.                  ...        0 min,  0.007 sec
     gradient                   ...        0 min,  0.012 sec
 * total energy  :   -38.6111999 Eh     change        0.1811632E-03 Eh
   gradient norm :     0.0189782 Eh/α   predicted    -0.2874589E-03 (-258.67%)
   displ. norm   :     0.1037903 α      lambda       -0.5777156E-03
   maximum displ.:     0.0692390 α      in ANC's #4, #6, #9, ...

........................................................................
.............................. CYCLE    8 ..............................
........................................................................
   1    -39.2855316 -0.392855E+02  0.235E-01    2.13       0.0  T
   2    -39.2855403 -0.864750E-05  0.131E-01    2.14       1.0  T
   3    -39.2854567  0.836152E-04  0.709E-02    2.13       1.0  T
   4    -39.2855531 -0.964155E-04  0.537E-03    2.14       4.3  T
   5    -39.2855534 -0.295565E-06  0.304E-03    2.14       7.6  T
   6    -39.2855534 -0.683239E-07  0.138E-03    2.13      16.6  T
   7    -39.2855535 -0.126866E-07  0.530E-04    2.14      43.3  T
     SCC iter.                  ...        0 min,  0.007 sec
     gradient                   ...        0 min,  0.012 sec
 * total energy  :   -38.6115215 Eh     change       -0.3215031E-03 Eh
   gradient norm :     0.0087529 Eh/α   predicted    -0.2919749E-03 (  -9.18%)
   displ. norm   :     0.0359595 α      lambda       -0.8634298E-04
   maximum displ.:     0.0186493 α      in ANC's #9, #6, #3, ...

........................................................................
.............................. CYCLE    9 ..............................
........................................................................
   1    -39.2869652 -0.392870E+02  0.397E-02    2.13       0.0  T
   2    -39.2869660 -0.784098E-06  0.227E-02    2.14       1.0  T
   3    -39.2869638  0.215843E-05  0.140E-02    2.14       1.6  T
   4    -39.2869665 -0.272586E-05  0.129E-03    2.14      17.8  T
   5    -39.2869666 -0.542202E-08  0.734E-04    2.14      31.2  T
     SCC iter.                  ...        0 min,  0.005 sec
     gradient                   ...        0 min,  0.012 sec
 * total energy  :   -38.6115361 Eh     change       -0.1469897E-04 Eh
   gradient norm :     0.0075361 Eh/α   predicted    -0.4322992E-04 ( 194.10%)
   displ. norm   :     0.0267957 α      lambda       -0.4233606E-04
   maximum displ.:     0.0183759 α      in ANC's #6, #9, #12, ...

........................................................................
.............................. CYCLE   10 ..............................
........................................................................
   1    -39.2863660 -0.392864E+02  0.348E-02    2.14       0.0  T
   2    -39.2863663 -0.276895E-06  0.199E-02    2.14       1.2  T
   3    -39.2863635  0.275699E-05  0.136E-02    2.14       1.7  T
   4    -39.2863668 -0.327294E-05  0.118E-03    2.14      19.4  T
   5    -39.2863668 -0.228716E-08  0.875E-04    2.14      26.2  T
   6    -39.2863668 -0.103017E-07  0.286E-04    2.14      80.2  T
     SCC iter.                  ...        0 min,  0.006 sec
     gradient                   ...        0 min,  0.012 sec
 * total energy  :   -38.6115626 Eh     change       -0.2649341E-04 Eh
   gradient norm :     0.0020072 Eh/α   predicted    -0.2118604E-04 ( -20.03%)
   displ. norm   :     0.0222903 α      lambda       -0.1057554E-04
   maximum displ.:     0.0140367 α      in ANC's #9, #6, #12, ...

........................................................................
.............................. CYCLE   11 ..............................
........................................................................
   1    -39.2866024 -0.392866E+02  0.284E-02    2.14       0.0  T
   2    -39.2866026 -0.160977E-06  0.159E-02    2.14       1.4  T
   3    -39.2866015  0.112436E-05  0.845E-03    2.14       2.7  T
   4    -39.2866028 -0.131633E-05  0.763E-04    2.14      30.1  T
   5    -39.2866028 -0.681943E-09  0.520E-04    2.14      44.1  T
   6    -39.2866028 -0.250547E-08  0.217E-04    2.14     105.7  T
     SCC iter.                  ...        0 min,  0.006 sec
     gradient                   ...        0 min,  0.012 sec
 * total energy  :   -38.6115693 Eh     change       -0.6642937E-05 Eh
   gradient norm :     0.0015585 Eh/α   predicted    -0.5294514E-05 ( -20.30%)
   displ. norm   :     0.0208825 α      lambda       -0.3148545E-05
   maximum displ.:     0.0122440 α      in ANC's #9, #12, #6, ...

........................................................................
.............................. CYCLE   12 ..............................
........................................................................
   1    -39.2868804 -0.392869E+02  0.284E-02    2.14       0.0  T
   2    -39.2868805 -0.120647E-06  0.160E-02    2.14       1.4  T
   3    -39.2868793  0.118836E-05  0.858E-03    2.14       2.7  T
   4    -39.2868807 -0.137939E-05  0.704E-04    2.14      32.6  T
   5    -39.2868807 -0.124313E-08  0.472E-04    2.14      48.6  T
   6    -39.2868807 -0.157698E-08  0.163E-04    2.14     141.0  T
     SCC iter.                  ...        0 min,  0.006 sec
     gradient                   ...        0 min,  0.013 sec
 * total energy  :   -38.6115706 Eh     change       -0.1284228E-05 Eh
   gradient norm :     0.0005649 Eh/α   predicted    -0.1575960E-05 (  22.72%)
   displ. norm   :     0.0076257 α      lambda       -0.1443640E-05
   maximum displ.:     0.0038183 α      in ANC's #2, #13, #11, ...

   *** GEOMETRY OPTIMIZATION CONVERGED AFTER 12 ITERATIONS ***

------------------------------------------------------------------------
 total energy gain   :        -0.0716671 Eh      -44.9718 kcal/mol
 total RMSD          :         0.2370145 a0        0.1254 Å
 total power (kW/mol):       -15.6801654 (step) -542.2381 (real)
------------------------------------------------------------------------

 ANCopt (total)                0 d,  0 h,  0 min,  0.347 sec
 optimizer setup                ...        0 min,  0.000 sec (  0.035%)
 model hessian                  ...        0 min,  0.002 sec (  0.493%)
 ANC generation                 ...        0 min,  0.000 sec (  0.131%)
 coordinate transformation      ...        0 min,  0.000 sec (  0.043%)
 single point calculation       ...        0 min,  0.341 sec ( 98.272%)
 optimization log               ...        0 min,  0.001 sec (  0.270%)
 hessian update                 ...        0 min,  0.000 sec (  0.034%)
 rational function              ...        0 min,  0.002 sec (  0.519%)

================
 final structure:
================
$coord
   -0.11096452480397    1.11933403304877   -0.00259055118140      C 
   -2.49232262972723    2.10479664109269    0.00287141310505      C 
   -4.72653119081976   -0.25819638068247   -0.00297071316106      S 
   -2.46527240728387   -2.60151134782034   -0.01184471726341      C 
   -0.10603001468850   -1.59211036634282   -0.01106440365669      C 
    2.50586776242906   -2.52000047958963   -0.01730062109563      C 
    3.26858678007271   -4.66726226302854   -0.02300416120015      O 
    4.11389770570239   -0.17111463591292   -0.01316035804325      C 
    2.45638259685409    2.05178386683920   -0.00316530964504      C 
    3.15251701224134    4.53402463995358    0.00725443921593      C 
    1.33502905700934    6.48884175954781    0.02246153164719      C 
   -0.12722985658986    8.08808758857459    0.03515076679858      N 
    5.66677082550511    5.41981315740238    0.00994478567109      C 
    7.67283429749639    6.24154058305363    0.01200448360864      N 
    6.63233044384345   -0.29482311131568   -0.02097081202853      C 
   -3.08252786699864    4.04210500557907    0.00901084405816      H 
   -3.01693409740819   -4.54987161609194   -0.01765203807388      H 
    7.52251041536898   -2.12812140284175   -0.03212745557257      H 
    7.84216576390755    1.33891444053879   -0.02268804454083      H 
$end
           -------------------------------------------------
          |                Final Singlepoint                |
           -------------------------------------------------

          ...................................................
          :                      SETUP                      :
          :.................................................:
          :  # basis functions                  70          :
          :  # atomic orbitals                  69          :
          :  # shells                           35          :
          :  # electrons                        70          :
          :  max. iterations                   250          :
          :  Hamiltonian                  GFN2-xTB          :
          :  restarted?                      false          :
          :  GBSA solvation                  false          :
          :  PC potential                    false          :
          :  electronic temp.          300.0000000     K    :
          :  accuracy                    1.0000000          :
          :  -> integral cutoff          0.2500000E+02      :
          :  -> integral neglect         0.1000000E-07      :
          :  -> SCF convergence          0.1000000E-05 Eh   :
          :  -> wf. convergence          0.1000000E-03 e    :
          :  Broyden damping             0.4000000          :
          ...................................................

 iter      E             dE          RMSdq      gap      omega  full diag
   1    -39.2868807 -0.392869E+02  0.775E-05    2.14       0.0  T
   2    -39.2868807 -0.341061E-12  0.383E-05    2.14     599.5  T
   3    -39.2868807 -0.128466E-10  0.403E-05    2.14     569.9  T

   *** convergence criteria satisfied after 3 iterations ***

         #    Occupation            Energy/Eh            Energy/eV
      -------------------------------------------------------------
         1        2.0000           -0.7739772             -21.0610
       ...           ...                  ...                  ...
        29        2.0000           -0.4838753             -13.1669
        30        2.0000           -0.4542259             -12.3601
        31        2.0000           -0.4516638             -12.2904
        32        2.0000           -0.4427404             -12.0476
        33        2.0000           -0.4415664             -12.0156
        34        2.0000           -0.4256219             -11.5818
        35        2.0000           -0.4201854             -11.4338 (HOMO)
        36                         -0.3415819              -9.2949 (LUMO)
        37                         -0.3198215              -8.7028
        38                         -0.2776069              -7.5541
        39                         -0.2513232              -6.8389
        40                         -0.2405974              -6.5470
       ...                                ...                  ...
        69                          1.1528430              31.3705
      -------------------------------------------------------------
                  HL-Gap            0.0786035 Eh            2.1389 eV
             Fermi-level           -0.3808836 Eh          -10.3644 eV

 SCC (total)                   0 d,  0 h,  0 min,  0.025 sec
 SCC setup                      ...        0 min,  0.000 sec (  0.647%)
 Dispersion                     ...        0 min,  0.000 sec (  0.760%)
 integral evaluation            ...        0 min,  0.009 sec ( 35.291%)
 zeroth order Hamiltonian       ...        0 min,  0.000 sec (  0.595%)
 iterations                     ...        0 min,  0.003 sec ( 13.622%)
 molecular gradient             ...        0 min,  0.012 sec ( 47.897%)
 printout                       ...        0 min,  0.000 sec (  1.029%)

         :::::::::::::::::::::::::::::::::::::::::::::::::::::
         ::                     SUMMARY                     ::
         :::::::::::::::::::::::::::::::::::::::::::::::::::::
         :: total energy             -38.611570543727 Eh    ::
         :: gradient norm              0.000565048367 Eh/a0 ::
         :: HOMO-LUMO gap              2.138910461098 eV    ::
         ::.................................................::
         :: SCC energy               -39.286880701979 Eh    ::
         :: -> isotropic ES            0.040779413346 Eh    ::
         :: -> anisotropic ES          0.002437751076 Eh    ::
         :: -> anisotropic XC          0.042187940450 Eh    ::
         :: -> dispersion             -0.023587129181 Eh    ::
         :: repulsion energy           0.675223742839 Eh    ::
         :: add. restraining           0.000000000000 Eh    ::
         :::::::::::::::::::::::::::::::::::::::::::::::::::::

           -------------------------------------------------
          |                Property Printout                |
           -------------------------------------------------

    * Orbital Energies and Occupations

         #    Occupation            Energy/Eh            Energy/eV
      -------------------------------------------------------------
         1        2.0000           -0.7739772             -21.0610
       ...           ...                  ...                  ...
        23        2.0000           -0.5119431             -13.9307
        24        2.0000           -0.5053529             -13.7514
        25        2.0000           -0.5001471             -13.6097
        26        2.0000           -0.4943916             -13.4531
        27        2.0000           -0.4940117             -13.4427
        28        2.0000           -0.4914985             -13.3744
        29        2.0000           -0.4838753             -13.1669
        30        2.0000           -0.4542259             -12.3601
        31        2.0000           -0.4516638             -12.2904
        32        2.0000           -0.4427404             -12.0476
        33        2.0000           -0.4415664             -12.0156
        34        2.0000           -0.4256219             -11.5818
        35        2.0000           -0.4201854             -11.4338 (HOMO)
        36                         -0.3415819              -9.2949 (LUMO)
        37                         -0.3198215              -8.7028
        38                         -0.2776069              -7.5541
        39                         -0.2513232              -6.8389
        40                         -0.2405974              -6.5470
        41                         -0.2297644              -6.2522
        42                         -0.2128965              -5.7932
        43                         -0.1924516              -5.2369
        44                         -0.1593702              -4.3367
        45                         -0.1566613              -4.2630
        46                         -0.1059086              -2.8819
       ...                                ...                  ...
        69                          1.1528430              31.3705
      -------------------------------------------------------------
                  HL-Gap            0.0786035 Eh            2.1389 eV
             Fermi-level           -0.3808836 Eh          -10.3644 eV

     #   Z        covCN         q      C6AA      α(0)
     1   6 C      3.236    -0.008    27.324     8.481
     2   6 C      2.926    -0.024    28.599     8.770
     3  16 S      2.340     0.079   137.875    19.763
     4   6 C      2.926    -0.011    28.287     8.722
     5   6 C      3.235    -0.031    27.882     8.569
     6   6 C      2.853     0.234    23.114     7.880
     7   8 O      0.856    -0.345    20.604     6.086
     8   6 C      3.003    -0.011    28.279     8.723
     9   6 C      3.002     0.037    27.159     8.549
    10   6 C      2.947     0.013    27.730     8.637
    11   6 C      1.930     0.122    28.086     8.558
    12   7 N      0.911    -0.222    25.855     7.354
    13   6 C      1.925     0.124    28.039     8.551
    14   7 N      0.911    -0.220    25.806     7.347
    15   6 C      2.840    -0.054    29.330     8.875
    16   1 H      0.926     0.074     2.037     2.232
    17   1 H      0.926     0.076     2.021     2.223
    18   1 H      0.926     0.089     1.888     2.149
    19   1 H      0.926     0.077     2.012     2.218

 Mol. C6AA /au·bohr⁶  :       8050.917925
 Mol. C8AA /au·bohr⁸  :     230362.531496
 Mol. α(0) /au        :        143.687152


Wiberg/Mayer (AO) data.
largest (>0.10) Wiberg bond orders for each atom
          total WBO             WBO to atom ...
     1  C   3.986        C    2 1.544    C    5 1.156    C    9 1.111
     2  C   3.941        C    1 1.544    S    3 1.223    H   16 0.964
     3  S   2.697        C    2 1.223    C    4 1.216
     4  C   3.955        C    5 1.577    S    3 1.216    H   17 0.966
     5  C   3.980        C    4 1.577    C    1 1.156    C    6 1.035
     6  C   3.935        O    7 1.809    C    5 1.035    C    8 0.982
     7  O   2.091        C    6 1.809
     8  C   3.987        C   15 1.805    C    9 1.078    C    6 0.982
     9  C   3.985        C   10 1.523    C    1 1.111    C    8 1.078
    10  C   3.986        C    9 1.523    C   13 1.094    C   11 1.089
    11  C   3.949        N   12 2.783    C   10 1.089
    12  N   2.993        C   11 2.783
    13  C   3.948        N   14 2.778    C   10 1.094
    14  N   2.984        C   13 2.778
    15  C   3.939        C    8 1.805    H   18 0.967    H   19 0.966
    16  H   0.994        C    2 0.964
    17  H   0.994        C    4 0.966
    18  H   0.991        C   15 0.967
    19  H   0.993        C   15 0.966

molecular dipole:
                 x           y           z       tot (Debye)
 q only:       -1.073      -0.666      -0.006
   full:       -1.054      -0.972      -0.009       3.645
molecular quadrupole (traceless):
                xx          xy          yy          xz          yz          zz
 q only:        7.963      -2.288     -16.618      -0.026      -0.106       8.655
  q+dip:        7.222      -3.352     -18.651      -0.038      -0.132      11.429
   full:        3.418      -3.045     -20.220      -0.020      -0.161      16.802

           -------------------------------------------------
          |                Geometry Summary                 |
           -------------------------------------------------

      molecular mass/u    :      212.2254000
   center of mass at/Å    :        0.6589645       0.7258006      -0.0007928
  moments of inertia/u·Å² :        0.6352919E+03   0.1029573E+04   0.1664864E+04
rotational constants/cm⁻¹ :        0.2653525E-01   0.1637342E-01   0.1012553E-01

 * 15 selected distances

     #   Z        #   Z                                     value/Å
     1   6 C      2   6 C                                 1.3638031
     2   6 C      3  16 S                                 1.7208807
     3  16 S      4   6 C                                 1.7232416 (max)
     1   6 C      5   6 C                                 1.4348441
     4   6 C      5   6 C                                 1.3579266
     6   6 C      7   8 O                                 1.2058400
     1   6 C      9   6 C                                 1.4454130
     9   6 C     10   6 C                                 1.3642341
    11   6 C     12   7 N                                 1.1467345
    13   6 C     14   7 N                                 1.1471717
     8   6 C     15   6 C                                 1.3343106
     2   6 C     16   1 H                                 1.0717040
     4   6 C     17   1 H                                 1.0715640 (min)
    15   6 C     18   1 H                                 1.0784741
    15   6 C     19   1 H                                 1.0757801

 * 5 distinct bonds (by element types)

   Z      Z             #   av. dist./Å        max./Å        min./Å
   1 H    6 C           4     1.0743805     1.0784741     1.0715640
   6 C    6 C           6     1.3834219     1.4454130     1.3343106
   6 C    7 N           2     1.1469531     1.1471717     1.1467345
   6 C    8 O           1     1.2058400     1.2058400     1.2058400
   6 C   16 S           2     1.7220612     1.7232416     1.7208807


optimized geometry written to: xtbopt.xyz


           -------------------------------------------------
          | TOTAL ENERGY              -38.611570543727 Eh   |
          | GRADIENT NORM               0.000565048367 Eh/α |
          | HOMO-LUMO GAP               2.138910461098 eV   |
           -------------------------------------------------

------------------------------------------------------------------------
 * finished run on 2021/02/19 at 08:09:17.334     
------------------------------------------------------------------------
 total:
 * wall-time:     0 d,  0 h,  0 min,  0.433 sec
 *  cpu-time:     0 d,  0 h,  0 min,  0.427 sec
 * ratio c/w:     0.987 speedup
 SCF:
 * wall-time:     0 d,  0 h,  0 min,  0.035 sec
 *  cpu-time:     0 d,  0 h,  0 min,  0.035 sec
 * ratio c/w:     1.000 speedup
 ANC optimizer:
 * wall-time:     0 d,  0 h,  0 min,  0.373 sec
 *  cpu-time:     0 d,  0 h,  0 min,  0.373 sec
 * ratio c/w:     1.000 speedup

