      -----------------------------------------------------------      
     |                   =====================                   |     
     |                           x T B                           |     
     |                   =====================                   |     
     |                         S. Grimme                         |     
     |          Mulliken Center for Theoretical Chemistry        |     
     |                    University of Bonn                     |     
     |                Version 6.2 RC2 (SAW190805)                |     
      -----------------------------------------------------------      

   This program is distributed in the hope that it will be useful,
   but WITHOUT ANY WARRANTY; without even the implied warranty of
   MERCHANTABILITY or FITNESS FOR A PARTICULAR PURPOSE.
   
   FOR NON-COMMERCIAL, ACADEMIA USE ONLY.
   
   Cite this work as:
   * S. Grimme, C. Bannwarth, P. Shushkov, J. Chem. Theory Comput., 2017,
     13, 1989-2009. DOI: 10.1021/acs.jctc.7b00118
   * C. Bannwarth, S. Ehlert and S. Grimme., J. Chem. Theory Comput., 2019,
     15, 1652-1671. DOI: 10.1021/acs.jctc.8b01176
   * P. Pracht, E. Caldeweyher, S. Ehlert, S. Grimme, ChemRxiv, 2019, preprint.
     DOI: 10.26434/chemrxiv.8326202.v1
   
   for DFT-D4:
   * E. Caldeweyher, C. Bannwarth and S. Grimme, J. Chem. Phys., 2017,
     147, 034112. DOI: 10.1063/1.4993215
   * E. Caldeweyher, S. Ehlert, A. Hansen, H. Neugebauer, S. Spicher,
     C. Bannwarth and S. Grimme, J. Chem. Phys., 2019, 150, 154122.
     DOI: 10.1063/1.5090222
   
   for sTDA-xTB:
   * S. Grimme and C. Bannwarth, J. Chem. Phys., 2016, 145, 054103.
     DOI: 10.1063/1.4959605
   
   in the mass-spec context:
   * V. Asgeirsson, C. Bauer and S. Grimme, Chem. Sci., 2017, 8, 4879.
     DOI: 10.1039/c7sc00601b
   
   for metadynamics refer to:
   * S. Grimme, J. Chem. Theory Comput., 2019, 155, 2847-2862
     DOI: 10.1021/acs.jctc.9b00143
   
   with help from (in alphabetical order)
   C. Bannwarth, F. Bohle, G. Brandenburg, E. Caldeweyher, M. Checinski,
   S. Dohm, S. Ehlert, S. Ehrlich, F. März, H. Neugebauer, J. Pisarek,
   P. Pracht, P. Shushkov, and S. Spicher.
   
 * started run on 2021/02/19 at 08:09:20.280     

           -------------------------------------------------
          |                Calculation Setup                |
           -------------------------------------------------

          program call               : /ihome/ghutchison/geoffh/xtb/xtb 15u.xyz -opt
          hostname                   : smp-n61
          coordinate file            : 15u.xyz
          omp threads                :                     1
          number of atoms            :                    20
          number of electrons        :                    54
          charge                     :                     0
          spin                       :                   0.0
          first test random number   :      0.70004886598520


########################################################################
# WARNING! Please study the warnings concerning your input carefully
#  - the use of '-opt' is discouraged, please use '--opt' next time
########################################################################

           ------------------------------------------------- 
          |                 G F N 2 - x T B                 |
          | Geometry, Frequencies, Noncovalent interactions |
          |            JCTC 2019 parametrisation            |
           ------------------------------------------------- 
             KAB for C  - Si     :                1.0500
             KAB for H  - Pd     :                0.9500
             k(s)              :                1.8500
             k(p)              :                2.2300
             k(d)              :                2.2300
             k(f)              :                2.0000
             kEN (H0ij)        :               -2.0000
             D4 a1             :                0.5200
             D4 a2             :                5.0000
             D4 s6             :                1.0000
             D4 s8             :                2.7000
             D4 s9             :                5.0000
             alphaj            :                2.0000

  Z AO/shell   Hii/eV     exponent
  1     Wed Apr 25 08:07:45 CEST 2018   EN: 2.200 GM2: 0.406  GM3: 0.0800  RAES: 1.40
     1s    -10.707211    1.230000
  6     Wed Apr 25 08:07:45 CEST 2018   EN: 2.550 GM2: 0.538  GM3: 0.1500  RAES: 3.00
     2s    -13.970922    2.096432
     2p    -10.063292    1.800000
  8     Wed Apr 25 08:07:45 CEST 2018   EN: 3.440 GM2: 0.452  GM3:-0.0517  RAES: 1.80
     2s    -20.229985    2.439742
     2p    -15.503117    2.137023

           ------------------------------------------------- 
          |        Self-Consistent Charge Iterations        |
           ------------------------------------------------- 

          ...................................................
          :                      SETUP                      :
          :.................................................:
          :  # basis functions                  50          :
          :  # atomic orbitals                  50          :
          :  # shells                           30          :
          :  # electrons                        54          :
          :  max. iterations                   250          :
          :  Hamiltonian                  GFN2-xTB          :
          :  restarted?                      false          :
          :  GBSA solvation                  false          :
          :  PC potential                    false          :
          :  electronic temp.          300.0000000     K    :
          :  accuracy                    1.0000000          :
          :  -> integral cutoff          0.2500000E+02      :
          :  -> integral neglect         0.1000000E-07      :
          :  -> SCF convergence          0.1000000E-05 Eh   :
          :  -> wf. convergence          0.1000000E-03 e    :
          :  Broyden damping             0.4000000          :
          ...................................................

 iter      E             dE          RMSdq      gap      omega  full diag
   1    -30.6925026 -0.306925E+02  0.468E+00    3.62       0.0  T
   2    -30.7325553 -0.400527E-01  0.262E+00    3.77       1.0  T
   3    -30.7314602  0.109509E-02  0.901E-01    3.56       1.0  T
   4    -30.7340931 -0.263292E-02  0.264E-01    3.79       1.0  T
   5    -30.7348730 -0.779942E-03  0.808E-02    3.74       1.0  T
   6    -30.7348710  0.197891E-05  0.466E-02    3.73       1.0  T
   7    -30.7348901 -0.190160E-04  0.139E-02    3.74       1.6  T
   8    -30.7348911 -0.108230E-05  0.326E-03    3.74       6.9  T
   9    -30.7348912 -0.261320E-07  0.109E-03    3.74      20.6  T
  10    -30.7348912 -0.500943E-09  0.642E-04    3.74      34.8  T
  11    -30.7348912 -0.392557E-08  0.142E-04    3.74     157.9  T

   *** convergence criteria satisfied after 11 iterations ***

         #    Occupation            Energy/Eh            Energy/eV
      -------------------------------------------------------------
         1        2.0000           -0.7095216             -19.3071
       ...           ...                  ...                  ...
        21        2.0000           -0.4622260             -12.5778
        22        2.0000           -0.4560956             -12.4110
        23        2.0000           -0.4481151             -12.1938
        24        2.0000           -0.4270351             -11.6202
        25        2.0000           -0.4134795             -11.2514
        26        2.0000           -0.4007304             -10.9044
        27        2.0000           -0.3636116              -9.8944 (HOMO)
        28                         -0.2262785              -6.1574 (LUMO)
        29                         -0.2044703              -5.5639
        30                         -0.0901335              -2.4527
        31                          0.0192148               0.5229
        32                          0.0355535               0.9675
       ...                                ...                  ...
        50                          0.6508347              17.7101
      -------------------------------------------------------------
                  HL-Gap            0.1373331 Eh            3.7370 eV
             Fermi-level           -0.2949450 Eh           -8.0259 eV

 SCC (total)                   0 d,  0 h,  0 min,  0.022 sec
 SCC setup                      ...        0 min,  0.000 sec (  1.084%)
 Dispersion                     ...        0 min,  0.000 sec (  1.057%)
 integral evaluation            ...        0 min,  0.005 sec ( 21.355%)
 zeroth order Hamiltonian       ...        0 min,  0.000 sec (  0.435%)
 iterations                     ...        0 min,  0.008 sec ( 38.943%)
 molecular gradient             ...        0 min,  0.008 sec ( 35.812%)
 printout                       ...        0 min,  0.000 sec (  1.094%)

         :::::::::::::::::::::::::::::::::::::::::::::::::::::
         ::                     SUMMARY                     ::
         :::::::::::::::::::::::::::::::::::::::::::::::::::::
         :: total energy             -30.340566908476 Eh    ::
         :: gradient norm              0.039832795559 Eh/a0 ::
         :: HOMO-LUMO gap              3.737022963469 eV    ::
         ::.................................................::
         :: SCC energy               -30.734891177509 Eh    ::
         :: -> isotropic ES            0.030381941300 Eh    ::
         :: -> anisotropic ES          0.005347430519 Eh    ::
         :: -> anisotropic XC          0.008886492332 Eh    ::
         :: -> dispersion             -0.015098788788 Eh    ::
         :: repulsion energy           0.394342554821 Eh    ::
         :: add. restraining           0.000000000000 Eh    ::
         :::::::::::::::::::::::::::::::::::::::::::::::::::::

      ----------------------------------------------------------- 
     |                   =====================                   |
     |                        A N C O P T                        |
     |                   =====================                   |
     |               Approximate Normal Coordinate               |
     |                Rational Function Optimizer                |
      ----------------------------------------------------------- 

          ...................................................
          :                      SETUP                      :
          :.................................................:
          :   optimization level            normal          :
          :   max. optcycles                   200          :
          :   ANC micro-cycles                  20          :
          :   degrees of freedom                54          :
          :.................................................:
          :   RF solver                   davidson          :
          :   input Hessian                  false          :
          :   write xtbopt.log                true          :
          :   linear?                        false          :
          :   energy convergence         0.5000000E-05 Eh   :
          :   grad. convergence          0.1000000E-02 Eh/α :
          :   maximium RF displ.         2.0000000          :
          :   Hlow (freq-cutoff)         0.5000000E-02      :
          :   Hmax (freq-cutoff)         5.0000000          :
          :   S6 in model hess.         20.0000000          :
          ...................................................

generating ANC from model Hessian ...
Using Lindh-Hessian (1995)
 Shifting diagonal of input Hessian by   3.653283003583946E-003
 Lowest  eigenvalues of input Hessian
   -0.000000   -0.000000   -0.000000    0.000000    0.000000    0.000000
    0.005000    0.006956    0.008195    0.009075    0.011303    0.015539
    0.018622    0.020078    0.028837    0.035978    0.038927    0.048817
 Highest eigenvalues
    1.525487    1.595745    1.854539    1.866154    1.996121    2.094848
 

........................................................................
.............................. CYCLE    1 ..............................
........................................................................
   1    -30.7348912 -0.307349E+02  0.666E-05    3.74       0.0  T
   2    -30.7348912 -0.167582E-10  0.352E-05    3.74     634.7  T
   3    -30.7348912 -0.150280E-11  0.231E-05    3.74     968.8  T
     SCC iter.                  ...        0 min,  0.003 sec
     gradient                   ...        0 min,  0.008 sec
 * total energy  :   -30.3405669 Eh     change        0.7485816E-08 Eh
   gradient norm :     0.0398336 Eh/α   predicted     0.0000000E+00 (-100.00%)
   displ. norm   :     0.2131661 α      lambda       -0.3297798E-02
   maximum displ.:     0.1169748 α      in ANC's #2, #4, #13, ...

........................................................................
.............................. CYCLE    2 ..............................
........................................................................
   1    -30.7511861 -0.307512E+02  0.165E-01    3.83       0.0  T
   2    -30.7511957 -0.955577E-05  0.998E-02    3.81       1.0  T
   3    -30.7511886  0.704216E-05  0.253E-02    3.82       1.0  T
   4    -30.7511984 -0.980400E-05  0.476E-03    3.82       4.7  T
   5    -30.7511985 -0.894364E-07  0.272E-03    3.82       8.2  T
   6    -30.7511985 -0.242509E-07  0.118E-03    3.82      18.9  T
     SCC iter.                  ...        0 min,  0.004 sec
     gradient                   ...        0 min,  0.007 sec
 * total energy  :   -30.3427569 Eh     change       -0.2189971E-02 Eh
   gradient norm :     0.0148442 Eh/α   predicted    -0.1723842E-02 ( -21.28%)
   displ. norm   :     0.2141330 α      lambda       -0.8255829E-03
   maximum displ.:     0.1383480 α      in ANC's #2, #4, #3, ...

........................................................................
.............................. CYCLE    3 ..............................
........................................................................
   1    -30.7560694 -0.307561E+02  0.155E-01    3.84       0.0  T
   2    -30.7560749 -0.551347E-05  0.943E-02    3.84       1.0  T
   3    -30.7560676  0.729603E-05  0.221E-02    3.85       1.0  T
   4    -30.7560772 -0.957525E-05  0.449E-03    3.84       5.0  T
   5    -30.7560773 -0.847065E-07  0.254E-03    3.84       8.8  T
   6    -30.7560773 -0.167102E-07  0.879E-04    3.84      25.4  T
     SCC iter.                  ...        0 min,  0.004 sec
     gradient                   ...        0 min,  0.007 sec
 * total energy  :   -30.3433184 Eh     change       -0.5614938E-03 Eh
   gradient norm :     0.0050484 Eh/α   predicted    -0.4317278E-03 ( -23.11%)
   displ. norm   :     0.2373405 α      lambda       -0.4058786E-03
   maximum displ.:     0.1610356 α      in ANC's #2, #4, #1, ...

........................................................................
.............................. CYCLE    4 ..............................
........................................................................
   1    -30.7560082 -0.307560E+02  0.170E-01    3.84       0.0  T
   2    -30.7560138 -0.559408E-05  0.103E-01    3.84       1.0  T
   3    -30.7560062  0.759836E-05  0.228E-02    3.84       1.0  T
   4    -30.7560164 -0.101389E-04  0.482E-03    3.84       4.6  T
   5    -30.7560164 -0.833946E-07  0.235E-03    3.84       9.5  T
   6    -30.7560164 -0.222236E-08  0.688E-04    3.84      32.5  T
     SCC iter.                  ...        0 min,  0.004 sec
     gradient                   ...        0 min,  0.007 sec
 * total energy  :   -30.3436340 Eh     change       -0.3156819E-03 Eh
   gradient norm :     0.0079752 Eh/α   predicted    -0.2143714E-03 ( -32.09%)
   displ. norm   :     0.2901438 α      lambda       -0.4299069E-03
   maximum displ.:     0.1899103 α      in ANC's #2, #4, #1, ...

........................................................................
.............................. CYCLE    5 ..............................
........................................................................
   1    -30.7546198 -0.307546E+02  0.210E-01    3.83       0.0  T
   2    -30.7546276 -0.786639E-05  0.128E-01    3.83       1.0  T
   3    -30.7546166  0.110655E-04  0.286E-02    3.83       1.0  T
   4    -30.7546316 -0.150119E-04  0.581E-03    3.83       3.9  T
   5    -30.7546317 -0.868271E-07  0.274E-03    3.83       8.2  T
   6    -30.7546317 -0.784617E-09  0.644E-04    3.83      34.7  T
     SCC iter.                  ...        0 min,  0.004 sec
     gradient                   ...        0 min,  0.007 sec
 * total energy  :   -30.3439586 Eh     change       -0.3245369E-03 Eh
   gradient norm :     0.0103730 Eh/α   predicted    -0.2330494E-03 ( -28.19%)
   displ. norm   :     0.2961017 α      lambda       -0.4255660E-03
   maximum displ.:     0.1976981 α      in ANC's #2, #1, #4, ...

........................................................................
.............................. CYCLE    6 ..............................
........................................................................
   1    -30.7538400 -0.307538E+02  0.217E-01    3.81       0.0  T
   2    -30.7538474 -0.736830E-05  0.133E-01    3.82       1.0  T
   3    -30.7538381  0.928750E-05  0.280E-02    3.81       1.0  T
   4    -30.7538515 -0.133920E-04  0.588E-03    3.82       3.8  T
   5    -30.7538515 -0.520841E-07  0.271E-03    3.82       8.3  T
   6    -30.7538515 -0.388332E-08  0.808E-04    3.82      27.7  T
     SCC iter.                  ...        0 min,  0.004 sec
     gradient                   ...        0 min,  0.007 sec
 * total energy  :   -30.3442613 Eh     change       -0.3027304E-03 Eh
   gradient norm :     0.0092475 Eh/α   predicted    -0.2314454E-03 ( -23.55%)
   displ. norm   :     0.2080826 α      lambda       -0.3046350E-03
   maximum displ.:     0.1421232 α      in ANC's #2, #1, #4, ...

........................................................................
.............................. CYCLE    7 ..............................
........................................................................
   1    -30.7550652 -0.307551E+02  0.151E-01    3.81       0.0  T
   2    -30.7550686 -0.335733E-05  0.921E-02    3.81       1.0  T
   3    -30.7550659  0.270705E-05  0.172E-02    3.81       1.3  T
   4    -30.7550705 -0.461156E-05  0.414E-03    3.81       5.4  T
   5    -30.7550705 -0.178676E-07  0.186E-03    3.81      12.0  T
   6    -30.7550705 -0.978289E-08  0.566E-04    3.81      39.5  T
     SCC iter.                  ...        0 min,  0.004 sec
     gradient                   ...        0 min,  0.007 sec
 * total energy  :   -30.3444759 Eh     change       -0.2146256E-03 Eh
   gradient norm :     0.0048604 Eh/α   predicted    -0.1589405E-03 ( -25.95%)
   displ. norm   :     0.2708537 α      lambda       -0.2040303E-03
   maximum displ.:     0.2058997 α      in ANC's #2, #1, #4, ...

........................................................................
.............................. CYCLE    8 ..............................
........................................................................
   1    -30.7541270 -0.307541E+02  0.196E-01    3.81       0.0  T
   2    -30.7541311 -0.412642E-05  0.120E-01    3.81       1.0  T
   3    -30.7541323 -0.120076E-05  0.108E-02    3.81       2.1  T
   4    -30.7541336 -0.125460E-05  0.517E-03    3.81       4.3  T
   5    -30.7541337 -0.533875E-07  0.168E-03    3.81      13.3  T
   6    -30.7541337 -0.651730E-08  0.441E-04    3.81      50.7  T
     SCC iter.                  ...        0 min,  0.004 sec
     gradient                   ...        0 min,  0.007 sec
 * total energy  :   -30.3445610 Eh     change       -0.8502901E-04 Eh
   gradient norm :     0.0070567 Eh/α   predicted    -0.1095029E-03 (  28.78%)
   displ. norm   :     0.1007908 α      lambda       -0.2117208E-03
   maximum displ.:     0.0554946 α      in ANC's #3, #2, #1, ...

........................................................................
.............................. CYCLE    9 ..............................
........................................................................
   1    -30.7580771 -0.307581E+02  0.612E-02    3.82       0.0  T
   2    -30.7580781 -0.104293E-05  0.368E-02    3.82       1.0  T
   3    -30.7580772  0.992403E-06  0.855E-03    3.82       2.6  T
   4    -30.7580785 -0.137232E-05  0.226E-03    3.82       9.9  T
   5    -30.7580786 -0.284495E-07  0.108E-03    3.82      20.6  T
     SCC iter.                  ...        0 min,  0.004 sec
     gradient                   ...        0 min,  0.007 sec
 * total energy  :   -30.3446360 Eh     change       -0.7499454E-04 Eh
   gradient norm :     0.0044765 Eh/α   predicted    -0.1069360E-03 (  42.59%)
   displ. norm   :     0.0675040 α      lambda       -0.4963027E-04
   maximum displ.:     0.0561797 α      in ANC's #2, #1, #4, ...

........................................................................
.............................. CYCLE   10 ..............................
........................................................................
   1    -30.7570809 -0.307571E+02  0.503E-02    3.82       0.0  T
   2    -30.7570812 -0.315300E-06  0.308E-02    3.82       1.0  T
   3    -30.7570810  0.188637E-06  0.455E-03    3.82       4.9  T
   4    -30.7570814 -0.385578E-06  0.143E-03    3.82      15.6  T
   5    -30.7570814 -0.242500E-08  0.521E-04    3.82      42.9  T
     SCC iter.                  ...        0 min,  0.004 sec
     gradient                   ...        0 min,  0.007 sec
 * total energy  :   -30.3446701 Eh     change       -0.3415695E-04 Eh
   gradient norm :     0.0025861 Eh/α   predicted    -0.2496492E-04 ( -26.91%)
   displ. norm   :     0.0743121 α      lambda       -0.2775268E-04
   maximum displ.:     0.0589398 α      in ANC's #2, #3, #1, ...

........................................................................
.............................. CYCLE   11 ..............................
........................................................................
   1    -30.7566150 -0.307566E+02  0.504E-02    3.82       0.0  T
   2    -30.7566153 -0.333630E-06  0.307E-02    3.82       1.0  T
   3    -30.7566151  0.198582E-06  0.489E-03    3.82       4.6  T
   4    -30.7566155 -0.373301E-06  0.136E-03    3.82      16.5  T
   5    -30.7566155 -0.363535E-08  0.607E-04    3.82      36.8  T
   6    -30.7566155 -0.328114E-09  0.173E-04    3.82     129.0  T
     SCC iter.                  ...        0 min,  0.004 sec
     gradient                   ...        0 min,  0.008 sec
 * total energy  :   -30.3446882 Eh     change       -0.1803746E-04 Eh
   gradient norm :     0.0012959 Eh/α   predicted    -0.1395919E-04 ( -22.61%)
   displ. norm   :     0.0773445 α      lambda       -0.1169421E-04
   maximum displ.:     0.0483527 α      in ANC's #3, #2, #1, ...

........................................................................
.............................. CYCLE   12 ..............................
........................................................................
   1    -30.7567050 -0.307567E+02  0.478E-02    3.82       0.0  T
   2    -30.7567052 -0.206418E-06  0.289E-02    3.82       1.0  T
   3    -30.7567052 -0.144081E-07  0.275E-03    3.82       8.1  T
   4    -30.7567053 -0.852003E-07  0.115E-03    3.82      19.4  T
   5    -30.7567053 -0.366885E-08  0.497E-04    3.82      45.0  T
   6    -30.7567053 -0.234333E-09  0.888E-05    3.82     251.7  T
     SCC iter.                  ...        0 min,  0.004 sec
     gradient                   ...        0 min,  0.008 sec
 * total energy  :   -30.3446971 Eh     change       -0.8986875E-05 Eh
   gradient norm :     0.0012189 Eh/α   predicted    -0.5865508E-05 ( -34.73%)
   displ. norm   :     0.0170178 α      lambda       -0.3271556E-05
   maximum displ.:     0.0109711 α      in ANC's #3, #4, #5, ...

........................................................................
.............................. CYCLE   13 ..............................
........................................................................
   1    -30.7569985 -0.307570E+02  0.103E-02    3.82       0.0  T
   2    -30.7569986 -0.425170E-07  0.621E-03    3.82       3.6  T
   3    -30.7569985  0.561585E-07  0.219E-03    3.82      10.2  T
   4    -30.7569986 -0.723136E-07  0.335E-04    3.82      66.7  T
   5    -30.7569986 -0.673356E-09  0.157E-04    3.82     142.2  T
     SCC iter.                  ...        0 min,  0.004 sec
     gradient                   ...        0 min,  0.008 sec
 * total energy  :   -30.3447000 Eh     change       -0.2860952E-05 Eh
   gradient norm :     0.0005812 Eh/α   predicted    -0.1643276E-05 ( -42.56%)
   displ. norm   :     0.0220054 α      lambda       -0.1477325E-05
   maximum displ.:     0.0134178 α      in ANC's #1, #3, #2, ...

   *** GEOMETRY OPTIMIZATION CONVERGED AFTER 13 ITERATIONS ***

------------------------------------------------------------------------
 total energy gain   :        -0.0041331 Eh       -2.5936 kcal/mol
 total RMSD          :         0.4032010 a0        0.2134 Å
 total power (kW/mol):        -0.8347267 (step)  -49.3241 (real)
------------------------------------------------------------------------

 ANCopt (total)                0 d,  0 h,  0 min,  0.220 sec
 optimizer setup                ...        0 min,  0.000 sec (  0.049%)
 model hessian                  ...        0 min,  0.003 sec (  1.261%)
 ANC generation                 ...        0 min,  0.001 sec (  0.234%)
 coordinate transformation      ...        0 min,  0.000 sec (  0.075%)
 single point calculation       ...        0 min,  0.213 sec ( 96.752%)
 optimization log               ...        0 min,  0.001 sec (  0.476%)
 hessian update                 ...        0 min,  0.000 sec (  0.057%)
 rational function              ...        0 min,  0.002 sec (  0.766%)

================
 final structure:
================
$coord
   -1.46042030404844    2.22478104519463    0.21968116509281      C 
    1.13245149528117    2.40760996436561   -0.10405587123132      C 
    2.45613606654472    4.61601676480104   -0.31089633780360      O 
    1.11730299361807    6.90500475446830   -0.17986547070219      C 
    2.55830598229923    0.18981755387398   -0.23661284490467      C 
    1.41335338914819   -2.13271496327509   -0.04127349953414      C 
   -1.19848971040741   -2.32038556571381    0.29219631804779      C 
   -2.61777331814170   -0.12231962463971    0.41573477058854      C 
   -2.14475724223561   -4.71725326459615    0.47358786770351      O 
   -4.75832634486812   -5.01703990172971    0.83231362879174      C 
   -2.63023666874481    3.89092661118813    0.32631789666965      H 
    2.52913302684011    8.38962798669775   -0.37366542967888      H 
    0.14820918398535    7.11972074796299    1.63672015691376      H 
   -0.26121626479676    7.07191704681011   -1.71490427939126      H 
    4.57345801695782    0.34665120045166   -0.49344415597415      H 
    2.50422860118190   -3.85088094567748   -0.13982672512049      H 
   -4.64004581365717   -0.18461787932416    0.66597117784418      H 
   -5.07496872497994   -7.04646313013868    0.95735147191698      H 
   -5.83790644316420   -4.25562258948735   -0.76038697600289      H 
   -5.39596615284536   -4.11919067214293    2.58413513381473      H 
$end
           -------------------------------------------------
          |                Final Singlepoint                |
           -------------------------------------------------

          ...................................................
          :                      SETUP                      :
          :.................................................:
          :  # basis functions                  50          :
          :  # atomic orbitals                  50          :
          :  # shells                           30          :
          :  # electrons                        54          :
          :  max. iterations                   250          :
          :  Hamiltonian                  GFN2-xTB          :
          :  restarted?                      false          :
          :  GBSA solvation                  false          :
          :  PC potential                    false          :
          :  electronic temp.          300.0000000     K    :
          :  accuracy                    1.0000000          :
          :  -> integral cutoff          0.2500000E+02      :
          :  -> integral neglect         0.1000000E-07      :
          :  -> SCF convergence          0.1000000E-05 Eh   :
          :  -> wf. convergence          0.1000000E-03 e    :
          :  Broyden damping             0.4000000          :
          ...................................................

 iter      E             dE          RMSdq      gap      omega  full diag
   1    -30.7569986 -0.307570E+02  0.531E-05    3.82       0.0  T
   2    -30.7569986 -0.199449E-10  0.298E-05    3.82     750.1  T
   3    -30.7569986 -0.115925E-10  0.171E-05    3.82    1305.2  T

   *** convergence criteria satisfied after 3 iterations ***

         #    Occupation            Energy/Eh            Energy/eV
      -------------------------------------------------------------
         1        2.0000           -0.7103655             -19.3300
       ...           ...                  ...                  ...
        21        2.0000           -0.4641247             -12.6295
        22        2.0000           -0.4617436             -12.5647
        23        2.0000           -0.4481479             -12.1947
        24        2.0000           -0.4233484             -11.5199
        25        2.0000           -0.4165587             -11.3351
        26        2.0000           -0.4028250             -10.9614
        27        2.0000           -0.3615911              -9.8394 (HOMO)
        28                         -0.2213226              -6.0225 (LUMO)
        29                         -0.2019045              -5.4941
        30                         -0.0828989              -2.2558
        31                          0.0294590               0.8016
        32                          0.0452819               1.2322
       ...                                ...                  ...
        50                          0.6829086              18.5829
      -------------------------------------------------------------
                  HL-Gap            0.1402686 Eh            3.8169 eV
             Fermi-level           -0.2914568 Eh           -7.9309 eV

 SCC (total)                   0 d,  0 h,  0 min,  0.015 sec
 SCC setup                      ...        0 min,  0.000 sec (  0.956%)
 Dispersion                     ...        0 min,  0.000 sec (  0.930%)
 integral evaluation            ...        0 min,  0.005 sec ( 29.435%)
 zeroth order Hamiltonian       ...        0 min,  0.000 sec (  0.539%)
 iterations                     ...        0 min,  0.003 sec ( 16.341%)
 molecular gradient             ...        0 min,  0.008 sec ( 50.071%)
 printout                       ...        0 min,  0.000 sec (  1.462%)

         :::::::::::::::::::::::::::::::::::::::::::::::::::::
         ::                     SUMMARY                     ::
         :::::::::::::::::::::::::::::::::::::::::::::::::::::
         :: total energy             -30.344700007857 Eh    ::
         :: gradient norm              0.000582149380 Eh/a0 ::
         :: HOMO-LUMO gap              3.816902747088 eV    ::
         ::.................................................::
         :: SCC energy               -30.756998587840 Eh    ::
         :: -> isotropic ES            0.029746940398 Eh    ::
         :: -> anisotropic ES          0.004505561183 Eh    ::
         :: -> anisotropic XC          0.007870830148 Eh    ::
         :: -> dispersion             -0.015150584057 Eh    ::
         :: repulsion energy           0.412319752906 Eh    ::
         :: add. restraining           0.000000000000 Eh    ::
         :::::::::::::::::::::::::::::::::::::::::::::::::::::

           -------------------------------------------------
          |                Property Printout                |
           -------------------------------------------------

    * Orbital Energies and Occupations

         #    Occupation            Energy/Eh            Energy/eV
      -------------------------------------------------------------
         1        2.0000           -0.7103655             -19.3300
       ...           ...                  ...                  ...
        15        2.0000           -0.5217164             -14.1966
        16        2.0000           -0.4962400             -13.5034
        17        2.0000           -0.4868265             -13.2472
        18        2.0000           -0.4853047             -13.2058
        19        2.0000           -0.4739002             -12.8955
        20        2.0000           -0.4645666             -12.6415
        21        2.0000           -0.4641247             -12.6295
        22        2.0000           -0.4617436             -12.5647
        23        2.0000           -0.4481479             -12.1947
        24        2.0000           -0.4233484             -11.5199
        25        2.0000           -0.4165587             -11.3351
        26        2.0000           -0.4028250             -10.9614
        27        2.0000           -0.3615911              -9.8394 (HOMO)
        28                         -0.2213226              -6.0225 (LUMO)
        29                         -0.2019045              -5.4941
        30                         -0.0828989              -2.2558
        31                          0.0294590               0.8016
        32                          0.0452819               1.2322
        33                          0.1070441               2.9128
        34                          0.1132217               3.0809
        35                          0.1329346               3.6173
        36                          0.1432856               3.8990
        37                          0.1626417               4.4257
        38                          0.1731176               4.7108
       ...                                ...                  ...
        50                          0.6829086              18.5829
      -------------------------------------------------------------
                  HL-Gap            0.1402686 Eh            3.8169 eV
             Fermi-level           -0.2914568 Eh           -7.9309 eV

     #   Z        covCN         q      C6AA      α(0)
     1   6 C      2.919    -0.069    29.714     8.939
     2   6 C      2.865     0.133    25.097     8.212
     3   8 O      1.705    -0.273    18.536     5.813
     4   6 C      3.644     0.039    20.249     6.468
     5   6 C      2.921    -0.054    29.332     8.881
     6   6 C      2.921    -0.054    29.332     8.881
     7   6 C      2.865     0.133    25.097     8.212
     8   6 C      2.919    -0.069    29.714     8.939
     9   8 O      1.705    -0.274    18.539     5.813
    10   6 C      3.644     0.039    20.250     6.468
    11   1 H      0.926     0.036     2.507     2.476
    12   1 H      0.925     0.060     2.199     2.319
    13   1 H      0.924     0.038     2.481     2.463
    14   1 H      0.924     0.038     2.481     2.463
    15   1 H      0.926     0.053     2.281     2.362
    16   1 H      0.926     0.053     2.281     2.362
    17   1 H      0.926     0.036     2.507     2.476
    18   1 H      0.925     0.060     2.199     2.319
    19   1 H      0.924     0.038     2.481     2.463
    20   1 H      0.924     0.038     2.480     2.463

 Mol. C6AA /au·bohr⁶  :       4182.477250
 Mol. C8AA /au·bohr⁸  :      96669.840493
 Mol. α(0) /au        :        100.791793


Wiberg/Mayer (AO) data.
largest (>0.10) Wiberg bond orders for each atom
          total WBO             WBO to atom ...
     1  C   3.988        C    8 1.418    C    2 1.393    H   11 0.967    C    6 0.105
     2  C   3.935        C    1 1.393    C    5 1.335    O    3 1.049
     3  O   2.214        C    2 1.049    C    4 0.989
     4  C   3.949        O    3 0.989    H   12 0.980    H   13 0.977    H   14 0.977
     5  C   3.988        C    6 1.495    C    2 1.335    H   15 0.968    C    8 0.105
     6  C   3.988        C    5 1.495    C    7 1.335    H   16 0.968    C    1 0.105
     7  C   3.935        C    8 1.393    C    6 1.335    O    9 1.049
     8  C   3.988        C    1 1.418    C    7 1.393    H   17 0.967    C    5 0.105
     9  O   2.214        C    7 1.049    C   10 0.989
    10  C   3.949        O    9 0.989    H   18 0.980    H   19 0.977    H   20 0.977
    11  H   0.999        C    1 0.967
    12  H   0.996        C    4 0.980
    13  H   0.998        C    4 0.977
    14  H   0.998        C    4 0.977
    15  H   0.997        C    5 0.968
    16  H   0.997        C    6 0.968
    17  H   0.999        C    8 0.967
    18  H   0.996        C   10 0.980
    19  H   0.998        C   10 0.977
    20  H   0.998        C   10 0.977

molecular dipole:
                 x           y           z       tot (Debye)
 q only:       -0.632       0.319       0.080
   full:       -0.922       0.464       0.113       2.640
molecular quadrupole (traceless):
                xx          xy          yy          xz          yz          zz
 q only:        1.084       1.259       3.187      -0.850      -0.292      -4.271
  q+dip:        2.483       0.041       2.807      -1.150      -0.141      -5.290
   full:        1.564       0.426       2.433      -0.891      -0.148      -3.996

           -------------------------------------------------
          |                Geometry Summary                 |
           -------------------------------------------------

      molecular mass/u    :      138.1658000
   center of mass at/Å    :       -0.2107268       0.1204196       0.0754631
  moments of inertia/u·Å² :        0.1240635E+03   0.7088759E+03   0.8264927E+03
rotational constants/cm⁻¹ :        0.1358791E+00   0.2378079E-01   0.2039659E-01

 * 20 selected distances

     #   Z        #   Z                                     value/Å
     1   6 C      2   6 C                                 1.3861229
     2   6 C      3   8 O                                 1.3668746
     3   8 O      4   6 C                                 1.4049740
     2   6 C      5   6 C                                 1.3969914
     5   6 C      6   6 C                                 1.3741533
     6   6 C      7   6 C                                 1.3968823
     1   6 C      8   6 C                                 1.3887032
     7   6 C      8   6 C                                 1.3861133
     7   6 C      9   8 O                                 1.3670094
     9   8 O     10   6 C                                 1.4049930 (max)
     1   6 C     11   1 H                                 1.0787798
     4   6 C     12   1 H                                 1.0889908
     4   6 C     13   1 H                                 1.0954390
     4   6 C     14   1 H                                 1.0953483
     5   6 C     15   1 H                                 1.0781974 (min)
     6   6 C     16   1 H                                 1.0782519
     8   6 C     17   1 H                                 1.0788061
    10   6 C     18   1 H                                 1.0889300
    10   6 C     19   1 H                                 1.0950191
    10   6 C     20   1 H                                 1.0949746

 * 3 distinct bonds (by element types)

   Z      Z             #   av. dist./Å        max./Å        min./Å
   1 H    6 C          10     1.0872737     1.0954390     1.0781974
   6 C    6 C           6     1.3881611     1.3969914     1.3741533
   6 C    8 O           4     1.3859628     1.4049930     1.3668746


optimized geometry written to: xtbopt.xyz


           -------------------------------------------------
          | TOTAL ENERGY              -30.344700007857 Eh   |
          | GRADIENT NORM               0.000582149380 Eh/α |
          | HOMO-LUMO GAP               3.816902747088 eV   |
           -------------------------------------------------

------------------------------------------------------------------------
 * finished run on 2021/02/19 at 08:09:20.562     
------------------------------------------------------------------------
 total:
 * wall-time:     0 d,  0 h,  0 min,  0.282 sec
 *  cpu-time:     0 d,  0 h,  0 min,  0.273 sec
 * ratio c/w:     0.967 speedup
 SCF:
 * wall-time:     0 d,  0 h,  0 min,  0.022 sec
 *  cpu-time:     0 d,  0 h,  0 min,  0.022 sec
 * ratio c/w:     1.000 speedup
 ANC optimizer:
 * wall-time:     0 d,  0 h,  0 min,  0.236 sec
 *  cpu-time:     0 d,  0 h,  0 min,  0.236 sec
 * ratio c/w:     1.000 speedup

