      -----------------------------------------------------------      
     |                   =====================                   |     
     |                           x T B                           |     
     |                   =====================                   |     
     |                         S. Grimme                         |     
     |          Mulliken Center for Theoretical Chemistry        |     
     |                    University of Bonn                     |     
     |                Version 6.2 RC2 (SAW190805)                |     
      -----------------------------------------------------------      

   This program is distributed in the hope that it will be useful,
   but WITHOUT ANY WARRANTY; without even the implied warranty of
   MERCHANTABILITY or FITNESS FOR A PARTICULAR PURPOSE.
   
   FOR NON-COMMERCIAL, ACADEMIA USE ONLY.
   
   Cite this work as:
   * S. Grimme, C. Bannwarth, P. Shushkov, J. Chem. Theory Comput., 2017,
     13, 1989-2009. DOI: 10.1021/acs.jctc.7b00118
   * C. Bannwarth, S. Ehlert and S. Grimme., J. Chem. Theory Comput., 2019,
     15, 1652-1671. DOI: 10.1021/acs.jctc.8b01176
   * P. Pracht, E. Caldeweyher, S. Ehlert, S. Grimme, ChemRxiv, 2019, preprint.
     DOI: 10.26434/chemrxiv.8326202.v1
   
   for DFT-D4:
   * E. Caldeweyher, C. Bannwarth and S. Grimme, J. Chem. Phys., 2017,
     147, 034112. DOI: 10.1063/1.4993215
   * E. Caldeweyher, S. Ehlert, A. Hansen, H. Neugebauer, S. Spicher,
     C. Bannwarth and S. Grimme, J. Chem. Phys., 2019, 150, 154122.
     DOI: 10.1063/1.5090222
   
   for sTDA-xTB:
   * S. Grimme and C. Bannwarth, J. Chem. Phys., 2016, 145, 054103.
     DOI: 10.1063/1.4959605
   
   in the mass-spec context:
   * V. Asgeirsson, C. Bauer and S. Grimme, Chem. Sci., 2017, 8, 4879.
     DOI: 10.1039/c7sc00601b
   
   for metadynamics refer to:
   * S. Grimme, J. Chem. Theory Comput., 2019, 155, 2847-2862
     DOI: 10.1021/acs.jctc.9b00143
   
   with help from (in alphabetical order)
   C. Bannwarth, F. Bohle, G. Brandenburg, E. Caldeweyher, M. Checinski,
   S. Dohm, S. Ehlert, S. Ehrlich, F. März, H. Neugebauer, J. Pisarek,
   P. Pracht, P. Shushkov, and S. Spicher.
   
 * started run on 2021/02/19 at 08:09:21.896     

           -------------------------------------------------
          |                Calculation Setup                |
           -------------------------------------------------

          program call               : /ihome/ghutchison/geoffh/xtb/xtb 16atl.xyz -opt
          hostname                   : smp-n61
          coordinate file            : 16atl.xyz
          omp threads                :                     1
          number of atoms            :                    25
          number of electrons        :                    80
          charge                     :                     0
          spin                       :                   0.0
          first test random number   :      0.31187261897566


########################################################################
# WARNING! Please study the warnings concerning your input carefully
#  - the use of '-opt' is discouraged, please use '--opt' next time
########################################################################

           ------------------------------------------------- 
          |                 G F N 2 - x T B                 |
          | Geometry, Frequencies, Noncovalent interactions |
          |            JCTC 2019 parametrisation            |
           ------------------------------------------------- 
             KAB for C  - Si     :                1.0500
             KAB for H  - Pd     :                0.9500
             k(s)              :                1.8500
             k(p)              :                2.2300
             k(d)              :                2.2300
             k(f)              :                2.0000
             kEN (H0ij)        :               -2.0000
             D4 a1             :                0.5200
             D4 a2             :                5.0000
             D4 s6             :                1.0000
             D4 s8             :                2.7000
             D4 s9             :                5.0000
             alphaj            :                2.0000

  Z AO/shell   Hii/eV     exponent
  1     Wed Apr 25 08:07:45 CEST 2018   EN: 2.200 GM2: 0.406  GM3: 0.0800  RAES: 1.40
     1s    -10.707211    1.230000
  6     Wed Apr 25 08:07:45 CEST 2018   EN: 2.550 GM2: 0.538  GM3: 0.1500  RAES: 3.00
     2s    -13.970922    2.096432
     2p    -10.063292    1.800000
  7     Wed Apr 25 08:07:45 CEST 2018   EN: 3.040 GM2: 0.461  GM3:-0.0640  RAES: 1.90
     2s    -16.686243    2.339881
     2p    -12.523956    2.014332
  8     Wed Apr 25 08:07:45 CEST 2018   EN: 3.440 GM2: 0.452  GM3:-0.0517  RAES: 1.80
     2s    -20.229985    2.439742
     2p    -15.503117    2.137023

           ------------------------------------------------- 
          |        Self-Consistent Charge Iterations        |
           ------------------------------------------------- 

          ...................................................
          :                      SETUP                      :
          :.................................................:
          :  # basis functions                  76          :
          :  # atomic orbitals                  76          :
          :  # shells                           42          :
          :  # electrons                        80          :
          :  max. iterations                   250          :
          :  Hamiltonian                  GFN2-xTB          :
          :  restarted?                      false          :
          :  GBSA solvation                  false          :
          :  PC potential                    false          :
          :  electronic temp.          300.0000000     K    :
          :  accuracy                    1.0000000          :
          :  -> integral cutoff          0.2500000E+02      :
          :  -> integral neglect         0.1000000E-07      :
          :  -> SCF convergence          0.1000000E-05 Eh   :
          :  -> wf. convergence          0.1000000E-03 e    :
          :  Broyden damping             0.4000000          :
          ...................................................

 iter      E             dE          RMSdq      gap      omega  full diag
   1    -44.4366740 -0.444367E+02  0.636E+00    2.53       0.0  T
   2    -44.3822785  0.543954E-01  0.436E+00    2.19       1.0  T
   3    -44.2681958  0.114083E+00  0.375E+00    1.93       1.0  T
   4    -44.5153932 -0.247197E+00  0.110E+00    1.96       1.0  T
   5    -44.5368411 -0.214479E-01  0.350E-01    1.93       1.0  T
   6    -44.5383657 -0.152458E-02  0.156E-01    1.95       1.0  T
   7    -44.5386126 -0.246846E-03  0.553E-02    1.98       1.0  T
   8    -44.5386326 -0.200549E-04  0.291E-02    1.97       1.0  T
   9    -44.5386405 -0.786046E-05  0.121E-02    1.97       1.7  T
  10    -44.5386415 -0.106731E-05  0.534E-03    1.97       3.7  T
  11    -44.5386419 -0.335104E-06  0.188E-03    1.97      10.6  T
  12    -44.5386419 -0.419075E-07  0.758E-04    1.97      26.4  T
  13    -44.5386419  0.157569E-08  0.521E-04    1.97      38.4  T

   *** convergence criteria satisfied after 13 iterations ***

         #    Occupation            Energy/Eh            Energy/eV
      -------------------------------------------------------------
         1        2.0000           -0.7237051             -19.6930
       ...           ...                  ...                  ...
        34        2.0000           -0.4595518             -12.5050
        35        2.0000           -0.4524452             -12.3117
        36        2.0000           -0.4480532             -12.1921
        37        2.0000           -0.4428307             -12.0500
        38        2.0000           -0.4317228             -11.7478
        39        2.0000           -0.4260427             -11.5932
        40        2.0000           -0.4104293             -11.1683 (HOMO)
        41                         -0.3380247              -9.1981 (LUMO)
        42                         -0.3169110              -8.6236
        43                         -0.2791155              -7.5951
        44                         -0.2608866              -7.0991
        45                         -0.2575741              -7.0089
       ...                                ...                  ...
        76                          1.0661175              29.0105
      -------------------------------------------------------------
                  HL-Gap            0.0724045 Eh            1.9702 eV
             Fermi-level           -0.3742270 Eh          -10.1832 eV

 SCC (total)                   0 d,  0 h,  0 min,  0.045 sec
 SCC setup                      ...        0 min,  0.000 sec (  0.723%)
 Dispersion                     ...        0 min,  0.000 sec (  0.994%)
 integral evaluation            ...        0 min,  0.011 sec ( 24.293%)
 zeroth order Hamiltonian       ...        0 min,  0.000 sec (  0.414%)
 iterations                     ...        0 min,  0.017 sec ( 37.605%)
 molecular gradient             ...        0 min,  0.016 sec ( 35.112%)
 printout                       ...        0 min,  0.000 sec (  0.756%)

         :::::::::::::::::::::::::::::::::::::::::::::::::::::
         ::                     SUMMARY                     ::
         :::::::::::::::::::::::::::::::::::::::::::::::::::::
         :: total energy             -43.813074539554 Eh    ::
         :: gradient norm              0.255441290029 Eh/a0 ::
         :: HOMO-LUMO gap              1.970227818993 eV    ::
         ::.................................................::
         :: SCC energy               -44.538641920125 Eh    ::
         :: -> isotropic ES            0.040971236040 Eh    ::
         :: -> anisotropic ES          0.002108725328 Eh    ::
         :: -> anisotropic XC          0.051167048280 Eh    ::
         :: -> dispersion             -0.027893421915 Eh    ::
         :: repulsion energy           0.725518432755 Eh    ::
         :: add. restraining           0.000000000000 Eh    ::
         :::::::::::::::::::::::::::::::::::::::::::::::::::::

      ----------------------------------------------------------- 
     |                   =====================                   |
     |                        A N C O P T                        |
     |                   =====================                   |
     |               Approximate Normal Coordinate               |
     |                Rational Function Optimizer                |
      ----------------------------------------------------------- 

          ...................................................
          :                      SETUP                      :
          :.................................................:
          :   optimization level            normal          :
          :   max. optcycles                   200          :
          :   ANC micro-cycles                  20          :
          :   degrees of freedom                69          :
          :.................................................:
          :   RF solver                   davidson          :
          :   input Hessian                  false          :
          :   write xtbopt.log                true          :
          :   linear?                        false          :
          :   energy convergence         0.5000000E-05 Eh   :
          :   grad. convergence          0.1000000E-02 Eh/α :
          :   maximium RF displ.         2.0000000          :
          :   Hlow (freq-cutoff)         0.5000000E-02      :
          :   Hmax (freq-cutoff)         5.0000000          :
          :   S6 in model hess.         20.0000000          :
          ...................................................

generating ANC from model Hessian ...
Using Lindh-Hessian (1995)
 Shifting diagonal of input Hessian by   5.212548235971993E-003
 Lowest  eigenvalues of input Hessian
    0.005000    0.005181   -0.000000   -0.000000   -0.000000    0.000000
    0.000000    0.000000    0.006503    0.008127    0.008928    0.009825
    0.011858    0.014005    0.015495    0.015678    0.019447    0.020559
 Highest eigenvalues
    1.942791    1.991732    2.006359    2.069355    2.254883    2.540495
 

........................................................................
.............................. CYCLE    1 ..............................
........................................................................
   1    -44.5386419 -0.445386E+02  0.126E-04    1.97       0.0  T
   2    -44.5386419  0.451692E-10  0.105E-04    1.97     191.4  T
   3    -44.5386419 -0.196607E-09  0.609E-05    1.97     328.6  T
     SCC iter.                  ...        0 min,  0.004 sec
     gradient                   ...        0 min,  0.016 sec
 * total energy  :   -43.8130745 Eh     change        0.5975909E-07 Eh
   gradient norm :     0.2554427 Eh/α   predicted     0.0000000E+00 (-100.00%)
   displ. norm   :     0.3114119 α      lambda       -0.5480375E-01
   maximum displ.:     0.1278268 α      in ANC's #44, #42, #25, ...

........................................................................
.............................. CYCLE    2 ..............................
........................................................................
   1    -44.6527443 -0.446527E+02  0.433E-01    2.02       0.0  T
   2    -44.6529596 -0.215289E-03  0.267E-01    2.03       1.0  T
   3    -44.6526714  0.288229E-03  0.204E-01    2.03       1.0  T
   4    -44.6532819 -0.610529E-03  0.363E-02    2.01       1.0  T
   5    -44.6533144 -0.324496E-04  0.150E-02    2.03       1.3  T
   6    -44.6533186 -0.426232E-05  0.662E-03    2.03       3.0  T
   7    -44.6533189 -0.300380E-06  0.348E-03    2.02       5.8  T
   8    -44.6533190 -0.795413E-07  0.147E-03    2.02      13.6  T
     SCC iter.                  ...        0 min,  0.009 sec
     gradient                   ...        0 min,  0.015 sec
 * total energy  :   -43.8454852 Eh     change       -0.3241070E-01 Eh
   gradient norm :     0.0484501 Eh/α   predicted    -0.3005968E-01 (  -7.25%)
   displ. norm   :     0.2137256 α      lambda       -0.3789813E-02
   maximum displ.:     0.0985534 α      in ANC's #16, #25, #10, ...

........................................................................
.............................. CYCLE    3 ..............................
........................................................................
   1    -44.6699153 -0.446699E+02  0.126E-01    1.99       0.0  T
   2    -44.6699234 -0.810264E-05  0.973E-02    2.00       1.0  T
   3    -44.6699845 -0.611227E-04  0.534E-02    2.00       1.0  T
   4    -44.6699987 -0.142643E-04  0.173E-02    2.00       1.2  T
   5    -44.6700049 -0.614524E-05  0.609E-03    2.00       3.3  T
   6    -44.6700054 -0.559132E-06  0.171E-03    2.00      11.7  T
   7    -44.6700055 -0.123780E-07  0.815E-04    2.00      24.5  T
     SCC iter.                  ...        0 min,  0.008 sec
     gradient                   ...        0 min,  0.015 sec
 * total energy  :   -43.8479651 Eh     change       -0.2479958E-02 Eh
   gradient norm :     0.0212613 Eh/α   predicted    -0.1981476E-02 ( -20.10%)
   displ. norm   :     0.1796926 α      lambda       -0.9107131E-03
   maximum displ.:     0.0760451 α      in ANC's #10, #14, #16, ...

........................................................................
.............................. CYCLE    4 ..............................
........................................................................
   1    -44.6693674 -0.446694E+02  0.190E-01    1.97       0.0  T
   2    -44.6693890 -0.215358E-04  0.110E-01    1.98       1.0  T
   3    -44.6693304  0.585202E-04  0.592E-02    1.99       1.0  T
   4    -44.6694020 -0.715652E-04  0.977E-03    1.99       2.0  T
   5    -44.6694034 -0.136931E-05  0.476E-03    1.99       4.2  T
   6    -44.6694036 -0.276437E-06  0.239E-03    1.99       8.4  T
     SCC iter.                  ...        0 min,  0.007 sec
     gradient                   ...        0 min,  0.015 sec
 * total energy  :   -43.8480100 Eh     change       -0.4486608E-04 Eh
   gradient norm :     0.0177289 Eh/α   predicted    -0.4700775E-03 ( 947.73%)
   displ. norm   :     0.2663290 α      lambda       -0.1637636E-02
   maximum displ.:     0.1098913 α      in ANC's #1, #7, #4, ...

........................................................................
.............................. CYCLE    5 ..............................
........................................................................
   1    -44.6688837 -0.446689E+02  0.352E-01    1.95       0.0  T
   2    -44.6689373 -0.535930E-04  0.197E-01    1.97       1.0  T
   3    -44.6688252  0.112034E-03  0.838E-02    1.96       1.0  T
   4    -44.6689676 -0.142392E-03  0.121E-02    1.97       1.7  T
   5    -44.6689696 -0.201415E-05  0.627E-03    1.97       3.2  T
   6    -44.6689700 -0.320020E-06  0.362E-03    1.97       5.5  T
   7    -44.6689701 -0.165921E-06  0.862E-04    1.97      23.2  T
   8    -44.6689701 -0.644822E-08  0.362E-04    1.97      55.2  T
     SCC iter.                  ...        0 min,  0.010 sec
     gradient                   ...        0 min,  0.015 sec
 * total energy  :   -43.8474457 Eh     change        0.5643056E-03 Eh
   gradient norm :     0.0395080 Eh/α   predicted    -0.8769132E-03 (-255.40%)
   displ. norm   :     0.1762287 α      lambda       -0.2143080E-02
   maximum displ.:     0.0702871 α      in ANC's #1, #7, #16, ...

........................................................................
.............................. CYCLE    6 ..............................
........................................................................
   1    -44.6725914 -0.446726E+02  0.205E-01    2.01       0.0  T
   2    -44.6726186 -0.271976E-04  0.119E-01    2.00       1.0  T
   3    -44.6725284  0.902196E-04  0.714E-02    1.99       1.0  T
   4    -44.6726380 -0.109664E-03  0.119E-02    1.99       1.7  T
   5    -44.6726406 -0.251875E-05  0.538E-03    1.99       3.7  T
   6    -44.6726409 -0.357554E-06  0.227E-03    1.99       8.8  T
     SCC iter.                  ...        0 min,  0.007 sec
     gradient                   ...        0 min,  0.015 sec
 * total energy  :   -43.8484215 Eh     change       -0.9758137E-03 Eh
   gradient norm :     0.0102744 Eh/α   predicted    -0.1104821E-02 (  13.22%)
   displ. norm   :     0.0615435 α      lambda       -0.1206864E-03
   maximum displ.:     0.0380365 α      in ANC's #2, #7, #12, ...

........................................................................
.............................. CYCLE    7 ..............................
........................................................................
   1    -44.6696735 -0.446697E+02  0.102E-01    1.99       0.0  T
   2    -44.6696770 -0.348200E-05  0.566E-02    1.99       1.0  T
   3    -44.6696709  0.607076E-05  0.177E-02    1.99       1.1  T
   4    -44.6696790 -0.812517E-05  0.225E-03    1.99       8.9  T
   5    -44.6696791 -0.183023E-07  0.147E-03    1.99      13.6  T
   6    -44.6696791 -0.215929E-07  0.675E-04    1.99      29.6  T
     SCC iter.                  ...        0 min,  0.007 sec
     gradient                   ...        0 min,  0.015 sec
 * total energy  :   -43.8483505 Eh     change        0.7099110E-04 Eh
   gradient norm :     0.0059039 Eh/α   predicted    -0.6057536E-04 (-185.33%)
   displ. norm   :     0.0659134 α      lambda       -0.2599540E-03
   maximum displ.:     0.0401034 α      in ANC's #2, #7, #3, ...

........................................................................
.............................. CYCLE    8 ..............................
........................................................................
   1    -44.6689107 -0.446689E+02  0.109E-01    1.99       0.0  T
   2    -44.6689148 -0.417970E-05  0.604E-02    1.99       1.0  T
   3    -44.6689152 -0.312189E-06  0.756E-03    1.99       2.6  T
   4    -44.6689167 -0.150379E-05  0.188E-03    1.99      10.7  T
   5    -44.6689167 -0.200193E-07  0.906E-04    1.99      22.1  T
     SCC iter.                  ...        0 min,  0.006 sec
     gradient                   ...        0 min,  0.015 sec
 * total energy  :   -43.8484362 Eh     change       -0.8563220E-04 Eh
   gradient norm :     0.0100498 Eh/α   predicted    -0.1305418E-03 (  52.44%)
   displ. norm   :     0.0218102 α      lambda       -0.7790961E-04
   maximum displ.:     0.0140290 α      in ANC's #7, #5, #2, ...

........................................................................
.............................. CYCLE    9 ..............................
........................................................................
   1    -44.6717249 -0.446717E+02  0.319E-02    1.99       0.0  T
   2    -44.6717257 -0.801629E-06  0.181E-02    1.99       1.1  T
   3    -44.6717240  0.168414E-05  0.988E-03    1.99       2.0  T
   4    -44.6717261 -0.206409E-05  0.128E-03    1.99      15.6  T
   5    -44.6717261 -0.240958E-07  0.753E-04    1.99      26.6  T
     SCC iter.                  ...        0 min,  0.006 sec
     gradient                   ...        0 min,  0.015 sec
 * total energy  :   -43.8484573 Eh     change       -0.2111964E-04 Eh
   gradient norm :     0.0047292 Eh/α   predicted    -0.3897438E-04 (  84.54%)
   displ. norm   :     0.0128746 α      lambda       -0.1844321E-04
   maximum displ.:     0.0068241 α      in ANC's #14, #12, #4, ...

........................................................................
.............................. CYCLE   10 ..............................
........................................................................
   1    -44.6706965 -0.446707E+02  0.175E-02    1.99       0.0  T
   2    -44.6706966 -0.109863E-06  0.100E-02    1.99       2.0  T
   3    -44.6706957  0.891534E-06  0.684E-03    1.99       2.9  T
   4    -44.6706968 -0.106667E-05  0.686E-04    1.99      29.1  T
   5    -44.6706968 -0.890223E-08  0.388E-04    1.99      51.6  T
     SCC iter.                  ...        0 min,  0.006 sec
     gradient                   ...        0 min,  0.015 sec
 * total energy  :   -43.8484671 Eh     change       -0.9821752E-05 Eh
   gradient norm :     0.0006415 Eh/α   predicted    -0.9226444E-05 (  -6.06%)
   displ. norm   :     0.0116123 α      lambda       -0.1944096E-05
   maximum displ.:     0.0082953 α      in ANC's #14, #15, #13, ...

........................................................................
.............................. CYCLE   11 ..............................
........................................................................
   1    -44.6705035 -0.446705E+02  0.155E-02    1.99       0.0  T
   2    -44.6705035 -0.380952E-07  0.873E-03    1.99       2.3  T
   3    -44.6705029  0.604577E-06  0.511E-03    1.99       3.9  T
   4    -44.6705036 -0.692284E-06  0.325E-04    1.99      61.5  T
   5    -44.6705036 -0.745260E-09  0.214E-04    1.99      93.7  T
     SCC iter.                  ...        0 min,  0.006 sec
     gradient                   ...        0 min,  0.016 sec
 * total energy  :   -43.8484690 Eh     change       -0.1880625E-05 Eh
   gradient norm :     0.0010198 Eh/α   predicted    -0.9767744E-06 ( -48.06%)
   displ. norm   :     0.0179962 α      lambda       -0.2215344E-05
   maximum displ.:     0.0119899 α      in ANC's #14, #15, #13, ...

........................................................................
.............................. CYCLE   12 ..............................
........................................................................
   1    -44.6706860 -0.446707E+02  0.232E-02    1.99       0.0  T
   2    -44.6706861 -0.839862E-07  0.131E-02    1.99       1.5  T
   3    -44.6706848  0.124573E-05  0.731E-03    1.99       2.7  T
   4    -44.6706862 -0.142151E-05  0.499E-04    1.99      40.1  T
   5    -44.6706862 -0.114834E-08  0.330E-04    1.99      60.6  T
   6    -44.6706862 -0.101776E-08  0.122E-04    1.99     164.2  T
     SCC iter.                  ...        0 min,  0.007 sec
     gradient                   ...        0 min,  0.016 sec
 * total energy  :   -43.8484697 Eh     change       -0.6984802E-06 Eh
   gradient norm :     0.0004940 Eh/α   predicted    -0.1109272E-05 (  58.81%)
   displ. norm   :     0.0179735 α      lambda        0.6221735E-05
   maximum displ.:     0.0119894 α      in ANC's #14, #15, #13, ...

   *** GEOMETRY OPTIMIZATION CONVERGED AFTER 12 ITERATIONS ***

------------------------------------------------------------------------
 total energy gain   :        -0.0353951 Eh      -22.2108 kcal/mol
 total RMSD          :         0.1261863 a0        0.0668 Å
 total power (kW/mol):        -7.7441590 (step) -226.9367 (real)
------------------------------------------------------------------------

 ANCopt (total)                0 d,  0 h,  0 min,  0.410 sec
 optimizer setup                ...        0 min,  0.000 sec (  0.033%)
 model hessian                  ...        0 min,  0.003 sec (  0.830%)
 ANC generation                 ...        0 min,  0.001 sec (  0.164%)
 coordinate transformation      ...        0 min,  0.000 sec (  0.046%)
 single point calculation       ...        0 min,  0.401 sec ( 98.036%)
 optimization log               ...        0 min,  0.001 sec (  0.293%)
 hessian update                 ...        0 min,  0.000 sec (  0.034%)
 rational function              ...        0 min,  0.002 sec (  0.384%)

================
 final structure:
================
$coord
   -2.13914211305285   -2.66674988577742    0.00156705045456      C 
   -2.28825796302305   -5.23937066476227    0.00459066925011      C 
   -4.57026282500070   -6.62713664841319    0.00634030910611      C 
   -6.34495604574770   -7.87183592482270    0.00720360724928      N 
   -0.17632229960366   -6.87364661038936    0.00726967553673      C 
    1.45976240904379   -8.29607486961372    0.01135710702702      N 
    0.16564673860134   -1.15791367853181   -0.00011221754604      C 
   -0.46583273217794    1.42979294682129    0.00347759425448      C 
    1.38883195230329    3.26980377431089    0.00294813408149      C 
    3.89655118093181    2.51676068084389   -0.00210728230261      C 
    4.56130191290508   -0.03194802914736   -0.00665072945164      C 
    2.68227175439824   -1.87928741181192   -0.00535285053532      C 
    7.27256214417847   -0.82511938019355   -0.01332398861323      C 
   -3.22660078258737    1.73031593027294    0.00588673156092      C 
   -4.44341823826596    3.66147105405633    0.01052155489977      O 
   -4.27355843200462   -0.90551764766587    0.00326115844092      C 
   -6.75662519813570   -1.34241237621040    0.00057540961848      C 
    0.86894652427102    5.24162663603783    0.00607131710785      H 
    5.37072122535806    3.92853514908468   -0.00278457790240      H 
    3.22097257043331   -3.84463234944062   -0.00891199461756      H 
    8.52583647138705    0.80106808764015   -0.01133213977825      H 
    7.67306588799931   -1.96955661867893   -1.67633691782199      H 
    7.67895605508440   -1.97841939393214    1.64206829866790      H 
   -8.02301374929188    0.25523411791027   -0.00216372063910      H 
   -7.58787552998548   -3.19716144021260   -0.00711685462873      H 
$end
           -------------------------------------------------
          |                Final Singlepoint                |
           -------------------------------------------------

          ...................................................
          :                      SETUP                      :
          :.................................................:
          :  # basis functions                  76          :
          :  # atomic orbitals                  76          :
          :  # shells                           42          :
          :  # electrons                        80          :
          :  max. iterations                   250          :
          :  Hamiltonian                  GFN2-xTB          :
          :  restarted?                      false          :
          :  GBSA solvation                  false          :
          :  PC potential                    false          :
          :  electronic temp.          300.0000000     K    :
          :  accuracy                    1.0000000          :
          :  -> integral cutoff          0.2500000E+02      :
          :  -> integral neglect         0.1000000E-07      :
          :  -> SCF convergence          0.1000000E-05 Eh   :
          :  -> wf. convergence          0.1000000E-03 e    :
          :  Broyden damping             0.4000000          :
          ...................................................

 iter      E             dE          RMSdq      gap      omega  full diag
   1    -44.6706862 -0.446707E+02  0.589E-05    1.99       0.0  T
   2    -44.6706862 -0.326139E-11  0.274E-05    1.99     730.1  T
   3    -44.6706862 -0.903810E-11  0.294E-05    1.99     680.6  T

   *** convergence criteria satisfied after 3 iterations ***

         #    Occupation            Energy/Eh            Energy/eV
      -------------------------------------------------------------
         1        2.0000           -0.7253651             -19.7382
       ...           ...                  ...                  ...
        34        2.0000           -0.4563679             -12.4184
        35        2.0000           -0.4497585             -12.2386
        36        2.0000           -0.4488647             -12.2142
        37        2.0000           -0.4390518             -11.9472
        38        2.0000           -0.4327990             -11.7771
        39        2.0000           -0.4245045             -11.5514
        40        2.0000           -0.4105714             -11.1722 (HOMO)
        41                         -0.3372806              -9.1779 (LUMO)
        42                         -0.3166925              -8.6176
        43                         -0.2561846              -6.9711
        44                         -0.2505427              -6.8176
        45                         -0.2284891              -6.2175
       ...                                ...                  ...
        76                          1.1537262              31.3945
      -------------------------------------------------------------
                  HL-Gap            0.0732908 Eh            1.9943 eV
             Fermi-level           -0.3739260 Eh          -10.1750 eV

 SCC (total)                   0 d,  0 h,  0 min,  0.032 sec
 SCC setup                      ...        0 min,  0.000 sec (  0.635%)
 Dispersion                     ...        0 min,  0.000 sec (  0.804%)
 integral evaluation            ...        0 min,  0.011 sec ( 33.355%)
 zeroth order Hamiltonian       ...        0 min,  0.000 sec (  0.533%)
 iterations                     ...        0 min,  0.004 sec ( 13.626%)
 molecular gradient             ...        0 min,  0.016 sec ( 49.882%)
 printout                       ...        0 min,  0.000 sec (  0.991%)

         :::::::::::::::::::::::::::::::::::::::::::::::::::::
         ::                     SUMMARY                     ::
         :::::::::::::::::::::::::::::::::::::::::::::::::::::
         :: total energy             -43.848469657614 Eh    ::
         :: gradient norm              0.000493965796 Eh/a0 ::
         :: HOMO-LUMO gap              1.994343975325 eV    ::
         ::.................................................::
         :: SCC energy               -44.670686228330 Eh    ::
         :: -> isotropic ES            0.041570801547 Eh    ::
         :: -> anisotropic ES          0.001713935064 Eh    ::
         :: -> anisotropic XC          0.048209911679 Eh    ::
         :: -> dispersion             -0.028203471443 Eh    ::
         :: repulsion energy           0.822161986813 Eh    ::
         :: add. restraining           0.000000000000 Eh    ::
         :::::::::::::::::::::::::::::::::::::::::::::::::::::

           -------------------------------------------------
          |                Property Printout                |
           -------------------------------------------------

    * Orbital Energies and Occupations

         #    Occupation            Energy/Eh            Energy/eV
      -------------------------------------------------------------
         1        2.0000           -0.7253651             -19.7382
       ...           ...                  ...                  ...
        28        2.0000           -0.5014930             -13.6463
        29        2.0000           -0.4938214             -13.4376
        30        2.0000           -0.4842889             -13.1782
        31        2.0000           -0.4838242             -13.1655
        32        2.0000           -0.4811740             -13.0934
        33        2.0000           -0.4726163             -12.8605
        34        2.0000           -0.4563679             -12.4184
        35        2.0000           -0.4497585             -12.2386
        36        2.0000           -0.4488647             -12.2142
        37        2.0000           -0.4390518             -11.9472
        38        2.0000           -0.4327990             -11.7771
        39        2.0000           -0.4245045             -11.5514
        40        2.0000           -0.4105714             -11.1722 (HOMO)
        41                         -0.3372806              -9.1779 (LUMO)
        42                         -0.3166925              -8.6176
        43                         -0.2561846              -6.9711
        44                         -0.2505427              -6.8176
        45                         -0.2284891              -6.2175
        46                         -0.2262531              -6.1567
        47                         -0.2053298              -5.5873
        48                         -0.1744969              -4.7483
        49                         -0.1191441              -3.2421
        50                         -0.0952064              -2.5907
        51                          0.0416304               1.1328
       ...                                ...                  ...
        76                          1.1537262              31.3945
      -------------------------------------------------------------
                  HL-Gap            0.0732908 Eh            1.9943 eV
             Fermi-level           -0.3739260 Eh          -10.1750 eV

     #   Z        covCN         q      C6AA      α(0)
     1   6 C      3.007     0.034    27.219     8.558
     2   6 C      2.947     0.015    27.678     8.629
     3   6 C      1.938     0.125    28.024     8.549
     4   7 N      0.911    -0.221    25.829     7.350
     5   6 C      1.938     0.125    28.010     8.547
     6   7 N      0.911    -0.224    25.894     7.360
     7   6 C      3.028     0.008    27.819     8.651
     8   6 C      3.035    -0.020    28.480     8.753
     9   6 C      2.911    -0.014    28.359     8.732
    10   6 C      2.925    -0.030    28.740     8.792
    11   6 C      2.966     0.034    27.227     8.559
    12   6 C      2.919    -0.037    28.909     8.817
    13   6 C      3.759    -0.116    22.777     6.804
    14   6 C      2.863     0.228    23.223     7.899
    15   8 O      0.856    -0.349    20.697     6.100
    16   6 C      2.996    -0.014    28.358     8.735
    17   6 C      2.840    -0.055    29.351     8.879
    18   1 H      0.926     0.063     2.167     2.302
    19   1 H      0.926     0.051     2.306     2.375
    20   1 H      0.926     0.058     2.227     2.334
    21   1 H      0.925     0.052     2.290     2.366
    22   1 H      0.925     0.063     2.166     2.302
    23   1 H      0.925     0.063     2.166     2.301
    24   1 H      0.926     0.087     1.908     2.160
    25   1 H      0.926     0.074     2.040     2.233

 Mol. C6AA /au·bohr⁶  :       9924.435472
 Mol. C8AA /au·bohr⁸  :     252570.537879
 Mol. α(0) /au        :        158.086691


Wiberg/Mayer (AO) data.
largest (>0.10) Wiberg bond orders for each atom
          total WBO             WBO to atom ...
     1  C   3.983        C    2 1.535    C    7 1.098    C   16 1.082
     2  C   3.986        C    1 1.535    C    5 1.089    C    3 1.087
     3  C   3.948        N    4 2.778    C    2 1.087
     4  N   2.985        C    3 2.778
     5  C   3.947        N    6 2.776    C    2 1.089
     6  N   2.985        C    5 2.776
     7  C   3.988        C   12 1.407    C    8 1.277    C    1 1.098
     8  C   3.980        C    9 1.410    C    7 1.277    C   14 1.037
     9  C   3.987        C   10 1.436    C    8 1.410    H   18 0.966
    10  C   3.970        C    9 1.436    C   11 1.396    H   19 0.967
    11  C   3.979        C   12 1.396    C   10 1.396    C   13 1.034
    12  C   3.980        C    7 1.407    C   11 1.396    H   20 0.960
    13  C   3.992        C   11 1.034    H   21 0.985    H   23 0.966    H   22 0.966
    14  C   3.930        O   15 1.805    C    8 1.037    C   16 0.985
    15  O   2.077        C   14 1.805
    16  C   3.987        C   17 1.806    C    1 1.082    C   14 0.985
    17  C   3.943        C   16 1.806    H   24 0.967    H   25 0.966
    18  H   0.995        C    9 0.966
    19  H   0.997        C   10 0.967
    20  H   0.996        C   12 0.960
    21  H   0.997        C   13 0.985
    22  H   0.994        C   13 0.966
    23  H   0.994        C   13 0.966
    24  H   0.992        C   17 0.967
    25  H   0.994        C   17 0.966

molecular dipole:
                 x           y           z       tot (Debye)
 q only:        1.379       0.834      -0.007
   full:        1.471       1.192      -0.009       4.812
molecular quadrupole (traceless):
                xx          xy          yy          xz          yz          zz
 q only:       11.580       1.646     -18.868       0.013       0.025       7.289
  q+dip:       13.460       1.651     -21.553       0.018       0.042       8.093
   full:        9.627       1.550     -24.542       0.020       0.038      14.916

           -------------------------------------------------
          |                Geometry Summary                 |
           -------------------------------------------------

      molecular mass/u    :      220.2300000
   center of mass at/Å    :       -0.4057104      -0.9421072       0.0011242
  moments of inertia/u·Å² :        0.7677224E+03   0.1160881E+04   0.1925492E+04
rotational constants/cm⁻¹ :        0.2195798E-01   0.1452142E-01   0.8754972E-02

 * 19 selected distances

     #   Z        #   Z                                     value/Å
     1   6 C      2   6 C                                 1.3636583
     3   6 C      4   7 N                                 1.1470841
     5   6 C      6   7 N                                 1.1472402
     7   6 C      8   6 C                                 1.4095404 (max)
     8   6 C      9   6 C                                 1.3825024
     9   6 C     10   6 C                                 1.3855711
    10   6 C     11   6 C                                 1.3938403
     7   6 C     12   6 C                                 1.3853744
    11   6 C     12   6 C                                 1.3944015
    14   6 C     15   8 O                                 1.2078726
    16   6 C     17   6 C                                 1.3341675
     9   6 C     18   1 H                                 1.0791034
    10   6 C     19   1 H                                 1.0801291
    12   6 C     20   1 H                                 1.0783786
    13   6 C     21   1 H                                 1.0864495
    13   6 C     22   1 H                                 1.0890967
    13   6 C     23   1 H                                 1.0890746
    17   6 C     24   1 H                                 1.0788238
    17   6 C     25   1 H                                 1.0755624 (min)

 * 4 distinct bonds (by element types)

   Z      Z             #   av. dist./Å        max./Å        min./Å
   1 H    6 C           8     1.0820773     1.0890967     1.0755624
   6 C    6 C           8     1.3811320     1.4095404     1.3341675
   6 C    7 N           2     1.1471621     1.1472402     1.1470841
   6 C    8 O           1     1.2078726     1.2078726     1.2078726


optimized geometry written to: xtbopt.xyz


           -------------------------------------------------
          | TOTAL ENERGY              -43.848469657614 Eh   |
          | GRADIENT NORM               0.000493965796 Eh/α |
          | HOMO-LUMO GAP               1.994343975325 eV   |
           -------------------------------------------------

------------------------------------------------------------------------
 * finished run on 2021/02/19 at 08:09:22.406     
------------------------------------------------------------------------
 total:
 * wall-time:     0 d,  0 h,  0 min,  0.510 sec
 *  cpu-time:     0 d,  0 h,  0 min,  0.509 sec
 * ratio c/w:     0.999 speedup
 SCF:
 * wall-time:     0 d,  0 h,  0 min,  0.045 sec
 *  cpu-time:     0 d,  0 h,  0 min,  0.045 sec
 * ratio c/w:     1.000 speedup
 ANC optimizer:
 * wall-time:     0 d,  0 h,  0 min,  0.442 sec
 *  cpu-time:     0 d,  0 h,  0 min,  0.442 sec
 * ratio c/w:     1.000 speedup


