      -----------------------------------------------------------      
     |                   =====================                   |     
     |                           x T B                           |     
     |                   =====================                   |     
     |                         S. Grimme                         |     
     |          Mulliken Center for Theoretical Chemistry        |     
     |                    University of Bonn                     |     
     |                Version 6.2 RC2 (SAW190805)                |     
      -----------------------------------------------------------      

   This program is distributed in the hope that it will be useful,
   but WITHOUT ANY WARRANTY; without even the implied warranty of
   MERCHANTABILITY or FITNESS FOR A PARTICULAR PURPOSE.
   
   FOR NON-COMMERCIAL, ACADEMIA USE ONLY.
   
   Cite this work as:
   * S. Grimme, C. Bannwarth, P. Shushkov, J. Chem. Theory Comput., 2017,
     13, 1989-2009. DOI: 10.1021/acs.jctc.7b00118
   * C. Bannwarth, S. Ehlert and S. Grimme., J. Chem. Theory Comput., 2019,
     15, 1652-1671. DOI: 10.1021/acs.jctc.8b01176
   * P. Pracht, E. Caldeweyher, S. Ehlert, S. Grimme, ChemRxiv, 2019, preprint.
     DOI: 10.26434/chemrxiv.8326202.v1
   
   for DFT-D4:
   * E. Caldeweyher, C. Bannwarth and S. Grimme, J. Chem. Phys., 2017,
     147, 034112. DOI: 10.1063/1.4993215
   * E. Caldeweyher, S. Ehlert, A. Hansen, H. Neugebauer, S. Spicher,
     C. Bannwarth and S. Grimme, J. Chem. Phys., 2019, 150, 154122.
     DOI: 10.1063/1.5090222
   
   for sTDA-xTB:
   * S. Grimme and C. Bannwarth, J. Chem. Phys., 2016, 145, 054103.
     DOI: 10.1063/1.4959605
   
   in the mass-spec context:
   * V. Asgeirsson, C. Bauer and S. Grimme, Chem. Sci., 2017, 8, 4879.
     DOI: 10.1039/c7sc00601b
   
   for metadynamics refer to:
   * S. Grimme, J. Chem. Theory Comput., 2019, 155, 2847-2862
     DOI: 10.1021/acs.jctc.9b00143
   
   with help from (in alphabetical order)
   C. Bannwarth, F. Bohle, G. Brandenburg, E. Caldeweyher, M. Checinski,
   S. Dohm, S. Ehlert, S. Ehrlich, F. März, H. Neugebauer, J. Pisarek,
   P. Pracht, P. Shushkov, and S. Spicher.
   
 * started run on 2021/02/19 at 08:09:36.010     

           -------------------------------------------------
          |                Calculation Setup                |
           -------------------------------------------------

          program call               : /ihome/ghutchison/geoffh/xtb/xtb 17utl.xyz -opt
          hostname                   : smp-n61
          coordinate file            : 17utl.xyz
          omp threads                :                     1
          number of atoms            :                    21
          number of electrons        :                    68
          charge                     :                     0
          spin                       :                   0.0
          first test random number   :      0.92361566494560


########################################################################
# WARNING! Please study the warnings concerning your input carefully
#  - the use of '-opt' is discouraged, please use '--opt' next time
########################################################################

           ------------------------------------------------- 
          |                 G F N 2 - x T B                 |
          | Geometry, Frequencies, Noncovalent interactions |
          |            JCTC 2019 parametrisation            |
           ------------------------------------------------- 
             KAB for C  - Si     :                1.0500
             KAB for H  - Pd     :                0.9500
             k(s)              :                1.8500
             k(p)              :                2.2300
             k(d)              :                2.2300
             k(f)              :                2.0000
             kEN (H0ij)        :               -2.0000
             D4 a1             :                0.5200
             D4 a2             :                5.0000
             D4 s6             :                1.0000
             D4 s8             :                2.7000
             D4 s9             :                5.0000
             alphaj            :                2.0000

  Z AO/shell   Hii/eV     exponent
  1     Wed Apr 25 08:07:45 CEST 2018   EN: 2.200 GM2: 0.406  GM3: 0.0800  RAES: 1.40
     1s    -10.707211    1.230000
  6     Wed Apr 25 08:07:45 CEST 2018   EN: 2.550 GM2: 0.538  GM3: 0.1500  RAES: 3.00
     2s    -13.970922    2.096432
     2p    -10.063292    1.800000
  7     Wed Apr 25 08:07:45 CEST 2018   EN: 3.040 GM2: 0.461  GM3:-0.0640  RAES: 1.90
     2s    -16.686243    2.339881
     2p    -12.523956    2.014332
 16     Tue Apr 24 11:44:34 CEST 2018   EN: 2.580 GM2: 0.340  GM3:-0.0502  RAES: 3.10
     3s    -20.029654    1.981333
     3p    -11.377694    2.025643
     3d     -0.420282    1.702555

           ------------------------------------------------- 
          |        Self-Consistent Charge Iterations        |
           ------------------------------------------------- 

          ...................................................
          :                      SETUP                      :
          :.................................................:
          :  # basis functions                  69          :
          :  # atomic orbitals                  68          :
          :  # shells                           36          :
          :  # electrons                        68          :
          :  max. iterations                   250          :
          :  Hamiltonian                  GFN2-xTB          :
          :  restarted?                      false          :
          :  GBSA solvation                  false          :
          :  PC potential                    false          :
          :  electronic temp.          300.0000000     K    :
          :  accuracy                    1.0000000          :
          :  -> integral cutoff          0.2500000E+02      :
          :  -> integral neglect         0.1000000E-07      :
          :  -> SCF convergence          0.1000000E-05 Eh   :
          :  -> wf. convergence          0.1000000E-03 e    :
          :  Broyden damping             0.4000000          :
          ...................................................

 iter      E             dE          RMSdq      gap      omega  full diag
   1    -37.2585153 -0.372585E+02  0.680E+00    2.41       0.0  T
   2    -37.1739082  0.846071E-01  0.502E+00    2.12       1.0  T
   3    -37.1988315 -0.249232E-01  0.360E+00    2.01       1.0  T
   4    -37.3658448 -0.167013E+00  0.137E+00    1.87       1.0  T
   5    -37.3925489 -0.267041E-01  0.517E-01    1.91       1.0  T
   6    -37.3941921 -0.164327E-02  0.184E-01    1.94       1.0  T
   7    -37.3945560 -0.363849E-03  0.982E-02    1.94       1.0  T
   8    -37.3946297 -0.737123E-04  0.478E-02    1.94       1.0  T
   9    -37.3946446 -0.148829E-04  0.232E-02    1.94       1.0  T
  10    -37.3946467 -0.210810E-05  0.992E-03    1.94       2.2  T
  11    -37.3946474 -0.702269E-06  0.594E-03    1.94       3.7  T
  12    -37.3946477 -0.268239E-06  0.261E-03    1.94       8.4  T
  13    -37.3946477 -0.180151E-07  0.107E-03    1.94      20.4  T
  14    -37.3946477 -0.128220E-07  0.421E-04    1.94      51.8  T
  15    -37.3946477 -0.213607E-08  0.225E-04    1.94      97.2  T

   *** convergence criteria satisfied after 15 iterations ***

         #    Occupation            Energy/Eh            Energy/eV
      -------------------------------------------------------------
         1        2.0000           -0.7633170             -20.7709
       ...           ...                  ...                  ...
        28        2.0000           -0.4782652             -13.0143
        29        2.0000           -0.4739955             -12.8981
        30        2.0000           -0.4532009             -12.3322
        31        2.0000           -0.4508868             -12.2693
        32        2.0000           -0.4471482             -12.1675
        33        2.0000           -0.4393094             -11.9542
        34        2.0000           -0.4087829             -11.1235 (HOMO)
        35                         -0.3375844              -9.1861 (LUMO)
        36                         -0.2943509              -8.0097
        37                         -0.2794646              -7.6046
        38                         -0.2546650              -6.9298
        39                         -0.2520349              -6.8582
       ...                                ...                  ...
        68                          1.0797998              29.3828
      -------------------------------------------------------------
                  HL-Gap            0.0711985 Eh            1.9374 eV
             Fermi-level           -0.3731837 Eh          -10.1548 eV

 SCC (total)                   0 d,  0 h,  0 min,  0.039 sec
 SCC setup                      ...        0 min,  0.000 sec (  0.675%)
 Dispersion                     ...        0 min,  0.000 sec (  0.732%)
 integral evaluation            ...        0 min,  0.009 sec ( 22.899%)
 zeroth order Hamiltonian       ...        0 min,  0.000 sec (  0.433%)
 iterations                     ...        0 min,  0.016 sec ( 40.907%)
 molecular gradient             ...        0 min,  0.013 sec ( 33.393%)
 printout                       ...        0 min,  0.000 sec (  0.838%)

         :::::::::::::::::::::::::::::::::::::::::::::::::::::
         ::                     SUMMARY                     ::
         :::::::::::::::::::::::::::::::::::::::::::::::::::::
         :: total energy             -36.813529842372 Eh    ::
         :: gradient norm              0.257645982394 Eh/a0 ::
         :: HOMO-LUMO gap              1.937409459174 eV    ::
         ::.................................................::
         :: SCC energy               -37.394647695921 Eh    ::
         :: -> isotropic ES            0.025219676673 Eh    ::
         :: -> anisotropic ES          0.009059593141 Eh    ::
         :: -> anisotropic XC          0.062774055420 Eh    ::
         :: -> dispersion             -0.023086091524 Eh    ::
         :: repulsion energy           0.580981691614 Eh    ::
         :: add. restraining           0.000000000000 Eh    ::
         :::::::::::::::::::::::::::::::::::::::::::::::::::::

      ----------------------------------------------------------- 
     |                   =====================                   |
     |                        A N C O P T                        |
     |                   =====================                   |
     |               Approximate Normal Coordinate               |
     |                Rational Function Optimizer                |
      ----------------------------------------------------------- 

          ...................................................
          :                      SETUP                      :
          :.................................................:
          :   optimization level            normal          :
          :   max. optcycles                   200          :
          :   ANC micro-cycles                  20          :
          :   degrees of freedom                57          :
          :.................................................:
          :   RF solver                   davidson          :
          :   input Hessian                  false          :
          :   write xtbopt.log                true          :
          :   linear?                        false          :
          :   energy convergence         0.5000000E-05 Eh   :
          :   grad. convergence          0.1000000E-02 Eh/α :
          :   maximium RF displ.         2.0000000          :
          :   Hlow (freq-cutoff)         0.5000000E-02      :
          :   Hmax (freq-cutoff)         5.0000000          :
          :   S6 in model hess.         20.0000000          :
          ...................................................

generating ANC from model Hessian ...
Using Lindh-Hessian (1995)
 Shifting diagonal of input Hessian by   4.388019905738250E-003
 Lowest  eigenvalues of input Hessian
   -0.000000   -0.000000   -0.000000    0.000000    0.000000    0.000000
    0.005000    0.005341    0.005627    0.007083    0.008476    0.009995
    0.010457    0.012823    0.012978    0.014386    0.018135    0.020314
 Highest eigenvalues
    1.541868    1.673515    1.874644    2.020815    2.542432    2.550559
 

........................................................................
.............................. CYCLE    1 ..............................
........................................................................
   1    -37.3946477 -0.373946E+02  0.540E-05    1.94       0.0  T
   2    -37.3946477 -0.495248E-11  0.348E-05    1.94     626.7  T
   3    -37.3946477 -0.497380E-12  0.247E-05    1.94     885.1  T
     SCC iter.                  ...        0 min,  0.004 sec
     gradient                   ...        0 min,  0.013 sec
 * total energy  :   -36.8135298 Eh     change        0.9222632E-09 Eh
   gradient norm :     0.2576462 Eh/α   predicted     0.0000000E+00 (-100.00%)
   displ. norm   :     0.3287831 α      lambda       -0.5648434E-01
   maximum displ.:     0.1330497 α      in ANC's #24, #37, #44, ...

........................................................................
.............................. CYCLE    2 ..............................
........................................................................
   1    -37.5174297 -0.375174E+02  0.518E-01    1.97       0.0  T
   2    -37.5176235 -0.193764E-03  0.314E-01    2.00       1.0  T
   3    -37.5172137  0.409823E-03  0.242E-01    1.99       1.0  T
   4    -37.5179612 -0.747563E-03  0.495E-02    1.99       1.0  T
   5    -37.5180039 -0.426813E-04  0.190E-02    1.99       1.1  T
   6    -37.5180078 -0.393658E-05  0.101E-02    1.99       2.2  T
   7    -37.5180089 -0.110504E-05  0.426E-03    1.99       5.1  T
   8    -37.5180090 -0.750495E-07  0.211E-03    1.99      10.3  T
     SCC iter.                  ...        0 min,  0.008 sec
     gradient                   ...        0 min,  0.012 sec
 * total energy  :   -36.8468233 Eh     change       -0.3329351E-01 Eh
   gradient norm :     0.0461176 Eh/α   predicted    -0.3129511E-01 (  -6.00%)
   displ. norm   :     0.2603949 α      lambda       -0.4085930E-02
   maximum displ.:     0.0937408 α      in ANC's #15, #3, #13, ...

........................................................................
.............................. CYCLE    3 ..............................
........................................................................
   1    -37.5314271 -0.375314E+02  0.288E-01    1.97       0.0  T
   2    -37.5314671 -0.399816E-04  0.160E-01    1.97       1.0  T
   3    -37.5313552  0.111956E-03  0.110E-01    1.99       1.0  T
   4    -37.5315362 -0.181043E-03  0.258E-02    1.98       1.0  T
   5    -37.5315385 -0.230449E-05  0.143E-02    1.98       1.5  T
   6    -37.5315410 -0.253066E-05  0.477E-03    1.98       4.6  T
   7    -37.5315412 -0.188678E-06  0.178E-03    1.98      12.3  T
     SCC iter.                  ...        0 min,  0.007 sec
     gradient                   ...        0 min,  0.012 sec
 * total energy  :   -36.8494494 Eh     change       -0.2626100E-02 Eh
   gradient norm :     0.0191241 Eh/α   predicted    -0.2181492E-02 ( -16.93%)
   displ. norm   :     0.3252993 α      lambda       -0.1608300E-02
   maximum displ.:     0.1550023 α      in ANC's #2, #5, #4, ...

........................................................................
.............................. CYCLE    4 ..............................
........................................................................
   1    -37.5321148 -0.375321E+02  0.398E-01    1.95       0.0  T
   2    -37.5321727 -0.578727E-04  0.219E-01    1.96       1.0  T
   3    -37.5319629  0.209710E-03  0.131E-01    1.98       1.0  T
   4    -37.5322246 -0.261664E-03  0.249E-02    1.96       1.0  T
   5    -37.5322288 -0.416081E-05  0.121E-02    1.97       1.8  T
   6    -37.5322302 -0.144625E-05  0.483E-03    1.97       4.5  T
   7    -37.5322305 -0.245976E-06  0.182E-03    1.97      12.0  T
   8    -37.5322305 -0.137642E-07  0.994E-04    1.97      21.9  T
     SCC iter.                  ...        0 min,  0.008 sec
     gradient                   ...        0 min,  0.012 sec
 * total energy  :   -36.8497294 Eh     change       -0.2799824E-03 Eh
   gradient norm :     0.0207299 Eh/α   predicted    -0.8892465E-03 ( 217.61%)
   displ. norm   :     0.2927193 α      lambda       -0.1710006E-02
   maximum displ.:     0.1865824 α      in ANC's #3, #6, #7, ...

........................................................................
.............................. CYCLE    5 ..............................
........................................................................
   1    -37.5337734 -0.375338E+02  0.365E-01    1.95       0.0  T
   2    -37.5338020 -0.286158E-04  0.201E-01    1.96       1.0  T
   3    -37.5336481  0.153988E-03  0.873E-02    1.96       1.0  T
   4    -37.5338260 -0.177943E-03  0.139E-02    1.96       1.6  T
   5    -37.5338280 -0.202165E-05  0.647E-03    1.96       3.4  T
   6    -37.5338282 -0.177932E-06  0.293E-03    1.96       7.4  T
   7    -37.5338283 -0.104958E-06  0.105E-03    1.96      20.8  T
     SCC iter.                  ...        0 min,  0.007 sec
     gradient                   ...        0 min,  0.012 sec
 * total energy  :   -36.8503749 Eh     change       -0.6455025E-03 Eh
   gradient norm :     0.0228483 Eh/α   predicted    -0.9282755E-03 (  43.81%)
   displ. norm   :     0.2215220 α      lambda       -0.1007943E-02
   maximum displ.:     0.1167337 α      in ANC's #2, #3, #5, ...

........................................................................
.............................. CYCLE    6 ..............................
........................................................................
   1    -37.5321055 -0.375321E+02  0.365E-01    1.96       0.0  T
   2    -37.5321347 -0.291870E-04  0.204E-01    1.96       1.0  T
   3    -37.5318985  0.236188E-03  0.115E-01    1.96       1.0  T
   4    -37.5321742 -0.275699E-03  0.120E-02    1.96       1.8  T
   5    -37.5321751 -0.864373E-06  0.853E-03    1.96       2.6  T
   6    -37.5321763 -0.117635E-05  0.198E-03    1.96      11.0  T
   7    -37.5321763 -0.148338E-07  0.880E-04    1.96      24.8  T
     SCC iter.                  ...        0 min,  0.007 sec
     gradient                   ...        0 min,  0.012 sec
 * total energy  :   -36.8505441 Eh     change       -0.1691796E-03 Eh
   gradient norm :     0.0129766 Eh/α   predicted    -0.5287045E-03 ( 212.51%)
   displ. norm   :     0.1849233 α      lambda       -0.9036441E-03
   maximum displ.:     0.1053330 α      in ANC's #5, #2, #3, ...

........................................................................
.............................. CYCLE    7 ..............................
........................................................................
   1    -37.5354891 -0.375355E+02  0.245E-01    1.98       0.0  T
   2    -37.5355028 -0.137299E-04  0.134E-01    1.98       1.0  T
   3    -37.5354786  0.242153E-04  0.393E-02    1.98       1.0  T
   4    -37.5355102 -0.315859E-04  0.823E-03    1.98       2.7  T
   5    -37.5355105 -0.270387E-06  0.429E-03    1.98       5.1  T
   6    -37.5355106 -0.172648E-06  0.193E-03    1.98      11.3  T
   7    -37.5355107 -0.474920E-07  0.750E-04    1.98      29.1  T
     SCC iter.                  ...        0 min,  0.007 sec
     gradient                   ...        0 min,  0.012 sec
 * total energy  :   -36.8510111 Eh     change       -0.4669637E-03 Eh
   gradient norm :     0.0159130 Eh/α   predicted    -0.4672794E-03 (   0.07%)
   displ. norm   :     0.2820431 α      lambda       -0.4958708E-03
   maximum displ.:     0.1959380 α      in ANC's #3, #2, #4, ...

........................................................................
.............................. CYCLE    8 ..............................
........................................................................
   1    -37.5309374 -0.375309E+02  0.222E-01    1.97       0.0  T
   2    -37.5309522 -0.147147E-04  0.119E-01    1.97       1.0  T
   3    -37.5309195  0.326347E-04  0.484E-02    1.98       1.0  T
   4    -37.5309587 -0.391814E-04  0.136E-02    1.98       1.6  T
   5    -37.5309592 -0.500683E-06  0.803E-03    1.98       2.7  T
   6    -37.5309602 -0.103320E-05  0.202E-03    1.98      10.8  T
   7    -37.5309603 -0.337504E-07  0.753E-04    1.98      29.0  T
     SCC iter.                  ...        0 min,  0.007 sec
     gradient                   ...        0 min,  0.012 sec
 * total energy  :   -36.8511829 Eh     change       -0.1718021E-03 Eh
   gradient norm :     0.0094680 Eh/α   predicted    -0.2676607E-03 (  55.80%)
   displ. norm   :     0.3907603 α      lambda       -0.7464521E-03
   maximum displ.:     0.2678351 α      in ANC's #2, #3, #5, ...

........................................................................
.............................. CYCLE    9 ..............................
........................................................................
   1    -37.5275133 -0.375275E+02  0.339E-01    1.97       0.0  T
   2    -37.5275450 -0.316682E-04  0.179E-01    1.97       1.0  T
   3    -37.5275186  0.263730E-04  0.525E-02    1.98       1.0  T
   4    -37.5275563 -0.377105E-04  0.197E-02    1.97       1.1  T
   5    -37.5275580 -0.167034E-05  0.729E-03    1.97       3.0  T
   6    -37.5275586 -0.639897E-06  0.282E-03    1.97       7.7  T
   7    -37.5275587 -0.769587E-07  0.120E-03    1.97      18.2  T
     SCC iter.                  ...        0 min,  0.007 sec
     gradient                   ...        0 min,  0.012 sec
 * total energy  :   -36.8514865 Eh     change       -0.3036580E-03 Eh
   gradient norm :     0.0201644 Eh/α   predicted    -0.4302164E-03 (  41.68%)
   displ. norm   :     0.2309625 α      lambda       -0.5291430E-03
   maximum displ.:     0.1438462 α      in ANC's #3, #2, #7, ...

........................................................................
.............................. CYCLE   10 ..............................
........................................................................
   1    -37.5321001 -0.375321E+02  0.197E-01    1.98       0.0  T
   2    -37.5321108 -0.106894E-04  0.103E-01    1.98       1.0  T
   3    -37.5320953  0.154929E-04  0.345E-02    1.98       1.0  T
   4    -37.5321148 -0.195091E-04  0.124E-02    1.98       1.8  T
   5    -37.5321153 -0.522055E-06  0.587E-03    1.98       3.7  T
   6    -37.5321159 -0.608884E-06  0.170E-03    1.98      12.9  T
     SCC iter.                  ...        0 min,  0.006 sec
     gradient                   ...        0 min,  0.012 sec
 * total energy  :   -36.8518518 Eh     change       -0.3652143E-03 Eh
   gradient norm :     0.0069888 Eh/α   predicted    -0.2786863E-03 ( -23.69%)
   displ. norm   :     0.3870404 α      lambda       -0.3944481E-03
   maximum displ.:     0.2778278 α      in ANC's #3, #2, #7, ...

........................................................................
.............................. CYCLE   11 ..............................
........................................................................
   1    -37.5322756 -0.375323E+02  0.294E-01    1.98       0.0  T
   2    -37.5322975 -0.219598E-04  0.154E-01    1.98       1.0  T
   3    -37.5322853  0.122727E-04  0.389E-02    1.98       1.0  T
   4    -37.5323034 -0.181727E-04  0.183E-02    1.98       1.2  T
   5    -37.5323055 -0.200978E-05  0.510E-03    1.98       4.3  T
   6    -37.5323059 -0.436488E-06  0.223E-03    1.98       9.8  T
   7    -37.5323060 -0.674729E-07  0.102E-03    1.98      21.4  T
     SCC iter.                  ...        0 min,  0.007 sec
     gradient                   ...        0 min,  0.012 sec
 * total energy  :   -36.8521216 Eh     change       -0.2698918E-03 Eh
   gradient norm :     0.0098015 Eh/α   predicted    -0.2267691E-03 ( -15.98%)
   displ. norm   :     0.4218515 α      lambda       -0.3215550E-03
   maximum displ.:     0.2927109 α      in ANC's #3, #2, #7, ...

........................................................................
.............................. CYCLE   12 ..............................
........................................................................
   1    -37.5341260 -0.375341E+02  0.307E-01    1.98       0.0  T
   2    -37.5341517 -0.257064E-04  0.156E-01    1.98       1.0  T
   3    -37.5341526 -0.860193E-06  0.293E-02    1.97       1.0  T
   4    -37.5341493  0.327493E-05  0.241E-02    1.98       1.0  T
   5    -37.5341587 -0.946338E-05  0.321E-03    1.97       6.8  T
   6    -37.5341589 -0.108835E-06  0.163E-03    1.97      13.4  T
   7    -37.5341589 -0.155033E-07  0.616E-04    1.97      35.4  T
     SCC iter.                  ...        0 min,  0.007 sec
     gradient                   ...        0 min,  0.012 sec
 * total energy  :   -36.8523253 Eh     change       -0.2036104E-03 Eh
   gradient norm :     0.0052734 Eh/α   predicted    -0.1893931E-03 (  -6.98%)
   displ. norm   :     0.3306033 α      lambda       -0.2051438E-03
   maximum displ.:     0.2387054 α      in ANC's #3, #2, #7, ...

........................................................................
.............................. CYCLE   13 ..............................
........................................................................
   1    -37.5338754 -0.375339E+02  0.247E-01    1.97       0.0  T
   2    -37.5338912 -0.157528E-04  0.130E-01    1.97       1.0  T
   3    -37.5338885  0.264428E-05  0.269E-02    1.97       1.0  T
   4    -37.5338952 -0.666447E-05  0.142E-02    1.97       1.5  T
   5    -37.5338965 -0.125714E-05  0.426E-03    1.97       5.1  T
   6    -37.5338968 -0.340418E-06  0.146E-03    1.97      15.0  T
   7    -37.5338968 -0.125384E-07  0.722E-04    1.97      30.2  T
     SCC iter.                  ...        0 min,  0.007 sec
     gradient                   ...        0 min,  0.012 sec
 * total energy  :   -36.8524567 Eh     change       -0.1314064E-03 Eh
   gradient norm :     0.0076296 Eh/α   predicted    -0.1137862E-03 ( -13.41%)
   displ. norm   :     0.2299978 α      lambda       -0.1414545E-03
   maximum displ.:     0.1549583 α      in ANC's #3, #2, #5, ...

........................................................................
.............................. CYCLE   14 ..............................
........................................................................
   1    -37.5365420 -0.375365E+02  0.176E-01    1.97       0.0  T
   2    -37.5365501 -0.808726E-05  0.917E-02    1.97       1.0  T
   3    -37.5365488  0.127137E-05  0.194E-02    1.97       1.1  T
   4    -37.5365520 -0.318499E-05  0.107E-02    1.97       2.0  T
   5    -37.5365528 -0.800863E-06  0.239E-03    1.97       9.1  T
   6    -37.5365529 -0.912256E-07  0.111E-03    1.97      19.7  T
     SCC iter.                  ...        0 min,  0.006 sec
     gradient                   ...        0 min,  0.012 sec
 * total energy  :   -36.8525490 Eh     change       -0.9237992E-04 Eh
   gradient norm :     0.0048013 Eh/α   predicted    -0.7446994E-04 ( -19.39%)
   displ. norm   :     0.4054373 α      lambda       -0.1223278E-03
   maximum displ.:     0.2964412 α      in ANC's #3, #2, #5, ...

........................................................................
.............................. CYCLE   15 ..............................
........................................................................
   1    -37.5309374 -0.375309E+02  0.302E-01    1.96       0.0  T
   2    -37.5309620 -0.246193E-04  0.155E-01    1.96       1.0  T
   3    -37.5309534  0.860704E-05  0.352E-02    1.97       1.0  T
   4    -37.5309646 -0.112080E-04  0.217E-02    1.96       1.0  T
   5    -37.5309699 -0.533522E-05  0.565E-03    1.96       3.9  T
   6    -37.5309703 -0.393641E-06  0.215E-03    1.96      10.2  T
   7    -37.5309704 -0.502842E-07  0.105E-03    1.96      20.8  T
     SCC iter.                  ...        0 min,  0.007 sec
     gradient                   ...        0 min,  0.012 sec
 * total energy  :   -36.8525563 Eh     change       -0.7301500E-05 Eh
   gradient norm :     0.0104349 Eh/α   predicted    -0.7121989E-04 ( 875.41%)
   displ. norm   :     0.1258960 α      lambda       -0.1357094E-03
   maximum displ.:     0.0838745 α      in ANC's #2, #3, #4, ...

........................................................................
.............................. CYCLE   16 ..............................
........................................................................
   1    -37.5356955 -0.375357E+02  0.884E-02    1.97       0.0  T
   2    -37.5356976 -0.211363E-05  0.459E-02    1.97       1.0  T
   3    -37.5356907  0.694231E-05  0.216E-02    1.97       1.0  T
   4    -37.5356990 -0.829460E-05  0.621E-03    1.97       3.5  T
   5    -37.5356990  0.124303E-07  0.362E-03    1.97       6.0  T
   6    -37.5356992 -0.225209E-06  0.776E-04    1.97      28.1  T
   7    -37.5356992 -0.635087E-08  0.364E-04    1.97      59.9  T
     SCC iter.                  ...        0 min,  0.007 sec
     gradient                   ...        0 min,  0.012 sec
 * total energy  :   -36.8526221 Eh     change       -0.6579727E-04 Eh
   gradient norm :     0.0041275 Eh/α   predicted    -0.6893346E-04 (   4.77%)
   displ. norm   :     0.0427665 α      lambda       -0.1918260E-04
   maximum displ.:     0.0287708 α      in ANC's #3, #8, #2, ...

........................................................................
.............................. CYCLE   17 ..............................
........................................................................
   1    -37.5358294 -0.375358E+02  0.331E-02    1.97       0.0  T
   2    -37.5358297 -0.282852E-06  0.183E-02    1.97       1.2  T
   3    -37.5358294  0.338560E-06  0.525E-03    1.97       4.2  T
   4    -37.5358298 -0.443745E-06  0.168E-03    1.97      13.0  T
   5    -37.5358299 -0.161838E-07  0.737E-04    1.97      29.6  T
     SCC iter.                  ...        0 min,  0.005 sec
     gradient                   ...        0 min,  0.012 sec
 * total energy  :   -36.8526361 Eh     change       -0.1398749E-04 Eh
   gradient norm :     0.0024342 Eh/α   predicted    -0.9610042E-05 ( -31.30%)
   displ. norm   :     0.1152845 α      lambda       -0.2661216E-04
   maximum displ.:     0.0830148 α      in ANC's #3, #2, #1, ...

........................................................................
.............................. CYCLE   18 ..............................
........................................................................
   1    -37.5355992 -0.375356E+02  0.905E-02    1.98       0.0  T
   2    -37.5356011 -0.198244E-05  0.488E-02    1.98       1.0  T
   3    -37.5356008  0.379966E-06  0.863E-03    1.98       2.5  T
   4    -37.5356016 -0.850274E-06  0.499E-03    1.98       4.4  T
   5    -37.5356019 -0.275002E-06  0.151E-03    1.98      14.4  T
   6    -37.5356019 -0.347398E-07  0.503E-04    1.98      43.4  T
   7    -37.5356019 -0.181932E-08  0.271E-04    1.98      80.5  T
     SCC iter.                  ...        0 min,  0.007 sec
     gradient                   ...        0 min,  0.013 sec
 * total energy  :   -36.8526532 Eh     change       -0.1707763E-04 Eh
   gradient norm :     0.0020891 Eh/α   predicted    -0.1348604E-04 ( -21.03%)
   displ. norm   :     0.0551410 α      lambda       -0.1181279E-04
   maximum displ.:     0.0328246 α      in ANC's #1, #3, #8, ...

........................................................................
.............................. CYCLE   19 ..............................
........................................................................
   1    -37.5354642 -0.375355E+02  0.463E-02    1.98       0.0  T
   2    -37.5354647 -0.486742E-06  0.256E-02    1.98       1.0  T
   3    -37.5354647  0.197175E-07  0.380E-03    1.98       5.7  T
   4    -37.5354649 -0.220425E-06  0.133E-03    1.98      16.4  T
   5    -37.5354649 -0.302925E-08  0.598E-04    1.98      36.5  T
   6    -37.5354649 -0.538076E-08  0.211E-04    1.98     103.3  T
     SCC iter.                  ...        0 min,  0.006 sec
     gradient                   ...        0 min,  0.013 sec
 * total energy  :   -36.8526615 Eh     change       -0.8281275E-05 Eh
   gradient norm :     0.0017379 Eh/α   predicted    -0.5926899E-05 ( -28.43%)
   displ. norm   :     0.1022798 α      lambda       -0.1275723E-04
   maximum displ.:     0.0742888 α      in ANC's #1, #3, #4, ...

........................................................................
.............................. CYCLE   20 ..............................
........................................................................
   1    -37.5356136 -0.375356E+02  0.864E-02    1.97       0.0  T
   2    -37.5356153 -0.167565E-05  0.480E-02    1.97       1.0  T
   3    -37.5356143  0.995148E-06  0.940E-03    1.98       2.3  T
   4    -37.5356161 -0.177442E-05  0.234E-03    1.97       9.3  T
   5    -37.5356161  0.100050E-07  0.147E-03    1.97      14.8  T
   6    -37.5356161 -0.366822E-07  0.295E-04    1.97      73.9  T
   7    -37.5356161 -0.110866E-09  0.181E-04    1.97     120.4  T
     SCC iter.                  ...        0 min,  0.007 sec
     gradient                   ...        0 min,  0.013 sec
 * total energy  :   -36.8526700 Eh     change       -0.8496300E-05 Eh
   gradient norm :     0.0017885 Eh/α   predicted    -0.6412699E-05 ( -24.52%)
   displ. norm   :     0.0497072 α      lambda       -0.7171392E-05
   maximum displ.:     0.0335163 α      in ANC's #3, #2, #7, ...
 * RMSD in coord.:     0.7631243 α      energy gain  -0.3914014E-01 Eh

generating ANC from model Hessian ...
Using Lindh-Hessian (1995)
 Shifting diagonal of input Hessian by   4.973724595142414E-003
 Lowest  eigenvalues of input Hessian
   -0.000000   -0.000000   -0.000000    0.000000    0.000000    0.000000
    0.005000    0.005149    0.005198    0.007023    0.010390    0.010714
    0.013768    0.013876    0.014216    0.015155    0.017823    0.018893
 Highest eigenvalues
    1.635986    1.742438    1.958479    2.597621    2.629881    2.667341
 

........................................................................
.............................. CYCLE   21 ..............................
........................................................................
   1    -37.5363106 -0.375363E+02  0.407E-02    1.97       0.0  T
   2    -37.5363110 -0.385598E-06  0.212E-02    1.97       1.0  T
   3    -37.5363092  0.179479E-05  0.101E-02    1.97       2.2  T
   4    -37.5363113 -0.207844E-05  0.275E-03    1.97       7.9  T
   5    -37.5363113 -0.304071E-07  0.127E-03    1.97      17.2  T
   6    -37.5363113 -0.215999E-07  0.356E-04    1.97      61.3  T
   7    -37.5363113 -0.129679E-08  0.142E-04    1.97     153.9  T
     SCC iter.                  ...        0 min,  0.007 sec
     gradient                   ...        0 min,  0.013 sec
 * total energy  :   -36.8526743 Eh     change       -0.4306903E-05 Eh
   gradient norm :     0.0024278 Eh/α   predicted     0.0000000E+00 (-100.00%)
   displ. norm   :     0.0166974 α      lambda       -0.7298228E-05
   maximum displ.:     0.0078997 α      in ANC's #3, #1, #12, ...

........................................................................
.............................. CYCLE   22 ..............................
........................................................................
   1    -37.5358207 -0.375358E+02  0.217E-02    1.97       0.0  T
   2    -37.5358208 -0.139513E-06  0.116E-02    1.97       1.9  T
   3    -37.5358208  0.582187E-08  0.234E-03    1.97       9.3  T
   4    -37.5358209 -0.388956E-07  0.121E-03    1.97      18.0  T
   5    -37.5358209 -0.103521E-07  0.383E-04    1.97      57.0  T
   6    -37.5358209 -0.167928E-08  0.162E-04    1.97     134.5  T
     SCC iter.                  ...        0 min,  0.006 sec
     gradient                   ...        0 min,  0.013 sec
 * total energy  :   -36.8526767 Eh     change       -0.2367375E-05 Eh
   gradient norm :     0.0008071 Eh/α   predicted    -0.3650965E-05 (  54.22%)
   displ. norm   :     0.0688063 α      lambda       -0.1427974E-04
   maximum displ.:     0.0524128 α      in ANC's #2, #1, #6, ...

   *** GEOMETRY OPTIMIZATION CONVERGED AFTER 22 ITERATIONS ***

------------------------------------------------------------------------
 total energy gain   :        -0.0391468 Eh      -24.5650 kcal/mol
 total RMSD          :         0.7642216 a0        0.4044 Å
 total power (kW/mol):        -4.6718156 (step) -159.1095 (real)
------------------------------------------------------------------------

 ANCopt (total)                0 d,  0 h,  0 min,  0.646 sec
 optimizer setup                ...        0 min,  0.000 sec (  0.020%)
 model hessian                  ...        0 min,  0.010 sec (  1.485%)
 ANC generation                 ...        0 min,  0.001 sec (  0.172%)
 coordinate transformation      ...        0 min,  0.000 sec (  0.046%)
 single point calculation       ...        0 min,  0.626 sec ( 96.831%)
 optimization log               ...        0 min,  0.002 sec (  0.282%)
 hessian update                 ...        0 min,  0.000 sec (  0.049%)
 rational function              ...        0 min,  0.006 sec (  0.899%)

================
 final structure:
================
$coord
   -3.03784701337082   -0.14045997521595    0.80828176314480      S 
   -0.63887522155037   -2.69786391917719    0.56479153990528      C 
   -0.73197685992047   -4.30765047196786    2.95835874127137      C 
   -1.18614488357547   -4.28212766941201   -1.78507850749922      C 
    1.80959868284428   -1.33420359951320    0.33557025102790      C 
    1.72187569304765    1.20393566395534    0.35505502040418      C 
   -0.80158146347636    2.25696467661838    0.60780614947187      C 
   -1.43142690435554    4.75805270176495    0.68869855268654      C 
    0.32724787602478    6.75329002564635    0.54821105637842      C 
    1.65939142486022    8.46036434676252    0.46122592497650      N 
   -3.97846306065975    5.51393989378385    0.93064474428109      C 
   -6.05367977413353    6.10628397566596    1.12230205709968      N 
    3.92233270245908    2.70893279401908    0.13728149847993      C 
    5.78506925252363    3.79229506114168   -0.04529329235119      N 
   -2.58884792445303   -5.16461992002872    3.15720509130935      H 
   -0.35596604286876   -3.15968796729267    4.62197886520252      H 
    0.67714377367714   -5.80096332650990    2.85386609858828      H 
   -3.03459047233539   -5.16442001916667   -1.62302195127742      H 
    0.23428964002351   -5.75515055016926   -1.98438735389934      H 
   -1.16241831771264   -3.10949058195069   -3.47378496478908      H 
    3.53552046252226   -2.40055434690816    0.16331083335682      H 
$end
           -------------------------------------------------
          |                Final Singlepoint                |
           -------------------------------------------------

          ...................................................
          :                      SETUP                      :
          :.................................................:
          :  # basis functions                  69          :
          :  # atomic orbitals                  68          :
          :  # shells                           36          :
          :  # electrons                        68          :
          :  max. iterations                   250          :
          :  Hamiltonian                  GFN2-xTB          :
          :  restarted?                      false          :
          :  GBSA solvation                  false          :
          :  PC potential                    false          :
          :  electronic temp.          300.0000000     K    :
          :  accuracy                    1.0000000          :
          :  -> integral cutoff          0.2500000E+02      :
          :  -> integral neglect         0.1000000E-07      :
          :  -> SCF convergence          0.1000000E-05 Eh   :
          :  -> wf. convergence          0.1000000E-03 e    :
          :  Broyden damping             0.4000000          :
          ...................................................

 iter      E             dE          RMSdq      gap      omega  full diag
   1    -37.5358209 -0.375358E+02  0.103E-04    1.97       0.0  T
   2    -37.5358209  0.102105E-10  0.569E-05    1.97     383.2  T
   3    -37.5358209 -0.665068E-10  0.461E-05    1.97     472.9  T

   *** convergence criteria satisfied after 3 iterations ***

         #    Occupation            Energy/Eh            Energy/eV
      -------------------------------------------------------------
         1        2.0000           -0.7650868             -20.8191
       ...           ...                  ...                  ...
        28        2.0000           -0.4851541             -13.2017
        29        2.0000           -0.4787379             -13.0271
        30        2.0000           -0.4503400             -12.2544
        31        2.0000           -0.4501206             -12.2484
        32        2.0000           -0.4420899             -12.0299
        33        2.0000           -0.4324290             -11.7670
        34        2.0000           -0.4072677             -11.0823 (HOMO)
        35                         -0.3347647              -9.1094 (LUMO)
        36                         -0.2839060              -7.7255
        37                         -0.2648946              -7.2081
        38                         -0.2373914              -6.4597
        39                         -0.2276096              -6.1936
       ...                                ...                  ...
        68                          1.1632846              31.6546
      -------------------------------------------------------------
                  HL-Gap            0.0725031 Eh            1.9729 eV
             Fermi-level           -0.3710162 Eh          -10.0959 eV

 SCC (total)                   0 d,  0 h,  0 min,  0.026 sec
 SCC setup                      ...        0 min,  0.000 sec (  0.674%)
 Dispersion                     ...        0 min,  0.000 sec (  0.675%)
 integral evaluation            ...        0 min,  0.009 sec ( 33.233%)
 zeroth order Hamiltonian       ...        0 min,  0.000 sec (  0.567%)
 iterations                     ...        0 min,  0.003 sec ( 13.360%)
 molecular gradient             ...        0 min,  0.013 sec ( 50.189%)
 printout                       ...        0 min,  0.000 sec (  1.131%)

         :::::::::::::::::::::::::::::::::::::::::::::::::::::
         ::                     SUMMARY                     ::
         :::::::::::::::::::::::::::::::::::::::::::::::::::::
         :: total energy             -36.852676651416 Eh    ::
         :: gradient norm              0.000807413311 Eh/a0 ::
         :: HOMO-LUMO gap              1.972908473742 eV    ::
         ::.................................................::
         :: SCC energy               -37.535820865467 Eh    ::
         :: -> isotropic ES            0.026582539861 Eh    ::
         :: -> anisotropic ES          0.008826597117 Eh    ::
         :: -> anisotropic XC          0.059597443094 Eh    ::
         :: -> dispersion             -0.023357816361 Eh    ::
         :: repulsion energy           0.683023330532 Eh    ::
         :: add. restraining           0.000000000000 Eh    ::
         :::::::::::::::::::::::::::::::::::::::::::::::::::::

           -------------------------------------------------
          |                Property Printout                |
           -------------------------------------------------

    * Orbital Energies and Occupations

         #    Occupation            Energy/Eh            Energy/eV
      -------------------------------------------------------------
         1        2.0000           -0.7650868             -20.8191
       ...           ...                  ...                  ...
        22        2.0000           -0.5069134             -13.7938
        23        2.0000           -0.4987319             -13.5712
        24        2.0000           -0.4936326             -13.4324
        25        2.0000           -0.4931360             -13.4189
        26        2.0000           -0.4892613             -13.3135
        27        2.0000           -0.4868165             -13.2470
        28        2.0000           -0.4851541             -13.2017
        29        2.0000           -0.4787379             -13.0271
        30        2.0000           -0.4503400             -12.2544
        31        2.0000           -0.4501206             -12.2484
        32        2.0000           -0.4420899             -12.0299
        33        2.0000           -0.4324290             -11.7670
        34        2.0000           -0.4072677             -11.0823 (HOMO)
        35                         -0.3347647              -9.1094 (LUMO)
        36                         -0.2839060              -7.7255
        37                         -0.2648946              -7.2081
        38                         -0.2373914              -6.4597
        39                         -0.2276096              -6.1936
        40                         -0.2189908              -5.9590
        41                         -0.2034024              -5.5349
        42                         -0.1751781              -4.7668
        43                         -0.1634898              -4.4488
        44                         -0.1166488              -3.1742
        45                         -0.0521885              -1.4201
       ...                                ...                  ...
        68                          1.1632846              31.6546
      -------------------------------------------------------------
                  HL-Gap            0.0725031 Eh            1.9729 eV
             Fermi-level           -0.3710162 Eh          -10.0959 eV

     #   Z        covCN         q      C6AA      α(0)
     1  16 S      2.257    -0.060   143.558    20.166
     2   6 C      3.906     0.069    19.378     6.257
     3   6 C      3.790    -0.108    22.583     6.768
     4   6 C      3.790    -0.108    22.583     6.768
     5   6 C      3.027    -0.020    28.481     8.754
     6   6 C      3.068     0.018    27.538     8.605
     7   6 C      2.988     0.060    26.648     8.468
     8   6 C      2.992     0.000    28.016     8.683
     9   6 C      1.920     0.117    28.226     8.580
    10   7 N      0.911    -0.213    25.643     7.324
    11   6 C      1.927     0.120    28.130     8.565
    12   7 N      0.911    -0.218    25.750     7.339
    13   6 C      1.906     0.113    28.308     8.593
    14   7 N      0.911    -0.188    25.068     7.241
    15   1 H      0.925     0.063     2.166     2.301
    16   1 H      0.925     0.055     2.263     2.352
    17   1 H      0.925     0.059     2.216     2.328
    18   1 H      0.925     0.063     2.165     2.301
    19   1 H      0.925     0.058     2.218     2.329
    20   1 H      0.925     0.055     2.262     2.352
    21   1 H      0.926     0.067     2.124     2.279

 Mol. C6AA /au·bohr⁶  :       7785.621375
 Mol. C8AA /au·bohr⁸  :     215186.339132
 Mol. α(0) /au        :        138.352805


Wiberg/Mayer (AO) data.
largest (>0.10) Wiberg bond orders for each atom
          total WBO             WBO to atom ...
     1  S   2.419        C    7 1.146    C    2 0.935    C    8 0.104
     2  C   3.969        C    5 1.026    C    3 0.981    C    4 0.980    S    1 0.935
     3  C   3.980        H   16 0.985    C    2 0.981    H   15 0.980    H   17 0.977
     4  C   3.980        H   20 0.985    C    2 0.980    H   18 0.980    H   19 0.977
     5  C   3.966        C    6 1.698    C    2 1.026    H   21 0.960    N   14 0.108
     6  C   3.989        C    5 1.698    C    7 1.086    C   13 1.081
     7  C   3.969        C    8 1.498    S    1 1.146    C    6 1.086
     8  C   3.980        C    7 1.498    C    9 1.096    C   11 1.091    S    1 0.104
     9  C   3.952        N   10 2.779    C    8 1.096
    10  N   3.016        C    9 2.779
    11  C   3.950        N   12 2.784    C    8 1.091
    12  N   2.993        C   11 2.784
    13  C   3.951        N   14 2.820    C    6 1.081
    14  N   3.015        C   13 2.820    C    5 0.108
    15  H   0.995        C    3 0.980
    16  H   0.997        C    3 0.985
    17  H   0.996        C    3 0.977
    18  H   0.995        C    4 0.980
    19  H   0.996        C    4 0.977
    20  H   0.997        C    4 0.985
    21  H   0.995        C    5 0.960

molecular dipole:
                 x           y           z       tot (Debye)
 q only:        0.029      -2.973      -0.023
   full:       -0.005      -3.709      -0.025       9.427
molecular quadrupole (traceless):
                xx          xy          yy          xz          yz          zz
 q only:       -5.505       0.225      -6.700       1.726      -2.516      12.205
  q+dip:       -8.439      -1.818      -9.188       2.495      -2.976      17.627
   full:      -11.518      -3.351      -9.643       3.111      -2.867      21.161

           -------------------------------------------------
          |                Geometry Summary                 |
           -------------------------------------------------

      molecular mass/u    :      201.2454000
   center of mass at/Å    :       -0.2432012       0.9172905       0.3033365
  moments of inertia/u·Å² :        0.5656011E+03   0.9439138E+03   0.1401259E+04
rotational constants/cm⁻¹ :        0.2980481E-01   0.1785929E-01   0.1203035E-01

 * 16 selected distances

     #   Z        #   Z                                     value/Å
     2   6 C      3   6 C                                 1.5272284
     2   6 C      4   6 C                                 1.5274154
     2   6 C      5   6 C                                 1.4880269
     5   6 C      6   6 C                                 1.3439671
     1  16 S      7   6 C                                 1.7381454 (max)
     7   6 C      8   6 C                                 1.3655122
     9   6 C     10   7 N                                 1.1467743
    11   6 C     12   7 N                                 1.1465121
    13   6 C     14   7 N                                 1.1443934
     3   6 C     15   1 H                                 1.0873153
     3   6 C     16   1 H                                 1.0879496
     3   6 C     17   1 H                                 1.0879096
     4   6 C     18   1 H                                 1.0872569
     4   6 C     19   1 H                                 1.0879908
     4   6 C     20   1 H                                 1.0880186
     5   6 C     21   1 H                                 1.0774422 (min)

 * 4 distinct bonds (by element types)

   Z      Z             #   av. dist./Å        max./Å        min./Å
   1 H    6 C           7     1.0862690     1.0880186     1.0774422
   6 C    6 C           5     1.4504300     1.5274154     1.3439671
   6 C    7 N           3     1.1458933     1.1467743     1.1443934
   6 C   16 S           1     1.7381454     1.7381454     1.7381454


optimized geometry written to: xtbopt.xyz


           -------------------------------------------------
          | TOTAL ENERGY              -36.852676651416 Eh   |
          | GRADIENT NORM               0.000807413311 Eh/α |
          | HOMO-LUMO GAP               1.972908473742 eV   |
           -------------------------------------------------

------------------------------------------------------------------------
 * finished run on 2021/02/19 at 08:09:36.746     
------------------------------------------------------------------------
 total:
 * wall-time:     0 d,  0 h,  0 min,  0.736 sec
 *  cpu-time:     0 d,  0 h,  0 min,  0.730 sec
 * ratio c/w:     0.991 speedup
 SCF:
 * wall-time:     0 d,  0 h,  0 min,  0.039 sec
 *  cpu-time:     0 d,  0 h,  0 min,  0.039 sec
 * ratio c/w:     0.999 speedup
 ANC optimizer:
 * wall-time:     0 d,  0 h,  0 min,  0.672 sec
 *  cpu-time:     0 d,  0 h,  0 min,  0.672 sec
 * ratio c/w:     0.999 speedup

