      -----------------------------------------------------------      
     |                   =====================                   |     
     |                           x T B                           |     
     |                   =====================                   |     
     |                         S. Grimme                         |     
     |          Mulliken Center for Theoretical Chemistry        |     
     |                    University of Bonn                     |     
     |                Version 6.2 RC2 (SAW190805)                |     
      -----------------------------------------------------------      

   This program is distributed in the hope that it will be useful,
   but WITHOUT ANY WARRANTY; without even the implied warranty of
   MERCHANTABILITY or FITNESS FOR A PARTICULAR PURPOSE.
   
   FOR NON-COMMERCIAL, ACADEMIA USE ONLY.
   
   Cite this work as:
   * S. Grimme, C. Bannwarth, P. Shushkov, J. Chem. Theory Comput., 2017,
     13, 1989-2009. DOI: 10.1021/acs.jctc.7b00118
   * C. Bannwarth, S. Ehlert and S. Grimme., J. Chem. Theory Comput., 2019,
     15, 1652-1671. DOI: 10.1021/acs.jctc.8b01176
   * P. Pracht, E. Caldeweyher, S. Ehlert, S. Grimme, ChemRxiv, 2019, preprint.
     DOI: 10.26434/chemrxiv.8326202.v1
   
   for DFT-D4:
   * E. Caldeweyher, C. Bannwarth and S. Grimme, J. Chem. Phys., 2017,
     147, 034112. DOI: 10.1063/1.4993215
   * E. Caldeweyher, S. Ehlert, A. Hansen, H. Neugebauer, S. Spicher,
     C. Bannwarth and S. Grimme, J. Chem. Phys., 2019, 150, 154122.
     DOI: 10.1063/1.5090222
   
   for sTDA-xTB:
   * S. Grimme and C. Bannwarth, J. Chem. Phys., 2016, 145, 054103.
     DOI: 10.1063/1.4959605
   
   in the mass-spec context:
   * V. Asgeirsson, C. Bauer and S. Grimme, Chem. Sci., 2017, 8, 4879.
     DOI: 10.1039/c7sc00601b
   
   for metadynamics refer to:
   * S. Grimme, J. Chem. Theory Comput., 2019, 155, 2847-2862
     DOI: 10.1021/acs.jctc.9b00143
   
   with help from (in alphabetical order)
   C. Bannwarth, F. Bohle, G. Brandenburg, E. Caldeweyher, M. Checinski,
   S. Dohm, S. Ehlert, S. Ehrlich, F. März, H. Neugebauer, J. Pisarek,
   P. Pracht, P. Shushkov, and S. Spicher.
   
 * started run on 2021/02/19 at 08:09:36.764     

           -------------------------------------------------
          |                Calculation Setup                |
           -------------------------------------------------

          program call               : /ihome/ghutchison/geoffh/xtb/xtb 18a.xyz -opt
          hostname                   : smp-n61
          coordinate file            : 18a.xyz
          omp threads                :                     1
          number of atoms            :                    16
          number of electrons        :                    60
          charge                     :                     0
          spin                       :                   0.0
          first test random number   :      0.01944153693157


########################################################################
# WARNING! Please study the warnings concerning your input carefully
#  - the use of '-opt' is discouraged, please use '--opt' next time
########################################################################

           ------------------------------------------------- 
          |                 G F N 2 - x T B                 |
          | Geometry, Frequencies, Noncovalent interactions |
          |            JCTC 2019 parametrisation            |
           ------------------------------------------------- 
             KAB for C  - Si     :                1.0500
             KAB for H  - Pd     :                0.9500
             k(s)              :                1.8500
             k(p)              :                2.2300
             k(d)              :                2.2300
             k(f)              :                2.0000
             kEN (H0ij)        :               -2.0000
             D4 a1             :                0.5200
             D4 a2             :                5.0000
             D4 s6             :                1.0000
             D4 s8             :                2.7000
             D4 s9             :                5.0000
             alphaj            :                2.0000

  Z AO/shell   Hii/eV     exponent
  1     Wed Apr 25 08:07:45 CEST 2018   EN: 2.200 GM2: 0.406  GM3: 0.0800  RAES: 1.40
     1s    -10.707211    1.230000
  6     Wed Apr 25 08:07:45 CEST 2018   EN: 2.550 GM2: 0.538  GM3: 0.1500  RAES: 3.00
     2s    -13.970922    2.096432
     2p    -10.063292    1.800000
  7     Wed Apr 25 08:07:45 CEST 2018   EN: 3.040 GM2: 0.461  GM3:-0.0640  RAES: 1.90
     2s    -16.686243    2.339881
     2p    -12.523956    2.014332
 16     Tue Apr 24 11:44:34 CEST 2018   EN: 2.580 GM2: 0.340  GM3:-0.0502  RAES: 3.10
     3s    -20.029654    1.981333
     3p    -11.377694    2.025643
     3d     -0.420282    1.702555

           ------------------------------------------------- 
          |        Self-Consistent Charge Iterations        |
           ------------------------------------------------- 

          ...................................................
          :                      SETUP                      :
          :.................................................:
          :  # basis functions                  64          :
          :  # atomic orbitals                  62          :
          :  # shells                           30          :
          :  # electrons                        60          :
          :  max. iterations                   250          :
          :  Hamiltonian                  GFN2-xTB          :
          :  restarted?                      false          :
          :  GBSA solvation                  false          :
          :  PC potential                    false          :
          :  electronic temp.          300.0000000     K    :
          :  accuracy                    1.0000000          :
          :  -> integral cutoff          0.2500000E+02      :
          :  -> integral neglect         0.1000000E-07      :
          :  -> SCF convergence          0.1000000E-05 Eh   :
          :  -> wf. convergence          0.1000000E-03 e    :
          :  Broyden damping             0.4000000          :
          ...................................................

 iter      E             dE          RMSdq      gap      omega  full diag
   1    -33.3078353 -0.333078E+02  0.477E+00    3.26       0.0  T
   2    -33.3381373 -0.303020E-01  0.345E+00    2.67       1.0  T
   3    -33.3653126 -0.271753E-01  0.164E+00    2.87       1.0  T
   4    -33.3832752 -0.179625E-01  0.693E-01    2.74       1.0  T
   5    -33.3847283 -0.145312E-02  0.151E-01    2.74       1.0  T
   6    -33.3847439 -0.156659E-04  0.321E-02    2.74       1.0  T
   7    -33.3847442 -0.235417E-06  0.966E-03    2.74       2.6  T
   8    -33.3847448 -0.621528E-06  0.278E-03    2.74       9.0  T
   9    -33.3847448 -0.448339E-07  0.107E-03    2.74      23.4  T
  10    -33.3847449 -0.481056E-08  0.252E-04    2.74      99.2  T
  11    -33.3847449 -0.169180E-10  0.119E-04    2.74     209.8  T

   *** convergence criteria satisfied after 11 iterations ***

         #    Occupation            Energy/Eh            Energy/eV
      -------------------------------------------------------------
         1        2.0000           -0.7585316             -20.6407
       ...           ...                  ...                  ...
        24        2.0000           -0.4490656             -12.2197
        25        2.0000           -0.4398882             -11.9700
        26        2.0000           -0.4314486             -11.7403
        27        2.0000           -0.4305477             -11.7158
        28        2.0000           -0.4273793             -11.6296
        29        2.0000           -0.4186212             -11.3913
        30        2.0000           -0.4032456             -10.9729 (HOMO)
        31                         -0.3024021              -8.2288 (LUMO)
        32                         -0.3017177              -8.2102
        33                         -0.2346399              -6.3849
        34                         -0.2227928              -6.0625
        35                         -0.2211011              -6.0165
       ...                                ...                  ...
        62                          0.5668186              15.4239
      -------------------------------------------------------------
                  HL-Gap            0.1008434 Eh            2.7441 eV
             Fermi-level           -0.3528239 Eh           -9.6008 eV

 SCC (total)                   0 d,  0 h,  0 min,  0.030 sec
 SCC setup                      ...        0 min,  0.000 sec (  0.895%)
 Dispersion                     ...        0 min,  0.000 sec (  0.655%)
 integral evaluation            ...        0 min,  0.008 sec ( 25.883%)
 zeroth order Hamiltonian       ...        0 min,  0.000 sec (  0.467%)
 iterations                     ...        0 min,  0.011 sec ( 34.804%)
 molecular gradient             ...        0 min,  0.011 sec ( 36.146%)
 printout                       ...        0 min,  0.000 sec (  0.991%)

         :::::::::::::::::::::::::::::::::::::::::::::::::::::
         ::                     SUMMARY                     ::
         :::::::::::::::::::::::::::::::::::::::::::::::::::::
         :: total energy             -33.071362421970 Eh    ::
         :: gradient norm              0.111267073232 Eh/a0 ::
         :: HOMO-LUMO gap              2.744089594555 eV    ::
         ::.................................................::
         :: SCC energy               -33.384744850154 Eh    ::
         :: -> isotropic ES            0.030626422473 Eh    ::
         :: -> anisotropic ES          0.001293012401 Eh    ::
         :: -> anisotropic XC          0.024244734487 Eh    ::
         :: -> dispersion             -0.018999803200 Eh    ::
         :: repulsion energy           0.313333450831 Eh    ::
         :: add. restraining           0.000000000000 Eh    ::
         :::::::::::::::::::::::::::::::::::::::::::::::::::::

      ----------------------------------------------------------- 
     |                   =====================                   |
     |                        A N C O P T                        |
     |                   =====================                   |
     |               Approximate Normal Coordinate               |
     |                Rational Function Optimizer                |
      ----------------------------------------------------------- 

          ...................................................
          :                      SETUP                      :
          :.................................................:
          :   optimization level            normal          :
          :   max. optcycles                   200          :
          :   ANC micro-cycles                  20          :
          :   degrees of freedom                42          :
          :.................................................:
          :   RF solver                   davidson          :
          :   input Hessian                  false          :
          :   write xtbopt.log                true          :
          :   linear?                        false          :
          :   energy convergence         0.5000000E-05 Eh   :
          :   grad. convergence          0.1000000E-02 Eh/α :
          :   maximium RF displ.         2.0000000          :
          :   Hlow (freq-cutoff)         0.5000000E-02      :
          :   Hmax (freq-cutoff)         5.0000000          :
          :   S6 in model hess.         20.0000000          :
          ...................................................

generating ANC from model Hessian ...
Using Lindh-Hessian (1995)
 Shifting diagonal of input Hessian by   0.000000000000000E+000
 Lowest  eigenvalues of input Hessian
   -0.000000   -0.000000    0.000000    0.000000    0.000000    0.000000
    0.005724    0.014731    0.015365    0.025225    0.027649    0.048970
    0.050132    0.053144    0.058533    0.063100    0.064674    0.068531
 Highest eigenvalues
    1.538584    1.542374    1.748923    1.795938    1.802678    1.877762
 

........................................................................
.............................. CYCLE    1 ..............................
........................................................................
   1    -33.3847449 -0.333847E+02  0.313E-05    2.74       0.0  T
   2    -33.3847449 -0.218847E-11  0.160E-05    2.74    1561.4  T
   3    -33.3847449 -0.298428E-12  0.944E-06    2.74    2648.7  T
     SCC iter.                  ...        0 min,  0.003 sec
     gradient                   ...        0 min,  0.011 sec
 * total energy  :   -33.0713624 Eh     change        0.4676338E-08 Eh
   gradient norm :     0.1112672 Eh/α   predicted     0.0000000E+00 (-100.00%)
   displ. norm   :     0.2175554 α      lambda       -0.2076935E-01
   maximum displ.:     0.2038280 α      in ANC's #24, #32, #28, ...

........................................................................
.............................. CYCLE    2 ..............................
........................................................................
   1    -33.4279735 -0.334280E+02  0.971E-01    2.92       0.0  T
   2    -33.4285340 -0.560434E-03  0.396E-01    2.95       1.0  T
   3    -33.4284831  0.509059E-04  0.116E-01    2.94       1.0  T
   4    -33.4285901 -0.107025E-03  0.696E-02    2.95       1.0  T
   5    -33.4286214 -0.313239E-04  0.260E-02    2.95       1.0  T
   6    -33.4286215 -0.118341E-06  0.474E-03    2.95       5.3  T
   7    -33.4286215 -0.163418E-08  0.114E-03    2.95      22.0  T
     SCC iter.                  ...        0 min,  0.006 sec
     gradient                   ...        0 min,  0.010 sec
 * total energy  :   -33.0844785 Eh     change       -0.1311610E-01 Eh
   gradient norm :     0.0489388 Eh/α   predicted    -0.1087618E-01 ( -17.08%)
   displ. norm   :     0.1023072 α      lambda       -0.3577973E-02
   maximum displ.:     0.0579442 α      in ANC's #24, #32, #6, ...

........................................................................
.............................. CYCLE    3 ..............................
........................................................................
   1    -33.4478851 -0.334479E+02  0.301E-01    3.05       0.0  T
   2    -33.4479517 -0.665911E-04  0.138E-01    3.05       1.0  T
   3    -33.4479288  0.229067E-04  0.722E-02    3.06       1.0  T
   4    -33.4479688 -0.400372E-04  0.259E-02    3.06       1.0  T
   5    -33.4479734 -0.452888E-05  0.677E-03    3.06       3.7  T
   6    -33.4479734 -0.148960E-07  0.851E-04    3.06      29.4  T
   7    -33.4479734 -0.173444E-08  0.436E-04    3.06      57.4  T
     SCC iter.                  ...        0 min,  0.006 sec
     gradient                   ...        0 min,  0.010 sec
 * total energy  :   -33.0865712 Eh     change       -0.2092689E-02 Eh
   gradient norm :     0.0225382 Eh/α   predicted    -0.1807710E-02 ( -13.62%)
   displ. norm   :     0.0304961 α      lambda       -0.5613439E-03
   maximum displ.:     0.0225766 α      in ANC's #32, #6, #37, ...

........................................................................
.............................. CYCLE    4 ..............................
........................................................................
   1    -33.4494855 -0.334495E+02  0.177E-01    3.08       0.0  T
   2    -33.4495164 -0.308846E-04  0.752E-02    3.07       1.0  T
   3    -33.4495315 -0.151070E-04  0.502E-02    3.08       1.0  T
   4    -33.4495557 -0.242193E-04  0.139E-02    3.08       1.8  T
   5    -33.4495563 -0.579724E-06  0.440E-03    3.08       5.7  T
   6    -33.4495563 -0.235228E-07  0.483E-04    3.08      51.8  T
     SCC iter.                  ...        0 min,  0.005 sec
     gradient                   ...        0 min,  0.010 sec
 * total energy  :   -33.0869420 Eh     change       -0.3707842E-03 Eh
   gradient norm :     0.0105726 Eh/α   predicted    -0.2809321E-03 ( -24.23%)
   displ. norm   :     0.0156595 α      lambda       -0.1434413E-03
   maximum displ.:     0.0086501 α      in ANC's #32, #37, #24, ...

........................................................................
.............................. CYCLE    5 ..............................
........................................................................
   1    -33.4480940 -0.334481E+02  0.130E-01    3.08       0.0  T
   2    -33.4481082 -0.141611E-04  0.499E-02    3.07       1.0  T
   3    -33.4481123 -0.410070E-05  0.344E-02    3.08       1.0  T
   4    -33.4481257 -0.134431E-04  0.746E-03    3.08       3.4  T
   5    -33.4481259 -0.150236E-06  0.278E-03    3.08       9.0  T
   6    -33.4481259 -0.562295E-08  0.293E-04    3.08      85.3  T
     SCC iter.                  ...        0 min,  0.005 sec
     gradient                   ...        0 min,  0.010 sec
 * total energy  :   -33.0870212 Eh     change       -0.7923238E-04 Eh
   gradient norm :     0.0035295 Eh/α   predicted    -0.7173857E-04 (  -9.46%)
   displ. norm   :     0.0037803 α      lambda       -0.8981002E-05
   maximum displ.:     0.0023252 α      in ANC's #40, #6, #12, ...

........................................................................
.............................. CYCLE    6 ..............................
........................................................................
   1    -33.4477095 -0.334477E+02  0.254E-02    3.07       0.0  T
   2    -33.4477100 -0.491917E-06  0.839E-03    3.07       3.0  T
   3    -33.4477100  0.434032E-07  0.612E-03    3.08       4.1  T
   4    -33.4477104 -0.399110E-06  0.136E-03    3.07      18.4  T
   5    -33.4477104 -0.462481E-08  0.481E-04    3.08      52.0  T
   6    -33.4477104 -0.207052E-10  0.533E-05    3.08     468.6  T
     SCC iter.                  ...        0 min,  0.005 sec
     gradient                   ...        0 min,  0.011 sec
 * total energy  :   -33.0870274 Eh     change       -0.6140494E-05 Eh
   gradient norm :     0.0016759 Eh/α   predicted    -0.4492093E-05 ( -26.84%)
   displ. norm   :     0.0048192 α      lambda       -0.3498875E-05
   maximum displ.:     0.0028755 α      in ANC's #40, #12, #1, ...

........................................................................
.............................. CYCLE    7 ..............................
........................................................................
   1    -33.4476041 -0.334476E+02  0.260E-02    3.07       0.0  T
   2    -33.4476047 -0.523697E-06  0.864E-03    3.07       2.9  T
   3    -33.4476046  0.687941E-07  0.511E-03    3.07       4.9  T
   4    -33.4476048 -0.236570E-06  0.153E-03    3.07      16.3  T
   5    -33.4476048 -0.101717E-07  0.584E-04    3.07      42.8  T
   6    -33.4476048 -0.115719E-09  0.109E-04    3.07     230.3  T
     SCC iter.                  ...        0 min,  0.005 sec
     gradient                   ...        0 min,  0.011 sec
 * total energy  :   -33.0870286 Eh     change       -0.1247038E-05 Eh
   gradient norm :     0.0008037 Eh/α   predicted    -0.1748941E-05 (  40.25%)
   displ. norm   :     0.0046115 α      lambda       -0.1059630E-05
   maximum displ.:     0.0035120 α      in ANC's #12, #1, #3, ...

   *** GEOMETRY OPTIMIZATION CONVERGED AFTER 7 ITERATIONS ***

------------------------------------------------------------------------
 total energy gain   :        -0.0156662 Eh       -9.8307 kcal/mol
 total RMSD          :         0.0746089 a0        0.0395 Å
 total power (kW/mol):        -5.8759377 (step) -239.2037 (real)
------------------------------------------------------------------------

 ANCopt (total)                0 d,  0 h,  0 min,  0.172 sec
 optimizer setup                ...        0 min,  0.000 sec (  0.075%)
 model hessian                  ...        0 min,  0.003 sec (  1.913%)
 ANC generation                 ...        0 min,  0.000 sec (  0.210%)
 coordinate transformation      ...        0 min,  0.000 sec (  0.048%)
 single point calculation       ...        0 min,  0.166 sec ( 96.452%)
 optimization log               ...        0 min,  0.001 sec (  0.302%)
 hessian update                 ...        0 min,  0.000 sec (  0.038%)
 rational function              ...        0 min,  0.001 sec (  0.689%)

================
 final structure:
================
$coord
    0.16250254328196    2.95394626376098   -0.03486062102734      C 
   -2.22865695705219    1.47015232460876   -0.00119105848369      C 
   -4.47282923244935    2.54027514691824   -0.00354610884826      N 
   -6.63181638955806    0.36343622355400    0.03649414664602      S 
   -4.71851852177183   -2.03241915932463    0.06148936637384      N 
   -2.37261963017837   -1.20923516293243    0.03691746829739      C 
   -0.15423164881913   -2.94100623518537    0.04898389984718      C 
    2.23688095516635   -1.45730682691647    0.00848392181207      C 
    2.38084334129630    1.22208060630310   -0.02962389168640      C 
    4.72670026742170    2.04518001479207   -0.06029218017918      N 
    6.63992885880139   -0.35081420214102   -0.04531695741582      S 
    4.48101080821814   -2.52751430623796    0.00474126896213      N 
    0.24033244943878    4.21215974106112    1.60522063079171      H 
    0.21787534785208    4.17416827948215   -1.70421914770472      H 
   -0.23244218146708   -4.20698732532837   -1.58501137347023      H 
   -0.20914085536667   -4.15329539351293    1.72420497596906      H 
$end
           -------------------------------------------------
          |                Final Singlepoint                |
           -------------------------------------------------

          ...................................................
          :                      SETUP                      :
          :.................................................:
          :  # basis functions                  64          :
          :  # atomic orbitals                  62          :
          :  # shells                           30          :
          :  # electrons                        60          :
          :  max. iterations                   250          :
          :  Hamiltonian                  GFN2-xTB          :
          :  restarted?                      false          :
          :  GBSA solvation                  false          :
          :  PC potential                    false          :
          :  electronic temp.          300.0000000     K    :
          :  accuracy                    1.0000000          :
          :  -> integral cutoff          0.2500000E+02      :
          :  -> integral neglect         0.1000000E-07      :
          :  -> SCF convergence          0.1000000E-05 Eh   :
          :  -> wf. convergence          0.1000000E-03 e    :
          :  Broyden damping             0.4000000          :
          ...................................................

 iter      E             dE          RMSdq      gap      omega  full diag
   1    -33.4476048 -0.334476E+02  0.347E-05    3.07       0.0  T
   2    -33.4476048 -0.198952E-11  0.151E-05    3.07    1650.3  T
   3    -33.4476048 -0.710543E-14  0.597E-06    3.07    4187.0  T

   *** convergence criteria satisfied after 3 iterations ***

         #    Occupation            Energy/Eh            Energy/eV
      -------------------------------------------------------------
         1        2.0000           -0.7609529             -20.7066
       ...           ...                  ...                  ...
        24        2.0000           -0.4451703             -12.1137
        25        2.0000           -0.4321952             -11.7606
        26        2.0000           -0.4189684             -11.4007
        27        2.0000           -0.4182414             -11.3809
        28        2.0000           -0.4168544             -11.3432
        29        2.0000           -0.4161531             -11.3241
        30        2.0000           -0.4010997             -10.9145 (HOMO)
        31                         -0.2881645              -7.8414 (LUMO)
        32                         -0.2880747              -7.8389
        33                         -0.2310027              -6.2859
        34                         -0.2183070              -5.9404
        35                         -0.2075789              -5.6485
       ...                                ...                  ...
        62                          0.6684019              18.1881
      -------------------------------------------------------------
                  HL-Gap            0.1129352 Eh            3.0731 eV
             Fermi-level           -0.3446321 Eh           -9.3779 eV

 SCC (total)                   0 d,  0 h,  0 min,  0.022 sec
 SCC setup                      ...        0 min,  0.000 sec (  0.677%)
 Dispersion                     ...        0 min,  0.000 sec (  0.483%)
 integral evaluation            ...        0 min,  0.007 sec ( 33.644%)
 zeroth order Hamiltonian       ...        0 min,  0.000 sec (  0.560%)
 iterations                     ...        0 min,  0.003 sec ( 14.195%)
 molecular gradient             ...        0 min,  0.011 sec ( 49.050%)
 printout                       ...        0 min,  0.000 sec (  1.187%)

         :::::::::::::::::::::::::::::::::::::::::::::::::::::
         ::                     SUMMARY                     ::
         :::::::::::::::::::::::::::::::::::::::::::::::::::::
         :: total energy             -33.087028608123 Eh    ::
         :: gradient norm              0.000803810944 Eh/a0 ::
         :: HOMO-LUMO gap              3.073123455638 eV    ::
         ::.................................................::
         :: SCC energy               -33.447604840548 Eh    ::
         :: -> isotropic ES            0.033118370491 Eh    ::
         :: -> anisotropic ES          0.000948003647 Eh    ::
         :: -> anisotropic XC          0.024907623695 Eh    ::
         :: -> dispersion             -0.019136184306 Eh    ::
         :: repulsion energy           0.360531074785 Eh    ::
         :: add. restraining           0.000000000000 Eh    ::
         :::::::::::::::::::::::::::::::::::::::::::::::::::::

           -------------------------------------------------
          |                Property Printout                |
           -------------------------------------------------

    * Orbital Energies and Occupations

         #    Occupation            Energy/Eh            Energy/eV
      -------------------------------------------------------------
         1        2.0000           -0.7609529             -20.7066
       ...           ...                  ...                  ...
        18        2.0000           -0.5129540             -13.9582
        19        2.0000           -0.4969313             -13.5222
        20        2.0000           -0.4951621             -13.4740
        21        2.0000           -0.4858314             -13.2201
        22        2.0000           -0.4718027             -12.8384
        23        2.0000           -0.4591631             -12.4945
        24        2.0000           -0.4451703             -12.1137
        25        2.0000           -0.4321952             -11.7606
        26        2.0000           -0.4189684             -11.4007
        27        2.0000           -0.4182414             -11.3809
        28        2.0000           -0.4168544             -11.3432
        29        2.0000           -0.4161531             -11.3241
        30        2.0000           -0.4010997             -10.9145 (HOMO)
        31                         -0.2881645              -7.8414 (LUMO)
        32                         -0.2880747              -7.8389
        33                         -0.2310027              -6.2859
        34                         -0.2183070              -5.9404
        35                         -0.2075789              -5.6485
        36                         -0.2015288              -5.4839
        37                         -0.1420431              -3.8652
        38                         -0.1390845              -3.7847
        39                          0.0134122               0.3650
        40                          0.0134551               0.3661
        41                          0.0209995               0.5714
       ...                                ...                  ...
        62                          0.6684019              18.1881
      -------------------------------------------------------------
                  HL-Gap            0.1129352 Eh            3.0731 eV
             Fermi-level           -0.3446321 Eh           -9.3779 eV

     #   Z        covCN         q      C6AA      α(0)
     1   6 C      3.810    -0.064    21.729     6.635
     2   6 C      3.326     0.071    24.266     7.828
     3   7 N      1.862    -0.261    27.632     7.791
     4  16 S      2.656     0.285   129.978    19.188
     5   7 N      1.862    -0.261    27.632     7.791
     6   6 C      3.326     0.071    24.266     7.828
     7   6 C      3.810    -0.064    21.729     6.635
     8   6 C      3.326     0.071    24.266     7.828
     9   6 C      3.326     0.071    24.266     7.828
    10   7 N      1.862    -0.261    27.632     7.791
    11  16 S      2.656     0.285   129.978    19.188
    12   7 N      1.862    -0.261    27.632     7.791
    13   1 H      0.924     0.079     1.987     2.205
    14   1 H      0.924     0.079     1.987     2.204
    15   1 H      0.924     0.079     1.987     2.204
    16   1 H      0.924     0.079     1.987     2.205

 Mol. C6AA /au·bohr⁶  :       6135.719272
 Mol. C8AA /au·bohr⁸  :     187588.479781
 Mol. α(0) /au        :        122.942200


Wiberg/Mayer (AO) data.
largest (>0.10) Wiberg bond orders for each atom
          total WBO             WBO to atom ...
     1  C   3.997        C    9 1.012    C    2 1.012    H   14 0.938    H   13 0.938
     2  C   3.976        N    3 1.506    C    6 1.257    C    1 1.012    S    4 0.134
     3  N   3.084        C    2 1.506    S    4 1.367    N    5 0.140
     4  S   3.076        N    3 1.367    N    5 1.367    C    2 0.134    C    6 0.134
     5  N   3.084        C    6 1.506    S    4 1.367    N    3 0.140
     6  C   3.976        N    5 1.506    C    2 1.257    C    7 1.012    S    4 0.134
     7  C   3.997        C    6 1.012    C    8 1.012    H   15 0.938    H   16 0.938
     8  C   3.976        N   12 1.506    C    9 1.257    C    7 1.012    S   11 0.134
     9  C   3.976        N   10 1.506    C    8 1.257    C    1 1.012    S   11 0.134
    10  N   3.084        C    9 1.506    S   11 1.367    N   12 0.140
    11  S   3.076        N   10 1.367    N   12 1.367    C    9 0.134    C    8 0.134
    12  N   3.084        C    8 1.506    S   11 1.367    N   10 0.140
    13  H   0.994        C    1 0.938
    14  H   0.994        C    1 0.938
    15  H   0.994        C    7 0.938
    16  H   0.994        C    7 0.938

molecular dipole:
                 x           y           z       tot (Debye)
 q only:        0.000       0.000       0.000
   full:        0.000       0.000       0.001       0.003
molecular quadrupole (traceless):
                xx          xy          yy          xz          yz          zz
 q only:        4.336      -0.406      -3.188      -0.032       0.031      -1.148
  q+dip:       -2.695       0.005      -2.620       0.055       0.110       5.315
   full:       -2.370      -0.099      -4.223       0.064       0.151       6.593

           -------------------------------------------------
          |                Geometry Summary                 |
           -------------------------------------------------

      molecular mass/u    :      196.2444000
   center of mass at/Å    :        0.0021651       0.0033771       0.0003667
  moments of inertia/u·Å² :        0.1880505E+03   0.1200672E+04   0.1382537E+04
rotational constants/cm⁻¹ :        0.8964418E-01   0.1404016E-01   0.1219326E-01

 * 18 selected distances

     #   Z        #   Z                                     value/Å
     1   6 C      2   6 C                                 1.4892765
     2   6 C      3   7 N                                 1.3156711
     3   7 N      4  16 S                                 1.6225524
     4  16 S      5   7 N                                 1.6225524 (max)
     2   6 C      6   6 C                                 1.4200593
     5   7 N      6   6 C                                 1.3156710
     6   6 C      7   6 C                                 1.4892765
     7   6 C      8   6 C                                 1.4892766
     1   6 C      9   6 C                                 1.4892765
     8   6 C      9   6 C                                 1.4200592
     9   6 C     10   7 N                                 1.3156711
    10   7 N     11  16 S                                 1.6225524
     8   6 C     12   7 N                                 1.3156710
    11  16 S     12   7 N                                 1.6225524
     1   6 C     13   1 H                                 1.0946457
     1   6 C     14   1 H                                 1.0946126
     7   6 C     15   1 H                                 1.0946125 (min)
     7   6 C     16   1 H                                 1.0946458

 * 4 distinct bonds (by element types)

   Z      Z             #   av. dist./Å        max./Å        min./Å
   1 H    6 C           4     1.0946292     1.0946458     1.0946125
   6 C    6 C           6     1.4662041     1.4892766     1.4200592
   6 C    7 N           4     1.3156710     1.3156711     1.3156710
   7 N   16 S           4     1.6225524     1.6225524     1.6225524


optimized geometry written to: xtbopt.xyz


           -------------------------------------------------
          | TOTAL ENERGY              -33.087028608123 Eh   |
          | GRADIENT NORM               0.000803810944 Eh/α |
          | HOMO-LUMO GAP               3.073123455638 eV   |
           -------------------------------------------------

------------------------------------------------------------------------
 * finished run on 2021/02/19 at 08:09:37.016     
------------------------------------------------------------------------
 total:
 * wall-time:     0 d,  0 h,  0 min,  0.252 sec
 *  cpu-time:     0 d,  0 h,  0 min,  0.243 sec
 * ratio c/w:     0.963 speedup
 SCF:
 * wall-time:     0 d,  0 h,  0 min,  0.030 sec
 *  cpu-time:     0 d,  0 h,  0 min,  0.030 sec
 * ratio c/w:     0.999 speedup
 ANC optimizer:
 * wall-time:     0 d,  0 h,  0 min,  0.195 sec
 *  cpu-time:     0 d,  0 h,  0 min,  0.194 sec
 * ratio c/w:     1.000 speedup

