      -----------------------------------------------------------      
     |                   =====================                   |     
     |                           x T B                           |     
     |                   =====================                   |     
     |                         S. Grimme                         |     
     |          Mulliken Center for Theoretical Chemistry        |     
     |                    University of Bonn                     |     
     |                Version 6.2 RC2 (SAW190805)                |     
      -----------------------------------------------------------      

   This program is distributed in the hope that it will be useful,
   but WITHOUT ANY WARRANTY; without even the implied warranty of
   MERCHANTABILITY or FITNESS FOR A PARTICULAR PURPOSE.
   
   FOR NON-COMMERCIAL, ACADEMIA USE ONLY.
   
   Cite this work as:
   * S. Grimme, C. Bannwarth, P. Shushkov, J. Chem. Theory Comput., 2017,
     13, 1989-2009. DOI: 10.1021/acs.jctc.7b00118
   * C. Bannwarth, S. Ehlert and S. Grimme., J. Chem. Theory Comput., 2019,
     15, 1652-1671. DOI: 10.1021/acs.jctc.8b01176
   * P. Pracht, E. Caldeweyher, S. Ehlert, S. Grimme, ChemRxiv, 2019, preprint.
     DOI: 10.26434/chemrxiv.8326202.v1
   
   for DFT-D4:
   * E. Caldeweyher, C. Bannwarth and S. Grimme, J. Chem. Phys., 2017,
     147, 034112. DOI: 10.1063/1.4993215
   * E. Caldeweyher, S. Ehlert, A. Hansen, H. Neugebauer, S. Spicher,
     C. Bannwarth and S. Grimme, J. Chem. Phys., 2019, 150, 154122.
     DOI: 10.1063/1.5090222
   
   for sTDA-xTB:
   * S. Grimme and C. Bannwarth, J. Chem. Phys., 2016, 145, 054103.
     DOI: 10.1063/1.4959605
   
   in the mass-spec context:
   * V. Asgeirsson, C. Bauer and S. Grimme, Chem. Sci., 2017, 8, 4879.
     DOI: 10.1039/c7sc00601b
   
   for metadynamics refer to:
   * S. Grimme, J. Chem. Theory Comput., 2019, 155, 2847-2862
     DOI: 10.1021/acs.jctc.9b00143
   
   with help from (in alphabetical order)
   C. Bannwarth, F. Bohle, G. Brandenburg, E. Caldeweyher, M. Checinski,
   S. Dohm, S. Ehlert, S. Ehrlich, F. März, H. Neugebauer, J. Pisarek,
   P. Pracht, P. Shushkov, and S. Spicher.
   
 * started run on 2021/02/19 at 08:09:53.538     

           -------------------------------------------------
          |                Calculation Setup                |
           -------------------------------------------------

          program call               : /ihome/ghutchison/geoffh/xtb/xtb 19atl.xyz -opt
          hostname                   : smp-n167
          coordinate file            : 19atl.xyz
          omp threads                :                     1
          number of atoms            :                    26
          number of electrons        :                    90
          charge                     :                     0
          spin                       :                   0.0
          first test random number   :      0.67781757079740


########################################################################
# WARNING! Please study the warnings concerning your input carefully
#  - the use of '-opt' is discouraged, please use '--opt' next time
########################################################################

           ------------------------------------------------- 
          |                 G F N 2 - x T B                 |
          | Geometry, Frequencies, Noncovalent interactions |
          |            JCTC 2019 parametrisation            |
           ------------------------------------------------- 
             KAB for C  - Si     :                1.0500
             KAB for H  - Pd     :                0.9500
             k(s)              :                1.8500
             k(p)              :                2.2300
             k(d)              :                2.2300
             k(f)              :                2.0000
             kEN (H0ij)        :               -2.0000
             D4 a1             :                0.5200
             D4 a2             :                5.0000
             D4 s6             :                1.0000
             D4 s8             :                2.7000
             D4 s9             :                5.0000
             alphaj            :                2.0000

  Z AO/shell   Hii/eV     exponent
  1     Wed Apr 25 08:07:45 CEST 2018   EN: 2.200 GM2: 0.406  GM3: 0.0800  RAES: 1.40
     1s    -10.707211    1.230000
  6     Wed Apr 25 08:07:45 CEST 2018   EN: 2.550 GM2: 0.538  GM3: 0.1500  RAES: 3.00
     2s    -13.970922    2.096432
     2p    -10.063292    1.800000
  7     Wed Apr 25 08:07:45 CEST 2018   EN: 3.040 GM2: 0.461  GM3:-0.0640  RAES: 1.90
     2s    -16.686243    2.339881
     2p    -12.523956    2.014332

           ------------------------------------------------- 
          |        Self-Consistent Charge Iterations        |
           ------------------------------------------------- 

          ...................................................
          :                      SETUP                      :
          :.................................................:
          :  # basis functions                  86          :
          :  # atomic orbitals                  86          :
          :  # shells                           46          :
          :  # electrons                        90          :
          :  max. iterations                   250          :
          :  Hamiltonian                  GFN2-xTB          :
          :  restarted?                      false          :
          :  GBSA solvation                  false          :
          :  PC potential                    false          :
          :  electronic temp.          300.0000000     K    :
          :  accuracy                    1.0000000          :
          :  -> integral cutoff          0.2500000E+02      :
          :  -> integral neglect         0.1000000E-07      :
          :  -> SCF convergence          0.1000000E-05 Eh   :
          :  -> wf. convergence          0.1000000E-03 e    :
          :  Broyden damping             0.4000000          :
          ...................................................

 iter      E             dE          RMSdq      gap      omega  full diag
   1    -49.2318365 -0.492318E+02  0.784E+00    2.12       0.0  T
   2    -48.9809509  0.250886E+00  0.620E+00    2.22       1.0  T
   3    -49.1063762 -0.125425E+00  0.444E+00    2.04       1.0  T
   4    -49.4105150 -0.304139E+00  0.110E+00    2.08       1.0  T
   5    -49.4346427 -0.241278E-01  0.433E-01    2.06       1.0  T
   6    -49.4363663 -0.172362E-02  0.233E-01    2.06       1.0  T
   7    -49.4371776 -0.811292E-03  0.117E-01    2.06       1.0  T
   8    -49.4374361 -0.258425E-03  0.310E-02    2.06       1.0  T
   9    -49.4374431 -0.707066E-05  0.191E-02    2.06       1.0  T
  10    -49.4374476 -0.447314E-05  0.532E-03    2.06       3.7  T
  11    -49.4374482 -0.648314E-06  0.181E-03    2.06      10.8  T
  12    -49.4374483 -0.729421E-08  0.140E-03    2.06      14.0  T
  13    -49.4374483 -0.186677E-07  0.766E-04    2.06      25.6  T
  14    -49.4374483 -0.148681E-07  0.234E-04    2.06      83.7  T

   *** convergence criteria satisfied after 14 iterations ***

         #    Occupation            Energy/Eh            Energy/eV
      -------------------------------------------------------------
         1        2.0000           -0.7032346             -19.1360
       ...           ...                  ...                  ...
        39        2.0000           -0.4635689             -12.6144
        40        2.0000           -0.4606284             -12.5343
        41        2.0000           -0.4574570             -12.4480
        42        2.0000           -0.4533436             -12.3361
        43        2.0000           -0.4496707             -12.2362
        44        2.0000           -0.4421805             -12.0323
        45        2.0000           -0.4289812             -11.6732 (HOMO)
        46                         -0.3531740              -9.6104 (LUMO)
        47                         -0.3470005              -9.4424
        48                         -0.2949038              -8.0247
        49                         -0.2867330              -7.8024
        50                         -0.2845881              -7.7440
       ...                                ...                  ...
        86                          1.0592049              28.8224
      -------------------------------------------------------------
                  HL-Gap            0.0758072 Eh            2.0628 eV
             Fermi-level           -0.3910776 Eh          -10.6418 eV

 SCC (total)                   0 d,  0 h,  0 min,  0.101 sec
 SCC setup                      ...        0 min,  0.000 sec (  0.202%)
 Dispersion                     ...        0 min,  0.000 sec (  0.313%)
 integral evaluation            ...        0 min,  0.016 sec ( 15.471%)
 zeroth order Hamiltonian       ...        0 min,  0.000 sec (  0.179%)
 iterations                     ...        0 min,  0.043 sec ( 42.190%)
 molecular gradient             ...        0 min,  0.042 sec ( 41.297%)
 printout                       ...        0 min,  0.000 sec (  0.332%)

         :::::::::::::::::::::::::::::::::::::::::::::::::::::
         ::                     SUMMARY                     ::
         :::::::::::::::::::::::::::::::::::::::::::::::::::::
         :: total energy             -48.677488886022 Eh    ::
         :: gradient norm              0.418351963500 Eh/a0 ::
         :: HOMO-LUMO gap              2.062819060275 eV    ::
         ::.................................................::
         :: SCC energy               -49.437448285698 Eh    ::
         :: -> isotropic ES            0.030758253244 Eh    ::
         :: -> anisotropic ES          0.003870867443 Eh    ::
         :: -> anisotropic XC          0.089103059512 Eh    ::
         :: -> dispersion             -0.032265372398 Eh    ::
         :: repulsion energy           0.759927475973 Eh    ::
         :: add. restraining           0.000000000000 Eh    ::
         :::::::::::::::::::::::::::::::::::::::::::::::::::::

      ----------------------------------------------------------- 
     |                   =====================                   |
     |                        A N C O P T                        |
     |                   =====================                   |
     |               Approximate Normal Coordinate               |
     |                Rational Function Optimizer                |
      ----------------------------------------------------------- 

          ...................................................
          :                      SETUP                      :
          :.................................................:
          :   optimization level            normal          :
          :   max. optcycles                   200          :
          :   ANC micro-cycles                  20          :
          :   degrees of freedom                72          :
          :.................................................:
          :   RF solver                   davidson          :
          :   input Hessian                  false          :
          :   write xtbopt.log                true          :
          :   linear?                        false          :
          :   energy convergence         0.5000000E-05 Eh   :
          :   grad. convergence          0.1000000E-02 Eh/α :
          :   maximium RF displ.         2.0000000          :
          :   Hlow (freq-cutoff)         0.5000000E-02      :
          :   Hmax (freq-cutoff)         5.0000000          :
          :   S6 in model hess.         20.0000000          :
          ...................................................

generating ANC from model Hessian ...
Using Lindh-Hessian (1995)
 Shifting diagonal of input Hessian by   5.305101876880416E-003
 Lowest  eigenvalues of input Hessian
    0.005000    0.005208   -0.000000   -0.000000    0.000000    0.000000
    0.000000    0.000000    0.005350    0.005749    0.006711    0.006866
    0.007360    0.008230    0.008872    0.010080    0.010567    0.013864
 Highest eigenvalues
    1.917048    1.937464    1.953639    1.999540    2.001754    2.534940
 

........................................................................
.............................. CYCLE    1 ..............................
........................................................................
   1    -49.4374483 -0.494374E+02  0.164E-04    2.06       0.0  T
   2    -49.4374483  0.109461E-08  0.237E-04    2.06      82.6  T
   3    -49.4374483 -0.164854E-08  0.472E-05    2.06     415.4  T
     SCC iter.                  ...        0 min,  0.018 sec
     gradient                   ...        0 min,  0.029 sec
 * total energy  :   -48.6774889 Eh     change        0.2583338E-07 Eh
   gradient norm :     0.4183530 Eh/α   predicted     0.0000000E+00 (-100.00%)
   displ. norm   :     0.4931097 α      lambda       -0.1401874E+00
   maximum displ.:     0.2793470 α      in ANC's #27, #28, #40, ...

........................................................................
.............................. CYCLE    2 ..............................
........................................................................
   1    -49.7019296 -0.497019E+02  0.646E-01    2.16       0.0  T
   2    -49.7023314 -0.401848E-03  0.387E-01    2.16       1.0  T
   3    -49.7012432  0.108826E-02  0.317E-01    2.16       1.0  T
   4    -49.7029007 -0.165753E-02  0.582E-02    2.16       1.0  T
   5    -49.7029897 -0.890214E-04  0.228E-02    2.16       1.0  T
   6    -49.7029998 -0.100646E-04  0.102E-02    2.16       1.9  T
   7    -49.7030005 -0.757724E-06  0.495E-03    2.16       4.0  T
   8    -49.7030007 -0.169411E-06  0.184E-03    2.16      10.7  T
     SCC iter.                  ...        0 min,  0.012 sec
     gradient                   ...        0 min,  0.014 sec
 * total energy  :   -48.7708227 Eh     change       -0.9333388E-01 Eh
   gradient norm :     0.0766760 Eh/α   predicted    -0.8713748E-01 (  -6.64%)
   displ. norm   :     0.5185225 α      lambda       -0.3264400E-01
   maximum displ.:     0.3485970 α      in ANC's #27, #28, #26, ...

........................................................................
.............................. CYCLE    3 ..............................
........................................................................
   1    -49.8105882 -0.498106E+02  0.391E-01    2.15       0.0  T
   2    -49.8105360  0.522324E-04  0.272E-01    2.14       1.0  T
   3    -49.8105549 -0.189211E-04  0.178E-01    2.16       1.0  T
   4    -49.8110162 -0.461325E-03  0.303E-02    2.15       1.0  T
   5    -49.8110361 -0.198888E-04  0.102E-02    2.15       1.9  T
   6    -49.8110367 -0.589635E-06  0.507E-03    2.15       3.9  T
   7    -49.8110369 -0.208907E-06  0.169E-03    2.15      11.6  T
     SCC iter.                  ...        0 min,  0.010 sec
     gradient                   ...        0 min,  0.015 sec
 * total energy  :   -48.7926128 Eh     change       -0.2179006E-01 Eh
   gradient norm :     0.0633352 Eh/α   predicted    -0.2071045E-01 (  -4.95%)
   displ. norm   :     0.3749633 α      lambda       -0.9942692E-02
   maximum displ.:     0.2449122 α      in ANC's #27, #5, #28, ...

........................................................................
.............................. CYCLE    4 ..............................
........................................................................
   1    -49.8251013 -0.498251E+02  0.401E-01    2.09       0.0  T
   2    -49.8251698 -0.684589E-04  0.260E-01    2.08       1.0  T
   3    -49.8245939  0.575891E-03  0.189E-01    2.10       1.0  T
   4    -49.8254083 -0.814419E-03  0.273E-02    2.09       1.0  T
   5    -49.8254211 -0.127438E-04  0.126E-02    2.09       1.6  T
   6    -49.8254234 -0.231921E-05  0.603E-03    2.09       3.3  T
   7    -49.8254237 -0.291188E-06  0.202E-03    2.09       9.7  T
   8    -49.8254237 -0.547431E-07  0.789E-04    2.09      24.9  T
     SCC iter.                  ...        0 min,  0.025 sec
     gradient                   ...        0 min,  0.028 sec
 * total energy  :   -48.7966193 Eh     change       -0.4006478E-02 Eh
   gradient norm :     0.0534556 Eh/α   predicted    -0.5670331E-02 (  41.53%)
   displ. norm   :     0.3521651 α      lambda       -0.3518401E-02
   maximum displ.:     0.1504741 α      in ANC's #10, #11, #14, ...

........................................................................
.............................. CYCLE    5 ..............................
........................................................................
   1    -49.8265394 -0.498265E+02  0.595E-01    2.06       0.0  T
   2    -49.8267215 -0.182033E-03  0.333E-01    2.06       1.0  T
   3    -49.8265815  0.140001E-03  0.906E-02    2.06       1.0  T
   4    -49.8267785 -0.197015E-03  0.221E-02    2.06       1.0  T
   5    -49.8267863 -0.779872E-05  0.955E-03    2.06       2.1  T
   6    -49.8267877 -0.144900E-05  0.478E-03    2.06       4.1  T
   7    -49.8267879 -0.192937E-06  0.239E-03    2.06       8.2  T
     SCC iter.                  ...        0 min,  0.010 sec
     gradient                   ...        0 min,  0.041 sec
 * total energy  :   -48.7934112 Eh     change        0.3208100E-02 Eh
   gradient norm :     0.0843197 Eh/α   predicted    -0.1977378E-02 (-161.64%)
   displ. norm   :     0.2753376 α      lambda       -0.8941901E-02
   maximum displ.:     0.1180108 α      in ANC's #6, #3, #10, ...

........................................................................
.............................. CYCLE    6 ..............................
........................................................................
   1    -49.8510568 -0.498511E+02  0.466E-01    2.09       0.0  T
   2    -49.8511874 -0.130684E-03  0.261E-01    2.09       1.0  T
   3    -49.8510120  0.175397E-03  0.844E-02    2.08       1.0  T
   4    -49.8512305 -0.218478E-03  0.191E-02    2.09       1.0  T
   5    -49.8512379 -0.733092E-05  0.579E-03    2.09       3.4  T
   6    -49.8512380 -0.165910E-06  0.319E-03    2.09       6.2  T
   7    -49.8512381 -0.740502E-07  0.154E-03    2.09      12.7  T
     SCC iter.                  ...        0 min,  0.010 sec
     gradient                   ...        0 min,  0.015 sec
 * total energy  :   -48.7963998 Eh     change       -0.2988595E-02 Eh
   gradient norm :     0.0542132 Eh/α   predicted    -0.4809899E-02 (  60.94%)
   displ. norm   :     0.4626415 α      lambda       -0.6635856E-02
   maximum displ.:     0.2289340 α      in ANC's #5, #11, #10, ...

........................................................................
.............................. CYCLE    7 ..............................
........................................................................
   1    -49.7871973 -0.497872E+02  0.788E-01    2.08       0.0  T
   2    -49.7873458 -0.148502E-03  0.458E-01    2.09       1.0  T
   3    -49.7840642  0.328165E-02  0.407E-01    2.08       1.0  T
   4    -49.7880370 -0.397283E-02  0.481E-02    2.09       1.0  T
   5    -49.7880790 -0.419806E-04  0.264E-02    2.08       1.0  T
   6    -49.7880895 -0.104760E-04  0.110E-02    2.09       1.8  T
   7    -49.7880901 -0.656928E-06  0.505E-03    2.09       3.9  T
   8    -49.7880905 -0.339549E-06  0.170E-03    2.09      11.5  T
     SCC iter.                  ...        0 min,  0.012 sec
     gradient                   ...        0 min,  0.015 sec
 * total energy  :   -48.7881003 Eh     change        0.8299475E-02 Eh
   gradient norm :     0.1590171 Eh/α   predicted    -0.4028094E-02 (-148.53%)
   displ. norm   :     0.3155911 α      lambda       -0.2323811E-01
   maximum displ.:     0.1809625 α      in ANC's #5, #11, #27, ...

........................................................................
.............................. CYCLE    8 ..............................
........................................................................
   1    -49.8323485 -0.498323E+02  0.668E-01    2.10       0.0  T
   2    -49.8325929 -0.244400E-03  0.376E-01    2.09       1.0  T
   3    -49.8314888  0.110417E-02  0.231E-01    2.10       1.0  T
   4    -49.8327759 -0.128715E-02  0.262E-02    2.09       1.0  T
   5    -49.8327906 -0.147012E-04  0.114E-02    2.10       1.7  T
   6    -49.8327933 -0.264045E-05  0.506E-03    2.10       3.9  T
   7    -49.8327934 -0.184347E-06  0.268E-03    2.10       7.3  T
     SCC iter.                  ...        0 min,  0.023 sec
     gradient                   ...        0 min,  0.028 sec
 * total energy  :   -48.7976710 Eh     change       -0.9570718E-02 Eh
   gradient norm :     0.0167959 Eh/α   predicted    -0.1277629E-01 (  33.49%)
   displ. norm   :     0.2132515 α      lambda       -0.9485098E-03
   maximum displ.:     0.0923368 α      in ANC's #5, #10, #1, ...

........................................................................
.............................. CYCLE    9 ..............................
........................................................................
   1    -49.8325428 -0.498325E+02  0.314E-01    2.08       0.0  T
   2    -49.8325741 -0.313307E-04  0.176E-01    2.08       1.0  T
   3    -49.8324906  0.835176E-04  0.633E-02    2.08       1.0  T
   4    -49.8325955 -0.104886E-03  0.836E-03    2.08       2.3  T
   5    -49.8325953  0.172730E-06  0.632E-03    2.08       3.1  T
   6    -49.8325960 -0.646858E-06  0.157E-03    2.08      12.5  T
   7    -49.8325960 -0.128033E-07  0.595E-04    2.08      32.9  T
     SCC iter.                  ...        0 min,  0.023 sec
     gradient                   ...        0 min,  0.028 sec
 * total energy  :   -48.7963565 Eh     change        0.1314556E-02 Eh
   gradient norm :     0.0319003 Eh/α   predicted    -0.4958217E-03 (-137.72%)
   displ. norm   :     0.1767306 α      lambda       -0.3229555E-02
   maximum displ.:     0.0706898 α      in ANC's #1, #7, #4, ...

........................................................................
.............................. CYCLE   10 ..............................
........................................................................
   1    -49.8406596 -0.498407E+02  0.288E-01    2.09       0.0  T
   2    -49.8406890 -0.293430E-04  0.160E-01    2.09       1.0  T
   3    -49.8406594  0.296149E-04  0.413E-02    2.09       1.0  T
   4    -49.8407040 -0.446171E-04  0.688E-03    2.09       2.8  T
   5    -49.8407042 -0.251728E-06  0.399E-03    2.09       4.9  T
   6    -49.8407044 -0.169776E-06  0.157E-03    2.09      12.5  T
     SCC iter.                  ...        0 min,  0.009 sec
     gradient                   ...        0 min,  0.028 sec
 * total energy  :   -48.7977945 Eh     change       -0.1438048E-02 Eh
   gradient norm :     0.0141247 Eh/α   predicted    -0.1665215E-02 (  15.80%)
   displ. norm   :     0.2015534 α      lambda       -0.8013285E-03
   maximum displ.:     0.1320203 α      in ANC's #11, #5, #2, ...

........................................................................
.............................. CYCLE   11 ..............................
........................................................................
   1    -49.8274720 -0.498275E+02  0.276E-01    2.09       0.0  T
   2    -49.8274957 -0.236855E-04  0.154E-01    2.09       1.0  T
   3    -49.8273686  0.127158E-03  0.791E-02    2.09       1.0  T
   4    -49.8275207 -0.152155E-03  0.799E-03    2.09       2.5  T
   5    -49.8275215 -0.743585E-06  0.483E-03    2.09       4.1  T
   6    -49.8275217 -0.220384E-06  0.130E-03    2.09      15.0  T
   7    -49.8275217 -0.147509E-07  0.468E-04    2.09      41.9  T
     SCC iter.                  ...        0 min,  0.023 sec
     gradient                   ...        0 min,  0.028 sec
 * total energy  :   -48.7969202 Eh     change        0.8742906E-03 Eh
   gradient norm :     0.0252182 Eh/α   predicted    -0.4169430E-03 (-147.69%)
   displ. norm   :     0.1783231 α      lambda       -0.2271964E-02
   maximum displ.:     0.1105702 α      in ANC's #10, #2, #11, ...

........................................................................
.............................. CYCLE   12 ..............................
........................................................................
   1    -49.8316222 -0.498316E+02  0.291E-01    2.10       0.0  T
   2    -49.8316520 -0.297829E-04  0.161E-01    2.10       1.0  T
   3    -49.8316534 -0.143522E-05  0.234E-02    2.10       1.0  T
   4    -49.8316657 -0.122434E-04  0.533E-03    2.10       3.7  T
   5    -49.8316657 -0.424978E-07  0.329E-03    2.10       6.0  T
   6    -49.8316658 -0.137649E-06  0.108E-03    2.10      18.1  T
     SCC iter.                  ...        0 min,  0.022 sec
     gradient                   ...        0 min,  0.028 sec
 * total energy  :   -48.7977458 Eh     change       -0.8255518E-03 Eh
   gradient norm :     0.0182986 Eh/α   predicted    -0.1172108E-02 (  41.98%)
   displ. norm   :     0.2140436 α      lambda       -0.1075426E-02
   maximum displ.:     0.1164086 α      in ANC's #5, #10, #21, ...

........................................................................
.............................. CYCLE   13 ..............................
........................................................................
   1    -49.8449695 -0.498450E+02  0.170E-01    2.09       0.0  T
   2    -49.8449800 -0.105440E-04  0.983E-02    2.09       1.0  T
   3    -49.8449246  0.554099E-04  0.663E-02    2.09       1.0  T
   4    -49.8450001 -0.754789E-04  0.630E-03    2.09       3.1  T
   5    -49.8450004 -0.302588E-06  0.420E-03    2.09       4.7  T
   6    -49.8450006 -0.222285E-06  0.177E-03    2.09      11.1  T
   7    -49.8450006 -0.375831E-07  0.407E-04    2.09      48.2  T
     SCC iter.                  ...        0 min,  0.023 sec
     gradient                   ...        0 min,  0.028 sec
 * total energy  :   -48.7973455 Eh     change        0.4002250E-03 Eh
   gradient norm :     0.0330551 Eh/α   predicted    -0.5623509E-03 (-240.51%)
   displ. norm   :     0.1235834 α      lambda       -0.1234550E-02
   maximum displ.:     0.0501298 α      in ANC's #5, #20, #21, ...

........................................................................
.............................. CYCLE   14 ..............................
........................................................................
   1    -49.8371758 -0.498372E+02  0.100E-01    2.10       0.0  T
   2    -49.8371786 -0.280484E-05  0.594E-02    2.10       1.0  T
   3    -49.8371553  0.233247E-04  0.424E-02    2.10       1.0  T
   4    -49.8371864 -0.311503E-04  0.476E-03    2.10       4.1  T
   5    -49.8371868 -0.363879E-06  0.270E-03    2.10       7.3  T
   6    -49.8371869 -0.882599E-07  0.102E-03    2.10      19.2  T
     SCC iter.                  ...        0 min,  0.009 sec
     gradient                   ...        0 min,  0.015 sec
 * total energy  :   -48.7979733 Eh     change       -0.6277253E-03 Eh
   gradient norm :     0.0023274 Eh/α   predicted    -0.6267083E-03 (  -0.16%)
   displ. norm   :     0.0339907 α      lambda       -0.2620878E-04
   maximum displ.:     0.0188657 α      in ANC's #11, #10, #20, ...

........................................................................
.............................. CYCLE   15 ..............................
........................................................................
   1    -49.8356619 -0.498357E+02  0.372E-02    2.10       0.0  T
   2    -49.8356623 -0.352975E-06  0.213E-02    2.10       1.0  T
   3    -49.8356589  0.336726E-05  0.131E-02    2.10       1.5  T
   4    -49.8356629 -0.396494E-05  0.138E-03    2.10      14.2  T
   5    -49.8356629 -0.251866E-07  0.832E-04    2.10      23.6  T
   6    -49.8356629 -0.701684E-08  0.288E-04    2.10      68.1  T
     SCC iter.                  ...        0 min,  0.009 sec
     gradient                   ...        0 min,  0.016 sec
 * total energy  :   -48.7979761 Eh     change       -0.2880387E-05 Eh
   gradient norm :     0.0033747 Eh/α   predicted    -0.1312370E-04 ( 355.62%)
   displ. norm   :     0.0160112 α      lambda       -0.1488645E-04
   maximum displ.:     0.0106182 α      in ANC's #5, #20, #15, ...

........................................................................
.............................. CYCLE   16 ..............................
........................................................................
   1    -49.8362273 -0.498362E+02  0.165E-02    2.10       0.0  T
   2    -49.8362274 -0.675386E-07  0.937E-03    2.10       2.1  T
   3    -49.8362271  0.326957E-06  0.428E-03    2.10       4.6  T
   4    -49.8362275 -0.391514E-06  0.502E-04    2.10      39.1  T
   5    -49.8362275  0.451770E-09  0.383E-04    2.10      51.2  T
     SCC iter.                  ...        0 min,  0.021 sec
     gradient                   ...        0 min,  0.029 sec
 * total energy  :   -48.7979848 Eh     change       -0.8618208E-05 Eh
   gradient norm :     0.0010544 Eh/α   predicted    -0.7448949E-05 ( -13.57%)
   displ. norm   :     0.0154004 α      lambda       -0.2723301E-05
   maximum displ.:     0.0119220 α      in ANC's #5, #13, #7, ...

........................................................................
.............................. CYCLE   17 ..............................
........................................................................
   1    -49.8367316 -0.498367E+02  0.184E-02    2.10       0.0  T
   2    -49.8367317 -0.804842E-07  0.103E-02    2.10       1.9  T
   3    -49.8367310  0.661947E-06  0.546E-03    2.10       3.6  T
   4    -49.8367318 -0.769780E-06  0.473E-04    2.10      41.5  T
   5    -49.8367318 -0.293599E-08  0.285E-04    2.10      68.9  T
     SCC iter.                  ...        0 min,  0.021 sec
     gradient                   ...        0 min,  0.029 sec
 * total energy  :   -48.7979868 Eh     change       -0.2012508E-05 Eh
   gradient norm :     0.0006108 Eh/α   predicted    -0.1362955E-05 ( -32.28%)
   displ. norm   :     0.0106497 α      lambda       -0.9482218E-06
   maximum displ.:     0.0047326 α      in ANC's #10, #5, #14, ...

   *** GEOMETRY OPTIMIZATION CONVERGED AFTER 17 ITERATIONS ***

------------------------------------------------------------------------
 total energy gain   :        -0.1204979 Eh      -75.6136 kcal/mol
 total RMSD          :         0.2760746 a0        0.1461 Å
 total power (kW/mol):       -18.6098338 (step) -274.4373 (real)
------------------------------------------------------------------------

 ANCopt (total)                0 d,  0 h,  0 min,  1.153 sec
 optimizer setup                ...        0 min,  0.000 sec (  0.006%)
 model hessian                  ...        0 min,  0.003 sec (  0.252%)
 ANC generation                 ...        0 min,  0.001 sec (  0.056%)
 coordinate transformation      ...        0 min,  0.000 sec (  0.010%)
 single point calculation       ...        0 min,  1.145 sec ( 99.333%)
 optimization log               ...        0 min,  0.001 sec (  0.094%)
 hessian update                 ...        0 min,  0.000 sec (  0.009%)
 rational function              ...        0 min,  0.002 sec (  0.204%)

================
 final structure:
================
$coord
    0.97789352086392    3.53557549639819   -0.00781091388858      C 
    3.50776086087337    2.86367369481393   -0.01119899829674      C 
    4.23490690408217    0.34168835517447   -0.00934450293947      C 
    2.45104327332764   -1.57392084823310   -0.00495562431090      C 
   -0.09286466941687   -0.93175807086910   -0.00200314327141      C 
   -0.83372327504268    1.63770914094251   -0.00273194342502      C 
   -3.57154581869464    1.78891499699558    0.00267310639219      C 
   -4.98055391659944    3.94770248422137    0.00575046750032      C 
   -3.95373698793038    6.41528071630478    0.00323715189916      C 
   -3.25671167698677    8.46783246690651    0.00157522028964      N 
   -7.64827625971200    4.07945340000027    0.00620858941350      C 
   -9.79793712865411    4.36091185606970    0.00509289594928      N 
   -4.53691972296965   -0.82151392914280    0.00464616134850      C 
   -2.32987034985934   -2.51739804156645    0.00323643793052      C 
   -2.37351005469756   -5.09485750902652    0.00559655340320      C 
   -4.56099057522515   -6.62780871429386    0.01237749117370      C 
   -6.22749339678036   -8.01455388720726    0.01810507415271      N 
   -0.19084502486914   -6.63712635224855    0.00037902200168      C 
    1.49215770569773   -8.00262099347666   -0.00342863737849      N 
   -6.96584891585985   -1.52215631528706    0.00936064621163      C 
    0.44745295334946    5.50092552539577   -0.00898827210209      H 
    4.92994528195723    4.32517190956877   -0.01533461788206      H 
    6.21689771629722   -0.13819218434410   -0.01155276909907      H 
    3.04809091084803   -3.52014021685752   -0.00355311698755      H 
   -8.47671222773928   -0.16397597735793    0.01005691825221      H 
   -7.52041424426482   -3.47653889516309    0.01114501522608      H 
$end
           -------------------------------------------------
          |                Final Singlepoint                |
           -------------------------------------------------

          ...................................................
          :                      SETUP                      :
          :.................................................:
          :  # basis functions                  86          :
          :  # atomic orbitals                  86          :
          :  # shells                           46          :
          :  # electrons                        90          :
          :  max. iterations                   250          :
          :  Hamiltonian                  GFN2-xTB          :
          :  restarted?                      false          :
          :  GBSA solvation                  false          :
          :  PC potential                    false          :
          :  electronic temp.          300.0000000     K    :
          :  accuracy                    1.0000000          :
          :  -> integral cutoff          0.2500000E+02      :
          :  -> integral neglect         0.1000000E-07      :
          :  -> SCF convergence          0.1000000E-05 Eh   :
          :  -> wf. convergence          0.1000000E-03 e    :
          :  Broyden damping             0.4000000          :
          ...................................................

 iter      E             dE          RMSdq      gap      omega  full diag
   1    -49.8367318 -0.498367E+02  0.129E-04    2.10       0.0  T
   2    -49.8367318 -0.323865E-10  0.979E-05    2.10     200.4  T
   3    -49.8367318 -0.233477E-09  0.421E-05    2.10     465.9  T

   *** convergence criteria satisfied after 3 iterations ***

         #    Occupation            Energy/Eh            Energy/eV
      -------------------------------------------------------------
         1        2.0000           -0.7170137             -19.5109
       ...           ...                  ...                  ...
        39        2.0000           -0.4597844             -12.5114
        40        2.0000           -0.4575680             -12.4511
        41        2.0000           -0.4570993             -12.4383
        42        2.0000           -0.4478938             -12.1878
        43        2.0000           -0.4462221             -12.1423
        44        2.0000           -0.4449593             -12.1080
        45        2.0000           -0.4279023             -11.6438 (HOMO)
        46                         -0.3507213              -9.5436 (LUMO)
        47                         -0.3464479              -9.4273
        48                         -0.2691708              -7.3245
        49                         -0.2618454              -7.1252
        50                         -0.2591503              -7.0518
       ...                                ...                  ...
        86                          1.1452989              31.1652
      -------------------------------------------------------------
                  HL-Gap            0.0771810 Eh            2.1002 eV
             Fermi-level           -0.3893118 Eh          -10.5937 eV

 SCC (total)                   0 d,  0 h,  0 min,  0.076 sec
 SCC setup                      ...        0 min,  0.000 sec (  0.210%)
 Dispersion                     ...        0 min,  0.000 sec (  0.294%)
 integral evaluation            ...        0 min,  0.042 sec ( 54.615%)
 zeroth order Hamiltonian       ...        0 min,  0.000 sec (  0.239%)
 iterations                     ...        0 min,  0.005 sec (  6.108%)
 molecular gradient             ...        0 min,  0.029 sec ( 38.100%)
 printout                       ...        0 min,  0.000 sec (  0.413%)

         :::::::::::::::::::::::::::::::::::::::::::::::::::::
         ::                     SUMMARY                     ::
         :::::::::::::::::::::::::::::::::::::::::::::::::::::
         :: total energy             -48.797986816435 Eh    ::
         :: gradient norm              0.000611211844 Eh/a0 ::
         :: HOMO-LUMO gap              2.100202218324 eV    ::
         ::.................................................::
         :: SCC energy               -49.836731812358 Eh    ::
         :: -> isotropic ES            0.032799699714 Eh    ::
         :: -> anisotropic ES          0.003388906198 Eh    ::
         :: -> anisotropic XC          0.080884880604 Eh    ::
         :: -> dispersion             -0.033547877103 Eh    ::
         :: repulsion energy           1.038701869994 Eh    ::
         :: add. restraining           0.000000000000 Eh    ::
         :::::::::::::::::::::::::::::::::::::::::::::::::::::

           -------------------------------------------------
          |                Property Printout                |
           -------------------------------------------------

    * Orbital Energies and Occupations

         #    Occupation            Energy/Eh            Energy/eV
      -------------------------------------------------------------
         1        2.0000           -0.7170137             -19.5109
       ...           ...                  ...                  ...
        33        2.0000           -0.4993780             -13.5888
        34        2.0000           -0.4987641             -13.5721
        35        2.0000           -0.4859591             -13.2236
        36        2.0000           -0.4814467             -13.1008
        37        2.0000           -0.4751477             -12.9294
        38        2.0000           -0.4669476             -12.7063
        39        2.0000           -0.4597844             -12.5114
        40        2.0000           -0.4575680             -12.4511
        41        2.0000           -0.4570993             -12.4383
        42        2.0000           -0.4478938             -12.1878
        43        2.0000           -0.4462221             -12.1423
        44        2.0000           -0.4449593             -12.1080
        45        2.0000           -0.4279023             -11.6438 (HOMO)
        46                         -0.3507213              -9.5436 (LUMO)
        47                         -0.3464479              -9.4273
        48                         -0.2691708              -7.3245
        49                         -0.2618454              -7.1252
        50                         -0.2591503              -7.0518
        51                         -0.2475065              -6.7350
        52                         -0.2349061              -6.3921
        53                         -0.2348380              -6.3903
        54                         -0.2123687              -5.7788
        55                         -0.2111100              -5.7446
        56                         -0.2073927              -5.6434
       ...                                ...                  ...
        86                          1.1452989              31.1652
      -------------------------------------------------------------
                  HL-Gap            0.0771810 Eh            2.1002 eV
             Fermi-level           -0.3893118 Eh          -10.5937 eV

     #   Z        covCN         q      C6AA      α(0)
     1   6 C      2.912    -0.025    28.623     8.773
     2   6 C      2.920    -0.016    28.419     8.742
     3   6 C      2.920    -0.016    28.419     8.742
     4   6 C      2.912    -0.025    28.623     8.773
     5   6 C      3.040     0.009    27.775     8.644
     6   6 C      3.040     0.009    27.775     8.644
     7   6 C      3.016     0.032    27.275     8.567
     8   6 C      2.947     0.016    27.644     8.623
     9   6 C      1.946     0.125    28.013     8.547
    10   7 N      0.911    -0.217    25.731     7.336
    11   6 C      1.944     0.124    28.038     8.551
    12   7 N      0.911    -0.216    25.719     7.335
    13   6 C      3.002     0.013    27.700     8.633
    14   6 C      3.016     0.032    27.275     8.567
    15   6 C      2.947     0.016    27.644     8.623
    16   6 C      1.944     0.124    28.039     8.551
    17   7 N      0.911    -0.216    25.718     7.335
    18   6 C      1.946     0.125    28.011     8.547
    19   7 N      0.911    -0.217    25.730     7.336
    20   6 C      2.840    -0.068    29.679     8.928
    21   1 H      0.926     0.060     2.201     2.320
    22   1 H      0.926     0.056     2.247     2.344
    23   1 H      0.926     0.056     2.247     2.344
    24   1 H      0.926     0.060     2.201     2.320
    25   1 H      0.926     0.080     1.984     2.203
    26   1 H      0.926     0.079     1.984     2.203

 Mol. C6AA /au·bohr⁶  :      12931.504711
 Mol. C8AA /au·bohr⁸  :     337697.195370
 Mol. α(0) /au        :        181.532186


Wiberg/Mayer (AO) data.
largest (>0.10) Wiberg bond orders for each atom
          total WBO             WBO to atom ...
     1  C   3.978        C    2 1.441    C    6 1.389    H   21 0.960
     2  C   3.968        C    1 1.441    C    3 1.416    H   22 0.969
     3  C   3.968        C    4 1.441    C    2 1.416    H   23 0.969
     4  C   3.978        C    3 1.441    C    5 1.389    H   24 0.960
     5  C   3.980        C    4 1.389    C    6 1.265    C   14 1.114
     6  C   3.980        C    1 1.389    C    5 1.265    C    7 1.114
     7  C   3.980        C    8 1.533    C    6 1.114    C   13 1.067
     8  C   3.978        C    7 1.533    C   11 1.088    C    9 1.086
     9  C   3.948        N   10 2.777    C    8 1.086
    10  N   2.985        C    9 2.777
    11  C   3.948        N   12 2.773    C    8 1.088
    12  N   2.984        C   11 2.773
    13  C   3.988        C   20 1.777    C    7 1.067    C   14 1.067
    14  C   3.980        C   15 1.533    C    5 1.114    C   13 1.067
    15  C   3.978        C   14 1.533    C   16 1.088    C   18 1.086
    16  C   3.948        N   17 2.773    C   15 1.088
    17  N   2.984        C   16 2.773
    18  C   3.948        N   19 2.778    C   15 1.086
    19  N   2.985        C   18 2.778
    20  C   3.930        C   13 1.777    H   25 0.960    H   26 0.960
    21  H   0.996        C    1 0.960
    22  H   0.996        C    2 0.969
    23  H   0.996        C    3 0.969
    24  H   0.996        C    4 0.960
    25  H   0.993        C   20 0.960
    26  H   0.993        C   20 0.960

molecular dipole:
                 x           y           z       tot (Debye)
 q only:        1.261       0.364      -0.002
   full:        1.526       0.441      -0.002       4.038
molecular quadrupole (traceless):
                xx          xy          yy          xz          yz          zz
 q only:        3.730       8.580     -20.129       0.008       0.009      16.400
  q+dip:        4.641      10.585     -24.880       0.006       0.011      20.238
   full:       -0.346      10.159     -28.527       0.027       0.021      28.873

           -------------------------------------------------
          |                Geometry Summary                 |
           -------------------------------------------------

      molecular mass/u    :      254.2502000
   center of mass at/Å    :       -1.2931041      -0.1155613       0.0009695
  moments of inertia/u·Å² :        0.1000423E+04   0.1691783E+04   0.2692206E+04
rotational constants/cm⁻¹ :        0.1685050E-01   0.9964416E-02   0.6261643E-02

 * 19 selected distances

     #   Z        #   Z                                     value/Å
     1   6 C      2   6 C                                 1.3851605
     2   6 C      3   6 C                                 1.3889421
     3   6 C      4   6 C                                 1.3851661
     4   6 C      5   6 C                                 1.3884072
     1   6 C      6   6 C                                 1.3884101
     5   6 C      6   6 C                                 1.4150950 (max)
     7   6 C      8   6 C                                 1.3641772
     9   6 C     10   7 N                                 1.1470844
    11   6 C     12   7 N                                 1.1472609
    14   6 C     15   6 C                                 1.3641290
    16   6 C     17   7 N                                 1.1472688
    18   6 C     19   7 N                                 1.1468735
    13   6 C     20   6 C                                 1.3377428
     1   6 C     21   1 H                                 1.0772325
     2   6 C     22   1 H                                 1.0791328
     3   6 C     23   1 H                                 1.0791296
     4   6 C     24   1 H                                 1.0772674
    20   6 C     25   1 H                                 1.0750718
    20   6 C     26   1 H                                 1.0750451 (min)

 * 3 distinct bonds (by element types)

   Z      Z             #   av. dist./Å        max./Å        min./Å
   1 H    6 C           6     1.0771465     1.0791328     1.0750451
   6 C    6 C           9     1.3796922     1.4150950     1.3377428
   6 C    7 N           4     1.1471219     1.1472688     1.1468735


optimized geometry written to: xtbopt.xyz


           -------------------------------------------------
          | TOTAL ENERGY              -48.797986816435 Eh   |
          | GRADIENT NORM               0.000611211844 Eh/α |
          | HOMO-LUMO GAP               2.100202218324 eV   |
           -------------------------------------------------

------------------------------------------------------------------------
 * finished run on 2021/02/19 at 08:09:54.937     
------------------------------------------------------------------------
 total:
 * wall-time:     0 d,  0 h,  0 min,  1.399 sec
 *  cpu-time:     0 d,  0 h,  0 min,  0.812 sec
 * ratio c/w:     0.581 speedup
 SCF:
 * wall-time:     0 d,  0 h,  0 min,  0.101 sec
 *  cpu-time:     0 d,  0 h,  0 min,  0.053 sec
 * ratio c/w:     0.525 speedup
 ANC optimizer:
 * wall-time:     0 d,  0 h,  0 min,  1.229 sec
 *  cpu-time:     0 d,  0 h,  0 min,  0.735 sec
 * ratio c/w:     0.598 speedup

