      -----------------------------------------------------------      
     |                   =====================                   |     
     |                           x T B                           |     
     |                   =====================                   |     
     |                         S. Grimme                         |     
     |          Mulliken Center for Theoretical Chemistry        |     
     |                    University of Bonn                     |     
     |                Version 6.2 RC2 (SAW190805)                |     
      -----------------------------------------------------------      

   This program is distributed in the hope that it will be useful,
   but WITHOUT ANY WARRANTY; without even the implied warranty of
   MERCHANTABILITY or FITNESS FOR A PARTICULAR PURPOSE.
   
   FOR NON-COMMERCIAL, ACADEMIA USE ONLY.
   
   Cite this work as:
   * S. Grimme, C. Bannwarth, P. Shushkov, J. Chem. Theory Comput., 2017,
     13, 1989-2009. DOI: 10.1021/acs.jctc.7b00118
   * C. Bannwarth, S. Ehlert and S. Grimme., J. Chem. Theory Comput., 2019,
     15, 1652-1671. DOI: 10.1021/acs.jctc.8b01176
   * P. Pracht, E. Caldeweyher, S. Ehlert, S. Grimme, ChemRxiv, 2019, preprint.
     DOI: 10.26434/chemrxiv.8326202.v1
   
   for DFT-D4:
   * E. Caldeweyher, C. Bannwarth and S. Grimme, J. Chem. Phys., 2017,
     147, 034112. DOI: 10.1063/1.4993215
   * E. Caldeweyher, S. Ehlert, A. Hansen, H. Neugebauer, S. Spicher,
     C. Bannwarth and S. Grimme, J. Chem. Phys., 2019, 150, 154122.
     DOI: 10.1063/1.5090222
   
   for sTDA-xTB:
   * S. Grimme and C. Bannwarth, J. Chem. Phys., 2016, 145, 054103.
     DOI: 10.1063/1.4959605
   
   in the mass-spec context:
   * V. Asgeirsson, C. Bauer and S. Grimme, Chem. Sci., 2017, 8, 4879.
     DOI: 10.1039/c7sc00601b
   
   for metadynamics refer to:
   * S. Grimme, J. Chem. Theory Comput., 2019, 155, 2847-2862
     DOI: 10.1021/acs.jctc.9b00143
   
   with help from (in alphabetical order)
   C. Bannwarth, F. Bohle, G. Brandenburg, E. Caldeweyher, M. Checinski,
   S. Dohm, S. Ehlert, S. Ehrlich, F. März, H. Neugebauer, J. Pisarek,
   P. Pracht, P. Shushkov, and S. Spicher.
   
 * started run on 2021/02/19 at 08:10:28.720     

           -------------------------------------------------
          |                Calculation Setup                |
           -------------------------------------------------

          program call               : /ihome/ghutchison/geoffh/xtb/xtb 20utl.xyz -opt
          hostname                   : smp-n135
          coordinate file            : 20utl.xyz
          omp threads                :                     1
          number of atoms            :                    35
          number of electrons        :                   112
          charge                     :                     0
          spin                       :                   0.0
          first test random number   :      0.21361036745686


########################################################################
# WARNING! Please study the warnings concerning your input carefully
#  - the use of '-opt' is discouraged, please use '--opt' next time
########################################################################

           ------------------------------------------------- 
          |                 G F N 2 - x T B                 |
          | Geometry, Frequencies, Noncovalent interactions |
          |            JCTC 2019 parametrisation            |
           ------------------------------------------------- 
             KAB for C  - Si     :                1.0500
             KAB for H  - Pd     :                0.9500
             k(s)              :                1.8500
             k(p)              :                2.2300
             k(d)              :                2.2300
             k(f)              :                2.0000
             kEN (H0ij)        :               -2.0000
             D4 a1             :                0.5200
             D4 a2             :                5.0000
             D4 s6             :                1.0000
             D4 s8             :                2.7000
             D4 s9             :                5.0000
             alphaj            :                2.0000

  Z AO/shell   Hii/eV     exponent
  1     Wed Apr 25 08:07:45 CEST 2018   EN: 2.200 GM2: 0.406  GM3: 0.0800  RAES: 1.40
     1s    -10.707211    1.230000
  6     Wed Apr 25 08:07:45 CEST 2018   EN: 2.550 GM2: 0.538  GM3: 0.1500  RAES: 3.00
     2s    -13.970922    2.096432
     2p    -10.063292    1.800000
  7     Wed Apr 25 08:07:45 CEST 2018   EN: 3.040 GM2: 0.461  GM3:-0.0640  RAES: 1.90
     2s    -16.686243    2.339881
     2p    -12.523956    2.014332
  8     Wed Apr 25 08:07:45 CEST 2018   EN: 3.440 GM2: 0.452  GM3:-0.0517  RAES: 1.80
     2s    -20.229985    2.439742
     2p    -15.503117    2.137023

           ------------------------------------------------- 
          |        Self-Consistent Charge Iterations        |
           ------------------------------------------------- 

          ...................................................
          :                      SETUP                      :
          :.................................................:
          :  # basis functions                 107          :
          :  # atomic orbitals                 107          :
          :  # shells                           59          :
          :  # electrons                       112          :
          :  max. iterations                   250          :
          :  Hamiltonian                  GFN2-xTB          :
          :  restarted?                      false          :
          :  GBSA solvation                  false          :
          :  PC potential                    false          :
          :  electronic temp.          300.0000000     K    :
          :  accuracy                    1.0000000          :
          :  -> integral cutoff          0.2500000E+02      :
          :  -> integral neglect         0.1000000E-07      :
          :  -> SCF convergence          0.1000000E-05 Eh   :
          :  -> wf. convergence          0.1000000E-03 e    :
          :  Broyden damping             0.4000000          :
          ...................................................

 iter      E             dE          RMSdq      gap      omega  full diag
   1    -61.9581595 -0.619582E+02  0.600E+00    2.56       0.0  T
   2    -61.8824205  0.757390E-01  0.423E+00    2.34       1.0  T
   3    -61.7715654  0.110855E+00  0.346E+00    2.51       1.0  T
   4    -62.0589273 -0.287362E+00  0.108E+00    2.36       1.0  T
   5    -62.0905744 -0.316471E-01  0.312E-01    2.32       1.0  T
   6    -62.0916720 -0.109765E-02  0.143E-01    2.33       1.0  T
   7    -62.0920233 -0.351255E-03  0.643E-02    2.34       1.0  T
   8    -62.0920773 -0.539770E-04  0.203E-02    2.34       1.0  T
   9    -62.0920810 -0.376758E-05  0.853E-03    2.34       2.0  T
  10    -62.0920819 -0.806397E-06  0.378E-03    2.34       4.5  T
  11    -62.0920821 -0.260933E-06  0.208E-03    2.34       8.1  T
  12    -62.0920822 -0.999454E-07  0.818E-04    2.34      20.7  T
  13    -62.0920822 -0.149016E-08  0.425E-04    2.34      39.7  T

   *** convergence criteria satisfied after 13 iterations ***

         #    Occupation            Energy/Eh            Energy/eV
      -------------------------------------------------------------
         1        2.0000           -0.7596858             -20.6721
       ...           ...                  ...                  ...
        50        2.0000           -0.4479349             -12.1889
        51        2.0000           -0.4384862             -11.9318
        52        2.0000           -0.4312855             -11.7359
        53        2.0000           -0.4302669             -11.7082
        54        2.0000           -0.4288092             -11.6685
        55        2.0000           -0.4247626             -11.5584
        56        2.0000           -0.4197401             -11.4217 (HOMO)
        57                         -0.3337563              -9.0820 (LUMO)
        58                         -0.2865325              -7.7969
        59                         -0.2709596              -7.3732
        60                         -0.2642615              -7.1909
        61                         -0.2556754              -6.9573
       ...                                ...                  ...
       107                          1.0808315              29.4109
      -------------------------------------------------------------
                  HL-Gap            0.0859838 Eh            2.3397 eV
             Fermi-level           -0.3767482 Eh          -10.2518 eV

 SCC (total)                   0 d,  0 h,  0 min,  0.082 sec
 SCC setup                      ...        0 min,  0.000 sec (  0.562%)
 Dispersion                     ...        0 min,  0.001 sec (  0.937%)
 integral evaluation            ...        0 min,  0.021 sec ( 25.957%)
 zeroth order Hamiltonian       ...        0 min,  0.000 sec (  0.438%)
 iterations                     ...        0 min,  0.030 sec ( 36.911%)
 molecular gradient             ...        0 min,  0.028 sec ( 34.552%)
 printout                       ...        0 min,  0.000 sec (  0.581%)

         :::::::::::::::::::::::::::::::::::::::::::::::::::::
         ::                     SUMMARY                     ::
         :::::::::::::::::::::::::::::::::::::::::::::::::::::
         :: total energy             -61.057421572319 Eh    ::
         :: gradient norm              0.267593930621 Eh/a0 ::
         :: HOMO-LUMO gap              2.339738646637 eV    ::
         ::.................................................::
         :: SCC energy               -62.092082217052 Eh    ::
         :: -> isotropic ES            0.039103448402 Eh    ::
         :: -> anisotropic ES          0.008439822658 Eh    ::
         :: -> anisotropic XC          0.075713490140 Eh    ::
         :: -> dispersion             -0.042977462891 Eh    ::
         :: repulsion energy           1.034000764657 Eh    ::
         :: add. restraining           0.000000000000 Eh    ::
         :::::::::::::::::::::::::::::::::::::::::::::::::::::

      ----------------------------------------------------------- 
     |                   =====================                   |
     |                        A N C O P T                        |
     |                   =====================                   |
     |               Approximate Normal Coordinate               |
     |                Rational Function Optimizer                |
      ----------------------------------------------------------- 

          ...................................................
          :                      SETUP                      :
          :.................................................:
          :   optimization level            normal          :
          :   max. optcycles                   200          :
          :   ANC micro-cycles                  20          :
          :   degrees of freedom                99          :
          :.................................................:
          :   RF solver                   davidson          :
          :   input Hessian                  false          :
          :   write xtbopt.log                true          :
          :   linear?                        false          :
          :   energy convergence         0.5000000E-05 Eh   :
          :   grad. convergence          0.1000000E-02 Eh/α :
          :   maximium RF displ.         2.0000000          :
          :   Hlow (freq-cutoff)         0.5000000E-02      :
          :   Hmax (freq-cutoff)         5.0000000          :
          :   S6 in model hess.         20.0000000          :
          ...................................................

generating ANC from model Hessian ...
Using Lindh-Hessian (1995)
 Shifting diagonal of input Hessian by   4.874160320555944E-003
 Lowest  eigenvalues of input Hessian
   -0.000000   -0.000000   -0.000000   -0.000000   -0.000000    0.000000
    0.005000    0.005172    0.005504    0.005632    0.005931    0.006184
    0.006523    0.007462    0.008525    0.010002    0.010844    0.012259
 Highest eigenvalues
    1.920575    1.926364    1.927315    2.064541    2.537219    2.579247
 

........................................................................
.............................. CYCLE    1 ..............................
........................................................................
   1    -62.0920822 -0.620921E+02  0.143E-04    2.34       0.0  T
   2    -62.0920822  0.190468E-09  0.136E-04    2.34     124.4  T
   3    -62.0920822 -0.477399E-09  0.705E-05    2.34     239.7  T
     SCC iter.                  ...        0 min,  0.008 sec
     gradient                   ...        0 min,  0.028 sec
 * total energy  :   -61.0574215 Eh     change        0.3406728E-07 Eh
   gradient norm :     0.2675954 Eh/α   predicted     0.0000000E+00 (-100.00%)
   displ. norm   :     0.3576056 α      lambda       -0.6298990E-01
   maximum displ.:     0.1274640 α      in ANC's #44, #22, #64, ...

........................................................................
.............................. CYCLE    2 ..............................
........................................................................
   1    -62.2400397 -0.622400E+02  0.417E-01    2.35       0.0  T
   2    -62.2402921 -0.252402E-03  0.254E-01    2.35       1.0  T
   3    -62.2401253  0.166785E-03  0.196E-01    2.38       1.0  T
   4    -62.2407522 -0.626912E-03  0.356E-02    2.36       1.0  T
   5    -62.2407895 -0.372316E-04  0.134E-02    2.37       1.3  T
   6    -62.2407935 -0.408732E-05  0.549E-03    2.36       3.1  T
   7    -62.2407936 -0.102113E-06  0.302E-03    2.36       5.6  T
     SCC iter.                  ...        0 min,  0.016 sec
     gradient                   ...        0 min,  0.026 sec
 * total energy  :   -61.0956333 Eh     change       -0.3821181E-01 Eh
   gradient norm :     0.0561906 Eh/α   predicted    -0.3552258E-01 (  -7.04%)
   displ. norm   :     0.3762649 α      lambda       -0.7977005E-02
   maximum displ.:     0.2000113 α      in ANC's #22, #13, #24, ...

........................................................................
.............................. CYCLE    3 ..............................
........................................................................
   1    -62.2738595 -0.622739E+02  0.216E-01    2.32       0.0  T
   2    -62.2739670 -0.107575E-03  0.154E-01    2.30       1.0  T
   3    -62.2742200 -0.252999E-03  0.887E-02    2.33       1.0  T
   4    -62.2742892 -0.691207E-04  0.326E-02    2.31       1.0  T
   5    -62.2743142 -0.250347E-04  0.125E-02    2.32       1.4  T
   6    -62.2743182 -0.398691E-05  0.302E-03    2.32       5.6  T
   7    -62.2743182 -0.404546E-07  0.235E-03    2.32       7.2  T
     SCC iter.                  ...        0 min,  0.016 sec
     gradient                   ...        0 min,  0.026 sec
 * total energy  :   -61.1008926 Eh     change       -0.5259277E-02 Eh
   gradient norm :     0.0269602 Eh/α   predicted    -0.4553182E-02 ( -13.43%)
   displ. norm   :     0.4270762 α      lambda       -0.3343619E-02
   maximum displ.:     0.2223603 α      in ANC's #8, #22, #13, ...

........................................................................
.............................. CYCLE    4 ..............................
........................................................................
   1    -62.2816436 -0.622816E+02  0.359E-01    2.29       0.0  T
   2    -62.2817572 -0.113615E-03  0.214E-01    2.26       1.0  T
   3    -62.2813133  0.443934E-03  0.158E-01    2.31       1.0  T
   4    -62.2819708 -0.657583E-03  0.306E-02    2.27       1.0  T
   5    -62.2819966 -0.257369E-04  0.114E-02    2.27       1.5  T
   6    -62.2819993 -0.270659E-05  0.432E-03    2.27       3.9  T
   7    -62.2819992  0.120949E-06  0.283E-03    2.27       6.0  T
     SCC iter.                  ...        0 min,  0.016 sec
     gradient                   ...        0 min,  0.026 sec
 * total energy  :   -61.1010491 Eh     change       -0.1564665E-03 Eh
   gradient norm :     0.0268487 Eh/α   predicted    -0.1976737E-02 (1163.36%)
   displ. norm   :     0.3220401 α      lambda       -0.3885840E-02
   maximum displ.:     0.1289514 α      in ANC's #8, #4, #7, ...

........................................................................
.............................. CYCLE    5 ..............................
........................................................................
   1    -62.2861638 -0.622862E+02  0.385E-01    2.27       0.0  T
   2    -62.2862419 -0.781473E-04  0.214E-01    2.26       1.0  T
   3    -62.2858630  0.378865E-03  0.111E-01    2.29       1.0  T
   4    -62.2863084 -0.445349E-03  0.158E-02    2.26       1.1  T
   5    -62.2863158 -0.741608E-05  0.678E-03    2.26       2.5  T
   6    -62.2863167 -0.850885E-06  0.257E-03    2.26       6.6  T
   7    -62.2863167 -0.259488E-08  0.111E-03    2.26      15.2  T
     SCC iter.                  ...        0 min,  0.016 sec
     gradient                   ...        0 min,  0.026 sec
 * total energy  :   -61.1024320 Eh     change       -0.1382863E-02 Eh
   gradient norm :     0.0280799 Eh/α   predicted    -0.2144421E-02 (  55.07%)
   displ. norm   :     0.1892471 α      lambda       -0.1224918E-02
   maximum displ.:     0.0787174 α      in ANC's #7, #9, #4, ...

........................................................................
.............................. CYCLE    6 ..............................
........................................................................
   1    -62.2828598 -0.622829E+02  0.222E-01    2.28       0.0  T
   2    -62.2828986 -0.388735E-04  0.128E-01    2.29       1.0  T
   3    -62.2827084  0.190216E-03  0.900E-02    2.27       1.0  T
   4    -62.2829482 -0.239769E-03  0.133E-02    2.29       1.3  T
   5    -62.2829526 -0.444606E-05  0.610E-03    2.28       2.8  T
   6    -62.2829535 -0.893502E-06  0.168E-03    2.28      10.1  T
   7    -62.2829536 -0.103749E-07  0.117E-03    2.28      14.5  T
     SCC iter.                  ...        0 min,  0.016 sec
     gradient                   ...        0 min,  0.026 sec
 * total energy  :   -61.1028626 Eh     change       -0.4306080E-03 Eh
   gradient norm :     0.0160247 Eh/α   predicted    -0.6343942E-03 (  47.33%)
   displ. norm   :     0.2539245 α      lambda       -0.9948486E-03
   maximum displ.:     0.1179571 α      in ANC's #4, #9, #7, ...

........................................................................
.............................. CYCLE    7 ..............................
........................................................................
   1    -62.2791178 -0.622791E+02  0.246E-01    2.29       0.0  T
   2    -62.2791472 -0.293810E-04  0.138E-01    2.29       1.0  T
   3    -62.2789964  0.150806E-03  0.705E-02    2.28       1.0  T
   4    -62.2791736 -0.177165E-03  0.956E-03    2.29       1.8  T
   5    -62.2791757 -0.212323E-05  0.463E-03    2.29       3.7  T
   6    -62.2791760 -0.293253E-06  0.189E-03    2.29       9.0  T
   7    -62.2791760  0.135388E-08  0.998E-04    2.29      16.9  T
     SCC iter.                  ...        0 min,  0.015 sec
     gradient                   ...        0 min,  0.026 sec
 * total energy  :   -61.1028575 Eh     change        0.5027565E-05 Eh
   gradient norm :     0.0215790 Eh/α   predicted    -0.5295024E-03 (*******%)
   displ. norm   :     0.2335558 α      lambda       -0.1282818E-02
   maximum displ.:     0.1068969 α      in ANC's #7, #4, #11, ...

........................................................................
.............................. CYCLE    8 ..............................
........................................................................
   1    -62.2806129 -0.622806E+02  0.213E-01    2.29       0.0  T
   2    -62.2806328 -0.199049E-04  0.119E-01    2.28       1.0  T
   3    -62.2805829  0.499130E-04  0.435E-02    2.29       1.0  T
   4    -62.2806444 -0.615013E-04  0.621E-03    2.28       2.7  T
   5    -62.2806449 -0.520526E-06  0.344E-03    2.28       4.9  T
   6    -62.2806451 -0.173506E-06  0.150E-03    2.28      11.3  T
     SCC iter.                  ...        0 min,  0.014 sec
     gradient                   ...        0 min,  0.026 sec
 * total energy  :   -61.1033582 Eh     change       -0.5006653E-03 Eh
   gradient norm :     0.0121441 Eh/α   predicted    -0.6763998E-03 (  35.10%)
   displ. norm   :     0.2490463 α      lambda       -0.9162142E-03
   maximum displ.:     0.1268061 α      in ANC's #4, #7, #10, ...

........................................................................
.............................. CYCLE    9 ..............................
........................................................................
   1    -62.2794685 -0.622795E+02  0.286E-01    2.27       0.0  T
   2    -62.2795060 -0.374969E-04  0.160E-01    2.26       1.0  T
   3    -62.2792481  0.257986E-03  0.900E-02    2.28       1.0  T
   4    -62.2795472 -0.299119E-03  0.112E-02    2.26       1.5  T
   5    -62.2795509 -0.372382E-05  0.475E-03    2.26       3.6  T
   6    -62.2795514 -0.463168E-06  0.186E-03    2.26       9.1  T
   7    -62.2795514  0.406970E-08  0.101E-03    2.26      16.7  T
     SCC iter.                  ...        0 min,  0.016 sec
     gradient                   ...        0 min,  0.026 sec
 * total energy  :   -61.1035329 Eh     change       -0.1746969E-03 Eh
   gradient norm :     0.0272952 Eh/α   predicted    -0.4865210E-03 ( 178.49%)
   displ. norm   :     0.1571166 α      lambda       -0.6835586E-03
   maximum displ.:     0.0824363 α      in ANC's #4, #6, #7, ...

........................................................................
.............................. CYCLE   10 ..............................
........................................................................
   1    -62.2832316 -0.622832E+02  0.111E-01    2.27       0.0  T
   2    -62.2832397 -0.813570E-05  0.642E-02    2.28       1.0  T
   3    -62.2831908  0.489468E-04  0.399E-02    2.27       1.0  T
   4    -62.2832476 -0.568651E-04  0.639E-03    2.28       2.6  T
   5    -62.2832488 -0.111789E-05  0.297E-03    2.28       5.7  T
   6    -62.2832489 -0.167600E-06  0.128E-03    2.28      13.2  T
     SCC iter.                  ...        0 min,  0.014 sec
     gradient                   ...        0 min,  0.026 sec
 * total energy  :   -61.1039519 Eh     change       -0.4190089E-03 Eh
   gradient norm :     0.0039776 Eh/α   predicted    -0.3502208E-03 ( -16.42%)
   displ. norm   :     0.3318717 α      lambda       -0.3785950E-03
   maximum displ.:     0.2046934 α      in ANC's #4, #7, #3, ...

........................................................................
.............................. CYCLE   11 ..............................
........................................................................
   1    -62.2805746 -0.622806E+02  0.145E-01    2.28       0.0  T
   2    -62.2805821 -0.751578E-05  0.836E-02    2.28       1.0  T
   3    -62.2805453  0.368032E-04  0.365E-02    2.27       1.0  T
   4    -62.2805876 -0.423459E-04  0.606E-03    2.28       2.8  T
   5    -62.2805883 -0.628955E-06  0.351E-03    2.28       4.8  T
   6    -62.2805885 -0.200863E-06  0.129E-03    2.28      13.1  T
   7    -62.2805885 -0.724162E-08  0.604E-04    2.28      28.0  T
   8    -62.2805885 -0.755253E-08  0.257E-04    2.28      65.9  T
     SCC iter.                  ...        0 min,  0.018 sec
     gradient                   ...        0 min,  0.029 sec
 * total energy  :   -61.1042559 Eh     change       -0.3040216E-03 Eh
   gradient norm :     0.0044084 Eh/α   predicted    -0.2101486E-03 ( -30.88%)
   displ. norm   :     0.4693524 α      lambda       -0.4367064E-03
   maximum displ.:     0.2830330 α      in ANC's #4, #7, #3, ...

........................................................................
.............................. CYCLE   12 ..............................
........................................................................
   1    -62.2811624 -0.622812E+02  0.207E-01    2.27       0.0  T
   2    -62.2811732 -0.108280E-04  0.118E-01    2.27       1.0  T
   3    -62.2811686  0.467429E-05  0.169E-02    2.27       1.0  T
   4    -62.2811780 -0.946106E-05  0.626E-03    2.27       2.7  T
   5    -62.2811781 -0.122618E-06  0.380E-03    2.27       4.4  T
   6    -62.2811784 -0.285826E-06  0.779E-04    2.27      21.7  T
   7    -62.2811784 -0.561759E-08  0.484E-04    2.27      34.9  T
     SCC iter.                  ...        0 min,  0.016 sec
     gradient                   ...        0 min,  0.026 sec
 * total energy  :   -61.1046086 Eh     change       -0.3526788E-03 Eh
   gradient norm :     0.0071887 Eh/α   predicted    -0.2664562E-03 ( -24.45%)
   displ. norm   :     0.5392477 α      lambda       -0.4185080E-03
   maximum displ.:     0.3246716 α      in ANC's #4, #7, #3, ...

........................................................................
.............................. CYCLE   13 ..............................
........................................................................
   1    -62.2812294 -0.622812E+02  0.234E-01    2.26       0.0  T
   2    -62.2812425 -0.130919E-04  0.135E-01    2.26       1.0  T
   3    -62.2812114  0.311290E-04  0.340E-02    2.26       1.0  T
   4    -62.2812505 -0.390882E-04  0.738E-03    2.26       2.3  T
   5    -62.2812506 -0.989472E-07  0.477E-03    2.26       3.5  T
   6    -62.2812510 -0.372901E-06  0.117E-03    2.26      14.4  T
   7    -62.2812510 -0.228993E-07  0.600E-04    2.26      28.2  T
     SCC iter.                  ...        0 min,  0.015 sec
     gradient                   ...        0 min,  0.026 sec
 * total energy  :   -61.1048875 Eh     change       -0.2789346E-03 Eh
   gradient norm :     0.0059232 Eh/α   predicted    -0.2701062E-03 (  -3.17%)
   displ. norm   :     0.4894169 α      lambda       -0.3240830E-03
   maximum displ.:     0.2979979 α      in ANC's #4, #3, #6, ...

........................................................................
.............................. CYCLE   14 ..............................
........................................................................
   1    -62.2810252 -0.622810E+02  0.232E-01    2.26       0.0  T
   2    -62.2810407 -0.154889E-04  0.132E-01    2.25       1.0  T
   3    -62.2809671  0.736193E-04  0.483E-02    2.27       1.0  T
   4    -62.2810525 -0.854644E-04  0.810E-03    2.26       2.1  T
   5    -62.2810532 -0.700085E-06  0.515E-03    2.26       3.3  T
   6    -62.2810536 -0.409605E-06  0.142E-03    2.26      11.9  T
   7    -62.2810537 -0.179376E-07  0.684E-04    2.26      24.7  T
     SCC iter.                  ...        0 min,  0.016 sec
     gradient                   ...        0 min,  0.026 sec
 * total energy  :   -61.1050049 Eh     change       -0.1173747E-03 Eh
   gradient norm :     0.0200752 Eh/α   predicted    -0.2008571E-03 (  71.12%)
   displ. norm   :     0.1681419 α      lambda       -0.2763601E-03
   maximum displ.:     0.0868051 α      in ANC's #4, #6, #3, ...

........................................................................
.............................. CYCLE   15 ..............................
........................................................................
   1    -62.2899986 -0.622900E+02  0.753E-02    2.26       0.0  T
   2    -62.2899999 -0.131067E-05  0.438E-02    2.26       1.0  T
   3    -62.2899814  0.185085E-04  0.272E-02    2.26       1.0  T
   4    -62.2900026 -0.212284E-04  0.328E-03    2.26       5.2  T
   5    -62.2900028 -0.217887E-06  0.162E-03    2.26      10.5  T
   6    -62.2900029 -0.200494E-07  0.788E-04    2.26      21.4  T
     SCC iter.                  ...        0 min,  0.014 sec
     gradient                   ...        0 min,  0.026 sec
 * total energy  :   -61.1051350 Eh     change       -0.1300765E-03 Eh
   gradient norm :     0.0112296 Eh/α   predicted    -0.1420901E-03 (   9.24%)
   displ. norm   :     0.2743506 α      lambda       -0.1619410E-03
   maximum displ.:     0.1622054 α      in ANC's #4, #3, #6, ...

........................................................................
.............................. CYCLE   16 ..............................
........................................................................
   1    -62.2857356 -0.622857E+02  0.123E-01    2.26       0.0  T
   2    -62.2857391 -0.354029E-05  0.710E-02    2.26       1.0  T
   3    -62.2857200  0.191384E-04  0.266E-02    2.26       1.0  T
   4    -62.2857421 -0.221569E-04  0.403E-03    2.26       4.2  T
   5    -62.2857422 -0.717235E-07  0.261E-03    2.26       6.5  T
   6    -62.2857423 -0.112895E-06  0.680E-04    2.26      24.8  T
     SCC iter.                  ...        0 min,  0.014 sec
     gradient                   ...        0 min,  0.026 sec
 * total energy  :   -61.1052451 Eh     change       -0.1101344E-03 Eh
   gradient norm :     0.0034074 Eh/α   predicted    -0.8706509E-04 ( -20.95%)
   displ. norm   :     0.3822765 α      lambda       -0.1546139E-03
   maximum displ.:     0.2176710 α      in ANC's #4, #3, #6, ...

........................................................................
.............................. CYCLE   17 ..............................
........................................................................
   1    -62.2829686 -0.622830E+02  0.177E-01    2.26       0.0  T
   2    -62.2829766 -0.794459E-05  0.101E-01    2.26       1.0  T
   3    -62.2829698  0.678352E-05  0.183E-02    2.26       1.0  T
   4    -62.2829802 -0.104740E-04  0.531E-03    2.26       3.2  T
   5    -62.2829803 -0.903281E-07  0.299E-03    2.26       5.7  T
   6    -62.2829805 -0.191590E-06  0.671E-04    2.26      25.2  T
   7    -62.2829805 -0.490157E-08  0.359E-04    2.26      47.0  T
     SCC iter.                  ...        0 min,  0.016 sec
     gradient                   ...        0 min,  0.029 sec
 * total energy  :   -61.1053562 Eh     change       -0.1110511E-03 Eh
   gradient norm :     0.0069177 Eh/α   predicted    -0.8860941E-04 ( -20.21%)
   displ. norm   :     0.3079550 α      lambda       -0.1419897E-03
   maximum displ.:     0.1700949 α      in ANC's #3, #6, #4, ...

........................................................................
.............................. CYCLE   18 ..............................
........................................................................
   1    -62.2832288 -0.622832E+02  0.153E-01    2.26       0.0  T
   2    -62.2832352 -0.643410E-05  0.872E-02    2.26       1.0  T
   3    -62.2832309  0.426411E-05  0.145E-02    2.27       1.2  T
   4    -62.2832380 -0.710792E-05  0.411E-03    2.26       4.1  T
   5    -62.2832380  0.112592E-07  0.289E-03    2.26       5.9  T
   6    -62.2832382 -0.207534E-06  0.804E-04    2.26      21.0  T
     SCC iter.                  ...        0 min,  0.014 sec
     gradient                   ...        0 min,  0.026 sec
 * total energy  :   -61.1054611 Eh     change       -0.1048908E-03 Eh
   gradient norm :     0.0079750 Eh/α   predicted    -0.7773247E-04 ( -25.89%)
   displ. norm   :     0.2728759 α      lambda       -0.1205658E-03
   maximum displ.:     0.1502897 α      in ANC's #3, #6, #7, ...

........................................................................
.............................. CYCLE   19 ..............................
........................................................................
   1    -62.2844072 -0.622844E+02  0.136E-01    2.26       0.0  T
   2    -62.2844118 -0.462368E-05  0.772E-02    2.27       1.0  T
   3    -62.2844114  0.468087E-06  0.900E-03    2.27       1.9  T
   4    -62.2844138 -0.239294E-05  0.363E-03    2.27       4.7  T
   5    -62.2844138 -0.227951E-07  0.218E-03    2.27       7.7  T
   6    -62.2844139 -0.109427E-06  0.522E-04    2.27      32.4  T
     SCC iter.                  ...        0 min,  0.014 sec
     gradient                   ...        0 min,  0.026 sec
 * total energy  :   -61.1055414 Eh     change       -0.8034026E-04 Eh
   gradient norm :     0.0035285 Eh/α   predicted    -0.6477406E-04 ( -19.38%)
   displ. norm   :     0.2418177 α      lambda       -0.4907906E-04
   maximum displ.:     0.1477299 α      in ANC's #3, #6, #4, ...

........................................................................
.............................. CYCLE   20 ..............................
........................................................................
   1    -62.2839727 -0.622840E+02  0.113E-01    2.27       0.0  T
   2    -62.2839758 -0.306655E-05  0.645E-02    2.27       1.0  T
   3    -62.2839694  0.641373E-05  0.154E-02    2.27       1.1  T
   4    -62.2839775 -0.815617E-05  0.317E-03    2.27       5.3  T
   5    -62.2839775 -0.261001E-07  0.209E-03    2.27       8.1  T
   6    -62.2839776 -0.891978E-07  0.575E-04    2.27      29.4  T
   7    -62.2839776 -0.695514E-08  0.238E-04    2.27      71.0  T
     SCC iter.                  ...        0 min,  0.016 sec
     gradient                   ...        0 min,  0.029 sec
 * total energy  :   -61.1055708 Eh     change       -0.2939951E-04 Eh
   gradient norm :     0.0032205 Eh/α   predicted    -0.2597700E-04 ( -11.64%)
   displ. norm   :     0.1026831 α      lambda       -0.3281876E-04
   maximum displ.:     0.0604515 α      in ANC's #7, #3, #6, ...
 * RMSD in coord.:     0.7720815 α      energy gain  -0.4814924E-01 Eh

generating ANC from model Hessian ...
Using Lindh-Hessian (1995)
 Shifting diagonal of input Hessian by   4.976813596210124E-003
 Lowest  eigenvalues of input Hessian
   -0.000000   -0.000000    0.000000    0.000000    0.000000    0.000000
    0.005000    0.005090    0.005781    0.005899    0.006305    0.006399
    0.006786    0.007277    0.010289    0.011031    0.013046    0.014087
 Highest eigenvalues
    2.017562    2.021288    2.035279    2.595309    2.650754    2.678685
 

........................................................................
.............................. CYCLE   21 ..............................
........................................................................
   1    -62.2870033 -0.622870E+02  0.481E-02    2.27       0.0  T
   2    -62.2870038 -0.507027E-06  0.275E-02    2.27       1.0  T
   3    -62.2869999  0.386611E-05  0.110E-02    2.27       1.5  T
   4    -62.2870043 -0.439031E-05  0.145E-03    2.27      11.6  T
   5    -62.2870044 -0.211091E-07  0.863E-04    2.27      19.6  T
   6    -62.2870044 -0.720398E-08  0.338E-04    2.27      49.9  T
     SCC iter.                  ...        0 min,  0.014 sec
     gradient                   ...        0 min,  0.029 sec
 * total energy  :   -61.1055868 Eh     change       -0.1595988E-04 Eh
   gradient norm :     0.0022744 Eh/α   predicted     0.0000000E+00 (-100.00%)
   displ. norm   :     0.0465599 α      lambda       -0.2304348E-04
   maximum displ.:     0.0226696 α      in ANC's #3, #5, #10, ...

........................................................................
.............................. CYCLE   22 ..............................
........................................................................
   1    -62.2856734 -0.622857E+02  0.452E-02    2.27       0.0  T
   2    -62.2856743 -0.815127E-06  0.251E-02    2.27       1.0  T
   3    -62.2856745 -0.225611E-06  0.216E-03    2.27       7.8  T
   4    -62.2856746 -0.121539E-06  0.926E-04    2.27      18.3  T
   5    -62.2856746 -0.708571E-08  0.452E-04    2.27      37.4  T
     SCC iter.                  ...        0 min,  0.012 sec
     gradient                   ...        0 min,  0.029 sec
 * total energy  :   -61.1055861 Eh     change        0.6730238E-06 Eh
   gradient norm :     0.0019723 Eh/α   predicted    -0.1154751E-04 (*******%)
   displ. norm   :     0.0830951 α      lambda       -0.4465226E-04
   maximum displ.:     0.0488088 α      in ANC's #1, #4, #5, ...

........................................................................
.............................. CYCLE   23 ..............................
........................................................................
   1    -62.2832312 -0.622832E+02  0.875E-02    2.27       0.0  T
   2    -62.2832345 -0.323274E-05  0.483E-02    2.27       1.0  T
   3    -62.2832355 -0.101388E-05  0.359E-03    2.27       4.7  T
   4    -62.2832358 -0.363647E-06  0.169E-03    2.27      10.0  T
   5    -62.2832359 -0.309777E-07  0.811E-04    2.27      20.8  T
   6    -62.2832359 -0.104943E-07  0.246E-04    2.27      68.6  T
     SCC iter.                  ...        0 min,  0.014 sec
     gradient                   ...        0 min,  0.029 sec
 * total energy  :   -61.1055653 Eh     change        0.2079644E-04 Eh
   gradient norm :     0.0062082 Eh/α   predicted    -0.2239705E-04 (-207.70%)
   displ. norm   :     0.0346024 α      lambda       -0.6821837E-04
   maximum displ.:     0.0237739 α      in ANC's #9, #13, #1, ...

........................................................................
.............................. CYCLE   24 ..............................
........................................................................
   1    -62.2851682 -0.622852E+02  0.462E-02    2.27       0.0  T
   2    -62.2851692 -0.100701E-05  0.255E-02    2.27       1.0  T
   3    -62.2851688  0.399190E-06  0.501E-03    2.27       3.4  T
   4    -62.2851696 -0.874781E-06  0.869E-04    2.27      19.5  T
   5    -62.2851697 -0.776259E-08  0.475E-04    2.27      35.6  T
     SCC iter.                  ...        0 min,  0.012 sec
     gradient                   ...        0 min,  0.026 sec
 * total energy  :   -61.1056030 Eh     change       -0.3771573E-04 Eh
   gradient norm :     0.0020129 Eh/α   predicted    -0.3415104E-04 (  -9.45%)
   displ. norm   :     0.0443474 α      lambda       -0.4075683E-04
   maximum displ.:     0.0227589 α      in ANC's #2, #1, #10, ...

........................................................................
.............................. CYCLE   25 ..............................
........................................................................
   1    -62.2864574 -0.622865E+02  0.613E-02    2.27       0.0  T
   2    -62.2864590 -0.156093E-05  0.338E-02    2.27       1.0  T
   3    -62.2864586  0.371717E-06  0.569E-03    2.27       3.0  T
   4    -62.2864597 -0.112836E-05  0.976E-04    2.27      17.3  T
   5    -62.2864597  0.175682E-08  0.583E-04    2.27      29.0  T
   6    -62.2864597 -0.692114E-08  0.152E-04    2.27     110.9  T
     SCC iter.                  ...        0 min,  0.014 sec
     gradient                   ...        0 min,  0.029 sec
 * total energy  :   -61.1055836 Eh     change        0.1942008E-04 Eh
   gradient norm :     0.0034013 Eh/α   predicted    -0.2042093E-04 (-205.15%)
   displ. norm   :     0.0458126 α      lambda       -0.7492596E-04
   maximum displ.:     0.0284515 α      in ANC's #8, #2, #11, ...

........................................................................
.............................. CYCLE   26 ..............................
........................................................................
   1    -62.2862911 -0.622863E+02  0.572E-02    2.27       0.0  T
   2    -62.2862925 -0.136055E-05  0.316E-02    2.27       1.0  T
   3    -62.2862926 -0.887892E-07  0.407E-03    2.27       4.1  T
   4    -62.2862931 -0.537950E-06  0.952E-04    2.27      17.8  T
   5    -62.2862931  0.279152E-08  0.588E-04    2.27      28.7  T
     SCC iter.                  ...        0 min,  0.012 sec
     gradient                   ...        0 min,  0.029 sec
 * total energy  :   -61.1056143 Eh     change       -0.3066734E-04 Eh
   gradient norm :     0.0021208 Eh/α   predicted    -0.3754293E-04 (  22.42%)
   displ. norm   :     0.0457739 α      lambda        0.1153433E-03
   maximum displ.:     0.0284444 α      in ANC's #8, #2, #11, ...

........................................................................
.............................. CYCLE   27 ..............................
........................................................................
   1    -62.2855570 -0.622856E+02  0.569E-02    2.27       0.0  T
   2    -62.2855584 -0.136267E-05  0.314E-02    2.27       1.0  T
   3    -62.2855585 -0.129291E-06  0.394E-03    2.27       4.3  T
   4    -62.2855590 -0.494434E-06  0.968E-04    2.27      17.5  T
   5    -62.2855590  0.187351E-08  0.588E-04    2.27      28.7  T
     SCC iter.                  ...        0 min,  0.012 sec
     gradient                   ...        0 min,  0.029 sec
 * total energy  :   -61.1055563 Eh     change        0.5793802E-04 Eh
   gradient norm :     0.0043881 Eh/α   predicted     0.5779225E-04 (  -0.25%)
   displ. norm   :     0.0481790 α      lambda       -0.1345842E-03
   maximum displ.:     0.0270802 α      in ANC's #8, #2, #11, ...

........................................................................
.............................. CYCLE   28 ..............................
........................................................................
   1    -62.2853111 -0.622853E+02  0.691E-02    2.27       0.0  T
   2    -62.2853131 -0.204556E-05  0.381E-02    2.27       1.0  T
   3    -62.2853108  0.230782E-05  0.988E-03    2.27       1.7  T
   4    -62.2853143 -0.346598E-05  0.116E-03    2.27      14.6  T
   5    -62.2853143 -0.659576E-09  0.832E-04    2.27      20.3  T
   6    -62.2853143 -0.127469E-07  0.201E-04    2.27      84.2  T
     SCC iter.                  ...        0 min,  0.014 sec
     gradient                   ...        0 min,  0.026 sec
 * total energy  :   -61.1056212 Eh     change       -0.6490226E-04 Eh
   gradient norm :     0.0016464 Eh/α   predicted    -0.6745156E-04 (   3.93%)
   displ. norm   :     0.0394740 α      lambda       -0.9542770E-05
   maximum displ.:     0.0250535 α      in ANC's #5, #3, #4, ...

........................................................................
.............................. CYCLE   29 ..............................
........................................................................
   1    -62.2864751 -0.622865E+02  0.266E-02    2.27       0.0  T
   2    -62.2864753 -0.198533E-06  0.150E-02    2.27       1.1  T
   3    -62.2864740  0.131845E-05  0.667E-03    2.27       2.5  T
   4    -62.2864755 -0.152724E-05  0.712E-04    2.27      23.7  T
   5    -62.2864755 -0.195302E-08  0.490E-04    2.27      34.5  T
   6    -62.2864755 -0.414313E-08  0.123E-04    2.27     137.8  T
     SCC iter.                  ...        0 min,  0.014 sec
     gradient                   ...        0 min,  0.029 sec
 * total energy  :   -61.1056250 Eh     change       -0.3789863E-05 Eh
   gradient norm :     0.0022192 Eh/α   predicted    -0.4777310E-05 (  26.05%)
   displ. norm   :     0.0258187 α      lambda       -0.6553738E-05
   maximum displ.:     0.0161594 α      in ANC's #5, #3, #4, ...

........................................................................
.............................. CYCLE   30 ..............................
........................................................................
   1    -62.2862269 -0.622862E+02  0.137E-02    2.27       0.0  T
   2    -62.2862270 -0.363526E-07  0.786E-03    2.27       2.2  T
   3    -62.2862269  0.237907E-07  0.108E-03    2.27      15.6  T
   4    -62.2862270 -0.406635E-07  0.312E-04    2.27      54.1  T
   5    -62.2862270 -0.524594E-10  0.189E-04    2.27      89.3  T
     SCC iter.                  ...        0 min,  0.012 sec
     gradient                   ...        0 min,  0.029 sec
 * total energy  :   -61.1056308 Eh     change       -0.5762917E-05 Eh
   gradient norm :     0.0012937 Eh/α   predicted    -0.3282721E-05 ( -43.04%)
   displ. norm   :     0.1113286 α      lambda       -0.1270429E-04
   maximum displ.:     0.0689189 α      in ANC's #5, #3, #4, ...

........................................................................
.............................. CYCLE   31 ..............................
........................................................................
   1    -62.2853282 -0.622853E+02  0.550E-02    2.27       0.0  T
   2    -62.2853286 -0.471614E-06  0.317E-02    2.27       1.0  T
   3    -62.2853282  0.404404E-06  0.411E-03    2.27       4.1  T
   4    -62.2853288 -0.622676E-06  0.120E-03    2.27      14.0  T
   5    -62.2853289 -0.576951E-08  0.718E-04    2.27      23.5  T
   6    -62.2853289 -0.121631E-07  0.174E-04    2.27      96.9  T
     SCC iter.                  ...        0 min,  0.014 sec
     gradient                   ...        0 min,  0.029 sec
 * total energy  :   -61.1056418 Eh     change       -0.1106179E-04 Eh
   gradient norm :     0.0017177 Eh/α   predicted    -0.6387982E-05 ( -42.25%)
   displ. norm   :     0.0631016 α      lambda       -0.4572911E-05
   maximum displ.:     0.0421629 α      in ANC's #5, #3, #4, ...

........................................................................
.............................. CYCLE   32 ..............................
........................................................................
   1    -62.2855449 -0.622855E+02  0.285E-02    2.27       0.0  T
   2    -62.2855450 -0.686432E-07  0.166E-02    2.27       1.0  T
   3    -62.2855449  0.579627E-07  0.162E-03    2.27      10.4  T
   4    -62.2855450 -0.923365E-07  0.433E-04    2.27      39.1  T
   5    -62.2855450 -0.698961E-10  0.271E-04    2.27      62.5  T
     SCC iter.                  ...        0 min,  0.012 sec
     gradient                   ...        0 min,  0.029 sec
 * total energy  :   -61.1056480 Eh     change       -0.6126747E-05 Eh
   gradient norm :     0.0012391 Eh/α   predicted    -0.2294860E-05 ( -62.54%)
   displ. norm   :     0.0637144 α      lambda       -0.5417504E-05
   maximum displ.:     0.0458102 α      in ANC's #5, #3, #4, ...

........................................................................
.............................. CYCLE   33 ..............................
........................................................................
   1    -62.2859168 -0.622859E+02  0.296E-02    2.27       0.0  T
   2    -62.2859169 -0.955776E-07  0.172E-02    2.27       1.0  T
   3    -62.2859169  0.157777E-07  0.139E-03    2.27      12.1  T
   4    -62.2859169 -0.590064E-07  0.484E-04    2.27      34.9  T
   5    -62.2859169  0.969806E-09  0.299E-04    2.27      56.5  T
     SCC iter.                  ...        0 min,  0.012 sec
     gradient                   ...        0 min,  0.029 sec
 * total energy  :   -61.1056543 Eh     change       -0.6300595E-05 Eh
   gradient norm :     0.0005523 Eh/α   predicted    -0.2714205E-05 ( -56.92%)
   displ. norm   :     0.0563449 α      lambda       -0.3400409E-05
   maximum displ.:     0.0428907 α      in ANC's #5, #3, #7, ...

........................................................................
.............................. CYCLE   34 ..............................
........................................................................
   1    -62.2861537 -0.622862E+02  0.256E-02    2.27       0.0  T
   2    -62.2861538 -0.585949E-07  0.149E-02    2.27       1.1  T
   3    -62.2861537  0.562565E-07  0.157E-03    2.27      10.8  T
   4    -62.2861538 -0.859802E-07  0.413E-04    2.27      40.9  T
   5    -62.2861538 -0.317243E-09  0.238E-04    2.27      71.0  T
     SCC iter.                  ...        0 min,  0.012 sec
     gradient                   ...        0 min,  0.029 sec
 * total energy  :   -61.1056585 Eh     change       -0.4249062E-05 Eh
   gradient norm :     0.0007336 Eh/α   predicted    -0.1704406E-05 ( -59.89%)
   displ. norm   :     0.0398393 α      lambda       -0.2361317E-05
   maximum displ.:     0.0318526 α      in ANC's #5, #3, #7, ...

   *** GEOMETRY OPTIMIZATION CONVERGED AFTER 34 ITERATIONS ***

------------------------------------------------------------------------
 total energy gain   :        -0.0482369 Eh      -30.2691 kcal/mol
 total RMSD          :         0.7839072 a0        0.4148 Å
 total power (kW/mol):        -3.7248848 (step)  -57.1961 (real)
------------------------------------------------------------------------

 ANCopt (total)                0 d,  0 h,  0 min,  2.214 sec
 optimizer setup                ...        0 min,  0.000 sec (  0.006%)
 model hessian                  ...        0 min,  0.018 sec (  0.834%)
 ANC generation                 ...        0 min,  0.002 sec (  0.109%)
 coordinate transformation      ...        0 min,  0.001 sec (  0.040%)
 single point calculation       ...        0 min,  2.177 sec ( 98.308%)
 optimization log               ...        0 min,  0.005 sec (  0.207%)
 hessian update                 ...        0 min,  0.001 sec (  0.026%)
 rational function              ...        0 min,  0.008 sec (  0.374%)

================
 final structure:
================
$coord
   -0.52798984266437   -2.19736823577793    0.92375361553100      C 
   -0.74459931802783   -3.49442636320660    3.48491479909119      C 
    1.34296331171821   -4.36715033575065    4.80580224163761      C 
    1.01366745838934   -5.56443746111170    7.11019643051431      C 
   -1.38345456590736   -5.87698095190655    8.10568091343749      C 
   -3.46582596339706   -4.98763460069743    6.79253335137926      C 
   -3.15176537359505   -3.80721059387625    4.48362184369344      C 
   -1.55886845488870   -3.99664554171785   -1.08462336681035      C 
   -3.61370666731419   -3.33692696646057   -2.56707769192163      C 
   -4.51310678632722   -5.01582537852345   -4.36182522596822      C 
   -3.36314445496489   -7.34076491977186   -4.68561313088836      C 
   -1.31177154676543   -7.99889308627986   -3.19827282340234      C 
   -0.40946003646071   -6.33532137539875   -1.39766968000428      C 
    2.05681151937561   -1.32835117266831    0.19751829449283      C 
    2.04088657251194    1.19908813679434   -0.10463167498426      C 
   -0.51665857594732    2.07199335175617    0.43236002326160      C 
   -1.43520952562702    4.47934942043031    0.37089590035079      C 
    0.07572223551415    6.58768248908421   -0.22630499858814      C 
    1.23165197855513    8.35733238565994   -0.69903219684094      N 
   -4.00438386253596    4.96154513904719    0.90319491029813      C 
   -6.09577868535371    5.33691643894340    1.32312611624239      N 
   -1.97585732408914    0.09119742090059    1.01272501469839      O 
    4.10357789534619    2.72125949071834   -0.82318324959145      C 
    5.84761540117667    3.85736338286118   -1.41048814010343      N 
    3.22776945685502   -4.11594304379190    4.06575139212010      H 
    2.64459048974163   -6.24474898494458    8.12982988700039      H 
   -1.62859120417605   -6.80605372141875    9.90498810410807      H 
   -5.34029126510428   -5.21568910061300    7.56337400603781      H 
   -4.76305241986127   -3.10556280266580    3.44880170439094      H 
   -4.52309638875016   -1.52906698657829   -2.31074980124161      H 
   -6.11950874500586   -4.49551149426970   -5.50600143321626      H 
   -4.06572035569132   -8.64296643946539   -6.08935908705018      H 
   -0.41189595645780   -9.81390595574913   -3.43646065030236      H 
    1.17259991763172   -6.86196998453625   -0.22042273405587      H 
    3.61508522968398   -2.58530189662580   -0.11843395165502      H 
$end
           -------------------------------------------------
          |                Final Singlepoint                |
           -------------------------------------------------

          ...................................................
          :                      SETUP                      :
          :.................................................:
          :  # basis functions                 107          :
          :  # atomic orbitals                 107          :
          :  # shells                           59          :
          :  # electrons                       112          :
          :  max. iterations                   250          :
          :  Hamiltonian                  GFN2-xTB          :
          :  restarted?                      false          :
          :  GBSA solvation                  false          :
          :  PC potential                    false          :
          :  electronic temp.          300.0000000     K    :
          :  accuracy                    1.0000000          :
          :  -> integral cutoff          0.2500000E+02      :
          :  -> integral neglect         0.1000000E-07      :
          :  -> SCF convergence          0.1000000E-05 Eh   :
          :  -> wf. convergence          0.1000000E-03 e    :
          :  Broyden damping             0.4000000          :
          ...................................................

 iter      E             dE          RMSdq      gap      omega  full diag
   1    -62.2861538 -0.622862E+02  0.927E-05    2.27       0.0  T
   2    -62.2861538  0.131450E-11  0.567E-05    2.27     298.2  T
   3    -62.2861538 -0.512088E-10  0.448E-05    2.27     377.0  T

   *** convergence criteria satisfied after 3 iterations ***

         #    Occupation            Energy/Eh            Energy/eV
      -------------------------------------------------------------
         1        2.0000           -0.7751624             -21.0932
       ...           ...                  ...                  ...
        50        2.0000           -0.4386461             -11.9362
        51        2.0000           -0.4354242             -11.8485
        52        2.0000           -0.4340853             -11.8121
        53        2.0000           -0.4337744             -11.8036
        54        2.0000           -0.4291475             -11.6777
        55        2.0000           -0.4271607             -11.6236
        56        2.0000           -0.4126485             -11.2287 (HOMO)
        57                         -0.3292359              -8.9590 (LUMO)
        58                         -0.2761045              -7.5132
        59                         -0.2597543              -7.0683
        60                         -0.2546671              -6.9298
        61                         -0.2521199              -6.8605
       ...                                ...                  ...
       107                          1.1682121              31.7887
      -------------------------------------------------------------
                  HL-Gap            0.0834126 Eh            2.2698 eV
             Fermi-level           -0.3709422 Eh          -10.0939 eV

 SCC (total)                   0 d,  0 h,  0 min,  0.059 sec
 SCC setup                      ...        0 min,  0.000 sec (  0.555%)
 Dispersion                     ...        0 min,  0.001 sec (  1.152%)
 integral evaluation            ...        0 min,  0.021 sec ( 35.580%)
 zeroth order Hamiltonian       ...        0 min,  0.000 sec (  0.579%)
 iterations                     ...        0 min,  0.008 sec ( 12.947%)
 molecular gradient             ...        0 min,  0.029 sec ( 48.333%)
 printout                       ...        0 min,  0.000 sec (  0.768%)

         :::::::::::::::::::::::::::::::::::::::::::::::::::::
         ::                     SUMMARY                     ::
         :::::::::::::::::::::::::::::::::::::::::::::::::::::
         :: total energy             -61.105658546571 Eh    ::
         :: gradient norm              0.000735850685 Eh/a0 ::
         :: HOMO-LUMO gap              2.269772416916 eV    ::
         ::.................................................::
         :: SCC energy               -62.286153833624 Eh    ::
         :: -> isotropic ES            0.038330533901 Eh    ::
         :: -> anisotropic ES          0.008086439819 Eh    ::
         :: -> anisotropic XC          0.071095026163 Eh    ::
         :: -> dispersion             -0.044064227187 Eh    ::
         :: repulsion energy           1.179837266678 Eh    ::
         :: add. restraining           0.000000000000 Eh    ::
         :::::::::::::::::::::::::::::::::::::::::::::::::::::

           -------------------------------------------------
          |                Property Printout                |
           -------------------------------------------------

    * Orbital Energies and Occupations

         #    Occupation            Energy/Eh            Energy/eV
      -------------------------------------------------------------
         1        2.0000           -0.7751624             -21.0932
       ...           ...                  ...                  ...
        44        2.0000           -0.4751283             -12.9289
        45        2.0000           -0.4610108             -12.5447
        46        2.0000           -0.4569793             -12.4350
        47        2.0000           -0.4520111             -12.2998
        48        2.0000           -0.4514632             -12.2849
        49        2.0000           -0.4500862             -12.2475
        50        2.0000           -0.4386461             -11.9362
        51        2.0000           -0.4354242             -11.8485
        52        2.0000           -0.4340853             -11.8121
        53        2.0000           -0.4337744             -11.8036
        54        2.0000           -0.4291475             -11.6777
        55        2.0000           -0.4271607             -11.6236
        56        2.0000           -0.4126485             -11.2287 (HOMO)
        57                         -0.3292359              -8.9590 (LUMO)
        58                         -0.2761045              -7.5132
        59                         -0.2597543              -7.0683
        60                         -0.2546671              -6.9298
        61                         -0.2521199              -6.8605
        62                         -0.2495889              -6.7917
        63                         -0.2441878              -6.6447
        64                         -0.2251696              -6.1272
        65                         -0.2141805              -5.8281
        66                         -0.2006083              -5.4588
        67                         -0.1596620              -4.3446
       ...                                ...                  ...
       107                          1.1682121              31.7887
      -------------------------------------------------------------
                  HL-Gap            0.0834126 Eh            2.2698 eV
             Fermi-level           -0.3709422 Eh          -10.0939 eV

     #   Z        covCN         q      C6AA      α(0)
     1   6 C      3.903     0.146    18.187     6.062
     2   6 C      2.978     0.004    27.940     8.670
     3   6 C      2.920    -0.035    28.868     8.811
     4   6 C      2.921    -0.026    28.648     8.777
     5   6 C      2.920    -0.025    28.633     8.775
     6   6 C      2.920    -0.024    28.592     8.769
     7   6 C      2.924    -0.027    28.667     8.780
     8   6 C      2.982     0.002    27.969     8.675
     9   6 C      2.921    -0.028    28.708     8.786
    10   6 C      2.921    -0.024    28.615     8.772
    11   6 C      2.920    -0.026    28.650     8.777
    12   6 C      2.921    -0.025    28.630     8.774
    13   6 C      2.922    -0.036    28.893     8.815
    14   6 C      2.984    -0.022    28.551     8.765
    15   6 C      2.991     0.005    27.906     8.666
    16   6 C      2.994     0.173    24.268     8.081
    17   6 C      2.944    -0.020    28.515     8.758
    18   6 C      1.917     0.115    28.257     8.585
    19   7 N      0.911    -0.218    25.747     7.339
    20   6 C      1.922     0.126    28.004     8.546
    21   7 N      0.911    -0.226    25.941     7.366
    22   8 O      1.711    -0.240    17.973     5.724
    23   6 C      1.899     0.115    28.282     8.589
    24   7 N      0.911    -0.185    25.007     7.233
    25   1 H      0.926     0.033     2.543     2.494
    26   1 H      0.926     0.044     2.402     2.423
    27   1 H      0.926     0.044     2.391     2.418
    28   1 H      0.926     0.046     2.367     2.406
    29   1 H      0.926     0.051     2.312     2.378
    30   1 H      0.926     0.049     2.328     2.386
    31   1 H      0.926     0.046     2.365     2.405
    32   1 H      0.926     0.045     2.389     2.417
    33   1 H      0.926     0.044     2.402     2.424
    34   1 H      0.926     0.034     2.525     2.485
    35   1 H      0.926     0.065     2.145     2.290

 Mol. C6AA /au·bohr⁶  :      20001.713558
 Mol. C8AA /au·bohr⁸  :     510328.567526
 Mol. α(0) /au        :        225.420739


Wiberg/Mayer (AO) data.
largest (>0.10) Wiberg bond orders for each atom
          total WBO             WBO to atom ...
     1  C   3.925        C   14 1.018    C    2 0.932    O   22 0.928    C    8 0.924
     2  C   3.969        C    3 1.420    C    7 1.409    C    1 0.932    C    5 0.109
     3  C   3.988        C    4 1.435    C    2 1.420    H   25 0.967    C    6 0.111
     4  C   3.990        C    5 1.445    C    3 1.435    H   26 0.970    C    7 0.113
     5  C   3.990        C    4 1.445    C    6 1.435    H   27 0.970    C    2 0.109
     6  C   3.989        C    7 1.447    C    5 1.435    H   28 0.970    C    3 0.111
     7  C   3.990        C    6 1.447    C    2 1.409    H   29 0.968    C    4 0.113
     8  C   3.968        C    9 1.421    C   13 1.405    C    1 0.924    C   11 0.108
     9  C   3.989        C   10 1.432    C    8 1.421    H   30 0.967    C   12 0.110
    10  C   3.990        C   11 1.446    C    9 1.432    H   31 0.969    C   13 0.113
    11  C   3.989        C   10 1.446    C   12 1.433    H   32 0.970    C    8 0.108
    12  C   3.990        C   13 1.449    C   11 1.433    H   33 0.970    C    9 0.110
    13  C   3.990        C   12 1.449    C    8 1.405    H   34 0.968    C   10 0.113
    14  C   3.965        C   15 1.685    C    1 1.018    H   35 0.967    N   24 0.110
    15  C   3.985        C   14 1.685    C   23 1.095    C   16 1.067
    16  C   3.934        C   17 1.475    O   22 1.134    C   15 1.067
    17  C   3.968        C   16 1.475    C   18 1.100    C   20 1.091
    18  C   3.952        N   19 2.784    C   17 1.100
    19  N   3.008        C   18 2.784
    20  C   3.950        N   21 2.789    C   17 1.091
    21  N   2.988        C   20 2.789
    22  O   2.322        C   16 1.134    C    1 0.928
    23  C   3.952        N   24 2.816    C   15 1.095
    24  N   3.010        C   23 2.816    C   14 0.110
    25  H   0.999        C    3 0.967
    26  H   0.997        C    4 0.970
    27  H   0.997        C    5 0.970
    28  H   0.997        C    6 0.970
    29  H   0.997        C    7 0.968
    30  H   0.997        C    9 0.967
    31  H   0.997        C   10 0.969
    32  H   0.997        C   11 0.970
    33  H   0.997        C   12 0.970
    34  H   0.999        C   13 0.968
    35  H   0.995        C   14 0.967

molecular dipole:
                 x           y           z       tot (Debye)
 q only:        0.002      -3.211       0.315
   full:       -0.045      -3.905       0.425       9.986
molecular quadrupole (traceless):
                xx          xy          yy          xz          yz          zz
 q only:       -6.766       2.108      -6.771       5.615      -1.118      13.537
  q+dip:       -6.613      -2.410     -11.810       9.930      -0.729      18.423
   full:      -10.558      -2.539     -11.259      10.105       0.749      21.817

           -------------------------------------------------
          |                Geometry Summary                 |
           -------------------------------------------------

      molecular mass/u    :      309.3264000
   center of mass at/Å    :       -0.4563674      -0.5758199       0.4292034
  moments of inertia/u·Å² :        0.1615513E+04   0.2691314E+04   0.3037002E+04
rotational constants/cm⁻¹ :        0.1043485E-01   0.6263717E-02   0.5550747E-02

 * 31 selected distances

     #   Z        #   Z                                     value/Å
     2   6 C      3   6 C                                 1.3864352
     3   6 C      4   6 C                                 1.3852083
     4   6 C      5   6 C                                 1.3834587
     5   6 C      6   6 C                                 1.3851475
     2   6 C      7   6 C                                 1.3889969
     6   6 C      7   6 C                                 1.3822681
     8   6 C      9   6 C                                 1.3855210
     9   6 C     10   6 C                                 1.3848620
    10   6 C     11   6 C                                 1.3832289
    11   6 C     12   6 C                                 1.3853376
     8   6 C     13   6 C                                 1.3888804
    12   6 C     13   6 C                                 1.3823391
     1   6 C     14   6 C                                 1.4933497 (max)
    14   6 C     15   6 C                                 1.3470132
    16   6 C     17   6 C                                 1.3638898
    18   6 C     19   7 N                                 1.1461673
    20   6 C     21   7 N                                 1.1461518
     1   6 C     22   8 O                                 1.4338428
    16   6 C     22   8 O                                 1.3376401
    23   6 C     24   7 N                                 1.1444583
     3   6 C     25   1 H                                 1.0797388
     4   6 C     26   1 H                                 1.0796236
     5   6 C     27   1 H                                 1.0794145
     6   6 C     28   1 H                                 1.0792913
     7   6 C     29   1 H                                 1.0792373
     9   6 C     30   1 H                                 1.0794504
    10   6 C     31   1 H                                 1.0793650
    11   6 C     32   1 H                                 1.0792939
    12   6 C     33   1 H                                 1.0794154
    13   6 C     34   1 H                                 1.0801158
    14   6 C     35   1 H                                 1.0725430 (min)

 * 4 distinct bonds (by element types)

   Z      Z             #   av. dist./Å        max./Å        min./Å
   1 H    6 C          11     1.0788626     1.0801158     1.0725430
   6 C    6 C          15     1.3883957     1.4933497     1.3470132
   6 C    7 N           3     1.1455925     1.1461673     1.1444583
   6 C    8 O           2     1.3857414     1.4338428     1.3376401


optimized geometry written to: xtbopt.xyz


           -------------------------------------------------
          | TOTAL ENERGY              -61.105658546571 Eh   |
          | GRADIENT NORM               0.000735850685 Eh/α |
          | HOMO-LUMO GAP               2.269772416916 eV   |
           -------------------------------------------------

------------------------------------------------------------------------
 * finished run on 2021/02/19 at 08:10:31.115     
------------------------------------------------------------------------
 total:
 * wall-time:     0 d,  0 h,  0 min,  2.395 sec
 *  cpu-time:     0 d,  0 h,  0 min,  2.383 sec
 * ratio c/w:     0.995 speedup
 SCF:
 * wall-time:     0 d,  0 h,  0 min,  0.082 sec
 *  cpu-time:     0 d,  0 h,  0 min,  0.082 sec
 * ratio c/w:     0.997 speedup
 ANC optimizer:
 * wall-time:     0 d,  0 h,  0 min,  2.274 sec
 *  cpu-time:     0 d,  0 h,  0 min,  2.268 sec
 * ratio c/w:     0.997 speedup

