      -----------------------------------------------------------      
     |                   =====================                   |     
     |                           x T B                           |     
     |                   =====================                   |     
     |                         S. Grimme                         |     
     |          Mulliken Center for Theoretical Chemistry        |     
     |                    University of Bonn                     |     
     |                Version 6.2 RC2 (SAW190805)                |     
      -----------------------------------------------------------      

   This program is distributed in the hope that it will be useful,
   but WITHOUT ANY WARRANTY; without even the implied warranty of
   MERCHANTABILITY or FITNESS FOR A PARTICULAR PURPOSE.
   
   FOR NON-COMMERCIAL, ACADEMIA USE ONLY.
   
   Cite this work as:
   * S. Grimme, C. Bannwarth, P. Shushkov, J. Chem. Theory Comput., 2017,
     13, 1989-2009. DOI: 10.1021/acs.jctc.7b00118
   * C. Bannwarth, S. Ehlert and S. Grimme., J. Chem. Theory Comput., 2019,
     15, 1652-1671. DOI: 10.1021/acs.jctc.8b01176
   * P. Pracht, E. Caldeweyher, S. Ehlert, S. Grimme, ChemRxiv, 2019, preprint.
     DOI: 10.26434/chemrxiv.8326202.v1
   
   for DFT-D4:
   * E. Caldeweyher, C. Bannwarth and S. Grimme, J. Chem. Phys., 2017,
     147, 034112. DOI: 10.1063/1.4993215
   * E. Caldeweyher, S. Ehlert, A. Hansen, H. Neugebauer, S. Spicher,
     C. Bannwarth and S. Grimme, J. Chem. Phys., 2019, 150, 154122.
     DOI: 10.1063/1.5090222
   
   for sTDA-xTB:
   * S. Grimme and C. Bannwarth, J. Chem. Phys., 2016, 145, 054103.
     DOI: 10.1063/1.4959605
   
   in the mass-spec context:
   * V. Asgeirsson, C. Bauer and S. Grimme, Chem. Sci., 2017, 8, 4879.
     DOI: 10.1039/c7sc00601b
   
   for metadynamics refer to:
   * S. Grimme, J. Chem. Theory Comput., 2019, 155, 2847-2862
     DOI: 10.1021/acs.jctc.9b00143
   
   with help from (in alphabetical order)
   C. Bannwarth, F. Bohle, G. Brandenburg, E. Caldeweyher, M. Checinski,
   S. Dohm, S. Ehlert, S. Ehrlich, F. März, H. Neugebauer, J. Pisarek,
   P. Pracht, P. Shushkov, and S. Spicher.
   
 * started run on 2021/02/19 at 08:11:39.557     

           -------------------------------------------------
          |                Calculation Setup                |
           -------------------------------------------------

          program call               : /ihome/ghutchison/geoffh/xtb/xtb 25u.xyz -opt
          hostname                   : smp-n135
          coordinate file            : 25u.xyz
          omp threads                :                     1
          number of atoms            :                    18
          number of electrons        :                    62
          charge                     :                     0
          spin                       :                   0.0
          first test random number   :      0.20134776277214


########################################################################
# WARNING! Please study the warnings concerning your input carefully
#  - the use of '-opt' is discouraged, please use '--opt' next time
########################################################################

           ------------------------------------------------- 
          |                 G F N 2 - x T B                 |
          | Geometry, Frequencies, Noncovalent interactions |
          |            JCTC 2019 parametrisation            |
           ------------------------------------------------- 
             KAB for C  - Si     :                1.0500
             KAB for H  - Pd     :                0.9500
             k(s)              :                1.8500
             k(p)              :                2.2300
             k(d)              :                2.2300
             k(f)              :                2.0000
             kEN (H0ij)        :               -2.0000
             D4 a1             :                0.5200
             D4 a2             :                5.0000
             D4 s6             :                1.0000
             D4 s8             :                2.7000
             D4 s9             :                5.0000
             alphaj            :                2.0000

  Z AO/shell   Hii/eV     exponent
  1     Wed Apr 25 08:07:45 CEST 2018   EN: 2.200 GM2: 0.406  GM3: 0.0800  RAES: 1.40
     1s    -10.707211    1.230000
  6     Wed Apr 25 08:07:45 CEST 2018   EN: 2.550 GM2: 0.538  GM3: 0.1500  RAES: 3.00
     2s    -13.970922    2.096432
     2p    -10.063292    1.800000
  7     Wed Apr 25 08:07:45 CEST 2018   EN: 3.040 GM2: 0.461  GM3:-0.0640  RAES: 1.90
     2s    -16.686243    2.339881
     2p    -12.523956    2.014332
  9     Mon Apr 23 13:58:50 CEST 2018   EN: 3.980 GM2: 0.532  GM3: 0.1426  RAES: 2.40
     2s    -23.458179    2.416361
     2p    -15.746583    2.308399

           ------------------------------------------------- 
          |        Self-Consistent Charge Iterations        |
           ------------------------------------------------- 

          ...................................................
          :                      SETUP                      :
          :.................................................:
          :  # basis functions                  54          :
          :  # atomic orbitals                  54          :
          :  # shells                           30          :
          :  # electrons                        62          :
          :  max. iterations                   250          :
          :  Hamiltonian                  GFN2-xTB          :
          :  restarted?                      false          :
          :  GBSA solvation                  false          :
          :  PC potential                    false          :
          :  electronic temp.          300.0000000     K    :
          :  accuracy                    1.0000000          :
          :  -> integral cutoff          0.2500000E+02      :
          :  -> integral neglect         0.1000000E-07      :
          :  -> SCF convergence          0.1000000E-05 Eh   :
          :  -> wf. convergence          0.1000000E-03 e    :
          :  Broyden damping             0.4000000          :
          ...................................................

 iter      E             dE          RMSdq      gap      omega  full diag
   1    -35.7914049 -0.357914E+02  0.459E+00    2.66       0.0  T
   2    -35.8088535 -0.174486E-01  0.265E+00    2.21       1.0  T
   3    -35.8093476 -0.494055E-03  0.596E-01    1.70       1.0  T
   4    -35.8101743 -0.826718E-03  0.247E-01    1.66       1.0  T
   5    -35.8107841 -0.609749E-03  0.132E-01    1.69       1.0  T
   6    -35.8109622 -0.178097E-03  0.405E-02    1.71       1.0  T
   7    -35.8109673 -0.509762E-05  0.239E-02    1.72       1.0  T
   8    -35.8109733 -0.602229E-05  0.987E-03    1.72       2.4  T
   9    -35.8109736 -0.285502E-06  0.199E-03    1.72      11.8  T
  10    -35.8109736 -0.402249E-07  0.921E-04    1.72      25.6  T
  11    -35.8109736 -0.339466E-08  0.279E-04    1.72      84.6  T

   *** convergence criteria satisfied after 11 iterations ***

         #    Occupation            Energy/Eh            Energy/eV
      -------------------------------------------------------------
         1        2.0000           -0.8568763             -23.3168
       ...           ...                  ...                  ...
        25        2.0000           -0.4779510             -13.0057
        26        2.0000           -0.4664248             -12.6921
        27        2.0000           -0.4596658             -12.5081
        28        2.0000           -0.4555078             -12.3950
        29        2.0000           -0.4372222             -11.8974
        30        2.0000           -0.4080030             -11.1023
        31        2.0000           -0.3953195             -10.7572 (HOMO)
        32                         -0.3320983              -9.0369 (LUMO)
        33                         -0.2764564              -7.5228
        34                         -0.2276252              -6.1940
        35                         -0.1714374              -4.6650
        36                         -0.0331594              -0.9023
       ...                                ...                  ...
        54                          0.6236484              16.9703
      -------------------------------------------------------------
                  HL-Gap            0.0632212 Eh            1.7203 eV
             Fermi-level           -0.3637089 Eh           -9.8970 eV

 SCC (total)                   0 d,  0 h,  0 min,  0.025 sec
 SCC setup                      ...        0 min,  0.000 sec (  0.937%)
 Dispersion                     ...        0 min,  0.000 sec (  0.897%)
 integral evaluation            ...        0 min,  0.006 sec ( 22.250%)
 zeroth order Hamiltonian       ...        0 min,  0.000 sec (  0.455%)
 iterations                     ...        0 min,  0.009 sec ( 37.903%)
 molecular gradient             ...        0 min,  0.009 sec ( 36.019%)
 printout                       ...        0 min,  0.000 sec (  1.323%)

         :::::::::::::::::::::::::::::::::::::::::::::::::::::
         ::                     SUMMARY                     ::
         :::::::::::::::::::::::::::::::::::::::::::::::::::::
         :: total energy             -35.421856656789 Eh    ::
         :: gradient norm              0.077637518877 Eh/a0 ::
         :: HOMO-LUMO gap              1.720336827462 eV    ::
         ::.................................................::
         :: SCC energy               -35.810973610006 Eh    ::
         :: -> isotropic ES            0.035205255671 Eh    ::
         :: -> anisotropic ES          0.002972006967 Eh    ::
         :: -> anisotropic XC          0.016523174575 Eh    ::
         :: -> dispersion             -0.016843247689 Eh    ::
         :: repulsion energy           0.389042839420 Eh    ::
         :: add. restraining           0.000000000000 Eh    ::
         :::::::::::::::::::::::::::::::::::::::::::::::::::::

      ----------------------------------------------------------- 
     |                   =====================                   |
     |                        A N C O P T                        |
     |                   =====================                   |
     |               Approximate Normal Coordinate               |
     |                Rational Function Optimizer                |
      ----------------------------------------------------------- 

          ...................................................
          :                      SETUP                      :
          :.................................................:
          :   optimization level            normal          :
          :   max. optcycles                   200          :
          :   ANC micro-cycles                  20          :
          :   degrees of freedom                48          :
          :.................................................:
          :   RF solver                   davidson          :
          :   input Hessian                  false          :
          :   write xtbopt.log                true          :
          :   linear?                        false          :
          :   energy convergence         0.5000000E-05 Eh   :
          :   grad. convergence          0.1000000E-02 Eh/α :
          :   maximium RF displ.         2.0000000          :
          :   Hlow (freq-cutoff)         0.5000000E-02      :
          :   Hmax (freq-cutoff)         5.0000000          :
          :   S6 in model hess.         20.0000000          :
          ...................................................

generating ANC from model Hessian ...
Using Lindh-Hessian (1995)
 Shifting diagonal of input Hessian by   0.000000000000000E+000
 Lowest  eigenvalues of input Hessian
   -0.000000   -0.000000   -0.000000   -0.000000    0.000000    0.000000
    0.005028    0.006642    0.012333    0.015164    0.021014    0.026142
    0.039739    0.046053    0.049667    0.053534    0.058956    0.066655
 Highest eigenvalues
    1.532130    1.762444    1.888245    1.905979    1.989537    2.123023
 

........................................................................
.............................. CYCLE    1 ..............................
........................................................................
   1    -35.8109736 -0.358110E+02  0.111E-04    1.72       0.0  T
   2    -35.8109736 -0.466187E-10  0.751E-05    1.72     313.8  T
   3    -35.8109736 -0.599414E-10  0.382E-05    1.72     616.6  T
     SCC iter.                  ...        0 min,  0.003 sec
     gradient                   ...        0 min,  0.009 sec
 * total energy  :   -35.4218567 Eh     change        0.4698428E-08 Eh
   gradient norm :     0.0776357 Eh/α   predicted     0.0000000E+00 (-100.00%)
   displ. norm   :     0.3044255 α      lambda       -0.9596050E-02
   maximum displ.:     0.1921666 α      in ANC's #1, #3, #28, ...

........................................................................
.............................. CYCLE    2 ..............................
........................................................................
   1    -35.8462138 -0.358462E+02  0.363E-01    1.88       0.0  T
   2    -35.8462530 -0.391191E-04  0.216E-01    1.87       1.0  T
   3    -35.8461611  0.918448E-04  0.906E-02    1.89       1.0  T
   4    -35.8462721 -0.111011E-03  0.188E-02    1.87       1.3  T
   5    -35.8462747 -0.255957E-05  0.104E-02    1.87       2.3  T
   6    -35.8462753 -0.594983E-06  0.445E-03    1.87       5.3  T
   7    -35.8462754 -0.138970E-06  0.144E-03    1.87      16.4  T
     SCC iter.                  ...        0 min,  0.005 sec
     gradient                   ...        0 min,  0.008 sec
 * total energy  :   -35.4278773 Eh     change       -0.6020617E-02 Eh
   gradient norm :     0.0226811 Eh/α   predicted    -0.5242683E-02 ( -12.92%)
   displ. norm   :     0.2091643 α      lambda       -0.1625572E-02
   maximum displ.:     0.1230614 α      in ANC's #1, #3, #8, ...

........................................................................
.............................. CYCLE    3 ..............................
........................................................................
   1    -35.8578973 -0.358579E+02  0.206E-01    1.91       0.0  T
   2    -35.8579108 -0.135070E-04  0.118E-01    1.91       1.0  T
   3    -35.8578870  0.238451E-04  0.489E-02    1.91       1.0  T
   4    -35.8579163 -0.293582E-04  0.118E-02    1.91       2.0  T
   5    -35.8579175 -0.118644E-05  0.567E-03    1.91       4.2  T
   6    -35.8579176 -0.111237E-06  0.237E-03    1.91       9.9  T
     SCC iter.                  ...        0 min,  0.005 sec
     gradient                   ...        0 min,  0.008 sec
 * total energy  :   -35.4288093 Eh     change       -0.9320210E-03 Eh
   gradient norm :     0.0092489 Eh/α   predicted    -0.8483487E-03 (  -8.98%)
   displ. norm   :     0.2212382 α      lambda       -0.5375232E-03
   maximum displ.:     0.1754630 α      in ANC's #1, #2, #3, ...

........................................................................
.............................. CYCLE    4 ..............................
........................................................................
   1    -35.8570864 -0.358571E+02  0.229E-01    1.89       0.0  T
   2    -35.8570953 -0.890021E-05  0.135E-01    1.90       1.0  T
   3    -35.8570777  0.176455E-04  0.390E-02    1.89       1.0  T
   4    -35.8571002 -0.225646E-04  0.955E-03    1.90       2.5  T
   5    -35.8571003 -0.110694E-06  0.638E-03    1.90       3.7  T
   6    -35.8571007 -0.322059E-06  0.151E-03    1.90      15.6  T
   7    -35.8571007 -0.153543E-07  0.469E-04    1.90      50.3  T
     SCC iter.                  ...        0 min,  0.005 sec
     gradient                   ...        0 min,  0.008 sec
 * total energy  :   -35.4291622 Eh     change       -0.3529575E-03 Eh
   gradient norm :     0.0066693 Eh/α   predicted    -0.2819174E-03 ( -20.13%)
   displ. norm   :     0.1652981 α      lambda       -0.2474159E-03
   maximum displ.:     0.1268115 α      in ANC's #1, #2, #8, ...

........................................................................
.............................. CYCLE    5 ..............................
........................................................................
   1    -35.8561428 -0.358561E+02  0.165E-01    1.90       0.0  T
   2    -35.8561491 -0.636630E-05  0.946E-02    1.90       1.0  T
   3    -35.8561182  0.309492E-04  0.476E-02    1.90       1.0  T
   4    -35.8561541 -0.359070E-04  0.660E-03    1.90       3.6  T
   5    -35.8561543 -0.201375E-06  0.371E-03    1.90       6.4  T
   6    -35.8561544 -0.677085E-07  0.157E-03    1.90      15.1  T
   7    -35.8561544 -0.115988E-07  0.585E-04    1.90      40.3  T
     SCC iter.                  ...        0 min,  0.005 sec
     gradient                   ...        0 min,  0.008 sec
 * total energy  :   -35.4293394 Eh     change       -0.1771411E-03 Eh
   gradient norm :     0.0053471 Eh/α   predicted    -0.1270907E-03 ( -28.25%)
   displ. norm   :     0.1569977 α      lambda       -0.1560252E-03
   maximum displ.:     0.1172134 α      in ANC's #1, #2, #8, ...

........................................................................
.............................. CYCLE    6 ..............................
........................................................................
   1    -35.8560784 -0.358561E+02  0.159E-01    1.91       0.0  T
   2    -35.8560829 -0.449669E-05  0.919E-02    1.90       1.0  T
   3    -35.8560578  0.250473E-04  0.422E-02    1.91       1.0  T
   4    -35.8560869 -0.290084E-04  0.633E-03    1.90       3.7  T
   5    -35.8560870 -0.177756E-06  0.373E-03    1.90       6.3  T
   6    -35.8560871 -0.493031E-07  0.141E-03    1.90      16.7  T
   7    -35.8560871 -0.180201E-07  0.449E-04    1.90      52.5  T
     SCC iter.                  ...        0 min,  0.005 sec
     gradient                   ...        0 min,  0.008 sec
 * total energy  :   -35.4294455 Eh     change       -0.1060644E-03 Eh
   gradient norm :     0.0051092 Eh/α   predicted    -0.7993089E-04 ( -24.64%)
   displ. norm   :     0.1091199 α      lambda       -0.6914845E-04
   maximum displ.:     0.0774514 α      in ANC's #1, #2, #8, ...

........................................................................
.............................. CYCLE    7 ..............................
........................................................................
   1    -35.8567839 -0.358568E+02  0.105E-01    1.92       0.0  T
   2    -35.8567862 -0.227736E-05  0.607E-02    1.91       1.0  T
   3    -35.8567747  0.114718E-04  0.287E-02    1.92       1.0  T
   4    -35.8567881 -0.134177E-04  0.478E-03    1.92       4.9  T
   5    -35.8567883 -0.193442E-06  0.238E-03    1.91       9.9  T
   6    -35.8567883 -0.158621E-07  0.813E-04    1.91      29.0  T
     SCC iter.                  ...        0 min,  0.005 sec
     gradient                   ...        0 min,  0.008 sec
 * total energy  :   -35.4294903 Eh     change       -0.4489588E-04 Eh
   gradient norm :     0.0030611 Eh/α   predicted    -0.3498618E-04 ( -22.07%)
   displ. norm   :     0.0624387 α      lambda       -0.2380654E-04
   maximum displ.:     0.0447157 α      in ANC's #2, #1, #8, ...

........................................................................
.............................. CYCLE    8 ..............................
........................................................................
   1    -35.8574243 -0.358574E+02  0.610E-02    1.92       0.0  T
   2    -35.8574249 -0.669189E-06  0.354E-02    1.92       1.0  T
   3    -35.8574243  0.643490E-06  0.824E-03    1.92       2.9  T
   4    -35.8574252 -0.888021E-06  0.258E-03    1.92       9.1  T
   5    -35.8574252 -0.329023E-07  0.115E-03    1.92      20.5  T
   6    -35.8574252 -0.358846E-08  0.403E-04    1.92      58.5  T
   7    -35.8574252 -0.941576E-09  0.144E-04    1.92     163.9  T
     SCC iter.                  ...        0 min,  0.005 sec
     gradient                   ...        0 min,  0.009 sec
 * total energy  :   -35.4295039 Eh     change       -0.1359440E-04 Eh
   gradient norm :     0.0011073 Eh/α   predicted    -0.1194822E-04 ( -12.11%)
   displ. norm   :     0.0320541 α      lambda       -0.5616975E-05
   maximum displ.:     0.0258931 α      in ANC's #2, #1, #3, ...

........................................................................
.............................. CYCLE    9 ..............................
........................................................................
   1    -35.8577883 -0.358578E+02  0.261E-02    1.92       0.0  T
   2    -35.8577885 -0.228233E-06  0.151E-02    1.92       1.6  T
   3    -35.8577881  0.381326E-06  0.590E-03    1.92       4.0  T
   4    -35.8577886 -0.499657E-06  0.134E-03    1.92      17.6  T
   5    -35.8577886 -0.856195E-08  0.804E-04    1.92      29.3  T
   6    -35.8577886 -0.363379E-08  0.227E-04    1.92     103.6  T
     SCC iter.                  ...        0 min,  0.005 sec
     gradient                   ...        0 min,  0.009 sec
 * total energy  :   -35.4295061 Eh     change       -0.2158315E-05 Eh
   gradient norm :     0.0010836 Eh/α   predicted    -0.2810813E-05 (  30.23%)
   displ. norm   :     0.0114378 α      lambda       -0.2459116E-05
   maximum displ.:     0.0090187 α      in ANC's #1, #6, #3, ...

........................................................................
.............................. CYCLE   10 ..............................
........................................................................
   1    -35.8577123 -0.358577E+02  0.977E-03    1.92       0.0  T
   2    -35.8577124 -0.771998E-07  0.580E-03    1.92       4.1  T
   3    -35.8577123  0.684807E-07  0.347E-03    1.92       6.8  T
   4    -35.8577124 -0.131720E-06  0.646E-04    1.92      36.5  T
   5    -35.8577125 -0.438871E-08  0.313E-04    1.92      75.3  T
     SCC iter.                  ...        0 min,  0.004 sec
     gradient                   ...        0 min,  0.009 sec
 * total energy  :   -35.4295079 Eh     change       -0.1835026E-05 Eh
   gradient norm :     0.0004240 Eh/α   predicted    -0.1227595E-05 ( -33.10%)
   displ. norm   :     0.0104948 α      lambda       -0.9205977E-06
   maximum displ.:     0.0089750 α      in ANC's #1, #2, #5, ...

   *** GEOMETRY OPTIMIZATION CONVERGED AFTER 10 ITERATIONS ***

------------------------------------------------------------------------
 total energy gain   :        -0.0076513 Eh       -4.8013 kcal/mol
 total RMSD          :         0.2608065 a0        0.1380 Å
 total power (kW/mol):        -2.0088433 (step)  -99.1829 (real)
------------------------------------------------------------------------

 ANCopt (total)                0 d,  0 h,  0 min,  0.203 sec
 optimizer setup                ...        0 min,  0.000 sec (  0.067%)
 model hessian                  ...        0 min,  0.005 sec (  2.382%)
 ANC generation                 ...        0 min,  0.000 sec (  0.223%)
 coordinate transformation      ...        0 min,  0.000 sec (  0.063%)
 single point calculation       ...        0 min,  0.194 sec ( 95.589%)
 optimization log               ...        0 min,  0.001 sec (  0.400%)
 hessian update                 ...        0 min,  0.000 sec (  0.051%)
 rational function              ...        0 min,  0.002 sec (  0.904%)

================
 final structure:
================
$coord
   -2.71389834481769    0.31414282388077   -0.34379556603302      C 
   -1.03054006367553    2.04613938018633   -1.03526190687788      C 
    1.64873062378999    1.66837777283602   -0.61154931825152      C 
    2.54653284025000   -0.54321707175307    0.17576771065168      C 
    0.85575712684718   -2.79417384978849    0.61308065925154      C 
   -1.94389187913289   -2.05891321340476    1.03145310433245      C 
   -3.72848746137600   -4.01125845124483    0.35333180171979      N 
   -3.08029638908401   -5.65297181610899   -1.23469969186435      C 
   -0.52171982680141   -5.76317600176462   -2.33710239060803      C 
    1.28838895239197   -4.47240982197083   -1.50886240865520      N 
   -0.15825412417501   -7.29036426254398   -4.30126629152963      F 
   -4.73405171146964   -7.41181336338965   -1.93322930380394      F 
   -4.71532384702637    0.52628094191712   -0.66508063295065      H 
   -1.62169623092198    3.76491930645940   -1.95961995720747      H 
    2.90482659942105    3.22904209287721   -0.99289181389574      H 
    4.54284985640196   -0.89699528354340    0.36932561005937      H 
    1.54808146378108   -3.83439649979165    2.27191162147424      H 
   -2.25761230766683   -1.71249211061944    3.05672037431425      H 
$end
           -------------------------------------------------
          |                Final Singlepoint                |
           -------------------------------------------------

          ...................................................
          :                      SETUP                      :
          :.................................................:
          :  # basis functions                  54          :
          :  # atomic orbitals                  54          :
          :  # shells                           30          :
          :  # electrons                        62          :
          :  max. iterations                   250          :
          :  Hamiltonian                  GFN2-xTB          :
          :  restarted?                      false          :
          :  GBSA solvation                  false          :
          :  PC potential                    false          :
          :  electronic temp.          300.0000000     K    :
          :  accuracy                    1.0000000          :
          :  -> integral cutoff          0.2500000E+02      :
          :  -> integral neglect         0.1000000E-07      :
          :  -> SCF convergence          0.1000000E-05 Eh   :
          :  -> wf. convergence          0.1000000E-03 e    :
          :  Broyden damping             0.4000000          :
          ...................................................

 iter      E             dE          RMSdq      gap      omega  full diag
   1    -35.8577125 -0.358577E+02  0.149E-04    1.92       0.0  T
   2    -35.8577125 -0.461853E-12  0.819E-05    1.92     287.9  T
   3    -35.8577125 -0.753673E-10  0.700E-05    1.92     336.8  T

   *** convergence criteria satisfied after 3 iterations ***

         #    Occupation            Energy/Eh            Energy/eV
      -------------------------------------------------------------
         1        2.0000           -0.8565249             -23.3072
       ...           ...                  ...                  ...
        25        2.0000           -0.4798984             -13.0587
        26        2.0000           -0.4687142             -12.7544
        27        2.0000           -0.4561683             -12.4130
        28        2.0000           -0.4542389             -12.3605
        29        2.0000           -0.4355975             -11.8532
        30        2.0000           -0.4055856             -11.0365
        31        2.0000           -0.3928933             -10.6912 (HOMO)
        32                         -0.3223056              -8.7704 (LUMO)
        33                         -0.2728633              -7.4250
        34                         -0.2091841              -5.6922
        35                         -0.1680551              -4.5730
        36                         -0.0178774              -0.4865
       ...                                ...                  ...
        54                          0.6691263              18.2079
      -------------------------------------------------------------
                  HL-Gap            0.0705877 Eh            1.9208 eV
             Fermi-level           -0.3575995 Eh           -9.7308 eV

 SCC (total)                   0 d,  0 h,  0 min,  0.018 sec
 SCC setup                      ...        0 min,  0.000 sec (  0.835%)
 Dispersion                     ...        0 min,  0.000 sec (  0.677%)
 integral evaluation            ...        0 min,  0.005 sec ( 30.308%)
 zeroth order Hamiltonian       ...        0 min,  0.000 sec (  0.599%)
 iterations                     ...        0 min,  0.003 sec ( 15.791%)
 molecular gradient             ...        0 min,  0.009 sec ( 50.075%)
 printout                       ...        0 min,  0.000 sec (  1.466%)

         :::::::::::::::::::::::::::::::::::::::::::::::::::::
         ::                     SUMMARY                     ::
         :::::::::::::::::::::::::::::::::::::::::::::::::::::
         :: total energy             -35.429507951215 Eh    ::
         :: gradient norm              0.000424842028 Eh/a0 ::
         :: HOMO-LUMO gap              1.920790261823 eV    ::
         ::.................................................::
         :: SCC energy               -35.857712451808 Eh    ::
         :: -> isotropic ES            0.035674407456 Eh    ::
         :: -> anisotropic ES          0.002228123286 Eh    ::
         :: -> anisotropic XC          0.015428137929 Eh    ::
         :: -> dispersion             -0.017103614665 Eh    ::
         :: repulsion energy           0.428123714464 Eh    ::
         :: add. restraining           0.000000000000 Eh    ::
         :::::::::::::::::::::::::::::::::::::::::::::::::::::

           -------------------------------------------------
          |                Property Printout                |
           -------------------------------------------------

    * Orbital Energies and Occupations

         #    Occupation            Energy/Eh            Energy/eV
      -------------------------------------------------------------
         1        2.0000           -0.8565249             -23.3072
       ...           ...                  ...                  ...
        19        2.0000           -0.5289800             -14.3943
        20        2.0000           -0.5218780             -14.2010
        21        2.0000           -0.5163754             -14.0513
        22        2.0000           -0.5088960             -13.8478
        23        2.0000           -0.5051077             -13.7447
        24        2.0000           -0.4839343             -13.1685
        25        2.0000           -0.4798984             -13.0587
        26        2.0000           -0.4687142             -12.7544
        27        2.0000           -0.4561683             -12.4130
        28        2.0000           -0.4542389             -12.3605
        29        2.0000           -0.4355975             -11.8532
        30        2.0000           -0.4055856             -11.0365
        31        2.0000           -0.3928933             -10.6912 (HOMO)
        32                         -0.3223056              -8.7704 (LUMO)
        33                         -0.2728633              -7.4250
        34                         -0.2091841              -5.6922
        35                         -0.1680551              -4.5730
        36                         -0.0178774              -0.4865
        37                          0.0217909               0.5930
        38                          0.0316904               0.8623
        39                          0.0630518               1.7157
        40                          0.0828140               2.2535
        41                          0.0987871               2.6881
        42                          0.1181801               3.2158
       ...                                ...                  ...
        54                          0.6691263              18.2079
      -------------------------------------------------------------
                  HL-Gap            0.0705877 Eh            1.9208 eV
             Fermi-level           -0.3575995 Eh           -9.7308 eV

     #   Z        covCN         q      C6AA      α(0)
     1   6 C      2.905    -0.038    28.954     8.823
     2   6 C      2.903    -0.032    28.801     8.800
     3   6 C      2.903    -0.029    28.725     8.788
     4   6 C      2.908    -0.035    28.868     8.810
     5   6 C      3.826     0.047    19.774     6.328
     6   6 C      3.829     0.044    19.809     6.333
     7   7 N      1.838    -0.225    26.770     7.668
     8   6 C      2.720     0.247    22.845     7.824
     9   6 C      2.718     0.247    22.859     7.827
    10   7 N      1.841    -0.224    26.730     7.662
    11   9 F      0.789    -0.173    10.956     3.910
    12   9 F      0.789    -0.172    10.948     3.908
    13   1 H      0.926     0.057     2.238     2.339
    14   1 H      0.926     0.050     2.319     2.382
    15   1 H      0.926     0.050     2.317     2.380
    16   1 H      0.926     0.058     2.217     2.328
    17   1 H      0.923     0.057     2.233     2.337
    18   1 H      0.923     0.070     2.081     2.256

 Mol. C6AA /au·bohr⁶  :       4305.157246
 Mol. C8AA /au·bohr⁸  :     102924.119007
 Mol. α(0) /au        :        100.702910


Wiberg/Mayer (AO) data.
largest (>0.10) Wiberg bond orders for each atom
          total WBO             WBO to atom ...
     1  C   3.986        C    2 1.845    C    6 0.986    H   13 0.965    C    4 0.123
     2  C   3.990        C    1 1.845    C    3 1.111    H   14 0.964
     3  C   3.992        C    4 1.850    C    2 1.111    H   15 0.966
     4  C   3.985        C    3 1.850    C    5 0.990    H   16 0.966    C    1 0.123
     5  C   3.976        C    4 0.990    N   10 0.989    C    6 0.962    H   17 0.937
     6  C   3.976        N    7 0.999    C    1 0.986    C    5 0.962    H   18 0.931
     7  N   3.083        C    8 1.790    C    6 0.999    F   12 0.109
     8  C   3.905        N    7 1.790    F   12 0.998    C    9 0.992
     9  C   3.906        N   10 1.792    F   11 0.996    C    8 0.992
    10  N   3.088        C    9 1.792    C    5 0.989    F   11 0.109
    11  F   1.168        C    9 0.996    N   10 0.109
    12  F   1.167        C    8 0.998    N    7 0.109
    13  H   0.997        C    1 0.965
    14  H   0.997        C    2 0.964
    15  H   0.997        C    3 0.966
    16  H   0.997        C    4 0.966
    17  H   0.997        C    5 0.937
    18  H   0.995        C    6 0.931

molecular dipole:
                 x           y           z       tot (Debye)
 q only:        0.448       1.275       0.764
   full:        0.405       1.117       0.753       3.576
molecular quadrupole (traceless):
                xx          xy          yy          xz          yz          zz
 q only:        2.831      -5.105      -6.321       0.253      -8.278       3.491
  q+dip:        1.390      -5.345      -4.210       1.984     -11.059       2.820
   full:       -0.265      -5.491      -4.142       2.433     -10.566       4.407

           -------------------------------------------------
          |                Geometry Summary                 |
           -------------------------------------------------

      molecular mass/u    :      168.1456000
   center of mass at/Å    :       -0.5590510      -1.7328367      -0.5585547
  moments of inertia/u·Å² :        0.2754355E+03   0.6623098E+03   0.8132116E+03
rotational constants/cm⁻¹ :        0.6120355E-01   0.2545279E-01   0.2072970E-01

 * 12 selected distances

     #   Z        #   Z                                     value/Å
     1   6 C      2   6 C                                 1.3294501
     3   6 C      4   6 C                                 1.3300225
     7   7 N      8   6 C                                 1.2564164
     9   6 C     10   7 N                                 1.2554503
     9   6 C     11   9 F                                 1.3305784 (max)
     8   6 C     12   9 F                                 1.3299493
     1   6 C     13   1 H                                 1.0785264
     2   6 C     14   1 H                                 1.0790686
     3   6 C     15   1 H                                 1.0791678
     4   6 C     16   1 H                                 1.0777439 (min)
     5   6 C     17   1 H                                 1.0989951
     6   6 C     18   1 H                                 1.0998915

 * 4 distinct bonds (by element types)

   Z      Z             #   av. dist./Å        max./Å        min./Å
   1 H    6 C           6     1.0855656     1.0998915     1.0777439
   6 C    6 C           2     1.3297363     1.3300225     1.3294501
   6 C    7 N           2     1.2559334     1.2564164     1.2554503
   6 C    9 F           2     1.3302639     1.3305784     1.3299493


optimized geometry written to: xtbopt.xyz


           -------------------------------------------------
          | TOTAL ENERGY              -35.429507951215 Eh   |
          | GRADIENT NORM               0.000424842028 Eh/α |
          | HOMO-LUMO GAP               1.920790261823 eV   |
           -------------------------------------------------

------------------------------------------------------------------------
 * finished run on 2021/02/19 at 08:11:39.822     
------------------------------------------------------------------------
 total:
 * wall-time:     0 d,  0 h,  0 min,  0.265 sec
 *  cpu-time:     0 d,  0 h,  0 min,  0.262 sec
 * ratio c/w:     0.988 speedup
 SCF:
 * wall-time:     0 d,  0 h,  0 min,  0.025 sec
 *  cpu-time:     0 d,  0 h,  0 min,  0.025 sec
 * ratio c/w:     0.998 speedup
 ANC optimizer:
 * wall-time:     0 d,  0 h,  0 min,  0.221 sec
 *  cpu-time:     0 d,  0 h,  0 min,  0.220 sec
 * ratio c/w:     0.998 speedup

