      -----------------------------------------------------------      
     |                   =====================                   |     
     |                           x T B                           |     
     |                   =====================                   |     
     |                         S. Grimme                         |     
     |          Mulliken Center for Theoretical Chemistry        |     
     |                    University of Bonn                     |     
     |                Version 6.2 RC2 (SAW190805)                |     
      -----------------------------------------------------------      

   This program is distributed in the hope that it will be useful,
   but WITHOUT ANY WARRANTY; without even the implied warranty of
   MERCHANTABILITY or FITNESS FOR A PARTICULAR PURPOSE.
   
   FOR NON-COMMERCIAL, ACADEMIA USE ONLY.
   
   Cite this work as:
   * S. Grimme, C. Bannwarth, P. Shushkov, J. Chem. Theory Comput., 2017,
     13, 1989-2009. DOI: 10.1021/acs.jctc.7b00118
   * C. Bannwarth, S. Ehlert and S. Grimme., J. Chem. Theory Comput., 2019,
     15, 1652-1671. DOI: 10.1021/acs.jctc.8b01176
   * P. Pracht, E. Caldeweyher, S. Ehlert, S. Grimme, ChemRxiv, 2019, preprint.
     DOI: 10.26434/chemrxiv.8326202.v1
   
   for DFT-D4:
   * E. Caldeweyher, C. Bannwarth and S. Grimme, J. Chem. Phys., 2017,
     147, 034112. DOI: 10.1063/1.4993215
   * E. Caldeweyher, S. Ehlert, A. Hansen, H. Neugebauer, S. Spicher,
     C. Bannwarth and S. Grimme, J. Chem. Phys., 2019, 150, 154122.
     DOI: 10.1063/1.5090222
   
   for sTDA-xTB:
   * S. Grimme and C. Bannwarth, J. Chem. Phys., 2016, 145, 054103.
     DOI: 10.1063/1.4959605
   
   in the mass-spec context:
   * V. Asgeirsson, C. Bauer and S. Grimme, Chem. Sci., 2017, 8, 4879.
     DOI: 10.1039/c7sc00601b
   
   for metadynamics refer to:
   * S. Grimme, J. Chem. Theory Comput., 2019, 155, 2847-2862
     DOI: 10.1021/acs.jctc.9b00143
   
   with help from (in alphabetical order)
   C. Bannwarth, F. Bohle, G. Brandenburg, E. Caldeweyher, M. Checinski,
   S. Dohm, S. Ehlert, S. Ehrlich, F. März, H. Neugebauer, J. Pisarek,
   P. Pracht, P. Shushkov, and S. Spicher.
   
 * started run on 2021/02/19 at 08:12:03.712     

           -------------------------------------------------
          |                Calculation Setup                |
           -------------------------------------------------

          program call               : /ihome/ghutchison/geoffh/xtb/xtb 29u.xyz -opt
          hostname                   : smp-n135
          coordinate file            : 29u.xyz
          omp threads                :                     1
          number of atoms            :                    26
          number of electrons        :                   128
          charge                     :                     0
          spin                       :                   0.0
          first test random number   :      0.70256595253856


########################################################################
# WARNING! Please study the warnings concerning your input carefully
#  - the use of '-opt' is discouraged, please use '--opt' next time
########################################################################

           ------------------------------------------------- 
          |                 G F N 2 - x T B                 |
          | Geometry, Frequencies, Noncovalent interactions |
          |            JCTC 2019 parametrisation            |
           ------------------------------------------------- 
             KAB for C  - Si     :                1.0500
             KAB for H  - Pd     :                0.9500
             k(s)              :                1.8500
             k(p)              :                2.2300
             k(d)              :                2.2300
             k(f)              :                2.0000
             kEN (H0ij)        :               -2.0000
             D4 a1             :                0.5200
             D4 a2             :                5.0000
             D4 s6             :                1.0000
             D4 s8             :                2.7000
             D4 s9             :                5.0000
             alphaj            :                2.0000

  Z AO/shell   Hii/eV     exponent
  1     Wed Apr 25 08:07:45 CEST 2018   EN: 2.200 GM2: 0.406  GM3: 0.0800  RAES: 1.40
     1s    -10.707211    1.230000
  6     Wed Apr 25 08:07:45 CEST 2018   EN: 2.550 GM2: 0.538  GM3: 0.1500  RAES: 3.00
     2s    -13.970922    2.096432
     2p    -10.063292    1.800000
  9     Mon Apr 23 13:58:50 CEST 2018   EN: 3.980 GM2: 0.532  GM3: 0.1426  RAES: 2.40
     2s    -23.458179    2.416361
     2p    -15.746583    2.308399

           ------------------------------------------------- 
          |        Self-Consistent Charge Iterations        |
           ------------------------------------------------- 

          ...................................................
          :                      SETUP                      :
          :.................................................:
          :  # basis functions                  98          :
          :  # atomic orbitals                  98          :
          :  # shells                           50          :
          :  # electrons                       128          :
          :  max. iterations                   250          :
          :  Hamiltonian                  GFN2-xTB          :
          :  restarted?                      false          :
          :  GBSA solvation                  false          :
          :  PC potential                    false          :
          :  electronic temp.          300.0000000     K    :
          :  accuracy                    1.0000000          :
          :  -> integral cutoff          0.2500000E+02      :
          :  -> integral neglect         0.1000000E-07      :
          :  -> SCF convergence          0.1000000E-05 Eh   :
          :  -> wf. convergence          0.1000000E-03 e    :
          :  Broyden damping             0.4000000          :
          ...................................................

 iter      E             dE          RMSdq      gap      omega  full diag
   1    -78.7981212 -0.787981E+02  0.502E+00    2.96       0.0  T
   2    -78.8464066 -0.482855E-01  0.281E+00    2.84       1.0  T
   3    -78.8343310  0.120757E-01  0.137E+00    2.91       1.0  T
   4    -78.8578512 -0.235202E-01  0.325E-01    2.87       1.0  T
   5    -78.8587085 -0.857289E-03  0.868E-02    2.87       1.0  T
   6    -78.8587350 -0.264943E-04  0.458E-02    2.87       1.0  T
   7    -78.8587437 -0.876724E-05  0.161E-02    2.87       1.2  T
   8    -78.8587463 -0.255714E-05  0.695E-03    2.87       2.8  T
   9    -78.8587467 -0.377687E-06  0.327E-03    2.87       6.0  T
  10    -78.8587467 -0.920229E-07  0.668E-04    2.87      29.4  T
  11    -78.8587468 -0.920672E-08  0.270E-04    2.87      72.5  T

   *** convergence criteria satisfied after 11 iterations ***

         #    Occupation            Energy/Eh            Energy/eV
      -------------------------------------------------------------
         1        2.0000           -0.8794732             -23.9317
       ...           ...                  ...                  ...
        58        2.0000           -0.5061382             -13.7727
        59        2.0000           -0.4955412             -13.4844
        60        2.0000           -0.4897362             -13.3264
        61        2.0000           -0.4784994             -13.0206
        62        2.0000           -0.4657013             -12.6724
        63        2.0000           -0.4656953             -12.6722
        64        2.0000           -0.4473269             -12.1724 (HOMO)
        65                         -0.3418805              -9.3030 (LUMO)
        66                         -0.3073465              -8.3633
        67                         -0.3073030              -8.3621
        68                         -0.3003839              -8.1739
        69                         -0.2475413              -6.7359
       ...                                ...                  ...
        98                          0.5844880              15.9047
      -------------------------------------------------------------
                  HL-Gap            0.1054464 Eh            2.8693 eV
             Fermi-level           -0.3946037 Eh          -10.7377 eV

 SCC (total)                   0 d,  0 h,  0 min,  0.062 sec
 SCC setup                      ...        0 min,  0.000 sec (  0.586%)
 Dispersion                     ...        0 min,  0.000 sec (  0.675%)
 integral evaluation            ...        0 min,  0.019 sec ( 29.955%)
 zeroth order Hamiltonian       ...        0 min,  0.000 sec (  0.402%)
 iterations                     ...        0 min,  0.021 sec ( 34.433%)
 molecular gradient             ...        0 min,  0.021 sec ( 33.223%)
 printout                       ...        0 min,  0.000 sec (  0.636%)

         :::::::::::::::::::::::::::::::::::::::::::::::::::::
         ::                     SUMMARY                     ::
         :::::::::::::::::::::::::::::::::::::::::::::::::::::
         :: total energy             -78.242113543196 Eh    ::
         :: gradient norm              0.038531586562 Eh/a0 ::
         :: HOMO-LUMO gap              2.869343435900 eV    ::
         ::.................................................::
         :: SCC energy               -78.858746757624 Eh    ::
         :: -> isotropic ES            0.092137342784 Eh    ::
         :: -> anisotropic ES          0.011512292697 Eh    ::
         :: -> anisotropic XC         -0.038970562567 Eh    ::
         :: -> dispersion             -0.027691419620 Eh    ::
         :: repulsion energy           0.616825707396 Eh    ::
         :: add. restraining           0.000000000000 Eh    ::
         :::::::::::::::::::::::::::::::::::::::::::::::::::::

      ----------------------------------------------------------- 
     |                   =====================                   |
     |                        A N C O P T                        |
     |                   =====================                   |
     |               Approximate Normal Coordinate               |
     |                Rational Function Optimizer                |
      ----------------------------------------------------------- 

          ...................................................
          :                      SETUP                      :
          :.................................................:
          :   optimization level            normal          :
          :   max. optcycles                   200          :
          :   ANC micro-cycles                  20          :
          :   degrees of freedom                72          :
          :.................................................:
          :   RF solver                   davidson          :
          :   input Hessian                  false          :
          :   write xtbopt.log                true          :
          :   linear?                        false          :
          :   energy convergence         0.5000000E-05 Eh   :
          :   grad. convergence          0.1000000E-02 Eh/α :
          :   maximium RF displ.         2.0000000          :
          :   Hlow (freq-cutoff)         0.5000000E-02      :
          :   Hmax (freq-cutoff)         5.0000000          :
          :   S6 in model hess.         20.0000000          :
          ...................................................

generating ANC from model Hessian ...
Using Lindh-Hessian (1995)
 Shifting diagonal of input Hessian by   4.416893965234465E-003
 Lowest  eigenvalues of input Hessian
   -0.000000   -0.000000    0.000000    0.000000    0.000000    0.000000
    0.005000    0.005295    0.005718    0.009188    0.010561    0.013256
    0.017109    0.019613    0.019908    0.024602    0.025115    0.027898
 Highest eigenvalues
    1.902621    1.966178    2.190571    2.199280    2.208753    2.212876
 

........................................................................
.............................. CYCLE    1 ..............................
........................................................................
   1    -78.8587468 -0.788587E+02  0.134E-04    2.87       0.0  T
   2    -78.8587468 -0.807603E-10  0.727E-05    2.87     269.8  T
   3    -78.8587468  0.110845E-11  0.416E-05    2.87     471.6  T
     SCC iter.                  ...        0 min,  0.006 sec
     gradient                   ...        0 min,  0.021 sec
 * total energy  :   -78.2421135 Eh     change        0.2825995E-07 Eh
   gradient norm :     0.0385355 Eh/α   predicted     0.0000000E+00 (-100.00%)
   displ. norm   :     0.1584294 α      lambda       -0.2221621E-02
   maximum displ.:     0.0993877 α      in ANC's #10, #7, #5, ...

........................................................................
.............................. CYCLE    2 ..............................
........................................................................
   1    -78.8727406 -0.788727E+02  0.832E-02    2.83       0.0  T
   2    -78.8727517 -0.111044E-04  0.492E-02    2.84       1.0  T
   3    -78.8727513  0.437783E-06  0.123E-02    2.83       1.6  T
   4    -78.8727522 -0.894872E-06  0.368E-03    2.84       5.3  T
   5    -78.8727524 -0.255589E-06  0.149E-03    2.84      13.2  T
     SCC iter.                  ...        0 min,  0.009 sec
     gradient                   ...        0 min,  0.019 sec
 * total energy  :   -78.2435824 Eh     change       -0.1468847E-02 Eh
   gradient norm :     0.0173582 Eh/α   predicted    -0.1138704E-02 ( -22.48%)
   displ. norm   :     0.0955276 α      lambda       -0.4762567E-03
   maximum displ.:     0.0544554 α      in ANC's #7, #2, #10, ...

........................................................................
.............................. CYCLE    3 ..............................
........................................................................
   1    -78.8786507 -0.788787E+02  0.615E-02    2.80       0.0  T
   2    -78.8786569 -0.623623E-05  0.361E-02    2.80       1.0  T
   3    -78.8786559  0.105310E-05  0.108E-02    2.80       1.8  T
   4    -78.8786571 -0.124893E-05  0.340E-03    2.80       5.8  T
   5    -78.8786574 -0.320017E-06  0.896E-04    2.80      21.9  T
   6    -78.8786574 -0.136782E-08  0.437E-04    2.80      44.9  T
     SCC iter.                  ...        0 min,  0.011 sec
     gradient                   ...        0 min,  0.019 sec
 * total energy  :   -78.2438247 Eh     change       -0.2423307E-03 Eh
   gradient norm :     0.0036134 Eh/α   predicted    -0.2403028E-03 (  -0.84%)
   displ. norm   :     0.0394488 α      lambda       -0.3459997E-04
   maximum displ.:     0.0313241 α      in ANC's #2, #1, #6, ...

........................................................................
.............................. CYCLE    4 ..............................
........................................................................
   1    -78.8780656 -0.788781E+02  0.318E-02    2.79       0.0  T
   2    -78.8780661 -0.402525E-06  0.192E-02    2.79       1.0  T
   3    -78.8780652  0.813980E-06  0.704E-03    2.79       2.8  T
   4    -78.8780662 -0.101226E-05  0.835E-04    2.79      23.5  T
   5    -78.8780663 -0.351605E-08  0.509E-04    2.79      38.6  T
   6    -78.8780663 -0.205583E-08  0.275E-04    2.79      71.2  T
     SCC iter.                  ...        0 min,  0.011 sec
     gradient                   ...        0 min,  0.021 sec
 * total energy  :   -78.2438488 Eh     change       -0.2409847E-04 Eh
   gradient norm :     0.0016750 Eh/α   predicted    -0.1733072E-04 ( -28.08%)
   displ. norm   :     0.0875658 α      lambda       -0.2512532E-04
   maximum displ.:     0.0746742 α      in ANC's #2, #1, #6, ...

........................................................................
.............................. CYCLE    5 ..............................
........................................................................
   1    -78.8767626 -0.788768E+02  0.704E-02    2.77       0.0  T
   2    -78.8767636 -0.104362E-05  0.423E-02    2.77       1.0  T
   3    -78.8767609  0.268682E-05  0.124E-02    2.77       1.6  T
   4    -78.8767642 -0.330492E-05  0.162E-03    2.77      12.1  T
   5    -78.8767642 -0.227062E-08  0.975E-04    2.77      20.1  T
   6    -78.8767642 -0.814786E-08  0.450E-04    2.77      43.5  T
     SCC iter.                  ...        0 min,  0.011 sec
     gradient                   ...        0 min,  0.021 sec
 * total energy  :   -78.2438748 Eh     change       -0.2605649E-04 Eh
   gradient norm :     0.0024006 Eh/α   predicted    -0.1260884E-04 ( -51.61%)
   displ. norm   :     0.0464309 α      lambda       -0.1540506E-04
   maximum displ.:     0.0389452 α      in ANC's #2, #1, #6, ...

........................................................................
.............................. CYCLE    6 ..............................
........................................................................
   1    -78.8767520 -0.788768E+02  0.368E-02    2.77       0.0  T
   2    -78.8767521 -0.109709E-06  0.221E-02    2.77       1.0  T
   3    -78.8767521  0.244718E-07  0.216E-03    2.77       9.1  T
   4    -78.8767521 -0.801704E-07  0.815E-04    2.77      24.1  T
   5    -78.8767521 -0.966509E-09  0.496E-04    2.77      39.6  T
     SCC iter.                  ...        0 min,  0.009 sec
     gradient                   ...        0 min,  0.021 sec
 * total energy  :   -78.2438894 Eh     change       -0.1457605E-04 Eh
   gradient norm :     0.0022962 Eh/α   predicted    -0.7719391E-05 ( -47.04%)
   displ. norm   :     0.0656410 α      lambda       -0.2280678E-04
   maximum displ.:     0.0517175 α      in ANC's #2, #1, #6, ...

........................................................................
.............................. CYCLE    7 ..............................
........................................................................
   1    -78.8770122 -0.788770E+02  0.513E-02    2.77       0.0  T
   2    -78.8770124 -0.222723E-06  0.308E-02    2.77       1.0  T
   3    -78.8770123  0.125578E-06  0.320E-03    2.77       6.1  T
   4    -78.8770126 -0.248940E-06  0.108E-03    2.77      18.1  T
   5    -78.8770126 -0.219035E-08  0.456E-04    2.77      43.0  T
   6    -78.8770126 -0.823874E-09  0.129E-04    2.77     151.8  T
     SCC iter.                  ...        0 min,  0.011 sec
     gradient                   ...        0 min,  0.021 sec
 * total energy  :   -78.2439104 Eh     change       -0.2096710E-04 Eh
   gradient norm :     0.0015137 Eh/α   predicted    -0.1145520E-04 ( -45.37%)
   displ. norm   :     0.1496108 α      lambda       -0.2957100E-04
   maximum displ.:     0.1143085 α      in ANC's #2, #1, #6, ...

........................................................................
.............................. CYCLE    8 ..............................
........................................................................
   1    -78.8774786 -0.788775E+02  0.116E-01    2.77       0.0  T
   2    -78.8774797 -0.108648E-05  0.699E-02    2.77       1.0  T
   3    -78.8774789  0.724705E-06  0.815E-03    2.77       2.4  T
   4    -78.8774803 -0.138867E-05  0.248E-03    2.77       7.9  T
   5    -78.8774803  0.511349E-08  0.106E-03    2.77      18.5  T
   6    -78.8774803 -0.134830E-07  0.431E-04    2.77      45.5  T
   7    -78.8774803 -0.328026E-08  0.103E-04    2.77     191.0  T
     SCC iter.                  ...        0 min,  0.012 sec
     gradient                   ...        0 min,  0.021 sec
 * total energy  :   -78.2439484 Eh     change       -0.3796947E-04 Eh
   gradient norm :     0.0015531 Eh/α   predicted    -0.1494108E-04 ( -60.65%)
   displ. norm   :     0.1573261 α      lambda       -0.2526990E-04
   maximum displ.:     0.1189723 α      in ANC's #2, #1, #3, ...

........................................................................
.............................. CYCLE    9 ..............................
........................................................................
   1    -78.8774993 -0.788775E+02  0.122E-01    2.76       0.0  T
   2    -78.8775004 -0.103255E-05  0.734E-02    2.76       1.0  T
   3    -78.8775006 -0.198052E-06  0.563E-03    2.76       3.5  T
   4    -78.8775010 -0.427380E-06  0.260E-03    2.76       7.5  T
   5    -78.8775010  0.676707E-09  0.104E-03    2.76      18.8  T
   6    -78.8775010 -0.149412E-07  0.377E-04    2.76      52.1  T
   7    -78.8775010 -0.279127E-08  0.637E-05    2.76     308.0  T
     SCC iter.                  ...        0 min,  0.012 sec
     gradient                   ...        0 min,  0.021 sec
 * total energy  :   -78.2439829 Eh     change       -0.3457975E-04 Eh
   gradient norm :     0.0017064 Eh/α   predicted    -0.1277583E-04 ( -63.05%)
   displ. norm   :     0.1708541 α      lambda       -0.2557682E-04
   maximum displ.:     0.1283676 α      in ANC's #2, #1, #3, ...

........................................................................
.............................. CYCLE   10 ..............................
........................................................................
   1    -78.8773305 -0.788773E+02  0.132E-01    2.75       0.0  T
   2    -78.8773318 -0.123902E-05  0.797E-02    2.75       1.0  T
   3    -78.8773322 -0.392889E-06  0.495E-03    2.75       4.0  T
   4    -78.8773325 -0.321655E-06  0.286E-03    2.75       6.9  T
   5    -78.8773325 -0.381960E-07  0.103E-03    2.75      19.0  T
   6    -78.8773325 -0.685334E-08  0.464E-04    2.75      42.3  T
   7    -78.8773326 -0.523100E-08  0.387E-05    2.75     506.6  T
     SCC iter.                  ...        0 min,  0.012 sec
     gradient                   ...        0 min,  0.021 sec
 * total energy  :   -78.2440179 Eh     change       -0.3498958E-04 Eh
   gradient norm :     0.0011560 Eh/α   predicted    -0.1295714E-04 ( -62.97%)
   displ. norm   :     0.1856863 α      lambda       -0.2462335E-04
   maximum displ.:     0.1399296 α      in ANC's #2, #1, #3, ...

........................................................................
.............................. CYCLE   11 ..............................
........................................................................
   1    -78.8770124 -0.788770E+02  0.143E-01    2.74       0.0  T
   2    -78.8770139 -0.145224E-05  0.864E-02    2.74       1.0  T
   3    -78.8770144 -0.523938E-06  0.508E-03    2.74       3.9  T
   4    -78.8770147 -0.314429E-06  0.305E-03    2.74       6.4  T
   5    -78.8770148 -0.573404E-07  0.100E-03    2.74      19.5  T
   6    -78.8770148 -0.612854E-08  0.447E-04    2.74      43.9  T
   7    -78.8770148 -0.476558E-08  0.379E-05    2.74     517.8  T
     SCC iter.                  ...        0 min,  0.012 sec
     gradient                   ...        0 min,  0.021 sec
 * total energy  :   -78.2440508 Eh     change       -0.3288783E-04 Eh
   gradient norm :     0.0005905 Eh/α   predicted    -0.1250449E-04 ( -61.98%)
   displ. norm   :     0.1759034 α      lambda       -0.1954259E-04
   maximum displ.:     0.1349459 α      in ANC's #2, #1, #3, ...

........................................................................
.............................. CYCLE   12 ..............................
........................................................................
   1    -78.8768738 -0.788769E+02  0.136E-01    2.73       0.0  T
   2    -78.8768751 -0.127977E-05  0.818E-02    2.73       1.0  T
   3    -78.8768757 -0.593124E-06  0.442E-03    2.73       4.4  T
   4    -78.8768758 -0.143702E-06  0.278E-03    2.73       7.0  T
   5    -78.8768759 -0.582368E-07  0.839E-04    2.73      23.4  T
   6    -78.8768759 -0.624374E-08  0.327E-04    2.73      60.0  T
     SCC iter.                  ...        0 min,  0.011 sec
     gradient                   ...        0 min,  0.021 sec
 * total energy  :   -78.2440768 Eh     change       -0.2600930E-04 Eh
   gradient norm :     0.0005797 Eh/α   predicted    -0.9907917E-05 ( -61.91%)
   displ. norm   :     0.1400741 α      lambda       -0.1330164E-04
   maximum displ.:     0.1109199 α      in ANC's #2, #1, #3, ...

........................................................................
.............................. CYCLE   13 ..............................
........................................................................
   1    -78.8768533 -0.788769E+02  0.109E-01    2.72       0.0  T
   2    -78.8768541 -0.807312E-06  0.654E-02    2.72       1.0  T
   3    -78.8768546 -0.430334E-06  0.333E-03    2.72       5.9  T
   4    -78.8768546 -0.404170E-07  0.207E-03    2.72       9.5  T
   5    -78.8768546 -0.304907E-07  0.589E-04    2.72      33.3  T
   6    -78.8768546 -0.477105E-08  0.162E-04    2.72     120.9  T
     SCC iter.                  ...        0 min,  0.011 sec
     gradient                   ...        0 min,  0.021 sec
 * total energy  :   -78.2440946 Eh     change       -0.1773865E-04 Eh
   gradient norm :     0.0005868 Eh/α   predicted    -0.6708990E-05 ( -62.18%)
   displ. norm   :     0.1032606 α      lambda       -0.8880944E-05
   maximum displ.:     0.0853871 α      in ANC's #2, #1, #6, ...

........................................................................
.............................. CYCLE   14 ..............................
........................................................................
   1    -78.8769716 -0.788770E+02  0.804E-02    2.72       0.0  T
   2    -78.8769720 -0.430824E-06  0.484E-02    2.72       1.0  T
   3    -78.8769722 -0.234759E-06  0.244E-03    2.72       8.0  T
   4    -78.8769722 -0.205132E-07  0.153E-03    2.72      12.8  T
   5    -78.8769723 -0.122158E-07  0.373E-04    2.72      52.6  T
   6    -78.8769723 -0.115851E-08  0.690E-05    2.72     284.1  T
     SCC iter.                  ...        0 min,  0.011 sec
     gradient                   ...        0 min,  0.021 sec
 * total energy  :   -78.2441067 Eh     change       -0.1211103E-04 Eh
   gradient norm :     0.0004865 Eh/α   predicted    -0.4467507E-05 ( -63.11%)
   displ. norm   :     0.0750010 α      lambda       -0.6358337E-05
   maximum displ.:     0.0646412 α      in ANC's #2, #1, #3, ...

........................................................................
.............................. CYCLE   15 ..............................
........................................................................
   1    -78.8770425 -0.788770E+02  0.590E-02    2.71       0.0  T
   2    -78.8770428 -0.244602E-06  0.355E-02    2.71       1.0  T
   3    -78.8770428 -0.860898E-07  0.225E-03    2.71       8.7  T
   4    -78.8770429 -0.621502E-07  0.123E-03    2.71      16.0  T
   5    -78.8770429 -0.232764E-08  0.425E-04    2.71      46.2  T
   6    -78.8770429 -0.236653E-08  0.158E-04    2.71     123.9  T
     SCC iter.                  ...        0 min,  0.011 sec
     gradient                   ...        0 min,  0.021 sec
 * total energy  :   -78.2441155 Eh     change       -0.8861014E-05 Eh
   gradient norm :     0.0003116 Eh/α   predicted    -0.3189232E-05 ( -64.01%)
   displ. norm   :     0.0570493 α      lambda       -0.5028513E-05
   maximum displ.:     0.0505348 α      in ANC's #2, #1, #3, ...

........................................................................
.............................. CYCLE   16 ..............................
........................................................................
   1    -78.8771026 -0.788771E+02  0.439E-02    2.71       0.0  T
   2    -78.8771027 -0.129532E-06  0.264E-02    2.71       1.0  T
   3    -78.8771028 -0.347598E-07  0.177E-03    2.71      11.1  T
   4    -78.8771028 -0.426545E-07  0.940E-04    2.71      20.9  T
   5    -78.8771028 -0.803652E-09  0.425E-04    2.71      46.1  T
     SCC iter.                  ...        0 min,  0.009 sec
     gradient                   ...        0 min,  0.021 sec
 * total energy  :   -78.2441227 Eh     change       -0.7163826E-05 Eh
   gradient norm :     0.0002603 Eh/α   predicted    -0.2519973E-05 ( -64.82%)
   displ. norm   :     0.0489774 α      lambda       -0.4386100E-05
   maximum displ.:     0.0431827 α      in ANC's #2, #3, #1, ...

........................................................................
.............................. CYCLE   17 ..............................
........................................................................
   1    -78.8771099 -0.788771E+02  0.367E-02    2.71       0.0  T
   2    -78.8771100 -0.965464E-07  0.221E-02    2.71       1.0  T
   3    -78.8771100 -0.221807E-07  0.154E-03    2.71      12.8  T
   4    -78.8771100 -0.376233E-07  0.793E-04    2.71      24.7  T
   5    -78.8771100 -0.122398E-09  0.338E-04    2.71      58.0  T
     SCC iter.                  ...        0 min,  0.009 sec
     gradient                   ...        0 min,  0.021 sec
 * total energy  :   -78.2441290 Eh     change       -0.6298587E-05 Eh
   gradient norm :     0.0002457 Eh/α   predicted    -0.2196185E-05 ( -65.13%)
   displ. norm   :     0.0490133 α      lambda       -0.4278467E-05
   maximum displ.:     0.0418660 α      in ANC's #2, #3, #4, ...

........................................................................
.............................. CYCLE   18 ..............................
........................................................................
   1    -78.8770745 -0.788771E+02  0.350E-02    2.71       0.0  T
   2    -78.8770746 -0.896239E-07  0.211E-02    2.71       1.0  T
   3    -78.8770746 -0.258819E-07  0.143E-03    2.71      13.7  T
   4    -78.8770746 -0.292054E-07  0.782E-04    2.71      25.1  T
   5    -78.8770746 -0.301270E-09  0.351E-04    2.71      55.9  T
     SCC iter.                  ...        0 min,  0.009 sec
     gradient                   ...        0 min,  0.021 sec
 * total energy  :   -78.2441350 Eh     change       -0.6001437E-05 Eh
   gradient norm :     0.0002328 Eh/α   predicted    -0.2142802E-05 ( -64.30%)
   displ. norm   :     0.0506530 α      lambda       -0.4072510E-05
   maximum displ.:     0.0419611 α      in ANC's #2, #3, #4, ...

........................................................................
.............................. CYCLE   19 ..............................
........................................................................
   1    -78.8770379 -0.788770E+02  0.350E-02    2.71       0.0  T
   2    -78.8770380 -0.965147E-07  0.211E-02    2.71       1.0  T
   3    -78.8770380  0.652231E-08  0.173E-03    2.71      11.3  T
   4    -78.8770381 -0.670677E-07  0.795E-04    2.71      24.7  T
   5    -78.8770381  0.975845E-09  0.418E-04    2.71      46.9  T
     SCC iter.                  ...        0 min,  0.009 sec
     gradient                   ...        0 min,  0.021 sec
 * total energy  :   -78.2441405 Eh     change       -0.5507852E-05 Eh
   gradient norm :     0.0001964 Eh/α   predicted    -0.2040056E-05 ( -62.96%)
   displ. norm   :     0.0505350 α      lambda       -0.3414084E-05
   maximum displ.:     0.0416335 α      in ANC's #2, #3, #1, ...

........................................................................
.............................. CYCLE   20 ..............................
........................................................................
   1    -78.8770037 -0.788770E+02  0.345E-02    2.71       0.0  T
   2    -78.8770038 -0.909325E-07  0.208E-02    2.71       1.0  T
   3    -78.8770038 -0.293038E-07  0.141E-03    2.71      13.9  T
   4    -78.8770038 -0.264706E-07  0.797E-04    2.71      24.6  T
   5    -78.8770038 -0.665949E-09  0.350E-04    2.71      56.0  T
     SCC iter.                  ...        0 min,  0.009 sec
     gradient                   ...        0 min,  0.021 sec
 * total energy  :   -78.2441452 Eh     change       -0.4730035E-05 Eh
   gradient norm :     0.0001516 Eh/α   predicted    -0.1712705E-05 ( -63.79%)
   displ. norm   :     0.0428637 α      lambda       -0.2514879E-05
   maximum displ.:     0.0359170 α      in ANC's #2, #3, #1, ...

   *** GEOMETRY OPTIMIZATION CONVERGED AFTER 20 ITERATIONS ***

------------------------------------------------------------------------
 total energy gain   :        -0.0020317 Eh       -1.2749 kcal/mol
 total RMSD          :         0.3208159 a0        0.1698 Å
 total power (kW/mol):        -0.2667108 (step)   -5.2981 (real)
------------------------------------------------------------------------

 ANCopt (total)                0 d,  0 h,  0 min,  1.007 sec
 optimizer setup                ...        0 min,  0.000 sec (  0.014%)
 model hessian                  ...        0 min,  0.003 sec (  0.281%)
 ANC generation                 ...        0 min,  0.001 sec (  0.075%)
 coordinate transformation      ...        0 min,  0.000 sec (  0.036%)
 single point calculation       ...        0 min,  0.997 sec ( 99.012%)
 optimization log               ...        0 min,  0.002 sec (  0.205%)
 hessian update                 ...        0 min,  0.000 sec (  0.026%)
 rational function              ...        0 min,  0.002 sec (  0.232%)

================
 final structure:
================
$coord
    1.96245583706531   -0.10857787115565    0.12347592344337      C 
    0.71400286459527   -2.49974671567083    0.63921260025396      C 
    1.71614328523572   -4.43143451667230    2.14276375248399      C 
    0.41005573105270   -6.66770315543333    2.58449883195475      C 
   -1.96233273193689   -7.04814874215709    1.51323038996642      C 
   -3.01814678452969   -5.15642077811885    0.01884815024604      C 
   -1.69216408186052   -2.92872522710214   -0.38315098141138      C 
   -2.74170004859802   -1.14666843550951   -1.82915949410839      F 
   -5.28986230724738   -5.48839913050177   -1.01559817862486      F 
   -3.21022924614710   -9.19195914302421    1.91957090614432      F 
    1.43048545143718   -8.45254941162746    4.03954242429562      F 
    3.96312240979325   -4.14597283335230    3.25641310765254      F 
    4.46205021488005    0.28927328877854    0.22692877332941      C 
    5.71434283722079    2.67186344908426   -0.31822632102300      C 
    4.57348574830889    5.05149728040257   -0.13957370690682      C 
    5.88859867931083    7.26528002630308   -0.66086175034903      C 
    8.41229187380511    7.16299971544989   -1.39655738633674      C 
    9.60613770047474    4.82464605904221   -1.57945315026797      C 
    8.26566243783734    2.63719092005879   -1.03128344762549      C 
    9.45020049333441    0.41760916552503   -1.22750810114158      F 
   12.02253159575020    4.69452697208280   -2.27586852122847      F 
    9.67160896701620    9.27668403419125   -1.91131037124620      F 
    4.73150558140633    9.49299082538061   -0.45399377197597      F 
    2.17076116493036    5.26152850692172    0.60451335119640      F 
    0.69497675980654    1.37880213489972   -0.46585519885093      H 
    5.74279690282125   -1.24145944223150    0.65437763374005      H 
$end
           -------------------------------------------------
          |                Final Singlepoint                |
           -------------------------------------------------

          ...................................................
          :                      SETUP                      :
          :.................................................:
          :  # basis functions                  98          :
          :  # atomic orbitals                  98          :
          :  # shells                           50          :
          :  # electrons                       128          :
          :  max. iterations                   250          :
          :  Hamiltonian                  GFN2-xTB          :
          :  restarted?                      false          :
          :  GBSA solvation                  false          :
          :  PC potential                    false          :
          :  electronic temp.          300.0000000     K    :
          :  accuracy                    1.0000000          :
          :  -> integral cutoff          0.2500000E+02      :
          :  -> integral neglect         0.1000000E-07      :
          :  -> SCF convergence          0.1000000E-05 Eh   :
          :  -> wf. convergence          0.1000000E-03 e    :
          :  Broyden damping             0.4000000          :
          ...................................................

 iter      E             dE          RMSdq      gap      omega  full diag
   1    -78.8770038 -0.788770E+02  0.160E-04    2.71       0.0  T
   2    -78.8770038 -0.271143E-10  0.703E-05    2.71     279.1  T
   3    -78.8770038  0.239737E-10  0.753E-05    2.71     260.4  T

   *** convergence criteria satisfied after 3 iterations ***

         #    Occupation            Energy/Eh            Energy/eV
      -------------------------------------------------------------
         1        2.0000           -0.8800780             -23.9481
       ...           ...                  ...                  ...
        58        2.0000           -0.5048893             -13.7387
        59        2.0000           -0.4943108             -13.4509
        60        2.0000           -0.4877032             -13.2711
        61        2.0000           -0.4775832             -12.9957
        62        2.0000           -0.4638989             -12.6233
        63        2.0000           -0.4638939             -12.6232
        64        2.0000           -0.4431450             -12.0586 (HOMO)
        65                         -0.3437361              -9.3535 (LUMO)
        66                         -0.3037649              -8.2659
        67                         -0.3037495              -8.2654
        68                         -0.2970362              -8.0828
        69                         -0.2421345              -6.5888
       ...                                ...                  ...
        98                          0.6099321              16.5971
      -------------------------------------------------------------
                  HL-Gap            0.0994089 Eh            2.7051 eV
             Fermi-level           -0.3934405 Eh          -10.7061 eV

 SCC (total)                   0 d,  0 h,  0 min,  0.046 sec
 SCC setup                      ...        0 min,  0.000 sec (  0.670%)
 Dispersion                     ...        0 min,  0.000 sec (  0.670%)
 integral evaluation            ...        0 min,  0.018 sec ( 39.806%)
 zeroth order Hamiltonian       ...        0 min,  0.000 sec (  0.521%)
 iterations                     ...        0 min,  0.006 sec ( 13.250%)
 molecular gradient             ...        0 min,  0.021 sec ( 44.195%)
 printout                       ...        0 min,  0.000 sec (  0.789%)

         :::::::::::::::::::::::::::::::::::::::::::::::::::::
         ::                     SUMMARY                     ::
         :::::::::::::::::::::::::::::::::::::::::::::::::::::
         :: total energy             -78.244145238784 Eh    ::
         :: gradient norm              0.000151285781 Eh/a0 ::
         :: HOMO-LUMO gap              2.705054065432 eV    ::
         ::.................................................::
         :: SCC energy               -78.877003832351 Eh    ::
         :: -> isotropic ES            0.089802585654 Eh    ::
         :: -> anisotropic ES          0.011535865123 Eh    ::
         :: -> anisotropic XC         -0.040744361331 Eh    ::
         :: -> dispersion             -0.027854281226 Eh    ::
         :: repulsion energy           0.633073003684 Eh    ::
         :: add. restraining           0.000000000000 Eh    ::
         :::::::::::::::::::::::::::::::::::::::::::::::::::::

           -------------------------------------------------
          |                Property Printout                |
           -------------------------------------------------

    * Orbital Energies and Occupations

         #    Occupation            Energy/Eh            Energy/eV
      -------------------------------------------------------------
         1        2.0000           -0.8800780             -23.9481
       ...           ...                  ...                  ...
        52        2.0000           -0.5324328             -14.4882
        53        2.0000           -0.5309551             -14.4480
        54        2.0000           -0.5189113             -14.1203
        55        2.0000           -0.5164452             -14.0532
        56        2.0000           -0.5148117             -14.0087
        57        2.0000           -0.5058904             -13.7660
        58        2.0000           -0.5048893             -13.7387
        59        2.0000           -0.4943108             -13.4509
        60        2.0000           -0.4877032             -13.2711
        61        2.0000           -0.4775832             -12.9957
        62        2.0000           -0.4638989             -12.6233
        63        2.0000           -0.4638939             -12.6232
        64        2.0000           -0.4431450             -12.0586 (HOMO)
        65                         -0.3437361              -9.3535 (LUMO)
        66                         -0.3037649              -8.2659
        67                         -0.3037495              -8.2654
        68                         -0.2970362              -8.0828
        69                         -0.2421345              -6.5888
        70                         -0.1743537              -4.7444
        71                         -0.1576044              -4.2886
        72                         -0.0497417              -1.3535
        73                         -0.0462085              -1.2574
        74                         -0.0315283              -0.8579
        75                         -0.0218567              -0.5948
       ...                                ...                  ...
        98                          0.6099321              16.5971
      -------------------------------------------------------------
                  HL-Gap            0.0994089 Eh            2.7051 eV
             Fermi-level           -0.3934405 Eh          -10.7061 eV

     #   Z        covCN         q      C6AA      α(0)
     1   6 C      2.900    -0.014    28.355     8.731
     2   6 C      2.966    -0.015    28.376     8.738
     3   6 C      2.784     0.147    24.797     8.157
     4   6 C      2.774     0.138    24.968     8.184
     5   6 C      2.777     0.141    24.904     8.174
     6   6 C      2.773     0.139    24.963     8.183
     7   6 C      2.790     0.146    24.808     8.159
     8   9 F      0.788    -0.163    10.859     3.893
     9   9 F      0.787    -0.153    10.757     3.874
    10   9 F      0.787    -0.147    10.704     3.865
    11   9 F      0.787    -0.153    10.760     3.875
    12   9 F      0.788    -0.165    10.877     3.896
    13   6 C      2.900    -0.014    28.355     8.731
    14   6 C      2.966    -0.015    28.376     8.738
    15   6 C      2.784     0.147    24.797     8.156
    16   6 C      2.774     0.138    24.968     8.184
    17   6 C      2.777     0.141    24.904     8.174
    18   6 C      2.773     0.139    24.963     8.183
    19   6 C      2.790     0.146    24.808     8.159
    20   9 F      0.788    -0.163    10.859     3.893
    21   9 F      0.787    -0.153    10.757     3.874
    22   9 F      0.787    -0.147    10.704     3.865
    23   9 F      0.787    -0.153    10.760     3.875
    24   9 F      0.788    -0.165    10.877     3.896
    25   1 H      0.926     0.097     1.810     2.104
    26   1 H      0.926     0.097     1.809     2.103

 Mol. C6AA /au·bohr⁶  :      11207.236437
 Mol. C8AA /au·bohr⁸  :     274849.551833
 Mol. α(0) /au        :        159.659474


Wiberg/Mayer (AO) data.
largest (>0.10) Wiberg bond orders for each atom
          total WBO             WBO to atom ...
     1  C   3.977        C   13 1.761    C    2 1.110    H   25 0.952
     2  C   3.982        C    3 1.320    C    7 1.314    C    1 1.110
     3  C   3.892        C    4 1.350    C    2 1.320    F   12 1.001
     4  C   3.907        C    3 1.350    C    5 1.330    F   11 1.009
     5  C   3.899        C    4 1.330    C    6 1.326    F   10 1.014
     6  C   3.907        C    7 1.354    C    5 1.326    F    9 1.009
     7  C   3.892        C    6 1.354    C    2 1.314    F    8 1.004
     8  F   1.152        C    7 1.004
     9  F   1.158        C    6 1.009
    10  F   1.164        C    5 1.014
    11  F   1.158        C    4 1.009
    12  F   1.151        C    3 1.001
    13  C   3.977        C    1 1.761    C   14 1.110    H   26 0.952
    14  C   3.982        C   15 1.320    C   19 1.314    C   13 1.110
    15  C   3.892        C   16 1.350    C   14 1.320    F   24 1.001
    16  C   3.907        C   15 1.350    C   17 1.330    F   23 1.009
    17  C   3.899        C   16 1.330    C   18 1.326    F   22 1.014
    18  C   3.907        C   19 1.354    C   17 1.326    F   21 1.009
    19  C   3.892        C   18 1.354    C   14 1.314    F   20 1.004
    20  F   1.152        C   19 1.004
    21  F   1.158        C   18 1.009
    22  F   1.164        C   17 1.014
    23  F   1.158        C   16 1.009
    24  F   1.151        C   15 1.001
    25  H   0.990        C    1 0.952
    26  H   0.990        C   13 0.952

molecular dipole:
                 x           y           z       tot (Debye)
 q only:        0.001      -0.006      -0.023
   full:        0.002      -0.007      -0.029       0.076
molecular quadrupole (traceless):
                xx          xy          yy          xz          yz          zz
 q only:       -5.683      -8.951     -10.209       0.309       6.644      15.892
  q+dip:       -7.459      -7.991     -10.972      -0.366       7.686      18.431
   full:       -8.654      -8.752     -12.583      -0.527       8.885      21.237

           -------------------------------------------------
          |                Geometry Summary                 |
           -------------------------------------------------

      molecular mass/u    :      360.1538000
   center of mass at/Å    :        1.7034196       0.0389821       0.0618741
  moments of inertia/u·Å² :        0.9947871E+03   0.5258856E+04   0.5936735E+04
rotational constants/cm⁻¹ :        0.1694597E-01   0.3205570E-02   0.2839546E-02

 * 25 selected distances

     #   Z        #   Z                                     value/Å
     2   6 C      3   6 C                                 1.3997083
     3   6 C      4   6 C                                 1.3902255
     4   6 C      5   6 C                                 1.3921066
     5   6 C      6   6 C                                 1.3927073
     2   6 C      7   6 C                                 1.4019592 (max)
     6   6 C      7   6 C                                 1.3882672
     7   6 C      8   9 F                                 1.3353935
     6   6 C      9   9 F                                 1.3325373
     5   6 C     10   9 F                                 1.3301501
     4   6 C     11   9 F                                 1.3328656
     3   6 C     12   9 F                                 1.3356479
     1   6 C     13   6 C                                 1.3404970
    14   6 C     15   6 C                                 1.3996842
    15   6 C     16   6 C                                 1.3902462
    16   6 C     17   6 C                                 1.3921221
    17   6 C     18   6 C                                 1.3927134
    14   6 C     19   6 C                                 1.4019587
    18   6 C     19   6 C                                 1.3882533
    19   6 C     20   9 F                                 1.3353920
    18   6 C     21   9 F                                 1.3325273
    17   6 C     22   9 F                                 1.3301743
    16   6 C     23   9 F                                 1.3328918
    15   6 C     24   9 F                                 1.3356736
     1   6 C     25   1 H                                 1.0801069 (min)
    13   6 C     26   1 H                                 1.0801138

 * 3 distinct bonds (by element types)

   Z      Z             #   av. dist./Å        max./Å        min./Å
   1 H    6 C           2     1.0801104     1.0801138     1.0801069
   6 C    6 C          13     1.3900345     1.4019592     1.3404970
   6 C    9 F          10     1.3333253     1.3356736     1.3301501


optimized geometry written to: xtbopt.xyz


           -------------------------------------------------
          | TOTAL ENERGY              -78.244145238784 Eh   |
          | GRADIENT NORM               0.000151285781 Eh/α |
          | HOMO-LUMO GAP               2.705054065432 eV   |
           -------------------------------------------------

------------------------------------------------------------------------
 * finished run on 2021/02/19 at 08:12:04.858     
------------------------------------------------------------------------
 total:
 * wall-time:     0 d,  0 h,  0 min,  1.146 sec
 *  cpu-time:     0 d,  0 h,  0 min,  1.143 sec
 * ratio c/w:     0.997 speedup
 SCF:
 * wall-time:     0 d,  0 h,  0 min,  0.062 sec
 *  cpu-time:     0 d,  0 h,  0 min,  0.062 sec
 * ratio c/w:     0.998 speedup
 ANC optimizer:
 * wall-time:     0 d,  0 h,  0 min,  1.054 sec
 *  cpu-time:     0 d,  0 h,  0 min,  1.051 sec
 * ratio c/w:     0.998 speedup

