      -----------------------------------------------------------      
     |                   =====================                   |     
     |                           x T B                           |     
     |                   =====================                   |     
     |                         S. Grimme                         |     
     |          Mulliken Center for Theoretical Chemistry        |     
     |                    University of Bonn                     |     
     |                Version 6.2 RC2 (SAW190805)                |     
      -----------------------------------------------------------      

   This program is distributed in the hope that it will be useful,
   but WITHOUT ANY WARRANTY; without even the implied warranty of
   MERCHANTABILITY or FITNESS FOR A PARTICULAR PURPOSE.
   
   FOR NON-COMMERCIAL, ACADEMIA USE ONLY.
   
   Cite this work as:
   * S. Grimme, C. Bannwarth, P. Shushkov, J. Chem. Theory Comput., 2017,
     13, 1989-2009. DOI: 10.1021/acs.jctc.7b00118
   * C. Bannwarth, S. Ehlert and S. Grimme., J. Chem. Theory Comput., 2019,
     15, 1652-1671. DOI: 10.1021/acs.jctc.8b01176
   * P. Pracht, E. Caldeweyher, S. Ehlert, S. Grimme, ChemRxiv, 2019, preprint.
     DOI: 10.26434/chemrxiv.8326202.v1
   
   for DFT-D4:
   * E. Caldeweyher, C. Bannwarth and S. Grimme, J. Chem. Phys., 2017,
     147, 034112. DOI: 10.1063/1.4993215
   * E. Caldeweyher, S. Ehlert, A. Hansen, H. Neugebauer, S. Spicher,
     C. Bannwarth and S. Grimme, J. Chem. Phys., 2019, 150, 154122.
     DOI: 10.1063/1.5090222
   
   for sTDA-xTB:
   * S. Grimme and C. Bannwarth, J. Chem. Phys., 2016, 145, 054103.
     DOI: 10.1063/1.4959605
   
   in the mass-spec context:
   * V. Asgeirsson, C. Bauer and S. Grimme, Chem. Sci., 2017, 8, 4879.
     DOI: 10.1039/c7sc00601b
   
   for metadynamics refer to:
   * S. Grimme, J. Chem. Theory Comput., 2019, 155, 2847-2862
     DOI: 10.1021/acs.jctc.9b00143
   
   with help from (in alphabetical order)
   C. Bannwarth, F. Bohle, G. Brandenburg, E. Caldeweyher, M. Checinski,
   S. Dohm, S. Ehlert, S. Ehrlich, F. März, H. Neugebauer, J. Pisarek,
   P. Pracht, P. Shushkov, and S. Spicher.
   
 * started run on 2021/02/19 at 08:12:07.948     

           -------------------------------------------------
          |                Calculation Setup                |
           -------------------------------------------------

          program call               : /ihome/ghutchison/geoffh/xtb/xtb 2atl.xyz -opt
          hostname                   : smp-n135
          coordinate file            : 2atl.xyz
          omp threads                :                     1
          number of atoms            :                    22
          number of electrons        :                    74
          charge                     :                     0
          spin                       :                   0.0
          first test random number   :      0.51578696763231


########################################################################
# WARNING! Please study the warnings concerning your input carefully
#  - the use of '-opt' is discouraged, please use '--opt' next time
########################################################################

           ------------------------------------------------- 
          |                 G F N 2 - x T B                 |
          | Geometry, Frequencies, Noncovalent interactions |
          |            JCTC 2019 parametrisation            |
           ------------------------------------------------- 
             KAB for C  - Si     :                1.0500
             KAB for H  - Pd     :                0.9500
             k(s)              :                1.8500
             k(p)              :                2.2300
             k(d)              :                2.2300
             k(f)              :                2.0000
             kEN (H0ij)        :               -2.0000
             D4 a1             :                0.5200
             D4 a2             :                5.0000
             D4 s6             :                1.0000
             D4 s8             :                2.7000
             D4 s9             :                5.0000
             alphaj            :                2.0000

  Z AO/shell   Hii/eV     exponent
  1     Wed Apr 25 08:07:45 CEST 2018   EN: 2.200 GM2: 0.406  GM3: 0.0800  RAES: 1.40
     1s    -10.707211    1.230000
  6     Wed Apr 25 08:07:45 CEST 2018   EN: 2.550 GM2: 0.538  GM3: 0.1500  RAES: 3.00
     2s    -13.970922    2.096432
     2p    -10.063292    1.800000
  7     Wed Apr 25 08:07:45 CEST 2018   EN: 3.040 GM2: 0.461  GM3:-0.0640  RAES: 1.90
     2s    -16.686243    2.339881
     2p    -12.523956    2.014332
  8     Wed Apr 25 08:07:45 CEST 2018   EN: 3.440 GM2: 0.452  GM3:-0.0517  RAES: 1.80
     2s    -20.229985    2.439742
     2p    -15.503117    2.137023

           ------------------------------------------------- 
          |        Self-Consistent Charge Iterations        |
           ------------------------------------------------- 

          ...................................................
          :                      SETUP                      :
          :.................................................:
          :  # basis functions                  70          :
          :  # atomic orbitals                  70          :
          :  # shells                           38          :
          :  # electrons                        74          :
          :  max. iterations                   250          :
          :  Hamiltonian                  GFN2-xTB          :
          :  restarted?                      false          :
          :  GBSA solvation                  false          :
          :  PC potential                    false          :
          :  electronic temp.          300.0000000     K    :
          :  accuracy                    1.0000000          :
          :  -> integral cutoff          0.2500000E+02      :
          :  -> integral neglect         0.1000000E-07      :
          :  -> SCF convergence          0.1000000E-05 Eh   :
          :  -> wf. convergence          0.1000000E-03 e    :
          :  Broyden damping             0.4000000          :
          ...................................................

 iter      E             dE          RMSdq      gap      omega  full diag
   1    -41.0928603 -0.410929E+02  0.736E+00    2.46       0.0  T
   2    -40.9642693  0.128591E+00  0.535E+00    2.18       1.0  T
   3    -40.8543400  0.109929E+00  0.454E+00    1.83       1.0  T
   4    -41.1974942 -0.343154E+00  0.101E+00    1.90       1.0  T
   5    -41.2107549 -0.132607E-01  0.304E-01    1.85       1.0  T
   6    -41.2115329 -0.777976E-03  0.118E-01    1.92       1.0  T
   7    -41.2116277 -0.948414E-04  0.595E-02    1.90       1.0  T
   8    -41.2116607 -0.329762E-04  0.322E-02    1.90       1.0  T
   9    -41.2116734 -0.127055E-04  0.152E-02    1.90       1.4  T
  10    -41.2116752 -0.184178E-05  0.701E-03    1.90       3.0  T
  11    -41.2116760 -0.749306E-06  0.266E-03    1.90       8.0  T
  12    -41.2116761 -0.112629E-06  0.857E-04    1.90      24.9  T
  13    -41.2116761 -0.204437E-08  0.356E-04    1.90      59.9  T

   *** convergence criteria satisfied after 13 iterations ***

         #    Occupation            Energy/Eh            Energy/eV
      -------------------------------------------------------------
         1        2.0000           -0.7271278             -19.7862
       ...           ...                  ...                  ...
        31        2.0000           -0.4639827             -12.6256
        32        2.0000           -0.4581395             -12.4666
        33        2.0000           -0.4519573             -12.2984
        34        2.0000           -0.4500533             -12.2466
        35        2.0000           -0.4433530             -12.0643
        36        2.0000           -0.4308418             -11.7238
        37        2.0000           -0.4133086             -11.2467 (HOMO)
        38                         -0.3434325              -9.3453 (LUMO)
        39                         -0.3220673              -8.7639
        40                         -0.2888754              -7.8607
        41                         -0.2790989              -7.5947
        42                         -0.2737351              -7.4487
       ...                                ...                  ...
        70                          0.7009028              19.0725
      -------------------------------------------------------------
                  HL-Gap            0.0698761 Eh            1.9014 eV
             Fermi-level           -0.3783705 Eh          -10.2960 eV

 SCC (total)                   0 d,  0 h,  0 min,  0.036 sec
 SCC setup                      ...        0 min,  0.000 sec (  0.752%)
 Dispersion                     ...        0 min,  0.000 sec (  1.082%)
 integral evaluation            ...        0 min,  0.009 sec ( 25.141%)
 zeroth order Hamiltonian       ...        0 min,  0.000 sec (  0.470%)
 iterations                     ...        0 min,  0.014 sec ( 38.160%)
 molecular gradient             ...        0 min,  0.012 sec ( 33.536%)
 printout                       ...        0 min,  0.000 sec (  0.736%)

         :::::::::::::::::::::::::::::::::::::::::::::::::::::
         ::                     SUMMARY                     ::
         :::::::::::::::::::::::::::::::::::::::::::::::::::::
         :: total energy             -40.602467558434 Eh    ::
         :: gradient norm              0.340677917976 Eh/a0 ::
         :: HOMO-LUMO gap              1.901426101682 eV    ::
         ::.................................................::
         :: SCC energy               -41.211676079564 Eh    ::
         :: -> isotropic ES            0.039120383559 Eh    ::
         :: -> anisotropic ES          0.001628375378 Eh    ::
         :: -> anisotropic XC          0.052107463165 Eh    ::
         :: -> dispersion             -0.024876098043 Eh    ::
         :: repulsion energy           0.609149495152 Eh    ::
         :: add. restraining           0.000000000000 Eh    ::
         :::::::::::::::::::::::::::::::::::::::::::::::::::::

      ----------------------------------------------------------- 
     |                   =====================                   |
     |                        A N C O P T                        |
     |                   =====================                   |
     |               Approximate Normal Coordinate               |
     |                Rational Function Optimizer                |
      ----------------------------------------------------------- 

          ...................................................
          :                      SETUP                      :
          :.................................................:
          :   optimization level            normal          :
          :   max. optcycles                   200          :
          :   ANC micro-cycles                  20          :
          :   degrees of freedom                60          :
          :.................................................:
          :   RF solver                   davidson          :
          :   input Hessian                  false          :
          :   write xtbopt.log                true          :
          :   linear?                        false          :
          :   energy convergence         0.5000000E-05 Eh   :
          :   grad. convergence          0.1000000E-02 Eh/α :
          :   maximium RF displ.         2.0000000          :
          :   Hlow (freq-cutoff)         0.5000000E-02      :
          :   Hmax (freq-cutoff)         5.0000000          :
          :   S6 in model hess.         20.0000000          :
          ...................................................

generating ANC from model Hessian ...
Using Lindh-Hessian (1995)
 Shifting diagonal of input Hessian by   4.881431506078308E-003
 Lowest  eigenvalues of input Hessian
   -0.000000   -0.000000    0.000000    0.000000    0.000000    0.000000
    0.005000    0.005893    0.007219    0.007502    0.008026    0.011268
    0.013358    0.016664    0.017561    0.019393    0.024741    0.024942
 Highest eigenvalues
    1.923630    1.950304    1.973748    2.009576    2.019548    2.266863
 

........................................................................
.............................. CYCLE    1 ..............................
........................................................................
   1    -41.2116761 -0.412117E+02  0.147E-04    1.90       0.0  T
   2    -41.2116761  0.551758E-09  0.182E-04    1.90     117.4  T
   3    -41.2116761 -0.794053E-09  0.634E-05    1.90     336.3  T
     SCC iter.                  ...        0 min,  0.003 sec
     gradient                   ...        0 min,  0.013 sec
 * total energy  :   -40.6024676 Eh     change       -0.2306305E-07 Eh
   gradient norm :     0.3406762 Eh/α   predicted     0.0000000E+00 (-100.00%)
   displ. norm   :     0.4319404 α      lambda       -0.9769541E-01
   maximum displ.:     0.1975450 α      in ANC's #20, #28, #25, ...

........................................................................
.............................. CYCLE    2 ..............................
........................................................................
   1    -41.3947273 -0.413947E+02  0.620E-01    2.03       0.0  T
   2    -41.3949538 -0.226454E-03  0.379E-01    2.03       1.0  T
   3    -41.3941194  0.834335E-03  0.305E-01    2.03       1.0  T
   4    -41.3955095 -0.139010E-02  0.573E-02    2.00       1.0  T
   5    -41.3955880 -0.784115E-04  0.169E-02    2.02       1.3  T
   6    -41.3955905 -0.257399E-05  0.970E-03    2.02       2.2  T
   7    -41.3955911 -0.559938E-06  0.465E-03    2.02       4.6  T
   8    -41.3955912 -0.148644E-06  0.171E-03    2.02      12.4  T
     SCC iter.                  ...        0 min,  0.008 sec
     gradient                   ...        0 min,  0.012 sec
 * total energy  :   -40.6643248 Eh     change       -0.6185725E-01 Eh
   gradient norm :     0.0505809 Eh/α   predicted    -0.5796135E-01 (  -6.30%)
   displ. norm   :     0.4092282 α      lambda       -0.1389741E-01
   maximum displ.:     0.2267444 α      in ANC's #10, #20, #25, ...

........................................................................
.............................. CYCLE    3 ..............................
........................................................................
   1    -41.4464304 -0.414464E+02  0.374E-01    1.99       0.0  T
   2    -41.4464264  0.398374E-05  0.245E-01    1.99       1.0  T
   3    -41.4462144  0.212032E-03  0.172E-01    2.02       1.0  T
   4    -41.4466778 -0.463456E-03  0.265E-02    2.01       1.0  T
   5    -41.4466886 -0.107170E-04  0.105E-02    2.01       2.0  T
   6    -41.4466892 -0.648946E-06  0.444E-03    2.01       4.8  T
   7    -41.4466893 -0.988794E-07  0.152E-03    2.01      14.0  T
     SCC iter.                  ...        0 min,  0.007 sec
     gradient                   ...        0 min,  0.012 sec
 * total energy  :   -40.6729387 Eh     change       -0.8613865E-02 Eh
   gradient norm :     0.0377101 Eh/α   predicted    -0.8112391E-02 (  -5.82%)
   displ. norm   :     0.3585496 α      lambda       -0.4235690E-02
   maximum displ.:     0.2207495 α      in ANC's #10, #7, #20, ...

........................................................................
.............................. CYCLE    4 ..............................
........................................................................
   1    -41.4453059 -0.414453E+02  0.365E-01    1.94       0.0  T
   2    -41.4453489 -0.429624E-04  0.221E-01    1.97       1.0  T
   3    -41.4449995  0.349359E-03  0.158E-01    1.98       1.0  T
   4    -41.4454432 -0.443688E-03  0.217E-02    1.98       1.0  T
   5    -41.4454491 -0.592217E-05  0.116E-02    1.98       1.8  T
   6    -41.4454508 -0.167028E-05  0.432E-03    1.98       4.9  T
   7    -41.4454508  0.101549E-07  0.197E-03    1.98      10.8  T
     SCC iter.                  ...        0 min,  0.007 sec
     gradient                   ...        0 min,  0.012 sec
 * total energy  :   -40.6734932 Eh     change       -0.5544791E-03 Eh
   gradient norm :     0.0322621 Eh/α   predicted    -0.2390111E-02 ( 331.06%)
   displ. norm   :     0.4169012 α      lambda       -0.4933558E-02
   maximum displ.:     0.2068469 α      in ANC's #10, #3, #5, ...

........................................................................
.............................. CYCLE    5 ..............................
........................................................................
   1    -41.4316450 -0.414316E+02  0.621E-01    1.93       0.0  T
   2    -41.4317746 -0.129520E-03  0.349E-01    1.97       1.0  T
   3    -41.4311393  0.635232E-03  0.176E-01    1.95       1.0  T
   4    -41.4318904 -0.751101E-03  0.191E-02    1.97       1.1  T
   5    -41.4318916 -0.113106E-05  0.140E-02    1.97       1.5  T
   6    -41.4318937 -0.216390E-05  0.548E-03    1.97       3.9  T
   7    -41.4318939 -0.172583E-06  0.220E-03    1.97       9.7  T
     SCC iter.                  ...        0 min,  0.007 sec
     gradient                   ...        0 min,  0.012 sec
 * total energy  :   -40.6729473 Eh     change        0.5458876E-03 Eh
   gradient norm :     0.0903721 Eh/α   predicted    -0.2895524E-02 (-630.42%)
   displ. norm   :     0.2327956 α      lambda       -0.6419210E-02
   maximum displ.:     0.1359877 α      in ANC's #1, #3, #4, ...

........................................................................
.............................. CYCLE    6 ..............................
........................................................................
   1    -41.4502691 -0.414503E+02  0.392E-01    2.02       0.0  T
   2    -41.4503595 -0.904414E-04  0.227E-01    2.02       1.0  T
   3    -41.4500615  0.298053E-03  0.123E-01    1.99       1.0  T
   4    -41.4504102 -0.348701E-03  0.201E-02    2.00       1.1  T
   5    -41.4504158 -0.561405E-05  0.813E-03    2.01       2.6  T
   6    -41.4504163 -0.547759E-06  0.413E-03    2.01       5.2  T
   7    -41.4504165 -0.166954E-06  0.149E-03    2.01      14.4  T
     SCC iter.                  ...        0 min,  0.007 sec
     gradient                   ...        0 min,  0.011 sec
 * total energy  :   -40.6751975 Eh     change       -0.2250204E-02 Eh
   gradient norm :     0.0271276 Eh/α   predicted    -0.3383547E-02 (  50.37%)
   displ. norm   :     0.1214972 α      lambda       -0.7725596E-03
   maximum displ.:     0.0565742 α      in ANC's #4, #14, #13, ...

........................................................................
.............................. CYCLE    7 ..............................
........................................................................
   1    -41.4496513 -0.414497E+02  0.130E-01    2.00       0.0  T
   2    -41.4496570 -0.573876E-05  0.750E-02    2.01       1.0  T
   3    -41.4496329  0.241464E-04  0.382E-02    2.01       1.0  T
   4    -41.4496610 -0.281646E-04  0.502E-03    2.01       4.2  T
   5    -41.4496610 -0.345241E-08  0.366E-03    2.01       5.8  T
   6    -41.4496612 -0.174561E-06  0.136E-03    2.01      15.7  T
     SCC iter.                  ...        0 min,  0.006 sec
     gradient                   ...        0 min,  0.011 sec
 * total energy  :   -40.6754670 Eh     change       -0.2694902E-03 Eh
   gradient norm :     0.0130733 Eh/α   predicted    -0.3919849E-03 (  45.45%)
   displ. norm   :     0.1305536 α      lambda       -0.3546457E-03
   maximum displ.:     0.0767633 α      in ANC's #3, #10, #4, ...

........................................................................
.............................. CYCLE    8 ..............................
........................................................................
   1    -41.4410505 -0.414411E+02  0.216E-01    2.00       0.0  T
   2    -41.4410631 -0.126231E-04  0.121E-01    2.00       1.0  T
   3    -41.4409479  0.115213E-03  0.771E-02    2.00       1.0  T
   4    -41.4410816 -0.133670E-03  0.538E-03    2.00       4.0  T
   5    -41.4410820 -0.405920E-06  0.323E-03    2.00       6.6  T
   6    -41.4410821 -0.144962E-06  0.170E-03    2.00      12.6  T
   7    -41.4410822 -0.276220E-07  0.690E-04    2.00      30.9  T
     SCC iter.                  ...        0 min,  0.007 sec
     gradient                   ...        0 min,  0.011 sec
 * total energy  :   -40.6753713 Eh     change        0.9568891E-04 Eh
   gradient norm :     0.0294790 Eh/α   predicted    -0.1803472E-03 (-288.47%)
   displ. norm   :     0.0892872 α      lambda       -0.6428792E-03
   maximum displ.:     0.0448516 α      in ANC's #7, #4, #3, ...

........................................................................
.............................. CYCLE    9 ..............................
........................................................................
   1    -41.4483209 -0.414483E+02  0.170E-01    2.01       0.0  T
   2    -41.4483315 -0.105447E-04  0.948E-02    2.01       1.0  T
   3    -41.4482905  0.409952E-04  0.485E-02    2.01       1.0  T
   4    -41.4483387 -0.482769E-04  0.638E-03    2.01       3.3  T
   5    -41.4483396 -0.813326E-06  0.282E-03    2.01       7.6  T
   6    -41.4483396 -0.831956E-07  0.137E-03    2.01      15.5  T
     SCC iter.                  ...        0 min,  0.006 sec
     gradient                   ...        0 min,  0.011 sec
 * total energy  :   -40.6756311 Eh     change       -0.2597584E-03 Eh
   gradient norm :     0.0051443 Eh/α   predicted    -0.3240046E-03 (  24.73%)
   displ. norm   :     0.0417092 α      lambda       -0.8438976E-04
   maximum displ.:     0.0236443 α      in ANC's #14, #1, #7, ...

........................................................................
.............................. CYCLE   10 ..............................
........................................................................
   1    -41.4492313 -0.414492E+02  0.455E-02    2.01       0.0  T
   2    -41.4492317 -0.417757E-06  0.269E-02    2.01       1.0  T
   3    -41.4492268  0.484165E-05  0.180E-02    2.01       1.2  T
   4    -41.4492326 -0.579920E-05  0.224E-03    2.01       9.5  T
   5    -41.4492327 -0.572181E-07  0.125E-03    2.01      17.1  T
   6    -41.4492327 -0.142900E-07  0.400E-04    2.01      53.3  T
     SCC iter.                  ...        0 min,  0.006 sec
     gradient                   ...        0 min,  0.011 sec
 * total energy  :   -40.6756665 Eh     change       -0.3545359E-04 Eh
   gradient norm :     0.0024257 Eh/α   predicted    -0.4226935E-04 (  19.22%)
   displ. norm   :     0.0384091 α      lambda       -0.3171091E-04
   maximum displ.:     0.0179953 α      in ANC's #10, #13, #6, ...

........................................................................
.............................. CYCLE   11 ..............................
........................................................................
   1    -41.4488531 -0.414489E+02  0.402E-02    2.01       0.0  T
   2    -41.4488535 -0.346411E-06  0.226E-02    2.01       1.0  T
   3    -41.4488500  0.343758E-05  0.132E-02    2.01       1.6  T
   4    -41.4488540 -0.399025E-05  0.103E-03    2.01      20.8  T
   5    -41.4488540 -0.229151E-08  0.714E-04    2.01      29.9  T
   6    -41.4488540 -0.470678E-08  0.345E-04    2.01      61.8  T
     SCC iter.                  ...        0 min,  0.006 sec
     gradient                   ...        0 min,  0.013 sec
 * total energy  :   -40.6756847 Eh     change       -0.1818681E-04 Eh
   gradient norm :     0.0029120 Eh/α   predicted    -0.1588017E-04 ( -12.68%)
   displ. norm   :     0.0313816 α      lambda       -0.1520307E-04
   maximum displ.:     0.0186096 α      in ANC's #10, #11, #3, ...

........................................................................
.............................. CYCLE   12 ..............................
........................................................................
   1    -41.4490842 -0.414491E+02  0.325E-02    2.01       0.0  T
   2    -41.4490844 -0.236875E-06  0.183E-02    2.01       1.2  T
   3    -41.4490826  0.179883E-05  0.982E-03    2.01       2.2  T
   4    -41.4490848 -0.211865E-05  0.839E-04    2.01      25.4  T
   5    -41.4490848 -0.127279E-08  0.629E-04    2.01      33.9  T
   6    -41.4490848 -0.376114E-08  0.219E-04    2.01      97.6  T
     SCC iter.                  ...        0 min,  0.006 sec
     gradient                   ...        0 min,  0.013 sec
 * total energy  :   -40.6756924 Eh     change       -0.7665575E-05 Eh
   gradient norm :     0.0019618 Eh/α   predicted    -0.7613476E-05 (  -0.68%)
   displ. norm   :     0.0471398 α      lambda        0.1470198E-04
   maximum displ.:     0.0279123 α      in ANC's #10, #11, #3, ...

........................................................................
.............................. CYCLE   13 ..............................
........................................................................
   1    -41.4492571 -0.414493E+02  0.489E-02    2.01       0.0  T
   2    -41.4492576 -0.536707E-06  0.275E-02    2.01       1.0  T
   3    -41.4492534  0.426792E-05  0.151E-02    2.01       1.4  T
   4    -41.4492584 -0.502139E-05  0.127E-03    2.01      16.8  T
   5    -41.4492584 -0.372316E-08  0.955E-04    2.01      22.3  T
   6    -41.4492584 -0.868067E-08  0.340E-04    2.01      62.6  T
     SCC iter.                  ...        0 min,  0.006 sec
     gradient                   ...        0 min,  0.012 sec
 * total energy  :   -40.6756761 Eh     change        0.1630604E-04 Eh
   gradient norm :     0.0052831 Eh/α   predicted     0.7357869E-05 ( -54.88%)
   displ. norm   :     0.0280956 α      lambda       -0.2457123E-04
   maximum displ.:     0.0189797 α      in ANC's #10, #3, #4, ...

........................................................................
.............................. CYCLE   14 ..............................
........................................................................
   1    -41.4495477 -0.414495E+02  0.274E-02    2.02       0.0  T
   2    -41.4495479 -0.199278E-06  0.156E-02    2.01       1.4  T
   3    -41.4495465  0.143078E-05  0.896E-03    2.02       2.4  T
   4    -41.4495482 -0.169494E-05  0.830E-04    2.01      25.7  T
   5    -41.4495482 -0.267311E-08  0.575E-04    2.01      37.0  T
     SCC iter.                  ...        0 min,  0.005 sec
     gradient                   ...        0 min,  0.011 sec
 * total energy  :   -40.6756922 Eh     change       -0.1617737E-04 Eh
   gradient norm :     0.0015817 Eh/α   predicted    -0.1229692E-04 ( -23.99%)
   displ. norm   :     0.0243245 α      lambda       -0.4533570E-05
   maximum displ.:     0.0168983 α      in ANC's #10, #3, #11, ...

........................................................................
.............................. CYCLE   15 ..............................
........................................................................
   1    -41.4493905 -0.414494E+02  0.233E-02    2.02       0.0  T
   2    -41.4493906 -0.121646E-06  0.131E-02    2.01       1.6  T
   3    -41.4493896  0.991944E-06  0.749E-03    2.01       2.8  T
   4    -41.4493908 -0.117255E-05  0.698E-04    2.01      30.6  T
   5    -41.4493908 -0.234638E-08  0.496E-04    2.01      42.9  T
   6    -41.4493908 -0.218387E-08  0.186E-04    2.01     114.7  T
     SCC iter.                  ...        0 min,  0.006 sec
     gradient                   ...        0 min,  0.012 sec
 * total energy  :   -40.6756940 Eh     change       -0.1747825E-05 Eh
   gradient norm :     0.0011852 Eh/α   predicted    -0.2268238E-05 (  29.77%)
   displ. norm   :     0.0070420 α      lambda       -0.9248035E-06
   maximum displ.:     0.0037656 α      in ANC's #10, #1, #4, ...

........................................................................
.............................. CYCLE   16 ..............................
........................................................................
   1    -41.4495439 -0.414495E+02  0.726E-03    2.01       0.0  T
   2    -41.4495439 -0.131158E-07  0.407E-03    2.01       5.2  T
   3    -41.4495438  0.866907E-07  0.238E-03    2.01       8.9  T
   4    -41.4495439 -0.105525E-06  0.176E-04    2.01     120.8  T
   5    -41.4495439 -0.309939E-10  0.139E-04    2.01     153.6  T
     SCC iter.                  ...        0 min,  0.005 sec
     gradient                   ...        0 min,  0.012 sec
 * total energy  :   -40.6756946 Eh     change       -0.6309508E-06 Eh
   gradient norm :     0.0003487 Eh/α   predicted    -0.4643365E-06 ( -26.41%)
   displ. norm   :     0.0063871 α      lambda       -0.2119984E-06
   maximum displ.:     0.0037719 α      in ANC's #6, #10, #1, ...

   *** GEOMETRY OPTIMIZATION CONVERGED AFTER 16 ITERATIONS ***

------------------------------------------------------------------------
 total energy gain   :        -0.0732270 Eh      -45.9507 kcal/mol
 total RMSD          :         0.2822121 a0        0.1493 Å
 total power (kW/mol):       -12.0160995 (step) -428.8124 (real)
------------------------------------------------------------------------

 ANCopt (total)                0 d,  0 h,  0 min,  0.448 sec
 optimizer setup                ...        0 min,  0.000 sec (  0.026%)
 model hessian                  ...        0 min,  0.002 sec (  0.554%)
 ANC generation                 ...        0 min,  0.000 sec (  0.108%)
 coordinate transformation      ...        0 min,  0.000 sec (  0.043%)
 single point calculation       ...        0 min,  0.441 sec ( 98.300%)
 optimization log               ...        0 min,  0.001 sec (  0.273%)
 hessian update                 ...        0 min,  0.000 sec (  0.030%)
 rational function              ...        0 min,  0.002 sec (  0.484%)

================
 final structure:
================
$coord
    0.93344965146064    3.21962657232493   -0.00022685994133      C 
    3.41167274983444    2.36507465206792    0.00210883772931      C 
    3.97958175631791   -0.19773279995610    0.00523494286490      C 
    2.06203540919830   -1.98387678907652    0.00597733496082      C 
   -0.41241715664523   -1.14459008157673    0.00368264050992      C 
   -1.00495696156152    1.45058245101505    0.00075875751641      C 
   -3.74146243240213    1.77176598107090    0.00137089971733      C 
   -5.02225415312370    4.00755196663946    0.00221673029254      C 
   -3.86291105766923    6.41375732751246   -0.00274500374031      C 
   -3.03883790225307    8.41853445173840   -0.00787189991322      N 
   -7.68425092493078    4.22772859596377    0.00688022078545      C 
   -9.82892464534514    4.53950719307332    0.01170557470107      N 
   -4.86656631311841   -0.75692770101190    0.00237080936557      C 
   -2.75505394836502   -2.64771698009914    0.00413997898655      C 
   -2.97684410573830   -4.91789388023299    0.00588744139335      O 
   -7.28348795638792   -1.47559585204142   -0.00015392401526      C 
    0.54804872767269    5.21951331276274   -0.00232675145091      H 
    4.92924056299330    3.72862343193880    0.00170538377030      H 
    5.92889842486689   -0.79878058055893    0.00705818547758      H 
    2.45886316101442   -3.98409140271360    0.00821218062541      H 
   -8.85590996476339   -0.18798290098382   -0.00359732650542      H 
   -7.70252819344980   -3.47077854036866   -0.00030730596747      H 
$end
           -------------------------------------------------
          |                Final Singlepoint                |
           -------------------------------------------------

          ...................................................
          :                      SETUP                      :
          :.................................................:
          :  # basis functions                  70          :
          :  # atomic orbitals                  70          :
          :  # shells                           38          :
          :  # electrons                        74          :
          :  max. iterations                   250          :
          :  Hamiltonian                  GFN2-xTB          :
          :  restarted?                      false          :
          :  GBSA solvation                  false          :
          :  PC potential                    false          :
          :  electronic temp.          300.0000000     K    :
          :  accuracy                    1.0000000          :
          :  -> integral cutoff          0.2500000E+02      :
          :  -> integral neglect         0.1000000E-07      :
          :  -> SCF convergence          0.1000000E-05 Eh   :
          :  -> wf. convergence          0.1000000E-03 e    :
          :  Broyden damping             0.4000000          :
          ...................................................

 iter      E             dE          RMSdq      gap      omega  full diag
   1    -41.4495439 -0.414495E+02  0.520E-05    2.01       0.0  T
   2    -41.4495439 -0.247269E-11  0.310E-05    2.01     687.0  T
   3    -41.4495439 -0.757439E-11  0.260E-05    2.01     820.0  T

   *** convergence criteria satisfied after 3 iterations ***

         #    Occupation            Energy/Eh            Energy/eV
      -------------------------------------------------------------
         1        2.0000           -0.7303964             -19.8751
       ...           ...                  ...                  ...
        31        2.0000           -0.4612125             -12.5502
        32        2.0000           -0.4530218             -12.3273
        33        2.0000           -0.4523820             -12.3099
        34        2.0000           -0.4470150             -12.1639
        35        2.0000           -0.4419610             -12.0264
        36        2.0000           -0.4286759             -11.6649
        37        2.0000           -0.4148758             -11.2893 (HOMO)
        38                         -0.3408545              -9.2751 (LUMO)
        39                         -0.3219819              -8.7616
        40                         -0.2608207              -7.0973
        41                         -0.2529914              -6.8842
        42                         -0.2338496              -6.3634
       ...                                ...                  ...
        70                          1.1520761              31.3496
      -------------------------------------------------------------
                  HL-Gap            0.0740212 Eh            2.0142 eV
             Fermi-level           -0.3778652 Eh          -10.2822 eV

 SCC (total)                   0 d,  0 h,  0 min,  0.025 sec
 SCC setup                      ...        0 min,  0.000 sec (  0.639%)
 Dispersion                     ...        0 min,  0.000 sec (  0.722%)
 integral evaluation            ...        0 min,  0.009 sec ( 35.921%)
 zeroth order Hamiltonian       ...        0 min,  0.000 sec (  0.513%)
 iterations                     ...        0 min,  0.003 sec ( 13.082%)
 molecular gradient             ...        0 min,  0.012 sec ( 48.013%)
 printout                       ...        0 min,  0.000 sec (  0.959%)

         :::::::::::::::::::::::::::::::::::::::::::::::::::::
         ::                     SUMMARY                     ::
         :::::::::::::::::::::::::::::::::::::::::::::::::::::
         :: total energy             -40.675694607491 Eh    ::
         :: gradient norm              0.000350221643 Eh/a0 ::
         :: HOMO-LUMO gap              2.014219898563 eV    ::
         ::.................................................::
         :: SCC energy               -41.449543940089 Eh    ::
         :: -> isotropic ES            0.040075985101 Eh    ::
         :: -> anisotropic ES          0.000931062416 Eh    ::
         :: -> anisotropic XC          0.047200710382 Eh    ::
         :: -> dispersion             -0.025400131075 Eh    ::
         :: repulsion energy           0.773781300198 Eh    ::
         :: add. restraining           0.000000000000 Eh    ::
         :::::::::::::::::::::::::::::::::::::::::::::::::::::

           -------------------------------------------------
          |                Property Printout                |
           -------------------------------------------------

    * Orbital Energies and Occupations

         #    Occupation            Energy/Eh            Energy/eV
      -------------------------------------------------------------
         1        2.0000           -0.7303964             -19.8751
       ...           ...                  ...                  ...
        25        2.0000           -0.5052512             -13.7486
        26        2.0000           -0.5050617             -13.7434
        27        2.0000           -0.4958455             -13.4926
        28        2.0000           -0.4927785             -13.4092
        29        2.0000           -0.4844958             -13.1838
        30        2.0000           -0.4752118             -12.9312
        31        2.0000           -0.4612125             -12.5502
        32        2.0000           -0.4530218             -12.3273
        33        2.0000           -0.4523820             -12.3099
        34        2.0000           -0.4470150             -12.1639
        35        2.0000           -0.4419610             -12.0264
        36        2.0000           -0.4286759             -11.6649
        37        2.0000           -0.4148758             -11.2893 (HOMO)
        38                         -0.3408545              -9.2751 (LUMO)
        39                         -0.3219819              -8.7616
        40                         -0.2608207              -7.0973
        41                         -0.2529914              -6.8842
        42                         -0.2338496              -6.3634
        43                         -0.2288964              -6.2286
        44                         -0.2078981              -5.6572
        45                         -0.1781031              -4.8464
        46                         -0.1230760              -3.3491
        47                         -0.0984666              -2.6794
        48                          0.0438615               1.1935
       ...                                ...                  ...
        70                          1.1520761              31.3496
      -------------------------------------------------------------
                  HL-Gap            0.0740212 Eh            2.0142 eV
             Fermi-level           -0.3778652 Eh          -10.2822 eV

     #   Z        covCN         q      C6AA      α(0)
     1   6 C      2.913    -0.024    28.613     8.771
     2   6 C      2.921    -0.016    28.421     8.742
     3   6 C      2.921    -0.018    28.462     8.749
     4   6 C      2.912    -0.012    28.312     8.725
     5   6 C      3.034    -0.015    28.343     8.732
     6   6 C      3.030     0.010    27.762     8.642
     7   6 C      3.007     0.034    27.226     8.559
     8   6 C      2.947     0.017    27.639     8.623
     9   6 C      1.937     0.125    28.018     8.548
    10   7 N      0.911    -0.220    25.801     7.346
    11   6 C      1.937     0.125    28.017     8.548
    12   7 N      0.911    -0.218    25.768     7.342
    13   6 C      2.995    -0.014    28.350     8.734
    14   6 C      2.863     0.229    23.209     7.897
    15   8 O      0.856    -0.344    20.598     6.085
    16   6 C      2.840    -0.054    29.330     8.875
    17   1 H      0.926     0.059     2.210     2.325
    18   1 H      0.926     0.055     2.262     2.352
    19   1 H      0.926     0.054     2.272     2.357
    20   1 H      0.926     0.065     2.145     2.290
    21   1 H      0.926     0.076     2.022     2.223
    22   1 H      0.926     0.088     1.895     2.153

 Mol. C6AA /au·bohr⁶  :       8442.866280
 Mol. C8AA /au·bohr⁸  :     217766.304960
 Mol. α(0) /au        :        146.620121


Wiberg/Mayer (AO) data.
largest (>0.10) Wiberg bond orders for each atom
          total WBO             WBO to atom ...
     1  C   3.980        C    2 1.439    C    6 1.391    H   17 0.961
     2  C   3.983        C    1 1.439    C    3 1.427    H   18 0.969
     3  C   3.970        C    4 1.430    C    2 1.427    H   19 0.969
     4  C   3.986        C    3 1.430    C    5 1.414    H   20 0.966
     5  C   3.979        C    4 1.414    C    6 1.288    C   14 1.029
     6  C   3.988        C    1 1.391    C    5 1.288    C    7 1.098
     7  C   3.983        C    8 1.537    C    6 1.098    C   13 1.081
     8  C   3.987        C    7 1.537    C    9 1.088    C   11 1.087
     9  C   3.948        N   10 2.779    C    8 1.088
    10  N   2.986        C    9 2.779
    11  C   3.948        N   12 2.780    C    8 1.087
    12  N   2.986        C   11 2.780
    13  C   3.987        C   16 1.806    C    7 1.081    C   14 0.987
    14  C   3.931        O   15 1.812    C    5 1.029    C   13 0.987
    15  O   2.084        C   14 1.812
    16  C   3.944        C   13 1.806    H   22 0.967    H   21 0.965
    17  H   0.996        C    1 0.961
    18  H   0.997        C    2 0.969
    19  H   0.996        C    3 0.969
    20  H   0.995        C    4 0.966
    21  H   0.994        C   16 0.965
    22  H   0.991        C   16 0.967

molecular dipole:
                 x           y           z       tot (Debye)
 q only:        1.264      -0.376      -0.001
   full:        1.531      -0.652      -0.001       4.229
molecular quadrupole (traceless):
                xx          xy          yy          xz          yz          zz
 q only:        4.324       9.385     -13.467       0.036       0.014       9.143
  q+dip:        5.446      12.202     -15.195       0.052       0.016       9.749
   full:        1.558      11.700     -18.346       0.056       0.026      16.788

           -------------------------------------------------
          |                Geometry Summary                 |
           -------------------------------------------------

      molecular mass/u    :      206.2032000
   center of mass at/Å    :       -1.4007465       0.7352167       0.0013818
  moments of inertia/u·Å² :        0.6258194E+03   0.1009628E+04   0.1635446E+04
rotational constants/cm⁻¹ :        0.2693689E-01   0.1669687E-01   0.1030767E-01

 * 17 selected distances

     #   Z        #   Z                                     value/Å
     1   6 C      2   6 C                                 1.3871970
     2   6 C      3   6 C                                 1.3890790
     3   6 C      4   6 C                                 1.3867367
     4   6 C      5   6 C                                 1.3826950
     1   6 C      6   6 C                                 1.3887187
     5   6 C      6   6 C                                 1.4086488 (max)
     7   6 C      8   6 C                                 1.3635089
     9   6 C     10   7 N                                 1.1470159
    11   6 C     12   7 N                                 1.1468450
    14   6 C     15   8 O                                 1.2070459
    13   6 C     16   6 C                                 1.3343245
     1   6 C     17   1 H                                 1.0777673
     2   6 C     18   1 H                                 1.0796095
     3   6 C     19   1 H                                 1.0794564
     4   6 C     20   1 H                                 1.0790982
    16   6 C     21   1 H                                 1.0754765 (min)
    16   6 C     22   1 H                                 1.0788403

 * 4 distinct bonds (by element types)

   Z      Z             #   av. dist./Å        max./Å        min./Å
   1 H    6 C           6     1.0783747     1.0796095     1.0754765
   6 C    6 C           8     1.3801136     1.4086488     1.3343245
   6 C    7 N           2     1.1469304     1.1470159     1.1468450
   6 C    8 O           1     1.2070459     1.2070459     1.2070459


optimized geometry written to: xtbopt.xyz


           -------------------------------------------------
          | TOTAL ENERGY              -40.675694607491 Eh   |
          | GRADIENT NORM               0.000350221643 Eh/α |
          | HOMO-LUMO GAP               2.014219898563 eV   |
           -------------------------------------------------

------------------------------------------------------------------------
 * finished run on 2021/02/19 at 08:12:08.482     
------------------------------------------------------------------------
 total:
 * wall-time:     0 d,  0 h,  0 min,  0.533 sec
 *  cpu-time:     0 d,  0 h,  0 min,  0.528 sec
 * ratio c/w:     0.990 speedup
 SCF:
 * wall-time:     0 d,  0 h,  0 min,  0.036 sec
 *  cpu-time:     0 d,  0 h,  0 min,  0.036 sec
 * ratio c/w:     0.998 speedup
 ANC optimizer:
 * wall-time:     0 d,  0 h,  0 min,  0.474 sec
 *  cpu-time:     0 d,  0 h,  0 min,  0.473 sec
 * ratio c/w:     0.998 speedup

