      -----------------------------------------------------------      
     |                   =====================                   |     
     |                           x T B                           |     
     |                   =====================                   |     
     |                         S. Grimme                         |     
     |          Mulliken Center for Theoretical Chemistry        |     
     |                    University of Bonn                     |     
     |                Version 6.2 RC2 (SAW190805)                |     
      -----------------------------------------------------------      

   This program is distributed in the hope that it will be useful,
   but WITHOUT ANY WARRANTY; without even the implied warranty of
   MERCHANTABILITY or FITNESS FOR A PARTICULAR PURPOSE.
   
   FOR NON-COMMERCIAL, ACADEMIA USE ONLY.
   
   Cite this work as:
   * S. Grimme, C. Bannwarth, P. Shushkov, J. Chem. Theory Comput., 2017,
     13, 1989-2009. DOI: 10.1021/acs.jctc.7b00118
   * C. Bannwarth, S. Ehlert and S. Grimme., J. Chem. Theory Comput., 2019,
     15, 1652-1671. DOI: 10.1021/acs.jctc.8b01176
   * P. Pracht, E. Caldeweyher, S. Ehlert, S. Grimme, ChemRxiv, 2019, preprint.
     DOI: 10.26434/chemrxiv.8326202.v1
   
   for DFT-D4:
   * E. Caldeweyher, C. Bannwarth and S. Grimme, J. Chem. Phys., 2017,
     147, 034112. DOI: 10.1063/1.4993215
   * E. Caldeweyher, S. Ehlert, A. Hansen, H. Neugebauer, S. Spicher,
     C. Bannwarth and S. Grimme, J. Chem. Phys., 2019, 150, 154122.
     DOI: 10.1063/1.5090222
   
   for sTDA-xTB:
   * S. Grimme and C. Bannwarth, J. Chem. Phys., 2016, 145, 054103.
     DOI: 10.1063/1.4959605
   
   in the mass-spec context:
   * V. Asgeirsson, C. Bauer and S. Grimme, Chem. Sci., 2017, 8, 4879.
     DOI: 10.1039/c7sc00601b
   
   for metadynamics refer to:
   * S. Grimme, J. Chem. Theory Comput., 2019, 155, 2847-2862
     DOI: 10.1021/acs.jctc.9b00143
   
   with help from (in alphabetical order)
   C. Bannwarth, F. Bohle, G. Brandenburg, E. Caldeweyher, M. Checinski,
   S. Dohm, S. Ehlert, S. Ehrlich, F. März, H. Neugebauer, J. Pisarek,
   P. Pracht, P. Shushkov, and S. Spicher.
   
 * started run on 2021/02/19 at 08:12:15.897     

           -------------------------------------------------
          |                Calculation Setup                |
           -------------------------------------------------

          program call               : /ihome/ghutchison/geoffh/xtb/xtb 30atl.xyz -opt
          hostname                   : smp-n135
          coordinate file            : 30atl.xyz
          omp threads                :                     1
          number of atoms            :                    22
          number of electrons        :                    80
          charge                     :                     0
          spin                       :                   0.0
          first test random number   :      0.71482855722328


########################################################################
# WARNING! Please study the warnings concerning your input carefully
#  - the use of '-opt' is discouraged, please use '--opt' next time
########################################################################

           ------------------------------------------------- 
          |                 G F N 2 - x T B                 |
          | Geometry, Frequencies, Noncovalent interactions |
          |            JCTC 2019 parametrisation            |
           ------------------------------------------------- 
             KAB for C  - Si     :                1.0500
             KAB for H  - Pd     :                0.9500
             k(s)              :                1.8500
             k(p)              :                2.2300
             k(d)              :                2.2300
             k(f)              :                2.0000
             kEN (H0ij)        :               -2.0000
             D4 a1             :                0.5200
             D4 a2             :                5.0000
             D4 s6             :                1.0000
             D4 s8             :                2.7000
             D4 s9             :                5.0000
             alphaj            :                2.0000

  Z AO/shell   Hii/eV     exponent
  1     Wed Apr 25 08:07:45 CEST 2018   EN: 2.200 GM2: 0.406  GM3: 0.0800  RAES: 1.40
     1s    -10.707211    1.230000
  6     Wed Apr 25 08:07:45 CEST 2018   EN: 2.550 GM2: 0.538  GM3: 0.1500  RAES: 3.00
     2s    -13.970922    2.096432
     2p    -10.063292    1.800000
  7     Wed Apr 25 08:07:45 CEST 2018   EN: 3.040 GM2: 0.461  GM3:-0.0640  RAES: 1.90
     2s    -16.686243    2.339881
     2p    -12.523956    2.014332
  8     Wed Apr 25 08:07:45 CEST 2018   EN: 3.440 GM2: 0.452  GM3:-0.0517  RAES: 1.80
     2s    -20.229985    2.439742
     2p    -15.503117    2.137023
 35     Tue Apr 24 12:21:41 CEST 2018   EN: 2.960 GM2: 0.261  GM3: 0.1300  RAES: 4.00
     4s    -23.583718    2.077587
     4p    -12.588824    2.263120
     4d      0.047980    1.845038

           ------------------------------------------------- 
          |        Self-Consistent Charge Iterations        |
           ------------------------------------------------- 

          ...................................................
          :                      SETUP                      :
          :.................................................:
          :  # basis functions                  79          :
          :  # atomic orbitals                  78          :
          :  # shells                           40          :
          :  # electrons                        80          :
          :  max. iterations                   250          :
          :  Hamiltonian                  GFN2-xTB          :
          :  restarted?                      false          :
          :  GBSA solvation                  false          :
          :  PC potential                    false          :
          :  electronic temp.          300.0000000     K    :
          :  accuracy                    1.0000000          :
          :  -> integral cutoff          0.2500000E+02      :
          :  -> integral neglect         0.1000000E-07      :
          :  -> SCF convergence          0.1000000E-05 Eh   :
          :  -> wf. convergence          0.1000000E-03 e    :
          :  Broyden damping             0.4000000          :
          ...................................................

 iter      E             dE          RMSdq      gap      omega  full diag
   1    -44.6471626 -0.446472E+02  0.765E+00    2.42       0.0  T
   2    -44.5197473  0.127415E+00  0.559E+00    2.20       1.0  T
   3    -44.3937891  0.125958E+00  0.463E+00    1.84       1.0  T
   4    -44.7589309 -0.365142E+00  0.122E+00    1.92       1.0  T
   5    -44.7772445 -0.183136E-01  0.464E-01    1.90       1.0  T
   6    -44.7784661 -0.122159E-02  0.238E-01    1.94       1.0  T
   7    -44.7788095 -0.343368E-03  0.124E-01    1.95       1.0  T
   8    -44.7788735 -0.640825E-04  0.911E-02    1.93       1.0  T
   9    -44.7788778 -0.429490E-05  0.698E-02    1.93       1.0  T
  10    -44.7789051 -0.273043E-04  0.395E-02    1.94       1.0  T
  11    -44.7789116 -0.644816E-05  0.245E-02    1.94       1.0  T
  12    -44.7789184 -0.679959E-05  0.122E-02    1.93       1.8  T
  13    -44.7789194 -0.962081E-06  0.507E-03    1.93       4.2  T
  14    -44.7789196 -0.299170E-06  0.147E-03    1.93      14.5  T
  15    -44.7789197 -0.299559E-07  0.798E-04    1.94      26.7  T
  16    -44.7789197 -0.612882E-08  0.381E-04    1.94      56.0  T

   *** convergence criteria satisfied after 16 iterations ***

         #    Occupation            Energy/Eh            Energy/eV
      -------------------------------------------------------------
         1        2.0000           -0.8614761             -23.4420
       ...           ...                  ...                  ...
        34        2.0000           -0.4683961             -12.7457
        35        2.0000           -0.4610173             -12.5449
        36        2.0000           -0.4595406             -12.5047
        37        2.0000           -0.4474032             -12.1745
        38        2.0000           -0.4382941             -11.9266
        39        2.0000           -0.4281762             -11.6513
        40        2.0000           -0.4246380             -11.5550 (HOMO)
        41                         -0.3535235              -9.6199 (LUMO)
        42                         -0.3352026              -9.1213
        43                         -0.2968670              -8.0782
        44                         -0.2869370              -7.8080
        45                         -0.2816006              -7.6627
       ...                                ...                  ...
        78                          0.6889164              18.7464
      -------------------------------------------------------------
                  HL-Gap            0.0711145 Eh            1.9351 eV
             Fermi-level           -0.3890808 Eh          -10.5874 eV

 SCC (total)                   0 d,  0 h,  0 min,  0.045 sec
 SCC setup                      ...        0 min,  0.000 sec (  0.598%)
 Dispersion                     ...        0 min,  0.000 sec (  0.776%)
 integral evaluation            ...        0 min,  0.011 sec ( 25.519%)
 zeroth order Hamiltonian       ...        0 min,  0.000 sec (  0.365%)
 iterations                     ...        0 min,  0.018 sec ( 40.900%)
 molecular gradient             ...        0 min,  0.014 sec ( 31.128%)
 printout                       ...        0 min,  0.000 sec (  0.621%)

         :::::::::::::::::::::::::::::::::::::::::::::::::::::
         ::                     SUMMARY                     ::
         :::::::::::::::::::::::::::::::::::::::::::::::::::::
         :: total energy             -44.179748030740 Eh    ::
         :: gradient norm              0.341664594456 Eh/a0 ::
         :: HOMO-LUMO gap              1.935123353432 eV    ::
         ::.................................................::
         :: SCC energy               -44.778919685717 Eh    ::
         :: -> isotropic ES            0.041539111388 Eh    ::
         :: -> anisotropic ES          0.001543719251 Eh    ::
         :: -> anisotropic XC          0.049757748566 Eh    ::
         :: -> dispersion             -0.027249253646 Eh    ::
         :: repulsion energy           0.599175889218 Eh    ::
         :: add. restraining           0.000000000000 Eh    ::
         :::::::::::::::::::::::::::::::::::::::::::::::::::::

      ----------------------------------------------------------- 
     |                   =====================                   |
     |                        A N C O P T                        |
     |                   =====================                   |
     |               Approximate Normal Coordinate               |
     |                Rational Function Optimizer                |
      ----------------------------------------------------------- 

          ...................................................
          :                      SETUP                      :
          :.................................................:
          :   optimization level            normal          :
          :   max. optcycles                   200          :
          :   ANC micro-cycles                  20          :
          :   degrees of freedom                60          :
          :.................................................:
          :   RF solver                   davidson          :
          :   input Hessian                  false          :
          :   write xtbopt.log                true          :
          :   linear?                        false          :
          :   energy convergence         0.5000000E-05 Eh   :
          :   grad. convergence          0.1000000E-02 Eh/α :
          :   maximium RF displ.         2.0000000          :
          :   Hlow (freq-cutoff)         0.5000000E-02      :
          :   Hmax (freq-cutoff)         5.0000000          :
          :   S6 in model hess.         20.0000000          :
          ...................................................

generating ANC from model Hessian ...
Using Lindh-Hessian (1995)
 Shifting diagonal of input Hessian by   4.888609587538343E-003
 Lowest  eigenvalues of input Hessian
   -0.000000   -0.000000    0.000000    0.000000    0.000000    0.000000
    0.005000    0.005863    0.007186    0.007350    0.007496    0.010905
    0.012873    0.013645    0.016849    0.018023    0.018833    0.024701
 Highest eigenvalues
    1.900741    1.950171    1.961615    2.001335    2.017920    2.267079
 

........................................................................
.............................. CYCLE    1 ..............................
........................................................................
   1    -44.7789197 -0.447789E+02  0.171E-04    1.94       0.0  T
   2    -44.7789197 -0.266027E-10  0.138E-04    1.94     154.1  T
   3    -44.7789197 -0.321833E-09  0.775E-05    1.94     275.2  T
     SCC iter.                  ...        0 min,  0.004 sec
     gradient                   ...        0 min,  0.014 sec
 * total energy  :   -44.1797480 Eh     change        0.3394732E-07 Eh
   gradient norm :     0.3416644 Eh/α   predicted     0.0000000E+00 (-100.00%)
   displ. norm   :     0.4316605 α      lambda       -0.9794406E-01
   maximum displ.:     0.1598541 α      in ANC's #21, #29, #33, ...

........................................................................
.............................. CYCLE    2 ..............................
........................................................................
   1    -44.9619318 -0.449619E+02  0.623E-01    2.05       0.0  T
   2    -44.9621287 -0.196873E-03  0.381E-01    2.05       1.0  T
   3    -44.9612924  0.836269E-03  0.309E-01    2.06       1.0  T
   4    -44.9627135 -0.142110E-02  0.579E-02    2.02       1.0  T
   5    -44.9627926 -0.790467E-04  0.175E-02    2.04       1.2  T
   6    -44.9627950 -0.245210E-05  0.103E-02    2.04       2.1  T
   7    -44.9627957 -0.688822E-06  0.489E-03    2.04       4.4  T
   8    -44.9627958 -0.122919E-06  0.247E-03    2.04       8.6  T
     SCC iter.                  ...        0 min,  0.009 sec
     gradient                   ...        0 min,  0.013 sec
 * total energy  :   -44.2417563 Eh     change       -0.6200835E-01 Eh
   gradient norm :     0.0506196 Eh/α   predicted    -0.5809704E-01 (  -6.31%)
   displ. norm   :     0.4090442 α      lambda       -0.1384734E-01
   maximum displ.:     0.1955675 α      in ANC's #10, #21, #22, ...

........................................................................
.............................. CYCLE    3 ..............................
........................................................................
   1    -45.0134464 -0.450134E+02  0.378E-01    2.01       0.0  T
   2    -45.0134467 -0.236740E-06  0.243E-01    2.01       1.0  T
   3    -45.0131842  0.262429E-03  0.173E-01    2.04       1.0  T
   4    -45.0136772 -0.492944E-03  0.286E-02    2.03       1.0  T
   5    -45.0136880 -0.108116E-04  0.126E-02    2.03       1.7  T
   6    -45.0136889 -0.914441E-06  0.568E-03    2.03       3.8  T
   7    -45.0136890 -0.150993E-06  0.307E-03    2.03       6.9  T
     SCC iter.                  ...        0 min,  0.007 sec
     gradient                   ...        0 min,  0.012 sec
 * total energy  :   -44.2503375 Eh     change       -0.8581160E-02 Eh
   gradient norm :     0.0383375 Eh/α   predicted    -0.8082128E-02 (  -5.82%)
   displ. norm   :     0.3619155 α      lambda       -0.4234750E-02
   maximum displ.:     0.2296893 α      in ANC's #10, #8, #21, ...

........................................................................
.............................. CYCLE    4 ..............................
........................................................................
   1    -45.0124373 -0.450124E+02  0.387E-01    1.96       0.0  T
   2    -45.0124828 -0.455500E-04  0.226E-01    1.99       1.0  T
   3    -45.0121221  0.360746E-03  0.156E-01    2.00       1.0  T
   4    -45.0125717 -0.449627E-03  0.265E-02    2.00       1.0  T
   5    -45.0125762 -0.446110E-05  0.159E-02    2.00       1.3  T
   6    -45.0125795 -0.332246E-05  0.620E-03    2.00       3.4  T
   7    -45.0125796 -0.105020E-06  0.387E-03    2.00       5.5  T
   8    -45.0125797 -0.687648E-07  0.274E-03    2.00       7.8  T
     SCC iter.                  ...        0 min,  0.008 sec
     gradient                   ...        0 min,  0.013 sec
 * total energy  :   -44.2510024 Eh     change       -0.6649045E-03 Eh
   gradient norm :     0.0307003 Eh/α   predicted    -0.2394716E-02 ( 260.16%)
   displ. norm   :     0.4266874 α      lambda       -0.4845373E-02
   maximum displ.:     0.1824949 α      in ANC's #5, #10, #1, ...

........................................................................
.............................. CYCLE    5 ..............................
........................................................................
   1    -44.9973421 -0.449973E+02  0.639E-01    1.95       0.0  T
   2    -44.9974715 -0.129424E-03  0.357E-01    1.99       1.0  T
   3    -44.9967850  0.686542E-03  0.181E-01    1.97       1.0  T
   4    -44.9975929 -0.807878E-03  0.223E-02    1.99       1.0  T
   5    -44.9975932 -0.321931E-06  0.167E-02    1.98       1.3  T
   6    -44.9975965 -0.331888E-05  0.673E-03    1.98       3.2  T
   7    -44.9975968 -0.269415E-06  0.366E-03    1.98       5.8  T
   8    -44.9975968 -0.783920E-07  0.245E-03    1.98       8.7  T
     SCC iter.                  ...        0 min,  0.007 sec
     gradient                   ...        0 min,  0.013 sec
 * total energy  :   -44.2502795 Eh     change        0.7229451E-03 Eh
   gradient norm :     0.0928937 Eh/α   predicted    -0.2863765E-02 (-496.12%)
   displ. norm   :     0.2331465 α      lambda       -0.6715798E-02
   maximum displ.:     0.1362480 α      in ANC's #1, #5, #3, ...

........................................................................
.............................. CYCLE    6 ..............................
........................................................................
   1    -45.0164106 -0.450164E+02  0.398E-01    2.03       0.0  T
   2    -45.0164989 -0.882948E-04  0.229E-01    2.03       1.0  T
   3    -45.0162062  0.292726E-03  0.121E-01    2.01       1.0  T
   4    -45.0165478 -0.341623E-03  0.200E-02    2.02       1.1  T
   5    -45.0165531 -0.533244E-05  0.798E-03    2.02       2.7  T
   6    -45.0165536 -0.475829E-06  0.428E-03    2.02       5.0  T
   7    -45.0165538 -0.197199E-06  0.167E-03    2.02      12.8  T
     SCC iter.                  ...        0 min,  0.007 sec
     gradient                   ...        0 min,  0.013 sec
 * total energy  :   -44.2526797 Eh     change       -0.2400207E-02 Eh
   gradient norm :     0.0264013 Eh/α   predicted    -0.3540427E-02 (  47.51%)
   displ. norm   :     0.1289940 α      lambda       -0.8035846E-03
   maximum displ.:     0.0817975 α      in ANC's #5, #15, #10, ...

........................................................................
.............................. CYCLE    7 ..............................
........................................................................
   1    -45.0174803 -0.450175E+02  0.161E-01    2.02       0.0  T
   2    -45.0174885 -0.821323E-05  0.916E-02    2.02       1.0  T
   3    -45.0174519  0.366203E-04  0.470E-02    2.02       1.0  T
   4    -45.0174947 -0.427585E-04  0.660E-03    2.02       3.2  T
   5    -45.0174947 -0.219680E-07  0.484E-03    2.02       4.4  T
   6    -45.0174951 -0.359524E-06  0.161E-03    2.02      13.3  T
     SCC iter.                  ...        0 min,  0.005 sec
     gradient                   ...        0 min,  0.013 sec
 * total energy  :   -44.2528807 Eh     change       -0.2010340E-03 Eh
   gradient norm :     0.0185120 Eh/α   predicted    -0.4084810E-03 ( 103.19%)
   displ. norm   :     0.1455897 α      lambda       -0.5103857E-03
   maximum displ.:     0.0765657 α      in ANC's #4, #3, #10, ...

........................................................................
.............................. CYCLE    8 ..............................
........................................................................
   1    -45.0077231 -0.450077E+02  0.249E-01    2.01       0.0  T
   2    -45.0077379 -0.148203E-04  0.139E-01    2.02       1.0  T
   3    -45.0075703  0.167576E-03  0.940E-02    2.01       1.0  T
   4    -45.0077655 -0.195169E-03  0.671E-03    2.02       3.2  T
   5    -45.0077661 -0.586751E-06  0.419E-03    2.02       5.1  T
   6    -45.0077663 -0.223708E-06  0.216E-03    2.02       9.9  T
   7    -45.0077663 -0.366611E-07  0.110E-03    2.02      19.4  T
     SCC iter.                  ...        0 min,  0.007 sec
     gradient                   ...        0 min,  0.013 sec
 * total energy  :   -44.2528470 Eh     change        0.3368512E-04 Eh
   gradient norm :     0.0285167 Eh/α   predicted    -0.2606063E-03 (-873.65%)
   displ. norm   :     0.0932523 α      lambda       -0.6517754E-03
   maximum displ.:     0.0482976 α      in ANC's #8, #4, #3, ...

........................................................................
.............................. CYCLE    9 ..............................
........................................................................
   1    -45.0150828 -0.450151E+02  0.171E-01    2.02       0.0  T
   2    -45.0150922 -0.946127E-05  0.957E-02    2.03       1.0  T
   3    -45.0150430  0.492268E-04  0.530E-02    2.03       1.0  T
   4    -45.0151008 -0.577745E-04  0.633E-03    2.02       3.4  T
   5    -45.0151016 -0.785967E-06  0.304E-03    2.03       7.0  T
   6    -45.0151016 -0.786044E-07  0.156E-03    2.02      13.6  T
     SCC iter.                  ...        0 min,  0.005 sec
     gradient                   ...        0 min,  0.013 sec
 * total energy  :   -44.2531092 Eh     change       -0.2621320E-03 Eh
   gradient norm :     0.0043335 Eh/α   predicted    -0.3287241E-03 (  25.40%)
   displ. norm   :     0.0427471 α      lambda       -0.7386829E-04
   maximum displ.:     0.0229984 α      in ANC's #15, #1, #5, ...

........................................................................
.............................. CYCLE   10 ..............................
........................................................................
   1    -45.0155977 -0.450156E+02  0.467E-02    2.03       0.0  T
   2    -45.0155980 -0.359393E-06  0.271E-02    2.03       1.0  T
   3    -45.0155926  0.542005E-05  0.184E-02    2.03       1.2  T
   4    -45.0155991 -0.645238E-05  0.208E-03    2.03      10.2  T
   5    -45.0155991 -0.413271E-07  0.120E-03    2.03      17.8  T
   6    -45.0155991 -0.109435E-07  0.336E-04    2.03      63.5  T
     SCC iter.                  ...        0 min,  0.006 sec
     gradient                   ...        0 min,  0.013 sec
 * total energy  :   -44.2531477 Eh     change       -0.3859025E-04 Eh
   gradient norm :     0.0023800 Eh/α   predicted    -0.3700210E-04 (  -4.12%)
   displ. norm   :     0.0425129 α      lambda        0.6427984E-04
   maximum displ.:     0.0229815 α      in ANC's #15, #1, #5, ...

........................................................................
.............................. CYCLE   11 ..............................
........................................................................
   1    -45.0158855 -0.450159E+02  0.464E-02    2.03       0.0  T
   2    -45.0158859 -0.331946E-06  0.270E-02    2.03       1.0  T
   3    -45.0158803  0.558062E-05  0.186E-02    2.03       1.1  T
   4    -45.0158869 -0.664369E-05  0.208E-03    2.03      10.3  T
   5    -45.0158870 -0.414338E-07  0.119E-03    2.03      17.8  T
   6    -45.0158870 -0.105483E-07  0.339E-04    2.03      62.9  T
   7    -45.0158870 -0.799183E-09  0.177E-04    2.03     120.7  T
     SCC iter.                  ...        0 min,  0.007 sec
     gradient                   ...        0 min,  0.014 sec
 * total energy  :   -44.2531156 Eh     change        0.3217977E-04 Eh
   gradient norm :     0.0064654 Eh/α   predicted     0.3219371E-04 (   0.04%)
   displ. norm   :     0.0376761 α      lambda       -0.9652922E-04
   maximum displ.:     0.0157935 α      in ANC's #12, #11, #15, ...

........................................................................
.............................. CYCLE   12 ..............................
........................................................................
   1    -45.0153182 -0.450153E+02  0.405E-02    2.03       0.0  T
   2    -45.0153186 -0.334383E-06  0.235E-02    2.03       1.0  T
   3    -45.0153162  0.232730E-05  0.117E-02    2.03       1.8  T
   4    -45.0153189 -0.267688E-05  0.166E-03    2.03      12.9  T
   5    -45.0153189 -0.502672E-08  0.107E-03    2.03      20.0  T
     SCC iter.                  ...        0 min,  0.005 sec
     gradient                   ...        0 min,  0.013 sec
 * total energy  :   -44.2531661 Eh     change       -0.5058453E-04 Eh
   gradient norm :     0.0035306 Eh/α   predicted    -0.4833514E-04 (  -4.45%)
   displ. norm   :     0.0180289 α      lambda       -0.1414102E-04
   maximum displ.:     0.0077210 α      in ANC's #11, #5, #12, ...

........................................................................
.............................. CYCLE   13 ..............................
........................................................................
   1    -45.0158191 -0.450158E+02  0.168E-02    2.03       0.0  T
   2    -45.0158192 -0.652293E-07  0.966E-03    2.03       2.2  T
   3    -45.0158187  0.505791E-06  0.641E-03    2.03       3.3  T
   4    -45.0158193 -0.652512E-06  0.521E-04    2.03      40.9  T
   5    -45.0158193  0.575128E-09  0.388E-04    2.03      54.9  T
     SCC iter.                  ...        0 min,  0.005 sec
     gradient                   ...        0 min,  0.014 sec
 * total energy  :   -44.2531719 Eh     change       -0.5796460E-05 Eh
   gradient norm :     0.0017434 Eh/α   predicted    -0.7074521E-05 (  22.05%)
   displ. norm   :     0.0271446 α      lambda        0.2154638E-04
   maximum displ.:     0.0115845 α      in ANC's #11, #5, #12, ...

........................................................................
.............................. CYCLE   14 ..............................
........................................................................
   1    -45.0165043 -0.450165E+02  0.253E-02    2.03       0.0  T
   2    -45.0165045 -0.143228E-06  0.145E-02    2.03       1.5  T
   3    -45.0165033  0.114402E-05  0.947E-03    2.03       2.3  T
   4    -45.0165048 -0.145211E-05  0.799E-04    2.03      26.7  T
   5    -45.0165048  0.151905E-08  0.616E-04    2.03      34.6  T
   6    -45.0165048 -0.518613E-08  0.141E-04    2.03     151.3  T
     SCC iter.                  ...        0 min,  0.005 sec
     gradient                   ...        0 min,  0.013 sec
 * total energy  :   -44.2531496 Eh     change        0.2238241E-04 Eh
   gradient norm :     0.0069842 Eh/α   predicted     0.1077517E-04 ( -51.86%)
   displ. norm   :     0.0189573 α      lambda       -0.3527574E-04
   maximum displ.:     0.0103676 α      in ANC's #5, #8, #13, ...

........................................................................
.............................. CYCLE   15 ..............................
........................................................................
   1    -45.0162582 -0.450163E+02  0.161E-02    2.03       0.0  T
   2    -45.0162583 -0.555978E-07  0.957E-03    2.03       2.2  T
   3    -45.0162578  0.484265E-06  0.710E-03    2.03       3.0  T
   4    -45.0162585 -0.726527E-06  0.947E-04    2.03      22.5  T
   5    -45.0162585 -0.111461E-07  0.506E-04    2.03      42.1  T
     SCC iter.                  ...        0 min,  0.005 sec
     gradient                   ...        0 min,  0.013 sec
 * total energy  :   -44.2531731 Eh     change       -0.2350350E-04 Eh
   gradient norm :     0.0022691 Eh/α   predicted    -0.1764738E-04 ( -24.92%)
   displ. norm   :     0.0188838 α      lambda       -0.5572338E-07
   maximum displ.:     0.0103676 α      in ANC's #5, #8, #13, ...

........................................................................
.............................. CYCLE   16 ..............................
........................................................................
   1    -45.0159907 -0.450160E+02  0.161E-02    2.03       0.0  T
   2    -45.0159907 -0.511482E-07  0.961E-03    2.03       2.2  T
   3    -45.0159902  0.499379E-06  0.716E-03    2.03       3.0  T
   4    -45.0159910 -0.748878E-06  0.963E-04    2.03      22.1  T
   5    -45.0159910 -0.115444E-07  0.509E-04    2.03      41.9  T
     SCC iter.                  ...        0 min,  0.005 sec
     gradient                   ...        0 min,  0.014 sec
 * total energy  :   -44.2531731 Eh     change        0.1322832E-08 Eh
   gradient norm :     0.0025173 Eh/α   predicted    -0.3145908E-07 (*******%)
   displ. norm   :     0.0098035 α      lambda       -0.6460612E-05
   maximum displ.:     0.0052783 α      in ANC's #5, #8, #13, ...

........................................................................
.............................. CYCLE   17 ..............................
........................................................................
   1    -45.0161223 -0.450161E+02  0.827E-03    2.03       0.0  T
   2    -45.0161223 -0.994624E-08  0.501E-03    2.03       4.3  T
   3    -45.0161222  0.123772E-06  0.378E-03    2.03       5.6  T
   4    -45.0161224 -0.209354E-06  0.559E-04    2.03      38.2  T
   5    -45.0161224 -0.455432E-08  0.242E-04    2.03      88.2  T
     SCC iter.                  ...        0 min,  0.005 sec
     gradient                   ...        0 min,  0.014 sec
 * total energy  :   -44.2531764 Eh     change       -0.3353835E-05 Eh
   gradient norm :     0.0001919 Eh/α   predicted    -0.3232951E-05 (  -3.60%)
   displ. norm   :     0.0041988 α      lambda       -0.1737096E-06
   maximum displ.:     0.0018873 α      in ANC's #6, #1, #10, ...

   *** GEOMETRY OPTIMIZATION CONVERGED AFTER 17 ITERATIONS ***

------------------------------------------------------------------------
 total energy gain   :        -0.0734284 Eh      -46.0770 kcal/mol
 total RMSD          :         0.2879876 a0        0.1524 Å
 total power (kW/mol):       -11.3403650 (step) -367.8087 (real)
------------------------------------------------------------------------

 ANCopt (total)                0 d,  0 h,  0 min,  0.524 sec
 optimizer setup                ...        0 min,  0.000 sec (  0.023%)
 model hessian                  ...        0 min,  0.002 sec (  0.418%)
 ANC generation                 ...        0 min,  0.000 sec (  0.093%)
 coordinate transformation      ...        0 min,  0.000 sec (  0.035%)
 single point calculation       ...        0 min,  0.517 sec ( 98.632%)
 optimization log               ...        0 min,  0.001 sec (  0.241%)
 hessian update                 ...        0 min,  0.000 sec (  0.027%)
 rational function              ...        0 min,  0.002 sec (  0.373%)

================
 final structure:
================
$coord
   -2.78349985853645   -2.66275886076089   -0.00207115832553      C 
   -3.00363783298043   -4.92975451437788   -0.00259327423584      O 
   -0.42997611676537   -1.16289124002748   -0.00363580533009      C 
   -1.01448220202935    1.43367541552515   -0.00383025241917      C 
    0.93555486613071    3.19506217076749   -0.00449551878891      C 
    3.40935800758347    2.34303673743172   -0.00437238615777      C 
    3.94314333556399   -0.23109407008643   -0.00380633925354      C 
    2.03177533152909   -2.02717804103415   -0.00363516131318      C 
    7.36444362168154   -1.30357601687276   -0.00215843966680      Br
   -3.74817419713164    1.76294198048774   -0.00095189683442      C 
   -5.01920427054984    4.00466758251657    0.00163322823107      C 
   -3.84366234317760    6.40315447320338   -0.00383141185324      C 
   -2.99451273375516    8.39705226284920   -0.00971202278467      N 
   -7.68059454618934    4.23561635649289    0.00917116138069      C 
   -9.82425091777123    4.55273143658926    0.01617171536653      N 
   -4.88241485020600   -0.76254012644620   -0.00039348158391      C 
   -7.30288628109399   -1.47188946380768   -0.00115852440359      C 
    0.56540613046278    5.19750870021239   -0.00498335141536      H 
    4.94365758047208    3.68653943727780   -0.00451532682839      H 
    2.43263344194426   -4.02640848972059   -0.00315595840851      H 
   -8.86876674661095   -0.17645047460617   -0.00121835154565      H 
   -7.73107951798060   -3.46501734969948   -0.00211657249328      H 
$end
           -------------------------------------------------
          |                Final Singlepoint                |
           -------------------------------------------------

          ...................................................
          :                      SETUP                      :
          :.................................................:
          :  # basis functions                  79          :
          :  # atomic orbitals                  78          :
          :  # shells                           40          :
          :  # electrons                        80          :
          :  max. iterations                   250          :
          :  Hamiltonian                  GFN2-xTB          :
          :  restarted?                      false          :
          :  GBSA solvation                  false          :
          :  PC potential                    false          :
          :  electronic temp.          300.0000000     K    :
          :  accuracy                    1.0000000          :
          :  -> integral cutoff          0.2500000E+02      :
          :  -> integral neglect         0.1000000E-07      :
          :  -> SCF convergence          0.1000000E-05 Eh   :
          :  -> wf. convergence          0.1000000E-03 e    :
          :  Broyden damping             0.4000000          :
          ...................................................

 iter      E             dE          RMSdq      gap      omega  full diag
   1    -45.0161224 -0.450161E+02  0.869E-05    2.03       0.0  T
   2    -45.0161224 -0.128395E-10  0.516E-05    2.03     413.2  T
   3    -45.0161224 -0.100471E-10  0.417E-05    2.03     511.4  T

   *** convergence criteria satisfied after 3 iterations ***

         #    Occupation            Energy/Eh            Energy/eV
      -------------------------------------------------------------
         1        2.0000           -0.8616597             -23.4470
       ...           ...                  ...                  ...
        34        2.0000           -0.4651635             -12.6577
        35        2.0000           -0.4610063             -12.5446
        36        2.0000           -0.4505565             -12.2603
        37        2.0000           -0.4470305             -12.1643
        38        2.0000           -0.4386400             -11.9360
        39        2.0000           -0.4275398             -11.6339
        40        2.0000           -0.4260985             -11.5947 (HOMO)
        41                         -0.3514938              -9.5646 (LUMO)
        42                         -0.3346948              -9.1075
        43                         -0.2782261              -7.5709
        44                         -0.2610018              -7.1022
        45                         -0.2527699              -6.8782
       ...                                ...                  ...
        78                          1.1447416              31.1500
      -------------------------------------------------------------
                  HL-Gap            0.0746047 Eh            2.0301 eV
             Fermi-level           -0.3887961 Eh          -10.5797 eV

 SCC (total)                   0 d,  0 h,  0 min,  0.029 sec
 SCC setup                      ...        0 min,  0.000 sec (  0.514%)
 Dispersion                     ...        0 min,  0.000 sec (  0.504%)
 integral evaluation            ...        0 min,  0.011 sec ( 37.676%)
 zeroth order Hamiltonian       ...        0 min,  0.000 sec (  0.521%)
 iterations                     ...        0 min,  0.003 sec ( 11.541%)
 molecular gradient             ...        0 min,  0.014 sec ( 48.213%)
 printout                       ...        0 min,  0.000 sec (  0.862%)

         :::::::::::::::::::::::::::::::::::::::::::::::::::::
         ::                     SUMMARY                     ::
         :::::::::::::::::::::::::::::::::::::::::::::::::::::
         :: total energy             -44.253176401025 Eh    ::
         :: gradient norm              0.000191400486 Eh/a0 ::
         :: HOMO-LUMO gap              2.030096784074 eV    ::
         ::.................................................::
         :: SCC energy               -45.016122396166 Eh    ::
         :: -> isotropic ES            0.042372792191 Eh    ::
         :: -> anisotropic ES          0.000983476827 Eh    ::
         :: -> anisotropic XC          0.045169361756 Eh    ::
         :: -> dispersion             -0.027786856145 Eh    ::
         :: repulsion energy           0.762942129725 Eh    ::
         :: add. restraining           0.000000000000 Eh    ::
         :::::::::::::::::::::::::::::::::::::::::::::::::::::

           -------------------------------------------------
          |                Property Printout                |
           -------------------------------------------------

    * Orbital Energies and Occupations

         #    Occupation            Energy/Eh            Energy/eV
      -------------------------------------------------------------
         1        2.0000           -0.8616597             -23.4470
       ...           ...                  ...                  ...
        28        2.0000           -0.5086020             -13.8398
        29        2.0000           -0.5056670             -13.7599
        30        2.0000           -0.4946660             -13.4605
        31        2.0000           -0.4921164             -13.3912
        32        2.0000           -0.4789568             -13.0331
        33        2.0000           -0.4758594             -12.9488
        34        2.0000           -0.4651635             -12.6577
        35        2.0000           -0.4610063             -12.5446
        36        2.0000           -0.4505565             -12.2603
        37        2.0000           -0.4470305             -12.1643
        38        2.0000           -0.4386400             -11.9360
        39        2.0000           -0.4275398             -11.6339
        40        2.0000           -0.4260985             -11.5947 (HOMO)
        41                         -0.3514938              -9.5646 (LUMO)
        42                         -0.3346948              -9.1075
        43                         -0.2782261              -7.5709
        44                         -0.2610018              -7.1022
        45                         -0.2527699              -6.8782
        46                         -0.2370644              -6.4509
        47                         -0.2310201              -6.2864
        48                         -0.2163470              -5.8871
        49                         -0.1892545              -5.1499
        50                         -0.1405254              -3.8239
        51                         -0.1106674              -3.0114
       ...                                ...                  ...
        78                          1.1447416              31.1500
      -------------------------------------------------------------
                  HL-Gap            0.0746047 Eh            2.0301 eV
             Fermi-level           -0.3887961 Eh          -10.5797 eV

     #   Z        covCN         q      C6AA      α(0)
     1   6 C      2.862     0.231    23.169     7.890
     2   8 O      0.856    -0.333    20.396     6.055
     3   6 C      3.038    -0.013    28.308     8.727
     4   6 C      3.028     0.009    27.794     8.648
     5   6 C      2.915    -0.024    28.608     8.771
     6   6 C      2.995    -0.025    28.605     8.773
     7   6 C      2.918     0.091    25.978     8.358
     8   6 C      2.986    -0.019    28.486     8.755
     9  35 Br     1.073    -0.125   188.470    22.135
    10   6 C      3.008     0.034    27.227     8.559
    11   6 C      2.947     0.019    27.573     8.612
    12   6 C      1.936     0.125    28.027     8.550
    13   7 N      0.911    -0.214    25.668     7.327
    14   6 C      1.936     0.125    28.011     8.547
    15   7 N      0.911    -0.212    25.621     7.321
    16   6 C      2.995    -0.013    28.331     8.731
    17   6 C      2.840    -0.052    29.290     8.869
    18   1 H      0.926     0.070     2.090     2.261
    19   1 H      0.926     0.074     2.046     2.237
    20   1 H      0.926     0.082     1.954     2.186
    21   1 H      0.926     0.080     1.982     2.201
    22   1 H      0.926     0.092     1.860     2.133

 Mol. C6AA /au·bohr⁶  :      10736.552622
 Mol. C8AA /au·bohr⁸  :     323028.091995
 Mol. α(0) /au        :        165.646823


Wiberg/Mayer (AO) data.
largest (>0.10) Wiberg bond orders for each atom
          total WBO             WBO to atom ...
     1  C   3.929        O    2 1.821    C    3 1.020    C   16 0.989
     2  O   2.093        C    1 1.821
     3  C   3.979        C    8 1.419    C    4 1.289    C    1 1.020
     4  C   3.989        C    5 1.381    C    3 1.289    C   10 1.101
     5  C   3.979        C    6 1.449    C    4 1.381    H   18 0.958
     6  C   3.981        C    5 1.449    C    7 1.389    H   19 0.966
     7  C   3.930        C    8 1.395    C    6 1.389    Br   9 1.010
     8  C   3.984        C    3 1.419    C    7 1.395    H   20 0.962
     9  Br  1.146        C    7 1.010
    10  C   3.980        C   11 1.536    C    4 1.101    C   16 1.081
    11  C   3.979        C   10 1.536    C   12 1.088    C   14 1.087
    12  C   3.948        N   13 2.780    C   11 1.088
    13  N   2.986        C   12 2.780
    14  C   3.948        N   15 2.782    C   11 1.087
    15  N   2.986        C   14 2.782
    16  C   3.986        C   17 1.802    C   10 1.081    C    1 0.989
    17  C   3.940        C   16 1.802    H   22 0.966    H   21 0.965
    18  H   0.995        C    5 0.958
    19  H   0.994        C    6 0.966
    20  H   0.993        C    8 0.962
    21  H   0.993        C   17 0.965
    22  H   0.991        C   17 0.966

molecular dipole:
                 x           y           z       tot (Debye)
 q only:        0.341      -0.137      -0.001
   full:        0.254      -0.315      -0.002       1.028
molecular quadrupole (traceless):
                xx          xy          yy          xz          yz          zz
 q only:       -1.329      11.249      -9.572       0.030      -0.001      10.900
  q+dip:       -6.945      16.403      -8.361       0.043       0.002      15.307
   full:       -9.779      15.359     -12.002       0.057       0.007      21.782

           -------------------------------------------------
          |                Geometry Summary                 |
           -------------------------------------------------

      molecular mass/u    :      285.0993000
   center of mass at/Å    :        0.0653464       0.3349523      -0.0007357
  moments of inertia/u·Å² :        0.6632934E+03   0.2695114E+04   0.3358404E+04
rotational constants/cm⁻¹ :        0.2541505E-01   0.6254887E-02   0.5019537E-02

 * 17 selected distances

     #   Z        #   Z                                     value/Å
     1   6 C      2   8 O                                 1.2052853
     3   6 C      4   6 C                                 1.4084275
     4   6 C      5   6 C                                 1.3905514
     5   6 C      6   6 C                                 1.3845495
     6   6 C      7   6 C                                 1.3911502
     3   6 C      8   6 C                                 1.3806570
     7   6 C      8   6 C                                 1.3879428
     7   6 C      9  35 Br                                1.8973433 (max)
    10   6 C     11   6 C                                 1.3636825
    12   6 C     13   7 N                                 1.1468283
    14   6 C     15   7 N                                 1.1467252
    16   6 C     17   6 C                                 1.3347293
     5   6 C     18   1 H                                 1.0776007
     6   6 C     19   1 H                                 1.0791940
     8   6 C     20   1 H                                 1.0790040
    17   6 C     21   1 H                                 1.0754340 (min)
    17   6 C     22   1 H                                 1.0787833

 * 5 distinct bonds (by element types)

   Z      Z             #   av. dist./Å        max./Å        min./Å
   1 H    6 C           5     1.0780032     1.0791940     1.0754340
   6 C    6 C           8     1.3802113     1.4084275     1.3347293
   6 C    7 N           2     1.1467768     1.1468283     1.1467252
   6 C    8 O           1     1.2052853     1.2052853     1.2052853
   6 C   35 Br          1     1.8973433     1.8973433     1.8973433


optimized geometry written to: xtbopt.xyz


           -------------------------------------------------
          | TOTAL ENERGY              -44.253176401025 Eh   |
          | GRADIENT NORM               0.000191400486 Eh/α |
          | HOMO-LUMO GAP               2.030096784074 eV   |
           -------------------------------------------------

------------------------------------------------------------------------
 * finished run on 2021/02/19 at 08:12:16.517     
------------------------------------------------------------------------
 total:
 * wall-time:     0 d,  0 h,  0 min,  0.620 sec
 *  cpu-time:     0 d,  0 h,  0 min,  0.618 sec
 * ratio c/w:     0.997 speedup
 SCF:
 * wall-time:     0 d,  0 h,  0 min,  0.045 sec
 *  cpu-time:     0 d,  0 h,  0 min,  0.045 sec
 * ratio c/w:     0.998 speedup
 ANC optimizer:
 * wall-time:     0 d,  0 h,  0 min,  0.554 sec
 *  cpu-time:     0 d,  0 h,  0 min,  0.552 sec
 * ratio c/w:     0.998 speedup

