      -----------------------------------------------------------      
     |                   =====================                   |     
     |                           x T B                           |     
     |                   =====================                   |     
     |                         S. Grimme                         |     
     |          Mulliken Center for Theoretical Chemistry        |     
     |                    University of Bonn                     |     
     |                Version 6.2 RC2 (SAW190805)                |     
      -----------------------------------------------------------      

   This program is distributed in the hope that it will be useful,
   but WITHOUT ANY WARRANTY; without even the implied warranty of
   MERCHANTABILITY or FITNESS FOR A PARTICULAR PURPOSE.
   
   FOR NON-COMMERCIAL, ACADEMIA USE ONLY.
   
   Cite this work as:
   * S. Grimme, C. Bannwarth, P. Shushkov, J. Chem. Theory Comput., 2017,
     13, 1989-2009. DOI: 10.1021/acs.jctc.7b00118
   * C. Bannwarth, S. Ehlert and S. Grimme., J. Chem. Theory Comput., 2019,
     15, 1652-1671. DOI: 10.1021/acs.jctc.8b01176
   * P. Pracht, E. Caldeweyher, S. Ehlert, S. Grimme, ChemRxiv, 2019, preprint.
     DOI: 10.26434/chemrxiv.8326202.v1
   
   for DFT-D4:
   * E. Caldeweyher, C. Bannwarth and S. Grimme, J. Chem. Phys., 2017,
     147, 034112. DOI: 10.1063/1.4993215
   * E. Caldeweyher, S. Ehlert, A. Hansen, H. Neugebauer, S. Spicher,
     C. Bannwarth and S. Grimme, J. Chem. Phys., 2019, 150, 154122.
     DOI: 10.1063/1.5090222
   
   for sTDA-xTB:
   * S. Grimme and C. Bannwarth, J. Chem. Phys., 2016, 145, 054103.
     DOI: 10.1063/1.4959605
   
   in the mass-spec context:
   * V. Asgeirsson, C. Bauer and S. Grimme, Chem. Sci., 2017, 8, 4879.
     DOI: 10.1039/c7sc00601b
   
   for metadynamics refer to:
   * S. Grimme, J. Chem. Theory Comput., 2019, 155, 2847-2862
     DOI: 10.1021/acs.jctc.9b00143
   
   with help from (in alphabetical order)
   C. Bannwarth, F. Bohle, G. Brandenburg, E. Caldeweyher, M. Checinski,
   S. Dohm, S. Ehlert, S. Ehrlich, F. März, H. Neugebauer, J. Pisarek,
   P. Pracht, P. Shushkov, and S. Spicher.
   
 * started run on 2021/02/19 at 08:12:21.404     

           -------------------------------------------------
          |                Calculation Setup                |
           -------------------------------------------------

          program call               : /ihome/ghutchison/geoffh/xtb/xtb 31atl.xyz -opt
          hostname                   : smp-n135
          coordinate file            : 31atl.xyz
          omp threads                :                     1
          number of atoms            :                    22
          number of electrons        :                    86
          charge                     :                     0
          spin                       :                   0.0
          first test random number   :      0.22830935167442


########################################################################
# WARNING! Please study the warnings concerning your input carefully
#  - the use of '-opt' is discouraged, please use '--opt' next time
########################################################################

           ------------------------------------------------- 
          |                 G F N 2 - x T B                 |
          | Geometry, Frequencies, Noncovalent interactions |
          |            JCTC 2019 parametrisation            |
           ------------------------------------------------- 
             KAB for C  - Si     :                1.0500
             KAB for H  - Pd     :                0.9500
             k(s)              :                1.8500
             k(p)              :                2.2300
             k(d)              :                2.2300
             k(f)              :                2.0000
             kEN (H0ij)        :               -2.0000
             D4 a1             :                0.5200
             D4 a2             :                5.0000
             D4 s6             :                1.0000
             D4 s8             :                2.7000
             D4 s9             :                5.0000
             alphaj            :                2.0000

  Z AO/shell   Hii/eV     exponent
  1     Wed Apr 25 08:07:45 CEST 2018   EN: 2.200 GM2: 0.406  GM3: 0.0800  RAES: 1.40
     1s    -10.707211    1.230000
  6     Wed Apr 25 08:07:45 CEST 2018   EN: 2.550 GM2: 0.538  GM3: 0.1500  RAES: 3.00
     2s    -13.970922    2.096432
     2p    -10.063292    1.800000
  7     Wed Apr 25 08:07:45 CEST 2018   EN: 3.040 GM2: 0.461  GM3:-0.0640  RAES: 1.90
     2s    -16.686243    2.339881
     2p    -12.523956    2.014332
  8     Wed Apr 25 08:07:45 CEST 2018   EN: 3.440 GM2: 0.452  GM3:-0.0517  RAES: 1.80
     2s    -20.229985    2.439742
     2p    -15.503117    2.137023
 35     Tue Apr 24 12:21:41 CEST 2018   EN: 2.960 GM2: 0.261  GM3: 0.1300  RAES: 4.00
     4s    -23.583718    2.077587
     4p    -12.588824    2.263120
     4d      0.047980    1.845038

           ------------------------------------------------- 
          |        Self-Consistent Charge Iterations        |
           ------------------------------------------------- 

          ...................................................
          :                      SETUP                      :
          :.................................................:
          :  # basis functions                  88          :
          :  # atomic orbitals                  86          :
          :  # shells                           42          :
          :  # electrons                        86          :
          :  max. iterations                   250          :
          :  Hamiltonian                  GFN2-xTB          :
          :  restarted?                      false          :
          :  GBSA solvation                  false          :
          :  PC potential                    false          :
          :  electronic temp.          300.0000000     K    :
          :  accuracy                    1.0000000          :
          :  -> integral cutoff          0.2500000E+02      :
          :  -> integral neglect         0.1000000E-07      :
          :  -> SCF convergence          0.1000000E-05 Eh   :
          :  -> wf. convergence          0.1000000E-03 e    :
          :  Broyden damping             0.4000000          :
          ...................................................

 iter      E             dE          RMSdq      gap      omega  full diag
   1    -48.1880155 -0.481880E+02  0.742E+00    1.69       0.0  T
   2    -48.1181826  0.698330E-01  0.539E+00    1.46       1.0  T
   3    -48.0352599  0.829227E-01  0.415E+00    1.74       1.0  T
   4    -48.2898774 -0.254618E+00  0.157E+00    1.54       1.0  T
   5    -48.3293206 -0.394432E-01  0.562E-01    1.59       1.0  T
   6    -48.3303687 -0.104808E-02  0.374E-01    1.55       1.0  T
   7    -48.3307090 -0.340325E-03  0.270E-01    1.59       1.0  T
   8    -48.3315800 -0.870997E-03  0.110E-01    1.57       1.0  T
   9    -48.3316497 -0.696717E-04  0.788E-02    1.57       1.0  T
  10    -48.3316672 -0.175406E-04  0.497E-02    1.57       1.0  T
  11    -48.3316772 -0.994094E-05  0.277E-02    1.57       1.0  T
  12    -48.3316810 -0.383916E-05  0.127E-02    1.57       1.7  T
  13    -48.3316822 -0.116764E-05  0.603E-03    1.57       3.5  T
  14    -48.3316823 -0.115339E-06  0.256E-03    1.57       8.3  T
  15    -48.3316824 -0.669309E-07  0.138E-03    1.57      15.5  T
  16    -48.3316824 -0.116209E-07  0.985E-04    1.57      21.6  T
  17    -48.3316824 -0.415742E-08  0.628E-04    1.57      33.9  T

   *** convergence criteria satisfied after 17 iterations ***

         #    Occupation            Energy/Eh            Energy/eV
      -------------------------------------------------------------
         1        2.0000           -0.8739241             -23.7807
       ...           ...                  ...                  ...
        37        2.0000           -0.4587051             -12.4820
        38        2.0000           -0.4532293             -12.3330
        39        2.0000           -0.4495400             -12.2326
        40        2.0000           -0.4480036             -12.1908
        41        2.0000           -0.4446942             -12.1007
        42        2.0000           -0.4343784             -11.8200
        43        2.0000           -0.4174846             -11.3603 (HOMO)
        44                         -0.3597618              -9.7896 (LUMO)
        45                         -0.3494513              -9.5091
        46                         -0.3234327              -8.8011
        47                         -0.2906289              -7.9084
        48                         -0.2878423              -7.8326
       ...                                ...                  ...
        86                          1.0351457              28.1677
      -------------------------------------------------------------
                  HL-Gap            0.0577227 Eh            1.5707 eV
             Fermi-level           -0.3886232 Eh          -10.5750 eV

 SCC (total)                   0 d,  0 h,  0 min,  0.051 sec
 SCC setup                      ...        0 min,  0.000 sec (  0.506%)
 Dispersion                     ...        0 min,  0.000 sec (  0.556%)
 integral evaluation            ...        0 min,  0.014 sec ( 27.036%)
 zeroth order Hamiltonian       ...        0 min,  0.000 sec (  0.422%)
 iterations                     ...        0 min,  0.019 sec ( 37.440%)
 molecular gradient             ...        0 min,  0.017 sec ( 33.380%)
 printout                       ...        0 min,  0.000 sec (  0.585%)

         :::::::::::::::::::::::::::::::::::::::::::::::::::::
         ::                     SUMMARY                     ::
         :::::::::::::::::::::::::::::::::::::::::::::::::::::
         :: total energy             -47.693395751738 Eh    ::
         :: gradient norm              0.273521902771 Eh/a0 ::
         :: HOMO-LUMO gap              1.570715907939 eV    ::
         ::.................................................::
         :: SCC energy               -48.331682379115 Eh    ::
         :: -> isotropic ES            0.044434166035 Eh    ::
         :: -> anisotropic ES          0.004547996066 Eh    ::
         :: -> anisotropic XC          0.047775269629 Eh    ::
         :: -> dispersion             -0.030621699571 Eh    ::
         :: repulsion energy           0.638133149055 Eh    ::
         :: add. restraining           0.000000000000 Eh    ::
         :::::::::::::::::::::::::::::::::::::::::::::::::::::

      ----------------------------------------------------------- 
     |                   =====================                   |
     |                        A N C O P T                        |
     |                   =====================                   |
     |               Approximate Normal Coordinate               |
     |                Rational Function Optimizer                |
      ----------------------------------------------------------- 

          ...................................................
          :                      SETUP                      :
          :.................................................:
          :   optimization level            normal          :
          :   max. optcycles                   200          :
          :   ANC micro-cycles                  20          :
          :   degrees of freedom                60          :
          :.................................................:
          :   RF solver                   davidson          :
          :   input Hessian                  false          :
          :   write xtbopt.log                true          :
          :   linear?                        false          :
          :   energy convergence         0.5000000E-05 Eh   :
          :   grad. convergence          0.1000000E-02 Eh/α :
          :   maximium RF displ.         2.0000000          :
          :   Hlow (freq-cutoff)         0.5000000E-02      :
          :   Hmax (freq-cutoff)         5.0000000          :
          :   S6 in model hess.         20.0000000          :
          ...................................................

generating ANC from model Hessian ...
Using Lindh-Hessian (1995)
 Shifting diagonal of input Hessian by   4.007323402953098E-003
 Lowest  eigenvalues of input Hessian
   -0.000000   -0.000000   -0.000000   -0.000000   -0.000000    0.000000
    0.005000    0.005272    0.006229    0.006646    0.008172    0.010384
    0.010785    0.011533    0.014586    0.017820    0.019966    0.021330
 Highest eigenvalues
    1.801256    1.901700    1.941353    2.064291    2.225196    2.499776
 

........................................................................
.............................. CYCLE    1 ..............................
........................................................................
   1    -48.3316824 -0.483317E+02  0.401E-04    1.57       0.0  T
   2    -48.3316824 -0.237890E-09  0.329E-04    1.57      64.8  T
   3    -48.3316824 -0.820961E-10  0.303E-04    1.57      70.3  T
     SCC iter.                  ...        0 min,  0.004 sec
     gradient                   ...        0 min,  0.017 sec
 * total energy  :   -47.6933958 Eh     change       -0.1137787E-07 Eh
   gradient norm :     0.2735214 Eh/α   predicted     0.0000000E+00 (-100.00%)
   displ. norm   :     0.5358303 α      lambda       -0.8413430E-01
   maximum displ.:     0.2351768 α      in ANC's #9, #20, #37, ...

........................................................................
.............................. CYCLE    2 ..............................
........................................................................
   1    -48.4627180 -0.484627E+02  0.654E-01    1.95       0.0  T
   2    -48.4623459  0.372116E-03  0.421E-01    1.91       1.0  T
   3    -48.4612543  0.109160E-02  0.411E-01    1.93       1.0  T
   4    -48.4635184 -0.226412E-02  0.914E-02    1.92       1.0  T
   5    -48.4636893 -0.170867E-03  0.401E-02    1.92       1.0  T
   6    -48.4637078 -0.185326E-04  0.186E-02    1.92       1.1  T
   7    -48.4637097 -0.184650E-05  0.115E-02    1.92       1.8  T
   8    -48.4637103 -0.623789E-06  0.842E-03    1.92       2.5  T
   9    -48.4637105 -0.262409E-06  0.507E-03    1.92       4.2  T
  10    -48.4637106 -0.939806E-07  0.319E-03    1.92       6.7  T
     SCC iter.                  ...        0 min,  0.010 sec
     gradient                   ...        0 min,  0.015 sec
 * total energy  :   -47.7498049 Eh     change       -0.5640913E-01 Eh
   gradient norm :     0.0674063 Eh/α   predicted    -0.5414524E-01 (  -4.01%)
   displ. norm   :     0.6577759 α      lambda       -0.2674837E-01
   maximum displ.:     0.3708743 α      in ANC's #9, #10, #13, ...

........................................................................
.............................. CYCLE    3 ..............................
........................................................................
   1    -48.5006748 -0.485007E+02  0.491E-01    2.11       0.0  T
   2    -48.5006636  0.111867E-04  0.293E-01    2.10       1.0  T
   3    -48.4996202  0.104346E-02  0.262E-01    2.12       1.0  T
   4    -48.5009629 -0.134271E-02  0.463E-02    2.10       1.0  T
   5    -48.5009763 -0.133926E-04  0.301E-02    2.10       1.0  T
   6    -48.5009837 -0.747371E-05  0.152E-02    2.10       1.4  T
   7    -48.5009860 -0.226195E-05  0.870E-03    2.10       2.5  T
   8    -48.5009861 -0.127683E-06  0.679E-03    2.10       3.1  T
   9    -48.5009863 -0.202466E-06  0.379E-03    2.10       5.6  T
  10    -48.5009864 -0.669644E-07  0.124E-03    2.10      17.2  T
     SCC iter.                  ...        0 min,  0.013 sec
     gradient                   ...        0 min,  0.018 sec
 * total energy  :   -47.7675751 Eh     change       -0.1777017E-01 Eh
   gradient norm :     0.0780963 Eh/α   predicted    -0.1916078E-01 (   7.83%)
   displ. norm   :     0.4730824 α      lambda       -0.1639677E-01
   maximum displ.:     0.1743997 α      in ANC's #18, #13, #9, ...

........................................................................
.............................. CYCLE    4 ..............................
........................................................................
   1    -48.5334844 -0.485335E+02  0.476E-01    2.16       0.0  T
   2    -48.5335094 -0.250111E-04  0.288E-01    2.15       1.0  T
   3    -48.5330371  0.472278E-03  0.248E-01    2.17       1.0  T
   4    -48.5339531 -0.915963E-03  0.454E-02    2.16       1.0  T
   5    -48.5339763 -0.232089E-04  0.277E-02    2.16       1.0  T
   6    -48.5339820 -0.568730E-05  0.150E-02    2.16       1.4  T
   7    -48.5339838 -0.175518E-05  0.780E-03    2.16       2.7  T
   8    -48.5339839 -0.971237E-07  0.532E-03    2.16       4.0  T
   9    -48.5339839 -0.227944E-07  0.338E-03    2.16       6.3  T
     SCC iter.                  ...        0 min,  0.013 sec
     gradient                   ...        0 min,  0.017 sec
 * total energy  :   -47.7788286 Eh     change       -0.1125354E-01 Eh
   gradient norm :     0.0550385 Eh/α   predicted    -0.1003325E-01 ( -10.84%)
   displ. norm   :     0.6036469 α      lambda       -0.1381183E-01
   maximum displ.:     0.3314981 α      in ANC's #4, #10, #9, ...

........................................................................
.............................. CYCLE    5 ..............................
........................................................................
   1    -48.5450619 -0.485451E+02  0.618E-01    2.16       0.0  T
   2    -48.5451374 -0.755293E-04  0.344E-01    2.16       1.0  T
   3    -48.5451100  0.274293E-04  0.632E-02    2.16       1.0  T
   4    -48.5451707 -0.607252E-04  0.243E-02    2.16       1.0  T
   5    -48.5451712 -0.515179E-06  0.123E-02    2.16       1.7  T
   6    -48.5451732 -0.192782E-05  0.554E-03    2.16       3.8  T
   7    -48.5451733 -0.177545E-06  0.378E-03    2.16       5.6  T
     SCC iter.                  ...        0 min,  0.009 sec
     gradient                   ...        0 min,  0.016 sec
 * total energy  :   -47.7893137 Eh     change       -0.1048511E-01 Eh
   gradient norm :     0.0453469 Eh/α   predicted    -0.9422361E-02 ( -10.14%)
   displ. norm   :     0.6537627 α      lambda       -0.1290809E-01
   maximum displ.:     0.3218895 α      in ANC's #9, #7, #4, ...

........................................................................
.............................. CYCLE    6 ..............................
........................................................................
   1    -48.5401624 -0.485402E+02  0.436E-01    2.21       0.0  T
   2    -48.5402051 -0.426743E-04  0.259E-01    2.22       1.0  T
   3    -48.5395551  0.649957E-03  0.201E-01    2.20       1.0  T
   4    -48.5403491 -0.794006E-03  0.320E-02    2.21       1.0  T
   5    -48.5403577 -0.854049E-05  0.158E-02    2.21       1.4  T
   6    -48.5403585 -0.828244E-06  0.915E-03    2.21       2.3  T
   7    -48.5403594 -0.881390E-06  0.438E-03    2.21       4.9  T
   8    -48.5403594 -0.506233E-07  0.315E-03    2.21       6.8  T
     SCC iter.                  ...        0 min,  0.010 sec
     gradient                   ...        0 min,  0.016 sec
 * total energy  :   -47.7977103 Eh     change       -0.8396636E-02 Eh
   gradient norm :     0.0448942 Eh/α   predicted    -0.9212545E-02 (   9.72%)
   displ. norm   :     0.5369258 α      lambda       -0.1063726E-01
   maximum displ.:     0.2912724 α      in ANC's #4, #42, #7, ...

........................................................................
.............................. CYCLE    7 ..............................
........................................................................
   1    -48.5596685 -0.485597E+02  0.535E-01    2.24       0.0  T
   2    -48.5597804 -0.111906E-03  0.296E-01    2.23       1.0  T
   3    -48.5596821  0.983438E-04  0.961E-02    2.24       1.0  T
   4    -48.5598193 -0.137262E-03  0.261E-02    2.23       1.0  T
   5    -48.5598215 -0.220374E-05  0.152E-02    2.24       1.4  T
   6    -48.5598226 -0.111857E-05  0.845E-03    2.23       2.5  T
   7    -48.5598235 -0.828706E-06  0.371E-03    2.24       5.7  T
   8    -48.5598235 -0.701997E-07  0.242E-03    2.23       8.8  T
     SCC iter.                  ...        0 min,  0.010 sec
     gradient                   ...        0 min,  0.016 sec
 * total energy  :   -47.8009271 Eh     change       -0.3216710E-02 Eh
   gradient norm :     0.0625500 Eh/α   predicted    -0.6851939E-02 ( 113.01%)
   displ. norm   :     0.5476884 α      lambda       -0.1250211E-01
   maximum displ.:     0.2674496 α      in ANC's #9, #4, #3, ...

........................................................................
.............................. CYCLE    8 ..............................
........................................................................
   1    -48.5554707 -0.485555E+02  0.369E-01    2.24       0.0  T
   2    -48.5555394 -0.687421E-04  0.206E-01    2.22       1.0  T
   3    -48.5552993  0.240148E-03  0.160E-01    2.23       1.0  T
   4    -48.5556378 -0.338521E-03  0.244E-02    2.23       1.0  T
   5    -48.5556417 -0.390908E-05  0.145E-02    2.23       1.5  T
   6    -48.5556440 -0.232565E-05  0.706E-03    2.23       3.0  T
   7    -48.5556444 -0.424305E-06  0.290E-03    2.23       7.3  T
   8    -48.5556445 -0.266963E-07  0.230E-03    2.23       9.3  T
     SCC iter.                  ...        0 min,  0.010 sec
     gradient                   ...        0 min,  0.016 sec
 * total energy  :   -47.8060317 Eh     change       -0.5104636E-02 Eh
   gradient norm :     0.0451184 Eh/α   predicted    -0.8126138E-02 (  59.19%)
   displ. norm   :     0.3048551 α      lambda       -0.4411911E-02
   maximum displ.:     0.1350977 α      in ANC's #3, #9, #16, ...

........................................................................
.............................. CYCLE    9 ..............................
........................................................................
   1    -48.5618686 -0.485619E+02  0.316E-01    2.23       0.0  T
   2    -48.5618912 -0.226108E-04  0.177E-01    2.24       1.0  T
   3    -48.5616153  0.275929E-03  0.116E-01    2.23       1.0  T
   4    -48.5619383 -0.322997E-03  0.181E-02    2.23       1.2  T
   5    -48.5619385 -0.203493E-06  0.115E-02    2.23       1.9  T
   6    -48.5619398 -0.131264E-05  0.482E-03    2.23       4.4  T
   7    -48.5619400 -0.160421E-06  0.318E-03    2.23       6.7  T
     SCC iter.                  ...        0 min,  0.009 sec
     gradient                   ...        0 min,  0.016 sec
 * total energy  :   -47.8085700 Eh     change       -0.2538311E-02 Eh
   gradient norm :     0.0355708 Eh/α   predicted    -0.2410970E-02 (  -5.02%)
   displ. norm   :     0.5004152 α      lambda       -0.4907054E-02
   maximum displ.:     0.2747919 α      in ANC's #4, #3, #10, ...

........................................................................
.............................. CYCLE   10 ..............................
........................................................................
   1    -48.5582751 -0.485583E+02  0.371E-01    2.21       0.0  T
   2    -48.5583200 -0.448906E-04  0.206E-01    2.22       1.0  T
   3    -48.5581685  0.151514E-03  0.948E-02    2.22       1.0  T
   4    -48.5583425 -0.174062E-03  0.226E-02    2.22       1.0  T
   5    -48.5583464 -0.385238E-05  0.123E-02    2.22       1.7  T
   6    -48.5583470 -0.604578E-06  0.737E-03    2.22       2.9  T
   7    -48.5583476 -0.594445E-06  0.422E-03    2.22       5.1  T
   8    -48.5583476 -0.246912E-07  0.298E-03    2.22       7.1  T
     SCC iter.                  ...        0 min,  0.010 sec
     gradient                   ...        0 min,  0.015 sec
 * total energy  :   -47.8111697 Eh     change       -0.2599741E-02 Eh
   gradient norm :     0.0488329 Eh/α   predicted    -0.3067929E-02 (  18.01%)
   displ. norm   :     0.5153728 α      lambda       -0.5416404E-02
   maximum displ.:     0.2052616 α      in ANC's #3, #6, #16, ...

........................................................................
.............................. CYCLE   11 ..............................
........................................................................
   1    -48.5815604 -0.485816E+02  0.485E-01    2.23       0.0  T
   2    -48.5816204 -0.599856E-04  0.275E-01    2.23       1.0  T
   3    -48.5812193  0.401136E-03  0.148E-01    2.22       1.0  T
   4    -48.5816824 -0.463168E-03  0.228E-02    2.23       1.0  T
   5    -48.5816842 -0.180537E-05  0.141E-02    2.23       1.5  T
   6    -48.5816858 -0.154495E-05  0.689E-03    2.23       3.1  T
   7    -48.5816860 -0.228166E-06  0.472E-03    2.23       4.5  T
   8    -48.5816861 -0.831946E-07  0.268E-03    2.23       8.0  T
     SCC iter.                  ...        0 min,  0.010 sec
     gradient                   ...        0 min,  0.015 sec
 * total energy  :   -47.8110762 Eh     change        0.9355049E-04 Eh
   gradient norm :     0.0897367 Eh/α   predicted    -0.3427536E-02 (*******%)
   displ. norm   :     0.3886630 α      lambda       -0.6877219E-02
   maximum displ.:     0.1930160 α      in ANC's #4, #3, #9, ...

........................................................................
.............................. CYCLE   12 ..............................
........................................................................
   1    -48.5689348 -0.485689E+02  0.471E-01    2.18       0.0  T
   2    -48.5690123 -0.775303E-04  0.270E-01    2.17       1.0  T
   3    -48.5684998  0.512541E-03  0.187E-01    2.19       1.0  T
   4    -48.5691466 -0.646761E-03  0.243E-02    2.18       1.0  T
   5    -48.5691521 -0.555450E-05  0.127E-02    2.18       1.7  T
   6    -48.5691540 -0.189181E-05  0.590E-03    2.18       3.6  T
   7    -48.5691543 -0.246528E-06  0.240E-03    2.18       8.9  T
     SCC iter.                  ...        0 min,  0.009 sec
     gradient                   ...        0 min,  0.015 sec
 * total energy  :   -47.8145108 Eh     change       -0.3434615E-02 Eh
   gradient norm :     0.0312381 Eh/α   predicted    -0.3958044E-02 (  15.24%)
   displ. norm   :     0.3733005 α      lambda       -0.3739890E-02
   maximum displ.:     0.2307335 α      in ANC's #3, #4, #2, ...

........................................................................
.............................. CYCLE   13 ..............................
........................................................................
   1    -48.5570482 -0.485570E+02  0.334E-01    2.14       0.0  T
   2    -48.5570773 -0.290052E-04  0.191E-01    2.14       1.0  T
   3    -48.5568241  0.253123E-03  0.115E-01    2.14       1.0  T
   4    -48.5571109 -0.286737E-03  0.207E-02    2.15       1.0  T
   5    -48.5571133 -0.239105E-05  0.116E-02    2.14       1.8  T
   6    -48.5571145 -0.119988E-05  0.585E-03    2.15       3.6  T
   7    -48.5571148 -0.338829E-06  0.305E-03    2.15       7.0  T
     SCC iter.                  ...        0 min,  0.008 sec
     gradient                   ...        0 min,  0.015 sec
 * total energy  :   -47.8152373 Eh     change       -0.7265074E-03 Eh
   gradient norm :     0.0600144 Eh/α   predicted    -0.2130529E-02 ( 193.26%)
   displ. norm   :     0.2585240 α      lambda       -0.3083489E-02
   maximum displ.:     0.1093026 α      in ANC's #3, #10, #2, ...

........................................................................
.............................. CYCLE   14 ..............................
........................................................................
   1    -48.5687782 -0.485688E+02  0.239E-01    2.14       0.0  T
   2    -48.5687897 -0.114922E-04  0.130E-01    2.14       1.0  T
   3    -48.5687733  0.163130E-04  0.355E-02    2.14       1.0  T
   4    -48.5687932 -0.198308E-04  0.190E-02    2.14       1.1  T
   5    -48.5687956 -0.239191E-05  0.932E-03    2.14       2.3  T
   6    -48.5687964 -0.843333E-06  0.393E-03    2.14       5.4  T
   7    -48.5687964 -0.328438E-07  0.296E-03    2.14       7.2  T
     SCC iter.                  ...        0 min,  0.007 sec
     gradient                   ...        0 min,  0.014 sec
 * total energy  :   -47.8173532 Eh     change       -0.2115903E-02 Eh
   gradient norm :     0.0277410 Eh/α   predicted    -0.1644790E-02 ( -22.27%)
   displ. norm   :     0.6295459 α      lambda       -0.2985274E-02
   maximum displ.:     0.3352492 α      in ANC's #3, #4, #2, ...

........................................................................
.............................. CYCLE   15 ..............................
........................................................................
   1    -48.5667631 -0.485668E+02  0.423E-01    2.13       0.0  T
   2    -48.5667957 -0.325889E-04  0.239E-01    2.13       1.0  T
   3    -48.5663964  0.399346E-03  0.157E-01    2.12       1.0  T
   4    -48.5668642 -0.467866E-03  0.268E-02    2.13       1.0  T
   5    -48.5668650 -0.798185E-06  0.182E-02    2.12       1.2  T
   6    -48.5668689 -0.387361E-05  0.741E-03    2.13       2.9  T
   7    -48.5668693 -0.366262E-06  0.424E-03    2.13       5.0  T
   8    -48.5668692  0.262880E-07  0.293E-03    2.13       7.3  T
     SCC iter.                  ...        0 min,  0.008 sec
     gradient                   ...        0 min,  0.014 sec
 * total energy  :   -47.8183091 Eh     change       -0.9558327E-03 Eh
   gradient norm :     0.0411583 Eh/α   predicted    -0.2084217E-02 ( 118.05%)
   displ. norm   :     0.3457206 α      lambda       -0.2943046E-02
   maximum displ.:     0.1824092 α      in ANC's #3, #2, #13, ...

........................................................................
.............................. CYCLE   16 ..............................
........................................................................
   1    -48.5696814 -0.485697E+02  0.281E-01    2.09       0.0  T
   2    -48.5697086 -0.272365E-04  0.162E-01    2.09       1.0  T
   3    -48.5696272  0.814072E-04  0.652E-02    2.10       1.0  T
   4    -48.5697208 -0.936093E-04  0.204E-02    2.10       1.0  T
   5    -48.5697239 -0.307275E-05  0.103E-02    2.10       2.1  T
   6    -48.5697242 -0.303125E-06  0.593E-03    2.10       3.6  T
   7    -48.5697244 -0.250620E-06  0.392E-03    2.10       5.4  T
     SCC iter.                  ...        0 min,  0.007 sec
     gradient                   ...        0 min,  0.014 sec
 * total energy  :   -47.8202767 Eh     change       -0.1967679E-02 Eh
   gradient norm :     0.0217617 Eh/α   predicted    -0.1647407E-02 ( -16.28%)
   displ. norm   :     0.4979149 α      lambda       -0.1870998E-02
   maximum displ.:     0.3456732 α      in ANC's #3, #2, #13, ...

........................................................................
.............................. CYCLE   17 ..............................
........................................................................
   1    -48.5734864 -0.485735E+02  0.410E-01    2.07       0.0  T
   2    -48.5735067 -0.203139E-04  0.221E-01    2.07       1.0  T
   3    -48.5733543  0.152345E-03  0.950E-02    2.07       1.0  T
   4    -48.5735310 -0.176687E-03  0.258E-02    2.07       1.0  T
   5    -48.5735311 -0.642390E-07  0.141E-02    2.07       1.5  T
   6    -48.5735335 -0.244334E-05  0.670E-03    2.07       3.2  T
   7    -48.5735337 -0.176864E-06  0.489E-03    2.07       4.4  T
   8    -48.5735337 -0.205994E-07  0.230E-03    2.07       9.3  T
     SCC iter.                  ...        0 min,  0.008 sec
     gradient                   ...        0 min,  0.015 sec
 * total energy  :   -47.8216015 Eh     change       -0.1324793E-02 Eh
   gradient norm :     0.0218272 Eh/α   predicted    -0.1167429E-02 ( -11.88%)
   displ. norm   :     0.5894226 α      lambda       -0.1784149E-02
   maximum displ.:     0.3491448 α      in ANC's #3, #2, #16, ...

........................................................................
.............................. CYCLE   18 ..............................
........................................................................
   1    -48.5620297 -0.485620E+02  0.502E-01    2.05       0.0  T
   2    -48.5620602 -0.305181E-04  0.274E-01    2.05       1.0  T
   3    -48.5616806  0.379611E-03  0.150E-01    2.04       1.0  T
   4    -48.5621188 -0.438202E-03  0.292E-02    2.05       1.0  T
   5    -48.5621170  0.181489E-05  0.213E-02    2.04       1.0  T
   6    -48.5621230 -0.606270E-05  0.867E-03    2.05       2.5  T
   7    -48.5621233 -0.288000E-06  0.639E-03    2.05       3.3  T
   8    -48.5621233 -0.392160E-08  0.335E-03    2.05       6.4  T
   9    -48.5621234 -0.123005E-06  0.165E-03    2.05      12.9  T
     SCC iter.                  ...        0 min,  0.009 sec
     gradient                   ...        0 min,  0.014 sec
 * total energy  :   -47.8224870 Eh     change       -0.8854282E-03 Eh
   gradient norm :     0.0367099 Eh/α   predicted    -0.1202006E-02 (  35.75%)
   displ. norm   :     0.4318192 α      lambda       -0.1790879E-02
   maximum displ.:     0.2674100 α      in ANC's #3, #2, #14, ...

........................................................................
.............................. CYCLE   19 ..............................
........................................................................
   1    -48.5763743 -0.485764E+02  0.335E-01    2.04       0.0  T
   2    -48.5763941 -0.197919E-04  0.185E-01    2.04       1.0  T
   3    -48.5763072  0.868930E-04  0.742E-02    2.04       1.0  T
   4    -48.5764086 -0.101447E-03  0.193E-02    2.04       1.1  T
   5    -48.5764092 -0.565295E-06  0.114E-02    2.04       1.9  T
   6    -48.5764103 -0.113416E-05  0.589E-03    2.04       3.6  T
   7    -48.5764105 -0.205408E-06  0.438E-03    2.04       4.9  T
     SCC iter.                  ...        0 min,  0.007 sec
     gradient                   ...        0 min,  0.014 sec
 * total energy  :   -47.8234673 Eh     change       -0.9803345E-03 Eh
   gradient norm :     0.0339033 Eh/α   predicted    -0.1062414E-02 (   8.37%)
   displ. norm   :     0.4002818 α      lambda       -0.1179754E-02
   maximum displ.:     0.2474833 α      in ANC's #3, #2, #13, ...

........................................................................
.............................. CYCLE   20 ..............................
........................................................................
   1    -48.5761668 -0.485762E+02  0.368E-01    2.03       0.0  T
   2    -48.5762038 -0.370397E-04  0.197E-01    2.02       1.0  T
   3    -48.5761515  0.523113E-04  0.641E-02    2.03       1.0  T
   4    -48.5762159 -0.643828E-04  0.275E-02    2.02       1.0  T
   5    -48.5762189 -0.305740E-05  0.156E-02    2.02       1.4  T
   6    -48.5762208 -0.185313E-05  0.790E-03    2.02       2.7  T
   7    -48.5762211 -0.270024E-06  0.580E-03    2.02       3.7  T
   8    -48.5762212 -0.978199E-07  0.371E-03    2.02       5.7  T
     SCC iter.                  ...        0 min,  0.008 sec
     gradient                   ...        0 min,  0.014 sec
 * total energy  :   -47.8240772 Eh     change       -0.6099022E-03 Eh
   gradient norm :     0.0287709 Eh/α   predicted    -0.6843961E-03 (  12.21%)
   displ. norm   :     0.3238894 α      lambda       -0.1330219E-02
   maximum displ.:     0.1649581 α      in ANC's #2, #3, #4, ...
 * RMSD in coord.:     1.3578983 α      energy gain  -0.1306814E+00 Eh

generating ANC from model Hessian ...
Using Lindh-Hessian (1995)
 Shifting diagonal of input Hessian by   4.653417032951996E-003
 Lowest  eigenvalues of input Hessian
   -0.000000   -0.000000    0.000000    0.000000    0.000000    0.000000
    0.005000    0.005840    0.006775    0.007813    0.009693    0.010642
    0.012238    0.012744    0.016055    0.016871    0.018482    0.020929
 Highest eigenvalues
    1.945983    2.024368    2.054802    2.322142    2.605344    2.652187
 

........................................................................
.............................. CYCLE   21 ..............................
........................................................................
   1    -48.5852837 -0.485853E+02  0.311E-01    2.03       0.0  T
   2    -48.5853124 -0.286600E-04  0.166E-01    2.03       1.0  T
   3    -48.5852662  0.462203E-04  0.589E-02    2.02       1.0  T
   4    -48.5853218 -0.556659E-04  0.214E-02    2.03       1.0  T
   5    -48.5853233 -0.141614E-05  0.126E-02    2.03       1.7  T
   6    -48.5853243 -0.101920E-05  0.788E-03    2.03       2.7  T
   7    -48.5853246 -0.330469E-06  0.572E-03    2.03       3.7  T
   8    -48.5853247 -0.105016E-06  0.384E-03    2.03       5.6  T
   9    -48.5853248 -0.424121E-07  0.176E-03    2.03      12.1  T
  10    -48.5853248 -0.278651E-07  0.111E-03    2.03      19.1  T
  11    -48.5853248 -0.566204E-08  0.800E-04    2.03      26.7  T
  12    -48.5853248 -0.263778E-08  0.434E-04    2.03      49.1  T
     SCC iter.                  ...        0 min,  0.012 sec
     gradient                   ...        0 min,  0.016 sec
 * total energy  :   -47.8244587 Eh     change       -0.3814726E-03 Eh
   gradient norm :     0.0235944 Eh/α   predicted     0.0000000E+00 (-100.00%)
   displ. norm   :     0.2051184 α      lambda       -0.1074477E-02
   maximum displ.:     0.1103888 α      in ANC's #3, #7, #6, ...

........................................................................
.............................. CYCLE   22 ..............................
........................................................................
   1    -48.5744021 -0.485744E+02  0.305E-01    2.01       0.0  T
   2    -48.5744301 -0.279870E-04  0.165E-01    2.02       1.0  T
   3    -48.5743785  0.515498E-04  0.579E-02    2.02       1.0  T
   4    -48.5744437 -0.651227E-04  0.139E-02    2.02       1.5  T
   5    -48.5744447 -0.100435E-05  0.828E-03    2.02       2.6  T
   6    -48.5744454 -0.765964E-06  0.455E-03    2.02       4.7  T
   7    -48.5744456 -0.125948E-06  0.294E-03    2.02       7.3  T
     SCC iter.                  ...        0 min,  0.007 sec
     gradient                   ...        0 min,  0.015 sec
 * total energy  :   -47.8247471 Eh     change       -0.2884461E-03 Eh
   gradient norm :     0.0145023 Eh/α   predicted    -0.5598501E-03 (  94.09%)
   displ. norm   :     0.2433652 α      lambda       -0.1407497E-02
   maximum displ.:     0.1119607 α      in ANC's #3, #7, #8, ...

........................................................................
.............................. CYCLE   23 ..............................
........................................................................
   1    -48.5675763 -0.485676E+02  0.355E-01    2.00       0.0  T
   2    -48.5676112 -0.349129E-04  0.198E-01    2.00       1.0  T
   3    -48.5674190  0.192228E-03  0.108E-01    2.01       1.0  T
   4    -48.5676485 -0.229469E-03  0.129E-02    2.00       1.7  T
   5    -48.5676485 -0.682168E-07  0.913E-03    2.00       2.3  T
   6    -48.5676494 -0.925807E-06  0.484E-03    2.00       4.4  T
   7    -48.5676495 -0.843390E-07  0.327E-03    2.00       6.5  T
   8    -48.5676496 -0.398640E-07  0.231E-03    2.00       9.2  T
   9    -48.5676496  0.316133E-08  0.164E-03    2.00      13.0  T
     SCC iter.                  ...        0 min,  0.009 sec
     gradient                   ...        0 min,  0.015 sec
 * total energy  :   -47.8245206 Eh     change        0.2265431E-03 Eh
   gradient norm :     0.0238158 Eh/α   predicted    -0.7454316E-03 (-429.05%)
   displ. norm   :     0.1468607 α      lambda       -0.1326555E-02
   maximum displ.:     0.0558845 α      in ANC's #8, #1, #7, ...

........................................................................
.............................. CYCLE   24 ..............................
........................................................................
   1    -48.5769621 -0.485770E+02  0.297E-01    2.01       0.0  T
   2    -48.5769825 -0.203284E-04  0.152E-01    2.01       1.0  T
   3    -48.5769401  0.423809E-04  0.544E-02    2.01       1.0  T
   4    -48.5769947 -0.545846E-04  0.158E-02    2.01       1.3  T
   5    -48.5769946  0.850122E-07  0.923E-03    2.01       2.3  T
   6    -48.5769955 -0.877437E-06  0.503E-03    2.01       4.2  T
   7    -48.5769956 -0.101285E-06  0.358E-03    2.01       6.0  T
     SCC iter.                  ...        0 min,  0.007 sec
     gradient                   ...        0 min,  0.014 sec
 * total energy  :   -47.8251732 Eh     change       -0.6526018E-03 Eh
   gradient norm :     0.0072951 Eh/α   predicted    -0.6775847E-03 (   3.83%)
   displ. norm   :     0.1353264 α      lambda       -0.3199470E-03
   maximum displ.:     0.0854414 α      in ANC's #3, #4, #6, ...

........................................................................
.............................. CYCLE   25 ..............................
........................................................................
   1    -48.5764243 -0.485764E+02  0.223E-01    2.01       0.0  T
   2    -48.5764363 -0.119620E-04  0.120E-01    2.01       1.0  T
   3    -48.5764247  0.115493E-04  0.297E-02    2.00       1.0  T
   4    -48.5764421 -0.173647E-04  0.935E-03    2.01       2.3  T
   5    -48.5764424 -0.297393E-06  0.367E-03    2.01       5.8  T
   6    -48.5764426 -0.186037E-06  0.172E-03    2.01      12.4  T
   7    -48.5764426 -0.157178E-07  0.117E-03    2.01      18.3  T
     SCC iter.                  ...        0 min,  0.007 sec
     gradient                   ...        0 min,  0.014 sec
 * total energy  :   -47.8250111 Eh     change        0.1620633E-03 Eh
   gradient norm :     0.0113094 Eh/α   predicted    -0.1629069E-03 (-200.52%)
   displ. norm   :     0.1256156 α      lambda       -0.6624509E-03
   maximum displ.:     0.0641676 α      in ANC's #1, #2, #4, ...

........................................................................
.............................. CYCLE   26 ..............................
........................................................................
   1    -48.5773371 -0.485773E+02  0.184E-01    2.01       0.0  T
   2    -48.5773460 -0.892468E-05  0.100E-01    2.01       1.0  T
   3    -48.5773438  0.218030E-05  0.200E-02    2.01       1.1  T
   4    -48.5773501 -0.628713E-05  0.623E-03    2.01       3.4  T
   5    -48.5773501 -0.447109E-07  0.277E-03    2.01       7.7  T
   6    -48.5773502 -0.738621E-07  0.171E-03    2.01      12.4  T
     SCC iter.                  ...        0 min,  0.006 sec
     gradient                   ...        0 min,  0.014 sec
 * total energy  :   -47.8253215 Eh     change       -0.3103594E-03 Eh
   gradient norm :     0.0048255 Eh/α   predicted    -0.3364544E-03 (   8.41%)
   displ. norm   :     0.1440255 α      lambda       -0.2758531E-03
   maximum displ.:     0.0968732 α      in ANC's #3, #10, #2, ...

........................................................................
.............................. CYCLE   27 ..............................
........................................................................
   1    -48.5749952 -0.485750E+02  0.217E-01    2.00       0.0  T
   2    -48.5750029 -0.770196E-05  0.103E-01    2.00       1.0  T
   3    -48.5749934  0.949060E-05  0.272E-02    2.00       1.0  T
   4    -48.5750064 -0.130126E-04  0.983E-03    2.00       2.2  T
   5    -48.5750063  0.704665E-07  0.520E-03    2.00       4.1  T
   6    -48.5750066 -0.318653E-06  0.269E-03    2.00       7.9  T
   7    -48.5750067 -0.317015E-07  0.192E-03    2.00      11.1  T
     SCC iter.                  ...        0 min,  0.007 sec
     gradient                   ...        0 min,  0.015 sec
 * total energy  :   -47.8254069 Eh     change       -0.8547161E-04 Eh
   gradient norm :     0.0054129 Eh/α   predicted    -0.1407920E-03 (  64.72%)
   displ. norm   :     0.1444828 α      lambda       -0.1768374E-03
   maximum displ.:     0.1159719 α      in ANC's #3, #2, #1, ...

........................................................................
.............................. CYCLE   28 ..............................
........................................................................
   1    -48.5757867 -0.485758E+02  0.150E-01    2.00       0.0  T
   2    -48.5757899 -0.318260E-05  0.758E-02    2.00       1.0  T
   3    -48.5757891  0.849677E-06  0.153E-02    2.00       1.4  T
   4    -48.5757908 -0.171905E-05  0.903E-03    2.00       2.4  T
   5    -48.5757911 -0.351063E-06  0.341E-03    2.00       6.3  T
   6    -48.5757912 -0.109428E-06  0.230E-03    2.00       9.3  T
   7    -48.5757913 -0.169633E-07  0.147E-03    2.00      14.5  T
     SCC iter.                  ...        0 min,  0.007 sec
     gradient                   ...        0 min,  0.014 sec
 * total energy  :   -47.8255534 Eh     change       -0.1464710E-03 Eh
   gradient norm :     0.0034841 Eh/α   predicted    -0.9026477E-04 ( -38.37%)
   displ. norm   :     0.2801629 α      lambda       -0.2292283E-03
   maximum displ.:     0.2082967 α      in ANC's #3, #2, #1, ...

........................................................................
.............................. CYCLE   29 ..............................
........................................................................
   1    -48.5763668 -0.485764E+02  0.200E-01    1.99       0.0  T
   2    -48.5763717 -0.487974E-05  0.111E-01    1.99       1.0  T
   3    -48.5763667  0.499926E-05  0.242E-02    1.99       1.0  T
   4    -48.5763732 -0.651648E-05  0.127E-02    1.99       1.7  T
   5    -48.5763743 -0.107263E-05  0.432E-03    1.99       4.9  T
   6    -48.5763744 -0.134495E-06  0.311E-03    1.99       6.9  T
   7    -48.5763744 -0.401609E-07  0.213E-03    1.99      10.0  T
   8    -48.5763745 -0.944161E-08  0.105E-03    1.99      20.3  T
   9    -48.5763745 -0.103272E-07  0.530E-04    1.99      40.2  T
  10    -48.5763745 -0.126670E-08  0.338E-04    1.99      63.1  T
     SCC iter.                  ...        0 min,  0.010 sec
     gradient                   ...        0 min,  0.015 sec
 * total energy  :   -47.8257281 Eh     change       -0.1746851E-03 Eh
   gradient norm :     0.0024691 Eh/α   predicted    -0.1236136E-03 ( -29.24%)
   displ. norm   :     0.3685503 α      lambda       -0.2045227E-03
   maximum displ.:     0.2719651 α      in ANC's #3, #2, #1, ...

........................................................................
.............................. CYCLE   30 ..............................
........................................................................
   1    -48.5750785 -0.485751E+02  0.266E-01    1.98       0.0  T
   2    -48.5750885 -0.100279E-04  0.144E-01    1.98       1.0  T
   3    -48.5750846  0.394143E-05  0.300E-02    1.98       1.0  T
   4    -48.5750916 -0.702333E-05  0.170E-02    1.98       1.3  T
   5    -48.5750932 -0.157018E-05  0.578E-03    1.98       3.7  T
   6    -48.5750933 -0.150813E-06  0.430E-03    1.98       5.0  T
   7    -48.5750934 -0.628997E-07  0.305E-03    1.98       7.0  T
   8    -48.5750934 -0.399391E-07  0.130E-03    1.98      16.4  T
   9    -48.5750934 -0.112206E-07  0.674E-04    1.98      31.6  T
  10    -48.5750934 -0.146893E-08  0.447E-04    1.98      47.7  T
     SCC iter.                  ...        0 min,  0.010 sec
     gradient                   ...        0 min,  0.015 sec
 * total energy  :   -47.8258788 Eh     change       -0.1507450E-03 Eh
   gradient norm :     0.0037937 Eh/α   predicted    -0.1161553E-03 ( -22.95%)
   displ. norm   :     0.4548501 α      lambda       -0.1930472E-03
   maximum displ.:     0.3359105 α      in ANC's #3, #2, #1, ...

........................................................................
.............................. CYCLE   31 ..............................
........................................................................
   1    -48.5734165 -0.485734E+02  0.333E-01    1.98       0.0  T
   2    -48.5734310 -0.145620E-04  0.179E-01    1.97       1.0  T
   3    -48.5734265  0.453537E-05  0.354E-02    1.97       1.0  T
   4    -48.5734340 -0.752199E-05  0.223E-02    1.97       1.0  T
   5    -48.5734378 -0.375306E-05  0.772E-03    1.97       2.8  T
   6    -48.5734381 -0.288171E-06  0.589E-03    1.97       3.6  T
   7    -48.5734382 -0.114344E-06  0.378E-03    1.97       5.6  T
   8    -48.5734382 -0.539349E-07  0.152E-03    1.97      14.1  T
   9    -48.5734382 -0.155471E-07  0.891E-04    1.97      23.9  T
  10    -48.5734382 -0.325260E-08  0.598E-04    1.97      35.6  T
     SCC iter.                  ...        0 min,  0.009 sec
     gradient                   ...        0 min,  0.016 sec
 * total energy  :   -47.8259961 Eh     change       -0.1172137E-03 Eh
   gradient norm :     0.0056739 Eh/α   predicted    -0.1164942E-03 (  -0.61%)
   displ. norm   :     0.2379339 α      lambda       -0.1195843E-03
   maximum displ.:     0.1625048 α      in ANC's #3, #2, #1, ...

........................................................................
.............................. CYCLE   32 ..............................
........................................................................
   1    -48.5759294 -0.485759E+02  0.156E-01    1.97       0.0  T
   2    -48.5759326 -0.315149E-05  0.853E-02    1.97       1.0  T
   3    -48.5759330 -0.432345E-06  0.133E-02    1.97       1.6  T
   4    -48.5759331 -0.830383E-07  0.926E-03    1.97       2.3  T
   5    -48.5759338 -0.705276E-06  0.396E-03    1.97       5.4  T
   6    -48.5759339 -0.129954E-06  0.264E-03    1.97       8.1  T
   7    -48.5759339  0.136605E-08  0.196E-03    1.97      10.9  T
     SCC iter.                  ...        0 min,  0.007 sec
     gradient                   ...        0 min,  0.015 sec
 * total energy  :   -47.8260702 Eh     change       -0.7412571E-04 Eh
   gradient norm :     0.0029602 Eh/α   predicted    -0.6318122E-04 ( -14.76%)
   displ. norm   :     0.2452298 α      lambda       -0.5898019E-04
   maximum displ.:     0.1649965 α      in ANC's #3, #2, #1, ...

........................................................................
.............................. CYCLE   33 ..............................
........................................................................
   1    -48.5762021 -0.485762E+02  0.172E-01    1.97       0.0  T
   2    -48.5762059 -0.375717E-05  0.931E-02    1.97       1.0  T
   3    -48.5762058  0.478376E-07  0.153E-02    1.97       1.4  T
   4    -48.5762061 -0.272192E-06  0.111E-02    1.97       1.9  T
   5    -48.5762075 -0.143010E-05  0.387E-03    1.97       5.5  T
   6    -48.5762076 -0.591292E-07  0.299E-03    1.97       7.1  T
   7    -48.5762076 -0.576353E-08  0.187E-03    1.97      11.4  T
   8    -48.5762076 -0.290068E-07  0.647E-04    1.97      32.9  T
   9    -48.5762076 -0.302158E-08  0.410E-04    1.97      52.0  T
     SCC iter.                  ...        0 min,  0.009 sec
     gradient                   ...        0 min,  0.015 sec
 * total energy  :   -47.8261119 Eh     change       -0.4176578E-04 Eh
   gradient norm :     0.0034051 Eh/α   predicted    -0.3126609E-04 ( -25.14%)
   displ. norm   :     0.2141108 α      lambda       -0.4774333E-04
   maximum displ.:     0.1354871 α      in ANC's #2, #3, #1, ...

........................................................................
.............................. CYCLE   34 ..............................
........................................................................
   1    -48.5778785 -0.485779E+02  0.152E-01    1.97       0.0  T
   2    -48.5778814 -0.294515E-05  0.817E-02    1.97       1.0  T
   3    -48.5778799  0.149491E-05  0.156E-02    1.97       1.4  T
   4    -48.5778819 -0.192098E-05  0.101E-02    1.97       2.1  T
   5    -48.5778828 -0.963515E-06  0.366E-03    1.97       5.8  T
   6    -48.5778829 -0.610453E-07  0.280E-03    1.97       7.6  T
   7    -48.5778829 -0.192931E-07  0.187E-03    1.97      11.4  T
   8    -48.5778829 -0.121743E-07  0.800E-04    1.97      26.6  T
   9    -48.5778829 -0.718521E-08  0.410E-04    1.97      52.0  T
     SCC iter.                  ...        0 min,  0.011 sec
     gradient                   ...        0 min,  0.016 sec
 * total energy  :   -47.8261393 Eh     change       -0.2732799E-04 Eh
   gradient norm :     0.0022861 Eh/α   predicted    -0.2496679E-04 (  -8.64%)
   displ. norm   :     0.2323769 α      lambda       -0.2700315E-04
   maximum displ.:     0.1465729 α      in ANC's #3, #2, #1, ...

........................................................................
.............................. CYCLE   35 ..............................
........................................................................
   1    -48.5753938 -0.485754E+02  0.153E-01    1.97       0.0  T
   2    -48.5753966 -0.281433E-05  0.835E-02    1.97       1.0  T
   3    -48.5753966 -0.214937E-07  0.133E-02    1.97       1.6  T
   4    -48.5753971 -0.450493E-06  0.905E-03    1.97       2.4  T
   5    -48.5753978 -0.720532E-06  0.332E-03    1.97       6.4  T
   6    -48.5753979 -0.665844E-07  0.250E-03    1.97       8.5  T
   7    -48.5753979 -0.142513E-07  0.163E-03    1.97      13.1  T
   8    -48.5753979 -0.155481E-07  0.628E-04    1.97      33.9  T
   9    -48.5753979 -0.250043E-08  0.340E-04    1.97      62.7  T
     SCC iter.                  ...        0 min,  0.010 sec
     gradient                   ...        0 min,  0.016 sec
 * total energy  :   -47.8261466 Eh     change       -0.7366246E-05 Eh
   gradient norm :     0.0026836 Eh/α   predicted    -0.1423307E-04 (  93.22%)
   displ. norm   :     0.0441943 α      lambda       -0.1796043E-04
   maximum displ.:     0.0322949 α      in ANC's #3, #6, #4, ...

........................................................................
.............................. CYCLE   36 ..............................
........................................................................
   1    -48.5770730 -0.485771E+02  0.374E-02    1.97       0.0  T
   2    -48.5770733 -0.279801E-06  0.206E-02    1.97       1.0  T
   3    -48.5770721  0.123529E-05  0.857E-03    1.97       2.5  T
   4    -48.5770735 -0.144818E-05  0.260E-03    1.97       8.2  T
   5    -48.5770735 -0.179846E-07  0.146E-03    1.97      14.6  T
   6    -48.5770736 -0.187081E-07  0.713E-04    1.97      29.9  T
   7    -48.5770736 -0.299028E-08  0.484E-04    1.97      44.0  T
     SCC iter.                  ...        0 min,  0.007 sec
     gradient                   ...        0 min,  0.016 sec
 * total energy  :   -47.8261547 Eh     change       -0.8014103E-05 Eh
   gradient norm :     0.0019366 Eh/α   predicted    -0.8998683E-05 (  12.29%)
   displ. norm   :     0.0534336 α      lambda       -0.7939633E-05
   maximum displ.:     0.0330643 α      in ANC's #2, #3, #4, ...

........................................................................
.............................. CYCLE   37 ..............................
........................................................................
   1    -48.5777368 -0.485777E+02  0.476E-02    1.97       0.0  T
   2    -48.5777373 -0.509774E-06  0.251E-02    1.97       1.0  T
   3    -48.5777362  0.111582E-05  0.863E-03    1.97       2.5  T
   4    -48.5777376 -0.134758E-05  0.323E-03    1.97       6.6  T
   5    -48.5777376 -0.349318E-07  0.190E-03    1.97      11.2  T
   6    -48.5777376 -0.242835E-07  0.115E-03    1.97      18.6  T
   7    -48.5777376 -0.294501E-08  0.901E-04    1.97      23.7  T
   8    -48.5777376 -0.315515E-08  0.537E-04    1.97      39.7  T
     SCC iter.                  ...        0 min,  0.008 sec
     gradient                   ...        0 min,  0.016 sec
 * total energy  :   -47.8261571 Eh     change       -0.2482732E-05 Eh
   gradient norm :     0.0031879 Eh/α   predicted    -0.3975306E-05 (  60.12%)
   displ. norm   :     0.0323929 α      lambda       -0.5195206E-05
   maximum displ.:     0.0245470 α      in ANC's #2, #3, #1, ...

........................................................................
.............................. CYCLE   38 ..............................
........................................................................
   1    -48.5771046 -0.485771E+02  0.255E-02    1.97       0.0  T
   2    -48.5771047 -0.131376E-06  0.141E-02    1.97       1.5  T
   3    -48.5771047 -0.112981E-07  0.192E-03    1.97      11.1  T
   4    -48.5771048 -0.307678E-07  0.112E-03    1.97      19.1  T
   5    -48.5771048 -0.574786E-08  0.586E-04    1.97      36.4  T
   6    -48.5771048 -0.268440E-08  0.381E-04    1.97      55.9  T
     SCC iter.                  ...        0 min,  0.006 sec
     gradient                   ...        0 min,  0.016 sec
 * total energy  :   -47.8261604 Eh     change       -0.3270570E-05 Eh
   gradient norm :     0.0011829 Eh/α   predicted    -0.2602061E-05 ( -20.44%)
   displ. norm   :     0.0205872 α      lambda       -0.2474406E-05
   maximum displ.:     0.0139374 α      in ANC's #2, #12, #11, ...

........................................................................
.............................. CYCLE   39 ..............................
........................................................................
   1    -48.5770637 -0.485771E+02  0.241E-02    1.97       0.0  T
   2    -48.5770638 -0.182698E-06  0.128E-02    1.97       1.7  T
   3    -48.5770636  0.204015E-06  0.423E-03    1.97       5.0  T
   4    -48.5770639 -0.258607E-06  0.196E-03    1.97      10.9  T
   5    -48.5770639 -0.185811E-07  0.123E-03    1.97      17.3  T
   6    -48.5770639 -0.902771E-08  0.714E-04    1.97      29.9  T
   7    -48.5770639 -0.112698E-08  0.549E-04    1.97      38.8  T
     SCC iter.                  ...        0 min,  0.009 sec
     gradient                   ...        0 min,  0.017 sec
 * total energy  :   -47.8261603 Eh     change        0.6550720E-07 Eh
   gradient norm :     0.0010408 Eh/α   predicted    -0.1238743E-05 (*******%)
   displ. norm   :     0.0141416 α      lambda       -0.1697398E-05
   maximum displ.:     0.0083566 α      in ANC's #2, #3, #12, ...

........................................................................
.............................. CYCLE   40 ..............................
........................................................................
   1    -48.5769095 -0.485769E+02  0.176E-02    1.97       0.0  T
   2    -48.5769096 -0.868479E-07  0.901E-03    1.97       2.4  T
   3    -48.5769096  0.299065E-07  0.240E-03    1.97       8.9  T
   4    -48.5769096 -0.581762E-07  0.139E-03    1.97      15.4  T
   5    -48.5769096 -0.143599E-08  0.924E-04    1.97      23.1  T
   6    -48.5769097 -0.715973E-08  0.541E-04    1.97      39.4  T
     SCC iter.                  ...        0 min,  0.008 sec
     gradient                   ...        0 min,  0.018 sec
 * total energy  :   -47.8261615 Eh     change       -0.1187654E-05 Eh
   gradient norm :     0.0005611 Eh/α   predicted    -0.8526076E-06 ( -28.21%)
   displ. norm   :     0.0368635 α      lambda       -0.5751608E-06
   maximum displ.:     0.0236637 α      in ANC's #3, #2, #1, ...

   *** GEOMETRY OPTIMIZATION CONVERGED AFTER 40 ITERATIONS ***

------------------------------------------------------------------------
 total energy gain   :        -0.1327658 Eh      -83.3118 kcal/mol
 total RMSD          :         1.7826669 a0        0.9433 Å
 total power (kW/mol):        -8.7144123 (step) -228.5625 (real)
------------------------------------------------------------------------

 ANCopt (total)                0 d,  0 h,  0 min,  1.525 sec
 optimizer setup                ...        0 min,  0.000 sec (  0.008%)
 model hessian                  ...        0 min,  0.005 sec (  0.329%)
 ANC generation                 ...        0 min,  0.001 sec (  0.050%)
 coordinate transformation      ...        0 min,  0.000 sec (  0.029%)
 single point calculation       ...        0 min,  1.504 sec ( 98.613%)
 optimization log               ...        0 min,  0.003 sec (  0.191%)
 hessian update                 ...        0 min,  0.000 sec (  0.022%)
 rational function              ...        0 min,  0.010 sec (  0.641%)

================
 final structure:
================
$coord
    3.04852232012765    0.14419493402709   -0.67785920295168      C 
    1.31826828720861   -1.33421600683995   -0.75238920094802      O 
    5.76759694279381   -0.37521207947730   -1.02611398197531      C 
    7.15589470649343    1.88297587551002   -0.78943790157355      C 
    9.76423258878413    1.83006765623112   -1.05345010809766      C 
   10.93726253311971   -0.46537559826737   -1.54653049309952      C 
    9.54082239025576   -2.69848378479127   -1.77765965441686      C 
    6.93097870820827   -2.65859511153436   -1.51571850135142      C 
   11.18757134173119   -5.79153761816176   -2.44916109698557      Br
   14.48909596044219   -0.53354985092793   -1.90701057466254      Br
    5.43696782651561    3.97499555418730   -0.27921514186709      C 
    6.09240002906354    6.44172108650897    0.06750603731302      C 
    8.60191305256969    7.35619209957589   -0.01323482599371      C 
   10.59914927475607    8.19556794412383   -0.05638295367872      N 
    4.35689362639137    8.41428140039969    0.55575489284554      C 
    3.05218523219949   10.09731761073366    0.95441281729495      N 
    2.87446330342939    2.93014333903491   -0.20647486598091      C 
    0.65522344347431    4.06372203984526    0.18697505397062      C 
   10.90296478126733    3.51126796625005   -0.88850097363435      H 
    5.83126725843221   -4.36702529769824   -1.69003556579640      H 
   -1.03460101765292    2.92350995746647    0.16163729072591      H 
    0.43818160646033    6.05461351897065    0.53020889276873      H 
$end
           -------------------------------------------------
          |                Final Singlepoint                |
           -------------------------------------------------

          ...................................................
          :                      SETUP                      :
          :.................................................:
          :  # basis functions                  88          :
          :  # atomic orbitals                  86          :
          :  # shells                           42          :
          :  # electrons                        86          :
          :  max. iterations                   250          :
          :  Hamiltonian                  GFN2-xTB          :
          :  restarted?                      false          :
          :  GBSA solvation                  false          :
          :  PC potential                    false          :
          :  electronic temp.          300.0000000     K    :
          :  accuracy                    1.0000000          :
          :  -> integral cutoff          0.2500000E+02      :
          :  -> integral neglect         0.1000000E-07      :
          :  -> SCF convergence          0.1000000E-05 Eh   :
          :  -> wf. convergence          0.1000000E-03 e    :
          :  Broyden damping             0.4000000          :
          ...................................................

 iter      E             dE          RMSdq      gap      omega  full diag
   1    -48.5769097 -0.485769E+02  0.360E-04    1.97       0.0  T
   2    -48.5769097 -0.157399E-09  0.290E-04    1.97      73.6  T
   3    -48.5769097 -0.315566E-09  0.252E-04    1.97      84.7  T

   *** convergence criteria satisfied after 3 iterations ***

         #    Occupation            Energy/Eh            Energy/eV
      -------------------------------------------------------------
         1        2.0000           -0.8726542             -23.7461
       ...           ...                  ...                  ...
        37        2.0000           -0.4566440             -12.4259
        38        2.0000           -0.4552265             -12.3873
        39        2.0000           -0.4500372             -12.2461
        40        2.0000           -0.4442067             -12.0875
        41        2.0000           -0.4399432             -11.9715
        42        2.0000           -0.4330723             -11.7845
        43        2.0000           -0.4316907             -11.7469 (HOMO)
        44                         -0.3592990              -9.7770 (LUMO)
        45                         -0.3426116              -9.3229
        46                         -0.2896750              -7.8825
        47                         -0.2683086              -7.3010
        48                         -0.2666762              -7.2566
       ...                                ...                  ...
        86                          1.1392076              30.9994
      -------------------------------------------------------------
                  HL-Gap            0.0723917 Eh            1.9699 eV
             Fermi-level           -0.3954948 Eh          -10.7620 eV

 SCC (total)                   0 d,  0 h,  0 min,  0.036 sec
 SCC setup                      ...        0 min,  0.000 sec (  0.620%)
 Dispersion                     ...        0 min,  0.000 sec (  0.778%)
 integral evaluation            ...        0 min,  0.014 sec ( 38.340%)
 zeroth order Hamiltonian       ...        0 min,  0.000 sec (  0.521%)
 iterations                     ...        0 min,  0.004 sec ( 12.304%)
 molecular gradient             ...        0 min,  0.017 sec ( 46.598%)
 printout                       ...        0 min,  0.000 sec (  0.719%)

         :::::::::::::::::::::::::::::::::::::::::::::::::::::
         ::                     SUMMARY                     ::
         :::::::::::::::::::::::::::::::::::::::::::::::::::::
         :: total energy             -47.826161504838 Eh    ::
         :: gradient norm              0.000563139218 Eh/a0 ::
         :: HOMO-LUMO gap              1.969877552872 eV    ::
         ::.................................................::
         :: SCC energy               -48.576909651734 Eh    ::
         :: -> isotropic ES            0.043610239235 Eh    ::
         :: -> anisotropic ES          0.003021244585 Eh    ::
         :: -> anisotropic XC          0.044151549791 Eh    ::
         :: -> dispersion             -0.030942704607 Eh    ::
         :: repulsion energy           0.750741555257 Eh    ::
         :: add. restraining           0.000000000000 Eh    ::
         :::::::::::::::::::::::::::::::::::::::::::::::::::::

           -------------------------------------------------
          |                Property Printout                |
           -------------------------------------------------

    * Orbital Energies and Occupations

         #    Occupation            Energy/Eh            Energy/eV
      -------------------------------------------------------------
         1        2.0000           -0.8726542             -23.7461
       ...           ...                  ...                  ...
        31        2.0000           -0.5066151             -13.7857
        32        2.0000           -0.4992656             -13.5857
        33        2.0000           -0.4910173             -13.3613
        34        2.0000           -0.4892649             -13.3136
        35        2.0000           -0.4854814             -13.2106
        36        2.0000           -0.4665714             -12.6961
        37        2.0000           -0.4566440             -12.4259
        38        2.0000           -0.4552265             -12.3873
        39        2.0000           -0.4500372             -12.2461
        40        2.0000           -0.4442067             -12.0875
        41        2.0000           -0.4399432             -11.9715
        42        2.0000           -0.4330723             -11.7845
        43        2.0000           -0.4316907             -11.7469 (HOMO)
        44                         -0.3592990              -9.7770 (LUMO)
        45                         -0.3426116              -9.3229
        46                         -0.2896750              -7.8825
        47                         -0.2683086              -7.3010
        48                         -0.2666762              -7.2566
        49                         -0.2510707              -6.8320
        50                         -0.2428398              -6.6080
        51                         -0.2285398              -6.2189
        52                         -0.2223691              -6.0510
        53                         -0.1975613              -5.3759
        54                         -0.1525966              -4.1524
       ...                                ...                  ...
        86                          1.1392076              30.9994
      -------------------------------------------------------------
                  HL-Gap            0.0723917 Eh            1.9699 eV
             Fermi-level           -0.3954948 Eh          -10.7620 eV

     #   Z        covCN         q      C6AA      α(0)
     1   6 C      2.862     0.231    23.160     7.888
     2   8 O      0.856    -0.330    20.334     6.046
     3   6 C      3.035    -0.016    28.386     8.739
     4   6 C      3.029     0.009    27.777     8.645
     5   6 C      2.999    -0.034    28.844     8.810
     6   6 C      2.980     0.081    26.195     8.395
     7   6 C      2.983     0.079    26.235     8.402
     8   6 C      2.993    -0.021    28.520     8.760
     9  35 Br     1.250    -0.091   187.535    22.080
    10  35 Br     1.257    -0.091   187.544    22.081
    11   6 C      3.007     0.034    27.213     8.557
    12   6 C      2.947     0.023    27.495     8.600
    13   6 C      1.935     0.124    28.041     8.552
    14   7 N      0.911    -0.206    25.473     7.300
    15   6 C      1.935     0.126    27.996     8.545
    16   7 N      0.911    -0.206    25.480     7.301
    17   6 C      2.996    -0.013    28.318     8.729
    18   6 C      2.840    -0.051    29.268     8.866
    19   1 H      0.926     0.084     1.939     2.178
    20   1 H      0.926     0.091     1.870     2.138
    21   1 H      0.926     0.094     1.836     2.119
    22   1 H      0.926     0.082     1.960     2.189

 Mol. C6AA /au·bohr⁶  :      13342.958201
 Mol. C8AA /au·bohr⁸  :     449445.298033
 Mol. α(0) /au        :        184.920425


Wiberg/Mayer (AO) data.
largest (>0.10) Wiberg bond orders for each atom
          total WBO             WBO to atom ...
     1  C   3.927        O    2 1.820    C    3 1.021    C   17 0.990
     2  O   2.088        C    1 1.820
     3  C   3.979        C    8 1.415    C    4 1.284    C    1 1.021
     4  C   3.989        C    5 1.390    C    3 1.284    C   11 1.096
     5  C   3.976        C    6 1.407    C    4 1.390    H   19 0.955
     6  C   3.947        C    5 1.407    C    7 1.343    Br  10 1.031
     7  C   3.937        C    8 1.397    C    6 1.343    Br   9 1.029
     8  C   3.983        C    3 1.415    C    7 1.397    H   20 0.959
     9  Br  1.201        C    7 1.029
    10  Br  1.205        C    6 1.031
    11  C   3.979        C   12 1.540    C    4 1.096    C   17 1.081
    12  C   3.979        C   11 1.540    C   13 1.086    C   15 1.085
    13  C   3.949        N   14 2.784    C   12 1.086
    14  N   2.988        C   13 2.784
    15  C   3.949        N   16 2.784    C   12 1.085
    16  N   2.989        C   15 2.784
    17  C   3.986        C   18 1.799    C   11 1.081    C    1 0.990
    18  C   3.937        C   17 1.799    H   21 0.966    H   22 0.965
    19  H   0.992        C    5 0.955
    20  H   0.991        C    8 0.959
    21  H   0.990        C   18 0.966
    22  H   0.993        C   18 0.965

molecular dipole:
                 x           y           z       tot (Debye)
 q only:       -0.484      -0.270      -0.002
   full:       -0.896      -0.355       0.023       2.451
molecular quadrupole (traceless):
                xx          xy          yy          xz          yz          zz
 q only:       -7.001      -7.134      -7.695       1.237      -2.982      14.696
  q+dip:      -15.432      -5.088      -8.975       3.640      -5.059      24.406
   full:      -18.417      -5.659     -11.561       4.380      -6.391      29.978

           -------------------------------------------------
          |                Geometry Summary                 |
           -------------------------------------------------

      molecular mass/u    :      363.9954000
   center of mass at/Å    :        4.7322510       0.1571412      -0.6490220
  moments of inertia/u·Å² :        0.1146916E+04   0.3119641E+04   0.4266547E+04
rotational constants/cm⁻¹ :        0.1469822E-01   0.5403709E-02   0.3951118E-02

 * 17 selected distances

     #   Z        #   Z                                     value/Å
     1   6 C      2   8 O                                 1.2049719
     3   6 C      4   6 C                                 1.4083274
     4   6 C      5   6 C                                 1.3876081
     5   6 C      6   6 C                                 1.3888446
     6   6 C      7   6 C                                 1.3990948
     3   6 C      8   6 C                                 1.3806363
     7   6 C      8   6 C                                 1.3881691
     7   6 C      9  35 Br                                1.8880343
     6   6 C     10  35 Br                                1.8895492 (max)
    11   6 C     12   6 C                                 1.3630338
    13   6 C     14   7 N                                 1.1466633
    15   6 C     16   7 N                                 1.1464724
    17   6 C     18   6 C                                 1.3350408
     5   6 C     19   1 H                                 1.0780620
     8   6 C     20   1 H                                 1.0791176
    18   6 C     21   1 H                                 1.0788252
    18   6 C     22   1 H                                 1.0752285 (min)

 * 5 distinct bonds (by element types)

   Z      Z             #   av. dist./Å        max./Å        min./Å
   1 H    6 C           4     1.0778083     1.0791176     1.0752285
   6 C    6 C           8     1.3813444     1.4083274     1.3350408
   6 C    7 N           2     1.1465678     1.1466633     1.1464724
   6 C    8 O           1     1.2049719     1.2049719     1.2049719
   6 C   35 Br          2     1.8887918     1.8895492     1.8880343


optimized geometry written to: xtbopt.xyz


           -------------------------------------------------
          | TOTAL ENERGY              -47.826161504838 Eh   |
          | GRADIENT NORM               0.000563139218 Eh/α |
          | HOMO-LUMO GAP               1.969877552872 eV   |
           -------------------------------------------------

------------------------------------------------------------------------
 * finished run on 2021/02/19 at 08:12:23.052     
------------------------------------------------------------------------
 total:
 * wall-time:     0 d,  0 h,  0 min,  1.648 sec
 *  cpu-time:     0 d,  0 h,  0 min,  1.632 sec
 * ratio c/w:     0.991 speedup
 SCF:
 * wall-time:     0 d,  0 h,  0 min,  0.051 sec
 *  cpu-time:     0 d,  0 h,  0 min,  0.051 sec
 * ratio c/w:     0.998 speedup
 ANC optimizer:
 * wall-time:     0 d,  0 h,  0 min,  1.562 sec
 *  cpu-time:     0 d,  0 h,  0 min,  1.558 sec
 * ratio c/w:     0.998 speedup

