      -----------------------------------------------------------      
     |                   =====================                   |     
     |                           x T B                           |     
     |                   =====================                   |     
     |                         S. Grimme                         |     
     |          Mulliken Center for Theoretical Chemistry        |     
     |                    University of Bonn                     |     
     |                Version 6.2 RC2 (SAW190805)                |     
      -----------------------------------------------------------      

   This program is distributed in the hope that it will be useful,
   but WITHOUT ANY WARRANTY; without even the implied warranty of
   MERCHANTABILITY or FITNESS FOR A PARTICULAR PURPOSE.
   
   FOR NON-COMMERCIAL, ACADEMIA USE ONLY.
   
   Cite this work as:
   * S. Grimme, C. Bannwarth, P. Shushkov, J. Chem. Theory Comput., 2017,
     13, 1989-2009. DOI: 10.1021/acs.jctc.7b00118
   * C. Bannwarth, S. Ehlert and S. Grimme., J. Chem. Theory Comput., 2019,
     15, 1652-1671. DOI: 10.1021/acs.jctc.8b01176
   * P. Pracht, E. Caldeweyher, S. Ehlert, S. Grimme, ChemRxiv, 2019, preprint.
     DOI: 10.26434/chemrxiv.8326202.v1
   
   for DFT-D4:
   * E. Caldeweyher, C. Bannwarth and S. Grimme, J. Chem. Phys., 2017,
     147, 034112. DOI: 10.1063/1.4993215
   * E. Caldeweyher, S. Ehlert, A. Hansen, H. Neugebauer, S. Spicher,
     C. Bannwarth and S. Grimme, J. Chem. Phys., 2019, 150, 154122.
     DOI: 10.1063/1.5090222
   
   for sTDA-xTB:
   * S. Grimme and C. Bannwarth, J. Chem. Phys., 2016, 145, 054103.
     DOI: 10.1063/1.4959605
   
   in the mass-spec context:
   * V. Asgeirsson, C. Bauer and S. Grimme, Chem. Sci., 2017, 8, 4879.
     DOI: 10.1039/c7sc00601b
   
   for metadynamics refer to:
   * S. Grimme, J. Chem. Theory Comput., 2019, 155, 2847-2862
     DOI: 10.1021/acs.jctc.9b00143
   
   with help from (in alphabetical order)
   C. Bannwarth, F. Bohle, G. Brandenburg, E. Caldeweyher, M. Checinski,
   S. Dohm, S. Ehlert, S. Ehrlich, F. März, H. Neugebauer, J. Pisarek,
   P. Pracht, P. Shushkov, and S. Spicher.
   
 * started run on 2021/02/19 at 08:12:25.154     

           -------------------------------------------------
          |                Calculation Setup                |
           -------------------------------------------------

          program call               : /ihome/ghutchison/geoffh/xtb/xtb 32atl.xyz -opt
          hostname                   : smp-n135
          coordinate file            : 32atl.xyz
          omp threads                :                     1
          number of atoms            :                    25
          number of electrons        :                    88
          charge                     :                     0
          spin                       :                   0.0
          first test random number   :      0.45682961672103


########################################################################
# WARNING! Please study the warnings concerning your input carefully
#  - the use of '-opt' is discouraged, please use '--opt' next time
########################################################################

           ------------------------------------------------- 
          |                 G F N 2 - x T B                 |
          | Geometry, Frequencies, Noncovalent interactions |
          |            JCTC 2019 parametrisation            |
           ------------------------------------------------- 
             KAB for C  - Si     :                1.0500
             KAB for H  - Pd     :                0.9500
             k(s)              :                1.8500
             k(p)              :                2.2300
             k(d)              :                2.2300
             k(f)              :                2.0000
             kEN (H0ij)        :               -2.0000
             D4 a1             :                0.5200
             D4 a2             :                5.0000
             D4 s6             :                1.0000
             D4 s8             :                2.7000
             D4 s9             :                5.0000
             alphaj            :                2.0000

  Z AO/shell   Hii/eV     exponent
  1     Wed Apr 25 08:07:45 CEST 2018   EN: 2.200 GM2: 0.406  GM3: 0.0800  RAES: 1.40
     1s    -10.707211    1.230000
  6     Wed Apr 25 08:07:45 CEST 2018   EN: 2.550 GM2: 0.538  GM3: 0.1500  RAES: 3.00
     2s    -13.970922    2.096432
     2p    -10.063292    1.800000
  7     Wed Apr 25 08:07:45 CEST 2018   EN: 3.040 GM2: 0.461  GM3:-0.0640  RAES: 1.90
     2s    -16.686243    2.339881
     2p    -12.523956    2.014332
  8     Wed Apr 25 08:07:45 CEST 2018   EN: 3.440 GM2: 0.452  GM3:-0.0517  RAES: 1.80
     2s    -20.229985    2.439742
     2p    -15.503117    2.137023
 16     Tue Apr 24 11:44:34 CEST 2018   EN: 2.580 GM2: 0.340  GM3:-0.0502  RAES: 3.10
     3s    -20.029654    1.981333
     3p    -11.377694    2.025643
     3d     -0.420282    1.702555

           ------------------------------------------------- 
          |        Self-Consistent Charge Iterations        |
           ------------------------------------------------- 

          ...................................................
          :                      SETUP                      :
          :.................................................:
          :  # basis functions                  88          :
          :  # atomic orbitals                  87          :
          :  # shells                           45          :
          :  # electrons                        88          :
          :  max. iterations                   250          :
          :  Hamiltonian                  GFN2-xTB          :
          :  restarted?                      false          :
          :  GBSA solvation                  false          :
          :  PC potential                    false          :
          :  electronic temp.          300.0000000     K    :
          :  accuracy                    1.0000000          :
          :  -> integral cutoff          0.2500000E+02      :
          :  -> integral neglect         0.1000000E-07      :
          :  -> SCF convergence          0.1000000E-05 Eh   :
          :  -> wf. convergence          0.1000000E-03 e    :
          :  Broyden damping             0.4000000          :
          ...................................................

 iter      E             dE          RMSdq      gap      omega  full diag
   1    -48.9373943 -0.489374E+02  0.654E+00    2.25       0.0  T
   2    -48.9398708 -0.247652E-02  0.423E+00    2.15       1.0  T
   3    -48.8452031  0.946677E-01  0.314E+00    1.69       1.0  T
   4    -49.0201878 -0.174985E+00  0.658E-01    1.86       1.0  T
   5    -49.0266604 -0.647254E-02  0.231E-01    1.84       1.0  T
   6    -49.0269592 -0.298863E-03  0.112E-01    1.88       1.0  T
   7    -49.0271887 -0.229492E-03  0.432E-02    1.88       1.0  T
   8    -49.0272000 -0.112867E-04  0.182E-02    1.87       1.1  T
   9    -49.0272028 -0.280894E-05  0.880E-03    1.87       2.3  T
  10    -49.0272035 -0.640710E-06  0.404E-03    1.87       4.9  T
  11    -49.0272037 -0.212677E-06  0.190E-03    1.87      10.5  T
  12    -49.0272037 -0.236269E-07  0.869E-04    1.87      23.0  T
  13    -49.0272037 -0.294084E-08  0.389E-04    1.87      51.4  T

   *** convergence criteria satisfied after 13 iterations ***

         #    Occupation            Energy/Eh            Energy/eV
      -------------------------------------------------------------
         1        2.0000           -0.7592381             -20.6599
       ...           ...                  ...                  ...
        38        2.0000           -0.4561808             -12.4133
        39        2.0000           -0.4520131             -12.2999
        40        2.0000           -0.4408164             -11.9952
        41        2.0000           -0.4400095             -11.9733
        42        2.0000           -0.4262990             -11.6002
        43        2.0000           -0.4109527             -11.1826
        44        2.0000           -0.4064656             -11.0605 (HOMO)
        45                         -0.3376557              -9.1881 (LUMO)
        46                         -0.3174053              -8.6370
        47                         -0.2813193              -7.6551
        48                         -0.2532906              -6.8924
        49                         -0.2520145              -6.8577
       ...                                ...                  ...
        87                          1.0772960              29.3147
      -------------------------------------------------------------
                  HL-Gap            0.0688099 Eh            1.8724 eV
             Fermi-level           -0.3720606 Eh          -10.1243 eV

 SCC (total)                   0 d,  0 h,  0 min,  0.053 sec
 SCC setup                      ...        0 min,  0.000 sec (  0.596%)
 Dispersion                     ...        0 min,  0.000 sec (  0.944%)
 integral evaluation            ...        0 min,  0.014 sec ( 27.241%)
 zeroth order Hamiltonian       ...        0 min,  0.000 sec (  0.413%)
 iterations                     ...        0 min,  0.020 sec ( 37.512%)
 molecular gradient             ...        0 min,  0.017 sec ( 32.619%)
 printout                       ...        0 min,  0.000 sec (  0.585%)

         :::::::::::::::::::::::::::::::::::::::::::::::::::::
         ::                     SUMMARY                     ::
         :::::::::::::::::::::::::::::::::::::::::::::::::::::
         :: total energy             -48.209981593750 Eh    ::
         :: gradient norm              0.092148199641 Eh/a0 ::
         :: HOMO-LUMO gap              1.872412869509 eV    ::
         ::.................................................::
         :: SCC energy               -49.027203707641 Eh    ::
         :: -> isotropic ES            0.041136838393 Eh    ::
         :: -> anisotropic ES          0.002268620894 Eh    ::
         :: -> anisotropic XC          0.049396724139 Eh    ::
         :: -> dispersion             -0.032608191091 Eh    ::
         :: repulsion energy           0.817283143044 Eh    ::
         :: add. restraining           0.000000000000 Eh    ::
         :::::::::::::::::::::::::::::::::::::::::::::::::::::

      ----------------------------------------------------------- 
     |                   =====================                   |
     |                        A N C O P T                        |
     |                   =====================                   |
     |               Approximate Normal Coordinate               |
     |                Rational Function Optimizer                |
      ----------------------------------------------------------- 

          ...................................................
          :                      SETUP                      :
          :.................................................:
          :   optimization level            normal          :
          :   max. optcycles                   200          :
          :   ANC micro-cycles                  20          :
          :   degrees of freedom                69          :
          :.................................................:
          :   RF solver                   davidson          :
          :   input Hessian                  false          :
          :   write xtbopt.log                true          :
          :   linear?                        false          :
          :   energy convergence         0.5000000E-05 Eh   :
          :   grad. convergence          0.1000000E-02 Eh/α :
          :   maximium RF displ.         2.0000000          :
          :   Hlow (freq-cutoff)         0.5000000E-02      :
          :   Hmax (freq-cutoff)         5.0000000          :
          :   S6 in model hess.         20.0000000          :
          ...................................................

generating ANC from model Hessian ...
Using Lindh-Hessian (1995)
 Shifting diagonal of input Hessian by   5.124548086787493E-003
 Lowest  eigenvalues of input Hessian
    0.005000   -0.000000   -0.000000    0.000000    0.000000    0.000000
    0.000000    0.005127    0.006610    0.007082    0.009699    0.011009
    0.012315    0.015252    0.016028    0.016699    0.020022    0.021077
 Highest eigenvalues
    1.934076    1.992260    2.028379    2.262629    2.521152    2.571767
 

........................................................................
.............................. CYCLE    1 ..............................
........................................................................
   1    -49.0272037 -0.490272E+02  0.209E-04    1.87       0.0  T
   2    -49.0272037  0.446718E-10  0.179E-04    1.87     111.6  T
   3    -49.0272037 -0.682313E-09  0.718E-05    1.87     278.6  T
     SCC iter.                  ...        0 min,  0.005 sec
     gradient                   ...        0 min,  0.017 sec
 * total energy  :   -48.2099816 Eh     change        0.3529148E-07 Eh
   gradient norm :     0.0921483 Eh/α   predicted     0.0000000E+00 (-100.00%)
   displ. norm   :     0.2981264 α      lambda       -0.1012156E-01
   maximum displ.:     0.1988884 α      in ANC's #16, #10, #27, ...

........................................................................
.............................. CYCLE    2 ..............................
........................................................................
   1    -49.0765894 -0.490766E+02  0.222E-01    1.91       0.0  T
   2    -49.0766721 -0.827447E-04  0.121E-01    1.95       1.0  T
   3    -49.0766491  0.230231E-04  0.655E-02    1.93       1.0  T
   4    -49.0766971 -0.480017E-04  0.232E-02    1.94       1.0  T
   5    -49.0767029 -0.576968E-05  0.917E-03    1.94       2.2  T
   6    -49.0767034 -0.521259E-06  0.435E-03    1.94       4.6  T
   7    -49.0767037 -0.325379E-06  0.144E-03    1.94      13.9  T
     SCC iter.                  ...        0 min,  0.010 sec
     gradient                   ...        0 min,  0.017 sec
 * total energy  :   -48.2164043 Eh     change       -0.6422766E-02 Eh
   gradient norm :     0.0335224 Eh/α   predicted    -0.5510579E-02 ( -14.20%)
   displ. norm   :     0.2441850 α      lambda       -0.2395804E-02
   maximum displ.:     0.1597485 α      in ANC's #10, #16, #5, ...

........................................................................
.............................. CYCLE    3 ..............................
........................................................................
   1    -49.0846501 -0.490847E+02  0.155E-01    1.92       0.0  T
   2    -49.0846811 -0.309156E-04  0.897E-02    1.95       1.0  T
   3    -49.0846534  0.277035E-04  0.534E-02    1.94       1.0  T
   4    -49.0846950 -0.416304E-04  0.162E-02    1.94       1.2  T
   5    -49.0846993 -0.432579E-05  0.618E-03    1.94       3.2  T
   6    -49.0846997 -0.350061E-06  0.279E-03    1.94       7.2  T
   7    -49.0846998 -0.119398E-06  0.104E-03    1.94      19.3  T
     SCC iter.                  ...        0 min,  0.010 sec
     gradient                   ...        0 min,  0.018 sec
 * total energy  :   -48.2178096 Eh     change       -0.1405294E-02 Eh
   gradient norm :     0.0079626 Eh/α   predicted    -0.1269352E-02 (  -9.67%)
   displ. norm   :     0.1472124 α      lambda       -0.3803239E-03
   maximum displ.:     0.0888308 α      in ANC's #10, #5, #16, ...

........................................................................
.............................. CYCLE    4 ..............................
........................................................................
   1    -49.0832144 -0.490832E+02  0.116E-01    1.93       0.0  T
   2    -49.0832203 -0.587801E-05  0.660E-02    1.94       1.0  T
   3    -49.0831996  0.206994E-04  0.308E-02    1.93       1.0  T
   4    -49.0832242 -0.246479E-04  0.564E-03    1.93       3.5  T
   5    -49.0832247 -0.503560E-06  0.273E-03    1.93       7.3  T
   6    -49.0832248 -0.380544E-07  0.133E-03    1.93      15.0  T
     SCC iter.                  ...        0 min,  0.009 sec
     gradient                   ...        0 min,  0.018 sec
 * total energy  :   -48.2179688 Eh     change       -0.1592312E-03 Eh
   gradient norm :     0.0067175 Eh/α   predicted    -0.1942836E-03 (  22.01%)
   displ. norm   :     0.2977171 α      lambda       -0.7480360E-03
   maximum displ.:     0.1702632 α      in ANC's #10, #5, #13, ...

........................................................................
.............................. CYCLE    5 ..............................
........................................................................
   1    -49.0774606 -0.490775E+02  0.263E-01    1.90       0.0  T
   2    -49.0774868 -0.262934E-04  0.148E-01    1.91       1.0  T
   3    -49.0773821  0.104764E-03  0.667E-02    1.91       1.0  T
   4    -49.0775064 -0.124298E-03  0.113E-02    1.91       1.8  T
   5    -49.0775082 -0.180258E-05  0.575E-03    1.91       3.5  T
   6    -49.0775083 -0.130616E-06  0.285E-03    1.91       7.0  T
   7    -49.0775084 -0.674232E-07  0.132E-03    1.91      15.2  T
     SCC iter.                  ...        0 min,  0.010 sec
     gradient                   ...        0 min,  0.018 sec
 * total energy  :   -48.2176333 Eh     change        0.3355150E-03 Eh
   gradient norm :     0.0186001 Eh/α   predicted    -0.4071708E-03 (-221.36%)
   displ. norm   :     0.1707091 α      lambda       -0.9970269E-03
   maximum displ.:     0.1036090 α      in ANC's #10, #5, #16, ...

........................................................................
.............................. CYCLE    6 ..............................
........................................................................
   1    -49.0824082 -0.490824E+02  0.158E-01    1.94       0.0  T
   2    -49.0824193 -0.111383E-04  0.892E-02    1.93       1.0  T
   3    -49.0823904  0.289258E-04  0.380E-02    1.93       1.0  T
   4    -49.0824258 -0.353641E-04  0.699E-03    1.93       2.9  T
   5    -49.0824265 -0.758740E-06  0.337E-03    1.93       5.9  T
   6    -49.0824266 -0.525967E-07  0.172E-03    1.93      11.6  T
   7    -49.0824266 -0.287766E-07  0.637E-04    1.93      31.4  T
     SCC iter.                  ...        0 min,  0.010 sec
     gradient                   ...        0 min,  0.018 sec
 * total energy  :   -48.2181422 Eh     change       -0.5089084E-03 Eh
   gradient norm :     0.0039640 Eh/α   predicted    -0.5130447E-03 (   0.81%)
   displ. norm   :     0.1037932 α      lambda       -0.1484079E-03
   maximum displ.:     0.0706258 α      in ANC's #7, #1, #6, ...

........................................................................
.............................. CYCLE    7 ..............................
........................................................................
   1    -49.0813129 -0.490813E+02  0.167E-01    1.93       0.0  T
   2    -49.0813223 -0.938200E-05  0.923E-02    1.93       1.0  T
   3    -49.0813201  0.224679E-05  0.176E-02    1.93       1.1  T
   4    -49.0813267 -0.667249E-05  0.357E-03    1.93       5.6  T
   5    -49.0813268 -0.785778E-07  0.210E-03    1.93       9.5  T
   6    -49.0813269 -0.484568E-07  0.753E-04    1.93      26.6  T
   7    -49.0813269 -0.892137E-08  0.183E-04    1.93     109.5  T
     SCC iter.                  ...        0 min,  0.010 sec
     gradient                   ...        0 min,  0.019 sec
 * total energy  :   -48.2178641 Eh     change        0.2781264E-03 Eh
   gradient norm :     0.0089311 Eh/α   predicted    -0.7500542E-04 (-126.97%)
   displ. norm   :     0.0875338 α      lambda       -0.6136474E-03
   maximum displ.:     0.0597490 α      in ANC's #7, #1, #6, ...

........................................................................
.............................. CYCLE    8 ..............................
........................................................................
   1    -49.0824711 -0.490825E+02  0.141E-01    1.93       0.0  T
   2    -49.0824779 -0.673014E-05  0.780E-02    1.93       1.0  T
   3    -49.0824785 -0.600187E-06  0.999E-03    1.93       2.0  T
   4    -49.0824809 -0.247823E-05  0.255E-03    1.93       7.8  T
   5    -49.0824809 -0.131517E-07  0.144E-03    1.93      13.9  T
     SCC iter.                  ...        0 min,  0.008 sec
     gradient                   ...        0 min,  0.018 sec
 * total energy  :   -48.2181740 Eh     change       -0.3098591E-03 Eh
   gradient norm :     0.0022828 Eh/α   predicted    -0.3091772E-03 (  -0.22%)
   displ. norm   :     0.0180443 α      lambda       -0.1142411E-04
   maximum displ.:     0.0106295 α      in ANC's #13, #15, #10, ...

........................................................................
.............................. CYCLE    9 ..............................
........................................................................
   1    -49.0824753 -0.490825E+02  0.204E-02    1.93       0.0  T
   2    -49.0824754 -0.942409E-07  0.115E-02    1.93       1.7  T
   3    -49.0824747  0.754877E-06  0.569E-03    1.93       3.5  T
   4    -49.0824755 -0.874991E-06  0.476E-04    1.93      42.0  T
   5    -49.0824755 -0.109087E-08  0.316E-04    1.93      63.3  T
     SCC iter.                  ...        0 min,  0.008 sec
     gradient                   ...        0 min,  0.019 sec
 * total energy  :   -48.2181830 Eh     change       -0.9052369E-05 Eh
   gradient norm :     0.0015614 Eh/α   predicted    -0.5714496E-05 ( -36.87%)
   displ. norm   :     0.0612129 α      lambda       -0.1896459E-04
   maximum displ.:     0.0377280 α      in ANC's #13, #15, #16, ...

........................................................................
.............................. CYCLE   10 ..............................
........................................................................
   1    -49.0827724 -0.490828E+02  0.739E-02    1.94       0.0  T
   2    -49.0827735 -0.107739E-05  0.416E-02    1.94       1.0  T
   3    -49.0827604  0.131007E-04  0.244E-02    1.94       1.0  T
   4    -49.0827756 -0.151721E-04  0.178E-03    1.94      11.2  T
   5    -49.0827756 -0.334718E-07  0.105E-03    1.94      19.0  T
   6    -49.0827756 -0.785621E-08  0.535E-04    1.94      37.4  T
   7    -49.0827756 -0.352266E-08  0.174E-04    1.94     115.2  T
     SCC iter.                  ...        0 min,  0.010 sec
     gradient                   ...        0 min,  0.019 sec
 * total energy  :   -48.2181918 Eh     change       -0.8757881E-05 Eh
   gradient norm :     0.0012437 Eh/α   predicted    -0.9502504E-05 (   8.50%)
   displ. norm   :     0.0179748 α      lambda       -0.3908068E-05
   maximum displ.:     0.0088308 α      in ANC's #13, #15, #10, ...

........................................................................
.............................. CYCLE   11 ..............................
........................................................................
   1    -49.0831475 -0.490831E+02  0.167E-02    1.94       0.0  T
   2    -49.0831476 -0.628335E-07  0.951E-03    1.94       2.1  T
   3    -49.0831469  0.707300E-06  0.574E-03    1.94       3.5  T
   4    -49.0831477 -0.819735E-06  0.579E-04    1.94      34.5  T
   5    -49.0831477 -0.364575E-08  0.335E-04    1.94      59.7  T
     SCC iter.                  ...        0 min,  0.008 sec
     gradient                   ...        0 min,  0.019 sec
 * total energy  :   -48.2181937 Eh     change       -0.1909412E-05 Eh
   gradient norm :     0.0008592 Eh/α   predicted    -0.1955961E-05 (   2.44%)
   displ. norm   :     0.0128754 α      lambda       -0.1925328E-05
   maximum displ.:     0.0062630 α      in ANC's #15, #13, #10, ...

   *** GEOMETRY OPTIMIZATION CONVERGED AFTER 11 ITERATIONS ***

------------------------------------------------------------------------
 total energy gain   :        -0.0082121 Eh       -5.1532 kcal/mol
 total RMSD          :         0.1508995 a0        0.0799 Å
 total power (kW/mol):        -1.9600790 (step)  -46.2155 (real)
------------------------------------------------------------------------

 ANCopt (total)                0 d,  0 h,  0 min,  0.467 sec
 optimizer setup                ...        0 min,  0.000 sec (  0.025%)
 model hessian                  ...        0 min,  0.003 sec (  0.568%)
 ANC generation                 ...        0 min,  0.001 sec (  0.133%)
 coordinate transformation      ...        0 min,  0.000 sec (  0.038%)
 single point calculation       ...        0 min,  0.460 sec ( 98.504%)
 optimization log               ...        0 min,  0.001 sec (  0.225%)
 hessian update                 ...        0 min,  0.000 sec (  0.026%)
 rational function              ...        0 min,  0.002 sec (  0.342%)

================
 final structure:
================
$coord
   -4.90435987326507   -2.26416521367194    0.00459639927784      C 
   -5.72673211145933   -4.70958233326415    0.00418721780240      C 
   -4.11969619488210   -6.84092275789047    0.00181339622314      C 
   -2.91193644570243   -8.64119227814562    0.00036290654234      N 
   -8.29254484339348   -5.44590863842356    0.00539871609952      C 
  -10.33473456869590   -6.17279429981305    0.00520304022323      N 
   -2.28989646287675   -1.41918053150828    0.00321742450182      C 
   -2.21841495405529    1.26398111573157    0.00334478567574      C 
    0.01030143204914    2.60036298643220    0.00240881074961      C 
    2.27175483975042    1.23738806255538    0.00151252692525      C 
    2.18343142415749   -1.43973870080201    0.00146804720129      C 
   -0.06363656584232   -2.79358461976360    0.00224762886389      C 
    5.19941318384357   -2.72684605605314    0.00025235875713      S 
    6.52337219226263    0.26058400405942   -0.00013839324939      C 
    4.80227877186109    2.14678398277943    0.00059923610975      C 
   -4.81109906457617    2.26442944581817    0.00522687509061      C 
   -5.48079619622453    4.44667595000456    0.00505455702354      O 
   -6.50508421446973   -0.00624359325782    0.00460005807363      C 
   -9.01657444149600    0.22011212729629    0.00593322170309      C 
    0.00243262197223    4.63924442550382    0.00268977204850      H 
   -0.03352517028525   -4.82912553829780    0.00221420968473      H 
    8.54409902780174    0.42256118872533   -0.00093751362952      H 
    5.27787926178304    4.12151671634509    0.00043150416913      H 
   -9.82245760576087    2.09244402236776    0.01157543740688      H 
  -10.30216811865504   -1.35374836850017    0.01073609517214      H 
$end
           -------------------------------------------------
          |                Final Singlepoint                |
           -------------------------------------------------

          ...................................................
          :                      SETUP                      :
          :.................................................:
          :  # basis functions                  88          :
          :  # atomic orbitals                  87          :
          :  # shells                           45          :
          :  # electrons                        88          :
          :  max. iterations                   250          :
          :  Hamiltonian                  GFN2-xTB          :
          :  restarted?                      false          :
          :  GBSA solvation                  false          :
          :  PC potential                    false          :
          :  electronic temp.          300.0000000     K    :
          :  accuracy                    1.0000000          :
          :  -> integral cutoff          0.2500000E+02      :
          :  -> integral neglect         0.1000000E-07      :
          :  -> SCF convergence          0.1000000E-05 Eh   :
          :  -> wf. convergence          0.1000000E-03 e    :
          :  Broyden damping             0.4000000          :
          ...................................................

 iter      E             dE          RMSdq      gap      omega  full diag
   1    -49.0831477 -0.490831E+02  0.180E-04    1.94       0.0  T
   2    -49.0831477  0.668550E-10  0.120E-04    1.94     167.1  T
   3    -49.0831477 -0.378478E-09  0.712E-05    1.94     280.9  T

   *** convergence criteria satisfied after 3 iterations ***

         #    Occupation            Energy/Eh            Energy/eV
      -------------------------------------------------------------
         1        2.0000           -0.7591132             -20.6565
       ...           ...                  ...                  ...
        38        2.0000           -0.4613591             -12.5542
        39        2.0000           -0.4494490             -12.2301
        40        2.0000           -0.4404847             -11.9862
        41        2.0000           -0.4388834             -11.9426
        42        2.0000           -0.4242289             -11.5439
        43        2.0000           -0.4123044             -11.2194
        44        2.0000           -0.4094772             -11.1424 (HOMO)
        45                         -0.3382846              -9.2052 (LUMO)
        46                         -0.3184215              -8.6647
        47                         -0.2788792              -7.5887
        48                         -0.2504200              -6.8143
        49                         -0.2495190              -6.7898
       ...                                ...                  ...
        87                          1.1559697              31.4555
      -------------------------------------------------------------
                  HL-Gap            0.0711926 Eh            1.9372 eV
             Fermi-level           -0.3738809 Eh          -10.1738 eV

 SCC (total)                   0 d,  0 h,  0 min,  0.040 sec
 SCC setup                      ...        0 min,  0.000 sec (  0.676%)
 Dispersion                     ...        0 min,  0.000 sec (  0.890%)
 integral evaluation            ...        0 min,  0.014 sec ( 35.702%)
 zeroth order Hamiltonian       ...        0 min,  0.000 sec (  0.501%)
 iterations                     ...        0 min,  0.005 sec ( 13.068%)
 molecular gradient             ...        0 min,  0.019 sec ( 48.220%)
 printout                       ...        0 min,  0.000 sec (  0.843%)

         :::::::::::::::::::::::::::::::::::::::::::::::::::::
         ::                     SUMMARY                     ::
         :::::::::::::::::::::::::::::::::::::::::::::::::::::
         :: total energy             -48.218193661007 Eh    ::
         :: gradient norm              0.000857638672 Eh/a0 ::
         :: HOMO-LUMO gap              1.937248473930 eV    ::
         ::.................................................::
         :: SCC energy               -49.083147722794 Eh    ::
         :: -> isotropic ES            0.041162594604 Eh    ::
         :: -> anisotropic ES          0.001900603781 Eh    ::
         :: -> anisotropic XC          0.047944510457 Eh    ::
         :: -> dispersion             -0.032919069165 Eh    ::
         :: repulsion energy           0.865005469064 Eh    ::
         :: add. restraining           0.000000000000 Eh    ::
         :::::::::::::::::::::::::::::::::::::::::::::::::::::

           -------------------------------------------------
          |                Property Printout                |
           -------------------------------------------------

    * Orbital Energies and Occupations

         #    Occupation            Energy/Eh            Energy/eV
      -------------------------------------------------------------
         1        2.0000           -0.7591132             -20.6565
       ...           ...                  ...                  ...
        32        2.0000           -0.4938372             -13.4380
        33        2.0000           -0.4883812             -13.2895
        34        2.0000           -0.4811611             -13.0931
        35        2.0000           -0.4797125             -13.0536
        36        2.0000           -0.4771456             -12.9838
        37        2.0000           -0.4623301             -12.5806
        38        2.0000           -0.4613591             -12.5542
        39        2.0000           -0.4494490             -12.2301
        40        2.0000           -0.4404847             -11.9862
        41        2.0000           -0.4388834             -11.9426
        42        2.0000           -0.4242289             -11.5439
        43        2.0000           -0.4123044             -11.2194
        44        2.0000           -0.4094772             -11.1424 (HOMO)
        45                         -0.3382846              -9.2052 (LUMO)
        46                         -0.3184215              -8.6647
        47                         -0.2788792              -7.5887
        48                         -0.2504200              -6.8143
        49                         -0.2495190              -6.7898
        50                         -0.2317941              -6.3074
        51                         -0.2254580              -6.1350
        52                         -0.2044204              -5.5626
        53                         -0.2037241              -5.5436
        54                         -0.1747464              -4.7551
        55                         -0.1454842              -3.9588
       ...                                ...                  ...
        87                          1.1559697              31.4555
      -------------------------------------------------------------
                  HL-Gap            0.0711926 Eh            1.9372 eV
             Fermi-level           -0.3738809 Eh          -10.1738 eV

     #   Z        covCN         q      C6AA      α(0)
     1   6 C      3.006     0.034    27.235     8.561
     2   6 C      2.947     0.014    27.709     8.634
     3   6 C      1.938     0.124    28.039     8.551
     4   7 N      0.911    -0.224    25.887     7.359
     5   6 C      1.938     0.125    28.024     8.549
     6   7 N      0.911    -0.222    25.854     7.354
     7   6 C      3.033     0.004    27.898     8.664
     8   6 C      3.031    -0.023    28.545     8.763
     9   6 C      2.909    -0.017    28.443     8.745
    10   6 C      3.149     0.010    27.513     8.580
    11   6 C      3.009     0.035    27.207     8.556
    12   6 C      2.932    -0.034    28.851     8.809
    13  16 S      2.255     0.008   140.736    19.967
    14   6 C      2.938    -0.009    28.244     8.716
    15   6 C      3.069    -0.045    29.054     8.838
    16   6 C      2.862     0.228    23.219     7.898
    17   8 O      0.856    -0.350    20.701     6.100
    18   6 C      2.995    -0.014    28.345     8.733
    19   6 C      2.840    -0.055    29.347     8.878
    20   1 H      0.926     0.067     2.115     2.274
    21   1 H      0.926     0.064     2.148     2.292
    22   1 H      0.926     0.061     2.191     2.315
    23   1 H      0.926     0.056     2.244     2.343
    24   1 H      0.926     0.087     1.904     2.158
    25   1 H      0.926     0.075     2.028     2.227

 Mol. C6AA /au·bohr⁶  :      13055.417372
 Mol. C8AA /au·bohr⁸  :     367569.073691
 Mol. α(0) /au        :        183.863344


Wiberg/Mayer (AO) data.
largest (>0.10) Wiberg bond orders for each atom
          total WBO             WBO to atom ...
     1  C   3.976        C    2 1.523    C    7 1.110    C   18 1.081
     2  C   3.969        C    1 1.523    C    3 1.090    C    5 1.090
     3  C   3.947        N    4 2.775    C    2 1.090
     4  N   2.982        C    3 2.775
     5  C   3.947        N    6 2.776    C    2 1.090
     6  N   2.982        C    5 2.776
     7  C   3.988        C   12 1.416    C    8 1.235    C    1 1.110
     8  C   3.981        C    9 1.465    C    7 1.235    C   16 1.035
     9  C   3.986        C    8 1.465    C   10 1.326    H   20 0.962
    10  C   3.974        C    9 1.326    C   11 1.257    C   15 1.207
    11  C   3.956        C   12 1.386    C   10 1.257    S   13 1.132
    12  C   3.978        C    7 1.416    C   11 1.386    H   21 0.958
    13  S   2.576        C   14 1.168    C   11 1.132
    14  C   3.938        C   15 1.667    S   13 1.168    H   22 0.968
    15  C   3.978        C   14 1.667    C   10 1.207    H   23 0.961
    16  C   3.928        O   17 1.804    C    8 1.035    C   18 0.988
    17  O   2.069        C   16 1.804
    18  C   3.986        C   19 1.804    C    1 1.081    C   16 0.988
    19  C   3.942        C   18 1.804    H   24 0.967    H   25 0.965
    20  H   0.995        C    9 0.962
    21  H   0.995        C   12 0.958
    22  H   0.996        C   14 0.968
    23  H   0.996        C   15 0.961
    24  H   0.991        C   19 0.967
    25  H   0.994        C   19 0.965

molecular dipole:
                 x           y           z       tot (Debye)
 q only:        1.642       0.781       0.001
   full:        1.810       1.294       0.002       5.656
molecular quadrupole (traceless):
                xx          xy          yy          xz          yz          zz
 q only:        5.890      -5.524     -15.670      -0.010      -0.003       9.780
  q+dip:        7.274      -6.316     -18.405      -0.020      -0.003      11.131
   full:        3.315      -5.842     -21.462      -0.013      -0.006      18.147

           -------------------------------------------------
          |                Geometry Summary                 |
           -------------------------------------------------

      molecular mass/u    :      262.2852000
   center of mass at/Å    :       -1.0070848      -0.8028148       0.0015159
  moments of inertia/u·Å² :        0.8312896E+03   0.1982589E+04   0.2813879E+04
rotational constants/cm⁻¹ :        0.2027889E-01   0.8502836E-02   0.5990888E-02

 * 21 selected distances

     #   Z        #   Z                                     value/Å
     1   6 C      2   6 C                                 1.3652733
     3   6 C      4   7 N                                 1.1471870
     5   6 C      6   7 N                                 1.1470949
     7   6 C      8   6 C                                 1.4203719
     8   6 C      9   6 C                                 1.3751579
     9   6 C     10   6 C                                 1.3972558
    10   6 C     11   6 C                                 1.4174454
     7   6 C     12   6 C                                 1.3845062
    11   6 C     12   6 C                                 1.3882422
    11   6 C     13  16 S                                 1.7352490 (max)
    13  16 S     14   6 C                                 1.7291717
    10   6 C     15   6 C                                 1.4229411
    14   6 C     15   6 C                                 1.3512076
    16   6 C     17   8 O                                 1.2079500
    18   6 C     19   6 C                                 1.3344107
     9   6 C     20   1 H                                 1.0789377
    12   6 C     21   1 H                                 1.0772798
    14   6 C     22   1 H                                 1.0727526 (min)
    15   6 C     23   1 H                                 1.0748638
    19   6 C     24   1 H                                 1.0786790
    19   6 C     25   1 H                                 1.0753907

 * 5 distinct bonds (by element types)

   Z      Z             #   av. dist./Å        max./Å        min./Å
   1 H    6 C           6     1.0763173     1.0789377     1.0727526
   6 C    6 C          10     1.3856812     1.4229411     1.3344107
   6 C    7 N           2     1.1471409     1.1471870     1.1470949
   6 C    8 O           1     1.2079500     1.2079500     1.2079500
   6 C   16 S           2     1.7322104     1.7352490     1.7291717


optimized geometry written to: xtbopt.xyz


           -------------------------------------------------
          | TOTAL ENERGY              -48.218193661007 Eh   |
          | GRADIENT NORM               0.000857638672 Eh/α |
          | HOMO-LUMO GAP               1.937248473930 eV   |
           -------------------------------------------------

------------------------------------------------------------------------
 * finished run on 2021/02/19 at 08:12:25.740     
------------------------------------------------------------------------
 total:
 * wall-time:     0 d,  0 h,  0 min,  0.586 sec
 *  cpu-time:     0 d,  0 h,  0 min,  0.583 sec
 * ratio c/w:     0.996 speedup
 SCF:
 * wall-time:     0 d,  0 h,  0 min,  0.053 sec
 *  cpu-time:     0 d,  0 h,  0 min,  0.053 sec
 * ratio c/w:     0.998 speedup
 ANC optimizer:
 * wall-time:     0 d,  0 h,  0 min,  0.507 sec
 *  cpu-time:     0 d,  0 h,  0 min,  0.505 sec
 * ratio c/w:     0.998 speedup

