      -----------------------------------------------------------      
     |                   =====================                   |     
     |                           x T B                           |     
     |                   =====================                   |     
     |                         S. Grimme                         |     
     |          Mulliken Center for Theoretical Chemistry        |     
     |                    University of Bonn                     |     
     |                Version 6.2 RC2 (SAW190805)                |     
      -----------------------------------------------------------      

   This program is distributed in the hope that it will be useful,
   but WITHOUT ANY WARRANTY; without even the implied warranty of
   MERCHANTABILITY or FITNESS FOR A PARTICULAR PURPOSE.
   
   FOR NON-COMMERCIAL, ACADEMIA USE ONLY.
   
   Cite this work as:
   * S. Grimme, C. Bannwarth, P. Shushkov, J. Chem. Theory Comput., 2017,
     13, 1989-2009. DOI: 10.1021/acs.jctc.7b00118
   * C. Bannwarth, S. Ehlert and S. Grimme., J. Chem. Theory Comput., 2019,
     15, 1652-1671. DOI: 10.1021/acs.jctc.8b01176
   * P. Pracht, E. Caldeweyher, S. Ehlert, S. Grimme, ChemRxiv, 2019, preprint.
     DOI: 10.26434/chemrxiv.8326202.v1
   
   for DFT-D4:
   * E. Caldeweyher, C. Bannwarth and S. Grimme, J. Chem. Phys., 2017,
     147, 034112. DOI: 10.1063/1.4993215
   * E. Caldeweyher, S. Ehlert, A. Hansen, H. Neugebauer, S. Spicher,
     C. Bannwarth and S. Grimme, J. Chem. Phys., 2019, 150, 154122.
     DOI: 10.1063/1.5090222
   
   for sTDA-xTB:
   * S. Grimme and C. Bannwarth, J. Chem. Phys., 2016, 145, 054103.
     DOI: 10.1063/1.4959605
   
   in the mass-spec context:
   * V. Asgeirsson, C. Bauer and S. Grimme, Chem. Sci., 2017, 8, 4879.
     DOI: 10.1039/c7sc00601b
   
   for metadynamics refer to:
   * S. Grimme, J. Chem. Theory Comput., 2019, 155, 2847-2862
     DOI: 10.1021/acs.jctc.9b00143
   
   with help from (in alphabetical order)
   C. Bannwarth, F. Bohle, G. Brandenburg, E. Caldeweyher, M. Checinski,
   S. Dohm, S. Ehlert, S. Ehrlich, F. März, H. Neugebauer, J. Pisarek,
   P. Pracht, P. Shushkov, and S. Spicher.
   
 * started run on 2021/02/19 at 08:12:27.955     

           -------------------------------------------------
          |                Calculation Setup                |
           -------------------------------------------------

          program call               : /ihome/ghutchison/geoffh/xtb/xtb 33atl.xyz -opt
          hostname                   : smp-n135
          coordinate file            : 33atl.xyz
          omp threads                :                     1
          number of atoms            :                    25
          number of electrons        :                    94
          charge                     :                     0
          spin                       :                   0.0
          first test random number   :      0.48882537873003


########################################################################
# WARNING! Please study the warnings concerning your input carefully
#  - the use of '-opt' is discouraged, please use '--opt' next time
########################################################################

           ------------------------------------------------- 
          |                 G F N 2 - x T B                 |
          | Geometry, Frequencies, Noncovalent interactions |
          |            JCTC 2019 parametrisation            |
           ------------------------------------------------- 
             KAB for C  - Si     :                1.0500
             KAB for H  - Pd     :                0.9500
             k(s)              :                1.8500
             k(p)              :                2.2300
             k(d)              :                2.2300
             k(f)              :                2.0000
             kEN (H0ij)        :               -2.0000
             D4 a1             :                0.5200
             D4 a2             :                5.0000
             D4 s6             :                1.0000
             D4 s8             :                2.7000
             D4 s9             :                5.0000
             alphaj            :                2.0000

  Z AO/shell   Hii/eV     exponent
  1     Wed Apr 25 08:07:45 CEST 2018   EN: 2.200 GM2: 0.406  GM3: 0.0800  RAES: 1.40
     1s    -10.707211    1.230000
  6     Wed Apr 25 08:07:45 CEST 2018   EN: 2.550 GM2: 0.538  GM3: 0.1500  RAES: 3.00
     2s    -13.970922    2.096432
     2p    -10.063292    1.800000
  7     Wed Apr 25 08:07:45 CEST 2018   EN: 3.040 GM2: 0.461  GM3:-0.0640  RAES: 1.90
     2s    -16.686243    2.339881
     2p    -12.523956    2.014332
  8     Wed Apr 25 08:07:45 CEST 2018   EN: 3.440 GM2: 0.452  GM3:-0.0517  RAES: 1.80
     2s    -20.229985    2.439742
     2p    -15.503117    2.137023
 16     Tue Apr 24 11:44:34 CEST 2018   EN: 2.580 GM2: 0.340  GM3:-0.0502  RAES: 3.10
     3s    -20.029654    1.981333
     3p    -11.377694    2.025643
     3d     -0.420282    1.702555
 35     Tue Apr 24 12:21:41 CEST 2018   EN: 2.960 GM2: 0.261  GM3: 0.1300  RAES: 4.00
     4s    -23.583718    2.077587
     4p    -12.588824    2.263120
     4d      0.047980    1.845038

           ------------------------------------------------- 
          |        Self-Consistent Charge Iterations        |
           ------------------------------------------------- 

          ...................................................
          :                      SETUP                      :
          :.................................................:
          :  # basis functions                  97          :
          :  # atomic orbitals                  95          :
          :  # shells                           47          :
          :  # electrons                        94          :
          :  max. iterations                   250          :
          :  Hamiltonian                  GFN2-xTB          :
          :  restarted?                      false          :
          :  GBSA solvation                  false          :
          :  PC potential                    false          :
          :  electronic temp.          300.0000000     K    :
          :  accuracy                    1.0000000          :
          :  -> integral cutoff          0.2500000E+02      :
          :  -> integral neglect         0.1000000E-07      :
          :  -> SCF convergence          0.1000000E-05 Eh   :
          :  -> wf. convergence          0.1000000E-03 e    :
          :  Broyden damping             0.4000000          :
          ...................................................

 iter      E             dE          RMSdq      gap      omega  full diag
   1    -52.4801104 -0.524801E+02  0.685E+00    2.24       0.0  T
   2    -52.4850030 -0.489251E-02  0.467E+00    2.12       1.0  T
   3    -52.4101098  0.748932E-01  0.313E+00    1.76       1.0  T
   4    -52.5827069 -0.172597E+00  0.770E-01    1.90       1.0  T
   5    -52.5905359 -0.782905E-02  0.328E-01    1.90       1.0  T
   6    -52.5906266 -0.906651E-04  0.214E-01    1.94       1.0  T
   7    -52.5911384 -0.511869E-03  0.969E-02    1.94       1.0  T
   8    -52.5911797 -0.413062E-04  0.711E-02    1.94       1.0  T
   9    -52.5911902 -0.104676E-04  0.519E-02    1.94       1.0  T
  10    -52.5912068 -0.165519E-04  0.267E-02    1.94       1.0  T
  11    -52.5912119 -0.508874E-05  0.142E-02    1.94       1.4  T
  12    -52.5912138 -0.198200E-05  0.588E-03    1.94       3.4  T
  13    -52.5912141 -0.248460E-06  0.272E-03    1.94       7.4  T
  14    -52.5912141 -0.470641E-07  0.157E-03    1.94      12.8  T
  15    -52.5912142 -0.236953E-07  0.860E-04    1.94      23.3  T
  16    -52.5912142 -0.561180E-09  0.496E-04    1.94      40.3  T

   *** convergence criteria satisfied after 16 iterations ***

         #    Occupation            Energy/Eh            Energy/eV
      -------------------------------------------------------------
         1        2.0000           -0.8672901             -23.6002
       ...           ...                  ...                  ...
        41        2.0000           -0.4584448             -12.4749
        42        2.0000           -0.4471825             -12.1685
        43        2.0000           -0.4422073             -12.0331
        44        2.0000           -0.4415313             -12.0147
        45        2.0000           -0.4308123             -11.7230
        46        2.0000           -0.4189423             -11.4000
        47        2.0000           -0.4166721             -11.3382 (HOMO)
        48                         -0.3453457              -9.3973 (LUMO)
        49                         -0.3262796              -8.8785
        50                         -0.2939786              -7.9996
        51                         -0.2644703              -7.1966
        52                         -0.2596429              -7.0652
       ...                                ...                  ...
        95                          1.0706495              29.1339
      -------------------------------------------------------------
                  HL-Gap            0.0713264 Eh            1.9409 eV
             Fermi-level           -0.3810089 Eh          -10.3678 eV

 SCC (total)                   0 d,  0 h,  0 min,  0.068 sec
 SCC setup                      ...        0 min,  0.000 sec (  0.605%)
 Dispersion                     ...        0 min,  0.000 sec (  0.718%)
 integral evaluation            ...        0 min,  0.018 sec ( 25.819%)
 zeroth order Hamiltonian       ...        0 min,  0.000 sec (  0.480%)
 iterations                     ...        0 min,  0.027 sec ( 39.967%)
 molecular gradient             ...        0 min,  0.022 sec ( 31.752%)
 printout                       ...        0 min,  0.000 sec (  0.574%)

         :::::::::::::::::::::::::::::::::::::::::::::::::::::
         ::                     SUMMARY                     ::
         :::::::::::::::::::::::::::::::::::::::::::::::::::::
         :: total energy             -51.781559944384 Eh    ::
         :: gradient norm              0.098556885097 Eh/a0 ::
         :: HOMO-LUMO gap              1.940889301814 eV    ::
         ::.................................................::
         :: SCC energy               -52.591214157347 Eh    ::
         :: -> isotropic ES            0.043505297280 Eh    ::
         :: -> anisotropic ES          0.003201974567 Eh    ::
         :: -> anisotropic XC          0.047791016407 Eh    ::
         :: -> dispersion             -0.035003321292 Eh    ::
         :: repulsion energy           0.809822365761 Eh    ::
         :: add. restraining           0.000000000000 Eh    ::
         :::::::::::::::::::::::::::::::::::::::::::::::::::::

      ----------------------------------------------------------- 
     |                   =====================                   |
     |                        A N C O P T                        |
     |                   =====================                   |
     |               Approximate Normal Coordinate               |
     |                Rational Function Optimizer                |
      ----------------------------------------------------------- 

          ...................................................
          :                      SETUP                      :
          :.................................................:
          :   optimization level            normal          :
          :   max. optcycles                   200          :
          :   ANC micro-cycles                  20          :
          :   degrees of freedom                69          :
          :.................................................:
          :   RF solver                   davidson          :
          :   input Hessian                  false          :
          :   write xtbopt.log                true          :
          :   linear?                        false          :
          :   energy convergence         0.5000000E-05 Eh   :
          :   grad. convergence          0.1000000E-02 Eh/α :
          :   maximium RF displ.         2.0000000          :
          :   Hlow (freq-cutoff)         0.5000000E-02      :
          :   Hmax (freq-cutoff)         5.0000000          :
          :   S6 in model hess.         20.0000000          :
          ...................................................

generating ANC from model Hessian ...
Using Lindh-Hessian (1995)
 Shifting diagonal of input Hessian by   5.126491175613654E-003
 Lowest  eigenvalues of input Hessian
    0.005000   -0.000000   -0.000000    0.000000    0.000000    0.000000
    0.000000    0.005127    0.006417    0.007059    0.009529    0.009781
    0.011933    0.013880    0.015814    0.016031    0.016666    0.020721
 Highest eigenvalues
    1.931954    1.991535    2.024388    2.261743    2.520687    2.571582
 

........................................................................
.............................. CYCLE    1 ..............................
........................................................................
   1    -52.5912142 -0.525912E+02  0.288E-04    1.94       0.0  T
   2    -52.5912142 -0.959801E-10  0.234E-04    1.94      85.4  T
   3    -52.5912142 -0.257529E-09  0.185E-04    1.94     108.1  T
     SCC iter.                  ...        0 min,  0.006 sec
     gradient                   ...        0 min,  0.022 sec
 * total energy  :   -51.7815600 Eh     change       -0.6708618E-08 Eh
   gradient norm :     0.0985566 Eh/α   predicted     0.0000000E+00 (-100.00%)
   displ. norm   :     0.2852456 α      lambda       -0.1069416E-01
   maximum displ.:     0.1574400 α      in ANC's #16, #10, #18, ...

........................................................................
.............................. CYCLE    2 ..............................
........................................................................
   1    -52.6375011 -0.526375E+02  0.292E-01    1.96       0.0  T
   2    -52.6376057 -0.104607E-03  0.157E-01    1.99       1.0  T
   3    -52.6375375  0.682286E-04  0.991E-02    1.97       1.0  T
   4    -52.6376887 -0.151191E-03  0.313E-02    1.98       1.0  T
   5    -52.6376978 -0.917438E-05  0.138E-02    1.98       1.4  T
   6    -52.6376988 -0.933160E-06  0.557E-03    1.98       3.6  T
   7    -52.6376992 -0.389457E-06  0.297E-03    1.98       6.7  T
     SCC iter.                  ...        0 min,  0.012 sec
     gradient                   ...        0 min,  0.020 sec
 * total energy  :   -51.7884564 Eh     change       -0.6896470E-02 Eh
   gradient norm :     0.0382286 Eh/α   predicted    -0.5782144E-02 ( -16.16%)
   displ. norm   :     0.2437194 α      lambda       -0.2860437E-02
   maximum displ.:     0.1536829 α      in ANC's #10, #16, #5, ...

........................................................................
.............................. CYCLE    3 ..............................
........................................................................
   1    -52.6446275 -0.526446E+02  0.238E-01    1.96       0.0  T
   2    -52.6446764 -0.489482E-04  0.127E-01    1.98       1.0  T
   3    -52.6446060  0.704445E-04  0.789E-02    1.97       1.0  T
   4    -52.6447206 -0.114666E-03  0.229E-02    1.97       1.0  T
   5    -52.6447256 -0.497528E-05  0.102E-02    1.98       2.0  T
   6    -52.6447262 -0.604334E-06  0.379E-03    1.97       5.3  T
   7    -52.6447264 -0.196507E-06  0.177E-03    1.97      11.3  T
     SCC iter.                  ...        0 min,  0.012 sec
     gradient                   ...        0 min,  0.020 sec
 * total energy  :   -51.7901395 Eh     change       -0.1683118E-02 Eh
   gradient norm :     0.0108249 Eh/α   predicted    -0.1515183E-02 (  -9.98%)
   displ. norm   :     0.1398569 α      lambda       -0.4111894E-03
   maximum displ.:     0.0837687 α      in ANC's #10, #5, #15, ...

........................................................................
.............................. CYCLE    4 ..............................
........................................................................
   1    -52.6430725 -0.526431E+02  0.122E-01    1.96       0.0  T
   2    -52.6430794 -0.690109E-05  0.650E-02    1.97       1.0  T
   3    -52.6430607  0.186768E-04  0.314E-02    1.96       1.0  T
   4    -52.6430835 -0.228542E-04  0.871E-03    1.97       2.3  T
   5    -52.6430842 -0.705100E-06  0.412E-03    1.97       4.8  T
   6    -52.6430844 -0.177154E-06  0.190E-03    1.97      10.5  T
   7    -52.6430844 -0.140458E-07  0.128E-03    1.97      15.7  T
     SCC iter.                  ...        0 min,  0.012 sec
     gradient                   ...        0 min,  0.020 sec
 * total energy  :   -51.7903776 Eh     change       -0.2380944E-03 Eh
   gradient norm :     0.0067227 Eh/α   predicted    -0.2096429E-03 ( -11.95%)
   displ. norm   :     0.2994629 α      lambda       -0.7054065E-03
   maximum displ.:     0.1560308 α      in ANC's #10, #5, #15, ...

........................................................................
.............................. CYCLE    5 ..............................
........................................................................
   1    -52.6351159 -0.526351E+02  0.321E-01    1.94       0.0  T
   2    -52.6351559 -0.399875E-04  0.175E-01    1.95       1.0  T
   3    -52.6350412  0.114662E-03  0.715E-02    1.94       1.0  T
   4    -52.6351800 -0.138770E-03  0.171E-02    1.95       1.2  T
   5    -52.6351831 -0.305812E-05  0.854E-03    1.95       2.3  T
   6    -52.6351839 -0.809300E-06  0.394E-03    1.95       5.1  T
   7    -52.6351839 -0.569130E-07  0.261E-03    1.95       7.7  T
   8    -52.6351840 -0.680232E-07  0.160E-03    1.95      12.5  T
     SCC iter.                  ...        0 min,  0.014 sec
     gradient                   ...        0 min,  0.020 sec
 * total energy  :   -51.7896956 Eh     change        0.6820220E-03 Eh
   gradient norm :     0.0220173 Eh/α   predicted    -0.3843337E-03 (-156.35%)
   displ. norm   :     0.1708160 α      lambda       -0.1641833E-02
   maximum displ.:     0.0829432 α      in ANC's #10, #2, #5, ...

........................................................................
.............................. CYCLE    6 ..............................
........................................................................
   1    -52.6418392 -0.526418E+02  0.223E-01    1.97       0.0  T
   2    -52.6418588 -0.196188E-04  0.122E-01    1.97       1.0  T
   3    -52.6418246  0.342128E-04  0.423E-02    1.97       1.0  T
   4    -52.6418690 -0.443881E-04  0.102E-02    1.97       2.0  T
   5    -52.6418701 -0.109013E-05  0.459E-03    1.96       4.4  T
   6    -52.6418703 -0.175738E-06  0.224E-03    1.97       8.9  T
     SCC iter.                  ...        0 min,  0.011 sec
     gradient                   ...        0 min,  0.020 sec
 * total energy  :   -51.7905261 Eh     change       -0.8304726E-03 Eh
   gradient norm :     0.0047878 Eh/α   predicted    -0.8448730E-03 (   1.73%)
   displ. norm   :     0.0632012 α      lambda       -0.7542626E-04
   maximum displ.:     0.0418814 α      in ANC's #7, #1, #2, ...

........................................................................
.............................. CYCLE    7 ..............................
........................................................................
   1    -52.6414087 -0.526414E+02  0.102E-01    1.97       0.0  T
   2    -52.6414122 -0.355567E-05  0.564E-02    1.97       1.0  T
   3    -52.6414094  0.284159E-05  0.143E-02    1.97       1.4  T
   4    -52.6414140 -0.462976E-05  0.310E-03    1.97       6.5  T
   5    -52.6414141 -0.776625E-07  0.191E-03    1.97      10.5  T
   6    -52.6414141 -0.258024E-07  0.114E-03    1.97      17.5  T
     SCC iter.                  ...        0 min,  0.011 sec
     gradient                   ...        0 min,  0.020 sec
 * total energy  :   -51.7904381 Eh     change        0.8799332E-04 Eh
   gradient norm :     0.0056712 Eh/α   predicted    -0.3786404E-04 (-143.03%)
   displ. norm   :     0.0529991 α      lambda       -0.2322514E-03
   maximum displ.:     0.0379788 α      in ANC's #7, #1, #2, ...

........................................................................
.............................. CYCLE    8 ..............................
........................................................................
   1    -52.6419032 -0.526419E+02  0.878E-02    1.97       0.0  T
   2    -52.6419058 -0.256425E-05  0.484E-02    1.97       1.0  T
   3    -52.6419056  0.151377E-06  0.743E-03    1.97       2.7  T
   4    -52.6419070 -0.135520E-05  0.179E-03    1.97      11.2  T
   5    -52.6419070 -0.562027E-08  0.111E-03    1.97      18.0  T
     SCC iter.                  ...        0 min,  0.009 sec
     gradient                   ...        0 min,  0.020 sec
 * total energy  :   -51.7905550 Eh     change       -0.1169400E-03 Eh
   gradient norm :     0.0034530 Eh/α   predicted    -0.1164533E-03 (  -0.42%)
   displ. norm   :     0.0224011 α      lambda       -0.1477551E-04
   maximum displ.:     0.0137944 α      in ANC's #15, #5, #10, ...

........................................................................
.............................. CYCLE    9 ..............................
........................................................................
   1    -52.6421598 -0.526422E+02  0.217E-02    1.97       0.0  T
   2    -52.6421600 -0.147233E-06  0.120E-02    1.97       1.7  T
   3    -52.6421591  0.835094E-06  0.623E-03    1.97       3.2  T
   4    -52.6421601 -0.987484E-06  0.884E-04    1.97      22.6  T
   5    -52.6421601 -0.722039E-09  0.519E-04    1.97      38.5  T
     SCC iter.                  ...        0 min,  0.009 sec
     gradient                   ...        0 min,  0.022 sec
 * total energy  :   -51.7905637 Eh     change       -0.8698255E-05 Eh
   gradient norm :     0.0017412 Eh/α   predicted    -0.7396101E-05 ( -14.97%)
   displ. norm   :     0.0336028 α      lambda        0.7003061E-05
   maximum displ.:     0.0206916 α      in ANC's #15, #5, #10, ...

........................................................................
.............................. CYCLE   10 ..............................
........................................................................
   1    -52.6424683 -0.526425E+02  0.326E-02    1.97       0.0  T
   2    -52.6424686 -0.334278E-06  0.181E-02    1.97       1.1  T
   3    -52.6424667  0.189755E-05  0.944E-03    1.97       2.1  T
   4    -52.6424689 -0.224449E-05  0.133E-03    1.97      15.0  T
   5    -52.6424689  0.779181E-10  0.840E-04    1.97      23.8  T
   6    -52.6424689 -0.956543E-08  0.381E-04    1.97      52.5  T
     SCC iter.                  ...        0 min,  0.011 sec
     gradient                   ...        0 min,  0.022 sec
 * total energy  :   -51.7905538 Eh     change        0.9895640E-05 Eh
   gradient norm :     0.0072095 Eh/α   predicted     0.3503262E-05 ( -64.60%)
   displ. norm   :     0.0136005 α      lambda       -0.2212549E-04
   maximum displ.:     0.0104424 α      in ANC's #5, #22, #10, ...

........................................................................
.............................. CYCLE   11 ..............................
........................................................................
   1    -52.6424679 -0.526425E+02  0.140E-02    1.97       0.0  T
   2    -52.6424680 -0.114398E-06  0.771E-03    1.97       2.6  T
   3    -52.6424676  0.355479E-06  0.497E-03    1.97       4.0  T
   4    -52.6424681 -0.448192E-06  0.925E-04    1.97      21.6  T
   5    -52.6424681 -0.662908E-08  0.564E-04    1.97      35.5  T
     SCC iter.                  ...        0 min,  0.009 sec
     gradient                   ...        0 min,  0.020 sec
 * total energy  :   -51.7905691 Eh     change       -0.1526047E-04 Eh
   gradient norm :     0.0026921 Eh/α   predicted    -0.1106712E-04 ( -27.48%)
   displ. norm   :     0.0135962 α      lambda       -0.3426097E-05
   maximum displ.:     0.0104420 α      in ANC's #5, #22, #10, ...

........................................................................
.............................. CYCLE   12 ..............................
........................................................................
   1    -52.6424541 -0.526425E+02  0.140E-02    1.97       0.0  T
   2    -52.6424542 -0.116732E-06  0.773E-03    1.97       2.6  T
   3    -52.6424538  0.329465E-06  0.488E-03    1.97       4.1  T
   4    -52.6424543 -0.420809E-06  0.913E-04    1.97      21.9  T
   5    -52.6424543 -0.469943E-08  0.578E-04    1.97      34.6  T
     SCC iter.                  ...        0 min,  0.009 sec
     gradient                   ...        0 min,  0.022 sec
 * total energy  :   -51.7905708 Eh     change       -0.1696002E-05 Eh
   gradient norm :     0.0021960 Eh/α   predicted    -0.1715140E-05 (   1.13%)
   displ. norm   :     0.0049942 α      lambda       -0.3053290E-05
   maximum displ.:     0.0032035 α      in ANC's #5, #17, #25, ...

........................................................................
.............................. CYCLE   13 ..............................
........................................................................
   1    -52.6424899 -0.526425E+02  0.465E-03    1.97       0.0  T
   2    -52.6424899 -0.145857E-07  0.269E-03    1.97       7.4  T
   3    -52.6424899  0.404097E-07  0.165E-03    1.97      12.1  T
   4    -52.6424899 -0.510659E-07  0.361E-04    1.97      55.4  T
   5    -52.6424899 -0.902332E-09  0.235E-04    1.97      84.9  T
     SCC iter.                  ...        0 min,  0.009 sec
     gradient                   ...        0 min,  0.022 sec
 * total energy  :   -51.7905726 Eh     change       -0.1785548E-05 Eh
   gradient norm :     0.0006010 Eh/α   predicted    -0.1527528E-05 ( -14.45%)
   displ. norm   :     0.0074782 α      lambda        0.1836604E-05
   maximum displ.:     0.0048054 α      in ANC's #5, #17, #25, ...

   *** GEOMETRY OPTIMIZATION CONVERGED AFTER 13 ITERATIONS ***

------------------------------------------------------------------------
 total energy gain   :        -0.0090126 Eh       -5.6555 kcal/mol
 total RMSD          :         0.1484116 a0        0.0785 Å
 total power (kW/mol):        -1.8202047 (step)  -36.4744 (real)
------------------------------------------------------------------------

 ANCopt (total)                0 d,  0 h,  0 min,  0.649 sec
 optimizer setup                ...        0 min,  0.000 sec (  0.024%)
 model hessian                  ...        0 min,  0.003 sec (  0.455%)
 ANC generation                 ...        0 min,  0.001 sec (  0.111%)
 coordinate transformation      ...        0 min,  0.000 sec (  0.037%)
 single point calculation       ...        0 min,  0.641 sec ( 98.745%)
 optimization log               ...        0 min,  0.001 sec (  0.211%)
 hessian update                 ...        0 min,  0.000 sec (  0.024%)
 rational function              ...        0 min,  0.002 sec (  0.266%)

================
 final structure:
================
$coord
   -4.91460333057763   -2.21819838987416    0.00158579588174      C 
   -5.75111724503875   -4.65802792546814    0.00028107684133      C 
   -4.15409854636900   -6.79755704920514   -0.00143193859787      C 
   -2.94659911512003   -8.59806758614170   -0.00256543917211      N 
   -8.32258104487827   -5.37739778700879    0.00023330858235      C 
  -10.37097034842391   -6.08594634976137    0.00009113813959      N 
   -2.29275927193428   -1.39060369834286    0.00110799167687      C 
   -2.20186562383357    1.28964148794461    0.00284124080066      C 
    0.03400926921483    2.61290282263465    0.00280372384520      C 
    2.28724405487263    1.23427813178130    0.00086562237110      C 
    2.18037456148826   -1.44203139121094   -0.00097957741946      C 
   -0.07474766340660   -2.78050239796212   -0.00086221211866      C 
    5.18223876800942   -2.76984283216348   -0.00325187764033      S 
    6.52294746744329    0.24123063151330   -0.00164701204808      C 
    4.81285027712273    2.14680148676513    0.00044147364642      C 
   10.04783489029507    0.58306640094271   -0.00277211604291      Br
   -4.79155701948991    2.30962575462033    0.00437545060362      C 
   -5.44107648001682    4.49604150513184    0.00603690773284      O 
   -6.49941351440731    0.05087023730898    0.00411035248234      C 
   -9.00966848094239    0.29584739439424    0.00582329543007      C 
    0.04066001047356    4.65130484018271    0.00416415970767      H 
   -0.05813366375445   -4.81601618241419   -0.00231304975846      H 
    5.30992985067698    4.11581839621242    0.00166366791573      H 
   -9.80101023599631    2.17454750413936    0.00618209020451      H 
  -10.30736755969165   -1.26814458107244    0.00454758317523      H 
$end
           -------------------------------------------------
          |                Final Singlepoint                |
           -------------------------------------------------

          ...................................................
          :                      SETUP                      :
          :.................................................:
          :  # basis functions                  97          :
          :  # atomic orbitals                  95          :
          :  # shells                           47          :
          :  # electrons                        94          :
          :  max. iterations                   250          :
          :  Hamiltonian                  GFN2-xTB          :
          :  restarted?                      false          :
          :  GBSA solvation                  false          :
          :  PC potential                    false          :
          :  electronic temp.          300.0000000     K    :
          :  accuracy                    1.0000000          :
          :  -> integral cutoff          0.2500000E+02      :
          :  -> integral neglect         0.1000000E-07      :
          :  -> SCF convergence          0.1000000E-05 Eh   :
          :  -> wf. convergence          0.1000000E-03 e    :
          :  Broyden damping             0.4000000          :
          ...................................................

 iter      E             dE          RMSdq      gap      omega  full diag
   1    -52.6424899 -0.526425E+02  0.160E-04    1.97       0.0  T
   2    -52.6424899  0.344613E-11  0.124E-04    1.97     161.0  T
   3    -52.6424899 -0.130484E-09  0.107E-04    1.97     187.5  T

   *** convergence criteria satisfied after 3 iterations ***

         #    Occupation            Energy/Eh            Energy/eV
      -------------------------------------------------------------
         1        2.0000           -0.8677942             -23.6139
       ...           ...                  ...                  ...
        41        2.0000           -0.4560448             -12.4096
        42        2.0000           -0.4454302             -12.1208
        43        2.0000           -0.4428843             -12.0515
        44        2.0000           -0.4408609             -11.9964
        45        2.0000           -0.4300378             -11.7019
        46        2.0000           -0.4201651             -11.4333
        47        2.0000           -0.4188903             -11.3986 (HOMO)
        48                         -0.3463837              -9.4256 (LUMO)
        49                         -0.3268947              -8.8953
        50                         -0.2932052              -7.9785
        51                         -0.2626506              -7.1471
        52                         -0.2584712              -7.0334
       ...                                ...                  ...
        95                          1.1495739              31.2815
      -------------------------------------------------------------
                  HL-Gap            0.0725066 Eh            1.9730 eV
             Fermi-level           -0.3826370 Eh          -10.4121 eV

 SCC (total)                   0 d,  0 h,  0 min,  0.046 sec
 SCC setup                      ...        0 min,  0.000 sec (  0.575%)
 Dispersion                     ...        0 min,  0.000 sec (  0.900%)
 integral evaluation            ...        0 min,  0.017 sec ( 37.508%)
 zeroth order Hamiltonian       ...        0 min,  0.000 sec (  0.506%)
 iterations                     ...        0 min,  0.006 sec ( 12.889%)
 molecular gradient             ...        0 min,  0.022 sec ( 46.724%)
 printout                       ...        0 min,  0.000 sec (  0.790%)

         :::::::::::::::::::::::::::::::::::::::::::::::::::::
         ::                     SUMMARY                     ::
         :::::::::::::::::::::::::::::::::::::::::::::::::::::
         :: total energy             -51.790572561473 Eh    ::
         :: gradient norm              0.000601749695 Eh/a0 ::
         :: HOMO-LUMO gap              1.973005406149 eV    ::
         ::.................................................::
         :: SCC energy               -52.642489944820 Eh    ::
         :: -> isotropic ES            0.043291465273 Eh    ::
         :: -> anisotropic ES          0.002535772568 Eh    ::
         :: -> anisotropic XC          0.046568987226 Eh    ::
         :: -> dispersion             -0.035318854548 Eh    ::
         :: repulsion energy           0.852077074457 Eh    ::
         :: add. restraining           0.000000000000 Eh    ::
         :::::::::::::::::::::::::::::::::::::::::::::::::::::

           -------------------------------------------------
          |                Property Printout                |
           -------------------------------------------------

    * Orbital Energies and Occupations

         #    Occupation            Energy/Eh            Energy/eV
      -------------------------------------------------------------
         1        2.0000           -0.8677942             -23.6139
       ...           ...                  ...                  ...
        35        2.0000           -0.4939043             -13.4398
        36        2.0000           -0.4938530             -13.4384
        37        2.0000           -0.4872925             -13.2599
        38        2.0000           -0.4742665             -12.9054
        39        2.0000           -0.4721485             -12.8478
        40        2.0000           -0.4634436             -12.6109
        41        2.0000           -0.4560448             -12.4096
        42        2.0000           -0.4454302             -12.1208
        43        2.0000           -0.4428843             -12.0515
        44        2.0000           -0.4408609             -11.9964
        45        2.0000           -0.4300378             -11.7019
        46        2.0000           -0.4201651             -11.4333
        47        2.0000           -0.4188903             -11.3986 (HOMO)
        48                         -0.3463837              -9.4256 (LUMO)
        49                         -0.3268947              -8.8953
        50                         -0.2932052              -7.9785
        51                         -0.2626506              -7.1471
        52                         -0.2584712              -7.0334
        53                         -0.2558487              -6.9620
        54                         -0.2319947              -6.3129
        55                         -0.2300660              -6.2604
        56                         -0.2176134              -5.9216
        57                         -0.2112687              -5.7489
        58                         -0.1827919              -4.9740
       ...                                ...                  ...
        95                          1.1495739              31.2815
      -------------------------------------------------------------
                  HL-Gap            0.0725066 Eh            1.9730 eV
             Fermi-level           -0.3826370 Eh          -10.4121 eV

     #   Z        covCN         q      C6AA      α(0)
     1   6 C      3.006     0.034    27.231     8.560
     2   6 C      2.947     0.016    27.651     8.624
     3   6 C      1.937     0.124    28.038     8.551
     4   7 N      0.911    -0.220    25.792     7.345
     5   6 C      1.937     0.125    28.016     8.548
     6   7 N      0.911    -0.217    25.735     7.337
     7   6 C      3.032     0.007    27.843     8.655
     8   6 C      3.031    -0.020    28.478     8.753
     9   6 C      2.910    -0.017    28.423     8.742
    10   6 C      3.146     0.011    27.515     8.582
    11   6 C      3.007     0.031    27.299     8.571
    12   6 C      2.934    -0.033    28.826     8.805
    13  16 S      2.396     0.026   139.999    19.914
    14   6 C      2.933     0.091    25.972     8.358
    15   6 C      3.101    -0.056    29.249     8.863
    16  35 Br     1.141    -0.102   187.858    22.099
    17   6 C      2.862     0.229    23.201     7.895
    18   8 O      0.856    -0.343    20.584     6.083
    19   6 C      2.995    -0.013    28.334     8.732
    20   6 C      2.840    -0.053    29.320     8.874
    21   1 H      0.926     0.073     2.053     2.241
    22   1 H      0.926     0.068     2.109     2.271
    23   1 H      0.926     0.073     2.055     2.242
    24   1 H      0.926     0.090     1.880     2.144
    25   1 H      0.926     0.078     2.003     2.213

 Mol. C6AA /au·bohr⁶  :      15895.995186
 Mol. C8AA /au·bohr⁸  :     501421.077357
 Mol. α(0) /au        :        203.002584


Wiberg/Mayer (AO) data.
largest (>0.10) Wiberg bond orders for each atom
          total WBO             WBO to atom ...
     1  C   3.977        C    2 1.527    C    7 1.108    C   19 1.081
     2  C   3.969        C    1 1.527    C    3 1.090    C    5 1.089
     3  C   3.948        N    4 2.777    C    2 1.090
     4  N   2.983        C    3 2.777
     5  C   3.948        N    6 2.778    C    2 1.089
     6  N   2.984        C    5 2.778
     7  C   3.983        C   12 1.412    C    8 1.241    C    1 1.108
     8  C   3.981        C    9 1.466    C    7 1.241    C   17 1.030
     9  C   3.975        C    8 1.466    C   10 1.321    H   21 0.962
    10  C   3.975        C    9 1.321    C   11 1.257    C   15 1.207
    11  C   3.953        C   12 1.389    C   10 1.257    S   13 1.122
    12  C   3.974        C    7 1.412    C   11 1.389    H   22 0.957
    13  S   2.564        C   14 1.134    C   11 1.122
    14  C   3.901        C   15 1.605    S   13 1.134    Br  16 1.035
    15  C   3.973        C   14 1.605    C   10 1.207    H   23 0.958
    16  Br  1.177        C   14 1.035
    17  C   3.928        O   18 1.810    C    8 1.030    C   19 0.989
    18  O   2.075        C   17 1.810
    19  C   3.986        C   20 1.802    C    1 1.081    C   17 0.989
    20  C   3.940        C   19 1.802    H   24 0.967    H   25 0.965
    21  H   0.994        C    9 0.962
    22  H   0.995        C   12 0.957
    23  H   0.994        C   15 0.958
    24  H   0.991        C   20 0.967
    25  H   0.993        C   20 0.965

molecular dipole:
                 x           y           z       tot (Debye)
 q only:        0.682       0.672       0.000
   full:        0.542       1.057       0.000       3.018
molecular quadrupole (traceless):
                xx          xy          yy          xz          yz          zz
 q only:       -3.083      -6.026     -10.145       0.002      -0.011      13.227
  q+dip:      -10.124      -8.710      -8.651       0.005      -0.012      18.775
   full:      -12.907      -8.056     -12.298       0.009      -0.018      25.205

           -------------------------------------------------
          |                Geometry Summary                 |
           -------------------------------------------------

      molecular mass/u    :      341.1813000
   center of mass at/Å    :        0.4560432      -0.5351208      -0.0000228
  moments of inertia/u·Å² :        0.8363834E+03   0.4483944E+04   0.5320328E+04
rotational constants/cm⁻¹ :        0.2015539E-01   0.3759554E-02   0.3168533E-02

 * 21 selected distances

     #   Z        #   Z                                     value/Å
     1   6 C      2   6 C                                 1.3648799
     3   6 C      4   7 N                                 1.1472161
     5   6 C      6   7 N                                 1.1469775
     7   6 C      8   6 C                                 1.4191404
     8   6 C      9   6 C                                 1.3748588
     9   6 C     10   6 C                                 1.3978372
    10   6 C     11   6 C                                 1.4173712
     7   6 C     12   6 C                                 1.3851307
    11   6 C     12   6 C                                 1.3877244
    11   6 C     13  16 S                                 1.7369817
    13  16 S     14   6 C                                 1.7442044
    10   6 C     15   6 C                                 1.4210539
    14   6 C     15   6 C                                 1.3549043
    14   6 C     16  35 Br                                1.8740411 (max)
    17   6 C     18   8 O                                 1.2069757
    19   6 C     20   6 C                                 1.3346808
     9   6 C     21   1 H                                 1.0786820
    12   6 C     22   1 H                                 1.0771838
    15   6 C     23   1 H                                 1.0746491 (min)
    20   6 C     24   1 H                                 1.0787608
    20   6 C     25   1 H                                 1.0754277

 * 6 distinct bonds (by element types)

   Z      Z             #   av. dist./Å        max./Å        min./Å
   1 H    6 C           5     1.0769407     1.0787608     1.0746491
   6 C    6 C          10     1.3857582     1.4210539     1.3346808
   6 C    7 N           2     1.1470968     1.1472161     1.1469775
   6 C    8 O           1     1.2069757     1.2069757     1.2069757
   6 C   16 S           2     1.7405930     1.7442044     1.7369817
   6 C   35 Br          1     1.8740411     1.8740411     1.8740411


optimized geometry written to: xtbopt.xyz


           -------------------------------------------------
          | TOTAL ENERGY              -51.790572561473 Eh   |
          | GRADIENT NORM               0.000601749695 Eh/α |
          | HOMO-LUMO GAP               1.973005406149 eV   |
           -------------------------------------------------

------------------------------------------------------------------------
 * finished run on 2021/02/19 at 08:12:28.749     
------------------------------------------------------------------------
 total:
 * wall-time:     0 d,  0 h,  0 min,  0.794 sec
 *  cpu-time:     0 d,  0 h,  0 min,  0.791 sec
 * ratio c/w:     0.996 speedup
 SCF:
 * wall-time:     0 d,  0 h,  0 min,  0.068 sec
 *  cpu-time:     0 d,  0 h,  0 min,  0.068 sec
 * ratio c/w:     0.998 speedup
 ANC optimizer:
 * wall-time:     0 d,  0 h,  0 min,  0.696 sec
 *  cpu-time:     0 d,  0 h,  0 min,  0.694 sec
 * ratio c/w:     0.997 speedup

