      -----------------------------------------------------------      
     |                   =====================                   |     
     |                           x T B                           |     
     |                   =====================                   |     
     |                         S. Grimme                         |     
     |          Mulliken Center for Theoretical Chemistry        |     
     |                    University of Bonn                     |     
     |                Version 6.2 RC2 (SAW190805)                |     
      -----------------------------------------------------------      

   This program is distributed in the hope that it will be useful,
   but WITHOUT ANY WARRANTY; without even the implied warranty of
   MERCHANTABILITY or FITNESS FOR A PARTICULAR PURPOSE.
   
   FOR NON-COMMERCIAL, ACADEMIA USE ONLY.
   
   Cite this work as:
   * S. Grimme, C. Bannwarth, P. Shushkov, J. Chem. Theory Comput., 2017,
     13, 1989-2009. DOI: 10.1021/acs.jctc.7b00118
   * C. Bannwarth, S. Ehlert and S. Grimme., J. Chem. Theory Comput., 2019,
     15, 1652-1671. DOI: 10.1021/acs.jctc.8b01176
   * P. Pracht, E. Caldeweyher, S. Ehlert, S. Grimme, ChemRxiv, 2019, preprint.
     DOI: 10.26434/chemrxiv.8326202.v1
   
   for DFT-D4:
   * E. Caldeweyher, C. Bannwarth and S. Grimme, J. Chem. Phys., 2017,
     147, 034112. DOI: 10.1063/1.4993215
   * E. Caldeweyher, S. Ehlert, A. Hansen, H. Neugebauer, S. Spicher,
     C. Bannwarth and S. Grimme, J. Chem. Phys., 2019, 150, 154122.
     DOI: 10.1063/1.5090222
   
   for sTDA-xTB:
   * S. Grimme and C. Bannwarth, J. Chem. Phys., 2016, 145, 054103.
     DOI: 10.1063/1.4959605
   
   in the mass-spec context:
   * V. Asgeirsson, C. Bauer and S. Grimme, Chem. Sci., 2017, 8, 4879.
     DOI: 10.1039/c7sc00601b
   
   for metadynamics refer to:
   * S. Grimme, J. Chem. Theory Comput., 2019, 155, 2847-2862
     DOI: 10.1021/acs.jctc.9b00143
   
   with help from (in alphabetical order)
   C. Bannwarth, F. Bohle, G. Brandenburg, E. Caldeweyher, M. Checinski,
   S. Dohm, S. Ehlert, S. Ehrlich, F. März, H. Neugebauer, J. Pisarek,
   P. Pracht, P. Shushkov, and S. Spicher.
   
 * started run on 2021/02/19 at 08:12:29.726     

           -------------------------------------------------
          |                Calculation Setup                |
           -------------------------------------------------

          program call               : /ihome/ghutchison/geoffh/xtb/xtb 34atl.xyz -opt
          hostname                   : smp-n135
          coordinate file            : 34atl.xyz
          omp threads                :                     1
          number of atoms            :                    19
          number of electrons        :                    76
          charge                     :                     0
          spin                       :                   0.0
          first test random number   :      0.44952047812251


########################################################################
# WARNING! Please study the warnings concerning your input carefully
#  - the use of '-opt' is discouraged, please use '--opt' next time
########################################################################

           ------------------------------------------------- 
          |                 G F N 2 - x T B                 |
          | Geometry, Frequencies, Noncovalent interactions |
          |            JCTC 2019 parametrisation            |
           ------------------------------------------------- 
             KAB for C  - Si     :                1.0500
             KAB for H  - Pd     :                0.9500
             k(s)              :                1.8500
             k(p)              :                2.2300
             k(d)              :                2.2300
             k(f)              :                2.0000
             kEN (H0ij)        :               -2.0000
             D4 a1             :                0.5200
             D4 a2             :                5.0000
             D4 s6             :                1.0000
             D4 s8             :                2.7000
             D4 s9             :                5.0000
             alphaj            :                2.0000

  Z AO/shell   Hii/eV     exponent
  1     Wed Apr 25 08:07:45 CEST 2018   EN: 2.200 GM2: 0.406  GM3: 0.0800  RAES: 1.40
     1s    -10.707211    1.230000
  6     Wed Apr 25 08:07:45 CEST 2018   EN: 2.550 GM2: 0.538  GM3: 0.1500  RAES: 3.00
     2s    -13.970922    2.096432
     2p    -10.063292    1.800000
  7     Wed Apr 25 08:07:45 CEST 2018   EN: 3.040 GM2: 0.461  GM3:-0.0640  RAES: 1.90
     2s    -16.686243    2.339881
     2p    -12.523956    2.014332
  8     Wed Apr 25 08:07:45 CEST 2018   EN: 3.440 GM2: 0.452  GM3:-0.0517  RAES: 1.80
     2s    -20.229985    2.439742
     2p    -15.503117    2.137023
 16     Tue Apr 24 11:44:34 CEST 2018   EN: 2.580 GM2: 0.340  GM3:-0.0502  RAES: 3.10
     3s    -20.029654    1.981333
     3p    -11.377694    2.025643
     3d     -0.420282    1.702555
 17     Mon Apr 23 14:09:22 CEST 2018   EN: 3.160 GM2: 0.249  GM3: 0.1495  RAES: 2.50
     3s    -29.278781    2.485265
     3p    -12.673758    2.199650
     3d     -0.240338    2.476089

           ------------------------------------------------- 
          |        Self-Consistent Charge Iterations        |
           ------------------------------------------------- 

          ...................................................
          :                      SETUP                      :
          :.................................................:
          :  # basis functions                  79          :
          :  # atomic orbitals                  77          :
          :  # shells                           37          :
          :  # electrons                        76          :
          :  max. iterations                   250          :
          :  Hamiltonian                  GFN2-xTB          :
          :  restarted?                      false          :
          :  GBSA solvation                  false          :
          :  PC potential                    false          :
          :  electronic temp.          300.0000000     K    :
          :  accuracy                    1.0000000          :
          :  -> integral cutoff          0.2500000E+02      :
          :  -> integral neglect         0.1000000E-07      :
          :  -> SCF convergence          0.1000000E-05 Eh   :
          :  -> wf. convergence          0.1000000E-03 e    :
          :  Broyden damping             0.4000000          :
          ...................................................

 iter      E             dE          RMSdq      gap      omega  full diag
   1    -42.9549065 -0.429549E+02  0.733E+00    2.21       0.0  T
   2    -42.8109735  0.143933E+00  0.569E+00    2.15       1.0  T
   3    -42.8690370 -0.580636E-01  0.412E+00    1.94       1.0  T
   4    -43.0756540 -0.206617E+00  0.129E+00    1.99       1.0  T
   5    -43.0970665 -0.214125E-01  0.404E-01    1.96       1.0  T
   6    -43.0982652 -0.119864E-02  0.211E-01    1.99       1.0  T
   7    -43.0985909 -0.325724E-03  0.116E-01    2.01       1.0  T
   8    -43.0986521 -0.611689E-04  0.880E-02    2.00       1.0  T
   9    -43.0986968 -0.447592E-04  0.655E-02    2.00       1.0  T
  10    -43.0987130 -0.161672E-04  0.509E-02    2.00       1.0  T
  11    -43.0987347 -0.216996E-04  0.342E-02    2.00       1.0  T
  12    -43.0987469 -0.121787E-04  0.134E-02    2.00       1.7  T
  13    -43.0987480 -0.111207E-05  0.734E-03    2.00       3.1  T
  14    -43.0987485 -0.540564E-06  0.357E-03    2.00       6.4  T
  15    -43.0987486 -0.982406E-07  0.188E-03    2.00      12.2  T
  16    -43.0987486 -0.102127E-07  0.127E-03    2.00      18.0  T
  17    -43.0987486 -0.735845E-08  0.900E-04    2.00      25.5  T
  18    -43.0987486 -0.576796E-08  0.470E-04    2.00      48.8  T

   *** convergence criteria satisfied after 18 iterations ***

         #    Occupation            Energy/Eh            Energy/eV
      -------------------------------------------------------------
         1        2.0000           -1.0917555             -29.7082
       ...           ...                  ...                  ...
        32        2.0000           -0.4658294             -12.6759
        33        2.0000           -0.4566993             -12.4274
        34        2.0000           -0.4553784             -12.3915
        35        2.0000           -0.4538336             -12.3494
        36        2.0000           -0.4416079             -12.0168
        37        2.0000           -0.4272248             -11.6254
        38        2.0000           -0.4215746             -11.4716 (HOMO)
        39                         -0.3479868              -9.4692 (LUMO)
        40                         -0.3257046              -8.8629
        41                         -0.2925130              -7.9597
        42                         -0.2847932              -7.7496
        43                         -0.2823203              -7.6823
       ...                                ...                  ...
        77                          0.7230996              19.6765
      -------------------------------------------------------------
                  HL-Gap            0.0735877 Eh            2.0024 eV
             Fermi-level           -0.3847807 Eh          -10.4704 eV

 SCC (total)                   0 d,  0 h,  0 min,  0.051 sec
 SCC setup                      ...        0 min,  0.000 sec (  0.533%)
 Dispersion                     ...        0 min,  0.000 sec (  0.500%)
 integral evaluation            ...        0 min,  0.012 sec ( 23.336%)
 zeroth order Hamiltonian       ...        0 min,  0.000 sec (  0.390%)
 iterations                     ...        0 min,  0.023 sec ( 44.608%)
 molecular gradient             ...        0 min,  0.015 sec ( 29.874%)
 printout                       ...        0 min,  0.000 sec (  0.660%)

         :::::::::::::::::::::::::::::::::::::::::::::::::::::
         ::                     SUMMARY                     ::
         :::::::::::::::::::::::::::::::::::::::::::::::::::::
         :: total energy             -42.583618186466 Eh    ::
         :: gradient norm              0.343828073115 Eh/a0 ::
         :: HOMO-LUMO gap              2.002424207290 eV    ::
         ::.................................................::
         :: SCC energy               -43.098748637485 Eh    ::
         :: -> isotropic ES            0.043391373021 Eh    ::
         :: -> anisotropic ES          0.000581620983 Eh    ::
         :: -> anisotropic XC          0.043401960095 Eh    ::
         :: -> dispersion             -0.025594343935 Eh    ::
         :: repulsion energy           0.515074558180 Eh    ::
         :: add. restraining           0.000000000000 Eh    ::
         :::::::::::::::::::::::::::::::::::::::::::::::::::::

      ----------------------------------------------------------- 
     |                   =====================                   |
     |                        A N C O P T                        |
     |                   =====================                   |
     |               Approximate Normal Coordinate               |
     |                Rational Function Optimizer                |
      ----------------------------------------------------------- 

          ...................................................
          :                      SETUP                      :
          :.................................................:
          :   optimization level            normal          :
          :   max. optcycles                   200          :
          :   ANC micro-cycles                  20          :
          :   degrees of freedom                51          :
          :.................................................:
          :   RF solver                   davidson          :
          :   input Hessian                  false          :
          :   write xtbopt.log                true          :
          :   linear?                        false          :
          :   energy convergence         0.5000000E-05 Eh   :
          :   grad. convergence          0.1000000E-02 Eh/α :
          :   maximium RF displ.         2.0000000          :
          :   Hlow (freq-cutoff)         0.5000000E-02      :
          :   Hmax (freq-cutoff)         5.0000000          :
          :   S6 in model hess.         20.0000000          :
          ...................................................

generating ANC from model Hessian ...
Using Lindh-Hessian (1995)
 Shifting diagonal of input Hessian by   5.319320073546050E-003
 Lowest  eigenvalues of input Hessian
    0.005000   -0.000000   -0.000000   -0.000000    0.000000    0.000000
    0.000000    0.006521    0.007808    0.008284    0.009547    0.012216
    0.013828    0.017949    0.021075    0.022189    0.030469    0.033183
 Highest eigenvalues
    1.898964    1.947986    1.988706    2.017483    2.050580    2.300705
 

........................................................................
.............................. CYCLE    1 ..............................
........................................................................
   1    -43.0987486 -0.430987E+02  0.229E-04    2.00       0.0  T
   2    -43.0987486 -0.126811E-09  0.176E-04    2.00     130.4  T
   3    -43.0987486  0.216787E-10  0.158E-04    2.00     145.0  T
     SCC iter.                  ...        0 min,  0.004 sec
     gradient                   ...        0 min,  0.015 sec
 * total energy  :   -42.5836182 Eh     change        0.3710099E-09 Eh
   gradient norm :     0.3438268 Eh/α   predicted     0.0000000E+00 (-100.00%)
   displ. norm   :     0.4260576 α      lambda       -0.9914599E-01
   maximum displ.:     0.2441199 α      in ANC's #19, #27, #32, ...

........................................................................
.............................. CYCLE    2 ..............................
........................................................................
   1    -43.2743560 -0.432744E+02  0.661E-01    2.12       0.0  T
   2    -43.2746026 -0.246583E-03  0.407E-01    2.13       1.0  T
   3    -43.2739207  0.681866E-03  0.324E-01    2.14       1.0  T
   4    -43.2752165 -0.129580E-02  0.641E-02    2.10       1.0  T
   5    -43.2752942 -0.776338E-04  0.221E-02    2.12       1.0  T
   6    -43.2752987 -0.454679E-05  0.123E-02    2.12       1.9  T
   7    -43.2752999 -0.115604E-05  0.630E-03    2.12       3.6  T
   8    -43.2753000 -0.147261E-06  0.385E-03    2.12       6.0  T
   9    -43.2753001 -0.969351E-07  0.254E-03    2.12       9.0  T
     SCC iter.                  ...        0 min,  0.011 sec
     gradient                   ...        0 min,  0.014 sec
 * total energy  :   -42.6463777 Eh     change       -0.6275956E-01 Eh
   gradient norm :     0.0544851 Eh/α   predicted    -0.5857175E-01 (  -6.67%)
   displ. norm   :     0.3459346 α      lambda       -0.1305938E-01
   maximum displ.:     0.2404961 α      in ANC's #19, #10, #27, ...

........................................................................
.............................. CYCLE    3 ..............................
........................................................................
   1    -43.3195253 -0.433195E+02  0.323E-01    2.10       0.0  T
   2    -43.3195152  0.101054E-04  0.226E-01    2.10       1.0  T
   3    -43.3196014 -0.861691E-04  0.143E-01    2.12       1.0  T
   4    -43.3197892 -0.187838E-03  0.313E-02    2.12       1.0  T
   5    -43.3198017 -0.124473E-04  0.129E-02    2.11       1.8  T
   6    -43.3198027 -0.102790E-05  0.663E-03    2.11       3.5  T
   7    -43.3198029 -0.213743E-06  0.410E-03    2.11       5.6  T
   8    -43.3198030 -0.843820E-07  0.311E-03    2.12       7.4  T
     SCC iter.                  ...        0 min,  0.010 sec
     gradient                   ...        0 min,  0.014 sec
 * total energy  :   -42.6542370 Eh     change       -0.7859301E-02 Eh
   gradient norm :     0.0432446 Eh/α   predicted    -0.7311104E-02 (  -6.98%)
   displ. norm   :     0.2134222 α      lambda       -0.2521859E-02
   maximum displ.:     0.1497417 α      in ANC's #10, #19, #12, ...

........................................................................
.............................. CYCLE    4 ..............................
........................................................................
   1    -43.3132273 -0.433132E+02  0.230E-01    2.07       0.0  T
   2    -43.3132565 -0.292309E-04  0.144E-01    2.09       1.0  T
   3    -43.3131662  0.902969E-04  0.994E-02    2.10       1.0  T
   4    -43.3132999 -0.133647E-03  0.196E-02    2.10       1.2  T
   5    -43.3133040 -0.416857E-05  0.101E-02    2.10       2.3  T
   6    -43.3133050 -0.100320E-05  0.518E-03    2.10       4.4  T
   7    -43.3133051 -0.121943E-06  0.347E-03    2.10       6.6  T
     SCC iter.                  ...        0 min,  0.009 sec
     gradient                   ...        0 min,  0.014 sec
 * total energy  :   -42.6552249 Eh     change       -0.9878669E-03 Eh
   gradient norm :     0.0249674 Eh/α   predicted    -0.1318364E-02 (  33.46%)
   displ. norm   :     0.3229319 α      lambda       -0.1722573E-02
   maximum displ.:     0.1611408 α      in ANC's #3, #1, #10, ...

........................................................................
.............................. CYCLE    5 ..............................
........................................................................
   1    -43.2982809 -0.432983E+02  0.570E-01    2.06       0.0  T
   2    -43.2983535 -0.726012E-04  0.320E-01    2.09       1.0  T
   3    -43.2979178  0.435663E-03  0.155E-01    2.08       1.0  T
   4    -43.2984271 -0.509281E-03  0.173E-02    2.09       1.3  T
   5    -43.2984281 -0.101753E-05  0.126E-02    2.09       1.8  T
   6    -43.2984294 -0.134129E-05  0.519E-03    2.09       4.4  T
   7    -43.2984296 -0.121946E-06  0.316E-03    2.09       7.3  T
     SCC iter.                  ...        0 min,  0.008 sec
     gradient                   ...        0 min,  0.014 sec
 * total energy  :   -42.6527354 Eh     change        0.2489516E-02 Eh
   gradient norm :     0.0711236 Eh/α   predicted    -0.9511058E-03 (-138.20%)
   displ. norm   :     0.2152577 α      lambda       -0.6520048E-02
   maximum displ.:     0.1354595 α      in ANC's #1, #3, #5, ...

........................................................................
.............................. CYCLE    6 ..............................
........................................................................
   1    -43.3162663 -0.433163E+02  0.419E-01    2.12       0.0  T
   2    -43.3163248 -0.584567E-04  0.234E-01    2.12       1.0  T
   3    -43.3162326  0.921218E-04  0.766E-02    2.10       1.0  T
   4    -43.3163520 -0.119320E-03  0.144E-02    2.11       1.6  T
   5    -43.3163541 -0.208484E-05  0.623E-03    2.11       3.7  T
   6    -43.3163541 -0.605604E-07  0.367E-03    2.11       6.3  T
   7    -43.3163542 -0.128188E-06  0.114E-03    2.11      20.1  T
     SCC iter.                  ...        0 min,  0.008 sec
     gradient                   ...        0 min,  0.014 sec
 * total energy  :   -42.6556914 Eh     change       -0.2956015E-02 Eh
   gradient norm :     0.0133946 Eh/α   predicted    -0.3411081E-02 (  15.39%)
   displ. norm   :     0.1264720 α      lambda       -0.4834162E-03
   maximum displ.:     0.0907347 α      in ANC's #4, #12, #3, ...

........................................................................
.............................. CYCLE    7 ..............................
........................................................................
   1    -43.3169773 -0.433170E+02  0.287E-01    2.11       0.0  T
   2    -43.3169961 -0.188840E-04  0.159E-01    2.12       1.0  T
   3    -43.3169478  0.483605E-04  0.580E-02    2.12       1.0  T
   4    -43.3170068 -0.590408E-04  0.737E-03    2.12       3.1  T
   5    -43.3170072 -0.395816E-06  0.461E-03    2.12       5.0  T
   6    -43.3170075 -0.266640E-06  0.188E-03    2.12      12.2  T
   7    -43.3170075 -0.110046E-07  0.965E-04    2.12      23.8  T
     SCC iter.                  ...        0 min,  0.008 sec
     gradient                   ...        0 min,  0.014 sec
 * total energy  :   -42.6555538 Eh     change        0.1376166E-03 Eh
   gradient norm :     0.0194165 Eh/α   predicted    -0.2455757E-03 (-278.45%)
   displ. norm   :     0.0968333 α      lambda       -0.4944093E-03
   maximum displ.:     0.0657921 α      in ANC's #4, #6, #10, ...

........................................................................
.............................. CYCLE    8 ..............................
........................................................................
   1    -43.3146877 -0.433147E+02  0.218E-01    2.12       0.0  T
   2    -43.3146952 -0.746128E-05  0.122E-01    2.12       1.0  T
   3    -43.3146169  0.782781E-04  0.687E-02    2.11       1.0  T
   4    -43.3147071 -0.902081E-04  0.507E-03    2.12       4.5  T
   5    -43.3147074 -0.262520E-06  0.293E-03    2.12       7.8  T
   6    -43.3147075 -0.807320E-07  0.132E-03    2.12      17.4  T
     SCC iter.                  ...        0 min,  0.007 sec
     gradient                   ...        0 min,  0.014 sec
 * total energy  :   -42.6558249 Eh     change       -0.2711479E-03 Eh
   gradient norm :     0.0086072 Eh/α   predicted    -0.2495251E-03 (  -7.97%)
   displ. norm   :     0.0358428 α      lambda       -0.8566686E-04
   maximum displ.:     0.0186556 α      in ANC's #10, #6, #3, ...

........................................................................
.............................. CYCLE    9 ..............................
........................................................................
   1    -43.3165637 -0.433166E+02  0.379E-02    2.12       0.0  T
   2    -43.3165644 -0.732867E-06  0.219E-02    2.12       1.0  T
   3    -43.3165624  0.204342E-05  0.140E-02    2.12       1.6  T
   4    -43.3165650 -0.262124E-05  0.154E-03    2.12      14.9  T
   5    -43.3165650 -0.848213E-08  0.102E-03    2.12      22.5  T
     SCC iter.                  ...        0 min,  0.006 sec
     gradient                   ...        0 min,  0.014 sec
 * total energy  :   -42.6558395 Eh     change       -0.1453929E-04 Eh
   gradient norm :     0.0072576 Eh/α   predicted    -0.4289183E-04 ( 195.01%)
   displ. norm   :     0.0271653 α      lambda       -0.4240106E-04
   maximum displ.:     0.0186972 α      in ANC's #6, #12, #10, ...

........................................................................
.............................. CYCLE   10 ..............................
........................................................................
   1    -43.3158731 -0.433159E+02  0.369E-02    2.12       0.0  T
   2    -43.3158733 -0.256968E-06  0.211E-02    2.12       1.1  T
   3    -43.3158701  0.325324E-05  0.146E-02    2.12       1.6  T
   4    -43.3158739 -0.384127E-05  0.122E-03    2.12      18.8  T
   5    -43.3158739 -0.408891E-08  0.886E-04    2.12      25.9  T
   6    -43.3158739 -0.975165E-08  0.336E-04    2.12      68.3  T
     SCC iter.                  ...        0 min,  0.007 sec
     gradient                   ...        0 min,  0.014 sec
 * total energy  :   -42.6558659 Eh     change       -0.2640534E-04 Eh
   gradient norm :     0.0017135 Eh/α   predicted    -0.2121854E-04 ( -19.64%)
   displ. norm   :     0.0322767 α      lambda       -0.9438554E-05
   maximum displ.:     0.0199071 α      in ANC's #10, #6, #11, ...

........................................................................
.............................. CYCLE   11 ..............................
........................................................................
   1    -43.3160514 -0.433161E+02  0.428E-02    2.12       0.0  T
   2    -43.3160517 -0.318010E-06  0.242E-02    2.12       1.0  T
   3    -43.3160488  0.287205E-05  0.132E-02    2.12       1.7  T
   4    -43.3160522 -0.332397E-05  0.116E-03    2.12      19.8  T
   5    -43.3160522 -0.119196E-08  0.795E-04    2.12      28.9  T
   6    -43.3160522 -0.603411E-08  0.332E-04    2.12      69.1  T
     SCC iter.                  ...        0 min,  0.008 sec
     gradient                   ...        0 min,  0.015 sec
 * total energy  :   -42.6558717 Eh     change       -0.5791927E-05 Eh
   gradient norm :     0.0021823 Eh/α   predicted    -0.4726093E-05 ( -18.40%)
   displ. norm   :     0.0057438 α      lambda       -0.2366404E-05
   maximum displ.:     0.0026443 α      in ANC's #13, #3, #4, ...

........................................................................
.............................. CYCLE   12 ..............................
........................................................................
   1    -43.3162151 -0.433162E+02  0.722E-03    2.12       0.0  T
   2    -43.3162151 -0.115771E-07  0.410E-03    2.12       5.6  T
   3    -43.3162150  0.450461E-07  0.184E-03    2.12      12.5  T
   4    -43.3162151 -0.534032E-07  0.239E-04    2.12      96.0  T
   5    -43.3162151  0.242714E-09  0.187E-04    2.12     122.6  T
     SCC iter.                  ...        0 min,  0.006 sec
     gradient                   ...        0 min,  0.015 sec
 * total energy  :   -42.6558726 Eh     change       -0.9686208E-06 Eh
   gradient norm :     0.0007131 Eh/α   predicted    -0.1186488E-05 (  22.49%)
   displ. norm   :     0.0085038 α      lambda        0.3421047E-05
   maximum displ.:     0.0039674 α      in ANC's #13, #3, #4, ...

   *** GEOMETRY OPTIMIZATION CONVERGED AFTER 12 ITERATIONS ***

------------------------------------------------------------------------
 total energy gain   :        -0.0722545 Eh      -45.3404 kcal/mol
 total RMSD          :         0.2348641 a0        0.1243 Å
 total power (kW/mol):       -15.8086722 (step) -452.1791 (real)
------------------------------------------------------------------------

 ANCopt (total)                0 d,  0 h,  0 min,  0.420 sec
 optimizer setup                ...        0 min,  0.000 sec (  0.033%)
 model hessian                  ...        0 min,  0.002 sec (  0.448%)
 ANC generation                 ...        0 min,  0.001 sec (  0.127%)
 coordinate transformation      ...        0 min,  0.000 sec (  0.037%)
 single point calculation       ...        0 min,  0.413 sec ( 98.494%)
 optimization log               ...        0 min,  0.001 sec (  0.239%)
 hessian update                 ...        0 min,  0.000 sec (  0.032%)
 rational function              ...        0 min,  0.002 sec (  0.415%)

================
 final structure:
================
$coord
   -0.13120035852781    1.12895653515405    0.00073052317818      C 
   -2.50224939048764    2.13162715239175    0.00365654342935      C 
   -4.77143986146228   -0.20324104075428    0.00192235898644      S 
   -2.49127275986947   -2.59477882471565   -0.00224785245669      C 
   -3.31947357833891   -5.68484060622142   -0.00567383583619      Cl
   -0.12195529582928   -1.58227501836110   -0.00287458258284      C 
    2.48515044073441   -2.51790164896401   -0.00733837359775      C 
    3.24477880376250   -4.66479146944986   -0.00889405755112      O 
    4.09375567545652   -0.16981548954855   -0.00838349329176      C 
    2.44033324937433    2.05494668569062   -0.00047773016940      C 
    3.14157249231049    4.53554342803798    0.00831218415662      C 
    1.33216756368813    6.49839149924922    0.02103551070564      C 
   -0.11829696191730    8.10789538833908    0.03176247373933      N 
    5.65917575917469    5.41401848219574    0.00996833577124      C 
    7.66788140976914    6.22898996750598    0.01108589984742      N 
    6.61212271849677   -0.30026354481989   -0.01890727829691      C 
   -3.07164157148194    4.07585377418915    0.00613438722744      H 
    7.49573648544908   -2.13689086444270   -0.02712357169272      H 
    7.82744899448188    1.32927917917906   -0.02470609860380      H 
$end
           -------------------------------------------------
          |                Final Singlepoint                |
           -------------------------------------------------

          ...................................................
          :                      SETUP                      :
          :.................................................:
          :  # basis functions                  79          :
          :  # atomic orbitals                  77          :
          :  # shells                           37          :
          :  # electrons                        76          :
          :  max. iterations                   250          :
          :  Hamiltonian                  GFN2-xTB          :
          :  restarted?                      false          :
          :  GBSA solvation                  false          :
          :  PC potential                    false          :
          :  electronic temp.          300.0000000     K    :
          :  accuracy                    1.0000000          :
          :  -> integral cutoff          0.2500000E+02      :
          :  -> integral neglect         0.1000000E-07      :
          :  -> SCF convergence          0.1000000E-05 Eh   :
          :  -> wf. convergence          0.1000000E-03 e    :
          :  Broyden damping             0.4000000          :
          ...................................................

 iter      E             dE          RMSdq      gap      omega  full diag
   1    -43.3162151 -0.433162E+02  0.745E-05    2.12       0.0  T
   2    -43.3162151  0.233058E-11  0.475E-05    2.12     483.1  T
   3    -43.3162151 -0.169393E-10  0.396E-05    2.12     579.1  T

   *** convergence criteria satisfied after 3 iterations ***

         #    Occupation            Energy/Eh            Energy/eV
      -------------------------------------------------------------
         1        2.0000           -1.0927506             -29.7353
       ...           ...                  ...                  ...
        32        2.0000           -0.4590946             -12.4926
        33        2.0000           -0.4552043             -12.3867
        34        2.0000           -0.4527463             -12.3199
        35        2.0000           -0.4460581             -12.1379
        36        2.0000           -0.4402862             -11.9808
        37        2.0000           -0.4245244             -11.5519
        38        2.0000           -0.4238006             -11.5322 (HOMO)
        39                         -0.3458130              -9.4101 (LUMO)
        40                         -0.3235800              -8.8051
        41                         -0.2844316              -7.7398
        42                         -0.2583491              -7.0300
        43                         -0.2528959              -6.8816
       ...                                ...                  ...
        77                          1.1498069              31.2878
      -------------------------------------------------------------
                  HL-Gap            0.0779876 Eh            2.1221 eV
             Fermi-level           -0.3848068 Eh          -10.4711 eV

 SCC (total)                   0 d,  0 h,  0 min,  0.032 sec
 SCC setup                      ...        0 min,  0.000 sec (  0.567%)
 Dispersion                     ...        0 min,  0.000 sec (  0.445%)
 integral evaluation            ...        0 min,  0.012 sec ( 36.234%)
 zeroth order Hamiltonian       ...        0 min,  0.000 sec (  0.544%)
 iterations                     ...        0 min,  0.004 sec ( 13.056%)
 molecular gradient             ...        0 min,  0.015 sec ( 47.931%)
 printout                       ...        0 min,  0.000 sec (  1.073%)

         :::::::::::::::::::::::::::::::::::::::::::::::::::::
         ::                     SUMMARY                     ::
         :::::::::::::::::::::::::::::::::::::::::::::::::::::
         :: total energy             -42.655872666701 Eh    ::
         :: gradient norm              0.000711655645 Eh/a0 ::
         :: HOMO-LUMO gap              2.122149554301 eV    ::
         ::.................................................::
         :: SCC energy               -43.316215099682 Eh    ::
         :: -> isotropic ES            0.043681349089 Eh    ::
         :: -> anisotropic ES         -0.000045984145 Eh    ::
         :: -> anisotropic XC          0.039399599876 Eh    ::
         :: -> dispersion             -0.026010326889 Eh    ::
         :: repulsion energy           0.660279297555 Eh    ::
         :: add. restraining           0.000000000000 Eh    ::
         :::::::::::::::::::::::::::::::::::::::::::::::::::::

           -------------------------------------------------
          |                Property Printout                |
           -------------------------------------------------

    * Orbital Energies and Occupations

         #    Occupation            Energy/Eh            Energy/eV
      -------------------------------------------------------------
         1        2.0000           -1.0927506             -29.7353
       ...           ...                  ...                  ...
        26        2.0000           -0.5085899             -13.8394
        27        2.0000           -0.5069712             -13.7954
        28        2.0000           -0.4997559             -13.5991
        29        2.0000           -0.4979401             -13.5496
        30        2.0000           -0.4879249             -13.2771
        31        2.0000           -0.4828438             -13.1388
        32        2.0000           -0.4590946             -12.4926
        33        2.0000           -0.4552043             -12.3867
        34        2.0000           -0.4527463             -12.3199
        35        2.0000           -0.4460581             -12.1379
        36        2.0000           -0.4402862             -11.9808
        37        2.0000           -0.4245244             -11.5519
        38        2.0000           -0.4238006             -11.5322 (HOMO)
        39                         -0.3458130              -9.4101 (LUMO)
        40                         -0.3235800              -8.8051
        41                         -0.2844316              -7.7398
        42                         -0.2583491              -7.0300
        43                         -0.2528959              -6.8816
        44                         -0.2328469              -6.3361
        45                         -0.2161023              -5.8804
        46                         -0.1971689              -5.3652
        47                         -0.1907441              -5.1904
        48                         -0.1654074              -4.5010
        49                         -0.1380518              -3.7566
       ...                                ...                  ...
        77                          1.1498069              31.2878
      -------------------------------------------------------------
                  HL-Gap            0.0779876 Eh            2.1221 eV
             Fermi-level           -0.3848068 Eh          -10.4711 eV

     #   Z        covCN         q      C6AA      α(0)
     1   6 C      3.226    -0.006    27.386     8.503
     2   6 C      2.923    -0.028    28.697     8.785
     3  16 S      2.399     0.089   137.451    19.732
     4   6 C      2.888     0.106    25.665     8.306
     5  17 Cl     1.005    -0.078   101.580    15.419
     6   6 C      3.230    -0.045    28.265     8.633
     7   6 C      2.852     0.238    23.040     7.867
     8   8 O      0.856    -0.339    20.508     6.072
     9   6 C      3.004    -0.010    28.257     8.720
    10   6 C      3.002     0.039    27.122     8.543
    11   6 C      2.947     0.015    27.670     8.628
    12   6 C      1.930     0.122    28.089     8.559
    13   7 N      0.911    -0.218    25.753     7.340
    14   6 C      1.925     0.125    28.020     8.549
    15   7 N      0.911    -0.216    25.704     7.333
    16   6 C      2.840    -0.053    29.313     8.873
    17   1 H      0.926     0.088     1.902     2.157
    18   1 H      0.926     0.092     1.859     2.132
    19   1 H      0.926     0.079     1.986     2.204

 Mol. C6AA /au·bohr⁶  :       9612.180400
 Mol. C8AA /au·bohr⁸  :     289863.579916
 Mol. α(0) /au        :        156.351724


Wiberg/Mayer (AO) data.
largest (>0.10) Wiberg bond orders for each atom
          total WBO             WBO to atom ...
     1  C   3.985        C    2 1.549    C    6 1.150    C   10 1.109
     2  C   3.934        C    1 1.549    S    3 1.207    H   17 0.960
     3  S   2.666        C    2 1.207    C    4 1.155
     4  C   3.902        C    6 1.513    S    3 1.155    Cl   5 1.055
     5  Cl  1.248        C    4 1.055
     6  C   3.973        C    4 1.513    C    1 1.150    C    7 1.040
     7  C   3.939        O    8 1.807    C    6 1.040    C    9 0.981
     8  O   2.096        C    7 1.807
     9  C   3.987        C   16 1.805    C   10 1.079    C    7 0.981
    10  C   3.985        C   11 1.524    C    1 1.109    C    9 1.079
    11  C   3.986        C   10 1.524    C   14 1.093    C   12 1.089
    12  C   3.949        N   13 2.784    C   11 1.089
    13  N   2.994        C   12 2.784
    14  C   3.949        N   15 2.780    C   11 1.093
    15  N   2.985        C   14 2.780
    16  C   3.938        C    9 1.805    H   18 0.966    H   19 0.965
    17  H   0.992        C    2 0.960
    18  H   0.990        C   16 0.966
    19  H   0.993        C   16 0.965

molecular dipole:
                 x           y           z       tot (Debye)
 q only:       -0.834      -0.066      -0.007
   full:       -0.869      -0.833      -0.009       3.058
molecular quadrupole (traceless):
                xx          xy          yy          xz          yz          zz
 q only:        9.481      -4.983     -19.205      -0.047      -0.082       9.724
  q+dip:        7.018      -4.427     -18.627      -0.059      -0.103      11.610
   full:        2.918      -3.777     -19.456      -0.040      -0.120      16.538

           -------------------------------------------------
          |                Geometry Summary                 |
           -------------------------------------------------

      molecular mass/u    :      246.6705000
   center of mass at/Å    :        0.3127536       0.2075645       0.0006736
  moments of inertia/u·Å² :        0.6580491E+03   0.1599375E+04   0.2257421E+04
rotational constants/cm⁻¹ :        0.2561759E-01   0.1054014E-01   0.7467653E-02

 * 15 selected distances

     #   Z        #   Z                                     value/Å
     1   6 C      2   6 C                                 1.3622826
     2   6 C      3  16 S                                 1.7229444
     3  16 S      4   6 C                                 1.7485791 (max)
     4   6 C      5  17 Cl                                1.6929050
     1   6 C      6   6 C                                 1.4347317
     4   6 C      6   6 C                                 1.3634742
     7   6 C      8   8 O                                 1.2051045
     1   6 C     10   6 C                                 1.4463339
    10   6 C     11   6 C                                 1.3641256
    12   6 C     13   7 N                                 1.1465533
    14   6 C     15   7 N                                 1.1471164
     9   6 C     16   6 C                                 1.3344608
     2   6 C     17   1 H                                 1.0720550 (min)
    16   6 C     18   1 H                                 1.0785407
    16   6 C     19   1 H                                 1.0757356

 * 6 distinct bonds (by element types)

   Z      Z             #   av. dist./Å        max./Å        min./Å
   1 H    6 C           3     1.0754438     1.0785407     1.0720550
   6 C    6 C           6     1.3842348     1.4463339     1.3344608
   6 C    7 N           2     1.1468349     1.1471164     1.1465533
   6 C    8 O           1     1.2051045     1.2051045     1.2051045
   6 C   16 S           2     1.7357618     1.7485791     1.7229444
   6 C   17 Cl          1     1.6929050     1.6929050     1.6929050


optimized geometry written to: xtbopt.xyz


           -------------------------------------------------
          | TOTAL ENERGY              -42.655872666701 Eh   |
          | GRADIENT NORM               0.000711655645 Eh/α |
          | HOMO-LUMO GAP               2.122149554301 eV   |
           -------------------------------------------------

------------------------------------------------------------------------
 * finished run on 2021/02/19 at 08:12:30.259     
------------------------------------------------------------------------
 total:
 * wall-time:     0 d,  0 h,  0 min,  0.533 sec
 *  cpu-time:     0 d,  0 h,  0 min,  0.525 sec
 * ratio c/w:     0.984 speedup
 SCF:
 * wall-time:     0 d,  0 h,  0 min,  0.051 sec
 *  cpu-time:     0 d,  0 h,  0 min,  0.051 sec
 * ratio c/w:     0.997 speedup
 ANC optimizer:
 * wall-time:     0 d,  0 h,  0 min,  0.452 sec
 *  cpu-time:     0 d,  0 h,  0 min,  0.451 sec
 * ratio c/w:     0.998 speedup

