      -----------------------------------------------------------      
     |                   =====================                   |     
     |                           x T B                           |     
     |                   =====================                   |     
     |                         S. Grimme                         |     
     |          Mulliken Center for Theoretical Chemistry        |     
     |                    University of Bonn                     |     
     |                Version 6.2 RC2 (SAW190805)                |     
      -----------------------------------------------------------      

   This program is distributed in the hope that it will be useful,
   but WITHOUT ANY WARRANTY; without even the implied warranty of
   MERCHANTABILITY or FITNESS FOR A PARTICULAR PURPOSE.
   
   FOR NON-COMMERCIAL, ACADEMIA USE ONLY.
   
   Cite this work as:
   * S. Grimme, C. Bannwarth, P. Shushkov, J. Chem. Theory Comput., 2017,
     13, 1989-2009. DOI: 10.1021/acs.jctc.7b00118
   * C. Bannwarth, S. Ehlert and S. Grimme., J. Chem. Theory Comput., 2019,
     15, 1652-1671. DOI: 10.1021/acs.jctc.8b01176
   * P. Pracht, E. Caldeweyher, S. Ehlert, S. Grimme, ChemRxiv, 2019, preprint.
     DOI: 10.26434/chemrxiv.8326202.v1
   
   for DFT-D4:
   * E. Caldeweyher, C. Bannwarth and S. Grimme, J. Chem. Phys., 2017,
     147, 034112. DOI: 10.1063/1.4993215
   * E. Caldeweyher, S. Ehlert, A. Hansen, H. Neugebauer, S. Spicher,
     C. Bannwarth and S. Grimme, J. Chem. Phys., 2019, 150, 154122.
     DOI: 10.1063/1.5090222
   
   for sTDA-xTB:
   * S. Grimme and C. Bannwarth, J. Chem. Phys., 2016, 145, 054103.
     DOI: 10.1063/1.4959605
   
   in the mass-spec context:
   * V. Asgeirsson, C. Bauer and S. Grimme, Chem. Sci., 2017, 8, 4879.
     DOI: 10.1039/c7sc00601b
   
   for metadynamics refer to:
   * S. Grimme, J. Chem. Theory Comput., 2019, 155, 2847-2862
     DOI: 10.1021/acs.jctc.9b00143
   
   with help from (in alphabetical order)
   C. Bannwarth, F. Bohle, G. Brandenburg, E. Caldeweyher, M. Checinski,
   S. Dohm, S. Ehlert, S. Ehrlich, F. März, H. Neugebauer, J. Pisarek,
   P. Pracht, P. Shushkov, and S. Spicher.
   
 * started run on 2021/02/19 at 08:12:32.520     

           -------------------------------------------------
          |                Calculation Setup                |
           -------------------------------------------------

          program call               : /ihome/ghutchison/geoffh/xtb/xtb 36u.xyz -opt
          hostname                   : smp-n135
          coordinate file            : 36u.xyz
          omp threads                :                     1
          number of atoms            :                    15
          number of electrons        :                    48
          charge                     :                     0
          spin                       :                   0.0
          first test random number   :      0.11778449547090


########################################################################
# WARNING! Please study the warnings concerning your input carefully
#  - the use of '-opt' is discouraged, please use '--opt' next time
########################################################################

           ------------------------------------------------- 
          |                 G F N 2 - x T B                 |
          | Geometry, Frequencies, Noncovalent interactions |
          |            JCTC 2019 parametrisation            |
           ------------------------------------------------- 
             KAB for C  - Si     :                1.0500
             KAB for H  - Pd     :                0.9500
             k(s)              :                1.8500
             k(p)              :                2.2300
             k(d)              :                2.2300
             k(f)              :                2.0000
             kEN (H0ij)        :               -2.0000
             D4 a1             :                0.5200
             D4 a2             :                5.0000
             D4 s6             :                1.0000
             D4 s8             :                2.7000
             D4 s9             :                5.0000
             alphaj            :                2.0000

  Z AO/shell   Hii/eV     exponent
  1     Wed Apr 25 08:07:45 CEST 2018   EN: 2.200 GM2: 0.406  GM3: 0.0800  RAES: 1.40
     1s    -10.707211    1.230000
  6     Wed Apr 25 08:07:45 CEST 2018   EN: 2.550 GM2: 0.538  GM3: 0.1500  RAES: 3.00
     2s    -13.970922    2.096432
     2p    -10.063292    1.800000
 16     Tue Apr 24 11:44:34 CEST 2018   EN: 2.580 GM2: 0.340  GM3:-0.0502  RAES: 3.10
     3s    -20.029654    1.981333
     3p    -11.377694    2.025643
     3d     -0.420282    1.702555

           ------------------------------------------------- 
          |        Self-Consistent Charge Iterations        |
           ------------------------------------------------- 

          ...................................................
          :                      SETUP                      :
          :.................................................:
          :  # basis functions                  60          :
          :  # atomic orbitals                  57          :
          :  # shells                           27          :
          :  # electrons                        48          :
          :  max. iterations                   250          :
          :  Hamiltonian                  GFN2-xTB          :
          :  restarted?                      false          :
          :  GBSA solvation                  false          :
          :  PC potential                    false          :
          :  electronic temp.          300.0000000     K    :
          :  accuracy                    1.0000000          :
          :  -> integral cutoff          0.2500000E+02      :
          :  -> integral neglect         0.1000000E-07      :
          :  -> SCF convergence          0.1000000E-05 Eh   :
          :  -> wf. convergence          0.1000000E-03 e    :
          :  Broyden damping             0.4000000          :
          ...................................................

 iter      E             dE          RMSdq      gap      omega  full diag
   1    -25.8678935 -0.258679E+02  0.519E+00    3.33       0.0  T
   2    -25.8932041 -0.253107E-01  0.281E+00    2.93       1.0  T
   3    -25.8934838 -0.279696E-03  0.839E-01    2.84       1.0  T
   4    -25.8955413 -0.205749E-02  0.379E-01    2.81       1.0  T
   5    -25.8953183  0.223072E-03  0.226E-01    2.85       1.0  T
   6    -25.8957657 -0.447478E-03  0.635E-02    2.82       1.0  T
   7    -25.8957936 -0.278273E-04  0.318E-02    2.83       1.0  T
   8    -25.8957944 -0.833364E-06  0.196E-02    2.83       1.3  T
   9    -25.8957959 -0.151064E-05  0.102E-02    2.83       2.5  T
  10    -25.8957963 -0.400746E-06  0.256E-03    2.83      10.1  T
  11    -25.8957963 -0.537345E-08  0.907E-04    2.83      28.5  T
  12    -25.8957963 -0.288056E-08  0.347E-04    2.83      74.4  T

   *** convergence criteria satisfied after 12 iterations ***

         #    Occupation            Energy/Eh            Energy/eV
      -------------------------------------------------------------
         1        2.0000           -0.7413678             -20.1736
       ...           ...                  ...                  ...
        18        2.0000           -0.4688857             -12.7590
        19        2.0000           -0.4653420             -12.6626
        20        2.0000           -0.4502395             -12.2516
        21        2.0000           -0.4240266             -11.5384
        22        2.0000           -0.4166916             -11.3388
        23        2.0000           -0.3722440             -10.1293
        24        2.0000           -0.3634338              -9.8895 (HOMO)
        25                         -0.2593766              -7.0580 (LUMO)
        26                         -0.2268189              -6.1721
        27                         -0.2157729              -5.8715
        28                         -0.2047672              -5.5720
        29                         -0.1903349              -5.1793
       ...                                ...                  ...
        57                          0.6685240              18.1915
      -------------------------------------------------------------
                  HL-Gap            0.1040572 Eh            2.8315 eV
             Fermi-level           -0.3114052 Eh           -8.4738 eV

 SCC (total)                   0 d,  0 h,  0 min,  0.029 sec
 SCC setup                      ...        0 min,  0.000 sec (  0.785%)
 Dispersion                     ...        0 min,  0.000 sec (  0.543%)
 integral evaluation            ...        0 min,  0.007 sec ( 24.981%)
 zeroth order Hamiltonian       ...        0 min,  0.000 sec (  0.431%)
 iterations                     ...        0 min,  0.010 sec ( 36.106%)
 molecular gradient             ...        0 min,  0.010 sec ( 35.969%)
 printout                       ...        0 min,  0.000 sec (  1.005%)

         :::::::::::::::::::::::::::::::::::::::::::::::::::::
         ::                     SUMMARY                     ::
         :::::::::::::::::::::::::::::::::::::::::::::::::::::
         :: total energy             -25.613187691888 Eh    ::
         :: gradient norm              0.042512375183 Eh/a0 ::
         :: HOMO-LUMO gap              2.831541004353 eV    ::
         ::.................................................::
         :: SCC energy               -25.895796319333 Eh    ::
         :: -> isotropic ES            0.003616433952 Eh    ::
         :: -> anisotropic ES          0.002146069925 Eh    ::
         :: -> anisotropic XC          0.014020585639 Eh    ::
         :: -> dispersion             -0.017693358327 Eh    ::
         :: repulsion energy           0.282557880011 Eh    ::
         :: add. restraining           0.000000000000 Eh    ::
         :::::::::::::::::::::::::::::::::::::::::::::::::::::

      ----------------------------------------------------------- 
     |                   =====================                   |
     |                        A N C O P T                        |
     |                   =====================                   |
     |               Approximate Normal Coordinate               |
     |                Rational Function Optimizer                |
      ----------------------------------------------------------- 

          ...................................................
          :                      SETUP                      :
          :.................................................:
          :   optimization level            normal          :
          :   max. optcycles                   200          :
          :   ANC micro-cycles                  20          :
          :   degrees of freedom                39          :
          :.................................................:
          :   RF solver                   davidson          :
          :   input Hessian                  false          :
          :   write xtbopt.log                true          :
          :   linear?                        false          :
          :   energy convergence         0.5000000E-05 Eh   :
          :   grad. convergence          0.1000000E-02 Eh/α :
          :   maximium RF displ.         2.0000000          :
          :   Hlow (freq-cutoff)         0.5000000E-02      :
          :   Hmax (freq-cutoff)         5.0000000          :
          :   S6 in model hess.         20.0000000          :
          ...................................................

generating ANC from model Hessian ...
Using Lindh-Hessian (1995)
 Shifting diagonal of input Hessian by   1.295927808768992E-005
 Lowest  eigenvalues of input Hessian
   -0.000000   -0.000000   -0.000000   -0.000000    0.000000    0.000000
    0.005000    0.005243    0.014903    0.019047    0.025609    0.030263
    0.033778    0.042378    0.046482    0.053141    0.061804    0.072324
 Highest eigenvalues
    1.221343    1.360796    1.488719    1.665840    1.755012    1.822098
 

........................................................................
.............................. CYCLE    1 ..............................
........................................................................
   1    -25.8957963 -0.258958E+02  0.129E-04    2.83       0.0  T
   2    -25.8957963 -0.807603E-10  0.612E-05    2.83     421.8  T
   3    -25.8957963 -0.176641E-10  0.380E-05    2.83     679.6  T
     SCC iter.                  ...        0 min,  0.003 sec
     gradient                   ...        0 min,  0.010 sec
 * total energy  :   -25.6131877 Eh     change        0.1546347E-08 Eh
   gradient norm :     0.0425123 Eh/α   predicted     0.0000000E+00 (-100.00%)
   displ. norm   :     0.3903504 α      lambda       -0.4926096E-02
   maximum displ.:     0.3067342 α      in ANC's #2, #1, #3, ...

........................................................................
.............................. CYCLE    2 ..............................
........................................................................
   1    -25.9062488 -0.259062E+02  0.648E-01    2.90       0.0  T
   2    -25.9063287 -0.799106E-04  0.310E-01    2.87       1.0  T
   3    -25.9063055  0.231517E-04  0.742E-02    2.88       1.0  T
   4    -25.9063485 -0.429818E-04  0.385E-02    2.87       1.0  T
   5    -25.9063529 -0.435800E-05  0.118E-02    2.87       2.2  T
   6    -25.9063536 -0.708870E-06  0.393E-03    2.87       6.6  T
   7    -25.9063536 -0.523312E-07  0.262E-03    2.87       9.9  T
     SCC iter.                  ...        0 min,  0.006 sec
     gradient                   ...        0 min,  0.010 sec
 * total energy  :   -25.6165011 Eh     change       -0.3313440E-02 Eh
   gradient norm :     0.0205279 Eh/α   predicted    -0.2838354E-02 ( -14.34%)
   displ. norm   :     0.3283877 α      lambda       -0.1936581E-02
   maximum displ.:     0.2434979 α      in ANC's #2, #3, #1, ...

........................................................................
.............................. CYCLE    3 ..............................
........................................................................
   1    -25.9111609 -0.259112E+02  0.580E-01    2.92       0.0  T
   2    -25.9112268 -0.658676E-04  0.270E-01    2.89       1.0  T
   3    -25.9112090  0.177334E-04  0.645E-02    2.90       1.0  T
   4    -25.9112445 -0.355068E-04  0.308E-02    2.89       1.0  T
   5    -25.9112466 -0.202519E-05  0.110E-02    2.89       2.3  T
   6    -25.9112472 -0.641413E-06  0.295E-03    2.89       8.7  T
   7    -25.9112472 -0.495205E-08  0.183E-03    2.89      14.1  T
     SCC iter.                  ...        0 min,  0.005 sec
     gradient                   ...        0 min,  0.010 sec
 * total energy  :   -25.6178935 Eh     change       -0.1392335E-02 Eh
   gradient norm :     0.0114942 Eh/α   predicted    -0.1072706E-02 ( -22.96%)
   displ. norm   :     0.3749462 α      lambda       -0.1306744E-02
   maximum displ.:     0.3068059 α      in ANC's #2, #3, #1, ...

........................................................................
.............................. CYCLE    4 ..............................
........................................................................
   1    -25.9106659 -0.259107E+02  0.499E-01    2.90       0.0  T
   2    -25.9107080 -0.420777E-04  0.235E-01    2.88       1.0  T
   3    -25.9107022  0.577348E-05  0.531E-02    2.89       1.0  T
   4    -25.9107167 -0.144869E-04  0.298E-02    2.88       1.0  T
   5    -25.9107197 -0.305804E-05  0.874E-03    2.89       3.0  T
   6    -25.9107203 -0.526755E-06  0.282E-03    2.89       9.1  T
   7    -25.9107203 -0.337664E-08  0.146E-03    2.89      17.7  T
     SCC iter.                  ...        0 min,  0.005 sec
     gradient                   ...        0 min,  0.010 sec
 * total energy  :   -25.6188812 Eh     change       -0.9877163E-03 Eh
   gradient norm :     0.0121057 Eh/α   predicted    -0.7452305E-03 ( -24.55%)
   displ. norm   :     0.3443631 α      lambda       -0.1019621E-02
   maximum displ.:     0.2957487 α      in ANC's #2, #3, #1, ...

........................................................................
.............................. CYCLE    5 ..............................
........................................................................
   1    -25.9105178 -0.259105E+02  0.398E-01    2.88       0.0  T
   2    -25.9105448 -0.270048E-04  0.191E-01    2.88       1.0  T
   3    -25.9105501 -0.525156E-05  0.351E-02    2.89       1.0  T
   4    -25.9105484  0.166239E-05  0.199E-02    2.88       1.3  T
   5    -25.9105509 -0.249240E-05  0.531E-03    2.88       4.9  T
   6    -25.9105511 -0.246859E-06  0.243E-03    2.88      10.6  T
   7    -25.9105511 -0.822451E-08  0.110E-03    2.88      23.5  T
     SCC iter.                  ...        0 min,  0.005 sec
     gradient                   ...        0 min,  0.010 sec
 * total energy  :   -25.6196695 Eh     change       -0.7882883E-03 Eh
   gradient norm :     0.0114320 Eh/α   predicted    -0.5702603E-03 ( -27.66%)
   displ. norm   :     0.3893861 α      lambda       -0.9239744E-03
   maximum displ.:     0.3268812 α      in ANC's #2, #3, #7, ...

........................................................................
.............................. CYCLE    6 ..............................
........................................................................
   1    -25.9102463 -0.259102E+02  0.459E-01    2.88       0.0  T
   2    -25.9102874 -0.411073E-04  0.219E-01    2.89       1.0  T
   3    -25.9102929 -0.548442E-05  0.393E-02    2.89       1.0  T
   4    -25.9102919  0.957841E-06  0.270E-02    2.89       1.0  T
   5    -25.9102973 -0.535068E-05  0.523E-03    2.89       4.9  T
   6    -25.9102974 -0.170170E-06  0.236E-03    2.89      10.9  T
   7    -25.9102974  0.232306E-08  0.155E-03    2.89      16.6  T
     SCC iter.                  ...        0 min,  0.006 sec
     gradient                   ...        0 min,  0.010 sec
 * total energy  :   -25.6203629 Eh     change       -0.6934526E-03 Eh
   gradient norm :     0.0116876 Eh/α   predicted    -0.5320295E-03 ( -23.28%)
   displ. norm   :     0.3850742 α      lambda       -0.7676894E-03
   maximum displ.:     0.3058975 α      in ANC's #2, #3, #1, ...

........................................................................
.............................. CYCLE    7 ..............................
........................................................................
   1    -25.9118944 -0.259119E+02  0.540E-01    2.89       0.0  T
   2    -25.9119524 -0.580352E-04  0.257E-01    2.90       1.0  T
   3    -25.9119603 -0.789134E-05  0.423E-02    2.90       1.0  T
   4    -25.9119615 -0.121140E-05  0.284E-02    2.90       1.0  T
   5    -25.9119667 -0.518729E-05  0.499E-03    2.90       5.2  T
   6    -25.9119669 -0.174097E-06  0.212E-03    2.90      12.2  T
   7    -25.9119669 -0.120333E-08  0.109E-03    2.90      23.7  T
     SCC iter.                  ...        0 min,  0.005 sec
     gradient                   ...        0 min,  0.010 sec
 * total energy  :   -25.6208585 Eh     change       -0.4955726E-03 Eh
   gradient norm :     0.0120773 Eh/α   predicted    -0.4407684E-03 ( -11.06%)
   displ. norm   :     0.2860661 α      lambda       -0.4879802E-03
   maximum displ.:     0.2185342 α      in ANC's #2, #3, #1, ...

........................................................................
.............................. CYCLE    8 ..............................
........................................................................
   1    -25.9122018 -0.259122E+02  0.433E-01    2.90       0.0  T
   2    -25.9122454 -0.436055E-04  0.203E-01    2.91       1.0  T
   3    -25.9122535 -0.811656E-05  0.315E-02    2.90       1.0  T
   4    -25.9122544 -0.885569E-06  0.176E-02    2.91       1.5  T
   5    -25.9122546 -0.182034E-06  0.719E-03    2.91       3.6  T
   6    -25.9122552 -0.587439E-06  0.162E-03    2.91      15.9  T
   7    -25.9122552 -0.353184E-08  0.799E-04    2.91      32.3  T
     SCC iter.                  ...        0 min,  0.005 sec
     gradient                   ...        0 min,  0.010 sec
 * total energy  :   -25.6211065 Eh     change       -0.2480436E-03 Eh
   gradient norm :     0.0086057 Eh/α   predicted    -0.2639556E-03 (   6.41%)
   displ. norm   :     0.1795444 α      lambda       -0.4138985E-03
   maximum displ.:     0.1469156 α      in ANC's #1, #2, #7, ...

........................................................................
.............................. CYCLE    9 ..............................
........................................................................
   1    -25.9171696 -0.259172E+02  0.374E-01    2.91       0.0  T
   2    -25.9171983 -0.286424E-04  0.176E-01    2.92       1.0  T
   3    -25.9172012 -0.291172E-05  0.304E-02    2.92       1.0  T
   4    -25.9172034 -0.227435E-05  0.199E-02    2.92       1.3  T
   5    -25.9172050 -0.159096E-05  0.639E-03    2.92       4.0  T
   6    -25.9172054 -0.319109E-06  0.161E-03    2.92      16.0  T
   7    -25.9172054 -0.585213E-08  0.106E-03    2.92      24.3  T
     SCC iter.                  ...        0 min,  0.006 sec
     gradient                   ...        0 min,  0.010 sec
 * total energy  :   -25.6213371 Eh     change       -0.2305943E-03 Eh
   gradient norm :     0.0087733 Eh/α   predicted    -0.2136183E-03 (  -7.36%)
   displ. norm   :     0.2789485 α      lambda       -0.3597802E-03
   maximum displ.:     0.1801845 α      in ANC's #1, #3, #2, ...

........................................................................
.............................. CYCLE   10 ..............................
........................................................................
   1    -25.9141422 -0.259141E+02  0.460E-01    2.93       0.0  T
   2    -25.9141895 -0.472410E-04  0.220E-01    2.93       1.0  T
   3    -25.9141957 -0.625054E-05  0.382E-02    2.93       1.0  T
   4    -25.9141987 -0.295596E-05  0.241E-02    2.93       1.1  T
   5    -25.9142009 -0.223512E-05  0.689E-03    2.94       3.7  T
   6    -25.9142014 -0.472168E-06  0.201E-03    2.93      12.8  T
   7    -25.9142014  0.392575E-08  0.115E-03    2.93      22.4  T
     SCC iter.                  ...        0 min,  0.005 sec
     gradient                   ...        0 min,  0.010 sec
 * total energy  :   -25.6214698 Eh     change       -0.1326364E-03 Eh
   gradient norm :     0.0147020 Eh/α   predicted    -0.1938843E-03 (  46.18%)
   displ. norm   :     0.1543286 α      lambda       -0.5046295E-03
   maximum displ.:     0.1194956 α      in ANC's #1, #2, #5, ...

........................................................................
.............................. CYCLE   11 ..............................
........................................................................
   1    -25.9156677 -0.259157E+02  0.300E-01    2.94       0.0  T
   2    -25.9156856 -0.179290E-04  0.144E-01    2.94       1.0  T
   3    -25.9156827  0.291727E-05  0.334E-02    2.94       1.0  T
   4    -25.9156900 -0.725346E-05  0.180E-02    2.94       1.4  T
   5    -25.9156909 -0.934775E-06  0.381E-03    2.94       6.8  T
   6    -25.9156910 -0.115342E-06  0.158E-03    2.94      16.4  T
   7    -25.9156910 -0.795838E-08  0.928E-04    2.94      27.8  T
     SCC iter.                  ...        0 min,  0.005 sec
     gradient                   ...        0 min,  0.010 sec
 * total energy  :   -25.6218418 Eh     change       -0.3720137E-03 Eh
   gradient norm :     0.0105760 Eh/α   predicted    -0.2583236E-03 ( -30.56%)
   displ. norm   :     0.4235902 α      lambda       -0.7653181E-03
   maximum displ.:     0.3635785 α      in ANC's #1, #3, #27, ...

........................................................................
.............................. CYCLE   12 ..............................
........................................................................
   1    -25.9138449 -0.259138E+02  0.929E-01    2.95       0.0  T
   2    -25.9140289 -0.183972E-03  0.438E-01    2.95       1.0  T
   3    -25.9140663 -0.374116E-04  0.664E-02    2.96       1.0  T
   4    -25.9140592  0.703307E-05  0.410E-02    2.95       1.0  T
   5    -25.9140715 -0.122191E-04  0.941E-03    2.96       2.7  T
   6    -25.9140723 -0.827074E-06  0.354E-03    2.96       7.3  T
   7    -25.9140723 -0.104495E-07  0.187E-03    2.96      13.8  T
   8    -25.9140723 -0.221261E-07  0.726E-04    2.96      35.6  T
     SCC iter.                  ...        0 min,  0.006 sec
     gradient                   ...        0 min,  0.010 sec
 * total energy  :   -25.6224112 Eh     change       -0.5694460E-03 Eh
   gradient norm :     0.0111741 Eh/α   predicted    -0.4513164E-03 ( -20.74%)
   displ. norm   :     0.4677489 α      lambda       -0.6439271E-03
   maximum displ.:     0.4023719 α      in ANC's #1, #5, #27, ...

........................................................................
.............................. CYCLE   13 ..............................
........................................................................
   1    -25.9091610 -0.259092E+02  0.945E-01    2.95       0.0  T
   2    -25.9093443 -0.183321E-03  0.445E-01    2.96       1.0  T
   3    -25.9093691 -0.248614E-04  0.758E-02    2.96       1.0  T
   4    -25.9093752 -0.602331E-05  0.509E-02    2.96       1.0  T
   5    -25.9093890 -0.138598E-04  0.105E-02    2.96       2.5  T
   6    -25.9093900 -0.943641E-06  0.359E-03    2.96       7.2  T
   7    -25.9093900  0.160934E-09  0.176E-03    2.96      14.7  T
   8    -25.9093900 -0.208351E-07  0.705E-04    2.96      36.6  T
     SCC iter.                  ...        0 min,  0.006 sec
     gradient                   ...        0 min,  0.010 sec
 * total energy  :   -25.6228128 Eh     change       -0.4015980E-03 Eh
   gradient norm :     0.0150328 Eh/α   predicted    -0.3924076E-03 (  -2.29%)
   displ. norm   :     0.2417239 α      lambda       -0.7023494E-03
   maximum displ.:     0.1466503 α      in ANC's #1, #2, #6, ...

........................................................................
.............................. CYCLE   14 ..............................
........................................................................
   1    -25.9129342 -0.259129E+02  0.365E-01    2.96       0.0  T
   2    -25.9129729 -0.386947E-04  0.173E-01    2.97       1.0  T
   3    -25.9129278  0.450915E-04  0.717E-02    2.96       1.0  T
   4    -25.9129914 -0.635963E-04  0.240E-02    2.97       1.1  T
   5    -25.9129928 -0.136370E-05  0.774E-03    2.97       3.3  T
   6    -25.9129928 -0.754344E-07  0.234E-03    2.97      11.0  T
   7    -25.9129929 -0.130842E-07  0.136E-03    2.97      18.9  T
     SCC iter.                  ...        0 min,  0.005 sec
     gradient                   ...        0 min,  0.010 sec
 * total energy  :   -25.6230603 Eh     change       -0.2474394E-03 Eh
   gradient norm :     0.0140708 Eh/α   predicted    -0.3716942E-03 (  50.22%)
   displ. norm   :     0.3435120 α      lambda       -0.8199684E-03
   maximum displ.:     0.2411378 α      in ANC's #1, #2, #7, ...

........................................................................
.............................. CYCLE   15 ..............................
........................................................................
   1    -25.9129140 -0.259129E+02  0.724E-01    2.99       0.0  T
   2    -25.9130181 -0.104114E-03  0.338E-01    2.99       1.0  T
   3    -25.9130353 -0.172163E-04  0.506E-02    2.99       1.0  T
   4    -25.9130351  0.246246E-06  0.358E-02    2.99       1.0  T
   5    -25.9130437 -0.868148E-05  0.489E-03    2.99       5.3  T
   6    -25.9130438 -0.757611E-07  0.238E-03    2.99      10.8  T
   7    -25.9130438 -0.728815E-08  0.903E-04    2.99      28.6  T
     SCC iter.                  ...        0 min,  0.005 sec
     gradient                   ...        0 min,  0.010 sec
 * total energy  :   -25.6235135 Eh     change       -0.4532386E-03 Eh
   gradient norm :     0.0133329 Eh/α   predicted    -0.4583682E-03 (   1.13%)
   displ. norm   :     0.1060500 α      lambda       -0.3171928E-03
   maximum displ.:     0.0781396 α      in ANC's #1, #24, #8, ...

........................................................................
.............................. CYCLE   16 ..............................
........................................................................
   1    -25.9153706 -0.259154E+02  0.231E-01    2.99       0.0  T
   2    -25.9153804 -0.979049E-05  0.108E-01    3.00       1.0  T
   3    -25.9153823 -0.183971E-05  0.166E-02    3.00       1.6  T
   4    -25.9153824 -0.174372E-06  0.978E-03    3.00       2.6  T
   5    -25.9153826 -0.117929E-06  0.345E-03    3.00       7.5  T
   6    -25.9153827 -0.117305E-06  0.111E-03    3.00      23.3  T
   7    -25.9153827 -0.597116E-08  0.574E-04    3.00      45.0  T
     SCC iter.                  ...        0 min,  0.006 sec
     gradient                   ...        0 min,  0.010 sec
 * total energy  :   -25.6237302 Eh     change       -0.2166556E-03 Eh
   gradient norm :     0.0075138 Eh/α   predicted    -0.1603797E-03 ( -25.97%)
   displ. norm   :     0.3738585 α      lambda       -0.3517192E-03
   maximum displ.:     0.3052098 α      in ANC's #1, #6, #27, ...

........................................................................
.............................. CYCLE   17 ..............................
........................................................................
   1    -25.9128315 -0.259128E+02  0.794E-01    2.99       0.0  T
   2    -25.9129491 -0.117604E-03  0.370E-01    3.00       1.0  T
   3    -25.9129712 -0.220943E-04  0.555E-02    3.00       1.0  T
   4    -25.9129662  0.496583E-05  0.377E-02    3.00       1.0  T
   5    -25.9129765 -0.102895E-04  0.799E-03    3.00       3.2  T
   6    -25.9129770 -0.491621E-06  0.281E-03    3.00       9.2  T
   7    -25.9129770  0.240107E-08  0.145E-03    3.00      17.9  T
     SCC iter.                  ...        0 min,  0.006 sec
     gradient                   ...        0 min,  0.010 sec
 * total energy  :   -25.6239181 Eh     change       -0.1879128E-03 Eh
   gradient norm :     0.0092180 Eh/α   predicted    -0.2004451E-03 (   6.67%)
   displ. norm   :     0.1230080 α      lambda       -0.3459841E-03
   maximum displ.:     0.0572663 α      in ANC's #1, #2, #24, ...

........................................................................
.............................. CYCLE   18 ..............................
........................................................................
   1    -25.9196627 -0.259197E+02  0.263E-01    3.02       0.0  T
   2    -25.9196759 -0.132386E-04  0.122E-01    3.02       1.0  T
   3    -25.9196773 -0.140931E-05  0.217E-02    3.02       1.2  T
   4    -25.9196783 -0.998377E-06  0.138E-02    3.02       1.9  T
   5    -25.9196789 -0.580553E-06  0.494E-03    3.02       5.2  T
   6    -25.9196791 -0.207425E-06  0.136E-03    3.02      19.0  T
   7    -25.9196791 -0.122772E-08  0.656E-04    3.02      39.3  T
     SCC iter.                  ...        0 min,  0.006 sec
     gradient                   ...        0 min,  0.010 sec
 * total energy  :   -25.6239902 Eh     change       -0.7208690E-04 Eh
   gradient norm :     0.0090092 Eh/α   predicted    -0.1756110E-03 ( 143.61%)
   displ. norm   :     0.2010403 α      lambda       -0.2722116E-03
   maximum displ.:     0.1544418 α      in ANC's #1, #7, #6, ...

........................................................................
.............................. CYCLE   19 ..............................
........................................................................
   1    -25.9169256 -0.259169E+02  0.415E-01    3.02       0.0  T
   2    -25.9169572 -0.316250E-04  0.195E-01    3.02       1.0  T
   3    -25.9169564  0.835014E-06  0.388E-02    3.02       1.0  T
   4    -25.9169644 -0.800748E-05  0.220E-02    3.02       1.2  T
   5    -25.9169659 -0.152363E-05  0.383E-03    3.02       6.7  T
   6    -25.9169660 -0.755672E-07  0.164E-03    3.02      15.7  T
   7    -25.9169660  0.399478E-09  0.981E-04    3.02      26.3  T
     SCC iter.                  ...        0 min,  0.006 sec
     gradient                   ...        0 min,  0.010 sec
 * total energy  :   -25.6241497 Eh     change       -0.1594961E-03 Eh
   gradient norm :     0.0047846 Eh/α   predicted    -0.1416072E-03 ( -11.22%)
   displ. norm   :     0.1217895 α      lambda       -0.6378218E-04
   maximum displ.:     0.0950748 α      in ANC's #1, #7, #6, ...

........................................................................
.............................. CYCLE   20 ..............................
........................................................................
   1    -25.9157888 -0.259158E+02  0.258E-01    3.01       0.0  T
   2    -25.9158008 -0.120631E-04  0.121E-01    3.01       1.0  T
   3    -25.9157996  0.121744E-05  0.262E-02    3.01       1.0  T
   4    -25.9158036 -0.397031E-05  0.142E-02    3.01       1.8  T
   5    -25.9158042 -0.615409E-06  0.217E-03    3.01      11.9  T
   6    -25.9158042 -0.254291E-07  0.100E-03    3.01      25.7  T
     SCC iter.                  ...        0 min,  0.005 sec
     gradient                   ...        0 min,  0.010 sec
 * total energy  :   -25.6241867 Eh     change       -0.3703567E-04 Eh
   gradient norm :     0.0042265 Eh/α   predicted    -0.3236292E-04 ( -12.62%)
   displ. norm   :     0.0608421 α      lambda       -0.3915425E-04
   maximum displ.:     0.0332101 α      in ANC's #1, #2, #7, ...
 * RMSD in coord.:     0.9114534 α      energy gain  -0.1099900E-01 Eh

generating ANC from model Hessian ...
Using Lindh-Hessian (1995)
 Shifting diagonal of input Hessian by   5.489352023880104E-004
 Lowest  eigenvalues of input Hessian
   -0.000000   -0.000000    0.000000    0.000000    0.000000    0.000000
    0.005000    0.006289    0.016905    0.019742    0.021172    0.028977
    0.036137    0.038926    0.053221    0.059636    0.059774    0.067363
 Highest eigenvalues
    1.228160    1.364969    1.512995    1.682318    1.794057    1.852343
 

........................................................................
.............................. CYCLE   21 ..............................
........................................................................
   1    -25.9170304 -0.259170E+02  0.121E-01    3.03       0.0  T
   2    -25.9170333 -0.291918E-05  0.572E-02    3.02       1.0  T
   3    -25.9170303  0.301857E-05  0.197E-02    3.02       1.3  T
   4    -25.9170346 -0.433365E-05  0.639E-03    3.02       4.0  T
   5    -25.9170346  0.795597E-08  0.250E-03    3.02      10.3  T
   6    -25.9170347 -0.565799E-07  0.717E-04    3.02      36.0  T
   7    -25.9170347 -0.325311E-08  0.386E-04    3.02      66.9  T
     SCC iter.                  ...        0 min,  0.005 sec
     gradient                   ...        0 min,  0.010 sec
 * total energy  :   -25.6242062 Eh     change       -0.1955037E-04 Eh
   gradient norm :     0.0019769 Eh/α   predicted     0.0000000E+00 (-100.00%)
   displ. norm   :     0.0547708 α      lambda       -0.1646564E-04
   maximum displ.:     0.0420524 α      in ANC's #1, #2, #3, ...

........................................................................
.............................. CYCLE   22 ..............................
........................................................................
   1    -25.9175564 -0.259176E+02  0.104E-01    3.02       0.0  T
   2    -25.9175587 -0.234556E-05  0.494E-02    3.02       1.0  T
   3    -25.9175591 -0.382970E-06  0.858E-03    3.02       3.0  T
   4    -25.9175590  0.130773E-06  0.576E-03    3.02       4.5  T
   5    -25.9175593 -0.291176E-06  0.998E-04    3.02      25.9  T
   6    -25.9175593 -0.609285E-08  0.454E-04    3.02      56.8  T
     SCC iter.                  ...        0 min,  0.005 sec
     gradient                   ...        0 min,  0.010 sec
 * total energy  :   -25.6242147 Eh     change       -0.8499972E-05 Eh
   gradient norm :     0.0007253 Eh/α   predicted    -0.8243249E-05 (  -3.02%)
   displ. norm   :     0.0152707 α      lambda       -0.4930251E-05
   maximum displ.:     0.0098501 α      in ANC's #6, #5, #2, ...

........................................................................
.............................. CYCLE   23 ..............................
........................................................................
   1    -25.9176435 -0.259176E+02  0.569E-02    3.02       0.0  T
   2    -25.9176441 -0.657150E-06  0.265E-02    3.02       1.0  T
   3    -25.9176443 -0.152512E-06  0.333E-03    3.02       7.7  T
   4    -25.9176443  0.166844E-07  0.132E-03    3.02      19.6  T
   5    -25.9176443 -0.188185E-07  0.324E-04    3.02      79.6  T
   6    -25.9176443 -0.733497E-09  0.123E-04    3.02     209.6  T
     SCC iter.                  ...        0 min,  0.005 sec
     gradient                   ...        0 min,  0.010 sec
 * total energy  :   -25.6242182 Eh     change       -0.3447966E-05 Eh
   gradient norm :     0.0004081 Eh/α   predicted    -0.2466650E-05 ( -28.46%)
   displ. norm   :     0.0104909 α      lambda       -0.1029902E-05
   maximum displ.:     0.0081897 α      in ANC's #1, #4, #5, ...

   *** GEOMETRY OPTIMIZATION CONVERGED AFTER 23 ITERATIONS ***

------------------------------------------------------------------------
 total energy gain   :        -0.0110305 Eh       -6.9217 kcal/mol
 total RMSD          :         0.9223582 a0        0.4881 Å
 total power (kW/mol):        -1.2591553 (step)  -54.5737 (real)
------------------------------------------------------------------------

 ANCopt (total)                0 d,  0 h,  0 min,  0.531 sec
 optimizer setup                ...        0 min,  0.000 sec (  0.025%)
 model hessian                  ...        0 min,  0.004 sec (  0.680%)
 ANC generation                 ...        0 min,  0.001 sec (  0.139%)
 coordinate transformation      ...        0 min,  0.000 sec (  0.054%)
 single point calculation       ...        0 min,  0.519 sec ( 97.872%)
 optimization log               ...        0 min,  0.002 sec (  0.295%)
 hessian update                 ...        0 min,  0.000 sec (  0.041%)
 rational function              ...        0 min,  0.003 sec (  0.633%)

================
 final structure:
================
$coord
    3.16579249651093   -2.27052137500456    0.52812963480250      C 
    0.77923813098394   -1.33319218449904    0.29963285132824      C 
    0.78160064309585    1.28965807097791   -0.31099548886062      C 
   -1.86428262630024    3.24097068253454   -0.82889408836798      S 
   -4.34243606089497    1.30544182339141    0.58396766989288      C 
   -4.36622735532436   -1.32898684281395   -0.52411364698320      C 
   -1.86541532823508   -3.28589155230585    0.81828339914809      S 
    3.16955438937198    2.22444246216749   -0.53633370993145      C 
    5.44386628017704   -0.02406585085396   -0.00091946207775      S 
    3.68647502148340   -4.17050509448927    0.98898785775724      H 
   -6.09128176853028    2.30357785251593    0.15122944503644      H 
   -4.06695642874006    1.25733669219501    2.62603561453177      H 
   -4.14647186571401   -1.28170538264526   -2.57239069828836      H 
   -6.10944858782432   -2.31613330129712   -0.04282100419759      H 
    3.69295091069871    4.12380294261771   -0.99687290189809      H 
$end
           -------------------------------------------------
          |                Final Singlepoint                |
           -------------------------------------------------

          ...................................................
          :                      SETUP                      :
          :.................................................:
          :  # basis functions                  60          :
          :  # atomic orbitals                  57          :
          :  # shells                           27          :
          :  # electrons                        48          :
          :  max. iterations                   250          :
          :  Hamiltonian                  GFN2-xTB          :
          :  restarted?                      false          :
          :  GBSA solvation                  false          :
          :  PC potential                    false          :
          :  electronic temp.          300.0000000     K    :
          :  accuracy                    1.0000000          :
          :  -> integral cutoff          0.2500000E+02      :
          :  -> integral neglect         0.1000000E-07      :
          :  -> SCF convergence          0.1000000E-05 Eh   :
          :  -> wf. convergence          0.1000000E-03 e    :
          :  Broyden damping             0.4000000          :
          ...................................................

 iter      E             dE          RMSdq      gap      omega  full diag
   1    -25.9176443 -0.259176E+02  0.626E-05    3.02       0.0  T
   2    -25.9176443 -0.468603E-11  0.412E-05    3.02     627.4  T
   3    -25.9176443 -0.254374E-10  0.163E-05    3.02    1588.1  T

   *** convergence criteria satisfied after 3 iterations ***

         #    Occupation            Energy/Eh            Energy/eV
      -------------------------------------------------------------
         1        2.0000           -0.7398895             -20.1334
       ...           ...                  ...                  ...
        18        2.0000           -0.4678361             -12.7305
        19        2.0000           -0.4633828             -12.6093
        20        2.0000           -0.4458549             -12.1323
        21        2.0000           -0.4247660             -11.5585
        22        2.0000           -0.4231009             -11.5132
        23        2.0000           -0.3726827             -10.1412
        24        2.0000           -0.3663257              -9.9682 (HOMO)
        25                         -0.2552915              -6.9468 (LUMO)
        26                         -0.2256756              -6.1409
        27                         -0.2159381              -5.8760
        28                         -0.2130965              -5.7987
        29                         -0.1890431              -5.1441
       ...                                ...                  ...
        57                          0.6691420              18.2083
      -------------------------------------------------------------
                  HL-Gap            0.1110342 Eh            3.0214 eV
             Fermi-level           -0.3108086 Eh           -8.4575 eV

 SCC (total)                   0 d,  0 h,  0 min,  0.021 sec
 SCC setup                      ...        0 min,  0.000 sec (  0.753%)
 Dispersion                     ...        0 min,  0.000 sec (  0.434%)
 integral evaluation            ...        0 min,  0.007 sec ( 33.122%)
 zeroth order Hamiltonian       ...        0 min,  0.000 sec (  0.559%)
 iterations                     ...        0 min,  0.003 sec ( 13.972%)
 molecular gradient             ...        0 min,  0.010 sec ( 49.647%)
 printout                       ...        0 min,  0.000 sec (  1.269%)

         :::::::::::::::::::::::::::::::::::::::::::::::::::::
         ::                     SUMMARY                     ::
         :::::::::::::::::::::::::::::::::::::::::::::::::::::
         :: total energy             -25.624218190424 Eh    ::
         :: gradient norm              0.000408197825 Eh/a0 ::
         :: HOMO-LUMO gap              3.021394292870 eV    ::
         ::.................................................::
         :: SCC energy               -25.917644302928 Eh    ::
         :: -> isotropic ES            0.003800943493 Eh    ::
         :: -> anisotropic ES          0.001386976296 Eh    ::
         :: -> anisotropic XC          0.014295496994 Eh    ::
         :: -> dispersion             -0.017826145433 Eh    ::
         :: repulsion energy           0.293378467686 Eh    ::
         :: add. restraining           0.000000000000 Eh    ::
         :::::::::::::::::::::::::::::::::::::::::::::::::::::

           -------------------------------------------------
          |                Property Printout                |
           -------------------------------------------------

    * Orbital Energies and Occupations

         #    Occupation            Energy/Eh            Energy/eV
      -------------------------------------------------------------
         1        2.0000           -0.7398895             -20.1334
       ...           ...                  ...                  ...
        12        2.0000           -0.5312024             -14.4548
        13        2.0000           -0.5129408             -13.9578
        14        2.0000           -0.5043835             -13.7250
        15        2.0000           -0.4951944             -13.4749
        16        2.0000           -0.4824034             -13.1269
        17        2.0000           -0.4731297             -12.8745
        18        2.0000           -0.4678361             -12.7305
        19        2.0000           -0.4633828             -12.6093
        20        2.0000           -0.4458549             -12.1323
        21        2.0000           -0.4247660             -11.5585
        22        2.0000           -0.4231009             -11.5132
        23        2.0000           -0.3726827             -10.1412
        24        2.0000           -0.3663257              -9.9682 (HOMO)
        25                         -0.2552915              -6.9468 (LUMO)
        26                         -0.2256756              -6.1409
        27                         -0.2159381              -5.8760
        28                         -0.2130965              -5.7987
        29                         -0.1890431              -5.1441
        30                         -0.1615905              -4.3971
        31                         -0.1285526              -3.4981
        32                         -0.1133329              -3.0839
        33                         -0.0350937              -0.9549
        34                         -0.0174127              -0.4738
        35                         -0.0117549              -0.3199
       ...                                ...                  ...
        57                          0.6691420              18.2083
      -------------------------------------------------------------
                  HL-Gap            0.1110342 Eh            3.0214 eV
             Fermi-level           -0.3108086 Eh           -8.4575 eV

     #   Z        covCN         q      C6AA      α(0)
     1   6 C      2.991    -0.037    28.913     8.820
     2   6 C      3.164     0.031    26.975     8.488
     3   6 C      3.164     0.031    26.976     8.488
     4  16 S      2.040    -0.164   147.981    20.474
     5   6 C      3.828    -0.001    20.576     6.454
     6   6 C      3.828    -0.001    20.577     6.454
     7  16 S      2.040    -0.164   147.975    20.474
     8   6 C      2.990    -0.037    28.910     8.820
     9  16 S      2.290    -0.010   141.458    20.018
    10   1 H      0.927     0.057     2.238     2.339
    11   1 H      0.925     0.059     2.216     2.328
    12   1 H      0.925     0.060     2.193     2.316
    13   1 H      0.925     0.061     2.191     2.315
    14   1 H      0.925     0.059     2.216     2.328
    15   1 H      0.927     0.057     2.237     2.339

 Mol. C6AA /au·bohr⁶  :       5663.402679
 Mol. C8AA /au·bohr⁸  :     199304.165109
 Mol. α(0) /au        :        122.456631


Wiberg/Mayer (AO) data.
largest (>0.10) Wiberg bond orders for each atom
          total WBO             WBO to atom ...
     1  C   3.942        C    2 1.566    S    9 1.187    H   10 0.968    C    8 0.110
     2  C   3.958        C    1 1.566    C    3 1.205    S    7 1.036
     3  C   3.958        C    8 1.566    C    2 1.205    S    4 1.036
     4  S   2.237        C    3 1.036    C    5 0.989
     5  C   3.981        C    6 1.021    S    4 0.989    H   12 0.973    H   11 0.965
     6  C   3.981        C    5 1.021    S    7 0.989    H   13 0.973    H   14 0.964
     7  S   2.239        C    2 1.036    C    6 0.989
     8  C   3.943        C    3 1.566    S    9 1.187    H   15 0.968    C    1 0.110
     9  S   2.654        C    8 1.187    C    1 1.187
    10  H   0.997        C    1 0.968
    11  H   0.996        C    5 0.965
    12  H   0.996        C    5 0.973
    13  H   0.996        C    6 0.973
    14  H   0.996        C    6 0.964
    15  H   0.997        C    8 0.968

molecular dipole:
                 x           y           z       tot (Debye)
 q only:       -0.414       0.003       0.010
   full:       -0.741       0.005       0.014       1.884
molecular quadrupole (traceless):
                xx          xy          yy          xz          yz          zz
 q only:        5.924       0.007      -4.226      -0.063       1.354      -1.699
  q+dip:        5.008       0.023      -5.216      -0.076       2.750       0.208
   full:        5.691       0.014      -5.212      -0.095       2.293      -0.478

           -------------------------------------------------
          |                Geometry Summary                 |
           -------------------------------------------------

      molecular mass/u    :      174.2934000
   center of mass at/Å    :        0.0973379      -0.0110975       0.0008186
  moments of inertia/u·Å² :        0.2832336E+03   0.5736408E+03   0.8380042E+03
rotational constants/cm⁻¹ :        0.5951847E-01   0.2938709E-01   0.2011641E-01

 * 12 selected distances

     #   Z        #   Z                                     value/Å
     1   6 C      2   6 C                                 1.3622012
     2   6 C      3   6 C                                 1.4250711
     5   6 C      6   6 C                                 1.5124313
     3   6 C      8   6 C                                 1.3622509
     1   6 C      9  16 S                                 1.7160424 (max)
     8   6 C      9  16 S                                 1.7159508
     1   6 C     10   1 H                                 1.0706446 (min)
     5   6 C     11   1 H                                 1.0898995
     5   6 C     12   1 H                                 1.0907016
     6   6 C     13   1 H                                 1.0904091
     6   6 C     14   1 H                                 1.0902748
     8   6 C     15   1 H                                 1.0706670

 * 3 distinct bonds (by element types)

   Z      Z             #   av. dist./Å        max./Å        min./Å
   1 H    6 C           6     1.0837661     1.0907016     1.0706446
   6 C    6 C           4     1.4154886     1.5124313     1.3622012
   6 C   16 S           2     1.7159966     1.7160424     1.7159508


optimized geometry written to: xtbopt.xyz


           -------------------------------------------------
          | TOTAL ENERGY              -25.624218190424 Eh   |
          | GRADIENT NORM               0.000408197825 Eh/α |
          | HOMO-LUMO GAP               3.021394292870 eV   |
           -------------------------------------------------

------------------------------------------------------------------------
 * finished run on 2021/02/19 at 08:12:33.118     
------------------------------------------------------------------------
 total:
 * wall-time:     0 d,  0 h,  0 min,  0.599 sec
 *  cpu-time:     0 d,  0 h,  0 min,  0.596 sec
 * ratio c/w:     0.996 speedup
 SCF:
 * wall-time:     0 d,  0 h,  0 min,  0.029 sec
 *  cpu-time:     0 d,  0 h,  0 min,  0.029 sec
 * ratio c/w:     0.998 speedup
 ANC optimizer:
 * wall-time:     0 d,  0 h,  0 min,  0.552 sec
 *  cpu-time:     0 d,  0 h,  0 min,  0.550 sec
 * ratio c/w:     0.997 speedup

