      -----------------------------------------------------------      
     |                   =====================                   |     
     |                           x T B                           |     
     |                   =====================                   |     
     |                         S. Grimme                         |     
     |          Mulliken Center for Theoretical Chemistry        |     
     |                    University of Bonn                     |     
     |                Version 6.2 RC2 (SAW190805)                |     
      -----------------------------------------------------------      

   This program is distributed in the hope that it will be useful,
   but WITHOUT ANY WARRANTY; without even the implied warranty of
   MERCHANTABILITY or FITNESS FOR A PARTICULAR PURPOSE.
   
   FOR NON-COMMERCIAL, ACADEMIA USE ONLY.
   
   Cite this work as:
   * S. Grimme, C. Bannwarth, P. Shushkov, J. Chem. Theory Comput., 2017,
     13, 1989-2009. DOI: 10.1021/acs.jctc.7b00118
   * C. Bannwarth, S. Ehlert and S. Grimme., J. Chem. Theory Comput., 2019,
     15, 1652-1671. DOI: 10.1021/acs.jctc.8b01176
   * P. Pracht, E. Caldeweyher, S. Ehlert, S. Grimme, ChemRxiv, 2019, preprint.
     DOI: 10.26434/chemrxiv.8326202.v1
   
   for DFT-D4:
   * E. Caldeweyher, C. Bannwarth and S. Grimme, J. Chem. Phys., 2017,
     147, 034112. DOI: 10.1063/1.4993215
   * E. Caldeweyher, S. Ehlert, A. Hansen, H. Neugebauer, S. Spicher,
     C. Bannwarth and S. Grimme, J. Chem. Phys., 2019, 150, 154122.
     DOI: 10.1063/1.5090222
   
   for sTDA-xTB:
   * S. Grimme and C. Bannwarth, J. Chem. Phys., 2016, 145, 054103.
     DOI: 10.1063/1.4959605
   
   in the mass-spec context:
   * V. Asgeirsson, C. Bauer and S. Grimme, Chem. Sci., 2017, 8, 4879.
     DOI: 10.1039/c7sc00601b
   
   for metadynamics refer to:
   * S. Grimme, J. Chem. Theory Comput., 2019, 155, 2847-2862
     DOI: 10.1021/acs.jctc.9b00143
   
   with help from (in alphabetical order)
   C. Bannwarth, F. Bohle, G. Brandenburg, E. Caldeweyher, M. Checinski,
   S. Dohm, S. Ehlert, S. Ehrlich, F. März, H. Neugebauer, J. Pisarek,
   P. Pracht, P. Shushkov, and S. Spicher.
   
 * started run on 2021/02/19 at 08:12:35.968     

           -------------------------------------------------
          |                Calculation Setup                |
           -------------------------------------------------

          program call               : /ihome/ghutchison/geoffh/xtb/xtb 39utl.xyz -opt
          hostname                   : smp-n135
          coordinate file            : 39utl.xyz
          omp threads                :                     1
          number of atoms            :                    19
          number of electrons        :                    62
          charge                     :                     0
          spin                       :                   0.0
          first test random number   :      0.77134952860172


########################################################################
# WARNING! Please study the warnings concerning your input carefully
#  - the use of '-opt' is discouraged, please use '--opt' next time
########################################################################

           ------------------------------------------------- 
          |                 G F N 2 - x T B                 |
          | Geometry, Frequencies, Noncovalent interactions |
          |            JCTC 2019 parametrisation            |
           ------------------------------------------------- 
             KAB for C  - Si     :                1.0500
             KAB for H  - Pd     :                0.9500
             k(s)              :                1.8500
             k(p)              :                2.2300
             k(d)              :                2.2300
             k(f)              :                2.0000
             kEN (H0ij)        :               -2.0000
             D4 a1             :                0.5200
             D4 a2             :                5.0000
             D4 s6             :                1.0000
             D4 s8             :                2.7000
             D4 s9             :                5.0000
             alphaj            :                2.0000

  Z AO/shell   Hii/eV     exponent
  1     Wed Apr 25 08:07:45 CEST 2018   EN: 2.200 GM2: 0.406  GM3: 0.0800  RAES: 1.40
     1s    -10.707211    1.230000
  6     Wed Apr 25 08:07:45 CEST 2018   EN: 2.550 GM2: 0.538  GM3: 0.1500  RAES: 3.00
     2s    -13.970922    2.096432
     2p    -10.063292    1.800000
  7     Wed Apr 25 08:07:45 CEST 2018   EN: 3.040 GM2: 0.461  GM3:-0.0640  RAES: 1.90
     2s    -16.686243    2.339881
     2p    -12.523956    2.014332
  8     Wed Apr 25 08:07:45 CEST 2018   EN: 3.440 GM2: 0.452  GM3:-0.0517  RAES: 1.80
     2s    -20.229985    2.439742
     2p    -15.503117    2.137023

           ------------------------------------------------- 
          |        Self-Consistent Charge Iterations        |
           ------------------------------------------------- 

          ...................................................
          :                      SETUP                      :
          :.................................................:
          :  # basis functions                  58          :
          :  # atomic orbitals                  58          :
          :  # shells                           32          :
          :  # electrons                        62          :
          :  max. iterations                   250          :
          :  Hamiltonian                  GFN2-xTB          :
          :  restarted?                      false          :
          :  GBSA solvation                  false          :
          :  PC potential                    false          :
          :  electronic temp.          300.0000000     K    :
          :  accuracy                    1.0000000          :
          :  -> integral cutoff          0.2500000E+02      :
          :  -> integral neglect         0.1000000E-07      :
          :  -> SCF convergence          0.1000000E-05 Eh   :
          :  -> wf. convergence          0.1000000E-03 e    :
          :  Broyden damping             0.4000000          :
          ...................................................

 iter      E             dE          RMSdq      gap      omega  full diag
   1    -34.8129034 -0.348129E+02  0.594E+00    2.72       0.0  T
   2    -34.8718419 -0.589386E-01  0.381E+00    2.66       1.0  T
   3    -34.8609320  0.109099E-01  0.251E+00    2.71       1.0  T
   4    -34.9079760 -0.470440E-01  0.915E-01    2.68       1.0  T
   5    -34.9186381 -0.106621E-01  0.168E-01    2.70       1.0  T
   6    -34.9187896 -0.151482E-03  0.992E-02    2.72       1.0  T
   7    -34.9188588 -0.691928E-04  0.311E-02    2.72       1.0  T
   8    -34.9188617 -0.288495E-05  0.193E-02    2.72       1.2  T
   9    -34.9188643 -0.266123E-05  0.536E-03    2.72       4.3  T
  10    -34.9188646 -0.273232E-06  0.286E-03    2.72       8.0  T
  11    -34.9188646 -0.498890E-07  0.113E-03    2.72      20.3  T
  12    -34.9188646 -0.365367E-08  0.576E-04    2.72      39.8  T
  13    -34.9188646 -0.154279E-08  0.266E-04    2.72      86.2  T

   *** convergence criteria satisfied after 13 iterations ***

         #    Occupation            Energy/Eh            Energy/eV
      -------------------------------------------------------------
         1        2.0000           -0.7152917             -19.4641
       ...           ...                  ...                  ...
        25        2.0000           -0.4648433             -12.6490
        26        2.0000           -0.4633765             -12.6091
        27        2.0000           -0.4607719             -12.5382
        28        2.0000           -0.4310298             -11.7289
        29        2.0000           -0.4265643             -11.6074
        30        2.0000           -0.4110424             -11.1850
        31        2.0000           -0.4095181             -11.1436 (HOMO)
        32                         -0.3094678              -8.4210 (LUMO)
        33                         -0.2612368              -7.1086
        34                         -0.2402562              -6.5377
        35                         -0.2189748              -5.9586
        36                         -0.2188059              -5.9540
       ...                                ...                  ...
        58                          1.0878803              29.6027
      -------------------------------------------------------------
                  HL-Gap            0.1000503 Eh            2.7225 eV
             Fermi-level           -0.3594929 Eh           -9.7823 eV

 SCC (total)                   0 d,  0 h,  0 min,  0.029 sec
 SCC setup                      ...        0 min,  0.000 sec (  0.855%)
 Dispersion                     ...        0 min,  0.000 sec (  0.962%)
 integral evaluation            ...        0 min,  0.006 sec ( 21.987%)
 zeroth order Hamiltonian       ...        0 min,  0.000 sec (  0.445%)
 iterations                     ...        0 min,  0.012 sec ( 40.670%)
 molecular gradient             ...        0 min,  0.010 sec ( 33.832%)
 printout                       ...        0 min,  0.000 sec (  1.075%)

         :::::::::::::::::::::::::::::::::::::::::::::::::::::
         ::                     SUMMARY                     ::
         :::::::::::::::::::::::::::::::::::::::::::::::::::::
         :: total energy             -34.351357146209 Eh    ::
         :: gradient norm              0.083170150958 Eh/a0 ::
         :: HOMO-LUMO gap              2.722507173933 eV    ::
         ::.................................................::
         :: SCC energy               -34.918864648980 Eh    ::
         :: -> isotropic ES            0.047686508867 Eh    ::
         :: -> anisotropic ES          0.001511594864 Eh    ::
         :: -> anisotropic XC          0.029281048631 Eh    ::
         :: -> dispersion             -0.019198011408 Eh    ::
         :: repulsion energy           0.567504212173 Eh    ::
         :: add. restraining           0.000000000000 Eh    ::
         :::::::::::::::::::::::::::::::::::::::::::::::::::::

      ----------------------------------------------------------- 
     |                   =====================                   |
     |                        A N C O P T                        |
     |                   =====================                   |
     |               Approximate Normal Coordinate               |
     |                Rational Function Optimizer                |
      ----------------------------------------------------------- 

          ...................................................
          :                      SETUP                      :
          :.................................................:
          :   optimization level            normal          :
          :   max. optcycles                   200          :
          :   ANC micro-cycles                  20          :
          :   degrees of freedom                51          :
          :.................................................:
          :   RF solver                   davidson          :
          :   input Hessian                  false          :
          :   write xtbopt.log                true          :
          :   linear?                        false          :
          :   energy convergence         0.5000000E-05 Eh   :
          :   grad. convergence          0.1000000E-02 Eh/α :
          :   maximium RF displ.         2.0000000          :
          :   Hlow (freq-cutoff)         0.5000000E-02      :
          :   Hmax (freq-cutoff)         5.0000000          :
          :   S6 in model hess.         20.0000000          :
          ...................................................

generating ANC from model Hessian ...
Using Lindh-Hessian (1995)
 Shifting diagonal of input Hessian by   4.770270819981237E-003
 Lowest  eigenvalues of input Hessian
   -0.000000   -0.000000   -0.000000    0.000000    0.000000    0.000000
    0.005000    0.009958    0.010394    0.018862    0.020914    0.023851
    0.024456    0.027929    0.040883    0.042061    0.063067    0.072781
 Highest eigenvalues
    1.822806    1.919997    2.012543    2.057758    2.334445    2.549018
 

........................................................................
.............................. CYCLE    1 ..............................
........................................................................
   1    -34.9188646 -0.349189E+02  0.762E-05    2.72       0.0  T
   2    -34.9188646 -0.160796E-10  0.477E-05    2.72     480.6  T
   3    -34.9188646 -0.143743E-10  0.344E-05    2.72     666.4  T
     SCC iter.                  ...        0 min,  0.003 sec
     gradient                   ...        0 min,  0.010 sec
 * total energy  :   -34.3513571 Eh     change        0.8112075E-08 Eh
   gradient norm :     0.0831721 Eh/α   predicted     0.0000000E+00 (-100.00%)
   displ. norm   :     0.1599234 α      lambda       -0.6060991E-02
   maximum displ.:     0.0903716 α      in ANC's #24, #11, #26, ...

........................................................................
.............................. CYCLE    2 ..............................
........................................................................
   1    -34.9543813 -0.349544E+02  0.151E-01    2.69       0.0  T
   2    -34.9544306 -0.492564E-04  0.832E-02    2.71       1.0  T
   3    -34.9544287  0.187971E-05  0.528E-02    2.71       1.0  T
   4    -34.9544428 -0.141266E-04  0.127E-02    2.71       1.8  T
   5    -34.9544448 -0.201370E-05  0.439E-03    2.71       5.2  T
   6    -34.9544450 -0.153192E-06  0.223E-03    2.71      10.3  T
     SCC iter.                  ...        0 min,  0.005 sec
     gradient                   ...        0 min,  0.009 sec
 * total energy  :   -34.3551973 Eh     change       -0.3840139E-02 Eh
   gradient norm :     0.0362137 Eh/α   predicted    -0.3108002E-02 ( -19.07%)
   displ. norm   :     0.1201870 α      lambda       -0.1603320E-02
   maximum displ.:     0.0550819 α      in ANC's #1, #24, #3, ...

........................................................................
.............................. CYCLE    3 ..............................
........................................................................
   1    -34.9621344 -0.349621E+02  0.170E-01    2.66       0.0  T
   2    -34.9621682 -0.338287E-04  0.931E-02    2.68       1.0  T
   3    -34.9621471  0.211451E-04  0.586E-02    2.68       1.0  T
   4    -34.9621818 -0.347086E-04  0.121E-02    2.68       1.9  T
   5    -34.9621836 -0.179049E-05  0.574E-03    2.68       4.0  T
   6    -34.9621839 -0.342930E-06  0.238E-03    2.68       9.6  T
     SCC iter.                  ...        0 min,  0.005 sec
     gradient                   ...        0 min,  0.009 sec
 * total energy  :   -34.3560040 Eh     change       -0.8066733E-03 Eh
   gradient norm :     0.0112569 Eh/α   predicted    -0.8132447E-03 (   0.81%)
   displ. norm   :     0.2411856 α      lambda       -0.1112372E-02
   maximum displ.:     0.1340520 α      in ANC's #3, #1, #2, ...

........................................................................
.............................. CYCLE    4 ..............................
........................................................................
   1    -34.9583628 -0.349584E+02  0.427E-01    2.62       0.0  T
   2    -34.9584253 -0.625823E-04  0.237E-01    2.63       1.0  T
   3    -34.9583069  0.118430E-03  0.924E-02    2.63       1.0  T
   4    -34.9584599 -0.152953E-03  0.155E-02    2.63       1.5  T
   5    -34.9584620 -0.217292E-05  0.818E-03    2.63       2.8  T
   6    -34.9584624 -0.339197E-06  0.359E-03    2.63       6.4  T
   7    -34.9584624 -0.424485E-07  0.147E-03    2.63      15.6  T
   8    -34.9584624 -0.270472E-07  0.485E-04    2.63      47.3  T
     SCC iter.                  ...        0 min,  0.007 sec
     gradient                   ...        0 min,  0.009 sec
 * total energy  :   -34.3548756 Eh     change        0.1128388E-02 Eh
   gradient norm :     0.0306649 Eh/α   predicted    -0.5885406E-03 (-152.16%)
   displ. norm   :     0.1723571 α      lambda       -0.2866909E-02
   maximum displ.:     0.1180206 α      in ANC's #1, #2, #3, ...

........................................................................
.............................. CYCLE    5 ..............................
........................................................................
   1    -34.9604110 -0.349604E+02  0.329E-01    2.67       0.0  T
   2    -34.9604462 -0.352240E-04  0.181E-01    2.66       1.0  T
   3    -34.9604230  0.231982E-04  0.467E-02    2.66       1.0  T
   4    -34.9604616 -0.386464E-04  0.797E-03    2.66       2.9  T
   5    -34.9604622 -0.557807E-06  0.442E-03    2.66       5.2  T
   6    -34.9604623 -0.138274E-06  0.167E-03    2.66      13.8  T
     SCC iter.                  ...        0 min,  0.005 sec
     gradient                   ...        0 min,  0.009 sec
 * total energy  :   -34.3562366 Eh     change       -0.1361011E-02 Eh
   gradient norm :     0.0072834 Eh/α   predicted    -0.1476040E-02 (   8.45%)
   displ. norm   :     0.0263031 α      lambda       -0.4666878E-04
   maximum displ.:     0.0168259 α      in ANC's #3, #1, #11, ...

........................................................................
.............................. CYCLE    6 ..............................
........................................................................
   1    -34.9582220 -0.349582E+02  0.294E-02    2.66       0.0  T
   2    -34.9582224 -0.418316E-06  0.166E-02    2.66       1.4  T
   3    -34.9582221  0.350353E-06  0.584E-03    2.66       3.9  T
   4    -34.9582225 -0.454988E-06  0.166E-03    2.66      13.8  T
   5    -34.9582226 -0.400432E-07  0.641E-04    2.66      35.8  T
     SCC iter.                  ...        0 min,  0.005 sec
     gradient                   ...        0 min,  0.009 sec
 * total energy  :   -34.3562654 Eh     change       -0.2878050E-04 Eh
   gradient norm :     0.0022621 Eh/α   predicted    -0.2335190E-04 ( -18.86%)
   displ. norm   :     0.0306536 α      lambda       -0.1678036E-04
   maximum displ.:     0.0259730 α      in ANC's #3, #1, #5, ...

........................................................................
.............................. CYCLE    7 ..............................
........................................................................
   1    -34.9576503 -0.349577E+02  0.276E-02    2.66       0.0  T
   2    -34.9576505 -0.207078E-06  0.161E-02    2.66       1.4  T
   3    -34.9576501  0.378487E-06  0.539E-03    2.66       4.3  T
   4    -34.9576505 -0.454429E-06  0.154E-03    2.66      14.9  T
   5    -34.9576506 -0.276126E-07  0.695E-04    2.66      33.0  T
   6    -34.9576506 -0.592998E-09  0.253E-04    2.66      90.6  T
     SCC iter.                  ...        0 min,  0.005 sec
     gradient                   ...        0 min,  0.010 sec
 * total energy  :   -34.3562767 Eh     change       -0.1132252E-04 Eh
   gradient norm :     0.0016486 Eh/α   predicted    -0.8399042E-05 ( -25.82%)
   displ. norm   :     0.0460417 α      lambda       -0.5843424E-06
   maximum displ.:     0.0389595 α      in ANC's #3, #1, #5, ...

........................................................................
.............................. CYCLE    8 ..............................
........................................................................
   1    -34.9567194 -0.349567E+02  0.414E-02    2.65       0.0  T
   2    -34.9567199 -0.472006E-06  0.242E-02    2.65       1.0  T
   3    -34.9567188  0.103938E-05  0.876E-03    2.65       2.6  T
   4    -34.9567200 -0.123102E-05  0.231E-03    2.65      10.0  T
   5    -34.9567201 -0.619548E-07  0.104E-03    2.65      22.0  T
   6    -34.9567201 -0.119933E-08  0.384E-04    2.65      59.7  T
   7    -34.9567201 -0.138189E-08  0.114E-04    2.65     201.2  T
     SCC iter.                  ...        0 min,  0.006 sec
     gradient                   ...        0 min,  0.010 sec
 * total energy  :   -34.3562729 Eh     change        0.3751962E-05 Eh
   gradient norm :     0.0032834 Eh/α   predicted    -0.2927064E-06 (-107.80%)
   displ. norm   :     0.0145427 α      lambda       -0.1018359E-04
   maximum displ.:     0.0103390 α      in ANC's #3, #1, #10, ...

........................................................................
.............................. CYCLE    9 ..............................
........................................................................
   1    -34.9576523 -0.349577E+02  0.125E-02    2.65       0.0  T
   2    -34.9576524 -0.685459E-07  0.732E-03    2.65       3.1  T
   3    -34.9576522  0.152214E-06  0.348E-03    2.65       6.6  T
   4    -34.9576524 -0.175543E-06  0.865E-04    2.65      26.5  T
   5    -34.9576524 -0.109019E-07  0.329E-04    2.65      69.7  T
     SCC iter.                  ...        0 min,  0.005 sec
     gradient                   ...        0 min,  0.010 sec
 * total energy  :   -34.3562800 Eh     change       -0.7081985E-05 Eh
   gradient norm :     0.0013244 Eh/α   predicted    -0.5096377E-05 ( -28.04%)
   displ. norm   :     0.0122541 α      lambda       -0.3356443E-05
   maximum displ.:     0.0062046 α      in ANC's #10, #5, #3, ...

........................................................................
.............................. CYCLE   10 ..............................
........................................................................
   1    -34.9584839 -0.349585E+02  0.113E-02    2.66       0.0  T
   2    -34.9584840 -0.101454E-06  0.656E-03    2.66       3.5  T
   3    -34.9584840  0.523634E-07  0.252E-03    2.66       9.1  T
   4    -34.9584840 -0.641462E-07  0.850E-04    2.66      27.0  T
   5    -34.9584840 -0.114726E-07  0.323E-04    2.66      71.1  T
     SCC iter.                  ...        0 min,  0.004 sec
     gradient                   ...        0 min,  0.010 sec
 * total energy  :   -34.3562819 Eh     change       -0.1848243E-05 Eh
   gradient norm :     0.0005202 Eh/α   predicted    -0.1679345E-05 (  -9.14%)
   displ. norm   :     0.0076691 α      lambda       -0.6152769E-06
   maximum displ.:     0.0061940 α      in ANC's #3, #1, #8, ...

   *** GEOMETRY OPTIMIZATION CONVERGED AFTER 10 ITERATIONS ***

------------------------------------------------------------------------
 total energy gain   :        -0.0049247 Eh       -3.0903 kcal/mol
 total RMSD          :         0.0794997 a0        0.0421 Å
 total power (kW/mol):        -1.2929823 (step)  -58.9181 (real)
------------------------------------------------------------------------

 ANCopt (total)                0 d,  0 h,  0 min,  0.219 sec
 optimizer setup                ...        0 min,  0.000 sec (  0.060%)
 model hessian                  ...        0 min,  0.002 sec (  0.979%)
 ANC generation                 ...        0 min,  0.000 sec (  0.223%)
 coordinate transformation      ...        0 min,  0.000 sec (  0.063%)
 single point calculation       ...        0 min,  0.214 sec ( 97.346%)
 optimization log               ...        0 min,  0.001 sec (  0.385%)
 hessian update                 ...        0 min,  0.000 sec (  0.048%)
 rational function              ...        0 min,  0.001 sec (  0.620%)

================
 final structure:
================
$coord
   -4.49179509353339   -1.40468771403143   -0.01997769290172      C 
   -4.57306250673615    1.23075122416489   -0.04012346321758      C 
   -2.36804157836977    2.60125505792870   -0.04178827285339      C 
   -0.02258885253104    1.36998930555069   -0.02446148374054      C 
    0.04235728963307   -1.29502231112983   -0.00473653642607      C 
   -2.21543760540809   -2.66289894014157   -0.00198024622922      C 
    2.33176345025578   -2.48632360604163    0.01156247716221      N 
    4.68281805690748   -1.34346820477903    0.00465832464995      C 
    6.58699765040653   -2.61299712694331    0.01508626745488      O 
    4.56329643936736    1.42963267391637   -0.01442423342786      C 
    2.32147571628408    2.68641253641347   -0.02747339583252      C 
    6.86819882621292    2.77528985679399   -0.02166778881614      C 
    8.70166502179081    3.92725187476814   -0.02833822071902      N 
   -6.23250686834867   -2.46745234966849   -0.01848007986835      H 
   -6.37418168189844    2.18550709890254   -0.05422641958330      H 
   -2.40778448562336    4.64087937998470   -0.05665395882639      H 
   -2.15210853365201   -4.70277813150005    0.01406277207335      H 
    2.36244766442276   -4.40206328756667    0.02554067129166      H 
    2.29834200952928    4.73012835968534   -0.04102576842488      H 
$end
           -------------------------------------------------
          |                Final Singlepoint                |
           -------------------------------------------------

          ...................................................
          :                      SETUP                      :
          :.................................................:
          :  # basis functions                  58          :
          :  # atomic orbitals                  58          :
          :  # shells                           32          :
          :  # electrons                        62          :
          :  max. iterations                   250          :
          :  Hamiltonian                  GFN2-xTB          :
          :  restarted?                      false          :
          :  GBSA solvation                  false          :
          :  PC potential                    false          :
          :  electronic temp.          300.0000000     K    :
          :  accuracy                    1.0000000          :
          :  -> integral cutoff          0.2500000E+02      :
          :  -> integral neglect         0.1000000E-07      :
          :  -> SCF convergence          0.1000000E-05 Eh   :
          :  -> wf. convergence          0.1000000E-03 e    :
          :  Broyden damping             0.4000000          :
          ...................................................

 iter      E             dE          RMSdq      gap      omega  full diag
   1    -34.9584840 -0.349585E+02  0.148E-04    2.66       0.0  T
   2    -34.9584840 -0.558131E-10  0.962E-05    2.66     238.4  T
   3    -34.9584840 -0.177067E-09  0.465E-05    2.66     493.5  T

   *** convergence criteria satisfied after 3 iterations ***

         #    Occupation            Energy/Eh            Energy/eV
      -------------------------------------------------------------
         1        2.0000           -0.7194836             -19.5781
       ...           ...                  ...                  ...
        25        2.0000           -0.4672251             -12.7138
        26        2.0000           -0.4643176             -12.6347
        27        2.0000           -0.4591405             -12.4938
        28        2.0000           -0.4298348             -11.6964
        29        2.0000           -0.4265410             -11.6068
        30        2.0000           -0.4128223             -11.2335
        31        2.0000           -0.4081159             -11.1054 (HOMO)
        32                         -0.3104584              -8.4480 (LUMO)
        33                         -0.2585004              -7.0342
        34                         -0.2350211              -6.3953
        35                         -0.2129263              -5.7940
        36                         -0.2101231              -5.7177
       ...                                ...                  ...
        58                          1.1702975              31.8454
      -------------------------------------------------------------
                  HL-Gap            0.0976575 Eh            2.6574 eV
             Fermi-level           -0.3592872 Eh           -9.7767 eV

 SCC (total)                   0 d,  0 h,  0 min,  0.020 sec
 SCC setup                      ...        0 min,  0.000 sec (  0.856%)
 Dispersion                     ...        0 min,  0.000 sec (  0.648%)
 integral evaluation            ...        0 min,  0.006 sec ( 31.810%)
 zeroth order Hamiltonian       ...        0 min,  0.000 sec (  0.679%)
 iterations                     ...        0 min,  0.003 sec ( 15.786%)
 molecular gradient             ...        0 min,  0.010 sec ( 48.556%)
 printout                       ...        0 min,  0.000 sec (  1.397%)

         :::::::::::::::::::::::::::::::::::::::::::::::::::::
         ::                     SUMMARY                     ::
         :::::::::::::::::::::::::::::::::::::::::::::::::::::
         :: total energy             -34.356281860280 Eh    ::
         :: gradient norm              0.000517325052 Eh/a0 ::
         :: HOMO-LUMO gap              2.657396240027 eV    ::
         ::.................................................::
         :: SCC energy               -34.958484043237 Eh    ::
         :: -> isotropic ES            0.046365709068 Eh    ::
         :: -> anisotropic ES          0.002048941299 Eh    ::
         :: -> anisotropic XC          0.027964580156 Eh    ::
         :: -> dispersion             -0.019325729334 Eh    ::
         :: repulsion energy           0.602198689244 Eh    ::
         :: add. restraining           0.000000000000 Eh    ::
         :::::::::::::::::::::::::::::::::::::::::::::::::::::

           -------------------------------------------------
          |                Property Printout                |
           -------------------------------------------------

    * Orbital Energies and Occupations

         #    Occupation            Energy/Eh            Energy/eV
      -------------------------------------------------------------
         1        2.0000           -0.7194836             -19.5781
       ...           ...                  ...                  ...
        19        2.0000           -0.5203160             -14.1585
        20        2.0000           -0.5129748             -13.9588
        21        2.0000           -0.5055565             -13.7569
        22        2.0000           -0.4968496             -13.5200
        23        2.0000           -0.4788011             -13.0288
        24        2.0000           -0.4773674             -12.9898
        25        2.0000           -0.4672251             -12.7138
        26        2.0000           -0.4643176             -12.6347
        27        2.0000           -0.4591405             -12.4938
        28        2.0000           -0.4298348             -11.6964
        29        2.0000           -0.4265410             -11.6068
        30        2.0000           -0.4128223             -11.2335
        31        2.0000           -0.4081159             -11.1054 (HOMO)
        32                         -0.3104584              -8.4480 (LUMO)
        33                         -0.2585004              -7.0342
        34                         -0.2350211              -6.3953
        35                         -0.2129263              -5.7940
        36                         -0.2101231              -5.7177
        37                         -0.1383815              -3.7656
        38                         -0.0891685              -2.4264
        39                         -0.0007051              -0.0192
        40                          0.0822640               2.2385
        41                          0.0941409               2.5617
        42                          0.1052699               2.8645
       ...                                ...                  ...
        58                          1.1702975              31.8454
      -------------------------------------------------------------
                  HL-Gap            0.0976575 Eh            2.6574 eV
             Fermi-level           -0.3592872 Eh           -9.7767 eV

     #   Z        covCN         q      C6AA      α(0)
     1   6 C      2.920    -0.019    28.490     8.753
     2   6 C      2.916    -0.033    28.815     8.802
     3   6 C      2.920    -0.028    28.697     8.785
     4   6 C      2.984     0.001    28.007     8.681
     5   6 C      2.918     0.078    26.248     8.401
     6   6 C      2.918    -0.051    29.269     8.872
     7   7 N      2.702    -0.137    23.974     7.272
     8   6 C      2.764     0.280    22.265     7.727
     9   8 O      0.859    -0.421    22.111     6.304
    10   6 C      2.959    -0.013    28.341     8.732
    11   6 C      2.924    -0.011    28.286     8.722
    12   6 C      1.912     0.125    28.036     8.551
    13   7 N      0.911    -0.212    25.612     7.319
    14   1 H      0.926     0.049     2.332     2.388
    15   1 H      0.926     0.047     2.362     2.403
    16   1 H      0.926     0.049     2.331     2.387
    17   1 H      0.926     0.043     2.404     2.425
    18   1 H      0.860     0.195     1.133     1.667
    19   1 H      0.925     0.058     2.218     2.329

 Mol. C6AA /au·bohr⁶  :       5743.417700
 Mol. C8AA /au·bohr⁸  :     144540.934019
 Mol. α(0) /au        :        120.522034


Wiberg/Mayer (AO) data.
largest (>0.10) Wiberg bond orders for each atom
          total WBO             WBO to atom ...
     1  C   3.979        C    6 1.493    C    2 1.370    H   14 0.970
     2  C   3.979        C    3 1.507    C    1 1.370    H   15 0.970
     3  C   3.976        C    2 1.507    C    4 1.319    H   16 0.968    C    6 0.108
     4  C   3.989        C    3 1.319    C    5 1.264    C   11 1.207
     5  C   3.955        C    6 1.331    C    4 1.264    N    7 1.176
     6  C   3.988        C    1 1.493    C    5 1.331    H   17 0.966    C    3 0.108
     7  N   3.545        C    5 1.176    C    8 1.126    H   18 0.926    O    9 0.161
     8  C   3.953        O    9 1.685    N    7 1.126    C   10 1.037
     9  O   2.008        C    8 1.685    N    7 0.161
    10  C   3.989        C   11 1.595    C   12 1.102    C    8 1.037
    11  C   3.987        C   10 1.595    C    4 1.207    H   19 0.964
    12  C   3.949        N   13 2.804    C   10 1.102
    13  N   2.980        C   12 2.804
    14  H   0.997        C    1 0.970
    15  H   0.997        C    2 0.970
    16  H   0.997        C    3 0.968
    17  H   0.998        C    6 0.966
    18  H   0.960        N    7 0.926
    19  H   0.996        C   11 0.964

molecular dipole:
                 x           y           z       tot (Debye)
 q only:       -2.656      -0.093      -0.003
   full:       -3.199      -0.382      -0.002       8.190
molecular quadrupole (traceless):
                xx          xy          yy          xz          yz          zz
 q only:      -19.901      -0.282      11.065       0.028      -0.018       8.836
  q+dip:      -25.866      -3.177      16.964       0.062      -0.059       8.901
   full:      -28.594      -4.273      14.879       0.052      -0.010      13.715

           -------------------------------------------------
          |                Geometry Summary                 |
           -------------------------------------------------

      molecular mass/u    :      170.1702000
   center of mass at/Å    :        0.9486584       0.1339241      -0.0075604
  moments of inertia/u·Å² :        0.2569523E+03   0.8980967E+03   0.1155048E+04
rotational constants/cm⁻¹ :        0.6560607E-01   0.1877040E-01   0.1459474E-01

 * 18 selected distances

     #   Z        #   Z                                     value/Å
     1   6 C      2   6 C                                 1.3953180
     2   6 C      3   6 C                                 1.3738649
     3   6 C      4   6 C                                 1.4018168
     4   6 C      5   6 C                                 1.4107209
     1   6 C      6   6 C                                 1.3763923
     5   6 C      6   6 C                                 1.3969410
     5   6 C      7   7 N                                 1.3657331
     7   7 N      8   6 C                                 1.3833329
     8   6 C      9   8 O                                 1.2110777
     4   6 C     11   6 C                                 1.4226523 (max)
    10   6 C     11   6 C                                 1.3600397
    12   6 C     13   7 N                                 1.1458440
     1   6 C     14   1 H                                 1.0792555
     2   6 C     15   1 H                                 1.0787675
     3   6 C     16   1 H                                 1.0795564
     6   6 C     17   1 H                                 1.0800111
     7   7 N     18   1 H                                 1.0139229 (min)
    11   6 C     19   1 H                                 1.0815810

 * 5 distinct bonds (by element types)

   Z      Z             #   av. dist./Å        max./Å        min./Å
   1 H    6 C           5     1.0798343     1.0815810     1.0787675
   6 C    6 C           8     1.3922182     1.4226523     1.3600397
   1 H    7 N           1     1.0139229     1.0139229     1.0139229
   6 C    7 N           3     1.2983034     1.3833329     1.1458440
   6 C    8 O           1     1.2110777     1.2110777     1.2110777


optimized geometry written to: xtbopt.xyz


           -------------------------------------------------
          | TOTAL ENERGY              -34.356281860280 Eh   |
          | GRADIENT NORM               0.000517325052 Eh/α |
          | HOMO-LUMO GAP               2.657396240027 eV   |
           -------------------------------------------------

------------------------------------------------------------------------
 * finished run on 2021/02/19 at 08:12:36.259     
------------------------------------------------------------------------
 total:
 * wall-time:     0 d,  0 h,  0 min,  0.291 sec
 *  cpu-time:     0 d,  0 h,  0 min,  0.286 sec
 * ratio c/w:     0.983 speedup
 SCF:
 * wall-time:     0 d,  0 h,  0 min,  0.029 sec
 *  cpu-time:     0 d,  0 h,  0 min,  0.029 sec
 * ratio c/w:     0.996 speedup
 ANC optimizer:
 * wall-time:     0 d,  0 h,  0 min,  0.240 sec
 *  cpu-time:     0 d,  0 h,  0 min,  0.240 sec
 * ratio c/w:     0.997 speedup

