      -----------------------------------------------------------      
     |                   =====================                   |     
     |                           x T B                           |     
     |                   =====================                   |     
     |                         S. Grimme                         |     
     |          Mulliken Center for Theoretical Chemistry        |     
     |                    University of Bonn                     |     
     |                Version 6.2 RC2 (SAW190805)                |     
      -----------------------------------------------------------      

   This program is distributed in the hope that it will be useful,
   but WITHOUT ANY WARRANTY; without even the implied warranty of
   MERCHANTABILITY or FITNESS FOR A PARTICULAR PURPOSE.
   
   FOR NON-COMMERCIAL, ACADEMIA USE ONLY.
   
   Cite this work as:
   * S. Grimme, C. Bannwarth, P. Shushkov, J. Chem. Theory Comput., 2017,
     13, 1989-2009. DOI: 10.1021/acs.jctc.7b00118
   * C. Bannwarth, S. Ehlert and S. Grimme., J. Chem. Theory Comput., 2019,
     15, 1652-1671. DOI: 10.1021/acs.jctc.8b01176
   * P. Pracht, E. Caldeweyher, S. Ehlert, S. Grimme, ChemRxiv, 2019, preprint.
     DOI: 10.26434/chemrxiv.8326202.v1
   
   for DFT-D4:
   * E. Caldeweyher, C. Bannwarth and S. Grimme, J. Chem. Phys., 2017,
     147, 034112. DOI: 10.1063/1.4993215
   * E. Caldeweyher, S. Ehlert, A. Hansen, H. Neugebauer, S. Spicher,
     C. Bannwarth and S. Grimme, J. Chem. Phys., 2019, 150, 154122.
     DOI: 10.1063/1.5090222
   
   for sTDA-xTB:
   * S. Grimme and C. Bannwarth, J. Chem. Phys., 2016, 145, 054103.
     DOI: 10.1063/1.4959605
   
   in the mass-spec context:
   * V. Asgeirsson, C. Bauer and S. Grimme, Chem. Sci., 2017, 8, 4879.
     DOI: 10.1039/c7sc00601b
   
   for metadynamics refer to:
   * S. Grimme, J. Chem. Theory Comput., 2019, 155, 2847-2862
     DOI: 10.1021/acs.jctc.9b00143
   
   with help from (in alphabetical order)
   C. Bannwarth, F. Bohle, G. Brandenburg, E. Caldeweyher, M. Checinski,
   S. Dohm, S. Ehlert, S. Ehrlich, F. März, H. Neugebauer, J. Pisarek,
   P. Pracht, P. Shushkov, and S. Spicher.
   
 * started run on 2021/02/19 at 08:12:36.276     

           -------------------------------------------------
          |                Calculation Setup                |
           -------------------------------------------------

          program call               : /ihome/ghutchison/geoffh/xtb/xtb 3a.xyz -opt
          hostname                   : smp-n135
          coordinate file            : 3a.xyz
          omp threads                :                     1
          number of atoms            :                    13
          number of electrons        :                    44
          charge                     :                     0
          spin                       :                   0.0
          first test random number   :      0.70256595253856


########################################################################
# WARNING! Please study the warnings concerning your input carefully
#  - the use of '-opt' is discouraged, please use '--opt' next time
########################################################################

           ------------------------------------------------- 
          |                 G F N 2 - x T B                 |
          | Geometry, Frequencies, Noncovalent interactions |
          |            JCTC 2019 parametrisation            |
           ------------------------------------------------- 
             KAB for C  - Si     :                1.0500
             KAB for H  - Pd     :                0.9500
             k(s)              :                1.8500
             k(p)              :                2.2300
             k(d)              :                2.2300
             k(f)              :                2.0000
             kEN (H0ij)        :               -2.0000
             D4 a1             :                0.5200
             D4 a2             :                5.0000
             D4 s6             :                1.0000
             D4 s8             :                2.7000
             D4 s9             :                5.0000
             alphaj            :                2.0000

  Z AO/shell   Hii/eV     exponent
  1     Wed Apr 25 08:07:45 CEST 2018   EN: 2.200 GM2: 0.406  GM3: 0.0800  RAES: 1.40
     1s    -10.707211    1.230000
  6     Wed Apr 25 08:07:45 CEST 2018   EN: 2.550 GM2: 0.538  GM3: 0.1500  RAES: 3.00
     2s    -13.970922    2.096432
     2p    -10.063292    1.800000
  7     Wed Apr 25 08:07:45 CEST 2018   EN: 3.040 GM2: 0.461  GM3:-0.0640  RAES: 1.90
     2s    -16.686243    2.339881
     2p    -12.523956    2.014332
 16     Tue Apr 24 11:44:34 CEST 2018   EN: 2.580 GM2: 0.340  GM3:-0.0502  RAES: 3.10
     3s    -20.029654    1.981333
     3p    -11.377694    2.025643
     3d     -0.420282    1.702555

           ------------------------------------------------- 
          |        Self-Consistent Charge Iterations        |
           ------------------------------------------------- 

          ...................................................
          :                      SETUP                      :
          :.................................................:
          :  # basis functions                  46          :
          :  # atomic orbitals                  45          :
          :  # shells                           23          :
          :  # electrons                        44          :
          :  max. iterations                   250          :
          :  Hamiltonian                  GFN2-xTB          :
          :  restarted?                      false          :
          :  GBSA solvation                  false          :
          :  PC potential                    false          :
          :  electronic temp.          300.0000000     K    :
          :  accuracy                    1.0000000          :
          :  -> integral cutoff          0.2500000E+02      :
          :  -> integral neglect         0.1000000E-07      :
          :  -> SCF convergence          0.1000000E-05 Eh   :
          :  -> wf. convergence          0.1000000E-03 e    :
          :  Broyden damping             0.4000000          :
          ...................................................

 iter      E             dE          RMSdq      gap      omega  full diag
   1    -24.2033343 -0.242033E+02  0.507E+00    2.43       0.0  T
   2    -24.2371008 -0.337665E-01  0.335E+00    2.29       1.0  T
   3    -24.2384263 -0.132550E-02  0.163E+00    2.39       1.0  T
   4    -24.2500439 -0.116176E-01  0.320E-01    2.29       1.0  T
   5    -24.2502763 -0.232358E-03  0.129E-01    2.29       1.0  T
   6    -24.2503094 -0.331395E-04  0.802E-02    2.30       1.0  T
   7    -24.2503555 -0.460887E-04  0.264E-02    2.30       1.1  T
   8    -24.2503557 -0.147170E-06  0.893E-03    2.30       3.1  T
   9    -24.2503561 -0.399744E-06  0.301E-03    2.30       9.2  T
  10    -24.2503561 -0.591076E-08  0.878E-04    2.30      31.6  T
  11    -24.2503561 -0.244001E-08  0.383E-04    2.30      72.5  T

   *** convergence criteria satisfied after 11 iterations ***

         #    Occupation            Energy/Eh            Energy/eV
      -------------------------------------------------------------
         1        2.0000           -0.7555130             -20.5586
       ...           ...                  ...                  ...
        16        2.0000           -0.4637607             -12.6196
        17        2.0000           -0.4608865             -12.5414
        18        2.0000           -0.4521752             -12.3043
        19        2.0000           -0.4194167             -11.4129
        20        2.0000           -0.4146486             -11.2832
        21        2.0000           -0.4093746             -11.1396
        22        2.0000           -0.3989394             -10.8557 (HOMO)
        23                         -0.3144450              -8.5565 (LUMO)
        24                         -0.2307634              -6.2794
        25                         -0.2252427              -6.1292
        26                         -0.2190629              -5.9610
        27                         -0.1565037              -4.2587
       ...                                ...                  ...
        45                          0.6386208              17.3778
      -------------------------------------------------------------
                  HL-Gap            0.0844944 Eh            2.2992 eV
             Fermi-level           -0.3566922 Eh           -9.7061 eV

 SCC (total)                   0 d,  0 h,  0 min,  0.019 sec
 SCC setup                      ...        0 min,  0.000 sec (  1.082%)
 Dispersion                     ...        0 min,  0.000 sec (  0.676%)
 integral evaluation            ...        0 min,  0.004 sec ( 23.335%)
 zeroth order Hamiltonian       ...        0 min,  0.000 sec (  0.535%)
 iterations                     ...        0 min,  0.007 sec ( 38.711%)
 molecular gradient             ...        0 min,  0.006 sec ( 33.943%)
 printout                       ...        0 min,  0.000 sec (  1.460%)

         :::::::::::::::::::::::::::::::::::::::::::::::::::::
         ::                     SUMMARY                     ::
         :::::::::::::::::::::::::::::::::::::::::::::::::::::
         :: total energy             -23.952464292590 Eh    ::
         :: gradient norm              0.088764937680 Eh/a0 ::
         :: HOMO-LUMO gap              2.299208528801 eV    ::
         ::.................................................::
         :: SCC energy               -24.250356088121 Eh    ::
         :: -> isotropic ES            0.016114973215 Eh    ::
         :: -> anisotropic ES          0.002349615154 Eh    ::
         :: -> anisotropic XC          0.018493779399 Eh    ::
         :: -> dispersion             -0.013011141259 Eh    ::
         :: repulsion energy           0.297870193261 Eh    ::
         :: add. restraining           0.000000000000 Eh    ::
         :::::::::::::::::::::::::::::::::::::::::::::::::::::

      ----------------------------------------------------------- 
     |                   =====================                   |
     |                        A N C O P T                        |
     |                   =====================                   |
     |               Approximate Normal Coordinate               |
     |                Rational Function Optimizer                |
      ----------------------------------------------------------- 

          ...................................................
          :                      SETUP                      :
          :.................................................:
          :   optimization level            normal          :
          :   max. optcycles                   200          :
          :   ANC micro-cycles                  20          :
          :   degrees of freedom                33          :
          :.................................................:
          :   RF solver                   davidson          :
          :   input Hessian                  false          :
          :   write xtbopt.log                true          :
          :   linear?                        false          :
          :   energy convergence         0.5000000E-05 Eh   :
          :   grad. convergence          0.1000000E-02 Eh/α :
          :   maximium RF displ.         2.0000000          :
          :   Hlow (freq-cutoff)         0.5000000E-02      :
          :   Hmax (freq-cutoff)         5.0000000          :
          :   S6 in model hess.         20.0000000          :
          ...................................................

generating ANC from model Hessian ...
Using Lindh-Hessian (1995)
 Shifting diagonal of input Hessian by   0.000000000000000E+000
 Lowest  eigenvalues of input Hessian
   -0.000000   -0.000000   -0.000000   -0.000000    0.000000    0.000000
    0.009488    0.014176    0.018797    0.024699    0.048576    0.063982
    0.072922    0.086082    0.089069    0.089924    0.090346    0.103592
 Highest eigenvalues
    1.460763    1.641287    1.661502    1.782785    1.874596    1.998740
 

........................................................................
.............................. CYCLE    1 ..............................
........................................................................
   1    -24.2503561 -0.242504E+02  0.122E-04    2.30       0.0  T
   2    -24.2503561  0.471907E-10  0.128E-04    2.30     217.5  T
   3    -24.2503561 -0.190834E-09  0.295E-05    2.30     941.2  T
     SCC iter.                  ...        0 min,  0.002 sec
     gradient                   ...        0 min,  0.006 sec
 * total energy  :   -23.9524643 Eh     change       -0.4522906E-08 Eh
   gradient norm :     0.0887638 Eh/α   predicted     0.0000000E+00 (-100.00%)
   displ. norm   :     0.2131742 α      lambda       -0.1425436E-01
   maximum displ.:     0.1354563 α      in ANC's #16, #19, #12, ...

........................................................................
.............................. CYCLE    2 ..............................
........................................................................
   1    -24.2947650 -0.242948E+02  0.619E-01    2.46       0.0  T
   2    -24.2949654 -0.200381E-03  0.250E-01    2.45       1.0  T
   3    -24.2949780 -0.126327E-04  0.548E-02    2.44       1.0  T
   4    -24.2949804 -0.240057E-05  0.304E-02    2.45       1.0  T
   5    -24.2949814 -0.947090E-06  0.130E-02    2.44       2.1  T
   6    -24.2949821 -0.746938E-06  0.320E-03    2.45       8.7  T
   7    -24.2949821  0.534646E-08  0.223E-03    2.45      12.4  T
     SCC iter.                  ...        0 min,  0.004 sec
     gradient                   ...        0 min,  0.006 sec
 * total energy  :   -23.9617240 Eh     change       -0.9259687E-02 Eh
   gradient norm :     0.0425445 Eh/α   predicted    -0.7451057E-02 ( -19.53%)
   displ. norm   :     0.0909874 α      lambda       -0.2629376E-02
   maximum displ.:     0.0522745 α      in ANC's #16, #19, #12, ...

........................................................................
.............................. CYCLE    3 ..............................
........................................................................
   1    -24.3117800 -0.243118E+02  0.266E-01    2.58       0.0  T
   2    -24.3118470 -0.669880E-04  0.967E-02    2.55       1.0  T
   3    -24.3118497 -0.275364E-05  0.502E-02    2.56       1.0  T
   4    -24.3118532 -0.345299E-05  0.191E-02    2.56       1.5  T
   5    -24.3118551 -0.189229E-05  0.576E-03    2.56       4.8  T
   6    -24.3118551 -0.213043E-07  0.255E-03    2.56      10.9  T
     SCC iter.                  ...        0 min,  0.003 sec
     gradient                   ...        0 min,  0.006 sec
 * total energy  :   -23.9631940 Eh     change       -0.1469972E-02 Eh
   gradient norm :     0.0175273 Eh/α   predicted    -0.1325571E-02 (  -9.82%)
   displ. norm   :     0.0234737 α      lambda       -0.3378037E-03
   maximum displ.:     0.0132994 α      in ANC's #25, #11, #29, ...

........................................................................
.............................. CYCLE    4 ..............................
........................................................................
   1    -24.3112589 -0.243113E+02  0.156E-01    2.60       0.0  T
   2    -24.3112822 -0.233831E-04  0.518E-02    2.58       1.0  T
   3    -24.3112847 -0.240272E-05  0.253E-02    2.59       1.1  T
   4    -24.3112879 -0.320136E-05  0.938E-03    2.59       3.0  T
   5    -24.3112880 -0.174499E-06  0.353E-03    2.59       7.9  T
   6    -24.3112880 -0.304617E-08  0.107E-03    2.59      26.0  T
   7    -24.3112880 -0.120980E-07  0.319E-04    2.59      87.1  T
     SCC iter.                  ...        0 min,  0.004 sec
     gradient                   ...        0 min,  0.006 sec
 * total energy  :   -23.9634270 Eh     change       -0.2330372E-03 Eh
   gradient norm :     0.0083053 Eh/α   predicted    -0.1689945E-03 ( -27.48%)
   displ. norm   :     0.0176594 α      lambda       -0.1110189E-03
   maximum displ.:     0.0090764 α      in ANC's #16, #11, #25, ...

........................................................................
.............................. CYCLE    5 ..............................
........................................................................
   1    -24.3094504 -0.243095E+02  0.119E-01    2.60       0.0  T
   2    -24.3094624 -0.119381E-04  0.385E-02    2.60       1.0  T
   3    -24.3094634 -0.100224E-05  0.174E-02    2.60       1.6  T
   4    -24.3094652 -0.186360E-05  0.608E-03    2.60       4.6  T
   5    -24.3094653 -0.763982E-07  0.234E-03    2.60      11.8  T
   6    -24.3094653 -0.125485E-08  0.387E-04    2.60      71.6  T
     SCC iter.                  ...        0 min,  0.003 sec
     gradient                   ...        0 min,  0.006 sec
 * total energy  :   -23.9634867 Eh     change       -0.5975558E-04 Eh
   gradient norm :     0.0026777 Eh/α   predicted    -0.5552648E-04 (  -7.08%)
   displ. norm   :     0.0029632 α      lambda       -0.5069899E-05
   maximum displ.:     0.0015442 α      in ANC's #12, #32, #8, ...

........................................................................
.............................. CYCLE    6 ..............................
........................................................................
   1    -24.3093349 -0.243093E+02  0.165E-02    2.60       0.0  T
   2    -24.3093351 -0.210924E-06  0.510E-03    2.60       5.4  T
   3    -24.3093351 -0.605909E-08  0.228E-03    2.60      12.2  T
   4    -24.3093351 -0.142231E-07  0.961E-04    2.60      28.9  T
   5    -24.3093351 -0.344921E-08  0.292E-04    2.60      94.9  T
     SCC iter.                  ...        0 min,  0.003 sec
     gradient                   ...        0 min,  0.006 sec
 * total energy  :   -23.9634903 Eh     change       -0.3576541E-05 Eh
   gradient norm :     0.0012808 Eh/α   predicted    -0.2535033E-05 ( -29.12%)
   displ. norm   :     0.0030877 α      lambda       -0.1987757E-05
   maximum displ.:     0.0018489 α      in ANC's #32, #12, #8, ...

........................................................................
.............................. CYCLE    7 ..............................
........................................................................
   1    -24.3094463 -0.243094E+02  0.148E-02    2.59       0.0  T
   2    -24.3094465 -0.159745E-06  0.480E-03    2.59       5.8  T
   3    -24.3094465 -0.294758E-08  0.193E-03    2.59      14.4  T
   4    -24.3094465  0.554433E-09  0.691E-04    2.59      40.1  T
   5    -24.3094465 -0.246716E-08  0.241E-04    2.59     115.2  T
     SCC iter.                  ...        0 min,  0.003 sec
     gradient                   ...        0 min,  0.006 sec
 * total energy  :   -23.9634912 Eh     change       -0.9036638E-06 Eh
   gradient norm :     0.0005159 Eh/α   predicted    -0.9947657E-06 (  10.08%)
   displ. norm   :     0.0013230 α      lambda       -0.2679063E-06
   maximum displ.:     0.0007506 α      in ANC's #11, #12, #8, ...

   *** GEOMETRY OPTIMIZATION CONVERGED AFTER 7 ITERATIONS ***

------------------------------------------------------------------------
 total energy gain   :        -0.0110269 Eh       -6.9195 kcal/mol
 total RMSD          :         0.0810729 a0        0.0429 Å
 total power (kW/mol):        -4.1358881 (step) -287.4571 (real)
------------------------------------------------------------------------

 ANCopt (total)                0 d,  0 h,  0 min,  0.101 sec
 optimizer setup                ...        0 min,  0.000 sec (  0.132%)
 model hessian                  ...        0 min,  0.001 sec (  1.206%)
 ANC generation                 ...        0 min,  0.000 sec (  0.309%)
 coordinate transformation      ...        0 min,  0.000 sec (  0.078%)
 single point calculation       ...        0 min,  0.097 sec ( 96.234%)
 optimization log               ...        0 min,  0.000 sec (  0.458%)
 hessian update                 ...        0 min,  0.000 sec (  0.065%)
 rational function              ...        0 min,  0.001 sec (  1.031%)

================
 final structure:
================
$coord
   -1.75482840405777   -2.71255176258676    0.00078119488125      C 
   -3.96688572547913   -1.37950637898422   -0.00028244430175      C 
   -4.00346912192960    1.28710135990167   -0.00114704376533      C 
   -1.82881363960203    2.68032869237816   -0.00096159498076      C 
    0.48342253809363    1.37590139533023    0.00012322323428      C 
    0.52075339834519   -1.34518351057090    0.00100584788801      C 
    2.87200273819710   -2.25802427387627    0.00197436491127      N 
    4.81359961070950    0.07450936928013    0.00177083820616      S 
    2.80874507080665    2.35290095230007    0.00050306808313      N 
   -1.70865630953166   -4.74931591643965    0.00143704890615      H 
   -5.74726502688747   -2.37725293906713   -0.00047025497535      H 
   -5.81054936232612    2.23563121210988   -0.00195062162620      H 
   -1.83853337265117    4.71759289331069   -0.00159309911280      H 
$end
           -------------------------------------------------
          |                Final Singlepoint                |
           -------------------------------------------------

          ...................................................
          :                      SETUP                      :
          :.................................................:
          :  # basis functions                  46          :
          :  # atomic orbitals                  45          :
          :  # shells                           23          :
          :  # electrons                        44          :
          :  max. iterations                   250          :
          :  Hamiltonian                  GFN2-xTB          :
          :  restarted?                      false          :
          :  GBSA solvation                  false          :
          :  PC potential                    false          :
          :  electronic temp.          300.0000000     K    :
          :  accuracy                    1.0000000          :
          :  -> integral cutoff          0.2500000E+02      :
          :  -> integral neglect         0.1000000E-07      :
          :  -> SCF convergence          0.1000000E-05 Eh   :
          :  -> wf. convergence          0.1000000E-03 e    :
          :  Broyden damping             0.4000000          :
          ...................................................

 iter      E             dE          RMSdq      gap      omega  full diag
   1    -24.3094465 -0.243094E+02  0.826E-05    2.59       0.0  T
   2    -24.3094465 -0.245493E-11  0.302E-05    2.59     917.7  T
   3    -24.3094465  0.113332E-11  0.189E-05    2.59    1469.5  T

   *** convergence criteria satisfied after 3 iterations ***

         #    Occupation            Energy/Eh            Energy/eV
      -------------------------------------------------------------
         1        2.0000           -0.7611793             -20.7127
       ...           ...                  ...                  ...
        16        2.0000           -0.4612058             -12.5500
        17        2.0000           -0.4575789             -12.4514
        18        2.0000           -0.4526779             -12.3180
        19        2.0000           -0.4119029             -11.2084
        20        2.0000           -0.4106408             -11.1741
        21        2.0000           -0.4095016             -11.1431
        22        2.0000           -0.4007289             -10.9044 (HOMO)
        23                         -0.3054770              -8.3125 (LUMO)
        24                         -0.2217234              -6.0334
        25                         -0.2174857              -5.9181
        26                         -0.2129581              -5.7949
        27                         -0.1371057              -3.7308
       ...                                ...                  ...
        45                          0.7306002              19.8806
      -------------------------------------------------------------
                  HL-Gap            0.0952519 Eh            2.5919 eV
             Fermi-level           -0.3531029 Eh           -9.6084 eV

 SCC (total)                   0 d,  0 h,  0 min,  0.013 sec
 SCC setup                      ...        0 min,  0.000 sec (  1.017%)
 Dispersion                     ...        0 min,  0.000 sec (  0.593%)
 integral evaluation            ...        0 min,  0.004 sec ( 30.716%)
 zeroth order Hamiltonian       ...        0 min,  0.000 sec (  0.578%)
 iterations                     ...        0 min,  0.002 sec ( 16.131%)
 molecular gradient             ...        0 min,  0.006 sec ( 48.887%)
 printout                       ...        0 min,  0.000 sec (  1.651%)

         :::::::::::::::::::::::::::::::::::::::::::::::::::::
         ::                     SUMMARY                     ::
         :::::::::::::::::::::::::::::::::::::::::::::::::::::
         :: total energy             -23.963491231079 Eh    ::
         :: gradient norm              0.000515996337 Eh/a0 ::
         :: HOMO-LUMO gap              2.591936597534 eV    ::
         ::.................................................::
         :: SCC energy               -24.309446473093 Eh    ::
         :: -> isotropic ES            0.017644134780 Eh    ::
         :: -> anisotropic ES          0.002716119145 Eh    ::
         :: -> anisotropic XC          0.017811813769 Eh    ::
         :: -> dispersion             -0.013066506396 Eh    ::
         :: repulsion energy           0.345935745350 Eh    ::
         :: add. restraining           0.000000000000 Eh    ::
         :::::::::::::::::::::::::::::::::::::::::::::::::::::

           -------------------------------------------------
          |                Property Printout                |
           -------------------------------------------------

    * Orbital Energies and Occupations

         #    Occupation            Energy/Eh            Energy/eV
      -------------------------------------------------------------
         1        2.0000           -0.7611793             -20.7127
       ...           ...                  ...                  ...
        10        2.0000           -0.5320496             -14.4778
        11        2.0000           -0.5313622             -14.4591
        12        2.0000           -0.5205700             -14.1654
        13        2.0000           -0.4970021             -13.5241
        14        2.0000           -0.4742949             -12.9062
        15        2.0000           -0.4740747             -12.9002
        16        2.0000           -0.4612058             -12.5500
        17        2.0000           -0.4575789             -12.4514
        18        2.0000           -0.4526779             -12.3180
        19        2.0000           -0.4119029             -11.2084
        20        2.0000           -0.4106408             -11.1741
        21        2.0000           -0.4095016             -11.1431
        22        2.0000           -0.4007289             -10.9044 (HOMO)
        23                         -0.3054770              -8.3125 (LUMO)
        24                         -0.2217234              -6.0334
        25                         -0.2174857              -5.9181
        26                         -0.2129581              -5.7949
        27                         -0.1371057              -3.7308
        28                         -0.1028385              -2.7984
        29                          0.0126476               0.3442
        30                          0.0315914               0.8596
        31                          0.0464824               1.2649
        32                          0.1163075               3.1649
        33                          0.1241437               3.3781
       ...                                ...                  ...
        45                          0.7306002              19.8806
      -------------------------------------------------------------
                  HL-Gap            0.0952519 Eh            2.5919 eV
             Fermi-level           -0.3531029 Eh           -9.6084 eV

     #   Z        covCN         q      C6AA      α(0)
     1   6 C      2.907    -0.039    28.978     8.827
     2   6 C      2.920    -0.028    28.704     8.786
     3   6 C      2.920    -0.028    28.704     8.786
     4   6 C      2.907    -0.039    28.978     8.827
     5   6 C      3.355     0.075    23.615     7.645
     6   6 C      3.355     0.075    23.615     7.645
     7   7 N      1.852    -0.268    27.821     7.818
     8  16 S      2.691     0.338   128.022    19.043
     9   7 N      1.852    -0.268    27.821     7.818
    10   1 H      0.926     0.049     2.327     2.386
    11   1 H      0.926     0.042     2.423     2.434
    12   1 H      0.926     0.042     2.423     2.434
    13   1 H      0.926     0.049     2.327     2.386

 Mol. C6AA /au·bohr⁶  :       3499.408041
 Mol. C8AA /au·bohr⁸  :     100850.599122
 Mol. α(0) /au        :         94.832840


Wiberg/Mayer (AO) data.
largest (>0.10) Wiberg bond orders for each atom
          total WBO             WBO to atom ...
     1  C   3.991        C    2 1.574    C    6 1.252    H   10 0.967    C    4 0.119
     2  C   3.992        C    1 1.574    C    3 1.296    H   11 0.970
     3  C   3.992        C    4 1.574    C    2 1.296    H   12 0.970
     4  C   3.991        C    3 1.574    C    5 1.252    H   13 0.967    C    1 0.119
     5  C   3.976        N    9 1.374    C    4 1.252    C    6 1.163
     6  C   3.976        N    7 1.374    C    1 1.252    C    5 1.163
     7  N   3.085        S    8 1.442    C    6 1.374    N    9 0.174
     8  S   3.219        N    9 1.442    N    7 1.442
     9  N   3.085        S    8 1.442    C    5 1.374    N    7 0.174
    10  H   0.998        C    1 0.967
    11  H   0.997        C    2 0.970
    12  H   0.997        C    3 0.970
    13  H   0.998        C    4 0.967

molecular dipole:
                 x           y           z       tot (Debye)
 q only:       -0.115      -0.002      -0.000
   full:       -0.459      -0.006      -0.000       1.168
molecular quadrupole (traceless):
                xx          xy          yy          xz          yz          zz
 q only:        5.802       0.124      -3.340       0.002       0.000      -2.462
  q+dip:        5.738       0.109      -2.664       0.002      -0.000      -3.074
   full:        4.677       0.118      -4.352       0.001       0.001      -0.325

           -------------------------------------------------
          |                Geometry Summary                 |
           -------------------------------------------------

      molecular mass/u    :      136.1710000
   center of mass at/Å    :        0.3573457       0.0093850       0.0003229
  moments of inertia/u·Å² :        0.1306897E+03   0.4047492E+03   0.5354389E+03
rotational constants/cm⁻¹ :        0.1289897E+00   0.4164958E-01   0.3148376E-01

 * 14 selected distances

     #   Z        #   Z                                     value/Å
     1   6 C      2   6 C                                 1.3666927
     2   6 C      3   6 C                                 1.4112410
     3   6 C      4   6 C                                 1.3666928
     4   6 C      5   6 C                                 1.4048603
     1   6 C      6   6 C                                 1.4048603
     5   6 C      6   6 C                                 1.4400718
     6   6 C      7   7 N                                 1.3347077
     7   7 N      8  16 S                                 1.6059908 (max)
     5   6 C      9   7 N                                 1.3347077
     8  16 S      9   7 N                                 1.6059908
     1   6 C     10   1 H                                 1.0780862
     2   6 C     11   1 H                                 1.0799947
     3   6 C     12   1 H                                 1.0799947
     4   6 C     13   1 H                                 1.0780862 (min)

 * 4 distinct bonds (by element types)

   Z      Z             #   av. dist./Å        max./Å        min./Å
   1 H    6 C           4     1.0790405     1.0799947     1.0780862
   6 C    6 C           6     1.3990698     1.4400718     1.3666927
   6 C    7 N           2     1.3347077     1.3347077     1.3347077
   7 N   16 S           2     1.6059908     1.6059908     1.6059908


optimized geometry written to: xtbopt.xyz


           -------------------------------------------------
          | TOTAL ENERGY              -23.963491231079 Eh   |
          | GRADIENT NORM               0.000515996337 Eh/α |
          | HOMO-LUMO GAP               2.591936597534 eV   |
           -------------------------------------------------

------------------------------------------------------------------------
 * finished run on 2021/02/19 at 08:12:36.429     
------------------------------------------------------------------------
 total:
 * wall-time:     0 d,  0 h,  0 min,  0.153 sec
 *  cpu-time:     0 d,  0 h,  0 min,  0.147 sec
 * ratio c/w:     0.959 speedup
 SCF:
 * wall-time:     0 d,  0 h,  0 min,  0.019 sec
 *  cpu-time:     0 d,  0 h,  0 min,  0.019 sec
 * ratio c/w:     0.996 speedup
 ANC optimizer:
 * wall-time:     0 d,  0 h,  0 min,  0.114 sec
 *  cpu-time:     0 d,  0 h,  0 min,  0.114 sec
 * ratio c/w:     0.996 speedup

