      -----------------------------------------------------------      
     |                   =====================                   |     
     |                           x T B                           |     
     |                   =====================                   |     
     |                         S. Grimme                         |     
     |          Mulliken Center for Theoretical Chemistry        |     
     |                    University of Bonn                     |     
     |                Version 6.2 RC2 (SAW190805)                |     
      -----------------------------------------------------------      

   This program is distributed in the hope that it will be useful,
   but WITHOUT ANY WARRANTY; without even the implied warranty of
   MERCHANTABILITY or FITNESS FOR A PARTICULAR PURPOSE.
   
   FOR NON-COMMERCIAL, ACADEMIA USE ONLY.
   
   Cite this work as:
   * S. Grimme, C. Bannwarth, P. Shushkov, J. Chem. Theory Comput., 2017,
     13, 1989-2009. DOI: 10.1021/acs.jctc.7b00118
   * C. Bannwarth, S. Ehlert and S. Grimme., J. Chem. Theory Comput., 2019,
     15, 1652-1671. DOI: 10.1021/acs.jctc.8b01176
   * P. Pracht, E. Caldeweyher, S. Ehlert, S. Grimme, ChemRxiv, 2019, preprint.
     DOI: 10.26434/chemrxiv.8326202.v1
   
   for DFT-D4:
   * E. Caldeweyher, C. Bannwarth and S. Grimme, J. Chem. Phys., 2017,
     147, 034112. DOI: 10.1063/1.4993215
   * E. Caldeweyher, S. Ehlert, A. Hansen, H. Neugebauer, S. Spicher,
     C. Bannwarth and S. Grimme, J. Chem. Phys., 2019, 150, 154122.
     DOI: 10.1063/1.5090222
   
   for sTDA-xTB:
   * S. Grimme and C. Bannwarth, J. Chem. Phys., 2016, 145, 054103.
     DOI: 10.1063/1.4959605
   
   in the mass-spec context:
   * V. Asgeirsson, C. Bauer and S. Grimme, Chem. Sci., 2017, 8, 4879.
     DOI: 10.1039/c7sc00601b
   
   for metadynamics refer to:
   * S. Grimme, J. Chem. Theory Comput., 2019, 155, 2847-2862
     DOI: 10.1021/acs.jctc.9b00143
   
   with help from (in alphabetical order)
   C. Bannwarth, F. Bohle, G. Brandenburg, E. Caldeweyher, M. Checinski,
   S. Dohm, S. Ehlert, S. Ehrlich, F. März, H. Neugebauer, J. Pisarek,
   P. Pracht, P. Shushkov, and S. Spicher.
   
 * started run on 2021/02/19 at 08:12:39.028     

           -------------------------------------------------
          |                Calculation Setup                |
           -------------------------------------------------

          program call               : /ihome/ghutchison/geoffh/xtb/xtb 3utl.xyz -opt
          hostname                   : smp-n135
          coordinate file            : 3utl.xyz
          omp threads                :                     1
          number of atoms            :                    14
          number of electrons        :                    60
          charge                     :                     0
          spin                       :                   0.0
          first test random number   :      0.53056665887039


########################################################################
# WARNING! Please study the warnings concerning your input carefully
#  - the use of '-opt' is discouraged, please use '--opt' next time
########################################################################

           ------------------------------------------------- 
          |                 G F N 2 - x T B                 |
          | Geometry, Frequencies, Noncovalent interactions |
          |            JCTC 2019 parametrisation            |
           ------------------------------------------------- 
             KAB for C  - Si     :                1.0500
             KAB for H  - Pd     :                0.9500
             k(s)              :                1.8500
             k(p)              :                2.2300
             k(d)              :                2.2300
             k(f)              :                2.0000
             kEN (H0ij)        :               -2.0000
             D4 a1             :                0.5200
             D4 a2             :                5.0000
             D4 s6             :                1.0000
             D4 s8             :                2.7000
             D4 s9             :                5.0000
             alphaj            :                2.0000

  Z AO/shell   Hii/eV     exponent
  1     Wed Apr 25 08:07:45 CEST 2018   EN: 2.200 GM2: 0.406  GM3: 0.0800  RAES: 1.40
     1s    -10.707211    1.230000
  6     Wed Apr 25 08:07:45 CEST 2018   EN: 2.550 GM2: 0.538  GM3: 0.1500  RAES: 3.00
     2s    -13.970922    2.096432
     2p    -10.063292    1.800000
  7     Wed Apr 25 08:07:45 CEST 2018   EN: 3.040 GM2: 0.461  GM3:-0.0640  RAES: 1.90
     2s    -16.686243    2.339881
     2p    -12.523956    2.014332
  8     Wed Apr 25 08:07:45 CEST 2018   EN: 3.440 GM2: 0.452  GM3:-0.0517  RAES: 1.80
     2s    -20.229985    2.439742
     2p    -15.503117    2.137023
 16     Tue Apr 24 11:44:34 CEST 2018   EN: 2.580 GM2: 0.340  GM3:-0.0502  RAES: 3.10
     3s    -20.029654    1.981333
     3p    -11.377694    2.025643
     3d     -0.420282    1.702555

           ------------------------------------------------- 
          |        Self-Consistent Charge Iterations        |
           ------------------------------------------------- 

          ...................................................
          :                      SETUP                      :
          :.................................................:
          :  # basis functions                  59          :
          :  # atomic orbitals                  58          :
          :  # shells                           28          :
          :  # electrons                        60          :
          :  max. iterations                   250          :
          :  Hamiltonian                  GFN2-xTB          :
          :  restarted?                      false          :
          :  GBSA solvation                  false          :
          :  PC potential                    false          :
          :  electronic temp.          300.0000000     K    :
          :  accuracy                    1.0000000          :
          :  -> integral cutoff          0.2500000E+02      :
          :  -> integral neglect         0.1000000E-07      :
          :  -> SCF convergence          0.1000000E-05 Eh   :
          :  -> wf. convergence          0.1000000E-03 e    :
          :  Broyden damping             0.4000000          :
          ...................................................

 iter      E             dE          RMSdq      gap      omega  full diag
   1    -33.8581803 -0.338582E+02  0.861E+00    1.92       0.0  T
   2    -33.7680393  0.901409E-01  0.639E+00    1.84       1.0  T
   3    -33.8495396 -0.815003E-01  0.437E+00    1.66       1.0  T
   4    -33.9709156 -0.121376E+00  0.196E+00    1.57       1.0  T
   5    -34.0149666 -0.440510E-01  0.580E-01    1.62       1.0  T
   6    -34.0163816 -0.141507E-02  0.260E-01    1.62       1.0  T
   7    -34.0166995 -0.317823E-03  0.125E-01    1.64       1.0  T
   8    -34.0168284 -0.128986E-03  0.528E-02    1.64       1.0  T
   9    -34.0168399 -0.114663E-04  0.340E-02    1.63       1.0  T
  10    -34.0168449 -0.503922E-05  0.154E-02    1.63       1.7  T
  11    -34.0168471 -0.210745E-05  0.584E-03    1.63       4.6  T
  12    -34.0168472 -0.111241E-06  0.265E-03    1.63      10.1  T
  13    -34.0168472 -0.187259E-07  0.160E-03    1.63      16.7  T
  14    -34.0168472 -0.119041E-07  0.478E-04    1.63      55.9  T
  15    -34.0168472 -0.245637E-08  0.193E-04    1.63     138.3  T

   *** convergence criteria satisfied after 15 iterations ***

         #    Occupation            Energy/Eh            Energy/eV
      -------------------------------------------------------------
         1        2.0000           -0.7965229             -21.6745
       ...           ...                  ...                  ...
        24        2.0000           -0.5071190             -13.7994
        25        2.0000           -0.4826352             -13.1332
        26        2.0000           -0.4816992             -13.1077
        27        2.0000           -0.4773788             -12.9901
        28        2.0000           -0.4711989             -12.8220
        29        2.0000           -0.4603733             -12.5274
        30        2.0000           -0.4508380             -12.2679 (HOMO)
        31                         -0.3907974             -10.6341 (LUMO)
        32                         -0.3240965              -8.8191
        33                         -0.3098344              -8.4310
        34                         -0.2868999              -7.8069
        35                         -0.2766779              -7.5288
       ...                                ...                  ...
        58                          1.0533876              28.6641
      -------------------------------------------------------------
                  HL-Gap            0.0600406 Eh            1.6338 eV
             Fermi-level           -0.4208177 Eh          -11.4510 eV

 SCC (total)                   0 d,  0 h,  0 min,  0.030 sec
 SCC setup                      ...        0 min,  0.000 sec (  0.730%)
 Dispersion                     ...        0 min,  0.000 sec (  0.576%)
 integral evaluation            ...        0 min,  0.007 sec ( 23.416%)
 zeroth order Hamiltonian       ...        0 min,  0.000 sec (  0.423%)
 iterations                     ...        0 min,  0.013 sec ( 42.163%)
 molecular gradient             ...        0 min,  0.009 sec ( 31.564%)
 printout                       ...        0 min,  0.000 sec (  0.971%)

         :::::::::::::::::::::::::::::::::::::::::::::::::::::
         ::                     SUMMARY                     ::
         :::::::::::::::::::::::::::::::::::::::::::::::::::::
         :: total energy             -33.511597671687 Eh    ::
         :: gradient norm              0.265052322192 Eh/a0 ::
         :: HOMO-LUMO gap              1.633788709577 eV    ::
         ::.................................................::
         :: SCC energy               -34.016847194713 Eh    ::
         :: -> isotropic ES            0.043831198626 Eh    ::
         :: -> anisotropic ES          0.005520755043 Eh    ::
         :: -> anisotropic XC          0.057191622658 Eh    ::
         :: -> dispersion             -0.016766595001 Eh    ::
         :: repulsion energy           0.505206939061 Eh    ::
         :: add. restraining           0.000000000000 Eh    ::
         :::::::::::::::::::::::::::::::::::::::::::::::::::::

      ----------------------------------------------------------- 
     |                   =====================                   |
     |                        A N C O P T                        |
     |                   =====================                   |
     |               Approximate Normal Coordinate               |
     |                Rational Function Optimizer                |
      ----------------------------------------------------------- 

          ...................................................
          :                      SETUP                      :
          :.................................................:
          :   optimization level            normal          :
          :   max. optcycles                   200          :
          :   ANC micro-cycles                  20          :
          :   degrees of freedom                36          :
          :.................................................:
          :   RF solver                   davidson          :
          :   input Hessian                  false          :
          :   write xtbopt.log                true          :
          :   linear?                        false          :
          :   energy convergence         0.5000000E-05 Eh   :
          :   grad. convergence          0.1000000E-02 Eh/α :
          :   maximium RF displ.         2.0000000          :
          :   Hlow (freq-cutoff)         0.5000000E-02      :
          :   Hmax (freq-cutoff)         5.0000000          :
          :   S6 in model hess.         20.0000000          :
          ...................................................

generating ANC from model Hessian ...
Using Lindh-Hessian (1995)
 Shifting diagonal of input Hessian by   4.375143147339153E-003
 Lowest  eigenvalues of input Hessian
   -0.000000   -0.000000    0.000000    0.000000    0.000000    0.000000
    0.005000    0.006241    0.007837    0.008940    0.009267    0.016007
    0.018462    0.027220    0.037253    0.045434    0.067829    0.075499
 Highest eigenvalues
    1.679942    1.887126    2.017649    2.213208    2.543385    2.559847
 

........................................................................
.............................. CYCLE    1 ..............................
........................................................................
   1    -34.0168472 -0.340168E+02  0.800E-05    1.63       0.0  T
   2    -34.0168472  0.149853E-10  0.764E-05    1.63     349.9  T
   3    -34.0168472 -0.520188E-10  0.376E-05    1.63     711.1  T
     SCC iter.                  ...        0 min,  0.003 sec
     gradient                   ...        0 min,  0.009 sec
 * total energy  :   -33.5115977 Eh     change       -0.7634640E-08 Eh
   gradient norm :     0.2650525 Eh/α   predicted     0.0000000E+00 (-100.00%)
   displ. norm   :     0.3232062 α      lambda       -0.5721980E-01
   maximum displ.:     0.1886400 α      in ANC's #15, #10, #20, ...

........................................................................
.............................. CYCLE    2 ..............................
........................................................................
   1    -34.1360576 -0.341361E+02  0.640E-01    1.65       0.0  T
   2    -34.1363139 -0.256389E-03  0.377E-01    1.64       1.0  T
   3    -34.1360591  0.254880E-03  0.279E-01    1.64       1.0  T
   4    -34.1365900 -0.530961E-03  0.578E-02    1.63       1.0  T
   5    -34.1366278 -0.378071E-04  0.182E-02    1.63       1.5  T
   6    -34.1366291 -0.128266E-05  0.113E-02    1.63       2.4  T
   7    -34.1366302 -0.105683E-05  0.479E-03    1.63       5.6  T
   8    -34.1366303 -0.882222E-07  0.258E-03    1.63      10.4  T
     SCC iter.                  ...        0 min,  0.006 sec
     gradient                   ...        0 min,  0.009 sec
 * total energy  :   -33.5454658 Eh     change       -0.3386810E-01 Eh
   gradient norm :     0.0519937 Eh/α   predicted    -0.3159854E-01 (  -6.70%)
   displ. norm   :     0.2573782 α      lambda       -0.4309341E-02
   maximum displ.:     0.1375977 α      in ANC's #3, #6, #8, ...

........................................................................
.............................. CYCLE    3 ..............................
........................................................................
   1    -34.1467279 -0.341467E+02  0.378E-01    1.61       0.0  T
   2    -34.1467867 -0.587512E-04  0.207E-01    1.59       1.0  T
   3    -34.1466024  0.184211E-03  0.149E-01    1.60       1.0  T
   4    -34.1468278 -0.225330E-03  0.418E-02    1.59       1.0  T
   5    -34.1468436 -0.158458E-04  0.192E-02    1.59       1.4  T
   6    -34.1468458 -0.219903E-05  0.798E-03    1.59       3.4  T
   7    -34.1468463 -0.514496E-06  0.317E-03    1.59       8.4  T
   8    -34.1468464 -0.982925E-07  0.139E-03    1.59      19.2  T
     SCC iter.                  ...        0 min,  0.006 sec
     gradient                   ...        0 min,  0.009 sec
 * total energy  :   -33.5482802 Eh     change       -0.2814415E-02 Eh
   gradient norm :     0.0274160 Eh/α   predicted    -0.2297403E-02 ( -18.37%)
   displ. norm   :     0.3049108 α      lambda       -0.2026023E-02
   maximum displ.:     0.1570397 α      in ANC's #5, #4, #3, ...

........................................................................
.............................. CYCLE    4 ..............................
........................................................................
   1    -34.1463693 -0.341464E+02  0.484E-01    1.55       0.0  T
   2    -34.1464439 -0.745800E-04  0.274E-01    1.54       1.0  T
   3    -34.1459911  0.452832E-03  0.211E-01    1.55       1.0  T
   4    -34.1465209 -0.529851E-03  0.528E-02    1.54       1.0  T
   5    -34.1465511 -0.301747E-04  0.207E-02    1.54       1.3  T
   6    -34.1465533 -0.218820E-05  0.987E-03    1.54       2.7  T
   7    -34.1465540 -0.671635E-06  0.361E-03    1.54       7.4  T
   8    -34.1465540 -0.736592E-07  0.182E-03    1.54      14.7  T
     SCC iter.                  ...        0 min,  0.006 sec
     gradient                   ...        0 min,  0.009 sec
 * total energy  :   -33.5486016 Eh     change       -0.3213975E-03 Eh
   gradient norm :     0.0258738 Eh/α   predicted    -0.1107198E-02 ( 244.49%)
   displ. norm   :     0.2705379 α      lambda       -0.2027441E-02
   maximum displ.:     0.1961670 α      in ANC's #3, #6, #2, ...

........................................................................
.............................. CYCLE    5 ..............................
........................................................................
   1    -34.1455803 -0.341456E+02  0.495E-01    1.52       0.0  T
   2    -34.1456217 -0.414072E-04  0.276E-01    1.51       1.0  T
   3    -34.1451981  0.423683E-03  0.162E-01    1.51       1.0  T
   4    -34.1456654 -0.467370E-03  0.297E-02    1.51       1.0  T
   5    -34.1456738 -0.835318E-05  0.108E-02    1.51       2.5  T
   6    -34.1456739 -0.880979E-07  0.639E-03    1.51       4.2  T
   7    -34.1456741 -0.274910E-06  0.292E-03    1.51       9.1  T
   8    -34.1456742 -0.493377E-07  0.118E-03    1.51      22.7  T
     SCC iter.                  ...        0 min,  0.006 sec
     gradient                   ...        0 min,  0.009 sec
 * total energy  :   -33.5490049 Eh     change       -0.4032969E-03 Eh
   gradient norm :     0.0276946 Eh/α   predicted    -0.1087916E-02 ( 169.76%)
   displ. norm   :     0.2336643 α      lambda       -0.1800417E-02
   maximum displ.:     0.1410406 α      in ANC's #4, #1, #3, ...

........................................................................
.............................. CYCLE    6 ..............................
........................................................................
   1    -34.1424870 -0.341425E+02  0.551E-01    1.51       0.0  T
   2    -34.1425262 -0.392346E-04  0.310E-01    1.51       1.0  T
   3    -34.1420694  0.456776E-03  0.182E-01    1.51       1.0  T
   4    -34.1425843 -0.514836E-03  0.234E-02    1.51       1.1  T
   5    -34.1425914 -0.717997E-05  0.101E-02    1.51       2.6  T
   6    -34.1425923 -0.806227E-06  0.373E-03    1.51       7.2  T
   7    -34.1425923 -0.329546E-07  0.204E-03    1.51      13.1  T
     SCC iter.                  ...        0 min,  0.006 sec
     gradient                   ...        0 min,  0.009 sec
 * total energy  :   -33.5492002 Eh     change       -0.1952904E-03 Eh
   gradient norm :     0.0199566 Eh/α   predicted    -0.9493579E-03 ( 386.13%)
   displ. norm   :     0.1779544 α      lambda       -0.1271613E-02
   maximum displ.:     0.0995107 α      in ANC's #3, #2, #6, ...

........................................................................
.............................. CYCLE    7 ..............................
........................................................................
   1    -34.1508046 -0.341508E+02  0.434E-01    1.51       0.0  T
   2    -34.1508334 -0.288154E-04  0.239E-01    1.51       1.0  T
   3    -34.1507799  0.535061E-04  0.746E-02    1.51       1.0  T
   4    -34.1508506 -0.707010E-04  0.888E-03    1.51       3.0  T
   5    -34.1508508 -0.181593E-06  0.603E-03    1.51       4.4  T
   6    -34.1508511 -0.283761E-06  0.315E-03    1.51       8.5  T
   7    -34.1508511 -0.881580E-07  0.132E-03    1.51      20.3  T
   8    -34.1508511 -0.889420E-08  0.750E-04    1.51      35.6  T
     SCC iter.                  ...        0 min,  0.006 sec
     gradient                   ...        0 min,  0.009 sec
 * total energy  :   -33.5495818 Eh     change       -0.3816333E-03 Eh
   gradient norm :     0.0155322 Eh/α   predicted    -0.6559413E-03 (  71.88%)
   displ. norm   :     0.1444196 α      lambda       -0.4862981E-03
   maximum displ.:     0.1049278 α      in ANC's #3, #4, #7, ...

........................................................................
.............................. CYCLE    8 ..............................
........................................................................
   1    -34.1484840 -0.341485E+02  0.273E-01    1.50       0.0  T
   2    -34.1484957 -0.116807E-04  0.153E-01    1.50       1.0  T
   3    -34.1484276  0.680404E-04  0.759E-02    1.50       1.0  T
   4    -34.1485048 -0.771874E-04  0.137E-02    1.50       1.9  T
   5    -34.1485068 -0.194697E-05  0.679E-03    1.50       3.9  T
   6    -34.1485071 -0.304383E-06  0.304E-03    1.50       8.8  T
   7    -34.1485071 -0.643095E-07  0.104E-03    1.50      25.8  T
   8    -34.1485071 -0.396691E-08  0.501E-04    1.50      53.3  T
     SCC iter.                  ...        0 min,  0.006 sec
     gradient                   ...        0 min,  0.009 sec
 * total energy  :   -33.5496855 Eh     change       -0.1037010E-03 Eh
   gradient norm :     0.0080389 Eh/α   predicted    -0.2482208E-03 ( 139.36%)
   displ. norm   :     0.1032532 α      lambda       -0.2590538E-03
   maximum displ.:     0.0633732 α      in ANC's #2, #4, #1, ...

........................................................................
.............................. CYCLE    9 ..............................
........................................................................
   1    -34.1452993 -0.341453E+02  0.225E-01    1.50       0.0  T
   2    -34.1453060 -0.664236E-05  0.124E-01    1.50       1.0  T
   3    -34.1452523  0.536825E-04  0.610E-02    1.50       1.0  T
   4    -34.1453125 -0.602229E-04  0.974E-03    1.50       2.7  T
   5    -34.1453134 -0.876814E-06  0.522E-03    1.50       5.1  T
   6    -34.1453136 -0.238345E-06  0.166E-03    1.50      16.1  T
   7    -34.1453136 -0.930287E-08  0.654E-04    1.50      40.9  T
     SCC iter.                  ...        0 min,  0.005 sec
     gradient                   ...        0 min,  0.009 sec
 * total energy  :   -33.5498062 Eh     change       -0.1206887E-03 Eh
   gradient norm :     0.0085332 Eh/α   predicted    -0.1309058E-03 (   8.47%)
   displ. norm   :     0.0487205 α      lambda       -0.6895598E-04
   maximum displ.:     0.0351735 α      in ANC's #1, #2, #7, ...

........................................................................
.............................. CYCLE   10 ..............................
........................................................................
   1    -34.1480553 -0.341481E+02  0.660E-02    1.50       0.0  T
   2    -34.1480563 -0.985522E-06  0.349E-02    1.50       1.0  T
   3    -34.1480555  0.765174E-06  0.102E-02    1.50       2.6  T
   4    -34.1480566 -0.108834E-05  0.386E-03    1.50       6.9  T
   5    -34.1480566 -0.251854E-07  0.224E-03    1.50      11.9  T
   6    -34.1480567 -0.495284E-07  0.691E-04    1.50      38.7  T
     SCC iter.                  ...        0 min,  0.005 sec
     gradient                   ...        0 min,  0.009 sec
 * total energy  :   -33.5498471 Eh     change       -0.4087459E-04 Eh
   gradient norm :     0.0022915 Eh/α   predicted    -0.3456084E-04 ( -15.45%)
   displ. norm   :     0.1042047 α      lambda       -0.5132055E-04
   maximum displ.:     0.0663316 α      in ANC's #2, #1, #3, ...

........................................................................
.............................. CYCLE   11 ..............................
........................................................................
   1    -34.1481938 -0.341482E+02  0.116E-01    1.50       0.0  T
   2    -34.1481961 -0.231436E-05  0.632E-02    1.50       1.0  T
   3    -34.1481947  0.149555E-05  0.148E-02    1.50       1.8  T
   4    -34.1481967 -0.202452E-05  0.756E-03    1.49       3.5  T
   5    -34.1481971 -0.395251E-06  0.307E-03    1.50       8.7  T
   6    -34.1481971 -0.770958E-07  0.111E-03    1.49      24.2  T
   7    -34.1481972 -0.725460E-08  0.557E-04    1.50      48.0  T
   8    -34.1481972 -0.209944E-09  0.285E-04    1.50      93.7  T
     SCC iter.                  ...        0 min,  0.006 sec
     gradient                   ...        0 min,  0.009 sec
 * total energy  :   -33.5498883 Eh     change       -0.4117437E-04 Eh
   gradient norm :     0.0037370 Eh/α   predicted    -0.2593964E-04 ( -37.00%)
   displ. norm   :     0.2352015 α      lambda       -0.8637457E-04
   maximum displ.:     0.1478428 α      in ANC's #1, #2, #3, ...

........................................................................
.............................. CYCLE   12 ..............................
........................................................................
   1    -34.1469757 -0.341470E+02  0.267E-01    1.49       0.0  T
   2    -34.1469886 -0.129541E-04  0.143E-01    1.49       1.0  T
   3    -34.1469701  0.185426E-04  0.416E-02    1.49       1.0  T
   4    -34.1469920 -0.219287E-04  0.175E-02    1.49       1.5  T
   5    -34.1469943 -0.234855E-05  0.637E-03    1.49       4.2  T
   6    -34.1469945 -0.190887E-06  0.250E-03    1.49      10.7  T
   7    -34.1469946 -0.418759E-07  0.111E-03    1.49      24.0  T
   8    -34.1469946 -0.119982E-08  0.512E-04    1.49      52.2  T
   9    -34.1469946 -0.154255E-08  0.158E-04    1.49     169.4  T
     SCC iter.                  ...        0 min,  0.007 sec
     gradient                   ...        0 min,  0.009 sec
 * total energy  :   -33.5499374 Eh     change       -0.4910637E-04 Eh
   gradient norm :     0.0048771 Eh/α   predicted    -0.4558276E-04 (  -7.18%)
   displ. norm   :     0.0800687 α      lambda       -0.2914840E-04
   maximum displ.:     0.0527547 α      in ANC's #2, #1, #3, ...

........................................................................
.............................. CYCLE   13 ..............................
........................................................................
   1    -34.1478643 -0.341479E+02  0.847E-02    1.49       0.0  T
   2    -34.1478653 -0.107553E-05  0.480E-02    1.49       1.0  T
   3    -34.1478516  0.137315E-04  0.296E-02    1.49       1.0  T
   4    -34.1478667 -0.150855E-04  0.485E-03    1.49       5.5  T
   5    -34.1478669 -0.156397E-06  0.225E-03    1.49      11.9  T
   6    -34.1478669 -0.692434E-08  0.104E-03    1.49      25.6  T
     SCC iter.                  ...        0 min,  0.005 sec
     gradient                   ...        0 min,  0.009 sec
 * total energy  :   -33.5499571 Eh     change       -0.1974947E-04 Eh
   gradient norm :     0.0032244 Eh/α   predicted    -0.1466763E-04 ( -25.73%)
   displ. norm   :     0.0959490 α      lambda       -0.3254493E-04
   maximum displ.:     0.0611402 α      in ANC's #2, #1, #3, ...

........................................................................
.............................. CYCLE   14 ..............................
........................................................................
   1    -34.1487664 -0.341488E+02  0.114E-01    1.50       0.0  T
   2    -34.1487687 -0.229441E-05  0.619E-02    1.50       1.0  T
   3    -34.1487620  0.673958E-05  0.228E-02    1.50       1.2  T
   4    -34.1487698 -0.782363E-05  0.609E-03    1.50       4.4  T
   5    -34.1487700 -0.236818E-06  0.280E-03    1.50       9.6  T
   6    -34.1487701 -0.489185E-07  0.107E-03    1.50      25.0  T
   7    -34.1487701 -0.111990E-07  0.407E-04    1.50      65.7  T
   8    -34.1487701 -0.442917E-09  0.210E-04    1.50     127.2  T
     SCC iter.                  ...        0 min,  0.006 sec
     gradient                   ...        0 min,  0.009 sec
 * total energy  :   -33.5499772 Eh     change       -0.2010966E-04 Eh
   gradient norm :     0.0019450 Eh/α   predicted    -0.1642334E-04 ( -18.33%)
   displ. norm   :     0.0830536 α      lambda       -0.1213774E-04
   maximum displ.:     0.0506310 α      in ANC's #1, #2, #3, ...

........................................................................
.............................. CYCLE   15 ..............................
........................................................................
   1    -34.1481167 -0.341481E+02  0.101E-01    1.50       0.0  T
   2    -34.1481190 -0.225559E-05  0.559E-02    1.50       1.0  T
   3    -34.1480947  0.242796E-04  0.430E-02    1.50       1.0  T
   4    -34.1481220 -0.272981E-04  0.866E-03    1.50       3.1  T
   5    -34.1481227 -0.672928E-06  0.335E-03    1.50       8.0  T
   6    -34.1481227 -0.250722E-07  0.176E-03    1.50      15.2  T
   7    -34.1481227 -0.172860E-07  0.740E-04    1.50      36.1  T
   8    -34.1481227 -0.428933E-08  0.359E-04    1.50      74.4  T
     SCC iter.                  ...        0 min,  0.006 sec
     gradient                   ...        0 min,  0.009 sec
 * total energy  :   -33.5499819 Eh     change       -0.4729392E-05 Eh
   gradient norm :     0.0027304 Eh/α   predicted    -0.6086953E-05 (  28.70%)
   displ. norm   :     0.0142848 α      lambda       -0.5235898E-05
   maximum displ.:     0.0101644 α      in ANC's #1, #2, #3, ...

........................................................................
.............................. CYCLE   16 ..............................
........................................................................
   1    -34.1483336 -0.341483E+02  0.194E-02    1.50       0.0  T
   2    -34.1483336 -0.193153E-07  0.112E-02    1.50       2.4  T
   3    -34.1483322  0.135745E-05  0.991E-03    1.50       2.7  T
   4    -34.1483338 -0.156583E-05  0.181E-03    1.50      14.8  T
   5    -34.1483338 -0.205321E-07  0.895E-04    1.50      29.9  T
   6    -34.1483338 -0.105951E-08  0.446E-04    1.50      59.9  T
     SCC iter.                  ...        0 min,  0.005 sec
     gradient                   ...        0 min,  0.009 sec
 * total energy  :   -33.5499851 Eh     change       -0.3135197E-05 Eh
   gradient norm :     0.0010887 Eh/α   predicted    -0.2620198E-05 ( -16.43%)
   displ. norm   :     0.0403714 α      lambda       -0.2164271E-05
   maximum displ.:     0.0265359 α      in ANC's #2, #1, #3, ...

........................................................................
.............................. CYCLE   17 ..............................
........................................................................
   1    -34.1490010 -0.341490E+02  0.478E-02    1.50       0.0  T
   2    -34.1490013 -0.321454E-06  0.265E-02    1.50       1.0  T
   3    -34.1489968  0.446562E-05  0.178E-02    1.50       1.5  T
   4    -34.1490018 -0.495736E-05  0.294E-03    1.50       9.1  T
   5    -34.1490018 -0.445784E-07  0.146E-03    1.50      18.4  T
   6    -34.1490018 -0.454435E-08  0.613E-04    1.50      43.6  T
   7    -34.1490018 -0.268572E-08  0.288E-04    1.50      92.7  T
     SCC iter.                  ...        0 min,  0.006 sec
     gradient                   ...        0 min,  0.009 sec
 * total energy  :   -33.5499855 Eh     change       -0.3755501E-06 Eh
   gradient norm :     0.0013601 Eh/α   predicted    -0.1081854E-05 ( 188.07%)
   displ. norm   :     0.0239404 α      lambda       -0.1682634E-05
   maximum displ.:     0.0163341 α      in ANC's #2, #3, #1, ...

........................................................................
.............................. CYCLE   18 ..............................
........................................................................
   1    -34.1482513 -0.341483E+02  0.303E-02    1.50       0.0  T
   2    -34.1482515 -0.163561E-06  0.165E-02    1.50       1.6  T
   3    -34.1482513  0.197689E-06  0.459E-03    1.50       5.8  T
   4    -34.1482515 -0.258502E-06  0.168E-03    1.50      15.9  T
   5    -34.1482515 -0.235760E-08  0.112E-03    1.50      23.9  T
   6    -34.1482515 -0.177319E-07  0.319E-04    1.50      83.9  T
   7    -34.1482515 -0.705512E-09  0.153E-04    1.50     174.7  T
     SCC iter.                  ...        0 min,  0.005 sec
     gradient                   ...        0 min,  0.009 sec
 * total energy  :   -33.5499862 Eh     change       -0.7131214E-06 Eh
   gradient norm :     0.0011813 Eh/α   predicted    -0.8408623E-06 (  17.91%)
   displ. norm   :     0.0061213 α      lambda       -0.8921205E-06
   maximum displ.:     0.0037400 α      in ANC's #1, #2, #4, ...

........................................................................
.............................. CYCLE   19 ..............................
........................................................................
   1    -34.1483873 -0.341484E+02  0.107E-02    1.50       0.0  T
   2    -34.1483873 -0.373665E-08  0.651E-03    1.50       4.1  T
   3    -34.1483870  0.286819E-06  0.572E-03    1.50       4.7  T
   4    -34.1483874 -0.435669E-06  0.135E-03    1.50      19.8  T
   5    -34.1483875 -0.174895E-07  0.417E-04    1.50      64.0  T
   6    -34.1483875 -0.816065E-09  0.217E-04    1.50     122.9  T
     SCC iter.                  ...        0 min,  0.005 sec
     gradient                   ...        0 min,  0.009 sec
 * total energy  :   -33.5499866 Eh     change       -0.3863353E-06 Eh
   gradient norm :     0.0005601 Eh/α   predicted    -0.4471101E-06 (  15.73%)
   displ. norm   :     0.0048446 α      lambda       -0.3791727E-06
   maximum displ.:     0.0031041 α      in ANC's #1, #2, #3, ...

   *** GEOMETRY OPTIMIZATION CONVERGED AFTER 19 ITERATIONS ***

------------------------------------------------------------------------
 total energy gain   :        -0.0383889 Eh      -24.0894 kcal/mol
 total RMSD          :         0.3835538 a0        0.2030 Å
 total power (kW/mol):        -5.3047374 (step) -238.8450 (real)
------------------------------------------------------------------------

 ANCopt (total)                0 d,  0 h,  0 min,  0.422 sec
 optimizer setup                ...        0 min,  0.000 sec (  0.032%)
 model hessian                  ...        0 min,  0.001 sec (  0.213%)
 ANC generation                 ...        0 min,  0.000 sec (  0.081%)
 coordinate transformation      ...        0 min,  0.000 sec (  0.053%)
 single point calculation       ...        0 min,  0.415 sec ( 98.361%)
 optimization log               ...        0 min,  0.001 sec (  0.295%)
 hessian update                 ...        0 min,  0.000 sec (  0.042%)
 rational function              ...        0 min,  0.003 sec (  0.645%)

================
 final structure:
================
$coord
    1.98091970481017   -1.32642061732783   -0.12566569798589      C 
    1.84867888718754    1.20267763923242    0.18398103330640      C 
   -0.70567508170030    2.14523091981128    0.58495413538262      C 
   -1.37784167771267    4.60742734533515    0.94772388672957      C 
    0.33598219203071    6.65434709008846    0.99090126872329      C 
    1.61641419904507    8.39889381285144    1.05090505846966      N 
   -3.93313244389523    5.30580083626073    1.32174150267721      C 
   -5.99476392574998    5.88854753559138    1.62549380125347      N 
   -2.89610588738341   -0.31595210071930    0.55005364328730      S 
   -0.43502401358023   -2.65003488706023   -0.00328218957799      C 
   -0.87016699418698   -4.84998465440665   -0.21088193485250      O 
    3.99832217662698    2.78549238101231    0.12360130988556      C 
    5.81204635472410    3.96245833654505    0.05626258028633      N 
    3.68848666380379   -2.38611201073890   -0.44421761769179      H 
$end
           -------------------------------------------------
          |                Final Singlepoint                |
           -------------------------------------------------

          ...................................................
          :                      SETUP                      :
          :.................................................:
          :  # basis functions                  59          :
          :  # atomic orbitals                  58          :
          :  # shells                           28          :
          :  # electrons                        60          :
          :  max. iterations                   250          :
          :  Hamiltonian                  GFN2-xTB          :
          :  restarted?                      false          :
          :  GBSA solvation                  false          :
          :  PC potential                    false          :
          :  electronic temp.          300.0000000     K    :
          :  accuracy                    1.0000000          :
          :  -> integral cutoff          0.2500000E+02      :
          :  -> integral neglect         0.1000000E-07      :
          :  -> SCF convergence          0.1000000E-05 Eh   :
          :  -> wf. convergence          0.1000000E-03 e    :
          :  Broyden damping             0.4000000          :
          ...................................................

 iter      E             dE          RMSdq      gap      omega  full diag
   1    -34.1483875 -0.341484E+02  0.947E-05    1.50       0.0  T
   2    -34.1483875 -0.613198E-11  0.558E-05    1.50     479.4  T
   3    -34.1483875 -0.307452E-10  0.362E-05    1.50     737.7  T

   *** convergence criteria satisfied after 3 iterations ***

         #    Occupation            Energy/Eh            Energy/eV
      -------------------------------------------------------------
         1        2.0000           -0.7907615             -21.5177
       ...           ...                  ...                  ...
        24        2.0000           -0.5156142             -14.0306
        25        2.0000           -0.4808023             -13.0833
        26        2.0000           -0.4766628             -12.9707
        27        2.0000           -0.4745398             -12.9129
        28        2.0000           -0.4655657             -12.6687
        29        2.0000           -0.4621737             -12.5764
        30        2.0000           -0.4457234             -12.1288 (HOMO)
        31                         -0.3905395             -10.6271 (LUMO)
        32                         -0.3180173              -8.6537
        33                         -0.2883727              -7.8470
        34                         -0.2693447              -7.3292
        35                         -0.2581013              -7.0233
       ...                                ...                  ...
        58                          1.1316188              30.7929
      -------------------------------------------------------------
                  HL-Gap            0.0551839 Eh            1.5016 eV
             Fermi-level           -0.4181315 Eh          -11.3779 eV

 SCC (total)                   0 d,  0 h,  0 min,  0.019 sec
 SCC setup                      ...        0 min,  0.000 sec (  0.769%)
 Dispersion                     ...        0 min,  0.000 sec (  0.574%)
 integral evaluation            ...        0 min,  0.007 sec ( 33.779%)
 zeroth order Hamiltonian       ...        0 min,  0.000 sec (  0.574%)
 iterations                     ...        0 min,  0.003 sec ( 14.545%)
 molecular gradient             ...        0 min,  0.009 sec ( 48.201%)
 printout                       ...        0 min,  0.000 sec (  1.321%)

         :::::::::::::::::::::::::::::::::::::::::::::::::::::
         ::                     SUMMARY                     ::
         :::::::::::::::::::::::::::::::::::::::::::::::::::::
         :: total energy             -33.549986561381 Eh    ::
         :: gradient norm              0.000559319802 Eh/a0 ::
         :: HOMO-LUMO gap              1.501630949356 eV    ::
         ::.................................................::
         :: SCC energy               -34.148387456109 Eh    ::
         :: -> isotropic ES            0.041700067376 Eh    ::
         :: -> anisotropic ES          0.005535277353 Eh    ::
         :: -> anisotropic XC          0.054881914444 Eh    ::
         :: -> dispersion             -0.017086792096 Eh    ::
         :: repulsion energy           0.598358898036 Eh    ::
         :: add. restraining           0.000000000000 Eh    ::
         :::::::::::::::::::::::::::::::::::::::::::::::::::::

           -------------------------------------------------
          |                Property Printout                |
           -------------------------------------------------

    * Orbital Energies and Occupations

         #    Occupation            Energy/Eh            Energy/eV
      -------------------------------------------------------------
         1        2.0000           -0.7907615             -21.5177
       ...           ...                  ...                  ...
        18        2.0000           -0.5551237             -15.1057
        19        2.0000           -0.5431558             -14.7800
        20        2.0000           -0.5325042             -14.4902
        21        2.0000           -0.5285565             -14.3828
        22        2.0000           -0.5216096             -14.1937
        23        2.0000           -0.5208517             -14.1731
        24        2.0000           -0.5156142             -14.0306
        25        2.0000           -0.4808023             -13.0833
        26        2.0000           -0.4766628             -12.9707
        27        2.0000           -0.4745398             -12.9129
        28        2.0000           -0.4655657             -12.6687
        29        2.0000           -0.4621737             -12.5764
        30        2.0000           -0.4457234             -12.1288 (HOMO)
        31                         -0.3905395             -10.6271 (LUMO)
        32                         -0.3180173              -8.6537
        33                         -0.2883727              -7.8470
        34                         -0.2693447              -7.3292
        35                         -0.2581013              -7.0233
        36                         -0.2561400              -6.9699
        37                         -0.2521883              -6.8624
        38                         -0.2338328              -6.3629
        39                         -0.1871204              -5.0918
        40                         -0.1823134              -4.9610
        41                         -0.1504570              -4.0941
       ...                                ...                  ...
        58                          1.1316188              30.7929
      -------------------------------------------------------------
                  HL-Gap            0.0551839 Eh            1.5016 eV
             Fermi-level           -0.4181315 Eh          -11.3779 eV

     #   Z        covCN         q      C6AA      α(0)
     1   6 C      3.014    -0.037    28.893     8.817
     2   6 C      3.066     0.040    27.048     8.528
     3   6 C      2.987     0.061    26.620     8.463
     4   6 C      2.989     0.035    27.204     8.556
     5   6 C      1.921     0.123    28.087     8.559
     6   7 N      0.911    -0.170    24.675     7.184
     7   6 C      1.926     0.127    27.985     8.543
     8   7 N      0.911    -0.171    24.705     7.189
     9  16 S      2.186    -0.031   142.332    20.080
    10   6 C      2.829     0.259    22.649     7.798
    11   8 O      0.868    -0.293    19.646     5.943
    12   6 C      1.905     0.118    28.201     8.576
    13   7 N      0.911    -0.158    24.430     7.148
    14   1 H      0.926     0.097     1.809     2.103

 Mol. C6AA /au·bohr⁶  :       5481.884810
 Mol. C8AA /au·bohr⁸  :     160751.959187
 Mol. α(0) /au        :        117.488044


Wiberg/Mayer (AO) data.
largest (>0.10) Wiberg bond orders for each atom
          total WBO             WBO to atom ...
     1  C   3.960        C    2 1.649    C   10 1.063    H   14 0.954    N   13 0.105
     2  C   3.990        C    1 1.649    C   12 1.090    C    3 1.079
     3  C   3.973        C    4 1.520    S    9 1.135    C    2 1.079
     4  C   3.991        C    3 1.520    C    5 1.090    C    7 1.083
     5  C   3.954        N    6 2.791    C    4 1.090
     6  N   3.010        C    5 2.791
     7  C   3.952        N    8 2.799    C    4 1.083
     8  N   2.986        C    7 2.799
     9  S   2.511        C    3 1.135    C   10 0.960    O   11 0.170
    10  C   3.927        O   11 1.842    C    1 1.063    S    9 0.960
    11  O   2.159        C   10 1.842    S    9 0.170
    12  C   3.955        N   13 2.814    C    2 1.090
    13  N   3.017        C   12 2.814    C    1 0.105
    14  H   0.989        C    1 0.954

molecular dipole:
                 x           y           z       tot (Debye)
 q only:        0.344      -0.343      -0.080
   full:        0.274      -1.106      -0.162       2.926
molecular quadrupole (traceless):
                xx          xy          yy          xz          yz          zz
 q only:        0.010      -4.388     -10.303       0.832      -2.083      10.293
  q+dip:       -2.147      -6.618     -14.523       1.548      -3.395      16.670
   full:       -5.322      -8.201     -15.648       2.229      -3.865      20.970

           -------------------------------------------------
          |                Geometry Summary                 |
           -------------------------------------------------

      molecular mass/u    :      187.1754000
   center of mass at/Å    :       -0.1764346       1.1036997       0.2839056
  moments of inertia/u·Å² :        0.5059286E+03   0.7553560E+03   0.1261284E+04
rotational constants/cm⁻¹ :        0.3332018E-01   0.2231747E-01   0.1336545E-01

 * 8 selected distances

     #   Z        #   Z                                     value/Å
     1   6 C      2   6 C                                 1.3501496
     3   6 C      4   6 C                                 1.3641920
     5   6 C      6   7 N                                 1.1455863
     7   6 C      8   7 N                                 1.1450525
     3   6 C      9  16 S                                 1.7436071 (max)
    10   6 C     11   8 O                                 1.1917920
    12   6 C     13   7 N                                 1.1447095
     1   6 C     14   1 H                                 1.0767432 (min)

 * 5 distinct bonds (by element types)

   Z      Z             #   av. dist./Å        max./Å        min./Å
   1 H    6 C           1     1.0767432     1.0767432     1.0767432
   6 C    6 C           2     1.3571708     1.3641920     1.3501496
   6 C    7 N           3     1.1451161     1.1455863     1.1447095
   6 C    8 O           1     1.1917920     1.1917920     1.1917920
   6 C   16 S           1     1.7436071     1.7436071     1.7436071


optimized geometry written to: xtbopt.xyz


           -------------------------------------------------
          | TOTAL ENERGY              -33.549986561381 Eh   |
          | GRADIENT NORM               0.000559319802 Eh/α |
          | HOMO-LUMO GAP               1.501630949356 eV   |
           -------------------------------------------------

------------------------------------------------------------------------
 * finished run on 2021/02/19 at 08:12:39.522     
------------------------------------------------------------------------
 total:
 * wall-time:     0 d,  0 h,  0 min,  0.495 sec
 *  cpu-time:     0 d,  0 h,  0 min,  0.488 sec
 * ratio c/w:     0.987 speedup
 SCF:
 * wall-time:     0 d,  0 h,  0 min,  0.030 sec
 *  cpu-time:     0 d,  0 h,  0 min,  0.030 sec
 * ratio c/w:     0.997 speedup
 ANC optimizer:
 * wall-time:     0 d,  0 h,  0 min,  0.442 sec
 *  cpu-time:     0 d,  0 h,  0 min,  0.441 sec
 * ratio c/w:     0.997 speedup

