      -----------------------------------------------------------      
     |                   =====================                   |     
     |                           x T B                           |     
     |                   =====================                   |     
     |                         S. Grimme                         |     
     |          Mulliken Center for Theoretical Chemistry        |     
     |                    University of Bonn                     |     
     |                Version 6.2 RC2 (SAW190805)                |     
      -----------------------------------------------------------      

   This program is distributed in the hope that it will be useful,
   but WITHOUT ANY WARRANTY; without even the implied warranty of
   MERCHANTABILITY or FITNESS FOR A PARTICULAR PURPOSE.
   
   FOR NON-COMMERCIAL, ACADEMIA USE ONLY.
   
   Cite this work as:
   * S. Grimme, C. Bannwarth, P. Shushkov, J. Chem. Theory Comput., 2017,
     13, 1989-2009. DOI: 10.1021/acs.jctc.7b00118
   * C. Bannwarth, S. Ehlert and S. Grimme., J. Chem. Theory Comput., 2019,
     15, 1652-1671. DOI: 10.1021/acs.jctc.8b01176
   * P. Pracht, E. Caldeweyher, S. Ehlert, S. Grimme, ChemRxiv, 2019, preprint.
     DOI: 10.26434/chemrxiv.8326202.v1
   
   for DFT-D4:
   * E. Caldeweyher, C. Bannwarth and S. Grimme, J. Chem. Phys., 2017,
     147, 034112. DOI: 10.1063/1.4993215
   * E. Caldeweyher, S. Ehlert, A. Hansen, H. Neugebauer, S. Spicher,
     C. Bannwarth and S. Grimme, J. Chem. Phys., 2019, 150, 154122.
     DOI: 10.1063/1.5090222
   
   for sTDA-xTB:
   * S. Grimme and C. Bannwarth, J. Chem. Phys., 2016, 145, 054103.
     DOI: 10.1063/1.4959605
   
   in the mass-spec context:
   * V. Asgeirsson, C. Bauer and S. Grimme, Chem. Sci., 2017, 8, 4879.
     DOI: 10.1039/c7sc00601b
   
   for metadynamics refer to:
   * S. Grimme, J. Chem. Theory Comput., 2019, 155, 2847-2862
     DOI: 10.1021/acs.jctc.9b00143
   
   with help from (in alphabetical order)
   C. Bannwarth, F. Bohle, G. Brandenburg, E. Caldeweyher, M. Checinski,
   S. Dohm, S. Ehlert, S. Ehrlich, F. März, H. Neugebauer, J. Pisarek,
   P. Pracht, P. Shushkov, and S. Spicher.
   
 * started run on 2021/04/08 at 13:09:10.505     

           -------------------------------------------------
          |                Calculation Setup                |
           -------------------------------------------------

          program call               : /ihome/ghutchison/geoffh/xtb/xtb 48utl.xyz -opt
          hostname                   : smp-n155
          coordinate file            : 48utl.xyz
          omp threads                :                     1
          number of atoms            :                    21
          number of electrons        :                    86
          charge                     :                     0
          spin                       :                   0.0
          first test random number   :      0.70783612326070


########################################################################
# WARNING! Please study the warnings concerning your input carefully
#  - the use of '-opt' is discouraged, please use '--opt' next time
########################################################################

           ------------------------------------------------- 
          |                 G F N 2 - x T B                 |
          | Geometry, Frequencies, Noncovalent interactions |
          |            JCTC 2019 parametrisation            |
           ------------------------------------------------- 
             KAB for C  - Si     :                1.0500
             KAB for H  - Pd     :                0.9500
             k(s)              :                1.8500
             k(p)              :                2.2300
             k(d)              :                2.2300
             k(f)              :                2.0000
             kEN (H0ij)        :               -2.0000
             D4 a1             :                0.5200
             D4 a2             :                5.0000
             D4 s6             :                1.0000
             D4 s8             :                2.7000
             D4 s9             :                5.0000
             alphaj            :                2.0000

  Z AO/shell   Hii/eV     exponent
  1     Wed Apr 25 08:07:45 CEST 2018   EN: 2.200 GM2: 0.406  GM3: 0.0800  RAES: 1.40
     1s    -10.707211    1.230000
  6     Wed Apr 25 08:07:45 CEST 2018   EN: 2.550 GM2: 0.538  GM3: 0.1500  RAES: 3.00
     2s    -13.970922    2.096432
     2p    -10.063292    1.800000
  7     Wed Apr 25 08:07:45 CEST 2018   EN: 3.040 GM2: 0.461  GM3:-0.0640  RAES: 1.90
     2s    -16.686243    2.339881
     2p    -12.523956    2.014332
  8     Wed Apr 25 08:07:45 CEST 2018   EN: 3.440 GM2: 0.452  GM3:-0.0517  RAES: 1.80
     2s    -20.229985    2.439742
     2p    -15.503117    2.137023
 16     Tue Apr 24 11:44:34 CEST 2018   EN: 2.580 GM2: 0.340  GM3:-0.0502  RAES: 3.10
     3s    -20.029654    1.981333
     3p    -11.377694    2.025643
     3d     -0.420282    1.702555

           ------------------------------------------------- 
          |        Self-Consistent Charge Iterations        |
           ------------------------------------------------- 

          ...................................................
          :                      SETUP                      :
          :.................................................:
          :  # basis functions                  78          :
          :  # atomic orbitals                  77          :
          :  # shells                           39          :
          :  # electrons                        86          :
          :  max. iterations                   250          :
          :  Hamiltonian                  GFN2-xTB          :
          :  restarted?                      false          :
          :  GBSA solvation                  false          :
          :  PC potential                    false          :
          :  electronic temp.          300.0000000     K    :
          :  accuracy                    1.0000000          :
          :  -> integral cutoff          0.2500000E+02      :
          :  -> integral neglect         0.1000000E-07      :
          :  -> SCF convergence          0.1000000E-05 Eh   :
          :  -> wf. convergence          0.1000000E-03 e    :
          :  Broyden damping             0.4000000          :
          ...................................................

 iter      E             dE          RMSdq      gap      omega  full diag
   1    -50.6336737 -0.506337E+02  0.695E+00    2.61       0.0  T
   2    -50.9195193 -0.285846E+00  0.334E+00    1.71       1.0  T
   3    -50.9197866 -0.267268E-03  0.200E+00    1.96       1.0  T
   4    -50.9251757 -0.538913E-02  0.130E+00    1.58       1.0  T
   5    -50.9412132 -0.160375E-01  0.254E-01    1.63       1.0  T
   6    -50.9422721 -0.105889E-02  0.848E-02    1.67       1.0  T
   7    -50.9422996 -0.274863E-04  0.549E-02    1.69       1.0  T
   8    -50.9423223 -0.226420E-04  0.159E-02    1.69       1.4  T
   9    -50.9423225 -0.215535E-06  0.884E-03    1.69       2.5  T
  10    -50.9423232 -0.700448E-06  0.364E-03    1.69       6.0  T
  11    -50.9423233 -0.150448E-06  0.136E-03    1.69      16.1  T
  12    -50.9423233 -0.115504E-08  0.716E-04    1.69      30.5  T
  13    -50.9423233 -0.447624E-08  0.326E-04    1.69      67.0  T

   *** convergence criteria satisfied after 13 iterations ***

         #    Occupation            Energy/Eh            Energy/eV
      -------------------------------------------------------------
         1        2.0000           -0.8121551             -22.0999
       ...           ...                  ...                  ...
        37        2.0000           -0.4949216             -13.4675
        38        2.0000           -0.4899957             -13.3335
        39        2.0000           -0.4739187             -12.8960
        40        2.0000           -0.4690861             -12.7645
        41        2.0000           -0.4532389             -12.3333
        42        2.0000           -0.4502842             -12.2529
        43        2.0000           -0.4311345             -11.7318 (HOMO)
        44                         -0.3690592             -10.0426 (LUMO)
        45                         -0.3641715              -9.9096
        46                         -0.3374935              -9.1837
        47                         -0.3204442              -8.7197
        48                         -0.2917304              -7.9384
       ...                                ...                  ...
        77                          0.7089661              19.2919
      -------------------------------------------------------------
                  HL-Gap            0.0620753 Eh            1.6892 eV
             Fermi-level           -0.4000969 Eh          -10.8872 eV

 SCC (total)                   0 d,  0 h,  0 min,  0.038 sec
 SCC setup                      ...        0 min,  0.000 sec (  0.686%)
 Dispersion                     ...        0 min,  0.000 sec (  0.758%)
 integral evaluation            ...        0 min,  0.011 sec ( 28.645%)
 zeroth order Hamiltonian       ...        0 min,  0.000 sec (  0.453%)
 iterations                     ...        0 min,  0.013 sec ( 33.255%)
 molecular gradient             ...        0 min,  0.013 sec ( 35.458%)
 printout                       ...        0 min,  0.000 sec (  0.644%)

         :::::::::::::::::::::::::::::::::::::::::::::::::::::
         ::                     SUMMARY                     ::
         :::::::::::::::::::::::::::::::::::::::::::::::::::::
         :: total energy             -50.449113511061 Eh    ::
         :: gradient norm              0.121160235930 Eh/a0 ::
         :: HOMO-LUMO gap              1.689154504067 eV    ::
         ::.................................................::
         :: SCC energy               -50.942323326232 Eh    ::
         :: -> isotropic ES            0.114109437925 Eh    ::
         :: -> anisotropic ES          0.018392440646 Eh    ::
         :: -> anisotropic XC          0.002180461320 Eh    ::
         :: -> dispersion             -0.026199976261 Eh    ::
         :: repulsion energy           0.493036928276 Eh    ::
         :: add. restraining           0.000000000000 Eh    ::
         :::::::::::::::::::::::::::::::::::::::::::::::::::::

      ----------------------------------------------------------- 
     |                   =====================                   |
     |                        A N C O P T                        |
     |                   =====================                   |
     |               Approximate Normal Coordinate               |
     |                Rational Function Optimizer                |
      ----------------------------------------------------------- 

          ...................................................
          :                      SETUP                      :
          :.................................................:
          :   optimization level            normal          :
          :   max. optcycles                   200          :
          :   ANC micro-cycles                  20          :
          :   degrees of freedom                57          :
          :.................................................:
          :   RF solver                   davidson          :
          :   input Hessian                  false          :
          :   write xtbopt.log                true          :
          :   linear?                        false          :
          :   energy convergence         0.5000000E-05 Eh   :
          :   grad. convergence          0.1000000E-02 Eh/α :
          :   maximium RF displ.         2.0000000          :
          :   Hlow (freq-cutoff)         0.5000000E-02      :
          :   Hmax (freq-cutoff)         5.0000000          :
          :   S6 in model hess.         20.0000000          :
          ...................................................

generating ANC from model Hessian ...
Using Lindh-Hessian (1995)
 Shifting diagonal of input Hessian by   3.404202344281209E-003
 Lowest  eigenvalues of input Hessian
   -0.000000   -0.000000   -0.000000   -0.000000    0.000000    0.000000
    0.005000    0.005648    0.008117    0.009384    0.012176    0.015888
    0.017013    0.022834    0.023815    0.024532    0.026150    0.037424
 Highest eigenvalues
    1.997703    2.133964    2.179027    2.294452    2.458358    2.468054
 

........................................................................
.............................. CYCLE    1 ..............................
........................................................................
   1    -50.9423233 -0.509423E+02  0.145E-04    1.69       0.0  T
   2    -50.9423233 -0.621867E-10  0.978E-05    1.69     223.2  T
   3    -50.9423233 -0.445937E-10  0.639E-05    1.69     341.3  T
     SCC iter.                  ...        0 min,  0.004 sec
     gradient                   ...        0 min,  0.013 sec
 * total energy  :   -50.4491135 Eh     change        0.1619937E-07 Eh
   gradient norm :     0.1211587 Eh/α   predicted     0.0000000E+00 (-100.00%)
   displ. norm   :     0.2550020 α      lambda       -0.1356027E-01
   maximum displ.:     0.1149829 α      in ANC's #7, #9, #16, ...

........................................................................
.............................. CYCLE    2 ..............................
........................................................................
   1    -50.9678735 -0.509679E+02  0.345E-01    1.85       0.0  T
   2    -50.9682665 -0.392946E-03  0.181E-01    1.87       1.0  T
   3    -50.9682336  0.328996E-04  0.941E-02    1.85       1.0  T
   4    -50.9682622 -0.286834E-04  0.588E-02    1.84       1.0  T
   5    -50.9683065 -0.442748E-04  0.118E-02    1.85       1.8  T
   6    -50.9683078 -0.128243E-05  0.572E-03    1.85       3.8  T
   7    -50.9683079 -0.542218E-07  0.294E-03    1.85       7.4  T
     SCC iter.                  ...        0 min,  0.006 sec
     gradient                   ...        0 min,  0.012 sec
 * total energy  :   -50.4584273 Eh     change       -0.9313803E-02 Eh
   gradient norm :     0.0522419 Eh/α   predicted    -0.7221023E-02 ( -22.47%)
   displ. norm   :     0.2521523 α      lambda       -0.4457837E-02
   maximum displ.:     0.1578541 α      in ANC's #7, #11, #16, ...

........................................................................
.............................. CYCLE    3 ..............................
........................................................................
   1    -50.9788820 -0.509789E+02  0.328E-01    1.89       0.0  T
   2    -50.9790314 -0.149437E-03  0.192E-01    1.91       1.0  T
   3    -50.9789301  0.101292E-03  0.117E-01    1.89       1.0  T
   4    -50.9790863 -0.156204E-03  0.355E-02    1.90       1.0  T
   5    -50.9790988 -0.124220E-04  0.113E-02    1.90       1.9  T
   6    -50.9790998 -0.100280E-05  0.538E-03    1.90       4.1  T
   7    -50.9790998 -0.102619E-07  0.327E-03    1.90       6.7  T
     SCC iter.                  ...        0 min,  0.006 sec
     gradient                   ...        0 min,  0.012 sec
 * total energy  :   -50.4605710 Eh     change       -0.2143677E-02 Eh
   gradient norm :     0.0170512 Eh/α   predicted    -0.2370636E-02 (  10.59%)
   displ. norm   :     0.2346067 α      lambda       -0.1650697E-02
   maximum displ.:     0.1740358 α      in ANC's #9, #11, #7, ...

........................................................................
.............................. CYCLE    4 ..............................
........................................................................
   1    -50.9781692 -0.509782E+02  0.376E-01    1.90       0.0  T
   2    -50.9782290 -0.598483E-04  0.222E-01    1.91       1.0  T
   3    -50.9781132  0.115848E-03  0.956E-02    1.90       1.0  T
   4    -50.9782578 -0.144632E-03  0.220E-02    1.91       1.0  T
   5    -50.9782638 -0.599906E-05  0.903E-03    1.91       2.4  T
   6    -50.9782639 -0.123618E-06  0.408E-03    1.91       5.4  T
   7    -50.9782641 -0.112217E-06  0.180E-03    1.91      12.1  T
   8    -50.9782641 -0.343053E-07  0.611E-04    1.91      35.7  T
     SCC iter.                  ...        0 min,  0.007 sec
     gradient                   ...        0 min,  0.012 sec
 * total energy  :   -50.4613090 Eh     change       -0.7380439E-03 Eh
   gradient norm :     0.0151223 Eh/α   predicted    -0.8707907E-03 (  17.99%)
   displ. norm   :     0.1638420 α      lambda       -0.7287718E-03
   maximum displ.:     0.1337719 α      in ANC's #11, #9, #4, ...

........................................................................
.............................. CYCLE    5 ..............................
........................................................................
   1    -50.9747516 -0.509748E+02  0.263E-01    1.84       0.0  T
   2    -50.9747993 -0.477570E-04  0.153E-01    1.85       1.0  T
   3    -50.9747224  0.769317E-04  0.819E-02    1.86       1.0  T
   4    -50.9748203 -0.979093E-04  0.159E-02    1.87       1.4  T
   5    -50.9748236 -0.329637E-05  0.626E-03    1.86       3.5  T
   6    -50.9748239 -0.237323E-06  0.332E-03    1.86       6.6  T
   7    -50.9748239 -0.101818E-07  0.186E-03    1.86      11.7  T
   8    -50.9748239 -0.340867E-07  0.597E-04    1.86      36.5  T
     SCC iter.                  ...        0 min,  0.007 sec
     gradient                   ...        0 min,  0.012 sec
 * total energy  :   -50.4618476 Eh     change       -0.5386264E-03 Eh
   gradient norm :     0.0137687 Eh/α   predicted    -0.3741703E-03 ( -30.53%)
   displ. norm   :     0.2678176 α      lambda       -0.8798821E-03
   maximum displ.:     0.2022572 α      in ANC's #11, #9, #7, ...

........................................................................
.............................. CYCLE    6 ..............................
........................................................................
   1    -50.9712884 -0.509713E+02  0.405E-01    1.77       0.0  T
   2    -50.9713813 -0.929077E-04  0.235E-01    1.79       1.0  T
   3    -50.9712004  0.180822E-03  0.122E-01    1.81       1.0  T
   4    -50.9714282 -0.227752E-03  0.223E-02    1.81       1.0  T
   5    -50.9714349 -0.669752E-05  0.912E-03    1.80       2.4  T
   6    -50.9714353 -0.406625E-06  0.485E-03    1.80       4.5  T
   7    -50.9714353 -0.457807E-07  0.263E-03    1.80       8.3  T
   8    -50.9714354 -0.563805E-07  0.924E-04    1.80      23.6  T
     SCC iter.                  ...        0 min,  0.007 sec
     gradient                   ...        0 min,  0.012 sec
 * total energy  :   -50.4623834 Eh     change       -0.5357319E-03 Eh
   gradient norm :     0.0223348 Eh/α   predicted    -0.4715065E-03 ( -11.99%)
   displ. norm   :     0.1751014 α      lambda       -0.6739565E-03
   maximum displ.:     0.0965605 α      in ANC's #11, #7, #1, ...

........................................................................
.............................. CYCLE    7 ..............................
........................................................................
   1    -50.9725625 -0.509726E+02  0.225E-01    1.78       0.0  T
   2    -50.9725974 -0.349215E-04  0.128E-01    1.79       1.0  T
   3    -50.9725635  0.339140E-04  0.580E-02    1.79       1.0  T
   4    -50.9726069 -0.434519E-04  0.164E-02    1.79       1.3  T
   5    -50.9726110 -0.400912E-05  0.588E-03    1.79       3.7  T
   6    -50.9726112 -0.216910E-06  0.264E-03    1.79       8.3  T
     SCC iter.                  ...        0 min,  0.005 sec
     gradient                   ...        0 min,  0.012 sec
 * total energy  :   -50.4628670 Eh     change       -0.4836349E-03 Eh
   gradient norm :     0.0183686 Eh/α   predicted    -0.3473201E-03 ( -28.19%)
   displ. norm   :     0.3484049 α      lambda       -0.1193022E-02
   maximum displ.:     0.2034394 α      in ANC's #11, #9, #7, ...

........................................................................
.............................. CYCLE    8 ..............................
........................................................................
   1    -50.9743635 -0.509744E+02  0.468E-01    1.75       0.0  T
   2    -50.9744908 -0.127250E-03  0.270E-01    1.77       1.0  T
   3    -50.9742822  0.208521E-03  0.137E-01    1.78       1.0  T
   4    -50.9745540 -0.271798E-03  0.303E-02    1.78       1.0  T
   5    -50.9745672 -0.131928E-04  0.112E-02    1.77       2.0  T
   6    -50.9745677 -0.466086E-06  0.536E-03    1.77       4.1  T
   7    -50.9745677 -0.522832E-07  0.296E-03    1.77       7.4  T
   8    -50.9745678 -0.831645E-07  0.103E-03    1.77      21.2  T
     SCC iter.                  ...        0 min,  0.007 sec
     gradient                   ...        0 min,  0.012 sec
 * total energy  :   -50.4635011 Eh     change       -0.6340854E-03 Eh
   gradient norm :     0.0197080 Eh/α   predicted    -0.6689276E-03 (   5.49%)
   displ. norm   :     0.2393693 α      lambda       -0.8712989E-03
   maximum displ.:     0.1662662 α      in ANC's #11, #9, #1, ...

........................................................................
.............................. CYCLE    9 ..............................
........................................................................
   1    -50.9749907 -0.509750E+02  0.377E-01    1.74       0.0  T
   2    -50.9751178 -0.127087E-03  0.218E-01    1.75       1.0  T
   3    -50.9750331  0.847026E-04  0.110E-01    1.76       1.0  T
   4    -50.9751600 -0.126911E-03  0.293E-02    1.76       1.0  T
   5    -50.9751730 -0.130420E-04  0.924E-03    1.76       2.4  T
   6    -50.9751734 -0.381256E-06  0.454E-03    1.76       4.8  T
   7    -50.9751734 -0.168436E-07  0.272E-03    1.76       8.0  T
   8    -50.9751735 -0.828098E-07  0.853E-04    1.76      25.6  T
     SCC iter.                  ...        0 min,  0.007 sec
     gradient                   ...        0 min,  0.012 sec
 * total energy  :   -50.4637997 Eh     change       -0.2985804E-03 Eh
   gradient norm :     0.0197222 Eh/α   predicted    -0.4606185E-03 (  54.27%)
   displ. norm   :     0.1334019 α      lambda       -0.8266204E-03
   maximum displ.:     0.0782861 α      in ANC's #7, #9, #3, ...

........................................................................
.............................. CYCLE   10 ..............................
........................................................................
   1    -50.9817745 -0.509818E+02  0.183E-01    1.79       0.0  T
   2    -50.9819428 -0.168342E-03  0.104E-01    1.78       1.0  T
   3    -50.9819620 -0.191585E-04  0.588E-02    1.78       1.0  T
   4    -50.9819730 -0.110478E-04  0.296E-02    1.78       1.0  T
   5    -50.9819820 -0.895590E-05  0.107E-02    1.78       2.0  T
   6    -50.9819835 -0.155543E-05  0.362E-03    1.78       6.0  T
   7    -50.9819835  0.399798E-08  0.258E-03    1.78       8.4  T
   8    -50.9819836 -0.594425E-07  0.534E-04    1.78      40.8  T
     SCC iter.                  ...        0 min,  0.007 sec
     gradient                   ...        0 min,  0.012 sec
 * total energy  :   -50.4636772 Eh     change        0.1224528E-03 Eh
   gradient norm :     0.0242403 Eh/α   predicted    -0.4206712E-03 (-443.54%)
   displ. norm   :     0.1736406 α      lambda       -0.1029120E-02
   maximum displ.:     0.1356386 α      in ANC's #11, #9, #7, ...

........................................................................
.............................. CYCLE   11 ..............................
........................................................................
   1    -50.9739280 -0.509739E+02  0.291E-01    1.70       0.0  T
   2    -50.9740793 -0.151325E-03  0.165E-01    1.72       1.0  T
   3    -50.9740109  0.683522E-04  0.952E-02    1.73       1.0  T
   4    -50.9741115 -0.100537E-03  0.293E-02    1.73       1.0  T
   5    -50.9741216 -0.100761E-04  0.981E-03    1.73       2.2  T
   6    -50.9741226 -0.106808E-05  0.438E-03    1.73       5.0  T
   7    -50.9741226 -0.557488E-08  0.254E-03    1.73       8.6  T
     SCC iter.                  ...        0 min,  0.006 sec
     gradient                   ...        0 min,  0.012 sec
 * total energy  :   -50.4638704 Eh     change       -0.1931675E-03 Eh
   gradient norm :     0.0201980 Eh/α   predicted    -0.5300770E-03 ( 174.41%)
   displ. norm   :     0.1809010 α      lambda       -0.1044866E-02
   maximum displ.:     0.0972239 α      in ANC's #10, #11, #6, ...

........................................................................
.............................. CYCLE   12 ..............................
........................................................................
   1    -50.9740754 -0.509741E+02  0.303E-01    1.75       0.0  T
   2    -50.9742628 -0.187339E-03  0.166E-01    1.75       1.0  T
   3    -50.9742462  0.165379E-04  0.743E-02    1.75       1.0  T
   4    -50.9742717 -0.254693E-04  0.327E-02    1.75       1.0  T
   5    -50.9742861 -0.144396E-04  0.106E-02    1.75       2.1  T
   6    -50.9742875 -0.141735E-05  0.442E-03    1.75       4.9  T
   7    -50.9742876 -0.117112E-07  0.215E-03    1.75      10.1  T
     SCC iter.                  ...        0 min,  0.006 sec
     gradient                   ...        0 min,  0.012 sec
 * total energy  :   -50.4636021 Eh     change        0.2682566E-03 Eh
   gradient norm :     0.0277711 Eh/α   predicted    -0.5395331E-03 (-301.13%)
   displ. norm   :     0.1204116 α      lambda       -0.1165496E-02
   maximum displ.:     0.0621146 α      in ANC's #10, #3, #5, ...

........................................................................
.............................. CYCLE   13 ..............................
........................................................................
   1    -50.9767279 -0.509767E+02  0.202E-01    1.76       0.0  T
   2    -50.9768530 -0.125064E-03  0.112E-01    1.76       1.0  T
   3    -50.9768602 -0.716775E-05  0.567E-02    1.76       1.0  T
   4    -50.9768733 -0.131188E-04  0.162E-02    1.76       1.4  T
   5    -50.9768746 -0.129380E-05  0.934E-03    1.76       2.3  T
   6    -50.9768761 -0.146254E-05  0.334E-03    1.76       6.5  T
   7    -50.9768761 -0.126834E-07  0.165E-03    1.76      13.2  T
     SCC iter.                  ...        0 min,  0.006 sec
     gradient                   ...        0 min,  0.012 sec
 * total energy  :   -50.4640906 Eh     change       -0.4885042E-03 Eh
   gradient norm :     0.0069930 Eh/α   predicted    -0.5912098E-03 (  21.02%)
   displ. norm   :     0.1095046 α      lambda       -0.2613087E-03
   maximum displ.:     0.0859611 α      in ANC's #11, #14, #4, ...

........................................................................
.............................. CYCLE   14 ..............................
........................................................................
   1    -50.9764536 -0.509765E+02  0.159E-01    1.73       0.0  T
   2    -50.9764887 -0.351312E-04  0.917E-02    1.74       1.0  T
   3    -50.9764840  0.476717E-05  0.459E-02    1.74       1.0  T
   4    -50.9764990 -0.150710E-04  0.123E-02    1.74       1.8  T
   5    -50.9765013 -0.226794E-05  0.477E-03    1.74       4.6  T
   6    -50.9765015 -0.141918E-06  0.183E-03    1.74      11.9  T
   7    -50.9765015 -0.693242E-08  0.995E-04    1.74      21.9  T
     SCC iter.                  ...        0 min,  0.006 sec
     gradient                   ...        0 min,  0.012 sec
 * total energy  :   -50.4641359 Eh     change       -0.4527222E-04 Eh
   gradient norm :     0.0063682 Eh/α   predicted    -0.1322241E-03 ( 192.06%)
   displ. norm   :     0.0398983 α      lambda       -0.1064916E-03
   maximum displ.:     0.0210595 α      in ANC's #14, #7, #1, ...

........................................................................
.............................. CYCLE   15 ..............................
........................................................................
   1    -50.9759797 -0.509760E+02  0.371E-02    1.74       0.0  T
   2    -50.9759814 -0.170054E-05  0.213E-02    1.74       1.0  T
   3    -50.9759802  0.117977E-05  0.118E-02    1.74       1.9  T
   4    -50.9759819 -0.167520E-05  0.310E-03    1.74       7.0  T
   5    -50.9759820 -0.117642E-06  0.127E-03    1.74      17.2  T
   6    -50.9759821 -0.189447E-07  0.506E-04    1.74      43.2  T
     SCC iter.                  ...        0 min,  0.005 sec
     gradient                   ...        0 min,  0.012 sec
 * total energy  :   -50.4641916 Eh     change       -0.5567636E-04 Eh
   gradient norm :     0.0027664 Eh/α   predicted    -0.5333873E-04 (  -4.20%)
   displ. norm   :     0.0216559 α      lambda       -0.1455599E-04
   maximum displ.:     0.0142117 α      in ANC's #1, #7, #11, ...

........................................................................
.............................. CYCLE   16 ..............................
........................................................................
   1    -50.9762360 -0.509762E+02  0.268E-02    1.75       0.0  T
   2    -50.9762367 -0.714508E-06  0.151E-02    1.75       1.4  T
   3    -50.9762365  0.188164E-06  0.621E-03    1.75       3.5  T
   4    -50.9762369 -0.313595E-06  0.190E-03    1.75      11.5  T
   5    -50.9762369 -0.347409E-07  0.105E-03    1.75      20.9  T
   6    -50.9762369 -0.157812E-07  0.355E-04    1.75      61.4  T
   7    -50.9762369 -0.132815E-09  0.195E-04    1.75     111.7  T
     SCC iter.                  ...        0 min,  0.006 sec
     gradient                   ...        0 min,  0.013 sec
 * total energy  :   -50.4641987 Eh     change       -0.7078622E-05 Eh
   gradient norm :     0.0022078 Eh/α   predicted    -0.7282592E-05 (   2.88%)
   displ. norm   :     0.0374296 α      lambda       -0.1158900E-04
   maximum displ.:     0.0282165 α      in ANC's #11, #1, #3, ...

........................................................................
.............................. CYCLE   17 ..............................
........................................................................
   1    -50.9761636 -0.509762E+02  0.485E-02    1.74       0.0  T
   2    -50.9761666 -0.302439E-05  0.289E-02    1.74       1.0  T
   3    -50.9761662  0.402377E-06  0.138E-02    1.74       1.6  T
   4    -50.9761676 -0.132035E-05  0.320E-03    1.74       6.8  T
   5    -50.9761677 -0.145024E-06  0.130E-03    1.74      16.8  T
   6    -50.9761677 -0.804094E-08  0.531E-04    1.74      41.1  T
   7    -50.9761677 -0.105305E-08  0.249E-04    1.74      87.5  T
     SCC iter.                  ...        0 min,  0.006 sec
     gradient                   ...        0 min,  0.013 sec
 * total energy  :   -50.4642062 Eh     change       -0.7500285E-05 Eh
   gradient norm :     0.0008505 Eh/α   predicted    -0.5804446E-05 ( -22.61%)
   displ. norm   :     0.0563841 α      lambda        0.1332879E-05
   maximum displ.:     0.0423248 α      in ANC's #11, #1, #3, ...

........................................................................
.............................. CYCLE   18 ..............................
........................................................................
   1    -50.9759783 -0.509760E+02  0.727E-02    1.74       0.0  T
   2    -50.9759851 -0.677989E-05  0.433E-02    1.74       1.0  T
   3    -50.9759842  0.929758E-06  0.207E-02    1.74       1.1  T
   4    -50.9759872 -0.299829E-05  0.479E-03    1.74       4.6  T
   5    -50.9759875 -0.324956E-06  0.194E-03    1.74      11.2  T
   6    -50.9759875 -0.177378E-07  0.799E-04    1.74      27.3  T
   7    -50.9759875 -0.250959E-08  0.375E-04    1.74      58.3  T
     SCC iter.                  ...        0 min,  0.006 sec
     gradient                   ...        0 min,  0.013 sec
 * total energy  :   -50.4642023 Eh     change        0.3855017E-05 Eh
   gradient norm :     0.0020055 Eh/α   predicted     0.6666953E-06 ( -82.71%)
   displ. norm   :     0.0206984 α      lambda       -0.8180998E-05
   maximum displ.:     0.0165532 α      in ANC's #11, #1, #39, ...

........................................................................
.............................. CYCLE   19 ..............................
........................................................................
   1    -50.9760868 -0.509761E+02  0.285E-02    1.74       0.0  T
   2    -50.9760882 -0.140431E-05  0.169E-02    1.74       1.3  T
   3    -50.9760882 -0.816800E-08  0.878E-03    1.74       2.5  T
   4    -50.9760886 -0.385381E-06  0.242E-03    1.74       9.0  T
   5    -50.9760887 -0.966609E-07  0.738E-04    1.74      29.6  T
   6    -50.9760887 -0.241730E-08  0.347E-04    1.74      62.9  T
     SCC iter.                  ...        0 min,  0.005 sec
     gradient                   ...        0 min,  0.013 sec
 * total energy  :   -50.4642077 Eh     change       -0.5409690E-05 Eh
   gradient norm :     0.0008023 Eh/α   predicted    -0.4102314E-05 ( -24.17%)
   displ. norm   :     0.0306841 α      lambda        0.5988849E-06
   maximum displ.:     0.0248298 α      in ANC's #11, #1, #39, ...

........................................................................
.............................. CYCLE   20 ..............................
........................................................................
   1    -50.9762096 -0.509762E+02  0.429E-02    1.74       0.0  T
   2    -50.9762127 -0.319256E-05  0.255E-02    1.74       1.0  T
   3    -50.9762128 -0.326017E-07  0.132E-02    1.74       1.7  T
   4    -50.9762136 -0.869502E-06  0.357E-03    1.74       6.1  T
   5    -50.9762139 -0.208786E-06  0.112E-03    1.74      19.6  T
   6    -50.9762139 -0.558720E-08  0.526E-04    1.74      41.5  T
   7    -50.9762139 -0.754440E-09  0.254E-04    1.74      85.8  T
     SCC iter.                  ...        0 min,  0.006 sec
     gradient                   ...        0 min,  0.013 sec
 * total energy  :   -50.4642053 Eh     change        0.2453372E-05 Eh
   gradient norm :     0.0023739 Eh/α   predicted     0.2976353E-06 ( -87.87%)
   displ. norm   :     0.0082955 α      lambda       -0.5168094E-05
   maximum displ.:     0.0049422 α      in ANC's #11, #1, #14, ...
 * RMSD in coord.:     0.3764980 α      energy gain  -0.1509176E-01 Eh

generating ANC from model Hessian ...
Using Lindh-Hessian (1995)
 Shifting diagonal of input Hessian by   3.520085358156854E-003
 Lowest  eigenvalues of input Hessian
   -0.000000   -0.000000   -0.000000   -0.000000    0.000000    0.000000
    0.005000    0.005901    0.008536    0.008786    0.012642    0.016763
    0.018130    0.022451    0.024054    0.025895    0.026495    0.038121
 Highest eigenvalues
    1.998430    2.153802    2.175858    2.311410    2.642389    2.663695
 

........................................................................
.............................. CYCLE   21 ..............................
........................................................................
   1    -50.9762236 -0.509762E+02  0.108E-02    1.74       0.0  T
   2    -50.9762241 -0.549095E-06  0.647E-03    1.74       3.4  T
   3    -50.9762243 -0.150904E-06  0.356E-03    1.74       6.1  T
   4    -50.9762243 -0.342314E-08  0.121E-03    1.74      18.0  T
   5    -50.9762243 -0.263138E-07  0.393E-04    1.74      55.6  T
   6    -50.9762243 -0.112641E-08  0.186E-04    1.74     117.1  T
     SCC iter.                  ...        0 min,  0.005 sec
     gradient                   ...        0 min,  0.013 sec
 * total energy  :   -50.4642087 Eh     change       -0.3383733E-05 Eh
   gradient norm :     0.0007960 Eh/α   predicted     0.0000000E+00 (-100.00%)
   displ. norm   :     0.0013932 α      lambda       -0.3382763E-07
   maximum displ.:     0.0007522 α      in ANC's #57, #1, #56, ...

   *** GEOMETRY OPTIMIZATION CONVERGED AFTER 21 ITERATIONS ***

------------------------------------------------------------------------
 total energy gain   :        -0.0150951 Eh       -9.4723 kcal/mol
 total RMSD          :         0.3764980 a0        0.1992 Å
 total power (kW/mol):        -1.8872518 (step)  -62.8167 (real)
------------------------------------------------------------------------

 ANCopt (total)                0 d,  0 h,  0 min,  0.631 sec
 optimizer setup                ...        0 min,  0.000 sec (  0.018%)
 model hessian                  ...        0 min,  0.005 sec (  0.789%)
 ANC generation                 ...        0 min,  0.001 sec (  0.136%)
 coordinate transformation      ...        0 min,  0.000 sec (  0.030%)
 single point calculation       ...        0 min,  0.620 sec ( 98.191%)
 optimization log               ...        0 min,  0.001 sec (  0.231%)
 hessian update                 ...        0 min,  0.000 sec (  0.025%)
 rational function              ...        0 min,  0.003 sec (  0.436%)

================
 final structure:
================
$coord
   -2.48624954403366    2.19742176478066   -0.12746504597184      C 
   -0.07027848190987    1.28436296595791   -0.00113384316882      C 
   -0.02261862131871   -1.42819454371848    0.02354358718743      C 
   -2.35128162345744   -2.49633704318568   -0.08688384419182      C 
   -4.65637170441956   -0.20397114781103   -0.21802789293868      S 
    2.58990484345834   -2.32039999490016    0.11536374871136      C 
    3.38358504628872   -4.44927705552480    0.24014804447411      O 
    4.17695333263609    0.04543743263355    0.02307983311293      C 
    2.49204823063507    2.26944537353417    0.00793002781485      C 
    3.15355376509443    4.74939499206170    0.04788687410743      C 
    1.34426655788412    6.79376378610142    0.37070891911731      N 
    1.68433782402843    8.65027252025243   -0.90826254069362      O 
   -0.35043790932611    6.48746569270946    1.86793701783196      O 
    5.70050788624192    5.74022534405495   -0.22950241952576      N 
    6.27479821446776    7.43302826094023    1.18457359113059      O 
    7.03220512836441    4.81718781973147   -1.83455021565559      O 
    6.68909319115890   -0.18284056986620    0.01128293871604      C 
   -3.16040586151391    4.10665402527174   -0.13373890261812      H 
   -2.84524685803584   -4.45997471526501   -0.10294567540149      H 
    7.45105422107583   -2.07377506445393    0.10765231224773      H 
    8.02498863100800    1.33742852596953   -0.15021798861010      H 
$end
           -------------------------------------------------
          |                Final Singlepoint                |
           -------------------------------------------------

          ...................................................
          :                      SETUP                      :
          :.................................................:
          :  # basis functions                  78          :
          :  # atomic orbitals                  77          :
          :  # shells                           39          :
          :  # electrons                        86          :
          :  max. iterations                   250          :
          :  Hamiltonian                  GFN2-xTB          :
          :  restarted?                      false          :
          :  GBSA solvation                  false          :
          :  PC potential                    false          :
          :  electronic temp.          300.0000000     K    :
          :  accuracy                    1.0000000          :
          :  -> integral cutoff          0.2500000E+02      :
          :  -> integral neglect         0.1000000E-07      :
          :  -> SCF convergence          0.1000000E-05 Eh   :
          :  -> wf. convergence          0.1000000E-03 e    :
          :  Broyden damping             0.4000000          :
          ...................................................

 iter      E             dE          RMSdq      gap      omega  full diag
   1    -50.9762243 -0.509762E+02  0.760E-05    1.74       0.0  T
   2    -50.9762243 -0.233342E-10  0.472E-05    1.74     462.5  T
   3    -50.9762243 -0.253522E-10  0.301E-05    1.74     724.9  T

   *** convergence criteria satisfied after 3 iterations ***

         #    Occupation            Energy/Eh            Energy/eV
      -------------------------------------------------------------
         1        2.0000           -0.8091745             -22.0188
       ...           ...                  ...                  ...
        37        2.0000           -0.4861443             -13.2287
        38        2.0000           -0.4792089             -13.0399
        39        2.0000           -0.4679417             -12.7333
        40        2.0000           -0.4630217             -12.5995
        41        2.0000           -0.4537534             -12.3473
        42        2.0000           -0.4483731             -12.2009
        43        2.0000           -0.4325409             -11.7700 (HOMO)
        44                         -0.3685266             -10.0281 (LUMO)
        45                         -0.3393525              -9.2343
        46                         -0.3332917              -9.0693
        47                         -0.2934664              -7.9856
        48                         -0.2867296              -7.8023
       ...                                ...                  ...
        77                          0.7284132              19.8211
      -------------------------------------------------------------
                  HL-Gap            0.0640143 Eh            1.7419 eV
             Fermi-level           -0.4005337 Eh          -10.8991 eV

 SCC (total)                   0 d,  0 h,  0 min,  0.027 sec
 SCC setup                      ...        0 min,  0.000 sec (  0.510%)
 Dispersion                     ...        0 min,  0.000 sec (  0.451%)
 integral evaluation            ...        0 min,  0.010 sec ( 38.185%)
 zeroth order Hamiltonian       ...        0 min,  0.000 sec (  0.561%)
 iterations                     ...        0 min,  0.003 sec ( 10.594%)
 molecular gradient             ...        0 min,  0.013 sec ( 48.791%)
 printout                       ...        0 min,  0.000 sec (  0.794%)

         :::::::::::::::::::::::::::::::::::::::::::::::::::::
         ::                     SUMMARY                     ::
         :::::::::::::::::::::::::::::::::::::::::::::::::::::
         :: total energy             -50.464208654901 Eh    ::
         :: gradient norm              0.000799060933 Eh/a0 ::
         :: HOMO-LUMO gap              1.741917981337 eV    ::
         ::.................................................::
         :: SCC energy               -50.976224308112 Eh    ::
         :: -> isotropic ES            0.115696499310 Eh    ::
         :: -> anisotropic ES          0.018163184059 Eh    ::
         :: -> anisotropic XC         -0.000452087834 Eh    ::
         :: -> dispersion             -0.026264313300 Eh    ::
         :: repulsion energy           0.511859716747 Eh    ::
         :: add. restraining           0.000000000000 Eh    ::
         :::::::::::::::::::::::::::::::::::::::::::::::::::::

           -------------------------------------------------
          |                Property Printout                |
           -------------------------------------------------

    * Orbital Energies and Occupations

         #    Occupation            Energy/Eh            Energy/eV
      -------------------------------------------------------------
         1        2.0000           -0.8091745             -22.0188
       ...           ...                  ...                  ...
        31        2.0000           -0.5171815             -14.0732
        32        2.0000           -0.5108270             -13.9003
        33        2.0000           -0.5063852             -13.7794
        34        2.0000           -0.5000004             -13.6057
        35        2.0000           -0.4929724             -13.4145
        36        2.0000           -0.4892177             -13.3123
        37        2.0000           -0.4861443             -13.2287
        38        2.0000           -0.4792089             -13.0399
        39        2.0000           -0.4679417             -12.7333
        40        2.0000           -0.4630217             -12.5995
        41        2.0000           -0.4537534             -12.3473
        42        2.0000           -0.4483731             -12.2009
        43        2.0000           -0.4325409             -11.7700 (HOMO)
        44                         -0.3685266             -10.0281 (LUMO)
        45                         -0.3393525              -9.2343
        46                         -0.3332917              -9.0693
        47                         -0.2934664              -7.9856
        48                         -0.2867296              -7.8023
        49                         -0.2513106              -6.8385
        50                         -0.1761589              -4.7935
        51                         -0.1708825              -4.6499
        52                         -0.1658585              -4.5132
        53                         -0.0761404              -2.0719
        54                         -0.0599679              -1.6318
       ...                                ...                  ...
        77                          0.7284132              19.8211
      -------------------------------------------------------------
                  HL-Gap            0.0640143 Eh            1.7419 eV
             Fermi-level           -0.4005337 Eh          -10.8991 eV

     #   Z        covCN         q      C6AA      α(0)
     1   6 C      2.930    -0.019    28.476     8.751
     2   6 C      3.224    -0.002    27.316     8.493
     3   6 C      3.243    -0.026    27.681     8.527
     4   6 C      2.923    -0.014    28.357     8.733
     5  16 S      2.341     0.119   136.272    19.647
     6   6 C      2.855     0.236    23.064     7.871
     7   8 O      0.856    -0.332    20.375     6.052
     8   6 C      3.001    -0.006    28.150     8.703
     9   6 C      2.979     0.052    26.831     8.497
    10   6 C      2.823    -0.032    28.789     8.792
    11   7 N      2.757     0.564    13.328     5.422
    12   8 O      0.931    -0.352    20.710     6.103
    13   8 O      0.929    -0.372    21.101     6.160
    14   7 N      2.757     0.567    13.295     5.415
    15   8 O      0.931    -0.352    20.715     6.104
    16   8 O      0.929    -0.364    20.949     6.138
    17   6 C      2.842    -0.049    29.200     8.856
    18   1 H      0.926     0.094     1.843     2.123
    19   1 H      0.926     0.085     1.931     2.173
    20   1 H      0.926     0.103     1.755     2.071
    21   1 H      0.926     0.100     1.787     2.090

 Mol. C6AA /au·bohr⁶  :       8844.188260
 Mol. C8AA /au·bohr⁸  :     239490.483811
 Mol. α(0) /au        :        146.724050


Wiberg/Mayer (AO) data.
largest (>0.10) Wiberg bond orders for each atom
          total WBO             WBO to atom ...
     1  C   3.948        C    2 1.529    S    5 1.251    H   18 0.958
     2  C   3.984        C    1 1.529    C    3 1.156    C    9 1.109
     3  C   3.982        C    4 1.580    C    2 1.156    C    6 1.036
     4  C   3.955        C    3 1.580    S    5 1.213    H   19 0.965
     5  S   2.716        C    1 1.251    C    4 1.213
     6  C   3.940        O    7 1.817    C    3 1.036    C    8 0.978
     7  O   2.100        C    6 1.817
     8  C   3.984        C   17 1.806    C    9 1.069    C    6 0.978
     9  C   3.979        C   10 1.588    C    2 1.109    C    8 1.069
    10  C   3.930        C    9 1.588    N   11 0.947    N   14 0.947
    11  N   3.918        O   12 1.471    O   13 1.449    C   10 0.947
    12  O   1.959        N   11 1.471    O   13 0.373
    13  O   1.958        N   11 1.449    O   12 0.373
    14  N   3.918        O   15 1.471    O   16 1.452    C   10 0.947
    15  O   1.963        N   14 1.471    O   16 0.376
    16  O   1.956        N   14 1.452    O   15 0.376
    17  C   3.932        C    8 1.806    H   20 0.961    H   21 0.958
    18  H   0.991        C    1 0.958
    19  H   0.992        C    4 0.965
    20  H   0.988        C   17 0.961
    21  H   0.989        C   17 0.958

molecular dipole:
                 x           y           z       tot (Debye)
 q only:       -1.518      -1.908      -0.148
   full:       -1.392      -1.750      -0.135       5.694
molecular quadrupole (traceless):
                xx          xy          yy          xz          yz          zz
 q only:       13.459      -9.621     -24.787       3.504      -1.072      11.327
  q+dip:       13.118      -8.671     -23.605       4.882      -1.438      10.488
   full:       10.659      -8.743     -25.297       5.174      -1.404      14.638

           -------------------------------------------------
          |                Geometry Summary                 |
           -------------------------------------------------

      molecular mass/u    :      252.2010000
   center of mass at/Å    :        0.8760689       1.2261926       0.0076943
  moments of inertia/u·Å² :        0.7575064E+03   0.1357037E+04   0.2032291E+04
rotational constants/cm⁻¹ :        0.2225411E-01   0.1242239E-01   0.8294890E-02

 * 16 selected distances

     #   Z        #   Z                                     value/Å
     1   6 C      2   6 C                                 1.3683660
     2   6 C      3   6 C                                 1.4357047
     3   6 C      4   6 C                                 1.3569857
     1   6 C      5  16 S                                 1.7134495
     4   6 C      5  16 S                                 1.7217041 (max)
     6   6 C      7   8 O                                 1.2041099
     9   6 C     10   6 C                                 1.3583823
    11   7 N     12   8 O                                 1.2064825
    11   7 N     13   8 O                                 1.2075836
    14   7 N     15   8 O                                 1.2061298
    14   7 N     16   8 O                                 1.2068948
     8   6 C     17   6 C                                 1.3348591
     1   6 C     18   1 H                                 1.0714623 (min)
     4   6 C     19   1 H                                 1.0715196
    17   6 C     20   1 H                                 1.0800280
    17   6 C     21   1 H                                 1.0743624

 * 5 distinct bonds (by element types)

   Z      Z             #   av. dist./Å        max./Å        min./Å
   1 H    6 C           4     1.0743431     1.0800280     1.0714623
   6 C    6 C           5     1.3708596     1.4357047     1.3348591
   6 C    8 O           1     1.2041099     1.2041099     1.2041099
   7 N    8 O           4     1.2067727     1.2075836     1.2061298
   6 C   16 S           2     1.7175768     1.7217041     1.7134495


optimized geometry written to: xtbopt.xyz


           -------------------------------------------------
          | TOTAL ENERGY              -50.464208654901 Eh   |
          | GRADIENT NORM               0.000799060933 Eh/α |
          | HOMO-LUMO GAP               1.741917981337 eV   |
           -------------------------------------------------

------------------------------------------------------------------------
 * finished run on 2021/04/08 at 13:09:11.230     
------------------------------------------------------------------------
 total:
 * wall-time:     0 d,  0 h,  0 min,  0.725 sec
 *  cpu-time:     0 d,  0 h,  0 min,  0.715 sec
 * ratio c/w:     0.987 speedup
 SCF:
 * wall-time:     0 d,  0 h,  0 min,  0.038 sec
 *  cpu-time:     0 d,  0 h,  0 min,  0.038 sec
 * ratio c/w:     0.998 speedup
 ANC optimizer:
 * wall-time:     0 d,  0 h,  0 min,  0.659 sec
 *  cpu-time:     0 d,  0 h,  0 min,  0.657 sec
 * ratio c/w:     0.998 speedup

