      -----------------------------------------------------------      
     |                   =====================                   |     
     |                           x T B                           |     
     |                   =====================                   |     
     |                         S. Grimme                         |     
     |          Mulliken Center for Theoretical Chemistry        |     
     |                    University of Bonn                     |     
     |                Version 6.2 RC2 (SAW190805)                |     
      -----------------------------------------------------------      

   This program is distributed in the hope that it will be useful,
   but WITHOUT ANY WARRANTY; without even the implied warranty of
   MERCHANTABILITY or FITNESS FOR A PARTICULAR PURPOSE.
   
   FOR NON-COMMERCIAL, ACADEMIA USE ONLY.
   
   Cite this work as:
   * S. Grimme, C. Bannwarth, P. Shushkov, J. Chem. Theory Comput., 2017,
     13, 1989-2009. DOI: 10.1021/acs.jctc.7b00118
   * C. Bannwarth, S. Ehlert and S. Grimme., J. Chem. Theory Comput., 2019,
     15, 1652-1671. DOI: 10.1021/acs.jctc.8b01176
   * P. Pracht, E. Caldeweyher, S. Ehlert, S. Grimme, ChemRxiv, 2019, preprint.
     DOI: 10.26434/chemrxiv.8326202.v1
   
   for DFT-D4:
   * E. Caldeweyher, C. Bannwarth and S. Grimme, J. Chem. Phys., 2017,
     147, 034112. DOI: 10.1063/1.4993215
   * E. Caldeweyher, S. Ehlert, A. Hansen, H. Neugebauer, S. Spicher,
     C. Bannwarth and S. Grimme, J. Chem. Phys., 2019, 150, 154122.
     DOI: 10.1063/1.5090222
   
   for sTDA-xTB:
   * S. Grimme and C. Bannwarth, J. Chem. Phys., 2016, 145, 054103.
     DOI: 10.1063/1.4959605
   
   in the mass-spec context:
   * V. Asgeirsson, C. Bauer and S. Grimme, Chem. Sci., 2017, 8, 4879.
     DOI: 10.1039/c7sc00601b
   
   for metadynamics refer to:
   * S. Grimme, J. Chem. Theory Comput., 2019, 155, 2847-2862
     DOI: 10.1021/acs.jctc.9b00143
   
   with help from (in alphabetical order)
   C. Bannwarth, F. Bohle, G. Brandenburg, E. Caldeweyher, M. Checinski,
   S. Dohm, S. Ehlert, S. Ehrlich, F. März, H. Neugebauer, J. Pisarek,
   P. Pracht, P. Shushkov, and S. Spicher.
   
 * started run on 2021/02/19 at 08:13:19.408     

           -------------------------------------------------
          |                Calculation Setup                |
           -------------------------------------------------

          program call               : /ihome/ghutchison/geoffh/xtb/xtb 5u.xyz -opt
          hostname                   : smp-n167
          coordinate file            : 5u.xyz
          omp threads                :                     1
          number of atoms            :                    12
          number of electrons        :                    42
          charge                     :                     0
          spin                       :                   0.0
          first test random number   :      0.79824935917332


########################################################################
# WARNING! Please study the warnings concerning your input carefully
#  - the use of '-opt' is discouraged, please use '--opt' next time
########################################################################

           ------------------------------------------------- 
          |                 G F N 2 - x T B                 |
          | Geometry, Frequencies, Noncovalent interactions |
          |            JCTC 2019 parametrisation            |
           ------------------------------------------------- 
             KAB for C  - Si     :                1.0500
             KAB for H  - Pd     :                0.9500
             k(s)              :                1.8500
             k(p)              :                2.2300
             k(d)              :                2.2300
             k(f)              :                2.0000
             kEN (H0ij)        :               -2.0000
             D4 a1             :                0.5200
             D4 a2             :                5.0000
             D4 s6             :                1.0000
             D4 s8             :                2.7000
             D4 s9             :                5.0000
             alphaj            :                2.0000

  Z AO/shell   Hii/eV     exponent
  1     Wed Apr 25 08:07:45 CEST 2018   EN: 2.200 GM2: 0.406  GM3: 0.0800  RAES: 1.40
     1s    -10.707211    1.230000
  6     Wed Apr 25 08:07:45 CEST 2018   EN: 2.550 GM2: 0.538  GM3: 0.1500  RAES: 3.00
     2s    -13.970922    2.096432
     2p    -10.063292    1.800000
  9     Mon Apr 23 13:58:50 CEST 2018   EN: 3.980 GM2: 0.532  GM3: 0.1426  RAES: 2.40
     2s    -23.458179    2.416361
     2p    -15.746583    2.308399

           ------------------------------------------------- 
          |        Self-Consistent Charge Iterations        |
           ------------------------------------------------- 

          ...................................................
          :                      SETUP                      :
          :.................................................:
          :  # basis functions                  36          :
          :  # atomic orbitals                  36          :
          :  # shells                           20          :
          :  # electrons                        42          :
          :  max. iterations                   250          :
          :  Hamiltonian                  GFN2-xTB          :
          :  restarted?                      false          :
          :  GBSA solvation                  false          :
          :  PC potential                    false          :
          :  electronic temp.          300.0000000     K    :
          :  accuracy                    1.0000000          :
          :  -> integral cutoff          0.2500000E+02      :
          :  -> integral neglect         0.1000000E-07      :
          :  -> SCF convergence          0.1000000E-05 Eh   :
          :  -> wf. convergence          0.1000000E-03 e    :
          :  Broyden damping             0.4000000          :
          ...................................................

 iter      E             dE          RMSdq      gap      omega  full diag
   1    -24.5984880 -0.245985E+02  0.516E+00    3.92       0.0  T
   2    -24.6210155 -0.225275E-01  0.313E+00    4.35       1.0  T
   3    -24.6169901  0.402548E-02  0.124E+00    3.99       1.0  T
   4    -24.6254309 -0.844082E-02  0.207E-01    4.32       1.0  T
   5    -24.6255093 -0.783789E-04  0.655E-02    4.29       1.0  T
   6    -24.6255134 -0.413800E-05  0.189E-02    4.28       1.5  T
   7    -24.6255135 -0.585923E-07  0.300E-03    4.29       9.6  T
   8    -24.6255135 -0.816716E-07  0.763E-04    4.29      37.8  T
   9    -24.6255135 -0.817508E-09  0.152E-04    4.29     190.5  T

   *** convergence criteria satisfied after 9 iterations ***

         #    Occupation            Energy/Eh            Energy/eV
      -------------------------------------------------------------
         1        2.0000           -0.8299663             -22.5845
       ...           ...                  ...                  ...
        15        2.0000           -0.5084690             -13.8361
        16        2.0000           -0.4918269             -13.3833
        17        2.0000           -0.4830216             -13.1437
        18        2.0000           -0.4800212             -13.0620
        19        2.0000           -0.4473526             -12.1731
        20        2.0000           -0.4375353             -11.9059
        21        2.0000           -0.4185596             -11.3896 (HOMO)
        22                         -0.2610377              -7.1032 (LUMO)
        23                         -0.2495611              -6.7909
        24                         -0.1273089              -3.4643
        25                          0.0391025               1.0640
        26                          0.0532891               1.4501
       ...                                ...                  ...
        36                          0.6145087              16.7216
      -------------------------------------------------------------
                  HL-Gap            0.1575220 Eh            4.2864 eV
             Fermi-level           -0.3397987 Eh           -9.2464 eV

 SCC (total)                   0 d,  0 h,  0 min,  0.009 sec
 SCC setup                      ...        0 min,  0.000 sec (  1.040%)
 Dispersion                     ...        0 min,  0.000 sec (  0.698%)
 integral evaluation            ...        0 min,  0.003 sec ( 30.047%)
 zeroth order Hamiltonian       ...        0 min,  0.000 sec (  0.470%)
 iterations                     ...        0 min,  0.003 sec ( 28.846%)
 molecular gradient             ...        0 min,  0.003 sec ( 37.269%)
 printout                       ...        0 min,  0.000 sec (  1.469%)

         :::::::::::::::::::::::::::::::::::::::::::::::::::::
         ::                     SUMMARY                     ::
         :::::::::::::::::::::::::::::::::::::::::::::::::::::
         :: total energy             -24.337228019198 Eh    ::
         :: gradient norm              0.026346845273 Eh/a0 ::
         :: HOMO-LUMO gap              4.286391071130 eV    ::
         ::.................................................::
         :: SCC energy               -24.625513543323 Eh    ::
         :: -> isotropic ES            0.022252911934 Eh    ::
         :: -> anisotropic ES         -0.000637720966 Eh    ::
         :: -> anisotropic XC          0.000897450341 Eh    ::
         :: -> dispersion             -0.008430682821 Eh    ::
         :: repulsion energy           0.288276571675 Eh    ::
         :: add. restraining           0.000000000000 Eh    ::
         :::::::::::::::::::::::::::::::::::::::::::::::::::::

      ----------------------------------------------------------- 
     |                   =====================                   |
     |                        A N C O P T                        |
     |                   =====================                   |
     |               Approximate Normal Coordinate               |
     |                Rational Function Optimizer                |
      ----------------------------------------------------------- 

          ...................................................
          :                      SETUP                      :
          :.................................................:
          :   optimization level            normal          :
          :   max. optcycles                   200          :
          :   ANC micro-cycles                  20          :
          :   degrees of freedom                30          :
          :.................................................:
          :   RF solver                   davidson          :
          :   input Hessian                  false          :
          :   write xtbopt.log                true          :
          :   linear?                        false          :
          :   energy convergence         0.5000000E-05 Eh   :
          :   grad. convergence          0.1000000E-02 Eh/α :
          :   maximium RF displ.         2.0000000          :
          :   Hlow (freq-cutoff)         0.5000000E-02      :
          :   Hmax (freq-cutoff)         5.0000000          :
          :   S6 in model hess.         20.0000000          :
          ...................................................

generating ANC from model Hessian ...
Using Lindh-Hessian (1995)
 Shifting diagonal of input Hessian by   0.000000000000000E+000
 Lowest  eigenvalues of input Hessian
   -0.000000   -0.000000   -0.000000    0.000000    0.000000    0.000000
    0.014156    0.014828    0.023470    0.026464    0.069073    0.072446
    0.093691    0.097422    0.099294    0.099326    0.104712    0.123563
 Highest eigenvalues
    1.467840    1.599859    1.857740    1.858311    1.989665    2.114376
 

........................................................................
.............................. CYCLE    1 ..............................
........................................................................
   1    -24.6255135 -0.246255E+02  0.242E-05    4.29       0.0  T
   2    -24.6255135 -0.188649E-11  0.132E-05    4.29    2191.9  T
   3    -24.6255135 -0.611067E-12  0.761E-06    4.29    3795.1  T
     SCC iter.                  ...        0 min,  0.001 sec
     gradient                   ...        0 min,  0.003 sec
 * total energy  :   -24.3372280 Eh     change       -0.1027882E-08 Eh
   gradient norm :     0.0263471 Eh/α   predicted     0.0000000E+00 (-100.00%)
   displ. norm   :     0.0685739 α      lambda       -0.1323792E-02
   maximum displ.:     0.0662116 α      in ANC's #16, #25, #23, ...

........................................................................
.............................. CYCLE    2 ..............................
........................................................................
   1    -24.6397225 -0.246397E+02  0.575E-02    4.38       0.0  T
   2    -24.6397297 -0.719995E-05  0.369E-02    4.36       1.0  T
   3    -24.6397300 -0.327743E-06  0.165E-02    4.36       1.7  T
   4    -24.6397305 -0.453330E-06  0.562E-03    4.36       5.1  T
   5    -24.6397306 -0.130038E-06  0.140E-03    4.36      20.6  T
     SCC iter.                  ...        0 min,  0.001 sec
     gradient                   ...        0 min,  0.003 sec
 * total energy  :   -24.3380113 Eh     change       -0.7832773E-03 Eh
   gradient norm :     0.0094170 Eh/α   predicted    -0.6650102E-03 ( -15.10%)
   displ. norm   :     0.0167181 α      lambda       -0.9514307E-04
   maximum displ.:     0.0116857 α      in ANC's #16, #13, #7, ...

........................................................................
.............................. CYCLE    3 ..............................
........................................................................
   1    -24.6422241 -0.246422E+02  0.262E-02    4.38       0.0  T
   2    -24.6422270 -0.287002E-05  0.171E-02    4.37       1.7  T
   3    -24.6422274 -0.461503E-06  0.921E-03    4.37       3.1  T
   4    -24.6422275 -0.602838E-07  0.284E-03    4.37      10.2  T
   5    -24.6422275 -0.205376E-07  0.676E-04    4.37      42.7  T
     SCC iter.                  ...        0 min,  0.001 sec
     gradient                   ...        0 min,  0.003 sec
 * total energy  :   -24.3380706 Eh     change       -0.5931017E-04 Eh
   gradient norm :     0.0038742 Eh/α   predicted    -0.4758406E-04 ( -19.77%)
   displ. norm   :     0.0099651 α      lambda       -0.2087718E-04
   maximum displ.:     0.0069572 α      in ANC's #7, #13, #30, ...

........................................................................
.............................. CYCLE    4 ..............................
........................................................................
   1    -24.6420864 -0.246421E+02  0.167E-02    4.38       0.0  T
   2    -24.6420875 -0.108003E-05  0.106E-02    4.37       2.7  T
   3    -24.6420877 -0.200604E-06  0.578E-03    4.37       5.0  T
   4    -24.6420877 -0.287039E-07  0.146E-03    4.37      19.8  T
   5    -24.6420877 -0.486408E-08  0.365E-04    4.37      79.1  T
   6    -24.6420877 -0.148795E-09  0.619E-05    4.37     466.4  T
     SCC iter.                  ...        0 min,  0.002 sec
     gradient                   ...        0 min,  0.018 sec
 * total energy  :   -24.3380837 Eh     change       -0.1311889E-04 Eh
   gradient norm :     0.0009653 Eh/α   predicted    -0.1044073E-04 ( -20.41%)
   displ. norm   :     0.0072453 α      lambda       -0.2995618E-05
   maximum displ.:     0.0049487 α      in ANC's #7, #13, #16, ...

........................................................................
.............................. CYCLE    5 ..............................
........................................................................
   1    -24.6413682 -0.246414E+02  0.921E-03    4.37       0.0  T
   2    -24.6413684 -0.240962E-06  0.568E-03    4.37       5.1  T
   3    -24.6413684 -0.456095E-07  0.311E-03    4.37       9.3  T
   4    -24.6413684 -0.126245E-07  0.534E-04    4.37      54.1  T
   5    -24.6413685 -0.679790E-09  0.156E-04    4.37     184.7  T
     SCC iter.                  ...        0 min,  0.001 sec
     gradient                   ...        0 min,  0.003 sec
 * total energy  :   -24.3380851 Eh     change       -0.1390957E-05 Eh
   gradient norm :     0.0005655 Eh/α   predicted    -0.1496042E-05 (   7.55%)
   displ. norm   :     0.0017122 α      lambda       -0.3476620E-06
   maximum displ.:     0.0010682 α      in ANC's #7, #13, #16, ...

   *** GEOMETRY OPTIMIZATION CONVERGED AFTER 5 ITERATIONS ***

------------------------------------------------------------------------
 total energy gain   :        -0.0008571 Eh       -0.5378 kcal/mol
 total RMSD          :         0.0240087 a0        0.0127 Å
 total power (kW/mol):        -0.4500623 (step)  -40.9804 (real)
------------------------------------------------------------------------

 ANCopt (total)                0 d,  0 h,  0 min,  0.055 sec
 optimizer setup                ...        0 min,  0.000 sec (  0.111%)
 model hessian                  ...        0 min,  0.001 sec (  1.509%)
 ANC generation                 ...        0 min,  0.000 sec (  0.315%)
 coordinate transformation      ...        0 min,  0.000 sec (  0.031%)
 single point calculation       ...        0 min,  0.053 sec ( 96.903%)
 optimization log               ...        0 min,  0.000 sec (  0.368%)
 hessian update                 ...        0 min,  0.000 sec (  0.037%)
 rational function              ...        0 min,  0.000 sec (  0.467%)

================
 final structure:
================
$coord
   -1.42636716727371    2.21561702929328   -0.01417936501807      C 
    1.18376567657813    2.35798592181535   -0.01355997328670      C 
    2.56977120103448    0.13997394658910   -0.00223189225807      C 
    5.11280588938655    0.27868366399795   -0.00162717150442      F 
    1.43322693132997   -2.21562957429468    0.00849741488851      C 
   -1.17690591996149   -2.35799888015690    0.00787786271253      C 
   -2.56291120341572   -0.13998677432994   -0.00344962648152      C 
   -5.10594581014188   -0.27869604662453   -0.00405375539681      F 
   -2.57657274871969    3.89721198298404   -0.02281728097729      H 
    2.14425024542546    4.15470866431093   -0.02169603765547      H 
    2.58343276346929   -3.89722457229196    0.01713523593932      H 
   -2.13739162653569   -4.15472095033061    0.01601393291267      H 
$end
           -------------------------------------------------
          |                Final Singlepoint                |
           -------------------------------------------------

          ...................................................
          :                      SETUP                      :
          :.................................................:
          :  # basis functions                  36          :
          :  # atomic orbitals                  36          :
          :  # shells                           20          :
          :  # electrons                        42          :
          :  max. iterations                   250          :
          :  Hamiltonian                  GFN2-xTB          :
          :  restarted?                      false          :
          :  GBSA solvation                  false          :
          :  PC potential                    false          :
          :  electronic temp.          300.0000000     K    :
          :  accuracy                    1.0000000          :
          :  -> integral cutoff          0.2500000E+02      :
          :  -> integral neglect         0.1000000E-07      :
          :  -> SCF convergence          0.1000000E-05 Eh   :
          :  -> wf. convergence          0.1000000E-03 e    :
          :  Broyden damping             0.4000000          :
          ...................................................

 iter      E             dE          RMSdq      gap      omega  full diag
   1    -24.6413685 -0.246414E+02  0.380E-05    4.37       0.0  T
   2    -24.6413685 -0.184741E-12  0.219E-05    4.37    1318.6  T
   3    -24.6413685  0.923706E-13  0.464E-06    4.37    6227.2  T

   *** convergence criteria satisfied after 3 iterations ***

         #    Occupation            Energy/Eh            Energy/eV
      -------------------------------------------------------------
         1        2.0000           -0.8278697             -22.5275
       ...           ...                  ...                  ...
        15        2.0000           -0.5105723             -13.8934
        16        2.0000           -0.4919524             -13.3867
        17        2.0000           -0.4846469             -13.1879
        18        2.0000           -0.4799934             -13.0613
        19        2.0000           -0.4487438             -12.2109
        20        2.0000           -0.4408865             -11.9971
        21        2.0000           -0.4202736             -11.4362 (HOMO)
        22                         -0.2598502              -7.0709 (LUMO)
        23                         -0.2491180              -6.7788
        24                         -0.1230157              -3.3474
        25                          0.0369698               1.0060
        26                          0.0474855               1.2921
       ...                                ...                  ...
        36                          0.6397979              17.4098
      -------------------------------------------------------------
                  HL-Gap            0.1604235 Eh            4.3653 eV
             Fermi-level           -0.3400619 Eh           -9.2536 eV

 SCC (total)                   0 d,  0 h,  0 min,  0.007 sec
 SCC setup                      ...        0 min,  0.000 sec (  0.883%)
 Dispersion                     ...        0 min,  0.000 sec (  0.501%)
 integral evaluation            ...        0 min,  0.003 sec ( 37.342%)
 zeroth order Hamiltonian       ...        0 min,  0.000 sec (  0.540%)
 iterations                     ...        0 min,  0.001 sec ( 12.705%)
 molecular gradient             ...        0 min,  0.003 sec ( 46.410%)
 printout                       ...        0 min,  0.000 sec (  1.464%)

         :::::::::::::::::::::::::::::::::::::::::::::::::::::
         ::                     SUMMARY                     ::
         :::::::::::::::::::::::::::::::::::::::::::::::::::::
         :: total energy             -24.338085129978 Eh    ::
         :: gradient norm              0.000563102721 Eh/a0 ::
         :: HOMO-LUMO gap              4.365344790799 eV    ::
         ::.................................................::
         :: SCC energy               -24.641368450577 Eh    ::
         :: -> isotropic ES            0.023190639701 Eh    ::
         :: -> anisotropic ES         -0.000994354407 Eh    ::
         :: -> anisotropic XC          0.000743056258 Eh    ::
         :: -> dispersion             -0.008451377286 Eh    ::
         :: repulsion energy           0.303274587299 Eh    ::
         :: add. restraining           0.000000000000 Eh    ::
         :::::::::::::::::::::::::::::::::::::::::::::::::::::

           -------------------------------------------------
          |                Property Printout                |
           -------------------------------------------------

    * Orbital Energies and Occupations

         #    Occupation            Energy/Eh            Energy/eV
      -------------------------------------------------------------
         1        2.0000           -0.8278697             -22.5275
       ...           ...                  ...                  ...
         9        2.0000           -0.5610046             -15.2657
        10        2.0000           -0.5565816             -15.1454
        11        2.0000           -0.5497673             -14.9599
        12        2.0000           -0.5361868             -14.5904
        13        2.0000           -0.5200652             -14.1517
        14        2.0000           -0.5112601             -13.9121
        15        2.0000           -0.5105723             -13.8934
        16        2.0000           -0.4919524             -13.3867
        17        2.0000           -0.4846469             -13.1879
        18        2.0000           -0.4799934             -13.0613
        19        2.0000           -0.4487438             -12.2109
        20        2.0000           -0.4408865             -11.9971
        21        2.0000           -0.4202736             -11.4362 (HOMO)
        22                         -0.2598502              -7.0709 (LUMO)
        23                         -0.2491180              -6.7788
        24                         -0.1230157              -3.3474
        25                          0.0369698               1.0060
        26                          0.0474855               1.2921
        27                          0.1228517               3.3430
        28                          0.1467893               3.9943
        29                          0.1504008               4.0926
        30                          0.1791543               4.8750
        31                          0.3459755               9.4145
        32                          0.3979901              10.8299
       ...                                ...                  ...
        36                          0.6397979              17.4098
      -------------------------------------------------------------
                  HL-Gap            0.1604235 Eh            4.3653 eV
             Fermi-level           -0.3400619 Eh           -9.2536 eV

     #   Z        covCN         q      C6AA      α(0)
     1   6 C      2.921    -0.047    29.158     8.855
     2   6 C      2.921    -0.047    29.158     8.855
     3   6 C      2.786     0.168    24.373     8.087
     4   9 F      0.787    -0.218    11.420     3.992
     5   6 C      2.921    -0.047    29.158     8.855
     6   6 C      2.921    -0.047    29.158     8.855
     7   6 C      2.786     0.168    24.373     8.087
     8   9 F      0.787    -0.218    11.420     3.992
     9   1 H      0.926     0.072     2.068     2.249
    10   1 H      0.926     0.072     2.068     2.249
    11   1 H      0.926     0.072     2.068     2.249
    12   1 H      0.926     0.072     2.068     2.249

 Mol. C6AA /au·bohr⁶  :       1914.693109
 Mol. C8AA /au·bohr⁸  :      46768.315072
 Mol. α(0) /au        :         68.572780


Wiberg/Mayer (AO) data.
largest (>0.10) Wiberg bond orders for each atom
          total WBO             WBO to atom ...
     1  C   3.989        C    2 1.443    C    7 1.396    H    9 0.966    C    5 0.111
     2  C   3.989        C    1 1.443    C    3 1.396    H   10 0.966    C    6 0.111
     3  C   3.891        C    5 1.396    C    2 1.396    F    4 0.965
     4  F   1.095        C    3 0.965
     5  C   3.989        C    6 1.443    C    3 1.396    H   11 0.966    C    1 0.111
     6  C   3.989        C    5 1.443    C    7 1.396    H   12 0.966    C    2 0.111
     7  C   3.891        C    6 1.396    C    1 1.396    F    8 0.965
     8  F   1.095        C    7 0.965
     9  H   0.995        C    1 0.966
    10  H   0.995        C    2 0.966
    11  H   0.995        C    5 0.966
    12  H   0.995        C    6 0.966

molecular dipole:
                 x           y           z       tot (Debye)
 q only:       -0.000      -0.000      -0.000
   full:       -0.000      -0.000      -0.000       0.000
molecular quadrupole (traceless):
                xx          xy          yy          xz          yz          zz
 q only:       -9.689      -0.944       7.575      -0.001      -0.027       2.114
  q+dip:      -12.031      -1.285      11.449      -0.000      -0.053       0.581
   full:      -12.279      -1.189       9.449      -0.002      -0.032       2.830

           -------------------------------------------------
          |                Geometry Summary                 |
           -------------------------------------------------

      molecular mass/u    :      114.0944000
   center of mass at/Å    :        0.0018151      -0.0000033      -0.0015033
  moments of inertia/u·Å² :        0.8892046E+02   0.3523231E+03   0.4412435E+03
rotational constants/cm⁻¹ :        0.1895810E+00   0.4784709E-01   0.3820483E-01

 * 10 selected distances

     #   Z        #   Z                                     value/Å
     1   6 C      2   6 C                                 1.3832761
     2   6 C      3   6 C                                 1.3840506 (max)
     3   6 C      5   6 C                                 1.3840505
     5   6 C      6   6 C                                 1.3832761
     1   6 C      7   6 C                                 1.3840506
     6   6 C      7   6 C                                 1.3840506
     1   6 C      9   1 H                                 1.0781211 (min)
     2   6 C     10   1 H                                 1.0781212
     5   6 C     11   1 H                                 1.0781212
     6   6 C     12   1 H                                 1.0781211

 * 2 distinct bonds (by element types)

   Z      Z             #   av. dist./Å        max./Å        min./Å
   1 H    6 C           4     1.0781212     1.0781212     1.0781211
   6 C    6 C           6     1.3837924     1.3840506     1.3832761


optimized geometry written to: xtbopt.xyz


           -------------------------------------------------
          | TOTAL ENERGY              -24.338085129978 Eh   |
          | GRADIENT NORM               0.000563102721 Eh/α |
          | HOMO-LUMO GAP               4.365344790799 eV   |
           -------------------------------------------------

------------------------------------------------------------------------
 * finished run on 2021/02/19 at 08:13:19.524     
------------------------------------------------------------------------
 total:
 * wall-time:     0 d,  0 h,  0 min,  0.115 sec
 *  cpu-time:     0 d,  0 h,  0 min,  0.068 sec
 * ratio c/w:     0.590 speedup
 SCF:
 * wall-time:     0 d,  0 h,  0 min,  0.009 sec
 *  cpu-time:     0 d,  0 h,  0 min,  0.009 sec
 * ratio c/w:     0.996 speedup
 ANC optimizer:
 * wall-time:     0 d,  0 h,  0 min,  0.063 sec
 *  cpu-time:     0 d,  0 h,  0 min,  0.048 sec
 * ratio c/w:     0.760 speedup

